,question,answer,contexts,ground_truth,context_precision,faithfulness,answer_relevancy,context_recall
0,Apa isi dari Permendikbud Nomor 3 Tahun 2020?,saya tidak tahu,"['• LAMPIRAN 6: Form Pengajuan Konversi Mata Kuliah\nNomor ........(NRP Mahasiswa)/(Semester)/2020\nLampiran : 1 (satu eks) laporan Magang/ Rincian Tugas Kegiatan magang\nPerihal : Surat Permohonan Konversi Magang\n(Tanggal Surat)\nKepada Yth\n: Kepala Departemen (Nama Departemen)\ndi ITS\nDengan hormat,\nSehubungan dengan pelaksanaan kegiatan Magang, saya yang bertanda tangan di bawah ini:\nNama Mahasiswa\nNRP\nDepartemen\nNo HP\nAlamat email\nmengajukan permohonan konversi Mata Kuliah untuk kegiatan Magang (Judul Kegiatan Magang) di (Perusahaan Tempat Magang) yang sedang/telah*) dilakukan pada .......d.......\n.... Adapun\ndetail mitra magang sebagai berikut :\nNama Perusahaan Tempat Magang\nAlamat Perusahaan Tempat\nMagang\nNo Telp Perusahaan Tempat\nMagang\nEmail perusahan\nNama Pembimbing Lapangan\nNo HP Pembimbing Lapangan\n....\nBerikut kami lampirkan Laporan Magang dan atau Rincian Kegiatan Magang.\nDemikian surat permohonan ini saya buat, atas perhatiannya saya sampaikan terima kasih.\nSurabaya,'
 '• LAMPIRAN 3: Sampul Laporan Magang\nSampul Laporan Magang berwarna biru dengan logo ITS di kiri atas. Pada sampul tercetak: Judul Laporan Magang, Nama Lengkap Mahasiswa, Asal Departemen dan Fakultas, Institut Teknologi Sepuluh Nopember, dan tahun penyelesaian.\nJenis huruf: Calibri\nUkuran huruf: 14 pt\nContoh Sampul Laporan Magang :\nLAPORAN MAGANG\n(JUDUL LAPORAN MAGANG)\n(NAMA)\n(NRP)\nDosen Pembimbing\n(Nama Dosen Pembimbing)\nDosen Pembimbing\n(Nama Dosen Pembimbing Lapangan)\n(Departemen)\n(Fakultas )\nInstitut Teknologi Sepuluh Nopember Surabaya\n2020\nBuku Petunjuk Teknis Magang\n65\n\n• LAMPIRAN 4 : Form Penilaian Magang (Dosen Pembimbing)\nLEMBAR PENILAIAN KINERJA MAGANG\nSemester Magang :..... Tahun Akademik 20.../20...\nNama Mahasiswa\nNRP\nDepartemen\nNama Dosen Pembimbing\nNama Perusahaan Mitra Magang\nWaktu Pelaksanaan Magang\nNama Proyek/ Kegiatan Magang\nNO\nASPEK YANG DINILAI\nBOBOT (B)\nNILAI (N)\n(0-100)\nJUMLAH\n(B XN)\n1\nKehadiran\n10\n\n\n2\nKesungguhan melaksanakan Kerja Praktek\n15'
 'LAMPIRAN\n\nLAMPIRAN\n• Form persetujuan untuk laporan magang\n• Form pengajuan konversi mata kuliah\n• Form Logbook\n• Form permohonan rencana kegiatan magang\n• Form penilaian magang\n62\nLampiran\n\n• LAMPIRAN 1: Form Logbook\nLOGBOOK MAGANG\nPeriode Magang :..\nTahun Akademik 20.../20...\nNama\nNRP\nPosisi Magang\nPembimbing Magang\nNama Perusahaan Mitra Magang :\nNama Proyek/Kegiatan\nNO\nTANGGAL\nDeskripsi Kegiatan (Bisa dilengkapi dengan Foto)\nPARAF PEMBIMBING\nMAGANG\n\n\n\n\n\n\n\n\n\n\n\n\n\n\n\n\n\n\n\n\n\n\n\n\n\n\n\n\n\n\n\n\n\n\n\n\nBuku Petunjuk Teknis Magang\n63\n\n• LAMPIRAN 2: Form Persetujuan untuk Laporan Magang\nFORMULIR PERSETUJUAN LAPORAN MAGANG BERJUDUL\n""JUDUL LAPORAN""\nSemester Magang :.... Tahun Akademik 20.../20...\nDisetujui oleh\nPembimbing Lapangan\nDosen Pembimbing\nMengetahui\nKepala Departemen\n64\nLampiran'
 '• LAMPIRAN 8: Form Persetujuan Konversi Mata Kuliah\nLAMPIRAN 1\nKOP Departemen\nNo\n:....\nLampiran :\nPerihal :.\nKepada yth :\nDosen Wali Departemen ...\nFakultas...\nITS\nSehubungan dengan adanya permohonan konversi mata kuliah dari mahasiswa peserta magang dengan detail sebagai berikut :\nNama\nNRP\nNama Mitra Magang :\nPeriode magang\nMahasiswa yang bersangkutan akan/ telah *) melakukan magang dengan rincian tugas sebagai berikut :\nBerdasarkan hasil telaah dan analisa dengan bidang akademik departemen, maka mahasiswa yang bersangkutan berhak untuk mendapatkan konversi mata kuliah dan SKS, dimana konversi ini akan di lakukan pada semester..... tahun ajaran ....\n.......Adapun mata kuliah yang dapat dikonversikan dengan\nkegiatan magang adalah sebagai berikut :\nNo.\nMata Kuliah Konversi\nJumlah SKS\n\n\n\n\n\n\n\n\n\nTotal SKS\n\nSurabaya, ....\n*) dicoret\nKepala Departemen ....\n70\nLampiran\n\nSUBDIREKTORAT PENGEMBANGAN KEWIRAUSAHAAN DAN KARIR\nDIREKTORAT KEMAHASISWAAN\nINSTITUT TEKNOLOGI SEPULUH NOPEMBER\n2020']","Pendidikan Tinggi, mahasiswa sarjana ataupun mahasiswa sarjana terapan memiliki kesempatan menempuh pembelajaran diluar Perguruan Tinggi.",,0.0,,0.0
1,Apa saja ketentuak mahasiswa dalam melaksanakan magang?,"Dalam melaksanakan magang, mahasiswa harus mematuhi beberapa ketentuan sebagai berikut:
1. Mematuhi aturan Mitra Magang dengan baik.
2. Bekerja dan berusaha memberikan yang terbaik untuk kepentingan Mitra Magang.
3. Menyelesaikan segala tugas yang diberikan Mitra Magang dengan benar, rapi, dan tepat waktu.
4. Menghormati pegawai Mitra Magang tanpa membedakan suku, agama, ras, gender, dan golongan.
5. Bersikap jujur, disiplin, santun, profesional, dan menjaga etos kerja di unit kerja Mitra Magang.
6. Menjaga kerahasiaan informasi unit kerja Mitra Magang. Seluruh informasi dan data yang akan dijadikan sumber dalam penulisan laporan magang harus disamarkan untuk menjaga kerahasiaan data dan informasi Mitra Magang.
7. Menjaga nama baik almamater ITS.","['07\nPEDOMAN\nPENULISAN\nLAPORAN\nMAGANG\n\n07\nPEDOMAN PENULISAN LAPORAN\nMAGANG\n7.1\nFUNGSI LAPORAN MAGANG\nPertanggungjawaban kegiatan Magang mahasiswa kepada Mitra Magang dan\nDepartemen.\n女你公\n299\nBahan pertimbangan pemberian nilai kegiatan Magang\nДо\nPenyampaian informasi bagi pihak ITS, mahasiswa, maupun Mitra Magang\nSalah satu alat untuk membina hubungan kerjasama, saling pengertian, dan koordinasi antara mahasiswa dengan pihak ITS maupun Mitra Magang\nSalah satu alat untuk menyampaikan ide, pendapat, penilaian, dan pengalaman yang berkaitan dengan penyelenggaraan Magang kepada\npihak lain.\n44\n07 Pedoman Penulisan Laporan Magang'
 '• Mahasiswa memberikan penjabaran mengenai rencana perbaikan / pengembangan diri, karir, dan pendidikan selanjutnya.\n• LAMPIRAN\n• Berisi naskah atau dokumen yang perlu disampaikan untuk mendukung dan menguatkan laporan.\n• Lampiran wajib berupa absensi dan,\n• Laporan logbook kegiatan harian yang ditandatangani oleh pembimbing lapangan.\n• Lampiran penunjang dapat berupa struktur organisasi lembaga tempat magang, prosedur atau proses kerja, foto-foto dan sebagainya.\n• Sertifikat magang.\n50\n07 Pedoman Penulisan Laporan Magang\n\nBARAT\nTH\nHARI LISTRIK NASIONAL\nPLN\nPL\nN\n08\nPENILAIAN\nMAGANG'
 '09\nЕТІКА\nMAGANG\n\n09\nETIKA MAGANG\n9.1\nETIKA PELAKSANAAN MAGANG DI PERUSAHAAN MITRA MAGANG\nVX\n• Mahasiswa harus mematuhi aturan Mitra Magang dengan baik.\n• Mahasiswa harus bekerja dan berusaha memberikan yang terbaik untuk kepentingan Mitra Magang.\n• Mahasiswa harus dapat menyelesaikan segala tugas yang diberikan\nMitra Magang dengan benar, rapi dan tepat waktu.\n• Mahasiswa harus menghormati pegawai Mitra Magang tanpa membedakan suku, agama, ras, gender dan golongan.\n• Mahasiswa bersikap jujur, disiplin, santun, profesional, dan menjaga etos kerja di unit kerja Mitra Magang.\n• Mahasiswa harus menjaga kerahasiaan informasi unit kerja Mitra Magang. Seluruh informasi dan data yang akan dijadikan sumber dalam penulisan laporan magang harus disamarkan dalam penulisan untuk menjaga kerahasidan data dan informasi Mitra Magang.\n• Mahasiswa harus menjaga nama baik almamater ITS.\n58\n09 Etika Magang'
 '• BAB 5. REFLEKSI DIRI\n• Mahasiswa mendeskripsikan tentang hal-hal positif yang diterima selama perkuliahan yang bermanfaat / relevan terhadap pekerjaan selama magang.\n• Mahasiswa menjelaskan tentang manfaat magang terhadap pengembangan soft-skills dan kekurangan soft-skills yang dimilikinya.\n• Mahasiswa memberikan penjabaran tentang manfaat magang terhadap pengembangan kemampuan kognitif dan kekurangan kemampuan kognitif yang dimilikinya.\nBuku Petunjuk Teknis Magang\n49']","1. Pelaksanaan Program Magang memiliki durasi minimal 1 bulan dan maksimal 6 bulan. 2. Selama Program Magang berlangsung, mahasiswa tidak harus mengajukan cuti. 3. Selama Program Magang berlangsung, mahasiswa secara penuh waktu bekerja di lapangan sesuai kesepakatan. 4. Mahasiswa bisa mendapatkan izin untuk melakukan kegiatan akademik tertentu, melalui pembicaraan dan kesepakatan dengan pihak Mitra Magang. 5. Mahasiswa dapat mengajukan konversi mata kuliah dengan Capaian Pembelajaran Mata Kuliah (CPMK) yang selaras dengan Program Magang. 6. Mahasiswa wajib dibimbing oleh pembimbing internal dari Dosen Departemen dan pembimbing lapangan dari Mitra Magang 7. Sebelum Program Magang berlangsung, mahasiswa, Departemen dan Mitra Magang wajib menandatangani perjanjian kerjasama dan nota kesepahaman.",0.0,0.6388888888675925,1.0,0.9634370649428323
2,Apa  Manfaat Program Magang bagi Mahasiswa,"Manfaat program magang bagi mahasiswa antara lain adalah sebagai berikut:
1. Mahasiswa dapat mendeskripsikan hal-hal positif yang diterima selama perkuliahan yang bermanfaat dan relevan terhadap pekerjaan selama magang.
2. Mahasiswa dapat menjelaskan manfaat magang terhadap pengembangan soft-skills dan mengidentifikasi kekurangan soft-skills yang dimilikinya.
3. Mahasiswa dapat memberikan penjabaran tentang manfaat magang terhadap pengembangan kemampuan kognitif dan mengidentifikasi kekurangan kemampuan kognitif yang dimilikinya.
4. Mahasiswa dapat merencanakan perbaikan atau pengembangan diri, karir, dan pendidikan selanjutnya berdasarkan pengalaman magang yang telah dijalani.","['• BAB 5. REFLEKSI DIRI\n• Mahasiswa mendeskripsikan tentang hal-hal positif yang diterima selama perkuliahan yang bermanfaat / relevan terhadap pekerjaan selama magang.\n• Mahasiswa menjelaskan tentang manfaat magang terhadap pengembangan soft-skills dan kekurangan soft-skills yang dimilikinya.\n• Mahasiswa memberikan penjabaran tentang manfaat magang terhadap pengembangan kemampuan kognitif dan kekurangan kemampuan kognitif yang dimilikinya.\nBuku Petunjuk Teknis Magang\n49'
 '• Mahasiswa memberikan penjabaran mengenai rencana perbaikan / pengembangan diri, karir, dan pendidikan selanjutnya.\n• LAMPIRAN\n• Berisi naskah atau dokumen yang perlu disampaikan untuk mendukung dan menguatkan laporan.\n• Lampiran wajib berupa absensi dan,\n• Laporan logbook kegiatan harian yang ditandatangani oleh pembimbing lapangan.\n• Lampiran penunjang dapat berupa struktur organisasi lembaga tempat magang, prosedur atau proses kerja, foto-foto dan sebagainya.\n• Sertifikat magang.\n50\n07 Pedoman Penulisan Laporan Magang\n\nBARAT\nTH\nHARI LISTRIK NASIONAL\nPLN\nPL\nN\n08\nPENILAIAN\nMAGANG'
 '6. Jarak Spasi\n1 (satu)\n• SISTEMATIKA LAPORAN MAGANG\nCover Luar\nCover Dalam\nLembar Pengesahan\nKata Pengantar\nDaftar Isi\nDaftar Gambar\nDaftar Tabel\nBAB 1. PENDAHULUAN\n1.1. Latar Belakang\n1.2. Tujuan Magang\n1.3. Manfaat Magang\n1.4. Mahasiswa menguraikan tujuan penulisan topik magang.\nBAB 2. PENDAHULUAN\n2.1. Sejarah Mitra Magang\n2.2. Struktur Organisasi Mitra Magang\n2.3. Visi dan Misi Perusahaan\n2.4. Kegiatan Produksi (barang/jasa) (jika ada)\nBAB 3. PELAKSANAAN MAGANG\n3.1 Posisi / kedudukan kegiatan Magang\n3.2 Metodologi penyelesaian Tugas\n3.3 Pembelajaran Hal Baru\nBAB 4. KESIMPULAN DAN SARAN\nBAB 5. REFLEKSI DIRI\nLAMPIRAN\nBuku Petunjuk Teknis Magang\n47'
 '07\nPEDOMAN\nPENULISAN\nLAPORAN\nMAGANG\n\n07\nPEDOMAN PENULISAN LAPORAN\nMAGANG\n7.1\nFUNGSI LAPORAN MAGANG\nPertanggungjawaban kegiatan Magang mahasiswa kepada Mitra Magang dan\nDepartemen.\n女你公\n299\nBahan pertimbangan pemberian nilai kegiatan Magang\nДо\nPenyampaian informasi bagi pihak ITS, mahasiswa, maupun Mitra Magang\nSalah satu alat untuk membina hubungan kerjasama, saling pengertian, dan koordinasi antara mahasiswa dengan pihak ITS maupun Mitra Magang\nSalah satu alat untuk menyampaikan ide, pendapat, penilaian, dan pengalaman yang berkaitan dengan penyelenggaraan Magang kepada\npihak lain.\n44\n07 Pedoman Penulisan Laporan Magang']",• Sarana mengaplikasikan ilmu di dalam kelas perkuliahan ke dunia kerja. • Sarana mengetahui dan mempelajari proses industri. • Berinteraksi langsung dengan mitra magang. • Sarana memperoleh bahan tugas akhir. • Menyelesaikan SKS mata kuliah.,0.2857142857142857,0.9999999999666667,1.0,0.9734040160976182
3,Berapa perhitugan 1 sks magang dalam jam kerja?,Saya tidak tahu.,"['2\nKesungguhan melaksanakan Kerja Praktek\n15\n\n\n3\nDisiplin dalam menyelesaikan pekerjaan\n\n\n\n4\nTanggung jawab\n15\n\n\n5\nKeahlian / Keterampilan dalam Berprofesi\n20\n\n\n6\nKreatifitas / Inovasi\n15\n\n\n7\nSikap dan Perilaku dalam Bekerja\n\n\n\n8\nKemampuan Bekerjasama Dalam Tim\n5\n\n\nJUMLAH\n100\n\n\nNILAI AKHIR =\nJUMLAH (B X N)\nJUMLAH BOBOT\n100\nSurabaya,\nDosen Pembimbing Magang\n66\nLampiran\n\n• LAMPIRAN 5: Form Penilaian Magang (Pembimbing Lapangan)\nLEMBAR PENILAIAN KINERJA MAGANG\nSemester Magang :.... Tahun Akademik 20.../20...\nNama Mahasiswa\nNRP\nDepartemen\nNama Pembimbing Lapangan\nNo HP\nNama Perusahaan Mitra Magang\nWaktu Pelaksanaan Magang\nNama Proyek/ Kegiatan Magang\nNO\nASPEK YANG DINILAI\nBOBOT (B)\nNILAI (N)\n(0-100)\nJUMLAH\n(B XN)\n1\nKehadiran\n10\n\n\n2\nKesungguhan melaksanakan Kerja Praktek\n15\n\n\n3\nDisiplin dalam menyelesaikan pekerjaan\n10\n\n\n4\nTanggung jawab\n15\n\n\n5\nKeahlian / Keterampilan dalam Berprofesi\n20\n\n\n6\nKreatifitas / Inovasi\nST\n\n\n7\nSikap dan Perilaku dalam Bekerja\n10'
 '6.1\nKRITERIA DOSEN PEMBIMBING MAGANG\nW888\nDosen yang telah mengajar selama 4 semester berturut-turut.\nMemperoleh SK Pembimbing Magang dari Departemen dan ketetapan melalui\nKeputusan Dekan.\n6.2\nRINCIAN TUGAS DOSEN PEMBIMBING\nMAGANG\n• Memberikan saran dan masukan saat konsultasi keilmuan jika diperlukan oleh mahasiswa selama magang.\n• Melakukan kegiatan pembimbingan bagi mahasiswa magang untuk dapat berkonsultasi selama magang atau bimbingan penulisan laporan magang.\n• Memberikan persetujuan dan penilaian Laporan Magang.\n• Memberikan penilaian dapat dilakukan dalam bentuk penilaian laporan magang dan atau presentasi kegiatan magang.\n40\n06 Pembimbingan Magang'
 '9.2\nETIKA BERKOMUNIKASI DENGAN\nDOSEN PEMBIMBING\n• Komunikasi dengan dosen pembimbing dilakukan dengan mengacu pada norma yang berlaku umum.\nDosen Pembimbing last seen today at 13:25\nSelamat pagi Bu, saya Rosyi, mahasiswa S1 PerencanaanWilayah\ndan Kota semester 7. Maaf bu, saya maumenanyakan\napakah besok Ibu ada waktu untuk bimbingan tugas\nkarya akhir? Terima Kasih\n7:20 AM J/\nSelamat siang Rosyi, hari Kamis pukul 10.00 WIB ya. Tolong ingatkan kembali.\n1:18 PM\nBaik bu, Terima Kasih\nHARI INI\n1:20 PM J/\nSelamat Pagi Bu, Saya Rosyi, maaf apakah saya jadi bimbingan hari ini pukul 10? Terima Kasih\n7:25 AM J/\n• Gunakan Bahasa Indonesia yang baik dan benar (bukan bahasa gaul). Pesan terdiri dari : salam, identitas, keperluan, dan ucapan terimakasih.\n• Pesan dimulai dengan salam/sapaan tanpa disingkat.\n• Mahasiswa harus menuliskan identitanya saat mengirim pesan kepada dosen.\n• Menuliskan pesan dengan singkat dan jelas.\n• Akhiri dengan ucapan terimakasih.\nJadi, temui saya di ruangan ya.'
 '• Mampu memilih dan mengorganisir data yang diperlukan.\n• Mampu mengamati dan menilai dengan jeli berbagai proses, peristiwa, manfaat dan kelemahan yang ada selama melakukan kegiatan Magang.\n7.4\nFORMAT DAN SISTEMATIKA LAPORAN\nMAGANG\n• FORMAT PENULISAN LAPORAN MAGANG\n1. Jenis dan Ukuran Kertas\nKertas HVS 70gram ukuran A5 (148 × 210 mm).\n2. Cover Laporan\n3. Lembar pengesahan dengan dasar polos berwarna putih\nPembimbing tempat magang tanda tangan terlebih dahulu.\n4. Jarak Tepi (margin)\n- Tepi Atas : 2,5 cm\n- Тері Bawah : 2,5 cm\n- Tepi Kiri: 2,5 cm\n- Tepi Kanan : 2,0 cm\n5. Jenis Huruf\nTimes New Roman, Normal, 12 pt (judul), 11 pt (isi)\n46\n07 Pedoman Penulisan Laporan Magang']",setara dengan kerja 45 jam,0.4,0.9999999999,0.0,0.0
4,Bagaimana Proses pengajuan konversi kegiatan magang dengan MK yang setara CPMK-nya?,"Proses pengajuan konversi kegiatan magang dengan MK yang setara CPMK-nya dilakukan dengan mengikuti langkah-langkah berikut:
1. Mahasiswa mengajukan permohonan konversi kegiatan magang dengan MK yang setara CPMK-nya kepada Dosen Pembimbing Magang.
2. Dosen Pembimbing Magang akan mengevaluasi kegiatan magang yang telah dilakukan oleh mahasiswa.
3. Jika kegiatan magang dinilai sesuai dengan MK yang setara CPMK-nya, Dosen Pembimbing Magang akan memberikan rekomendasi untuk konversi tersebut.
4. Mahasiswa kemudian mengajukan permohonan konversi kegiatan magang dengan MK yang setara CPMK-nya kepada Departemen terkait.
5. Departemen akan melakukan evaluasi lebih lanjut terkait permohonan konversi tersebut.
6. Jika disetujui, Departemen akan mengeluarkan keputusan resmi terkait konversi kegiatan magang menjadi MK yang setara CPMK-nya.
7. Mahasiswa dapat melanjutkan proses administrasi terkait konversi tersebut sesuai dengan ketentuan yang berlaku.

Demikianlah proses pengajuan konversi kegiatan magang dengan MK yang setara CPMK-nya. Jika terdapat perubahan dalam prosedur tersebut, mahasiswa disarankan untuk selalu memperhatikan informasi terbaru dari pihak terkait.","['07\nPEDOMAN\nPENULISAN\nLAPORAN\nMAGANG\n\n07\nPEDOMAN PENULISAN LAPORAN\nMAGANG\n7.1\nFUNGSI LAPORAN MAGANG\nPertanggungjawaban kegiatan Magang mahasiswa kepada Mitra Magang dan\nDepartemen.\n女你公\n299\nBahan pertimbangan pemberian nilai kegiatan Magang\nДо\nPenyampaian informasi bagi pihak ITS, mahasiswa, maupun Mitra Magang\nSalah satu alat untuk membina hubungan kerjasama, saling pengertian, dan koordinasi antara mahasiswa dengan pihak ITS maupun Mitra Magang\nSalah satu alat untuk menyampaikan ide, pendapat, penilaian, dan pengalaman yang berkaitan dengan penyelenggaraan Magang kepada\npihak lain.\n44\n07 Pedoman Penulisan Laporan Magang'
 '6.1\nKRITERIA DOSEN PEMBIMBING MAGANG\nW888\nDosen yang telah mengajar selama 4 semester berturut-turut.\nMemperoleh SK Pembimbing Magang dari Departemen dan ketetapan melalui\nKeputusan Dekan.\n6.2\nRINCIAN TUGAS DOSEN PEMBIMBING\nMAGANG\n• Memberikan saran dan masukan saat konsultasi keilmuan jika diperlukan oleh mahasiswa selama magang.\n• Melakukan kegiatan pembimbingan bagi mahasiswa magang untuk dapat berkonsultasi selama magang atau bimbingan penulisan laporan magang.\n• Memberikan persetujuan dan penilaian Laporan Magang.\n• Memberikan penilaian dapat dilakukan dalam bentuk penilaian laporan magang dan atau presentasi kegiatan magang.\n40\n06 Pembimbingan Magang'
 '7.2\nKETENTUAN UMUM DALAM PENULISAN\nLAPORAN MAGANG\n• Laporan Magang ditulis dan dipresentasikan pada akhir magang (jika diperlukan).\n• Laporan Magang selain diserahkan ke departemen dan mitra magang, juga diserahkan ke Subdirektorat PK2 Direktorat Kemahasiswaan dalam bentuk softcopy melalui SIM Magang.\n7.3\nPRINSIP PENULISAN LAPORAN\nMAGANG\n• BENAR DAN OBYEKTIF\nLaporan magang harus sesuai dengan ketentuan yang ada dalam pedoman ini serta memuat informasi yang benar dan obyektif.\n• JELAS DAN CERMAT\nLaporan magang harus mudah dimengerti / dipahami oleh pembaca, dengan cara menghindari pemakaian kata / istilah, rangkaian kata / kalimat atau gaya bahasa yang kurang dapat dipahami oleh pembaca maupun penulisnya sendiri. Gunakan kata-kata yang sederhana tetapi jelas maksudnya.\n• LANGSUNG KE SASARAN'
 '4. Hasil penilaian dilakukan dengan cara mengisi formulir yang ada dan diserahkan\npada departemen.\n8.2\nPENILAIAN PRESTASI KINERJA MAGANG\nOLEH UNIT MITRA MAGANG\nDalam melakukan kegiatan magang, mahasiswa akan memperoleh penilaian dari unit tempat magang. Formulir penilaian magang diisi dan ditandatangani oleh atasan yang berwenang di tempat magang (minimal level manajer) dan dicap menggunakan stempel unit tempat magang. Berikut adalah butir penilaian kinerja magang:\n52\n08 Penilaian Magang']","• Subdirektorat PK2 akan menyampaikan rencana kegiatan selama magang yang diterima dari mitra magang kepada departemen dimana mahasiswa magang berasal. • Departemen akan melakukan verifikasi dan validasi untuk menilai mata kuliah apa saja yang CPMK-nya selaras dengan kegiatan magang berdasarkan rencana kegiatan magang dan akan berdiskusi dengan mitra magang jika diperlukan untuk mendapat-kan penjelasan lebih detail. • Departemen akan menyampaikan ke mahasiswa hasil verifikasi berupa daftar MK yang dapat dikonversikan dengan kegiatan magang. • Mahasiswa harus mengisi FRS dengan Mata Kuliah yang akan dikonversikan dengan Kegiatan Magang pada semester yang sama, atau mahasiswa bersama dosen wali akan melakukan revisi paling lambat minggu ke 4 perkuliahan jika jadwal FRS sudah terlampaui.",0.0,0.6388888888675925,1.0,0.9938171114929606
5,Bagaimana SOP konversi mata kuliah untuk magang mandiri?,"SOP konversi mata kuliah untuk magang mandiri melibatkan beberapa langkah sebagai berikut:
1. Mahasiswa mengajukan permohonan konversi mata kuliah untuk kegiatan magang mandiri dengan mengisi Form Pengajuan Konversi Mata Kuliah yang mencakup informasi seperti nama mahasiswa, NRP, departemen, nomor HP, alamat email, judul kegiatan magang, nama perusahaan tempat magang, alamat perusahaan tempat magang, nomor telepon perusahaan tempat magang, email perusahaan, nama pembimbing lapangan, dan nomor HP pembimbing lapangan.
2. Mahasiswa melampirkan Laporan Magang dan/atau Rincian Kegiatan Magang sebagai bukti pelaksanaan kegiatan magang.
3. Surat permohonan konversi mata kuliah kemudian diajukan kepada Kepala Departemen yang bersangkutan di ITS.
4. Setelah itu, hasil telaah dan analisa dengan bidang akademik departemen akan menentukan apakah mahasiswa berhak untuk mendapatkan konversi mata kuliah dan SKS. Jika berhak, konversi ini akan dilakukan pada semester dan tahun ajaran tertentu.
5. Mata kuliah yang dapat dikonversikan dengan kegiatan magang akan ditentukan berdasarkan hasil telaah dan analisa tersebut.
6. Terakhir, Kepala Departemen akan menandatangani persetujuan konversi mata kuliah untuk magang mandiri.

Itulah SOP konversi mata kuliah untuk magang mandiri berdasarkan konteks yang diberikan.","['• LAMPIRAN 8: Form Persetujuan Konversi Mata Kuliah\nLAMPIRAN 1\nKOP Departemen\nNo\n:....\nLampiran :\nPerihal :.\nKepada yth :\nDosen Wali Departemen ...\nFakultas...\nITS\nSehubungan dengan adanya permohonan konversi mata kuliah dari mahasiswa peserta magang dengan detail sebagai berikut :\nNama\nNRP\nNama Mitra Magang :\nPeriode magang\nMahasiswa yang bersangkutan akan/ telah *) melakukan magang dengan rincian tugas sebagai berikut :\nBerdasarkan hasil telaah dan analisa dengan bidang akademik departemen, maka mahasiswa yang bersangkutan berhak untuk mendapatkan konversi mata kuliah dan SKS, dimana konversi ini akan di lakukan pada semester..... tahun ajaran ....\n.......Adapun mata kuliah yang dapat dikonversikan dengan\nkegiatan magang adalah sebagai berikut :\nNo.\nMata Kuliah Konversi\nJumlah SKS\n\n\n\n\n\n\n\n\n\nTotal SKS\n\nSurabaya, ....\n*) dicoret\nKepala Departemen ....\n70\nLampiran\n\nSUBDIREKTORAT PENGEMBANGAN KEWIRAUSAHAAN DAN KARIR\nDIREKTORAT KEMAHASISWAAN\nINSTITUT TEKNOLOGI SEPULUH NOPEMBER\n2020'
 '• Mahasiswa memberikan penjabaran mengenai rencana perbaikan / pengembangan diri, karir, dan pendidikan selanjutnya.\n• LAMPIRAN\n• Berisi naskah atau dokumen yang perlu disampaikan untuk mendukung dan menguatkan laporan.\n• Lampiran wajib berupa absensi dan,\n• Laporan logbook kegiatan harian yang ditandatangani oleh pembimbing lapangan.\n• Lampiran penunjang dapat berupa struktur organisasi lembaga tempat magang, prosedur atau proses kerja, foto-foto dan sebagainya.\n• Sertifikat magang.\n50\n07 Pedoman Penulisan Laporan Magang\n\nBARAT\nTH\nHARI LISTRIK NASIONAL\nPLN\nPL\nN\n08\nPENILAIAN\nMAGANG'
 '6.1\nKRITERIA DOSEN PEMBIMBING MAGANG\nW888\nDosen yang telah mengajar selama 4 semester berturut-turut.\nMemperoleh SK Pembimbing Magang dari Departemen dan ketetapan melalui\nKeputusan Dekan.\n6.2\nRINCIAN TUGAS DOSEN PEMBIMBING\nMAGANG\n• Memberikan saran dan masukan saat konsultasi keilmuan jika diperlukan oleh mahasiswa selama magang.\n• Melakukan kegiatan pembimbingan bagi mahasiswa magang untuk dapat berkonsultasi selama magang atau bimbingan penulisan laporan magang.\n• Memberikan persetujuan dan penilaian Laporan Magang.\n• Memberikan penilaian dapat dilakukan dalam bentuk penilaian laporan magang dan atau presentasi kegiatan magang.\n40\n06 Pembimbingan Magang'
 '• LAMPIRAN 6: Form Pengajuan Konversi Mata Kuliah\nNomor ........(NRP Mahasiswa)/(Semester)/2020\nLampiran : 1 (satu eks) laporan Magang/ Rincian Tugas Kegiatan magang\nPerihal : Surat Permohonan Konversi Magang\n(Tanggal Surat)\nKepada Yth\n: Kepala Departemen (Nama Departemen)\ndi ITS\nDengan hormat,\nSehubungan dengan pelaksanaan kegiatan Magang, saya yang bertanda tangan di bawah ini:\nNama Mahasiswa\nNRP\nDepartemen\nNo HP\nAlamat email\nmengajukan permohonan konversi Mata Kuliah untuk kegiatan Magang (Judul Kegiatan Magang) di (Perusahaan Tempat Magang) yang sedang/telah*) dilakukan pada .......d.......\n.... Adapun\ndetail mitra magang sebagai berikut :\nNama Perusahaan Tempat Magang\nAlamat Perusahaan Tempat\nMagang\nNo Telp Perusahaan Tempat\nMagang\nEmail perusahan\nNama Pembimbing Lapangan\nNo HP Pembimbing Lapangan\n....\nBerikut kami lampirkan Laporan Magang dan atau Rincian Kegiatan Magang.\nDemikian surat permohonan ini saya buat, atas perhatiannya saya sampaikan terima kasih.\nSurabaya,']",Melaporkan kegiatan magang Mengupdate data magang Mengajukan permohonan konversi MK Melakukan telaah dan verifikasi bersama tim akademik departemen Menerima hasil telaah MK yang dikonversikan dengan Magang Melakukan FRS / Perubahan FRS Dosen wali mengetahui dan menyetujui FRS / Perubahan FRS di semester yang sama / di semester depan,0.0,0.9166666666361111,0.7777777777777778,0.9728606332777948
6,Apa itu Program Magang Mahasiswa Bersertifikat (PMMB) ?,"Program Magang Mahasiswa Bersertifikat (PMMB) adalah program yang bertujuan untuk memberikan pengalaman praktik kerja kepada mahasiswa di dunia industri. Dalam program ini, mahasiswa akan melakukan magang di perusahaan mitra untuk mendapatkan pengetahuan dan keterampilan yang relevan dengan bidang studi mereka. Selain itu, PMMB juga memberikan sertifikat sebagai bukti bahwa mahasiswa telah menyelesaikan program magang dengan baik.","['07\nPEDOMAN\nPENULISAN\nLAPORAN\nMAGANG\n\n07\nPEDOMAN PENULISAN LAPORAN\nMAGANG\n7.1\nFUNGSI LAPORAN MAGANG\nPertanggungjawaban kegiatan Magang mahasiswa kepada Mitra Magang dan\nDepartemen.\n女你公\n299\nBahan pertimbangan pemberian nilai kegiatan Magang\nДо\nPenyampaian informasi bagi pihak ITS, mahasiswa, maupun Mitra Magang\nSalah satu alat untuk membina hubungan kerjasama, saling pengertian, dan koordinasi antara mahasiswa dengan pihak ITS maupun Mitra Magang\nSalah satu alat untuk menyampaikan ide, pendapat, penilaian, dan pengalaman yang berkaitan dengan penyelenggaraan Magang kepada\npihak lain.\n44\n07 Pedoman Penulisan Laporan Magang'
 '• LAMPIRAN 6: Form Pengajuan Konversi Mata Kuliah\nNomor ........(NRP Mahasiswa)/(Semester)/2020\nLampiran : 1 (satu eks) laporan Magang/ Rincian Tugas Kegiatan magang\nPerihal : Surat Permohonan Konversi Magang\n(Tanggal Surat)\nKepada Yth\n: Kepala Departemen (Nama Departemen)\ndi ITS\nDengan hormat,\nSehubungan dengan pelaksanaan kegiatan Magang, saya yang bertanda tangan di bawah ini:\nNama Mahasiswa\nNRP\nDepartemen\nNo HP\nAlamat email\nmengajukan permohonan konversi Mata Kuliah untuk kegiatan Magang (Judul Kegiatan Magang) di (Perusahaan Tempat Magang) yang sedang/telah*) dilakukan pada .......d.......\n.... Adapun\ndetail mitra magang sebagai berikut :\nNama Perusahaan Tempat Magang\nAlamat Perusahaan Tempat\nMagang\nNo Telp Perusahaan Tempat\nMagang\nEmail perusahan\nNama Pembimbing Lapangan\nNo HP Pembimbing Lapangan\n....\nBerikut kami lampirkan Laporan Magang dan atau Rincian Kegiatan Magang.\nDemikian surat permohonan ini saya buat, atas perhatiannya saya sampaikan terima kasih.\nSurabaya,'
 '• LAMPIRAN 7: Form Rincian Tugas Magang\nRINCIAN TUGAS MAGANG\nSemester Magang :... Tahun Akademik 20.../20...\nNama Mahasiswa\nNRP\nDepartemen\nNama Dosen Pembimbing\nNama Perusahaan Mitra Magang\nWaktu Pelaksanaan Magang\nNama Proyek / Kegiatan Magang\nPosisi dalam Proyek\nNO\nRincian Tugas Magang\nWaktu Pelaksanaan\nSurabaya, ..\nMahasiswa peserta magang (.........\n........)\nBuku Petunjuk Teknis Magang\n69'
 '....\nBerikut kami lampirkan Laporan Magang dan atau Rincian Kegiatan Magang.\nDemikian surat permohonan ini saya buat, atas perhatiannya saya sampaikan terima kasih.\nSurabaya,\nMahasiswa peserta magang\n*) dipilih salah satu\n68\nLampiran']",Program Magang Mahasiswa Bersertifikat (PMMB) merupakan program magang yang bekerjasama dengan Forum Human Capital Indonesia (FHCI).,0.42857142857142855,0.3333333333,0.0,0.9510530432188925
7,"Apa peran Subdirektorat Pengembangan Kewirausahaan dan
Karir (PK2) dalam penyelenggaraan Program Magang?","Subdirektorat Pengembangan Kewirausahaan dan Karir (PK2) memiliki peran dalam penyelenggaraan Program Magang sebagai penyedia informasi dan bimbingan bagi mahasiswa yang sedang menjalani magang. Mereka membantu mahasiswa dalam mencari tempat magang yang sesuai dengan minat dan kemampuan, serta memberikan panduan terkait prosedur dan persyaratan yang harus dipenuhi selama magang berlangsung. Selain itu, PK2 juga bertanggung jawab dalam memfasilitasi hubungan kerjasama antara mahasiswa, institusi pendidikan, dan mitra magang untuk menciptakan lingkungan yang kondusif bagi pengembangan kewirausahaan dan karir mahasiswa.","['07\nPEDOMAN\nPENULISAN\nLAPORAN\nMAGANG\n\n07\nPEDOMAN PENULISAN LAPORAN\nMAGANG\n7.1\nFUNGSI LAPORAN MAGANG\nPertanggungjawaban kegiatan Magang mahasiswa kepada Mitra Magang dan\nDepartemen.\n女你公\n299\nBahan pertimbangan pemberian nilai kegiatan Magang\nДо\nPenyampaian informasi bagi pihak ITS, mahasiswa, maupun Mitra Magang\nSalah satu alat untuk membina hubungan kerjasama, saling pengertian, dan koordinasi antara mahasiswa dengan pihak ITS maupun Mitra Magang\nSalah satu alat untuk menyampaikan ide, pendapat, penilaian, dan pengalaman yang berkaitan dengan penyelenggaraan Magang kepada\npihak lain.\n44\n07 Pedoman Penulisan Laporan Magang'
 '• LAMPIRAN 8: Form Persetujuan Konversi Mata Kuliah\nLAMPIRAN 1\nKOP Departemen\nNo\n:....\nLampiran :\nPerihal :.\nKepada yth :\nDosen Wali Departemen ...\nFakultas...\nITS\nSehubungan dengan adanya permohonan konversi mata kuliah dari mahasiswa peserta magang dengan detail sebagai berikut :\nNama\nNRP\nNama Mitra Magang :\nPeriode magang\nMahasiswa yang bersangkutan akan/ telah *) melakukan magang dengan rincian tugas sebagai berikut :\nBerdasarkan hasil telaah dan analisa dengan bidang akademik departemen, maka mahasiswa yang bersangkutan berhak untuk mendapatkan konversi mata kuliah dan SKS, dimana konversi ini akan di lakukan pada semester..... tahun ajaran ....\n.......Adapun mata kuliah yang dapat dikonversikan dengan\nkegiatan magang adalah sebagai berikut :\nNo.\nMata Kuliah Konversi\nJumlah SKS\n\n\n\n\n\n\n\n\n\nTotal SKS\n\nSurabaya, ....\n*) dicoret\nKepala Departemen ....\n70\nLampiran\n\nSUBDIREKTORAT PENGEMBANGAN KEWIRAUSAHAAN DAN KARIR\nDIREKTORAT KEMAHASISWAAN\nINSTITUT TEKNOLOGI SEPULUH NOPEMBER\n2020'
 '• LAMPIRAN 6: Form Pengajuan Konversi Mata Kuliah\nNomor ........(NRP Mahasiswa)/(Semester)/2020\nLampiran : 1 (satu eks) laporan Magang/ Rincian Tugas Kegiatan magang\nPerihal : Surat Permohonan Konversi Magang\n(Tanggal Surat)\nKepada Yth\n: Kepala Departemen (Nama Departemen)\ndi ITS\nDengan hormat,\nSehubungan dengan pelaksanaan kegiatan Magang, saya yang bertanda tangan di bawah ini:\nNama Mahasiswa\nNRP\nDepartemen\nNo HP\nAlamat email\nmengajukan permohonan konversi Mata Kuliah untuk kegiatan Magang (Judul Kegiatan Magang) di (Perusahaan Tempat Magang) yang sedang/telah*) dilakukan pada .......d.......\n.... Adapun\ndetail mitra magang sebagai berikut :\nNama Perusahaan Tempat Magang\nAlamat Perusahaan Tempat\nMagang\nNo Telp Perusahaan Tempat\nMagang\nEmail perusahan\nNama Pembimbing Lapangan\nNo HP Pembimbing Lapangan\n....\nBerikut kami lampirkan Laporan Magang dan atau Rincian Kegiatan Magang.\nDemikian surat permohonan ini saya buat, atas perhatiannya saya sampaikan terima kasih.\nSurabaya,'
 'kepentingan yang dilakukan oleh organisasi tersebut (misalnya melalui produk atau jasa yang dihasilkan).\n• BAB 3. PELAKSANAAN MAGANG\n3.1. Posisi / Kedudukan Kegiatan Magang\n• Mahasiswa dapat menguraikan kedudukan / posisi kegiatan yang ditugaskan oleh mitra magang dalam lingkup pekerjaan / proyek keseluruhan. Hal ini dimaksudkan untuk mengetahui apakah mahasiswa memahami kaitan antara apa yang telah dilakukan / dihasilkan dengan pekerjaan tersebut.\n3.2. Metodologi penyelesaian Tugas\n• Mahasiswa menguraikan kasus / masalah menjadi topik pembahasan. Mahasiswa menganalisis kasus / masalah tersebut dengan menggunakan teori atau metode yang relevan. Analisis bukan mendeskripsikan teori, namun menggunakan teori guna menjelaskan dan membandingkan dengan kasus/masalah yang diangkat.\nUraian mengenai teori atau metode harus menyebutkan referensi yang valid dan handal.\n3.3. Pembelajaran Hal Baru']",1. Sebagai koordinator dalam penyelenggaraan Program Magang. 2. Menyusun kebijakan terkait magang untuk memfasilitasi kegiatan pembelajaran akademik dan Program Magang. 3. Mengkoordinasikan penyusunan Perjanjian Kerja Sama (PKS) dengan Mitra Magang. 4. Menginisiasi kerjasama magang dengan mitra magang,0.0,0.6388888888675925,1.0,0.9932492626916489
8,Bagaimana skema waktu pelaksanaan program magang?,"Skema waktu pelaksanaan program magang biasanya ditentukan oleh departemen atau perusahaan mitra magang. Mahasiswa harus menyesuaikan jadwal magang dengan waktu yang telah disepakati. Selain itu, waktu pelaksanaan magang juga dapat tertera dalam Form Rincian Tugas Magang yang harus diisi oleh mahasiswa. Jadi, mahasiswa perlu memperhatikan jadwal yang telah ditetapkan untuk menjalani program magang dengan baik.","['9.2\nETIKA BERKOMUNIKASI DENGAN\nDOSEN PEMBIMBING\n• Komunikasi dengan dosen pembimbing dilakukan dengan mengacu pada norma yang berlaku umum.\nDosen Pembimbing last seen today at 13:25\nSelamat pagi Bu, saya Rosyi, mahasiswa S1 PerencanaanWilayah\ndan Kota semester 7. Maaf bu, saya maumenanyakan\napakah besok Ibu ada waktu untuk bimbingan tugas\nkarya akhir? Terima Kasih\n7:20 AM J/\nSelamat siang Rosyi, hari Kamis pukul 10.00 WIB ya. Tolong ingatkan kembali.\n1:18 PM\nBaik bu, Terima Kasih\nHARI INI\n1:20 PM J/\nSelamat Pagi Bu, Saya Rosyi, maaf apakah saya jadi bimbingan hari ini pukul 10? Terima Kasih\n7:25 AM J/\n• Gunakan Bahasa Indonesia yang baik dan benar (bukan bahasa gaul). Pesan terdiri dari : salam, identitas, keperluan, dan ucapan terimakasih.\n• Pesan dimulai dengan salam/sapaan tanpa disingkat.\n• Mahasiswa harus menuliskan identitanya saat mengirim pesan kepada dosen.\n• Menuliskan pesan dengan singkat dan jelas.\n• Akhiri dengan ucapan terimakasih.\nJadi, temui saya di ruangan ya.'
 '• LAMPIRAN 7: Form Rincian Tugas Magang\nRINCIAN TUGAS MAGANG\nSemester Magang :... Tahun Akademik 20.../20...\nNama Mahasiswa\nNRP\nDepartemen\nNama Dosen Pembimbing\nNama Perusahaan Mitra Magang\nWaktu Pelaksanaan Magang\nNama Proyek / Kegiatan Magang\nPosisi dalam Proyek\nNO\nRincian Tugas Magang\nWaktu Pelaksanaan\nSurabaya, ..\nMahasiswa peserta magang (.........\n........)\nBuku Petunjuk Teknis Magang\n69'
 '• Mahasiswa harus menuliskan identitanya saat mengirim pesan kepada dosen.\n• Menuliskan pesan dengan singkat dan jelas.\n• Akhiri dengan ucapan terimakasih.\nJadi, temui saya di ruangan ya.\n9:58 PM\n• Type a message\n• Jika pesan sudah dibalas, jangan lupa ucapkan persetujuan dan terimakasih.\n• Jika ada dosen yang minta diingatkan\nGambar 9.1 Contoh Komunikasi dengan Dosen\nPembimbing\nuntuk bertemu (Gambar 9.1)\n• Etika bertemu dengan pembimbing\n• Masuk ruang dosen dengan izin dan jangan memaksa bertemu saat dosen sedang istirahat dan berdiskusi.\n• Datang sesuai dengan waktu yang telah disepakati.\n• Memakai pakaian yang rapi dan sopan.\nBuku Petunjuk Teknis Magang\n59'
 '4. Hasil penilaian dilakukan dengan cara mengisi formulir yang ada dan diserahkan\npada departemen.\n8.2\nPENILAIAN PRESTASI KINERJA MAGANG\nOLEH UNIT MITRA MAGANG\nDalam melakukan kegiatan magang, mahasiswa akan memperoleh penilaian dari unit tempat magang. Formulir penilaian magang diisi dan ditandatangani oleh atasan yang berwenang di tempat magang (minimal level manajer) dan dicap menggunakan stempel unit tempat magang. Berikut adalah butir penilaian kinerja magang:\n52\n08 Penilaian Magang']",Program Mahasiswa Magang Bersertifikat (PMMB) • Magang dilaksanakan maksimal 6 bulan • Magang dilaksanakan 2 periode dalam 1 tahun yaitu 1. Periode Febuari - Agustus 2. Periode September - Januari Program Mahasiswa Magang Kerjasama • Magang dilaksanakan sekurang-kurangnya 1 bulan maksimal 6 bulan • Magang dilaksanakan setiap saat sesuai dengan kesepakatan dengan Mitra Magang. Program Magang Mandiri • Magang dilaksanakan sekurang-kurangnya 1 bulan dan maksimal 6 bulan • Magang dilaksanakan setiap saat sesuai dengan kesepakatan dengan Mitra Magang.,0.0,0.499999999975,1.0,0.9765969239479345
9,Apa saja rincian tugas dosen pembimbing magang?,"Dosen pembimbing magang memiliki beberapa tugas, antara lain:
1. Memberikan saran dan masukan saat konsultasi keilmuan jika diperlukan oleh mahasiswa selama magang.
2. Melakukan kegiatan pembimbingan bagi mahasiswa magang untuk dapat berkonsultasi selama magang atau bimbingan penulisan laporan magang.
3. Memberikan persetujuan dan penilaian Laporan Magang.
4. Memberikan penilaian dapat dilakukan dalam bentuk penilaian laporan magang dan atau presentasi kegiatan magang.","['6.4\nKETENTUAN PEMBIMBINGAN MAGANG\nBAGI DOSEN\nA.Dosen pembimbing harus dapat memberikan masukan dan pengarahan tentang pelaksanaan magang dan penulisan Laporan Magang. Pemberian masukan dan arahan tersebut diantaranya mencakup namun tidak terbatas pada hal berikut:\n• Memberikan masukan, arahan, dan mendiskusikan rumusan permasalahan dan tujuan atau topik Laporan Magang.\n• Membuat rencana bimbingan bersama mahasiswa.\n• Mengarahkan mahasiswa dalam hal metode penulisan ilmiah dan metode analisis dalam Laporan Magang sesuai dengan pedoman penulisan Laporan Magang yang telah disepakati.\n• Mendiskusikan acuan materi keilmuan yang relevan dengan topik Laporan Magang.\n• Hadir dalam Sidang Magang dan memberikan penilaian akhir bagi Laporan\nMagang yang diujikan.\n• Memberikan arahan dalam penyelesaian revisi Laporan Magang.\nB. Dosen pembimbing harus memastikan bahwa Laporan Magang bebas dari plagiarisme.\n6.5\nPENGGANTIAN DOSEN PEMBIMBING\nMAGANG'
 '6.1\nKRITERIA DOSEN PEMBIMBING MAGANG\nW888\nDosen yang telah mengajar selama 4 semester berturut-turut.\nMemperoleh SK Pembimbing Magang dari Departemen dan ketetapan melalui\nKeputusan Dekan.\n6.2\nRINCIAN TUGAS DOSEN PEMBIMBING\nMAGANG\n• Memberikan saran dan masukan saat konsultasi keilmuan jika diperlukan oleh mahasiswa selama magang.\n• Melakukan kegiatan pembimbingan bagi mahasiswa magang untuk dapat berkonsultasi selama magang atau bimbingan penulisan laporan magang.\n• Memberikan persetujuan dan penilaian Laporan Magang.\n• Memberikan penilaian dapat dilakukan dalam bentuk penilaian laporan magang dan atau presentasi kegiatan magang.\n40\n06 Pembimbingan Magang'
 '6.3\nKETENTUAN PEMBIMBINGAN MAGANG\nBAGI MAHASISWA\nMahasiswa harus melakukan pembimbingan sebelum dan saat pelaksanaan magang untuk memastikan pelaksanaan magang dan penulisan Laporan Magang dapat berjalan dengan baik.\nMahasiswa harus membuat Laporan Magang sesuai dengan pedoman penulisan Laporan Magang.\nMahasiswa menyerahkan Laporan Magang sesuai\ndengan jadwal atau kesepakatan dialokasikan oleh dosen pembimbing.\nMahasiswa harus memenuhi jumlah bimbingan minimal yang telah ditetapkan.\nMahasiswa harus memperhatikan etika berkomunikasi dan etika berperilaku dalam melakukan proses pembimbingan.\nBuku Petunjuk Teknis Magang\n41'
 '• Memberikan arahan dalam penyelesaian revisi Laporan Magang.\nB. Dosen pembimbing harus memastikan bahwa Laporan Magang bebas dari plagiarisme.\n6.5\nPENGGANTIAN DOSEN PEMBIMBING\nMAGANG\n• Penggantian dosen pembimbing magang harus didasarkan pada alasan yang dapat dipertanggungjawabkan.\n• Pengajuan permohonan penggantian dosen pembimbing magang dapat dilakukan selambat-lambatnya 2 (dua) bulan setelah magang dimulai.\n• Penggantian dosen pembimbing magang harus dengan persetujuan dari Kepala\nDepartemen.\n42\n06 Pembimbingan Magang']",• Memberikan saran dan masukan saat konsultasi keilmuan jika diperlukan oleh mahasiswa selama magang. • Melakukan kegiatan pembimbingan bagi mahasiswa magang untuk dapat berkonsultasi selama magang atau bimbingan penulisan laporan magang. • Memberikan persetujuan dan penilaian Laporan Magang. • Memberikan penilaian dapat dilakukan dalam bentuk penilaian laporan magang dan atau presentasi kegiatan magang.,0.0,0.999999999975,1.0,0.9768603582718911
10,Apa fungsi laporan magang?,"Fungsi laporan magang adalah sebagai bentuk dokumentasi yang berisi hasil kegiatan magang yang dilakukan oleh mahasiswa. Laporan magang juga berfungsi sebagai sarana untuk mengevaluasi dan memperbaiki proses magang, serta sebagai alat untuk menilai pemahaman dan kemampuan mahasiswa dalam menguasai masalah yang dilaporkan, serta kemampuan analisis dan kemampuan berkomunikasi secara tertulis.","['• TEGAS DAN KONSISTEN\nLaporan Magang harus tegas dan konsisten sehingga tidak terjadi kontradiksi antara bagian yang satu dengan bagian lainnya, baik dalam hal substansi, istilah, maupun teknik penulisan penyajian.\nPenulisan, penyerahan, evaluasi, dan perbaikan Laporan Magang harus dilakukan sesuai dengan ketentuan yang berlaku. Untuk memenuhi syarat tersebut, dengan ini seorang penulis Laporan Magang harus:\n• Benar-benar menguasai masalah yang dilaporkan.\n• Mempunyai minat, kesanggupan, obyektifitas, ketelitian, dan kemampuan analisis dalam menyusun laporan.\n• Mampu bekerjasama, serta tanggap dan terbuka terhadap kritik.\n• Mampu menggunakan bahasa tulisan yang baik.\n• Dapat menggunakan kata-kata, istilah, kalimat dan gaya bahasa yang sederhana, jelas, dan mudah dimengerti.\n• Mampu memilih dan mengorganisir data yang diperlukan.\n• Mampu mengamati dan menilai dengan jeli berbagai proses, peristiwa, manfaat dan kelemahan yang ada selama melakukan kegiatan Magang.\n7.4'
 '• LANGSUNG KE SASARAN\nLaporan magang harus tepat, padat dan langsung ke pokok persoalannya. Uraian sebaiknya tidak terlalu panjang atau menggunakan kata-kata kiasan hanya sekedar untuk memberi kesan bahwa laporan itu tebal (laporan tebal tidak selalu berarti bagus).\n• LENGKAP\nLaporan magang harus disajikan secara lengkap dalam bentuk uraian menyeluruh berdasarkan data terpilih dengan disertai data penunjang yang diperlukan. Oleh karena itu Laporan Magang harus memuat seluruh materi magang yang dikerjakan mahasiswa (bukan seluruh materi proyek / kegiatan) dan tidak menimbulkan masalah, persoalan, atau pertanyaan baru, disertai data penunjang, misalnya grafik, tabel, peta, skema, dan lain-lain bila diperlukan.\nBuku Petunjuk Teknis Magang\n45'
 '7.2\nKETENTUAN UMUM DALAM PENULISAN\nLAPORAN MAGANG\n• Laporan Magang ditulis dan dipresentasikan pada akhir magang (jika diperlukan).\n• Laporan Magang selain diserahkan ke departemen dan mitra magang, juga diserahkan ke Subdirektorat PK2 Direktorat Kemahasiswaan dalam bentuk softcopy melalui SIM Magang.\n7.3\nPRINSIP PENULISAN LAPORAN\nMAGANG\n• BENAR DAN OBYEKTIF\nLaporan magang harus sesuai dengan ketentuan yang ada dalam pedoman ini serta memuat informasi yang benar dan obyektif.\n• JELAS DAN CERMAT\nLaporan magang harus mudah dimengerti / dipahami oleh pembaca, dengan cara menghindari pemakaian kata / istilah, rangkaian kata / kalimat atau gaya bahasa yang kurang dapat dipahami oleh pembaca maupun penulisnya sendiri. Gunakan kata-kata yang sederhana tetapi jelas maksudnya.\n• LANGSUNG KE SASARAN'
 'Berikut adalah ketentuan umum mengenai Laporan Magang:\n• Pada akhir pelaksanaan magang mahasiswa diwajibkan menulis Laporan Magang.\n• Pedoman penulisan Laporan Magang dapat ditemukan pada Bagian 5 dari buku petunjuk teknis magang ini.\n• Laporan Magang harus disetujui oleh dosen pembimbing magang dan dosen lapangan.\n• Laporan Magang harus diselesaikan segera setelah Program Magang berakhir.\n• Laporan Magang yang telah disetujui pembimbing magang dapat di presentasikan jika diperlukan.\n• Dalam penyusunan Laporan Magang, mahasiswa wajib menaati ketentuan kerahasiaan data / informasi yang ditetapkan oleh unit tempat magang.\n8.4\nPENILAIAN PRESENTASI LAPORAN\nMAGANG (JIKA DIPERLUKAN)\nButir penilaian presentasi Laporan Magang mencakup aspek berikut ini:\nAlur Presentasi\n1. Logika dalam Analisis Presentasi\n2. Substansi Isi Presentasi\nProses Presentasi\n1. Kualitas Slides Presentasi\n2. Sistematika Slides Presentasi\nKomunikasi dalam Presentasi\n1. Kemampuan Menjelaskan Isi\nLaporan Magang']","sebagai Pertanggungjawaban kegiatan Magang mahasiswa kepada Mitra Magang dan
Departemen.",1.0,0.6388888888675925,0.9999991532904762,0.0
11,Apa saja ketentuan umum dalam penulisan lapora magang?,"Ketentuan umum dalam penulisan laporan magang adalah sebagai berikut:
1. Laporan Magang ditulis dan dipresentasikan pada akhir magang (jika diperlukan).
2. Laporan Magang selain diserahkan ke departemen dan mitra magang, juga diserahkan ke Subdirektorat PK2 Direktorat Kemahasiswaan dalam bentuk softcopy melalui SIM Magang.
3. Laporan magang harus sesuai dengan ketentuan yang ada dalam pedoman ini serta memuat informasi yang benar dan obyektif.
4. Laporan magang harus mudah dimengerti/dipahami oleh pembaca dengan menggunakan kata-kata yang sederhana tetapi jelas maksudnya.
5. Laporan magang harus langsung ke sasaran.
6. Pada akhir pelaksanaan magang, mahasiswa diwajibkan menulis Laporan Magang.
7. Pedoman penulisan Laporan Magang dapat ditemukan pada Bagian 5 dari buku petunjuk teknis magang.
8. Laporan Magang harus disetujui oleh dosen pembimbing magang dan dosen lapangan.
9. Laporan Magang harus diselesaikan segera setelah Program Magang berakhir.
10. Laporan Magang yang telah disetujui pembimbing magang dapat dipresentasikan jika diperlukan.
11. Dalam penyusunan Laporan Magang, mahasiswa wajib menaati ketentuan kerahasiaan data/informasi yang ditetapkan oleh unit tempat magang.","['7.2\nKETENTUAN UMUM DALAM PENULISAN\nLAPORAN MAGANG\n• Laporan Magang ditulis dan dipresentasikan pada akhir magang (jika diperlukan).\n• Laporan Magang selain diserahkan ke departemen dan mitra magang, juga diserahkan ke Subdirektorat PK2 Direktorat Kemahasiswaan dalam bentuk softcopy melalui SIM Magang.\n7.3\nPRINSIP PENULISAN LAPORAN\nMAGANG\n• BENAR DAN OBYEKTIF\nLaporan magang harus sesuai dengan ketentuan yang ada dalam pedoman ini serta memuat informasi yang benar dan obyektif.\n• JELAS DAN CERMAT\nLaporan magang harus mudah dimengerti / dipahami oleh pembaca, dengan cara menghindari pemakaian kata / istilah, rangkaian kata / kalimat atau gaya bahasa yang kurang dapat dipahami oleh pembaca maupun penulisnya sendiri. Gunakan kata-kata yang sederhana tetapi jelas maksudnya.\n• LANGSUNG KE SASARAN'
 '07\nPEDOMAN\nPENULISAN\nLAPORAN\nMAGANG\n\n07\nPEDOMAN PENULISAN LAPORAN\nMAGANG\n7.1\nFUNGSI LAPORAN MAGANG\nPertanggungjawaban kegiatan Magang mahasiswa kepada Mitra Magang dan\nDepartemen.\n女你公\n299\nBahan pertimbangan pemberian nilai kegiatan Magang\nДо\nPenyampaian informasi bagi pihak ITS, mahasiswa, maupun Mitra Magang\nSalah satu alat untuk membina hubungan kerjasama, saling pengertian, dan koordinasi antara mahasiswa dengan pihak ITS maupun Mitra Magang\nSalah satu alat untuk menyampaikan ide, pendapat, penilaian, dan pengalaman yang berkaitan dengan penyelenggaraan Magang kepada\npihak lain.\n44\n07 Pedoman Penulisan Laporan Magang'
 '• LAMPIRAN 8: Form Persetujuan Konversi Mata Kuliah\nLAMPIRAN 1\nKOP Departemen\nNo\n:....\nLampiran :\nPerihal :.\nKepada yth :\nDosen Wali Departemen ...\nFakultas...\nITS\nSehubungan dengan adanya permohonan konversi mata kuliah dari mahasiswa peserta magang dengan detail sebagai berikut :\nNama\nNRP\nNama Mitra Magang :\nPeriode magang\nMahasiswa yang bersangkutan akan/ telah *) melakukan magang dengan rincian tugas sebagai berikut :\nBerdasarkan hasil telaah dan analisa dengan bidang akademik departemen, maka mahasiswa yang bersangkutan berhak untuk mendapatkan konversi mata kuliah dan SKS, dimana konversi ini akan di lakukan pada semester..... tahun ajaran ....\n.......Adapun mata kuliah yang dapat dikonversikan dengan\nkegiatan magang adalah sebagai berikut :\nNo.\nMata Kuliah Konversi\nJumlah SKS\n\n\n\n\n\n\n\n\n\nTotal SKS\n\nSurabaya, ....\n*) dicoret\nKepala Departemen ....\n70\nLampiran\n\nSUBDIREKTORAT PENGEMBANGAN KEWIRAUSAHAAN DAN KARIR\nDIREKTORAT KEMAHASISWAAN\nINSTITUT TEKNOLOGI SEPULUH NOPEMBER\n2020'
 'Berikut adalah ketentuan umum mengenai Laporan Magang:\n• Pada akhir pelaksanaan magang mahasiswa diwajibkan menulis Laporan Magang.\n• Pedoman penulisan Laporan Magang dapat ditemukan pada Bagian 5 dari buku petunjuk teknis magang ini.\n• Laporan Magang harus disetujui oleh dosen pembimbing magang dan dosen lapangan.\n• Laporan Magang harus diselesaikan segera setelah Program Magang berakhir.\n• Laporan Magang yang telah disetujui pembimbing magang dapat di presentasikan jika diperlukan.\n• Dalam penyusunan Laporan Magang, mahasiswa wajib menaati ketentuan kerahasiaan data / informasi yang ditetapkan oleh unit tempat magang.\n8.4\nPENILAIAN PRESENTASI LAPORAN\nMAGANG (JIKA DIPERLUKAN)\nButir penilaian presentasi Laporan Magang mencakup aspek berikut ini:\nAlur Presentasi\n1. Logika dalam Analisis Presentasi\n2. Substansi Isi Presentasi\nProses Presentasi\n1. Kualitas Slides Presentasi\n2. Sistematika Slides Presentasi\nKomunikasi dalam Presentasi\n1. Kemampuan Menjelaskan Isi\nLaporan Magang']","benar dan obyektif, jelas dan cermat, langsung ke sasaran, lengkap, tegas dan konsisten",0.9166666666361111,1.0,0.9515284430108152,0.6
12,Apa jenis dan ukuran kertas pada format penulisan laporan magang?,Jenis kertas yang digunakan dalam format penulisan laporan magang adalah kertas A4. Sedangkan ukuran huruf yang digunakan adalah Calibri dengan ukuran huruf 14 pt.,"['• LANGSUNG KE SASARAN\nLaporan magang harus tepat, padat dan langsung ke pokok persoalannya. Uraian sebaiknya tidak terlalu panjang atau menggunakan kata-kata kiasan hanya sekedar untuk memberi kesan bahwa laporan itu tebal (laporan tebal tidak selalu berarti bagus).\n• LENGKAP\nLaporan magang harus disajikan secara lengkap dalam bentuk uraian menyeluruh berdasarkan data terpilih dengan disertai data penunjang yang diperlukan. Oleh karena itu Laporan Magang harus memuat seluruh materi magang yang dikerjakan mahasiswa (bukan seluruh materi proyek / kegiatan) dan tidak menimbulkan masalah, persoalan, atau pertanyaan baru, disertai data penunjang, misalnya grafik, tabel, peta, skema, dan lain-lain bila diperlukan.\nBuku Petunjuk Teknis Magang\n45'
 '• TEGAS DAN KONSISTEN\nLaporan Magang harus tegas dan konsisten sehingga tidak terjadi kontradiksi antara bagian yang satu dengan bagian lainnya, baik dalam hal substansi, istilah, maupun teknik penulisan penyajian.\nPenulisan, penyerahan, evaluasi, dan perbaikan Laporan Magang harus dilakukan sesuai dengan ketentuan yang berlaku. Untuk memenuhi syarat tersebut, dengan ini seorang penulis Laporan Magang harus:\n• Benar-benar menguasai masalah yang dilaporkan.\n• Mempunyai minat, kesanggupan, obyektifitas, ketelitian, dan kemampuan analisis dalam menyusun laporan.\n• Mampu bekerjasama, serta tanggap dan terbuka terhadap kritik.\n• Mampu menggunakan bahasa tulisan yang baik.\n• Dapat menggunakan kata-kata, istilah, kalimat dan gaya bahasa yang sederhana, jelas, dan mudah dimengerti.\n• Mampu memilih dan mengorganisir data yang diperlukan.\n• Mampu mengamati dan menilai dengan jeli berbagai proses, peristiwa, manfaat dan kelemahan yang ada selama melakukan kegiatan Magang.\n7.4'
 '7.2\nKETENTUAN UMUM DALAM PENULISAN\nLAPORAN MAGANG\n• Laporan Magang ditulis dan dipresentasikan pada akhir magang (jika diperlukan).\n• Laporan Magang selain diserahkan ke departemen dan mitra magang, juga diserahkan ke Subdirektorat PK2 Direktorat Kemahasiswaan dalam bentuk softcopy melalui SIM Magang.\n7.3\nPRINSIP PENULISAN LAPORAN\nMAGANG\n• BENAR DAN OBYEKTIF\nLaporan magang harus sesuai dengan ketentuan yang ada dalam pedoman ini serta memuat informasi yang benar dan obyektif.\n• JELAS DAN CERMAT\nLaporan magang harus mudah dimengerti / dipahami oleh pembaca, dengan cara menghindari pemakaian kata / istilah, rangkaian kata / kalimat atau gaya bahasa yang kurang dapat dipahami oleh pembaca maupun penulisnya sendiri. Gunakan kata-kata yang sederhana tetapi jelas maksudnya.\n• LANGSUNG KE SASARAN'
 '• LAMPIRAN 3: Sampul Laporan Magang\nSampul Laporan Magang berwarna biru dengan logo ITS di kiri atas. Pada sampul tercetak: Judul Laporan Magang, Nama Lengkap Mahasiswa, Asal Departemen dan Fakultas, Institut Teknologi Sepuluh Nopember, dan tahun penyelesaian.\nJenis huruf: Calibri\nUkuran huruf: 14 pt\nContoh Sampul Laporan Magang :\nLAPORAN MAGANG\n(JUDUL LAPORAN MAGANG)\n(NAMA)\n(NRP)\nDosen Pembimbing\n(Nama Dosen Pembimbing)\nDosen Pembimbing\n(Nama Dosen Pembimbing Lapangan)\n(Departemen)\n(Fakultas )\nInstitut Teknologi Sepuluh Nopember Surabaya\n2020\nBuku Petunjuk Teknis Magang\n65\n\n• LAMPIRAN 4 : Form Penilaian Magang (Dosen Pembimbing)\nLEMBAR PENILAIAN KINERJA MAGANG\nSemester Magang :..... Tahun Akademik 20.../20...\nNama Mahasiswa\nNRP\nDepartemen\nNama Dosen Pembimbing\nNama Perusahaan Mitra Magang\nWaktu Pelaksanaan Magang\nNama Proyek/ Kegiatan Magang\nNO\nASPEK YANG DINILAI\nBOBOT (B)\nNILAI (N)\n(0-100)\nJUMLAH\n(B XN)\n1\nKehadiran\n10\n\n\n2\nKesungguhan melaksanakan Kerja Praktek\n15']",Kertas HVS 70gram ukuran A5 (148 × 210 mm).,0.8333333332916666,0.6666666666666666,0.9769629066788695,1.0
13,Berapa jarak tepi margin dalam penulisan laporan magang?,"Tepi margin dalam penulisan laporan magang biasanya disarankan untuk memiliki jarak sekitar 2,5 cm dari tepi kertas. Jarak ini bertujuan untuk memberikan ruang yang cukup agar teks tidak terlalu padat dan memudahkan pembaca dalam membaca laporan.","['• LANGSUNG KE SASARAN\nLaporan magang harus tepat, padat dan langsung ke pokok persoalannya. Uraian sebaiknya tidak terlalu panjang atau menggunakan kata-kata kiasan hanya sekedar untuk memberi kesan bahwa laporan itu tebal (laporan tebal tidak selalu berarti bagus).\n• LENGKAP\nLaporan magang harus disajikan secara lengkap dalam bentuk uraian menyeluruh berdasarkan data terpilih dengan disertai data penunjang yang diperlukan. Oleh karena itu Laporan Magang harus memuat seluruh materi magang yang dikerjakan mahasiswa (bukan seluruh materi proyek / kegiatan) dan tidak menimbulkan masalah, persoalan, atau pertanyaan baru, disertai data penunjang, misalnya grafik, tabel, peta, skema, dan lain-lain bila diperlukan.\nBuku Petunjuk Teknis Magang\n45'
 '• LAMPIRAN 3: Sampul Laporan Magang\nSampul Laporan Magang berwarna biru dengan logo ITS di kiri atas. Pada sampul tercetak: Judul Laporan Magang, Nama Lengkap Mahasiswa, Asal Departemen dan Fakultas, Institut Teknologi Sepuluh Nopember, dan tahun penyelesaian.\nJenis huruf: Calibri\nUkuran huruf: 14 pt\nContoh Sampul Laporan Magang :\nLAPORAN MAGANG\n(JUDUL LAPORAN MAGANG)\n(NAMA)\n(NRP)\nDosen Pembimbing\n(Nama Dosen Pembimbing)\nDosen Pembimbing\n(Nama Dosen Pembimbing Lapangan)\n(Departemen)\n(Fakultas )\nInstitut Teknologi Sepuluh Nopember Surabaya\n2020\nBuku Petunjuk Teknis Magang\n65\n\n• LAMPIRAN 4 : Form Penilaian Magang (Dosen Pembimbing)\nLEMBAR PENILAIAN KINERJA MAGANG\nSemester Magang :..... Tahun Akademik 20.../20...\nNama Mahasiswa\nNRP\nDepartemen\nNama Dosen Pembimbing\nNama Perusahaan Mitra Magang\nWaktu Pelaksanaan Magang\nNama Proyek/ Kegiatan Magang\nNO\nASPEK YANG DINILAI\nBOBOT (B)\nNILAI (N)\n(0-100)\nJUMLAH\n(B XN)\n1\nKehadiran\n10\n\n\n2\nKesungguhan melaksanakan Kerja Praktek\n15'
 '7.2\nKETENTUAN UMUM DALAM PENULISAN\nLAPORAN MAGANG\n• Laporan Magang ditulis dan dipresentasikan pada akhir magang (jika diperlukan).\n• Laporan Magang selain diserahkan ke departemen dan mitra magang, juga diserahkan ke Subdirektorat PK2 Direktorat Kemahasiswaan dalam bentuk softcopy melalui SIM Magang.\n7.3\nPRINSIP PENULISAN LAPORAN\nMAGANG\n• BENAR DAN OBYEKTIF\nLaporan magang harus sesuai dengan ketentuan yang ada dalam pedoman ini serta memuat informasi yang benar dan obyektif.\n• JELAS DAN CERMAT\nLaporan magang harus mudah dimengerti / dipahami oleh pembaca, dengan cara menghindari pemakaian kata / istilah, rangkaian kata / kalimat atau gaya bahasa yang kurang dapat dipahami oleh pembaca maupun penulisnya sendiri. Gunakan kata-kata yang sederhana tetapi jelas maksudnya.\n• LANGSUNG KE SASARAN'
 '• TEGAS DAN KONSISTEN\nLaporan Magang harus tegas dan konsisten sehingga tidak terjadi kontradiksi antara bagian yang satu dengan bagian lainnya, baik dalam hal substansi, istilah, maupun teknik penulisan penyajian.\nPenulisan, penyerahan, evaluasi, dan perbaikan Laporan Magang harus dilakukan sesuai dengan ketentuan yang berlaku. Untuk memenuhi syarat tersebut, dengan ini seorang penulis Laporan Magang harus:\n• Benar-benar menguasai masalah yang dilaporkan.\n• Mempunyai minat, kesanggupan, obyektifitas, ketelitian, dan kemampuan analisis dalam menyusun laporan.\n• Mampu bekerjasama, serta tanggap dan terbuka terhadap kritik.\n• Mampu menggunakan bahasa tulisan yang baik.\n• Dapat menggunakan kata-kata, istilah, kalimat dan gaya bahasa yang sederhana, jelas, dan mudah dimengerti.\n• Mampu memilih dan mengorganisir data yang diperlukan.\n• Mampu mengamati dan menilai dengan jeli berbagai proses, peristiwa, manfaat dan kelemahan yang ada selama melakukan kegiatan Magang.\n7.4']","- Tepi Atas : 2,5 cm
- Тері Bawah : 2,5 cm
- Tepi Kiri : 2,5 cm
- Tepi Kanan : 2,0 cm",0.999999999975,0.0,0.9903877487675277,0.0
14,apa ketentuan umum mengenai penilaian akhir magang?,"Ketentuan umum mengenai penilaian akhir magang adalah sebagai berikut:
1. Hasil penilaian dilakukan dengan cara mengisi formulir yang ada dan diserahkan pada departemen.
2. Penilaian prestasi kinerja magang oleh unit mitra magang dilakukan dengan mengisi formulir penilaian magang yang diisi dan ditandatangani oleh atasan yang berwenang di tempat magang (minimal level manajer) dan dicap menggunakan stempel unit tempat magang.
3. Laporan Magang harus disetujui oleh dosen pembimbing magang dan dosen lapangan.
4. Laporan Magang harus diselesaikan segera setelah Program Magang berakhir.
5. Laporan Magang yang telah disetujui pembimbing magang dapat dipresentasikan jika diperlukan.
6. Dalam penyusunan Laporan Magang, mahasiswa wajib menaati ketentuan kerahasiaan data / informasi yang ditetapkan oleh unit tempat magang.","['4. Hasil penilaian dilakukan dengan cara mengisi formulir yang ada dan diserahkan\npada departemen.\n8.2\nPENILAIAN PRESTASI KINERJA MAGANG\nOLEH UNIT MITRA MAGANG\nDalam melakukan kegiatan magang, mahasiswa akan memperoleh penilaian dari unit tempat magang. Formulir penilaian magang diisi dan ditandatangani oleh atasan yang berwenang di tempat magang (minimal level manajer) dan dicap menggunakan stempel unit tempat magang. Berikut adalah butir penilaian kinerja magang:\n52\n08 Penilaian Magang'
 'Berikut adalah ketentuan umum mengenai Laporan Magang:\n• Pada akhir pelaksanaan magang mahasiswa diwajibkan menulis Laporan Magang.\n• Pedoman penulisan Laporan Magang dapat ditemukan pada Bagian 5 dari buku petunjuk teknis magang ini.\n• Laporan Magang harus disetujui oleh dosen pembimbing magang dan dosen lapangan.\n• Laporan Magang harus diselesaikan segera setelah Program Magang berakhir.\n• Laporan Magang yang telah disetujui pembimbing magang dapat di presentasikan jika diperlukan.\n• Dalam penyusunan Laporan Magang, mahasiswa wajib menaati ketentuan kerahasiaan data / informasi yang ditetapkan oleh unit tempat magang.\n8.4\nPENILAIAN PRESENTASI LAPORAN\nMAGANG (JIKA DIPERLUKAN)\nButir penilaian presentasi Laporan Magang mencakup aspek berikut ini:\nAlur Presentasi\n1. Logika dalam Analisis Presentasi\n2. Substansi Isi Presentasi\nProses Presentasi\n1. Kualitas Slides Presentasi\n2. Sistematika Slides Presentasi\nKomunikasi dalam Presentasi\n1. Kemampuan Menjelaskan Isi\nLaporan Magang'
 '7.2\nKETENTUAN UMUM DALAM PENULISAN\nLAPORAN MAGANG\n• Laporan Magang ditulis dan dipresentasikan pada akhir magang (jika diperlukan).\n• Laporan Magang selain diserahkan ke departemen dan mitra magang, juga diserahkan ke Subdirektorat PK2 Direktorat Kemahasiswaan dalam bentuk softcopy melalui SIM Magang.\n7.3\nPRINSIP PENULISAN LAPORAN\nMAGANG\n• BENAR DAN OBYEKTIF\nLaporan magang harus sesuai dengan ketentuan yang ada dalam pedoman ini serta memuat informasi yang benar dan obyektif.\n• JELAS DAN CERMAT\nLaporan magang harus mudah dimengerti / dipahami oleh pembaca, dengan cara menghindari pemakaian kata / istilah, rangkaian kata / kalimat atau gaya bahasa yang kurang dapat dipahami oleh pembaca maupun penulisnya sendiri. Gunakan kata-kata yang sederhana tetapi jelas maksudnya.\n• LANGSUNG KE SASARAN'
 'Beberapa ketentuan yang perlu diperhatikan khususnya oleh mahasiswa peserta magang dalam merencanakan dan melaksanakan ujian presentasi Laporan Magang sebagai berikut:\n• Ujian Presentasi Laporan Magang dilaksanakan oleh mahasiswa yang telah menyelesaikan penyusunan karya akhir Laporan Magang yang sudah disetujui oleh pembimbing magang.\n• Ujian Presentasi Magang dilaksanakan setelah berkas penilaian kinerja magang sudah diisi oleh unit tempat magang dan sudah diterima oleh program studi.\n• Ujian Presentasi Magang akan dilakukan di ruang ujian Sidang atau di ruang kelas.\n• Untuk dapat mengikuti Ujian Presentasi Magang, mahasiswa harus mengajukan Permohonan Ujian Presentasi Magang sesuai jadwal yang ditetapkan oleh Program Studi.\n• Ujian Presentasi Magang akan diuji oleh 3 (tiga) orang dosen penguji, salah satunya dosen pembimbing magang dan berlangsung sekitar 1,5 jam termasuk sesi untuk tanya jawab.']","1. Dosen pembimbing magang dan dosen pembimbing dari unit tempat magang memberikan penilaian terhadap Laporan Magang dan ujian presentasi magang
jika diperlukan.
2. Unit tempat magang memberikan penilaian terhadap prestasi magang.
3. Penilaian penulisan laporan magang mengacu kepada ketentuan.
4. Hasil penilaian dilakukan dengan cara mengisi formulir yang ada dan diserahkan
pada departemen",0.999999999975,0.8,0.9704039888393178,1.0
15,Apa saja etika pelaksanaan magang di perusahaan mitra magang?,"Etika pelaksanaan magang di perusahaan mitra magang meliputi:
1. Mahasiswa harus mematuhi aturan Mitra Magang dengan baik.
2. Mahasiswa harus bekerja dan berusaha memberikan yang terbaik untuk kepentingan Mitra Magang.
3. Mahasiswa harus dapat menyelesaikan segala tugas yang diberikan Mitra Magang dengan benar, rapi, dan tepat waktu.
4. Mahasiswa harus menghormati pegawai Mitra Magang tanpa membedakan suku, agama, ras, gender, dan golongan.
5. Mahasiswa bersikap jujur, disiplin, santun, profesional, dan menjaga etos kerja di unit kerja Mitra Magang.
6. Mahasiswa harus menjaga kerahasiaan informasi unit kerja Mitra Magang. Seluruh informasi dan data yang akan dijadikan sumber dalam penulisan laporan magang harus disamarkan dalam penulisan untuk menjaga kerahasiaan data dan informasi Mitra Magang.
7. Mahasiswa harus menjaga nama baik almamater ITS.","['07\nPEDOMAN\nPENULISAN\nLAPORAN\nMAGANG\n\n07\nPEDOMAN PENULISAN LAPORAN\nMAGANG\n7.1\nFUNGSI LAPORAN MAGANG\nPertanggungjawaban kegiatan Magang mahasiswa kepada Mitra Magang dan\nDepartemen.\n女你公\n299\nBahan pertimbangan pemberian nilai kegiatan Magang\nДо\nPenyampaian informasi bagi pihak ITS, mahasiswa, maupun Mitra Magang\nSalah satu alat untuk membina hubungan kerjasama, saling pengertian, dan koordinasi antara mahasiswa dengan pihak ITS maupun Mitra Magang\nSalah satu alat untuk menyampaikan ide, pendapat, penilaian, dan pengalaman yang berkaitan dengan penyelenggaraan Magang kepada\npihak lain.\n44\n07 Pedoman Penulisan Laporan Magang'
 '09\nЕТІКА\nMAGANG\n\n09\nETIKA MAGANG\n9.1\nETIKA PELAKSANAAN MAGANG DI PERUSAHAAN MITRA MAGANG\nVX\n• Mahasiswa harus mematuhi aturan Mitra Magang dengan baik.\n• Mahasiswa harus bekerja dan berusaha memberikan yang terbaik untuk kepentingan Mitra Magang.\n• Mahasiswa harus dapat menyelesaikan segala tugas yang diberikan\nMitra Magang dengan benar, rapi dan tepat waktu.\n• Mahasiswa harus menghormati pegawai Mitra Magang tanpa membedakan suku, agama, ras, gender dan golongan.\n• Mahasiswa bersikap jujur, disiplin, santun, profesional, dan menjaga etos kerja di unit kerja Mitra Magang.\n• Mahasiswa harus menjaga kerahasiaan informasi unit kerja Mitra Magang. Seluruh informasi dan data yang akan dijadikan sumber dalam penulisan laporan magang harus disamarkan dalam penulisan untuk menjaga kerahasidan data dan informasi Mitra Magang.\n• Mahasiswa harus menjaga nama baik almamater ITS.\n58\n09 Etika Magang'
 '08\nPENILAIAN MAGANG\n8.1\nBOBOT PENILAIAN MAGANG\n• Berikut adalah bobot masing-masing komponen penilaian untuk nilai akhir magang:\n60%\n40%\nPrestasi Kinerja Magang\noleh Unit tempat Magang\nPenulisan Laporan Magang,\ndan presentasi laporan jika diperlukan\n• Berikut ketentuan umum mengenai penilaian akhir magang:\n1. Dosen pembimbing magang dan dosen pembimbing dari unit tempat magang memberikan penilaian terhadap Laporan Magang dan ujian presentasi magang\njika diperlukan.\n2. Unit tempat magang memberikan penilaian terhadap prestasi magang.\n3. Penilaian penulisan laporan magang mengacu kepada ketentuan.\n4. Hasil penilaian dilakukan dengan cara mengisi formulir yang ada dan diserahkan\npada departemen.\n8.2\nPENILAIAN PRESTASI KINERJA MAGANG\nOLEH UNIT MITRA MAGANG'
 '4. Hasil penilaian dilakukan dengan cara mengisi formulir yang ada dan diserahkan\npada departemen.\n8.2\nPENILAIAN PRESTASI KINERJA MAGANG\nOLEH UNIT MITRA MAGANG\nDalam melakukan kegiatan magang, mahasiswa akan memperoleh penilaian dari unit tempat magang. Formulir penilaian magang diisi dan ditandatangani oleh atasan yang berwenang di tempat magang (minimal level manajer) dan dicap menggunakan stempel unit tempat magang. Berikut adalah butir penilaian kinerja magang:\n52\n08 Penilaian Magang']","• Mahasiswa harus mematuhi aturan Mitra Magang dengan baik.
• Mahasiswa harus bekerja dan berusaha memberikan yang terbaik untuk kepentingan Mitra Magang.
• Mahasiswa harus dapat menyelesaikan segala tugas yang diberikan
Mitra Magang dengan benar, rapi dan tepat waktu.
• Mahasiswa harus menghormati pegawai Mitra Magang tanpa membedakan suku, agama, ras, gender dan golongan.
• Mahasiswa bersikap jujur, disiplin, santun, profesional, dan menjaga etos kerja di unit kerja Mitra Magang.
• Mahasiswa harus menjaga kerahasiaan informasi unit kerja Mitra Magang. Seluruh informasi dan data yang akan dijadikan sumber dalam penulisan laporan magang harus disamarkan dalam penulisan untuk menjaga kerahasidan data dan informasi Mitra Magang.
• Mahasiswa harus menjaga nama baik almamater ITS.",0.999999999975,1.0,0.9999999999999996,1.0
16,Apa syarat yang harus dipenuhi mahasiswa untik mengikuti kegiatan magang?,"Mahasiswa harus mematuhi aturan Mitra Magang dengan baik, bekerja dan berusaha memberikan yang terbaik untuk kepentingan Mitra Magang, dapat menyelesaikan segala tugas yang diberikan dengan benar, rapi, dan tepat waktu, menghormati pegawai Mitra Magang tanpa membedakan suku, agama, ras, gender, dan golongan, bersikap jujur, disiplin, santun, profesional, dan menjaga etos kerja di unit kerja Mitra Magang, menjaga kerahasiaan informasi unit kerja Mitra Magang, menjaga nama baik almamater ITS.","['09\nЕТІКА\nMAGANG\n\n09\nETIKA MAGANG\n9.1\nETIKA PELAKSANAAN MAGANG DI PERUSAHAAN MITRA MAGANG\nVX\n• Mahasiswa harus mematuhi aturan Mitra Magang dengan baik.\n• Mahasiswa harus bekerja dan berusaha memberikan yang terbaik untuk kepentingan Mitra Magang.\n• Mahasiswa harus dapat menyelesaikan segala tugas yang diberikan\nMitra Magang dengan benar, rapi dan tepat waktu.\n• Mahasiswa harus menghormati pegawai Mitra Magang tanpa membedakan suku, agama, ras, gender dan golongan.\n• Mahasiswa bersikap jujur, disiplin, santun, profesional, dan menjaga etos kerja di unit kerja Mitra Magang.\n• Mahasiswa harus menjaga kerahasiaan informasi unit kerja Mitra Magang. Seluruh informasi dan data yang akan dijadikan sumber dalam penulisan laporan magang harus disamarkan dalam penulisan untuk menjaga kerahasidan data dan informasi Mitra Magang.\n• Mahasiswa harus menjaga nama baik almamater ITS.\n58\n09 Etika Magang'
 '9.3\nETIKA BERPAKAIAN DI PERUSAHAAN\nMITRA MAGANG\n• Mahasiswa harus mengenakan pakaian yang formal dan sopan. Contoh pakaian formal adalah kemeja, celana atau rok, dari bahan kain. Pakaian yang dihindari adalah pakaian yang terbuat dari bahan kaos dan jeans. Mahasiswa juga harus menghindari pakaian yang terlalu longgar atau terlalu ketat.\n• Mahasiswa harus mengenakan pakaian yang sopan. Pakaian yang terlalu terbuka (seksi), seperti memakai pakaian bagian atas yang terlalu rendah, memakai rok yang terlalu pendek, atau pakaian bagian atas dan bagian bawah yang tembus pandang, harus dihindari.\n• Mahasiswa disarankan menggunakan sepatu. Penggunaan sandal saat pelaksanaan kegiatan magang harus dihindari. Sepatu yang digunakan sebaiknya tidak meng-ganggu mobilitas mahasiswa peserta magang dalam pelaksanaan magang.\n• Mahasiswa harus menghindari penggunaan aksesoris dan makeup yang berlebihan.\n09 Etika Magang\n\nLAMPIRAN'
 'Beberapa ketentuan yang perlu diperhatikan khususnya oleh mahasiswa peserta magang dalam merencanakan dan melaksanakan ujian presentasi Laporan Magang sebagai berikut:\n• Ujian Presentasi Laporan Magang dilaksanakan oleh mahasiswa yang telah menyelesaikan penyusunan karya akhir Laporan Magang yang sudah disetujui oleh pembimbing magang.\n• Ujian Presentasi Magang dilaksanakan setelah berkas penilaian kinerja magang sudah diisi oleh unit tempat magang dan sudah diterima oleh program studi.\n• Ujian Presentasi Magang akan dilakukan di ruang ujian Sidang atau di ruang kelas.\n• Untuk dapat mengikuti Ujian Presentasi Magang, mahasiswa harus mengajukan Permohonan Ujian Presentasi Magang sesuai jadwal yang ditetapkan oleh Program Studi.\n• Ujian Presentasi Magang akan diuji oleh 3 (tiga) orang dosen penguji, salah satunya dosen pembimbing magang dan berlangsung sekitar 1,5 jam termasuk sesi untuk tanya jawab.'
 '• BAB 5. REFLEKSI DIRI\n• Mahasiswa mendeskripsikan tentang hal-hal positif yang diterima selama perkuliahan yang bermanfaat / relevan terhadap pekerjaan selama magang.\n• Mahasiswa menjelaskan tentang manfaat magang terhadap pengembangan soft-skills dan kekurangan soft-skills yang dimilikinya.\n• Mahasiswa memberikan penjabaran tentang manfaat magang terhadap pengembangan kemampuan kognitif dan kekurangan kemampuan kognitif yang dimilikinya.\nBuku Petunjuk Teknis Magang\n49']","1. Mahasiswa peserta magang adalah mahasiswa aktif ITS 2. Mahasiswa sudah menempuh minimal 90 SKS, untuk departemen yang tidak mempunyai MK magang dalam kurikulumnya.",0.999999999975,1.0,0.9328509020643264,1.0
17,apa peran Dosen pembimbing magang?,"Dosen pembimbing magang memiliki peran sebagai berikut:
1. Memberikan masukan, arahan, dan mendiskusikan rumusan permasalahan dan tujuan atau topik Laporan Magang.
2. Membuat rencana bimbingan bersama mahasiswa.
3. Mengarahkan mahasiswa dalam hal metode penulisan ilmiah dan metode analisis dalam Laporan Magang sesuai dengan pedoman penulisan yang telah disepakati.
4. Mendiskusikan acuan materi keilmuan yang relevan dengan topik Laporan Magang.
5. Hadir dalam Sidang Magang dan memberikan penilaian akhir bagi Laporan Magang yang diujikan.
6. Memberikan arahan dalam penyelesaian revisi Laporan Magang.
7. Memastikan bahwa Laporan Magang bebas dari plagiarisme.","['6.4\nKETENTUAN PEMBIMBINGAN MAGANG\nBAGI DOSEN\nA.Dosen pembimbing harus dapat memberikan masukan dan pengarahan tentang pelaksanaan magang dan penulisan Laporan Magang. Pemberian masukan dan arahan tersebut diantaranya mencakup namun tidak terbatas pada hal berikut:\n• Memberikan masukan, arahan, dan mendiskusikan rumusan permasalahan dan tujuan atau topik Laporan Magang.\n• Membuat rencana bimbingan bersama mahasiswa.\n• Mengarahkan mahasiswa dalam hal metode penulisan ilmiah dan metode analisis dalam Laporan Magang sesuai dengan pedoman penulisan Laporan Magang yang telah disepakati.\n• Mendiskusikan acuan materi keilmuan yang relevan dengan topik Laporan Magang.\n• Hadir dalam Sidang Magang dan memberikan penilaian akhir bagi Laporan\nMagang yang diujikan.\n• Memberikan arahan dalam penyelesaian revisi Laporan Magang.\nB. Dosen pembimbing harus memastikan bahwa Laporan Magang bebas dari plagiarisme.\n6.5\nPENGGANTIAN DOSEN PEMBIMBING\nMAGANG'
 '6.1\nKRITERIA DOSEN PEMBIMBING MAGANG\nW888\nDosen yang telah mengajar selama 4 semester berturut-turut.\nMemperoleh SK Pembimbing Magang dari Departemen dan ketetapan melalui\nKeputusan Dekan.\n6.2\nRINCIAN TUGAS DOSEN PEMBIMBING\nMAGANG\n• Memberikan saran dan masukan saat konsultasi keilmuan jika diperlukan oleh mahasiswa selama magang.\n• Melakukan kegiatan pembimbingan bagi mahasiswa magang untuk dapat berkonsultasi selama magang atau bimbingan penulisan laporan magang.\n• Memberikan persetujuan dan penilaian Laporan Magang.\n• Memberikan penilaian dapat dilakukan dalam bentuk penilaian laporan magang dan atau presentasi kegiatan magang.\n40\n06 Pembimbingan Magang'
 'Inisiatif\nKemampuan komunikasi (lisan dan tulisan)\nDisiplin\nPenampilan\nKetekunan\nKemampuan teknikal\nBerpikir kritis, kreatif dan analitis\nKemampuan bekerjasama\ndalam tim Kemampuan\nberadaptasi\n凸\nHasil pekerjaan (kontribusi)\nSedangkan mekanisme pengiriman formulir penilaian magang dari unit tempat magang adalah sebagai berikut:\nこと\nFormulir kosong serta amplop balasan yang sudah bertuliskan alamat Departemen disampaikan oleh mahasiswa magang kepada atasan yang berwenang.\nFormulir penilaian yang sudah terisi dimasukkan ke dalam amplop tertutup dan dikirim langsung ke Departemen.\nBuku Petunjuk Teknis Magang\n53\n\n8.3\nPENILAIAN PENULISAN LAPORAN\nMAGANG\nButir penilaian Laporan Magang mencakup aspek sebagai berikut:\n2. Tugas mahasiswa selama magang\ndijelaskan dengan baik dan relevan\nDeskripsi proses kegiatan\nmagang yang dilakukan\n1. Gambaran umum Mitra Magang\ndengan Departemen.\n\njelas.'
 '6.3\nKETENTUAN PEMBIMBINGAN MAGANG\nBAGI MAHASISWA\nMahasiswa harus melakukan pembimbingan sebelum dan saat pelaksanaan magang untuk memastikan pelaksanaan magang dan penulisan Laporan Magang dapat berjalan dengan baik.\nMahasiswa harus membuat Laporan Magang sesuai dengan pedoman penulisan Laporan Magang.\nMahasiswa menyerahkan Laporan Magang sesuai\ndengan jadwal atau kesepakatan dialokasikan oleh dosen pembimbing.\nMahasiswa harus memenuhi jumlah bimbingan minimal yang telah ditetapkan.\nMahasiswa harus memperhatikan etika berkomunikasi dan etika berperilaku dalam melakukan proses pembimbingan.\nBuku Petunjuk Teknis Magang\n41']",Dosen pembimbing magang memegang peranan kunci dalam koordinasi pelaksanaan magang dengan mahasiswa peserta magang dan unit tempat magang serta wajib memantau secara kontinu pelaksanaan magang dari mahasiswa yang dibimbingnya.,0.999999999975,1.0,0.9756435559484581,0.0
18,Bagaimana proses seleksi program mahasiswa magang bersertifikat?,"Proses seleksi program mahasiswa magang bersertifikat dilakukan dengan cara mengisi formulir yang ada dan diserahkan pada departemen terkait. Selain itu, mahasiswa juga akan memperoleh penilaian dari unit tempat magang. Formulir penilaian magang diisi dan ditandatangani oleh atasan yang berwenang di tempat magang (minimal level manajer) dan dicap menggunakan stempel unit tempat magang. Seluruh proses penilaian kinerja magang akan dilakukan oleh unit mitra magang sesuai dengan butir penilaian kinerja magang yang telah ditetapkan.","['4. Hasil penilaian dilakukan dengan cara mengisi formulir yang ada dan diserahkan\npada departemen.\n8.2\nPENILAIAN PRESTASI KINERJA MAGANG\nOLEH UNIT MITRA MAGANG\nDalam melakukan kegiatan magang, mahasiswa akan memperoleh penilaian dari unit tempat magang. Formulir penilaian magang diisi dan ditandatangani oleh atasan yang berwenang di tempat magang (minimal level manajer) dan dicap menggunakan stempel unit tempat magang. Berikut adalah butir penilaian kinerja magang:\n52\n08 Penilaian Magang'
 '6.1\nKRITERIA DOSEN PEMBIMBING MAGANG\nW888\nDosen yang telah mengajar selama 4 semester berturut-turut.\nMemperoleh SK Pembimbing Magang dari Departemen dan ketetapan melalui\nKeputusan Dekan.\n6.2\nRINCIAN TUGAS DOSEN PEMBIMBING\nMAGANG\n• Memberikan saran dan masukan saat konsultasi keilmuan jika diperlukan oleh mahasiswa selama magang.\n• Melakukan kegiatan pembimbingan bagi mahasiswa magang untuk dapat berkonsultasi selama magang atau bimbingan penulisan laporan magang.\n• Memberikan persetujuan dan penilaian Laporan Magang.\n• Memberikan penilaian dapat dilakukan dalam bentuk penilaian laporan magang dan atau presentasi kegiatan magang.\n40\n06 Pembimbingan Magang'
 'Beberapa ketentuan yang perlu diperhatikan khususnya oleh mahasiswa peserta magang dalam merencanakan dan melaksanakan ujian presentasi Laporan Magang sebagai berikut:\n• Ujian Presentasi Laporan Magang dilaksanakan oleh mahasiswa yang telah menyelesaikan penyusunan karya akhir Laporan Magang yang sudah disetujui oleh pembimbing magang.\n• Ujian Presentasi Magang dilaksanakan setelah berkas penilaian kinerja magang sudah diisi oleh unit tempat magang dan sudah diterima oleh program studi.\n• Ujian Presentasi Magang akan dilakukan di ruang ujian Sidang atau di ruang kelas.\n• Untuk dapat mengikuti Ujian Presentasi Magang, mahasiswa harus mengajukan Permohonan Ujian Presentasi Magang sesuai jadwal yang ditetapkan oleh Program Studi.\n• Ujian Presentasi Magang akan diuji oleh 3 (tiga) orang dosen penguji, salah satunya dosen pembimbing magang dan berlangsung sekitar 1,5 jam termasuk sesi untuk tanya jawab.'
 '6.3\nKETENTUAN PEMBIMBINGAN MAGANG\nBAGI MAHASISWA\nMahasiswa harus melakukan pembimbingan sebelum dan saat pelaksanaan magang untuk memastikan pelaksanaan magang dan penulisan Laporan Magang dapat berjalan dengan baik.\nMahasiswa harus membuat Laporan Magang sesuai dengan pedoman penulisan Laporan Magang.\nMahasiswa menyerahkan Laporan Magang sesuai\ndengan jadwal atau kesepakatan dialokasikan oleh dosen pembimbing.\nMahasiswa harus memenuhi jumlah bimbingan minimal yang telah ditetapkan.\nMahasiswa harus memperhatikan etika berkomunikasi dan etika berperilaku dalam melakukan proses pembimbingan.\nBuku Petunjuk Teknis Magang\n41']",Seleksi program magang bersertifikat dilakukan oleh FHCl atau BUMN Proses tahapan seleksi dilaksanakan sesuai dengan kebijakan BUMN Hasil proses seleksi akan disampaikan ke Sub Direktorat PK2 untuk diumumkan ke mahasiswa calon peserta magang.,0.0,0.8571428571428571,0.9953024240693678,0.0
19,apa saja berkas yang perlu diunggah melalui SIM magang?,"Berkas yang perlu diunggah melalui SIM magang antara lain:
1. Laporan Magang
2. Absensi
3. Laporan logbook kegiatan harian yang ditandatangani oleh pembimbing lapangan
4. Struktur organisasi lembaga tempat magang
5. Prosedur atau proses kerja
6. Foto-foto dan sebagainya
7. Sertifikat magang

Semua berkas tersebut harus diunggah dalam bentuk softcopy melalui SIM Magang.","['7.2\nKETENTUAN UMUM DALAM PENULISAN\nLAPORAN MAGANG\n• Laporan Magang ditulis dan dipresentasikan pada akhir magang (jika diperlukan).\n• Laporan Magang selain diserahkan ke departemen dan mitra magang, juga diserahkan ke Subdirektorat PK2 Direktorat Kemahasiswaan dalam bentuk softcopy melalui SIM Magang.\n7.3\nPRINSIP PENULISAN LAPORAN\nMAGANG\n• BENAR DAN OBYEKTIF\nLaporan magang harus sesuai dengan ketentuan yang ada dalam pedoman ini serta memuat informasi yang benar dan obyektif.\n• JELAS DAN CERMAT\nLaporan magang harus mudah dimengerti / dipahami oleh pembaca, dengan cara menghindari pemakaian kata / istilah, rangkaian kata / kalimat atau gaya bahasa yang kurang dapat dipahami oleh pembaca maupun penulisnya sendiri. Gunakan kata-kata yang sederhana tetapi jelas maksudnya.\n• LANGSUNG KE SASARAN'
 '• Mahasiswa memberikan penjabaran mengenai rencana perbaikan / pengembangan diri, karir, dan pendidikan selanjutnya.\n• LAMPIRAN\n• Berisi naskah atau dokumen yang perlu disampaikan untuk mendukung dan menguatkan laporan.\n• Lampiran wajib berupa absensi dan,\n• Laporan logbook kegiatan harian yang ditandatangani oleh pembimbing lapangan.\n• Lampiran penunjang dapat berupa struktur organisasi lembaga tempat magang, prosedur atau proses kerja, foto-foto dan sebagainya.\n• Sertifikat magang.\n50\n07 Pedoman Penulisan Laporan Magang\n\nBARAT\nTH\nHARI LISTRIK NASIONAL\nPLN\nPL\nN\n08\nPENILAIAN\nMAGANG'
 '07\nPEDOMAN\nPENULISAN\nLAPORAN\nMAGANG\n\n07\nPEDOMAN PENULISAN LAPORAN\nMAGANG\n7.1\nFUNGSI LAPORAN MAGANG\nPertanggungjawaban kegiatan Magang mahasiswa kepada Mitra Magang dan\nDepartemen.\n女你公\n299\nBahan pertimbangan pemberian nilai kegiatan Magang\nДо\nPenyampaian informasi bagi pihak ITS, mahasiswa, maupun Mitra Magang\nSalah satu alat untuk membina hubungan kerjasama, saling pengertian, dan koordinasi antara mahasiswa dengan pihak ITS maupun Mitra Magang\nSalah satu alat untuk menyampaikan ide, pendapat, penilaian, dan pengalaman yang berkaitan dengan penyelenggaraan Magang kepada\npihak lain.\n44\n07 Pedoman Penulisan Laporan Magang'
 'LAMPIRAN\n\nLAMPIRAN\n• Form persetujuan untuk laporan magang\n• Form pengajuan konversi mata kuliah\n• Form Logbook\n• Form permohonan rencana kegiatan magang\n• Form penilaian magang\n62\nLampiran\n\n• LAMPIRAN 1: Form Logbook\nLOGBOOK MAGANG\nPeriode Magang :..\nTahun Akademik 20.../20...\nNama\nNRP\nPosisi Magang\nPembimbing Magang\nNama Perusahaan Mitra Magang :\nNama Proyek/Kegiatan\nNO\nTANGGAL\nDeskripsi Kegiatan (Bisa dilengkapi dengan Foto)\nPARAF PEMBIMBING\nMAGANG\n\n\n\n\n\n\n\n\n\n\n\n\n\n\n\n\n\n\n\n\n\n\n\n\n\n\n\n\n\n\n\n\n\n\n\n\nBuku Petunjuk Teknis Magang\n63\n\n• LAMPIRAN 2: Form Persetujuan untuk Laporan Magang\nFORMULIR PERSETUJUAN LAPORAN MAGANG BERJUDUL\n""JUDUL LAPORAN""\nSemester Magang :.... Tahun Akademik 20.../20...\nDisetujui oleh\nPembimbing Lapangan\nDosen Pembimbing\nMengetahui\nKepala Departemen\n64\nLampiran']",• CV • Transkrip Nilai • Surat Rekomendasi Departemen • Mengisi Form Pakta Integritas,0.8055555555287036,1.0,0.9563200739585543,0.0
