,question,ground_truth,contexts,answer
0,Apa isi dari Permendikbud Nomor 3 Tahun 2020?,"Pendidikan Tinggi, mahasiswa sarjana ataupun mahasiswa sarjana terapan memiliki kesempatan menempuh pembelajaran diluar Perguruan Tinggi.","['• Mahasiswa memberikan penjabaran mengenai rencana perbaikan / pengembangan diri, karir, dan pendidikan selanjutnya.\n• LAMPIRAN\n• Berisi naskah atau dokumen yang perlu disampaikan untuk mendukung dan menguatkan laporan.\n• Lampiran wajib berupa absensi dan,\n• Laporan logbook kegiatan harian yang ditandatangani oleh pembimbing lapangan.\n• Lampiran penunjang dapat berupa struktur organisasi lembaga tempat magang, prosedur atau proses kerja, foto-foto dan sebagainya.\n• Sertifikat magang.\n50\n07 Pedoman Penulisan Laporan Magang\n\nBARAT\nTH\nHARI LISTRIK NASIONAL\nPLN\nPL\nN\n08\nPENILAIAN\nMAGANG', '• LAMPIRAN 8: Form Persetujuan Konversi Mata Kuliah\nLAMPIRAN 1\nKOP Departemen\nNo\n:....\nLampiran :\nPerihal :.\nKepada yth :\nDosen Wali Departemen ...\nFakultas...\nITS\nSehubungan dengan adanya permohonan konversi mata kuliah dari mahasiswa peserta magang dengan detail sebagai berikut :\nNama\nNRP\nNama Mitra Magang :\nPeriode magang\nMahasiswa yang bersangkutan akan/ telah *) melakukan magang dengan rincian tugas sebagai berikut :\nBerdasarkan hasil telaah dan analisa dengan bidang akademik departemen, maka mahasiswa yang bersangkutan berhak untuk mendapatkan konversi mata kuliah dan SKS, dimana konversi ini akan di lakukan pada semester..... tahun ajaran ....\n.......Adapun mata kuliah yang dapat dikonversikan dengan\nkegiatan magang adalah sebagai berikut :\nNo.\nMata Kuliah Konversi\nJumlah SKS\n\n\n\n\n\n\n\n\n\nTotal SKS\n\nSurabaya, ....\n*) dicoret\nKepala Departemen ....\n70\nLampiran\n\nSUBDIREKTORAT PENGEMBANGAN KEWIRAUSAHAAN DAN KARIR\nDIREKTORAT KEMAHASISWAAN\nINSTITUT TEKNOLOGI SEPULUH NOPEMBER\n2020', '....\nBerikut kami lampirkan Laporan Magang dan atau Rincian Kegiatan Magang.\nDemikian surat permohonan ini saya buat, atas perhatiannya saya sampaikan terima kasih.\nSurabaya,\nMahasiswa peserta magang\n*) dipilih salah satu\n68\nLampiran', '6. Jarak Spasi\n1 (satu)\n• SISTEMATIKA LAPORAN MAGANG\nCover Luar\nCover Dalam\nLembar Pengesahan\nKata Pengantar\nDaftar Isi\nDaftar Gambar\nDaftar Tabel\nBAB 1. PENDAHULUAN\n1.1. Latar Belakang\n1.2. Tujuan Magang\n1.3. Manfaat Magang\n1.4. Mahasiswa menguraikan tujuan penulisan topik magang.\nBAB 2. PENDAHULUAN\n2.1. Sejarah Mitra Magang\n2.2. Struktur Organisasi Mitra Magang\n2.3. Visi dan Misi Perusahaan\n2.4. Kegiatan Produksi (barang/jasa) (jika ada)\nBAB 3. PELAKSANAAN MAGANG\n3.1 Posisi / kedudukan kegiatan Magang\n3.2 Metodologi penyelesaian Tugas\n3.3 Pembelajaran Hal Baru\nBAB 4. KESIMPULAN DAN SARAN\nBAB 5. REFLEKSI DIRI\nLAMPIRAN\nBuku Petunjuk Teknis Magang\n47']",Saya tidak tahu.
1,Apa saja ketentuak mahasiswa dalam melaksanakan magang?,"1. Pelaksanaan Program Magang memiliki durasi minimal 1 bulan dan maksimal 6 bulan. 2. Selama Program Magang berlangsung, mahasiswa tidak harus mengajukan cuti. 3. Selama Program Magang berlangsung, mahasiswa secara penuh waktu bekerja di lapangan sesuai kesepakatan. 4. Mahasiswa bisa mendapatkan izin untuk melakukan kegiatan akademik tertentu, melalui pembicaraan dan kesepakatan dengan pihak Mitra Magang. 5. Mahasiswa dapat mengajukan konversi mata kuliah dengan Capaian Pembelajaran Mata Kuliah (CPMK) yang selaras dengan Program Magang. 6. Mahasiswa wajib dibimbing oleh pembimbing internal dari Dosen Departemen dan pembimbing lapangan dari Mitra Magang 7. Sebelum Program Magang berlangsung, mahasiswa, Departemen dan Mitra Magang wajib menandatangani perjanjian kerjasama dan nota kesepahaman.","['6.3\nKETENTUAN PEMBIMBINGAN MAGANG\nBAGI MAHASISWA\nMahasiswa harus melakukan pembimbingan sebelum dan saat pelaksanaan magang untuk memastikan pelaksanaan magang dan penulisan Laporan Magang dapat berjalan dengan baik.\nMahasiswa harus membuat Laporan Magang sesuai dengan pedoman penulisan Laporan Magang.\nMahasiswa menyerahkan Laporan Magang sesuai\ndengan jadwal atau kesepakatan dialokasikan oleh dosen pembimbing.\nMahasiswa harus memenuhi jumlah bimbingan minimal yang telah ditetapkan.\nMahasiswa harus memperhatikan etika berkomunikasi dan etika berperilaku dalam melakukan proses pembimbingan.\nBuku Petunjuk Teknis Magang\n41', '6.1\nKRITERIA DOSEN PEMBIMBING MAGANG\nW888\nDosen yang telah mengajar selama 4 semester berturut-turut.\nMemperoleh SK Pembimbing Magang dari Departemen dan ketetapan melalui\nKeputusan Dekan.\n6.2\nRINCIAN TUGAS DOSEN PEMBIMBING\nMAGANG\n• Memberikan saran dan masukan saat konsultasi keilmuan jika diperlukan oleh mahasiswa selama magang.\n• Melakukan kegiatan pembimbingan bagi mahasiswa magang untuk dapat berkonsultasi selama magang atau bimbingan penulisan laporan magang.\n• Memberikan persetujuan dan penilaian Laporan Magang.\n• Memberikan penilaian dapat dilakukan dalam bentuk penilaian laporan magang dan atau presentasi kegiatan magang.\n40\n06 Pembimbingan Magang', '• BAB 5. REFLEKSI DIRI\n• Mahasiswa mendeskripsikan tentang hal-hal positif yang diterima selama perkuliahan yang bermanfaat / relevan terhadap pekerjaan selama magang.\n• Mahasiswa menjelaskan tentang manfaat magang terhadap pengembangan soft-skills dan kekurangan soft-skills yang dimilikinya.\n• Mahasiswa memberikan penjabaran tentang manfaat magang terhadap pengembangan kemampuan kognitif dan kekurangan kemampuan kognitif yang dimilikinya.\nBuku Petunjuk Teknis Magang\n49', '• Mahasiswa menguraikan sejarah mitra magang secara umum serta spesifik (unit / divisi terkait) yang menjadi konteks dari topik yang dipilih.\n2.2. Struktur Organisasi Mitra Magang\n• Mahasiswa dapat menjelaskan struktur organisasi Mitra Magang secara umum yaitu dapat mencakup struktur organisasi, proses bisnis, ketentuan/peraturan terkait, dan sejenisnya.\n2.3. Visi dan Misi Perusahaan\n• Mahasiswa dapat menjelaskan Visi Misi Mitra Magang secara umum\n2.4. Kegiatan Produksi (barang/jasa) (jika ada)\n• Mahasiswa dapat menjelaskan proses penciptaan nilai untuk pemangku\n48\n07 Pedoman Penulisan Laporan Magang']","Mahasiswa harus melakukan pembimbingan sebelum dan saat pelaksanaan magang untuk memastikan pelaksanaan magang dan penulisan Laporan Magang dapat berjalan dengan baik. Mahasiswa harus membuat Laporan Magang sesuai dengan pedoman penulisan Laporan Magang. Mahasiswa menyerahkan Laporan Magang sesuai dengan jadwal atau kesepakatan yang dialokasikan oleh dosen pembimbing. Mahasiswa harus memenuhi jumlah bimbingan minimal yang telah ditetapkan. Selain itu, mahasiswa juga harus memperhatikan etika berkomunikasi dan etika berperilaku dalam melakukan proses pembimbingan."
2,Apa  Manfaat Program Magang bagi Mahasiswa,• Sarana mengaplikasikan ilmu di dalam kelas perkuliahan ke dunia kerja. • Sarana mengetahui dan mempelajari proses industri. • Berinteraksi langsung dengan mitra magang. • Sarana memperoleh bahan tugas akhir. • Menyelesaikan SKS mata kuliah.,"['• BAB 5. REFLEKSI DIRI\n• Mahasiswa mendeskripsikan tentang hal-hal positif yang diterima selama perkuliahan yang bermanfaat / relevan terhadap pekerjaan selama magang.\n• Mahasiswa menjelaskan tentang manfaat magang terhadap pengembangan soft-skills dan kekurangan soft-skills yang dimilikinya.\n• Mahasiswa memberikan penjabaran tentang manfaat magang terhadap pengembangan kemampuan kognitif dan kekurangan kemampuan kognitif yang dimilikinya.\nBuku Petunjuk Teknis Magang\n49', 'kepentingan yang dilakukan oleh organisasi tersebut (misalnya melalui produk atau jasa yang dihasilkan).\n• BAB 3. PELAKSANAAN MAGANG\n3.1. Posisi / Kedudukan Kegiatan Magang\n• Mahasiswa dapat menguraikan kedudukan / posisi kegiatan yang ditugaskan oleh mitra magang dalam lingkup pekerjaan / proyek keseluruhan. Hal ini dimaksudkan untuk mengetahui apakah mahasiswa memahami kaitan antara apa yang telah dilakukan / dihasilkan dengan pekerjaan tersebut.\n3.2. Metodologi penyelesaian Tugas\n• Mahasiswa menguraikan kasus / masalah menjadi topik pembahasan. Mahasiswa menganalisis kasus / masalah tersebut dengan menggunakan teori atau metode yang relevan. Analisis bukan mendeskripsikan teori, namun menggunakan teori guna menjelaskan dan membandingkan dengan kasus/masalah yang diangkat.\nUraian mengenai teori atau metode harus menyebutkan referensi yang valid dan handal.\n3.3. Pembelajaran Hal Baru', 'Uraian mengenai teori atau metode harus menyebutkan referensi yang valid dan handal.\n3.3. Pembelajaran Hal Baru\n• Mahasiswa dapat menguraikan temuan-temuan terkait pembelajaran hal baru yang dapat selama magang. Mahasiswa juga dapat membandingkan kegiatan magang yang dilaksanakan / ditemukan dengan teori atau konsep yang telah dipelajari. Mahasiswa juga dapat menyampaikan kendala yang dihadapi selama\nmagang.\n• BAB 4. KESIMPULAN DAN SARAN\nKesimpulan berisi ringkasan terhadap keseluruhan laporan, termasuk pembelajar-an apa yang didapat selama magang. Saran atau rekomendasi merupakan bahan masukan bagi mitra magang yang telah dijadikan lokasi Magang, maupun bagi mahasiswa angkatan berikutnya dalam menentukan spesifikasi dalam program Magang.\n• BAB 5. REFLEKSI DIRI\n• Mahasiswa mendeskripsikan tentang hal-hal positif yang diterima selama perkuliahan yang bermanfaat / relevan terhadap pekerjaan selama magang.', '• Mahasiswa menguraikan sejarah mitra magang secara umum serta spesifik (unit / divisi terkait) yang menjadi konteks dari topik yang dipilih.\n2.2. Struktur Organisasi Mitra Magang\n• Mahasiswa dapat menjelaskan struktur organisasi Mitra Magang secara umum yaitu dapat mencakup struktur organisasi, proses bisnis, ketentuan/peraturan terkait, dan sejenisnya.\n2.3. Visi dan Misi Perusahaan\n• Mahasiswa dapat menjelaskan Visi Misi Mitra Magang secara umum\n2.4. Kegiatan Produksi (barang/jasa) (jika ada)\n• Mahasiswa dapat menjelaskan proses penciptaan nilai untuk pemangku\n48\n07 Pedoman Penulisan Laporan Magang']","Program magang memiliki berbagai manfaat bagi mahasiswa, antara lain:

1. Pengembangan soft-skills: Melalui program magang, mahasiswa dapat mengembangkan berbagai soft-skills seperti kemampuan komunikasi, kerja tim, kepemimpinan, dan adaptabilitas. Hal ini akan membantu mahasiswa dalam berinteraksi di lingkungan kerja di masa depan.

2. Pengembangan kemampuan kognitif: Selain soft-skills, program magang juga membantu mahasiswa dalam mengembangkan kemampuan kognitif seperti analisis, pemecahan masalah, dan pemahaman konsep-konsep teori yang telah dipelajari di bangku kuliah.

3. Pembelajaran hal baru: Selama magang, mahasiswa memiliki kesempatan untuk belajar hal-hal baru yang mungkin tidak diajarkan di kelas. Mereka dapat membandingkan teori yang dipelajari dengan praktik di lapangan, sehingga memperdalam pemahaman mereka.

4. Refleksi diri: Program magang juga memberikan kesempatan bagi mahasiswa untuk merenungkan hal-hal positif yang diterima selama perkuliahan yang relevan dengan pekerjaan yang mereka lakukan selama magang. Hal ini membantu mahasiswa untuk mengidentifikasi kelebihan dan kekurangan mereka.

Dengan demikian, program magang tidak hanya memberikan pengalaman kerja praktis, tetapi juga berkontribusi dalam pengembangan diri mahasiswa secara menyeluruh."
3,Berapa perhitugan 1 sks magang dalam jam kerja?,setara dengan kerja 45 jam,"['Beberapa ketentuan yang perlu diperhatikan khususnya oleh mahasiswa peserta magang dalam merencanakan dan melaksanakan ujian presentasi Laporan Magang sebagai berikut:\n• Ujian Presentasi Laporan Magang dilaksanakan oleh mahasiswa yang telah menyelesaikan penyusunan karya akhir Laporan Magang yang sudah disetujui oleh pembimbing magang.\n• Ujian Presentasi Magang dilaksanakan setelah berkas penilaian kinerja magang sudah diisi oleh unit tempat magang dan sudah diterima oleh program studi.\n• Ujian Presentasi Magang akan dilakukan di ruang ujian Sidang atau di ruang kelas.\n• Untuk dapat mengikuti Ujian Presentasi Magang, mahasiswa harus mengajukan Permohonan Ujian Presentasi Magang sesuai jadwal yang ditetapkan oleh Program Studi.\n• Ujian Presentasi Magang akan diuji oleh 3 (tiga) orang dosen penguji, salah satunya dosen pembimbing magang dan berlangsung sekitar 1,5 jam termasuk sesi untuk tanya jawab.', '6.1\nKRITERIA DOSEN PEMBIMBING MAGANG\nW888\nDosen yang telah mengajar selama 4 semester berturut-turut.\nMemperoleh SK Pembimbing Magang dari Departemen dan ketetapan melalui\nKeputusan Dekan.\n6.2\nRINCIAN TUGAS DOSEN PEMBIMBING\nMAGANG\n• Memberikan saran dan masukan saat konsultasi keilmuan jika diperlukan oleh mahasiswa selama magang.\n• Melakukan kegiatan pembimbingan bagi mahasiswa magang untuk dapat berkonsultasi selama magang atau bimbingan penulisan laporan magang.\n• Memberikan persetujuan dan penilaian Laporan Magang.\n• Memberikan penilaian dapat dilakukan dalam bentuk penilaian laporan magang dan atau presentasi kegiatan magang.\n40\n06 Pembimbingan Magang', '• Ujian Presentasi Magang akan diuji oleh 3 (tiga) orang dosen penguji, salah satunya dosen pembimbing magang dan berlangsung sekitar 1,5 jam termasuk sesi untuk tanya jawab.\n• Dalam melakukan presentasi, mahasiswa peserta magang harus menyiapkan bahan presentasi sebanyak 10 slides (minimum) sampai dengan 20 slides (maksimum).\nJumlah tersebut untuk memaparkan hasil-hasil magang dan tidak termasuk lampiran tabel, gambar, perhitungan, dan sebagainya.\n• Setelah presentasi Laporan Magang, dosen pembimbing dan dosen lain yang ditunjuk (tim penguji) mengajukan pertanyaan yang bersifat komprehensif.\n• Pertanyaan yang bersifat komprehensif adalah pertanyaan-pertanyaan yang terkait dengan Laporan Magang dan teori terkait topik yang diangkat dalam Laporan Magang.\n56\n08 Penilaian Magang', '6.3\nKETENTUAN PEMBIMBINGAN MAGANG\nBAGI MAHASISWA\nMahasiswa harus melakukan pembimbingan sebelum dan saat pelaksanaan magang untuk memastikan pelaksanaan magang dan penulisan Laporan Magang dapat berjalan dengan baik.\nMahasiswa harus membuat Laporan Magang sesuai dengan pedoman penulisan Laporan Magang.\nMahasiswa menyerahkan Laporan Magang sesuai\ndengan jadwal atau kesepakatan dialokasikan oleh dosen pembimbing.\nMahasiswa harus memenuhi jumlah bimbingan minimal yang telah ditetapkan.\nMahasiswa harus memperhatikan etika berkomunikasi dan etika berperilaku dalam melakukan proses pembimbingan.\nBuku Petunjuk Teknis Magang\n41']",Saya tidak tahu.
4,Bagaimana Proses pengajuan konversi kegiatan magang dengan MK yang setara CPMK-nya?,"• Subdirektorat PK2 akan menyampaikan rencana kegiatan selama magang yang diterima dari mitra magang kepada departemen dimana mahasiswa magang berasal. • Departemen akan melakukan verifikasi dan validasi untuk menilai mata kuliah apa saja yang CPMK-nya selaras dengan kegiatan magang berdasarkan rencana kegiatan magang dan akan berdiskusi dengan mitra magang jika diperlukan untuk mendapat-kan penjelasan lebih detail. • Departemen akan menyampaikan ke mahasiswa hasil verifikasi berupa daftar MK yang dapat dikonversikan dengan kegiatan magang. • Mahasiswa harus mengisi FRS dengan Mata Kuliah yang akan dikonversikan dengan Kegiatan Magang pada semester yang sama, atau mahasiswa bersama dosen wali akan melakukan revisi paling lambat minggu ke 4 perkuliahan jika jadwal FRS sudah terlampaui.","['6.1\nKRITERIA DOSEN PEMBIMBING MAGANG\nW888\nDosen yang telah mengajar selama 4 semester berturut-turut.\nMemperoleh SK Pembimbing Magang dari Departemen dan ketetapan melalui\nKeputusan Dekan.\n6.2\nRINCIAN TUGAS DOSEN PEMBIMBING\nMAGANG\n• Memberikan saran dan masukan saat konsultasi keilmuan jika diperlukan oleh mahasiswa selama magang.\n• Melakukan kegiatan pembimbingan bagi mahasiswa magang untuk dapat berkonsultasi selama magang atau bimbingan penulisan laporan magang.\n• Memberikan persetujuan dan penilaian Laporan Magang.\n• Memberikan penilaian dapat dilakukan dalam bentuk penilaian laporan magang dan atau presentasi kegiatan magang.\n40\n06 Pembimbingan Magang', '• LAMPIRAN 8: Form Persetujuan Konversi Mata Kuliah\nLAMPIRAN 1\nKOP Departemen\nNo\n:....\nLampiran :\nPerihal :.\nKepada yth :\nDosen Wali Departemen ...\nFakultas...\nITS\nSehubungan dengan adanya permohonan konversi mata kuliah dari mahasiswa peserta magang dengan detail sebagai berikut :\nNama\nNRP\nNama Mitra Magang :\nPeriode magang\nMahasiswa yang bersangkutan akan/ telah *) melakukan magang dengan rincian tugas sebagai berikut :\nBerdasarkan hasil telaah dan analisa dengan bidang akademik departemen, maka mahasiswa yang bersangkutan berhak untuk mendapatkan konversi mata kuliah dan SKS, dimana konversi ini akan di lakukan pada semester..... tahun ajaran ....\n.......Adapun mata kuliah yang dapat dikonversikan dengan\nkegiatan magang adalah sebagai berikut :\nNo.\nMata Kuliah Konversi\nJumlah SKS\n\n\n\n\n\n\n\n\n\nTotal SKS\n\nSurabaya, ....\n*) dicoret\nKepala Departemen ....\n70\nLampiran\n\nSUBDIREKTORAT PENGEMBANGAN KEWIRAUSAHAAN DAN KARIR\nDIREKTORAT KEMAHASISWAAN\nINSTITUT TEKNOLOGI SEPULUH NOPEMBER\n2020', '6.3\nKETENTUAN PEMBIMBINGAN MAGANG\nBAGI MAHASISWA\nMahasiswa harus melakukan pembimbingan sebelum dan saat pelaksanaan magang untuk memastikan pelaksanaan magang dan penulisan Laporan Magang dapat berjalan dengan baik.\nMahasiswa harus membuat Laporan Magang sesuai dengan pedoman penulisan Laporan Magang.\nMahasiswa menyerahkan Laporan Magang sesuai\ndengan jadwal atau kesepakatan dialokasikan oleh dosen pembimbing.\nMahasiswa harus memenuhi jumlah bimbingan minimal yang telah ditetapkan.\nMahasiswa harus memperhatikan etika berkomunikasi dan etika berperilaku dalam melakukan proses pembimbingan.\nBuku Petunjuk Teknis Magang\n41', '• LAMPIRAN 6: Form Pengajuan Konversi Mata Kuliah\nNomor ........(NRP Mahasiswa)/(Semester)/2020\nLampiran : 1 (satu eks) laporan Magang/ Rincian Tugas Kegiatan magang\nPerihal : Surat Permohonan Konversi Magang\n(Tanggal Surat)\nKepada Yth\n: Kepala Departemen (Nama Departemen)\ndi ITS\nDengan hormat,\nSehubungan dengan pelaksanaan kegiatan Magang, saya yang bertanda tangan di bawah ini:\nNama Mahasiswa\nNRP\nDepartemen\nNo HP\nAlamat email\nmengajukan permohonan konversi Mata Kuliah untuk kegiatan Magang (Judul Kegiatan Magang) di (Perusahaan Tempat Magang) yang sedang/telah*) dilakukan pada .......d.......\n.... Adapun\ndetail mitra magang sebagai berikut :\nNama Perusahaan Tempat Magang\nAlamat Perusahaan Tempat\nMagang\nNo Telp Perusahaan Tempat\nMagang\nEmail perusahan\nNama Pembimbing Lapangan\nNo HP Pembimbing Lapangan\n....\nBerikut kami lampirkan Laporan Magang dan atau Rincian Kegiatan Magang.\nDemikian surat permohonan ini saya buat, atas perhatiannya saya sampaikan terima kasih.\nSurabaya,']","Proses pengajuan konversi kegiatan magang dengan Mata Kuliah (MK) yang setara CPMK-nya dimulai dengan mahasiswa yang sedang atau telah melakukan magang mengajukan permohonan konversi Mata Kuliah kepada Kepala Departemen yang bersangkutan di Institut Teknologi Sepuluh Nopember (ITS). Dalam surat permohonan tersebut, mahasiswa harus mencantumkan detail mitra magang seperti nama perusahaan tempat magang, alamat perusahaan tempat magang, nomor telepon perusahaan tempat magang, email perusahaan, nama pembimbing lapangan, dan nomor HP pembimbing lapangan. Selain itu, mahasiswa juga harus melampirkan Laporan Magang dan/atau Rincian Kegiatan Magang.

Setelah itu, hasil telaah dan analisa dengan bidang akademik departemen akan menentukan apakah mahasiswa berhak untuk mendapatkan konversi mata kuliah dan SKS. Jika mahasiswa dinyatakan berhak, konversi ini akan dilakukan pada semester tertentu dalam tahun ajaran yang bersangkutan. Mata kuliah yang dapat dikonversikan dengan kegiatan magang akan ditentukan berdasarkan keputusan departemen.

Demikianlah proses pengajuan konversi kegiatan magang dengan MK yang setara CPMK-nya di ITS."
5,Bagaimana SOP konversi mata kuliah untuk magang mandiri?,Melaporkan kegiatan magang Mengupdate data magang Mengajukan permohonan konversi MK Melakukan telaah dan verifikasi bersama tim akademik departemen Menerima hasil telaah MK yang dikonversikan dengan Magang Melakukan FRS / Perubahan FRS Dosen wali mengetahui dan menyetujui FRS / Perubahan FRS di semester yang sama / di semester depan,"['• LAMPIRAN 8: Form Persetujuan Konversi Mata Kuliah\nLAMPIRAN 1\nKOP Departemen\nNo\n:....\nLampiran :\nPerihal :.\nKepada yth :\nDosen Wali Departemen ...\nFakultas...\nITS\nSehubungan dengan adanya permohonan konversi mata kuliah dari mahasiswa peserta magang dengan detail sebagai berikut :\nNama\nNRP\nNama Mitra Magang :\nPeriode magang\nMahasiswa yang bersangkutan akan/ telah *) melakukan magang dengan rincian tugas sebagai berikut :\nBerdasarkan hasil telaah dan analisa dengan bidang akademik departemen, maka mahasiswa yang bersangkutan berhak untuk mendapatkan konversi mata kuliah dan SKS, dimana konversi ini akan di lakukan pada semester..... tahun ajaran ....\n.......Adapun mata kuliah yang dapat dikonversikan dengan\nkegiatan magang adalah sebagai berikut :\nNo.\nMata Kuliah Konversi\nJumlah SKS\n\n\n\n\n\n\n\n\n\nTotal SKS\n\nSurabaya, ....\n*) dicoret\nKepala Departemen ....\n70\nLampiran\n\nSUBDIREKTORAT PENGEMBANGAN KEWIRAUSAHAAN DAN KARIR\nDIREKTORAT KEMAHASISWAAN\nINSTITUT TEKNOLOGI SEPULUH NOPEMBER\n2020', '6.1\nKRITERIA DOSEN PEMBIMBING MAGANG\nW888\nDosen yang telah mengajar selama 4 semester berturut-turut.\nMemperoleh SK Pembimbing Magang dari Departemen dan ketetapan melalui\nKeputusan Dekan.\n6.2\nRINCIAN TUGAS DOSEN PEMBIMBING\nMAGANG\n• Memberikan saran dan masukan saat konsultasi keilmuan jika diperlukan oleh mahasiswa selama magang.\n• Melakukan kegiatan pembimbingan bagi mahasiswa magang untuk dapat berkonsultasi selama magang atau bimbingan penulisan laporan magang.\n• Memberikan persetujuan dan penilaian Laporan Magang.\n• Memberikan penilaian dapat dilakukan dalam bentuk penilaian laporan magang dan atau presentasi kegiatan magang.\n40\n06 Pembimbingan Magang', '• Mahasiswa menguraikan sejarah mitra magang secara umum serta spesifik (unit / divisi terkait) yang menjadi konteks dari topik yang dipilih.\n2.2. Struktur Organisasi Mitra Magang\n• Mahasiswa dapat menjelaskan struktur organisasi Mitra Magang secara umum yaitu dapat mencakup struktur organisasi, proses bisnis, ketentuan/peraturan terkait, dan sejenisnya.\n2.3. Visi dan Misi Perusahaan\n• Mahasiswa dapat menjelaskan Visi Misi Mitra Magang secara umum\n2.4. Kegiatan Produksi (barang/jasa) (jika ada)\n• Mahasiswa dapat menjelaskan proses penciptaan nilai untuk pemangku\n48\n07 Pedoman Penulisan Laporan Magang', '6.3\nKETENTUAN PEMBIMBINGAN MAGANG\nBAGI MAHASISWA\nMahasiswa harus melakukan pembimbingan sebelum dan saat pelaksanaan magang untuk memastikan pelaksanaan magang dan penulisan Laporan Magang dapat berjalan dengan baik.\nMahasiswa harus membuat Laporan Magang sesuai dengan pedoman penulisan Laporan Magang.\nMahasiswa menyerahkan Laporan Magang sesuai\ndengan jadwal atau kesepakatan dialokasikan oleh dosen pembimbing.\nMahasiswa harus memenuhi jumlah bimbingan minimal yang telah ditetapkan.\nMahasiswa harus memperhatikan etika berkomunikasi dan etika berperilaku dalam melakukan proses pembimbingan.\nBuku Petunjuk Teknis Magang\n41']","SOP konversi mata kuliah untuk magang mandiri melibatkan beberapa langkah, antara lain:
1. Mahasiswa melakukan magang mandiri di mitra magang yang telah disetujui oleh departemen.
2. Mahasiswa harus menyelesaikan periode magang sesuai dengan yang telah ditentukan.
3. Setelah selesai magang, mahasiswa harus menyusun laporan magang yang sesuai dengan pedoman penulisan yang telah ditetapkan.
4. Dosen pembimbing magang akan memberikan persetujuan dan penilaian terhadap laporan magang yang telah disusun oleh mahasiswa.
5. Berdasarkan hasil telaah dan analisa dengan bidang akademik departemen, mahasiswa berhak untuk mendapatkan konversi mata kuliah dan SKS.
6. Konversi mata kuliah akan dilakukan pada semester tertentu sesuai dengan keputusan departemen.
7. Mata kuliah yang dapat dikonversikan dengan kegiatan magang akan ditentukan berdasarkan hasil telaah dan analisa departemen.

Itulah beberapa langkah dalam SOP konversi mata kuliah untuk magang mandiri."
6,Apa itu Program Magang Mahasiswa Bersertifikat (PMMB) ?,Program Magang Mahasiswa Bersertifikat (PMMB) merupakan program magang yang bekerjasama dengan Forum Human Capital Indonesia (FHCI).,"['6.1\nKRITERIA DOSEN PEMBIMBING MAGANG\nW888\nDosen yang telah mengajar selama 4 semester berturut-turut.\nMemperoleh SK Pembimbing Magang dari Departemen dan ketetapan melalui\nKeputusan Dekan.\n6.2\nRINCIAN TUGAS DOSEN PEMBIMBING\nMAGANG\n• Memberikan saran dan masukan saat konsultasi keilmuan jika diperlukan oleh mahasiswa selama magang.\n• Melakukan kegiatan pembimbingan bagi mahasiswa magang untuk dapat berkonsultasi selama magang atau bimbingan penulisan laporan magang.\n• Memberikan persetujuan dan penilaian Laporan Magang.\n• Memberikan penilaian dapat dilakukan dalam bentuk penilaian laporan magang dan atau presentasi kegiatan magang.\n40\n06 Pembimbingan Magang', '• LAMPIRAN 8: Form Persetujuan Konversi Mata Kuliah\nLAMPIRAN 1\nKOP Departemen\nNo\n:....\nLampiran :\nPerihal :.\nKepada yth :\nDosen Wali Departemen ...\nFakultas...\nITS\nSehubungan dengan adanya permohonan konversi mata kuliah dari mahasiswa peserta magang dengan detail sebagai berikut :\nNama\nNRP\nNama Mitra Magang :\nPeriode magang\nMahasiswa yang bersangkutan akan/ telah *) melakukan magang dengan rincian tugas sebagai berikut :\nBerdasarkan hasil telaah dan analisa dengan bidang akademik departemen, maka mahasiswa yang bersangkutan berhak untuk mendapatkan konversi mata kuliah dan SKS, dimana konversi ini akan di lakukan pada semester..... tahun ajaran ....\n.......Adapun mata kuliah yang dapat dikonversikan dengan\nkegiatan magang adalah sebagai berikut :\nNo.\nMata Kuliah Konversi\nJumlah SKS\n\n\n\n\n\n\n\n\n\nTotal SKS\n\nSurabaya, ....\n*) dicoret\nKepala Departemen ....\n70\nLampiran\n\nSUBDIREKTORAT PENGEMBANGAN KEWIRAUSAHAAN DAN KARIR\nDIREKTORAT KEMAHASISWAAN\nINSTITUT TEKNOLOGI SEPULUH NOPEMBER\n2020', 'Beberapa ketentuan yang perlu diperhatikan khususnya oleh mahasiswa peserta magang dalam merencanakan dan melaksanakan ujian presentasi Laporan Magang sebagai berikut:\n• Ujian Presentasi Laporan Magang dilaksanakan oleh mahasiswa yang telah menyelesaikan penyusunan karya akhir Laporan Magang yang sudah disetujui oleh pembimbing magang.\n• Ujian Presentasi Magang dilaksanakan setelah berkas penilaian kinerja magang sudah diisi oleh unit tempat magang dan sudah diterima oleh program studi.\n• Ujian Presentasi Magang akan dilakukan di ruang ujian Sidang atau di ruang kelas.\n• Untuk dapat mengikuti Ujian Presentasi Magang, mahasiswa harus mengajukan Permohonan Ujian Presentasi Magang sesuai jadwal yang ditetapkan oleh Program Studi.\n• Ujian Presentasi Magang akan diuji oleh 3 (tiga) orang dosen penguji, salah satunya dosen pembimbing magang dan berlangsung sekitar 1,5 jam termasuk sesi untuk tanya jawab.', '• LAMPIRAN 6: Form Pengajuan Konversi Mata Kuliah\nNomor ........(NRP Mahasiswa)/(Semester)/2020\nLampiran : 1 (satu eks) laporan Magang/ Rincian Tugas Kegiatan magang\nPerihal : Surat Permohonan Konversi Magang\n(Tanggal Surat)\nKepada Yth\n: Kepala Departemen (Nama Departemen)\ndi ITS\nDengan hormat,\nSehubungan dengan pelaksanaan kegiatan Magang, saya yang bertanda tangan di bawah ini:\nNama Mahasiswa\nNRP\nDepartemen\nNo HP\nAlamat email\nmengajukan permohonan konversi Mata Kuliah untuk kegiatan Magang (Judul Kegiatan Magang) di (Perusahaan Tempat Magang) yang sedang/telah*) dilakukan pada .......d.......\n.... Adapun\ndetail mitra magang sebagai berikut :\nNama Perusahaan Tempat Magang\nAlamat Perusahaan Tempat\nMagang\nNo Telp Perusahaan Tempat\nMagang\nEmail perusahan\nNama Pembimbing Lapangan\nNo HP Pembimbing Lapangan\n....\nBerikut kami lampirkan Laporan Magang dan atau Rincian Kegiatan Magang.\nDemikian surat permohonan ini saya buat, atas perhatiannya saya sampaikan terima kasih.\nSurabaya,']","Program Magang Mahasiswa Bersertifikat (PMMB) adalah program magang yang ditujukan untuk mahasiswa yang ingin mendapatkan pengalaman kerja di dunia industri. Dalam program ini, mahasiswa akan melakukan magang di perusahaan atau lembaga tertentu selama periode tertentu sesuai dengan ketentuan yang berlaku. Selama magang, mahasiswa akan dibimbing oleh seorang dosen pembimbing magang yang telah memenuhi kriteria tertentu, seperti telah mengajar selama 4 semester berturut-turut dan memiliki SK Pembimbing Magang dari Departemen serta ketetapan melalui Keputusan Dekan. Dosen pembimbing magang memiliki tugas-tugas seperti memberikan saran dan masukan saat konsultasi keilmuan, melakukan kegiatan pembimbingan bagi mahasiswa magang, memberikan persetujuan dan penilaian terhadap Laporan Magang, serta memberikan penilaian dalam bentuk penilaian laporan magang dan/atau presentasi kegiatan magang. Setelah menyelesaikan magang, mahasiswa akan mengikuti ujian presentasi Laporan Magang yang dilaksanakan oleh 3 orang dosen penguji, salah satunya adalah dosen pembimbing magang."
7,"Apa peran Subdirektorat Pengembangan Kewirausahaan dan
Karir (PK2) dalam penyelenggaraan Program Magang?",1. Sebagai koordinator dalam penyelenggaraan Program Magang. 2. Menyusun kebijakan terkait magang untuk memfasilitasi kegiatan pembelajaran akademik dan Program Magang. 3. Mengkoordinasikan penyusunan Perjanjian Kerja Sama (PKS) dengan Mitra Magang. 4. Menginisiasi kerjasama magang dengan mitra magang,"['kepentingan yang dilakukan oleh organisasi tersebut (misalnya melalui produk atau jasa yang dihasilkan).\n• BAB 3. PELAKSANAAN MAGANG\n3.1. Posisi / Kedudukan Kegiatan Magang\n• Mahasiswa dapat menguraikan kedudukan / posisi kegiatan yang ditugaskan oleh mitra magang dalam lingkup pekerjaan / proyek keseluruhan. Hal ini dimaksudkan untuk mengetahui apakah mahasiswa memahami kaitan antara apa yang telah dilakukan / dihasilkan dengan pekerjaan tersebut.\n3.2. Metodologi penyelesaian Tugas\n• Mahasiswa menguraikan kasus / masalah menjadi topik pembahasan. Mahasiswa menganalisis kasus / masalah tersebut dengan menggunakan teori atau metode yang relevan. Analisis bukan mendeskripsikan teori, namun menggunakan teori guna menjelaskan dan membandingkan dengan kasus/masalah yang diangkat.\nUraian mengenai teori atau metode harus menyebutkan referensi yang valid dan handal.\n3.3. Pembelajaran Hal Baru', '• Mahasiswa menguraikan sejarah mitra magang secara umum serta spesifik (unit / divisi terkait) yang menjadi konteks dari topik yang dipilih.\n2.2. Struktur Organisasi Mitra Magang\n• Mahasiswa dapat menjelaskan struktur organisasi Mitra Magang secara umum yaitu dapat mencakup struktur organisasi, proses bisnis, ketentuan/peraturan terkait, dan sejenisnya.\n2.3. Visi dan Misi Perusahaan\n• Mahasiswa dapat menjelaskan Visi Misi Mitra Magang secara umum\n2.4. Kegiatan Produksi (barang/jasa) (jika ada)\n• Mahasiswa dapat menjelaskan proses penciptaan nilai untuk pemangku\n48\n07 Pedoman Penulisan Laporan Magang', '6.1\nKRITERIA DOSEN PEMBIMBING MAGANG\nW888\nDosen yang telah mengajar selama 4 semester berturut-turut.\nMemperoleh SK Pembimbing Magang dari Departemen dan ketetapan melalui\nKeputusan Dekan.\n6.2\nRINCIAN TUGAS DOSEN PEMBIMBING\nMAGANG\n• Memberikan saran dan masukan saat konsultasi keilmuan jika diperlukan oleh mahasiswa selama magang.\n• Melakukan kegiatan pembimbingan bagi mahasiswa magang untuk dapat berkonsultasi selama magang atau bimbingan penulisan laporan magang.\n• Memberikan persetujuan dan penilaian Laporan Magang.\n• Memberikan penilaian dapat dilakukan dalam bentuk penilaian laporan magang dan atau presentasi kegiatan magang.\n40\n06 Pembimbingan Magang', 'Inisiatif\nKemampuan komunikasi (lisan dan tulisan)\nDisiplin\nPenampilan\nKetekunan\nKemampuan teknikal\nBerpikir kritis, kreatif dan analitis\nKemampuan bekerjasama\ndalam tim Kemampuan\nberadaptasi\n凸\nHasil pekerjaan (kontribusi)\nSedangkan mekanisme pengiriman formulir penilaian magang dari unit tempat magang adalah sebagai berikut:\nこと\nFormulir kosong serta amplop balasan yang sudah bertuliskan alamat Departemen disampaikan oleh mahasiswa magang kepada atasan yang berwenang.\nFormulir penilaian yang sudah terisi dimasukkan ke dalam amplop tertutup dan dikirim langsung ke Departemen.\nBuku Petunjuk Teknis Magang\n53\n\n8.3\nPENILAIAN PENULISAN LAPORAN\nMAGANG\nButir penilaian Laporan Magang mencakup aspek sebagai berikut:\n2. Tugas mahasiswa selama magang\ndijelaskan dengan baik dan relevan\nDeskripsi proses kegiatan\nmagang yang dilakukan\n1. Gambaran umum Mitra Magang\ndengan Departemen.\n\njelas.']",TANYABOT: Saya tidak tahu.
8,Bagaimana skema waktu pelaksanaan program magang?,Program Mahasiswa Magang Bersertifikat (PMMB) • Magang dilaksanakan maksimal 6 bulan • Magang dilaksanakan 2 periode dalam 1 tahun yaitu 1. Periode Febuari - Agustus 2. Periode September - Januari Program Mahasiswa Magang Kerjasama • Magang dilaksanakan sekurang-kurangnya 1 bulan maksimal 6 bulan • Magang dilaksanakan setiap saat sesuai dengan kesepakatan dengan Mitra Magang. Program Magang Mandiri • Magang dilaksanakan sekurang-kurangnya 1 bulan dan maksimal 6 bulan • Magang dilaksanakan setiap saat sesuai dengan kesepakatan dengan Mitra Magang.,"['6.3\nKETENTUAN PEMBIMBINGAN MAGANG\nBAGI MAHASISWA\nMahasiswa harus melakukan pembimbingan sebelum dan saat pelaksanaan magang untuk memastikan pelaksanaan magang dan penulisan Laporan Magang dapat berjalan dengan baik.\nMahasiswa harus membuat Laporan Magang sesuai dengan pedoman penulisan Laporan Magang.\nMahasiswa menyerahkan Laporan Magang sesuai\ndengan jadwal atau kesepakatan dialokasikan oleh dosen pembimbing.\nMahasiswa harus memenuhi jumlah bimbingan minimal yang telah ditetapkan.\nMahasiswa harus memperhatikan etika berkomunikasi dan etika berperilaku dalam melakukan proses pembimbingan.\nBuku Petunjuk Teknis Magang\n41', 'Beberapa ketentuan yang perlu diperhatikan khususnya oleh mahasiswa peserta magang dalam merencanakan dan melaksanakan ujian presentasi Laporan Magang sebagai berikut:\n• Ujian Presentasi Laporan Magang dilaksanakan oleh mahasiswa yang telah menyelesaikan penyusunan karya akhir Laporan Magang yang sudah disetujui oleh pembimbing magang.\n• Ujian Presentasi Magang dilaksanakan setelah berkas penilaian kinerja magang sudah diisi oleh unit tempat magang dan sudah diterima oleh program studi.\n• Ujian Presentasi Magang akan dilakukan di ruang ujian Sidang atau di ruang kelas.\n• Untuk dapat mengikuti Ujian Presentasi Magang, mahasiswa harus mengajukan Permohonan Ujian Presentasi Magang sesuai jadwal yang ditetapkan oleh Program Studi.\n• Ujian Presentasi Magang akan diuji oleh 3 (tiga) orang dosen penguji, salah satunya dosen pembimbing magang dan berlangsung sekitar 1,5 jam termasuk sesi untuk tanya jawab.', '• Mahasiswa menguraikan sejarah mitra magang secara umum serta spesifik (unit / divisi terkait) yang menjadi konteks dari topik yang dipilih.\n2.2. Struktur Organisasi Mitra Magang\n• Mahasiswa dapat menjelaskan struktur organisasi Mitra Magang secara umum yaitu dapat mencakup struktur organisasi, proses bisnis, ketentuan/peraturan terkait, dan sejenisnya.\n2.3. Visi dan Misi Perusahaan\n• Mahasiswa dapat menjelaskan Visi Misi Mitra Magang secara umum\n2.4. Kegiatan Produksi (barang/jasa) (jika ada)\n• Mahasiswa dapat menjelaskan proses penciptaan nilai untuk pemangku\n48\n07 Pedoman Penulisan Laporan Magang', '• Mampu memilih dan mengorganisir data yang diperlukan.\n• Mampu mengamati dan menilai dengan jeli berbagai proses, peristiwa, manfaat dan kelemahan yang ada selama melakukan kegiatan Magang.\n7.4\nFORMAT DAN SISTEMATIKA LAPORAN\nMAGANG\n• FORMAT PENULISAN LAPORAN MAGANG\n1. Jenis dan Ukuran Kertas\nKertas HVS 70gram ukuran A5 (148 × 210 mm).\n2. Cover Laporan\n3. Lembar pengesahan dengan dasar polos berwarna putih\nPembimbing tempat magang tanda tangan terlebih dahulu.\n4. Jarak Tepi (margin)\n- Tepi Atas : 2,5 cm\n- Тері Bawah : 2,5 cm\n- Tepi Kiri: 2,5 cm\n- Tepi Kanan : 2,0 cm\n5. Jenis Huruf\nTimes New Roman, Normal, 12 pt (judul), 11 pt (isi)\n46\n07 Pedoman Penulisan Laporan Magang']","Skema waktu pelaksanaan program magang meliputi beberapa tahapan, yaitu:
1. Mahasiswa harus melakukan pembimbingan sebelum dan saat pelaksanaan magang untuk memastikan pelaksanaan magang dan penulisan Laporan Magang dapat berjalan dengan baik.
2. Mahasiswa harus membuat Laporan Magang sesuai dengan pedoman penulisan Laporan Magang.
3. Mahasiswa menyerahkan Laporan Magang sesuai dengan jadwal atau kesepakatan yang dialokasikan oleh dosen pembimbing.
4. Mahasiswa harus memenuhi jumlah bimbingan minimal yang telah ditetapkan.
5. Mahasiswa harus memperhatikan etika berkomunikasi dan etika berperilaku dalam melakukan proses pembimbingan.
6. Ujian Presentasi Laporan Magang dilaksanakan setelah berkas penilaian kinerja magang sudah diisi oleh unit tempat magang dan sudah diterima oleh program studi.
7. Ujian Presentasi Magang akan dilakukan di ruang ujian Sidang atau di ruang kelas.
8. Untuk dapat mengikuti Ujian Presentasi Magang, mahasiswa harus mengajukan Permohonan Ujian Presentasi Magang sesuai jadwal yang ditetapkan oleh Program Studi.
9. Ujian Presentasi Magang akan diuji oleh 3 (tiga) orang dosen penguji, salah satunya dosen pembimbing magang dan berlangsung sekitar 1,5 jam termasuk sesi untuk tanya jawab."
9,Apa saja rincian tugas dosen pembimbing magang?,• Memberikan saran dan masukan saat konsultasi keilmuan jika diperlukan oleh mahasiswa selama magang. • Melakukan kegiatan pembimbingan bagi mahasiswa magang untuk dapat berkonsultasi selama magang atau bimbingan penulisan laporan magang. • Memberikan persetujuan dan penilaian Laporan Magang. • Memberikan penilaian dapat dilakukan dalam bentuk penilaian laporan magang dan atau presentasi kegiatan magang.,"['6.4\nKETENTUAN PEMBIMBINGAN MAGANG\nBAGI DOSEN\nA.Dosen pembimbing harus dapat memberikan masukan dan pengarahan tentang pelaksanaan magang dan penulisan Laporan Magang. Pemberian masukan dan arahan tersebut diantaranya mencakup namun tidak terbatas pada hal berikut:\n• Memberikan masukan, arahan, dan mendiskusikan rumusan permasalahan dan tujuan atau topik Laporan Magang.\n• Membuat rencana bimbingan bersama mahasiswa.\n• Mengarahkan mahasiswa dalam hal metode penulisan ilmiah dan metode analisis dalam Laporan Magang sesuai dengan pedoman penulisan Laporan Magang yang telah disepakati.\n• Mendiskusikan acuan materi keilmuan yang relevan dengan topik Laporan Magang.\n• Hadir dalam Sidang Magang dan memberikan penilaian akhir bagi Laporan\nMagang yang diujikan.\n• Memberikan arahan dalam penyelesaian revisi Laporan Magang.\nB. Dosen pembimbing harus memastikan bahwa Laporan Magang bebas dari plagiarisme.\n6.5\nPENGGANTIAN DOSEN PEMBIMBING\nMAGANG', '6.1\nKRITERIA DOSEN PEMBIMBING MAGANG\nW888\nDosen yang telah mengajar selama 4 semester berturut-turut.\nMemperoleh SK Pembimbing Magang dari Departemen dan ketetapan melalui\nKeputusan Dekan.\n6.2\nRINCIAN TUGAS DOSEN PEMBIMBING\nMAGANG\n• Memberikan saran dan masukan saat konsultasi keilmuan jika diperlukan oleh mahasiswa selama magang.\n• Melakukan kegiatan pembimbingan bagi mahasiswa magang untuk dapat berkonsultasi selama magang atau bimbingan penulisan laporan magang.\n• Memberikan persetujuan dan penilaian Laporan Magang.\n• Memberikan penilaian dapat dilakukan dalam bentuk penilaian laporan magang dan atau presentasi kegiatan magang.\n40\n06 Pembimbingan Magang', '6.3\nKETENTUAN PEMBIMBINGAN MAGANG\nBAGI MAHASISWA\nMahasiswa harus melakukan pembimbingan sebelum dan saat pelaksanaan magang untuk memastikan pelaksanaan magang dan penulisan Laporan Magang dapat berjalan dengan baik.\nMahasiswa harus membuat Laporan Magang sesuai dengan pedoman penulisan Laporan Magang.\nMahasiswa menyerahkan Laporan Magang sesuai\ndengan jadwal atau kesepakatan dialokasikan oleh dosen pembimbing.\nMahasiswa harus memenuhi jumlah bimbingan minimal yang telah ditetapkan.\nMahasiswa harus memperhatikan etika berkomunikasi dan etika berperilaku dalam melakukan proses pembimbingan.\nBuku Petunjuk Teknis Magang\n41', 'Uraian mengenai teori atau metode harus menyebutkan referensi yang valid dan handal.\n3.3. Pembelajaran Hal Baru\n• Mahasiswa dapat menguraikan temuan-temuan terkait pembelajaran hal baru yang dapat selama magang. Mahasiswa juga dapat membandingkan kegiatan magang yang dilaksanakan / ditemukan dengan teori atau konsep yang telah dipelajari. Mahasiswa juga dapat menyampaikan kendala yang dihadapi selama\nmagang.\n• BAB 4. KESIMPULAN DAN SARAN\nKesimpulan berisi ringkasan terhadap keseluruhan laporan, termasuk pembelajar-an apa yang didapat selama magang. Saran atau rekomendasi merupakan bahan masukan bagi mitra magang yang telah dijadikan lokasi Magang, maupun bagi mahasiswa angkatan berikutnya dalam menentukan spesifikasi dalam program Magang.\n• BAB 5. REFLEKSI DIRI\n• Mahasiswa mendeskripsikan tentang hal-hal positif yang diterima selama perkuliahan yang bermanfaat / relevan terhadap pekerjaan selama magang.']","Rincian tugas dosen pembimbing magang meliputi:
1. Memberikan saran dan masukan saat konsultasi keilmuan jika diperlukan oleh mahasiswa selama magang.
2. Melakukan kegiatan pembimbingan bagi mahasiswa magang untuk dapat berkonsultasi selama magang atau bimbingan penulisan laporan magang.
3. Memberikan persetujuan dan penilaian Laporan Magang.
4. Memberikan penilaian dapat dilakukan dalam bentuk penilaian laporan magang dan atau presentasi kegiatan magang."
10,Apa fungsi laporan magang?,"sebagai Pertanggungjawaban kegiatan Magang mahasiswa kepada Mitra Magang dan
Departemen.","['07\nPEDOMAN\nPENULISAN\nLAPORAN\nMAGANG\n\n07\nPEDOMAN PENULISAN LAPORAN\nMAGANG\n7.1\nFUNGSI LAPORAN MAGANG\nPertanggungjawaban kegiatan Magang mahasiswa kepada Mitra Magang dan\nDepartemen.\n女你公\n299\nBahan pertimbangan pemberian nilai kegiatan Magang\nДо\nPenyampaian informasi bagi pihak ITS, mahasiswa, maupun Mitra Magang\nSalah satu alat untuk membina hubungan kerjasama, saling pengertian, dan koordinasi antara mahasiswa dengan pihak ITS maupun Mitra Magang\nSalah satu alat untuk menyampaikan ide, pendapat, penilaian, dan pengalaman yang berkaitan dengan penyelenggaraan Magang kepada\npihak lain.\n44\n07 Pedoman Penulisan Laporan Magang', '7.2\nKETENTUAN UMUM DALAM PENULISAN\nLAPORAN MAGANG\n• Laporan Magang ditulis dan dipresentasikan pada akhir magang (jika diperlukan).\n• Laporan Magang selain diserahkan ke departemen dan mitra magang, juga diserahkan ke Subdirektorat PK2 Direktorat Kemahasiswaan dalam bentuk softcopy melalui SIM Magang.\n7.3\nPRINSIP PENULISAN LAPORAN\nMAGANG\n• BENAR DAN OBYEKTIF\nLaporan magang harus sesuai dengan ketentuan yang ada dalam pedoman ini serta memuat informasi yang benar dan obyektif.\n• JELAS DAN CERMAT\nLaporan magang harus mudah dimengerti / dipahami oleh pembaca, dengan cara menghindari pemakaian kata / istilah, rangkaian kata / kalimat atau gaya bahasa yang kurang dapat dipahami oleh pembaca maupun penulisnya sendiri. Gunakan kata-kata yang sederhana tetapi jelas maksudnya.\n• LANGSUNG KE SASARAN', '• Mahasiswa menguraikan sejarah mitra magang secara umum serta spesifik (unit / divisi terkait) yang menjadi konteks dari topik yang dipilih.\n2.2. Struktur Organisasi Mitra Magang\n• Mahasiswa dapat menjelaskan struktur organisasi Mitra Magang secara umum yaitu dapat mencakup struktur organisasi, proses bisnis, ketentuan/peraturan terkait, dan sejenisnya.\n2.3. Visi dan Misi Perusahaan\n• Mahasiswa dapat menjelaskan Visi Misi Mitra Magang secara umum\n2.4. Kegiatan Produksi (barang/jasa) (jika ada)\n• Mahasiswa dapat menjelaskan proses penciptaan nilai untuk pemangku\n48\n07 Pedoman Penulisan Laporan Magang', '7.5\nKETENTUAN ISI LAPORAN MAGANG\n• BAB 1. PENDAHULUAN\n1.1. Latar Belakang, meliputi\n• Mahasiswa menguraikan latar belakang (argumen / alasan) dari topik yang dipilih dalam Laporan Magang ini.\n• Latar belakang harus menunjukkan urgensi dari topik yang dipilih. Urgensi misal-nya ditunjukkan oleh keunikan topik (isu mutakhir), keunikan industri, permasalah-an atau risiko yang ditimbulkan, atau perbedaan pendapat.\n1.2. Tujuan Magang, meliputi\n• Mencerminkan hal-hal yang akan diuraikan di bab analisis.\n1.3. Manfaat Magang, meliputi\n• Manfaat untuk ITS\n• Manfaat untuk Mitra Magang\n• Manfaat untuk Mahasiswa\n1.4. Mahasiswa menguraikan tujuan penulisan topik magang.\n• Tujuan harus mencerminkan hal-hal yang akan diuraikan di bab analisis.\n• BAB 2. PROFIL MITRA MAGANG\n2.1. Sejarah Mitra Magang\n• Mahasiswa menguraikan sejarah mitra magang secara umum serta spesifik (unit / divisi terkait) yang menjadi konteks dari topik yang dipilih.\n2.2. Struktur Organisasi Mitra Magang']","Fungsi laporan magang adalah sebagai pertanggungjawaban kegiatan magang mahasiswa kepada Mitra Magang dan Departemen, sebagai bahan pertimbangan pemberian nilai kegiatan magang, sebagai penyampaian informasi bagi pihak ITS, mahasiswa, maupun Mitra Magang, sebagai alat untuk membina hubungan kerjasama, saling pengertian, dan koordinasi antara mahasiswa dengan pihak ITS maupun Mitra Magang, serta sebagai alat untuk menyampaikan ide, pendapat, penilaian, dan pengalaman yang berkaitan dengan penyelenggaraan magang kepada pihak lain."
11,Apa saja ketentuan umum dalam penulisan lapora magang?,"benar dan obyektif, jelas dan cermat, langsung ke sasaran, lengkap, tegas dan konsisten","['Berikut adalah ketentuan umum mengenai Laporan Magang:\n• Pada akhir pelaksanaan magang mahasiswa diwajibkan menulis Laporan Magang.\n• Pedoman penulisan Laporan Magang dapat ditemukan pada Bagian 5 dari buku petunjuk teknis magang ini.\n• Laporan Magang harus disetujui oleh dosen pembimbing magang dan dosen lapangan.\n• Laporan Magang harus diselesaikan segera setelah Program Magang berakhir.\n• Laporan Magang yang telah disetujui pembimbing magang dapat di presentasikan jika diperlukan.\n• Dalam penyusunan Laporan Magang, mahasiswa wajib menaati ketentuan kerahasiaan data / informasi yang ditetapkan oleh unit tempat magang.\n8.4\nPENILAIAN PRESENTASI LAPORAN\nMAGANG (JIKA DIPERLUKAN)\nButir penilaian presentasi Laporan Magang mencakup aspek berikut ini:\nAlur Presentasi\n1. Logika dalam Analisis Presentasi\n2. Substansi Isi Presentasi\nProses Presentasi\n1. Kualitas Slides Presentasi\n2. Sistematika Slides Presentasi\nKomunikasi dalam Presentasi\n1. Kemampuan Menjelaskan Isi\nLaporan Magang', '7.2\nKETENTUAN UMUM DALAM PENULISAN\nLAPORAN MAGANG\n• Laporan Magang ditulis dan dipresentasikan pada akhir magang (jika diperlukan).\n• Laporan Magang selain diserahkan ke departemen dan mitra magang, juga diserahkan ke Subdirektorat PK2 Direktorat Kemahasiswaan dalam bentuk softcopy melalui SIM Magang.\n7.3\nPRINSIP PENULISAN LAPORAN\nMAGANG\n• BENAR DAN OBYEKTIF\nLaporan magang harus sesuai dengan ketentuan yang ada dalam pedoman ini serta memuat informasi yang benar dan obyektif.\n• JELAS DAN CERMAT\nLaporan magang harus mudah dimengerti / dipahami oleh pembaca, dengan cara menghindari pemakaian kata / istilah, rangkaian kata / kalimat atau gaya bahasa yang kurang dapat dipahami oleh pembaca maupun penulisnya sendiri. Gunakan kata-kata yang sederhana tetapi jelas maksudnya.\n• LANGSUNG KE SASARAN', '6.3\nKETENTUAN PEMBIMBINGAN MAGANG\nBAGI MAHASISWA\nMahasiswa harus melakukan pembimbingan sebelum dan saat pelaksanaan magang untuk memastikan pelaksanaan magang dan penulisan Laporan Magang dapat berjalan dengan baik.\nMahasiswa harus membuat Laporan Magang sesuai dengan pedoman penulisan Laporan Magang.\nMahasiswa menyerahkan Laporan Magang sesuai\ndengan jadwal atau kesepakatan dialokasikan oleh dosen pembimbing.\nMahasiswa harus memenuhi jumlah bimbingan minimal yang telah ditetapkan.\nMahasiswa harus memperhatikan etika berkomunikasi dan etika berperilaku dalam melakukan proses pembimbingan.\nBuku Petunjuk Teknis Magang\n41', '• Memberikan arahan dalam penyelesaian revisi Laporan Magang.\nB. Dosen pembimbing harus memastikan bahwa Laporan Magang bebas dari plagiarisme.\n6.5\nPENGGANTIAN DOSEN PEMBIMBING\nMAGANG\n• Penggantian dosen pembimbing magang harus didasarkan pada alasan yang dapat dipertanggungjawabkan.\n• Pengajuan permohonan penggantian dosen pembimbing magang dapat dilakukan selambat-lambatnya 2 (dua) bulan setelah magang dimulai.\n• Penggantian dosen pembimbing magang harus dengan persetujuan dari Kepala\nDepartemen.\n42\n06 Pembimbingan Magang']","Ketentuan umum dalam penulisan Laporan Magang adalah sebagai berikut:
1. Laporan Magang harus ditulis dan dipresentasikan pada akhir magang (jika diperlukan).
2. Laporan Magang harus disetujui oleh dosen pembimbing magang dan dosen lapangan.
3. Laporan Magang harus diselesaikan segera setelah Program Magang berakhir.
4. Laporan Magang yang telah disetujui pembimbing magang dapat dipresentasikan jika diperlukan.
5. Dalam penyusunan Laporan Magang, mahasiswa wajib menaati ketentuan kerahasiaan data / informasi yang ditetapkan oleh unit tempat magang.
6. Laporan Magang selain diserahkan ke departemen dan mitra magang, juga diserahkan ke Subdirektorat PK2 Direktorat Kemahasiswaan dalam bentuk softcopy melalui SIM Magang.
7. Laporan Magang harus sesuai dengan ketentuan yang ada dalam pedoman, memuat informasi yang benar dan obyektif, mudah dimengerti oleh pembaca, dan menggunakan kata-kata yang sederhana tetapi jelas maksudnya."
12,Apa jenis dan ukuran kertas pada format penulisan laporan magang?,Kertas HVS 70gram ukuran A5 (148 × 210 mm).,"['• Mampu memilih dan mengorganisir data yang diperlukan.\n• Mampu mengamati dan menilai dengan jeli berbagai proses, peristiwa, manfaat dan kelemahan yang ada selama melakukan kegiatan Magang.\n7.4\nFORMAT DAN SISTEMATIKA LAPORAN\nMAGANG\n• FORMAT PENULISAN LAPORAN MAGANG\n1. Jenis dan Ukuran Kertas\nKertas HVS 70gram ukuran A5 (148 × 210 mm).\n2. Cover Laporan\n3. Lembar pengesahan dengan dasar polos berwarna putih\nPembimbing tempat magang tanda tangan terlebih dahulu.\n4. Jarak Tepi (margin)\n- Tepi Atas : 2,5 cm\n- Тері Bawah : 2,5 cm\n- Tepi Kiri: 2,5 cm\n- Tepi Kanan : 2,0 cm\n5. Jenis Huruf\nTimes New Roman, Normal, 12 pt (judul), 11 pt (isi)\n46\n07 Pedoman Penulisan Laporan Magang', '• Mahasiswa memberikan penjabaran mengenai rencana perbaikan / pengembangan diri, karir, dan pendidikan selanjutnya.\n• LAMPIRAN\n• Berisi naskah atau dokumen yang perlu disampaikan untuk mendukung dan menguatkan laporan.\n• Lampiran wajib berupa absensi dan,\n• Laporan logbook kegiatan harian yang ditandatangani oleh pembimbing lapangan.\n• Lampiran penunjang dapat berupa struktur organisasi lembaga tempat magang, prosedur atau proses kerja, foto-foto dan sebagainya.\n• Sertifikat magang.\n50\n07 Pedoman Penulisan Laporan Magang\n\nBARAT\nTH\nHARI LISTRIK NASIONAL\nPLN\nPL\nN\n08\nPENILAIAN\nMAGANG', 'Berikut adalah ketentuan umum mengenai Laporan Magang:\n• Pada akhir pelaksanaan magang mahasiswa diwajibkan menulis Laporan Magang.\n• Pedoman penulisan Laporan Magang dapat ditemukan pada Bagian 5 dari buku petunjuk teknis magang ini.\n• Laporan Magang harus disetujui oleh dosen pembimbing magang dan dosen lapangan.\n• Laporan Magang harus diselesaikan segera setelah Program Magang berakhir.\n• Laporan Magang yang telah disetujui pembimbing magang dapat di presentasikan jika diperlukan.\n• Dalam penyusunan Laporan Magang, mahasiswa wajib menaati ketentuan kerahasiaan data / informasi yang ditetapkan oleh unit tempat magang.\n8.4\nPENILAIAN PRESENTASI LAPORAN\nMAGANG (JIKA DIPERLUKAN)\nButir penilaian presentasi Laporan Magang mencakup aspek berikut ini:\nAlur Presentasi\n1. Logika dalam Analisis Presentasi\n2. Substansi Isi Presentasi\nProses Presentasi\n1. Kualitas Slides Presentasi\n2. Sistematika Slides Presentasi\nKomunikasi dalam Presentasi\n1. Kemampuan Menjelaskan Isi\nLaporan Magang', '6. Jarak Spasi\n1 (satu)\n• SISTEMATIKA LAPORAN MAGANG\nCover Luar\nCover Dalam\nLembar Pengesahan\nKata Pengantar\nDaftar Isi\nDaftar Gambar\nDaftar Tabel\nBAB 1. PENDAHULUAN\n1.1. Latar Belakang\n1.2. Tujuan Magang\n1.3. Manfaat Magang\n1.4. Mahasiswa menguraikan tujuan penulisan topik magang.\nBAB 2. PENDAHULUAN\n2.1. Sejarah Mitra Magang\n2.2. Struktur Organisasi Mitra Magang\n2.3. Visi dan Misi Perusahaan\n2.4. Kegiatan Produksi (barang/jasa) (jika ada)\nBAB 3. PELAKSANAAN MAGANG\n3.1 Posisi / kedudukan kegiatan Magang\n3.2 Metodologi penyelesaian Tugas\n3.3 Pembelajaran Hal Baru\nBAB 4. KESIMPULAN DAN SARAN\nBAB 5. REFLEKSI DIRI\nLAMPIRAN\nBuku Petunjuk Teknis Magang\n47']",Jenis dan ukuran kertas pada format penulisan laporan magang adalah kertas HVS 70 gram dengan ukuran A5 (148 × 210 mm).
13,Berapa jarak tepi margin dalam penulisan laporan magang?,"- Tepi Atas : 2,5 cm
- Тері Bawah : 2,5 cm
- Tepi Kiri : 2,5 cm
- Tepi Kanan : 2,0 cm","['• Mampu memilih dan mengorganisir data yang diperlukan.\n• Mampu mengamati dan menilai dengan jeli berbagai proses, peristiwa, manfaat dan kelemahan yang ada selama melakukan kegiatan Magang.\n7.4\nFORMAT DAN SISTEMATIKA LAPORAN\nMAGANG\n• FORMAT PENULISAN LAPORAN MAGANG\n1. Jenis dan Ukuran Kertas\nKertas HVS 70gram ukuran A5 (148 × 210 mm).\n2. Cover Laporan\n3. Lembar pengesahan dengan dasar polos berwarna putih\nPembimbing tempat magang tanda tangan terlebih dahulu.\n4. Jarak Tepi (margin)\n- Tepi Atas : 2,5 cm\n- Тері Bawah : 2,5 cm\n- Tepi Kiri: 2,5 cm\n- Tepi Kanan : 2,0 cm\n5. Jenis Huruf\nTimes New Roman, Normal, 12 pt (judul), 11 pt (isi)\n46\n07 Pedoman Penulisan Laporan Magang', '• LANGSUNG KE SASARAN\nLaporan magang harus tepat, padat dan langsung ke pokok persoalannya. Uraian sebaiknya tidak terlalu panjang atau menggunakan kata-kata kiasan hanya sekedar untuk memberi kesan bahwa laporan itu tebal (laporan tebal tidak selalu berarti bagus).\n• LENGKAP\nLaporan magang harus disajikan secara lengkap dalam bentuk uraian menyeluruh berdasarkan data terpilih dengan disertai data penunjang yang diperlukan. Oleh karena itu Laporan Magang harus memuat seluruh materi magang yang dikerjakan mahasiswa (bukan seluruh materi proyek / kegiatan) dan tidak menimbulkan masalah, persoalan, atau pertanyaan baru, disertai data penunjang, misalnya grafik, tabel, peta, skema, dan lain-lain bila diperlukan.\nBuku Petunjuk Teknis Magang\n45', '6. Jarak Spasi\n1 (satu)\n• SISTEMATIKA LAPORAN MAGANG\nCover Luar\nCover Dalam\nLembar Pengesahan\nKata Pengantar\nDaftar Isi\nDaftar Gambar\nDaftar Tabel\nBAB 1. PENDAHULUAN\n1.1. Latar Belakang\n1.2. Tujuan Magang\n1.3. Manfaat Magang\n1.4. Mahasiswa menguraikan tujuan penulisan topik magang.\nBAB 2. PENDAHULUAN\n2.1. Sejarah Mitra Magang\n2.2. Struktur Organisasi Mitra Magang\n2.3. Visi dan Misi Perusahaan\n2.4. Kegiatan Produksi (barang/jasa) (jika ada)\nBAB 3. PELAKSANAAN MAGANG\n3.1 Posisi / kedudukan kegiatan Magang\n3.2 Metodologi penyelesaian Tugas\n3.3 Pembelajaran Hal Baru\nBAB 4. KESIMPULAN DAN SARAN\nBAB 5. REFLEKSI DIRI\nLAMPIRAN\nBuku Petunjuk Teknis Magang\n47', 'Berikut adalah ketentuan umum mengenai Laporan Magang:\n• Pada akhir pelaksanaan magang mahasiswa diwajibkan menulis Laporan Magang.\n• Pedoman penulisan Laporan Magang dapat ditemukan pada Bagian 5 dari buku petunjuk teknis magang ini.\n• Laporan Magang harus disetujui oleh dosen pembimbing magang dan dosen lapangan.\n• Laporan Magang harus diselesaikan segera setelah Program Magang berakhir.\n• Laporan Magang yang telah disetujui pembimbing magang dapat di presentasikan jika diperlukan.\n• Dalam penyusunan Laporan Magang, mahasiswa wajib menaati ketentuan kerahasiaan data / informasi yang ditetapkan oleh unit tempat magang.\n8.4\nPENILAIAN PRESENTASI LAPORAN\nMAGANG (JIKA DIPERLUKAN)\nButir penilaian presentasi Laporan Magang mencakup aspek berikut ini:\nAlur Presentasi\n1. Logika dalam Analisis Presentasi\n2. Substansi Isi Presentasi\nProses Presentasi\n1. Kualitas Slides Presentasi\n2. Sistematika Slides Presentasi\nKomunikasi dalam Presentasi\n1. Kemampuan Menjelaskan Isi\nLaporan Magang']","Jarak tepi margin dalam penulisan laporan magang adalah sebagai berikut:
- Tepi Atas: 2,5 cm
- Tepi Bawah: 2,5 cm
- Tepi Kiri: 2,5 cm
- Tepi Kanan: 2,0 cm"
14,apa ketentuan umum mengenai penilaian akhir magang?,"1. Dosen pembimbing magang dan dosen pembimbing dari unit tempat magang memberikan penilaian terhadap Laporan Magang dan ujian presentasi magang
jika diperlukan.
2. Unit tempat magang memberikan penilaian terhadap prestasi magang.
3. Penilaian penulisan laporan magang mengacu kepada ketentuan.
4. Hasil penilaian dilakukan dengan cara mengisi formulir yang ada dan diserahkan
pada departemen","['Beberapa ketentuan yang perlu diperhatikan khususnya oleh mahasiswa peserta magang dalam merencanakan dan melaksanakan ujian presentasi Laporan Magang sebagai berikut:\n• Ujian Presentasi Laporan Magang dilaksanakan oleh mahasiswa yang telah menyelesaikan penyusunan karya akhir Laporan Magang yang sudah disetujui oleh pembimbing magang.\n• Ujian Presentasi Magang dilaksanakan setelah berkas penilaian kinerja magang sudah diisi oleh unit tempat magang dan sudah diterima oleh program studi.\n• Ujian Presentasi Magang akan dilakukan di ruang ujian Sidang atau di ruang kelas.\n• Untuk dapat mengikuti Ujian Presentasi Magang, mahasiswa harus mengajukan Permohonan Ujian Presentasi Magang sesuai jadwal yang ditetapkan oleh Program Studi.\n• Ujian Presentasi Magang akan diuji oleh 3 (tiga) orang dosen penguji, salah satunya dosen pembimbing magang dan berlangsung sekitar 1,5 jam termasuk sesi untuk tanya jawab.', '4. Hasil penilaian dilakukan dengan cara mengisi formulir yang ada dan diserahkan\npada departemen.\n8.2\nPENILAIAN PRESTASI KINERJA MAGANG\nOLEH UNIT MITRA MAGANG\nDalam melakukan kegiatan magang, mahasiswa akan memperoleh penilaian dari unit tempat magang. Formulir penilaian magang diisi dan ditandatangani oleh atasan yang berwenang di tempat magang (minimal level manajer) dan dicap menggunakan stempel unit tempat magang. Berikut adalah butir penilaian kinerja magang:\n52\n08 Penilaian Magang', '08\nPENILAIAN MAGANG\n8.1\nBOBOT PENILAIAN MAGANG\n• Berikut adalah bobot masing-masing komponen penilaian untuk nilai akhir magang:\n60%\n40%\nPrestasi Kinerja Magang\noleh Unit tempat Magang\nPenulisan Laporan Magang,\ndan presentasi laporan jika diperlukan\n• Berikut ketentuan umum mengenai penilaian akhir magang:\n1. Dosen pembimbing magang dan dosen pembimbing dari unit tempat magang memberikan penilaian terhadap Laporan Magang dan ujian presentasi magang\njika diperlukan.\n2. Unit tempat magang memberikan penilaian terhadap prestasi magang.\n3. Penilaian penulisan laporan magang mengacu kepada ketentuan.\n4. Hasil penilaian dilakukan dengan cara mengisi formulir yang ada dan diserahkan\npada departemen.\n8.2\nPENILAIAN PRESTASI KINERJA MAGANG\nOLEH UNIT MITRA MAGANG', '6.3\nKETENTUAN PEMBIMBINGAN MAGANG\nBAGI MAHASISWA\nMahasiswa harus melakukan pembimbingan sebelum dan saat pelaksanaan magang untuk memastikan pelaksanaan magang dan penulisan Laporan Magang dapat berjalan dengan baik.\nMahasiswa harus membuat Laporan Magang sesuai dengan pedoman penulisan Laporan Magang.\nMahasiswa menyerahkan Laporan Magang sesuai\ndengan jadwal atau kesepakatan dialokasikan oleh dosen pembimbing.\nMahasiswa harus memenuhi jumlah bimbingan minimal yang telah ditetapkan.\nMahasiswa harus memperhatikan etika berkomunikasi dan etika berperilaku dalam melakukan proses pembimbingan.\nBuku Petunjuk Teknis Magang\n41']","Ketentuan umum mengenai penilaian akhir magang adalah sebagai berikut:
1. Dosen pembimbing magang dan dosen pembimbing dari unit tempat magang memberikan penilaian terhadap Laporan Magang dan ujian presentasi magang jika diperlukan.
2. Unit tempat magang memberikan penilaian terhadap prestasi magang.
3. Penilaian penulisan laporan magang mengacu kepada ketentuan yang berlaku.
4. Hasil penilaian dilakukan dengan cara mengisi formulir yang ada dan diserahkan pada departemen."
15,Apa saja etika pelaksanaan magang di perusahaan mitra magang?,"• Mahasiswa harus mematuhi aturan Mitra Magang dengan baik.
• Mahasiswa harus bekerja dan berusaha memberikan yang terbaik untuk kepentingan Mitra Magang.
• Mahasiswa harus dapat menyelesaikan segala tugas yang diberikan
Mitra Magang dengan benar, rapi dan tepat waktu.
• Mahasiswa harus menghormati pegawai Mitra Magang tanpa membedakan suku, agama, ras, gender dan golongan.
• Mahasiswa bersikap jujur, disiplin, santun, profesional, dan menjaga etos kerja di unit kerja Mitra Magang.
• Mahasiswa harus menjaga kerahasiaan informasi unit kerja Mitra Magang. Seluruh informasi dan data yang akan dijadikan sumber dalam penulisan laporan magang harus disamarkan dalam penulisan untuk menjaga kerahasidan data dan informasi Mitra Magang.
• Mahasiswa harus menjaga nama baik almamater ITS.","['09\nЕТІКА\nMAGANG\n\n09\nETIKA MAGANG\n9.1\nETIKA PELAKSANAAN MAGANG DI PERUSAHAAN MITRA MAGANG\nVX\n• Mahasiswa harus mematuhi aturan Mitra Magang dengan baik.\n• Mahasiswa harus bekerja dan berusaha memberikan yang terbaik untuk kepentingan Mitra Magang.\n• Mahasiswa harus dapat menyelesaikan segala tugas yang diberikan\nMitra Magang dengan benar, rapi dan tepat waktu.\n• Mahasiswa harus menghormati pegawai Mitra Magang tanpa membedakan suku, agama, ras, gender dan golongan.\n• Mahasiswa bersikap jujur, disiplin, santun, profesional, dan menjaga etos kerja di unit kerja Mitra Magang.\n• Mahasiswa harus menjaga kerahasiaan informasi unit kerja Mitra Magang. Seluruh informasi dan data yang akan dijadikan sumber dalam penulisan laporan magang harus disamarkan dalam penulisan untuk menjaga kerahasidan data dan informasi Mitra Magang.\n• Mahasiswa harus menjaga nama baik almamater ITS.\n58\n09 Etika Magang', '• Mahasiswa menguraikan sejarah mitra magang secara umum serta spesifik (unit / divisi terkait) yang menjadi konteks dari topik yang dipilih.\n2.2. Struktur Organisasi Mitra Magang\n• Mahasiswa dapat menjelaskan struktur organisasi Mitra Magang secara umum yaitu dapat mencakup struktur organisasi, proses bisnis, ketentuan/peraturan terkait, dan sejenisnya.\n2.3. Visi dan Misi Perusahaan\n• Mahasiswa dapat menjelaskan Visi Misi Mitra Magang secara umum\n2.4. Kegiatan Produksi (barang/jasa) (jika ada)\n• Mahasiswa dapat menjelaskan proses penciptaan nilai untuk pemangku\n48\n07 Pedoman Penulisan Laporan Magang', '6.3\nKETENTUAN PEMBIMBINGAN MAGANG\nBAGI MAHASISWA\nMahasiswa harus melakukan pembimbingan sebelum dan saat pelaksanaan magang untuk memastikan pelaksanaan magang dan penulisan Laporan Magang dapat berjalan dengan baik.\nMahasiswa harus membuat Laporan Magang sesuai dengan pedoman penulisan Laporan Magang.\nMahasiswa menyerahkan Laporan Magang sesuai\ndengan jadwal atau kesepakatan dialokasikan oleh dosen pembimbing.\nMahasiswa harus memenuhi jumlah bimbingan minimal yang telah ditetapkan.\nMahasiswa harus memperhatikan etika berkomunikasi dan etika berperilaku dalam melakukan proses pembimbingan.\nBuku Petunjuk Teknis Magang\n41', 'kepentingan yang dilakukan oleh organisasi tersebut (misalnya melalui produk atau jasa yang dihasilkan).\n• BAB 3. PELAKSANAAN MAGANG\n3.1. Posisi / Kedudukan Kegiatan Magang\n• Mahasiswa dapat menguraikan kedudukan / posisi kegiatan yang ditugaskan oleh mitra magang dalam lingkup pekerjaan / proyek keseluruhan. Hal ini dimaksudkan untuk mengetahui apakah mahasiswa memahami kaitan antara apa yang telah dilakukan / dihasilkan dengan pekerjaan tersebut.\n3.2. Metodologi penyelesaian Tugas\n• Mahasiswa menguraikan kasus / masalah menjadi topik pembahasan. Mahasiswa menganalisis kasus / masalah tersebut dengan menggunakan teori atau metode yang relevan. Analisis bukan mendeskripsikan teori, namun menggunakan teori guna menjelaskan dan membandingkan dengan kasus/masalah yang diangkat.\nUraian mengenai teori atau metode harus menyebutkan referensi yang valid dan handal.\n3.3. Pembelajaran Hal Baru']","Etika pelaksanaan magang di perusahaan mitra magang meliputi beberapa hal, antara lain:
1. Mahasiswa harus mematuhi aturan Mitra Magang dengan baik.
2. Mahasiswa harus bekerja dan berusaha memberikan yang terbaik untuk kepentingan Mitra Magang.
3. Mahasiswa harus dapat menyelesaikan segala tugas yang diberikan Mitra Magang dengan benar, rapi, dan tepat waktu.
4. Mahasiswa harus menghormati pegawai Mitra Magang tanpa membedakan suku, agama, ras, gender, dan golongan.
5. Mahasiswa bersikap jujur, disiplin, santun, profesional, dan menjaga etos kerja di unit kerja Mitra Magang.
6. Mahasiswa harus menjaga kerahasiaan informasi unit kerja Mitra Magang. Seluruh informasi dan data yang akan dijadikan sumber dalam penulisan laporan magang harus disamarkan dalam penulisan untuk menjaga kerahasiaan data dan informasi Mitra Magang.
7. Mahasiswa harus menjaga nama baik almamater ITS."
16,Apa syarat yang harus dipenuhi mahasiswa untik mengikuti kegiatan magang?,"1. Mahasiswa peserta magang adalah mahasiswa aktif ITS 2. Mahasiswa sudah menempuh minimal 90 SKS, untuk departemen yang tidak mempunyai MK magang dalam kurikulumnya.","['6.3\nKETENTUAN PEMBIMBINGAN MAGANG\nBAGI MAHASISWA\nMahasiswa harus melakukan pembimbingan sebelum dan saat pelaksanaan magang untuk memastikan pelaksanaan magang dan penulisan Laporan Magang dapat berjalan dengan baik.\nMahasiswa harus membuat Laporan Magang sesuai dengan pedoman penulisan Laporan Magang.\nMahasiswa menyerahkan Laporan Magang sesuai\ndengan jadwal atau kesepakatan dialokasikan oleh dosen pembimbing.\nMahasiswa harus memenuhi jumlah bimbingan minimal yang telah ditetapkan.\nMahasiswa harus memperhatikan etika berkomunikasi dan etika berperilaku dalam melakukan proses pembimbingan.\nBuku Petunjuk Teknis Magang\n41', 'Beberapa ketentuan yang perlu diperhatikan khususnya oleh mahasiswa peserta magang dalam merencanakan dan melaksanakan ujian presentasi Laporan Magang sebagai berikut:\n• Ujian Presentasi Laporan Magang dilaksanakan oleh mahasiswa yang telah menyelesaikan penyusunan karya akhir Laporan Magang yang sudah disetujui oleh pembimbing magang.\n• Ujian Presentasi Magang dilaksanakan setelah berkas penilaian kinerja magang sudah diisi oleh unit tempat magang dan sudah diterima oleh program studi.\n• Ujian Presentasi Magang akan dilakukan di ruang ujian Sidang atau di ruang kelas.\n• Untuk dapat mengikuti Ujian Presentasi Magang, mahasiswa harus mengajukan Permohonan Ujian Presentasi Magang sesuai jadwal yang ditetapkan oleh Program Studi.\n• Ujian Presentasi Magang akan diuji oleh 3 (tiga) orang dosen penguji, salah satunya dosen pembimbing magang dan berlangsung sekitar 1,5 jam termasuk sesi untuk tanya jawab.', '6.1\nKRITERIA DOSEN PEMBIMBING MAGANG\nW888\nDosen yang telah mengajar selama 4 semester berturut-turut.\nMemperoleh SK Pembimbing Magang dari Departemen dan ketetapan melalui\nKeputusan Dekan.\n6.2\nRINCIAN TUGAS DOSEN PEMBIMBING\nMAGANG\n• Memberikan saran dan masukan saat konsultasi keilmuan jika diperlukan oleh mahasiswa selama magang.\n• Melakukan kegiatan pembimbingan bagi mahasiswa magang untuk dapat berkonsultasi selama magang atau bimbingan penulisan laporan magang.\n• Memberikan persetujuan dan penilaian Laporan Magang.\n• Memberikan penilaian dapat dilakukan dalam bentuk penilaian laporan magang dan atau presentasi kegiatan magang.\n40\n06 Pembimbingan Magang', '• Memberikan arahan dalam penyelesaian revisi Laporan Magang.\nB. Dosen pembimbing harus memastikan bahwa Laporan Magang bebas dari plagiarisme.\n6.5\nPENGGANTIAN DOSEN PEMBIMBING\nMAGANG\n• Penggantian dosen pembimbing magang harus didasarkan pada alasan yang dapat dipertanggungjawabkan.\n• Pengajuan permohonan penggantian dosen pembimbing magang dapat dilakukan selambat-lambatnya 2 (dua) bulan setelah magang dimulai.\n• Penggantian dosen pembimbing magang harus dengan persetujuan dari Kepala\nDepartemen.\n42\n06 Pembimbingan Magang']","Mahasiswa harus melakukan pembimbingan sebelum dan saat pelaksanaan magang untuk memastikan pelaksanaan magang dan penulisan Laporan Magang dapat berjalan dengan baik. Selain itu, mahasiswa juga harus membuat Laporan Magang sesuai dengan pedoman penulisan yang telah ditetapkan, menyerahkan Laporan Magang sesuai jadwal yang dialokasikan oleh dosen pembimbing, memenuhi jumlah bimbingan minimal yang telah ditetapkan, serta memperhatikan etika berkomunikasi dan berperilaku dalam melakukan proses pembimbingan."
17,apa peran Dosen pembimbing magang?,Dosen pembimbing magang memegang peranan kunci dalam koordinasi pelaksanaan magang dengan mahasiswa peserta magang dan unit tempat magang serta wajib memantau secara kontinu pelaksanaan magang dari mahasiswa yang dibimbingnya.,"['6.1\nKRITERIA DOSEN PEMBIMBING MAGANG\nW888\nDosen yang telah mengajar selama 4 semester berturut-turut.\nMemperoleh SK Pembimbing Magang dari Departemen dan ketetapan melalui\nKeputusan Dekan.\n6.2\nRINCIAN TUGAS DOSEN PEMBIMBING\nMAGANG\n• Memberikan saran dan masukan saat konsultasi keilmuan jika diperlukan oleh mahasiswa selama magang.\n• Melakukan kegiatan pembimbingan bagi mahasiswa magang untuk dapat berkonsultasi selama magang atau bimbingan penulisan laporan magang.\n• Memberikan persetujuan dan penilaian Laporan Magang.\n• Memberikan penilaian dapat dilakukan dalam bentuk penilaian laporan magang dan atau presentasi kegiatan magang.\n40\n06 Pembimbingan Magang', '6.4\nKETENTUAN PEMBIMBINGAN MAGANG\nBAGI DOSEN\nA.Dosen pembimbing harus dapat memberikan masukan dan pengarahan tentang pelaksanaan magang dan penulisan Laporan Magang. Pemberian masukan dan arahan tersebut diantaranya mencakup namun tidak terbatas pada hal berikut:\n• Memberikan masukan, arahan, dan mendiskusikan rumusan permasalahan dan tujuan atau topik Laporan Magang.\n• Membuat rencana bimbingan bersama mahasiswa.\n• Mengarahkan mahasiswa dalam hal metode penulisan ilmiah dan metode analisis dalam Laporan Magang sesuai dengan pedoman penulisan Laporan Magang yang telah disepakati.\n• Mendiskusikan acuan materi keilmuan yang relevan dengan topik Laporan Magang.\n• Hadir dalam Sidang Magang dan memberikan penilaian akhir bagi Laporan\nMagang yang diujikan.\n• Memberikan arahan dalam penyelesaian revisi Laporan Magang.\nB. Dosen pembimbing harus memastikan bahwa Laporan Magang bebas dari plagiarisme.\n6.5\nPENGGANTIAN DOSEN PEMBIMBING\nMAGANG', '6.3\nKETENTUAN PEMBIMBINGAN MAGANG\nBAGI MAHASISWA\nMahasiswa harus melakukan pembimbingan sebelum dan saat pelaksanaan magang untuk memastikan pelaksanaan magang dan penulisan Laporan Magang dapat berjalan dengan baik.\nMahasiswa harus membuat Laporan Magang sesuai dengan pedoman penulisan Laporan Magang.\nMahasiswa menyerahkan Laporan Magang sesuai\ndengan jadwal atau kesepakatan dialokasikan oleh dosen pembimbing.\nMahasiswa harus memenuhi jumlah bimbingan minimal yang telah ditetapkan.\nMahasiswa harus memperhatikan etika berkomunikasi dan etika berperilaku dalam melakukan proses pembimbingan.\nBuku Petunjuk Teknis Magang\n41', '• Mahasiswa menguraikan sejarah mitra magang secara umum serta spesifik (unit / divisi terkait) yang menjadi konteks dari topik yang dipilih.\n2.2. Struktur Organisasi Mitra Magang\n• Mahasiswa dapat menjelaskan struktur organisasi Mitra Magang secara umum yaitu dapat mencakup struktur organisasi, proses bisnis, ketentuan/peraturan terkait, dan sejenisnya.\n2.3. Visi dan Misi Perusahaan\n• Mahasiswa dapat menjelaskan Visi Misi Mitra Magang secara umum\n2.4. Kegiatan Produksi (barang/jasa) (jika ada)\n• Mahasiswa dapat menjelaskan proses penciptaan nilai untuk pemangku\n48\n07 Pedoman Penulisan Laporan Magang']","Dosen pembimbing magang memiliki beberapa peran, antara lain:
1. Memberikan saran dan masukan saat konsultasi keilmuan jika diperlukan oleh mahasiswa selama magang.
2. Melakukan kegiatan pembimbingan bagi mahasiswa magang untuk dapat berkonsultasi selama magang atau bimbingan penulisan laporan magang.
3. Memberikan persetujuan dan penilaian terhadap Laporan Magang.
4. Memberikan penilaian yang dapat dilakukan dalam bentuk penilaian laporan magang dan/atau presentasi kegiatan magang.
5. Memberikan masukan dan pengarahan tentang pelaksanaan magang dan penulisan Laporan Magang, termasuk membahas rumusan permasalahan, tujuan, dan topik Laporan Magang.
6. Membuat rencana bimbingan bersama mahasiswa.
7. Mengarahkan mahasiswa dalam metode penulisan ilmiah dan metode analisis sesuai pedoman penulisan Laporan Magang.
8. Hadir dalam Sidang Magang dan memberikan penilaian akhir terhadap Laporan Magang yang diujikan.
9. Memberikan arahan dalam penyelesaian revisi Laporan Magang.
10. Memastikan bahwa Laporan Magang bebas dari plagiarisme."
18,Bagaimana proses seleksi program mahasiswa magang bersertifikat?,Seleksi program magang bersertifikat dilakukan oleh FHCl atau BUMN Proses tahapan seleksi dilaksanakan sesuai dengan kebijakan BUMN Hasil proses seleksi akan disampaikan ke Sub Direktorat PK2 untuk diumumkan ke mahasiswa calon peserta magang.,"['Beberapa ketentuan yang perlu diperhatikan khususnya oleh mahasiswa peserta magang dalam merencanakan dan melaksanakan ujian presentasi Laporan Magang sebagai berikut:\n• Ujian Presentasi Laporan Magang dilaksanakan oleh mahasiswa yang telah menyelesaikan penyusunan karya akhir Laporan Magang yang sudah disetujui oleh pembimbing magang.\n• Ujian Presentasi Magang dilaksanakan setelah berkas penilaian kinerja magang sudah diisi oleh unit tempat magang dan sudah diterima oleh program studi.\n• Ujian Presentasi Magang akan dilakukan di ruang ujian Sidang atau di ruang kelas.\n• Untuk dapat mengikuti Ujian Presentasi Magang, mahasiswa harus mengajukan Permohonan Ujian Presentasi Magang sesuai jadwal yang ditetapkan oleh Program Studi.\n• Ujian Presentasi Magang akan diuji oleh 3 (tiga) orang dosen penguji, salah satunya dosen pembimbing magang dan berlangsung sekitar 1,5 jam termasuk sesi untuk tanya jawab.', '6.3\nKETENTUAN PEMBIMBINGAN MAGANG\nBAGI MAHASISWA\nMahasiswa harus melakukan pembimbingan sebelum dan saat pelaksanaan magang untuk memastikan pelaksanaan magang dan penulisan Laporan Magang dapat berjalan dengan baik.\nMahasiswa harus membuat Laporan Magang sesuai dengan pedoman penulisan Laporan Magang.\nMahasiswa menyerahkan Laporan Magang sesuai\ndengan jadwal atau kesepakatan dialokasikan oleh dosen pembimbing.\nMahasiswa harus memenuhi jumlah bimbingan minimal yang telah ditetapkan.\nMahasiswa harus memperhatikan etika berkomunikasi dan etika berperilaku dalam melakukan proses pembimbingan.\nBuku Petunjuk Teknis Magang\n41', '6.1\nKRITERIA DOSEN PEMBIMBING MAGANG\nW888\nDosen yang telah mengajar selama 4 semester berturut-turut.\nMemperoleh SK Pembimbing Magang dari Departemen dan ketetapan melalui\nKeputusan Dekan.\n6.2\nRINCIAN TUGAS DOSEN PEMBIMBING\nMAGANG\n• Memberikan saran dan masukan saat konsultasi keilmuan jika diperlukan oleh mahasiswa selama magang.\n• Melakukan kegiatan pembimbingan bagi mahasiswa magang untuk dapat berkonsultasi selama magang atau bimbingan penulisan laporan magang.\n• Memberikan persetujuan dan penilaian Laporan Magang.\n• Memberikan penilaian dapat dilakukan dalam bentuk penilaian laporan magang dan atau presentasi kegiatan magang.\n40\n06 Pembimbingan Magang', '• Ujian Presentasi Magang akan diuji oleh 3 (tiga) orang dosen penguji, salah satunya dosen pembimbing magang dan berlangsung sekitar 1,5 jam termasuk sesi untuk tanya jawab.\n• Dalam melakukan presentasi, mahasiswa peserta magang harus menyiapkan bahan presentasi sebanyak 10 slides (minimum) sampai dengan 20 slides (maksimum).\nJumlah tersebut untuk memaparkan hasil-hasil magang dan tidak termasuk lampiran tabel, gambar, perhitungan, dan sebagainya.\n• Setelah presentasi Laporan Magang, dosen pembimbing dan dosen lain yang ditunjuk (tim penguji) mengajukan pertanyaan yang bersifat komprehensif.\n• Pertanyaan yang bersifat komprehensif adalah pertanyaan-pertanyaan yang terkait dengan Laporan Magang dan teori terkait topik yang diangkat dalam Laporan Magang.\n56\n08 Penilaian Magang']",Saya tidak menemukan informasi mengenai proses seleksi program mahasiswa magang bersertifikat dalam konteks yang diberikan.
19,apa saja berkas yang perlu diunggah melalui SIM magang?,• CV • Transkrip Nilai • Surat Rekomendasi Departemen • Mengisi Form Pakta Integritas,"['Berikut adalah ketentuan umum mengenai Laporan Magang:\n• Pada akhir pelaksanaan magang mahasiswa diwajibkan menulis Laporan Magang.\n• Pedoman penulisan Laporan Magang dapat ditemukan pada Bagian 5 dari buku petunjuk teknis magang ini.\n• Laporan Magang harus disetujui oleh dosen pembimbing magang dan dosen lapangan.\n• Laporan Magang harus diselesaikan segera setelah Program Magang berakhir.\n• Laporan Magang yang telah disetujui pembimbing magang dapat di presentasikan jika diperlukan.\n• Dalam penyusunan Laporan Magang, mahasiswa wajib menaati ketentuan kerahasiaan data / informasi yang ditetapkan oleh unit tempat magang.\n8.4\nPENILAIAN PRESENTASI LAPORAN\nMAGANG (JIKA DIPERLUKAN)\nButir penilaian presentasi Laporan Magang mencakup aspek berikut ini:\nAlur Presentasi\n1. Logika dalam Analisis Presentasi\n2. Substansi Isi Presentasi\nProses Presentasi\n1. Kualitas Slides Presentasi\n2. Sistematika Slides Presentasi\nKomunikasi dalam Presentasi\n1. Kemampuan Menjelaskan Isi\nLaporan Magang', 'Beberapa ketentuan yang perlu diperhatikan khususnya oleh mahasiswa peserta magang dalam merencanakan dan melaksanakan ujian presentasi Laporan Magang sebagai berikut:\n• Ujian Presentasi Laporan Magang dilaksanakan oleh mahasiswa yang telah menyelesaikan penyusunan karya akhir Laporan Magang yang sudah disetujui oleh pembimbing magang.\n• Ujian Presentasi Magang dilaksanakan setelah berkas penilaian kinerja magang sudah diisi oleh unit tempat magang dan sudah diterima oleh program studi.\n• Ujian Presentasi Magang akan dilakukan di ruang ujian Sidang atau di ruang kelas.\n• Untuk dapat mengikuti Ujian Presentasi Magang, mahasiswa harus mengajukan Permohonan Ujian Presentasi Magang sesuai jadwal yang ditetapkan oleh Program Studi.\n• Ujian Presentasi Magang akan diuji oleh 3 (tiga) orang dosen penguji, salah satunya dosen pembimbing magang dan berlangsung sekitar 1,5 jam termasuk sesi untuk tanya jawab.', '....\nBerikut kami lampirkan Laporan Magang dan atau Rincian Kegiatan Magang.\nDemikian surat permohonan ini saya buat, atas perhatiannya saya sampaikan terima kasih.\nSurabaya,\nMahasiswa peserta magang\n*) dipilih salah satu\n68\nLampiran', '• Mahasiswa memberikan penjabaran mengenai rencana perbaikan / pengembangan diri, karir, dan pendidikan selanjutnya.\n• LAMPIRAN\n• Berisi naskah atau dokumen yang perlu disampaikan untuk mendukung dan menguatkan laporan.\n• Lampiran wajib berupa absensi dan,\n• Laporan logbook kegiatan harian yang ditandatangani oleh pembimbing lapangan.\n• Lampiran penunjang dapat berupa struktur organisasi lembaga tempat magang, prosedur atau proses kerja, foto-foto dan sebagainya.\n• Sertifikat magang.\n50\n07 Pedoman Penulisan Laporan Magang\n\nBARAT\nTH\nHARI LISTRIK NASIONAL\nPLN\nPL\nN\n08\nPENILAIAN\nMAGANG']","Untuk mengunggah berkas melalui SIM magang, mahasiswa perlu mengunggah beberapa berkas penting seperti Laporan Magang yang telah disetujui oleh dosen pembimbing magang dan dosen lapangan, serta berkas penilaian kinerja magang yang sudah diisi oleh unit tempat magang dan sudah diterima oleh program studi. Selain itu, mahasiswa juga perlu mengunggah berkas pendukung seperti absensi, laporan logbook kegiatan harian yang ditandatangani oleh pembimbing lapangan, struktur organisasi lembaga tempat magang, prosedur atau proses kerja, foto-foto, sertifikat magang, dan dokumen lain yang diperlukan untuk mendukung dan menguatkan laporan magang."
