,question,answer,contexts,ground_truth,context_precision,faithfulness,answer_relevancy,context_recall
0,Apa isi dari Permendikbud Nomor 3 Tahun 2020?,Saya tidak tahu.,"['3\nDisiplin dalam menyelesaikan pekerjaan\n10\n\n\n4\nTanggung jawab\n15\n\n\n5\nKeahlian / Keterampilan dalam Berprofesi\n20\n\n\n6\nKreatifitas / Inovasi\nST\n\n\n7\nSikap dan Perilaku dalam Bekerja\n10\n\n\n8\nKemampuan Bekerjasama Dalam Tim\n5\n\n\nJUMLAH\n100\n\n\nNILAI AKHIR =\nJUMLAH (B X N)\nJUMLAH BOBOT\n100\nSurabaya,\nPembimbing Lapangan\nBuku Petunjuk Teknis Magang\n67'
 'Uraian mengenai teori atau metode harus menyebutkan referensi yang valid dan handal.\n3.3. Pembelajaran Hal Baru\n• Mahasiswa dapat menguraikan temuan-temuan terkait pembelajaran hal baru yang dapat selama magang. Mahasiswa juga dapat membandingkan kegiatan magang yang dilaksanakan / ditemukan dengan teori atau konsep yang telah dipelajari. Mahasiswa juga dapat menyampaikan kendala yang dihadapi selama\nmagang.\n• BAB 4. KESIMPULAN DAN SARAN\nKesimpulan berisi ringkasan terhadap keseluruhan laporan, termasuk pembelajar-an apa yang didapat selama magang. Saran atau rekomendasi merupakan bahan masukan bagi mitra magang yang telah dijadikan lokasi Magang, maupun bagi mahasiswa angkatan berikutnya dalam menentukan spesifikasi dalam program Magang.\n• BAB 5. REFLEKSI DIRI\n• Mahasiswa mendeskripsikan tentang hal-hal positif yang diterima selama perkuliahan yang bermanfaat / relevan terhadap pekerjaan selama magang.'
 '• Mahasiswa memberikan penjabaran mengenai rencana perbaikan / pengembangan diri, karir, dan pendidikan selanjutnya.\n• LAMPIRAN\n• Berisi naskah atau dokumen yang perlu disampaikan untuk mendukung dan menguatkan laporan.\n• Lampiran wajib berupa absensi dan,\n• Laporan logbook kegiatan harian yang ditandatangani oleh pembimbing lapangan.\n• Lampiran penunjang dapat berupa struktur organisasi lembaga tempat magang, prosedur atau proses kerja, foto-foto dan sebagainya.\n• Sertifikat magang.\n50\n07 Pedoman Penulisan Laporan Magang\n\nBARAT\nTH\nHARI LISTRIK NASIONAL\nPLN\nPL\nN\n08\nPENILAIAN\nMAGANG'
 'jelas.\n\n2. Masalah dianalisis menggunakan\nlandasan teoritis dan bukti\npendukung yang kuat.\nKelengkapan subtansi laporan\n3. Kesimpulan dirumuskan sesuai\ndengan hasil analisis.\n\n4. Refleksi diri mencerminkan proses\npembelajaran selama magang\nskill dan social-emotional skill.\n\ninstitusi (jika ada).\nKesesuaian format laporan\nbuku Pedoman Magang ini.\n2. Logika penyajian yang runtun.\n\n3. Bahasa yang baku serta ilmiah.\n1. Pendahuluan / latar belakang dan\nperumusan masalah ditulis secara\nsecara pribadi, meliputi aspek technical\n5. Rekomendasi yang dibuat memuat\nrekomendasi terkait masalah yang\ndianalisis dan rekomendasi untuk\n1. Mengikuti panduan laporan magang\nseperti yang tertera dalam Bagian 8\nTabel 8.1 Butir Penilaian Laporan Magang\n54\n08 Penilaian Magang']","Pendidikan Tinggi, mahasiswa sarjana ataupun mahasiswa sarjana terapan memiliki kesempatan menempuh pembelajaran diluar Perguruan Tinggi.",,,0.5833333333041666,0.0
1,Apa saja ketentuak mahasiswa dalam melaksanakan magang?,"Dalam melaksanakan magang, terdapat beberapa ketentuan yang perlu diperhatikan oleh mahasiswa peserta magang, yaitu:

1. Mahasiswa harus melakukan pembimbingan sebelum dan saat pelaksanaan magang untuk memastikan pelaksanaan magang dan penulisan Laporan Magang dapat berjalan dengan baik.
2. Mahasiswa harus membuat Laporan Magang sesuai dengan pedoman penulisan Laporan Magang.
3. Mahasiswa harus menyerahkan Laporan Magang sesuai dengan jadwal atau kesepakatan yang dialokasikan oleh dosen pembimbing.
4. Mahasiswa harus memenuhi jumlah bimbingan minimal yang telah ditetapkan.
5. Mahasiswa harus memperhatikan etika berkomunikasi dan etika berperilaku dalam melakukan proses pembimbingan.

Selain itu, mahasiswa juga perlu memperhatikan ketentuan-ketentuan lain yang terkait dengan ujian presentasi Laporan Magang, seperti persyaratan untuk mengikuti ujian presentasi, tempat pelaksanaan ujian, dan proses ujian yang melibatkan 3 orang dosen penguji termasuk dosen pembimbing magang.","['Beberapa ketentuan yang perlu diperhatikan khususnya oleh mahasiswa peserta magang dalam merencanakan dan melaksanakan ujian presentasi Laporan Magang sebagai berikut:\n• Ujian Presentasi Laporan Magang dilaksanakan oleh mahasiswa yang telah menyelesaikan penyusunan karya akhir Laporan Magang yang sudah disetujui oleh pembimbing magang.\n• Ujian Presentasi Magang dilaksanakan setelah berkas penilaian kinerja magang sudah diisi oleh unit tempat magang dan sudah diterima oleh program studi.\n• Ujian Presentasi Magang akan dilakukan di ruang ujian Sidang atau di ruang kelas.\n• Untuk dapat mengikuti Ujian Presentasi Magang, mahasiswa harus mengajukan Permohonan Ujian Presentasi Magang sesuai jadwal yang ditetapkan oleh Program Studi.\n• Ujian Presentasi Magang akan diuji oleh 3 (tiga) orang dosen penguji, salah satunya dosen pembimbing magang dan berlangsung sekitar 1,5 jam termasuk sesi untuk tanya jawab.'
 '6.3\nKETENTUAN PEMBIMBINGAN MAGANG\nBAGI MAHASISWA\nMahasiswa harus melakukan pembimbingan sebelum dan saat pelaksanaan magang untuk memastikan pelaksanaan magang dan penulisan Laporan Magang dapat berjalan dengan baik.\nMahasiswa harus membuat Laporan Magang sesuai dengan pedoman penulisan Laporan Magang.\nMahasiswa menyerahkan Laporan Magang sesuai\ndengan jadwal atau kesepakatan dialokasikan oleh dosen pembimbing.\nMahasiswa harus memenuhi jumlah bimbingan minimal yang telah ditetapkan.\nMahasiswa harus memperhatikan etika berkomunikasi dan etika berperilaku dalam melakukan proses pembimbingan.\nBuku Petunjuk Teknis Magang\n41'
 '• BAB 5. REFLEKSI DIRI\n• Mahasiswa mendeskripsikan tentang hal-hal positif yang diterima selama perkuliahan yang bermanfaat / relevan terhadap pekerjaan selama magang.\n• Mahasiswa menjelaskan tentang manfaat magang terhadap pengembangan soft-skills dan kekurangan soft-skills yang dimilikinya.\n• Mahasiswa memberikan penjabaran tentang manfaat magang terhadap pengembangan kemampuan kognitif dan kekurangan kemampuan kognitif yang dimilikinya.\nBuku Petunjuk Teknis Magang\n49'
 '9.3\nETIKA BERPAKAIAN DI PERUSAHAAN\nMITRA MAGANG\n• Mahasiswa harus mengenakan pakaian yang formal dan sopan. Contoh pakaian formal adalah kemeja, celana atau rok, dari bahan kain. Pakaian yang dihindari adalah pakaian yang terbuat dari bahan kaos dan jeans. Mahasiswa juga harus menghindari pakaian yang terlalu longgar atau terlalu ketat.\n• Mahasiswa harus mengenakan pakaian yang sopan. Pakaian yang terlalu terbuka (seksi), seperti memakai pakaian bagian atas yang terlalu rendah, memakai rok yang terlalu pendek, atau pakaian bagian atas dan bagian bawah yang tembus pandang, harus dihindari.\n• Mahasiswa disarankan menggunakan sepatu. Penggunaan sandal saat pelaksanaan kegiatan magang harus dihindari. Sepatu yang digunakan sebaiknya tidak meng-ganggu mobilitas mahasiswa peserta magang dalam pelaksanaan magang.\n• Mahasiswa harus menghindari penggunaan aksesoris dan makeup yang berlebihan.\n09 Etika Magang\n\nLAMPIRAN']","1. Pelaksanaan Program Magang memiliki durasi minimal 1 bulan dan maksimal 6 bulan. 2. Selama Program Magang berlangsung, mahasiswa tidak harus mengajukan cuti. 3. Selama Program Magang berlangsung, mahasiswa secara penuh waktu bekerja di lapangan sesuai kesepakatan. 4. Mahasiswa bisa mendapatkan izin untuk melakukan kegiatan akademik tertentu, melalui pembicaraan dan kesepakatan dengan pihak Mitra Magang. 5. Mahasiswa dapat mengajukan konversi mata kuliah dengan Capaian Pembelajaran Mata Kuliah (CPMK) yang selaras dengan Program Magang. 6. Mahasiswa wajib dibimbing oleh pembimbing internal dari Dosen Departemen dan pembimbing lapangan dari Mitra Magang 7. Sebelum Program Magang berlangsung, mahasiswa, Departemen dan Mitra Magang wajib menandatangani perjanjian kerjasama dan nota kesepahaman.",0.0,0.0,0.999999999975,0.7777777777777778
2,Apa  Manfaat Program Magang bagi Mahasiswa,"Manfaat program magang bagi mahasiswa antara lain adalah sebagai berikut:
1. Mahasiswa dapat mendeskripsikan hal-hal positif yang diterima selama perkuliahan yang bermanfaat dan relevan terhadap pekerjaan selama magang.
2. Mahasiswa dapat menjelaskan manfaat magang terhadap pengembangan soft-skills dan mengidentifikasi kekurangan soft-skills yang dimilikinya.
3. Mahasiswa dapat memberikan penjabaran tentang manfaat magang terhadap pengembangan kemampuan kognitif dan mengidentifikasi kekurangan kemampuan kognitif yang dimilikinya.
4. Mahasiswa dapat menguraikan temuan-temuan terkait pembelajaran hal baru yang diperoleh selama magang, serta membandingkan kegiatan magang dengan teori atau konsep yang telah dipelajari.
5. Mahasiswa dapat menyampaikan kendala yang dihadapi selama magang.
6. Mahasiswa dapat merumuskan kesimpulan dari keseluruhan pengalaman magang dan memberikan saran atau rekomendasi bagi mitra magang dan mahasiswa angkatan berikutnya dalam program magang.","['• BAB 5. REFLEKSI DIRI\n• Mahasiswa mendeskripsikan tentang hal-hal positif yang diterima selama perkuliahan yang bermanfaat / relevan terhadap pekerjaan selama magang.\n• Mahasiswa menjelaskan tentang manfaat magang terhadap pengembangan soft-skills dan kekurangan soft-skills yang dimilikinya.\n• Mahasiswa memberikan penjabaran tentang manfaat magang terhadap pengembangan kemampuan kognitif dan kekurangan kemampuan kognitif yang dimilikinya.\nBuku Petunjuk Teknis Magang\n49'
 'Uraian mengenai teori atau metode harus menyebutkan referensi yang valid dan handal.\n3.3. Pembelajaran Hal Baru\n• Mahasiswa dapat menguraikan temuan-temuan terkait pembelajaran hal baru yang dapat selama magang. Mahasiswa juga dapat membandingkan kegiatan magang yang dilaksanakan / ditemukan dengan teori atau konsep yang telah dipelajari. Mahasiswa juga dapat menyampaikan kendala yang dihadapi selama\nmagang.\n• BAB 4. KESIMPULAN DAN SARAN\nKesimpulan berisi ringkasan terhadap keseluruhan laporan, termasuk pembelajar-an apa yang didapat selama magang. Saran atau rekomendasi merupakan bahan masukan bagi mitra magang yang telah dijadikan lokasi Magang, maupun bagi mahasiswa angkatan berikutnya dalam menentukan spesifikasi dalam program Magang.\n• BAB 5. REFLEKSI DIRI\n• Mahasiswa mendeskripsikan tentang hal-hal positif yang diterima selama perkuliahan yang bermanfaat / relevan terhadap pekerjaan selama magang.'
 'Beberapa ketentuan yang perlu diperhatikan khususnya oleh mahasiswa peserta magang dalam merencanakan dan melaksanakan ujian presentasi Laporan Magang sebagai berikut:\n• Ujian Presentasi Laporan Magang dilaksanakan oleh mahasiswa yang telah menyelesaikan penyusunan karya akhir Laporan Magang yang sudah disetujui oleh pembimbing magang.\n• Ujian Presentasi Magang dilaksanakan setelah berkas penilaian kinerja magang sudah diisi oleh unit tempat magang dan sudah diterima oleh program studi.\n• Ujian Presentasi Magang akan dilakukan di ruang ujian Sidang atau di ruang kelas.\n• Untuk dapat mengikuti Ujian Presentasi Magang, mahasiswa harus mengajukan Permohonan Ujian Presentasi Magang sesuai jadwal yang ditetapkan oleh Program Studi.\n• Ujian Presentasi Magang akan diuji oleh 3 (tiga) orang dosen penguji, salah satunya dosen pembimbing magang dan berlangsung sekitar 1,5 jam termasuk sesi untuk tanya jawab.'
 '7.5\nKETENTUAN ISI LAPORAN MAGANG\n• BAB 1. PENDAHULUAN\n1.1. Latar Belakang, meliputi\n• Mahasiswa menguraikan latar belakang (argumen / alasan) dari topik yang dipilih dalam Laporan Magang ini.\n• Latar belakang harus menunjukkan urgensi dari topik yang dipilih. Urgensi misal-nya ditunjukkan oleh keunikan topik (isu mutakhir), keunikan industri, permasalah-an atau risiko yang ditimbulkan, atau perbedaan pendapat.\n1.2. Tujuan Magang, meliputi\n• Mencerminkan hal-hal yang akan diuraikan di bab analisis.\n1.3. Manfaat Magang, meliputi\n• Manfaat untuk ITS\n• Manfaat untuk Mitra Magang\n• Manfaat untuk Mahasiswa\n1.4. Mahasiswa menguraikan tujuan penulisan topik magang.\n• Tujuan harus mencerminkan hal-hal yang akan diuraikan di bab analisis.\n• BAB 2. PROFIL MITRA MAGANG\n2.1. Sejarah Mitra Magang\n• Mahasiswa menguraikan sejarah mitra magang secara umum serta spesifik (unit / divisi terkait) yang menjadi konteks dari topik yang dipilih.\n2.2. Struktur Organisasi Mitra Magang']",• Sarana mengaplikasikan ilmu di dalam kelas perkuliahan ke dunia kerja. • Sarana mengetahui dan mempelajari proses industri. • Berinteraksi langsung dengan mitra magang. • Sarana memperoleh bahan tugas akhir. • Menyelesaikan SKS mata kuliah.,0.9224563816250423,0.0,0.9166666666361111,1.0
3,Berapa perhitugan 1 sks magang dalam jam kerja?,Saya tidak tahu.,"['3\nDisiplin dalam menyelesaikan pekerjaan\n10\n\n\n4\nTanggung jawab\n15\n\n\n5\nKeahlian / Keterampilan dalam Berprofesi\n20\n\n\n6\nKreatifitas / Inovasi\nST\n\n\n7\nSikap dan Perilaku dalam Bekerja\n10\n\n\n8\nKemampuan Bekerjasama Dalam Tim\n5\n\n\nJUMLAH\n100\n\n\nNILAI AKHIR =\nJUMLAH (B X N)\nJUMLAH BOBOT\n100\nSurabaya,\nPembimbing Lapangan\nBuku Petunjuk Teknis Magang\n67'
 '6. Jarak Spasi\n1 (satu)\n• SISTEMATIKA LAPORAN MAGANG\nCover Luar\nCover Dalam\nLembar Pengesahan\nKata Pengantar\nDaftar Isi\nDaftar Gambar\nDaftar Tabel\nBAB 1. PENDAHULUAN\n1.1. Latar Belakang\n1.2. Tujuan Magang\n1.3. Manfaat Magang\n1.4. Mahasiswa menguraikan tujuan penulisan topik magang.\nBAB 2. PENDAHULUAN\n2.1. Sejarah Mitra Magang\n2.2. Struktur Organisasi Mitra Magang\n2.3. Visi dan Misi Perusahaan\n2.4. Kegiatan Produksi (barang/jasa) (jika ada)\nBAB 3. PELAKSANAAN MAGANG\n3.1 Posisi / kedudukan kegiatan Magang\n3.2 Metodologi penyelesaian Tugas\n3.3 Pembelajaran Hal Baru\nBAB 4. KESIMPULAN DAN SARAN\nBAB 5. REFLEKSI DIRI\nLAMPIRAN\nBuku Petunjuk Teknis Magang\n47'
 '6.1\nKRITERIA DOSEN PEMBIMBING MAGANG\nW888\nDosen yang telah mengajar selama 4 semester berturut-turut.\nMemperoleh SK Pembimbing Magang dari Departemen dan ketetapan melalui\nKeputusan Dekan.\n6.2\nRINCIAN TUGAS DOSEN PEMBIMBING\nMAGANG\n• Memberikan saran dan masukan saat konsultasi keilmuan jika diperlukan oleh mahasiswa selama magang.\n• Melakukan kegiatan pembimbingan bagi mahasiswa magang untuk dapat berkonsultasi selama magang atau bimbingan penulisan laporan magang.\n• Memberikan persetujuan dan penilaian Laporan Magang.\n• Memberikan penilaian dapat dilakukan dalam bentuk penilaian laporan magang dan atau presentasi kegiatan magang.\n40\n06 Pembimbingan Magang'
 '• Ujian Presentasi Magang akan diuji oleh 3 (tiga) orang dosen penguji, salah satunya dosen pembimbing magang dan berlangsung sekitar 1,5 jam termasuk sesi untuk tanya jawab.\n• Dalam melakukan presentasi, mahasiswa peserta magang harus menyiapkan bahan presentasi sebanyak 10 slides (minimum) sampai dengan 20 slides (maksimum).\nJumlah tersebut untuk memaparkan hasil-hasil magang dan tidak termasuk lampiran tabel, gambar, perhitungan, dan sebagainya.\n• Setelah presentasi Laporan Magang, dosen pembimbing dan dosen lain yang ditunjuk (tim penguji) mengajukan pertanyaan yang bersifat komprehensif.\n• Pertanyaan yang bersifat komprehensif adalah pertanyaan-pertanyaan yang terkait dengan Laporan Magang dan teori terkait topik yang diangkat dalam Laporan Magang.\n56\n08 Penilaian Magang']",setara dengan kerja 45 jam,0.9734040160976182,0.2,0.7499999999625,0.0
4,Bagaimana Proses pengajuan konversi kegiatan magang dengan MK yang setara CPMK-nya?,"Proses pengajuan konversi kegiatan magang dengan MK yang setara CPMK-nya dimulai dengan mengisi Form Pengajuan Konversi Mata Kuliah yang mencakup informasi seperti nomor NRP Mahasiswa, semester, tahun, laporan magang, rincian tugas kegiatan magang, judul kegiatan magang, perusahaan tempat magang, dan detail mitra magang. Setelah itu, surat permohonan konversi magang diajukan kepada Kepala Departemen yang bersangkutan di ITS. Surat permohonan tersebut harus mencantumkan informasi lengkap mengenai kegiatan magang yang dilakukan, termasuk nama perusahaan tempat magang, alamat perusahaan, nomor telepon, email perusahaan, nama pembimbing lapangan, dan nomor HP pembimbing lapangan.

Selain itu, mahasiswa juga harus melampirkan laporan magang dan/atau rincian kegiatan magang sebagai bukti pelaksanaan kegiatan magang. Setelah semua persyaratan terpenuhi, mahasiswa dapat mengajukan permohonan konversi mata kuliah untuk kegiatan magang tersebut. Proses selanjutnya akan melibatkan penilaian prestasi kinerja magang oleh unit mitra magang, di mana mahasiswa akan mendapatkan penilaian dari atasan yang berwenang di tempat magang. Formulir penilaian magang yang sudah terisi kemudian akan dikirim langsung ke Departemen untuk proses selanjutnya.","['• LAMPIRAN 6: Form Pengajuan Konversi Mata Kuliah\nNomor ........(NRP Mahasiswa)/(Semester)/2020\nLampiran : 1 (satu eks) laporan Magang/ Rincian Tugas Kegiatan magang\nPerihal : Surat Permohonan Konversi Magang\n(Tanggal Surat)\nKepada Yth\n: Kepala Departemen (Nama Departemen)\ndi ITS\nDengan hormat,\nSehubungan dengan pelaksanaan kegiatan Magang, saya yang bertanda tangan di bawah ini:\nNama Mahasiswa\nNRP\nDepartemen\nNo HP\nAlamat email\nmengajukan permohonan konversi Mata Kuliah untuk kegiatan Magang (Judul Kegiatan Magang) di (Perusahaan Tempat Magang) yang sedang/telah*) dilakukan pada .......d.......\n.... Adapun\ndetail mitra magang sebagai berikut :\nNama Perusahaan Tempat Magang\nAlamat Perusahaan Tempat\nMagang\nNo Telp Perusahaan Tempat\nMagang\nEmail perusahan\nNama Pembimbing Lapangan\nNo HP Pembimbing Lapangan\n....\nBerikut kami lampirkan Laporan Magang dan atau Rincian Kegiatan Magang.\nDemikian surat permohonan ini saya buat, atas perhatiannya saya sampaikan terima kasih.\nSurabaya,'
 'kepentingan yang dilakukan oleh organisasi tersebut (misalnya melalui produk atau jasa yang dihasilkan).\n• BAB 3. PELAKSANAAN MAGANG\n3.1. Posisi / Kedudukan Kegiatan Magang\n• Mahasiswa dapat menguraikan kedudukan / posisi kegiatan yang ditugaskan oleh mitra magang dalam lingkup pekerjaan / proyek keseluruhan. Hal ini dimaksudkan untuk mengetahui apakah mahasiswa memahami kaitan antara apa yang telah dilakukan / dihasilkan dengan pekerjaan tersebut.\n3.2. Metodologi penyelesaian Tugas\n• Mahasiswa menguraikan kasus / masalah menjadi topik pembahasan. Mahasiswa menganalisis kasus / masalah tersebut dengan menggunakan teori atau metode yang relevan. Analisis bukan mendeskripsikan teori, namun menggunakan teori guna menjelaskan dan membandingkan dengan kasus/masalah yang diangkat.\nUraian mengenai teori atau metode harus menyebutkan referensi yang valid dan handal.\n3.3. Pembelajaran Hal Baru'
 '4. Hasil penilaian dilakukan dengan cara mengisi formulir yang ada dan diserahkan\npada departemen.\n8.2\nPENILAIAN PRESTASI KINERJA MAGANG\nOLEH UNIT MITRA MAGANG\nDalam melakukan kegiatan magang, mahasiswa akan memperoleh penilaian dari unit tempat magang. Formulir penilaian magang diisi dan ditandatangani oleh atasan yang berwenang di tempat magang (minimal level manajer) dan dicap menggunakan stempel unit tempat magang. Berikut adalah butir penilaian kinerja magang:\n52\n08 Penilaian Magang'
 'Inisiatif\nKemampuan komunikasi (lisan dan tulisan)\nDisiplin\nPenampilan\nKetekunan\nKemampuan teknikal\nBerpikir kritis, kreatif dan analitis\nKemampuan bekerjasama\ndalam tim Kemampuan\nberadaptasi\n凸\nHasil pekerjaan (kontribusi)\nSedangkan mekanisme pengiriman formulir penilaian magang dari unit tempat magang adalah sebagai berikut:\nこと\nFormulir kosong serta amplop balasan yang sudah bertuliskan alamat Departemen disampaikan oleh mahasiswa magang kepada atasan yang berwenang.\nFormulir penilaian yang sudah terisi dimasukkan ke dalam amplop tertutup dan dikirim langsung ke Departemen.\nBuku Petunjuk Teknis Magang\n53\n\n8.3\nPENILAIAN PENULISAN LAPORAN\nMAGANG\nButir penilaian Laporan Magang mencakup aspek sebagai berikut:\n2. Tugas mahasiswa selama magang\ndijelaskan dengan baik dan relevan\nDeskripsi proses kegiatan\nmagang yang dilakukan\n1. Gambaran umum Mitra Magang\ndengan Departemen.\n\njelas.']","• Subdirektorat PK2 akan menyampaikan rencana kegiatan selama magang yang diterima dari mitra magang kepada departemen dimana mahasiswa magang berasal. • Departemen akan melakukan verifikasi dan validasi untuk menilai mata kuliah apa saja yang CPMK-nya selaras dengan kegiatan magang berdasarkan rencana kegiatan magang dan akan berdiskusi dengan mitra magang jika diperlukan untuk mendapat-kan penjelasan lebih detail. • Departemen akan menyampaikan ke mahasiswa hasil verifikasi berupa daftar MK yang dapat dikonversikan dengan kegiatan magang. • Mahasiswa harus mengisi FRS dengan Mata Kuliah yang akan dikonversikan dengan Kegiatan Magang pada semester yang sama, atau mahasiswa bersama dosen wali akan melakukan revisi paling lambat minggu ke 4 perkuliahan jika jadwal FRS sudah terlampaui.",0.0,0.0,0.999999999975,1.0
5,Bagaimana SOP konversi mata kuliah untuk magang mandiri?,"SOP konversi mata kuliah untuk magang mandiri meliputi beberapa langkah yang harus dilakukan oleh mahasiswa yang ingin mengkonversi mata kuliah berdasarkan kegiatan magang yang dilakukan. Langkah-langkah tersebut antara lain:

1. Mengajukan permohonan konversi mata kuliah dengan mengisi Form Pengajuan Konversi Mata Kuliah yang telah disediakan. Form ini biasanya berisi informasi mengenai nama mahasiswa, NRP, departemen, periode magang, detail mitra magang, dan laporan magang atau rincian tugas kegiatan magang.

2. Surat permohonan konversi magang kemudian diajukan kepada Kepala Departemen yang bersangkutan di institusi tempat mahasiswa melakukan magang.

3. Setelah permohonan disetujui, mahasiswa berhak untuk mendapatkan konversi mata kuliah dan SKS berdasarkan hasil telaah dan analisa dengan bidang akademik departemen. Konversi ini biasanya dilakukan pada semester tertentu dalam tahun ajaran yang bersangkutan.

4. Mata kuliah yang dapat dikonversikan dengan kegiatan magang biasanya tercantum dalam Form Persetujuan Konversi Mata Kuliah. Form ini berisi informasi mengenai mata kuliah konversi, jumlah SKS yang dapat dikonversikan, dan total SKS yang akan diperoleh setelah konversi.

5. Proses konversi mata kuliah untuk magang mandiri harus dilakukan sesuai dengan prosedur yang berlaku di institusi pendidikan yang bersangkutan dan disetujui oleh pihak terkait seperti Kepala Departemen.

Demikianlah SOP konversi mata kuliah untuk magang mandiri yang harus diikuti oleh mahasiswa yang ingin mengkonversi mata kuliah berdasarkan kegiatan magang yang dilakukan.","['• LAMPIRAN 8: Form Persetujuan Konversi Mata Kuliah\nLAMPIRAN 1\nKOP Departemen\nNo\n:....\nLampiran :\nPerihal :.\nKepada yth :\nDosen Wali Departemen ...\nFakultas...\nITS\nSehubungan dengan adanya permohonan konversi mata kuliah dari mahasiswa peserta magang dengan detail sebagai berikut :\nNama\nNRP\nNama Mitra Magang :\nPeriode magang\nMahasiswa yang bersangkutan akan/ telah *) melakukan magang dengan rincian tugas sebagai berikut :\nBerdasarkan hasil telaah dan analisa dengan bidang akademik departemen, maka mahasiswa yang bersangkutan berhak untuk mendapatkan konversi mata kuliah dan SKS, dimana konversi ini akan di lakukan pada semester..... tahun ajaran ....\n.......Adapun mata kuliah yang dapat dikonversikan dengan\nkegiatan magang adalah sebagai berikut :\nNo.\nMata Kuliah Konversi\nJumlah SKS\n\n\n\n\n\n\n\n\n\nTotal SKS\n\nSurabaya, ....\n*) dicoret\nKepala Departemen ....\n70\nLampiran\n\nSUBDIREKTORAT PENGEMBANGAN KEWIRAUSAHAAN DAN KARIR\nDIREKTORAT KEMAHASISWAAN\nINSTITUT TEKNOLOGI SEPULUH NOPEMBER\n2020'
 '• LAMPIRAN 6: Form Pengajuan Konversi Mata Kuliah\nNomor ........(NRP Mahasiswa)/(Semester)/2020\nLampiran : 1 (satu eks) laporan Magang/ Rincian Tugas Kegiatan magang\nPerihal : Surat Permohonan Konversi Magang\n(Tanggal Surat)\nKepada Yth\n: Kepala Departemen (Nama Departemen)\ndi ITS\nDengan hormat,\nSehubungan dengan pelaksanaan kegiatan Magang, saya yang bertanda tangan di bawah ini:\nNama Mahasiswa\nNRP\nDepartemen\nNo HP\nAlamat email\nmengajukan permohonan konversi Mata Kuliah untuk kegiatan Magang (Judul Kegiatan Magang) di (Perusahaan Tempat Magang) yang sedang/telah*) dilakukan pada .......d.......\n.... Adapun\ndetail mitra magang sebagai berikut :\nNama Perusahaan Tempat Magang\nAlamat Perusahaan Tempat\nMagang\nNo Telp Perusahaan Tempat\nMagang\nEmail perusahan\nNama Pembimbing Lapangan\nNo HP Pembimbing Lapangan\n....\nBerikut kami lampirkan Laporan Magang dan atau Rincian Kegiatan Magang.\nDemikian surat permohonan ini saya buat, atas perhatiannya saya sampaikan terima kasih.\nSurabaya,'
 'Uraian mengenai teori atau metode harus menyebutkan referensi yang valid dan handal.\n3.3. Pembelajaran Hal Baru\n• Mahasiswa dapat menguraikan temuan-temuan terkait pembelajaran hal baru yang dapat selama magang. Mahasiswa juga dapat membandingkan kegiatan magang yang dilaksanakan / ditemukan dengan teori atau konsep yang telah dipelajari. Mahasiswa juga dapat menyampaikan kendala yang dihadapi selama\nmagang.\n• BAB 4. KESIMPULAN DAN SARAN\nKesimpulan berisi ringkasan terhadap keseluruhan laporan, termasuk pembelajar-an apa yang didapat selama magang. Saran atau rekomendasi merupakan bahan masukan bagi mitra magang yang telah dijadikan lokasi Magang, maupun bagi mahasiswa angkatan berikutnya dalam menentukan spesifikasi dalam program Magang.\n• BAB 5. REFLEKSI DIRI\n• Mahasiswa mendeskripsikan tentang hal-hal positif yang diterima selama perkuliahan yang bermanfaat / relevan terhadap pekerjaan selama magang.'
 '• BAB 5. REFLEKSI DIRI\n• Mahasiswa mendeskripsikan tentang hal-hal positif yang diterima selama perkuliahan yang bermanfaat / relevan terhadap pekerjaan selama magang.\n• Mahasiswa menjelaskan tentang manfaat magang terhadap pengembangan soft-skills dan kekurangan soft-skills yang dimilikinya.\n• Mahasiswa memberikan penjabaran tentang manfaat magang terhadap pengembangan kemampuan kognitif dan kekurangan kemampuan kognitif yang dimilikinya.\nBuku Petunjuk Teknis Magang\n49']",Melaporkan kegiatan magang Mengupdate data magang Mengajukan permohonan konversi MK Melakukan telaah dan verifikasi bersama tim akademik departemen Menerima hasil telaah MK yang dikonversikan dengan Magang Melakukan FRS / Perubahan FRS Dosen wali mengetahui dan menyetujui FRS / Perubahan FRS di semester yang sama / di semester depan,0.9937923336450943,0.0,0.999999999975,
6,Apa itu Program Magang Mahasiswa Bersertifikat (PMMB) ?,"Program Magang Mahasiswa Bersertifikat (PMMB) adalah program yang memungkinkan mahasiswa untuk melakukan magang di perusahaan atau lembaga tertentu sebagai bagian dari pengembangan diri, karir, dan pendidikan selanjutnya. Dalam program ini, mahasiswa diharapkan untuk memberikan penjabaran mengenai rencana perbaikan atau pengembangan diri, serta menyampaikan laporan magang yang mencakup berbagai aspek seperti sejarah mitra magang, struktur organisasi mitra magang, visi dan misi perusahaan, kegiatan produksi (barang/jasa), pembelajaran hal baru, kesimpulan dan saran, serta refleksi diri. Selain itu, mahasiswa juga diharapkan untuk melampirkan dokumen-dokumen pendukung seperti absensi, laporan logbook kegiatan harian, struktur organisasi lembaga tempat magang, sertifikat magang, dan lain sebagainya. Penilaian terhadap kinerja magang mahasiswa juga dilakukan oleh unit tempat magang melalui formulir penilaian yang diisi dan ditandatangani oleh atasan yang berwenang di tempat magang.","['• Mahasiswa memberikan penjabaran mengenai rencana perbaikan / pengembangan diri, karir, dan pendidikan selanjutnya.\n• LAMPIRAN\n• Berisi naskah atau dokumen yang perlu disampaikan untuk mendukung dan menguatkan laporan.\n• Lampiran wajib berupa absensi dan,\n• Laporan logbook kegiatan harian yang ditandatangani oleh pembimbing lapangan.\n• Lampiran penunjang dapat berupa struktur organisasi lembaga tempat magang, prosedur atau proses kerja, foto-foto dan sebagainya.\n• Sertifikat magang.\n50\n07 Pedoman Penulisan Laporan Magang\n\nBARAT\nTH\nHARI LISTRIK NASIONAL\nPLN\nPL\nN\n08\nPENILAIAN\nMAGANG'
 '• Mahasiswa menguraikan sejarah mitra magang secara umum serta spesifik (unit / divisi terkait) yang menjadi konteks dari topik yang dipilih.\n2.2. Struktur Organisasi Mitra Magang\n• Mahasiswa dapat menjelaskan struktur organisasi Mitra Magang secara umum yaitu dapat mencakup struktur organisasi, proses bisnis, ketentuan/peraturan terkait, dan sejenisnya.\n2.3. Visi dan Misi Perusahaan\n• Mahasiswa dapat menjelaskan Visi Misi Mitra Magang secara umum\n2.4. Kegiatan Produksi (barang/jasa) (jika ada)\n• Mahasiswa dapat menjelaskan proses penciptaan nilai untuk pemangku\n48\n07 Pedoman Penulisan Laporan Magang'
 '4. Hasil penilaian dilakukan dengan cara mengisi formulir yang ada dan diserahkan\npada departemen.\n8.2\nPENILAIAN PRESTASI KINERJA MAGANG\nOLEH UNIT MITRA MAGANG\nDalam melakukan kegiatan magang, mahasiswa akan memperoleh penilaian dari unit tempat magang. Formulir penilaian magang diisi dan ditandatangani oleh atasan yang berwenang di tempat magang (minimal level manajer) dan dicap menggunakan stempel unit tempat magang. Berikut adalah butir penilaian kinerja magang:\n52\n08 Penilaian Magang'
 'Uraian mengenai teori atau metode harus menyebutkan referensi yang valid dan handal.\n3.3. Pembelajaran Hal Baru\n• Mahasiswa dapat menguraikan temuan-temuan terkait pembelajaran hal baru yang dapat selama magang. Mahasiswa juga dapat membandingkan kegiatan magang yang dilaksanakan / ditemukan dengan teori atau konsep yang telah dipelajari. Mahasiswa juga dapat menyampaikan kendala yang dihadapi selama\nmagang.\n• BAB 4. KESIMPULAN DAN SARAN\nKesimpulan berisi ringkasan terhadap keseluruhan laporan, termasuk pembelajar-an apa yang didapat selama magang. Saran atau rekomendasi merupakan bahan masukan bagi mitra magang yang telah dijadikan lokasi Magang, maupun bagi mahasiswa angkatan berikutnya dalam menentukan spesifikasi dalam program Magang.\n• BAB 5. REFLEKSI DIRI\n• Mahasiswa mendeskripsikan tentang hal-hal positif yang diterima selama perkuliahan yang bermanfaat / relevan terhadap pekerjaan selama magang.']",Program Magang Mahasiswa Bersertifikat (PMMB) merupakan program magang yang bekerjasama dengan Forum Human Capital Indonesia (FHCI).,0.9164508608547481,0.14285714285714285,0.9166666666361111,1.0
7,"Apa peran Subdirektorat Pengembangan Kewirausahaan dan
Karir (PK2) dalam penyelenggaraan Program Magang?","Subdirektorat Pengembangan Kewirausahaan dan Karir (PK2) memiliki peran dalam penyelenggaraan Program Magang dengan menerima Laporan Magang yang diserahkan oleh mahasiswa setelah magang selesai. Laporan Magang tersebut harus diserahkan dalam bentuk softcopy melalui SIM Magang ke Subdirektorat PK2 Direktorat Kemahasiswaan. Subdirektorat PK2 juga bertanggung jawab untuk memastikan bahwa Laporan Magang yang diserahkan sesuai dengan ketentuan yang ada dalam pedoman, serta memuat informasi yang benar dan obyektif.","['7.2\nKETENTUAN UMUM DALAM PENULISAN\nLAPORAN MAGANG\n• Laporan Magang ditulis dan dipresentasikan pada akhir magang (jika diperlukan).\n• Laporan Magang selain diserahkan ke departemen dan mitra magang, juga diserahkan ke Subdirektorat PK2 Direktorat Kemahasiswaan dalam bentuk softcopy melalui SIM Magang.\n7.3\nPRINSIP PENULISAN LAPORAN\nMAGANG\n• BENAR DAN OBYEKTIF\nLaporan magang harus sesuai dengan ketentuan yang ada dalam pedoman ini serta memuat informasi yang benar dan obyektif.\n• JELAS DAN CERMAT\nLaporan magang harus mudah dimengerti / dipahami oleh pembaca, dengan cara menghindari pemakaian kata / istilah, rangkaian kata / kalimat atau gaya bahasa yang kurang dapat dipahami oleh pembaca maupun penulisnya sendiri. Gunakan kata-kata yang sederhana tetapi jelas maksudnya.\n• LANGSUNG KE SASARAN'
 'kepentingan yang dilakukan oleh organisasi tersebut (misalnya melalui produk atau jasa yang dihasilkan).\n• BAB 3. PELAKSANAAN MAGANG\n3.1. Posisi / Kedudukan Kegiatan Magang\n• Mahasiswa dapat menguraikan kedudukan / posisi kegiatan yang ditugaskan oleh mitra magang dalam lingkup pekerjaan / proyek keseluruhan. Hal ini dimaksudkan untuk mengetahui apakah mahasiswa memahami kaitan antara apa yang telah dilakukan / dihasilkan dengan pekerjaan tersebut.\n3.2. Metodologi penyelesaian Tugas\n• Mahasiswa menguraikan kasus / masalah menjadi topik pembahasan. Mahasiswa menganalisis kasus / masalah tersebut dengan menggunakan teori atau metode yang relevan. Analisis bukan mendeskripsikan teori, namun menggunakan teori guna menjelaskan dan membandingkan dengan kasus/masalah yang diangkat.\nUraian mengenai teori atau metode harus menyebutkan referensi yang valid dan handal.\n3.3. Pembelajaran Hal Baru'
 '6.1\nKRITERIA DOSEN PEMBIMBING MAGANG\nW888\nDosen yang telah mengajar selama 4 semester berturut-turut.\nMemperoleh SK Pembimbing Magang dari Departemen dan ketetapan melalui\nKeputusan Dekan.\n6.2\nRINCIAN TUGAS DOSEN PEMBIMBING\nMAGANG\n• Memberikan saran dan masukan saat konsultasi keilmuan jika diperlukan oleh mahasiswa selama magang.\n• Melakukan kegiatan pembimbingan bagi mahasiswa magang untuk dapat berkonsultasi selama magang atau bimbingan penulisan laporan magang.\n• Memberikan persetujuan dan penilaian Laporan Magang.\n• Memberikan penilaian dapat dilakukan dalam bentuk penilaian laporan magang dan atau presentasi kegiatan magang.\n40\n06 Pembimbingan Magang'
 '• Memberikan arahan dalam penyelesaian revisi Laporan Magang.\nB. Dosen pembimbing harus memastikan bahwa Laporan Magang bebas dari plagiarisme.\n6.5\nPENGGANTIAN DOSEN PEMBIMBING\nMAGANG\n• Penggantian dosen pembimbing magang harus didasarkan pada alasan yang dapat dipertanggungjawabkan.\n• Pengajuan permohonan penggantian dosen pembimbing magang dapat dilakukan selambat-lambatnya 2 (dua) bulan setelah magang dimulai.\n• Penggantian dosen pembimbing magang harus dengan persetujuan dari Kepala\nDepartemen.\n42\n06 Pembimbingan Magang']",1. Sebagai koordinator dalam penyelenggaraan Program Magang. 2. Menyusun kebijakan terkait magang untuk memfasilitasi kegiatan pembelajaran akademik dan Program Magang. 3. Mengkoordinasikan penyusunan Perjanjian Kerja Sama (PKS) dengan Mitra Magang. 4. Menginisiasi kerjasama magang dengan mitra magang,0.9309299129949965,0.0,0.999999999975,1.0
8,Bagaimana skema waktu pelaksanaan program magang?,"Skema waktu pelaksanaan program magang adalah sebagai berikut:
1. Ujian Presentasi Laporan Magang dilaksanakan setelah mahasiswa menyelesaikan penyusunan karya akhir Laporan Magang yang disetujui oleh pembimbing magang.
2. Ujian Presentasi Magang dilaksanakan setelah berkas penilaian kinerja magang diisi oleh unit tempat magang dan diterima oleh program studi.
3. Ujian Presentasi Magang dilakukan di ruang ujian Sidang atau di ruang kelas.
4. Mahasiswa harus mengajukan Permohonan Ujian Presentasi Magang sesuai jadwal yang ditetapkan oleh Program Studi.
5. Ujian Presentasi Magang akan diuji oleh 3 (tiga) orang dosen penguji, termasuk dosen pembimbing magang, dan berlangsung sekitar 1,5 jam termasuk sesi tanya jawab.","['Beberapa ketentuan yang perlu diperhatikan khususnya oleh mahasiswa peserta magang dalam merencanakan dan melaksanakan ujian presentasi Laporan Magang sebagai berikut:\n• Ujian Presentasi Laporan Magang dilaksanakan oleh mahasiswa yang telah menyelesaikan penyusunan karya akhir Laporan Magang yang sudah disetujui oleh pembimbing magang.\n• Ujian Presentasi Magang dilaksanakan setelah berkas penilaian kinerja magang sudah diisi oleh unit tempat magang dan sudah diterima oleh program studi.\n• Ujian Presentasi Magang akan dilakukan di ruang ujian Sidang atau di ruang kelas.\n• Untuk dapat mengikuti Ujian Presentasi Magang, mahasiswa harus mengajukan Permohonan Ujian Presentasi Magang sesuai jadwal yang ditetapkan oleh Program Studi.\n• Ujian Presentasi Magang akan diuji oleh 3 (tiga) orang dosen penguji, salah satunya dosen pembimbing magang dan berlangsung sekitar 1,5 jam termasuk sesi untuk tanya jawab.'
 'Uraian mengenai teori atau metode harus menyebutkan referensi yang valid dan handal.\n3.3. Pembelajaran Hal Baru\n• Mahasiswa dapat menguraikan temuan-temuan terkait pembelajaran hal baru yang dapat selama magang. Mahasiswa juga dapat membandingkan kegiatan magang yang dilaksanakan / ditemukan dengan teori atau konsep yang telah dipelajari. Mahasiswa juga dapat menyampaikan kendala yang dihadapi selama\nmagang.\n• BAB 4. KESIMPULAN DAN SARAN\nKesimpulan berisi ringkasan terhadap keseluruhan laporan, termasuk pembelajar-an apa yang didapat selama magang. Saran atau rekomendasi merupakan bahan masukan bagi mitra magang yang telah dijadikan lokasi Magang, maupun bagi mahasiswa angkatan berikutnya dalam menentukan spesifikasi dalam program Magang.\n• BAB 5. REFLEKSI DIRI\n• Mahasiswa mendeskripsikan tentang hal-hal positif yang diterima selama perkuliahan yang bermanfaat / relevan terhadap pekerjaan selama magang.'
 '• LANGSUNG KE SASARAN\nLaporan magang harus tepat, padat dan langsung ke pokok persoalannya. Uraian sebaiknya tidak terlalu panjang atau menggunakan kata-kata kiasan hanya sekedar untuk memberi kesan bahwa laporan itu tebal (laporan tebal tidak selalu berarti bagus).\n• LENGKAP\nLaporan magang harus disajikan secara lengkap dalam bentuk uraian menyeluruh berdasarkan data terpilih dengan disertai data penunjang yang diperlukan. Oleh karena itu Laporan Magang harus memuat seluruh materi magang yang dikerjakan mahasiswa (bukan seluruh materi proyek / kegiatan) dan tidak menimbulkan masalah, persoalan, atau pertanyaan baru, disertai data penunjang, misalnya grafik, tabel, peta, skema, dan lain-lain bila diperlukan.\nBuku Petunjuk Teknis Magang\n45'
 '6.1\nKRITERIA DOSEN PEMBIMBING MAGANG\nW888\nDosen yang telah mengajar selama 4 semester berturut-turut.\nMemperoleh SK Pembimbing Magang dari Departemen dan ketetapan melalui\nKeputusan Dekan.\n6.2\nRINCIAN TUGAS DOSEN PEMBIMBING\nMAGANG\n• Memberikan saran dan masukan saat konsultasi keilmuan jika diperlukan oleh mahasiswa selama magang.\n• Melakukan kegiatan pembimbingan bagi mahasiswa magang untuk dapat berkonsultasi selama magang atau bimbingan penulisan laporan magang.\n• Memberikan persetujuan dan penilaian Laporan Magang.\n• Memberikan penilaian dapat dilakukan dalam bentuk penilaian laporan magang dan atau presentasi kegiatan magang.\n40\n06 Pembimbingan Magang']",Program Mahasiswa Magang Bersertifikat (PMMB) • Magang dilaksanakan maksimal 6 bulan • Magang dilaksanakan 2 periode dalam 1 tahun yaitu 1. Periode Febuari - Agustus 2. Periode September - Januari Program Mahasiswa Magang Kerjasama • Magang dilaksanakan sekurang-kurangnya 1 bulan maksimal 6 bulan • Magang dilaksanakan setiap saat sesuai dengan kesepakatan dengan Mitra Magang. Program Magang Mandiri • Magang dilaksanakan sekurang-kurangnya 1 bulan dan maksimal 6 bulan • Magang dilaksanakan setiap saat sesuai dengan kesepakatan dengan Mitra Magang.,0.9942840000819594,0.75,0.5833333333041666,1.0
9,Apa saja rincian tugas dosen pembimbing magang?,"Rincian tugas dosen pembimbing magang meliputi:
1. Memberikan saran dan masukan saat konsultasi keilmuan jika diperlukan oleh mahasiswa selama magang.
2. Melakukan kegiatan pembimbingan bagi mahasiswa magang untuk dapat berkonsultasi selama magang atau bimbingan penulisan laporan magang.
3. Memberikan persetujuan dan penilaian Laporan Magang.
4. Memberikan penilaian dapat dilakukan dalam bentuk penilaian laporan magang dan atau presentasi kegiatan magang.
5. Memberikan arahan dalam penyelesaian revisi Laporan Magang.
6. Memastikan bahwa Laporan Magang bebas dari plagiarisme.","['6.1\nKRITERIA DOSEN PEMBIMBING MAGANG\nW888\nDosen yang telah mengajar selama 4 semester berturut-turut.\nMemperoleh SK Pembimbing Magang dari Departemen dan ketetapan melalui\nKeputusan Dekan.\n6.2\nRINCIAN TUGAS DOSEN PEMBIMBING\nMAGANG\n• Memberikan saran dan masukan saat konsultasi keilmuan jika diperlukan oleh mahasiswa selama magang.\n• Melakukan kegiatan pembimbingan bagi mahasiswa magang untuk dapat berkonsultasi selama magang atau bimbingan penulisan laporan magang.\n• Memberikan persetujuan dan penilaian Laporan Magang.\n• Memberikan penilaian dapat dilakukan dalam bentuk penilaian laporan magang dan atau presentasi kegiatan magang.\n40\n06 Pembimbingan Magang'
 '• Memberikan arahan dalam penyelesaian revisi Laporan Magang.\nB. Dosen pembimbing harus memastikan bahwa Laporan Magang bebas dari plagiarisme.\n6.5\nPENGGANTIAN DOSEN PEMBIMBING\nMAGANG\n• Penggantian dosen pembimbing magang harus didasarkan pada alasan yang dapat dipertanggungjawabkan.\n• Pengajuan permohonan penggantian dosen pembimbing magang dapat dilakukan selambat-lambatnya 2 (dua) bulan setelah magang dimulai.\n• Penggantian dosen pembimbing magang harus dengan persetujuan dari Kepala\nDepartemen.\n42\n06 Pembimbingan Magang'
 '6.4\nKETENTUAN PEMBIMBINGAN MAGANG\nBAGI DOSEN\nA.Dosen pembimbing harus dapat memberikan masukan dan pengarahan tentang pelaksanaan magang dan penulisan Laporan Magang. Pemberian masukan dan arahan tersebut diantaranya mencakup namun tidak terbatas pada hal berikut:\n• Memberikan masukan, arahan, dan mendiskusikan rumusan permasalahan dan tujuan atau topik Laporan Magang.\n• Membuat rencana bimbingan bersama mahasiswa.\n• Mengarahkan mahasiswa dalam hal metode penulisan ilmiah dan metode analisis dalam Laporan Magang sesuai dengan pedoman penulisan Laporan Magang yang telah disepakati.\n• Mendiskusikan acuan materi keilmuan yang relevan dengan topik Laporan Magang.\n• Hadir dalam Sidang Magang dan memberikan penilaian akhir bagi Laporan\nMagang yang diujikan.\n• Memberikan arahan dalam penyelesaian revisi Laporan Magang.\nB. Dosen pembimbing harus memastikan bahwa Laporan Magang bebas dari plagiarisme.\n6.5\nPENGGANTIAN DOSEN PEMBIMBING\nMAGANG'
 '6.3\nKETENTUAN PEMBIMBINGAN MAGANG\nBAGI MAHASISWA\nMahasiswa harus melakukan pembimbingan sebelum dan saat pelaksanaan magang untuk memastikan pelaksanaan magang dan penulisan Laporan Magang dapat berjalan dengan baik.\nMahasiswa harus membuat Laporan Magang sesuai dengan pedoman penulisan Laporan Magang.\nMahasiswa menyerahkan Laporan Magang sesuai\ndengan jadwal atau kesepakatan dialokasikan oleh dosen pembimbing.\nMahasiswa harus memenuhi jumlah bimbingan minimal yang telah ditetapkan.\nMahasiswa harus memperhatikan etika berkomunikasi dan etika berperilaku dalam melakukan proses pembimbingan.\nBuku Petunjuk Teknis Magang\n41']",• Memberikan saran dan masukan saat konsultasi keilmuan jika diperlukan oleh mahasiswa selama magang. • Melakukan kegiatan pembimbingan bagi mahasiswa magang untuk dapat berkonsultasi selama magang atau bimbingan penulisan laporan magang. • Memberikan persetujuan dan penilaian Laporan Magang. • Memberikan penilaian dapat dilakukan dalam bentuk penilaian laporan magang dan atau presentasi kegiatan magang.,0.9972905936508734,0.0,0.999999999975,1.0
10,Apa fungsi laporan magang?,"Fungsi laporan magang adalah sebagai berikut:
1. Pertanggungjawaban kegiatan Magang mahasiswa kepada Mitra Magang dan Departemen.
2. Bahan pertimbangan pemberian nilai kegiatan Magang.
3. Penyampaian informasi bagi pihak ITS, mahasiswa, maupun Mitra Magang.
4. Alat untuk membina hubungan kerjasama, saling pengertian, dan koordinasi antara mahasiswa dengan pihak ITS maupun Mitra Magang.
5. Alat untuk menyampaikan ide, pendapat, penilaian, dan pengalaman yang berkaitan dengan penyelenggaraan Magang kepada pihak lain.","['07\nPEDOMAN\nPENULISAN\nLAPORAN\nMAGANG\n\n07\nPEDOMAN PENULISAN LAPORAN\nMAGANG\n7.1\nFUNGSI LAPORAN MAGANG\nPertanggungjawaban kegiatan Magang mahasiswa kepada Mitra Magang dan\nDepartemen.\n女你公\n299\nBahan pertimbangan pemberian nilai kegiatan Magang\nДо\nPenyampaian informasi bagi pihak ITS, mahasiswa, maupun Mitra Magang\nSalah satu alat untuk membina hubungan kerjasama, saling pengertian, dan koordinasi antara mahasiswa dengan pihak ITS maupun Mitra Magang\nSalah satu alat untuk menyampaikan ide, pendapat, penilaian, dan pengalaman yang berkaitan dengan penyelenggaraan Magang kepada\npihak lain.\n44\n07 Pedoman Penulisan Laporan Magang'
 'Inisiatif\nKemampuan komunikasi (lisan dan tulisan)\nDisiplin\nPenampilan\nKetekunan\nKemampuan teknikal\nBerpikir kritis, kreatif dan analitis\nKemampuan bekerjasama\ndalam tim Kemampuan\nberadaptasi\n凸\nHasil pekerjaan (kontribusi)\nSedangkan mekanisme pengiriman formulir penilaian magang dari unit tempat magang adalah sebagai berikut:\nこと\nFormulir kosong serta amplop balasan yang sudah bertuliskan alamat Departemen disampaikan oleh mahasiswa magang kepada atasan yang berwenang.\nFormulir penilaian yang sudah terisi dimasukkan ke dalam amplop tertutup dan dikirim langsung ke Departemen.\nBuku Petunjuk Teknis Magang\n53\n\n8.3\nPENILAIAN PENULISAN LAPORAN\nMAGANG\nButir penilaian Laporan Magang mencakup aspek sebagai berikut:\n2. Tugas mahasiswa selama magang\ndijelaskan dengan baik dan relevan\nDeskripsi proses kegiatan\nmagang yang dilakukan\n1. Gambaran umum Mitra Magang\ndengan Departemen.\n\njelas.'
 '• LANGSUNG KE SASARAN\nLaporan magang harus tepat, padat dan langsung ke pokok persoalannya. Uraian sebaiknya tidak terlalu panjang atau menggunakan kata-kata kiasan hanya sekedar untuk memberi kesan bahwa laporan itu tebal (laporan tebal tidak selalu berarti bagus).\n• LENGKAP\nLaporan magang harus disajikan secara lengkap dalam bentuk uraian menyeluruh berdasarkan data terpilih dengan disertai data penunjang yang diperlukan. Oleh karena itu Laporan Magang harus memuat seluruh materi magang yang dikerjakan mahasiswa (bukan seluruh materi proyek / kegiatan) dan tidak menimbulkan masalah, persoalan, atau pertanyaan baru, disertai data penunjang, misalnya grafik, tabel, peta, skema, dan lain-lain bila diperlukan.\nBuku Petunjuk Teknis Magang\n45'
 '• TEGAS DAN KONSISTEN\nLaporan Magang harus tegas dan konsisten sehingga tidak terjadi kontradiksi antara bagian yang satu dengan bagian lainnya, baik dalam hal substansi, istilah, maupun teknik penulisan penyajian.\nPenulisan, penyerahan, evaluasi, dan perbaikan Laporan Magang harus dilakukan sesuai dengan ketentuan yang berlaku. Untuk memenuhi syarat tersebut, dengan ini seorang penulis Laporan Magang harus:\n• Benar-benar menguasai masalah yang dilaporkan.\n• Mempunyai minat, kesanggupan, obyektifitas, ketelitian, dan kemampuan analisis dalam menyusun laporan.\n• Mampu bekerjasama, serta tanggap dan terbuka terhadap kritik.\n• Mampu menggunakan bahasa tulisan yang baik.\n• Dapat menggunakan kata-kata, istilah, kalimat dan gaya bahasa yang sederhana, jelas, dan mudah dimengerti.\n• Mampu memilih dan mengorganisir data yang diperlukan.\n• Mampu mengamati dan menilai dengan jeli berbagai proses, peristiwa, manfaat dan kelemahan yang ada selama melakukan kegiatan Magang.\n7.4']","sebagai Pertanggungjawaban kegiatan Magang mahasiswa kepada Mitra Magang dan
Departemen.",0.8796041058297986,1.0,0.999999999975,0.6
11,Apa saja ketentuan umum dalam penulisan lapora magang?,"Ketentuan umum dalam penulisan laporan magang antara lain:

1. Laporan Magang harus ditulis dan dipresentasikan pada akhir magang (jika diperlukan).
2. Laporan Magang harus diserahkan ke departemen dan mitra magang, serta diserahkan ke Subdirektorat PK2 Direktorat Kemahasiswaan dalam bentuk softcopy melalui SIM Magang.
3. Laporan Magang harus sesuai dengan ketentuan yang ada dalam pedoman dan memuat informasi yang benar dan obyektif.
4. Laporan Magang harus mudah dimengerti oleh pembaca dengan menghindari pemakaian kata/istilah, rangkaian kata/kalimat, atau gaya bahasa yang kurang dapat dipahami. Gunakan kata-kata yang sederhana tetapi jelas maksudnya.
5. Laporan Magang harus langsung ke sasaran.","['• TEGAS DAN KONSISTEN\nLaporan Magang harus tegas dan konsisten sehingga tidak terjadi kontradiksi antara bagian yang satu dengan bagian lainnya, baik dalam hal substansi, istilah, maupun teknik penulisan penyajian.\nPenulisan, penyerahan, evaluasi, dan perbaikan Laporan Magang harus dilakukan sesuai dengan ketentuan yang berlaku. Untuk memenuhi syarat tersebut, dengan ini seorang penulis Laporan Magang harus:\n• Benar-benar menguasai masalah yang dilaporkan.\n• Mempunyai minat, kesanggupan, obyektifitas, ketelitian, dan kemampuan analisis dalam menyusun laporan.\n• Mampu bekerjasama, serta tanggap dan terbuka terhadap kritik.\n• Mampu menggunakan bahasa tulisan yang baik.\n• Dapat menggunakan kata-kata, istilah, kalimat dan gaya bahasa yang sederhana, jelas, dan mudah dimengerti.\n• Mampu memilih dan mengorganisir data yang diperlukan.\n• Mampu mengamati dan menilai dengan jeli berbagai proses, peristiwa, manfaat dan kelemahan yang ada selama melakukan kegiatan Magang.\n7.4'
 'Berikut adalah ketentuan umum mengenai Laporan Magang:\n• Pada akhir pelaksanaan magang mahasiswa diwajibkan menulis Laporan Magang.\n• Pedoman penulisan Laporan Magang dapat ditemukan pada Bagian 5 dari buku petunjuk teknis magang ini.\n• Laporan Magang harus disetujui oleh dosen pembimbing magang dan dosen lapangan.\n• Laporan Magang harus diselesaikan segera setelah Program Magang berakhir.\n• Laporan Magang yang telah disetujui pembimbing magang dapat di presentasikan jika diperlukan.\n• Dalam penyusunan Laporan Magang, mahasiswa wajib menaati ketentuan kerahasiaan data / informasi yang ditetapkan oleh unit tempat magang.\n8.4\nPENILAIAN PRESENTASI LAPORAN\nMAGANG (JIKA DIPERLUKAN)\nButir penilaian presentasi Laporan Magang mencakup aspek berikut ini:\nAlur Presentasi\n1. Logika dalam Analisis Presentasi\n2. Substansi Isi Presentasi\nProses Presentasi\n1. Kualitas Slides Presentasi\n2. Sistematika Slides Presentasi\nKomunikasi dalam Presentasi\n1. Kemampuan Menjelaskan Isi\nLaporan Magang'
 '7.2\nKETENTUAN UMUM DALAM PENULISAN\nLAPORAN MAGANG\n• Laporan Magang ditulis dan dipresentasikan pada akhir magang (jika diperlukan).\n• Laporan Magang selain diserahkan ke departemen dan mitra magang, juga diserahkan ke Subdirektorat PK2 Direktorat Kemahasiswaan dalam bentuk softcopy melalui SIM Magang.\n7.3\nPRINSIP PENULISAN LAPORAN\nMAGANG\n• BENAR DAN OBYEKTIF\nLaporan magang harus sesuai dengan ketentuan yang ada dalam pedoman ini serta memuat informasi yang benar dan obyektif.\n• JELAS DAN CERMAT\nLaporan magang harus mudah dimengerti / dipahami oleh pembaca, dengan cara menghindari pemakaian kata / istilah, rangkaian kata / kalimat atau gaya bahasa yang kurang dapat dipahami oleh pembaca maupun penulisnya sendiri. Gunakan kata-kata yang sederhana tetapi jelas maksudnya.\n• LANGSUNG KE SASARAN'
 '7.5\nKETENTUAN ISI LAPORAN MAGANG\n• BAB 1. PENDAHULUAN\n1.1. Latar Belakang, meliputi\n• Mahasiswa menguraikan latar belakang (argumen / alasan) dari topik yang dipilih dalam Laporan Magang ini.\n• Latar belakang harus menunjukkan urgensi dari topik yang dipilih. Urgensi misal-nya ditunjukkan oleh keunikan topik (isu mutakhir), keunikan industri, permasalah-an atau risiko yang ditimbulkan, atau perbedaan pendapat.\n1.2. Tujuan Magang, meliputi\n• Mencerminkan hal-hal yang akan diuraikan di bab analisis.\n1.3. Manfaat Magang, meliputi\n• Manfaat untuk ITS\n• Manfaat untuk Mitra Magang\n• Manfaat untuk Mahasiswa\n1.4. Mahasiswa menguraikan tujuan penulisan topik magang.\n• Tujuan harus mencerminkan hal-hal yang akan diuraikan di bab analisis.\n• BAB 2. PROFIL MITRA MAGANG\n2.1. Sejarah Mitra Magang\n• Mahasiswa menguraikan sejarah mitra magang secara umum serta spesifik (unit / divisi terkait) yang menjadi konteks dari topik yang dipilih.\n2.2. Struktur Organisasi Mitra Magang']","benar dan obyektif, jelas dan cermat, langsung ke sasaran, lengkap, tegas dan konsisten",1.0,1.0,0.999999999975,0.9514094806886383
12,Apa jenis dan ukuran kertas pada format penulisan laporan magang?,Jenis dan ukuran kertas pada format penulisan laporan magang adalah kertas HVS 70 gram dengan ukuran A5 (148 × 210 mm).,"['• Mampu memilih dan mengorganisir data yang diperlukan.\n• Mampu mengamati dan menilai dengan jeli berbagai proses, peristiwa, manfaat dan kelemahan yang ada selama melakukan kegiatan Magang.\n7.4\nFORMAT DAN SISTEMATIKA LAPORAN\nMAGANG\n• FORMAT PENULISAN LAPORAN MAGANG\n1. Jenis dan Ukuran Kertas\nKertas HVS 70gram ukuran A5 (148 × 210 mm).\n2. Cover Laporan\n3. Lembar pengesahan dengan dasar polos berwarna putih\nPembimbing tempat magang tanda tangan terlebih dahulu.\n4. Jarak Tepi (margin)\n- Tepi Atas : 2,5 cm\n- Тері Bawah : 2,5 cm\n- Tepi Kiri: 2,5 cm\n- Tepi Kanan : 2,0 cm\n5. Jenis Huruf\nTimes New Roman, Normal, 12 pt (judul), 11 pt (isi)\n46\n07 Pedoman Penulisan Laporan Magang'
 '• LANGSUNG KE SASARAN\nLaporan magang harus tepat, padat dan langsung ke pokok persoalannya. Uraian sebaiknya tidak terlalu panjang atau menggunakan kata-kata kiasan hanya sekedar untuk memberi kesan bahwa laporan itu tebal (laporan tebal tidak selalu berarti bagus).\n• LENGKAP\nLaporan magang harus disajikan secara lengkap dalam bentuk uraian menyeluruh berdasarkan data terpilih dengan disertai data penunjang yang diperlukan. Oleh karena itu Laporan Magang harus memuat seluruh materi magang yang dikerjakan mahasiswa (bukan seluruh materi proyek / kegiatan) dan tidak menimbulkan masalah, persoalan, atau pertanyaan baru, disertai data penunjang, misalnya grafik, tabel, peta, skema, dan lain-lain bila diperlukan.\nBuku Petunjuk Teknis Magang\n45'
 '• TEGAS DAN KONSISTEN\nLaporan Magang harus tegas dan konsisten sehingga tidak terjadi kontradiksi antara bagian yang satu dengan bagian lainnya, baik dalam hal substansi, istilah, maupun teknik penulisan penyajian.\nPenulisan, penyerahan, evaluasi, dan perbaikan Laporan Magang harus dilakukan sesuai dengan ketentuan yang berlaku. Untuk memenuhi syarat tersebut, dengan ini seorang penulis Laporan Magang harus:\n• Benar-benar menguasai masalah yang dilaporkan.\n• Mempunyai minat, kesanggupan, obyektifitas, ketelitian, dan kemampuan analisis dalam menyusun laporan.\n• Mampu bekerjasama, serta tanggap dan terbuka terhadap kritik.\n• Mampu menggunakan bahasa tulisan yang baik.\n• Dapat menggunakan kata-kata, istilah, kalimat dan gaya bahasa yang sederhana, jelas, dan mudah dimengerti.\n• Mampu memilih dan mengorganisir data yang diperlukan.\n• Mampu mengamati dan menilai dengan jeli berbagai proses, peristiwa, manfaat dan kelemahan yang ada selama melakukan kegiatan Magang.\n7.4'
 'Berikut adalah ketentuan umum mengenai Laporan Magang:\n• Pada akhir pelaksanaan magang mahasiswa diwajibkan menulis Laporan Magang.\n• Pedoman penulisan Laporan Magang dapat ditemukan pada Bagian 5 dari buku petunjuk teknis magang ini.\n• Laporan Magang harus disetujui oleh dosen pembimbing magang dan dosen lapangan.\n• Laporan Magang harus diselesaikan segera setelah Program Magang berakhir.\n• Laporan Magang yang telah disetujui pembimbing magang dapat di presentasikan jika diperlukan.\n• Dalam penyusunan Laporan Magang, mahasiswa wajib menaati ketentuan kerahasiaan data / informasi yang ditetapkan oleh unit tempat magang.\n8.4\nPENILAIAN PRESENTASI LAPORAN\nMAGANG (JIKA DIPERLUKAN)\nButir penilaian presentasi Laporan Magang mencakup aspek berikut ini:\nAlur Presentasi\n1. Logika dalam Analisis Presentasi\n2. Substansi Isi Presentasi\nProses Presentasi\n1. Kualitas Slides Presentasi\n2. Sistematika Slides Presentasi\nKomunikasi dalam Presentasi\n1. Kemampuan Menjelaskan Isi\nLaporan Magang']",Kertas HVS 70gram ukuran A5 (148 × 210 mm).,0.8,0.9999999999666667,1.0,0.9854042718198118
13,Berapa jarak tepi margin dalam penulisan laporan magang?,"Jarak tepi margin dalam penulisan laporan magang adalah sebagai berikut:
- Tepi Atas : 2,5 cm
- Tepi Bawah : 2,5 cm
- Tepi Kiri: 2,5 cm
- Tepi Kanan : 2,0 cm","['• TEGAS DAN KONSISTEN\nLaporan Magang harus tegas dan konsisten sehingga tidak terjadi kontradiksi antara bagian yang satu dengan bagian lainnya, baik dalam hal substansi, istilah, maupun teknik penulisan penyajian.\nPenulisan, penyerahan, evaluasi, dan perbaikan Laporan Magang harus dilakukan sesuai dengan ketentuan yang berlaku. Untuk memenuhi syarat tersebut, dengan ini seorang penulis Laporan Magang harus:\n• Benar-benar menguasai masalah yang dilaporkan.\n• Mempunyai minat, kesanggupan, obyektifitas, ketelitian, dan kemampuan analisis dalam menyusun laporan.\n• Mampu bekerjasama, serta tanggap dan terbuka terhadap kritik.\n• Mampu menggunakan bahasa tulisan yang baik.\n• Dapat menggunakan kata-kata, istilah, kalimat dan gaya bahasa yang sederhana, jelas, dan mudah dimengerti.\n• Mampu memilih dan mengorganisir data yang diperlukan.\n• Mampu mengamati dan menilai dengan jeli berbagai proses, peristiwa, manfaat dan kelemahan yang ada selama melakukan kegiatan Magang.\n7.4'
 '• LANGSUNG KE SASARAN\nLaporan magang harus tepat, padat dan langsung ke pokok persoalannya. Uraian sebaiknya tidak terlalu panjang atau menggunakan kata-kata kiasan hanya sekedar untuk memberi kesan bahwa laporan itu tebal (laporan tebal tidak selalu berarti bagus).\n• LENGKAP\nLaporan magang harus disajikan secara lengkap dalam bentuk uraian menyeluruh berdasarkan data terpilih dengan disertai data penunjang yang diperlukan. Oleh karena itu Laporan Magang harus memuat seluruh materi magang yang dikerjakan mahasiswa (bukan seluruh materi proyek / kegiatan) dan tidak menimbulkan masalah, persoalan, atau pertanyaan baru, disertai data penunjang, misalnya grafik, tabel, peta, skema, dan lain-lain bila diperlukan.\nBuku Petunjuk Teknis Magang\n45'
 '• Mampu memilih dan mengorganisir data yang diperlukan.\n• Mampu mengamati dan menilai dengan jeli berbagai proses, peristiwa, manfaat dan kelemahan yang ada selama melakukan kegiatan Magang.\n7.4\nFORMAT DAN SISTEMATIKA LAPORAN\nMAGANG\n• FORMAT PENULISAN LAPORAN MAGANG\n1. Jenis dan Ukuran Kertas\nKertas HVS 70gram ukuran A5 (148 × 210 mm).\n2. Cover Laporan\n3. Lembar pengesahan dengan dasar polos berwarna putih\nPembimbing tempat magang tanda tangan terlebih dahulu.\n4. Jarak Tepi (margin)\n- Tepi Atas : 2,5 cm\n- Тері Bawah : 2,5 cm\n- Tepi Kiri: 2,5 cm\n- Tepi Kanan : 2,0 cm\n5. Jenis Huruf\nTimes New Roman, Normal, 12 pt (judul), 11 pt (isi)\n46\n07 Pedoman Penulisan Laporan Magang'
 'Inisiatif\nKemampuan komunikasi (lisan dan tulisan)\nDisiplin\nPenampilan\nKetekunan\nKemampuan teknikal\nBerpikir kritis, kreatif dan analitis\nKemampuan bekerjasama\ndalam tim Kemampuan\nberadaptasi\n凸\nHasil pekerjaan (kontribusi)\nSedangkan mekanisme pengiriman formulir penilaian magang dari unit tempat magang adalah sebagai berikut:\nこと\nFormulir kosong serta amplop balasan yang sudah bertuliskan alamat Departemen disampaikan oleh mahasiswa magang kepada atasan yang berwenang.\nFormulir penilaian yang sudah terisi dimasukkan ke dalam amplop tertutup dan dikirim langsung ke Departemen.\nBuku Petunjuk Teknis Magang\n53\n\n8.3\nPENILAIAN PENULISAN LAPORAN\nMAGANG\nButir penilaian Laporan Magang mencakup aspek sebagai berikut:\n2. Tugas mahasiswa selama magang\ndijelaskan dengan baik dan relevan\nDeskripsi proses kegiatan\nmagang yang dilakukan\n1. Gambaran umum Mitra Magang\ndengan Departemen.\n\njelas.']","- Tepi Atas : 2,5 cm
- Тері Bawah : 2,5 cm
- Tepi Kiri : 2,5 cm
- Tepi Kanan : 2,0 cm",1.0,0.999999999975,1.0,0.986166433433393
14,apa ketentuan umum mengenai penilaian akhir magang?,"Ketentuan umum mengenai penilaian akhir magang adalah sebagai berikut:
1. Dosen pembimbing magang dan dosen pembimbing dari unit tempat magang memberikan penilaian terhadap Laporan Magang dan ujian presentasi magang jika diperlukan.
2. Unit tempat magang memberikan penilaian terhadap prestasi magang.
3. Penilaian penulisan laporan magang mengacu kepada ketentuan yang berlaku.
4. Hasil penilaian dilakukan dengan cara mengisi formulir yang ada dan diserahkan pada departemen.","['08\nPENILAIAN MAGANG\n8.1\nBOBOT PENILAIAN MAGANG\n• Berikut adalah bobot masing-masing komponen penilaian untuk nilai akhir magang:\n60%\n40%\nPrestasi Kinerja Magang\noleh Unit tempat Magang\nPenulisan Laporan Magang,\ndan presentasi laporan jika diperlukan\n• Berikut ketentuan umum mengenai penilaian akhir magang:\n1. Dosen pembimbing magang dan dosen pembimbing dari unit tempat magang memberikan penilaian terhadap Laporan Magang dan ujian presentasi magang\njika diperlukan.\n2. Unit tempat magang memberikan penilaian terhadap prestasi magang.\n3. Penilaian penulisan laporan magang mengacu kepada ketentuan.\n4. Hasil penilaian dilakukan dengan cara mengisi formulir yang ada dan diserahkan\npada departemen.\n8.2\nPENILAIAN PRESTASI KINERJA MAGANG\nOLEH UNIT MITRA MAGANG'
 'Beberapa ketentuan yang perlu diperhatikan khususnya oleh mahasiswa peserta magang dalam merencanakan dan melaksanakan ujian presentasi Laporan Magang sebagai berikut:\n• Ujian Presentasi Laporan Magang dilaksanakan oleh mahasiswa yang telah menyelesaikan penyusunan karya akhir Laporan Magang yang sudah disetujui oleh pembimbing magang.\n• Ujian Presentasi Magang dilaksanakan setelah berkas penilaian kinerja magang sudah diisi oleh unit tempat magang dan sudah diterima oleh program studi.\n• Ujian Presentasi Magang akan dilakukan di ruang ujian Sidang atau di ruang kelas.\n• Untuk dapat mengikuti Ujian Presentasi Magang, mahasiswa harus mengajukan Permohonan Ujian Presentasi Magang sesuai jadwal yang ditetapkan oleh Program Studi.\n• Ujian Presentasi Magang akan diuji oleh 3 (tiga) orang dosen penguji, salah satunya dosen pembimbing magang dan berlangsung sekitar 1,5 jam termasuk sesi untuk tanya jawab.'
 'Berikut adalah ketentuan umum mengenai Laporan Magang:\n• Pada akhir pelaksanaan magang mahasiswa diwajibkan menulis Laporan Magang.\n• Pedoman penulisan Laporan Magang dapat ditemukan pada Bagian 5 dari buku petunjuk teknis magang ini.\n• Laporan Magang harus disetujui oleh dosen pembimbing magang dan dosen lapangan.\n• Laporan Magang harus diselesaikan segera setelah Program Magang berakhir.\n• Laporan Magang yang telah disetujui pembimbing magang dapat di presentasikan jika diperlukan.\n• Dalam penyusunan Laporan Magang, mahasiswa wajib menaati ketentuan kerahasiaan data / informasi yang ditetapkan oleh unit tempat magang.\n8.4\nPENILAIAN PRESENTASI LAPORAN\nMAGANG (JIKA DIPERLUKAN)\nButir penilaian presentasi Laporan Magang mencakup aspek berikut ini:\nAlur Presentasi\n1. Logika dalam Analisis Presentasi\n2. Substansi Isi Presentasi\nProses Presentasi\n1. Kualitas Slides Presentasi\n2. Sistematika Slides Presentasi\nKomunikasi dalam Presentasi\n1. Kemampuan Menjelaskan Isi\nLaporan Magang'
 '4. Hasil penilaian dilakukan dengan cara mengisi formulir yang ada dan diserahkan\npada departemen.\n8.2\nPENILAIAN PRESTASI KINERJA MAGANG\nOLEH UNIT MITRA MAGANG\nDalam melakukan kegiatan magang, mahasiswa akan memperoleh penilaian dari unit tempat magang. Formulir penilaian magang diisi dan ditandatangani oleh atasan yang berwenang di tempat magang (minimal level manajer) dan dicap menggunakan stempel unit tempat magang. Berikut adalah butir penilaian kinerja magang:\n52\n08 Penilaian Magang']","1. Dosen pembimbing magang dan dosen pembimbing dari unit tempat magang memberikan penilaian terhadap Laporan Magang dan ujian presentasi magang
jika diperlukan.
2. Unit tempat magang memberikan penilaian terhadap prestasi magang.
3. Penilaian penulisan laporan magang mengacu kepada ketentuan.
4. Hasil penilaian dilakukan dengan cara mengisi formulir yang ada dan diserahkan
pada departemen",1.0,0.999999999975,0.625,0.9675798422485871
15,Apa saja etika pelaksanaan magang di perusahaan mitra magang?,"Etika pelaksanaan magang di perusahaan mitra magang meliputi beberapa hal sebagai berikut:
1. Mematuhi aturan Mitra Magang dengan baik.
2. Bekerja dan berusaha memberikan yang terbaik untuk kepentingan Mitra Magang.
3. Dapat menyelesaikan segala tugas yang diberikan Mitra Magang dengan benar, rapi, dan tepat waktu.
4. Menghormati pegawai Mitra Magang tanpa membedakan suku, agama, ras, gender, dan golongan.
5. Bersikap jujur, disiplin, santun, profesional, dan menjaga etos kerja di unit kerja Mitra Magang.
6. Menjaga kerahasiaan informasi unit kerja Mitra Magang.
7. Menjaga nama baik almamater ITS.

Itulah beberapa etika pelaksanaan magang di perusahaan mitra magang yang harus dipatuhi oleh mahasiswa yang sedang menjalani magang.","['9.3\nETIKA BERPAKAIAN DI PERUSAHAAN\nMITRA MAGANG\n• Mahasiswa harus mengenakan pakaian yang formal dan sopan. Contoh pakaian formal adalah kemeja, celana atau rok, dari bahan kain. Pakaian yang dihindari adalah pakaian yang terbuat dari bahan kaos dan jeans. Mahasiswa juga harus menghindari pakaian yang terlalu longgar atau terlalu ketat.\n• Mahasiswa harus mengenakan pakaian yang sopan. Pakaian yang terlalu terbuka (seksi), seperti memakai pakaian bagian atas yang terlalu rendah, memakai rok yang terlalu pendek, atau pakaian bagian atas dan bagian bawah yang tembus pandang, harus dihindari.\n• Mahasiswa disarankan menggunakan sepatu. Penggunaan sandal saat pelaksanaan kegiatan magang harus dihindari. Sepatu yang digunakan sebaiknya tidak meng-ganggu mobilitas mahasiswa peserta magang dalam pelaksanaan magang.\n• Mahasiswa harus menghindari penggunaan aksesoris dan makeup yang berlebihan.\n09 Etika Magang\n\nLAMPIRAN'
 '09\nЕТІКА\nMAGANG\n\n09\nETIKA MAGANG\n9.1\nETIKA PELAKSANAAN MAGANG DI PERUSAHAAN MITRA MAGANG\nVX\n• Mahasiswa harus mematuhi aturan Mitra Magang dengan baik.\n• Mahasiswa harus bekerja dan berusaha memberikan yang terbaik untuk kepentingan Mitra Magang.\n• Mahasiswa harus dapat menyelesaikan segala tugas yang diberikan\nMitra Magang dengan benar, rapi dan tepat waktu.\n• Mahasiswa harus menghormati pegawai Mitra Magang tanpa membedakan suku, agama, ras, gender dan golongan.\n• Mahasiswa bersikap jujur, disiplin, santun, profesional, dan menjaga etos kerja di unit kerja Mitra Magang.\n• Mahasiswa harus menjaga kerahasiaan informasi unit kerja Mitra Magang. Seluruh informasi dan data yang akan dijadikan sumber dalam penulisan laporan magang harus disamarkan dalam penulisan untuk menjaga kerahasidan data dan informasi Mitra Magang.\n• Mahasiswa harus menjaga nama baik almamater ITS.\n58\n09 Etika Magang'
 'kepentingan yang dilakukan oleh organisasi tersebut (misalnya melalui produk atau jasa yang dihasilkan).\n• BAB 3. PELAKSANAAN MAGANG\n3.1. Posisi / Kedudukan Kegiatan Magang\n• Mahasiswa dapat menguraikan kedudukan / posisi kegiatan yang ditugaskan oleh mitra magang dalam lingkup pekerjaan / proyek keseluruhan. Hal ini dimaksudkan untuk mengetahui apakah mahasiswa memahami kaitan antara apa yang telah dilakukan / dihasilkan dengan pekerjaan tersebut.\n3.2. Metodologi penyelesaian Tugas\n• Mahasiswa menguraikan kasus / masalah menjadi topik pembahasan. Mahasiswa menganalisis kasus / masalah tersebut dengan menggunakan teori atau metode yang relevan. Analisis bukan mendeskripsikan teori, namun menggunakan teori guna menjelaskan dan membandingkan dengan kasus/masalah yang diangkat.\nUraian mengenai teori atau metode harus menyebutkan referensi yang valid dan handal.\n3.3. Pembelajaran Hal Baru'
 '4. Hasil penilaian dilakukan dengan cara mengisi formulir yang ada dan diserahkan\npada departemen.\n8.2\nPENILAIAN PRESTASI KINERJA MAGANG\nOLEH UNIT MITRA MAGANG\nDalam melakukan kegiatan magang, mahasiswa akan memperoleh penilaian dari unit tempat magang. Formulir penilaian magang diisi dan ditandatangani oleh atasan yang berwenang di tempat magang (minimal level manajer) dan dicap menggunakan stempel unit tempat magang. Berikut adalah butir penilaian kinerja magang:\n52\n08 Penilaian Magang']","• Mahasiswa harus mematuhi aturan Mitra Magang dengan baik.
• Mahasiswa harus bekerja dan berusaha memberikan yang terbaik untuk kepentingan Mitra Magang.
• Mahasiswa harus dapat menyelesaikan segala tugas yang diberikan
Mitra Magang dengan benar, rapi dan tepat waktu.
• Mahasiswa harus menghormati pegawai Mitra Magang tanpa membedakan suku, agama, ras, gender dan golongan.
• Mahasiswa bersikap jujur, disiplin, santun, profesional, dan menjaga etos kerja di unit kerja Mitra Magang.
• Mahasiswa harus menjaga kerahasiaan informasi unit kerja Mitra Magang. Seluruh informasi dan data yang akan dijadikan sumber dalam penulisan laporan magang harus disamarkan dalam penulisan untuk menjaga kerahasidan data dan informasi Mitra Magang.
• Mahasiswa harus menjaga nama baik almamater ITS.",0.999999999975,1.0,0.9762266980206875,1.0
16,Apa syarat yang harus dipenuhi mahasiswa untik mengikuti kegiatan magang?,"Untuk dapat mengikuti kegiatan magang, mahasiswa harus memperhatikan beberapa syarat sebagai berikut:
1. Menyelesaikan penyusunan karya akhir Laporan Magang yang sudah disetujui oleh pembimbing magang.
2. Mengajukan Permohonan Ujian Presentasi Magang sesuai jadwal yang ditetapkan oleh Program Studi.
3. Memastikan berkas penilaian kinerja magang sudah diisi oleh unit tempat magang dan sudah diterima oleh program studi.
4. Bersedia untuk menjalani Ujian Presentasi Magang yang akan diuji oleh 3 (tiga) orang dosen penguji, salah satunya dosen pembimbing magang.
5. Mengikuti prosedur yang telah ditetapkan oleh Program Studi terkait pelaksanaan kegiatan magang.","['Beberapa ketentuan yang perlu diperhatikan khususnya oleh mahasiswa peserta magang dalam merencanakan dan melaksanakan ujian presentasi Laporan Magang sebagai berikut:\n• Ujian Presentasi Laporan Magang dilaksanakan oleh mahasiswa yang telah menyelesaikan penyusunan karya akhir Laporan Magang yang sudah disetujui oleh pembimbing magang.\n• Ujian Presentasi Magang dilaksanakan setelah berkas penilaian kinerja magang sudah diisi oleh unit tempat magang dan sudah diterima oleh program studi.\n• Ujian Presentasi Magang akan dilakukan di ruang ujian Sidang atau di ruang kelas.\n• Untuk dapat mengikuti Ujian Presentasi Magang, mahasiswa harus mengajukan Permohonan Ujian Presentasi Magang sesuai jadwal yang ditetapkan oleh Program Studi.\n• Ujian Presentasi Magang akan diuji oleh 3 (tiga) orang dosen penguji, salah satunya dosen pembimbing magang dan berlangsung sekitar 1,5 jam termasuk sesi untuk tanya jawab.'
 '9.3\nETIKA BERPAKAIAN DI PERUSAHAAN\nMITRA MAGANG\n• Mahasiswa harus mengenakan pakaian yang formal dan sopan. Contoh pakaian formal adalah kemeja, celana atau rok, dari bahan kain. Pakaian yang dihindari adalah pakaian yang terbuat dari bahan kaos dan jeans. Mahasiswa juga harus menghindari pakaian yang terlalu longgar atau terlalu ketat.\n• Mahasiswa harus mengenakan pakaian yang sopan. Pakaian yang terlalu terbuka (seksi), seperti memakai pakaian bagian atas yang terlalu rendah, memakai rok yang terlalu pendek, atau pakaian bagian atas dan bagian bawah yang tembus pandang, harus dihindari.\n• Mahasiswa disarankan menggunakan sepatu. Penggunaan sandal saat pelaksanaan kegiatan magang harus dihindari. Sepatu yang digunakan sebaiknya tidak meng-ganggu mobilitas mahasiswa peserta magang dalam pelaksanaan magang.\n• Mahasiswa harus menghindari penggunaan aksesoris dan makeup yang berlebihan.\n09 Etika Magang\n\nLAMPIRAN'
 '6.3\nKETENTUAN PEMBIMBINGAN MAGANG\nBAGI MAHASISWA\nMahasiswa harus melakukan pembimbingan sebelum dan saat pelaksanaan magang untuk memastikan pelaksanaan magang dan penulisan Laporan Magang dapat berjalan dengan baik.\nMahasiswa harus membuat Laporan Magang sesuai dengan pedoman penulisan Laporan Magang.\nMahasiswa menyerahkan Laporan Magang sesuai\ndengan jadwal atau kesepakatan dialokasikan oleh dosen pembimbing.\nMahasiswa harus memenuhi jumlah bimbingan minimal yang telah ditetapkan.\nMahasiswa harus memperhatikan etika berkomunikasi dan etika berperilaku dalam melakukan proses pembimbingan.\nBuku Petunjuk Teknis Magang\n41'
 '4. Hasil penilaian dilakukan dengan cara mengisi formulir yang ada dan diserahkan\npada departemen.\n8.2\nPENILAIAN PRESTASI KINERJA MAGANG\nOLEH UNIT MITRA MAGANG\nDalam melakukan kegiatan magang, mahasiswa akan memperoleh penilaian dari unit tempat magang. Formulir penilaian magang diisi dan ditandatangani oleh atasan yang berwenang di tempat magang (minimal level manajer) dan dicap menggunakan stempel unit tempat magang. Berikut adalah butir penilaian kinerja magang:\n52\n08 Penilaian Magang']","1. Mahasiswa peserta magang adalah mahasiswa aktif ITS 2. Mahasiswa sudah menempuh minimal 90 SKS, untuk departemen yang tidak mempunyai MK magang dalam kurikulumnya.",0.999999999975,1.0,0.9910441651718248,0.0
17,apa peran Dosen pembimbing magang?,"Peran Dosen Pembimbing Magang antara lain adalah:
1. Memberikan saran dan masukan saat konsultasi keilmuan jika diperlukan oleh mahasiswa selama magang.
2. Melakukan kegiatan pembimbingan bagi mahasiswa magang untuk dapat berkonsultasi selama magang atau bimbingan penulisan laporan magang.
3. Memberikan persetujuan dan penilaian terhadap Laporan Magang.
4. Memberikan penilaian yang dapat dilakukan dalam bentuk penilaian laporan magang dan/atau presentasi kegiatan magang.
5. Memberikan arahan dalam penyelesaian revisi Laporan Magang.
6. Memastikan bahwa Laporan Magang bebas dari plagiarisme.
7. Mengajukan permohonan penggantian dosen pembimbing magang jika diperlukan dengan persetujuan dari Kepala Departemen.","['6.1\nKRITERIA DOSEN PEMBIMBING MAGANG\nW888\nDosen yang telah mengajar selama 4 semester berturut-turut.\nMemperoleh SK Pembimbing Magang dari Departemen dan ketetapan melalui\nKeputusan Dekan.\n6.2\nRINCIAN TUGAS DOSEN PEMBIMBING\nMAGANG\n• Memberikan saran dan masukan saat konsultasi keilmuan jika diperlukan oleh mahasiswa selama magang.\n• Melakukan kegiatan pembimbingan bagi mahasiswa magang untuk dapat berkonsultasi selama magang atau bimbingan penulisan laporan magang.\n• Memberikan persetujuan dan penilaian Laporan Magang.\n• Memberikan penilaian dapat dilakukan dalam bentuk penilaian laporan magang dan atau presentasi kegiatan magang.\n40\n06 Pembimbingan Magang'
 '• Memberikan arahan dalam penyelesaian revisi Laporan Magang.\nB. Dosen pembimbing harus memastikan bahwa Laporan Magang bebas dari plagiarisme.\n6.5\nPENGGANTIAN DOSEN PEMBIMBING\nMAGANG\n• Penggantian dosen pembimbing magang harus didasarkan pada alasan yang dapat dipertanggungjawabkan.\n• Pengajuan permohonan penggantian dosen pembimbing magang dapat dilakukan selambat-lambatnya 2 (dua) bulan setelah magang dimulai.\n• Penggantian dosen pembimbing magang harus dengan persetujuan dari Kepala\nDepartemen.\n42\n06 Pembimbingan Magang'
 '6.4\nKETENTUAN PEMBIMBINGAN MAGANG\nBAGI DOSEN\nA.Dosen pembimbing harus dapat memberikan masukan dan pengarahan tentang pelaksanaan magang dan penulisan Laporan Magang. Pemberian masukan dan arahan tersebut diantaranya mencakup namun tidak terbatas pada hal berikut:\n• Memberikan masukan, arahan, dan mendiskusikan rumusan permasalahan dan tujuan atau topik Laporan Magang.\n• Membuat rencana bimbingan bersama mahasiswa.\n• Mengarahkan mahasiswa dalam hal metode penulisan ilmiah dan metode analisis dalam Laporan Magang sesuai dengan pedoman penulisan Laporan Magang yang telah disepakati.\n• Mendiskusikan acuan materi keilmuan yang relevan dengan topik Laporan Magang.\n• Hadir dalam Sidang Magang dan memberikan penilaian akhir bagi Laporan\nMagang yang diujikan.\n• Memberikan arahan dalam penyelesaian revisi Laporan Magang.\nB. Dosen pembimbing harus memastikan bahwa Laporan Magang bebas dari plagiarisme.\n6.5\nPENGGANTIAN DOSEN PEMBIMBING\nMAGANG'
 '6.3\nKETENTUAN PEMBIMBINGAN MAGANG\nBAGI MAHASISWA\nMahasiswa harus melakukan pembimbingan sebelum dan saat pelaksanaan magang untuk memastikan pelaksanaan magang dan penulisan Laporan Magang dapat berjalan dengan baik.\nMahasiswa harus membuat Laporan Magang sesuai dengan pedoman penulisan Laporan Magang.\nMahasiswa menyerahkan Laporan Magang sesuai\ndengan jadwal atau kesepakatan dialokasikan oleh dosen pembimbing.\nMahasiswa harus memenuhi jumlah bimbingan minimal yang telah ditetapkan.\nMahasiswa harus memperhatikan etika berkomunikasi dan etika berperilaku dalam melakukan proses pembimbingan.\nBuku Petunjuk Teknis Magang\n41']",Dosen pembimbing magang memegang peranan kunci dalam koordinasi pelaksanaan magang dengan mahasiswa peserta magang dan unit tempat magang serta wajib memantau secara kontinu pelaksanaan magang dari mahasiswa yang dibimbingnya.,0.8055555555287036,1.0,0.9681972129171177,0.0
18,Bagaimana proses seleksi program mahasiswa magang bersertifikat?,"Proses seleksi program mahasiswa magang bersertifikat meliputi beberapa tahapan, antara lain:

1. Mahasiswa yang ingin mengikuti program magang bersertifikat harus menyelesaikan penyusunan karya akhir Laporan Magang yang sudah disetujui oleh pembimbing magang.
2. Setelah berkas penilaian kinerja magang diisi oleh unit tempat magang dan diterima oleh program studi, mahasiswa dapat melaksanakan ujian presentasi Laporan Magang.
3. Ujian Presentasi Magang dilakukan di ruang ujian Sidang atau di ruang kelas.
4. Mahasiswa harus mengajukan Permohonan Ujian Presentasi Magang sesuai jadwal yang ditetapkan oleh Program Studi.
5. Ujian Presentasi Magang akan diuji oleh 3 (tiga) orang dosen penguji, salah satunya adalah dosen pembimbing magang.
6. Proses penilaian kinerja magang juga dilakukan oleh unit tempat magang, dimana mahasiswa akan memperoleh penilaian dari atasan yang berwenang di tempat magang.
7. Hasil penilaian kinerja magang akan diisi dalam formulir penilaian magang dan diserahkan pada departemen.

Demikianlah proses seleksi program mahasiswa magang bersertifikat yang perlu diperhatikan.","['Beberapa ketentuan yang perlu diperhatikan khususnya oleh mahasiswa peserta magang dalam merencanakan dan melaksanakan ujian presentasi Laporan Magang sebagai berikut:\n• Ujian Presentasi Laporan Magang dilaksanakan oleh mahasiswa yang telah menyelesaikan penyusunan karya akhir Laporan Magang yang sudah disetujui oleh pembimbing magang.\n• Ujian Presentasi Magang dilaksanakan setelah berkas penilaian kinerja magang sudah diisi oleh unit tempat magang dan sudah diterima oleh program studi.\n• Ujian Presentasi Magang akan dilakukan di ruang ujian Sidang atau di ruang kelas.\n• Untuk dapat mengikuti Ujian Presentasi Magang, mahasiswa harus mengajukan Permohonan Ujian Presentasi Magang sesuai jadwal yang ditetapkan oleh Program Studi.\n• Ujian Presentasi Magang akan diuji oleh 3 (tiga) orang dosen penguji, salah satunya dosen pembimbing magang dan berlangsung sekitar 1,5 jam termasuk sesi untuk tanya jawab.'
 'Uraian mengenai teori atau metode harus menyebutkan referensi yang valid dan handal.\n3.3. Pembelajaran Hal Baru\n• Mahasiswa dapat menguraikan temuan-temuan terkait pembelajaran hal baru yang dapat selama magang. Mahasiswa juga dapat membandingkan kegiatan magang yang dilaksanakan / ditemukan dengan teori atau konsep yang telah dipelajari. Mahasiswa juga dapat menyampaikan kendala yang dihadapi selama\nmagang.\n• BAB 4. KESIMPULAN DAN SARAN\nKesimpulan berisi ringkasan terhadap keseluruhan laporan, termasuk pembelajar-an apa yang didapat selama magang. Saran atau rekomendasi merupakan bahan masukan bagi mitra magang yang telah dijadikan lokasi Magang, maupun bagi mahasiswa angkatan berikutnya dalam menentukan spesifikasi dalam program Magang.\n• BAB 5. REFLEKSI DIRI\n• Mahasiswa mendeskripsikan tentang hal-hal positif yang diterima selama perkuliahan yang bermanfaat / relevan terhadap pekerjaan selama magang.'
 '4. Hasil penilaian dilakukan dengan cara mengisi formulir yang ada dan diserahkan\npada departemen.\n8.2\nPENILAIAN PRESTASI KINERJA MAGANG\nOLEH UNIT MITRA MAGANG\nDalam melakukan kegiatan magang, mahasiswa akan memperoleh penilaian dari unit tempat magang. Formulir penilaian magang diisi dan ditandatangani oleh atasan yang berwenang di tempat magang (minimal level manajer) dan dicap menggunakan stempel unit tempat magang. Berikut adalah butir penilaian kinerja magang:\n52\n08 Penilaian Magang'
 'Inisiatif\nKemampuan komunikasi (lisan dan tulisan)\nDisiplin\nPenampilan\nKetekunan\nKemampuan teknikal\nBerpikir kritis, kreatif dan analitis\nKemampuan bekerjasama\ndalam tim Kemampuan\nberadaptasi\n凸\nHasil pekerjaan (kontribusi)\nSedangkan mekanisme pengiriman formulir penilaian magang dari unit tempat magang adalah sebagai berikut:\nこと\nFormulir kosong serta amplop balasan yang sudah bertuliskan alamat Departemen disampaikan oleh mahasiswa magang kepada atasan yang berwenang.\nFormulir penilaian yang sudah terisi dimasukkan ke dalam amplop tertutup dan dikirim langsung ke Departemen.\nBuku Petunjuk Teknis Magang\n53\n\n8.3\nPENILAIAN PENULISAN LAPORAN\nMAGANG\nButir penilaian Laporan Magang mencakup aspek sebagai berikut:\n2. Tugas mahasiswa selama magang\ndijelaskan dengan baik dan relevan\nDeskripsi proses kegiatan\nmagang yang dilakukan\n1. Gambaran umum Mitra Magang\ndengan Departemen.\n\njelas.']",Seleksi program magang bersertifikat dilakukan oleh FHCl atau BUMN Proses tahapan seleksi dilaksanakan sesuai dengan kebijakan BUMN Hasil proses seleksi akan disampaikan ke Sub Direktorat PK2 untuk diumumkan ke mahasiswa calon peserta magang.,0.249999999975,1.0,0.9806619206993493,0.0
19,apa saja berkas yang perlu diunggah melalui SIM magang?,"Anda perlu mengunggah berkas-berkas berikut melalui SIM magang:
1. Absensi
2. Laporan logbook kegiatan harian yang ditandatangani oleh pembimbing lapangan
3. Struktur organisasi lembaga tempat magang
4. Prosedur atau proses kerja
5. Foto-foto dan sebagainya
6. Sertifikat magang

Semua berkas tersebut perlu diunggah untuk mendukung dan menguatkan laporan magang yang disampaikan.","['• Mahasiswa memberikan penjabaran mengenai rencana perbaikan / pengembangan diri, karir, dan pendidikan selanjutnya.\n• LAMPIRAN\n• Berisi naskah atau dokumen yang perlu disampaikan untuk mendukung dan menguatkan laporan.\n• Lampiran wajib berupa absensi dan,\n• Laporan logbook kegiatan harian yang ditandatangani oleh pembimbing lapangan.\n• Lampiran penunjang dapat berupa struktur organisasi lembaga tempat magang, prosedur atau proses kerja, foto-foto dan sebagainya.\n• Sertifikat magang.\n50\n07 Pedoman Penulisan Laporan Magang\n\nBARAT\nTH\nHARI LISTRIK NASIONAL\nPLN\nPL\nN\n08\nPENILAIAN\nMAGANG'
 '• LANGSUNG KE SASARAN\nLaporan magang harus tepat, padat dan langsung ke pokok persoalannya. Uraian sebaiknya tidak terlalu panjang atau menggunakan kata-kata kiasan hanya sekedar untuk memberi kesan bahwa laporan itu tebal (laporan tebal tidak selalu berarti bagus).\n• LENGKAP\nLaporan magang harus disajikan secara lengkap dalam bentuk uraian menyeluruh berdasarkan data terpilih dengan disertai data penunjang yang diperlukan. Oleh karena itu Laporan Magang harus memuat seluruh materi magang yang dikerjakan mahasiswa (bukan seluruh materi proyek / kegiatan) dan tidak menimbulkan masalah, persoalan, atau pertanyaan baru, disertai data penunjang, misalnya grafik, tabel, peta, skema, dan lain-lain bila diperlukan.\nBuku Petunjuk Teknis Magang\n45'
 '2. Substansi Isi Presentasi\nProses Presentasi\n1. Kualitas Slides Presentasi\n2. Sistematika Slides Presentasi\nKomunikasi dalam Presentasi\n1. Kemampuan Menjelaskan Isi\nLaporan Magang\n2. Kemampuan Menjawab Pertanyaan\nPenguji\nTabel 8.1 Butir Penilaian Presentasi Laporan Magang\nBuku Petunjuk Teknis Magang\n55'
 'Berikut adalah ketentuan umum mengenai Laporan Magang:\n• Pada akhir pelaksanaan magang mahasiswa diwajibkan menulis Laporan Magang.\n• Pedoman penulisan Laporan Magang dapat ditemukan pada Bagian 5 dari buku petunjuk teknis magang ini.\n• Laporan Magang harus disetujui oleh dosen pembimbing magang dan dosen lapangan.\n• Laporan Magang harus diselesaikan segera setelah Program Magang berakhir.\n• Laporan Magang yang telah disetujui pembimbing magang dapat di presentasikan jika diperlukan.\n• Dalam penyusunan Laporan Magang, mahasiswa wajib menaati ketentuan kerahasiaan data / informasi yang ditetapkan oleh unit tempat magang.\n8.4\nPENILAIAN PRESENTASI LAPORAN\nMAGANG (JIKA DIPERLUKAN)\nButir penilaian presentasi Laporan Magang mencakup aspek berikut ini:\nAlur Presentasi\n1. Logika dalam Analisis Presentasi\n2. Substansi Isi Presentasi\nProses Presentasi\n1. Kualitas Slides Presentasi\n2. Sistematika Slides Presentasi\nKomunikasi dalam Presentasi\n1. Kemampuan Menjelaskan Isi\nLaporan Magang']",• CV • Transkrip Nilai • Surat Rekomendasi Departemen • Mengisi Form Pakta Integritas,0.999999999975,1.0,0.8770165929725381,0.0
