,question,answer,contexts,ground_truth,context_precision,faithfulness,answer_relevancy,context_recall
0,Apa isi dari Permendikbud Nomor 3 Tahun 2020?,Saya tidak tahu.,"['• LAMPIRAN 7: Form Rincian Tugas Magang\nRINCIAN TUGAS MAGANG\nSemester Magang :... Tahun Akademik 20.../20...\nNama Mahasiswa\nNRP\nDepartemen\nNama Dosen Pembimbing\nNama Perusahaan Mitra Magang\nWaktu Pelaksanaan Magang\nNama Proyek / Kegiatan Magang\nPosisi dalam Proyek\nNO\nRincian Tugas Magang\nWaktu Pelaksanaan\nSurabaya, ..\nMahasiswa peserta magang (.........\n........)\nBuku Petunjuk Teknis Magang\n69'
 '• LAMPIRAN 6: Form Pengajuan Konversi Mata Kuliah\nNomor ........(NRP Mahasiswa)/(Semester)/2020\nLampiran : 1 (satu eks) laporan Magang/ Rincian Tugas Kegiatan magang\nPerihal : Surat Permohonan Konversi Magang\n(Tanggal Surat)\nKepada Yth\n: Kepala Departemen (Nama Departemen)\ndi ITS\nDengan hormat,\nSehubungan dengan pelaksanaan kegiatan Magang, saya yang bertanda tangan di bawah ini:\nNama Mahasiswa\nNRP\nDepartemen\nNo HP\nAlamat email\nmengajukan permohonan konversi Mata Kuliah untuk kegiatan Magang (Judul Kegiatan Magang) di (Perusahaan Tempat Magang) yang sedang/telah*) dilakukan pada .......d.......\n.... Adapun\ndetail mitra magang sebagai berikut :\nNama Perusahaan Tempat Magang\nAlamat Perusahaan Tempat\nMagang\nNo Telp Perusahaan Tempat\nMagang\nEmail perusahan\nNama Pembimbing Lapangan\nNo HP Pembimbing Lapangan\n....\nBerikut kami lampirkan Laporan Magang dan atau Rincian Kegiatan Magang.\nDemikian surat permohonan ini saya buat, atas perhatiannya saya sampaikan terima kasih.\nSurabaya,'
 '2\nKesungguhan melaksanakan Kerja Praktek\n15\n\n\n3\nDisiplin dalam menyelesaikan pekerjaan\n\n\n\n4\nTanggung jawab\n15\n\n\n5\nKeahlian / Keterampilan dalam Berprofesi\n20\n\n\n6\nKreatifitas / Inovasi\n15\n\n\n7\nSikap dan Perilaku dalam Bekerja\n\n\n\n8\nKemampuan Bekerjasama Dalam Tim\n5\n\n\nJUMLAH\n100\n\n\nNILAI AKHIR =\nJUMLAH (B X N)\nJUMLAH BOBOT\n100\nSurabaya,\nDosen Pembimbing Magang\n66\nLampiran\n\n• LAMPIRAN 5: Form Penilaian Magang (Pembimbing Lapangan)\nLEMBAR PENILAIAN KINERJA MAGANG\nSemester Magang :.... Tahun Akademik 20.../20...\nNama Mahasiswa\nNRP\nDepartemen\nNama Pembimbing Lapangan\nNo HP\nNama Perusahaan Mitra Magang\nWaktu Pelaksanaan Magang\nNama Proyek/ Kegiatan Magang\nNO\nASPEK YANG DINILAI\nBOBOT (B)\nNILAI (N)\n(0-100)\nJUMLAH\n(B XN)\n1\nKehadiran\n10\n\n\n2\nKesungguhan melaksanakan Kerja Praktek\n15\n\n\n3\nDisiplin dalam menyelesaikan pekerjaan\n10\n\n\n4\nTanggung jawab\n15\n\n\n5\nKeahlian / Keterampilan dalam Berprofesi\n20\n\n\n6\nKreatifitas / Inovasi\nST\n\n\n7\nSikap dan Perilaku dalam Bekerja\n10'
 '3\nDisiplin dalam menyelesaikan pekerjaan\n10\n\n\n4\nTanggung jawab\n15\n\n\n5\nKeahlian / Keterampilan dalam Berprofesi\n20\n\n\n6\nKreatifitas / Inovasi\nST\n\n\n7\nSikap dan Perilaku dalam Bekerja\n10\n\n\n8\nKemampuan Bekerjasama Dalam Tim\n5\n\n\nJUMLAH\n100\n\n\nNILAI AKHIR =\nJUMLAH (B X N)\nJUMLAH BOBOT\n100\nSurabaya,\nPembimbing Lapangan\nBuku Petunjuk Teknis Magang\n67']","Pendidikan Tinggi, mahasiswa sarjana ataupun mahasiswa sarjana terapan memiliki kesempatan menempuh pembelajaran diluar Perguruan Tinggi.",,0.0,0.0,0.0
1,Apa saja ketentuak mahasiswa dalam melaksanakan magang?,"Mahasiswa dalam melaksanakan magang harus mengikuti beberapa ketentuan, antara lain:
1. Menyusun Laporan Magang atau Rincian Kegiatan Magang.
2. Memilih salah satu dari lampiran yang disediakan.
3. Menyusun Form Rincian Tugas Magang sesuai dengan petunjuk yang diberikan.
4. Melaksanakan tugas magang sesuai dengan waktu dan proyek/kegiatan yang ditentukan.
5. Berkomunikasi dan berkonsultasi dengan Dosen Pembimbing Magang jika diperlukan.
6. Menyelesaikan tugas magang dengan disiplin, tanggung jawab, keahlian/keterampilan, kreativitas/inovasi, sikap dan perilaku yang baik, serta kemampuan bekerjasama dalam tim.
7. Menyerahkan Laporan Magang dan/atau melakukan presentasi kegiatan magang untuk dinilai oleh Dosen Pembimbing Magang.
8. Memperoleh penilaian akhir berdasarkan bobot nilai yang telah ditentukan.

Demikianlah beberapa ketentuan yang harus dipatuhi oleh mahasiswa dalam melaksanakan magang.","['....\nBerikut kami lampirkan Laporan Magang dan atau Rincian Kegiatan Magang.\nDemikian surat permohonan ini saya buat, atas perhatiannya saya sampaikan terima kasih.\nSurabaya,\nMahasiswa peserta magang\n*) dipilih salah satu\n68\nLampiran'
 '• LAMPIRAN 7: Form Rincian Tugas Magang\nRINCIAN TUGAS MAGANG\nSemester Magang :... Tahun Akademik 20.../20...\nNama Mahasiswa\nNRP\nDepartemen\nNama Dosen Pembimbing\nNama Perusahaan Mitra Magang\nWaktu Pelaksanaan Magang\nNama Proyek / Kegiatan Magang\nPosisi dalam Proyek\nNO\nRincian Tugas Magang\nWaktu Pelaksanaan\nSurabaya, ..\nMahasiswa peserta magang (.........\n........)\nBuku Petunjuk Teknis Magang\n69'
 '6.1\nKRITERIA DOSEN PEMBIMBING MAGANG\nW888\nDosen yang telah mengajar selama 4 semester berturut-turut.\nMemperoleh SK Pembimbing Magang dari Departemen dan ketetapan melalui\nKeputusan Dekan.\n6.2\nRINCIAN TUGAS DOSEN PEMBIMBING\nMAGANG\n• Memberikan saran dan masukan saat konsultasi keilmuan jika diperlukan oleh mahasiswa selama magang.\n• Melakukan kegiatan pembimbingan bagi mahasiswa magang untuk dapat berkonsultasi selama magang atau bimbingan penulisan laporan magang.\n• Memberikan persetujuan dan penilaian Laporan Magang.\n• Memberikan penilaian dapat dilakukan dalam bentuk penilaian laporan magang dan atau presentasi kegiatan magang.\n40\n06 Pembimbingan Magang'
 '3\nDisiplin dalam menyelesaikan pekerjaan\n10\n\n\n4\nTanggung jawab\n15\n\n\n5\nKeahlian / Keterampilan dalam Berprofesi\n20\n\n\n6\nKreatifitas / Inovasi\nST\n\n\n7\nSikap dan Perilaku dalam Bekerja\n10\n\n\n8\nKemampuan Bekerjasama Dalam Tim\n5\n\n\nJUMLAH\n100\n\n\nNILAI AKHIR =\nJUMLAH (B X N)\nJUMLAH BOBOT\n100\nSurabaya,\nPembimbing Lapangan\nBuku Petunjuk Teknis Magang\n67']","1. Pelaksanaan Program Magang memiliki durasi minimal 1 bulan dan maksimal 6 bulan. 2. Selama Program Magang berlangsung, mahasiswa tidak harus mengajukan cuti. 3. Selama Program Magang berlangsung, mahasiswa secara penuh waktu bekerja di lapangan sesuai kesepakatan. 4. Mahasiswa bisa mendapatkan izin untuk melakukan kegiatan akademik tertentu, melalui pembicaraan dan kesepakatan dengan pihak Mitra Magang. 5. Mahasiswa dapat mengajukan konversi mata kuliah dengan Capaian Pembelajaran Mata Kuliah (CPMK) yang selaras dengan Program Magang. 6. Mahasiswa wajib dibimbing oleh pembimbing internal dari Dosen Departemen dan pembimbing lapangan dari Mitra Magang 7. Sebelum Program Magang berlangsung, mahasiswa, Departemen dan Mitra Magang wajib menandatangani perjanjian kerjasama dan nota kesepahaman.",0.0,0.499999999975,0.8888888888888888,0.9640561349217958
2,Apa  Manfaat Program Magang bagi Mahasiswa,"Manfaat Program Magang bagi Mahasiswa antara lain adalah:
1. Memberikan pengalaman kerja nyata di lapangan yang dapat meningkatkan keterampilan dan pengetahuan praktis mahasiswa.
2. Memperluas jaringan profesional mahasiswa dengan berinteraksi langsung dengan dunia kerja.
3. Meningkatkan pemahaman mahasiswa tentang lingkungan kerja dan tuntutan pekerjaan di dunia nyata.
4. Memberikan kesempatan bagi mahasiswa untuk mengaplikasikan teori yang dipelajari di bangku kuliah ke dalam praktik kerja.
5. Membantu mahasiswa dalam mengembangkan soft skills seperti kemampuan komunikasi, kerjasama tim, dan kepemimpinan.
6. Menambah nilai tambah pada CV mahasiswa sehingga meningkatkan peluang mendapatkan pekerjaan setelah lulus.","['Beberapa ketentuan yang perlu diperhatikan khususnya oleh mahasiswa peserta magang dalam merencanakan dan melaksanakan ujian presentasi Laporan Magang sebagai berikut:\n• Ujian Presentasi Laporan Magang dilaksanakan oleh mahasiswa yang telah menyelesaikan penyusunan karya akhir Laporan Magang yang sudah disetujui oleh pembimbing magang.\n• Ujian Presentasi Magang dilaksanakan setelah berkas penilaian kinerja magang sudah diisi oleh unit tempat magang dan sudah diterima oleh program studi.\n• Ujian Presentasi Magang akan dilakukan di ruang ujian Sidang atau di ruang kelas.\n• Untuk dapat mengikuti Ujian Presentasi Magang, mahasiswa harus mengajukan Permohonan Ujian Presentasi Magang sesuai jadwal yang ditetapkan oleh Program Studi.\n• Ujian Presentasi Magang akan diuji oleh 3 (tiga) orang dosen penguji, salah satunya dosen pembimbing magang dan berlangsung sekitar 1,5 jam termasuk sesi untuk tanya jawab.'
 '• LAMPIRAN 7: Form Rincian Tugas Magang\nRINCIAN TUGAS MAGANG\nSemester Magang :... Tahun Akademik 20.../20...\nNama Mahasiswa\nNRP\nDepartemen\nNama Dosen Pembimbing\nNama Perusahaan Mitra Magang\nWaktu Pelaksanaan Magang\nNama Proyek / Kegiatan Magang\nPosisi dalam Proyek\nNO\nRincian Tugas Magang\nWaktu Pelaksanaan\nSurabaya, ..\nMahasiswa peserta magang (.........\n........)\nBuku Petunjuk Teknis Magang\n69'
 '7.5\nKETENTUAN ISI LAPORAN MAGANG\n• BAB 1. PENDAHULUAN\n1.1. Latar Belakang, meliputi\n• Mahasiswa menguraikan latar belakang (argumen / alasan) dari topik yang dipilih dalam Laporan Magang ini.\n• Latar belakang harus menunjukkan urgensi dari topik yang dipilih. Urgensi misal-nya ditunjukkan oleh keunikan topik (isu mutakhir), keunikan industri, permasalah-an atau risiko yang ditimbulkan, atau perbedaan pendapat.\n1.2. Tujuan Magang, meliputi\n• Mencerminkan hal-hal yang akan diuraikan di bab analisis.\n1.3. Manfaat Magang, meliputi\n• Manfaat untuk ITS\n• Manfaat untuk Mitra Magang\n• Manfaat untuk Mahasiswa\n1.4. Mahasiswa menguraikan tujuan penulisan topik magang.\n• Tujuan harus mencerminkan hal-hal yang akan diuraikan di bab analisis.\n• BAB 2. PROFIL MITRA MAGANG\n2.1. Sejarah Mitra Magang\n• Mahasiswa menguraikan sejarah mitra magang secara umum serta spesifik (unit / divisi terkait) yang menjadi konteks dari topik yang dipilih.\n2.2. Struktur Organisasi Mitra Magang'
 '6.4\nKETENTUAN PEMBIMBINGAN MAGANG\nBAGI DOSEN\nA.Dosen pembimbing harus dapat memberikan masukan dan pengarahan tentang pelaksanaan magang dan penulisan Laporan Magang. Pemberian masukan dan arahan tersebut diantaranya mencakup namun tidak terbatas pada hal berikut:\n• Memberikan masukan, arahan, dan mendiskusikan rumusan permasalahan dan tujuan atau topik Laporan Magang.\n• Membuat rencana bimbingan bersama mahasiswa.\n• Mengarahkan mahasiswa dalam hal metode penulisan ilmiah dan metode analisis dalam Laporan Magang sesuai dengan pedoman penulisan Laporan Magang yang telah disepakati.\n• Mendiskusikan acuan materi keilmuan yang relevan dengan topik Laporan Magang.\n• Hadir dalam Sidang Magang dan memberikan penilaian akhir bagi Laporan\nMagang yang diujikan.\n• Memberikan arahan dalam penyelesaian revisi Laporan Magang.\nB. Dosen pembimbing harus memastikan bahwa Laporan Magang bebas dari plagiarisme.\n6.5\nPENGGANTIAN DOSEN PEMBIMBING\nMAGANG']",• Sarana mengaplikasikan ilmu di dalam kelas perkuliahan ke dunia kerja. • Sarana mengetahui dan mempelajari proses industri. • Berinteraksi langsung dengan mitra magang. • Sarana memperoleh bahan tugas akhir. • Menyelesaikan SKS mata kuliah.,0.14285714285714285,0.6388888888675925,0.6666666666666666,0.9757362841836904
3,Berapa perhitugan 1 sks magang dalam jam kerja?,Perhitungan 1 sks magang dalam jam kerja adalah sebanyak 50 jam kerja.,"['• LAMPIRAN 7: Form Rincian Tugas Magang\nRINCIAN TUGAS MAGANG\nSemester Magang :... Tahun Akademik 20.../20...\nNama Mahasiswa\nNRP\nDepartemen\nNama Dosen Pembimbing\nNama Perusahaan Mitra Magang\nWaktu Pelaksanaan Magang\nNama Proyek / Kegiatan Magang\nPosisi dalam Proyek\nNO\nRincian Tugas Magang\nWaktu Pelaksanaan\nSurabaya, ..\nMahasiswa peserta magang (.........\n........)\nBuku Petunjuk Teknis Magang\n69'
 '....\nBerikut kami lampirkan Laporan Magang dan atau Rincian Kegiatan Magang.\nDemikian surat permohonan ini saya buat, atas perhatiannya saya sampaikan terima kasih.\nSurabaya,\nMahasiswa peserta magang\n*) dipilih salah satu\n68\nLampiran'
 '3\nDisiplin dalam menyelesaikan pekerjaan\n10\n\n\n4\nTanggung jawab\n15\n\n\n5\nKeahlian / Keterampilan dalam Berprofesi\n20\n\n\n6\nKreatifitas / Inovasi\nST\n\n\n7\nSikap dan Perilaku dalam Bekerja\n10\n\n\n8\nKemampuan Bekerjasama Dalam Tim\n5\n\n\nJUMLAH\n100\n\n\nNILAI AKHIR =\nJUMLAH (B X N)\nJUMLAH BOBOT\n100\nSurabaya,\nPembimbing Lapangan\nBuku Petunjuk Teknis Magang\n67'
 '6.1\nKRITERIA DOSEN PEMBIMBING MAGANG\nW888\nDosen yang telah mengajar selama 4 semester berturut-turut.\nMemperoleh SK Pembimbing Magang dari Departemen dan ketetapan melalui\nKeputusan Dekan.\n6.2\nRINCIAN TUGAS DOSEN PEMBIMBING\nMAGANG\n• Memberikan saran dan masukan saat konsultasi keilmuan jika diperlukan oleh mahasiswa selama magang.\n• Melakukan kegiatan pembimbingan bagi mahasiswa magang untuk dapat berkonsultasi selama magang atau bimbingan penulisan laporan magang.\n• Memberikan persetujuan dan penilaian Laporan Magang.\n• Memberikan penilaian dapat dilakukan dalam bentuk penilaian laporan magang dan atau presentasi kegiatan magang.\n40\n06 Pembimbingan Magang']",setara dengan kerja 45 jam,0.3333333333,0.0,0.9670436719899351,0.0
4,Bagaimana Proses pengajuan konversi kegiatan magang dengan MK yang setara CPMK-nya?,"Proses pengajuan konversi kegiatan magang dengan MK yang setara CPMK-nya dimulai dengan mengisi Form Pengajuan Konversi Mata Kuliah yang mencakup informasi seperti nomor NRP mahasiswa, semester, tahun, laporan magang, rincian tugas kegiatan magang, perusahaan tempat magang, dan lain sebagainya. Setelah itu, surat permohonan konversi magang diajukan kepada Kepala Departemen yang bersangkutan di ITS. Dalam surat permohonan tersebut, harus disebutkan detail mitra magang seperti nama perusahaan tempat magang, alamat perusahaan, nomor telepon, email perusahaan, nama pembimbing lapangan, dan nomor HP pembimbing lapangan. Selain itu, juga perlu dilampirkan laporan magang dan/atau rincian kegiatan magang. Proses pengajuan konversi ini harus dilakukan dengan memperhatikan petunjuk teknis magang yang berlaku. Jika terdapat penggantian dosen pembimbing magang, hal tersebut juga harus dilakukan dengan persetujuan dari Kepala Departemen.","['• LAMPIRAN 6: Form Pengajuan Konversi Mata Kuliah\nNomor ........(NRP Mahasiswa)/(Semester)/2020\nLampiran : 1 (satu eks) laporan Magang/ Rincian Tugas Kegiatan magang\nPerihal : Surat Permohonan Konversi Magang\n(Tanggal Surat)\nKepada Yth\n: Kepala Departemen (Nama Departemen)\ndi ITS\nDengan hormat,\nSehubungan dengan pelaksanaan kegiatan Magang, saya yang bertanda tangan di bawah ini:\nNama Mahasiswa\nNRP\nDepartemen\nNo HP\nAlamat email\nmengajukan permohonan konversi Mata Kuliah untuk kegiatan Magang (Judul Kegiatan Magang) di (Perusahaan Tempat Magang) yang sedang/telah*) dilakukan pada .......d.......\n.... Adapun\ndetail mitra magang sebagai berikut :\nNama Perusahaan Tempat Magang\nAlamat Perusahaan Tempat\nMagang\nNo Telp Perusahaan Tempat\nMagang\nEmail perusahan\nNama Pembimbing Lapangan\nNo HP Pembimbing Lapangan\n....\nBerikut kami lampirkan Laporan Magang dan atau Rincian Kegiatan Magang.\nDemikian surat permohonan ini saya buat, atas perhatiannya saya sampaikan terima kasih.\nSurabaya,'
 '• LAMPIRAN 7: Form Rincian Tugas Magang\nRINCIAN TUGAS MAGANG\nSemester Magang :... Tahun Akademik 20.../20...\nNama Mahasiswa\nNRP\nDepartemen\nNama Dosen Pembimbing\nNama Perusahaan Mitra Magang\nWaktu Pelaksanaan Magang\nNama Proyek / Kegiatan Magang\nPosisi dalam Proyek\nNO\nRincian Tugas Magang\nWaktu Pelaksanaan\nSurabaya, ..\nMahasiswa peserta magang (.........\n........)\nBuku Petunjuk Teknis Magang\n69'
 '2. Substansi Isi Presentasi\nProses Presentasi\n1. Kualitas Slides Presentasi\n2. Sistematika Slides Presentasi\nKomunikasi dalam Presentasi\n1. Kemampuan Menjelaskan Isi\nLaporan Magang\n2. Kemampuan Menjawab Pertanyaan\nPenguji\nTabel 8.1 Butir Penilaian Presentasi Laporan Magang\nBuku Petunjuk Teknis Magang\n55'
 '• Memberikan arahan dalam penyelesaian revisi Laporan Magang.\nB. Dosen pembimbing harus memastikan bahwa Laporan Magang bebas dari plagiarisme.\n6.5\nPENGGANTIAN DOSEN PEMBIMBING\nMAGANG\n• Penggantian dosen pembimbing magang harus didasarkan pada alasan yang dapat dipertanggungjawabkan.\n• Pengajuan permohonan penggantian dosen pembimbing magang dapat dilakukan selambat-lambatnya 2 (dua) bulan setelah magang dimulai.\n• Penggantian dosen pembimbing magang harus dengan persetujuan dari Kepala\nDepartemen.\n42\n06 Pembimbingan Magang']","• Subdirektorat PK2 akan menyampaikan rencana kegiatan selama magang yang diterima dari mitra magang kepada departemen dimana mahasiswa magang berasal. • Departemen akan melakukan verifikasi dan validasi untuk menilai mata kuliah apa saja yang CPMK-nya selaras dengan kegiatan magang berdasarkan rencana kegiatan magang dan akan berdiskusi dengan mitra magang jika diperlukan untuk mendapat-kan penjelasan lebih detail. • Departemen akan menyampaikan ke mahasiswa hasil verifikasi berupa daftar MK yang dapat dikonversikan dengan kegiatan magang. • Mahasiswa harus mengisi FRS dengan Mata Kuliah yang akan dikonversikan dengan Kegiatan Magang pada semester yang sama, atau mahasiswa bersama dosen wali akan melakukan revisi paling lambat minggu ke 4 perkuliahan jika jadwal FRS sudah terlampaui.",0.999999999975,1.0,0.9879455591382631,0.25
5,Bagaimana SOP konversi mata kuliah untuk magang mandiri?,"SOP konversi mata kuliah untuk magang mandiri melibatkan proses permohonan konversi mata kuliah dari mahasiswa peserta magang kepada dosen wali departemen. Dalam permohonan tersebut, harus disertakan detail informasi mengenai nama mahasiswa, NRP, nama mitra magang, periode magang, serta rincian tugas magang yang telah dilakukan atau akan dilakukan. Setelah itu, hasil telaah dan analisa dengan bidang akademik departemen akan menentukan apakah mahasiswa berhak mendapatkan konversi mata kuliah dan SKS. Jika berhak, konversi tersebut akan dilakukan pada semester tertentu dalam tahun ajaran yang bersangkutan. Selain itu, terdapat daftar mata kuliah yang dapat dikonversikan dengan kegiatan magang yang harus disertakan dalam permohonan konversi mata kuliah.","['• LAMPIRAN 7: Form Rincian Tugas Magang\nRINCIAN TUGAS MAGANG\nSemester Magang :... Tahun Akademik 20.../20...\nNama Mahasiswa\nNRP\nDepartemen\nNama Dosen Pembimbing\nNama Perusahaan Mitra Magang\nWaktu Pelaksanaan Magang\nNama Proyek / Kegiatan Magang\nPosisi dalam Proyek\nNO\nRincian Tugas Magang\nWaktu Pelaksanaan\nSurabaya, ..\nMahasiswa peserta magang (.........\n........)\nBuku Petunjuk Teknis Magang\n69'
 '• LAMPIRAN 8: Form Persetujuan Konversi Mata Kuliah\nLAMPIRAN 1\nKOP Departemen\nNo\n:....\nLampiran :\nPerihal :.\nKepada yth :\nDosen Wali Departemen ...\nFakultas...\nITS\nSehubungan dengan adanya permohonan konversi mata kuliah dari mahasiswa peserta magang dengan detail sebagai berikut :\nNama\nNRP\nNama Mitra Magang :\nPeriode magang\nMahasiswa yang bersangkutan akan/ telah *) melakukan magang dengan rincian tugas sebagai berikut :\nBerdasarkan hasil telaah dan analisa dengan bidang akademik departemen, maka mahasiswa yang bersangkutan berhak untuk mendapatkan konversi mata kuliah dan SKS, dimana konversi ini akan di lakukan pada semester..... tahun ajaran ....\n.......Adapun mata kuliah yang dapat dikonversikan dengan\nkegiatan magang adalah sebagai berikut :\nNo.\nMata Kuliah Konversi\nJumlah SKS\n\n\n\n\n\n\n\n\n\nTotal SKS\n\nSurabaya, ....\n*) dicoret\nKepala Departemen ....\n70\nLampiran\n\nSUBDIREKTORAT PENGEMBANGAN KEWIRAUSAHAAN DAN KARIR\nDIREKTORAT KEMAHASISWAAN\nINSTITUT TEKNOLOGI SEPULUH NOPEMBER\n2020'
 '....\nBerikut kami lampirkan Laporan Magang dan atau Rincian Kegiatan Magang.\nDemikian surat permohonan ini saya buat, atas perhatiannya saya sampaikan terima kasih.\nSurabaya,\nMahasiswa peserta magang\n*) dipilih salah satu\n68\nLampiran'
 '09\nЕТІКА\nMAGANG\n\n09\nETIKA MAGANG\n9.1\nETIKA PELAKSANAAN MAGANG DI PERUSAHAAN MITRA MAGANG\nVX\n• Mahasiswa harus mematuhi aturan Mitra Magang dengan baik.\n• Mahasiswa harus bekerja dan berusaha memberikan yang terbaik untuk kepentingan Mitra Magang.\n• Mahasiswa harus dapat menyelesaikan segala tugas yang diberikan\nMitra Magang dengan benar, rapi dan tepat waktu.\n• Mahasiswa harus menghormati pegawai Mitra Magang tanpa membedakan suku, agama, ras, gender dan golongan.\n• Mahasiswa bersikap jujur, disiplin, santun, profesional, dan menjaga etos kerja di unit kerja Mitra Magang.\n• Mahasiswa harus menjaga kerahasiaan informasi unit kerja Mitra Magang. Seluruh informasi dan data yang akan dijadikan sumber dalam penulisan laporan magang harus disamarkan dalam penulisan untuk menjaga kerahasidan data dan informasi Mitra Magang.\n• Mahasiswa harus menjaga nama baik almamater ITS.\n58\n09 Etika Magang']",Melaporkan kegiatan magang Mengupdate data magang Mengajukan permohonan konversi MK Melakukan telaah dan verifikasi bersama tim akademik departemen Menerima hasil telaah MK yang dikonversikan dengan Magang Melakukan FRS / Perubahan FRS Dosen wali mengetahui dan menyetujui FRS / Perubahan FRS di semester yang sama / di semester depan,0.9166666666361111,1.0,0.9844345210572465,0.0
6,Apa itu Program Magang Mahasiswa Bersertifikat (PMMB) ?,"Program Magang Mahasiswa Bersertifikat (PMMB) adalah program yang memungkinkan mahasiswa untuk melakukan magang di perusahaan mitra dengan persetujuan dari pembimbing magang. Dalam program ini, mahasiswa akan melakukan penyusunan karya akhir berupa Laporan Magang yang kemudian akan dipresentasikan dalam Ujian Presentasi Laporan Magang. Ujian Presentasi Laporan Magang dilakukan oleh 3 orang dosen penguji, termasuk dosen pembimbing magang, dan berlangsung sekitar 1,5 jam termasuk sesi tanya jawab. Sebelum mengikuti ujian, mahasiswa harus mengajukan Permohonan Ujian Presentasi Magang sesuai jadwal yang ditetapkan oleh Program Studi.","['Beberapa ketentuan yang perlu diperhatikan khususnya oleh mahasiswa peserta magang dalam merencanakan dan melaksanakan ujian presentasi Laporan Magang sebagai berikut:\n• Ujian Presentasi Laporan Magang dilaksanakan oleh mahasiswa yang telah menyelesaikan penyusunan karya akhir Laporan Magang yang sudah disetujui oleh pembimbing magang.\n• Ujian Presentasi Magang dilaksanakan setelah berkas penilaian kinerja magang sudah diisi oleh unit tempat magang dan sudah diterima oleh program studi.\n• Ujian Presentasi Magang akan dilakukan di ruang ujian Sidang atau di ruang kelas.\n• Untuk dapat mengikuti Ujian Presentasi Magang, mahasiswa harus mengajukan Permohonan Ujian Presentasi Magang sesuai jadwal yang ditetapkan oleh Program Studi.\n• Ujian Presentasi Magang akan diuji oleh 3 (tiga) orang dosen penguji, salah satunya dosen pembimbing magang dan berlangsung sekitar 1,5 jam termasuk sesi untuk tanya jawab.'
 '• LAMPIRAN 7: Form Rincian Tugas Magang\nRINCIAN TUGAS MAGANG\nSemester Magang :... Tahun Akademik 20.../20...\nNama Mahasiswa\nNRP\nDepartemen\nNama Dosen Pembimbing\nNama Perusahaan Mitra Magang\nWaktu Pelaksanaan Magang\nNama Proyek / Kegiatan Magang\nPosisi dalam Proyek\nNO\nRincian Tugas Magang\nWaktu Pelaksanaan\nSurabaya, ..\nMahasiswa peserta magang (.........\n........)\nBuku Petunjuk Teknis Magang\n69'
 '6.4\nKETENTUAN PEMBIMBINGAN MAGANG\nBAGI DOSEN\nA.Dosen pembimbing harus dapat memberikan masukan dan pengarahan tentang pelaksanaan magang dan penulisan Laporan Magang. Pemberian masukan dan arahan tersebut diantaranya mencakup namun tidak terbatas pada hal berikut:\n• Memberikan masukan, arahan, dan mendiskusikan rumusan permasalahan dan tujuan atau topik Laporan Magang.\n• Membuat rencana bimbingan bersama mahasiswa.\n• Mengarahkan mahasiswa dalam hal metode penulisan ilmiah dan metode analisis dalam Laporan Magang sesuai dengan pedoman penulisan Laporan Magang yang telah disepakati.\n• Mendiskusikan acuan materi keilmuan yang relevan dengan topik Laporan Magang.\n• Hadir dalam Sidang Magang dan memberikan penilaian akhir bagi Laporan\nMagang yang diujikan.\n• Memberikan arahan dalam penyelesaian revisi Laporan Magang.\nB. Dosen pembimbing harus memastikan bahwa Laporan Magang bebas dari plagiarisme.\n6.5\nPENGGANTIAN DOSEN PEMBIMBING\nMAGANG'
 '2\nKesungguhan melaksanakan Kerja Praktek\n15\n\n\n3\nDisiplin dalam menyelesaikan pekerjaan\n\n\n\n4\nTanggung jawab\n15\n\n\n5\nKeahlian / Keterampilan dalam Berprofesi\n20\n\n\n6\nKreatifitas / Inovasi\n15\n\n\n7\nSikap dan Perilaku dalam Bekerja\n\n\n\n8\nKemampuan Bekerjasama Dalam Tim\n5\n\n\nJUMLAH\n100\n\n\nNILAI AKHIR =\nJUMLAH (B X N)\nJUMLAH BOBOT\n100\nSurabaya,\nDosen Pembimbing Magang\n66\nLampiran\n\n• LAMPIRAN 5: Form Penilaian Magang (Pembimbing Lapangan)\nLEMBAR PENILAIAN KINERJA MAGANG\nSemester Magang :.... Tahun Akademik 20.../20...\nNama Mahasiswa\nNRP\nDepartemen\nNama Pembimbing Lapangan\nNo HP\nNama Perusahaan Mitra Magang\nWaktu Pelaksanaan Magang\nNama Proyek/ Kegiatan Magang\nNO\nASPEK YANG DINILAI\nBOBOT (B)\nNILAI (N)\n(0-100)\nJUMLAH\n(B XN)\n1\nKehadiran\n10\n\n\n2\nKesungguhan melaksanakan Kerja Praktek\n15\n\n\n3\nDisiplin dalam menyelesaikan pekerjaan\n10\n\n\n4\nTanggung jawab\n15\n\n\n5\nKeahlian / Keterampilan dalam Berprofesi\n20\n\n\n6\nKreatifitas / Inovasi\nST\n\n\n7\nSikap dan Perilaku dalam Bekerja\n10']",Program Magang Mahasiswa Bersertifikat (PMMB) merupakan program magang yang bekerjasama dengan Forum Human Capital Indonesia (FHCI).,0.49999999995,1.0,0.8423846061405028,0.0
7,"Apa peran Subdirektorat Pengembangan Kewirausahaan dan
Karir (PK2) dalam penyelenggaraan Program Magang?","TANYABOT: Subdirektorat Pengembangan Kewirausahaan dan Karir (PK2) memiliki peran dalam penyelenggaraan Program Magang dengan memberikan arahan dalam penyelesaian revisi Laporan Magang. Selain itu, PK2 juga bertanggung jawab untuk memastikan bahwa Laporan Magang bebas dari plagiarisme.","['Beberapa ketentuan yang perlu diperhatikan khususnya oleh mahasiswa peserta magang dalam merencanakan dan melaksanakan ujian presentasi Laporan Magang sebagai berikut:\n• Ujian Presentasi Laporan Magang dilaksanakan oleh mahasiswa yang telah menyelesaikan penyusunan karya akhir Laporan Magang yang sudah disetujui oleh pembimbing magang.\n• Ujian Presentasi Magang dilaksanakan setelah berkas penilaian kinerja magang sudah diisi oleh unit tempat magang dan sudah diterima oleh program studi.\n• Ujian Presentasi Magang akan dilakukan di ruang ujian Sidang atau di ruang kelas.\n• Untuk dapat mengikuti Ujian Presentasi Magang, mahasiswa harus mengajukan Permohonan Ujian Presentasi Magang sesuai jadwal yang ditetapkan oleh Program Studi.\n• Ujian Presentasi Magang akan diuji oleh 3 (tiga) orang dosen penguji, salah satunya dosen pembimbing magang dan berlangsung sekitar 1,5 jam termasuk sesi untuk tanya jawab.'
 '• Memberikan arahan dalam penyelesaian revisi Laporan Magang.\nB. Dosen pembimbing harus memastikan bahwa Laporan Magang bebas dari plagiarisme.\n6.5\nPENGGANTIAN DOSEN PEMBIMBING\nMAGANG\n• Penggantian dosen pembimbing magang harus didasarkan pada alasan yang dapat dipertanggungjawabkan.\n• Pengajuan permohonan penggantian dosen pembimbing magang dapat dilakukan selambat-lambatnya 2 (dua) bulan setelah magang dimulai.\n• Penggantian dosen pembimbing magang harus dengan persetujuan dari Kepala\nDepartemen.\n42\n06 Pembimbingan Magang'
 '• LAMPIRAN 7: Form Rincian Tugas Magang\nRINCIAN TUGAS MAGANG\nSemester Magang :... Tahun Akademik 20.../20...\nNama Mahasiswa\nNRP\nDepartemen\nNama Dosen Pembimbing\nNama Perusahaan Mitra Magang\nWaktu Pelaksanaan Magang\nNama Proyek / Kegiatan Magang\nPosisi dalam Proyek\nNO\nRincian Tugas Magang\nWaktu Pelaksanaan\nSurabaya, ..\nMahasiswa peserta magang (.........\n........)\nBuku Petunjuk Teknis Magang\n69'
 '6.4\nKETENTUAN PEMBIMBINGAN MAGANG\nBAGI DOSEN\nA.Dosen pembimbing harus dapat memberikan masukan dan pengarahan tentang pelaksanaan magang dan penulisan Laporan Magang. Pemberian masukan dan arahan tersebut diantaranya mencakup namun tidak terbatas pada hal berikut:\n• Memberikan masukan, arahan, dan mendiskusikan rumusan permasalahan dan tujuan atau topik Laporan Magang.\n• Membuat rencana bimbingan bersama mahasiswa.\n• Mengarahkan mahasiswa dalam hal metode penulisan ilmiah dan metode analisis dalam Laporan Magang sesuai dengan pedoman penulisan Laporan Magang yang telah disepakati.\n• Mendiskusikan acuan materi keilmuan yang relevan dengan topik Laporan Magang.\n• Hadir dalam Sidang Magang dan memberikan penilaian akhir bagi Laporan\nMagang yang diujikan.\n• Memberikan arahan dalam penyelesaian revisi Laporan Magang.\nB. Dosen pembimbing harus memastikan bahwa Laporan Magang bebas dari plagiarisme.\n6.5\nPENGGANTIAN DOSEN PEMBIMBING\nMAGANG']",1. Sebagai koordinator dalam penyelenggaraan Program Magang. 2. Menyusun kebijakan terkait magang untuk memfasilitasi kegiatan pembelajaran akademik dan Program Magang. 3. Mengkoordinasikan penyusunan Perjanjian Kerja Sama (PKS) dengan Mitra Magang. 4. Menginisiasi kerjasama magang dengan mitra magang,0.999999999975,0.0,0.9915715492719342,0.0
8,Bagaimana skema waktu pelaksanaan program magang?,"Skema waktu pelaksanaan program magang biasanya disesuaikan dengan kesepakatan antara mahasiswa, dosen pembimbing, dan perusahaan mitra magang. Program magang dapat dilakukan selama satu semester atau lebih, tergantung pada kesepakatan yang telah dibuat. Selain itu, waktu pelaksanaan magang juga dapat disesuaikan dengan jadwal kerja mahasiswa dan perusahaan mitra magang. Selama program magang, mahasiswa diharapkan dapat melaksanakan tugas magang sesuai dengan rincian yang telah disepakati dan mendapatkan bimbingan dari dosen pembimbing.","['• LAMPIRAN 7: Form Rincian Tugas Magang\nRINCIAN TUGAS MAGANG\nSemester Magang :... Tahun Akademik 20.../20...\nNama Mahasiswa\nNRP\nDepartemen\nNama Dosen Pembimbing\nNama Perusahaan Mitra Magang\nWaktu Pelaksanaan Magang\nNama Proyek / Kegiatan Magang\nPosisi dalam Proyek\nNO\nRincian Tugas Magang\nWaktu Pelaksanaan\nSurabaya, ..\nMahasiswa peserta magang (.........\n........)\nBuku Petunjuk Teknis Magang\n69'
 '6.4\nKETENTUAN PEMBIMBINGAN MAGANG\nBAGI DOSEN\nA.Dosen pembimbing harus dapat memberikan masukan dan pengarahan tentang pelaksanaan magang dan penulisan Laporan Magang. Pemberian masukan dan arahan tersebut diantaranya mencakup namun tidak terbatas pada hal berikut:\n• Memberikan masukan, arahan, dan mendiskusikan rumusan permasalahan dan tujuan atau topik Laporan Magang.\n• Membuat rencana bimbingan bersama mahasiswa.\n• Mengarahkan mahasiswa dalam hal metode penulisan ilmiah dan metode analisis dalam Laporan Magang sesuai dengan pedoman penulisan Laporan Magang yang telah disepakati.\n• Mendiskusikan acuan materi keilmuan yang relevan dengan topik Laporan Magang.\n• Hadir dalam Sidang Magang dan memberikan penilaian akhir bagi Laporan\nMagang yang diujikan.\n• Memberikan arahan dalam penyelesaian revisi Laporan Magang.\nB. Dosen pembimbing harus memastikan bahwa Laporan Magang bebas dari plagiarisme.\n6.5\nPENGGANTIAN DOSEN PEMBIMBING\nMAGANG'
 'Beberapa ketentuan yang perlu diperhatikan khususnya oleh mahasiswa peserta magang dalam merencanakan dan melaksanakan ujian presentasi Laporan Magang sebagai berikut:\n• Ujian Presentasi Laporan Magang dilaksanakan oleh mahasiswa yang telah menyelesaikan penyusunan karya akhir Laporan Magang yang sudah disetujui oleh pembimbing magang.\n• Ujian Presentasi Magang dilaksanakan setelah berkas penilaian kinerja magang sudah diisi oleh unit tempat magang dan sudah diterima oleh program studi.\n• Ujian Presentasi Magang akan dilakukan di ruang ujian Sidang atau di ruang kelas.\n• Untuk dapat mengikuti Ujian Presentasi Magang, mahasiswa harus mengajukan Permohonan Ujian Presentasi Magang sesuai jadwal yang ditetapkan oleh Program Studi.\n• Ujian Presentasi Magang akan diuji oleh 3 (tiga) orang dosen penguji, salah satunya dosen pembimbing magang dan berlangsung sekitar 1,5 jam termasuk sesi untuk tanya jawab.'
 '6.1\nKRITERIA DOSEN PEMBIMBING MAGANG\nW888\nDosen yang telah mengajar selama 4 semester berturut-turut.\nMemperoleh SK Pembimbing Magang dari Departemen dan ketetapan melalui\nKeputusan Dekan.\n6.2\nRINCIAN TUGAS DOSEN PEMBIMBING\nMAGANG\n• Memberikan saran dan masukan saat konsultasi keilmuan jika diperlukan oleh mahasiswa selama magang.\n• Melakukan kegiatan pembimbingan bagi mahasiswa magang untuk dapat berkonsultasi selama magang atau bimbingan penulisan laporan magang.\n• Memberikan persetujuan dan penilaian Laporan Magang.\n• Memberikan penilaian dapat dilakukan dalam bentuk penilaian laporan magang dan atau presentasi kegiatan magang.\n40\n06 Pembimbingan Magang']",Program Mahasiswa Magang Bersertifikat (PMMB) • Magang dilaksanakan maksimal 6 bulan • Magang dilaksanakan 2 periode dalam 1 tahun yaitu 1. Periode Febuari - Agustus 2. Periode September - Januari Program Mahasiswa Magang Kerjasama • Magang dilaksanakan sekurang-kurangnya 1 bulan maksimal 6 bulan • Magang dilaksanakan setiap saat sesuai dengan kesepakatan dengan Mitra Magang. Program Magang Mandiri • Magang dilaksanakan sekurang-kurangnya 1 bulan dan maksimal 6 bulan • Magang dilaksanakan setiap saat sesuai dengan kesepakatan dengan Mitra Magang.,0.9999999999,1.0,0.0,
9,Apa saja rincian tugas dosen pembimbing magang?,"Rincian tugas dosen pembimbing magang meliputi:
1. Memberikan saran dan masukan saat konsultasi keilmuan jika diperlukan oleh mahasiswa selama magang.
2. Melakukan kegiatan pembimbingan bagi mahasiswa magang untuk dapat berkonsultasi selama magang atau bimbingan penulisan laporan magang.
3. Memberikan persetujuan dan penilaian Laporan Magang.
4. Memberikan penilaian dapat dilakukan dalam bentuk penilaian laporan magang dan atau presentasi kegiatan magang.
5. Memberikan arahan dalam penyelesaian revisi Laporan Magang.
6. Memastikan bahwa Laporan Magang bebas dari plagiarisme.","['• LAMPIRAN 7: Form Rincian Tugas Magang\nRINCIAN TUGAS MAGANG\nSemester Magang :... Tahun Akademik 20.../20...\nNama Mahasiswa\nNRP\nDepartemen\nNama Dosen Pembimbing\nNama Perusahaan Mitra Magang\nWaktu Pelaksanaan Magang\nNama Proyek / Kegiatan Magang\nPosisi dalam Proyek\nNO\nRincian Tugas Magang\nWaktu Pelaksanaan\nSurabaya, ..\nMahasiswa peserta magang (.........\n........)\nBuku Petunjuk Teknis Magang\n69'
 '6.1\nKRITERIA DOSEN PEMBIMBING MAGANG\nW888\nDosen yang telah mengajar selama 4 semester berturut-turut.\nMemperoleh SK Pembimbing Magang dari Departemen dan ketetapan melalui\nKeputusan Dekan.\n6.2\nRINCIAN TUGAS DOSEN PEMBIMBING\nMAGANG\n• Memberikan saran dan masukan saat konsultasi keilmuan jika diperlukan oleh mahasiswa selama magang.\n• Melakukan kegiatan pembimbingan bagi mahasiswa magang untuk dapat berkonsultasi selama magang atau bimbingan penulisan laporan magang.\n• Memberikan persetujuan dan penilaian Laporan Magang.\n• Memberikan penilaian dapat dilakukan dalam bentuk penilaian laporan magang dan atau presentasi kegiatan magang.\n40\n06 Pembimbingan Magang'
 '6.4\nKETENTUAN PEMBIMBINGAN MAGANG\nBAGI DOSEN\nA.Dosen pembimbing harus dapat memberikan masukan dan pengarahan tentang pelaksanaan magang dan penulisan Laporan Magang. Pemberian masukan dan arahan tersebut diantaranya mencakup namun tidak terbatas pada hal berikut:\n• Memberikan masukan, arahan, dan mendiskusikan rumusan permasalahan dan tujuan atau topik Laporan Magang.\n• Membuat rencana bimbingan bersama mahasiswa.\n• Mengarahkan mahasiswa dalam hal metode penulisan ilmiah dan metode analisis dalam Laporan Magang sesuai dengan pedoman penulisan Laporan Magang yang telah disepakati.\n• Mendiskusikan acuan materi keilmuan yang relevan dengan topik Laporan Magang.\n• Hadir dalam Sidang Magang dan memberikan penilaian akhir bagi Laporan\nMagang yang diujikan.\n• Memberikan arahan dalam penyelesaian revisi Laporan Magang.\nB. Dosen pembimbing harus memastikan bahwa Laporan Magang bebas dari plagiarisme.\n6.5\nPENGGANTIAN DOSEN PEMBIMBING\nMAGANG'
 '• Memberikan arahan dalam penyelesaian revisi Laporan Magang.\nB. Dosen pembimbing harus memastikan bahwa Laporan Magang bebas dari plagiarisme.\n6.5\nPENGGANTIAN DOSEN PEMBIMBING\nMAGANG\n• Penggantian dosen pembimbing magang harus didasarkan pada alasan yang dapat dipertanggungjawabkan.\n• Pengajuan permohonan penggantian dosen pembimbing magang dapat dilakukan selambat-lambatnya 2 (dua) bulan setelah magang dimulai.\n• Penggantian dosen pembimbing magang harus dengan persetujuan dari Kepala\nDepartemen.\n42\n06 Pembimbingan Magang']",• Memberikan saran dan masukan saat konsultasi keilmuan jika diperlukan oleh mahasiswa selama magang. • Melakukan kegiatan pembimbingan bagi mahasiswa magang untuk dapat berkonsultasi selama magang atau bimbingan penulisan laporan magang. • Memberikan persetujuan dan penilaian Laporan Magang. • Memberikan penilaian dapat dilakukan dalam bentuk penilaian laporan magang dan atau presentasi kegiatan magang.,0.999999999975,1.0,0.9908715462211678,1.0
10,Apa fungsi laporan magang?,"Fungsi laporan magang adalah sebagai pertanggungjawaban kegiatan magang mahasiswa kepada Mitra Magang dan Departemen, sebagai bahan pertimbangan pemberian nilai kegiatan magang, sebagai penyampaian informasi bagi pihak ITS, mahasiswa, maupun Mitra Magang, sebagai alat untuk membina hubungan kerjasama, saling pengertian, dan koordinasi antara mahasiswa dengan pihak ITS maupun Mitra Magang, serta sebagai alat untuk menyampaikan ide, pendapat, penilaian, dan pengalaman yang berkaitan dengan penyelenggaraan magang kepada pihak lain.","['Berikut adalah ketentuan umum mengenai Laporan Magang:\n• Pada akhir pelaksanaan magang mahasiswa diwajibkan menulis Laporan Magang.\n• Pedoman penulisan Laporan Magang dapat ditemukan pada Bagian 5 dari buku petunjuk teknis magang ini.\n• Laporan Magang harus disetujui oleh dosen pembimbing magang dan dosen lapangan.\n• Laporan Magang harus diselesaikan segera setelah Program Magang berakhir.\n• Laporan Magang yang telah disetujui pembimbing magang dapat di presentasikan jika diperlukan.\n• Dalam penyusunan Laporan Magang, mahasiswa wajib menaati ketentuan kerahasiaan data / informasi yang ditetapkan oleh unit tempat magang.\n8.4\nPENILAIAN PRESENTASI LAPORAN\nMAGANG (JIKA DIPERLUKAN)\nButir penilaian presentasi Laporan Magang mencakup aspek berikut ini:\nAlur Presentasi\n1. Logika dalam Analisis Presentasi\n2. Substansi Isi Presentasi\nProses Presentasi\n1. Kualitas Slides Presentasi\n2. Sistematika Slides Presentasi\nKomunikasi dalam Presentasi\n1. Kemampuan Menjelaskan Isi\nLaporan Magang'
 '7.2\nKETENTUAN UMUM DALAM PENULISAN\nLAPORAN MAGANG\n• Laporan Magang ditulis dan dipresentasikan pada akhir magang (jika diperlukan).\n• Laporan Magang selain diserahkan ke departemen dan mitra magang, juga diserahkan ke Subdirektorat PK2 Direktorat Kemahasiswaan dalam bentuk softcopy melalui SIM Magang.\n7.3\nPRINSIP PENULISAN LAPORAN\nMAGANG\n• BENAR DAN OBYEKTIF\nLaporan magang harus sesuai dengan ketentuan yang ada dalam pedoman ini serta memuat informasi yang benar dan obyektif.\n• JELAS DAN CERMAT\nLaporan magang harus mudah dimengerti / dipahami oleh pembaca, dengan cara menghindari pemakaian kata / istilah, rangkaian kata / kalimat atau gaya bahasa yang kurang dapat dipahami oleh pembaca maupun penulisnya sendiri. Gunakan kata-kata yang sederhana tetapi jelas maksudnya.\n• LANGSUNG KE SASARAN'
 '07\nPEDOMAN\nPENULISAN\nLAPORAN\nMAGANG\n\n07\nPEDOMAN PENULISAN LAPORAN\nMAGANG\n7.1\nFUNGSI LAPORAN MAGANG\nPertanggungjawaban kegiatan Magang mahasiswa kepada Mitra Magang dan\nDepartemen.\n女你公\n299\nBahan pertimbangan pemberian nilai kegiatan Magang\nДо\nPenyampaian informasi bagi pihak ITS, mahasiswa, maupun Mitra Magang\nSalah satu alat untuk membina hubungan kerjasama, saling pengertian, dan koordinasi antara mahasiswa dengan pihak ITS maupun Mitra Magang\nSalah satu alat untuk menyampaikan ide, pendapat, penilaian, dan pengalaman yang berkaitan dengan penyelenggaraan Magang kepada\npihak lain.\n44\n07 Pedoman Penulisan Laporan Magang'
 '• LAMPIRAN 7: Form Rincian Tugas Magang\nRINCIAN TUGAS MAGANG\nSemester Magang :... Tahun Akademik 20.../20...\nNama Mahasiswa\nNRP\nDepartemen\nNama Dosen Pembimbing\nNama Perusahaan Mitra Magang\nWaktu Pelaksanaan Magang\nNama Proyek / Kegiatan Magang\nPosisi dalam Proyek\nNO\nRincian Tugas Magang\nWaktu Pelaksanaan\nSurabaya, ..\nMahasiswa peserta magang (.........\n........)\nBuku Petunjuk Teknis Magang\n69']","sebagai Pertanggungjawaban kegiatan Magang mahasiswa kepada Mitra Magang dan
Departemen.",0.999999999975,1.0,0.9973143136217812,1.0
11,Apa saja ketentuan umum dalam penulisan lapora magang?,"Ketentuan umum dalam penulisan Laporan Magang adalah sebagai berikut:
1. Pada akhir pelaksanaan magang, mahasiswa diwajibkan menulis Laporan Magang.
2. Pedoman penulisan Laporan Magang dapat ditemukan pada Bagian 5 dari buku petunjuk teknis magang.
3. Laporan Magang harus disetujui oleh dosen pembimbing magang dan dosen lapangan.
4. Laporan Magang harus diselesaikan segera setelah Program Magang berakhir.
5. Laporan Magang yang telah disetujui pembimbing magang dapat dipresentasikan jika diperlukan.
6. Dalam penyusunan Laporan Magang, mahasiswa wajib menaati ketentuan kerahasiaan data/informasi yang ditetapkan oleh unit tempat magang.","['6.4\nKETENTUAN PEMBIMBINGAN MAGANG\nBAGI DOSEN\nA.Dosen pembimbing harus dapat memberikan masukan dan pengarahan tentang pelaksanaan magang dan penulisan Laporan Magang. Pemberian masukan dan arahan tersebut diantaranya mencakup namun tidak terbatas pada hal berikut:\n• Memberikan masukan, arahan, dan mendiskusikan rumusan permasalahan dan tujuan atau topik Laporan Magang.\n• Membuat rencana bimbingan bersama mahasiswa.\n• Mengarahkan mahasiswa dalam hal metode penulisan ilmiah dan metode analisis dalam Laporan Magang sesuai dengan pedoman penulisan Laporan Magang yang telah disepakati.\n• Mendiskusikan acuan materi keilmuan yang relevan dengan topik Laporan Magang.\n• Hadir dalam Sidang Magang dan memberikan penilaian akhir bagi Laporan\nMagang yang diujikan.\n• Memberikan arahan dalam penyelesaian revisi Laporan Magang.\nB. Dosen pembimbing harus memastikan bahwa Laporan Magang bebas dari plagiarisme.\n6.5\nPENGGANTIAN DOSEN PEMBIMBING\nMAGANG'
 '07\nPEDOMAN\nPENULISAN\nLAPORAN\nMAGANG\n\n07\nPEDOMAN PENULISAN LAPORAN\nMAGANG\n7.1\nFUNGSI LAPORAN MAGANG\nPertanggungjawaban kegiatan Magang mahasiswa kepada Mitra Magang dan\nDepartemen.\n女你公\n299\nBahan pertimbangan pemberian nilai kegiatan Magang\nДо\nPenyampaian informasi bagi pihak ITS, mahasiswa, maupun Mitra Magang\nSalah satu alat untuk membina hubungan kerjasama, saling pengertian, dan koordinasi antara mahasiswa dengan pihak ITS maupun Mitra Magang\nSalah satu alat untuk menyampaikan ide, pendapat, penilaian, dan pengalaman yang berkaitan dengan penyelenggaraan Magang kepada\npihak lain.\n44\n07 Pedoman Penulisan Laporan Magang'
 'Berikut adalah ketentuan umum mengenai Laporan Magang:\n• Pada akhir pelaksanaan magang mahasiswa diwajibkan menulis Laporan Magang.\n• Pedoman penulisan Laporan Magang dapat ditemukan pada Bagian 5 dari buku petunjuk teknis magang ini.\n• Laporan Magang harus disetujui oleh dosen pembimbing magang dan dosen lapangan.\n• Laporan Magang harus diselesaikan segera setelah Program Magang berakhir.\n• Laporan Magang yang telah disetujui pembimbing magang dapat di presentasikan jika diperlukan.\n• Dalam penyusunan Laporan Magang, mahasiswa wajib menaati ketentuan kerahasiaan data / informasi yang ditetapkan oleh unit tempat magang.\n8.4\nPENILAIAN PRESENTASI LAPORAN\nMAGANG (JIKA DIPERLUKAN)\nButir penilaian presentasi Laporan Magang mencakup aspek berikut ini:\nAlur Presentasi\n1. Logika dalam Analisis Presentasi\n2. Substansi Isi Presentasi\nProses Presentasi\n1. Kualitas Slides Presentasi\n2. Sistematika Slides Presentasi\nKomunikasi dalam Presentasi\n1. Kemampuan Menjelaskan Isi\nLaporan Magang'
 '• Mahasiswa menguraikan sejarah mitra magang secara umum serta spesifik (unit / divisi terkait) yang menjadi konteks dari topik yang dipilih.\n2.2. Struktur Organisasi Mitra Magang\n• Mahasiswa dapat menjelaskan struktur organisasi Mitra Magang secara umum yaitu dapat mencakup struktur organisasi, proses bisnis, ketentuan/peraturan terkait, dan sejenisnya.\n2.3. Visi dan Misi Perusahaan\n• Mahasiswa dapat menjelaskan Visi Misi Mitra Magang secara umum\n2.4. Kegiatan Produksi (barang/jasa) (jika ada)\n• Mahasiswa dapat menjelaskan proses penciptaan nilai untuk pemangku\n48\n07 Pedoman Penulisan Laporan Magang']","benar dan obyektif, jelas dan cermat, langsung ke sasaran, lengkap, tegas dan konsisten",0.8333333332916666,1.0,0.9465734583079208,0.0
12,Apa jenis dan ukuran kertas pada format penulisan laporan magang?,Jenis kertas yang digunakan dalam format penulisan laporan magang umumnya adalah kertas A4 dengan ukuran 210 x 297 mm.,"['07\nPEDOMAN\nPENULISAN\nLAPORAN\nMAGANG\n\n07\nPEDOMAN PENULISAN LAPORAN\nMAGANG\n7.1\nFUNGSI LAPORAN MAGANG\nPertanggungjawaban kegiatan Magang mahasiswa kepada Mitra Magang dan\nDepartemen.\n女你公\n299\nBahan pertimbangan pemberian nilai kegiatan Magang\nДо\nPenyampaian informasi bagi pihak ITS, mahasiswa, maupun Mitra Magang\nSalah satu alat untuk membina hubungan kerjasama, saling pengertian, dan koordinasi antara mahasiswa dengan pihak ITS maupun Mitra Magang\nSalah satu alat untuk menyampaikan ide, pendapat, penilaian, dan pengalaman yang berkaitan dengan penyelenggaraan Magang kepada\npihak lain.\n44\n07 Pedoman Penulisan Laporan Magang'
 '• LAMPIRAN 7: Form Rincian Tugas Magang\nRINCIAN TUGAS MAGANG\nSemester Magang :... Tahun Akademik 20.../20...\nNama Mahasiswa\nNRP\nDepartemen\nNama Dosen Pembimbing\nNama Perusahaan Mitra Magang\nWaktu Pelaksanaan Magang\nNama Proyek / Kegiatan Magang\nPosisi dalam Proyek\nNO\nRincian Tugas Magang\nWaktu Pelaksanaan\nSurabaya, ..\nMahasiswa peserta magang (.........\n........)\nBuku Petunjuk Teknis Magang\n69'
 '4. Hasil penilaian dilakukan dengan cara mengisi formulir yang ada dan diserahkan\npada departemen.\n8.2\nPENILAIAN PRESTASI KINERJA MAGANG\nOLEH UNIT MITRA MAGANG\nDalam melakukan kegiatan magang, mahasiswa akan memperoleh penilaian dari unit tempat magang. Formulir penilaian magang diisi dan ditandatangani oleh atasan yang berwenang di tempat magang (minimal level manajer) dan dicap menggunakan stempel unit tempat magang. Berikut adalah butir penilaian kinerja magang:\n52\n08 Penilaian Magang'
 '2. Substansi Isi Presentasi\nProses Presentasi\n1. Kualitas Slides Presentasi\n2. Sistematika Slides Presentasi\nKomunikasi dalam Presentasi\n1. Kemampuan Menjelaskan Isi\nLaporan Magang\n2. Kemampuan Menjawab Pertanyaan\nPenguji\nTabel 8.1 Butir Penilaian Presentasi Laporan Magang\nBuku Petunjuk Teknis Magang\n55']",Kertas HVS 70gram ukuran A5 (148 × 210 mm).,0.9166666666361111,0.0,0.9606656563934264,1.0
13,Berapa jarak tepi margin dalam penulisan laporan magang?,Margin dalam penulisan laporan magang adalah 1 (satu) jarak spasi.,"['Inisiatif\nKemampuan komunikasi (lisan dan tulisan)\nDisiplin\nPenampilan\nKetekunan\nKemampuan teknikal\nBerpikir kritis, kreatif dan analitis\nKemampuan bekerjasama\ndalam tim Kemampuan\nberadaptasi\n凸\nHasil pekerjaan (kontribusi)\nSedangkan mekanisme pengiriman formulir penilaian magang dari unit tempat magang adalah sebagai berikut:\nこと\nFormulir kosong serta amplop balasan yang sudah bertuliskan alamat Departemen disampaikan oleh mahasiswa magang kepada atasan yang berwenang.\nFormulir penilaian yang sudah terisi dimasukkan ke dalam amplop tertutup dan dikirim langsung ke Departemen.\nBuku Petunjuk Teknis Magang\n53\n\n8.3\nPENILAIAN PENULISAN LAPORAN\nMAGANG\nButir penilaian Laporan Magang mencakup aspek sebagai berikut:\n2. Tugas mahasiswa selama magang\ndijelaskan dengan baik dan relevan\nDeskripsi proses kegiatan\nmagang yang dilakukan\n1. Gambaran umum Mitra Magang\ndengan Departemen.\n\njelas.'
 '6.4\nKETENTUAN PEMBIMBINGAN MAGANG\nBAGI DOSEN\nA.Dosen pembimbing harus dapat memberikan masukan dan pengarahan tentang pelaksanaan magang dan penulisan Laporan Magang. Pemberian masukan dan arahan tersebut diantaranya mencakup namun tidak terbatas pada hal berikut:\n• Memberikan masukan, arahan, dan mendiskusikan rumusan permasalahan dan tujuan atau topik Laporan Magang.\n• Membuat rencana bimbingan bersama mahasiswa.\n• Mengarahkan mahasiswa dalam hal metode penulisan ilmiah dan metode analisis dalam Laporan Magang sesuai dengan pedoman penulisan Laporan Magang yang telah disepakati.\n• Mendiskusikan acuan materi keilmuan yang relevan dengan topik Laporan Magang.\n• Hadir dalam Sidang Magang dan memberikan penilaian akhir bagi Laporan\nMagang yang diujikan.\n• Memberikan arahan dalam penyelesaian revisi Laporan Magang.\nB. Dosen pembimbing harus memastikan bahwa Laporan Magang bebas dari plagiarisme.\n6.5\nPENGGANTIAN DOSEN PEMBIMBING\nMAGANG'
 '07\nPEDOMAN\nPENULISAN\nLAPORAN\nMAGANG\n\n07\nPEDOMAN PENULISAN LAPORAN\nMAGANG\n7.1\nFUNGSI LAPORAN MAGANG\nPertanggungjawaban kegiatan Magang mahasiswa kepada Mitra Magang dan\nDepartemen.\n女你公\n299\nBahan pertimbangan pemberian nilai kegiatan Magang\nДо\nPenyampaian informasi bagi pihak ITS, mahasiswa, maupun Mitra Magang\nSalah satu alat untuk membina hubungan kerjasama, saling pengertian, dan koordinasi antara mahasiswa dengan pihak ITS maupun Mitra Magang\nSalah satu alat untuk menyampaikan ide, pendapat, penilaian, dan pengalaman yang berkaitan dengan penyelenggaraan Magang kepada\npihak lain.\n44\n07 Pedoman Penulisan Laporan Magang'
 '6. Jarak Spasi\n1 (satu)\n• SISTEMATIKA LAPORAN MAGANG\nCover Luar\nCover Dalam\nLembar Pengesahan\nKata Pengantar\nDaftar Isi\nDaftar Gambar\nDaftar Tabel\nBAB 1. PENDAHULUAN\n1.1. Latar Belakang\n1.2. Tujuan Magang\n1.3. Manfaat Magang\n1.4. Mahasiswa menguraikan tujuan penulisan topik magang.\nBAB 2. PENDAHULUAN\n2.1. Sejarah Mitra Magang\n2.2. Struktur Organisasi Mitra Magang\n2.3. Visi dan Misi Perusahaan\n2.4. Kegiatan Produksi (barang/jasa) (jika ada)\nBAB 3. PELAKSANAAN MAGANG\n3.1 Posisi / kedudukan kegiatan Magang\n3.2 Metodologi penyelesaian Tugas\n3.3 Pembelajaran Hal Baru\nBAB 4. KESIMPULAN DAN SARAN\nBAB 5. REFLEKSI DIRI\nLAMPIRAN\nBuku Petunjuk Teknis Magang\n47']","- Tepi Atas : 2,5 cm
- Тері Bawah : 2,5 cm
- Tepi Kiri : 2,5 cm
- Tepi Kanan : 2,0 cm",0.8055555555287036,1.0,0.9728286856865256,0.0
14,apa ketentuan umum mengenai penilaian akhir magang?,"Ketentuan umum mengenai penilaian akhir magang adalah sebagai berikut:
1. Dosen pembimbing magang dan dosen pembimbing dari unit tempat magang memberikan penilaian terhadap Laporan Magang dan ujian presentasi magang jika diperlukan.
2. Unit tempat magang memberikan penilaian terhadap prestasi magang.
3. Penilaian penulisan laporan magang mengacu kepada ketentuan.
4. Hasil penilaian dilakukan dengan cara mengisi formulir yang ada dan diserahkan pada departemen.","['4. Hasil penilaian dilakukan dengan cara mengisi formulir yang ada dan diserahkan\npada departemen.\n8.2\nPENILAIAN PRESTASI KINERJA MAGANG\nOLEH UNIT MITRA MAGANG\nDalam melakukan kegiatan magang, mahasiswa akan memperoleh penilaian dari unit tempat magang. Formulir penilaian magang diisi dan ditandatangani oleh atasan yang berwenang di tempat magang (minimal level manajer) dan dicap menggunakan stempel unit tempat magang. Berikut adalah butir penilaian kinerja magang:\n52\n08 Penilaian Magang'
 '08\nPENILAIAN MAGANG\n8.1\nBOBOT PENILAIAN MAGANG\n• Berikut adalah bobot masing-masing komponen penilaian untuk nilai akhir magang:\n60%\n40%\nPrestasi Kinerja Magang\noleh Unit tempat Magang\nPenulisan Laporan Magang,\ndan presentasi laporan jika diperlukan\n• Berikut ketentuan umum mengenai penilaian akhir magang:\n1. Dosen pembimbing magang dan dosen pembimbing dari unit tempat magang memberikan penilaian terhadap Laporan Magang dan ujian presentasi magang\njika diperlukan.\n2. Unit tempat magang memberikan penilaian terhadap prestasi magang.\n3. Penilaian penulisan laporan magang mengacu kepada ketentuan.\n4. Hasil penilaian dilakukan dengan cara mengisi formulir yang ada dan diserahkan\npada departemen.\n8.2\nPENILAIAN PRESTASI KINERJA MAGANG\nOLEH UNIT MITRA MAGANG'
 '• Mahasiswa menguraikan sejarah mitra magang secara umum serta spesifik (unit / divisi terkait) yang menjadi konteks dari topik yang dipilih.\n2.2. Struktur Organisasi Mitra Magang\n• Mahasiswa dapat menjelaskan struktur organisasi Mitra Magang secara umum yaitu dapat mencakup struktur organisasi, proses bisnis, ketentuan/peraturan terkait, dan sejenisnya.\n2.3. Visi dan Misi Perusahaan\n• Mahasiswa dapat menjelaskan Visi Misi Mitra Magang secara umum\n2.4. Kegiatan Produksi (barang/jasa) (jika ada)\n• Mahasiswa dapat menjelaskan proses penciptaan nilai untuk pemangku\n48\n07 Pedoman Penulisan Laporan Magang'
 '6.1\nKRITERIA DOSEN PEMBIMBING MAGANG\nW888\nDosen yang telah mengajar selama 4 semester berturut-turut.\nMemperoleh SK Pembimbing Magang dari Departemen dan ketetapan melalui\nKeputusan Dekan.\n6.2\nRINCIAN TUGAS DOSEN PEMBIMBING\nMAGANG\n• Memberikan saran dan masukan saat konsultasi keilmuan jika diperlukan oleh mahasiswa selama magang.\n• Melakukan kegiatan pembimbingan bagi mahasiswa magang untuk dapat berkonsultasi selama magang atau bimbingan penulisan laporan magang.\n• Memberikan persetujuan dan penilaian Laporan Magang.\n• Memberikan penilaian dapat dilakukan dalam bentuk penilaian laporan magang dan atau presentasi kegiatan magang.\n40\n06 Pembimbingan Magang']","1. Dosen pembimbing magang dan dosen pembimbing dari unit tempat magang memberikan penilaian terhadap Laporan Magang dan ujian presentasi magang
jika diperlukan.
2. Unit tempat magang memberikan penilaian terhadap prestasi magang.
3. Penilaian penulisan laporan magang mengacu kepada ketentuan.
4. Hasil penilaian dilakukan dengan cara mengisi formulir yang ada dan diserahkan
pada departemen",0.999999999975,1.0,0.9744316365876403,1.0
15,Apa saja etika pelaksanaan magang di perusahaan mitra magang?,"Etika pelaksanaan magang di perusahaan mitra magang meliputi:
1. Mahasiswa harus mematuhi aturan Mitra Magang dengan baik.
2. Mahasiswa harus bekerja dan berusaha memberikan yang terbaik untuk kepentingan Mitra Magang.
3. Mahasiswa harus dapat menyelesaikan segala tugas yang diberikan Mitra Magang dengan benar, rapi, dan tepat waktu.
4. Mahasiswa harus menghormati pegawai Mitra Magang tanpa membedakan suku, agama, ras, gender, dan golongan.
5. Mahasiswa bersikap jujur, disiplin, santun, profesional, dan menjaga etos kerja di unit kerja Mitra Magang.
6. Mahasiswa harus menjaga kerahasiaan informasi unit kerja Mitra Magang. Seluruh informasi dan data yang akan dijadikan sumber dalam penulisan laporan magang harus disamarkan dalam penulisan untuk menjaga kerahasiaan data dan informasi Mitra Magang.
7. Mahasiswa harus menjaga nama baik almamater ITS.","['• LAMPIRAN 7: Form Rincian Tugas Magang\nRINCIAN TUGAS MAGANG\nSemester Magang :... Tahun Akademik 20.../20...\nNama Mahasiswa\nNRP\nDepartemen\nNama Dosen Pembimbing\nNama Perusahaan Mitra Magang\nWaktu Pelaksanaan Magang\nNama Proyek / Kegiatan Magang\nPosisi dalam Proyek\nNO\nRincian Tugas Magang\nWaktu Pelaksanaan\nSurabaya, ..\nMahasiswa peserta magang (.........\n........)\nBuku Petunjuk Teknis Magang\n69'
 '6.4\nKETENTUAN PEMBIMBINGAN MAGANG\nBAGI DOSEN\nA.Dosen pembimbing harus dapat memberikan masukan dan pengarahan tentang pelaksanaan magang dan penulisan Laporan Magang. Pemberian masukan dan arahan tersebut diantaranya mencakup namun tidak terbatas pada hal berikut:\n• Memberikan masukan, arahan, dan mendiskusikan rumusan permasalahan dan tujuan atau topik Laporan Magang.\n• Membuat rencana bimbingan bersama mahasiswa.\n• Mengarahkan mahasiswa dalam hal metode penulisan ilmiah dan metode analisis dalam Laporan Magang sesuai dengan pedoman penulisan Laporan Magang yang telah disepakati.\n• Mendiskusikan acuan materi keilmuan yang relevan dengan topik Laporan Magang.\n• Hadir dalam Sidang Magang dan memberikan penilaian akhir bagi Laporan\nMagang yang diujikan.\n• Memberikan arahan dalam penyelesaian revisi Laporan Magang.\nB. Dosen pembimbing harus memastikan bahwa Laporan Magang bebas dari plagiarisme.\n6.5\nPENGGANTIAN DOSEN PEMBIMBING\nMAGANG'
 '....\nBerikut kami lampirkan Laporan Magang dan atau Rincian Kegiatan Magang.\nDemikian surat permohonan ini saya buat, atas perhatiannya saya sampaikan terima kasih.\nSurabaya,\nMahasiswa peserta magang\n*) dipilih salah satu\n68\nLampiran'
 '09\nЕТІКА\nMAGANG\n\n09\nETIKA MAGANG\n9.1\nETIKA PELAKSANAAN MAGANG DI PERUSAHAAN MITRA MAGANG\nVX\n• Mahasiswa harus mematuhi aturan Mitra Magang dengan baik.\n• Mahasiswa harus bekerja dan berusaha memberikan yang terbaik untuk kepentingan Mitra Magang.\n• Mahasiswa harus dapat menyelesaikan segala tugas yang diberikan\nMitra Magang dengan benar, rapi dan tepat waktu.\n• Mahasiswa harus menghormati pegawai Mitra Magang tanpa membedakan suku, agama, ras, gender dan golongan.\n• Mahasiswa bersikap jujur, disiplin, santun, profesional, dan menjaga etos kerja di unit kerja Mitra Magang.\n• Mahasiswa harus menjaga kerahasiaan informasi unit kerja Mitra Magang. Seluruh informasi dan data yang akan dijadikan sumber dalam penulisan laporan magang harus disamarkan dalam penulisan untuk menjaga kerahasidan data dan informasi Mitra Magang.\n• Mahasiswa harus menjaga nama baik almamater ITS.\n58\n09 Etika Magang']","• Mahasiswa harus mematuhi aturan Mitra Magang dengan baik.
• Mahasiswa harus bekerja dan berusaha memberikan yang terbaik untuk kepentingan Mitra Magang.
• Mahasiswa harus dapat menyelesaikan segala tugas yang diberikan
Mitra Magang dengan benar, rapi dan tepat waktu.
• Mahasiswa harus menghormati pegawai Mitra Magang tanpa membedakan suku, agama, ras, gender dan golongan.
• Mahasiswa bersikap jujur, disiplin, santun, profesional, dan menjaga etos kerja di unit kerja Mitra Magang.
• Mahasiswa harus menjaga kerahasiaan informasi unit kerja Mitra Magang. Seluruh informasi dan data yang akan dijadikan sumber dalam penulisan laporan magang harus disamarkan dalam penulisan untuk menjaga kerahasidan data dan informasi Mitra Magang.
• Mahasiswa harus menjaga nama baik almamater ITS.",0.9166666666361111,1.0,0.9999999999999996,1.0
16,Apa syarat yang harus dipenuhi mahasiswa untik mengikuti kegiatan magang?,"Untuk mengikuti kegiatan magang, mahasiswa harus memenuhi syarat-syarat tertentu yang biasanya ditentukan oleh lembaga pendidikan atau perusahaan mitra magang. Beberapa syarat umum yang biasanya harus dipenuhi oleh mahasiswa untuk mengikuti kegiatan magang antara lain adalah:

1. Status sebagai mahasiswa aktif di perguruan tinggi yang telah ditentukan.
2. Menyertakan surat permohonan magang yang lengkap dengan lampiran-lampiran yang diminta.
3. Memiliki kemauan dan motivasi yang tinggi untuk belajar dan berkontribusi selama kegiatan magang.
4. Memahami dan menaati peraturan-peraturan yang berlaku selama kegiatan magang.
5. Memiliki pengetahuan dan keterampilan yang sesuai dengan bidang magang yang dipilih.
6. Menyelesaikan proses seleksi yang telah ditentukan oleh lembaga pendidikan atau perusahaan mitra magang.

Selain syarat-syarat di atas, terdapat juga syarat-syarat khusus yang mungkin ditentukan oleh lembaga pendidikan atau perusahaan mitra magang sesuai dengan kebutuhan dan ketentuan yang berlaku.","['....\nBerikut kami lampirkan Laporan Magang dan atau Rincian Kegiatan Magang.\nDemikian surat permohonan ini saya buat, atas perhatiannya saya sampaikan terima kasih.\nSurabaya,\nMahasiswa peserta magang\n*) dipilih salah satu\n68\nLampiran'
 '7.5\nKETENTUAN ISI LAPORAN MAGANG\n• BAB 1. PENDAHULUAN\n1.1. Latar Belakang, meliputi\n• Mahasiswa menguraikan latar belakang (argumen / alasan) dari topik yang dipilih dalam Laporan Magang ini.\n• Latar belakang harus menunjukkan urgensi dari topik yang dipilih. Urgensi misal-nya ditunjukkan oleh keunikan topik (isu mutakhir), keunikan industri, permasalah-an atau risiko yang ditimbulkan, atau perbedaan pendapat.\n1.2. Tujuan Magang, meliputi\n• Mencerminkan hal-hal yang akan diuraikan di bab analisis.\n1.3. Manfaat Magang, meliputi\n• Manfaat untuk ITS\n• Manfaat untuk Mitra Magang\n• Manfaat untuk Mahasiswa\n1.4. Mahasiswa menguraikan tujuan penulisan topik magang.\n• Tujuan harus mencerminkan hal-hal yang akan diuraikan di bab analisis.\n• BAB 2. PROFIL MITRA MAGANG\n2.1. Sejarah Mitra Magang\n• Mahasiswa menguraikan sejarah mitra magang secara umum serta spesifik (unit / divisi terkait) yang menjadi konteks dari topik yang dipilih.\n2.2. Struktur Organisasi Mitra Magang'
 '• Mahasiswa menguraikan sejarah mitra magang secara umum serta spesifik (unit / divisi terkait) yang menjadi konteks dari topik yang dipilih.\n2.2. Struktur Organisasi Mitra Magang\n• Mahasiswa dapat menjelaskan struktur organisasi Mitra Magang secara umum yaitu dapat mencakup struktur organisasi, proses bisnis, ketentuan/peraturan terkait, dan sejenisnya.\n2.3. Visi dan Misi Perusahaan\n• Mahasiswa dapat menjelaskan Visi Misi Mitra Magang secara umum\n2.4. Kegiatan Produksi (barang/jasa) (jika ada)\n• Mahasiswa dapat menjelaskan proses penciptaan nilai untuk pemangku\n48\n07 Pedoman Penulisan Laporan Magang'
 '• LAMPIRAN 7: Form Rincian Tugas Magang\nRINCIAN TUGAS MAGANG\nSemester Magang :... Tahun Akademik 20.../20...\nNama Mahasiswa\nNRP\nDepartemen\nNama Dosen Pembimbing\nNama Perusahaan Mitra Magang\nWaktu Pelaksanaan Magang\nNama Proyek / Kegiatan Magang\nPosisi dalam Proyek\nNO\nRincian Tugas Magang\nWaktu Pelaksanaan\nSurabaya, ..\nMahasiswa peserta magang (.........\n........)\nBuku Petunjuk Teknis Magang\n69']","1. Mahasiswa peserta magang adalah mahasiswa aktif ITS 2. Mahasiswa sudah menempuh minimal 90 SKS, untuk departemen yang tidak mempunyai MK magang dalam kurikulumnya.",0.5833333333041666,0.5555555555555556,0.9797066373838068,0.5
17,apa peran Dosen pembimbing magang?,"Dosen pembimbing magang memiliki beberapa peran, antara lain:
1. Memberikan saran dan masukan saat konsultasi keilmuan jika diperlukan oleh mahasiswa selama magang.
2. Melakukan kegiatan pembimbingan bagi mahasiswa magang untuk dapat berkonsultasi selama magang atau bimbingan penulisan laporan magang.
3. Memberikan persetujuan dan penilaian terhadap Laporan Magang.
4. Memberikan penilaian dapat dilakukan dalam bentuk penilaian laporan magang dan/atau presentasi kegiatan magang.
5. Memberikan arahan dalam penyelesaian revisi Laporan Magang.
6. Memastikan bahwa Laporan Magang bebas dari plagiarisme.
7. Hadir dalam Sidang Magang dan memberikan penilaian akhir bagi Laporan Magang yang diujikan.

Dengan demikian, Dosen pembimbing magang memiliki peran penting dalam mendampingi dan membimbing mahasiswa selama menjalani magang serta dalam penyelesaian tugas-tugas terkait magang.","['• LAMPIRAN 7: Form Rincian Tugas Magang\nRINCIAN TUGAS MAGANG\nSemester Magang :... Tahun Akademik 20.../20...\nNama Mahasiswa\nNRP\nDepartemen\nNama Dosen Pembimbing\nNama Perusahaan Mitra Magang\nWaktu Pelaksanaan Magang\nNama Proyek / Kegiatan Magang\nPosisi dalam Proyek\nNO\nRincian Tugas Magang\nWaktu Pelaksanaan\nSurabaya, ..\nMahasiswa peserta magang (.........\n........)\nBuku Petunjuk Teknis Magang\n69'
 '6.1\nKRITERIA DOSEN PEMBIMBING MAGANG\nW888\nDosen yang telah mengajar selama 4 semester berturut-turut.\nMemperoleh SK Pembimbing Magang dari Departemen dan ketetapan melalui\nKeputusan Dekan.\n6.2\nRINCIAN TUGAS DOSEN PEMBIMBING\nMAGANG\n• Memberikan saran dan masukan saat konsultasi keilmuan jika diperlukan oleh mahasiswa selama magang.\n• Melakukan kegiatan pembimbingan bagi mahasiswa magang untuk dapat berkonsultasi selama magang atau bimbingan penulisan laporan magang.\n• Memberikan persetujuan dan penilaian Laporan Magang.\n• Memberikan penilaian dapat dilakukan dalam bentuk penilaian laporan magang dan atau presentasi kegiatan magang.\n40\n06 Pembimbingan Magang'
 '• Memberikan arahan dalam penyelesaian revisi Laporan Magang.\nB. Dosen pembimbing harus memastikan bahwa Laporan Magang bebas dari plagiarisme.\n6.5\nPENGGANTIAN DOSEN PEMBIMBING\nMAGANG\n• Penggantian dosen pembimbing magang harus didasarkan pada alasan yang dapat dipertanggungjawabkan.\n• Pengajuan permohonan penggantian dosen pembimbing magang dapat dilakukan selambat-lambatnya 2 (dua) bulan setelah magang dimulai.\n• Penggantian dosen pembimbing magang harus dengan persetujuan dari Kepala\nDepartemen.\n42\n06 Pembimbingan Magang'
 '6.4\nKETENTUAN PEMBIMBINGAN MAGANG\nBAGI DOSEN\nA.Dosen pembimbing harus dapat memberikan masukan dan pengarahan tentang pelaksanaan magang dan penulisan Laporan Magang. Pemberian masukan dan arahan tersebut diantaranya mencakup namun tidak terbatas pada hal berikut:\n• Memberikan masukan, arahan, dan mendiskusikan rumusan permasalahan dan tujuan atau topik Laporan Magang.\n• Membuat rencana bimbingan bersama mahasiswa.\n• Mengarahkan mahasiswa dalam hal metode penulisan ilmiah dan metode analisis dalam Laporan Magang sesuai dengan pedoman penulisan Laporan Magang yang telah disepakati.\n• Mendiskusikan acuan materi keilmuan yang relevan dengan topik Laporan Magang.\n• Hadir dalam Sidang Magang dan memberikan penilaian akhir bagi Laporan\nMagang yang diujikan.\n• Memberikan arahan dalam penyelesaian revisi Laporan Magang.\nB. Dosen pembimbing harus memastikan bahwa Laporan Magang bebas dari plagiarisme.\n6.5\nPENGGANTIAN DOSEN PEMBIMBING\nMAGANG']",Dosen pembimbing magang memegang peranan kunci dalam koordinasi pelaksanaan magang dengan mahasiswa peserta magang dan unit tempat magang serta wajib memantau secara kontinu pelaksanaan magang dari mahasiswa yang dibimbingnya.,0.9166666666361111,1.0,0.965038489542937,0.0
18,Bagaimana proses seleksi program mahasiswa magang bersertifikat?,Saya tidak menemukan informasi mengenai proses seleksi program mahasiswa magang bersertifikat dalam konteks yang diberikan.,"['• LAMPIRAN 7: Form Rincian Tugas Magang\nRINCIAN TUGAS MAGANG\nSemester Magang :... Tahun Akademik 20.../20...\nNama Mahasiswa\nNRP\nDepartemen\nNama Dosen Pembimbing\nNama Perusahaan Mitra Magang\nWaktu Pelaksanaan Magang\nNama Proyek / Kegiatan Magang\nPosisi dalam Proyek\nNO\nRincian Tugas Magang\nWaktu Pelaksanaan\nSurabaya, ..\nMahasiswa peserta magang (.........\n........)\nBuku Petunjuk Teknis Magang\n69'
 '3\nDisiplin dalam menyelesaikan pekerjaan\n10\n\n\n4\nTanggung jawab\n15\n\n\n5\nKeahlian / Keterampilan dalam Berprofesi\n20\n\n\n6\nKreatifitas / Inovasi\nST\n\n\n7\nSikap dan Perilaku dalam Bekerja\n10\n\n\n8\nKemampuan Bekerjasama Dalam Tim\n5\n\n\nJUMLAH\n100\n\n\nNILAI AKHIR =\nJUMLAH (B X N)\nJUMLAH BOBOT\n100\nSurabaya,\nPembimbing Lapangan\nBuku Petunjuk Teknis Magang\n67'
 '• LAMPIRAN 8: Form Persetujuan Konversi Mata Kuliah\nLAMPIRAN 1\nKOP Departemen\nNo\n:....\nLampiran :\nPerihal :.\nKepada yth :\nDosen Wali Departemen ...\nFakultas...\nITS\nSehubungan dengan adanya permohonan konversi mata kuliah dari mahasiswa peserta magang dengan detail sebagai berikut :\nNama\nNRP\nNama Mitra Magang :\nPeriode magang\nMahasiswa yang bersangkutan akan/ telah *) melakukan magang dengan rincian tugas sebagai berikut :\nBerdasarkan hasil telaah dan analisa dengan bidang akademik departemen, maka mahasiswa yang bersangkutan berhak untuk mendapatkan konversi mata kuliah dan SKS, dimana konversi ini akan di lakukan pada semester..... tahun ajaran ....\n.......Adapun mata kuliah yang dapat dikonversikan dengan\nkegiatan magang adalah sebagai berikut :\nNo.\nMata Kuliah Konversi\nJumlah SKS\n\n\n\n\n\n\n\n\n\nTotal SKS\n\nSurabaya, ....\n*) dicoret\nKepala Departemen ....\n70\nLampiran\n\nSUBDIREKTORAT PENGEMBANGAN KEWIRAUSAHAAN DAN KARIR\nDIREKTORAT KEMAHASISWAAN\nINSTITUT TEKNOLOGI SEPULUH NOPEMBER\n2020'
 '2. Substansi Isi Presentasi\nProses Presentasi\n1. Kualitas Slides Presentasi\n2. Sistematika Slides Presentasi\nKomunikasi dalam Presentasi\n1. Kemampuan Menjelaskan Isi\nLaporan Magang\n2. Kemampuan Menjawab Pertanyaan\nPenguji\nTabel 8.1 Butir Penilaian Presentasi Laporan Magang\nBuku Petunjuk Teknis Magang\n55']",Seleksi program magang bersertifikat dilakukan oleh FHCl atau BUMN Proses tahapan seleksi dilaksanakan sesuai dengan kebijakan BUMN Hasil proses seleksi akan disampaikan ke Sub Direktorat PK2 untuk diumumkan ke mahasiswa calon peserta magang.,0.499999999975,0.0,0.0,
19,apa saja berkas yang perlu diunggah melalui SIM magang?,Berkas yang perlu diunggah melalui SIM magang adalah Laporan Magang yang telah disetujui oleh pembimbing magang.,"['....\nBerikut kami lampirkan Laporan Magang dan atau Rincian Kegiatan Magang.\nDemikian surat permohonan ini saya buat, atas perhatiannya saya sampaikan terima kasih.\nSurabaya,\nMahasiswa peserta magang\n*) dipilih salah satu\n68\nLampiran'
 'Beberapa ketentuan yang perlu diperhatikan khususnya oleh mahasiswa peserta magang dalam merencanakan dan melaksanakan ujian presentasi Laporan Magang sebagai berikut:\n• Ujian Presentasi Laporan Magang dilaksanakan oleh mahasiswa yang telah menyelesaikan penyusunan karya akhir Laporan Magang yang sudah disetujui oleh pembimbing magang.\n• Ujian Presentasi Magang dilaksanakan setelah berkas penilaian kinerja magang sudah diisi oleh unit tempat magang dan sudah diterima oleh program studi.\n• Ujian Presentasi Magang akan dilakukan di ruang ujian Sidang atau di ruang kelas.\n• Untuk dapat mengikuti Ujian Presentasi Magang, mahasiswa harus mengajukan Permohonan Ujian Presentasi Magang sesuai jadwal yang ditetapkan oleh Program Studi.\n• Ujian Presentasi Magang akan diuji oleh 3 (tiga) orang dosen penguji, salah satunya dosen pembimbing magang dan berlangsung sekitar 1,5 jam termasuk sesi untuk tanya jawab.'
 '• LAMPIRAN 7: Form Rincian Tugas Magang\nRINCIAN TUGAS MAGANG\nSemester Magang :... Tahun Akademik 20.../20...\nNama Mahasiswa\nNRP\nDepartemen\nNama Dosen Pembimbing\nNama Perusahaan Mitra Magang\nWaktu Pelaksanaan Magang\nNama Proyek / Kegiatan Magang\nPosisi dalam Proyek\nNO\nRincian Tugas Magang\nWaktu Pelaksanaan\nSurabaya, ..\nMahasiswa peserta magang (.........\n........)\nBuku Petunjuk Teknis Magang\n69'
 '7.2\nKETENTUAN UMUM DALAM PENULISAN\nLAPORAN MAGANG\n• Laporan Magang ditulis dan dipresentasikan pada akhir magang (jika diperlukan).\n• Laporan Magang selain diserahkan ke departemen dan mitra magang, juga diserahkan ke Subdirektorat PK2 Direktorat Kemahasiswaan dalam bentuk softcopy melalui SIM Magang.\n7.3\nPRINSIP PENULISAN LAPORAN\nMAGANG\n• BENAR DAN OBYEKTIF\nLaporan magang harus sesuai dengan ketentuan yang ada dalam pedoman ini serta memuat informasi yang benar dan obyektif.\n• JELAS DAN CERMAT\nLaporan magang harus mudah dimengerti / dipahami oleh pembaca, dengan cara menghindari pemakaian kata / istilah, rangkaian kata / kalimat atau gaya bahasa yang kurang dapat dipahami oleh pembaca maupun penulisnya sendiri. Gunakan kata-kata yang sederhana tetapi jelas maksudnya.\n• LANGSUNG KE SASARAN']",• CV • Transkrip Nilai • Surat Rekomendasi Departemen • Mengisi Form Pakta Integritas,0.999999999975,0.5,0.9610622056740897,0.0
