question,context
Bagaimana format makro penulisan proposal tesis di ITS?,"4. Layout tulisan disajikan dalam Lampiran 1, dengan penjelasan seperti yang tertulis pada item 5 di bawah ini. Tulisan diketik dengan batas tepi halaman mengikuti ketentuan jarak sebagai berikut: a) Jarak dari tepi atas kertas = 3,5 cm. b) Jarak dari tepi bawah kertas = 3 cm. c) Jarak dari tepi kiri kertas = 4 cm (halaman ganjil). d) Jarak dari tepi kanan kertas = 3 cm (halaman ganjil). e) Jarak dari tepi kiri kertas = 3 cm (halaman genap). f) Jarak dari tepi kanan kertas = 4 cm (halaman genap)."
Tata cara penulisan bab dan sub-bab dalam tesis?,"Tulisan BAB 1, BAB 2, dst. dimulai dari batas margin atas dengan ukuran huruf 14 point. Judul bab dimulai 1,5 spasi (1 kali ketukan enter) dari tulisan BAB 1, BAB 2, dst. Tulisan bab dan judul bab ditulis dengan huruf kapital untuk semua huruf dengan ukuran huruf 14 point. Angka untuk nomor bab ditulis dengan angka Arabic (1, 2, 3, dst). Kalimat awal (jika tidak dimulai dengan sub-bab) atau sub-bab awal dimulai 3 spasi (2 kali ketukan enter) dari judul bab dan dimulai dari margin kiri (untuk judul sub-bab) atau masuk 1 tab (1,5 cm) untuk awal kalimat. Judul sub-bab ditulis dengan title case."
Bagaimana aturan penulisan paragraf dalam proposal tesis?,"Kalimat awal pada suatu paragraf ditulis masuk 1 (satu) tab. Antar paragraf tidak perlu diberi jarak. Permulaan bab selalu ditulis pada halaman baru dan dimulai pada halaman dengan nomor ganjil. Apabila suatu bab berakhir pada halaman dengan nomor ganjil, maka halaman genap berikutnya dibiarkan kosong."
Bagaimana menuliskan gambar dan tabel dalam tesis?,Semua gambar dan tabel harus jelas / tidak kabur / buram. Ukuran huruf pada gambar dan tabel harus dapat dibaca oleh mata normal dengan mudah. Gambar dan tabel diletakkan di tengah halaman (centered). Nomor dan judul tabel ditulis di sisi kiri di atas tabel. Nomor tabel disesuaikan dengan letak tabel dalam bab.
Apa saja yang perlu diperhatikan dalam penulisan rumus tesis?,"Semua rumus ditulis dengan menggunakan equation editor (atau mathtype). Penulisan rumus dimulai pada batas kiri, rata dengan kalimat tepat di atasnya, dengan jarak 1,5 spasi dari kalimat di atas dan di bawahnya. Nomor rumus disesuaikan dengan nomor bab letak rumus tersebut dan ditulis di ujung kanan baris tersebut (aligned right)."
Bagaimana penulisan abstrak dalam proposal tesis?,"Abstrak proposal tesis ditulis dalam Bahasa Indonesia dan Inggris pada halaman yang berbeda secara berurutan. Judul tesis ditulis pada batas margin atas, di tengah halaman, dengan ukuran font 14 dan dicetak tebal, dengan jarak spasi 1. Nama mahasiswa, dosen pembimbing, dan ko-pembimbing ditulis 2 spasi di bawahnya, dicetak dengan font normal, pada tengah halaman."
Bagaimana penomoran halaman dalam tesis?,"Penomoran halaman dilakukan sebagai berikut: semua bagian sebelum teks (sebelum Bab 1), dimulai dari lembar pengesahan, diberi nomor halaman dengan angka Romawi kecil yang diletakkan di bagian bawah-tengah halaman (i, ii, dst). Bagian teks (Bab 1, dan seterusnya termasuk daftar pustaka dan lampiran) diberi nomor halaman dengan angka Arabic yang diletakkan di bagian bawah-tengah halaman."
Apa format untuk penulisan judul tesis dalam abstrak?,"Judul tesis ditulis pada batas margin atas, di tengah halaman, dengan ukuran font 14 dan dicetak tebal, dengan jarak spasi 1. Nama mahasiswa, dosen pembimbing, dan ko-pembimbing ditulis 2 spasi di bawahnya, dicetak dengan font normal, pada tengah halaman."
Apa yang harus dilakukan saat mengganti judul atau metode pada tesis?,"Jika Pembimbing dan RMK tetap dan hanya melakukan penyesuaian judul/metode, maka cukup dilakukan dengan mengisi form pergantian judul yang ada di link akademik. Jika TA expired atau jika pembimbing dan atau RMK ganti, maka mesti mengajukan proposal TA ulang dan mengambil Pra-TA lagi."
Apa yang harus diperbaiki setelah sidang proposal tesis?,"Usul perbaikan yang diberikan oleh seluruh dosen penguji termasuk dosen pembimbing, dituangkan dalam berita acara seminar proposal tesis dengan mencantumkan jangka waktu perbaikannya dengan batas maksimum satu bulan. Perbaikan ini harus dikonsultasikan kepada para dosen penguji dan dosen pembimbing."
Apa saja hal yang harus ada dalam revisi setelah sidang?,"1. Mahasiswa mengerjakan revisi (jika ada)
2. Mahasiswa mengumpulkan persetujuan revisi dari penguji (menggunakan tanda tangan digital atau email)
3. Mahasiswa memenuhi persyaratan-persyaratan yudisium."
Kapan nilai Pra-TA atau TA keluar?,"Nilai KP, nilai Pra TA dan TA akan dientry ke integra secara batch operation dalam waktu yang kurang lebih sama. Waktu menyesuaikan dengan kalender akademik, tidak melebihi batas yudisium. Bertanya ke sekdep 1 tentang nilainya HANYA jika diperlukan untuk keperluan mendesak saja."
Siapa yang bertanggung jawab atas penyusunan tesis?,"Mahasiswa bertanggung jawab atas semua aspek yang berkaitan dengan penyiapan tesis dan publikasi dari penelitian atau studinya (tesisnya), termasuk isi dan materi, organisasi dan format, pekerjaan editorial, bahasa, bibliografi, pengetikan dan penyajian berbagai gambar, serta penjagaan terhadap kualitas dan kesahihan data, logika, dan rasionalitas."
Apa tanggung jawab dosen pembimbing dalam penyusunan tesis?,"Dosen pembimbing (komite dosen pembimbing) bertanggung jawab untuk memeriksa, mengoreksi, dan mengarahkan materi (substansi) dan metodologi yang dipergunakan dalam penelitian atau studi untuk penulisan tesis, memeriksa dan mengoreksi organisasi, isi, dan format tesis, serta melakukan evaluasi menyeluruh atas penyelesaian tesis."
Apa saja unsur utama dalam tesis?,"Unsur dalam tesis terdiri dari: Judul penelitian, lembar pengesahan, abstrak, daftar isi, daftar gambar (jika ada), daftar tabel (jika ada), daftar notasi/simbol (bila diperlukan), bagian tubuh (bab-bab) yang terdiri dari pendahuluan, kajian pustaka dan dasar teori, metoda penelitian, hasil penelitian dan pembahasan, kesimpulan, daftar pustaka, lampiran (jika ada), dan biografi penulis."
Bagaimana penulisan abstrak tesis?,"Abstrak tesis pada dasarnya sama dengan format abstrak proposal tesis, tetapi pada abstrak tesis harus ditambahkan hasil dan kesimpulan dari penelitian yang telah dilakukan. Abstrak ditulis dalam Bahasa Indonesia dan Inggris."
Bagaimana aturan daftar pustaka dalam tesis?,"Daftar pustaka merupakan daftar referensi dari semua jenis referensi seperti buku, jurnal papers, artikel, disertasi, tesis, handouts, laboratory manuals, dan karya ilmiah lainnya yang dikutip di dalam penulisan proposal tesis. Semua referensi yang tertulis dalam daftar pustaka harus dirujuk di dalam tesis."
Bagaimana format penulisan artikel/paper dari jurnal dalam daftar pustaka?,"Nama akhir/keluarga penulis pertama, nama kecil/depan, nama akhir/keluarga penulis kedua, nama kecil/depan, dan nama penulis selanjutnya. Nama kecil/depan bisa ditulis lengkap atau hanya inisialnya saja. Tahun penerbitan/publikasi ditulis dalam kurung. Judul artikel/paper dicetak huruf tegak dengan title case diantara tanda kutip. Judul jurnal dicetak miring/italic. Nomor volume dari jurnal. Nomor jurnal. Nomor halaman dari artikel tersebut di dalam jurnal."
Apa aturan penulisan buku dalam daftar pustaka?,Nama pengarang dan tahun publikasi sama dengan penulisan artikel dari jurnal. Judul buku dicetak miring/italic dengan title case. Nomor volume dari buku (jika ada). Edisi penerbitan. Nama penerbit. Kota tempat diterbitkan.
Bagaimana aturan menulis artikel dalam buku prosiding pada daftar pustaka?,"Nama pengarang, tahun publikasi, dan judul artikel/paper sama dengan penulisan artikel dari jurnal. Judul buku dicetak miring/italic. Nomor volume dari buku (jika ada). Edisi penerbitan. Nama editor didahului dengan ed. atau eds. bila lebih dari satu editor. Nama penyelenggara seminar/conference. Kota tempat penyelenggaraan. Nomor halaman dari artikel/paper tersebut di dalam prosiding."
Bagaimana format penulisan referensi proyek mahasiswa?,Nama pengarang dan tahun publikasi sama dengan penulisan artikel dari jurnal. Judul proyek dicetak miring/italic. Jenis proyek. Nama perguruan tinggi. Kota tempat penyelenggaraan.
Bagaimana referensi tesis dan disertasi ditulis dalam daftar pustaka?,"Nama pengarang dan tahun publikasi sama dengan penulisan artikel dari jurnal. Judul tesis/disertasi dicetak miring/italic. Tesis/disertasi Ph.D/Master/Magister, tidak dicetak miring (dicetak huruf tegak). Nama perguruan tinggi. Kota tempat perguruan tinggi tersebut."
Bagaimana menulis standar teknis di daftar pustaka?,Nama pengarang dan tahun publikasi sama dengan penulisan artikel dari jurnal. Judul standar teknis dicetak miring/italic. Nama penerbit. Kota tempat diterbitkan.
Bagaimana cara menulis dokumen pemerintah dalam daftar pustaka?,Nama pengarang dan tahun publikasi sama dengan penulisan artikel dari jurnal. Judul dokumen dicetak miring/italic. Volume atau nomor (jika ada). Nama penerbit. Kota tempat diterbitkan.
Bagaimana menulis bahan kuliah atau handouts di daftar pustaka?,"Nama pengarang, tahun publikasi sama dengan penulisan artikel dari jurnal. Judul topik handouts dicetak miring. Lecture handout/bahan kuliah dan nama mata kuliah dicetak huruf tegak. Nama perguruan tinggi. Kota tempat perguruan tinggi tersebut."
Bagaimana menulis petunjuk praktikum dalam daftar pustaka?,"Nama pengarang, tahun publikasi sama dengan penulisan artikel dari jurnal. Nama dari kegiatan laboratorium/praktikum dicetak miring. Laboratory manual/petunjuk praktikum dicetak huruf tegak. Nama perguruan tinggi. Kota tempat perguruan tinggi tersebut."