,question,answer,contexts,ground_truth,context_precision,faithfulness,answer_relevancy,context_recall
0,Apa perbedaan antara program magang MBKM dan non-MBKM?,"Program magang MBKM memiliki beberapa perbedaan dengan program magang non-MBKM, yaitu:
1. Program magang MBKM dapat dilaksanakan di luar Program Studi baik yang ada di internal ITS maupun di luar ITS, sedangkan program magang non-MBKM tidak memiliki fleksibilitas tersebut.
2. Lama waktu pelaksanaan program magang MBKM minimal 3 bulan dan maksimal 6 bulan, sedangkan program magang non-MBKM tidak memiliki ketentuan waktu yang spesifik.
3. Mahasiswa yang melaksanakan magang dalam program MBKM harus bekerja di lapangan secara penuh waktu sesuai dengan kesepakatan tempat magang, sedangkan program magang non-MBKM mungkin memiliki fleksibilitas jam kerja yang berbeda.
4. Program magang MBKM memiliki penilaian minimal sebanyak 4 kali terhadap pelaksanaan magang, sedangkan program magang non-MBKM mungkin memiliki jumlah penilaian yang berbeda.
5. Pelaporan terhadap proses dan hasil penilaian program magang MBKM dilakukan oleh Dosen pembimbing akademik dalam pelaksanaan MBKM, sedangkan program magang non-MBKM mungkin memiliki prosedur pelaporan yang berbeda.","['NO ELEMEN PENILAIAN  INDIKATOR  \n(1) (2) (3) \natau kombinasi keduanya  \n6 Standar Proses – Tempat \npelaksanaan MBKM  Tempat k egiatan MB – KM dapat dilaksanakan di luar Program Studi baik yang ada di internal \nITS maupun di luar ITS . \n7 Standar Proses –  \nLama waktu pelaksanaan \nMBKM  Lama waktu pelaksanaan MBKM, dapat dikonvesi ke MK, dengan syarat:  \ni. Lama kegiatan belajar dapat dikonversi ke dalam sks adalah minimal 2720 menit atau \n45.3 jam.  \nii. Lama kegiatan bentuk MBKM dihitung atas waktu untuk:  (a) persiapan  di tempat \nMBKM , (b) pelaksanaan, (c) penilaian, dan  (d)  pelaporan.  \niii. Lama waktu kegiatan MB -KM bentuk magang, minimal 3 bulan dan maksimal 6 bulan.  \n8 Standar Proses –  \nKegiatan akademik selama  \nMBKM  – bentuk magang  (i) Mahasiswa yang melaksakan magang harus bekerja di lapangan secara penuh waktu \nsesuai dengan kesepakata n tempat magang;  \n(ii) Mahasiswa yang melaksanakan magang dapat melakukan kegiatan praktek / kolaborasi'
 'c. Jumlah penilaian terhadap pelaksanaan MBKM minimal sebanyak 4 (empat).  \nd. Pelaporan terhadap proses dan hasil penilaian dilakukan oleh Dosen pembimbing \nakademik dalam pelaksanaan MBKM.  \ne. Sistem informasi untuk mempermudah pendataan – implementasi MBKM di Pro di. \n \n2.4 Pengendalian  \nPengendalian pelaksanaan MBKM dilakukan oleh Prodi bersama direktorat dan unit \nterkait, mulai dari perencanaan, pelaksanaan dan pelaporan kegiatan MBKM. \nPengendalian dilakukan atas unsur -unsur yang dikawatirkan akan menyimpang, atau \ntidak memenuhi  standar yang telah ditetapkan.  \n \n \n \n 20 Baku Mutu - MBKM   - 2021  \n \n 3 Penutup  \nBaku mutu MBKM yang disusun sesuai dengan SN Dikti dan kebijakan Rektor ITS \nyang berlaku, sebagai rujukan bagi Direktorat terkait dan Prodi di dalam \nmeingimplementasi MBKM, dengan tujuan:  \n(i) Melakukan pengukuran ketercapaian CPL untuk masing -masing bentuk \nMBKM.  \n(ii) Melakukan penilaian dan evaluasi atas proses dan hasil kegiatan MBKM'
 'meingimplementasi MBKM, dengan tujuan:  \n(i) Melakukan pengukuran ketercapaian CPL untuk masing -masing bentuk \nMBKM.  \n(ii) Melakukan penilaian dan evaluasi atas proses dan hasil kegiatan MBKM  \n(iii) Melakukan pengendalian proses implementasi MBKM  \n(iv) Melakukan peningkatan impleme ntasi MBKM, atas hasil survey kepuasan \npihak internal dan eksternal stakeholder yang terlibat di dalam implementasi \nMBKM.    \n \n \n \n 21 Baku Mutu - MBKM   - 2021'
 'a. Perencanaan bentuk MB KM, yang direncanakan oleh mahasiswa bersama dosen \nwali. Perencanaan terhadap unsur: (i) Waktu dan lama waktu pelaksanaan MBKM, \n(ii) bentuk MBKM, (iii) kesesuaian bentuk MBKM dengan target perncapaian CPL, \n(iv) luaran dari pelaksanaan MBKM,  \nb. Pelaksanaan pe nilaian dapat dilakukan pada proses dan hasil MBKM dengan \nmenggunakan prinsip, teknik , instrumen dan waktu asesmen proses dan hasil \nMBKM.  Penilaian menggunakan prinsip edukatif, otentik, objektif, akuntabel, dan \ntransparan yang dilakukan secara terintegrasi . Teknik penilaian dapat \nmenggunakan satu atau lebih dari kombinasi berikut ini: observasi, partisipasi, \nunjuk kerja, tes tertulis, tes lisan, dan angket . Instrumen penilaian dapat \ndigunakan satu atau kombinasi dari: rubrik dan atau portofolio.   \nc. Jumlah penilaian terhadap pelaksanaan MBKM minimal sebanyak 4 (empat).  \nd. Pelaporan terhadap proses dan hasil penilaian dilakukan oleh Dosen pembimbing \nakademik dalam pelaksanaan MBKM.']","Program MBKM adalah program dari Kementerian Pendidikan yang harus dikonversikan ke SKS Mata Kuliah dan memerlukan surat PKS, sementara program magang non-MBKM adalah program magang yang dikonversikan ke SKEM atau untuk menambah pengalaman dan tidak memerlukan surat PKS.",,0.999999999975,0.5,0.9915845974373303
1,Apa syarat minimal SKS yang harus sudah ditempuh mahasiswa untuk mengikuti program magang MBKM?,Syarat minimal SKS yang harus sudah ditempuh mahasiswa untuk mengikuti program magang MBKM adalah minimal 72 SKS.,"['(4) Kegiatan MBKM – dalam bentuk pertukaran pelajar melalui MK di prodi di luar ITS, \ndengan ketentuan jumlah sks maksimal adalah 20 (dua puluh) sks, yang meliputi mata \nkuliah inti dan mata kuliah non inti.  \nIII STANDAR PROSES PEMBELAJARAN  \n5 Standar Proses –bentuk \npembelajaran MBKM  (i) Mahasiswa dapat melaksanakan kegiatan pembelajaran MBKM dalam rangka meraih CPL \nProdi dalam bentuk satu atau lebih bentuk berikut ini:  \na. Magang/ Praktik Kerja;  \nb. Membangun Desa/ Kuliah Kerja Nyata Tematik;  \nc. Pertukaran Pelajar;  \nd. Proyek Kemanusiaan;  \ne. Penelitian/ Riset;  \nf. Kegiatan Wirausaha;  \ng. Studi/ Proyek Independen; dan  \nh. Asistensi Mengajar di Satuan Pendidikan  \n(ii)  Pelaksanaan MB -KM bentuk (a) sd (h) dapat dilaksanakan dalam bentuk  online, offline 8 Dokumen Panduan Baku Mutu Pelaksanaan MBKM - 2021  \n NO ELEMEN PENILAIAN  INDIKATOR  \n(1) (2) (3) \natau kombinasi keduanya  \n6 Standar Proses – Tempat'
 '(ii) Keterjaminan pemenuhan CPL  melalui MBKM ( ketersediaan matrik / peta CPL - MK \nMBKM ), dan ketersediaan modul MK melalui pembelajaran  untuk MK yang \ndilaksanakan secara MBKM  \n3 Standar Isi  – MK Pengayaan  (i) MK pengayaan sebagai salah satu kurikulum di dalam MB -KM adalah mata kuliah yang \ndiambil dari luar Program Studi dan ditempuh oleh mahasiswa program sarjana setelah \nmenempuh minimal 72 sks.  \n(ii) Pengambilan MK pengayaan minimal 3 sks dan maksimal 12 sks.  \n(iii) MK pengayaan dilak ukan untuk MK yang dikelompokkan sebagai MK non inti, yang \nterdiri dari: (a) MK wajib kurikulum, (b) MK penciri ITS, (c) MK kategori pengayaan lain, \nyang diatur sesuai dengan Peraturan Akademik di ITS.  \n(iv) Jumlah sks pada MK mata kuliah non inti maksimal sebesar 20 (dua puluh) sks   \n(v) Bentuk kegiatan pengabdian kepada masyarakat merupakan salah satu bentuk 7 Dokumen Panduan Baku Mutu Pelaksanaan MBKM - 2021  \n NO ELEMEN PENILAIAN  INDIKATOR  \n(1) (2) (3)'
 'c. Jumlah penilaian terhadap pelaksanaan MBKM minimal sebanyak 4 (empat).  \nd. Pelaporan terhadap proses dan hasil penilaian dilakukan oleh Dosen pembimbing \nakademik dalam pelaksanaan MBKM.  \ne. Sistem informasi untuk mempermudah pendataan – implementasi MBKM di Pro di. \n \n2.4 Pengendalian  \nPengendalian pelaksanaan MBKM dilakukan oleh Prodi bersama direktorat dan unit \nterkait, mulai dari perencanaan, pelaksanaan dan pelaporan kegiatan MBKM. \nPengendalian dilakukan atas unsur -unsur yang dikawatirkan akan menyimpang, atau \ntidak memenuhi  standar yang telah ditetapkan.  \n \n \n \n 20 Baku Mutu - MBKM   - 2021  \n \n 3 Penutup  \nBaku mutu MBKM yang disusun sesuai dengan SN Dikti dan kebijakan Rektor ITS \nyang berlaku, sebagai rujukan bagi Direktorat terkait dan Prodi di dalam \nmeingimplementasi MBKM, dengan tujuan:  \n(i) Melakukan pengukuran ketercapaian CPL untuk masing -masing bentuk \nMBKM.  \n(ii) Melakukan penilaian dan evaluasi atas proses dan hasil kegiatan MBKM'
 'magang sesuai dengan ketentuan yang berlaku;  \n 9 Dokumen Panduan Baku Mutu Pelaksanaan MBKM - 2021  \n NO ELEMEN PENILAIAN  INDIKATOR  \n(1) (2) (3) \n9 Standar Proses –  \nKegiatan MBKM – bentuk \nPengabdian kepada Masyarakat  (i) Kegiatan MBKM dalam bentuk pengabdian kepada masyarakat  atau selanjutnya \ndikategorikan sebagai KKN  ditujukan untuk pembinaan karakter kebangsaan mahasiswa \nkhususnya untuk menumbuhkan kepedulian terhadap persoalan yang dihadapi \nmasyarakat , sebaga i salah satu CPL dalam aspek Sikap .  \n(ii) Kegiatan MBKM dalam bentuk KKN harus dibawah bimbingan dosen . \n(iii) Kegiatan MBKM dalam bentuk KKN dapat diakui sebagai  tambahan sks atau dapat \ndikompensasi dengan mata kuliah Program Studi yang memiliki capaian pembelajaran \nyang setara.  \n(iv) Kegiatan MBKM dalam bentuk KKN dilaksanakan pada semester 6 (enam) dan 7 (tujuh)  \natau sebelum nya dengan syarat telah lulus tahap persiapan.']",Mahasiswa minimal harus sudah lulus 90 SKS atau sudah lulus semester 5 untuk mengikuti program magang MBKM.,0.0,0.6388888888675925,1.0,0.9768435799720475
2,Berapa lama durasi pelaksanaan magang yang diperbolehkan untuk program magang MBKM?,Durasi pelaksanaan magang yang diperbolehkan untuk program magang MBKM minimal adalah 3 bulan dan maksimal adalah 6 bulan.,"['NO ELEMEN PENILAIAN  INDIKATOR  \n(1) (2) (3) \natau kombinasi keduanya  \n6 Standar Proses – Tempat \npelaksanaan MBKM  Tempat k egiatan MB – KM dapat dilaksanakan di luar Program Studi baik yang ada di internal \nITS maupun di luar ITS . \n7 Standar Proses –  \nLama waktu pelaksanaan \nMBKM  Lama waktu pelaksanaan MBKM, dapat dikonvesi ke MK, dengan syarat:  \ni. Lama kegiatan belajar dapat dikonversi ke dalam sks adalah minimal 2720 menit atau \n45.3 jam.  \nii. Lama kegiatan bentuk MBKM dihitung atas waktu untuk:  (a) persiapan  di tempat \nMBKM , (b) pelaksanaan, (c) penilaian, dan  (d)  pelaporan.  \niii. Lama waktu kegiatan MB -KM bentuk magang, minimal 3 bulan dan maksimal 6 bulan.  \n8 Standar Proses –  \nKegiatan akademik selama  \nMBKM  – bentuk magang  (i) Mahasiswa yang melaksakan magang harus bekerja di lapangan secara penuh waktu \nsesuai dengan kesepakata n tempat magang;  \n(ii) Mahasiswa yang melaksanakan magang dapat melakukan kegiatan praktek / kolaborasi'
 'c. Jumlah penilaian terhadap pelaksanaan MBKM minimal sebanyak 4 (empat).  \nd. Pelaporan terhadap proses dan hasil penilaian dilakukan oleh Dosen pembimbing \nakademik dalam pelaksanaan MBKM.  \ne. Sistem informasi untuk mempermudah pendataan – implementasi MBKM di Pro di. \n \n2.4 Pengendalian  \nPengendalian pelaksanaan MBKM dilakukan oleh Prodi bersama direktorat dan unit \nterkait, mulai dari perencanaan, pelaksanaan dan pelaporan kegiatan MBKM. \nPengendalian dilakukan atas unsur -unsur yang dikawatirkan akan menyimpang, atau \ntidak memenuhi  standar yang telah ditetapkan.  \n \n \n \n 20 Baku Mutu - MBKM   - 2021  \n \n 3 Penutup  \nBaku mutu MBKM yang disusun sesuai dengan SN Dikti dan kebijakan Rektor ITS \nyang berlaku, sebagai rujukan bagi Direktorat terkait dan Prodi di dalam \nmeingimplementasi MBKM, dengan tujuan:  \n(i) Melakukan pengukuran ketercapaian CPL untuk masing -masing bentuk \nMBKM.  \n(ii) Melakukan penilaian dan evaluasi atas proses dan hasil kegiatan MBKM'
 'pelaksanaan MBKM  \n(v) Ketersediaan doku men panduan  17 Dokumen Panduan Baku Mutu Pelaksanaan MBKM - 2021  \n NO ELEMEN PENILAIAN  INDIKATOR  \n(1) (2) (3) \n(vi) Keterlaksanaan penjaminan mutu internal di UPPS dan Prodi dalam pelaksanaan \nMBKM, meliputi: (a) perencanaan kurikulum dan bentuk MBKM, (b) pelaksanaan \nMBKM, (c) evaluasi pelaksanaan MBKM, (d) pengendalian, dan (e) peningkatan \nimplementasi MBKM  di waktu berikutnya  18 Dokumen Panduan Baku Mutu Pelaksanaan MBKM - 2021  \n 2.2 Implementasi Standar MBKM   \nImplementasi dalam penjaminan mutu MBKM, dilengkapi dengan beberapa dokumen, \nyaitu:  \n(1). Dokumen Panduan pelaksanaan MBKM yang diterbitkan oleh: (a) Direktorat terkait \nsebagai koordinator pelaksana masing -masing bentuk MBKM, (b) Prodi sebagai \npelaksana MBKM  untuk memandu dosen, mahasiswa dan tenaga kependidikan yang \nterlibat di dalam pro ses dan hasil pelaksanaan MBKM.  \n(2). SOP yang diterbitkan oleh: (a) Direktorat terkait sebagai koordinator pelaksana'
 'meingimplementasi MBKM, dengan tujuan:  \n(i) Melakukan pengukuran ketercapaian CPL untuk masing -masing bentuk \nMBKM.  \n(ii) Melakukan penilaian dan evaluasi atas proses dan hasil kegiatan MBKM  \n(iii) Melakukan pengendalian proses implementasi MBKM  \n(iv) Melakukan peningkatan impleme ntasi MBKM, atas hasil survey kepuasan \npihak internal dan eksternal stakeholder yang terlibat di dalam implementasi \nMBKM.    \n \n \n \n 21 Baku Mutu - MBKM   - 2021']",Durasi pelaksanaan magang untuk program magang MBKM adalah selama 3 hingga 6 bulan.,0.0,0.8055555555287036,1.0,0.9750696962994149
3,Apakah mahasiswa yang mengikuti magang MBKM diperbolehkan mengambil mata kuliah lain?,"Mahasiswa yang mengikuti magang MBKM diperbolehkan mengambil mata kuliah lain, dengan ketentuan jumlah sks maksimal adalah 20 (dua puluh) sks, yang meliputi mata kuliah inti dan mata kuliah non inti.","['(4) Kegiatan MBKM – dalam bentuk pertukaran pelajar melalui MK di prodi di luar ITS, \ndengan ketentuan jumlah sks maksimal adalah 20 (dua puluh) sks, yang meliputi mata \nkuliah inti dan mata kuliah non inti.  \nIII STANDAR PROSES PEMBELAJARAN  \n5 Standar Proses –bentuk \npembelajaran MBKM  (i) Mahasiswa dapat melaksanakan kegiatan pembelajaran MBKM dalam rangka meraih CPL \nProdi dalam bentuk satu atau lebih bentuk berikut ini:  \na. Magang/ Praktik Kerja;  \nb. Membangun Desa/ Kuliah Kerja Nyata Tematik;  \nc. Pertukaran Pelajar;  \nd. Proyek Kemanusiaan;  \ne. Penelitian/ Riset;  \nf. Kegiatan Wirausaha;  \ng. Studi/ Proyek Independen; dan  \nh. Asistensi Mengajar di Satuan Pendidikan  \n(ii)  Pelaksanaan MB -KM bentuk (a) sd (h) dapat dilaksanakan dalam bentuk  online, offline 8 Dokumen Panduan Baku Mutu Pelaksanaan MBKM - 2021  \n NO ELEMEN PENILAIAN  INDIKATOR  \n(1) (2) (3) \natau kombinasi keduanya  \n6 Standar Proses – Tempat'
 'dan menengah ,   \n(iii) Kegiatan MBKM dalam bentuk asistensi mengajar di satuan pendidikan , merupakan \nkegiatan dalam bentuk: bantuan mengajar, tutorial, bimbingan teknis, pelatihan dan \nkegiatan lainnya yang relevan  dengan kegiatan akademik di satuan pendidikan tersebut.  \n(iv) Kegiatan MBKM dalam bentuk asistensi mengajar  dapat dikonversi ke dalam sks MK  \natau bentuk lain sesuai dengan ketercapaian CPL serta lama waktu proses kegiatan  \n(v) Kegiatan MBKM dalam bentuk asistensi mengajar dikembangkan oleh Direktorat yang 13 Dokumen Panduan Baku Mutu Pelaksanaan MBKM - 2021  \n NO ELEMEN PENILAIAN  INDIKATOR  \n(1) (2) (3) \nmengurusi kemahasiswaan.  \n(vi) Implementasi kegiatan MBKM  dalam bentuk asistensi mengajar  dikoordinasi oleh \nDirektorat yang mengurusi Kemahasiswaan bersama Prodi terkait , melalui tahapan  \nkegiatan (a) persiapan, (b) Pelaksanaa n, (c) Evaluasi, (d) Pengendalian, dan (e) \nPeningkatan  \n Standar Proses –  \nKegiatan MBKM – Bentuk \nMagang / Praktik Kerja dan'
 '(ii) Keterjaminan pemenuhan CPL  melalui MBKM ( ketersediaan matrik / peta CPL - MK \nMBKM ), dan ketersediaan modul MK melalui pembelajaran  untuk MK yang \ndilaksanakan secara MBKM  \n3 Standar Isi  – MK Pengayaan  (i) MK pengayaan sebagai salah satu kurikulum di dalam MB -KM adalah mata kuliah yang \ndiambil dari luar Program Studi dan ditempuh oleh mahasiswa program sarjana setelah \nmenempuh minimal 72 sks.  \n(ii) Pengambilan MK pengayaan minimal 3 sks dan maksimal 12 sks.  \n(iii) MK pengayaan dilak ukan untuk MK yang dikelompokkan sebagai MK non inti, yang \nterdiri dari: (a) MK wajib kurikulum, (b) MK penciri ITS, (c) MK kategori pengayaan lain, \nyang diatur sesuai dengan Peraturan Akademik di ITS.  \n(iv) Jumlah sks pada MK mata kuliah non inti maksimal sebesar 20 (dua puluh) sks   \n(v) Bentuk kegiatan pengabdian kepada masyarakat merupakan salah satu bentuk 7 Dokumen Panduan Baku Mutu Pelaksanaan MBKM - 2021  \n NO ELEMEN PENILAIAN  INDIKATOR  \n(1) (2) (3)'
 'transfer kredit  \n(xi) Mekanisme dalam transfer kredit dapat dikembangkan oleh Prodi dan dikoordinasikan \ndengan Direktorat terkait.  \n7 Standar pengolaan – tempat \npelaksanaan MBKM   (1) MBKM dapat dilaksanakan oleh Prodi dengan cara menerima mahasiswa dari perguruan \ntinggi lain . \n(2) Persayaratan MBKM untuk mahasiswa luar ITS , dengan akreditasi Prodi asal mahasiswa \nminimal sama dengan Prodi di ITS.  \n(3) Jumlah mahasiswa dari luar ITS sebagai pelaksana MB -KM dibatasi maksimal sebesar 10 % \n(sepuluh persen) dari daya tampung Program Studi di ITS , kecuali dengan kerjasama \nkhusus.  \n(4) Mekanisme dan penyelenggaraan kegiatan pertukaran pelajar/ kuliah untuk mahasis wa \ndi luar ITS dapat  dikembangkan dan dikoordinasikan oleh Direktorat yang mengurusi \npendidikan bekerjasama dengan Direktorat yang mengurusi pascasarjana dan \npengembangan akademik .']","Mahasiswa yang mengikuti magang MBKM tidak diperbolehkan mengambil mata kuliah lain, atau hanya diperbolehkan mengambil maksimal 3 mata kuliah (setara 10 SKS).",1.0,0.6388888888675925,0.3333333333333333,0.8944765619652925
4,Apa saja tahapan dalam skema pelaksanaan Program Magang Flagship di ITS?,Saya tidak tahu.,"['di luar ITS dapat  dikembangkan dan dikoordinasikan oleh Direktorat yang mengurusi \npendidikan bekerjasama dengan Direktorat yang mengurusi pascasarjana dan \npengembangan akademik . \n(5) Direktorat yang mengurusi kegiatan pertukaran pelajar/ kuliah dalam negeri harus 16 Dokumen Panduan Baku Mutu Pelaksanaan MBKM - 2021  \n NO ELEMEN PENILAIAN  INDIKATOR  \n(1) (2) (3) \nberkoordinasi dengan Program Studi terkait . \n Standar Pengelolaan – \nPerencanaan MBKM  1. Prodi mempunyai Dokumen panduan untuk implementasi MBKM / turunan dokumen \nPerek 21 tahun 202 1 yang menjadi konsideran  implementasi MBKM . \n2. Prodi mempunyai kurikulum implementasi MBKM, yang meliputi CPL yang ditetapkan \nsesuai dengan implementasi MBKM dan peta CPL – MK MBKM  \n3.  Prodi mempunyai Dokumen panduan untuk Dosen  Wali dan Dosen Pembimbing dalam \npelaksanaan MBKM   \n4. Prodi mempunyai Dokumen pan duan untuk Mahasiswa dalam perencanaan , \npelaksannaan, penilaian pelaksanaan  MBKM'
 '(v) Bentuk kegiatan pengabdian kepada masyarakat merupakan salah satu bentuk 7 Dokumen Panduan Baku Mutu Pelaksanaan MBKM - 2021  \n NO ELEMEN PENILAIAN  INDIKATOR  \n(1) (2) (3) \nimplementasi MK pengayaan dengan bobot 3 (tiga) sks.  \n \n4 Standar Isi  – Pengakuan bobot \nsks (1) Jumlah sks maksimal yang dapat diambil dalam rangka pelaksanaan kegiatan MB – KM \nadalah 40 (empat puluh) sks.  \n(2) Kegiatan magang/ praktik kerja pada program sarjana terapan diimplementasikan dalam \nbentuk mata kuliah wajib sebagai  mata kuliah penciri Fakultas  Vokasi sebesar 14 (empat \nbelas) sks.  \n(3) Konversi kegiatan MB -KM magang dapat dikonversikan ke dalam: (i) MK KP,  \n(ii) beberapa MK gabungan antara KP dengan MK lain dengan kesamaan CP MK,  \n(iii) MK magang dengan maksimum bobot 20 (dua puluh) sks.   \n(4) Kegiatan MBKM – dalam bentuk pertukaran pelajar melalui MK di prodi di luar ITS, \ndengan ketentuan jumlah sks maksimal adalah 20 (dua puluh) sks, yang meliputi mata'
 'b. Manual pelaksanaan standar  \nc. Manual evaluasi standar  \nd. Manual pengendalian pelaksnanaan standar  \ne. Manual peningkatan standar  \n3. Rincian tentang hal yang harus dikerjakan  \n4. Pihak yang bertanggung jawab mengerjakan sesuatu  \n5. Uraian tentang pekerjaan yang harus dilaksanakan sesuai manual  \n6. Uraian tentang bagaimana pekerjaan itu harus dilaksanakan  \n7. Rincian formulir / borang / proforma yang harus dibuat dan digunakan sebagai \nbagian dari manual MBKM  \n8. Rincian sarana yang digunakan sesuai petunjuk dalam manual  \n \n 19 Dokumen Panduan Baku Mutu Pelaksanaan MBKM - 2021  \n 2.3 Evaluasi  MBKM  \nEvaluasi MBKM dilakukan oleh organ mutu di masing -masing pelaksana MBKM, dalam \nwaktu setiap semester minimal 1 (satu) kali. Evaluasi dilakukan terhadap:  \na. Perencanaan bentuk MB KM, yang direncanakan oleh mahasiswa bersama dosen \nwali. Perencanaan terhadap unsur: (i) Waktu dan lama waktu pelaksanaan MBKM,'
 'c. Jumlah penilaian terhadap pelaksanaan MBKM minimal sebanyak 4 (empat).  \nd. Pelaporan terhadap proses dan hasil penilaian dilakukan oleh Dosen pembimbing \nakademik dalam pelaksanaan MBKM.  \ne. Sistem informasi untuk mempermudah pendataan – implementasi MBKM di Pro di. \n \n2.4 Pengendalian  \nPengendalian pelaksanaan MBKM dilakukan oleh Prodi bersama direktorat dan unit \nterkait, mulai dari perencanaan, pelaksanaan dan pelaporan kegiatan MBKM. \nPengendalian dilakukan atas unsur -unsur yang dikawatirkan akan menyimpang, atau \ntidak memenuhi  standar yang telah ditetapkan.  \n \n \n \n 20 Baku Mutu - MBKM   - 2021  \n \n 3 Penutup  \nBaku mutu MBKM yang disusun sesuai dengan SN Dikti dan kebijakan Rektor ITS \nyang berlaku, sebagai rujukan bagi Direktorat terkait dan Prodi di dalam \nmeingimplementasi MBKM, dengan tujuan:  \n(i) Melakukan pengukuran ketercapaian CPL untuk masing -masing bentuk \nMBKM.  \n(ii) Melakukan penilaian dan evaluasi atas proses dan hasil kegiatan MBKM']","Tahapan dalam skema pelaksanaan Program Magang Flagship di ITS meliputi: membuat akun di kampusmerdeka.kemdikbud.go.id, memilih program dan mitra, konsultasi ke Departemen, mengajukan SPTJM, pengecekan Track Record Magang Mahasiswa oleh PK2, dan pendaftaran program MSIB di website kampus merdeka.",0.0,0.499999999975,,0.0
5,Apa tugas PK2 dalam mengelola pendaftaran program magang di ITS?,Saya tidak tahu.,"['2 PRINSIP PPEPP DALAM PENYELENGGARAAN MB -KM \n \nSiklus PPEPP dalam penyelenggaran MB -KM, ditunjukkan di dalam ilustrasi gambar 1.1 di \nbawah ini.  \n \nP: Penetapan   \nP: Pelaksanaan   \nE: Evaluasi  \nP: Pengendalian  \nP: Peningkatan  \n \n \nGambar 2.1 Siklus PPEPP di dalam SPMI  \n \n \n2.1 Penetapan Standar  \nStandar dalam penyelenggaraan MB -KM mengacu pada: (i) SN – Dikti, (ii) Peraturan \nRektor tentang MB -KM, dan (iii) Panduan yang telah dikeluarkan oleh D irektorat \nKemahasiswaan, Direktorat Pendidikan, dan Direktorat Riset dan Pengabdian kepada \nMasyarakat .  \nStandar yang digunakan di dalam penjaminan mutu MB -KM mengacu pada SN Dikti dan \nKebijakan yang telah ditetapkan oleh Rektor ITS yang masih berlaku. Standar tersebut  \ndituliskan di dalam Tabel di bawah ini.  6 Dokumen Panduan Baku Mutu Pelaksanaan MBKM - 2021  \n  \nTabel 2.1 Standar dalam penyelenggaraan MB -KM di   ITS \nNO ELEMEN PENILAIAN  INDIKATOR  \n(1) (2) (3) \nI STANDAR KOMPETENSI LULUSAN'
 'Tabel 2.1 Standar dalam penyelenggaraan MB -KM di   ITS \nNO ELEMEN PENILAIAN  INDIKATOR  \n(1) (2) (3) \nI STANDAR KOMPETENSI LULUSAN  \n1 Standar Kompetensi Lulusan  (i) Pelaksanaan MBKM mengacu pada CPL Prodi sebagai target dari kemampuan lulusan, \ndengan minimal pencapaian 80%  CPL dan atau sebagai kompetensi tambahan  \n(ii) Kompetensi tambahan dimaksudkan untuk memperlancar karir lulusan, kolaborasi riset \ndan atau kerja sama p engembangan industri.  \nII STANDAR ISI PEMBELAJARAN  \n2 Standar Isi  – MK Pengayaan  (i) Prodi menyediakan kurikulum untuk pelaksanaan MBKM yang disusun bersama \npemangku kepentingan internal dan eksternal, serta direview oleh pakar bidang ilmu \nprogram studi nya.  \n(ii) Keterjaminan pemenuhan CPL  melalui MBKM ( ketersediaan matrik / peta CPL - MK \nMBKM ), dan ketersediaan modul MK melalui pembelajaran  untuk MK yang \ndilaksanakan secara MBKM'
 'b. Manual pelaksanaan standar  \nc. Manual evaluasi standar  \nd. Manual pengendalian pelaksnanaan standar  \ne. Manual peningkatan standar  \n3. Rincian tentang hal yang harus dikerjakan  \n4. Pihak yang bertanggung jawab mengerjakan sesuatu  \n5. Uraian tentang pekerjaan yang harus dilaksanakan sesuai manual  \n6. Uraian tentang bagaimana pekerjaan itu harus dilaksanakan  \n7. Rincian formulir / borang / proforma yang harus dibuat dan digunakan sebagai \nbagian dari manual MBKM  \n8. Rincian sarana yang digunakan sesuai petunjuk dalam manual  \n \n 19 Dokumen Panduan Baku Mutu Pelaksanaan MBKM - 2021  \n 2.3 Evaluasi  MBKM  \nEvaluasi MBKM dilakukan oleh organ mutu di masing -masing pelaksana MBKM, dalam \nwaktu setiap semester minimal 1 (satu) kali. Evaluasi dilakukan terhadap:  \na. Perencanaan bentuk MB KM, yang direncanakan oleh mahasiswa bersama dosen \nwali. Perencanaan terhadap unsur: (i) Waktu dan lama waktu pelaksanaan MBKM,'
 'di luar ITS dapat  dikembangkan dan dikoordinasikan oleh Direktorat yang mengurusi \npendidikan bekerjasama dengan Direktorat yang mengurusi pascasarjana dan \npengembangan akademik . \n(5) Direktorat yang mengurusi kegiatan pertukaran pelajar/ kuliah dalam negeri harus 16 Dokumen Panduan Baku Mutu Pelaksanaan MBKM - 2021  \n NO ELEMEN PENILAIAN  INDIKATOR  \n(1) (2) (3) \nberkoordinasi dengan Program Studi terkait . \n Standar Pengelolaan – \nPerencanaan MBKM  1. Prodi mempunyai Dokumen panduan untuk implementasi MBKM / turunan dokumen \nPerek 21 tahun 202 1 yang menjadi konsideran  implementasi MBKM . \n2. Prodi mempunyai kurikulum implementasi MBKM, yang meliputi CPL yang ditetapkan \nsesuai dengan implementasi MBKM dan peta CPL – MK MBKM  \n3.  Prodi mempunyai Dokumen panduan untuk Dosen  Wali dan Dosen Pembimbing dalam \npelaksanaan MBKM   \n4. Prodi mempunyai Dokumen pan duan untuk Mahasiswa dalam perencanaan , \npelaksannaan, penilaian pelaksanaan  MBKM']","PK2 mengkoordinir pendaftaran program magang melalui SIM Magang, melakukan seleksi administrasi, mengecek track record magang mahasiswa, dan mengirimkan data kandidat peserta magang ke mitra.",0.0,0.6388888888675925,,0.0
6,Apa saja dokumen yang harus diunggah mahasiswa saat mendaftar program MSIB?,"Dokumen yang harus diunggah mahasiswa saat mendaftar program MSIB antara lain:
1. Dokumen panduan untuk implementasi MBKM / turunan dokumen Perek 21 tahun 2021 yang menjadi pertimbangan implementasi MBKM.
2. Kurikulum implementasi MBKM, yang meliputi CPL yang ditetapkan sesuai dengan implementasi MBKM dan peta CPL - MK MBKM.
3. Dokumen panduan untuk Dosen Wali dan Dosen Pembimbing dalam pelaksanaan MBKM.
4. Dokumen panduan untuk Mahasiswa dalam perencanaan, pelaksanaan, dan penilaian pelaksanaan MBKM.
5. Dokumen panduan bagi administratur dalam perekaman pelaksanaan dan monitoring MBKM.","['di luar ITS dapat  dikembangkan dan dikoordinasikan oleh Direktorat yang mengurusi \npendidikan bekerjasama dengan Direktorat yang mengurusi pascasarjana dan \npengembangan akademik . \n(5) Direktorat yang mengurusi kegiatan pertukaran pelajar/ kuliah dalam negeri harus 16 Dokumen Panduan Baku Mutu Pelaksanaan MBKM - 2021  \n NO ELEMEN PENILAIAN  INDIKATOR  \n(1) (2) (3) \nberkoordinasi dengan Program Studi terkait . \n Standar Pengelolaan – \nPerencanaan MBKM  1. Prodi mempunyai Dokumen panduan untuk implementasi MBKM / turunan dokumen \nPerek 21 tahun 202 1 yang menjadi konsideran  implementasi MBKM . \n2. Prodi mempunyai kurikulum implementasi MBKM, yang meliputi CPL yang ditetapkan \nsesuai dengan implementasi MBKM dan peta CPL – MK MBKM  \n3.  Prodi mempunyai Dokumen panduan untuk Dosen  Wali dan Dosen Pembimbing dalam \npelaksanaan MBKM   \n4. Prodi mempunyai Dokumen pan duan untuk Mahasiswa dalam perencanaan , \npelaksannaan, penilaian pelaksanaan  MBKM'
 'sesuai dengan kesepakata n tempat magang;  \n(ii) Mahasiswa yang melaksanakan magang dapat melakukan kegiatan praktek / kolaborasi \nriset / kerja sama pengembangan industri / bentu k kegiatan  lain  yang selaras dengan \nCPL’   \n(iii) Mahasiswa yang melaksanakan magang wajib  dibimbing oleh pembimbing internal dari \ndosen ITS dan  pembimbing eksternal dari pihak  instansi / lembaga /  industri  tempat \nmagang ;  \n(iv) Mahasiswa yang melaksanakan magang dapat melakukan kegiatan akademik yang lain \ndengan syarat telah mendapatkan ijin dari pihak penanggung jawab lembaga / badan / \nindustri magang ;  \n(v) Mahasiswa pada waktu melaksanaan magang  tidak harus cuti  studi ;  \n(vi) Mahasiswa yang melaksa nakan magang dapat diberi  memberikan surat keterangan \nhasil kegiatan magang / sertifikat kompetensi  dari lembaga / badan / industri letak \nmagang sesuai dengan ketentuan yang berlaku;  \n 9 Dokumen Panduan Baku Mutu Pelaksanaan MBKM - 2021  \n NO ELEMEN PENILAIAN  INDIKATOR  \n(1) (2) (3)'
 '(v) Bentuk kegiatan pengabdian kepada masyarakat merupakan salah satu bentuk 7 Dokumen Panduan Baku Mutu Pelaksanaan MBKM - 2021  \n NO ELEMEN PENILAIAN  INDIKATOR  \n(1) (2) (3) \nimplementasi MK pengayaan dengan bobot 3 (tiga) sks.  \n \n4 Standar Isi  – Pengakuan bobot \nsks (1) Jumlah sks maksimal yang dapat diambil dalam rangka pelaksanaan kegiatan MB – KM \nadalah 40 (empat puluh) sks.  \n(2) Kegiatan magang/ praktik kerja pada program sarjana terapan diimplementasikan dalam \nbentuk mata kuliah wajib sebagai  mata kuliah penciri Fakultas  Vokasi sebesar 14 (empat \nbelas) sks.  \n(3) Konversi kegiatan MB -KM magang dapat dikonversikan ke dalam: (i) MK KP,  \n(ii) beberapa MK gabungan antara KP dengan MK lain dengan kesamaan CP MK,  \n(iii) MK magang dengan maksimum bobot 20 (dua puluh) sks.   \n(4) Kegiatan MBKM – dalam bentuk pertukaran pelajar melalui MK di prodi di luar ITS, \ndengan ketentuan jumlah sks maksimal adalah 20 (dua puluh) sks, yang meliputi mata'
 'pelaksanaan MBKM   \n4. Prodi mempunyai Dokumen pan duan untuk Mahasiswa dalam perencanaan , \npelaksannaan, penilaian pelaksanaan  MBKM  \n5. Prodi mempunyai d okumen panduan bagi administratur dalam perekaman pelaksanaan \ndan monev MBKM  \n \n8 Standar Pengelolaan – \nPeningkatan MBKM  Mutu, manfaat, kepuasan dan keberlanjutan kerjasama pendidikan  dalam MBKM  \n(i) UPPS dan Prodi melakukan survey kepuasaan kepada seluruh mitra kerjasama \npelaksanaan MBKM, sebagai upaya evaluasi dan keberlanjutan program MBKM.  \n(ii) Upaya yang dilakukan  Direktorat,  UPPS dan PS untuk meningkatkan animo \nmahasiswa dalam pelaksanaan MBKM  \n(iii) Ketersediaan layanan bagi mahasiswa dalam pelaksanaan MBKM di level Prodi dan \nlevel Direktorat terkait  \n(iv) Ketersediaan layanan bagi dosen pembimbing dalam dan pembimbing dari luar untuk \npelaksanaan MBKM  \n(v) Ketersediaan doku men panduan  17 Dokumen Panduan Baku Mutu Pelaksanaan MBKM - 2021  \n NO ELEMEN PENILAIAN  INDIKATOR  \n(1) (2) (3)']","Dokumen yang harus diunggah antara lain CV, transkrip nilai, surat rekomendasi departemen, form pakta integritas, dan dokumen kelengkapan lainnya.",0.0,0.999999999975,0.3333333333333333,0.9838044224988923
7,Bagaimana proses verifikasi data mahasiswa oleh Penanggung Jawab Fakultas/Prodi?,"Proses verifikasi data mahasiswa oleh Penanggung Jawab Fakultas/Prodi meliputi beberapa langkah, antara lain:
1. Penanggung Jawab Fakultas/Prodi memeriksa data mahasiswa yang akan melakukan magang, termasuk persyaratan yang harus dipenuhi sesuai dengan ketentuan yang berlaku.
2. Penanggung Jawab Fakultas/Prodi melakukan verifikasi terhadap dokumen-dokumen yang diperlukan untuk melaksanakan magang, seperti surat izin magang, surat pernyataan, dan dokumen lainnya.
3. Penanggung Jawab Fakultas/Prodi memastikan bahwa mahasiswa telah mendapatkan pembimbing internal dari dosen ITS dan pembimbing eksternal dari pihak instansi/lembaga/industri tempat magang.
4. Penanggung Jawab Fakultas/Prodi juga memverifikasi apakah mahasiswa telah mendapatkan ijin untuk melakukan kegiatan akademik lain selama magang.
5. Selain itu, Penanggung Jawab Fakultas/Prodi juga memastikan bahwa mahasiswa tidak harus cuti studi saat melaksanakan magang.
6. Terakhir, Penanggung Jawab Fakultas/Prodi dapat memberikan surat keterangan hasil kegiatan magang atau sertifikat kompetensi dari lembaga/badan/industri tempat magang sesuai dengan ketentuan yang berlaku.","['sesuai dengan kesepakata n tempat magang;  \n(ii) Mahasiswa yang melaksanakan magang dapat melakukan kegiatan praktek / kolaborasi \nriset / kerja sama pengembangan industri / bentu k kegiatan  lain  yang selaras dengan \nCPL’   \n(iii) Mahasiswa yang melaksanakan magang wajib  dibimbing oleh pembimbing internal dari \ndosen ITS dan  pembimbing eksternal dari pihak  instansi / lembaga /  industri  tempat \nmagang ;  \n(iv) Mahasiswa yang melaksanakan magang dapat melakukan kegiatan akademik yang lain \ndengan syarat telah mendapatkan ijin dari pihak penanggung jawab lembaga / badan / \nindustri magang ;  \n(v) Mahasiswa pada waktu melaksanaan magang  tidak harus cuti  studi ;  \n(vi) Mahasiswa yang melaksa nakan magang dapat diberi  memberikan surat keterangan \nhasil kegiatan magang / sertifikat kompetensi  dari lembaga / badan / industri letak \nmagang sesuai dengan ketentuan yang berlaku;  \n 9 Dokumen Panduan Baku Mutu Pelaksanaan MBKM - 2021  \n NO ELEMEN PENILAIAN  INDIKATOR  \n(1) (2) (3)'
 'di luar ITS dapat  dikembangkan dan dikoordinasikan oleh Direktorat yang mengurusi \npendidikan bekerjasama dengan Direktorat yang mengurusi pascasarjana dan \npengembangan akademik . \n(5) Direktorat yang mengurusi kegiatan pertukaran pelajar/ kuliah dalam negeri harus 16 Dokumen Panduan Baku Mutu Pelaksanaan MBKM - 2021  \n NO ELEMEN PENILAIAN  INDIKATOR  \n(1) (2) (3) \nberkoordinasi dengan Program Studi terkait . \n Standar Pengelolaan – \nPerencanaan MBKM  1. Prodi mempunyai Dokumen panduan untuk implementasi MBKM / turunan dokumen \nPerek 21 tahun 202 1 yang menjadi konsideran  implementasi MBKM . \n2. Prodi mempunyai kurikulum implementasi MBKM, yang meliputi CPL yang ditetapkan \nsesuai dengan implementasi MBKM dan peta CPL – MK MBKM  \n3.  Prodi mempunyai Dokumen panduan untuk Dosen  Wali dan Dosen Pembimbing dalam \npelaksanaan MBKM   \n4. Prodi mempunyai Dokumen pan duan untuk Mahasiswa dalam perencanaan , \npelaksannaan, penilaian pelaksanaan  MBKM'
 '(v) Bentuk kegiatan pengabdian kepada masyarakat merupakan salah satu bentuk 7 Dokumen Panduan Baku Mutu Pelaksanaan MBKM - 2021  \n NO ELEMEN PENILAIAN  INDIKATOR  \n(1) (2) (3) \nimplementasi MK pengayaan dengan bobot 3 (tiga) sks.  \n \n4 Standar Isi  – Pengakuan bobot \nsks (1) Jumlah sks maksimal yang dapat diambil dalam rangka pelaksanaan kegiatan MB – KM \nadalah 40 (empat puluh) sks.  \n(2) Kegiatan magang/ praktik kerja pada program sarjana terapan diimplementasikan dalam \nbentuk mata kuliah wajib sebagai  mata kuliah penciri Fakultas  Vokasi sebesar 14 (empat \nbelas) sks.  \n(3) Konversi kegiatan MB -KM magang dapat dikonversikan ke dalam: (i) MK KP,  \n(ii) beberapa MK gabungan antara KP dengan MK lain dengan kesamaan CP MK,  \n(iii) MK magang dengan maksimum bobot 20 (dua puluh) sks.   \n(4) Kegiatan MBKM – dalam bentuk pertukaran pelajar melalui MK di prodi di luar ITS, \ndengan ketentuan jumlah sks maksimal adalah 20 (dua puluh) sks, yang meliputi mata'
 '(1) (2) (3) \nDalam hal mahasiswa mendapatkan nilai mata kuliah pengayaan kurang dari C, maka \nmahasiswa dapat menggantinya dengan mata kuliah pengayaan yang berbeda.  \nV STANDAR DOSEN DAN TENDIK  \n12 Standar dosen dan Tendik  (i) Dosen wali ditugaskan oleh Prodi untuk membuat perencanaan bersama dengan \nmahasiswa yang akan melaksanakan kegatan MBKM  \n(ii) Dosen wali ditugaskan oleh Prodi untuk melakukan evaluasi terhadap kesesuaian \nbentuk dan lama pelaksanaan MBKM sesuai dengan CPL  \n(iii) Dosen wali di tugaskan oleh Prodi untuk melakukan penilaian atas rencana, \npelaksanaan dan evaluasi MBKM  \n(iv) Dosen pembimbing MBKM ditugaskan oleh Prodi sesuai dengan pengampu MK \nkonversi dan atau dosen wali  \n(v) Tendik Prodi ditugaskan untuk melayani administrasi dalam implement asi MBKM, \nmulai dari perencanaan, pelaksanaan, moneitoring dan evaluasi, serta pelaporan \nMBKM.  \n \nVI STANDAR PENGELOLAAN PEMBELAJARAN']","Penanggung Jawab Fakultas/Prodi mengecek kesesuaian data akademik mahasiswa dan kebenaran dokumen yang telah diunggah di laman MBKM, dan memberikan izin jika data sudah sesuai.",0.0,0.999999999975,0.927770968486869,0.0
8,Apa yang harus dilakukan mahasiswa jika datanya memerlukan revisi?,Mahasiswa harus mendapatkan izin dari pihak penanggung jawab lembaga / badan / industri tempat magang untuk melakukan revisi data jika diperlukan.,"['sesuai dengan kesepakata n tempat magang;  \n(ii) Mahasiswa yang melaksanakan magang dapat melakukan kegiatan praktek / kolaborasi \nriset / kerja sama pengembangan industri / bentu k kegiatan  lain  yang selaras dengan \nCPL’   \n(iii) Mahasiswa yang melaksanakan magang wajib  dibimbing oleh pembimbing internal dari \ndosen ITS dan  pembimbing eksternal dari pihak  instansi / lembaga /  industri  tempat \nmagang ;  \n(iv) Mahasiswa yang melaksanakan magang dapat melakukan kegiatan akademik yang lain \ndengan syarat telah mendapatkan ijin dari pihak penanggung jawab lembaga / badan / \nindustri magang ;  \n(v) Mahasiswa pada waktu melaksanaan magang  tidak harus cuti  studi ;  \n(vi) Mahasiswa yang melaksa nakan magang dapat diberi  memberikan surat keterangan \nhasil kegiatan magang / sertifikat kompetensi  dari lembaga / badan / industri letak \nmagang sesuai dengan ketentuan yang berlaku;  \n 9 Dokumen Panduan Baku Mutu Pelaksanaan MBKM - 2021  \n NO ELEMEN PENILAIAN  INDIKATOR  \n(1) (2) (3)'
 'b. Manual pelaksanaan standar  \nc. Manual evaluasi standar  \nd. Manual pengendalian pelaksnanaan standar  \ne. Manual peningkatan standar  \n3. Rincian tentang hal yang harus dikerjakan  \n4. Pihak yang bertanggung jawab mengerjakan sesuatu  \n5. Uraian tentang pekerjaan yang harus dilaksanakan sesuai manual  \n6. Uraian tentang bagaimana pekerjaan itu harus dilaksanakan  \n7. Rincian formulir / borang / proforma yang harus dibuat dan digunakan sebagai \nbagian dari manual MBKM  \n8. Rincian sarana yang digunakan sesuai petunjuk dalam manual  \n \n 19 Dokumen Panduan Baku Mutu Pelaksanaan MBKM - 2021  \n 2.3 Evaluasi  MBKM  \nEvaluasi MBKM dilakukan oleh organ mutu di masing -masing pelaksana MBKM, dalam \nwaktu setiap semester minimal 1 (satu) kali. Evaluasi dilakukan terhadap:  \na. Perencanaan bentuk MB KM, yang direncanakan oleh mahasiswa bersama dosen \nwali. Perencanaan terhadap unsur: (i) Waktu dan lama waktu pelaksanaan MBKM,'
 'di luar ITS dapat  dikembangkan dan dikoordinasikan oleh Direktorat yang mengurusi \npendidikan bekerjasama dengan Direktorat yang mengurusi pascasarjana dan \npengembangan akademik . \n(5) Direktorat yang mengurusi kegiatan pertukaran pelajar/ kuliah dalam negeri harus 16 Dokumen Panduan Baku Mutu Pelaksanaan MBKM - 2021  \n NO ELEMEN PENILAIAN  INDIKATOR  \n(1) (2) (3) \nberkoordinasi dengan Program Studi terkait . \n Standar Pengelolaan – \nPerencanaan MBKM  1. Prodi mempunyai Dokumen panduan untuk implementasi MBKM / turunan dokumen \nPerek 21 tahun 202 1 yang menjadi konsideran  implementasi MBKM . \n2. Prodi mempunyai kurikulum implementasi MBKM, yang meliputi CPL yang ditetapkan \nsesuai dengan implementasi MBKM dan peta CPL – MK MBKM  \n3.  Prodi mempunyai Dokumen panduan untuk Dosen  Wali dan Dosen Pembimbing dalam \npelaksanaan MBKM   \n4. Prodi mempunyai Dokumen pan duan untuk Mahasiswa dalam perencanaan , \npelaksannaan, penilaian pelaksanaan  MBKM'
 '(1) (2) (3) \nDalam hal mahasiswa mendapatkan nilai mata kuliah pengayaan kurang dari C, maka \nmahasiswa dapat menggantinya dengan mata kuliah pengayaan yang berbeda.  \nV STANDAR DOSEN DAN TENDIK  \n12 Standar dosen dan Tendik  (i) Dosen wali ditugaskan oleh Prodi untuk membuat perencanaan bersama dengan \nmahasiswa yang akan melaksanakan kegatan MBKM  \n(ii) Dosen wali ditugaskan oleh Prodi untuk melakukan evaluasi terhadap kesesuaian \nbentuk dan lama pelaksanaan MBKM sesuai dengan CPL  \n(iii) Dosen wali di tugaskan oleh Prodi untuk melakukan penilaian atas rencana, \npelaksanaan dan evaluasi MBKM  \n(iv) Dosen pembimbing MBKM ditugaskan oleh Prodi sesuai dengan pengampu MK \nkonversi dan atau dosen wali  \n(v) Tendik Prodi ditugaskan untuk melayani administrasi dalam implement asi MBKM, \nmulai dari perencanaan, pelaksanaan, moneitoring dan evaluasi, serta pelaporan \nMBKM.  \n \nVI STANDAR PENGELOLAAN PEMBELAJARAN']","Mahasiswa harus memperbaiki data sesuai dengan catatan perbaikan yang diberikan oleh Penanggung Jawab Fakultas/Prodi, dan mengunggah kembali dokumen yang diperbaiki.",0.6388888888675925,0.5,0.0,1.0
9,Apa saja peran mitra magang dalam program magang ITS?,"Mitra magang memiliki beberapa peran dalam program magang ITS, antara lain:
1. Memberikan bimbingan kepada mahasiswa selama menjalani magang.
2. Menyediakan kesempatan bagi mahasiswa untuk melakukan praktik kerja atau kolaborasi riset.
3. Menjadi pembimbing eksternal bagi mahasiswa selama magang.
4. Memberikan ijin kepada mahasiswa untuk melakukan kegiatan akademik lain selama magang.
5. Memberikan surat keterangan hasil kegiatan magang atau sertifikat kompetensi sesuai dengan ketentuan yang berlaku.","['(v) Bentuk kegiatan pengabdian kepada masyarakat merupakan salah satu bentuk 7 Dokumen Panduan Baku Mutu Pelaksanaan MBKM - 2021  \n NO ELEMEN PENILAIAN  INDIKATOR  \n(1) (2) (3) \nimplementasi MK pengayaan dengan bobot 3 (tiga) sks.  \n \n4 Standar Isi  – Pengakuan bobot \nsks (1) Jumlah sks maksimal yang dapat diambil dalam rangka pelaksanaan kegiatan MB – KM \nadalah 40 (empat puluh) sks.  \n(2) Kegiatan magang/ praktik kerja pada program sarjana terapan diimplementasikan dalam \nbentuk mata kuliah wajib sebagai  mata kuliah penciri Fakultas  Vokasi sebesar 14 (empat \nbelas) sks.  \n(3) Konversi kegiatan MB -KM magang dapat dikonversikan ke dalam: (i) MK KP,  \n(ii) beberapa MK gabungan antara KP dengan MK lain dengan kesamaan CP MK,  \n(iii) MK magang dengan maksimum bobot 20 (dua puluh) sks.   \n(4) Kegiatan MBKM – dalam bentuk pertukaran pelajar melalui MK di prodi di luar ITS, \ndengan ketentuan jumlah sks maksimal adalah 20 (dua puluh) sks, yang meliputi mata'
 'sesuai dengan kesepakata n tempat magang;  \n(ii) Mahasiswa yang melaksanakan magang dapat melakukan kegiatan praktek / kolaborasi \nriset / kerja sama pengembangan industri / bentu k kegiatan  lain  yang selaras dengan \nCPL’   \n(iii) Mahasiswa yang melaksanakan magang wajib  dibimbing oleh pembimbing internal dari \ndosen ITS dan  pembimbing eksternal dari pihak  instansi / lembaga /  industri  tempat \nmagang ;  \n(iv) Mahasiswa yang melaksanakan magang dapat melakukan kegiatan akademik yang lain \ndengan syarat telah mendapatkan ijin dari pihak penanggung jawab lembaga / badan / \nindustri magang ;  \n(v) Mahasiswa pada waktu melaksanaan magang  tidak harus cuti  studi ;  \n(vi) Mahasiswa yang melaksa nakan magang dapat diberi  memberikan surat keterangan \nhasil kegiatan magang / sertifikat kompetensi  dari lembaga / badan / industri letak \nmagang sesuai dengan ketentuan yang berlaku;  \n 9 Dokumen Panduan Baku Mutu Pelaksanaan MBKM - 2021  \n NO ELEMEN PENILAIAN  INDIKATOR  \n(1) (2) (3)'
 'b. Manual pelaksanaan standar  \nc. Manual evaluasi standar  \nd. Manual pengendalian pelaksnanaan standar  \ne. Manual peningkatan standar  \n3. Rincian tentang hal yang harus dikerjakan  \n4. Pihak yang bertanggung jawab mengerjakan sesuatu  \n5. Uraian tentang pekerjaan yang harus dilaksanakan sesuai manual  \n6. Uraian tentang bagaimana pekerjaan itu harus dilaksanakan  \n7. Rincian formulir / borang / proforma yang harus dibuat dan digunakan sebagai \nbagian dari manual MBKM  \n8. Rincian sarana yang digunakan sesuai petunjuk dalam manual  \n \n 19 Dokumen Panduan Baku Mutu Pelaksanaan MBKM - 2021  \n 2.3 Evaluasi  MBKM  \nEvaluasi MBKM dilakukan oleh organ mutu di masing -masing pelaksana MBKM, dalam \nwaktu setiap semester minimal 1 (satu) kali. Evaluasi dilakukan terhadap:  \na. Perencanaan bentuk MB KM, yang direncanakan oleh mahasiswa bersama dosen \nwali. Perencanaan terhadap unsur: (i) Waktu dan lama waktu pelaksanaan MBKM,'
 'dan start -up.  \n(iii) Kegiatan MBKM dalam bentuk magang/ praktik kerja dan kegiatan wirausaha hilirisasi \ndikembangkan oleh  Direktorat yang mengurusi inovasi dan kawasan sains teknologi \nbekerjasama dengan Direktorat yang mengurusi kemahasiswaan . \n(iv) Impl ementasi kegiatan MBKM dalam bentuk  magang/ praktik kerja dan kegiatan \nwirausaha hilirisasi dikoordinir oleh Direktorat yang mengurusi  inovasi dan kawasan \nsains teknologi  bersama Prodi terkait, melalui tahapan  kegiatan (a) persiapan, (b) \nPelaksanaan, (c) Evaluasi, (d) Pengendalian, dan (e) Peningkatan   \n \nIV STANDAR PENILAIAN PEMBELAJARAN  \n11 Standar penilaian  (i) Penilaian atas proses dan hasil pelaksanaan MBKM mengacu pada prinsip penilaian.  \n \n 14 Dokumen Panduan Baku Mutu Pelaksanaan MBKM - 2021  \n NO ELEMEN PENILAIAN  INDIKATOR  \n(1) (2) (3) \nDalam hal mahasiswa mendapatkan nilai mata kuliah pengayaan kurang dari C, maka \nmahasiswa dapat menggantinya dengan mata kuliah pengayaan yang berbeda.']","Peran mitra magang meliputi memberikan profil perusahaan, menyusun perjanjian kerja sama magang, memberikan tugas dan arahan kepada mahasiswa magang, serta menyediakan fasilitas kerja dan penilaian prestasi mahasiswa.",0.999999999975,0.0,0.9988011580116544,0.5
10,Berapa jumlah mitra industri yang berpartisipasi dalam Program Magang MSIB Batch 5?,saya tidak tahu,"['c. Jumlah penilaian terhadap pelaksanaan MBKM minimal sebanyak 4 (empat).  \nd. Pelaporan terhadap proses dan hasil penilaian dilakukan oleh Dosen pembimbing \nakademik dalam pelaksanaan MBKM.  \ne. Sistem informasi untuk mempermudah pendataan – implementasi MBKM di Pro di. \n \n2.4 Pengendalian  \nPengendalian pelaksanaan MBKM dilakukan oleh Prodi bersama direktorat dan unit \nterkait, mulai dari perencanaan, pelaksanaan dan pelaporan kegiatan MBKM. \nPengendalian dilakukan atas unsur -unsur yang dikawatirkan akan menyimpang, atau \ntidak memenuhi  standar yang telah ditetapkan.  \n \n \n \n 20 Baku Mutu - MBKM   - 2021  \n \n 3 Penutup  \nBaku mutu MBKM yang disusun sesuai dengan SN Dikti dan kebijakan Rektor ITS \nyang berlaku, sebagai rujukan bagi Direktorat terkait dan Prodi di dalam \nmeingimplementasi MBKM, dengan tujuan:  \n(i) Melakukan pengukuran ketercapaian CPL untuk masing -masing bentuk \nMBKM.  \n(ii) Melakukan penilaian dan evaluasi atas proses dan hasil kegiatan MBKM'
 '(v) Bentuk kegiatan pengabdian kepada masyarakat merupakan salah satu bentuk 7 Dokumen Panduan Baku Mutu Pelaksanaan MBKM - 2021  \n NO ELEMEN PENILAIAN  INDIKATOR  \n(1) (2) (3) \nimplementasi MK pengayaan dengan bobot 3 (tiga) sks.  \n \n4 Standar Isi  – Pengakuan bobot \nsks (1) Jumlah sks maksimal yang dapat diambil dalam rangka pelaksanaan kegiatan MB – KM \nadalah 40 (empat puluh) sks.  \n(2) Kegiatan magang/ praktik kerja pada program sarjana terapan diimplementasikan dalam \nbentuk mata kuliah wajib sebagai  mata kuliah penciri Fakultas  Vokasi sebesar 14 (empat \nbelas) sks.  \n(3) Konversi kegiatan MB -KM magang dapat dikonversikan ke dalam: (i) MK KP,  \n(ii) beberapa MK gabungan antara KP dengan MK lain dengan kesamaan CP MK,  \n(iii) MK magang dengan maksimum bobot 20 (dua puluh) sks.   \n(4) Kegiatan MBKM – dalam bentuk pertukaran pelajar melalui MK di prodi di luar ITS, \ndengan ketentuan jumlah sks maksimal adalah 20 (dua puluh) sks, yang meliputi mata'
 'di luar ITS dapat  dikembangkan dan dikoordinasikan oleh Direktorat yang mengurusi \npendidikan bekerjasama dengan Direktorat yang mengurusi pascasarjana dan \npengembangan akademik . \n(5) Direktorat yang mengurusi kegiatan pertukaran pelajar/ kuliah dalam negeri harus 16 Dokumen Panduan Baku Mutu Pelaksanaan MBKM - 2021  \n NO ELEMEN PENILAIAN  INDIKATOR  \n(1) (2) (3) \nberkoordinasi dengan Program Studi terkait . \n Standar Pengelolaan – \nPerencanaan MBKM  1. Prodi mempunyai Dokumen panduan untuk implementasi MBKM / turunan dokumen \nPerek 21 tahun 202 1 yang menjadi konsideran  implementasi MBKM . \n2. Prodi mempunyai kurikulum implementasi MBKM, yang meliputi CPL yang ditetapkan \nsesuai dengan implementasi MBKM dan peta CPL – MK MBKM  \n3.  Prodi mempunyai Dokumen panduan untuk Dosen  Wali dan Dosen Pembimbing dalam \npelaksanaan MBKM   \n4. Prodi mempunyai Dokumen pan duan untuk Mahasiswa dalam perencanaan , \npelaksannaan, penilaian pelaksanaan  MBKM'
 'dan start -up.  \n(iii) Kegiatan MBKM dalam bentuk magang/ praktik kerja dan kegiatan wirausaha hilirisasi \ndikembangkan oleh  Direktorat yang mengurusi inovasi dan kawasan sains teknologi \nbekerjasama dengan Direktorat yang mengurusi kemahasiswaan . \n(iv) Impl ementasi kegiatan MBKM dalam bentuk  magang/ praktik kerja dan kegiatan \nwirausaha hilirisasi dikoordinir oleh Direktorat yang mengurusi  inovasi dan kawasan \nsains teknologi  bersama Prodi terkait, melalui tahapan  kegiatan (a) persiapan, (b) \nPelaksanaan, (c) Evaluasi, (d) Pengendalian, dan (e) Peningkatan   \n \nIV STANDAR PENILAIAN PEMBELAJARAN  \n11 Standar penilaian  (i) Penilaian atas proses dan hasil pelaksanaan MBKM mengacu pada prinsip penilaian.  \n \n 14 Dokumen Panduan Baku Mutu Pelaksanaan MBKM - 2021  \n NO ELEMEN PENILAIAN  INDIKATOR  \n(1) (2) (3) \nDalam hal mahasiswa mendapatkan nilai mata kuliah pengayaan kurang dari C, maka \nmahasiswa dapat menggantinya dengan mata kuliah pengayaan yang berbeda.']",Terdapat 121 mitra industri yang berpartisipasi dalam Program Magang MSIB Batch 5.,0.0,,0.0,0.0
11,Bagaimana cara PK2 mempublikasikan informasi lowongan magang? ,"PK2 dapat mempublikasikan informasi lowongan magang dengan cara mengikuti standar dalam penyelenggaraan MB-KM di ITS. Standar tersebut mengacu pada SN-Dikti, Peraturan Rektor tentang MB-KM, dan panduan yang telah dikeluarkan oleh Direktorat Kemahasiswaan, Direktorat Pendidikan, dan Direktorat Riset dan Pengabdian kepada Masyarakat. Salah satu bentuk kegiatan magang yang dapat dipublikasikan adalah melalui pengabdian kepada masyarakat atau KKN. Kegiatan magang dalam bentuk KKN harus dibawah bimbingan dosen, dilaksanakan pada semester 6 dan 7, dan dapat diakui sebagai tambahan SKS. Selain itu, informasi lowongan magang juga dapat dipublikasikan melalui kegiatan wirausaha yang mendukung pencapaian profil sebagai kader pengusaha yang mendukung perkembangan ITS di masa mendatang. Implementasi kegiatan wirausaha dalam MB-KM dapat dikembangkan oleh Direktorat yang mengurusi Kemahasiswaan.","['2 PRINSIP PPEPP DALAM PENYELENGGARAAN MB -KM \n \nSiklus PPEPP dalam penyelenggaran MB -KM, ditunjukkan di dalam ilustrasi gambar 1.1 di \nbawah ini.  \n \nP: Penetapan   \nP: Pelaksanaan   \nE: Evaluasi  \nP: Pengendalian  \nP: Peningkatan  \n \n \nGambar 2.1 Siklus PPEPP di dalam SPMI  \n \n \n2.1 Penetapan Standar  \nStandar dalam penyelenggaraan MB -KM mengacu pada: (i) SN – Dikti, (ii) Peraturan \nRektor tentang MB -KM, dan (iii) Panduan yang telah dikeluarkan oleh D irektorat \nKemahasiswaan, Direktorat Pendidikan, dan Direktorat Riset dan Pengabdian kepada \nMasyarakat .  \nStandar yang digunakan di dalam penjaminan mutu MB -KM mengacu pada SN Dikti dan \nKebijakan yang telah ditetapkan oleh Rektor ITS yang masih berlaku. Standar tersebut  \ndituliskan di dalam Tabel di bawah ini.  6 Dokumen Panduan Baku Mutu Pelaksanaan MBKM - 2021  \n  \nTabel 2.1 Standar dalam penyelenggaraan MB -KM di   ITS \nNO ELEMEN PENILAIAN  INDIKATOR  \n(1) (2) (3) \nI STANDAR KOMPETENSI LULUSAN'
 'magang sesuai dengan ketentuan yang berlaku;  \n 9 Dokumen Panduan Baku Mutu Pelaksanaan MBKM - 2021  \n NO ELEMEN PENILAIAN  INDIKATOR  \n(1) (2) (3) \n9 Standar Proses –  \nKegiatan MBKM – bentuk \nPengabdian kepada Masyarakat  (i) Kegiatan MBKM dalam bentuk pengabdian kepada masyarakat  atau selanjutnya \ndikategorikan sebagai KKN  ditujukan untuk pembinaan karakter kebangsaan mahasiswa \nkhususnya untuk menumbuhkan kepedulian terhadap persoalan yang dihadapi \nmasyarakat , sebaga i salah satu CPL dalam aspek Sikap .  \n(ii) Kegiatan MBKM dalam bentuk KKN harus dibawah bimbingan dosen . \n(iii) Kegiatan MBKM dalam bentuk KKN dapat diakui sebagai  tambahan sks atau dapat \ndikompensasi dengan mata kuliah Program Studi yang memiliki capaian pembelajaran \nyang setara.  \n(iv) Kegiatan MBKM dalam bentuk KKN dilaksanakan pada semester 6 (enam) dan 7 (tujuh)  \natau sebelum nya dengan syarat telah lulus tahap persiapan.'
 '(v) Bentuk kegiatan pengabdian kepada masyarakat merupakan salah satu bentuk 7 Dokumen Panduan Baku Mutu Pelaksanaan MBKM - 2021  \n NO ELEMEN PENILAIAN  INDIKATOR  \n(1) (2) (3) \nimplementasi MK pengayaan dengan bobot 3 (tiga) sks.  \n \n4 Standar Isi  – Pengakuan bobot \nsks (1) Jumlah sks maksimal yang dapat diambil dalam rangka pelaksanaan kegiatan MB – KM \nadalah 40 (empat puluh) sks.  \n(2) Kegiatan magang/ praktik kerja pada program sarjana terapan diimplementasikan dalam \nbentuk mata kuliah wajib sebagai  mata kuliah penciri Fakultas  Vokasi sebesar 14 (empat \nbelas) sks.  \n(3) Konversi kegiatan MB -KM magang dapat dikonversikan ke dalam: (i) MK KP,  \n(ii) beberapa MK gabungan antara KP dengan MK lain dengan kesamaan CP MK,  \n(iii) MK magang dengan maksimum bobot 20 (dua puluh) sks.   \n(4) Kegiatan MBKM – dalam bentuk pertukaran pelajar melalui MK di prodi di luar ITS, \ndengan ketentuan jumlah sks maksimal adalah 20 (dua puluh) sks, yang meliputi mata'
 'NO ELEMEN PENILAIAN  INDIKATOR  \n(1) (2) (3) \nmengurusi riset dan  pengabdian kepada masyarakat . \n(ix) Implementasi MBKM dalam bentuk penelitian/ riset dikembangkan dan dikoordin ir oleh \nDirektorat yang mengurusi riset dan pengabdian kepada masyarakat  bersama Prodi \nterkait ,  melalui tahapan kegiatan (a) persiapan, (b) Pelaksanaan, (c) Evaluasi, (d) \nPengendalian, dan (e) Peningkatan.  \n \n12 Standar Proses –  \nKegiatan MBKM – bentuk \nKewirausahaan  (i) Kegiatan MBKM dalam bentuk wirausaha  dimaksudkan untuk mendukung pencapaian \nprofil sebagai kader pengusaha yang mendukung perkembangan ITS di masa \nmendatang . \n(ii) Kegiatan MBKM dalam bentuk wirausaha  dapat dikonversi ke dalam sks MK sesuai \ndengan ketercapaian CPL atau bentuk lain  \n(iii) Kegiatan MBKM da lam bentuk wirausaha  dikembangkan oleh Direktorat yang \nmengurusi Kemahasiswaan.  \n(x) Implementasi  Kegiatan MBKM dalam bentuk wirausaha  dikoordinir oleh Direktorat']","PK2 mempublikasikan informasi lowongan magang melalui sosial media, serta menyebarkan informasi ke LO MBKM dan Kepala Departemen.",0.99999999995,1.0,0.9844322325423803,0.0
12,Apa yang dilakukan oleh mahasiswa setelah selesai melaksanakan magang MSIB?,"Setelah selesai melaksanakan magang MSIB, mahasiswa dapat melakukan kegiatan praktek/kolaborasi riset/kerja sama pengembangan industri/bentuk kegiatan lain yang selaras dengan CPL. Selain itu, mahasiswa wajib dibimbing oleh pembimbing internal dari dosen ITS dan pembimbing eksternal dari pihak instansi/lembaga/industri tempat magang. Mahasiswa juga dapat melakukan kegiatan akademik lain dengan syarat telah mendapatkan izin dari pihak penanggung jawab lembaga/badan/industri magang. Mahasiswa tidak harus cuti studi saat melaksanakan magang dan dapat diberikan surat keterangan hasil kegiatan magang/sertifikat kompetensi dari lembaga/badan/industri tempat magang sesuai dengan ketentuan yang berlaku.","['sesuai dengan kesepakata n tempat magang;  \n(ii) Mahasiswa yang melaksanakan magang dapat melakukan kegiatan praktek / kolaborasi \nriset / kerja sama pengembangan industri / bentu k kegiatan  lain  yang selaras dengan \nCPL’   \n(iii) Mahasiswa yang melaksanakan magang wajib  dibimbing oleh pembimbing internal dari \ndosen ITS dan  pembimbing eksternal dari pihak  instansi / lembaga /  industri  tempat \nmagang ;  \n(iv) Mahasiswa yang melaksanakan magang dapat melakukan kegiatan akademik yang lain \ndengan syarat telah mendapatkan ijin dari pihak penanggung jawab lembaga / badan / \nindustri magang ;  \n(v) Mahasiswa pada waktu melaksanaan magang  tidak harus cuti  studi ;  \n(vi) Mahasiswa yang melaksa nakan magang dapat diberi  memberikan surat keterangan \nhasil kegiatan magang / sertifikat kompetensi  dari lembaga / badan / industri letak \nmagang sesuai dengan ketentuan yang berlaku;  \n 9 Dokumen Panduan Baku Mutu Pelaksanaan MBKM - 2021  \n NO ELEMEN PENILAIAN  INDIKATOR  \n(1) (2) (3)'
 '(4) Kegiatan MBKM – dalam bentuk pertukaran pelajar melalui MK di prodi di luar ITS, \ndengan ketentuan jumlah sks maksimal adalah 20 (dua puluh) sks, yang meliputi mata \nkuliah inti dan mata kuliah non inti.  \nIII STANDAR PROSES PEMBELAJARAN  \n5 Standar Proses –bentuk \npembelajaran MBKM  (i) Mahasiswa dapat melaksanakan kegiatan pembelajaran MBKM dalam rangka meraih CPL \nProdi dalam bentuk satu atau lebih bentuk berikut ini:  \na. Magang/ Praktik Kerja;  \nb. Membangun Desa/ Kuliah Kerja Nyata Tematik;  \nc. Pertukaran Pelajar;  \nd. Proyek Kemanusiaan;  \ne. Penelitian/ Riset;  \nf. Kegiatan Wirausaha;  \ng. Studi/ Proyek Independen; dan  \nh. Asistensi Mengajar di Satuan Pendidikan  \n(ii)  Pelaksanaan MB -KM bentuk (a) sd (h) dapat dilaksanakan dalam bentuk  online, offline 8 Dokumen Panduan Baku Mutu Pelaksanaan MBKM - 2021  \n NO ELEMEN PENILAIAN  INDIKATOR  \n(1) (2) (3) \natau kombinasi keduanya  \n6 Standar Proses – Tempat'
 '(v) Bentuk kegiatan pengabdian kepada masyarakat merupakan salah satu bentuk 7 Dokumen Panduan Baku Mutu Pelaksanaan MBKM - 2021  \n NO ELEMEN PENILAIAN  INDIKATOR  \n(1) (2) (3) \nimplementasi MK pengayaan dengan bobot 3 (tiga) sks.  \n \n4 Standar Isi  – Pengakuan bobot \nsks (1) Jumlah sks maksimal yang dapat diambil dalam rangka pelaksanaan kegiatan MB – KM \nadalah 40 (empat puluh) sks.  \n(2) Kegiatan magang/ praktik kerja pada program sarjana terapan diimplementasikan dalam \nbentuk mata kuliah wajib sebagai  mata kuliah penciri Fakultas  Vokasi sebesar 14 (empat \nbelas) sks.  \n(3) Konversi kegiatan MB -KM magang dapat dikonversikan ke dalam: (i) MK KP,  \n(ii) beberapa MK gabungan antara KP dengan MK lain dengan kesamaan CP MK,  \n(iii) MK magang dengan maksimum bobot 20 (dua puluh) sks.   \n(4) Kegiatan MBKM – dalam bentuk pertukaran pelajar melalui MK di prodi di luar ITS, \ndengan ketentuan jumlah sks maksimal adalah 20 (dua puluh) sks, yang meliputi mata'
 '(1) (2) (3) \nDalam hal mahasiswa mendapatkan nilai mata kuliah pengayaan kurang dari C, maka \nmahasiswa dapat menggantinya dengan mata kuliah pengayaan yang berbeda.  \nV STANDAR DOSEN DAN TENDIK  \n12 Standar dosen dan Tendik  (i) Dosen wali ditugaskan oleh Prodi untuk membuat perencanaan bersama dengan \nmahasiswa yang akan melaksanakan kegatan MBKM  \n(ii) Dosen wali ditugaskan oleh Prodi untuk melakukan evaluasi terhadap kesesuaian \nbentuk dan lama pelaksanaan MBKM sesuai dengan CPL  \n(iii) Dosen wali di tugaskan oleh Prodi untuk melakukan penilaian atas rencana, \npelaksanaan dan evaluasi MBKM  \n(iv) Dosen pembimbing MBKM ditugaskan oleh Prodi sesuai dengan pengampu MK \nkonversi dan atau dosen wali  \n(v) Tendik Prodi ditugaskan untuk melayani administrasi dalam implement asi MBKM, \nmulai dari perencanaan, pelaksanaan, moneitoring dan evaluasi, serta pelaporan \nMBKM.  \n \nVI STANDAR PENGELOLAAN PEMBELAJARAN']","Setelah selesai melaksanakan magang MSIB, mahasiswa membuat laporan akhir, mengunggah kelengkapan berkas di website kampus merdeka dan SIM Magang, serta pihak departemen melakukan verifikasi laporan akhir di SIM Magang.",0.999999999975,1.0,0.9785187806406074,0.0
13,Apa tujuan dilakukannya digitalisasi proses pendaftaran seperti SPTJM dan SR?,"Tujuan dilakukannya digitalisasi proses pendaftaran seperti SPTJM dan SR adalah untuk mempermudah dan mempercepat proses administrasi serta pengelolaan data terkait kegiatan pengabdian kepada masyarakat. Dengan digitalisasi, diharapkan proses pendaftaran dapat dilakukan secara efisien, transparan, dan akurat sehingga memudahkan koordinasi dan monitoring pelaksanaan kegiatan pengabdian kepada masyarakat.","['(v) Bentuk kegiatan pengabdian kepada masyarakat merupakan salah satu bentuk 7 Dokumen Panduan Baku Mutu Pelaksanaan MBKM - 2021  \n NO ELEMEN PENILAIAN  INDIKATOR  \n(1) (2) (3) \nimplementasi MK pengayaan dengan bobot 3 (tiga) sks.  \n \n4 Standar Isi  – Pengakuan bobot \nsks (1) Jumlah sks maksimal yang dapat diambil dalam rangka pelaksanaan kegiatan MB – KM \nadalah 40 (empat puluh) sks.  \n(2) Kegiatan magang/ praktik kerja pada program sarjana terapan diimplementasikan dalam \nbentuk mata kuliah wajib sebagai  mata kuliah penciri Fakultas  Vokasi sebesar 14 (empat \nbelas) sks.  \n(3) Konversi kegiatan MB -KM magang dapat dikonversikan ke dalam: (i) MK KP,  \n(ii) beberapa MK gabungan antara KP dengan MK lain dengan kesamaan CP MK,  \n(iii) MK magang dengan maksimum bobot 20 (dua puluh) sks.   \n(4) Kegiatan MBKM – dalam bentuk pertukaran pelajar melalui MK di prodi di luar ITS, \ndengan ketentuan jumlah sks maksimal adalah 20 (dua puluh) sks, yang meliputi mata'
 'b. Manual pelaksanaan standar  \nc. Manual evaluasi standar  \nd. Manual pengendalian pelaksnanaan standar  \ne. Manual peningkatan standar  \n3. Rincian tentang hal yang harus dikerjakan  \n4. Pihak yang bertanggung jawab mengerjakan sesuatu  \n5. Uraian tentang pekerjaan yang harus dilaksanakan sesuai manual  \n6. Uraian tentang bagaimana pekerjaan itu harus dilaksanakan  \n7. Rincian formulir / borang / proforma yang harus dibuat dan digunakan sebagai \nbagian dari manual MBKM  \n8. Rincian sarana yang digunakan sesuai petunjuk dalam manual  \n \n 19 Dokumen Panduan Baku Mutu Pelaksanaan MBKM - 2021  \n 2.3 Evaluasi  MBKM  \nEvaluasi MBKM dilakukan oleh organ mutu di masing -masing pelaksana MBKM, dalam \nwaktu setiap semester minimal 1 (satu) kali. Evaluasi dilakukan terhadap:  \na. Perencanaan bentuk MB KM, yang direncanakan oleh mahasiswa bersama dosen \nwali. Perencanaan terhadap unsur: (i) Waktu dan lama waktu pelaksanaan MBKM,'
 'di luar ITS dapat  dikembangkan dan dikoordinasikan oleh Direktorat yang mengurusi \npendidikan bekerjasama dengan Direktorat yang mengurusi pascasarjana dan \npengembangan akademik . \n(5) Direktorat yang mengurusi kegiatan pertukaran pelajar/ kuliah dalam negeri harus 16 Dokumen Panduan Baku Mutu Pelaksanaan MBKM - 2021  \n NO ELEMEN PENILAIAN  INDIKATOR  \n(1) (2) (3) \nberkoordinasi dengan Program Studi terkait . \n Standar Pengelolaan – \nPerencanaan MBKM  1. Prodi mempunyai Dokumen panduan untuk implementasi MBKM / turunan dokumen \nPerek 21 tahun 202 1 yang menjadi konsideran  implementasi MBKM . \n2. Prodi mempunyai kurikulum implementasi MBKM, yang meliputi CPL yang ditetapkan \nsesuai dengan implementasi MBKM dan peta CPL – MK MBKM  \n3.  Prodi mempunyai Dokumen panduan untuk Dosen  Wali dan Dosen Pembimbing dalam \npelaksanaan MBKM   \n4. Prodi mempunyai Dokumen pan duan untuk Mahasiswa dalam perencanaan , \npelaksannaan, penilaian pelaksanaan  MBKM'
 'dan start -up.  \n(iii) Kegiatan MBKM dalam bentuk magang/ praktik kerja dan kegiatan wirausaha hilirisasi \ndikembangkan oleh  Direktorat yang mengurusi inovasi dan kawasan sains teknologi \nbekerjasama dengan Direktorat yang mengurusi kemahasiswaan . \n(iv) Impl ementasi kegiatan MBKM dalam bentuk  magang/ praktik kerja dan kegiatan \nwirausaha hilirisasi dikoordinir oleh Direktorat yang mengurusi  inovasi dan kawasan \nsains teknologi  bersama Prodi terkait, melalui tahapan  kegiatan (a) persiapan, (b) \nPelaksanaan, (c) Evaluasi, (d) Pengendalian, dan (e) Peningkatan   \n \nIV STANDAR PENILAIAN PEMBELAJARAN  \n11 Standar penilaian  (i) Penilaian atas proses dan hasil pelaksanaan MBKM mengacu pada prinsip penilaian.  \n \n 14 Dokumen Panduan Baku Mutu Pelaksanaan MBKM - 2021  \n NO ELEMEN PENILAIAN  INDIKATOR  \n(1) (2) (3) \nDalam hal mahasiswa mendapatkan nilai mata kuliah pengayaan kurang dari C, maka \nmahasiswa dapat menggantinya dengan mata kuliah pengayaan yang berbeda.']","Tujuan digitalisasi proses pendaftaran adalah untuk mempermudah proses verifikasi data, meningkatkan efisiensi, dan memastikan keamanan serta keakuratan data mahasiswa.",0.0,0.5714285714285714,1.0000000000000009,0.0
14,Apa itu SIM Magang dan apa fungsinya?,"SIM Magang adalah Sistem Informasi Magang yang digunakan dalam penyelenggaraan Magang Berbasis Kompetensi (MB-KM) di ITS. SIM Magang berfungsi sebagai platform untuk mengelola dan memantau kegiatan magang mahasiswa, termasuk pengaturan jadwal, penugasan, evaluasi, dan pelaporan hasil magang. SIM Magang juga dapat digunakan untuk memudahkan koordinasi antara mahasiswa, dosen pembimbing, dan pihak perusahaan atau lembaga tempat magang dilaksanakan.","['Tabel 2.1 Standar dalam penyelenggaraan MB -KM di   ITS \nNO ELEMEN PENILAIAN  INDIKATOR  \n(1) (2) (3) \nI STANDAR KOMPETENSI LULUSAN  \n1 Standar Kompetensi Lulusan  (i) Pelaksanaan MBKM mengacu pada CPL Prodi sebagai target dari kemampuan lulusan, \ndengan minimal pencapaian 80%  CPL dan atau sebagai kompetensi tambahan  \n(ii) Kompetensi tambahan dimaksudkan untuk memperlancar karir lulusan, kolaborasi riset \ndan atau kerja sama p engembangan industri.  \nII STANDAR ISI PEMBELAJARAN  \n2 Standar Isi  – MK Pengayaan  (i) Prodi menyediakan kurikulum untuk pelaksanaan MBKM yang disusun bersama \npemangku kepentingan internal dan eksternal, serta direview oleh pakar bidang ilmu \nprogram studi nya.  \n(ii) Keterjaminan pemenuhan CPL  melalui MBKM ( ketersediaan matrik / peta CPL - MK \nMBKM ), dan ketersediaan modul MK melalui pembelajaran  untuk MK yang \ndilaksanakan secara MBKM'
 '2 PRINSIP PPEPP DALAM PENYELENGGARAAN MB -KM \n \nSiklus PPEPP dalam penyelenggaran MB -KM, ditunjukkan di dalam ilustrasi gambar 1.1 di \nbawah ini.  \n \nP: Penetapan   \nP: Pelaksanaan   \nE: Evaluasi  \nP: Pengendalian  \nP: Peningkatan  \n \n \nGambar 2.1 Siklus PPEPP di dalam SPMI  \n \n \n2.1 Penetapan Standar  \nStandar dalam penyelenggaraan MB -KM mengacu pada: (i) SN – Dikti, (ii) Peraturan \nRektor tentang MB -KM, dan (iii) Panduan yang telah dikeluarkan oleh D irektorat \nKemahasiswaan, Direktorat Pendidikan, dan Direktorat Riset dan Pengabdian kepada \nMasyarakat .  \nStandar yang digunakan di dalam penjaminan mutu MB -KM mengacu pada SN Dikti dan \nKebijakan yang telah ditetapkan oleh Rektor ITS yang masih berlaku. Standar tersebut  \ndituliskan di dalam Tabel di bawah ini.  6 Dokumen Panduan Baku Mutu Pelaksanaan MBKM - 2021  \n  \nTabel 2.1 Standar dalam penyelenggaraan MB -KM di   ITS \nNO ELEMEN PENILAIAN  INDIKATOR  \n(1) (2) (3) \nI STANDAR KOMPETENSI LULUSAN'
 '(v) Bentuk kegiatan pengabdian kepada masyarakat merupakan salah satu bentuk 7 Dokumen Panduan Baku Mutu Pelaksanaan MBKM - 2021  \n NO ELEMEN PENILAIAN  INDIKATOR  \n(1) (2) (3) \nimplementasi MK pengayaan dengan bobot 3 (tiga) sks.  \n \n4 Standar Isi  – Pengakuan bobot \nsks (1) Jumlah sks maksimal yang dapat diambil dalam rangka pelaksanaan kegiatan MB – KM \nadalah 40 (empat puluh) sks.  \n(2) Kegiatan magang/ praktik kerja pada program sarjana terapan diimplementasikan dalam \nbentuk mata kuliah wajib sebagai  mata kuliah penciri Fakultas  Vokasi sebesar 14 (empat \nbelas) sks.  \n(3) Konversi kegiatan MB -KM magang dapat dikonversikan ke dalam: (i) MK KP,  \n(ii) beberapa MK gabungan antara KP dengan MK lain dengan kesamaan CP MK,  \n(iii) MK magang dengan maksimum bobot 20 (dua puluh) sks.   \n(4) Kegiatan MBKM – dalam bentuk pertukaran pelajar melalui MK di prodi di luar ITS, \ndengan ketentuan jumlah sks maksimal adalah 20 (dua puluh) sks, yang meliputi mata'
 'b. Manual pelaksanaan standar  \nc. Manual evaluasi standar  \nd. Manual pengendalian pelaksnanaan standar  \ne. Manual peningkatan standar  \n3. Rincian tentang hal yang harus dikerjakan  \n4. Pihak yang bertanggung jawab mengerjakan sesuatu  \n5. Uraian tentang pekerjaan yang harus dilaksanakan sesuai manual  \n6. Uraian tentang bagaimana pekerjaan itu harus dilaksanakan  \n7. Rincian formulir / borang / proforma yang harus dibuat dan digunakan sebagai \nbagian dari manual MBKM  \n8. Rincian sarana yang digunakan sesuai petunjuk dalam manual  \n \n 19 Dokumen Panduan Baku Mutu Pelaksanaan MBKM - 2021  \n 2.3 Evaluasi  MBKM  \nEvaluasi MBKM dilakukan oleh organ mutu di masing -masing pelaksana MBKM, dalam \nwaktu setiap semester minimal 1 (satu) kali. Evaluasi dilakukan terhadap:  \na. Perencanaan bentuk MB KM, yang direncanakan oleh mahasiswa bersama dosen \nwali. Perencanaan terhadap unsur: (i) Waktu dan lama waktu pelaksanaan MBKM,']","SIM Magang adalah sistem informasi yang digunakan untuk mengelola pendaftaran, pelaksanaan, dan pelaporan program magang. Fungsinya termasuk mengunggah berkas magang, pengecekan data, serta monitoring kegiatan magang mahasiswa.",0.0,0.8571428571428571,0.9633828306420522,0.0
15,Apa yang harus dipersiapkan mahasiswa sebelum mendaftar program magang?,"Sebelum mendaftar program magang, mahasiswa harus mempersiapkan beberapa hal berikut:
1. Kesepakatan mengenai tempat magang.
2. Kemampuan untuk melakukan kegiatan praktek, kolaborasi riset, kerja sama pengembangan industri, atau kegiatan lain yang selaras dengan Capaian Pembelajaran Lulusan (CPL).
3. Pembimbing internal dari dosen ITS dan pembimbing eksternal dari pihak instansi/lembaga/industri tempat magang.
4. Izin dari pihak penanggung jawab lembaga/badan/industri magang untuk melakukan kegiatan akademik lain.
5. Tidak perlu cuti studi saat melaksanakan magang.
6. Kemungkinan untuk mendapatkan surat keterangan hasil kegiatan magang atau sertifikat kompetensi dari lembaga/badan/industri tempat magang sesuai dengan ketentuan yang berlaku.","['sesuai dengan kesepakata n tempat magang;  \n(ii) Mahasiswa yang melaksanakan magang dapat melakukan kegiatan praktek / kolaborasi \nriset / kerja sama pengembangan industri / bentu k kegiatan  lain  yang selaras dengan \nCPL’   \n(iii) Mahasiswa yang melaksanakan magang wajib  dibimbing oleh pembimbing internal dari \ndosen ITS dan  pembimbing eksternal dari pihak  instansi / lembaga /  industri  tempat \nmagang ;  \n(iv) Mahasiswa yang melaksanakan magang dapat melakukan kegiatan akademik yang lain \ndengan syarat telah mendapatkan ijin dari pihak penanggung jawab lembaga / badan / \nindustri magang ;  \n(v) Mahasiswa pada waktu melaksanaan magang  tidak harus cuti  studi ;  \n(vi) Mahasiswa yang melaksa nakan magang dapat diberi  memberikan surat keterangan \nhasil kegiatan magang / sertifikat kompetensi  dari lembaga / badan / industri letak \nmagang sesuai dengan ketentuan yang berlaku;  \n 9 Dokumen Panduan Baku Mutu Pelaksanaan MBKM - 2021  \n NO ELEMEN PENILAIAN  INDIKATOR  \n(1) (2) (3)'
 'di luar ITS dapat  dikembangkan dan dikoordinasikan oleh Direktorat yang mengurusi \npendidikan bekerjasama dengan Direktorat yang mengurusi pascasarjana dan \npengembangan akademik . \n(5) Direktorat yang mengurusi kegiatan pertukaran pelajar/ kuliah dalam negeri harus 16 Dokumen Panduan Baku Mutu Pelaksanaan MBKM - 2021  \n NO ELEMEN PENILAIAN  INDIKATOR  \n(1) (2) (3) \nberkoordinasi dengan Program Studi terkait . \n Standar Pengelolaan – \nPerencanaan MBKM  1. Prodi mempunyai Dokumen panduan untuk implementasi MBKM / turunan dokumen \nPerek 21 tahun 202 1 yang menjadi konsideran  implementasi MBKM . \n2. Prodi mempunyai kurikulum implementasi MBKM, yang meliputi CPL yang ditetapkan \nsesuai dengan implementasi MBKM dan peta CPL – MK MBKM  \n3.  Prodi mempunyai Dokumen panduan untuk Dosen  Wali dan Dosen Pembimbing dalam \npelaksanaan MBKM   \n4. Prodi mempunyai Dokumen pan duan untuk Mahasiswa dalam perencanaan , \npelaksannaan, penilaian pelaksanaan  MBKM'
 '(v) Bentuk kegiatan pengabdian kepada masyarakat merupakan salah satu bentuk 7 Dokumen Panduan Baku Mutu Pelaksanaan MBKM - 2021  \n NO ELEMEN PENILAIAN  INDIKATOR  \n(1) (2) (3) \nimplementasi MK pengayaan dengan bobot 3 (tiga) sks.  \n \n4 Standar Isi  – Pengakuan bobot \nsks (1) Jumlah sks maksimal yang dapat diambil dalam rangka pelaksanaan kegiatan MB – KM \nadalah 40 (empat puluh) sks.  \n(2) Kegiatan magang/ praktik kerja pada program sarjana terapan diimplementasikan dalam \nbentuk mata kuliah wajib sebagai  mata kuliah penciri Fakultas  Vokasi sebesar 14 (empat \nbelas) sks.  \n(3) Konversi kegiatan MB -KM magang dapat dikonversikan ke dalam: (i) MK KP,  \n(ii) beberapa MK gabungan antara KP dengan MK lain dengan kesamaan CP MK,  \n(iii) MK magang dengan maksimum bobot 20 (dua puluh) sks.   \n(4) Kegiatan MBKM – dalam bentuk pertukaran pelajar melalui MK di prodi di luar ITS, \ndengan ketentuan jumlah sks maksimal adalah 20 (dua puluh) sks, yang meliputi mata'
 '(4) Kegiatan MBKM – dalam bentuk pertukaran pelajar melalui MK di prodi di luar ITS, \ndengan ketentuan jumlah sks maksimal adalah 20 (dua puluh) sks, yang meliputi mata \nkuliah inti dan mata kuliah non inti.  \nIII STANDAR PROSES PEMBELAJARAN  \n5 Standar Proses –bentuk \npembelajaran MBKM  (i) Mahasiswa dapat melaksanakan kegiatan pembelajaran MBKM dalam rangka meraih CPL \nProdi dalam bentuk satu atau lebih bentuk berikut ini:  \na. Magang/ Praktik Kerja;  \nb. Membangun Desa/ Kuliah Kerja Nyata Tematik;  \nc. Pertukaran Pelajar;  \nd. Proyek Kemanusiaan;  \ne. Penelitian/ Riset;  \nf. Kegiatan Wirausaha;  \ng. Studi/ Proyek Independen; dan  \nh. Asistensi Mengajar di Satuan Pendidikan  \n(ii)  Pelaksanaan MB -KM bentuk (a) sd (h) dapat dilaksanakan dalam bentuk  online, offline 8 Dokumen Panduan Baku Mutu Pelaksanaan MBKM - 2021  \n NO ELEMEN PENILAIAN  INDIKATOR  \n(1) (2) (3) \natau kombinasi keduanya  \n6 Standar Proses – Tempat']","Mahasiswa harus memastikan data diri sudah sesuai dengan PDDIKTI, mendapatkan surat rekomendasi dari perguruan tinggi, surat keterangan sehat, sertifikat prestasi (jika ada), surat persetujuan orang tua/wali, dan surat pakta integritas.",0.999999999975,1.0,1.0,0.0
16,Apa yang dilakukan PK2 dalam monitoring pelaksanaan program magang? ,"PK2 melakukan monitoring pelaksanaan program magang dengan melakukan pengendalian proses implementasi MBKM, melakukan penilaian dan evaluasi atas proses dan hasil kegiatan MBKM, serta melakukan peningkatan implementasi MBKM berdasarkan hasil survey kepuasan pihak internal dan eksternal stakeholder yang terlibat dalam implementasi MBKM. Selain itu, PK2 juga melakukan pengendalian pelaksanaan program magang bersama direktorat dan unit terkait, mulai dari perencanaan, pelaksanaan, hingga pelaporan kegiatan magang.","['2 PRINSIP PPEPP DALAM PENYELENGGARAAN MB -KM \n \nSiklus PPEPP dalam penyelenggaran MB -KM, ditunjukkan di dalam ilustrasi gambar 1.1 di \nbawah ini.  \n \nP: Penetapan   \nP: Pelaksanaan   \nE: Evaluasi  \nP: Pengendalian  \nP: Peningkatan  \n \n \nGambar 2.1 Siklus PPEPP di dalam SPMI  \n \n \n2.1 Penetapan Standar  \nStandar dalam penyelenggaraan MB -KM mengacu pada: (i) SN – Dikti, (ii) Peraturan \nRektor tentang MB -KM, dan (iii) Panduan yang telah dikeluarkan oleh D irektorat \nKemahasiswaan, Direktorat Pendidikan, dan Direktorat Riset dan Pengabdian kepada \nMasyarakat .  \nStandar yang digunakan di dalam penjaminan mutu MB -KM mengacu pada SN Dikti dan \nKebijakan yang telah ditetapkan oleh Rektor ITS yang masih berlaku. Standar tersebut  \ndituliskan di dalam Tabel di bawah ini.  6 Dokumen Panduan Baku Mutu Pelaksanaan MBKM - 2021  \n  \nTabel 2.1 Standar dalam penyelenggaraan MB -KM di   ITS \nNO ELEMEN PENILAIAN  INDIKATOR  \n(1) (2) (3) \nI STANDAR KOMPETENSI LULUSAN'
 'meingimplementasi MBKM, dengan tujuan:  \n(i) Melakukan pengukuran ketercapaian CPL untuk masing -masing bentuk \nMBKM.  \n(ii) Melakukan penilaian dan evaluasi atas proses dan hasil kegiatan MBKM  \n(iii) Melakukan pengendalian proses implementasi MBKM  \n(iv) Melakukan peningkatan impleme ntasi MBKM, atas hasil survey kepuasan \npihak internal dan eksternal stakeholder yang terlibat di dalam implementasi \nMBKM.    \n \n \n \n 21 Baku Mutu - MBKM   - 2021'
 'c. Jumlah penilaian terhadap pelaksanaan MBKM minimal sebanyak 4 (empat).  \nd. Pelaporan terhadap proses dan hasil penilaian dilakukan oleh Dosen pembimbing \nakademik dalam pelaksanaan MBKM.  \ne. Sistem informasi untuk mempermudah pendataan – implementasi MBKM di Pro di. \n \n2.4 Pengendalian  \nPengendalian pelaksanaan MBKM dilakukan oleh Prodi bersama direktorat dan unit \nterkait, mulai dari perencanaan, pelaksanaan dan pelaporan kegiatan MBKM. \nPengendalian dilakukan atas unsur -unsur yang dikawatirkan akan menyimpang, atau \ntidak memenuhi  standar yang telah ditetapkan.  \n \n \n \n 20 Baku Mutu - MBKM   - 2021  \n \n 3 Penutup  \nBaku mutu MBKM yang disusun sesuai dengan SN Dikti dan kebijakan Rektor ITS \nyang berlaku, sebagai rujukan bagi Direktorat terkait dan Prodi di dalam \nmeingimplementasi MBKM, dengan tujuan:  \n(i) Melakukan pengukuran ketercapaian CPL untuk masing -masing bentuk \nMBKM.  \n(ii) Melakukan penilaian dan evaluasi atas proses dan hasil kegiatan MBKM'
 'NO ELEMEN PENILAIAN  INDIKATOR  \n(1) (2) (3) \nmengurusi riset dan  pengabdian kepada masyarakat . \n(ix) Implementasi MBKM dalam bentuk penelitian/ riset dikembangkan dan dikoordin ir oleh \nDirektorat yang mengurusi riset dan pengabdian kepada masyarakat  bersama Prodi \nterkait ,  melalui tahapan kegiatan (a) persiapan, (b) Pelaksanaan, (c) Evaluasi, (d) \nPengendalian, dan (e) Peningkatan.  \n \n12 Standar Proses –  \nKegiatan MBKM – bentuk \nKewirausahaan  (i) Kegiatan MBKM dalam bentuk wirausaha  dimaksudkan untuk mendukung pencapaian \nprofil sebagai kader pengusaha yang mendukung perkembangan ITS di masa \nmendatang . \n(ii) Kegiatan MBKM dalam bentuk wirausaha  dapat dikonversi ke dalam sks MK sesuai \ndengan ketercapaian CPL atau bentuk lain  \n(iii) Kegiatan MBKM da lam bentuk wirausaha  dikembangkan oleh Direktorat yang \nmengurusi Kemahasiswaan.  \n(x) Implementasi  Kegiatan MBKM dalam bentuk wirausaha  dikoordinir oleh Direktorat']","PK2 melakukan monitoring terhadap pengisian SIM Magang oleh mahasiswa, melakukan monitoring dan evaluasi secara berkala, dan memastikan mahasiswa mengunggah logbook mingguan di website kampus merdeka dan SIM Magang.",0.999999999975,0.0,0.9919275024405719,0.0
17,Bagaimana proses seleksi administrasi untuk program magang kerjasama di ITS?,"Proses seleksi administrasi untuk program magang kerjasama di ITS meliputi beberapa tahapan, antara lain:

1. Perjanjian kerjasama antara ITS dengan instansi/lembaga/industri tempat magang harus sudah terjalin.
2. Kegiatan Magang Berbasis Kampus-Masyarakat (MB-KM) hanya dapat dilaksanakan dengan perguruan tinggi yang memiliki peringkat setara atau lebih tinggi dari ITS, perguruan tinggi yang memiliki MoU dengan ITS, atau lembaga non-perguruan tinggi yang memiliki MoU dengan ITS.
3. Kegiatan MB-KM dalam bentuk kuliah dapat dilakukan di Program Studi yang memiliki nilai akreditasi minimal dengan Program Studi asal di ITS.
4. Kegiatan MB-KM dapat dialih kreditkan menjadi sks MK Prodi melalui mekanisme pemeriksaan kesesuaian dengan CPL.
5. Pemeriksaan kesesuaian CPL dilakukan oleh Prodi atau Direktorat bersama tim pelaksana transfer kredit.
6. Mekanisme dalam transfer kredit dapat dikembangkan oleh Prodi dan dikordinasikan dengan Direktorat terkait.

Demikianlah proses seleksi administrasi untuk program magang kerjasama di ITS berdasarkan konteks yang diberikan.","['NO ELEMEN PENILAIAN  INDIKATOR  \n(1) (2) (3) \nperjanjian kerjasama antar ITS dengan  instansi / lembaga / i ndustri tempat magang  \n(vii) Kegiatan MB -KM hanya bisa dilaksanakan dengan: a. Perguruan tinggi yang \nmempunyai rangking setara atau lebih tinggi dari ITS, b. Perguruan tinggi yang \nmempunyai MoU dengan ITS; atau c. Lembaga non perguruan ting gi yang mempunyai \nMoU dengan ITS.  \n(viii) Kegiatan MB -KM dalam bentuk kuliah dapat dilakukan di Prodi yang mempunyai nilai \nakreditasi minimal dengan Prodi asal di ITS  \n(ix) Kegiatan MB -KM dapat di alih kreditkan menjadi sks MK Prodi, melalui mekanisme \npemeriksaan kese suaian dengan CPL  \n(x) Pemeriksa kesesuaian CPL dilakukan oleh Prodi atau Direktorat bersama tim pelaksana \ntransfer kredit  \n(xi) Mekanisme dalam transfer kredit dapat dikembangkan oleh Prodi dan dikoordinasikan \ndengan Direktorat terkait.  \n7 Standar pengolaan – tempat'
 'di luar ITS dapat  dikembangkan dan dikoordinasikan oleh Direktorat yang mengurusi \npendidikan bekerjasama dengan Direktorat yang mengurusi pascasarjana dan \npengembangan akademik . \n(5) Direktorat yang mengurusi kegiatan pertukaran pelajar/ kuliah dalam negeri harus 16 Dokumen Panduan Baku Mutu Pelaksanaan MBKM - 2021  \n NO ELEMEN PENILAIAN  INDIKATOR  \n(1) (2) (3) \nberkoordinasi dengan Program Studi terkait . \n Standar Pengelolaan – \nPerencanaan MBKM  1. Prodi mempunyai Dokumen panduan untuk implementasi MBKM / turunan dokumen \nPerek 21 tahun 202 1 yang menjadi konsideran  implementasi MBKM . \n2. Prodi mempunyai kurikulum implementasi MBKM, yang meliputi CPL yang ditetapkan \nsesuai dengan implementasi MBKM dan peta CPL – MK MBKM  \n3.  Prodi mempunyai Dokumen panduan untuk Dosen  Wali dan Dosen Pembimbing dalam \npelaksanaan MBKM   \n4. Prodi mempunyai Dokumen pan duan untuk Mahasiswa dalam perencanaan , \npelaksannaan, penilaian pelaksanaan  MBKM'
 'sesuai dengan kesepakata n tempat magang;  \n(ii) Mahasiswa yang melaksanakan magang dapat melakukan kegiatan praktek / kolaborasi \nriset / kerja sama pengembangan industri / bentu k kegiatan  lain  yang selaras dengan \nCPL’   \n(iii) Mahasiswa yang melaksanakan magang wajib  dibimbing oleh pembimbing internal dari \ndosen ITS dan  pembimbing eksternal dari pihak  instansi / lembaga /  industri  tempat \nmagang ;  \n(iv) Mahasiswa yang melaksanakan magang dapat melakukan kegiatan akademik yang lain \ndengan syarat telah mendapatkan ijin dari pihak penanggung jawab lembaga / badan / \nindustri magang ;  \n(v) Mahasiswa pada waktu melaksanaan magang  tidak harus cuti  studi ;  \n(vi) Mahasiswa yang melaksa nakan magang dapat diberi  memberikan surat keterangan \nhasil kegiatan magang / sertifikat kompetensi  dari lembaga / badan / industri letak \nmagang sesuai dengan ketentuan yang berlaku;  \n 9 Dokumen Panduan Baku Mutu Pelaksanaan MBKM - 2021  \n NO ELEMEN PENILAIAN  INDIKATOR  \n(1) (2) (3)'
 'dan start -up.  \n(iii) Kegiatan MBKM dalam bentuk magang/ praktik kerja dan kegiatan wirausaha hilirisasi \ndikembangkan oleh  Direktorat yang mengurusi inovasi dan kawasan sains teknologi \nbekerjasama dengan Direktorat yang mengurusi kemahasiswaan . \n(iv) Impl ementasi kegiatan MBKM dalam bentuk  magang/ praktik kerja dan kegiatan \nwirausaha hilirisasi dikoordinir oleh Direktorat yang mengurusi  inovasi dan kawasan \nsains teknologi  bersama Prodi terkait, melalui tahapan  kegiatan (a) persiapan, (b) \nPelaksanaan, (c) Evaluasi, (d) Pengendalian, dan (e) Peningkatan   \n \nIV STANDAR PENILAIAN PEMBELAJARAN  \n11 Standar penilaian  (i) Penilaian atas proses dan hasil pelaksanaan MBKM mengacu pada prinsip penilaian.  \n \n 14 Dokumen Panduan Baku Mutu Pelaksanaan MBKM - 2021  \n NO ELEMEN PENILAIAN  INDIKATOR  \n(1) (2) (3) \nDalam hal mahasiswa mendapatkan nilai mata kuliah pengayaan kurang dari C, maka \nmahasiswa dapat menggantinya dengan mata kuliah pengayaan yang berbeda.']","Mahasiswa mendaftar dan mengumpulkan berkas ke form pendaftaran, PK2 melakukan seleksi administrasi, dan jika lolos, PK2 mengirimkan data kandidat peserta magang ke mitra untuk proses seleksi lanjutan oleh mitra.",0.999999999975,0.5384615384615384,0.9792983018619479,0.3333333333333333
18,Apa saja peran Penanggung Jawab Fakultas atau Prodi dalam program MBKM?,"Penanggung Jawab Fakultas atau Prodi dalam program MBKM memiliki peran penting dalam koordinasi dan pengelolaan kegiatan MBKM. Mereka bertanggung jawab dalam tahapan kegiatan MBKM, mulai dari persiapan, pelaksanaan, evaluasi, pengendalian, hingga peningkatan. Mereka juga berperan dalam mengoordinasikan kegiatan MBKM dengan Direktorat yang mengurusi kemahasiswaan dan inovasi, serta bekerja sama dengan berbagai pihak terkait untuk memastikan kelancaran dan kesuksesan program MBKM. Selain itu, Penanggung Jawab Fakultas atau Prodi juga bertanggung jawab dalam memberikan bimbingan dan dukungan kepada mahasiswa selama pelaksanaan kegiatan MBKM sesuai dengan panduan yang telah ditetapkan.","['(vii) Implementasi  Kegiatan MBKM dalam bentuk  Studi/  Proyek  dikoordinir oleh  Direktorat \nyang mengurusi kemahasiswaan  bersama Prodi terkait , melalui tahapan  kegiatan (a) \npersiapan, (b) Pelaksanaan, (c) Evaluasi, (d) Pengendalian, dan (e) Peningkatan.  \n \n14 Standar Proses –  \nKegiatan MBKM – Bentuk \nAsistensi Mengajar di Satuan \nPendidikan  (i) Kegiatan MBKM dalam bentuk asistensi mengajar di satuan pendidikan ditujukan untuk \nmemberikan kesempatan bagi mahasiswa yang memiliki minat dalam bidang pendidikan \ndalam rangka meraih profil sebagai pendidik , dan  membantu meningkatkan \npemerataan kualitas pendidikan  yang relevan dengan pendidikan tinggi dan \nperkembangan zaman . \n(ii) Kegiatan MBKM dalam bentuk asistensi mengajar  dilakukan di satuan pendidikan dasar \ndan menengah ,   \n(iii) Kegiatan MBKM dalam bentuk asistensi mengajar di satuan pendidikan , merupakan \nkegiatan dalam bentuk: bantuan mengajar, tutorial, bimbingan teknis, pelatihan dan'
 'dan start -up.  \n(iii) Kegiatan MBKM dalam bentuk magang/ praktik kerja dan kegiatan wirausaha hilirisasi \ndikembangkan oleh  Direktorat yang mengurusi inovasi dan kawasan sains teknologi \nbekerjasama dengan Direktorat yang mengurusi kemahasiswaan . \n(iv) Impl ementasi kegiatan MBKM dalam bentuk  magang/ praktik kerja dan kegiatan \nwirausaha hilirisasi dikoordinir oleh Direktorat yang mengurusi  inovasi dan kawasan \nsains teknologi  bersama Prodi terkait, melalui tahapan  kegiatan (a) persiapan, (b) \nPelaksanaan, (c) Evaluasi, (d) Pengendalian, dan (e) Peningkatan   \n \nIV STANDAR PENILAIAN PEMBELAJARAN  \n11 Standar penilaian  (i) Penilaian atas proses dan hasil pelaksanaan MBKM mengacu pada prinsip penilaian.  \n \n 14 Dokumen Panduan Baku Mutu Pelaksanaan MBKM - 2021  \n NO ELEMEN PENILAIAN  INDIKATOR  \n(1) (2) (3) \nDalam hal mahasiswa mendapatkan nilai mata kuliah pengayaan kurang dari C, maka \nmahasiswa dapat menggantinya dengan mata kuliah pengayaan yang berbeda.'
 '(iii) Kegiatan MBKM da lam bentuk wirausaha  dikembangkan oleh Direktorat yang \nmengurusi Kemahasiswaan.  \n(x) Implementasi  Kegiatan MBKM dalam bentuk wirausaha  dikoordinir oleh Direktorat \nyang mengurusi kemahasiswaan  bersama Prodi terkait , melalui  tahapan kegiatan (a) \npersiapan, (b) Pelaksanaan, (c) Evaluasi, (d) Pengendalian, dan (e) Peningkatan.  \n \n13 Standar Proses –  \nKegiatan MBKM – bentuk Studi \nIndependen  (i) Kegiatan MBKM dalam bentuk Studi/ Proyek Independen dimaksudkan untuk \nmendukung pencapaian profil sebagai inovator yang produktif.  \n(ii) Kegiatan  MBKM dalam bentuk Studi/ Proyek Independen dalam rangka untuk \nmewujudkan gagasan mahasiswa dalam mengembangkan produk inovatif, \nmenyelenggarakan pendidikan berbasis ri set dan pengembangan (R&D) serta \nmeningkatkan prestasi mahasiswa dalam ajang nasional dan internasional.  \n(iii) Kegiatan  MBKM dalam bentuk Studi/ Proyek Independen adalah semua kegiatan untuk'
 'terlibat di dalam pro ses dan hasil pelaksanaan MBKM.  \n(2). SOP yang diterbitkan oleh: (a) Direktorat terkait sebagai koordinator pelaksana \nmasing -masing bentuk MBKM, (b) Prodi sebagai pelaksana MBKM  untuk memandu \ndosen, mahasiswa dan tenaga kependidikan yang terlibat di dalam proses dan hasil \npelaksanaan MBKM.  \nDokumen (1) dan (2) di atas, merupakan manual untuk seluruh stakeholder yang terlibat \ndi dalam implementasi MBKM, yang dapat disusun dalam satu dokumen atau lebih secara \nterpisah. Rambu -rambu dalam penyusunan ke dua dokumen di atas, dengan ketentuan \nmemuat unsur -unsur sebagai berikut, dan dapat dikembangkan sesuai dengan kebutuhan \ndan tujuan pelaksanaan MBKM.  \n1. Tujuan dan ma ksud Manual MBKM  \n2. Luas lingkup Manual MBKM  \na. Manual Penetapan standar  \nb. Manual pelaksanaan standar  \nc. Manual evaluasi standar  \nd. Manual pengendalian pelaksnanaan standar  \ne. Manual peningkatan standar  \n3. Rincian tentang hal yang harus dikerjakan']","Penanggung Jawab Fakultas atau Prodi bertugas melakukan verifikasi data dan dokumen mahasiswa, memberikan rekomendasi kepada mahasiswa untuk mengikuti Program MBKM, dan melakukan koordinasi jika ada data yang perlu diperbaiki.",0.999999999975,1.0,0.986581606936569,0.0
19,Bagaimana penilaian prestasi mahasiswa dilakukan oleh mitra magang?,"Penilaian prestasi mahasiswa dilakukan oleh mitra magang dengan memberikan bimbingan kepada mahasiswa selama menjalani magang, memberikan evaluasi terhadap kinerja dan kemampuan mahasiswa selama magang berlangsung, serta memberikan surat keterangan hasil kegiatan magang atau sertifikat kompetensi sesuai dengan ketentuan yang berlaku. Selain itu, mahasiswa juga wajib dibimbing oleh pembimbing internal dari dosen ITS dan pembimbing eksternal dari pihak instansi/lembaga/industri tempat magang. Jika mahasiswa ingin melakukan kegiatan akademik lain selama magang, harus mendapatkan izin dari pihak penanggung jawab lembaga/badan/industri magang.","['(1) (2) (3) \nDalam hal mahasiswa mendapatkan nilai mata kuliah pengayaan kurang dari C, maka \nmahasiswa dapat menggantinya dengan mata kuliah pengayaan yang berbeda.  \nV STANDAR DOSEN DAN TENDIK  \n12 Standar dosen dan Tendik  (i) Dosen wali ditugaskan oleh Prodi untuk membuat perencanaan bersama dengan \nmahasiswa yang akan melaksanakan kegatan MBKM  \n(ii) Dosen wali ditugaskan oleh Prodi untuk melakukan evaluasi terhadap kesesuaian \nbentuk dan lama pelaksanaan MBKM sesuai dengan CPL  \n(iii) Dosen wali di tugaskan oleh Prodi untuk melakukan penilaian atas rencana, \npelaksanaan dan evaluasi MBKM  \n(iv) Dosen pembimbing MBKM ditugaskan oleh Prodi sesuai dengan pengampu MK \nkonversi dan atau dosen wali  \n(v) Tendik Prodi ditugaskan untuk melayani administrasi dalam implement asi MBKM, \nmulai dari perencanaan, pelaksanaan, moneitoring dan evaluasi, serta pelaporan \nMBKM.  \n \nVI STANDAR PENGELOLAAN PEMBELAJARAN'
 'sesuai dengan kesepakata n tempat magang;  \n(ii) Mahasiswa yang melaksanakan magang dapat melakukan kegiatan praktek / kolaborasi \nriset / kerja sama pengembangan industri / bentu k kegiatan  lain  yang selaras dengan \nCPL’   \n(iii) Mahasiswa yang melaksanakan magang wajib  dibimbing oleh pembimbing internal dari \ndosen ITS dan  pembimbing eksternal dari pihak  instansi / lembaga /  industri  tempat \nmagang ;  \n(iv) Mahasiswa yang melaksanakan magang dapat melakukan kegiatan akademik yang lain \ndengan syarat telah mendapatkan ijin dari pihak penanggung jawab lembaga / badan / \nindustri magang ;  \n(v) Mahasiswa pada waktu melaksanaan magang  tidak harus cuti  studi ;  \n(vi) Mahasiswa yang melaksa nakan magang dapat diberi  memberikan surat keterangan \nhasil kegiatan magang / sertifikat kompetensi  dari lembaga / badan / industri letak \nmagang sesuai dengan ketentuan yang berlaku;  \n 9 Dokumen Panduan Baku Mutu Pelaksanaan MBKM - 2021  \n NO ELEMEN PENILAIAN  INDIKATOR  \n(1) (2) (3)'
 '(v) Bentuk kegiatan pengabdian kepada masyarakat merupakan salah satu bentuk 7 Dokumen Panduan Baku Mutu Pelaksanaan MBKM - 2021  \n NO ELEMEN PENILAIAN  INDIKATOR  \n(1) (2) (3) \nimplementasi MK pengayaan dengan bobot 3 (tiga) sks.  \n \n4 Standar Isi  – Pengakuan bobot \nsks (1) Jumlah sks maksimal yang dapat diambil dalam rangka pelaksanaan kegiatan MB – KM \nadalah 40 (empat puluh) sks.  \n(2) Kegiatan magang/ praktik kerja pada program sarjana terapan diimplementasikan dalam \nbentuk mata kuliah wajib sebagai  mata kuliah penciri Fakultas  Vokasi sebesar 14 (empat \nbelas) sks.  \n(3) Konversi kegiatan MB -KM magang dapat dikonversikan ke dalam: (i) MK KP,  \n(ii) beberapa MK gabungan antara KP dengan MK lain dengan kesamaan CP MK,  \n(iii) MK magang dengan maksimum bobot 20 (dua puluh) sks.   \n(4) Kegiatan MBKM – dalam bentuk pertukaran pelajar melalui MK di prodi di luar ITS, \ndengan ketentuan jumlah sks maksimal adalah 20 (dua puluh) sks, yang meliputi mata'
 'kegiatan (a) persiapan, (b) Pelaksanaa n, (c) Evaluasi, (d) Pengendalian, dan (e) \nPeningkatan  \n Standar Proses –  \nKegiatan MBKM – Bentuk \nMagang / Praktik Kerja dan \nWirausaha lingkup Hilirisasi  (i) Kegiatan MBKM dalam bentuk Magang/ Praktik Kerja dan Kegiatan Wirausaha Lingkup \nHilirisasi ditujukan untuk  memperlancar karir lulusan, pengayaan kompetensi \nmahasiswa, kolaborasi magang, wirausaha dan kerja sama pengembangan produk \ninovatif  dalam rangka meraih profil lulusan sebagai  inovator yang produktif.  \n(ii) Kegiatan MBKM dalam bentuk magang/ praktik kerja dan kegiatan wirausaha hilirisasi \ndapat berupa kegiatan penelitian dan pengabdian masyarakat bersama civitas \nakademika yang lain untuk memecahkan persoalan di masyarakat atau indust ri, inkubasi \ndan start -up.  \n(iii) Kegiatan MBKM dalam bentuk magang/ praktik kerja dan kegiatan wirausaha hilirisasi \ndikembangkan oleh  Direktorat yang mengurusi inovasi dan kawasan sains teknologi']","Mitra magang memberikan penilaian berdasarkan formulir penilaian yang meliputi aspek-aspek seperti inisiatif, kemampuan komunikasi, disiplin, penampilan, ketekunan, kemampuan teknikal, berpikir kritis, kemampuan bekerjasama, kemampuan beradaptasi, dan hasil pekerjaan (kontribusi), yang kemudian diserahkan ke departemen untuk verifikasi.",0.6388888888675925,0.16666666666666666,0.9999999999999996,0.0
