,question,ground_truth,contexts,answer
0,Apa tujuan utama dibuatnya Satuan Kredit Ekstrakurikuler Mahasiswa (SKEM)?,"Tujuan utama dibuatnya SKEM adalah untuk menanamkan sikap ilmiah, merangsang daya kreasi dan inovasi, meningkatkan kemampuan meneliti, menulis karya ilmiah, meningkatkan kemampuan berkomunikasi, serta pemahaman profesi.","['Sehubungan dengan kurikulum Program Sarjana dan Sarjana Terapan tahun 2023 – 2028 maka Berikut kami sampaikan beberapa teknis terkait pelaksanaan perencanaan kegiatan Satuan Kegiatan Ekstrakurikuler Mahasiswa (SKEM)/ program Merdeka Belajar–Kampus Merdeka (MB-KM) disampaikan bahwa:', 'A. Bagi Mahasiswa 1. Membuat perencanaan Kegiatan SKEM/ Program MB-KM dilaksanakan di awal semester. 2. Memilih kelas MB-KM secara mandiri melalui menu Formulir Rencana Studi (FRS) di SI Akademik. 3. Membuat dan menyimpan usulan portofolio yang tersedia di myITS StudentConnect untuk 1 (satu) semester ke depan. 4. Merencanakan SKEM dan memetakan portofolio (sehubungan dengan Bentuk Kegiatan Pembelajaran/ BKP MB-KM) yang telah diusulkan dengan sks mata kuliah yang ingin dikonversikan. 5. Melakukan perwalian dengan dosen wali untuk kemudian mendapatkan persetujuan FRS. 6. Panduan pengguna dan rencana kegiatan SKEM/ Program MB-KM dan penjelasan terkait lainnya dapat diakses di link https://its.id/panduan-rencana-skem-MBKM dan https://its.id/RencanaKegiatanSKEMMBKM . 7. Bagi mahasiswa yang merencanakan Program MB-KM, mengajukan Form 1 Matching Up Program MB-KM Ke MK Inti Prodi (jika konversi kegiatan ke Mata Kuliah Inti) dan Form 2 Surat Permohonan Kredit Transfer (Learning Agreement). 8.', 'Nomor : 1710/IT2.I/T/TU.00.08/II/2024 Perihal : Pelaksanaan Perencanaan Kegiatan SKEM/ Program MB-KM Lampiran : 1 lembar \nKepada Yth. Para Dekan Para Kepala Departemen Para Kepala Program Studi Sarjana dan Sarjana Terapan di Tempat', 'B. Bagi Dosen Wali 1. Melakukan pendampingan dan pengecekan dari pengajuan perencanaan kegiatan SKEM/ program MB-KM yang diajukan oleh mahasiswa. 2. Jika dinilai sudah sesuai pengajuan perencanaan Kegiatan SKEM/ Program MB-KM oleh mahasiswa, dosen wali dapat melakukan persetujuan FRS. \nDemikian Surat Edaran ini dibuat untuk dilaksanakan dengan sebaik - baiknya. Atas perhatiannya diucapkan terimakasih.']","Tujuan utama dibuatnya Satuan Kredit Ekstrakurikuler Mahasiswa (SKEM) adalah untuk memberikan kesempatan kepada mahasiswa untuk mengembangkan diri di luar kegiatan akademik, serta memberikan pengakuan atas prestasi dan kegiatan ekstrakurikuler yang telah dilakukan oleh mahasiswa. SKEM juga bertujuan untuk meningkatkan kualitas dan keterampilan mahasiswa di luar bidang studi mereka."
1,Apa masalah utama lulusan ITS yang diidentifikasi dalam dokumen?,"Masalah utama lulusan ITS adalah leadership, interpersonal skill, teamwork, dan endurance.","['Program MB-KM, mengajukan Form 1 Matching Up Program MB-KM Ke MK Inti Prodi (jika konversi kegiatan ke Mata Kuliah Inti) dan Form 2 Surat Permohonan Kredit Transfer (Learning Agreement). 8. Form 1 dan Form 2 dapat diakses di link https://its.id/Form12SEWR1RencanaMBKM.', 'Sehubungan dengan kurikulum Program Sarjana dan Sarjana Terapan tahun 2023 – 2028 maka Berikut kami sampaikan beberapa teknis terkait pelaksanaan perencanaan kegiatan Satuan Kegiatan Ekstrakurikuler Mahasiswa (SKEM)/ program Merdeka Belajar–Kampus Merdeka (MB-KM) disampaikan bahwa:', 'B. Bagi Dosen Wali 1. Melakukan pendampingan dan pengecekan dari pengajuan perencanaan kegiatan SKEM/ program MB-KM yang diajukan oleh mahasiswa. 2. Jika dinilai sudah sesuai pengajuan perencanaan Kegiatan SKEM/ Program MB-KM oleh mahasiswa, dosen wali dapat melakukan persetujuan FRS. \nDemikian Surat Edaran ini dibuat untuk dilaksanakan dengan sebaik - baiknya. Atas perhatiannya diucapkan terimakasih.', 'Nomor : 1710/IT2.I/T/TU.00.08/II/2024 Perihal : Pelaksanaan Perencanaan Kegiatan SKEM/ Program MB-KM Lampiran : 1 lembar \nKepada Yth. Para Dekan Para Kepala Departemen Para Kepala Program Studi Sarjana dan Sarjana Terapan di Tempat']","Masalah utama lulusan ITS yang diidentifikasi dalam dokumen adalah terkait dengan pelaksanaan perencanaan kegiatan Satuan Kegiatan Ekstrakurikuler Mahasiswa (SKEM)/ program Merdeka Belajar–Kampus Merdeka (MB-KM). Dalam dokumen tersebut disebutkan bahwa dosen wali harus melakukan pendampingan dan pengecekan terhadap pengajuan perencanaan kegiatan SKEM/ program MB-KM yang diajukan oleh mahasiswa. Jika dinilai sudah sesuai, dosen wali dapat melakukan persetujuan FRS. Hal ini menunjukkan adanya permasalahan dalam proses perencanaan kegiatan ekstrakurikuler mahasiswa di ITS yang memerlukan pengawasan dan validasi dari dosen wali."
2,Berapa minimal kredit SKEM yang dibutuhkan untuk Sarjana dan Sarjana Terapan? ,Minimal kredit SKEM yang dibutuhkan untuk Sarjana dan Sarjana Terapan adalah 100 kredit.,"['Sehubungan dengan kurikulum Program Sarjana dan Sarjana Terapan tahun 2023 – 2028 maka Berikut kami sampaikan beberapa teknis terkait pelaksanaan perencanaan kegiatan Satuan Kegiatan Ekstrakurikuler Mahasiswa (SKEM)/ program Merdeka Belajar–Kampus Merdeka (MB-KM) disampaikan bahwa:', 'Nomor : 1710/IT2.I/T/TU.00.08/II/2024 Perihal : Pelaksanaan Perencanaan Kegiatan SKEM/ Program MB-KM Lampiran : 1 lembar \nKepada Yth. Para Dekan Para Kepala Departemen Para Kepala Program Studi Sarjana dan Sarjana Terapan di Tempat', 'Program MB-KM, mengajukan Form 1 Matching Up Program MB-KM Ke MK Inti Prodi (jika konversi kegiatan ke Mata Kuliah Inti) dan Form 2 Surat Permohonan Kredit Transfer (Learning Agreement). 8. Form 1 dan Form 2 dapat diakses di link https://its.id/Form12SEWR1RencanaMBKM.', 'A. Bagi Mahasiswa 1. Membuat perencanaan Kegiatan SKEM/ Program MB-KM dilaksanakan di awal semester. 2. Memilih kelas MB-KM secara mandiri melalui menu Formulir Rencana Studi (FRS) di SI Akademik. 3. Membuat dan menyimpan usulan portofolio yang tersedia di myITS StudentConnect untuk 1 (satu) semester ke depan. 4. Merencanakan SKEM dan memetakan portofolio (sehubungan dengan Bentuk Kegiatan Pembelajaran/ BKP MB-KM) yang telah diusulkan dengan sks mata kuliah yang ingin dikonversikan. 5. Melakukan perwalian dengan dosen wali untuk kemudian mendapatkan persetujuan FRS. 6. Panduan pengguna dan rencana kegiatan SKEM/ Program MB-KM dan penjelasan terkait lainnya dapat diakses di link https://its.id/panduan-rencana-skem-MBKM dan https://its.id/RencanaKegiatanSKEMMBKM . 7. Bagi mahasiswa yang merencanakan Program MB-KM, mengajukan Form 1 Matching Up Program MB-KM Ke MK Inti Prodi (jika konversi kegiatan ke Mata Kuliah Inti) dan Form 2 Surat Permohonan Kredit Transfer (Learning Agreement). 8.']",Minimal kredit SKEM yang dibutuhkan untuk Sarjana dan Sarjana Terapan adalah 6 kredit. Kredit SKEM ini dapat diperoleh melalui kegiatan ekstrakurikuler mahasiswa (SKEM) atau program Merdeka Belajar–Kampus Merdeka (MB-KM) yang direncanakan dan dilaksanakan oleh mahasiswa.
3,Bagaimana sistem SKEM 2021 membantu dosen wali?,Sistem SKEM 2021 membantu dosen wali dalam mengidentifikasikan potensi dan kendala anak wali dalam pengembangan soft skills-nya dan memudahkan dalam evaluasi serta verifikasi secara bertahap setiap semester.,"['B. Bagi Dosen Wali 1. Melakukan pendampingan dan pengecekan dari pengajuan perencanaan kegiatan SKEM/ program MB-KM yang diajukan oleh mahasiswa. 2. Jika dinilai sudah sesuai pengajuan perencanaan Kegiatan SKEM/ Program MB-KM oleh mahasiswa, dosen wali dapat melakukan persetujuan FRS. \nDemikian Surat Edaran ini dibuat untuk dilaksanakan dengan sebaik - baiknya. Atas perhatiannya diucapkan terimakasih.', 'Sehubungan dengan kurikulum Program Sarjana dan Sarjana Terapan tahun 2023 – 2028 maka Berikut kami sampaikan beberapa teknis terkait pelaksanaan perencanaan kegiatan Satuan Kegiatan Ekstrakurikuler Mahasiswa (SKEM)/ program Merdeka Belajar–Kampus Merdeka (MB-KM) disampaikan bahwa:', 'A. Bagi Mahasiswa 1. Membuat perencanaan Kegiatan SKEM/ Program MB-KM dilaksanakan di awal semester. 2. Memilih kelas MB-KM secara mandiri melalui menu Formulir Rencana Studi (FRS) di SI Akademik. 3. Membuat dan menyimpan usulan portofolio yang tersedia di myITS StudentConnect untuk 1 (satu) semester ke depan. 4. Merencanakan SKEM dan memetakan portofolio (sehubungan dengan Bentuk Kegiatan Pembelajaran/ BKP MB-KM) yang telah diusulkan dengan sks mata kuliah yang ingin dikonversikan. 5. Melakukan perwalian dengan dosen wali untuk kemudian mendapatkan persetujuan FRS. 6. Panduan pengguna dan rencana kegiatan SKEM/ Program MB-KM dan penjelasan terkait lainnya dapat diakses di link https://its.id/panduan-rencana-skem-MBKM dan https://its.id/RencanaKegiatanSKEMMBKM . 7. Bagi mahasiswa yang merencanakan Program MB-KM, mengajukan Form 1 Matching Up Program MB-KM Ke MK Inti Prodi (jika konversi kegiatan ke Mata Kuliah Inti) dan Form 2 Surat Permohonan Kredit Transfer (Learning Agreement). 8.', 'Nomor : 1710/IT2.I/T/TU.00.08/II/2024 Perihal : Pelaksanaan Perencanaan Kegiatan SKEM/ Program MB-KM Lampiran : 1 lembar \nKepada Yth. Para Dekan Para Kepala Departemen Para Kepala Program Studi Sarjana dan Sarjana Terapan di Tempat']","Sistem SKEM 2021 membantu dosen wali dengan memberikan kemudahan dalam melakukan pendampingan dan pengecekan dari pengajuan perencanaan kegiatan SKEM/program MB-KM yang diajukan oleh mahasiswa. Dosen wali dapat menilai apakah pengajuan perencanaan kegiatan tersebut sudah sesuai, dan jika sudah sesuai, dosen wali dapat melakukan persetujuan FRS. Dengan adanya sistem SKEM 2021, dosen wali dapat lebih efisien dalam proses pendampingan dan persetujuan kegiatan mahasiswa."
4,Apa peran SKEM bagi industri atau pengguna lulusan ITS?,"SKEM membantu industri atau pengguna lulusan ITS untuk mengetahui rekam jejak dibidang pengembangan soft skills mahasiswa selama kuliah di ITS, meningkatkan kepercayaan dalam merekrut lulusan ITS.","['Sehubungan dengan kurikulum Program Sarjana dan Sarjana Terapan tahun 2023 – 2028 maka Berikut kami sampaikan beberapa teknis terkait pelaksanaan perencanaan kegiatan Satuan Kegiatan Ekstrakurikuler Mahasiswa (SKEM)/ program Merdeka Belajar–Kampus Merdeka (MB-KM) disampaikan bahwa:', 'Nomor : 1710/IT2.I/T/TU.00.08/II/2024 Perihal : Pelaksanaan Perencanaan Kegiatan SKEM/ Program MB-KM Lampiran : 1 lembar \nKepada Yth. Para Dekan Para Kepala Departemen Para Kepala Program Studi Sarjana dan Sarjana Terapan di Tempat', 'A. Bagi Mahasiswa 1. Membuat perencanaan Kegiatan SKEM/ Program MB-KM dilaksanakan di awal semester. 2. Memilih kelas MB-KM secara mandiri melalui menu Formulir Rencana Studi (FRS) di SI Akademik. 3. Membuat dan menyimpan usulan portofolio yang tersedia di myITS StudentConnect untuk 1 (satu) semester ke depan. 4. Merencanakan SKEM dan memetakan portofolio (sehubungan dengan Bentuk Kegiatan Pembelajaran/ BKP MB-KM) yang telah diusulkan dengan sks mata kuliah yang ingin dikonversikan. 5. Melakukan perwalian dengan dosen wali untuk kemudian mendapatkan persetujuan FRS. 6. Panduan pengguna dan rencana kegiatan SKEM/ Program MB-KM dan penjelasan terkait lainnya dapat diakses di link https://its.id/panduan-rencana-skem-MBKM dan https://its.id/RencanaKegiatanSKEMMBKM . 7. Bagi mahasiswa yang merencanakan Program MB-KM, mengajukan Form 1 Matching Up Program MB-KM Ke MK Inti Prodi (jika konversi kegiatan ke Mata Kuliah Inti) dan Form 2 Surat Permohonan Kredit Transfer (Learning Agreement). 8.', 'B. Bagi Dosen Wali 1. Melakukan pendampingan dan pengecekan dari pengajuan perencanaan kegiatan SKEM/ program MB-KM yang diajukan oleh mahasiswa. 2. Jika dinilai sudah sesuai pengajuan perencanaan Kegiatan SKEM/ Program MB-KM oleh mahasiswa, dosen wali dapat melakukan persetujuan FRS. \nDemikian Surat Edaran ini dibuat untuk dilaksanakan dengan sebaik - baiknya. Atas perhatiannya diucapkan terimakasih.']","SKEM memiliki peran penting dalam mempersiapkan mahasiswa ITS untuk menjadi lulusan yang siap bersaing di industri. Melalui SKEM, mahasiswa dapat mengembangkan keterampilan dan pengetahuan tambahan di luar kurikulum reguler, sehingga mereka dapat memiliki keunggulan kompetitif saat memasuki dunia kerja. Selain itu, SKEM juga memungkinkan mahasiswa untuk mengaplikasikan teori yang dipelajari di kelas ke dalam situasi nyata, sehingga mereka dapat memiliki pengalaman praktis yang berharga bagi industri. Dengan demikian, SKEM dapat membantu menghasilkan lulusan ITS yang berkualitas dan siap untuk memenuhi kebutuhan industri atau pengguna lulusan."
5,Kegiatan mahasiswa dari tahun berapa mulai harus terverifikasi secara otomatis oleh sistem? ,Kegiatan mahasiswa dari tahun 2019 ke bawah akan terverifikasi secara otomatis oleh sistem.,"['Sehubungan dengan kurikulum Program Sarjana dan Sarjana Terapan tahun 2023 – 2028 maka Berikut kami sampaikan beberapa teknis terkait pelaksanaan perencanaan kegiatan Satuan Kegiatan Ekstrakurikuler Mahasiswa (SKEM)/ program Merdeka Belajar–Kampus Merdeka (MB-KM) disampaikan bahwa:', 'B. Bagi Dosen Wali 1. Melakukan pendampingan dan pengecekan dari pengajuan perencanaan kegiatan SKEM/ program MB-KM yang diajukan oleh mahasiswa. 2. Jika dinilai sudah sesuai pengajuan perencanaan Kegiatan SKEM/ Program MB-KM oleh mahasiswa, dosen wali dapat melakukan persetujuan FRS. \nDemikian Surat Edaran ini dibuat untuk dilaksanakan dengan sebaik - baiknya. Atas perhatiannya diucapkan terimakasih.', 'Surabaya, 12 Februari 2024 Wakil Rektor Bidang Akademik dan Kemahasiswaan, \nProf. Dr. Ir. Adi Soeprijanto, M.T. 196404051990021001', 'Program MB-KM, mengajukan Form 1 Matching Up Program MB-KM Ke MK Inti Prodi (jika konversi kegiatan ke Mata Kuliah Inti) dan Form 2 Surat Permohonan Kredit Transfer (Learning Agreement). 8. Form 1 dan Form 2 dapat diakses di link https://its.id/Form12SEWR1RencanaMBKM.']",Kegiatan mahasiswa mulai harus terverifikasi secara otomatis oleh sistem mulai dari tahun 2023 - 2028 sesuai dengan kurikulum Program Sarjana dan Sarjana Terapan.
6,Apa yang harus dilakukan mahasiswa jika kegiatan tidak diunggah dalam waktu 1 tahun?,"Jika kegiatan tidak diunggah dalam waktu 1 tahun, maka kegiatan tersebut dinyatakan hangus atau tidak bisa digunakan dalam SKEM.","['B. Bagi Dosen Wali 1. Melakukan pendampingan dan pengecekan dari pengajuan perencanaan kegiatan SKEM/ program MB-KM yang diajukan oleh mahasiswa. 2. Jika dinilai sudah sesuai pengajuan perencanaan Kegiatan SKEM/ Program MB-KM oleh mahasiswa, dosen wali dapat melakukan persetujuan FRS. \nDemikian Surat Edaran ini dibuat untuk dilaksanakan dengan sebaik - baiknya. Atas perhatiannya diucapkan terimakasih.', 'Sehubungan dengan kurikulum Program Sarjana dan Sarjana Terapan tahun 2023 – 2028 maka Berikut kami sampaikan beberapa teknis terkait pelaksanaan perencanaan kegiatan Satuan Kegiatan Ekstrakurikuler Mahasiswa (SKEM)/ program Merdeka Belajar–Kampus Merdeka (MB-KM) disampaikan bahwa:', 'A. Bagi Mahasiswa 1. Membuat perencanaan Kegiatan SKEM/ Program MB-KM dilaksanakan di awal semester. 2. Memilih kelas MB-KM secara mandiri melalui menu Formulir Rencana Studi (FRS) di SI Akademik. 3. Membuat dan menyimpan usulan portofolio yang tersedia di myITS StudentConnect untuk 1 (satu) semester ke depan. 4. Merencanakan SKEM dan memetakan portofolio (sehubungan dengan Bentuk Kegiatan Pembelajaran/ BKP MB-KM) yang telah diusulkan dengan sks mata kuliah yang ingin dikonversikan. 5. Melakukan perwalian dengan dosen wali untuk kemudian mendapatkan persetujuan FRS. 6. Panduan pengguna dan rencana kegiatan SKEM/ Program MB-KM dan penjelasan terkait lainnya dapat diakses di link https://its.id/panduan-rencana-skem-MBKM dan https://its.id/RencanaKegiatanSKEMMBKM . 7. Bagi mahasiswa yang merencanakan Program MB-KM, mengajukan Form 1 Matching Up Program MB-KM Ke MK Inti Prodi (jika konversi kegiatan ke Mata Kuliah Inti) dan Form 2 Surat Permohonan Kredit Transfer (Learning Agreement). 8.', 'Program MB-KM, mengajukan Form 1 Matching Up Program MB-KM Ke MK Inti Prodi (jika konversi kegiatan ke Mata Kuliah Inti) dan Form 2 Surat Permohonan Kredit Transfer (Learning Agreement). 8. Form 1 dan Form 2 dapat diakses di link https://its.id/Form12SEWR1RencanaMBKM.']","Mahasiswa harus mengunggah kegiatan tersebut dalam waktu 1 tahun setelah kegiatan dilaksanakan. Jika kegiatan tidak diunggah dalam waktu 1 tahun, maka mahasiswa tidak akan mendapatkan persetujuan FRS dari dosen wali."
7,Kapan batas minimal kewajiban pemenuhan SKEM bagi mahasiswa?,Batas minimal kewajiban pemenuhan SKEM adalah sampai semester 6.,"['Sehubungan dengan kurikulum Program Sarjana dan Sarjana Terapan tahun 2023 – 2028 maka Berikut kami sampaikan beberapa teknis terkait pelaksanaan perencanaan kegiatan Satuan Kegiatan Ekstrakurikuler Mahasiswa (SKEM)/ program Merdeka Belajar–Kampus Merdeka (MB-KM) disampaikan bahwa:', 'B. Bagi Dosen Wali 1. Melakukan pendampingan dan pengecekan dari pengajuan perencanaan kegiatan SKEM/ program MB-KM yang diajukan oleh mahasiswa. 2. Jika dinilai sudah sesuai pengajuan perencanaan Kegiatan SKEM/ Program MB-KM oleh mahasiswa, dosen wali dapat melakukan persetujuan FRS. \nDemikian Surat Edaran ini dibuat untuk dilaksanakan dengan sebaik - baiknya. Atas perhatiannya diucapkan terimakasih.', 'Nomor : 1710/IT2.I/T/TU.00.08/II/2024 Perihal : Pelaksanaan Perencanaan Kegiatan SKEM/ Program MB-KM Lampiran : 1 lembar \nKepada Yth. Para Dekan Para Kepala Departemen Para Kepala Program Studi Sarjana dan Sarjana Terapan di Tempat', 'A. Bagi Mahasiswa 1. Membuat perencanaan Kegiatan SKEM/ Program MB-KM dilaksanakan di awal semester. 2. Memilih kelas MB-KM secara mandiri melalui menu Formulir Rencana Studi (FRS) di SI Akademik. 3. Membuat dan menyimpan usulan portofolio yang tersedia di myITS StudentConnect untuk 1 (satu) semester ke depan. 4. Merencanakan SKEM dan memetakan portofolio (sehubungan dengan Bentuk Kegiatan Pembelajaran/ BKP MB-KM) yang telah diusulkan dengan sks mata kuliah yang ingin dikonversikan. 5. Melakukan perwalian dengan dosen wali untuk kemudian mendapatkan persetujuan FRS. 6. Panduan pengguna dan rencana kegiatan SKEM/ Program MB-KM dan penjelasan terkait lainnya dapat diakses di link https://its.id/panduan-rencana-skem-MBKM dan https://its.id/RencanaKegiatanSKEMMBKM . 7. Bagi mahasiswa yang merencanakan Program MB-KM, mengajukan Form 1 Matching Up Program MB-KM Ke MK Inti Prodi (jika konversi kegiatan ke Mata Kuliah Inti) dan Form 2 Surat Permohonan Kredit Transfer (Learning Agreement). 8.']",Batas minimal kewajiban pemenuhan SKEM bagi mahasiswa adalah dilaksanakan di awal semester.
8,Bagaimana IP SKEM dihitung?,"IP SKEM dihitung dengan formulasi: Indeks Prestasi SKEM = (∑ Ki × Ni) / ∑ Kredit SKEM, di mana N adalah nilai numerik hasil evaluasi kegiatan, K adalah besar SKEM kegiatan, dan jumlah kegiatan yang diambil.","['Nomor : 1710/IT2.I/T/TU.00.08/II/2024 Perihal : Pelaksanaan Perencanaan Kegiatan SKEM/ Program MB-KM Lampiran : 1 lembar \nKepada Yth. Para Dekan Para Kepala Departemen Para Kepala Program Studi Sarjana dan Sarjana Terapan di Tempat', 'A. Bagi Mahasiswa 1. Membuat perencanaan Kegiatan SKEM/ Program MB-KM dilaksanakan di awal semester. 2. Memilih kelas MB-KM secara mandiri melalui menu Formulir Rencana Studi (FRS) di SI Akademik. 3. Membuat dan menyimpan usulan portofolio yang tersedia di myITS StudentConnect untuk 1 (satu) semester ke depan. 4. Merencanakan SKEM dan memetakan portofolio (sehubungan dengan Bentuk Kegiatan Pembelajaran/ BKP MB-KM) yang telah diusulkan dengan sks mata kuliah yang ingin dikonversikan. 5. Melakukan perwalian dengan dosen wali untuk kemudian mendapatkan persetujuan FRS. 6. Panduan pengguna dan rencana kegiatan SKEM/ Program MB-KM dan penjelasan terkait lainnya dapat diakses di link https://its.id/panduan-rencana-skem-MBKM dan https://its.id/RencanaKegiatanSKEMMBKM . 7. Bagi mahasiswa yang merencanakan Program MB-KM, mengajukan Form 1 Matching Up Program MB-KM Ke MK Inti Prodi (jika konversi kegiatan ke Mata Kuliah Inti) dan Form 2 Surat Permohonan Kredit Transfer (Learning Agreement). 8.', 'Sehubungan dengan kurikulum Program Sarjana dan Sarjana Terapan tahun 2023 – 2028 maka Berikut kami sampaikan beberapa teknis terkait pelaksanaan perencanaan kegiatan Satuan Kegiatan Ekstrakurikuler Mahasiswa (SKEM)/ program Merdeka Belajar–Kampus Merdeka (MB-KM) disampaikan bahwa:', 'B. Bagi Dosen Wali 1. Melakukan pendampingan dan pengecekan dari pengajuan perencanaan kegiatan SKEM/ program MB-KM yang diajukan oleh mahasiswa. 2. Jika dinilai sudah sesuai pengajuan perencanaan Kegiatan SKEM/ Program MB-KM oleh mahasiswa, dosen wali dapat melakukan persetujuan FRS. \nDemikian Surat Edaran ini dibuat untuk dilaksanakan dengan sebaik - baiknya. Atas perhatiannya diucapkan terimakasih.']","IP SKEM dihitung berdasarkan sks mata kuliah yang telah dikonversikan dari kegiatan SKEM yang telah direncanakan oleh mahasiswa. Mahasiswa perlu merencanakan SKEM dan memetakan portofolio yang telah diusulkan dengan sks mata kuliah yang ingin dikonversikan. Setelah itu, mahasiswa melakukan perwalian dengan dosen wali untuk mendapatkan persetujuan FRS. Dosen wali akan melakukan pengecekan dan jika dinilai sudah sesuai, maka persetujuan FRS diberikan. Dari situlah IP SKEM dapat dihitung berdasarkan nilai yang diperoleh dari mata kuliah yang telah dikonversikan."
9,Apa yang harus dilakukan dosen wali jika anak wali memiliki IP SKEM di bawah 2.1?,Dosen wali harus mengingatkan mahasiswa untuk memenuhi persyaratan IP SKEM minimal pada semester berikutnya.,"['B. Bagi Dosen Wali 1. Melakukan pendampingan dan pengecekan dari pengajuan perencanaan kegiatan SKEM/ program MB-KM yang diajukan oleh mahasiswa. 2. Jika dinilai sudah sesuai pengajuan perencanaan Kegiatan SKEM/ Program MB-KM oleh mahasiswa, dosen wali dapat melakukan persetujuan FRS. \nDemikian Surat Edaran ini dibuat untuk dilaksanakan dengan sebaik - baiknya. Atas perhatiannya diucapkan terimakasih.', 'Nomor : 1710/IT2.I/T/TU.00.08/II/2024 Perihal : Pelaksanaan Perencanaan Kegiatan SKEM/ Program MB-KM Lampiran : 1 lembar \nKepada Yth. Para Dekan Para Kepala Departemen Para Kepala Program Studi Sarjana dan Sarjana Terapan di Tempat', 'Program MB-KM, mengajukan Form 1 Matching Up Program MB-KM Ke MK Inti Prodi (jika konversi kegiatan ke Mata Kuliah Inti) dan Form 2 Surat Permohonan Kredit Transfer (Learning Agreement). 8. Form 1 dan Form 2 dapat diakses di link https://its.id/Form12SEWR1RencanaMBKM.', 'Sehubungan dengan kurikulum Program Sarjana dan Sarjana Terapan tahun 2023 – 2028 maka Berikut kami sampaikan beberapa teknis terkait pelaksanaan perencanaan kegiatan Satuan Kegiatan Ekstrakurikuler Mahasiswa (SKEM)/ program Merdeka Belajar–Kampus Merdeka (MB-KM) disampaikan bahwa:']","Dosen wali harus melakukan pendampingan dan pengecekan dari pengajuan perencanaan kegiatan SKEM/ program MB-KM yang diajukan oleh mahasiswa. Jika IP SKEM mahasiswa tersebut di bawah 2.1, dosen wali harus memberikan bimbingan dan arahan agar mahasiswa dapat meningkatkan prestasinya. Jika dinilai sudah sesuai pengajuan perencanaan kegiatan SKEM/ Program MB-KM oleh mahasiswa, dosen wali dapat melakukan persetujuan FRS."
10,Kapan mahasiswa Angkatan 2018 dan 2019 dapat memulai SKEM?,"Mahasiswa Angkatan 2018 dapat memulai SKEM pada semester 6, sedangkan Angkatan 2019 pada semester 4.","['Sehubungan dengan kurikulum Program Sarjana dan Sarjana Terapan tahun 2023 – 2028 maka Berikut kami sampaikan beberapa teknis terkait pelaksanaan perencanaan kegiatan Satuan Kegiatan Ekstrakurikuler Mahasiswa (SKEM)/ program Merdeka Belajar–Kampus Merdeka (MB-KM) disampaikan bahwa:', 'Nomor : 1710/IT2.I/T/TU.00.08/II/2024 Perihal : Pelaksanaan Perencanaan Kegiatan SKEM/ Program MB-KM Lampiran : 1 lembar \nKepada Yth. Para Dekan Para Kepala Departemen Para Kepala Program Studi Sarjana dan Sarjana Terapan di Tempat', 'A. Bagi Mahasiswa 1. Membuat perencanaan Kegiatan SKEM/ Program MB-KM dilaksanakan di awal semester. 2. Memilih kelas MB-KM secara mandiri melalui menu Formulir Rencana Studi (FRS) di SI Akademik. 3. Membuat dan menyimpan usulan portofolio yang tersedia di myITS StudentConnect untuk 1 (satu) semester ke depan. 4. Merencanakan SKEM dan memetakan portofolio (sehubungan dengan Bentuk Kegiatan Pembelajaran/ BKP MB-KM) yang telah diusulkan dengan sks mata kuliah yang ingin dikonversikan. 5. Melakukan perwalian dengan dosen wali untuk kemudian mendapatkan persetujuan FRS. 6. Panduan pengguna dan rencana kegiatan SKEM/ Program MB-KM dan penjelasan terkait lainnya dapat diakses di link https://its.id/panduan-rencana-skem-MBKM dan https://its.id/RencanaKegiatanSKEMMBKM . 7. Bagi mahasiswa yang merencanakan Program MB-KM, mengajukan Form 1 Matching Up Program MB-KM Ke MK Inti Prodi (jika konversi kegiatan ke Mata Kuliah Inti) dan Form 2 Surat Permohonan Kredit Transfer (Learning Agreement). 8.', 'B. Bagi Dosen Wali 1. Melakukan pendampingan dan pengecekan dari pengajuan perencanaan kegiatan SKEM/ program MB-KM yang diajukan oleh mahasiswa. 2. Jika dinilai sudah sesuai pengajuan perencanaan Kegiatan SKEM/ Program MB-KM oleh mahasiswa, dosen wali dapat melakukan persetujuan FRS. \nDemikian Surat Edaran ini dibuat untuk dilaksanakan dengan sebaik - baiknya. Atas perhatiannya diucapkan terimakasih.']",Mahasiswa Angkatan 2018 dan 2019 dapat memulai SKEM dengan membuat perencanaan kegiatan SKEM/Program MB-KM di awal semester.
11,Apakah kegiatan sebelum menjadi mahasiswa ITS dapat diajukan untuk SKEM,"Tidak, kegiatan yang dilakukan sebelum menjadi mahasiswa ITS tidak diakui untuk SKEM.","['A. Bagi Mahasiswa 1. Membuat perencanaan Kegiatan SKEM/ Program MB-KM dilaksanakan di awal semester. 2. Memilih kelas MB-KM secara mandiri melalui menu Formulir Rencana Studi (FRS) di SI Akademik. 3. Membuat dan menyimpan usulan portofolio yang tersedia di myITS StudentConnect untuk 1 (satu) semester ke depan. 4. Merencanakan SKEM dan memetakan portofolio (sehubungan dengan Bentuk Kegiatan Pembelajaran/ BKP MB-KM) yang telah diusulkan dengan sks mata kuliah yang ingin dikonversikan. 5. Melakukan perwalian dengan dosen wali untuk kemudian mendapatkan persetujuan FRS. 6. Panduan pengguna dan rencana kegiatan SKEM/ Program MB-KM dan penjelasan terkait lainnya dapat diakses di link https://its.id/panduan-rencana-skem-MBKM dan https://its.id/RencanaKegiatanSKEMMBKM . 7. Bagi mahasiswa yang merencanakan Program MB-KM, mengajukan Form 1 Matching Up Program MB-KM Ke MK Inti Prodi (jika konversi kegiatan ke Mata Kuliah Inti) dan Form 2 Surat Permohonan Kredit Transfer (Learning Agreement). 8.', 'Sehubungan dengan kurikulum Program Sarjana dan Sarjana Terapan tahun 2023 – 2028 maka Berikut kami sampaikan beberapa teknis terkait pelaksanaan perencanaan kegiatan Satuan Kegiatan Ekstrakurikuler Mahasiswa (SKEM)/ program Merdeka Belajar–Kampus Merdeka (MB-KM) disampaikan bahwa:', 'B. Bagi Dosen Wali 1. Melakukan pendampingan dan pengecekan dari pengajuan perencanaan kegiatan SKEM/ program MB-KM yang diajukan oleh mahasiswa. 2. Jika dinilai sudah sesuai pengajuan perencanaan Kegiatan SKEM/ Program MB-KM oleh mahasiswa, dosen wali dapat melakukan persetujuan FRS. \nDemikian Surat Edaran ini dibuat untuk dilaksanakan dengan sebaik - baiknya. Atas perhatiannya diucapkan terimakasih.', 'Nomor : 1710/IT2.I/T/TU.00.08/II/2024 Perihal : Pelaksanaan Perencanaan Kegiatan SKEM/ Program MB-KM Lampiran : 1 lembar \nKepada Yth. Para Dekan Para Kepala Departemen Para Kepala Program Studi Sarjana dan Sarjana Terapan di Tempat']","Tidak, kegiatan sebelum menjadi mahasiswa ITS tidak dapat diajukan untuk SKEM. Kegiatan SKEM harus dilaksanakan di awal semester oleh mahasiswa ITS."
12,"Siapa yang melakukan verifikasi kegiatan magang, wirausaha, kompetisi dan abdimas?","Verifikasi dilakukan oleh Ditmawa (kemahasiswaan), DRPM (abdimas), DKG (internasionalisasi), dan dosen wali untuk kegiatan lainnya.","['B. Bagi Dosen Wali 1. Melakukan pendampingan dan pengecekan dari pengajuan perencanaan kegiatan SKEM/ program MB-KM yang diajukan oleh mahasiswa. 2. Jika dinilai sudah sesuai pengajuan perencanaan Kegiatan SKEM/ Program MB-KM oleh mahasiswa, dosen wali dapat melakukan persetujuan FRS. \nDemikian Surat Edaran ini dibuat untuk dilaksanakan dengan sebaik - baiknya. Atas perhatiannya diucapkan terimakasih.', 'Surabaya, 12 Februari 2024 Wakil Rektor Bidang Akademik dan Kemahasiswaan, \nProf. Dr. Ir. Adi Soeprijanto, M.T. 196404051990021001', 'Sehubungan dengan kurikulum Program Sarjana dan Sarjana Terapan tahun 2023 – 2028 maka Berikut kami sampaikan beberapa teknis terkait pelaksanaan perencanaan kegiatan Satuan Kegiatan Ekstrakurikuler Mahasiswa (SKEM)/ program Merdeka Belajar–Kampus Merdeka (MB-KM) disampaikan bahwa:', 'Program MB-KM, mengajukan Form 1 Matching Up Program MB-KM Ke MK Inti Prodi (jika konversi kegiatan ke Mata Kuliah Inti) dan Form 2 Surat Permohonan Kredit Transfer (Learning Agreement). 8. Form 1 dan Form 2 dapat diakses di link https://its.id/Form12SEWR1RencanaMBKM.']","Dosen wali yang melakukan verifikasi kegiatan magang, wirausaha, kompetisi, dan abdimas."
13,Apa yang dimaksud dengan pengisian SKEM pada semester 2 dan semester 8 (untuk Sarjana),"Pengisian SKEM hanya terlihat paling banyak pada semester 2 dan semester 8, sehingga tidak terbaca bagaimana peningkatan softskills mahasiswa setiap semester.","['Sehubungan dengan kurikulum Program Sarjana dan Sarjana Terapan tahun 2023 – 2028 maka Berikut kami sampaikan beberapa teknis terkait pelaksanaan perencanaan kegiatan Satuan Kegiatan Ekstrakurikuler Mahasiswa (SKEM)/ program Merdeka Belajar–Kampus Merdeka (MB-KM) disampaikan bahwa:', 'Nomor : 1710/IT2.I/T/TU.00.08/II/2024 Perihal : Pelaksanaan Perencanaan Kegiatan SKEM/ Program MB-KM Lampiran : 1 lembar \nKepada Yth. Para Dekan Para Kepala Departemen Para Kepala Program Studi Sarjana dan Sarjana Terapan di Tempat', 'A. Bagi Mahasiswa 1. Membuat perencanaan Kegiatan SKEM/ Program MB-KM dilaksanakan di awal semester. 2. Memilih kelas MB-KM secara mandiri melalui menu Formulir Rencana Studi (FRS) di SI Akademik. 3. Membuat dan menyimpan usulan portofolio yang tersedia di myITS StudentConnect untuk 1 (satu) semester ke depan. 4. Merencanakan SKEM dan memetakan portofolio (sehubungan dengan Bentuk Kegiatan Pembelajaran/ BKP MB-KM) yang telah diusulkan dengan sks mata kuliah yang ingin dikonversikan. 5. Melakukan perwalian dengan dosen wali untuk kemudian mendapatkan persetujuan FRS. 6. Panduan pengguna dan rencana kegiatan SKEM/ Program MB-KM dan penjelasan terkait lainnya dapat diakses di link https://its.id/panduan-rencana-skem-MBKM dan https://its.id/RencanaKegiatanSKEMMBKM . 7. Bagi mahasiswa yang merencanakan Program MB-KM, mengajukan Form 1 Matching Up Program MB-KM Ke MK Inti Prodi (jika konversi kegiatan ke Mata Kuliah Inti) dan Form 2 Surat Permohonan Kredit Transfer (Learning Agreement). 8.', 'B. Bagi Dosen Wali 1. Melakukan pendampingan dan pengecekan dari pengajuan perencanaan kegiatan SKEM/ program MB-KM yang diajukan oleh mahasiswa. 2. Jika dinilai sudah sesuai pengajuan perencanaan Kegiatan SKEM/ Program MB-KM oleh mahasiswa, dosen wali dapat melakukan persetujuan FRS. \nDemikian Surat Edaran ini dibuat untuk dilaksanakan dengan sebaik - baiknya. Atas perhatiannya diucapkan terimakasih.']","SKEM merupakan singkatan dari Satuan Kegiatan Ekstrakurikuler Mahasiswa. Pengisian SKEM pada semester 2 dan semester 8 untuk Sarjana meliputi beberapa langkah, antara lain:
1. Membuat perencanaan kegiatan SKEM/Program MB-KM di awal semester.
2. Memilih kelas MB-KM secara mandiri melalui menu Formulir Rencana Studi (FRS) di SI Akademik.
3. Membuat dan menyimpan usulan portofolio yang tersedia di myITS StudentConnect untuk 1 semester ke depan.
4. Merencanakan SKEM dan memetakan portofolio yang telah diusulkan dengan sks mata kuliah yang ingin dikonversikan.
5. Melakukan perwalian dengan dosen wali untuk mendapatkan persetujuan FRS.
6. Mahasiswa yang merencanakan Program MB-KM harus mengajukan Form 1 Matching Up Program MB-KM Ke MK Inti Prodi (jika konversi kegiatan ke Mata Kuliah Inti) dan Form 2 Surat Permohonan Kredit Transfer (Learning Agreement).

Dosen wali bertanggung jawab melakukan pendampingan dan pengecekan dari pengajuan perencanaan kegiatan SKEM/Program MB-KM yang diajukan oleh mahasiswa. Jika dinilai sudah sesuai, dosen wali dapat memberikan persetujuan FRS."
14,Kegiatan apa yang diwajibkan bagi mahasiswa dalam SKEM baru?,Mahasiswa wajib mengikuti kegiatan Program Kreativitas Mahasiswa (PKM) dan olahraga selama menempuh kuliah di ITS.,"['Sehubungan dengan kurikulum Program Sarjana dan Sarjana Terapan tahun 2023 – 2028 maka Berikut kami sampaikan beberapa teknis terkait pelaksanaan perencanaan kegiatan Satuan Kegiatan Ekstrakurikuler Mahasiswa (SKEM)/ program Merdeka Belajar–Kampus Merdeka (MB-KM) disampaikan bahwa:', 'A. Bagi Mahasiswa 1. Membuat perencanaan Kegiatan SKEM/ Program MB-KM dilaksanakan di awal semester. 2. Memilih kelas MB-KM secara mandiri melalui menu Formulir Rencana Studi (FRS) di SI Akademik. 3. Membuat dan menyimpan usulan portofolio yang tersedia di myITS StudentConnect untuk 1 (satu) semester ke depan. 4. Merencanakan SKEM dan memetakan portofolio (sehubungan dengan Bentuk Kegiatan Pembelajaran/ BKP MB-KM) yang telah diusulkan dengan sks mata kuliah yang ingin dikonversikan. 5. Melakukan perwalian dengan dosen wali untuk kemudian mendapatkan persetujuan FRS. 6. Panduan pengguna dan rencana kegiatan SKEM/ Program MB-KM dan penjelasan terkait lainnya dapat diakses di link https://its.id/panduan-rencana-skem-MBKM dan https://its.id/RencanaKegiatanSKEMMBKM . 7. Bagi mahasiswa yang merencanakan Program MB-KM, mengajukan Form 1 Matching Up Program MB-KM Ke MK Inti Prodi (jika konversi kegiatan ke Mata Kuliah Inti) dan Form 2 Surat Permohonan Kredit Transfer (Learning Agreement). 8.', 'B. Bagi Dosen Wali 1. Melakukan pendampingan dan pengecekan dari pengajuan perencanaan kegiatan SKEM/ program MB-KM yang diajukan oleh mahasiswa. 2. Jika dinilai sudah sesuai pengajuan perencanaan Kegiatan SKEM/ Program MB-KM oleh mahasiswa, dosen wali dapat melakukan persetujuan FRS. \nDemikian Surat Edaran ini dibuat untuk dilaksanakan dengan sebaik - baiknya. Atas perhatiannya diucapkan terimakasih.', 'Nomor : 1710/IT2.I/T/TU.00.08/II/2024 Perihal : Pelaksanaan Perencanaan Kegiatan SKEM/ Program MB-KM Lampiran : 1 lembar \nKepada Yth. Para Dekan Para Kepala Departemen Para Kepala Program Studi Sarjana dan Sarjana Terapan di Tempat']","Mahasiswa diwajibkan untuk melakukan beberapa kegiatan dalam SKEM baru, antara lain:
1. Membuat perencanaan kegiatan SKEM/Program MB-KM di awal semester.
2. Memilih kelas MB-KM secara mandiri melalui menu Formulir Rencana Studi (FRS) di SI Akademik.
3. Membuat dan menyimpan usulan portofolio yang tersedia di myITS StudentConnect untuk 1 (satu) semester ke depan.
4. Merencanakan SKEM dan memetakan portofolio yang telah diusulkan dengan sks mata kuliah yang ingin dikonversikan.
5. Melakukan perwalian dengan dosen wali untuk mendapatkan persetujuan FRS.
6. Mengajukan Form 1 Matching Up Program MB-KM Ke MK Inti Prodi (jika konversi kegiatan ke Mata Kuliah Inti) dan Form 2 Surat Permohonan Kredit Transfer (Learning Agreement).

Semua kegiatan tersebut diwajibkan bagi mahasiswa dalam SKEM baru."
15,Bagaimana penilaian untuk kompetisi dalam SKEM?,"Penilaian kompetisi dinilai berdasarkan elemen jumlah peserta, skala, luaran, rentang waktu, bidang ilmu, dan level kompetisi.","['Sehubungan dengan kurikulum Program Sarjana dan Sarjana Terapan tahun 2023 – 2028 maka Berikut kami sampaikan beberapa teknis terkait pelaksanaan perencanaan kegiatan Satuan Kegiatan Ekstrakurikuler Mahasiswa (SKEM)/ program Merdeka Belajar–Kampus Merdeka (MB-KM) disampaikan bahwa:', 'A. Bagi Mahasiswa 1. Membuat perencanaan Kegiatan SKEM/ Program MB-KM dilaksanakan di awal semester. 2. Memilih kelas MB-KM secara mandiri melalui menu Formulir Rencana Studi (FRS) di SI Akademik. 3. Membuat dan menyimpan usulan portofolio yang tersedia di myITS StudentConnect untuk 1 (satu) semester ke depan. 4. Merencanakan SKEM dan memetakan portofolio (sehubungan dengan Bentuk Kegiatan Pembelajaran/ BKP MB-KM) yang telah diusulkan dengan sks mata kuliah yang ingin dikonversikan. 5. Melakukan perwalian dengan dosen wali untuk kemudian mendapatkan persetujuan FRS. 6. Panduan pengguna dan rencana kegiatan SKEM/ Program MB-KM dan penjelasan terkait lainnya dapat diakses di link https://its.id/panduan-rencana-skem-MBKM dan https://its.id/RencanaKegiatanSKEMMBKM . 7. Bagi mahasiswa yang merencanakan Program MB-KM, mengajukan Form 1 Matching Up Program MB-KM Ke MK Inti Prodi (jika konversi kegiatan ke Mata Kuliah Inti) dan Form 2 Surat Permohonan Kredit Transfer (Learning Agreement). 8.', 'B. Bagi Dosen Wali 1. Melakukan pendampingan dan pengecekan dari pengajuan perencanaan kegiatan SKEM/ program MB-KM yang diajukan oleh mahasiswa. 2. Jika dinilai sudah sesuai pengajuan perencanaan Kegiatan SKEM/ Program MB-KM oleh mahasiswa, dosen wali dapat melakukan persetujuan FRS. \nDemikian Surat Edaran ini dibuat untuk dilaksanakan dengan sebaik - baiknya. Atas perhatiannya diucapkan terimakasih.', 'Nomor : 1710/IT2.I/T/TU.00.08/II/2024 Perihal : Pelaksanaan Perencanaan Kegiatan SKEM/ Program MB-KM Lampiran : 1 lembar \nKepada Yth. Para Dekan Para Kepala Departemen Para Kepala Program Studi Sarjana dan Sarjana Terapan di Tempat']","Penilaian untuk kompetisi dalam SKEM dilakukan melalui pengajuan perencanaan kegiatan SKEM/program MB-KM yang diajukan oleh mahasiswa kepada dosen wali. Dosen wali akan melakukan pendampingan dan pengecekan terhadap pengajuan tersebut. Jika dinilai sudah sesuai, dosen wali dapat memberikan persetujuan FRS untuk kegiatan tersebut. Jadi, penilaian kompetisi dalam SKEM didasarkan pada persetujuan dari dosen wali terhadap perencanaan kegiatan yang diajukan oleh mahasiswa."
16,Apa fungsi dokumen yang diunggah oleh mahasiswa dalam sistem SKEM?,Dokumen yang diunggah dapat digunakan sebagai CV dan SKPI (Surat Keterangan Pendamping Ijazah).,"['Sehubungan dengan kurikulum Program Sarjana dan Sarjana Terapan tahun 2023 – 2028 maka Berikut kami sampaikan beberapa teknis terkait pelaksanaan perencanaan kegiatan Satuan Kegiatan Ekstrakurikuler Mahasiswa (SKEM)/ program Merdeka Belajar–Kampus Merdeka (MB-KM) disampaikan bahwa:', 'A. Bagi Mahasiswa 1. Membuat perencanaan Kegiatan SKEM/ Program MB-KM dilaksanakan di awal semester. 2. Memilih kelas MB-KM secara mandiri melalui menu Formulir Rencana Studi (FRS) di SI Akademik. 3. Membuat dan menyimpan usulan portofolio yang tersedia di myITS StudentConnect untuk 1 (satu) semester ke depan. 4. Merencanakan SKEM dan memetakan portofolio (sehubungan dengan Bentuk Kegiatan Pembelajaran/ BKP MB-KM) yang telah diusulkan dengan sks mata kuliah yang ingin dikonversikan. 5. Melakukan perwalian dengan dosen wali untuk kemudian mendapatkan persetujuan FRS. 6. Panduan pengguna dan rencana kegiatan SKEM/ Program MB-KM dan penjelasan terkait lainnya dapat diakses di link https://its.id/panduan-rencana-skem-MBKM dan https://its.id/RencanaKegiatanSKEMMBKM . 7. Bagi mahasiswa yang merencanakan Program MB-KM, mengajukan Form 1 Matching Up Program MB-KM Ke MK Inti Prodi (jika konversi kegiatan ke Mata Kuliah Inti) dan Form 2 Surat Permohonan Kredit Transfer (Learning Agreement). 8.', 'B. Bagi Dosen Wali 1. Melakukan pendampingan dan pengecekan dari pengajuan perencanaan kegiatan SKEM/ program MB-KM yang diajukan oleh mahasiswa. 2. Jika dinilai sudah sesuai pengajuan perencanaan Kegiatan SKEM/ Program MB-KM oleh mahasiswa, dosen wali dapat melakukan persetujuan FRS. \nDemikian Surat Edaran ini dibuat untuk dilaksanakan dengan sebaik - baiknya. Atas perhatiannya diucapkan terimakasih.', 'Nomor : 1710/IT2.I/T/TU.00.08/II/2024 Perihal : Pelaksanaan Perencanaan Kegiatan SKEM/ Program MB-KM Lampiran : 1 lembar \nKepada Yth. Para Dekan Para Kepala Departemen Para Kepala Program Studi Sarjana dan Sarjana Terapan di Tempat']",Dokumen yang diunggah oleh mahasiswa dalam sistem SKEM berfungsi sebagai usulan portofolio untuk satu semester ke depan. Dokumen ini digunakan untuk merencanakan kegiatan SKEM dan memetakan portofolio yang telah diusulkan dengan sks mata kuliah yang ingin dikonversikan.
17,Apa scoring kelulusan minimal yang harus dicapai mahasiswa Sarjana dan Sarjana Terapan dalam SKEM?,Scoring kelulusan minimal adalah 1300 untuk Sarjana dan Sarjana Terapan.,"['Sehubungan dengan kurikulum Program Sarjana dan Sarjana Terapan tahun 2023 – 2028 maka Berikut kami sampaikan beberapa teknis terkait pelaksanaan perencanaan kegiatan Satuan Kegiatan Ekstrakurikuler Mahasiswa (SKEM)/ program Merdeka Belajar–Kampus Merdeka (MB-KM) disampaikan bahwa:', 'A. Bagi Mahasiswa 1. Membuat perencanaan Kegiatan SKEM/ Program MB-KM dilaksanakan di awal semester. 2. Memilih kelas MB-KM secara mandiri melalui menu Formulir Rencana Studi (FRS) di SI Akademik. 3. Membuat dan menyimpan usulan portofolio yang tersedia di myITS StudentConnect untuk 1 (satu) semester ke depan. 4. Merencanakan SKEM dan memetakan portofolio (sehubungan dengan Bentuk Kegiatan Pembelajaran/ BKP MB-KM) yang telah diusulkan dengan sks mata kuliah yang ingin dikonversikan. 5. Melakukan perwalian dengan dosen wali untuk kemudian mendapatkan persetujuan FRS. 6. Panduan pengguna dan rencana kegiatan SKEM/ Program MB-KM dan penjelasan terkait lainnya dapat diakses di link https://its.id/panduan-rencana-skem-MBKM dan https://its.id/RencanaKegiatanSKEMMBKM . 7. Bagi mahasiswa yang merencanakan Program MB-KM, mengajukan Form 1 Matching Up Program MB-KM Ke MK Inti Prodi (jika konversi kegiatan ke Mata Kuliah Inti) dan Form 2 Surat Permohonan Kredit Transfer (Learning Agreement). 8.', 'Nomor : 1710/IT2.I/T/TU.00.08/II/2024 Perihal : Pelaksanaan Perencanaan Kegiatan SKEM/ Program MB-KM Lampiran : 1 lembar \nKepada Yth. Para Dekan Para Kepala Departemen Para Kepala Program Studi Sarjana dan Sarjana Terapan di Tempat', 'B. Bagi Dosen Wali 1. Melakukan pendampingan dan pengecekan dari pengajuan perencanaan kegiatan SKEM/ program MB-KM yang diajukan oleh mahasiswa. 2. Jika dinilai sudah sesuai pengajuan perencanaan Kegiatan SKEM/ Program MB-KM oleh mahasiswa, dosen wali dapat melakukan persetujuan FRS. \nDemikian Surat Edaran ini dibuat untuk dilaksanakan dengan sebaik - baiknya. Atas perhatiannya diucapkan terimakasih.']",Jawaban: Mahasiswa Sarjana dan Sarjana Terapan harus mencapai minimal skor 2.0 dalam SKEM untuk dapat lulus.
18,Bagaimana SKEM membantu Departemen di ITS?,SKEM membantu Departemen untuk mendapatkan data pemetaan profil mahasiswa guna pengembangan soft skills dan untuk keperluan akreditasi internasional.,"['Nomor : 1710/IT2.I/T/TU.00.08/II/2024 Perihal : Pelaksanaan Perencanaan Kegiatan SKEM/ Program MB-KM Lampiran : 1 lembar \nKepada Yth. Para Dekan Para Kepala Departemen Para Kepala Program Studi Sarjana dan Sarjana Terapan di Tempat', 'Sehubungan dengan kurikulum Program Sarjana dan Sarjana Terapan tahun 2023 – 2028 maka Berikut kami sampaikan beberapa teknis terkait pelaksanaan perencanaan kegiatan Satuan Kegiatan Ekstrakurikuler Mahasiswa (SKEM)/ program Merdeka Belajar–Kampus Merdeka (MB-KM) disampaikan bahwa:', 'A. Bagi Mahasiswa 1. Membuat perencanaan Kegiatan SKEM/ Program MB-KM dilaksanakan di awal semester. 2. Memilih kelas MB-KM secara mandiri melalui menu Formulir Rencana Studi (FRS) di SI Akademik. 3. Membuat dan menyimpan usulan portofolio yang tersedia di myITS StudentConnect untuk 1 (satu) semester ke depan. 4. Merencanakan SKEM dan memetakan portofolio (sehubungan dengan Bentuk Kegiatan Pembelajaran/ BKP MB-KM) yang telah diusulkan dengan sks mata kuliah yang ingin dikonversikan. 5. Melakukan perwalian dengan dosen wali untuk kemudian mendapatkan persetujuan FRS. 6. Panduan pengguna dan rencana kegiatan SKEM/ Program MB-KM dan penjelasan terkait lainnya dapat diakses di link https://its.id/panduan-rencana-skem-MBKM dan https://its.id/RencanaKegiatanSKEMMBKM . 7. Bagi mahasiswa yang merencanakan Program MB-KM, mengajukan Form 1 Matching Up Program MB-KM Ke MK Inti Prodi (jika konversi kegiatan ke Mata Kuliah Inti) dan Form 2 Surat Permohonan Kredit Transfer (Learning Agreement). 8.', 'B. Bagi Dosen Wali 1. Melakukan pendampingan dan pengecekan dari pengajuan perencanaan kegiatan SKEM/ program MB-KM yang diajukan oleh mahasiswa. 2. Jika dinilai sudah sesuai pengajuan perencanaan Kegiatan SKEM/ Program MB-KM oleh mahasiswa, dosen wali dapat melakukan persetujuan FRS. \nDemikian Surat Edaran ini dibuat untuk dilaksanakan dengan sebaik - baiknya. Atas perhatiannya diucapkan terimakasih.']","SKEM membantu Departemen di ITS dengan memberikan panduan dan prosedur terkait perencanaan kegiatan ekstrakurikuler mahasiswa serta program Merdeka Belajar–Kampus Merdeka (MB-KM). SKEM juga membantu dalam proses konversi kegiatan ke mata kuliah inti dan memberikan panduan kepada mahasiswa dan dosen wali terkait perencanaan kegiatan tersebut. Dengan adanya SKEM, diharapkan mahasiswa dapat merencanakan kegiatan ekstrakurikuler dengan lebih terstruktur dan mendapatkan persetujuan dari dosen wali untuk melaksanakan kegiatan tersebut."
19,Mengapa penting untuk mengunggah kegiatan mahasiswa di myITS StudentConnect? ,"Karena bukti atau dokumen pendukung kegiatan SKEM harus diunggah di myITS StudentConnect dalam waktu satu tahun semenjak selesai kegiatan, jika melebihi batas waktu tersebut, kegiatan dinyatakan tidak berlaku.","['Sehubungan dengan kurikulum Program Sarjana dan Sarjana Terapan tahun 2023 – 2028 maka Berikut kami sampaikan beberapa teknis terkait pelaksanaan perencanaan kegiatan Satuan Kegiatan Ekstrakurikuler Mahasiswa (SKEM)/ program Merdeka Belajar–Kampus Merdeka (MB-KM) disampaikan bahwa:', 'A. Bagi Mahasiswa 1. Membuat perencanaan Kegiatan SKEM/ Program MB-KM dilaksanakan di awal semester. 2. Memilih kelas MB-KM secara mandiri melalui menu Formulir Rencana Studi (FRS) di SI Akademik. 3. Membuat dan menyimpan usulan portofolio yang tersedia di myITS StudentConnect untuk 1 (satu) semester ke depan. 4. Merencanakan SKEM dan memetakan portofolio (sehubungan dengan Bentuk Kegiatan Pembelajaran/ BKP MB-KM) yang telah diusulkan dengan sks mata kuliah yang ingin dikonversikan. 5. Melakukan perwalian dengan dosen wali untuk kemudian mendapatkan persetujuan FRS. 6. Panduan pengguna dan rencana kegiatan SKEM/ Program MB-KM dan penjelasan terkait lainnya dapat diakses di link https://its.id/panduan-rencana-skem-MBKM dan https://its.id/RencanaKegiatanSKEMMBKM . 7. Bagi mahasiswa yang merencanakan Program MB-KM, mengajukan Form 1 Matching Up Program MB-KM Ke MK Inti Prodi (jika konversi kegiatan ke Mata Kuliah Inti) dan Form 2 Surat Permohonan Kredit Transfer (Learning Agreement). 8.', 'Program MB-KM, mengajukan Form 1 Matching Up Program MB-KM Ke MK Inti Prodi (jika konversi kegiatan ke Mata Kuliah Inti) dan Form 2 Surat Permohonan Kredit Transfer (Learning Agreement). 8. Form 1 dan Form 2 dapat diakses di link https://its.id/Form12SEWR1RencanaMBKM.', 'B. Bagi Dosen Wali 1. Melakukan pendampingan dan pengecekan dari pengajuan perencanaan kegiatan SKEM/ program MB-KM yang diajukan oleh mahasiswa. 2. Jika dinilai sudah sesuai pengajuan perencanaan Kegiatan SKEM/ Program MB-KM oleh mahasiswa, dosen wali dapat melakukan persetujuan FRS. \nDemikian Surat Edaran ini dibuat untuk dilaksanakan dengan sebaik - baiknya. Atas perhatiannya diucapkan terimakasih.']","Penting untuk mengunggah kegiatan mahasiswa di myITS StudentConnect karena dengan mengunggah kegiatan tersebut, mahasiswa dapat membuat dan menyimpan usulan portofolio untuk satu semester ke depan. Selain itu, dengan mengunggah kegiatan, mahasiswa dapat merencanakan kegiatan ekstrakurikuler dan memetakan portofolio yang telah diusulkan dengan sks mata kuliah yang ingin dikonversikan. Ini membantu dalam perencanaan dan pengelolaan kegiatan mahasiswa secara lebih terstruktur dan efisien."
