,question,answer,contexts,ground_truth,context_precision,faithfulness,answer_relevancy,context_recall
0,Apa tujuan utama dibuatnya Satuan Kredit Ekstrakurikuler Mahasiswa (SKEM)?,"Tujuan utama dibuatnya Satuan Kredit Ekstrakurikuler Mahasiswa (SKEM) adalah untuk memberikan kesempatan kepada mahasiswa untuk mengembangkan diri di luar kegiatan akademik, serta memberikan pengakuan atas kegiatan ekstrakurikuler yang telah dilakukan oleh mahasiswa melalui pemberian kredit yang dapat dikonversikan ke dalam sks mata kuliah.","['Sehubungan dengan kurikulum Program Sarjana dan Sarjana Terapan tahun 2023 – 2028 maka Berikut kami sampaikan beberapa teknis terkait pelaksanaan perencanaan kegiatan Satuan Kegiatan Ekstrakurikuler Mahasiswa (SKEM)/ program Merdeka Belajar–Kampus Merdeka (MB-KM) disampaikan bahwa:'
 'B. Bagi Dosen Wali 1. Melakukan pendampingan dan pengecekan dari pengajuan perencanaan kegiatan SKEM/ program MB-KM yang diajukan oleh mahasiswa. 2. Jika dinilai sudah sesuai pengajuan perencanaan Kegiatan SKEM/ Program MB-KM oleh mahasiswa, dosen wali dapat melakukan persetujuan FRS. \nDemikian Surat Edaran ini dibuat untuk dilaksanakan dengan sebaik - baiknya. Atas perhatiannya diucapkan terimakasih.'
 'A. Bagi Mahasiswa 1. Membuat perencanaan Kegiatan SKEM/ Program MB-KM dilaksanakan di awal semester. 2. Memilih kelas MB-KM secara mandiri melalui menu Formulir Rencana Studi (FRS) di SI Akademik. 3. Membuat dan menyimpan usulan portofolio yang tersedia di myITS StudentConnect untuk 1 (satu) semester ke depan. 4. Merencanakan SKEM dan memetakan portofolio (sehubungan dengan Bentuk Kegiatan Pembelajaran/ BKP MB-KM) yang telah diusulkan dengan sks mata kuliah yang ingin dikonversikan. 5. Melakukan perwalian dengan dosen wali untuk kemudian mendapatkan persetujuan FRS. 6. Panduan pengguna dan rencana kegiatan SKEM/ Program MB-KM dan penjelasan terkait lainnya dapat diakses di link https://its.id/panduan-rencana-skem-MBKM dan https://its.id/RencanaKegiatanSKEMMBKM . 7. Bagi mahasiswa yang merencanakan Program MB-KM, mengajukan Form 1 Matching Up Program MB-KM Ke MK Inti Prodi (jika konversi kegiatan ke Mata Kuliah Inti) dan Form 2 Surat Permohonan Kredit Transfer (Learning Agreement). 8.'
 'Nomor : 1710/IT2.I/T/TU.00.08/II/2024 Perihal : Pelaksanaan Perencanaan Kegiatan SKEM/ Program MB-KM Lampiran : 1 lembar \nKepada Yth. Para Dekan Para Kepala Departemen Para Kepala Program Studi Sarjana dan Sarjana Terapan di Tempat']","Tujuan utama dibuatnya SKEM adalah untuk menanamkan sikap ilmiah, merangsang daya kreasi dan inovasi, meningkatkan kemampuan meneliti, menulis karya ilmiah, meningkatkan kemampuan berkomunikasi, serta pemahaman profesi.",0.999999999975,0.5,0.9999999999999999,0.0
1,Apa masalah utama lulusan ITS yang diidentifikasi dalam dokumen?,Masalah utama lulusan ITS yang diidentifikasi dalam dokumen adalah kurangnya pendampingan dan pengecekan dari pengajuan perencanaan kegiatan SKEM/program MB-KM yang diajukan oleh mahasiswa oleh Dosen Wali.,"['Nomor : 1710/IT2.I/T/TU.00.08/II/2024 Perihal : Pelaksanaan Perencanaan Kegiatan SKEM/ Program MB-KM Lampiran : 1 lembar \nKepada Yth. Para Dekan Para Kepala Departemen Para Kepala Program Studi Sarjana dan Sarjana Terapan di Tempat'
 'B. Bagi Dosen Wali 1. Melakukan pendampingan dan pengecekan dari pengajuan perencanaan kegiatan SKEM/ program MB-KM yang diajukan oleh mahasiswa. 2. Jika dinilai sudah sesuai pengajuan perencanaan Kegiatan SKEM/ Program MB-KM oleh mahasiswa, dosen wali dapat melakukan persetujuan FRS. \nDemikian Surat Edaran ini dibuat untuk dilaksanakan dengan sebaik - baiknya. Atas perhatiannya diucapkan terimakasih.'
 'Surabaya, 12 Februari 2024 Wakil Rektor Bidang Akademik dan Kemahasiswaan, \nProf. Dr. Ir. Adi Soeprijanto, M.T. 196404051990021001'
 'Program MB-KM, mengajukan Form 1 Matching Up Program MB-KM Ke MK Inti Prodi (jika konversi kegiatan ke Mata Kuliah Inti) dan Form 2 Surat Permohonan Kredit Transfer (Learning Agreement). 8. Form 1 dan Form 2 dapat diakses di link https://its.id/Form12SEWR1RencanaMBKM.']","Masalah utama lulusan ITS adalah leadership, interpersonal skill, teamwork, dan endurance.",0.8055555555287036,1.0,0.9920336243167913,0.0
2,Berapa minimal kredit SKEM yang dibutuhkan untuk Sarjana dan Sarjana Terapan? ,Minimal kredit SKEM yang dibutuhkan untuk Sarjana dan Sarjana Terapan adalah 144 kredit.,"['Sehubungan dengan kurikulum Program Sarjana dan Sarjana Terapan tahun 2023 – 2028 maka Berikut kami sampaikan beberapa teknis terkait pelaksanaan perencanaan kegiatan Satuan Kegiatan Ekstrakurikuler Mahasiswa (SKEM)/ program Merdeka Belajar–Kampus Merdeka (MB-KM) disampaikan bahwa:'
 'B. Bagi Dosen Wali 1. Melakukan pendampingan dan pengecekan dari pengajuan perencanaan kegiatan SKEM/ program MB-KM yang diajukan oleh mahasiswa. 2. Jika dinilai sudah sesuai pengajuan perencanaan Kegiatan SKEM/ Program MB-KM oleh mahasiswa, dosen wali dapat melakukan persetujuan FRS. \nDemikian Surat Edaran ini dibuat untuk dilaksanakan dengan sebaik - baiknya. Atas perhatiannya diucapkan terimakasih.'
 'Nomor : 1710/IT2.I/T/TU.00.08/II/2024 Perihal : Pelaksanaan Perencanaan Kegiatan SKEM/ Program MB-KM Lampiran : 1 lembar \nKepada Yth. Para Dekan Para Kepala Departemen Para Kepala Program Studi Sarjana dan Sarjana Terapan di Tempat'
 'Program MB-KM, mengajukan Form 1 Matching Up Program MB-KM Ke MK Inti Prodi (jika konversi kegiatan ke Mata Kuliah Inti) dan Form 2 Surat Permohonan Kredit Transfer (Learning Agreement). 8. Form 1 dan Form 2 dapat diakses di link https://its.id/Form12SEWR1RencanaMBKM.']",Minimal kredit SKEM yang dibutuhkan untuk Sarjana dan Sarjana Terapan adalah 100 kredit.,0.9999999999666667,0.0,0.9937163358568389,0.0
3,Bagaimana sistem SKEM 2021 membantu dosen wali?,"Sistem SKEM 2021 membantu dosen wali dengan memungkinkan mahasiswa untuk melakukan perwalian dengan dosen wali untuk kemudian mendapatkan persetujuan Formulir Rencana Studi (FRS). Dengan adanya sistem ini, dosen wali dapat memberikan persetujuan terhadap rencana kegiatan SKEM/ Program MB-KM yang telah direncanakan oleh mahasiswa.","['Nomor : 1710/IT2.I/T/TU.00.08/II/2024 Perihal : Pelaksanaan Perencanaan Kegiatan SKEM/ Program MB-KM Lampiran : 1 lembar \nKepada Yth. Para Dekan Para Kepala Departemen Para Kepala Program Studi Sarjana dan Sarjana Terapan di Tempat'
 'Sehubungan dengan kurikulum Program Sarjana dan Sarjana Terapan tahun 2023 – 2028 maka Berikut kami sampaikan beberapa teknis terkait pelaksanaan perencanaan kegiatan Satuan Kegiatan Ekstrakurikuler Mahasiswa (SKEM)/ program Merdeka Belajar–Kampus Merdeka (MB-KM) disampaikan bahwa:'
 'Program MB-KM, mengajukan Form 1 Matching Up Program MB-KM Ke MK Inti Prodi (jika konversi kegiatan ke Mata Kuliah Inti) dan Form 2 Surat Permohonan Kredit Transfer (Learning Agreement). 8. Form 1 dan Form 2 dapat diakses di link https://its.id/Form12SEWR1RencanaMBKM.'
 'A. Bagi Mahasiswa 1. Membuat perencanaan Kegiatan SKEM/ Program MB-KM dilaksanakan di awal semester. 2. Memilih kelas MB-KM secara mandiri melalui menu Formulir Rencana Studi (FRS) di SI Akademik. 3. Membuat dan menyimpan usulan portofolio yang tersedia di myITS StudentConnect untuk 1 (satu) semester ke depan. 4. Merencanakan SKEM dan memetakan portofolio (sehubungan dengan Bentuk Kegiatan Pembelajaran/ BKP MB-KM) yang telah diusulkan dengan sks mata kuliah yang ingin dikonversikan. 5. Melakukan perwalian dengan dosen wali untuk kemudian mendapatkan persetujuan FRS. 6. Panduan pengguna dan rencana kegiatan SKEM/ Program MB-KM dan penjelasan terkait lainnya dapat diakses di link https://its.id/panduan-rencana-skem-MBKM dan https://its.id/RencanaKegiatanSKEMMBKM . 7. Bagi mahasiswa yang merencanakan Program MB-KM, mengajukan Form 1 Matching Up Program MB-KM Ke MK Inti Prodi (jika konversi kegiatan ke Mata Kuliah Inti) dan Form 2 Surat Permohonan Kredit Transfer (Learning Agreement). 8.']",Sistem SKEM 2021 membantu dosen wali dalam mengidentifikasikan potensi dan kendala anak wali dalam pengembangan soft skills-nya dan memudahkan dalam evaluasi serta verifikasi secara bertahap setiap semester.,0.999999999975,0.4,0.9862145563663635,0.0
4,Apa peran SKEM bagi industri atau pengguna lulusan ITS?,"SKEM (Satuan Kegiatan Ekstrakurikuler Mahasiswa) memiliki peran penting bagi industri atau pengguna lulusan ITS karena melalui kegiatan SKEM, mahasiswa dapat mengembangkan keterampilan dan pengetahuan tambahan di luar kurikulum yang dapat meningkatkan kualitas dan kompetensi lulusan. Dengan demikian, lulusan ITS yang telah aktif dalam kegiatan SKEM diharapkan memiliki keunggulan kompetitif dan siap untuk memasuki dunia kerja yang sesuai dengan tuntutan industri.","['Nomor : 1710/IT2.I/T/TU.00.08/II/2024 Perihal : Pelaksanaan Perencanaan Kegiatan SKEM/ Program MB-KM Lampiran : 1 lembar \nKepada Yth. Para Dekan Para Kepala Departemen Para Kepala Program Studi Sarjana dan Sarjana Terapan di Tempat'
 'Sehubungan dengan kurikulum Program Sarjana dan Sarjana Terapan tahun 2023 – 2028 maka Berikut kami sampaikan beberapa teknis terkait pelaksanaan perencanaan kegiatan Satuan Kegiatan Ekstrakurikuler Mahasiswa (SKEM)/ program Merdeka Belajar–Kampus Merdeka (MB-KM) disampaikan bahwa:'
 'Surabaya, 12 Februari 2024 Wakil Rektor Bidang Akademik dan Kemahasiswaan, \nProf. Dr. Ir. Adi Soeprijanto, M.T. 196404051990021001'
 'B. Bagi Dosen Wali 1. Melakukan pendampingan dan pengecekan dari pengajuan perencanaan kegiatan SKEM/ program MB-KM yang diajukan oleh mahasiswa. 2. Jika dinilai sudah sesuai pengajuan perencanaan Kegiatan SKEM/ Program MB-KM oleh mahasiswa, dosen wali dapat melakukan persetujuan FRS. \nDemikian Surat Edaran ini dibuat untuk dilaksanakan dengan sebaik - baiknya. Atas perhatiannya diucapkan terimakasih.']","SKEM membantu industri atau pengguna lulusan ITS untuk mengetahui rekam jejak dibidang pengembangan soft skills mahasiswa selama kuliah di ITS, meningkatkan kepercayaan dalam merekrut lulusan ITS.",0.999999999975,0.0,0.9924116475953939,0.5
5,Kegiatan mahasiswa dari tahun berapa mulai harus terverifikasi secara otomatis oleh sistem? ,Kegiatan mahasiswa mulai harus terverifikasi secara otomatis oleh sistem mulai dari tahun 2023 - 2028 berdasarkan kurikulum Program Sarjana dan Sarjana Terapan yang berlaku.,"['B. Bagi Dosen Wali 1. Melakukan pendampingan dan pengecekan dari pengajuan perencanaan kegiatan SKEM/ program MB-KM yang diajukan oleh mahasiswa. 2. Jika dinilai sudah sesuai pengajuan perencanaan Kegiatan SKEM/ Program MB-KM oleh mahasiswa, dosen wali dapat melakukan persetujuan FRS. \nDemikian Surat Edaran ini dibuat untuk dilaksanakan dengan sebaik - baiknya. Atas perhatiannya diucapkan terimakasih.'
 'Nomor : 1710/IT2.I/T/TU.00.08/II/2024 Perihal : Pelaksanaan Perencanaan Kegiatan SKEM/ Program MB-KM Lampiran : 1 lembar \nKepada Yth. Para Dekan Para Kepala Departemen Para Kepala Program Studi Sarjana dan Sarjana Terapan di Tempat'
 'Surabaya, 12 Februari 2024 Wakil Rektor Bidang Akademik dan Kemahasiswaan, \nProf. Dr. Ir. Adi Soeprijanto, M.T. 196404051990021001'
 'Sehubungan dengan kurikulum Program Sarjana dan Sarjana Terapan tahun 2023 – 2028 maka Berikut kami sampaikan beberapa teknis terkait pelaksanaan perencanaan kegiatan Satuan Kegiatan Ekstrakurikuler Mahasiswa (SKEM)/ program Merdeka Belajar–Kampus Merdeka (MB-KM) disampaikan bahwa:']",Kegiatan mahasiswa dari tahun 2019 ke bawah akan terverifikasi secara otomatis oleh sistem.,0.999999999975,0.0,0.9826548135380536,0.0
6,Apa yang harus dilakukan mahasiswa jika kegiatan tidak diunggah dalam waktu 1 tahun?,"Mahasiswa harus mengajukan perencanaan kegiatan SKEM/program MB-KM kepada dosen wali untuk mendapatkan persetujuan FRS. Jika kegiatan tidak diunggah dalam waktu 1 tahun, mahasiswa perlu melakukan pendampingan dan pengecekan ulang terhadap pengajuan perencanaan kegiatan tersebut.","['Sehubungan dengan kurikulum Program Sarjana dan Sarjana Terapan tahun 2023 – 2028 maka Berikut kami sampaikan beberapa teknis terkait pelaksanaan perencanaan kegiatan Satuan Kegiatan Ekstrakurikuler Mahasiswa (SKEM)/ program Merdeka Belajar–Kampus Merdeka (MB-KM) disampaikan bahwa:'
 'Surabaya, 12 Februari 2024 Wakil Rektor Bidang Akademik dan Kemahasiswaan, \nProf. Dr. Ir. Adi Soeprijanto, M.T. 196404051990021001'
 'Nomor : 1710/IT2.I/T/TU.00.08/II/2024 Perihal : Pelaksanaan Perencanaan Kegiatan SKEM/ Program MB-KM Lampiran : 1 lembar \nKepada Yth. Para Dekan Para Kepala Departemen Para Kepala Program Studi Sarjana dan Sarjana Terapan di Tempat'
 'B. Bagi Dosen Wali 1. Melakukan pendampingan dan pengecekan dari pengajuan perencanaan kegiatan SKEM/ program MB-KM yang diajukan oleh mahasiswa. 2. Jika dinilai sudah sesuai pengajuan perencanaan Kegiatan SKEM/ Program MB-KM oleh mahasiswa, dosen wali dapat melakukan persetujuan FRS. \nDemikian Surat Edaran ini dibuat untuk dilaksanakan dengan sebaik - baiknya. Atas perhatiannya diucapkan terimakasih.']","Jika kegiatan tidak diunggah dalam waktu 1 tahun, maka kegiatan tersebut dinyatakan hangus atau tidak bisa digunakan dalam SKEM.",0.999999999975,0.5,0.961760108338472,0.0
7,Kapan batas minimal kewajiban pemenuhan SKEM bagi mahasiswa?,"Batas minimal kewajiban pemenuhan SKEM bagi mahasiswa adalah pada semester 4. Pada semester tersebut, mahasiswa diwajibkan untuk mengajukan perencanaan kegiatan SKEM/Program MB-KM kepada dosen wali untuk mendapatkan persetujuan FRS.","['Sehubungan dengan kurikulum Program Sarjana dan Sarjana Terapan tahun 2023 – 2028 maka Berikut kami sampaikan beberapa teknis terkait pelaksanaan perencanaan kegiatan Satuan Kegiatan Ekstrakurikuler Mahasiswa (SKEM)/ program Merdeka Belajar–Kampus Merdeka (MB-KM) disampaikan bahwa:'
 'B. Bagi Dosen Wali 1. Melakukan pendampingan dan pengecekan dari pengajuan perencanaan kegiatan SKEM/ program MB-KM yang diajukan oleh mahasiswa. 2. Jika dinilai sudah sesuai pengajuan perencanaan Kegiatan SKEM/ Program MB-KM oleh mahasiswa, dosen wali dapat melakukan persetujuan FRS. \nDemikian Surat Edaran ini dibuat untuk dilaksanakan dengan sebaik - baiknya. Atas perhatiannya diucapkan terimakasih.'
 'Nomor : 1710/IT2.I/T/TU.00.08/II/2024 Perihal : Pelaksanaan Perencanaan Kegiatan SKEM/ Program MB-KM Lampiran : 1 lembar \nKepada Yth. Para Dekan Para Kepala Departemen Para Kepala Program Studi Sarjana dan Sarjana Terapan di Tempat'
 'Program MB-KM, mengajukan Form 1 Matching Up Program MB-KM Ke MK Inti Prodi (jika konversi kegiatan ke Mata Kuliah Inti) dan Form 2 Surat Permohonan Kredit Transfer (Learning Agreement). 8. Form 1 dan Form 2 dapat diakses di link https://its.id/Form12SEWR1RencanaMBKM.']",Batas minimal kewajiban pemenuhan SKEM adalah sampai semester 6.,0.999999999975,0.3333333333333333,0.9915329211399505,0.0
8,Bagaimana IP SKEM dihitung?,"IP SKEM dihitung berdasarkan jumlah bobot mata kuliah yang diambil oleh mahasiswa dalam kegiatan SKEM, kemudian dibagi dengan total bobot mata kuliah yang diambil. Bobot mata kuliah dapat dilihat dari nilai mata kuliah yang diambil oleh mahasiswa. Jika terdapat konversi kegiatan ke Mata Kuliah Inti, maka mahasiswa perlu mengajukan Form 1 Matching Up Program MB-KM Ke MK Inti Prodi dan Form 2 Surat Permohonan Kredit Transfer (Learning Agreement). Form 1 dan Form 2 dapat diakses melalui link https://its.id/Form12SEWR1RencanaMBKM.","['B. Bagi Dosen Wali 1. Melakukan pendampingan dan pengecekan dari pengajuan perencanaan kegiatan SKEM/ program MB-KM yang diajukan oleh mahasiswa. 2. Jika dinilai sudah sesuai pengajuan perencanaan Kegiatan SKEM/ Program MB-KM oleh mahasiswa, dosen wali dapat melakukan persetujuan FRS. \nDemikian Surat Edaran ini dibuat untuk dilaksanakan dengan sebaik - baiknya. Atas perhatiannya diucapkan terimakasih.'
 'Program MB-KM, mengajukan Form 1 Matching Up Program MB-KM Ke MK Inti Prodi (jika konversi kegiatan ke Mata Kuliah Inti) dan Form 2 Surat Permohonan Kredit Transfer (Learning Agreement). 8. Form 1 dan Form 2 dapat diakses di link https://its.id/Form12SEWR1RencanaMBKM.'
 'Nomor : 1710/IT2.I/T/TU.00.08/II/2024 Perihal : Pelaksanaan Perencanaan Kegiatan SKEM/ Program MB-KM Lampiran : 1 lembar \nKepada Yth. Para Dekan Para Kepala Departemen Para Kepala Program Studi Sarjana dan Sarjana Terapan di Tempat'
 'Sehubungan dengan kurikulum Program Sarjana dan Sarjana Terapan tahun 2023 – 2028 maka Berikut kami sampaikan beberapa teknis terkait pelaksanaan perencanaan kegiatan Satuan Kegiatan Ekstrakurikuler Mahasiswa (SKEM)/ program Merdeka Belajar–Kampus Merdeka (MB-KM) disampaikan bahwa:']","IP SKEM dihitung dengan formulasi: Indeks Prestasi SKEM = (∑ Ki × Ni) / ∑ Kredit SKEM, di mana N adalah nilai numerik hasil evaluasi kegiatan, K adalah besar SKEM kegiatan, dan jumlah kegiatan yang diambil.",0.999999999975,0.4,0.9225593595888069,0.0
9,Apa yang harus dilakukan dosen wali jika anak wali memiliki IP SKEM di bawah 2.1?,"Dosen wali harus melakukan pendampingan dan pengecekan dari pengajuan perencanaan kegiatan SKEM/ program MB-KM yang diajukan oleh mahasiswa. Jika dinilai sudah sesuai pengajuan perencanaan kegiatan SKEM/ Program MB-KM oleh mahasiswa, dosen wali dapat melakukan persetujuan FRS.","['Nomor : 1710/IT2.I/T/TU.00.08/II/2024 Perihal : Pelaksanaan Perencanaan Kegiatan SKEM/ Program MB-KM Lampiran : 1 lembar \nKepada Yth. Para Dekan Para Kepala Departemen Para Kepala Program Studi Sarjana dan Sarjana Terapan di Tempat'
 'B. Bagi Dosen Wali 1. Melakukan pendampingan dan pengecekan dari pengajuan perencanaan kegiatan SKEM/ program MB-KM yang diajukan oleh mahasiswa. 2. Jika dinilai sudah sesuai pengajuan perencanaan Kegiatan SKEM/ Program MB-KM oleh mahasiswa, dosen wali dapat melakukan persetujuan FRS. \nDemikian Surat Edaran ini dibuat untuk dilaksanakan dengan sebaik - baiknya. Atas perhatiannya diucapkan terimakasih.'
 'Sehubungan dengan kurikulum Program Sarjana dan Sarjana Terapan tahun 2023 – 2028 maka Berikut kami sampaikan beberapa teknis terkait pelaksanaan perencanaan kegiatan Satuan Kegiatan Ekstrakurikuler Mahasiswa (SKEM)/ program Merdeka Belajar–Kampus Merdeka (MB-KM) disampaikan bahwa:'
 'Program MB-KM, mengajukan Form 1 Matching Up Program MB-KM Ke MK Inti Prodi (jika konversi kegiatan ke Mata Kuliah Inti) dan Form 2 Surat Permohonan Kredit Transfer (Learning Agreement). 8. Form 1 dan Form 2 dapat diakses di link https://its.id/Form12SEWR1RencanaMBKM.']",Dosen wali harus mengingatkan mahasiswa untuk memenuhi persyaratan IP SKEM minimal pada semester berikutnya.,0.999999999975,1.0,0.8818163005409945,0.0
10,Kapan mahasiswa Angkatan 2018 dan 2019 dapat memulai SKEM?,"Mahasiswa Angkatan 2018 dan 2019 dapat memulai SKEM setelah melakukan pendampingan dan pengecekan dari pengajuan perencanaan kegiatan SKEM/program MB-KM yang diajukan oleh mahasiswa oleh dosen wali. Jika pengajuan perencanaan kegiatan sudah dinilai sesuai, dosen wali dapat melakukan persetujuan FRS.","['Sehubungan dengan kurikulum Program Sarjana dan Sarjana Terapan tahun 2023 – 2028 maka Berikut kami sampaikan beberapa teknis terkait pelaksanaan perencanaan kegiatan Satuan Kegiatan Ekstrakurikuler Mahasiswa (SKEM)/ program Merdeka Belajar–Kampus Merdeka (MB-KM) disampaikan bahwa:'
 'Nomor : 1710/IT2.I/T/TU.00.08/II/2024 Perihal : Pelaksanaan Perencanaan Kegiatan SKEM/ Program MB-KM Lampiran : 1 lembar \nKepada Yth. Para Dekan Para Kepala Departemen Para Kepala Program Studi Sarjana dan Sarjana Terapan di Tempat'
 'B. Bagi Dosen Wali 1. Melakukan pendampingan dan pengecekan dari pengajuan perencanaan kegiatan SKEM/ program MB-KM yang diajukan oleh mahasiswa. 2. Jika dinilai sudah sesuai pengajuan perencanaan Kegiatan SKEM/ Program MB-KM oleh mahasiswa, dosen wali dapat melakukan persetujuan FRS. \nDemikian Surat Edaran ini dibuat untuk dilaksanakan dengan sebaik - baiknya. Atas perhatiannya diucapkan terimakasih.'
 'Surabaya, 12 Februari 2024 Wakil Rektor Bidang Akademik dan Kemahasiswaan, \nProf. Dr. Ir. Adi Soeprijanto, M.T. 196404051990021001']","Mahasiswa Angkatan 2018 dapat memulai SKEM pada semester 6, sedangkan Angkatan 2019 pada semester 4.",0.999999999975,0.5,0.9553109861586933,0.0
11,Apakah kegiatan sebelum menjadi mahasiswa ITS dapat diajukan untuk SKEM,"Tidak, kegiatan sebelum menjadi mahasiswa ITS tidak dapat diajukan untuk SKEM. Kegiatan yang dapat diajukan untuk SKEM adalah kegiatan yang terkait dengan Program Merdeka Belajar–Kampus Merdeka (MB-KM) setelah mahasiswa menjadi mahasiswa ITS.","['Sehubungan dengan kurikulum Program Sarjana dan Sarjana Terapan tahun 2023 – 2028 maka Berikut kami sampaikan beberapa teknis terkait pelaksanaan perencanaan kegiatan Satuan Kegiatan Ekstrakurikuler Mahasiswa (SKEM)/ program Merdeka Belajar–Kampus Merdeka (MB-KM) disampaikan bahwa:'
 'B. Bagi Dosen Wali 1. Melakukan pendampingan dan pengecekan dari pengajuan perencanaan kegiatan SKEM/ program MB-KM yang diajukan oleh mahasiswa. 2. Jika dinilai sudah sesuai pengajuan perencanaan Kegiatan SKEM/ Program MB-KM oleh mahasiswa, dosen wali dapat melakukan persetujuan FRS. \nDemikian Surat Edaran ini dibuat untuk dilaksanakan dengan sebaik - baiknya. Atas perhatiannya diucapkan terimakasih.'
 'Program MB-KM, mengajukan Form 1 Matching Up Program MB-KM Ke MK Inti Prodi (jika konversi kegiatan ke Mata Kuliah Inti) dan Form 2 Surat Permohonan Kredit Transfer (Learning Agreement). 8. Form 1 dan Form 2 dapat diakses di link https://its.id/Form12SEWR1RencanaMBKM.'
 'Nomor : 1710/IT2.I/T/TU.00.08/II/2024 Perihal : Pelaksanaan Perencanaan Kegiatan SKEM/ Program MB-KM Lampiran : 1 lembar \nKepada Yth. Para Dekan Para Kepala Departemen Para Kepala Program Studi Sarjana dan Sarjana Terapan di Tempat']","Tidak, kegiatan yang dilakukan sebelum menjadi mahasiswa ITS tidak diakui untuk SKEM.",0.999999999975,0.5,0.9845768964177996,1.0
12,"Siapa yang melakukan verifikasi kegiatan magang, wirausaha, kompetisi dan abdimas?","Dosen wali yang melakukan verifikasi kegiatan magang, wirausaha, kompetisi, dan abdimas. Jika dinilai sudah sesuai pengajuan perencanaan kegiatan SKEM/ Program MB-KM oleh mahasiswa, dosen wali dapat melakukan persetujuan FRS.","['Sehubungan dengan kurikulum Program Sarjana dan Sarjana Terapan tahun 2023 – 2028 maka Berikut kami sampaikan beberapa teknis terkait pelaksanaan perencanaan kegiatan Satuan Kegiatan Ekstrakurikuler Mahasiswa (SKEM)/ program Merdeka Belajar–Kampus Merdeka (MB-KM) disampaikan bahwa:'
 'B. Bagi Dosen Wali 1. Melakukan pendampingan dan pengecekan dari pengajuan perencanaan kegiatan SKEM/ program MB-KM yang diajukan oleh mahasiswa. 2. Jika dinilai sudah sesuai pengajuan perencanaan Kegiatan SKEM/ Program MB-KM oleh mahasiswa, dosen wali dapat melakukan persetujuan FRS. \nDemikian Surat Edaran ini dibuat untuk dilaksanakan dengan sebaik - baiknya. Atas perhatiannya diucapkan terimakasih.'
 'Surabaya, 12 Februari 2024 Wakil Rektor Bidang Akademik dan Kemahasiswaan, \nProf. Dr. Ir. Adi Soeprijanto, M.T. 196404051990021001'
 'Program MB-KM, mengajukan Form 1 Matching Up Program MB-KM Ke MK Inti Prodi (jika konversi kegiatan ke Mata Kuliah Inti) dan Form 2 Surat Permohonan Kredit Transfer (Learning Agreement). 8. Form 1 dan Form 2 dapat diakses di link https://its.id/Form12SEWR1RencanaMBKM.']","Verifikasi dilakukan oleh Ditmawa (kemahasiswaan), DRPM (abdimas), DKG (internasionalisasi), dan dosen wali untuk kegiatan lainnya.",0.999999999975,0.5,0.8647671620846706,0.0
13,Apa yang dimaksud dengan pengisian SKEM pada semester 2 dan semester 8 (untuk Sarjana),"SKEM merupakan singkatan dari Satuan Kegiatan Ekstrakurikuler Mahasiswa. Pengisian SKEM pada semester 2 dan semester 8 untuk Sarjana adalah proses dimana mahasiswa membuat perencanaan kegiatan SKEM atau Program Merdeka Belajar–Kampus Merdeka (MB-KM) di awal semester. Pada semester 2, mahasiswa harus memilih kelas MB-KM secara mandiri melalui menu Formulir Rencana Studi (FRS) di SI Akademik, membuat dan menyimpan usulan portofolio untuk satu semester ke depan, merencanakan SKEM dan memetakan portofolio yang telah diusulkan dengan sks mata kuliah yang ingin dikonversikan, melakukan perwalian dengan dosen wali untuk mendapatkan persetujuan FRS, serta mengajukan Form 1 Matching Up Program MB-KM Ke MK Inti Prodi (jika konversi kegiatan ke Mata Kuliah Inti) dan Form 2 Surat Permohonan Kredit Transfer (Learning Agreement). Sedangkan pada semester 8, proses pengisian SKEM akan melibatkan dosen wali yang akan melakukan pendampingan dan pengecekan dari pengajuan perencanaan kegiatan SKEM/program MB-KM yang diajukan oleh mahasiswa. Jika dinilai sudah sesuai, dosen wali dapat memberikan persetujuan FRS.","['Sehubungan dengan kurikulum Program Sarjana dan Sarjana Terapan tahun 2023 – 2028 maka Berikut kami sampaikan beberapa teknis terkait pelaksanaan perencanaan kegiatan Satuan Kegiatan Ekstrakurikuler Mahasiswa (SKEM)/ program Merdeka Belajar–Kampus Merdeka (MB-KM) disampaikan bahwa:'
 'A. Bagi Mahasiswa 1. Membuat perencanaan Kegiatan SKEM/ Program MB-KM dilaksanakan di awal semester. 2. Memilih kelas MB-KM secara mandiri melalui menu Formulir Rencana Studi (FRS) di SI Akademik. 3. Membuat dan menyimpan usulan portofolio yang tersedia di myITS StudentConnect untuk 1 (satu) semester ke depan. 4. Merencanakan SKEM dan memetakan portofolio (sehubungan dengan Bentuk Kegiatan Pembelajaran/ BKP MB-KM) yang telah diusulkan dengan sks mata kuliah yang ingin dikonversikan. 5. Melakukan perwalian dengan dosen wali untuk kemudian mendapatkan persetujuan FRS. 6. Panduan pengguna dan rencana kegiatan SKEM/ Program MB-KM dan penjelasan terkait lainnya dapat diakses di link https://its.id/panduan-rencana-skem-MBKM dan https://its.id/RencanaKegiatanSKEMMBKM . 7. Bagi mahasiswa yang merencanakan Program MB-KM, mengajukan Form 1 Matching Up Program MB-KM Ke MK Inti Prodi (jika konversi kegiatan ke Mata Kuliah Inti) dan Form 2 Surat Permohonan Kredit Transfer (Learning Agreement). 8.'
 'Nomor : 1710/IT2.I/T/TU.00.08/II/2024 Perihal : Pelaksanaan Perencanaan Kegiatan SKEM/ Program MB-KM Lampiran : 1 lembar \nKepada Yth. Para Dekan Para Kepala Departemen Para Kepala Program Studi Sarjana dan Sarjana Terapan di Tempat'
 'B. Bagi Dosen Wali 1. Melakukan pendampingan dan pengecekan dari pengajuan perencanaan kegiatan SKEM/ program MB-KM yang diajukan oleh mahasiswa. 2. Jika dinilai sudah sesuai pengajuan perencanaan Kegiatan SKEM/ Program MB-KM oleh mahasiswa, dosen wali dapat melakukan persetujuan FRS. \nDemikian Surat Edaran ini dibuat untuk dilaksanakan dengan sebaik - baiknya. Atas perhatiannya diucapkan terimakasih.']","Pengisian SKEM hanya terlihat paling banyak pada semester 2 dan semester 8, sehingga tidak terbaca bagaimana peningkatan softskills mahasiswa setiap semester.",0.999999999975,1.0,0.8778810759890495,0.0
14,Kegiatan apa yang diwajibkan bagi mahasiswa dalam SKEM baru?,"Mahasiswa diwajibkan untuk mengajukan perencanaan kegiatan SKEM/Program MB-KM kepada dosen wali. Jika perencanaan kegiatan tersebut dinilai sudah sesuai, maka dosen wali dapat melakukan persetujuan FRS.","['Sehubungan dengan kurikulum Program Sarjana dan Sarjana Terapan tahun 2023 – 2028 maka Berikut kami sampaikan beberapa teknis terkait pelaksanaan perencanaan kegiatan Satuan Kegiatan Ekstrakurikuler Mahasiswa (SKEM)/ program Merdeka Belajar–Kampus Merdeka (MB-KM) disampaikan bahwa:'
 'B. Bagi Dosen Wali 1. Melakukan pendampingan dan pengecekan dari pengajuan perencanaan kegiatan SKEM/ program MB-KM yang diajukan oleh mahasiswa. 2. Jika dinilai sudah sesuai pengajuan perencanaan Kegiatan SKEM/ Program MB-KM oleh mahasiswa, dosen wali dapat melakukan persetujuan FRS. \nDemikian Surat Edaran ini dibuat untuk dilaksanakan dengan sebaik - baiknya. Atas perhatiannya diucapkan terimakasih.'
 'Surabaya, 12 Februari 2024 Wakil Rektor Bidang Akademik dan Kemahasiswaan, \nProf. Dr. Ir. Adi Soeprijanto, M.T. 196404051990021001'
 'Nomor : 1710/IT2.I/T/TU.00.08/II/2024 Perihal : Pelaksanaan Perencanaan Kegiatan SKEM/ Program MB-KM Lampiran : 1 lembar \nKepada Yth. Para Dekan Para Kepala Departemen Para Kepala Program Studi Sarjana dan Sarjana Terapan di Tempat']",Mahasiswa wajib mengikuti kegiatan Program Kreativitas Mahasiswa (PKM) dan olahraga selama menempuh kuliah di ITS.,0.999999999975,1.0,0.8983655706457995,0.0
15,Bagaimana penilaian untuk kompetisi dalam SKEM?,"Dalam SKEM, penilaian untuk kompetisi dilakukan berdasarkan pengajuan perencanaan kegiatan SKEM/program MB-KM yang diajukan oleh mahasiswa. Dosen wali akan melakukan pendampingan dan pengecekan terhadap pengajuan tersebut. Jika dinilai sudah sesuai dengan pengajuan perencanaan kegiatan SKEM/program MB-KM oleh mahasiswa, dosen wali dapat memberikan persetujuan FRS.","['B. Bagi Dosen Wali 1. Melakukan pendampingan dan pengecekan dari pengajuan perencanaan kegiatan SKEM/ program MB-KM yang diajukan oleh mahasiswa. 2. Jika dinilai sudah sesuai pengajuan perencanaan Kegiatan SKEM/ Program MB-KM oleh mahasiswa, dosen wali dapat melakukan persetujuan FRS. \nDemikian Surat Edaran ini dibuat untuk dilaksanakan dengan sebaik - baiknya. Atas perhatiannya diucapkan terimakasih.'
 'Sehubungan dengan kurikulum Program Sarjana dan Sarjana Terapan tahun 2023 – 2028 maka Berikut kami sampaikan beberapa teknis terkait pelaksanaan perencanaan kegiatan Satuan Kegiatan Ekstrakurikuler Mahasiswa (SKEM)/ program Merdeka Belajar–Kampus Merdeka (MB-KM) disampaikan bahwa:'
 'Nomor : 1710/IT2.I/T/TU.00.08/II/2024 Perihal : Pelaksanaan Perencanaan Kegiatan SKEM/ Program MB-KM Lampiran : 1 lembar \nKepada Yth. Para Dekan Para Kepala Departemen Para Kepala Program Studi Sarjana dan Sarjana Terapan di Tempat'
 'Program MB-KM, mengajukan Form 1 Matching Up Program MB-KM Ke MK Inti Prodi (jika konversi kegiatan ke Mata Kuliah Inti) dan Form 2 Surat Permohonan Kredit Transfer (Learning Agreement). 8. Form 1 dan Form 2 dapat diakses di link https://its.id/Form12SEWR1RencanaMBKM.']","Penilaian kompetisi dinilai berdasarkan elemen jumlah peserta, skala, luaran, rentang waktu, bidang ilmu, dan level kompetisi.",0.999999999975,1.0,0.9929784728618841,0.0
16,Apa fungsi dokumen yang diunggah oleh mahasiswa dalam sistem SKEM?,Dokumen yang diunggah oleh mahasiswa dalam sistem SKEM adalah usulan portofolio yang tersedia di myITS StudentConnect untuk 1 (satu) semester ke depan.,"['Sehubungan dengan kurikulum Program Sarjana dan Sarjana Terapan tahun 2023 – 2028 maka Berikut kami sampaikan beberapa teknis terkait pelaksanaan perencanaan kegiatan Satuan Kegiatan Ekstrakurikuler Mahasiswa (SKEM)/ program Merdeka Belajar–Kampus Merdeka (MB-KM) disampaikan bahwa:'
 'B. Bagi Dosen Wali 1. Melakukan pendampingan dan pengecekan dari pengajuan perencanaan kegiatan SKEM/ program MB-KM yang diajukan oleh mahasiswa. 2. Jika dinilai sudah sesuai pengajuan perencanaan Kegiatan SKEM/ Program MB-KM oleh mahasiswa, dosen wali dapat melakukan persetujuan FRS. \nDemikian Surat Edaran ini dibuat untuk dilaksanakan dengan sebaik - baiknya. Atas perhatiannya diucapkan terimakasih.'
 'Nomor : 1710/IT2.I/T/TU.00.08/II/2024 Perihal : Pelaksanaan Perencanaan Kegiatan SKEM/ Program MB-KM Lampiran : 1 lembar \nKepada Yth. Para Dekan Para Kepala Departemen Para Kepala Program Studi Sarjana dan Sarjana Terapan di Tempat'
 'A. Bagi Mahasiswa 1. Membuat perencanaan Kegiatan SKEM/ Program MB-KM dilaksanakan di awal semester. 2. Memilih kelas MB-KM secara mandiri melalui menu Formulir Rencana Studi (FRS) di SI Akademik. 3. Membuat dan menyimpan usulan portofolio yang tersedia di myITS StudentConnect untuk 1 (satu) semester ke depan. 4. Merencanakan SKEM dan memetakan portofolio (sehubungan dengan Bentuk Kegiatan Pembelajaran/ BKP MB-KM) yang telah diusulkan dengan sks mata kuliah yang ingin dikonversikan. 5. Melakukan perwalian dengan dosen wali untuk kemudian mendapatkan persetujuan FRS. 6. Panduan pengguna dan rencana kegiatan SKEM/ Program MB-KM dan penjelasan terkait lainnya dapat diakses di link https://its.id/panduan-rencana-skem-MBKM dan https://its.id/RencanaKegiatanSKEMMBKM . 7. Bagi mahasiswa yang merencanakan Program MB-KM, mengajukan Form 1 Matching Up Program MB-KM Ke MK Inti Prodi (jika konversi kegiatan ke Mata Kuliah Inti) dan Form 2 Surat Permohonan Kredit Transfer (Learning Agreement). 8.']",Dokumen yang diunggah dapat digunakan sebagai CV dan SKPI (Surat Keterangan Pendamping Ijazah).,0.999999999975,1.0,0.9065048823626585,0.0
17,Apa scoring kelulusan minimal yang harus dicapai mahasiswa Sarjana dan Sarjana Terapan dalam SKEM?,Mahasiswa Sarjana dan Sarjana Terapan harus mencapai minimal skor 2.0 dalam SKEM untuk dapat lulus.,"['Sehubungan dengan kurikulum Program Sarjana dan Sarjana Terapan tahun 2023 – 2028 maka Berikut kami sampaikan beberapa teknis terkait pelaksanaan perencanaan kegiatan Satuan Kegiatan Ekstrakurikuler Mahasiswa (SKEM)/ program Merdeka Belajar–Kampus Merdeka (MB-KM) disampaikan bahwa:'
 'B. Bagi Dosen Wali 1. Melakukan pendampingan dan pengecekan dari pengajuan perencanaan kegiatan SKEM/ program MB-KM yang diajukan oleh mahasiswa. 2. Jika dinilai sudah sesuai pengajuan perencanaan Kegiatan SKEM/ Program MB-KM oleh mahasiswa, dosen wali dapat melakukan persetujuan FRS. \nDemikian Surat Edaran ini dibuat untuk dilaksanakan dengan sebaik - baiknya. Atas perhatiannya diucapkan terimakasih.'
 'Nomor : 1710/IT2.I/T/TU.00.08/II/2024 Perihal : Pelaksanaan Perencanaan Kegiatan SKEM/ Program MB-KM Lampiran : 1 lembar \nKepada Yth. Para Dekan Para Kepala Departemen Para Kepala Program Studi Sarjana dan Sarjana Terapan di Tempat'
 'A. Bagi Mahasiswa 1. Membuat perencanaan Kegiatan SKEM/ Program MB-KM dilaksanakan di awal semester. 2. Memilih kelas MB-KM secara mandiri melalui menu Formulir Rencana Studi (FRS) di SI Akademik. 3. Membuat dan menyimpan usulan portofolio yang tersedia di myITS StudentConnect untuk 1 (satu) semester ke depan. 4. Merencanakan SKEM dan memetakan portofolio (sehubungan dengan Bentuk Kegiatan Pembelajaran/ BKP MB-KM) yang telah diusulkan dengan sks mata kuliah yang ingin dikonversikan. 5. Melakukan perwalian dengan dosen wali untuk kemudian mendapatkan persetujuan FRS. 6. Panduan pengguna dan rencana kegiatan SKEM/ Program MB-KM dan penjelasan terkait lainnya dapat diakses di link https://its.id/panduan-rencana-skem-MBKM dan https://its.id/RencanaKegiatanSKEMMBKM . 7. Bagi mahasiswa yang merencanakan Program MB-KM, mengajukan Form 1 Matching Up Program MB-KM Ke MK Inti Prodi (jika konversi kegiatan ke Mata Kuliah Inti) dan Form 2 Surat Permohonan Kredit Transfer (Learning Agreement). 8.']",Scoring kelulusan minimal adalah 1300 untuk Sarjana dan Sarjana Terapan.,0.8333333332916666,0.0,0.9654838479789255,0.0
18,Bagaimana SKEM membantu Departemen di ITS?,"SKEM membantu Departemen di ITS dengan memberikan panduan dan prosedur bagi dosen wali dalam melakukan pendampingan dan pengecekan dari pengajuan perencanaan kegiatan SKEM/program MB-KM yang diajukan oleh mahasiswa. Selain itu, SKEM juga memungkinkan mahasiswa untuk membuat perencanaan kegiatan SKEM/program MB-KM di awal semester, memilih kelas MB-KM secara mandiri melalui menu Formulir Rencana Studi (FRS) di SI Akademik, dan melakukan perwalian dengan dosen wali untuk mendapatkan persetujuan FRS. SKEM juga memfasilitasi mahasiswa yang merencanakan Program MB-KM dengan mengajukan Form 1 Matching Up Program MB-KM Ke MK Inti Prodi dan Form 2 Surat Permohonan Kredit Transfer (Learning Agreement).","['Nomor : 1710/IT2.I/T/TU.00.08/II/2024 Perihal : Pelaksanaan Perencanaan Kegiatan SKEM/ Program MB-KM Lampiran : 1 lembar \nKepada Yth. Para Dekan Para Kepala Departemen Para Kepala Program Studi Sarjana dan Sarjana Terapan di Tempat'
 'B. Bagi Dosen Wali 1. Melakukan pendampingan dan pengecekan dari pengajuan perencanaan kegiatan SKEM/ program MB-KM yang diajukan oleh mahasiswa. 2. Jika dinilai sudah sesuai pengajuan perencanaan Kegiatan SKEM/ Program MB-KM oleh mahasiswa, dosen wali dapat melakukan persetujuan FRS. \nDemikian Surat Edaran ini dibuat untuk dilaksanakan dengan sebaik - baiknya. Atas perhatiannya diucapkan terimakasih.'
 'Program MB-KM, mengajukan Form 1 Matching Up Program MB-KM Ke MK Inti Prodi (jika konversi kegiatan ke Mata Kuliah Inti) dan Form 2 Surat Permohonan Kredit Transfer (Learning Agreement). 8. Form 1 dan Form 2 dapat diakses di link https://its.id/Form12SEWR1RencanaMBKM.'
 'A. Bagi Mahasiswa 1. Membuat perencanaan Kegiatan SKEM/ Program MB-KM dilaksanakan di awal semester. 2. Memilih kelas MB-KM secara mandiri melalui menu Formulir Rencana Studi (FRS) di SI Akademik. 3. Membuat dan menyimpan usulan portofolio yang tersedia di myITS StudentConnect untuk 1 (satu) semester ke depan. 4. Merencanakan SKEM dan memetakan portofolio (sehubungan dengan Bentuk Kegiatan Pembelajaran/ BKP MB-KM) yang telah diusulkan dengan sks mata kuliah yang ingin dikonversikan. 5. Melakukan perwalian dengan dosen wali untuk kemudian mendapatkan persetujuan FRS. 6. Panduan pengguna dan rencana kegiatan SKEM/ Program MB-KM dan penjelasan terkait lainnya dapat diakses di link https://its.id/panduan-rencana-skem-MBKM dan https://its.id/RencanaKegiatanSKEMMBKM . 7. Bagi mahasiswa yang merencanakan Program MB-KM, mengajukan Form 1 Matching Up Program MB-KM Ke MK Inti Prodi (jika konversi kegiatan ke Mata Kuliah Inti) dan Form 2 Surat Permohonan Kredit Transfer (Learning Agreement). 8.']",SKEM membantu Departemen untuk mendapatkan data pemetaan profil mahasiswa guna pengembangan soft skills dan untuk keperluan akreditasi internasional.,0.999999999975,1.0,0.9812824121531487,0.0
19,Mengapa penting untuk mengunggah kegiatan mahasiswa di myITS StudentConnect? ,"Penting untuk mengunggah kegiatan mahasiswa di myITS StudentConnect karena dengan mengunggah usulan portofolio ke dalam sistem tersebut, mahasiswa dapat merencanakan kegiatan SKEM/Program MB-KM untuk satu semester ke depan. Selain itu, dengan mengunggah kegiatan tersebut, mahasiswa dapat memetakan portofolio yang telah diusulkan dengan sks mata kuliah yang ingin dikonversikan. Hal ini membantu dalam proses perwalian dengan dosen wali untuk mendapatkan persetujuan FRS.","['A. Bagi Mahasiswa 1. Membuat perencanaan Kegiatan SKEM/ Program MB-KM dilaksanakan di awal semester. 2. Memilih kelas MB-KM secara mandiri melalui menu Formulir Rencana Studi (FRS) di SI Akademik. 3. Membuat dan menyimpan usulan portofolio yang tersedia di myITS StudentConnect untuk 1 (satu) semester ke depan. 4. Merencanakan SKEM dan memetakan portofolio (sehubungan dengan Bentuk Kegiatan Pembelajaran/ BKP MB-KM) yang telah diusulkan dengan sks mata kuliah yang ingin dikonversikan. 5. Melakukan perwalian dengan dosen wali untuk kemudian mendapatkan persetujuan FRS. 6. Panduan pengguna dan rencana kegiatan SKEM/ Program MB-KM dan penjelasan terkait lainnya dapat diakses di link https://its.id/panduan-rencana-skem-MBKM dan https://its.id/RencanaKegiatanSKEMMBKM . 7. Bagi mahasiswa yang merencanakan Program MB-KM, mengajukan Form 1 Matching Up Program MB-KM Ke MK Inti Prodi (jika konversi kegiatan ke Mata Kuliah Inti) dan Form 2 Surat Permohonan Kredit Transfer (Learning Agreement). 8.'
 'Nomor : 1710/IT2.I/T/TU.00.08/II/2024 Perihal : Pelaksanaan Perencanaan Kegiatan SKEM/ Program MB-KM Lampiran : 1 lembar \nKepada Yth. Para Dekan Para Kepala Departemen Para Kepala Program Studi Sarjana dan Sarjana Terapan di Tempat'
 'B. Bagi Dosen Wali 1. Melakukan pendampingan dan pengecekan dari pengajuan perencanaan kegiatan SKEM/ program MB-KM yang diajukan oleh mahasiswa. 2. Jika dinilai sudah sesuai pengajuan perencanaan Kegiatan SKEM/ Program MB-KM oleh mahasiswa, dosen wali dapat melakukan persetujuan FRS. \nDemikian Surat Edaran ini dibuat untuk dilaksanakan dengan sebaik - baiknya. Atas perhatiannya diucapkan terimakasih.'
 'Program MB-KM, mengajukan Form 1 Matching Up Program MB-KM Ke MK Inti Prodi (jika konversi kegiatan ke Mata Kuliah Inti) dan Form 2 Surat Permohonan Kredit Transfer (Learning Agreement). 8. Form 1 dan Form 2 dapat diakses di link https://its.id/Form12SEWR1RencanaMBKM.']","Karena bukti atau dokumen pendukung kegiatan SKEM harus diunggah di myITS StudentConnect dalam waktu satu tahun semenjak selesai kegiatan, jika melebihi batas waktu tersebut, kegiatan dinyatakan tidak berlaku.",0.999999999975,1.0,0.9937041180128428,0.0
