,question,ground_truth,contexts,answer
0,Apa itu program IUP?,"International Undergraduate Program yang selanjutnya disingkat IUP adalah program pendidikan sarjana yang dilaksanakan dalam bahasa Inggris dan mahasiswa wajib mengikuti kegiatan internasional sekurang-kurangnya satu kali selama masa studi dalam bentuk Joint degree/Double Degree, student exchange, final project, internship, atau short program dengan perguruan tinggi mitra ITS di luar negeri.","['Program MB-KM, mengajukan Form 1 Matching Up Program MB-KM Ke MK Inti Prodi (jika konversi kegiatan ke Mata Kuliah Inti) dan Form 2 Surat Permohonan Kredit Transfer (Learning Agreement). 8. Form 1 dan Form 2 dapat diakses di link https://its.id/Form12SEWR1RencanaMBKM.']",Saya tidak tahu.
1,Apa saja dana pendidikan di ITS?,"UKT, SPP, SPI dan SPA.","['Pasa1 14\n(1) Mahasiswa yang merupakan dosen tetap ITS, selanjutnya disebut pegawai pelajar, \n  dapat memperoleh keringanan dana SPP dengan ketentuan sebagai berikut:\n  a. tercatat sebagai mahasiswa aktif program doktor pada salah satu Program Studi di \n   ITS;\n  b. berusia paling rendah 35 tahun;\n  c. untuk dosen tetap PNS telah mendapatkan surat keputusan dari kementerian \n   tentang tugas belajar dengan beasiswa atau sedang diusulkan oleh ITS untuk \n   mendapatkan surat keputusan dari kementerian tentang tugas belajar dengan \n   beasiswa; dan\n  d. Untuk dosen tetap Non PNS telah mendapatkan surat keputusan dari Rektor \n   tentang tugas belajar dengan beasiswa.\n(2) Beasiswa yang dimaksud sebagaimana pada ayat (1) huruf c dan huruf d berupa \n  pembiayaan untuk keringanan SPP yang bersumber dari dana ITS.\n(3) Pengusulan oleh ITS sebagaimana dimaksud pada ayat (1) huruf c telah mendapat \n  rekomendasi dari Wakil Rektor yang membidangi sumber daya manusia.']","Dana pendidikan di ITS meliputi keringanan dana SPP bagi mahasiswa yang merupakan dosen tetap ITS, yang disebut pegawai pelajar. Keringanan dana SPP ini dapat diperoleh oleh mahasiswa aktif program doktor pada salah satu Program Studi di ITS yang memenuhi syarat-syarat tertentu, seperti berusia paling rendah 35 tahun dan telah mendapatkan surat keputusan dari kementerian atau Rektor tentang tugas belajar dengan beasiswa. Beasiswa tersebut bersumber dari dana ITS dan berupa pembiayaan untuk keringanan SPP."
2,Apa tujuan dibuat SKEM?,"1. Menanamkan sikap ilmiah, merangsang daya kreasi dan inovasi, meningkatkan kemampuan meneliti, menulis karya ilmiah, meningkatkan kemampuan berkomunikasi, serta pemahaman profesi. 2. Meningkatkan kesehatan / kebugaran, prestasi dan apresiasi budaya melalui penyaluran minat dan bakat dalam bidang seni dan olah raga. 3. Meningkatkan kemampuan mahasiswa dalam kerjasama (team work), komunikasi, ketrampilan manajemen, berorganisasi dan kepemimpinan. 4. Meningkatkan pengabdian kepada masyarakat, rasa kepedulian terhadap sesama, serta menanamkan rasa cinta tanah air.",['Sehubungan dengan kurikulum Program Sarjana dan Sarjana Terapan tahun 2023 – 2028 maka Berikut kami sampaikan beberapa teknis terkait pelaksanaan perencanaan kegiatan Satuan Kegiatan Ekstrakurikuler Mahasiswa (SKEM)/ program Merdeka Belajar–Kampus Merdeka (MB-KM) disampaikan bahwa:'],"SKEM atau Satuan Kegiatan Ekstrakurikuler Mahasiswa dibuat dengan tujuan untuk memberikan kesempatan kepada mahasiswa untuk mengembangkan minat, bakat, dan potensi diri di luar kegiatan akademik serta meningkatkan kualitas soft skill mahasiswa."
3,Apa itu Beasiswa Prioritas?,"Beasiswa Prioritas merupakan program beasiswa yang memberikan kesempatan kepada pendaftar untuk dapat melakukan pendaftaran pada dua program sekaligus, yaitu pada program Beasiswa Kemitraan/Kerja Sama LPDP dan pada salah satu program Beasiswa Afirmasi/Beasiswa Targeted/Beasiswa Umum tujuan luar negeri.","['Dipublikasikan tanggal 11 Januari 2024\nprogram beasiswa lain yang dipilih, sesuai\ndengan syarat dan ketentuan yang berlaku.\nApa saja komponen Dana yang diberikan?\n1. Dana Pendidikan\na. Tuition Fee\nb. Dana Pendaftaran\nc. Dana Tunjangan Buku\nd. Dana Penelitian Tesis\ne. Dana Seminar Internasional\nf. Dana Publikasi Jurnal Internasional\n2. Dana Pendukung\na. Dana Transportasi\nb. Dana Aplikasi Visa\nc. Dana Asuransi Kesehatan\nd. Dana Kedatangan\ne. Dana Hidup Bulanan\nf. Dana Lomba Internasional\ng. Dana keadaaan darurat (jika diperlukan)\nApa saja persyaratan umum pendaftaran\nBeasiswa Prioritas LPDP – Campus\nFrance Program Master?\nPersyaratan umum Beasiswa Prioritas LPDP –\nCampus France Program Master adalah sebagai\nberikut:\n1. Warga Negara Indonesia.\n2. Telah menyelesaikan studi program diploma\nempat (D4) atau sarjana (S1).\n3. Pendaftar yang telah menyelesaikan studi\nmagister (S2) tidak diizinkan mendaftar.\n4. Bagi pendaftar lulusan perguruan tinggi luar']","Beasiswa Prioritas adalah program beasiswa yang diberikan oleh LPDP - Campus France Program Master yang memiliki komponen Dana Pendidikan dan Dana Pendukung. Beasiswa ini memiliki persyaratan umum pendaftaran, seperti menjadi Warga Negara Indonesia, telah menyelesaikan studi program diploma empat (D4) atau sarjana (S1), dan tidak diizinkan bagi yang telah menyelesaikan studi magister (S2)."
4,Apa saja Jenis Program Magang Kampus Merdeka di ITS,"MBKM: Program dari Kementerian Pendidkan, Kebudayaan, Riset dan Teknologi dalam bentuk pembelajaran di luar Kampus selama 2 semester, dan bisa/wajib dikonversikan ke SKS
Mata Kuliah. Non-MBKM: Program Magang dikonversikan ke SKEM atau hanya untuk menambah pengalaman mahasiswa.","['Subdit. PK2\nJenis Program Magang Kampus Merdeka di ITS\n• MBKM [ Program dari Kementerian Pendidkan,\nKebudayaan, Riset dan Teknologi dalam bentuk pembelajaran di luar Kampus selama 2 semester, dan bisa/wajib dikonversikan ke SKS\nMata Kuliah. *\n• Non-MBKM [ Program Magang dikonversikan ke SKEM atau hanya untuk menambah pengalaman mahasiswa. *\n)* syarat dan ketentuan berlaku.\nADVANCING HUMANITY\niTS\nProgram Magang Flagship (Kampus Merdeka)\n• MSIB (Magang dan Studi Independen Bersertifikat)\n• Bangkit (by Google, GoTo, and Traveloka)\n• Gerilya ( by Kementerian ESDM )\nProgram Magang Reguler\n• Magang Kerjasama\n• Magang Mandiri\nProgram Magang Lokal\nMagang Institut']","Program Magang Kampus Merdeka di ITS terdiri dari beberapa jenis, yaitu:
1. MBKM (Program dari Kementerian Pendidikan, Kebudayaan, Riset dan Teknologi dalam bentuk pembelajaran di luar Kampus selama 2 semester, dan bisa/wajib dikonversikan ke SKS Mata Kuliah).
2. Non-MBKM (Program Magang dikonversikan ke SKEM atau hanya untuk menambah pengalaman mahasiswa).
3. Program Magang Flagship, antara lain:
   - MSIB (Magang dan Studi Independen Bersertifikat)
   - Bangkit (by Google, GoTo, and Traveloka)
   - Gerilya (by Kementerian ESDM)
4. Program Magang Reguler, antara lain:
   - Magang Kerjasama
   - Magang Mandiri
5. Program Magang Lokal, yaitu Magang Institut."
5,Apa syarat Foto formal calon wisudawan ITS?,"Mempunyai kualitas STUDIO FOTO dengan ekstensi file: .jpg atau .jpeg Berlatar belakang biru dengan komposisi warna (C: 100 M: 040 Y: 001 K: 001) atau (R: 000 G: 120 B: 193) Mempunyai ukuran proporsional separuh badan Menghadap lurus kedepan Tidak menggunakan kacamata Menampakkan bagian wajah dengan jelas Memakai jas warna gelap, kemeja putih, dan berdasi hitam (Pria/Wanita) Khusus bagi wanita yang berhijab warna hijab menyesuaikan dan tidak berdasi","['A. Semua calon Wisudawan ITS ke-129 periode wisuda April 2024 wajib mengisi biodata di menu update wisudawan sampai dengan tanggal 9 Februari 2024, dengan ketentuan sebagai berikut:\n1. Mempersiapkan dokumen yang akan diunggah antara lain: Ijazah terakhir, KTP, foto formal terbaru berwarna untuk ijazah, dan Akte Kelahiran (apabila diperlukan);\n2. Foto formal terbaru berwarna yang diunggah mempunyai ketentuan:\nMempunyai kualitas STUDIO FOTO dengan ekstensi file: .jpg atau .jpeg\nBerlatar belakang biru dengan komposisi warna (C: 100 M: 040 Y: 001 K: 001) atau (R: 000 G: 120 B: 193)\nMempunyai ukuran proporsional separuh badan\nMenghadap lurus kedepan\nTidak menggunakan kacamata\nMenampakkan bagian wajah dengan jelas\nMemakai jas warna gelap, kemeja putih, dan berdasi hitam (Pria/Wanita)\nKhusus bagi wanita yang berhijab warna hijab menyesuaikan dan tidak berdasi']","Syarat Foto formal calon wisudawan ITS adalah sebagai berikut:
1. Mempunyai kualitas STUDIO FOTO dengan ekstensi file: .jpg atau .jpeg
2. Berlatar belakang biru dengan komposisi warna (C: 100 M: 040 Y: 001 K: 001) atau (R: 000 G: 120 B: 193)
3. Mempunyai ukuran proporsional separuh badan
4. Menghadap lurus kedepan
5. Tidak menggunakan kacamata
6. Menampakkan bagian wajah dengan jelas
7. Memakai jas warna gelap, kemeja putih, dan berdasi hitam (Pria/Wanita)
8. Khusus bagi wanita yang berhijab warna hijab menyesuaikan dan tidak berdasi."
6,Apakah mata kuliah pengayaan bisa di-drop?,"Seperti halnya MK yang lain, jika masih dalam masa drop tiap semester, maka boleh (sampai dengan minggu 10). Setelah waktu itu tidak bisa, namun bisa digantikan dengan MK pengayaan lain yang diambil di semester berikutnya.","['Q: Berapa sks mata kuliah pengayaan yang bisa diambil?\n\nA: Di peraturan akademik mengambil MK pengayaan maksimal 6 sks dan minimum 3 sks.\n\nQ: Apakah mata kuliah pengayaan bisa di-drop?\n\nA: Seperti halnya MK yang lain, jika masih dalam masa drop tiap semester, maka boleh (sampai dengan minggu 10). Setelah waktu itu tidak bisa, namun bisa digantikan dengan MK pengayaan lain yang diambil di semester berikutnya.\n\nQ: Kepada siapa saya meminta konsultasi tentang perwalian/perencanaan kuliah, merubah MK yang diambil dan drop MK setelah minggu ke 4?\n\nA: Ke DOSEN WALI, bukan ke PEMBIMBING TA. Batas akhir perubahan MK adalah minggu ke 3 dan drop MK adalah minggu ke 10\n\nQ: Bagaimana jika saya tidak bisa ambil MK di FRS padahal prasyarat sudah terpenuhi? \n\nA: Silakan menginformasikan ke doswal dengan menyertakan bukti2. Doswal akan membantu menambahkan MK yang dimaksud jika bukti2 telah mencukupi.\n\nQ: Apakah MK yang diambil via dropdown MBKM bisa menggantikan MK yang sudah diambil?']","Ya, mata kuliah pengayaan bisa di-drop seperti halnya mata kuliah lainnya. Namun, hal ini harus dilakukan dalam masa drop tiap semester, yang biasanya berlangsung hingga minggu ke-10. Setelah melewati waktu tersebut, mata kuliah tidak bisa di-drop. Namun, jika memang perlu di-drop, mata kuliah pengayaan tersebut bisa digantikan dengan mata kuliah pengayaan lain yang diambil di semester berikutnya."
7,"MyITS saya bermasalah, bisa lapor kemana?",Silakan ajukan tiket ke DPTSI di https://servicedesk.its.ac.id/,"['Q: MyITS saya bermasalah, bisa lapor kemana?\n\nA: Silakan ajukan tiket ke DPTSI di https://servicedesk.its.ac.id/\n\nQ: Saya ingin mengurus “…..” siapa tendik yang harus ditemui?\n\nA: Temui tendik sesuai bidangnya yuk! :)\n\nPersuratan (S1) → Pak Sugeng\nAkademik (S1) → Bu Inka (Kelas, Nilai, MBKM, International Exposure), Bu Icha (Asisten Dosen, MonKP)\nAkademik + Persuratan (S2) → Bu Kartika\nAkademik + Persuratan (S3) → Bu Lina\nPeminjaman Ruang → Pak Husein (Kasubbag)\nKeuangan → Bu Devi, Bu Due\nUrusan Ruang Aula → Pak Jumali\nUrusan Ruang Kelas → Pak Edy\nUrusan Laboratorium → Teknisi Lab. Pak Junaidi (PKT, KCV, LP), Pak Jumali (KBJ, RPL), Pak Gayuh (AP, MCI, GiGA), Pak Kunto (AJK).\nUrusan Keamanan dan Kebersihan → Pak Sukron\nUrusan Kelistrikan → Pak Hari\nQ: Cara mendapatkan transkrip\n\nA: Buka SIM Akademik, masuk ke menu LAPORAN -> TRANSKRIP\n\nQ: Cara mendapatkan surat keterangan aktif mahasiswa\n\nA: Buka SIM Akademik, masuk ke menu SURAT MAHASISWA -> LAYANAN SURAT MAHASISWA']",Anda dapat melaporkan masalah MyITS Anda dengan mengajukan tiket ke DPTSI di https://servicedesk.its.ac.id/
8,Berapa koordinat latitude langitude ITS Surabaya?,Tidak tahu,"['KEMENTERIAN PENDIDIKAN, KEBUDAYAAN,\nRISET, DAN TEKNOLOGI\nINSTITUT TEKNOLOGI SEPULUH NOPEMBER\nDIREKTORAT KEMITRAAN GLOBAL\nGedung Global Kampong Kampus ITS Sukolilo - Surabaya 60111 Indonesia\n(0) Telepon: 031 5923411 (Hunting): 031 5994251-54 ext.1224\nFax: 031 5923411\nhttps://www.its.ac.id/, https://www.its.ac.id/international/ email: international(ajits.ac.id\nNomor : 7518/IT2MVIII/T/TU.00.08/2023\n\nLampiran :2 (dua) lembar\nPerihal : Pemberitahuan Informasi Persyaratan Eksposur Internasional\nKepada Yth.\nKepala Departemen dan Ketua Program Studi\ndi lingkungan ITS\nDengan hormat,\nsehubungan dengan surat kami dengan nomor 7311/!T2.VINI/T/TU.00.08/2023 perihal Pemberitahuan Informasi Persyaratan\nEksposur Internasional, bersama dengan ini memberikan informasi lebih lanjut tentang persyaratan yang harus dipenuhi oleh\nseluruh mahasiswa ITS dalam rangka pelaksanaan kegiatan eksposur internasional. Persyaratan tersebut adalah sebagai berikut:']",Saya tidak tahu.
9,Bagaimana SKEM membantu Departemen di ITS?,SKEM membantu Departemen untuk mendapatkan data pemetaan profil mahasiswa guna pengembangan soft skills dan untuk keperluan akreditasi internasional.,['(4) Kegiatan asistensi mengajar oleh mahasiswa harus dibimbing oleh dosen tetap dari ITS dan mendapatkan persetujuan dari Direktorat yang mengurusi kemahasiswaan.\r\n(5) Kegiatan asistensi mengajar di satuan pendidikan yang dilaksanakan selama satu semester dapat diusulkan menjadi nilai akademik yang relevan setelah direview dan disetujui oleh tim penilai.\r\n(6) Tim Penilai pada ayat (5) dibentuk oleh Departemen dan disahkan oleh Direktorat yang mengurusi kemahasiswaan.\r\n(7) Kegiatan asistensi mengajar di satuan pendidikan dapat diusulkan menjadi Satuan Kegiatan Ekstrakurikuler (SKEM) setelah disahkan oleh Direktorat yang mengurusi kemahasiswaan.\r\n(8) Mekanisme dan penyelenggaraan kegiatan asistensi mengajar di satuan pendidikan dikembangkan dan dikoordinasikan oleh Direktorat yang mengurusi kemahasiswaan.'],"SKEM dapat membantu Departemen di ITS dengan menjadi Satuan Kegiatan Ekstrakurikuler yang disahkan oleh Direktorat yang mengurusi kemahasiswaan. Hal ini dapat membantu dalam mengembangkan mekanisme dan penyelenggaraan kegiatan asistensi mengajar di satuan pendidikan, serta memperluas cakupan kegiatan akademik yang relevan bagi mahasiswa."
10,Mengapa penting untuk mengunggah kegiatan mahasiswa di myITS StudentConnect? ,"Karena bukti atau dokumen pendukung kegiatan SKEM harus diunggah di myITS StudentConnect dalam waktu satu tahun semenjak selesai kegiatan, jika melebihi batas waktu tersebut, kegiatan dinyatakan tidak berlaku.","['(ii) Kegiatan MBKM dalam bentuk pertukaran pelajar  dapat dilakukan dengan PT di dalam \nnegeri atau di luar negeri.  \n(iii) Kegiatan dalam Pertukaran pelajar yang dilaksanakan di dalam negeri maupun luar \nnegeri dalam rangka  memperluas wawasan mahasiswa, penyetaraan pendidikan, \npengkayaan sains dan teknologi (saintek) serta terjadinya kolaborasi invensi dan inovasi 10 Dokumen Panduan Baku Mutu Pelaksanaan MBKM - 2021  \n NO ELEMEN PENILAIAN  INDIKATOR  \n(1) (2) (3) \nmultidisiplin lingkup nasion al dan internasional .  \n(iv) Kegiatan pertukaran pelajar  dalam negeri (nasional) dalam bentuk kuliah dapat \ndilakukan  di luar program studi di internal ITS atau di luar program studi di luar ITS baik \ndalam bidang keilmuan sebidang atau tidak sebidang.  \n(v) Kegiatan pe rtukaran pelajar internasional dapat dilakukan dalam bentuk: (a) student \nexchange,  (b) internship, (c) short program, (d) public service/outreach program , atau (e) \nMK secara online .']","Penting untuk mengunggah kegiatan mahasiswa di myITS StudentConnect karena dengan demikian informasi mengenai kegiatan tersebut dapat terdokumentasi dengan baik. Selain itu, pengunggahan kegiatan mahasiswa juga dapat memperluas wawasan mahasiswa, meningkatkan penyetaraan pendidikan, mengkaya sains dan teknologi, serta memungkinkan terjadinya kolaborasi invensi dan inovasi baik dalam lingkup nasional maupun internasional."
11,Sebutkan salah satu dasar hukum perubahan peraturan ini.,Undang-Undang Nomor 12 Tahun 2012 tentang Pendidikan Tinggi.,"['Menetapkan :    PERATURAN REKTOR INSTITUT TEKNOLOGI SEPULUH\n                NOPEMBER TENTANG PERUBAHAN ATAS PERATURAN\n                REKTOR INSTITUT TEKNOLOGI SEPULUH NOPEMBER\n                NOMOR 12 TAHUN 2019 TENTANG BAKU MUTU MAGANG\n                PROGRAM STUDI SARJANA TERAPAN DAN SARJANA.\n\n\n                                  Pasal I\n\n\nKetentuan Pasal 4 Peraturan Rektor Institut Teknologi Sepuluh Nopember\nNomor 12 Tahun 2019 tentang Baku Mutu Magang Program Studi Sarjana\nTerapan dan Sarjana, diubah sehingga Pasal 4 berbunyi sebagai berikut:']",Dasar hukum perubahan peraturan ini adalah Peraturan Rektor Institut Teknologi Sepuluh Nopember Nomor 12 Tahun 2019 tentang Baku Mutu Magang Program Studi Sarjana Terapan dan Sarjana.
12,Apa yang terjadi jika mahasiswa tidak membayar UKT atau SPP? ,"Status mahasiswa dinyatakan tidak aktif dan jika tidak membayar selama 2 semester berturut-turut, dinyatakan mengundurkan diri.","['Pasal 12\n(1) Mahasiswa dapat menerima penyesuaian pembayaran nilai UKT atau SPP dengan \n  kondisi sebagai berikut:\n  a. Mahasiswa program sarjana dan sarjana terapan penerima beasiswa KIP-K yang \n   berada pada semester XI dan seterusnya, diwajibkan membayar UKT atau SPP \n   berdasarkan hasil evaluasi kemampuan ekonomi orang tua/wali Mahasiswa;\n  b. Mahasiswa program studi magister yang berada pada semester VII dan \n   seterusnya, diwajibkan membayar SPP senilai SPP yang dikenakan kepada \n   Mahasiswa baru program magister tersebut pada semester berjalan;\n  c. Mahasiswa program studi doktor yang berada pada semester XIII dan seterusnya, \n   diwajibkan membayar SPP senilai SPP yang dikenakan kepada Mahasiswa Baru \n   program doktor pada semester berjalan; dan/atau\n  d. Mahasiswa program pascasarjana yang berpindah jenis kelas diwajibkan \n   membayar SPP untuk jenis kelas dengan tarif lebih tinggi.']","Jika mahasiswa tidak membayar UKT atau SPP sesuai dengan ketentuan yang telah ditetapkan, maka mahasiswa tersebut dapat dikenakan sanksi administratif sesuai dengan peraturan yang berlaku di perguruan tinggi tersebut. Sanksi administratif tersebut dapat berupa pembekuan hak sebagai mahasiswa, tidak diizinkan mengikuti perkuliahan, tidak diizinkan mengikuti ujian, atau sanksi lainnya sesuai dengan kebijakan perguruan tinggi."
13,Apa saja peran Penanggung Jawab Fakultas atau Prodi dalam program MBKM?,"Penanggung Jawab Fakultas atau Prodi bertugas melakukan verifikasi data dan dokumen mahasiswa, memberikan rekomendasi kepada mahasiswa untuk mengikuti Program MBKM, dan melakukan koordinasi jika ada data yang perlu diperbaiki.","['Penanggungjawab Fakultas atau Prodi\nPenanggung Jawab Fakultas atau Prodi, bertugas untuk:\n1)\n2)\n3\nMelakukan verifikasi kebenaran data dan dokumen mahasiswa yang akan mendaftar Program flagship\nMBKM;\nMemberikan rekomendasi kepada mahasiswa untuk mengikuti Program flagship MBKM; dan melakukan koordinasi dengan mkhasiswa apabila terdapat data atau dokumen yang perlu diperbaiki.\n2023']","Penanggung Jawab Fakultas atau Prodi dalam program MBKM bertugas untuk melakukan verifikasi kebenaran data dan dokumen mahasiswa yang akan mendaftar Program flagship MBKM, memberikan rekomendasi kepada mahasiswa untuk mengikuti Program flagship MBKM, dan melakukan koordinasi dengan mahasiswa apabila terdapat data atau dokumen yang perlu diperbaiki."
14,Bagaimana penilaian prestasi mahasiswa dilakukan oleh mitra magang?,"Mitra magang memberikan penilaian berdasarkan formulir penilaian yang meliputi aspek-aspek seperti inisiatif, kemampuan komunikasi, disiplin, penampilan, ketekunan, kemampuan teknikal, berpikir kritis, kemampuan bekerjasama, kemampuan beradaptasi, dan hasil pekerjaan (kontribusi), yang kemudian diserahkan ke departemen untuk verifikasi.","['melaksanakan program magang industri. Fokus evaluasi adalah individu mahasiswa, yaitu \nprestasi yang dicapai dalam pelaksanaan magang oleh mahasiswa. Melalui evaluasi akan \ndiperoleh tentang apa yang telah dicapai dan apa yang belum dicapai oleh mahasiswa \nselama mengikuti kegiatan.  Evaluasi dapat memberikan informasi terkait kemampuan apa \nyang telah dicapai oleh mahasiswa selama mengikuti program.  Selain itu, melalui evaluasi \ndapat dilakukan judgment terhadap nilai atau implikasi dari hasil program. Selanjutnya, \nprogram ini digunakan untuk meningkatkan kompetensi mahasiswa.\n1. Prinsip Penilaian\nPenilaian dalam pelaksanaan kebijakan Merdeka Belajar - Kampus Merdeka, program \n“hak belajar tiga semester di luar program studi” mengacu kepada 5 (lima) prinsip sesuai \nSNPT yaitu edukatif, otentik, objektif, akuntabel, dan transparan yang dilakukan secara \nterintegrasi.\n2. Aspek – aspek Penilaian\nSejalan dengan prinsip-prinsip penilaian di atas, maka aspek-aspek yang dinilai dalam']","Penilaian prestasi mahasiswa dilakukan oleh mitra magang dengan fokus pada evaluasi individu mahasiswa. Evaluasi tersebut memberikan informasi tentang prestasi yang telah dicapai dan yang belum dicapai oleh mahasiswa selama mengikuti kegiatan magang. Evaluasi juga dapat memberikan informasi terkait kemampuan yang telah dicapai oleh mahasiswa selama mengikuti program magang. Selain itu, melalui evaluasi juga dapat dilakukan penilaian terhadap nilai atau implikasi dari hasil program magang untuk meningkatkan kompetensi mahasiswa. Penilaian dilakukan berdasarkan prinsip-prinsip penilaian yang meliputi edukatif, otentik, objektif, akuntabel, dan transparan yang dilakukan secara terintegrasi sesuai dengan Standar Nasional Pendidikan Tinggi (SNPT)."
15,"Proyek P13 ""Application of Novel Snap-shot based Hyperspectral Imaging Combined with AI to Detect Lesions"" menggunakan metode apa?","Proyek ini menggunakan model pembelajaran mesin seperti YOLOv5, YOLOv8, R-CNN, dan Faster R-CNN untuk mendeteksi kanker esofagus stadium awal menggunakan model gambar cahaya putih (WLI) dan gambar narrowband hiperspektral (HSI-NBI).","['techniques. In this research, you will learn deep learning\r\ntechniques such as CNN, RNN, LSTM, AE, VAE, etc. The\r\npossible applications and topics include: (1) 3D human\r\nskeleton extraction, (2) skeleton-based action\r\nrecognition/behavior modeling, (3) action prediction for\r\nelderly monitoring, (4) 3D object (vehicle, pedestrian,\r\ncyclist) detection and positioning from fusion of RGB/LiDAR\r\nsensor data, (5) object (head/vehicle/ human/object) pose\r\nestimation from single RGB image, (6) deep learning-based\r\nadverse drug reaction (ADR) prediction for clinic medicine\r\nuse, (7) AI-generated content (AIGC), such as\r\n(text/audio/image) -to-(image/video), (8) elderly caring\r\napplication of AIGC, (9) heart rate estimation from facial\r\nimage sequence. The intern student is expected to have\r\nsome preliminary knowledge on NN (neural network) or\r\ndeep learning and skilled in Python programming. He/She\r\nwill learn how to apply state-of-the-art deep learning']",Saya tidak tahu.
16,"Apa yang akan dikembangkan dalam proyek P16 ""Next Generation Wireless Communication, B5G/6G, Reconfigurable Intelligent Surface, System Level Simulation, Artificial Intelligence-enhanced Wireless Research""? ","Proyek ini berfokus pada inovasi dan desain konsep-konsep canggih dan arsitektur di luar 5G dan 6G, mengidentifikasi dan memvalidasi solusi untuk masalah kunci melalui simulasi atau eksperimen prototipe, serta merancang algoritma, model, dan protokol baru untuk mengoptimalkan kinerja jaringan nirkabel.","['Category\r\n■ Scholarship\r\n■ Self-supported\r\nIntern period At least 8 weeks between 2024/5/1- 2024/12/31\r\n\r\nNumber P16\r\nProject title\r\nNext generation Wireless communication, B5G/6G,\r\nReconfigurable Intelligent Surface, System level\r\nsimulation, Artificial Intelligence-enhanced wireless\r\nresearch\r\nDescription of the\r\nresearch\r\nInnovate and design cutting-edge concepts and\r\narchitectures beyond 5G (B5G) and 6G.\r\nIdentify and validate solutions to key problems through\r\nsimulation or prototype experiments.\r\nConduct research on AI and machine learning\r\ntechniques applied to wireless communications and\r\nnetworks.\r\nDesign and implement novel algorithms, models, and\r\nprotocols to optimize wireless network performance.\r\nCollaborate with the research team to manage projects\r\nand ensure timely deliverables,\r\nPlease refer to the website of our lab at\r\nhttps://sites.google.com/view/ccuantlab/english\r\nMentor at CCU\r\nAssoc. Prof. Jen-Yi Pan\r\nDept. of Communications Engineering,']","Proyek P16 akan mengembangkan konsep dan arsitektur terdepan di luar 5G (B5G) dan 6G. Proyek ini juga akan mengidentifikasi dan memvalidasi solusi untuk masalah kunci melalui simulasi atau eksperimen prototipe. Selain itu, proyek ini akan melakukan penelitian tentang teknik kecerdasan buatan dan pembelajaran mesin yang diterapkan pada komunikasi nirkabel dan jaringan. Algoritma, model, dan protokol baru akan dirancang dan diimplementasikan untuk mengoptimalkan kinerja jaringan nirkabel. Kolaborasi dengan tim penelitian akan dilakukan untuk mengelola proyek dan memastikan pengiriman tepat waktu."
17,Bagaimana cara menghubungi penyelenggara program internship ini?,"Kontak dapat dilakukan melalui nomor +886-5-2720411 ext. 23003, 23005, atau email coleng_dia@ccu.edu.tw. Alamatnya adalah No.168, Sec. 1, University Rd., Minhsiung, Chiayi 621301, Taiwan (R.O.C.).","['Penanggungjawab Fakultas atau Prodi\nPenanggung Jawab Fakultas atau Prodi, bertugas untuk:\n1)\n2)\n3\nMelakukan verifikasi kebenaran data dan dokumen mahasiswa yang akan mendaftar Program flagship\nMBKM;\nMemberikan rekomendasi kepada mahasiswa untuk mengikuti Program flagship MBKM; dan melakukan koordinasi dengan mkhasiswa apabila terdapat data atau dokumen yang perlu diperbaiki.\n2023']",Saya tidak tahu.
18,Apa yang harus dilakukan jika ingin menghapus atau menarik artikel yang telah diunggah?,"Isi form di link: https://its.id/FHAJTeknikITS untuk Jurnal Teknik, https://its.id/FHAJSainsSeniITS untuk Jurnal Sains & Seni, atau https://its.id/FHAJRepositoryITS untuk Repository.","['data diri dan akademik, maka Anda dapat meminta mahasiswa untuk melakukan revisi data.\n1.\n2\n3\n4\n5\nPada pertanyaan pertama untuk mengizinkan mahasiswa mengikuti program, klik ""Ya, Beri Izin"".\nPertanyaan berikutnya, apakah data akademik sudah sesuai dengan data pembanding internal? Anda klik\n""Tidak Sesuai"".\nKolom komentar akan muncul, dan Anda diharapkan memberikan deskripsi ketidaksesuaian data yang Anda maksudkan agar mahasiswa dapat melakukan perbaikan sesuai dengan data yang benar. Klik ""Kirim Permintaan Revisi""\nNotifikasi permintaan revisi berhasil terkirim\nBerikut tampilan pada akun mahasiswa yang perlu melakukan revisi. Klik ""Perbaiki Data"", kemudian lakukan perbaikan data sesuai dengan catatan perbaikan yang diberikan.\nKementerian Pendidikan, Kebudayaan, Riset dan\nTeknologi']","Jika ingin menghapus atau menarik artikel yang telah diunggah, Anda dapat meminta mahasiswa untuk melakukan revisi data. Pertama, klik ""Tidak Sesuai"" pada pertanyaan apakah data akademik sudah sesuai dengan data pembanding internal. Kemudian, kolom komentar akan muncul, dan Anda diharapkan memberikan deskripsi ketidaksesuaian data yang Anda maksudkan agar mahasiswa dapat melakukan perbaikan sesuai dengan data yang benar. Setelah itu, klik ""Kirim Permintaan Revisi"" untuk mengirim notifikasi permintaan revisi kepada mahasiswa. Mahasiswa akan melihat tampilan pada akun mereka yang perlu melakukan revisi, dan mereka dapat klik ""Perbaiki Data"" untuk melakukan perbaikan sesuai dengan catatan perbaikan yang diberikan."
19,Apa yang terjadi dengan artikel yang tidak memenuhi ketentuan publikasi?,Artikel tersebut tidak akan dipublikasikan di Jurnal Teknik ITS dan Jurnal Sains & Seni ITS.,"[""melakukan UNGGAH di Jurnal Repository, menggunakan login 'mahasiswa', dengan.\nkata sandi 'M4h4sisw4lTs!' ke alamat 'https://ejurnal.its.ac.id/index.php/index/login'\ndengan mengunggah file artikel dan file Form Telaah(dalam format pdf) saja.\nPengecekan file vang TERuNGGAH dapat dilihat di\nhttps://lpmp2ki.its.ac.id/pomits.\nJika terdapat penghapusan/penarikan artikel, dapat mengisi form pada link :\nhttps://its.id/FHAJTeknikITSPOMITS, untuk Jurnal Teknik ITS;\n1.-\nhttps:/l/its.id/FHAJSainsSenilTSPOMITS, untuk Jurnal Sains &Seni ITS;\n3.https://its.id/FHAJRepositorylTSPOMITS, untuk Jurnal Repository..\n Penghapusan Artikel akan dilakukan setelah yudisium berakhir.\nArtikel - artikel yang TIDAK MEMENUHI KETENTUAN PUBLIKASI (gaya selingkung\ntidak sesuai format dan file pendukung tidak lengkap) tidak akan DIPUBLIKASIKAN\ndi Jurnal Teknik ITS dan Jurnal Sains & Seni ITS.\nPeriode unggah artikel untuk yudisium 29 adalah sampai dengan \n15 Februari 2024 pukul 24.00 WIB""]",Artikel yang tidak memenuhi ketentuan publikasi (gaya selingkung tidak sesuai format dan file pendukung tidak lengkap) tidak akan dipublikasikan di Jurnal Teknik ITS dan Jurnal Sains & Seni ITS.
