,question,ground_truth,contexts,answer
0,Apa itu program IUP?,"International Undergraduate Program yang selanjutnya disingkat IUP adalah program pendidikan sarjana yang dilaksanakan dalam bahasa Inggris dan mahasiswa wajib mengikuti kegiatan internasional sekurang-kurangnya satu kali selama masa studi dalam bentuk Joint degree/Double Degree, student exchange, final project, internship, atau short program dengan perguruan tinggi mitra ITS di luar negeri.","['Sosialisasi Program\nMagang ITS dan\nProgram MSIB Batch 6\n2023\nSubdirektorat Pengembangan Kewirausahaan dan Karir\nDirektorat Kemahasiswaan\nInstitut Teknologi Sepuluh Nopember\nSubdit. PK2\nKementerian Pendidikan, Kebudayaan, Riset, dan Teknologi.\nuntuk Fakultas/Prodi\n\nPENDAHULUAN\nTABLE OF\nCONTENT\nALUR VERIFIKASI MAHASISWA OLEH\nPENANGGUNG JAWAB FAKULTAS/PRODI\nSOP PELAKSANAAN PROGRAM\nMAGANG\nSTATISTIK PESERTA MSIB 4 & 5, DAN\nMONITORING PELAPORAN SIM\nMAGANG\nPENUGASAN PENANGGUNG JAWAB\nFAKULTAS/PRODI\nDIGITALISASI SPTJM DAN SR\nOVERVIEW MSIB 6\n\nWebsite Resmi ITS Career Center (Subdit. PK2 ITS)\nSubdit. PK2\nhttps://www.its.ac.id/careers/id/magang', 'Subdit. PK2\nSKEMA PELAKSANAAN\nPROGRAM MAGANG\nMANDIRI DI ITS\nMahasiswa / Departemen melakukan\nmenyertakan:\n1. Proposal Magang\n2. Surat Rekomendasi Departemen\n3. Surat Penerimaan Magang\nPelaksanaan Magang\nProses pengurusan\nPKS\nPKS tidak\ndisetujui\nPKS\nTertandatangan\nSelesai\nMagang berakhir <\nMahasiswa mendapatkan\nSertifikat / Penilaian Magang\nSelesai\nADVANCING HUMANITY\niTS\nMulai\nMahasiswa mengurus\nsurat rekomendasi\ndepartemen untuk pengajuan magang ke\nMitra\nMahasiswa mengajukan\npermohonan magang ke\nMitra\nMitra melakukan seleksi magang\nMahasiswa menerima hasil seleksi magang dari Mitra\nTidak diterima\nSelesai\nDiterima\nMahasiswa melaporkan\nke Departemen', 'MEMUTUSKAN:\nMenetapkan : PERATURAN REKTOR INSTITUT TEKNOLOGI SEPULUH NOPEMBER \n                TENTANG DANA PENDIDIKAN INSTITUT TEKNOLOGI SEPULUH \n                NOPEMBER.\n\n                                         BAB I \n                                  KETENTUAN UMUM', 'Subdit. PK2\nADVANCING\nHUMANITY\niTS\nSkema Pelaksanaan Program Magang Flagship\n12. Koordinator magang di Departemen memberikan verifikasi data mahasiswa serta menentukan\nDosen Pembimbing di Sim Magang;\n13. Mitra MSIB membuat jadwal sosialisasi dan konsolidasi dengan PT yang kemudian akan direkap oleh\nPK2 dan disebarkan ke Departemen;\n14. PK2, Departemen, dan Mitra berdiskusi terkait pelaksanaan program selama konsolidasi (Kurikulum\nMagang, dan seluruh informasi terkait);\n15. Mahasiswa melaksanakan kegiatan MSIB dan mengunggah logbook mingguan di website kampus\nmerdeka dan SIM Magang;\n16. PIC Departemen dan PK2 melakukan monitoring terhadap pengisian SIM Magang Mahasiswa;\n17. Mitra memberikan penilaian Magang terhadap mahasiswa;\n18. Mahasiswa membuat laporan akhir dan mengunggah kelengkapan berkas di website kampus\nmerdeka dan SIM Magang;\n19. Pihak Departemen melakukan verifikasi laporan akhir mahasiswa di SIM Magang;\n20. Proses Selesai.\n2023']",Saya tidak tahu.
1,Apa saja dana pendidikan di ITS?,"UKT, SPP, SPI dan SPA.","['BAB IX \n      BESARAN DAN MEKANISME PEMBAYARAN DANA PENDIDIKAN\n\n                  Pasal 24\n(1) Besaran dana pendidikan ditetapkan melalui keputusan Rektor.\n(2) Pembayaran dana pendidikan sebagaimana dimaksud pada ayat (1) dilakukan secara \n  online melalui bank persepsi yang ditunjuk, sesuai jadwal pembayaran yang telah \n  ditetapkan.\n\n\n                   12\n(3) Dana Pendidikan yang telah dibayarkan tidak dapat ditarik kembali kecuali memenuhi \n      ketentuan sebagaimana diatur dalam Pasal 20.\n\n                                                                            BAB X \n                                                             KETENTUAN PENUTUP', 'Pasal 4\n(1) Kewajiban membayar dana pendidikan berupa UKT dikenakan kepada:\n  a. Calon Mahasiswa Baru program sarjana dan sarjana terapan yang diterima dari \n   Jalur Seleksi Nasional; dan\n  b. Mahasiswa program sarjana dan sarjana terapan yang diterima dari Jalur Seleksi \n   Nasional.\n(2) Kewajiban membayar dana pendidikan berupa SPP dikenakan kepada:\n  a. Calon Mahasiswa Baru program sarjana dan sarjana terapan yang diterima dari \n   selain Jalur Seleksi Nasional;\n  b. Mahasiswa program sarjana dan sarjana terapan yang diterima dari selain Jalur  \n   Seleksi Nasional;\n  c. Ca1on Mahasiswa Baru program sarjana dan sarjana terapan yang diterima dari \n   Jalur seleksi nasional program joint degree/ double degree-,\n  d. Mahasiswa program sarjana dan sarjana terapan yang diterima dari Jalur Seleksi \n   Nasional program joint degree/ double degree-,\n  e. Calon Mahasiswa Baru program pascasarjana dan pascasarjana terapan; dan', 'diterima melalui selain jalur Seleksi Nasional atau calon mahasiswa baru dan \n  mahasiswa program sarjana/sarjana terapan yang diterima melalui jalur seleksi \n  nasional program joint degree/ double degree.\n14. Sumbangan Pengembangan Institusi yang selanjutnya disingkat SPI adalah dana \n  yang dikenakan satu kali pada saat registrasi kepada calon mahasiswa baru program \n  sarjana/ sarjana terapan dan pascasarjana/ pascasarjana terapan yang diterima \n  melalui selain jalur Seleksi Nasional.\n15. Sumbangan Pengembangan Akademik yang selanjutnya disingkat SPA adalah dana \n  yang dikenakan setiap semester mulai semester 2 sampai dengan semester 6 kepada \n  mahasiswa program sarjana/sarjana terapan yang diterima melalui selain Jalur \n  Seleksi Nasional\n16. Jalur Seleksi Nasional adalah seleksi penerimaan mahasiswa baru program sarjana \n  dan sarjana terapan melalui seleksi nasional berdasarkan prestasi atau tes.', '(4) Kewajiban membayar dana pendidikan berupa SPA dikenakan kepada Mahasiswa \n  program sarjana dan sarjana terapan yang diterima selain dari jalur Seleksi Nasional \n  kecuali jalur mandiri seleksi mandiri prestasi.\n(5) Untuk mendapatkan NRP, Calon Mahasiswa Baru wajib melakukan pembayaran dana \n  pendidikan sesuai dengan kriteria sebagaimana dimaksud pada ayat (1), ayat (2), dan \n  ayat (3).\n(6) Calon Mahasiswa Baru yang telah mendapatkan NRP dinyatakan terdaftar sebagai \n  Mahasiswa Baru yang ditetapkan dengan keputusan Rektor.\n\n                   BAB V \n           FORMULASI PEMBAYARAN UKT DAN SPP\n\n                 Bagian Kesatu \n            Kewajiban Membayar UKT atau SPP']","Dana pendidikan di ITS terdiri dari beberapa jenis, yaitu:
1. UKT (Uang Kuliah Tunggal) yang dikenakan kepada calon mahasiswa baru program sarjana dan sarjana terapan yang diterima dari Jalur Seleksi Nasional, serta mahasiswa program sarjana dan sarjana terapan yang diterima dari Jalur Seleksi Nasional.
2. SPP (Sumbangan Pengembangan Pendidikan) yang dikenakan kepada calon mahasiswa baru program sarjana dan sarjana terapan yang diterima dari selain Jalur Seleksi Nasional, mahasiswa program sarjana dan sarjana terapan yang diterima dari selain Jalur Seleksi Nasional, calon mahasiswa baru program sarjana dan sarjana terapan yang diterima dari Jalur seleksi nasional program joint degree/ double degree, serta mahasiswa program sarjana dan sarjana terapan yang diterima dari Jalur Seleksi Nasional program joint degree/ double degree.
3. SPI (Sumbangan Pengembangan Institusi) yang dikenakan satu kali pada saat registrasi kepada calon mahasiswa baru program sarjana/ sarjana terapan dan pascasarjana/ pascasarjana terapan yang diterima melalui selain Jalur Seleksi Nasional.
4. SPA (Sumbangan Pengembangan Akademik) yang dikenakan setiap semester mulai semester 2 sampai dengan semester 6 kepada mahasiswa program sarjana/sarjana terapan yang diterima melalui selain Jalur Seleksi Nasional.
5. Dana pendidikan berupa SPA yang dikenakan kepada mahasiswa program sarjana dan sarjana terapan yang diterima selain dari jalur Seleksi Nasional kecuali jalur mandiri seleksi mandiri prestasi."
2,Apa tujuan dibuat SKEM?,"1. Menanamkan sikap ilmiah, merangsang daya kreasi dan inovasi, meningkatkan kemampuan meneliti, menulis karya ilmiah, meningkatkan kemampuan berkomunikasi, serta pemahaman profesi. 2. Meningkatkan kesehatan / kebugaran, prestasi dan apresiasi budaya melalui penyaluran minat dan bakat dalam bidang seni dan olah raga. 3. Meningkatkan kemampuan mahasiswa dalam kerjasama (team work), komunikasi, ketrampilan manajemen, berorganisasi dan kepemimpinan. 4. Meningkatkan pengabdian kepada masyarakat, rasa kepedulian terhadap sesama, serta menanamkan rasa cinta tanah air.","['BAB I  \nTUGAS AKHIR : PENGERTIAN DAN T UJUAN \n \n \n1.1  Pen gertian \n Tiap mahasis wa yang akan m enyelesai kan studiny a dala m \nprogram  sarjana dan di ploma di wajibkan un tuk meny usun  suatu \nkarya ilm iah yang disebut  Tugas Akhir, setelah y ang bersangkut an \nmemenuhi persy aratan tertentu. T ugas Akhir dapat berupa penelitian \natau perancan gan (desain) y ang m empunyai ciri-ciri antara lain : \n \n1. Mem puny ai perum usan masa lah untuk penelitian, dan \nide untu k perancangan \n2. Judul tugas akhir dipilih sendiri oleh mahasiswa atau \nditentukan oleh dosen pembim bing \n3. Didasarkan pada pengamata n labor atorium /lapan gan \n(data primer) dan/atau analisis data sekunder \n4. Harus ada  ketertiban metodologi \n5. Di bawah bim bingan berkala dan teratur oleh dosen  \npembimbing \n6. Harus cer mat dalam  sajian (tata tulis ilmiah atau  aturan \ngambar) \n7. Dipresentasik an dala m forum  seminar \n8. Dipertahankan dalam  ujian lisan di  depan tim  dosen \npenguji \n \n1.2  T ujuan', 'Konsep Satuan Kredit Ekstrakurikuler Mahasiswa\nDirektorat Kemahasiswaan \nEdisi Revisi (24 Agustus 2021)\n\nTujuan Dibuat SKEM\n1. Menanamkan sikap ilmiah, merangsang daya kreasi dan inovasi, meningkatkan\nkemampuan meneliti, menulis karya ilmiah, meningkatkan kemampuan berkomunikasi,\nserta pemahaman profesi.\n2. Meningkatkan kesehatan / kebugaran, prestasi dan apresiasi budaya melalui penyaluran\nminat dan bakat dalam bidang seni dan olah raga.\n3. Meningkatkan kemampuan mahasiswa dalam kerjasama (team work), komunikasi,\nketrampilan manajemen, berorganisasi dan kepemimpinan.\n4. Meningkatkan pengabdian kepada masyarakat, rasa kepedulian terhadap sesama, serta\nmenanamkan rasa cinta tanah air.', 'dicantum kan. Cara menyebutkan sum ber ialah  dengan \nmenuliskan nam a pengarang dan tahun publi kasi didalam  \nkurung. Untuk kutipan yang diam bil tidak secara la ngsung \ndari aslin ya maka y ang dituliskan adal ah nama penulis asli \ndan nam a penyuntin g (contoh: Faqih  dalam  Sulistijono, \n2006). Cara menuliskan daftar acu an dapat dilihat pada Sub \nbab 3.1 0. \n \n3.3. Halaman Judul \n Halaman judul ( Lampiran 1 ) sama den gan halam an kulit luar, \nberisi : tulisan ”TUGAS AKHIR”, judul Tugas Akhir; lam bang ITS, \nnama penulis dengan nomor pokok (N RP); nama ju rusan, fakultas, \n10 institut (dit ulis lengkap), dan nam a kota (Surabaya), serta tah un \npembuatan. Halaman ju dul ditu lis dalam  bahasa Inggris dan  \nIndonesia dalam  halam an yang berbe da. Kedua halam an judul \ntersebut menggunakan karakteristik  huruf y ang sama dengan bagian \nhalam an yang lain (bukan  huruf tim bul atau warna). \n Judul Tugas Akhir harus diketik seluru hnya dengan huruf-h uruf', 'juga dapat memanfaatkan Program Holistik Pembinaan dan Pemberdayaan Desa \n(PHP2D) dengan mengikuti prosedur dari Direktorat Belmawa.\n27       Buku Panduan Merdeka Belajar - Kampus Merdeka\nContoh Model KKNT Pembangunan dan Pemberdayaan bersama Kemendes\nContoh Model KKNT Pembangunan dan Pemberdayaan bersama Mitra\nBuku Panduan Merdeka Belajar - Kampus Merdeka       28\n3) Model KKNT Mengajar di Desa\nPelaksanaan kegiatan ini diutamakan pada mahasiswa program studi Pendidikan. \nBagi mahasiswa di luar program studi Pendidikan dapat melakukan kegiatan \nmengajar sesuai dengan bidang keahlian dalam rangka pemberdayaan \nmasyarakat misalnya penerapan teknologi tepat guna. Semua kegiatan KKNT \nmengajar ini bersifat membantu pengajaran formal dan non-formal. Bila di akhir \nkegiatan ini akan dijadikan sebagai tugas akhir, maka harus direncanakan sejak \nawal dalam bentuk proposal yang mengacu pada aturan prodi.\nContoh Model KKNT Mengajar di Desa\n4) Model KKNT Free Form']","Tujuan dibuat SKEM adalah untuk:
1. Menanamkan sikap ilmiah, merangsang daya kreasi dan inovasi, meningkatkan kemampuan meneliti, menulis karya ilmiah, meningkatkan kemampuan berkomunikasi, serta pemahaman profesi.
2. Meningkatkan kesehatan/kebugaran, prestasi dan apresiasi budaya melalui penyaluran minat dan bakat dalam bidang seni dan olahraga.
3. Meningkatkan kemampuan mahasiswa dalam kerjasama (team work), komunikasi, ketrampilan manajemen, berorganisasi dan kepemimpinan.
4. Meningkatkan pengabdian kepada masyarakat, rasa kepedulian terhadap sesama, serta menanamkan rasa cinta tanah air."
3,Apa itu Beasiswa Prioritas?,"Beasiswa Prioritas merupakan program beasiswa yang memberikan kesempatan kepada pendaftar untuk dapat melakukan pendaftaran pada dua program sekaligus, yaitu pada program Beasiswa Kemitraan/Kerja Sama LPDP dan pada salah satu program Beasiswa Afirmasi/Beasiswa Targeted/Beasiswa Umum tujuan luar negeri.","['Dipublikasikan tanggal 11 Januari 2024\nprogram beasiswa lain yang dipilih, sesuai\ndengan syarat dan ketentuan yang berlaku.\nApa saja komponen Dana yang diberikan?\n1. Dana Pendidikan\na. Tuition Fee\nb. Dana Pendaftaran\nc. Dana Tunjangan Buku\nd. Dana Penelitian Tesis\ne. Dana Seminar Internasional\nf. Dana Publikasi Jurnal Internasional\n2. Dana Pendukung\na. Dana Transportasi\nb. Dana Aplikasi Visa\nc. Dana Asuransi Kesehatan\nd. Dana Kedatangan\ne. Dana Hidup Bulanan\nf. Dana Lomba Internasional\ng. Dana keadaaan darurat (jika diperlukan)\nApa saja persyaratan umum pendaftaran\nBeasiswa Prioritas LPDP – Campus\nFrance Program Master?\nPersyaratan umum Beasiswa Prioritas LPDP –\nCampus France Program Master adalah sebagai\nberikut:\n1. Warga Negara Indonesia.\n2. Telah menyelesaikan studi program diploma\nempat (D4) atau sarjana (S1).\n3. Pendaftar yang telah menyelesaikan studi\nmagister (S2) tidak diizinkan mendaftar.\n4. Bagi pendaftar lulusan perguruan tinggi luar', 'Panduan Pendaftaran\nBeasiswa Prioritas\nLPDP - Campus France\nProgram Master\nTahun 2024\nlpdp.kemenkeu.go.id', 'Pasal 11\n(1) ITS dapat membebaskan pembayaran UKT atau SPP bagi Mahasiswa yang memenuhi \n  persyaratan sebagai berikut:\n  a. Mahasiswa yang mendapat penghargaan karena membawa nama baik ITS pada \n   tingkat nasional atau internasional dengan kriteria tertentu, mendapat pembebasan \n   selama 1 (satu) semester;\n  b. Mahasiswa program magister yang mendapatkan beasiswa fresh graduate, \n   mendapat pembebasan selama 4 (empat) semester;\n  c. Mahasiswa program magister yang mendapatkan beasiswa fast track, mendapatkan \n   pembebasan selama 2 (dua) semester pada jenjang magister apabila memenuhi \n   persyaratan program beasiswa fast track;\n  d. Mahasiswa yang mendapatkan izin cuti studi sebelum masa pembayaran UKT atau \n   SPP berakhir;\n  e. Mahasiswa yang mendapatkan beasiswa Kartu Indonesia Pintar - Kuliah (KIP-K) \n   pada semester 1X dan X untuk program sarjana atau program sarjana terapan;', 'Pasal 11\n(1) ITS dapat membebaskan pembayaran UKT atau SPP bagi Mahasiswa yang memenuhi \n  persyaratan sebagai berikut:\n  a. Mahasiswa yang mendapat penghargaan karena membawa nama baik ITS pada \n   tingkat nasional atau internasional dengan kriteria tertentu, mendapat pembebasan \n   selama 1 (satu) semester;\n  b. Mahasiswa program magister yang mendapatkan beasiswa fresh graduate, \n   mendapat pembebasan selama 4 (empat) semester;\n  c. Mahasiswa program magister yang mendapatkan beasiswa fast track, mendapatkan \n   pembebasan selama 2 (dua) semester pada jenjang magister apabila memenuhi \n   persyaratan program beasiswa fast track;\n  d. Mahasiswa yang mendapatkan izin cuti studi sebelum masa pembayaran UKT atau \n   SPP berakhir;\n  e. Mahasiswa yang mendapatkan beasiswa Kartu Indonesia Pintar - Kuliah (KIP-K) \n   pada semester 1X dan X untuk program sarjana atau program sarjana terapan;']","Beasiswa Prioritas adalah program beasiswa yang diberikan oleh LPDP - Campus France Program Master untuk warga negara Indonesia yang telah menyelesaikan studi program diploma empat (D4) atau sarjana (S1). Beasiswa ini memberikan berbagai komponen dana, seperti dana pendidikan (seperti tuition fee, dana pendaftaran, dan lain-lain) dan dana pendukung (seperti dana transportasi, dana asuransi kesehatan, dan lain-lain) sesuai dengan syarat dan ketentuan yang berlaku."
4,Apa saja Jenis Program Magang Kampus Merdeka di ITS,"MBKM: Program dari Kementerian Pendidkan, Kebudayaan, Riset dan Teknologi dalam bentuk pembelajaran di luar Kampus selama 2 semester, dan bisa/wajib dikonversikan ke SKS
Mata Kuliah. Non-MBKM: Program Magang dikonversikan ke SKEM atau hanya untuk menambah pengalaman mahasiswa.","['juga dapat memanfaatkan Program Holistik Pembinaan dan Pemberdayaan Desa \n(PHP2D) dengan mengikuti prosedur dari Direktorat Belmawa.\n27       Buku Panduan Merdeka Belajar - Kampus Merdeka\nContoh Model KKNT Pembangunan dan Pemberdayaan bersama Kemendes\nContoh Model KKNT Pembangunan dan Pemberdayaan bersama Mitra\nBuku Panduan Merdeka Belajar - Kampus Merdeka       28\n3) Model KKNT Mengajar di Desa\nPelaksanaan kegiatan ini diutamakan pada mahasiswa program studi Pendidikan. \nBagi mahasiswa di luar program studi Pendidikan dapat melakukan kegiatan \nmengajar sesuai dengan bidang keahlian dalam rangka pemberdayaan \nmasyarakat misalnya penerapan teknologi tepat guna. Semua kegiatan KKNT \nmengajar ini bersifat membantu pengajaran formal dan non-formal. Bila di akhir \nkegiatan ini akan dijadikan sebagai tugas akhir, maka harus direncanakan sejak \nawal dalam bentuk proposal yang mengacu pada aturan prodi.\nContoh Model KKNT Mengajar di Desa\n4) Model KKNT Free Form', '2. Dalam menyusun kebijakan dan manual mutu Program Kampus Merdeka sebaiknya \nmengacu pada kebijakan dan manual mutu dari sistem penjaminan mutu yang telah \nberlaku di perguruan tinggi. \n3. Kebijakan dan manual mutu Program Kampus Merdeka yang telah ditetapkan \nwajib didiseminasikan dan disosialisasikan khususnya kepada dosen pembimbing, \npembimbing industri dan peserta magang.A. Menyusun Kebijakan dan Manual Mutu\nAgar pelaksanaan kebijakan Merdeka Belajar - Kampus Merdeka, program “hak belajar tiga \nsemester di luar program studi”dapat berjalan dengan mutu yang terjamin, maka perlu \nditetapkan beberapa mutu, antara lain :\n1. Mutu kompetensi peserta.\n2. Mutu pelaksanaan.\n3. Mutu proses pembimbingan internal dan ekternal.\n4. Mutu sarana dan pasarana untuk pelaksanaan. \n5. Mutu pelaporan dan presentasi hasil.\n6. Mutu penilaian.\nBeberapa kriteria yang dianjurkan untuk kegiatan di luar kampus untuk menjaga mutu dan \nmendapatkan sks penuh:\nTabel 3.1. Kriteria Kegiatan di Luar Kampus', 'maka guna menyikapi dinamika kurikulum program studi (prodi) dalam mendukung Program Merdeka Belajar –\nKampus Merdeka (MB-KM), disampaikan bahwa:\n   1. Evaluasi dan pengembangan atas bahan kajian mata kuliah (MK) dapat dilakukan setiap tahun.\n   2. Prodi didorong untuk menambah MK Pengayaan yang dibuka bagi mahasiswa ITS di luar prodi, dan MK\n       Prodi yang dibuka bagi mahasiswa di luar ITS yang memiliki program/ kerjasama tertentu.\n   3. MK Pengayaan dan Kelas MK Prodi pada point 2 diberikan penanda khusus secara sistem.\n   4. Prodi didorong untuk membuka MK pilihan baru guna mendukung 8 (delapan) Bentuk Kegiatan Pembelajaran\n       (BKP) Program Merdeka Belajar – Kampus Merdeka (MB-KM).\n   5. Prodi dapat melakukan alih kredit dari BKP Program MB-KM mahasiswanya ke MK Prodi lain, dengan syarat\n       MK tersebut termasuk MK Pengayaan.\n   6. Dalam hal alih kredit, prodi/ direktorat penyelenggara MK adalah yang memutuskan persetujuan dengan', 'Sosialisasi Program\nMagang ITS dan\nProgram MSIB Batch 6\n2023\nSubdirektorat Pengembangan Kewirausahaan dan Karir\nDirektorat Kemahasiswaan\nInstitut Teknologi Sepuluh Nopember\nSubdit. PK2\nKementerian Pendidikan, Kebudayaan, Riset, dan Teknologi.\nuntuk Fakultas/Prodi\n\nPENDAHULUAN\nTABLE OF\nCONTENT\nALUR VERIFIKASI MAHASISWA OLEH\nPENANGGUNG JAWAB FAKULTAS/PRODI\nSOP PELAKSANAAN PROGRAM\nMAGANG\nSTATISTIK PESERTA MSIB 4 & 5, DAN\nMONITORING PELAPORAN SIM\nMAGANG\nPENUGASAN PENANGGUNG JAWAB\nFAKULTAS/PRODI\nDIGITALISASI SPTJM DAN SR\nOVERVIEW MSIB 6\n\nWebsite Resmi ITS Career Center (Subdit. PK2 ITS)\nSubdit. PK2\nhttps://www.its.ac.id/careers/id/magang']",Saya tidak tahu.
5,Apa syarat Foto formal calon wisudawan ITS?,"Mempunyai kualitas STUDIO FOTO dengan ekstensi file: .jpg atau .jpeg Berlatar belakang biru dengan komposisi warna (C: 100 M: 040 Y: 001 K: 001) atau (R: 000 G: 120 B: 193) Mempunyai ukuran proporsional separuh badan Menghadap lurus kedepan Tidak menggunakan kacamata Menampakkan bagian wajah dengan jelas Memakai jas warna gelap, kemeja putih, dan berdasi hitam (Pria/Wanita) Khusus bagi wanita yang berhijab warna hijab menyesuaikan dan tidak berdasi","['Judul\nData pelaksana (NRP & Nama mahasiswa serta NIP dan Nama Pembimbing)\nLogo ITS\nLatar belakang/introduksi\nMetode\nHasil (teks dan gambar/fotografi/skema)\nSimpulan dan Saran\nLogo perangkat lunak yang digunakan / Institusi mitra (jika ada)\n16.Gambar produk jika ada akan sangat mendukung impresi pelaksanaan kegiatan secara visual.\n17.Resolusi yang disarankan untuk kualitas cetakan adalah minimal 300 dpi dari sumber gambar aslinya.\n\nDesclaimer\n\nMahasiswa wajib mengisi Form Kepuasan Layanan & Pengumpulan Berkas Yudisium secara lengkap sebelum deadline pengumpulan berakhir.\n\nDeadline pengunggahan kelengkapan yudisium S1 di Departemen Teknik Informatika 10 Februari 2024\n\nLink Terkait\n\ue31d\nIsi Form Kepuasan Mahasiswa\n\uf548\nIsi Form Pengumpulan Berkas Yudisium\n\ueed6\nCek berkas-berkas yudisium\nWhat to do?*\n\n*Jika ada informasi yang kurang mohon informasikan kepada kami :))\n\n1        \nMengecek nilai TOEFL di UPT Bahasa.\n\nJika belum terpenuhi, segera melakukan perbaikan nilai!', 'Menampakkan bagian wajah dengan jelas\nMemakai jas warna gelap, kemeja putih, dan berdasi hitam (Pria/Wanita)\nKhusus bagi wanita yang berhijab warna hijab menyesuaikan dan tidak berdasi\n3. Data yang dipergunakan sebagai dasar pencetakan ijazah (Nama, Tempat Lahir, Tanggal Lahir, NIK) adalah data yang ada pada KTP/Akta kelahiran;\n4. Penulisan data di ijazah ITS menggunakan aturan Proper Case;\n5. Jika ada ketidaksesuaian penulisan nama dan/atau tempat lahir pada preview ijazah dengan data\nyang dimasukkan, mohon cetak preview ijazahnya kemudian diserahkan ke kantor Direktorat\nPendidikan disertai dokumen pendukung;\n6. Apabila memerlukan informasi lebih lanjut dapat menghubungi dirpendikcare@its.ac.id atau di\ncall centre pada hari dan jam kerja melalui no (WA Text Only) 085186819604, 085186819605.', '24\n\x0cLAMPIRAN 2: Contoh Halaman Pengesahan Proposal Tugas Akhir\n\n                         LEMBAR PENGESAHAN\n\n      JUDUL PROPOSAL TUGAS AKHIR DITULIS SINGKAT JELAS DAN\n                 MENGGAMBARKAN TEMA POKOK\n\n\n                         PROPOSAL TUGAS AKHIR\n                    Diajukan untuk memenuhi salah satu syarat\n                      memperoleh gelar <Nama Gelar> pada\n                    Program Studi S-1 <Nama Program Studi>\n                        Departemen <Nama Departemen>\n                            Fakultas <Nama Fakultas>\n                       Institut Teknologi Sepuluh Nopember\n\n\n\n                        Oleh : <NAMA MAHASISWA>\n                              NRP. <XXXXXXXX>\n\n\n\n                 Disetujui oleh Tim Penguji Proposal Tugas Akhir :\n\n\n1. Nama dan gelar pembimbing                             Pembimbing\n\n\n2. Nama dan gelar ko-pembimbing/penguji                  Ko-pembimbing', 'Indonesia (KONI) dengan menunjukkan sertifikat/surat keterangan dimana\nverifikasi dilakukan oleh dosen wali.\n13. Bagi mahasiswa yang tidak memiliki sertifikat kegiatan, bisa digantikan dengan surat\npernyataan bermaterai (Format surat pernyataan bebas). Dalam satu Surat Pernyataan\ndapat berisi beberapa kegiatan.\n14. Bagi mahasiswa yang tidak memiliki surat tugas bisa dimintakan ke direktorat\nkemahasiswaan atau fakultas. Surat tugas bisa menghubungi Direktorat\nKemahasiswaan (CP Mas Reza 081414170021).\n15. Bagi mahasiswa yang tidak memiliki foto kegiatan bisa digantikan dengan screenshot\nkegiatan tersebut di website.']","Syarat foto formal calon wisudawan ITS adalah menampakkan bagian wajah dengan jelas, memakai jas warna gelap, kemeja putih, dan berdasi hitam untuk pria atau wanita, khusus bagi wanita yang berhijab warna hijab harus disesuaikan dan tidak berdasi."
6,Apakah mata kuliah pengayaan bisa di-drop?,"Seperti halnya MK yang lain, jika masih dalam masa drop tiap semester, maka boleh (sampai dengan minggu 10). Setelah waktu itu tidak bisa, namun bisa digantikan dengan MK pengayaan lain yang diambil di semester berikutnya.","['• Keputusan penolakan bersifat final dan tidak dapat diubah kembali.\n• Dengan menolak mahasiswa, maka seluruh lamaran mahasiswa ke program Kampus Merdeka akan langsung dinyatakan gagal.\n(2/2) Tolak Mahasiswa\n1 • Kebutusan penolakan bersifat fnal dan tidak danat diubah kembali\n• Dengan menolak mahasiswa, maka seluruh lamaran mahasiswa ke program Kampus\nMerdeka akan langsung dinyatakan gagal.\nApakah Anda telah memahami konsekuensi di atas?\nSava memahami konsekuensi vana ditimbulkan serta keputusan ini diambil secara sadar dan I tanpa paksaan.\nLakukan ceklis pada kolom yang tersedia dan klik ""Ya, Tolak"".\n2\nKemball\nYa, Tolak\n8 Kementerian Pendidikan, Kebudayaan, Riset dan\nTeknologi', 'BAGAIMANA MEKANISME PELAKSANAAN PERTUKARAN\nMAHASISWA MERDEKA?\nTerdapat dua mekanisme, yaitu:\n1. Mahasiswa didorong untuk mengambil keseluruhan 20 sks dari mata kuliah yang ditawarkan oleh perguruan tinggi penerima, termasuk di dalamnya 2 sks Modul Nusantara (wajib). Dalam skema ini, penentuan mata kuliah di perguruan tinggi penerima baru bisa dipilih, setelah proses perekrutan selesai dan mahasiswa ditempatkan di salah satu perguruan tinggi penerima. Maka, dalam proses pendaftaran melalui aplikasi MBKM, para mahasiswa tidak memilih mata kuliah apapun di aplikasi tersebut.\n2. Mahasiswa dapat mengkombinasikan mata kuliah yang ditawarkan perguruan tinggi penerima (paling sedikit 8 sks mata kuliah dan 2 sks modul nusantara (wajib)) dengan mata kuliah dari perguruan tinggi lain (dilakukan secara daring), contoh:\na. Jika ada mata kuliah wajib yang masih harus dituntaskan di perguruan tinggi asal; atau\nb. Jika mahasiswa tertarik untuk mengambil mata kuliah unggulan di perguruan tinggi lain.', 'Q: Berapa sks mata kuliah pengayaan yang bisa diambil?\n\nA: Di peraturan akademik mengambil MK pengayaan maksimal 6 sks dan minimum 3 sks.\n\nQ: Apakah mata kuliah pengayaan bisa di-drop?\n\nA: Seperti halnya MK yang lain, jika masih dalam masa drop tiap semester, maka boleh (sampai dengan minggu 10). Setelah waktu itu tidak bisa, namun bisa digantikan dengan MK pengayaan lain yang diambil di semester berikutnya.\n\nQ: Kepada siapa saya meminta konsultasi tentang perwalian/perencanaan kuliah, merubah MK yang diambil dan drop MK setelah minggu ke 4?\n\nA: Ke DOSEN WALI, bukan ke PEMBIMBING TA. Batas akhir perubahan MK adalah minggu ke 3 dan drop MK adalah minggu ke 10\n\nQ: Bagaimana jika saya tidak bisa ambil MK di FRS padahal prasyarat sudah terpenuhi? \n\nA: Silakan menginformasikan ke doswal dengan menyertakan bukti2. Doswal akan membantu menambahkan MK yang dimaksud jika bukti2 telah mencukupi.\n\nQ: Apakah MK yang diambil via dropdown MBKM bisa menggantikan MK yang sudah diambil?', '6\n  1. Keringanan pembayaran UKT atau SPP sebesar 50% (lima puluh persen) untuk \n    selain Mahasiswa IUP dan joint degree/ double degree; atau\n  2. Keringanan pembayaran SPP sebesar 70% (tujuh puluh persen) untuk Mahasiswa \n    IUP dan joint degree/ double degree.\n(6) Mahasiswa program doktor yang melaksanakan ujian tertutup setelah yudisium \n  institut sampai dengan dimulainya semester baru dan dinyatakan lulus ujian tertutup \n  maka wajib membayar SPP sebesar 10% (sepuluh persen) dan mengikuti periode \n  wisuda setelah yudisium institut berikutnya.\n(7) Dalam hal Mahasiswi sebagaimana dimaksud pada ayat (6) tidak lulus ujian tertutup, \n  maka membayar SPP sebesar 100°/0 (seratus persen).\n(8) Mahasiswa luar ITS yang melakukan kegiatan akademik di ITS wajib membayar SPP \n  sesuai dengan perjanjian kerjasama.']","Ya, mata kuliah pengayaan bisa di-drop. Seperti halnya mata kuliah lain, jika masih dalam masa drop tiap semester, maka boleh (sampai dengan minggu 10). Setelah waktu itu tidak bisa, namun bisa digantikan dengan mata kuliah pengayaan lain yang diambil di semester berikutnya."
7,"MyITS saya bermasalah, bisa lapor kemana?",Silakan ajukan tiket ke DPTSI di https://servicedesk.its.ac.id/,"['Bersama dengan ini saya sertakan dokumen revisi TA saya dengan poin sebagai berikut:\n- perbaikan ....\nMohon berkenan memeriksa dan menginformasikan jika ada yang perlu saya perbaiki.\n\nDemikian, terima kasih\nAgus\n0511000..…\n\nQ: Bagaimana mendapatkan surat keterangan yang tidak ada di menu integra, contoh surat keterangan selesai TA dan lulus >=144 SKS?\n\nA: kirim ke WA Pak Sugeng +62 856-4843-2445\n------------------------------------------------------------------------------\nKepada Yth\nBapak Ary Mazharuddin Shiddiqi\ndi tempat\n\nDengan hormat,\nDengan surat ini saya,\n\nNama: \nNRP: \nTempat/Tgl lahir: \nAlamat sekarang: \nSKS Lulus:\nemail aktif:\nNo HP aktif:\n\nBermaksud untuk mengajukan permohonan kepada Bapak Ary guna memperoleh Surat Keterangan Selesai Tugas Akhir.\n\nDemikian surat ini saya ajukan dan atas terkabulnya permohonan ini, saya ucapkan terimakasih\n\nSurabaya, .…', '7.2\nKETENTUAN UMUM DALAM PENULISAN\nLAPORAN MAGANG\n• Laporan Magang ditulis dan dipresentasikan pada akhir magang (jika diperlukan).\n• Laporan Magang selain diserahkan ke departemen dan mitra magang, juga diserahkan ke Subdirektorat PK2 Direktorat Kemahasiswaan dalam bentuk softcopy melalui SIM Magang.\n7.3\nPRINSIP PENULISAN LAPORAN\nMAGANG\n• BENAR DAN OBYEKTIF\nLaporan magang harus sesuai dengan ketentuan yang ada dalam pedoman ini serta memuat informasi yang benar dan obyektif.\n• JELAS DAN CERMAT\nLaporan magang harus mudah dimengerti / dipahami oleh pembaca, dengan cara menghindari pemakaian kata / istilah, rangkaian kata / kalimat atau gaya bahasa yang kurang dapat dipahami oleh pembaca maupun penulisnya sendiri. Gunakan kata-kata yang sederhana tetapi jelas maksudnya.\n• LANGSUNG KE SASARAN', 'ERICHA VALENTINA\n5015201016\nS1 Perencanaan Wilayah d Vely Kukinul Siswanto\n\n\nFALDI FAKHRI\n5015201128\nS1 Perencanaan Wilayah d I Dewa Made Frendika S\n\nKK\nTerdapat inkonsistensi data / data yang belum diisi pada registras\nTerdapat laporan mingguan dengan foto aktivitas yang belum diis\nTerdapat laporan mingguan dengan foto aktivitas yang belum diis\nTerdapat laporan mingguan dengan foto aktivitas yang belum diis\nTerdapat laporan mingguan dengan foto aktivitas yang belum diis\nTerdapat laporan mingguan dengan foto aktivitas yang belum diis\nTerdapat laporan mingguan dengan foto aktivitas yang belum diis -\nits.id/ListSIMMagang\n+\nMix\nGenap 22/23\nGasal 23/24\nKementerian Pendidikan, Kebudayaan, Riset dan\nTeknologi\n\nSubdit. PK2\nADVANCING HUMANITY\niTS\nh\n4\nOverview MSIB 6\nd\n2023', 'Q: MyITS saya bermasalah, bisa lapor kemana?\n\nA: Silakan ajukan tiket ke DPTSI di https://servicedesk.its.ac.id/\n\nQ: Saya ingin mengurus “…..” siapa tendik yang harus ditemui?\n\nA: Temui tendik sesuai bidangnya yuk! :)\n\nPersuratan (S1) → Pak Sugeng\nAkademik (S1) → Bu Inka (Kelas, Nilai, MBKM, International Exposure), Bu Icha (Asisten Dosen, MonKP)\nAkademik + Persuratan (S2) → Bu Kartika\nAkademik + Persuratan (S3) → Bu Lina\nPeminjaman Ruang → Pak Husein (Kasubbag)\nKeuangan → Bu Devi, Bu Due\nUrusan Ruang Aula → Pak Jumali\nUrusan Ruang Kelas → Pak Edy\nUrusan Laboratorium → Teknisi Lab. Pak Junaidi (PKT, KCV, LP), Pak Jumali (KBJ, RPL), Pak Gayuh (AP, MCI, GiGA), Pak Kunto (AJK).\nUrusan Keamanan dan Kebersihan → Pak Sukron\nUrusan Kelistrikan → Pak Hari\nQ: Cara mendapatkan transkrip\n\nA: Buka SIM Akademik, masuk ke menu LAPORAN -> TRANSKRIP\n\nQ: Cara mendapatkan surat keterangan aktif mahasiswa\n\nA: Buka SIM Akademik, masuk ke menu SURAT MAHASISWA -> LAYANAN SURAT MAHASISWA']",Anda dapat mengajukan tiket ke DPTSI di https://servicedesk.its.ac.id/ untuk melaporkan masalah MyITS Anda.
8,Berapa koordinat latitude langitude ITS Surabaya?,Tidak tahu,"['KEMENTERIAN PENDIDIKAN, KEBUDAYAAN,\n                          RISET, DAN TEKNOLOGI\n                 INSTITUT TEKNOLOGI SEPULUH NOPEMBER\n                             Kampus ITS Sukolilo – Surabaya 60111\n                      Telepon : 031-5994251-54, 5947274, 5945472 (Hunting)\n                                    Fax: 031-5947264, 5950806\n                                        http://www.its.ac.id\n\n\n PERATURAN REKTOR INSTITUT TEKNOLOGI SEPULUH NOPEMBER\n                         NOMOR 23 TAHUN 2021\n\n\n                                    TENTANG\n\n\n   PERUBAHAN ATAS PERATURAN REKTOR INSTITUT TEKNOLOGI\nSEPULUH NOPEMBER NOMOR 12 TAHUN 2019 TENTANG BAKU MUTU\n    MAGANG PROGRAM STUDI SARJANA TERAPAN DAN SARJANA\n\n\n                DENGAN RAHMAT TUHAN YANG MAHA ESA\n\n\n       REKTOR INSTITUT TEKNOLOGI SEPULUH NOPEMBER,', 'KEMENTERIAN PENDIDIKAN, KEBUDAYAAN, RISET, DAN TEKNOLOGI\nINSTITUT TEKNOLOGI SEPULUH NOPEMBER\n       Kampus ITS Sukolilo - Surabaya 60111 Telepon : 031-5994251-54, 5947274, 5945472 (Hunting)\nFax: 031-5947264, 5950806\nhttp://www.its.ac.id\n\n\nPERATURAN REKTOR INSTITUT TEKNOWGI SEPULUH NOPEMBER NOMOR 7 TAHUN 2023\n\nTENTANG\n\nPEMBERIAN APRESIASI BAGI MAHASISWA BEPRESTASI\nDAN DOSEN PEMBIMBING DI BIDANG KOMPETISI KEMAHASISWAAN INSTITUT TEKNOWGI SEPULUH NOPEMBER', 'KEMENTERIAN PENDIDIKAN, KEBUDAYAAN, \n                      RISET, DAN TEKNOLOGI \n             INSTITUT TEKNOLOGI SEPULUH NOPEMBER\n                     Kampus ITS Sukolilo - Surabaya 60111 \n                 Telepon : 031-5994251-54, 5947274, 5945472 (Hunting) \n                         Fax: 031-5947264, 5950806 \n                           http://wwwits.ac.id\n\n       PERATURAN REKTOR INSTITUT TEKNOLOGI SEPULUH NOPEMBER \n                     NOMOR 5 TAHUN 2023\n\n                          TENTANG\n\n        DANA PENDIDIKAN INSTITUT TEKNOLOGI SEPULUH NOPEMBER \n\n              DENGAN RAHMAT TUHAN YANG MAHA ESA\n\n           REKTOR INSTITUT TEKNOLOGI SEPULUH NOPEMBER,', 'KEMENTERIAN PENDIDIKAN, KEBUDAYAAN, RISET, DAN TEKNOLOGI INSTITUT TEKNOLOGI SEPULUH NOPEMBER\nKampus ITS Sukolilo Surabaya 60111\nTelepon: 031-5994251-54, 5947274, 5945472 (Hunting)\nFax: 031-5947264, 5950806\nhttp://www.its.ac.id\nNomor : 6195/IT2.I/B/PP.06.00/1/2024\nLamp : Satu set\nPerihal: Wisuda ITS ke 129 Periode April 2024\n26 Februari 2024\nY th.:\n- Para Dekan\n- Para Kepala Departemen\nInstitut Teknologi Sepuluh Nopember\nKampus ITS Surabaya\nSehubungan dengan akan dilaksanakan Wisuda 129 Periode April 2024 yang akan dilaksanakan secara offline pada tanggal 20-21 April 2024, bersama ini kami mohon untuk disampaikan kepada calon wisudawan 129 di lingkungan Saudara untuk memperhatikan ketentuan-ketentuan sebagai berikut:\nA. PELAKSANAAN WISUDA :\nWisuda ITS ke 129 dilaksanakan secara offline di Gedung Graha Sepuluh Nopember\nJadwal pelaksanaan wisuda sebagai berikut :\nNO\nFAKULTAS\nFT-IRS, FT-SPK, SIMT, F-VOKASI\nFSAD, FTK, FT-EIC, F-DKBD\nJADWAL\nSabtu, 20 April 2024\nMinggu, 21 April 2024\nPukul']",Saya tidak tahu.
9,Bagaimana SKEM membantu Departemen di ITS?,SKEM membantu Departemen untuk mendapatkan data pemetaan profil mahasiswa guna pengembangan soft skills dan untuk keperluan akreditasi internasional.,"['Bagi Departemen, sistem baru SKEM ITS 2021 ini membantu Departemen untuk mendapatkan\ndata pemetaaan profile mahasiswa guna pengembangan Soft skills mahasiswa di Departemen dan\njuga berguna untuk Akreditasi Internasional Departemen.\nBagi ITS, sistem baru SKEM ITS 2021 ini akan menunjang ketersediaan data Kegiatan\nKemahasiswaan ITS secara terstruktur dan sistematis yang bisa digunakan sebagai basis data utama\nbagi pemeringkatan Bidang Kemahasiswan Nasional, pemeringkatan Internasional (THE/QS), dan akreditasi Internasional (ASIIN, AUNQA, IABEE).\nBagi Industri/Pengguna Lulusan ITS, sistem baru SKEM ITS 2021 membantu Industri/Pengguna\nLulusan ITS untuk mengetahui rekam jejak dibidang pengembangan Soft skills selama menjadi\nmahasiswa ITS. Sehingga Industri/Pengguna Lulusan ITS akan semakin menambah kepercayaan\ndalam merekrut lulusan ITS.\nHal-hal Teknis Pokok Dalam SKEM\nSistem SKEM ITS 2021 hanya berlaku bagi angkatan mahasiswa 2018 keatas.', 'Nomor : 1710/IT2.I/T/TU.00.08/II/2024 Perihal : Pelaksanaan Perencanaan Kegiatan SKEM/ Program MB-KM Lampiran : 1 lembar \nKepada Yth. Para Dekan Para Kepala Departemen Para Kepala Program Studi Sarjana dan Sarjana Terapan di Tempat', '(3) Mekanisme dan penyelenggaraan kegiatan magang/ praktik kerja dan kegiatan wirausaha hilirisasi dikembangkan dan dikoordinasikan oleh Direktorat yang mengurusi inovasi dan kawasan sains teknologi bekerjasama dengan Direktorat yang mengurusi kemahasiswaan.\r\n\r\n(4) Direktorat yang mengurusi inovasi dan kawasan sains teknologi dalam menyelenggarakan kegiatan Magang/ Praktik Kerja dan Kegiatan Wirausaha Hilirisasi sebagaimana dimaksud pada ayat (3) berkoordinasi dengan Program Studi terkait.\r\n\r\nPasal 15\r\n(1) Dalam penyelenggaraan kegiatan MB - KM di ITS, dilaksanakan oleh Tim MB-KM ITS.\r\n(2) Tim MB-KM ITS berperan dalam memfasilitasi implementasi kegiatan MB-KM di ITS meliputi membuat prosedur operasional baku, dokumen teknis, penjaminan mutu, sistem aplikasi dan hal lainnya yang mendukung penyelenggaraan kegiatan MB-KM di ITS.\r\n(3) Tim MB-KM ITS ditetapkan melalui Keputusan Rektor.\r\n\r\n        BAB V KETENTUAN PENUTUP\r\n\r\nPasal 16', 'melampirkan surat usulan atau surat\nrekomendasi sekurang-kurangnya dari\npejabat setingkat eselon II yang membidangi\npembinaan/pengembangan SDM pada\nKementerian/Lembaga atau Pemerintah\nDaerah tempat pendaftar bekerja dengan\nketentuan;\na. mengusulkan atau merekomendasikan\npendaftar untuk mengikuti program\nBeasiswa LPDP; dan\nb. mencantumkan Nama Lengkap serta\nNomor Induk Pegawai (NIP) pendaftar.\n9. Bagi pendaftar yang merupakan PNS dengan\nstatus PNS dengan jabatan fungsional\nsebagai Peneliti/Perekayasa/Medis/\nParamedis/ Pendidik, mengunggah Surat\nKeputusan (SK) Jabatan Terakhir atau SK\nKenaikan Pangkat Terakhir atau sejenisnya\nyang menunjukkan bahwa pendaftar adalah\nPNS dengan jabatan fungsional sebagai\nPeneliti/Perekayasa/Medis/Paramedis/Pendi\ndik.\n10. Bagi pendaftar berstatus prajurit TNI di semua\nprogram beasiswa LPDP wajib melampirkan\nsurat usulan atau surat rekomendasi\nsekurang-kurangnya pejabat yang\nmembidangi pembinaan SDM pada Mabes\nTNI/ TNI AD/ TNI AL/ TNI AU untuk mengikuti']","SKEM ITS 2021 membantu Departemen di ITS dengan memberikan data pemetaan profile mahasiswa guna pengembangan Soft skills mahasiswa di Departemen. Selain itu, SKEM juga berguna untuk Akreditasi Internasional Departemen. Dengan adanya SKEM ini, Departemen di ITS dapat memiliki data yang terstruktur dan sistematis untuk mendukung pengembangan soft skills mahasiswa serta proses akreditasi internasional Departemen."
10,Mengapa penting untuk mengunggah kegiatan mahasiswa di myITS StudentConnect? ,"Karena bukti atau dokumen pendukung kegiatan SKEM harus diunggah di myITS StudentConnect dalam waktu satu tahun semenjak selesai kegiatan, jika melebihi batas waktu tersebut, kegiatan dinyatakan tidak berlaku.","['Subdit. PK2\nADVANCING HUMANITY\niTS\nSkema Pelaksanaan Program Magang Flagship\nMahasiswa membuat akun di https://kampusmerdeka.kemdikbud.go.id/;\n2. Mahasiswa memilih program dan mitra yang akan dilkuti;\n3. Mahasiswa berkonsultasi ke Departemen serta mengajukan Surat Rekomendasi (SR);\n4. Departemen cek relevansi kegiatan / program mitra serta rencana konversi SKS;\n5. Mahasiswa mengajukan SPTJM;\n6. PKZ melakukan pengecekan Track Record Magang Mahasiswa;\n7. SPTJM terbit;\nMahasiswa mendaftar program MSIB di website kampus merdeka dengan upload dokumen kelengkapan;\n9. Mahasiswa melakukan cek hasil penerimaan;\n10. Apabila lolos, mitra mengeluarkan data penerimaan mahasiswa lolos MSIB yang kemudian diunduh oleh PK2 sebagai Koordinator PT;\n11. Sembari paralel, mahasiswa mengunggah melengkapi data di SIM Magang;\nTerestudent\n2023', 'Skema Pelaksanaan Program Magang Flagship\n1. Mahasiswa membuat akun di https://kampusmerdeka.kemdikbud.go.id/ ;\n2. Mahasiswa memilih program dan mitra yang akan diikuti;\n3. Mahasiswa berkonsultasi ke Departemen serta mengajukan Surat Rekomendasi (SR);\n4. Departemen cek relevansi kegiatan / program mitra serta rencana konversi SKS;\n5. Mahasiswa mengajukan SPTJM;\n6. PK2 melakukan pengecekan Track Record Magang Mahasiswa;\n7. SPTJM terbit;\n8. Mahasiswa mendaftar program MSIB di website kampus merdeka dengan upload dokumen\nkelengkapan;\n9. Mahasiswa melakukan cek hasil penerimaan;\n10. Apabila lolos, mitra mengeluarkan data penerimaan mahasiswa lolos MSIB yang kemudian\ndiunduh oleh PK2 sebagai Koordinator PT;\n11. Sembari paralel, mahasiswa mengunggah melengkapi data di SIM Magang;', 'Before\nAfter\nSubdit. PK2\nADVANCING HUMANITY\niTS\nAlur SR/SPTJM yang baru meningkatkan keterlibatan Perguruan Tinggi asal mahasiswa dalam proses pendaftaran dan rekomendasi mahasiswa dalam platform MBKM\nPendaftaran di Platform\nPengisian Data dan Upload Dokumen\nVerifikasi Mahasiswa (Seleksi Administrasi)\n2\nMahasiswa meminta tanda\nMahasiswa mendaftar\nke MSIB/KM di\ntangan basah Prodi dan Rektorat untuk SR/SPTJM\nplatform MBKM\ndan upload di platform\n3\n4\nMahasiswa mengisi\ndata dan upload dokumen diri di platform\nTim Program melakukan verifikasi data dan berkas mahasiswa, termasuk SR dan\nSPTJM, melalui platform\nla\nMahasiswa mendaftar\nke MSIB/KM di\nplatform MBKM\n1b\n2a\n2b\nЗа\nMahasiswa mengisi data dan upload dokumen diri dan upload dokun di platform\n3b\nPerguruan Tinggi menunjuk Pimpinan\nPT dan mendaftar akun pada platform\nPimpinan PT mengunggah surat tugas dari PT dan spesimen tanda tangan yang akan diverifikasi oleh\nPPKM\nMahasiswa melakukan\npersetujuan terhadap poin-poin pertanggungjawaban', 'Subdit. PK2\nADVANCING HUMANITY\niTS\nPemangku Kepentingan Program MSIB 6\nPimpinan\nPerguruan Tinggi\nPerusahaan dan\nOrganisasi Mitra\nDosen\nMahasiswa\nPerguruan Tinggi\nDalam Negeri Penerima\nMahasiswa\nPraktisi\ndan Mentor\nPerguruan Tinggi\nLuar Negeri Penerima\nMahasiswa']","Penting untuk mengunggah kegiatan mahasiswa di myITS StudentConnect karena platform tersebut dapat digunakan untuk memantau dan merekam aktivitas serta pencapaian mahasiswa selama program magang. Dengan mengunggah kegiatan, mahasiswa dapat memberikan informasi yang lengkap dan akurat kepada pihak terkait, seperti Departemen, PK2, dan mitra magang. Selain itu, data yang terdokumentasi dengan baik juga dapat membantu dalam evaluasi dan peningkatan program magang di masa depan."
11,Sebutkan salah satu dasar hukum perubahan peraturan ini.,Undang-Undang Nomor 12 Tahun 2012 tentang Pendidikan Tinggi.,"['Biro Umum dan Reformasi Birokrasi\nInsititut Teknologi Sepuluh Nopember\nPusat Layanan Terpadu sesuai dengan Peraturan Rektor TS\nNomor 26 Tahun 2019 bertugas untuk membenkan layanan prima\nsebagai perwujudan pelaksanaan reformasi birokrasi\nLAYANAN ADAPTASI KEBIASAAN BARU\n1. Layanan Legalisasi\n"" Legalisasi Ijazah - Legalisasi Surat Keterangan Pendamping Jazah\n"" Legalisasi Transkrip Nilai "" Legalisasi Sertifikat Cum Laude\n"" Legalisasi Translate Ijazah "" Legalisasi Akreditasi .\nKirim ajuan pada tautan: myits-services.its.ac.id :\n2. Layanan Translate\n“- Translate ijazah\n- Translate Sertifikat Cum Laude\n"" Translate Sertifikat Program Studi Profesi Insinyur (PSPI) AA\nKirim ajuan pada tautan: its./d/translate\n3. Layanan Surat Keterangan Lulus\nKirim ajuan pada tautan: its./d/SKL\n4. Layanan Surat Keterangan Bekerja\nKirim ajuan pada tautan: its.id/skbpITS)\n5. Layanan Usulan Tunjangan Pegawai\nKirim ajuan pada tautan: its.id/tunjangan', '4\n\n                  BAB II \n              MAKSUD DAN TUJUAN\n\n                 Pasal 2\n(1) Peraturan Rektor ini diterbitkan dengan maksud agar setiap pemungutan dan \n  penghimpunan dana pendidikan dari Calon Mahasiswa Baru dan Mahasiswa serta \n  penggunaannya memiliki landasan hukum.\n(2) Peraturan ini diterbitkan dengan tujuan untuk menjamin transparansi pemungutan, \n  penghimpunan, dan penggunaan dana pendidikan.\n\n                 BAB III \n               RUANG LINGKUP\n\n                 Pasal 3\n(1) Peraturan Rektor ini melingkupi besaran dan mekanisme pemungutan, \n  penghimpunan, dan penggunaan dana pendidikan.\n(2) Dana pendidikan sebagaimana dimaksud pada ayat (1) terdiri atas:\n  a. UKT;\n  b. SPP;\n  c. SPI; dan\n  d. SPA.\n\n                 BAB IV \n         KEWAJIBAN PEMBAYARAN DANA PENDIDIKAN', 'law)\n2\n4\nAreas of Law (private vs. public law and their respective\nsubdivisions explained)\n2\n5\nContracts I (contract formation: mutual assent; offer and\nacceptance explained)\n2\n6\nContracts II (simple contracts and deeds (specialty contracts), the\nelement of ‘consideration’, the various types of contracts)\n2\n7\nContracts III (breach of contract; remedies: monetary damages\nand specific performance)\n2\n8 Repetition (tentative; subject to alteration) 2\n9 MIDTERM EXAM 2\n10 Criminal Law I (elements of crime; types of crime) 2\n11 Courts and Juries: The Judicial System 2\n12\nLitigation in the US: The Adversary System of Trial\n(How a case is tried in the US courts; some basics of civil and\ncriminal procedure)\n2\n13\nLegal Professions and their Education (Judges, Attorneys,\nBarristers, Solicitor & Co; working in a commercial law firm;\napplying for a legal position)\n2\n14 Tort Law 2\n15 Constitution and Government 2\n16 Civil and Human Rights 2\n17 Repetition (tentative; subject to alteration) 2\n18', 'd. bahwa rancangan Perubahan Atas Peraturan Rektor tentang Penyelenggaraan Kegiatan Merdeka Belajar - Kampus Merdeka di Institut Teknologi Sepuluh Nopember telah mendapat persetujuan Senat Akademik melalui Berita Acara Sidang Pleno Senat Akademik Institut Teknologi Sepuluh Nopember Nomor: T/61733/IT2.XI/TU.00.03.01/2021;\r\ne. bahwa berdasarkan pertimbangan sebagaimana dimaksud pada huruf a, huruf b, huruf c dan huruf d di atas, perlu menetapkan Peraturan Rektor tentang Penyelenggaraan Kegiatan Merdeka Belajar - Kampus Merdeka di Institut Teknologi Sepuluh Nopember;\r\n\r\nMengingat : 1. Undang-Undang Nomor 12 Tahun 2012 tentang Pendidikan Tinggi (Lembaran Negara Republik Indonesia Tahun 2012 Nomor 158, Tambahan Lembaran Negara Republik Indonesia Nomor 5336);\r\n2. Peraturan Pemerintah Nomor 4 Tahun 2014 tentang Penyelenggaraan Pendidikan Tinggi dan Pengelolaan Perguruan Tinggi (Lembaran']",Salah satu dasar hukum perubahan peraturan ini adalah Undang-Undang Nomor 12 Tahun 2012 tentang Pendidikan Tinggi.
12,Apa yang terjadi jika mahasiswa tidak membayar UKT atau SPP? ,"Status mahasiswa dinyatakan tidak aktif dan jika tidak membayar selama 2 semester berturut-turut, dinyatakan mengundurkan diri.","['Pasal 12\n(1) Mahasiswa dapat menerima penyesuaian pembayaran nilai UKT atau SPP dengan \n  kondisi sebagai berikut:\n  a. Mahasiswa program sarjana dan sarjana terapan penerima beasiswa KIP-K yang \n   berada pada semester XI dan seterusnya, diwajibkan membayar UKT atau SPP \n   berdasarkan hasil evaluasi kemampuan ekonomi orang tua/wali Mahasiswa;\n  b. Mahasiswa program studi magister yang berada pada semester VII dan \n   seterusnya, diwajibkan membayar SPP senilai SPP yang dikenakan kepada \n   Mahasiswa baru program magister tersebut pada semester berjalan;\n  c. Mahasiswa program studi doktor yang berada pada semester XIII dan seterusnya, \n   diwajibkan membayar SPP senilai SPP yang dikenakan kepada Mahasiswa Baru \n   program doktor pada semester berjalan; dan/atau\n  d. Mahasiswa program pascasarjana yang berpindah jenis kelas diwajibkan \n   membayar SPP untuk jenis kelas dengan tarif lebih tinggi.', 'Pasal 12\n(1) Mahasiswa dapat menerima penyesuaian pembayaran nilai UKT atau SPP dengan \n  kondisi sebagai berikut:\n  a. Mahasiswa program sarjana dan sarjana terapan penerima beasiswa KIP-K yang \n   berada pada semester XI dan seterusnya, diwajibkan membayar UKT atau SPP \n   berdasarkan hasil evaluasi kemampuan ekonomi orang tua/wali Mahasiswa;\n  b. Mahasiswa program studi magister yang berada pada semester VII dan \n   seterusnya, diwajibkan membayar SPP senilai SPP yang dikenakan kepada \n   Mahasiswa baru program magister tersebut pada semester berjalan;\n  c. Mahasiswa program studi doktor yang berada pada semester XIII dan seterusnya, \n   diwajibkan membayar SPP senilai SPP yang dikenakan kepada Mahasiswa Baru \n   program doktor pada semester berjalan; dan/atau\n  d. Mahasiswa program pascasarjana yang berpindah jenis kelas diwajibkan \n   membayar SPP untuk jenis kelas dengan tarif lebih tinggi.', '7\n  b. apabila permohonan disetujui Wakil Rektor yang membidangi akademik, maka \n    Mahasiswa diwajibkan membayar UKT atau SPP selama periode yang tidak \n    dibayar dan membayar UKT atau SPP pada semester berikutnya untuk diaktifkan \n    statusnya sebagai Mahasiswa.\n\n                  Pasal 10\n(1) Mahasiswa yang mendapatkan izin cuti paling lambat pada minggu ke-4 (ke-empat) \n  perkuliahan diwajibkan membayar UKT atau SPP sebesar 20% (dua puluh persen).\n(2) Mahasiswa yang mendapatkan izin cuti setelah minggu ke-4 (ke-empat) perkuliahan, \n  diwajibkan membayar UKT atau SPP sebesar 100% (seratus persen).\n(3) Pengajuan izin cuti sebagaimana dimaksud pada ayat (1) dan ayat (2) diajukan \n  kepada Wakil Rektor yang membidangi akademik.\n\n                 Bagian Kedua \n           Pembebasan Pembayaran UKT dan SPP', '7\n  b. apabila permohonan disetujui Wakil Rektor yang membidangi akademik, maka \n    Mahasiswa diwajibkan membayar UKT atau SPP selama periode yang tidak \n    dibayar dan membayar UKT atau SPP pada semester berikutnya untuk diaktifkan \n    statusnya sebagai Mahasiswa.\n\n                  Pasal 10\n(1) Mahasiswa yang mendapatkan izin cuti paling lambat pada minggu ke-4 (ke-empat) \n  perkuliahan diwajibkan membayar UKT atau SPP sebesar 20% (dua puluh persen).\n(2) Mahasiswa yang mendapatkan izin cuti setelah minggu ke-4 (ke-empat) perkuliahan, \n  diwajibkan membayar UKT atau SPP sebesar 100% (seratus persen).\n(3) Pengajuan izin cuti sebagaimana dimaksud pada ayat (1) dan ayat (2) diajukan \n  kepada Wakil Rektor yang membidangi akademik.\n\n                 Bagian Kedua \n           Pembebasan Pembayaran UKT dan SPP']","Jika mahasiswa tidak membayar UKT atau SPP, maka statusnya sebagai mahasiswa akan tidak aktif. Mahasiswa diwajibkan membayar UKT atau SPP selama periode yang tidak dibayar dan membayar UKT atau SPP pada semester berikutnya untuk mengaktifkan kembali statusnya sebagai mahasiswa."
13,Apa saja peran Penanggung Jawab Fakultas atau Prodi dalam program MBKM?,"Penanggung Jawab Fakultas atau Prodi bertugas melakukan verifikasi data dan dokumen mahasiswa, memberikan rekomendasi kepada mahasiswa untuk mengikuti Program MBKM, dan melakukan koordinasi jika ada data yang perlu diperbaiki.","['(vii) Implementasi  Kegiatan MBKM dalam bentuk  Studi/  Proyek  dikoordinir oleh  Direktorat \nyang mengurusi kemahasiswaan  bersama Prodi terkait , melalui tahapan  kegiatan (a) \npersiapan, (b) Pelaksanaan, (c) Evaluasi, (d) Pengendalian, dan (e) Peningkatan.  \n \n14 Standar Proses –  \nKegiatan MBKM – Bentuk \nAsistensi Mengajar di Satuan \nPendidikan  (i) Kegiatan MBKM dalam bentuk asistensi mengajar di satuan pendidikan ditujukan untuk \nmemberikan kesempatan bagi mahasiswa yang memiliki minat dalam bidang pendidikan \ndalam rangka meraih profil sebagai pendidik , dan  membantu meningkatkan \npemerataan kualitas pendidikan  yang relevan dengan pendidikan tinggi dan \nperkembangan zaman . \n(ii) Kegiatan MBKM dalam bentuk asistensi mengajar  dilakukan di satuan pendidikan dasar \ndan menengah ,   \n(iii) Kegiatan MBKM dalam bentuk asistensi mengajar di satuan pendidikan , merupakan \nkegiatan dalam bentuk: bantuan mengajar, tutorial, bimbingan teknis, pelatihan dan', 'Penanggungjawab Fakultas atau Prodi\nPenanggung Jawab Fakultas atau Prodi, bertugas untuk:\n1)\n2)\n3\nMelakukan verifikasi kebenaran data dan dokumen mahasiswa yang akan mendaftar Program flagship\nMBKM;\nMemberikan rekomendasi kepada mahasiswa untuk mengikuti Program flagship MBKM; dan melakukan koordinasi dengan mkhasiswa apabila terdapat data atau dokumen yang perlu diperbaiki.\n2023', 'dan start -up.  \n(iii) Kegiatan MBKM dalam bentuk magang/ praktik kerja dan kegiatan wirausaha hilirisasi \ndikembangkan oleh  Direktorat yang mengurusi inovasi dan kawasan sains teknologi \nbekerjasama dengan Direktorat yang mengurusi kemahasiswaan . \n(iv) Impl ementasi kegiatan MBKM dalam bentuk  magang/ praktik kerja dan kegiatan \nwirausaha hilirisasi dikoordinir oleh Direktorat yang mengurusi  inovasi dan kawasan \nsains teknologi  bersama Prodi terkait, melalui tahapan  kegiatan (a) persiapan, (b) \nPelaksanaan, (c) Evaluasi, (d) Pengendalian, dan (e) Peningkatan   \n \nIV STANDAR PENILAIAN PEMBELAJARAN  \n11 Standar penilaian  (i) Penilaian atas proses dan hasil pelaksanaan MBKM mengacu pada prinsip penilaian.  \n \n 14 Dokumen Panduan Baku Mutu Pelaksanaan MBKM - 2021  \n NO ELEMEN PENILAIAN  INDIKATOR  \n(1) (2) (3) \nDalam hal mahasiswa mendapatkan nilai mata kuliah pengayaan kurang dari C, maka \nmahasiswa dapat menggantinya dengan mata kuliah pengayaan yang berbeda.', 'sebagai pimpinan perguruan tinggi; \n2) Pimpinan PT bertugas menentukan penanggung \njawab dari masing-masing prodi atau fakultas \nuntuk bertindak sebagai pihak yang akan \nmerekomendasikan mahasiswa untuk mengikuti \nprogram MBKM; dan \n3) Pimpinan PT bertugas memberikan persetujuan \nakhir daftar mahasiswa setelah mendapatkan \nrekomendasi dari prodi atau fakultas pada laman Penanggung Jawab Fakultas atau Prodi, bertugas untuk: \n1) Melakukan verifikasi kebenaran data dan dokumen \nmahasiswa yang akan mendaftar Program flagship \nMBKM; \n2) Memberikan rekomendasi kepada mahasiswa untuk \nmengikuti Program flagship MBKM; dan \n3) melakukan koordinasi dengan mkhasiswa apabila \nterdapat data atau dokumen yang perlu diperbaiki. \n2023 Subdit. PK2 \nKebutuhan Perbaikan dan Pengembangan Platform \n2023 Subdit. PK2 \n2023 Subdit. PK2 \nDIGITALISASI SPTJM DAN SR \n2023 \nSubdit. PK2 \n5\n2023 Subdit. PK2 \nKebutuhan Perbaikan dan Pengembangan Platform 2023 Subdit. PK2 \nProses Sebelum: Surat Rekomendasi dan']","Penanggung Jawab Fakultas atau Prodi dalam program MBKM memiliki beberapa peran, antara lain:
1. Melakukan verifikasi kebenaran data dan dokumen mahasiswa yang akan mendaftar Program flagship MBKM.
2. Memberikan rekomendasi kepada mahasiswa untuk mengikuti Program flagship MBKM.
3. Melakukan koordinasi dengan mahasiswa apabila terdapat data atau dokumen yang perlu diperbaiki."
14,Bagaimana penilaian prestasi mahasiswa dilakukan oleh mitra magang?,"Mitra magang memberikan penilaian berdasarkan formulir penilaian yang meliputi aspek-aspek seperti inisiatif, kemampuan komunikasi, disiplin, penampilan, ketekunan, kemampuan teknikal, berpikir kritis, kemampuan bekerjasama, kemampuan beradaptasi, dan hasil pekerjaan (kontribusi), yang kemudian diserahkan ke departemen untuk verifikasi.","['melaksanakan program magang industri. Fokus evaluasi adalah individu mahasiswa, yaitu \nprestasi yang dicapai dalam pelaksanaan magang oleh mahasiswa. Melalui evaluasi akan \ndiperoleh tentang apa yang telah dicapai dan apa yang belum dicapai oleh mahasiswa \nselama mengikuti kegiatan.  Evaluasi dapat memberikan informasi terkait kemampuan apa \nyang telah dicapai oleh mahasiswa selama mengikuti program.  Selain itu, melalui evaluasi \ndapat dilakukan judgment terhadap nilai atau implikasi dari hasil program. Selanjutnya, \nprogram ini digunakan untuk meningkatkan kompetensi mahasiswa.\n1. Prinsip Penilaian\nPenilaian dalam pelaksanaan kebijakan Merdeka Belajar - Kampus Merdeka, program \n“hak belajar tiga semester di luar program studi” mengacu kepada 5 (lima) prinsip sesuai \nSNPT yaitu edukatif, otentik, objektif, akuntabel, dan transparan yang dilakukan secara \nterintegrasi.\n2. Aspek – aspek Penilaian\nSejalan dengan prinsip-prinsip penilaian di atas, maka aspek-aspek yang dinilai dalam', '4. Hasil penilaian dilakukan dengan cara mengisi formulir yang ada dan diserahkan\npada departemen.\n8.2\nPENILAIAN PRESTASI KINERJA MAGANG\nOLEH UNIT MITRA MAGANG\nDalam melakukan kegiatan magang, mahasiswa akan memperoleh penilaian dari unit tempat magang. Formulir penilaian magang diisi dan ditandatangani oleh atasan yang berwenang di tempat magang (minimal level manajer) dan dicap menggunakan stempel unit tempat magang. Berikut adalah butir penilaian kinerja magang:\n52\n08 Penilaian Magang', '• BAB 5. REFLEKSI DIRI\n• Mahasiswa mendeskripsikan tentang hal-hal positif yang diterima selama perkuliahan yang bermanfaat / relevan terhadap pekerjaan selama magang.\n• Mahasiswa menjelaskan tentang manfaat magang terhadap pengembangan soft-skills dan kekurangan soft-skills yang dimilikinya.\n• Mahasiswa memberikan penjabaran tentang manfaat magang terhadap pengembangan kemampuan kognitif dan kekurangan kemampuan kognitif yang dimilikinya.\nBuku Petunjuk Teknis Magang\n49', '3) Meningkatkan prestasi mahasiswa dalam ajang nasional dan internasional.\nStudi/proyek independen dapat menjadi pelengkap atau pengganti mata kuliah yang \nharus diambil. Ekuivalensi kegiatan studi independen ke dalam mata kuliah dihitung \nberdasarkan kontribusi dan peran mahasiswa yang dibuktikan dalam aktivitas di \nbawah koordinasi dosen pembimbing. Adapun untuk mekanisme pelaksanaan \nkegiatan studi/proyek independen adalah sebagai berikut.\n1) Perguruan Tinggi\na) Menyediakan tim dosen pendamping untuk proyek independen yang \ndiajukan oleh tim mahasiswa sesuai dengan keahlian dari topik proyek \nindependen yang diajukan.\nb) Memfasilitasi terbentuknya sebuah tim proyek independen yang terdiri dari \nmahasiswa lintas disiplin.\nc) Menilai kelayakan proyek independen yang diajukan.\nd) Menyelenggarakan bimbingan, pendampingan, serta pelatihan dalam proses \nproyek independen yang dijalankan oleh tim mahasiswa.\ne) Menyelenggarakan evaluasi dan penilaian dari proyek independen mahasiswa']",Penilaian prestasi mahasiswa dilakukan oleh mitra magang dengan cara mahasiswa akan memperoleh penilaian dari unit tempat magang. Formulir penilaian magang diisi dan ditandatangani oleh atasan yang berwenang di tempat magang (minimal level manajer) dan dicap menggunakan stempel unit tempat magang. Butir penilaian kinerja magang meliputi berbagai aspek yang dinilai untuk mengevaluasi prestasi mahasiswa selama menjalani kegiatan magang.
15,"Proyek P13 ""Application of Novel Snap-shot based Hyperspectral Imaging Combined with AI to Detect Lesions"" menggunakan metode apa?","Proyek ini menggunakan model pembelajaran mesin seperti YOLOv5, YOLOv8, R-CNN, dan Faster R-CNN untuk mendeteksi kanker esofagus stadium awal menggunakan model gambar cahaya putih (WLI) dan gambar narrowband hiperspektral (HSI-NBI).","['■ Post-graduate student\r\n■ Third/forth-year undergraduate senior student\r\nCategory\r\n■ Scholarship\r\n■ Self-supported\r\nIntern period At least 8 weeks between May and December 2024\r\n\r\nNumber P13\r\nProject title\r\nApplication of Novel Snap-shot based hyperspectral imaging\r\ncombined with AI to detect Lesions\r\nDescription of the\r\nresearch\r\nThe early detection of esophageal cancer presents a\r\nconsiderable difficulty, which contributes to its high\r\nprevalence as a major cause of cancer-related fatalities. This\r\nproject will utilize various machine learning models, including\r\nYOLOv5, YOLOv8, R-CNN, and Faster R-CNN, to predict and\r\ndetect early-stage esophageal cancer. It will make use of two\r\nmodels of esophageal cancer images: the white-light images\r\n(WLI) model and the hyperspectral narrowband images (HSI-\r\nNBI) model. These models will be generated through a\r\nconversion algorithm referred to as the spectrum-aided\r\nvision enhancer (SAVE). The main goal will be to discover', 'NBI) model. These models will be generated through a\r\nconversion algorithm referred to as the spectrum-aided\r\nvision enhancer (SAVE). The main goal will be to discover\r\nDysplasia and Squamous Cell Carcinoma (SCC). The\r\nevaluation of model performance will be conducted using the\r\ncreated confusion matrix and five important indicators:\r\nprecision, recall, F1-score, mAP, and the confusion matrix of\r\nthe trained model.\r\nMentor at CCU\r\nProf. Hsiang-Chen Wang\r\nDept. of Mechanical Engineering,\r\nNational Chung Cheng University, Taiwan, ROC.\r\n(e-mail: hcwang@ccu.edu.tw)\r\nExpected student level\r\n■ Post-graduate student\r\n■ Third/forth-year undergraduate senior student\r\nCategory ■ Scholarship\r\nIntern period At least 12 weeks between May and December 2024\r\n\r\nNumber P14\r\nProject title Stirling engines and their applications\r\nDescription of the\r\nresearch\r\nThe students will learn the research topics about Stirling\r\nengines and their applications in renewable energy,', '• Mampu memilih dan mengorganisir data yang diperlukan.\n• Mampu mengamati dan menilai dengan jeli berbagai proses, peristiwa, manfaat dan kelemahan yang ada selama melakukan kegiatan Magang.\n7.4\nFORMAT DAN SISTEMATIKA LAPORAN\nMAGANG\n• FORMAT PENULISAN LAPORAN MAGANG\n1. Jenis dan Ukuran Kertas\nKertas HVS 70gram ukuran A5 (148 × 210 mm).\n2. Cover Laporan\n3. Lembar pengesahan dengan dasar polos berwarna putih\nPembimbing tempat magang tanda tangan terlebih dahulu.\n4. Jarak Tepi (margin)\n- Tepi Atas : 2,5 cm\n- Тері Bawah : 2,5 cm\n- Tepi Kiri: 2,5 cm\n- Tepi Kanan : 2,0 cm\n5. Jenis Huruf\nTimes New Roman, Normal, 12 pt (judul), 11 pt (isi)\n46\n07 Pedoman Penulisan Laporan Magang', ""developing algorithms for sensor data calibration, point\r\ncloud processing and image processing to create a\r\ncomprehensive and accurate representation of the\r\nvehicle's surroundings. The primary objective is to develop\r\nand optimize algorithms for efficiently processing and\r\ninterpreting the multi-modality. This includes tasks such as\r\nsemantic segmentation, feature extraction, and object\r\nrecognition, all of which are pivotal for the accurate\r\nperception of the vehicle's surroundings.\r\nMentor at CCU\r\nAssoc. Prof. Jui-Chiu Chiang\r\nDept. of Electrical Engineering,\r\nNational Chung Cheng University, Taiwan, ROC.\r\n(E-mail: rachel@ccu.edu.tw)\r\nExpected student level █ Third/forth-year undergraduate senior student\r\nCategory\r\n█ Scholarship\r\n█ Self-supported\r\nIntern period At least 12 weeks between May 1st and Dec. 31th\r\n\r\nNumber P4\r\nProject title\r\nSimulation and Reconstruction of Pencil Beam Scanning of\r\nParticle Therapy\r\nDescription of the research""]","Proyek P13 ""Application of Novel Snap-shot based Hyperspectral Imaging Combined with AI to Detect Lesions"" menggunakan berbagai model machine learning, termasuk YOLOv5, YOLOv8, R-CNN, dan Faster R-CNN, untuk memprediksi dan mendeteksi kanker esofagus pada tahap awal. Proyek ini juga menggunakan dua model gambar kanker esofagus: model gambar cahaya putih (WLI) dan model gambar hiperspektral narrowband (HSI-NBI). Model-model ini dihasilkan melalui algoritma konversi yang disebut sebagai spectrum-aided vision enhancer (SAVE). Tujuan utamanya adalah untuk menemukan Dysplasia dan Squamous Cell Carcinoma (SCC)."
16,"Apa yang akan dikembangkan dalam proyek P16 ""Next Generation Wireless Communication, B5G/6G, Reconfigurable Intelligent Surface, System Level Simulation, Artificial Intelligence-enhanced Wireless Research""? ","Proyek ini berfokus pada inovasi dan desain konsep-konsep canggih dan arsitektur di luar 5G dan 6G, mengidentifikasi dan memvalidasi solusi untuk masalah kunci melalui simulasi atau eksperimen prototipe, serta merancang algoritma, model, dan protokol baru untuk mengoptimalkan kinerja jaringan nirkabel.","['Category\r\n■ Scholarship\r\n■ Self-supported\r\nIntern period At least 8 weeks between 2024/5/1- 2024/12/31\r\n\r\nNumber P16\r\nProject title\r\nNext generation Wireless communication, B5G/6G,\r\nReconfigurable Intelligent Surface, System level\r\nsimulation, Artificial Intelligence-enhanced wireless\r\nresearch\r\nDescription of the\r\nresearch\r\nInnovate and design cutting-edge concepts and\r\narchitectures beyond 5G (B5G) and 6G.\r\nIdentify and validate solutions to key problems through\r\nsimulation or prototype experiments.\r\nConduct research on AI and machine learning\r\ntechniques applied to wireless communications and\r\nnetworks.\r\nDesign and implement novel algorithms, models, and\r\nprotocols to optimize wireless network performance.\r\nCollaborate with the research team to manage projects\r\nand ensure timely deliverables,\r\nPlease refer to the website of our lab at\r\nhttps://sites.google.com/view/ccuantlab/english\r\nMentor at CCU\r\nAssoc. Prof. Jen-Yi Pan\r\nDept. of Communications Engineering,', 'Sosialisasi Program\nMagang ITS dan\nProgram MSIB Batch 6\n2023\nSubdirektorat Pengembangan Kewirausahaan dan Karir\nDirektorat Kemahasiswaan\nInstitut Teknologi Sepuluh Nopember\nSubdit. PK2\nKementerian Pendidikan, Kebudayaan, Riset, dan Teknologi.\nuntuk Fakultas/Prodi\n\nPENDAHULUAN\nTABLE OF\nCONTENT\nALUR VERIFIKASI MAHASISWA OLEH\nPENANGGUNG JAWAB FAKULTAS/PRODI\nSOP PELAKSANAAN PROGRAM\nMAGANG\nSTATISTIK PESERTA MSIB 4 & 5, DAN\nMONITORING PELAPORAN SIM\nMAGANG\nPENUGASAN PENANGGUNG JAWAB\nFAKULTAS/PRODI\nDIGITALISASI SPTJM DAN SR\nOVERVIEW MSIB 6\n\nWebsite Resmi ITS Career Center (Subdit. PK2 ITS)\nSubdit. PK2\nhttps://www.its.ac.id/careers/id/magang', 'Bagi Departemen, sistem baru SKEM ITS 2021 ini membantu Departemen untuk mendapatkan\ndata pemetaaan profile mahasiswa guna pengembangan Soft skills mahasiswa di Departemen dan\njuga berguna untuk Akreditasi Internasional Departemen.\nBagi ITS, sistem baru SKEM ITS 2021 ini akan menunjang ketersediaan data Kegiatan\nKemahasiswaan ITS secara terstruktur dan sistematis yang bisa digunakan sebagai basis data utama\nbagi pemeringkatan Bidang Kemahasiswan Nasional, pemeringkatan Internasional (THE/QS), dan akreditasi Internasional (ASIIN, AUNQA, IABEE).\nBagi Industri/Pengguna Lulusan ITS, sistem baru SKEM ITS 2021 membantu Industri/Pengguna\nLulusan ITS untuk mengetahui rekam jejak dibidang pengembangan Soft skills selama menjadi\nmahasiswa ITS. Sehingga Industri/Pengguna Lulusan ITS akan semakin menambah kepercayaan\ndalam merekrut lulusan ITS.\nHal-hal Teknis Pokok Dalam SKEM\nSistem SKEM ITS 2021 hanya berlaku bagi angkatan mahasiswa 2018 keatas.', 'dalam merekrut lulusan ITS.\nHal-hal Teknis Pokok Dalam SKEM\nSistem SKEM ITS 2021 hanya berlaku bagi angkatan mahasiswa 2018 keatas.\nKegiatan mahasiswa yang dilakukan tahun 2019 kebawah akan terverifikasi secara otomatis\noleh system.\nMahasiswa Angkatan 2018 dan 2019 dapat memulai SKEM sepeti table dibawah ini.\nANGKATAN MEMULAI SKEM\nBARU\nKETERANGAN\n2018 Semester 6 (2021) Kegiatan Sem 1 s/d 5, masih bisa dipakai untuk pengajuan\nSKEM di Sem 6\n2019 Semester 4 (2021) Kegiatan Sem 1 s/d 3, masih bisa dipakai untuk pengajuan\nSKEM di Sem 4.\n2020 Semester 2 (2021) Mahasiswa Sem 2 dapat mengajukan SKEM dengan\nkegiatan yang dilakukan di Sem 1.\nNilai IP SKEM dihitung berdasarkan persyaratan berikut:\nNO KETERANGAN\n1 Minimal 2 kegiatan dari 2 bagian yang berbeda.\n(Contoh: Kegiatan 1. Mahasiswa ikut kegiatan pada Bagian Kompetisi/ Magang/Wirausaha\n(Misal sebagai peserta Lomba), dan Kegiatan 2. Mahasiswa ikut kegiatan pada Bagian\nSummit/Internasionalisasi/Recognisi (misal mengikuti Webinar)']","Proyek P16 ""Next Generation Wireless Communication, B5G/6G, Reconfigurable Intelligent Surface, System Level Simulation, Artificial Intelligence-enhanced Wireless Research"" akan mengembangkan konsep dan arsitektur terdepan di luar 5G (B5G) dan 6G. Proyek ini juga akan mengidentifikasi dan memvalidasi solusi untuk masalah kunci melalui simulasi atau eksperimen prototipe. Selain itu, proyek ini akan melakukan penelitian tentang teknik kecerdasan buatan dan pembelajaran mesin yang diterapkan pada komunikasi nirkabel dan jaringan. Selain itu, proyek ini akan merancang dan menerapkan algoritma, model, dan protokol baru untuk mengoptimalkan kinerja jaringan nirkabel. Kolaborasi dengan tim penelitian juga akan dilakukan untuk mengelola proyek dan memastikan pengiriman tepat waktu."
17,Bagaimana cara menghubungi penyelenggara program internship ini?,"Kontak dapat dilakukan melalui nomor +886-5-2720411 ext. 23003, 23005, atau email coleng_dia@ccu.edu.tw. Alamatnya adalah No.168, Sec. 1, University Rd., Minhsiung, Chiayi 621301, Taiwan (R.O.C.).","['mendaftarkan program kegiatan wirausaha.\nb) Dengan bimbingan pusat inkubasi atau dosen pembimbing kewirausahaan/\nmentor, mahasiswa menyusun proposal kegiatan wirausaha. \nc) Melaksanakan kegiatan wirausaha di bawah bimbingan dosen pembimbing \natau mentor kewirausahaan.Buku Panduan Merdeka Belajar - Kampus Merdeka       20\nd) Menyampaikan hasil kegiatan wirausaha dan menyampaikan laporan dalam \nbentuk presentasi.\nTabel 2.4. Contoh Capaian Pembelajaran Mahasiswa Ilmu Komunikasi yang \nMengikuti Kegiatan Wirausaha (Bentuk  Blended )\nProdi CPL Wirausaha Ekuivalensi MKJumlah \nSKS\nIlmu \nKomunikasiMampu \nmelakukan \npraktik awal \nwirausaha dengan \npemahaman \nkonsep \nwirausaha yang \nkomprehensifKewirausahaan Sosial 3\nEtika Bisnis 2\nPengantar Manajemen dan Bisnis 2\nPemasaran Digital 3\nWirausaha\n1. Desain Wirausaha dan \nPresentasi\n2. Praktik Wirausaha\n3. Laporan Pelaksanaan \nWirausaha dan Presentasi3\n4\n3\nJumlah 6 MK 20 SKS\nPenjelasan Tabel 2.4.', 'dengan bobot 20 SKS/40 SKS.\nd) Selama mengikuti program wirausaha, mahasiswa dibimbing oleh dosen \npembimbing, mentor pakar wirausaha/pengusaha yang telah berhasil.   \ne) Perguruan tinggi yang memiliki pusat inkubasi diharapkan mengintegrasikan \nprogram ini dengan pusat tersebut. Bagi yang belum memiliki dapat bekerja \nsama dengan pusat-pusat inkubasi dan akselerasi bisnis.\nf) Perguruan tinggi bekerja sama dengan institusi mitra dalam menyediakan \nsistem pembelajaran kewirausahaan yang terpadu dengan praktik langsung. \nSistem pembelajaran ini dapat berupa fasilitasi pelatihan, pendampingan, \ndan bimbingan dari mentor/pelaku usaha.\ng) Menyusun pedoman teknis kegiatan pembelajaran melalui wirausaha.\n2) Mahasiswa\na) Dengan persetujuan dosen pembimbing akademik (DPA), mahasiswa \nmendaftarkan program kegiatan wirausaha.\nb) Dengan bimbingan pusat inkubasi atau dosen pembimbing kewirausahaan/\nmentor, mahasiswa menyusun proposal kegiatan wirausaha.', '“Lengkapi Sekarang” \n2. Klik tab “Penugasan tiap Program Studi” . Pada laman tersebut Anda dapat  \nmemasukkan alamat email Penanggung Jawab Fakultas/Prodi. \n3. Untuk melihat panduan pengisian, silakan klik “Lihat Panduan” \n4. Setelah informasi alamat email Penanggung Jawab Fakultas/Prodi sudah Anda lengkapi,  \nmaka klik “Simpan” .\n11 PENUGASAN PENANGGUNG JAWAB FAKULTAS/PRODI \n2\n3\n4\nCatatan: \n●Pimpinan Perguruan Tinggi perlu  \nmenugaskan Penanggung Jawab  \nFakultas/Prodi untuk seluruh Program  \nStudi yang terdapat di PT \n●Jika terdapat ketidaksesuaian data dari  \nProgram Studi yang ada di platform  \ndengan Program Studi di PT, harap  \nmelaporkan hal tersebut melalui Pusat  \nBantuan \nKementerian Pendidikan, Kebudayaan, Riset, dan \nTeknologi Kementerian Pendidikan, Kebudayaan, Riset dan \nTeknologi Subdit. PK2 \n5\n5. Anda dapat mencentang kotak “Jangan tampilkan ini lagi” , sehingga untuk penyimpanan berikutnya tidak akan  \nmuncul notifikasi seperti di atas.', 'application form, prepare\r\napplication materials, and send\r\nthem in a ZIP-compressed file to\r\ncoleng_dia@ccu.edu.tw.\r\n• The title of the e-mail please be\r\nmarked with “Application for 2024\r\nCCU/COE International Internship”.\r\nAll the intern research topics and\r\ntheir requirements are listed as\r\nfollows.\r\n• Application deadline: Mar. 3, 2024\r\n• More detailed information about\r\napplication can be found on the\r\nwebsite\r\nhttps://sites.google.com/view/ccu-\r\ncoe-internship/home\r\nCONTACT\r\n+886-5-2720411 ext. 23003, 23005\r\ncoleng_dia@ccu.edu.tw\r\nNo.168, Sec. 1, University Rd., Minhsiung,\r\nChiayi 621301, Taiwan (R.O.C.)\r\n\r\nINTERN RESEARCH TOPICS\r\nNumber P1\r\nProject title\r\nTrustable Artificial Intelligence for Critical Applications and\r\n6G Security\r\nDescription of the research\r\nArtificial Intelligence (AI) technologies, 6G networking,\r\nand quantum computing are the leading forces in\r\nbringing the world to an era of better intelligence and full']","Anda dapat menghubungi penyelenggara program internship ini melalui email coleng_dia@ccu.edu.tw atau melalui nomor telepon +886-5-2720411 ext. 23003 atau 23005. Alamat lengkap penyelenggara program ini adalah No.168, Sec. 1, University Rd., Minhsiung, Chiayi 621301, Taiwan (R.O.C.). Informasi lebih detail mengenai aplikasi dapat ditemukan di website https://sites.google.com/view/ccu-coe-internship/home."
18,Apa yang harus dilakukan jika ingin menghapus atau menarik artikel yang telah diunggah?,"Isi form di link: https://its.id/FHAJTeknikITS untuk Jurnal Teknik, https://its.id/FHAJSainsSeniITS untuk Jurnal Sains & Seni, atau https://its.id/FHAJRepositoryITS untuk Repository.","['\uf0b7   Pengecekan file yang TERUNGGAH dapat dilihat di\n    http://lpmp2ki.its.ac.id/pomits.\n\n\uf0b7   Jika terdapat penghapusan/penarikan artikel, dapat mengisi form pada link\n    \uf031\uf02e http://bit.ly/FHAJTeknikITS, untuk Jurnal Teknik ITS;\n    \uf032\uf02e http://bit.ly/FHAJSainsSeniITS, untuk Jurnal Sains &Seni ITS;\n    \uf033\uf02e http://bit.ly/FHAJRepositoryITS, untuk Repository.\n\n\n\uf0b7   List data Artikel terhapus dapat dilihat pada website jurnal.\n    (http://ejurnal.its.ac.id, yang diupdate tiap 3 hari)\n\n\uf0b7   Artikel - artikel yang TIDAK MEMENUHI KETENTUAN PUBLIKASI (gaya selingkung tidak\n    sesuai format dan file pendukung tidak lengkap) tidak akan DIPUBLIKASIKAN di\n    Jurnal POMITS.\n\n\uf0b7   Periode unggah artikel untuk yudisium 122 adalah sampai dengan\n    7 Agustus 2020, pukul 24.00 WIB', '3. Artikel yang terbit secara periodik\n\n   Artikel yang dipublikasikan secara periodik, termasuk: (i) jurnal, (ii) majalah, (iii) surat\n   kabar, (iv) buletin, (v) blog, dan (vi) platform online lainnya yang menerbitkan artikel.\n   Jurnal dan majalah mempunyai identitas dengan memiliki nomor volume/edisi. Sebagai\n   contoh sebuah jurnal dengan identitas volume 6, nomor 2.\n   Dalam hal ini nomor volume dicetak miring diikuti oleh nomor dalam tanda kurung\n   tetapi tidak miring. Contoh; 6 (2)\n\n   a. Artikel jurnal dengan DOI\n   Gunakan kapitalisasi kalimat pada judul artikel. Gunakan huruf kapital pada huruf\n   pertama setiap kata utama dalam judul jurnal. Cetak miring judul jurnal dan nomor\n   volume. Tambahkan nomor penerbitan jika tersedia, sertakan nomor DOI; biasanya\n   muncul di halaman pertama artikel.\n Format:\n Author, A. A., Author, B. B., & Author, C. C. (year). Title of article. Title of Periodical,\n      xx, pp-pp. https://doi.org/xxxx', ""melakukan UNGGAH di Jurnal Repository, menggunakan login 'mahasiswa', dengan.\nkata sandi 'M4h4sisw4lTs!' ke alamat 'https://ejurnal.its.ac.id/index.php/index/login'\ndengan mengunggah file artikel dan file Form Telaah(dalam format pdf) saja.\nPengecekan file vang TERuNGGAH dapat dilihat di\nhttps://lpmp2ki.its.ac.id/pomits.\nJika terdapat penghapusan/penarikan artikel, dapat mengisi form pada link :\nhttps://its.id/FHAJTeknikITSPOMITS, untuk Jurnal Teknik ITS;\n1.-\nhttps:/l/its.id/FHAJSainsSenilTSPOMITS, untuk Jurnal Sains &Seni ITS;\n3.https://its.id/FHAJRepositorylTSPOMITS, untuk Jurnal Repository..\n Penghapusan Artikel akan dilakukan setelah yudisium berakhir.\nArtikel - artikel yang TIDAK MEMENUHI KETENTUAN PUBLIKASI (gaya selingkung\ntidak sesuai format dan file pendukung tidak lengkap) tidak akan DIPUBLIKASIKAN\ndi Jurnal Teknik ITS dan Jurnal Sains & Seni ITS.\nPeriode unggah artikel untuk yudisium 29 adalah sampai dengan \n15 Februari 2024 pukul 24.00 WIB"", 'Teknologi Subdit. PK2 \n5\n5. Anda dapat mencentang kotak “Jangan tampilkan ini lagi” , sehingga untuk penyimpanan berikutnya tidak akan  \nmuncul notifikasi seperti di atas. \n6. Jika penugasan Penanggung Jawab Fakultas/Prodi sudah sesuai, klik “Ya, Simpan” \n7. Jika penyimpanan email Penanggung Jawab Fakultas/Prodi berhasil akan muncul pemberitahuan dengan kotak  \nberwarna hijau. \n8. Jika Anda ingin mengubah email Penanggung Jawab Fakultas/Prodi yang telah tersimpan, silakan klik “Ubah” \n6\n7PENUGASAN PENANGGUNG JAWAB FAKULTAS/PRODI \n8\nKementerian Pendidikan, Kebudayaan, Riset, dan \nTeknologi Kementerian Pendidikan, Kebudayaan, Riset dan \nTeknologi Subdit. PK2 \n18. Penanggung Jawab Fakultas/Prodi  \nAnda akan menerima email notifikasi  \npenugasan verifikasi data akademik  \nmahasiswa untuk prodi tersebut untuk  \nprogram Kampus Merdeka. Klik  \n“Verifikasi Sekarang”. \n9. Contoh email notifikasi penugasan  \njika belum ada mahasiswa yang  \nterdaftar \nMohon cek folder Spam jika email']","Untuk menghapus atau menarik artikel yang telah diunggah, Anda dapat mengisi form pada link yang sesuai dengan jenis jurnal tempat artikel tersebut diunggah. Berikut adalah link untuk menghapus atau menarik artikel:
1. Jurnal Teknik ITS: http://bit.ly/FHAJTeknikITS
2. Jurnal Sains & Seni ITS: http://bit.ly/FHAJSainsSeniITS
3. Jurnal Repository: http://bit.ly/FHAJRepositoryITS

Penghapusan artikel akan dilakukan setelah periode yudisium berakhir. Artikel yang tidak memenuhi ketentuan publikasi, seperti gaya selingkung tidak sesuai format dan file pendukung tidak lengkap, tidak akan dipublikasikan di Jurnal Teknik ITS dan Jurnal Sains & Seni ITS."
19,Apa yang terjadi dengan artikel yang tidak memenuhi ketentuan publikasi?,Artikel tersebut tidak akan dipublikasikan di Jurnal Teknik ITS dan Jurnal Sains & Seni ITS.,"['3. Artikel yang terbit secara periodik\n\n   Artikel yang dipublikasikan secara periodik, termasuk: (i) jurnal, (ii) majalah, (iii) surat\n   kabar, (iv) buletin, (v) blog, dan (vi) platform online lainnya yang menerbitkan artikel.\n   Jurnal dan majalah mempunyai identitas dengan memiliki nomor volume/edisi. Sebagai\n   contoh sebuah jurnal dengan identitas volume 6, nomor 2.\n   Dalam hal ini nomor volume dicetak miring diikuti oleh nomor dalam tanda kurung\n   tetapi tidak miring. Contoh; 6 (2)\n\n   a. Artikel jurnal dengan DOI\n   Gunakan kapitalisasi kalimat pada judul artikel. Gunakan huruf kapital pada huruf\n   pertama setiap kata utama dalam judul jurnal. Cetak miring judul jurnal dan nomor\n   volume. Tambahkan nomor penerbitan jika tersedia, sertakan nomor DOI; biasanya\n   muncul di halaman pertama artikel.\n Format:\n Author, A. A., Author, B. B., & Author, C. C. (year). Title of article. Title of Periodical,\n      xx, pp-pp. https://doi.org/xxxx', '\uf0b7   Mahasiswa yang Dosen Pembimbingnya memilih untuk MEMPUBLIKASIKAN\n    artikelnya pada Jurnal POMITS, dapat melakukan UNGGAH, dengan mengikuti langkah\n    pada BUKU PANDUAN TATA CARA UNGGAH. File yang HARUS DIUNGGAH adalah\n    (ukuran masing-masing file tidak boleh lebih dari 2 MB):\n    \uf031\uf02e Artikel hasil dari Tugas Akhir, dalam format Ms. Word yang telah mengikuti tem-\n       plate. (selain format Ms.Word artikel DITOLAK/REJECTED)\n    \uf032\uf02e Formulir Hak Cipta.\n    \uf033\uf02e Form Telaah Artikel POMITS, dalam format PDF.\n    \uf034\uf02e Form Revisi/Perbaikan/Penyempurnaan TA yang berisi nama penguji beserta\n       komentar dari penguji, dalam format PDF. (Mohon nama penguji tidak disingkat/\n       tidak hanya TTD saja)\n    \uf035\uf02e Template, Formulir Hak Cipta, Buku Panduan Tata Cara Unggah, dan Form Telaah\n       Artikel dapat diunduh pada link:\n       http://ejurnal.its.ac.id/index.php/teknik (Jurnal Teknik ITS)\n        http://ejurnal.its.ac.id/index.php/sains_seni (Jurnal Sains&Seni ITS)', 'Pemberitahuan\nUnggah Artikel POmITS\nUNGGAH artikel WAJIB dilakukan oleh MAHASISWA PENDAFTAR YUDISIUM 129\n Mahasiswa yang Dosen Pembimbingnya memilih untuk MEMpuBLIKAsIKAN\nartikelnya pada Jurnal POmITS, dapat melakukan UNGGAH, dengan mengikuti langkah\npada BUKU PANDUAN TATA CARA UNGGAH. File yang HARUS DIUNGGAH adalah\n(ukuran masing-masing file tidak boleh lebih dari 2 MB):\nArtikel hasil dari Tugas Akhir, dalam format Ms. Word yang telah mengikuti tem-\n1.\nplate. (selain format Ms.Word artikel DITOLAK/REJECTED)\nFormulir Hak Cipta, dalam format PDF.\nForm Telaah Artikel POmITs, dalam format PDF.\nForm Revisi/Perbaikan/Penyempurnaan TA yang berisi nama penguji beserta\ntidak hanya TTD saja)\n Template, Formulir Hak Cipta, Buku Panduan Tata Cara Unggah, dan Form Telaah\n5.\nArtikel dapat diunduh pada link:\nhttps://ejurnal.its.ac.id/index.php/teknik (Jurnal Teknik ITS)\nhttps://ejurnal.its.ac.id/index.php/sains_seni (Jurnal Sains&Seni ITS)\nSection yang bisa dipilih pada Jurnal Teknik ITS:', '• TEGAS DAN KONSISTEN\nLaporan Magang harus tegas dan konsisten sehingga tidak terjadi kontradiksi antara bagian yang satu dengan bagian lainnya, baik dalam hal substansi, istilah, maupun teknik penulisan penyajian.\nPenulisan, penyerahan, evaluasi, dan perbaikan Laporan Magang harus dilakukan sesuai dengan ketentuan yang berlaku. Untuk memenuhi syarat tersebut, dengan ini seorang penulis Laporan Magang harus:\n• Benar-benar menguasai masalah yang dilaporkan.\n• Mempunyai minat, kesanggupan, obyektifitas, ketelitian, dan kemampuan analisis dalam menyusun laporan.\n• Mampu bekerjasama, serta tanggap dan terbuka terhadap kritik.\n• Mampu menggunakan bahasa tulisan yang baik.\n• Dapat menggunakan kata-kata, istilah, kalimat dan gaya bahasa yang sederhana, jelas, dan mudah dimengerti.\n• Mampu memilih dan mengorganisir data yang diperlukan.\n• Mampu mengamati dan menilai dengan jeli berbagai proses, peristiwa, manfaat dan kelemahan yang ada selama melakukan kegiatan Magang.\n7.4']","Artikel yang tidak memenuhi ketentuan publikasi akan DITOLAK atau REJECTED. Hal ini berlaku terutama untuk artikel yang tidak disusun dalam format Ms. Word sesuai dengan template yang ditentukan. Selain itu, artikel yang tidak memenuhi persyaratan lain seperti tidak mengunggah Formulir Hak Cipta, Form Telaah Artikel POMITS, atau Form Revisi/Perbaikan/Penyempurnaan TA juga dapat ditolak. Oleh karena itu, penting bagi mahasiswa untuk memastikan bahwa artikel yang diunggah memenuhi semua ketentuan yang telah ditetapkan."
