,question,ground_truth,contexts,answer
0,Apa itu program IUP?,"International Undergraduate Program yang selanjutnya disingkat IUP adalah program pendidikan sarjana yang dilaksanakan dalam bahasa Inggris dan mahasiswa wajib mengikuti kegiatan internasional sekurang-kurangnya satu kali selama masa studi dalam bentuk Joint degree/Double Degree, student exchange, final project, internship, atau short program dengan perguruan tinggi mitra ITS di luar negeri.","['Program MB-KM, mengajukan Form 1 Matching Up Program MB-KM Ke MK Inti Prodi (jika konversi kegiatan ke Mata Kuliah Inti) dan Form 2 Surat Permohonan Kredit Transfer (Learning Agreement). 8. Form 1 dan Form 2 dapat diakses di link https://its.id/Form12SEWR1RencanaMBKM.', 'Subdit. PK2\nADVANCING HUMANITY\niTS\nf°\n2\nSOP PELAKSANAAN PROGRAM MAGANG\n2023\n\nSubdit. PK2\nADVANCING HUMANITY\niTS\nSOP PELAKSANAAN PROGRAM MAGANG\nFLAGSHIP DI ITS\nMahasiswa\nDepartemen\nSubdirektorat\nPengembangan\nKewirausahaan dan Karir\nMitra Magang dan Studi\nIndependen\nStart\nTidak\nMemeniksa\nDatabese track record Magary:\nMahasiova\n\nSubdit. PK2\nADVANCING HUMANITY\niTS\nSOP PELAKSANAAN PROGRAM MAGANG\nFLAGSHIP DI ITS\nMahasisw\nDepartemen\nSubdirektorat\nPengembangan\nKewirausahaan dan Karir\nMitra Magang dan Studi\nIndependen\nSPTJM\nTerrot\nTidak mengilcuti MSID\nTidak\nLOLOS\nPKQ mengunduh data\npenerimaan MSB 4\nData Penetia Mohai\nPinkonsoldast derana Pl\nPK2 monyusun jedwat\nBerdiskusi terkait program selama konsolidasi\nFinish', 'with the format written on the program web\n• After that, ITS GE will reply back to you email regarding further step to join the program\nwww.its.ac.id INSTITUT TEKNOLOGI SEPULUH NOPEMBER, Surabaya - Indonesia\n- Thank You-\nwww.its.ac.id its_campus institut teknologu sepuluh nopember', '2. GCA adalah program persiapan Study Abroad yang berlangsung selama 8 pertemuan selama 8 pekan dan diselenggarakan\nsatu kali setahun. Program ini sangat sesuai bagi mahasiswa yang ingin mempersiapkan diri secara mendalam. Sementara\nitu, GCW adalah program persiapan Study Abroad yang berlangsung selama 3 hari dan diadakan tiga kali dalam satu\nsemester. GCW lebih cocok bagi mahasiswa yang telah memiliki dasar pengetahuan. Untuk informasi lebih lanjut tentang\nprogram ini, silahkan membaca detil informasi di https://www.its.ac.id/international/its-goes-global/students/global-\ncompetencies-program/\n\n3. Sertifikat GCA/GCW tidak diwajibkan bagi mahasiswa yang mengikuti kegiatan Studi Ekskursi (SE), Short Program in-country,\nGPbL in-country, atau program internasionalisasi in-country lainnya yang diselenggarakan oleh ITS, serta program AIESEC,\nlomba internasional, dan lain sebagainya yang tidak membutuhkan rekomendasi dan dukungan dana dari ITS.', 'Nomor : 1710/IT2.I/T/TU.00.08/II/2024 Perihal : Pelaksanaan Perencanaan Kegiatan SKEM/ Program MB-KM Lampiran : 1 lembar \nKepada Yth. Para Dekan Para Kepala Departemen Para Kepala Program Studi Sarjana dan Sarjana Terapan di Tempat', 'Sehubungan dengan kurikulum Program Sarjana dan Sarjana Terapan tahun 2023 – 2028 maka Berikut kami sampaikan beberapa teknis terkait pelaksanaan perencanaan kegiatan Satuan Kegiatan Ekstrakurikuler Mahasiswa (SKEM)/ program Merdeka Belajar–Kampus Merdeka (MB-KM) disampaikan bahwa:']",Saya tidak tahu.
1,Apa saja dana pendidikan di ITS?,"UKT, SPP, SPI dan SPA.","['Pasa1 14\n(1) Mahasiswa yang merupakan dosen tetap ITS, selanjutnya disebut pegawai pelajar, \n  dapat memperoleh keringanan dana SPP dengan ketentuan sebagai berikut:\n  a. tercatat sebagai mahasiswa aktif program doktor pada salah satu Program Studi di \n   ITS;\n  b. berusia paling rendah 35 tahun;\n  c. untuk dosen tetap PNS telah mendapatkan surat keputusan dari kementerian \n   tentang tugas belajar dengan beasiswa atau sedang diusulkan oleh ITS untuk \n   mendapatkan surat keputusan dari kementerian tentang tugas belajar dengan \n   beasiswa; dan\n  d. Untuk dosen tetap Non PNS telah mendapatkan surat keputusan dari Rektor \n   tentang tugas belajar dengan beasiswa.\n(2) Beasiswa yang dimaksud sebagaimana pada ayat (1) huruf c dan huruf d berupa \n  pembiayaan untuk keringanan SPP yang bersumber dari dana ITS.\n(3) Pengusulan oleh ITS sebagaimana dimaksud pada ayat (1) huruf c telah mendapat \n  rekomendasi dari Wakil Rektor yang membidangi sumber daya manusia.', 'Pasa1 14\n(1) Mahasiswa yang merupakan dosen tetap ITS, selanjutnya disebut pegawai pelajar, \n  dapat memperoleh keringanan dana SPP dengan ketentuan sebagai berikut:\n  a. tercatat sebagai mahasiswa aktif program doktor pada salah satu Program Studi di \n   ITS;\n  b. berusia paling rendah 35 tahun;\n  c. untuk dosen tetap PNS telah mendapatkan surat keputusan dari kementerian \n   tentang tugas belajar dengan beasiswa atau sedang diusulkan oleh ITS untuk \n   mendapatkan surat keputusan dari kementerian tentang tugas belajar dengan \n   beasiswa; dan\n  d. Untuk dosen tetap Non PNS telah mendapatkan surat keputusan dari Rektor \n   tentang tugas belajar dengan beasiswa.\n(2) Beasiswa yang dimaksud sebagaimana pada ayat (1) huruf c dan huruf d berupa \n  pembiayaan untuk keringanan SPP yang bersumber dari dana ITS.\n(3) Pengusulan oleh ITS sebagaimana dimaksud pada ayat (1) huruf c telah mendapat \n  rekomendasi dari Wakil Rektor yang membidangi sumber daya manusia.', '1. Setiap mahasiswa ITS yang ingin mendaftar program internasional di perguruan tinggi mitra ITS luar negeri yang\nmembutuhkan surat rekomendasi atau dana dukungan dari ITS di antaranya IISMA/IISMA-Vo, pertukaran pelajar (exchange),\nlab-internship, short program, atau program lain di luar negeri, diharuskan memiliki sertifikat Global Competency\nWorkshop (GCW) atau Global Competency Academy (GCA). Sertifikat ini hanya bisa diperoleh dengan mengikuti program\nGCW atau GCA.', '5. Surat persetujuan orang tua/wali (contoh terlampir)\n6. Surat pakta integritas (contoh terlampir\nPERTANYAAN YANG SERING DITANYAKAN\nT. Mahasiswa dari perguruan tinggi apa saja yang dapat mengikuti program Pertukaran Mahasiswa Merdeka?\nJ. Mahasiswa dari perguruan tinggi negeri maupun swasta non vokasi di bawah Direktorat Jenderal Pendidikan Tinggi, Kementerian Pendidikan, Kebudayaan, Riset, dan Tenologi RI.\nJ. Apakah Pertukaran Mahasiswa Merdeka 2021 untuk mahasiswa S1 saja?\nA. Pertukaran Mahasiswa Merdeka 2021 diperuntukkan untuk mahasiswa jenjang St.\nT. Apakah mahasiswa yang lolos akan menerima bantuan potongan\nUKT?\nJ. Mahasiswa akan menerima bantuan potongan UKT sebesar maksimal Rp 2.400.000 dengan syarat bukan penerima bantuan\nUKT dari beasiswa pemerintah lainnya.\nT. Bagaimana jika UKT saya lebih kecil dari 2,4 juta?\nJ. Bantuan UKT akan dibayarkan at cost (sesuai besaran UKT mahasiswa).', 'Pasal 17\n(1) Mahasiswa yang merupakan tenaga kependidikan tetap ITS, selanjutnya disebut \n  pegawai pelajar, dapat memperoleh keringanan dana SPP dengan ketentuan sebagai \n  berikut:\n  a. tercatat sebagai Mahasiswa aktif program magister atau doktor pada salah satu \n   Program Studi di ITS;\n  b. berusia minimal 27 (dua puluh tujuh) tahun untuk Mahasiswa program magister, \n   atau berusia minimal 35 (tiga puluh lima) tahun untuk Mahasiswa program doktor;\n  c. untuk tenaga kependidikan tetap PNS telah mendapatkan surat keputusan dari \n   Kementerian tentang tugas belajar dengan beasiswa atau sedang diusulkan oleh \n   ITS untuk mendapatkan surat keputusan dari kementerian tentang tugas belajar \n   dengan beasiswa; dan\n  d. untuk tenaga kependidikan tetap Non PNS telah mendapatkan surat keputusan dari \n   Rektor tentang tugas belajar dengan beasiswa.\n(2) Beasiswa yang dimaksud sebagaimana pada ayat (1) huruf c dan huruf d berupa', 'Pasal 17\n(1) Mahasiswa yang merupakan tenaga kependidikan tetap ITS, selanjutnya disebut \n  pegawai pelajar, dapat memperoleh keringanan dana SPP dengan ketentuan sebagai \n  berikut:\n  a. tercatat sebagai Mahasiswa aktif program magister atau doktor pada salah satu \n   Program Studi di ITS;\n  b. berusia minimal 27 (dua puluh tujuh) tahun untuk Mahasiswa program magister, \n   atau berusia minimal 35 (tiga puluh lima) tahun untuk Mahasiswa program doktor;\n  c. untuk tenaga kependidikan tetap PNS telah mendapatkan surat keputusan dari \n   Kementerian tentang tugas belajar dengan beasiswa atau sedang diusulkan oleh \n   ITS untuk mendapatkan surat keputusan dari kementerian tentang tugas belajar \n   dengan beasiswa; dan\n  d. untuk tenaga kependidikan tetap Non PNS telah mendapatkan surat keputusan dari \n   Rektor tentang tugas belajar dengan beasiswa.\n(2) Beasiswa yang dimaksud sebagaimana pada ayat (1) huruf c dan huruf d berupa']",Dana pendidikan di ITS meliputi keringanan dana SPP untuk mahasiswa yang merupakan dosen tetap ITS atau tenaga kependidikan tetap ITS. Keringanan dana SPP tersebut dapat diperoleh dengan ketentuan-ketentuan tertentu sesuai dengan Peraturan Rektor No. 5/2023. Dana pendidikan juga mencakup pembiayaan untuk keringanan SPP yang bersumber dari dana ITS bagi mahasiswa yang memenuhi syarat-syarat yang telah ditetapkan.
2,Apa tujuan dibuat SKEM?,"1. Menanamkan sikap ilmiah, merangsang daya kreasi dan inovasi, meningkatkan kemampuan meneliti, menulis karya ilmiah, meningkatkan kemampuan berkomunikasi, serta pemahaman profesi. 2. Meningkatkan kesehatan / kebugaran, prestasi dan apresiasi budaya melalui penyaluran minat dan bakat dalam bidang seni dan olah raga. 3. Meningkatkan kemampuan mahasiswa dalam kerjasama (team work), komunikasi, ketrampilan manajemen, berorganisasi dan kepemimpinan. 4. Meningkatkan pengabdian kepada masyarakat, rasa kepedulian terhadap sesama, serta menanamkan rasa cinta tanah air.","['Sehubungan dengan kurikulum Program Sarjana dan Sarjana Terapan tahun 2023 – 2028 maka Berikut kami sampaikan beberapa teknis terkait pelaksanaan perencanaan kegiatan Satuan Kegiatan Ekstrakurikuler Mahasiswa (SKEM)/ program Merdeka Belajar–Kampus Merdeka (MB-KM) disampaikan bahwa:', 'kepentingan yang dilakukan oleh organisasi tersebut (misalnya melalui produk atau jasa yang dihasilkan).\n• BAB 3. PELAKSANAAN MAGANG\n3.1. Posisi / Kedudukan Kegiatan Magang\n• Mahasiswa dapat menguraikan kedudukan / posisi kegiatan yang ditugaskan oleh mitra magang dalam lingkup pekerjaan / proyek keseluruhan. Hal ini dimaksudkan untuk mengetahui apakah mahasiswa memahami kaitan antara apa yang telah dilakukan / dihasilkan dengan pekerjaan tersebut.\n3.2. Metodologi penyelesaian Tugas\n• Mahasiswa menguraikan kasus / masalah menjadi topik pembahasan. Mahasiswa menganalisis kasus / masalah tersebut dengan menggunakan teori atau metode yang relevan. Analisis bukan mendeskripsikan teori, namun menggunakan teori guna menjelaskan dan membandingkan dengan kasus/masalah yang diangkat.\nUraian mengenai teori atau metode harus menyebutkan referensi yang valid dan handal.\n3.3. Pembelajaran Hal Baru', 'Nomor : 1710/IT2.I/T/TU.00.08/II/2024 Perihal : Pelaksanaan Perencanaan Kegiatan SKEM/ Program MB-KM Lampiran : 1 lembar \nKepada Yth. Para Dekan Para Kepala Departemen Para Kepala Program Studi Sarjana dan Sarjana Terapan di Tempat', 'Konsep Satuan Kredit Ekstrakurikuler Mahasiswa\nDirektorat Kemahasiswaan \nEdisi Revisi (24 Agustus 2021)\n\nTujuan Dibuat SKEM\n1. Menanamkan sikap ilmiah, merangsang daya kreasi dan inovasi, meningkatkan\nkemampuan meneliti, menulis karya ilmiah, meningkatkan kemampuan berkomunikasi,\nserta pemahaman profesi.\n2. Meningkatkan kesehatan / kebugaran, prestasi dan apresiasi budaya melalui penyaluran\nminat dan bakat dalam bidang seni dan olah raga.\n3. Meningkatkan kemampuan mahasiswa dalam kerjasama (team work), komunikasi,\nketrampilan manajemen, berorganisasi dan kepemimpinan.\n4. Meningkatkan pengabdian kepada masyarakat, rasa kepedulian terhadap sesama, serta\nmenanamkan rasa cinta tanah air.', 'Kredit SKEM\n4 Bagian:\n\n1. Kompetisi, wirausaha, dan magang Ng\n\n2. Organisasi kepemimpinan & minat bakat Xx\n\n3. Pengabdian masyarakat\n\n4. Internasinalisasi, Summit dan Rekognisi\n\n) Total Kredit SKEM\n\nNOTES:\n\nIl. Khusus kegiatan LKMM tidak memerlukan bobot sebagai faktor pengkali sehingga\nlangsung kepada nilai SKEM dibagi dengan jumlah nilai SKEM untuk mendapatkan IP\nSKEM.\n\n2 Penilaian IP SKEM harus minimal menyertakan dua katagori kecuali Magang dan\nWirausaha sebagai owner atau direktur utama.\n\n3. Dalam satu semester IP Skem harus minimal 2.1 agar bisa dinyatakan lulus.\n\n4 Skem dengan formula baru ini hanya berlaku pada mahasiswa Angkatan 2018 keatas,\nsedangkan untuk mahasiswa Angkatan 2017 kebawah masih berlaku SKEM lama.\n\n5. Bagi mahasiswa dengan keterbatasan tertentu sehingga tidak memungkinkan untuk\nmengikuti SKEM baru, TIM Ditmawa akan membentuk tim review internal dengan\nmelibatkan TKK Departemen.', 'B. Bagi Dosen Wali 1. Melakukan pendampingan dan pengecekan dari pengajuan perencanaan kegiatan SKEM/ program MB-KM yang diajukan oleh mahasiswa. 2. Jika dinilai sudah sesuai pengajuan perencanaan Kegiatan SKEM/ Program MB-KM oleh mahasiswa, dosen wali dapat melakukan persetujuan FRS. \nDemikian Surat Edaran ini dibuat untuk dilaksanakan dengan sebaik - baiknya. Atas perhatiannya diucapkan terimakasih.']","Tujuan dibuat SKEM adalah untuk:
1. Menanamkan sikap ilmiah, merangsang daya kreasi dan inovasi, meningkatkan kemampuan meneliti, menulis karya ilmiah, meningkatkan kemampuan berkomunikasi, serta pemahaman profesi.
2. Meningkatkan kesehatan/kebugaran, prestasi, dan apresiasi budaya melalui penyaluran minat dan bakat dalam bidang seni dan olahraga.
3. Meningkatkan kemampuan mahasiswa dalam kerjasama (team work), komunikasi, ketrampilan manajemen, berorganisasi, dan kepemimpinan.
4. Meningkatkan pengabdian kepada masyarakat, rasa kepedulian terhadap sesama, serta menanamkan rasa cinta tanah air."
3,Apa itu Beasiswa Prioritas?,"Beasiswa Prioritas merupakan program beasiswa yang memberikan kesempatan kepada pendaftar untuk dapat melakukan pendaftaran pada dua program sekaligus, yaitu pada program Beasiswa Kemitraan/Kerja Sama LPDP dan pada salah satu program Beasiswa Afirmasi/Beasiswa Targeted/Beasiswa Umum tujuan luar negeri.","['Dipublikasikan tanggal 11 Januari 2024\nprogram beasiswa lain yang dipilih, sesuai\ndengan syarat dan ketentuan yang berlaku.\nApa saja komponen Dana yang diberikan?\n1. Dana Pendidikan\na. Tuition Fee\nb. Dana Pendaftaran\nc. Dana Tunjangan Buku\nd. Dana Penelitian Tesis\ne. Dana Seminar Internasional\nf. Dana Publikasi Jurnal Internasional\n2. Dana Pendukung\na. Dana Transportasi\nb. Dana Aplikasi Visa\nc. Dana Asuransi Kesehatan\nd. Dana Kedatangan\ne. Dana Hidup Bulanan\nf. Dana Lomba Internasional\ng. Dana keadaaan darurat (jika diperlukan)\nApa saja persyaratan umum pendaftaran\nBeasiswa Prioritas LPDP – Campus\nFrance Program Master?\nPersyaratan umum Beasiswa Prioritas LPDP –\nCampus France Program Master adalah sebagai\nberikut:\n1. Warga Negara Indonesia.\n2. Telah menyelesaikan studi program diploma\nempat (D4) atau sarjana (S1).\n3. Pendaftar yang telah menyelesaikan studi\nmagister (S2) tidak diizinkan mendaftar.\n4. Bagi pendaftar lulusan perguruan tinggi luar', 'Dipublikasikan tanggal 11 Januari 2024\nTentang LPDP\nLPDP berkomitmen untuk mempersiapkan\npemimpin dan profesional masa depan serta\nmendorong inovasi demi terwujudnya Indonesia\nyang sejahtera, demokratis, dan berkeadilan.\nLPDP menyelenggarakan program beasiswa\nmagister/doktor serta beasiswa dokter spesialis,\ndokter subspesialis dan Fellowship untuk putra-\nputri terbaik Indonesia.\nApa itu Beasiswa Prioritas?\nBeasiswa Prioritas merupakan program beasiswa\nyang memberikan kesempatan kepada pendaftar\nuntuk dapat melakukan pendaftaran pada dua\nprogram sekaligus, yaitu pada program Beasiswa\nKemitraan/Kerja Sama LPDP dan pada salah satu\nprogram Beasiswa Afirmasi/Beasiswa\nTargeted/Beasiswa Umum tujuan luar negeri.\nApa itu Beasiswa Prioritas LPDP – Campus\nFrance Program Master?\nBeasiswa Prioritas LPDP – Campus France\nProgram Master memberikan kesempatan bagi\npendaftar untuk dapat melakukan pendaftaran\npada Beasiswa Kemitraan LPDP – Campus\nFrance dan beasiswa Magister Luar Negeri', 'Panduan Pendaftaran\nBeasiswa Prioritas\nLPDP - Campus France\nProgram Master\nTahun 2024\nlpdp.kemenkeu.go.id', 'beasiswa dengan kewajiban pengembalian\ndana studi yang telah diterima dan\npemblokiran untuk mengikuti program LPDP\ndi masa mendatang.\nBagaimana dengan ketentuan\nPengabdian yang ditetapkan LPDP?\n1. Penerima Beasiswa wajib kembali dan\nmengabdi di Indonesia setelah selesai studi\nsesuai dengan ketentuan LPDP.\n2. Kembali ke Indonesia dan berkontribusi di\nIndonesia selama 2 kali masa studi ditambah', 'Siapakah Sasaran Beasiswa Prioritas\nLPDP – Campus France Program Master?\n1. Warga Negara Indonesia (WNI)\n2. PNS/TNI/POLRI\nSeperti Apa Skema Prioritas LPDP –\nCampus France Program Master?\nPendaftar wajib mendaftar secara bersamaan\npada beasiswa Kemitraan LPDP – Campus France\nProgram Master dan salah satu program Magister\nbeasiswa Afirmasi/Targeted/Umum tujuan luar\nnegeri, dengan skema berikut.\n1. Beasiswa Kemitraan LPDP – Campus France\nProgram Master:\na. Beasiswa LPDP – Campus France\nProgram Master diperuntukkan bagi\nWarga Negara Indonesia untuk dapat\nmenempuh pendidikan pada program\nmagister di program studi dan universitas\nsebagaimana daftar terlampir dengan\ndurasi pendanaan paling lama 24 (dua\npuluh empat) bulan.\nb. Pendaftar diharuskan untuk melakukan\npendaftaran pada:\n● Perguruan Tinggi Tujuan Studi\nsesuai jadwal dan ketentuan yang\nberlaku di Perguruan Tinggi, dan\n● Campus France sesuai jadwal dan\nketentuan yang berlaku di Campus\nFrance.\n2. Persyaratan dan dokumen pada Beasiswa', 'Program Master memberikan kesempatan bagi\npendaftar untuk dapat melakukan pendaftaran\npada Beasiswa Kemitraan LPDP – Campus\nFrance dan beasiswa Magister Luar Negeri\npada salah satu program:\n1. Beasiswa Afirmasi\na. Beasiswa Daerah Afirmasi\nb. Beasiswa Putra Putri Papua\nc. Beasiswa Penyandang Disabilitas\nd. Beasiswa Prasejahtera\n2. Beasiswa Targeted\na. Beasiswa PNS, TNI, POLRI\nb. Beasiswa Kewirausahaan\nc. Beasiswa Umum\na. Beasiswa Reguler\nb. Beasiswa Parsial\nBeasiswa Kemitraan LPDP - Campus France\nmerupakan beasiswa kerja sama antara LPDP dan\nPemerintah Perancis pada jenjang master untuk\nbidang prioritas pembangunan Indonesia sesuai\ndengan keahlian pengetahuan yang dimiliki oleh\nUniversitas di Perancis dalam rangka\nmenghasilkan pemimpin masa depan Indonesia\nyang kompeten di bidang tersebut.\nSiapakah Sasaran Beasiswa Prioritas\nLPDP – Campus France Program Master?\n1. Warga Negara Indonesia (WNI)\n2. PNS/TNI/POLRI\nSeperti Apa Skema Prioritas LPDP –\nCampus France Program Master?']","Beasiswa Prioritas merupakan program beasiswa yang memberikan kesempatan kepada pendaftar untuk dapat melakukan pendaftaran pada dua program sekaligus, yaitu pada program Beasiswa Kemitraan/Kerja Sama LPDP dan pada salah satu program Beasiswa Afirmasi/Beasiswa Targeted/Beasiswa Umum tujuan luar negeri."
4,Apa saja Jenis Program Magang Kampus Merdeka di ITS,"MBKM: Program dari Kementerian Pendidkan, Kebudayaan, Riset dan Teknologi dalam bentuk pembelajaran di luar Kampus selama 2 semester, dan bisa/wajib dikonversikan ke SKS
Mata Kuliah. Non-MBKM: Program Magang dikonversikan ke SKEM atau hanya untuk menambah pengalaman mahasiswa.","['Subdit. PK2\nJenis Program Magang Kampus Merdeka di ITS\n• MBKM [ Program dari Kementerian Pendidkan,\nKebudayaan, Riset dan Teknologi dalam bentuk pembelajaran di luar Kampus selama 2 semester, dan bisa/wajib dikonversikan ke SKS\nMata Kuliah. *\n• Non-MBKM [ Program Magang dikonversikan ke SKEM atau hanya untuk menambah pengalaman mahasiswa. *\n)* syarat dan ketentuan berlaku.\nADVANCING HUMANITY\niTS\nProgram Magang Flagship (Kampus Merdeka)\n• MSIB (Magang dan Studi Independen Bersertifikat)\n• Bangkit (by Google, GoTo, and Traveloka)\n• Gerilya ( by Kementerian ESDM )\nProgram Magang Reguler\n• Magang Kerjasama\n• Magang Mandiri\nProgram Magang Lokal\nMagang Institut', 'Program Kampus Merdeka\nKamu bisa berbagai pilihan program dari Kampus Merdeka yang tersedia untukmu\nProgram yang sedang berjalan\nIndonesian International Student\nMobility Awards\nMobilitas mahasiswa seiama I semester di perguruan tinggi terbaik dunia\nPeriode Registrasi: 1May 2021 - 30 July 2021\nMagang\nPembelaiaran lanasuna di temoat keria selama I\nSemestel\nPeriode Registrasi: 8 June 2021 - 15 July 2021\nPertukaran Mahasiswa Merdeka\nGelatar untas kamous dan lintas oudava\nPeriode Registrasi: 1May 2021 - 30 July 2\nStudi Independen\nMewujudkan gagasan inovatif pengembangan\nproduk\n12. Pada halaman berikutnya akan menuju form Registrasi Pertukaran\nMahasiswa Merdeka. Pertama, lengkapi 3 pilihan Lokasi Pulau Perguruan Tinggi penerima yaitu Pilihan Lokasi Pulau 1, Pilihan Lokasi Pulau 2, dan Pilihan Lokasi Pulau 3 seperti pada gambar berikut:\nC Kerat\n@ DASHBOARD E KEGIATAN MAHASISWA & PROFIL\nINDAH SYAHYA DINATA\n凹\nPertukaran Mahasiswa Merdeka\nFORMULIR PENDAFTARAN\nPilih Penempatan & Mata Kuliah', 'Website Resmi ITS Career Center (Subdit. PK2 ITS)\nSubdit. PK2\nhttps://www.its.ac.id/careers/id/magang\n\nJenis Program Magang\nKampus Merdeka di ITS\n• MBKM 🡺 Program dari\nKementerian Pendidkan,\nKebudayaan, Riset dan Teknologi\ndalam bentuk pembelajaran di luar\nKampus selama 2 semester, dan\nbisa/wajib dikonversikan ke SKS\nMata Kuliah. *\n• Non-MBKM 🡺 Program Magang\ndikonversikan ke SKEM atau hanya\nuntuk menambah pengalaman\nmahasiswa. *\n)* syarat dan ketentuan berlaku.\nProgram Magang Flagship ( Kampus Merdeka )\n• MSIB (Magang dan Studi Independen Bersertifikat)\n• Bangkit ( by Google, GoTo, and Traveloka )\n• Gerilya ( by Kementerian ESDM )\nProgram Magang Reguler\n• Magang Kerjasama\n• Magang Mandiri\nProgram Magang Lokal\n• Magang Institut\n\nAPA SAJA SYARAT DAN KETENTUAN UNTUK JENIS MAGANG MBKM ?', 'MERDEKA BELAJAR – KAMPUS MERDEKA (MB-KM) DI INSTITUT TEKNOLOGI SEPULUH NOPEMBER\nDisampaikan di IPITS 2020\nINSTITUT TEKNOLOGI SEPULUH NOPEMBER, Surabaya - Indonesia\n\nMERDEKA BELAJAR DAN KAMPUS MERDEKA (MB-KM)\nOutline:\n\nPENDAHULUAN\nDASAR HUKUM MB-KM\nKEGIATAN MB-KM DI ITS\nTERIMA KASIH\nPENDAHULUAN\n\nTantangan Abad 21\nSosialisasi Program MB-KM, Ditjen Dikti, 2020\nKampus Merdeka\n\nHak Belajar 3 Semester di Luar Program Studi (Prodi)\nPermendikbud Nomor 3 Tahun 2020 tentang Standar Nasional Pendidikan Tinggi\n\nMahasiswa memiliki kesempatan untuk:\n\nSatu semester atau setara dengan 20 SKS menempuh pembelajaran di luar program studi pada perguruan tinggi yang sama.\nPaling lama dua semester atau setara dengan 40 SKS menempuh pembelajaran pada:\nProgram studi yang sama di perguruan tinggi yang berbeda\nProgram studi yang berbeda di perguruan tinggi yang berbeda\nDi luar perguruan tinggi\nDASAR HUKUM MB-KM', '1. Setiap mahasiswa ITS yang ingin mendaftar program internasional di perguruan tinggi mitra ITS luar negeri yang\nmembutuhkan surat rekomendasi atau dana dukungan dari ITS di antaranya IISMA/IISMA-Vo, pertukaran pelajar (exchange),\nlab-internship, short program, atau program lain di luar negeri, diharuskan memiliki sertifikat Global Competency\nWorkshop (GCW) atau Global Competency Academy (GCA). Sertifikat ini hanya bisa diperoleh dengan mengikuti program\nGCW atau GCA.', 'Subdit. PK2\nADVANCING HUMANITY\niTS\nPERSYARATAN PENDAFTARAN MAHASISWA UNTUK MENGIKUTI BKP-MBKM\nPROGRAM MAGANG FLAGSHIP MSIB\nMahasiswa aktif ITS Tingkat Si/D4 yang belum Yudisium\nMinimal sudah lulus ≥ 90 SKS (atau sudah lulus semester 5)\nMahasiswa tidak diperkenankan mengambil Program Kegiatan (BKP) MBKM yang sama lebih dari 1 kali. Mahasiswa yang sudah pernah mengikuti Program Kegiatan Magang (konversi ke SKS), tidak diperkenankan mendaftar Program kegiatan Magang kembali (disarankan mendaftar pada Program ВКР MBKM lainnya). Contoh: Studi Independen']","Di ITS terdapat beberapa jenis Program Magang Kampus Merdeka, yaitu:
1. Program Magang Flagship, yang terdiri dari:
   - MSIB (Magang dan Studi Independen Bersertifikat)
   - Bangkit (oleh Google, GoTo, dan Traveloka)
   - Gerilya (oleh Kementerian ESDM)
2. Program Magang Reguler, yang terdiri dari:
   - Magang Kerjasama
   - Magang Mandiri
3. Program Magang Lokal, yaitu Magang Institut."
5,Apa syarat Foto formal calon wisudawan ITS?,"Mempunyai kualitas STUDIO FOTO dengan ekstensi file: .jpg atau .jpeg Berlatar belakang biru dengan komposisi warna (C: 100 M: 040 Y: 001 K: 001) atau (R: 000 G: 120 B: 193) Mempunyai ukuran proporsional separuh badan Menghadap lurus kedepan Tidak menggunakan kacamata Menampakkan bagian wajah dengan jelas Memakai jas warna gelap, kemeja putih, dan berdasi hitam (Pria/Wanita) Khusus bagi wanita yang berhijab warna hijab menyesuaikan dan tidak berdasi","['A. Semua calon Wisudawan ITS ke-129 periode wisuda April 2024 wajib mengisi biodata di menu update wisudawan sampai dengan tanggal 9 Februari 2024, dengan ketentuan sebagai berikut:\n1. Mempersiapkan dokumen yang akan diunggah antara lain: Ijazah terakhir, KTP, foto formal terbaru berwarna untuk ijazah, dan Akte Kelahiran (apabila diperlukan);\n2. Foto formal terbaru berwarna yang diunggah mempunyai ketentuan:\nMempunyai kualitas STUDIO FOTO dengan ekstensi file: .jpg atau .jpeg\nBerlatar belakang biru dengan komposisi warna (C: 100 M: 040 Y: 001 K: 001) atau (R: 000 G: 120 B: 193)\nMempunyai ukuran proporsional separuh badan\nMenghadap lurus kedepan\nTidak menggunakan kacamata\nMenampakkan bagian wajah dengan jelas\nMemakai jas warna gelap, kemeja putih, dan berdasi hitam (Pria/Wanita)\nKhusus bagi wanita yang berhijab warna hijab menyesuaikan dan tidak berdasi', 'KEMENTERIAN PENDIDIKAN, KEBUDAYAAN, RISET, DAN TEKNOLOGI INSTITUT TEKNOLOGI SEPULUH NOPEMBER\nKampus ITS Sukolilo Surabaya 60111\nTelepon: 031-5994251-54, 5947274, 5945472 (Hunting)\nFax: 031-5947264, 5950806\nhttp://www.its.ac.id\n4. Calon wisudawan diwajibkan login ke Aplikasi Wisuda (https://wisuda.dwpits.id)\nmenggunakan akun alumni yang didapatkan dari pendaftaran di myITS Alumni\n(https://alumni.its.ac.id).\nD. KEGIATAN LAIN :\n1. Pengambilan Gordon, Toga dan Pemesanan Foto Prosesi serta Undangan di gedung\nDharma Wanita Persatuan ITS sesuai dengan jadwal sebagai berikut:\n- Magister dan Doktor:\nMenyerahkan bukti slip pembayaran wisuda dan slip sewa toga dari bank.\n- Sarjana dan Sarjana Terapan:\nMenunjukkan identitas diri dan menyerahkan bukti pembayaran/slip sewa toga dari bank.\n- Pemesanan Foto Prosesi (tidak wajib)\n- Undangan Wisuda untuk orang tua:\nUndangan untuk orang tua/pendamping wisudawan diambil bersamaan dengan\npengambilan toga', '- Pemesanan Foto Prosesi (tidak wajib)\n- Undangan Wisuda untuk orang tua:\nUndangan untuk orang tua/pendamping wisudawan diambil bersamaan dengan\npengambilan toga\n2. Jadwal pengambilan toga, gordon, undangan dan pemesanan foto prosesi sebagai berikut:\nHari\n:Rabu & Kamis\nTanggal : 17 & 18 April 2024\nPukul\n: 08.00-12.00 WIB\nPembagian jadwal pengambilan berdasarkan Fakultas akan disampaikan menyusul oleh\nDharma Wanita Persatuan ITS.\nAtas perhatian dan kerjasama yang diberikan kami sampaikan terima kasih.\nT. 1964405 5902an, M.T.\nMEMENTERIAN AS\nINSTITUT\nTembusan:\n- Rektor ITS\n- Para Wakil Rektor\n- Sekretaris Institut\n- Kepala Biro Sarana dan Prasarana\n- Kepala Biro Keuangan\n- Ketua Darma Wanita Persatuan ITS\n- Kabag. Admisitrasi Umum dan Kearsipan Digital', 'APA YANG HARUS MAHASISWA PERSIAPKAN SEBELUM MENDAFTAR?\n1. Mahasiswa memastikan data diri (nama, tempat tanggal lahir, NIM dan NIK) sesuai dengan data di PDDIKTI (https://\npddikti.kemdikbud.go.id)\n2. Surat rekomendasi dari Perguruan Tinggi (Program Studi/Dekan/ Wakil Dekan bidang Kemahasiswaan) (contoh terlampir)\n3. Surat keterangan sehat dari puskesmas/rumah sakit\n4. Sertifikat prestasi minimal tingkat provinsi selama menjadi mahasiswa (ini dilampirkan khusus untuk mahasiswa yang memiliki\nPK di bawah 2,75)', '2. Mahasiswa Program Sarjana dan Sarjana Terapan tidak dikenakan biaya Wisuda, hanya dikenakan uang jaminan toga (akan dikembalikan setelah toga kembali).\n3. Biaya sewa dan peminjaman toga mengacu pada surat yang dikeluarkan oleh Dharma Wanita Persatuan ITS Nomor B 362/Sekre/DPW-ITS/II/2024 tanggal 26 Februari 2024\ndan pada laman https://wisuda.dwpits.id', '(Bagi mahasiswa Program Sarjana dan Sarjana Terapan)\n\nhttp://lpmp2ki.its.ac.id/pomits\n5        \nMelunasi IKOMA.\n\n(Bagi mahasiswa Program Sarjana dan Sarjana Terapan)\n\nDapat bertanya ke Instagram @ikomaits \n6        Mengisi data-data untuk cetak ijazah di Direktorat Pendidikan dengan Pengisian Data di SIAKAD        Baca dokumen “Pemberitahuan untuk calon Wisudawan ITS…”\n7        Mengisi data terkait peminjaman-pengembalian toga.        https://wisuda.its.ac.id/\n8        Mengajak kepada semua calon wisudawan untuk berpartisipasi menjadi donatur dana abadi/endowment fund ITS.        http://danaabadi.its.ac.id/web/\n9        Mengisi Form Kepuasan & Yudisium Departemen        Link di atas :D']","Syarat foto formal calon wisudawan ITS adalah sebagai berikut:
1. Mempunyai kualitas STUDIO FOTO dengan ekstensi file: .jpg atau .jpeg
2. Berlatar belakang biru dengan komposisi warna (C: 100 M: 040 Y: 001 K: 001) atau (R: 000 G: 120 B: 193)
3. Mempunyai ukuran proporsional separuh badan
4. Menghadap lurus kedepan
5. Tidak menggunakan kacamata
6. Menampakkan bagian wajah dengan jelas
7. Memakai jas warna gelap, kemeja putih, dan berdasi hitam (Pria/Wanita)
8. Khusus bagi wanita yang berhijab, warna hijab harus disesuaikan dan tidak berdasi."
6,Apakah mata kuliah pengayaan bisa di-drop?,"Seperti halnya MK yang lain, jika masih dalam masa drop tiap semester, maka boleh (sampai dengan minggu 10). Setelah waktu itu tidak bisa, namun bisa digantikan dengan MK pengayaan lain yang diambil di semester berikutnya.","['Q: Berapa sks mata kuliah pengayaan yang bisa diambil?\n\nA: Di peraturan akademik mengambil MK pengayaan maksimal 6 sks dan minimum 3 sks.\n\nQ: Apakah mata kuliah pengayaan bisa di-drop?\n\nA: Seperti halnya MK yang lain, jika masih dalam masa drop tiap semester, maka boleh (sampai dengan minggu 10). Setelah waktu itu tidak bisa, namun bisa digantikan dengan MK pengayaan lain yang diambil di semester berikutnya.\n\nQ: Kepada siapa saya meminta konsultasi tentang perwalian/perencanaan kuliah, merubah MK yang diambil dan drop MK setelah minggu ke 4?\n\nA: Ke DOSEN WALI, bukan ke PEMBIMBING TA. Batas akhir perubahan MK adalah minggu ke 3 dan drop MK adalah minggu ke 10\n\nQ: Bagaimana jika saya tidak bisa ambil MK di FRS padahal prasyarat sudah terpenuhi? \n\nA: Silakan menginformasikan ke doswal dengan menyertakan bukti2. Doswal akan membantu menambahkan MK yang dimaksud jika bukti2 telah mencukupi.\n\nQ: Apakah MK yang diambil via dropdown MBKM bisa menggantikan MK yang sudah diambil?', 'Frequently Asked Question\nAcademic Support 📖 \nQ: Nilai saya belum keluar/salah, banding nilainya bagaimana?\n\nA: Untuk kelas MBKM, Isi form ralat nilai beserta bukti dukung → tunggu nilai berubah. Form dibagikan ke mahasiswa setelah rilis nilai MBKM (ctt : periode rilis nilai MBKM berbeda dengan nilai kelas reguler).\n\nUntuk kelas reguler, komunikasikan dengan dosen pengampu MK masing - masing.\n\nQ: Kelas saya bentrok, bagaimana cara pindah kelas?\n\nA: Cari kelas dengan jadwal yang sesuai → konsultasikan ke dosen wali & pengampu MK → laporkan ke Sekdep 1 (+cc Bu Inka jika via email) → bersabar sampai kelasnya dirubah.\n\nQ: Apakah wajib mengisi kuisioner dan IPD di akhir semester?\n\nA: WAJIB. Tolong diisi ya.\n\nQ: Berapa sks mata kuliah pengayaan yang bisa diambil?\n\nA: Di peraturan akademik mengambil MK pengayaan maksimal 6 sks dan minimum 3 sks.\n\nQ: Apakah mata kuliah pengayaan bisa di-drop?', 'Q : Apakah syarat mengambil mata kuliah Pra-TA?\n\nA : Mahasiswa telah menempuh 100 SKS\n\nQ : Bolehkan saya mengambil Pra-TA dan TA pada semester yang bersamaan?\n\nA : Jika di semester sebelumnya sudah pernah mengambil Pra TA dan tidak berhasil mengumpulkan proposal TA, makan boleh diambil bersamaan dengan TA di semester sekarang.\n\nQ : Untuk mengambil mata kuliah Tugas Akhir, apakah ada jumlah minimum sks yang harus diambil untuk mata kuliah dengan RMK TA yang sama?\n\nA : Tidak ada aturan yang baku yang mengatur ini. Hanya saja, akan sangat membantu TA jika difokuskan untuk mengambil MK yang mendukung TA yang akan diambil di sebuah RMK. \n \n\nQ : Bagaimana prosedur pergantian Judul Tugas Akhir?\n\nA : Jika Pembimbing dan RMK tetap dan hanya melakukan penyesuaian judul/metode, maka cukup dilakukan dengan mengisi form pergantian judul yang ada di link akademik.\n\nJika TA expired atau jika pembimbing dan atau RMK ganti, maka mesti mengajukan proposal TA ulang dan mengambil Pra-TA lagi.', 'BAGAIMANA MEKANISME PELAKSANAAN PERTUKARAN\nMAHASISWA MERDEKA?\nTerdapat dua mekanisme, yaitu:\n1. Mahasiswa didorong untuk mengambil keseluruhan 20 sks dari mata kuliah yang ditawarkan oleh perguruan tinggi penerima, termasuk di dalamnya 2 sks Modul Nusantara (wajib). Dalam skema ini, penentuan mata kuliah di perguruan tinggi penerima baru bisa dipilih, setelah proses perekrutan selesai dan mahasiswa ditempatkan di salah satu perguruan tinggi penerima. Maka, dalam proses pendaftaran melalui aplikasi MBKM, para mahasiswa tidak memilih mata kuliah apapun di aplikasi tersebut.\n2. Mahasiswa dapat mengkombinasikan mata kuliah yang ditawarkan perguruan tinggi penerima (paling sedikit 8 sks mata kuliah dan 2 sks modul nusantara (wajib)) dengan mata kuliah dari perguruan tinggi lain (dilakukan secara daring), contoh:\na. Jika ada mata kuliah wajib yang masih harus dituntaskan di perguruan tinggi asal; atau\nb. Jika mahasiswa tertarik untuk mengambil mata kuliah unggulan di perguruan tinggi lain.', 'banyak)\n8. Pertukaran Pelajar • Jenis mata pelajaran yang diambil harus \nmemenuhi ketentuan yang ditetapkan prodi asal \nuntuk lulus (mis. memenuhi kurikulum dasar, \nmemenuhi persyaratan kuliah umum, memenuhi \npersyaratan electives, etc)Buku Panduan Merdeka Belajar - Kampus Merdeka       32\nSatuan penjaminan mutu di perguruan tinggi penyelenggara Merdeka Belajar - Kampus \nMerdeka, program “hak belajar tiga semester di luar program studi” wajib memiliki \nmekanisme formal untuk mengevaluasi dan memonitor mahasiswa secara periodik. Untuk \nmenjamin mutu program tersebut maka pelaksanaan monitor dan evaluasi dilakukan mulai \ndari tahap persiapan, pelaksanaan, dan penilaian. Penilaian/evaluasi merupakan salah \nsatu rangkaian kegiatan dalam meningkatkan kualitas, kinerja, dan produktifitas dalam \nmelaksanakan program magang industri. Fokus evaluasi adalah individu mahasiswa, yaitu \nprestasi yang dicapai dalam pelaksanaan magang oleh mahasiswa. Melalui evaluasi akan', '(1) (2) (3) \nDalam hal mahasiswa mendapatkan nilai mata kuliah pengayaan kurang dari C, maka \nmahasiswa dapat menggantinya dengan mata kuliah pengayaan yang berbeda.  \nV STANDAR DOSEN DAN TENDIK  \n12 Standar dosen dan Tendik  (i) Dosen wali ditugaskan oleh Prodi untuk membuat perencanaan bersama dengan \nmahasiswa yang akan melaksanakan kegatan MBKM  \n(ii) Dosen wali ditugaskan oleh Prodi untuk melakukan evaluasi terhadap kesesuaian \nbentuk dan lama pelaksanaan MBKM sesuai dengan CPL  \n(iii) Dosen wali di tugaskan oleh Prodi untuk melakukan penilaian atas rencana, \npelaksanaan dan evaluasi MBKM  \n(iv) Dosen pembimbing MBKM ditugaskan oleh Prodi sesuai dengan pengampu MK \nkonversi dan atau dosen wali  \n(v) Tendik Prodi ditugaskan untuk melayani administrasi dalam implement asi MBKM, \nmulai dari perencanaan, pelaksanaan, moneitoring dan evaluasi, serta pelaporan \nMBKM.  \n \nVI STANDAR PENGELOLAAN PEMBELAJARAN']","MK pengayaan bisa di-drop seperti halnya MK yang lain, selama masih dalam masa drop tiap semester, yang berarti bisa dilakukan hingga minggu ke-10. Setelah melewati waktu tersebut, tidak akan bisa lagi melakukan drop MK pengayaan. Namun, jika ingin menggantikan MK pengayaan yang sudah di-drop, bisa dilakukan dengan mengambil MK pengayaan lain di semester berikutnya. Jadi, penting untuk memperhatikan batas waktu drop MK pengayaan agar tidak melewatinya."
7,"MyITS saya bermasalah, bisa lapor kemana?",Silakan ajukan tiket ke DPTSI di https://servicedesk.its.ac.id/,"['Q: MyITS saya bermasalah, bisa lapor kemana?\n\nA: Silakan ajukan tiket ke DPTSI di https://servicedesk.its.ac.id/\n\nQ: Saya ingin mengurus “…..” siapa tendik yang harus ditemui?\n\nA: Temui tendik sesuai bidangnya yuk! :)\n\nPersuratan (S1) → Pak Sugeng\nAkademik (S1) → Bu Inka (Kelas, Nilai, MBKM, International Exposure), Bu Icha (Asisten Dosen, MonKP)\nAkademik + Persuratan (S2) → Bu Kartika\nAkademik + Persuratan (S3) → Bu Lina\nPeminjaman Ruang → Pak Husein (Kasubbag)\nKeuangan → Bu Devi, Bu Due\nUrusan Ruang Aula → Pak Jumali\nUrusan Ruang Kelas → Pak Edy\nUrusan Laboratorium → Teknisi Lab. Pak Junaidi (PKT, KCV, LP), Pak Jumali (KBJ, RPL), Pak Gayuh (AP, MCI, GiGA), Pak Kunto (AJK).\nUrusan Keamanan dan Kebersihan → Pak Sukron\nUrusan Kelistrikan → Pak Hari\nQ: Cara mendapatkan transkrip\n\nA: Buka SIM Akademik, masuk ke menu LAPORAN -> TRANSKRIP\n\nQ: Cara mendapatkan surat keterangan aktif mahasiswa\n\nA: Buka SIM Akademik, masuk ke menu SURAT MAHASISWA -> LAYANAN SURAT MAHASISWA', 'Bersama dengan ini saya sertakan dokumen revisi TA saya dengan poin sebagai berikut:\n- perbaikan ....\nMohon berkenan memeriksa dan menginformasikan jika ada yang perlu saya perbaiki.\n\nDemikian, terima kasih\nAgus\n0511000..…\n\nQ: Bagaimana mendapatkan surat keterangan yang tidak ada di menu integra, contoh surat keterangan selesai TA dan lulus >=144 SKS?\n\nA: kirim ke WA Pak Sugeng +62 856-4843-2445\n------------------------------------------------------------------------------\nKepada Yth\nBapak Ary Mazharuddin Shiddiqi\ndi tempat\n\nDengan hormat,\nDengan surat ini saya,\n\nNama: \nNRP: \nTempat/Tgl lahir: \nAlamat sekarang: \nSKS Lulus:\nemail aktif:\nNo HP aktif:\n\nBermaksud untuk mengajukan permohonan kepada Bapak Ary guna memperoleh Surat Keterangan Selesai Tugas Akhir.\n\nDemikian surat ini saya ajukan dan atas terkabulnya permohonan ini, saya ucapkan terimakasih\n\nSurabaya, .…', 'Kirim permintaan pada platform MyiTS SSO di fitur: MyITS Student Connect\n12. Layanan Reset Password Sister\nKirim permintaan pada tautan: Servicesdesk.its.ac.id\n13. Layanan Aktivasi Gate\nLuring secara realtime di PLT, Gedung KPA, Plaza dr. Angka, Lantai 1\n14. Layanan Lost and Found\nLapor pada tautan: its.Id/lost\n15. Layanan Id Card Pegawai\nKirim ajuan pada tautan: its.id/idCard\nCatatan: Layanan dilakukan secara daring maupun luring di jam kerja\nSENIN - KAMIS JUMAT\nJam Kerja : 08.00 - 16.00 WIB Jam Kerja : 08.00 - 15.00 WIB\nJam Istirahat : 12.00 - 13.00 WIB Jam Istirahat : 12.00 - 13.00 WIB', 'Kirim permintaan pada platform MyiTS SSO di fitur MyITS Student Commect\n12. Layanan Reset Password Sister\nKirim permintaan pada tautan: servicesdesh its.oc.id\n13. Layanan Aktivasi Gate\nLuring secara reaitime di PLT. Gedung KPA, Plaza dr. Angka, Lantai 1\n14. Layanan Lost and Found\nLapor pada tautan: its.id/tost\n15. Layanan Id Card Pegawai\nKirim ajuan pada tautan: its.id/idCard\nCatatan Layanan dilakukan secara daring maupun luring di jam kerja\nSENIN - KAMIS JUMAT\nJam Kerja : 08.00 - 16.00 WIB Jam Kerja : 08.00 - 15.00 WIB\nJam istirahat : 12.00 - 13.00 WIB Jam Istirahat : 12.00-13.00 WIB\nHUBUNGI KAMI\nplt@its.ac.id\nPhone: 031-599-425-1, PABX: 1010\n0857-0609-0069 (Anita)\nHotline ITS: 0811-3055-3555\nGedung KPA, Plaza dr.Angka, Gedung KPA, Plaza dr.Angka, Lantai 1, Kampus ITS Sukolilo Surabaya\nPengaduan: servicedesk.its.ac.id\nWebsite: its.ac.id/burb/id/pusat-layanan-terpadu', ""+ → C • kampusmerdeka.kemdikbud.go.id/register\nDaftar\nApakah data kamu sudah benar?\nSilakan cek kembali data di bawah ini dan pastikan semua info sudah benar\n0★名★●\n3/3\nNama\nTanggal Lahir\nJenis Kelamin\nNIM\n1A19114\nPerguruan lingg\nProgram Studi\n• kampusmerdeka.kemdikbud.go.id/register\nSelanjutnya\nTerdapat Kesalahan Data\nKementerian Pendidikan dan Kebudayaan Indonesia\nNavigasi\nTautan Eksternal\n8. Setelah berhasil mendaftarkan diri dan melengkapi data pada form registrasi, Maka akan diarahkan untuk cek aktivasi akun pada email dan klik link 'Aktifkan Akun' seperti gambar dibawah\nGmail\nStarred\nSnoozed\nSent\nMore\nNew meeting\nMy meetings\ningouts\nNo recent chats\nsara new one\nQ Search mail\nGoogle\n个D。。\nSor 19 < >\nE\nAktivasi Akun : MBKM Inbox x\nadministrator. kampus merdeka kampusmerdexa@mail.smipzgo.com.invalid via smipcorp.com\nPendaftaran Berhasil!\n€\nHallo indah\nTerima kasih telah melakukan registrasi akun Merdeka Belaiar : Kamous Merdeka, berikut adalah informasi akun anda l\nEmail :1"", 'Lakukan pembayaran dengan transfer ke VA BNI. Berlaku 1x24 jam. Jika kadaluarsa bisa melakukan pesanan baru.\nMemantau Pesanan\n\nStatus Pesanan:\n\nMembuat pesanan cetak\nMenunggu pembayaran\nPembayaran diterima\nProses pencetakan\nSelesai dicetak\nPengiriman ke Perpustakaan / Departemen\nSelesai\nPesanan kadaluarsa\nPesanan dibatalkan\nJika ada permasalahan teknis dapat menghubungi:\n\nWA Layanan DPTSI: 0811 3333 8 222 (07:30 – 16:00 WIB)\nPortal Servicedesk: https://servicedesk.its.ac.id']",Anda dapat melaporkan masalah MyITS Anda dengan mengajukan tiket ke DPTSI di https://servicedesk.its.ac.id/
8,Berapa koordinat latitude langitude ITS Surabaya?,Tidak tahu,"['KEMENTERIAN PENDIDIKAN, KEBUDAYAAN,\nRISET, DAN TEKNOLOGI\nINSTITUT TEKNOLOGI SEPULUH NOPEMBER\nDIREKTORAT KEMITRAAN GLOBAL\nGedung Global Kampong Kampus ITS Sukolilo - Surabaya 60111 Indonesia\n(0) Telepon: 031 5923411 (Hunting): 031 5994251-54 ext.1224\nFax: 031 5923411\nhttps://www.its.ac.id/, https://www.its.ac.id/international/ email: international(ajits.ac.id\nNomor : 7518/IT2MVIII/T/TU.00.08/2023\n\nLampiran :2 (dua) lembar\nPerihal : Pemberitahuan Informasi Persyaratan Eksposur Internasional\nKepada Yth.\nKepala Departemen dan Ketua Program Studi\ndi lingkungan ITS\nDengan hormat,\nsehubungan dengan surat kami dengan nomor 7311/!T2.VINI/T/TU.00.08/2023 perihal Pemberitahuan Informasi Persyaratan\nEksposur Internasional, bersama dengan ini memberikan informasi lebih lanjut tentang persyaratan yang harus dipenuhi oleh\nseluruh mahasiswa ITS dalam rangka pelaksanaan kegiatan eksposur internasional. Persyaratan tersebut adalah sebagai berikut:', '\uf0b7   Section yang bisa dipilih pada Jurnal Teknik ITS:\n    Teknologi Informasi dan Komunikasi (TIK); Energi (ERG); Pemukiman dan Bencana\n    (PdB); Bangunan Berorientasi Lingkungan (BBL); Transportasi (TRP); Teknologi\n    Proses (TP); Kelautan (KLT).\n\n\uf0b7   Section yang bisa dipilih pada Jurnal Sains & Seni ITS:\n    Matematika dan Terapannya (MAT); Fisika dan Terapannya (FIS); Kimia dan Tera-\n    pannya (KIM); Statistika dan Terapannya (STA); Biologi dan Terapannya (BIO);\n    Produk Desain (PD); Arsitektur (ARS).\n\n\uf0b7   Mahasiswa yang Dosen Pembimbingnya memilih untuk TIDAK MEMPUBLIKASIKAN\n    artikelnya pada Jurnal POMITS, dapat melakukan UNGGAH di Repository, menggunakan\n    login ‘mahasiswa’, dengan kata sandi ‘M4h4sisw4ITS!’ ke alamat ‘http://\n    ejurnal.its.ac.id/index.php/index/login’ dengan mengunggah file artikel dan file Form\n    Telaah saja.\n\n\uf0b7   Pengecekan file yang TERUNGGAH dapat dilihat di\n    http://lpmp2ki.its.ac.id/pomits.', 'ERICHA VALENTINA\n5015201016\nS1 Perencanaan Wilayah d Vely Kukinul Siswanto\n\n\nFALDI FAKHRI\n5015201128\nS1 Perencanaan Wilayah d I Dewa Made Frendika S\n\nKK\nTerdapat inkonsistensi data / data yang belum diisi pada registras\nTerdapat laporan mingguan dengan foto aktivitas yang belum diis\nTerdapat laporan mingguan dengan foto aktivitas yang belum diis\nTerdapat laporan mingguan dengan foto aktivitas yang belum diis\nTerdapat laporan mingguan dengan foto aktivitas yang belum diis\nTerdapat laporan mingguan dengan foto aktivitas yang belum diis\nTerdapat laporan mingguan dengan foto aktivitas yang belum diis -\nits.id/ListSIMMagang\n+\nMix\nGenap 22/23\nGasal 23/24\nKementerian Pendidikan, Kebudayaan, Riset dan\nTeknologi\n\nSubdit. PK2\nADVANCING HUMANITY\niTS\nh\n4\nOverview MSIB 6\nd\n2023', '08123456789\nク7_つんークやつ？\n22:00\n2307678245\nS1- Nama Program\nKamous Menasia\n08123456789\nク7_Qん、つやつ？\n22:00\n1\n2\nPada laman MBKM, Anda akan menemukan daftar mahasiswa yang harus Anda verifikasi datanya.\nAnda dapat menyaring data tersebut berdasarkan Program Studi atau langsung mencari menggunakan nama atau NIM. Klik ""Periksa"".\nAnda dapat mengecek kembali histori verifikasi data Akademik mahasiswa dengan klik ""Lihat Histori\nVerifikasi""\nKementerian Pendidikan, Kebudayaan, Riset dan\nTeknologi', '5. Dengan memperhatikan poin 1, DKG menginformasikan bahwa Test GCW Non-Degree yang sebelumnya diselenggarakan\nsetiap bulan tidak akan lagi diselenggarakan, kecuali dalam kondisi yang sangat khusus, dengan mempertimbangkan surat\npermohonan oleh mahasiswa yang diketahui oleh Kepala Departemen. Pelaksanaan Test GCW Non Degree akan diputuskan\noleh Direktur Kemitraan Global.\nBersama ini kami juga melampirkan poster informasi penyelenggaraan Global Competency Academy yang pendaftarannya dibuka\nsampai dengan 17 September 2023. Kami mohon bantuan dari Bapak/Ibu Kepala Departemen dan Ketua Program Studi untuk\nmenyebarkan informasi ini kepada mahasiswa di departemen masing-masing.\nUntuk pertanyaan lebih lanjut, kiranya dapat disampaikan melalui email studyabroad@its.ac.id , LINE Official @yao2114f , atau\nmelalui Instagram @itsinternationaloffice.\nDemikian surat ini kami sampaikan. Atas perhatian dan kerjasamanya kami sampaikan terima kasih.\n\nSurabaya, 13 September 2023', ""• NIM (Nomor Induk Mahasiswa)\n• NIK (Nomor Induk Kependudukan)\n• Tanggallahir\nDaftar\n2/3\nMasukkan Data Kamu\nPerguruan Tinggi Asal\nMasukan perguruan tingqi asal\nProgram Studi\nMasukan program studi\nNomor Induk Mahasiswa (NIM)\nMasukkan NIMlengkap\nNomor Induk Kependudukan (NIK)\nMasukkan NIK lengkap\nNIK dapat dilihat di KTP atau KK\nTanggal Lahir\n28\nMei\n2021\nDengan ini saya menyetujui Ketentuan Penggunaan dan Kebijakan Privasi dari Kampus Merdeka\n6. Setelah melengkapi data, Lalu centang box dengan menyetujui Ketentuan Penggunaan dan Kebijakan Privasi dari Kampus Merdeka dan klik button 'Selanjutnya'\nNiK dapat dilhat di KTP atau KK\nTanggal Lahir\nNovember\nK\nDengan ini saya menyetujui Ketentuan Penggunaan dan Kebijakan Privasi dari Kampus Merdeka\nSelanjutnya\n7. Selanjutnya akan menuju tampilan data diri untuk memastikan kebenaran data yang sudah dilengkapi\n• Jika sudah benar, klik button 'Selanjutnya'\n• Jika mash terdapat kesalahan data, klik button 'Terdapat Kesalahan Data'""]",Saya tidak tahu.
9,Bagaimana SKEM membantu Departemen di ITS?,SKEM membantu Departemen untuk mendapatkan data pemetaan profil mahasiswa guna pengembangan soft skills dan untuk keperluan akreditasi internasional.,"['(4) Kegiatan asistensi mengajar oleh mahasiswa harus dibimbing oleh dosen tetap dari ITS dan mendapatkan persetujuan dari Direktorat yang mengurusi kemahasiswaan.\r\n(5) Kegiatan asistensi mengajar di satuan pendidikan yang dilaksanakan selama satu semester dapat diusulkan menjadi nilai akademik yang relevan setelah direview dan disetujui oleh tim penilai.\r\n(6) Tim Penilai pada ayat (5) dibentuk oleh Departemen dan disahkan oleh Direktorat yang mengurusi kemahasiswaan.\r\n(7) Kegiatan asistensi mengajar di satuan pendidikan dapat diusulkan menjadi Satuan Kegiatan Ekstrakurikuler (SKEM) setelah disahkan oleh Direktorat yang mengurusi kemahasiswaan.\r\n(8) Mekanisme dan penyelenggaraan kegiatan asistensi mengajar di satuan pendidikan dikembangkan dan dikoordinasikan oleh Direktorat yang mengurusi kemahasiswaan.', 'B. Bagi Dosen Wali 1. Melakukan pendampingan dan pengecekan dari pengajuan perencanaan kegiatan SKEM/ program MB-KM yang diajukan oleh mahasiswa. 2. Jika dinilai sudah sesuai pengajuan perencanaan Kegiatan SKEM/ Program MB-KM oleh mahasiswa, dosen wali dapat melakukan persetujuan FRS. \nDemikian Surat Edaran ini dibuat untuk dilaksanakan dengan sebaik - baiknya. Atas perhatiannya diucapkan terimakasih.', 'h. Asistensi Mengajar di Satuan Pendidikan.\r\n(3) Dalam hal ada penambahan dan atau perubahan BKP MBKM sebagaimana dimaksud pada ayat (2) ditetapkan melalui Keputusan Rektor.\r\n(4) Kegiatan Membangun Desa/ Kuliah Kerja Nyata Tematik sebagaimana dimaksud pada ayat (2) huruf b dan Proyek Kemanusiaan sebagaimana dimaksud pada ayat (2) huruf d diwujudkan melalui kegiatan pengabdian kepada masyarakat.\r\n\r\n              BAB IV PELAKSANAAN KEGIATAN MB - KM\r\n\r\nPasal 4\r\n(1) Jumlah sks maksimal yang dapat diambil dalam rangka pelaksanaan kegiatan MB -\r\nKM adalah 40 (empat puluh) sks.\r\n(2) Kegiatan MB-KM hanya bisa dilaksanakan dengan:\r\na. Perguruan tinggi yang mempunyai rangking setara atau lebih tinggi dari ITS,\r\nb. Perguruan tinggi yang mempunyai MoU dengan ITS; atau\r\nc. Lembaga non perguruan tinggi yang mempunyai MoU dengan ITS.\r\n(3) Pelaksanaan transfer kegiatan MB - KM menjadi sks mata kuliah, program studi atau direktorat membentuk tim pelaksana transfer kredit.', 'di luar ITS dapat  dikembangkan dan dikoordinasikan oleh Direktorat yang mengurusi \npendidikan bekerjasama dengan Direktorat yang mengurusi pascasarjana dan \npengembangan akademik . \n(5) Direktorat yang mengurusi kegiatan pertukaran pelajar/ kuliah dalam negeri harus 16 Dokumen Panduan Baku Mutu Pelaksanaan MBKM - 2021  \n NO ELEMEN PENILAIAN  INDIKATOR  \n(1) (2) (3) \nberkoordinasi dengan Program Studi terkait . \n Standar Pengelolaan – \nPerencanaan MBKM  1. Prodi mempunyai Dokumen panduan untuk implementasi MBKM / turunan dokumen \nPerek 21 tahun 202 1 yang menjadi konsideran  implementasi MBKM . \n2. Prodi mempunyai kurikulum implementasi MBKM, yang meliputi CPL yang ditetapkan \nsesuai dengan implementasi MBKM dan peta CPL – MK MBKM  \n3.  Prodi mempunyai Dokumen panduan untuk Dosen  Wali dan Dosen Pembimbing dalam \npelaksanaan MBKM   \n4. Prodi mempunyai Dokumen pan duan untuk Mahasiswa dalam perencanaan , \npelaksannaan, penilaian pelaksanaan  MBKM', 'BAB II MAKSUD DAN TUJUAN\n\nPasal 2\nPeraturan ini diterbitkan dengan maksud agar pimpinan ITS mempunyai pedoman dalam memberikan Apresiasi kepada Mahasiswa berprestasi dan Pembimbing di bidang kemahasiswaan.\n\n                               Pasal 3 Peraturan ini diterbitkan dengan tujuan:\na. memotivasi Mahasiswa agar berprestasi dalam berbagai kegiatan lomba; dan\nb. mendorong Pembimbing untuk melakukan pembinaan, pendampingan dan/atau pelatihan secara intensif kepada perorangan atau kelompok Mahasiswa.\n\nBAB III\nSYARAT DAN TINGKAT PRESTASI\n\nBagianKesatu\nSyarat Prestasi Lomba Kementerian\n\n\n\n(1) Syarat untuk Mahasiswa:\n\nPasal 4\n\na. Mahasiswa aktif yang terdaftar di sistem akademik ITS;', 'transfer kredit  \n(xi) Mekanisme dalam transfer kredit dapat dikembangkan oleh Prodi dan dikoordinasikan \ndengan Direktorat terkait.  \n7 Standar pengolaan – tempat \npelaksanaan MBKM   (1) MBKM dapat dilaksanakan oleh Prodi dengan cara menerima mahasiswa dari perguruan \ntinggi lain . \n(2) Persayaratan MBKM untuk mahasiswa luar ITS , dengan akreditasi Prodi asal mahasiswa \nminimal sama dengan Prodi di ITS.  \n(3) Jumlah mahasiswa dari luar ITS sebagai pelaksana MB -KM dibatasi maksimal sebesar 10 % \n(sepuluh persen) dari daya tampung Program Studi di ITS , kecuali dengan kerjasama \nkhusus.  \n(4) Mekanisme dan penyelenggaraan kegiatan pertukaran pelajar/ kuliah untuk mahasis wa \ndi luar ITS dapat  dikembangkan dan dikoordinasikan oleh Direktorat yang mengurusi \npendidikan bekerjasama dengan Direktorat yang mengurusi pascasarjana dan \npengembangan akademik .']","SKEM membantu Departemen di ITS dengan memberikan mekanisme untuk mengembangkan dan mengkoordinasikan kegiatan asistensi mengajar di satuan pendidikan. Selain itu, SKEM juga dapat diusulkan menjadi Satuan Kegiatan Ekstrakurikuler (SKEM) setelah disahkan oleh Direktorat yang mengurusi kemahasiswaan. Dengan demikian, SKEM memberikan kerangka kerja yang jelas dan terstruktur bagi Departemen di ITS dalam mengelola kegiatan asistensi mengajar."
10,Mengapa penting untuk mengunggah kegiatan mahasiswa di myITS StudentConnect? ,"Karena bukti atau dokumen pendukung kegiatan SKEM harus diunggah di myITS StudentConnect dalam waktu satu tahun semenjak selesai kegiatan, jika melebihi batas waktu tersebut, kegiatan dinyatakan tidak berlaku.","['(ii) Kegiatan MBKM dalam bentuk pertukaran pelajar  dapat dilakukan dengan PT di dalam \nnegeri atau di luar negeri.  \n(iii) Kegiatan dalam Pertukaran pelajar yang dilaksanakan di dalam negeri maupun luar \nnegeri dalam rangka  memperluas wawasan mahasiswa, penyetaraan pendidikan, \npengkayaan sains dan teknologi (saintek) serta terjadinya kolaborasi invensi dan inovasi 10 Dokumen Panduan Baku Mutu Pelaksanaan MBKM - 2021  \n NO ELEMEN PENILAIAN  INDIKATOR  \n(1) (2) (3) \nmultidisiplin lingkup nasion al dan internasional .  \n(iv) Kegiatan pertukaran pelajar  dalam negeri (nasional) dalam bentuk kuliah dapat \ndilakukan  di luar program studi di internal ITS atau di luar program studi di luar ITS baik \ndalam bidang keilmuan sebidang atau tidak sebidang.  \n(v) Kegiatan pe rtukaran pelajar internasional dapat dilakukan dalam bentuk: (a) student \nexchange,  (b) internship, (c) short program, (d) public service/outreach program , atau (e) \nMK secara online .', 'banyak)\n8. Pertukaran Pelajar • Jenis mata pelajaran yang diambil harus \nmemenuhi ketentuan yang ditetapkan prodi asal \nuntuk lulus (mis. memenuhi kurikulum dasar, \nmemenuhi persyaratan kuliah umum, memenuhi \npersyaratan electives, etc)Buku Panduan Merdeka Belajar - Kampus Merdeka       32\nSatuan penjaminan mutu di perguruan tinggi penyelenggara Merdeka Belajar - Kampus \nMerdeka, program “hak belajar tiga semester di luar program studi” wajib memiliki \nmekanisme formal untuk mengevaluasi dan memonitor mahasiswa secara periodik. Untuk \nmenjamin mutu program tersebut maka pelaksanaan monitor dan evaluasi dilakukan mulai \ndari tahap persiapan, pelaksanaan, dan penilaian. Penilaian/evaluasi merupakan salah \nsatu rangkaian kegiatan dalam meningkatkan kualitas, kinerja, dan produktifitas dalam \nmelaksanakan program magang industri. Fokus evaluasi adalah individu mahasiswa, yaitu \nprestasi yang dicapai dalam pelaksanaan magang oleh mahasiswa. Melalui evaluasi akan', 'i. Mahasiswa dari perguruan tinggi mitra luar negeri program kerjasama yang bersifat \n   resiprokal; atau\n  j. Mahasiswa program sarjana atau sarjana terapan yang mampu mempublikasikan \n   paper pada jurnal internasional bereputasi Q1 sebagai nama pertama dengan \n   rekomendasi Wakil Rektor yang membidangi akademik dibebaskan untuk semester \n   berikutnya atau menarik UKT atau SPP pada semester berjalan apabila lulus \n   yudisium.', 'i. Mahasiswa dari perguruan tinggi mitra luar negeri program kerjasama yang bersifat \n   resiprokal; atau\n  j. Mahasiswa program sarjana atau sarjana terapan yang mampu mempublikasikan \n   paper pada jurnal internasional bereputasi Q1 sebagai nama pertama dengan \n   rekomendasi Wakil Rektor yang membidangi akademik dibebaskan untuk semester \n   berikutnya atau menarik UKT atau SPP pada semester berjalan apabila lulus \n   yudisium.', '1. Setiap mahasiswa ITS yang ingin mendaftar program internasional di perguruan tinggi mitra ITS luar negeri yang\nmembutuhkan surat rekomendasi atau dana dukungan dari ITS di antaranya IISMA/IISMA-Vo, pertukaran pelajar (exchange),\nlab-internship, short program, atau program lain di luar negeri, diharuskan memiliki sertifikat Global Competency\nWorkshop (GCW) atau Global Competency Academy (GCA). Sertifikat ini hanya bisa diperoleh dengan mengikuti program\nGCW atau GCA.', '(3) Pengambilan mata kuliah internasional hanya diijinkan jika perguruan tinggi luar negeri tujuan memiliki peringkat yang minimal sama dengan ITS.\r\n(4) Mekanisme dan penyelenggaraan kegiatan pertukaran pelajar/ kuliah internasional dikembangkan dan dikoordinasikan oleh Direktorat yang mengurusi kemitraan global.\r\n(5) Direktorat yang mengurusi kemitraan global dalam menyelenggarakan kegiatan\r\n\r\npertukaran pelajar/ kuliah internasional sebagaimana dimaksud pada ayat (4) berkoordinasi dengan Program Studi terkait.\r\n\r\nBagian Kelima Penelitian/ Riset\r\n\r\nPasal 10\r\n(1) Kegiatan penelitian/ riset ditujukan untuk membangun cara berfikir kritis, meningkatkan mutu penelitian, kompetensi penelitian mahasiswa dan meningkatkan ekosistem serta kualitas riset di laboratorium.\r\n(2) Mahasiswa dapat mengikuti kegiatan penelitian di luar ITS dalam skema kerjasama penelitian dengan lembaga riset atau pusat studi atau program studi.']","Penting untuk mengunggah kegiatan mahasiswa di myITS StudentConnect karena platform tersebut dapat digunakan sebagai sarana untuk memperlihatkan pencapaian dan aktivitas mahasiswa selama berkuliah. Dengan mengunggah kegiatan, mahasiswa dapat memperoleh pengakuan atas partisipasi dan prestasi yang telah dicapai selama masa studi mereka. Selain itu, informasi mengenai kegiatan mahasiswa juga dapat menjadi referensi bagi pihak-pihak terkait seperti dosen pembimbing, pihak administrasi kampus, dan calon pemberi beasiswa atau employer yang tertarik untuk mengetahui profil dan kualitas mahasiswa tersebut."
11,Sebutkan salah satu dasar hukum perubahan peraturan ini.,Undang-Undang Nomor 12 Tahun 2012 tentang Pendidikan Tinggi.,"['Menetapkan :    PERATURAN REKTOR INSTITUT TEKNOLOGI SEPULUH\n                NOPEMBER TENTANG PERUBAHAN ATAS PERATURAN\n                REKTOR INSTITUT TEKNOLOGI SEPULUH NOPEMBER\n                NOMOR 12 TAHUN 2019 TENTANG BAKU MUTU MAGANG\n                PROGRAM STUDI SARJANA TERAPAN DAN SARJANA.\n\n\n                                  Pasal I\n\n\nKetentuan Pasal 4 Peraturan Rektor Institut Teknologi Sepuluh Nopember\nNomor 12 Tahun 2019 tentang Baku Mutu Magang Program Studi Sarjana\nTerapan dan Sarjana, diubah sehingga Pasal 4 berbunyi sebagai berikut:', '30\n\x0cLAMPIRAN 7: Contoh Halaman Judul Tugas Akhir Bahasa Indonesia\n\n\n\n\n                                                                31\n\x0cLAMPIRAN 8: Contoh Halaman Judul Tugas Akhir Bahasa Inggris\n\n\n\n\n                                                              32\n\x0cLAMPIRAN 9: Contoh Halaman Pengesahan Tugas Akhir\n\n                        LEMBAR PENGESAHAN\n\n  JUDUL TUGAS AKHIR DITULIS SINGKAT JELAS DAN MENGGAMBARKAN\n                          TEMA POKOK\n\n\n                                TUGAS AKHIR\n                    Diajukan untuk memenuhi salah satu syarat\n                      memperoleh gelar <Nama Gelar> pada\n                    Program Studi S-1 <Nama Program Studi>\n                        Departemen <Nama Departemen>\n                            Fakultas <Nama Fakultas>\n                      Institut Teknologi Sepuluh Nopember', 'd. bahwa rancangan Perubahan Atas Peraturan Rektor tentang Penyelenggaraan Kegiatan Merdeka Belajar - Kampus Merdeka di Institut Teknologi Sepuluh Nopember telah mendapat persetujuan Senat Akademik melalui Berita Acara Sidang Pleno Senat Akademik Institut Teknologi Sepuluh Nopember Nomor: T/61733/IT2.XI/TU.00.03.01/2021;\r\ne. bahwa berdasarkan pertimbangan sebagaimana dimaksud pada huruf a, huruf b, huruf c dan huruf d di atas, perlu menetapkan Peraturan Rektor tentang Penyelenggaraan Kegiatan Merdeka Belajar - Kampus Merdeka di Institut Teknologi Sepuluh Nopember;\r\n\r\nMengingat : 1. Undang-Undang Nomor 12 Tahun 2012 tentang Pendidikan Tinggi (Lembaran Negara Republik Indonesia Tahun 2012 Nomor 158, Tambahan Lembaran Negara Republik Indonesia Nomor 5336);\r\n2. Peraturan Pemerintah Nomor 4 Tahun 2014 tentang Penyelenggaraan Pendidikan Tinggi dan Pengelolaan Perguruan Tinggi (Lembaran', '• Memberikan arahan dalam penyelesaian revisi Laporan Magang.\nB. Dosen pembimbing harus memastikan bahwa Laporan Magang bebas dari plagiarisme.\n6.5\nPENGGANTIAN DOSEN PEMBIMBING\nMAGANG\n• Penggantian dosen pembimbing magang harus didasarkan pada alasan yang dapat dipertanggungjawabkan.\n• Pengajuan permohonan penggantian dosen pembimbing magang dapat dilakukan selambat-lambatnya 2 (dua) bulan setelah magang dimulai.\n• Penggantian dosen pembimbing magang harus dengan persetujuan dari Kepala\nDepartemen.\n42\n06 Pembimbingan Magang', '24\n\x0cLAMPIRAN 2: Contoh Halaman Pengesahan Proposal Tugas Akhir\n\n                         LEMBAR PENGESAHAN\n\n      JUDUL PROPOSAL TUGAS AKHIR DITULIS SINGKAT JELAS DAN\n                 MENGGAMBARKAN TEMA POKOK\n\n\n                         PROPOSAL TUGAS AKHIR\n                    Diajukan untuk memenuhi salah satu syarat\n                      memperoleh gelar <Nama Gelar> pada\n                    Program Studi S-1 <Nama Program Studi>\n                        Departemen <Nama Departemen>\n                            Fakultas <Nama Fakultas>\n                       Institut Teknologi Sepuluh Nopember\n\n\n\n                        Oleh : <NAMA MAHASISWA>\n                              NRP. <XXXXXXXX>\n\n\n\n                 Disetujui oleh Tim Penguji Proposal Tugas Akhir :\n\n\n1. Nama dan gelar pembimbing                             Pembimbing\n\n\n2. Nama dan gelar ko-pembimbing/penguji                  Ko-pembimbing', 'Republik Indonesia Nomor 8 Tahun 2020 tentang Perubahan Atas \n             Peraturan Pemerintah Nomor 26 Tahun 2015 tentang Bentuk dan \n             Mekanisme Pendanaan Perguruan Tinggi Negeri Badan Hukum \n             (Lembaran Negara Republik Indonesia Tahun 2020 Nomor 28; \n             Tambahan Lembaran Negara Republik Indonesia Nomor 6461);\n           4. Peraturan Pemerintah Nomor 54 Tahun 2015 tentang Statuta Institut \n             Teknologi Sepuluh Nopember (Lembaran Negara Republik Indonesia']",Salah satu dasar hukum perubahan peraturan ini adalah Undang-Undang Nomor 12 Tahun 2012 tentang Pendidikan Tinggi.
12,Apa yang terjadi jika mahasiswa tidak membayar UKT atau SPP? ,"Status mahasiswa dinyatakan tidak aktif dan jika tidak membayar selama 2 semester berturut-turut, dinyatakan mengundurkan diri.","['Pasal 12\n(1) Mahasiswa dapat menerima penyesuaian pembayaran nilai UKT atau SPP dengan \n  kondisi sebagai berikut:\n  a. Mahasiswa program sarjana dan sarjana terapan penerima beasiswa KIP-K yang \n   berada pada semester XI dan seterusnya, diwajibkan membayar UKT atau SPP \n   berdasarkan hasil evaluasi kemampuan ekonomi orang tua/wali Mahasiswa;\n  b. Mahasiswa program studi magister yang berada pada semester VII dan \n   seterusnya, diwajibkan membayar SPP senilai SPP yang dikenakan kepada \n   Mahasiswa baru program magister tersebut pada semester berjalan;\n  c. Mahasiswa program studi doktor yang berada pada semester XIII dan seterusnya, \n   diwajibkan membayar SPP senilai SPP yang dikenakan kepada Mahasiswa Baru \n   program doktor pada semester berjalan; dan/atau\n  d. Mahasiswa program pascasarjana yang berpindah jenis kelas diwajibkan \n   membayar SPP untuk jenis kelas dengan tarif lebih tinggi.', 'Pasal 12\n(1) Mahasiswa dapat menerima penyesuaian pembayaran nilai UKT atau SPP dengan \n  kondisi sebagai berikut:\n  a. Mahasiswa program sarjana dan sarjana terapan penerima beasiswa KIP-K yang \n   berada pada semester XI dan seterusnya, diwajibkan membayar UKT atau SPP \n   berdasarkan hasil evaluasi kemampuan ekonomi orang tua/wali Mahasiswa;\n  b. Mahasiswa program studi magister yang berada pada semester VII dan \n   seterusnya, diwajibkan membayar SPP senilai SPP yang dikenakan kepada \n   Mahasiswa baru program magister tersebut pada semester berjalan;\n  c. Mahasiswa program studi doktor yang berada pada semester XIII dan seterusnya, \n   diwajibkan membayar SPP senilai SPP yang dikenakan kepada Mahasiswa Baru \n   program doktor pada semester berjalan; dan/atau\n  d. Mahasiswa program pascasarjana yang berpindah jenis kelas diwajibkan \n   membayar SPP untuk jenis kelas dengan tarif lebih tinggi.', '7\n  b. apabila permohonan disetujui Wakil Rektor yang membidangi akademik, maka \n    Mahasiswa diwajibkan membayar UKT atau SPP selama periode yang tidak \n    dibayar dan membayar UKT atau SPP pada semester berikutnya untuk diaktifkan \n    statusnya sebagai Mahasiswa.\n\n                  Pasal 10\n(1) Mahasiswa yang mendapatkan izin cuti paling lambat pada minggu ke-4 (ke-empat) \n  perkuliahan diwajibkan membayar UKT atau SPP sebesar 20% (dua puluh persen).\n(2) Mahasiswa yang mendapatkan izin cuti setelah minggu ke-4 (ke-empat) perkuliahan, \n  diwajibkan membayar UKT atau SPP sebesar 100% (seratus persen).\n(3) Pengajuan izin cuti sebagaimana dimaksud pada ayat (1) dan ayat (2) diajukan \n  kepada Wakil Rektor yang membidangi akademik.\n\n                 Bagian Kedua \n           Pembebasan Pembayaran UKT dan SPP', '7\n  b. apabila permohonan disetujui Wakil Rektor yang membidangi akademik, maka \n    Mahasiswa diwajibkan membayar UKT atau SPP selama periode yang tidak \n    dibayar dan membayar UKT atau SPP pada semester berikutnya untuk diaktifkan \n    statusnya sebagai Mahasiswa.\n\n                  Pasal 10\n(1) Mahasiswa yang mendapatkan izin cuti paling lambat pada minggu ke-4 (ke-empat) \n  perkuliahan diwajibkan membayar UKT atau SPP sebesar 20% (dua puluh persen).\n(2) Mahasiswa yang mendapatkan izin cuti setelah minggu ke-4 (ke-empat) perkuliahan, \n  diwajibkan membayar UKT atau SPP sebesar 100% (seratus persen).\n(3) Pengajuan izin cuti sebagaimana dimaksud pada ayat (1) dan ayat (2) diajukan \n  kepada Wakil Rektor yang membidangi akademik.\n\n                 Bagian Kedua \n           Pembebasan Pembayaran UKT dan SPP', 'Pasal 8\n(1) Mahasiswa yang tidak membayar UKT atau SPP sampai dengan batas waktu yang \n  ditentukan, status Mahasiswanya dinyatakan tidak aktif.\n(2) Mahasiswa yang tidak membayar UKT atau SPP sebagaimana dimaksud pada ayat (1) \n  selama 2 (dua) semester berturut-turut, dinyatakan mengundurkan diri melalui \n  keputusan Rektor.', 'Pasal 8\n(1) Mahasiswa yang tidak membayar UKT atau SPP sampai dengan batas waktu yang \n  ditentukan, status Mahasiswanya dinyatakan tidak aktif.\n(2) Mahasiswa yang tidak membayar UKT atau SPP sebagaimana dimaksud pada ayat (1) \n  selama 2 (dua) semester berturut-turut, dinyatakan mengundurkan diri melalui \n  keputusan Rektor.']","Jika mahasiswa tidak membayar UKT atau SPP sampai dengan batas waktu yang ditentukan, status Mahasiswanya akan dinyatakan tidak aktif. Selain itu, jika mahasiswa tidak membayar UKT atau SPP selama 2 (dua) semester berturut-turut, maka mahasiswa tersebut akan dinyatakan mengundurkan diri melalui keputusan Rektor."
13,Apa saja peran Penanggung Jawab Fakultas atau Prodi dalam program MBKM?,"Penanggung Jawab Fakultas atau Prodi bertugas melakukan verifikasi data dan dokumen mahasiswa, memberikan rekomendasi kepada mahasiswa untuk mengikuti Program MBKM, dan melakukan koordinasi jika ada data yang perlu diperbaiki.","['Penanggungjawab Fakultas atau Prodi\nPenanggung Jawab Fakultas atau Prodi, bertugas untuk:\n1)\n2)\n3\nMelakukan verifikasi kebenaran data dan dokumen mahasiswa yang akan mendaftar Program flagship\nMBKM;\nMemberikan rekomendasi kepada mahasiswa untuk mengikuti Program flagship MBKM; dan melakukan koordinasi dengan mkhasiswa apabila terdapat data atau dokumen yang perlu diperbaiki.\n2023', 'Subdit. PK2\nPeranan Perguruan Tinggi\nPimpinan Perguruan Tinggi\nPimpinan Perguruan Tinggi, bertugas untuk memberikan persetujuan final kepada mahasiswa yang ingin mendaftar program flagship MBKM, dengan ketentuan sebagai berikut:\n1) Pimpinan PT wajib mempunyai salah satu jabatan sebagai pimpinan perguruan tinggi;\n리\nPimpinan PT bertugas menentukan penanggung jawab dari masing-masing prodi atau fakultas untuk bertindak sebagai pihak yang akan merekomendasikan mahasiswa untuk mengikuti\nprogram MBKM; dan\n3)\nPimpinan PT bertugas memberikan persetujuan akhir daftar mahasiswa setelah mendapatkan rekomendasi dari prodi atau fakultas pada laman\nADVANCING HUMANITY\nPenanggungjawab Fakultas atau Prodi\nPenanggung Jawab Fakultas atau Prodi, bertugas untuk:\n1)\n2)\n3\nMelakukan verifikasi kebenaran data dan dokumen mahasiswa yang akan mendaftar Program flagship\nMBKM;', 'kembali  (disarankan mendaftar pada Program BKP MBKM lainnya). Contoh: Magang \n●Mahasiswa yang akan mengikuti Program Magang dan Studi Independen (MSIB) Batch 6 Wajib \nmelakukan konversi alih kredit SKS MK. Subdit. PK2 \n2023 Magang dan Studi Independen Bersertifikat (MSIB) \nMengurangi Kesenjangan antara Ketersediaan SDM Berkualitas  \ndengan Permintaan Industri \nDipercaya oleh Perusahaan  \ndari Dalam dan Luar Negeri \nDan masih banyak lagi… \n Pemangku Kepentingan Program MSIB 6 \nSubdit. PK2 \nPeranan Perguruan Tinggi \n2023 \nSubdit. PK2 \nPimpinan Perguruan Tinggi Penanggungjawab Fakultas atau Prodi \nPimpinan Perguruan Tinggi, bertugas untuk memberikan \npersetujuan final kepada mahasiswa yang ingin \nmendaftar program flagship MBKM, dengan ketentuan \nsebagai berikut: \n1) Pimpinan PT wajib mempunyai salah satu jabatan \nsebagai pimpinan perguruan tinggi; \n2) Pimpinan PT bertugas menentukan penanggung \njawab dari masing-masing prodi atau fakultas \nuntuk bertindak sebagai pihak yang akan', 'di luar ITS dapat  dikembangkan dan dikoordinasikan oleh Direktorat yang mengurusi \npendidikan bekerjasama dengan Direktorat yang mengurusi pascasarjana dan \npengembangan akademik . \n(5) Direktorat yang mengurusi kegiatan pertukaran pelajar/ kuliah dalam negeri harus 16 Dokumen Panduan Baku Mutu Pelaksanaan MBKM - 2021  \n NO ELEMEN PENILAIAN  INDIKATOR  \n(1) (2) (3) \nberkoordinasi dengan Program Studi terkait . \n Standar Pengelolaan – \nPerencanaan MBKM  1. Prodi mempunyai Dokumen panduan untuk implementasi MBKM / turunan dokumen \nPerek 21 tahun 202 1 yang menjadi konsideran  implementasi MBKM . \n2. Prodi mempunyai kurikulum implementasi MBKM, yang meliputi CPL yang ditetapkan \nsesuai dengan implementasi MBKM dan peta CPL – MK MBKM  \n3.  Prodi mempunyai Dokumen panduan untuk Dosen  Wali dan Dosen Pembimbing dalam \npelaksanaan MBKM   \n4. Prodi mempunyai Dokumen pan duan untuk Mahasiswa dalam perencanaan , \npelaksannaan, penilaian pelaksanaan  MBKM', 'Kepada Yth. 1. Dekan\n             2. Kepala Departemen\n             Pada Program Pendidikan Akademik di Lingkungan ITS\n\n\nMempertimbangkan:\n(1). Peraturan Menteri Pendidikan dan Kebudayaan Republik Indonesia Nomor 3 Tahun 2020 tentang Standar Nasional\n      Pendidikan Tinggi;\n(2) Keputusan Menteri Pendidikan dan Kebudayaan Nomor 74/P/2021 tentang Pengakuan Satuan Kredit Semester\n      Pembelajaran Program Kampus Merdeka;\n(3). Peraturan Rektor ITS Nomor 27 Tahun 2020 Tentang Pedoman Evaluasi Kurikulum Untuk Program Pendidikan\n      Akademik Dan Profesi Di Lingkungan Institut Teknologi Sepuluh Nopember;\n(4). Peraturan Rektor ITS Nomor 30 Tahun 2020 Tentang Penyelenggaraan Kegiatan Merdeka Belajar –       Kampus\n      Merdeka Di Institut Teknologi Sepuluh Nopember,', 'meningkatkan prestasi mahasiswa dalam ajang nasional dan internasional.  \n(iii) Kegiatan  MBKM dalam bentuk Studi/ Proyek Independen adalah semua kegiatan untuk  \npenerapan saintek dalam rangka menghasilkan inovasi terdepan (frontie r).  12 Dokumen Panduan Baku Mutu Pelaksanaan MBKM - 2021  \n NO ELEMEN PENILAIAN  INDIKATOR  \n(1) (2) (3) \n(iv) Kegiatan  MBKM dalam bentuk Studi/ Proyek Independen dapat berupa lomba - lomba \nkemahasiswaan atau proyek - proyek untuk memecahkan persoalan di ITS, di \nmasyarakat atau industri.  \n(v) Kegiatan MBKM dalam bentuk  Studi/ Proyek Independen  dapat dikonversika n ke dalam \nsks MK  atau bentuk lain sesuai dengan ketercapaian CPL serta lama waktu proses \nkegiatan.  \n(vi) Kegiatan MBKM dalam bentuk  Studi/ Proyek dikembangkan oleh Direktorat yang \nmengurusi Kemahasiswaan.  \n(vii) Implementasi  Kegiatan MBKM dalam bentuk  Studi/  Proyek  dikoordinir oleh  Direktorat \nyang mengurusi kemahasiswaan  bersama Prodi terkait , melalui tahapan  kegiatan (a)']","Penanggung Jawab Fakultas atau Prodi dalam program MBKM memiliki beberapa peran, antara lain:
1. Melakukan verifikasi kebenaran data dan dokumen mahasiswa yang akan mendaftar Program flagship MBKM.
2. Memberikan rekomendasi kepada mahasiswa untuk mengikuti Program flagship MBKM.
3. Melakukan koordinasi dengan mahasiswa apabila terdapat data atau dokumen yang perlu diperbaiki."
14,Bagaimana penilaian prestasi mahasiswa dilakukan oleh mitra magang?,"Mitra magang memberikan penilaian berdasarkan formulir penilaian yang meliputi aspek-aspek seperti inisiatif, kemampuan komunikasi, disiplin, penampilan, ketekunan, kemampuan teknikal, berpikir kritis, kemampuan bekerjasama, kemampuan beradaptasi, dan hasil pekerjaan (kontribusi), yang kemudian diserahkan ke departemen untuk verifikasi.","['melaksanakan program magang industri. Fokus evaluasi adalah individu mahasiswa, yaitu \nprestasi yang dicapai dalam pelaksanaan magang oleh mahasiswa. Melalui evaluasi akan \ndiperoleh tentang apa yang telah dicapai dan apa yang belum dicapai oleh mahasiswa \nselama mengikuti kegiatan.  Evaluasi dapat memberikan informasi terkait kemampuan apa \nyang telah dicapai oleh mahasiswa selama mengikuti program.  Selain itu, melalui evaluasi \ndapat dilakukan judgment terhadap nilai atau implikasi dari hasil program. Selanjutnya, \nprogram ini digunakan untuk meningkatkan kompetensi mahasiswa.\n1. Prinsip Penilaian\nPenilaian dalam pelaksanaan kebijakan Merdeka Belajar - Kampus Merdeka, program \n“hak belajar tiga semester di luar program studi” mengacu kepada 5 (lima) prinsip sesuai \nSNPT yaitu edukatif, otentik, objektif, akuntabel, dan transparan yang dilakukan secara \nterintegrasi.\n2. Aspek – aspek Penilaian\nSejalan dengan prinsip-prinsip penilaian di atas, maka aspek-aspek yang dinilai dalam', 'cara observasi (kepribadian dan sosial) sebagai teknik utama. Sedangkan penilaian \nhasil dilaksanakan pada akhir pelaksanaan program dengan menggunakan laporan \nyang dibuat oleh mahasiswa. Penilaian dilakukan oleh pendamping dari Pihak Ketiga \nyang terkait dengan kegiatan yang diambil oleh mahasiswa dan dosen pendamping di \nPerguruan Tinggi.\nSelain komponen diatas, perguruan tinggi diwajibkan untuk membuat sistem berupa \nsurvey online  tentang pengalaman dan penilaian mahasiswa terhadap kualitas program \nmerdeka belajar yang mereka jalani selama satu semester diluar program studi. Hal ini dapat \ndigunakan untuk mendapatkan umpan balik dari mahasiswa sebagai sarana evaluasi bagi \nperguruan tinggi dalam mengembangkan program berikutnya.C. Melaksanakan Monitoring dan Evaluasi33       Buku Panduan Merdeka Belajar - Kampus Merdeka\nBAB IV\nPENUTUP\nDemikian buku panduan ini disusun, semoga bermanfaat bagi perguruan tinggi dan dapat', 'banyak)\n8. Pertukaran Pelajar • Jenis mata pelajaran yang diambil harus \nmemenuhi ketentuan yang ditetapkan prodi asal \nuntuk lulus (mis. memenuhi kurikulum dasar, \nmemenuhi persyaratan kuliah umum, memenuhi \npersyaratan electives, etc)Buku Panduan Merdeka Belajar - Kampus Merdeka       32\nSatuan penjaminan mutu di perguruan tinggi penyelenggara Merdeka Belajar - Kampus \nMerdeka, program “hak belajar tiga semester di luar program studi” wajib memiliki \nmekanisme formal untuk mengevaluasi dan memonitor mahasiswa secara periodik. Untuk \nmenjamin mutu program tersebut maka pelaksanaan monitor dan evaluasi dilakukan mulai \ndari tahap persiapan, pelaksanaan, dan penilaian. Penilaian/evaluasi merupakan salah \nsatu rangkaian kegiatan dalam meningkatkan kualitas, kinerja, dan produktifitas dalam \nmelaksanakan program magang industri. Fokus evaluasi adalah individu mahasiswa, yaitu \nprestasi yang dicapai dalam pelaksanaan magang oleh mahasiswa. Melalui evaluasi akan', 'e) Memberikan nilai untuk direkognisi menjadi SKS mahasiswa.\n3) Mahasiswa\na)  Dengan persetujuan Dosen Pembimbing Akademik (DPA), mahasiswa \nmendaftarkan diri untuk mengikuti program kemanusiaan. \nb) Melaksanakan kegiatan proyek (relawan) kemanusiaan di bawah bimbingan \ndosen pembimbing dan supervisor/mentor lapangan.\nc) Mengisi logbook sesuai dengan aktivitas yang dilakukan.\nd) Menyusun laporan kegiatan dan menyampaikan laporan dalam bentuk \npublikasi atau presentasi.\nProses Program Proyek Kemanusiaan\n19       Buku Panduan Merdeka Belajar - Kampus Merdeka\nf. Kegiatan Wirausaha\nBerdasarkan Global Entrepreneurship Index (GEI) pada tahun 2018, Indonesia hanya \nmemiliki skor 21% wirausahawan dari berbagai bidang pekerjaan, atau peringkat 94 \ndari 137 negara yang disurvei. Sementara menurut riset darn IDN Research Institute \ntahun 2019, 69,1% millennial di Indonesia memiliki minat untuk berwirausaha. \nSayangnya, potensi wirausaha bagi generasi milenial tersebut belum dapat dikelola', '6. Mutu penilaian.\nBeberapa kriteria yang dianjurkan untuk kegiatan di luar kampus untuk menjaga mutu dan \nmendapatkan sks penuh:\nTabel 3.1. Kriteria Kegiatan di Luar Kampus\nNo. Kegiatan Kriteria untuk dapat sks penuh (20 sks)\n1. Magang/ Praktek Kerja • Tingkat kemampuan yang diperlukan untuk \nmagang harus setara dengan level sarjana (bukan \ntingkat SMA kebawah)\n• Mahasiswa menjadi bagian dari sebuah tim – \nterlibat secara aktif di kegiatan tim\n• Mahasiswa mendapatkan masukan terkait \nperforma kinerja setiap 2 bulan\n• Harus memberikan presentasi di akhir magang \nkepada salah satu pimpinan perusahaa\n2. Asistensi Mengajar di Satuan \nPendidikan• Menentukan target yang ingin dicapai selama \nkegiatan (mis. meningkatkan kemampuan \nnumerik siswa, dst.) dan pencapaiannya \ndievaluasi di akhir kegiatan\n3. Penelitian/ Riset • Jenis penelitian (tingkat kesulitan) harus sesuai \ndengan tingkat sarjana\n• Harus terlibat dalam pembuatan laporan akhir/', 'd) Melakukan evaluasi akhir dan penyetaraan kegiatan proyek kemanusiaan \nmahasiswa menjadi mata kuliah yang relevan (SKS), serta program \nberkesinambungan.\ne)  Menyusun pedoman teknis kegiatan pembelajaran melalui proyek \nkemanusiaan.\nf) Melaporkan hasil kegiatan belajar ke Direktorat Jenderal Pendidikan Tinggi \nmelalui Pangkalan Data Pendidikan Tinggi.\n2) Lembaga Mitra\na) Menjamin kegiatan kemanusiaan yang diikuti mahasiswa sesuai dengan \nkesepakatan dalam dokumen kerja sama (MoU/SPK).\nb) Menjamin pemenuhan hak dan keselamatan mahasiswa selama mengikuti \nproyek kemanusiaan.\nc) Menunjuk supervisor/mentor dalam proyek kemanusiaan yang diikuti oleh \nmahasiswa.\nd) Melakukan monitoring dan evaluasi bersama dosen pembimbing atas \nkegiatan yang diikuti oleh mahasiswa.\ne) Memberikan nilai untuk direkognisi menjadi SKS mahasiswa.\n3) Mahasiswa\na)  Dengan persetujuan Dosen Pembimbing Akademik (DPA), mahasiswa \nmendaftarkan diri untuk mengikuti program kemanusiaan.']","Penilaian prestasi mahasiswa dilakukan oleh mitra magang dengan cara melakukan observasi terhadap kepribadian dan sosial mahasiswa sebagai teknik utama. Selain itu, penilaian hasil dilaksanakan pada akhir pelaksanaan program dengan menggunakan laporan yang dibuat oleh mahasiswa. Penilaian ini dilakukan oleh pendamping dari Pihak Ketiga yang terkait dengan kegiatan yang diambil oleh mahasiswa dan dosen pendamping di Perguruan Tinggi."
15,"Proyek P13 ""Application of Novel Snap-shot based Hyperspectral Imaging Combined with AI to Detect Lesions"" menggunakan metode apa?","Proyek ini menggunakan model pembelajaran mesin seperti YOLOv5, YOLOv8, R-CNN, dan Faster R-CNN untuk mendeteksi kanker esofagus stadium awal menggunakan model gambar cahaya putih (WLI) dan gambar narrowband hiperspektral (HSI-NBI).","['techniques. In this research, you will learn deep learning\r\ntechniques such as CNN, RNN, LSTM, AE, VAE, etc. The\r\npossible applications and topics include: (1) 3D human\r\nskeleton extraction, (2) skeleton-based action\r\nrecognition/behavior modeling, (3) action prediction for\r\nelderly monitoring, (4) 3D object (vehicle, pedestrian,\r\ncyclist) detection and positioning from fusion of RGB/LiDAR\r\nsensor data, (5) object (head/vehicle/ human/object) pose\r\nestimation from single RGB image, (6) deep learning-based\r\nadverse drug reaction (ADR) prediction for clinic medicine\r\nuse, (7) AI-generated content (AIGC), such as\r\n(text/audio/image) -to-(image/video), (8) elderly caring\r\napplication of AIGC, (9) heart rate estimation from facial\r\nimage sequence. The intern student is expected to have\r\nsome preliminary knowledge on NN (neural network) or\r\ndeep learning and skilled in Python programming. He/She\r\nwill learn how to apply state-of-the-art deep learning', 'Intern period At least 12 weeks between May 1st and Dec. 31th\r\n\r\nNumber P4\r\nProject title\r\nSimulation and Reconstruction of Pencil Beam Scanning of\r\nParticle Therapy\r\nDescription of the research\r\nPencil beam scanning in particle therapy is one of the\r\nhighlight radiation therapies for cancer treatment. Due to\r\nthe effectively and precisely control for particle-beam, the\r\nnarrow pulse and extremely high radiation dose rate\r\ndelivering becomes more and more significant. Basically,\r\nthe high dose rate will enable the recombination of the ion\r\npair effect, and it can lead to the received signal\r\nunderestimated. In addition, the higher spatial resolution\r\nand wide field of view is necessary. So, the main purpose of\r\nthe project is to develop a novel algorithm to reconstruct\r\nthe 2D image of the extremely high dose rate in\r\nproton/particle therapies. We hope that the students could\r\njoin us to implement a novel reconstruction algorithm and', '• Teori yang akan digunakan untuk meny elesaikan  \npermasalahan   \nc. Metodolog i  \n• Metode y ang digunakan \n• Bahan dan perala tan y ang digunakan \n• Urutan pelaksanaan percobaan \n7 d. Hasil dan Pe mbahasan \n• Data hasil percobaan/pengu kuran \n• Pembahasan/Diskusi (analisis, sintesis d an evaluasi)   \ne. Kesim pulan dan Saran \n• Berupa hasil  penelitian yang menjawab perm asalah an \natau y ang berupa konsep, program , dan kary a rancangan \n• Saran-saran (jika diangga p pe rlu), berisi hal-hal yang \nmasih dapat dikerjakan dengan lebih  baik dan  dapat \ndikem bangkan lebih lanj ut, atau berisi masalah-masalah \nyang dialam i pada saat proses pengerjaa n tugas akhir. \n \n3. Bagian ’Akhi r’ terdiri dari: \n a. Daftar Pustak a \n b. Lampiran-la mpiran (jika ada) \n c. Biodata penul is \n \n3.2. F ormat Laporan \n Pengetikan t ugas akhir harus mengikuti ketentu an sebagai \nberikut ini: \n \na. Jenis dan uku ran kertas : \nKertas HVS 80 gram  ukuran A5 (148 m m x 210 mm) \nb. Jarak spasi : 1 (satu)', '8. Referensi l ainnya (Manual,  Brosur, dan sejenisny a)  \nReliab le Su pply in Reliab le Qu ality. Brosur PT . Dharma S arana \nPerdana.  Pulo Gadung Industrial Estate , Jakarta.  \nEngineeri ng E ducat ion and T raining. Catalogue Plint Engineering . \nOakland Par k, Wokingham. \nMonograf Kelurahan Wonorejo, Rungkut, Surabaya, 2006 . \n14  \n3.11.  Biodata Penulis \n Ditulis pada halam an terakhir da n beri si tentang resume penulis, \nantara lain tem pat dan tanggal la hir, ri wayat pendid ikan, aktivita s \nyang m enonjol, organisasi, prestasi y ang pernah diraih, dan lain-l ain. \nPada sudut kiri atas ditam pilkan foto terbaru cl osed-up pen ulis \nukuran (4 x 6) cm  dan dianjurkan foto warna. Contoh bi odata dapat  \ndilihat pada Lampiran 4 . \n \n \n \n \n \n \n \n \n \n \n \n \n \n \n \n \n \n \n \n \n \n \n \n \n \n \n \n \n \n \n \n15  \n \n \n \n \n \nLampiran 1 : CONTOH HALAMAN JUDUL ATAU KULIT MUKA \n \n16 TUGAS AKHIR - MT 1702\nPENGARUH PENAMBAHAN U NSUR BISMUTH (Bi)\nDAN YTRIUM  (Y) DALAM CAIRAN SENG PADA', '15\n\x0c1. Bila referensi berupa Buku\n   a. Buku tanpa adanya identitas DOI, dalam bentuk versi cetak, dan tidak ada versi\n       digital.\n    Format:\n    Author, A. A. (year). Title of book. Publisher\n\n    Contoh:\n    Lloyd Owen, D. A. (2018). Smart water technologies and techniques: Data capture and\n         analysis for sustainable water management. John Wiley & Sons.\n\n    Cara menulis sitasi:\n    Menurut Lloyd Owen (2018, p.2) … atau … (Lloyd Owen, 2019, p. 2)', '• Mampu memilih dan mengorganisir data yang diperlukan.\n• Mampu mengamati dan menilai dengan jeli berbagai proses, peristiwa, manfaat dan kelemahan yang ada selama melakukan kegiatan Magang.\n7.4\nFORMAT DAN SISTEMATIKA LAPORAN\nMAGANG\n• FORMAT PENULISAN LAPORAN MAGANG\n1. Jenis dan Ukuran Kertas\nKertas HVS 70gram ukuran A5 (148 × 210 mm).\n2. Cover Laporan\n3. Lembar pengesahan dengan dasar polos berwarna putih\nPembimbing tempat magang tanda tangan terlebih dahulu.\n4. Jarak Tepi (margin)\n- Tepi Atas : 2,5 cm\n- Тері Bawah : 2,5 cm\n- Tepi Kiri: 2,5 cm\n- Tepi Kanan : 2,0 cm\n5. Jenis Huruf\nTimes New Roman, Normal, 12 pt (judul), 11 pt (isi)\n46\n07 Pedoman Penulisan Laporan Magang']",Saya tidak tahu.
16,"Apa yang akan dikembangkan dalam proyek P16 ""Next Generation Wireless Communication, B5G/6G, Reconfigurable Intelligent Surface, System Level Simulation, Artificial Intelligence-enhanced Wireless Research""? ","Proyek ini berfokus pada inovasi dan desain konsep-konsep canggih dan arsitektur di luar 5G dan 6G, mengidentifikasi dan memvalidasi solusi untuk masalah kunci melalui simulasi atau eksperimen prototipe, serta merancang algoritma, model, dan protokol baru untuk mengoptimalkan kinerja jaringan nirkabel.","['Category\r\n■ Scholarship\r\n■ Self-supported\r\nIntern period At least 8 weeks between 2024/5/1- 2024/12/31\r\n\r\nNumber P16\r\nProject title\r\nNext generation Wireless communication, B5G/6G,\r\nReconfigurable Intelligent Surface, System level\r\nsimulation, Artificial Intelligence-enhanced wireless\r\nresearch\r\nDescription of the\r\nresearch\r\nInnovate and design cutting-edge concepts and\r\narchitectures beyond 5G (B5G) and 6G.\r\nIdentify and validate solutions to key problems through\r\nsimulation or prototype experiments.\r\nConduct research on AI and machine learning\r\ntechniques applied to wireless communications and\r\nnetworks.\r\nDesign and implement novel algorithms, models, and\r\nprotocols to optimize wireless network performance.\r\nCollaborate with the research team to manage projects\r\nand ensure timely deliverables,\r\nPlease refer to the website of our lab at\r\nhttps://sites.google.com/view/ccuantlab/english\r\nMentor at CCU\r\nAssoc. Prof. Jen-Yi Pan\r\nDept. of Communications Engineering,', 'techniques. In this research, you will learn deep learning\r\ntechniques such as CNN, RNN, LSTM, AE, VAE, etc. The\r\npossible applications and topics include: (1) 3D human\r\nskeleton extraction, (2) skeleton-based action\r\nrecognition/behavior modeling, (3) action prediction for\r\nelderly monitoring, (4) 3D object (vehicle, pedestrian,\r\ncyclist) detection and positioning from fusion of RGB/LiDAR\r\nsensor data, (5) object (head/vehicle/ human/object) pose\r\nestimation from single RGB image, (6) deep learning-based\r\nadverse drug reaction (ADR) prediction for clinic medicine\r\nuse, (7) AI-generated content (AIGC), such as\r\n(text/audio/image) -to-(image/video), (8) elderly caring\r\napplication of AIGC, (9) heart rate estimation from facial\r\nimage sequence. The intern student is expected to have\r\nsome preliminary knowledge on NN (neural network) or\r\ndeep learning and skilled in Python programming. He/She\r\nwill learn how to apply state-of-the-art deep learning', 'systems (IBRs) has been displacing conventional\r\nsynchronous generators and causing a reduction in system\r\ninertia. IBRs are integrated into power grids through power-\r\nelectronics inverters. These are generally categorized as (i)\r\ngrid-following (GFL) and (ii) grid-forming (GFM) inverters.\r\nThe GFM inverter is a promising emerging technology that\r\ngenerates its own voltage signal and has the capability to\r\nregulate the frequency and voltage at the point of\r\ninterconnection. GFM and GFL with virtual inertia and grid\r\nvoltage support functions are in great demand when the\r\npenetration level of IBRs in the grid is high. The simulation-\r\nbased research project will focus on investigating the\r\npotential applications to enhance low-inertia microgrid/grid\r\nresilience and stability when the grid is subjected to minor\r\nor large disturbances.\r\nMentor at CCU\r\nProf. Gary Chang, PhD, PE, IEEE Fellow\r\nDept. of Electrical Engineering,\r\nNational Chung Cheng University, Taiwan, ROC.', 'Description of the research\r\nArtificial Intelligence (AI) technologies, 6G networking,\r\nand quantum computing are the leading forces in\r\nbringing the world to an era of better intelligence and full\r\nautomation. However, the rapid development of such\r\ntechnologies raises concerns that they could be used to\r\ndamage human life, destroy critical infrastructure, and\r\nfurther violate user privacy. For example, AI power can be\r\nexploited to scan the vulnerabilities of critical control\r\nsystems (SCADA, ITS) or track a target user in a restricted\r\naccess building, even without physical intrusion. Similarly,\r\nthe attackers can launch adversarial attacks against AI-\r\nbased Advanced Driver-Assistance Systems (ADAS) and\r\nforce connected vehicles to act as unexpected weapons\r\nto hit civilians. Early detection of security attacks and\r\nsecure AI models are the top targets of many current\r\nresearch efforts. In short, our lab is recruiting talents who\r\nare interested in the following topics:', 'secure AI models are the top targets of many current\r\nresearch efforts. In short, our lab is recruiting talents who\r\nare interested in the following topics:\r\n(1) AI for Cybersecurity: Misbehavior detection in\r\nautonomous vehicles, Deep Reinforcement Learning for\r\naerial-assisted networks (UAV-satellite-space) or\r\nIntelligent Transportation Systems, Self-supervised\r\nLearning, autoDL /ML for Intrusion Detection Systems.\r\n(2) Cybersecurity for AI: Trustable AI for automated\r\nvehicles and AI-based control systems from adversarial\r\nattacks.\r\n(3) 6G security: Signal sensing, physical layer\r\nauthentication, high-accuracy localization and sensing.\r\n(4) Space and Quantum security: Blockchain for\r\nvehicular/aerial networks; Quantum - safe\r\nvehicular/aerial networks; Quantum - compatible IDS\r\nplatforms.\r\nAbout CISLab: CIS Lab is a leading security research group\r\nat National Chung Cheng University, established by Prof.\r\nVan-Linh Nguyen. CISLab has been the home of many', 'MSc Information technology / Track Data science IMT Atlantique\n15\nDigital / Information\nTechnologies\nMaster Cybersecurity Institut Polytechnique de Paris\n16\nDigital / Information\nTechnologies\nMSc Data Analytics for Business KEDGE Business School']","Proyek P16 ""Next Generation Wireless Communication, B5G/6G, Reconfigurable Intelligent Surface, System Level Simulation, Artificial Intelligence-enhanced Wireless Research"" akan mengembangkan konsep dan arsitektur terdepan di luar 5G (B5G) dan 6G. Proyek ini juga akan mengidentifikasi dan memvalidasi solusi untuk masalah kunci melalui simulasi atau eksperimen prototipe. Selain itu, proyek ini akan melakukan penelitian tentang teknik kecerdasan buatan dan pembelajaran mesin yang diterapkan pada komunikasi nirkabel dan jaringan. Selain itu, proyek ini akan merancang dan menerapkan algoritma, model, dan protokol baru untuk mengoptimalkan kinerja jaringan nirkabel. Kolaborasi dengan tim penelitian juga akan dilakukan untuk mengelola proyek dan memastikan pengiriman tepat waktu."
17,Bagaimana cara menghubungi penyelenggara program internship ini?,"Kontak dapat dilakukan melalui nomor +886-5-2720411 ext. 23003, 23005, atau email coleng_dia@ccu.edu.tw. Alamatnya adalah No.168, Sec. 1, University Rd., Minhsiung, Chiayi 621301, Taiwan (R.O.C.).","['Penanggungjawab Fakultas atau Prodi\nPenanggung Jawab Fakultas atau Prodi, bertugas untuk:\n1)\n2)\n3\nMelakukan verifikasi kebenaran data dan dokumen mahasiswa yang akan mendaftar Program flagship\nMBKM;\nMemberikan rekomendasi kepada mahasiswa untuk mengikuti Program flagship MBKM; dan melakukan koordinasi dengan mkhasiswa apabila terdapat data atau dokumen yang perlu diperbaiki.\n2023', '•ala manas swa cari eroeiterkaitakan\ndikirimkan ke email tersebut.\nUbah Email Penanggung Jawab\nAnda dapat mengubah email dengan\nmenekan lomoo uoan oaca daris.\nprogram studi terkait. Pilih tombol simpan\nuntuk menyimpan email yang baru.\nHapus Email Penanggung Jawab\nAnda cadal mencnaous email cari\nprogram studi terkait dengan menekan\ntombol [:] lalu pilih hapus email. Maka email tersebut bukan lagi sebagai\nPenanggung Jawab Fakultas/Prodi.\nMasukkan emaill\nemailP|corodi@kamous.ac.id\nemailorodi2@kamous.ac.idl\nemailPICprodi@kampus.ac.id\nemail@kampus.ac.id\nTutup\nCatatan:\n• Pimpinan Perguruan Tinggi perlu\nmenugaskan Penanggung Jawab\nFakultas/Prodi untuk seluruh Program\nStudi yang terdapat di PT\nJika terdapat ketidaksesuaian data dari\nProgram Studi yang ada di platform dengan Program Studi di PT, harap melaporkan hal tersebut melalui Pusat\nBantuan\nKementerian Pendidikan, Kebudayaan, Riset dan\nTeknologi', ""PANDUAN PEMBUATAN AKUN DAN\nPENDAFTARAN PROGRAM\n1. Akses website MBKM kampusmerdeka.kemdikbud.go.id, silahkan\nklik tombol 'MASUK' di pojok kanan atas seperti gambar di bawah ini:\nBand Laman Kampus Merdeka telah diperbari dengan sisteryang wbh baik dan ramah guna. Mohon masuk ke akun Anda untuk pergumuman terbar\nJika ada pertanyaan, siakan menggunakan fitur tanya jawab yang ada di laman ini.\nProgram\n- Masu\nAmbil Kendali\nMasa Depanmu\nKampus Merdeka adalah cara terbaik berk\nuntuk membentuk masa depan yang sesuai dengan aspir asi karieru\nDaftar Program\n2. Daftarkan akun MBKM dengan klik tombol 'Daftar'\nLaman Kampus Merdeka telah diperbarui dengan sistem yang lebih baik dan ramah guna. Mohon masuk ke akun Anda untuk pengumuman terbaru.\nJika ada pertanyaan, silakan menggun\nMasuk\nKampus herdeko\nHama cmail\nMasukkan alamat email yang terdaftar\nKata Sandi\nKaraand\nocram\nMasuk\nAmbil\nMasa [\nKampus Merdeka adalah ca untuk membentuk masa de\nDaftar Progra\nMasuk\nBelum punya ak\n2 Daftar"", 'exchange,  (b) internship, (c) short program, (d) public service/outreach program , atau (e) \nMK secara online . \n(vi) Kegiatan pertukaran pelajar internasional dilakukan pada perguruan tinggi yang \nmempunyai reputasi minimal sama dengan ITS.  \n(vii) Kegiatan MBKM dalam bentuk  pertukaran pelajar nasional dan internasional \ndikembangkan dan dikoordinasikan oleh Direktorat terkait.  \n(viii) Implementasi  MBKM dalam bentuk  pertukaran pelajar nasional dan internasional \ndikoordinir oleh Direktorat yang mengurusi kegiatan pertukaran pelajar nasional dan \ninternasional bersama  Prodi terkait ,  melalui tahapan kegiatan (a) persiapan, (b) \nPelaksanaan, (c) Evaluasi, (d) Pengendalian,  dan (e) Peningkatan.  \n \n11 Standar Proses –  \nKegiatan MBKM – bentuk \nPenelitian  (i) Kegiatan MBKM dalam bentuk penelitian /riset  dimaksudkan untuk mencapai CPL . \n(ii) Kegiatan MBKM dalam bentuk penelitian/ riset ditujukan untuk membangun dan', '1. Setiap mahasiswa ITS yang ingin mendaftar program internasional di perguruan tinggi mitra ITS luar negeri yang\nmembutuhkan surat rekomendasi atau dana dukungan dari ITS di antaranya IISMA/IISMA-Vo, pertukaran pelajar (exchange),\nlab-internship, short program, atau program lain di luar negeri, diharuskan memiliki sertifikat Global Competency\nWorkshop (GCW) atau Global Competency Academy (GCA). Sertifikat ini hanya bisa diperoleh dengan mengikuti program\nGCW atau GCA.', 'Hal ini dilakukan dengan tujuan memastikan keakuratan informasi akademik mahasiswa sebagai syarat mendaftar ke program Kampus Merdeka.\nJika ada pertanyaan atau bantuan yang dibutuhkan, harap hubungi tim kami di Pusat Bantuan.\nHormat kami,\nTim Kampus Merdeka\n8. Penanggung Jawab Fakultas/Prodi Anda akan menerima email notifikasi penugasan verifikasi data akademik mahasiswa untuk prodi tersebut untuk program Kampus Merdeka. Klik\n""Verifikasi Sekarang"".\n9. Contoh email notifikasi penugasan jika belum ada mahasiswa yang terdaftar\nMohon cek folder Spam jika email tidak muncul di folder Kotak Masuk.\nCatatan:\nPenanggung Jawab Fakultas/Prodi dapat menerima penugasan dan melakukan verifikasi hanya dengan klik tautan yang dikirimkan lewat email. Tidak perlu melakukan pendaftaran di laman MBKM.\nKementerian Pendidikan, Kebudayaan, Riset dan\nTeknologi']","Untuk menghubungi penyelenggara program internship, Anda dapat menggunakan fitur tanya jawab yang ada di laman website MBKM kampusmerdeka.kemdikbud.go.id. Jika ada pertanyaan atau bantuan yang dibutuhkan, Anda juga dapat menghubungi tim di Pusat Bantuan."
18,Apa yang harus dilakukan jika ingin menghapus atau menarik artikel yang telah diunggah?,"Isi form di link: https://its.id/FHAJTeknikITS untuk Jurnal Teknik, https://its.id/FHAJSainsSeniITS untuk Jurnal Sains & Seni, atau https://its.id/FHAJRepositoryITS untuk Repository.","['data diri dan akademik, maka Anda dapat meminta mahasiswa untuk melakukan revisi data.\n1.\n2\n3\n4\n5\nPada pertanyaan pertama untuk mengizinkan mahasiswa mengikuti program, klik ""Ya, Beri Izin"".\nPertanyaan berikutnya, apakah data akademik sudah sesuai dengan data pembanding internal? Anda klik\n""Tidak Sesuai"".\nKolom komentar akan muncul, dan Anda diharapkan memberikan deskripsi ketidaksesuaian data yang Anda maksudkan agar mahasiswa dapat melakukan perbaikan sesuai dengan data yang benar. Klik ""Kirim Permintaan Revisi""\nNotifikasi permintaan revisi berhasil terkirim\nBerikut tampilan pada akun mahasiswa yang perlu melakukan revisi. Klik ""Perbaiki Data"", kemudian lakukan perbaikan data sesuai dengan catatan perbaikan yang diberikan.\nKementerian Pendidikan, Kebudayaan, Riset dan\nTeknologi', '\uf0b7   UNGGAH artikel WAJIB dilakukan oleh MAHASISWA PENDAFTAR YUDISIUM 121.', 'PENANGGUNG JAWAB FAKULTAS/PRODI \nKementerian Pendidikan, Kebudayaan, Riset, dan \nTeknologi Kementerian Pendidikan, Kebudayaan, Riset dan \nTeknologi Subdit. PK2 \n1\n2\n3\n4\n Jika pada data mahasiswa Anda menemukan ketidaksesuaian  \ndata diri dan akademik, maka Anda dapat meminta mahasiswa  \nuntuk melakukan revisi data. \n1. Pada pertanyaan pertama untuk mengizinkan mahasiswa  \nmengikuti program, klik “Ya, Beri Izin”. \n2. Pertanyaan berikutnya, apakah data akademik sudah  \nsesuai dengan data pembanding internal? Anda klik  \n“Tidak Sesuai”. \n3. Kolom komentar akan muncul, dan Anda diharapkan  \nmemberikan deskripsi ketidaksesuaian data yang Anda  \nmaksudkan agar mahasiswa dapat melakukan perbaikan  \nsesuai dengan data yang benar. Klik “Kirim Permintaan  \nRevisi” .\n4. Notifikasi permintaan revisi berhasil terkirim \n5. Berikut tampilan pada akun mahasiswa yang perlu  \nmelakukan revisi . Klik “Perbaiki Data”, kemudian  \nlakukan perbaikan data sesuai dengan catatan perbaikan  \nyang diberikan. 2', 'Cara menulis sitasi:\n     Harding (2019) menuliskan …. atau … (Harding, 2019)\n\n      i. Artikel di dalam webpage - yang dikategorikan bukan surat kabar\n     Contoh:\n     Taunton, E. (2019, December 2). Low methane New Zealand sheep coming to a farm\n          near you. Stuff. https://www.stuff.co.nz/business/farming/117862851/low-\n          methane-sheep-coming-to-a- farm-near-you\n\n     Cara menulis sitasi:\n     Taunton (2019) … OR … (Taunton, 2019)\n\n\n3.12 Biodata Penulis\n    Ditulis pada halaman terakhir dan berisi tentang resume penulis, antara lain tempat dan\ntanggal lahir, riwayat pendidikan, aktivitas yang menonjol, organisasi, prestasi yang pernah\ndiraih, dll. Pada sudut kiri atas ditampilkan foto terbaru closed-up penulis ukuran (4 x 6) cm\ndan dianjurkan foto warna. Contoh biodata dapat dilihat pada Lampiran 11.\n\n\n\n\n                                                                                           22\n\x0c                                     DAFTAR PUSTAKA', 'Pemberitahuan\nUnggah Artikel POmITS\nUNGGAH artikel WAJIB dilakukan oleh MAHASISWA PENDAFTAR YUDISIUM 129\n Mahasiswa yang Dosen Pembimbingnya memilih untuk MEMpuBLIKAsIKAN\nartikelnya pada Jurnal POmITS, dapat melakukan UNGGAH, dengan mengikuti langkah\npada BUKU PANDUAN TATA CARA UNGGAH. File yang HARUS DIUNGGAH adalah\n(ukuran masing-masing file tidak boleh lebih dari 2 MB):\nArtikel hasil dari Tugas Akhir, dalam format Ms. Word yang telah mengikuti tem-\n1.\nplate. (selain format Ms.Word artikel DITOLAK/REJECTED)\nFormulir Hak Cipta, dalam format PDF.\nForm Telaah Artikel POmITs, dalam format PDF.\nForm Revisi/Perbaikan/Penyempurnaan TA yang berisi nama penguji beserta\ntidak hanya TTD saja)\n Template, Formulir Hak Cipta, Buku Panduan Tata Cara Unggah, dan Form Telaah\n5.\nArtikel dapat diunduh pada link:\nhttps://ejurnal.its.ac.id/index.php/teknik (Jurnal Teknik ITS)\nhttps://ejurnal.its.ac.id/index.php/sains_seni (Jurnal Sains&Seni ITS)\nSection yang bisa dipilih pada Jurnal Teknik ITS:', '*Jika ada informasi yang kurang mohon informasikan kepada kami :))\n\n1        \nMengecek nilai TOEFL di UPT Bahasa.\n\nJika belum terpenuhi, segera melakukan perbaikan nilai!\n\nhttps://bahasa.its.ac.id/\n2        Melakukan pengecekan nilai SKEM di MyITS StudentConnect.\n(Bagi mahasiswa Program Sarjana dan Sarjana Terapan) Jika belum terpenuhi, segera melakukan perbaikan nilai!        \nSKEM lama (Angkatan sebelum 2018)\nCP: Romli (085755935945)\n\nLink: melalui SIAKAD \n\n SKEM baru (Angkatan 2018 dst)\nCP: Rayhan (082233935593)\n\nLink: MyITS student connect\n\nCek juga Informasi SKEM di halaman depan if-tegration, di IF, dapat ditanyakan ke TKK > Bu Ratih\n\n3        \nBebas Pustaka dengan mengakses e-Bebas-Pustaka melalui web perpustakaan.\n\nSalah satu persyaratan bebas Pustaka adalah upload buku TA melalui web repository.its.ac.id.']","Anda dapat menghapus atau menarik artikel yang telah diunggah dengan mengikuti langkah-langkah berikut:
1. Buka akun mahasiswa yang telah mengunggah artikel.
2. Cari opsi atau menu yang berkaitan dengan pengelolaan artikel yang telah diunggah.
3. Pilih opsi untuk menghapus atau menarik artikel yang ingin dihapus.
4. Konfirmasikan tindakan tersebut dan ikuti petunjuk yang diberikan untuk menyelesaikan proses penghapusan atau penarikan artikel.

Jika Anda tidak mengetahui langkah-langkah yang tepat, Anda dapat menghubungi pihak yang bertanggung jawab di institusi terkait untuk bantuan lebih lanjut."
19,Apa yang terjadi dengan artikel yang tidak memenuhi ketentuan publikasi?,Artikel tersebut tidak akan dipublikasikan di Jurnal Teknik ITS dan Jurnal Sains & Seni ITS.,"[""melakukan UNGGAH di Jurnal Repository, menggunakan login 'mahasiswa', dengan.\nkata sandi 'M4h4sisw4lTs!' ke alamat 'https://ejurnal.its.ac.id/index.php/index/login'\ndengan mengunggah file artikel dan file Form Telaah(dalam format pdf) saja.\nPengecekan file vang TERuNGGAH dapat dilihat di\nhttps://lpmp2ki.its.ac.id/pomits.\nJika terdapat penghapusan/penarikan artikel, dapat mengisi form pada link :\nhttps://its.id/FHAJTeknikITSPOMITS, untuk Jurnal Teknik ITS;\n1.-\nhttps:/l/its.id/FHAJSainsSenilTSPOMITS, untuk Jurnal Sains &Seni ITS;\n3.https://its.id/FHAJRepositorylTSPOMITS, untuk Jurnal Repository..\n Penghapusan Artikel akan dilakukan setelah yudisium berakhir.\nArtikel - artikel yang TIDAK MEMENUHI KETENTUAN PUBLIKASI (gaya selingkung\ntidak sesuai format dan file pendukung tidak lengkap) tidak akan DIPUBLIKASIKAN\ndi Jurnal Teknik ITS dan Jurnal Sains & Seni ITS.\nPeriode unggah artikel untuk yudisium 29 adalah sampai dengan \n15 Februari 2024 pukul 24.00 WIB"", '\uf0b7   Pengecekan file yang TERUNGGAH dapat dilihat di\n    http://lpmp2ki.its.ac.id/pomits.\n\n\uf0b7   Jika terdapat penghapusan/penarikan artikel, dapat mengisi form pada link\n    \uf031\uf02e http://bit.ly/FHAJTeknikITS, untuk Jurnal Teknik ITS;\n    \uf032\uf02e http://bit.ly/FHAJSainsSeniITS, untuk Jurnal Sains &Seni ITS;\n    \uf033\uf02e http://bit.ly/FHAJRepositoryITS, untuk Repository.\n\n\n\uf0b7   List data Artikel terhapus dapat dilihat pada website jurnal.\n    (http://ejurnal.its.ac.id, yang diupdate tiap 3 hari)\n\n\uf0b7   Artikel - artikel yang TIDAK MEMENUHI KETENTUAN PUBLIKASI (gaya selingkung tidak\n    sesuai format dan file pendukung tidak lengkap) tidak akan DIPUBLIKASIKAN di\n    Jurnal POMITS.\n\n\uf0b7   Periode unggah artikel untuk yudisium 122 adalah sampai dengan\n    7 Agustus 2020, pukul 24.00 WIB', '\uf0b7   UNGGAH artikel WAJIB dilakukan oleh MAHASISWA PENDAFTAR YUDISIUM 121.', 'Pemberitahuan\nUnggah Artikel POmITS\nUNGGAH artikel WAJIB dilakukan oleh MAHASISWA PENDAFTAR YUDISIUM 129\n Mahasiswa yang Dosen Pembimbingnya memilih untuk MEMpuBLIKAsIKAN\nartikelnya pada Jurnal POmITS, dapat melakukan UNGGAH, dengan mengikuti langkah\npada BUKU PANDUAN TATA CARA UNGGAH. File yang HARUS DIUNGGAH adalah\n(ukuran masing-masing file tidak boleh lebih dari 2 MB):\nArtikel hasil dari Tugas Akhir, dalam format Ms. Word yang telah mengikuti tem-\n1.\nplate. (selain format Ms.Word artikel DITOLAK/REJECTED)\nFormulir Hak Cipta, dalam format PDF.\nForm Telaah Artikel POmITs, dalam format PDF.\nForm Revisi/Perbaikan/Penyempurnaan TA yang berisi nama penguji beserta\ntidak hanya TTD saja)\n Template, Formulir Hak Cipta, Buku Panduan Tata Cara Unggah, dan Form Telaah\n5.\nArtikel dapat diunduh pada link:\nhttps://ejurnal.its.ac.id/index.php/teknik (Jurnal Teknik ITS)\nhttps://ejurnal.its.ac.id/index.php/sains_seni (Jurnal Sains&Seni ITS)\nSection yang bisa dipilih pada Jurnal Teknik ITS:', 'e. Artikel jurnal dengan DOI, Penulis secara individu atau dalam group\n\nContoh:\nEysenbach, G., & CONSORT-EHEALTH Group. (2011). CONSORT-EHEALTH:\n     Improving and standardizing evaluation reports of web-based and mobile health\n     interventions. Journal of Medical Internet Research, 13(4), e126.\n     https://doi.org/10.2196/jmir.1923\n\nf. Artikel jurnal dalam pers\nArtikel dalam pers adalah peer review, dimana artikel diterima dan akan diterbitkan\ndalam jurnal, tetapi belum ditetapkan ke volume tertentu /edisi tertentu. Meskipun artikel\ndi pers belum memiliki semua rincian bibliografi yang tersedia, artikel ini dapat dikutip\nmenggunakan tahun publikasi online dan DOI.\n\nContoh:\nKreuzer, M., Cado, V., & Raïes. (2019). Moments of care: How interpersonal interactions\n     contribute to luxury experience of healthcare consumers. Journal of Business\n     Research. https://doi.org/10.1016/j.jbusres.2019.11.033', '*Jika ada informasi yang kurang mohon informasikan kepada kami :))\n\n1        \nMengecek nilai TOEFL di UPT Bahasa.\n\nJika belum terpenuhi, segera melakukan perbaikan nilai!\n\nhttps://bahasa.its.ac.id/\n2        Melakukan pengecekan nilai SKEM di MyITS StudentConnect.\n(Bagi mahasiswa Program Sarjana dan Sarjana Terapan) Jika belum terpenuhi, segera melakukan perbaikan nilai!        \nSKEM lama (Angkatan sebelum 2018)\nCP: Romli (085755935945)\n\nLink: melalui SIAKAD \n\n SKEM baru (Angkatan 2018 dst)\nCP: Rayhan (082233935593)\n\nLink: MyITS student connect\n\nCek juga Informasi SKEM di halaman depan if-tegration, di IF, dapat ditanyakan ke TKK > Bu Ratih\n\n3        \nBebas Pustaka dengan mengakses e-Bebas-Pustaka melalui web perpustakaan.\n\nSalah satu persyaratan bebas Pustaka adalah upload buku TA melalui web repository.its.ac.id.']","Artikel yang tidak memenuhi ketentuan publikasi, seperti gaya selingkung tidak sesuai format dan file pendukung tidak lengkap, tidak akan dipublikasikan di Jurnal Teknik ITS dan Jurnal Sains & Seni ITS."
