,question,ground_truth,contexts,answer
0,Apa itu program IUP?,"International Undergraduate Program yang selanjutnya disingkat IUP adalah program pendidikan sarjana yang dilaksanakan dalam bahasa Inggris dan mahasiswa wajib mengikuti kegiatan internasional sekurang-kurangnya satu kali selama masa studi dalam bentuk Joint degree/Double Degree, student exchange, final project, internship, atau short program dengan perguruan tinggi mitra ITS di luar negeri.","['perkuliahan atau kegiatan terjadwal lainnya, termasuk kegiatan evaluasi.\n6. Mahasiswa adalah peserta didik pada jenjang pendidikan tinggi di ITS.\n7. Mahasiswa Asing adalah mahasiswa ITS dengan kewarganegaraan selain Indonesia.\n8. International Undergraduate Program yang selanjutnya disingkat IUP adalah program \n     pendidikan sarjana yang dilaksanakan dalam bahasa Inggris dan mahasiswa wajib \n     mengikuti kegiatan internasional sekurang-kurangnya satu kali selama masa studi \n     dalam bentuk Joint degree/Double Degree, student exchange, final project, internship, \n     atau short program dengan perguruan tinggi mitra ITS di luar negeri.\n9. Joint Degree/Double Degree adalah penyelenggaraan pendidikan bergelar yang \n     bekerja sama dengan perguruan tinggi mitra.', 'terlibat di dalam pro ses dan hasil pelaksanaan MBKM.  \n(2). SOP yang diterbitkan oleh: (a) Direktorat terkait sebagai koordinator pelaksana \nmasing -masing bentuk MBKM, (b) Prodi sebagai pelaksana MBKM  untuk memandu \ndosen, mahasiswa dan tenaga kependidikan yang terlibat di dalam proses dan hasil \npelaksanaan MBKM.  \nDokumen (1) dan (2) di atas, merupakan manual untuk seluruh stakeholder yang terlibat \ndi dalam implementasi MBKM, yang dapat disusun dalam satu dokumen atau lebih secara \nterpisah. Rambu -rambu dalam penyusunan ke dua dokumen di atas, dengan ketentuan \nmemuat unsur -unsur sebagai berikut, dan dapat dikembangkan sesuai dengan kebutuhan \ndan tujuan pelaksanaan MBKM.  \n1. Tujuan dan ma ksud Manual MBKM  \n2. Luas lingkup Manual MBKM  \na. Manual Penetapan standar  \nb. Manual pelaksanaan standar  \nc. Manual evaluasi standar  \nd. Manual pengendalian pelaksnanaan standar  \ne. Manual peningkatan standar  \n3. Rincian tentang hal yang harus dikerjakan', 'â€¢ IISMA is a scholarship scheme by the Government of Indonesia to\nfund Indonesian students in mobility programs at top universities\nabroad. Students can spend up to one semester at a partner\nuniversity abroad to study, learn about the culture of the\ndestination country, and do practical assignments to home skills.\nwww.its.ac.id INSTITUT TEKNOLOGI SEPULUH NOPEMBER, Surabaya - Indonesia\nStudent Exchange (IISMA)\nCoverage\n- Tuition fee\n- Monthly living expenses (including accommodation) according to PO LPDP\n- Health insurance during the program (excluding travel insurance)\n- Visa\n- Self Quarantine in destination country (if needed)\n- PCR Test\n- Flight ticket\nwww.its.ac.id INSTITUT TEKNOLOGI SEPULUH NOPEMBER, Surabaya - Indonesia\nIF International exposure\nâ€¢ Collaborating with DKG\nâ€¢ Search place of execution\nâ€¢ Document handling\nâ€¢ Student exchange/Internship partners:\nâ€¢ Asia University, Taiwan\nâ€¢ Shibaura University, Japan\nâ€¢ Kumamoto Univ, Hiroshima Uni, Japan\nâ€¢ Ajoo Univ, Korea', 'Subdit. PK2\nSKEMA PELAKSANAAN\nPROGRAM MAGANG\nMANDIRI DI ITS\nMahasiswa / Departemen melakukan\nmenyertakan:\n1. Proposal Magang\n2. Surat Rekomendasi Departemen\n3. Surat Penerimaan Magang\nPelaksanaan Magang\nProses pengurusan\nPKS\nPKS tidak\ndisetujui\nPKS\nTertandatangan\nSelesai\nMagang berakhir <\nMahasiswa mendapatkan\nSertifikat / Penilaian Magang\nSelesai\nADVANCING HUMANITY\niTS\nMulai\nMahasiswa mengurus\nsurat rekomendasi\ndepartemen untuk pengajuan magang ke\nMitra\nMahasiswa mengajukan\npermohonan magang ke\nMitra\nMitra melakukan seleksi magang\nMahasiswa menerima hasil seleksi magang dari Mitra\nTidak diterima\nSelesai\nDiterima\nMahasiswa melaporkan\nke Departemen']","Program IUP adalah International Undergraduate Program yang merupakan program pendidikan sarjana yang dilaksanakan dalam bahasa Inggris di ITS. Mahasiswa yang mengikuti program ini wajib mengikuti kegiatan internasional sekurang-kurangnya satu kali selama masa studi dalam bentuk Joint degree/Double Degree, student exchange, final project, internship, atau short program dengan perguruan tinggi mitra ITS di luar negeri."
1,Apa saja dana pendidikan di ITS?,"UKT, SPP, SPI dan SPA.","['BAB IX \n      BESARAN DAN MEKANISME PEMBAYARAN DANA PENDIDIKAN\n\n                  Pasal 24\n(1) Besaran dana pendidikan ditetapkan melalui keputusan Rektor.\n(2) Pembayaran dana pendidikan sebagaimana dimaksud pada ayat (1) dilakukan secara \n  online melalui bank persepsi yang ditunjuk, sesuai jadwal pembayaran yang telah \n  ditetapkan.\n\n\n                   12\n(3) Dana Pendidikan yang telah dibayarkan tidak dapat ditarik kembali kecuali memenuhi \n      ketentuan sebagaimana diatur dalam Pasal 20.\n\n                                                                            BAB X \n                                                             KETENTUAN PENUTUP', 'Pasal 23\n(1) Dana Pendidikan dig~an untuk:\n a. penyelenggaraan kegiatan tridharma perguruan tinggi dan pengelolaan manajemen;\n b. pengadaan sarana dan prasarana penyelenggaraan tridharma perguruan tinggi dan \n   manajemen yang meliputi:\n   1. pembangunan gedung pendidikan, Laboratorium, dan manajemen; dan\n   2. pengadaan peralatan pendidikan, laboratorium, dan manajemen;\n c. pengembangan keahlian dan keilmuan dosen dan tenaga kependidikan;\n d. pengembangan program penyelenggaraan pendidikan tinggi yang dituangkan dalam \n   dokumen perencanaan ITS.\n(2) Pengelolaan manajemen sebagaimana dimaksud pada ayat (1) huruf a terdiri atas:\n a. operasional rutin perkantoran; dan\n b. kesejahteraan pegawai mengacu pada peraturan Rektor yang mengatur tentang \n   kepegawaian dan pengelolaan kinerja.\n(3) Besaran dan mekanisme penggunaan dana pendidikan mengacu pada dokumen \n perencanaan dan dokumen pedoman pengelolaan keuangan.', 'Pasal 4\n(1) Kewajiban membayar dana pendidikan berupa UKT dikenakan kepada:\n  a. Calon Mahasiswa Baru program sarjana dan sarjana terapan yang diterima dari \n   Jalur Seleksi Nasional; dan\n  b. Mahasiswa program sarjana dan sarjana terapan yang diterima dari Jalur Seleksi \n   Nasional.\n(2) Kewajiban membayar dana pendidikan berupa SPP dikenakan kepada:\n  a. Calon Mahasiswa Baru program sarjana dan sarjana terapan yang diterima dari \n   selain Jalur Seleksi Nasional;\n  b. Mahasiswa program sarjana dan sarjana terapan yang diterima dari selain Jalur  \n   Seleksi Nasional;\n  c. Ca1on Mahasiswa Baru program sarjana dan sarjana terapan yang diterima dari \n   Jalur seleksi nasional program joint degree/ double degree-,\n  d. Mahasiswa program sarjana dan sarjana terapan yang diterima dari Jalur Seleksi \n   Nasional program joint degree/ double degree-,\n  e. Calon Mahasiswa Baru program pascasarjana dan pascasarjana terapan; dan', 'â€¢ Jika uang kuliah tunggal (UKT) saya lebih rendah dari Rp 2.400.000, maka bantuan UKT dari program ini akan dibayarkan\nsesuai biaya.\nâ€¢ Jika saya tidak berhasil menyelesaikan program, maka saya bersedia untuk tidak menerima bantuan potongan UKT.\nâ€¢ Untuk memastikan kebenaran data dan menyetujui semua ketentuan yang berlaku pada pendaftaran program Pertukaran\n17']","Dana pendidikan di ITS digunakan untuk beberapa hal, yaitu:
1. Penyelenggaraan kegiatan tridharma perguruan tinggi dan pengelolaan manajemen.
2. Pengadaan sarana dan prasarana penyelenggaraan tridharma perguruan tinggi dan manajemen, termasuk pembangunan gedung pendidikan, laboratorium, dan manajemen, serta pengadaan peralatan pendidikan, laboratorium, dan manajemen.
3. Pengembangan keahlian dan keilmuan dosen dan tenaga kependidikan.
4. Pengembangan program penyelenggaraan pendidikan tinggi yang dituangkan dalam dokumen perencanaan ITS.

Selain itu, dana pendidikan juga digunakan untuk pengelolaan manajemen yang meliputi operasional rutin perkantoran dan kesejahteraan pegawai sesuai dengan peraturan Rektor yang mengatur tentang kepegawaian dan pengelolaan kinerja. Besaran dan mekanisme penggunaan dana pendidikan mengacu pada dokumen perencanaan dan dokumen pedoman pengelolaan keuangan."
2,Apa tujuan dibuat SKEM?,"1. Menanamkan sikap ilmiah, merangsang daya kreasi dan inovasi, meningkatkan kemampuan meneliti, menulis karya ilmiah, meningkatkan kemampuan berkomunikasi, serta pemahaman profesi. 2. Meningkatkan kesehatan / kebugaran, prestasi dan apresiasi budaya melalui penyaluran minat dan bakat dalam bidang seni dan olah raga. 3. Meningkatkan kemampuan mahasiswa dalam kerjasama (team work), komunikasi, ketrampilan manajemen, berorganisasi dan kepemimpinan. 4. Meningkatkan pengabdian kepada masyarakat, rasa kepedulian terhadap sesama, serta menanamkan rasa cinta tanah air.","['Konsep Satuan Kredit Ekstrakurikuler Mahasiswa\nDirektorat Kemahasiswaan \nEdisi Revisi (24 Agustus 2021)\n\nTujuan Dibuat SKEM\n1. Menanamkan sikap ilmiah, merangsang daya kreasi dan inovasi, meningkatkan\nkemampuan meneliti, menulis karya ilmiah, meningkatkan kemampuan berkomunikasi,\nserta pemahaman profesi.\n2. Meningkatkan kesehatan / kebugaran, prestasi dan apresiasi budaya melalui penyaluran\nminat dan bakat dalam bidang seni dan olah raga.\n3. Meningkatkan kemampuan mahasiswa dalam kerjasama (team work), komunikasi,\nketrampilan manajemen, berorganisasi dan kepemimpinan.\n4. Meningkatkan pengabdian kepada masyarakat, rasa kepedulian terhadap sesama, serta\nmenanamkan rasa cinta tanah air.', 'Prinsip Pokok SKEM\nBagi Mahasiswa, sistem baru SKEM ITS 2021 mendorong mahasiswa untuk merencanakan,\nmelakukan, dan mengadministrasikan kegiatan ekstrakurikuler secara berkala setiap semester.\nDengan ini mahasiswa bisa melakukan evaluasi sendiri Soft skills apa yang perlu mahasiswa\nkembangkan selama perkuliahan. Selain itu dokumen yang diunggah dalam system dapat digunakan\nsebagai CV dan SKPI (Surat Keterangan Pendamping Ijasah)\nBagi Dosen Wali, sistem baru SKEM ITS 2021 ini membantu mengidentifikasikan potensi dan\nkendala anak wali dalam pengembangan Soft skillsnya.\nSelain itu Dosen Wali dimudahkan dalam mengevaluasi dan verifikasi secara bertahap/setiap\nsemester. Hal ini akan menghilangkan menumpukkan pekerjaan verifikasi kegiatan ekstrakurikuler\nMahasiswa menjelang Yudisium.\nBagi Departemen, sistem baru SKEM ITS 2021 ini membantu Departemen untuk mendapatkan\ndata pemetaaan profile mahasiswa guna pengembangan Soft skills mahasiswa di Departemen dan', 'Kredit SKEM\n4 Bagian:\n\n1. Kompetisi, wirausaha, dan magang Ng\n\n2. Organisasi kepemimpinan & minat bakat Xx\n\n3. Pengabdian masyarakat\n\n4. Internasinalisasi, Summit dan Rekognisi\n\n) Total Kredit SKEM\n\nNOTES:\n\nIl. Khusus kegiatan LKMM tidak memerlukan bobot sebagai faktor pengkali sehingga\nlangsung kepada nilai SKEM dibagi dengan jumlah nilai SKEM untuk mendapatkan IP\nSKEM.\n\n2 Penilaian IP SKEM harus minimal menyertakan dua katagori kecuali Magang dan\nWirausaha sebagai owner atau direktur utama.\n\n3. Dalam satu semester IP Skem harus minimal 2.1 agar bisa dinyatakan lulus.\n\n4 Skem dengan formula baru ini hanya berlaku pada mahasiswa Angkatan 2018 keatas,\nsedangkan untuk mahasiswa Angkatan 2017 kebawah masih berlaku SKEM lama.\n\n5. Bagi mahasiswa dengan keterbatasan tertentu sehingga tidak memungkinkan untuk\nmengikuti SKEM baru, TIM Ditmawa akan membentuk tim review internal dengan\nmelibatkan TKK Departemen.', 'Hal-Hal Teknis Pokok SKEM\nâ€¢ Mahasiswa wajib melakukan Upload kegiatannya dengan batas waktu 1 tahun. Jika dalam\nmasa 1 tahun kegiatan tersebut belum di Upload ke sistem maka kegiatan tersebut dinyatakan\nhangus/tidak bisa digunakan dalam SKEM.\nâ€¢ Kegiatan yang sudah di Upload di system dapat dipakai untuk pengajuan SKEM di semester\nberikutnya.\nâ€¢ Dalam pengajuan SKEM, mahasiswa dapat memilih beberapa kegiatan yang sudah ter-\nUpload untuk diajukan sebagai SKEM. Jika ada kegiatan yang berlebih maka kegiatan lebih\ntersebut dapat dipakai untuk SKEM di semester yang lain.\nâ€¢ Kegiatan yang dilakuakan sebelum menjadi mahasiswa ITS tidak diakui sebagai kegiatan\nyang dapat diajukan untuk SKEM.\nâ€¢ Batas minimal kewajiban pemenuhan SKEM adalah sampai semester 6. Jika mahasiswa\nsudah memiliki kredit SKEM diatas 100 dan IPK min 2,1 pada semester 6, maka pada\nsemester 7 dan 8 sudah tidak wajib memenuhi syarat SKEM.']","Tujuan dibuat SKEM adalah untuk menanamkan sikap ilmiah, merangsang daya kreasi dan inovasi, meningkatkan kemampuan meneliti, menulis karya ilmiah, meningkatkan kemampuan berkomunikasi, serta pemahaman profesi. Selain itu, SKEM juga bertujuan untuk meningkatkan kesehatan/kebugaran, prestasi, dan apresiasi budaya melalui penyaluran minat dan bakat dalam bidang seni dan olahraga, meningkatkan kemampuan mahasiswa dalam kerjasama (team work), komunikasi, ketrampilan manajemen, berorganisasi, dan kepemimpinan, serta meningkatkan pengabdian kepada masyarakat, rasa kepedulian terhadap sesama, serta menanamkan rasa cinta tanah air."
3,Apa itu Beasiswa Prioritas?,"Beasiswa Prioritas merupakan program beasiswa yang memberikan kesempatan kepada pendaftar untuk dapat melakukan pendaftaran pada dua program sekaligus, yaitu pada program Beasiswa Kemitraan/Kerja Sama LPDP dan pada salah satu program Beasiswa Afirmasi/Beasiswa Targeted/Beasiswa Umum tujuan luar negeri.","['Siapakah Sasaran Beasiswa Prioritas\nLPDP â€“ Campus France Program Master?\n1. Warga Negara Indonesia (WNI)\n2. PNS/TNI/POLRI\nSeperti Apa Skema Prioritas LPDP â€“\nCampus France Program Master?\nPendaftar wajib mendaftar secara bersamaan\npada beasiswa Kemitraan LPDP â€“ Campus France\nProgram Master dan salah satu program Magister\nbeasiswa Afirmasi/Targeted/Umum tujuan luar\nnegeri, dengan skema berikut.\n1. Beasiswa Kemitraan LPDP â€“ Campus France\nProgram Master:\na. Beasiswa LPDP â€“ Campus France\nProgram Master diperuntukkan bagi\nWarga Negara Indonesia untuk dapat\nmenempuh pendidikan pada program\nmagister di program studi dan universitas\nsebagaimana daftar terlampir dengan\ndurasi pendanaan paling lama 24 (dua\npuluh empat) bulan.\nb. Pendaftar diharuskan untuk melakukan\npendaftaran pada:\nâ— Perguruan Tinggi Tujuan Studi\nsesuai jadwal dan ketentuan yang\nberlaku di Perguruan Tinggi, dan\nâ— Campus France sesuai jadwal dan\nketentuan yang berlaku di Campus\nFrance.\n2. Persyaratan dan dokumen pada Beasiswa', 'Panduan Pendaftaran\nBeasiswa Prioritas\nLPDP - Campus France\nProgram Master\nTahun 2024\nlpdp.kemenkeu.go.id', 'Dipublikasikan tanggal 11 Januari 2024\nTentang LPDP\nLPDP berkomitmen untuk mempersiapkan\npemimpin dan profesional masa depan serta\nmendorong inovasi demi terwujudnya Indonesia\nyang sejahtera, demokratis, dan berkeadilan.\nLPDP menyelenggarakan program beasiswa\nmagister/doktor serta beasiswa dokter spesialis,\ndokter subspesialis dan Fellowship untuk putra-\nputri terbaik Indonesia.\nApa itu Beasiswa Prioritas?\nBeasiswa Prioritas merupakan program beasiswa\nyang memberikan kesempatan kepada pendaftar\nuntuk dapat melakukan pendaftaran pada dua\nprogram sekaligus, yaitu pada program Beasiswa\nKemitraan/Kerja Sama LPDP dan pada salah satu\nprogram Beasiswa Afirmasi/Beasiswa\nTargeted/Beasiswa Umum tujuan luar negeri.\nApa itu Beasiswa Prioritas LPDP â€“ Campus\nFrance Program Master?\nBeasiswa Prioritas LPDP â€“ Campus France\nProgram Master memberikan kesempatan bagi\npendaftar untuk dapat melakukan pendaftaran\npada Beasiswa Kemitraan LPDP â€“ Campus\nFrance dan beasiswa Magister Luar Negeri', 'Dipublikasikan tanggal 11 Januari 2024\nprogram beasiswa lain yang dipilih, sesuai\ndengan syarat dan ketentuan yang berlaku.\nApa saja komponen Dana yang diberikan?\n1. Dana Pendidikan\na. Tuition Fee\nb. Dana Pendaftaran\nc. Dana Tunjangan Buku\nd. Dana Penelitian Tesis\ne. Dana Seminar Internasional\nf. Dana Publikasi Jurnal Internasional\n2. Dana Pendukung\na. Dana Transportasi\nb. Dana Aplikasi Visa\nc. Dana Asuransi Kesehatan\nd. Dana Kedatangan\ne. Dana Hidup Bulanan\nf. Dana Lomba Internasional\ng. Dana keadaaan darurat (jika diperlukan)\nApa saja persyaratan umum pendaftaran\nBeasiswa Prioritas LPDP â€“ Campus\nFrance Program Master?\nPersyaratan umum Beasiswa Prioritas LPDP â€“\nCampus France Program Master adalah sebagai\nberikut:\n1. Warga Negara Indonesia.\n2. Telah menyelesaikan studi program diploma\nempat (D4) atau sarjana (S1).\n3. Pendaftar yang telah menyelesaikan studi\nmagister (S2) tidak diizinkan mendaftar.\n4. Bagi pendaftar lulusan perguruan tinggi luar']","Beasiswa Prioritas merupakan program beasiswa yang memberikan kesempatan kepada pendaftar untuk dapat melakukan pendaftaran pada dua program sekaligus, yaitu pada program Beasiswa Kemitraan/Kerja Sama LPDP dan pada salah satu program Beasiswa Afirmasi/Beasiswa Targeted/Beasiswa Umum tujuan luar negeri."
4,Apa saja Jenis Program Magang Kampus Merdeka di ITS,"MBKM: Program dari Kementerian Pendidkan, Kebudayaan, Riset dan Teknologi dalam bentuk pembelajaran di luar Kampus selama 2 semester, dan bisa/wajib dikonversikan ke SKS
Mata Kuliah. Non-MBKM: Program Magang dikonversikan ke SKEM atau hanya untuk menambah pengalaman mahasiswa.","['Subdit. PK2\nJenis Program Magang Kampus Merdeka di ITS\nâ€¢ MBKM [ Program dari Kementerian Pendidkan,\nKebudayaan, Riset dan Teknologi dalam bentuk pembelajaran di luar Kampus selama 2 semester, dan bisa/wajib dikonversikan ke SKS\nMata Kuliah. *\nâ€¢ Non-MBKM [ Program Magang dikonversikan ke SKEM atau hanya untuk menambah pengalaman mahasiswa. *\n)* syarat dan ketentuan berlaku.\nADVANCING HUMANITY\niTS\nProgram Magang Flagship (Kampus Merdeka)\nâ€¢ MSIB (Magang dan Studi Independen Bersertifikat)\nâ€¢ Bangkit (by Google, GoTo, and Traveloka)\nâ€¢ Gerilya ( by Kementerian ESDM )\nProgram Magang Reguler\nâ€¢ Magang Kerjasama\nâ€¢ Magang Mandiri\nProgram Magang Lokal\nMagang Institut', 'juga dapat memanfaatkan Program Holistik Pembinaan dan Pemberdayaan Desa \n(PHP2D) dengan mengikuti prosedur dari Direktorat Belmawa.\n27       Buku Panduan Merdeka Belajar - Kampus Merdeka\nContoh Model KKNT Pembangunan dan Pemberdayaan bersama Kemendes\nContoh Model KKNT Pembangunan dan Pemberdayaan bersama Mitra\nBuku Panduan Merdeka Belajar - Kampus Merdeka       28\n3) Model KKNT Mengajar di Desa\nPelaksanaan kegiatan ini diutamakan pada mahasiswa program studi Pendidikan. \nBagi mahasiswa di luar program studi Pendidikan dapat melakukan kegiatan \nmengajar sesuai dengan bidang keahlian dalam rangka pemberdayaan \nmasyarakat misalnya penerapan teknologi tepat guna. Semua kegiatan KKNT \nmengajar ini bersifat membantu pengajaran formal dan non-formal. Bila di akhir \nkegiatan ini akan dijadikan sebagai tugas akhir, maka harus direncanakan sejak \nawal dalam bentuk proposal yang mengacu pada aturan prodi.\nContoh Model KKNT Mengajar di Desa\n4) Model KKNT Free Form', 'Mengambil beberapa MK (perkuliahan secara online)\nPenguatan Program Magang di ITS\n\nPerubahan SOTK â†’ Unit Pengelolaan Magang Industri (Direktorat Kemahasiswaan)\nPenambahan kuliah wajib MK Magang â†’ Fakultas Vokasi\nJenis Program Magang di ITS\n\nBerdasarkan Mitra Magang: BUMN, Non-BUMN, ITS, UKM/Kewirausahaan\nBerdasarkan Jalur Magang: PMMB, Non-PMMB, Mandiri, Kerjasama\nPENGHARGAAN FHCI UNTUK ITS\nITS sebagai kontributor terbaik PMMB 2019 bersama UGM dan Politeknik Negeri Ujung Pandang.\n\nKuliah Kerja Nyata (KKN)\nKegiatan KKN sebagai metode pembelajaran dan sarana pengabdian kepada masyarakat dengan tujuan:', 'Sosialisasi Program\nMagang ITS dan\nProgram MSIB Batch 6\n2023\nSubdirektorat Pengembangan Kewirausahaan dan Karir\nDirektorat Kemahasiswaan\nInstitut Teknologi Sepuluh Nopember\nSubdit. PK2\nKementerian Pendidikan, Kebudayaan, Riset, dan Teknologi.\nuntuk Fakultas/Prodi\n\nPENDAHULUAN\nTABLE OF\nCONTENT\nALUR VERIFIKASI MAHASISWA OLEH\nPENANGGUNG JAWAB FAKULTAS/PRODI\nSOP PELAKSANAAN PROGRAM\nMAGANG\nSTATISTIK PESERTA MSIB 4 & 5, DAN\nMONITORING PELAPORAN SIM\nMAGANG\nPENUGASAN PENANGGUNG JAWAB\nFAKULTAS/PRODI\nDIGITALISASI SPTJM DAN SR\nOVERVIEW MSIB 6\n\nWebsite Resmi ITS Career Center (Subdit. PK2 ITS)\nSubdit. PK2\nhttps://www.its.ac.id/careers/id/magang']","Program Magang Kampus Merdeka di ITS terdiri dari beberapa jenis, yaitu:
1. MBKM (Program dari Kementerian Pendidikan, Kebudayaan, Riset dan Teknologi dalam bentuk pembelajaran di luar Kampus selama 2 semester, dan bisa/wajib dikonversikan ke SKS Mata Kuliah).
2. Non-MBKM (Program Magang dikonversikan ke SKEM atau hanya untuk menambah pengalaman mahasiswa).
3. Program Magang Flagship, antara lain:
   - MSIB (Magang dan Studi Independen Bersertifikat)
   - Bangkit (by Google, GoTo, and Traveloka)
   - Gerilya (by Kementerian ESDM)
4. Program Magang Reguler, antara lain:
   - Magang Kerjasama
   - Magang Mandiri
5. Program Magang Lokal, yaitu Magang Institut."
5,Apa syarat Foto formal calon wisudawan ITS?,"Mempunyai kualitas STUDIO FOTO dengan ekstensi file: .jpg atau .jpeg Berlatar belakang biru dengan komposisi warna (C: 100 M: 040 Y: 001 K: 001) atau (R: 000 G: 120 B: 193) Mempunyai ukuran proporsional separuh badan Menghadap lurus kedepan Tidak menggunakan kacamata Menampakkan bagian wajah dengan jelas Memakai jas warna gelap, kemeja putih, dan berdasi hitam (Pria/Wanita) Khusus bagi wanita yang berhijab warna hijab menyesuaikan dan tidak berdasi","['Menampakkan bagian wajah dengan jelas\nMemakai jas warna gelap, kemeja putih, dan berdasi hitam (Pria/Wanita)\nKhusus bagi wanita yang berhijab warna hijab menyesuaikan dan tidak berdasi\n3. Data yang dipergunakan sebagai dasar pencetakan ijazah (Nama, Tempat Lahir, Tanggal Lahir, NIK) adalah data yang ada pada KTP/Akta kelahiran;\n4. Penulisan data di ijazah ITS menggunakan aturan Proper Case;\n5. Jika ada ketidaksesuaian penulisan nama dan/atau tempat lahir pada preview ijazah dengan data\nyang dimasukkan, mohon cetak preview ijazahnya kemudian diserahkan ke kantor Direktorat\nPendidikan disertai dokumen pendukung;\n6. Apabila memerlukan informasi lebih lanjut dapat menghubungi dirpendikcare@its.ac.id atau di\ncall centre pada hari dan jam kerja melalui no (WA Text Only) 085186819604, 085186819605.', 'Syarat dokumen mengikuti syarat program\nbeasiswa yang dipilih (mengacu pada Buku\nPanduan masing-masing program beasiswa).\nSeperti apa format Komitmen kembali ke\nIndonesia, rencana pasca studi, dan\nrencana kontribusi di Indonesia serta\nRencana Bisnis atau Rencana\nPengembangan Bisnis?\nKomitmen kembali ke Indonesia, rencana\npasca studi, dan rencana kontribusi di\nIndonesia (1500 â€“ 2000 kata)\nDeskripsikan dalam tulisan secara jelas dan\nkonkret tentang tema di atas.', 'A. Semua calon Wisudawan ITS ke-129 periode wisuda April 2024 wajib mengisi biodata di menu update wisudawan sampai dengan tanggal 9 Februari 2024, dengan ketentuan sebagai berikut:\n1. Mempersiapkan dokumen yang akan diunggah antara lain: Ijazah terakhir, KTP, foto formal terbaru berwarna untuk ijazah, dan Akte Kelahiran (apabila diperlukan);\n2. Foto formal terbaru berwarna yang diunggah mempunyai ketentuan:\nMempunyai kualitas STUDIO FOTO dengan ekstensi file: .jpg atau .jpeg\nBerlatar belakang biru dengan komposisi warna (C: 100 M: 040 Y: 001 K: 001) atau (R: 000 G: 120 B: 193)\nMempunyai ukuran proporsional separuh badan\nMenghadap lurus kedepan\nTidak menggunakan kacamata\nMenampakkan bagian wajah dengan jelas\nMemakai jas warna gelap, kemeja putih, dan berdasi hitam (Pria/Wanita)\nKhusus bagi wanita yang berhijab warna hijab menyesuaikan dan tidak berdasi', 'Bagian Kedua\nSyarat Prestasi Lomba Mandiri\n\nPasal 5\n(1) Syarat untuk Mahasiswa:\na. Mahasiswa aktif yang terdaftar di sistem akademik ITS;\nb. memiliki surat tugas dari direktorat yang mengurusi kemahasiswaan/dekan untuk mengikuti kompetisi tersebut; dan\nc. Mahasiswa yang mendapatkan Apresiasi adalah juara 1, juara 2, juara 3,\ndan Finalis pada kegiatan kompetisi dan kewirausahaan yang melibatkan ilmu pengetahuan, teknologi, olahraga dan seni yang diadakan oleh Kementerian atau Lomba Mandiri bereputasi dengan skala nasional ataupun internasional dibuktikan dengan sertifikat.\n(2) Syarat untuk Pembimbing:\na. dosen aktifyang ada di ITS;\nb. dosen yang mempunyai Surat Keputusan Rektor sebagai Pembimbing kegiatan kompetisi kemahasiswaan; dan\nc. telah        melakukan        verifikasi        prestasi        anak        bimbingnya        di        myITS\nStudentConnect.\n\nBagian Ketiga Tingkat Prestasi']","Syarat Foto formal calon wisudawan ITS adalah sebagai berikut:
1. Mempunyai kualitas STUDIO FOTO dengan ekstensi file: .jpg atau .jpeg
2. Berlatar belakang biru dengan komposisi warna (C: 100 M: 040 Y: 001 K: 001) atau (R: 000 G: 120 B: 193)
3. Mempunyai ukuran proporsional separuh badan
4. Menghadap lurus kedepan
5. Tidak menggunakan kacamata
6. Menampakkan bagian wajah dengan jelas
7. Memakai jas warna gelap, kemeja putih, dan berdasi hitam (Pria/Wanita)
8. Khusus bagi wanita yang berhijab warna hijab menyesuaikan dan tidak berdasi

Itulah syarat-syarat yang harus dipenuhi untuk Foto formal calon wisudawan ITS."
6,Apakah mata kuliah pengayaan bisa di-drop?,"Seperti halnya MK yang lain, jika masih dalam masa drop tiap semester, maka boleh (sampai dengan minggu 10). Setelah waktu itu tidak bisa, namun bisa digantikan dengan MK pengayaan lain yang diambil di semester berikutnya.","['Q: Berapa sks mata kuliah pengayaan yang bisa diambil?\n\nA: Di peraturan akademik mengambil MK pengayaan maksimal 6 sks dan minimum 3 sks.\n\nQ: Apakah mata kuliah pengayaan bisa di-drop?\n\nA: Seperti halnya MK yang lain, jika masih dalam masa drop tiap semester, maka boleh (sampai dengan minggu 10). Setelah waktu itu tidak bisa, namun bisa digantikan dengan MK pengayaan lain yang diambil di semester berikutnya.\n\nQ: Kepada siapa saya meminta konsultasi tentang perwalian/perencanaan kuliah, merubah MK yang diambil dan drop MK setelah minggu ke 4?\n\nA: Ke DOSEN WALI, bukan ke PEMBIMBING TA. Batas akhir perubahan MK adalah minggu ke 3 dan drop MK adalah minggu ke 10\n\nQ: Bagaimana jika saya tidak bisa ambil MK di FRS padahal prasyarat sudah terpenuhi? \n\nA: Silakan menginformasikan ke doswal dengan menyertakan bukti2. Doswal akan membantu menambahkan MK yang dimaksud jika bukti2 telah mencukupi.\n\nQ: Apakah MK yang diambil via dropdown MBKM bisa menggantikan MK yang sudah diambil?', '(1) (2) (3) \nDalam hal mahasiswa mendapatkan nilai mata kuliah pengayaan kurang dari C, maka \nmahasiswa dapat menggantinya dengan mata kuliah pengayaan yang berbeda.  \nV STANDAR DOSEN DAN TENDIK  \n12 Standar dosen dan Tendik  (i) Dosen wali ditugaskan oleh Prodi untuk membuat perencanaan bersama dengan \nmahasiswa yang akan melaksanakan kegatan MBKM  \n(ii) Dosen wali ditugaskan oleh Prodi untuk melakukan evaluasi terhadap kesesuaian \nbentuk dan lama pelaksanaan MBKM sesuai dengan CPL  \n(iii) Dosen wali di tugaskan oleh Prodi untuk melakukan penilaian atas rencana, \npelaksanaan dan evaluasi MBKM  \n(iv) Dosen pembimbing MBKM ditugaskan oleh Prodi sesuai dengan pengampu MK \nkonversi dan atau dosen wali  \n(v) Tendik Prodi ditugaskan untuk melayani administrasi dalam implement asi MBKM, \nmulai dari perencanaan, pelaksanaan, moneitoring dan evaluasi, serta pelaporan \nMBKM.  \n \nVI STANDAR PENGELOLAAN PEMBELAJARAN', 'Teknologi Subdit. PK2 \n5\n5. Anda dapat mencentang kotak â€œJangan tampilkan ini lagiâ€ , sehingga untuk penyimpanan berikutnya tidak akan  \nmuncul notifikasi seperti di atas. \n6. Jika penugasan Penanggung Jawab Fakultas/Prodi sudah sesuai, klik â€œYa, Simpanâ€ \n7. Jika penyimpanan email Penanggung Jawab Fakultas/Prodi berhasil akan muncul pemberitahuan dengan kotak  \nberwarna hijau. \n8. Jika Anda ingin mengubah email Penanggung Jawab Fakultas/Prodi yang telah tersimpan, silakan klik â€œUbahâ€ \n6\n7PENUGASAN PENANGGUNG JAWAB FAKULTAS/PRODI \n8\nKementerian Pendidikan, Kebudayaan, Riset, dan \nTeknologi Kementerian Pendidikan, Kebudayaan, Riset dan \nTeknologi Subdit. PK2 \n18. Penanggung Jawab Fakultas/Prodi  \nAnda akan menerima email notifikasi  \npenugasan verifikasi data akademik  \nmahasiswa untuk prodi tersebut untuk  \nprogram Kampus Merdeka. Klik  \nâ€œVerifikasi Sekarangâ€. \n9. Contoh email notifikasi penugasan  \njika belum ada mahasiswa yang  \nterdaftar \nMohon cek folder Spam jika email', 'â€¢ Keputusan penolakan bersifat final dan tidak dapat diubah kembali.\nâ€¢ Dengan menolak mahasiswa, maka seluruh lamaran mahasiswa ke program Kampus Merdeka akan langsung dinyatakan gagal.\n(2/2) Tolak Mahasiswa\n1 â€¢ Kebutusan penolakan bersifat fnal dan tidak danat diubah kembali\nâ€¢ Dengan menolak mahasiswa, maka seluruh lamaran mahasiswa ke program Kampus\nMerdeka akan langsung dinyatakan gagal.\nApakah Anda telah memahami konsekuensi di atas?\nSava memahami konsekuensi vana ditimbulkan serta keputusan ini diambil secara sadar dan I tanpa paksaan.\nLakukan ceklis pada kolom yang tersedia dan klik ""Ya, Tolak"".\n2\nKemball\nYa, Tolak\n8 Kementerian Pendidikan, Kebudayaan, Riset dan\nTeknologi']","Ya, mata kuliah pengayaan bisa di-drop seperti halnya mata kuliah lainnya. Namun, proses drop mata kuliah harus dilakukan dalam masa drop tiap semester, yaitu sampai dengan minggu ke-10. Setelah melewati waktu tersebut, mata kuliah tidak bisa di-drop. Namun, jika memang perlu di-drop, maka bisa digantikan dengan mata kuliah pengayaan lain yang diambil di semester berikutnya. Jadi, pastikan untuk melakukan proses drop mata kuliah sebelum melewati batas waktu yang telah ditentukan."
7,"MyITS saya bermasalah, bisa lapor kemana?",Silakan ajukan tiket ke DPTSI di https://servicedesk.its.ac.id/,"['Q: MyITS saya bermasalah, bisa lapor kemana?\n\nA: Silakan ajukan tiket ke DPTSI di https://servicedesk.its.ac.id/\n\nQ: Saya ingin mengurus â€œâ€¦..â€ siapa tendik yang harus ditemui?\n\nA: Temui tendik sesuai bidangnya yuk! :)\n\nPersuratan (S1) â†’ Pak Sugeng\nAkademik (S1) â†’ Bu Inka (Kelas, Nilai, MBKM, International Exposure), Bu Icha (Asisten Dosen, MonKP)\nAkademik + Persuratan (S2) â†’ Bu Kartika\nAkademik + Persuratan (S3) â†’ Bu Lina\nPeminjaman Ruang â†’ Pak Husein (Kasubbag)\nKeuangan â†’ Bu Devi, Bu Due\nUrusan Ruang Aula â†’ Pak Jumali\nUrusan Ruang Kelas â†’ Pak Edy\nUrusan Laboratorium â†’ Teknisi Lab. Pak Junaidi (PKT, KCV, LP), Pak Jumali (KBJ, RPL), Pak Gayuh (AP, MCI, GiGA), Pak Kunto (AJK).\nUrusan Keamanan dan Kebersihan â†’ Pak Sukron\nUrusan Kelistrikan â†’ Pak Hari\nQ: Cara mendapatkan transkrip\n\nA: Buka SIM Akademik, masuk ke menu LAPORAN -> TRANSKRIP\n\nQ: Cara mendapatkan surat keterangan aktif mahasiswa\n\nA: Buka SIM Akademik, masuk ke menu SURAT MAHASISWA -> LAYANAN SURAT MAHASISWA', 'Bersama dengan ini saya sertakan dokumen revisi TA saya dengan poin sebagai berikut:\n- perbaikan ....\nMohon berkenan memeriksa dan menginformasikan jika ada yang perlu saya perbaiki.\n\nDemikian, terima kasih\nAgus\n0511000..â€¦\n\nQ: Bagaimana mendapatkan surat keterangan yang tidak ada di menu integra, contoh surat keterangan selesai TA dan lulus >=144 SKS?\n\nA: kirim ke WA Pak Sugeng +62 856-4843-2445\n------------------------------------------------------------------------------\nKepada Yth\nBapak Ary Mazharuddin Shiddiqi\ndi tempat\n\nDengan hormat,\nDengan surat ini saya,\n\nNama: \nNRP: \nTempat/Tgl lahir: \nAlamat sekarang: \nSKS Lulus:\nemail aktif:\nNo HP aktif:\n\nBermaksud untuk mengajukan permohonan kepada Bapak Ary guna memperoleh Surat Keterangan Selesai Tugas Akhir.\n\nDemikian surat ini saya ajukan dan atas terkabulnya permohonan ini, saya ucapkan terimakasih\n\nSurabaya, .â€¦', '6. Apabila memerlukan informasi lebih lanjut dapat menghubungi dirpendikcare@its.ac.id atau di\ncall centre pada hari dan jam kerja melalui no (WA Text Only) 085186819604, 085186819605.\nB. Bagi semua calon wisudawan (Sarjana dan Sarjana Terapan) wajib menghadap dosen wali untuk persetujuan SKEM, serta wajib melakukan pengajuan SKPI di studentconnect paling lambat tanggal 9 Februari 2024;\nC. Ijazah dicetak berdasarkan data preview yang dipermanen oleh calon wisudawan. Ijazah dicetak hanya sekali saja, bila ada kekeliruan pengisian data pada point 3 maka akan diterbitkan surat keterangan.\nD.Pelaksanaan wisuda akan dilaksanakan secara offline (Informasi mengenai gladi bersih disampaikan lebih lanjut.\n Atas perhatian dan kerjasama yang diberikan, kami sampaikan terima kasih.\n Powered by TCPDF (www.tcpdf.org)\nTembusan Yth :\n1. Rektor ITS\n2. Kepala Bagian Administrasi Umum dan Kearsipan Digital 3. Sekretaris Institut\nSurabaya, 09 Januari 2024\nWakil Rektor Bidang Akademik dan Kemahasiswaan,', '7.2\nKETENTUAN UMUM DALAM PENULISAN\nLAPORAN MAGANG\nâ€¢ Laporan Magang ditulis dan dipresentasikan pada akhir magang (jika diperlukan).\nâ€¢ Laporan Magang selain diserahkan ke departemen dan mitra magang, juga diserahkan ke Subdirektorat PK2 Direktorat Kemahasiswaan dalam bentuk softcopy melalui SIM Magang.\n7.3\nPRINSIP PENULISAN LAPORAN\nMAGANG\nâ€¢ BENAR DAN OBYEKTIF\nLaporan magang harus sesuai dengan ketentuan yang ada dalam pedoman ini serta memuat informasi yang benar dan obyektif.\nâ€¢ JELAS DAN CERMAT\nLaporan magang harus mudah dimengerti / dipahami oleh pembaca, dengan cara menghindari pemakaian kata / istilah, rangkaian kata / kalimat atau gaya bahasa yang kurang dapat dipahami oleh pembaca maupun penulisnya sendiri. Gunakan kata-kata yang sederhana tetapi jelas maksudnya.\nâ€¢ LANGSUNG KE SASARAN']",Anda dapat melaporkan masalah MyITS Anda dengan mengajukan tiket ke DPTSI di https://servicedesk.its.ac.id/
8,Berapa koordinat latitude langitude ITS Surabaya?,Tidak tahu,"['KEMENTERIAN PENDIDIKAN, KEBUDAYAAN,\n                          RISET, DAN TEKNOLOGI\n                 INSTITUT TEKNOLOGI SEPULUH NOPEMBER\n                             Kampus ITS Sukolilo â€“ Surabaya 60111\n                      Telepon : 031-5994251-54, 5947274, 5945472 (Hunting)\n                                    Fax: 031-5947264, 5950806\n                                        http://www.its.ac.id\n\n\n PERATURAN REKTOR INSTITUT TEKNOLOGI SEPULUH NOPEMBER\n                         NOMOR 23 TAHUN 2021\n\n\n                                    TENTANG\n\n\n   PERUBAHAN ATAS PERATURAN REKTOR INSTITUT TEKNOLOGI\nSEPULUH NOPEMBER NOMOR 12 TAHUN 2019 TENTANG BAKU MUTU\n    MAGANG PROGRAM STUDI SARJANA TERAPAN DAN SARJANA\n\n\n                DENGAN RAHMAT TUHAN YANG MAHA ESA\n\n\n       REKTOR INSTITUT TEKNOLOGI SEPULUH NOPEMBER,', 'KEMENTERIAN PENDIDIKAN, KEBUDAYAAN, \n                      RISET, DAN TEKNOLOGI \n             INSTITUT TEKNOLOGI SEPULUH NOPEMBER\n                     Kampus ITS Sukolilo - Surabaya 60111 \n                 Telepon : 031-5994251-54, 5947274, 5945472 (Hunting) \n                         Fax: 031-5947264, 5950806 \n                           http://wwwits.ac.id\n\n       PERATURAN REKTOR INSTITUT TEKNOLOGI SEPULUH NOPEMBER \n                     NOMOR 5 TAHUN 2023\n\n                          TENTANG\n\n        DANA PENDIDIKAN INSTITUT TEKNOLOGI SEPULUH NOPEMBER \n\n              DENGAN RAHMAT TUHAN YANG MAHA ESA\n\n           REKTOR INSTITUT TEKNOLOGI SEPULUH NOPEMBER,', 'C Kerat\n@ DASHBOARD E KEGIATAN MAHASISWA & PROFIL\nINDAH SYAHYA DINATA\nå‡¹\nPertukaran Mahasiswa Merdeka\nFORMULIR PENDAFTARAN\nPilih Penempatan & Mata Kuliah\nDalam Pertukaran Mahasiswa Merdeka (20 SKS), kamu bisa mengikuti perkuliahan luar jaringan di Perguruan Tinggi (PT) penerima dan dalam jaringan (maksimum 10 SKS) di beberapa PT mitra.\nUniversitas Luar Jaringan\n20 / 20 SKS\nPilihan Lokasi Pulau PT penerima\nPilihan lokasi putau harus di luar alamat KTP dan domisili PT asal. Preferensi mahasiswa akan dipertimbangkan namun keputusan panitia bersifat final dan tidak dapat digugat.\nPilih Lokasi Pulau 11\nãƒ­\nPilhan lokasi pulau narus di luar alamat KIP dan domisili PI asal. Preterensi manasiswa akan diperumbangkan namun keputusan panta bersitat unai dan toak dapat diguga\nSulawesi\nBali - NTT - NTB\nBerikut adalah contoh Pilihan pulau yang telah di-cluster sesuai\ndomisili pendaftar:\n14', 'KEMENTERIAN PENDIDIKAN, KEBUDAYAAN, RISET, DAN TEKNOLOGI\nINSTITUT TEKNOLOGI SEPULUH NOPEMBER\n       Kampus ITS Sukolilo - Surabaya 60111 Telepon : 031-5994251-54, 5947274, 5945472 (Hunting)\nFax: 031-5947264, 5950806\nhttp://www.its.ac.id\n\n\nPERATURAN REKTOR INSTITUT TEKNOWGI SEPULUH NOPEMBER NOMOR 7 TAHUN 2023\n\nTENTANG\n\nPEMBERIAN APRESIASI BAGI MAHASISWA BEPRESTASI\nDAN DOSEN PEMBIMBING DI BIDANG KOMPETISI KEMAHASISWAAN INSTITUT TEKNOWGI SEPULUH NOPEMBER']",Saya tidak tahu.
9,Bagaimana SKEM membantu Departemen di ITS?,SKEM membantu Departemen untuk mendapatkan data pemetaan profil mahasiswa guna pengembangan soft skills dan untuk keperluan akreditasi internasional.,"['Bagi Departemen, sistem baru SKEM ITS 2021 ini membantu Departemen untuk mendapatkan\ndata pemetaaan profile mahasiswa guna pengembangan Soft skills mahasiswa di Departemen dan\njuga berguna untuk Akreditasi Internasional Departemen.\nBagi ITS, sistem baru SKEM ITS 2021 ini akan menunjang ketersediaan data Kegiatan\nKemahasiswaan ITS secara terstruktur dan sistematis yang bisa digunakan sebagai basis data utama\nbagi pemeringkatan Bidang Kemahasiswan Nasional, pemeringkatan Internasional (THE/QS), dan akreditasi Internasional (ASIIN, AUNQA, IABEE).\nBagi Industri/Pengguna Lulusan ITS, sistem baru SKEM ITS 2021 membantu Industri/Pengguna\nLulusan ITS untuk mengetahui rekam jejak dibidang pengembangan Soft skills selama menjadi\nmahasiswa ITS. Sehingga Industri/Pengguna Lulusan ITS akan semakin menambah kepercayaan\ndalam merekrut lulusan ITS.\nHal-hal Teknis Pokok Dalam SKEM\nSistem SKEM ITS 2021 hanya berlaku bagi angkatan mahasiswa 2018 keatas.', 'Dosen & Tendik di Departemen Teknik Informatika ðŸ‘¥\nNama Dosen/Tendik,Kode Dosen,RMK,Email,NIP/NPP,Role Tendik,PIC Laboratorium\n""Prof. Ir. Supeno Djanali, M.Sc., Ph.D."",SD,AJK,supeno@its.ac.id,8859390019,,\n""Prof. Ir. Handayani Tjandrasa, M.Sc., Ph.D."",HT,KCV,handatj@its.ac.id,8866323419,,\n""Prof. Drs.Ec. Ir. Riyanarto Sarno, M.Sc., Ph.D."",RS,MCI,riyanarto@if.its.ac.id,19590803 198601 1 001,,\n""Prof. Dr. Ir. Joko Lianto Buliali, M.Sc."",JL,PKT,joko@if.its.ac.id,19670727 199203 1 002,,\n""Ir. Siti Rochimah, M.T., Ph.D."",ST,RPL,siti@if.its.ac.id,19681002 199403 2 001,,\n""Victor Hariadi, S.Si., M.Kom."",VH,PKT,victor@if.its.ac.id,19691228 199412 1 001,,\n""Rully Soelaiman, S.Kom., M.Kom."",RL,AP,rully@if.its.ac.id,19700213 199402 1 001,,\n""Dr. Yudhi Purwananto, S.Kom., M.Kom."",YP,AP,yudhi@if.its.ac.id,19700714 199703 1 002,,\n""Prof. Dr.Eng. Nanik Suciati, S.Kom., M.Kom."",NS,KCV,nanik@if.its.ac.id,19710428 199412 2 001,,', 'Subdit. PK2\nSKEMA PELAKSANAAN\nPROGRAM MAGANG\nMANDIRI DI ITS\nMahasiswa / Departemen melakukan\nmenyertakan:\n1. Proposal Magang\n2. Surat Rekomendasi Departemen\n3. Surat Penerimaan Magang\nPelaksanaan Magang\nProses pengurusan\nPKS\nPKS tidak\ndisetujui\nPKS\nTertandatangan\nSelesai\nMagang berakhir <\nMahasiswa mendapatkan\nSertifikat / Penilaian Magang\nSelesai\nADVANCING HUMANITY\niTS\nMulai\nMahasiswa mengurus\nsurat rekomendasi\ndepartemen untuk pengajuan magang ke\nMitra\nMahasiswa mengajukan\npermohonan magang ke\nMitra\nMitra melakukan seleksi magang\nMahasiswa menerima hasil seleksi magang dari Mitra\nTidak diterima\nSelesai\nDiterima\nMahasiswa melaporkan\nke Departemen', 'Subdit. PK2\nADVANCING\nHUMANITY\niTS\nSkema Pelaksanaan Program Magang Flagship\n12. Koordinator magang di Departemen memberikan verifikasi data mahasiswa serta menentukan\nDosen Pembimbing di Sim Magang;\n13. Mitra MSIB membuat jadwal sosialisasi dan konsolidasi dengan PT yang kemudian akan direkap oleh\nPK2 dan disebarkan ke Departemen;\n14. PK2, Departemen, dan Mitra berdiskusi terkait pelaksanaan program selama konsolidasi (Kurikulum\nMagang, dan seluruh informasi terkait);\n15. Mahasiswa melaksanakan kegiatan MSIB dan mengunggah logbook mingguan di website kampus\nmerdeka dan SIM Magang;\n16. PIC Departemen dan PK2 melakukan monitoring terhadap pengisian SIM Magang Mahasiswa;\n17. Mitra memberikan penilaian Magang terhadap mahasiswa;\n18. Mahasiswa membuat laporan akhir dan mengunggah kelengkapan berkas di website kampus\nmerdeka dan SIM Magang;\n19. Pihak Departemen melakukan verifikasi laporan akhir mahasiswa di SIM Magang;\n20. Proses Selesai.\n2023']","SKEM ITS 2021 membantu Departemen di ITS dengan memberikan data pemetaan profile mahasiswa guna pengembangan Soft skills mahasiswa di Departemen. Selain itu, SKEM juga berguna untuk Akreditasi Internasional Departemen. Dengan adanya SKEM, Departemen dapat memiliki data kegiatan kemahasiswaan secara terstruktur dan sistematis yang dapat digunakan sebagai basis data utama untuk pemeringkatan Bidang Kemahasiswaan Nasional, pemeringkatan Internasional (THE/QS), dan akreditasi Internasional (ASIIN, AUNQA, IABEE)."
10,Mengapa penting untuk mengunggah kegiatan mahasiswa di myITS StudentConnect? ,"Karena bukti atau dokumen pendukung kegiatan SKEM harus diunggah di myITS StudentConnect dalam waktu satu tahun semenjak selesai kegiatan, jika melebihi batas waktu tersebut, kegiatan dinyatakan tidak berlaku.","['jawab terhadap kegiatan mahasiswa dari awal sampai dengan akhir.\nb) Pembimbing pendamping   dari pemerintah desa di lokasi setempat.\nc) Melibatkan unsur-unsur mitra, misalnya Penggerak Swadaya Masyarakat \n(PSM) maupun unsur lain sesuai lingkup kegiatan.\nd) Dosen pendamping bersama pembimbing di desa melakukan pembimbingan \ndan   penilaian terhadap program yang dilakukan mahasiswa.  \ne) Ketentuan lain dapat diatur oleh perguruan tinggi pelaksana.25       Buku Panduan Merdeka Belajar - Kampus Merdeka\n4) Lokasi Pelaksanaan\na)  Lokasi berdasarkan rekomendasi dari Direktorat Jenderal Pendidikan Tinggi.\nb)  Lokasi pelaksanaan di desa sangat tertinggal, tertinggal dan berkembang.\nc)  Desa-desa Binaan Perguruan Tinggi Pelaksana.\nd)  Radius desa lokasi KKNT dengan Perguruan Tinggi dirancang 200 km.\ne) Desa lainnya yang diusulkan oleh Mitra (Pemda, Industri, dan lainnya.\n5) Mitra\na) Pemerintah (Kemendes, Desa binaan PT, Kemkes, PUPR, Kementan, Kemensos,', 'juga dapat memanfaatkan Program Holistik Pembinaan dan Pemberdayaan Desa \n(PHP2D) dengan mengikuti prosedur dari Direktorat Belmawa.\n27       Buku Panduan Merdeka Belajar - Kampus Merdeka\nContoh Model KKNT Pembangunan dan Pemberdayaan bersama Kemendes\nContoh Model KKNT Pembangunan dan Pemberdayaan bersama Mitra\nBuku Panduan Merdeka Belajar - Kampus Merdeka       28\n3) Model KKNT Mengajar di Desa\nPelaksanaan kegiatan ini diutamakan pada mahasiswa program studi Pendidikan. \nBagi mahasiswa di luar program studi Pendidikan dapat melakukan kegiatan \nmengajar sesuai dengan bidang keahlian dalam rangka pemberdayaan \nmasyarakat misalnya penerapan teknologi tepat guna. Semua kegiatan KKNT \nmengajar ini bersifat membantu pengajaran formal dan non-formal. Bila di akhir \nkegiatan ini akan dijadikan sebagai tugas akhir, maka harus direncanakan sejak \nawal dalam bentuk proposal yang mengacu pada aturan prodi.\nContoh Model KKNT Mengajar di Desa\n4) Model KKNT Free Form', 'Before\nAfter\nSubdit. PK2\nADVANCING HUMANITY\niTS\nAlur SR/SPTJM yang baru meningkatkan keterlibatan Perguruan Tinggi asal mahasiswa dalam proses pendaftaran dan rekomendasi mahasiswa dalam platform MBKM\nPendaftaran di Platform\nPengisian Data dan Upload Dokumen\nVerifikasi Mahasiswa (Seleksi Administrasi)\n2\nMahasiswa meminta tanda\nMahasiswa mendaftar\nke MSIB/KM di\ntangan basah Prodi dan Rektorat untuk SR/SPTJM\nplatform MBKM\ndan upload di platform\n3\n4\nMahasiswa mengisi\ndata dan upload dokumen diri di platform\nTim Program melakukan verifikasi data dan berkas mahasiswa, termasuk SR dan\nSPTJM, melalui platform\nla\nMahasiswa mendaftar\nke MSIB/KM di\nplatform MBKM\n1b\n2a\n2b\nÐ—Ð°\nMahasiswa mengisi data dan upload dokumen diri dan upload dokun di platform\n3b\nPerguruan Tinggi menunjuk Pimpinan\nPT dan mendaftar akun pada platform\nPimpinan PT mengunggah surat tugas dari PT dan spesimen tanda tangan yang akan diverifikasi oleh\nPPKM\nMahasiswa melakukan\npersetujuan terhadap poin-poin pertanggungjawaban', 'C Kerat\n@ DASHBOARD E KEGIATAN MAHASISWA & PROFIL\nINDAH SYAHYA DINATA\nå‡¹\nPertukaran Mahasiswa Merdeka\nFORMULIR PENDAFTARAN\nPilih Penempatan & Mata Kuliah\nDalam Pertukaran Mahasiswa Merdeka (20 SKS), kamu bisa mengikuti perkuliahan luar jaringan di Perguruan Tinggi (PT) penerima dan dalam jaringan (maksimum 10 SKS) di beberapa PT mitra.\nUniversitas Luar Jaringan\n20 / 20 SKS\nPilihan Lokasi Pulau PT penerima\nPilihan lokasi putau harus di luar alamat KTP dan domisili PT asal. Preferensi mahasiswa akan dipertimbangkan namun keputusan panitia bersifat final dan tidak dapat digugat.\nPilih Lokasi Pulau 11\nãƒ­\nPilhan lokasi pulau narus di luar alamat KIP dan domisili PI asal. Preterensi manasiswa akan diperumbangkan namun keputusan panta bersitat unai dan toak dapat diguga\nSulawesi\nBali - NTT - NTB\nBerikut adalah contoh Pilihan pulau yang telah di-cluster sesuai\ndomisili pendaftar:\n14']","Penting untuk mengunggah kegiatan mahasiswa di myITS StudentConnect karena platform tersebut digunakan untuk memantau dan merekam aktivitas serta pencapaian mahasiswa selama masa studi mereka. Dengan mengunggah kegiatan, mahasiswa dapat memperlihatkan kontribusi dan partisipasi mereka dalam berbagai kegiatan akademik dan non-akademik. Selain itu, data kegiatan yang terdokumentasi dengan baik juga dapat menjadi bukti atau referensi penting dalam proses evaluasi, penilaian, dan pengembangan diri mahasiswa."
11,Sebutkan salah satu dasar hukum perubahan peraturan ini.,Undang-Undang Nomor 12 Tahun 2012 tentang Pendidikan Tinggi.,"['tentang Perubahan atas Peraturan Rektor Institut Teknologi Sepuluh \n   Nopember Nomor 24 Tahun 2019 tentang Organisasi dan Tata Kerja \n   Institut Teknologi Sepuluh Nopember;\n13. Peraturan Rektor Institut Teknologi Sepuluh Nopember Nomor 25 \n   Tahun 2019 tentang Organisasi dan Tata Kerja Fakultas di \n   Lingkungan Institut Teknologi Sepuluh Nopember sebagaimana telah \n   diubah terakhir dengan Peraturan Rektor Institut Teknologi Sepuluh \n   Nopember Nomor 2 Tahun 2023 Perubahan Kedua Atas Peraturan \n   Rektor Institut Teknologi Sepuluh Nopember Nomor 25 Tahun 2019 \n   tentang Organisasi dan Tata Kerja Fakultas di Lingkungan Institut \n   Teknologi Sepuluh Nopember;\n14. Peraturan Rektor Institut Teknologi Sepuluh Nopember Nomor 26 \n   Tahun 2019 tentang Organisasi dan Tata Kerja Sekretaris Institut, \n   Direktorat, Biro, Kantor, Perpustakaan, dan Unit di Lingkungan \n   Institut Teknologi Sepuluh Nopember; Peraturan Rektor Institut', 'Menimbang   :    a.   bahwa Peraturan Rektor Institut Teknologi Sepuluh\n                      Nopember Nomor 12 Tahun 2019 tentang Baku Mutu\n                      Magang Program Studi Sarjana Terapan dan Sarjana\n                      perlu     dilakukan        penyesuaian      untuk         mengikuti\n                      perkembangan yang ada;\n                 b.   bahwa rancangan perubahan atas Peraturan Rektor\n                      Institut Teknologi Sepuluh Nopember Nomor 12 Tahun\n                      2019    tentang    Baku      Mutu       Magang     Program    Studi\n                      Sarjana     Terapan     dan   Sarjana      telah    mendapatkan\n                      pertimbangan       Senat      Akademik      Institut      Teknologi\n                      Sepuluh Nopember berdasarkan Berita Acara Sidang\n                      Pleno Senat       Akademik         Institut Teknologi Sepuluh\n                      Nopember Nomor T/61733/IT2.XI/TU.00.03.01/2021;', 'Mengingat : 1. Undang-Undang Nomor 12 Tahun 2012 tentang Pendidikan Tinggi\n             (Lembaran Negara Republik Indonesia Tahun 2012 Nomor 158, \n             Tambahan Lembaran Negara Republik Indonesia Nomor 5336);\n           2. Peraturan Pemerintah Nomor 4 Tahun 2014 tentang Penyelenggaraan \n             Pendidikan Tinggi dan Pengelolaan Perguruan Tinggi (Lembaran \n             Negara Republik Indonesia Tahun 2014 Nomor 16, Tambahan \n             Lembaran Negara Republik Indonesia Nomor 5500);\n           3. Peraturan Pemerintah Nomor 26 Tahun 2015 tentang Bentuk \n             dan Mekanisme Pendanaan Perguruan Tinggi Negeri Badan \n             Hukum (Lembaran Negara Republik Indonesia Tahun 2015 \n             Nomor 110, Tambahan Lembaran Negara Republik Indonesia \n             Nomor 5699) sebagaimana diubah dengan Peraturan Pemerintah \n             Republik Indonesia Nomor 8 Tahun 2020 tentang Perubahan Atas \n             Peraturan Pemerintah Nomor 26 Tahun 2015 tentang Bentuk dan', '4\n\n                  BAB II \n              MAKSUD DAN TUJUAN\n\n                 Pasal 2\n(1) Peraturan Rektor ini diterbitkan dengan maksud agar setiap pemungutan dan \n  penghimpunan dana pendidikan dari Calon Mahasiswa Baru dan Mahasiswa serta \n  penggunaannya memiliki landasan hukum.\n(2) Peraturan ini diterbitkan dengan tujuan untuk menjamin transparansi pemungutan, \n  penghimpunan, dan penggunaan dana pendidikan.\n\n                 BAB III \n               RUANG LINGKUP\n\n                 Pasal 3\n(1) Peraturan Rektor ini melingkupi besaran dan mekanisme pemungutan, \n  penghimpunan, dan penggunaan dana pendidikan.\n(2) Dana pendidikan sebagaimana dimaksud pada ayat (1) terdiri atas:\n  a. UKT;\n  b. SPP;\n  c. SPI; dan\n  d. SPA.\n\n                 BAB IV \n         KEWAJIBAN PEMBAYARAN DANA PENDIDIKAN']",Salah satu dasar hukum perubahan peraturan ini adalah Peraturan Pemerintah Nomor 26 Tahun 2015 tentang Bentuk dan Mekanisme Pendanaan Perguruan Tinggi Negeri Badan Hukum.
12,Apa yang terjadi jika mahasiswa tidak membayar UKT atau SPP? ,"Status mahasiswa dinyatakan tidak aktif dan jika tidak membayar selama 2 semester berturut-turut, dinyatakan mengundurkan diri.","['Pasal 12\n(1) Mahasiswa dapat menerima penyesuaian pembayaran nilai UKT atau SPP dengan \n  kondisi sebagai berikut:\n  a. Mahasiswa program sarjana dan sarjana terapan penerima beasiswa KIP-K yang \n   berada pada semester XI dan seterusnya, diwajibkan membayar UKT atau SPP \n   berdasarkan hasil evaluasi kemampuan ekonomi orang tua/wali Mahasiswa;\n  b. Mahasiswa program studi magister yang berada pada semester VII dan \n   seterusnya, diwajibkan membayar SPP senilai SPP yang dikenakan kepada \n   Mahasiswa baru program magister tersebut pada semester berjalan;\n  c. Mahasiswa program studi doktor yang berada pada semester XIII dan seterusnya, \n   diwajibkan membayar SPP senilai SPP yang dikenakan kepada Mahasiswa Baru \n   program doktor pada semester berjalan; dan/atau\n  d. Mahasiswa program pascasarjana yang berpindah jenis kelas diwajibkan \n   membayar SPP untuk jenis kelas dengan tarif lebih tinggi.', 'Pasal 12\n(1) Mahasiswa dapat menerima penyesuaian pembayaran nilai UKT atau SPP dengan \n  kondisi sebagai berikut:\n  a. Mahasiswa program sarjana dan sarjana terapan penerima beasiswa KIP-K yang \n   berada pada semester XI dan seterusnya, diwajibkan membayar UKT atau SPP \n   berdasarkan hasil evaluasi kemampuan ekonomi orang tua/wali Mahasiswa;\n  b. Mahasiswa program studi magister yang berada pada semester VII dan \n   seterusnya, diwajibkan membayar SPP senilai SPP yang dikenakan kepada \n   Mahasiswa baru program magister tersebut pada semester berjalan;\n  c. Mahasiswa program studi doktor yang berada pada semester XIII dan seterusnya, \n   diwajibkan membayar SPP senilai SPP yang dikenakan kepada Mahasiswa Baru \n   program doktor pada semester berjalan; dan/atau\n  d. Mahasiswa program pascasarjana yang berpindah jenis kelas diwajibkan \n   membayar SPP untuk jenis kelas dengan tarif lebih tinggi.', '7\n  b. apabila permohonan disetujui Wakil Rektor yang membidangi akademik, maka \n    Mahasiswa diwajibkan membayar UKT atau SPP selama periode yang tidak \n    dibayar dan membayar UKT atau SPP pada semester berikutnya untuk diaktifkan \n    statusnya sebagai Mahasiswa.\n\n                  Pasal 10\n(1) Mahasiswa yang mendapatkan izin cuti paling lambat pada minggu ke-4 (ke-empat) \n  perkuliahan diwajibkan membayar UKT atau SPP sebesar 20% (dua puluh persen).\n(2) Mahasiswa yang mendapatkan izin cuti setelah minggu ke-4 (ke-empat) perkuliahan, \n  diwajibkan membayar UKT atau SPP sebesar 100% (seratus persen).\n(3) Pengajuan izin cuti sebagaimana dimaksud pada ayat (1) dan ayat (2) diajukan \n  kepada Wakil Rektor yang membidangi akademik.\n\n                 Bagian Kedua \n           Pembebasan Pembayaran UKT dan SPP', '7\n  b. apabila permohonan disetujui Wakil Rektor yang membidangi akademik, maka \n    Mahasiswa diwajibkan membayar UKT atau SPP selama periode yang tidak \n    dibayar dan membayar UKT atau SPP pada semester berikutnya untuk diaktifkan \n    statusnya sebagai Mahasiswa.\n\n                  Pasal 10\n(1) Mahasiswa yang mendapatkan izin cuti paling lambat pada minggu ke-4 (ke-empat) \n  perkuliahan diwajibkan membayar UKT atau SPP sebesar 20% (dua puluh persen).\n(2) Mahasiswa yang mendapatkan izin cuti setelah minggu ke-4 (ke-empat) perkuliahan, \n  diwajibkan membayar UKT atau SPP sebesar 100% (seratus persen).\n(3) Pengajuan izin cuti sebagaimana dimaksud pada ayat (1) dan ayat (2) diajukan \n  kepada Wakil Rektor yang membidangi akademik.\n\n                 Bagian Kedua \n           Pembebasan Pembayaran UKT dan SPP']","Jika mahasiswa tidak membayar UKT atau SPP, maka statusnya sebagai mahasiswa akan dinonaktifkan. Mahasiswa diwajibkan membayar UKT atau SPP selama periode yang tidak dibayar dan membayar UKT atau SPP pada semester berikutnya untuk diaktifkan kembali statusnya sebagai mahasiswa."
13,Apa saja peran Penanggung Jawab Fakultas atau Prodi dalam program MBKM?,"Penanggung Jawab Fakultas atau Prodi bertugas melakukan verifikasi data dan dokumen mahasiswa, memberikan rekomendasi kepada mahasiswa untuk mengikuti Program MBKM, dan melakukan koordinasi jika ada data yang perlu diperbaiki.","['Penanggungjawab Fakultas atau Prodi\nPenanggung Jawab Fakultas atau Prodi, bertugas untuk:\n1)\n2)\n3\nMelakukan verifikasi kebenaran data dan dokumen mahasiswa yang akan mendaftar Program flagship\nMBKM;\nMemberikan rekomendasi kepada mahasiswa untuk mengikuti Program flagship MBKM; dan melakukan koordinasi dengan mkhasiswa apabila terdapat data atau dokumen yang perlu diperbaiki.\n2023', '1.\n2.\n3.\nsubdit. PK2\n1\nPENUGASAN PENANGGUNG JAWAB FAKULTAS/PRODI\nDaftar Program Studi\nProgram studi vana me\nenuhi svarat menaikuti Kamous Merdeka â€¢ Semester Ganiil 2023/2024\n3\nÂ® Lihat Panduan\nanggung Jawab Fakultas/Prodi adalah perwakilan program studi yang bertugas untuk memberikan izi\nemik manasiswa untuk meno kuri orocram Kamous Meraeka.\nla berands\nSiapa itu Penanaguna Jawab Fakultas/Prodi?\nPenanggung Jawab Fakultas/Prodi adalah perwakilan program studi yang bertugas untuk memberikan izin dan melakukan verifikasi data\n4 Segera si email Penancauna Jawab untuk 114 program studi selambat-lambatnva tancaal 28 Oktober 20231\nram Studi\nSegera lengkapi email Penanggung Jawab\nFakultas/Prodi!\nPastikan Anda seluruh program studi memiliki emil Penanggung Jawab memverifikasi data\nmahasiswa.\n2\nMasukkan nama program studi/email\nProgram StudiA-Z\nMemperlihatkan 114 Program Studi l\nPenanggung\nJawab\nProgram Stud\nEmail Penanggung Jawat\nTotal Prodi\n114\nBelum ada Penanggung Jawab\n114\nMasukkan\nMasukkan', 'sebagai pimpinan perguruan tinggi; \n2) Pimpinan PT bertugas menentukan penanggung \njawab dari masing-masing prodi atau fakultas \nuntuk bertindak sebagai pihak yang akan \nmerekomendasikan mahasiswa untuk mengikuti \nprogram MBKM; dan \n3) Pimpinan PT bertugas memberikan persetujuan \nakhir daftar mahasiswa setelah mendapatkan \nrekomendasi dari prodi atau fakultas pada laman Penanggung Jawab Fakultas atau Prodi, bertugas untuk: \n1) Melakukan verifikasi kebenaran data dan dokumen \nmahasiswa yang akan mendaftar Program flagship \nMBKM; \n2) Memberikan rekomendasi kepada mahasiswa untuk \nmengikuti Program flagship MBKM; dan \n3) melakukan koordinasi dengan mkhasiswa apabila \nterdapat data atau dokumen yang perlu diperbaiki. \n2023 Subdit. PK2 \nKebutuhan Perbaikan dan Pengembangan Platform \n2023 Subdit. PK2 \n2023 Subdit. PK2 \nDIGITALISASI SPTJM DAN SR \n2023 \nSubdit. PK2 \n5\n2023 Subdit. PK2 \nKebutuhan Perbaikan dan Pengembangan Platform 2023 Subdit. PK2 \nProses Sebelum: Surat Rekomendasi dan', 'Subdit. PK2\nPeranan Perguruan Tinggi\nPimpinan Perguruan Tinggi\nPimpinan Perguruan Tinggi, bertugas untuk memberikan persetujuan final kepada mahasiswa yang ingin mendaftar program flagship MBKM, dengan ketentuan sebagai berikut:\n1) Pimpinan PT wajib mempunyai salah satu jabatan sebagai pimpinan perguruan tinggi;\në¦¬\nPimpinan PT bertugas menentukan penanggung jawab dari masing-masing prodi atau fakultas untuk bertindak sebagai pihak yang akan merekomendasikan mahasiswa untuk mengikuti\nprogram MBKM; dan\n3)\nPimpinan PT bertugas memberikan persetujuan akhir daftar mahasiswa setelah mendapatkan rekomendasi dari prodi atau fakultas pada laman\nADVANCING HUMANITY\nPenanggungjawab Fakultas atau Prodi\nPenanggung Jawab Fakultas atau Prodi, bertugas untuk:\n1)\n2)\n3\nMelakukan verifikasi kebenaran data dan dokumen mahasiswa yang akan mendaftar Program flagship\nMBKM;']","Penanggung Jawab Fakultas atau Prodi memiliki peran sebagai berikut dalam program MBKM:
1. Melakukan verifikasi kebenaran data dan dokumen mahasiswa yang akan mendaftar Program flagship MBKM.
2. Memberikan rekomendasi kepada mahasiswa untuk mengikuti Program flagship MBKM.
3. Melakukan koordinasi dengan mahasiswa apabila terdapat data atau dokumen yang perlu diperbaiki."
14,Bagaimana penilaian prestasi mahasiswa dilakukan oleh mitra magang?,"Mitra magang memberikan penilaian berdasarkan formulir penilaian yang meliputi aspek-aspek seperti inisiatif, kemampuan komunikasi, disiplin, penampilan, ketekunan, kemampuan teknikal, berpikir kritis, kemampuan bekerjasama, kemampuan beradaptasi, dan hasil pekerjaan (kontribusi), yang kemudian diserahkan ke departemen untuk verifikasi.","['4. Hasil penilaian dilakukan dengan cara mengisi formulir yang ada dan diserahkan\npada departemen.\n8.2\nPENILAIAN PRESTASI KINERJA MAGANG\nOLEH UNIT MITRA MAGANG\nDalam melakukan kegiatan magang, mahasiswa akan memperoleh penilaian dari unit tempat magang. Formulir penilaian magang diisi dan ditandatangani oleh atasan yang berwenang di tempat magang (minimal level manajer) dan dicap menggunakan stempel unit tempat magang. Berikut adalah butir penilaian kinerja magang:\n52\n08 Penilaian Magang', 'cara observasi (kepribadian dan sosial) sebagai teknik utama. Sedangkan penilaian \nhasil dilaksanakan pada akhir pelaksanaan program dengan menggunakan laporan \nyang dibuat oleh mahasiswa. Penilaian dilakukan oleh pendamping dari Pihak Ketiga \nyang terkait dengan kegiatan yang diambil oleh mahasiswa dan dosen pendamping di \nPerguruan Tinggi.\nSelain komponen diatas, perguruan tinggi diwajibkan untuk membuat sistem berupa \nsurvey online  tentang pengalaman dan penilaian mahasiswa terhadap kualitas program \nmerdeka belajar yang mereka jalani selama satu semester diluar program studi. Hal ini dapat \ndigunakan untuk mendapatkan umpan balik dari mahasiswa sebagai sarana evaluasi bagi \nperguruan tinggi dalam mengembangkan program berikutnya.C. Melaksanakan Monitoring dan Evaluasi33       Buku Panduan Merdeka Belajar - Kampus Merdeka\nBAB IV\nPENUTUP\nDemikian buku panduan ini disusun, semoga bermanfaat bagi perguruan tinggi dan dapat', 'melaksanakan program magang industri. Fokus evaluasi adalah individu mahasiswa, yaitu \nprestasi yang dicapai dalam pelaksanaan magang oleh mahasiswa. Melalui evaluasi akan \ndiperoleh tentang apa yang telah dicapai dan apa yang belum dicapai oleh mahasiswa \nselama mengikuti kegiatan.  Evaluasi dapat memberikan informasi terkait kemampuan apa \nyang telah dicapai oleh mahasiswa selama mengikuti program.  Selain itu, melalui evaluasi \ndapat dilakukan judgment terhadap nilai atau implikasi dari hasil program. Selanjutnya, \nprogram ini digunakan untuk meningkatkan kompetensi mahasiswa.\n1. Prinsip Penilaian\nPenilaian dalam pelaksanaan kebijakan Merdeka Belajar - Kampus Merdeka, program \nâ€œhak belajar tiga semester di luar program studiâ€ mengacu kepada 5 (lima) prinsip sesuai \nSNPT yaitu edukatif, otentik, objektif, akuntabel, dan transparan yang dilakukan secara \nterintegrasi.\n2. Aspek â€“ aspek Penilaian\nSejalan dengan prinsip-prinsip penilaian di atas, maka aspek-aspek yang dinilai dalam', '08\nPENILAIAN MAGANG\n8.1\nBOBOT PENILAIAN MAGANG\nâ€¢ Berikut adalah bobot masing-masing komponen penilaian untuk nilai akhir magang:\n60%\n40%\nPrestasi Kinerja Magang\noleh Unit tempat Magang\nPenulisan Laporan Magang,\ndan presentasi laporan jika diperlukan\nâ€¢ Berikut ketentuan umum mengenai penilaian akhir magang:\n1. Dosen pembimbing magang dan dosen pembimbing dari unit tempat magang memberikan penilaian terhadap Laporan Magang dan ujian presentasi magang\njika diperlukan.\n2. Unit tempat magang memberikan penilaian terhadap prestasi magang.\n3. Penilaian penulisan laporan magang mengacu kepada ketentuan.\n4. Hasil penilaian dilakukan dengan cara mengisi formulir yang ada dan diserahkan\npada departemen.\n8.2\nPENILAIAN PRESTASI KINERJA MAGANG\nOLEH UNIT MITRA MAGANG']",Penilaian prestasi mahasiswa dilakukan oleh mitra magang dengan cara mengisi formulir penilaian magang yang kemudian ditandatangani oleh atasan yang berwenang di tempat magang (minimal level manajer) dan dicap menggunakan stempel unit tempat magang. Formulir penilaian ini berisi butir-butir penilaian kinerja magang yang akan digunakan sebagai acuan dalam menilai prestasi mahasiswa selama menjalani kegiatan magang.
15,"Proyek P13 ""Application of Novel Snap-shot based Hyperspectral Imaging Combined with AI to Detect Lesions"" menggunakan metode apa?","Proyek ini menggunakan model pembelajaran mesin seperti YOLOv5, YOLOv8, R-CNN, dan Faster R-CNN untuk mendeteksi kanker esofagus stadium awal menggunakan model gambar cahaya putih (WLI) dan gambar narrowband hiperspektral (HSI-NBI).","['â–  Post-graduate student\r\nâ–  Third/forth-year undergraduate senior student\r\nCategory\r\nâ–  Scholarship\r\nâ–  Self-supported\r\nIntern period At least 8 weeks between May and December 2024\r\n\r\nNumber P13\r\nProject title\r\nApplication of Novel Snap-shot based hyperspectral imaging\r\ncombined with AI to detect Lesions\r\nDescription of the\r\nresearch\r\nThe early detection of esophageal cancer presents a\r\nconsiderable difficulty, which contributes to its high\r\nprevalence as a major cause of cancer-related fatalities. This\r\nproject will utilize various machine learning models, including\r\nYOLOv5, YOLOv8, R-CNN, and Faster R-CNN, to predict and\r\ndetect early-stage esophageal cancer. It will make use of two\r\nmodels of esophageal cancer images: the white-light images\r\n(WLI) model and the hyperspectral narrowband images (HSI-\r\nNBI) model. These models will be generated through a\r\nconversion algorithm referred to as the spectrum-aided\r\nvision enhancer (SAVE). The main goal will be to discover', 'NBI) model. These models will be generated through a\r\nconversion algorithm referred to as the spectrum-aided\r\nvision enhancer (SAVE). The main goal will be to discover\r\nDysplasia and Squamous Cell Carcinoma (SCC). The\r\nevaluation of model performance will be conducted using the\r\ncreated confusion matrix and five important indicators:\r\nprecision, recall, F1-score, mAP, and the confusion matrix of\r\nthe trained model.\r\nMentor at CCU\r\nProf. Hsiang-Chen Wang\r\nDept. of Mechanical Engineering,\r\nNational Chung Cheng University, Taiwan, ROC.\r\n(e-mail: hcwang@ccu.edu.tw)\r\nExpected student level\r\nâ–  Post-graduate student\r\nâ–  Third/forth-year undergraduate senior student\r\nCategory â–  Scholarship\r\nIntern period At least 12 weeks between May and December 2024\r\n\r\nNumber P14\r\nProject title Stirling engines and their applications\r\nDescription of the\r\nresearch\r\nThe students will learn the research topics about Stirling\r\nengines and their applications in renewable energy,', ""developing algorithms for sensor data calibration, point\r\ncloud processing and image processing to create a\r\ncomprehensive and accurate representation of the\r\nvehicle's surroundings. The primary objective is to develop\r\nand optimize algorithms for efficiently processing and\r\ninterpreting the multi-modality. This includes tasks such as\r\nsemantic segmentation, feature extraction, and object\r\nrecognition, all of which are pivotal for the accurate\r\nperception of the vehicle's surroundings.\r\nMentor at CCU\r\nAssoc. Prof. Jui-Chiu Chiang\r\nDept. of Electrical Engineering,\r\nNational Chung Cheng University, Taiwan, ROC.\r\n(E-mail: rachel@ccu.edu.tw)\r\nExpected student level â–ˆ Third/forth-year undergraduate senior student\r\nCategory\r\nâ–ˆ Scholarship\r\nâ–ˆ Self-supported\r\nIntern period At least 12 weeks between May 1st and Dec. 31th\r\n\r\nNumber P4\r\nProject title\r\nSimulation and Reconstruction of Pencil Beam Scanning of\r\nParticle Therapy\r\nDescription of the research"", 'penelitian atau perancanga n (desain) y ang berdasarkan \nrasional tertentu yang dinilai penting  dan berm anfaat \nditinjau dari beberapa segi  \nc. Mam pu melaksanakan penelitian/desain, m ulai d ari \npenyusunan,  pelaksanaan, sam pai pelap oran \nd. Mam pu melakukan kajia n secara kuantitatif dan/ atau \nkualitatif, serta menyusun kesimpulan y ang jelas \ne. Mampu mempresenta sikan dan m empertahankan hasil \nTugas Akhir  dalam  ujian lisan di hadapan tim  dosen \npenguji \n  \n1.3. Bentu k Tugas Akhir \n  Bentuk tugas akhir bisa berupa  penelitian atau perancangan, \nyang terdiri a tas proposal tugas akhir da n laporan tu gas akhir. \n \n1.3.1. Tugas Akhir y ang berupa penelitian \nTugas akhir y ang berupa penelitia n harus mengandung \nkejelasan t entang hal-hal y ang ingin diselidiki ( something to \nbe inquired o r examined ), antara lain: \n  \n a. Obyek yang akan diteliti \n b.  Perm asalahan yang ingin dipecahkan  \n c. Hipotesa y ang ingin dibuk tikan/diuji ke benaranny a']","Proyek P13 ""Application of Novel Snap-shot based Hyperspectral Imaging Combined with AI to Detect Lesions"" menggunakan metode machine learning, termasuk model-model seperti YOLOv5, YOLOv8, R-CNN, dan Faster R-CNN, untuk memprediksi dan mendeteksi kanker kerongkongan pada tahap awal. Selain itu, proyek ini juga menggunakan dua model gambar kanker kerongkongan: model gambar cahaya putih (WLI) dan model gambar hiperspektral narrowband (HSI-NBI) yang dihasilkan melalui algoritma konversi yang disebut spectrum-aided vision enhancer (SAVE). Tujuan utamanya adalah untuk menemukan Dysplasia dan Squamous Cell Carcinoma (SCC)."
16,"Apa yang akan dikembangkan dalam proyek P16 ""Next Generation Wireless Communication, B5G/6G, Reconfigurable Intelligent Surface, System Level Simulation, Artificial Intelligence-enhanced Wireless Research""? ","Proyek ini berfokus pada inovasi dan desain konsep-konsep canggih dan arsitektur di luar 5G dan 6G, mengidentifikasi dan memvalidasi solusi untuk masalah kunci melalui simulasi atau eksperimen prototipe, serta merancang algoritma, model, dan protokol baru untuk mengoptimalkan kinerja jaringan nirkabel.","['Category\r\nâ–  Scholarship\r\nâ–  Self-supported\r\nIntern period At least 8 weeks between 2024/5/1- 2024/12/31\r\n\r\nNumber P16\r\nProject title\r\nNext generation Wireless communication, B5G/6G,\r\nReconfigurable Intelligent Surface, System level\r\nsimulation, Artificial Intelligence-enhanced wireless\r\nresearch\r\nDescription of the\r\nresearch\r\nInnovate and design cutting-edge concepts and\r\narchitectures beyond 5G (B5G) and 6G.\r\nIdentify and validate solutions to key problems through\r\nsimulation or prototype experiments.\r\nConduct research on AI and machine learning\r\ntechniques applied to wireless communications and\r\nnetworks.\r\nDesign and implement novel algorithms, models, and\r\nprotocols to optimize wireless network performance.\r\nCollaborate with the research team to manage projects\r\nand ensure timely deliverables,\r\nPlease refer to the website of our lab at\r\nhttps://sites.google.com/view/ccuantlab/english\r\nMentor at CCU\r\nAssoc. Prof. Jen-Yi Pan\r\nDept. of Communications Engineering,', 'b) Membuat mahasiswa mampu berkolaborasi menyusun dan membuat \nRencana Pembangunan Jangka Menengah Desa (RPJMDes), Rencana Kegiatan \nPembangunan Desa (RKPDes), dan program strategis lainnya di desa bersama \nDosen Pendamping, Pemerintah Desa, Penggerak Swadaya Masyarakat (PSM), \nKader Pemberdayaan Masyarakat Desa (KPMD), pendamping lokal desa, dan \nunsur masyarakat.  \nc) Membuat mahasiswa dapat mengaplikasikan ilmu yang dimiliki secara \nkolaboratif bersama dengan Pemerintah Desa dan unsur masyarakat untuk \nmembangun desa. \nd) Mahasiswa mampu memanfaatkan ilmu pengetahuan, teknologi, dan \nketerampilan yang dimilikinya di lapangan yang disukainya.\n2) Bagi Perguruan Tinggi\na) Memberikan umpan balik bagi perguruan tinggi tentang ilmu pengetahuan \ndan teknologi yang dibutuhkan secara nyata oleh masyarakat.   \nb) Menjadi   sarana bagi perguruan tinggi dalam membentuk jejaring atau mitra \nstrategis dalam membantu pembangunan desa.\nc)  Menjadi sarana pengembangan tri dharma perguruan tinggi.', 'di luar ITS dapat  dikembangkan dan dikoordinasikan oleh Direktorat yang mengurusi \npendidikan bekerjasama dengan Direktorat yang mengurusi pascasarjana dan \npengembangan akademik . \n(5) Direktorat yang mengurusi kegiatan pertukaran pelajar/ kuliah dalam negeri harus 16 Dokumen Panduan Baku Mutu Pelaksanaan MBKM - 2021  \n NO ELEMEN PENILAIAN  INDIKATOR  \n(1) (2) (3) \nberkoordinasi dengan Program Studi terkait . \n Standar Pengelolaan â€“ \nPerencanaan MBKM  1. Prodi mempunyai Dokumen panduan untuk implementasi MBKM / turunan dokumen \nPerek 21 tahun 202 1 yang menjadi konsideran  implementasi MBKM . \n2. Prodi mempunyai kurikulum implementasi MBKM, yang meliputi CPL yang ditetapkan \nsesuai dengan implementasi MBKM dan peta CPL â€“ MK MBKM  \n3.  Prodi mempunyai Dokumen panduan untuk Dosen  Wali dan Dosen Pembimbing dalam \npelaksanaan MBKM   \n4. Prodi mempunyai Dokumen pan duan untuk Mahasiswa dalam perencanaan , \npelaksannaan, penilaian pelaksanaan  MBKM', 'Dipublikasikan tanggal 11 Januari 2024\nNo Bidang Study Program University\n51 Material Sciences\nGraduate Programme Innovative Materials and\nEnergy Systems (Emat) - Master\nNantes UniversitÃ©\n52 Urban Planning Economics for Smart Cities and Climate Policy Institut Polytechnique de Paris\nPoin-Poin Surat Pernyataan pada Aplikasi Pendaftaran (Disetujui Saat Akan Melakukan Submit)\n1. Setia kepada Pancasila, Negara Kesatuan Republik Indonesia, dan UUD 1945.\n2. Tidak pernah, sedang, atau akan mendukung atau terlibat dalam gerakan, organisasi, atau ideologi\nyang bertentangan dan/atau berpotensi mengganggu tegaknya ideologi Pancasila, Undang-\nUndang Dasar 1945, dan Negara Kesatuan Republik Indonesia.\n3. Mendahulukan kepentingan Bangsa dan Negara Kesatuan Republik Indonesia di atas kepentingan\npribadi.\n4. Tidak akan berpindah kewarganegaraan sejak pendaftaran beasiswa sampai dengan selesainya\nmasa kontribusi sebagai alumni beasiswa LPDP.']","Proyek P16 akan mengembangkan konsep dan arsitektur terdepan di luar 5G (B5G) dan 6G. Selain itu, proyek ini juga akan mengidentifikasi dan memvalidasi solusi untuk masalah kunci melalui simulasi atau eksperimen prototipe. Penelitian akan dilakukan pada teknik kecerdasan buatan dan pembelajaran mesin yang diterapkan pada komunikasi nirkabel dan jaringan. Selain itu, proyek ini juga akan merancang dan menerapkan algoritma, model, dan protokol baru untuk mengoptimalkan kinerja jaringan nirkabel. Kolaborasi dengan tim penelitian akan dilakukan untuk mengelola proyek dan memastikan pengiriman tepat waktu."
17,Bagaimana cara menghubungi penyelenggara program internship ini?,"Kontak dapat dilakukan melalui nomor +886-5-2720411 ext. 23003, 23005, atau email coleng_dia@ccu.edu.tw. Alamatnya adalah No.168, Sec. 1, University Rd., Minhsiung, Chiayi 621301, Taiwan (R.O.C.).","['application form, prepare\r\napplication materials, and send\r\nthem in a ZIP-compressed file to\r\ncoleng_dia@ccu.edu.tw.\r\nâ€¢ The title of the e-mail please be\r\nmarked with â€œApplication for 2024\r\nCCU/COE International Internshipâ€.\r\nAll the intern research topics and\r\ntheir requirements are listed as\r\nfollows.\r\nâ€¢ Application deadline: Mar. 3, 2024\r\nâ€¢ More detailed information about\r\napplication can be found on the\r\nwebsite\r\nhttps://sites.google.com/view/ccu-\r\ncoe-internship/home\r\nCONTACT\r\n+886-5-2720411 ext. 23003, 23005\r\ncoleng_dia@ccu.edu.tw\r\nNo.168, Sec. 1, University Rd., Minhsiung,\r\nChiayi 621301, Taiwan (R.O.C.)\r\n\r\nINTERN RESEARCH TOPICS\r\nNumber P1\r\nProject title\r\nTrustable Artificial Intelligence for Critical Applications and\r\n6G Security\r\nDescription of the research\r\nArtificial Intelligence (AI) technologies, 6G networking,\r\nand quantum computing are the leading forces in\r\nbringing the world to an era of better intelligence and full', 'mendaftarkan program kegiatan wirausaha.\nb) Dengan bimbingan pusat inkubasi atau dosen pembimbing kewirausahaan/\nmentor, mahasiswa menyusun proposal kegiatan wirausaha. \nc) Melaksanakan kegiatan wirausaha di bawah bimbingan dosen pembimbing \natau mentor kewirausahaan.Buku Panduan Merdeka Belajar - Kampus Merdeka       20\nd) Menyampaikan hasil kegiatan wirausaha dan menyampaikan laporan dalam \nbentuk presentasi.\nTabel 2.4. Contoh Capaian Pembelajaran Mahasiswa Ilmu Komunikasi yang \nMengikuti Kegiatan Wirausaha (Bentuk  Blended )\nProdi CPL Wirausaha Ekuivalensi MKJumlah \nSKS\nIlmu \nKomunikasiMampu \nmelakukan \npraktik awal \nwirausaha dengan \npemahaman \nkonsep \nwirausaha yang \nkomprehensifKewirausahaan Sosial 3\nEtika Bisnis 2\nPengantar Manajemen dan Bisnis 2\nPemasaran Digital 3\nWirausaha\n1. Desain Wirausaha dan \nPresentasi\n2. Praktik Wirausaha\n3. Laporan Pelaksanaan \nWirausaha dan Presentasi3\n4\n3\nJumlah 6 MK 20 SKS\nPenjelasan Tabel 2.4.', 'KEMENTERIAN PENDIDIKAN, KEBUDAYAAN,\n                                     RISET DAN TEKNOLOGI\n                            INSTITUT TEKNOLOGI SEPULUH NOPEMBER\n                                          Kampus ITS Sukolilo â€“ Surabaya 60111\n                                   Telepon : 031-5994251-54, 5947274, 5945472 (Hunting)\n                                                 Fax: 031-5947264, 5950806\n                                                     http://www.its.ac.id\n\n\n                                            SURAT EDARAN\n                 WAKIL REKTOR BIDANG AKADEMIK DAN KEMAHASISWAAN\n                          INSTITUT TEKNOLOGI SEPULUH NOPEMBER\n                                  NOMOR: 757/IT2.I/T/TU.00.08/2022\n\n\n                                              TENTANG\n             Pelaksanaan Bentuk Kegiatan Pembelajaran Merdeka Belajar â€“ Kampus Merdeka\n\n\nKepada Yth. 1. Dekan\n           2. Kepala Departemen\n           di Lingkungan ITS', 'KEMENTERIAN PENDIDIKAN, KEBUDAYAAN, \n                      RISET, DAN TEKNOLOGI \n             INSTITUT TEKNOLOGI SEPULUH NOPEMBER\n                     Kampus ITS Sukolilo - Surabaya 60111 \n                 Telepon : 031-5994251-54, 5947274, 5945472 (Hunting) \n                         Fax: 031-5947264, 5950806 \n                           http://wwwits.ac.id\n\n       PERATURAN REKTOR INSTITUT TEKNOLOGI SEPULUH NOPEMBER \n                     NOMOR 5 TAHUN 2023\n\n                          TENTANG\n\n        DANA PENDIDIKAN INSTITUT TEKNOLOGI SEPULUH NOPEMBER \n\n              DENGAN RAHMAT TUHAN YANG MAHA ESA\n\n           REKTOR INSTITUT TEKNOLOGI SEPULUH NOPEMBER,']","Anda dapat menghubungi penyelenggara program internship ini melalui email di coleng_dia@ccu.edu.tw atau melalui nomor telepon +886-5-2720411 ext. 23003 atau 23005. Alamat lengkap penyelenggara program ini adalah No.168, Sec. 1, University Rd., Minhsiung, Chiayi 621301, Taiwan (R.O.C.)."
18,Apa yang harus dilakukan jika ingin menghapus atau menarik artikel yang telah diunggah?,"Isi form di link: https://its.id/FHAJTeknikITS untuk Jurnal Teknik, https://its.id/FHAJSainsSeniITS untuk Jurnal Sains & Seni, atau https://its.id/FHAJRepositoryITS untuk Repository.","['\uf0b7   Pengecekan file yang TERUNGGAH dapat dilihat di\n    http://lpmp2ki.its.ac.id/pomits.\n\n\uf0b7   Jika terdapat penghapusan/penarikan artikel, dapat mengisi form pada link\n    \uf031\uf02e http://bit.ly/FHAJTeknikITS, untuk Jurnal Teknik ITS;\n    \uf032\uf02e http://bit.ly/FHAJSainsSeniITS, untuk Jurnal Sains &Seni ITS;\n    \uf033\uf02e http://bit.ly/FHAJRepositoryITS, untuk Repository.\n\n\n\uf0b7   List data Artikel terhapus dapat dilihat pada website jurnal.\n    (http://ejurnal.its.ac.id, yang diupdate tiap 3 hari)\n\n\uf0b7   Artikel - artikel yang TIDAK MEMENUHI KETENTUAN PUBLIKASI (gaya selingkung tidak\n    sesuai format dan file pendukung tidak lengkap) tidak akan DIPUBLIKASIKAN di\n    Jurnal POMITS.\n\n\uf0b7   Periode unggah artikel untuk yudisium 122 adalah sampai dengan\n    7 Agustus 2020, pukul 24.00 WIB', ""melakukan UNGGAH di Jurnal Repository, menggunakan login 'mahasiswa', dengan.\nkata sandi 'M4h4sisw4lTs!' ke alamat 'https://ejurnal.its.ac.id/index.php/index/login'\ndengan mengunggah file artikel dan file Form Telaah(dalam format pdf) saja.\nPengecekan file vang TERuNGGAH dapat dilihat di\nhttps://lpmp2ki.its.ac.id/pomits.\nJika terdapat penghapusan/penarikan artikel, dapat mengisi form pada link :\nhttps://its.id/FHAJTeknikITSPOMITS, untuk Jurnal Teknik ITS;\n1.-\nhttps:/l/its.id/FHAJSainsSenilTSPOMITS, untuk Jurnal Sains &Seni ITS;\n3.https://its.id/FHAJRepositorylTSPOMITS, untuk Jurnal Repository..\n Penghapusan Artikel akan dilakukan setelah yudisium berakhir.\nArtikel - artikel yang TIDAK MEMENUHI KETENTUAN PUBLIKASI (gaya selingkung\ntidak sesuai format dan file pendukung tidak lengkap) tidak akan DIPUBLIKASIKAN\ndi Jurnal Teknik ITS dan Jurnal Sains & Seni ITS.\nPeriode unggah artikel untuk yudisium 29 adalah sampai dengan \n15 Februari 2024 pukul 24.00 WIB"", 'Pemberitahuan\nUnggah Artikel POmITS\nUNGGAH artikel WAJIB dilakukan oleh MAHASISWA PENDAFTAR YUDISIUM 129\n Mahasiswa yang Dosen Pembimbingnya memilih untuk MEMpuBLIKAsIKAN\nartikelnya pada Jurnal POmITS, dapat melakukan UNGGAH, dengan mengikuti langkah\npada BUKU PANDUAN TATA CARA UNGGAH. File yang HARUS DIUNGGAH adalah\n(ukuran masing-masing file tidak boleh lebih dari 2 MB):\nArtikel hasil dari Tugas Akhir, dalam format Ms. Word yang telah mengikuti tem-\n1.\nplate. (selain format Ms.Word artikel DITOLAK/REJECTED)\nFormulir Hak Cipta, dalam format PDF.\nForm Telaah Artikel POmITs, dalam format PDF.\nForm Revisi/Perbaikan/Penyempurnaan TA yang berisi nama penguji beserta\ntidak hanya TTD saja)\n Template, Formulir Hak Cipta, Buku Panduan Tata Cara Unggah, dan Form Telaah\n5.\nArtikel dapat diunduh pada link:\nhttps://ejurnal.its.ac.id/index.php/teknik (Jurnal Teknik ITS)\nhttps://ejurnal.its.ac.id/index.php/sains_seni (Jurnal Sains&Seni ITS)\nSection yang bisa dipilih pada Jurnal Teknik ITS:', '\uf0b7   Mahasiswa yang Dosen Pembimbingnya memilih untuk MEMPUBLIKASIKAN\n    artikelnya pada Jurnal POMITS, dapat melakukan UNGGAH, dengan mengikuti langkah\n    pada BUKU PANDUAN TATA CARA UNGGAH. File yang HARUS DIUNGGAH adalah\n    (ukuran masing-masing file tidak boleh lebih dari 2 MB):\n    \uf031\uf02e Artikel hasil dari Tugas Akhir, dalam format Ms. Word yang telah mengikuti tem-\n       plate. (selain format Ms.Word artikel DITOLAK/REJECTED)\n    \uf032\uf02e Formulir Hak Cipta.\n    \uf033\uf02e Form Telaah Artikel POMITS, dalam format PDF.\n    \uf034\uf02e Form Revisi/Perbaikan/Penyempurnaan TA yang berisi nama penguji beserta\n       komentar dari penguji, dalam format PDF. (Mohon nama penguji tidak disingkat/\n       tidak hanya TTD saja)\n    \uf035\uf02e Template, Formulir Hak Cipta, Buku Panduan Tata Cara Unggah, dan Form Telaah\n       Artikel dapat diunduh pada link:\n       http://ejurnal.its.ac.id/index.php/teknik (Jurnal Teknik ITS)\n        http://ejurnal.its.ac.id/index.php/sains_seni (Jurnal Sains&Seni ITS)']","Untuk menghapus atau menarik artikel yang telah diunggah, Anda dapat mengisi form pada link yang sesuai dengan jenis jurnal tempat artikel tersebut dipublikasikan. Berikut adalah link untuk mengisi form penghapusan/penarikan artikel:
1. Jurnal Teknik ITS: http://bit.ly/FHAJTeknikITS
2. Jurnal Sains & Seni ITS: http://bit.ly/FHAJSainsSeniITS
3. Jurnal Repository: http://bit.ly/FHAJRepositoryITS

Penghapusan artikel akan dilakukan setelah periode yudisium berakhir."
19,Apa yang terjadi dengan artikel yang tidak memenuhi ketentuan publikasi?,Artikel tersebut tidak akan dipublikasikan di Jurnal Teknik ITS dan Jurnal Sains & Seni ITS.,"['3. Artikel yang terbit secara periodik\n\n   Artikel yang dipublikasikan secara periodik, termasuk: (i) jurnal, (ii) majalah, (iii) surat\n   kabar, (iv) buletin, (v) blog, dan (vi) platform online lainnya yang menerbitkan artikel.\n   Jurnal dan majalah mempunyai identitas dengan memiliki nomor volume/edisi. Sebagai\n   contoh sebuah jurnal dengan identitas volume 6, nomor 2.\n   Dalam hal ini nomor volume dicetak miring diikuti oleh nomor dalam tanda kurung\n   tetapi tidak miring. Contoh; 6 (2)\n\n   a. Artikel jurnal dengan DOI\n   Gunakan kapitalisasi kalimat pada judul artikel. Gunakan huruf kapital pada huruf\n   pertama setiap kata utama dalam judul jurnal. Cetak miring judul jurnal dan nomor\n   volume. Tambahkan nomor penerbitan jika tersedia, sertakan nomor DOI; biasanya\n   muncul di halaman pertama artikel.\n Format:\n Author, A. A., Author, B. B., & Author, C. C. (year). Title of article. Title of Periodical,\n      xx, pp-pp. https://doi.org/xxxx', '\uf0b7   UNGGAH artikel WAJIB dilakukan oleh MAHASISWA PENDAFTAR YUDISIUM 121.', 'e. Artikel jurnal dengan DOI, Penulis secara individu atau dalam group\n\nContoh:\nEysenbach, G., & CONSORT-EHEALTH Group. (2011). CONSORT-EHEALTH:\n     Improving and standardizing evaluation reports of web-based and mobile health\n     interventions. Journal of Medical Internet Research, 13(4), e126.\n     https://doi.org/10.2196/jmir.1923\n\nf. Artikel jurnal dalam pers\nArtikel dalam pers adalah peer review, dimana artikel diterima dan akan diterbitkan\ndalam jurnal, tetapi belum ditetapkan ke volume tertentu /edisi tertentu. Meskipun artikel\ndi pers belum memiliki semua rincian bibliografi yang tersedia, artikel ini dapat dikutip\nmenggunakan tahun publikasi online dan DOI.\n\nContoh:\nKreuzer, M., Cado, V., & RaÃ¯es. (2019). Moments of care: How interpersonal interactions\n     contribute to luxury experience of healthcare consumers. Journal of Business\n     Research. https://doi.org/10.1016/j.jbusres.2019.11.033', 'Pemberitahuan\nUnggah Artikel POmITS\nUNGGAH artikel WAJIB dilakukan oleh MAHASISWA PENDAFTAR YUDISIUM 129\n Mahasiswa yang Dosen Pembimbingnya memilih untuk MEMpuBLIKAsIKAN\nartikelnya pada Jurnal POmITS, dapat melakukan UNGGAH, dengan mengikuti langkah\npada BUKU PANDUAN TATA CARA UNGGAH. File yang HARUS DIUNGGAH adalah\n(ukuran masing-masing file tidak boleh lebih dari 2 MB):\nArtikel hasil dari Tugas Akhir, dalam format Ms. Word yang telah mengikuti tem-\n1.\nplate. (selain format Ms.Word artikel DITOLAK/REJECTED)\nFormulir Hak Cipta, dalam format PDF.\nForm Telaah Artikel POmITs, dalam format PDF.\nForm Revisi/Perbaikan/Penyempurnaan TA yang berisi nama penguji beserta\ntidak hanya TTD saja)\n Template, Formulir Hak Cipta, Buku Panduan Tata Cara Unggah, dan Form Telaah\n5.\nArtikel dapat diunduh pada link:\nhttps://ejurnal.its.ac.id/index.php/teknik (Jurnal Teknik ITS)\nhttps://ejurnal.its.ac.id/index.php/sains_seni (Jurnal Sains&Seni ITS)\nSection yang bisa dipilih pada Jurnal Teknik ITS:']","Artikel yang tidak memenuhi ketentuan publikasi akan ditolak atau direjected. Salah satu ketentuan yang harus dipenuhi adalah format artikel harus dalam format Ms. Word sesuai dengan template yang telah ditentukan. Jika artikel tidak memenuhi ketentuan tersebut, maka artikel tersebut akan ditolak."
