,question,ground_truth,contexts,answer
0,Apa itu program IUP?,"International Undergraduate Program yang selanjutnya disingkat IUP adalah program pendidikan sarjana yang dilaksanakan dalam bahasa Inggris dan mahasiswa wajib mengikuti kegiatan internasional sekurang-kurangnya satu kali selama masa studi dalam bentuk Joint degree/Double Degree, student exchange, final project, internship, atau short program dengan perguruan tinggi mitra ITS di luar negeri.","['perkuliahan atau kegiatan terjadwal lainnya, termasuk kegiatan evaluasi.\n6. Mahasiswa adalah peserta didik pada jenjang pendidikan tinggi di ITS.\n7. Mahasiswa Asing adalah mahasiswa ITS dengan kewarganegaraan selain Indonesia.\n8. International Undergraduate Program yang selanjutnya disingkat IUP adalah program \n     pendidikan sarjana yang dilaksanakan dalam bahasa Inggris dan mahasiswa wajib \n     mengikuti kegiatan internasional sekurang-kurangnya satu kali selama masa studi \n     dalam bentuk Joint degree/Double Degree, student exchange, final project, internship, \n     atau short program dengan perguruan tinggi mitra ITS di luar negeri.\n9. Joint Degree/Double Degree adalah penyelenggaraan pendidikan bergelar yang \n     bekerja sama dengan perguruan tinggi mitra.', 'terlibat di dalam pro ses dan hasil pelaksanaan MBKM.  \n(2). SOP yang diterbitkan oleh: (a) Direktorat terkait sebagai koordinator pelaksana \nmasing -masing bentuk MBKM, (b) Prodi sebagai pelaksana MBKM  untuk memandu \ndosen, mahasiswa dan tenaga kependidikan yang terlibat di dalam proses dan hasil \npelaksanaan MBKM.  \nDokumen (1) dan (2) di atas, merupakan manual untuk seluruh stakeholder yang terlibat \ndi dalam implementasi MBKM, yang dapat disusun dalam satu dokumen atau lebih secara \nterpisah. Rambu -rambu dalam penyusunan ke dua dokumen di atas, dengan ketentuan \nmemuat unsur -unsur sebagai berikut, dan dapat dikembangkan sesuai dengan kebutuhan \ndan tujuan pelaksanaan MBKM.  \n1. Tujuan dan ma ksud Manual MBKM  \n2. Luas lingkup Manual MBKM  \na. Manual Penetapan standar  \nb. Manual pelaksanaan standar  \nc. Manual evaluasi standar  \nd. Manual pengendalian pelaksnanaan standar  \ne. Manual peningkatan standar  \n3. Rincian tentang hal yang harus dikerjakan', 'â€¢ IISMA is a scholarship scheme by the Government of Indonesia to\nfund Indonesian students in mobility programs at top universities\nabroad. Students can spend up to one semester at a partner\nuniversity abroad to study, learn about the culture of the\ndestination country, and do practical assignments to home skills.\nwww.its.ac.id INSTITUT TEKNOLOGI SEPULUH NOPEMBER, Surabaya - Indonesia\nStudent Exchange (IISMA)\nCoverage\n- Tuition fee\n- Monthly living expenses (including accommodation) according to PO LPDP\n- Health insurance during the program (excluding travel insurance)\n- Visa\n- Self Quarantine in destination country (if needed)\n- PCR Test\n- Flight ticket\nwww.its.ac.id INSTITUT TEKNOLOGI SEPULUH NOPEMBER, Surabaya - Indonesia\nIF International exposure\nâ€¢ Collaborating with DKG\nâ€¢ Search place of execution\nâ€¢ Document handling\nâ€¢ Student exchange/Internship partners:\nâ€¢ Asia University, Taiwan\nâ€¢ Shibaura University, Japan\nâ€¢ Kumamoto Univ, Hiroshima Uni, Japan\nâ€¢ Ajoo Univ, Korea', '6. Apabila memerlukan informasi lebih lanjut dapat menghubungi dirpendikcare@its.ac.id atau di\ncall centre pada hari dan jam kerja melalui no (WA Text Only) 085186819604, 085186819605.\nB. Bagi semua calon wisudawan (Sarjana dan Sarjana Terapan) wajib menghadap dosen wali untuk persetujuan SKEM, serta wajib melakukan pengajuan SKPI di studentconnect paling lambat tanggal 9 Februari 2024;\nC. Ijazah dicetak berdasarkan data preview yang dipermanen oleh calon wisudawan. Ijazah dicetak hanya sekali saja, bila ada kekeliruan pengisian data pada point 3 maka akan diterbitkan surat keterangan.\nD.Pelaksanaan wisuda akan dilaksanakan secara offline (Informasi mengenai gladi bersih disampaikan lebih lanjut.\n Atas perhatian dan kerjasama yang diberikan, kami sampaikan terima kasih.\n Powered by TCPDF (www.tcpdf.org)\nTembusan Yth :\n1. Rektor ITS\n2. Kepala Bagian Administrasi Umum dan Kearsipan Digital 3. Sekretaris Institut\nSurabaya, 09 Januari 2024\nWakil Rektor Bidang Akademik dan Kemahasiswaan,']","Program IUP adalah International Undergraduate Program yang merupakan program pendidikan sarjana yang dilaksanakan dalam bahasa Inggris di ITS. Mahasiswa yang mengikuti program ini wajib mengikuti kegiatan internasional sekurang-kurangnya satu kali selama masa studi dalam bentuk Joint degree/Double Degree, student exchange, final project, internship, atau short program dengan perguruan tinggi mitra ITS di luar negeri."
1,Apa saja dana pendidikan di ITS?,"UKT, SPP, SPI dan SPA.","['Pasal 23\n(1) Dana Pendidikan dig~an untuk:\n a. penyelenggaraan kegiatan tridharma perguruan tinggi dan pengelolaan manajemen;\n b. pengadaan sarana dan prasarana penyelenggaraan tridharma perguruan tinggi dan \n   manajemen yang meliputi:\n   1. pembangunan gedung pendidikan, Laboratorium, dan manajemen; dan\n   2. pengadaan peralatan pendidikan, laboratorium, dan manajemen;\n c. pengembangan keahlian dan keilmuan dosen dan tenaga kependidikan;\n d. pengembangan program penyelenggaraan pendidikan tinggi yang dituangkan dalam \n   dokumen perencanaan ITS.\n(2) Pengelolaan manajemen sebagaimana dimaksud pada ayat (1) huruf a terdiri atas:\n a. operasional rutin perkantoran; dan\n b. kesejahteraan pegawai mengacu pada peraturan Rektor yang mengatur tentang \n   kepegawaian dan pengelolaan kinerja.\n(3) Besaran dan mekanisme penggunaan dana pendidikan mengacu pada dokumen \n perencanaan dan dokumen pedoman pengelolaan keuangan.', 'BAB IX \n      BESARAN DAN MEKANISME PEMBAYARAN DANA PENDIDIKAN\n\n                  Pasal 24\n(1) Besaran dana pendidikan ditetapkan melalui keputusan Rektor.\n(2) Pembayaran dana pendidikan sebagaimana dimaksud pada ayat (1) dilakukan secara \n  online melalui bank persepsi yang ditunjuk, sesuai jadwal pembayaran yang telah \n  ditetapkan.\n\n\n                   12\n(3) Dana Pendidikan yang telah dibayarkan tidak dapat ditarik kembali kecuali memenuhi \n      ketentuan sebagaimana diatur dalam Pasal 20.\n\n                                                                            BAB X \n                                                             KETENTUAN PENUTUP', 'Pasal 4\n(1) Kewajiban membayar dana pendidikan berupa UKT dikenakan kepada:\n  a. Calon Mahasiswa Baru program sarjana dan sarjana terapan yang diterima dari \n   Jalur Seleksi Nasional; dan\n  b. Mahasiswa program sarjana dan sarjana terapan yang diterima dari Jalur Seleksi \n   Nasional.\n(2) Kewajiban membayar dana pendidikan berupa SPP dikenakan kepada:\n  a. Calon Mahasiswa Baru program sarjana dan sarjana terapan yang diterima dari \n   selain Jalur Seleksi Nasional;\n  b. Mahasiswa program sarjana dan sarjana terapan yang diterima dari selain Jalur  \n   Seleksi Nasional;\n  c. Ca1on Mahasiswa Baru program sarjana dan sarjana terapan yang diterima dari \n   Jalur seleksi nasional program joint degree/ double degree-,\n  d. Mahasiswa program sarjana dan sarjana terapan yang diterima dari Jalur Seleksi \n   Nasional program joint degree/ double degree-,\n  e. Calon Mahasiswa Baru program pascasarjana dan pascasarjana terapan; dan', 'dapat menuliskan hal-hal yang dilakukannya beserta hasilnya dalam bentuk tugas \nakhir.\nPelaksanaan KKNT dilakukan untuk mendukung kerja sama bersama Kementerian \nDesa PDTT serta Kementerian/ stakeholder  lainnya. Pemerintah melalui Kementerian \nDesa PDTT menyalurkan dana desa 1 milyar per desa kepada sejumlah 74.957 \ndesa di Indonesia, yang berdasarkan data Indeks Desa Membangun (IDM) tahun \n2019, terdapat desa sangat tertinggal sebanyak 6.549 dan desa tertinggal 20.128. \nPelaksanaan KKNT dapat dilakukan pada desa sangat tertinggal, tertinggal dan \nberkembang, yang sumber daya manusianya  belum memiliki kemampuan \nperencanaan pembangunan dengan fasilitas dana yang besar tersebut. Sehingga \nefektivitas penggunaan dana desa untuk menggerakkan pertumbuhan ekonomi \nmasih perlu ditingkatkan, salah satunya melalui mahasiswa yang dapat menjadi \nsumber daya manusia yang lebih memberdayakan dana desa.\n23       Buku Panduan Merdeka Belajar - Kampus Merdeka']","Dana Pendidikan di ITS digunakan untuk beberapa hal, yaitu:
1. Penyelenggaraan kegiatan tridharma perguruan tinggi dan pengelolaan manajemen.
2. Pengadaan sarana dan prasarana penyelenggaraan tridharma perguruan tinggi dan manajemen, termasuk pembangunan gedung pendidikan, laboratorium, dan manajemen, serta pengadaan peralatan pendidikan, laboratorium, dan manajemen.
3. Pengembangan keahlian dan keilmuan dosen dan tenaga kependidikan.
4. Pengembangan program penyelenggaraan pendidikan tinggi yang dituangkan dalam dokumen perencanaan ITS.

Selain itu, pengelolaan manajemen dana pendidikan meliputi operasional rutin perkantoran dan kesejahteraan pegawai mengacu pada peraturan Rektor yang mengatur tentang kepegawaian dan pengelolaan kinerja. Besaran dan mekanisme penggunaan dana pendidikan mengacu pada dokumen perencanaan dan dokumen pedoman pengelolaan keuangan."
2,Apa tujuan dibuat SKEM?,"1. Menanamkan sikap ilmiah, merangsang daya kreasi dan inovasi, meningkatkan kemampuan meneliti, menulis karya ilmiah, meningkatkan kemampuan berkomunikasi, serta pemahaman profesi. 2. Meningkatkan kesehatan / kebugaran, prestasi dan apresiasi budaya melalui penyaluran minat dan bakat dalam bidang seni dan olah raga. 3. Meningkatkan kemampuan mahasiswa dalam kerjasama (team work), komunikasi, ketrampilan manajemen, berorganisasi dan kepemimpinan. 4. Meningkatkan pengabdian kepada masyarakat, rasa kepedulian terhadap sesama, serta menanamkan rasa cinta tanah air.","['Konsep Satuan Kredit Ekstrakurikuler Mahasiswa\nDirektorat Kemahasiswaan \nEdisi Revisi (24 Agustus 2021)\n\nTujuan Dibuat SKEM\n1. Menanamkan sikap ilmiah, merangsang daya kreasi dan inovasi, meningkatkan\nkemampuan meneliti, menulis karya ilmiah, meningkatkan kemampuan berkomunikasi,\nserta pemahaman profesi.\n2. Meningkatkan kesehatan / kebugaran, prestasi dan apresiasi budaya melalui penyaluran\nminat dan bakat dalam bidang seni dan olah raga.\n3. Meningkatkan kemampuan mahasiswa dalam kerjasama (team work), komunikasi,\nketrampilan manajemen, berorganisasi dan kepemimpinan.\n4. Meningkatkan pengabdian kepada masyarakat, rasa kepedulian terhadap sesama, serta\nmenanamkan rasa cinta tanah air.', 'Prinsip Pokok SKEM\nBagi Mahasiswa, sistem baru SKEM ITS 2021 mendorong mahasiswa untuk merencanakan,\nmelakukan, dan mengadministrasikan kegiatan ekstrakurikuler secara berkala setiap semester.\nDengan ini mahasiswa bisa melakukan evaluasi sendiri Soft skills apa yang perlu mahasiswa\nkembangkan selama perkuliahan. Selain itu dokumen yang diunggah dalam system dapat digunakan\nsebagai CV dan SKPI (Surat Keterangan Pendamping Ijasah)\nBagi Dosen Wali, sistem baru SKEM ITS 2021 ini membantu mengidentifikasikan potensi dan\nkendala anak wali dalam pengembangan Soft skillsnya.\nSelain itu Dosen Wali dimudahkan dalam mengevaluasi dan verifikasi secara bertahap/setiap\nsemester. Hal ini akan menghilangkan menumpukkan pekerjaan verifikasi kegiatan ekstrakurikuler\nMahasiswa menjelang Yudisium.\nBagi Departemen, sistem baru SKEM ITS 2021 ini membantu Departemen untuk mendapatkan\ndata pemetaaan profile mahasiswa guna pengembangan Soft skills mahasiswa di Departemen dan', 'BAB II MAKSUD DAN TUJUAN\n\nPasal 2\nPeraturan ini diterbitkan dengan maksud agar pimpinan ITS mempunyai pedoman dalam memberikan Apresiasi kepada Mahasiswa berprestasi dan Pembimbing di bidang kemahasiswaan.\n\n                               Pasal 3 Peraturan ini diterbitkan dengan tujuan:\na. memotivasi Mahasiswa agar berprestasi dalam berbagai kegiatan lomba; dan\nb. mendorong Pembimbing untuk melakukan pembinaan, pendampingan dan/atau pelatihan secara intensif kepada perorangan atau kelompok Mahasiswa.\n\nBAB III\nSYARAT DAN TINGKAT PRESTASI\n\nBagianKesatu\nSyarat Prestasi Lomba Kementerian\n\n\n\n(1) Syarat untuk Mahasiswa:\n\nPasal 4\n\na. Mahasiswa aktif yang terdaftar di sistem akademik ITS;', '6. Jarak Spasi\n1 (satu)\nâ€¢ SISTEMATIKA LAPORAN MAGANG\nCover Luar\nCover Dalam\nLembar Pengesahan\nKata Pengantar\nDaftar Isi\nDaftar Gambar\nDaftar Tabel\nBAB 1. PENDAHULUAN\n1.1. Latar Belakang\n1.2. Tujuan Magang\n1.3. Manfaat Magang\n1.4. Mahasiswa menguraikan tujuan penulisan topik magang.\nBAB 2. PENDAHULUAN\n2.1. Sejarah Mitra Magang\n2.2. Struktur Organisasi Mitra Magang\n2.3. Visi dan Misi Perusahaan\n2.4. Kegiatan Produksi (barang/jasa) (jika ada)\nBAB 3. PELAKSANAAN MAGANG\n3.1 Posisi / kedudukan kegiatan Magang\n3.2 Metodologi penyelesaian Tugas\n3.3 Pembelajaran Hal Baru\nBAB 4. KESIMPULAN DAN SARAN\nBAB 5. REFLEKSI DIRI\nLAMPIRAN\nBuku Petunjuk Teknis Magang\n47']","Tujuan dibuat SKEM adalah untuk:
1. Menanamkan sikap ilmiah, merangsang daya kreasi dan inovasi, meningkatkan kemampuan meneliti, menulis karya ilmiah, meningkatkan kemampuan berkomunikasi, serta pemahaman profesi.
2. Meningkatkan kesehatan/kebugaran, prestasi, dan apresiasi budaya melalui penyaluran minat dan bakat dalam bidang seni dan olahraga.
3. Meningkatkan kemampuan mahasiswa dalam kerjasama (team work), komunikasi, ketrampilan manajemen, berorganisasi, dan kepemimpinan.
4. Meningkatkan pengabdian kepada masyarakat, rasa kepedulian terhadap sesama, serta menanamkan rasa cinta tanah air."
3,Apa itu Beasiswa Prioritas?,"Beasiswa Prioritas merupakan program beasiswa yang memberikan kesempatan kepada pendaftar untuk dapat melakukan pendaftaran pada dua program sekaligus, yaitu pada program Beasiswa Kemitraan/Kerja Sama LPDP dan pada salah satu program Beasiswa Afirmasi/Beasiswa Targeted/Beasiswa Umum tujuan luar negeri.","['Siapakah Sasaran Beasiswa Prioritas\nLPDP â€“ Campus France Program Master?\n1. Warga Negara Indonesia (WNI)\n2. PNS/TNI/POLRI\nSeperti Apa Skema Prioritas LPDP â€“\nCampus France Program Master?\nPendaftar wajib mendaftar secara bersamaan\npada beasiswa Kemitraan LPDP â€“ Campus France\nProgram Master dan salah satu program Magister\nbeasiswa Afirmasi/Targeted/Umum tujuan luar\nnegeri, dengan skema berikut.\n1. Beasiswa Kemitraan LPDP â€“ Campus France\nProgram Master:\na. Beasiswa LPDP â€“ Campus France\nProgram Master diperuntukkan bagi\nWarga Negara Indonesia untuk dapat\nmenempuh pendidikan pada program\nmagister di program studi dan universitas\nsebagaimana daftar terlampir dengan\ndurasi pendanaan paling lama 24 (dua\npuluh empat) bulan.\nb. Pendaftar diharuskan untuk melakukan\npendaftaran pada:\nâ— Perguruan Tinggi Tujuan Studi\nsesuai jadwal dan ketentuan yang\nberlaku di Perguruan Tinggi, dan\nâ— Campus France sesuai jadwal dan\nketentuan yang berlaku di Campus\nFrance.\n2. Persyaratan dan dokumen pada Beasiswa', 'Panduan Pendaftaran\nBeasiswa Prioritas\nLPDP - Campus France\nProgram Master\nTahun 2024\nlpdp.kemenkeu.go.id', 'Dipublikasikan tanggal 11 Januari 2024\nTentang LPDP\nLPDP berkomitmen untuk mempersiapkan\npemimpin dan profesional masa depan serta\nmendorong inovasi demi terwujudnya Indonesia\nyang sejahtera, demokratis, dan berkeadilan.\nLPDP menyelenggarakan program beasiswa\nmagister/doktor serta beasiswa dokter spesialis,\ndokter subspesialis dan Fellowship untuk putra-\nputri terbaik Indonesia.\nApa itu Beasiswa Prioritas?\nBeasiswa Prioritas merupakan program beasiswa\nyang memberikan kesempatan kepada pendaftar\nuntuk dapat melakukan pendaftaran pada dua\nprogram sekaligus, yaitu pada program Beasiswa\nKemitraan/Kerja Sama LPDP dan pada salah satu\nprogram Beasiswa Afirmasi/Beasiswa\nTargeted/Beasiswa Umum tujuan luar negeri.\nApa itu Beasiswa Prioritas LPDP â€“ Campus\nFrance Program Master?\nBeasiswa Prioritas LPDP â€“ Campus France\nProgram Master memberikan kesempatan bagi\npendaftar untuk dapat melakukan pendaftaran\npada Beasiswa Kemitraan LPDP â€“ Campus\nFrance dan beasiswa Magister Luar Negeri', 'dan Seleksi Substansi\n18 â€“ 27 Maret\n2024\nShort Listed untuk\nKampus Tujuan\n3 April 2024\nLoA Unconditional dari\nKampus Tujuan\n27 Mei 2024\nPengumuman Hasil\nSeleksi Substansi\n10 Juni 2024\nMulai Perkuliahan Paling\nCepat\nJuli 2024\nCatatan:\nPendaftar diharuskan melakukan pendaftaran\npada:\na. universitas sesuai jadwal dan ketentuan yang\nberlaku di Perguruan Tinggi; dan\nb. Campus France sesuai jadwal dan ketentuan\nyang berlaku di Campus France.\nBagi pendaftar yang mendaftar dengan LoA\nUnconditional yang sesuai dengan ketentuan\nLPDP pada beasiswa lain yang dipilih (beasiswa\nafirmasi, targeted, atau umum) dapat melanjutkan\nke tahap Seleksi Substansi tanpa mengikuti\nSeleksi Bakat Skolastik.\nApa saja Pelanggaran dan Sanksi yang\ndiberlakukan oleh LPDP?\n1. Pendaftar yang melakukan kecurangan\nselama tahapan pendaftaran dan/atau seleksi\nbeasiswa dikategorikan sebagai pelanggaran\nketentuan dan persyaratan seleksi.\n2. Pendaftar yang melanggar ketentuan dan\npersyaratan seleksi akan digugurkan dan']","Beasiswa Prioritas merupakan program beasiswa yang memberikan kesempatan kepada pendaftar untuk dapat melakukan pendaftaran pada dua program sekaligus, yaitu pada program Beasiswa Kemitraan/Kerja Sama LPDP dan pada salah satu program Beasiswa Afirmasi/Beasiswa Targeted/Beasiswa Umum tujuan luar negeri."
4,Apa saja Jenis Program Magang Kampus Merdeka di ITS,"MBKM: Program dari Kementerian Pendidkan, Kebudayaan, Riset dan Teknologi dalam bentuk pembelajaran di luar Kampus selama 2 semester, dan bisa/wajib dikonversikan ke SKS
Mata Kuliah. Non-MBKM: Program Magang dikonversikan ke SKEM atau hanya untuk menambah pengalaman mahasiswa.","['Subdit. PK2\nJenis Program Magang Kampus Merdeka di ITS\nâ€¢ MBKM [ Program dari Kementerian Pendidkan,\nKebudayaan, Riset dan Teknologi dalam bentuk pembelajaran di luar Kampus selama 2 semester, dan bisa/wajib dikonversikan ke SKS\nMata Kuliah. *\nâ€¢ Non-MBKM [ Program Magang dikonversikan ke SKEM atau hanya untuk menambah pengalaman mahasiswa. *\n)* syarat dan ketentuan berlaku.\nADVANCING HUMANITY\niTS\nProgram Magang Flagship (Kampus Merdeka)\nâ€¢ MSIB (Magang dan Studi Independen Bersertifikat)\nâ€¢ Bangkit (by Google, GoTo, and Traveloka)\nâ€¢ Gerilya ( by Kementerian ESDM )\nProgram Magang Reguler\nâ€¢ Magang Kerjasama\nâ€¢ Magang Mandiri\nProgram Magang Lokal\nMagang Institut', 'Website Resmi ITS Career Center (Subdit. PK2 ITS)\nSubdit. PK2\nhttps://www.its.ac.id/careers/id/magang\n\nJenis Program Magang\nKampus Merdeka di ITS\nâ€¢ MBKM ðŸ¡º Program dari\nKementerian Pendidkan,\nKebudayaan, Riset dan Teknologi\ndalam bentuk pembelajaran di luar\nKampus selama 2 semester, dan\nbisa/wajib dikonversikan ke SKS\nMata Kuliah. *\nâ€¢ Non-MBKM ðŸ¡º Program Magang\ndikonversikan ke SKEM atau hanya\nuntuk menambah pengalaman\nmahasiswa. *\n)* syarat dan ketentuan berlaku.\nProgram Magang Flagship ( Kampus Merdeka )\nâ€¢ MSIB (Magang dan Studi Independen Bersertifikat)\nâ€¢ Bangkit ( by Google, GoTo, and Traveloka )\nâ€¢ Gerilya ( by Kementerian ESDM )\nProgram Magang Reguler\nâ€¢ Magang Kerjasama\nâ€¢ Magang Mandiri\nProgram Magang Lokal\nâ€¢ Magang Institut\n\nAPA SAJA SYARAT DAN KETENTUAN UNTUK JENIS MAGANG MBKM ?', 'Mengambil beberapa MK (perkuliahan secara online)\nPenguatan Program Magang di ITS\n\nPerubahan SOTK â†’ Unit Pengelolaan Magang Industri (Direktorat Kemahasiswaan)\nPenambahan kuliah wajib MK Magang â†’ Fakultas Vokasi\nJenis Program Magang di ITS\n\nBerdasarkan Mitra Magang: BUMN, Non-BUMN, ITS, UKM/Kewirausahaan\nBerdasarkan Jalur Magang: PMMB, Non-PMMB, Mandiri, Kerjasama\nPENGHARGAAN FHCI UNTUK ITS\nITS sebagai kontributor terbaik PMMB 2019 bersama UGM dan Politeknik Negeri Ujung Pandang.\n\nKuliah Kerja Nyata (KKN)\nKegiatan KKN sebagai metode pembelajaran dan sarana pengabdian kepada masyarakat dengan tujuan:', 'Mahasiswa tidak diperkenankan mengambil Program Kegiatan (BKP) MBKM yang sama lebih dari 1 kali. Mahasiswa yang sudah pernah mengikuti Program Kegiatan Studi Independen ( konversi ke SKS), tidak diperkenankan mendaftar Program kegiatan Studi Independen kembali (disarankan mendaftar pada Program BKP MBKM lainnya). Contoh: Magang Mahasiswa yang akan mengikuti Program Magang dan Studi Independen (MSIB) Batch 6 Wajib melakukan konversi alih kredit SKS MK.\n2023']","Program Magang Kampus Merdeka di ITS terdiri dari dua jenis, yaitu:
1. MBKM (Program dari Kementerian Pendidikan, Kebudayaan, Riset dan Teknologi) dalam bentuk pembelajaran di luar Kampus selama 2 semester, dan bisa/wajib dikonversikan ke SKS Mata Kuliah.
2. Non-MBKM (Program Magang dikonversikan ke SKEM atau hanya untuk menambah pengalaman mahasiswa)."
5,Apa syarat Foto formal calon wisudawan ITS?,"Mempunyai kualitas STUDIO FOTO dengan ekstensi file: .jpg atau .jpeg Berlatar belakang biru dengan komposisi warna (C: 100 M: 040 Y: 001 K: 001) atau (R: 000 G: 120 B: 193) Mempunyai ukuran proporsional separuh badan Menghadap lurus kedepan Tidak menggunakan kacamata Menampakkan bagian wajah dengan jelas Memakai jas warna gelap, kemeja putih, dan berdasi hitam (Pria/Wanita) Khusus bagi wanita yang berhijab warna hijab menyesuaikan dan tidak berdasi","['Menampakkan bagian wajah dengan jelas\nMemakai jas warna gelap, kemeja putih, dan berdasi hitam (Pria/Wanita)\nKhusus bagi wanita yang berhijab warna hijab menyesuaikan dan tidak berdasi\n3. Data yang dipergunakan sebagai dasar pencetakan ijazah (Nama, Tempat Lahir, Tanggal Lahir, NIK) adalah data yang ada pada KTP/Akta kelahiran;\n4. Penulisan data di ijazah ITS menggunakan aturan Proper Case;\n5. Jika ada ketidaksesuaian penulisan nama dan/atau tempat lahir pada preview ijazah dengan data\nyang dimasukkan, mohon cetak preview ijazahnya kemudian diserahkan ke kantor Direktorat\nPendidikan disertai dokumen pendukung;\n6. Apabila memerlukan informasi lebih lanjut dapat menghubungi dirpendikcare@its.ac.id atau di\ncall centre pada hari dan jam kerja melalui no (WA Text Only) 085186819604, 085186819605.', 'A. Semua calon Wisudawan ITS ke-129 periode wisuda April 2024 wajib mengisi biodata di menu update wisudawan sampai dengan tanggal 9 Februari 2024, dengan ketentuan sebagai berikut:\n1. Mempersiapkan dokumen yang akan diunggah antara lain: Ijazah terakhir, KTP, foto formal terbaru berwarna untuk ijazah, dan Akte Kelahiran (apabila diperlukan);\n2. Foto formal terbaru berwarna yang diunggah mempunyai ketentuan:\nMempunyai kualitas STUDIO FOTO dengan ekstensi file: .jpg atau .jpeg\nBerlatar belakang biru dengan komposisi warna (C: 100 M: 040 Y: 001 K: 001) atau (R: 000 G: 120 B: 193)\nMempunyai ukuran proporsional separuh badan\nMenghadap lurus kedepan\nTidak menggunakan kacamata\nMenampakkan bagian wajah dengan jelas\nMemakai jas warna gelap, kemeja putih, dan berdasi hitam (Pria/Wanita)\nKhusus bagi wanita yang berhijab warna hijab menyesuaikan dan tidak berdasi', 'BAB III\nSYARAT DAN TINGKAT PRESTASI\n\nBagianKesatu\nSyarat Prestasi Lomba Kementerian\n\n\n\n(1) Syarat untuk Mahasiswa:\n\nPasal 4\n\na. Mahasiswa aktif yang terdaftar di sistem akademik ITS;\n\nb. Mahasiswa memiliki surat tugas dari direktorat yang mengurusi kemahasiswaan/dekan untuk mengikuti kompetisi tersebut; dan\nc. Mahasiswa yang mendapatkan Apresiasi adalah juara 1, juara 2, juara 3, dan Finalis pada kegiatan kompetisi yang diadakan oleh Kementerian atau Lomba Mandiri bereputasi dengan skala nasional ataupun internasional dibuktikan dengan sertifikat\n(2) Syarat untuk Pembimbing:\na. dosen aktif yang ada di ITS; dan\nb. dosen yang mempunyai Surat Keputusan Rektor sebagai Pembimbing kegiatan kompetisi kemahasiswaan.\n(3) Syarat untuk Dosen Penalaran yaitu dosen aktif yang tergabung pada kegiatan penalaran yang dibuktikan dengan Surat Keputusan Rektor dan mendukung kegiatan kompetisi yang diselenggarakan oleh Kementerian.\n\nBagian Kedua\nSyarat Prestasi Lomba Mandiri', 'Tabel 2.1 Standar dalam penyelenggaraan MB -KM di   ITS \nNO ELEMEN PENILAIAN  INDIKATOR  \n(1) (2) (3) \nI STANDAR KOMPETENSI LULUSAN  \n1 Standar Kompetensi Lulusan  (i) Pelaksanaan MBKM mengacu pada CPL Prodi sebagai target dari kemampuan lulusan, \ndengan minimal pencapaian 80%  CPL dan atau sebagai kompetensi tambahan  \n(ii) Kompetensi tambahan dimaksudkan untuk memperlancar karir lulusan, kolaborasi riset \ndan atau kerja sama p engembangan industri.  \nII STANDAR ISI PEMBELAJARAN  \n2 Standar Isi  â€“ MK Pengayaan  (i) Prodi menyediakan kurikulum untuk pelaksanaan MBKM yang disusun bersama \npemangku kepentingan internal dan eksternal, serta direview oleh pakar bidang ilmu \nprogram studi nya.  \n(ii) Keterjaminan pemenuhan CPL  melalui MBKM ( ketersediaan matrik / peta CPL - MK \nMBKM ), dan ketersediaan modul MK melalui pembelajaran  untuk MK yang \ndilaksanakan secara MBKM']","Syarat Foto formal calon wisudawan ITS adalah sebagai berikut:
1. Mempunyai kualitas STUDIO FOTO dengan ekstensi file: .jpg atau .jpeg
2. Berlatar belakang biru dengan komposisi warna (C: 100 M: 040 Y: 001 K: 001) atau (R: 000 G: 120 B: 193)
3. Mempunyai ukuran proporsional separuh badan
4. Menghadap lurus kedepan
5. Tidak menggunakan kacamata
6. Menampakkan bagian wajah dengan jelas
7. Memakai jas warna gelap, kemeja putih, dan berdasi hitam (Pria/Wanita)
8. Khusus bagi wanita yang berhijab warna hijab menyesuaikan dan tidak berdasi

Jadi, itulah syarat-syarat untuk Foto formal calon wisudawan ITS."
6,Apakah mata kuliah pengayaan bisa di-drop?,"Seperti halnya MK yang lain, jika masih dalam masa drop tiap semester, maka boleh (sampai dengan minggu 10). Setelah waktu itu tidak bisa, namun bisa digantikan dengan MK pengayaan lain yang diambil di semester berikutnya.","['Q: Berapa sks mata kuliah pengayaan yang bisa diambil?\n\nA: Di peraturan akademik mengambil MK pengayaan maksimal 6 sks dan minimum 3 sks.\n\nQ: Apakah mata kuliah pengayaan bisa di-drop?\n\nA: Seperti halnya MK yang lain, jika masih dalam masa drop tiap semester, maka boleh (sampai dengan minggu 10). Setelah waktu itu tidak bisa, namun bisa digantikan dengan MK pengayaan lain yang diambil di semester berikutnya.\n\nQ: Kepada siapa saya meminta konsultasi tentang perwalian/perencanaan kuliah, merubah MK yang diambil dan drop MK setelah minggu ke 4?\n\nA: Ke DOSEN WALI, bukan ke PEMBIMBING TA. Batas akhir perubahan MK adalah minggu ke 3 dan drop MK adalah minggu ke 10\n\nQ: Bagaimana jika saya tidak bisa ambil MK di FRS padahal prasyarat sudah terpenuhi? \n\nA: Silakan menginformasikan ke doswal dengan menyertakan bukti2. Doswal akan membantu menambahkan MK yang dimaksud jika bukti2 telah mencukupi.\n\nQ: Apakah MK yang diambil via dropdown MBKM bisa menggantikan MK yang sudah diambil?', '(1) (2) (3) \nDalam hal mahasiswa mendapatkan nilai mata kuliah pengayaan kurang dari C, maka \nmahasiswa dapat menggantinya dengan mata kuliah pengayaan yang berbeda.  \nV STANDAR DOSEN DAN TENDIK  \n12 Standar dosen dan Tendik  (i) Dosen wali ditugaskan oleh Prodi untuk membuat perencanaan bersama dengan \nmahasiswa yang akan melaksanakan kegatan MBKM  \n(ii) Dosen wali ditugaskan oleh Prodi untuk melakukan evaluasi terhadap kesesuaian \nbentuk dan lama pelaksanaan MBKM sesuai dengan CPL  \n(iii) Dosen wali di tugaskan oleh Prodi untuk melakukan penilaian atas rencana, \npelaksanaan dan evaluasi MBKM  \n(iv) Dosen pembimbing MBKM ditugaskan oleh Prodi sesuai dengan pengampu MK \nkonversi dan atau dosen wali  \n(v) Tendik Prodi ditugaskan untuk melayani administrasi dalam implement asi MBKM, \nmulai dari perencanaan, pelaksanaan, moneitoring dan evaluasi, serta pelaporan \nMBKM.  \n \nVI STANDAR PENGELOLAAN PEMBELAJARAN', '5. Surat persetujuan orang tua/wali (contoh terlampir)\n6. Surat pakta integritas (contoh terlampir\nPERTANYAAN YANG SERING DITANYAKAN\nT. Mahasiswa dari perguruan tinggi apa saja yang dapat mengikuti program Pertukaran Mahasiswa Merdeka?\nJ. Mahasiswa dari perguruan tinggi negeri maupun swasta non vokasi di bawah Direktorat Jenderal Pendidikan Tinggi, Kementerian Pendidikan, Kebudayaan, Riset, dan Tenologi RI.\nJ. Apakah Pertukaran Mahasiswa Merdeka 2021 untuk mahasiswa S1 saja?\nA. Pertukaran Mahasiswa Merdeka 2021 diperuntukkan untuk mahasiswa jenjang St.\nT. Apakah mahasiswa yang lolos akan menerima bantuan potongan\nUKT?\nJ. Mahasiswa akan menerima bantuan potongan UKT sebesar maksimal Rp 2.400.000 dengan syarat bukan penerima bantuan\nUKT dari beasiswa pemerintah lainnya.\nT. Bagaimana jika UKT saya lebih kecil dari 2,4 juta?\nJ. Bantuan UKT akan dibayarkan at cost (sesuai besaran UKT mahasiswa).', '31l83 0uluD 29 A0l 2U2120.0y mib\nFORMULIR PENDAFTARAN\nDalam Pertukaran Mahasiswa Merdeka (20 SKS), kamu bisa mengikuti perkuliahan luar jaringan di Perguruan Tinggi (PT) penerima dan dalam jaringan (maksimum 10 SKS) di beberapa PT mitra.\nUniversitas Luar Jaringan\nKalimantan\nsulawesi\nBali - NTT - NTB\nMaluku - Papua\nLainnya\n13. Selanjutnya mengisi pilihan Mata kuliah dalam jaringan (daring) yang ingin diikuti oleh pendaftar, dengan ketentuan jumlah SKS terpilih pada mata kuliah dalam jaringan yaitu maksimum 10 SKS.\nMahasiswa disarankan untuk mengambil 20 SKS secara luar jaringan (luring) di perguruan tinggi penerima.\nMata Kuliah Dalam Jaringan\nPilihan Mata Kuliah\nContoh pilihan beberapa Mata kuliah dan pendaftar bisa mencari menggunakan fitur Search dengan mengetik keyword Mata kuliah seperti pada gambar berikut:\nPilih Mata Kullah 1\nPilih Mata Kuliah 2\nSearch\nType keywords here\nKOMUNIKASI BISNIS\nUniversitas surabaya\nAkuntansi\nPANCASILA DAN KEWARGANEGARAAN\nFarmas']","Ya, mata kuliah pengayaan bisa di-drop seperti halnya mata kuliah lainnya. Jika masih dalam masa drop tiap semester, maka boleh (sampai dengan minggu 10). Setelah waktu itu tidak bisa, namun bisa digantikan dengan mata kuliah pengayaan lain yang diambil di semester berikutnya."
7,"MyITS saya bermasalah, bisa lapor kemana?",Silakan ajukan tiket ke DPTSI di https://servicedesk.its.ac.id/,"['Q: MyITS saya bermasalah, bisa lapor kemana?\n\nA: Silakan ajukan tiket ke DPTSI di https://servicedesk.its.ac.id/\n\nQ: Saya ingin mengurus â€œâ€¦..â€ siapa tendik yang harus ditemui?\n\nA: Temui tendik sesuai bidangnya yuk! :)\n\nPersuratan (S1) â†’ Pak Sugeng\nAkademik (S1) â†’ Bu Inka (Kelas, Nilai, MBKM, International Exposure), Bu Icha (Asisten Dosen, MonKP)\nAkademik + Persuratan (S2) â†’ Bu Kartika\nAkademik + Persuratan (S3) â†’ Bu Lina\nPeminjaman Ruang â†’ Pak Husein (Kasubbag)\nKeuangan â†’ Bu Devi, Bu Due\nUrusan Ruang Aula â†’ Pak Jumali\nUrusan Ruang Kelas â†’ Pak Edy\nUrusan Laboratorium â†’ Teknisi Lab. Pak Junaidi (PKT, KCV, LP), Pak Jumali (KBJ, RPL), Pak Gayuh (AP, MCI, GiGA), Pak Kunto (AJK).\nUrusan Keamanan dan Kebersihan â†’ Pak Sukron\nUrusan Kelistrikan â†’ Pak Hari\nQ: Cara mendapatkan transkrip\n\nA: Buka SIM Akademik, masuk ke menu LAPORAN -> TRANSKRIP\n\nQ: Cara mendapatkan surat keterangan aktif mahasiswa\n\nA: Buka SIM Akademik, masuk ke menu SURAT MAHASISWA -> LAYANAN SURAT MAHASISWA', 'Bersama dengan ini saya sertakan dokumen revisi TA saya dengan poin sebagai berikut:\n- perbaikan ....\nMohon berkenan memeriksa dan menginformasikan jika ada yang perlu saya perbaiki.\n\nDemikian, terima kasih\nAgus\n0511000..â€¦\n\nQ: Bagaimana mendapatkan surat keterangan yang tidak ada di menu integra, contoh surat keterangan selesai TA dan lulus >=144 SKS?\n\nA: kirim ke WA Pak Sugeng +62 856-4843-2445\n------------------------------------------------------------------------------\nKepada Yth\nBapak Ary Mazharuddin Shiddiqi\ndi tempat\n\nDengan hormat,\nDengan surat ini saya,\n\nNama: \nNRP: \nTempat/Tgl lahir: \nAlamat sekarang: \nSKS Lulus:\nemail aktif:\nNo HP aktif:\n\nBermaksud untuk mengajukan permohonan kepada Bapak Ary guna memperoleh Surat Keterangan Selesai Tugas Akhir.\n\nDemikian surat ini saya ajukan dan atas terkabulnya permohonan ini, saya ucapkan terimakasih\n\nSurabaya, .â€¦', '6. Apabila memerlukan informasi lebih lanjut dapat menghubungi dirpendikcare@its.ac.id atau di\ncall centre pada hari dan jam kerja melalui no (WA Text Only) 085186819604, 085186819605.\nB. Bagi semua calon wisudawan (Sarjana dan Sarjana Terapan) wajib menghadap dosen wali untuk persetujuan SKEM, serta wajib melakukan pengajuan SKPI di studentconnect paling lambat tanggal 9 Februari 2024;\nC. Ijazah dicetak berdasarkan data preview yang dipermanen oleh calon wisudawan. Ijazah dicetak hanya sekali saja, bila ada kekeliruan pengisian data pada point 3 maka akan diterbitkan surat keterangan.\nD.Pelaksanaan wisuda akan dilaksanakan secara offline (Informasi mengenai gladi bersih disampaikan lebih lanjut.\n Atas perhatian dan kerjasama yang diberikan, kami sampaikan terima kasih.\n Powered by TCPDF (www.tcpdf.org)\nTembusan Yth :\n1. Rektor ITS\n2. Kepala Bagian Administrasi Umum dan Kearsipan Digital 3. Sekretaris Institut\nSurabaya, 09 Januari 2024\nWakil Rektor Bidang Akademik dan Kemahasiswaan,', 'Subdit. PK2\nSKEMA PELAKSANAAN\nPROGRAM MAGANG\nMANDIRI DI ITS\nMahasiswa / Departemen melakukan\nmenyertakan:\n1. Proposal Magang\n2. Surat Rekomendasi Departemen\n3. Surat Penerimaan Magang\nPelaksanaan Magang\nProses pengurusan\nPKS\nPKS tidak\ndisetujui\nPKS\nTertandatangan\nSelesai\nMagang berakhir <\nMahasiswa mendapatkan\nSertifikat / Penilaian Magang\nSelesai\nADVANCING HUMANITY\niTS\nMulai\nMahasiswa mengurus\nsurat rekomendasi\ndepartemen untuk pengajuan magang ke\nMitra\nMahasiswa mengajukan\npermohonan magang ke\nMitra\nMitra melakukan seleksi magang\nMahasiswa menerima hasil seleksi magang dari Mitra\nTidak diterima\nSelesai\nDiterima\nMahasiswa melaporkan\nke Departemen']",Anda dapat melaporkan masalah MyITS Anda dengan mengajukan tiket ke DPTSI di https://servicedesk.its.ac.id/
8,Berapa koordinat latitude langitude ITS Surabaya?,Tidak tahu,"['3. Name of Examiner and academic title                     Examiner\n\n\n4. Name of Examiner and academic title                     Examiner\n\n\n5. Name of Examiner and academic title                     Examiner\n\n\n\n                                  SURABAYA\n                                   Month, Year\n\n                                                                        26\n\x0cLAMPIRAN 3: Contoh Format Abstrak Bahasa Indonesia\n\n    ANALISA PENGARUH PANJANG LINKAGE TERHADAP RESPON SERIES\n          ACTIVE VARIABLE GEOMETRY SUSPENSION (SAVGS)\n\n\nNama Mahasiswa / NRP         : Asmone Siswo / 02112040000130\nDepartemen                   : Teknik Mesin FTIRS - ITS\nDosen Pembimbing             : Nama pembimbing dan gelar', 'KEMENTERIAN PENDIDIKAN, KEBUDAYAAN,\nRISET, DAN TEKNOLOGI\nINSTITUT TEKNOLOGI SEPULUH NOPEMBER\nDIREKTORAT PERENCANAAN DAN PENGEMBANGAN\nKampus ITS Sukolilo Surabaya 60111\nTelepon: 031-5939632, PABX 1292, 1006, 1010, 1007, 1111\nFax: 031-5939632\nemail: tu_dpal@its.ac.id\nSurat Pengumuman\nNomor : 7244/IT2.II.1/B/TU.00.02/2023\nPENGUMUMAN PERIHAL PERMOHONAN KERINGANAN UKT/SPP\nSEMESTER GENAP 2023/2024\nDitujukan kepada Mahasiswa ITS Program Sarjana dan Sarjana Terapan.\nBagi mahasiswa ITS yang berencana melakukan permohonan keringanan UKT/SPP, maka diharapkan dapat memperhatikan\nbeberapa hal sebagaimana berikut:\n1. Permohonan Keringanan UKT/SPP dapat dilakukan melalui sipmaba.its.ac.id, di mana hanya diperkenankan untuk\nmahasiswa sarjana dan mahasiswa vokasi / sarjana terapan (selain mahasiswa IUP dan Joint Degree). Pada saat\nperiode pengajuan, Mahasiswa yang dimaksud disyaratkan saat ini minimal akan memasuki semester 2 (dua)', 'KEMENTERIAN PENDIDIKAN, KEBUDAYAAN,\r\nRISET, DAN TEKNOLOGI\r\nINSTITUT TEKNOLOGI SEPULUH NOPEMBER\r\nDIREKTORAT PERENCANAAN DAN PENGEMBANGAN\r\nKampus ITS Sukolilo Surabaya 60111\r\nTelepon: 031-5939632, PABX 1292, 1006, 1010, 1007, 1111\r\nFax: 031-5939632\r\nemail: tu_dpal@its.ac.id\r\nSurat Pengumuman\r\nNomor : 7244/IT2.II.1/B/TU.00.02/2023\r\nPENGUMUMAN PERIHAL PERMOHONAN KERINGANAN UKT/SPP\r\nSEMESTER GENAP 2023/2024\r\nDitujukan kepada Mahasiswa ITS Program Sarjana dan Sarjana Terapan.\r\nBagi mahasiswa ITS yang berencana melakukan permohonan keringanan UKT/SPP, maka diharapkan dapat memperhatikan\r\nbeberapa hal sebagaimana berikut:\r\n1. Permohonan Keringanan UKT/SPP dapat dilakukan melalui sipmaba.its.ac.id, di mana hanya diperkenankan untuk\r\nmahasiswa sarjana dan mahasiswa vokasi / sarjana terapan (selain mahasiswa IUP dan Joint Degree). Pada saat\r\nperiode pengajuan, Mahasiswa yang dimaksud disyaratkan saat ini minimal akan memasuki semester 2 (dua)', 'KEMENTERIAN PENDIDIKAN, KEBUDAYAAN, RISET, DAN TEKNOLOGI\r\nINSTITUT TEKNOLOGI SEPULUH NOPEMBER\r\n       Kampus ITS Sukolilo - Surabaya 60111 Telepon : 031-5994251-54, 5947274, 5945472 (Hunting)\r\nFax: 031-5947264, 5950806\r\nhttp://www.its.ac.id\r\n\r\n\r\nPERATURAN REKTOR INSTITUT TEKNOLOGI SEPULUH NOPEMBER NOMOR 22 TAHUN 2021\r\n\r\nTENTANG\r\n\r\nPENYELENGGARAAN KEGIATAN MERDEKA BELAJAR - KAMPUS MERDEKA DI INSTITUT TEKNOLOGI SEPULUH NOPEMBER\r\n\r\n      DENGAN RAHMAT TUHAN YANG MAHA ESA REKTOR INSTITUT TEKNOLOGI SEPULUH NOPEMBER,\r\nMenimbang : a. bahwa dalam rangka Institut Teknologi Sepuluh Nopember menuju perguruan tinggi dengan reputasi internasional (world class university) dalam ilmu pengetahuan dan teknologi, dipandang perlu menyusun peraturan penyelenggaraan kegiatan merdeka belajar - kampus merdeka yang mendukung perihal tersebut;']",Saya tidak tahu.
9,Bagaimana SKEM membantu Departemen di ITS?,SKEM membantu Departemen untuk mendapatkan data pemetaan profil mahasiswa guna pengembangan soft skills dan untuk keperluan akreditasi internasional.,"['Dosen & Tendik di Departemen Teknik Informatika ðŸ‘¥\nNama Dosen/Tendik,Kode Dosen,RMK,Email,NIP/NPP,Role Tendik,PIC Laboratorium\n""Prof. Ir. Supeno Djanali, M.Sc., Ph.D."",SD,AJK,supeno@its.ac.id,8859390019,,\n""Prof. Ir. Handayani Tjandrasa, M.Sc., Ph.D."",HT,KCV,handatj@its.ac.id,8866323419,,\n""Prof. Drs.Ec. Ir. Riyanarto Sarno, M.Sc., Ph.D."",RS,MCI,riyanarto@if.its.ac.id,19590803 198601 1 001,,\n""Prof. Dr. Ir. Joko Lianto Buliali, M.Sc."",JL,PKT,joko@if.its.ac.id,19670727 199203 1 002,,\n""Ir. Siti Rochimah, M.T., Ph.D."",ST,RPL,siti@if.its.ac.id,19681002 199403 2 001,,\n""Victor Hariadi, S.Si., M.Kom."",VH,PKT,victor@if.its.ac.id,19691228 199412 1 001,,\n""Rully Soelaiman, S.Kom., M.Kom."",RL,AP,rully@if.its.ac.id,19700213 199402 1 001,,\n""Dr. Yudhi Purwananto, S.Kom., M.Kom."",YP,AP,yudhi@if.its.ac.id,19700714 199703 1 002,,\n""Prof. Dr.Eng. Nanik Suciati, S.Kom., M.Kom."",NS,KCV,nanik@if.its.ac.id,19710428 199412 2 001,,', 'nyata adalah sebagai berikut.\n1) Perguruan Tinggi\na) Menjalin kerja sama dengan pihak Kementerian Desa PDTT, serta Kemdikbud \ndalam penyelenggaraan program proyek di desa atau menjalin kerja sama \nlangsung dengan pemerintah daerah untuk penyelenggaraan program \nproyek di desa.\nb) Mengelola pendaftaran dan penempatan mahasiswa ke desa tujuan.\nc) Menugaskan dosen pembimbing yang akan membimbing mahasiswa selama \nKKNT.\nd) Bila dimungkinkan pembimbing melakukan kunjungan di lokasi KKNT untuk \nmonitoring dan evaluasi.\ne) Memberangkatkan dan memulangkan   mahasiswa    dari kampus ke lokasi \npenempatan program.\nf) Memberikan pembekalan, pemeriksaan kesehatan, dan menyediakan \njaminan kesehatan dan keselamatan kepada mahasiswa calon peserta KKNT.\ng) Perguruan tinggi menyusun SOP pelaksanaan KKNT dengan \nmempertimbangkan jaminan Keamanan dan Keselamatan Mahasiswa \nselama di lapangan.\nh) Perguruan tinggi memberikan pembekalan tentang kearifan lokal masyarakat', 'Menghubungi dosen pembimbing yang sudah ditentukan oleh koordinator KP\nMematuhi dan mengikuti segala aturan terkait kerja praktik di perusahaan/tempat KP\nMengerjakan pekerjaan yang sesuai dengan kompetensi Informatika\nProgress report secara reguler ke dosen pembimbing dan pembimbing lapangan sesuai kesepakatan dengan pembimbing\nPenilaian KP oleh Pembimbing Lapangan\nSudah menyelesaikan segala tugas/pekerjaan yang diberikan pembimbing lapangan di tempat KP\nMeminta pembimbing lapangan untuk mengisi Formulir Penilaian Kerja Praktik Lapangan dilengkapi dengan stempel resmi perusahaan (beberapa perusahaan memiliki format penilaian sendiri)\nSetelah KP selesai\n6. Penilaian KP oleh Dosen Pembimbing', 'sebagai pimpinan perguruan tinggi; \n2) Pimpinan PT bertugas menentukan penanggung \njawab dari masing-masing prodi atau fakultas \nuntuk bertindak sebagai pihak yang akan \nmerekomendasikan mahasiswa untuk mengikuti \nprogram MBKM; dan \n3) Pimpinan PT bertugas memberikan persetujuan \nakhir daftar mahasiswa setelah mendapatkan \nrekomendasi dari prodi atau fakultas pada laman Penanggung Jawab Fakultas atau Prodi, bertugas untuk: \n1) Melakukan verifikasi kebenaran data dan dokumen \nmahasiswa yang akan mendaftar Program flagship \nMBKM; \n2) Memberikan rekomendasi kepada mahasiswa untuk \nmengikuti Program flagship MBKM; dan \n3) melakukan koordinasi dengan mkhasiswa apabila \nterdapat data atau dokumen yang perlu diperbaiki. \n2023 Subdit. PK2 \nKebutuhan Perbaikan dan Pengembangan Platform \n2023 Subdit. PK2 \n2023 Subdit. PK2 \nDIGITALISASI SPTJM DAN SR \n2023 \nSubdit. PK2 \n5\n2023 Subdit. PK2 \nKebutuhan Perbaikan dan Pengembangan Platform 2023 Subdit. PK2 \nProses Sebelum: Surat Rekomendasi dan']","SKEM membantu Departemen di ITS dengan menjalin kerja sama dengan pihak Kementerian Desa PDTT, serta Kemdikbud dalam penyelenggaraan program proyek di desa atau menjalin kerja sama langsung dengan pemerintah daerah untuk penyelenggaraan program proyek di desa. Selain itu, SKEM juga mengelola pendaftaran dan penempatan mahasiswa ke desa tujuan, menugaskan dosen pembimbing yang akan membimbing mahasiswa selama KKNT, memberangkatkan dan memulangkan mahasiswa dari kampus ke lokasi penempatan program, memberikan pembekalan, pemeriksaan kesehatan, serta menyediakan jaminan kesehatan dan keselamatan kepada mahasiswa calon peserta KKNT. SKEM juga membantu perguruan tinggi dalam menyusun SOP pelaksanaan KKNT dengan mempertimbangkan jaminan Keamanan dan Keselamatan Mahasiswa selama di lapangan, serta memberikan pembekalan tentang kearifan lokal masyarakat kepada mahasiswa."
10,Mengapa penting untuk mengunggah kegiatan mahasiswa di myITS StudentConnect? ,"Karena bukti atau dokumen pendukung kegiatan SKEM harus diunggah di myITS StudentConnect dalam waktu satu tahun semenjak selesai kegiatan, jika melebihi batas waktu tersebut, kegiatan dinyatakan tidak berlaku.","['jawab terhadap kegiatan mahasiswa dari awal sampai dengan akhir.\nb) Pembimbing pendamping   dari pemerintah desa di lokasi setempat.\nc) Melibatkan unsur-unsur mitra, misalnya Penggerak Swadaya Masyarakat \n(PSM) maupun unsur lain sesuai lingkup kegiatan.\nd) Dosen pendamping bersama pembimbing di desa melakukan pembimbingan \ndan   penilaian terhadap program yang dilakukan mahasiswa.  \ne) Ketentuan lain dapat diatur oleh perguruan tinggi pelaksana.25       Buku Panduan Merdeka Belajar - Kampus Merdeka\n4) Lokasi Pelaksanaan\na)  Lokasi berdasarkan rekomendasi dari Direktorat Jenderal Pendidikan Tinggi.\nb)  Lokasi pelaksanaan di desa sangat tertinggal, tertinggal dan berkembang.\nc)  Desa-desa Binaan Perguruan Tinggi Pelaksana.\nd)  Radius desa lokasi KKNT dengan Perguruan Tinggi dirancang 200 km.\ne) Desa lainnya yang diusulkan oleh Mitra (Pemda, Industri, dan lainnya.\n5) Mitra\na) Pemerintah (Kemendes, Desa binaan PT, Kemkes, PUPR, Kementan, Kemensos,', 'juga dapat memanfaatkan Program Holistik Pembinaan dan Pemberdayaan Desa \n(PHP2D) dengan mengikuti prosedur dari Direktorat Belmawa.\n27       Buku Panduan Merdeka Belajar - Kampus Merdeka\nContoh Model KKNT Pembangunan dan Pemberdayaan bersama Kemendes\nContoh Model KKNT Pembangunan dan Pemberdayaan bersama Mitra\nBuku Panduan Merdeka Belajar - Kampus Merdeka       28\n3) Model KKNT Mengajar di Desa\nPelaksanaan kegiatan ini diutamakan pada mahasiswa program studi Pendidikan. \nBagi mahasiswa di luar program studi Pendidikan dapat melakukan kegiatan \nmengajar sesuai dengan bidang keahlian dalam rangka pemberdayaan \nmasyarakat misalnya penerapan teknologi tepat guna. Semua kegiatan KKNT \nmengajar ini bersifat membantu pengajaran formal dan non-formal. Bila di akhir \nkegiatan ini akan dijadikan sebagai tugas akhir, maka harus direncanakan sejak \nawal dalam bentuk proposal yang mengacu pada aturan prodi.\nContoh Model KKNT Mengajar di Desa\n4) Model KKNT Free Form', 'PENGALAMAN TENTANG KEBUDAYAAN DAERAH LAIN\nMELALUI MODUL NUSANTARA\nSelain mengikuti pembelajaran mata kuliah di perguruan tinggi penerima, mahasiswa yang mengikuti program Pertukaran Mahasiswa Merdeka juga akan mendapatkan pengalaman langsung berinteraksi dengan mahasiswa dari daerah lain dan mempelajari kebudayaan daerah lain melalui Modul Nusantara. Modul Nusantara ini senilai 2 sks dan wajib diambil oleh mahasiswa peserta program Pertukaran Mahasiswa Merdeka. Modul Nusantara dilaksanakan di perguruan tinggi penerima. Modul Nusantara dibagi ke dalam empat jenis kegiatan yaitu kebinekaan, inspirasi, refleksi, dan kontribusi sosial. Dalam pelaksanaan Modul Nusantara, mahasiswa akan dibimbing oleh dosen pembimbing modul nusantara dan dibantu oleh mentor.\nBAGAIMANA MEKANISME PELAKSANAAN PERTUKARAN\nMAHASISWA MERDEKA?\nTerdapat dua mekanisme, yaitu:', 'Hal-Hal Teknis Pokok SKEM\nâ€¢ Mahasiswa wajib melakukan Upload kegiatannya dengan batas waktu 1 tahun. Jika dalam\nmasa 1 tahun kegiatan tersebut belum di Upload ke sistem maka kegiatan tersebut dinyatakan\nhangus/tidak bisa digunakan dalam SKEM.\nâ€¢ Kegiatan yang sudah di Upload di system dapat dipakai untuk pengajuan SKEM di semester\nberikutnya.\nâ€¢ Dalam pengajuan SKEM, mahasiswa dapat memilih beberapa kegiatan yang sudah ter-\nUpload untuk diajukan sebagai SKEM. Jika ada kegiatan yang berlebih maka kegiatan lebih\ntersebut dapat dipakai untuk SKEM di semester yang lain.\nâ€¢ Kegiatan yang dilakuakan sebelum menjadi mahasiswa ITS tidak diakui sebagai kegiatan\nyang dapat diajukan untuk SKEM.\nâ€¢ Batas minimal kewajiban pemenuhan SKEM adalah sampai semester 6. Jika mahasiswa\nsudah memiliki kredit SKEM diatas 100 dan IPK min 2,1 pada semester 6, maka pada\nsemester 7 dan 8 sudah tidak wajib memenuhi syarat SKEM.']","Penting untuk mengunggah kegiatan mahasiswa di myITS StudentConnect karena kegiatan tersebut akan menjadi bagian dari Sistem Kredit Ekstrakurikuler Mahasiswa (SKEM) yang merupakan salah satu syarat kelulusan di perguruan tinggi. Dengan mengunggah kegiatan, mahasiswa dapat memperoleh kredit SKEM yang diperlukan untuk memenuhi syarat kelulusan. Selain itu, dengan mengunggah kegiatan, mahasiswa juga dapat melacak dan mencatat aktivitas dan prestasi yang telah dicapai selama masa kuliah mereka."
11,Sebutkan salah satu dasar hukum perubahan peraturan ini.,Undang-Undang Nomor 12 Tahun 2012 tentang Pendidikan Tinggi.,"['tentang Perubahan atas Peraturan Rektor Institut Teknologi Sepuluh \n   Nopember Nomor 24 Tahun 2019 tentang Organisasi dan Tata Kerja \n   Institut Teknologi Sepuluh Nopember;\n13. Peraturan Rektor Institut Teknologi Sepuluh Nopember Nomor 25 \n   Tahun 2019 tentang Organisasi dan Tata Kerja Fakultas di \n   Lingkungan Institut Teknologi Sepuluh Nopember sebagaimana telah \n   diubah terakhir dengan Peraturan Rektor Institut Teknologi Sepuluh \n   Nopember Nomor 2 Tahun 2023 Perubahan Kedua Atas Peraturan \n   Rektor Institut Teknologi Sepuluh Nopember Nomor 25 Tahun 2019 \n   tentang Organisasi dan Tata Kerja Fakultas di Lingkungan Institut \n   Teknologi Sepuluh Nopember;\n14. Peraturan Rektor Institut Teknologi Sepuluh Nopember Nomor 26 \n   Tahun 2019 tentang Organisasi dan Tata Kerja Sekretaris Institut, \n   Direktorat, Biro, Kantor, Perpustakaan, dan Unit di Lingkungan \n   Institut Teknologi Sepuluh Nopember; Peraturan Rektor Institut', 'Untuk      Program          Pendidikan         Akademik       Institut\n     Teknologi      Sepuluh             Nopember         Tahun       2019\n     sebagaimana diubah dengan Peraturan Rektor Institut\n     Teknologi Sepuluh Nopember Nomor 21 Tahun 2021\n     tentang    Perubahan         Ketiga     Atas    Peraturan     Rektor\n     Institut Teknologi Sepuluh Nopember Nomor 32 Tahun\n     2019 tentang Peraturan Akademik Untuk Program\n     Pendidikan    Akademik             Institut    Teknologi     Sepuluh\n     Nopember Tahun 2019;\n11. Peraturan Rektor Institut Teknologi Sepuluh Nopember\n     Nomor 26 Tahun 2020 tentang Peraturan Akademik\n     Program Vokasi Institut Teknologi Sepuluh Nopember\n     Tahun 2020;\n12. Peraturan Rektor Institut Teknologi Sepuluh Nopember\n     Nomor 11 Tahun 2021 tentang Organisasi dan Tata\n     Kerja     Sekolah    di      Lingkungan         Institut    Teknologi\n\x0c                       Sepuluh Nopember;', 'Menimbang   :    a.   bahwa Peraturan Rektor Institut Teknologi Sepuluh\n                      Nopember Nomor 12 Tahun 2019 tentang Baku Mutu\n                      Magang Program Studi Sarjana Terapan dan Sarjana\n                      perlu     dilakukan        penyesuaian      untuk         mengikuti\n                      perkembangan yang ada;\n                 b.   bahwa rancangan perubahan atas Peraturan Rektor\n                      Institut Teknologi Sepuluh Nopember Nomor 12 Tahun\n                      2019    tentang    Baku      Mutu       Magang     Program    Studi\n                      Sarjana     Terapan     dan   Sarjana      telah    mendapatkan\n                      pertimbangan       Senat      Akademik      Institut      Teknologi\n                      Sepuluh Nopember berdasarkan Berita Acara Sidang\n                      Pleno Senat       Akademik         Institut Teknologi Sepuluh\n                      Nopember Nomor T/61733/IT2.XI/TU.00.03.01/2021;', '8. Peraturan Rektor Institut Tek:nologi Sepuluh Nopember Nomor 16 Tahun 2019 tentang Hak dan Kewajiban Mahasiswa lnstitut Tek:nologi Sepuluh Nopember;\n9. Peraturan Rektor Institut Tek:nologi Sepuluh Nopember Nomor 24 Tahun 2019 tentang Organisasi dan Tata Kerja Institut Tek:nologi Sepuluh Nopember sebagaimana telah diubah dengan Peraturan Rektor Institut Teknologi Sepuluh Nopember Nomor 30 Tahun 2022 tentang Perubahan atas Peraturan Rektor Institut Teknologi Sepuluh Nopember Nomor 24 Tahun 2019;\n10. Peraturan Rektor Institut Teknologi Sepuluh Nopember Nomor 26 Tahun 2019 tentang Organisasi dan Tata Kerja Sekretaris lnstitut, Direktorat, Biro, Kantor, Perpustakaan, dan Unit di Lingkungan Institut Teknologi Sepuluh Nopember sebagaimana telah diubah terakhir dengan Peraturan Rektor Institut Teknologi Sepuluh Nopember Nomor 22 Tahun 2022 tentang Perubahan Kedua Peraturan Rektor Institut Teknologi Sepuluh Nopember Nomor 26 Tahun 2019;']",Salah satu dasar hukum perubahan peraturan ini adalah Peraturan Rektor Institut Teknologi Sepuluh Nopember Nomor 12 Tahun 2019 tentang Baku Mutu Magang Program Studi Sarjana Terapan dan Sarjana yang perlu dilakukan penyesuaian untuk mengikuti perkembangan yang ada.
12,Apa yang terjadi jika mahasiswa tidak membayar UKT atau SPP? ,"Status mahasiswa dinyatakan tidak aktif dan jika tidak membayar selama 2 semester berturut-turut, dinyatakan mengundurkan diri.","['Pasal 5\n(1) Mahasiswa wajib membayar UKT atau SPP sesuai kriteria sebagaimana dimaksud \n  dalam Pasal 4 secara penuh pada semester berjalan agar terdaftar sebagai. Mahasiswa \n  aktif.\n(2) Mahasiswa sebagaimana dimaksud pada ayat (1) dapat dikecualikan dari kewajiban \n  membayar UKT atau SPP secara penuh apabila memenuhi ketentuan sebagai berikut:\n  a. Mahasiswa program magister yang telah menyelesaikan semua mata kuliah \n    termasuk tesis, tetapi belum memenuhi persyaratan lulus yudisium;\n  b. Mahasiswa program doktor yang telah lulus ujian tertutup pada semester \n    sebelumnya dan masih harus menyelesaikan perbaikan disertasinya melewati \n    masa yudisium institut; atau\n  e. Mahasiswa aktif tidak berbeasiswa yang mengikuti kegiatan akademik di luar ITS\n    selama paling sedikit 8 (delapan) minggu dalam 1 (satu) semester, berupa:\n    1. program exchange dengan perguruan tinggi mitra luar negeri untuk program \n     pascasarjana; atau', 'Pasal 5\n(1) Mahasiswa wajib membayar UKT atau SPP sesuai kriteria sebagaimana dimaksud \n  dalam Pasal 4 secara penuh pada semester berjalan agar terdaftar sebagai. Mahasiswa \n  aktif.\n(2) Mahasiswa sebagaimana dimaksud pada ayat (1) dapat dikecualikan dari kewajiban \n  membayar UKT atau SPP secara penuh apabila memenuhi ketentuan sebagai berikut:\n  a. Mahasiswa program magister yang telah menyelesaikan semua mata kuliah \n    termasuk tesis, tetapi belum memenuhi persyaratan lulus yudisium;\n  b. Mahasiswa program doktor yang telah lulus ujian tertutup pada semester \n    sebelumnya dan masih harus menyelesaikan perbaikan disertasinya melewati \n    masa yudisium institut; atau\n  e. Mahasiswa aktif tidak berbeasiswa yang mengikuti kegiatan akademik di luar ITS\n    selama paling sedikit 8 (delapan) minggu dalam 1 (satu) semester, berupa:\n    1. program exchange dengan perguruan tinggi mitra luar negeri untuk program \n     pascasarjana; atau', 'Pasal 12\n(1) Mahasiswa dapat menerima penyesuaian pembayaran nilai UKT atau SPP dengan \n  kondisi sebagai berikut:\n  a. Mahasiswa program sarjana dan sarjana terapan penerima beasiswa KIP-K yang \n   berada pada semester XI dan seterusnya, diwajibkan membayar UKT atau SPP \n   berdasarkan hasil evaluasi kemampuan ekonomi orang tua/wali Mahasiswa;\n  b. Mahasiswa program studi magister yang berada pada semester VII dan \n   seterusnya, diwajibkan membayar SPP senilai SPP yang dikenakan kepada \n   Mahasiswa baru program magister tersebut pada semester berjalan;\n  c. Mahasiswa program studi doktor yang berada pada semester XIII dan seterusnya, \n   diwajibkan membayar SPP senilai SPP yang dikenakan kepada Mahasiswa Baru \n   program doktor pada semester berjalan; dan/atau\n  d. Mahasiswa program pascasarjana yang berpindah jenis kelas diwajibkan \n   membayar SPP untuk jenis kelas dengan tarif lebih tinggi.', 'Pasal 12\n(1) Mahasiswa dapat menerima penyesuaian pembayaran nilai UKT atau SPP dengan \n  kondisi sebagai berikut:\n  a. Mahasiswa program sarjana dan sarjana terapan penerima beasiswa KIP-K yang \n   berada pada semester XI dan seterusnya, diwajibkan membayar UKT atau SPP \n   berdasarkan hasil evaluasi kemampuan ekonomi orang tua/wali Mahasiswa;\n  b. Mahasiswa program studi magister yang berada pada semester VII dan \n   seterusnya, diwajibkan membayar SPP senilai SPP yang dikenakan kepada \n   Mahasiswa baru program magister tersebut pada semester berjalan;\n  c. Mahasiswa program studi doktor yang berada pada semester XIII dan seterusnya, \n   diwajibkan membayar SPP senilai SPP yang dikenakan kepada Mahasiswa Baru \n   program doktor pada semester berjalan; dan/atau\n  d. Mahasiswa program pascasarjana yang berpindah jenis kelas diwajibkan \n   membayar SPP untuk jenis kelas dengan tarif lebih tinggi.']","Jika mahasiswa tidak membayar UKT atau SPP, maka mahasiswa tersebut tidak akan terdaftar sebagai mahasiswa aktif sesuai dengan Pasal 5 ayat (1) dari Peraturan Rektor No. 5/2023 Dana Pendidikan ITS."
13,Apa saja peran Penanggung Jawab Fakultas atau Prodi dalam program MBKM?,"Penanggung Jawab Fakultas atau Prodi bertugas melakukan verifikasi data dan dokumen mahasiswa, memberikan rekomendasi kepada mahasiswa untuk mengikuti Program MBKM, dan melakukan koordinasi jika ada data yang perlu diperbaiki.","['Penanggungjawab Fakultas atau Prodi\nPenanggung Jawab Fakultas atau Prodi, bertugas untuk:\n1)\n2)\n3\nMelakukan verifikasi kebenaran data dan dokumen mahasiswa yang akan mendaftar Program flagship\nMBKM;\nMemberikan rekomendasi kepada mahasiswa untuk mengikuti Program flagship MBKM; dan melakukan koordinasi dengan mkhasiswa apabila terdapat data atau dokumen yang perlu diperbaiki.\n2023', '1.\n2.\n3.\nsubdit. PK2\n1\nPENUGASAN PENANGGUNG JAWAB FAKULTAS/PRODI\nDaftar Program Studi\nProgram studi vana me\nenuhi svarat menaikuti Kamous Merdeka â€¢ Semester Ganiil 2023/2024\n3\nÂ® Lihat Panduan\nanggung Jawab Fakultas/Prodi adalah perwakilan program studi yang bertugas untuk memberikan izi\nemik manasiswa untuk meno kuri orocram Kamous Meraeka.\nla berands\nSiapa itu Penanaguna Jawab Fakultas/Prodi?\nPenanggung Jawab Fakultas/Prodi adalah perwakilan program studi yang bertugas untuk memberikan izin dan melakukan verifikasi data\n4 Segera si email Penancauna Jawab untuk 114 program studi selambat-lambatnva tancaal 28 Oktober 20231\nram Studi\nSegera lengkapi email Penanggung Jawab\nFakultas/Prodi!\nPastikan Anda seluruh program studi memiliki emil Penanggung Jawab memverifikasi data\nmahasiswa.\n2\nMasukkan nama program studi/email\nProgram StudiA-Z\nMemperlihatkan 114 Program Studi l\nPenanggung\nJawab\nProgram Stud\nEmail Penanggung Jawat\nTotal Prodi\n114\nBelum ada Penanggung Jawab\n114\nMasukkan\nMasukkan', 'sebagai pimpinan perguruan tinggi; \n2) Pimpinan PT bertugas menentukan penanggung \njawab dari masing-masing prodi atau fakultas \nuntuk bertindak sebagai pihak yang akan \nmerekomendasikan mahasiswa untuk mengikuti \nprogram MBKM; dan \n3) Pimpinan PT bertugas memberikan persetujuan \nakhir daftar mahasiswa setelah mendapatkan \nrekomendasi dari prodi atau fakultas pada laman Penanggung Jawab Fakultas atau Prodi, bertugas untuk: \n1) Melakukan verifikasi kebenaran data dan dokumen \nmahasiswa yang akan mendaftar Program flagship \nMBKM; \n2) Memberikan rekomendasi kepada mahasiswa untuk \nmengikuti Program flagship MBKM; dan \n3) melakukan koordinasi dengan mkhasiswa apabila \nterdapat data atau dokumen yang perlu diperbaiki. \n2023 Subdit. PK2 \nKebutuhan Perbaikan dan Pengembangan Platform \n2023 Subdit. PK2 \n2023 Subdit. PK2 \nDIGITALISASI SPTJM DAN SR \n2023 \nSubdit. PK2 \n5\n2023 Subdit. PK2 \nKebutuhan Perbaikan dan Pengembangan Platform 2023 Subdit. PK2 \nProses Sebelum: Surat Rekomendasi dan', 'data dari Prodi yang ada di platform dengan Prodi di PT, harap melaporkan hal tersebut melalui Pusat Bantuan.\nâ€¢ Satu email penanggung jawab dapat digunakan untuk beberapa prodi sekaligus.\nâ€¢ Pimpinan PT akan menerima hasil verifikasi data mahasiswa dari Penanggung Jawab\nFakultas/Profi\nâ€¢ Pimpinan PT dapat memberikan rekomendasi secara sekaligus (bulk approval)\nâ€¢ Pimpinan PT memberikan persetujuan rekomendasi dan\nmengunggah file tanda tangan sesuai ketentuan yang berlaku\n2023']","Penanggung Jawab Fakultas atau Prodi memiliki beberapa peran dalam program MBKM, antara lain:
1. Melakukan verifikasi kebenaran data dan dokumen mahasiswa yang akan mendaftar Program flagship MBKM.
2. Memberikan rekomendasi kepada mahasiswa untuk mengikuti Program flagship MBKM.
3. Melakukan koordinasi dengan mahasiswa apabila terdapat data atau dokumen yang perlu diperbaiki."
14,Bagaimana penilaian prestasi mahasiswa dilakukan oleh mitra magang?,"Mitra magang memberikan penilaian berdasarkan formulir penilaian yang meliputi aspek-aspek seperti inisiatif, kemampuan komunikasi, disiplin, penampilan, ketekunan, kemampuan teknikal, berpikir kritis, kemampuan bekerjasama, kemampuan beradaptasi, dan hasil pekerjaan (kontribusi), yang kemudian diserahkan ke departemen untuk verifikasi.","['3. Ayat 14, Penetapan predikat kelulusan ditentukan berdasarkan Indeks Prestasi Kumulatif\n    Predikat (IPKP) dan masa studi.\n\nAtas perhatian dan kerjasama yang diberikan, kami sampaikan terima kasih.\n\n\n                                                    Wakil Rektor Bidang Akademik dan\n                                                    Kemahasiswaan,\n\n\n\n\n                                                    Prof. Dr. Ir. Adi Soeprijanto, M.T.\n                                                    NIP. 196404051990021001\n\nTembusan :\n- Kepala Bagian Administrasi Umum dan Kearsipan Digital', 'cara observasi (kepribadian dan sosial) sebagai teknik utama. Sedangkan penilaian \nhasil dilaksanakan pada akhir pelaksanaan program dengan menggunakan laporan \nyang dibuat oleh mahasiswa. Penilaian dilakukan oleh pendamping dari Pihak Ketiga \nyang terkait dengan kegiatan yang diambil oleh mahasiswa dan dosen pendamping di \nPerguruan Tinggi.\nSelain komponen diatas, perguruan tinggi diwajibkan untuk membuat sistem berupa \nsurvey online  tentang pengalaman dan penilaian mahasiswa terhadap kualitas program \nmerdeka belajar yang mereka jalani selama satu semester diluar program studi. Hal ini dapat \ndigunakan untuk mendapatkan umpan balik dari mahasiswa sebagai sarana evaluasi bagi \nperguruan tinggi dalam mengembangkan program berikutnya.C. Melaksanakan Monitoring dan Evaluasi33       Buku Panduan Merdeka Belajar - Kampus Merdeka\nBAB IV\nPENUTUP\nDemikian buku panduan ini disusun, semoga bermanfaat bagi perguruan tinggi dan dapat', 'melaksanakan program magang industri. Fokus evaluasi adalah individu mahasiswa, yaitu \nprestasi yang dicapai dalam pelaksanaan magang oleh mahasiswa. Melalui evaluasi akan \ndiperoleh tentang apa yang telah dicapai dan apa yang belum dicapai oleh mahasiswa \nselama mengikuti kegiatan.  Evaluasi dapat memberikan informasi terkait kemampuan apa \nyang telah dicapai oleh mahasiswa selama mengikuti program.  Selain itu, melalui evaluasi \ndapat dilakukan judgment terhadap nilai atau implikasi dari hasil program. Selanjutnya, \nprogram ini digunakan untuk meningkatkan kompetensi mahasiswa.\n1. Prinsip Penilaian\nPenilaian dalam pelaksanaan kebijakan Merdeka Belajar - Kampus Merdeka, program \nâ€œhak belajar tiga semester di luar program studiâ€ mengacu kepada 5 (lima) prinsip sesuai \nSNPT yaitu edukatif, otentik, objektif, akuntabel, dan transparan yang dilakukan secara \nterintegrasi.\n2. Aspek â€“ aspek Penilaian\nSejalan dengan prinsip-prinsip penilaian di atas, maka aspek-aspek yang dinilai dalam', '4. Hasil penilaian dilakukan dengan cara mengisi formulir yang ada dan diserahkan\npada departemen.\n8.2\nPENILAIAN PRESTASI KINERJA MAGANG\nOLEH UNIT MITRA MAGANG\nDalam melakukan kegiatan magang, mahasiswa akan memperoleh penilaian dari unit tempat magang. Formulir penilaian magang diisi dan ditandatangani oleh atasan yang berwenang di tempat magang (minimal level manajer) dan dicap menggunakan stempel unit tempat magang. Berikut adalah butir penilaian kinerja magang:\n52\n08 Penilaian Magang']",Penilaian prestasi mahasiswa dilakukan oleh mitra magang dengan cara mahasiswa akan memperoleh penilaian dari unit tempat magang. Formulir penilaian magang diisi dan ditandatangani oleh atasan yang berwenang di tempat magang (minimal level manajer) dan dicap menggunakan stempel unit tempat magang. Penilaian kinerja magang meliputi berbagai butir penilaian yang akan digunakan untuk mengevaluasi prestasi mahasiswa selama menjalani kegiatan magang.
15,"Proyek P13 ""Application of Novel Snap-shot based Hyperspectral Imaging Combined with AI to Detect Lesions"" menggunakan metode apa?","Proyek ini menggunakan model pembelajaran mesin seperti YOLOv5, YOLOv8, R-CNN, dan Faster R-CNN untuk mendeteksi kanker esofagus stadium awal menggunakan model gambar cahaya putih (WLI) dan gambar narrowband hiperspektral (HSI-NBI).","['â–  Post-graduate student\r\nâ–  Third/forth-year undergraduate senior student\r\nCategory\r\nâ–  Scholarship\r\nâ–  Self-supported\r\nIntern period At least 8 weeks between May and December 2024\r\n\r\nNumber P13\r\nProject title\r\nApplication of Novel Snap-shot based hyperspectral imaging\r\ncombined with AI to detect Lesions\r\nDescription of the\r\nresearch\r\nThe early detection of esophageal cancer presents a\r\nconsiderable difficulty, which contributes to its high\r\nprevalence as a major cause of cancer-related fatalities. This\r\nproject will utilize various machine learning models, including\r\nYOLOv5, YOLOv8, R-CNN, and Faster R-CNN, to predict and\r\ndetect early-stage esophageal cancer. It will make use of two\r\nmodels of esophageal cancer images: the white-light images\r\n(WLI) model and the hyperspectral narrowband images (HSI-\r\nNBI) model. These models will be generated through a\r\nconversion algorithm referred to as the spectrum-aided\r\nvision enhancer (SAVE). The main goal will be to discover', 'NBI) model. These models will be generated through a\r\nconversion algorithm referred to as the spectrum-aided\r\nvision enhancer (SAVE). The main goal will be to discover\r\nDysplasia and Squamous Cell Carcinoma (SCC). The\r\nevaluation of model performance will be conducted using the\r\ncreated confusion matrix and five important indicators:\r\nprecision, recall, F1-score, mAP, and the confusion matrix of\r\nthe trained model.\r\nMentor at CCU\r\nProf. Hsiang-Chen Wang\r\nDept. of Mechanical Engineering,\r\nNational Chung Cheng University, Taiwan, ROC.\r\n(e-mail: hcwang@ccu.edu.tw)\r\nExpected student level\r\nâ–  Post-graduate student\r\nâ–  Third/forth-year undergraduate senior student\r\nCategory â–  Scholarship\r\nIntern period At least 12 weeks between May and December 2024\r\n\r\nNumber P14\r\nProject title Stirling engines and their applications\r\nDescription of the\r\nresearch\r\nThe students will learn the research topics about Stirling\r\nengines and their applications in renewable energy,', 'Intern period At least 12 weeks between May 1st and Dec. 31th\r\n\r\nNumber P4\r\nProject title\r\nSimulation and Reconstruction of Pencil Beam Scanning of\r\nParticle Therapy\r\nDescription of the research\r\nPencil beam scanning in particle therapy is one of the\r\nhighlight radiation therapies for cancer treatment. Due to\r\nthe effectively and precisely control for particle-beam, the\r\nnarrow pulse and extremely high radiation dose rate\r\ndelivering becomes more and more significant. Basically,\r\nthe high dose rate will enable the recombination of the ion\r\npair effect, and it can lead to the received signal\r\nunderestimated. In addition, the higher spatial resolution\r\nand wide field of view is necessary. So, the main purpose of\r\nthe project is to develop a novel algorithm to reconstruct\r\nthe 2D image of the extremely high dose rate in\r\nproton/particle therapies. We hope that the students could\r\njoin us to implement a novel reconstruction algorithm and', '7.2\nKETENTUAN UMUM DALAM PENULISAN\nLAPORAN MAGANG\nâ€¢ Laporan Magang ditulis dan dipresentasikan pada akhir magang (jika diperlukan).\nâ€¢ Laporan Magang selain diserahkan ke departemen dan mitra magang, juga diserahkan ke Subdirektorat PK2 Direktorat Kemahasiswaan dalam bentuk softcopy melalui SIM Magang.\n7.3\nPRINSIP PENULISAN LAPORAN\nMAGANG\nâ€¢ BENAR DAN OBYEKTIF\nLaporan magang harus sesuai dengan ketentuan yang ada dalam pedoman ini serta memuat informasi yang benar dan obyektif.\nâ€¢ JELAS DAN CERMAT\nLaporan magang harus mudah dimengerti / dipahami oleh pembaca, dengan cara menghindari pemakaian kata / istilah, rangkaian kata / kalimat atau gaya bahasa yang kurang dapat dipahami oleh pembaca maupun penulisnya sendiri. Gunakan kata-kata yang sederhana tetapi jelas maksudnya.\nâ€¢ LANGSUNG KE SASARAN']","Proyek P13 ""Application of Novel Snap-shot based Hyperspectral Imaging Combined with AI to Detect Lesions"" menggunakan berbagai model machine learning, termasuk YOLOv5, YOLOv8, R-CNN, dan Faster R-CNN, untuk memprediksi dan mendeteksi kanker esofagus pada tahap awal. Selain itu, proyek ini juga menggunakan dua model gambar kanker esofagus: model gambar cahaya putih (WLI) dan model gambar hiperspektral narrowband (HSI-NBI). Model-model ini dihasilkan melalui algoritma konversi yang disebut sebagai spectrum-aided vision enhancer (SAVE). Tujuan utamanya adalah untuk menemukan Dysplasia dan Squamous Cell Carcinoma (SCC)."
16,"Apa yang akan dikembangkan dalam proyek P16 ""Next Generation Wireless Communication, B5G/6G, Reconfigurable Intelligent Surface, System Level Simulation, Artificial Intelligence-enhanced Wireless Research""? ","Proyek ini berfokus pada inovasi dan desain konsep-konsep canggih dan arsitektur di luar 5G dan 6G, mengidentifikasi dan memvalidasi solusi untuk masalah kunci melalui simulasi atau eksperimen prototipe, serta merancang algoritma, model, dan protokol baru untuk mengoptimalkan kinerja jaringan nirkabel.","['di luar ITS dapat  dikembangkan dan dikoordinasikan oleh Direktorat yang mengurusi \npendidikan bekerjasama dengan Direktorat yang mengurusi pascasarjana dan \npengembangan akademik . \n(5) Direktorat yang mengurusi kegiatan pertukaran pelajar/ kuliah dalam negeri harus 16 Dokumen Panduan Baku Mutu Pelaksanaan MBKM - 2021  \n NO ELEMEN PENILAIAN  INDIKATOR  \n(1) (2) (3) \nberkoordinasi dengan Program Studi terkait . \n Standar Pengelolaan â€“ \nPerencanaan MBKM  1. Prodi mempunyai Dokumen panduan untuk implementasi MBKM / turunan dokumen \nPerek 21 tahun 202 1 yang menjadi konsideran  implementasi MBKM . \n2. Prodi mempunyai kurikulum implementasi MBKM, yang meliputi CPL yang ditetapkan \nsesuai dengan implementasi MBKM dan peta CPL â€“ MK MBKM  \n3.  Prodi mempunyai Dokumen panduan untuk Dosen  Wali dan Dosen Pembimbing dalam \npelaksanaan MBKM   \n4. Prodi mempunyai Dokumen pan duan untuk Mahasiswa dalam perencanaan , \npelaksannaan, penilaian pelaksanaan  MBKM', 'Pemasaran Digital 3\nWirausaha\n1. Desain Wirausaha dan \nPresentasi\n2. Praktik Wirausaha\n3. Laporan Pelaksanaan \nWirausaha dan Presentasi3\n4\n3\nJumlah 6 MK 20 SKS\nPenjelasan Tabel 2.4. \nMahasiswa Ilmu Komunikasi mengambil bentuk kegiatan pembelajaran \nberupa Kewirausahaan untuk menambah kompetensinya di bidang wirausaha. \nKompetensi yang telah dicapai melalui serangkaian proses kegiatan pembelajaran \nkewirausahaan ini sesuai dengan CPL, proses pencapaian CPL tersebut dapat \ndiekuivalensikan kedalam mata kuliah Kewirausahaan Sosial, Etika Bisnis, \nPengantar Manajemen dan Bisnis, Pemasaran Digital, Desain Wirausaha dan \nPresentasi, Praktik Wirausaha, serta Laporan Wirausaha dan Presentasi yang \nsetara dengan 20 SKS.\nProses Program Wirausaha\n21       Buku Panduan Merdeka Belajar - Kampus Merdeka\ng. Studi/Proyek Independen\nBanyak mahasiswa yang memiliki passion untuk mewujudkan karya besar yang \ndilombakan di tingkat internasional atau karya dari ide yang inovatif. Idealnya, studi/', 'b) Menjadi   sarana bagi perguruan tinggi dalam membentuk jejaring atau mitra \nstrategis dalam membantu pembangunan desa.\nc)  Menjadi sarana pengembangan tri dharma perguruan tinggi.\nd)  Menjadi sarana aktualisasi dosen dalam pengembangan ilmu pengetahuan.\n3) Bagi Desa\na) Memperoleh bantuan pemikiran dan tenaga dari tenaga terdidik untuk \nmenyusun Rencana Pembangunan Jangka Menengah Desa (RPJMDes) dan \nRencana Kegiatan Pembangunan Desa (RKPDes).\nb) Membantu perubahan/perbaikan tata kelola desa.  \nc)  Memacu terbentuknya tenaga muda yang diperlukan dalam pemberdayaan \nmasyarakat desa\nd)  Membantu pengayaan wawasan masyarakat terhadap pembangunan desa.\ne) Percepatan pembangunan di wilayah pedesaan.\nSelain persyaratan umum yang terdapat pada pelaksanaan kebijakan Merdeka Belajar \n- Kampus Merdeka di atas, untuk kegiatan KKNT terdapat persyaratan tambahan \nyang harus dipenuhi oleh mahasiswa, yaitu:\n1) Mahasiswa telah menyelesaikan proses pembelajaran setelah  semester 6.', 'b) Membuat mahasiswa mampu berkolaborasi menyusun dan membuat \nRencana Pembangunan Jangka Menengah Desa (RPJMDes), Rencana Kegiatan \nPembangunan Desa (RKPDes), dan program strategis lainnya di desa bersama \nDosen Pendamping, Pemerintah Desa, Penggerak Swadaya Masyarakat (PSM), \nKader Pemberdayaan Masyarakat Desa (KPMD), pendamping lokal desa, dan \nunsur masyarakat.  \nc) Membuat mahasiswa dapat mengaplikasikan ilmu yang dimiliki secara \nkolaboratif bersama dengan Pemerintah Desa dan unsur masyarakat untuk \nmembangun desa. \nd) Mahasiswa mampu memanfaatkan ilmu pengetahuan, teknologi, dan \nketerampilan yang dimilikinya di lapangan yang disukainya.\n2) Bagi Perguruan Tinggi\na) Memberikan umpan balik bagi perguruan tinggi tentang ilmu pengetahuan \ndan teknologi yang dibutuhkan secara nyata oleh masyarakat.   \nb) Menjadi   sarana bagi perguruan tinggi dalam membentuk jejaring atau mitra \nstrategis dalam membantu pembangunan desa.\nc)  Menjadi sarana pengembangan tri dharma perguruan tinggi.']",Saya tidak tahu.
17,Bagaimana cara menghubungi penyelenggara program internship ini?,"Kontak dapat dilakukan melalui nomor +886-5-2720411 ext. 23003, 23005, atau email coleng_dia@ccu.edu.tw. Alamatnya adalah No.168, Sec. 1, University Rd., Minhsiung, Chiayi 621301, Taiwan (R.O.C.).","['KEMENTERIAN PENDIDIKAN, KEBUDAYAAN,\n                                     RISET DAN TEKNOLOGI\n                            INSTITUT TEKNOLOGI SEPULUH NOPEMBER\n                                          Kampus ITS Sukolilo â€“ Surabaya 60111\n                                   Telepon : 031-5994251-54, 5947274, 5945472 (Hunting)\n                                                 Fax: 031-5947264, 5950806\n                                                     http://www.its.ac.id\n\n\n                                            SURAT EDARAN\n                 WAKIL REKTOR BIDANG AKADEMIK DAN KEMAHASISWAAN\n                          INSTITUT TEKNOLOGI SEPULUH NOPEMBER\n                                  NOMOR: 757/IT2.I/T/TU.00.08/2022\n\n\n                                              TENTANG\n             Pelaksanaan Bentuk Kegiatan Pembelajaran Merdeka Belajar â€“ Kampus Merdeka\n\n\nKepada Yth. 1. Dekan\n           2. Kepala Departemen\n           di Lingkungan ITS', 'KEMENTERIAN PENDIDIKAN, KEBUDAYAAN, \n                      RISET, DAN TEKNOLOGI \n             INSTITUT TEKNOLOGI SEPULUH NOPEMBER\n                     Kampus ITS Sukolilo - Surabaya 60111 \n                 Telepon : 031-5994251-54, 5947274, 5945472 (Hunting) \n                         Fax: 031-5947264, 5950806 \n                           http://wwwits.ac.id\n\n       PERATURAN REKTOR INSTITUT TEKNOLOGI SEPULUH NOPEMBER \n                     NOMOR 5 TAHUN 2023\n\n                          TENTANG\n\n        DANA PENDIDIKAN INSTITUT TEKNOLOGI SEPULUH NOPEMBER \n\n              DENGAN RAHMAT TUHAN YANG MAHA ESA\n\n           REKTOR INSTITUT TEKNOLOGI SEPULUH NOPEMBER,', 'KEMENTERIAN PENDIDIKAN, KEBUDAYAAN, RISET, DAN TEKNOLOGI\nINSTITUT TEKNOLOGI SEPULUH NOPEMBER\n       Kampus ITS Sukolilo - Surabaya 60111 Telepon : 031-5994251-54, 5947274, 5945472 (Hunting)\nFax: 031-5947264, 5950806\nhttp://www.its.ac.id\n\n\nPERATURAN REKTOR INSTITUT TEKNOWGI SEPULUH NOPEMBER NOMOR 7 TAHUN 2023\n\nTENTANG\n\nPEMBERIAN APRESIASI BAGI MAHASISWA BEPRESTASI\nDAN DOSEN PEMBIMBING DI BIDANG KOMPETISI KEMAHASISWAAN INSTITUT TEKNOWGI SEPULUH NOPEMBER', 'KEMENTERIAN PENDIDIKAN, KEBUDAYAAN, RISET, DAN TEKNOLOGI\r\nINSTITUT TEKNOLOGI SEPULUH NOPEMBER\r\n       Kampus ITS Sukolilo - Surabaya 60111 Telepon : 031-5994251-54, 5947274, 5945472 (Hunting)\r\nFax: 031-5947264, 5950806\r\nhttp://www.its.ac.id\r\n\r\n\r\nPERATURAN REKTOR INSTITUT TEKNOLOGI SEPULUH NOPEMBER NOMOR 22 TAHUN 2021\r\n\r\nTENTANG\r\n\r\nPENYELENGGARAAN KEGIATAN MERDEKA BELAJAR - KAMPUS MERDEKA DI INSTITUT TEKNOLOGI SEPULUH NOPEMBER\r\n\r\n      DENGAN RAHMAT TUHAN YANG MAHA ESA REKTOR INSTITUT TEKNOLOGI SEPULUH NOPEMBER,\r\nMenimbang : a. bahwa dalam rangka Institut Teknologi Sepuluh Nopember menuju perguruan tinggi dengan reputasi internasional (world class university) dalam ilmu pengetahuan dan teknologi, dipandang perlu menyusun peraturan penyelenggaraan kegiatan merdeka belajar - kampus merdeka yang mendukung perihal tersebut;']",Saya tidak menemukan informasi mengenai program internship dalam konteks yang diberikan.
18,Apa yang harus dilakukan jika ingin menghapus atau menarik artikel yang telah diunggah?,"Isi form di link: https://its.id/FHAJTeknikITS untuk Jurnal Teknik, https://its.id/FHAJSainsSeniITS untuk Jurnal Sains & Seni, atau https://its.id/FHAJRepositoryITS untuk Repository.","['\uf0b7   Pengecekan file yang TERUNGGAH dapat dilihat di\n    http://lpmp2ki.its.ac.id/pomits.\n\n\uf0b7   Jika terdapat penghapusan/penarikan artikel, dapat mengisi form pada link\n    \uf031\uf02e http://bit.ly/FHAJTeknikITS, untuk Jurnal Teknik ITS;\n    \uf032\uf02e http://bit.ly/FHAJSainsSeniITS, untuk Jurnal Sains &Seni ITS;\n    \uf033\uf02e http://bit.ly/FHAJRepositoryITS, untuk Repository.\n\n\n\uf0b7   List data Artikel terhapus dapat dilihat pada website jurnal.\n    (http://ejurnal.its.ac.id, yang diupdate tiap 3 hari)\n\n\uf0b7   Artikel - artikel yang TIDAK MEMENUHI KETENTUAN PUBLIKASI (gaya selingkung tidak\n    sesuai format dan file pendukung tidak lengkap) tidak akan DIPUBLIKASIKAN di\n    Jurnal POMITS.\n\n\uf0b7   Periode unggah artikel untuk yudisium 122 adalah sampai dengan\n    7 Agustus 2020, pukul 24.00 WIB', ""KIRIM\nTampilan halaman jika sudah menyelesaikan pendaftaran, lalu klik button 'Back To Home:\nÂ©Korako\nâ€¢ DASHBOARD E KEGIATAN MAHASISVIA & PROFIL\nTeguh Bintang Nugraha a\nSuccessfully Submitted!\nspe andro owthe oronress owur submitco onnlication oney Anallantonabunder sourprori\nBACK TO HOME\n17. Maka pendaftar berhasil mendaftarkan diri pada Program\nPertukaran Mahasiswa Merdeka dan menunggu update pengumuman selanjutnya di web Kampus Merdeka dengan klik button 'Kegiatanku'\n18"", 'Meminta persetujuan form pengajuan KP ke Koordinator Kerja Praktek (Sekretaris Departemen 1)\nMenyerahkan Form Pengajuan KP yang sudah disetujui Koord. KP kepada Staf Akademik (Pak Sugeng) untuk dibuatkan surat pengantar ke tempat KP\nSurat pengantar KP dikeluarkan oleh departemen Teknik Informatika yang ditujukan kepada organisasi tempat KP yang berisi:\nPermohonan agar mahasiswa X diijinkan untuk melakukan KP di organisasi Y,\nTanggal mulai,\nDurasi kerja praktik\nSurat pengantar KP dikirimkan ke instansi penerima KP\nJika balasan persetujuan sudah didapatkan, unggah ke MONKP\nStatus KP akan menjadi CONFIRMED\nDosen Pembimbing Kerja Praktik\n\nSyarat mendapatkan dosen pembimbing internal KP:\nStatus KP akan menjadi CONFIRMED\nDosen Pembimbing KP dipilih oleh koordinator KP dengan menyesuaikan load pembimbingan dosen, kecuali ada rekomendasi khusus dari dosen ybs\nPengalokasian dilakukan secara batch operation\nDi lokasi KP\n4. Melaksanakan Kerja Praktik', 'Lakukan pembayaran dengan transfer ke VA BNI. Berlaku 1x24 jam. Jika kadaluarsa bisa melakukan pesanan baru.\nMemantau Pesanan\n\nStatus Pesanan:\n\nMembuat pesanan cetak\nMenunggu pembayaran\nPembayaran diterima\nProses pencetakan\nSelesai dicetak\nPengiriman ke Perpustakaan / Departemen\nSelesai\nPesanan kadaluarsa\nPesanan dibatalkan\nJika ada permasalahan teknis dapat menghubungi:\n\nWA Layanan DPTSI: 0811 3333 8 222 (07:30 â€“ 16:00 WIB)\nPortal Servicedesk: https://servicedesk.its.ac.id']","Untuk menghapus atau menarik artikel yang telah diunggah, Anda dapat mengisi form pada link berikut:
- Untuk Jurnal Teknik ITS: http://bit.ly/FHAJTeknikITS
- Untuk Jurnal Sains & Seni ITS: http://bit.ly/FHAJSainsSeniITS
- Untuk Repository: http://bit.ly/FHAJRepositoryITS

Setelah mengisi form tersebut, penghapusan atau penarikan artikel akan diproses sesuai dengan prosedur yang telah ditentukan."
19,Apa yang terjadi dengan artikel yang tidak memenuhi ketentuan publikasi?,Artikel tersebut tidak akan dipublikasikan di Jurnal Teknik ITS dan Jurnal Sains & Seni ITS.,"['3. Artikel yang terbit secara periodik\n\n   Artikel yang dipublikasikan secara periodik, termasuk: (i) jurnal, (ii) majalah, (iii) surat\n   kabar, (iv) buletin, (v) blog, dan (vi) platform online lainnya yang menerbitkan artikel.\n   Jurnal dan majalah mempunyai identitas dengan memiliki nomor volume/edisi. Sebagai\n   contoh sebuah jurnal dengan identitas volume 6, nomor 2.\n   Dalam hal ini nomor volume dicetak miring diikuti oleh nomor dalam tanda kurung\n   tetapi tidak miring. Contoh; 6 (2)\n\n   a. Artikel jurnal dengan DOI\n   Gunakan kapitalisasi kalimat pada judul artikel. Gunakan huruf kapital pada huruf\n   pertama setiap kata utama dalam judul jurnal. Cetak miring judul jurnal dan nomor\n   volume. Tambahkan nomor penerbitan jika tersedia, sertakan nomor DOI; biasanya\n   muncul di halaman pertama artikel.\n Format:\n Author, A. A., Author, B. B., & Author, C. C. (year). Title of article. Title of Periodical,\n      xx, pp-pp. https://doi.org/xxxx', '\uf0b7   UNGGAH artikel WAJIB dilakukan oleh MAHASISWA PENDAFTAR YUDISIUM 121.', 'â€¢ TEGAS DAN KONSISTEN\nLaporan Magang harus tegas dan konsisten sehingga tidak terjadi kontradiksi antara bagian yang satu dengan bagian lainnya, baik dalam hal substansi, istilah, maupun teknik penulisan penyajian.\nPenulisan, penyerahan, evaluasi, dan perbaikan Laporan Magang harus dilakukan sesuai dengan ketentuan yang berlaku. Untuk memenuhi syarat tersebut, dengan ini seorang penulis Laporan Magang harus:\nâ€¢ Benar-benar menguasai masalah yang dilaporkan.\nâ€¢ Mempunyai minat, kesanggupan, obyektifitas, ketelitian, dan kemampuan analisis dalam menyusun laporan.\nâ€¢ Mampu bekerjasama, serta tanggap dan terbuka terhadap kritik.\nâ€¢ Mampu menggunakan bahasa tulisan yang baik.\nâ€¢ Dapat menggunakan kata-kata, istilah, kalimat dan gaya bahasa yang sederhana, jelas, dan mudah dimengerti.\nâ€¢ Mampu memilih dan mengorganisir data yang diperlukan.\nâ€¢ Mampu mengamati dan menilai dengan jeli berbagai proses, peristiwa, manfaat dan kelemahan yang ada selama melakukan kegiatan Magang.\n7.4', 'Menimbang   :    a.   bahwa Peraturan Rektor Institut Teknologi Sepuluh\n                      Nopember Nomor 12 Tahun 2019 tentang Baku Mutu\n                      Magang Program Studi Sarjana Terapan dan Sarjana\n                      perlu     dilakukan        penyesuaian      untuk         mengikuti\n                      perkembangan yang ada;\n                 b.   bahwa rancangan perubahan atas Peraturan Rektor\n                      Institut Teknologi Sepuluh Nopember Nomor 12 Tahun\n                      2019    tentang    Baku      Mutu       Magang     Program    Studi\n                      Sarjana     Terapan     dan   Sarjana      telah    mendapatkan\n                      pertimbangan       Senat      Akademik      Institut      Teknologi\n                      Sepuluh Nopember berdasarkan Berita Acara Sidang\n                      Pleno Senat       Akademik         Institut Teknologi Sepuluh\n                      Nopember Nomor T/61733/IT2.XI/TU.00.03.01/2021;']","Artikel yang tidak memenuhi ketentuan publikasi dapat mengalami penolakan atau penundaan dalam proses publikasi. Hal ini dapat menyebabkan artikel tersebut tidak diakui atau dianggap tidak sah oleh pihak yang berwenang. Oleh karena itu, sangat penting bagi penulis artikel untuk memastikan bahwa artikel yang mereka publikasikan memenuhi semua ketentuan yang berlaku."
