,question,answer,contexts,ground_truth,context_precision,faithfulness,answer_relevancy,context_recall
0,Apa saja persyaratan umum pendaftaran Beasiswa Prioritas LPDP – Campus France Program Master?,"Persyaratan umum pendaftaran Beasiswa Prioritas LPDP - Campus France Program Master adalah sebagai berikut:
1. Warga Negara Indonesia.
2. Telah menyelesaikan studi program diploma empat (D4) atau sarjana (S1).
3. Pendaftar yang telah menyelesaikan studi magister (S2) tidak diizinkan mendaftar.
4. Bagi pendaftar lulusan perguruan tinggi luar negeri, harus memiliki ijazah yang diakui oleh Kementerian Pendidikan dan Kebudayaan Republik Indonesia.","['Panduan Pendaftaran\nBeasiswa Prioritas\nLPDP - Campus France\nProgram Master\nTahun 2024\nlpdp.kemenkeu.go.id'
 'kejuaraan/non kejuaraan, dan pengalaman\norganisasi pada aplikasi pendaftaran.\nApa saja persyaratan khusus pendaftaran\nBeasiswa Prioritas LPDP – Campus France\nProgram Master?\nPersyaratan khusus Beasiswa Kemitraan LPDP –\nCampus France Program Master adalah sebagai\nberikut:'
 'Dipublikasikan tanggal 11 Januari 2024\nprogram beasiswa lain yang dipilih, sesuai\ndengan syarat dan ketentuan yang berlaku.\nApa saja komponen Dana yang diberikan?\n1. Dana Pendidikan\na. Tuition Fee\nb. Dana Pendaftaran\nc. Dana Tunjangan Buku\nd. Dana Penelitian Tesis\ne. Dana Seminar Internasional\nf. Dana Publikasi Jurnal Internasional\n2. Dana Pendukung\na. Dana Transportasi\nb. Dana Aplikasi Visa\nc. Dana Asuransi Kesehatan\nd. Dana Kedatangan\ne. Dana Hidup Bulanan\nf. Dana Lomba Internasional\ng. Dana keadaaan darurat (jika diperlukan)\nApa saja persyaratan umum pendaftaran\nBeasiswa Prioritas LPDP – Campus\nFrance Program Master?\nPersyaratan umum Beasiswa Prioritas LPDP –\nCampus France Program Master adalah sebagai\nberikut:\n1. Warga Negara Indonesia.\n2. Telah menyelesaikan studi program diploma\nempat (D4) atau sarjana (S1).\n3. Pendaftar yang telah menyelesaikan studi\nmagister (S2) tidak diizinkan mendaftar.\n4. Bagi pendaftar lulusan perguruan tinggi luar'
 'Siapakah Sasaran Beasiswa Prioritas\nLPDP – Campus France Program Master?\n1. Warga Negara Indonesia (WNI)\n2. PNS/TNI/POLRI\nSeperti Apa Skema Prioritas LPDP –\nCampus France Program Master?\nPendaftar wajib mendaftar secara bersamaan\npada beasiswa Kemitraan LPDP – Campus France\nProgram Master dan salah satu program Magister\nbeasiswa Afirmasi/Targeted/Umum tujuan luar\nnegeri, dengan skema berikut.\n1. Beasiswa Kemitraan LPDP – Campus France\nProgram Master:\na. Beasiswa LPDP – Campus France\nProgram Master diperuntukkan bagi\nWarga Negara Indonesia untuk dapat\nmenempuh pendidikan pada program\nmagister di program studi dan universitas\nsebagaimana daftar terlampir dengan\ndurasi pendanaan paling lama 24 (dua\npuluh empat) bulan.\nb. Pendaftar diharuskan untuk melakukan\npendaftaran pada:\n● Perguruan Tinggi Tujuan Studi\nsesuai jadwal dan ketentuan yang\nberlaku di Perguruan Tinggi, dan\n● Campus France sesuai jadwal dan\nketentuan yang berlaku di Campus\nFrance.\n2. Persyaratan dan dokumen pada Beasiswa']","Warga Negara Indonesia, telah menyelesaikan studi D4/S1, tidak diizinkan bagi yang telah menyelesaikan studi S2, dan bagi lulusan luar negeri wajib melampirkan hasil penyetaraan ijazah dan konversi IPK.",0.999999999975,0.75,1.0,0.0
1,Apa yang harus dilakukan pendaftar yang merupakan PNS?,"Pendaftar yang merupakan PNS harus bersedia memenuhi ketentuan tugas belajar dan mendapatkan surat izin mengikuti seleksi dari pejabat yang berwenang sesuai dengan ketentuan yang tercantum dalam pengumuman Beasiswa Prioritas LPDP - Campus France 2024 S1. Jika dosen tetap ITS yang merupakan PNS ingin memperoleh keringanan dana SPP, maka harus memenuhi persyaratan yang tercantum dalam Peraturan Rektor No. 5/2023 Dana Pendidikan ITS, seperti mendapatkan surat keputusan dari kementerian tentang tugas belajar dengan beasiswa atau surat keputusan dari Rektor tentang tugas belajar dengan beasiswa.","['c. diberhentikan beasiswanya apabila tidak memenuhi kewajiban pada huruf a atau b.\n14. Sebagai pendaftar Beasiswa LPDP program magister belum pernah menyelesaikan studi magister\n(S2) atau sebagai pendaftar Beasiswa LPDP program doktor belum menyelesaikan studi doktor\n(S3).\n15. Sebagai CPNS, PNS, prajurit TNI, atau anggota POLRI, bersedia memenuhi ketentuan tugas\nbelajar dan mendapatkan surat izin mengikuti seleksi dari pejabat yang berwenang.\n16. Sebagai CPNS, PNS, prajurit TNI, atau anggota POLRI bersedia:'
 'Pasa1 14\n(1) Mahasiswa yang merupakan dosen tetap ITS, selanjutnya disebut pegawai pelajar, \n  dapat memperoleh keringanan dana SPP dengan ketentuan sebagai berikut:\n  a. tercatat sebagai mahasiswa aktif program doktor pada salah satu Program Studi di \n   ITS;\n  b. berusia paling rendah 35 tahun;\n  c. untuk dosen tetap PNS telah mendapatkan surat keputusan dari kementerian \n   tentang tugas belajar dengan beasiswa atau sedang diusulkan oleh ITS untuk \n   mendapatkan surat keputusan dari kementerian tentang tugas belajar dengan \n   beasiswa; dan\n  d. Untuk dosen tetap Non PNS telah mendapatkan surat keputusan dari Rektor \n   tentang tugas belajar dengan beasiswa.\n(2) Beasiswa yang dimaksud sebagaimana pada ayat (1) huruf c dan huruf d berupa \n  pembiayaan untuk keringanan SPP yang bersumber dari dana ITS.\n(3) Pengusulan oleh ITS sebagaimana dimaksud pada ayat (1) huruf c telah mendapat \n  rekomendasi dari Wakil Rektor yang membidangi sumber daya manusia.'
 'Pasa1 14\n(1) Mahasiswa yang merupakan dosen tetap ITS, selanjutnya disebut pegawai pelajar, \n  dapat memperoleh keringanan dana SPP dengan ketentuan sebagai berikut:\n  a. tercatat sebagai mahasiswa aktif program doktor pada salah satu Program Studi di \n   ITS;\n  b. berusia paling rendah 35 tahun;\n  c. untuk dosen tetap PNS telah mendapatkan surat keputusan dari kementerian \n   tentang tugas belajar dengan beasiswa atau sedang diusulkan oleh ITS untuk \n   mendapatkan surat keputusan dari kementerian tentang tugas belajar dengan \n   beasiswa; dan\n  d. Untuk dosen tetap Non PNS telah mendapatkan surat keputusan dari Rektor \n   tentang tugas belajar dengan beasiswa.\n(2) Beasiswa yang dimaksud sebagaimana pada ayat (1) huruf c dan huruf d berupa \n  pembiayaan untuk keringanan SPP yang bersumber dari dana ITS.\n(3) Pengusulan oleh ITS sebagaimana dimaksud pada ayat (1) huruf c telah mendapat \n  rekomendasi dari Wakil Rektor yang membidangi sumber daya manusia.'
 'Syarat dokumen mengikuti syarat program\nbeasiswa yang dipilih (mengacu pada Buku\nPanduan masing-masing program beasiswa).\nSeperti apa format Komitmen kembali ke\nIndonesia, rencana pasca studi, dan\nrencana kontribusi di Indonesia serta\nRencana Bisnis atau Rencana\nPengembangan Bisnis?\nKomitmen kembali ke Indonesia, rencana\npasca studi, dan rencana kontribusi di\nIndonesia (1500 – 2000 kata)\nDeskripsikan dalam tulisan secara jelas dan\nkonkret tentang tema di atas.']",Melampirkan surat usulan atau rekomendasi dari pejabat eselon II yang mencantumkan NIP pendaftar.,0.9999999999666667,0.75,0.9091454717241653,0.0
2,Apa yang harus dipersiapkan sebelum mengikuti program internasional?,"Sebelum mengikuti program internasional, hal yang harus dipersiapkan termasuk syarat dokumen yang mengikuti syarat program beasiswa yang dipilih, seperti yang dijelaskan dalam Buku Panduan masing-masing program beasiswa. Selain itu, juga perlu disiapkan format Komitmen kembali ke Indonesia, rencana pasca studi, rencana kontribusi di Indonesia, serta Rencana Bisnis atau Rencana Pengembangan Bisnis. Komitmen kembali ke Indonesia, rencana pasca studi, dan rencana kontribusi di Indonesia harus dideskripsikan dalam tulisan secara jelas dan konkret dalam rentang 1500-2000 kata.","['Syarat dokumen mengikuti syarat program\nbeasiswa yang dipilih (mengacu pada Buku\nPanduan masing-masing program beasiswa).\nSeperti apa format Komitmen kembali ke\nIndonesia, rencana pasca studi, dan\nrencana kontribusi di Indonesia serta\nRencana Bisnis atau Rencana\nPengembangan Bisnis?\nKomitmen kembali ke Indonesia, rencana\npasca studi, dan rencana kontribusi di\nIndonesia (1500 – 2000 kata)\nDeskripsikan dalam tulisan secara jelas dan\nkonkret tentang tema di atas.'
 'i. Mahasiswa dari perguruan tinggi mitra luar negeri program kerjasama yang bersifat \n   resiprokal; atau\n  j. Mahasiswa program sarjana atau sarjana terapan yang mampu mempublikasikan \n   paper pada jurnal internasional bereputasi Q1 sebagai nama pertama dengan \n   rekomendasi Wakil Rektor yang membidangi akademik dibebaskan untuk semester \n   berikutnya atau menarik UKT atau SPP pada semester berjalan apabila lulus \n   yudisium.'
 'i. Mahasiswa dari perguruan tinggi mitra luar negeri program kerjasama yang bersifat \n   resiprokal; atau\n  j. Mahasiswa program sarjana atau sarjana terapan yang mampu mempublikasikan \n   paper pada jurnal internasional bereputasi Q1 sebagai nama pertama dengan \n   rekomendasi Wakil Rektor yang membidangi akademik dibebaskan untuk semester \n   berikutnya atau menarik UKT atau SPP pada semester berjalan apabila lulus \n   yudisium.'
 'program doktor pada semester berjalan; dan/atau\n  d. Mahasiswa program pascasarjana yang berpindah jenis kelas diwajibkan \n   membayar SPP untuk jenis kelas dengan tarif lebih tinggi.\n(2) Perpindahan mahasiswa sebagaimana dimaksud ayat (1) huruf d harus mendapatkan \n  persetujuan Wakil Rektor yang membidangi akademik.']","Persiapan meliputi dokumentasi, keuangan, barang bawaan, pengetahuan, dan psikologi.",0.5833333333041666,1.0,0.9998171403888305,0.0
3,Apa contoh program magang di luar negeri?,Saya tidak mengetahui contoh program magang di luar negeri yang spesifik dari konteks yang diberikan.,"['Syarat dokumen mengikuti syarat program\nbeasiswa yang dipilih (mengacu pada Buku\nPanduan masing-masing program beasiswa).\nSeperti apa format Komitmen kembali ke\nIndonesia, rencana pasca studi, dan\nrencana kontribusi di Indonesia serta\nRencana Bisnis atau Rencana\nPengembangan Bisnis?\nKomitmen kembali ke Indonesia, rencana\npasca studi, dan rencana kontribusi di\nIndonesia (1500 – 2000 kata)\nDeskripsikan dalam tulisan secara jelas dan\nkonkret tentang tema di atas.'
 'i. Mahasiswa dari perguruan tinggi mitra luar negeri program kerjasama yang bersifat \n   resiprokal; atau\n  j. Mahasiswa program sarjana atau sarjana terapan yang mampu mempublikasikan \n   paper pada jurnal internasional bereputasi Q1 sebagai nama pertama dengan \n   rekomendasi Wakil Rektor yang membidangi akademik dibebaskan untuk semester \n   berikutnya atau menarik UKT atau SPP pada semester berjalan apabila lulus \n   yudisium.'
 'i. Mahasiswa dari perguruan tinggi mitra luar negeri program kerjasama yang bersifat \n   resiprokal; atau\n  j. Mahasiswa program sarjana atau sarjana terapan yang mampu mempublikasikan \n   paper pada jurnal internasional bereputasi Q1 sebagai nama pertama dengan \n   rekomendasi Wakil Rektor yang membidangi akademik dibebaskan untuk semester \n   berikutnya atau menarik UKT atau SPP pada semester berjalan apabila lulus \n   yudisium.'
 'kejuaraan/non kejuaraan, dan pengalaman\norganisasi pada aplikasi pendaftaran.\nApa saja persyaratan khusus pendaftaran\nBeasiswa Prioritas LPDP – Campus France\nProgram Master?\nPersyaratan khusus Beasiswa Kemitraan LPDP –\nCampus France Program Master adalah sebagai\nberikut:']",Contoh program magang meliputi Universiti Kuala Lumpur (UniKL) di Malaysia dan Shibaura Institute of Technology di Jepang.,0.6388888888675925,0.0,0.0,0.0
4,Apa yang dimaksud dengan UKT?,"UKT merupakan singkatan dari Uang Kuliah Tunggal, yaitu biaya yang harus dibayar oleh mahasiswa setiap semester untuk biaya pendidikan di perguruan tinggi.","['Syarat dokumen mengikuti syarat program\nbeasiswa yang dipilih (mengacu pada Buku\nPanduan masing-masing program beasiswa).\nSeperti apa format Komitmen kembali ke\nIndonesia, rencana pasca studi, dan\nrencana kontribusi di Indonesia serta\nRencana Bisnis atau Rencana\nPengembangan Bisnis?\nKomitmen kembali ke Indonesia, rencana\npasca studi, dan rencana kontribusi di\nIndonesia (1500 – 2000 kata)\nDeskripsikan dalam tulisan secara jelas dan\nkonkret tentang tema di atas.'
 '3. Apabila ada data dukung yang tidak tersedia tempatnya untuk mengupload, maka data dukung dapat digabungkan\r\ndengan surat permohonan banding UKT/SPP dengan cara dikolase.\r\n4. Bagi mahasiswa Jalur Mandiri Kemitraan, data penghasilan orang tua (ayah dan ibu) yang dimasukkan adalah jumlah\r\ntotal per tahun\r\n5. Bagi mahasiswa jalur reguler, data penghasilan orang tua (ayah dan ibu) yang dimasukkan adalah jumlah total per\r\nbulan.\r\nSurabaya, 16 Nopember 2023\r\nDirektur Perencanaan dan Pengembangan,\r\nDr. Ir. Suwadi M.T.\r\n196808181993031002\r\nPowered by TCPDF (www.tcpdf.org)'
 '(4) Kewajiban membayar dana pendidikan berupa SPA dikenakan kepada Mahasiswa \n  program sarjana dan sarjana terapan yang diterima selain dari jalur Seleksi Nasional \n  kecuali jalur mandiri seleksi mandiri prestasi.\n(5) Untuk mendapatkan NRP, Calon Mahasiswa Baru wajib melakukan pembayaran dana \n  pendidikan sesuai dengan kriteria sebagaimana dimaksud pada ayat (1), ayat (2), dan \n  ayat (3).\n(6) Calon Mahasiswa Baru yang telah mendapatkan NRP dinyatakan terdaftar sebagai \n  Mahasiswa Baru yang ditetapkan dengan keputusan Rektor.\n\n                   BAB V \n           FORMULASI PEMBAYARAN UKT DAN SPP\n\n                 Bagian Kesatu \n            Kewajiban Membayar UKT atau SPP'
 '(4) Kewajiban membayar dana pendidikan berupa SPA dikenakan kepada Mahasiswa \n  program sarjana dan sarjana terapan yang diterima selain dari jalur Seleksi Nasional \n  kecuali jalur mandiri seleksi mandiri prestasi.\n(5) Untuk mendapatkan NRP, Calon Mahasiswa Baru wajib melakukan pembayaran dana \n  pendidikan sesuai dengan kriteria sebagaimana dimaksud pada ayat (1), ayat (2), dan \n  ayat (3).\n(6) Calon Mahasiswa Baru yang telah mendapatkan NRP dinyatakan terdaftar sebagai \n  Mahasiswa Baru yang ditetapkan dengan keputusan Rektor.\n\n                   BAB V \n           FORMULASI PEMBAYARAN UKT DAN SPP\n\n                 Bagian Kesatu \n            Kewajiban Membayar UKT atau SPP']",Uang Kuliah Tunggal,0.999999999975,0.5,0.9432138797033204,0.0
5,Berapa persen keringanan pembayaran SPP bagi mahasiswa aktif pembayar dana pendidikan di luar ITS?,Jawaban: Mahasiswa aktif pembayar dana pendidikan di luar ITS diberikan keringanan sebesar 10% (sepuluh persen) dari besaran SPP.,"['Pasal 6\nMahasiswa program Joint Degree/ Double Degree yang melakukan kegiatan akademik di \nperguruan tinggi mitra luar negeri, diwajibkan membayar SPP:\na. sebesar 100% (seratus persen) di ITS untuk Mahasiswa yang tidak berkewajiban \n  membayar dana pendidikan di perguruan tinggi mitra luar negeri;\nb. sebesar 10% (sepuluh persen) di ITS untuk Mahasiswa yang berkewajiban membayar \n  dana pendidikan di perguruan tinggi mitra luar negeri; dan\nc. sebesar 100% (seratus persen) di ITS untuk Mahasiswa berkegiatan akademik di \n  perguruan tinggi mitra luar negeri yang mensyaratkan pembagian pendapatan SPP \n  dengan ITS.\n\n                   Pasal 7\n(1) Mahasiswa asing membayar UKT atau SPP yang besarannya ditetapkan dengan \n  keputusan Rektor.\n(2) Mahasiswa asing dari negara berkembang dapat diberikan beasiswa dari ITS berupa \n  keringanan pembayaran UKT atau SPP yang ditetapkan dengan keputusan Rektor.'
 'Pasal 6\nMahasiswa program Joint Degree/ Double Degree yang melakukan kegiatan akademik di \nperguruan tinggi mitra luar negeri, diwajibkan membayar SPP:\na. sebesar 100% (seratus persen) di ITS untuk Mahasiswa yang tidak berkewajiban \n  membayar dana pendidikan di perguruan tinggi mitra luar negeri;\nb. sebesar 10% (sepuluh persen) di ITS untuk Mahasiswa yang berkewajiban membayar \n  dana pendidikan di perguruan tinggi mitra luar negeri; dan\nc. sebesar 100% (seratus persen) di ITS untuk Mahasiswa berkegiatan akademik di \n  perguruan tinggi mitra luar negeri yang mensyaratkan pembagian pendapatan SPP \n  dengan ITS.\n\n                   Pasal 7\n(1) Mahasiswa asing membayar UKT atau SPP yang besarannya ditetapkan dengan \n  keputusan Rektor.\n(2) Mahasiswa asing dari negara berkembang dapat diberikan beasiswa dari ITS berupa \n  keringanan pembayaran UKT atau SPP yang ditetapkan dengan keputusan Rektor.'
 'Pasal 13\nMahasiswa program sarjana dan sarjana terapan pada semester 9, dan mengambil mata \nkilliah kurang dari atau sama dengan 6 sks, diberikan keringanan sebesar 50% (lima \npuluh persen) dari besaran UKT atau SPP.\n\n                Bagian Keempat \n           Keringanan Dana SPP Untuk Dosen ITS'
 'Pasal 13\nMahasiswa program sarjana dan sarjana terapan pada semester 9, dan mengambil mata \nkilliah kurang dari atau sama dengan 6 sks, diberikan keringanan sebesar 50% (lima \npuluh persen) dari besaran UKT atau SPP.\n\n                Bagian Keempat \n           Keringanan Dana SPP Untuk Dosen ITS']",Maksimal 90%,0.999999999975,0.0,0.9788320355126866,0.0
6,Apa yang dimaksud dengan Program Studi dalam peraturan ini?,"Program Studi dalam peraturan ini mengacu pada program sarjana, program sarjana terapan, program doktor, dan program pascasarjana yang diatur dalam ketentuan-ketentuan yang tercantum dalam Peraturan Rektor No. 5/2023 Dana Pendidikan ITS.","['i. Mahasiswa dari perguruan tinggi mitra luar negeri program kerjasama yang bersifat \n   resiprokal; atau\n  j. Mahasiswa program sarjana atau sarjana terapan yang mampu mempublikasikan \n   paper pada jurnal internasional bereputasi Q1 sebagai nama pertama dengan \n   rekomendasi Wakil Rektor yang membidangi akademik dibebaskan untuk semester \n   berikutnya atau menarik UKT atau SPP pada semester berjalan apabila lulus \n   yudisium.'
 'i. Mahasiswa dari perguruan tinggi mitra luar negeri program kerjasama yang bersifat \n   resiprokal; atau\n  j. Mahasiswa program sarjana atau sarjana terapan yang mampu mempublikasikan \n   paper pada jurnal internasional bereputasi Q1 sebagai nama pertama dengan \n   rekomendasi Wakil Rektor yang membidangi akademik dibebaskan untuk semester \n   berikutnya atau menarik UKT atau SPP pada semester berjalan apabila lulus \n   yudisium.'
 'program doktor pada semester berjalan; dan/atau\n  d. Mahasiswa program pascasarjana yang berpindah jenis kelas diwajibkan \n   membayar SPP untuk jenis kelas dengan tarif lebih tinggi.\n(2) Perpindahan mahasiswa sebagaimana dimaksud ayat (1) huruf d harus mendapatkan \n  persetujuan Wakil Rektor yang membidangi akademik.'
 'program doktor pada semester berjalan; dan/atau\n  d. Mahasiswa program pascasarjana yang berpindah jenis kelas diwajibkan \n   membayar SPP untuk jenis kelas dengan tarif lebih tinggi.\n(2) Perpindahan mahasiswa sebagaimana dimaksud ayat (1) huruf d harus mendapatkan \n  persetujuan Wakil Rektor yang membidangi akademik.']",Kesatuan kegiatan pendidikan dan pembelajaran yang memiliki kurikulum dan metode pembelajaran tertentu,0.99999999995,0.4,0.9999999999999997,0.0
7,Apa saja yang termasuk dana pendidikan menurut Pasal 3 ayat (2) peraturan ini?,Dana pendidikan menurut Pasal 3 ayat (2) peraturan ini mencakup biaya pendidikan yang harus dibayar oleh Mahasiswa program sarjana dan sarjana terapan yang diterima selain dari jalur Seleksi Nasional kecuali jalur mandiri seleksi mandiri prestasi.,"['(4) Kewajiban membayar dana pendidikan berupa SPA dikenakan kepada Mahasiswa \n  program sarjana dan sarjana terapan yang diterima selain dari jalur Seleksi Nasional \n  kecuali jalur mandiri seleksi mandiri prestasi.\n(5) Untuk mendapatkan NRP, Calon Mahasiswa Baru wajib melakukan pembayaran dana \n  pendidikan sesuai dengan kriteria sebagaimana dimaksud pada ayat (1), ayat (2), dan \n  ayat (3).\n(6) Calon Mahasiswa Baru yang telah mendapatkan NRP dinyatakan terdaftar sebagai \n  Mahasiswa Baru yang ditetapkan dengan keputusan Rektor.\n\n                   BAB V \n           FORMULASI PEMBAYARAN UKT DAN SPP\n\n                 Bagian Kesatu \n            Kewajiban Membayar UKT atau SPP'
 '(4) Kewajiban membayar dana pendidikan berupa SPA dikenakan kepada Mahasiswa \n  program sarjana dan sarjana terapan yang diterima selain dari jalur Seleksi Nasional \n  kecuali jalur mandiri seleksi mandiri prestasi.\n(5) Untuk mendapatkan NRP, Calon Mahasiswa Baru wajib melakukan pembayaran dana \n  pendidikan sesuai dengan kriteria sebagaimana dimaksud pada ayat (1), ayat (2), dan \n  ayat (3).\n(6) Calon Mahasiswa Baru yang telah mendapatkan NRP dinyatakan terdaftar sebagai \n  Mahasiswa Baru yang ditetapkan dengan keputusan Rektor.\n\n                   BAB V \n           FORMULASI PEMBAYARAN UKT DAN SPP\n\n                 Bagian Kesatu \n            Kewajiban Membayar UKT atau SPP'
 'kemitraan/kerja sama beasiswa prioritas, maka tidak dapat berpindah program studi, perguruan\ntinggi, dan/atau program Beasiswa LPDP lainnya, atau kelulusan akan dibatalkan.\nDemikian surat pernyataan ini dibuat dengan sebenar-benarnya untuk dapat digunakan sebagaimana\nmestinya. Apabila saya melanggar dan tidak mematuhi surat pernyataan ini, saya bersedia menerima\nsanksi sesuai ketentuan yang berlaku.'
 'Pasal 26\nPeraturan Rektor ini mulai berlaku pada tanggal ditetapkan.\n\n\n                                                                           Ditetapkan di Surabaya\n                                                                              pada tanggal 3 Januari 2023']","UKT, SPP, SPI, dan SPA",0.99999999995,1.0,0.9744495180864042,0.0
8,Berapa biaya hidup di Eropa untuk program pertukaran?,Saya tidak mengetahui informasi tersebut.,"['kemitraan/kerja sama beasiswa prioritas, maka tidak dapat berpindah program studi, perguruan\ntinggi, dan/atau program Beasiswa LPDP lainnya, atau kelulusan akan dibatalkan.\nDemikian surat pernyataan ini dibuat dengan sebenar-benarnya untuk dapat digunakan sebagaimana\nmestinya. Apabila saya melanggar dan tidak mematuhi surat pernyataan ini, saya bersedia menerima\nsanksi sesuai ketentuan yang berlaku.'
 'program doktor pada semester berjalan; dan/atau\n  d. Mahasiswa program pascasarjana yang berpindah jenis kelas diwajibkan \n   membayar SPP untuk jenis kelas dengan tarif lebih tinggi.\n(2) Perpindahan mahasiswa sebagaimana dimaksud ayat (1) huruf d harus mendapatkan \n  persetujuan Wakil Rektor yang membidangi akademik.'
 'program doktor pada semester berjalan; dan/atau\n  d. Mahasiswa program pascasarjana yang berpindah jenis kelas diwajibkan \n   membayar SPP untuk jenis kelas dengan tarif lebih tinggi.\n(2) Perpindahan mahasiswa sebagaimana dimaksud ayat (1) huruf d harus mendapatkan \n  persetujuan Wakil Rektor yang membidangi akademik.'
 'i. Mahasiswa dari perguruan tinggi mitra luar negeri program kerjasama yang bersifat \n   resiprokal; atau\n  j. Mahasiswa program sarjana atau sarjana terapan yang mampu mempublikasikan \n   paper pada jurnal internasional bereputasi Q1 sebagai nama pertama dengan \n   rekomendasi Wakil Rektor yang membidangi akademik dibebaskan untuk semester \n   berikutnya atau menarik UKT atau SPP pada semester berjalan apabila lulus \n   yudisium.']","Biaya hidup di Eropa sekitar €7,800 per tahun dan biaya kuliah sekitar €10,140 per tahun.",0.0,0.0,0.0,0.0
9,Apa keuntungan mengikuti program pertukaran pelajar?,Tidak ada informasi yang relevan dalam konteks yang diberikan mengenai keuntungan mengikuti program pertukaran pelajar.,"['Syarat dokumen mengikuti syarat program\nbeasiswa yang dipilih (mengacu pada Buku\nPanduan masing-masing program beasiswa).\nSeperti apa format Komitmen kembali ke\nIndonesia, rencana pasca studi, dan\nrencana kontribusi di Indonesia serta\nRencana Bisnis atau Rencana\nPengembangan Bisnis?\nKomitmen kembali ke Indonesia, rencana\npasca studi, dan rencana kontribusi di\nIndonesia (1500 – 2000 kata)\nDeskripsikan dalam tulisan secara jelas dan\nkonkret tentang tema di atas.'
 'program doktor pada semester berjalan; dan/atau\n  d. Mahasiswa program pascasarjana yang berpindah jenis kelas diwajibkan \n   membayar SPP untuk jenis kelas dengan tarif lebih tinggi.\n(2) Perpindahan mahasiswa sebagaimana dimaksud ayat (1) huruf d harus mendapatkan \n  persetujuan Wakil Rektor yang membidangi akademik.'
 'program doktor pada semester berjalan; dan/atau\n  d. Mahasiswa program pascasarjana yang berpindah jenis kelas diwajibkan \n   membayar SPP untuk jenis kelas dengan tarif lebih tinggi.\n(2) Perpindahan mahasiswa sebagaimana dimaksud ayat (1) huruf d harus mendapatkan \n  persetujuan Wakil Rektor yang membidangi akademik.'
 'i. Mahasiswa dari perguruan tinggi mitra luar negeri program kerjasama yang bersifat \n   resiprokal; atau\n  j. Mahasiswa program sarjana atau sarjana terapan yang mampu mempublikasikan \n   paper pada jurnal internasional bereputasi Q1 sebagai nama pertama dengan \n   rekomendasi Wakil Rektor yang membidangi akademik dibebaskan untuk semester \n   berikutnya atau menarik UKT atau SPP pada semester berjalan apabila lulus \n   yudisium.']","Keuntungan termasuk pengalaman internasional, kredit transfer, dan kemungkinan mendapat beasiswa jika berprestasi.",0.249999999975,1.0,0.0,0.0
10,Apa saja pelanggaran dan sanksi yang diberlakukan oleh LPDP?,"LPDP memiliki beberapa ketentuan yang harus dipatuhi oleh penerima beasiswa, dan jika terjadi pelanggaran, maka akan diberlakukan sanksi. Beberapa pelanggaran dan sanksi yang diberlakukan oleh LPDP antara lain:

1. Tidak memenuhi kewajiban pengembalian dana studi yang telah diterima atau pemblokiran untuk mengikuti program LPDP di masa mendatang.
2. Tidak kembali dan mengabdi di Indonesia setelah selesai studi sesuai dengan ketentuan LPDP.
3. Berpindah kewarganegaraan sejak pendaftaran beasiswa sampai dengan selesainya masa kontribusi sebagai alumni beasiswa LPDP.
4. Menerima beasiswa untuk studi dengan jenjang bergelar dari sumber lain yang berpotensi double funding apabila ditetapkan sebagai Penerima Beasiswa.
5. Menggunakan media informasi dan media sosial untuk menyampaikan informasi yang belum terkonfirmasi kebenarannya yang berpotensi menimbulkan konflik di kalangan masyarakat.
6. Terlibat dalam aktivitas atau tindakan yang melanggar hukum dan norma sosial masyarakat Indonesia.
7. Terlibat dalam tindak pidana apapun.
8. Melakukan tindakan terkait dengan penggunaan atau pengedaran zat adiktif atau narkoba.
9. Menyelesaikan studi pada jenjang yang sama dengan jenjang studi yang dilamar.
10. Bekerja selama masa studi tanpa persetujuan LPDP.

Sanksi yang diberlakukan oleh LPDP bagi pelanggar-pelanggaran tersebut antara lain:
- Diberhentikan beasiswanya apabila tidak memenuhi kewajiban.
- Tidak diterima sebagai penerima beasiswa LPDP.
- Diberhentikan beasiswanya apabila tidak memenuhi kewajiban pada huruf tertentu.
- Tidak diterima sebagai pendaftar Beasiswa LPDP program magister atau doktor.
- Tidak memenuhi ketentuan tugas belajar dan mendapatkan surat izin mengikuti seleksi dari pejabat yang berwenang.

Jadi, LPDP memiliki ketentuan yang ketat dan sanksi yang tegas bagi para penerima beasiswa yang melanggar aturan yang telah ditetapkan.","['beasiswa dengan kewajiban pengembalian\ndana studi yang telah diterima dan\npemblokiran untuk mengikuti program LPDP\ndi masa mendatang.\nBagaimana dengan ketentuan\nPengabdian yang ditetapkan LPDP?\n1. Penerima Beasiswa wajib kembali dan\nmengabdi di Indonesia setelah selesai studi\nsesuai dengan ketentuan LPDP.\n2. Kembali ke Indonesia dan berkontribusi di\nIndonesia selama 2 kali masa studi ditambah'
 'Syarat dokumen mengikuti syarat program\nbeasiswa yang dipilih (mengacu pada Buku\nPanduan masing-masing program beasiswa).\nSeperti apa format Komitmen kembali ke\nIndonesia, rencana pasca studi, dan\nrencana kontribusi di Indonesia serta\nRencana Bisnis atau Rencana\nPengembangan Bisnis?\nKomitmen kembali ke Indonesia, rencana\npasca studi, dan rencana kontribusi di\nIndonesia (1500 – 2000 kata)\nDeskripsikan dalam tulisan secara jelas dan\nkonkret tentang tema di atas.'
 'pribadi.\n4. Tidak akan berpindah kewarganegaraan sejak pendaftaran beasiswa sampai dengan selesainya\nmasa kontribusi sebagai alumni beasiswa LPDP.\n5. Tidak akan menerima beasiswa untuk studi dengan jenjang bergelar dari sumber lain yang\nberpotensi double funding apabila ditetapkan sebagai Penerima Beasiswa.\n6. Tidak menggunakan media informasi dan media sosial untuk menyampaikan informasi yang belum\nterkonfirmasi kebenarannya yang berpotensi menimbulkan konflik di kalangan masyarakat.\n7. Tidak pernah, sedang, atau akan terlibat dalam aktivitas atau tindakan yang melanggar hukum dan\nnorma sosial masyarakat Indonesia.\n8. Tidak pernah, sedang, atau akan terlibat dalam tindak pidana apapun.\n9. Tidak pernah, sedang, atau akan melakukan tindakan terkait dengan penggunaan atau\npengedaran zat adiktif atau narkoba.\n10. Tidak pernah menyelesaikan studi pada jenjang yang sama dengan jenjang studi yang dilamar.\n11. Bersedia untuk tidak bekerja selama masa studi, kecuali atas persetujuan LPDP.'
 'c. diberhentikan beasiswanya apabila tidak memenuhi kewajiban pada huruf a atau b.\n14. Sebagai pendaftar Beasiswa LPDP program magister belum pernah menyelesaikan studi magister\n(S2) atau sebagai pendaftar Beasiswa LPDP program doktor belum menyelesaikan studi doktor\n(S3).\n15. Sebagai CPNS, PNS, prajurit TNI, atau anggota POLRI, bersedia memenuhi ketentuan tugas\nbelajar dan mendapatkan surat izin mengikuti seleksi dari pejabat yang berwenang.\n16. Sebagai CPNS, PNS, prajurit TNI, atau anggota POLRI bersedia:']","Pelanggaran meliputi kecurangan selama pendaftaran atau seleksi, memberikan informasi atau dokumen palsu. Sanksi termasuk pembatalan beasiswa dan pengembalian dana studi.",0.8055555555287036,0.1111111111111111,0.8869930890143035,0.0
11,Apa ketentuan pengabdian yang ditetapkan LPDP?,Ketentuan pengabdian yang ditetapkan LPDP adalah penerima beasiswa wajib kembali dan mengabdi di Indonesia setelah selesai studi sesuai dengan ketentuan LPDP. Mereka juga harus kembali ke Indonesia dan berkontribusi di Indonesia selama 2 kali masa studi ditambah.,"['beasiswa dengan kewajiban pengembalian\ndana studi yang telah diterima dan\npemblokiran untuk mengikuti program LPDP\ndi masa mendatang.\nBagaimana dengan ketentuan\nPengabdian yang ditetapkan LPDP?\n1. Penerima Beasiswa wajib kembali dan\nmengabdi di Indonesia setelah selesai studi\nsesuai dengan ketentuan LPDP.\n2. Kembali ke Indonesia dan berkontribusi di\nIndonesia selama 2 kali masa studi ditambah'
 'kejuaraan/non kejuaraan, dan pengalaman\norganisasi pada aplikasi pendaftaran.\nApa saja persyaratan khusus pendaftaran\nBeasiswa Prioritas LPDP – Campus France\nProgram Master?\nPersyaratan khusus Beasiswa Kemitraan LPDP –\nCampus France Program Master adalah sebagai\nberikut:'
 'b. Kelas khusus;\nc. Kelas karyawan;\nd. Kelas jarak jauh;\ne. Kelas yang diselenggarakan bukan di\nperguruan tinggi induk;\nf. Kelas internasional bagi pendaftar tujuan\nstudi dalam negeri;\ng. Kelas yang diselenggarakan di lebih dari\n1 (satu) negara perguruan tinggi; atau\nh. Kelas lainnya yang tidak memenuhi\nketentuan LPDP.\n14. Menyetujui surat pernyataan yang telah\ndisediakan pada aplikasi pendaftaran\nbeasiswa LPDP (poin-poin terlampir).\n15. Menulis profil diri termasuk riwayat pendidikan\nyang tidak diselesaikan pada aplikasi\npendaftaran.\n16. Menulis komitmen kembali ke Indonesia,\nrencana pasca studi, dan rencana kontribusi\ndi Indonesia.\n17. Jika pendaftar memiliki publikasi ilmiah,\nprestasi kejuaraan/non kejuaraan, dan\npengalaman organisasi maka pendaftar\nmengisi riwayat publikasi ilmiah, prestasi\nkejuaraan/non kejuaraan, dan pengalaman\norganisasi pada aplikasi pendaftaran.\nApa saja persyaratan khusus pendaftaran\nBeasiswa Prioritas LPDP – Campus France\nProgram Master?'
 'Syarat dokumen mengikuti syarat program\nbeasiswa yang dipilih (mengacu pada Buku\nPanduan masing-masing program beasiswa).\nSeperti apa format Komitmen kembali ke\nIndonesia, rencana pasca studi, dan\nrencana kontribusi di Indonesia serta\nRencana Bisnis atau Rencana\nPengembangan Bisnis?\nKomitmen kembali ke Indonesia, rencana\npasca studi, dan rencana kontribusi di\nIndonesia (1500 – 2000 kata)\nDeskripsikan dalam tulisan secara jelas dan\nkonkret tentang tema di atas.']",Penerima Beasiswa wajib kembali dan mengabdi di Indonesia selama dua kali masa studi ditambah satu tahun setelah selesai studi.,0.9999999999666667,0.75,0.9815226644052961,1.0
12,Mahasiswa dari jalur apa yang diperkenankan mengajukan permohonan?,Mahasiswa yang diperkenankan mengajukan permohonan adalah mahasiswa program pascasarjana yang berpindah jenis kelas. Mereka harus mengajukan permohonan kepada Wakil Rektor yang membidangi akademik dan mendapatkan persetujuan untuk dapat berpindah jenis kelas.,"['kemitraan/kerja sama beasiswa prioritas, maka tidak dapat berpindah program studi, perguruan\ntinggi, dan/atau program Beasiswa LPDP lainnya, atau kelulusan akan dibatalkan.\nDemikian surat pernyataan ini dibuat dengan sebenar-benarnya untuk dapat digunakan sebagaimana\nmestinya. Apabila saya melanggar dan tidak mematuhi surat pernyataan ini, saya bersedia menerima\nsanksi sesuai ketentuan yang berlaku.'
 'Pasal 9\n(1) Mahasiswa sebagaimana yang dimaksud dalam Pasal 8 ayat (1), status mahasiswanya \n  diaktifkan kembali apabila membayar UKT atau SPP paling lambat minggu ke 4 \n  (empat) masa perkuliahan.\n(2) Mahasiswa sebagaimana yang dimaksud dalam Pasal 8 ayat (1) dan tinggal \n  mengerjakan tugas akhir/ tesis/disertasi, diaktifkan kembali apabila membayar UKT \n  atau SPP paling lambat minggu ke 12 (dua belas) masa perkuliahan.\n(3) Mahasiswa sebagaimana dimaksud dalam Pasal 8 ayat (2) dapat diaktifkan kembali \n  dengan syarat:\n  a. Mahasiswa mengajukan surat permohonan aktif kembali kepada Wakil Rektor \n    yang membidangi akademik, selambat-lambatnya 1 (satu) minggu sebelum \n    perkuliahan semester berikutnya dimulai; dan'
 'Pasal 9\n(1) Mahasiswa sebagaimana yang dimaksud dalam Pasal 8 ayat (1), status mahasiswanya \n  diaktifkan kembali apabila membayar UKT atau SPP paling lambat minggu ke 4 \n  (empat) masa perkuliahan.\n(2) Mahasiswa sebagaimana yang dimaksud dalam Pasal 8 ayat (1) dan tinggal \n  mengerjakan tugas akhir/ tesis/disertasi, diaktifkan kembali apabila membayar UKT \n  atau SPP paling lambat minggu ke 12 (dua belas) masa perkuliahan.\n(3) Mahasiswa sebagaimana dimaksud dalam Pasal 8 ayat (2) dapat diaktifkan kembali \n  dengan syarat:\n  a. Mahasiswa mengajukan surat permohonan aktif kembali kepada Wakil Rektor \n    yang membidangi akademik, selambat-lambatnya 1 (satu) minggu sebelum \n    perkuliahan semester berikutnya dimulai; dan'
 'program doktor pada semester berjalan; dan/atau\n  d. Mahasiswa program pascasarjana yang berpindah jenis kelas diwajibkan \n   membayar SPP untuk jenis kelas dengan tarif lebih tinggi.\n(2) Perpindahan mahasiswa sebagaimana dimaksud ayat (1) huruf d harus mendapatkan \n  persetujuan Wakil Rektor yang membidangi akademik.']",Mahasiswa sarjana dan vokasi (selain mahasiswa IUP dan Joint Degree),0.999999999975,1.0,0.9020236772495732,1.0
13,Melalui aplikasi apa mahasiswa dapat mengajukan permohonan keringanan UKT?,"Mahasiswa dapat mengajukan permohonan keringanan UKT melalui aplikasi sipmaba.its.ac.id. Aplikasi tersebut hanya diperkenankan untuk mahasiswa sarjana dan mahasiswa vokasi/sarjana terapan, kecuali mahasiswa IUP dan Joint Degree.","['KEMENTERIAN PENDIDIKAN, KEBUDAYAAN,\nRISET, DAN TEKNOLOGI\nINSTITUT TEKNOLOGI SEPULUH NOPEMBER\nDIREKTORAT PERENCANAAN DAN PENGEMBANGAN\nKampus ITS Sukolilo Surabaya 60111\nTelepon: 031-5939632, PABX 1292, 1006, 1010, 1007, 1111\nFax: 031-5939632\nemail: tu_dpal@its.ac.id\nSurat Pengumuman\nNomor : 7244/IT2.II.1/B/TU.00.02/2023\nPENGUMUMAN PERIHAL PERMOHONAN KERINGANAN UKT/SPP\nSEMESTER GENAP 2023/2024\nDitujukan kepada Mahasiswa ITS Program Sarjana dan Sarjana Terapan.\nBagi mahasiswa ITS yang berencana melakukan permohonan keringanan UKT/SPP, maka diharapkan dapat memperhatikan\nbeberapa hal sebagaimana berikut:\n1. Permohonan Keringanan UKT/SPP dapat dilakukan melalui sipmaba.its.ac.id, di mana hanya diperkenankan untuk\nmahasiswa sarjana dan mahasiswa vokasi / sarjana terapan (selain mahasiswa IUP dan Joint Degree). Pada saat\nperiode pengajuan, Mahasiswa yang dimaksud disyaratkan saat ini minimal akan memasuki semester 2 (dua)'
 'KEMENTERIAN PENDIDIKAN, KEBUDAYAAN,\r\nRISET, DAN TEKNOLOGI\r\nINSTITUT TEKNOLOGI SEPULUH NOPEMBER\r\nDIREKTORAT PERENCANAAN DAN PENGEMBANGAN\r\nKampus ITS Sukolilo Surabaya 60111\r\nTelepon: 031-5939632, PABX 1292, 1006, 1010, 1007, 1111\r\nFax: 031-5939632\r\nemail: tu_dpal@its.ac.id\r\nSurat Pengumuman\r\nNomor : 7244/IT2.II.1/B/TU.00.02/2023\r\nPENGUMUMAN PERIHAL PERMOHONAN KERINGANAN UKT/SPP\r\nSEMESTER GENAP 2023/2024\r\nDitujukan kepada Mahasiswa ITS Program Sarjana dan Sarjana Terapan.\r\nBagi mahasiswa ITS yang berencana melakukan permohonan keringanan UKT/SPP, maka diharapkan dapat memperhatikan\r\nbeberapa hal sebagaimana berikut:\r\n1. Permohonan Keringanan UKT/SPP dapat dilakukan melalui sipmaba.its.ac.id, di mana hanya diperkenankan untuk\r\nmahasiswa sarjana dan mahasiswa vokasi / sarjana terapan (selain mahasiswa IUP dan Joint Degree). Pada saat\r\nperiode pengajuan, Mahasiswa yang dimaksud disyaratkan saat ini minimal akan memasuki semester 2 (dua)'
 'Pasal 13\nMahasiswa program sarjana dan sarjana terapan pada semester 9, dan mengambil mata \nkilliah kurang dari atau sama dengan 6 sks, diberikan keringanan sebesar 50% (lima \npuluh persen) dari besaran UKT atau SPP.\n\n                Bagian Keempat \n           Keringanan Dana SPP Untuk Dosen ITS'
 'Pasal 13\nMahasiswa program sarjana dan sarjana terapan pada semester 9, dan mengambil mata \nkilliah kurang dari atau sama dengan 6 sks, diberikan keringanan sebesar 50% (lima \npuluh persen) dari besaran UKT atau SPP.\n\n                Bagian Keempat \n           Keringanan Dana SPP Untuk Dosen ITS']",myITS Portal atau portal.its.ac.id dengan aplikasi layanan SIPMABA,0.999999999975,1.0,0.9623416928955919,1.0
14,Data dan berkas pendukung apa yang harus diupload untuk pengajuan keringanan UKT?,"Untuk pengajuan keringanan UKT, berikut adalah data dan berkas pendukung yang harus diupload pada sistem:
1. Surat permohonan kepada Wakil Rektor II yang disertai alasan mengajukan keringanan UKT (format bebas)
2. Bukti/data dukung alasan mengajukan keringanan UKT (bukti dijadikan 1 file dengan surat permohonan keringanan UKT), misalnya surat keterangan dari Rumah Sakit/dokter jika orang tua sakit
3. Surat keterangan pekerjaan orang tua (ayah dan ibu) terbaru
4. Surat keterangan penghasilan orang tua (ayah dan ibu) terbaru
5. SPT Tahunan orang tua (ayah dan ibu) terbaru
6. Foto usaha pekerjaan orang tua (ayah dan ibu) terbaru (untuk jenis pekerjaan pedagang/pengusaha)
7. Tagihan listrik terbaru
8. PBB terbaru
9. Kartu Keluarga (KK) terbaru
10. Pajak kendaraan roda 2 dan 4 terbaru
11. Foto rumah (tampak depan, ruang tamu, 2 kamar tidur, dan tampak belakang/dapur/kamar mandi)","['menu pendukung (supported) dan upload berkas (upload file). Data dan berkas pendukung yang harus diupload\ndi pada sistem adalah:\nSurat permohonan kepada Wakil Rektor II yang disertai alasan mengajukan keringanan UKT (format bebas)\nBukti/data dukung alasan mengajukan keringanan UKT (bukti dijadikan 1 file dengan surat permohonan keringanan\nUKT). Misalnya, apabila orang tua sakit, maka data dukung yang dilampirkan berupa surat keterangan yang\ndikeluarkan dari Rumah Sakit/dokter yang menangani penyakit tersebut.\nSurat keterangan pekerjaan orang tua (ayah dan ibu) terbaru\nSurat keterangan penghasilan orang tua (ayah dan ibu) terbaru\nSPT Tahunan orang tua (ayah dan ibu) terbaru\nFoto usaha pekerjaan orang tua (ayah dan ibu) terbaru (untuk jenis pekerjaan pedangang/pengusaha)\nTagihan listrik (bukti pembayaran listrik) terbaru\nPBB terbaru\nKartu keluarga (KK) terbaru\nPajak kendaraan roda 2 dan 4 terbaru\nFoto rumah (tampak depan, ruang tamu, 2 kamar tidur dan tampak belakang/dapur/kamar mandi)'
 'menu pendukung (supported) dan upload berkas (upload file). Data dan berkas pendukung yang harus diupload\r\ndi pada sistem adalah:\r\nSurat permohonan kepada Wakil Rektor II yang disertai alasan mengajukan keringanan UKT (format bebas)\r\nBukti/data dukung alasan mengajukan keringanan UKT (bukti dijadikan 1 file dengan surat permohonan keringanan\r\nUKT). Misalnya, apabila orang tua sakit, maka data dukung yang dilampirkan berupa surat keterangan yang\r\ndikeluarkan dari Rumah Sakit/dokter yang menangani penyakit tersebut.\r\nSurat keterangan pekerjaan orang tua (ayah dan ibu) terbaru\r\nSurat keterangan penghasilan orang tua (ayah dan ibu) terbaru\r\nSPT Tahunan orang tua (ayah dan ibu) terbaru\r\nFoto usaha pekerjaan orang tua (ayah dan ibu) terbaru (untuk jenis pekerjaan pedangang/pengusaha)\r\nTagihan listrik (bukti pembayaran listrik) terbaru\r\nPBB terbaru\r\nKartu keluarga (KK) terbaru\r\nPajak kendaraan roda 2 dan 4 terbaru'
 'Dipublikasikan tanggal 11 Januari 2024\na. diberhentikan beasiswanya apabila mengundurkan diri sebagai CPNS, PNS, prajurit TNI, atau\nanggota POLRI setelah ditetapkan sebagai Calon Penerima Beasiswa;\nb. diberhentikan beasiswanya dan melakukan pengembalian dana studi apabila mengundurkan\ndiri sebagai CPNS, PNS, prajurit TNI, atau anggota POLRI setelah ditetapkan sebagai\nPenerima Beasiswa LPDP.\n17. Memberikan dokumen dan data pendaftaran yang benar, akurat, dan sesuai aslinya serta bersedia\nmenerima sanksi pemblokiran bila terdapat informasi pada dokumen dan data pendaftaran yang\ntidak benar.\n18. Berkomitmen melaksanakan ketentuan beasiswa LPDP.\n19. Apabila dinyatakan lulus pada program studi dan perguruan tinggi pada pogram beasiswa\nkemitraan/kerja sama beasiswa prioritas, maka tidak dapat berpindah program studi, perguruan\ntinggi, dan/atau program Beasiswa LPDP lainnya, atau kelulusan akan dibatalkan.'
 'Dipublikasikan tanggal 11 Januari 2024\nbeasiswa. Surat rekomendasi dapat\ndisampaikan dengan dua cara:\na. Surat Rekomendasi Online Form,\ndisampaikan dengan cara menginput\ndata pemberi rekomendasi melalui\naplikasi pendaftaran yang terdiri dari\nnama perekomendasi, instansi, jabatan,\nemail aktif dan nomor handphone.\nSelanjutnya, LPDP akan mengirimkan\nemail kepada perekomendasi untuk\nmengisikan rekomendasi yang kemudian\ndikirimkan (submit) kepada LPDP.\nb. Surat Rekomendasi Offline Form\n(unggahan) yang ditandatangani oleh\nPemberi Rekomendasi, disampaikan\ndengan cara mengunggah dokumen\npada aplikasi pendaftaran serta\nmengisikan data bulan dan tahun surat\ntersebut diterbitkan atau ditandatangani\n(contoh format terlampir).\n8. Bagi pendaftar berstatus PNS dan CPNS di\nsemua program beasiswa LPDP wajib\nmelampirkan surat usulan atau surat\nrekomendasi sekurang-kurangnya dari\npejabat setingkat eselon II yang membidangi\npembinaan/pengembangan SDM pada\nKementerian/Lembaga atau Pemerintah']","Surat permohonan, bukti dukung, surat keterangan pekerjaan, surat keterangan penghasilan, SPT, foto usaha, tagihan listrik, PBB, kartu keluarga, pajak kendaraan, foto rumah",0.999999999975,1.0,0.9787987342748062,0.0
15,Apa yang harus disertakan jika alasan permohonan keringanan adalah orang tua pensiun?,"Jawaban: Jika alasan permohonan keringanan adalah orang tua pensiun, maka harus disertakan surat keterangan pensiun dari orang tua yang bersangkutan sebagai salah satu persyaratan untuk memperoleh keringanan dana SPP sesuai dengan ketentuan yang berlaku.","['kemitraan/kerja sama beasiswa prioritas, maka tidak dapat berpindah program studi, perguruan\ntinggi, dan/atau program Beasiswa LPDP lainnya, atau kelulusan akan dibatalkan.\nDemikian surat pernyataan ini dibuat dengan sebenar-benarnya untuk dapat digunakan sebagaimana\nmestinya. Apabila saya melanggar dan tidak mematuhi surat pernyataan ini, saya bersedia menerima\nsanksi sesuai ketentuan yang berlaku.'
 'pribadi.\n4. Tidak akan berpindah kewarganegaraan sejak pendaftaran beasiswa sampai dengan selesainya\nmasa kontribusi sebagai alumni beasiswa LPDP.\n5. Tidak akan menerima beasiswa untuk studi dengan jenjang bergelar dari sumber lain yang\nberpotensi double funding apabila ditetapkan sebagai Penerima Beasiswa.\n6. Tidak menggunakan media informasi dan media sosial untuk menyampaikan informasi yang belum\nterkonfirmasi kebenarannya yang berpotensi menimbulkan konflik di kalangan masyarakat.\n7. Tidak pernah, sedang, atau akan terlibat dalam aktivitas atau tindakan yang melanggar hukum dan\nnorma sosial masyarakat Indonesia.\n8. Tidak pernah, sedang, atau akan terlibat dalam tindak pidana apapun.\n9. Tidak pernah, sedang, atau akan melakukan tindakan terkait dengan penggunaan atau\npengedaran zat adiktif atau narkoba.\n10. Tidak pernah menyelesaikan studi pada jenjang yang sama dengan jenjang studi yang dilamar.\n11. Bersedia untuk tidak bekerja selama masa studi, kecuali atas persetujuan LPDP.'
 'Pasa1 14\n(1) Mahasiswa yang merupakan dosen tetap ITS, selanjutnya disebut pegawai pelajar, \n  dapat memperoleh keringanan dana SPP dengan ketentuan sebagai berikut:\n  a. tercatat sebagai mahasiswa aktif program doktor pada salah satu Program Studi di \n   ITS;\n  b. berusia paling rendah 35 tahun;\n  c. untuk dosen tetap PNS telah mendapatkan surat keputusan dari kementerian \n   tentang tugas belajar dengan beasiswa atau sedang diusulkan oleh ITS untuk \n   mendapatkan surat keputusan dari kementerian tentang tugas belajar dengan \n   beasiswa; dan\n  d. Untuk dosen tetap Non PNS telah mendapatkan surat keputusan dari Rektor \n   tentang tugas belajar dengan beasiswa.\n(2) Beasiswa yang dimaksud sebagaimana pada ayat (1) huruf c dan huruf d berupa \n  pembiayaan untuk keringanan SPP yang bersumber dari dana ITS.\n(3) Pengusulan oleh ITS sebagaimana dimaksud pada ayat (1) huruf c telah mendapat \n  rekomendasi dari Wakil Rektor yang membidangi sumber daya manusia.'
 'Pasa1 14\n(1) Mahasiswa yang merupakan dosen tetap ITS, selanjutnya disebut pegawai pelajar, \n  dapat memperoleh keringanan dana SPP dengan ketentuan sebagai berikut:\n  a. tercatat sebagai mahasiswa aktif program doktor pada salah satu Program Studi di \n   ITS;\n  b. berusia paling rendah 35 tahun;\n  c. untuk dosen tetap PNS telah mendapatkan surat keputusan dari kementerian \n   tentang tugas belajar dengan beasiswa atau sedang diusulkan oleh ITS untuk \n   mendapatkan surat keputusan dari kementerian tentang tugas belajar dengan \n   beasiswa; dan\n  d. Untuk dosen tetap Non PNS telah mendapatkan surat keputusan dari Rektor \n   tentang tugas belajar dengan beasiswa.\n(2) Beasiswa yang dimaksud sebagaimana pada ayat (1) huruf c dan huruf d berupa \n  pembiayaan untuk keringanan SPP yang bersumber dari dana ITS.\n(3) Pengusulan oleh ITS sebagaimana dimaksud pada ayat (1) huruf c telah mendapat \n  rekomendasi dari Wakil Rektor yang membidangi sumber daya manusia.']",Surat keterangan/surat keputusan termasuk gaji pensiun atau pesangon,0.4166666666458333,0.0,0.0,0.0
16,Dimana saya bisa mengajukan permohonan keringanan UKT?,"Anda bisa mengajukan permohonan keringanan UKT melalui situs sipmaba.its.ac.id. Permohonan keringanan UKT hanya diperkenankan untuk mahasiswa sarjana dan mahasiswa vokasi/sarjana terapan (selain mahasiswa IUP dan Joint Degree). Saat periode pengajuan, mahasiswa yang dimaksud disyaratkan minimal akan memasuki semester 2 (dua).","['KEMENTERIAN PENDIDIKAN, KEBUDAYAAN,\nRISET, DAN TEKNOLOGI\nINSTITUT TEKNOLOGI SEPULUH NOPEMBER\nDIREKTORAT PERENCANAAN DAN PENGEMBANGAN\nKampus ITS Sukolilo Surabaya 60111\nTelepon: 031-5939632, PABX 1292, 1006, 1010, 1007, 1111\nFax: 031-5939632\nemail: tu_dpal@its.ac.id\nSurat Pengumuman\nNomor : 7244/IT2.II.1/B/TU.00.02/2023\nPENGUMUMAN PERIHAL PERMOHONAN KERINGANAN UKT/SPP\nSEMESTER GENAP 2023/2024\nDitujukan kepada Mahasiswa ITS Program Sarjana dan Sarjana Terapan.\nBagi mahasiswa ITS yang berencana melakukan permohonan keringanan UKT/SPP, maka diharapkan dapat memperhatikan\nbeberapa hal sebagaimana berikut:\n1. Permohonan Keringanan UKT/SPP dapat dilakukan melalui sipmaba.its.ac.id, di mana hanya diperkenankan untuk\nmahasiswa sarjana dan mahasiswa vokasi / sarjana terapan (selain mahasiswa IUP dan Joint Degree). Pada saat\nperiode pengajuan, Mahasiswa yang dimaksud disyaratkan saat ini minimal akan memasuki semester 2 (dua)'
 'KEMENTERIAN PENDIDIKAN, KEBUDAYAAN,\r\nRISET, DAN TEKNOLOGI\r\nINSTITUT TEKNOLOGI SEPULUH NOPEMBER\r\nDIREKTORAT PERENCANAAN DAN PENGEMBANGAN\r\nKampus ITS Sukolilo Surabaya 60111\r\nTelepon: 031-5939632, PABX 1292, 1006, 1010, 1007, 1111\r\nFax: 031-5939632\r\nemail: tu_dpal@its.ac.id\r\nSurat Pengumuman\r\nNomor : 7244/IT2.II.1/B/TU.00.02/2023\r\nPENGUMUMAN PERIHAL PERMOHONAN KERINGANAN UKT/SPP\r\nSEMESTER GENAP 2023/2024\r\nDitujukan kepada Mahasiswa ITS Program Sarjana dan Sarjana Terapan.\r\nBagi mahasiswa ITS yang berencana melakukan permohonan keringanan UKT/SPP, maka diharapkan dapat memperhatikan\r\nbeberapa hal sebagaimana berikut:\r\n1. Permohonan Keringanan UKT/SPP dapat dilakukan melalui sipmaba.its.ac.id, di mana hanya diperkenankan untuk\r\nmahasiswa sarjana dan mahasiswa vokasi / sarjana terapan (selain mahasiswa IUP dan Joint Degree). Pada saat\r\nperiode pengajuan, Mahasiswa yang dimaksud disyaratkan saat ini minimal akan memasuki semester 2 (dua)'
 'kemitraan/kerja sama beasiswa prioritas, maka tidak dapat berpindah program studi, perguruan\ntinggi, dan/atau program Beasiswa LPDP lainnya, atau kelulusan akan dibatalkan.\nDemikian surat pernyataan ini dibuat dengan sebenar-benarnya untuk dapat digunakan sebagaimana\nmestinya. Apabila saya melanggar dan tidak mematuhi surat pernyataan ini, saya bersedia menerima\nsanksi sesuai ketentuan yang berlaku.'
 'BAB IX \n      BESARAN DAN MEKANISME PEMBAYARAN DANA PENDIDIKAN\n\n                  Pasal 24\n(1) Besaran dana pendidikan ditetapkan melalui keputusan Rektor.\n(2) Pembayaran dana pendidikan sebagaimana dimaksud pada ayat (1) dilakukan secara \n  online melalui bank persepsi yang ditunjuk, sesuai jadwal pembayaran yang telah \n  ditetapkan.\n\n\n                   12\n(3) Dana Pendidikan yang telah dibayarkan tidak dapat ditarik kembali kecuali memenuhi \n      ketentuan sebagaimana diatur dalam Pasal 20.\n\n                                                                            BAB X \n                                                             KETENTUAN PENUTUP']",Permohonan keringanan UKT dapat diajukan melalui SIPMABA di portal.its.ac.id.,0.99999999995,0.75,0.9635386479530931,1.0
17,Kapan pengajuan keringanan UKT/SPP dapat dilakukan?,Pengajuan keringanan UKT/SPP dapat dilakukan mulai tanggal 01 hingga 17 Desember 2023 melalui aplikasi sipmaba melalui portal.its.ac.id oleh mahasiswa.,"['Pasal 13\nMahasiswa program sarjana dan sarjana terapan pada semester 9, dan mengambil mata \nkilliah kurang dari atau sama dengan 6 sks, diberikan keringanan sebesar 50% (lima \npuluh persen) dari besaran UKT atau SPP.\n\n                Bagian Keempat \n           Keringanan Dana SPP Untuk Dosen ITS'
 'Pasal 13\nMahasiswa program sarjana dan sarjana terapan pada semester 9, dan mengambil mata \nkilliah kurang dari atau sama dengan 6 sks, diberikan keringanan sebesar 50% (lima \npuluh persen) dari besaran UKT atau SPP.\n\n                Bagian Keempat \n           Keringanan Dana SPP Untuk Dosen ITS'
 'UKT. Selanjutnya mahasiswa dapat mengisi kelengkapan dokumen yang diperlukan untuk proses pengajuan keringanan.\nApabila menemui kendala di dalam proses pengisian data, mahasiswa dapat bertanya via whatsapp messanger ke\nnomor 081231223994.\n3. Timeline pengisian adalah sebagaimana berikut :\n01–17 Desember 2023 : Pengajuan keringanan UKT/SPP di aplikasi sipmaba melalui portal.its.ac.id\noleh mahasiswa\n18 – 24 Desember 2023 : Pengecekan/verifikasi oleh Verifikator Banding UKT/SPP\n27 - 29 Desember 2023 : Evaluasi oleh Subdit Perencanaan Anggaran\n02 – 05 Januari 2024 : Sinkronisasi data tagihan UKT dengan Biro Keuangan\n08 Januari 2024 : Pengumuman hasil Banding UKT/SPP\n10 – 31 Januari 2024 : Masa pembayaran UKT/SPP semester genap 2023/2024\n4. Pada pengajuan keringanan UKT, mahasiswa harus melakukan update data dan berkas di aplikasi SIPMABA pada\nmenu pendukung (supported) dan upload berkas (upload file). Data dan berkas pendukung yang harus diupload\ndi pada sistem adalah:'
 'UKT. Selanjutnya mahasiswa dapat mengisi kelengkapan dokumen yang diperlukan untuk proses pengajuan keringanan.\r\nApabila menemui kendala di dalam proses pengisian data, mahasiswa dapat bertanya via whatsapp messanger ke\r\nnomor 081231223994.\r\n3. Timeline pengisian adalah sebagaimana berikut :\r\n01–17 Desember 2023 : Pengajuan keringanan UKT/SPP di aplikasi sipmaba melalui portal.its.ac.id\r\noleh mahasiswa\r\n18 – 24 Desember 2023 : Pengecekan/verifikasi oleh Verifikator Banding UKT/SPP\r\n27 - 29 Desember 2023 : Evaluasi oleh Subdit Perencanaan Anggaran\r\n02 – 05 Januari 2024 : Sinkronisasi data tagihan UKT dengan Biro Keuangan\r\n08 Januari 2024 : Pengumuman hasil Banding UKT/SPP\r\n10 – 31 Januari 2024 : Masa pembayaran UKT/SPP semester genap 2023/2024\r\n4. Pada pengajuan keringanan UKT, mahasiswa harus melakukan update data dan berkas di aplikasi SIPMABA pada\r\nmenu pendukung (supported) dan upload berkas (upload file). Data dan berkas pendukung yang harus diupload\r\ndi pada sistem adalah:']",Pengajuan keringanan UKT/SPP dapat dilakukan pada 01-17 Desember 2023.,0.999999999975,1.0,0.9939641418526818,1.0
18,Apa yang harus dilakukan jika orang tua meninggal dunia?,"Jika orang tua meninggal dunia, hal pertama yang harus dilakukan adalah segera mengurus proses pemakaman dan mengurus segala administrasi terkait pemakaman tersebut. Selain itu, penting juga untuk memberitahukan kepada keluarga dan kerabat terdekat mengenai kepergian orang tua tersebut. Selain itu, jika orang tua yang meninggal memiliki asuransi atau warisan, maka perlu juga mengurus proses klaim asuransi dan pembagian warisan sesuai dengan ketentuan hukum yang berlaku. Jika diperlukan, dapat juga mencari bantuan dari ahli waris atau pengacara untuk membantu proses administrasi dan hukum terkait kepergian orang tua.","['Rektor tentang tugas belajar dengan beasiswa.\n(2) Beasiswa yang dimaksud sebagaimana pada ayat (1) huruf c dan huruf d berupa \n  pembiayaan untuk keringanan SPP yang bersumber dari dana ITS.\n(3) Pengusulan oleh ITS sebagaimana dimaksud pada ayat (1) huruf c telah mendapat \n  rekomendasi dari Wakil Rektor yang membidangi sumber daya manusia.\n(4) Penetapan Keputusan Rektor sebagaimana dimaksud pada ayat (1) huruf d telah \n  mendapat rekomendasi dari Wakil Rektor yang membidangi sumber daya manusia'
 'Rektor tentang tugas belajar dengan beasiswa.\n(2) Beasiswa yang dimaksud sebagaimana pada ayat (1) huruf c dan huruf d berupa \n  pembiayaan untuk keringanan SPP yang bersumber dari dana ITS.\n(3) Pengusulan oleh ITS sebagaimana dimaksud pada ayat (1) huruf c telah mendapat \n  rekomendasi dari Wakil Rektor yang membidangi sumber daya manusia.\n(4) Penetapan Keputusan Rektor sebagaimana dimaksud pada ayat (1) huruf d telah \n  mendapat rekomendasi dari Wakil Rektor yang membidangi sumber daya manusia'
 'pribadi.\n4. Tidak akan berpindah kewarganegaraan sejak pendaftaran beasiswa sampai dengan selesainya\nmasa kontribusi sebagai alumni beasiswa LPDP.\n5. Tidak akan menerima beasiswa untuk studi dengan jenjang bergelar dari sumber lain yang\nberpotensi double funding apabila ditetapkan sebagai Penerima Beasiswa.\n6. Tidak menggunakan media informasi dan media sosial untuk menyampaikan informasi yang belum\nterkonfirmasi kebenarannya yang berpotensi menimbulkan konflik di kalangan masyarakat.\n7. Tidak pernah, sedang, atau akan terlibat dalam aktivitas atau tindakan yang melanggar hukum dan\nnorma sosial masyarakat Indonesia.\n8. Tidak pernah, sedang, atau akan terlibat dalam tindak pidana apapun.\n9. Tidak pernah, sedang, atau akan melakukan tindakan terkait dengan penggunaan atau\npengedaran zat adiktif atau narkoba.\n10. Tidak pernah menyelesaikan studi pada jenjang yang sama dengan jenjang studi yang dilamar.\n11. Bersedia untuk tidak bekerja selama masa studi, kecuali atas persetujuan LPDP.'
 'kemitraan/kerja sama beasiswa prioritas, maka tidak dapat berpindah program studi, perguruan\ntinggi, dan/atau program Beasiswa LPDP lainnya, atau kelulusan akan dibatalkan.\nDemikian surat pernyataan ini dibuat dengan sebenar-benarnya untuk dapat digunakan sebagaimana\nmestinya. Apabila saya melanggar dan tidak mematuhi surat pernyataan ini, saya bersedia menerima\nsanksi sesuai ketentuan yang berlaku.']",Lampirkan surat kematian atau akte kematian.,0.0,0.0,0.9999999999999994,0.0
19,Bagaimana cara login ke portal pengajuan keringanan UKT?,"Anda dapat login ke portal pengajuan keringanan UKT dengan cara sebagai berikut:
1. Buka myITS Portal atau portal.its.ac.id
2. Pilih aplikasi layanan SIPMABA
3. Login dengan memilih role ""Login as Mahasiswa Lama""
4. Setelah login, pilih menu ""Permohonan Keringanan UKT""
5. Isi kelengkapan dokumen yang diperlukan untuk proses pengajuan keringanan.

Semoga jawaban ini membantu!","['periode pengajuan, Mahasiswa yang dimaksud disyaratkan saat ini minimal akan memasuki semester 2 (dua)\ndan bukan termasuk kelompok penerima beasiswa, baik beasiswa Bidik Misi/KIP-K maupun beasiswa lainnya, serta\nbelum pernah mendapatkan penurunan UKT dari proses banding UKT sebelumnya,\n2. Permohonan Keringanan UKT dilakukan melalui myITS Portal atau portal.its.ac.id dengan aplikasi layanan\nSIPMABA dilakukan dengan melakukan terhadap update data–data kelengkapan verifikasi UKT yang sebelumnya\npernah diisi oleh mahasiswa pada saat menjadi calon mahasiswa baru.\nPengisian data dapat dilakukan dengan cara login melalui myITS Portal atau portal.its.ac.id dan memilih aplikasi SIPMABA\nkemudian memilih role Login as Mahasiswa Lama. Setelah login, mahasiswa dapat memilih menu Permohonan Keringanan\nUKT. Selanjutnya mahasiswa dapat mengisi kelengkapan dokumen yang diperlukan untuk proses pengajuan keringanan.'
 'periode pengajuan, Mahasiswa yang dimaksud disyaratkan saat ini minimal akan memasuki semester 2 (dua)\r\ndan bukan termasuk kelompok penerima beasiswa, baik beasiswa Bidik Misi/KIP-K maupun beasiswa lainnya, serta\r\nbelum pernah mendapatkan penurunan UKT dari proses banding UKT sebelumnya,\r\n2. Permohonan Keringanan UKT dilakukan melalui myITS Portal atau portal.its.ac.id dengan aplikasi layanan\r\nSIPMABA dilakukan dengan melakukan terhadap update data–data kelengkapan verifikasi UKT yang sebelumnya\r\npernah diisi oleh mahasiswa pada saat menjadi calon mahasiswa baru.\r\nPengisian data dapat dilakukan dengan cara login melalui myITS Portal atau portal.its.ac.id dan memilih aplikasi SIPMABA\r\nkemudian memilih role Login as Mahasiswa Lama. Setelah login, mahasiswa dapat memilih menu Permohonan Keringanan\r\nUKT. Selanjutnya mahasiswa dapat mengisi kelengkapan dokumen yang diperlukan untuk proses pengajuan keringanan.'
 'beasiswa dengan kewajiban pengembalian\ndana studi yang telah diterima dan\npemblokiran untuk mengikuti program LPDP\ndi masa mendatang.\nBagaimana dengan ketentuan\nPengabdian yang ditetapkan LPDP?\n1. Penerima Beasiswa wajib kembali dan\nmengabdi di Indonesia setelah selesai studi\nsesuai dengan ketentuan LPDP.\n2. Kembali ke Indonesia dan berkontribusi di\nIndonesia selama 2 kali masa studi ditambah'
 'BAB IX \n      BESARAN DAN MEKANISME PEMBAYARAN DANA PENDIDIKAN\n\n                  Pasal 24\n(1) Besaran dana pendidikan ditetapkan melalui keputusan Rektor.\n(2) Pembayaran dana pendidikan sebagaimana dimaksud pada ayat (1) dilakukan secara \n  online melalui bank persepsi yang ditunjuk, sesuai jadwal pembayaran yang telah \n  ditetapkan.\n\n\n                   12\n(3) Dana Pendidikan yang telah dibayarkan tidak dapat ditarik kembali kecuali memenuhi \n      ketentuan sebagaimana diatur dalam Pasal 20.\n\n                                                                            BAB X \n                                                             KETENTUAN PENUTUP']",Login melalui myITS Portal atau portal.its.ac.id dan memilih aplikasi SIPMABA dengan role Login as Mahasiswa Lama.,0.9999999999666667,0.8571428571428571,0.9999986588859434,1.0
