,question,ground_truth,contexts,answer
0,Apa saja persyaratan umum pendaftaran Beasiswa Prioritas LPDP – Campus France Program Master?,"Warga Negara Indonesia, telah menyelesaikan studi D4/S1, tidak diizinkan bagi yang telah menyelesaikan studi S2, dan bagi lulusan luar negeri wajib melampirkan hasil penyetaraan ijazah dan konversi IPK.","['kejuaraan/non kejuaraan, dan pengalaman\norganisasi pada aplikasi pendaftaran.\nApa saja persyaratan khusus pendaftaran\nBeasiswa Prioritas LPDP – Campus France\nProgram Master?\nPersyaratan khusus Beasiswa Kemitraan LPDP –\nCampus France Program Master adalah sebagai\nberikut:', 'Panduan Pendaftaran\nBeasiswa Prioritas\nLPDP - Campus France\nProgram Master\nTahun 2024\nlpdp.kemenkeu.go.id', 'Siapakah Sasaran Beasiswa Prioritas\nLPDP – Campus France Program Master?\n1. Warga Negara Indonesia (WNI)\n2. PNS/TNI/POLRI\nSeperti Apa Skema Prioritas LPDP –\nCampus France Program Master?\nPendaftar wajib mendaftar secara bersamaan\npada beasiswa Kemitraan LPDP – Campus France\nProgram Master dan salah satu program Magister\nbeasiswa Afirmasi/Targeted/Umum tujuan luar\nnegeri, dengan skema berikut.\n1. Beasiswa Kemitraan LPDP – Campus France\nProgram Master:\na. Beasiswa LPDP – Campus France\nProgram Master diperuntukkan bagi\nWarga Negara Indonesia untuk dapat\nmenempuh pendidikan pada program\nmagister di program studi dan universitas\nsebagaimana daftar terlampir dengan\ndurasi pendanaan paling lama 24 (dua\npuluh empat) bulan.\nb. Pendaftar diharuskan untuk melakukan\npendaftaran pada:\n● Perguruan Tinggi Tujuan Studi\nsesuai jadwal dan ketentuan yang\nberlaku di Perguruan Tinggi, dan\n● Campus France sesuai jadwal dan\nketentuan yang berlaku di Campus\nFrance.\n2. Persyaratan dan dokumen pada Beasiswa', 'sesuai jadwal dan ketentuan yang\nberlaku di Perguruan Tinggi, dan\n● Campus France sesuai jadwal dan\nketentuan yang berlaku di Campus\nFrance.\n2. Persyaratan dan dokumen pada Beasiswa\nAfirmasi/Targeted/Umum yang dipilih,\nmengikuti syarat dan ketentuan pada masing-\nmasing program beasiswa.\n3. Pendaftar yang lolos seleksi pada program\nBeasiswa Kemitraan LPDP – Campus France\nProgram Master wajib menempuh studi pada\nprogram studi dan universitas tersebut.\n4. Apabila dinyatakan lulus pada program studi\ndan perguruan tinggi pada program beasiswa\nkemitraan/kerja sama beasiswa prioritas,\nmaka tidak dapat berpindah program studi,\nperguruan tinggi, dan/atau Beasiswa LPDP\nlainnya, atau kelulusan akan dibatalkan.\n5. Pendaftar yang tidak lolos seleksi pada\nprogram Beasiswa Kemitraan LPDP –\nCampus France, maka akan diproses pada']","Persyaratan umum pendaftaran Beasiswa Prioritas LPDP - Campus France Program Master adalah sebagai berikut:
1. Warga Negara Indonesia (WNI)
2. PNS/TNI/POLRI
3. Mendaftar secara bersamaan pada beasiswa Kemitraan LPDP - Campus France Program Master dan salah satu program Magister beasiswa Afirmasi/Targeted/Umum tujuan luar negeri
4. Menempuh pendidikan pada program magister di program studi dan universitas yang tercantum dengan durasi pendanaan paling lama 24 bulan
5. Melakukan pendaftaran pada Perguruan Tinggi Tujuan Studi dan Campus France sesuai jadwal dan ketentuan yang berlaku
6. Memenuhi persyaratan dan dokumen pada program beasiswa Afirmasi/Targeted/Umum yang dipilih
7. Menempuh studi pada program studi dan universitas yang telah dipilih setelah lolos seleksi
8. Tidak dapat berpindah program studi, perguruan tinggi, dan/atau Beasiswa LPDP lainnya setelah dinyatakan lulus
9. Jika tidak lolos seleksi pada program Beasiswa Kemitraan LPDP - Campus France, akan diproses pada tahap selanjutnya."
1,Apa yang harus dilakukan pendaftar yang merupakan PNS?,Melampirkan surat usulan atau rekomendasi dari pejabat eselon II yang mencantumkan NIP pendaftar.,"['melampirkan surat usulan atau surat\nrekomendasi sekurang-kurangnya dari\npejabat setingkat eselon II yang membidangi\npembinaan/pengembangan SDM pada\nKementerian/Lembaga atau Pemerintah\nDaerah tempat pendaftar bekerja dengan\nketentuan;\na. mengusulkan atau merekomendasikan\npendaftar untuk mengikuti program\nBeasiswa LPDP; dan\nb. mencantumkan Nama Lengkap serta\nNomor Induk Pegawai (NIP) pendaftar.\n9. Bagi pendaftar yang merupakan PNS dengan\nstatus PNS dengan jabatan fungsional\nsebagai Peneliti/Perekayasa/Medis/\nParamedis/ Pendidik, mengunggah Surat\nKeputusan (SK) Jabatan Terakhir atau SK\nKenaikan Pangkat Terakhir atau sejenisnya\nyang menunjukkan bahwa pendaftar adalah\nPNS dengan jabatan fungsional sebagai\nPeneliti/Perekayasa/Medis/Paramedis/Pendi\ndik.\n10. Bagi pendaftar berstatus prajurit TNI di semua\nprogram beasiswa LPDP wajib melampirkan\nsurat usulan atau surat rekomendasi\nsekurang-kurangnya pejabat yang\nmembidangi pembinaan SDM pada Mabes\nTNI/ TNI AD/ TNI AL/ TNI AU untuk mengikuti', '10. Tidak pernah menyelesaikan studi pada jenjang yang sama dengan jenjang studi yang dilamar.\n11. Bersedia untuk tidak bekerja selama masa studi, kecuali atas persetujuan LPDP.\n12. Kembali ke Indonesia dan berkontribusi di Indonesia selama 2 kali masa studi ditambah 1 tahun\nsetelah selesai studi.\n13. Sebagai pendaftar yang sedang menjalani studi (on going) bersedia untuk:\na. diwajibkan membuat dan menandatangani surat pengunduran diri yang ditujukan kepada\nPerguruan Tinggi atas program studi yang sedang ditempuh serta menyampaikan surat\ntersebut kepada LPDP paling lambat 2 (dua) pekan setelah diumumkan lulus seleksi\nsubstansi;\nb. diwajibkan menyerahkan surat pemberhentian resmi dari program studi atau perguruan tinggi\nsebelum penandatanganan surat pernyataan Penerima Beasiswa; dan\nc. diberhentikan beasiswanya apabila tidak memenuhi kewajiban pada huruf a atau b.\n14. Sebagai pendaftar Beasiswa LPDP program magister belum pernah menyelesaikan studi magister', 'empat (D4) atau sarjana (S1).\n3. Pendaftar yang telah menyelesaikan studi\nmagister (S2) tidak diizinkan mendaftar.\n4. Bagi pendaftar lulusan perguruan tinggi luar\nnegeri pada jenjang pendidikan sebelumnya,\nwajib melampirkan\na. hasil penyetaraan ijazah Kementerian\nPendidikan, Kebudayaan, Riset, dan\nTeknologi, melalui laman\nhttps://piln.kemdikbud.go.id/ atau dari\nKementerian Agama melalui laman\nhttps://diktis.kemenag.go.id/penyetaraan\nijazah/\nb. hasil konversi IPK dari Kementerian\nPendidikan, Kebudayaan, Riset, dan\nTeknologi, melalui laman\nhttps://piln.kemdikbud.go.id/ atau dari\nKementerian Agama melalui laman\nhttps://diktis.kemenag.go.id/penyetaraan\nijazah/\nc. tangkapan layar ajuan penyetaraan\nijazah dan/atau ajuan konversi IPK pada\nlaman Kementerian Pendidikan,\nKebudayaan, Riset, dan Teknologi atau\nKementerian Agama mengenai\npenyetaraan ijazah dan konversi IPK\nbagi pendaftar yang penyetaraan ijazah\ndan/atau konversi IPKnya belum terbit.\n5. Pendaftar yang sedang menempuh studi (on', 'Penerima Beasiswa.\nd. Bagi pendaftar yang lulus seleksi\nsubstansi dan tidak memenuhi ketentuan\ntersebut di atas, maka LPDP dapat\nmembatalkan statusnya sebagai Calon\nPenerima Beasiswa.\ne. Bagi pendaftar yang menyelesaikan studi\ndan mendapat gelar sebelum\npengumuman seleksi substansi, maka\nLPDP dapat membatalkan statusnya\nsebagai Calon Penerima Beasiswa.\n6. Pendaftar yang pernah menempuh studi\nnamun tidak menyelesaikan studi pada\nprogram magister dapat mendaftar Beasiswa\nLPDP di jenjang studi yang sama, dibuktikan\ndengan melampirkan surat\npemberhentian/sejenisnya sebagai\nmahasiswa dari perguruan tinggi tersebut.\n7. Melampirkan surat rekomendasi sesuai\ndengan persyaratan masing-masing program\nyang diterbitkan paling lama 1 (satu) tahun di\nbulan yang sama dengan waktu pendaftaran']",Pendaftar yang merupakan PNS harus mengunggah Surat Keputusan (SK) Jabatan Terakhir atau SK Kenaikan Pangkat Terakhir atau sejenisnya yang menunjukkan bahwa pendaftar adalah PNS dengan jabatan fungsional sebagai Peneliti/Perekayasa/Medis/Paramedis/Pendidik.
2,Apa yang harus dipersiapkan sebelum mengikuti program internasional?,"Persiapan meliputi dokumentasi, keuangan, barang bawaan, pengetahuan, dan psikologi.","['International Exposure Study Abroad for ITS Students\nDepartment of Informatics Faculty of Intelligent Electrical and Information Technology Institut Teknologi Sepuluh Nopember\n\nOverview\nEach international program has different pre and post departure preparation, though some points are similar.\nThe preparation includes documentation, financial, belongings, knowledge, and psychology.\nWhat to prepare when you are going to participate in a study abroad program?\nWebsite: www.its.ac.id INSTITUT TEKNOLOGI SEPULUH NOPEMBER, Surabaya - Indonesia\nTypes of Program\nExchange\n\nOpportunities to study abroad with ITS partner university.\nDuration: 1-2 semesters.\nRequirement: Credit transfer.\nInternship\n\nOpportunities to intern abroad with ITS partner university and non-partner.\nDuration: 1-3 Months.\nRecommended for final year students.\nShort Program', 'empat (D4) atau sarjana (S1).\n3. Pendaftar yang telah menyelesaikan studi\nmagister (S2) tidak diizinkan mendaftar.\n4. Bagi pendaftar lulusan perguruan tinggi luar\nnegeri pada jenjang pendidikan sebelumnya,\nwajib melampirkan\na. hasil penyetaraan ijazah Kementerian\nPendidikan, Kebudayaan, Riset, dan\nTeknologi, melalui laman\nhttps://piln.kemdikbud.go.id/ atau dari\nKementerian Agama melalui laman\nhttps://diktis.kemenag.go.id/penyetaraan\nijazah/\nb. hasil konversi IPK dari Kementerian\nPendidikan, Kebudayaan, Riset, dan\nTeknologi, melalui laman\nhttps://piln.kemdikbud.go.id/ atau dari\nKementerian Agama melalui laman\nhttps://diktis.kemenag.go.id/penyetaraan\nijazah/\nc. tangkapan layar ajuan penyetaraan\nijazah dan/atau ajuan konversi IPK pada\nlaman Kementerian Pendidikan,\nKebudayaan, Riset, dan Teknologi atau\nKementerian Agama mengenai\npenyetaraan ijazah dan konversi IPK\nbagi pendaftar yang penyetaraan ijazah\ndan/atau konversi IPKnya belum terbit.\n5. Pendaftar yang sedang menempuh studi (on', '✔\nSertifikat Bahasa Asing yang\ndipersyaratkan dan Masih\nBerlaku (Asli)\n✔\nSurat rekomendasi dari\nakademisi atau tokoh\nmasyarakat *)\n✔ ✔\nSurat usulan dari pejabat\nyang membidangi SDM untuk\npendaftar PNS/TNI/POLRI\nsesuai ketentuan\n✔\nSurat pernyataan pada\naplikasi pendaftaran saat\n✔\nDokumen\nOnline\nForm\nUnggah\nakan melakukan submit\n(poin-poin terlampir)\nProfil diri pada formulir\npendaftaran online\n✔\nKomitmen kembali ke\nIndonesia, rencana pasca\nstudi, dan rencana kontribusi\ndi Indonesia.\n✔\nPublikasi ilmiah, prestasi\nkejuaraan/non kejuaraan,\ndan pengalaman organisasi.\n✔\nSK Jabatan terakhir bagi\nPNS\nPeneliti/Perekayasa/Medis/\nParamedis/Pendidik\n✔\n*) Surat harus diterbitkan paling lama 1 (satu)\ntahun di bulan yang sama dengan waktu\npendaftaran beasiswa\n2. Syarat dokumen program beasiswa lain\nSyarat dokumen mengikuti syarat program\nbeasiswa yang dipilih (mengacu pada Buku\nPanduan masing-masing program beasiswa).\nSeperti apa format Komitmen kembali ke\nIndonesia, rencana pasca studi, dan', '10. Tidak pernah menyelesaikan studi pada jenjang yang sama dengan jenjang studi yang dilamar.\n11. Bersedia untuk tidak bekerja selama masa studi, kecuali atas persetujuan LPDP.\n12. Kembali ke Indonesia dan berkontribusi di Indonesia selama 2 kali masa studi ditambah 1 tahun\nsetelah selesai studi.\n13. Sebagai pendaftar yang sedang menjalani studi (on going) bersedia untuk:\na. diwajibkan membuat dan menandatangani surat pengunduran diri yang ditujukan kepada\nPerguruan Tinggi atas program studi yang sedang ditempuh serta menyampaikan surat\ntersebut kepada LPDP paling lambat 2 (dua) pekan setelah diumumkan lulus seleksi\nsubstansi;\nb. diwajibkan menyerahkan surat pemberhentian resmi dari program studi atau perguruan tinggi\nsebelum penandatanganan surat pernyataan Penerima Beasiswa; dan\nc. diberhentikan beasiswanya apabila tidak memenuhi kewajiban pada huruf a atau b.\n14. Sebagai pendaftar Beasiswa LPDP program magister belum pernah menyelesaikan studi magister']","Sebelum mengikuti program internasional, hal-hal yang harus dipersiapkan meliputi dokumentasi, keuangan, barang bawaan, pengetahuan, dan psikologi. Dokumentasi mencakup persyaratan seperti transfer kredit untuk program pertukaran dan surat rekomendasi untuk program magang. Persiapan keuangan melibatkan perencanaan biaya selama program berlangsung. Barang bawaan harus disiapkan sesuai kebutuhan selama program. Pengetahuan tentang tujuan program internasional juga perlu dipersiapkan, termasuk informasi tentang universitas mitra ITS dan program yang ditawarkan. Selain itu, kesiapan psikologis juga penting untuk menghadapi tantangan dan adaptasi selama program internasional."
3,Apa contoh program magang di luar negeri?,Contoh program magang meliputi Universiti Kuala Lumpur (UniKL) di Malaysia dan Shibaura Institute of Technology di Jepang.,"['i. Mahasiswa dari perguruan tinggi mitra luar negeri program kerjasama yang bersifat \n   resiprokal; atau\n  j. Mahasiswa program sarjana atau sarjana terapan yang mampu mempublikasikan \n   paper pada jurnal internasional bereputasi Q1 sebagai nama pertama dengan \n   rekomendasi Wakil Rektor yang membidangi akademik dibebaskan untuk semester \n   berikutnya atau menarik UKT atau SPP pada semester berjalan apabila lulus \n   yudisium.', 'i. Mahasiswa dari perguruan tinggi mitra luar negeri program kerjasama yang bersifat \n   resiprokal; atau\n  j. Mahasiswa program sarjana atau sarjana terapan yang mampu mempublikasikan \n   paper pada jurnal internasional bereputasi Q1 sebagai nama pertama dengan \n   rekomendasi Wakil Rektor yang membidangi akademik dibebaskan untuk semester \n   berikutnya atau menarik UKT atau SPP pada semester berjalan apabila lulus \n   yudisium.', ""Opportunities to study abroad with ITS partner university and graduate with two independent degrees.\nDuration: 2:2, 2.5:1.5, 3:1.\nRequirement: Credit transfer.\nShort Program Examples\nNational Cheng Kung University Summer School\nInternational Summer/Winter University at Hochschule Darmstadt University of Applied Science, Germany\nFeng Chia International Summer School\nGKS ASEAN SCIENCES\nDelightful Istanbul Summer or Winter School\nGlobal Project Based Learning (GPBL) Shibaura Institute of Technology (SIT) Japan and KMUTT\nMore information: bit.ly/its-short-program\nInternship Examples\nUniversiti Kuala Lumpur (UniKL) – MFI (Malaysia France Institute) Campus\nShibaura Institute of Technology, Japan\nUniversiti Teknologi Malaysia, Malaysia\nTarlac Agricultural University (TAU), Philippines\nKing Mongkut's University of Technology Thonburi (KMUTT), Thailand\nNational Chung Hsing University (NCHU), Taiwan\nPompeu Fabra University, Spain\nMore information: bit.ly/its-internship"", 'b. Kelas khusus;\nc. Kelas karyawan;\nd. Kelas jarak jauh;\ne. Kelas yang diselenggarakan bukan di\nperguruan tinggi induk;\nf. Kelas internasional bagi pendaftar tujuan\nstudi dalam negeri;\ng. Kelas yang diselenggarakan di lebih dari\n1 (satu) negara perguruan tinggi; atau\nh. Kelas lainnya yang tidak memenuhi\nketentuan LPDP.\n14. Menyetujui surat pernyataan yang telah\ndisediakan pada aplikasi pendaftaran\nbeasiswa LPDP (poin-poin terlampir).\n15. Menulis profil diri termasuk riwayat pendidikan\nyang tidak diselesaikan pada aplikasi\npendaftaran.\n16. Menulis komitmen kembali ke Indonesia,\nrencana pasca studi, dan rencana kontribusi\ndi Indonesia.\n17. Jika pendaftar memiliki publikasi ilmiah,\nprestasi kejuaraan/non kejuaraan, dan\npengalaman organisasi maka pendaftar\nmengisi riwayat publikasi ilmiah, prestasi\nkejuaraan/non kejuaraan, dan pengalaman\norganisasi pada aplikasi pendaftaran.\nApa saja persyaratan khusus pendaftaran\nBeasiswa Prioritas LPDP – Campus France\nProgram Master?']","Program magang di luar negeri dapat mencakup beberapa contoh seperti:
1. Universiti Kuala Lumpur (UniKL) – MFI (Malaysia France Institute) Campus
2. Shibaura Institute of Technology, Jepang
3. Universiti Teknologi Malaysia, Malaysia
4. Tarlac Agricultural University (TAU), Filipina
5. King Mongkut's University of Technology Thonburi (KMUTT), Thailand
6. National Chung Hsing University (NCHU), Taiwan
7. Pompeu Fabra University, Spanyol

Informasi lebih lanjut dapat ditemukan di bit.ly/its-internship."
4,Apa yang dimaksud dengan UKT?,Uang Kuliah Tunggal,"['10. Tarif adalah besaran dana pendidikan yang ditetapkan oleh Rektor.\n11. Biaya Kuliah tunggal yang selanjutnya disingkat BKT adalah keseluruhan biaya \n  operasional pertahun yang terkait langsung dengan proses pembelajaran mahasiswa \n  pada program studi di perguruan tinggi negeri.\n12. Uang Kuliah Tunggal yang selanjutnya disingkat UKT adalah biaya yang dikenakan \n  setiap semester kepada calon mahasiswa baru dan mahasiswa program \n  sarjana/sarjana terapan yang diterima melalui jalur Seleksi Nasional.\n13. Sumbangan Pembinaan Pendidikan yang selanjutnya disingkat SPP adalah biaya \n  yang dikenakan setiap semester kepada calon mahasiswa baru dan mahasiswa \n  program sarjana/ sarjana terapan dan pascasarjana/ pascasarjana terapan yang \n  diterima melalui selain jalur Seleksi Nasional atau calon mahasiswa baru dan \n  mahasiswa program sarjana/sarjana terapan yang diterima melalui jalur seleksi', 'Pasal 4\n(1) Kewajiban membayar dana pendidikan berupa UKT dikenakan kepada:\n  a. Calon Mahasiswa Baru program sarjana dan sarjana terapan yang diterima dari \n   Jalur Seleksi Nasional; dan\n  b. Mahasiswa program sarjana dan sarjana terapan yang diterima dari Jalur Seleksi \n   Nasional.\n(2) Kewajiban membayar dana pendidikan berupa SPP dikenakan kepada:\n  a. Calon Mahasiswa Baru program sarjana dan sarjana terapan yang diterima dari \n   selain Jalur Seleksi Nasional;\n  b. Mahasiswa program sarjana dan sarjana terapan yang diterima dari selain Jalur  \n   Seleksi Nasional;\n  c. Ca1on Mahasiswa Baru program sarjana dan sarjana terapan yang diterima dari \n   Jalur seleksi nasional program joint degree/ double degree-,\n  d. Mahasiswa program sarjana dan sarjana terapan yang diterima dari Jalur Seleksi \n   Nasional program joint degree/ double degree-,\n  e. Calon Mahasiswa Baru program pascasarjana dan pascasarjana terapan; dan', 'Pasal 20\n(1) Mahasiswa dapat melakukan penarikan UKT atau SPP sebesar 80% (delapan puluh \n  persen), apabila Mahasiswa mendapatkan izin cuti studi paling lambat minggu ke 4 \n  (empat) masa perkuliahan.\n(2) Mahasiswa yang mendapatkan izin cuti setelah kegiatan perkuliahan berjalan lebih \n  dari 4 (empat) minggu, maka dana pendidikan yang telah dibayarkan tidak dapat \n  ditarik kembali.\n(3) Penarikan UKT atau SPP sebesar 100% (seratus persen) dapat diberikan apabila:\n  a. Mahasiswa tersebut diberhentikan dengan keputusan Rektor;\n  b. Mahasiswa tersebut mendapatkan izin cuti studi sebelum masa pembayaran UKT \n   atau SPP berakhir; atau\n  c. Mahasiswa tersebut mendapatkan izin cuti sakit yang diakibatkan oleh peristiwa \n   yang menyebabkan Mahasiswa tersebut tidak dapat mengikuti perkuliahan \n   sekurang-kurangnya 2 (dua) minggu secara bertur-ut-turut, dibuktikan dengan \n   surat keterangan dokter dan rekomendasi kepala departemen.', 'angka 1 paling banyak 90% (sembilan puluh persen) pada semester berjalan; dan\n  b. Keringanan pembayaran UKT atau SPP sebagaimana dimaksud ayat (2) huruf c \n    angka 2 paling banyak 90% (sembilan puluh persen) pada semester berjalan, \n    diberikan kepada Mahasiswa yang melakukan kegiatan akademik dan \n    kemahasiswaan di Luar ITS di dalam negeri yang memiliki kewajiban membayar \n    dana pendidikan atau dana kepesertaan yang dikenakan oleh penyelenggara paling \n    sedikit senilai besaran UKT atau SPP ITS.\n(5) Mahasiswa yang mendapatkan keringanan pembayaran sebagaimana dimaksud pada \n  ayat (4) huruf b, dan mengambil paling banyak 6 sks di ITS pada semester berjalan \n  maka keringanan pembayarannya yaitu:']","UKT adalah singkatan dari Uang Kuliah Tunggal, yaitu biaya yang dikenakan setiap semester kepada calon mahasiswa baru dan mahasiswa program sarjana/sarjana terapan yang diterima melalui jalur Seleksi Nasional."
5,Berapa persen keringanan pembayaran SPP bagi mahasiswa aktif pembayar dana pendidikan di luar ITS?,Maksimal 90%,"['angka 1 paling banyak 90% (sembilan puluh persen) pada semester berjalan; dan\n  b. Keringanan pembayaran UKT atau SPP sebagaimana dimaksud ayat (2) huruf c \n    angka 2 paling banyak 90% (sembilan puluh persen) pada semester berjalan, \n    diberikan kepada Mahasiswa yang melakukan kegiatan akademik dan \n    kemahasiswaan di Luar ITS di dalam negeri yang memiliki kewajiban membayar \n    dana pendidikan atau dana kepesertaan yang dikenakan oleh penyelenggara paling \n    sedikit senilai besaran UKT atau SPP ITS.\n(5) Mahasiswa yang mendapatkan keringanan pembayaran sebagaimana dimaksud pada \n  ayat (4) huruf b, dan mengambil paling banyak 6 sks di ITS pada semester berjalan \n  maka keringanan pembayarannya yaitu:', 'angka 1 paling banyak 90% (sembilan puluh persen) pada semester berjalan; dan\n  b. Keringanan pembayaran UKT atau SPP sebagaimana dimaksud ayat (2) huruf c \n    angka 2 paling banyak 90% (sembilan puluh persen) pada semester berjalan, \n    diberikan kepada Mahasiswa yang melakukan kegiatan akademik dan \n    kemahasiswaan di Iuar ITS di dalam negeri yang memiliki kewajiban membayar \n    dana pendidikan atau dana kepesertaan yang dikenakan oleh penyelenggara paling \n    sedikit senilai besaran UKT atau SPP ITS.\n(5) Mahasiswa yang mendapatkan keringanan pembayaran sebagaimana dimaksud pada \n  ayat (4) huruf b, dan mengambil paling banyak 6 sks di ITS pada semester berjalan \n  maka keringanan pembayarannya yaitu:', 'Pasal 17\n(1) Mahasiswa yang merupakan tenaga kependidikan tetap ITS, selanjutnya disebut \n  pegawai pelajar, dapat memperoleh keringanan dana SPP dengan ketentuan sebagai \n  berikut:\n  a. tercatat sebagai Mahasiswa aktif program magister atau doktor pada salah satu \n   Program Studi di ITS;\n  b. berusia minimal 27 (dua puluh tujuh) tahun untuk Mahasiswa program magister, \n   atau berusia minimal 35 (tiga puluh lima) tahun untuk Mahasiswa program doktor;\n  c. untuk tenaga kependidikan tetap PNS telah mendapatkan surat keputusan dari \n   Kementerian tentang tugas belajar dengan beasiswa atau sedang diusulkan oleh \n   ITS untuk mendapatkan surat keputusan dari kementerian tentang tugas belajar \n   dengan beasiswa; dan\n  d. untuk tenaga kependidikan tetap Non PNS telah mendapatkan surat keputusan dari \n   Rektor tentang tugas belajar dengan beasiswa.\n(2) Beasiswa yang dimaksud sebagaimana pada ayat (1) huruf c dan huruf d berupa', 'Pasal 17\n(1) Mahasiswa yang merupakan tenaga kependidikan tetap ITS, selanjutnya disebut \n  pegawai pelajar, dapat memperoleh keringanan dana SPP dengan ketentuan sebagai \n  berikut:\n  a. tercatat sebagai Mahasiswa aktif program magister atau doktor pada salah satu \n   Program Studi di ITS;\n  b. berusia minimal 27 (dua puluh tujuh) tahun untuk Mahasiswa program magister, \n   atau berusia minimal 35 (tiga puluh lima) tahun untuk Mahasiswa program doktor;\n  c. untuk tenaga kependidikan tetap PNS telah mendapatkan surat keputusan dari \n   Kementerian tentang tugas belajar dengan beasiswa atau sedang diusulkan oleh \n   ITS untuk mendapatkan surat keputusan dari kementerian tentang tugas belajar \n   dengan beasiswa; dan\n  d. untuk tenaga kependidikan tetap Non PNS telah mendapatkan surat keputusan dari \n   Rektor tentang tugas belajar dengan beasiswa.\n(2) Beasiswa yang dimaksud sebagaimana pada ayat (1) huruf c dan huruf d berupa']",Keringanan pembayaran SPP bagi mahasiswa aktif pembayar dana pendidikan di luar ITS adalah paling banyak 90% (sembilan puluh persen) pada semester berjalan.
6,Apa yang dimaksud dengan Program Studi dalam peraturan ini?,Kesatuan kegiatan pendidikan dan pembelajaran yang memiliki kurikulum dan metode pembelajaran tertentu,"['Dalam peraturan ini yang dimaksud dengan:Pasal 1\n1. Institut Teknologi Sepuluh Nopember yang selanjutnya disebut ITS adalah perguruan \n     tinggi negeri badan hukum.\n2. Rektor adalah organ ITS yang memimpin penyelenggaraan dan pengelolaan ITS.\n3. Program Studi adalah kesatuan kegiatan pendidikan dan pembelajaran yang memiliki \n     kurikulum dan metode pembelajaran tertentu dalam satu jenis pendidikan akademik, \n     pendidikan vokasi, dan/atau pendidikan profesi.\n4. Pendidikan Profesi adalah program pendidikan sesudah program sarjana yang \n     mempersiapkan peserta didik untuk memiliki kemampuan dalam keahlian khusus \n     dan diselenggarakan bersama dengan organisasi profesi.\n5. Semester adalah satuan waktu kegiatan yang terdiri dari 16 (enam belas) minggu \n     perkuliahan atau kegiatan terjadwal lainnya, termasuk kegiatan evaluasi.\n6. Mahasiswa adalah peserta didik pada jenjang pendidikan tinggi di ITS.', '11\n                  BAB VI \n   KEWAJIBAN PEMBAYARAN SUMBANGAN PENGEMBANGAN INSTITUSI (SPI)\n\n                  Pasal 21\n(1) Semua calon Mahasiswa Baru program sarjana/ sarjana terapan yang diterima melalui \n  jalur mandiri dan program sarjana/sarjana terapan/pascasarjana/pascasarjana \n  terapan jalur kerjasama diwajibkan membayar SPI.\n(2) Jalur mandiri sebagaimana dimaksud pada ayat (1) dikecualikan untuk jalur seleksi \n  mandiri prestasi\n(3) Semua calon Mahasiswa Baru sebagaimana dimaksud pada ayat (1) dan ayat (2) yang \n  tidak memenuhi kewajiban sebagaimana yang dimaksud pada ayat (1) sampai batas \n  waktu registrasi yang ditentukan, dianggap mengundurkan diri.\n\n                  BAB VII \n   KEWAJIBAN PEMBAYARAN SUMBANGAN PENGEMBANGAN AKADEMIK (SPA)', '4\n\n                  BAB II \n              MAKSUD DAN TUJUAN\n\n                 Pasal 2\n(1) Peraturan Rektor ini diterbitkan dengan maksud agar setiap pemungutan dan \n  penghimpunan dana pendidikan dari Calon Mahasiswa Baru dan Mahasiswa serta \n  penggunaannya memiliki landasan hukum.\n(2) Peraturan ini diterbitkan dengan tujuan untuk menjamin transparansi pemungutan, \n  penghimpunan, dan penggunaan dana pendidikan.\n\n                 BAB III \n               RUANG LINGKUP\n\n                 Pasal 3\n(1) Peraturan Rektor ini melingkupi besaran dan mekanisme pemungutan, \n  penghimpunan, dan penggunaan dana pendidikan.\n(2) Dana pendidikan sebagaimana dimaksud pada ayat (1) terdiri atas:\n  a. UKT;\n  b. SPP;\n  c. SPI; dan\n  d. SPA.\n\n                 BAB IV \n         KEWAJIBAN PEMBAYARAN DANA PENDIDIKAN', 'perkuliahan atau kegiatan terjadwal lainnya, termasuk kegiatan evaluasi.\n6. Mahasiswa adalah peserta didik pada jenjang pendidikan tinggi di ITS.\n7. Mahasiswa Asing adalah mahasiswa ITS dengan kewarganegaraan selain Indonesia.\n8. International Undergraduate Program yang selanjutnya disingkat IUP adalah program \n     pendidikan sarjana yang dilaksanakan dalam bahasa Inggris dan mahasiswa wajib \n     mengikuti kegiatan internasional sekurang-kurangnya satu kali selama masa studi \n     dalam bentuk Joint degree/Double Degree, student exchange, final project, internship, \n     atau short program dengan perguruan tinggi mitra ITS di luar negeri.\n9. Joint Degree/Double Degree adalah penyelenggaraan pendidikan bergelar yang \n     bekerja sama dengan perguruan tinggi mitra.']","Program Studi dalam peraturan ini adalah kesatuan kegiatan pendidikan dan pembelajaran yang memiliki kurikulum dan metode pembelajaran tertentu dalam satu jenis pendidikan akademik, pendidikan vokasi, dan/atau pendidikan profesi."
7,Apa saja yang termasuk dana pendidikan menurut Pasal 3 ayat (2) peraturan ini?,"UKT, SPP, SPI, dan SPA","['BAB IX \n      BESARAN DAN MEKANISME PEMBAYARAN DANA PENDIDIKAN\n\n                  Pasal 24\n(1) Besaran dana pendidikan ditetapkan melalui keputusan Rektor.\n(2) Pembayaran dana pendidikan sebagaimana dimaksud pada ayat (1) dilakukan secara \n  online melalui bank persepsi yang ditunjuk, sesuai jadwal pembayaran yang telah \n  ditetapkan.\n\n\n                   12\n(3) Dana Pendidikan yang telah dibayarkan tidak dapat ditarik kembali kecuali memenuhi \n      ketentuan sebagaimana diatur dalam Pasal 20.\n\n                                                                            BAB X \n                                                             KETENTUAN PENUTUP', 'Pasal 4\n(1) Kewajiban membayar dana pendidikan berupa UKT dikenakan kepada:\n  a. Calon Mahasiswa Baru program sarjana dan sarjana terapan yang diterima dari \n   Jalur Seleksi Nasional; dan\n  b. Mahasiswa program sarjana dan sarjana terapan yang diterima dari Jalur Seleksi \n   Nasional.\n(2) Kewajiban membayar dana pendidikan berupa SPP dikenakan kepada:\n  a. Calon Mahasiswa Baru program sarjana dan sarjana terapan yang diterima dari \n   selain Jalur Seleksi Nasional;\n  b. Mahasiswa program sarjana dan sarjana terapan yang diterima dari selain Jalur  \n   Seleksi Nasional;\n  c. Ca1on Mahasiswa Baru program sarjana dan sarjana terapan yang diterima dari \n   Jalur seleksi nasional program joint degree/ double degree-,\n  d. Mahasiswa program sarjana dan sarjana terapan yang diterima dari Jalur Seleksi \n   Nasional program joint degree/ double degree-,\n  e. Calon Mahasiswa Baru program pascasarjana dan pascasarjana terapan; dan', '4\n\n                  BAB II \n              MAKSUD DAN TUJUAN\n\n                 Pasal 2\n(1) Peraturan Rektor ini diterbitkan dengan maksud agar setiap pemungutan dan \n  penghimpunan dana pendidikan dari Calon Mahasiswa Baru dan Mahasiswa serta \n  penggunaannya memiliki landasan hukum.\n(2) Peraturan ini diterbitkan dengan tujuan untuk menjamin transparansi pemungutan, \n  penghimpunan, dan penggunaan dana pendidikan.\n\n                 BAB III \n               RUANG LINGKUP\n\n                 Pasal 3\n(1) Peraturan Rektor ini melingkupi besaran dan mekanisme pemungutan, \n  penghimpunan, dan penggunaan dana pendidikan.\n(2) Dana pendidikan sebagaimana dimaksud pada ayat (1) terdiri atas:\n  a. UKT;\n  b. SPP;\n  c. SPI; dan\n  d. SPA.\n\n                 BAB IV \n         KEWAJIBAN PEMBAYARAN DANA PENDIDIKAN', 'Pasal 23\n(1) Dana Pendidikan dig~an untuk:\n a. penyelenggaraan kegiatan tridharma perguruan tinggi dan pengelolaan manajemen;\n b. pengadaan sarana dan prasarana penyelenggaraan tridharma perguruan tinggi dan \n   manajemen yang meliputi:\n   1. pembangunan gedung pendidikan, Laboratorium, dan manajemen; dan\n   2. pengadaan peralatan pendidikan, laboratorium, dan manajemen;\n c. pengembangan keahlian dan keilmuan dosen dan tenaga kependidikan;\n d. pengembangan program penyelenggaraan pendidikan tinggi yang dituangkan dalam \n   dokumen perencanaan ITS.\n(2) Pengelolaan manajemen sebagaimana dimaksud pada ayat (1) huruf a terdiri atas:\n a. operasional rutin perkantoran; dan\n b. kesejahteraan pegawai mengacu pada peraturan Rektor yang mengatur tentang \n   kepegawaian dan pengelolaan kinerja.\n(3) Besaran dan mekanisme penggunaan dana pendidikan mengacu pada dokumen \n perencanaan dan dokumen pedoman pengelolaan keuangan.']","Dana pendidikan menurut Pasal 3 ayat (2) peraturan ini terdiri atas:
a. UKT (Uang Kuliah Tunggal)
b. SPP (Sumbangan Pembinaan Pendidikan)
c. SPI (Sumbangan Pengembangan Institusi)
d. SPA (Sumbangan Pengembangan Akademik)"
8,Berapa biaya hidup di Eropa untuk program pertukaran?,"Biaya hidup di Eropa sekitar €7,800 per tahun dan biaya kuliah sekitar €10,140 per tahun.","['Bialystok University of Technology, Poland\nUniversity of Szczecin, Poland\nCoverage:\nTransportation Fee: 1100 Euro\nLiving Allowance: 700 – 800 Euro/Month (based on contract)\nStudent Exchange (IISMA)\nIISMA (Indonesian International Student Mobility Awards) is a scholarship scheme funded by the Government of Indonesia for mobility programs at top universities abroad.\nCoverage:\nTuition fee\nMonthly living expenses (including accommodation) according to PO LPDP\nHealth insurance during the program (excluding travel insurance)\nVisa\nSelf Quarantine in destination country (if needed)\nPCR Test\nFlight ticket\nInternational Exposure Collaboration and Support\nCollaboration with DKG\nDocument handling and student exchange/internship partnerships with various universities in Taiwan, Japan, Korea, Malaysia, Thailand, France, and others.\nJoint Degree Partners\nUniversity of Queensland (2.5+1.5)\nFontys University (3+1)\nNewcastle University (2+2)\nAsia University (2+2)\nTomsk State University (2+2)', 'Cost of living: €7,800 per year\nTuition fee: €10,140 per year\nAustralia:\n\nCost of living: AUD 18,000 per year\nTuition fee: AUD 25,040 per year\nScholarship Opportunities:\n\nAvailable for those with good achievements.\nStudents in partner campuses pay 10% of ITS fees.\nExchange Course Policy\nFull Study at Partner University:\n\nPay 10% of ITS fees.\nFull Study at Partner University & Partial Study at ITS:\n\nPay 20% of ITS fees for up to 6 credits online.\nFull Study at ITS & Partial Online Study at Partner University:', 'Pasal 6\nMahasiswa program Joint Degree/ Double Degree yang melakukan kegiatan akademik di \nperguruan tinggi mitra luar negeri, diwajibkan membayar SPP:\na. sebesar 100% (seratus persen) di ITS untuk Mahasiswa yang tidak berkewajiban \n  membayar dana pendidikan di perguruan tinggi mitra luar negeri;\nb. sebesar 10% (sepuluh persen) di ITS untuk Mahasiswa yang berkewajiban membayar \n  dana pendidikan di perguruan tinggi mitra luar negeri; dan\nc. sebesar 100% (seratus persen) di ITS untuk Mahasiswa berkegiatan akademik di \n  perguruan tinggi mitra luar negeri yang mensyaratkan pembagian pendapatan SPP \n  dengan ITS.\n\n                   Pasal 7\n(1) Mahasiswa asing membayar UKT atau SPP yang besarannya ditetapkan dengan \n  keputusan Rektor.\n(2) Mahasiswa asing dari negara berkembang dapat diberikan beasiswa dari ITS berupa \n  keringanan pembayaran UKT atau SPP yang ditetapkan dengan keputusan Rektor.', 'Pasal 6\nMahasiswa program Joint Degree/ Double Degree yang melakukan kegiatan akademik di \nperguruan tinggi mitra luar negeri, diwajibkan membayar SPP:\na. sebesar 100% (seratus persen) di ITS untuk Mahasiswa yang tidak berkewajiban \n  membayar dana pendidikan di perguruan tinggi mitra luar negeri;\nb. sebesar 10% (sepuluh persen) di ITS untuk Mahasiswa yang berkewajiban membayar \n  dana pendidikan di perguruan tinggi mitra luar negeri; dan\nc. sebesar 100% (seratus persen) di ITS untuk Mahasiswa berkegiatan akademik di \n  perguruan tinggi mitra luar negeri yang mensyaratkan pembagian pendapatan SPP \n  dengan ITS.\n\n                   Pasal 7\n(1) Mahasiswa asing membayar UKT atau SPP yang besarannya ditetapkan dengan \n  keputusan Rektor.\n(2) Mahasiswa asing dari negara berkembang dapat diberikan beasiswa dari ITS berupa \n  keringanan pembayaran UKT atau SPP yang ditetapkan dengan keputusan Rektor.']",Biaya hidup di Eropa untuk program pertukaran adalah sekitar 700 - 800 Euro per bulan berdasarkan kontrak yang ditawarkan.
9,Apa keuntungan mengikuti program pertukaran pelajar?,"Keuntungan termasuk pengalaman internasional, kredit transfer, dan kemungkinan mendapat beasiswa jika berprestasi.","[""Opportunities to study abroad with ITS partner university and graduate with two independent degrees.\nDuration: 2:2, 2.5:1.5, 3:1.\nRequirement: Credit transfer.\nShort Program Examples\nNational Cheng Kung University Summer School\nInternational Summer/Winter University at Hochschule Darmstadt University of Applied Science, Germany\nFeng Chia International Summer School\nGKS ASEAN SCIENCES\nDelightful Istanbul Summer or Winter School\nGlobal Project Based Learning (GPBL) Shibaura Institute of Technology (SIT) Japan and KMUTT\nMore information: bit.ly/its-short-program\nInternship Examples\nUniversiti Kuala Lumpur (UniKL) – MFI (Malaysia France Institute) Campus\nShibaura Institute of Technology, Japan\nUniversiti Teknologi Malaysia, Malaysia\nTarlac Agricultural University (TAU), Philippines\nKing Mongkut's University of Technology Thonburi (KMUTT), Thailand\nNational Chung Hsing University (NCHU), Taiwan\nPompeu Fabra University, Spain\nMore information: bit.ly/its-internship"", 'perkuliahan atau kegiatan terjadwal lainnya, termasuk kegiatan evaluasi.\n6. Mahasiswa adalah peserta didik pada jenjang pendidikan tinggi di ITS.\n7. Mahasiswa Asing adalah mahasiswa ITS dengan kewarganegaraan selain Indonesia.\n8. International Undergraduate Program yang selanjutnya disingkat IUP adalah program \n     pendidikan sarjana yang dilaksanakan dalam bahasa Inggris dan mahasiswa wajib \n     mengikuti kegiatan internasional sekurang-kurangnya satu kali selama masa studi \n     dalam bentuk Joint degree/Double Degree, student exchange, final project, internship, \n     atau short program dengan perguruan tinggi mitra ITS di luar negeri.\n9. Joint Degree/Double Degree adalah penyelenggaraan pendidikan bergelar yang \n     bekerja sama dengan perguruan tinggi mitra.', 'program doktor pada semester berjalan; dan/atau\n  d. Mahasiswa program pascasarjana yang berpindah jenis kelas diwajibkan \n   membayar SPP untuk jenis kelas dengan tarif lebih tinggi.\n(2) Perpindahan mahasiswa sebagaimana dimaksud ayat (1) huruf d harus mendapatkan \n  persetujuan Wakil Rektor yang membidangi akademik.', 'program doktor pada semester berjalan; dan/atau\n  d. Mahasiswa program pascasarjana yang berpindah jenis kelas diwajibkan \n   membayar SPP untuk jenis kelas dengan tarif lebih tinggi.\n(2) Perpindahan mahasiswa sebagaimana dimaksud ayat (1) huruf d harus mendapatkan \n  persetujuan Wakil Rektor yang membidangi akademik.']","Keuntungan mengikuti program pertukaran pelajar antara lain adalah kesempatan untuk belajar di universitas mitra ITS di luar negeri dan lulus dengan dua gelar independen, durasi program yang fleksibel (2:2, 2.5:1.5, 3:1), serta kemungkinan untuk mentransfer kredit. Selain itu, program pertukaran pelajar juga memberikan kesempatan untuk mengikuti program pendek seperti National Cheng Kung University Summer School, International Summer/Winter University di Hochschule Darmstadt University of Applied Science, dan program lainnya yang dapat meningkatkan pengalaman belajar dan keterampilan internasional mahasiswa."
10,Apa saja pelanggaran dan sanksi yang diberlakukan oleh LPDP?,"Pelanggaran meliputi kecurangan selama pendaftaran atau seleksi, memberikan informasi atau dokumen palsu. Sanksi termasuk pembatalan beasiswa dan pengembalian dana studi.","['kemitraan/kerja sama beasiswa prioritas, maka tidak dapat berpindah program studi, perguruan\ntinggi, dan/atau program Beasiswa LPDP lainnya, atau kelulusan akan dibatalkan.\nDemikian surat pernyataan ini dibuat dengan sebenar-benarnya untuk dapat digunakan sebagaimana\nmestinya. Apabila saya melanggar dan tidak mematuhi surat pernyataan ini, saya bersedia menerima\nsanksi sesuai ketentuan yang berlaku.', 'Pasal 25\n(1) Pada saat Peraturan Rektor ini mulai berlaku, Peraturan Rektor Institut Teknologi \n      Sepuluh Nopember Nomor 16 Tahun 2021 tentang Biaya Pendidikan Institut Teknologi \n      Sepuluh Nopember dicabut dan dinyatakan tidak berlaku.\n(2) Dikecualikan dari ayat (1), ketentuan Pasal 6 ayat (2), Pasal 6 ayat (3), Pasal 6 ayat (4), \n      Pasal 6 ayat (5), Pasal 9, dan Pasal 16 ayat (4) Peraturan Rektor Institut Teknologi \n      Sepuluh Nopember Nomor 16 Tahun 2021 tentang Biaya Pendidikan Institut Teknologi \n      Sepuluh Nopember tetap berlaku, yang digunakan untuk pelaksanaan pembayaran, \n      penarikan, dan pemberian keringanan dana pendidikan untuk tahun akademik \n      2021/2022 dan tahun akademik 2022/2023.\n(3) Ketentuan lebih lanjut tentang pelaksanaan sebagaimana dimaksud pada ayat (2) \n      diatur dengan Surat Edaran Wakil Rektor yang membidangi keuangan', 'jenjang sebelumnya; dan/atau\nd. Persyaratan tambahan lain yang tidak\nberisiko mengubah status diterimanya\norang tersebut sebagai mahasiswa pada\nprogram studi yang dituju.\n4. Pendaftar Beasiswa LPDP yang melampirkan\nLoA dengan waktu mulai studi yang tidak\nsesuai dengan ketentuan LPDP wajib\nmelampirkan surat keterangan penundaan\njadwal perkuliahan program studi dari\nPerguruan Tinggi yang diunggah bersamaan\ndengan LoA.\n5. Bagi pendaftar Beasiswa LPDP dengan\nskema double degree/joint degree dapat\nmelampirkan LoA dari Perguruan Tinggi Luar\nNegeri dan/atau Perguruan Tinggi Dalam\nNegeri yang menyatakan program double\ndegree/joint degree.\n6. Jika pendaftar mengunggah LoA\nUnconditional yang tidak sesuai ketentuan\nLPDP, maka dianggap tidak memenuhi\nkriteria pendaftaran.\nBagaimana Cara Mendaftar Beasiswa\nLPDP?\n1. Mendaftar secara online pada situs\nPendaftaran Beasiswa LPDP:\nhttps://beasiswalpdp.kemenkeu.go.id/', '11\n                  BAB VI \n   KEWAJIBAN PEMBAYARAN SUMBANGAN PENGEMBANGAN INSTITUSI (SPI)\n\n                  Pasal 21\n(1) Semua calon Mahasiswa Baru program sarjana/ sarjana terapan yang diterima melalui \n  jalur mandiri dan program sarjana/sarjana terapan/pascasarjana/pascasarjana \n  terapan jalur kerjasama diwajibkan membayar SPI.\n(2) Jalur mandiri sebagaimana dimaksud pada ayat (1) dikecualikan untuk jalur seleksi \n  mandiri prestasi\n(3) Semua calon Mahasiswa Baru sebagaimana dimaksud pada ayat (1) dan ayat (2) yang \n  tidak memenuhi kewajiban sebagaimana yang dimaksud pada ayat (1) sampai batas \n  waktu registrasi yang ditentukan, dianggap mengundurkan diri.\n\n                  BAB VII \n   KEWAJIBAN PEMBAYARAN SUMBANGAN PENGEMBANGAN AKADEMIK (SPA)']","Pelanggaran yang dapat diberlakukan oleh LPDP antara lain adalah berpindah program studi, perguruan tinggi, dan/atau program Beasiswa LPDP lainnya setelah menerima beasiswa prioritas. Sanksi yang dapat diberlakukan jika terjadi pelanggaran tersebut adalah pembatalan kelulusan. Jadi, jika seorang penerima beasiswa LPDP melanggar ketentuan tersebut, maka kelulusannya dapat dibatalkan sesuai dengan surat pernyataan yang telah ditandatangani."
11,Apa ketentuan pengabdian yang ditetapkan LPDP?,Penerima Beasiswa wajib kembali dan mengabdi di Indonesia selama dua kali masa studi ditambah satu tahun setelah selesai studi.,"['Dipublikasikan tanggal 11 Januari 2024\nTentang LPDP\nLPDP berkomitmen untuk mempersiapkan\npemimpin dan profesional masa depan serta\nmendorong inovasi demi terwujudnya Indonesia\nyang sejahtera, demokratis, dan berkeadilan.\nLPDP menyelenggarakan program beasiswa\nmagister/doktor serta beasiswa dokter spesialis,\ndokter subspesialis dan Fellowship untuk putra-\nputri terbaik Indonesia.\nApa itu Beasiswa Prioritas?\nBeasiswa Prioritas merupakan program beasiswa\nyang memberikan kesempatan kepada pendaftar\nuntuk dapat melakukan pendaftaran pada dua\nprogram sekaligus, yaitu pada program Beasiswa\nKemitraan/Kerja Sama LPDP dan pada salah satu\nprogram Beasiswa Afirmasi/Beasiswa\nTargeted/Beasiswa Umum tujuan luar negeri.\nApa itu Beasiswa Prioritas LPDP – Campus\nFrance Program Master?\nBeasiswa Prioritas LPDP – Campus France\nProgram Master memberikan kesempatan bagi\npendaftar untuk dapat melakukan pendaftaran\npada Beasiswa Kemitraan LPDP – Campus\nFrance dan beasiswa Magister Luar Negeri', 'program beasiswa LPDP wajib melampirkan\nsurat usulan atau surat rekomendasi\nsekurang-kurangnya pejabat yang\nmembidangi pembinaan SDM pada Mabes\nTNI/ TNI AD/ TNI AL/ TNI AU untuk mengikuti\nprogram beasiswa LPDP yang ditujukan\nkepada LPDP.\n11. Bagi pendaftar berstatus anggota POLRI di\nsemua program beasiswa LPDP wajib\nmelampirkan surat usulan atau surat\nrekomendasi sekurang-kurangnya pejabat\nyang membidangi pembinaan SDM pada\nMabes POLRI untuk mengikuti program\nbeasiswa LPDP kepada LPDP pada saat\npendaftaran beasiswa LPDP.\n12. Memilih Perguruan Tinggi Tujuan dan\nprogram studi sesuai dengan ketentuan LPDP\n13. Beasiswa hanya diperuntukkan bagi kelas\nreguler atau kelas lain yang ditetapkan oleh\nLPDP, dan tidak diperuntukkan untuk kelas-\nkelas sebagai berikut:\na. Kelas eksekutif;\nb. Kelas khusus;\nc. Kelas karyawan;\nd. Kelas jarak jauh;\ne. Kelas yang diselenggarakan bukan di\nperguruan tinggi induk;\nf. Kelas internasional bagi pendaftar tujuan\nstudi dalam negeri;', 'beasiswa dengan kewajiban pengembalian\ndana studi yang telah diterima dan\npemblokiran untuk mengikuti program LPDP\ndi masa mendatang.\nBagaimana dengan ketentuan\nPengabdian yang ditetapkan LPDP?\n1. Penerima Beasiswa wajib kembali dan\nmengabdi di Indonesia setelah selesai studi\nsesuai dengan ketentuan LPDP.\n2. Kembali ke Indonesia dan berkontribusi di\nIndonesia selama 2 kali masa studi ditambah', 'jenjang sebelumnya; dan/atau\nd. Persyaratan tambahan lain yang tidak\nberisiko mengubah status diterimanya\norang tersebut sebagai mahasiswa pada\nprogram studi yang dituju.\n4. Pendaftar Beasiswa LPDP yang melampirkan\nLoA dengan waktu mulai studi yang tidak\nsesuai dengan ketentuan LPDP wajib\nmelampirkan surat keterangan penundaan\njadwal perkuliahan program studi dari\nPerguruan Tinggi yang diunggah bersamaan\ndengan LoA.\n5. Bagi pendaftar Beasiswa LPDP dengan\nskema double degree/joint degree dapat\nmelampirkan LoA dari Perguruan Tinggi Luar\nNegeri dan/atau Perguruan Tinggi Dalam\nNegeri yang menyatakan program double\ndegree/joint degree.\n6. Jika pendaftar mengunggah LoA\nUnconditional yang tidak sesuai ketentuan\nLPDP, maka dianggap tidak memenuhi\nkriteria pendaftaran.\nBagaimana Cara Mendaftar Beasiswa\nLPDP?\n1. Mendaftar secara online pada situs\nPendaftaran Beasiswa LPDP:\nhttps://beasiswalpdp.kemenkeu.go.id/']",Ketentuan pengabdian yang ditetapkan LPDP adalah penerima beasiswa wajib kembali dan mengabdi di Indonesia setelah selesai studi sesuai dengan ketentuan LPDP. Mereka harus kembali ke Indonesia dan berkontribusi di Indonesia selama 2 kali masa studi sebelumnya.
12,Mahasiswa dari jalur apa yang diperkenankan mengajukan permohonan?,Mahasiswa sarjana dan vokasi (selain mahasiswa IUP dan Joint Degree),"['11\n                  BAB VI \n   KEWAJIBAN PEMBAYARAN SUMBANGAN PENGEMBANGAN INSTITUSI (SPI)\n\n                  Pasal 21\n(1) Semua calon Mahasiswa Baru program sarjana/ sarjana terapan yang diterima melalui \n  jalur mandiri dan program sarjana/sarjana terapan/pascasarjana/pascasarjana \n  terapan jalur kerjasama diwajibkan membayar SPI.\n(2) Jalur mandiri sebagaimana dimaksud pada ayat (1) dikecualikan untuk jalur seleksi \n  mandiri prestasi\n(3) Semua calon Mahasiswa Baru sebagaimana dimaksud pada ayat (1) dan ayat (2) yang \n  tidak memenuhi kewajiban sebagaimana yang dimaksud pada ayat (1) sampai batas \n  waktu registrasi yang ditentukan, dianggap mengundurkan diri.\n\n                  BAB VII \n   KEWAJIBAN PEMBAYARAN SUMBANGAN PENGEMBANGAN AKADEMIK (SPA)', 'b. Kelas khusus;\nc. Kelas karyawan;\nd. Kelas jarak jauh;\ne. Kelas yang diselenggarakan bukan di\nperguruan tinggi induk;\nf. Kelas internasional bagi pendaftar tujuan\nstudi dalam negeri;\ng. Kelas yang diselenggarakan di lebih dari\n1 (satu) negara perguruan tinggi; atau\nh. Kelas lainnya yang tidak memenuhi\nketentuan LPDP.\n14. Menyetujui surat pernyataan yang telah\ndisediakan pada aplikasi pendaftaran\nbeasiswa LPDP (poin-poin terlampir).\n15. Menulis profil diri termasuk riwayat pendidikan\nyang tidak diselesaikan pada aplikasi\npendaftaran.\n16. Menulis komitmen kembali ke Indonesia,\nrencana pasca studi, dan rencana kontribusi\ndi Indonesia.\n17. Jika pendaftar memiliki publikasi ilmiah,\nprestasi kejuaraan/non kejuaraan, dan\npengalaman organisasi maka pendaftar\nmengisi riwayat publikasi ilmiah, prestasi\nkejuaraan/non kejuaraan, dan pengalaman\norganisasi pada aplikasi pendaftaran.\nApa saja persyaratan khusus pendaftaran\nBeasiswa Prioritas LPDP – Campus France\nProgram Master?', 'empat (D4) atau sarjana (S1).\n3. Pendaftar yang telah menyelesaikan studi\nmagister (S2) tidak diizinkan mendaftar.\n4. Bagi pendaftar lulusan perguruan tinggi luar\nnegeri pada jenjang pendidikan sebelumnya,\nwajib melampirkan\na. hasil penyetaraan ijazah Kementerian\nPendidikan, Kebudayaan, Riset, dan\nTeknologi, melalui laman\nhttps://piln.kemdikbud.go.id/ atau dari\nKementerian Agama melalui laman\nhttps://diktis.kemenag.go.id/penyetaraan\nijazah/\nb. hasil konversi IPK dari Kementerian\nPendidikan, Kebudayaan, Riset, dan\nTeknologi, melalui laman\nhttps://piln.kemdikbud.go.id/ atau dari\nKementerian Agama melalui laman\nhttps://diktis.kemenag.go.id/penyetaraan\nijazah/\nc. tangkapan layar ajuan penyetaraan\nijazah dan/atau ajuan konversi IPK pada\nlaman Kementerian Pendidikan,\nKebudayaan, Riset, dan Teknologi atau\nKementerian Agama mengenai\npenyetaraan ijazah dan konversi IPK\nbagi pendaftar yang penyetaraan ijazah\ndan/atau konversi IPKnya belum terbit.\n5. Pendaftar yang sedang menempuh studi (on', 'Syarat dokumen mengikuti syarat program\nbeasiswa yang dipilih (mengacu pada Buku\nPanduan masing-masing program beasiswa).\nSeperti apa format Komitmen kembali ke\nIndonesia, rencana pasca studi, dan\nrencana kontribusi di Indonesia serta\nRencana Bisnis atau Rencana\nPengembangan Bisnis?\nKomitmen kembali ke Indonesia, rencana\npasca studi, dan rencana kontribusi di\nIndonesia (1500 – 2000 kata)\nDeskripsikan dalam tulisan secara jelas dan\nkonkret tentang tema di atas.']","Mahasiswa dari jalur mandiri dan program sarjana/sarjana terapan/pascasarjana/pascasarjana terapan jalur kerjasama diperkenankan mengajukan permohonan. Namun, jalur mandiri dikecualikan untuk jalur seleksi mandiri prestasi."
13,Melalui aplikasi apa mahasiswa dapat mengajukan permohonan keringanan UKT?,myITS Portal atau portal.its.ac.id dengan aplikasi layanan SIPMABA,"['Pasal 17\n(1) Mahasiswa yang merupakan tenaga kependidikan tetap ITS, selanjutnya disebut \n  pegawai pelajar, dapat memperoleh keringanan dana SPP dengan ketentuan sebagai \n  berikut:\n  a. tercatat sebagai Mahasiswa aktif program magister atau doktor pada salah satu \n   Program Studi di ITS;\n  b. berusia minimal 27 (dua puluh tujuh) tahun untuk Mahasiswa program magister, \n   atau berusia minimal 35 (tiga puluh lima) tahun untuk Mahasiswa program doktor;\n  c. untuk tenaga kependidikan tetap PNS telah mendapatkan surat keputusan dari \n   Kementerian tentang tugas belajar dengan beasiswa atau sedang diusulkan oleh \n   ITS untuk mendapatkan surat keputusan dari kementerian tentang tugas belajar \n   dengan beasiswa; dan\n  d. untuk tenaga kependidikan tetap Non PNS telah mendapatkan surat keputusan dari \n   Rektor tentang tugas belajar dengan beasiswa.\n(2) Beasiswa yang dimaksud sebagaimana pada ayat (1) huruf c dan huruf d berupa', 'Pasal 17\n(1) Mahasiswa yang merupakan tenaga kependidikan tetap ITS, selanjutnya disebut \n  pegawai pelajar, dapat memperoleh keringanan dana SPP dengan ketentuan sebagai \n  berikut:\n  a. tercatat sebagai Mahasiswa aktif program magister atau doktor pada salah satu \n   Program Studi di ITS;\n  b. berusia minimal 27 (dua puluh tujuh) tahun untuk Mahasiswa program magister, \n   atau berusia minimal 35 (tiga puluh lima) tahun untuk Mahasiswa program doktor;\n  c. untuk tenaga kependidikan tetap PNS telah mendapatkan surat keputusan dari \n   Kementerian tentang tugas belajar dengan beasiswa atau sedang diusulkan oleh \n   ITS untuk mendapatkan surat keputusan dari kementerian tentang tugas belajar \n   dengan beasiswa; dan\n  d. untuk tenaga kependidikan tetap Non PNS telah mendapatkan surat keputusan dari \n   Rektor tentang tugas belajar dengan beasiswa.\n(2) Beasiswa yang dimaksud sebagaimana pada ayat (1) huruf c dan huruf d berupa', 'periode pengajuan, Mahasiswa yang dimaksud disyaratkan saat ini minimal akan memasuki semester 2 (dua)\ndan bukan termasuk kelompok penerima beasiswa, baik beasiswa Bidik Misi/KIP-K maupun beasiswa lainnya, serta\nbelum pernah mendapatkan penurunan UKT dari proses banding UKT sebelumnya,\n2. Permohonan Keringanan UKT dilakukan melalui myITS Portal atau portal.its.ac.id dengan aplikasi layanan\nSIPMABA dilakukan dengan melakukan terhadap update data–data kelengkapan verifikasi UKT yang sebelumnya\npernah diisi oleh mahasiswa pada saat menjadi calon mahasiswa baru.\nPengisian data dapat dilakukan dengan cara login melalui myITS Portal atau portal.its.ac.id dan memilih aplikasi SIPMABA\nkemudian memilih role Login as Mahasiswa Lama. Setelah login, mahasiswa dapat memilih menu Permohonan Keringanan\nUKT. Selanjutnya mahasiswa dapat mengisi kelengkapan dokumen yang diperlukan untuk proses pengajuan keringanan.', 'periode pengajuan, Mahasiswa yang dimaksud disyaratkan saat ini minimal akan memasuki semester 2 (dua)\r\ndan bukan termasuk kelompok penerima beasiswa, baik beasiswa Bidik Misi/KIP-K maupun beasiswa lainnya, serta\r\nbelum pernah mendapatkan penurunan UKT dari proses banding UKT sebelumnya,\r\n2. Permohonan Keringanan UKT dilakukan melalui myITS Portal atau portal.its.ac.id dengan aplikasi layanan\r\nSIPMABA dilakukan dengan melakukan terhadap update data–data kelengkapan verifikasi UKT yang sebelumnya\r\npernah diisi oleh mahasiswa pada saat menjadi calon mahasiswa baru.\r\nPengisian data dapat dilakukan dengan cara login melalui myITS Portal atau portal.its.ac.id dan memilih aplikasi SIPMABA\r\nkemudian memilih role Login as Mahasiswa Lama. Setelah login, mahasiswa dapat memilih menu Permohonan Keringanan\r\nUKT. Selanjutnya mahasiswa dapat mengisi kelengkapan dokumen yang diperlukan untuk proses pengajuan keringanan.']","Mahasiswa dapat mengajukan permohonan keringanan UKT melalui aplikasi layanan SIPMABA yang dapat diakses melalui myITS Portal atau portal.its.ac.id. Setelah login, mahasiswa dapat memilih menu Permohonan Keringanan UKT dan mengisi kelengkapan dokumen yang diperlukan untuk proses pengajuan keringanan."
14,Data dan berkas pendukung apa yang harus diupload untuk pengajuan keringanan UKT?,"Surat permohonan, bukti dukung, surat keterangan pekerjaan, surat keterangan penghasilan, SPT, foto usaha, tagihan listrik, PBB, kartu keluarga, pajak kendaraan, foto rumah","['menu pendukung (supported) dan upload berkas (upload file). Data dan berkas pendukung yang harus diupload\ndi pada sistem adalah:\nSurat permohonan kepada Wakil Rektor II yang disertai alasan mengajukan keringanan UKT (format bebas)\nBukti/data dukung alasan mengajukan keringanan UKT (bukti dijadikan 1 file dengan surat permohonan keringanan\nUKT). Misalnya, apabila orang tua sakit, maka data dukung yang dilampirkan berupa surat keterangan yang\ndikeluarkan dari Rumah Sakit/dokter yang menangani penyakit tersebut.\nSurat keterangan pekerjaan orang tua (ayah dan ibu) terbaru\nSurat keterangan penghasilan orang tua (ayah dan ibu) terbaru\nSPT Tahunan orang tua (ayah dan ibu) terbaru\nFoto usaha pekerjaan orang tua (ayah dan ibu) terbaru (untuk jenis pekerjaan pedangang/pengusaha)\nTagihan listrik (bukti pembayaran listrik) terbaru\nPBB terbaru\nKartu keluarga (KK) terbaru\nPajak kendaraan roda 2 dan 4 terbaru\nFoto rumah (tampak depan, ruang tamu, 2 kamar tidur dan tampak belakang/dapur/kamar mandi)', 'menu pendukung (supported) dan upload berkas (upload file). Data dan berkas pendukung yang harus diupload\r\ndi pada sistem adalah:\r\nSurat permohonan kepada Wakil Rektor II yang disertai alasan mengajukan keringanan UKT (format bebas)\r\nBukti/data dukung alasan mengajukan keringanan UKT (bukti dijadikan 1 file dengan surat permohonan keringanan\r\nUKT). Misalnya, apabila orang tua sakit, maka data dukung yang dilampirkan berupa surat keterangan yang\r\ndikeluarkan dari Rumah Sakit/dokter yang menangani penyakit tersebut.\r\nSurat keterangan pekerjaan orang tua (ayah dan ibu) terbaru\r\nSurat keterangan penghasilan orang tua (ayah dan ibu) terbaru\r\nSPT Tahunan orang tua (ayah dan ibu) terbaru\r\nFoto usaha pekerjaan orang tua (ayah dan ibu) terbaru (untuk jenis pekerjaan pedangang/pengusaha)\r\nTagihan listrik (bukti pembayaran listrik) terbaru\r\nPBB terbaru\r\nKartu keluarga (KK) terbaru\r\nPajak kendaraan roda 2 dan 4 terbaru', 'Tagihan listrik (bukti pembayaran listrik) terbaru\r\nPBB terbaru\r\nKartu keluarga (KK) terbaru\r\nPajak kendaraan roda 2 dan 4 terbaru\r\nFoto rumah (tampak depan, ruang tamu, 2 kamar tidur dan tampak belakang/dapur/kamar mandi)\r\nCatatan:\r\n1. Apabila alasan permohonan keringanan dikarenakan orang tua pensiun, maka data dukung yang perlu dilampirkan\r\nberupa surat keterangan/surat keputusan (termasuk gaji pensiun atau pesangon) yang dikeluarkan oleh pemberi kerja.\r\nBerkas tersebut dapat diupload pada bagian pekerjaan, penghasilan atau SPT.\r\n2. Apabila orang tua meninggal dunia, maka data dukung yang dilampirkan berupa surat kematian/akte kematian. Berkas\r\ntersebut dapat diupload pada bagian pekerjaan, penghasilan atau SPT.\r\n3. Apabila ada data dukung yang tidak tersedia tempatnya untuk mengupload, maka data dukung dapat digabungkan\r\ndengan surat permohonan banding UKT/SPP dengan cara dikolase.', '3. Apabila ada data dukung yang tidak tersedia tempatnya untuk mengupload, maka data dukung dapat digabungkan\r\ndengan surat permohonan banding UKT/SPP dengan cara dikolase.\r\n4. Bagi mahasiswa Jalur Mandiri Kemitraan, data penghasilan orang tua (ayah dan ibu) yang dimasukkan adalah jumlah\r\ntotal per tahun\r\n5. Bagi mahasiswa jalur reguler, data penghasilan orang tua (ayah dan ibu) yang dimasukkan adalah jumlah total per\r\nbulan.\r\nSurabaya, 16 Nopember 2023\r\nDirektur Perencanaan dan Pengembangan,\r\nDr. Ir. Suwadi M.T.\r\n196808181993031002\r\nPowered by TCPDF (www.tcpdf.org)']","Untuk pengajuan keringanan UKT, data dan berkas pendukung yang harus diupload pada sistem antara lain:
1. Surat permohonan kepada Wakil Rektor II yang disertai alasan mengajukan keringanan UKT (format bebas)
2. Bukti/data dukung alasan mengajukan keringanan UKT (bukti dijadikan 1 file dengan surat permohonan keringanan UKT), misalnya surat keterangan dari Rumah Sakit/dokter jika orang tua sakit
3. Surat keterangan pekerjaan orang tua (ayah dan ibu) terbaru
4. Surat keterangan penghasilan orang tua (ayah dan ibu) terbaru
5. SPT Tahunan orang tua (ayah dan ibu) terbaru
6. Foto usaha pekerjaan orang tua (ayah dan ibu) terbaru (untuk jenis pekerjaan pedagang/pengusaha)
7. Tagihan listrik terbaru
8. PBB terbaru
9. Kartu Keluarga (KK) terbaru
10. Pajak kendaraan roda 2 dan 4 terbaru
11. Foto rumah (tampak depan, ruang tamu, 2 kamar tidur, dan tampak belakang/dapur/kamar mandi)

Catatan tambahan:
- Jika alasan permohonan keringanan dikarenakan orang tua pensiun, maka perlu dilampirkan surat keterangan/surat keputusan (termasuk gaji pensiun atau pesangon) yang dikeluarkan oleh pemberi kerja.
- Jika orang tua meninggal dunia, maka perlu dilampirkan surat kematian/akte kematian.
- Jika ada data dukung yang tidak tersedia tempatnya untuk diupload, data dukung dapat digabungkan dengan surat permohonan banding UKT/SPP dengan cara dikolase."
15,Apa yang harus disertakan jika alasan permohonan keringanan adalah orang tua pensiun?,Surat keterangan/surat keputusan termasuk gaji pensiun atau pesangon,"['dengan surat permohonan banding UKT/SPP dengan cara dikolase.\n4. Bagi mahasiswa Jalur Mandiri Kemitraan, data penghasilan orang tua (ayah dan ibu) yang dimasukkan adalah jumlah\ntotal per tahun\n5. Bagi mahasiswa jalur reguler, data penghasilan orang tua (ayah dan ibu) yang dimasukkan adalah jumlah total per\nbulan.\nSurabaya, 16 Nopember 2023\nDirektur Perencanaan dan Pengembangan,\nDr. Ir. Suwadi M.T.\n196808181993031002', 'Tagihan listrik (bukti pembayaran listrik) terbaru\r\nPBB terbaru\r\nKartu keluarga (KK) terbaru\r\nPajak kendaraan roda 2 dan 4 terbaru\r\nFoto rumah (tampak depan, ruang tamu, 2 kamar tidur dan tampak belakang/dapur/kamar mandi)\r\nCatatan:\r\n1. Apabila alasan permohonan keringanan dikarenakan orang tua pensiun, maka data dukung yang perlu dilampirkan\r\nberupa surat keterangan/surat keputusan (termasuk gaji pensiun atau pesangon) yang dikeluarkan oleh pemberi kerja.\r\nBerkas tersebut dapat diupload pada bagian pekerjaan, penghasilan atau SPT.\r\n2. Apabila orang tua meninggal dunia, maka data dukung yang dilampirkan berupa surat kematian/akte kematian. Berkas\r\ntersebut dapat diupload pada bagian pekerjaan, penghasilan atau SPT.\r\n3. Apabila ada data dukung yang tidak tersedia tempatnya untuk mengupload, maka data dukung dapat digabungkan\r\ndengan surat permohonan banding UKT/SPP dengan cara dikolase.', 'PBB terbaru\nKartu keluarga (KK) terbaru\nPajak kendaraan roda 2 dan 4 terbaru\nFoto rumah (tampak depan, ruang tamu, 2 kamar tidur dan tampak belakang/dapur/kamar mandi)\nCatatan:\n1. Apabila alasan permohonan keringanan dikarenakan orang tua pensiun, maka data dukung yang perlu dilampirkan\nberupa surat keterangan/surat keputusan (termasuk gaji pensiun atau pesangon) yang dikeluarkan oleh pemberi kerja.\nBerkas tersebut dapat diupload pada bagian pekerjaan, penghasilan atau SPT.\n2. Apabila orang tua meninggal dunia, maka data dukung yang dilampirkan berupa surat kematian/akte kematian. Berkas\ntersebut dapat diupload pada bagian pekerjaan, penghasilan atau SPT.\n3. Apabila ada data dukung yang tidak tersedia tempatnya untuk mengupload, maka data dukung dapat digabungkan\ndengan surat permohonan banding UKT/SPP dengan cara dikolase.\n4. Bagi mahasiswa Jalur Mandiri Kemitraan, data penghasilan orang tua (ayah dan ibu) yang dimasukkan adalah jumlah\ntotal per tahun', '3. Apabila ada data dukung yang tidak tersedia tempatnya untuk mengupload, maka data dukung dapat digabungkan\r\ndengan surat permohonan banding UKT/SPP dengan cara dikolase.\r\n4. Bagi mahasiswa Jalur Mandiri Kemitraan, data penghasilan orang tua (ayah dan ibu) yang dimasukkan adalah jumlah\r\ntotal per tahun\r\n5. Bagi mahasiswa jalur reguler, data penghasilan orang tua (ayah dan ibu) yang dimasukkan adalah jumlah total per\r\nbulan.\r\nSurabaya, 16 Nopember 2023\r\nDirektur Perencanaan dan Pengembangan,\r\nDr. Ir. Suwadi M.T.\r\n196808181993031002\r\nPowered by TCPDF (www.tcpdf.org)']","Jika alasan permohonan keringanan adalah orang tua pensiun, maka yang harus disertakan adalah surat keterangan/surat keputusan (termasuk gaji pensiun atau pesangon) yang dikeluarkan oleh pemberi kerja. Berkas tersebut dapat diupload pada bagian pekerjaan, penghasilan, atau SPT."
16,Dimana saya bisa mengajukan permohonan keringanan UKT?,Permohonan keringanan UKT dapat diajukan melalui SIPMABA di portal.its.ac.id.,"['3. Apabila ada data dukung yang tidak tersedia tempatnya untuk mengupload, maka data dukung dapat digabungkan\r\ndengan surat permohonan banding UKT/SPP dengan cara dikolase.\r\n4. Bagi mahasiswa Jalur Mandiri Kemitraan, data penghasilan orang tua (ayah dan ibu) yang dimasukkan adalah jumlah\r\ntotal per tahun\r\n5. Bagi mahasiswa jalur reguler, data penghasilan orang tua (ayah dan ibu) yang dimasukkan adalah jumlah total per\r\nbulan.\r\nSurabaya, 16 Nopember 2023\r\nDirektur Perencanaan dan Pengembangan,\r\nDr. Ir. Suwadi M.T.\r\n196808181993031002\r\nPowered by TCPDF (www.tcpdf.org)', 'dengan surat permohonan banding UKT/SPP dengan cara dikolase.\n4. Bagi mahasiswa Jalur Mandiri Kemitraan, data penghasilan orang tua (ayah dan ibu) yang dimasukkan adalah jumlah\ntotal per tahun\n5. Bagi mahasiswa jalur reguler, data penghasilan orang tua (ayah dan ibu) yang dimasukkan adalah jumlah total per\nbulan.\nSurabaya, 16 Nopember 2023\nDirektur Perencanaan dan Pengembangan,\nDr. Ir. Suwadi M.T.\n196808181993031002', 'periode pengajuan, Mahasiswa yang dimaksud disyaratkan saat ini minimal akan memasuki semester 2 (dua)\ndan bukan termasuk kelompok penerima beasiswa, baik beasiswa Bidik Misi/KIP-K maupun beasiswa lainnya, serta\nbelum pernah mendapatkan penurunan UKT dari proses banding UKT sebelumnya,\n2. Permohonan Keringanan UKT dilakukan melalui myITS Portal atau portal.its.ac.id dengan aplikasi layanan\nSIPMABA dilakukan dengan melakukan terhadap update data–data kelengkapan verifikasi UKT yang sebelumnya\npernah diisi oleh mahasiswa pada saat menjadi calon mahasiswa baru.\nPengisian data dapat dilakukan dengan cara login melalui myITS Portal atau portal.its.ac.id dan memilih aplikasi SIPMABA\nkemudian memilih role Login as Mahasiswa Lama. Setelah login, mahasiswa dapat memilih menu Permohonan Keringanan\nUKT. Selanjutnya mahasiswa dapat mengisi kelengkapan dokumen yang diperlukan untuk proses pengajuan keringanan.', 'periode pengajuan, Mahasiswa yang dimaksud disyaratkan saat ini minimal akan memasuki semester 2 (dua)\r\ndan bukan termasuk kelompok penerima beasiswa, baik beasiswa Bidik Misi/KIP-K maupun beasiswa lainnya, serta\r\nbelum pernah mendapatkan penurunan UKT dari proses banding UKT sebelumnya,\r\n2. Permohonan Keringanan UKT dilakukan melalui myITS Portal atau portal.its.ac.id dengan aplikasi layanan\r\nSIPMABA dilakukan dengan melakukan terhadap update data–data kelengkapan verifikasi UKT yang sebelumnya\r\npernah diisi oleh mahasiswa pada saat menjadi calon mahasiswa baru.\r\nPengisian data dapat dilakukan dengan cara login melalui myITS Portal atau portal.its.ac.id dan memilih aplikasi SIPMABA\r\nkemudian memilih role Login as Mahasiswa Lama. Setelah login, mahasiswa dapat memilih menu Permohonan Keringanan\r\nUKT. Selanjutnya mahasiswa dapat mengisi kelengkapan dokumen yang diperlukan untuk proses pengajuan keringanan.']","Anda bisa mengajukan permohonan keringanan UKT melalui myITS Portal atau portal.its.ac.id dengan menggunakan aplikasi layanan SIPMABA. Proses pengisian data dilakukan dengan login melalui myITS Portal atau portal.its.ac.id, memilih aplikasi SIPMABA, dan memilih role Login as Mahasiswa Lama. Setelah login, Anda dapat memilih menu Permohonan Keringanan UKT dan mengisi kelengkapan dokumen yang diperlukan untuk proses pengajuan keringanan."
17,Kapan pengajuan keringanan UKT/SPP dapat dilakukan?,Pengajuan keringanan UKT/SPP dapat dilakukan pada 01-17 Desember 2023.,"['Pasal 20\n(1) Mahasiswa dapat melakukan penarikan UKT atau SPP sebesar 80% (delapan puluh \n  persen), apabila Mahasiswa mendapatkan izin cuti studi paling lambat minggu ke 4 \n  (empat) masa perkuliahan.\n(2) Mahasiswa yang mendapatkan izin cuti setelah kegiatan perkuliahan berjalan lebih \n  dari 4 (empat) minggu, maka dana pendidikan yang telah dibayarkan tidak dapat \n  ditarik kembali.\n(3) Penarikan UKT atau SPP sebesar 100% (seratus persen) dapat diberikan apabila:\n  a. Mahasiswa tersebut diberhentikan dengan keputusan Rektor;\n  b. Mahasiswa tersebut mendapatkan izin cuti studi sebelum masa pembayaran UKT \n   atau SPP berakhir; atau\n  c. Mahasiswa tersebut mendapatkan izin cuti sakit yang diakibatkan oleh peristiwa \n   yang menyebabkan Mahasiswa tersebut tidak dapat mengikuti perkuliahan \n   sekurang-kurangnya 2 (dua) minggu secara bertur-ut-turut, dibuktikan dengan \n   surat keterangan dokter dan rekomendasi kepala departemen.', '7\n  b. apabila permohonan disetujui Wakil Rektor yang membidangi akademik, maka \n    Mahasiswa diwajibkan membayar UKT atau SPP selama periode yang tidak \n    dibayar dan membayar UKT atau SPP pada semester berikutnya untuk diaktifkan \n    statusnya sebagai Mahasiswa.\n\n                  Pasal 10\n(1) Mahasiswa yang mendapatkan izin cuti paling lambat pada minggu ke-4 (ke-empat) \n  perkuliahan diwajibkan membayar UKT atau SPP sebesar 20% (dua puluh persen).\n(2) Mahasiswa yang mendapatkan izin cuti setelah minggu ke-4 (ke-empat) perkuliahan, \n  diwajibkan membayar UKT atau SPP sebesar 100% (seratus persen).\n(3) Pengajuan izin cuti sebagaimana dimaksud pada ayat (1) dan ayat (2) diajukan \n  kepada Wakil Rektor yang membidangi akademik.\n\n                 Bagian Kedua \n           Pembebasan Pembayaran UKT dan SPP', '7\n  b. apabila permohonan disetujui Wakil Rektor yang membidangi akademik, maka \n    Mahasiswa diwajibkan membayar UKT atau SPP selama periode yang tidak \n    dibayar dan membayar UKT atau SPP pada semester berikutnya untuk diaktifkan \n    statusnya sebagai Mahasiswa.\n\n                  Pasal 10\n(1) Mahasiswa yang mendapatkan izin cuti paling lambat pada minggu ke-4 (ke-empat) \n  perkuliahan diwajibkan membayar UKT atau SPP sebesar 20% (dua puluh persen).\n(2) Mahasiswa yang mendapatkan izin cuti setelah minggu ke-4 (ke-empat) perkuliahan, \n  diwajibkan membayar UKT atau SPP sebesar 100% (seratus persen).\n(3) Pengajuan izin cuti sebagaimana dimaksud pada ayat (1) dan ayat (2) diajukan \n  kepada Wakil Rektor yang membidangi akademik.\n\n                 Bagian Kedua \n           Pembebasan Pembayaran UKT dan SPP', 'Pasal 16\n(1) Keringanan SPP sebagaimana dimaksud dalam Pasal 15 ayat (1) dapat diberikan mulai \n  semester satu untuk pegawai pelajar dengan status Mahasiswa Baru atau mulai \n  semester berjalan untuk pegawai pelajar dengan status Mahasiswa ongoing.\n(2) Keringanan SPP dapat diberikan paling lama sampai dengan semester VI (enam) \n  dengan memperhitungkan masa cuti.\n(3) Keringanan SPP setelah semester VI (enam) dapat diberikan perpanjangan sampai 1 \n  (satu) semester berikutnya atas rekomendasi dari tim yang ditunjuk oleh ITS dan \n  mendapat persetujuan dari Wakil Rektor yang membidangi sumber daya manusia.\n\n                 Bagian Kelima \n        Keringanan Dana SPP Untuk Tenaga Kependidikan ITS']","Pengajuan keringanan UKT/SPP dapat dilakukan mulai semester satu untuk pegawai pelajar dengan status Mahasiswa Baru atau mulai semester berjalan untuk pegawai pelajar dengan status Mahasiswa ongoing. Keringanan SPP dapat diberikan paling lama sampai dengan semester VI (enam) dengan memperhitungkan masa cuti. Setelah semester VI (enam), keringanan SPP dapat diberikan perpanjangan sampai 1 (satu) semester berikutnya atas rekomendasi dari tim yang ditunjuk oleh ITS dan mendapat persetujuan dari Wakil Rektor yang membidangi sumber daya manusia."
18,Apa yang harus dilakukan jika orang tua meninggal dunia?,Lampirkan surat kematian atau akte kematian.,"['Tagihan listrik (bukti pembayaran listrik) terbaru\r\nPBB terbaru\r\nKartu keluarga (KK) terbaru\r\nPajak kendaraan roda 2 dan 4 terbaru\r\nFoto rumah (tampak depan, ruang tamu, 2 kamar tidur dan tampak belakang/dapur/kamar mandi)\r\nCatatan:\r\n1. Apabila alasan permohonan keringanan dikarenakan orang tua pensiun, maka data dukung yang perlu dilampirkan\r\nberupa surat keterangan/surat keputusan (termasuk gaji pensiun atau pesangon) yang dikeluarkan oleh pemberi kerja.\r\nBerkas tersebut dapat diupload pada bagian pekerjaan, penghasilan atau SPT.\r\n2. Apabila orang tua meninggal dunia, maka data dukung yang dilampirkan berupa surat kematian/akte kematian. Berkas\r\ntersebut dapat diupload pada bagian pekerjaan, penghasilan atau SPT.\r\n3. Apabila ada data dukung yang tidak tersedia tempatnya untuk mengupload, maka data dukung dapat digabungkan\r\ndengan surat permohonan banding UKT/SPP dengan cara dikolase.', 'dengan surat permohonan banding UKT/SPP dengan cara dikolase.\n4. Bagi mahasiswa Jalur Mandiri Kemitraan, data penghasilan orang tua (ayah dan ibu) yang dimasukkan adalah jumlah\ntotal per tahun\n5. Bagi mahasiswa jalur reguler, data penghasilan orang tua (ayah dan ibu) yang dimasukkan adalah jumlah total per\nbulan.\nSurabaya, 16 Nopember 2023\nDirektur Perencanaan dan Pengembangan,\nDr. Ir. Suwadi M.T.\n196808181993031002', '3. Apabila ada data dukung yang tidak tersedia tempatnya untuk mengupload, maka data dukung dapat digabungkan\r\ndengan surat permohonan banding UKT/SPP dengan cara dikolase.\r\n4. Bagi mahasiswa Jalur Mandiri Kemitraan, data penghasilan orang tua (ayah dan ibu) yang dimasukkan adalah jumlah\r\ntotal per tahun\r\n5. Bagi mahasiswa jalur reguler, data penghasilan orang tua (ayah dan ibu) yang dimasukkan adalah jumlah total per\r\nbulan.\r\nSurabaya, 16 Nopember 2023\r\nDirektur Perencanaan dan Pengembangan,\r\nDr. Ir. Suwadi M.T.\r\n196808181993031002\r\nPowered by TCPDF (www.tcpdf.org)', 'PBB terbaru\nKartu keluarga (KK) terbaru\nPajak kendaraan roda 2 dan 4 terbaru\nFoto rumah (tampak depan, ruang tamu, 2 kamar tidur dan tampak belakang/dapur/kamar mandi)\nCatatan:\n1. Apabila alasan permohonan keringanan dikarenakan orang tua pensiun, maka data dukung yang perlu dilampirkan\nberupa surat keterangan/surat keputusan (termasuk gaji pensiun atau pesangon) yang dikeluarkan oleh pemberi kerja.\nBerkas tersebut dapat diupload pada bagian pekerjaan, penghasilan atau SPT.\n2. Apabila orang tua meninggal dunia, maka data dukung yang dilampirkan berupa surat kematian/akte kematian. Berkas\ntersebut dapat diupload pada bagian pekerjaan, penghasilan atau SPT.\n3. Apabila ada data dukung yang tidak tersedia tempatnya untuk mengupload, maka data dukung dapat digabungkan\ndengan surat permohonan banding UKT/SPP dengan cara dikolase.\n4. Bagi mahasiswa Jalur Mandiri Kemitraan, data penghasilan orang tua (ayah dan ibu) yang dimasukkan adalah jumlah\ntotal per tahun']","Jika orang tua meninggal dunia, Anda perlu melampirkan surat kematian/akte kematian sebagai data dukung. Berkas tersebut dapat diupload pada bagian pekerjaan, penghasilan, atau SPT sesuai dengan petunjuk yang diberikan."
19,Bagaimana cara login ke portal pengajuan keringanan UKT?,Login melalui myITS Portal atau portal.its.ac.id dan memilih aplikasi SIPMABA dengan role Login as Mahasiswa Lama.,"['periode pengajuan, Mahasiswa yang dimaksud disyaratkan saat ini minimal akan memasuki semester 2 (dua)\ndan bukan termasuk kelompok penerima beasiswa, baik beasiswa Bidik Misi/KIP-K maupun beasiswa lainnya, serta\nbelum pernah mendapatkan penurunan UKT dari proses banding UKT sebelumnya,\n2. Permohonan Keringanan UKT dilakukan melalui myITS Portal atau portal.its.ac.id dengan aplikasi layanan\nSIPMABA dilakukan dengan melakukan terhadap update data–data kelengkapan verifikasi UKT yang sebelumnya\npernah diisi oleh mahasiswa pada saat menjadi calon mahasiswa baru.\nPengisian data dapat dilakukan dengan cara login melalui myITS Portal atau portal.its.ac.id dan memilih aplikasi SIPMABA\nkemudian memilih role Login as Mahasiswa Lama. Setelah login, mahasiswa dapat memilih menu Permohonan Keringanan\nUKT. Selanjutnya mahasiswa dapat mengisi kelengkapan dokumen yang diperlukan untuk proses pengajuan keringanan.', 'periode pengajuan, Mahasiswa yang dimaksud disyaratkan saat ini minimal akan memasuki semester 2 (dua)\r\ndan bukan termasuk kelompok penerima beasiswa, baik beasiswa Bidik Misi/KIP-K maupun beasiswa lainnya, serta\r\nbelum pernah mendapatkan penurunan UKT dari proses banding UKT sebelumnya,\r\n2. Permohonan Keringanan UKT dilakukan melalui myITS Portal atau portal.its.ac.id dengan aplikasi layanan\r\nSIPMABA dilakukan dengan melakukan terhadap update data–data kelengkapan verifikasi UKT yang sebelumnya\r\npernah diisi oleh mahasiswa pada saat menjadi calon mahasiswa baru.\r\nPengisian data dapat dilakukan dengan cara login melalui myITS Portal atau portal.its.ac.id dan memilih aplikasi SIPMABA\r\nkemudian memilih role Login as Mahasiswa Lama. Setelah login, mahasiswa dapat memilih menu Permohonan Keringanan\r\nUKT. Selanjutnya mahasiswa dapat mengisi kelengkapan dokumen yang diperlukan untuk proses pengajuan keringanan.', '6\n  1. Keringanan pembayaran UKT atau SPP sebesar 50% (lima puluh persen) untuk \n    selain Mahasiswa IUP dan joint degree/ double degree; atau\n  2. Keringanan pembayaran SPP sebesar 70% (tujuh puluh persen) untuk Mahasiswa \n    IUP dan joint degree/ double degree.\n(6) Mahasiswa program doktor yang melaksanakan ujian tertutup setelah yudisium \n  institut sampai dengan dimulainya semester baru dan dinyatakan lulus ujian tertutup \n  maka wajib membayar SPP sebesar 10% (sepuluh persen) dan mengikuti periode \n  wisuda setelah yudisium institut berikutnya.\n(7) Dalam hal Mahasiswi sebagaimana dimaksud pada ayat (6) tidak lulus ujian tertutup, \n  maka membayar SPP sebesar 100°/0 (seratus persen).\n(8) Mahasiswa luar ITS yang melakukan kegiatan akademik di ITS wajib membayar SPP \n  sesuai dengan perjanjian kerjasama.', '6\n  1. Keringanan pembayaran UKT atau SPP sebesar 50% (lima puluh persen) untuk \n    selain Mahasiswa IUP dan joint degree/ double degree; atau\n  2. Keringanan pembayaran SPP sebesar 70% (tujuh puluh persen) untuk Mahasiswa \n    IUP dan joint degree/ double degree.\n(6) Mahasiswa program doktor yang melaksanakan ujian tertutup setelah yudisium \n  institut sampai dengan dimulainya semester baru dan dinyatakan lulus ujian tertutup \n  maka wajib membayar SPP sebesar 10% (sepuluh persen) dan mengikuti periode \n  wisuda setelah yudisium institut berikutnya.\n(7) Dalam hal Mahasiswi sebagaimana dimaksud pada ayat (6) tidak lulus ujian tertutup, \n  maka membayar SPP sebesar 100°/0 (seratus persen).\n(8) Mahasiswa luar ITS yang melakukan kegiatan akademik di ITS wajib membayar SPP \n  sesuai dengan perjanjian kerjasama.']","Anda dapat login ke portal pengajuan keringanan UKT dengan cara sebagai berikut:
1. Buka myITS Portal atau portal.its.ac.id
2. Pilih aplikasi layanan SIPMABA
3. Login dengan memilih role ""Login as Mahasiswa Lama""
4. Setelah login, pilih menu ""Permohonan Keringanan UKT""
5. Selanjutnya, isi kelengkapan dokumen yang diperlukan untuk proses pengajuan keringanan.

Semoga jawaban ini membantu!"
