,question,answer,contexts,ground_truth,context_precision,faithfulness,answer_relevancy,context_recall
0,Apa saja persyaratan umum pendaftaran Beasiswa Prioritas LPDP – Campus France Program Master?,"Untuk pendaftaran Beasiswa Prioritas LPDP - Campus France Program Master, terdapat persyaratan umum yang harus dipenuhi, yaitu:
1. Warga Negara Indonesia (WNI)
2. PNS/TNI/POLRI
3. Mendaftar secara bersamaan pada Beasiswa Kemitraan LPDP - Campus France Program Master dan salah satu program Magister beasiswa Afirmasi/Targeted/Umum tujuan luar negeri.","['kejuaraan/non kejuaraan, dan pengalaman\norganisasi pada aplikasi pendaftaran.\nApa saja persyaratan khusus pendaftaran\nBeasiswa Prioritas LPDP – Campus France\nProgram Master?\nPersyaratan khusus Beasiswa Kemitraan LPDP –\nCampus France Program Master adalah sebagai\nberikut:'
 'Program Master memberikan kesempatan bagi\npendaftar untuk dapat melakukan pendaftaran\npada Beasiswa Kemitraan LPDP – Campus\nFrance dan beasiswa Magister Luar Negeri\npada salah satu program:\n1. Beasiswa Afirmasi\na. Beasiswa Daerah Afirmasi\nb. Beasiswa Putra Putri Papua\nc. Beasiswa Penyandang Disabilitas\nd. Beasiswa Prasejahtera\n2. Beasiswa Targeted\na. Beasiswa PNS, TNI, POLRI\nb. Beasiswa Kewirausahaan\nc. Beasiswa Umum\na. Beasiswa Reguler\nb. Beasiswa Parsial\nBeasiswa Kemitraan LPDP - Campus France\nmerupakan beasiswa kerja sama antara LPDP dan\nPemerintah Perancis pada jenjang master untuk\nbidang prioritas pembangunan Indonesia sesuai\ndengan keahlian pengetahuan yang dimiliki oleh\nUniversitas di Perancis dalam rangka\nmenghasilkan pemimpin masa depan Indonesia\nyang kompeten di bidang tersebut.\nSiapakah Sasaran Beasiswa Prioritas\nLPDP – Campus France Program Master?\n1. Warga Negara Indonesia (WNI)\n2. PNS/TNI/POLRI\nSeperti Apa Skema Prioritas LPDP –\nCampus France Program Master?'
 'Panduan Pendaftaran\nBeasiswa Prioritas\nLPDP - Campus France\nProgram Master\nTahun 2024\nlpdp.kemenkeu.go.id'
 'Siapakah Sasaran Beasiswa Prioritas\nLPDP – Campus France Program Master?\n1. Warga Negara Indonesia (WNI)\n2. PNS/TNI/POLRI\nSeperti Apa Skema Prioritas LPDP –\nCampus France Program Master?\nPendaftar wajib mendaftar secara bersamaan\npada beasiswa Kemitraan LPDP – Campus France\nProgram Master dan salah satu program Magister\nbeasiswa Afirmasi/Targeted/Umum tujuan luar\nnegeri, dengan skema berikut.\n1. Beasiswa Kemitraan LPDP – Campus France\nProgram Master:\na. Beasiswa LPDP – Campus France\nProgram Master diperuntukkan bagi\nWarga Negara Indonesia untuk dapat\nmenempuh pendidikan pada program\nmagister di program studi dan universitas\nsebagaimana daftar terlampir dengan\ndurasi pendanaan paling lama 24 (dua\npuluh empat) bulan.\nb. Pendaftar diharuskan untuk melakukan\npendaftaran pada:\n● Perguruan Tinggi Tujuan Studi\nsesuai jadwal dan ketentuan yang\nberlaku di Perguruan Tinggi, dan\n● Campus France sesuai jadwal dan\nketentuan yang berlaku di Campus\nFrance.\n2. Persyaratan dan dokumen pada Beasiswa']","Warga Negara Indonesia, telah menyelesaikan studi D4/S1, tidak diizinkan bagi yang telah menyelesaikan studi S2, dan bagi lulusan luar negeri wajib melampirkan hasil penyetaraan ijazah dan konversi IPK.",,0.999999999975,1.0,0.9963651166597646
1,Apa yang harus dilakukan pendaftar yang merupakan PNS?,"Pendaftar yang merupakan PNS harus melampirkan Surat Keputusan (SK) Jabatan Terakhir atau SK Kenaikan Pangkat Terakhir atau sejenisnya yang menunjukkan bahwa pendaftar adalah PNS dengan jabatan fungsional sebagai Peneliti/Perekayasa/Medis/Paramedis/Pendidik. Selain itu, bagi pendaftar yang merupakan prajurit TNI di semua program beasiswa LPDP, wajib melampirkan surat usulan atau surat rekomendasi sekurang-kurangnya dari pejabat yang membidangi pembinaan SDM pada Mabes TNI/TNI AD/TNI AL/TNI AU untuk mengikuti program beasiswa.","['Program Master memberikan kesempatan bagi\npendaftar untuk dapat melakukan pendaftaran\npada Beasiswa Kemitraan LPDP – Campus\nFrance dan beasiswa Magister Luar Negeri\npada salah satu program:\n1. Beasiswa Afirmasi\na. Beasiswa Daerah Afirmasi\nb. Beasiswa Putra Putri Papua\nc. Beasiswa Penyandang Disabilitas\nd. Beasiswa Prasejahtera\n2. Beasiswa Targeted\na. Beasiswa PNS, TNI, POLRI\nb. Beasiswa Kewirausahaan\nc. Beasiswa Umum\na. Beasiswa Reguler\nb. Beasiswa Parsial\nBeasiswa Kemitraan LPDP - Campus France\nmerupakan beasiswa kerja sama antara LPDP dan\nPemerintah Perancis pada jenjang master untuk\nbidang prioritas pembangunan Indonesia sesuai\ndengan keahlian pengetahuan yang dimiliki oleh\nUniversitas di Perancis dalam rangka\nmenghasilkan pemimpin masa depan Indonesia\nyang kompeten di bidang tersebut.\nSiapakah Sasaran Beasiswa Prioritas\nLPDP – Campus France Program Master?\n1. Warga Negara Indonesia (WNI)\n2. PNS/TNI/POLRI\nSeperti Apa Skema Prioritas LPDP –\nCampus France Program Master?'
 'Dipublikasikan tanggal 11 Januari 2024\n1 tahun (2N+1) setelah selesai studi secara\nberturut-turut.\nDokumen apa saja yang harus diisi atau di\nunggah pada aplikasi pendaftaran\nBeasiswa Prioritas LPDP – Campus France\nProgram Master?\n1. Syarat dokumen Beasiswa Kemitraan LPDP-\nCampus France\nDokumen\nOnline\nForm\nUnggah\nBiodata Diri ✔\nKartu Tanda Penduduk (KTP) ✔\nScan Ijazah S1 (Asli atau\nLegalisir) atau SKL (Surat\nKeterangan Lulus)\n✔\nSurat pemberhentian sebagai\nmahasiswa dari Perguruan\nTinggi bagi yang tidak\nmenyelesaikan studi master.\n✔\nScan Transkrip Nilai S1\n(bukan Transkrip Profesi)\n✔\nDokumen penyetaraan ijazah\ndari\nKemendikbudristek/Kemena\ng atau tangkapan layar\npengajuan penyetaraan\nijazah.\n✔\nDokumen konversi IPK dari\nKemendikbudristek/Kemena\ng atau tangkapan layar\npengajuan konversi IPK\n✔\nSertifikat Bahasa Asing yang\ndipersyaratkan dan Masih\nBerlaku (Asli)\n✔\nSurat rekomendasi dari\nakademisi atau tokoh\nmasyarakat *)\n✔ ✔\nSurat usulan dari pejabat\nyang membidangi SDM untuk'
 'melampirkan surat usulan atau surat\nrekomendasi sekurang-kurangnya dari\npejabat setingkat eselon II yang membidangi\npembinaan/pengembangan SDM pada\nKementerian/Lembaga atau Pemerintah\nDaerah tempat pendaftar bekerja dengan\nketentuan;\na. mengusulkan atau merekomendasikan\npendaftar untuk mengikuti program\nBeasiswa LPDP; dan\nb. mencantumkan Nama Lengkap serta\nNomor Induk Pegawai (NIP) pendaftar.\n9. Bagi pendaftar yang merupakan PNS dengan\nstatus PNS dengan jabatan fungsional\nsebagai Peneliti/Perekayasa/Medis/\nParamedis/ Pendidik, mengunggah Surat\nKeputusan (SK) Jabatan Terakhir atau SK\nKenaikan Pangkat Terakhir atau sejenisnya\nyang menunjukkan bahwa pendaftar adalah\nPNS dengan jabatan fungsional sebagai\nPeneliti/Perekayasa/Medis/Paramedis/Pendi\ndik.\n10. Bagi pendaftar berstatus prajurit TNI di semua\nprogram beasiswa LPDP wajib melampirkan\nsurat usulan atau surat rekomendasi\nsekurang-kurangnya pejabat yang\nmembidangi pembinaan SDM pada Mabes\nTNI/ TNI AD/ TNI AL/ TNI AU untuk mengikuti'
 'Siapakah Sasaran Beasiswa Prioritas\nLPDP – Campus France Program Master?\n1. Warga Negara Indonesia (WNI)\n2. PNS/TNI/POLRI\nSeperti Apa Skema Prioritas LPDP –\nCampus France Program Master?\nPendaftar wajib mendaftar secara bersamaan\npada beasiswa Kemitraan LPDP – Campus France\nProgram Master dan salah satu program Magister\nbeasiswa Afirmasi/Targeted/Umum tujuan luar\nnegeri, dengan skema berikut.\n1. Beasiswa Kemitraan LPDP – Campus France\nProgram Master:\na. Beasiswa LPDP – Campus France\nProgram Master diperuntukkan bagi\nWarga Negara Indonesia untuk dapat\nmenempuh pendidikan pada program\nmagister di program studi dan universitas\nsebagaimana daftar terlampir dengan\ndurasi pendanaan paling lama 24 (dua\npuluh empat) bulan.\nb. Pendaftar diharuskan untuk melakukan\npendaftaran pada:\n● Perguruan Tinggi Tujuan Studi\nsesuai jadwal dan ketentuan yang\nberlaku di Perguruan Tinggi, dan\n● Campus France sesuai jadwal dan\nketentuan yang berlaku di Campus\nFrance.\n2. Persyaratan dan dokumen pada Beasiswa']",Melampirkan surat usulan atau rekomendasi dari pejabat eselon II yang mencantumkan NIP pendaftar.,0.0,0.999999999975,1.0,0.9310968261885714
2,Apa yang harus dipersiapkan sebelum mengikuti program internasional?,"Sebelum mengikuti program internasional, hal-hal yang harus dipersiapkan antara lain:

1. Menyelesaikan persyaratan umum pendaftaran Beasiswa Prioritas LPDP – Campus France Program Master, seperti menjadi Warga Negara Indonesia, telah menyelesaikan studi program diploma empat (D4) atau sarjana (S1), dan tidak memiliki gelar magister (S2).
2. Memilih program beasiswa yang sesuai dengan syarat dan ketentuan yang berlaku, seperti Beasiswa Afirmasi atau Beasiswa Targeted.
3. Menyiapkan dokumen-dokumen yang diperlukan untuk pendaftaran, seperti surat pernyataan, profil diri termasuk riwayat pendidikan, komitmen kembali ke Indonesia, dan riwayat publikasi ilmiah, prestasi kejuaraan/non kejuaraan, serta pengalaman organisasi.
4. Memahami komponen Dana yang diberikan, seperti Dana Pendidikan (Tuition Fee, Dana Pendaftaran, Dana Tunjangan Buku, Dana Penelitian Tesis, Dana Seminar Internasional, Dana Publikasi Jurnal Internasional) dan Dana Pendukung (Dana Transportasi, Dana Aplikasi Visa, Dana Asuransi Kesehatan, Dana Kedatangan, Dana Hidup Bulanan, Dana Lomba Internasional, Dana keadaaan darurat).
5. Memahami skema Prioritas LPDP – Campus France Program Master dan sasaran penerima beasiswa, yaitu Warga Negara Indonesia (WNI) dan PNS/TNI/POLRI.
6. Memahami ketentuan-ketentuan lain yang berlaku sesuai dengan program beasiswa yang dipilih.","['b. Kelas khusus;\nc. Kelas karyawan;\nd. Kelas jarak jauh;\ne. Kelas yang diselenggarakan bukan di\nperguruan tinggi induk;\nf. Kelas internasional bagi pendaftar tujuan\nstudi dalam negeri;\ng. Kelas yang diselenggarakan di lebih dari\n1 (satu) negara perguruan tinggi; atau\nh. Kelas lainnya yang tidak memenuhi\nketentuan LPDP.\n14. Menyetujui surat pernyataan yang telah\ndisediakan pada aplikasi pendaftaran\nbeasiswa LPDP (poin-poin terlampir).\n15. Menulis profil diri termasuk riwayat pendidikan\nyang tidak diselesaikan pada aplikasi\npendaftaran.\n16. Menulis komitmen kembali ke Indonesia,\nrencana pasca studi, dan rencana kontribusi\ndi Indonesia.\n17. Jika pendaftar memiliki publikasi ilmiah,\nprestasi kejuaraan/non kejuaraan, dan\npengalaman organisasi maka pendaftar\nmengisi riwayat publikasi ilmiah, prestasi\nkejuaraan/non kejuaraan, dan pengalaman\norganisasi pada aplikasi pendaftaran.\nApa saja persyaratan khusus pendaftaran\nBeasiswa Prioritas LPDP – Campus France\nProgram Master?'
 'Dipublikasikan tanggal 11 Januari 2024\nprogram beasiswa lain yang dipilih, sesuai\ndengan syarat dan ketentuan yang berlaku.\nApa saja komponen Dana yang diberikan?\n1. Dana Pendidikan\na. Tuition Fee\nb. Dana Pendaftaran\nc. Dana Tunjangan Buku\nd. Dana Penelitian Tesis\ne. Dana Seminar Internasional\nf. Dana Publikasi Jurnal Internasional\n2. Dana Pendukung\na. Dana Transportasi\nb. Dana Aplikasi Visa\nc. Dana Asuransi Kesehatan\nd. Dana Kedatangan\ne. Dana Hidup Bulanan\nf. Dana Lomba Internasional\ng. Dana keadaaan darurat (jika diperlukan)\nApa saja persyaratan umum pendaftaran\nBeasiswa Prioritas LPDP – Campus\nFrance Program Master?\nPersyaratan umum Beasiswa Prioritas LPDP –\nCampus France Program Master adalah sebagai\nberikut:\n1. Warga Negara Indonesia.\n2. Telah menyelesaikan studi program diploma\nempat (D4) atau sarjana (S1).\n3. Pendaftar yang telah menyelesaikan studi\nmagister (S2) tidak diizinkan mendaftar.\n4. Bagi pendaftar lulusan perguruan tinggi luar'
 'Program Master memberikan kesempatan bagi\npendaftar untuk dapat melakukan pendaftaran\npada Beasiswa Kemitraan LPDP – Campus\nFrance dan beasiswa Magister Luar Negeri\npada salah satu program:\n1. Beasiswa Afirmasi\na. Beasiswa Daerah Afirmasi\nb. Beasiswa Putra Putri Papua\nc. Beasiswa Penyandang Disabilitas\nd. Beasiswa Prasejahtera\n2. Beasiswa Targeted\na. Beasiswa PNS, TNI, POLRI\nb. Beasiswa Kewirausahaan\nc. Beasiswa Umum\na. Beasiswa Reguler\nb. Beasiswa Parsial\nBeasiswa Kemitraan LPDP - Campus France\nmerupakan beasiswa kerja sama antara LPDP dan\nPemerintah Perancis pada jenjang master untuk\nbidang prioritas pembangunan Indonesia sesuai\ndengan keahlian pengetahuan yang dimiliki oleh\nUniversitas di Perancis dalam rangka\nmenghasilkan pemimpin masa depan Indonesia\nyang kompeten di bidang tersebut.\nSiapakah Sasaran Beasiswa Prioritas\nLPDP – Campus France Program Master?\n1. Warga Negara Indonesia (WNI)\n2. PNS/TNI/POLRI\nSeperti Apa Skema Prioritas LPDP –\nCampus France Program Master?'
 'perkuliahan atau kegiatan terjadwal lainnya, termasuk kegiatan evaluasi.\n6. Mahasiswa adalah peserta didik pada jenjang pendidikan tinggi di ITS.\n7. Mahasiswa Asing adalah mahasiswa ITS dengan kewarganegaraan selain Indonesia.\n8. International Undergraduate Program yang selanjutnya disingkat IUP adalah program \n     pendidikan sarjana yang dilaksanakan dalam bahasa Inggris dan mahasiswa wajib \n     mengikuti kegiatan internasional sekurang-kurangnya satu kali selama masa studi \n     dalam bentuk Joint degree/Double Degree, student exchange, final project, internship, \n     atau short program dengan perguruan tinggi mitra ITS di luar negeri.\n9. Joint Degree/Double Degree adalah penyelenggaraan pendidikan bergelar yang \n     bekerja sama dengan perguruan tinggi mitra.']","Persiapan meliputi dokumentasi, keuangan, barang bawaan, pengetahuan, dan psikologi.",1.0,0.999999999975,0.8888888888888888,0.8407596790796165
3,Apa contoh program magang di luar negeri?,Saya tidak mengetahui program magang di luar negeri yang spesifik dari konteks yang diberikan.,"['b. Kelas khusus;\nc. Kelas karyawan;\nd. Kelas jarak jauh;\ne. Kelas yang diselenggarakan bukan di\nperguruan tinggi induk;\nf. Kelas internasional bagi pendaftar tujuan\nstudi dalam negeri;\ng. Kelas yang diselenggarakan di lebih dari\n1 (satu) negara perguruan tinggi; atau\nh. Kelas lainnya yang tidak memenuhi\nketentuan LPDP.\n14. Menyetujui surat pernyataan yang telah\ndisediakan pada aplikasi pendaftaran\nbeasiswa LPDP (poin-poin terlampir).\n15. Menulis profil diri termasuk riwayat pendidikan\nyang tidak diselesaikan pada aplikasi\npendaftaran.\n16. Menulis komitmen kembali ke Indonesia,\nrencana pasca studi, dan rencana kontribusi\ndi Indonesia.\n17. Jika pendaftar memiliki publikasi ilmiah,\nprestasi kejuaraan/non kejuaraan, dan\npengalaman organisasi maka pendaftar\nmengisi riwayat publikasi ilmiah, prestasi\nkejuaraan/non kejuaraan, dan pengalaman\norganisasi pada aplikasi pendaftaran.\nApa saja persyaratan khusus pendaftaran\nBeasiswa Prioritas LPDP – Campus France\nProgram Master?'
 'Program Master memberikan kesempatan bagi\npendaftar untuk dapat melakukan pendaftaran\npada Beasiswa Kemitraan LPDP – Campus\nFrance dan beasiswa Magister Luar Negeri\npada salah satu program:\n1. Beasiswa Afirmasi\na. Beasiswa Daerah Afirmasi\nb. Beasiswa Putra Putri Papua\nc. Beasiswa Penyandang Disabilitas\nd. Beasiswa Prasejahtera\n2. Beasiswa Targeted\na. Beasiswa PNS, TNI, POLRI\nb. Beasiswa Kewirausahaan\nc. Beasiswa Umum\na. Beasiswa Reguler\nb. Beasiswa Parsial\nBeasiswa Kemitraan LPDP - Campus France\nmerupakan beasiswa kerja sama antara LPDP dan\nPemerintah Perancis pada jenjang master untuk\nbidang prioritas pembangunan Indonesia sesuai\ndengan keahlian pengetahuan yang dimiliki oleh\nUniversitas di Perancis dalam rangka\nmenghasilkan pemimpin masa depan Indonesia\nyang kompeten di bidang tersebut.\nSiapakah Sasaran Beasiswa Prioritas\nLPDP – Campus France Program Master?\n1. Warga Negara Indonesia (WNI)\n2. PNS/TNI/POLRI\nSeperti Apa Skema Prioritas LPDP –\nCampus France Program Master?'
 'Dipublikasikan tanggal 11 Januari 2024\nprogram beasiswa lain yang dipilih, sesuai\ndengan syarat dan ketentuan yang berlaku.\nApa saja komponen Dana yang diberikan?\n1. Dana Pendidikan\na. Tuition Fee\nb. Dana Pendaftaran\nc. Dana Tunjangan Buku\nd. Dana Penelitian Tesis\ne. Dana Seminar Internasional\nf. Dana Publikasi Jurnal Internasional\n2. Dana Pendukung\na. Dana Transportasi\nb. Dana Aplikasi Visa\nc. Dana Asuransi Kesehatan\nd. Dana Kedatangan\ne. Dana Hidup Bulanan\nf. Dana Lomba Internasional\ng. Dana keadaaan darurat (jika diperlukan)\nApa saja persyaratan umum pendaftaran\nBeasiswa Prioritas LPDP – Campus\nFrance Program Master?\nPersyaratan umum Beasiswa Prioritas LPDP –\nCampus France Program Master adalah sebagai\nberikut:\n1. Warga Negara Indonesia.\n2. Telah menyelesaikan studi program diploma\nempat (D4) atau sarjana (S1).\n3. Pendaftar yang telah menyelesaikan studi\nmagister (S2) tidak diizinkan mendaftar.\n4. Bagi pendaftar lulusan perguruan tinggi luar'
 'perkuliahan atau kegiatan terjadwal lainnya, termasuk kegiatan evaluasi.\n6. Mahasiswa adalah peserta didik pada jenjang pendidikan tinggi di ITS.\n7. Mahasiswa Asing adalah mahasiswa ITS dengan kewarganegaraan selain Indonesia.\n8. International Undergraduate Program yang selanjutnya disingkat IUP adalah program \n     pendidikan sarjana yang dilaksanakan dalam bahasa Inggris dan mahasiswa wajib \n     mengikuti kegiatan internasional sekurang-kurangnya satu kali selama masa studi \n     dalam bentuk Joint degree/Double Degree, student exchange, final project, internship, \n     atau short program dengan perguruan tinggi mitra ITS di luar negeri.\n9. Joint Degree/Double Degree adalah penyelenggaraan pendidikan bergelar yang \n     bekerja sama dengan perguruan tinggi mitra.']",Contoh program magang meliputi Universiti Kuala Lumpur (UniKL) di Malaysia dan Shibaura Institute of Technology di Jepang.,0.0,0.249999999975,0.0,0.0
4,Apa yang dimaksud dengan UKT?,UKT adalah singkatan dari Uang Kuliah Tunggal. UKT adalah biaya yang dikenakan setiap semester kepada calon mahasiswa baru dan mahasiswa program sarjana/sarjana terapan yang diterima melalui jalur Seleksi Nasional.,"['4\n\n                  BAB II \n              MAKSUD DAN TUJUAN\n\n                 Pasal 2\n(1) Peraturan Rektor ini diterbitkan dengan maksud agar setiap pemungutan dan \n  penghimpunan dana pendidikan dari Calon Mahasiswa Baru dan Mahasiswa serta \n  penggunaannya memiliki landasan hukum.\n(2) Peraturan ini diterbitkan dengan tujuan untuk menjamin transparansi pemungutan, \n  penghimpunan, dan penggunaan dana pendidikan.\n\n                 BAB III \n               RUANG LINGKUP\n\n                 Pasal 3\n(1) Peraturan Rektor ini melingkupi besaran dan mekanisme pemungutan, \n  penghimpunan, dan penggunaan dana pendidikan.\n(2) Dana pendidikan sebagaimana dimaksud pada ayat (1) terdiri atas:\n  a. UKT;\n  b. SPP;\n  c. SPI; dan\n  d. SPA.\n\n                 BAB IV \n         KEWAJIBAN PEMBAYARAN DANA PENDIDIKAN'
 'Pasal 8\n(1) Mahasiswa yang tidak membayar UKT atau SPP sampai dengan batas waktu yang \n  ditentukan, status Mahasiswanya dinyatakan tidak aktif.\n(2) Mahasiswa yang tidak membayar UKT atau SPP sebagaimana dimaksud pada ayat (1) \n  selama 2 (dua) semester berturut-turut, dinyatakan mengundurkan diri melalui \n  keputusan Rektor.'
 'Pasal 8\n(1) Mahasiswa yang tidak membayar UKT atau SPP sampai dengan batas waktu yang \n  ditentukan, status Mahasiswanya dinyatakan tidak aktif.\n(2) Mahasiswa yang tidak membayar UKT atau SPP sebagaimana dimaksud pada ayat (1) \n  selama 2 (dua) semester berturut-turut, dinyatakan mengundurkan diri melalui \n  keputusan Rektor.'
 '10. Tarif adalah besaran dana pendidikan yang ditetapkan oleh Rektor.\n11. Biaya Kuliah tunggal yang selanjutnya disingkat BKT adalah keseluruhan biaya \n  operasional pertahun yang terkait langsung dengan proses pembelajaran mahasiswa \n  pada program studi di perguruan tinggi negeri.\n12. Uang Kuliah Tunggal yang selanjutnya disingkat UKT adalah biaya yang dikenakan \n  setiap semester kepada calon mahasiswa baru dan mahasiswa program \n  sarjana/sarjana terapan yang diterima melalui jalur Seleksi Nasional.\n13. Sumbangan Pembinaan Pendidikan yang selanjutnya disingkat SPP adalah biaya \n  yang dikenakan setiap semester kepada calon mahasiswa baru dan mahasiswa \n  program sarjana/ sarjana terapan dan pascasarjana/ pascasarjana terapan yang \n  diterima melalui selain jalur Seleksi Nasional atau calon mahasiswa baru dan \n  mahasiswa program sarjana/sarjana terapan yang diterima melalui jalur seleksi']",Uang Kuliah Tunggal,1.0,0.999999999975,1.0,0.999999094680789
5,Berapa persen keringanan pembayaran SPP bagi mahasiswa aktif pembayar dana pendidikan di luar ITS?,Mahasiswa aktif pembayar dana pendidikan di luar ITS diberikan keringanan pembayaran SPP sebesar 10% (sepuluh persen) di ITS.,"['Pasal 6\nMahasiswa program Joint Degree/ Double Degree yang melakukan kegiatan akademik di \nperguruan tinggi mitra luar negeri, diwajibkan membayar SPP:\na. sebesar 100% (seratus persen) di ITS untuk Mahasiswa yang tidak berkewajiban \n  membayar dana pendidikan di perguruan tinggi mitra luar negeri;\nb. sebesar 10% (sepuluh persen) di ITS untuk Mahasiswa yang berkewajiban membayar \n  dana pendidikan di perguruan tinggi mitra luar negeri; dan\nc. sebesar 100% (seratus persen) di ITS untuk Mahasiswa berkegiatan akademik di \n  perguruan tinggi mitra luar negeri yang mensyaratkan pembagian pendapatan SPP \n  dengan ITS.\n\n                   Pasal 7\n(1) Mahasiswa asing membayar UKT atau SPP yang besarannya ditetapkan dengan \n  keputusan Rektor.\n(2) Mahasiswa asing dari negara berkembang dapat diberikan beasiswa dari ITS berupa \n  keringanan pembayaran UKT atau SPP yang ditetapkan dengan keputusan Rektor.'
 'Pasal 6\nMahasiswa program Joint Degree/ Double Degree yang melakukan kegiatan akademik di \nperguruan tinggi mitra luar negeri, diwajibkan membayar SPP:\na. sebesar 100% (seratus persen) di ITS untuk Mahasiswa yang tidak berkewajiban \n  membayar dana pendidikan di perguruan tinggi mitra luar negeri;\nb. sebesar 10% (sepuluh persen) di ITS untuk Mahasiswa yang berkewajiban membayar \n  dana pendidikan di perguruan tinggi mitra luar negeri; dan\nc. sebesar 100% (seratus persen) di ITS untuk Mahasiswa berkegiatan akademik di \n  perguruan tinggi mitra luar negeri yang mensyaratkan pembagian pendapatan SPP \n  dengan ITS.\n\n                   Pasal 7\n(1) Mahasiswa asing membayar UKT atau SPP yang besarannya ditetapkan dengan \n  keputusan Rektor.\n(2) Mahasiswa asing dari negara berkembang dapat diberikan beasiswa dari ITS berupa \n  keringanan pembayaran UKT atau SPP yang ditetapkan dengan keputusan Rektor.'
 'angka 1 paling banyak 90% (sembilan puluh persen) pada semester berjalan; dan\n  b. Keringanan pembayaran UKT atau SPP sebagaimana dimaksud ayat (2) huruf c \n    angka 2 paling banyak 90% (sembilan puluh persen) pada semester berjalan, \n    diberikan kepada Mahasiswa yang melakukan kegiatan akademik dan \n    kemahasiswaan di Luar ITS di dalam negeri yang memiliki kewajiban membayar \n    dana pendidikan atau dana kepesertaan yang dikenakan oleh penyelenggara paling \n    sedikit senilai besaran UKT atau SPP ITS.\n(5) Mahasiswa yang mendapatkan keringanan pembayaran sebagaimana dimaksud pada \n  ayat (4) huruf b, dan mengambil paling banyak 6 sks di ITS pada semester berjalan \n  maka keringanan pembayarannya yaitu:'
 '6\n  1. Keringanan pembayaran UKT atau SPP sebesar 50% (lima puluh persen) untuk \n    selain Mahasiswa IUP dan joint degree/ double degree; atau\n  2. Keringanan pembayaran SPP sebesar 70% (tujuh puluh persen) untuk Mahasiswa \n    IUP dan joint degree/ double degree.\n(6) Mahasiswa program doktor yang melaksanakan ujian tertutup setelah yudisium \n  institut sampai dengan dimulainya semester baru dan dinyatakan lulus ujian tertutup \n  maka wajib membayar SPP sebesar 10% (sepuluh persen) dan mengikuti periode \n  wisuda setelah yudisium institut berikutnya.\n(7) Dalam hal Mahasiswi sebagaimana dimaksud pada ayat (6) tidak lulus ujian tertutup, \n  maka membayar SPP sebesar 100°/0 (seratus persen).\n(8) Mahasiswa luar ITS yang melakukan kegiatan akademik di ITS wajib membayar SPP \n  sesuai dengan perjanjian kerjasama.']",Maksimal 90%,1.0,0.999999999975,1.0,0.9960532555463236
6,Apa yang dimaksud dengan Program Studi dalam peraturan ini?,"Program Studi dalam peraturan ini adalah kesatuan kegiatan pendidikan dan pembelajaran yang memiliki kurikulum dan metode pembelajaran tertentu dalam satu jenis pendidikan akademik, pendidikan vokasi, dan/atau pendidikan profesi.","['Dalam peraturan ini yang dimaksud dengan:Pasal 1\n1. Institut Teknologi Sepuluh Nopember yang selanjutnya disebut ITS adalah perguruan \n     tinggi negeri badan hukum.\n2. Rektor adalah organ ITS yang memimpin penyelenggaraan dan pengelolaan ITS.\n3. Program Studi adalah kesatuan kegiatan pendidikan dan pembelajaran yang memiliki \n     kurikulum dan metode pembelajaran tertentu dalam satu jenis pendidikan akademik, \n     pendidikan vokasi, dan/atau pendidikan profesi.\n4. Pendidikan Profesi adalah program pendidikan sesudah program sarjana yang \n     mempersiapkan peserta didik untuk memiliki kemampuan dalam keahlian khusus \n     dan diselenggarakan bersama dengan organisasi profesi.\n5. Semester adalah satuan waktu kegiatan yang terdiri dari 16 (enam belas) minggu \n     perkuliahan atau kegiatan terjadwal lainnya, termasuk kegiatan evaluasi.\n6. Mahasiswa adalah peserta didik pada jenjang pendidikan tinggi di ITS.'
 'Siapakah Sasaran Beasiswa Prioritas\nLPDP – Campus France Program Master?\n1. Warga Negara Indonesia (WNI)\n2. PNS/TNI/POLRI\nSeperti Apa Skema Prioritas LPDP –\nCampus France Program Master?\nPendaftar wajib mendaftar secara bersamaan\npada beasiswa Kemitraan LPDP – Campus France\nProgram Master dan salah satu program Magister\nbeasiswa Afirmasi/Targeted/Umum tujuan luar\nnegeri, dengan skema berikut.\n1. Beasiswa Kemitraan LPDP – Campus France\nProgram Master:\na. Beasiswa LPDP – Campus France\nProgram Master diperuntukkan bagi\nWarga Negara Indonesia untuk dapat\nmenempuh pendidikan pada program\nmagister di program studi dan universitas\nsebagaimana daftar terlampir dengan\ndurasi pendanaan paling lama 24 (dua\npuluh empat) bulan.\nb. Pendaftar diharuskan untuk melakukan\npendaftaran pada:\n● Perguruan Tinggi Tujuan Studi\nsesuai jadwal dan ketentuan yang\nberlaku di Perguruan Tinggi, dan\n● Campus France sesuai jadwal dan\nketentuan yang berlaku di Campus\nFrance.\n2. Persyaratan dan dokumen pada Beasiswa'
 'Program Master memberikan kesempatan bagi\npendaftar untuk dapat melakukan pendaftaran\npada Beasiswa Kemitraan LPDP – Campus\nFrance dan beasiswa Magister Luar Negeri\npada salah satu program:\n1. Beasiswa Afirmasi\na. Beasiswa Daerah Afirmasi\nb. Beasiswa Putra Putri Papua\nc. Beasiswa Penyandang Disabilitas\nd. Beasiswa Prasejahtera\n2. Beasiswa Targeted\na. Beasiswa PNS, TNI, POLRI\nb. Beasiswa Kewirausahaan\nc. Beasiswa Umum\na. Beasiswa Reguler\nb. Beasiswa Parsial\nBeasiswa Kemitraan LPDP - Campus France\nmerupakan beasiswa kerja sama antara LPDP dan\nPemerintah Perancis pada jenjang master untuk\nbidang prioritas pembangunan Indonesia sesuai\ndengan keahlian pengetahuan yang dimiliki oleh\nUniversitas di Perancis dalam rangka\nmenghasilkan pemimpin masa depan Indonesia\nyang kompeten di bidang tersebut.\nSiapakah Sasaran Beasiswa Prioritas\nLPDP – Campus France Program Master?\n1. Warga Negara Indonesia (WNI)\n2. PNS/TNI/POLRI\nSeperti Apa Skema Prioritas LPDP –\nCampus France Program Master?'
 'beasiswa dengan kewajiban pengembalian\ndana studi yang telah diterima dan\npemblokiran untuk mengikuti program LPDP\ndi masa mendatang.\nBagaimana dengan ketentuan\nPengabdian yang ditetapkan LPDP?\n1. Penerima Beasiswa wajib kembali dan\nmengabdi di Indonesia setelah selesai studi\nsesuai dengan ketentuan LPDP.\n2. Kembali ke Indonesia dan berkontribusi di\nIndonesia selama 2 kali masa studi ditambah']",Kesatuan kegiatan pendidikan dan pembelajaran yang memiliki kurikulum dan metode pembelajaran tertentu,1.0,0.9999999999666667,1.0,0.8765174373549393
7,Apa saja yang termasuk dana pendidikan menurut Pasal 3 ayat (2) peraturan ini?,"Dana pendidikan menurut Pasal 3 ayat (2) peraturan ini terdiri atas:
a. UKT;
b. SPP;
c. SPI; dan
d. SPA.","['4\n\n                  BAB II \n              MAKSUD DAN TUJUAN\n\n                 Pasal 2\n(1) Peraturan Rektor ini diterbitkan dengan maksud agar setiap pemungutan dan \n  penghimpunan dana pendidikan dari Calon Mahasiswa Baru dan Mahasiswa serta \n  penggunaannya memiliki landasan hukum.\n(2) Peraturan ini diterbitkan dengan tujuan untuk menjamin transparansi pemungutan, \n  penghimpunan, dan penggunaan dana pendidikan.\n\n                 BAB III \n               RUANG LINGKUP\n\n                 Pasal 3\n(1) Peraturan Rektor ini melingkupi besaran dan mekanisme pemungutan, \n  penghimpunan, dan penggunaan dana pendidikan.\n(2) Dana pendidikan sebagaimana dimaksud pada ayat (1) terdiri atas:\n  a. UKT;\n  b. SPP;\n  c. SPI; dan\n  d. SPA.\n\n                 BAB IV \n         KEWAJIBAN PEMBAYARAN DANA PENDIDIKAN'
 'Pasal 23\n(1) Dana Pendidikan dig~an untuk:\n a. penyelenggaraan kegiatan tridharma perguruan tinggi dan pengelolaan manajemen;\n b. pengadaan sarana dan prasarana penyelenggaraan tridharma perguruan tinggi dan \n   manajemen yang meliputi:\n   1. pembangunan gedung pendidikan, Laboratorium, dan manajemen; dan\n   2. pengadaan peralatan pendidikan, laboratorium, dan manajemen;\n c. pengembangan keahlian dan keilmuan dosen dan tenaga kependidikan;\n d. pengembangan program penyelenggaraan pendidikan tinggi yang dituangkan dalam \n   dokumen perencanaan ITS.\n(2) Pengelolaan manajemen sebagaimana dimaksud pada ayat (1) huruf a terdiri atas:\n a. operasional rutin perkantoran; dan\n b. kesejahteraan pegawai mengacu pada peraturan Rektor yang mengatur tentang \n   kepegawaian dan pengelolaan kinerja.\n(3) Besaran dan mekanisme penggunaan dana pendidikan mengacu pada dokumen \n perencanaan dan dokumen pedoman pengelolaan keuangan.'
 'Rektor tentang tugas belajar dengan beasiswa.\n(2) Beasiswa yang dimaksud sebagaimana pada ayat (1) huruf c dan huruf d berupa \n  pembiayaan untuk keringanan SPP yang bersumber dari dana ITS.\n(3) Pengusulan oleh ITS sebagaimana dimaksud pada ayat (1) huruf c telah mendapat \n  rekomendasi dari Wakil Rektor yang membidangi sumber daya manusia.\n(4) Penetapan Keputusan Rektor sebagaimana dimaksud pada ayat (1) huruf d telah \n  mendapat rekomendasi dari Wakil Rektor yang membidangi sumber daya manusia'
 'Rektor tentang tugas belajar dengan beasiswa.\n(2) Beasiswa yang dimaksud sebagaimana pada ayat (1) huruf c dan huruf d berupa \n  pembiayaan untuk keringanan SPP yang bersumber dari dana ITS.\n(3) Pengusulan oleh ITS sebagaimana dimaksud pada ayat (1) huruf c telah mendapat \n  rekomendasi dari Wakil Rektor yang membidangi sumber daya manusia.\n(4) Penetapan Keputusan Rektor sebagaimana dimaksud pada ayat (1) huruf d telah \n  mendapat rekomendasi dari Wakil Rektor yang membidangi sumber daya manusia']","UKT, SPP, SPI, dan SPA",1.0,0.999999999975,1.0,0.9948546067680626
8,Berapa biaya hidup di Eropa untuk program pertukaran?,Saya tidak tahu.,"['Program Master memberikan kesempatan bagi\npendaftar untuk dapat melakukan pendaftaran\npada Beasiswa Kemitraan LPDP – Campus\nFrance dan beasiswa Magister Luar Negeri\npada salah satu program:\n1. Beasiswa Afirmasi\na. Beasiswa Daerah Afirmasi\nb. Beasiswa Putra Putri Papua\nc. Beasiswa Penyandang Disabilitas\nd. Beasiswa Prasejahtera\n2. Beasiswa Targeted\na. Beasiswa PNS, TNI, POLRI\nb. Beasiswa Kewirausahaan\nc. Beasiswa Umum\na. Beasiswa Reguler\nb. Beasiswa Parsial\nBeasiswa Kemitraan LPDP - Campus France\nmerupakan beasiswa kerja sama antara LPDP dan\nPemerintah Perancis pada jenjang master untuk\nbidang prioritas pembangunan Indonesia sesuai\ndengan keahlian pengetahuan yang dimiliki oleh\nUniversitas di Perancis dalam rangka\nmenghasilkan pemimpin masa depan Indonesia\nyang kompeten di bidang tersebut.\nSiapakah Sasaran Beasiswa Prioritas\nLPDP – Campus France Program Master?\n1. Warga Negara Indonesia (WNI)\n2. PNS/TNI/POLRI\nSeperti Apa Skema Prioritas LPDP –\nCampus France Program Master?'
 'Dipublikasikan tanggal 11 Januari 2024\nprogram beasiswa lain yang dipilih, sesuai\ndengan syarat dan ketentuan yang berlaku.\nApa saja komponen Dana yang diberikan?\n1. Dana Pendidikan\na. Tuition Fee\nb. Dana Pendaftaran\nc. Dana Tunjangan Buku\nd. Dana Penelitian Tesis\ne. Dana Seminar Internasional\nf. Dana Publikasi Jurnal Internasional\n2. Dana Pendukung\na. Dana Transportasi\nb. Dana Aplikasi Visa\nc. Dana Asuransi Kesehatan\nd. Dana Kedatangan\ne. Dana Hidup Bulanan\nf. Dana Lomba Internasional\ng. Dana keadaaan darurat (jika diperlukan)\nApa saja persyaratan umum pendaftaran\nBeasiswa Prioritas LPDP – Campus\nFrance Program Master?\nPersyaratan umum Beasiswa Prioritas LPDP –\nCampus France Program Master adalah sebagai\nberikut:\n1. Warga Negara Indonesia.\n2. Telah menyelesaikan studi program diploma\nempat (D4) atau sarjana (S1).\n3. Pendaftar yang telah menyelesaikan studi\nmagister (S2) tidak diizinkan mendaftar.\n4. Bagi pendaftar lulusan perguruan tinggi luar'
 'beasiswa dengan kewajiban pengembalian\ndana studi yang telah diterima dan\npemblokiran untuk mengikuti program LPDP\ndi masa mendatang.\nBagaimana dengan ketentuan\nPengabdian yang ditetapkan LPDP?\n1. Penerima Beasiswa wajib kembali dan\nmengabdi di Indonesia setelah selesai studi\nsesuai dengan ketentuan LPDP.\n2. Kembali ke Indonesia dan berkontribusi di\nIndonesia selama 2 kali masa studi ditambah'
 'Siapakah Sasaran Beasiswa Prioritas\nLPDP – Campus France Program Master?\n1. Warga Negara Indonesia (WNI)\n2. PNS/TNI/POLRI\nSeperti Apa Skema Prioritas LPDP –\nCampus France Program Master?\nPendaftar wajib mendaftar secara bersamaan\npada beasiswa Kemitraan LPDP – Campus France\nProgram Master dan salah satu program Magister\nbeasiswa Afirmasi/Targeted/Umum tujuan luar\nnegeri, dengan skema berikut.\n1. Beasiswa Kemitraan LPDP – Campus France\nProgram Master:\na. Beasiswa LPDP – Campus France\nProgram Master diperuntukkan bagi\nWarga Negara Indonesia untuk dapat\nmenempuh pendidikan pada program\nmagister di program studi dan universitas\nsebagaimana daftar terlampir dengan\ndurasi pendanaan paling lama 24 (dua\npuluh empat) bulan.\nb. Pendaftar diharuskan untuk melakukan\npendaftaran pada:\n● Perguruan Tinggi Tujuan Studi\nsesuai jadwal dan ketentuan yang\nberlaku di Perguruan Tinggi, dan\n● Campus France sesuai jadwal dan\nketentuan yang berlaku di Campus\nFrance.\n2. Persyaratan dan dokumen pada Beasiswa']","Biaya hidup di Eropa sekitar €7,800 per tahun dan biaya kuliah sekitar €10,140 per tahun.",1.0,0.6388888888675925,0.0,0.0
9,Apa keuntungan mengikuti program pertukaran pelajar?,Tidak ada informasi yang relevan dalam konteks yang diberikan mengenai keuntungan mengikuti program pertukaran pelajar.,"['Program Master memberikan kesempatan bagi\npendaftar untuk dapat melakukan pendaftaran\npada Beasiswa Kemitraan LPDP – Campus\nFrance dan beasiswa Magister Luar Negeri\npada salah satu program:\n1. Beasiswa Afirmasi\na. Beasiswa Daerah Afirmasi\nb. Beasiswa Putra Putri Papua\nc. Beasiswa Penyandang Disabilitas\nd. Beasiswa Prasejahtera\n2. Beasiswa Targeted\na. Beasiswa PNS, TNI, POLRI\nb. Beasiswa Kewirausahaan\nc. Beasiswa Umum\na. Beasiswa Reguler\nb. Beasiswa Parsial\nBeasiswa Kemitraan LPDP - Campus France\nmerupakan beasiswa kerja sama antara LPDP dan\nPemerintah Perancis pada jenjang master untuk\nbidang prioritas pembangunan Indonesia sesuai\ndengan keahlian pengetahuan yang dimiliki oleh\nUniversitas di Perancis dalam rangka\nmenghasilkan pemimpin masa depan Indonesia\nyang kompeten di bidang tersebut.\nSiapakah Sasaran Beasiswa Prioritas\nLPDP – Campus France Program Master?\n1. Warga Negara Indonesia (WNI)\n2. PNS/TNI/POLRI\nSeperti Apa Skema Prioritas LPDP –\nCampus France Program Master?'
 'Dipublikasikan tanggal 11 Januari 2024\nprogram beasiswa lain yang dipilih, sesuai\ndengan syarat dan ketentuan yang berlaku.\nApa saja komponen Dana yang diberikan?\n1. Dana Pendidikan\na. Tuition Fee\nb. Dana Pendaftaran\nc. Dana Tunjangan Buku\nd. Dana Penelitian Tesis\ne. Dana Seminar Internasional\nf. Dana Publikasi Jurnal Internasional\n2. Dana Pendukung\na. Dana Transportasi\nb. Dana Aplikasi Visa\nc. Dana Asuransi Kesehatan\nd. Dana Kedatangan\ne. Dana Hidup Bulanan\nf. Dana Lomba Internasional\ng. Dana keadaaan darurat (jika diperlukan)\nApa saja persyaratan umum pendaftaran\nBeasiswa Prioritas LPDP – Campus\nFrance Program Master?\nPersyaratan umum Beasiswa Prioritas LPDP –\nCampus France Program Master adalah sebagai\nberikut:\n1. Warga Negara Indonesia.\n2. Telah menyelesaikan studi program diploma\nempat (D4) atau sarjana (S1).\n3. Pendaftar yang telah menyelesaikan studi\nmagister (S2) tidak diizinkan mendaftar.\n4. Bagi pendaftar lulusan perguruan tinggi luar'
 'Pasal 6\nMahasiswa program Joint Degree/ Double Degree yang melakukan kegiatan akademik di \nperguruan tinggi mitra luar negeri, diwajibkan membayar SPP:\na. sebesar 100% (seratus persen) di ITS untuk Mahasiswa yang tidak berkewajiban \n  membayar dana pendidikan di perguruan tinggi mitra luar negeri;\nb. sebesar 10% (sepuluh persen) di ITS untuk Mahasiswa yang berkewajiban membayar \n  dana pendidikan di perguruan tinggi mitra luar negeri; dan\nc. sebesar 100% (seratus persen) di ITS untuk Mahasiswa berkegiatan akademik di \n  perguruan tinggi mitra luar negeri yang mensyaratkan pembagian pendapatan SPP \n  dengan ITS.\n\n                   Pasal 7\n(1) Mahasiswa asing membayar UKT atau SPP yang besarannya ditetapkan dengan \n  keputusan Rektor.\n(2) Mahasiswa asing dari negara berkembang dapat diberikan beasiswa dari ITS berupa \n  keringanan pembayaran UKT atau SPP yang ditetapkan dengan keputusan Rektor.'
 'Pasal 6\nMahasiswa program Joint Degree/ Double Degree yang melakukan kegiatan akademik di \nperguruan tinggi mitra luar negeri, diwajibkan membayar SPP:\na. sebesar 100% (seratus persen) di ITS untuk Mahasiswa yang tidak berkewajiban \n  membayar dana pendidikan di perguruan tinggi mitra luar negeri;\nb. sebesar 10% (sepuluh persen) di ITS untuk Mahasiswa yang berkewajiban membayar \n  dana pendidikan di perguruan tinggi mitra luar negeri; dan\nc. sebesar 100% (seratus persen) di ITS untuk Mahasiswa berkegiatan akademik di \n  perguruan tinggi mitra luar negeri yang mensyaratkan pembagian pendapatan SPP \n  dengan ITS.\n\n                   Pasal 7\n(1) Mahasiswa asing membayar UKT atau SPP yang besarannya ditetapkan dengan \n  keputusan Rektor.\n(2) Mahasiswa asing dari negara berkembang dapat diberikan beasiswa dari ITS berupa \n  keringanan pembayaran UKT atau SPP yang ditetapkan dengan keputusan Rektor.']","Keuntungan termasuk pengalaman internasional, kredit transfer, dan kemungkinan mendapat beasiswa jika berprestasi.",0.0,0.999999999975,1.0,0.0
10,Apa saja pelanggaran dan sanksi yang diberlakukan oleh LPDP?,"Pelanggaran dan sanksi yang diberlakukan oleh LPDP antara lain:
1. Pendaftar yang melanggar ketentuan dan persyaratan seleksi akan digugurkan dan tidak dapat mengikuti tahapan seleksi berikutnya.
2. Apabila pendaftar yang telah ditetapkan sebagai Calon Penerima Beasiswa atau Penerima Beasiswa di kemudian hari diketahui melanggar ketentuan dan persyaratan seleksi dan/atau tidak memenuhi pernyataan yang disampaikan pada surat pernyataan, maka akan diberikan sanksi sesuai dengan ketentuan yang berlaku di LPDP.
3. Apabila pendaftar yang telah ditetapkan sebagai Calon Penerima Beasiswa atau Penerima Beasiswa di kemudian hari diketahui memberikan informasi atau dokumen yang tidak benar atau palsu, maka akan dikenakan sanksi administratif berat berupa pemberhentian sebagai penerima beasiswa dengan kewajiban pengembalian dana studi yang telah diterima dan pemblokiran untuk mengikuti program LPDP di masa mendatang.","['beasiswa dengan kewajiban pengembalian\ndana studi yang telah diterima dan\npemblokiran untuk mengikuti program LPDP\ndi masa mendatang.\nBagaimana dengan ketentuan\nPengabdian yang ditetapkan LPDP?\n1. Penerima Beasiswa wajib kembali dan\nmengabdi di Indonesia setelah selesai studi\nsesuai dengan ketentuan LPDP.\n2. Kembali ke Indonesia dan berkontribusi di\nIndonesia selama 2 kali masa studi ditambah'
 'beasiswa dikategorikan sebagai pelanggaran\nketentuan dan persyaratan seleksi.\n2. Pendaftar yang melanggar ketentuan dan\npersyaratan seleksi akan digugurkan dan\ntidak dapat mengikuti tahapan seleksi\nberikutnya.\n3. Apabila pendaftar yang telah ditetapkan\nsebagai Calon Penerima Beasiswa atau\nPenerima Beasiswa di kemudian hari\ndiketahui melanggar ketentuan dan\npersyaratan seleksi dan/atau tidak memenuhi\npernyataan yang disampaikan pada surat\npernyataan, maka akan diberikan sanksi\nsesuai dengan ketentuan yang berlaku di\nLPDP.\n4. Apabila pendaftar yang telah ditetapkan\nsebagai Calon Penerima Beasiswa atau\nPenerima Beasiswa di kemudian hari\ndiketahui memberikan informasi atau\ndokumen yang tidak benar atau palsu, maka\nakan dikenakan sanksi administratif berat\nberupa pemberhentian sebagai penerima\nbeasiswa dengan kewajiban pengembalian\ndana studi yang telah diterima dan\npemblokiran untuk mengikuti program LPDP\ndi masa mendatang.\nBagaimana dengan ketentuan\nPengabdian yang ditetapkan LPDP?'
 'kemitraan/kerja sama beasiswa prioritas, maka tidak dapat berpindah program studi, perguruan\ntinggi, dan/atau program Beasiswa LPDP lainnya, atau kelulusan akan dibatalkan.\nDemikian surat pernyataan ini dibuat dengan sebenar-benarnya untuk dapat digunakan sebagaimana\nmestinya. Apabila saya melanggar dan tidak mematuhi surat pernyataan ini, saya bersedia menerima\nsanksi sesuai ketentuan yang berlaku.'
 'Siapakah Sasaran Beasiswa Prioritas\nLPDP – Campus France Program Master?\n1. Warga Negara Indonesia (WNI)\n2. PNS/TNI/POLRI\nSeperti Apa Skema Prioritas LPDP –\nCampus France Program Master?\nPendaftar wajib mendaftar secara bersamaan\npada beasiswa Kemitraan LPDP – Campus France\nProgram Master dan salah satu program Magister\nbeasiswa Afirmasi/Targeted/Umum tujuan luar\nnegeri, dengan skema berikut.\n1. Beasiswa Kemitraan LPDP – Campus France\nProgram Master:\na. Beasiswa LPDP – Campus France\nProgram Master diperuntukkan bagi\nWarga Negara Indonesia untuk dapat\nmenempuh pendidikan pada program\nmagister di program studi dan universitas\nsebagaimana daftar terlampir dengan\ndurasi pendanaan paling lama 24 (dua\npuluh empat) bulan.\nb. Pendaftar diharuskan untuk melakukan\npendaftaran pada:\n● Perguruan Tinggi Tujuan Studi\nsesuai jadwal dan ketentuan yang\nberlaku di Perguruan Tinggi, dan\n● Campus France sesuai jadwal dan\nketentuan yang berlaku di Campus\nFrance.\n2. Persyaratan dan dokumen pada Beasiswa']","Pelanggaran meliputi kecurangan selama pendaftaran atau seleksi, memberikan informasi atau dokumen palsu. Sanksi termasuk pembatalan beasiswa dan pengembalian dana studi.",0.3333333333333333,0.999999999975,1.0,0.879323520864579
11,Apa ketentuan pengabdian yang ditetapkan LPDP?,Ketentuan pengabdian yang ditetapkan LPDP adalah penerima beasiswa wajib kembali dan mengabdi di Indonesia setelah selesai studi sesuai dengan ketentuan LPDP. Mereka harus kembali ke Indonesia dan berkontribusi di Indonesia selama 2 kali masa studi ditambah.,"['beasiswa dengan kewajiban pengembalian\ndana studi yang telah diterima dan\npemblokiran untuk mengikuti program LPDP\ndi masa mendatang.\nBagaimana dengan ketentuan\nPengabdian yang ditetapkan LPDP?\n1. Penerima Beasiswa wajib kembali dan\nmengabdi di Indonesia setelah selesai studi\nsesuai dengan ketentuan LPDP.\n2. Kembali ke Indonesia dan berkontribusi di\nIndonesia selama 2 kali masa studi ditambah'
 'kejuaraan/non kejuaraan, dan pengalaman\norganisasi pada aplikasi pendaftaran.\nApa saja persyaratan khusus pendaftaran\nBeasiswa Prioritas LPDP – Campus France\nProgram Master?\nPersyaratan khusus Beasiswa Kemitraan LPDP –\nCampus France Program Master adalah sebagai\nberikut:'
 'Program Master memberikan kesempatan bagi\npendaftar untuk dapat melakukan pendaftaran\npada Beasiswa Kemitraan LPDP – Campus\nFrance dan beasiswa Magister Luar Negeri\npada salah satu program:\n1. Beasiswa Afirmasi\na. Beasiswa Daerah Afirmasi\nb. Beasiswa Putra Putri Papua\nc. Beasiswa Penyandang Disabilitas\nd. Beasiswa Prasejahtera\n2. Beasiswa Targeted\na. Beasiswa PNS, TNI, POLRI\nb. Beasiswa Kewirausahaan\nc. Beasiswa Umum\na. Beasiswa Reguler\nb. Beasiswa Parsial\nBeasiswa Kemitraan LPDP - Campus France\nmerupakan beasiswa kerja sama antara LPDP dan\nPemerintah Perancis pada jenjang master untuk\nbidang prioritas pembangunan Indonesia sesuai\ndengan keahlian pengetahuan yang dimiliki oleh\nUniversitas di Perancis dalam rangka\nmenghasilkan pemimpin masa depan Indonesia\nyang kompeten di bidang tersebut.\nSiapakah Sasaran Beasiswa Prioritas\nLPDP – Campus France Program Master?\n1. Warga Negara Indonesia (WNI)\n2. PNS/TNI/POLRI\nSeperti Apa Skema Prioritas LPDP –\nCampus France Program Master?'
 'Siapakah Sasaran Beasiswa Prioritas\nLPDP – Campus France Program Master?\n1. Warga Negara Indonesia (WNI)\n2. PNS/TNI/POLRI\nSeperti Apa Skema Prioritas LPDP –\nCampus France Program Master?\nPendaftar wajib mendaftar secara bersamaan\npada beasiswa Kemitraan LPDP – Campus France\nProgram Master dan salah satu program Magister\nbeasiswa Afirmasi/Targeted/Umum tujuan luar\nnegeri, dengan skema berikut.\n1. Beasiswa Kemitraan LPDP – Campus France\nProgram Master:\na. Beasiswa LPDP – Campus France\nProgram Master diperuntukkan bagi\nWarga Negara Indonesia untuk dapat\nmenempuh pendidikan pada program\nmagister di program studi dan universitas\nsebagaimana daftar terlampir dengan\ndurasi pendanaan paling lama 24 (dua\npuluh empat) bulan.\nb. Pendaftar diharuskan untuk melakukan\npendaftaran pada:\n● Perguruan Tinggi Tujuan Studi\nsesuai jadwal dan ketentuan yang\nberlaku di Perguruan Tinggi, dan\n● Campus France sesuai jadwal dan\nketentuan yang berlaku di Campus\nFrance.\n2. Persyaratan dan dokumen pada Beasiswa']",Penerima Beasiswa wajib kembali dan mengabdi di Indonesia selama dua kali masa studi ditambah satu tahun setelah selesai studi.,1.0,0.999999999975,0.75,0.9815226644052961
12,Mahasiswa dari jalur apa yang diperkenankan mengajukan permohonan?,Mahasiswa dari jalur seleksi mandiri prestasi diperkenankan untuk mengajukan permohonan.,"['Siapakah Sasaran Beasiswa Prioritas\nLPDP – Campus France Program Master?\n1. Warga Negara Indonesia (WNI)\n2. PNS/TNI/POLRI\nSeperti Apa Skema Prioritas LPDP –\nCampus France Program Master?\nPendaftar wajib mendaftar secara bersamaan\npada beasiswa Kemitraan LPDP – Campus France\nProgram Master dan salah satu program Magister\nbeasiswa Afirmasi/Targeted/Umum tujuan luar\nnegeri, dengan skema berikut.\n1. Beasiswa Kemitraan LPDP – Campus France\nProgram Master:\na. Beasiswa LPDP – Campus France\nProgram Master diperuntukkan bagi\nWarga Negara Indonesia untuk dapat\nmenempuh pendidikan pada program\nmagister di program studi dan universitas\nsebagaimana daftar terlampir dengan\ndurasi pendanaan paling lama 24 (dua\npuluh empat) bulan.\nb. Pendaftar diharuskan untuk melakukan\npendaftaran pada:\n● Perguruan Tinggi Tujuan Studi\nsesuai jadwal dan ketentuan yang\nberlaku di Perguruan Tinggi, dan\n● Campus France sesuai jadwal dan\nketentuan yang berlaku di Campus\nFrance.\n2. Persyaratan dan dokumen pada Beasiswa'
 'Dipublikasikan tanggal 11 Januari 2024\nprogram beasiswa lain yang dipilih, sesuai\ndengan syarat dan ketentuan yang berlaku.\nApa saja komponen Dana yang diberikan?\n1. Dana Pendidikan\na. Tuition Fee\nb. Dana Pendaftaran\nc. Dana Tunjangan Buku\nd. Dana Penelitian Tesis\ne. Dana Seminar Internasional\nf. Dana Publikasi Jurnal Internasional\n2. Dana Pendukung\na. Dana Transportasi\nb. Dana Aplikasi Visa\nc. Dana Asuransi Kesehatan\nd. Dana Kedatangan\ne. Dana Hidup Bulanan\nf. Dana Lomba Internasional\ng. Dana keadaaan darurat (jika diperlukan)\nApa saja persyaratan umum pendaftaran\nBeasiswa Prioritas LPDP – Campus\nFrance Program Master?\nPersyaratan umum Beasiswa Prioritas LPDP –\nCampus France Program Master adalah sebagai\nberikut:\n1. Warga Negara Indonesia.\n2. Telah menyelesaikan studi program diploma\nempat (D4) atau sarjana (S1).\n3. Pendaftar yang telah menyelesaikan studi\nmagister (S2) tidak diizinkan mendaftar.\n4. Bagi pendaftar lulusan perguruan tinggi luar'
 'Program Master memberikan kesempatan bagi\npendaftar untuk dapat melakukan pendaftaran\npada Beasiswa Kemitraan LPDP – Campus\nFrance dan beasiswa Magister Luar Negeri\npada salah satu program:\n1. Beasiswa Afirmasi\na. Beasiswa Daerah Afirmasi\nb. Beasiswa Putra Putri Papua\nc. Beasiswa Penyandang Disabilitas\nd. Beasiswa Prasejahtera\n2. Beasiswa Targeted\na. Beasiswa PNS, TNI, POLRI\nb. Beasiswa Kewirausahaan\nc. Beasiswa Umum\na. Beasiswa Reguler\nb. Beasiswa Parsial\nBeasiswa Kemitraan LPDP - Campus France\nmerupakan beasiswa kerja sama antara LPDP dan\nPemerintah Perancis pada jenjang master untuk\nbidang prioritas pembangunan Indonesia sesuai\ndengan keahlian pengetahuan yang dimiliki oleh\nUniversitas di Perancis dalam rangka\nmenghasilkan pemimpin masa depan Indonesia\nyang kompeten di bidang tersebut.\nSiapakah Sasaran Beasiswa Prioritas\nLPDP – Campus France Program Master?\n1. Warga Negara Indonesia (WNI)\n2. PNS/TNI/POLRI\nSeperti Apa Skema Prioritas LPDP –\nCampus France Program Master?'
 '11\n                  BAB VI \n   KEWAJIBAN PEMBAYARAN SUMBANGAN PENGEMBANGAN INSTITUSI (SPI)\n\n                  Pasal 21\n(1) Semua calon Mahasiswa Baru program sarjana/ sarjana terapan yang diterima melalui \n  jalur mandiri dan program sarjana/sarjana terapan/pascasarjana/pascasarjana \n  terapan jalur kerjasama diwajibkan membayar SPI.\n(2) Jalur mandiri sebagaimana dimaksud pada ayat (1) dikecualikan untuk jalur seleksi \n  mandiri prestasi\n(3) Semua calon Mahasiswa Baru sebagaimana dimaksud pada ayat (1) dan ayat (2) yang \n  tidak memenuhi kewajiban sebagaimana yang dimaksud pada ayat (1) sampai batas \n  waktu registrasi yang ditentukan, dianggap mengundurkan diri.\n\n                  BAB VII \n   KEWAJIBAN PEMBAYARAN SUMBANGAN PENGEMBANGAN AKADEMIK (SPA)']",Mahasiswa sarjana dan vokasi (selain mahasiswa IUP dan Joint Degree),1.0,0.999999999975,0.839285041419121,0.0
13,Melalui aplikasi apa mahasiswa dapat mengajukan permohonan keringanan UKT?,Mahasiswa dapat mengajukan permohonan keringanan UKT melalui aplikasi SIPMABA melalui portal.its.ac.id.,"['UKT. Selanjutnya mahasiswa dapat mengisi kelengkapan dokumen yang diperlukan untuk proses pengajuan keringanan.\nApabila menemui kendala di dalam proses pengisian data, mahasiswa dapat bertanya via whatsapp messanger ke\nnomor 081231223994.\n3. Timeline pengisian adalah sebagaimana berikut :\n01–17 Desember 2023 : Pengajuan keringanan UKT/SPP di aplikasi sipmaba melalui portal.its.ac.id\noleh mahasiswa\n18 – 24 Desember 2023 : Pengecekan/verifikasi oleh Verifikator Banding UKT/SPP\n27 - 29 Desember 2023 : Evaluasi oleh Subdit Perencanaan Anggaran\n02 – 05 Januari 2024 : Sinkronisasi data tagihan UKT dengan Biro Keuangan\n08 Januari 2024 : Pengumuman hasil Banding UKT/SPP\n10 – 31 Januari 2024 : Masa pembayaran UKT/SPP semester genap 2023/2024\n4. Pada pengajuan keringanan UKT, mahasiswa harus melakukan update data dan berkas di aplikasi SIPMABA pada\nmenu pendukung (supported) dan upload berkas (upload file). Data dan berkas pendukung yang harus diupload\ndi pada sistem adalah:'
 'UKT. Selanjutnya mahasiswa dapat mengisi kelengkapan dokumen yang diperlukan untuk proses pengajuan keringanan.\r\nApabila menemui kendala di dalam proses pengisian data, mahasiswa dapat bertanya via whatsapp messanger ke\r\nnomor 081231223994.\r\n3. Timeline pengisian adalah sebagaimana berikut :\r\n01–17 Desember 2023 : Pengajuan keringanan UKT/SPP di aplikasi sipmaba melalui portal.its.ac.id\r\noleh mahasiswa\r\n18 – 24 Desember 2023 : Pengecekan/verifikasi oleh Verifikator Banding UKT/SPP\r\n27 - 29 Desember 2023 : Evaluasi oleh Subdit Perencanaan Anggaran\r\n02 – 05 Januari 2024 : Sinkronisasi data tagihan UKT dengan Biro Keuangan\r\n08 Januari 2024 : Pengumuman hasil Banding UKT/SPP\r\n10 – 31 Januari 2024 : Masa pembayaran UKT/SPP semester genap 2023/2024\r\n4. Pada pengajuan keringanan UKT, mahasiswa harus melakukan update data dan berkas di aplikasi SIPMABA pada\r\nmenu pendukung (supported) dan upload berkas (upload file). Data dan berkas pendukung yang harus diupload\r\ndi pada sistem adalah:'
 'Pasal 11\n(1) ITS dapat membebaskan pembayaran UKT atau SPP bagi Mahasiswa yang memenuhi \n  persyaratan sebagai berikut:\n  a. Mahasiswa yang mendapat penghargaan karena membawa nama baik ITS pada \n   tingkat nasional atau internasional dengan kriteria tertentu, mendapat pembebasan \n   selama 1 (satu) semester;\n  b. Mahasiswa program magister yang mendapatkan beasiswa fresh graduate, \n   mendapat pembebasan selama 4 (empat) semester;\n  c. Mahasiswa program magister yang mendapatkan beasiswa fast track, mendapatkan \n   pembebasan selama 2 (dua) semester pada jenjang magister apabila memenuhi \n   persyaratan program beasiswa fast track;\n  d. Mahasiswa yang mendapatkan izin cuti studi sebelum masa pembayaran UKT atau \n   SPP berakhir;\n  e. Mahasiswa yang mendapatkan beasiswa Kartu Indonesia Pintar - Kuliah (KIP-K) \n   pada semester 1X dan X untuk program sarjana atau program sarjana terapan;'
 'Pasal 11\n(1) ITS dapat membebaskan pembayaran UKT atau SPP bagi Mahasiswa yang memenuhi \n  persyaratan sebagai berikut:\n  a. Mahasiswa yang mendapat penghargaan karena membawa nama baik ITS pada \n   tingkat nasional atau internasional dengan kriteria tertentu, mendapat pembebasan \n   selama 1 (satu) semester;\n  b. Mahasiswa program magister yang mendapatkan beasiswa fresh graduate, \n   mendapat pembebasan selama 4 (empat) semester;\n  c. Mahasiswa program magister yang mendapatkan beasiswa fast track, mendapatkan \n   pembebasan selama 2 (dua) semester pada jenjang magister apabila memenuhi \n   persyaratan program beasiswa fast track;\n  d. Mahasiswa yang mendapatkan izin cuti studi sebelum masa pembayaran UKT atau \n   SPP berakhir;\n  e. Mahasiswa yang mendapatkan beasiswa Kartu Indonesia Pintar - Kuliah (KIP-K) \n   pada semester 1X dan X untuk program sarjana atau program sarjana terapan;']",myITS Portal atau portal.its.ac.id dengan aplikasi layanan SIPMABA,0.999999999975,1.0,0.9623416928955919,0.0
14,Data dan berkas pendukung apa yang harus diupload untuk pengajuan keringanan UKT?,"Untuk pengajuan keringanan UKT, data dan berkas pendukung yang harus diupload adalah sebagai berikut:
1. Surat permohonan kepada Wakil Rektor II yang disertai alasan mengajukan keringanan UKT (format bebas)
2. Bukti/data dukung alasan mengajukan keringanan UKT (bukti dijadikan 1 file dengan surat permohonan keringanan UKT)
3. Surat keterangan pekerjaan orang tua (ayah dan ibu) terbaru
4. Surat keterangan penghasilan orang tua (ayah dan ibu) terbaru
5. SPT Tahunan orang tua (ayah dan ibu) terbaru
6. Foto usaha pekerjaan orang tua (ayah dan ibu) terbaru (untuk jenis pekerjaan pedagang/pengusaha)
7. Tagihan listrik (bukti pembayaran listrik) terbaru
8. PBB terbaru
9. Kartu Keluarga (KK) terbaru
10. Pajak kendaraan roda 2 dan 4 terbaru
11. Foto rumah (tampak depan, ruang tamu, 2 kamar tidur, dan tampak belakang/dapur/kamar mandi)

Semua berkas tersebut harus diupload pada sistem untuk proses pengajuan keringanan UKT.","['menu pendukung (supported) dan upload berkas (upload file). Data dan berkas pendukung yang harus diupload\r\ndi pada sistem adalah:\r\nSurat permohonan kepada Wakil Rektor II yang disertai alasan mengajukan keringanan UKT (format bebas)\r\nBukti/data dukung alasan mengajukan keringanan UKT (bukti dijadikan 1 file dengan surat permohonan keringanan\r\nUKT). Misalnya, apabila orang tua sakit, maka data dukung yang dilampirkan berupa surat keterangan yang\r\ndikeluarkan dari Rumah Sakit/dokter yang menangani penyakit tersebut.\r\nSurat keterangan pekerjaan orang tua (ayah dan ibu) terbaru\r\nSurat keterangan penghasilan orang tua (ayah dan ibu) terbaru\r\nSPT Tahunan orang tua (ayah dan ibu) terbaru\r\nFoto usaha pekerjaan orang tua (ayah dan ibu) terbaru (untuk jenis pekerjaan pedangang/pengusaha)\r\nTagihan listrik (bukti pembayaran listrik) terbaru\r\nPBB terbaru\r\nKartu keluarga (KK) terbaru\r\nPajak kendaraan roda 2 dan 4 terbaru'
 'menu pendukung (supported) dan upload berkas (upload file). Data dan berkas pendukung yang harus diupload\ndi pada sistem adalah:\nSurat permohonan kepada Wakil Rektor II yang disertai alasan mengajukan keringanan UKT (format bebas)\nBukti/data dukung alasan mengajukan keringanan UKT (bukti dijadikan 1 file dengan surat permohonan keringanan\nUKT). Misalnya, apabila orang tua sakit, maka data dukung yang dilampirkan berupa surat keterangan yang\ndikeluarkan dari Rumah Sakit/dokter yang menangani penyakit tersebut.\nSurat keterangan pekerjaan orang tua (ayah dan ibu) terbaru\nSurat keterangan penghasilan orang tua (ayah dan ibu) terbaru\nSPT Tahunan orang tua (ayah dan ibu) terbaru\nFoto usaha pekerjaan orang tua (ayah dan ibu) terbaru (untuk jenis pekerjaan pedangang/pengusaha)\nTagihan listrik (bukti pembayaran listrik) terbaru\nPBB terbaru\nKartu keluarga (KK) terbaru\nPajak kendaraan roda 2 dan 4 terbaru\nFoto rumah (tampak depan, ruang tamu, 2 kamar tidur dan tampak belakang/dapur/kamar mandi)'
 'UKT. Selanjutnya mahasiswa dapat mengisi kelengkapan dokumen yang diperlukan untuk proses pengajuan keringanan.\nApabila menemui kendala di dalam proses pengisian data, mahasiswa dapat bertanya via whatsapp messanger ke\nnomor 081231223994.\n3. Timeline pengisian adalah sebagaimana berikut :\n01–17 Desember 2023 : Pengajuan keringanan UKT/SPP di aplikasi sipmaba melalui portal.its.ac.id\noleh mahasiswa\n18 – 24 Desember 2023 : Pengecekan/verifikasi oleh Verifikator Banding UKT/SPP\n27 - 29 Desember 2023 : Evaluasi oleh Subdit Perencanaan Anggaran\n02 – 05 Januari 2024 : Sinkronisasi data tagihan UKT dengan Biro Keuangan\n08 Januari 2024 : Pengumuman hasil Banding UKT/SPP\n10 – 31 Januari 2024 : Masa pembayaran UKT/SPP semester genap 2023/2024\n4. Pada pengajuan keringanan UKT, mahasiswa harus melakukan update data dan berkas di aplikasi SIPMABA pada\nmenu pendukung (supported) dan upload berkas (upload file). Data dan berkas pendukung yang harus diupload\ndi pada sistem adalah:'
 'UKT. Selanjutnya mahasiswa dapat mengisi kelengkapan dokumen yang diperlukan untuk proses pengajuan keringanan.\r\nApabila menemui kendala di dalam proses pengisian data, mahasiswa dapat bertanya via whatsapp messanger ke\r\nnomor 081231223994.\r\n3. Timeline pengisian adalah sebagaimana berikut :\r\n01–17 Desember 2023 : Pengajuan keringanan UKT/SPP di aplikasi sipmaba melalui portal.its.ac.id\r\noleh mahasiswa\r\n18 – 24 Desember 2023 : Pengecekan/verifikasi oleh Verifikator Banding UKT/SPP\r\n27 - 29 Desember 2023 : Evaluasi oleh Subdit Perencanaan Anggaran\r\n02 – 05 Januari 2024 : Sinkronisasi data tagihan UKT dengan Biro Keuangan\r\n08 Januari 2024 : Pengumuman hasil Banding UKT/SPP\r\n10 – 31 Januari 2024 : Masa pembayaran UKT/SPP semester genap 2023/2024\r\n4. Pada pengajuan keringanan UKT, mahasiswa harus melakukan update data dan berkas di aplikasi SIPMABA pada\r\nmenu pendukung (supported) dan upload berkas (upload file). Data dan berkas pendukung yang harus diupload\r\ndi pada sistem adalah:']","Surat permohonan, bukti dukung, surat keterangan pekerjaan, surat keterangan penghasilan, SPT, foto usaha, tagihan listrik, PBB, kartu keluarga, pajak kendaraan, foto rumah",0.999999999975,1.0,0.9770461063709571,1.0
15,Apa yang harus disertakan jika alasan permohonan keringanan adalah orang tua pensiun?,"Jika alasan permohonan keringanan adalah orang tua pensiun, maka yang harus disertakan adalah surat keterangan/surat keputusan (termasuk gaji pensiun atau pesangon) yang dikeluarkan oleh pemberi kerja. Berkas tersebut dapat diupload pada bagian pekerjaan, penghasilan, atau SPT.","['PBB terbaru\nKartu keluarga (KK) terbaru\nPajak kendaraan roda 2 dan 4 terbaru\nFoto rumah (tampak depan, ruang tamu, 2 kamar tidur dan tampak belakang/dapur/kamar mandi)\nCatatan:\n1. Apabila alasan permohonan keringanan dikarenakan orang tua pensiun, maka data dukung yang perlu dilampirkan\nberupa surat keterangan/surat keputusan (termasuk gaji pensiun atau pesangon) yang dikeluarkan oleh pemberi kerja.\nBerkas tersebut dapat diupload pada bagian pekerjaan, penghasilan atau SPT.\n2. Apabila orang tua meninggal dunia, maka data dukung yang dilampirkan berupa surat kematian/akte kematian. Berkas\ntersebut dapat diupload pada bagian pekerjaan, penghasilan atau SPT.\n3. Apabila ada data dukung yang tidak tersedia tempatnya untuk mengupload, maka data dukung dapat digabungkan\ndengan surat permohonan banding UKT/SPP dengan cara dikolase.\n4. Bagi mahasiswa Jalur Mandiri Kemitraan, data penghasilan orang tua (ayah dan ibu) yang dimasukkan adalah jumlah\ntotal per tahun'
 'Tagihan listrik (bukti pembayaran listrik) terbaru\r\nPBB terbaru\r\nKartu keluarga (KK) terbaru\r\nPajak kendaraan roda 2 dan 4 terbaru\r\nFoto rumah (tampak depan, ruang tamu, 2 kamar tidur dan tampak belakang/dapur/kamar mandi)\r\nCatatan:\r\n1. Apabila alasan permohonan keringanan dikarenakan orang tua pensiun, maka data dukung yang perlu dilampirkan\r\nberupa surat keterangan/surat keputusan (termasuk gaji pensiun atau pesangon) yang dikeluarkan oleh pemberi kerja.\r\nBerkas tersebut dapat diupload pada bagian pekerjaan, penghasilan atau SPT.\r\n2. Apabila orang tua meninggal dunia, maka data dukung yang dilampirkan berupa surat kematian/akte kematian. Berkas\r\ntersebut dapat diupload pada bagian pekerjaan, penghasilan atau SPT.\r\n3. Apabila ada data dukung yang tidak tersedia tempatnya untuk mengupload, maka data dukung dapat digabungkan\r\ndengan surat permohonan banding UKT/SPP dengan cara dikolase.'
 'menu pendukung (supported) dan upload berkas (upload file). Data dan berkas pendukung yang harus diupload\r\ndi pada sistem adalah:\r\nSurat permohonan kepada Wakil Rektor II yang disertai alasan mengajukan keringanan UKT (format bebas)\r\nBukti/data dukung alasan mengajukan keringanan UKT (bukti dijadikan 1 file dengan surat permohonan keringanan\r\nUKT). Misalnya, apabila orang tua sakit, maka data dukung yang dilampirkan berupa surat keterangan yang\r\ndikeluarkan dari Rumah Sakit/dokter yang menangani penyakit tersebut.\r\nSurat keterangan pekerjaan orang tua (ayah dan ibu) terbaru\r\nSurat keterangan penghasilan orang tua (ayah dan ibu) terbaru\r\nSPT Tahunan orang tua (ayah dan ibu) terbaru\r\nFoto usaha pekerjaan orang tua (ayah dan ibu) terbaru (untuk jenis pekerjaan pedangang/pengusaha)\r\nTagihan listrik (bukti pembayaran listrik) terbaru\r\nPBB terbaru\r\nKartu keluarga (KK) terbaru\r\nPajak kendaraan roda 2 dan 4 terbaru'
 'menu pendukung (supported) dan upload berkas (upload file). Data dan berkas pendukung yang harus diupload\ndi pada sistem adalah:\nSurat permohonan kepada Wakil Rektor II yang disertai alasan mengajukan keringanan UKT (format bebas)\nBukti/data dukung alasan mengajukan keringanan UKT (bukti dijadikan 1 file dengan surat permohonan keringanan\nUKT). Misalnya, apabila orang tua sakit, maka data dukung yang dilampirkan berupa surat keterangan yang\ndikeluarkan dari Rumah Sakit/dokter yang menangani penyakit tersebut.\nSurat keterangan pekerjaan orang tua (ayah dan ibu) terbaru\nSurat keterangan penghasilan orang tua (ayah dan ibu) terbaru\nSPT Tahunan orang tua (ayah dan ibu) terbaru\nFoto usaha pekerjaan orang tua (ayah dan ibu) terbaru (untuk jenis pekerjaan pedangang/pengusaha)\nTagihan listrik (bukti pembayaran listrik) terbaru\nPBB terbaru\nKartu keluarga (KK) terbaru\nPajak kendaraan roda 2 dan 4 terbaru\nFoto rumah (tampak depan, ruang tamu, 2 kamar tidur dan tampak belakang/dapur/kamar mandi)']",Surat keterangan/surat keputusan termasuk gaji pensiun atau pesangon,0.9999999999666667,1.0,0.9861472515015212,1.0
16,Dimana saya bisa mengajukan permohonan keringanan UKT?,"Anda bisa mengajukan permohonan keringanan UKT melalui aplikasi SIPMABA melalui portal.its.ac.id pada rentang waktu 01-17 Desember 2023. Jika Anda menemui kendala dalam proses pengisian data, Anda dapat bertanya melalui whatsapp messenger ke nomor 081231223994.","['3. Apabila ada data dukung yang tidak tersedia tempatnya untuk mengupload, maka data dukung dapat digabungkan\r\ndengan surat permohonan banding UKT/SPP dengan cara dikolase.\r\n4. Bagi mahasiswa Jalur Mandiri Kemitraan, data penghasilan orang tua (ayah dan ibu) yang dimasukkan adalah jumlah\r\ntotal per tahun\r\n5. Bagi mahasiswa jalur reguler, data penghasilan orang tua (ayah dan ibu) yang dimasukkan adalah jumlah total per\r\nbulan.\r\nSurabaya, 16 Nopember 2023\r\nDirektur Perencanaan dan Pengembangan,\r\nDr. Ir. Suwadi M.T.\r\n196808181993031002\r\nPowered by TCPDF (www.tcpdf.org)'
 'UKT. Selanjutnya mahasiswa dapat mengisi kelengkapan dokumen yang diperlukan untuk proses pengajuan keringanan.\nApabila menemui kendala di dalam proses pengisian data, mahasiswa dapat bertanya via whatsapp messanger ke\nnomor 081231223994.\n3. Timeline pengisian adalah sebagaimana berikut :\n01–17 Desember 2023 : Pengajuan keringanan UKT/SPP di aplikasi sipmaba melalui portal.its.ac.id\noleh mahasiswa\n18 – 24 Desember 2023 : Pengecekan/verifikasi oleh Verifikator Banding UKT/SPP\n27 - 29 Desember 2023 : Evaluasi oleh Subdit Perencanaan Anggaran\n02 – 05 Januari 2024 : Sinkronisasi data tagihan UKT dengan Biro Keuangan\n08 Januari 2024 : Pengumuman hasil Banding UKT/SPP\n10 – 31 Januari 2024 : Masa pembayaran UKT/SPP semester genap 2023/2024\n4. Pada pengajuan keringanan UKT, mahasiswa harus melakukan update data dan berkas di aplikasi SIPMABA pada\nmenu pendukung (supported) dan upload berkas (upload file). Data dan berkas pendukung yang harus diupload\ndi pada sistem adalah:'
 'UKT. Selanjutnya mahasiswa dapat mengisi kelengkapan dokumen yang diperlukan untuk proses pengajuan keringanan.\r\nApabila menemui kendala di dalam proses pengisian data, mahasiswa dapat bertanya via whatsapp messanger ke\r\nnomor 081231223994.\r\n3. Timeline pengisian adalah sebagaimana berikut :\r\n01–17 Desember 2023 : Pengajuan keringanan UKT/SPP di aplikasi sipmaba melalui portal.its.ac.id\r\noleh mahasiswa\r\n18 – 24 Desember 2023 : Pengecekan/verifikasi oleh Verifikator Banding UKT/SPP\r\n27 - 29 Desember 2023 : Evaluasi oleh Subdit Perencanaan Anggaran\r\n02 – 05 Januari 2024 : Sinkronisasi data tagihan UKT dengan Biro Keuangan\r\n08 Januari 2024 : Pengumuman hasil Banding UKT/SPP\r\n10 – 31 Januari 2024 : Masa pembayaran UKT/SPP semester genap 2023/2024\r\n4. Pada pengajuan keringanan UKT, mahasiswa harus melakukan update data dan berkas di aplikasi SIPMABA pada\r\nmenu pendukung (supported) dan upload berkas (upload file). Data dan berkas pendukung yang harus diupload\r\ndi pada sistem adalah:'
 'Pasal 20\n(1) Mahasiswa dapat melakukan penarikan UKT atau SPP sebesar 80% (delapan puluh \n  persen), apabila Mahasiswa mendapatkan izin cuti studi paling lambat minggu ke 4 \n  (empat) masa perkuliahan.\n(2) Mahasiswa yang mendapatkan izin cuti setelah kegiatan perkuliahan berjalan lebih \n  dari 4 (empat) minggu, maka dana pendidikan yang telah dibayarkan tidak dapat \n  ditarik kembali.\n(3) Penarikan UKT atau SPP sebesar 100% (seratus persen) dapat diberikan apabila:\n  a. Mahasiswa tersebut diberhentikan dengan keputusan Rektor;\n  b. Mahasiswa tersebut mendapatkan izin cuti studi sebelum masa pembayaran UKT \n   atau SPP berakhir; atau\n  c. Mahasiswa tersebut mendapatkan izin cuti sakit yang diakibatkan oleh peristiwa \n   yang menyebabkan Mahasiswa tersebut tidak dapat mengikuti perkuliahan \n   sekurang-kurangnya 2 (dua) minggu secara bertur-ut-turut, dibuktikan dengan \n   surat keterangan dokter dan rekomendasi kepala departemen.']",Permohonan keringanan UKT dapat diajukan melalui SIPMABA di portal.its.ac.id.,0.999999999975,1.0,0.9635642987129426,1.0
17,Kapan pengajuan keringanan UKT/SPP dapat dilakukan?,Pengajuan keringanan UKT/SPP dapat dilakukan melalui sipmaba.its.ac.id pada saat periode pengajuan. Mahasiswa yang dapat mengajukan keringanan UKT/SPP adalah mahasiswa sarjana dan mahasiswa vokasi/sarjana terapan (selain mahasiswa IUP dan Joint Degree) yang minimal akan memasuki semester 2 (dua).,"['KEMENTERIAN PENDIDIKAN, KEBUDAYAAN,\nRISET, DAN TEKNOLOGI\nINSTITUT TEKNOLOGI SEPULUH NOPEMBER\nDIREKTORAT PERENCANAAN DAN PENGEMBANGAN\nKampus ITS Sukolilo Surabaya 60111\nTelepon: 031-5939632, PABX 1292, 1006, 1010, 1007, 1111\nFax: 031-5939632\nemail: tu_dpal@its.ac.id\nSurat Pengumuman\nNomor : 7244/IT2.II.1/B/TU.00.02/2023\nPENGUMUMAN PERIHAL PERMOHONAN KERINGANAN UKT/SPP\nSEMESTER GENAP 2023/2024\nDitujukan kepada Mahasiswa ITS Program Sarjana dan Sarjana Terapan.\nBagi mahasiswa ITS yang berencana melakukan permohonan keringanan UKT/SPP, maka diharapkan dapat memperhatikan\nbeberapa hal sebagaimana berikut:\n1. Permohonan Keringanan UKT/SPP dapat dilakukan melalui sipmaba.its.ac.id, di mana hanya diperkenankan untuk\nmahasiswa sarjana dan mahasiswa vokasi / sarjana terapan (selain mahasiswa IUP dan Joint Degree). Pada saat\nperiode pengajuan, Mahasiswa yang dimaksud disyaratkan saat ini minimal akan memasuki semester 2 (dua)'
 'KEMENTERIAN PENDIDIKAN, KEBUDAYAAN,\r\nRISET, DAN TEKNOLOGI\r\nINSTITUT TEKNOLOGI SEPULUH NOPEMBER\r\nDIREKTORAT PERENCANAAN DAN PENGEMBANGAN\r\nKampus ITS Sukolilo Surabaya 60111\r\nTelepon: 031-5939632, PABX 1292, 1006, 1010, 1007, 1111\r\nFax: 031-5939632\r\nemail: tu_dpal@its.ac.id\r\nSurat Pengumuman\r\nNomor : 7244/IT2.II.1/B/TU.00.02/2023\r\nPENGUMUMAN PERIHAL PERMOHONAN KERINGANAN UKT/SPP\r\nSEMESTER GENAP 2023/2024\r\nDitujukan kepada Mahasiswa ITS Program Sarjana dan Sarjana Terapan.\r\nBagi mahasiswa ITS yang berencana melakukan permohonan keringanan UKT/SPP, maka diharapkan dapat memperhatikan\r\nbeberapa hal sebagaimana berikut:\r\n1. Permohonan Keringanan UKT/SPP dapat dilakukan melalui sipmaba.its.ac.id, di mana hanya diperkenankan untuk\r\nmahasiswa sarjana dan mahasiswa vokasi / sarjana terapan (selain mahasiswa IUP dan Joint Degree). Pada saat\r\nperiode pengajuan, Mahasiswa yang dimaksud disyaratkan saat ini minimal akan memasuki semester 2 (dua)'
 'Dipublikasikan tanggal 11 Januari 2024\na. diberhentikan beasiswanya apabila mengundurkan diri sebagai CPNS, PNS, prajurit TNI, atau\nanggota POLRI setelah ditetapkan sebagai Calon Penerima Beasiswa;\nb. diberhentikan beasiswanya dan melakukan pengembalian dana studi apabila mengundurkan\ndiri sebagai CPNS, PNS, prajurit TNI, atau anggota POLRI setelah ditetapkan sebagai\nPenerima Beasiswa LPDP.\n17. Memberikan dokumen dan data pendaftaran yang benar, akurat, dan sesuai aslinya serta bersedia\nmenerima sanksi pemblokiran bila terdapat informasi pada dokumen dan data pendaftaran yang\ntidak benar.\n18. Berkomitmen melaksanakan ketentuan beasiswa LPDP.\n19. Apabila dinyatakan lulus pada program studi dan perguruan tinggi pada pogram beasiswa\nkemitraan/kerja sama beasiswa prioritas, maka tidak dapat berpindah program studi, perguruan\ntinggi, dan/atau program Beasiswa LPDP lainnya, atau kelulusan akan dibatalkan.'
 'Tagihan listrik (bukti pembayaran listrik) terbaru\r\nPBB terbaru\r\nKartu keluarga (KK) terbaru\r\nPajak kendaraan roda 2 dan 4 terbaru\r\nFoto rumah (tampak depan, ruang tamu, 2 kamar tidur dan tampak belakang/dapur/kamar mandi)\r\nCatatan:\r\n1. Apabila alasan permohonan keringanan dikarenakan orang tua pensiun, maka data dukung yang perlu dilampirkan\r\nberupa surat keterangan/surat keputusan (termasuk gaji pensiun atau pesangon) yang dikeluarkan oleh pemberi kerja.\r\nBerkas tersebut dapat diupload pada bagian pekerjaan, penghasilan atau SPT.\r\n2. Apabila orang tua meninggal dunia, maka data dukung yang dilampirkan berupa surat kematian/akte kematian. Berkas\r\ntersebut dapat diupload pada bagian pekerjaan, penghasilan atau SPT.\r\n3. Apabila ada data dukung yang tidak tersedia tempatnya untuk mengupload, maka data dukung dapat digabungkan\r\ndengan surat permohonan banding UKT/SPP dengan cara dikolase.']",Pengajuan keringanan UKT/SPP dapat dilakukan pada 01-17 Desember 2023.,0.999999999975,1.0,0.9404617804124413,0.0
18,Apa yang harus dilakukan jika orang tua meninggal dunia?,"Jika orang tua meninggal dunia, maka yang perlu dilakukan adalah melampirkan data dukung berupa surat kematian/akte kematian. Berkas tersebut dapat diupload pada bagian pekerjaan, penghasilan, atau SPT sesuai dengan prosedur yang berlaku. Jika ada data dukung yang tidak tersedia tempatnya untuk diunggah, maka data dukung dapat digabungkan dengan surat permohonan banding UKT/SPP dengan cara dikolase.","['PBB terbaru\nKartu keluarga (KK) terbaru\nPajak kendaraan roda 2 dan 4 terbaru\nFoto rumah (tampak depan, ruang tamu, 2 kamar tidur dan tampak belakang/dapur/kamar mandi)\nCatatan:\n1. Apabila alasan permohonan keringanan dikarenakan orang tua pensiun, maka data dukung yang perlu dilampirkan\nberupa surat keterangan/surat keputusan (termasuk gaji pensiun atau pesangon) yang dikeluarkan oleh pemberi kerja.\nBerkas tersebut dapat diupload pada bagian pekerjaan, penghasilan atau SPT.\n2. Apabila orang tua meninggal dunia, maka data dukung yang dilampirkan berupa surat kematian/akte kematian. Berkas\ntersebut dapat diupload pada bagian pekerjaan, penghasilan atau SPT.\n3. Apabila ada data dukung yang tidak tersedia tempatnya untuk mengupload, maka data dukung dapat digabungkan\ndengan surat permohonan banding UKT/SPP dengan cara dikolase.\n4. Bagi mahasiswa Jalur Mandiri Kemitraan, data penghasilan orang tua (ayah dan ibu) yang dimasukkan adalah jumlah\ntotal per tahun'
 'Tagihan listrik (bukti pembayaran listrik) terbaru\r\nPBB terbaru\r\nKartu keluarga (KK) terbaru\r\nPajak kendaraan roda 2 dan 4 terbaru\r\nFoto rumah (tampak depan, ruang tamu, 2 kamar tidur dan tampak belakang/dapur/kamar mandi)\r\nCatatan:\r\n1. Apabila alasan permohonan keringanan dikarenakan orang tua pensiun, maka data dukung yang perlu dilampirkan\r\nberupa surat keterangan/surat keputusan (termasuk gaji pensiun atau pesangon) yang dikeluarkan oleh pemberi kerja.\r\nBerkas tersebut dapat diupload pada bagian pekerjaan, penghasilan atau SPT.\r\n2. Apabila orang tua meninggal dunia, maka data dukung yang dilampirkan berupa surat kematian/akte kematian. Berkas\r\ntersebut dapat diupload pada bagian pekerjaan, penghasilan atau SPT.\r\n3. Apabila ada data dukung yang tidak tersedia tempatnya untuk mengupload, maka data dukung dapat digabungkan\r\ndengan surat permohonan banding UKT/SPP dengan cara dikolase.'
 'Pasal 20\n(1) Mahasiswa dapat melakukan penarikan UKT atau SPP sebesar 80% (delapan puluh \n  persen), apabila Mahasiswa mendapatkan izin cuti studi paling lambat minggu ke 4 \n  (empat) masa perkuliahan.\n(2) Mahasiswa yang mendapatkan izin cuti setelah kegiatan perkuliahan berjalan lebih \n  dari 4 (empat) minggu, maka dana pendidikan yang telah dibayarkan tidak dapat \n  ditarik kembali.\n(3) Penarikan UKT atau SPP sebesar 100% (seratus persen) dapat diberikan apabila:\n  a. Mahasiswa tersebut diberhentikan dengan keputusan Rektor;\n  b. Mahasiswa tersebut mendapatkan izin cuti studi sebelum masa pembayaran UKT \n   atau SPP berakhir; atau\n  c. Mahasiswa tersebut mendapatkan izin cuti sakit yang diakibatkan oleh peristiwa \n   yang menyebabkan Mahasiswa tersebut tidak dapat mengikuti perkuliahan \n   sekurang-kurangnya 2 (dua) minggu secara bertur-ut-turut, dibuktikan dengan \n   surat keterangan dokter dan rekomendasi kepala departemen.'
 '9\n(4) Penetapan keputusan Rektor sebagaimana dimaksud pada ayat (1) huruf d telah \n  mendapat rekomendasi dari Wakil Rektor yang membidangi sumber daya manusia\n\n                   Pasal 15\n(1) Pegawai pelajar sebagaimana dimaksud dalam Pasal 14 diberikan keringanan SPP \n  dengan ketentuan:\n  a. sebesar 50% (lima puluh persen) darl dana SPP jika pegawai pelajar berusia 35 (tiga \n   puluh lima) tahun sampai dengan 40 (empat puluh) tahun; dan\n  b. sebesar 80% (delapan puluh persen) dari dana SPP jika pegawai pelajar berusia \n   lebih dari 40 (empat puluh) tahun.\n(2) Dalam hal ada persyaratan yang belum terpenuhi sebagaimana dimaksud dalam Pasal \n  14 ayat (1) huruf c, keringanan SPP sebagaimana dimaksud pada ayat (1) berupa \n  skema pengembalian atau reimbursement dana SPP.']",Lampirkan surat kematian atau akte kematian.,0.9999999999666667,1.0,0.9759432770271066,1.0
19,Bagaimana cara login ke portal pengajuan keringanan UKT?,"Untuk login ke portal pengajuan keringanan UKT, mahasiswa dapat mengikuti langkah-langkah berikut:
1. Buka myITS Portal atau portal.its.ac.id
2. Pilih aplikasi SIPMABA
3. Pilih role Login as Mahasiswa Lama
4. Login menggunakan akun mahasiswa
5. Pilih menu Permohonan Keringanan UKT
6. Isi kelengkapan dokumen yang diperlukan untuk proses pengajuan keringanan.

Dengan mengikuti langkah-langkah di atas, mahasiswa dapat login ke portal pengajuan keringanan UKT.","['periode pengajuan, Mahasiswa yang dimaksud disyaratkan saat ini minimal akan memasuki semester 2 (dua)\ndan bukan termasuk kelompok penerima beasiswa, baik beasiswa Bidik Misi/KIP-K maupun beasiswa lainnya, serta\nbelum pernah mendapatkan penurunan UKT dari proses banding UKT sebelumnya,\n2. Permohonan Keringanan UKT dilakukan melalui myITS Portal atau portal.its.ac.id dengan aplikasi layanan\nSIPMABA dilakukan dengan melakukan terhadap update data–data kelengkapan verifikasi UKT yang sebelumnya\npernah diisi oleh mahasiswa pada saat menjadi calon mahasiswa baru.\nPengisian data dapat dilakukan dengan cara login melalui myITS Portal atau portal.its.ac.id dan memilih aplikasi SIPMABA\nkemudian memilih role Login as Mahasiswa Lama. Setelah login, mahasiswa dapat memilih menu Permohonan Keringanan\nUKT. Selanjutnya mahasiswa dapat mengisi kelengkapan dokumen yang diperlukan untuk proses pengajuan keringanan.'
 'periode pengajuan, Mahasiswa yang dimaksud disyaratkan saat ini minimal akan memasuki semester 2 (dua)\r\ndan bukan termasuk kelompok penerima beasiswa, baik beasiswa Bidik Misi/KIP-K maupun beasiswa lainnya, serta\r\nbelum pernah mendapatkan penurunan UKT dari proses banding UKT sebelumnya,\r\n2. Permohonan Keringanan UKT dilakukan melalui myITS Portal atau portal.its.ac.id dengan aplikasi layanan\r\nSIPMABA dilakukan dengan melakukan terhadap update data–data kelengkapan verifikasi UKT yang sebelumnya\r\npernah diisi oleh mahasiswa pada saat menjadi calon mahasiswa baru.\r\nPengisian data dapat dilakukan dengan cara login melalui myITS Portal atau portal.its.ac.id dan memilih aplikasi SIPMABA\r\nkemudian memilih role Login as Mahasiswa Lama. Setelah login, mahasiswa dapat memilih menu Permohonan Keringanan\r\nUKT. Selanjutnya mahasiswa dapat mengisi kelengkapan dokumen yang diperlukan untuk proses pengajuan keringanan.'
 'UKT. Selanjutnya mahasiswa dapat mengisi kelengkapan dokumen yang diperlukan untuk proses pengajuan keringanan.\nApabila menemui kendala di dalam proses pengisian data, mahasiswa dapat bertanya via whatsapp messanger ke\nnomor 081231223994.\n3. Timeline pengisian adalah sebagaimana berikut :\n01–17 Desember 2023 : Pengajuan keringanan UKT/SPP di aplikasi sipmaba melalui portal.its.ac.id\noleh mahasiswa\n18 – 24 Desember 2023 : Pengecekan/verifikasi oleh Verifikator Banding UKT/SPP\n27 - 29 Desember 2023 : Evaluasi oleh Subdit Perencanaan Anggaran\n02 – 05 Januari 2024 : Sinkronisasi data tagihan UKT dengan Biro Keuangan\n08 Januari 2024 : Pengumuman hasil Banding UKT/SPP\n10 – 31 Januari 2024 : Masa pembayaran UKT/SPP semester genap 2023/2024\n4. Pada pengajuan keringanan UKT, mahasiswa harus melakukan update data dan berkas di aplikasi SIPMABA pada\nmenu pendukung (supported) dan upload berkas (upload file). Data dan berkas pendukung yang harus diupload\ndi pada sistem adalah:'
 'UKT. Selanjutnya mahasiswa dapat mengisi kelengkapan dokumen yang diperlukan untuk proses pengajuan keringanan.\r\nApabila menemui kendala di dalam proses pengisian data, mahasiswa dapat bertanya via whatsapp messanger ke\r\nnomor 081231223994.\r\n3. Timeline pengisian adalah sebagaimana berikut :\r\n01–17 Desember 2023 : Pengajuan keringanan UKT/SPP di aplikasi sipmaba melalui portal.its.ac.id\r\noleh mahasiswa\r\n18 – 24 Desember 2023 : Pengecekan/verifikasi oleh Verifikator Banding UKT/SPP\r\n27 - 29 Desember 2023 : Evaluasi oleh Subdit Perencanaan Anggaran\r\n02 – 05 Januari 2024 : Sinkronisasi data tagihan UKT dengan Biro Keuangan\r\n08 Januari 2024 : Pengumuman hasil Banding UKT/SPP\r\n10 – 31 Januari 2024 : Masa pembayaran UKT/SPP semester genap 2023/2024\r\n4. Pada pengajuan keringanan UKT, mahasiswa harus melakukan update data dan berkas di aplikasi SIPMABA pada\r\nmenu pendukung (supported) dan upload berkas (upload file). Data dan berkas pendukung yang harus diupload\r\ndi pada sistem adalah:']",Login melalui myITS Portal atau portal.its.ac.id dan memilih aplikasi SIPMABA dengan role Login as Mahasiswa Lama.,0.999999999975,1.0,0.9999986929947019,1.0
