,question,ground_truth,contexts,answer
0,Kapan jadwal kuliah Kalkulus 1 untuk Semester Regular?,"Jadwal kuliah Kalkulus 1 untuk Semester Regular adalah Selasa dan Kamis, pukul 15.30-17.10.","['11. Peraturan Rektor Institut Tek:nologi Sepuluh Nopember Nomor 16 Tahun 2021 tentang Biaya Pendidikan;\n12. Peraturan Rektor Institut Tek:nologi Sepuluh Nopember Nomor 22 Tahun 2021 tentang Penyelenggaraan Kegiatan Merdeka Belajar Kampus Merdeka di Institut Teknologi Sepuluh Nopember;\n13. Peraturan Rektor Institut Tek:nologi Sepuluh Nopember Nomor 9 Tahun 2022 tentang Satuan Kegiatan Estra Kurikuler Mahasiswa Institut Teknologi Sepuluh Nopember;', 'KEMENTERIAN PENDIDIKAN, KEBUDAYAAN, RISET, DAN TEKNOLOGI\nINSTITUT TEKNOLOGI SEPULUH NOPEMBER\n       Kampus ITS Sukolilo - Surabaya 60111 Telepon : 031-5994251-54, 5947274, 5945472 (Hunting)\nFax: 031-5947264, 5950806\nhttp://www.its.ac.id\n\n\nPERATURAN REKTOR INSTITUT TEKNOWGI SEPULUH NOPEMBER NOMOR 7 TAHUN 2023\n\nTENTANG\n\nPEMBERIAN APRESIASI BAGI MAHASISWA BEPRESTASI\nDAN DOSEN PEMBIMBING DI BIDANG KOMPETISI KEMAHASISWAAN INSTITUT TEKNOWGI SEPULUH NOPEMBER', 'Pasal 9\nKetentuan lebih lanjut mengenai syarat, prosedur dan bentuk apresiasi diatur lebih lanjut dalam petunjuk teknis Wakil Rektor yang membidangi kemahasiswaan.\n\nBAB VI\nKETENTUAN PENUTUP\n\nPasal 10\nPada saat Peraturan Rektor ini mulai berlaku, Peraturan Rektor Institut Teknologi Sepuluh Nopember Nomor 27 Tahun 2022 tentang Pemberian Apresiasi Bagi Mahasiswa Beprestasi dan Dosen Pembimbing di Bidang Kompetisi Kemahasiswaan lnstitut Teknologi Sepuluh Nopember, dicabut dan dinyatakan tidak berlaku.\n\nPasal 11\nPeraturan Rektor ini mulai berlaku pada tanggal ditetapkan.\n\nDitetapkan di Surabaya\npada tanggal 3 Januari 2023\nREKTOR INSTITUT TEKNOLOGI SEPULUH NOPEMBER,\n\n\n\n\nMOCHAMAD ASHARI\nNIP 196510121990031003', 'Mengingat  : 1. Undang-Undang Nomor 12 Tahun 2012 tentang Pendidikan Tinggi (Lembaran Negara Republik Indonesia Tahun 2012 Nomor 158, Tambahan Lembaran Negara Republik Indonesia Nomor 5336);\n2. Peraturan Pemerintah Nomor 4 Tahun 2014 tentang Penyelenggaraan Pendidikan Tinggi dan Pengelolaan Perguruan Tinggi (Lembaran Negara Republik Indonesia Tahun 2014 Nomor 16, Tambahan Lembaran Negara Republik Indonesia Nomor 5500);']",Saya tidak mengetahui jadwal kuliah Kalkulus 1 untuk Semester Regular.
1,Di mana lokasi ruang kelas untuk kuliah Matematika 2 untuk Semester Regular?,"Lokasi ruang kelas Matematika 2 untuk Semester Regular adalah di Tower 1, Lt. 3, ruang TW1-302.","['KEMENTERIAN PENDIDIKAN, KEBUDAYAAN, RISET, DAN TEKNOLOGI\nINSTITUT TEKNOLOGI SEPULUH NOPEMBER\n       Kampus ITS Sukolilo - Surabaya 60111 Telepon : 031-5994251-54, 5947274, 5945472 (Hunting)\nFax: 031-5947264, 5950806\nhttp://www.its.ac.id\n\n\nPERATURAN REKTOR INSTITUT TEKNOWGI SEPULUH NOPEMBER NOMOR 7 TAHUN 2023\n\nTENTANG\n\nPEMBERIAN APRESIASI BAGI MAHASISWA BEPRESTASI\nDAN DOSEN PEMBIMBING DI BIDANG KOMPETISI KEMAHASISWAAN INSTITUT TEKNOWGI SEPULUH NOPEMBER', 'Mengingat  : 1. Undang-Undang Nomor 12 Tahun 2012 tentang Pendidikan Tinggi (Lembaran Negara Republik Indonesia Tahun 2012 Nomor 158, Tambahan Lembaran Negara Republik Indonesia Nomor 5336);\n2. Peraturan Pemerintah Nomor 4 Tahun 2014 tentang Penyelenggaraan Pendidikan Tinggi dan Pengelolaan Perguruan Tinggi (Lembaran Negara Republik Indonesia Tahun 2014 Nomor 16, Tambahan Lembaran Negara Republik Indonesia Nomor 5500);', 'c. bahwa, berdasarkan pertimbangan sebagaimana dimaksud dalam huruf a dan huruf b, tersebut di atas, perlu ditetapkan peraturan Rektor Institut Teknologi Sepuluh Nopember tentang Pemberian Apresiasi Bagi Mahasiswa Berprestasi dan Dosen Pembimbing di Bidang Kompetisi Kemahasiswaan Institut Teknologi Sepuluh Nopember,', 'Pasal 1 Dalam peraturan ini yang dimaksud dengan:\n1. Institut Teknologi Sepuluh Nopember yang selanjutnya disebut ITS adalah perguruan tinggi negeri badan hulrum.\n2. Rektor adalah organ ITS yang memimpin penyelenggaraan dan pengelolaan ITS.\n3. Mahasiswa adalah peserta didik pada jenjang pendidikan tinggi di ITS.\n4. Pembimbing adalah dosen ITS yang mendapat Surat Keputusan Rektor untuk membina Mahasiswa mengikuti kegiatan kompetisi baik dalam skala nasional maupun internasional\n5. Dosen Penalaran adalah dosen ITS yang mendapat Surat Keputusan Rektor untuk membina Mahasiswa mengikuti kegiatan kompetisi yang diselenggarakan oleh Kementerian yang menangani urusan di bidang pendidikan tinggi baik dalam skala nasional maupun internasional.\n6. Apresiasi adalah bentuk reward selain penghargaan sebagaimana dimaksud dalam Peraturan Rektor lnstitut Teknologi Sepuluh Nopember Nomor 25 Tahun 2018 tentang Tata Cara Pemberian Penghargaan.']",Saya tidak mengetahui informasi tersebut.
2,Berapa jumlah SKS untuk mata kuliah Fisika 1 di Semester Regular?,Mata kuliah Fisika 1 memiliki 5 SKS.,"['KEMENTERIAN PENDIDIKAN, KEBUDAYAAN, RISET, DAN TEKNOLOGI\nINSTITUT TEKNOLOGI SEPULUH NOPEMBER\n       Kampus ITS Sukolilo - Surabaya 60111 Telepon : 031-5994251-54, 5947274, 5945472 (Hunting)\nFax: 031-5947264, 5950806\nhttp://www.its.ac.id\n\n\nPERATURAN REKTOR INSTITUT TEKNOWGI SEPULUH NOPEMBER NOMOR 7 TAHUN 2023\n\nTENTANG\n\nPEMBERIAN APRESIASI BAGI MAHASISWA BEPRESTASI\nDAN DOSEN PEMBIMBING DI BIDANG KOMPETISI KEMAHASISWAAN INSTITUT TEKNOWGI SEPULUH NOPEMBER', '11. Peraturan Rektor Institut Tek:nologi Sepuluh Nopember Nomor 16 Tahun 2021 tentang Biaya Pendidikan;\n12. Peraturan Rektor Institut Tek:nologi Sepuluh Nopember Nomor 22 Tahun 2021 tentang Penyelenggaraan Kegiatan Merdeka Belajar Kampus Merdeka di Institut Teknologi Sepuluh Nopember;\n13. Peraturan Rektor Institut Tek:nologi Sepuluh Nopember Nomor 9 Tahun 2022 tentang Satuan Kegiatan Estra Kurikuler Mahasiswa Institut Teknologi Sepuluh Nopember;', 'Bagian Kedua\nSyarat Prestasi Lomba Mandiri\n\nPasal 5\n(1) Syarat untuk Mahasiswa:\na. Mahasiswa aktif yang terdaftar di sistem akademik ITS;\nb. memiliki surat tugas dari direktorat yang mengurusi kemahasiswaan/dekan untuk mengikuti kompetisi tersebut; dan\nc. Mahasiswa yang mendapatkan Apresiasi adalah juara 1, juara 2, juara 3,\ndan Finalis pada kegiatan kompetisi dan kewirausahaan yang melibatkan ilmu pengetahuan, teknologi, olahraga dan seni yang diadakan oleh Kementerian atau Lomba Mandiri bereputasi dengan skala nasional ataupun internasional dibuktikan dengan sertifikat.\n(2) Syarat untuk Pembimbing:\na. dosen aktifyang ada di ITS;\nb. dosen yang mempunyai Surat Keputusan Rektor sebagai Pembimbing kegiatan kompetisi kemahasiswaan; dan\nc. telah        melakukan        verifikasi        prestasi        anak        bimbingnya        di        myITS\nStudentConnect.\n\nBagian Ketiga Tingkat Prestasi', 'Mengingat  : 1. Undang-Undang Nomor 12 Tahun 2012 tentang Pendidikan Tinggi (Lembaran Negara Republik Indonesia Tahun 2012 Nomor 158, Tambahan Lembaran Negara Republik Indonesia Nomor 5336);\n2. Peraturan Pemerintah Nomor 4 Tahun 2014 tentang Penyelenggaraan Pendidikan Tinggi dan Pengelolaan Perguruan Tinggi (Lembaran Negara Republik Indonesia Tahun 2014 Nomor 16, Tambahan Lembaran Negara Republik Indonesia Nomor 5500);']",Saya tidak tahu.
3,Apa kode mata kuliah untuk Kimia 1 di Semester Regular?,Kode mata kuliah untuk Kimia 1 di Semester Regular adalah SK234101.,"['11. Peraturan Rektor Institut Tek:nologi Sepuluh Nopember Nomor 16 Tahun 2021 tentang Biaya Pendidikan;\n12. Peraturan Rektor Institut Tek:nologi Sepuluh Nopember Nomor 22 Tahun 2021 tentang Penyelenggaraan Kegiatan Merdeka Belajar Kampus Merdeka di Institut Teknologi Sepuluh Nopember;\n13. Peraturan Rektor Institut Tek:nologi Sepuluh Nopember Nomor 9 Tahun 2022 tentang Satuan Kegiatan Estra Kurikuler Mahasiswa Institut Teknologi Sepuluh Nopember;', 'KEMENTERIAN PENDIDIKAN, KEBUDAYAAN, RISET, DAN TEKNOLOGI\nINSTITUT TEKNOLOGI SEPULUH NOPEMBER\n       Kampus ITS Sukolilo - Surabaya 60111 Telepon : 031-5994251-54, 5947274, 5945472 (Hunting)\nFax: 031-5947264, 5950806\nhttp://www.its.ac.id\n\n\nPERATURAN REKTOR INSTITUT TEKNOWGI SEPULUH NOPEMBER NOMOR 7 TAHUN 2023\n\nTENTANG\n\nPEMBERIAN APRESIASI BAGI MAHASISWA BEPRESTASI\nDAN DOSEN PEMBIMBING DI BIDANG KOMPETISI KEMAHASISWAAN INSTITUT TEKNOWGI SEPULUH NOPEMBER', 'Mengingat  : 1. Undang-Undang Nomor 12 Tahun 2012 tentang Pendidikan Tinggi (Lembaran Negara Republik Indonesia Tahun 2012 Nomor 158, Tambahan Lembaran Negara Republik Indonesia Nomor 5336);\n2. Peraturan Pemerintah Nomor 4 Tahun 2014 tentang Penyelenggaraan Pendidikan Tinggi dan Pengelolaan Perguruan Tinggi (Lembaran Negara Republik Indonesia Tahun 2014 Nomor 16, Tambahan Lembaran Negara Republik Indonesia Nomor 5500);', 'c. bahwa, berdasarkan pertimbangan sebagaimana dimaksud dalam huruf a dan huruf b, tersebut di atas, perlu ditetapkan peraturan Rektor Institut Teknologi Sepuluh Nopember tentang Pemberian Apresiasi Bagi Mahasiswa Berprestasi dan Dosen Pembimbing di Bidang Kompetisi Kemahasiswaan Institut Teknologi Sepuluh Nopember,']",Saya tidak tahu.
4,Pada hari apa dan jam berapa kelas Kimia 1 untuk Semester Regular berlangsung?,"Kelas Kimia 1 untuk Semester Regular berlangsung pada hari Selasa dan Kamis, pukul 07.00-08.40","['11. Peraturan Rektor Institut Tek:nologi Sepuluh Nopember Nomor 16 Tahun 2021 tentang Biaya Pendidikan;\n12. Peraturan Rektor Institut Tek:nologi Sepuluh Nopember Nomor 22 Tahun 2021 tentang Penyelenggaraan Kegiatan Merdeka Belajar Kampus Merdeka di Institut Teknologi Sepuluh Nopember;\n13. Peraturan Rektor Institut Tek:nologi Sepuluh Nopember Nomor 9 Tahun 2022 tentang Satuan Kegiatan Estra Kurikuler Mahasiswa Institut Teknologi Sepuluh Nopember;', 'Pasal 9\nKetentuan lebih lanjut mengenai syarat, prosedur dan bentuk apresiasi diatur lebih lanjut dalam petunjuk teknis Wakil Rektor yang membidangi kemahasiswaan.\n\nBAB VI\nKETENTUAN PENUTUP\n\nPasal 10\nPada saat Peraturan Rektor ini mulai berlaku, Peraturan Rektor Institut Teknologi Sepuluh Nopember Nomor 27 Tahun 2022 tentang Pemberian Apresiasi Bagi Mahasiswa Beprestasi dan Dosen Pembimbing di Bidang Kompetisi Kemahasiswaan lnstitut Teknologi Sepuluh Nopember, dicabut dan dinyatakan tidak berlaku.\n\nPasal 11\nPeraturan Rektor ini mulai berlaku pada tanggal ditetapkan.\n\nDitetapkan di Surabaya\npada tanggal 3 Januari 2023\nREKTOR INSTITUT TEKNOLOGI SEPULUH NOPEMBER,\n\n\n\n\nMOCHAMAD ASHARI\nNIP 196510121990031003', 'KEMENTERIAN PENDIDIKAN, KEBUDAYAAN, RISET, DAN TEKNOLOGI\nINSTITUT TEKNOLOGI SEPULUH NOPEMBER\n       Kampus ITS Sukolilo - Surabaya 60111 Telepon : 031-5994251-54, 5947274, 5945472 (Hunting)\nFax: 031-5947264, 5950806\nhttp://www.its.ac.id\n\n\nPERATURAN REKTOR INSTITUT TEKNOWGI SEPULUH NOPEMBER NOMOR 7 TAHUN 2023\n\nTENTANG\n\nPEMBERIAN APRESIASI BAGI MAHASISWA BEPRESTASI\nDAN DOSEN PEMBIMBING DI BIDANG KOMPETISI KEMAHASISWAAN INSTITUT TEKNOWGI SEPULUH NOPEMBER', 'Mengingat  : 1. Undang-Undang Nomor 12 Tahun 2012 tentang Pendidikan Tinggi (Lembaran Negara Republik Indonesia Tahun 2012 Nomor 158, Tambahan Lembaran Negara Republik Indonesia Nomor 5336);\n2. Peraturan Pemerintah Nomor 4 Tahun 2014 tentang Penyelenggaraan Pendidikan Tinggi dan Pengelolaan Perguruan Tinggi (Lembaran Negara Republik Indonesia Tahun 2014 Nomor 16, Tambahan Lembaran Negara Republik Indonesia Nomor 5500);']",Saya tidak mengetahui informasi tersebut.
5,Di lantai berapa dan ruangan mana kelas Fisika Mekanika di Semester IUP?,"Kelas Fisika Mekanika di Semester IUP berada di Tower 1, Lt. 6, ruang TW1-606.","['Bagian Kedua\nSyarat Prestasi Lomba Mandiri\n\nPasal 5\n(1) Syarat untuk Mahasiswa:\na. Mahasiswa aktif yang terdaftar di sistem akademik ITS;\nb. memiliki surat tugas dari direktorat yang mengurusi kemahasiswaan/dekan untuk mengikuti kompetisi tersebut; dan\nc. Mahasiswa yang mendapatkan Apresiasi adalah juara 1, juara 2, juara 3,\ndan Finalis pada kegiatan kompetisi dan kewirausahaan yang melibatkan ilmu pengetahuan, teknologi, olahraga dan seni yang diadakan oleh Kementerian atau Lomba Mandiri bereputasi dengan skala nasional ataupun internasional dibuktikan dengan sertifikat.\n(2) Syarat untuk Pembimbing:\na. dosen aktifyang ada di ITS;\nb. dosen yang mempunyai Surat Keputusan Rektor sebagai Pembimbing kegiatan kompetisi kemahasiswaan; dan\nc. telah        melakukan        verifikasi        prestasi        anak        bimbingnya        di        myITS\nStudentConnect.\n\nBagian Ketiga Tingkat Prestasi', 'KEMENTERIAN PENDIDIKAN, KEBUDAYAAN, RISET, DAN TEKNOLOGI\nINSTITUT TEKNOLOGI SEPULUH NOPEMBER\n       Kampus ITS Sukolilo - Surabaya 60111 Telepon : 031-5994251-54, 5947274, 5945472 (Hunting)\nFax: 031-5947264, 5950806\nhttp://www.its.ac.id\n\n\nPERATURAN REKTOR INSTITUT TEKNOWGI SEPULUH NOPEMBER NOMOR 7 TAHUN 2023\n\nTENTANG\n\nPEMBERIAN APRESIASI BAGI MAHASISWA BEPRESTASI\nDAN DOSEN PEMBIMBING DI BIDANG KOMPETISI KEMAHASISWAAN INSTITUT TEKNOWGI SEPULUH NOPEMBER', 'BAB III\nSYARAT DAN TINGKAT PRESTASI\n\nBagianKesatu\nSyarat Prestasi Lomba Kementerian\n\n\n\n(1) Syarat untuk Mahasiswa:\n\nPasal 4\n\na. Mahasiswa aktif yang terdaftar di sistem akademik ITS;\n\nb. Mahasiswa memiliki surat tugas dari direktorat yang mengurusi kemahasiswaan/dekan untuk mengikuti kompetisi tersebut; dan\nc. Mahasiswa yang mendapatkan Apresiasi adalah juara 1, juara 2, juara 3, dan Finalis pada kegiatan kompetisi yang diadakan oleh Kementerian atau Lomba Mandiri bereputasi dengan skala nasional ataupun internasional dibuktikan dengan sertifikat\n(2) Syarat untuk Pembimbing:\na. dosen aktif yang ada di ITS; dan\nb. dosen yang mempunyai Surat Keputusan Rektor sebagai Pembimbing kegiatan kompetisi kemahasiswaan.\n(3) Syarat untuk Dosen Penalaran yaitu dosen aktif yang tergabung pada kegiatan penalaran yang dibuktikan dengan Surat Keputusan Rektor dan mendukung kegiatan kompetisi yang diselenggarakan oleh Kementerian.\n\nBagian Kedua\nSyarat Prestasi Lomba Mandiri', '11. Peraturan Rektor Institut Tek:nologi Sepuluh Nopember Nomor 16 Tahun 2021 tentang Biaya Pendidikan;\n12. Peraturan Rektor Institut Tek:nologi Sepuluh Nopember Nomor 22 Tahun 2021 tentang Penyelenggaraan Kegiatan Merdeka Belajar Kampus Merdeka di Institut Teknologi Sepuluh Nopember;\n13. Peraturan Rektor Institut Tek:nologi Sepuluh Nopember Nomor 9 Tahun 2022 tentang Satuan Kegiatan Estra Kurikuler Mahasiswa Institut Teknologi Sepuluh Nopember;']",Saya tidak tahu.
6,Apa jadwal kuliah Bahasa Indonesia untuk Semester Regular?,"Jadwal kuliah Bahasa Indonesia untuk Semester Regular adalah Jum'at, pukul 09.00-10.40.","['KEMENTERIAN PENDIDIKAN, KEBUDAYAAN, RISET, DAN TEKNOLOGI\nINSTITUT TEKNOLOGI SEPULUH NOPEMBER\n       Kampus ITS Sukolilo - Surabaya 60111 Telepon : 031-5994251-54, 5947274, 5945472 (Hunting)\nFax: 031-5947264, 5950806\nhttp://www.its.ac.id\n\n\nPERATURAN REKTOR INSTITUT TEKNOWGI SEPULUH NOPEMBER NOMOR 7 TAHUN 2023\n\nTENTANG\n\nPEMBERIAN APRESIASI BAGI MAHASISWA BEPRESTASI\nDAN DOSEN PEMBIMBING DI BIDANG KOMPETISI KEMAHASISWAAN INSTITUT TEKNOWGI SEPULUH NOPEMBER', '11. Peraturan Rektor Institut Tek:nologi Sepuluh Nopember Nomor 16 Tahun 2021 tentang Biaya Pendidikan;\n12. Peraturan Rektor Institut Tek:nologi Sepuluh Nopember Nomor 22 Tahun 2021 tentang Penyelenggaraan Kegiatan Merdeka Belajar Kampus Merdeka di Institut Teknologi Sepuluh Nopember;\n13. Peraturan Rektor Institut Tek:nologi Sepuluh Nopember Nomor 9 Tahun 2022 tentang Satuan Kegiatan Estra Kurikuler Mahasiswa Institut Teknologi Sepuluh Nopember;', 'Mengingat  : 1. Undang-Undang Nomor 12 Tahun 2012 tentang Pendidikan Tinggi (Lembaran Negara Republik Indonesia Tahun 2012 Nomor 158, Tambahan Lembaran Negara Republik Indonesia Nomor 5336);\n2. Peraturan Pemerintah Nomor 4 Tahun 2014 tentang Penyelenggaraan Pendidikan Tinggi dan Pengelolaan Perguruan Tinggi (Lembaran Negara Republik Indonesia Tahun 2014 Nomor 16, Tambahan Lembaran Negara Republik Indonesia Nomor 5500);', 'Pasal 9\nKetentuan lebih lanjut mengenai syarat, prosedur dan bentuk apresiasi diatur lebih lanjut dalam petunjuk teknis Wakil Rektor yang membidangi kemahasiswaan.\n\nBAB VI\nKETENTUAN PENUTUP\n\nPasal 10\nPada saat Peraturan Rektor ini mulai berlaku, Peraturan Rektor Institut Teknologi Sepuluh Nopember Nomor 27 Tahun 2022 tentang Pemberian Apresiasi Bagi Mahasiswa Beprestasi dan Dosen Pembimbing di Bidang Kompetisi Kemahasiswaan lnstitut Teknologi Sepuluh Nopember, dicabut dan dinyatakan tidak berlaku.\n\nPasal 11\nPeraturan Rektor ini mulai berlaku pada tanggal ditetapkan.\n\nDitetapkan di Surabaya\npada tanggal 3 Januari 2023\nREKTOR INSTITUT TEKNOLOGI SEPULUH NOPEMBER,\n\n\n\n\nMOCHAMAD ASHARI\nNIP 196510121990031003']",Saya tidak menemukan informasi mengenai jadwal kuliah Bahasa Indonesia untuk Semester Regular dalam konteks yang diberikan.
7,Berapa jumlah SKS untuk mata kuliah Pancasila di Semester IUP?,Mata kuliah Pancasila di Semester IUP memiliki 2 SKS.,"['KEMENTERIAN PENDIDIKAN, KEBUDAYAAN, RISET, DAN TEKNOLOGI\nINSTITUT TEKNOLOGI SEPULUH NOPEMBER\n       Kampus ITS Sukolilo - Surabaya 60111 Telepon : 031-5994251-54, 5947274, 5945472 (Hunting)\nFax: 031-5947264, 5950806\nhttp://www.its.ac.id\n\n\nPERATURAN REKTOR INSTITUT TEKNOWGI SEPULUH NOPEMBER NOMOR 7 TAHUN 2023\n\nTENTANG\n\nPEMBERIAN APRESIASI BAGI MAHASISWA BEPRESTASI\nDAN DOSEN PEMBIMBING DI BIDANG KOMPETISI KEMAHASISWAAN INSTITUT TEKNOWGI SEPULUH NOPEMBER', '11. Peraturan Rektor Institut Tek:nologi Sepuluh Nopember Nomor 16 Tahun 2021 tentang Biaya Pendidikan;\n12. Peraturan Rektor Institut Tek:nologi Sepuluh Nopember Nomor 22 Tahun 2021 tentang Penyelenggaraan Kegiatan Merdeka Belajar Kampus Merdeka di Institut Teknologi Sepuluh Nopember;\n13. Peraturan Rektor Institut Tek:nologi Sepuluh Nopember Nomor 9 Tahun 2022 tentang Satuan Kegiatan Estra Kurikuler Mahasiswa Institut Teknologi Sepuluh Nopember;', 'BAB II MAKSUD DAN TUJUAN\n\nPasal 2\nPeraturan ini diterbitkan dengan maksud agar pimpinan ITS mempunyai pedoman dalam memberikan Apresiasi kepada Mahasiswa berprestasi dan Pembimbing di bidang kemahasiswaan.\n\n                               Pasal 3 Peraturan ini diterbitkan dengan tujuan:\na. memotivasi Mahasiswa agar berprestasi dalam berbagai kegiatan lomba; dan\nb. mendorong Pembimbing untuk melakukan pembinaan, pendampingan dan/atau pelatihan secara intensif kepada perorangan atau kelompok Mahasiswa.\n\nBAB III\nSYARAT DAN TINGKAT PRESTASI\n\nBagianKesatu\nSyarat Prestasi Lomba Kementerian\n\n\n\n(1) Syarat untuk Mahasiswa:\n\nPasal 4\n\na. Mahasiswa aktif yang terdaftar di sistem akademik ITS;', 'BAB III\nSYARAT DAN TINGKAT PRESTASI\n\nBagianKesatu\nSyarat Prestasi Lomba Kementerian\n\n\n\n(1) Syarat untuk Mahasiswa:\n\nPasal 4\n\na. Mahasiswa aktif yang terdaftar di sistem akademik ITS;\n\nb. Mahasiswa memiliki surat tugas dari direktorat yang mengurusi kemahasiswaan/dekan untuk mengikuti kompetisi tersebut; dan\nc. Mahasiswa yang mendapatkan Apresiasi adalah juara 1, juara 2, juara 3, dan Finalis pada kegiatan kompetisi yang diadakan oleh Kementerian atau Lomba Mandiri bereputasi dengan skala nasional ataupun internasional dibuktikan dengan sertifikat\n(2) Syarat untuk Pembimbing:\na. dosen aktif yang ada di ITS; dan\nb. dosen yang mempunyai Surat Keputusan Rektor sebagai Pembimbing kegiatan kompetisi kemahasiswaan.\n(3) Syarat untuk Dosen Penalaran yaitu dosen aktif yang tergabung pada kegiatan penalaran yang dibuktikan dengan Surat Keputusan Rektor dan mendukung kegiatan kompetisi yang diselenggarakan oleh Kementerian.\n\nBagian Kedua\nSyarat Prestasi Lomba Mandiri']",Saya tidak tahu.
8,Pada hari apa kelas Kewarganegaraan untuk Semester IUP dijadwalkan?,"Kelas Kewarganegaraan untuk Semester IUP dijadwalkan pada hari Selasa, pukul 11.00-12.40.","['KEMENTERIAN PENDIDIKAN, KEBUDAYAAN, RISET, DAN TEKNOLOGI\nINSTITUT TEKNOLOGI SEPULUH NOPEMBER\n       Kampus ITS Sukolilo - Surabaya 60111 Telepon : 031-5994251-54, 5947274, 5945472 (Hunting)\nFax: 031-5947264, 5950806\nhttp://www.its.ac.id\n\n\nPERATURAN REKTOR INSTITUT TEKNOWGI SEPULUH NOPEMBER NOMOR 7 TAHUN 2023\n\nTENTANG\n\nPEMBERIAN APRESIASI BAGI MAHASISWA BEPRESTASI\nDAN DOSEN PEMBIMBING DI BIDANG KOMPETISI KEMAHASISWAAN INSTITUT TEKNOWGI SEPULUH NOPEMBER', 'Pasal 9\nKetentuan lebih lanjut mengenai syarat, prosedur dan bentuk apresiasi diatur lebih lanjut dalam petunjuk teknis Wakil Rektor yang membidangi kemahasiswaan.\n\nBAB VI\nKETENTUAN PENUTUP\n\nPasal 10\nPada saat Peraturan Rektor ini mulai berlaku, Peraturan Rektor Institut Teknologi Sepuluh Nopember Nomor 27 Tahun 2022 tentang Pemberian Apresiasi Bagi Mahasiswa Beprestasi dan Dosen Pembimbing di Bidang Kompetisi Kemahasiswaan lnstitut Teknologi Sepuluh Nopember, dicabut dan dinyatakan tidak berlaku.\n\nPasal 11\nPeraturan Rektor ini mulai berlaku pada tanggal ditetapkan.\n\nDitetapkan di Surabaya\npada tanggal 3 Januari 2023\nREKTOR INSTITUT TEKNOLOGI SEPULUH NOPEMBER,\n\n\n\n\nMOCHAMAD ASHARI\nNIP 196510121990031003', '11. Peraturan Rektor Institut Tek:nologi Sepuluh Nopember Nomor 16 Tahun 2021 tentang Biaya Pendidikan;\n12. Peraturan Rektor Institut Tek:nologi Sepuluh Nopember Nomor 22 Tahun 2021 tentang Penyelenggaraan Kegiatan Merdeka Belajar Kampus Merdeka di Institut Teknologi Sepuluh Nopember;\n13. Peraturan Rektor Institut Tek:nologi Sepuluh Nopember Nomor 9 Tahun 2022 tentang Satuan Kegiatan Estra Kurikuler Mahasiswa Institut Teknologi Sepuluh Nopember;', 'Menetapkan\n\nMEMUTUSKAN:\nPERATURAN REKTOR INSTITUT TEKNOLOGI SEPULUH NOPEMBER TENTANG PEMBERIAN APRESIASI BAGI MAHASISWA BEPRESTASI DAN DOSEN PEMBIMBING DI BIDANG KEMAHASISW AAN INSTITUT TEKNOLOGI SEPULUH NOPEMBER.\n\nBAB!\nKETENTUAN UMUM']",Saya tidak menemukan informasi mengenai jadwal kelas Kewarganegaraan untuk Semester IUP dalam konteks yang diberikan.
9,Di mana lokasi ruang kelas untuk kuliah Agama Islam di Semester IUP?,"Lokasi ruang kelas untuk kuliah Agama Islam di Semester IUP adalah di Tower 1, Lt. 3, ruang TW1-304.","['KEMENTERIAN PENDIDIKAN, KEBUDAYAAN, RISET, DAN TEKNOLOGI\nINSTITUT TEKNOLOGI SEPULUH NOPEMBER\n       Kampus ITS Sukolilo - Surabaya 60111 Telepon : 031-5994251-54, 5947274, 5945472 (Hunting)\nFax: 031-5947264, 5950806\nhttp://www.its.ac.id\n\n\nPERATURAN REKTOR INSTITUT TEKNOWGI SEPULUH NOPEMBER NOMOR 7 TAHUN 2023\n\nTENTANG\n\nPEMBERIAN APRESIASI BAGI MAHASISWA BEPRESTASI\nDAN DOSEN PEMBIMBING DI BIDANG KOMPETISI KEMAHASISWAAN INSTITUT TEKNOWGI SEPULUH NOPEMBER', 'Pasal 1 Dalam peraturan ini yang dimaksud dengan:\n1. Institut Teknologi Sepuluh Nopember yang selanjutnya disebut ITS adalah perguruan tinggi negeri badan hulrum.\n2. Rektor adalah organ ITS yang memimpin penyelenggaraan dan pengelolaan ITS.\n3. Mahasiswa adalah peserta didik pada jenjang pendidikan tinggi di ITS.\n4. Pembimbing adalah dosen ITS yang mendapat Surat Keputusan Rektor untuk membina Mahasiswa mengikuti kegiatan kompetisi baik dalam skala nasional maupun internasional\n5. Dosen Penalaran adalah dosen ITS yang mendapat Surat Keputusan Rektor untuk membina Mahasiswa mengikuti kegiatan kompetisi yang diselenggarakan oleh Kementerian yang menangani urusan di bidang pendidikan tinggi baik dalam skala nasional maupun internasional.\n6. Apresiasi adalah bentuk reward selain penghargaan sebagaimana dimaksud dalam Peraturan Rektor lnstitut Teknologi Sepuluh Nopember Nomor 25 Tahun 2018 tentang Tata Cara Pemberian Penghargaan.', 'c. bahwa, berdasarkan pertimbangan sebagaimana dimaksud dalam huruf a dan huruf b, tersebut di atas, perlu ditetapkan peraturan Rektor Institut Teknologi Sepuluh Nopember tentang Pemberian Apresiasi Bagi Mahasiswa Berprestasi dan Dosen Pembimbing di Bidang Kompetisi Kemahasiswaan Institut Teknologi Sepuluh Nopember,', 'DENGAN RAHMAT TUHAN YANG MAHA ESA REKTOR INSTITUT TEKNOLOGI SEPULUH NOPEMBER,\nMenimbang : a. bahwa dalam rangka memotivasi mahasiswa dan dosen untuk berpartisipasi aktif dan berprestasi dalam berbagai kegiatan kemahasiswaan, perlu diberikan apresiasi yang berkeadilan dan terstruktur sesuai tingkatan prestasi yang telah dicapai;\nb. bahwa Peraturan Rektor Institut Teknologi Sepuluh Nopember Nomor 27 Tahun 2022 tentang Pemberian Apresiasi Bagi Mahasiswa Beprestasi dan Dosen Pembimbing di Bidang Kompetisi Kemahasiswaan Institut Teknologi Sepuluh Nopember perlu dilakukan penyesuaian memenuhi perkembangan akademik dan kemahasiswaan di lingkungan Institut Teknologi Sepuluh Nopember,']",Saya tidak mengetahui lokasi ruang kelas untuk kuliah Agama Islam di Semester IUP.
10,Berapa jumlah SKS untuk mata kuliah Kalkulus 1 di Semester IUP?,Mata kuliah Kalkulus 1 di Semester IUP memiliki 3 SKS.,"['KEMENTERIAN PENDIDIKAN, KEBUDAYAAN, RISET, DAN TEKNOLOGI\nINSTITUT TEKNOLOGI SEPULUH NOPEMBER\n       Kampus ITS Sukolilo - Surabaya 60111 Telepon : 031-5994251-54, 5947274, 5945472 (Hunting)\nFax: 031-5947264, 5950806\nhttp://www.its.ac.id\n\n\nPERATURAN REKTOR INSTITUT TEKNOWGI SEPULUH NOPEMBER NOMOR 7 TAHUN 2023\n\nTENTANG\n\nPEMBERIAN APRESIASI BAGI MAHASISWA BEPRESTASI\nDAN DOSEN PEMBIMBING DI BIDANG KOMPETISI KEMAHASISWAAN INSTITUT TEKNOWGI SEPULUH NOPEMBER', '11. Peraturan Rektor Institut Tek:nologi Sepuluh Nopember Nomor 16 Tahun 2021 tentang Biaya Pendidikan;\n12. Peraturan Rektor Institut Tek:nologi Sepuluh Nopember Nomor 22 Tahun 2021 tentang Penyelenggaraan Kegiatan Merdeka Belajar Kampus Merdeka di Institut Teknologi Sepuluh Nopember;\n13. Peraturan Rektor Institut Tek:nologi Sepuluh Nopember Nomor 9 Tahun 2022 tentang Satuan Kegiatan Estra Kurikuler Mahasiswa Institut Teknologi Sepuluh Nopember;', 'BAB III\nSYARAT DAN TINGKAT PRESTASI\n\nBagianKesatu\nSyarat Prestasi Lomba Kementerian\n\n\n\n(1) Syarat untuk Mahasiswa:\n\nPasal 4\n\na. Mahasiswa aktif yang terdaftar di sistem akademik ITS;\n\nb. Mahasiswa memiliki surat tugas dari direktorat yang mengurusi kemahasiswaan/dekan untuk mengikuti kompetisi tersebut; dan\nc. Mahasiswa yang mendapatkan Apresiasi adalah juara 1, juara 2, juara 3, dan Finalis pada kegiatan kompetisi yang diadakan oleh Kementerian atau Lomba Mandiri bereputasi dengan skala nasional ataupun internasional dibuktikan dengan sertifikat\n(2) Syarat untuk Pembimbing:\na. dosen aktif yang ada di ITS; dan\nb. dosen yang mempunyai Surat Keputusan Rektor sebagai Pembimbing kegiatan kompetisi kemahasiswaan.\n(3) Syarat untuk Dosen Penalaran yaitu dosen aktif yang tergabung pada kegiatan penalaran yang dibuktikan dengan Surat Keputusan Rektor dan mendukung kegiatan kompetisi yang diselenggarakan oleh Kementerian.\n\nBagian Kedua\nSyarat Prestasi Lomba Mandiri', 'Bagian Kedua\nSyarat Prestasi Lomba Mandiri\n\nPasal 5\n(1) Syarat untuk Mahasiswa:\na. Mahasiswa aktif yang terdaftar di sistem akademik ITS;\nb. memiliki surat tugas dari direktorat yang mengurusi kemahasiswaan/dekan untuk mengikuti kompetisi tersebut; dan\nc. Mahasiswa yang mendapatkan Apresiasi adalah juara 1, juara 2, juara 3,\ndan Finalis pada kegiatan kompetisi dan kewirausahaan yang melibatkan ilmu pengetahuan, teknologi, olahraga dan seni yang diadakan oleh Kementerian atau Lomba Mandiri bereputasi dengan skala nasional ataupun internasional dibuktikan dengan sertifikat.\n(2) Syarat untuk Pembimbing:\na. dosen aktifyang ada di ITS;\nb. dosen yang mempunyai Surat Keputusan Rektor sebagai Pembimbing kegiatan kompetisi kemahasiswaan; dan\nc. telah        melakukan        verifikasi        prestasi        anak        bimbingnya        di        myITS\nStudentConnect.\n\nBagian Ketiga Tingkat Prestasi']",Saya tidak tahu.
11,Apa kode departemen untuk mata kuliah Fisika Dasar di Semester Regular? ,Mata kuliah Fisika Dasar di Semester Regular memiliki kode departemen SF234204.,"['KEMENTERIAN PENDIDIKAN, KEBUDAYAAN, RISET, DAN TEKNOLOGI\nINSTITUT TEKNOLOGI SEPULUH NOPEMBER\n       Kampus ITS Sukolilo - Surabaya 60111 Telepon : 031-5994251-54, 5947274, 5945472 (Hunting)\nFax: 031-5947264, 5950806\nhttp://www.its.ac.id\n\n\nPERATURAN REKTOR INSTITUT TEKNOWGI SEPULUH NOPEMBER NOMOR 7 TAHUN 2023\n\nTENTANG\n\nPEMBERIAN APRESIASI BAGI MAHASISWA BEPRESTASI\nDAN DOSEN PEMBIMBING DI BIDANG KOMPETISI KEMAHASISWAAN INSTITUT TEKNOWGI SEPULUH NOPEMBER', '11. Peraturan Rektor Institut Tek:nologi Sepuluh Nopember Nomor 16 Tahun 2021 tentang Biaya Pendidikan;\n12. Peraturan Rektor Institut Tek:nologi Sepuluh Nopember Nomor 22 Tahun 2021 tentang Penyelenggaraan Kegiatan Merdeka Belajar Kampus Merdeka di Institut Teknologi Sepuluh Nopember;\n13. Peraturan Rektor Institut Tek:nologi Sepuluh Nopember Nomor 9 Tahun 2022 tentang Satuan Kegiatan Estra Kurikuler Mahasiswa Institut Teknologi Sepuluh Nopember;', 'Mengingat  : 1. Undang-Undang Nomor 12 Tahun 2012 tentang Pendidikan Tinggi (Lembaran Negara Republik Indonesia Tahun 2012 Nomor 158, Tambahan Lembaran Negara Republik Indonesia Nomor 5336);\n2. Peraturan Pemerintah Nomor 4 Tahun 2014 tentang Penyelenggaraan Pendidikan Tinggi dan Pengelolaan Perguruan Tinggi (Lembaran Negara Republik Indonesia Tahun 2014 Nomor 16, Tambahan Lembaran Negara Republik Indonesia Nomor 5500);', 'c. bahwa, berdasarkan pertimbangan sebagaimana dimaksud dalam huruf a dan huruf b, tersebut di atas, perlu ditetapkan peraturan Rektor Institut Teknologi Sepuluh Nopember tentang Pemberian Apresiasi Bagi Mahasiswa Berprestasi dan Dosen Pembimbing di Bidang Kompetisi Kemahasiswaan Institut Teknologi Sepuluh Nopember,']",Saya tidak tahu.
12,Pada jadwal mana kelas Bahasa Inggris untuk Semester Regular berlangsung?," Kelas Bahasa Inggris untuk Semester Regular berlangsung pada Jum'at, pukul 13.30-15.10.","['Mengingat  : 1. Undang-Undang Nomor 12 Tahun 2012 tentang Pendidikan Tinggi (Lembaran Negara Republik Indonesia Tahun 2012 Nomor 158, Tambahan Lembaran Negara Republik Indonesia Nomor 5336);\n2. Peraturan Pemerintah Nomor 4 Tahun 2014 tentang Penyelenggaraan Pendidikan Tinggi dan Pengelolaan Perguruan Tinggi (Lembaran Negara Republik Indonesia Tahun 2014 Nomor 16, Tambahan Lembaran Negara Republik Indonesia Nomor 5500);', 'Bagian Kedua\nSyarat Prestasi Lomba Mandiri\n\nPasal 5\n(1) Syarat untuk Mahasiswa:\na. Mahasiswa aktif yang terdaftar di sistem akademik ITS;\nb. memiliki surat tugas dari direktorat yang mengurusi kemahasiswaan/dekan untuk mengikuti kompetisi tersebut; dan\nc. Mahasiswa yang mendapatkan Apresiasi adalah juara 1, juara 2, juara 3,\ndan Finalis pada kegiatan kompetisi dan kewirausahaan yang melibatkan ilmu pengetahuan, teknologi, olahraga dan seni yang diadakan oleh Kementerian atau Lomba Mandiri bereputasi dengan skala nasional ataupun internasional dibuktikan dengan sertifikat.\n(2) Syarat untuk Pembimbing:\na. dosen aktifyang ada di ITS;\nb. dosen yang mempunyai Surat Keputusan Rektor sebagai Pembimbing kegiatan kompetisi kemahasiswaan; dan\nc. telah        melakukan        verifikasi        prestasi        anak        bimbingnya        di        myITS\nStudentConnect.\n\nBagian Ketiga Tingkat Prestasi', 'KEMENTERIAN PENDIDIKAN, KEBUDAYAAN, RISET, DAN TEKNOLOGI\nINSTITUT TEKNOLOGI SEPULUH NOPEMBER\n       Kampus ITS Sukolilo - Surabaya 60111 Telepon : 031-5994251-54, 5947274, 5945472 (Hunting)\nFax: 031-5947264, 5950806\nhttp://www.its.ac.id\n\n\nPERATURAN REKTOR INSTITUT TEKNOWGI SEPULUH NOPEMBER NOMOR 7 TAHUN 2023\n\nTENTANG\n\nPEMBERIAN APRESIASI BAGI MAHASISWA BEPRESTASI\nDAN DOSEN PEMBIMBING DI BIDANG KOMPETISI KEMAHASISWAAN INSTITUT TEKNOWGI SEPULUH NOPEMBER', '11. Peraturan Rektor Institut Tek:nologi Sepuluh Nopember Nomor 16 Tahun 2021 tentang Biaya Pendidikan;\n12. Peraturan Rektor Institut Tek:nologi Sepuluh Nopember Nomor 22 Tahun 2021 tentang Penyelenggaraan Kegiatan Merdeka Belajar Kampus Merdeka di Institut Teknologi Sepuluh Nopember;\n13. Peraturan Rektor Institut Tek:nologi Sepuluh Nopember Nomor 9 Tahun 2022 tentang Satuan Kegiatan Estra Kurikuler Mahasiswa Institut Teknologi Sepuluh Nopember;']",Saya tidak mengetahui jawabannya.
13,Di mana lokasi ruang kelas untuk kelas Pancasila untuk Semester Regular?,"Lokasi ruang kelas untuk kelas Pancasila untuk Semester Regular adalah di Tower 1, Lt. 6, ruang TW1-605.","['KEMENTERIAN PENDIDIKAN, KEBUDAYAAN, RISET, DAN TEKNOLOGI\nINSTITUT TEKNOLOGI SEPULUH NOPEMBER\n       Kampus ITS Sukolilo - Surabaya 60111 Telepon : 031-5994251-54, 5947274, 5945472 (Hunting)\nFax: 031-5947264, 5950806\nhttp://www.its.ac.id\n\n\nPERATURAN REKTOR INSTITUT TEKNOWGI SEPULUH NOPEMBER NOMOR 7 TAHUN 2023\n\nTENTANG\n\nPEMBERIAN APRESIASI BAGI MAHASISWA BEPRESTASI\nDAN DOSEN PEMBIMBING DI BIDANG KOMPETISI KEMAHASISWAAN INSTITUT TEKNOWGI SEPULUH NOPEMBER', 'DENGAN RAHMAT TUHAN YANG MAHA ESA REKTOR INSTITUT TEKNOLOGI SEPULUH NOPEMBER,\nMenimbang : a. bahwa dalam rangka memotivasi mahasiswa dan dosen untuk berpartisipasi aktif dan berprestasi dalam berbagai kegiatan kemahasiswaan, perlu diberikan apresiasi yang berkeadilan dan terstruktur sesuai tingkatan prestasi yang telah dicapai;\nb. bahwa Peraturan Rektor Institut Teknologi Sepuluh Nopember Nomor 27 Tahun 2022 tentang Pemberian Apresiasi Bagi Mahasiswa Beprestasi dan Dosen Pembimbing di Bidang Kompetisi Kemahasiswaan Institut Teknologi Sepuluh Nopember perlu dilakukan penyesuaian memenuhi perkembangan akademik dan kemahasiswaan di lingkungan Institut Teknologi Sepuluh Nopember,', 'c. bahwa, berdasarkan pertimbangan sebagaimana dimaksud dalam huruf a dan huruf b, tersebut di atas, perlu ditetapkan peraturan Rektor Institut Teknologi Sepuluh Nopember tentang Pemberian Apresiasi Bagi Mahasiswa Berprestasi dan Dosen Pembimbing di Bidang Kompetisi Kemahasiswaan Institut Teknologi Sepuluh Nopember,', 'Mengingat  : 1. Undang-Undang Nomor 12 Tahun 2012 tentang Pendidikan Tinggi (Lembaran Negara Republik Indonesia Tahun 2012 Nomor 158, Tambahan Lembaran Negara Republik Indonesia Nomor 5336);\n2. Peraturan Pemerintah Nomor 4 Tahun 2014 tentang Penyelenggaraan Pendidikan Tinggi dan Pengelolaan Perguruan Tinggi (Lembaran Negara Republik Indonesia Tahun 2014 Nomor 16, Tambahan Lembaran Negara Republik Indonesia Nomor 5500);']",Saya tidak mengetahui lokasi ruang kelas untuk kelas Pancasila untuk Semester Regular.
14,Pada hari dan pukul berapa kelas Fisika 1 untuk Semester IUP diadakan?,"Kelas Fisika 1 untuk Semester IUP diadakan pada hari Selasa dan Kamis, pukul 15.30-17.10.","['KEMENTERIAN PENDIDIKAN, KEBUDAYAAN, RISET, DAN TEKNOLOGI\nINSTITUT TEKNOLOGI SEPULUH NOPEMBER\n       Kampus ITS Sukolilo - Surabaya 60111 Telepon : 031-5994251-54, 5947274, 5945472 (Hunting)\nFax: 031-5947264, 5950806\nhttp://www.its.ac.id\n\n\nPERATURAN REKTOR INSTITUT TEKNOWGI SEPULUH NOPEMBER NOMOR 7 TAHUN 2023\n\nTENTANG\n\nPEMBERIAN APRESIASI BAGI MAHASISWA BEPRESTASI\nDAN DOSEN PEMBIMBING DI BIDANG KOMPETISI KEMAHASISWAAN INSTITUT TEKNOWGI SEPULUH NOPEMBER', '11. Peraturan Rektor Institut Tek:nologi Sepuluh Nopember Nomor 16 Tahun 2021 tentang Biaya Pendidikan;\n12. Peraturan Rektor Institut Tek:nologi Sepuluh Nopember Nomor 22 Tahun 2021 tentang Penyelenggaraan Kegiatan Merdeka Belajar Kampus Merdeka di Institut Teknologi Sepuluh Nopember;\n13. Peraturan Rektor Institut Tek:nologi Sepuluh Nopember Nomor 9 Tahun 2022 tentang Satuan Kegiatan Estra Kurikuler Mahasiswa Institut Teknologi Sepuluh Nopember;', 'Pasal 9\nKetentuan lebih lanjut mengenai syarat, prosedur dan bentuk apresiasi diatur lebih lanjut dalam petunjuk teknis Wakil Rektor yang membidangi kemahasiswaan.\n\nBAB VI\nKETENTUAN PENUTUP\n\nPasal 10\nPada saat Peraturan Rektor ini mulai berlaku, Peraturan Rektor Institut Teknologi Sepuluh Nopember Nomor 27 Tahun 2022 tentang Pemberian Apresiasi Bagi Mahasiswa Beprestasi dan Dosen Pembimbing di Bidang Kompetisi Kemahasiswaan lnstitut Teknologi Sepuluh Nopember, dicabut dan dinyatakan tidak berlaku.\n\nPasal 11\nPeraturan Rektor ini mulai berlaku pada tanggal ditetapkan.\n\nDitetapkan di Surabaya\npada tanggal 3 Januari 2023\nREKTOR INSTITUT TEKNOLOGI SEPULUH NOPEMBER,\n\n\n\n\nMOCHAMAD ASHARI\nNIP 196510121990031003', 'Menetapkan\n\nMEMUTUSKAN:\nPERATURAN REKTOR INSTITUT TEKNOLOGI SEPULUH NOPEMBER TENTANG PEMBERIAN APRESIASI BAGI MAHASISWA BEPRESTASI DAN DOSEN PEMBIMBING DI BIDANG KEMAHASISW AAN INSTITUT TEKNOLOGI SEPULUH NOPEMBER.\n\nBAB!\nKETENTUAN UMUM']",Saya tidak tahu.
15,Apa kode mata kuliah untuk Bahasa Inggris di Semester IUP?,Kode mata kuliah untuk Bahasa Inggris di Semester IUP adalah UG234914.,"['KEMENTERIAN PENDIDIKAN, KEBUDAYAAN, RISET, DAN TEKNOLOGI\nINSTITUT TEKNOLOGI SEPULUH NOPEMBER\n       Kampus ITS Sukolilo - Surabaya 60111 Telepon : 031-5994251-54, 5947274, 5945472 (Hunting)\nFax: 031-5947264, 5950806\nhttp://www.its.ac.id\n\n\nPERATURAN REKTOR INSTITUT TEKNOWGI SEPULUH NOPEMBER NOMOR 7 TAHUN 2023\n\nTENTANG\n\nPEMBERIAN APRESIASI BAGI MAHASISWA BEPRESTASI\nDAN DOSEN PEMBIMBING DI BIDANG KOMPETISI KEMAHASISWAAN INSTITUT TEKNOWGI SEPULUH NOPEMBER', 'BAB II MAKSUD DAN TUJUAN\n\nPasal 2\nPeraturan ini diterbitkan dengan maksud agar pimpinan ITS mempunyai pedoman dalam memberikan Apresiasi kepada Mahasiswa berprestasi dan Pembimbing di bidang kemahasiswaan.\n\n                               Pasal 3 Peraturan ini diterbitkan dengan tujuan:\na. memotivasi Mahasiswa agar berprestasi dalam berbagai kegiatan lomba; dan\nb. mendorong Pembimbing untuk melakukan pembinaan, pendampingan dan/atau pelatihan secara intensif kepada perorangan atau kelompok Mahasiswa.\n\nBAB III\nSYARAT DAN TINGKAT PRESTASI\n\nBagianKesatu\nSyarat Prestasi Lomba Kementerian\n\n\n\n(1) Syarat untuk Mahasiswa:\n\nPasal 4\n\na. Mahasiswa aktif yang terdaftar di sistem akademik ITS;', 'Pasal 1 Dalam peraturan ini yang dimaksud dengan:\n1. Institut Teknologi Sepuluh Nopember yang selanjutnya disebut ITS adalah perguruan tinggi negeri badan hulrum.\n2. Rektor adalah organ ITS yang memimpin penyelenggaraan dan pengelolaan ITS.\n3. Mahasiswa adalah peserta didik pada jenjang pendidikan tinggi di ITS.\n4. Pembimbing adalah dosen ITS yang mendapat Surat Keputusan Rektor untuk membina Mahasiswa mengikuti kegiatan kompetisi baik dalam skala nasional maupun internasional\n5. Dosen Penalaran adalah dosen ITS yang mendapat Surat Keputusan Rektor untuk membina Mahasiswa mengikuti kegiatan kompetisi yang diselenggarakan oleh Kementerian yang menangani urusan di bidang pendidikan tinggi baik dalam skala nasional maupun internasional.\n6. Apresiasi adalah bentuk reward selain penghargaan sebagaimana dimaksud dalam Peraturan Rektor lnstitut Teknologi Sepuluh Nopember Nomor 25 Tahun 2018 tentang Tata Cara Pemberian Penghargaan.', 'c. bahwa, berdasarkan pertimbangan sebagaimana dimaksud dalam huruf a dan huruf b, tersebut di atas, perlu ditetapkan peraturan Rektor Institut Teknologi Sepuluh Nopember tentang Pemberian Apresiasi Bagi Mahasiswa Berprestasi dan Dosen Pembimbing di Bidang Kompetisi Kemahasiswaan Institut Teknologi Sepuluh Nopember,']",Saya tidak tahu.
16,Di lantai mana kuliah Agama Islam di Semester Regular diadakan?,"Kuliah Agama Islam di Semester Regular diadakan di Tower 1, Lt. 5.","['KEMENTERIAN PENDIDIKAN, KEBUDAYAAN, RISET, DAN TEKNOLOGI\nINSTITUT TEKNOLOGI SEPULUH NOPEMBER\n       Kampus ITS Sukolilo - Surabaya 60111 Telepon : 031-5994251-54, 5947274, 5945472 (Hunting)\nFax: 031-5947264, 5950806\nhttp://www.its.ac.id\n\n\nPERATURAN REKTOR INSTITUT TEKNOWGI SEPULUH NOPEMBER NOMOR 7 TAHUN 2023\n\nTENTANG\n\nPEMBERIAN APRESIASI BAGI MAHASISWA BEPRESTASI\nDAN DOSEN PEMBIMBING DI BIDANG KOMPETISI KEMAHASISWAAN INSTITUT TEKNOWGI SEPULUH NOPEMBER', 'DENGAN RAHMAT TUHAN YANG MAHA ESA REKTOR INSTITUT TEKNOLOGI SEPULUH NOPEMBER,\nMenimbang : a. bahwa dalam rangka memotivasi mahasiswa dan dosen untuk berpartisipasi aktif dan berprestasi dalam berbagai kegiatan kemahasiswaan, perlu diberikan apresiasi yang berkeadilan dan terstruktur sesuai tingkatan prestasi yang telah dicapai;\nb. bahwa Peraturan Rektor Institut Teknologi Sepuluh Nopember Nomor 27 Tahun 2022 tentang Pemberian Apresiasi Bagi Mahasiswa Beprestasi dan Dosen Pembimbing di Bidang Kompetisi Kemahasiswaan Institut Teknologi Sepuluh Nopember perlu dilakukan penyesuaian memenuhi perkembangan akademik dan kemahasiswaan di lingkungan Institut Teknologi Sepuluh Nopember,', 'c. bahwa, berdasarkan pertimbangan sebagaimana dimaksud dalam huruf a dan huruf b, tersebut di atas, perlu ditetapkan peraturan Rektor Institut Teknologi Sepuluh Nopember tentang Pemberian Apresiasi Bagi Mahasiswa Berprestasi dan Dosen Pembimbing di Bidang Kompetisi Kemahasiswaan Institut Teknologi Sepuluh Nopember,', 'Pasal 1 Dalam peraturan ini yang dimaksud dengan:\n1. Institut Teknologi Sepuluh Nopember yang selanjutnya disebut ITS adalah perguruan tinggi negeri badan hulrum.\n2. Rektor adalah organ ITS yang memimpin penyelenggaraan dan pengelolaan ITS.\n3. Mahasiswa adalah peserta didik pada jenjang pendidikan tinggi di ITS.\n4. Pembimbing adalah dosen ITS yang mendapat Surat Keputusan Rektor untuk membina Mahasiswa mengikuti kegiatan kompetisi baik dalam skala nasional maupun internasional\n5. Dosen Penalaran adalah dosen ITS yang mendapat Surat Keputusan Rektor untuk membina Mahasiswa mengikuti kegiatan kompetisi yang diselenggarakan oleh Kementerian yang menangani urusan di bidang pendidikan tinggi baik dalam skala nasional maupun internasional.\n6. Apresiasi adalah bentuk reward selain penghargaan sebagaimana dimaksud dalam Peraturan Rektor lnstitut Teknologi Sepuluh Nopember Nomor 25 Tahun 2018 tentang Tata Cara Pemberian Penghargaan.']",Di lantai mana kuliah Agama Islam diadakan tidak dijelaskan dalam konteks yang diberikan. Sehingga saya tidak dapat memberikan jawaban atas pertanyaan tersebut.
17,Kapan waktu kuliah Fisika Mekanika di Semester Regular berlangsung?,"Kuliah Fisika Mekanika di Semester Regular berlangsung pada Senin dan Rabu, pukul 15.30-17.10.","['Pasal 9\nKetentuan lebih lanjut mengenai syarat, prosedur dan bentuk apresiasi diatur lebih lanjut dalam petunjuk teknis Wakil Rektor yang membidangi kemahasiswaan.\n\nBAB VI\nKETENTUAN PENUTUP\n\nPasal 10\nPada saat Peraturan Rektor ini mulai berlaku, Peraturan Rektor Institut Teknologi Sepuluh Nopember Nomor 27 Tahun 2022 tentang Pemberian Apresiasi Bagi Mahasiswa Beprestasi dan Dosen Pembimbing di Bidang Kompetisi Kemahasiswaan lnstitut Teknologi Sepuluh Nopember, dicabut dan dinyatakan tidak berlaku.\n\nPasal 11\nPeraturan Rektor ini mulai berlaku pada tanggal ditetapkan.\n\nDitetapkan di Surabaya\npada tanggal 3 Januari 2023\nREKTOR INSTITUT TEKNOLOGI SEPULUH NOPEMBER,\n\n\n\n\nMOCHAMAD ASHARI\nNIP 196510121990031003', '11. Peraturan Rektor Institut Tek:nologi Sepuluh Nopember Nomor 16 Tahun 2021 tentang Biaya Pendidikan;\n12. Peraturan Rektor Institut Tek:nologi Sepuluh Nopember Nomor 22 Tahun 2021 tentang Penyelenggaraan Kegiatan Merdeka Belajar Kampus Merdeka di Institut Teknologi Sepuluh Nopember;\n13. Peraturan Rektor Institut Tek:nologi Sepuluh Nopember Nomor 9 Tahun 2022 tentang Satuan Kegiatan Estra Kurikuler Mahasiswa Institut Teknologi Sepuluh Nopember;', '8. Peraturan Rektor Institut Tek:nologi Sepuluh Nopember Nomor 16 Tahun 2019 tentang Hak dan Kewajiban Mahasiswa lnstitut Tek:nologi Sepuluh Nopember;\n9. Peraturan Rektor Institut Tek:nologi Sepuluh Nopember Nomor 24 Tahun 2019 tentang Organisasi dan Tata Kerja Institut Tek:nologi Sepuluh Nopember sebagaimana telah diubah dengan Peraturan Rektor Institut Teknologi Sepuluh Nopember Nomor 30 Tahun 2022 tentang Perubahan atas Peraturan Rektor Institut Teknologi Sepuluh Nopember Nomor 24 Tahun 2019;\n10. Peraturan Rektor Institut Teknologi Sepuluh Nopember Nomor 26 Tahun 2019 tentang Organisasi dan Tata Kerja Sekretaris lnstitut, Direktorat, Biro, Kantor, Perpustakaan, dan Unit di Lingkungan Institut Teknologi Sepuluh Nopember sebagaimana telah diubah terakhir dengan Peraturan Rektor Institut Teknologi Sepuluh Nopember Nomor 22 Tahun 2022 tentang Perubahan Kedua Peraturan Rektor Institut Teknologi Sepuluh Nopember Nomor 26 Tahun 2019;', 'KEMENTERIAN PENDIDIKAN, KEBUDAYAAN, RISET, DAN TEKNOLOGI\nINSTITUT TEKNOLOGI SEPULUH NOPEMBER\n       Kampus ITS Sukolilo - Surabaya 60111 Telepon : 031-5994251-54, 5947274, 5945472 (Hunting)\nFax: 031-5947264, 5950806\nhttp://www.its.ac.id\n\n\nPERATURAN REKTOR INSTITUT TEKNOWGI SEPULUH NOPEMBER NOMOR 7 TAHUN 2023\n\nTENTANG\n\nPEMBERIAN APRESIASI BAGI MAHASISWA BEPRESTASI\nDAN DOSEN PEMBIMBING DI BIDANG KOMPETISI KEMAHASISWAAN INSTITUT TEKNOWGI SEPULUH NOPEMBER']",Saya tidak tahu.
18,Berapa jumlah SKS untuk mata kuliah Matematika di Semester IUP? ,Mata kuliah Matematika di Semester IUP memiliki 2 SKS.,"['KEMENTERIAN PENDIDIKAN, KEBUDAYAAN, RISET, DAN TEKNOLOGI\nINSTITUT TEKNOLOGI SEPULUH NOPEMBER\n       Kampus ITS Sukolilo - Surabaya 60111 Telepon : 031-5994251-54, 5947274, 5945472 (Hunting)\nFax: 031-5947264, 5950806\nhttp://www.its.ac.id\n\n\nPERATURAN REKTOR INSTITUT TEKNOWGI SEPULUH NOPEMBER NOMOR 7 TAHUN 2023\n\nTENTANG\n\nPEMBERIAN APRESIASI BAGI MAHASISWA BEPRESTASI\nDAN DOSEN PEMBIMBING DI BIDANG KOMPETISI KEMAHASISWAAN INSTITUT TEKNOWGI SEPULUH NOPEMBER', '11. Peraturan Rektor Institut Tek:nologi Sepuluh Nopember Nomor 16 Tahun 2021 tentang Biaya Pendidikan;\n12. Peraturan Rektor Institut Tek:nologi Sepuluh Nopember Nomor 22 Tahun 2021 tentang Penyelenggaraan Kegiatan Merdeka Belajar Kampus Merdeka di Institut Teknologi Sepuluh Nopember;\n13. Peraturan Rektor Institut Tek:nologi Sepuluh Nopember Nomor 9 Tahun 2022 tentang Satuan Kegiatan Estra Kurikuler Mahasiswa Institut Teknologi Sepuluh Nopember;', 'Mengingat  : 1. Undang-Undang Nomor 12 Tahun 2012 tentang Pendidikan Tinggi (Lembaran Negara Republik Indonesia Tahun 2012 Nomor 158, Tambahan Lembaran Negara Republik Indonesia Nomor 5336);\n2. Peraturan Pemerintah Nomor 4 Tahun 2014 tentang Penyelenggaraan Pendidikan Tinggi dan Pengelolaan Perguruan Tinggi (Lembaran Negara Republik Indonesia Tahun 2014 Nomor 16, Tambahan Lembaran Negara Republik Indonesia Nomor 5500);', 'Pasal 1 Dalam peraturan ini yang dimaksud dengan:\n1. Institut Teknologi Sepuluh Nopember yang selanjutnya disebut ITS adalah perguruan tinggi negeri badan hulrum.\n2. Rektor adalah organ ITS yang memimpin penyelenggaraan dan pengelolaan ITS.\n3. Mahasiswa adalah peserta didik pada jenjang pendidikan tinggi di ITS.\n4. Pembimbing adalah dosen ITS yang mendapat Surat Keputusan Rektor untuk membina Mahasiswa mengikuti kegiatan kompetisi baik dalam skala nasional maupun internasional\n5. Dosen Penalaran adalah dosen ITS yang mendapat Surat Keputusan Rektor untuk membina Mahasiswa mengikuti kegiatan kompetisi yang diselenggarakan oleh Kementerian yang menangani urusan di bidang pendidikan tinggi baik dalam skala nasional maupun internasional.\n6. Apresiasi adalah bentuk reward selain penghargaan sebagaimana dimaksud dalam Peraturan Rektor lnstitut Teknologi Sepuluh Nopember Nomor 25 Tahun 2018 tentang Tata Cara Pemberian Penghargaan.']",Saya tidak menemukan informasi mengenai jumlah SKS untuk mata kuliah Matematika di Semester IUP dalam konteks yang diberikan.
19,Apa hari dan jam kuliah untuk Bahasa Indonesia di Semester IUP?,"Kuliah Bahasa Indonesia di Semester IUP berlangsung pada Kamis, pukul 13.30-15.10.","['KEMENTERIAN PENDIDIKAN, KEBUDAYAAN, RISET, DAN TEKNOLOGI\nINSTITUT TEKNOLOGI SEPULUH NOPEMBER\n       Kampus ITS Sukolilo - Surabaya 60111 Telepon : 031-5994251-54, 5947274, 5945472 (Hunting)\nFax: 031-5947264, 5950806\nhttp://www.its.ac.id\n\n\nPERATURAN REKTOR INSTITUT TEKNOWGI SEPULUH NOPEMBER NOMOR 7 TAHUN 2023\n\nTENTANG\n\nPEMBERIAN APRESIASI BAGI MAHASISWA BEPRESTASI\nDAN DOSEN PEMBIMBING DI BIDANG KOMPETISI KEMAHASISWAAN INSTITUT TEKNOWGI SEPULUH NOPEMBER', '11. Peraturan Rektor Institut Tek:nologi Sepuluh Nopember Nomor 16 Tahun 2021 tentang Biaya Pendidikan;\n12. Peraturan Rektor Institut Tek:nologi Sepuluh Nopember Nomor 22 Tahun 2021 tentang Penyelenggaraan Kegiatan Merdeka Belajar Kampus Merdeka di Institut Teknologi Sepuluh Nopember;\n13. Peraturan Rektor Institut Tek:nologi Sepuluh Nopember Nomor 9 Tahun 2022 tentang Satuan Kegiatan Estra Kurikuler Mahasiswa Institut Teknologi Sepuluh Nopember;', 'Pasal 9\nKetentuan lebih lanjut mengenai syarat, prosedur dan bentuk apresiasi diatur lebih lanjut dalam petunjuk teknis Wakil Rektor yang membidangi kemahasiswaan.\n\nBAB VI\nKETENTUAN PENUTUP\n\nPasal 10\nPada saat Peraturan Rektor ini mulai berlaku, Peraturan Rektor Institut Teknologi Sepuluh Nopember Nomor 27 Tahun 2022 tentang Pemberian Apresiasi Bagi Mahasiswa Beprestasi dan Dosen Pembimbing di Bidang Kompetisi Kemahasiswaan lnstitut Teknologi Sepuluh Nopember, dicabut dan dinyatakan tidak berlaku.\n\nPasal 11\nPeraturan Rektor ini mulai berlaku pada tanggal ditetapkan.\n\nDitetapkan di Surabaya\npada tanggal 3 Januari 2023\nREKTOR INSTITUT TEKNOLOGI SEPULUH NOPEMBER,\n\n\n\n\nMOCHAMAD ASHARI\nNIP 196510121990031003', 'Mengingat  : 1. Undang-Undang Nomor 12 Tahun 2012 tentang Pendidikan Tinggi (Lembaran Negara Republik Indonesia Tahun 2012 Nomor 158, Tambahan Lembaran Negara Republik Indonesia Nomor 5336);\n2. Peraturan Pemerintah Nomor 4 Tahun 2014 tentang Penyelenggaraan Pendidikan Tinggi dan Pengelolaan Perguruan Tinggi (Lembaran Negara Republik Indonesia Tahun 2014 Nomor 16, Tambahan Lembaran Negara Republik Indonesia Nomor 5500);']",Saya tidak menemukan informasi mengenai jadwal kuliah Bahasa Indonesia di Semester IUP dalam konteks yang diberikan.
