,question,answer,contexts,ground_truth,context_precision,faithfulness,answer_relevancy,context_recall
0,Di mana lokasi kelas 'Kimia 1' untuk program reguler?,"Kelas 'Kimia 1' untuk program reguler berlokasi di Tower 1, Lt. 2, ruang TW1-205 pada hari Senin dan Rabu pukul 15.30-17.10.","[""UG234914 Bahasa Inggris 2 â‰¥6 1 Semua Departemen Jum'at, 13.30-15.10 TW1-201 Tower 1, Lt. 2\nKode MK Mata Kuliah IUP SKS Semester\nNama\nKelas\nKode Departemen Hari / Pukul Ruang Lokasi Ruang\nUG234911 Pancasila 2 â‰¥6 1 Semua Departemen Senin, 07.00-08.40 TW1-304 Tower 1, Lt. 3\nUG234913 Kewarganegaraan 2 â‰¥6 1 Semua Departemen Selasa, 11.00-12.40 TW1-304 Tower 1, Lt. 3\nUG234901 Agama Islam 2 â‰¥6 1 Semua Departemen Kamis, 09.00-10.40 TW1-304 Tower 1, Lt. 3\nUG234912 Bahasa Indonesia 2 â‰¥6 1 Semua Departemen Kamis, 13.30-15.10 TW1-304 Tower 1, Lt. 3\nUG234914 Bahasa Inggris 2 â‰¥6 1 Semua Departemen Kamis, 11.00-12.40 TW1-304 Tower 1, Lt. 3\nSKPB, 24 Januari 2024""
 'sesuai Kode Mata Kuliah\nSenin, Rabu; 15.30-17.10 TW1-205 Tower 1, Lt. 2\nSK234101 Kimia 1 4 â‰¥4 1\nSemua Departemen\nsesuai Kode Mata Kuliah\nSelasa, Kamis; 07.00-08.40 TW1-503 Tower 1, Lt. 5\nKode MK Mata Kuliah IUP SKS Semester\nNama\nKelas\nKode Departemen Hari / Pukul Ruang Lokasi Ruang\nSM234101 Kalkulus 1 3 â‰¥4 2\nSemua Departemen\nsesuai Kode Mata Kuliah\nSenin, Rabu; 15.30-17.10 TW1-606 Tower 1, Lt. 6\nSM234152 Matematika 2 â‰¥4 2\nSemua Departemen\nsesuai Kode Mata Kuliah\nSenin, 15.30-17.10 TW1-304 Tower 1, Lt. 3\nSF234101 Fisika 1 5 â‰¥4 2\nSemua Departemen\nsesuai Kode Mata Kuliah\nSelasa, Kamis; 15.30-17.10 TW1-506 Tower 1, Lt. 5\nSF234102 Fisika Mekanika 4 â‰¥4 2\nSemua Departemen\nsesuai Kode Mata Kuliah\nSelasa, Kamis; 15.30-17.10 TW1-606 Tower 1, Lt. 6\nSF234103 Fisika Mekanika 3 â‰¥4 2\nSemua Departemen\nsesuai Kode Mata Kuliah\nSelasa, Kamis; 15.30-17.10 TW1-706 Tower 1, Lt. 7\nSF234204 Fisika Dasar 3 â‰¥4 2\nSemua Departemen\nsesuai Kode Mata Kuliah\nSelasa, Kamis; 15.30-17.10 TW1-806 Tower 1, Lt. 8'
 'Purnomo,,,,,Petugas Keamanan (Parkir),\nSoegeng Santoso,,,,,Pengadministrasi Umum,\nJumali,,,,,Teknisi Laboratorium,""KBJ, RPL, Aula""\nEdy Lukito,,,,,Pengelola Instalasi Teknologi Informasi,LP 2\nKunto Hermono,,,,,Teknisi Laboratorium,""AJK, Lab Pasca S2, Lab Kerjasama S3, Lab Residensi S3""\nLina Ambarwati,,,,,Pengadministrasi Akademik Prodi Pascasarjana (S3),\nMuhammad Chusaeni,,,,,Kepala Subbagian Tata Usaha DTIF,\nHari Pramono,,,,,Teknisi Pemeliharaan Sarana dan Prasarana (Departemen),\nGayuh Adi Rustanto,,,,,Teknisi Laboratorium,""MCI, GIGa, AP""\nAhmad Junaidi Abdillah,,,,,Teknisi Laboratorium,""LP 1, KCV""\nMochamad Suchron,,,,,Pramu Bakti,\nChafrida Devi Viantika Sari,,,,,Pengelola Keuangan,\nKartika Dwi Yuniavita Rahmawati,,,,,Pengadministrasi Akademik Prodi Pascasarjana (S2),\nInka Novita Dinia,,,,,Pengadministrasi Akademik (Sarjana/Sarjana Terapan),\nDue Nashrunisa,,,,,Pengelola Keuangan,\nRif\'atus Sholichah,,,,,Pengadministrasi Akademik (Sarjana/Sarjana Terapan),'
 'BAB V BENTUK APRESIASI\n\nPasal 8\n(1) Apresiasi Lomba Kementerian dan        Lomba Mandiri bagi dosen Pembimbing kompetisi yang diikuti oleh Mahasiswa yang meraih medali/juara berupa:\na. piagam/ sertifikat atau t.anda jasa;\nb. angka kredit kepegawaian (Kum B) untuk Beban Kerja Dosen (BKD) yang terintegrasi dengan sistem informasi kepegawaian ITS; dan/atau\nc. reward sesuai dengan SBI.\n(2) Apresiasi Lomba Kementerian dan Lomba Mandiri bagi Mahasiswa berupa:\na. reward sesuai dengan SBI;\nb. konversi nilai akademik (SKS) untuk setiap lomba yang diputuskan oleh tim\nreviewer Departemen;\nc. konversi nilai Satuan Kredit Ekstrakurikuler Mahasiswa (SKEM) untuk setiap lomba yang diputuskan oleh tim review direktorat yang mengurusi kemahasiswaan;dan/atau\nd. beasiswa Magister di seluruh program studi yang ada di ITS selama waktu\nyang ditentukan.\n(3) Setiap perolehan medali/juara di setiap kompetisi sebagaimana disebutkan dalam Pasal 6 ayat (2) juga mendapatkan apresiasi berupa nominal uang.']","Kelas 'Kimia 1' dilaksanakan di ruangan TW1-503, Tower 1, Lt. 5.",,0.99999999995,0.5,0.9099823168870277
1,Dimana kelas 'Agama Islam' untuk program reguler dilaksanakan?,"Kelas 'Agama Islam' untuk program reguler dilaksanakan pada hari Kamis, pukul 09.00-10.40 di ruang TW1-304 Tower 1, Lt. 3.","['BAB V BENTUK APRESIASI\n\nPasal 8\n(1) Apresiasi Lomba Kementerian dan        Lomba Mandiri bagi dosen Pembimbing kompetisi yang diikuti oleh Mahasiswa yang meraih medali/juara berupa:\na. piagam/ sertifikat atau t.anda jasa;\nb. angka kredit kepegawaian (Kum B) untuk Beban Kerja Dosen (BKD) yang terintegrasi dengan sistem informasi kepegawaian ITS; dan/atau\nc. reward sesuai dengan SBI.\n(2) Apresiasi Lomba Kementerian dan Lomba Mandiri bagi Mahasiswa berupa:\na. reward sesuai dengan SBI;\nb. konversi nilai akademik (SKS) untuk setiap lomba yang diputuskan oleh tim\nreviewer Departemen;\nc. konversi nilai Satuan Kredit Ekstrakurikuler Mahasiswa (SKEM) untuk setiap lomba yang diputuskan oleh tim review direktorat yang mengurusi kemahasiswaan;dan/atau\nd. beasiswa Magister di seluruh program studi yang ada di ITS selama waktu\nyang ditentukan.\n(3) Setiap perolehan medali/juara di setiap kompetisi sebagaimana disebutkan dalam Pasal 6 ayat (2) juga mendapatkan apresiasi berupa nominal uang.'
 'Pasal 1 Dalam peraturan ini yang dimaksud dengan:\n1. Institut Teknologi Sepuluh Nopember yang selanjutnya disebut ITS adalah perguruan tinggi negeri badan hulrum.\n2. Rektor adalah organ ITS yang memimpin penyelenggaraan dan pengelolaan ITS.\n3. Mahasiswa adalah peserta didik pada jenjang pendidikan tinggi di ITS.\n4. Pembimbing adalah dosen ITS yang mendapat Surat Keputusan Rektor untuk membina Mahasiswa mengikuti kegiatan kompetisi baik dalam skala nasional maupun internasional\n5. Dosen Penalaran adalah dosen ITS yang mendapat Surat Keputusan Rektor untuk membina Mahasiswa mengikuti kegiatan kompetisi yang diselenggarakan oleh Kementerian yang menangani urusan di bidang pendidikan tinggi baik dalam skala nasional maupun internasional.\n6. Apresiasi adalah bentuk reward selain penghargaan sebagaimana dimaksud dalam Peraturan Rektor lnstitut Teknologi Sepuluh Nopember Nomor 25 Tahun 2018 tentang Tata Cara Pemberian Penghargaan.'
 'Pasal 9\nKetentuan lebih lanjut mengenai syarat, prosedur dan bentuk apresiasi diatur lebih lanjut dalam petunjuk teknis Wakil Rektor yang membidangi kemahasiswaan.\n\nBAB VI\nKETENTUAN PENUTUP\n\nPasal 10\nPada saat Peraturan Rektor ini mulai berlaku, Peraturan Rektor Institut Teknologi Sepuluh Nopember Nomor 27 Tahun 2022 tentang Pemberian Apresiasi Bagi Mahasiswa Beprestasi dan Dosen Pembimbing di Bidang Kompetisi Kemahasiswaan lnstitut Teknologi Sepuluh Nopember, dicabut dan dinyatakan tidak berlaku.\n\nPasal 11\nPeraturan Rektor ini mulai berlaku pada tanggal ditetapkan.\n\nDitetapkan di Surabaya\npada tanggal 3 Januari 2023\nREKTOR INSTITUT TEKNOLOGI SEPULUH NOPEMBER,\n\n\n\n\nMOCHAMAD ASHARI\nNIP 196510121990031003'
 ""UG234914 Bahasa Inggris 2 â‰¥6 1 Semua Departemen Jum'at, 13.30-15.10 TW1-201 Tower 1, Lt. 2\nKode MK Mata Kuliah IUP SKS Semester\nNama\nKelas\nKode Departemen Hari / Pukul Ruang Lokasi Ruang\nUG234911 Pancasila 2 â‰¥6 1 Semua Departemen Senin, 07.00-08.40 TW1-304 Tower 1, Lt. 3\nUG234913 Kewarganegaraan 2 â‰¥6 1 Semua Departemen Selasa, 11.00-12.40 TW1-304 Tower 1, Lt. 3\nUG234901 Agama Islam 2 â‰¥6 1 Semua Departemen Kamis, 09.00-10.40 TW1-304 Tower 1, Lt. 3\nUG234912 Bahasa Indonesia 2 â‰¥6 1 Semua Departemen Kamis, 13.30-15.10 TW1-304 Tower 1, Lt. 3\nUG234914 Bahasa Inggris 2 â‰¥6 1 Semua Departemen Kamis, 11.00-12.40 TW1-304 Tower 1, Lt. 3\nSKPB, 24 Januari 2024""]","Kelas 'Agama Islam' dilaksanakan di ruangan TW1-505, Tower 1, Lt. 5.",1.0,0.499999999975,1.0,0.9058472771596602
2,Dimana lokasi kelas 'Fisika Mekanika 4' untuk program IUP?,"Kelas 'Fisika Mekanika 4' untuk program IUP berlokasi di Tower 1, Lt. 6, pada hari Selasa dan Kamis pukul 15.30-17.10, ruang TW1-606.","[""sesuai Kode Mata Kuliah\nSelasa, Kamis; 15.30-17.10 TW1-706 Tower 1, Lt. 7\nSF234204 Fisika Dasar 3 â‰¥4 2\nSemua Departemen\nsesuai Kode Mata Kuliah\nSelasa, Kamis; 15.30-17.10 TW1-806 Tower 1, Lt. 8\nSK234101 Kimia 1 4 â‰¥4 2\nSemua Departemen\nsesuai Kode Mata Kuliah\nSelasa, Kamis; 13.30-15.10 TW1-706 Tower 1, Lt. 7\nKode MK Mata Kuliah Reg SKS Semester\nNama\nKelas\nKode Departemen Hari / Pukul Ruang Lokasi Ruang\nUG234911 Pancasila 2 2 dan â‰¥6 1\n5055 dan Semua\nDepartemen\nSenin, 13.30-15.10 TW1-605 Tower 1, Lt. 6\nUG234913 Kewarganegaraan 2 2 dan â‰¥6 1\n5055 dan Semua\nDepartemen\nSelasa, 13.30-15.10 TW1-206 Tower 1, Lt. 2\nUG234901 Agama Islam 2 â‰¥6 1 Semua Departemen Kamis, 07.00-08.40 TW1-505 Tower 1, Lt. 5\nUG234912 Bahasa Indonesia 2 â‰¥6 1 Semua Departemen Jum'at, 09.00-10.40 TW1-601 Tower 1, Lt. 6\nUG234914 Bahasa Inggris 2 â‰¥6 1 Semua Departemen Jum'at, 13.30-15.10 TW1-201 Tower 1, Lt. 2\nKode MK Mata Kuliah IUP SKS Semester\nNama\nKelas\nKode Departemen Hari / Pukul Ruang Lokasi Ruang""
 'sesuai Kode Mata Kuliah\nSenin, Rabu; 15.30-17.10 TW1-205 Tower 1, Lt. 2\nSK234101 Kimia 1 4 â‰¥4 1\nSemua Departemen\nsesuai Kode Mata Kuliah\nSelasa, Kamis; 07.00-08.40 TW1-503 Tower 1, Lt. 5\nKode MK Mata Kuliah IUP SKS Semester\nNama\nKelas\nKode Departemen Hari / Pukul Ruang Lokasi Ruang\nSM234101 Kalkulus 1 3 â‰¥4 2\nSemua Departemen\nsesuai Kode Mata Kuliah\nSenin, Rabu; 15.30-17.10 TW1-606 Tower 1, Lt. 6\nSM234152 Matematika 2 â‰¥4 2\nSemua Departemen\nsesuai Kode Mata Kuliah\nSenin, 15.30-17.10 TW1-304 Tower 1, Lt. 3\nSF234101 Fisika 1 5 â‰¥4 2\nSemua Departemen\nsesuai Kode Mata Kuliah\nSelasa, Kamis; 15.30-17.10 TW1-506 Tower 1, Lt. 5\nSF234102 Fisika Mekanika 4 â‰¥4 2\nSemua Departemen\nsesuai Kode Mata Kuliah\nSelasa, Kamis; 15.30-17.10 TW1-606 Tower 1, Lt. 6\nSF234103 Fisika Mekanika 3 â‰¥4 2\nSemua Departemen\nsesuai Kode Mata Kuliah\nSelasa, Kamis; 15.30-17.10 TW1-706 Tower 1, Lt. 7\nSF234204 Fisika Dasar 3 â‰¥4 2\nSemua Departemen\nsesuai Kode Mata Kuliah\nSelasa, Kamis; 15.30-17.10 TW1-806 Tower 1, Lt. 8'
 'Q: MyITS saya bermasalah, bisa lapor kemana?\n\nA: Silakan ajukan tiket ke DPTSI di https://servicedesk.its.ac.id/\n\nQ: Saya ingin mengurus â€œâ€¦..â€ siapa tendik yang harus ditemui?\n\nA: Temui tendik sesuai bidangnya yuk! :)\n\nPersuratan (S1) â†’ Pak Sugeng\nAkademik (S1) â†’ Bu Inka (Kelas, Nilai, MBKM, International Exposure), Bu Icha (Asisten Dosen, MonKP)\nAkademik + Persuratan (S2) â†’ Bu Kartika\nAkademik + Persuratan (S3) â†’ Bu Lina\nPeminjaman Ruang â†’ Pak Husein (Kasubbag)\nKeuangan â†’ Bu Devi, Bu Due\nUrusan Ruang Aula â†’ Pak Jumali\nUrusan Ruang Kelas â†’ Pak Edy\nUrusan Laboratorium â†’ Teknisi Lab. Pak Junaidi (PKT, KCV, LP), Pak Jumali (KBJ, RPL), Pak Gayuh (AP, MCI, GiGA), Pak Kunto (AJK).\nUrusan Keamanan dan Kebersihan â†’ Pak Sukron\nUrusan Kelistrikan â†’ Pak Hari\nQ: Cara mendapatkan transkrip\n\nA: Buka SIM Akademik, masuk ke menu LAPORAN -> TRANSKRIP\n\nQ: Cara mendapatkan surat keterangan aktif mahasiswa\n\nA: Buka SIM Akademik, masuk ke menu SURAT MAHASISWA -> LAYANAN SURAT MAHASISWA'
 ""UG234914 Bahasa Inggris 2 â‰¥6 1 Semua Departemen Jum'at, 13.30-15.10 TW1-201 Tower 1, Lt. 2\nKode MK Mata Kuliah IUP SKS Semester\nNama\nKelas\nKode Departemen Hari / Pukul Ruang Lokasi Ruang\nUG234911 Pancasila 2 â‰¥6 1 Semua Departemen Senin, 07.00-08.40 TW1-304 Tower 1, Lt. 3\nUG234913 Kewarganegaraan 2 â‰¥6 1 Semua Departemen Selasa, 11.00-12.40 TW1-304 Tower 1, Lt. 3\nUG234901 Agama Islam 2 â‰¥6 1 Semua Departemen Kamis, 09.00-10.40 TW1-304 Tower 1, Lt. 3\nUG234912 Bahasa Indonesia 2 â‰¥6 1 Semua Departemen Kamis, 13.30-15.10 TW1-304 Tower 1, Lt. 3\nUG234914 Bahasa Inggris 2 â‰¥6 1 Semua Departemen Kamis, 11.00-12.40 TW1-304 Tower 1, Lt. 3\nSKPB, 24 Januari 2024""]","Kelas 'Fisika Mekanika 4' dilaksanakan di ruangan TW1-606, Tower 1, Lt. 6.",0.0,0.9166666666361111,1.0,0.7764932899597182
3,Apa kode mata kuliah 'Fisika 1' untuk program IUP?,Saya tidak tahu.,"[""sesuai Kode Mata Kuliah\nSelasa, Kamis; 15.30-17.10 TW1-706 Tower 1, Lt. 7\nSF234204 Fisika Dasar 3 â‰¥4 2\nSemua Departemen\nsesuai Kode Mata Kuliah\nSelasa, Kamis; 15.30-17.10 TW1-806 Tower 1, Lt. 8\nSK234101 Kimia 1 4 â‰¥4 2\nSemua Departemen\nsesuai Kode Mata Kuliah\nSelasa, Kamis; 13.30-15.10 TW1-706 Tower 1, Lt. 7\nKode MK Mata Kuliah Reg SKS Semester\nNama\nKelas\nKode Departemen Hari / Pukul Ruang Lokasi Ruang\nUG234911 Pancasila 2 2 dan â‰¥6 1\n5055 dan Semua\nDepartemen\nSenin, 13.30-15.10 TW1-605 Tower 1, Lt. 6\nUG234913 Kewarganegaraan 2 2 dan â‰¥6 1\n5055 dan Semua\nDepartemen\nSelasa, 13.30-15.10 TW1-206 Tower 1, Lt. 2\nUG234901 Agama Islam 2 â‰¥6 1 Semua Departemen Kamis, 07.00-08.40 TW1-505 Tower 1, Lt. 5\nUG234912 Bahasa Indonesia 2 â‰¥6 1 Semua Departemen Jum'at, 09.00-10.40 TW1-601 Tower 1, Lt. 6\nUG234914 Bahasa Inggris 2 â‰¥6 1 Semua Departemen Jum'at, 13.30-15.10 TW1-201 Tower 1, Lt. 2\nKode MK Mata Kuliah IUP SKS Semester\nNama\nKelas\nKode Departemen Hari / Pukul Ruang Lokasi Ruang""
 'sesuai Kode Mata Kuliah\nSenin, Rabu; 15.30-17.10 TW1-205 Tower 1, Lt. 2\nSK234101 Kimia 1 4 â‰¥4 1\nSemua Departemen\nsesuai Kode Mata Kuliah\nSelasa, Kamis; 07.00-08.40 TW1-503 Tower 1, Lt. 5\nKode MK Mata Kuliah IUP SKS Semester\nNama\nKelas\nKode Departemen Hari / Pukul Ruang Lokasi Ruang\nSM234101 Kalkulus 1 3 â‰¥4 2\nSemua Departemen\nsesuai Kode Mata Kuliah\nSenin, Rabu; 15.30-17.10 TW1-606 Tower 1, Lt. 6\nSM234152 Matematika 2 â‰¥4 2\nSemua Departemen\nsesuai Kode Mata Kuliah\nSenin, 15.30-17.10 TW1-304 Tower 1, Lt. 3\nSF234101 Fisika 1 5 â‰¥4 2\nSemua Departemen\nsesuai Kode Mata Kuliah\nSelasa, Kamis; 15.30-17.10 TW1-506 Tower 1, Lt. 5\nSF234102 Fisika Mekanika 4 â‰¥4 2\nSemua Departemen\nsesuai Kode Mata Kuliah\nSelasa, Kamis; 15.30-17.10 TW1-606 Tower 1, Lt. 6\nSF234103 Fisika Mekanika 3 â‰¥4 2\nSemua Departemen\nsesuai Kode Mata Kuliah\nSelasa, Kamis; 15.30-17.10 TW1-706 Tower 1, Lt. 7\nSF234204 Fisika Dasar 3 â‰¥4 2\nSemua Departemen\nsesuai Kode Mata Kuliah\nSelasa, Kamis; 15.30-17.10 TW1-806 Tower 1, Lt. 8'
 'Pasal 9\nKetentuan lebih lanjut mengenai syarat, prosedur dan bentuk apresiasi diatur lebih lanjut dalam petunjuk teknis Wakil Rektor yang membidangi kemahasiswaan.\n\nBAB VI\nKETENTUAN PENUTUP\n\nPasal 10\nPada saat Peraturan Rektor ini mulai berlaku, Peraturan Rektor Institut Teknologi Sepuluh Nopember Nomor 27 Tahun 2022 tentang Pemberian Apresiasi Bagi Mahasiswa Beprestasi dan Dosen Pembimbing di Bidang Kompetisi Kemahasiswaan lnstitut Teknologi Sepuluh Nopember, dicabut dan dinyatakan tidak berlaku.\n\nPasal 11\nPeraturan Rektor ini mulai berlaku pada tanggal ditetapkan.\n\nDitetapkan di Surabaya\npada tanggal 3 Januari 2023\nREKTOR INSTITUT TEKNOLOGI SEPULUH NOPEMBER,\n\n\n\n\nMOCHAMAD ASHARI\nNIP 196510121990031003'
 'Mengingat  : 1. Undang-Undang Nomor 12 Tahun 2012 tentang Pendidikan Tinggi (Lembaran Negara Republik Indonesia Tahun 2012 Nomor 158, Tambahan Lembaran Negara Republik Indonesia Nomor 5336);\n2. Peraturan Pemerintah Nomor 4 Tahun 2014 tentang Penyelenggaraan Pendidikan Tinggi dan Pengelolaan Perguruan Tinggi (Lembaran Negara Republik Indonesia Tahun 2014 Nomor 16, Tambahan Lembaran Negara Republik Indonesia Nomor 5500);']",Kode mata kuliah 'Fisika 1' adalah SF234101.,1.0,0.9166666666361111,0.0,0.0
4,Apa yang harus dilakukan jika tidak bisa ambil MK di FRS tapi prasyarat sudah terpenuhi?,"Jawaban: Jika tidak bisa mengambil mata kuliah (MK) di Formulir Rencana Studi (FRS) meskipun prasyarat sudah terpenuhi, Anda dapat menghubungi admin atau pihak terkait di departemen atau fakultas Anda untuk mendapatkan bantuan lebih lanjut. Mereka dapat membantu menyelesaikan masalah tersebut dan memberikan solusi yang tepat. Jangan ragu untuk meminta bantuan jika mengalami kendala dalam proses pengambilan MK.","['Q: Apakah MK yang diambil via dropdown MBKM bisa menggantikan MK yang sudah diambil?\n\nA: TIDAK BISA!\n\nQ: Apakah MK Magang bisa menggantikan MK pilihan yang sudah diambil?\n\nA: TIDAK BISA. MK Magang berbobot 9 sks dan mengisi kewajiban 15 sks minimal MK pilihan. Jika pernah mengambil MK pilhan dan tidak lulus, maka WAJIB DIULANG sampai lulus.\n\nCatatan âœðŸ»\n\nTentang MBKM & KP, Pengajuan Cuti, Pengunduran Diri, TA, Yudisium, dan Wisuda dapat dicek pada menu terkait. Jika tetap tidak menemukan jawaban, tanyakan pada admin.'
 'Q: MyITS saya bermasalah, bisa lapor kemana?\n\nA: Silakan ajukan tiket ke DPTSI di https://servicedesk.its.ac.id/\n\nQ: Saya ingin mengurus â€œâ€¦..â€ siapa tendik yang harus ditemui?\n\nA: Temui tendik sesuai bidangnya yuk! :)\n\nPersuratan (S1) â†’ Pak Sugeng\nAkademik (S1) â†’ Bu Inka (Kelas, Nilai, MBKM, International Exposure), Bu Icha (Asisten Dosen, MonKP)\nAkademik + Persuratan (S2) â†’ Bu Kartika\nAkademik + Persuratan (S3) â†’ Bu Lina\nPeminjaman Ruang â†’ Pak Husein (Kasubbag)\nKeuangan â†’ Bu Devi, Bu Due\nUrusan Ruang Aula â†’ Pak Jumali\nUrusan Ruang Kelas â†’ Pak Edy\nUrusan Laboratorium â†’ Teknisi Lab. Pak Junaidi (PKT, KCV, LP), Pak Jumali (KBJ, RPL), Pak Gayuh (AP, MCI, GiGA), Pak Kunto (AJK).\nUrusan Keamanan dan Kebersihan â†’ Pak Sukron\nUrusan Kelistrikan â†’ Pak Hari\nQ: Cara mendapatkan transkrip\n\nA: Buka SIM Akademik, masuk ke menu LAPORAN -> TRANSKRIP\n\nQ: Cara mendapatkan surat keterangan aktif mahasiswa\n\nA: Buka SIM Akademik, masuk ke menu SURAT MAHASISWA -> LAYANAN SURAT MAHASISWA'
 'Dosen & Tendik di Departemen Teknik Informatika ðŸ‘¥\nNama Dosen/Tendik,Kode Dosen,RMK,Email,NIP/NPP,Role Tendik,PIC Laboratorium\n""Prof. Ir. Supeno Djanali, M.Sc., Ph.D."",SD,AJK,supeno@its.ac.id,8859390019,,\n""Prof. Ir. Handayani Tjandrasa, M.Sc., Ph.D."",HT,KCV,handatj@its.ac.id,8866323419,,\n""Prof. Drs.Ec. Ir. Riyanarto Sarno, M.Sc., Ph.D."",RS,MCI,riyanarto@if.its.ac.id,19590803 198601 1 001,,\n""Prof. Dr. Ir. Joko Lianto Buliali, M.Sc."",JL,PKT,joko@if.its.ac.id,19670727 199203 1 002,,\n""Ir. Siti Rochimah, M.T., Ph.D."",ST,RPL,siti@if.its.ac.id,19681002 199403 2 001,,\n""Victor Hariadi, S.Si., M.Kom."",VH,PKT,victor@if.its.ac.id,19691228 199412 1 001,,\n""Rully Soelaiman, S.Kom., M.Kom."",RL,AP,rully@if.its.ac.id,19700213 199402 1 001,,\n""Dr. Yudhi Purwananto, S.Kom., M.Kom."",YP,AP,yudhi@if.its.ac.id,19700714 199703 1 002,,\n""Prof. Dr.Eng. Nanik Suciati, S.Kom., M.Kom."",NS,KCV,nanik@if.its.ac.id,19710428 199412 2 001,,'
 'Pasal 9\nKetentuan lebih lanjut mengenai syarat, prosedur dan bentuk apresiasi diatur lebih lanjut dalam petunjuk teknis Wakil Rektor yang membidangi kemahasiswaan.\n\nBAB VI\nKETENTUAN PENUTUP\n\nPasal 10\nPada saat Peraturan Rektor ini mulai berlaku, Peraturan Rektor Institut Teknologi Sepuluh Nopember Nomor 27 Tahun 2022 tentang Pemberian Apresiasi Bagi Mahasiswa Beprestasi dan Dosen Pembimbing di Bidang Kompetisi Kemahasiswaan lnstitut Teknologi Sepuluh Nopember, dicabut dan dinyatakan tidak berlaku.\n\nPasal 11\nPeraturan Rektor ini mulai berlaku pada tanggal ditetapkan.\n\nDitetapkan di Surabaya\npada tanggal 3 Januari 2023\nREKTOR INSTITUT TEKNOLOGI SEPULUH NOPEMBER,\n\n\n\n\nMOCHAMAD ASHARI\nNIP 196510121990031003']",Informasikan ke dosen wali dengan bukti-buktinya. Dosen wali akan membantu menambahkan MK tersebut jika bukti cukup.,1.0,0.7499999999625,1.0,0.858859529815266
5,Berapa maksimal SKS untuk mata kuliah pengayaan?,Maksimal SKS untuk mata kuliah pengayaan adalah 6 SKS.,"['Q: Berapa sks mata kuliah pengayaan yang bisa diambil?\n\nA: Di peraturan akademik mengambil MK pengayaan maksimal 6 sks dan minimum 3 sks.\n\nQ: Apakah mata kuliah pengayaan bisa di-drop?\n\nA: Seperti halnya MK yang lain, jika masih dalam masa drop tiap semester, maka boleh (sampai dengan minggu 10). Setelah waktu itu tidak bisa, namun bisa digantikan dengan MK pengayaan lain yang diambil di semester berikutnya.\n\nQ: Kepada siapa saya meminta konsultasi tentang perwalian/perencanaan kuliah, merubah MK yang diambil dan drop MK setelah minggu ke 4?\n\nA: Ke DOSEN WALI, bukan ke PEMBIMBING TA. Batas akhir perubahan MK adalah minggu ke 3 dan drop MK adalah minggu ke 10\n\nQ: Bagaimana jika saya tidak bisa ambil MK di FRS padahal prasyarat sudah terpenuhi? \n\nA: Silakan menginformasikan ke doswal dengan menyertakan bukti2. Doswal akan membantu menambahkan MK yang dimaksud jika bukti2 telah mencukupi.\n\nQ: Apakah MK yang diambil via dropdown MBKM bisa menggantikan MK yang sudah diambil?'
 'BAB V BENTUK APRESIASI\n\nPasal 8\n(1) Apresiasi Lomba Kementerian dan        Lomba Mandiri bagi dosen Pembimbing kompetisi yang diikuti oleh Mahasiswa yang meraih medali/juara berupa:\na. piagam/ sertifikat atau t.anda jasa;\nb. angka kredit kepegawaian (Kum B) untuk Beban Kerja Dosen (BKD) yang terintegrasi dengan sistem informasi kepegawaian ITS; dan/atau\nc. reward sesuai dengan SBI.\n(2) Apresiasi Lomba Kementerian dan Lomba Mandiri bagi Mahasiswa berupa:\na. reward sesuai dengan SBI;\nb. konversi nilai akademik (SKS) untuk setiap lomba yang diputuskan oleh tim\nreviewer Departemen;\nc. konversi nilai Satuan Kredit Ekstrakurikuler Mahasiswa (SKEM) untuk setiap lomba yang diputuskan oleh tim review direktorat yang mengurusi kemahasiswaan;dan/atau\nd. beasiswa Magister di seluruh program studi yang ada di ITS selama waktu\nyang ditentukan.\n(3) Setiap perolehan medali/juara di setiap kompetisi sebagaimana disebutkan dalam Pasal 6 ayat (2) juga mendapatkan apresiasi berupa nominal uang.'
 'Q : Apakah syarat mengambil mata kuliah Pra-TA?\n\nA : Mahasiswa telah menempuh 100 SKS\n\nQ : Bolehkan saya mengambil Pra-TA dan TA pada semester yang bersamaan?\n\nA : Jika di semester sebelumnya sudah pernah mengambil Pra TA dan tidak berhasil mengumpulkan proposal TA, makan boleh diambil bersamaan dengan TA di semester sekarang.\n\nQ : Untuk mengambil mata kuliah Tugas Akhir, apakah ada jumlah minimum sks yang harus diambil untuk mata kuliah dengan RMK TA yang sama?\n\nA : Tidak ada aturan yang baku yang mengatur ini. Hanya saja, akan sangat membantu TA jika difokuskan untuk mengambil MK yang mendukung TA yang akan diambil di sebuah RMK. \n \n\nQ : Bagaimana prosedur pergantian Judul Tugas Akhir?\n\nA : Jika Pembimbing dan RMK tetap dan hanya melakukan penyesuaian judul/metode, maka cukup dilakukan dengan mengisi form pergantian judul yang ada di link akademik.\n\nJika TA expired atau jika pembimbing dan atau RMK ganti, maka mesti mengajukan proposal TA ulang dan mengambil Pra-TA lagi.'
 'Pasal 9\nKetentuan lebih lanjut mengenai syarat, prosedur dan bentuk apresiasi diatur lebih lanjut dalam petunjuk teknis Wakil Rektor yang membidangi kemahasiswaan.\n\nBAB VI\nKETENTUAN PENUTUP\n\nPasal 10\nPada saat Peraturan Rektor ini mulai berlaku, Peraturan Rektor Institut Teknologi Sepuluh Nopember Nomor 27 Tahun 2022 tentang Pemberian Apresiasi Bagi Mahasiswa Beprestasi dan Dosen Pembimbing di Bidang Kompetisi Kemahasiswaan lnstitut Teknologi Sepuluh Nopember, dicabut dan dinyatakan tidak berlaku.\n\nPasal 11\nPeraturan Rektor ini mulai berlaku pada tanggal ditetapkan.\n\nDitetapkan di Surabaya\npada tanggal 3 Januari 2023\nREKTOR INSTITUT TEKNOLOGI SEPULUH NOPEMBER,\n\n\n\n\nMOCHAMAD ASHARI\nNIP 196510121990031003']","Sesuai peraturan akademik, maksimal 6 SKS dan minimal 3 SKS.",0.0,0.999999999975,1.0,0.9569630342627079
6,Apakah MK Magang bisa mengganti MK yang sudah diambil?,"MK Magang tidak bisa menggantikan MK pilihan yang sudah diambil. MK Magang memiliki bobot 9 sks dan mengisi kewajiban 15 sks minimal MK pilihan. Jika pernah mengambil MK pilihan dan tidak lulus, maka wajib diulang sampai lulus.","['Q: Apakah MK yang diambil via dropdown MBKM bisa menggantikan MK yang sudah diambil?\n\nA: TIDAK BISA!\n\nQ: Apakah MK Magang bisa menggantikan MK pilihan yang sudah diambil?\n\nA: TIDAK BISA. MK Magang berbobot 9 sks dan mengisi kewajiban 15 sks minimal MK pilihan. Jika pernah mengambil MK pilhan dan tidak lulus, maka WAJIB DIULANG sampai lulus.\n\nCatatan âœðŸ»\n\nTentang MBKM & KP, Pengajuan Cuti, Pengunduran Diri, TA, Yudisium, dan Wisuda dapat dicek pada menu terkait. Jika tetap tidak menemukan jawaban, tanyakan pada admin.'
 'Jika TA expired atau jika pembimbing dan atau RMK ganti, maka mesti mengajukan proposal TA ulang dan mengambil Pra-TA lagi.\n\nQ : Setelah sidang, apa yang perlu dilakukan?\n\nA : 1. menyelesaikan revisi (jika ada)\n2. mendapatkan persetujuan dari penguji thdp revisi yang diberikan. Persetujuan bisa dengan menggunakan form revisi/email. Form ada di Pak Yudi Mulyono. Form ini disimpan mahasiswa, tidak wajib untuk dikirim ke dosenpenguji/pembimbing/sekdep 1\n3. mengkompilasi buku versi terakhir\n4. memenuhi persyaratan yudisium\n5. mengisi data wisudawan\n\nQ : Bagaimana follow Up setelah sidang TA?\n\nA : 1. mahasiswa mengerjakan revisi (jika ada)\n2. mahasiswa mengumpulkan persetujuan revisi dari penguji (menggunakan ttd digital atau email)\n3. mahasiswa memenuhi persyaratan-persyaratan yudisium.\n \n\nQ : Berapa lama waktu revisi TA setelah sidang?'
 'Pasal 9\nKetentuan lebih lanjut mengenai syarat, prosedur dan bentuk apresiasi diatur lebih lanjut dalam petunjuk teknis Wakil Rektor yang membidangi kemahasiswaan.\n\nBAB VI\nKETENTUAN PENUTUP\n\nPasal 10\nPada saat Peraturan Rektor ini mulai berlaku, Peraturan Rektor Institut Teknologi Sepuluh Nopember Nomor 27 Tahun 2022 tentang Pemberian Apresiasi Bagi Mahasiswa Beprestasi dan Dosen Pembimbing di Bidang Kompetisi Kemahasiswaan lnstitut Teknologi Sepuluh Nopember, dicabut dan dinyatakan tidak berlaku.\n\nPasal 11\nPeraturan Rektor ini mulai berlaku pada tanggal ditetapkan.\n\nDitetapkan di Surabaya\npada tanggal 3 Januari 2023\nREKTOR INSTITUT TEKNOLOGI SEPULUH NOPEMBER,\n\n\n\n\nMOCHAMAD ASHARI\nNIP 196510121990031003'
 'Q: MyITS saya bermasalah, bisa lapor kemana?\n\nA: Silakan ajukan tiket ke DPTSI di https://servicedesk.its.ac.id/\n\nQ: Saya ingin mengurus â€œâ€¦..â€ siapa tendik yang harus ditemui?\n\nA: Temui tendik sesuai bidangnya yuk! :)\n\nPersuratan (S1) â†’ Pak Sugeng\nAkademik (S1) â†’ Bu Inka (Kelas, Nilai, MBKM, International Exposure), Bu Icha (Asisten Dosen, MonKP)\nAkademik + Persuratan (S2) â†’ Bu Kartika\nAkademik + Persuratan (S3) â†’ Bu Lina\nPeminjaman Ruang â†’ Pak Husein (Kasubbag)\nKeuangan â†’ Bu Devi, Bu Due\nUrusan Ruang Aula â†’ Pak Jumali\nUrusan Ruang Kelas â†’ Pak Edy\nUrusan Laboratorium â†’ Teknisi Lab. Pak Junaidi (PKT, KCV, LP), Pak Jumali (KBJ, RPL), Pak Gayuh (AP, MCI, GiGA), Pak Kunto (AJK).\nUrusan Keamanan dan Kebersihan â†’ Pak Sukron\nUrusan Kelistrikan â†’ Pak Hari\nQ: Cara mendapatkan transkrip\n\nA: Buka SIM Akademik, masuk ke menu LAPORAN -> TRANSKRIP\n\nQ: Cara mendapatkan surat keterangan aktif mahasiswa\n\nA: Buka SIM Akademik, masuk ke menu SURAT MAHASISWA -> LAYANAN SURAT MAHASISWA']","Tidak bisa, MK Magang dan MK pilihan memiliki ketentuan masing-masing.",1.0,0.8333333332916666,1.0,0.0
7,Apakah saya bisa drop MK pengayaan kapan saja?,"Anda tidak bisa drop MK pengayaan kapan saja. MK pengayaan memiliki aturan tersendiri terkait waktu dan prosedur pengambilannya. Jika ingin melakukan drop MK pengayaan, pastikan untuk memahami kebijakan dan prosedur yang berlaku di institusi Anda. Jika masih ada pertanyaan lebih lanjut, disarankan untuk bertanya langsung kepada admin terkait.","['Q: Apakah MK yang diambil via dropdown MBKM bisa menggantikan MK yang sudah diambil?\n\nA: TIDAK BISA!\n\nQ: Apakah MK Magang bisa menggantikan MK pilihan yang sudah diambil?\n\nA: TIDAK BISA. MK Magang berbobot 9 sks dan mengisi kewajiban 15 sks minimal MK pilihan. Jika pernah mengambil MK pilhan dan tidak lulus, maka WAJIB DIULANG sampai lulus.\n\nCatatan âœðŸ»\n\nTentang MBKM & KP, Pengajuan Cuti, Pengunduran Diri, TA, Yudisium, dan Wisuda dapat dicek pada menu terkait. Jika tetap tidak menemukan jawaban, tanyakan pada admin.'
 'Jika TA expired atau jika pembimbing dan atau RMK ganti, maka mesti mengajukan proposal TA ulang dan mengambil Pra-TA lagi.\n\nQ : Setelah sidang, apa yang perlu dilakukan?\n\nA : 1. menyelesaikan revisi (jika ada)\n2. mendapatkan persetujuan dari penguji thdp revisi yang diberikan. Persetujuan bisa dengan menggunakan form revisi/email. Form ada di Pak Yudi Mulyono. Form ini disimpan mahasiswa, tidak wajib untuk dikirim ke dosenpenguji/pembimbing/sekdep 1\n3. mengkompilasi buku versi terakhir\n4. memenuhi persyaratan yudisium\n5. mengisi data wisudawan\n\nQ : Bagaimana follow Up setelah sidang TA?\n\nA : 1. mahasiswa mengerjakan revisi (jika ada)\n2. mahasiswa mengumpulkan persetujuan revisi dari penguji (menggunakan ttd digital atau email)\n3. mahasiswa memenuhi persyaratan-persyaratan yudisium.\n \n\nQ : Berapa lama waktu revisi TA setelah sidang?'
 'Q: MyITS saya bermasalah, bisa lapor kemana?\n\nA: Silakan ajukan tiket ke DPTSI di https://servicedesk.its.ac.id/\n\nQ: Saya ingin mengurus â€œâ€¦..â€ siapa tendik yang harus ditemui?\n\nA: Temui tendik sesuai bidangnya yuk! :)\n\nPersuratan (S1) â†’ Pak Sugeng\nAkademik (S1) â†’ Bu Inka (Kelas, Nilai, MBKM, International Exposure), Bu Icha (Asisten Dosen, MonKP)\nAkademik + Persuratan (S2) â†’ Bu Kartika\nAkademik + Persuratan (S3) â†’ Bu Lina\nPeminjaman Ruang â†’ Pak Husein (Kasubbag)\nKeuangan â†’ Bu Devi, Bu Due\nUrusan Ruang Aula â†’ Pak Jumali\nUrusan Ruang Kelas â†’ Pak Edy\nUrusan Laboratorium â†’ Teknisi Lab. Pak Junaidi (PKT, KCV, LP), Pak Jumali (KBJ, RPL), Pak Gayuh (AP, MCI, GiGA), Pak Kunto (AJK).\nUrusan Keamanan dan Kebersihan â†’ Pak Sukron\nUrusan Kelistrikan â†’ Pak Hari\nQ: Cara mendapatkan transkrip\n\nA: Buka SIM Akademik, masuk ke menu LAPORAN -> TRANSKRIP\n\nQ: Cara mendapatkan surat keterangan aktif mahasiswa\n\nA: Buka SIM Akademik, masuk ke menu SURAT MAHASISWA -> LAYANAN SURAT MAHASISWA'
 'Q: Bagaimana cara mendapatkan Surat Keterangan Lulus, legalisir ijazah dll atau surat keterangan selsai TA?\n\nA: SKL dilayani oleh BIRO UMUM DAN REFORMASI BIROKRASI (BURB)\nhttps://www.its.ac.id/burb/id/permohonan-surat-keterangan-lulus/\nSKL baru akan dikeluarkan jika sudah ada SK kelulusan dari Rektor ITS\n\nSurat keterangan selesai TA diberikan oleh prodi T Informatika. Silakan kirim permohonan ke WA Pak Sugeng +62 856-4843-2445 disertai dengan data diri dan keperluan surat keterangan telah menyelesaikan TA\n \n\nQ: Bagaimana cara berkomunikasi dengan email?\n\nA: Email adalah media komunikasi resmi dari institusi, sedangkan WA bukan.\nTuliskan salam, isi email, dan ditutup dengan salam.\ncontoh adalah sebagai berikut\n-------------------------------------------------------------------------------------------------------\nAssalamualaikum/Selamat Pagi']","Bisa drop sampai dengan minggu ke-10. Setelah itu, bisa digantikan dengan MK pengayaan lain di semester berikutnya.",0.99999999995,0.25,0.7847992136694467,1.0
8,Bagaimana cara mendapatkan transkrip?,"Untuk mendapatkan transkrip, Anda dapat membuka SIM Akademik dan masuk ke menu LAPORAN -> TRANSKRIP. Dari sana, Anda dapat mengakses dan mengunduh transkrip akademik Anda.","['A: Buka SIM Akademik, masuk ke menu LAPORAN -> TRANSKRIP\n\nQ: Cara mendapatkan surat keterangan aktif mahasiswa\n\nA: Buka SIM Akademik, masuk ke menu SURAT MAHASISWA -> LAYANAN SURAT MAHASISWA\n\nQ: Bagaimana mendapatkan translasi ke dalam Bahasa Inggris dari dokumen resmi ITS?\n\nA: Translasi dilayani oleh BURB\nKeluhan/permintaan : servicedesk.its.ac.id\nEmail : plt@its.ac.id \nTelp : (031) 5994251\nhttps://www.its.ac.id/burb/wp-content/uploads/sites/106/2022/05/Panduan-myITS-Services_rev-1.pdf""\n\nQ: Untuk keperluan mendaftar bekerja / sekolah lanjutan, surat keterangan apakah yang bisa saya dapatkan?\n\nA:\nSebelum yudisium\nSurat keterangan telah menyelesaikan xxx sks dan telah selesai sidang TA\nSetelah yudisium\nSurat keterangan lulus yang diterbitkan oleh BURB\nSetelah wisuda:\nIjazah dan transkrip resmi ITS\n\nQ: Bagaimana cara mendapatkan Surat Keterangan Lulus, legalisir ijazah dll atau surat keterangan selsai TA?'
 'Q: Bagaimana cara mendapatkan Surat Keterangan Lulus, legalisir ijazah dll atau surat keterangan selsai TA?\n\nA: SKL dilayani oleh BIRO UMUM DAN REFORMASI BIROKRASI (BURB)\nhttps://www.its.ac.id/burb/id/permohonan-surat-keterangan-lulus/\nSKL baru akan dikeluarkan jika sudah ada SK kelulusan dari Rektor ITS\n\nSurat keterangan selesai TA diberikan oleh prodi T Informatika. Silakan kirim permohonan ke WA Pak Sugeng +62 856-4843-2445 disertai dengan data diri dan keperluan surat keterangan telah menyelesaikan TA\n \n\nQ: Bagaimana cara berkomunikasi dengan email?\n\nA: Email adalah media komunikasi resmi dari institusi, sedangkan WA bukan.\nTuliskan salam, isi email, dan ditutup dengan salam.\ncontoh adalah sebagai berikut\n-------------------------------------------------------------------------------------------------------\nAssalamualaikum/Selamat Pagi'
 'BAB IV\nPROSEDUR PENGAJUAN MENDAPATKAN APRESIASI\n\nPasal 7\n(1) Untuk mendapatkan Apresiasi atas prestasi Kementerian yang diraih oleh Mahasiswa, prosedur yang harus dilakukan oleh Mahasiswa yaitu:\na. Mahasiswa hams mengisi data dan mengunggah dokumen penghargaan yang diraih ke myJTS Stu.dentConnect;\nb. mendapatkan verifikasi dari direktorat yang mengurusi kemahasiswaan; dan\nc. mendapatkan penetapan melalui Surat Keputusan Rektor.\n(2) Untuk mendapatkan Apresiasi atas prestasi Lomba mandiri yang diraih oleh Mahasiswa, prosedur yang harus dilakukan oleh Mahasiswa yaitu:\na. Mahasiswa hams mengisi data dan mengunggah dokumen penghargaan yang diraih ke myITS Stu.dentConnect;\nb. mendapatkan        verifikasi        dari Dosen        Pembimbing        dan        direktorat yang mengurusi kemahasiswaan; dan\nc. mendapatkan penetapan melalui Surat Keputusan Rektor.\n\n      BAB V BENTUK APRESIASI'
 'Menetapkan\n\nMEMUTUSKAN:\nPERATURAN REKTOR INSTITUT TEKNOLOGI SEPULUH NOPEMBER TENTANG PEMBERIAN APRESIASI BAGI MAHASISWA BEPRESTASI DAN DOSEN PEMBIMBING DI BIDANG KEMAHASISW AAN INSTITUT TEKNOLOGI SEPULUH NOPEMBER.\n\nBAB!\nKETENTUAN UMUM']","Buka SIM Akademik, masuk ke menu LAPORAN -> TRANSKRIP.",0.9999999999666667,0.5,0.8458281431293097,1.0
9,Siapa yang harus dihubungi untuk mendapatkan surat keterangan menyelesaikan Tugas Akhir?,"Jawaban: Untuk mendapatkan surat keterangan menyelesaikan Tugas Akhir, Anda harus mengirim permohonan ke WhatsApp Pak Sugeng di nomor +62 856-4843-2445 disertai dengan data diri dan keperluan surat keterangan telah menyelesaikan Tugas Akhir.","['Q: MyITS saya bermasalah, bisa lapor kemana?\n\nA: Silakan ajukan tiket ke DPTSI di https://servicedesk.its.ac.id/\n\nQ: Saya ingin mengurus â€œâ€¦..â€ siapa tendik yang harus ditemui?\n\nA: Temui tendik sesuai bidangnya yuk! :)\n\nPersuratan (S1) â†’ Pak Sugeng\nAkademik (S1) â†’ Bu Inka (Kelas, Nilai, MBKM, International Exposure), Bu Icha (Asisten Dosen, MonKP)\nAkademik + Persuratan (S2) â†’ Bu Kartika\nAkademik + Persuratan (S3) â†’ Bu Lina\nPeminjaman Ruang â†’ Pak Husein (Kasubbag)\nKeuangan â†’ Bu Devi, Bu Due\nUrusan Ruang Aula â†’ Pak Jumali\nUrusan Ruang Kelas â†’ Pak Edy\nUrusan Laboratorium â†’ Teknisi Lab. Pak Junaidi (PKT, KCV, LP), Pak Jumali (KBJ, RPL), Pak Gayuh (AP, MCI, GiGA), Pak Kunto (AJK).\nUrusan Keamanan dan Kebersihan â†’ Pak Sukron\nUrusan Kelistrikan â†’ Pak Hari\nQ: Cara mendapatkan transkrip\n\nA: Buka SIM Akademik, masuk ke menu LAPORAN -> TRANSKRIP\n\nQ: Cara mendapatkan surat keterangan aktif mahasiswa\n\nA: Buka SIM Akademik, masuk ke menu SURAT MAHASISWA -> LAYANAN SURAT MAHASISWA'
 'KEMENTERIAN PENDIDIKAN, KEBUDAYAAN, RISET, DAN TEKNOLOGI\nINSTITUT TEKNOLOGI SEPULUH NOPEMBER\n       Kampus ITS Sukolilo - Surabaya 60111 Telepon : 031-5994251-54, 5947274, 5945472 (Hunting)\nFax: 031-5947264, 5950806\nhttp://www.its.ac.id\n\n\nPERATURAN REKTOR INSTITUT TEKNOWGI SEPULUH NOPEMBER NOMOR 7 TAHUN 2023\n\nTENTANG\n\nPEMBERIAN APRESIASI BAGI MAHASISWA BEPRESTASI\nDAN DOSEN PEMBIMBING DI BIDANG KOMPETISI KEMAHASISWAAN INSTITUT TEKNOWGI SEPULUH NOPEMBER'
 'Q: Bagaimana cara mendapatkan Surat Keterangan Lulus, legalisir ijazah dll atau surat keterangan selsai TA?\n\nA: SKL dilayani oleh BIRO UMUM DAN REFORMASI BIROKRASI (BURB)\nhttps://www.its.ac.id/burb/id/permohonan-surat-keterangan-lulus/\nSKL baru akan dikeluarkan jika sudah ada SK kelulusan dari Rektor ITS\n\nSurat keterangan selesai TA diberikan oleh prodi T Informatika. Silakan kirim permohonan ke WA Pak Sugeng +62 856-4843-2445 disertai dengan data diri dan keperluan surat keterangan telah menyelesaikan TA\n \n\nQ: Bagaimana cara berkomunikasi dengan email?\n\nA: Email adalah media komunikasi resmi dari institusi, sedangkan WA bukan.\nTuliskan salam, isi email, dan ditutup dengan salam.\ncontoh adalah sebagai berikut\n-------------------------------------------------------------------------------------------------------\nAssalamualaikum/Selamat Pagi'
 'Bersama dengan ini saya sertakan dokumen revisi TA saya dengan poin sebagai berikut:\n- perbaikan ....\nMohon berkenan memeriksa dan menginformasikan jika ada yang perlu saya perbaiki.\n\nDemikian, terima kasih\nAgus\n0511000..â€¦\n\nQ: Bagaimana mendapatkan surat keterangan yang tidak ada di menu integra, contoh surat keterangan selesai TA dan lulus >=144 SKS?\n\nA: kirim ke WA Pak Sugeng +62 856-4843-2445\n------------------------------------------------------------------------------\nKepada Yth\nBapak Ary Mazharuddin Shiddiqi\ndi tempat\n\nDengan hormat,\nDengan surat ini saya,\n\nNama: \nNRP: \nTempat/Tgl lahir: \nAlamat sekarang: \nSKS Lulus:\nemail aktif:\nNo HP aktif:\n\nBermaksud untuk mengajukan permohonan kepada Bapak Ary guna memperoleh Surat Keterangan Selesai Tugas Akhir.\n\nDemikian surat ini saya ajukan dan atas terkabulnya permohonan ini, saya ucapkan terimakasih\n\nSurabaya, .â€¦']",Pak Sugeng melalui WA +62 856-4843-2445.,0.999999999975,1.0,0.0,1.0
10,Apa yang harus dilakukan untuk menyelesaikan masalah pada MyITS?,Anda dapat melaporkan masalah pada MyITS dengan mengajukan tiket ke DPTSI melalui https://servicedesk.its.ac.id/.,"['Bersama dengan ini saya sertakan dokumen revisi TA saya dengan poin sebagai berikut:\n- perbaikan ....\nMohon berkenan memeriksa dan menginformasikan jika ada yang perlu saya perbaiki.\n\nDemikian, terima kasih\nAgus\n0511000..â€¦\n\nQ: Bagaimana mendapatkan surat keterangan yang tidak ada di menu integra, contoh surat keterangan selesai TA dan lulus >=144 SKS?\n\nA: kirim ke WA Pak Sugeng +62 856-4843-2445\n------------------------------------------------------------------------------\nKepada Yth\nBapak Ary Mazharuddin Shiddiqi\ndi tempat\n\nDengan hormat,\nDengan surat ini saya,\n\nNama: \nNRP: \nTempat/Tgl lahir: \nAlamat sekarang: \nSKS Lulus:\nemail aktif:\nNo HP aktif:\n\nBermaksud untuk mengajukan permohonan kepada Bapak Ary guna memperoleh Surat Keterangan Selesai Tugas Akhir.\n\nDemikian surat ini saya ajukan dan atas terkabulnya permohonan ini, saya ucapkan terimakasih\n\nSurabaya, .â€¦'
 'Q: MyITS saya bermasalah, bisa lapor kemana?\n\nA: Silakan ajukan tiket ke DPTSI di https://servicedesk.its.ac.id/\n\nQ: Saya ingin mengurus â€œâ€¦..â€ siapa tendik yang harus ditemui?\n\nA: Temui tendik sesuai bidangnya yuk! :)\n\nPersuratan (S1) â†’ Pak Sugeng\nAkademik (S1) â†’ Bu Inka (Kelas, Nilai, MBKM, International Exposure), Bu Icha (Asisten Dosen, MonKP)\nAkademik + Persuratan (S2) â†’ Bu Kartika\nAkademik + Persuratan (S3) â†’ Bu Lina\nPeminjaman Ruang â†’ Pak Husein (Kasubbag)\nKeuangan â†’ Bu Devi, Bu Due\nUrusan Ruang Aula â†’ Pak Jumali\nUrusan Ruang Kelas â†’ Pak Edy\nUrusan Laboratorium â†’ Teknisi Lab. Pak Junaidi (PKT, KCV, LP), Pak Jumali (KBJ, RPL), Pak Gayuh (AP, MCI, GiGA), Pak Kunto (AJK).\nUrusan Keamanan dan Kebersihan â†’ Pak Sukron\nUrusan Kelistrikan â†’ Pak Hari\nQ: Cara mendapatkan transkrip\n\nA: Buka SIM Akademik, masuk ke menu LAPORAN -> TRANSKRIP\n\nQ: Cara mendapatkan surat keterangan aktif mahasiswa\n\nA: Buka SIM Akademik, masuk ke menu SURAT MAHASISWA -> LAYANAN SURAT MAHASISWA'
 'Frequently Asked Question\nAcademic Support ðŸ“– \nQ: Nilai saya belum keluar/salah, banding nilainya bagaimana?\n\nA: Untuk kelas MBKM, Isi form ralat nilai beserta bukti dukung â†’ tunggu nilai berubah. Form dibagikan ke mahasiswa setelah rilis nilai MBKM (ctt : periode rilis nilai MBKM berbeda dengan nilai kelas reguler).\n\nUntuk kelas reguler, komunikasikan dengan dosen pengampu MK masing - masing.\n\nQ: Kelas saya bentrok, bagaimana cara pindah kelas?\n\nA: Cari kelas dengan jadwal yang sesuai â†’ konsultasikan ke dosen wali & pengampu MK â†’ laporkan ke Sekdep 1 (+cc Bu Inka jika via email) â†’ bersabar sampai kelasnya dirubah.\n\nQ: Apakah wajib mengisi kuisioner dan IPD di akhir semester?\n\nA: WAJIB. Tolong diisi ya.\n\nQ: Berapa sks mata kuliah pengayaan yang bisa diambil?\n\nA: Di peraturan akademik mengambil MK pengayaan maksimal 6 sks dan minimum 3 sks.\n\nQ: Apakah mata kuliah pengayaan bisa di-drop?'
 'sesuai Kode Mata Kuliah\nSenin, Rabu; 15.30-17.10 TW1-205 Tower 1, Lt. 2\nSK234101 Kimia 1 4 â‰¥4 1\nSemua Departemen\nsesuai Kode Mata Kuliah\nSelasa, Kamis; 07.00-08.40 TW1-503 Tower 1, Lt. 5\nKode MK Mata Kuliah IUP SKS Semester\nNama\nKelas\nKode Departemen Hari / Pukul Ruang Lokasi Ruang\nSM234101 Kalkulus 1 3 â‰¥4 2\nSemua Departemen\nsesuai Kode Mata Kuliah\nSenin, Rabu; 15.30-17.10 TW1-606 Tower 1, Lt. 6\nSM234152 Matematika 2 â‰¥4 2\nSemua Departemen\nsesuai Kode Mata Kuliah\nSenin, 15.30-17.10 TW1-304 Tower 1, Lt. 3\nSF234101 Fisika 1 5 â‰¥4 2\nSemua Departemen\nsesuai Kode Mata Kuliah\nSelasa, Kamis; 15.30-17.10 TW1-506 Tower 1, Lt. 5\nSF234102 Fisika Mekanika 4 â‰¥4 2\nSemua Departemen\nsesuai Kode Mata Kuliah\nSelasa, Kamis; 15.30-17.10 TW1-606 Tower 1, Lt. 6\nSF234103 Fisika Mekanika 3 â‰¥4 2\nSemua Departemen\nsesuai Kode Mata Kuliah\nSelasa, Kamis; 15.30-17.10 TW1-706 Tower 1, Lt. 7\nSF234204 Fisika Dasar 3 â‰¥4 2\nSemua Departemen\nsesuai Kode Mata Kuliah\nSelasa, Kamis; 15.30-17.10 TW1-806 Tower 1, Lt. 8']",Ajukan tiket ke DPTSI melalui https://servicedesk.its.ac.id.,0.5833333333041666,0.5,0.7970153434534994,1.0
11,"Apa email dari Dr. Yudhi Purwananto, S.Kom., M.Kom.?","Email dari Dr. Yudhi Purwananto, S.Kom., M.Kom. adalah yudhi@if.its.ac.id.","['""Dr. Yudhi Purwananto, S.Kom., M.Kom."",YP,AP,yudhi@if.its.ac.id,19700714 199703 1 002,,\n""Prof. Dr.Eng. Nanik Suciati, S.Kom., M.Kom."",NS,KCV,nanik@if.its.ac.id,19710428 199412 2 001,,\n""Dr. Ahmad Saikhu, S.Si., M.T."",AS,PKT,ahmad89saikhu@gmail.com,19710718 200604 1 001,,\n""Dr. Wahyu Suadi, S.Kom., M.Kom."",WS,AJK,wsuadi@if.its.ac.id,19711030 200212 1 001,,\n""Dr. Dwi Sunaryono, S.Kom., M.Kom."",DS,AP,dwi@if.its.ac.id,19720528 199702 1 001,,\n""Prof. Dr. Agus Zainal Arifin, S.Kom., M.Kom."",AZ,KCV,agusza@if.its.ac.id,19720809 199512 1 001,,\n""Ir. Misbakhul Munir Irfan Subakti, S.Kom, M.Sc., M.Phil"",IS,AP,irfan@if.its.ac.id,19740209 200212 1 001,,\n""Fajar Baskoro, S.Kom., M.T."",FB,AP,fajar@if.its.ac.id,19740403 199903 1 002,,\n""Prof. Daniel Oranova Siahaan, S.Kom., M.Sc., PD.Eng."",DO,RPL,daniel@if.its.ac.id,19741123 200604 1 001,,\n""Prof. Tohari Ahmad, S.Kom., MIT., Ph.D."",TA,KBJ,tohari@if.its.ac.id,19750525 200312 1 002,,'
 '""Prof. Daniel Oranova Siahaan, S.Kom., M.Sc., PD.Eng."",DO,RPL,daniel@if.its.ac.id,19741123 200604 1 001,,\n""Prof. Tohari Ahmad, S.Kom., MIT., Ph.D."",TA,KBJ,tohari@if.its.ac.id,19750525 200312 1 002,,\n""Dr. Bilqis Amaliah, S.Kom., M.Kom."",BA,PKT,bamaliah@gmail.com,19750914 200112 2 002,,\n""Prof. Dr.Eng. Chastine Fatichah, S.Kom., M.Kom."",CF,KCV,chastine@if.its.ac.id,19751220 200112 2 002,,\n""Sarwosri, S.Kom., M.T."",SR,RPL,sri@if.its.ac.id,19760809 200112 2 001,,\n""Imam Kuswardayan, S.Kom., M.T."",IM,GIGa,imam@if.its.ac.id,19761215 200312 1 001,,\n""Royyana Muslim Ijtihadie, S.Kom., M.Kom., Ph.D."",RM,AJK,royyana@gmail.com,19770824 200304 1 001,,\n""Dr.Eng. Darlis Herumurti, S.Kom., M.Kom."",DH,GIGa,darlis@if.its.ac.id,19771217 200312 1 001,,\n""Prof. Dr. Ir. Diana Purwitasari, S.Kom., M.Sc."",DP,AP,diana@if.its.ac.id,19780410 200312 2 001,,\n""Dr. Ir. Umi Laili Yuhana, S.Kom., M.Sc."",UY,RPL,yuhana@if.its.ac.id,19790626 200501 2 002,,'
 '""Prof. Dr. Ir. Diana Purwitasari, S.Kom., M.Sc."",DP,AP,diana@if.its.ac.id,19780410 200312 2 001,,\n""Dr. Ir. Umi Laili Yuhana, S.Kom., M.Sc."",UY,RPL,yuhana@if.its.ac.id,19790626 200501 2 002,,\n""Ir. Ary Mazharuddin Shiddiqi, S.Kom., M.Comp.Sc., Ph.D."",AM,KBJ,ary.shiddiqi@if.its.ac.id,19810620 200501 1 003,,\n""Dr. Anny Yuniarti, S.Kom, M.Comp.Sc."",AY,GIGa,anny@if.its.ac.id,19810622 200501 2 002,,\n""Ir. Arya Yudhi Wijaya, S.Kom., M.Kom."",AW,PKT,arya@if.its.ac.id,19840904 201012 1 002,,\n""Dr.Eng. Radityo Anggoro, S.Kom., M.Sc."",RA,AJK,onggo.informatika@gmail.com,19841016 200812 1 002,,\n""Ratih Nur Esti Anggraini, S.Kom., M.Sc., Ph.D."",RN,MCI,ratih_nea@if.its.ac.id,19841210 201404 2 003,,\n""Adhatus Solichah Ahmadiyah, S.Kom., M.Sc."",AL,MCI,adhatus@if.its.ac.id,19850826 201504 2 002,,\n""Dini Adni Navastara, S.Kom., M.Sc."",DA,KCV,dini_navastara@if.its.ac.id,19851017 201504 2 001,,\n""Wijayanti Nurul Khotimah, S.Kom., M.Sc."",WN,GIGa,wijayanti@if.its.ac.id,19860312 201212 2 004,,'
 'KEMENTERIAN PENDIDIKAN, KEBUDAYAAN, RISET, DAN TEKNOLOGI\nINSTITUT TEKNOLOGI SEPULUH NOPEMBER\n       Kampus ITS Sukolilo - Surabaya 60111 Telepon : 031-5994251-54, 5947274, 5945472 (Hunting)\nFax: 031-5947264, 5950806\nhttp://www.its.ac.id\n\n\nPERATURAN REKTOR INSTITUT TEKNOWGI SEPULUH NOPEMBER NOMOR 7 TAHUN 2023\n\nTENTANG\n\nPEMBERIAN APRESIASI BAGI MAHASISWA BEPRESTASI\nDAN DOSEN PEMBIMBING DI BIDANG KOMPETISI KEMAHASISWAAN INSTITUT TEKNOWGI SEPULUH NOPEMBER']",yudhi@if.its.ac.id,0.7499999999625,1.0,0.9317059444015275,1.0
12,Siapa dosen berkode AZ dan dalam RMK KCV?,Saya tidak tahu.,"['Pasal 9\nKetentuan lebih lanjut mengenai syarat, prosedur dan bentuk apresiasi diatur lebih lanjut dalam petunjuk teknis Wakil Rektor yang membidangi kemahasiswaan.\n\nBAB VI\nKETENTUAN PENUTUP\n\nPasal 10\nPada saat Peraturan Rektor ini mulai berlaku, Peraturan Rektor Institut Teknologi Sepuluh Nopember Nomor 27 Tahun 2022 tentang Pemberian Apresiasi Bagi Mahasiswa Beprestasi dan Dosen Pembimbing di Bidang Kompetisi Kemahasiswaan lnstitut Teknologi Sepuluh Nopember, dicabut dan dinyatakan tidak berlaku.\n\nPasal 11\nPeraturan Rektor ini mulai berlaku pada tanggal ditetapkan.\n\nDitetapkan di Surabaya\npada tanggal 3 Januari 2023\nREKTOR INSTITUT TEKNOLOGI SEPULUH NOPEMBER,\n\n\n\n\nMOCHAMAD ASHARI\nNIP 196510121990031003'
 'Q: Bagaimana cara mendapatkan Surat Keterangan Lulus, legalisir ijazah dll atau surat keterangan selsai TA?\n\nA: SKL dilayani oleh BIRO UMUM DAN REFORMASI BIROKRASI (BURB)\nhttps://www.its.ac.id/burb/id/permohonan-surat-keterangan-lulus/\nSKL baru akan dikeluarkan jika sudah ada SK kelulusan dari Rektor ITS\n\nSurat keterangan selesai TA diberikan oleh prodi T Informatika. Silakan kirim permohonan ke WA Pak Sugeng +62 856-4843-2445 disertai dengan data diri dan keperluan surat keterangan telah menyelesaikan TA\n \n\nQ: Bagaimana cara berkomunikasi dengan email?\n\nA: Email adalah media komunikasi resmi dari institusi, sedangkan WA bukan.\nTuliskan salam, isi email, dan ditutup dengan salam.\ncontoh adalah sebagai berikut\n-------------------------------------------------------------------------------------------------------\nAssalamualaikum/Selamat Pagi'
 'Mengingat  : 1. Undang-Undang Nomor 12 Tahun 2012 tentang Pendidikan Tinggi (Lembaran Negara Republik Indonesia Tahun 2012 Nomor 158, Tambahan Lembaran Negara Republik Indonesia Nomor 5336);\n2. Peraturan Pemerintah Nomor 4 Tahun 2014 tentang Penyelenggaraan Pendidikan Tinggi dan Pengelolaan Perguruan Tinggi (Lembaran Negara Republik Indonesia Tahun 2014 Nomor 16, Tambahan Lembaran Negara Republik Indonesia Nomor 5500);'
 ""UG234914 Bahasa Inggris 2 â‰¥6 1 Semua Departemen Jum'at, 13.30-15.10 TW1-201 Tower 1, Lt. 2\nKode MK Mata Kuliah IUP SKS Semester\nNama\nKelas\nKode Departemen Hari / Pukul Ruang Lokasi Ruang\nUG234911 Pancasila 2 â‰¥6 1 Semua Departemen Senin, 07.00-08.40 TW1-304 Tower 1, Lt. 3\nUG234913 Kewarganegaraan 2 â‰¥6 1 Semua Departemen Selasa, 11.00-12.40 TW1-304 Tower 1, Lt. 3\nUG234901 Agama Islam 2 â‰¥6 1 Semua Departemen Kamis, 09.00-10.40 TW1-304 Tower 1, Lt. 3\nUG234912 Bahasa Indonesia 2 â‰¥6 1 Semua Departemen Kamis, 13.30-15.10 TW1-304 Tower 1, Lt. 3\nUG234914 Bahasa Inggris 2 â‰¥6 1 Semua Departemen Kamis, 11.00-12.40 TW1-304 Tower 1, Lt. 3\nSKPB, 24 Januari 2024""]","Prof. Dr. Agus Zainal Arifin, S.Kom., M.Kom.",0.8055555555287036,0.0,0.8045701642854345,0.0
13,Siapa dosen yang bertanggung jawab atas Laboratorium KCV dan juga seorang teknisi?,Dosen yang bertanggung jawab atas Laboratorium KCV dan juga seorang teknisi adalah Prof. Dr.Eng. Nanik Suciati.,"['Dosen & Tendik di Departemen Teknik Informatika ðŸ‘¥\nNama Dosen/Tendik,Kode Dosen,RMK,Email,NIP/NPP,Role Tendik,PIC Laboratorium\n""Prof. Ir. Supeno Djanali, M.Sc., Ph.D."",SD,AJK,supeno@its.ac.id,8859390019,,\n""Prof. Ir. Handayani Tjandrasa, M.Sc., Ph.D."",HT,KCV,handatj@its.ac.id,8866323419,,\n""Prof. Drs.Ec. Ir. Riyanarto Sarno, M.Sc., Ph.D."",RS,MCI,riyanarto@if.its.ac.id,19590803 198601 1 001,,\n""Prof. Dr. Ir. Joko Lianto Buliali, M.Sc."",JL,PKT,joko@if.its.ac.id,19670727 199203 1 002,,\n""Ir. Siti Rochimah, M.T., Ph.D."",ST,RPL,siti@if.its.ac.id,19681002 199403 2 001,,\n""Victor Hariadi, S.Si., M.Kom."",VH,PKT,victor@if.its.ac.id,19691228 199412 1 001,,\n""Rully Soelaiman, S.Kom., M.Kom."",RL,AP,rully@if.its.ac.id,19700213 199402 1 001,,\n""Dr. Yudhi Purwananto, S.Kom., M.Kom."",YP,AP,yudhi@if.its.ac.id,19700714 199703 1 002,,\n""Prof. Dr.Eng. Nanik Suciati, S.Kom., M.Kom."",NS,KCV,nanik@if.its.ac.id,19710428 199412 2 001,,'
 '""Prof. Daniel Oranova Siahaan, S.Kom., M.Sc., PD.Eng."",DO,RPL,daniel@if.its.ac.id,19741123 200604 1 001,,\n""Prof. Tohari Ahmad, S.Kom., MIT., Ph.D."",TA,KBJ,tohari@if.its.ac.id,19750525 200312 1 002,,\n""Dr. Bilqis Amaliah, S.Kom., M.Kom."",BA,PKT,bamaliah@gmail.com,19750914 200112 2 002,,\n""Prof. Dr.Eng. Chastine Fatichah, S.Kom., M.Kom."",CF,KCV,chastine@if.its.ac.id,19751220 200112 2 002,,\n""Sarwosri, S.Kom., M.T."",SR,RPL,sri@if.its.ac.id,19760809 200112 2 001,,\n""Imam Kuswardayan, S.Kom., M.T."",IM,GIGa,imam@if.its.ac.id,19761215 200312 1 001,,\n""Royyana Muslim Ijtihadie, S.Kom., M.Kom., Ph.D."",RM,AJK,royyana@gmail.com,19770824 200304 1 001,,\n""Dr.Eng. Darlis Herumurti, S.Kom., M.Kom."",DH,GIGa,darlis@if.its.ac.id,19771217 200312 1 001,,\n""Prof. Dr. Ir. Diana Purwitasari, S.Kom., M.Sc."",DP,AP,diana@if.its.ac.id,19780410 200312 2 001,,\n""Dr. Ir. Umi Laili Yuhana, S.Kom., M.Sc."",UY,RPL,yuhana@if.its.ac.id,19790626 200501 2 002,,'
 'Purnomo,,,,,Petugas Keamanan (Parkir),\nSoegeng Santoso,,,,,Pengadministrasi Umum,\nJumali,,,,,Teknisi Laboratorium,""KBJ, RPL, Aula""\nEdy Lukito,,,,,Pengelola Instalasi Teknologi Informasi,LP 2\nKunto Hermono,,,,,Teknisi Laboratorium,""AJK, Lab Pasca S2, Lab Kerjasama S3, Lab Residensi S3""\nLina Ambarwati,,,,,Pengadministrasi Akademik Prodi Pascasarjana (S3),\nMuhammad Chusaeni,,,,,Kepala Subbagian Tata Usaha DTIF,\nHari Pramono,,,,,Teknisi Pemeliharaan Sarana dan Prasarana (Departemen),\nGayuh Adi Rustanto,,,,,Teknisi Laboratorium,""MCI, GIGa, AP""\nAhmad Junaidi Abdillah,,,,,Teknisi Laboratorium,""LP 1, KCV""\nMochamad Suchron,,,,,Pramu Bakti,\nChafrida Devi Viantika Sari,,,,,Pengelola Keuangan,\nKartika Dwi Yuniavita Rahmawati,,,,,Pengadministrasi Akademik Prodi Pascasarjana (S2),\nInka Novita Dinia,,,,,Pengadministrasi Akademik (Sarjana/Sarjana Terapan),\nDue Nashrunisa,,,,,Pengelola Keuangan,\nRif\'atus Sholichah,,,,,Pengadministrasi Akademik (Sarjana/Sarjana Terapan),'
 '""Dr. Yudhi Purwananto, S.Kom., M.Kom."",YP,AP,yudhi@if.its.ac.id,19700714 199703 1 002,,\n""Prof. Dr.Eng. Nanik Suciati, S.Kom., M.Kom."",NS,KCV,nanik@if.its.ac.id,19710428 199412 2 001,,\n""Dr. Ahmad Saikhu, S.Si., M.T."",AS,PKT,ahmad89saikhu@gmail.com,19710718 200604 1 001,,\n""Dr. Wahyu Suadi, S.Kom., M.Kom."",WS,AJK,wsuadi@if.its.ac.id,19711030 200212 1 001,,\n""Dr. Dwi Sunaryono, S.Kom., M.Kom."",DS,AP,dwi@if.its.ac.id,19720528 199702 1 001,,\n""Prof. Dr. Agus Zainal Arifin, S.Kom., M.Kom."",AZ,KCV,agusza@if.its.ac.id,19720809 199512 1 001,,\n""Ir. Misbakhul Munir Irfan Subakti, S.Kom, M.Sc., M.Phil"",IS,AP,irfan@if.its.ac.id,19740209 200212 1 001,,\n""Fajar Baskoro, S.Kom., M.T."",FB,AP,fajar@if.its.ac.id,19740403 199903 1 002,,\n""Prof. Daniel Oranova Siahaan, S.Kom., M.Sc., PD.Eng."",DO,RPL,daniel@if.its.ac.id,19741123 200604 1 001,,\n""Prof. Tohari Ahmad, S.Kom., MIT., Ph.D."",TA,KBJ,tohari@if.its.ac.id,19750525 200312 1 002,,']",Mochamad Suchron,0.7499999999625,0.25,0.9314075502699873,0.0
14,Apakah syarat mengambil mata kuliah Pra-TA?,Syarat mengambil mata kuliah Pra-TA adalah mahasiswa telah menempuh 100 SKS.,"['Q : Apakah syarat mengambil mata kuliah Pra-TA?\n\nA : Mahasiswa telah menempuh 100 SKS\n\nQ : Bolehkan saya mengambil Pra-TA dan TA pada semester yang bersamaan?\n\nA : Jika di semester sebelumnya sudah pernah mengambil Pra TA dan tidak berhasil mengumpulkan proposal TA, makan boleh diambil bersamaan dengan TA di semester sekarang.\n\nQ : Untuk mengambil mata kuliah Tugas Akhir, apakah ada jumlah minimum sks yang harus diambil untuk mata kuliah dengan RMK TA yang sama?\n\nA : Tidak ada aturan yang baku yang mengatur ini. Hanya saja, akan sangat membantu TA jika difokuskan untuk mengambil MK yang mendukung TA yang akan diambil di sebuah RMK. \n \n\nQ : Bagaimana prosedur pergantian Judul Tugas Akhir?\n\nA : Jika Pembimbing dan RMK tetap dan hanya melakukan penyesuaian judul/metode, maka cukup dilakukan dengan mengisi form pergantian judul yang ada di link akademik.\n\nJika TA expired atau jika pembimbing dan atau RMK ganti, maka mesti mengajukan proposal TA ulang dan mengambil Pra-TA lagi.'
 'Q : Berapa lama waktu revisi TA setelah sidang?\n\nA : Umumnya sekitar maksimum dua pekan setelah sidang TA. Lebih baik jika bisa selesai sebelum itu, sehingga dapat mempersiapkan berkas-berkas untuk yudisium dan wisuda.\n \n\nQ : Kemanakah saya mengumpulkan lembar revisi?\n\nA : Revisi yang telah disetujui oleh penguji dipakai dasar untuk membuat buku TA versi final untuk persyaratan yudisium. Dosen pembimbing dikirim kopiannya melalui email\n \n\nQ : Dimana panduan tentang POMITS\n\nA : http://ejurnal.its.ac.id/ \n\nQ : Kapan nilai Pra TA atau TA keluar?\n\nA : Nilai KP, nilai Pra TA dan TA akan dientry ke integra secara batch operation dalam waktu yang kurang lebih sama. Waktu menyesuaikan dengan kalender akademik, tidak melebihi batas yudisium. Bertanya ke sekdep 1 tentang nilainya HANYA jika diperlukan untuk keperluan mendesak saja.'
 'Jika TA expired atau jika pembimbing dan atau RMK ganti, maka mesti mengajukan proposal TA ulang dan mengambil Pra-TA lagi.\n\nQ : Setelah sidang, apa yang perlu dilakukan?\n\nA : 1. menyelesaikan revisi (jika ada)\n2. mendapatkan persetujuan dari penguji thdp revisi yang diberikan. Persetujuan bisa dengan menggunakan form revisi/email. Form ada di Pak Yudi Mulyono. Form ini disimpan mahasiswa, tidak wajib untuk dikirim ke dosenpenguji/pembimbing/sekdep 1\n3. mengkompilasi buku versi terakhir\n4. memenuhi persyaratan yudisium\n5. mengisi data wisudawan\n\nQ : Bagaimana follow Up setelah sidang TA?\n\nA : 1. mahasiswa mengerjakan revisi (jika ada)\n2. mahasiswa mengumpulkan persetujuan revisi dari penguji (menggunakan ttd digital atau email)\n3. mahasiswa memenuhi persyaratan-persyaratan yudisium.\n \n\nQ : Berapa lama waktu revisi TA setelah sidang?'
 'Q: MyITS saya bermasalah, bisa lapor kemana?\n\nA: Silakan ajukan tiket ke DPTSI di https://servicedesk.its.ac.id/\n\nQ: Saya ingin mengurus â€œâ€¦..â€ siapa tendik yang harus ditemui?\n\nA: Temui tendik sesuai bidangnya yuk! :)\n\nPersuratan (S1) â†’ Pak Sugeng\nAkademik (S1) â†’ Bu Inka (Kelas, Nilai, MBKM, International Exposure), Bu Icha (Asisten Dosen, MonKP)\nAkademik + Persuratan (S2) â†’ Bu Kartika\nAkademik + Persuratan (S3) â†’ Bu Lina\nPeminjaman Ruang â†’ Pak Husein (Kasubbag)\nKeuangan â†’ Bu Devi, Bu Due\nUrusan Ruang Aula â†’ Pak Jumali\nUrusan Ruang Kelas â†’ Pak Edy\nUrusan Laboratorium â†’ Teknisi Lab. Pak Junaidi (PKT, KCV, LP), Pak Jumali (KBJ, RPL), Pak Gayuh (AP, MCI, GiGA), Pak Kunto (AJK).\nUrusan Keamanan dan Kebersihan â†’ Pak Sukron\nUrusan Kelistrikan â†’ Pak Hari\nQ: Cara mendapatkan transkrip\n\nA: Buka SIM Akademik, masuk ke menu LAPORAN -> TRANSKRIP\n\nQ: Cara mendapatkan surat keterangan aktif mahasiswa\n\nA: Buka SIM Akademik, masuk ke menu SURAT MAHASISWA -> LAYANAN SURAT MAHASISWA']",Mahasiswa telah menempuh 100 SKS.,0.9999999999,1.0,0.9999994305134274,1.0
15,"Setelah sidang, apa yang perlu dilakukan?","Setelah sidang, Anda perlu melakukan beberapa hal, antara lain:

1. Jika Anda ingin mendapatkan Surat Keterangan Lulus, legalisir ijazah, atau surat keterangan selesai TA, Anda dapat mengajukan permohonan ke BIRO UMUM DAN REFORMASI BIROKRASI (BURB) ITS. Informasi lebih lanjut dapat dilihat di https://www.its.ac.id/burb/id/permohonan-surat-keterangan-lulus/.

2. Jika Anda ingin mendapatkan Surat Keterangan Aktif Mahasiswa, Anda dapat membuka SIM Akademik, masuk ke menu SURAT MAHASISWA -> LAYANAN SURAT MAHASISWA.

3. Jika Anda memiliki pertanyaan terkait nilai atau kelas, Anda dapat menghubungi dosen pengampu mata kuliah terkait atau konsultasikan dengan Sekdep 1.

4. Jika Anda memiliki pertanyaan atau kebutuhan lain terkait akademik, Anda dapat menghubungi pihak terkait sesuai dengan bidangnya, seperti Akademik (S1) â†’ Bu Inka, Akademik + Persuratan (S2) â†’ Bu Kartika, Urusan Ruang Kelas â†’ Pak Edy, dan lain sebagainya.

Jika ada hal lain yang perlu Anda tanyakan, silakan sampaikan pertanyaannya.","['Q: MyITS saya bermasalah, bisa lapor kemana?\n\nA: Silakan ajukan tiket ke DPTSI di https://servicedesk.its.ac.id/\n\nQ: Saya ingin mengurus â€œâ€¦..â€ siapa tendik yang harus ditemui?\n\nA: Temui tendik sesuai bidangnya yuk! :)\n\nPersuratan (S1) â†’ Pak Sugeng\nAkademik (S1) â†’ Bu Inka (Kelas, Nilai, MBKM, International Exposure), Bu Icha (Asisten Dosen, MonKP)\nAkademik + Persuratan (S2) â†’ Bu Kartika\nAkademik + Persuratan (S3) â†’ Bu Lina\nPeminjaman Ruang â†’ Pak Husein (Kasubbag)\nKeuangan â†’ Bu Devi, Bu Due\nUrusan Ruang Aula â†’ Pak Jumali\nUrusan Ruang Kelas â†’ Pak Edy\nUrusan Laboratorium â†’ Teknisi Lab. Pak Junaidi (PKT, KCV, LP), Pak Jumali (KBJ, RPL), Pak Gayuh (AP, MCI, GiGA), Pak Kunto (AJK).\nUrusan Keamanan dan Kebersihan â†’ Pak Sukron\nUrusan Kelistrikan â†’ Pak Hari\nQ: Cara mendapatkan transkrip\n\nA: Buka SIM Akademik, masuk ke menu LAPORAN -> TRANSKRIP\n\nQ: Cara mendapatkan surat keterangan aktif mahasiswa\n\nA: Buka SIM Akademik, masuk ke menu SURAT MAHASISWA -> LAYANAN SURAT MAHASISWA'
 'Q: Bagaimana cara mendapatkan Surat Keterangan Lulus, legalisir ijazah dll atau surat keterangan selsai TA?\n\nA: SKL dilayani oleh BIRO UMUM DAN REFORMASI BIROKRASI (BURB)\nhttps://www.its.ac.id/burb/id/permohonan-surat-keterangan-lulus/\nSKL baru akan dikeluarkan jika sudah ada SK kelulusan dari Rektor ITS\n\nSurat keterangan selesai TA diberikan oleh prodi T Informatika. Silakan kirim permohonan ke WA Pak Sugeng +62 856-4843-2445 disertai dengan data diri dan keperluan surat keterangan telah menyelesaikan TA\n \n\nQ: Bagaimana cara berkomunikasi dengan email?\n\nA: Email adalah media komunikasi resmi dari institusi, sedangkan WA bukan.\nTuliskan salam, isi email, dan ditutup dengan salam.\ncontoh adalah sebagai berikut\n-------------------------------------------------------------------------------------------------------\nAssalamualaikum/Selamat Pagi'
 'Frequently Asked Question\nAcademic Support ðŸ“– \nQ: Nilai saya belum keluar/salah, banding nilainya bagaimana?\n\nA: Untuk kelas MBKM, Isi form ralat nilai beserta bukti dukung â†’ tunggu nilai berubah. Form dibagikan ke mahasiswa setelah rilis nilai MBKM (ctt : periode rilis nilai MBKM berbeda dengan nilai kelas reguler).\n\nUntuk kelas reguler, komunikasikan dengan dosen pengampu MK masing - masing.\n\nQ: Kelas saya bentrok, bagaimana cara pindah kelas?\n\nA: Cari kelas dengan jadwal yang sesuai â†’ konsultasikan ke dosen wali & pengampu MK â†’ laporkan ke Sekdep 1 (+cc Bu Inka jika via email) â†’ bersabar sampai kelasnya dirubah.\n\nQ: Apakah wajib mengisi kuisioner dan IPD di akhir semester?\n\nA: WAJIB. Tolong diisi ya.\n\nQ: Berapa sks mata kuliah pengayaan yang bisa diambil?\n\nA: Di peraturan akademik mengambil MK pengayaan maksimal 6 sks dan minimum 3 sks.\n\nQ: Apakah mata kuliah pengayaan bisa di-drop?'
 'BAB V BENTUK APRESIASI\n\nPasal 8\n(1) Apresiasi Lomba Kementerian dan        Lomba Mandiri bagi dosen Pembimbing kompetisi yang diikuti oleh Mahasiswa yang meraih medali/juara berupa:\na. piagam/ sertifikat atau t.anda jasa;\nb. angka kredit kepegawaian (Kum B) untuk Beban Kerja Dosen (BKD) yang terintegrasi dengan sistem informasi kepegawaian ITS; dan/atau\nc. reward sesuai dengan SBI.\n(2) Apresiasi Lomba Kementerian dan Lomba Mandiri bagi Mahasiswa berupa:\na. reward sesuai dengan SBI;\nb. konversi nilai akademik (SKS) untuk setiap lomba yang diputuskan oleh tim\nreviewer Departemen;\nc. konversi nilai Satuan Kredit Ekstrakurikuler Mahasiswa (SKEM) untuk setiap lomba yang diputuskan oleh tim review direktorat yang mengurusi kemahasiswaan;dan/atau\nd. beasiswa Magister di seluruh program studi yang ada di ITS selama waktu\nyang ditentukan.\n(3) Setiap perolehan medali/juara di setiap kompetisi sebagaimana disebutkan dalam Pasal 6 ayat (2) juga mendapatkan apresiasi berupa nominal uang.']",1. Menyelesaikan revisi (jika ada). 2. Mendapatkan persetujuan dari penguji terhadap revisi yang diberikan dengan menggunakan form revisi/email. 3. Mengkompilasi buku versi terakhir. 4. Memenuhi persyaratan yudisium. 5. Mengisi data wisudawan.,0.999999999975,0.8571428571428571,0.808896493007469,0.0
16,Kapan nilai Pra-TA atau TA keluar?,"Nilai Pra-TA atau TA akan dientry ke integra secara batch operation dalam waktu yang kurang lebih sama. Waktu penentuan keluarnya nilai tersebut akan disesuaikan dengan kalender akademik dan tidak akan melebihi batas yudisium. Jika diperlukan informasi lebih lanjut tentang nilai tersebut, Anda dapat bertanya ke sekdep 1 hanya jika untuk keperluan mendesak saja.","['Q : Apakah syarat mengambil mata kuliah Pra-TA?\n\nA : Mahasiswa telah menempuh 100 SKS\n\nQ : Bolehkan saya mengambil Pra-TA dan TA pada semester yang bersamaan?\n\nA : Jika di semester sebelumnya sudah pernah mengambil Pra TA dan tidak berhasil mengumpulkan proposal TA, makan boleh diambil bersamaan dengan TA di semester sekarang.\n\nQ : Untuk mengambil mata kuliah Tugas Akhir, apakah ada jumlah minimum sks yang harus diambil untuk mata kuliah dengan RMK TA yang sama?\n\nA : Tidak ada aturan yang baku yang mengatur ini. Hanya saja, akan sangat membantu TA jika difokuskan untuk mengambil MK yang mendukung TA yang akan diambil di sebuah RMK. \n \n\nQ : Bagaimana prosedur pergantian Judul Tugas Akhir?\n\nA : Jika Pembimbing dan RMK tetap dan hanya melakukan penyesuaian judul/metode, maka cukup dilakukan dengan mengisi form pergantian judul yang ada di link akademik.\n\nJika TA expired atau jika pembimbing dan atau RMK ganti, maka mesti mengajukan proposal TA ulang dan mengambil Pra-TA lagi.'
 'Q : Berapa lama waktu revisi TA setelah sidang?\n\nA : Umumnya sekitar maksimum dua pekan setelah sidang TA. Lebih baik jika bisa selesai sebelum itu, sehingga dapat mempersiapkan berkas-berkas untuk yudisium dan wisuda.\n \n\nQ : Kemanakah saya mengumpulkan lembar revisi?\n\nA : Revisi yang telah disetujui oleh penguji dipakai dasar untuk membuat buku TA versi final untuk persyaratan yudisium. Dosen pembimbing dikirim kopiannya melalui email\n \n\nQ : Dimana panduan tentang POMITS\n\nA : http://ejurnal.its.ac.id/ \n\nQ : Kapan nilai Pra TA atau TA keluar?\n\nA : Nilai KP, nilai Pra TA dan TA akan dientry ke integra secara batch operation dalam waktu yang kurang lebih sama. Waktu menyesuaikan dengan kalender akademik, tidak melebihi batas yudisium. Bertanya ke sekdep 1 tentang nilainya HANYA jika diperlukan untuk keperluan mendesak saja.'
 'Jika TA expired atau jika pembimbing dan atau RMK ganti, maka mesti mengajukan proposal TA ulang dan mengambil Pra-TA lagi.\n\nQ : Setelah sidang, apa yang perlu dilakukan?\n\nA : 1. menyelesaikan revisi (jika ada)\n2. mendapatkan persetujuan dari penguji thdp revisi yang diberikan. Persetujuan bisa dengan menggunakan form revisi/email. Form ada di Pak Yudi Mulyono. Form ini disimpan mahasiswa, tidak wajib untuk dikirim ke dosenpenguji/pembimbing/sekdep 1\n3. mengkompilasi buku versi terakhir\n4. memenuhi persyaratan yudisium\n5. mengisi data wisudawan\n\nQ : Bagaimana follow Up setelah sidang TA?\n\nA : 1. mahasiswa mengerjakan revisi (jika ada)\n2. mahasiswa mengumpulkan persetujuan revisi dari penguji (menggunakan ttd digital atau email)\n3. mahasiswa memenuhi persyaratan-persyaratan yudisium.\n \n\nQ : Berapa lama waktu revisi TA setelah sidang?'
 'Bersama dengan ini saya sertakan dokumen revisi TA saya dengan poin sebagai berikut:\n- perbaikan ....\nMohon berkenan memeriksa dan menginformasikan jika ada yang perlu saya perbaiki.\n\nDemikian, terima kasih\nAgus\n0511000..â€¦\n\nQ: Bagaimana mendapatkan surat keterangan yang tidak ada di menu integra, contoh surat keterangan selesai TA dan lulus >=144 SKS?\n\nA: kirim ke WA Pak Sugeng +62 856-4843-2445\n------------------------------------------------------------------------------\nKepada Yth\nBapak Ary Mazharuddin Shiddiqi\ndi tempat\n\nDengan hormat,\nDengan surat ini saya,\n\nNama: \nNRP: \nTempat/Tgl lahir: \nAlamat sekarang: \nSKS Lulus:\nemail aktif:\nNo HP aktif:\n\nBermaksud untuk mengajukan permohonan kepada Bapak Ary guna memperoleh Surat Keterangan Selesai Tugas Akhir.\n\nDemikian surat ini saya ajukan dan atas terkabulnya permohonan ini, saya ucapkan terimakasih\n\nSurabaya, .â€¦']","Nilai KP, nilai Pra-TA, dan TA akan dientry ke integra secara batch operation dalam waktu yang kurang lebih sama, menyesuaikan dengan kalender akademik, tidak melebihi batas yudisium. Bertanya ke sekdep 1 tentang nilainya hanya jika diperlukan untuk keperluan mendesak.",0.9999999999666667,1.0,0.0,1.0
17,Siapa yang dapat memperoleh apresiasi dalam kompetisi yang diadakan oleh Kementerian atau Lomba Mandiri bereputasi skala nasional atau internasional?,"Mahasiswa dan dosen pembimbing yang memenuhi syarat dapat memperoleh apresiasi dalam kompetisi yang diadakan oleh Kementerian atau Lomba Mandiri bereputasi skala nasional atau internasional. Mahasiswa yang dapat memperoleh apresiasi adalah juara 1, juara 2, juara 3, dan Finalis pada kegiatan kompetisi tersebut, yang dibuktikan dengan sertifikat. Sedangkan dosen pembimbing yang dapat memperoleh apresiasi adalah dosen aktif yang ada di ITS dan memiliki Surat Keputusan Rektor sebagai Pembimbing kegiatan kompetisi kemahasiswaan.","['BAB V BENTUK APRESIASI\n\nPasal 8\n(1) Apresiasi Lomba Kementerian dan        Lomba Mandiri bagi dosen Pembimbing kompetisi yang diikuti oleh Mahasiswa yang meraih medali/juara berupa:\na. piagam/ sertifikat atau t.anda jasa;\nb. angka kredit kepegawaian (Kum B) untuk Beban Kerja Dosen (BKD) yang terintegrasi dengan sistem informasi kepegawaian ITS; dan/atau\nc. reward sesuai dengan SBI.\n(2) Apresiasi Lomba Kementerian dan Lomba Mandiri bagi Mahasiswa berupa:\na. reward sesuai dengan SBI;\nb. konversi nilai akademik (SKS) untuk setiap lomba yang diputuskan oleh tim\nreviewer Departemen;\nc. konversi nilai Satuan Kredit Ekstrakurikuler Mahasiswa (SKEM) untuk setiap lomba yang diputuskan oleh tim review direktorat yang mengurusi kemahasiswaan;dan/atau\nd. beasiswa Magister di seluruh program studi yang ada di ITS selama waktu\nyang ditentukan.\n(3) Setiap perolehan medali/juara di setiap kompetisi sebagaimana disebutkan dalam Pasal 6 ayat (2) juga mendapatkan apresiasi berupa nominal uang.'
 'DENGAN RAHMAT TUHAN YANG MAHA ESA REKTOR INSTITUT TEKNOLOGI SEPULUH NOPEMBER,\nMenimbang : a. bahwa dalam rangka memotivasi mahasiswa dan dosen untuk berpartisipasi aktif dan berprestasi dalam berbagai kegiatan kemahasiswaan, perlu diberikan apresiasi yang berkeadilan dan terstruktur sesuai tingkatan prestasi yang telah dicapai;\nb. bahwa Peraturan Rektor Institut Teknologi Sepuluh Nopember Nomor 27 Tahun 2022 tentang Pemberian Apresiasi Bagi Mahasiswa Beprestasi dan Dosen Pembimbing di Bidang Kompetisi Kemahasiswaan Institut Teknologi Sepuluh Nopember perlu dilakukan penyesuaian memenuhi perkembangan akademik dan kemahasiswaan di lingkungan Institut Teknologi Sepuluh Nopember,'
 'BAB III\nSYARAT DAN TINGKAT PRESTASI\n\nBagianKesatu\nSyarat Prestasi Lomba Kementerian\n\n\n\n(1) Syarat untuk Mahasiswa:\n\nPasal 4\n\na. Mahasiswa aktif yang terdaftar di sistem akademik ITS;\n\nb. Mahasiswa memiliki surat tugas dari direktorat yang mengurusi kemahasiswaan/dekan untuk mengikuti kompetisi tersebut; dan\nc. Mahasiswa yang mendapatkan Apresiasi adalah juara 1, juara 2, juara 3, dan Finalis pada kegiatan kompetisi yang diadakan oleh Kementerian atau Lomba Mandiri bereputasi dengan skala nasional ataupun internasional dibuktikan dengan sertifikat\n(2) Syarat untuk Pembimbing:\na. dosen aktif yang ada di ITS; dan\nb. dosen yang mempunyai Surat Keputusan Rektor sebagai Pembimbing kegiatan kompetisi kemahasiswaan.\n(3) Syarat untuk Dosen Penalaran yaitu dosen aktif yang tergabung pada kegiatan penalaran yang dibuktikan dengan Surat Keputusan Rektor dan mendukung kegiatan kompetisi yang diselenggarakan oleh Kementerian.\n\nBagian Kedua\nSyarat Prestasi Lomba Mandiri'
 'Bagian Ketiga Tingkat Prestasi\n\nPasal 6\n(1) Level/kategori kompetisi yang diakui sebagai prestasi adalah kompetisi tingkat nasional ataupun internasional baik yang diadakan Kementerian ataupun Lomba Mandiri yang bereputasi\n(2) Prestasi dalam lomba yang diakui:\na. Prestasi yang diakui adalah juara 1, 2, 3 dan Fina1is untuk kompetisi yang diadakan Kementerian ataupun Lomba Mandiri yang bereputasi.\n\nb. Lomba mandiri bereputasi memiliki katagori sebagai berikut:\n1. skala        nasional:        kompetisi        diikuti        oleh        perguruan        tinggi/lembaga riset/inst.ansi resmi lainnya sesuai dengan ketentuan Kementerian.\n2. Skala Internasional: kompetisi diikuti oleh perguruan tinggi/lembaga riset/inst.ansi resmi sesuai dengan ketentuan Kementerian.\n\nBAB IV\nPROSEDUR PENGAJUAN MENDAPATKAN APRESIASI']",Mahasiswa yang aktif dan terdaftar di sistem akademik ITS dan mempunyai sertifikat prestasi,0.999999999975,1.0,0.982521403898374,1.0
18,Apa syarat untuk dosen pembimbing agar dapat memperoleh apresiasi?,"Syarat untuk dosen pembimbing agar dapat memperoleh apresiasi adalah sebagai berikut:
1. Dosen pembimbing harus menjadi kompetisi yang diikuti oleh Mahasiswa yang meraih medali/juara.
2. Apresiasi berupa piagam/sertifikat atau tanda jasa.
3. Angka kredit kepegawaian (Kum B) untuk Beban Kerja Dosen (BKD) yang terintegrasi dengan sistem informasi kepegawaian ITS.
4. Reward sesuai dengan SBI.","['BAB V BENTUK APRESIASI\n\nPasal 8\n(1) Apresiasi Lomba Kementerian dan        Lomba Mandiri bagi dosen Pembimbing kompetisi yang diikuti oleh Mahasiswa yang meraih medali/juara berupa:\na. piagam/ sertifikat atau t.anda jasa;\nb. angka kredit kepegawaian (Kum B) untuk Beban Kerja Dosen (BKD) yang terintegrasi dengan sistem informasi kepegawaian ITS; dan/atau\nc. reward sesuai dengan SBI.\n(2) Apresiasi Lomba Kementerian dan Lomba Mandiri bagi Mahasiswa berupa:\na. reward sesuai dengan SBI;\nb. konversi nilai akademik (SKS) untuk setiap lomba yang diputuskan oleh tim\nreviewer Departemen;\nc. konversi nilai Satuan Kredit Ekstrakurikuler Mahasiswa (SKEM) untuk setiap lomba yang diputuskan oleh tim review direktorat yang mengurusi kemahasiswaan;dan/atau\nd. beasiswa Magister di seluruh program studi yang ada di ITS selama waktu\nyang ditentukan.\n(3) Setiap perolehan medali/juara di setiap kompetisi sebagaimana disebutkan dalam Pasal 6 ayat (2) juga mendapatkan apresiasi berupa nominal uang.'
 'Pasal 9\nKetentuan lebih lanjut mengenai syarat, prosedur dan bentuk apresiasi diatur lebih lanjut dalam petunjuk teknis Wakil Rektor yang membidangi kemahasiswaan.\n\nBAB VI\nKETENTUAN PENUTUP\n\nPasal 10\nPada saat Peraturan Rektor ini mulai berlaku, Peraturan Rektor Institut Teknologi Sepuluh Nopember Nomor 27 Tahun 2022 tentang Pemberian Apresiasi Bagi Mahasiswa Beprestasi dan Dosen Pembimbing di Bidang Kompetisi Kemahasiswaan lnstitut Teknologi Sepuluh Nopember, dicabut dan dinyatakan tidak berlaku.\n\nPasal 11\nPeraturan Rektor ini mulai berlaku pada tanggal ditetapkan.\n\nDitetapkan di Surabaya\npada tanggal 3 Januari 2023\nREKTOR INSTITUT TEKNOLOGI SEPULUH NOPEMBER,\n\n\n\n\nMOCHAMAD ASHARI\nNIP 196510121990031003'
 'Q: MyITS saya bermasalah, bisa lapor kemana?\n\nA: Silakan ajukan tiket ke DPTSI di https://servicedesk.its.ac.id/\n\nQ: Saya ingin mengurus â€œâ€¦..â€ siapa tendik yang harus ditemui?\n\nA: Temui tendik sesuai bidangnya yuk! :)\n\nPersuratan (S1) â†’ Pak Sugeng\nAkademik (S1) â†’ Bu Inka (Kelas, Nilai, MBKM, International Exposure), Bu Icha (Asisten Dosen, MonKP)\nAkademik + Persuratan (S2) â†’ Bu Kartika\nAkademik + Persuratan (S3) â†’ Bu Lina\nPeminjaman Ruang â†’ Pak Husein (Kasubbag)\nKeuangan â†’ Bu Devi, Bu Due\nUrusan Ruang Aula â†’ Pak Jumali\nUrusan Ruang Kelas â†’ Pak Edy\nUrusan Laboratorium â†’ Teknisi Lab. Pak Junaidi (PKT, KCV, LP), Pak Jumali (KBJ, RPL), Pak Gayuh (AP, MCI, GiGA), Pak Kunto (AJK).\nUrusan Keamanan dan Kebersihan â†’ Pak Sukron\nUrusan Kelistrikan â†’ Pak Hari\nQ: Cara mendapatkan transkrip\n\nA: Buka SIM Akademik, masuk ke menu LAPORAN -> TRANSKRIP\n\nQ: Cara mendapatkan surat keterangan aktif mahasiswa\n\nA: Buka SIM Akademik, masuk ke menu SURAT MAHASISWA -> LAYANAN SURAT MAHASISWA'
 'DENGAN RAHMAT TUHAN YANG MAHA ESA REKTOR INSTITUT TEKNOLOGI SEPULUH NOPEMBER,\nMenimbang : a. bahwa dalam rangka memotivasi mahasiswa dan dosen untuk berpartisipasi aktif dan berprestasi dalam berbagai kegiatan kemahasiswaan, perlu diberikan apresiasi yang berkeadilan dan terstruktur sesuai tingkatan prestasi yang telah dicapai;\nb. bahwa Peraturan Rektor Institut Teknologi Sepuluh Nopember Nomor 27 Tahun 2022 tentang Pemberian Apresiasi Bagi Mahasiswa Beprestasi dan Dosen Pembimbing di Bidang Kompetisi Kemahasiswaan Institut Teknologi Sepuluh Nopember perlu dilakukan penyesuaian memenuhi perkembangan akademik dan kemahasiswaan di lingkungan Institut Teknologi Sepuluh Nopember,']",Dosen aktif yang ada di ITS dan mempunyai Surat Keputusan Rektor sebagai Pembimbing kegiatan kompetisi kemahasiswaan,0.9166666666361111,0.75,0.9529938496245741,1.0
19,Apa bentuk dari apresiasi bagi Mahasiswa?,"Bentuk apresiasi bagi Mahasiswa berdasarkan Peraturan Rektor adalah sebagai berikut:
1. Reward sesuai dengan SBI
2. Konversi nilai akademik (SKS) untuk setiap lomba yang diputuskan oleh tim reviewer Departemen
3. Konversi nilai Satuan Kredit Ekstrakurikuler Mahasiswa (SKEM) untuk setiap lomba yang diputuskan oleh tim review direktorat yang mengurusi kemahasiswaan
4. Beasiswa Magister di seluruh program studi yang ada di ITS selama waktu yang ditentukan
5. Setiap perolehan medali/juara di setiap kompetisi juga mendapatkan apresiasi berupa nominal uang.","['Pasal 9\nKetentuan lebih lanjut mengenai syarat, prosedur dan bentuk apresiasi diatur lebih lanjut dalam petunjuk teknis Wakil Rektor yang membidangi kemahasiswaan.\n\nBAB VI\nKETENTUAN PENUTUP\n\nPasal 10\nPada saat Peraturan Rektor ini mulai berlaku, Peraturan Rektor Institut Teknologi Sepuluh Nopember Nomor 27 Tahun 2022 tentang Pemberian Apresiasi Bagi Mahasiswa Beprestasi dan Dosen Pembimbing di Bidang Kompetisi Kemahasiswaan lnstitut Teknologi Sepuluh Nopember, dicabut dan dinyatakan tidak berlaku.\n\nPasal 11\nPeraturan Rektor ini mulai berlaku pada tanggal ditetapkan.\n\nDitetapkan di Surabaya\npada tanggal 3 Januari 2023\nREKTOR INSTITUT TEKNOLOGI SEPULUH NOPEMBER,\n\n\n\n\nMOCHAMAD ASHARI\nNIP 196510121990031003'
 'BAB V BENTUK APRESIASI\n\nPasal 8\n(1) Apresiasi Lomba Kementerian dan        Lomba Mandiri bagi dosen Pembimbing kompetisi yang diikuti oleh Mahasiswa yang meraih medali/juara berupa:\na. piagam/ sertifikat atau t.anda jasa;\nb. angka kredit kepegawaian (Kum B) untuk Beban Kerja Dosen (BKD) yang terintegrasi dengan sistem informasi kepegawaian ITS; dan/atau\nc. reward sesuai dengan SBI.\n(2) Apresiasi Lomba Kementerian dan Lomba Mandiri bagi Mahasiswa berupa:\na. reward sesuai dengan SBI;\nb. konversi nilai akademik (SKS) untuk setiap lomba yang diputuskan oleh tim\nreviewer Departemen;\nc. konversi nilai Satuan Kredit Ekstrakurikuler Mahasiswa (SKEM) untuk setiap lomba yang diputuskan oleh tim review direktorat yang mengurusi kemahasiswaan;dan/atau\nd. beasiswa Magister di seluruh program studi yang ada di ITS selama waktu\nyang ditentukan.\n(3) Setiap perolehan medali/juara di setiap kompetisi sebagaimana disebutkan dalam Pasal 6 ayat (2) juga mendapatkan apresiasi berupa nominal uang.'
 'DENGAN RAHMAT TUHAN YANG MAHA ESA REKTOR INSTITUT TEKNOLOGI SEPULUH NOPEMBER,\nMenimbang : a. bahwa dalam rangka memotivasi mahasiswa dan dosen untuk berpartisipasi aktif dan berprestasi dalam berbagai kegiatan kemahasiswaan, perlu diberikan apresiasi yang berkeadilan dan terstruktur sesuai tingkatan prestasi yang telah dicapai;\nb. bahwa Peraturan Rektor Institut Teknologi Sepuluh Nopember Nomor 27 Tahun 2022 tentang Pemberian Apresiasi Bagi Mahasiswa Beprestasi dan Dosen Pembimbing di Bidang Kompetisi Kemahasiswaan Institut Teknologi Sepuluh Nopember perlu dilakukan penyesuaian memenuhi perkembangan akademik dan kemahasiswaan di lingkungan Institut Teknologi Sepuluh Nopember,'
 'Frequently Asked Question\nAcademic Support ðŸ“– \nQ: Nilai saya belum keluar/salah, banding nilainya bagaimana?\n\nA: Untuk kelas MBKM, Isi form ralat nilai beserta bukti dukung â†’ tunggu nilai berubah. Form dibagikan ke mahasiswa setelah rilis nilai MBKM (ctt : periode rilis nilai MBKM berbeda dengan nilai kelas reguler).\n\nUntuk kelas reguler, komunikasikan dengan dosen pengampu MK masing - masing.\n\nQ: Kelas saya bentrok, bagaimana cara pindah kelas?\n\nA: Cari kelas dengan jadwal yang sesuai â†’ konsultasikan ke dosen wali & pengampu MK â†’ laporkan ke Sekdep 1 (+cc Bu Inka jika via email) â†’ bersabar sampai kelasnya dirubah.\n\nQ: Apakah wajib mengisi kuisioner dan IPD di akhir semester?\n\nA: WAJIB. Tolong diisi ya.\n\nQ: Berapa sks mata kuliah pengayaan yang bisa diambil?\n\nA: Di peraturan akademik mengambil MK pengayaan maksimal 6 sks dan minimum 3 sks.\n\nQ: Apakah mata kuliah pengayaan bisa di-drop?']","Reward sesuai dengan SBI, konversi nilai akademik (SKS), konversi nilai SKEM, dan/atau beasiswa Magister",0.9999999999666667,1.0,0.9566753380867259,1.0
