,question,answer,contexts,ground_truth,context_precision,faithfulness,answer_relevancy,context_recall
0,Apa itu Tesis?,"Tesis adalah karya tulis ilmiah yang disusun oleh seorang mahasiswa sebagai syarat untuk memperoleh gelar akademik, seperti gelar sarjana atau magister. Tesis biasanya berisi penelitian yang mendalam tentang suatu topik tertentu dan harus disusun dengan metodologi yang benar serta didukung oleh data dan analisis yang valid. Tesis juga harus disetujui oleh dosen pembimbing dan penguji sebelum mahasiswa dapat memperoleh gelar tersebut.","['pendaftaran sidang proposal tesis melalui MonTes dan grup whatsapp.  \n3. Mahasiswa yang ingin mendaftar sidang proposal tesis, harus melengkapi berkas \npersyaratan  pendafta ran sidang proposal tesis , meliputi  draft proposal tesis dan lembar  \npersetujuan pembimbing. Apabila kedua dokumen tersebut sudah lengkap, mahasiswa \ndapat melakukan pendaftaran melalui Google Form dengan link \nhttps://bit.ly/DaftarSidangPropTesGasal2122 . \n4. Admin Akademik Pascasarjana  memverikasi berkas persyaratan pendaftaran sidang \nproposal tesis . Apabila berkas sudah memenuhi, kemudian meng -input data mahasiswa \nyang mendaftar sidang proposal tesis ke MonTes  dan mengatur status menjadi â€˜Terdaftarâ€™.  \n5. Admin Akademik Pascasarjana  merekap data mahasiswa pendaftar sidang proposal tesis \ndi Microsoft Excel dan mengirimkan file hasil rekapitulasi data pendaf tar sidang proposal \ntesis ke masing -masing ketua RMK yang terkait dengan topik penelitian tesis mahasiswa'
 'hasil revisiDokumen hasil\nrevisi sidang\nproposal tesis  \nApakah revisi\nsudah sesuai?Dokumen hasil\nrevisi sidang\nproposal tesis  Ketua RMK menentukan penguji\ndan menjadwalkan sidang\nproposal tesis setiap pesertaSOP PENDAFT ARAN SIDANG PROPOSAL TESIS PROGRAM STUDI S2 TEKNIK INFORMA TIKA (SISTEM ONLINE ), FT -EIC, ITS  \nYaDraft proposal tesis\ndan form persetujuan\npembimbing\nPemeriksa,\n \n \n \n \n \nLina Ambarwati, S.Kom.  \nNIP. 198003242014092001  Mengetahui,\nDr. Ahmad Saikhu, S.Si., M.T . \nNIP. 197107182006041001Pembuat,\n \n \n \n \n \nKartika Dwi Y uniavita Rahmawati, S.T .\nNPP. 1998202122056  \nJadwal sidang, link\nmeeting, dan VB\nTidak\nMenginfokan link google form\nuntuk meng-upload  seluruh\ndokumen hasil revisi sidang\nproposal tesis ke mahasiswa\nStatus sidang\nproposal tesis\nmenjadi ""Disetujui""Merekap data mahasiswa yang\ntelah menyelesaikan revisi\nsidang proposal tesis dan\nmenginfokan ke Kaprodi\nMeng-update status sidang\nproposal tesis di MonT esMeng-upload lembar revisi sidang'
 '10. Mahasiswa melaksanakan sidang proposal tesis. Sedangkan, dosen pembimbing dan \npenguji memberikan feedback ke mahasiswa, mengisi berita acara , memberikan penilaian \ndan catatan revisi  sidang proposal tesis.  \n11. Setelah mahasiswa melaksanakan sidang proposal tesis, Admin Akademik Pascasarjana  \nmeng -update status sidang proposal tesis di MonTes dari â€˜Terjadwal Ujianâ€™ menjadi \nâ€˜Revisi â€™. \n12. Mahasiswa mengerjakan revisi dan menyusun buku proposal tesis sesuai dengan hasil \ndiskusi ketika sidang proposal tesis dan/atau sesuai catatan dalam lembar revisi. Apabila \nsudah selesai mengerjakan revisi, mahasiswa dapat memberikan hasil revisinya ke dosen \npembimbing dan penguji serta mengajukan lembar revisi dan lembar pengesahan buku \nproposal tesis untuk meminta persetujuan ke dosen pembimbing dan penguji. Batas \npengerjaan revi si adalah 2 minggu setelah sidang proposal tesis berlangsung.  \n13. Apabila revisi yang dikerjakan mahasiswa dirasa sudah tepat, dosen pembimbing dan'
 'Lampiran 4\nContoh abstrak proposal tesis dalam Bahasa Indonesia\nINFILTRASI AIR HUJAN DAN KEGEMPAAN TERINDUKSI\nLERENG STABILITAS PADA TANAH SISA\nMENGGUNAKAN RESISTIVITAS DAN PENGUKURAN\nMICROTREMOR\nMahasiswa Nama\nMahasiswa ID\nPembimbing\nCo-Supervisor\n: Dwa Desa Warnana\n: 3107 301 202\n: Dr. Ir. Ria A. A. Soemitro, M.Eng\n: Dr. Ir. Widya Utama, DEA.\nABSTRAK\nPenggunaan metode resistivitas dan mikrotremor dalam']",Tesis adalah karya ilmiah yang ditulis untuk memenuhi salah satu syarat untuk menyelesaikan studi pascasarjana strata 2 (program Magister) di Institut Teknologi Sepuluh Nopember Surabaya.,,0.8055555555287036,0.0,0.9934254086702788
1,Bagaimana Ketentuan Abstrak dalam penulisan Tesis,"Tidak ada informasi spesifik mengenai ketentuan abstrak dalam penulisan tesis dalam konteks yang diberikan. Oleh karena itu, saya tidak dapat memberikan jawaban yang tepat.","['hasil revisiDokumen hasil\nrevisi sidang\nproposal tesis  \nApakah revisi\nsudah sesuai?Dokumen hasil\nrevisi sidang\nproposal tesis  Ketua RMK menentukan penguji\ndan menjadwalkan sidang\nproposal tesis setiap pesertaSOP PENDAFT ARAN SIDANG PROPOSAL TESIS PROGRAM STUDI S2 TEKNIK INFORMA TIKA (SISTEM ONLINE ), FT -EIC, ITS  \nYaDraft proposal tesis\ndan form persetujuan\npembimbing\nPemeriksa,\n \n \n \n \n \nLina Ambarwati, S.Kom.  \nNIP. 198003242014092001  Mengetahui,\nDr. Ahmad Saikhu, S.Si., M.T . \nNIP. 197107182006041001Pembuat,\n \n \n \n \n \nKartika Dwi Y uniavita Rahmawati, S.T .\nNPP. 1998202122056  \nJadwal sidang, link\nmeeting, dan VB\nTidak\nMenginfokan link google form\nuntuk meng-upload  seluruh\ndokumen hasil revisi sidang\nproposal tesis ke mahasiswa\nStatus sidang\nproposal tesis\nmenjadi ""Disetujui""Merekap data mahasiswa yang\ntelah menyelesaikan revisi\nsidang proposal tesis dan\nmenginfokan ke Kaprodi\nMeng-update status sidang\nproposal tesis di MonT esMeng-upload lembar revisi sidang'
 'pengerjaan revi si adalah 2 minggu setelah sidang proposal tesis berlangsung.  \n13. Apabila revisi yang dikerjakan mahasiswa dirasa sudah tepat, dosen pembimbing dan \npenguji dapat memberikan persetujuan yang dibuktikan dengan menandatangi form revisi  \ndan lembar pengesahan buku proposal tesis . 14. Admin Akademik Pascasarjana  menginfokan link untuk upload hasil revisi sidang \nproposal tesis ke mahasiswa melalui grup Whatsapp.  \n15. Mahasiswa meng -upload file hasil revisi sidang proposal tesis dan lembar revisi sidang \nproposal tesis ke link https://bit.ly/HasilRevisiProposalTesisDTIf . \n16. Apabila mahasiswa sudah mengumpulkan softfile buku proposal tesis, Admin Akademik \nPascasarjana  mengubah status sidang proposal tesis di MonTes  dari â€˜Revisiâ€™  menjad i \nâ€˜Disetujuiâ€™.  \n17. Mahasiswa dapat mengecek nilai sidang proposal tesis di SIAKAD ITS mata kuliah IF \n185301 Tesis -Proposal.  \n \n \nNotes: Link google form akan di -update setiap tahun ajaran'
 'Frequently Asked Question\nAcademic Support ðŸ“– \nQ: Nilai saya belum keluar/salah, banding nilainya bagaimana?\n\nA: Untuk kelas MBKM, Isi form ralat nilai beserta bukti dukung â†’ tunggu nilai berubah. Form dibagikan ke mahasiswa setelah rilis nilai MBKM (ctt : periode rilis nilai MBKM berbeda dengan nilai kelas reguler).\n\nUntuk kelas reguler, komunikasikan dengan dosen pengampu MK masing - masing.\n\nQ: Kelas saya bentrok, bagaimana cara pindah kelas?\n\nA: Cari kelas dengan jadwal yang sesuai â†’ konsultasikan ke dosen wali & pengampu MK â†’ laporkan ke Sekdep 1 (+cc Bu Inka jika via email) â†’ bersabar sampai kelasnya dirubah.\n\nQ: Apakah wajib mengisi kuisioner dan IPD di akhir semester?\n\nA: WAJIB. Tolong diisi ya.\n\nQ: Berapa sks mata kuliah pengayaan yang bisa diambil?\n\nA: Di peraturan akademik mengambil MK pengayaan maksimal 6 sks dan minimum 3 sks.\n\nQ: Apakah mata kuliah pengayaan bisa di-drop?'
 'Apakah berkas\nsudah lengkap?\nMelakukan pendaftaran sidang\nproposal tesis\nMeminta tanda tangan form revisi\nke dosen pembimbing dan\npenguji dan lembar pengesahan\nke dosen pembimbingJadwal sidang, link\nmeeting, form penilaian\ndan form berita acara  \nMengajukan hasil revisi\nke dosen pembimbing\ndan pengujiMelengkapi dan memeriksa\nberkas persyaratan pendaftaran\nsidang proposal tesis\nTidak\nYa\nCatatan revisi sidang proposal\ntesis dan data penilaian sidang\nproposal tesis dari\npembimbing dan penguji\nMahasiswa dapat mengecek nilai\nsidang proposal tesis melalui\nSIAKAD ITS di akhir semester\n(IF 185301 T esis-Proposal)Dosen (Pembimbing, Penguji, Ketua RMK)\nDosen pembimbing dan penguji\nmenandatangani form revisi dan\nlembar pengesahan, lalu\nmenyerahkan kembali ke mahasiswaDosen pembimbing\ndan penguji memeriksa\nhasil revisiDokumen hasil\nrevisi sidang\nproposal tesis  \nApakah revisi\nsudah sesuai?Dokumen hasil\nrevisi sidang\nproposal tesis  Ketua RMK menentukan penguji\ndan menjadwalkan sidang']","Abstrak berjarak 2 spasi dari kata ABSTRAK, yang tertulis di tengah halaman, dengan ukuran font 14, dicetak tebal, dan menggunakan huruf kapital untuk semua huruf (upper case).",0.0,0.0,0.0,0.0
2,Apa saja tata tertib pelaksanaan sidang proposal Tesis?,"Tata tertib pelaksanaan sidang proposal Tesis meliputi:
1. Peserta sidang proposal tesis harus menyiapkan perangkat laptop yang memadai dan jaringan internet yang stabil serta berada di tempat yang kondusif.
2. Peserta sidang proposal tesis harus menyiapkan aplikasi Zoom dengan fitur kamera dan audio yang dapat berfungsi dengan baik.
3. Peserta sidang proposal tesis harus menyiapkan file presentasi berupa PPT dan draft proposal tesis.
4. Waktu sidang proposal tesis berlangsung selama 60 menit, terdiri dari 15 menit presentasi dan 45 menit tanya jawab.
5. Peserta sidang proposal tesis disarankan untuk standby 30 menit sebelum jadwal yang ditentukan dan dapat bergabung pada link zoom meeting sesuai jadwal yang telah ditentukan atau sesuai instruksi dari dosen pembimbing/penguji.","['Apakah berkas\nsudah lengkap?\nMelakukan pendaftaran sidang\nproposal tesis\nMeminta tanda tangan form revisi\nke dosen pembimbing dan\npenguji dan lembar pengesahan\nke dosen pembimbingJadwal sidang, link\nmeeting, form penilaian\ndan form berita acara  \nMengajukan hasil revisi\nke dosen pembimbing\ndan pengujiMelengkapi dan memeriksa\nberkas persyaratan pendaftaran\nsidang proposal tesis\nTidak\nYa\nCatatan revisi sidang proposal\ntesis dan data penilaian sidang\nproposal tesis dari\npembimbing dan penguji\nMahasiswa dapat mengecek nilai\nsidang proposal tesis melalui\nSIAKAD ITS di akhir semester\n(IF 185301 T esis-Proposal)Dosen (Pembimbing, Penguji, Ketua RMK)\nDosen pembimbing dan penguji\nmenandatangani form revisi dan\nlembar pengesahan, lalu\nmenyerahkan kembali ke mahasiswaDosen pembimbing\ndan penguji memeriksa\nhasil revisiDokumen hasil\nrevisi sidang\nproposal tesis  \nApakah revisi\nsudah sesuai?Dokumen hasil\nrevisi sidang\nproposal tesis  Ketua RMK menentukan penguji\ndan menjadwalkan sidang'
 'TATA TERTIB PELAKSANAAN SIDANG PROPOSAL TESIS\n\nPROGRAM STUDI S2 TEKNIK INFORMATIKA\n\nDEPARTEMEN TEKNIK INFORMATIKA â€“ FAKULTAS TEKNOLOGI ELEKTRO & INFORMATIKA CERDAS, ITS\n\n1. Peserta sidang proposal tesis menyiapkan perangkat laptop yang memadai dan jaringan internet yang stabil serta berada di tempat yang kondusif.\n\n2. Peserta sidang proposal tesis menyiapkan aplikasi Zoom dengan fitur kamera dan audio yang dapat berfungsi dengan baik.\n\n3. Peserta sidang proposal tesis menyiapkan file presentasi berupa PPT dan draft proposal tesis.\n\n4. Waktu sidang proposal tesis berlangsung selama 60 menit, 15 menit presentasi dan 45 menit tanya jawab.\n\n5. Peserta sidang proposal tesis disarankan untuk standby 30 menit sebelum jadwal yang ditentukan dan dapat bergabung pada link zoom meeting sesuai jadwal yang telah ditentukan atau sesuai instruksi dari dosen pembimbing/ penguji.'
 'hasil revisiDokumen hasil\nrevisi sidang\nproposal tesis  \nApakah revisi\nsudah sesuai?Dokumen hasil\nrevisi sidang\nproposal tesis  Ketua RMK menentukan penguji\ndan menjadwalkan sidang\nproposal tesis setiap pesertaSOP PENDAFT ARAN SIDANG PROPOSAL TESIS PROGRAM STUDI S2 TEKNIK INFORMA TIKA (SISTEM ONLINE ), FT -EIC, ITS  \nYaDraft proposal tesis\ndan form persetujuan\npembimbing\nPemeriksa,\n \n \n \n \n \nLina Ambarwati, S.Kom.  \nNIP. 198003242014092001  Mengetahui,\nDr. Ahmad Saikhu, S.Si., M.T . \nNIP. 197107182006041001Pembuat,\n \n \n \n \n \nKartika Dwi Y uniavita Rahmawati, S.T .\nNPP. 1998202122056  \nJadwal sidang, link\nmeeting, dan VB\nTidak\nMenginfokan link google form\nuntuk meng-upload  seluruh\ndokumen hasil revisi sidang\nproposal tesis ke mahasiswa\nStatus sidang\nproposal tesis\nmenjadi ""Disetujui""Merekap data mahasiswa yang\ntelah menyelesaikan revisi\nsidang proposal tesis dan\nmenginfokan ke Kaprodi\nMeng-update status sidang\nproposal tesis di MonT esMeng-upload lembar revisi sidang'
 'Admin Akademik Pascasarjana\nMenginfokan jadwal,\npersyaratan, dan link google\nform pendaftaran sidang\nproposal tesisSTART\nMerekap catatan revisi di\nlembar revisi dan nilai di\nexcel\nMembagikan lembar revisi ke\nmahasiswaMelaksanakan sidang proposal\ntesis sesuai jadwal\nMengerjakan revisi sesuai\ncatatan di lembar revisiDosen pembimbing dan\npenguji menguji sidang\nproposal tesis sesuai plotting\nMemberikan penilaian dan\ncatatan revisi melalui google\nformMemverifikasi berkas\npersyaratan sidang proposal\ntesis\nApakah berkas\nsudah memenuhi\nsyarat?Tidak\nYa\nMerekap daftar peserta sidang\nproposal tesis setiap RMK dan\nmenginfokan ke Ketua RMK\nMenginfokan jadwal sidang\nproposal tesis ke mahasiswa dan\ndosen (pembimbing dan penguji)Checklist kelengkapan\nberkas pendaftaran\nsidang proposal tesis  Mahasiswa\nApakah berkas\nsudah lengkap?\nMelakukan pendaftaran sidang\nproposal tesis\nMeminta tanda tangan form revisi\nke dosen pembimbing dan\npenguji dan lembar pengesahan\nke dosen pembimbingJadwal sidang, link']","1. Peserta sidang proposal tesis menyiapkan perangkat laptop yang memadai dan jaringan internet yang stabil serta berada di tempat yang kondusif.
2. Peserta sidang proposal tesis menyiapkan aplikasi Zoom dengan fitur kamera dan audio yang dapat berfungsi dengan baik.
3. Peserta sidang proposal tesis menyiapkan file presentasi berupa PPT dan draft proposal tesis.
4. Waktu sidang proposal tesis berlangsung selama 60 menit, 15 menit presentasi dan 45 menit tanya jawab.
5. Peserta sidang proposal tesis disarankan untuk standby 30 menit sebelum jadwal yang ditentukan dan dapat bergabung pada link zoom meeting sesuai jadwal yang telah ditentukan atau sesuai instruksi dari dosen pembimbing/ penguji.
6. Peserta sidang proposal tesis memakai dresscode berupa kemeja lengan panjang dan berdasi (laki-laki) dan memakai kemeja dengan blazer tanpa berdasi (perempuan).
7. Selama sidang proposal tesis, peserta sidang proposal tesis wajib menggunakan virtual background yang dapat diunduh melalui https://bit.ly/VBProposalTesis dan kamera diharapkan selalu menyala (ON).
8. Selama sesi diskusi dan tanya jawab, peserta sidang proposal tesis diharapkan dapat mencatat masukan dan koreksi dari dosen penguji.
9. Link Zoom meeting sidang proposal tesis akan diinfokan H-1 melalui grup Whatsapp.",0.0,0.999999999975,1.0,0.9577291048420098
3,Kapan Wisuda 129 dilaksanakan?,"Wisuda 129 dilaksanakan pada tanggal 20 April 2024 untuk Fakultas FT-IRS, FT-SPK, SIMT, F-VOKASI, dan pada tanggal 21 April 2024 untuk Fakultas FSAD, FTK, FT-EIC, F-DKBD.","['- Pemesanan Foto Prosesi (tidak wajib)\n- Undangan Wisuda untuk orang tua:\nUndangan untuk orang tua/pendamping wisudawan diambil bersamaan dengan\npengambilan toga\n2. Jadwal pengambilan toga, gordon, undangan dan pemesanan foto prosesi sebagai berikut:\nHari\n:Rabu & Kamis\nTanggal : 17 & 18 April 2024\nPukul\n: 08.00-12.00 WIB\nPembagian jadwal pengambilan berdasarkan Fakultas akan disampaikan menyusul oleh\nDharma Wanita Persatuan ITS.\nAtas perhatian dan kerjasama yang diberikan kami sampaikan terima kasih.\nT. 1964405 5902an, M.T.\nMEMENTERIAN AS\nINSTITUT\nTembusan:\n- Rektor ITS\n- Para Wakil Rektor\n- Sekretaris Institut\n- Kepala Biro Sarana dan Prasarana\n- Kepala Biro Keuangan\n- Ketua Darma Wanita Persatuan ITS\n- Kabag. Admisitrasi Umum dan Kearsipan Digital'
 '2. Mahasiswa Program Sarjana dan Sarjana Terapan tidak dikenakan biaya Wisuda, hanya dikenakan uang jaminan toga (akan dikembalikan setelah toga kembali).\n3. Biaya sewa dan peminjaman toga mengacu pada surat yang dikeluarkan oleh Dharma Wanita Persatuan ITS Nomor B 362/Sekre/DPW-ITS/II/2024 tanggal 26 Februari 2024\ndan pada laman https://wisuda.dwpits.id'
 'KEMENTERIAN PENDIDIKAN, KEBUDAYAAN, RISET, DAN TEKNOLOGI INSTITUT TEKNOLOGI SEPULUH NOPEMBER\nKampus ITS Sukolilo Surabaya 60111\nTelepon: 031-5994251-54, 5947274, 5945472 (Hunting)\nFax: 031-5947264, 5950806\nhttp://www.its.ac.id\nNomor : 6195/IT2.I/B/PP.06.00/1/2024\nLamp : Satu set\nPerihal: Wisuda ITS ke 129 Periode April 2024\n26 Februari 2024\nY th.:\n- Para Dekan\n- Para Kepala Departemen\nInstitut Teknologi Sepuluh Nopember\nKampus ITS Surabaya\nSehubungan dengan akan dilaksanakan Wisuda 129 Periode April 2024 yang akan dilaksanakan secara offline pada tanggal 20-21 April 2024, bersama ini kami mohon untuk disampaikan kepada calon wisudawan 129 di lingkungan Saudara untuk memperhatikan ketentuan-ketentuan sebagai berikut:\nA. PELAKSANAAN WISUDA :\nWisuda ITS ke 129 dilaksanakan secara offline di Gedung Graha Sepuluh Nopember\nJadwal pelaksanaan wisuda sebagai berikut :\nNO\nFAKULTAS\nFT-IRS, FT-SPK, SIMT, F-VOKASI\nFSAD, FTK, FT-EIC, F-DKBD\nJADWAL\nSabtu, 20 April 2024\nMinggu, 21 April 2024\nPukul'
 'Jadwal pelaksanaan wisuda sebagai berikut :\nNO\nFAKULTAS\nFT-IRS, FT-SPK, SIMT, F-VOKASI\nFSAD, FTK, FT-EIC, F-DKBD\nJADWAL\nSabtu, 20 April 2024\nMinggu, 21 April 2024\nPukul\nTempat\n: 06.30 WIB - selesa1\n: Graha Sepuluh Nopember, Kampus ITS Sukolilo - Surabaya\nB. PEMBEKALAN WISUDA :\nHari/tanggal\n: Kamis, 18 April 2024\nPukul\n: 08.00 WIB\nTempat\n: Gedung Graha Sepuluh Nopember (Offline)\nC. PEMBAYARAN BIAYA WISUDA DAN TOGA:\n1. Biaya wisuda sebesar Rp. 1.000.000,- (Satu juta rupiah) khusus program Magister dan Doktor, dibayarkan dengan sistem host to host, melalui bank Mandiri, BRI, BNI, dan BSI mulai tanggal 4 s.d 15 Maret 2024, dengan cara menyebutkan angka 93 dilanjutkan dengan NRP. Sedangkan biaya sewa dan peminjaman toga mengikuti ketentuan Dharma Wanita Persatuan ITS.\n2. Mahasiswa Program Sarjana dan Sarjana Terapan tidak dikenakan biaya Wisuda, hanya dikenakan uang jaminan toga (akan dikembalikan setelah toga kembali).']",Wisuda 129 Periode April 2024 yang akan dilaksanakan secara offline pada tanggal 20-21 April 2024,0.7777777777777778,0.999999999975,0.5,0.9227092901648245
4,Berapa biaya peminjaman toga?,"Biaya peminjaman toga adalah Rp. 550.000,- (Lima ratus lima puluh ribu rupiah), terdiri dari Biaya Jaminan Toga sebesar Rp. 300.000,- (tiga ratus ribu rupiah) dan Biaya Sewa Toga sebesar Rp. 250.000,- (dua ratus lima puluh ribu rupiah).","['2. Mahasiswa Program Sarjana dan Sarjana Terapan tidak dikenakan biaya Wisuda, hanya dikenakan uang jaminan toga (akan dikembalikan setelah toga kembali).\n3. Biaya sewa dan peminjaman toga mengacu pada surat yang dikeluarkan oleh Dharma Wanita Persatuan ITS Nomor B 362/Sekre/DPW-ITS/II/2024 tanggal 26 Februari 2024\ndan pada laman https://wisuda.dwpits.id'
 'Membayar biaya Sewa dan Jaminan Toga Rp. 550.000,- (Lima ratus lima puluh ribu rupiah)\nPerincian sebagai berikut :\nBiaya Jaminan Toga: Rp. 300.000,- (tiga ratus ribu rupiah).\nBiaya Sewa Toga\nRp. 250.000,- (dua ratus lima puluh ribu rupiah).\n3. Cara Transfer Pembayaran sewa Toga Dan Uang Jaminan.\nSaat mentransfer, angka ribuan diganti 3 digit angka terakhir NRP.\nContoh: NRP 0111156001259\n> Nilai yang di transfer wisudawan S1 dan S1 TERAPAN Rp. 300.259,-\n> Nilai yang di transfer wisudawan ASING dan Wisudawan Non UKT S2, S3 Rp. 550.259,-\n4. Pembayaran Toga ke: BNI No. Rek. 8586878897\nAtas Nama\nDHARMA WANITA PERSATUAN ITS.\nPeriode pembayaran\n: 27 Februari 2024 - 15 Maret 2024.'
 '*Sebagai syarat kelengkapan pengembalian Toga anda bisa cetak QR di\nLACAK.\n8. Pengembalian Toga tanggal 22 April 2024.\n(Syarat, Ketentuan dan Teknis Pengembalian Toga akan di informasikan kemudian).\nBiaya Jaminan Toga sebesar Rp. 300.000,- (tiga ratus ribu rupiah) akan ditransfer oleh DWP ITS lewat BNI ke Rekening wisudawan setelah DWP - ITS MENERIMA PENGEMBALIAN TOGA\n*CP BNI perihal pengembalian uang jaminan: Ibu Inna Nurdianti, 0819 3812 5893.\nII. MENGISI DATA ONLINE di : wisuda.dwpits.id\n1. Pengisian Data Online dimulai 27 Februari 2024 - 15 Maret 2024.\nPukul: 23.00 WIB.\n2. Tidak menerima pendaftaran dan peminjaman toga setelah data online ditutup.\n3. Mengisi Form Peminjaman Toga secara lengkap.\n(Nama, NRP, Departemen, Fakultas, Strata, No. Telp / WA Wisudawan,\nUkuran Toga yang dipilih dan disertai bukti Pembayaran Toga ke Rekening\nDWP ITS).'
 'Nomor\nLampiran\nPerihal\nDharma Wanita Persatuan\nInstitut Teknologi Sepuluh Nopember\nProvinsi Jawa Timur\nKAMPUS ITS - KEPUTIH - SUKOLILO - SURABAYA TELP. (031) 5912379\n: B 362/Sekre/DWP-ITS/ll/2024.\nSurabaya, 26 Februari 2024\n: -\n: Informasi Peminjaman Toga.\nKepada Yth : Wisudawan ITS\nWisuda ITS ke-129\nDi tempat.\nSelamat dan sukses kepada seluruh Wisudawan, Wisuda ITS ke-129, semoga ilmu yang didapat bermanfaat.\nWisuda ITS ke-129 akan dilaksanakan tanggal 20 dan 21 April 2024, para wisudawan mengenakan Toga seperti pelaksanaan Wisuda sebelumnya.\nSYARAT, KETENTUAN DAN TEKNIS PEMINJAMAN TOGA sbb :\nI. BIAYA TOGA :\n1. Wisudawan S1 dan S1 TERAPAN :\nMembayar Biaya Jaminan Toga Rp. 300.000,- (Tiga Ratus Ribu Rupiah)\n2. Wisudawan ASING dan Wisudawan Non UKT S2 & S3 :\nMembayar biaya Sewa dan Jaminan Toga Rp. 550.000,- (Lima ratus lima puluh ribu rupiah)\nPerincian sebagai berikut :\nBiaya Jaminan Toga: Rp. 300.000,- (tiga ratus ribu rupiah).\nBiaya Sewa Toga']","Wisudawan S1 dan S1 TERAPAN : Membayar Biaya Jaminan Toga Rp. 300.000,- (Tiga Ratus Ribu Rupiah). Wisudawan ASING dan Wisudawan Non UKT S2 & S3 Membayar biaya Sewa dan Jaminan Toga Rp. 550.000,- (Lima ratus lima puluh ribu rupiah)",1.0,0.999999999975,0.8333333333333334,0.9833145697995791
5,Dimana alamat Departemen Teknik Industri? ,Departemen Teknik Industri berada di Institut Teknologi Sepuluh Nopember (ITS) Surabaya.,"['Tembusan Yth :\n1. Rektor ITS\n2. Kepala Bagian Administrasi Umum dan Kearsipan Digital 3. Sekretaris Institut\nSurabaya, 09 Januari 2024\nWakil Rektor Bidang Akademik dan Kemahasiswaan,\nProf. Dr. Ir. Adi Soeprijanto M.T.\n196404051990021001'
 '6. Apabila memerlukan informasi lebih lanjut dapat menghubungi dirpendikcare@its.ac.id atau di\ncall centre pada hari dan jam kerja melalui no (WA Text Only) 085186819604, 085186819605.\nB. Bagi semua calon wisudawan (Sarjana dan Sarjana Terapan) wajib menghadap dosen wali untuk persetujuan SKEM, serta wajib melakukan pengajuan SKPI di studentconnect paling lambat tanggal 9 Februari 2024;\nC. Ijazah dicetak berdasarkan data preview yang dipermanen oleh calon wisudawan. Ijazah dicetak hanya sekali saja, bila ada kekeliruan pengisian data pada point 3 maka akan diterbitkan surat keterangan.\nD.Pelaksanaan wisuda akan dilaksanakan secara offline (Informasi mengenai gladi bersih disampaikan lebih lanjut.\n Atas perhatian dan kerjasama yang diberikan, kami sampaikan terima kasih.\n Powered by TCPDF (www.tcpdf.org)\nTembusan Yth :\n1. Rektor ITS\n2. Kepala Bagian Administrasi Umum dan Kearsipan Digital 3. Sekretaris Institut\nSurabaya, 09 Januari 2024\nWakil Rektor Bidang Akademik dan Kemahasiswaan,'
 'Q: MyITS saya bermasalah, bisa lapor kemana?\n\nA: Silakan ajukan tiket ke DPTSI di https://servicedesk.its.ac.id/\n\nQ: Saya ingin mengurus â€œâ€¦..â€ siapa tendik yang harus ditemui?\n\nA: Temui tendik sesuai bidangnya yuk! :)\n\nPersuratan (S1) â†’ Pak Sugeng\nAkademik (S1) â†’ Bu Inka (Kelas, Nilai, MBKM, International Exposure), Bu Icha (Asisten Dosen, MonKP)\nAkademik + Persuratan (S2) â†’ Bu Kartika\nAkademik + Persuratan (S3) â†’ Bu Lina\nPeminjaman Ruang â†’ Pak Husein (Kasubbag)\nKeuangan â†’ Bu Devi, Bu Due\nUrusan Ruang Aula â†’ Pak Jumali\nUrusan Ruang Kelas â†’ Pak Edy\nUrusan Laboratorium â†’ Teknisi Lab. Pak Junaidi (PKT, KCV, LP), Pak Jumali (KBJ, RPL), Pak Gayuh (AP, MCI, GiGA), Pak Kunto (AJK).\nUrusan Keamanan dan Kebersihan â†’ Pak Sukron\nUrusan Kelistrikan â†’ Pak Hari\nQ: Cara mendapatkan transkrip\n\nA: Buka SIM Akademik, masuk ke menu LAPORAN -> TRANSKRIP\n\nQ: Cara mendapatkan surat keterangan aktif mahasiswa\n\nA: Buka SIM Akademik, masuk ke menu SURAT MAHASISWA -> LAYANAN SURAT MAHASISWA'
 'Direktorat Pascasarjana dan Pengembangan Akademik\nInstitut Teknologi Sepuluh Nopember\n2021\nDirektorai\nPascasarjana\ndan Pengembangan\nAkademik ITS']",Tidak tahu,1.0,0.0,0.0,0.9647539585688186
6,Apa Url untuk mengunggah Repository Jurnal Pomits?,URL untuk mengunggah Repository Jurnal Pomits adalah https://ejurnal.its.ac.id/index.php/index/login.,"[""melakukan UNGGAH di Jurnal Repository, menggunakan login 'mahasiswa', dengan.\nkata sandi 'M4h4sisw4lTs!' ke alamat 'https://ejurnal.its.ac.id/index.php/index/login'\ndengan mengunggah file artikel dan file Form Telaah(dalam format pdf) saja.\nPengecekan file vang TERuNGGAH dapat dilihat di\nhttps://lpmp2ki.its.ac.id/pomits.\nJika terdapat penghapusan/penarikan artikel, dapat mengisi form pada link :\nhttps://its.id/FHAJTeknikITSPOMITS, untuk Jurnal Teknik ITS;\n1.-\nhttps:/l/its.id/FHAJSainsSenilTSPOMITS, untuk Jurnal Sains &Seni ITS;\n3.https://its.id/FHAJRepositorylTSPOMITS, untuk Jurnal Repository..\n Penghapusan Artikel akan dilakukan setelah yudisium berakhir.\nArtikel - artikel yang TIDAK MEMENUHI KETENTUAN PUBLIKASI (gaya selingkung\ntidak sesuai format dan file pendukung tidak lengkap) tidak akan DIPUBLIKASIKAN\ndi Jurnal Teknik ITS dan Jurnal Sains & Seni ITS.\nPeriode unggah artikel untuk yudisium 29 adalah sampai dengan \n15 Februari 2024 pukul 24.00 WIB""
 'Pemberitahuan\nUnggah Artikel POmITS\nUNGGAH artikel WAJIB dilakukan oleh MAHASISWA PENDAFTAR YUDISIUM 129\n Mahasiswa yang Dosen Pembimbingnya memilih untuk MEMpuBLIKAsIKAN\nartikelnya pada Jurnal POmITS, dapat melakukan UNGGAH, dengan mengikuti langkah\npada BUKU PANDUAN TATA CARA UNGGAH. File yang HARUS DIUNGGAH adalah\n(ukuran masing-masing file tidak boleh lebih dari 2 MB):\nArtikel hasil dari Tugas Akhir, dalam format Ms. Word yang telah mengikuti tem-\n1.\nplate. (selain format Ms.Word artikel DITOLAK/REJECTED)\nFormulir Hak Cipta, dalam format PDF.\nForm Telaah Artikel POmITs, dalam format PDF.\nForm Revisi/Perbaikan/Penyempurnaan TA yang berisi nama penguji beserta\ntidak hanya TTD saja)\n Template, Formulir Hak Cipta, Buku Panduan Tata Cara Unggah, dan Form Telaah\n5.\nArtikel dapat diunduh pada link:\nhttps://ejurnal.its.ac.id/index.php/teknik (Jurnal Teknik ITS)\nhttps://ejurnal.its.ac.id/index.php/sains_seni (Jurnal Sains&Seni ITS)\nSection yang bisa dipilih pada Jurnal Teknik ITS:'
 'File jurnal yang telah terbit atau prosiding International Conference [Apabila belum terbit, silakan unggah file jurnal nya]\nBukti telah melakukan publikasi ilmiah (LoA jurnal atau sertifikat&dokumentasi mengikuti International Conference)\nForm bebas tanggungan dosen pembimbing [yang telah ter-TTD]\nForm bebas tanggungan RBTC [yang telah ter-TTD] dan form bebas tanggungan perpustakaan ITS [Menyerahkan 1 hardfile tesis dengan membawa form bebas RBTC untuk meminta TTD ke Mbak Kartika dan menyerahkan 1 hardfile tesis ke Perpustakaan ITS. Apabila mencetak tesis di myitsprinting, dapat mengunggah bukti pembayaran]\nForm bebas tanggungan laboratorium [Silakan menemui Pak Kunto di Laboratorium Pascasarjana Lantai 1 atau menghubungi ke 08121628141 untuk meminta TTD]\nScreenshoot telah mengisi form Tracer Study [https://its.id/TracerStudyLulusanS2IF]\nScreenshoot telah mengisi form Kepuasan Layanan Akademik [https://its.id/KepuasanLayananAkademikS2IF]'
 ""https://ejurnal.its.ac.id/index.php/teknik (Jurnal Teknik ITS)\nhttps://ejurnal.its.ac.id/index.php/sains_seni (Jurnal Sains&Seni ITS)\nSection yang bisa dipilih pada Jurnal Teknik ITS:\nTeknologi Informasi dan Komunikasi (TIK); Energi (ERG); Pemukiman dan Bencana\n(PdB); Bangunan Berorientasi Lingkungan (BBL); Transportasi (TRP); Teknologi.\nProses (TP); Kelautan (KLT).\nSection yang bisa dipilih pada Jurnal Sains & Seni ITS:\nMatematika dan Terapannya (MAT); Fisika dan Terapannya (FIS); Kimia dan Tera.\npannya (KIm); Statistika dan Terapannya (STA); Biologi dan Terapannya (BIO);\nProduk Desain (PD); Arsitektur (ARS); Desain dan Seni (DDS); Bisnis Dan Studi\nPembangunan (BSP).\nMahasiswa yang Dosen Pembimbingnya memilih untuk TIDAK MEMPUBLIKASIKAN\nartikelnya pada Jurnal pomits (Jurnal Teknik dan Jurnal Sains & Seni), dapat\nmelakukan UNGGAH di Jurnal Repository, menggunakan login 'mahasiswa', dengan.\nkata sandi 'M4h4sisw4lTs!' ke alamat 'https://ejurnal.its.ac.id/index.php/index/login'""]",https://ejurnal.its.ac.id/index.php/index/login,0.0,0.999999999975,1.0,0.9948338787829577
7,Berapa sks mata kuliah pengayaan yang bisa diambil?,Anda dapat mengambil mata kuliah pengayaan maksimal 6 sks dan minimum 3 sks sesuai dengan peraturan akademik.,"['Q: Berapa sks mata kuliah pengayaan yang bisa diambil?\n\nA: Di peraturan akademik mengambil MK pengayaan maksimal 6 sks dan minimum 3 sks.\n\nQ: Apakah mata kuliah pengayaan bisa di-drop?\n\nA: Seperti halnya MK yang lain, jika masih dalam masa drop tiap semester, maka boleh (sampai dengan minggu 10). Setelah waktu itu tidak bisa, namun bisa digantikan dengan MK pengayaan lain yang diambil di semester berikutnya.\n\nQ: Kepada siapa saya meminta konsultasi tentang perwalian/perencanaan kuliah, merubah MK yang diambil dan drop MK setelah minggu ke 4?\n\nA: Ke DOSEN WALI, bukan ke PEMBIMBING TA. Batas akhir perubahan MK adalah minggu ke 3 dan drop MK adalah minggu ke 10\n\nQ: Bagaimana jika saya tidak bisa ambil MK di FRS padahal prasyarat sudah terpenuhi? \n\nA: Silakan menginformasikan ke doswal dengan menyertakan bukti2. Doswal akan membantu menambahkan MK yang dimaksud jika bukti2 telah mencukupi.\n\nQ: Apakah MK yang diambil via dropdown MBKM bisa menggantikan MK yang sudah diambil?'
 'Frequently Asked Question\nAcademic Support ðŸ“– \nQ: Nilai saya belum keluar/salah, banding nilainya bagaimana?\n\nA: Untuk kelas MBKM, Isi form ralat nilai beserta bukti dukung â†’ tunggu nilai berubah. Form dibagikan ke mahasiswa setelah rilis nilai MBKM (ctt : periode rilis nilai MBKM berbeda dengan nilai kelas reguler).\n\nUntuk kelas reguler, komunikasikan dengan dosen pengampu MK masing - masing.\n\nQ: Kelas saya bentrok, bagaimana cara pindah kelas?\n\nA: Cari kelas dengan jadwal yang sesuai â†’ konsultasikan ke dosen wali & pengampu MK â†’ laporkan ke Sekdep 1 (+cc Bu Inka jika via email) â†’ bersabar sampai kelasnya dirubah.\n\nQ: Apakah wajib mengisi kuisioner dan IPD di akhir semester?\n\nA: WAJIB. Tolong diisi ya.\n\nQ: Berapa sks mata kuliah pengayaan yang bisa diambil?\n\nA: Di peraturan akademik mengambil MK pengayaan maksimal 6 sks dan minimum 3 sks.\n\nQ: Apakah mata kuliah pengayaan bisa di-drop?'
 'Student Affairs ðŸŽ—ï¸\nQ: Bagaimana cara mendaftar Asisten Dosen?\n\nA:  Pendaftaran Asisten Dosen dibuka setiap awal semester. Calon Asisten WAJIB mengisi form pendaftaran. Rekomendasi Dosen dapat menjadi nilai tambah. Setiap mahasiswa hanya bisa mendaftar maksimal 3 kelas.\n\nQ: Apa yang harus dikumpulkan oleh Asisten Dosen sebagai laporan di akhir semester? Apa harus mengisi daftar hadir?\n\nA:  Tidak ada presensi khusus kehadiran asisten. Namun, setiap asisten wajib mencatatkan setiap kehadiran & rincian/deksripsi kegiatan (saat hadir) di logbook yang akan dikumpulkan dan dicek di akhir semester.\n\nQ: Apakah mahasiswa baru juga mengisi SKEM?\n\nA:  Semua mahasiswa wajib mengisi SKEM dengan terlebih dahulu melengkapi portofolio. Setelah itu dapat memilih SKEM yang sesuai\n\nQ: Jika saya membutuhkan surat tugas untuk mengisi SKEM, kemana saya meminta?\n\nA:  silakan kontak ke CP Dirmawa di 082233935593 atau mengacu ke pamflet yang ada di folder MBKM dari link akademik Sarjana'
 'pengerjaan revi si adalah 2 minggu setelah sidang proposal tesis berlangsung.  \n13. Apabila revisi yang dikerjakan mahasiswa dirasa sudah tepat, dosen pembimbing dan \npenguji dapat memberikan persetujuan yang dibuktikan dengan menandatangi form revisi  \ndan lembar pengesahan buku proposal tesis . 14. Admin Akademik Pascasarjana  menginfokan link untuk upload hasil revisi sidang \nproposal tesis ke mahasiswa melalui grup Whatsapp.  \n15. Mahasiswa meng -upload file hasil revisi sidang proposal tesis dan lembar revisi sidang \nproposal tesis ke link https://bit.ly/HasilRevisiProposalTesisDTIf . \n16. Apabila mahasiswa sudah mengumpulkan softfile buku proposal tesis, Admin Akademik \nPascasarjana  mengubah status sidang proposal tesis di MonTes  dari â€˜Revisiâ€™  menjad i \nâ€˜Disetujuiâ€™.  \n17. Mahasiswa dapat mengecek nilai sidang proposal tesis di SIAKAD ITS mata kuliah IF \n185301 Tesis -Proposal.  \n \n \nNotes: Link google form akan di -update setiap tahun ajaran']",Di peraturan akademik mengambil MK pengayaan maksimal 6 sks dan minimum 3 sks.,1.0,0.99999999995,1.0,1.0000000000000007
8,"Jika saya membutuhkan surat tugas untuk mengisi SKEM, kemana saya meminta?",Anda dapat menghubungi CP Dirmawa di nomor 082233935593 atau mengacu pada pamflet yang ada di folder MBKM dari link akademik Sarjana.,"['Student Affairs ðŸŽ—ï¸\nQ: Bagaimana cara mendaftar Asisten Dosen?\n\nA:  Pendaftaran Asisten Dosen dibuka setiap awal semester. Calon Asisten WAJIB mengisi form pendaftaran. Rekomendasi Dosen dapat menjadi nilai tambah. Setiap mahasiswa hanya bisa mendaftar maksimal 3 kelas.\n\nQ: Apa yang harus dikumpulkan oleh Asisten Dosen sebagai laporan di akhir semester? Apa harus mengisi daftar hadir?\n\nA:  Tidak ada presensi khusus kehadiran asisten. Namun, setiap asisten wajib mencatatkan setiap kehadiran & rincian/deksripsi kegiatan (saat hadir) di logbook yang akan dikumpulkan dan dicek di akhir semester.\n\nQ: Apakah mahasiswa baru juga mengisi SKEM?\n\nA:  Semua mahasiswa wajib mengisi SKEM dengan terlebih dahulu melengkapi portofolio. Setelah itu dapat memilih SKEM yang sesuai\n\nQ: Jika saya membutuhkan surat tugas untuk mengisi SKEM, kemana saya meminta?\n\nA:  silakan kontak ke CP Dirmawa di 082233935593 atau mengacu ke pamflet yang ada di folder MBKM dari link akademik Sarjana'
 'Bersama dengan ini saya sertakan dokumen revisi TA saya dengan poin sebagai berikut:\n- perbaikan ....\nMohon berkenan memeriksa dan menginformasikan jika ada yang perlu saya perbaiki.\n\nDemikian, terima kasih\nAgus\n0511000..â€¦\n\nQ: Bagaimana mendapatkan surat keterangan yang tidak ada di menu integra, contoh surat keterangan selesai TA dan lulus >=144 SKS?\n\nA: kirim ke WA Pak Sugeng +62 856-4843-2445\n------------------------------------------------------------------------------\nKepada Yth\nBapak Ary Mazharuddin Shiddiqi\ndi tempat\n\nDengan hormat,\nDengan surat ini saya,\n\nNama: \nNRP: \nTempat/Tgl lahir: \nAlamat sekarang: \nSKS Lulus:\nemail aktif:\nNo HP aktif:\n\nBermaksud untuk mengajukan permohonan kepada Bapak Ary guna memperoleh Surat Keterangan Selesai Tugas Akhir.\n\nDemikian surat ini saya ajukan dan atas terkabulnya permohonan ini, saya ucapkan terimakasih\n\nSurabaya, .â€¦'
 'A:  silakan kontak ke CP Dirmawa di 082233935593 atau mengacu ke pamflet yang ada di folder MBKM dari link akademik Sarjana\n\nQ: Kapan saya mesti entry SKEM ke SI SKEM?\n\nA:  Setiap semester, dan akan menjadi IP SKEM. Untuk lulus, minimal IP SKEM adalah 2.0. \n\nQ: Dimana panduan mengisi SKEM? \n\nA:  Ada di File panduan SKEM pada link akademik departemen \n\nQ: Kemana harus bertanya tentang UKT? (kesulitan pembayaran, keringanan, keterlambatan pembayaran)\n\nA:  Kontak Biro Keuangan (Senin - Jumat 08:00 - 15:00)\n-      WA (Text only) 082136250808\n-      WA (Text only) 081393936651\n-      WA (Text only) 081393936652\n-      WA (Text only) 087777587330\n-      WA (Text only) 082141942985\n\nCatatan âœðŸ»\n\nTentang Refund UKT dapat dicek pada menu terkait. Jika tetap tidak menemukan jawaban, Tanyakan pada admin.'
 'A: Buka SIM Akademik, masuk ke menu LAPORAN -> TRANSKRIP\n\nQ: Cara mendapatkan surat keterangan aktif mahasiswa\n\nA: Buka SIM Akademik, masuk ke menu SURAT MAHASISWA -> LAYANAN SURAT MAHASISWA\n\nQ: Bagaimana mendapatkan translasi ke dalam Bahasa Inggris dari dokumen resmi ITS?\n\nA: Translasi dilayani oleh BURB\nKeluhan/permintaan : servicedesk.its.ac.id\nEmail : plt@its.ac.id \nTelp : (031) 5994251\nhttps://www.its.ac.id/burb/wp-content/uploads/sites/106/2022/05/Panduan-myITS-Services_rev-1.pdf""\n\nQ: Untuk keperluan mendaftar bekerja / sekolah lanjutan, surat keterangan apakah yang bisa saya dapatkan?\n\nA:\nSebelum yudisium\nSurat keterangan telah menyelesaikan xxx sks dan telah selesai sidang TA\nSetelah yudisium\nSurat keterangan lulus yang diterbitkan oleh BURB\nSetelah wisuda:\nIjazah dan transkrip resmi ITS\n\nQ: Bagaimana cara mendapatkan Surat Keterangan Lulus, legalisir ijazah dll atau surat keterangan selsai TA?']",silakan kontak ke CP Dirmawa di 082233935593 atau mengacu ke pamflet yang ada di folder MBKM dari link akademik Sarjana,1.0,0.8055555555287036,1.0,0.0
9,Berapa ukuran maksimal untuk setiap file yang diunggah di Jurnal POmITS?,Ukuran maksimal untuk setiap file yang diunggah di Jurnal POmITS adalah tidak boleh lebih dari 2 MB.,"['File jurnal yang telah terbit atau prosiding International Conference [Apabila belum terbit, silakan unggah file jurnal nya]\nBukti telah melakukan publikasi ilmiah (LoA jurnal atau sertifikat&dokumentasi mengikuti International Conference)\nForm bebas tanggungan dosen pembimbing [yang telah ter-TTD]\nForm bebas tanggungan RBTC [yang telah ter-TTD] dan form bebas tanggungan perpustakaan ITS [Menyerahkan 1 hardfile tesis dengan membawa form bebas RBTC untuk meminta TTD ke Mbak Kartika dan menyerahkan 1 hardfile tesis ke Perpustakaan ITS. Apabila mencetak tesis di myitsprinting, dapat mengunggah bukti pembayaran]\nForm bebas tanggungan laboratorium [Silakan menemui Pak Kunto di Laboratorium Pascasarjana Lantai 1 atau menghubungi ke 08121628141 untuk meminta TTD]\nScreenshoot telah mengisi form Tracer Study [https://its.id/TracerStudyLulusanS2IF]\nScreenshoot telah mengisi form Kepuasan Layanan Akademik [https://its.id/KepuasanLayananAkademikS2IF]'
 'Pemberitahuan\nUnggah Artikel POmITS\nUNGGAH artikel WAJIB dilakukan oleh MAHASISWA PENDAFTAR YUDISIUM 129\n Mahasiswa yang Dosen Pembimbingnya memilih untuk MEMpuBLIKAsIKAN\nartikelnya pada Jurnal POmITS, dapat melakukan UNGGAH, dengan mengikuti langkah\npada BUKU PANDUAN TATA CARA UNGGAH. File yang HARUS DIUNGGAH adalah\n(ukuran masing-masing file tidak boleh lebih dari 2 MB):\nArtikel hasil dari Tugas Akhir, dalam format Ms. Word yang telah mengikuti tem-\n1.\nplate. (selain format Ms.Word artikel DITOLAK/REJECTED)\nFormulir Hak Cipta, dalam format PDF.\nForm Telaah Artikel POmITs, dalam format PDF.\nForm Revisi/Perbaikan/Penyempurnaan TA yang berisi nama penguji beserta\ntidak hanya TTD saja)\n Template, Formulir Hak Cipta, Buku Panduan Tata Cara Unggah, dan Form Telaah\n5.\nArtikel dapat diunduh pada link:\nhttps://ejurnal.its.ac.id/index.php/teknik (Jurnal Teknik ITS)\nhttps://ejurnal.its.ac.id/index.php/sains_seni (Jurnal Sains&Seni ITS)\nSection yang bisa dipilih pada Jurnal Teknik ITS:'
 ""melakukan UNGGAH di Jurnal Repository, menggunakan login 'mahasiswa', dengan.\nkata sandi 'M4h4sisw4lTs!' ke alamat 'https://ejurnal.its.ac.id/index.php/index/login'\ndengan mengunggah file artikel dan file Form Telaah(dalam format pdf) saja.\nPengecekan file vang TERuNGGAH dapat dilihat di\nhttps://lpmp2ki.its.ac.id/pomits.\nJika terdapat penghapusan/penarikan artikel, dapat mengisi form pada link :\nhttps://its.id/FHAJTeknikITSPOMITS, untuk Jurnal Teknik ITS;\n1.-\nhttps:/l/its.id/FHAJSainsSenilTSPOMITS, untuk Jurnal Sains &Seni ITS;\n3.https://its.id/FHAJRepositorylTSPOMITS, untuk Jurnal Repository..\n Penghapusan Artikel akan dilakukan setelah yudisium berakhir.\nArtikel - artikel yang TIDAK MEMENUHI KETENTUAN PUBLIKASI (gaya selingkung\ntidak sesuai format dan file pendukung tidak lengkap) tidak akan DIPUBLIKASIKAN\ndi Jurnal Teknik ITS dan Jurnal Sains & Seni ITS.\nPeriode unggah artikel untuk yudisium 29 adalah sampai dengan \n15 Februari 2024 pukul 24.00 WIB""
 'Ijazah S1\nKTP\nFoto formal (kemeja putih, berjas warna gelap, berdasi hitam, tidak memakai kaca mata) background biru (R:000 G:120 B:193 atau C:100 M:040 Y:001 K:001). Ukuran proposional separuh badan, kualitas STUDIO FOTO. Format .jpg atau .jpeg\nSertifikat TOEFL dari UPBG ITS atau screenshot dari web https://bahasa.its.ac.id/\nTranskrip Akademik\nScreenshoot bukti telah mengecek draft ijazah yang telah ditandatangani oleh calon wisudawan di SIAkad [Apabila terdapat kesalahan data, silahkan membuat laporan ke http://servicedesk.its.ac.id/]\nScreenshoot bukti telah mengisi data tesis (judul, abstrak, keywords, dosen pembimbing) di SIAkad\nDua eksemplar Buku Tesis [dilengkapi dengan Lembar Pengesahan yang telah TTD+stempel]. Dicetak bolak-balik A4 80gr. Dijilid softcover. Diserahkan ke Sekretariat Pascasarjana Teknik Informatika (Mbak Kartika) dan Perpustakaan ITS.\nFile jurnal yang telah terbit atau prosiding International Conference [Apabila belum terbit, silakan unggah file jurnal nya]']",Ukuran masing-masing file tidak boleh lebih dari 2 MB.,1.0,0.999999999975,1.0,0.9472741025081683
10,Di lantai mana kuliah Agama Islam di Semester Regular diadakan?,Saya tidak tahu.,"['Frequently Asked Question\nAcademic Support ðŸ“– \nQ: Nilai saya belum keluar/salah, banding nilainya bagaimana?\n\nA: Untuk kelas MBKM, Isi form ralat nilai beserta bukti dukung â†’ tunggu nilai berubah. Form dibagikan ke mahasiswa setelah rilis nilai MBKM (ctt : periode rilis nilai MBKM berbeda dengan nilai kelas reguler).\n\nUntuk kelas reguler, komunikasikan dengan dosen pengampu MK masing - masing.\n\nQ: Kelas saya bentrok, bagaimana cara pindah kelas?\n\nA: Cari kelas dengan jadwal yang sesuai â†’ konsultasikan ke dosen wali & pengampu MK â†’ laporkan ke Sekdep 1 (+cc Bu Inka jika via email) â†’ bersabar sampai kelasnya dirubah.\n\nQ: Apakah wajib mengisi kuisioner dan IPD di akhir semester?\n\nA: WAJIB. Tolong diisi ya.\n\nQ: Berapa sks mata kuliah pengayaan yang bisa diambil?\n\nA: Di peraturan akademik mengambil MK pengayaan maksimal 6 sks dan minimum 3 sks.\n\nQ: Apakah mata kuliah pengayaan bisa di-drop?'
 'Q: Berapa sks mata kuliah pengayaan yang bisa diambil?\n\nA: Di peraturan akademik mengambil MK pengayaan maksimal 6 sks dan minimum 3 sks.\n\nQ: Apakah mata kuliah pengayaan bisa di-drop?\n\nA: Seperti halnya MK yang lain, jika masih dalam masa drop tiap semester, maka boleh (sampai dengan minggu 10). Setelah waktu itu tidak bisa, namun bisa digantikan dengan MK pengayaan lain yang diambil di semester berikutnya.\n\nQ: Kepada siapa saya meminta konsultasi tentang perwalian/perencanaan kuliah, merubah MK yang diambil dan drop MK setelah minggu ke 4?\n\nA: Ke DOSEN WALI, bukan ke PEMBIMBING TA. Batas akhir perubahan MK adalah minggu ke 3 dan drop MK adalah minggu ke 10\n\nQ: Bagaimana jika saya tidak bisa ambil MK di FRS padahal prasyarat sudah terpenuhi? \n\nA: Silakan menginformasikan ke doswal dengan menyertakan bukti2. Doswal akan membantu menambahkan MK yang dimaksud jika bukti2 telah mencukupi.\n\nQ: Apakah MK yang diambil via dropdown MBKM bisa menggantikan MK yang sudah diambil?'
 'Jadwal pelaksanaan wisuda sebagai berikut :\nNO\nFAKULTAS\nFT-IRS, FT-SPK, SIMT, F-VOKASI\nFSAD, FTK, FT-EIC, F-DKBD\nJADWAL\nSabtu, 20 April 2024\nMinggu, 21 April 2024\nPukul\nTempat\n: 06.30 WIB - selesa1\n: Graha Sepuluh Nopember, Kampus ITS Sukolilo - Surabaya\nB. PEMBEKALAN WISUDA :\nHari/tanggal\n: Kamis, 18 April 2024\nPukul\n: 08.00 WIB\nTempat\n: Gedung Graha Sepuluh Nopember (Offline)\nC. PEMBAYARAN BIAYA WISUDA DAN TOGA:\n1. Biaya wisuda sebesar Rp. 1.000.000,- (Satu juta rupiah) khusus program Magister dan Doktor, dibayarkan dengan sistem host to host, melalui bank Mandiri, BRI, BNI, dan BSI mulai tanggal 4 s.d 15 Maret 2024, dengan cara menyebutkan angka 93 dilanjutkan dengan NRP. Sedangkan biaya sewa dan peminjaman toga mengikuti ketentuan Dharma Wanita Persatuan ITS.\n2. Mahasiswa Program Sarjana dan Sarjana Terapan tidak dikenakan biaya Wisuda, hanya dikenakan uang jaminan toga (akan dikembalikan setelah toga kembali).'
 'KEMENTERIAN PENDIDIKAN, KEBUDAYAAN, RISET, DAN TEKNOLOGI INSTITUT TEKNOLOGI SEPULUH NOPEMBER\nKampus ITS Sukolilo Surabaya 60111\nTelepon: 031-5994251-54, 5947274, 5945472 (Hunting)\nFax: 031-5947264, 5950806\nhttp://www.its.ac.id\nNomor : 6195/IT2.I/B/PP.06.00/1/2024\nLamp : Satu set\nPerihal: Wisuda ITS ke 129 Periode April 2024\n26 Februari 2024\nY th.:\n- Para Dekan\n- Para Kepala Departemen\nInstitut Teknologi Sepuluh Nopember\nKampus ITS Surabaya\nSehubungan dengan akan dilaksanakan Wisuda 129 Periode April 2024 yang akan dilaksanakan secara offline pada tanggal 20-21 April 2024, bersama ini kami mohon untuk disampaikan kepada calon wisudawan 129 di lingkungan Saudara untuk memperhatikan ketentuan-ketentuan sebagai berikut:\nA. PELAKSANAAN WISUDA :\nWisuda ITS ke 129 dilaksanakan secara offline di Gedung Graha Sepuluh Nopember\nJadwal pelaksanaan wisuda sebagai berikut :\nNO\nFAKULTAS\nFT-IRS, FT-SPK, SIMT, F-VOKASI\nFSAD, FTK, FT-EIC, F-DKBD\nJADWAL\nSabtu, 20 April 2024\nMinggu, 21 April 2024\nPukul']","Kuliah Agama Islam di Semester Regular diadakan di Tower 1, Lt. 5.",1.0,0.3333333333,0.0,0.0
11,Kapan waktu kuliah Fisika Mekanika di Semester Regular berlangsung?,Saya tidak tahu.,"['Frequently Asked Question\nAcademic Support ðŸ“– \nQ: Nilai saya belum keluar/salah, banding nilainya bagaimana?\n\nA: Untuk kelas MBKM, Isi form ralat nilai beserta bukti dukung â†’ tunggu nilai berubah. Form dibagikan ke mahasiswa setelah rilis nilai MBKM (ctt : periode rilis nilai MBKM berbeda dengan nilai kelas reguler).\n\nUntuk kelas reguler, komunikasikan dengan dosen pengampu MK masing - masing.\n\nQ: Kelas saya bentrok, bagaimana cara pindah kelas?\n\nA: Cari kelas dengan jadwal yang sesuai â†’ konsultasikan ke dosen wali & pengampu MK â†’ laporkan ke Sekdep 1 (+cc Bu Inka jika via email) â†’ bersabar sampai kelasnya dirubah.\n\nQ: Apakah wajib mengisi kuisioner dan IPD di akhir semester?\n\nA: WAJIB. Tolong diisi ya.\n\nQ: Berapa sks mata kuliah pengayaan yang bisa diambil?\n\nA: Di peraturan akademik mengambil MK pengayaan maksimal 6 sks dan minimum 3 sks.\n\nQ: Apakah mata kuliah pengayaan bisa di-drop?'
 'Q: Berapa sks mata kuliah pengayaan yang bisa diambil?\n\nA: Di peraturan akademik mengambil MK pengayaan maksimal 6 sks dan minimum 3 sks.\n\nQ: Apakah mata kuliah pengayaan bisa di-drop?\n\nA: Seperti halnya MK yang lain, jika masih dalam masa drop tiap semester, maka boleh (sampai dengan minggu 10). Setelah waktu itu tidak bisa, namun bisa digantikan dengan MK pengayaan lain yang diambil di semester berikutnya.\n\nQ: Kepada siapa saya meminta konsultasi tentang perwalian/perencanaan kuliah, merubah MK yang diambil dan drop MK setelah minggu ke 4?\n\nA: Ke DOSEN WALI, bukan ke PEMBIMBING TA. Batas akhir perubahan MK adalah minggu ke 3 dan drop MK adalah minggu ke 10\n\nQ: Bagaimana jika saya tidak bisa ambil MK di FRS padahal prasyarat sudah terpenuhi? \n\nA: Silakan menginformasikan ke doswal dengan menyertakan bukti2. Doswal akan membantu menambahkan MK yang dimaksud jika bukti2 telah mencukupi.\n\nQ: Apakah MK yang diambil via dropdown MBKM bisa menggantikan MK yang sudah diambil?'
 'TATA TERTIB PELAKSANAAN SIDANG PROPOSAL TESIS\n\nPROGRAM STUDI S2 TEKNIK INFORMATIKA\n\nDEPARTEMEN TEKNIK INFORMATIKA â€“ FAKULTAS TEKNOLOGI ELEKTRO & INFORMATIKA CERDAS, ITS\n\n1. Peserta sidang proposal tesis menyiapkan perangkat laptop yang memadai dan jaringan internet yang stabil serta berada di tempat yang kondusif.\n\n2. Peserta sidang proposal tesis menyiapkan aplikasi Zoom dengan fitur kamera dan audio yang dapat berfungsi dengan baik.\n\n3. Peserta sidang proposal tesis menyiapkan file presentasi berupa PPT dan draft proposal tesis.\n\n4. Waktu sidang proposal tesis berlangsung selama 60 menit, 15 menit presentasi dan 45 menit tanya jawab.\n\n5. Peserta sidang proposal tesis disarankan untuk standby 30 menit sebelum jadwal yang ditentukan dan dapat bergabung pada link zoom meeting sesuai jadwal yang telah ditentukan atau sesuai instruksi dari dosen pembimbing/ penguji.'
 '10. Mahasiswa melaksanakan sidang proposal tesis. Sedangkan, dosen pembimbing dan \npenguji memberikan feedback ke mahasiswa, mengisi berita acara , memberikan penilaian \ndan catatan revisi  sidang proposal tesis.  \n11. Setelah mahasiswa melaksanakan sidang proposal tesis, Admin Akademik Pascasarjana  \nmeng -update status sidang proposal tesis di MonTes dari â€˜Terjadwal Ujianâ€™ menjadi \nâ€˜Revisi â€™. \n12. Mahasiswa mengerjakan revisi dan menyusun buku proposal tesis sesuai dengan hasil \ndiskusi ketika sidang proposal tesis dan/atau sesuai catatan dalam lembar revisi. Apabila \nsudah selesai mengerjakan revisi, mahasiswa dapat memberikan hasil revisinya ke dosen \npembimbing dan penguji serta mengajukan lembar revisi dan lembar pengesahan buku \nproposal tesis untuk meminta persetujuan ke dosen pembimbing dan penguji. Batas \npengerjaan revi si adalah 2 minggu setelah sidang proposal tesis berlangsung.  \n13. Apabila revisi yang dikerjakan mahasiswa dirasa sudah tepat, dosen pembimbing dan']","Kuliah Fisika Mekanika di Semester Regular berlangsung pada Senin dan Rabu, pukul 15.30-17.10.",0.0,0.99999999995,0.0,0.0
12,Berapa jumlah SKS untuk mata kuliah Matematika di Semester IUP? ,Saya tidak menemukan informasi mengenai jumlah SKS untuk mata kuliah Matematika di Semester IUP dalam konteks yang diberikan.,"['Frequently Asked Question\nAcademic Support ðŸ“– \nQ: Nilai saya belum keluar/salah, banding nilainya bagaimana?\n\nA: Untuk kelas MBKM, Isi form ralat nilai beserta bukti dukung â†’ tunggu nilai berubah. Form dibagikan ke mahasiswa setelah rilis nilai MBKM (ctt : periode rilis nilai MBKM berbeda dengan nilai kelas reguler).\n\nUntuk kelas reguler, komunikasikan dengan dosen pengampu MK masing - masing.\n\nQ: Kelas saya bentrok, bagaimana cara pindah kelas?\n\nA: Cari kelas dengan jadwal yang sesuai â†’ konsultasikan ke dosen wali & pengampu MK â†’ laporkan ke Sekdep 1 (+cc Bu Inka jika via email) â†’ bersabar sampai kelasnya dirubah.\n\nQ: Apakah wajib mengisi kuisioner dan IPD di akhir semester?\n\nA: WAJIB. Tolong diisi ya.\n\nQ: Berapa sks mata kuliah pengayaan yang bisa diambil?\n\nA: Di peraturan akademik mengambil MK pengayaan maksimal 6 sks dan minimum 3 sks.\n\nQ: Apakah mata kuliah pengayaan bisa di-drop?'
 'Q: Berapa sks mata kuliah pengayaan yang bisa diambil?\n\nA: Di peraturan akademik mengambil MK pengayaan maksimal 6 sks dan minimum 3 sks.\n\nQ: Apakah mata kuliah pengayaan bisa di-drop?\n\nA: Seperti halnya MK yang lain, jika masih dalam masa drop tiap semester, maka boleh (sampai dengan minggu 10). Setelah waktu itu tidak bisa, namun bisa digantikan dengan MK pengayaan lain yang diambil di semester berikutnya.\n\nQ: Kepada siapa saya meminta konsultasi tentang perwalian/perencanaan kuliah, merubah MK yang diambil dan drop MK setelah minggu ke 4?\n\nA: Ke DOSEN WALI, bukan ke PEMBIMBING TA. Batas akhir perubahan MK adalah minggu ke 3 dan drop MK adalah minggu ke 10\n\nQ: Bagaimana jika saya tidak bisa ambil MK di FRS padahal prasyarat sudah terpenuhi? \n\nA: Silakan menginformasikan ke doswal dengan menyertakan bukti2. Doswal akan membantu menambahkan MK yang dimaksud jika bukti2 telah mencukupi.\n\nQ: Apakah MK yang diambil via dropdown MBKM bisa menggantikan MK yang sudah diambil?'
 'Lampiran 7A\nContoh lembar penilaian dan daftar hadir seminar proposal\ntesis\nDEPARTEMEN PENDIDIKAN NASIONAL\nINSTITUT TEKNOLOGI SEPULUH NOPEMBER SURABAYA\nPROGRAM PASCASARJANA\nDAFTAR HADIR DAN NILAI SEMINAR PROPOSAL TESIS\n:........\nJudul Seminar\nOleh\nNrp.\nProgram Studi\nBidang Keahlian\nTanda Tangan\n:....\n:\nNo\nNama Dosen\nJabatan\nTanda Tangan\nNilai (dalam angka)\n\n\nKetua\nAnggota\nAnggota\nAnggota\n\n\nNilai rata-rata : .... (dalam angka)\n.... (dalam huruf)\nKetua Sidang,\nSurabaya,\nMengetahui :\nKetua Program Studi,\n47'
 'Student Affairs ðŸŽ—ï¸\nQ: Bagaimana cara mendaftar Asisten Dosen?\n\nA:  Pendaftaran Asisten Dosen dibuka setiap awal semester. Calon Asisten WAJIB mengisi form pendaftaran. Rekomendasi Dosen dapat menjadi nilai tambah. Setiap mahasiswa hanya bisa mendaftar maksimal 3 kelas.\n\nQ: Apa yang harus dikumpulkan oleh Asisten Dosen sebagai laporan di akhir semester? Apa harus mengisi daftar hadir?\n\nA:  Tidak ada presensi khusus kehadiran asisten. Namun, setiap asisten wajib mencatatkan setiap kehadiran & rincian/deksripsi kegiatan (saat hadir) di logbook yang akan dikumpulkan dan dicek di akhir semester.\n\nQ: Apakah mahasiswa baru juga mengisi SKEM?\n\nA:  Semua mahasiswa wajib mengisi SKEM dengan terlebih dahulu melengkapi portofolio. Setelah itu dapat memilih SKEM yang sesuai\n\nQ: Jika saya membutuhkan surat tugas untuk mengisi SKEM, kemana saya meminta?\n\nA:  silakan kontak ke CP Dirmawa di 082233935593 atau mengacu ke pamflet yang ada di folder MBKM dari link akademik Sarjana']",Mata kuliah Matematika di Semester IUP memiliki 2 SKS.,0.0,0.9166666666361111,0.0,0.0
13,Apa hari dan jam kuliah untuk Bahasa Indonesia di Semester IUP?,Saya tidak menemukan informasi mengenai jadwal kuliah Bahasa Indonesia di Semester IUP dalam konteks yang diberikan.,"['Frequently Asked Question\nAcademic Support ðŸ“– \nQ: Nilai saya belum keluar/salah, banding nilainya bagaimana?\n\nA: Untuk kelas MBKM, Isi form ralat nilai beserta bukti dukung â†’ tunggu nilai berubah. Form dibagikan ke mahasiswa setelah rilis nilai MBKM (ctt : periode rilis nilai MBKM berbeda dengan nilai kelas reguler).\n\nUntuk kelas reguler, komunikasikan dengan dosen pengampu MK masing - masing.\n\nQ: Kelas saya bentrok, bagaimana cara pindah kelas?\n\nA: Cari kelas dengan jadwal yang sesuai â†’ konsultasikan ke dosen wali & pengampu MK â†’ laporkan ke Sekdep 1 (+cc Bu Inka jika via email) â†’ bersabar sampai kelasnya dirubah.\n\nQ: Apakah wajib mengisi kuisioner dan IPD di akhir semester?\n\nA: WAJIB. Tolong diisi ya.\n\nQ: Berapa sks mata kuliah pengayaan yang bisa diambil?\n\nA: Di peraturan akademik mengambil MK pengayaan maksimal 6 sks dan minimum 3 sks.\n\nQ: Apakah mata kuliah pengayaan bisa di-drop?'
 'KEMENTERIAN PENDIDIKAN, KEBUDAYAAN, RISET, DAN TEKNOLOGI INSTITUT TEKNOLOGI SEPULUH NOPEMBER\nKampus ITS Sukolilo Surabaya 60111\nTelepon: 031-5994251-54, 5947274, 5945472 (Hunting)\nFax: 031-5947264, 5950806\nhttp://www.its.ac.id\nNomor : 6195/IT2.I/B/PP.06.00/1/2024\nLamp : Satu set\nPerihal: Wisuda ITS ke 129 Periode April 2024\n26 Februari 2024\nY th.:\n- Para Dekan\n- Para Kepala Departemen\nInstitut Teknologi Sepuluh Nopember\nKampus ITS Surabaya\nSehubungan dengan akan dilaksanakan Wisuda 129 Periode April 2024 yang akan dilaksanakan secara offline pada tanggal 20-21 April 2024, bersama ini kami mohon untuk disampaikan kepada calon wisudawan 129 di lingkungan Saudara untuk memperhatikan ketentuan-ketentuan sebagai berikut:\nA. PELAKSANAAN WISUDA :\nWisuda ITS ke 129 dilaksanakan secara offline di Gedung Graha Sepuluh Nopember\nJadwal pelaksanaan wisuda sebagai berikut :\nNO\nFAKULTAS\nFT-IRS, FT-SPK, SIMT, F-VOKASI\nFSAD, FTK, FT-EIC, F-DKBD\nJADWAL\nSabtu, 20 April 2024\nMinggu, 21 April 2024\nPukul'
 'Lampiran 10.C\nContoh Berita Acara Ujian Akhir Tesis\nDEPARTEMEN PENDIDIKAN NASIONAL\nINSTITUT TEKNOLOGI SEPULUH NOPEMBER SURABAYA\nPROGRAM PASCASARJANA\nBERITA ACARA\nUJIAN TESIS\nPada\nHari, Tanggal Jam\nTempat\ntelah dilaksanakan Ujian Tesis\nJudul\nOleh Nrp.\nProgram Studi\nBidang Keahlian\n:.....\n:...\ndengan hasil\n1. disetujui\n2. disetujui dengan perbaikan / penyempurnaan\n3. tidak disetujui atau mengulang\nPerbaikan / penyempurnaan yang harus dilakukan adalah : (kalau diperlukan dapat ditulis di lembar terpisah)\nPenguji :\nKetua Sidang\n1..\n2.\nMengetahui,\nKetua Program Studi,\n3.\n4......\n5. Dst\n57\n\nCatatan : dibuat rangkap 4\n1. Direktur PPs - ITS\n2. Ketua Program Studi\n3. Dosen (-dosen) Pembimbing\n4. Mahasiswa yang bersangkutan'
 'Jadwal pelaksanaan wisuda sebagai berikut :\nNO\nFAKULTAS\nFT-IRS, FT-SPK, SIMT, F-VOKASI\nFSAD, FTK, FT-EIC, F-DKBD\nJADWAL\nSabtu, 20 April 2024\nMinggu, 21 April 2024\nPukul\nTempat\n: 06.30 WIB - selesa1\n: Graha Sepuluh Nopember, Kampus ITS Sukolilo - Surabaya\nB. PEMBEKALAN WISUDA :\nHari/tanggal\n: Kamis, 18 April 2024\nPukul\n: 08.00 WIB\nTempat\n: Gedung Graha Sepuluh Nopember (Offline)\nC. PEMBAYARAN BIAYA WISUDA DAN TOGA:\n1. Biaya wisuda sebesar Rp. 1.000.000,- (Satu juta rupiah) khusus program Magister dan Doktor, dibayarkan dengan sistem host to host, melalui bank Mandiri, BRI, BNI, dan BSI mulai tanggal 4 s.d 15 Maret 2024, dengan cara menyebutkan angka 93 dilanjutkan dengan NRP. Sedangkan biaya sewa dan peminjaman toga mengikuti ketentuan Dharma Wanita Persatuan ITS.\n2. Mahasiswa Program Sarjana dan Sarjana Terapan tidak dikenakan biaya Wisuda, hanya dikenakan uang jaminan toga (akan dikembalikan setelah toga kembali).']","Kuliah Bahasa Indonesia di Semester IUP berlangsung pada Kamis, pukul 13.30-15.10.",0.0,0.9999999999,1.0,0.0
14,Bagaimana cara penulisan abstrak yang benar dalam proposal tesis?,"Untuk menulis abstrak yang benar dalam proposal tesis, Anda dapat mengikuti panduan berikut:

1. Pastikan abstrak mencakup informasi singkat tentang latar belakang masalah, tujuan penelitian, metode penelitian yang digunakan, hasil penelitian, dan kesimpulan yang diperoleh.
2. Gunakan bahasa yang jelas, ringkas, dan mudah dipahami oleh pembaca.
3. Hindari penggunaan kalimat yang terlalu panjang dan rumit.
4. Pastikan abstrak memiliki struktur yang teratur, dimulai dari latar belakang, tujuan, metode, hasil, dan kesimpulan.
5. Periksa kembali abstrak untuk memastikan tidak ada kesalahan tata bahasa atau ejaan.

Dengan mengikuti panduan di atas, Anda dapat menulis abstrak yang benar dan informatif dalam proposal tesis Anda.","['pendaftaran sidang proposal tesis melalui MonTes dan grup whatsapp.  \n3. Mahasiswa yang ingin mendaftar sidang proposal tesis, harus melengkapi berkas \npersyaratan  pendafta ran sidang proposal tesis , meliputi  draft proposal tesis dan lembar  \npersetujuan pembimbing. Apabila kedua dokumen tersebut sudah lengkap, mahasiswa \ndapat melakukan pendaftaran melalui Google Form dengan link \nhttps://bit.ly/DaftarSidangPropTesGasal2122 . \n4. Admin Akademik Pascasarjana  memverikasi berkas persyaratan pendaftaran sidang \nproposal tesis . Apabila berkas sudah memenuhi, kemudian meng -input data mahasiswa \nyang mendaftar sidang proposal tesis ke MonTes  dan mengatur status menjadi â€˜Terdaftarâ€™.  \n5. Admin Akademik Pascasarjana  merekap data mahasiswa pendaftar sidang proposal tesis \ndi Microsoft Excel dan mengirimkan file hasil rekapitulasi data pendaf tar sidang proposal \ntesis ke masing -masing ketua RMK yang terkait dengan topik penelitian tesis mahasiswa'
 'hasil revisiDokumen hasil\nrevisi sidang\nproposal tesis  \nApakah revisi\nsudah sesuai?Dokumen hasil\nrevisi sidang\nproposal tesis  Ketua RMK menentukan penguji\ndan menjadwalkan sidang\nproposal tesis setiap pesertaSOP PENDAFT ARAN SIDANG PROPOSAL TESIS PROGRAM STUDI S2 TEKNIK INFORMA TIKA (SISTEM ONLINE ), FT -EIC, ITS  \nYaDraft proposal tesis\ndan form persetujuan\npembimbing\nPemeriksa,\n \n \n \n \n \nLina Ambarwati, S.Kom.  \nNIP. 198003242014092001  Mengetahui,\nDr. Ahmad Saikhu, S.Si., M.T . \nNIP. 197107182006041001Pembuat,\n \n \n \n \n \nKartika Dwi Y uniavita Rahmawati, S.T .\nNPP. 1998202122056  \nJadwal sidang, link\nmeeting, dan VB\nTidak\nMenginfokan link google form\nuntuk meng-upload  seluruh\ndokumen hasil revisi sidang\nproposal tesis ke mahasiswa\nStatus sidang\nproposal tesis\nmenjadi ""Disetujui""Merekap data mahasiswa yang\ntelah menyelesaikan revisi\nsidang proposal tesis dan\nmenginfokan ke Kaprodi\nMeng-update status sidang\nproposal tesis di MonT esMeng-upload lembar revisi sidang'
 'Apakah berkas\nsudah lengkap?\nMelakukan pendaftaran sidang\nproposal tesis\nMeminta tanda tangan form revisi\nke dosen pembimbing dan\npenguji dan lembar pengesahan\nke dosen pembimbingJadwal sidang, link\nmeeting, form penilaian\ndan form berita acara  \nMengajukan hasil revisi\nke dosen pembimbing\ndan pengujiMelengkapi dan memeriksa\nberkas persyaratan pendaftaran\nsidang proposal tesis\nTidak\nYa\nCatatan revisi sidang proposal\ntesis dan data penilaian sidang\nproposal tesis dari\npembimbing dan penguji\nMahasiswa dapat mengecek nilai\nsidang proposal tesis melalui\nSIAKAD ITS di akhir semester\n(IF 185301 T esis-Proposal)Dosen (Pembimbing, Penguji, Ketua RMK)\nDosen pembimbing dan penguji\nmenandatangani form revisi dan\nlembar pengesahan, lalu\nmenyerahkan kembali ke mahasiswaDosen pembimbing\ndan penguji memeriksa\nhasil revisiDokumen hasil\nrevisi sidang\nproposal tesis  \nApakah revisi\nsudah sesuai?Dokumen hasil\nrevisi sidang\nproposal tesis  Ketua RMK menentukan penguji\ndan menjadwalkan sidang'
 'pengerjaan revi si adalah 2 minggu setelah sidang proposal tesis berlangsung.  \n13. Apabila revisi yang dikerjakan mahasiswa dirasa sudah tepat, dosen pembimbing dan \npenguji dapat memberikan persetujuan yang dibuktikan dengan menandatangi form revisi  \ndan lembar pengesahan buku proposal tesis . 14. Admin Akademik Pascasarjana  menginfokan link untuk upload hasil revisi sidang \nproposal tesis ke mahasiswa melalui grup Whatsapp.  \n15. Mahasiswa meng -upload file hasil revisi sidang proposal tesis dan lembar revisi sidang \nproposal tesis ke link https://bit.ly/HasilRevisiProposalTesisDTIf . \n16. Apabila mahasiswa sudah mengumpulkan softfile buku proposal tesis, Admin Akademik \nPascasarjana  mengubah status sidang proposal tesis di MonTes  dari â€˜Revisiâ€™  menjad i \nâ€˜Disetujuiâ€™.  \n17. Mahasiswa dapat mengecek nilai sidang proposal tesis di SIAKAD ITS mata kuliah IF \n185301 Tesis -Proposal.  \n \n \nNotes: Link google form akan di -update setiap tahun ajaran']","Abstrak ditulis dalam Bahasa Indonesia dan Bahasa Inggris pada halaman yang berbeda, maksimal 350 kata, dengan format yang mencakup latar belakang, permasalahan, metodologi, dan kata kunci.",0.0,0.49999999995,1.0,0.9932797622226475
15,Bagaimana aturan penomoran halaman dalam proposal dan tesis?,"Aturan penomoran halaman dalam proposal dan tesis biasanya mengikuti aturan standar penulisan ilmiah. Penomoran halaman dimulai dari halaman judul yang biasanya tidak diberi nomor halaman, kemudian halaman-halaman berikutnya diberi nomor halaman berurutan dengan angka arab (1, 2, 3, dst.). Halaman-halaman awal seperti daftar isi, daftar tabel, daftar gambar, abstrak, kata pengantar, dan lain-lain biasanya diberi nomor romawi kecil (i, ii, iii, dst.) sedangkan halaman-halaman utama dan lampiran diberi nomor halaman angka arab. Penomoran halaman biasanya diletakkan di bagian bawah tengah atau kanan bawah halaman.","['hasil revisiDokumen hasil\nrevisi sidang\nproposal tesis  \nApakah revisi\nsudah sesuai?Dokumen hasil\nrevisi sidang\nproposal tesis  Ketua RMK menentukan penguji\ndan menjadwalkan sidang\nproposal tesis setiap pesertaSOP PENDAFT ARAN SIDANG PROPOSAL TESIS PROGRAM STUDI S2 TEKNIK INFORMA TIKA (SISTEM ONLINE ), FT -EIC, ITS  \nYaDraft proposal tesis\ndan form persetujuan\npembimbing\nPemeriksa,\n \n \n \n \n \nLina Ambarwati, S.Kom.  \nNIP. 198003242014092001  Mengetahui,\nDr. Ahmad Saikhu, S.Si., M.T . \nNIP. 197107182006041001Pembuat,\n \n \n \n \n \nKartika Dwi Y uniavita Rahmawati, S.T .\nNPP. 1998202122056  \nJadwal sidang, link\nmeeting, dan VB\nTidak\nMenginfokan link google form\nuntuk meng-upload  seluruh\ndokumen hasil revisi sidang\nproposal tesis ke mahasiswa\nStatus sidang\nproposal tesis\nmenjadi ""Disetujui""Merekap data mahasiswa yang\ntelah menyelesaikan revisi\nsidang proposal tesis dan\nmenginfokan ke Kaprodi\nMeng-update status sidang\nproposal tesis di MonT esMeng-upload lembar revisi sidang'
 'pengerjaan revi si adalah 2 minggu setelah sidang proposal tesis berlangsung.  \n13. Apabila revisi yang dikerjakan mahasiswa dirasa sudah tepat, dosen pembimbing dan \npenguji dapat memberikan persetujuan yang dibuktikan dengan menandatangi form revisi  \ndan lembar pengesahan buku proposal tesis . 14. Admin Akademik Pascasarjana  menginfokan link untuk upload hasil revisi sidang \nproposal tesis ke mahasiswa melalui grup Whatsapp.  \n15. Mahasiswa meng -upload file hasil revisi sidang proposal tesis dan lembar revisi sidang \nproposal tesis ke link https://bit.ly/HasilRevisiProposalTesisDTIf . \n16. Apabila mahasiswa sudah mengumpulkan softfile buku proposal tesis, Admin Akademik \nPascasarjana  mengubah status sidang proposal tesis di MonTes  dari â€˜Revisiâ€™  menjad i \nâ€˜Disetujuiâ€™.  \n17. Mahasiswa dapat mengecek nilai sidang proposal tesis di SIAKAD ITS mata kuliah IF \n185301 Tesis -Proposal.  \n \n \nNotes: Link google form akan di -update setiap tahun ajaran'
 'di Microsoft Excel dan mengirimkan file hasil rekapitulasi data pendaf tar sidang proposal \ntesis ke masing -masing ketua RMK yang terkait dengan topik penelitian tesis mahasiswa \nuntuk meminta di -plotting -kan jadwal sidang tesis dan dosen penguji.  \n6. Ketua RMK mem -plotting jadwal dan dosen penguji sidang proposal tesis untuk masi ng-\nmasing mahasiswa dan menginfokannya ke Admin Akademik Pascasarjana . \n7. Admin Akademik Pascasarjana  mengirimkan jadwal dan virtual background sidang \nproposal tesis ke mahasiswa melalui grup Whatsapp.  \n8. Mahasiswa standby 30 menit sebelum sesi dimulai dan bergabung ke link meeting sesuai \njadwal sidang proposal tesis yang telah ditentukan.  \n9. Dosen pembimbing dan penguji bergabung ke link meeting sesuai jadwal sidang proposal \ntesis yang telah ditentukan.  \n10. Mahasiswa melaksanakan sidang proposal tesis. Sedangkan, dosen pembimbing dan \npenguji memberikan feedback ke mahasiswa, mengisi berita acara , memberikan penilaian'
 'telah menyelesaikan revisi\nsidang proposal tesis dan\nmenginfokan ke Kaprodi\nMeng-update status sidang\nproposal tesis di MonT esMeng-upload lembar revisi sidang\nproposal tesis dan buku proposal\ntesis yang dilengkapi dengan\nlembar pengesahan yang sudah\ntertandatanganiLembar revisi dan\nlembar pengesahan yang\ntelah tertandatanganiData peserta sidang\nproposal tesis\nLembar revisi sidang\nproposal tesis  Usulan jadwal dan\npenguji sidang\nproposal tesis  \nLembar revisi dan\nlembar pengesahanSIDANG PROPOSAL TESIS (IF -185301) PROGRAM STUDI S2 TEKNIK \nINFORMATIKA, DEPARTEMEN TEKNIK INFORMATIKA, FT -EIC ITS  \n(SISTEM ONLINE ) \n \n1. Dalam satu semester, terdapat dua kali siding proposal tesis, yaitu minggu ke -5 â€“ minggu \nke-6 dan minggu ke -17 â€“ minggu  ke-18. \n2. Admin Akademik Pascasarjana  menginfokan jadwal, persyaratan, dan link Google Form \npendaftaran sidang proposal tesis melalui MonTes dan grup whatsapp.  \n3. Mahasiswa yang ingin mendaftar sidang proposal tesis, harus melengkapi berkas']","Semua bagian sebelum teks diberi nomor halaman dengan angka Romawi kecil pada bagian bawah-tengah halaman, sedangkan bagian teks dan seterusnya menggunakan angka Arab dan diletakkan di bagian bawah-tengah halaman.",0.0,0.0,0.6666666666666666,0.999998891116426
16,Apa ketentuan margin dalam penulisan proposal tesis? ,"Margin dalam penulisan proposal tesis adalah 4 cm dari sisi kanan, kiri, atas, dan bawah.","['pendaftaran sidang proposal tesis melalui MonTes dan grup whatsapp.  \n3. Mahasiswa yang ingin mendaftar sidang proposal tesis, harus melengkapi berkas \npersyaratan  pendafta ran sidang proposal tesis , meliputi  draft proposal tesis dan lembar  \npersetujuan pembimbing. Apabila kedua dokumen tersebut sudah lengkap, mahasiswa \ndapat melakukan pendaftaran melalui Google Form dengan link \nhttps://bit.ly/DaftarSidangPropTesGasal2122 . \n4. Admin Akademik Pascasarjana  memverikasi berkas persyaratan pendaftaran sidang \nproposal tesis . Apabila berkas sudah memenuhi, kemudian meng -input data mahasiswa \nyang mendaftar sidang proposal tesis ke MonTes  dan mengatur status menjadi â€˜Terdaftarâ€™.  \n5. Admin Akademik Pascasarjana  merekap data mahasiswa pendaftar sidang proposal tesis \ndi Microsoft Excel dan mengirimkan file hasil rekapitulasi data pendaf tar sidang proposal \ntesis ke masing -masing ketua RMK yang terkait dengan topik penelitian tesis mahasiswa'
 'hasil revisiDokumen hasil\nrevisi sidang\nproposal tesis  \nApakah revisi\nsudah sesuai?Dokumen hasil\nrevisi sidang\nproposal tesis  Ketua RMK menentukan penguji\ndan menjadwalkan sidang\nproposal tesis setiap pesertaSOP PENDAFT ARAN SIDANG PROPOSAL TESIS PROGRAM STUDI S2 TEKNIK INFORMA TIKA (SISTEM ONLINE ), FT -EIC, ITS  \nYaDraft proposal tesis\ndan form persetujuan\npembimbing\nPemeriksa,\n \n \n \n \n \nLina Ambarwati, S.Kom.  \nNIP. 198003242014092001  Mengetahui,\nDr. Ahmad Saikhu, S.Si., M.T . \nNIP. 197107182006041001Pembuat,\n \n \n \n \n \nKartika Dwi Y uniavita Rahmawati, S.T .\nNPP. 1998202122056  \nJadwal sidang, link\nmeeting, dan VB\nTidak\nMenginfokan link google form\nuntuk meng-upload  seluruh\ndokumen hasil revisi sidang\nproposal tesis ke mahasiswa\nStatus sidang\nproposal tesis\nmenjadi ""Disetujui""Merekap data mahasiswa yang\ntelah menyelesaikan revisi\nsidang proposal tesis dan\nmenginfokan ke Kaprodi\nMeng-update status sidang\nproposal tesis di MonT esMeng-upload lembar revisi sidang'
 'Apakah berkas\nsudah lengkap?\nMelakukan pendaftaran sidang\nproposal tesis\nMeminta tanda tangan form revisi\nke dosen pembimbing dan\npenguji dan lembar pengesahan\nke dosen pembimbingJadwal sidang, link\nmeeting, form penilaian\ndan form berita acara  \nMengajukan hasil revisi\nke dosen pembimbing\ndan pengujiMelengkapi dan memeriksa\nberkas persyaratan pendaftaran\nsidang proposal tesis\nTidak\nYa\nCatatan revisi sidang proposal\ntesis dan data penilaian sidang\nproposal tesis dari\npembimbing dan penguji\nMahasiswa dapat mengecek nilai\nsidang proposal tesis melalui\nSIAKAD ITS di akhir semester\n(IF 185301 T esis-Proposal)Dosen (Pembimbing, Penguji, Ketua RMK)\nDosen pembimbing dan penguji\nmenandatangani form revisi dan\nlembar pengesahan, lalu\nmenyerahkan kembali ke mahasiswaDosen pembimbing\ndan penguji memeriksa\nhasil revisiDokumen hasil\nrevisi sidang\nproposal tesis  \nApakah revisi\nsudah sesuai?Dokumen hasil\nrevisi sidang\nproposal tesis  Ketua RMK menentukan penguji\ndan menjadwalkan sidang'
 'pengerjaan revi si adalah 2 minggu setelah sidang proposal tesis berlangsung.  \n13. Apabila revisi yang dikerjakan mahasiswa dirasa sudah tepat, dosen pembimbing dan \npenguji dapat memberikan persetujuan yang dibuktikan dengan menandatangi form revisi  \ndan lembar pengesahan buku proposal tesis . 14. Admin Akademik Pascasarjana  menginfokan link untuk upload hasil revisi sidang \nproposal tesis ke mahasiswa melalui grup Whatsapp.  \n15. Mahasiswa meng -upload file hasil revisi sidang proposal tesis dan lembar revisi sidang \nproposal tesis ke link https://bit.ly/HasilRevisiProposalTesisDTIf . \n16. Apabila mahasiswa sudah mengumpulkan softfile buku proposal tesis, Admin Akademik \nPascasarjana  mengubah status sidang proposal tesis di MonTes  dari â€˜Revisiâ€™  menjad i \nâ€˜Disetujuiâ€™.  \n17. Mahasiswa dapat mengecek nilai sidang proposal tesis di SIAKAD ITS mata kuliah IF \n185301 Tesis -Proposal.  \n \n \nNotes: Link google form akan di -update setiap tahun ajaran']","Margin yang ditetapkan adalah 3,5 cm dari tepi atas, 3 cm dari tepi bawah, 4 cm dari tepi kiri (halaman ganjil) atau kanan (halaman genap), dan 3 cm dari tepi kanan (halaman ganjil) atau kiri (halaman genap).",0.0,0.9999999999,0.0,0.964196074488675
17,Apa syarat yang harus dipenuhi mahasiswa sebelum dapat membuat proposal tesis,"Sebelum dapat membuat proposal tesis, mahasiswa harus melengkapi berkas persyaratan pendaftaran sidang proposal tesis, yang meliputi draft proposal tesis dan lembar persetujuan pembimbing. Setelah kedua dokumen tersebut sudah lengkap, mahasiswa dapat melakukan pendaftaran melalui Google Form dengan link yang disediakan. Setelah itu, admin Akademik Pascasarjana akan memverifikasi berkas persyaratan pendaftaran sidang proposal tesis. Jika berkas sudah memenuhi syarat, admin akan meng-input data mahasiswa yang mendaftar sidang proposal tesis ke MonTes dan mengatur status menjadi 'Terdaftar'.","['pendaftaran sidang proposal tesis melalui MonTes dan grup whatsapp.  \n3. Mahasiswa yang ingin mendaftar sidang proposal tesis, harus melengkapi berkas \npersyaratan  pendafta ran sidang proposal tesis , meliputi  draft proposal tesis dan lembar  \npersetujuan pembimbing. Apabila kedua dokumen tersebut sudah lengkap, mahasiswa \ndapat melakukan pendaftaran melalui Google Form dengan link \nhttps://bit.ly/DaftarSidangPropTesGasal2122 . \n4. Admin Akademik Pascasarjana  memverikasi berkas persyaratan pendaftaran sidang \nproposal tesis . Apabila berkas sudah memenuhi, kemudian meng -input data mahasiswa \nyang mendaftar sidang proposal tesis ke MonTes  dan mengatur status menjadi â€˜Terdaftarâ€™.  \n5. Admin Akademik Pascasarjana  merekap data mahasiswa pendaftar sidang proposal tesis \ndi Microsoft Excel dan mengirimkan file hasil rekapitulasi data pendaf tar sidang proposal \ntesis ke masing -masing ketua RMK yang terkait dengan topik penelitian tesis mahasiswa'
 'Apakah berkas\nsudah lengkap?\nMelakukan pendaftaran sidang\nproposal tesis\nMeminta tanda tangan form revisi\nke dosen pembimbing dan\npenguji dan lembar pengesahan\nke dosen pembimbingJadwal sidang, link\nmeeting, form penilaian\ndan form berita acara  \nMengajukan hasil revisi\nke dosen pembimbing\ndan pengujiMelengkapi dan memeriksa\nberkas persyaratan pendaftaran\nsidang proposal tesis\nTidak\nYa\nCatatan revisi sidang proposal\ntesis dan data penilaian sidang\nproposal tesis dari\npembimbing dan penguji\nMahasiswa dapat mengecek nilai\nsidang proposal tesis melalui\nSIAKAD ITS di akhir semester\n(IF 185301 T esis-Proposal)Dosen (Pembimbing, Penguji, Ketua RMK)\nDosen pembimbing dan penguji\nmenandatangani form revisi dan\nlembar pengesahan, lalu\nmenyerahkan kembali ke mahasiswaDosen pembimbing\ndan penguji memeriksa\nhasil revisiDokumen hasil\nrevisi sidang\nproposal tesis  \nApakah revisi\nsudah sesuai?Dokumen hasil\nrevisi sidang\nproposal tesis  Ketua RMK menentukan penguji\ndan menjadwalkan sidang'
 'pengerjaan revi si adalah 2 minggu setelah sidang proposal tesis berlangsung.  \n13. Apabila revisi yang dikerjakan mahasiswa dirasa sudah tepat, dosen pembimbing dan \npenguji dapat memberikan persetujuan yang dibuktikan dengan menandatangi form revisi  \ndan lembar pengesahan buku proposal tesis . 14. Admin Akademik Pascasarjana  menginfokan link untuk upload hasil revisi sidang \nproposal tesis ke mahasiswa melalui grup Whatsapp.  \n15. Mahasiswa meng -upload file hasil revisi sidang proposal tesis dan lembar revisi sidang \nproposal tesis ke link https://bit.ly/HasilRevisiProposalTesisDTIf . \n16. Apabila mahasiswa sudah mengumpulkan softfile buku proposal tesis, Admin Akademik \nPascasarjana  mengubah status sidang proposal tesis di MonTes  dari â€˜Revisiâ€™  menjad i \nâ€˜Disetujuiâ€™.  \n17. Mahasiswa dapat mengecek nilai sidang proposal tesis di SIAKAD ITS mata kuliah IF \n185301 Tesis -Proposal.  \n \n \nNotes: Link google form akan di -update setiap tahun ajaran'
 '10. Mahasiswa melaksanakan sidang proposal tesis. Sedangkan, dosen pembimbing dan \npenguji memberikan feedback ke mahasiswa, mengisi berita acara , memberikan penilaian \ndan catatan revisi  sidang proposal tesis.  \n11. Setelah mahasiswa melaksanakan sidang proposal tesis, Admin Akademik Pascasarjana  \nmeng -update status sidang proposal tesis di MonTes dari â€˜Terjadwal Ujianâ€™ menjadi \nâ€˜Revisi â€™. \n12. Mahasiswa mengerjakan revisi dan menyusun buku proposal tesis sesuai dengan hasil \ndiskusi ketika sidang proposal tesis dan/atau sesuai catatan dalam lembar revisi. Apabila \nsudah selesai mengerjakan revisi, mahasiswa dapat memberikan hasil revisinya ke dosen \npembimbing dan penguji serta mengajukan lembar revisi dan lembar pengesahan buku \nproposal tesis untuk meminta persetujuan ke dosen pembimbing dan penguji. Batas \npengerjaan revi si adalah 2 minggu setelah sidang proposal tesis berlangsung.  \n13. Apabila revisi yang dikerjakan mahasiswa dirasa sudah tepat, dosen pembimbing dan']","Mahasiswa harus menyelesaikan minimal 25% beban sks dengan IP kumulatif di atas 2,5 tanpa nilai D dan E sebelum dapat membuat proposal tesis.",0.8055555555287036,1.0,0.0,0.0
18,Bagaimana proses seminar proposal tesis dilaksanakan? ,"Proses seminar proposal tesis dilaksanakan dengan langkah-langkah sebagai berikut:
1. Mahasiswa melakukan pendaftaran sidang proposal tesis dengan melengkapi berkas persyaratan pendaftaran, seperti draft proposal tesis dan lembar persetujuan pembimbing.
2. Admin Akademik Pascasarjana memverifikasi berkas persyaratan pendaftaran sidang proposal tesis. Jika berkas sudah lengkap, data mahasiswa yang mendaftar sidang akan diinput ke MonTes dan statusnya menjadi 'Terdaftar'.
3. Admin Akademik Pascasarjana merekap data mahasiswa pendaftar sidang proposal tesis dan mengirimkan file hasil rekapitulasi data kepada ketua RMK yang terkait.
4. Mahasiswa melaksanakan sidang proposal tesis, dimana dosen pembimbing dan penguji memberikan feedback, mengisi berita acara, memberikan penilaian, dan catatan revisi.
5. Setelah sidang proposal tesis selesai, Admin Akademik Pascasarjana meng-update status sidang dari 'Terjadwal Ujian' menjadi 'Revisi'.
6. Mahasiswa mengerjakan revisi sesuai dengan hasil diskusi saat sidang proposal tesis atau catatan dalam lembar revisi. Batas pengerjaan revisi adalah 2 minggu setelah sidang berlangsung.
7. Apabila revisi dianggap sudah tepat, dosen pembimbing dan penguji memberikan persetujuan dengan menandatangani form revisi dan lembar pengesahan buku proposal tesis.
8. Admin Akademik Pascasarjana menginfokan link untuk upload hasil revisi sidang proposal tesis kepada mahasiswa melalui grup Whatsapp.
9. Mahasiswa meng-upload file hasil revisi sidang proposal tesis ke link yang disediakan.
10. Jika mahasiswa sudah mengumpulkan softfile buku proposal tesis, Admin Akademik Pascasarjana mengubah status sidang dari 'Revisi' menjadi 'Disetujui'.
11. Mahasiswa dapat mengecek nilai sidang proposal tesis di SIAKAD ITS pada mata kuliah IF 185301 Tesis-Proposal.","['Apakah berkas\nsudah lengkap?\nMelakukan pendaftaran sidang\nproposal tesis\nMeminta tanda tangan form revisi\nke dosen pembimbing dan\npenguji dan lembar pengesahan\nke dosen pembimbingJadwal sidang, link\nmeeting, form penilaian\ndan form berita acara  \nMengajukan hasil revisi\nke dosen pembimbing\ndan pengujiMelengkapi dan memeriksa\nberkas persyaratan pendaftaran\nsidang proposal tesis\nTidak\nYa\nCatatan revisi sidang proposal\ntesis dan data penilaian sidang\nproposal tesis dari\npembimbing dan penguji\nMahasiswa dapat mengecek nilai\nsidang proposal tesis melalui\nSIAKAD ITS di akhir semester\n(IF 185301 T esis-Proposal)Dosen (Pembimbing, Penguji, Ketua RMK)\nDosen pembimbing dan penguji\nmenandatangani form revisi dan\nlembar pengesahan, lalu\nmenyerahkan kembali ke mahasiswaDosen pembimbing\ndan penguji memeriksa\nhasil revisiDokumen hasil\nrevisi sidang\nproposal tesis  \nApakah revisi\nsudah sesuai?Dokumen hasil\nrevisi sidang\nproposal tesis  Ketua RMK menentukan penguji\ndan menjadwalkan sidang'
 '10. Mahasiswa melaksanakan sidang proposal tesis. Sedangkan, dosen pembimbing dan \npenguji memberikan feedback ke mahasiswa, mengisi berita acara , memberikan penilaian \ndan catatan revisi  sidang proposal tesis.  \n11. Setelah mahasiswa melaksanakan sidang proposal tesis, Admin Akademik Pascasarjana  \nmeng -update status sidang proposal tesis di MonTes dari â€˜Terjadwal Ujianâ€™ menjadi \nâ€˜Revisi â€™. \n12. Mahasiswa mengerjakan revisi dan menyusun buku proposal tesis sesuai dengan hasil \ndiskusi ketika sidang proposal tesis dan/atau sesuai catatan dalam lembar revisi. Apabila \nsudah selesai mengerjakan revisi, mahasiswa dapat memberikan hasil revisinya ke dosen \npembimbing dan penguji serta mengajukan lembar revisi dan lembar pengesahan buku \nproposal tesis untuk meminta persetujuan ke dosen pembimbing dan penguji. Batas \npengerjaan revi si adalah 2 minggu setelah sidang proposal tesis berlangsung.  \n13. Apabila revisi yang dikerjakan mahasiswa dirasa sudah tepat, dosen pembimbing dan'
 'pendaftaran sidang proposal tesis melalui MonTes dan grup whatsapp.  \n3. Mahasiswa yang ingin mendaftar sidang proposal tesis, harus melengkapi berkas \npersyaratan  pendafta ran sidang proposal tesis , meliputi  draft proposal tesis dan lembar  \npersetujuan pembimbing. Apabila kedua dokumen tersebut sudah lengkap, mahasiswa \ndapat melakukan pendaftaran melalui Google Form dengan link \nhttps://bit.ly/DaftarSidangPropTesGasal2122 . \n4. Admin Akademik Pascasarjana  memverikasi berkas persyaratan pendaftaran sidang \nproposal tesis . Apabila berkas sudah memenuhi, kemudian meng -input data mahasiswa \nyang mendaftar sidang proposal tesis ke MonTes  dan mengatur status menjadi â€˜Terdaftarâ€™.  \n5. Admin Akademik Pascasarjana  merekap data mahasiswa pendaftar sidang proposal tesis \ndi Microsoft Excel dan mengirimkan file hasil rekapitulasi data pendaf tar sidang proposal \ntesis ke masing -masing ketua RMK yang terkait dengan topik penelitian tesis mahasiswa'
 'pengerjaan revi si adalah 2 minggu setelah sidang proposal tesis berlangsung.  \n13. Apabila revisi yang dikerjakan mahasiswa dirasa sudah tepat, dosen pembimbing dan \npenguji dapat memberikan persetujuan yang dibuktikan dengan menandatangi form revisi  \ndan lembar pengesahan buku proposal tesis . 14. Admin Akademik Pascasarjana  menginfokan link untuk upload hasil revisi sidang \nproposal tesis ke mahasiswa melalui grup Whatsapp.  \n15. Mahasiswa meng -upload file hasil revisi sidang proposal tesis dan lembar revisi sidang \nproposal tesis ke link https://bit.ly/HasilRevisiProposalTesisDTIf . \n16. Apabila mahasiswa sudah mengumpulkan softfile buku proposal tesis, Admin Akademik \nPascasarjana  mengubah status sidang proposal tesis di MonTes  dari â€˜Revisiâ€™  menjad i \nâ€˜Disetujuiâ€™.  \n17. Mahasiswa dapat mengecek nilai sidang proposal tesis di SIAKAD ITS mata kuliah IF \n185301 Tesis -Proposal.  \n \n \nNotes: Link google form akan di -update setiap tahun ajaran']","Proposal tesis harus dipresentasikan dalam seminar terbuka yang dihadiri oleh dosen pembimbing, dosen penguji, mahasiswa pascasarjana pada bidang keahlian yang sama, dan pihak lain yang berminat.",0.9999999999666667,1.0,0.799287309966421,0.0
19,Apa saja pilihan penilaian yang dapat diberikan oleh tim penguji proposal tesis?,"Pilihan penilaian yang dapat diberikan oleh tim penguji proposal tesis antara lain adalah memberikan feedback kepada mahasiswa, mengisi berita acara, memberikan penilaian, dan catatan revisi terhadap sidang proposal tesis yang dilaksanakan. Setelah itu, dosen pembimbing dan penguji dapat menandatangani form revisi dan lembar pengesahan buku proposal tesis setelah revisi dilakukan oleh mahasiswa.","['Apakah berkas\nsudah lengkap?\nMelakukan pendaftaran sidang\nproposal tesis\nMeminta tanda tangan form revisi\nke dosen pembimbing dan\npenguji dan lembar pengesahan\nke dosen pembimbingJadwal sidang, link\nmeeting, form penilaian\ndan form berita acara  \nMengajukan hasil revisi\nke dosen pembimbing\ndan pengujiMelengkapi dan memeriksa\nberkas persyaratan pendaftaran\nsidang proposal tesis\nTidak\nYa\nCatatan revisi sidang proposal\ntesis dan data penilaian sidang\nproposal tesis dari\npembimbing dan penguji\nMahasiswa dapat mengecek nilai\nsidang proposal tesis melalui\nSIAKAD ITS di akhir semester\n(IF 185301 T esis-Proposal)Dosen (Pembimbing, Penguji, Ketua RMK)\nDosen pembimbing dan penguji\nmenandatangani form revisi dan\nlembar pengesahan, lalu\nmenyerahkan kembali ke mahasiswaDosen pembimbing\ndan penguji memeriksa\nhasil revisiDokumen hasil\nrevisi sidang\nproposal tesis  \nApakah revisi\nsudah sesuai?Dokumen hasil\nrevisi sidang\nproposal tesis  Ketua RMK menentukan penguji\ndan menjadwalkan sidang'
 '10. Mahasiswa melaksanakan sidang proposal tesis. Sedangkan, dosen pembimbing dan \npenguji memberikan feedback ke mahasiswa, mengisi berita acara , memberikan penilaian \ndan catatan revisi  sidang proposal tesis.  \n11. Setelah mahasiswa melaksanakan sidang proposal tesis, Admin Akademik Pascasarjana  \nmeng -update status sidang proposal tesis di MonTes dari â€˜Terjadwal Ujianâ€™ menjadi \nâ€˜Revisi â€™. \n12. Mahasiswa mengerjakan revisi dan menyusun buku proposal tesis sesuai dengan hasil \ndiskusi ketika sidang proposal tesis dan/atau sesuai catatan dalam lembar revisi. Apabila \nsudah selesai mengerjakan revisi, mahasiswa dapat memberikan hasil revisinya ke dosen \npembimbing dan penguji serta mengajukan lembar revisi dan lembar pengesahan buku \nproposal tesis untuk meminta persetujuan ke dosen pembimbing dan penguji. Batas \npengerjaan revi si adalah 2 minggu setelah sidang proposal tesis berlangsung.  \n13. Apabila revisi yang dikerjakan mahasiswa dirasa sudah tepat, dosen pembimbing dan'
 'Frequently Asked Question\nAcademic Support ðŸ“– \nQ: Nilai saya belum keluar/salah, banding nilainya bagaimana?\n\nA: Untuk kelas MBKM, Isi form ralat nilai beserta bukti dukung â†’ tunggu nilai berubah. Form dibagikan ke mahasiswa setelah rilis nilai MBKM (ctt : periode rilis nilai MBKM berbeda dengan nilai kelas reguler).\n\nUntuk kelas reguler, komunikasikan dengan dosen pengampu MK masing - masing.\n\nQ: Kelas saya bentrok, bagaimana cara pindah kelas?\n\nA: Cari kelas dengan jadwal yang sesuai â†’ konsultasikan ke dosen wali & pengampu MK â†’ laporkan ke Sekdep 1 (+cc Bu Inka jika via email) â†’ bersabar sampai kelasnya dirubah.\n\nQ: Apakah wajib mengisi kuisioner dan IPD di akhir semester?\n\nA: WAJIB. Tolong diisi ya.\n\nQ: Berapa sks mata kuliah pengayaan yang bisa diambil?\n\nA: Di peraturan akademik mengambil MK pengayaan maksimal 6 sks dan minimum 3 sks.\n\nQ: Apakah mata kuliah pengayaan bisa di-drop?'
 'pengerjaan revi si adalah 2 minggu setelah sidang proposal tesis berlangsung.  \n13. Apabila revisi yang dikerjakan mahasiswa dirasa sudah tepat, dosen pembimbing dan \npenguji dapat memberikan persetujuan yang dibuktikan dengan menandatangi form revisi  \ndan lembar pengesahan buku proposal tesis . 14. Admin Akademik Pascasarjana  menginfokan link untuk upload hasil revisi sidang \nproposal tesis ke mahasiswa melalui grup Whatsapp.  \n15. Mahasiswa meng -upload file hasil revisi sidang proposal tesis dan lembar revisi sidang \nproposal tesis ke link https://bit.ly/HasilRevisiProposalTesisDTIf . \n16. Apabila mahasiswa sudah mengumpulkan softfile buku proposal tesis, Admin Akademik \nPascasarjana  mengubah status sidang proposal tesis di MonTes  dari â€˜Revisiâ€™  menjad i \nâ€˜Disetujuiâ€™.  \n17. Mahasiswa dapat mengecek nilai sidang proposal tesis di SIAKAD ITS mata kuliah IF \n185301 Tesis -Proposal.  \n \n \nNotes: Link google form akan di -update setiap tahun ajaran']","im penguji dapat memberikan penilaian berupa: proposal disetujui, proposal disetujui dengan perbaikan, atau proposal tidak disetujui dan harus diulang.",0.9999999999666667,0.75,0.0,1.0
