,question,ground_truth,contexts,answer
0,Apa itu Tesis?,Tesis adalah karya ilmiah yang ditulis untuk memenuhi salah satu syarat untuk menyelesaikan studi pascasarjana strata 2 (program Magister) di Institut Teknologi Sepuluh Nopember Surabaya.,"['Lampiran 11.A\nContoh abstrak tesis dalam Bahasa Indonesia\nKINERJA KOMPOS PRODUKSI UDPK BRATANG\nSEBAGAI MEDIA PENUKAR ION UNTUK MEREDUKSI LOGAM BERAT Cu DALAM AIR LIMBAH BUATAN\nNama mahasiswa\nNRP\nPembimbing\nABSTRAK\nKurangnya motivasi dalam kegiatan pengomposan salah\nsatunya adalah karena rendahnya nilai jual dan sempitnya pasar untuk produksi kompos. Pemanfaatan kompos sebagai media penukar 10n dharapkan dapat meningkatkan nila jual kompos sekaligus untuk memberikan alternatif pengolahan logam berat, khususnya Cu, yang murah. Kemampuan kompos untuk menukar ion berasal dari kandungan materi humus pada kompos yang mempunyai kapasitas tukar kation (KTK). Grup fungsi yang\nberperan\nadalah grup karboksil (-COOH) sehingga\nbisa\ndikategorikan sebagai resin asam lemah. Penelitian ini bertujuan untuk mengkaji kinerja kompos produksi UDPK Bratang sebagai media penukar ion untuk mereduksi Cu dalam air limbah buatan.\nKTK teoritis diukur dengan metode titrasi pH dan', '""Shintami Chusnul Hidayati, S.Kom., M.Sc., Ph.D."",SC,MCI,shintami@its.ac.id,1987 202012 004,,\n""Agus Budi Raharjo, S.Kom., M.Kom., Ph.D."",AB,AP,agus.budi@its.ac.id,1990 202011 022,,\n""Siska Arifiani, S.Kom., M.Kom."",SA,GIGa,siska@its.ac.id,1990 202012 034,,\n""Kelly Rossa Sungkono, S.Kom., M.Kom."",KR,MCI,kelly@its.ac.id,1994 201912 088,,\n""Aldinata Rizky Revanda, S.Kom., M.Kom. "",AI,KCV,aldinata.rizky@its.ac.id,1998 202311 059,,\n""Moch. Nafkhan Alzamzami, S.T., M.T."",NZ,KBJ,nafkhan@its.ac.id,1999 202311 033,,\n""Bintang Nuralamsyah, S.Kom., M.Kom."",BN,RPL,bintang@its.ac.id,1999 202311 029,,\n""Dr.Eng. Muhamad Hilmil Muchtar Aditya Pradana, S. Kom., M. Sc.."",,PKT,hilmi@its.ac.id,1992 202311 051,,\n""Imam Mustafa Kamal, S.ST., Ph.D."",,KCV,,1992 202311 057,,\nSupriyo,,,,,Pramu Keamanan dan Perparkiran,\nYudi Mulyono,,,,,Pengadministrasi Akademik (Sarjana/Sarjana Terapan),\nPurnomo,,,,,Petugas Keamanan (Parkir),\nSoegeng Santoso,,,,,Pengadministrasi Umum,\nJumali,,,,,Teknisi Laboratorium,""KBJ, RPL, Aula""', 'ーー\nLampiran 8A\nA. Contoh sampul / cover dalam tesis mono disiplin\ne20 mm\n40 mm\n35 mm\nWarna Dibagian Atas Garis Biru ITS : Putih\n0.6 dari tinggi kertas\n• 15 mm\nWarna Biru ITS\nWarna Dibawah Garis Biru ITS :\nSesuai Warna Fakultas\nTesis - No. Kode Tesis\nJudul Tesis\nTrebuchet MS (Bold), 17 puchet Ms (Bold),\n18 point\n0.4 dari tinggi kertas\n40 mm\nNAMA MAHASISWA NRP MAHASISWA\nDOSEN PEMBIMBING\nProf. Ir. Wahyu Susilo, M.Sc., Ph.D.\nDr. Ir. Indah Wahyuni, M.Sc.\nPROGRAM MAGISTER BIDANG KEAHLIAN ...\n00.......\nPROGRAM STUDI..............\nDEPARTEMEN ..\nFAKULTAS ..\nINSTITUT TEKNOLOGI SEPULUH NOPEMBER\nSURABAYA\n>20..\n--1\n130 mm\nV\n- Trebuchet MS,\n12 point\n51', 'Pemberitahuan\nUnggah Artikel POmITS\nUNGGAH artikel WAJIB dilakukan oleh MAHASISWA PENDAFTAR YUDISIUM 129\n Mahasiswa yang Dosen Pembimbingnya memilih untuk MEMpuBLIKAsIKAN\nartikelnya pada Jurnal POmITS, dapat melakukan UNGGAH, dengan mengikuti langkah\npada BUKU PANDUAN TATA CARA UNGGAH. File yang HARUS DIUNGGAH adalah\n(ukuran masing-masing file tidak boleh lebih dari 2 MB):\nArtikel hasil dari Tugas Akhir, dalam format Ms. Word yang telah mengikuti tem-\n1.\nplate. (selain format Ms.Word artikel DITOLAK/REJECTED)\nFormulir Hak Cipta, dalam format PDF.\nForm Telaah Artikel POmITs, dalam format PDF.\nForm Revisi/Perbaikan/Penyempurnaan TA yang berisi nama penguji beserta\ntidak hanya TTD saja)\n Template, Formulir Hak Cipta, Buku Panduan Tata Cara Unggah, dan Form Telaah\n5.\nArtikel dapat diunduh pada link:\nhttps://ejurnal.its.ac.id/index.php/teknik (Jurnal Teknik ITS)\nhttps://ejurnal.its.ac.id/index.php/sains_seni (Jurnal Sains&Seni ITS)\nSection yang bisa dipilih pada Jurnal Teknik ITS:']","Tesis adalah sebuah karya tulis ilmiah yang disusun oleh seorang mahasiswa sebagai syarat untuk memperoleh gelar sarjana atau magister. Tesis biasanya berisi penelitian yang mendalam tentang suatu topik tertentu dan harus disusun dengan metodologi yang benar serta didukung oleh data dan analisis yang valid. Tesis juga harus memiliki struktur yang terorganisir dengan baik, termasuk abstrak, pendahuluan, tinjauan pustaka, metodologi penelitian, hasil penelitian, pembahasan, dan kesimpulan."
1,Bagaimana Ketentuan Abstrak dalam penulisan Tesis,"Abstrak berjarak 2 spasi dari kata ABSTRAK, yang tertulis di tengah halaman, dengan ukuran font 14, dicetak tebal, dan menggunakan huruf kapital untuk semua huruf (upper case).","['Pemberitahuan\nUnggah Artikel POmITS\nUNGGAH artikel WAJIB dilakukan oleh MAHASISWA PENDAFTAR YUDISIUM 129\n Mahasiswa yang Dosen Pembimbingnya memilih untuk MEMpuBLIKAsIKAN\nartikelnya pada Jurnal POmITS, dapat melakukan UNGGAH, dengan mengikuti langkah\npada BUKU PANDUAN TATA CARA UNGGAH. File yang HARUS DIUNGGAH adalah\n(ukuran masing-masing file tidak boleh lebih dari 2 MB):\nArtikel hasil dari Tugas Akhir, dalam format Ms. Word yang telah mengikuti tem-\n1.\nplate. (selain format Ms.Word artikel DITOLAK/REJECTED)\nFormulir Hak Cipta, dalam format PDF.\nForm Telaah Artikel POmITs, dalam format PDF.\nForm Revisi/Perbaikan/Penyempurnaan TA yang berisi nama penguji beserta\ntidak hanya TTD saja)\n Template, Formulir Hak Cipta, Buku Panduan Tata Cara Unggah, dan Form Telaah\n5.\nArtikel dapat diunduh pada link:\nhttps://ejurnal.its.ac.id/index.php/teknik (Jurnal Teknik ITS)\nhttps://ejurnal.its.ac.id/index.php/sains_seni (Jurnal Sains&Seni ITS)\nSection yang bisa dipilih pada Jurnal Teknik ITS:', 'Lampiran 11.A\nContoh abstrak tesis dalam Bahasa Indonesia\nKINERJA KOMPOS PRODUKSI UDPK BRATANG\nSEBAGAI MEDIA PENUKAR ION UNTUK MEREDUKSI LOGAM BERAT Cu DALAM AIR LIMBAH BUATAN\nNama mahasiswa\nNRP\nPembimbing\nABSTRAK\nKurangnya motivasi dalam kegiatan pengomposan salah\nsatunya adalah karena rendahnya nilai jual dan sempitnya pasar untuk produksi kompos. Pemanfaatan kompos sebagai media penukar 10n dharapkan dapat meningkatkan nila jual kompos sekaligus untuk memberikan alternatif pengolahan logam berat, khususnya Cu, yang murah. Kemampuan kompos untuk menukar ion berasal dari kandungan materi humus pada kompos yang mempunyai kapasitas tukar kation (KTK). Grup fungsi yang\nberperan\nadalah grup karboksil (-COOH) sehingga\nbisa\ndikategorikan sebagai resin asam lemah. Penelitian ini bertujuan untuk mengkaji kinerja kompos produksi UDPK Bratang sebagai media penukar ion untuk mereduksi Cu dalam air limbah buatan.\nKTK teoritis diukur dengan metode titrasi pH dan', 'Lampiran 10.C\nContoh Berita Acara Ujian Akhir Tesis\nDEPARTEMEN PENDIDIKAN NASIONAL\nINSTITUT TEKNOLOGI SEPULUH NOPEMBER SURABAYA\nPROGRAM PASCASARJANA\nBERITA ACARA\nUJIAN TESIS\nPada\nHari, Tanggal Jam\nTempat\ntelah dilaksanakan Ujian Tesis\nJudul\nOleh Nrp.\nProgram Studi\nBidang Keahlian\n:.....\n:...\ndengan hasil\n1. disetujui\n2. disetujui dengan perbaikan / penyempurnaan\n3. tidak disetujui atau mengulang\nPerbaikan / penyempurnaan yang harus dilakukan adalah : (kalau diperlukan dapat ditulis di lembar terpisah)\nPenguji :\nKetua Sidang\n1..\n2.\nMengetahui,\nKetua Program Studi,\n3.\n4......\n5. Dst\n57\n\nCatatan : dibuat rangkap 4\n1. Direktur PPs - ITS\n2. Ketua Program Studi\n3. Dosen (-dosen) Pembimbing\n4. Mahasiswa yang bersangkutan', 'ーー\nLampiran 8A\nA. Contoh sampul / cover dalam tesis mono disiplin\ne20 mm\n40 mm\n35 mm\nWarna Dibagian Atas Garis Biru ITS : Putih\n0.6 dari tinggi kertas\n• 15 mm\nWarna Biru ITS\nWarna Dibawah Garis Biru ITS :\nSesuai Warna Fakultas\nTesis - No. Kode Tesis\nJudul Tesis\nTrebuchet MS (Bold), 17 puchet Ms (Bold),\n18 point\n0.4 dari tinggi kertas\n40 mm\nNAMA MAHASISWA NRP MAHASISWA\nDOSEN PEMBIMBING\nProf. Ir. Wahyu Susilo, M.Sc., Ph.D.\nDr. Ir. Indah Wahyuni, M.Sc.\nPROGRAM MAGISTER BIDANG KEAHLIAN ...\n00.......\nPROGRAM STUDI..............\nDEPARTEMEN ..\nFAKULTAS ..\nINSTITUT TEKNOLOGI SEPULUH NOPEMBER\nSURABAYA\n>20..\n--1\n130 mm\nV\n- Trebuchet MS,\n12 point\n51']","Abstrak dalam penulisan tesis harus mencakup ringkasan dari isi tesis yang meliputi latar belakang masalah, tujuan penelitian, metode penelitian, hasil penelitian, dan kesimpulan. Abstrak juga harus ditulis dalam bahasa yang jelas, singkat, padat, dan informatif. Abstrak biasanya terdiri dari satu paragraf dengan panjang maksimal 250 kata."
2,Apa saja tata tertib pelaksanaan sidang proposal Tesis?,"1. Peserta sidang proposal tesis menyiapkan perangkat laptop yang memadai dan jaringan internet yang stabil serta berada di tempat yang kondusif.
2. Peserta sidang proposal tesis menyiapkan aplikasi Zoom dengan fitur kamera dan audio yang dapat berfungsi dengan baik.
3. Peserta sidang proposal tesis menyiapkan file presentasi berupa PPT dan draft proposal tesis.
4. Waktu sidang proposal tesis berlangsung selama 60 menit, 15 menit presentasi dan 45 menit tanya jawab.
5. Peserta sidang proposal tesis disarankan untuk standby 30 menit sebelum jadwal yang ditentukan dan dapat bergabung pada link zoom meeting sesuai jadwal yang telah ditentukan atau sesuai instruksi dari dosen pembimbing/ penguji.
6. Peserta sidang proposal tesis memakai dresscode berupa kemeja lengan panjang dan berdasi (laki-laki) dan memakai kemeja dengan blazer tanpa berdasi (perempuan).
7. Selama sidang proposal tesis, peserta sidang proposal tesis wajib menggunakan virtual background yang dapat diunduh melalui https://bit.ly/VBProposalTesis dan kamera diharapkan selalu menyala (ON).
8. Selama sesi diskusi dan tanya jawab, peserta sidang proposal tesis diharapkan dapat mencatat masukan dan koreksi dari dosen penguji.
9. Link Zoom meeting sidang proposal tesis akan diinfokan H-1 melalui grup Whatsapp.","['telah menyelesaikan revisi\nsidang proposal tesis dan\nmenginfokan ke Kaprodi\nMeng-update status sidang\nproposal tesis di MonT esMeng-upload lembar revisi sidang\nproposal tesis dan buku proposal\ntesis yang dilengkapi dengan\nlembar pengesahan yang sudah\ntertandatanganiLembar revisi dan\nlembar pengesahan yang\ntelah tertandatanganiData peserta sidang\nproposal tesis\nLembar revisi sidang\nproposal tesis  Usulan jadwal dan\npenguji sidang\nproposal tesis  \nLembar revisi dan\nlembar pengesahanSIDANG PROPOSAL TESIS (IF -185301) PROGRAM STUDI S2 TEKNIK \nINFORMATIKA, DEPARTEMEN TEKNIK INFORMATIKA, FT -EIC ITS  \n(SISTEM ONLINE ) \n \n1. Dalam satu semester, terdapat dua kali siding proposal tesis, yaitu minggu ke -5 – minggu \nke-6 dan minggu ke -17 – minggu  ke-18. \n2. Admin Akademik Pascasarjana  menginfokan jadwal, persyaratan, dan link Google Form \npendaftaran sidang proposal tesis melalui MonTes dan grup whatsapp.  \n3. Mahasiswa yang ingin mendaftar sidang proposal tesis, harus melengkapi berkas', '10. Mahasiswa melaksanakan sidang proposal tesis. Sedangkan, dosen pembimbing dan \npenguji memberikan feedback ke mahasiswa, mengisi berita acara , memberikan penilaian \ndan catatan revisi  sidang proposal tesis.  \n11. Setelah mahasiswa melaksanakan sidang proposal tesis, Admin Akademik Pascasarjana  \nmeng -update status sidang proposal tesis di MonTes dari ‘Terjadwal Ujian’ menjadi \n‘Revisi ’. \n12. Mahasiswa mengerjakan revisi dan menyusun buku proposal tesis sesuai dengan hasil \ndiskusi ketika sidang proposal tesis dan/atau sesuai catatan dalam lembar revisi. Apabila \nsudah selesai mengerjakan revisi, mahasiswa dapat memberikan hasil revisinya ke dosen \npembimbing dan penguji serta mengajukan lembar revisi dan lembar pengesahan buku \nproposal tesis untuk meminta persetujuan ke dosen pembimbing dan penguji. Batas \npengerjaan revi si adalah 2 minggu setelah sidang proposal tesis berlangsung.  \n13. Apabila revisi yang dikerjakan mahasiswa dirasa sudah tepat, dosen pembimbing dan', 'hasil revisiDokumen hasil\nrevisi sidang\nproposal tesis  \nApakah revisi\nsudah sesuai?Dokumen hasil\nrevisi sidang\nproposal tesis  Ketua RMK menentukan penguji\ndan menjadwalkan sidang\nproposal tesis setiap pesertaSOP PENDAFT ARAN SIDANG PROPOSAL TESIS PROGRAM STUDI S2 TEKNIK INFORMA TIKA (SISTEM ONLINE ), FT -EIC, ITS  \nYaDraft proposal tesis\ndan form persetujuan\npembimbing\nPemeriksa,\n \n \n \n \n \nLina Ambarwati, S.Kom.  \nNIP. 198003242014092001  Mengetahui,\nDr. Ahmad Saikhu, S.Si., M.T . \nNIP. 197107182006041001Pembuat,\n \n \n \n \n \nKartika Dwi Y uniavita Rahmawati, S.T .\nNPP. 1998202122056  \nJadwal sidang, link\nmeeting, dan VB\nTidak\nMenginfokan link google form\nuntuk meng-upload  seluruh\ndokumen hasil revisi sidang\nproposal tesis ke mahasiswa\nStatus sidang\nproposal tesis\nmenjadi ""Disetujui""Merekap data mahasiswa yang\ntelah menyelesaikan revisi\nsidang proposal tesis dan\nmenginfokan ke Kaprodi\nMeng-update status sidang\nproposal tesis di MonT esMeng-upload lembar revisi sidang', 'TATA TERTIB PELAKSANAAN SIDANG PROPOSAL TESIS\n\nPROGRAM STUDI S2 TEKNIK INFORMATIKA\n\nDEPARTEMEN TEKNIK INFORMATIKA – FAKULTAS TEKNOLOGI ELEKTRO & INFORMATIKA CERDAS, ITS\n\n1. Peserta sidang proposal tesis menyiapkan perangkat laptop yang memadai dan jaringan internet yang stabil serta berada di tempat yang kondusif.\n\n2. Peserta sidang proposal tesis menyiapkan aplikasi Zoom dengan fitur kamera dan audio yang dapat berfungsi dengan baik.\n\n3. Peserta sidang proposal tesis menyiapkan file presentasi berupa PPT dan draft proposal tesis.\n\n4. Waktu sidang proposal tesis berlangsung selama 60 menit, 15 menit presentasi dan 45 menit tanya jawab.\n\n5. Peserta sidang proposal tesis disarankan untuk standby 30 menit sebelum jadwal yang ditentukan dan dapat bergabung pada link zoom meeting sesuai jadwal yang telah ditentukan atau sesuai instruksi dari dosen pembimbing/ penguji.']","Tata tertib pelaksanaan sidang proposal Tesis meliputi:
1. Peserta sidang proposal tesis harus menyiapkan perangkat laptop yang memadai dan jaringan internet yang stabil serta berada di tempat yang kondusif.
2. Peserta sidang proposal tesis harus menyiapkan aplikasi Zoom dengan fitur kamera dan audio yang dapat berfungsi dengan baik.
3. Peserta sidang proposal tesis harus menyiapkan file presentasi berupa PPT dan draft proposal tesis.
4. Waktu sidang proposal tesis berlangsung selama 60 menit, terdiri dari 15 menit presentasi dan 45 menit tanya jawab.
5. Peserta sidang proposal tesis disarankan untuk standby 30 menit sebelum jadwal yang ditentukan dan dapat bergabung pada link zoom meeting sesuai jadwal yang telah ditentukan atau sesuai instruksi dari dosen pembimbing/penguji."
3,Kapan Wisuda 129 dilaksanakan?,Wisuda 129 Periode April 2024 yang akan dilaksanakan secara offline pada tanggal 20-21 April 2024,"['Nomor\nLampiran\nPerihal\nDharma Wanita Persatuan\nInstitut Teknologi Sepuluh Nopember\nProvinsi Jawa Timur\nKAMPUS ITS - KEPUTIH - SUKOLILO - SURABAYA TELP. (031) 5912379\n: B 362/Sekre/DWP-ITS/ll/2024.\nSurabaya, 26 Februari 2024\n: -\n: Informasi Peminjaman Toga.\nKepada Yth : Wisudawan ITS\nWisuda ITS ke-129\nDi tempat.\nSelamat dan sukses kepada seluruh Wisudawan, Wisuda ITS ke-129, semoga ilmu yang didapat bermanfaat.\nWisuda ITS ke-129 akan dilaksanakan tanggal 20 dan 21 April 2024, para wisudawan mengenakan Toga seperti pelaksanaan Wisuda sebelumnya.\nSYARAT, KETENTUAN DAN TEKNIS PEMINJAMAN TOGA sbb :\nI. BIAYA TOGA :\n1. Wisudawan S1 dan S1 TERAPAN :\nMembayar Biaya Jaminan Toga Rp. 300.000,- (Tiga Ratus Ribu Rupiah)\n2. Wisudawan ASING dan Wisudawan Non UKT S2 & S3 :\nMembayar biaya Sewa dan Jaminan Toga Rp. 550.000,- (Lima ratus lima puluh ribu rupiah)\nPerincian sebagai berikut :\nBiaya Jaminan Toga: Rp. 300.000,- (tiga ratus ribu rupiah).\nBiaya Sewa Toga', '- Pemesanan Foto Prosesi (tidak wajib)\n- Undangan Wisuda untuk orang tua:\nUndangan untuk orang tua/pendamping wisudawan diambil bersamaan dengan\npengambilan toga\n2. Jadwal pengambilan toga, gordon, undangan dan pemesanan foto prosesi sebagai berikut:\nHari\n:Rabu & Kamis\nTanggal : 17 & 18 April 2024\nPukul\n: 08.00-12.00 WIB\nPembagian jadwal pengambilan berdasarkan Fakultas akan disampaikan menyusul oleh\nDharma Wanita Persatuan ITS.\nAtas perhatian dan kerjasama yang diberikan kami sampaikan terima kasih.\nT. 1964405 5902an, M.T.\nMEMENTERIAN AS\nINSTITUT\nTembusan:\n- Rektor ITS\n- Para Wakil Rektor\n- Sekretaris Institut\n- Kepala Biro Sarana dan Prasarana\n- Kepala Biro Keuangan\n- Ketua Darma Wanita Persatuan ITS\n- Kabag. Admisitrasi Umum dan Kearsipan Digital', '""Dini Adni Navastara, S.Kom., M.Sc."",DA,KCV,dini_navastara@if.its.ac.id,19851017 201504 2 001,,\n""Wijayanti Nurul Khotimah, S.Kom., M.Sc."",WN,GIGa,wijayanti@if.its.ac.id,19860312 201212 2 004,,\n""Nurul Fajrin Ariyani, S.Kom., M.Sc."",NF,MCI,nurulfajrin@if.its.ac.id,19860722 201504 2 003,,\n""Abdul Munif, S.Kom., M.Sc.Eng."",MN,MCI,munif@if.its.ac.id,19860823 201504 1 004,,\n""Bagus Jati Santoso, S.Kom., Ph.D."",BJ,KBJ,bagus@if.its.ac.id,19861125 201803 1 001,,\n""Rizky Januar Akbar, S.Kom., M.Eng."",RJ,RPL,rizky@if.its.ac.id,19870103 201404 1 001,,\n""Dr. Baskoro Adi Pratomo., S.Kom., M.Kom."",BS,AJK,baskoro@if.its.ac.id,19870218 201404 1 001,,\n""Hudan Studiawan, S.Kom., M.Kom., Ph.D."",HS,KBJ,hudan@if.its.ac.id,19870511 201212 1 003,,\n""Hadziq Fabroyir, S.Kom., Ph.D."",HF,GIGa,hadziq@its.ac.id,19860227 201903 1 006,,\n""Shintami Chusnul Hidayati, S.Kom., M.Sc., Ph.D."",SC,MCI,shintami@its.ac.id,1987 202012 004,,\n""Agus Budi Raharjo, S.Kom., M.Kom., Ph.D."",AB,AP,agus.budi@its.ac.id,1990 202011 022,,', 'Jadwal pelaksanaan wisuda sebagai berikut :\nNO\nFAKULTAS\nFT-IRS, FT-SPK, SIMT, F-VOKASI\nFSAD, FTK, FT-EIC, F-DKBD\nJADWAL\nSabtu, 20 April 2024\nMinggu, 21 April 2024\nPukul\nTempat\n: 06.30 WIB - selesa1\n: Graha Sepuluh Nopember, Kampus ITS Sukolilo - Surabaya\nB. PEMBEKALAN WISUDA :\nHari/tanggal\n: Kamis, 18 April 2024\nPukul\n: 08.00 WIB\nTempat\n: Gedung Graha Sepuluh Nopember (Offline)\nC. PEMBAYARAN BIAYA WISUDA DAN TOGA:\n1. Biaya wisuda sebesar Rp. 1.000.000,- (Satu juta rupiah) khusus program Magister dan Doktor, dibayarkan dengan sistem host to host, melalui bank Mandiri, BRI, BNI, dan BSI mulai tanggal 4 s.d 15 Maret 2024, dengan cara menyebutkan angka 93 dilanjutkan dengan NRP. Sedangkan biaya sewa dan peminjaman toga mengikuti ketentuan Dharma Wanita Persatuan ITS.\n2. Mahasiswa Program Sarjana dan Sarjana Terapan tidak dikenakan biaya Wisuda, hanya dikenakan uang jaminan toga (akan dikembalikan setelah toga kembali).']",Wisuda ITS ke-129 akan dilaksanakan pada tanggal 20 dan 21 April 2024.
4,Berapa biaya peminjaman toga?,"Wisudawan S1 dan S1 TERAPAN : Membayar Biaya Jaminan Toga Rp. 300.000,- (Tiga Ratus Ribu Rupiah). Wisudawan ASING dan Wisudawan Non UKT S2 & S3 Membayar biaya Sewa dan Jaminan Toga Rp. 550.000,- (Lima ratus lima puluh ribu rupiah)","['Membayar biaya Sewa dan Jaminan Toga Rp. 550.000,- (Lima ratus lima puluh ribu rupiah)\nPerincian sebagai berikut :\nBiaya Jaminan Toga: Rp. 300.000,- (tiga ratus ribu rupiah).\nBiaya Sewa Toga\nRp. 250.000,- (dua ratus lima puluh ribu rupiah).\n3. Cara Transfer Pembayaran sewa Toga Dan Uang Jaminan.\nSaat mentransfer, angka ribuan diganti 3 digit angka terakhir NRP.\nContoh: NRP 0111156001259\n> Nilai yang di transfer wisudawan S1 dan S1 TERAPAN Rp. 300.259,-\n> Nilai yang di transfer wisudawan ASING dan Wisudawan Non UKT S2, S3 Rp. 550.259,-\n4. Pembayaran Toga ke: BNI No. Rek. 8586878897\nAtas Nama\nDHARMA WANITA PERSATUAN ITS.\nPeriode pembayaran\n: 27 Februari 2024 - 15 Maret 2024.', '*Sebagai syarat kelengkapan pengembalian Toga anda bisa cetak QR di\nLACAK.\n8. Pengembalian Toga tanggal 22 April 2024.\n(Syarat, Ketentuan dan Teknis Pengembalian Toga akan di informasikan kemudian).\nBiaya Jaminan Toga sebesar Rp. 300.000,- (tiga ratus ribu rupiah) akan ditransfer oleh DWP ITS lewat BNI ke Rekening wisudawan setelah DWP - ITS MENERIMA PENGEMBALIAN TOGA\n*CP BNI perihal pengembalian uang jaminan: Ibu Inna Nurdianti, 0819 3812 5893.\nII. MENGISI DATA ONLINE di : wisuda.dwpits.id\n1. Pengisian Data Online dimulai 27 Februari 2024 - 15 Maret 2024.\nPukul: 23.00 WIB.\n2. Tidak menerima pendaftaran dan peminjaman toga setelah data online ditutup.\n3. Mengisi Form Peminjaman Toga secara lengkap.\n(Nama, NRP, Departemen, Fakultas, Strata, No. Telp / WA Wisudawan,\nUkuran Toga yang dipilih dan disertai bukti Pembayaran Toga ke Rekening\nDWP ITS).', '2. Mahasiswa Program Sarjana dan Sarjana Terapan tidak dikenakan biaya Wisuda, hanya dikenakan uang jaminan toga (akan dikembalikan setelah toga kembali).\n3. Biaya sewa dan peminjaman toga mengacu pada surat yang dikeluarkan oleh Dharma Wanita Persatuan ITS Nomor B 362/Sekre/DPW-ITS/II/2024 tanggal 26 Februari 2024\ndan pada laman https://wisuda.dwpits.id', 'Pembayaran melalui :\n• Teller Bank\n> Mobile Banking.\n> Internet Banking\n• ATM (Tidak disarankan karena tidak bisa memasukkan identitas NRP\ndan Departemen).\n5. Bukti / Slip Transfer yang melalui ATM DITULIS BOLLPOINT nama, NRP, dan Departemen.\n6. Bukti pembayaran upload di form Peminjaman Toga di wisuda.dwpits.id\n7. Paket Toga yang diterima berupa: Toga (Jubah hitam), Kaba (Kain biru di dada ada list warna identitas Fakultas), Topi, Gordon (Kalung medali) dan Undangan.\nDiambil di kantor Dharma Wanita Persatuan ITS, JI. Teknik Sipil No.5, Kampus ITS, Keputih, Sukolilo. Surabaya.\nJadwal Pengambilan Toga :\nHari\n: Rabu & Kamis\nTanggal\n: 17 & 18 April 2024\nPukul\n: 08.00 - 12.00 WIB\n*Pembagian jadwal Pengambilan Toga berdasarkan Fakultas akan disampaikan menyusul.\n*Sebagai syarat kelengkapan pengembalian Toga anda bisa cetak QR di\nLACAK.\n8. Pengembalian Toga tanggal 22 April 2024.\n(Syarat, Ketentuan dan Teknis Pengembalian Toga akan di informasikan kemudian).']","Biaya peminjaman toga adalah Rp. 250.000,- (dua ratus lima puluh ribu rupiah)."
5,Dimana alamat Departemen Teknik Industri? ,Tidak tahu,"['Dosen & Tendik di Departemen Teknik Informatika 👥\nNama Dosen/Tendik,Kode Dosen,RMK,Email,NIP/NPP,Role Tendik,PIC Laboratorium\n""Prof. Ir. Supeno Djanali, M.Sc., Ph.D."",SD,AJK,supeno@its.ac.id,8859390019,,\n""Prof. Ir. Handayani Tjandrasa, M.Sc., Ph.D."",HT,KCV,handatj@its.ac.id,8866323419,,\n""Prof. Drs.Ec. Ir. Riyanarto Sarno, M.Sc., Ph.D."",RS,MCI,riyanarto@if.its.ac.id,19590803 198601 1 001,,\n""Prof. Dr. Ir. Joko Lianto Buliali, M.Sc."",JL,PKT,joko@if.its.ac.id,19670727 199203 1 002,,\n""Ir. Siti Rochimah, M.T., Ph.D."",ST,RPL,siti@if.its.ac.id,19681002 199403 2 001,,\n""Victor Hariadi, S.Si., M.Kom."",VH,PKT,victor@if.its.ac.id,19691228 199412 1 001,,\n""Rully Soelaiman, S.Kom., M.Kom."",RL,AP,rully@if.its.ac.id,19700213 199402 1 001,,\n""Dr. Yudhi Purwananto, S.Kom., M.Kom."",YP,AP,yudhi@if.its.ac.id,19700714 199703 1 002,,\n""Prof. Dr.Eng. Nanik Suciati, S.Kom., M.Kom."",NS,KCV,nanik@if.its.ac.id,19710428 199412 2 001,,', 'Direktorat Pascasarjana dan Pengembangan Akademik\nInstitut Teknologi Sepuluh Nopember\n2021\nDirektorai\nPascasarjana\ndan Pengembangan\nAkademik ITS', 'Tembusan Yth :\n1. Rektor ITS\n2. Kepala Bagian Administrasi Umum dan Kearsipan Digital 3. Sekretaris Institut\nSurabaya, 09 Januari 2024\nWakil Rektor Bidang Akademik dan Kemahasiswaan,\nProf. Dr. Ir. Adi Soeprijanto M.T.\n196404051990021001', ""https://ejurnal.its.ac.id/index.php/teknik (Jurnal Teknik ITS)\nhttps://ejurnal.its.ac.id/index.php/sains_seni (Jurnal Sains&Seni ITS)\nSection yang bisa dipilih pada Jurnal Teknik ITS:\nTeknologi Informasi dan Komunikasi (TIK); Energi (ERG); Pemukiman dan Bencana\n(PdB); Bangunan Berorientasi Lingkungan (BBL); Transportasi (TRP); Teknologi.\nProses (TP); Kelautan (KLT).\nSection yang bisa dipilih pada Jurnal Sains & Seni ITS:\nMatematika dan Terapannya (MAT); Fisika dan Terapannya (FIS); Kimia dan Tera.\npannya (KIm); Statistika dan Terapannya (STA); Biologi dan Terapannya (BIO);\nProduk Desain (PD); Arsitektur (ARS); Desain dan Seni (DDS); Bisnis Dan Studi\nPembangunan (BSP).\nMahasiswa yang Dosen Pembimbingnya memilih untuk TIDAK MEMPUBLIKASIKAN\nartikelnya pada Jurnal pomits (Jurnal Teknik dan Jurnal Sains & Seni), dapat\nmelakukan UNGGAH di Jurnal Repository, menggunakan login 'mahasiswa', dengan.\nkata sandi 'M4h4sisw4lTs!' ke alamat 'https://ejurnal.its.ac.id/index.php/index/login'""]",Saya tidak tahu.
6,Apa Url untuk mengunggah Repository Jurnal Pomits?,https://ejurnal.its.ac.id/index.php/index/login,"[""melakukan UNGGAH di Jurnal Repository, menggunakan login 'mahasiswa', dengan.\nkata sandi 'M4h4sisw4lTs!' ke alamat 'https://ejurnal.its.ac.id/index.php/index/login'\ndengan mengunggah file artikel dan file Form Telaah(dalam format pdf) saja.\nPengecekan file vang TERuNGGAH dapat dilihat di\nhttps://lpmp2ki.its.ac.id/pomits.\nJika terdapat penghapusan/penarikan artikel, dapat mengisi form pada link :\nhttps://its.id/FHAJTeknikITSPOMITS, untuk Jurnal Teknik ITS;\n1.-\nhttps:/l/its.id/FHAJSainsSenilTSPOMITS, untuk Jurnal Sains &Seni ITS;\n3.https://its.id/FHAJRepositorylTSPOMITS, untuk Jurnal Repository..\n Penghapusan Artikel akan dilakukan setelah yudisium berakhir.\nArtikel - artikel yang TIDAK MEMENUHI KETENTUAN PUBLIKASI (gaya selingkung\ntidak sesuai format dan file pendukung tidak lengkap) tidak akan DIPUBLIKASIKAN\ndi Jurnal Teknik ITS dan Jurnal Sains & Seni ITS.\nPeriode unggah artikel untuk yudisium 29 adalah sampai dengan \n15 Februari 2024 pukul 24.00 WIB"", 'File jurnal yang telah terbit atau prosiding International Conference [Apabila belum terbit, silakan unggah file jurnal nya]\nBukti telah melakukan publikasi ilmiah (LoA jurnal atau sertifikat&dokumentasi mengikuti International Conference)\nForm bebas tanggungan dosen pembimbing [yang telah ter-TTD]\nForm bebas tanggungan RBTC [yang telah ter-TTD] dan form bebas tanggungan perpustakaan ITS [Menyerahkan 1 hardfile tesis dengan membawa form bebas RBTC untuk meminta TTD ke Mbak Kartika dan menyerahkan 1 hardfile tesis ke Perpustakaan ITS. Apabila mencetak tesis di myitsprinting, dapat mengunggah bukti pembayaran]\nForm bebas tanggungan laboratorium [Silakan menemui Pak Kunto di Laboratorium Pascasarjana Lantai 1 atau menghubungi ke 08121628141 untuk meminta TTD]\nScreenshoot telah mengisi form Tracer Study [https://its.id/TracerStudyLulusanS2IF]\nScreenshoot telah mengisi form Kepuasan Layanan Akademik [https://its.id/KepuasanLayananAkademikS2IF]', 'Pemberitahuan\nUnggah Artikel POmITS\nUNGGAH artikel WAJIB dilakukan oleh MAHASISWA PENDAFTAR YUDISIUM 129\n Mahasiswa yang Dosen Pembimbingnya memilih untuk MEMpuBLIKAsIKAN\nartikelnya pada Jurnal POmITS, dapat melakukan UNGGAH, dengan mengikuti langkah\npada BUKU PANDUAN TATA CARA UNGGAH. File yang HARUS DIUNGGAH adalah\n(ukuran masing-masing file tidak boleh lebih dari 2 MB):\nArtikel hasil dari Tugas Akhir, dalam format Ms. Word yang telah mengikuti tem-\n1.\nplate. (selain format Ms.Word artikel DITOLAK/REJECTED)\nFormulir Hak Cipta, dalam format PDF.\nForm Telaah Artikel POmITs, dalam format PDF.\nForm Revisi/Perbaikan/Penyempurnaan TA yang berisi nama penguji beserta\ntidak hanya TTD saja)\n Template, Formulir Hak Cipta, Buku Panduan Tata Cara Unggah, dan Form Telaah\n5.\nArtikel dapat diunduh pada link:\nhttps://ejurnal.its.ac.id/index.php/teknik (Jurnal Teknik ITS)\nhttps://ejurnal.its.ac.id/index.php/sains_seni (Jurnal Sains&Seni ITS)\nSection yang bisa dipilih pada Jurnal Teknik ITS:', 'LAYANAN ADAPTASI KEBIASAAN BARU\n6. Kebutuhan Surat Lainnya\n- Surat Keterangan Alumni "" Surat Permohonan Statement Letter /\n"" Surat Rekomendasi Dekan/Rektor Certihcation Letter\n"" Surat Keterangan Pengganti Ijazah "" Surat Keterangan Berkelakuan Baik\n"" Verification of Academic Recoras "" Surat Keterangan Pengembalian ke Instansi Asal\nKirim dan sertakan dokumen pada Email: pitaits.ac.id\n7. Spesimen Tanda Tangan Pejabat\nIntip informasi pada tautan: www.its.ac.id/burb/id/spesimen-tandatangan\n8. Rekrutmen Dosen dan Tendik\nInformasi dapat diakses pada tautan: rekrutmen.its.ac.Id\n9. Layanan LHKPN\nLayanan dapat diakses pada tautan: elhkpn.kpk.go.id\n10. Layanan LHKASN\nLayanan dapat diakses pada tautan: siharka.menpan.go.id\n11. Surat Keterangan Tidak Sedang Menerima Beasiswa\nKirim permintaan pada platform MyiTS SSO di fitur: MyITS Student Connect\n12. Layanan Reset Password Sister\nKirim permintaan pada tautan: Servicesdesk.its.ac.id\n13. Layanan Aktivasi Gate']",URL untuk mengunggah Repository Jurnal Pomits adalah https://its.id/FHAJRepositorylTSPOMITS.
7,Berapa sks mata kuliah pengayaan yang bisa diambil?,Di peraturan akademik mengambil MK pengayaan maksimal 6 sks dan minimum 3 sks.,"['Q: Berapa sks mata kuliah pengayaan yang bisa diambil?\n\nA: Di peraturan akademik mengambil MK pengayaan maksimal 6 sks dan minimum 3 sks.\n\nQ: Apakah mata kuliah pengayaan bisa di-drop?\n\nA: Seperti halnya MK yang lain, jika masih dalam masa drop tiap semester, maka boleh (sampai dengan minggu 10). Setelah waktu itu tidak bisa, namun bisa digantikan dengan MK pengayaan lain yang diambil di semester berikutnya.\n\nQ: Kepada siapa saya meminta konsultasi tentang perwalian/perencanaan kuliah, merubah MK yang diambil dan drop MK setelah minggu ke 4?\n\nA: Ke DOSEN WALI, bukan ke PEMBIMBING TA. Batas akhir perubahan MK adalah minggu ke 3 dan drop MK adalah minggu ke 10\n\nQ: Bagaimana jika saya tidak bisa ambil MK di FRS padahal prasyarat sudah terpenuhi? \n\nA: Silakan menginformasikan ke doswal dengan menyertakan bukti2. Doswal akan membantu menambahkan MK yang dimaksud jika bukti2 telah mencukupi.\n\nQ: Apakah MK yang diambil via dropdown MBKM bisa menggantikan MK yang sudah diambil?', 'Lampiran 6B\nC. Contoh sampul / cover luar tesis multi disiplin\n20 mm\n40 mm\n35 mm\nWarna Dibagian Atas Garis Biru ITS : Putih\n$ 15 mm\n0.6 dari tinggi kertas\nWarna Biru ITS\nWarna Dibawah Garis Biru ITS :\nSesuai Warna Fakultas\nTesis - No. Kode Tesis\nJudul Tesis\nTrebuchet MS (Bold),\n12 point\nTrebuchet MS (Bold),\n18 point\n0.4 dari tinggi kertas\n40 mm\nNAMA MAHASISWA NRP MAHASISWA\nDOSEN PEMBIMBING\nProf. Ir. Wahyu Susilo, M.Sc., Ph.D.\nDr. Ir. Indah Wahyuni, M.Sc.\nPROGRAM MAGISTER\nBIDANG KEAHLIAN .................\nPROGRAM STUDI .....\n•..\nPROGRAM PASCASARJANA\nINSTITUT TEKNOLOGI SEPULUH NOPEMBER !\nSURABAYA\n720..\n: 30 mm\nV\nTrebuchet MS,\n12 point\n46', 'Lampiran 10.A\nContoh Form Evaluasi Ujian Akhir Tesis (Rekapitulasi)\nDEPARTEMEN PENDIDIKAN NASIONAL\nINSTITUT TEKNOLOGI SEPULUH NOPEMBER SURABAYA\nPROGRAM PASCASARJANA\nDAFTAR NILAI UJIAN TESIS\n:.............\nJudul Tesis\nOleh Nrp.\nBidang Keahlian\nProgram Studi\n: Pascasarjana\nFakultas / Jurusan\nTanda Tangan\nI. NILAI UJIAN (kisaran antara 40 - 60%)\n\nPenguji I\nPenguji II\nPenguji II\nPenguji IV\nPenguji V\nRata-rata\nMateri (80%)\n\n\n\n\n\n\nSikap /\nPresentasi (20%)\n\n\n\n\n\n\n\n\nNilai Total\n\n\n\n\nCatatan : Pembimbing juga bertindak sebagai penguji\nII. NILAI PEMBIMBING (kisaran antara 40 - 60%)\n\nDosen Pembimbing\nNilai\n\nPembimbing I\nPembimbing I\n\n54\n\nNilai rata-rata : .............(dalam angka)\n... (dalam huruf)\nSurabaya, .......................\nMengetahui :\nKetuaProgram Studi,\n55', 'Catatan : dibuat rangkap 4\n1. Direktur PPs - ITS\n2. Ketua Program Studi\n3. Dosen (-dosen) Pembimbing\n4. Mahasiswa yang bersangkutan\n\nLampiran 10.D\nContoh lembar pengesahan tesis\nTesis disusun untuk memenuhi salah satu syarat memperoleh gelar\nMagister Manajemen Teknologi (M.MT)\ndi\nInstitut Teknologi Sepuluh Nopember\noleh :\nNrp.-\nTanggal Ujian :\nPeriode Wisuda :\nDisetujui oleh:\n1. Nama Pembimbing\nNIP:\n2. Nama Pembimbing\nNIP:\n3. Nama Penguji\nNIP:\n4. Nama Penguji\nNIP:\n5. Nama Penguji\nNIP:\n(Pembimbing 1)\n(Pembimbing Il)\n(Penguji)\n(Penguji)\n(Penguji)\nDirektur Program Pascasarjana,\nNama Lengkap\nNIP.\n59']","Di peraturan akademik, Anda dapat mengambil maksimal 6 sks dan minimum 3 sks mata kuliah pengayaan."
8,"Jika saya membutuhkan surat tugas untuk mengisi SKEM, kemana saya meminta?",silakan kontak ke CP Dirmawa di 082233935593 atau mengacu ke pamflet yang ada di folder MBKM dari link akademik Sarjana,"['A:  silakan kontak ke CP Dirmawa di 082233935593 atau mengacu ke pamflet yang ada di folder MBKM dari link akademik Sarjana\n\nQ: Kapan saya mesti entry SKEM ke SI SKEM?\n\nA:  Setiap semester, dan akan menjadi IP SKEM. Untuk lulus, minimal IP SKEM adalah 2.0. \n\nQ: Dimana panduan mengisi SKEM? \n\nA:  Ada di File panduan SKEM pada link akademik departemen \n\nQ: Kemana harus bertanya tentang UKT? (kesulitan pembayaran, keringanan, keterlambatan pembayaran)\n\nA:  Kontak Biro Keuangan (Senin - Jumat 08:00 - 15:00)\n-      WA (Text only) 082136250808\n-      WA (Text only) 081393936651\n-      WA (Text only) 081393936652\n-      WA (Text only) 087777587330\n-      WA (Text only) 082141942985\n\nCatatan ✍🏻\n\nTentang Refund UKT dapat dicek pada menu terkait. Jika tetap tidak menemukan jawaban, Tanyakan pada admin.', 'LAYANAN ADAPTASI KEBIASAAN BARU\n\' 6. Kebutuhan Surat Lainnya\n| - Surat Keterangan Atumni ""Surat Permohonan Statement ette\n| "" Surat Rukomendasi Dekan, Rektor Cerhkfcalon Letter\n- - Surat Keterangan Pengganti Ijazah "" Surat keterangan Berkelakuar Bar\n| "" Venficaton of Academic Records. "" Surat Keterangan Pengembalian ke intansi Asai\nKirim dan sertakan dokumen pada Email pilints.ac.id\n|\n| .\n7. Spesimen Tanda Tangan Pejabat\nIntip informasi pada tautan: weru.its.ac.id/burb. id/ spesimen-tandatangan\n|\n| .\n8. Rekrutmen Dosen dan Tendik\n| Informasi dapat diakses pada tau:an: rekrut men.its.oc.id\n|\n| 9. Layanan LHKPN\n| Layanan dapat diakses pada tautan: elhikpn. hpk.go.id\n10. Layanan LHKASN\nIn Layanan dapat diakses pada tautan: siharka.menpan.go.id\nTI. Surat Keterangan Tidak Sedang Menerima Beasiswa\nKirim permintaan pada platform MyiTS SSO di fitur MyITS Student Commect\n12. Layanan Reset Password Sister\nKirim permintaan pada tautan: servicesdesh its.oc.id\n13. Layanan Aktivasi Gate', '6. Apabila memerlukan informasi lebih lanjut dapat menghubungi dirpendikcare@its.ac.id atau di\ncall centre pada hari dan jam kerja melalui no (WA Text Only) 085186819604, 085186819605.\nB. Bagi semua calon wisudawan (Sarjana dan Sarjana Terapan) wajib menghadap dosen wali untuk persetujuan SKEM, serta wajib melakukan pengajuan SKPI di studentconnect paling lambat tanggal 9 Februari 2024;\nC. Ijazah dicetak berdasarkan data preview yang dipermanen oleh calon wisudawan. Ijazah dicetak hanya sekali saja, bila ada kekeliruan pengisian data pada point 3 maka akan diterbitkan surat keterangan.\nD.Pelaksanaan wisuda akan dilaksanakan secara offline (Informasi mengenai gladi bersih disampaikan lebih lanjut.\n Atas perhatian dan kerjasama yang diberikan, kami sampaikan terima kasih.\n Powered by TCPDF (www.tcpdf.org)\nTembusan Yth :\n1. Rektor ITS\n2. Kepala Bagian Administrasi Umum dan Kearsipan Digital 3. Sekretaris Institut\nSurabaya, 09 Januari 2024\nWakil Rektor Bidang Akademik dan Kemahasiswaan,', 'LAYANAN ADAPTASI KEBIASAAN BARU\n6. Kebutuhan Surat Lainnya\n- Surat Keterangan Alumni "" Surat Permohonan Statement Letter /\n"" Surat Rekomendasi Dekan/Rektor Certihcation Letter\n"" Surat Keterangan Pengganti Ijazah "" Surat Keterangan Berkelakuan Baik\n"" Verification of Academic Recoras "" Surat Keterangan Pengembalian ke Instansi Asal\nKirim dan sertakan dokumen pada Email: pitaits.ac.id\n7. Spesimen Tanda Tangan Pejabat\nIntip informasi pada tautan: www.its.ac.id/burb/id/spesimen-tandatangan\n8. Rekrutmen Dosen dan Tendik\nInformasi dapat diakses pada tautan: rekrutmen.its.ac.Id\n9. Layanan LHKPN\nLayanan dapat diakses pada tautan: elhkpn.kpk.go.id\n10. Layanan LHKASN\nLayanan dapat diakses pada tautan: siharka.menpan.go.id\n11. Surat Keterangan Tidak Sedang Menerima Beasiswa\nKirim permintaan pada platform MyiTS SSO di fitur: MyITS Student Connect\n12. Layanan Reset Password Sister\nKirim permintaan pada tautan: Servicesdesk.its.ac.id\n13. Layanan Aktivasi Gate']",Anda dapat meminta surat tugas untuk mengisi SKEM dengan menghubungi CP Dirmawa di nomor 082233935593 atau merujuk pada pamflet yang ada di folder MBKM dari link akademik Sarjana.
9,Berapa ukuran maksimal untuk setiap file yang diunggah di Jurnal POmITS?,Ukuran masing-masing file tidak boleh lebih dari 2 MB.,"['UKURAN\nLINGKAR DADA (LD)\nPANJANG BAJU (PB)\nXS\n100 CM\n102 CM\nS\n104 CM\n108 CM\nM\n106 CM\n112 CM\nL\n108 CM\n116 CM\nXL\n124 CM\n120 CM\nXXL\n126 CM\n123 CM\nXXXL\n130 CM\n125 СМ\nXXXL\n138 CM\n129 CM\nIII. UKURAN TOGA sbb :\nPerhatikan dan ukur Size seperti panduan dibawah ini, karena ukuran Toga lebih besar dari baju sehari-hari.\nInformasi terkait Sewa Toga menghubungi :\n-Ibu Tri Arif > 0822 3459 5170.\n-Ibu Faimun > 0895 3262 90800.\n-Ibu Sutopo > 0821 4359 9392.\nDemikian pengumuman kami sampaikan, kami mengucapkan terimakasih.\nКАВА\nKetua\nLD\nITS\nTOGA\n(Ny. Rost Indarjani M. Ashari) *\nPB', 'Pemberitahuan\nUnggah Artikel POmITS\nUNGGAH artikel WAJIB dilakukan oleh MAHASISWA PENDAFTAR YUDISIUM 129\n Mahasiswa yang Dosen Pembimbingnya memilih untuk MEMpuBLIKAsIKAN\nartikelnya pada Jurnal POmITS, dapat melakukan UNGGAH, dengan mengikuti langkah\npada BUKU PANDUAN TATA CARA UNGGAH. File yang HARUS DIUNGGAH adalah\n(ukuran masing-masing file tidak boleh lebih dari 2 MB):\nArtikel hasil dari Tugas Akhir, dalam format Ms. Word yang telah mengikuti tem-\n1.\nplate. (selain format Ms.Word artikel DITOLAK/REJECTED)\nFormulir Hak Cipta, dalam format PDF.\nForm Telaah Artikel POmITs, dalam format PDF.\nForm Revisi/Perbaikan/Penyempurnaan TA yang berisi nama penguji beserta\ntidak hanya TTD saja)\n Template, Formulir Hak Cipta, Buku Panduan Tata Cara Unggah, dan Form Telaah\n5.\nArtikel dapat diunduh pada link:\nhttps://ejurnal.its.ac.id/index.php/teknik (Jurnal Teknik ITS)\nhttps://ejurnal.its.ac.id/index.php/sains_seni (Jurnal Sains&Seni ITS)\nSection yang bisa dipilih pada Jurnal Teknik ITS:', 'Konsentrasi awal Cu yang akan disishkan antara 2 mg / 1 sampai 10 mg / 1, yang digunakan dalam penelitian ini, tidak menunjukkan pengaruh signifikan terhadap efisiensi penyisihan. Pada percobaan kontinyu didapatkan kapasitas operasi kolom penukar ion sebesar 249,129 meq / 1, kesetimbangan dicapai pada perbandingan 2,9 mg Cu / g media kompos, dan model adsorbsi isotermis mengikuti persamaan Freundlich sebagai berikut:\n=X=0,029Ce 209\nKata kunci: Cu, kompos, kapasitas tukar kation, logam berat, media pernukaran ion\n61', 'KTK teoritis diukur dengan metode titrasi pH dan\nammonium replacement. Kompos dibagi menjadi tiga kategori berdasarkan ukuran partikelnya. Untuk mengetahui pengaruh pH dan konsentrasi awal Cu terhadap efisiensi penyisihan Cu dilakukan\npercobaan batch dengan variasi pH 2-10 serta konsentrasi Cu 2-10 mg / It. Percobaan dilanjutkan dengan percobaan kontinyu untuk mendapatkan kapasitas operasi kolom penukar ion, kondisi kesetimbangan (x / m), serta model adsorbsi isotermisnya.\nKompos dengan ukuran partikel ≤ 0,425 m (lolos ayakan\nno. 40) mempunyai KTK teoritis terbesar yaitu 1,6 meq / g, jika diukur dengan titrasi pH, dan 15,89 meq / 100g, jika diukur dengan ammonium replacement. pH optimum didapat sekitar 6 dan 10.\n60']",Ukuran maksimal untuk setiap file yang diunggah di Jurnal POmITS adalah tidak boleh lebih dari 2 MB.
10,Di lantai mana kuliah Agama Islam di Semester Regular diadakan?,"Kuliah Agama Islam di Semester Regular diadakan di Tower 1, Lt. 5.","['Catatan : dibuat rangkap 4\n1. Direktur PPs - ITS\n2. Ketua Program Studi\n3. Dosen (-dosen) Pembimbing\n4. Mahasiswa yang bersangkutan\n\nLampiran 10.D\nContoh lembar pengesahan tesis\nTesis disusun untuk memenuhi salah satu syarat memperoleh gelar\nMagister Manajemen Teknologi (M.MT)\ndi\nInstitut Teknologi Sepuluh Nopember\noleh :\nNrp.-\nTanggal Ujian :\nPeriode Wisuda :\nDisetujui oleh:\n1. Nama Pembimbing\nNIP:\n2. Nama Pembimbing\nNIP:\n3. Nama Penguji\nNIP:\n4. Nama Penguji\nNIP:\n5. Nama Penguji\nNIP:\n(Pembimbing 1)\n(Pembimbing Il)\n(Penguji)\n(Penguji)\n(Penguji)\nDirektur Program Pascasarjana,\nNama Lengkap\nNIP.\n59', '6. Peserta sidang proposal tesis memakai dresscode berupa kemeja lengan panjang dan berdasi (laki-laki) dan memakai kemeja dengan blazer tanpa berdasi (perempuan).\n\n7. Selama sidang proposal tesis, peserta sidang proposal tesis wajib menggunakan virtual background yang dapat diunduh melalui https://bit.ly/VBProposalTesis dan kamera diharapkan selalu menyala (ON).\n\n8. Selama sesi diskusi dan tanya jawab, peserta sidang proposal tesis diharapkan dapat mencatat masukan dan koreksi dari dosen penguji.\n\n9. Link Zoom meeting sidang proposal tesis akan diinfokan H-1 melalui grup Whatsapp.', 'Lampiran 7A\nContoh lembar penilaian dan daftar hadir seminar proposal\ntesis\nDEPARTEMEN PENDIDIKAN NASIONAL\nINSTITUT TEKNOLOGI SEPULUH NOPEMBER SURABAYA\nPROGRAM PASCASARJANA\nDAFTAR HADIR DAN NILAI SEMINAR PROPOSAL TESIS\n:........\nJudul Seminar\nOleh\nNrp.\nProgram Studi\nBidang Keahlian\nTanda Tangan\n:....\n:\nNo\nNama Dosen\nJabatan\nTanda Tangan\nNilai (dalam angka)\n\n\nKetua\nAnggota\nAnggota\nAnggota\n\n\nNilai rata-rata : .... (dalam angka)\n.... (dalam huruf)\nKetua Sidang,\nSurabaya,\nMengetahui :\nKetua Program Studi,\n47', '- Pemesanan Foto Prosesi (tidak wajib)\n- Undangan Wisuda untuk orang tua:\nUndangan untuk orang tua/pendamping wisudawan diambil bersamaan dengan\npengambilan toga\n2. Jadwal pengambilan toga, gordon, undangan dan pemesanan foto prosesi sebagai berikut:\nHari\n:Rabu & Kamis\nTanggal : 17 & 18 April 2024\nPukul\n: 08.00-12.00 WIB\nPembagian jadwal pengambilan berdasarkan Fakultas akan disampaikan menyusul oleh\nDharma Wanita Persatuan ITS.\nAtas perhatian dan kerjasama yang diberikan kami sampaikan terima kasih.\nT. 1964405 5902an, M.T.\nMEMENTERIAN AS\nINSTITUT\nTembusan:\n- Rektor ITS\n- Para Wakil Rektor\n- Sekretaris Institut\n- Kepala Biro Sarana dan Prasarana\n- Kepala Biro Keuangan\n- Ketua Darma Wanita Persatuan ITS\n- Kabag. Admisitrasi Umum dan Kearsipan Digital']",Saya tidak tahu.
11,Kapan waktu kuliah Fisika Mekanika di Semester Regular berlangsung?,"Kuliah Fisika Mekanika di Semester Regular berlangsung pada Senin dan Rabu, pukul 15.30-17.10.","['Jadwal pelaksanaan wisuda sebagai berikut :\nNO\nFAKULTAS\nFT-IRS, FT-SPK, SIMT, F-VOKASI\nFSAD, FTK, FT-EIC, F-DKBD\nJADWAL\nSabtu, 20 April 2024\nMinggu, 21 April 2024\nPukul\nTempat\n: 06.30 WIB - selesa1\n: Graha Sepuluh Nopember, Kampus ITS Sukolilo - Surabaya\nB. PEMBEKALAN WISUDA :\nHari/tanggal\n: Kamis, 18 April 2024\nPukul\n: 08.00 WIB\nTempat\n: Gedung Graha Sepuluh Nopember (Offline)\nC. PEMBAYARAN BIAYA WISUDA DAN TOGA:\n1. Biaya wisuda sebesar Rp. 1.000.000,- (Satu juta rupiah) khusus program Magister dan Doktor, dibayarkan dengan sistem host to host, melalui bank Mandiri, BRI, BNI, dan BSI mulai tanggal 4 s.d 15 Maret 2024, dengan cara menyebutkan angka 93 dilanjutkan dengan NRP. Sedangkan biaya sewa dan peminjaman toga mengikuti ketentuan Dharma Wanita Persatuan ITS.\n2. Mahasiswa Program Sarjana dan Sarjana Terapan tidak dikenakan biaya Wisuda, hanya dikenakan uang jaminan toga (akan dikembalikan setelah toga kembali).', 'Lampiran 10.C\nContoh Berita Acara Ujian Akhir Tesis\nDEPARTEMEN PENDIDIKAN NASIONAL\nINSTITUT TEKNOLOGI SEPULUH NOPEMBER SURABAYA\nPROGRAM PASCASARJANA\nBERITA ACARA\nUJIAN TESIS\nPada\nHari, Tanggal Jam\nTempat\ntelah dilaksanakan Ujian Tesis\nJudul\nOleh Nrp.\nProgram Studi\nBidang Keahlian\n:.....\n:...\ndengan hasil\n1. disetujui\n2. disetujui dengan perbaikan / penyempurnaan\n3. tidak disetujui atau mengulang\nPerbaikan / penyempurnaan yang harus dilakukan adalah : (kalau diperlukan dapat ditulis di lembar terpisah)\nPenguji :\nKetua Sidang\n1..\n2.\nMengetahui,\nKetua Program Studi,\n3.\n4......\n5. Dst\n57\n\nCatatan : dibuat rangkap 4\n1. Direktur PPs - ITS\n2. Ketua Program Studi\n3. Dosen (-dosen) Pembimbing\n4. Mahasiswa yang bersangkutan', '- Pemesanan Foto Prosesi (tidak wajib)\n- Undangan Wisuda untuk orang tua:\nUndangan untuk orang tua/pendamping wisudawan diambil bersamaan dengan\npengambilan toga\n2. Jadwal pengambilan toga, gordon, undangan dan pemesanan foto prosesi sebagai berikut:\nHari\n:Rabu & Kamis\nTanggal : 17 & 18 April 2024\nPukul\n: 08.00-12.00 WIB\nPembagian jadwal pengambilan berdasarkan Fakultas akan disampaikan menyusul oleh\nDharma Wanita Persatuan ITS.\nAtas perhatian dan kerjasama yang diberikan kami sampaikan terima kasih.\nT. 1964405 5902an, M.T.\nMEMENTERIAN AS\nINSTITUT\nTembusan:\n- Rektor ITS\n- Para Wakil Rektor\n- Sekretaris Institut\n- Kepala Biro Sarana dan Prasarana\n- Kepala Biro Keuangan\n- Ketua Darma Wanita Persatuan ITS\n- Kabag. Admisitrasi Umum dan Kearsipan Digital', 'Q: Berapa sks mata kuliah pengayaan yang bisa diambil?\n\nA: Di peraturan akademik mengambil MK pengayaan maksimal 6 sks dan minimum 3 sks.\n\nQ: Apakah mata kuliah pengayaan bisa di-drop?\n\nA: Seperti halnya MK yang lain, jika masih dalam masa drop tiap semester, maka boleh (sampai dengan minggu 10). Setelah waktu itu tidak bisa, namun bisa digantikan dengan MK pengayaan lain yang diambil di semester berikutnya.\n\nQ: Kepada siapa saya meminta konsultasi tentang perwalian/perencanaan kuliah, merubah MK yang diambil dan drop MK setelah minggu ke 4?\n\nA: Ke DOSEN WALI, bukan ke PEMBIMBING TA. Batas akhir perubahan MK adalah minggu ke 3 dan drop MK adalah minggu ke 10\n\nQ: Bagaimana jika saya tidak bisa ambil MK di FRS padahal prasyarat sudah terpenuhi? \n\nA: Silakan menginformasikan ke doswal dengan menyertakan bukti2. Doswal akan membantu menambahkan MK yang dimaksud jika bukti2 telah mencukupi.\n\nQ: Apakah MK yang diambil via dropdown MBKM bisa menggantikan MK yang sudah diambil?']",Saya tidak menemukan informasi mengenai jadwal kuliah Fisika Mekanika di Semester Regular dalam konteks yang diberikan.
12,Berapa jumlah SKS untuk mata kuliah Matematika di Semester IUP? ,Mata kuliah Matematika di Semester IUP memiliki 2 SKS.,"['Q: Berapa sks mata kuliah pengayaan yang bisa diambil?\n\nA: Di peraturan akademik mengambil MK pengayaan maksimal 6 sks dan minimum 3 sks.\n\nQ: Apakah mata kuliah pengayaan bisa di-drop?\n\nA: Seperti halnya MK yang lain, jika masih dalam masa drop tiap semester, maka boleh (sampai dengan minggu 10). Setelah waktu itu tidak bisa, namun bisa digantikan dengan MK pengayaan lain yang diambil di semester berikutnya.\n\nQ: Kepada siapa saya meminta konsultasi tentang perwalian/perencanaan kuliah, merubah MK yang diambil dan drop MK setelah minggu ke 4?\n\nA: Ke DOSEN WALI, bukan ke PEMBIMBING TA. Batas akhir perubahan MK adalah minggu ke 3 dan drop MK adalah minggu ke 10\n\nQ: Bagaimana jika saya tidak bisa ambil MK di FRS padahal prasyarat sudah terpenuhi? \n\nA: Silakan menginformasikan ke doswal dengan menyertakan bukti2. Doswal akan membantu menambahkan MK yang dimaksud jika bukti2 telah mencukupi.\n\nQ: Apakah MK yang diambil via dropdown MBKM bisa menggantikan MK yang sudah diambil?', 'KTK teoritis diukur dengan metode titrasi pH dan\nammonium replacement. Kompos dibagi menjadi tiga kategori berdasarkan ukuran partikelnya. Untuk mengetahui pengaruh pH dan konsentrasi awal Cu terhadap efisiensi penyisihan Cu dilakukan\npercobaan batch dengan variasi pH 2-10 serta konsentrasi Cu 2-10 mg / It. Percobaan dilanjutkan dengan percobaan kontinyu untuk mendapatkan kapasitas operasi kolom penukar ion, kondisi kesetimbangan (x / m), serta model adsorbsi isotermisnya.\nKompos dengan ukuran partikel ≤ 0,425 m (lolos ayakan\nno. 40) mempunyai KTK teoritis terbesar yaitu 1,6 meq / g, jika diukur dengan titrasi pH, dan 15,89 meq / 100g, jika diukur dengan ammonium replacement. pH optimum didapat sekitar 6 dan 10.\n60', 'Lampiran 10.A\nContoh Form Evaluasi Ujian Akhir Tesis (Rekapitulasi)\nDEPARTEMEN PENDIDIKAN NASIONAL\nINSTITUT TEKNOLOGI SEPULUH NOPEMBER SURABAYA\nPROGRAM PASCASARJANA\nDAFTAR NILAI UJIAN TESIS\n:.............\nJudul Tesis\nOleh Nrp.\nBidang Keahlian\nProgram Studi\n: Pascasarjana\nFakultas / Jurusan\nTanda Tangan\nI. NILAI UJIAN (kisaran antara 40 - 60%)\n\nPenguji I\nPenguji II\nPenguji II\nPenguji IV\nPenguji V\nRata-rata\nMateri (80%)\n\n\n\n\n\n\nSikap /\nPresentasi (20%)\n\n\n\n\n\n\n\n\nNilai Total\n\n\n\n\nCatatan : Pembimbing juga bertindak sebagai penguji\nII. NILAI PEMBIMBING (kisaran antara 40 - 60%)\n\nDosen Pembimbing\nNilai\n\nPembimbing I\nPembimbing I\n\n54\n\nNilai rata-rata : .............(dalam angka)\n... (dalam huruf)\nSurabaya, .......................\nMengetahui :\nKetuaProgram Studi,\n55', '6. Apabila memerlukan informasi lebih lanjut dapat menghubungi dirpendikcare@its.ac.id atau di\ncall centre pada hari dan jam kerja melalui no (WA Text Only) 085186819604, 085186819605.\nB. Bagi semua calon wisudawan (Sarjana dan Sarjana Terapan) wajib menghadap dosen wali untuk persetujuan SKEM, serta wajib melakukan pengajuan SKPI di studentconnect paling lambat tanggal 9 Februari 2024;\nC. Ijazah dicetak berdasarkan data preview yang dipermanen oleh calon wisudawan. Ijazah dicetak hanya sekali saja, bila ada kekeliruan pengisian data pada point 3 maka akan diterbitkan surat keterangan.\nD.Pelaksanaan wisuda akan dilaksanakan secara offline (Informasi mengenai gladi bersih disampaikan lebih lanjut.\n Atas perhatian dan kerjasama yang diberikan, kami sampaikan terima kasih.\n Powered by TCPDF (www.tcpdf.org)\nTembusan Yth :\n1. Rektor ITS\n2. Kepala Bagian Administrasi Umum dan Kearsipan Digital 3. Sekretaris Institut\nSurabaya, 09 Januari 2024\nWakil Rektor Bidang Akademik dan Kemahasiswaan,']",Saya tidak tahu.
13,Apa hari dan jam kuliah untuk Bahasa Indonesia di Semester IUP?,"Kuliah Bahasa Indonesia di Semester IUP berlangsung pada Kamis, pukul 13.30-15.10.","['- Pemesanan Foto Prosesi (tidak wajib)\n- Undangan Wisuda untuk orang tua:\nUndangan untuk orang tua/pendamping wisudawan diambil bersamaan dengan\npengambilan toga\n2. Jadwal pengambilan toga, gordon, undangan dan pemesanan foto prosesi sebagai berikut:\nHari\n:Rabu & Kamis\nTanggal : 17 & 18 April 2024\nPukul\n: 08.00-12.00 WIB\nPembagian jadwal pengambilan berdasarkan Fakultas akan disampaikan menyusul oleh\nDharma Wanita Persatuan ITS.\nAtas perhatian dan kerjasama yang diberikan kami sampaikan terima kasih.\nT. 1964405 5902an, M.T.\nMEMENTERIAN AS\nINSTITUT\nTembusan:\n- Rektor ITS\n- Para Wakil Rektor\n- Sekretaris Institut\n- Kepala Biro Sarana dan Prasarana\n- Kepala Biro Keuangan\n- Ketua Darma Wanita Persatuan ITS\n- Kabag. Admisitrasi Umum dan Kearsipan Digital', 'Jadwal pelaksanaan wisuda sebagai berikut :\nNO\nFAKULTAS\nFT-IRS, FT-SPK, SIMT, F-VOKASI\nFSAD, FTK, FT-EIC, F-DKBD\nJADWAL\nSabtu, 20 April 2024\nMinggu, 21 April 2024\nPukul\nTempat\n: 06.30 WIB - selesa1\n: Graha Sepuluh Nopember, Kampus ITS Sukolilo - Surabaya\nB. PEMBEKALAN WISUDA :\nHari/tanggal\n: Kamis, 18 April 2024\nPukul\n: 08.00 WIB\nTempat\n: Gedung Graha Sepuluh Nopember (Offline)\nC. PEMBAYARAN BIAYA WISUDA DAN TOGA:\n1. Biaya wisuda sebesar Rp. 1.000.000,- (Satu juta rupiah) khusus program Magister dan Doktor, dibayarkan dengan sistem host to host, melalui bank Mandiri, BRI, BNI, dan BSI mulai tanggal 4 s.d 15 Maret 2024, dengan cara menyebutkan angka 93 dilanjutkan dengan NRP. Sedangkan biaya sewa dan peminjaman toga mengikuti ketentuan Dharma Wanita Persatuan ITS.\n2. Mahasiswa Program Sarjana dan Sarjana Terapan tidak dikenakan biaya Wisuda, hanya dikenakan uang jaminan toga (akan dikembalikan setelah toga kembali).', 'A:  silakan kontak ke CP Dirmawa di 082233935593 atau mengacu ke pamflet yang ada di folder MBKM dari link akademik Sarjana\n\nQ: Kapan saya mesti entry SKEM ke SI SKEM?\n\nA:  Setiap semester, dan akan menjadi IP SKEM. Untuk lulus, minimal IP SKEM adalah 2.0. \n\nQ: Dimana panduan mengisi SKEM? \n\nA:  Ada di File panduan SKEM pada link akademik departemen \n\nQ: Kemana harus bertanya tentang UKT? (kesulitan pembayaran, keringanan, keterlambatan pembayaran)\n\nA:  Kontak Biro Keuangan (Senin - Jumat 08:00 - 15:00)\n-      WA (Text only) 082136250808\n-      WA (Text only) 081393936651\n-      WA (Text only) 081393936652\n-      WA (Text only) 087777587330\n-      WA (Text only) 082141942985\n\nCatatan ✍🏻\n\nTentang Refund UKT dapat dicek pada menu terkait. Jika tetap tidak menemukan jawaban, Tanyakan pada admin.', '6. Apabila memerlukan informasi lebih lanjut dapat menghubungi dirpendikcare@its.ac.id atau di\ncall centre pada hari dan jam kerja melalui no (WA Text Only) 085186819604, 085186819605.\nB. Bagi semua calon wisudawan (Sarjana dan Sarjana Terapan) wajib menghadap dosen wali untuk persetujuan SKEM, serta wajib melakukan pengajuan SKPI di studentconnect paling lambat tanggal 9 Februari 2024;\nC. Ijazah dicetak berdasarkan data preview yang dipermanen oleh calon wisudawan. Ijazah dicetak hanya sekali saja, bila ada kekeliruan pengisian data pada point 3 maka akan diterbitkan surat keterangan.\nD.Pelaksanaan wisuda akan dilaksanakan secara offline (Informasi mengenai gladi bersih disampaikan lebih lanjut.\n Atas perhatian dan kerjasama yang diberikan, kami sampaikan terima kasih.\n Powered by TCPDF (www.tcpdf.org)\nTembusan Yth :\n1. Rektor ITS\n2. Kepala Bagian Administrasi Umum dan Kearsipan Digital 3. Sekretaris Institut\nSurabaya, 09 Januari 2024\nWakil Rektor Bidang Akademik dan Kemahasiswaan,']",Saya tidak mengetahui informasi mengenai jadwal kuliah Bahasa Indonesia di Semester IUP.
14,Bagaimana cara penulisan abstrak yang benar dalam proposal tesis?,"Abstrak ditulis dalam Bahasa Indonesia dan Bahasa Inggris pada halaman yang berbeda, maksimal 350 kata, dengan format yang mencakup latar belakang, permasalahan, metodologi, dan kata kunci.","['Lampiran 4\nContoh abstrak proposal tesis dalam Bahasa Indonesia\nINFILTRASI AIR HUJAN DAN KEGEMPAAN TERINDUKSI\nLERENG STABILITAS PADA TANAH SISA\nMENGGUNAKAN RESISTIVITAS DAN PENGUKURAN\nMICROTREMOR\nMahasiswa Nama\nMahasiswa ID\nPembimbing\nCo-Supervisor\n: Dwa Desa Warnana\n: 3107 301 202\n: Dr. Ir. Ria A. A. Soemitro, M.Eng\n: Dr. Ir. Widya Utama, DEA.\nABSTRAK\nPenggunaan metode resistivitas dan mikrotremor dalam', 'Lampiran 11.A\nContoh abstrak tesis dalam Bahasa Indonesia\nKINERJA KOMPOS PRODUKSI UDPK BRATANG\nSEBAGAI MEDIA PENUKAR ION UNTUK MEREDUKSI LOGAM BERAT Cu DALAM AIR LIMBAH BUATAN\nNama mahasiswa\nNRP\nPembimbing\nABSTRAK\nKurangnya motivasi dalam kegiatan pengomposan salah\nsatunya adalah karena rendahnya nilai jual dan sempitnya pasar untuk produksi kompos. Pemanfaatan kompos sebagai media penukar 10n dharapkan dapat meningkatkan nila jual kompos sekaligus untuk memberikan alternatif pengolahan logam berat, khususnya Cu, yang murah. Kemampuan kompos untuk menukar ion berasal dari kandungan materi humus pada kompos yang mempunyai kapasitas tukar kation (KTK). Grup fungsi yang\nberperan\nadalah grup karboksil (-COOH) sehingga\nbisa\ndikategorikan sebagai resin asam lemah. Penelitian ini bertujuan untuk mengkaji kinerja kompos produksi UDPK Bratang sebagai media penukar ion untuk mereduksi Cu dalam air limbah buatan.\nKTK teoritis diukur dengan metode titrasi pH dan', 'pendaftaran sidang proposal tesis melalui MonTes dan grup whatsapp.  \n3. Mahasiswa yang ingin mendaftar sidang proposal tesis, harus melengkapi berkas \npersyaratan  pendafta ran sidang proposal tesis , meliputi  draft proposal tesis dan lembar  \npersetujuan pembimbing. Apabila kedua dokumen tersebut sudah lengkap, mahasiswa \ndapat melakukan pendaftaran melalui Google Form dengan link \nhttps://bit.ly/DaftarSidangPropTesGasal2122 . \n4. Admin Akademik Pascasarjana  memverikasi berkas persyaratan pendaftaran sidang \nproposal tesis . Apabila berkas sudah memenuhi, kemudian meng -input data mahasiswa \nyang mendaftar sidang proposal tesis ke MonTes  dan mengatur status menjadi ‘Terdaftar’.  \n5. Admin Akademik Pascasarjana  merekap data mahasiswa pendaftar sidang proposal tesis \ndi Microsoft Excel dan mengirimkan file hasil rekapitulasi data pendaf tar sidang proposal \ntesis ke masing -masing ketua RMK yang terkait dengan topik penelitian tesis mahasiswa', 'ーー\nLampiran 8A\nA. Contoh sampul / cover dalam tesis mono disiplin\ne20 mm\n40 mm\n35 mm\nWarna Dibagian Atas Garis Biru ITS : Putih\n0.6 dari tinggi kertas\n• 15 mm\nWarna Biru ITS\nWarna Dibawah Garis Biru ITS :\nSesuai Warna Fakultas\nTesis - No. Kode Tesis\nJudul Tesis\nTrebuchet MS (Bold), 17 puchet Ms (Bold),\n18 point\n0.4 dari tinggi kertas\n40 mm\nNAMA MAHASISWA NRP MAHASISWA\nDOSEN PEMBIMBING\nProf. Ir. Wahyu Susilo, M.Sc., Ph.D.\nDr. Ir. Indah Wahyuni, M.Sc.\nPROGRAM MAGISTER BIDANG KEAHLIAN ...\n00.......\nPROGRAM STUDI..............\nDEPARTEMEN ..\nFAKULTAS ..\nINSTITUT TEKNOLOGI SEPULUH NOPEMBER\nSURABAYA\n>20..\n--1\n130 mm\nV\n- Trebuchet MS,\n12 point\n51']","Untuk penulisan abstrak yang benar dalam proposal tesis, pertama-tama, Anda perlu memperhatikan struktur dan konten yang sesuai. Abstrak harus mencakup informasi singkat tentang latar belakang masalah, tujuan penelitian, metode yang digunakan, hasil yang diharapkan, dan kesimpulan yang diperoleh dari penelitian tersebut. Pastikan abstrak ditulis dengan jelas, ringkas, dan mudah dipahami oleh pembaca.

Selain itu, dalam penulisan abstrak, hindari penggunaan kalimat yang terlalu panjang dan rumit. Gunakan bahasa yang formal namun tetap mudah dipahami. Pastikan abstrak mencerminkan secara akurat isi dari proposal tesis yang akan disusun.

Dalam contoh abstrak proposal tesis yang disebutkan dalam konteks, terdapat penggunaan metode resistivitas dan mikrotremor untuk mengkaji infiltrasi air hujan dan kegempaan terinduksi pada lereng stabilits pada tanah sisa. Hal ini menunjukkan pentingnya menjelaskan metode yang digunakan dalam penelitian serta fokus dari penelitian tersebut.

Jadi, untuk menulis abstrak yang benar dalam proposal tesis, pastikan untuk merangkum secara singkat namun informatif tentang penelitian yang akan dilakukan, metode yang digunakan, dan hasil yang diharapkan."
15,Bagaimana aturan penomoran halaman dalam proposal dan tesis?,"Semua bagian sebelum teks diberi nomor halaman dengan angka Romawi kecil pada bagian bawah-tengah halaman, sedangkan bagian teks dan seterusnya menggunakan angka Arab dan diletakkan di bagian bawah-tengah halaman.","['6. Peserta sidang proposal tesis memakai dresscode berupa kemeja lengan panjang dan berdasi (laki-laki) dan memakai kemeja dengan blazer tanpa berdasi (perempuan).\n\n7. Selama sidang proposal tesis, peserta sidang proposal tesis wajib menggunakan virtual background yang dapat diunduh melalui https://bit.ly/VBProposalTesis dan kamera diharapkan selalu menyala (ON).\n\n8. Selama sesi diskusi dan tanya jawab, peserta sidang proposal tesis diharapkan dapat mencatat masukan dan koreksi dari dosen penguji.\n\n9. Link Zoom meeting sidang proposal tesis akan diinfokan H-1 melalui grup Whatsapp.', 'Lampiran 7A\nContoh lembar penilaian dan daftar hadir seminar proposal\ntesis\nDEPARTEMEN PENDIDIKAN NASIONAL\nINSTITUT TEKNOLOGI SEPULUH NOPEMBER SURABAYA\nPROGRAM PASCASARJANA\nDAFTAR HADIR DAN NILAI SEMINAR PROPOSAL TESIS\n:........\nJudul Seminar\nOleh\nNrp.\nProgram Studi\nBidang Keahlian\nTanda Tangan\n:....\n:\nNo\nNama Dosen\nJabatan\nTanda Tangan\nNilai (dalam angka)\n\n\nKetua\nAnggota\nAnggota\nAnggota\n\n\nNilai rata-rata : .... (dalam angka)\n.... (dalam huruf)\nKetua Sidang,\nSurabaya,\nMengetahui :\nKetua Program Studi,\n47', 'hasil revisiDokumen hasil\nrevisi sidang\nproposal tesis  \nApakah revisi\nsudah sesuai?Dokumen hasil\nrevisi sidang\nproposal tesis  Ketua RMK menentukan penguji\ndan menjadwalkan sidang\nproposal tesis setiap pesertaSOP PENDAFT ARAN SIDANG PROPOSAL TESIS PROGRAM STUDI S2 TEKNIK INFORMA TIKA (SISTEM ONLINE ), FT -EIC, ITS  \nYaDraft proposal tesis\ndan form persetujuan\npembimbing\nPemeriksa,\n \n \n \n \n \nLina Ambarwati, S.Kom.  \nNIP. 198003242014092001  Mengetahui,\nDr. Ahmad Saikhu, S.Si., M.T . \nNIP. 197107182006041001Pembuat,\n \n \n \n \n \nKartika Dwi Y uniavita Rahmawati, S.T .\nNPP. 1998202122056  \nJadwal sidang, link\nmeeting, dan VB\nTidak\nMenginfokan link google form\nuntuk meng-upload  seluruh\ndokumen hasil revisi sidang\nproposal tesis ke mahasiswa\nStatus sidang\nproposal tesis\nmenjadi ""Disetujui""Merekap data mahasiswa yang\ntelah menyelesaikan revisi\nsidang proposal tesis dan\nmenginfokan ke Kaprodi\nMeng-update status sidang\nproposal tesis di MonT esMeng-upload lembar revisi sidang', '10. Mahasiswa melaksanakan sidang proposal tesis. Sedangkan, dosen pembimbing dan \npenguji memberikan feedback ke mahasiswa, mengisi berita acara , memberikan penilaian \ndan catatan revisi  sidang proposal tesis.  \n11. Setelah mahasiswa melaksanakan sidang proposal tesis, Admin Akademik Pascasarjana  \nmeng -update status sidang proposal tesis di MonTes dari ‘Terjadwal Ujian’ menjadi \n‘Revisi ’. \n12. Mahasiswa mengerjakan revisi dan menyusun buku proposal tesis sesuai dengan hasil \ndiskusi ketika sidang proposal tesis dan/atau sesuai catatan dalam lembar revisi. Apabila \nsudah selesai mengerjakan revisi, mahasiswa dapat memberikan hasil revisinya ke dosen \npembimbing dan penguji serta mengajukan lembar revisi dan lembar pengesahan buku \nproposal tesis untuk meminta persetujuan ke dosen pembimbing dan penguji. Batas \npengerjaan revi si adalah 2 minggu setelah sidang proposal tesis berlangsung.  \n13. Apabila revisi yang dikerjakan mahasiswa dirasa sudah tepat, dosen pembimbing dan']","Penomoran halaman dalam proposal dan tesis biasanya menggunakan angka romawi untuk bagian awal seperti daftar isi, daftar tabel, dan daftar gambar. Sedangkan untuk bagian utama seperti pendahuluan, tinjauan pustaka, metode penelitian, hasil penelitian, dan kesimpulan, biasanya menggunakan angka arab. Penomoran halaman dimulai dari halaman judul hingga halaman terakhir dari tesis atau proposal. Jadi, aturan penomoran halaman dalam proposal dan tesis mengikuti urutan angka romawi dan angka arab sesuai dengan bagian yang ada dalam dokumen tersebut."
16,Apa ketentuan margin dalam penulisan proposal tesis? ,"Margin yang ditetapkan adalah 3,5 cm dari tepi atas, 3 cm dari tepi bawah, 4 cm dari tepi kiri (halaman ganjil) atau kanan (halaman genap), dan 3 cm dari tepi kanan (halaman ganjil) atau kiri (halaman genap).","['6. Peserta sidang proposal tesis memakai dresscode berupa kemeja lengan panjang dan berdasi (laki-laki) dan memakai kemeja dengan blazer tanpa berdasi (perempuan).\n\n7. Selama sidang proposal tesis, peserta sidang proposal tesis wajib menggunakan virtual background yang dapat diunduh melalui https://bit.ly/VBProposalTesis dan kamera diharapkan selalu menyala (ON).\n\n8. Selama sesi diskusi dan tanya jawab, peserta sidang proposal tesis diharapkan dapat mencatat masukan dan koreksi dari dosen penguji.\n\n9. Link Zoom meeting sidang proposal tesis akan diinfokan H-1 melalui grup Whatsapp.', 'ーー\nLampiran 8A\nA. Contoh sampul / cover dalam tesis mono disiplin\ne20 mm\n40 mm\n35 mm\nWarna Dibagian Atas Garis Biru ITS : Putih\n0.6 dari tinggi kertas\n• 15 mm\nWarna Biru ITS\nWarna Dibawah Garis Biru ITS :\nSesuai Warna Fakultas\nTesis - No. Kode Tesis\nJudul Tesis\nTrebuchet MS (Bold), 17 puchet Ms (Bold),\n18 point\n0.4 dari tinggi kertas\n40 mm\nNAMA MAHASISWA NRP MAHASISWA\nDOSEN PEMBIMBING\nProf. Ir. Wahyu Susilo, M.Sc., Ph.D.\nDr. Ir. Indah Wahyuni, M.Sc.\nPROGRAM MAGISTER BIDANG KEAHLIAN ...\n00.......\nPROGRAM STUDI..............\nDEPARTEMEN ..\nFAKULTAS ..\nINSTITUT TEKNOLOGI SEPULUH NOPEMBER\nSURABAYA\n>20..\n--1\n130 mm\nV\n- Trebuchet MS,\n12 point\n51', 'Lampiran 8B\nC. Contoh sampul / cover dalam tesis multi disiplin\n20 mm\n40 mm\n35 mm\nWarna Dibagian Atas Garis Biru ITS : Putih\n@ 15 mm\n0.6 dari tinggi kertas\nーーーーー\nWarna Biru ITS\nWarna Dibawah Garis Biru ITS :\nSesuai Warna Fakultas\nTesis - No. Kode Tesis\nJudul Tesis\nTrebuchet MS (Bold),\n12 point\nTrebuchet MS (Bold),\n18 point\n0.4 dari tinggi kertas\n40 mm\nNAMA MAHASISWA NRP MAHASISWA\nDOSEN PEMBIMBING\nProf. Ir. Wahyu Susilo, M.Sc., Ph.D.\nDr. Ir. Indah Wahyuni, M.Sc.\nPROGRAM MAGISTER\nBIDANG KEAHLIAN .................\nPROGRAM STUDI .....\n•..\nPROGRAM PASCASARJANA\nINSTITUT TEKNOLOGI SEPULUH NOPEMBER\nSURABAYA\n720..\n: 30 mm\nV\nTrebuchet MS,\n12 point\n52', 'Lampiran 7A\nContoh lembar penilaian dan daftar hadir seminar proposal\ntesis\nDEPARTEMEN PENDIDIKAN NASIONAL\nINSTITUT TEKNOLOGI SEPULUH NOPEMBER SURABAYA\nPROGRAM PASCASARJANA\nDAFTAR HADIR DAN NILAI SEMINAR PROPOSAL TESIS\n:........\nJudul Seminar\nOleh\nNrp.\nProgram Studi\nBidang Keahlian\nTanda Tangan\n:....\n:\nNo\nNama Dosen\nJabatan\nTanda Tangan\nNilai (dalam angka)\n\n\nKetua\nAnggota\nAnggota\nAnggota\n\n\nNilai rata-rata : .... (dalam angka)\n.... (dalam huruf)\nKetua Sidang,\nSurabaya,\nMengetahui :\nKetua Program Studi,\n47']","Margin dalam penulisan proposal tesis adalah sebesar 20 mm dari sisi atas, 40 mm dari sisi bawah, dan 35 mm dari sisi kanan dan kiri."
17,Apa syarat yang harus dipenuhi mahasiswa sebelum dapat membuat proposal tesis,"Mahasiswa harus menyelesaikan minimal 25% beban sks dengan IP kumulatif di atas 2,5 tanpa nilai D dan E sebelum dapat membuat proposal tesis.","['pendaftaran sidang proposal tesis melalui MonTes dan grup whatsapp.  \n3. Mahasiswa yang ingin mendaftar sidang proposal tesis, harus melengkapi berkas \npersyaratan  pendafta ran sidang proposal tesis , meliputi  draft proposal tesis dan lembar  \npersetujuan pembimbing. Apabila kedua dokumen tersebut sudah lengkap, mahasiswa \ndapat melakukan pendaftaran melalui Google Form dengan link \nhttps://bit.ly/DaftarSidangPropTesGasal2122 . \n4. Admin Akademik Pascasarjana  memverikasi berkas persyaratan pendaftaran sidang \nproposal tesis . Apabila berkas sudah memenuhi, kemudian meng -input data mahasiswa \nyang mendaftar sidang proposal tesis ke MonTes  dan mengatur status menjadi ‘Terdaftar’.  \n5. Admin Akademik Pascasarjana  merekap data mahasiswa pendaftar sidang proposal tesis \ndi Microsoft Excel dan mengirimkan file hasil rekapitulasi data pendaf tar sidang proposal \ntesis ke masing -masing ketua RMK yang terkait dengan topik penelitian tesis mahasiswa', 'Lampiran 4\nContoh abstrak proposal tesis dalam Bahasa Indonesia\nINFILTRASI AIR HUJAN DAN KEGEMPAAN TERINDUKSI\nLERENG STABILITAS PADA TANAH SISA\nMENGGUNAKAN RESISTIVITAS DAN PENGUKURAN\nMICROTREMOR\nMahasiswa Nama\nMahasiswa ID\nPembimbing\nCo-Supervisor\n: Dwa Desa Warnana\n: 3107 301 202\n: Dr. Ir. Ria A. A. Soemitro, M.Eng\n: Dr. Ir. Widya Utama, DEA.\nABSTRAK\nPenggunaan metode resistivitas dan mikrotremor dalam', 'Lampiran 7A\nContoh lembar penilaian dan daftar hadir seminar proposal\ntesis\nDEPARTEMEN PENDIDIKAN NASIONAL\nINSTITUT TEKNOLOGI SEPULUH NOPEMBER SURABAYA\nPROGRAM PASCASARJANA\nDAFTAR HADIR DAN NILAI SEMINAR PROPOSAL TESIS\n:........\nJudul Seminar\nOleh\nNrp.\nProgram Studi\nBidang Keahlian\nTanda Tangan\n:....\n:\nNo\nNama Dosen\nJabatan\nTanda Tangan\nNilai (dalam angka)\n\n\nKetua\nAnggota\nAnggota\nAnggota\n\n\nNilai rata-rata : .... (dalam angka)\n.... (dalam huruf)\nKetua Sidang,\nSurabaya,\nMengetahui :\nKetua Program Studi,\n47', '6. Peserta sidang proposal tesis memakai dresscode berupa kemeja lengan panjang dan berdasi (laki-laki) dan memakai kemeja dengan blazer tanpa berdasi (perempuan).\n\n7. Selama sidang proposal tesis, peserta sidang proposal tesis wajib menggunakan virtual background yang dapat diunduh melalui https://bit.ly/VBProposalTesis dan kamera diharapkan selalu menyala (ON).\n\n8. Selama sesi diskusi dan tanya jawab, peserta sidang proposal tesis diharapkan dapat mencatat masukan dan koreksi dari dosen penguji.\n\n9. Link Zoom meeting sidang proposal tesis akan diinfokan H-1 melalui grup Whatsapp.']","Sebelum dapat membuat proposal tesis, mahasiswa harus melengkapi berkas persyaratan pendaftaran sidang proposal tesis, yang meliputi draft proposal tesis dan lembar persetujuan pembimbing. Setelah kedua dokumen tersebut sudah lengkap, mahasiswa dapat melakukan pendaftaran melalui Google Form dengan link yang telah disediakan."
18,Bagaimana proses seminar proposal tesis dilaksanakan? ,"Proposal tesis harus dipresentasikan dalam seminar terbuka yang dihadiri oleh dosen pembimbing, dosen penguji, mahasiswa pascasarjana pada bidang keahlian yang sama, dan pihak lain yang berminat.","['TATA TERTIB PELAKSANAAN SIDANG PROPOSAL TESIS\n\nPROGRAM STUDI S2 TEKNIK INFORMATIKA\n\nDEPARTEMEN TEKNIK INFORMATIKA – FAKULTAS TEKNOLOGI ELEKTRO & INFORMATIKA CERDAS, ITS\n\n1. Peserta sidang proposal tesis menyiapkan perangkat laptop yang memadai dan jaringan internet yang stabil serta berada di tempat yang kondusif.\n\n2. Peserta sidang proposal tesis menyiapkan aplikasi Zoom dengan fitur kamera dan audio yang dapat berfungsi dengan baik.\n\n3. Peserta sidang proposal tesis menyiapkan file presentasi berupa PPT dan draft proposal tesis.\n\n4. Waktu sidang proposal tesis berlangsung selama 60 menit, 15 menit presentasi dan 45 menit tanya jawab.\n\n5. Peserta sidang proposal tesis disarankan untuk standby 30 menit sebelum jadwal yang ditentukan dan dapat bergabung pada link zoom meeting sesuai jadwal yang telah ditentukan atau sesuai instruksi dari dosen pembimbing/ penguji.', 'pendaftaran sidang proposal tesis melalui MonTes dan grup whatsapp.  \n3. Mahasiswa yang ingin mendaftar sidang proposal tesis, harus melengkapi berkas \npersyaratan  pendafta ran sidang proposal tesis , meliputi  draft proposal tesis dan lembar  \npersetujuan pembimbing. Apabila kedua dokumen tersebut sudah lengkap, mahasiswa \ndapat melakukan pendaftaran melalui Google Form dengan link \nhttps://bit.ly/DaftarSidangPropTesGasal2122 . \n4. Admin Akademik Pascasarjana  memverikasi berkas persyaratan pendaftaran sidang \nproposal tesis . Apabila berkas sudah memenuhi, kemudian meng -input data mahasiswa \nyang mendaftar sidang proposal tesis ke MonTes  dan mengatur status menjadi ‘Terdaftar’.  \n5. Admin Akademik Pascasarjana  merekap data mahasiswa pendaftar sidang proposal tesis \ndi Microsoft Excel dan mengirimkan file hasil rekapitulasi data pendaf tar sidang proposal \ntesis ke masing -masing ketua RMK yang terkait dengan topik penelitian tesis mahasiswa', 'di Microsoft Excel dan mengirimkan file hasil rekapitulasi data pendaf tar sidang proposal \ntesis ke masing -masing ketua RMK yang terkait dengan topik penelitian tesis mahasiswa \nuntuk meminta di -plotting -kan jadwal sidang tesis dan dosen penguji.  \n6. Ketua RMK mem -plotting jadwal dan dosen penguji sidang proposal tesis untuk masi ng-\nmasing mahasiswa dan menginfokannya ke Admin Akademik Pascasarjana . \n7. Admin Akademik Pascasarjana  mengirimkan jadwal dan virtual background sidang \nproposal tesis ke mahasiswa melalui grup Whatsapp.  \n8. Mahasiswa standby 30 menit sebelum sesi dimulai dan bergabung ke link meeting sesuai \njadwal sidang proposal tesis yang telah ditentukan.  \n9. Dosen pembimbing dan penguji bergabung ke link meeting sesuai jadwal sidang proposal \ntesis yang telah ditentukan.  \n10. Mahasiswa melaksanakan sidang proposal tesis. Sedangkan, dosen pembimbing dan \npenguji memberikan feedback ke mahasiswa, mengisi berita acara , memberikan penilaian', '10. Mahasiswa melaksanakan sidang proposal tesis. Sedangkan, dosen pembimbing dan \npenguji memberikan feedback ke mahasiswa, mengisi berita acara , memberikan penilaian \ndan catatan revisi  sidang proposal tesis.  \n11. Setelah mahasiswa melaksanakan sidang proposal tesis, Admin Akademik Pascasarjana  \nmeng -update status sidang proposal tesis di MonTes dari ‘Terjadwal Ujian’ menjadi \n‘Revisi ’. \n12. Mahasiswa mengerjakan revisi dan menyusun buku proposal tesis sesuai dengan hasil \ndiskusi ketika sidang proposal tesis dan/atau sesuai catatan dalam lembar revisi. Apabila \nsudah selesai mengerjakan revisi, mahasiswa dapat memberikan hasil revisinya ke dosen \npembimbing dan penguji serta mengajukan lembar revisi dan lembar pengesahan buku \nproposal tesis untuk meminta persetujuan ke dosen pembimbing dan penguji. Batas \npengerjaan revi si adalah 2 minggu setelah sidang proposal tesis berlangsung.  \n13. Apabila revisi yang dikerjakan mahasiswa dirasa sudah tepat, dosen pembimbing dan']","Proses seminar proposal tesis dilaksanakan dengan beberapa tahapan sebagai berikut:
1. Peserta sidang proposal tesis harus menyiapkan perangkat laptop yang memadai, jaringan internet yang stabil, serta berada di tempat yang kondusif.
2. Peserta sidang proposal tesis harus menyiapkan aplikasi Zoom dengan fitur kamera dan audio yang berfungsi dengan baik.
3. Peserta sidang proposal tesis harus menyiapkan file presentasi berupa PPT dan draft proposal tesis.
4. Waktu sidang proposal tesis berlangsung selama 60 menit, terdiri dari 15 menit presentasi dan 45 menit tanya jawab.
5. Peserta sidang disarankan untuk standby 30 menit sebelum jadwal yang ditentukan dan bergabung pada link Zoom meeting sesuai jadwal yang telah ditentukan atau instruksi dari dosen pembimbing/penguji.

Setelah itu, proses pendaftaran sidang proposal tesis dilakukan melalui MonTes dan grup WhatsApp dengan melengkapi berkas persyaratan seperti draft proposal tesis dan lembar persetujuan pembimbing. Admin Akademik Pascasarjana akan memverifikasi berkas persyaratan pendaftaran sidang proposal tesis. Jika berkas sudah lengkap, data mahasiswa yang mendaftar akan di-input ke MonTes dan statusnya diatur menjadi 'Terdaftar'.

Ketua RMK akan menetapkan jadwal dan dosen penguji sidang proposal tesis untuk setiap mahasiswa, kemudian Admin Akademik Pascasarjana akan mengirimkan jadwal dan virtual background sidang proposal tesis ke mahasiswa melalui grup WhatsApp. Selanjutnya, mahasiswa dan dosen pembimbing/penguji akan bergabung ke link meeting sesuai jadwal sidang proposal tesis yang telah ditentukan.

Selama sidang proposal tesis, mahasiswa akan melakukan presentasi, sementara dosen pembimbing dan penguji memberikan feedback, mengisi berita acara, memberikan penilaian, dan catatan revisi jika diperlukan. Setelah sidang, status sidang proposal tesis akan di-update di MonTes dan mahasiswa harus mengerjakan revisi sesuai dengan hasil diskusi saat sidang. Batas pengerjaan revisi adalah 2 minggu setelah sidang berlangsung. Jika revisi dianggap sudah tepat, mahasiswa dapat mengajukan lembar revisi dan pengesahan buku proposal tesis kepada dosen pembimbing dan penguji."
19,Apa saja pilihan penilaian yang dapat diberikan oleh tim penguji proposal tesis?,"im penguji dapat memberikan penilaian berupa: proposal disetujui, proposal disetujui dengan perbaikan, atau proposal tidak disetujui dan harus diulang.","['hasil revisiDokumen hasil\nrevisi sidang\nproposal tesis  \nApakah revisi\nsudah sesuai?Dokumen hasil\nrevisi sidang\nproposal tesis  Ketua RMK menentukan penguji\ndan menjadwalkan sidang\nproposal tesis setiap pesertaSOP PENDAFT ARAN SIDANG PROPOSAL TESIS PROGRAM STUDI S2 TEKNIK INFORMA TIKA (SISTEM ONLINE ), FT -EIC, ITS  \nYaDraft proposal tesis\ndan form persetujuan\npembimbing\nPemeriksa,\n \n \n \n \n \nLina Ambarwati, S.Kom.  \nNIP. 198003242014092001  Mengetahui,\nDr. Ahmad Saikhu, S.Si., M.T . \nNIP. 197107182006041001Pembuat,\n \n \n \n \n \nKartika Dwi Y uniavita Rahmawati, S.T .\nNPP. 1998202122056  \nJadwal sidang, link\nmeeting, dan VB\nTidak\nMenginfokan link google form\nuntuk meng-upload  seluruh\ndokumen hasil revisi sidang\nproposal tesis ke mahasiswa\nStatus sidang\nproposal tesis\nmenjadi ""Disetujui""Merekap data mahasiswa yang\ntelah menyelesaikan revisi\nsidang proposal tesis dan\nmenginfokan ke Kaprodi\nMeng-update status sidang\nproposal tesis di MonT esMeng-upload lembar revisi sidang', 'Lampiran 7A\nContoh lembar penilaian dan daftar hadir seminar proposal\ntesis\nDEPARTEMEN PENDIDIKAN NASIONAL\nINSTITUT TEKNOLOGI SEPULUH NOPEMBER SURABAYA\nPROGRAM PASCASARJANA\nDAFTAR HADIR DAN NILAI SEMINAR PROPOSAL TESIS\n:........\nJudul Seminar\nOleh\nNrp.\nProgram Studi\nBidang Keahlian\nTanda Tangan\n:....\n:\nNo\nNama Dosen\nJabatan\nTanda Tangan\nNilai (dalam angka)\n\n\nKetua\nAnggota\nAnggota\nAnggota\n\n\nNilai rata-rata : .... (dalam angka)\n.... (dalam huruf)\nKetua Sidang,\nSurabaya,\nMengetahui :\nKetua Program Studi,\n47', 'Lampiran 10.A\nContoh Form Evaluasi Ujian Akhir Tesis (Rekapitulasi)\nDEPARTEMEN PENDIDIKAN NASIONAL\nINSTITUT TEKNOLOGI SEPULUH NOPEMBER SURABAYA\nPROGRAM PASCASARJANA\nDAFTAR NILAI UJIAN TESIS\n:.............\nJudul Tesis\nOleh Nrp.\nBidang Keahlian\nProgram Studi\n: Pascasarjana\nFakultas / Jurusan\nTanda Tangan\nI. NILAI UJIAN (kisaran antara 40 - 60%)\n\nPenguji I\nPenguji II\nPenguji II\nPenguji IV\nPenguji V\nRata-rata\nMateri (80%)\n\n\n\n\n\n\nSikap /\nPresentasi (20%)\n\n\n\n\n\n\n\n\nNilai Total\n\n\n\n\nCatatan : Pembimbing juga bertindak sebagai penguji\nII. NILAI PEMBIMBING (kisaran antara 40 - 60%)\n\nDosen Pembimbing\nNilai\n\nPembimbing I\nPembimbing I\n\n54\n\nNilai rata-rata : .............(dalam angka)\n... (dalam huruf)\nSurabaya, .......................\nMengetahui :\nKetuaProgram Studi,\n55', 'pengerjaan revi si adalah 2 minggu setelah sidang proposal tesis berlangsung.  \n13. Apabila revisi yang dikerjakan mahasiswa dirasa sudah tepat, dosen pembimbing dan \npenguji dapat memberikan persetujuan yang dibuktikan dengan menandatangi form revisi  \ndan lembar pengesahan buku proposal tesis . 14. Admin Akademik Pascasarjana  menginfokan link untuk upload hasil revisi sidang \nproposal tesis ke mahasiswa melalui grup Whatsapp.  \n15. Mahasiswa meng -upload file hasil revisi sidang proposal tesis dan lembar revisi sidang \nproposal tesis ke link https://bit.ly/HasilRevisiProposalTesisDTIf . \n16. Apabila mahasiswa sudah mengumpulkan softfile buku proposal tesis, Admin Akademik \nPascasarjana  mengubah status sidang proposal tesis di MonTes  dari ‘Revisi’  menjad i \n‘Disetujui’.  \n17. Mahasiswa dapat mengecek nilai sidang proposal tesis di SIAKAD ITS mata kuliah IF \n185301 Tesis -Proposal.  \n \n \nNotes: Link google form akan di -update setiap tahun ajaran']","Terdapat beberapa pilihan penilaian yang dapat diberikan oleh tim penguji proposal tesis, yaitu:
1. Materi (80%)
2. Sikap / Presentasi (20%)
3. Nilai Total

Pada bagian Materi, terdapat penilaian dari Penguji I, Penguji II, Penguji III, Penguji IV, dan Penguji V. Sedangkan pada bagian Sikap / Presentasi, terdapat penilaian terhadap aspek sikap dan presentasi dari mahasiswa. Nilai total merupakan hasil akumulasi dari penilaian materi dan sikap/presentasi."
