,question,answer,contexts,ground_truth,context_precision,faithfulness,answer_relevancy,context_recall
0,Apa yang perlu direncanakan mahasiswa sehubungan dengan Bentuk Kegiatan Pembelajaran (BKP) MB-KM?,"Mahasiswa perlu merencanakan SKEM dan memetakan portofolio yang telah diusulkan dengan sks mata kuliah yang ingin dikonversikan sehubungan dengan Bentuk Kegiatan Pembelajaran (BKP) MB-KM. Selain itu, mahasiswa juga perlu melakukan perwalian dengan dosen wali untuk kemudian mendapatkan persetujuan Formulir Rencana Studi (FRS). Panduan pengguna dan rencana kegiatan SKEM/ Program MB-KM serta penjelasan terkait lainnya dapat diakses melalui link yang disediakan.","['A. Bagi Mahasiswa 1. Membuat perencanaan Kegiatan SKEM/ Program MB-KM dilaksanakan di awal semester. 2. Memilih kelas MB-KM secara mandiri melalui menu Formulir Rencana Studi (FRS) di SI Akademik. 3. Membuat dan menyimpan usulan portofolio yang tersedia di myITS StudentConnect untuk 1 (satu) semester ke depan. 4. Merencanakan SKEM dan memetakan portofolio (sehubungan dengan Bentuk Kegiatan Pembelajaran/ BKP MB-KM) yang telah diusulkan dengan sks mata kuliah yang ingin dikonversikan. 5. Melakukan perwalian dengan dosen wali untuk kemudian mendapatkan persetujuan FRS. 6. Panduan pengguna dan rencana kegiatan SKEM/ Program MB-KM dan penjelasan terkait lainnya dapat diakses di link https://its.id/panduan-rencana-skem-MBKM dan https://its.id/RencanaKegiatanSKEMMBKM . 7. Bagi mahasiswa yang merencanakan Program MB-KM, mengajukan Form 1 Matching Up Program MB-KM Ke MK Inti Prodi (jika konversi kegiatan ke Mata Kuliah Inti) dan Form 2 Surat Permohonan Kredit Transfer (Learning Agreement). 8.'
 'Sehubungan dengan kurikulum Program Sarjana dan Sarjana Terapan tahun 2023 – 2028 maka Berikut kami sampaikan beberapa teknis terkait pelaksanaan perencanaan kegiatan Satuan Kegiatan Ekstrakurikuler Mahasiswa (SKEM)/ program Merdeka Belajar–Kampus Merdeka (MB-KM) disampaikan bahwa:'
 'berlaku untuk angkatan 2021 keatas dimana kredit SKEMnya minimal 25.\n11. Dalam hal kegiatan yang digunakan untuk SKEM, mahasiswa wajib memiliki kegiatan\nProgram Kreativitas Mahasiswa (mulai angkatan 2020) dan Olahraga (mulai angkatan\n2021) selama menempuh kuliah di ITS. Untuk PKM mengikuti kegiatan minimal satu\nkali sedangkan olahraga dua kali selama menempuh kuliah di ITS.\n12. Kegiatan Olahraga ini ada 3 katagori yaitu:\na. Kegiatan olahraga mandiri yang ditunjukkan dengan logbook dan diverifikasi oleh\ndosen wali.\nb. Kegiatan olahraga yang dikoordinasi oleh UKM olahraga yang ada di ITS dengan\nmenunjukkan sertifikat/surat keterangan dimana verifikasi dilakukan oleh dosen\nwali.\nc. Kegiatan olahraga yang diselanggarakan oleh Komite Olahraga Nasional\nIndonesia (KONI) dengan menunjukkan sertifikat/surat keterangan dimana\nverifikasi dilakukan oleh dosen wali.\n13. Bagi mahasiswa yang tidak memiliki sertifikat kegiatan, bisa digantikan dengan surat'
 'B. Bagi Dosen Wali 1. Melakukan pendampingan dan pengecekan dari pengajuan perencanaan kegiatan SKEM/ program MB-KM yang diajukan oleh mahasiswa. 2. Jika dinilai sudah sesuai pengajuan perencanaan Kegiatan SKEM/ Program MB-KM oleh mahasiswa, dosen wali dapat melakukan persetujuan FRS. \nDemikian Surat Edaran ini dibuat untuk dilaksanakan dengan sebaik - baiknya. Atas perhatiannya diucapkan terimakasih.']",Merencanakan SKEM dan memetakan portofolio dengan SKS mata kuliah yang ingin dikonversikan,0.999999999975,1.0,0.8936139773919914,1.0
1,Apa yang harus dilakukan mahasiswa yang merencanakan Program MB-KM?,"Mahasiswa yang merencanakan Program MB-KM harus melakukan beberapa langkah, antara lain:
1. Membuat perencanaan kegiatan SKEM/Program MB-KM di awal semester.
2. Memilih kelas MB-KM secara mandiri melalui menu Formulir Rencana Studi (FRS) di SI Akademik.
3. Membuat dan menyimpan usulan portofolio yang tersedia di myITS StudentConnect untuk 1 (satu) semester ke depan.
4. Merencanakan SKEM dan memetakan portofolio yang telah diusulkan dengan sks mata kuliah yang ingin dikonversikan.
5. Melakukan perwalian dengan dosen wali untuk mendapatkan persetujuan FRS.
6. Mengajukan Form 1 Matching Up Program MB-KM Ke MK Inti Prodi (jika konversi kegiatan ke Mata Kuliah Inti) dan Form 2 Surat Permohonan Kredit Transfer (Learning Agreement).
7. Mengakses panduan pengguna dan rencana kegiatan SKEM/Program MB-KM serta penjelasan terkait lainnya melalui link yang disediakan.

Jadi, mahasiswa yang merencanakan Program MB-KM harus mengikuti langkah-langkah tersebut untuk melaksanakan program dengan baik.","['A. Bagi Mahasiswa 1. Membuat perencanaan Kegiatan SKEM/ Program MB-KM dilaksanakan di awal semester. 2. Memilih kelas MB-KM secara mandiri melalui menu Formulir Rencana Studi (FRS) di SI Akademik. 3. Membuat dan menyimpan usulan portofolio yang tersedia di myITS StudentConnect untuk 1 (satu) semester ke depan. 4. Merencanakan SKEM dan memetakan portofolio (sehubungan dengan Bentuk Kegiatan Pembelajaran/ BKP MB-KM) yang telah diusulkan dengan sks mata kuliah yang ingin dikonversikan. 5. Melakukan perwalian dengan dosen wali untuk kemudian mendapatkan persetujuan FRS. 6. Panduan pengguna dan rencana kegiatan SKEM/ Program MB-KM dan penjelasan terkait lainnya dapat diakses di link https://its.id/panduan-rencana-skem-MBKM dan https://its.id/RencanaKegiatanSKEMMBKM . 7. Bagi mahasiswa yang merencanakan Program MB-KM, mengajukan Form 1 Matching Up Program MB-KM Ke MK Inti Prodi (jika konversi kegiatan ke Mata Kuliah Inti) dan Form 2 Surat Permohonan Kredit Transfer (Learning Agreement). 8.'
 'di Microsoft Excel dan mengirimkan file hasil rekapitulasi data pendaf tar sidang proposal \ntesis ke masing -masing ketua RMK yang terkait dengan topik penelitian tesis mahasiswa \nuntuk meminta di -plotting -kan jadwal sidang tesis dan dosen penguji.  \n6. Ketua RMK mem -plotting jadwal dan dosen penguji sidang proposal tesis untuk masi ng-\nmasing mahasiswa dan menginfokannya ke Admin Akademik Pascasarjana . \n7. Admin Akademik Pascasarjana  mengirimkan jadwal dan virtual background sidang \nproposal tesis ke mahasiswa melalui grup Whatsapp.  \n8. Mahasiswa standby 30 menit sebelum sesi dimulai dan bergabung ke link meeting sesuai \njadwal sidang proposal tesis yang telah ditentukan.  \n9. Dosen pembimbing dan penguji bergabung ke link meeting sesuai jadwal sidang proposal \ntesis yang telah ditentukan.  \n10. Mahasiswa melaksanakan sidang proposal tesis. Sedangkan, dosen pembimbing dan \npenguji memberikan feedback ke mahasiswa, mengisi berita acara , memberikan penilaian'
 'B. Bagi Dosen Wali 1. Melakukan pendampingan dan pengecekan dari pengajuan perencanaan kegiatan SKEM/ program MB-KM yang diajukan oleh mahasiswa. 2. Jika dinilai sudah sesuai pengajuan perencanaan Kegiatan SKEM/ Program MB-KM oleh mahasiswa, dosen wali dapat melakukan persetujuan FRS. \nDemikian Surat Edaran ini dibuat untuk dilaksanakan dengan sebaik - baiknya. Atas perhatiannya diucapkan terimakasih.'
 'Program MB-KM, mengajukan Form 1 Matching Up Program MB-KM Ke MK Inti Prodi (jika konversi kegiatan ke Mata Kuliah Inti) dan Form 2 Surat Permohonan Kredit Transfer (Learning Agreement). 8. Form 1 dan Form 2 dapat diakses di link https://its.id/Form12SEWR1RencanaMBKM.']",Mengajukan Form 1 Matching Up Program MB-KM Ke MK Inti Prodi dan Form 2 Surat Permohonan Kredit Transfer (Learning Agreement),0.999999999975,1.0,0.9851190012529507,1.0
2,Apa masalah utama lulusan ITS menurut kondisi eksisting?,"Masalah utama lulusan ITS menurut kondisi eksisting adalah kurangnya kemampuan dalam Leadership, Interpersonal skill, teamwork, dan endurance. Selain itu, mahasiswa dengan nilai SKEM di atas 3.000 tidak terlihat memiliki softskill yang lebih baik dari yang memiliki nilai 1300. Mendapatkan nilai SKEM 1300 belum bisa dipakai secara efektif untuk mengukur capaian softskill mahasiswa. Pengisian SKEM didominasi pada semester 2 dan semester 8 sehingga tidak terbaca bagaimana track peningkatan softskill mahasiswa. Hanya 46% mahasiswa yang mengikuti kompetisi, tergabung dalam ormawa, wirausaha, delegasi, dll.","['Kondisi Eksisting\n1. Masalah utama lulusan ITS adalah Leadership, Interpersonal skill, teamwork, dan\nendurance.\n2. Mahasiswa dengan nilai SKEM diatas 3.000 tidak terlihat memiliki softskill yang\nlebih baik dari yang 1300.\n3. Mendapatkan nilai SKEM 1300 belum bisa dipakai secara efektif untuk mengukur\ncapaian softskill mahasiswa.\n4. Pengisian SKEM didominasi pada semester 2 dan semester 8 (untuk Sarjana)\nsehingga tidak terbaca bagaimana track peningkatan softskill mahasiswa.\n5. Hanya 46% mahasiswa yang mengikuti kompetisi, tergabung dalam ormawa,\nwirausaha, delegasi dll.'
 'Yth. :\n - Para Dekan\n - Para Kepala Departemen\nInstitut Teknologi Sepuluh Nopember\nKampus ITS, Surabaya\n\n\nSehubungan dengan telah terbitnya Peraturan Rektor Institut Teknologi Sepuluh Nopember\nNomor 18 Tahun 2023 tentang Peraturan Akademik Program Pendidikan Akademik, Vokasi dan\nProfesi Institut Teknologi Sepuluh Nopember Tahun 2023, bersama ini kami mohon bapak/ibu\nmencermati beberapa perubahan terkait syarat ujian tugas akhir serta yudisium mulai periode ke\n129 sebagai berikut:\nPasal 11\n1. Ayat 10, Kemampuan salah satu bahasa asing dan nilai SKEM digunakan sebagai\n    persyaratan mendaftar ujian Tugas/Proyek Akhir, Skripsi, Tesis, dan Disertasi dengan skor\n    paling sedikit sebagaimana tercantum dalam tabel.\n\n2. Ayat 13, Penentuan predikat kelulusan menggunakan Indeks Prestasi Kumulatif Predikat\n   (IPKP) yang dihitung berdasar pada semua sks Mata Kuliah yang pernah diambil dan\n   dirumuskan sebagai berikut:'
 'Lampiran 10.A\nContoh Form Evaluasi Ujian Akhir Tesis (Rekapitulasi)\nDEPARTEMEN PENDIDIKAN NASIONAL\nINSTITUT TEKNOLOGI SEPULUH NOPEMBER SURABAYA\nPROGRAM PASCASARJANA\nDAFTAR NILAI UJIAN TESIS\n:.............\nJudul Tesis\nOleh Nrp.\nBidang Keahlian\nProgram Studi\n: Pascasarjana\nFakultas / Jurusan\nTanda Tangan\nI. NILAI UJIAN (kisaran antara 40 - 60%)\n\nPenguji I\nPenguji II\nPenguji II\nPenguji IV\nPenguji V\nRata-rata\nMateri (80%)\n\n\n\n\n\n\nSikap /\nPresentasi (20%)\n\n\n\n\n\n\n\n\nNilai Total\n\n\n\n\nCatatan : Pembimbing juga bertindak sebagai penguji\nII. NILAI PEMBIMBING (kisaran antara 40 - 60%)\n\nDosen Pembimbing\nNilai\n\nPembimbing I\nPembimbing I\n\n54\n\nNilai rata-rata : .............(dalam angka)\n... (dalam huruf)\nSurabaya, .......................\nMengetahui :\nKetuaProgram Studi,\n55'
 'BAB I  \nTUGAS AKHIR : PENGERTIAN DAN T UJUAN \n \n \n1.1  Pen gertian \n Tiap mahasis wa yang akan m enyelesai kan studiny a dala m \nprogram  sarjana dan di ploma di wajibkan un tuk meny usun  suatu \nkarya ilm iah yang disebut  Tugas Akhir, setelah y ang bersangkut an \nmemenuhi persy aratan tertentu. T ugas Akhir dapat berupa penelitian \natau perancan gan (desain) y ang m empunyai ciri-ciri antara lain : \n \n1. Mem puny ai perum usan masa lah untuk penelitian, dan \nide untu k perancangan \n2. Judul tugas akhir dipilih sendiri oleh mahasiswa atau \nditentukan oleh dosen pembim bing \n3. Didasarkan pada pengamata n labor atorium /lapan gan \n(data primer) dan/atau analisis data sekunder \n4. Harus ada  ketertiban metodologi \n5. Di bawah bim bingan berkala dan teratur oleh dosen  \npembimbing \n6. Harus cer mat dalam  sajian (tata tulis ilmiah atau  aturan \ngambar) \n7. Dipresentasik an dala m forum  seminar \n8. Dipertahankan dalam  ujian lisan di  depan tim  dosen \npenguji \n \n1.2  T ujuan']","Leadership, Interpersonal skill, teamwork, dan endurance.",0.7499999999625,0.46153846153846156,0.9999988387817466,1.0
3,"Berapa persen mahasiswa yang mengikuti kompetisi, tergabung dalam ormawa, wirausaha, delegasi, dll?",Saya tidak tahu.,"['17. Pentas Paduan Suara Gerejawi (PESPARAWI)\n18. Kompetisi Inovasi Bisnis Mahasiswa (KIBM) 2020\n19. Akselerasi Startup Mahasiswa Indonesia (ASMI)\n20. Kompetisi Mahasiswa Nasional Bidang Ilmu Bisnis, Manajemen dan Keuangan 2020\nAdapun lomba yang Non Kemdikbud adalah semua lomba (Nasional atau Internasional)\nyang diadakan sebuah institusi resmi yang bukan termasuk dalam Kemdikbud.\nContoh Perhitungan:\nSekelompok mahasiswa mendapatkan medali perak Poster PKMM yang tidak berhubungan\ndengan bidang ilmu, Maka perhitungannya :\nNilai = 5 orang (3) * Nasional (2) * Pelaksanaan (2) * > 6 bulan (3) *\ntidak berhubungan (1) * Penunjang non Kemdikbud (1) = 36 SKEM dengan nilai AB'
 'Kompetisi, Wirausaha, dan Magang\nKompetisi dinilai berdasarkan 6 elemen\nELEMEN PENILAIAN KATEGORI BOBOT\nJumlah Peserta\nIndividu 1\nBeregu (2 Anggota) 2\nBeregu (>2 Anggota) 3\nSkala\nInstitut 1\nRegional 2\nNasional 3\nInternasional 4\nLuaran\nIde 1\nPelaksanaan 2\nHasil 3\nRentang Waktu\n< 3 Bulan 1\n3-6 Bulan 2\n> 6 Bulan 3\nBidang Ilmu\nTidak Berhubungan 1\nBerhubungan 2\nLevel\nKompetisi Kemdikbud 2\nKompetisi non Kemdikbud 1\nAspek Penilaian\n(Kompetisi)\nPENILAIAN\nHURUF ANGKA\nJuara 1 / emas A 4.0\nJuara 2 / perak AB 3.5\nJuara 3 / perunggu B 3.0\nJuara Harapan / Finalis BC 2.5\nPeserta C 2.0\nAspek Penilaian\n(PKM)\nPENILAIAN\nHURUF ANGKA\nPeserta PIMNAS A 4.0\nProposal didanai AB 3.5\nUpload proposal ke\nSIM BELMAWA\nB 3.0\nPeserta Liga PKM ITS BC 2.5\nToT / Workshop PKM C 2.0'
 'dimana pesertanya berasal dari sekurang-kurangnya diikuti oleh 3 negara.\n5. Dalam penentuan penyetaraan apresiasi yang bisa diekivalensikan dengan juara 1, 2,\ndan 3 ditentukan oleh Ditmawa.'
 'Wirausaha dinilai berdasarkan 6 elemen:\nAspek Penilaian\nPENILAIAN\nHURUF ANGKA\nOmzet > 50 Juta/Tahun A 4.0\nOmzet 20-50 Juta/Tahun AB 3.5\nOmzet 5-19,9 Juta/Tahun B 3.0\nOmzet 2 – 4,9 Juta/Tahun BC 2.5\nOmzet < 2 Juta/Tahun C 2.0\nELEMEN PENILAIAN KATEGORI BOBOT\nPeran\nAnggota 1\nKetua 2\nJumlah Pelaku\nIndividu 1\nTim (Mahasiswa ITS) 2\nBadan Hukum\nNon 1\nCV / UKM 2\nPT 3\nRentang Waktu\n< 1 Tahun 1\n> 1 Tahun 2\nBidang Ilmu\nTidak Berhubungan 1\nBerhubungan 2\nNotes:\nKhusus untuk peran sebagai Direktur Utama atau owner bisa mendapatkan dua kategori\nkegiatan yakni wirausaha dan abdimas.\nContoh Perhitungan:\nMahasiswa memiliki usaha konsultan bidang Teknik dalam bentuk CV yang berdiri sejak 2016\ndan memiliki omzet 100 juta per tahun, Maka perhitungan SKEMnya:\nNilai = individu (1) * CV (2) * > 1 tahun (2) * berhubungan (2) = 8 SKEM\ndengan nilai AB']",46%,0.499999999975,0.0,0.0,0.0
4,Apa itu tesis?,"Tesis adalah sebuah karya tulis ilmiah yang disusun oleh seorang mahasiswa sebagai syarat untuk memperoleh gelar akademik tertentu, seperti gelar sarjana, magister, atau doktor. Tesis biasanya berisi penelitian yang mendalam tentang suatu topik tertentu dan harus disusun dengan format dan struktur tertentu sesuai dengan standar akademik yang berlaku.","['Lampiran 11.A\nContoh abstrak tesis dalam Bahasa Indonesia\nKINERJA KOMPOS PRODUKSI UDPK BRATANG\nSEBAGAI MEDIA PENUKAR ION UNTUK MEREDUKSI LOGAM BERAT Cu DALAM AIR LIMBAH BUATAN\nNama mahasiswa\nNRP\nPembimbing\nABSTRAK\nKurangnya motivasi dalam kegiatan pengomposan salah\nsatunya adalah karena rendahnya nilai jual dan sempitnya pasar untuk produksi kompos. Pemanfaatan kompos sebagai media penukar 10n dharapkan dapat meningkatkan nila jual kompos sekaligus untuk memberikan alternatif pengolahan logam berat, khususnya Cu, yang murah. Kemampuan kompos untuk menukar ion berasal dari kandungan materi humus pada kompos yang mempunyai kapasitas tukar kation (KTK). Grup fungsi yang\nberperan\nadalah grup karboksil (-COOH) sehingga\nbisa\ndikategorikan sebagai resin asam lemah. Penelitian ini bertujuan untuk mengkaji kinerja kompos produksi UDPK Bratang sebagai media penukar ion untuk mereduksi Cu dalam air limbah buatan.\nKTK teoritis diukur dengan metode titrasi pH dan'
 'ーー\nLampiran 8A\nA. Contoh sampul / cover dalam tesis mono disiplin\ne20 mm\n40 mm\n35 mm\nWarna Dibagian Atas Garis Biru ITS : Putih\n0.6 dari tinggi kertas\n• 15 mm\nWarna Biru ITS\nWarna Dibawah Garis Biru ITS :\nSesuai Warna Fakultas\nTesis - No. Kode Tesis\nJudul Tesis\nTrebuchet MS (Bold), 17 puchet Ms (Bold),\n18 point\n0.4 dari tinggi kertas\n40 mm\nNAMA MAHASISWA NRP MAHASISWA\nDOSEN PEMBIMBING\nProf. Ir. Wahyu Susilo, M.Sc., Ph.D.\nDr. Ir. Indah Wahyuni, M.Sc.\nPROGRAM MAGISTER BIDANG KEAHLIAN ...\n00.......\nPROGRAM STUDI..............\nDEPARTEMEN ..\nFAKULTAS ..\nINSTITUT TEKNOLOGI SEPULUH NOPEMBER\nSURABAYA\n>20..\n--1\n130 mm\nV\n- Trebuchet MS,\n12 point\n51'
 'Lampiran 8B\nC. Contoh sampul / cover dalam tesis multi disiplin\n20 mm\n40 mm\n35 mm\nWarna Dibagian Atas Garis Biru ITS : Putih\n@ 15 mm\n0.6 dari tinggi kertas\nーーーーー\nWarna Biru ITS\nWarna Dibawah Garis Biru ITS :\nSesuai Warna Fakultas\nTesis - No. Kode Tesis\nJudul Tesis\nTrebuchet MS (Bold),\n12 point\nTrebuchet MS (Bold),\n18 point\n0.4 dari tinggi kertas\n40 mm\nNAMA MAHASISWA NRP MAHASISWA\nDOSEN PEMBIMBING\nProf. Ir. Wahyu Susilo, M.Sc., Ph.D.\nDr. Ir. Indah Wahyuni, M.Sc.\nPROGRAM MAGISTER\nBIDANG KEAHLIAN .................\nPROGRAM STUDI .....\n•..\nPROGRAM PASCASARJANA\nINSTITUT TEKNOLOGI SEPULUH NOPEMBER\nSURABAYA\n720..\n: 30 mm\nV\nTrebuchet MS,\n12 point\n52'
 '\uf0b7   UNGGAH artikel WAJIB dilakukan oleh MAHASISWA PENDAFTAR YUDISIUM 121.']",Tesis adalah karya ilmiah yang ditulis untuk memenuhi salah satu syarat untuk menyelesaikan studi pascasarjana strata 2 (program Magister) di Institut Teknologi Sepuluh Nopember.,0.4166666666458333,0.5714285714285714,0.999999999999999,0.0
5,Bagaimana penulisan nomor halaman dalam proposal tesis?,"Penulisan nomor halaman dalam proposal tesis dilakukan dengan cara menuliskan nomor halaman di bagian atas (header) sebelah kanan untuk halaman gasal dan sebelah kiri untuk halaman genap. Namun, halaman pertama dari bab baru ditulis di bawah (footer) kanan dan dimulai dengan nomor halaman gasal. Halaman dengan nomor gasal diletakkan pada lembar kanan dan halaman genap pada lembar kiri. Jika suatu bab berakhir pada halaman bernomor gasal, maka ditambahkan satu halaman kosong dengan nomor halaman genap dan diberi tulisan ""Halaman ini sengaja dikosongkan"". Antar bab diberi halaman pembatas dengan warna biru tanpa diberi nomor halaman.","['dicantum kan. Cara menyebutkan sum ber ialah  dengan \nmenuliskan nam a pengarang dan tahun publi kasi didalam  \nkurung. Untuk kutipan yang diam bil tidak secara la ngsung \ndari aslin ya maka y ang dituliskan adal ah nama penulis asli \ndan nam a penyuntin g (contoh: Faqih  dalam  Sulistijono, \n2006). Cara menuliskan daftar acu an dapat dilihat pada Sub \nbab 3.1 0. \n \n3.3. Halaman Judul \n Halaman judul ( Lampiran 1 ) sama den gan halam an kulit luar, \nberisi : tulisan ”TUGAS AKHIR”, judul Tugas Akhir; lam bang ITS, \nnama penulis dengan nomor pokok (N RP); nama ju rusan, fakultas, \n10 institut (dit ulis lengkap), dan nam a kota (Surabaya), serta tah un \npembuatan. Halaman ju dul ditu lis dalam  bahasa Inggris dan  \nIndonesia dalam  halam an yang berbe da. Kedua halam an judul \ntersebut menggunakan karakteristik  huruf y ang sama dengan bagian \nhalam an yang lain (bukan  huruf tim bul atau warna). \n Judul Tugas Akhir harus diketik seluru hnya dengan huruf-h uruf'
 'dan dim ulai dari Bab  Pe ndahul uan sam pai dengan \nlampiran. \n- Nomor hala man ditulis di atas (hea der) sebelah  kanan \nuntuk halam an gasal dan sebelah kiri untuk hala man genap, \nkecuali halaman pertama dari bab baru ditulis di bawah \n(footer) kanan dan dim ulai dengan nomor halaman gasal. \n- Hala man de ngan nom or gasal  dilet akkan pada le mbar \nkanan dan ha laman genap pada lembar kiri. Bila suatu bab \nberakhir pada halam an bernom or gasal, maka ditam bahkan \nsatu halaman kosong den gan nom or halam an genap (diberi \ntulisan ”Halaman ini sengaja dikoson gkan”). \n- Antar bab d iberi halam an pe mbatas dengan warna biru  \ntanpa diberi n omor halaman. \ng. Tabel dan Gam bar \nTabel-tabel diberi nom or urut  pada setiap bab denga n angka  \nArab dengan ketentuan pen ulisan sbb: \n− Nomor terdiri dari 2 bagian, bagian pertam a \nmenunjukkan  bab sedangkan b agian kedua   \nmenunjukkan  nom or tabel (contoh:  Tabel 2.1, Tabel 3.2,  \nTabel 3.3, ds b.).'
 'diketik dala m huruf-huruf besar, tepat di tengah-tengah halaman  \nsimetri kiri-kanan. Contoh halaman pengesahan pada la mpiran 2. \n \n3.5. Halaman Abstrak \n Halaman ab strak berisi : judul, nama penulis, nrp, nam a \npembimbing, ko pembimbing,  abst rak dan kata k unci. Halaman  \nabstrak ditulis dalam bahasa Inggr is dan Indonesia dalam  halaman \nyang berbeda . Jum lah kata maksim um adalah 400,  term asuk kata \nkunci. Con toh halaman abstrak pada lam piran 3. \n \n3.6. Halaman Kata Pengantar  \n Kata  Pengantar tidak lebih  dari s atu hal aman, beri si penjelasan \ntentang m aksud penulisa n laporan tu gas akhir, term asuk ucap an \nterim akasih kepada orang-orang yang pun ya kontribusi langs ung \ndalam  peny usunan TA. Tulisan ”KATA PENGANTAR” sebagai \njudul dari h alaman ini dituliska n seluruhn ya dengan huruf-h uruf \nbesar. \n \n11 3.7. Halaman Daftar Isi \n Yang dicantum kan dalam daftar isi : halam an judul, lem bar'
 'Cara menulis sitasi:\nWhitehead & Gould Fogerite (2017, p. 282) menyatakan… atau … (Whitehead & Gould\nFogerite, 2017, p. 282)\n\nd. Artikel jurnal dengan DOI, dan jumlah penulis 21 orang atau lebih\nKarena DOI asli panjang dan rumit, DOI pendek digunakan. Bentuk DOI yang panjang\natau pendek dapat diterima. Daftar 19 penulis pertama, kemudian gunakan … dan\nkemudian cantumkan nama penulis terakhir.\n\nContoh\nGaudinski, M. R., Coates, E. E., Houser, K. V., Chend, G. L., Yamshchikov, G., Saunders,\n     J. G., Holmans, L. A., Gordon, I., Plummer, S., Hendel, C. S., Conan-Cibotti, M.,\n     Lorenzo, M., L., Sitar, S., Carlton, K., Laurencot, C., Bailer, R. T., Narpala. S.,\n     McDermott, A. B., Namboodirir, A., M., … Ledgerwood, J. E. (2018). Safety and\n     pharmacokinetics of the Fc-modified HIV-1 human monoclonal antibody\n     VRC01LS: A phase 1 open-label clinical trial in healthy adults. PLoS Med, 15(1),\n     e1002493. https://doi.org/10.1371/journal.pmed.1002493']","Penomoran halaman sebelum teks (sebelum Bab 1) menggunakan angka Romawi kecil, sedangkan bagian teks menggunakan angka Arabic.",0.9166666666361111,0.8888888888888888,0.9913615268246221,
6,Bagaimana pelaksanaan wisuda akan dilakukan?,"Pelaksanaan wisuda akan dilakukan pada Sabtu, 20 April 2024 untuk Fakultas FT-IRS, FT-SPK, SIMT, dan F-VOKASI, serta pada Minggu, 21 April 2024 untuk FSAD, FTK, FT-EIC, dan F-DKBD. Acara akan dimulai pukul 06.30 WIB di Graha Sepuluh Nopember, Kampus ITS Sukolilo - Surabaya. Sebelumnya, akan ada pembekalan wisuda pada Kamis, 18 April 2024 pukul 08.00 WIB di Gedung Graha Sepuluh Nopember. Biaya wisuda sebesar Rp. 1.000.000,- untuk program Magister dan Doktor, dan harus dibayarkan melalui bank Mandiri, BRI, BNI, dan BSI mulai tanggal 4 hingga 15 Maret 2024 dengan cara menyebutkan angka 93 dilanjutkan dengan NRP. Mahasiswa Program Sarjana dan Sarjana Terapan tidak dikenakan biaya wisuda, hanya uang jaminan toga yang akan dikembalikan setelah pengembalian toga.","['Lakukan pembayaran dengan transfer ke VA BNI. Berlaku 1x24 jam. Jika kadaluarsa bisa melakukan pesanan baru.\nMemantau Pesanan\n\nStatus Pesanan:\n\nMembuat pesanan cetak\nMenunggu pembayaran\nPembayaran diterima\nProses pencetakan\nSelesai dicetak\nPengiriman ke Perpustakaan / Departemen\nSelesai\nPesanan kadaluarsa\nPesanan dibatalkan\nJika ada permasalahan teknis dapat menghubungi:\n\nWA Layanan DPTSI: 0811 3333 8 222 (07:30 – 16:00 WIB)\nPortal Servicedesk: https://servicedesk.its.ac.id'
 '5. Setelah semua proses diatas sudah dilakukan dengan benar, maka mahasiswa tinggal menunggu\n      perubahan status proposal TA-nya via MONTA (Mendaftar \uf0e0 Tunggu Sidang Proposal \uf0e0 OK/\n      Revisi/ Ditolak). Bagi mahasiswa yang status proposalnya OK, maka bisa segera melakukan\n      bimbingan ke dosen pembimbing. Sedangkan bagi proposalnya berstatus Revisi/Ditolak, harap\n      menghadap ke koordinator TA/Ketua RMK untuk mengambil hardcopy proposal dan menanyakan\n      keterangan lebih detail tenang status proposalnya.\n\x0c\uf076 Bimbingan TA\n\n  1. Setelah proposal TA mahasiswa berstatus “OK”, maka proses bimbingan TA bisa mulai dilakukan\n     baik secara online maupun offline. Untuk bimbingan online, mahasiswa mengisi kegiatan\n     bimbingan dengan memilih menu Progres TA, kemudian memilih menu Bimbingan Baru.\n\n\n\n\n  2. Berikut merupakan halaman bimbingan baru untuk diisikan item/catatan yang dijadikan topik\n     bimbingan.'
 'dan dim ulai dari Bab  Pe ndahul uan sam pai dengan \nlampiran. \n- Nomor hala man ditulis di atas (hea der) sebelah  kanan \nuntuk halam an gasal dan sebelah kiri untuk hala man genap, \nkecuali halaman pertama dari bab baru ditulis di bawah \n(footer) kanan dan dim ulai dengan nomor halaman gasal. \n- Hala man de ngan nom or gasal  dilet akkan pada le mbar \nkanan dan ha laman genap pada lembar kiri. Bila suatu bab \nberakhir pada halam an bernom or gasal, maka ditam bahkan \nsatu halaman kosong den gan nom or halam an genap (diberi \ntulisan ”Halaman ini sengaja dikoson gkan”). \n- Antar bab d iberi halam an pe mbatas dengan warna biru  \ntanpa diberi n omor halaman. \ng. Tabel dan Gam bar \nTabel-tabel diberi nom or urut  pada setiap bab denga n angka  \nArab dengan ketentuan pen ulisan sbb: \n− Nomor terdiri dari 2 bagian, bagian pertam a \nmenunjukkan  bab sedangkan b agian kedua   \nmenunjukkan  nom or tabel (contoh:  Tabel 2.1, Tabel 3.2,  \nTabel 3.3, ds b.).'
 'Jadwal pelaksanaan wisuda sebagai berikut :\nNO\nFAKULTAS\nFT-IRS, FT-SPK, SIMT, F-VOKASI\nFSAD, FTK, FT-EIC, F-DKBD\nJADWAL\nSabtu, 20 April 2024\nMinggu, 21 April 2024\nPukul\nTempat\n: 06.30 WIB - selesa1\n: Graha Sepuluh Nopember, Kampus ITS Sukolilo - Surabaya\nB. PEMBEKALAN WISUDA :\nHari/tanggal\n: Kamis, 18 April 2024\nPukul\n: 08.00 WIB\nTempat\n: Gedung Graha Sepuluh Nopember (Offline)\nC. PEMBAYARAN BIAYA WISUDA DAN TOGA:\n1. Biaya wisuda sebesar Rp. 1.000.000,- (Satu juta rupiah) khusus program Magister dan Doktor, dibayarkan dengan sistem host to host, melalui bank Mandiri, BRI, BNI, dan BSI mulai tanggal 4 s.d 15 Maret 2024, dengan cara menyebutkan angka 93 dilanjutkan dengan NRP. Sedangkan biaya sewa dan peminjaman toga mengikuti ketentuan Dharma Wanita Persatuan ITS.\n2. Mahasiswa Program Sarjana dan Sarjana Terapan tidak dikenakan biaya Wisuda, hanya dikenakan uang jaminan toga (akan dikembalikan setelah toga kembali).']",Pelaksanaan wisuda akan dilakukan secara offline.,0.249999999975,1.0,0.9242655671578451,0.0
7,Apakah calon wisudawan Sarjana dan Sarjana Terapan memiliki kewajiban yang sama terkait pengisian biodata dan proses wisuda?,"Tidak, calon wisudawan Sarjana dan Sarjana Terapan memiliki kewajiban yang berbeda terkait pengisian biodata dan proses wisuda. Calon wisudawan Sarjana dan Sarjana Terapan harus melunasi IKOMA dan mengisi data-data untuk cetak ijazah di Direktorat Pendidikan dengan Pengisian Data di SIAKAD. Selain itu, mereka juga harus mengisi data terkait peminjaman-pengembalian toga dan mengisi Form Kepuasan & Yudisium Departemen. Sedangkan untuk proses wisuda, mereka dapat bertanya ke Instagram @ikomaits dan diharapkan untuk berpartisipasi menjadi donatur dana abadi/endowment fund ITS.","['(Bagi mahasiswa Program Sarjana dan Sarjana Terapan)\n\nhttp://lpmp2ki.its.ac.id/pomits\n5        \nMelunasi IKOMA.\n\n(Bagi mahasiswa Program Sarjana dan Sarjana Terapan)\n\nDapat bertanya ke Instagram @ikomaits \n6        Mengisi data-data untuk cetak ijazah di Direktorat Pendidikan dengan Pengisian Data di SIAKAD        Baca dokumen “Pemberitahuan untuk calon Wisudawan ITS…”\n7        Mengisi data terkait peminjaman-pengembalian toga.        https://wisuda.its.ac.id/\n8        Mengajak kepada semua calon wisudawan untuk berpartisipasi menjadi donatur dana abadi/endowment fund ITS.        http://danaabadi.its.ac.id/web/\n9        Mengisi Form Kepuasan & Yudisium Departemen        Link di atas :D'
 'Sedangkan untuk lomba yang terkait dengan reward prestasi maka verifikasi dilakukan\noleh Ditmawa sebelum diberikan ke Departemen.\n7. Verifikasi portofolio dilakukan oleh Ditmawa (Kewirausahaan, Magang, Kompetisi\ndan abdimas lain), DRPM (Abdimas), DKG (Internasionalisasi), dan dosen wali (selain\nkegiatan diatas).\n8. Terkait kesesuaian dengan bidang ilmu akan diverifikasi oleh dosen wali dari\nDepartemen masing-masing.\n9. Dosen wali mempunyai kewajiban untuk memantau perkembangan IP SKEM anak wali\nagar tidak dibawah 2.1 dan apabila pada semester berjalan IP SKEM berada dibawah\n2.1, maka dosen wali wajib mengingatkan mahasiswa yang bersangkutan untuk\nmemenuhi persyaratan ini pada semester berikutnya.\n10. Skem Baru ini berlaku juga untuk mahasiswa IUP dan RPL. Khusus mahasiswa RPL\nberlaku untuk angkatan 2021 keatas dimana kredit SKEMnya minimal 25.\n11. Dalam hal kegiatan yang digunakan untuk SKEM, mahasiswa wajib memiliki kegiatan'
 'Yth. :\n - Para Dekan\n - Para Kepala Departemen\nInstitut Teknologi Sepuluh Nopember\nKampus ITS, Surabaya\n\n\nSehubungan dengan telah terbitnya Peraturan Rektor Institut Teknologi Sepuluh Nopember\nNomor 18 Tahun 2023 tentang Peraturan Akademik Program Pendidikan Akademik, Vokasi dan\nProfesi Institut Teknologi Sepuluh Nopember Tahun 2023, bersama ini kami mohon bapak/ibu\nmencermati beberapa perubahan terkait syarat ujian tugas akhir serta yudisium mulai periode ke\n129 sebagai berikut:\nPasal 11\n1. Ayat 10, Kemampuan salah satu bahasa asing dan nilai SKEM digunakan sebagai\n    persyaratan mendaftar ujian Tugas/Proyek Akhir, Skripsi, Tesis, dan Disertasi dengan skor\n    paling sedikit sebagaimana tercantum dalam tabel.\n\n2. Ayat 13, Penentuan predikat kelulusan menggunakan Indeks Prestasi Kumulatif Predikat\n   (IPKP) yang dihitung berdasar pada semua sks Mata Kuliah yang pernah diambil dan\n   dirumuskan sebagai berikut:'
 'BAB I  \nTUGAS AKHIR : PENGERTIAN DAN T UJUAN \n \n \n1.1  Pen gertian \n Tiap mahasis wa yang akan m enyelesai kan studiny a dala m \nprogram  sarjana dan di ploma di wajibkan un tuk meny usun  suatu \nkarya ilm iah yang disebut  Tugas Akhir, setelah y ang bersangkut an \nmemenuhi persy aratan tertentu. T ugas Akhir dapat berupa penelitian \natau perancan gan (desain) y ang m empunyai ciri-ciri antara lain : \n \n1. Mem puny ai perum usan masa lah untuk penelitian, dan \nide untu k perancangan \n2. Judul tugas akhir dipilih sendiri oleh mahasiswa atau \nditentukan oleh dosen pembim bing \n3. Didasarkan pada pengamata n labor atorium /lapan gan \n(data primer) dan/atau analisis data sekunder \n4. Harus ada  ketertiban metodologi \n5. Di bawah bim bingan berkala dan teratur oleh dosen  \npembimbing \n6. Harus cer mat dalam  sajian (tata tulis ilmiah atau  aturan \ngambar) \n7. Dipresentasik an dala m forum  seminar \n8. Dipertahankan dalam  ujian lisan di  depan tim  dosen \npenguji \n \n1.2  T ujuan']","Ya, semua calon wisudawan Sarjana dan Sarjana Terapan wajib mengikuti ketentuan yang sama.",0.999999999975,0.8571428571428571,0.0,1.0
8,Bagaimana cara mengajukan SKPI?,"Untuk mengajukan SKPI, calon wisudawan (Sarjana dan Sarjana Terapan) wajib menghadap dosen wali untuk persetujuan SKEM, serta wajib melakukan pengajuan SKPI di studentconnect paling lambat tanggal 9 Februari 2024. Jika ada kekeliruan pengisian data pada SKPI, akan diterbitkan surat keterangan.","['6. Apabila memerlukan informasi lebih lanjut dapat menghubungi dirpendikcare@its.ac.id atau di\ncall centre pada hari dan jam kerja melalui no (WA Text Only) 085186819604, 085186819605.\nB. Bagi semua calon wisudawan (Sarjana dan Sarjana Terapan) wajib menghadap dosen wali untuk persetujuan SKEM, serta wajib melakukan pengajuan SKPI di studentconnect paling lambat tanggal 9 Februari 2024;\nC. Ijazah dicetak berdasarkan data preview yang dipermanen oleh calon wisudawan. Ijazah dicetak hanya sekali saja, bila ada kekeliruan pengisian data pada point 3 maka akan diterbitkan surat keterangan.\nD.Pelaksanaan wisuda akan dilaksanakan secara offline (Informasi mengenai gladi bersih disampaikan lebih lanjut.\n Atas perhatian dan kerjasama yang diberikan, kami sampaikan terima kasih.\n Powered by TCPDF (www.tcpdf.org)\nTembusan Yth :\n1. Rektor ITS\n2. Kepala Bagian Administrasi Umum dan Kearsipan Digital 3. Sekretaris Institut\nSurabaya, 09 Januari 2024\nWakil Rektor Bidang Akademik dan Kemahasiswaan,'
 'LAYANAN ADAPTASI KEBIASAAN BARU\n\' 6. Kebutuhan Surat Lainnya\n| - Surat Keterangan Atumni ""Surat Permohonan Statement ette\n| "" Surat Rukomendasi Dekan, Rektor Cerhkfcalon Letter\n- - Surat Keterangan Pengganti Ijazah "" Surat keterangan Berkelakuar Bar\n| "" Venficaton of Academic Records. "" Surat Keterangan Pengembalian ke intansi Asai\nKirim dan sertakan dokumen pada Email pilints.ac.id\n|\n| .\n7. Spesimen Tanda Tangan Pejabat\nIntip informasi pada tautan: weru.its.ac.id/burb. id/ spesimen-tandatangan\n|\n| .\n8. Rekrutmen Dosen dan Tendik\n| Informasi dapat diakses pada tau:an: rekrut men.its.oc.id\n|\n| 9. Layanan LHKPN\n| Layanan dapat diakses pada tautan: elhikpn. hpk.go.id\n10. Layanan LHKASN\nIn Layanan dapat diakses pada tautan: siharka.menpan.go.id\nTI. Surat Keterangan Tidak Sedang Menerima Beasiswa\nKirim permintaan pada platform MyiTS SSO di fitur MyITS Student Commect\n12. Layanan Reset Password Sister\nKirim permintaan pada tautan: servicesdesh its.oc.id\n13. Layanan Aktivasi Gate'
 '6. Harus cer mat dalam  sajian (tata tulis ilmiah atau  aturan \ngambar) \n7. Dipresentasik an dala m forum  seminar \n8. Dipertahankan dalam  ujian lisan di  depan tim  dosen \npenguji \n \n1.2  T ujuan \n Dengan menyusun Tu gas Akhir diha rapkan mahasiswa \nmam pu m erangkum , mengaplikasika n, menuangkan, m emecahkan \nsemua pengetahuan, ketram pilan, ide dan m asalah  dalam  bidang  \nkeahlian tertentu secara sistem atis, logis, kritis dan kreatif, didukung \ndata/informasi y ang akurat denga n analisis y ang tepat.  \n1  Penyusunan Tugas Akhir merupa kan salah satu sy arat untuk  \nmeny elesaika n studi dalam progra m sarjana dan  diplom a yang \nmem puny ai tujuan agar mahasiswa : \n \na. Mam pu membentuk sikap mental ilm iah \nb. Mam pu m engidentifi kasi dan m erumuskan m asalah \npenelitian atau perancanga n (desain) y ang berdasarkan \nrasional tertentu yang dinilai penting  dan berm anfaat \nditinjau dari beberapa segi  \nc. Mam pu melaksanakan penelitian/desain, m ulai d ari'
 'dicantum kan. Cara menyebutkan sum ber ialah  dengan \nmenuliskan nam a pengarang dan tahun publi kasi didalam  \nkurung. Untuk kutipan yang diam bil tidak secara la ngsung \ndari aslin ya maka y ang dituliskan adal ah nama penulis asli \ndan nam a penyuntin g (contoh: Faqih  dalam  Sulistijono, \n2006). Cara menuliskan daftar acu an dapat dilihat pada Sub \nbab 3.1 0. \n \n3.3. Halaman Judul \n Halaman judul ( Lampiran 1 ) sama den gan halam an kulit luar, \nberisi : tulisan ”TUGAS AKHIR”, judul Tugas Akhir; lam bang ITS, \nnama penulis dengan nomor pokok (N RP); nama ju rusan, fakultas, \n10 institut (dit ulis lengkap), dan nam a kota (Surabaya), serta tah un \npembuatan. Halaman ju dul ditu lis dalam  bahasa Inggris dan  \nIndonesia dalam  halam an yang berbe da. Kedua halam an judul \ntersebut menggunakan karakteristik  huruf y ang sama dengan bagian \nhalam an yang lain (bukan  huruf tim bul atau warna). \n Judul Tugas Akhir harus diketik seluru hnya dengan huruf-h uruf']",SKPI diajukan melalui studentconnect.,0.8333333332916666,1.0,0.8902273231948943,1.0
9,Apa ciri-ciri Tugas Akhir?,"Tugas Akhir memiliki ciri-ciri sebagai berikut:
1. Terdiri dari tiga bagian besar, yaitu Bagian 'Awal', Bagian 'Inti/Pokok', dan Bagian 'Penutup'.
2. Bagian 'Awal' meliputi judul Tugas Akhir dalam bahasa Indonesia dan bahasa Inggris, halaman pengesahan, abstrak dalam bahasa Indonesia dan bahasa Inggris, kata pengantar, daftar isi, daftar gambar, grafik, diagram, daftar tabel, dan daftar simbol.
3. Bagian 'Inti/Pokok' berisi pendahuluan yang mencakup latar belakang masalah, rumusan permasalahan, batasan masalah/ruang lingkup, tujuan, manfaat (jika diperlukan), tinjauan pustaka, dan metodologi.
4. Bagian 'Penutup' biasanya berisi kesimpulan, saran, dan daftar pustaka.
5. Judul Tugas Akhir harus ditulis dengan huruf besar tanpa disingkat, kecuali singkatan yang sudah baku.
6. Nama penulis harus ditulis dengan huruf besar tanpa disingkat.
7. Halaman pengesahan harus diletakkan setelah halaman judul dan berisi informasi tentang pembimbing, ko-pembimbing/penguji, serta tempat dan tanggal pengesahan.
8. Halaman abstrak juga merupakan bagian penting yang harus disertakan dalam Tugas Akhir.","['6 BAB III  \nLAPORAN TUGAS AKHIR \n \n3.1. Sistem atika \n Siste matika l aporan Tugas Akhir terdiri atas  tiga ba gian besar, \nyaitu : \n \n1. Bagian ’Awal’ terdiri dari: \na. Judul Tu gas Akhir dala m bahasa In donesia dan  bahasa \nInggris pada kulit m uka dan kulit  dalam  (Lampiran 1 ) \nb. Hala man pengesahan ( Lampiran 2 ) \nc. Abstrak atau  uraian singkat dalam  bahasa Indonesia dan  \nbahasa Inggris ( Lampiran 3 ) \nd. Kata pengantar \ne. Daftar isi \nf. Daftar gam bar, grafik, diag ram \ng. Daftar tabel \nh. Daftar si mbol \n \n2. Bagian ‘Inti/Pokok’ atau ‘Batang Tubuh’ berisi :  \n a. Pendahuluan  \n• Latar belakan g masalah \n• Rumusan Per masalahan  \n• Batasan m asalah/ruang lingkup \n• Tujuan  \n• Manfaat (bila diperlukan untuk ditulis) \nb. Tinjauan Pustaka \n• Hasil peneliti an terdahulu yang relevan \n• Teori yang akan digunakan untuk meny elesaikan  \npermasalahan   \nc. Metodolog i  \n• Metode y ang digunakan \n• Bahan dan perala tan y ang digunakan \n• Urutan pelaksanaan percobaan'
 'Oleh : <NAMA MAHASISWA>\n                             NRP. <XXXXXXXX>\n\n\n\n                    Disetujui oleh Tim Penguji Tugas Akhir :\n\n\n1. Nama dan gelar pembimbing                            Pembimbing\n\n\n2. Nama dan gelar ko-pembimbing/penguji                 Ko-pembimbing\n\n\n3. Nama dan gelar penguji                               Penguji\n\n\n4. Nama dan gelar penguji                               Penguji\n\n\n5. Nama dan gelar penguji                               Penguji\n\n\n                                 SURABAYA\n                                 Bulan, Tahun\n\n\n\n                                                                        33\n\x0c                              APPROVAL SHEET\n\n\n\nTHE TITLE OF THE FINAL PROJECT IS WRITTEN BRIEFLY, CLEARLY AND\n                  DESCRIBING THE MAIN THEME'
 'tersebut menggunakan karakteristik  huruf y ang sama dengan bagian \nhalam an yang lain (bukan  huruf tim bul atau warna). \n Judul Tugas Akhir harus diketik seluru hnya dengan huruf-h uruf \nbesar dan tidak boleh disingkat, kecuali singkatan yang sudah baku.  \n Nama penulis harus ditulis dengan huruf besar dan tidak \ndisingkat.   \n \n3.4. Hala man Pen gesahan  \n Hala man pengesahan diletakkan pada hala man sesud ah hala man \njudul.  \n Hala man pengesahan berisi : tulisan ”LEMBA R \nPENGESAHAN”, judul Tugas Ak hir; tujuan ddiiaajjuukkaannnnyyaa  TTAA,,  \nppeerrsseettuujjuuaann  ppeemmbbiimmbbiinngg  ((ddaappaatt  lleebbiihh  ddaarrii  ssaattuu)),,  nnaammaa--nnaammaa  \nppeemmbbiimmbbiinngg,,  kkoottaa,,  bbuullaann  ddaann    ttaahhuunn  ppeennggeessaahhaann..  Halam an ini sel alu \ndiketik dala m huruf-huruf besar, tepat di tengah-tengah halaman  \nsimetri kiri-kanan. Contoh halaman pengesahan pada la mpiran 2. \n \n3.5. Halaman Abstrak'
 'Lampiran 10.A\nContoh Form Evaluasi Ujian Akhir Tesis (Rekapitulasi)\nDEPARTEMEN PENDIDIKAN NASIONAL\nINSTITUT TEKNOLOGI SEPULUH NOPEMBER SURABAYA\nPROGRAM PASCASARJANA\nDAFTAR NILAI UJIAN TESIS\n:.............\nJudul Tesis\nOleh Nrp.\nBidang Keahlian\nProgram Studi\n: Pascasarjana\nFakultas / Jurusan\nTanda Tangan\nI. NILAI UJIAN (kisaran antara 40 - 60%)\n\nPenguji I\nPenguji II\nPenguji II\nPenguji IV\nPenguji V\nRata-rata\nMateri (80%)\n\n\n\n\n\n\nSikap /\nPresentasi (20%)\n\n\n\n\n\n\n\n\nNilai Total\n\n\n\n\nCatatan : Pembimbing juga bertindak sebagai penguji\nII. NILAI PEMBIMBING (kisaran antara 40 - 60%)\n\nDosen Pembimbing\nNilai\n\nPembimbing I\nPembimbing I\n\n54\n\nNilai rata-rata : .............(dalam angka)\n... (dalam huruf)\nSurabaya, .......................\nMengetahui :\nKetuaProgram Studi,\n55']","Perumusan masalah atau ide, judul dipilih sendiri atau oleh dosen pembimbing, berdasarkan pengamatan laboratorium/lapangan, ketertiban metodologi, bimbingan berkala, cermat dalam sajian, dipresentasikan dalam forum seminar, dipertahankan dalam ujian lisan",0.9999999999,1.0,1.0000000000000004,0.0
10,Apa bentuk Tugas Akhir?,"Tugas Akhir terdiri dari tiga bagian besar, yaitu:
1. Bagian 'Awal' yang terdiri dari:
   a. Judul Tugas Akhir dalam bahasa Indonesia dan bahasa Inggris pada kulit muka dan kulit dalam
   b. Halaman pengesahan
   c. Abstrak atau uraian singkat dalam bahasa Indonesia dan bahasa Inggris
   d. Kata pengantar
   e. Daftar isi
   f. Daftar gambar, grafik, diagram
   g. Daftar tabel
   h. Daftar simbol

2. Bagian 'Inti/Pokok' atau 'Batang Tubuh' yang berisi:
   a. Pendahuluan
      - Latar belakang masalah
      - Rumusan Permasalahan
      - Batasan masalah/ruang lingkup
      - Tujuan
      - Manfaat (bila diperlukan untuk ditulis)
   b. Tinjauan Pustaka
      - Hasil penelitian terdahulu yang relevan
      - Teori yang akan digunakan untuk menyelesaikan permasalahan
   c. Metodologi
      - Metode yang digunakan
      - Bahan dan peralatan yang digunakan
      - Urutan pelaksanaan percobaan

Jadi, bentuk Tugas Akhir terdiri dari bagian 'Awal' dan 'Inti/Pokok' yang mencakup berbagai komponen seperti judul, halaman pengesahan, abstrak, kata pengantar, daftar isi, tinjauan pustaka, dan metodologi.","['6 BAB III  \nLAPORAN TUGAS AKHIR \n \n3.1. Sistem atika \n Siste matika l aporan Tugas Akhir terdiri atas  tiga ba gian besar, \nyaitu : \n \n1. Bagian ’Awal’ terdiri dari: \na. Judul Tu gas Akhir dala m bahasa In donesia dan  bahasa \nInggris pada kulit m uka dan kulit  dalam  (Lampiran 1 ) \nb. Hala man pengesahan ( Lampiran 2 ) \nc. Abstrak atau  uraian singkat dalam  bahasa Indonesia dan  \nbahasa Inggris ( Lampiran 3 ) \nd. Kata pengantar \ne. Daftar isi \nf. Daftar gam bar, grafik, diag ram \ng. Daftar tabel \nh. Daftar si mbol \n \n2. Bagian ‘Inti/Pokok’ atau ‘Batang Tubuh’ berisi :  \n a. Pendahuluan  \n• Latar belakan g masalah \n• Rumusan Per masalahan  \n• Batasan m asalah/ruang lingkup \n• Tujuan  \n• Manfaat (bila diperlukan untuk ditulis) \nb. Tinjauan Pustaka \n• Hasil peneliti an terdahulu yang relevan \n• Teori yang akan digunakan untuk meny elesaikan  \npermasalahan   \nc. Metodolog i  \n• Metode y ang digunakan \n• Bahan dan perala tan y ang digunakan \n• Urutan pelaksanaan percobaan'
 'tersebut menggunakan karakteristik  huruf y ang sama dengan bagian \nhalam an yang lain (bukan  huruf tim bul atau warna). \n Judul Tugas Akhir harus diketik seluru hnya dengan huruf-h uruf \nbesar dan tidak boleh disingkat, kecuali singkatan yang sudah baku.  \n Nama penulis harus ditulis dengan huruf besar dan tidak \ndisingkat.   \n \n3.4. Hala man Pen gesahan  \n Hala man pengesahan diletakkan pada hala man sesud ah hala man \njudul.  \n Hala man pengesahan berisi : tulisan ”LEMBA R \nPENGESAHAN”, judul Tugas Ak hir; tujuan ddiiaajjuukkaannnnyyaa  TTAA,,  \nppeerrsseettuujjuuaann  ppeemmbbiimmbbiinngg  ((ddaappaatt  lleebbiihh  ddaarrii  ssaattuu)),,  nnaammaa--nnaammaa  \nppeemmbbiimmbbiinngg,,  kkoottaa,,  bbuullaann  ddaann    ttaahhuunn  ppeennggeessaahhaann..  Halam an ini sel alu \ndiketik dala m huruf-huruf besar, tepat di tengah-tengah halaman  \nsimetri kiri-kanan. Contoh halaman pengesahan pada la mpiran 2. \n \n3.5. Halaman Abstrak'
 'THE TITLE OF THE FINAL PROJECT IS WRITTEN BRIEFLY, CLEARLY AND\n                  DESCRIBING THE MAIN THEME\n\n\n\n                               FINAL PROJECT\n                    Submitted to fulfill one of the requirements\n                    for obtaining a degree <name of degree> at\n             Undergraduate Study Program of <name of Study Program>\n                      Department of <name of Department>\n                          Faculty of <name of Faculty>\n                       Institut Teknologi Sepuluh Nopember\n\n\n\n                          By: <NAME OF STUDENT>\n                              NRP. <XXXXXXXX>\n\n\n\n                    Approved by Final Project Examiner Team:\n\n\n1. Name of Advisor and academic title                      Advisor\n\n\n2. Name of Co-Advisor/Examiner and academic title          Co-Advisor\n\n\n3. Name of Examiner and academic title                     Examiner\n\n\n4. Name of Examiner and academic title                     Examiner'
 'Oleh : <NAMA MAHASISWA>\n                             NRP. <XXXXXXXX>\n\n\n\n                    Disetujui oleh Tim Penguji Tugas Akhir :\n\n\n1. Nama dan gelar pembimbing                            Pembimbing\n\n\n2. Nama dan gelar ko-pembimbing/penguji                 Ko-pembimbing\n\n\n3. Nama dan gelar penguji                               Penguji\n\n\n4. Nama dan gelar penguji                               Penguji\n\n\n5. Nama dan gelar penguji                               Penguji\n\n\n                                 SURABAYA\n                                 Bulan, Tahun\n\n\n\n                                                                        33\n\x0c                              APPROVAL SHEET\n\n\n\nTHE TITLE OF THE FINAL PROJECT IS WRITTEN BRIEFLY, CLEARLY AND\n                  DESCRIBING THE MAIN THEME']",Penelitian atau perancangan yang terdiri dari proposal tugas akhir dan laporan tugas akhir,0.8333333332916666,1.0,0.9160949754366355,0.0
11,Apa isi bagian ‘Awal’ laporan tugas akhir?,"Bagian 'Awal' dari laporan tugas akhir terdiri dari:
1. Judul Tugas Akhir dalam bahasa Indonesia dan bahasa Inggris pada kulit muka dan kulit dalam
2. Halaman pengesahan
3. Abstrak atau uraian singkat dalam bahasa Indonesia dan bahasa Inggris
4. Kata pengantar
5. Daftar isi
6. Daftar gambar, grafik, diagram
7. Daftar tabel
8. Daftar simbol","['lembar Judul Tugas Akhir.  \n \ni. Berbagai tingkatan judul bab \n- Bab dan Judul bab : diket ik dengan huruf besar sem ua \npada halam an baru denga n jara k seim bang dari tepi  kiri \ndan kanan (c enter), dan d itebalkan. Nom or bab ditulis \ndalam  huruf Romawi; judul bab di tulis pada b aris \nberikutn ya. \n-       Su b-jud ul : huruf-h uruf pertama setiap kata, kecuali \nkata sa mbung, ditulis dengan huruf besar yang \nditebalkan da n diletakkan mulai dari tepi kiri.  \n-       Anak su b-judul : ditulis mulai dari tepi sebelah kiri dan  \nditebalkan. Huruf pertama dari anak sub-ju dul ditulis  \ndengan huruf besar. \n-       Jika masih ada judul dalam  tingkatan yang lebih \nrendah, dituli s seperti pada c. \n  \nj. Acuan dan Daftar Acuan. \n Semua sumber pustaka yang diacu secara langsung harus \ndicantum kan. Cara menyebutkan sum ber ialah  dengan \nmenuliskan nam a pengarang dan tahun publi kasi didalam  \nkurung. Untuk kutipan yang diam bil tidak secara la ngsung'
 'tersebut menggunakan karakteristik  huruf y ang sama dengan bagian \nhalam an yang lain (bukan  huruf tim bul atau warna). \n Judul Tugas Akhir harus diketik seluru hnya dengan huruf-h uruf \nbesar dan tidak boleh disingkat, kecuali singkatan yang sudah baku.  \n Nama penulis harus ditulis dengan huruf besar dan tidak \ndisingkat.   \n \n3.4. Hala man Pen gesahan  \n Hala man pengesahan diletakkan pada hala man sesud ah hala man \njudul.  \n Hala man pengesahan berisi : tulisan ”LEMBA R \nPENGESAHAN”, judul Tugas Ak hir; tujuan ddiiaajjuukkaannnnyyaa  TTAA,,  \nppeerrsseettuujjuuaann  ppeemmbbiimmbbiinngg  ((ddaappaatt  lleebbiihh  ddaarrii  ssaattuu)),,  nnaammaa--nnaammaa  \nppeemmbbiimmbbiinngg,,  kkoottaa,,  bbuullaann  ddaann    ttaahhuunn  ppeennggeessaahhaann..  Halam an ini sel alu \ndiketik dala m huruf-huruf besar, tepat di tengah-tengah halaman  \nsimetri kiri-kanan. Contoh halaman pengesahan pada la mpiran 2. \n \n3.5. Halaman Abstrak'
 '6 BAB III  \nLAPORAN TUGAS AKHIR \n \n3.1. Sistem atika \n Siste matika l aporan Tugas Akhir terdiri atas  tiga ba gian besar, \nyaitu : \n \n1. Bagian ’Awal’ terdiri dari: \na. Judul Tu gas Akhir dala m bahasa In donesia dan  bahasa \nInggris pada kulit m uka dan kulit  dalam  (Lampiran 1 ) \nb. Hala man pengesahan ( Lampiran 2 ) \nc. Abstrak atau  uraian singkat dalam  bahasa Indonesia dan  \nbahasa Inggris ( Lampiran 3 ) \nd. Kata pengantar \ne. Daftar isi \nf. Daftar gam bar, grafik, diag ram \ng. Daftar tabel \nh. Daftar si mbol \n \n2. Bagian ‘Inti/Pokok’ atau ‘Batang Tubuh’ berisi :  \n a. Pendahuluan  \n• Latar belakan g masalah \n• Rumusan Per masalahan  \n• Batasan m asalah/ruang lingkup \n• Tujuan  \n• Manfaat (bila diperlukan untuk ditulis) \nb. Tinjauan Pustaka \n• Hasil peneliti an terdahulu yang relevan \n• Teori yang akan digunakan untuk meny elesaikan  \npermasalahan   \nc. Metodolog i  \n• Metode y ang digunakan \n• Bahan dan perala tan y ang digunakan \n• Urutan pelaksanaan percobaan'
 'Oleh : <NAMA MAHASISWA>\n                             NRP. <XXXXXXXX>\n\n\n\n                    Disetujui oleh Tim Penguji Tugas Akhir :\n\n\n1. Nama dan gelar pembimbing                            Pembimbing\n\n\n2. Nama dan gelar ko-pembimbing/penguji                 Ko-pembimbing\n\n\n3. Nama dan gelar penguji                               Penguji\n\n\n4. Nama dan gelar penguji                               Penguji\n\n\n5. Nama dan gelar penguji                               Penguji\n\n\n                                 SURABAYA\n                                 Bulan, Tahun\n\n\n\n                                                                        33\n\x0c                              APPROVAL SHEET\n\n\n\nTHE TITLE OF THE FINAL PROJECT IS WRITTEN BRIEFLY, CLEARLY AND\n                  DESCRIBING THE MAIN THEME']","Judul Tugas Akhir, Halaman pengesahan, Abstrak, Kata pengantar, Daftar isi, Daftar gambar, grafik, diagram, Daftar tabel, Daftar simbol",0.999999999975,0.8888888888888888,0.9039244281692987,1.0
12,Apa yang harus ada dalam halaman abstrak laporan tugas akhir?,"Dalam halaman abstrak laporan tugas akhir, biasanya harus mencakup ringkasan singkat dari isi laporan tugas akhir, termasuk tujuan penelitian, metode yang digunakan, temuan utama, dan kesimpulan yang diambil. Abstrak juga harus mencakup informasi tentang topik penelitian dan kontribusi penelitian tersebut terhadap bidang studi yang relevan.","['Oleh : <NAMA MAHASISWA>\n                             NRP. <XXXXXXXX>\n\n\n\n                    Disetujui oleh Tim Penguji Tugas Akhir :\n\n\n1. Nama dan gelar pembimbing                            Pembimbing\n\n\n2. Nama dan gelar ko-pembimbing/penguji                 Ko-pembimbing\n\n\n3. Nama dan gelar penguji                               Penguji\n\n\n4. Nama dan gelar penguji                               Penguji\n\n\n5. Nama dan gelar penguji                               Penguji\n\n\n                                 SURABAYA\n                                 Bulan, Tahun\n\n\n\n                                                                        33\n\x0c                              APPROVAL SHEET\n\n\n\nTHE TITLE OF THE FINAL PROJECT IS WRITTEN BRIEFLY, CLEARLY AND\n                  DESCRIBING THE MAIN THEME'
 'THE TITLE OF THE FINAL PROJECT IS WRITTEN BRIEFLY, CLEARLY AND\n                  DESCRIBING THE MAIN THEME\n\n\n\n                               FINAL PROJECT\n                    Submitted to fulfill one of the requirements\n                    for obtaining a degree <name of degree> at\n             Undergraduate Study Program of <name of Study Program>\n                      Department of <name of Department>\n                          Faculty of <name of Faculty>\n                       Institut Teknologi Sepuluh Nopember\n\n\n\n                          By: <NAME OF STUDENT>\n                              NRP. <XXXXXXXX>\n\n\n\n                    Approved by Final Project Examiner Team:\n\n\n1. Name of Advisor and academic title                      Advisor\n\n\n2. Name of Co-Advisor/Examiner and academic title          Co-Advisor\n\n\n3. Name of Examiner and academic title                     Examiner\n\n\n4. Name of Examiner and academic title                     Examiner'
 '1. Nama dan gelar pembimbing                             Pembimbing\n\n\n2. Nama dan gelar ko-pembimbing/penguji                  Ko-pembimbing\n\n\n3. Nama dan gelar penguji                                Penguji\n\n\n4. Nama dan gelar penguji                                Penguji\n\n\n5. Nama dan gelar penguji                                Penguji\n\n\n\n                                  SURABAYA\n                                  Bulan, Tahun\n\n                                                                         25\n\x0c                              APPROVAL SHEET\n\n\n\n  THE TITLE OF THE FINAL PROJECT PROPOSAL IS WRITTEN BRIEFLY,\n            CLEARLY AND DESCRIBING THE MAIN THEME'
 '24\n\x0cLAMPIRAN 2: Contoh Halaman Pengesahan Proposal Tugas Akhir\n\n                         LEMBAR PENGESAHAN\n\n      JUDUL PROPOSAL TUGAS AKHIR DITULIS SINGKAT JELAS DAN\n                 MENGGAMBARKAN TEMA POKOK\n\n\n                         PROPOSAL TUGAS AKHIR\n                    Diajukan untuk memenuhi salah satu syarat\n                      memperoleh gelar <Nama Gelar> pada\n                    Program Studi S-1 <Nama Program Studi>\n                        Departemen <Nama Departemen>\n                            Fakultas <Nama Fakultas>\n                       Institut Teknologi Sepuluh Nopember\n\n\n\n                        Oleh : <NAMA MAHASISWA>\n                              NRP. <XXXXXXXX>\n\n\n\n                 Disetujui oleh Tim Penguji Proposal Tugas Akhir :\n\n\n1. Nama dan gelar pembimbing                             Pembimbing\n\n\n2. Nama dan gelar ko-pembimbing/penguji                  Ko-pembimbing']","Judul, nama penulis, NRP, nama pembimbing, abstrak, kata kunci, ditulis dalam bahasa Inggris dan Indonesia",0.9999999999666667,1.0,0.9173755606173332,0.0
13,Bagaimana cara login ke MONTA?,"Untuk login ke MONTA, mahasiswa perlu melakukan langkah-langkah berikut:
1. Buka situs MONTA di monta.if.its.ac.id
2. Login menggunakan default username dan password, yang biasanya adalah NRP.
3. Setelah login berhasil, mahasiswa akan masuk ke halaman mahasiswa.","['SOP (Guidelines) Mahasiswa\n\n\nBerikut merupakan guidelines penggunaan MONTA untuk mahasiswa:\n\n\n\uf076 Login ke MONTA (monta.if.its.ac.id)\n   1. Melakukan login terlebih dahulu (default username dan password adalah NRP).\n\n\n\n\n   2. Setelah login, maka akan masuk ke halaman mahasiswa.'
 'KEMENTERIAN PENDIDIKAN, KEBUDAYAAN, RISET, DAN TEKNOLOGI INSTITUT TEKNOLOGI SEPULUH NOPEMBER\nKampus ITS Sukolilo Surabaya 60111\nTelepon: 031-5994251-54, 5947274, 5945472 (Hunting)\nFax: 031-5947264, 5950806\nhttp://www.its.ac.id\n4. Calon wisudawan diwajibkan login ke Aplikasi Wisuda (https://wisuda.dwpits.id)\nmenggunakan akun alumni yang didapatkan dari pendaftaran di myITS Alumni\n(https://alumni.its.ac.id).\nD. KEGIATAN LAIN :\n1. Pengambilan Gordon, Toga dan Pemesanan Foto Prosesi serta Undangan di gedung\nDharma Wanita Persatuan ITS sesuai dengan jadwal sebagai berikut:\n- Magister dan Doktor:\nMenyerahkan bukti slip pembayaran wisuda dan slip sewa toga dari bank.\n- Sarjana dan Sarjana Terapan:\nMenunjukkan identitas diri dan menyerahkan bukti pembayaran/slip sewa toga dari bank.\n- Pemesanan Foto Prosesi (tidak wajib)\n- Undangan Wisuda untuk orang tua:\nUndangan untuk orang tua/pendamping wisudawan diambil bersamaan dengan\npengambilan toga'
 '1. Langkah awal sebelum mengisikan data proposal TA ke MONTA, mahasiswa wajib berdiskusi\n      terlebih dahulu dengan calon dosen pembimbing perihal topik TA yang ingin dikerjakan sambil\n      bimbingan dalam penyusunan draft proposal TA.\n\n   2. Setelah topik dan draft proposal TA sudah disetujui, mahasiswa melakukan pendaftaran proposal\n      TA ke sistem dengan memilih menu Proposal TA –> Buat Proposal serta mengunggah file draft\n      proposal yang sudah disepakati pembimbing.\n      Setelah mengisi semua isian form maka memilih tombol Buat Proposal Baru.\n\n\n\n\n   3. Setelah mendaftarkan proposal, mahasiswa dapat mencetak cover proposal TA dengan memilih\n      menu Cetak Cover –> Cetak Cover Proposal TA.\n\n\n\n\n   4. Mahasiswa wajib menyerahkan kepada koordinator TA/Ketua RMK, hardcopy proposal TA\n      lengkap dengan cover proposal yang dicetak dari MONTA dan sudah disetujui/ditandatangani\n      oleh dosen pembimbing.'
 '6. Apabila memerlukan informasi lebih lanjut dapat menghubungi dirpendikcare@its.ac.id atau di\ncall centre pada hari dan jam kerja melalui no (WA Text Only) 085186819604, 085186819605.\nB. Bagi semua calon wisudawan (Sarjana dan Sarjana Terapan) wajib menghadap dosen wali untuk persetujuan SKEM, serta wajib melakukan pengajuan SKPI di studentconnect paling lambat tanggal 9 Februari 2024;\nC. Ijazah dicetak berdasarkan data preview yang dipermanen oleh calon wisudawan. Ijazah dicetak hanya sekali saja, bila ada kekeliruan pengisian data pada point 3 maka akan diterbitkan surat keterangan.\nD.Pelaksanaan wisuda akan dilaksanakan secara offline (Informasi mengenai gladi bersih disampaikan lebih lanjut.\n Atas perhatian dan kerjasama yang diberikan, kami sampaikan terima kasih.\n Powered by TCPDF (www.tcpdf.org)\nTembusan Yth :\n1. Rektor ITS\n2. Kepala Bagian Administrasi Umum dan Kearsipan Digital 3. Sekretaris Institut\nSurabaya, 09 Januari 2024\nWakil Rektor Bidang Akademik dan Kemahasiswaan,']",Melakukan login dengan default username dan password adalah NRP ke monta.if.its.ac.id,0.9999999999666667,1.0,0.948095876784326,1.0
14,Apa yang dilakukan setelah topik dan draft proposal TA sudah disetujui?,"Setelah topik dan draft proposal TA sudah disetujui, langkah selanjutnya adalah mahasiswa melakukan pendaftaran proposal TA ke sistem dengan memilih menu Proposal TA –> Buat Proposal serta mengunggah file draft proposal yang sudah disepakati pembimbing. Setelah mengisi semua isian form maka memilih tombol Buat Proposal Baru. Setelah mendaftarkan proposal, mahasiswa dapat mencetak cover proposal TA dengan memilih menu Cetak Cover –> Cetak Cover Proposal TA. Selanjutnya, mahasiswa wajib menyerahkan kepada koordinator TA/Ketua RMK, hardcopy proposal TA lengkap dengan cover proposal yang dicetak dari MONTA dan sudah disetujui/ditandatangani oleh dosen pembimbing.","['5. Setelah semua proses diatas sudah dilakukan dengan benar, maka mahasiswa tinggal menunggu\n      perubahan status proposal TA-nya via MONTA (Mendaftar \uf0e0 Tunggu Sidang Proposal \uf0e0 OK/\n      Revisi/ Ditolak). Bagi mahasiswa yang status proposalnya OK, maka bisa segera melakukan\n      bimbingan ke dosen pembimbing. Sedangkan bagi proposalnya berstatus Revisi/Ditolak, harap\n      menghadap ke koordinator TA/Ketua RMK untuk mengambil hardcopy proposal dan menanyakan\n      keterangan lebih detail tenang status proposalnya.\n\x0c\uf076 Bimbingan TA\n\n  1. Setelah proposal TA mahasiswa berstatus “OK”, maka proses bimbingan TA bisa mulai dilakukan\n     baik secara online maupun offline. Untuk bimbingan online, mahasiswa mengisi kegiatan\n     bimbingan dengan memilih menu Progres TA, kemudian memilih menu Bimbingan Baru.\n\n\n\n\n  2. Berikut merupakan halaman bimbingan baru untuk diisikan item/catatan yang dijadikan topik\n     bimbingan.'
 'telah menyelesaikan revisi\nsidang proposal tesis dan\nmenginfokan ke Kaprodi\nMeng-update status sidang\nproposal tesis di MonT esMeng-upload lembar revisi sidang\nproposal tesis dan buku proposal\ntesis yang dilengkapi dengan\nlembar pengesahan yang sudah\ntertandatanganiLembar revisi dan\nlembar pengesahan yang\ntelah tertandatanganiData peserta sidang\nproposal tesis\nLembar revisi sidang\nproposal tesis  Usulan jadwal dan\npenguji sidang\nproposal tesis  \nLembar revisi dan\nlembar pengesahanSIDANG PROPOSAL TESIS (IF -185301) PROGRAM STUDI S2 TEKNIK \nINFORMATIKA, DEPARTEMEN TEKNIK INFORMATIKA, FT -EIC ITS  \n(SISTEM ONLINE ) \n \n1. Dalam satu semester, terdapat dua kali siding proposal tesis, yaitu minggu ke -5 – minggu \nke-6 dan minggu ke -17 – minggu  ke-18. \n2. Admin Akademik Pascasarjana  menginfokan jadwal, persyaratan, dan link Google Form \npendaftaran sidang proposal tesis melalui MonTes dan grup whatsapp.  \n3. Mahasiswa yang ingin mendaftar sidang proposal tesis, harus melengkapi berkas'
 'Jika TA expired atau jika pembimbing dan atau RMK ganti, maka mesti mengajukan proposal TA ulang dan mengambil Pra-TA lagi.\n\nQ : Setelah sidang, apa yang perlu dilakukan?\n\nA : 1. menyelesaikan revisi (jika ada)\n2. mendapatkan persetujuan dari penguji thdp revisi yang diberikan. Persetujuan bisa dengan menggunakan form revisi/email. Form ada di Pak Yudi Mulyono. Form ini disimpan mahasiswa, tidak wajib untuk dikirim ke dosenpenguji/pembimbing/sekdep 1\n3. mengkompilasi buku versi terakhir\n4. memenuhi persyaratan yudisium\n5. mengisi data wisudawan\n\nQ : Bagaimana follow Up setelah sidang TA?\n\nA : 1. mahasiswa mengerjakan revisi (jika ada)\n2. mahasiswa mengumpulkan persetujuan revisi dari penguji (menggunakan ttd digital atau email)\n3. mahasiswa memenuhi persyaratan-persyaratan yudisium.\n \n\nQ : Berapa lama waktu revisi TA setelah sidang?'
 '1. Langkah awal sebelum mengisikan data proposal TA ke MONTA, mahasiswa wajib berdiskusi\n      terlebih dahulu dengan calon dosen pembimbing perihal topik TA yang ingin dikerjakan sambil\n      bimbingan dalam penyusunan draft proposal TA.\n\n   2. Setelah topik dan draft proposal TA sudah disetujui, mahasiswa melakukan pendaftaran proposal\n      TA ke sistem dengan memilih menu Proposal TA –> Buat Proposal serta mengunggah file draft\n      proposal yang sudah disepakati pembimbing.\n      Setelah mengisi semua isian form maka memilih tombol Buat Proposal Baru.\n\n\n\n\n   3. Setelah mendaftarkan proposal, mahasiswa dapat mencetak cover proposal TA dengan memilih\n      menu Cetak Cover –> Cetak Cover Proposal TA.\n\n\n\n\n   4. Mahasiswa wajib menyerahkan kepada koordinator TA/Ketua RMK, hardcopy proposal TA\n      lengkap dengan cover proposal yang dicetak dari MONTA dan sudah disetujui/ditandatangani\n      oleh dosen pembimbing.']",Melakukan pendaftaran proposal TA ke sistem MONTA dan mengunggah file draft proposal yang sudah disepakati pembimbing,0.9166666666361111,0.8333333333333334,0.8539193485443518,1.0
15,Dimana mahasiswa dapat mencetak cover proposal TA?,Mahasiswa dapat mencetak cover proposal TA dengan memilih menu Cetak Cover -&gt; Cetak Cover Proposal TA.,"['1. Langkah awal sebelum mengisikan data proposal TA ke MONTA, mahasiswa wajib berdiskusi\n      terlebih dahulu dengan calon dosen pembimbing perihal topik TA yang ingin dikerjakan sambil\n      bimbingan dalam penyusunan draft proposal TA.\n\n   2. Setelah topik dan draft proposal TA sudah disetujui, mahasiswa melakukan pendaftaran proposal\n      TA ke sistem dengan memilih menu Proposal TA –> Buat Proposal serta mengunggah file draft\n      proposal yang sudah disepakati pembimbing.\n      Setelah mengisi semua isian form maka memilih tombol Buat Proposal Baru.\n\n\n\n\n   3. Setelah mendaftarkan proposal, mahasiswa dapat mencetak cover proposal TA dengan memilih\n      menu Cetak Cover –> Cetak Cover Proposal TA.\n\n\n\n\n   4. Mahasiswa wajib menyerahkan kepada koordinator TA/Ketua RMK, hardcopy proposal TA\n      lengkap dengan cover proposal yang dicetak dari MONTA dan sudah disetujui/ditandatangani\n      oleh dosen pembimbing.'
 'www.its.ac.id INSTITUT TEKNOLOGI SEPULUH NOPEMBER, Surabaya - Indonesia\n\nPemesanan Cetak Buku TA di myITS Printing\n\nSubdit. Aplikasi dan Platform Digital\nDirektorat Pengembangan Teknologi dan Sistem Informasi\n30 Juli 2020\n\nTata Cara Pemesanan\n\nMengunggah file buku TA yang sudah ditandatangani pembimbing ke repository.its.ac.id dan mencatat Eprint ID.\nMenunggu validasi buku TA 1x24 jam (hari kerja).\nMembuka my.its.ac.id dan memilih aplikasi myITS Printing.\nMemilih layanan Cetak Buku TA.\nMemasukkan Eprint ID.\nMemasukkan ukuran buku, opsi warna, opsi jilid sampul, dan jumlah buku.\nMelihat harga total dan melakukan pembayaran dengan cara transfer ke Virtual Account BNI.\nSelesai (mahasiswa dapat memantau status pencetakan di menu Daftar Pesanan Saya).\nMelihat Eprint ID terpublikasi\n\nMembuka laman repository.its.ac.id.\nMemilih menu Latest Addition.\nMencari publikasi yang sesuai.\nEprint ID:\n88888\n\nEprint ID berbeda-beda untuk setiap mahasiswa. Jangan menggunakan Eprint ID orang lain.'
 '2. Berikut merupakan halaman bimbingan baru untuk diisikan item/catatan yang dijadikan topik\n     bimbingan.\n\n\n\n\n  3. Setelah selesai mengisi kartu bimbingan, maka akan kembali ke halaman progres Tugas Akhir\n     mahasiswa. Bimbingan TA dilakukan/dientri minimal sebanyak 8 kali. Jika kurang dari 8, maka\n     mahasiswa tersebut tidak dapat dijadwalkan untuk mengikuti sidang TA.\n\x0c\uf076 Mendaftar Sidang TA\n\n   1. Untuk mengikuti sidang TA, mahasiswa dapat mencetak cover persetujuan maju sidang pada\n      menu Cetak Cover –> Cetak Persetujuan Maju Sidang.\n\n\n\n\n   2. Form Persetujuan Maju Sidang yang sudah ditandatangani oleh dosen pembimbing, diserahkan\n      ke coordinator TA/ketua RMK untuk kemudian dijadwalkan untuk mengikuti sidang TA.\n      Mahasiswa dapat memonitor perubahan status TA dan jadwal TA via MONTA.'
 '5. Setelah semua proses diatas sudah dilakukan dengan benar, maka mahasiswa tinggal menunggu\n      perubahan status proposal TA-nya via MONTA (Mendaftar \uf0e0 Tunggu Sidang Proposal \uf0e0 OK/\n      Revisi/ Ditolak). Bagi mahasiswa yang status proposalnya OK, maka bisa segera melakukan\n      bimbingan ke dosen pembimbing. Sedangkan bagi proposalnya berstatus Revisi/Ditolak, harap\n      menghadap ke koordinator TA/Ketua RMK untuk mengambil hardcopy proposal dan menanyakan\n      keterangan lebih detail tenang status proposalnya.\n\x0c\uf076 Bimbingan TA\n\n  1. Setelah proposal TA mahasiswa berstatus “OK”, maka proses bimbingan TA bisa mulai dilakukan\n     baik secara online maupun offline. Untuk bimbingan online, mahasiswa mengisi kegiatan\n     bimbingan dengan memilih menu Progres TA, kemudian memilih menu Bimbingan Baru.\n\n\n\n\n  2. Berikut merupakan halaman bimbingan baru untuk diisikan item/catatan yang dijadikan topik\n     bimbingan.']",Menu Cetak Cover –> Cetak Cover Proposal TA di MONTA,0.999999999975,0.6666666666666666,0.9788546408623744,1.0
16,Konten apa saja yang harus ada dalam video Tugas Akhir?,"Dalam video Tugas Akhir, konten yang harus ada meliputi:
1. Judul Tugas Akhir yang ditulis dengan huruf besar dan tidak boleh disingkat.
2. Nama penulis Tugas Akhir yang ditulis dengan huruf besar dan tidak disingkat.
3. Halaman pengesahan yang berisi ""LEMBAR PENGESAHAN"", judul Tugas Akhir, tujuan, pembimbing, ko-pembimbing, kota, bulan, dan tahun pengesahan.
4. Halaman abstrak yang menjelaskan secara singkat isi dari Tugas Akhir.
5. Halaman judul Tugas Akhir dalam Bahasa Indonesia.
6. Halaman judul Tugas Akhir dalam Bahasa Inggris.
7. Contoh halaman pengesahan proposal Tugas Akhir.

Semua konten tersebut harus disusun dengan rapi dan sesuai dengan pedoman yang berlaku.","['Oleh : <NAMA MAHASISWA>\n                             NRP. <XXXXXXXX>\n\n\n\n                    Disetujui oleh Tim Penguji Tugas Akhir :\n\n\n1. Nama dan gelar pembimbing                            Pembimbing\n\n\n2. Nama dan gelar ko-pembimbing/penguji                 Ko-pembimbing\n\n\n3. Nama dan gelar penguji                               Penguji\n\n\n4. Nama dan gelar penguji                               Penguji\n\n\n5. Nama dan gelar penguji                               Penguji\n\n\n                                 SURABAYA\n                                 Bulan, Tahun\n\n\n\n                                                                        33\n\x0c                              APPROVAL SHEET\n\n\n\nTHE TITLE OF THE FINAL PROJECT IS WRITTEN BRIEFLY, CLEARLY AND\n                  DESCRIBING THE MAIN THEME'
 'tersebut menggunakan karakteristik  huruf y ang sama dengan bagian \nhalam an yang lain (bukan  huruf tim bul atau warna). \n Judul Tugas Akhir harus diketik seluru hnya dengan huruf-h uruf \nbesar dan tidak boleh disingkat, kecuali singkatan yang sudah baku.  \n Nama penulis harus ditulis dengan huruf besar dan tidak \ndisingkat.   \n \n3.4. Hala man Pen gesahan  \n Hala man pengesahan diletakkan pada hala man sesud ah hala man \njudul.  \n Hala man pengesahan berisi : tulisan ”LEMBA R \nPENGESAHAN”, judul Tugas Ak hir; tujuan ddiiaajjuukkaannnnyyaa  TTAA,,  \nppeerrsseettuujjuuaann  ppeemmbbiimmbbiinngg  ((ddaappaatt  lleebbiihh  ddaarrii  ssaattuu)),,  nnaammaa--nnaammaa  \nppeemmbbiimmbbiinngg,,  kkoottaa,,  bbuullaann  ddaann    ttaahhuunn  ppeennggeessaahhaann..  Halam an ini sel alu \ndiketik dala m huruf-huruf besar, tepat di tengah-tengah halaman  \nsimetri kiri-kanan. Contoh halaman pengesahan pada la mpiran 2. \n \n3.5. Halaman Abstrak'
 '24\n\x0cLAMPIRAN 2: Contoh Halaman Pengesahan Proposal Tugas Akhir\n\n                         LEMBAR PENGESAHAN\n\n      JUDUL PROPOSAL TUGAS AKHIR DITULIS SINGKAT JELAS DAN\n                 MENGGAMBARKAN TEMA POKOK\n\n\n                         PROPOSAL TUGAS AKHIR\n                    Diajukan untuk memenuhi salah satu syarat\n                      memperoleh gelar <Nama Gelar> pada\n                    Program Studi S-1 <Nama Program Studi>\n                        Departemen <Nama Departemen>\n                            Fakultas <Nama Fakultas>\n                       Institut Teknologi Sepuluh Nopember\n\n\n\n                        Oleh : <NAMA MAHASISWA>\n                              NRP. <XXXXXXXX>\n\n\n\n                 Disetujui oleh Tim Penguji Proposal Tugas Akhir :\n\n\n1. Nama dan gelar pembimbing                             Pembimbing\n\n\n2. Nama dan gelar ko-pembimbing/penguji                  Ko-pembimbing'
 '30\n\x0cLAMPIRAN 7: Contoh Halaman Judul Tugas Akhir Bahasa Indonesia\n\n\n\n\n                                                                31\n\x0cLAMPIRAN 8: Contoh Halaman Judul Tugas Akhir Bahasa Inggris\n\n\n\n\n                                                              32\n\x0cLAMPIRAN 9: Contoh Halaman Pengesahan Tugas Akhir\n\n                        LEMBAR PENGESAHAN\n\n  JUDUL TUGAS AKHIR DITULIS SINGKAT JELAS DAN MENGGAMBARKAN\n                          TEMA POKOK\n\n\n                                TUGAS AKHIR\n                    Diajukan untuk memenuhi salah satu syarat\n                      memperoleh gelar <Nama Gelar> pada\n                    Program Studi S-1 <Nama Program Studi>\n                        Departemen <Nama Departemen>\n                            Fakultas <Nama Fakultas>\n                      Institut Teknologi Sepuluh Nopember']","Logo ITS, Judul Tugas Akhir, Data Pembuat dan Pembimbing, Deskripsi singkat Tugas Akhir, Cara jalannya aplikasi",0.99999999995,0.625,0.9834174836112437,0.0
17,Bagaimana cara pengecekan file yang telah terunggah di POmITS?,"Untuk melakukan pengecekan file yang telah terunggah di POmITS, Anda dapat mengakses link berikut: http://lpmp2ki.its.ac.id/pomits. Pada link tersebut, Anda dapat melihat apakah file yang Anda unggah telah terverifikasi atau belum. Jika terdapat penghapusan atau penarikan artikel, Anda dapat mengisi form pada link yang sesuai dengan jenis jurnal, yaitu http://bit.ly/FHAJTeknikITS untuk Jurnal Teknik ITS, http://bit.ly/FHAJSainsSeniITS untuk Jurnal Sains & Seni ITS, dan http://bit.ly/FHAJRepositoryITS untuk Repository. Selain itu, Anda juga dapat melihat daftar data artikel yang terhapus pada website jurnal yang diupdate setiap 3 hari. Jika artikel tidak memenuhi ketentuan publikasi, seperti gaya penulisan yang tidak sesuai format atau file pendukung yang tidak lengkap, artikel tersebut tidak akan dipublikasikan di Jurnal POmITS. Periode unggah artikel untuk yudisium tertentu juga telah ditentukan, seperti contohnya periode unggah artikel untuk yudisium 122 adalah sampai dengan 7 Agustus 2020 pukul 24.00 WIB.","['\uf0b7   Pengecekan file yang TERUNGGAH dapat dilihat di\n    http://lpmp2ki.its.ac.id/pomits.\n\n\uf0b7   Jika terdapat penghapusan/penarikan artikel, dapat mengisi form pada link\n    \uf031\uf02e http://bit.ly/FHAJTeknikITS, untuk Jurnal Teknik ITS;\n    \uf032\uf02e http://bit.ly/FHAJSainsSeniITS, untuk Jurnal Sains &Seni ITS;\n    \uf033\uf02e http://bit.ly/FHAJRepositoryITS, untuk Repository.\n\n\n\uf0b7   List data Artikel terhapus dapat dilihat pada website jurnal.\n    (http://ejurnal.its.ac.id, yang diupdate tiap 3 hari)\n\n\uf0b7   Artikel - artikel yang TIDAK MEMENUHI KETENTUAN PUBLIKASI (gaya selingkung tidak\n    sesuai format dan file pendukung tidak lengkap) tidak akan DIPUBLIKASIKAN di\n    Jurnal POMITS.\n\n\uf0b7   Periode unggah artikel untuk yudisium 122 adalah sampai dengan\n    7 Agustus 2020, pukul 24.00 WIB'
 ""melakukan UNGGAH di Jurnal Repository, menggunakan login 'mahasiswa', dengan.\nkata sandi 'M4h4sisw4lTs!' ke alamat 'https://ejurnal.its.ac.id/index.php/index/login'\ndengan mengunggah file artikel dan file Form Telaah(dalam format pdf) saja.\nPengecekan file vang TERuNGGAH dapat dilihat di\nhttps://lpmp2ki.its.ac.id/pomits.\nJika terdapat penghapusan/penarikan artikel, dapat mengisi form pada link :\nhttps://its.id/FHAJTeknikITSPOMITS, untuk Jurnal Teknik ITS;\n1.-\nhttps:/l/its.id/FHAJSainsSenilTSPOMITS, untuk Jurnal Sains &Seni ITS;\n3.https://its.id/FHAJRepositorylTSPOMITS, untuk Jurnal Repository..\n Penghapusan Artikel akan dilakukan setelah yudisium berakhir.\nArtikel - artikel yang TIDAK MEMENUHI KETENTUAN PUBLIKASI (gaya selingkung\ntidak sesuai format dan file pendukung tidak lengkap) tidak akan DIPUBLIKASIKAN\ndi Jurnal Teknik ITS dan Jurnal Sains & Seni ITS.\nPeriode unggah artikel untuk yudisium 29 adalah sampai dengan \n15 Februari 2024 pukul 24.00 WIB""
 'Pemberitahuan\nUnggah Artikel POmITS\nUNGGAH artikel WAJIB dilakukan oleh MAHASISWA PENDAFTAR YUDISIUM 129\n Mahasiswa yang Dosen Pembimbingnya memilih untuk MEMpuBLIKAsIKAN\nartikelnya pada Jurnal POmITS, dapat melakukan UNGGAH, dengan mengikuti langkah\npada BUKU PANDUAN TATA CARA UNGGAH. File yang HARUS DIUNGGAH adalah\n(ukuran masing-masing file tidak boleh lebih dari 2 MB):\nArtikel hasil dari Tugas Akhir, dalam format Ms. Word yang telah mengikuti tem-\n1.\nplate. (selain format Ms.Word artikel DITOLAK/REJECTED)\nFormulir Hak Cipta, dalam format PDF.\nForm Telaah Artikel POmITs, dalam format PDF.\nForm Revisi/Perbaikan/Penyempurnaan TA yang berisi nama penguji beserta\ntidak hanya TTD saja)\n Template, Formulir Hak Cipta, Buku Panduan Tata Cara Unggah, dan Form Telaah\n5.\nArtikel dapat diunduh pada link:\nhttps://ejurnal.its.ac.id/index.php/teknik (Jurnal Teknik ITS)\nhttps://ejurnal.its.ac.id/index.php/sains_seni (Jurnal Sains&Seni ITS)\nSection yang bisa dipilih pada Jurnal Teknik ITS:'
 '\uf0b7   Mahasiswa yang Dosen Pembimbingnya memilih untuk MEMPUBLIKASIKAN\n    artikelnya pada Jurnal POMITS, dapat melakukan UNGGAH, dengan mengikuti langkah\n    pada BUKU PANDUAN TATA CARA UNGGAH. File yang HARUS DIUNGGAH adalah\n    (ukuran masing-masing file tidak boleh lebih dari 2 MB):\n    \uf031\uf02e Artikel hasil dari Tugas Akhir, dalam format Ms. Word yang telah mengikuti tem-\n       plate. (selain format Ms.Word artikel DITOLAK/REJECTED)\n    \uf032\uf02e Formulir Hak Cipta.\n    \uf033\uf02e Form Telaah Artikel POMITS, dalam format PDF.\n    \uf034\uf02e Form Revisi/Perbaikan/Penyempurnaan TA yang berisi nama penguji beserta\n       komentar dari penguji, dalam format PDF. (Mohon nama penguji tidak disingkat/\n       tidak hanya TTD saja)\n    \uf035\uf02e Template, Formulir Hak Cipta, Buku Panduan Tata Cara Unggah, dan Form Telaah\n       Artikel dapat diunduh pada link:\n       http://ejurnal.its.ac.id/index.php/teknik (Jurnal Teknik ITS)\n        http://ejurnal.its.ac.id/index.php/sains_seni (Jurnal Sains&Seni ITS)']",Pengecekan file yang telah terunggah dapat dilakukan di https://lpmp2ki.its.ac.id/pomits.,0.999999999975,0.8333333333333334,0.9537982808499251,1.0
18,Apa yang harus dilakukan jika terjadi kesalahan pada file yang sudah terunggah?,"Jika terjadi kesalahan pada file yang sudah terunggah, Anda dapat mengisi form pada link berikut:
1. https://its.id/FHAJTeknikITSPOMITS, untuk Jurnal Teknik ITS;
2. https://its.id/FHAJSainsSeniITSPOMITS, untuk Jurnal Sains & Seni ITS;
3. https://its.id/FHAJRepositoryITSPOMITS, untuk Jurnal Repository.

Penghapusan atau penarikan artikel akan dilakukan setelah yudisium berakhir. Artikel yang tidak memenuhi ketentuan publikasi seperti gaya selingkung tidak sesuai format dan file pendukung tidak lengkap tidak akan dipublikasikan di Jurnal Teknik ITS dan Jurnal Sains & Seni ITS.","[""melakukan UNGGAH di Jurnal Repository, menggunakan login 'mahasiswa', dengan.\nkata sandi 'M4h4sisw4lTs!' ke alamat 'https://ejurnal.its.ac.id/index.php/index/login'\ndengan mengunggah file artikel dan file Form Telaah(dalam format pdf) saja.\nPengecekan file vang TERuNGGAH dapat dilihat di\nhttps://lpmp2ki.its.ac.id/pomits.\nJika terdapat penghapusan/penarikan artikel, dapat mengisi form pada link :\nhttps://its.id/FHAJTeknikITSPOMITS, untuk Jurnal Teknik ITS;\n1.-\nhttps:/l/its.id/FHAJSainsSenilTSPOMITS, untuk Jurnal Sains &Seni ITS;\n3.https://its.id/FHAJRepositorylTSPOMITS, untuk Jurnal Repository..\n Penghapusan Artikel akan dilakukan setelah yudisium berakhir.\nArtikel - artikel yang TIDAK MEMENUHI KETENTUAN PUBLIKASI (gaya selingkung\ntidak sesuai format dan file pendukung tidak lengkap) tidak akan DIPUBLIKASIKAN\ndi Jurnal Teknik ITS dan Jurnal Sains & Seni ITS.\nPeriode unggah artikel untuk yudisium 29 adalah sampai dengan \n15 Februari 2024 pukul 24.00 WIB""
 'Apakah berkas\nsudah lengkap?\nMelakukan pendaftaran sidang\nproposal tesis\nMeminta tanda tangan form revisi\nke dosen pembimbing dan\npenguji dan lembar pengesahan\nke dosen pembimbingJadwal sidang, link\nmeeting, form penilaian\ndan form berita acara  \nMengajukan hasil revisi\nke dosen pembimbing\ndan pengujiMelengkapi dan memeriksa\nberkas persyaratan pendaftaran\nsidang proposal tesis\nTidak\nYa\nCatatan revisi sidang proposal\ntesis dan data penilaian sidang\nproposal tesis dari\npembimbing dan penguji\nMahasiswa dapat mengecek nilai\nsidang proposal tesis melalui\nSIAKAD ITS di akhir semester\n(IF 185301 T esis-Proposal)Dosen (Pembimbing, Penguji, Ketua RMK)\nDosen pembimbing dan penguji\nmenandatangani form revisi dan\nlembar pengesahan, lalu\nmenyerahkan kembali ke mahasiswaDosen pembimbing\ndan penguji memeriksa\nhasil revisiDokumen hasil\nrevisi sidang\nproposal tesis  \nApakah revisi\nsudah sesuai?Dokumen hasil\nrevisi sidang\nproposal tesis  Ketua RMK menentukan penguji\ndan menjadwalkan sidang'
 'Lakukan pembayaran dengan transfer ke VA BNI. Berlaku 1x24 jam. Jika kadaluarsa bisa melakukan pesanan baru.\nMemantau Pesanan\n\nStatus Pesanan:\n\nMembuat pesanan cetak\nMenunggu pembayaran\nPembayaran diterima\nProses pencetakan\nSelesai dicetak\nPengiriman ke Perpustakaan / Departemen\nSelesai\nPesanan kadaluarsa\nPesanan dibatalkan\nJika ada permasalahan teknis dapat menghubungi:\n\nWA Layanan DPTSI: 0811 3333 8 222 (07:30 – 16:00 WIB)\nPortal Servicedesk: https://servicedesk.its.ac.id'
 'Lampiran 10.C\nContoh Berita Acara Ujian Akhir Tesis\nDEPARTEMEN PENDIDIKAN NASIONAL\nINSTITUT TEKNOLOGI SEPULUH NOPEMBER SURABAYA\nPROGRAM PASCASARJANA\nBERITA ACARA\nUJIAN TESIS\nPada\nHari, Tanggal Jam\nTempat\ntelah dilaksanakan Ujian Tesis\nJudul\nOleh Nrp.\nProgram Studi\nBidang Keahlian\n:.....\n:...\ndengan hasil\n1. disetujui\n2. disetujui dengan perbaikan / penyempurnaan\n3. tidak disetujui atau mengulang\nPerbaikan / penyempurnaan yang harus dilakukan adalah : (kalau diperlukan dapat ditulis di lembar terpisah)\nPenguji :\nKetua Sidang\n1..\n2.\nMengetahui,\nKetua Program Studi,\n3.\n4......\n5. Dst\n57\n\nCatatan : dibuat rangkap 4\n1. Direktur PPs - ITS\n2. Ketua Program Studi\n3. Dosen (-dosen) Pembimbing\n4. Mahasiswa yang bersangkutan']","Jika terjadi kesalahan pada file, mahasiswa dapat melakukan penghapusan artikel dan unggah ulang dengan mengikuti form pada link: https://its.id/FHAJTeknikITSPOMITS, https://its.id/FHAJSainsSenilTSPOMITS, dan https://its.id/FHAJRepositorylTSPOMITS.",0.999999999975,1.0,0.0,1.0
19,Apa saja unsur dalam proposal tesis?,"Dalam proposal tesis terdapat beberapa unsur yang umumnya harus ada, antara lain:

1. Judul Tesis: Judul yang mencerminkan topik atau masalah yang akan diteliti.
2. Abstrak: Ringkasan singkat tentang tujuan, metode, dan hasil yang diharapkan dari penelitian.
3. Pendahuluan: Menjelaskan latar belakang, masalah penelitian, tujuan penelitian, dan manfaat dari penelitian.
4. Tinjauan Pustaka: Review literatur yang mendukung penelitian, termasuk teori, temuan, dan penelitian terdahulu yang relevan.
5. Metodologi: Penjelasan mengenai bahan, peralatan, cara kerja, dan teknik yang akan digunakan dalam penelitian.
6. Jadwal Kegiatan: Rincian setiap kegiatan penelitian yang akan dilakukan.
7. Daftar Pustaka: Daftar referensi yang digunakan dalam proposal tesis.

Selain itu, terdapat juga informasi mengenai identitas mahasiswa, pembimbing, dan co-supervisor yang tercantum dalam proposal tesis.","['Lampiran 4\nContoh abstrak proposal tesis dalam Bahasa Indonesia\nINFILTRASI AIR HUJAN DAN KEGEMPAAN TERINDUKSI\nLERENG STABILITAS PADA TANAH SISA\nMENGGUNAKAN RESISTIVITAS DAN PENGUKURAN\nMICROTREMOR\nMahasiswa Nama\nMahasiswa ID\nPembimbing\nCo-Supervisor\n: Dwa Desa Warnana\n: 3107 301 202\n: Dr. Ir. Ria A. A. Soemitro, M.Eng\n: Dr. Ir. Widya Utama, DEA.\nABSTRAK\nPenggunaan metode resistivitas dan mikrotremor dalam'
 'Tinjauan pus taka berisi referensi yang terbaru, relevan, dan asli.  \nTinjauan pu staka menguraikan teori, tem uan, dan bahan  \npenelitian lain yang di arahkan unt uk m enyusun kerangka  \npemikiran atau konsep yang akan digunakan dalam  penelitian.  \n \ne.  Metodolog i  \nMetodolog i berisi bahan-bahan, peralatan, dan cara kerja serta \nteknik/proses pengerjaan. Yang dim aksud dengan ba han adalah : \nmateri al, data, dan hasil penelitia n lain. Yang dimaksud peralatan \n: alat-al at uji laboratorium dan lapan gan, perangk at keras dan \n5 lunak, teori  dan persamaan, serta variabel. Yang dimaksud \ndengan proses : teknik pengum pulan  dan analisis data, model \npendekatan yang digunakan, rancangan pene litian, cara penafsiran  \ndan pengum pulan hasil penelitian, u jicoba dan cara evaluasi, serta \ncara peny impulan. Pada bab ini perlu  dijelaskan tem pat/lokasi \npelaksanaan TA. \n \nf.  Jadwal kegiat an \nJadwal kegiatan berisi rincian setiap kegiatan penelitian y ang'
 'THE TITLE OF THE FINAL PROJECT PROPOSAL IS WRITTEN BRIEFLY,\n            CLEARLY AND DESCRIBING THE MAIN THEME\n\n\n\n                        FINAL PROJECT PROPOSAL\n                    Submitted to fulfill one of the requirements\n                    for obtaining a degree <name of degree> at\n             Undergraduate Study Program of <name of Study Program>\n                      Department of <name of Department>\n                          Faculty of <name of Faculty>\n                       Institut Teknologi Sepuluh Nopember\n\n\n\n                          By: <NAME OF STUDENT>\n                              NRP. <XXXXXXXX>\n\n\n\n                Approved by Final Project Proposal Examiner Team:\n\n\n1. Name of Advisor and academic title                      Advisor\n\n\n2. Name of Co-Advisor/Examiner and academic title          Co-Advisor\n\n\n3. Name of Examiner and academic title                     Examiner\n\n\n4. Name of Examiner and academic title                     Examiner'
 'Lampiran 11.A\nContoh abstrak tesis dalam Bahasa Indonesia\nKINERJA KOMPOS PRODUKSI UDPK BRATANG\nSEBAGAI MEDIA PENUKAR ION UNTUK MEREDUKSI LOGAM BERAT Cu DALAM AIR LIMBAH BUATAN\nNama mahasiswa\nNRP\nPembimbing\nABSTRAK\nKurangnya motivasi dalam kegiatan pengomposan salah\nsatunya adalah karena rendahnya nilai jual dan sempitnya pasar untuk produksi kompos. Pemanfaatan kompos sebagai media penukar 10n dharapkan dapat meningkatkan nila jual kompos sekaligus untuk memberikan alternatif pengolahan logam berat, khususnya Cu, yang murah. Kemampuan kompos untuk menukar ion berasal dari kandungan materi humus pada kompos yang mempunyai kapasitas tukar kation (KTK). Grup fungsi yang\nberperan\nadalah grup karboksil (-COOH) sehingga\nbisa\ndikategorikan sebagai resin asam lemah. Penelitian ini bertujuan untuk mengkaji kinerja kompos produksi UDPK Bratang sebagai media penukar ion untuk mereduksi Cu dalam air limbah buatan.\nKTK teoritis diukur dengan metode titrasi pH dan']","Unsur dalam proposal tesis terdiri dari: Judul, Lembar Pengesahan, Abstrak, Daftar isi, Bagian tubuh (bab-bab), Rencana dan Jadwal Kerja Penelitian dan Penyusunan Tesis, Daftar pustaka, dan Lampiran.",0.8055555555287036,0.9285714285714286,0.9519413665595504,0.0
