,question,ground_truth,contexts,answer
0,Apa yang perlu direncanakan mahasiswa sehubungan dengan Bentuk Kegiatan Pembelajaran (BKP) MB-KM?,Merencanakan SKEM dan memetakan portofolio dengan SKS mata kuliah yang ingin dikonversikan,"['A. Bagi Mahasiswa 1. Membuat perencanaan Kegiatan SKEM/ Program MB-KM dilaksanakan di awal semester. 2. Memilih kelas MB-KM secara mandiri melalui menu Formulir Rencana Studi (FRS) di SI Akademik. 3. Membuat dan menyimpan usulan portofolio yang tersedia di myITS StudentConnect untuk 1 (satu) semester ke depan. 4. Merencanakan SKEM dan memetakan portofolio (sehubungan dengan Bentuk Kegiatan Pembelajaran/ BKP MB-KM) yang telah diusulkan dengan sks mata kuliah yang ingin dikonversikan. 5. Melakukan perwalian dengan dosen wali untuk kemudian mendapatkan persetujuan FRS. 6. Panduan pengguna dan rencana kegiatan SKEM/ Program MB-KM dan penjelasan terkait lainnya dapat diakses di link https://its.id/panduan-rencana-skem-MBKM dan https://its.id/RencanaKegiatanSKEMMBKM . 7. Bagi mahasiswa yang merencanakan Program MB-KM, mengajukan Form 1 Matching Up Program MB-KM Ke MK Inti Prodi (jika konversi kegiatan ke Mata Kuliah Inti) dan Form 2 Surat Permohonan Kredit Transfer (Learning Agreement). 8.', '5. Bagi mahasiswa dengan keterbatasan tertentu sehingga tidak memungkinkan untuk\nmengikuti SKEM baru, TIM Ditmawa akan membentuk tim review internal dengan\nmelibatkan TKK Departemen.\n\n6. Apabila ada kegiatan berkelompok seperti kegiatan lomba maka yang dinilai adalah\nketua kelompoknya dan anggota mengikuti nilai dari ketua kelompok tersebut.', 'B. Bagi Dosen Wali 1. Melakukan pendampingan dan pengecekan dari pengajuan perencanaan kegiatan SKEM/ program MB-KM yang diajukan oleh mahasiswa. 2. Jika dinilai sudah sesuai pengajuan perencanaan Kegiatan SKEM/ Program MB-KM oleh mahasiswa, dosen wali dapat melakukan persetujuan FRS. \nDemikian Surat Edaran ini dibuat untuk dilaksanakan dengan sebaik - baiknya. Atas perhatiannya diucapkan terimakasih.', 'Indonesia (KONI) dengan menunjukkan sertifikat/surat keterangan dimana\nverifikasi dilakukan oleh dosen wali.\n13. Bagi mahasiswa yang tidak memiliki sertifikat kegiatan, bisa digantikan dengan surat\npernyataan bermaterai (Format surat pernyataan bebas). Dalam satu Surat Pernyataan\ndapat berisi beberapa kegiatan.\n14. Bagi mahasiswa yang tidak memiliki surat tugas bisa dimintakan ke direktorat\nkemahasiswaan atau fakultas. Surat tugas bisa menghubungi Direktorat\nKemahasiswaan (CP Mas Reza 081414170021).\n15. Bagi mahasiswa yang tidak memiliki foto kegiatan bisa digantikan dengan screenshot\nkegiatan tersebut di website.']","Mahasiswa perlu merencanakan SKEM dan memetakan portofolio yang telah diusulkan dengan sks mata kuliah yang ingin dikonversikan. Selain itu, mahasiswa juga perlu membuat perencanaan kegiatan SKEM/ Program MB-KM dilaksanakan di awal semester, memilih kelas MB-KM secara mandiri melalui menu Formulir Rencana Studi (FRS) di SI Akademik, membuat dan menyimpan usulan portofolio yang tersedia di myITS StudentConnect untuk 1 (satu) semester ke depan, serta melakukan perwalian dengan dosen wali untuk kemudian mendapatkan persetujuan FRS. Panduan pengguna dan rencana kegiatan SKEM/ Program MB-KM serta penjelasan terkait lainnya juga dapat diakses melalui link yang disediakan."
1,Apa yang harus dilakukan mahasiswa yang merencanakan Program MB-KM?,Mengajukan Form 1 Matching Up Program MB-KM Ke MK Inti Prodi dan Form 2 Surat Permohonan Kredit Transfer (Learning Agreement),"['Sehubungan dengan kurikulum Program Sarjana dan Sarjana Terapan tahun 2023 – 2028 maka Berikut kami sampaikan beberapa teknis terkait pelaksanaan perencanaan kegiatan Satuan Kegiatan Ekstrakurikuler Mahasiswa (SKEM)/ program Merdeka Belajar–Kampus Merdeka (MB-KM) disampaikan bahwa:', 'B. Bagi Dosen Wali 1. Melakukan pendampingan dan pengecekan dari pengajuan perencanaan kegiatan SKEM/ program MB-KM yang diajukan oleh mahasiswa. 2. Jika dinilai sudah sesuai pengajuan perencanaan Kegiatan SKEM/ Program MB-KM oleh mahasiswa, dosen wali dapat melakukan persetujuan FRS. \nDemikian Surat Edaran ini dibuat untuk dilaksanakan dengan sebaik - baiknya. Atas perhatiannya diucapkan terimakasih.', '2. Mahasiswa Program Sarjana dan Sarjana Terapan tidak dikenakan biaya Wisuda, hanya dikenakan uang jaminan toga (akan dikembalikan setelah toga kembali).\n3. Biaya sewa dan peminjaman toga mengacu pada surat yang dikeluarkan oleh Dharma Wanita Persatuan ITS Nomor B 362/Sekre/DPW-ITS/II/2024 tanggal 26 Februari 2024\ndan pada laman https://wisuda.dwpits.id', 'A. Bagi Mahasiswa 1. Membuat perencanaan Kegiatan SKEM/ Program MB-KM dilaksanakan di awal semester. 2. Memilih kelas MB-KM secara mandiri melalui menu Formulir Rencana Studi (FRS) di SI Akademik. 3. Membuat dan menyimpan usulan portofolio yang tersedia di myITS StudentConnect untuk 1 (satu) semester ke depan. 4. Merencanakan SKEM dan memetakan portofolio (sehubungan dengan Bentuk Kegiatan Pembelajaran/ BKP MB-KM) yang telah diusulkan dengan sks mata kuliah yang ingin dikonversikan. 5. Melakukan perwalian dengan dosen wali untuk kemudian mendapatkan persetujuan FRS. 6. Panduan pengguna dan rencana kegiatan SKEM/ Program MB-KM dan penjelasan terkait lainnya dapat diakses di link https://its.id/panduan-rencana-skem-MBKM dan https://its.id/RencanaKegiatanSKEMMBKM . 7. Bagi mahasiswa yang merencanakan Program MB-KM, mengajukan Form 1 Matching Up Program MB-KM Ke MK Inti Prodi (jika konversi kegiatan ke Mata Kuliah Inti) dan Form 2 Surat Permohonan Kredit Transfer (Learning Agreement). 8.']","Mahasiswa yang merencanakan Program MB-KM harus melakukan beberapa hal, antara lain:
1. Membuat perencanaan Kegiatan SKEM/ Program MB-KM dilaksanakan di awal semester.
2. Memilih kelas MB-KM secara mandiri melalui menu Formulir Rencana Studi (FRS) di SI Akademik.
3. Membuat dan menyimpan usulan portofolio yang tersedia di myITS StudentConnect untuk 1 (satu) semester ke depan.
4. Merencanakan SKEM dan memetakan portofolio (sehubungan dengan Bentuk Kegiatan Pembelajaran/ BKP MB-KM) yang telah diusulkan dengan sks mata kuliah yang ingin dikonversikan.
5. Melakukan perwalian dengan dosen wali untuk kemudian mendapatkan persetujuan FRS.
6. Panduan pengguna dan rencana kegiatan SKEM/ Program MB-KM dan penjelasan terkait lainnya dapat diakses di link https://its.id/panduan-rencana-skem-MBKM dan https://its.id/RencanaKegiatanSKEMMBKM.
7. Bagi mahasiswa yang merencanakan Program MB-KM, mengajukan Form 1 Matching Up Program MB-KM Ke MK Inti Prodi (jika konversi kegiatan ke Mata Kuliah Inti) dan Form 2 Surat Permohonan Kredit Transfer (Learning Agreement)."
2,Apa masalah utama lulusan ITS menurut kondisi eksisting?,"Leadership, Interpersonal skill, teamwork, dan endurance.","['Kondisi Eksisting\n1. Masalah utama lulusan ITS adalah Leadership, Interpersonal skill, teamwork, dan\nendurance.\n2. Mahasiswa dengan nilai SKEM diatas 3.000 tidak terlihat memiliki softskill yang\nlebih baik dari yang 1300.\n3. Mendapatkan nilai SKEM 1300 belum bisa dipakai secara efektif untuk mengukur\ncapaian softskill mahasiswa.\n4. Pengisian SKEM didominasi pada semester 2 dan semester 8 (untuk Sarjana)\nsehingga tidak terbaca bagaimana track peningkatan softskill mahasiswa.\n5. Hanya 46% mahasiswa yang mengikuti kompetisi, tergabung dalam ormawa,\nwirausaha, delegasi dll.', 'teks, dijelaskan di dalam bab berikut. Penjelasan ini, secara otomatis dapat tercetak di dalam\nhasil tulisan dengan menggunakan bantuan MS Worls, dalam fitur “Reference”, dengan mode:\nStyle “APA”. Apabila menggunakan bantuan otomasi MS Word, maka penulis tidak perlu\nmengetik secara manual, dan hasilnya akan tertampil baik di dalam teks sebagai sitasi, maupun\ndi dalam daftar acuan sebagai daftar pustaka yang digunakan.', '5. Bagi mahasiswa dengan keterbatasan tertentu sehingga tidak memungkinkan untuk\nmengikuti SKEM baru, TIM Ditmawa akan membentuk tim review internal dengan\nmelibatkan TKK Departemen.\n\n6. Apabila ada kegiatan berkelompok seperti kegiatan lomba maka yang dinilai adalah\nketua kelompoknya dan anggota mengikuti nilai dari ketua kelompok tersebut.', 'dicantum kan. Cara menyebutkan sum ber ialah  dengan \nmenuliskan nam a pengarang dan tahun publi kasi didalam  \nkurung. Untuk kutipan yang diam bil tidak secara la ngsung \ndari aslin ya maka y ang dituliskan adal ah nama penulis asli \ndan nam a penyuntin g (contoh: Faqih  dalam  Sulistijono, \n2006). Cara menuliskan daftar acu an dapat dilihat pada Sub \nbab 3.1 0. \n \n3.3. Halaman Judul \n Halaman judul ( Lampiran 1 ) sama den gan halam an kulit luar, \nberisi : tulisan ”TUGAS AKHIR”, judul Tugas Akhir; lam bang ITS, \nnama penulis dengan nomor pokok (N RP); nama ju rusan, fakultas, \n10 institut (dit ulis lengkap), dan nam a kota (Surabaya), serta tah un \npembuatan. Halaman ju dul ditu lis dalam  bahasa Inggris dan  \nIndonesia dalam  halam an yang berbe da. Kedua halam an judul \ntersebut menggunakan karakteristik  huruf y ang sama dengan bagian \nhalam an yang lain (bukan  huruf tim bul atau warna). \n Judul Tugas Akhir harus diketik seluru hnya dengan huruf-h uruf']","Masalah utama lulusan ITS menurut kondisi eksisting adalah kurangnya kemampuan dalam Leadership, Interpersonal skill, teamwork, dan endurance."
3,"Berapa persen mahasiswa yang mengikuti kompetisi, tergabung dalam ormawa, wirausaha, delegasi, dll?",46%,"['2. Mahasiswa Program Sarjana dan Sarjana Terapan tidak dikenakan biaya Wisuda, hanya dikenakan uang jaminan toga (akan dikembalikan setelah toga kembali).\n3. Biaya sewa dan peminjaman toga mengacu pada surat yang dikeluarkan oleh Dharma Wanita Persatuan ITS Nomor B 362/Sekre/DPW-ITS/II/2024 tanggal 26 Februari 2024\ndan pada laman https://wisuda.dwpits.id', 'asing (khususnya Bahasa Inggris) mahasiswa Program Studi Sarjana, Sarjana Terapan, Magister,\n      Magister Terapan, dan Doktor di lingkungannya;\n   2. Departemen dapat bekerja sama dengan Unit Pusat Bahasa Global (UPBG) untuk meningkatkan\n      kemampuan Bahasa asing mahasiswa yang belum lulus skor kemampuan Bahasa asing;\n   3. Mahasiswa yang belum lulus skor kemampuan Bahasa asing wajib mengikuti kursus Bahasa asing\n      yang diselenggarakan oleh UPBG sesuai dengan level Bahasa asing yang diperolehnya;\n   4. Skor kelulusan Bahasa Asing (terutama Bahasa Inggris) digunakan sebagai persyaratan untuk\n      mahasiswa yang akan mendaftar ujian/sidang Tugas Akhir/Skripsi (untuk Sarjana dan Sarjana\n      Terapan), ujian/sidang Thesis (untuk Magister dan Magister Terapan), dan ujian/sidang tertutup\n      Disertasi (untuk Doktor);\n   5. Departemen dapat memberikan bantuan peningkatan Bahasa Asing (Bahasa Inggris) kepada\n      mahasiswa sesuai dengan SBI yang ada.', '3. Ayat 14, Penetapan predikat kelulusan ditentukan berdasarkan Indeks Prestasi Kumulatif\n    Predikat (IPKP) dan masa studi.\n\nAtas perhatian dan kerjasama yang diberikan, kami sampaikan terima kasih.\n\n\n                                                    Wakil Rektor Bidang Akademik dan\n                                                    Kemahasiswaan,\n\n\n\n\n                                                    Prof. Dr. Ir. Adi Soeprijanto, M.T.\n                                                    NIP. 196404051990021001\n\nTembusan :\n- Kepala Bagian Administrasi Umum dan Kearsipan Digital', '3        \nBebas Pustaka dengan mengakses e-Bebas-Pustaka melalui web perpustakaan.\n\nSalah satu persyaratan bebas Pustaka adalah upload buku TA melalui web repository.its.ac.id.\n\nBebas Pustaka akan dikirim langsung ke e-mail atau No. WA yang telah didaftarkan jika sudah TIDAK mempunyai tanggungan berupa pinjaman koleksi atau denda. Pengecekan pinjaman koleksi atau denda dapat dilakukan melalui web perpustakaan bagian layanan online pinjaman koleksi atau denda.\n\nBebas Pustaka: https://www.its.ac.id/perpustakaan/id/bebas-pustaka-id/\n\n \n\nUpload buku TA: https://repository.its.ac.id/\n\n4        \nMelakukan upload jurnal/artikel di Pomits.\n\n(Bagi mahasiswa Program Sarjana dan Sarjana Terapan)\n\nhttp://lpmp2ki.its.ac.id/pomits\n5        \nMelunasi IKOMA.\n\n(Bagi mahasiswa Program Sarjana dan Sarjana Terapan)']","Saya tidak menemukan informasi mengenai persentase mahasiswa yang mengikuti kompetisi, tergabung dalam ormawa, wirausaha, delegasi, dll dalam konteks yang diberikan."
4,Apa itu tesis?,Tesis adalah karya ilmiah yang ditulis untuk memenuhi salah satu syarat untuk menyelesaikan studi pascasarjana strata 2 (program Magister) di Institut Teknologi Sepuluh Nopember.,"['teks, dijelaskan di dalam bab berikut. Penjelasan ini, secara otomatis dapat tercetak di dalam\nhasil tulisan dengan menggunakan bantuan MS Worls, dalam fitur “Reference”, dengan mode:\nStyle “APA”. Apabila menggunakan bantuan otomasi MS Word, maka penulis tidak perlu\nmengetik secara manual, dan hasilnya akan tertampil baik di dalam teks sebagai sitasi, maupun\ndi dalam daftar acuan sebagai daftar pustaka yang digunakan.', '14\n\x0c3.11 Daftar Acuan atau Daftar Pustaka\n    Penulisan daftar pustaka yang diletakkan di bagian akhir isi laporan TA/PA, dilakukan\ndengan menggunakan standar APA (Association Pshychology America) edisi ke 7. Standar\npenulisan ini digunakan untuk seluruh bidang ilmu, yaitu: sains, teknik, komputing, desain, seni\ndan yang lain (Southern Institute of Technology, 2020). Pengelompokan pustaka di dalam APA\nversi 7.0 ini lebih ringkas, dibandingkan dalam APA versi 6.0.\n    Secara umum penulisan daftar pustaka dalam standar APA, versi 7.0 adalah sebagai\nberikut:\n  1.  Daftar pustaka dimulai pada halaman terpisah dari halaman isi dalam laporan TA/PA.\n  2.  Daftar pustaka akan muncul dalam urutan abjad dengan nama belakang penulis pertama.\n  3.  Hasil cetak dengan standar APA menggunakan indentasi gantung. Baris ke dua dalam\n      daftar pustaka, menjorok ke dalam di bawah garis ke satu.\n  4. Penulisan kapitalisasi judul hanya di awal kalimat, yang berbeda dengan penulisan judul', 'Webe r, B. 1985. ""The Myth Maker : The Creative Mind"". New Yo rk \nTimes Magaz ines, 20 October, 42. \n \n 6. Bila referensi berupa artikel dalam S urat Kabar   \nKom pas (Jakarta). 1992. 4 Jan uari. \nJawa Pos (Surabaya). 1993. 21 April. \nRahayu, S. 1992. ""H endak Kem ana Arsi tektur R umah Sus un \nIndonesi a?"". Kompa s (Jakarta), 5 Maret. \nSjahrir, A . 1993. ""Pro spek Eko nomi Indonesia"". Jawa P os \n(Sura baya), 22 Maret. \n \n 7. Bila referensi berupa artikel dari Internet   \nCoutinho , J., Martin, S., Samata,  G., Tapley,  S. dan Wilkin, D., \n1995. Fieldb us Tutori al,  <URL:h ttp://kernow.cu rtin. \nedu.au/www/fieldbus/fieldbu s.htm>. \n Pinto, J.J. , Feb. 19 97. Fieldbus:A Ne utral Instr umentati on \nVendor’s Perspecti ve Com municatio, <URL:h ttp: \n//www .actionio.com/jimpinto/fbart icl.html>. \n \n8. Referensi l ainnya (Manual,  Brosur, dan sejenisny a)  \nReliab le Su pply in Reliab le Qu ality. Brosur PT . Dharma S arana \nPerdana.  Pulo Gadung Industrial Estate , Jakarta.', '6 BAB III  \nLAPORAN TUGAS AKHIR \n \n3.1. Sistem atika \n Siste matika l aporan Tugas Akhir terdiri atas  tiga ba gian besar, \nyaitu : \n \n1. Bagian ’Awal’ terdiri dari: \na. Judul Tu gas Akhir dala m bahasa In donesia dan  bahasa \nInggris pada kulit m uka dan kulit  dalam  (Lampiran 1 ) \nb. Hala man pengesahan ( Lampiran 2 ) \nc. Abstrak atau  uraian singkat dalam  bahasa Indonesia dan  \nbahasa Inggris ( Lampiran 3 ) \nd. Kata pengantar \ne. Daftar isi \nf. Daftar gam bar, grafik, diag ram \ng. Daftar tabel \nh. Daftar si mbol \n \n2. Bagian ‘Inti/Pokok’ atau ‘Batang Tubuh’ berisi :  \n a. Pendahuluan  \n• Latar belakan g masalah \n• Rumusan Per masalahan  \n• Batasan m asalah/ruang lingkup \n• Tujuan  \n• Manfaat (bila diperlukan untuk ditulis) \nb. Tinjauan Pustaka \n• Hasil peneliti an terdahulu yang relevan \n• Teori yang akan digunakan untuk meny elesaikan  \npermasalahan   \nc. Metodolog i  \n• Metode y ang digunakan \n• Bahan dan perala tan y ang digunakan \n• Urutan pelaksanaan percobaan']",Tesis adalah sebuah karya tulis ilmiah yang disusun oleh seorang mahasiswa sebagai syarat untuk memperoleh gelar sarjana atau magister. Tesis biasanya berisi penelitian yang mendalam tentang suatu topik tertentu dan harus disusun dengan format dan struktur tertentu sesuai dengan pedoman yang berlaku.
5,Bagaimana penulisan nomor halaman dalam proposal tesis?,"Penomoran halaman sebelum teks (sebelum Bab 1) menggunakan angka Romawi kecil, sedangkan bagian teks menggunakan angka Arabic.","['1. Langkah awal sebelum mengisikan data proposal TA ke MONTA, mahasiswa wajib berdiskusi\n      terlebih dahulu dengan calon dosen pembimbing perihal topik TA yang ingin dikerjakan sambil\n      bimbingan dalam penyusunan draft proposal TA.\n\n   2. Setelah topik dan draft proposal TA sudah disetujui, mahasiswa melakukan pendaftaran proposal\n      TA ke sistem dengan memilih menu Proposal TA –> Buat Proposal serta mengunggah file draft\n      proposal yang sudah disepakati pembimbing.\n      Setelah mengisi semua isian form maka memilih tombol Buat Proposal Baru.\n\n\n\n\n   3. Setelah mendaftarkan proposal, mahasiswa dapat mencetak cover proposal TA dengan memilih\n      menu Cetak Cover –> Cetak Cover Proposal TA.\n\n\n\n\n   4. Mahasiswa wajib menyerahkan kepada koordinator TA/Ketua RMK, hardcopy proposal TA\n      lengkap dengan cover proposal yang dicetak dari MONTA dan sudah disetujui/ditandatangani\n      oleh dosen pembimbing.', '5. Setelah semua proses diatas sudah dilakukan dengan benar, maka mahasiswa tinggal menunggu\n      perubahan status proposal TA-nya via MONTA (Mendaftar \uf0e0 Tunggu Sidang Proposal \uf0e0 OK/\n      Revisi/ Ditolak). Bagi mahasiswa yang status proposalnya OK, maka bisa segera melakukan\n      bimbingan ke dosen pembimbing. Sedangkan bagi proposalnya berstatus Revisi/Ditolak, harap\n      menghadap ke koordinator TA/Ketua RMK untuk mengambil hardcopy proposal dan menanyakan\n      keterangan lebih detail tenang status proposalnya.\n\x0c\uf076 Bimbingan TA\n\n  1. Setelah proposal TA mahasiswa berstatus “OK”, maka proses bimbingan TA bisa mulai dilakukan\n     baik secara online maupun offline. Untuk bimbingan online, mahasiswa mengisi kegiatan\n     bimbingan dengan memilih menu Progres TA, kemudian memilih menu Bimbingan Baru.\n\n\n\n\n  2. Berikut merupakan halaman bimbingan baru untuk diisikan item/catatan yang dijadikan topik\n     bimbingan.', 'hasil revisiDokumen hasil\nrevisi sidang\nproposal tesis  \nApakah revisi\nsudah sesuai?Dokumen hasil\nrevisi sidang\nproposal tesis  Ketua RMK menentukan penguji\ndan menjadwalkan sidang\nproposal tesis setiap pesertaSOP PENDAFT ARAN SIDANG PROPOSAL TESIS PROGRAM STUDI S2 TEKNIK INFORMA TIKA (SISTEM ONLINE ), FT -EIC, ITS  \nYaDraft proposal tesis\ndan form persetujuan\npembimbing\nPemeriksa,\n \n \n \n \n \nLina Ambarwati, S.Kom.  \nNIP. 198003242014092001  Mengetahui,\nDr. Ahmad Saikhu, S.Si., M.T . \nNIP. 197107182006041001Pembuat,\n \n \n \n \n \nKartika Dwi Y uniavita Rahmawati, S.T .\nNPP. 1998202122056  \nJadwal sidang, link\nmeeting, dan VB\nTidak\nMenginfokan link google form\nuntuk meng-upload  seluruh\ndokumen hasil revisi sidang\nproposal tesis ke mahasiswa\nStatus sidang\nproposal tesis\nmenjadi ""Disetujui""Merekap data mahasiswa yang\ntelah menyelesaikan revisi\nsidang proposal tesis dan\nmenginfokan ke Kaprodi\nMeng-update status sidang\nproposal tesis di MonT esMeng-upload lembar revisi sidang', '10. Mahasiswa melaksanakan sidang proposal tesis. Sedangkan, dosen pembimbing dan \npenguji memberikan feedback ke mahasiswa, mengisi berita acara , memberikan penilaian \ndan catatan revisi  sidang proposal tesis.  \n11. Setelah mahasiswa melaksanakan sidang proposal tesis, Admin Akademik Pascasarjana  \nmeng -update status sidang proposal tesis di MonTes dari ‘Terjadwal Ujian’ menjadi \n‘Revisi ’. \n12. Mahasiswa mengerjakan revisi dan menyusun buku proposal tesis sesuai dengan hasil \ndiskusi ketika sidang proposal tesis dan/atau sesuai catatan dalam lembar revisi. Apabila \nsudah selesai mengerjakan revisi, mahasiswa dapat memberikan hasil revisinya ke dosen \npembimbing dan penguji serta mengajukan lembar revisi dan lembar pengesahan buku \nproposal tesis untuk meminta persetujuan ke dosen pembimbing dan penguji. Batas \npengerjaan revi si adalah 2 minggu setelah sidang proposal tesis berlangsung.  \n13. Apabila revisi yang dikerjakan mahasiswa dirasa sudah tepat, dosen pembimbing dan']","Penulisan nomor halaman dalam proposal tesis harus mengikuti aturan penulisan nomor halaman yang umum digunakan dalam penulisan ilmiah. Nomor halaman biasanya diletakkan di bagian bawah tengah atau kanan bawah setiap halaman. Nomor halaman biasanya dimulai dari halaman judul (halaman depan) hingga halaman terakhir proposal tesis. Nomor halaman juga harus konsisten dan berurutan sesuai dengan struktur proposal tesis yang telah ditentukan. Jika terdapat lampiran, nomor halaman untuk lampiran biasanya menggunakan huruf (misalnya A, B, C, dst.) setelah nomor halaman terakhir dari bagian utama proposal tesis."
6,Bagaimana pelaksanaan wisuda akan dilakukan?,Pelaksanaan wisuda akan dilakukan secara offline.,"['\uf0b7   UNGGAH artikel WAJIB dilakukan oleh MAHASISWA PENDAFTAR YUDISIUM 121.', '2. Mahasiswa Program Sarjana dan Sarjana Terapan tidak dikenakan biaya Wisuda, hanya dikenakan uang jaminan toga (akan dikembalikan setelah toga kembali).\n3. Biaya sewa dan peminjaman toga mengacu pada surat yang dikeluarkan oleh Dharma Wanita Persatuan ITS Nomor B 362/Sekre/DPW-ITS/II/2024 tanggal 26 Februari 2024\ndan pada laman https://wisuda.dwpits.id', 'Disertasi (untuk Doktor);\n   5. Departemen dapat memberikan bantuan peningkatan Bahasa Asing (Bahasa Inggris) kepada\n      mahasiswa sesuai dengan SBI yang ada.\nDemikian atas perhatian dan kerjasamanya disampaikan terima kasih.', '5. Bagi mahasiswa dengan keterbatasan tertentu sehingga tidak memungkinkan untuk\nmengikuti SKEM baru, TIM Ditmawa akan membentuk tim review internal dengan\nmelibatkan TKK Departemen.\n\n6. Apabila ada kegiatan berkelompok seperti kegiatan lomba maka yang dinilai adalah\nketua kelompoknya dan anggota mengikuti nilai dari ketua kelompok tersebut.']","Pelaksanaan wisuda akan dilakukan dengan mahasiswa Program Sarjana dan Sarjana Terapan tidak dikenakan biaya Wisuda, hanya dikenakan uang jaminan toga yang akan dikembalikan setelah toga dikembalikan. Biaya sewa dan peminjaman toga mengacu pada surat yang dikeluarkan oleh Dharma Wanita Persatuan ITS Nomor B 362/Sekre/DPW-ITS/II/2024 tanggal 26 Februari 2024 dan informasi lebih lanjut dapat dilihat di laman https://wisuda.dwpits.id."
7,Apakah calon wisudawan Sarjana dan Sarjana Terapan memiliki kewajiban yang sama terkait pengisian biodata dan proses wisuda?,"Ya, semua calon wisudawan Sarjana dan Sarjana Terapan wajib mengikuti ketentuan yang sama.","['2. Mahasiswa Program Sarjana dan Sarjana Terapan tidak dikenakan biaya Wisuda, hanya dikenakan uang jaminan toga (akan dikembalikan setelah toga kembali).\n3. Biaya sewa dan peminjaman toga mengacu pada surat yang dikeluarkan oleh Dharma Wanita Persatuan ITS Nomor B 362/Sekre/DPW-ITS/II/2024 tanggal 26 Februari 2024\ndan pada laman https://wisuda.dwpits.id', '\uf0b7   Section yang bisa dipilih pada Jurnal Teknik ITS:\n    Teknologi Informasi dan Komunikasi (TIK); Energi (ERG); Pemukiman dan Bencana\n    (PdB); Bangunan Berorientasi Lingkungan (BBL); Transportasi (TRP); Teknologi\n    Proses (TP); Kelautan (KLT).\n\n\uf0b7   Section yang bisa dipilih pada Jurnal Sains & Seni ITS:\n    Matematika dan Terapannya (MAT); Fisika dan Terapannya (FIS); Kimia dan Tera-\n    pannya (KIM); Statistika dan Terapannya (STA); Biologi dan Terapannya (BIO);\n    Produk Desain (PD); Arsitektur (ARS).\n\n\uf0b7   Mahasiswa yang Dosen Pembimbingnya memilih untuk TIDAK MEMPUBLIKASIKAN\n    artikelnya pada Jurnal POMITS, dapat melakukan UNGGAH di Repository, menggunakan\n    login ‘mahasiswa’, dengan kata sandi ‘M4h4sisw4ITS!’ ke alamat ‘http://\n    ejurnal.its.ac.id/index.php/index/login’ dengan mengunggah file artikel dan file Form\n    Telaah saja.\n\n\uf0b7   Pengecekan file yang TERUNGGAH dapat dilihat di\n    http://lpmp2ki.its.ac.id/pomits.', '(Bagi mahasiswa Program Sarjana dan Sarjana Terapan)\n\nhttp://lpmp2ki.its.ac.id/pomits\n5        \nMelunasi IKOMA.\n\n(Bagi mahasiswa Program Sarjana dan Sarjana Terapan)\n\nDapat bertanya ke Instagram @ikomaits \n6        Mengisi data-data untuk cetak ijazah di Direktorat Pendidikan dengan Pengisian Data di SIAKAD        Baca dokumen “Pemberitahuan untuk calon Wisudawan ITS…”\n7        Mengisi data terkait peminjaman-pengembalian toga.        https://wisuda.its.ac.id/\n8        Mengajak kepada semua calon wisudawan untuk berpartisipasi menjadi donatur dana abadi/endowment fund ITS.        http://danaabadi.its.ac.id/web/\n9        Mengisi Form Kepuasan & Yudisium Departemen        Link di atas :D', 'Nomor\nLampiran\nPerihal\nDharma Wanita Persatuan\nInstitut Teknologi Sepuluh Nopember\nProvinsi Jawa Timur\nKAMPUS ITS - KEPUTIH - SUKOLILO - SURABAYA TELP. (031) 5912379\n: B 362/Sekre/DWP-ITS/ll/2024.\nSurabaya, 26 Februari 2024\n: -\n: Informasi Peminjaman Toga.\nKepada Yth : Wisudawan ITS\nWisuda ITS ke-129\nDi tempat.\nSelamat dan sukses kepada seluruh Wisudawan, Wisuda ITS ke-129, semoga ilmu yang didapat bermanfaat.\nWisuda ITS ke-129 akan dilaksanakan tanggal 20 dan 21 April 2024, para wisudawan mengenakan Toga seperti pelaksanaan Wisuda sebelumnya.\nSYARAT, KETENTUAN DAN TEKNIS PEMINJAMAN TOGA sbb :\nI. BIAYA TOGA :\n1. Wisudawan S1 dan S1 TERAPAN :\nMembayar Biaya Jaminan Toga Rp. 300.000,- (Tiga Ratus Ribu Rupiah)\n2. Wisudawan ASING dan Wisudawan Non UKT S2 & S3 :\nMembayar biaya Sewa dan Jaminan Toga Rp. 550.000,- (Lima ratus lima puluh ribu rupiah)\nPerincian sebagai berikut :\nBiaya Jaminan Toga: Rp. 300.000,- (tiga ratus ribu rupiah).\nBiaya Sewa Toga']","Ya, calon wisudawan Sarjana dan Sarjana Terapan memiliki kewajiban yang sama terkait pengisian biodata untuk proses wisuda. Mereka harus mengisi data-data untuk cetak ijazah di Direktorat Pendidikan dengan Pengisian Data di SIAKAD sesuai dengan panduan yang diberikan."
8,Bagaimana cara mengajukan SKPI?,SKPI diajukan melalui studentconnect.,"['Kredit SKEM\n4 Bagian:\n\n1. Kompetisi, wirausaha, dan magang Ng\n\n2. Organisasi kepemimpinan & minat bakat Xx\n\n3. Pengabdian masyarakat\n\n4. Internasinalisasi, Summit dan Rekognisi\n\n) Total Kredit SKEM\n\nNOTES:\n\nIl. Khusus kegiatan LKMM tidak memerlukan bobot sebagai faktor pengkali sehingga\nlangsung kepada nilai SKEM dibagi dengan jumlah nilai SKEM untuk mendapatkan IP\nSKEM.\n\n2 Penilaian IP SKEM harus minimal menyertakan dua katagori kecuali Magang dan\nWirausaha sebagai owner atau direktur utama.\n\n3. Dalam satu semester IP Skem harus minimal 2.1 agar bisa dinyatakan lulus.\n\n4 Skem dengan formula baru ini hanya berlaku pada mahasiswa Angkatan 2018 keatas,\nsedangkan untuk mahasiswa Angkatan 2017 kebawah masih berlaku SKEM lama.\n\n5. Bagi mahasiswa dengan keterbatasan tertentu sehingga tidak memungkinkan untuk\nmengikuti SKEM baru, TIM Ditmawa akan membentuk tim review internal dengan\nmelibatkan TKK Departemen.', '5. Bagi mahasiswa dengan keterbatasan tertentu sehingga tidak memungkinkan untuk\nmengikuti SKEM baru, TIM Ditmawa akan membentuk tim review internal dengan\nmelibatkan TKK Departemen.\n\n6. Apabila ada kegiatan berkelompok seperti kegiatan lomba maka yang dinilai adalah\nketua kelompoknya dan anggota mengikuti nilai dari ketua kelompok tersebut.', '6 BAB III  \nLAPORAN TUGAS AKHIR \n \n3.1. Sistem atika \n Siste matika l aporan Tugas Akhir terdiri atas  tiga ba gian besar, \nyaitu : \n \n1. Bagian ’Awal’ terdiri dari: \na. Judul Tu gas Akhir dala m bahasa In donesia dan  bahasa \nInggris pada kulit m uka dan kulit  dalam  (Lampiran 1 ) \nb. Hala man pengesahan ( Lampiran 2 ) \nc. Abstrak atau  uraian singkat dalam  bahasa Indonesia dan  \nbahasa Inggris ( Lampiran 3 ) \nd. Kata pengantar \ne. Daftar isi \nf. Daftar gam bar, grafik, diag ram \ng. Daftar tabel \nh. Daftar si mbol \n \n2. Bagian ‘Inti/Pokok’ atau ‘Batang Tubuh’ berisi :  \n a. Pendahuluan  \n• Latar belakan g masalah \n• Rumusan Per masalahan  \n• Batasan m asalah/ruang lingkup \n• Tujuan  \n• Manfaat (bila diperlukan untuk ditulis) \nb. Tinjauan Pustaka \n• Hasil peneliti an terdahulu yang relevan \n• Teori yang akan digunakan untuk meny elesaikan  \npermasalahan   \nc. Metodolog i  \n• Metode y ang digunakan \n• Bahan dan perala tan y ang digunakan \n• Urutan pelaksanaan percobaan', 'Ketentuan dan Simulasi\n1. Pedoman SKEM ini mengikat bagi mahasiswa ITS mulai angkatan tahun akademik\n2018 keatas sebagai persyaratan mengikuti yudisium.\n2. Bukti atau dokumen pendukung kegiatan SKEM harus diunggah di myITS\nStudentConnect paling lambat satu tahun terhitung semenjak selesai kegiatan. Apabila\nmelebihi batas tersebut diatas maka dinyatakan tidak berlaku.\n3. Minimal kegiatan SKEM mencakup 2 bagian dari 4 bagian dalam peraturan (kecuali\nMagang/KP dan Kewirausahaan).\n4. Pengisian portofolio kegiatan SKEM dapat dilakukan pada akhir semester sebelumnya.']","Untuk mengajukan SKPI (Sistem Kredit Prestasi Mahasiswa) di ITS, mahasiswa harus memenuhi beberapa ketentuan dan langkah-langkah sebagai berikut:

1. Pastikan Anda merupakan mahasiswa ITS angkatan tahun akademik 2018 ke atas, karena SKPI ini berlaku bagi mahasiswa tersebut sebagai persyaratan mengikuti yudisium.
2. Selengkapnya, bukti atau dokumen pendukung kegiatan SKPI harus diunggah di myITS StudentConnect paling lambat satu tahun terhitung semenjak selesai kegiatan. Jika melebihi batas waktu tersebut, pengajuan SKPI dianggap tidak berlaku.
3. Minimal kegiatan SKPI yang diajukan harus mencakup 2 bagian dari 4 bagian dalam peraturan yang telah ditetapkan, kecuali untuk Magang/KP dan Kewirausahaan.
4. Pengisian portofolio kegiatan SKPI dapat dilakukan pada akhir semester sebelumnya.

Dengan memenuhi ketentuan di atas, mahasiswa dapat mengajukan SKPI sesuai dengan prosedur yang berlaku di ITS. Jika terdapat kendala atau pertanyaan lebih lanjut, mahasiswa dapat menghubungi TIM Ditmawa yang akan membentuk tim review internal dengan melibatkan TKK Departemen."
9,Apa ciri-ciri Tugas Akhir?,"Perumusan masalah atau ide, judul dipilih sendiri atau oleh dosen pembimbing, berdasarkan pengamatan laboratorium/lapangan, ketertiban metodologi, bimbingan berkala, cermat dalam sajian, dipresentasikan dalam forum seminar, dipertahankan dalam ujian lisan","['dicantum kan. Cara menyebutkan sum ber ialah  dengan \nmenuliskan nam a pengarang dan tahun publi kasi didalam  \nkurung. Untuk kutipan yang diam bil tidak secara la ngsung \ndari aslin ya maka y ang dituliskan adal ah nama penulis asli \ndan nam a penyuntin g (contoh: Faqih  dalam  Sulistijono, \n2006). Cara menuliskan daftar acu an dapat dilihat pada Sub \nbab 3.1 0. \n \n3.3. Halaman Judul \n Halaman judul ( Lampiran 1 ) sama den gan halam an kulit luar, \nberisi : tulisan ”TUGAS AKHIR”, judul Tugas Akhir; lam bang ITS, \nnama penulis dengan nomor pokok (N RP); nama ju rusan, fakultas, \n10 institut (dit ulis lengkap), dan nam a kota (Surabaya), serta tah un \npembuatan. Halaman ju dul ditu lis dalam  bahasa Inggris dan  \nIndonesia dalam  halam an yang berbe da. Kedua halam an judul \ntersebut menggunakan karakteristik  huruf y ang sama dengan bagian \nhalam an yang lain (bukan  huruf tim bul atau warna). \n Judul Tugas Akhir harus diketik seluru hnya dengan huruf-h uruf', '6 BAB III  \nLAPORAN TUGAS AKHIR \n \n3.1. Sistem atika \n Siste matika l aporan Tugas Akhir terdiri atas  tiga ba gian besar, \nyaitu : \n \n1. Bagian ’Awal’ terdiri dari: \na. Judul Tu gas Akhir dala m bahasa In donesia dan  bahasa \nInggris pada kulit m uka dan kulit  dalam  (Lampiran 1 ) \nb. Hala man pengesahan ( Lampiran 2 ) \nc. Abstrak atau  uraian singkat dalam  bahasa Indonesia dan  \nbahasa Inggris ( Lampiran 3 ) \nd. Kata pengantar \ne. Daftar isi \nf. Daftar gam bar, grafik, diag ram \ng. Daftar tabel \nh. Daftar si mbol \n \n2. Bagian ‘Inti/Pokok’ atau ‘Batang Tubuh’ berisi :  \n a. Pendahuluan  \n• Latar belakan g masalah \n• Rumusan Per masalahan  \n• Batasan m asalah/ruang lingkup \n• Tujuan  \n• Manfaat (bila diperlukan untuk ditulis) \nb. Tinjauan Pustaka \n• Hasil peneliti an terdahulu yang relevan \n• Teori yang akan digunakan untuk meny elesaikan  \npermasalahan   \nc. Metodolog i  \n• Metode y ang digunakan \n• Bahan dan perala tan y ang digunakan \n• Urutan pelaksanaan percobaan', 'penelitian atau perancanga n (desain) y ang berdasarkan \nrasional tertentu yang dinilai penting  dan berm anfaat \nditinjau dari beberapa segi  \nc. Mam pu melaksanakan penelitian/desain, m ulai d ari \npenyusunan,  pelaksanaan, sam pai pelap oran \nd. Mam pu melakukan kajia n secara kuantitatif dan/ atau \nkualitatif, serta menyusun kesimpulan y ang jelas \ne. Mampu mempresenta sikan dan m empertahankan hasil \nTugas Akhir  dalam  ujian lisan di hadapan tim  dosen \npenguji \n  \n1.3. Bentu k Tugas Akhir \n  Bentuk tugas akhir bisa berupa  penelitian atau perancangan, \nyang terdiri a tas proposal tugas akhir da n laporan tu gas akhir. \n \n1.3.1. Tugas Akhir y ang berupa penelitian \nTugas akhir y ang berupa penelitia n harus mengandung \nkejelasan t entang hal-hal y ang ingin diselidiki ( something to \nbe inquired o r examined ), antara lain: \n  \n a. Obyek yang akan diteliti \n b.  Perm asalahan yang ingin dipecahkan  \n c. Hipotesa y ang ingin dibuk tikan/diuji ke benaranny a', '2.1. Isi Pro posal Tugas Akhir \n Proposal Tugas Akhir hendakny a dibuat secara realistis,  \nkomprehensif, dan terperin ci yang berisi hal-hal berik ut ini : \n \na.  Judul Pro posal \nJudul pro posal hendakn ya singka t, jelas, dan menggam barkan  \ntema pokok. Judul harus diterjem ahkan kedalam  bahasa Inggris \nyang representatif, dan di tuliskan di bagian bawah judul bahasa \nIndonesia. \n \nb.  Uraian Singkat  \nUraian singkat berisi tentang hal- hal yang akan dik erjakan pada \npelaksanaan Tugas Akhir (300 kata sam pai 500 kat a).  \n \nc.  Pendahuluan  \nPendahuluan  berisi hal-h al yang mendoron g atau hal-hal yang \nmelat arbelak angi pentingny a dilakukan penelitian tersebut. \nKomponen-k omponen dalam  bab ini diantarany a adalah : (1)  \nLatar belaka ng m asalah ;  (2) Perum usan masalah ; (3) Batasan  \nmasalah/ruang lingkup ; (4) Tuju an Pe nelitian dan ( 5) Relevansi \natau Manfaat hasil penelitian \n \nc.1. Latar belakang masal ah']","Tugas Akhir dapat memiliki ciri-ciri sebagai berikut:
1. Tugas Akhir dapat berupa penelitian atau perancangan.
2. Tugas Akhir terdiri atas proposal Tugas Akhir dan laporan Tugas Akhir.
3. Tugas Akhir yang berupa penelitian harus mengandung kejelasan tentang hal-hal yang ingin diselidiki, seperti obyek yang akan diteliti, permasalahan yang ingin dipecahkan, dan hipotesis yang ingin dibuktikan.
4. Proposal Tugas Akhir hendaknya dibuat secara realistis, komprehensif, dan terperinci.
5. Judul Tugas Akhir harus singkat, jelas, dan menggambarkan tema pokok. Judul juga harus diterjemahkan ke dalam bahasa Inggris yang representatif.
6. Laporan Tugas Akhir harus memiliki bagian awal yang terdiri dari judul Tugas Akhir, halaman pengesahan, abstrak, kata pengantar, daftar isi, daftar gambar, grafik, diagram, daftar tabel, dan daftar simbol.
7. Laporan Tugas Akhir juga harus memiliki bagian inti atau pokok yang berisi pendahuluan, tinjauan pustaka, metodologi, hasil penelitian, kesimpulan, serta presentasi dan pembelaan hasil Tugas Akhir dalam ujian lisan."
10,Apa bentuk Tugas Akhir?,Penelitian atau perancangan yang terdiri dari proposal tugas akhir dan laporan tugas akhir,"['dicantum kan. Cara menyebutkan sum ber ialah  dengan \nmenuliskan nam a pengarang dan tahun publi kasi didalam  \nkurung. Untuk kutipan yang diam bil tidak secara la ngsung \ndari aslin ya maka y ang dituliskan adal ah nama penulis asli \ndan nam a penyuntin g (contoh: Faqih  dalam  Sulistijono, \n2006). Cara menuliskan daftar acu an dapat dilihat pada Sub \nbab 3.1 0. \n \n3.3. Halaman Judul \n Halaman judul ( Lampiran 1 ) sama den gan halam an kulit luar, \nberisi : tulisan ”TUGAS AKHIR”, judul Tugas Akhir; lam bang ITS, \nnama penulis dengan nomor pokok (N RP); nama ju rusan, fakultas, \n10 institut (dit ulis lengkap), dan nam a kota (Surabaya), serta tah un \npembuatan. Halaman ju dul ditu lis dalam  bahasa Inggris dan  \nIndonesia dalam  halam an yang berbe da. Kedua halam an judul \ntersebut menggunakan karakteristik  huruf y ang sama dengan bagian \nhalam an yang lain (bukan  huruf tim bul atau warna). \n Judul Tugas Akhir harus diketik seluru hnya dengan huruf-h uruf', '30\n\x0cLAMPIRAN 7: Contoh Halaman Judul Tugas Akhir Bahasa Indonesia\n\n\n\n\n                                                                31\n\x0cLAMPIRAN 8: Contoh Halaman Judul Tugas Akhir Bahasa Inggris\n\n\n\n\n                                                              32\n\x0cLAMPIRAN 9: Contoh Halaman Pengesahan Tugas Akhir\n\n                        LEMBAR PENGESAHAN\n\n  JUDUL TUGAS AKHIR DITULIS SINGKAT JELAS DAN MENGGAMBARKAN\n                          TEMA POKOK\n\n\n                                TUGAS AKHIR\n                    Diajukan untuk memenuhi salah satu syarat\n                      memperoleh gelar <Nama Gelar> pada\n                    Program Studi S-1 <Nama Program Studi>\n                        Departemen <Nama Departemen>\n                            Fakultas <Nama Fakultas>\n                      Institut Teknologi Sepuluh Nopember', '6 BAB III  \nLAPORAN TUGAS AKHIR \n \n3.1. Sistem atika \n Siste matika l aporan Tugas Akhir terdiri atas  tiga ba gian besar, \nyaitu : \n \n1. Bagian ’Awal’ terdiri dari: \na. Judul Tu gas Akhir dala m bahasa In donesia dan  bahasa \nInggris pada kulit m uka dan kulit  dalam  (Lampiran 1 ) \nb. Hala man pengesahan ( Lampiran 2 ) \nc. Abstrak atau  uraian singkat dalam  bahasa Indonesia dan  \nbahasa Inggris ( Lampiran 3 ) \nd. Kata pengantar \ne. Daftar isi \nf. Daftar gam bar, grafik, diag ram \ng. Daftar tabel \nh. Daftar si mbol \n \n2. Bagian ‘Inti/Pokok’ atau ‘Batang Tubuh’ berisi :  \n a. Pendahuluan  \n• Latar belakan g masalah \n• Rumusan Per masalahan  \n• Batasan m asalah/ruang lingkup \n• Tujuan  \n• Manfaat (bila diperlukan untuk ditulis) \nb. Tinjauan Pustaka \n• Hasil peneliti an terdahulu yang relevan \n• Teori yang akan digunakan untuk meny elesaikan  \npermasalahan   \nc. Metodolog i  \n• Metode y ang digunakan \n• Bahan dan perala tan y ang digunakan \n• Urutan pelaksanaan percobaan', '2.1. Isi Pro posal Tugas Akhir \n Proposal Tugas Akhir hendakny a dibuat secara realistis,  \nkomprehensif, dan terperin ci yang berisi hal-hal berik ut ini : \n \na.  Judul Pro posal \nJudul pro posal hendakn ya singka t, jelas, dan menggam barkan  \ntema pokok. Judul harus diterjem ahkan kedalam  bahasa Inggris \nyang representatif, dan di tuliskan di bagian bawah judul bahasa \nIndonesia. \n \nb.  Uraian Singkat  \nUraian singkat berisi tentang hal- hal yang akan dik erjakan pada \npelaksanaan Tugas Akhir (300 kata sam pai 500 kat a).  \n \nc.  Pendahuluan  \nPendahuluan  berisi hal-h al yang mendoron g atau hal-hal yang \nmelat arbelak angi pentingny a dilakukan penelitian tersebut. \nKomponen-k omponen dalam  bab ini diantarany a adalah : (1)  \nLatar belaka ng m asalah ;  (2) Perum usan masalah ; (3) Batasan  \nmasalah/ruang lingkup ; (4) Tuju an Pe nelitian dan ( 5) Relevansi \natau Manfaat hasil penelitian \n \nc.1. Latar belakang masal ah']","Tugas Akhir memiliki bentuk berupa laporan yang terdiri dari beberapa bagian, yaitu bagian 'Awal' dan bagian 'Inti/Pokok'. Bagian 'Awal' terdiri dari judul Tugas Akhir dalam bahasa Indonesia dan bahasa Inggris, halaman pengesahan, abstrak atau uraian singkat dalam bahasa Indonesia dan bahasa Inggris, kata pengantar, daftar isi, daftar gambar, grafik, diagram, daftar tabel, dan daftar simbol. Sedangkan bagian 'Inti/Pokok' atau 'Batang Tubuh' berisi pendahuluan, tinjauan pustaka, dan metodologi."
11,Apa isi bagian ‘Awal’ laporan tugas akhir?,"Judul Tugas Akhir, Halaman pengesahan, Abstrak, Kata pengantar, Daftar isi, Daftar gambar, grafik, diagram, Daftar tabel, Daftar simbol","['6 BAB III  \nLAPORAN TUGAS AKHIR \n \n3.1. Sistem atika \n Siste matika l aporan Tugas Akhir terdiri atas  tiga ba gian besar, \nyaitu : \n \n1. Bagian ’Awal’ terdiri dari: \na. Judul Tu gas Akhir dala m bahasa In donesia dan  bahasa \nInggris pada kulit m uka dan kulit  dalam  (Lampiran 1 ) \nb. Hala man pengesahan ( Lampiran 2 ) \nc. Abstrak atau  uraian singkat dalam  bahasa Indonesia dan  \nbahasa Inggris ( Lampiran 3 ) \nd. Kata pengantar \ne. Daftar isi \nf. Daftar gam bar, grafik, diag ram \ng. Daftar tabel \nh. Daftar si mbol \n \n2. Bagian ‘Inti/Pokok’ atau ‘Batang Tubuh’ berisi :  \n a. Pendahuluan  \n• Latar belakan g masalah \n• Rumusan Per masalahan  \n• Batasan m asalah/ruang lingkup \n• Tujuan  \n• Manfaat (bila diperlukan untuk ditulis) \nb. Tinjauan Pustaka \n• Hasil peneliti an terdahulu yang relevan \n• Teori yang akan digunakan untuk meny elesaikan  \npermasalahan   \nc. Metodolog i  \n• Metode y ang digunakan \n• Bahan dan perala tan y ang digunakan \n• Urutan pelaksanaan percobaan', 'dicantum kan. Cara menyebutkan sum ber ialah  dengan \nmenuliskan nam a pengarang dan tahun publi kasi didalam  \nkurung. Untuk kutipan yang diam bil tidak secara la ngsung \ndari aslin ya maka y ang dituliskan adal ah nama penulis asli \ndan nam a penyuntin g (contoh: Faqih  dalam  Sulistijono, \n2006). Cara menuliskan daftar acu an dapat dilihat pada Sub \nbab 3.1 0. \n \n3.3. Halaman Judul \n Halaman judul ( Lampiran 1 ) sama den gan halam an kulit luar, \nberisi : tulisan ”TUGAS AKHIR”, judul Tugas Akhir; lam bang ITS, \nnama penulis dengan nomor pokok (N RP); nama ju rusan, fakultas, \n10 institut (dit ulis lengkap), dan nam a kota (Surabaya), serta tah un \npembuatan. Halaman ju dul ditu lis dalam  bahasa Inggris dan  \nIndonesia dalam  halam an yang berbe da. Kedua halam an judul \ntersebut menggunakan karakteristik  huruf y ang sama dengan bagian \nhalam an yang lain (bukan  huruf tim bul atau warna). \n Judul Tugas Akhir harus diketik seluru hnya dengan huruf-h uruf', '• Teori yang akan digunakan untuk meny elesaikan  \npermasalahan   \nc. Metodolog i  \n• Metode y ang digunakan \n• Bahan dan perala tan y ang digunakan \n• Urutan pelaksanaan percobaan \n7 d. Hasil dan Pe mbahasan \n• Data hasil percobaan/pengu kuran \n• Pembahasan/Diskusi (analisis, sintesis d an evaluasi)   \ne. Kesim pulan dan Saran \n• Berupa hasil  penelitian yang menjawab perm asalah an \natau y ang berupa konsep, program , dan kary a rancangan \n• Saran-saran (jika diangga p pe rlu), berisi hal-hal yang \nmasih dapat dikerjakan dengan lebih  baik dan  dapat \ndikem bangkan lebih lanj ut, atau berisi masalah-masalah \nyang dialam i pada saat proses pengerjaa n tugas akhir. \n \n3. Bagian ’Akhi r’ terdiri dari: \n a. Daftar Pustak a \n b. Lampiran-la mpiran (jika ada) \n c. Biodata penul is \n \n3.2. F ormat Laporan \n Pengetikan t ugas akhir harus mengikuti ketentu an sebagai \nberikut ini: \n \na. Jenis dan uku ran kertas : \nKertas HVS 80 gram  ukuran A5 (148 m m x 210 mm) \nb. Jarak spasi : 1 (satu)', '− Nomor terdiri dari 2 bagian, bagian pertam a \nmenunjukkan  bab sedangkan b agian kedua   \nmenunjukkan  nom or tabel (contoh:  Tabel 2.1, Tabel 3.2,  \nTabel 3.3, ds b.). \n− Nomor dan Judul Tabel diletakkan di atas tabel  serta \nsetiap kata  dimulai dengan huruf besar kecuali  kata  \nsambung. \n  \n Gam bar-gambar diberi nom or urut pada setiap bab dengan  \nangka Arab dengan ketentu an penulisan sbb: \n- Nomor terdiri dari 2 bagian, bagian pertam a \nmenunjukkan  bab sedangkan b agian kedua   \nmenunjukkan  nom or gambar. (contoh  : Gam bar 2.1 , \nGam bar 3.2, Gam bar 3.3, dsb. ). \n9 - Nomor dan Judul Gam bar diletakkan di bawah  gam bar. \n \nh. Ketebalan ku lit muka dan kulit belakang tidak lebi h dari 1 \nmm (soft cover). Tulisan pada kulit muka  sama dengan \nlembar Judul Tugas Akhir.  \n \ni. Berbagai tingkatan judul bab \n- Bab dan Judul bab : diket ik dengan huruf besar sem ua \npada halam an baru denga n jara k seim bang dari tepi  kiri']","Isi dari bagian ‘Awal’ laporan tugas akhir terdiri dari:
1. Judul Tugas Akhir dalam bahasa Indonesia dan bahasa Inggris pada kulit muka dan kulit dalam
2. Halaman pengesahan
3. Abstrak atau uraian singkat dalam bahasa Indonesia dan bahasa Inggris
4. Kata pengantar
5. Daftar isi
6. Daftar gambar, grafik, diagram
7. Daftar tabel
8. Daftar simbol

Semua isi tersebut merupakan bagian dari bagian ‘Awal’ dalam laporan tugas akhir."
12,Apa yang harus ada dalam halaman abstrak laporan tugas akhir?,"Judul, nama penulis, NRP, nama pembimbing, abstrak, kata kunci, ditulis dalam bahasa Inggris dan Indonesia","['6 BAB III  \nLAPORAN TUGAS AKHIR \n \n3.1. Sistem atika \n Siste matika l aporan Tugas Akhir terdiri atas  tiga ba gian besar, \nyaitu : \n \n1. Bagian ’Awal’ terdiri dari: \na. Judul Tu gas Akhir dala m bahasa In donesia dan  bahasa \nInggris pada kulit m uka dan kulit  dalam  (Lampiran 1 ) \nb. Hala man pengesahan ( Lampiran 2 ) \nc. Abstrak atau  uraian singkat dalam  bahasa Indonesia dan  \nbahasa Inggris ( Lampiran 3 ) \nd. Kata pengantar \ne. Daftar isi \nf. Daftar gam bar, grafik, diag ram \ng. Daftar tabel \nh. Daftar si mbol \n \n2. Bagian ‘Inti/Pokok’ atau ‘Batang Tubuh’ berisi :  \n a. Pendahuluan  \n• Latar belakan g masalah \n• Rumusan Per masalahan  \n• Batasan m asalah/ruang lingkup \n• Tujuan  \n• Manfaat (bila diperlukan untuk ditulis) \nb. Tinjauan Pustaka \n• Hasil peneliti an terdahulu yang relevan \n• Teori yang akan digunakan untuk meny elesaikan  \npermasalahan   \nc. Metodolog i  \n• Metode y ang digunakan \n• Bahan dan perala tan y ang digunakan \n• Urutan pelaksanaan percobaan', 'dicantum kan. Cara menyebutkan sum ber ialah  dengan \nmenuliskan nam a pengarang dan tahun publi kasi didalam  \nkurung. Untuk kutipan yang diam bil tidak secara la ngsung \ndari aslin ya maka y ang dituliskan adal ah nama penulis asli \ndan nam a penyuntin g (contoh: Faqih  dalam  Sulistijono, \n2006). Cara menuliskan daftar acu an dapat dilihat pada Sub \nbab 3.1 0. \n \n3.3. Halaman Judul \n Halaman judul ( Lampiran 1 ) sama den gan halam an kulit luar, \nberisi : tulisan ”TUGAS AKHIR”, judul Tugas Akhir; lam bang ITS, \nnama penulis dengan nomor pokok (N RP); nama ju rusan, fakultas, \n10 institut (dit ulis lengkap), dan nam a kota (Surabaya), serta tah un \npembuatan. Halaman ju dul ditu lis dalam  bahasa Inggris dan  \nIndonesia dalam  halam an yang berbe da. Kedua halam an judul \ntersebut menggunakan karakteristik  huruf y ang sama dengan bagian \nhalam an yang lain (bukan  huruf tim bul atau warna). \n Judul Tugas Akhir harus diketik seluru hnya dengan huruf-h uruf', 'teks, dijelaskan di dalam bab berikut. Penjelasan ini, secara otomatis dapat tercetak di dalam\nhasil tulisan dengan menggunakan bantuan MS Worls, dalam fitur “Reference”, dengan mode:\nStyle “APA”. Apabila menggunakan bantuan otomasi MS Word, maka penulis tidak perlu\nmengetik secara manual, dan hasilnya akan tertampil baik di dalam teks sebagai sitasi, maupun\ndi dalam daftar acuan sebagai daftar pustaka yang digunakan.', 'tersebut menggunakan karakteristik  huruf y ang sama dengan bagian \nhalam an yang lain (bukan  huruf tim bul atau warna). \n Judul Tugas Akhir harus diketik seluru hnya dengan huruf-h uruf \nbesar dan tidak boleh disingkat, kecuali singkatan yang sudah baku.  \n Nama penulis harus ditulis dengan huruf besar dan tidak \ndisingkat.   \n \n3.4. Hala man Pen gesahan  \n Hala man pengesahan diletakkan pada hala man sesud ah hala man \njudul.  \n Hala man pengesahan berisi : tulisan ”LEMBA R \nPENGESAHAN”, judul Tugas Ak hir; tujuan ddiiaajjuukkaannnnyyaa  TTAA,,  \nppeerrsseettuujjuuaann  ppeemmbbiimmbbiinngg  ((ddaappaatt  lleebbiihh  ddaarrii  ssaattuu)),,  nnaammaa--nnaammaa  \nppeemmbbiimmbbiinngg,,  kkoottaa,,  bbuullaann  ddaann    ttaahhuunn  ppeennggeessaahhaann..  Halam an ini sel alu \ndiketik dala m huruf-huruf besar, tepat di tengah-tengah halaman  \nsimetri kiri-kanan. Contoh halaman pengesahan pada la mpiran 2. \n \n3.5. Halaman Abstrak']","Dalam halaman abstrak laporan tugas akhir, harus ada uraian singkat dalam bahasa Indonesia dan bahasa Inggris yang menjelaskan secara ringkas tentang isi dari tugas akhir tersebut. Abstrak ini biasanya mencakup latar belakang masalah, tujuan penelitian, metode yang digunakan, hasil yang dicapai, dan kesimpulan yang diperoleh."
13,Bagaimana cara login ke MONTA?,Melakukan login dengan default username dan password adalah NRP ke monta.if.its.ac.id,"['SOP (Guidelines) Mahasiswa\n\n\nBerikut merupakan guidelines penggunaan MONTA untuk mahasiswa:\n\n\n\uf076 Login ke MONTA (monta.if.its.ac.id)\n   1. Melakukan login terlebih dahulu (default username dan password adalah NRP).\n\n\n\n\n   2. Setelah login, maka akan masuk ke halaman mahasiswa.', 'Kirim permintaan pada platform MyiTS SSO di fitur: MyITS Student Connect\n12. Layanan Reset Password Sister\nKirim permintaan pada tautan: Servicesdesk.its.ac.id\n13. Layanan Aktivasi Gate\nLuring secara realtime di PLT, Gedung KPA, Plaza dr. Angka, Lantai 1\n14. Layanan Lost and Found\nLapor pada tautan: its.Id/lost\n15. Layanan Id Card Pegawai\nKirim ajuan pada tautan: its.id/idCard\nCatatan: Layanan dilakukan secara daring maupun luring di jam kerja\nSENIN - KAMIS JUMAT\nJam Kerja : 08.00 - 16.00 WIB Jam Kerja : 08.00 - 15.00 WIB\nJam Istirahat : 12.00 - 13.00 WIB Jam Istirahat : 12.00 - 13.00 WIB', '6 BAB III  \nLAPORAN TUGAS AKHIR \n \n3.1. Sistem atika \n Siste matika l aporan Tugas Akhir terdiri atas  tiga ba gian besar, \nyaitu : \n \n1. Bagian ’Awal’ terdiri dari: \na. Judul Tu gas Akhir dala m bahasa In donesia dan  bahasa \nInggris pada kulit m uka dan kulit  dalam  (Lampiran 1 ) \nb. Hala man pengesahan ( Lampiran 2 ) \nc. Abstrak atau  uraian singkat dalam  bahasa Indonesia dan  \nbahasa Inggris ( Lampiran 3 ) \nd. Kata pengantar \ne. Daftar isi \nf. Daftar gam bar, grafik, diag ram \ng. Daftar tabel \nh. Daftar si mbol \n \n2. Bagian ‘Inti/Pokok’ atau ‘Batang Tubuh’ berisi :  \n a. Pendahuluan  \n• Latar belakan g masalah \n• Rumusan Per masalahan  \n• Batasan m asalah/ruang lingkup \n• Tujuan  \n• Manfaat (bila diperlukan untuk ditulis) \nb. Tinjauan Pustaka \n• Hasil peneliti an terdahulu yang relevan \n• Teori yang akan digunakan untuk meny elesaikan  \npermasalahan   \nc. Metodolog i  \n• Metode y ang digunakan \n• Bahan dan perala tan y ang digunakan \n• Urutan pelaksanaan percobaan', 'Indonesia (KONI) dengan menunjukkan sertifikat/surat keterangan dimana\nverifikasi dilakukan oleh dosen wali.\n13. Bagi mahasiswa yang tidak memiliki sertifikat kegiatan, bisa digantikan dengan surat\npernyataan bermaterai (Format surat pernyataan bebas). Dalam satu Surat Pernyataan\ndapat berisi beberapa kegiatan.\n14. Bagi mahasiswa yang tidak memiliki surat tugas bisa dimintakan ke direktorat\nkemahasiswaan atau fakultas. Surat tugas bisa menghubungi Direktorat\nKemahasiswaan (CP Mas Reza 081414170021).\n15. Bagi mahasiswa yang tidak memiliki foto kegiatan bisa digantikan dengan screenshot\nkegiatan tersebut di website.']","Untuk login ke MONTA, Anda dapat mengikuti langkah-langkah berikut:
1. Buka website MONTA di monta.if.its.ac.id
2. Lakukan login dengan menggunakan default username dan password, yang biasanya adalah NRP Anda.
3. Setelah login berhasil, Anda akan masuk ke halaman mahasiswa."
14,Apa yang dilakukan setelah topik dan draft proposal TA sudah disetujui?,Melakukan pendaftaran proposal TA ke sistem MONTA dan mengunggah file draft proposal yang sudah disepakati pembimbing,"['1. Langkah awal sebelum mengisikan data proposal TA ke MONTA, mahasiswa wajib berdiskusi\n      terlebih dahulu dengan calon dosen pembimbing perihal topik TA yang ingin dikerjakan sambil\n      bimbingan dalam penyusunan draft proposal TA.\n\n   2. Setelah topik dan draft proposal TA sudah disetujui, mahasiswa melakukan pendaftaran proposal\n      TA ke sistem dengan memilih menu Proposal TA –> Buat Proposal serta mengunggah file draft\n      proposal yang sudah disepakati pembimbing.\n      Setelah mengisi semua isian form maka memilih tombol Buat Proposal Baru.\n\n\n\n\n   3. Setelah mendaftarkan proposal, mahasiswa dapat mencetak cover proposal TA dengan memilih\n      menu Cetak Cover –> Cetak Cover Proposal TA.\n\n\n\n\n   4. Mahasiswa wajib menyerahkan kepada koordinator TA/Ketua RMK, hardcopy proposal TA\n      lengkap dengan cover proposal yang dicetak dari MONTA dan sudah disetujui/ditandatangani\n      oleh dosen pembimbing.', 'pengerjaan revi si adalah 2 minggu setelah sidang proposal tesis berlangsung.  \n13. Apabila revisi yang dikerjakan mahasiswa dirasa sudah tepat, dosen pembimbing dan \npenguji dapat memberikan persetujuan yang dibuktikan dengan menandatangi form revisi  \ndan lembar pengesahan buku proposal tesis . 14. Admin Akademik Pascasarjana  menginfokan link untuk upload hasil revisi sidang \nproposal tesis ke mahasiswa melalui grup Whatsapp.  \n15. Mahasiswa meng -upload file hasil revisi sidang proposal tesis dan lembar revisi sidang \nproposal tesis ke link https://bit.ly/HasilRevisiProposalTesisDTIf . \n16. Apabila mahasiswa sudah mengumpulkan softfile buku proposal tesis, Admin Akademik \nPascasarjana  mengubah status sidang proposal tesis di MonTes  dari ‘Revisi’  menjad i \n‘Disetujui’.  \n17. Mahasiswa dapat mengecek nilai sidang proposal tesis di SIAKAD ITS mata kuliah IF \n185301 Tesis -Proposal.  \n \n \nNotes: Link google form akan di -update setiap tahun ajaran', 'hasil revisiDokumen hasil\nrevisi sidang\nproposal tesis  \nApakah revisi\nsudah sesuai?Dokumen hasil\nrevisi sidang\nproposal tesis  Ketua RMK menentukan penguji\ndan menjadwalkan sidang\nproposal tesis setiap pesertaSOP PENDAFT ARAN SIDANG PROPOSAL TESIS PROGRAM STUDI S2 TEKNIK INFORMA TIKA (SISTEM ONLINE ), FT -EIC, ITS  \nYaDraft proposal tesis\ndan form persetujuan\npembimbing\nPemeriksa,\n \n \n \n \n \nLina Ambarwati, S.Kom.  \nNIP. 198003242014092001  Mengetahui,\nDr. Ahmad Saikhu, S.Si., M.T . \nNIP. 197107182006041001Pembuat,\n \n \n \n \n \nKartika Dwi Y uniavita Rahmawati, S.T .\nNPP. 1998202122056  \nJadwal sidang, link\nmeeting, dan VB\nTidak\nMenginfokan link google form\nuntuk meng-upload  seluruh\ndokumen hasil revisi sidang\nproposal tesis ke mahasiswa\nStatus sidang\nproposal tesis\nmenjadi ""Disetujui""Merekap data mahasiswa yang\ntelah menyelesaikan revisi\nsidang proposal tesis dan\nmenginfokan ke Kaprodi\nMeng-update status sidang\nproposal tesis di MonT esMeng-upload lembar revisi sidang', 'Ketua\nAnggota\nAnggota\nAnggota\n\n\nNilai rata-rata : .... (dalam angka)\n.... (dalam huruf)\nKetua Sidang,\nSurabaya,\nMengetahui :\nKetua Program Studi,\n47\n\nLampiran 7B\nContoh berita acara seminar proposal tesis\nDEPARTEMEN PENDIDIKAN NASIONAL\nINSTITUT TEKNOLOGI SEPULUH NOPEMBER SURABAYA\nPROGRAM PASCASARJANA\nBERITA ACARA\nSEMINAR PROPOSAL TESIS\nPada\nHari, Tanggal\nJam\nTempat\n.........\n:.........\n..........\ntelah dilaksanakan Seminar Proposal Tesis\nJudul\nOleh Nrp.\nProgram Studi\nBidang Keahlian\n:...\n:....\ndengan hasil\n1. disetujui\n2. disetujui dengan perbaikan / penyempuraan (jangka waktu perbaikan: ...hari)\n3. tidak disetujui atau mengulang\nPerbaikan / penyempurnaan yang harus dilakukan adalah : (kalau diperlukan dapat ditulis di lembar terpisah\nNama Dosen\nTanda Tangan\nKetua Sidang,\n1..\n2.\n.....\nMengetahui :\nKetua Program Studi,\n3.\n4.\n48\n\nCatatan : dibuat rangkap 4\n1. Direktur PPs - ITS\n2. Ketua Program Studi\n3. Dosen (-dosen) Pembimbing\n4. Mahasiswa yang bersangkutan\n49']","Setelah topik dan draft proposal TA sudah disetujui, langkah selanjutnya yang dilakukan adalah mahasiswa melakukan pendaftaran proposal TA ke sistem dengan memilih menu Proposal TA –> Buat Proposal serta mengunggah file draft proposal yang sudah disepakati pembimbing. Setelah mengisi semua isian form, mahasiswa kemudian memilih tombol Buat Proposal Baru. Setelah mendaftarkan proposal, mahasiswa dapat mencetak cover proposal TA dengan memilih menu Cetak Cover –> Cetak Cover Proposal TA. Selanjutnya, mahasiswa wajib menyerahkan kepada koordinator TA/Ketua RMK hardcopy proposal TA lengkap dengan cover proposal yang dicetak dari MONTA dan sudah disetujui/ditandatangani oleh dosen pembimbing."
15,Dimana mahasiswa dapat mencetak cover proposal TA?,Menu Cetak Cover –> Cetak Cover Proposal TA di MONTA,"['1. Langkah awal sebelum mengisikan data proposal TA ke MONTA, mahasiswa wajib berdiskusi\n      terlebih dahulu dengan calon dosen pembimbing perihal topik TA yang ingin dikerjakan sambil\n      bimbingan dalam penyusunan draft proposal TA.\n\n   2. Setelah topik dan draft proposal TA sudah disetujui, mahasiswa melakukan pendaftaran proposal\n      TA ke sistem dengan memilih menu Proposal TA –> Buat Proposal serta mengunggah file draft\n      proposal yang sudah disepakati pembimbing.\n      Setelah mengisi semua isian form maka memilih tombol Buat Proposal Baru.\n\n\n\n\n   3. Setelah mendaftarkan proposal, mahasiswa dapat mencetak cover proposal TA dengan memilih\n      menu Cetak Cover –> Cetak Cover Proposal TA.\n\n\n\n\n   4. Mahasiswa wajib menyerahkan kepada koordinator TA/Ketua RMK, hardcopy proposal TA\n      lengkap dengan cover proposal yang dicetak dari MONTA dan sudah disetujui/ditandatangani\n      oleh dosen pembimbing.', '2. Mahasiswa Program Sarjana dan Sarjana Terapan tidak dikenakan biaya Wisuda, hanya dikenakan uang jaminan toga (akan dikembalikan setelah toga kembali).\n3. Biaya sewa dan peminjaman toga mengacu pada surat yang dikeluarkan oleh Dharma Wanita Persatuan ITS Nomor B 362/Sekre/DPW-ITS/II/2024 tanggal 26 Februari 2024\ndan pada laman https://wisuda.dwpits.id', 'hasil revisiDokumen hasil\nrevisi sidang\nproposal tesis  \nApakah revisi\nsudah sesuai?Dokumen hasil\nrevisi sidang\nproposal tesis  Ketua RMK menentukan penguji\ndan menjadwalkan sidang\nproposal tesis setiap pesertaSOP PENDAFT ARAN SIDANG PROPOSAL TESIS PROGRAM STUDI S2 TEKNIK INFORMA TIKA (SISTEM ONLINE ), FT -EIC, ITS  \nYaDraft proposal tesis\ndan form persetujuan\npembimbing\nPemeriksa,\n \n \n \n \n \nLina Ambarwati, S.Kom.  \nNIP. 198003242014092001  Mengetahui,\nDr. Ahmad Saikhu, S.Si., M.T . \nNIP. 197107182006041001Pembuat,\n \n \n \n \n \nKartika Dwi Y uniavita Rahmawati, S.T .\nNPP. 1998202122056  \nJadwal sidang, link\nmeeting, dan VB\nTidak\nMenginfokan link google form\nuntuk meng-upload  seluruh\ndokumen hasil revisi sidang\nproposal tesis ke mahasiswa\nStatus sidang\nproposal tesis\nmenjadi ""Disetujui""Merekap data mahasiswa yang\ntelah menyelesaikan revisi\nsidang proposal tesis dan\nmenginfokan ke Kaprodi\nMeng-update status sidang\nproposal tesis di MonT esMeng-upload lembar revisi sidang', '3. Ayat 14, Penetapan predikat kelulusan ditentukan berdasarkan Indeks Prestasi Kumulatif\n    Predikat (IPKP) dan masa studi.\n\nAtas perhatian dan kerjasama yang diberikan, kami sampaikan terima kasih.\n\n\n                                                    Wakil Rektor Bidang Akademik dan\n                                                    Kemahasiswaan,\n\n\n\n\n                                                    Prof. Dr. Ir. Adi Soeprijanto, M.T.\n                                                    NIP. 196404051990021001\n\nTembusan :\n- Kepala Bagian Administrasi Umum dan Kearsipan Digital']",Mahasiswa dapat mencetak cover proposal TA dengan memilih menu Cetak Cover –> Cetak Cover Proposal TA.
16,Konten apa saja yang harus ada dalam video Tugas Akhir?,"Logo ITS, Judul Tugas Akhir, Data Pembuat dan Pembimbing, Deskripsi singkat Tugas Akhir, Cara jalannya aplikasi","['1. Jenis video adalah video promosi, boleh juga berupa video tutorial penggunaan software / hardware.\n2. Durasi video antara 1-5 menit\n3. Resolusi video 720p atau 1080i (HD)\n4. Bisa menggunakan video editor bebas, seperti Camtasia, Windows MovieMaker, dll.\n5. Format yang dikumpulkan berupa .mp4 atau .wmv\n6. Konten video minimal berisi :\n\nLogo ITS\nJudul Tugas Akhir\nData Pembuat dan Pembimbing (NRP, NIP, Nama, menggunakan foto juga boleh)\nDeskripsi singkat tugas akhir (boleh berupa narasi suara, anotasi dan atau tulisan)\nCara jalannya aplikasi (bisa direkam menggunakan video camcoder atau screen capture)\nSupaya lebih menarik, beri animasi title clip, caption, maupun musik latar belakang.\n================================\n= Ketentuan Poster Tugas Akhir =\n================================', 'dicantum kan. Cara menyebutkan sum ber ialah  dengan \nmenuliskan nam a pengarang dan tahun publi kasi didalam  \nkurung. Untuk kutipan yang diam bil tidak secara la ngsung \ndari aslin ya maka y ang dituliskan adal ah nama penulis asli \ndan nam a penyuntin g (contoh: Faqih  dalam  Sulistijono, \n2006). Cara menuliskan daftar acu an dapat dilihat pada Sub \nbab 3.1 0. \n \n3.3. Halaman Judul \n Halaman judul ( Lampiran 1 ) sama den gan halam an kulit luar, \nberisi : tulisan ”TUGAS AKHIR”, judul Tugas Akhir; lam bang ITS, \nnama penulis dengan nomor pokok (N RP); nama ju rusan, fakultas, \n10 institut (dit ulis lengkap), dan nam a kota (Surabaya), serta tah un \npembuatan. Halaman ju dul ditu lis dalam  bahasa Inggris dan  \nIndonesia dalam  halam an yang berbe da. Kedua halam an judul \ntersebut menggunakan karakteristik  huruf y ang sama dengan bagian \nhalam an yang lain (bukan  huruf tim bul atau warna). \n Judul Tugas Akhir harus diketik seluru hnya dengan huruf-h uruf', '30\n\x0cLAMPIRAN 7: Contoh Halaman Judul Tugas Akhir Bahasa Indonesia\n\n\n\n\n                                                                31\n\x0cLAMPIRAN 8: Contoh Halaman Judul Tugas Akhir Bahasa Inggris\n\n\n\n\n                                                              32\n\x0cLAMPIRAN 9: Contoh Halaman Pengesahan Tugas Akhir\n\n                        LEMBAR PENGESAHAN\n\n  JUDUL TUGAS AKHIR DITULIS SINGKAT JELAS DAN MENGGAMBARKAN\n                          TEMA POKOK\n\n\n                                TUGAS AKHIR\n                    Diajukan untuk memenuhi salah satu syarat\n                      memperoleh gelar <Nama Gelar> pada\n                    Program Studi S-1 <Nama Program Studi>\n                        Departemen <Nama Departemen>\n                            Fakultas <Nama Fakultas>\n                      Institut Teknologi Sepuluh Nopember', 'Berkas yang diperlukan untuk Yudisium S1 di Departemen Teknik Informatika DesclaimerBerkas yang diperlukan untuk Yudisium S1 di Departemen Teknik Informatika\nSOFTCOPY yang perlu dikumpulkan beserta penamaannya :\n\nPoster TA (NRP-nama-Video_TA contoh: 5102100006-Radityo-Anggoro-Video_TA)\nArtikel POMITS dalam format .doc atau .pdf (NRP-nama-POMITS contoh: 5102100006-Radityo-Anggoro-POMITS)\nVideo TA (NRP-nama-Poster_TA contoh: 5102100006-Radityo-Anggoro-Poster_TA)\nBuku TA (NRP-nama-Buku_TA contoh: 5102100006-Radityo-Anggoro-Buku_TA)\nPresentasi TA (NRP-nama-Slide_TA contoh: 5102100006-Radityo-Anggoro-Slide_TA)\n===============================\n= Ketentuan Video Tugas Akhir =\n===============================']","Konten yang harus ada dalam video Tugas Akhir antara lain:
1. Logo ITS
2. Judul Tugas Akhir
3. Data Pembuat dan Pembimbing (NRP, NIP, Nama, menggunakan foto juga boleh)
4. Deskripsi singkat tugas akhir (boleh berupa narasi suara, anotasi dan atau tulisan)
5. Cara jalannya aplikasi (bisa direkam menggunakan video camcoder atau screen capture)
6. Animasi title clip, caption, maupun musik latar belakang."
17,Bagaimana cara pengecekan file yang telah terunggah di POmITS?,Pengecekan file yang telah terunggah dapat dilakukan di https://lpmp2ki.its.ac.id/pomits.,"[""melakukan UNGGAH di Jurnal Repository, menggunakan login 'mahasiswa', dengan.\nkata sandi 'M4h4sisw4lTs!' ke alamat 'https://ejurnal.its.ac.id/index.php/index/login'\ndengan mengunggah file artikel dan file Form Telaah(dalam format pdf) saja.\nPengecekan file vang TERuNGGAH dapat dilihat di\nhttps://lpmp2ki.its.ac.id/pomits.\nJika terdapat penghapusan/penarikan artikel, dapat mengisi form pada link :\nhttps://its.id/FHAJTeknikITSPOMITS, untuk Jurnal Teknik ITS;\n1.-\nhttps:/l/its.id/FHAJSainsSenilTSPOMITS, untuk Jurnal Sains &Seni ITS;\n3.https://its.id/FHAJRepositorylTSPOMITS, untuk Jurnal Repository..\n Penghapusan Artikel akan dilakukan setelah yudisium berakhir.\nArtikel - artikel yang TIDAK MEMENUHI KETENTUAN PUBLIKASI (gaya selingkung\ntidak sesuai format dan file pendukung tidak lengkap) tidak akan DIPUBLIKASIKAN\ndi Jurnal Teknik ITS dan Jurnal Sains & Seni ITS.\nPeriode unggah artikel untuk yudisium 29 adalah sampai dengan \n15 Februari 2024 pukul 24.00 WIB"", '3        \nBebas Pustaka dengan mengakses e-Bebas-Pustaka melalui web perpustakaan.\n\nSalah satu persyaratan bebas Pustaka adalah upload buku TA melalui web repository.its.ac.id.\n\nBebas Pustaka akan dikirim langsung ke e-mail atau No. WA yang telah didaftarkan jika sudah TIDAK mempunyai tanggungan berupa pinjaman koleksi atau denda. Pengecekan pinjaman koleksi atau denda dapat dilakukan melalui web perpustakaan bagian layanan online pinjaman koleksi atau denda.\n\nBebas Pustaka: https://www.its.ac.id/perpustakaan/id/bebas-pustaka-id/\n\n \n\nUpload buku TA: https://repository.its.ac.id/\n\n4        \nMelakukan upload jurnal/artikel di Pomits.\n\n(Bagi mahasiswa Program Sarjana dan Sarjana Terapan)\n\nhttp://lpmp2ki.its.ac.id/pomits\n5        \nMelunasi IKOMA.\n\n(Bagi mahasiswa Program Sarjana dan Sarjana Terapan)', '\uf0b7   Pengecekan file yang TERUNGGAH dapat dilihat di\n    http://lpmp2ki.its.ac.id/pomits.\n\n\uf0b7   Jika terdapat penghapusan/penarikan artikel, dapat mengisi form pada link\n    \uf031\uf02e http://bit.ly/FHAJTeknikITS, untuk Jurnal Teknik ITS;\n    \uf032\uf02e http://bit.ly/FHAJSainsSeniITS, untuk Jurnal Sains &Seni ITS;\n    \uf033\uf02e http://bit.ly/FHAJRepositoryITS, untuk Repository.\n\n\n\uf0b7   List data Artikel terhapus dapat dilihat pada website jurnal.\n    (http://ejurnal.its.ac.id, yang diupdate tiap 3 hari)\n\n\uf0b7   Artikel - artikel yang TIDAK MEMENUHI KETENTUAN PUBLIKASI (gaya selingkung tidak\n    sesuai format dan file pendukung tidak lengkap) tidak akan DIPUBLIKASIKAN di\n    Jurnal POMITS.\n\n\uf0b7   Periode unggah artikel untuk yudisium 122 adalah sampai dengan\n    7 Agustus 2020, pukul 24.00 WIB', '\uf0b7   Mahasiswa yang Dosen Pembimbingnya memilih untuk MEMPUBLIKASIKAN\n    artikelnya pada Jurnal POMITS, dapat melakukan UNGGAH, dengan mengikuti langkah\n    pada BUKU PANDUAN TATA CARA UNGGAH. File yang HARUS DIUNGGAH adalah\n    (ukuran masing-masing file tidak boleh lebih dari 2 MB):\n    \uf031\uf02e Artikel hasil dari Tugas Akhir, dalam format Ms. Word yang telah mengikuti tem-\n       plate. (selain format Ms.Word artikel DITOLAK/REJECTED)\n    \uf032\uf02e Formulir Hak Cipta.\n    \uf033\uf02e Form Telaah Artikel POMITS, dalam format PDF.\n    \uf034\uf02e Form Revisi/Perbaikan/Penyempurnaan TA yang berisi nama penguji beserta\n       komentar dari penguji, dalam format PDF. (Mohon nama penguji tidak disingkat/\n       tidak hanya TTD saja)\n    \uf035\uf02e Template, Formulir Hak Cipta, Buku Panduan Tata Cara Unggah, dan Form Telaah\n       Artikel dapat diunduh pada link:\n       http://ejurnal.its.ac.id/index.php/teknik (Jurnal Teknik ITS)\n        http://ejurnal.its.ac.id/index.php/sains_seni (Jurnal Sains&Seni ITS)']","Untuk melakukan pengecekan file yang telah terunggah di Pomits, Anda dapat mengakses website http://lpmp2ki.its.ac.id/pomits. Di sana Anda dapat melihat daftar file yang telah terunggah. Jika terdapat penghapusan atau penarikan artikel, Anda dapat mengisi form pada link yang disediakan, yaitu http://bit.ly/FHAJTeknikITS untuk Jurnal Teknik ITS, http://bit.ly/FHAJSainsSeniITS untuk Jurnal Sains & Seni ITS, dan http://bit.ly/FHAJRepositoryITS untuk Repository. Selain itu, Anda juga dapat melihat daftar data artikel yang terhapus pada website jurnal, http://ejurnal.its.ac.id, yang diupdate setiap 3 hari."
18,Apa yang harus dilakukan jika terjadi kesalahan pada file yang sudah terunggah?,"Jika terjadi kesalahan pada file, mahasiswa dapat melakukan penghapusan artikel dan unggah ulang dengan mengikuti form pada link: https://its.id/FHAJTeknikITSPOMITS, https://its.id/FHAJSainsSenilTSPOMITS, dan https://its.id/FHAJRepositorylTSPOMITS.","['\uf0b7   Pengecekan file yang TERUNGGAH dapat dilihat di\n    http://lpmp2ki.its.ac.id/pomits.\n\n\uf0b7   Jika terdapat penghapusan/penarikan artikel, dapat mengisi form pada link\n    \uf031\uf02e http://bit.ly/FHAJTeknikITS, untuk Jurnal Teknik ITS;\n    \uf032\uf02e http://bit.ly/FHAJSainsSeniITS, untuk Jurnal Sains &Seni ITS;\n    \uf033\uf02e http://bit.ly/FHAJRepositoryITS, untuk Repository.\n\n\n\uf0b7   List data Artikel terhapus dapat dilihat pada website jurnal.\n    (http://ejurnal.its.ac.id, yang diupdate tiap 3 hari)\n\n\uf0b7   Artikel - artikel yang TIDAK MEMENUHI KETENTUAN PUBLIKASI (gaya selingkung tidak\n    sesuai format dan file pendukung tidak lengkap) tidak akan DIPUBLIKASIKAN di\n    Jurnal POMITS.\n\n\uf0b7   Periode unggah artikel untuk yudisium 122 adalah sampai dengan\n    7 Agustus 2020, pukul 24.00 WIB', '\uf0b7   Mahasiswa yang Dosen Pembimbingnya memilih untuk MEMPUBLIKASIKAN\n    artikelnya pada Jurnal POMITS, dapat melakukan UNGGAH, dengan mengikuti langkah\n    pada BUKU PANDUAN TATA CARA UNGGAH. File yang HARUS DIUNGGAH adalah\n    (ukuran masing-masing file tidak boleh lebih dari 2 MB):\n    \uf031\uf02e Artikel hasil dari Tugas Akhir, dalam format Ms. Word yang telah mengikuti tem-\n       plate. (selain format Ms.Word artikel DITOLAK/REJECTED)\n    \uf032\uf02e Formulir Hak Cipta.\n    \uf033\uf02e Form Telaah Artikel POMITS, dalam format PDF.\n    \uf034\uf02e Form Revisi/Perbaikan/Penyempurnaan TA yang berisi nama penguji beserta\n       komentar dari penguji, dalam format PDF. (Mohon nama penguji tidak disingkat/\n       tidak hanya TTD saja)\n    \uf035\uf02e Template, Formulir Hak Cipta, Buku Panduan Tata Cara Unggah, dan Form Telaah\n       Artikel dapat diunduh pada link:\n       http://ejurnal.its.ac.id/index.php/teknik (Jurnal Teknik ITS)\n        http://ejurnal.its.ac.id/index.php/sains_seni (Jurnal Sains&Seni ITS)', 'Pemberitahuan\nUnggah Artikel POmITS\nUNGGAH artikel WAJIB dilakukan oleh MAHASISWA PENDAFTAR YUDISIUM 129\n Mahasiswa yang Dosen Pembimbingnya memilih untuk MEMpuBLIKAsIKAN\nartikelnya pada Jurnal POmITS, dapat melakukan UNGGAH, dengan mengikuti langkah\npada BUKU PANDUAN TATA CARA UNGGAH. File yang HARUS DIUNGGAH adalah\n(ukuran masing-masing file tidak boleh lebih dari 2 MB):\nArtikel hasil dari Tugas Akhir, dalam format Ms. Word yang telah mengikuti tem-\n1.\nplate. (selain format Ms.Word artikel DITOLAK/REJECTED)\nFormulir Hak Cipta, dalam format PDF.\nForm Telaah Artikel POmITs, dalam format PDF.\nForm Revisi/Perbaikan/Penyempurnaan TA yang berisi nama penguji beserta\ntidak hanya TTD saja)\n Template, Formulir Hak Cipta, Buku Panduan Tata Cara Unggah, dan Form Telaah\n5.\nArtikel dapat diunduh pada link:\nhttps://ejurnal.its.ac.id/index.php/teknik (Jurnal Teknik ITS)\nhttps://ejurnal.its.ac.id/index.php/sains_seni (Jurnal Sains&Seni ITS)\nSection yang bisa dipilih pada Jurnal Teknik ITS:', 'teks, dijelaskan di dalam bab berikut. Penjelasan ini, secara otomatis dapat tercetak di dalam\nhasil tulisan dengan menggunakan bantuan MS Worls, dalam fitur “Reference”, dengan mode:\nStyle “APA”. Apabila menggunakan bantuan otomasi MS Word, maka penulis tidak perlu\nmengetik secara manual, dan hasilnya akan tertampil baik di dalam teks sebagai sitasi, maupun\ndi dalam daftar acuan sebagai daftar pustaka yang digunakan.']","Jika terjadi kesalahan pada file yang sudah terunggah, Anda dapat mengisi form pada link yang disediakan untuk penghapusan/penarikan artikel. Form tersebut dapat diakses melalui link berikut:
- http://bit.ly/FHAJTeknikITS, untuk Jurnal Teknik ITS
- http://bit.ly/FHAJSainsSeniITS, untuk Jurnal Sains & Seni ITS
- http://bit.ly/FHAJRepositoryITS, untuk Repository.

Selain itu, Anda juga dapat melihat list data Artikel terhapus pada website jurnal yang diupdate setiap 3 hari di http://ejurnal.its.ac.id."
19,Apa saja unsur dalam proposal tesis?,"Unsur dalam proposal tesis terdiri dari: Judul, Lembar Pengesahan, Abstrak, Daftar isi, Bagian tubuh (bab-bab), Rencana dan Jadwal Kerja Penelitian dan Penyusunan Tesis, Daftar pustaka, dan Lampiran.","['10. Mahasiswa melaksanakan sidang proposal tesis. Sedangkan, dosen pembimbing dan \npenguji memberikan feedback ke mahasiswa, mengisi berita acara , memberikan penilaian \ndan catatan revisi  sidang proposal tesis.  \n11. Setelah mahasiswa melaksanakan sidang proposal tesis, Admin Akademik Pascasarjana  \nmeng -update status sidang proposal tesis di MonTes dari ‘Terjadwal Ujian’ menjadi \n‘Revisi ’. \n12. Mahasiswa mengerjakan revisi dan menyusun buku proposal tesis sesuai dengan hasil \ndiskusi ketika sidang proposal tesis dan/atau sesuai catatan dalam lembar revisi. Apabila \nsudah selesai mengerjakan revisi, mahasiswa dapat memberikan hasil revisinya ke dosen \npembimbing dan penguji serta mengajukan lembar revisi dan lembar pengesahan buku \nproposal tesis untuk meminta persetujuan ke dosen pembimbing dan penguji. Batas \npengerjaan revi si adalah 2 minggu setelah sidang proposal tesis berlangsung.  \n13. Apabila revisi yang dikerjakan mahasiswa dirasa sudah tepat, dosen pembimbing dan', 'hasil revisiDokumen hasil\nrevisi sidang\nproposal tesis  \nApakah revisi\nsudah sesuai?Dokumen hasil\nrevisi sidang\nproposal tesis  Ketua RMK menentukan penguji\ndan menjadwalkan sidang\nproposal tesis setiap pesertaSOP PENDAFT ARAN SIDANG PROPOSAL TESIS PROGRAM STUDI S2 TEKNIK INFORMA TIKA (SISTEM ONLINE ), FT -EIC, ITS  \nYaDraft proposal tesis\ndan form persetujuan\npembimbing\nPemeriksa,\n \n \n \n \n \nLina Ambarwati, S.Kom.  \nNIP. 198003242014092001  Mengetahui,\nDr. Ahmad Saikhu, S.Si., M.T . \nNIP. 197107182006041001Pembuat,\n \n \n \n \n \nKartika Dwi Y uniavita Rahmawati, S.T .\nNPP. 1998202122056  \nJadwal sidang, link\nmeeting, dan VB\nTidak\nMenginfokan link google form\nuntuk meng-upload  seluruh\ndokumen hasil revisi sidang\nproposal tesis ke mahasiswa\nStatus sidang\nproposal tesis\nmenjadi ""Disetujui""Merekap data mahasiswa yang\ntelah menyelesaikan revisi\nsidang proposal tesis dan\nmenginfokan ke Kaprodi\nMeng-update status sidang\nproposal tesis di MonT esMeng-upload lembar revisi sidang', 'pendaftaran sidang proposal tesis melalui MonTes dan grup whatsapp.  \n3. Mahasiswa yang ingin mendaftar sidang proposal tesis, harus melengkapi berkas \npersyaratan  pendafta ran sidang proposal tesis , meliputi  draft proposal tesis dan lembar  \npersetujuan pembimbing. Apabila kedua dokumen tersebut sudah lengkap, mahasiswa \ndapat melakukan pendaftaran melalui Google Form dengan link \nhttps://bit.ly/DaftarSidangPropTesGasal2122 . \n4. Admin Akademik Pascasarjana  memverikasi berkas persyaratan pendaftaran sidang \nproposal tesis . Apabila berkas sudah memenuhi, kemudian meng -input data mahasiswa \nyang mendaftar sidang proposal tesis ke MonTes  dan mengatur status menjadi ‘Terdaftar’.  \n5. Admin Akademik Pascasarjana  merekap data mahasiswa pendaftar sidang proposal tesis \ndi Microsoft Excel dan mengirimkan file hasil rekapitulasi data pendaf tar sidang proposal \ntesis ke masing -masing ketua RMK yang terkait dengan topik penelitian tesis mahasiswa', 'Admin Akademik Pascasarjana\nMenginfokan jadwal,\npersyaratan, dan link google\nform pendaftaran sidang\nproposal tesisSTART\nMerekap catatan revisi di\nlembar revisi dan nilai di\nexcel\nMembagikan lembar revisi ke\nmahasiswaMelaksanakan sidang proposal\ntesis sesuai jadwal\nMengerjakan revisi sesuai\ncatatan di lembar revisiDosen pembimbing dan\npenguji menguji sidang\nproposal tesis sesuai plotting\nMemberikan penilaian dan\ncatatan revisi melalui google\nformMemverifikasi berkas\npersyaratan sidang proposal\ntesis\nApakah berkas\nsudah memenuhi\nsyarat?Tidak\nYa\nMerekap daftar peserta sidang\nproposal tesis setiap RMK dan\nmenginfokan ke Ketua RMK\nMenginfokan jadwal sidang\nproposal tesis ke mahasiswa dan\ndosen (pembimbing dan penguji)Checklist kelengkapan\nberkas pendaftaran\nsidang proposal tesis  Mahasiswa\nApakah berkas\nsudah lengkap?\nMelakukan pendaftaran sidang\nproposal tesis\nMeminta tanda tangan form revisi\nke dosen pembimbing dan\npenguji dan lembar pengesahan\nke dosen pembimbingJadwal sidang, link']","Proposal tesis terdiri dari beberapa unsur yang harus disusun dengan baik, antara lain:

1. Judul Tesis: Merupakan judul yang mencerminkan topik penelitian yang akan dilakukan.
2. Latar Belakang: Berisi penjelasan mengenai alasan pemilihan topik penelitian, relevansi, dan urgensi dari penelitian tersebut.
3. Rumusan Masalah: Merupakan pernyataan yang menjelaskan permasalahan yang akan diteliti dalam penelitian.
4. Tujuan Penelitian: Menjelaskan tujuan yang ingin dicapai melalui penelitian tersebut.
5. Manfaat Penelitian: Berisi penjelasan mengenai manfaat yang diharapkan dari hasil penelitian.
6. Tinjauan Pustaka: Merupakan rangkuman dari teori-teori yang relevan dengan topik penelitian.
7. Metode Penelitian: Berisi penjelasan mengenai langkah-langkah yang akan dilakukan dalam penelitian, termasuk metode pengumpulan data dan analisis data.
8. Jadwal Penelitian: Merupakan rencana waktu pelaksanaan penelitian dari awal hingga akhir.
9. Daftar Pustaka: Berisi daftar referensi yang digunakan dalam penyusunan proposal tesis.

Semua unsur tersebut harus disusun secara sistematis dan terstruktur untuk memudahkan pemahaman dan evaluasi dari dosen pembimbing dan penguji."
