,question,answer,contexts,ground_truth,context_precision,faithfulness,answer_relevancy,context_recall
0,Apa yang perlu direncanakan mahasiswa sehubungan dengan Bentuk Kegiatan Pembelajaran (BKP) MB-KM?,"Mahasiswa perlu merencanakan SKEM dan memetakan portofolio yang telah diusulkan dengan sks mata kuliah yang ingin dikonversikan sehubungan dengan Bentuk Kegiatan Pembelajaran (BKP) MB-KM. Selain itu, mahasiswa juga perlu melakukan perwalian dengan dosen wali untuk kemudian mendapatkan persetujuan Formulir Rencana Studi (FRS).","['A. Bagi Mahasiswa 1. Membuat perencanaan Kegiatan SKEM/ Program MB-KM dilaksanakan di awal semester. 2. Memilih kelas MB-KM secara mandiri melalui menu Formulir Rencana Studi (FRS) di SI Akademik. 3. Membuat dan menyimpan usulan portofolio yang tersedia di myITS StudentConnect untuk 1 (satu) semester ke depan. 4. Merencanakan SKEM dan memetakan portofolio (sehubungan dengan Bentuk Kegiatan Pembelajaran/ BKP MB-KM) yang telah diusulkan dengan sks mata kuliah yang ingin dikonversikan. 5. Melakukan perwalian dengan dosen wali untuk kemudian mendapatkan persetujuan FRS. 6. Panduan pengguna dan rencana kegiatan SKEM/ Program MB-KM dan penjelasan terkait lainnya dapat diakses di link https://its.id/panduan-rencana-skem-MBKM dan https://its.id/RencanaKegiatanSKEMMBKM . 7. Bagi mahasiswa yang merencanakan Program MB-KM, mengajukan Form 1 Matching Up Program MB-KM Ke MK Inti Prodi (jika konversi kegiatan ke Mata Kuliah Inti) dan Form 2 Surat Permohonan Kredit Transfer (Learning Agreement). 8.'
 'Sehubungan dengan kurikulum Program Sarjana dan Sarjana Terapan tahun 2023 – 2028 maka Berikut kami sampaikan beberapa teknis terkait pelaksanaan perencanaan kegiatan Satuan Kegiatan Ekstrakurikuler Mahasiswa (SKEM)/ program Merdeka Belajar–Kampus Merdeka (MB-KM) disampaikan bahwa:'
 'Nomor : 1710/IT2.I/T/TU.00.08/II/2024 Perihal : Pelaksanaan Perencanaan Kegiatan SKEM/ Program MB-KM Lampiran : 1 lembar \nKepada Yth. Para Dekan Para Kepala Departemen Para Kepala Program Studi Sarjana dan Sarjana Terapan di Tempat'
 'berlaku untuk angkatan 2021 keatas dimana kredit SKEMnya minimal 25.\n11. Dalam hal kegiatan yang digunakan untuk SKEM, mahasiswa wajib memiliki kegiatan\nProgram Kreativitas Mahasiswa (mulai angkatan 2020) dan Olahraga (mulai angkatan\n2021) selama menempuh kuliah di ITS. Untuk PKM mengikuti kegiatan minimal satu\nkali sedangkan olahraga dua kali selama menempuh kuliah di ITS.\n12. Kegiatan Olahraga ini ada 3 katagori yaitu:\na. Kegiatan olahraga mandiri yang ditunjukkan dengan logbook dan diverifikasi oleh\ndosen wali.\nb. Kegiatan olahraga yang dikoordinasi oleh UKM olahraga yang ada di ITS dengan\nmenunjukkan sertifikat/surat keterangan dimana verifikasi dilakukan oleh dosen\nwali.\nc. Kegiatan olahraga yang diselanggarakan oleh Komite Olahraga Nasional\nIndonesia (KONI) dengan menunjukkan sertifikat/surat keterangan dimana\nverifikasi dilakukan oleh dosen wali.\n13. Bagi mahasiswa yang tidak memiliki sertifikat kegiatan, bisa digantikan dengan surat']",Merencanakan SKEM dan memetakan portofolio dengan SKS mata kuliah yang ingin dikonversikan,0.999999999975,1.0,0.8758497687362662,1.0
1,Apa yang harus dilakukan mahasiswa yang merencanakan Program MB-KM?,"Mahasiswa yang merencanakan Program MB-KM harus melakukan beberapa langkah, antara lain:
1. Membuat perencanaan Kegiatan SKEM/ Program MB-KM di awal semester.
2. Memilih kelas MB-KM secara mandiri melalui menu Formulir Rencana Studi (FRS) di SI Akademik.
3. Membuat dan menyimpan usulan portofolio yang tersedia di myITS StudentConnect untuk 1 (satu) semester ke depan.
4. Merencanakan SKEM dan memetakan portofolio yang telah diusulkan dengan sks mata kuliah yang ingin dikonversikan.
5. Melakukan perwalian dengan dosen wali untuk mendapatkan persetujuan FRS.
6. Mengajukan Form 1 Matching Up Program MB-KM Ke MK Inti Prodi (jika konversi kegiatan ke Mata Kuliah Inti) dan Form 2 Surat Permohonan Kredit Transfer (Learning Agreement).
7. Mengakses panduan pengguna dan rencana kegiatan SKEM/ Program MB-KM serta penjelasan terkait lainnya melalui link yang disediakan.

Jadi, mahasiswa yang merencanakan Program MB-KM harus mengikuti prosedur-prosedur tersebut untuk melaksanakan program dengan baik.","['A. Bagi Mahasiswa 1. Membuat perencanaan Kegiatan SKEM/ Program MB-KM dilaksanakan di awal semester. 2. Memilih kelas MB-KM secara mandiri melalui menu Formulir Rencana Studi (FRS) di SI Akademik. 3. Membuat dan menyimpan usulan portofolio yang tersedia di myITS StudentConnect untuk 1 (satu) semester ke depan. 4. Merencanakan SKEM dan memetakan portofolio (sehubungan dengan Bentuk Kegiatan Pembelajaran/ BKP MB-KM) yang telah diusulkan dengan sks mata kuliah yang ingin dikonversikan. 5. Melakukan perwalian dengan dosen wali untuk kemudian mendapatkan persetujuan FRS. 6. Panduan pengguna dan rencana kegiatan SKEM/ Program MB-KM dan penjelasan terkait lainnya dapat diakses di link https://its.id/panduan-rencana-skem-MBKM dan https://its.id/RencanaKegiatanSKEMMBKM . 7. Bagi mahasiswa yang merencanakan Program MB-KM, mengajukan Form 1 Matching Up Program MB-KM Ke MK Inti Prodi (jika konversi kegiatan ke Mata Kuliah Inti) dan Form 2 Surat Permohonan Kredit Transfer (Learning Agreement). 8.'
 'Program MB-KM, mengajukan Form 1 Matching Up Program MB-KM Ke MK Inti Prodi (jika konversi kegiatan ke Mata Kuliah Inti) dan Form 2 Surat Permohonan Kredit Transfer (Learning Agreement). 8. Form 1 dan Form 2 dapat diakses di link https://its.id/Form12SEWR1RencanaMBKM.'
 'Nomor : 1710/IT2.I/T/TU.00.08/II/2024 Perihal : Pelaksanaan Perencanaan Kegiatan SKEM/ Program MB-KM Lampiran : 1 lembar \nKepada Yth. Para Dekan Para Kepala Departemen Para Kepala Program Studi Sarjana dan Sarjana Terapan di Tempat'
 '6. Harus cer mat dalam  sajian (tata tulis ilmiah atau  aturan \ngambar) \n7. Dipresentasik an dala m forum  seminar \n8. Dipertahankan dalam  ujian lisan di  depan tim  dosen \npenguji \n \n1.2  T ujuan \n Dengan menyusun Tu gas Akhir diha rapkan mahasiswa \nmam pu m erangkum , mengaplikasika n, menuangkan, m emecahkan \nsemua pengetahuan, ketram pilan, ide dan m asalah  dalam  bidang  \nkeahlian tertentu secara sistem atis, logis, kritis dan kreatif, didukung \ndata/informasi y ang akurat denga n analisis y ang tepat.  \n1  Penyusunan Tugas Akhir merupa kan salah satu sy arat untuk  \nmeny elesaika n studi dalam progra m sarjana dan  diplom a yang \nmem puny ai tujuan agar mahasiswa : \n \na. Mam pu membentuk sikap mental ilm iah \nb. Mam pu m engidentifi kasi dan m erumuskan m asalah \npenelitian atau perancanga n (desain) y ang berdasarkan \nrasional tertentu yang dinilai penting  dan berm anfaat \nditinjau dari beberapa segi  \nc. Mam pu melaksanakan penelitian/desain, m ulai d ari']",Mengajukan Form 1 Matching Up Program MB-KM Ke MK Inti Prodi dan Form 2 Surat Permohonan Kredit Transfer (Learning Agreement),0.999999999975,1.0,0.9855738179348204,1.0
2,Apa masalah utama lulusan ITS menurut kondisi eksisting?,"Masalah utama lulusan ITS menurut kondisi eksisting adalah kurangnya kemampuan dalam Leadership, Interpersonal skill, teamwork, dan endurance.","['Kondisi Eksisting\n1. Masalah utama lulusan ITS adalah Leadership, Interpersonal skill, teamwork, dan\nendurance.\n2. Mahasiswa dengan nilai SKEM diatas 3.000 tidak terlihat memiliki softskill yang\nlebih baik dari yang 1300.\n3. Mendapatkan nilai SKEM 1300 belum bisa dipakai secara efektif untuk mengukur\ncapaian softskill mahasiswa.\n4. Pengisian SKEM didominasi pada semester 2 dan semester 8 (untuk Sarjana)\nsehingga tidak terbaca bagaimana track peningkatan softskill mahasiswa.\n5. Hanya 46% mahasiswa yang mengikuti kompetisi, tergabung dalam ormawa,\nwirausaha, delegasi dll.'
 '6. Apabila memerlukan informasi lebih lanjut dapat menghubungi dirpendikcare@its.ac.id atau di\ncall centre pada hari dan jam kerja melalui no (WA Text Only) 085186819604, 085186819605.\nB. Bagi semua calon wisudawan (Sarjana dan Sarjana Terapan) wajib menghadap dosen wali untuk persetujuan SKEM, serta wajib melakukan pengajuan SKPI di studentconnect paling lambat tanggal 9 Februari 2024;\nC. Ijazah dicetak berdasarkan data preview yang dipermanen oleh calon wisudawan. Ijazah dicetak hanya sekali saja, bila ada kekeliruan pengisian data pada point 3 maka akan diterbitkan surat keterangan.\nD.Pelaksanaan wisuda akan dilaksanakan secara offline (Informasi mengenai gladi bersih disampaikan lebih lanjut.\n Atas perhatian dan kerjasama yang diberikan, kami sampaikan terima kasih.\n Powered by TCPDF (www.tcpdf.org)\nTembusan Yth :\n1. Rektor ITS\n2. Kepala Bagian Administrasi Umum dan Kearsipan Digital 3. Sekretaris Institut\nSurabaya, 09 Januari 2024\nWakil Rektor Bidang Akademik dan Kemahasiswaan,'
 'Lampiran 7A\nContoh lembar penilaian dan daftar hadir seminar proposal\ntesis\nDEPARTEMEN PENDIDIKAN NASIONAL\nINSTITUT TEKNOLOGI SEPULUH NOPEMBER SURABAYA\nPROGRAM PASCASARJANA\nDAFTAR HADIR DAN NILAI SEMINAR PROPOSAL TESIS\n:........\nJudul Seminar\nOleh\nNrp.\nProgram Studi\nBidang Keahlian\nTanda Tangan\n:....\n:\nNo\nNama Dosen\nJabatan\nTanda Tangan\nNilai (dalam angka)\n\n\nKetua\nAnggota\nAnggota\nAnggota\n\n\nNilai rata-rata : .... (dalam angka)\n.... (dalam huruf)\nKetua Sidang,\nSurabaya,\nMengetahui :\nKetua Program Studi,\n47'
 'Latar belaka ng m asalah ;  (2) Perum usan masalah ; (3) Batasan  \nmasalah/ruang lingkup ; (4) Tuju an Pe nelitian dan ( 5) Relevansi \natau Manfaat hasil penelitian \n \nc.1. Latar belakang masal ah \n Setiap penelitian y ang di ajukan untuk Tugas Akhir harus \nmem puny ai latar belakan g masal ah (aktual) yang memang \nmemerlukan pem ecahan. Latar belakang timbulny a masalah  \nperlu diuraikan secar a jelas dengan sejauh m ungkin didukung  \noleh hasil stu di terdahulu a tau data sekunder. \n \n \n4  c.2. Perum usan masalah \n Perm asalahan  penelitian harus dituliskan dalam  bentuk \ndeklaratif atau kali mat-kalim at pert anyaan yang tegas da n \njelas. Masalah penelitian merupakan peru musan kesenjangan \nantara keadaa n yang ada de ngan keadaan yang akan dicapai. \n \nc.3. Batasan masalah/Rua ng Lingkup \n Batasan masalah/ruang lingku p berisi tentang variable y ang \nakan diteliti dan variabel y ang diasu msikan sebagai p arameter \nkonstanta atau param eter yang diabaikan .']","Leadership, Interpersonal skill, teamwork, dan endurance.",0.9999999999,1.0,1.0000000000000007,1.0
3,"Berapa persen mahasiswa yang mengikuti kompetisi, tergabung dalam ormawa, wirausaha, delegasi, dll?",Saya tidak tahu.,"['dimana pesertanya berasal dari sekurang-kurangnya diikuti oleh 3 negara.\n5. Dalam penentuan penyetaraan apresiasi yang bisa diekivalensikan dengan juara 1, 2,\ndan 3 ditentukan oleh Ditmawa.'
 '17. Pentas Paduan Suara Gerejawi (PESPARAWI)\n18. Kompetisi Inovasi Bisnis Mahasiswa (KIBM) 2020\n19. Akselerasi Startup Mahasiswa Indonesia (ASMI)\n20. Kompetisi Mahasiswa Nasional Bidang Ilmu Bisnis, Manajemen dan Keuangan 2020\nAdapun lomba yang Non Kemdikbud adalah semua lomba (Nasional atau Internasional)\nyang diadakan sebuah institusi resmi yang bukan termasuk dalam Kemdikbud.\nContoh Perhitungan:\nSekelompok mahasiswa mendapatkan medali perak Poster PKMM yang tidak berhubungan\ndengan bidang ilmu, Maka perhitungannya :\nNilai = 5 orang (3) * Nasional (2) * Pelaksanaan (2) * > 6 bulan (3) *\ntidak berhubungan (1) * Penunjang non Kemdikbud (1) = 36 SKEM dengan nilai AB'
 'Kompetisi, Wirausaha, dan Magang\nKompetisi dinilai berdasarkan 6 elemen\nELEMEN PENILAIAN KATEGORI BOBOT\nJumlah Peserta\nIndividu 1\nBeregu (2 Anggota) 2\nBeregu (>2 Anggota) 3\nSkala\nInstitut 1\nRegional 2\nNasional 3\nInternasional 4\nLuaran\nIde 1\nPelaksanaan 2\nHasil 3\nRentang Waktu\n< 3 Bulan 1\n3-6 Bulan 2\n> 6 Bulan 3\nBidang Ilmu\nTidak Berhubungan 1\nBerhubungan 2\nLevel\nKompetisi Kemdikbud 2\nKompetisi non Kemdikbud 1\nAspek Penilaian\n(Kompetisi)\nPENILAIAN\nHURUF ANGKA\nJuara 1 / emas A 4.0\nJuara 2 / perak AB 3.5\nJuara 3 / perunggu B 3.0\nJuara Harapan / Finalis BC 2.5\nPeserta C 2.0\nAspek Penilaian\n(PKM)\nPENILAIAN\nHURUF ANGKA\nPeserta PIMNAS A 4.0\nProposal didanai AB 3.5\nUpload proposal ke\nSIM BELMAWA\nB 3.0\nPeserta Liga PKM ITS BC 2.5\nToT / Workshop PKM C 2.0'
 'Wirausaha dinilai berdasarkan 6 elemen:\nAspek Penilaian\nPENILAIAN\nHURUF ANGKA\nOmzet > 50 Juta/Tahun A 4.0\nOmzet 20-50 Juta/Tahun AB 3.5\nOmzet 5-19,9 Juta/Tahun B 3.0\nOmzet 2 – 4,9 Juta/Tahun BC 2.5\nOmzet < 2 Juta/Tahun C 2.0\nELEMEN PENILAIAN KATEGORI BOBOT\nPeran\nAnggota 1\nKetua 2\nJumlah Pelaku\nIndividu 1\nTim (Mahasiswa ITS) 2\nBadan Hukum\nNon 1\nCV / UKM 2\nPT 3\nRentang Waktu\n< 1 Tahun 1\n> 1 Tahun 2\nBidang Ilmu\nTidak Berhubungan 1\nBerhubungan 2\nNotes:\nKhusus untuk peran sebagai Direktur Utama atau owner bisa mendapatkan dua kategori\nkegiatan yakni wirausaha dan abdimas.\nContoh Perhitungan:\nMahasiswa memiliki usaha konsultan bidang Teknik dalam bentuk CV yang berdiri sejak 2016\ndan memiliki omzet 100 juta per tahun, Maka perhitungan SKEMnya:\nNilai = individu (1) * CV (2) * > 1 tahun (2) * berhubungan (2) = 8 SKEM\ndengan nilai AB']",46%,0.4166666666458333,0.0,0.0,0.0
4,Apa itu tesis?,Tesis adalah sebuah karya tulis ilmiah yang disusun oleh seorang mahasiswa sebagai syarat untuk memperoleh gelar sarjana atau magister. Tesis biasanya berisi penelitian yang mendalam tentang suatu topik tertentu dan disusun berdasarkan metodologi ilmiah yang telah ditentukan. Tesis juga harus disetujui oleh seorang pembimbing dan penguji sebelum mahasiswa dapat memperoleh gelar yang diinginkan.,"['Lampiran 11.A\nContoh abstrak tesis dalam Bahasa Indonesia\nKINERJA KOMPOS PRODUKSI UDPK BRATANG\nSEBAGAI MEDIA PENUKAR ION UNTUK MEREDUKSI LOGAM BERAT Cu DALAM AIR LIMBAH BUATAN\nNama mahasiswa\nNRP\nPembimbing\nABSTRAK\nKurangnya motivasi dalam kegiatan pengomposan salah\nsatunya adalah karena rendahnya nilai jual dan sempitnya pasar untuk produksi kompos. Pemanfaatan kompos sebagai media penukar 10n dharapkan dapat meningkatkan nila jual kompos sekaligus untuk memberikan alternatif pengolahan logam berat, khususnya Cu, yang murah. Kemampuan kompos untuk menukar ion berasal dari kandungan materi humus pada kompos yang mempunyai kapasitas tukar kation (KTK). Grup fungsi yang\nberperan\nadalah grup karboksil (-COOH) sehingga\nbisa\ndikategorikan sebagai resin asam lemah. Penelitian ini bertujuan untuk mengkaji kinerja kompos produksi UDPK Bratang sebagai media penukar ion untuk mereduksi Cu dalam air limbah buatan.\nKTK teoritis diukur dengan metode titrasi pH dan'
 'Lampiran 8B\nC. Contoh sampul / cover dalam tesis multi disiplin\n20 mm\n40 mm\n35 mm\nWarna Dibagian Atas Garis Biru ITS : Putih\n@ 15 mm\n0.6 dari tinggi kertas\nーーーーー\nWarna Biru ITS\nWarna Dibawah Garis Biru ITS :\nSesuai Warna Fakultas\nTesis - No. Kode Tesis\nJudul Tesis\nTrebuchet MS (Bold),\n12 point\nTrebuchet MS (Bold),\n18 point\n0.4 dari tinggi kertas\n40 mm\nNAMA MAHASISWA NRP MAHASISWA\nDOSEN PEMBIMBING\nProf. Ir. Wahyu Susilo, M.Sc., Ph.D.\nDr. Ir. Indah Wahyuni, M.Sc.\nPROGRAM MAGISTER\nBIDANG KEAHLIAN .................\nPROGRAM STUDI .....\n•..\nPROGRAM PASCASARJANA\nINSTITUT TEKNOLOGI SEPULUH NOPEMBER\nSURABAYA\n720..\n: 30 mm\nV\nTrebuchet MS,\n12 point\n52'
 'ーー\nLampiran 8A\nA. Contoh sampul / cover dalam tesis mono disiplin\ne20 mm\n40 mm\n35 mm\nWarna Dibagian Atas Garis Biru ITS : Putih\n0.6 dari tinggi kertas\n• 15 mm\nWarna Biru ITS\nWarna Dibawah Garis Biru ITS :\nSesuai Warna Fakultas\nTesis - No. Kode Tesis\nJudul Tesis\nTrebuchet MS (Bold), 17 puchet Ms (Bold),\n18 point\n0.4 dari tinggi kertas\n40 mm\nNAMA MAHASISWA NRP MAHASISWA\nDOSEN PEMBIMBING\nProf. Ir. Wahyu Susilo, M.Sc., Ph.D.\nDr. Ir. Indah Wahyuni, M.Sc.\nPROGRAM MAGISTER BIDANG KEAHLIAN ...\n00.......\nPROGRAM STUDI..............\nDEPARTEMEN ..\nFAKULTAS ..\nINSTITUT TEKNOLOGI SEPULUH NOPEMBER\nSURABAYA\n>20..\n--1\n130 mm\nV\n- Trebuchet MS,\n12 point\n51'
 'Catatan : dibuat rangkap 4\n1. Direktur PPs - ITS\n2. Ketua Program Studi\n3. Dosen (-dosen) Pembimbing\n4. Mahasiswa yang bersangkutan\n\nLampiran 10.D\nContoh lembar pengesahan tesis\nTesis disusun untuk memenuhi salah satu syarat memperoleh gelar\nMagister Manajemen Teknologi (M.MT)\ndi\nInstitut Teknologi Sepuluh Nopember\noleh :\nNrp.-\nTanggal Ujian :\nPeriode Wisuda :\nDisetujui oleh:\n1. Nama Pembimbing\nNIP:\n2. Nama Pembimbing\nNIP:\n3. Nama Penguji\nNIP:\n4. Nama Penguji\nNIP:\n5. Nama Penguji\nNIP:\n(Pembimbing 1)\n(Pembimbing Il)\n(Penguji)\n(Penguji)\n(Penguji)\nDirektur Program Pascasarjana,\nNama Lengkap\nNIP.\n59']",Tesis adalah karya ilmiah yang ditulis untuk memenuhi salah satu syarat untuk menyelesaikan studi pascasarjana strata 2 (program Magister) di Institut Teknologi Sepuluh Nopember.,0.499999999975,0.7142857142857143,0.9999988458853467,0.0
5,Bagaimana penulisan nomor halaman dalam proposal tesis?,"Penulisan nomor halaman dalam proposal tesis dilakukan dengan cara menuliskan nomor halaman di atas (header) sebelah kanan untuk halaman gasal dan sebelah kiri untuk halaman genap. Namun, halaman pertama dari bab baru ditulis di bawah (footer) kanan dan dimulai dengan nomor halaman gasal. Halaman dengan nomor gasal diletakkan pada lembar kanan dan halaman genap pada lembar kiri. Jika suatu bab berakhir pada halaman bernomor gasal, maka ditambahkan satu halaman kosong dengan nomor halaman genap dan diberi tulisan ""Halaman ini sengaja dikosongkan"". Antar bab diberi halaman pembatas dengan warna biru tanpa diberi nomor halaman.","['dicantum kan. Cara menyebutkan sum ber ialah  dengan \nmenuliskan nam a pengarang dan tahun publi kasi didalam  \nkurung. Untuk kutipan yang diam bil tidak secara la ngsung \ndari aslin ya maka y ang dituliskan adal ah nama penulis asli \ndan nam a penyuntin g (contoh: Faqih  dalam  Sulistijono, \n2006). Cara menuliskan daftar acu an dapat dilihat pada Sub \nbab 3.1 0. \n \n3.3. Halaman Judul \n Halaman judul ( Lampiran 1 ) sama den gan halam an kulit luar, \nberisi : tulisan ”TUGAS AKHIR”, judul Tugas Akhir; lam bang ITS, \nnama penulis dengan nomor pokok (N RP); nama ju rusan, fakultas, \n10 institut (dit ulis lengkap), dan nam a kota (Surabaya), serta tah un \npembuatan. Halaman ju dul ditu lis dalam  bahasa Inggris dan  \nIndonesia dalam  halam an yang berbe da. Kedua halam an judul \ntersebut menggunakan karakteristik  huruf y ang sama dengan bagian \nhalam an yang lain (bukan  huruf tim bul atau warna). \n Judul Tugas Akhir harus diketik seluru hnya dengan huruf-h uruf'
 'dan dim ulai dari Bab  Pe ndahul uan sam pai dengan \nlampiran. \n- Nomor hala man ditulis di atas (hea der) sebelah  kanan \nuntuk halam an gasal dan sebelah kiri untuk hala man genap, \nkecuali halaman pertama dari bab baru ditulis di bawah \n(footer) kanan dan dim ulai dengan nomor halaman gasal. \n- Hala man de ngan nom or gasal  dilet akkan pada le mbar \nkanan dan ha laman genap pada lembar kiri. Bila suatu bab \nberakhir pada halam an bernom or gasal, maka ditam bahkan \nsatu halaman kosong den gan nom or halam an genap (diberi \ntulisan ”Halaman ini sengaja dikoson gkan”). \n- Antar bab d iberi halam an pe mbatas dengan warna biru  \ntanpa diberi n omor halaman. \ng. Tabel dan Gam bar \nTabel-tabel diberi nom or urut  pada setiap bab denga n angka  \nArab dengan ketentuan pen ulisan sbb: \n− Nomor terdiri dari 2 bagian, bagian pertam a \nmenunjukkan  bab sedangkan b agian kedua   \nmenunjukkan  nom or tabel (contoh:  Tabel 2.1, Tabel 3.2,  \nTabel 3.3, ds b.).'
 'diketik dala m huruf-huruf besar, tepat di tengah-tengah halaman  \nsimetri kiri-kanan. Contoh halaman pengesahan pada la mpiran 2. \n \n3.5. Halaman Abstrak \n Halaman ab strak berisi : judul, nama penulis, nrp, nam a \npembimbing, ko pembimbing,  abst rak dan kata k unci. Halaman  \nabstrak ditulis dalam bahasa Inggr is dan Indonesia dalam  halaman \nyang berbeda . Jum lah kata maksim um adalah 400,  term asuk kata \nkunci. Con toh halaman abstrak pada lam piran 3. \n \n3.6. Halaman Kata Pengantar  \n Kata  Pengantar tidak lebih  dari s atu hal aman, beri si penjelasan \ntentang m aksud penulisa n laporan tu gas akhir, term asuk ucap an \nterim akasih kepada orang-orang yang pun ya kontribusi langs ung \ndalam  peny usunan TA. Tulisan ”KATA PENGANTAR” sebagai \njudul dari h alaman ini dituliska n seluruhn ya dengan huruf-h uruf \nbesar. \n \n11 3.7. Halaman Daftar Isi \n Yang dicantum kan dalam daftar isi : halam an judul, lem bar'
 'Catatan : dibuat rangkap 4\n1. Direktur PPs - ITS\n2. Ketua Program Studi\n3. Dosen (-dosen) Pembimbing\n4. Mahasiswa yang bersangkutan\n\nLampiran 10.D\nContoh lembar pengesahan tesis\nTesis disusun untuk memenuhi salah satu syarat memperoleh gelar\nMagister Manajemen Teknologi (M.MT)\ndi\nInstitut Teknologi Sepuluh Nopember\noleh :\nNrp.-\nTanggal Ujian :\nPeriode Wisuda :\nDisetujui oleh:\n1. Nama Pembimbing\nNIP:\n2. Nama Pembimbing\nNIP:\n3. Nama Penguji\nNIP:\n4. Nama Penguji\nNIP:\n5. Nama Penguji\nNIP:\n(Pembimbing 1)\n(Pembimbing Il)\n(Penguji)\n(Penguji)\n(Penguji)\nDirektur Program Pascasarjana,\nNama Lengkap\nNIP.\n59']","Penomoran halaman sebelum teks (sebelum Bab 1) menggunakan angka Romawi kecil, sedangkan bagian teks menggunakan angka Arabic.",0.6388888888675925,1.0,0.9913615268246221,0.0
6,Bagaimana pelaksanaan wisuda akan dilakukan?,Saya tidak mengetahui informasi mengenai pelaksanaan wisuda.,"['6. Harus cer mat dalam  sajian (tata tulis ilmiah atau  aturan \ngambar) \n7. Dipresentasik an dala m forum  seminar \n8. Dipertahankan dalam  ujian lisan di  depan tim  dosen \npenguji \n \n1.2  T ujuan \n Dengan menyusun Tu gas Akhir diha rapkan mahasiswa \nmam pu m erangkum , mengaplikasika n, menuangkan, m emecahkan \nsemua pengetahuan, ketram pilan, ide dan m asalah  dalam  bidang  \nkeahlian tertentu secara sistem atis, logis, kritis dan kreatif, didukung \ndata/informasi y ang akurat denga n analisis y ang tepat.  \n1  Penyusunan Tugas Akhir merupa kan salah satu sy arat untuk  \nmeny elesaika n studi dalam progra m sarjana dan  diplom a yang \nmem puny ai tujuan agar mahasiswa : \n \na. Mam pu membentuk sikap mental ilm iah \nb. Mam pu m engidentifi kasi dan m erumuskan m asalah \npenelitian atau perancanga n (desain) y ang berdasarkan \nrasional tertentu yang dinilai penting  dan berm anfaat \nditinjau dari beberapa segi  \nc. Mam pu melaksanakan penelitian/desain, m ulai d ari'
 '5. Setelah semua proses diatas sudah dilakukan dengan benar, maka mahasiswa tinggal menunggu\n      perubahan status proposal TA-nya via MONTA (Mendaftar \uf0e0 Tunggu Sidang Proposal \uf0e0 OK/\n      Revisi/ Ditolak). Bagi mahasiswa yang status proposalnya OK, maka bisa segera melakukan\n      bimbingan ke dosen pembimbing. Sedangkan bagi proposalnya berstatus Revisi/Ditolak, harap\n      menghadap ke koordinator TA/Ketua RMK untuk mengambil hardcopy proposal dan menanyakan\n      keterangan lebih detail tenang status proposalnya.\n\x0c\uf076 Bimbingan TA\n\n  1. Setelah proposal TA mahasiswa berstatus “OK”, maka proses bimbingan TA bisa mulai dilakukan\n     baik secara online maupun offline. Untuk bimbingan online, mahasiswa mengisi kegiatan\n     bimbingan dengan memilih menu Progres TA, kemudian memilih menu Bimbingan Baru.\n\n\n\n\n  2. Berikut merupakan halaman bimbingan baru untuk diisikan item/catatan yang dijadikan topik\n     bimbingan.'
 'BAB I  \nTUGAS AKHIR : PENGERTIAN DAN T UJUAN \n \n \n1.1  Pen gertian \n Tiap mahasis wa yang akan m enyelesai kan studiny a dala m \nprogram  sarjana dan di ploma di wajibkan un tuk meny usun  suatu \nkarya ilm iah yang disebut  Tugas Akhir, setelah y ang bersangkut an \nmemenuhi persy aratan tertentu. T ugas Akhir dapat berupa penelitian \natau perancan gan (desain) y ang m empunyai ciri-ciri antara lain : \n \n1. Mem puny ai perum usan masa lah untuk penelitian, dan \nide untu k perancangan \n2. Judul tugas akhir dipilih sendiri oleh mahasiswa atau \nditentukan oleh dosen pembim bing \n3. Didasarkan pada pengamata n labor atorium /lapan gan \n(data primer) dan/atau analisis data sekunder \n4. Harus ada  ketertiban metodologi \n5. Di bawah bim bingan berkala dan teratur oleh dosen  \npembimbing \n6. Harus cer mat dalam  sajian (tata tulis ilmiah atau  aturan \ngambar) \n7. Dipresentasik an dala m forum  seminar \n8. Dipertahankan dalam  ujian lisan di  depan tim  dosen \npenguji \n \n1.2  T ujuan'
 '\uf0b7   UNGGAH artikel WAJIB dilakukan oleh MAHASISWA PENDAFTAR YUDISIUM 121.']",Pelaksanaan wisuda akan dilakukan secara offline.,0.0,0.0,0.0,0.0
7,Apakah calon wisudawan Sarjana dan Sarjana Terapan memiliki kewajiban yang sama terkait pengisian biodata dan proses wisuda?,"Calon wisudawan Sarjana dan Sarjana Terapan memiliki kewajiban yang sama terkait pengisian biodata dan proses wisuda. Mereka wajib menghadap dosen wali untuk persetujuan SKEM, serta melakukan pengajuan SKPI di studentconnect paling lambat tanggal 9 Februari 2024. Ijazah dicetak berdasarkan data preview yang dipermanen oleh calon wisudawan, dan akan diterbitkan surat keterangan jika terdapat kekeliruan pengisian data. Pelaksanaan wisuda akan dilaksanakan secara offline.","['Sedangkan untuk lomba yang terkait dengan reward prestasi maka verifikasi dilakukan\noleh Ditmawa sebelum diberikan ke Departemen.\n7. Verifikasi portofolio dilakukan oleh Ditmawa (Kewirausahaan, Magang, Kompetisi\ndan abdimas lain), DRPM (Abdimas), DKG (Internasionalisasi), dan dosen wali (selain\nkegiatan diatas).\n8. Terkait kesesuaian dengan bidang ilmu akan diverifikasi oleh dosen wali dari\nDepartemen masing-masing.\n9. Dosen wali mempunyai kewajiban untuk memantau perkembangan IP SKEM anak wali\nagar tidak dibawah 2.1 dan apabila pada semester berjalan IP SKEM berada dibawah\n2.1, maka dosen wali wajib mengingatkan mahasiswa yang bersangkutan untuk\nmemenuhi persyaratan ini pada semester berikutnya.\n10. Skem Baru ini berlaku juga untuk mahasiswa IUP dan RPL. Khusus mahasiswa RPL\nberlaku untuk angkatan 2021 keatas dimana kredit SKEMnya minimal 25.\n11. Dalam hal kegiatan yang digunakan untuk SKEM, mahasiswa wajib memiliki kegiatan'
 '6. Apabila memerlukan informasi lebih lanjut dapat menghubungi dirpendikcare@its.ac.id atau di\ncall centre pada hari dan jam kerja melalui no (WA Text Only) 085186819604, 085186819605.\nB. Bagi semua calon wisudawan (Sarjana dan Sarjana Terapan) wajib menghadap dosen wali untuk persetujuan SKEM, serta wajib melakukan pengajuan SKPI di studentconnect paling lambat tanggal 9 Februari 2024;\nC. Ijazah dicetak berdasarkan data preview yang dipermanen oleh calon wisudawan. Ijazah dicetak hanya sekali saja, bila ada kekeliruan pengisian data pada point 3 maka akan diterbitkan surat keterangan.\nD.Pelaksanaan wisuda akan dilaksanakan secara offline (Informasi mengenai gladi bersih disampaikan lebih lanjut.\n Atas perhatian dan kerjasama yang diberikan, kami sampaikan terima kasih.\n Powered by TCPDF (www.tcpdf.org)\nTembusan Yth :\n1. Rektor ITS\n2. Kepala Bagian Administrasi Umum dan Kearsipan Digital 3. Sekretaris Institut\nSurabaya, 09 Januari 2024\nWakil Rektor Bidang Akademik dan Kemahasiswaan,'
 'dimana pesertanya berasal dari sekurang-kurangnya diikuti oleh 3 negara.\n5. Dalam penentuan penyetaraan apresiasi yang bisa diekivalensikan dengan juara 1, 2,\ndan 3 ditentukan oleh Ditmawa.'
 'Notes:\nAda dua kategori abdi masyarakat:\n1. Pengabdian Masyarakat berupa abdimas reguler yang dibimbing dosen maka SK-\nnya akan dikeluarkan oleh DRPM (Direktorat Riset dan Pengabdian Kepada\nMasyarakat).\n2. Pengabdian Masyarakat lain bukti bukti berupa surat tugas dan sertifikat yang\ndikeluarkan oleh Ditmawa.\n3. Asistensi mengajar di satuan Pendidikan dapat diusulkan apabila memenuhi salah\nsatu kriteria sebagai berikut:\na. Tidak diklaim ke SKS\nb. Kegiatan berdurasi lebih dari 3 bulan (setara ≥ dari 10 SKS) bisa diajukan ke\nSKEM dan SKS selama konversi SKSnya tidak maksimal.\n4. Kedua pengabdian masyarakat tersebut harus diupload melalui portofolio di myITS\nStudentConnect.']","Ya, semua calon wisudawan Sarjana dan Sarjana Terapan wajib mengikuti ketentuan yang sama.",0.9166666666361111,1.0,0.9709841656691784,1.0
8,Bagaimana cara mengajukan SKPI?,Saya tidak tahu.,"['BAB I  \nTUGAS AKHIR : PENGERTIAN DAN T UJUAN \n \n \n1.1  Pen gertian \n Tiap mahasis wa yang akan m enyelesai kan studiny a dala m \nprogram  sarjana dan di ploma di wajibkan un tuk meny usun  suatu \nkarya ilm iah yang disebut  Tugas Akhir, setelah y ang bersangkut an \nmemenuhi persy aratan tertentu. T ugas Akhir dapat berupa penelitian \natau perancan gan (desain) y ang m empunyai ciri-ciri antara lain : \n \n1. Mem puny ai perum usan masa lah untuk penelitian, dan \nide untu k perancangan \n2. Judul tugas akhir dipilih sendiri oleh mahasiswa atau \nditentukan oleh dosen pembim bing \n3. Didasarkan pada pengamata n labor atorium /lapan gan \n(data primer) dan/atau analisis data sekunder \n4. Harus ada  ketertiban metodologi \n5. Di bawah bim bingan berkala dan teratur oleh dosen  \npembimbing \n6. Harus cer mat dalam  sajian (tata tulis ilmiah atau  aturan \ngambar) \n7. Dipresentasik an dala m forum  seminar \n8. Dipertahankan dalam  ujian lisan di  depan tim  dosen \npenguji \n \n1.2  T ujuan'
 '6. Harus cer mat dalam  sajian (tata tulis ilmiah atau  aturan \ngambar) \n7. Dipresentasik an dala m forum  seminar \n8. Dipertahankan dalam  ujian lisan di  depan tim  dosen \npenguji \n \n1.2  T ujuan \n Dengan menyusun Tu gas Akhir diha rapkan mahasiswa \nmam pu m erangkum , mengaplikasika n, menuangkan, m emecahkan \nsemua pengetahuan, ketram pilan, ide dan m asalah  dalam  bidang  \nkeahlian tertentu secara sistem atis, logis, kritis dan kreatif, didukung \ndata/informasi y ang akurat denga n analisis y ang tepat.  \n1  Penyusunan Tugas Akhir merupa kan salah satu sy arat untuk  \nmeny elesaika n studi dalam progra m sarjana dan  diplom a yang \nmem puny ai tujuan agar mahasiswa : \n \na. Mam pu membentuk sikap mental ilm iah \nb. Mam pu m engidentifi kasi dan m erumuskan m asalah \npenelitian atau perancanga n (desain) y ang berdasarkan \nrasional tertentu yang dinilai penting  dan berm anfaat \nditinjau dari beberapa segi  \nc. Mam pu melaksanakan penelitian/desain, m ulai d ari'
 'Catatan : dibuat rangkap 4\n1. Direktur PPs - ITS\n2. Ketua Program Studi\n3. Dosen (-dosen) Pembimbing\n4. Mahasiswa yang bersangkutan\n\nLampiran 10.D\nContoh lembar pengesahan tesis\nTesis disusun untuk memenuhi salah satu syarat memperoleh gelar\nMagister Manajemen Teknologi (M.MT)\ndi\nInstitut Teknologi Sepuluh Nopember\noleh :\nNrp.-\nTanggal Ujian :\nPeriode Wisuda :\nDisetujui oleh:\n1. Nama Pembimbing\nNIP:\n2. Nama Pembimbing\nNIP:\n3. Nama Penguji\nNIP:\n4. Nama Penguji\nNIP:\n5. Nama Penguji\nNIP:\n(Pembimbing 1)\n(Pembimbing Il)\n(Penguji)\n(Penguji)\n(Penguji)\nDirektur Program Pascasarjana,\nNama Lengkap\nNIP.\n59'
 'penelitian atau perancanga n (desain) y ang berdasarkan \nrasional tertentu yang dinilai penting  dan berm anfaat \nditinjau dari beberapa segi  \nc. Mam pu melaksanakan penelitian/desain, m ulai d ari \npenyusunan,  pelaksanaan, sam pai pelap oran \nd. Mam pu melakukan kajia n secara kuantitatif dan/ atau \nkualitatif, serta menyusun kesimpulan y ang jelas \ne. Mampu mempresenta sikan dan m empertahankan hasil \nTugas Akhir  dalam  ujian lisan di hadapan tim  dosen \npenguji \n  \n1.3. Bentu k Tugas Akhir \n  Bentuk tugas akhir bisa berupa  penelitian atau perancangan, \nyang terdiri a tas proposal tugas akhir da n laporan tu gas akhir. \n \n1.3.1. Tugas Akhir y ang berupa penelitian \nTugas akhir y ang berupa penelitia n harus mengandung \nkejelasan t entang hal-hal y ang ingin diselidiki ( something to \nbe inquired o r examined ), antara lain: \n  \n a. Obyek yang akan diteliti \n b.  Perm asalahan yang ingin dipecahkan  \n c. Hipotesa y ang ingin dibuk tikan/diuji ke benaranny a']",SKPI diajukan melalui studentconnect.,0.0,0.0,0.0,0.0
9,Apa ciri-ciri Tugas Akhir?,"Tugas Akhir memiliki beberapa ciri-ciri, antara lain:
1. Memiliki perumusan masalah untuk penelitian dan ide untuk perancangan.
2. Judul Tugas Akhir dipilih sendiri oleh mahasiswa atau ditentukan oleh dosen pembimbing.
3. Didasarkan pada pengamatan laboratorium/lapangan (data primer) dan/atau analisis data sekunder.
4. Harus ada ketertiban metodologi.
5. Dibimbing secara berkala dan teratur oleh dosen pembimbing.
6. Harus cermat dalam penyajian (tata tulis ilmiah atau aturan gambar).
7. Harus dipresentasikan dalam forum seminar.
8. Harus dipertahankan dalam ujian lisan di depan tim dosen penguji.","['6 BAB III  \nLAPORAN TUGAS AKHIR \n \n3.1. Sistem atika \n Siste matika l aporan Tugas Akhir terdiri atas  tiga ba gian besar, \nyaitu : \n \n1. Bagian ’Awal’ terdiri dari: \na. Judul Tu gas Akhir dala m bahasa In donesia dan  bahasa \nInggris pada kulit m uka dan kulit  dalam  (Lampiran 1 ) \nb. Hala man pengesahan ( Lampiran 2 ) \nc. Abstrak atau  uraian singkat dalam  bahasa Indonesia dan  \nbahasa Inggris ( Lampiran 3 ) \nd. Kata pengantar \ne. Daftar isi \nf. Daftar gam bar, grafik, diag ram \ng. Daftar tabel \nh. Daftar si mbol \n \n2. Bagian ‘Inti/Pokok’ atau ‘Batang Tubuh’ berisi :  \n a. Pendahuluan  \n• Latar belakan g masalah \n• Rumusan Per masalahan  \n• Batasan m asalah/ruang lingkup \n• Tujuan  \n• Manfaat (bila diperlukan untuk ditulis) \nb. Tinjauan Pustaka \n• Hasil peneliti an terdahulu yang relevan \n• Teori yang akan digunakan untuk meny elesaikan  \npermasalahan   \nc. Metodolog i  \n• Metode y ang digunakan \n• Bahan dan perala tan y ang digunakan \n• Urutan pelaksanaan percobaan'
 'BAB I  \nTUGAS AKHIR : PENGERTIAN DAN T UJUAN \n \n \n1.1  Pen gertian \n Tiap mahasis wa yang akan m enyelesai kan studiny a dala m \nprogram  sarjana dan di ploma di wajibkan un tuk meny usun  suatu \nkarya ilm iah yang disebut  Tugas Akhir, setelah y ang bersangkut an \nmemenuhi persy aratan tertentu. T ugas Akhir dapat berupa penelitian \natau perancan gan (desain) y ang m empunyai ciri-ciri antara lain : \n \n1. Mem puny ai perum usan masa lah untuk penelitian, dan \nide untu k perancangan \n2. Judul tugas akhir dipilih sendiri oleh mahasiswa atau \nditentukan oleh dosen pembim bing \n3. Didasarkan pada pengamata n labor atorium /lapan gan \n(data primer) dan/atau analisis data sekunder \n4. Harus ada  ketertiban metodologi \n5. Di bawah bim bingan berkala dan teratur oleh dosen  \npembimbing \n6. Harus cer mat dalam  sajian (tata tulis ilmiah atau  aturan \ngambar) \n7. Dipresentasik an dala m forum  seminar \n8. Dipertahankan dalam  ujian lisan di  depan tim  dosen \npenguji \n \n1.2  T ujuan'
 'Oleh : <NAMA MAHASISWA>\n                             NRP. <XXXXXXXX>\n\n\n\n                    Disetujui oleh Tim Penguji Tugas Akhir :\n\n\n1. Nama dan gelar pembimbing                            Pembimbing\n\n\n2. Nama dan gelar ko-pembimbing/penguji                 Ko-pembimbing\n\n\n3. Nama dan gelar penguji                               Penguji\n\n\n4. Nama dan gelar penguji                               Penguji\n\n\n5. Nama dan gelar penguji                               Penguji\n\n\n                                 SURABAYA\n                                 Bulan, Tahun\n\n\n\n                                                                        33\n\x0c                              APPROVAL SHEET\n\n\n\nTHE TITLE OF THE FINAL PROJECT IS WRITTEN BRIEFLY, CLEARLY AND\n                  DESCRIBING THE MAIN THEME'
 'tersebut menggunakan karakteristik  huruf y ang sama dengan bagian \nhalam an yang lain (bukan  huruf tim bul atau warna). \n Judul Tugas Akhir harus diketik seluru hnya dengan huruf-h uruf \nbesar dan tidak boleh disingkat, kecuali singkatan yang sudah baku.  \n Nama penulis harus ditulis dengan huruf besar dan tidak \ndisingkat.   \n \n3.4. Hala man Pen gesahan  \n Hala man pengesahan diletakkan pada hala man sesud ah hala man \njudul.  \n Hala man pengesahan berisi : tulisan ”LEMBA R \nPENGESAHAN”, judul Tugas Ak hir; tujuan ddiiaajjuukkaannnnyyaa  TTAA,,  \nppeerrsseettuujjuuaann  ppeemmbbiimmbbiinngg  ((ddaappaatt  lleebbiihh  ddaarrii  ssaattuu)),,  nnaammaa--nnaammaa  \nppeemmbbiimmbbiinngg,,  kkoottaa,,  bbuullaann  ddaann    ttaahhuunn  ppeennggeessaahhaann..  Halam an ini sel alu \ndiketik dala m huruf-huruf besar, tepat di tengah-tengah halaman  \nsimetri kiri-kanan. Contoh halaman pengesahan pada la mpiran 2. \n \n3.5. Halaman Abstrak']","Perumusan masalah atau ide, judul dipilih sendiri atau oleh dosen pembimbing, berdasarkan pengamatan laboratorium/lapangan, ketertiban metodologi, bimbingan berkala, cermat dalam sajian, dipresentasikan dalam forum seminar, dipertahankan dalam ujian lisan",0.9166666666361111,1.0,0.9972738919021252,0.75
10,Apa bentuk Tugas Akhir?,"Tugas Akhir memiliki tiga bagian besar, yaitu:
1. Bagian 'Awal' yang terdiri dari:
   a. Judul Tugas Akhir dalam bahasa Indonesia dan bahasa Inggris pada kulit muka dan kulit dalam
   b. Halaman pengesahan
   c. Abstrak atau uraian singkat dalam bahasa Indonesia dan bahasa Inggris
   d. Kata pengantar
   e. Daftar isi
   f. Daftar gambar, grafik, diagram
   g. Daftar tabel
   h. Daftar simbol

2. Bagian 'Inti/Pokok' atau 'Batang Tubuh' yang berisi:
   a. Pendahuluan
      - Latar belakang masalah
      - Rumusan Permasalahan
      - Batasan masalah/ruang lingkup
      - Tujuan
      - Manfaat (bila diperlukan untuk ditulis)
   b. Tinjauan Pustaka
      - Hasil penelitian terdahulu yang relevan
      - Teori yang akan digunakan untuk menyelesaikan permasalahan
   c. Metodologi
      - Metode yang digunakan
      - Bahan dan peralatan yang digunakan
      - Urutan pelaksanaan percobaan

Jadi, bentuk Tugas Akhir terdiri dari bagian 'Awal' dan bagian 'Inti/Pokok'.","['6 BAB III  \nLAPORAN TUGAS AKHIR \n \n3.1. Sistem atika \n Siste matika l aporan Tugas Akhir terdiri atas  tiga ba gian besar, \nyaitu : \n \n1. Bagian ’Awal’ terdiri dari: \na. Judul Tu gas Akhir dala m bahasa In donesia dan  bahasa \nInggris pada kulit m uka dan kulit  dalam  (Lampiran 1 ) \nb. Hala man pengesahan ( Lampiran 2 ) \nc. Abstrak atau  uraian singkat dalam  bahasa Indonesia dan  \nbahasa Inggris ( Lampiran 3 ) \nd. Kata pengantar \ne. Daftar isi \nf. Daftar gam bar, grafik, diag ram \ng. Daftar tabel \nh. Daftar si mbol \n \n2. Bagian ‘Inti/Pokok’ atau ‘Batang Tubuh’ berisi :  \n a. Pendahuluan  \n• Latar belakan g masalah \n• Rumusan Per masalahan  \n• Batasan m asalah/ruang lingkup \n• Tujuan  \n• Manfaat (bila diperlukan untuk ditulis) \nb. Tinjauan Pustaka \n• Hasil peneliti an terdahulu yang relevan \n• Teori yang akan digunakan untuk meny elesaikan  \npermasalahan   \nc. Metodolog i  \n• Metode y ang digunakan \n• Bahan dan perala tan y ang digunakan \n• Urutan pelaksanaan percobaan'
 'Oleh : <NAMA MAHASISWA>\n                             NRP. <XXXXXXXX>\n\n\n\n                    Disetujui oleh Tim Penguji Tugas Akhir :\n\n\n1. Nama dan gelar pembimbing                            Pembimbing\n\n\n2. Nama dan gelar ko-pembimbing/penguji                 Ko-pembimbing\n\n\n3. Nama dan gelar penguji                               Penguji\n\n\n4. Nama dan gelar penguji                               Penguji\n\n\n5. Nama dan gelar penguji                               Penguji\n\n\n                                 SURABAYA\n                                 Bulan, Tahun\n\n\n\n                                                                        33\n\x0c                              APPROVAL SHEET\n\n\n\nTHE TITLE OF THE FINAL PROJECT IS WRITTEN BRIEFLY, CLEARLY AND\n                  DESCRIBING THE MAIN THEME'
 'tersebut menggunakan karakteristik  huruf y ang sama dengan bagian \nhalam an yang lain (bukan  huruf tim bul atau warna). \n Judul Tugas Akhir harus diketik seluru hnya dengan huruf-h uruf \nbesar dan tidak boleh disingkat, kecuali singkatan yang sudah baku.  \n Nama penulis harus ditulis dengan huruf besar dan tidak \ndisingkat.   \n \n3.4. Hala man Pen gesahan  \n Hala man pengesahan diletakkan pada hala man sesud ah hala man \njudul.  \n Hala man pengesahan berisi : tulisan ”LEMBA R \nPENGESAHAN”, judul Tugas Ak hir; tujuan ddiiaajjuukkaannnnyyaa  TTAA,,  \nppeerrsseettuujjuuaann  ppeemmbbiimmbbiinngg  ((ddaappaatt  lleebbiihh  ddaarrii  ssaattuu)),,  nnaammaa--nnaammaa  \nppeemmbbiimmbbiinngg,,  kkoottaa,,  bbuullaann  ddaann    ttaahhuunn  ppeennggeessaahhaann..  Halam an ini sel alu \ndiketik dala m huruf-huruf besar, tepat di tengah-tengah halaman  \nsimetri kiri-kanan. Contoh halaman pengesahan pada la mpiran 2. \n \n3.5. Halaman Abstrak'
 'Nama mahasiswa / NRP : ____________________________________\n    Departemen               : ____________________________________\n    Dosen Pembimbing / NIP : ____________________________________\n\n\ndengan ini menyatakan bahwa Tugas Akhir dengan judul “____________________________”\nadalah hasil karya sendiri, bersifat orisinal, dan ditulis dengan mengikuti kaidah penulisan\nilmiah.\nBilamana di kemudian hari ditemukan ketidaksesuaian dengan pernyataan ini, maka saya\nbersedia menerima sanksi sesuai dengan ketentuan yang berlaku di Institut Teknologi Sepuluh\nNopember.\n\n\n\n                                                   Surabaya, __________________\nMengetahui\nDosen Pembimbing                                   Mahasiswa,\n\n\n\n\n(___________________________)                      (___________________________)\nNIP.                                               NRP.']",Penelitian atau perancangan yang terdiri dari proposal tugas akhir dan laporan tugas akhir,0.8333333332916666,1.0,0.9163896555650499,0.0
11,Apa isi bagian ‘Awal’ laporan tugas akhir?,"Bagian 'Awal' dari laporan tugas akhir terdiri dari:
1. Judul Tugas Akhir dalam bahasa Indonesia dan bahasa Inggris pada kulit muka dan kulit dalam
2. Halaman pengesahan
3. Abstrak atau uraian singkat dalam bahasa Indonesia dan bahasa Inggris
4. Kata pengantar
5. Daftar isi
6. Daftar gambar, grafik, diagram
7. Daftar tabel
8. Daftar simbol","['Nama mahasiswa / NRP : ____________________________________\n    Departemen               : ____________________________________\n    Dosen Pembimbing / NIP : ____________________________________\n\n\ndengan ini menyatakan bahwa Tugas Akhir dengan judul “____________________________”\nadalah hasil karya sendiri, bersifat orisinal, dan ditulis dengan mengikuti kaidah penulisan\nilmiah.\nBilamana di kemudian hari ditemukan ketidaksesuaian dengan pernyataan ini, maka saya\nbersedia menerima sanksi sesuai dengan ketentuan yang berlaku di Institut Teknologi Sepuluh\nNopember.\n\n\n\n                                                   Surabaya, __________________\nMengetahui\nDosen Pembimbing                                   Mahasiswa,\n\n\n\n\n(___________________________)                      (___________________________)\nNIP.                                               NRP.'
 'Lampiran 10.C\nContoh Berita Acara Ujian Akhir Tesis\nDEPARTEMEN PENDIDIKAN NASIONAL\nINSTITUT TEKNOLOGI SEPULUH NOPEMBER SURABAYA\nPROGRAM PASCASARJANA\nBERITA ACARA\nUJIAN TESIS\nPada\nHari, Tanggal Jam\nTempat\ntelah dilaksanakan Ujian Tesis\nJudul\nOleh Nrp.\nProgram Studi\nBidang Keahlian\n:.....\n:...\ndengan hasil\n1. disetujui\n2. disetujui dengan perbaikan / penyempurnaan\n3. tidak disetujui atau mengulang\nPerbaikan / penyempurnaan yang harus dilakukan adalah : (kalau diperlukan dapat ditulis di lembar terpisah)\nPenguji :\nKetua Sidang\n1..\n2.\nMengetahui,\nKetua Program Studi,\n3.\n4......\n5. Dst\n57\n\nCatatan : dibuat rangkap 4\n1. Direktur PPs - ITS\n2. Ketua Program Studi\n3. Dosen (-dosen) Pembimbing\n4. Mahasiswa yang bersangkutan'
 'Oleh : <NAMA MAHASISWA>\n                             NRP. <XXXXXXXX>\n\n\n\n                    Disetujui oleh Tim Penguji Tugas Akhir :\n\n\n1. Nama dan gelar pembimbing                            Pembimbing\n\n\n2. Nama dan gelar ko-pembimbing/penguji                 Ko-pembimbing\n\n\n3. Nama dan gelar penguji                               Penguji\n\n\n4. Nama dan gelar penguji                               Penguji\n\n\n5. Nama dan gelar penguji                               Penguji\n\n\n                                 SURABAYA\n                                 Bulan, Tahun\n\n\n\n                                                                        33\n\x0c                              APPROVAL SHEET\n\n\n\nTHE TITLE OF THE FINAL PROJECT IS WRITTEN BRIEFLY, CLEARLY AND\n                  DESCRIBING THE MAIN THEME'
 '6 BAB III  \nLAPORAN TUGAS AKHIR \n \n3.1. Sistem atika \n Siste matika l aporan Tugas Akhir terdiri atas  tiga ba gian besar, \nyaitu : \n \n1. Bagian ’Awal’ terdiri dari: \na. Judul Tu gas Akhir dala m bahasa In donesia dan  bahasa \nInggris pada kulit m uka dan kulit  dalam  (Lampiran 1 ) \nb. Hala man pengesahan ( Lampiran 2 ) \nc. Abstrak atau  uraian singkat dalam  bahasa Indonesia dan  \nbahasa Inggris ( Lampiran 3 ) \nd. Kata pengantar \ne. Daftar isi \nf. Daftar gam bar, grafik, diag ram \ng. Daftar tabel \nh. Daftar si mbol \n \n2. Bagian ‘Inti/Pokok’ atau ‘Batang Tubuh’ berisi :  \n a. Pendahuluan  \n• Latar belakan g masalah \n• Rumusan Per masalahan  \n• Batasan m asalah/ruang lingkup \n• Tujuan  \n• Manfaat (bila diperlukan untuk ditulis) \nb. Tinjauan Pustaka \n• Hasil peneliti an terdahulu yang relevan \n• Teori yang akan digunakan untuk meny elesaikan  \npermasalahan   \nc. Metodolog i  \n• Metode y ang digunakan \n• Bahan dan perala tan y ang digunakan \n• Urutan pelaksanaan percobaan']","Judul Tugas Akhir, Halaman pengesahan, Abstrak, Kata pengantar, Daftar isi, Daftar gambar, grafik, diagram, Daftar tabel, Daftar simbol",0.9166666666361111,1.0,0.9039034029803753,1.0
12,Apa yang harus ada dalam halaman abstrak laporan tugas akhir?,"Dalam halaman abstrak laporan tugas akhir, harus ada uraian singkat dalam bahasa Indonesia dan bahasa Inggris.","['Oleh : <NAMA MAHASISWA>\n                             NRP. <XXXXXXXX>\n\n\n\n                    Disetujui oleh Tim Penguji Tugas Akhir :\n\n\n1. Nama dan gelar pembimbing                            Pembimbing\n\n\n2. Nama dan gelar ko-pembimbing/penguji                 Ko-pembimbing\n\n\n3. Nama dan gelar penguji                               Penguji\n\n\n4. Nama dan gelar penguji                               Penguji\n\n\n5. Nama dan gelar penguji                               Penguji\n\n\n                                 SURABAYA\n                                 Bulan, Tahun\n\n\n\n                                                                        33\n\x0c                              APPROVAL SHEET\n\n\n\nTHE TITLE OF THE FINAL PROJECT IS WRITTEN BRIEFLY, CLEARLY AND\n                  DESCRIBING THE MAIN THEME'
 '6 BAB III  \nLAPORAN TUGAS AKHIR \n \n3.1. Sistem atika \n Siste matika l aporan Tugas Akhir terdiri atas  tiga ba gian besar, \nyaitu : \n \n1. Bagian ’Awal’ terdiri dari: \na. Judul Tu gas Akhir dala m bahasa In donesia dan  bahasa \nInggris pada kulit m uka dan kulit  dalam  (Lampiran 1 ) \nb. Hala man pengesahan ( Lampiran 2 ) \nc. Abstrak atau  uraian singkat dalam  bahasa Indonesia dan  \nbahasa Inggris ( Lampiran 3 ) \nd. Kata pengantar \ne. Daftar isi \nf. Daftar gam bar, grafik, diag ram \ng. Daftar tabel \nh. Daftar si mbol \n \n2. Bagian ‘Inti/Pokok’ atau ‘Batang Tubuh’ berisi :  \n a. Pendahuluan  \n• Latar belakan g masalah \n• Rumusan Per masalahan  \n• Batasan m asalah/ruang lingkup \n• Tujuan  \n• Manfaat (bila diperlukan untuk ditulis) \nb. Tinjauan Pustaka \n• Hasil peneliti an terdahulu yang relevan \n• Teori yang akan digunakan untuk meny elesaikan  \npermasalahan   \nc. Metodolog i  \n• Metode y ang digunakan \n• Bahan dan perala tan y ang digunakan \n• Urutan pelaksanaan percobaan'
 '1. Nama dan gelar pembimbing                             Pembimbing\n\n\n2. Nama dan gelar ko-pembimbing/penguji                  Ko-pembimbing\n\n\n3. Nama dan gelar penguji                                Penguji\n\n\n4. Nama dan gelar penguji                                Penguji\n\n\n5. Nama dan gelar penguji                                Penguji\n\n\n\n                                  SURABAYA\n                                  Bulan, Tahun\n\n                                                                         25\n\x0c                              APPROVAL SHEET\n\n\n\n  THE TITLE OF THE FINAL PROJECT PROPOSAL IS WRITTEN BRIEFLY,\n            CLEARLY AND DESCRIBING THE MAIN THEME'
 'THE TITLE OF THE FINAL PROJECT IS WRITTEN BRIEFLY, CLEARLY AND\n                  DESCRIBING THE MAIN THEME\n\n\n\n                               FINAL PROJECT\n                    Submitted to fulfill one of the requirements\n                    for obtaining a degree <name of degree> at\n             Undergraduate Study Program of <name of Study Program>\n                      Department of <name of Department>\n                          Faculty of <name of Faculty>\n                       Institut Teknologi Sepuluh Nopember\n\n\n\n                          By: <NAME OF STUDENT>\n                              NRP. <XXXXXXXX>\n\n\n\n                    Approved by Final Project Examiner Team:\n\n\n1. Name of Advisor and academic title                      Advisor\n\n\n2. Name of Co-Advisor/Examiner and academic title          Co-Advisor\n\n\n3. Name of Examiner and academic title                     Examiner\n\n\n4. Name of Examiner and academic title                     Examiner']","Judul, nama penulis, NRP, nama pembimbing, abstrak, kata kunci, ditulis dalam bahasa Inggris dan Indonesia",0.6388888888675925,1.0,0.8876599452610822,1.0
13,Bagaimana cara login ke MONTA?,"Untuk login ke MONTA, mahasiswa harus melakukan langkah-langkah berikut:
1. Buka situs MONTA di monta.if.its.ac.id
2. Login menggunakan default username dan password, yang merupakan NRP mahasiswa.
3. Setelah login berhasil, mahasiswa akan masuk ke halaman mahasiswa.","['SOP (Guidelines) Mahasiswa\n\n\nBerikut merupakan guidelines penggunaan MONTA untuk mahasiswa:\n\n\n\uf076 Login ke MONTA (monta.if.its.ac.id)\n   1. Melakukan login terlebih dahulu (default username dan password adalah NRP).\n\n\n\n\n   2. Setelah login, maka akan masuk ke halaman mahasiswa.'
 'KEMENTERIAN PENDIDIKAN, KEBUDAYAAN, RISET, DAN TEKNOLOGI INSTITUT TEKNOLOGI SEPULUH NOPEMBER\nKampus ITS Sukolilo Surabaya 60111\nTelepon: 031-5994251-54, 5947274, 5945472 (Hunting)\nFax: 031-5947264, 5950806\nhttp://www.its.ac.id\n4. Calon wisudawan diwajibkan login ke Aplikasi Wisuda (https://wisuda.dwpits.id)\nmenggunakan akun alumni yang didapatkan dari pendaftaran di myITS Alumni\n(https://alumni.its.ac.id).\nD. KEGIATAN LAIN :\n1. Pengambilan Gordon, Toga dan Pemesanan Foto Prosesi serta Undangan di gedung\nDharma Wanita Persatuan ITS sesuai dengan jadwal sebagai berikut:\n- Magister dan Doktor:\nMenyerahkan bukti slip pembayaran wisuda dan slip sewa toga dari bank.\n- Sarjana dan Sarjana Terapan:\nMenunjukkan identitas diri dan menyerahkan bukti pembayaran/slip sewa toga dari bank.\n- Pemesanan Foto Prosesi (tidak wajib)\n- Undangan Wisuda untuk orang tua:\nUndangan untuk orang tua/pendamping wisudawan diambil bersamaan dengan\npengambilan toga'
 '1. Langkah awal sebelum mengisikan data proposal TA ke MONTA, mahasiswa wajib berdiskusi\n      terlebih dahulu dengan calon dosen pembimbing perihal topik TA yang ingin dikerjakan sambil\n      bimbingan dalam penyusunan draft proposal TA.\n\n   2. Setelah topik dan draft proposal TA sudah disetujui, mahasiswa melakukan pendaftaran proposal\n      TA ke sistem dengan memilih menu Proposal TA –> Buat Proposal serta mengunggah file draft\n      proposal yang sudah disepakati pembimbing.\n      Setelah mengisi semua isian form maka memilih tombol Buat Proposal Baru.\n\n\n\n\n   3. Setelah mendaftarkan proposal, mahasiswa dapat mencetak cover proposal TA dengan memilih\n      menu Cetak Cover –> Cetak Cover Proposal TA.\n\n\n\n\n   4. Mahasiswa wajib menyerahkan kepada koordinator TA/Ketua RMK, hardcopy proposal TA\n      lengkap dengan cover proposal yang dicetak dari MONTA dan sudah disetujui/ditandatangani\n      oleh dosen pembimbing.'
 '6. Apabila memerlukan informasi lebih lanjut dapat menghubungi dirpendikcare@its.ac.id atau di\ncall centre pada hari dan jam kerja melalui no (WA Text Only) 085186819604, 085186819605.\nB. Bagi semua calon wisudawan (Sarjana dan Sarjana Terapan) wajib menghadap dosen wali untuk persetujuan SKEM, serta wajib melakukan pengajuan SKPI di studentconnect paling lambat tanggal 9 Februari 2024;\nC. Ijazah dicetak berdasarkan data preview yang dipermanen oleh calon wisudawan. Ijazah dicetak hanya sekali saja, bila ada kekeliruan pengisian data pada point 3 maka akan diterbitkan surat keterangan.\nD.Pelaksanaan wisuda akan dilaksanakan secara offline (Informasi mengenai gladi bersih disampaikan lebih lanjut.\n Atas perhatian dan kerjasama yang diberikan, kami sampaikan terima kasih.\n Powered by TCPDF (www.tcpdf.org)\nTembusan Yth :\n1. Rektor ITS\n2. Kepala Bagian Administrasi Umum dan Kearsipan Digital 3. Sekretaris Institut\nSurabaya, 09 Januari 2024\nWakil Rektor Bidang Akademik dan Kemahasiswaan,']",Melakukan login dengan default username dan password adalah NRP ke monta.if.its.ac.id,0.99999999995,1.0,0.9350213847898248,1.0
14,Apa yang dilakukan setelah topik dan draft proposal TA sudah disetujui?,"Setelah topik dan draft proposal TA sudah disetujui, langkah-langkah yang perlu dilakukan adalah:
1. Menyelesaikan revisi (jika ada)
2. Mendapatkan persetujuan dari penguji terkait revisi yang diberikan. Persetujuan bisa dilakukan dengan menggunakan form revisi atau melalui email. Form revisi dapat diperoleh dari Pak Yudi Mulyono dan disimpan oleh mahasiswa, tidak wajib untuk dikirim ke dosen penguji/pembimbing/sekdep.
3. Mengkompilasi buku versi terakhir dari proposal TA.
4. Memenuhi persyaratan yudisium.
5. Mengisi data wisudawan.

Setelah itu, mahasiswa perlu melakukan revisi (jika ada), mengumpulkan persetujuan revisi dari penguji (menggunakan tanda tangan digital atau email), dan memenuhi persyaratan-persyaratan yudisium.","['telah menyelesaikan revisi\nsidang proposal tesis dan\nmenginfokan ke Kaprodi\nMeng-update status sidang\nproposal tesis di MonT esMeng-upload lembar revisi sidang\nproposal tesis dan buku proposal\ntesis yang dilengkapi dengan\nlembar pengesahan yang sudah\ntertandatanganiLembar revisi dan\nlembar pengesahan yang\ntelah tertandatanganiData peserta sidang\nproposal tesis\nLembar revisi sidang\nproposal tesis  Usulan jadwal dan\npenguji sidang\nproposal tesis  \nLembar revisi dan\nlembar pengesahanSIDANG PROPOSAL TESIS (IF -185301) PROGRAM STUDI S2 TEKNIK \nINFORMATIKA, DEPARTEMEN TEKNIK INFORMATIKA, FT -EIC ITS  \n(SISTEM ONLINE ) \n \n1. Dalam satu semester, terdapat dua kali siding proposal tesis, yaitu minggu ke -5 – minggu \nke-6 dan minggu ke -17 – minggu  ke-18. \n2. Admin Akademik Pascasarjana  menginfokan jadwal, persyaratan, dan link Google Form \npendaftaran sidang proposal tesis melalui MonTes dan grup whatsapp.  \n3. Mahasiswa yang ingin mendaftar sidang proposal tesis, harus melengkapi berkas'
 'Jika TA expired atau jika pembimbing dan atau RMK ganti, maka mesti mengajukan proposal TA ulang dan mengambil Pra-TA lagi.\n\nQ : Setelah sidang, apa yang perlu dilakukan?\n\nA : 1. menyelesaikan revisi (jika ada)\n2. mendapatkan persetujuan dari penguji thdp revisi yang diberikan. Persetujuan bisa dengan menggunakan form revisi/email. Form ada di Pak Yudi Mulyono. Form ini disimpan mahasiswa, tidak wajib untuk dikirim ke dosenpenguji/pembimbing/sekdep 1\n3. mengkompilasi buku versi terakhir\n4. memenuhi persyaratan yudisium\n5. mengisi data wisudawan\n\nQ : Bagaimana follow Up setelah sidang TA?\n\nA : 1. mahasiswa mengerjakan revisi (jika ada)\n2. mahasiswa mengumpulkan persetujuan revisi dari penguji (menggunakan ttd digital atau email)\n3. mahasiswa memenuhi persyaratan-persyaratan yudisium.\n \n\nQ : Berapa lama waktu revisi TA setelah sidang?'
 'hasil revisiDokumen hasil\nrevisi sidang\nproposal tesis  \nApakah revisi\nsudah sesuai?Dokumen hasil\nrevisi sidang\nproposal tesis  Ketua RMK menentukan penguji\ndan menjadwalkan sidang\nproposal tesis setiap pesertaSOP PENDAFT ARAN SIDANG PROPOSAL TESIS PROGRAM STUDI S2 TEKNIK INFORMA TIKA (SISTEM ONLINE ), FT -EIC, ITS  \nYaDraft proposal tesis\ndan form persetujuan\npembimbing\nPemeriksa,\n \n \n \n \n \nLina Ambarwati, S.Kom.  \nNIP. 198003242014092001  Mengetahui,\nDr. Ahmad Saikhu, S.Si., M.T . \nNIP. 197107182006041001Pembuat,\n \n \n \n \n \nKartika Dwi Y uniavita Rahmawati, S.T .\nNPP. 1998202122056  \nJadwal sidang, link\nmeeting, dan VB\nTidak\nMenginfokan link google form\nuntuk meng-upload  seluruh\ndokumen hasil revisi sidang\nproposal tesis ke mahasiswa\nStatus sidang\nproposal tesis\nmenjadi ""Disetujui""Merekap data mahasiswa yang\ntelah menyelesaikan revisi\nsidang proposal tesis dan\nmenginfokan ke Kaprodi\nMeng-update status sidang\nproposal tesis di MonT esMeng-upload lembar revisi sidang'
 '5. Setelah semua proses diatas sudah dilakukan dengan benar, maka mahasiswa tinggal menunggu\n      perubahan status proposal TA-nya via MONTA (Mendaftar \uf0e0 Tunggu Sidang Proposal \uf0e0 OK/\n      Revisi/ Ditolak). Bagi mahasiswa yang status proposalnya OK, maka bisa segera melakukan\n      bimbingan ke dosen pembimbing. Sedangkan bagi proposalnya berstatus Revisi/Ditolak, harap\n      menghadap ke koordinator TA/Ketua RMK untuk mengambil hardcopy proposal dan menanyakan\n      keterangan lebih detail tenang status proposalnya.\n\x0c\uf076 Bimbingan TA\n\n  1. Setelah proposal TA mahasiswa berstatus “OK”, maka proses bimbingan TA bisa mulai dilakukan\n     baik secara online maupun offline. Untuk bimbingan online, mahasiswa mengisi kegiatan\n     bimbingan dengan memilih menu Progres TA, kemudian memilih menu Bimbingan Baru.\n\n\n\n\n  2. Berikut merupakan halaman bimbingan baru untuk diisikan item/catatan yang dijadikan topik\n     bimbingan.']",Melakukan pendaftaran proposal TA ke sistem MONTA dan mengunggah file draft proposal yang sudah disepakati pembimbing,0.8055555555287036,0.5714285714285714,0.8653338605552968,0.0
15,Dimana mahasiswa dapat mencetak cover proposal TA?,"Mahasiswa dapat mencetak cover proposal TA di myITS Printing dengan mengikuti langkah-langkah berikut:
1. Mengunggah file buku TA yang sudah ditandatangani pembimbing ke repository.its.ac.id dan mencatat Eprint ID.
2. Menunggu validasi buku TA selama 1x24 jam (hari kerja).
3. Membuka my.its.ac.id dan memilih aplikasi myITS Printing.
4. Memilih layanan Cetak Buku TA.
5. Memasukkan Eprint ID.
6. Memasukkan ukuran buku, opsi warna, opsi jilid sampul, dan jumlah buku.
7. Melihat harga total dan melakukan pembayaran dengan cara transfer ke Virtual Account BNI.
8. Setelah selesai, mahasiswa dapat memantau status pencetakan di menu Daftar Pesanan Saya.","['ーー\nLampiran 8A\nA. Contoh sampul / cover dalam tesis mono disiplin\ne20 mm\n40 mm\n35 mm\nWarna Dibagian Atas Garis Biru ITS : Putih\n0.6 dari tinggi kertas\n• 15 mm\nWarna Biru ITS\nWarna Dibawah Garis Biru ITS :\nSesuai Warna Fakultas\nTesis - No. Kode Tesis\nJudul Tesis\nTrebuchet MS (Bold), 17 puchet Ms (Bold),\n18 point\n0.4 dari tinggi kertas\n40 mm\nNAMA MAHASISWA NRP MAHASISWA\nDOSEN PEMBIMBING\nProf. Ir. Wahyu Susilo, M.Sc., Ph.D.\nDr. Ir. Indah Wahyuni, M.Sc.\nPROGRAM MAGISTER BIDANG KEAHLIAN ...\n00.......\nPROGRAM STUDI..............\nDEPARTEMEN ..\nFAKULTAS ..\nINSTITUT TEKNOLOGI SEPULUH NOPEMBER\nSURABAYA\n>20..\n--1\n130 mm\nV\n- Trebuchet MS,\n12 point\n51'
 'Lampiran 6B\nC. Contoh sampul / cover luar tesis multi disiplin\n20 mm\n40 mm\n35 mm\nWarna Dibagian Atas Garis Biru ITS : Putih\n$ 15 mm\n0.6 dari tinggi kertas\nWarna Biru ITS\nWarna Dibawah Garis Biru ITS :\nSesuai Warna Fakultas\nTesis - No. Kode Tesis\nJudul Tesis\nTrebuchet MS (Bold),\n12 point\nTrebuchet MS (Bold),\n18 point\n0.4 dari tinggi kertas\n40 mm\nNAMA MAHASISWA NRP MAHASISWA\nDOSEN PEMBIMBING\nProf. Ir. Wahyu Susilo, M.Sc., Ph.D.\nDr. Ir. Indah Wahyuni, M.Sc.\nPROGRAM MAGISTER\nBIDANG KEAHLIAN .................\nPROGRAM STUDI .....\n•..\nPROGRAM PASCASARJANA\nINSTITUT TEKNOLOGI SEPULUH NOPEMBER !\nSURABAYA\n720..\n: 30 mm\nV\nTrebuchet MS,\n12 point\n46'
 'www.its.ac.id INSTITUT TEKNOLOGI SEPULUH NOPEMBER, Surabaya - Indonesia\n\nPemesanan Cetak Buku TA di myITS Printing\n\nSubdit. Aplikasi dan Platform Digital\nDirektorat Pengembangan Teknologi dan Sistem Informasi\n30 Juli 2020\n\nTata Cara Pemesanan\n\nMengunggah file buku TA yang sudah ditandatangani pembimbing ke repository.its.ac.id dan mencatat Eprint ID.\nMenunggu validasi buku TA 1x24 jam (hari kerja).\nMembuka my.its.ac.id dan memilih aplikasi myITS Printing.\nMemilih layanan Cetak Buku TA.\nMemasukkan Eprint ID.\nMemasukkan ukuran buku, opsi warna, opsi jilid sampul, dan jumlah buku.\nMelihat harga total dan melakukan pembayaran dengan cara transfer ke Virtual Account BNI.\nSelesai (mahasiswa dapat memantau status pencetakan di menu Daftar Pesanan Saya).\nMelihat Eprint ID terpublikasi\n\nMembuka laman repository.its.ac.id.\nMemilih menu Latest Addition.\nMencari publikasi yang sesuai.\nEprint ID:\n88888\n\nEprint ID berbeda-beda untuk setiap mahasiswa. Jangan menggunakan Eprint ID orang lain.'
 'Judul\nData pelaksana (NRP & Nama mahasiswa serta NIP dan Nama Pembimbing)\nLogo ITS\nLatar belakang/introduksi\nMetode\nHasil (teks dan gambar/fotografi/skema)\nSimpulan dan Saran\nLogo perangkat lunak yang digunakan / Institusi mitra (jika ada)\n16.Gambar produk jika ada akan sangat mendukung impresi pelaksanaan kegiatan secara visual.\n17.Resolusi yang disarankan untuk kualitas cetakan adalah minimal 300 dpi dari sumber gambar aslinya.\n\nDesclaimer\n\nMahasiswa wajib mengisi Form Kepuasan Layanan & Pengumpulan Berkas Yudisium secara lengkap sebelum deadline pengumpulan berakhir.\n\nDeadline pengunggahan kelengkapan yudisium S1 di Departemen Teknik Informatika 10 Februari 2024\n\nLink Terkait\n\ue31d\nIsi Form Kepuasan Mahasiswa\n\uf548\nIsi Form Pengumpulan Berkas Yudisium\n\ueed6\nCek berkas-berkas yudisium\nWhat to do?*\n\n*Jika ada informasi yang kurang mohon informasikan kepada kami :))\n\n1        \nMengecek nilai TOEFL di UPT Bahasa.\n\nJika belum terpenuhi, segera melakukan perbaikan nilai!']",Menu Cetak Cover –> Cetak Cover Proposal TA di MONTA,0.999999999975,0.8888888888888888,0.9506062246368175,0.0
16,Konten apa saja yang harus ada dalam video Tugas Akhir?,"Dalam video Tugas Akhir, konten yang harus ada meliputi:
1. Penjelasan singkat tentang latar belakang dan tujuan dari Tugas Akhir.
2. Presentasi hasil penelitian atau perancangan yang telah dilakukan.
3. Penyajian data dan analisis yang mendukung temuan dalam Tugas Akhir.
4. Penjelasan tentang metodologi yang digunakan dalam penelitian atau perancangan.
5. Kesimpulan dan rekomendasi berdasarkan hasil Tugas Akhir.
6. Presentasi yang jelas dan menarik untuk memperjelas informasi yang disampaikan.
7. Penyampaian secara sistematis dan terstruktur sesuai dengan konten yang telah disusun dalam Tugas Akhir.","['Oleh : <NAMA MAHASISWA>\n                             NRP. <XXXXXXXX>\n\n\n\n                    Disetujui oleh Tim Penguji Tugas Akhir :\n\n\n1. Nama dan gelar pembimbing                            Pembimbing\n\n\n2. Nama dan gelar ko-pembimbing/penguji                 Ko-pembimbing\n\n\n3. Nama dan gelar penguji                               Penguji\n\n\n4. Nama dan gelar penguji                               Penguji\n\n\n5. Nama dan gelar penguji                               Penguji\n\n\n                                 SURABAYA\n                                 Bulan, Tahun\n\n\n\n                                                                        33\n\x0c                              APPROVAL SHEET\n\n\n\nTHE TITLE OF THE FINAL PROJECT IS WRITTEN BRIEFLY, CLEARLY AND\n                  DESCRIBING THE MAIN THEME'
 'dimana pesertanya berasal dari sekurang-kurangnya diikuti oleh 3 negara.\n5. Dalam penentuan penyetaraan apresiasi yang bisa diekivalensikan dengan juara 1, 2,\ndan 3 ditentukan oleh Ditmawa.'
 '24\n\x0cLAMPIRAN 2: Contoh Halaman Pengesahan Proposal Tugas Akhir\n\n                         LEMBAR PENGESAHAN\n\n      JUDUL PROPOSAL TUGAS AKHIR DITULIS SINGKAT JELAS DAN\n                 MENGGAMBARKAN TEMA POKOK\n\n\n                         PROPOSAL TUGAS AKHIR\n                    Diajukan untuk memenuhi salah satu syarat\n                      memperoleh gelar <Nama Gelar> pada\n                    Program Studi S-1 <Nama Program Studi>\n                        Departemen <Nama Departemen>\n                            Fakultas <Nama Fakultas>\n                       Institut Teknologi Sepuluh Nopember\n\n\n\n                        Oleh : <NAMA MAHASISWA>\n                              NRP. <XXXXXXXX>\n\n\n\n                 Disetujui oleh Tim Penguji Proposal Tugas Akhir :\n\n\n1. Nama dan gelar pembimbing                             Pembimbing\n\n\n2. Nama dan gelar ko-pembimbing/penguji                  Ko-pembimbing'
 'BAB I  \nTUGAS AKHIR : PENGERTIAN DAN T UJUAN \n \n \n1.1  Pen gertian \n Tiap mahasis wa yang akan m enyelesai kan studiny a dala m \nprogram  sarjana dan di ploma di wajibkan un tuk meny usun  suatu \nkarya ilm iah yang disebut  Tugas Akhir, setelah y ang bersangkut an \nmemenuhi persy aratan tertentu. T ugas Akhir dapat berupa penelitian \natau perancan gan (desain) y ang m empunyai ciri-ciri antara lain : \n \n1. Mem puny ai perum usan masa lah untuk penelitian, dan \nide untu k perancangan \n2. Judul tugas akhir dipilih sendiri oleh mahasiswa atau \nditentukan oleh dosen pembim bing \n3. Didasarkan pada pengamata n labor atorium /lapan gan \n(data primer) dan/atau analisis data sekunder \n4. Harus ada  ketertiban metodologi \n5. Di bawah bim bingan berkala dan teratur oleh dosen  \npembimbing \n6. Harus cer mat dalam  sajian (tata tulis ilmiah atau  aturan \ngambar) \n7. Dipresentasik an dala m forum  seminar \n8. Dipertahankan dalam  ujian lisan di  depan tim  dosen \npenguji \n \n1.2  T ujuan']","Logo ITS, Judul Tugas Akhir, Data Pembuat dan Pembimbing, Deskripsi singkat Tugas Akhir, Cara jalannya aplikasi",0.4166666666458333,1.0,0.9833868304516877,0.2
17,Bagaimana cara pengecekan file yang telah terunggah di POmITS?,"Untuk melakukan pengecekan file yang telah terunggah di POmITS, Anda dapat mengunjungi website resmi POmITS di http://lpmp2ki.its.ac.id/pomits. Di sana, Anda dapat melihat daftar file yang telah terunggah. Jika terdapat penghapusan atau penarikan artikel, Anda dapat mengisi form yang tersedia pada link berikut: 
- http://bit.ly/FHAJTeknikITS untuk Jurnal Teknik ITS
- http://bit.ly/FHAJSainsSeniITS untuk Jurnal Sains & Seni ITS
- http://bit.ly/FHAJRepositoryITS untuk Repository.

Selain itu, Anda juga dapat melihat daftar data artikel terhapus yang diupdate setiap 3 hari pada website jurnal di http://ejurnal.its.ac.id. Artikel-artikel yang tidak memenuhi ketentuan publikasi, seperti gaya selingkung tidak sesuai format dan file pendukung tidak lengkap, tidak akan dipublikasikan di Jurnal POmITS. Periode unggah artikel untuk yudisium 122 adalah sampai dengan 7 Agustus 2020 pukul 24.00 WIB.","['\uf0b7   Pengecekan file yang TERUNGGAH dapat dilihat di\n    http://lpmp2ki.its.ac.id/pomits.\n\n\uf0b7   Jika terdapat penghapusan/penarikan artikel, dapat mengisi form pada link\n    \uf031\uf02e http://bit.ly/FHAJTeknikITS, untuk Jurnal Teknik ITS;\n    \uf032\uf02e http://bit.ly/FHAJSainsSeniITS, untuk Jurnal Sains &Seni ITS;\n    \uf033\uf02e http://bit.ly/FHAJRepositoryITS, untuk Repository.\n\n\n\uf0b7   List data Artikel terhapus dapat dilihat pada website jurnal.\n    (http://ejurnal.its.ac.id, yang diupdate tiap 3 hari)\n\n\uf0b7   Artikel - artikel yang TIDAK MEMENUHI KETENTUAN PUBLIKASI (gaya selingkung tidak\n    sesuai format dan file pendukung tidak lengkap) tidak akan DIPUBLIKASIKAN di\n    Jurnal POMITS.\n\n\uf0b7   Periode unggah artikel untuk yudisium 122 adalah sampai dengan\n    7 Agustus 2020, pukul 24.00 WIB'
 'Pemberitahuan\nUnggah Artikel POmITS\nUNGGAH artikel WAJIB dilakukan oleh MAHASISWA PENDAFTAR YUDISIUM 129\n Mahasiswa yang Dosen Pembimbingnya memilih untuk MEMpuBLIKAsIKAN\nartikelnya pada Jurnal POmITS, dapat melakukan UNGGAH, dengan mengikuti langkah\npada BUKU PANDUAN TATA CARA UNGGAH. File yang HARUS DIUNGGAH adalah\n(ukuran masing-masing file tidak boleh lebih dari 2 MB):\nArtikel hasil dari Tugas Akhir, dalam format Ms. Word yang telah mengikuti tem-\n1.\nplate. (selain format Ms.Word artikel DITOLAK/REJECTED)\nFormulir Hak Cipta, dalam format PDF.\nForm Telaah Artikel POmITs, dalam format PDF.\nForm Revisi/Perbaikan/Penyempurnaan TA yang berisi nama penguji beserta\ntidak hanya TTD saja)\n Template, Formulir Hak Cipta, Buku Panduan Tata Cara Unggah, dan Form Telaah\n5.\nArtikel dapat diunduh pada link:\nhttps://ejurnal.its.ac.id/index.php/teknik (Jurnal Teknik ITS)\nhttps://ejurnal.its.ac.id/index.php/sains_seni (Jurnal Sains&Seni ITS)\nSection yang bisa dipilih pada Jurnal Teknik ITS:'
 '\uf0b7   Mahasiswa yang Dosen Pembimbingnya memilih untuk MEMPUBLIKASIKAN\n    artikelnya pada Jurnal POMITS, dapat melakukan UNGGAH, dengan mengikuti langkah\n    pada BUKU PANDUAN TATA CARA UNGGAH. File yang HARUS DIUNGGAH adalah\n    (ukuran masing-masing file tidak boleh lebih dari 2 MB):\n    \uf031\uf02e Artikel hasil dari Tugas Akhir, dalam format Ms. Word yang telah mengikuti tem-\n       plate. (selain format Ms.Word artikel DITOLAK/REJECTED)\n    \uf032\uf02e Formulir Hak Cipta.\n    \uf033\uf02e Form Telaah Artikel POMITS, dalam format PDF.\n    \uf034\uf02e Form Revisi/Perbaikan/Penyempurnaan TA yang berisi nama penguji beserta\n       komentar dari penguji, dalam format PDF. (Mohon nama penguji tidak disingkat/\n       tidak hanya TTD saja)\n    \uf035\uf02e Template, Formulir Hak Cipta, Buku Panduan Tata Cara Unggah, dan Form Telaah\n       Artikel dapat diunduh pada link:\n       http://ejurnal.its.ac.id/index.php/teknik (Jurnal Teknik ITS)\n        http://ejurnal.its.ac.id/index.php/sains_seni (Jurnal Sains&Seni ITS)'
 'Lakukan pembayaran dengan transfer ke VA BNI. Berlaku 1x24 jam. Jika kadaluarsa bisa melakukan pesanan baru.\nMemantau Pesanan\n\nStatus Pesanan:\n\nMembuat pesanan cetak\nMenunggu pembayaran\nPembayaran diterima\nProses pencetakan\nSelesai dicetak\nPengiriman ke Perpustakaan / Departemen\nSelesai\nPesanan kadaluarsa\nPesanan dibatalkan\nJika ada permasalahan teknis dapat menghubungi:\n\nWA Layanan DPTSI: 0811 3333 8 222 (07:30 – 16:00 WIB)\nPortal Servicedesk: https://servicedesk.its.ac.id']",Pengecekan file yang telah terunggah dapat dilakukan di https://lpmp2ki.its.ac.id/pomits.,0.8055555555287036,0.8333333333333334,0.9952150037039026,1.0
18,Apa yang harus dilakukan jika terjadi kesalahan pada file yang sudah terunggah?,"Jika terjadi kesalahan pada file yang sudah terunggah, Anda dapat mengisi form penghapusan/penarikan artikel sesuai dengan jenis jurnal yang bersangkutan. Untuk Jurnal Teknik ITS, Anda dapat mengisi form pada link http://bit.ly/FHAJTeknikITS, untuk Jurnal Sains & Seni ITS pada link http://bit.ly/FHAJSainsSeniITS, dan untuk Repository pada link http://bit.ly/FHAJRepositoryITS. Penghapusan artikel akan dilakukan setelah yudisium berakhir.","['Lakukan pembayaran dengan transfer ke VA BNI. Berlaku 1x24 jam. Jika kadaluarsa bisa melakukan pesanan baru.\nMemantau Pesanan\n\nStatus Pesanan:\n\nMembuat pesanan cetak\nMenunggu pembayaran\nPembayaran diterima\nProses pencetakan\nSelesai dicetak\nPengiriman ke Perpustakaan / Departemen\nSelesai\nPesanan kadaluarsa\nPesanan dibatalkan\nJika ada permasalahan teknis dapat menghubungi:\n\nWA Layanan DPTSI: 0811 3333 8 222 (07:30 – 16:00 WIB)\nPortal Servicedesk: https://servicedesk.its.ac.id'
 '\uf0b7   Pengecekan file yang TERUNGGAH dapat dilihat di\n    http://lpmp2ki.its.ac.id/pomits.\n\n\uf0b7   Jika terdapat penghapusan/penarikan artikel, dapat mengisi form pada link\n    \uf031\uf02e http://bit.ly/FHAJTeknikITS, untuk Jurnal Teknik ITS;\n    \uf032\uf02e http://bit.ly/FHAJSainsSeniITS, untuk Jurnal Sains &Seni ITS;\n    \uf033\uf02e http://bit.ly/FHAJRepositoryITS, untuk Repository.\n\n\n\uf0b7   List data Artikel terhapus dapat dilihat pada website jurnal.\n    (http://ejurnal.its.ac.id, yang diupdate tiap 3 hari)\n\n\uf0b7   Artikel - artikel yang TIDAK MEMENUHI KETENTUAN PUBLIKASI (gaya selingkung tidak\n    sesuai format dan file pendukung tidak lengkap) tidak akan DIPUBLIKASIKAN di\n    Jurnal POMITS.\n\n\uf0b7   Periode unggah artikel untuk yudisium 122 adalah sampai dengan\n    7 Agustus 2020, pukul 24.00 WIB'
 ""melakukan UNGGAH di Jurnal Repository, menggunakan login 'mahasiswa', dengan.\nkata sandi 'M4h4sisw4lTs!' ke alamat 'https://ejurnal.its.ac.id/index.php/index/login'\ndengan mengunggah file artikel dan file Form Telaah(dalam format pdf) saja.\nPengecekan file vang TERuNGGAH dapat dilihat di\nhttps://lpmp2ki.its.ac.id/pomits.\nJika terdapat penghapusan/penarikan artikel, dapat mengisi form pada link :\nhttps://its.id/FHAJTeknikITSPOMITS, untuk Jurnal Teknik ITS;\n1.-\nhttps:/l/its.id/FHAJSainsSenilTSPOMITS, untuk Jurnal Sains &Seni ITS;\n3.https://its.id/FHAJRepositorylTSPOMITS, untuk Jurnal Repository..\n Penghapusan Artikel akan dilakukan setelah yudisium berakhir.\nArtikel - artikel yang TIDAK MEMENUHI KETENTUAN PUBLIKASI (gaya selingkung\ntidak sesuai format dan file pendukung tidak lengkap) tidak akan DIPUBLIKASIKAN\ndi Jurnal Teknik ITS dan Jurnal Sains & Seni ITS.\nPeriode unggah artikel untuk yudisium 29 adalah sampai dengan \n15 Februari 2024 pukul 24.00 WIB""
 'Apakah berkas\nsudah lengkap?\nMelakukan pendaftaran sidang\nproposal tesis\nMeminta tanda tangan form revisi\nke dosen pembimbing dan\npenguji dan lembar pengesahan\nke dosen pembimbingJadwal sidang, link\nmeeting, form penilaian\ndan form berita acara  \nMengajukan hasil revisi\nke dosen pembimbing\ndan pengujiMelengkapi dan memeriksa\nberkas persyaratan pendaftaran\nsidang proposal tesis\nTidak\nYa\nCatatan revisi sidang proposal\ntesis dan data penilaian sidang\nproposal tesis dari\npembimbing dan penguji\nMahasiswa dapat mengecek nilai\nsidang proposal tesis melalui\nSIAKAD ITS di akhir semester\n(IF 185301 T esis-Proposal)Dosen (Pembimbing, Penguji, Ketua RMK)\nDosen pembimbing dan penguji\nmenandatangani form revisi dan\nlembar pengesahan, lalu\nmenyerahkan kembali ke mahasiswaDosen pembimbing\ndan penguji memeriksa\nhasil revisiDokumen hasil\nrevisi sidang\nproposal tesis  \nApakah revisi\nsudah sesuai?Dokumen hasil\nrevisi sidang\nproposal tesis  Ketua RMK menentukan penguji\ndan menjadwalkan sidang']","Jika terjadi kesalahan pada file, mahasiswa dapat melakukan penghapusan artikel dan unggah ulang dengan mengikuti form pada link: https://its.id/FHAJTeknikITSPOMITS, https://its.id/FHAJSainsSenilTSPOMITS, dan https://its.id/FHAJRepositorylTSPOMITS.",0.9999999999666667,0.4,0.0,1.0
19,Apa saja unsur dalam proposal tesis?,"Terdapat beberapa unsur dalam proposal tesis, yaitu:
1. Judul Proposal
2. Nama Mahasiswa
3. NRP Mahasiswa
4. Pembimbing
5. Ko-Pembimbing/Penguji
6. Penguji
7. Abstrak Proposal
8. Tujuan Penelitian
9. Metode Penelitian
10. Hasil yang Diharapkan
11. Daftar Pustaka

Semua unsur tersebut penting untuk disertakan dalam sebuah proposal tesis.","['1. Nama dan gelar pembimbing                             Pembimbing\n\n\n2. Nama dan gelar ko-pembimbing/penguji                  Ko-pembimbing\n\n\n3. Nama dan gelar penguji                                Penguji\n\n\n4. Nama dan gelar penguji                                Penguji\n\n\n5. Nama dan gelar penguji                                Penguji\n\n\n\n                                  SURABAYA\n                                  Bulan, Tahun\n\n                                                                         25\n\x0c                              APPROVAL SHEET\n\n\n\n  THE TITLE OF THE FINAL PROJECT PROPOSAL IS WRITTEN BRIEFLY,\n            CLEARLY AND DESCRIBING THE MAIN THEME'
 'Lampiran 11.A\nContoh abstrak tesis dalam Bahasa Indonesia\nKINERJA KOMPOS PRODUKSI UDPK BRATANG\nSEBAGAI MEDIA PENUKAR ION UNTUK MEREDUKSI LOGAM BERAT Cu DALAM AIR LIMBAH BUATAN\nNama mahasiswa\nNRP\nPembimbing\nABSTRAK\nKurangnya motivasi dalam kegiatan pengomposan salah\nsatunya adalah karena rendahnya nilai jual dan sempitnya pasar untuk produksi kompos. Pemanfaatan kompos sebagai media penukar 10n dharapkan dapat meningkatkan nila jual kompos sekaligus untuk memberikan alternatif pengolahan logam berat, khususnya Cu, yang murah. Kemampuan kompos untuk menukar ion berasal dari kandungan materi humus pada kompos yang mempunyai kapasitas tukar kation (KTK). Grup fungsi yang\nberperan\nadalah grup karboksil (-COOH) sehingga\nbisa\ndikategorikan sebagai resin asam lemah. Penelitian ini bertujuan untuk mengkaji kinerja kompos produksi UDPK Bratang sebagai media penukar ion untuk mereduksi Cu dalam air limbah buatan.\nKTK teoritis diukur dengan metode titrasi pH dan'
 'Lampiran 4\nContoh abstrak proposal tesis dalam Bahasa Indonesia\nINFILTRASI AIR HUJAN DAN KEGEMPAAN TERINDUKSI\nLERENG STABILITAS PADA TANAH SISA\nMENGGUNAKAN RESISTIVITAS DAN PENGUKURAN\nMICROTREMOR\nMahasiswa Nama\nMahasiswa ID\nPembimbing\nCo-Supervisor\n: Dwa Desa Warnana\n: 3107 301 202\n: Dr. Ir. Ria A. A. Soemitro, M.Eng\n: Dr. Ir. Widya Utama, DEA.\nABSTRAK\nPenggunaan metode resistivitas dan mikrotremor dalam'
 'THE TITLE OF THE FINAL PROJECT PROPOSAL IS WRITTEN BRIEFLY,\n            CLEARLY AND DESCRIBING THE MAIN THEME\n\n\n\n                        FINAL PROJECT PROPOSAL\n                    Submitted to fulfill one of the requirements\n                    for obtaining a degree <name of degree> at\n             Undergraduate Study Program of <name of Study Program>\n                      Department of <name of Department>\n                          Faculty of <name of Faculty>\n                       Institut Teknologi Sepuluh Nopember\n\n\n\n                          By: <NAME OF STUDENT>\n                              NRP. <XXXXXXXX>\n\n\n\n                Approved by Final Project Proposal Examiner Team:\n\n\n1. Name of Advisor and academic title                      Advisor\n\n\n2. Name of Co-Advisor/Examiner and academic title          Co-Advisor\n\n\n3. Name of Examiner and academic title                     Examiner\n\n\n4. Name of Examiner and academic title                     Examiner']","Unsur dalam proposal tesis terdiri dari: Judul, Lembar Pengesahan, Abstrak, Daftar isi, Bagian tubuh (bab-bab), Rencana dan Jadwal Kerja Penelitian dan Penyusunan Tesis, Daftar pustaka, dan Lampiran.",0.4166666666458333,0.0,0.9709950822795427,0.0
