,question,answer,contexts,ground_truth,context_precision,faithfulness,answer_relevancy,context_recall
0,Apa yang perlu direncanakan mahasiswa sehubungan dengan Bentuk Kegiatan Pembelajaran (BKP) MB-KM?,"Mahasiswa perlu merencanakan SKEM dan memetakan portofolio yang telah diusulkan dengan sks mata kuliah yang ingin dikonversikan sehubungan dengan Bentuk Kegiatan Pembelajaran (BKP) MB-KM. Selain itu, mahasiswa juga perlu melakukan perwalian dengan dosen wali untuk kemudian mendapatkan persetujuan FRS. Panduan pengguna dan rencana kegiatan SKEM/ Program MB-KM serta penjelasan terkait lainnya dapat diakses melalui link https://its.id/panduan-rencana-skem-MBKM dan https://its.id/RencanaKegiatanSKEMMBKM.","['Sehubungan dengan kurikulum Program Sarjana dan Sarjana Terapan tahun 2023 – 2028 maka Berikut kami sampaikan beberapa teknis terkait pelaksanaan perencanaan kegiatan Satuan Kegiatan Ekstrakurikuler Mahasiswa (SKEM)/ program Merdeka Belajar–Kampus Merdeka (MB-KM) disampaikan bahwa:'
 'A. Bagi Mahasiswa 1. Membuat perencanaan Kegiatan SKEM/ Program MB-KM dilaksanakan di awal semester. 2. Memilih kelas MB-KM secara mandiri melalui menu Formulir Rencana Studi (FRS) di SI Akademik. 3. Membuat dan menyimpan usulan portofolio yang tersedia di myITS StudentConnect untuk 1 (satu) semester ke depan. 4. Merencanakan SKEM dan memetakan portofolio (sehubungan dengan Bentuk Kegiatan Pembelajaran/ BKP MB-KM) yang telah diusulkan dengan sks mata kuliah yang ingin dikonversikan. 5. Melakukan perwalian dengan dosen wali untuk kemudian mendapatkan persetujuan FRS. 6. Panduan pengguna dan rencana kegiatan SKEM/ Program MB-KM dan penjelasan terkait lainnya dapat diakses di link https://its.id/panduan-rencana-skem-MBKM dan https://its.id/RencanaKegiatanSKEMMBKM . 7. Bagi mahasiswa yang merencanakan Program MB-KM, mengajukan Form 1 Matching Up Program MB-KM Ke MK Inti Prodi (jika konversi kegiatan ke Mata Kuliah Inti) dan Form 2 Surat Permohonan Kredit Transfer (Learning Agreement). 8.'
 'berlaku untuk angkatan 2021 keatas dimana kredit SKEMnya minimal 25.\n11. Dalam hal kegiatan yang digunakan untuk SKEM, mahasiswa wajib memiliki kegiatan\nProgram Kreativitas Mahasiswa (mulai angkatan 2020) dan Olahraga (mulai angkatan\n2021) selama menempuh kuliah di ITS. Untuk PKM mengikuti kegiatan minimal satu\nkali sedangkan olahraga dua kali selama menempuh kuliah di ITS.\n12. Kegiatan Olahraga ini ada 3 katagori yaitu:\na. Kegiatan olahraga mandiri yang ditunjukkan dengan logbook dan diverifikasi oleh\ndosen wali.\nb. Kegiatan olahraga yang dikoordinasi oleh UKM olahraga yang ada di ITS dengan\nmenunjukkan sertifikat/surat keterangan dimana verifikasi dilakukan oleh dosen\nwali.\nc. Kegiatan olahraga yang diselanggarakan oleh Komite Olahraga Nasional\nIndonesia (KONI) dengan menunjukkan sertifikat/surat keterangan dimana\nverifikasi dilakukan oleh dosen wali.\n13. Bagi mahasiswa yang tidak memiliki sertifikat kegiatan, bisa digantikan dengan surat'
 'Ketentuan dan Simulasi\n1. Pedoman SKEM ini mengikat bagi mahasiswa ITS mulai angkatan tahun akademik\n2018 keatas sebagai persyaratan mengikuti yudisium.\n2. Bukti atau dokumen pendukung kegiatan SKEM harus diunggah di myITS\nStudentConnect paling lambat satu tahun terhitung semenjak selesai kegiatan. Apabila\nmelebihi batas tersebut diatas maka dinyatakan tidak berlaku.\n3. Minimal kegiatan SKEM mencakup 2 bagian dari 4 bagian dalam peraturan (kecuali\nMagang/KP dan Kewirausahaan).\n4. Pengisian portofolio kegiatan SKEM dapat dilakukan pada akhir semester sebelumnya.']",Merencanakan SKEM dan memetakan portofolio dengan SKS mata kuliah yang ingin dikonversikan,,,0.999999999975,1.0
1,Apa yang harus dilakukan mahasiswa yang merencanakan Program MB-KM?,"Mahasiswa yang merencanakan Program MB-KM harus melakukan beberapa langkah, antara lain:
1. Membuat perencanaan kegiatan SKEM/Program MB-KM di awal semester.
2. Memilih kelas MB-KM secara mandiri melalui menu Formulir Rencana Studi (FRS) di SI Akademik.
3. Membuat dan menyimpan usulan portofolio yang tersedia di myITS StudentConnect untuk 1 (satu) semester ke depan.
4. Merencanakan SKEM dan memetakan portofolio yang telah diusulkan dengan sks mata kuliah yang ingin dikonversikan.
5. Melakukan perwalian dengan dosen wali untuk kemudian mendapatkan persetujuan FRS.
6. Mengajukan Form 1 Matching Up Program MB-KM Ke MK Inti Prodi (jika konversi kegiatan ke Mata Kuliah Inti) dan Form 2 Surat Permohonan Kredit Transfer (Learning Agreement).
7. Mengakses panduan pengguna dan rencana kegiatan SKEM/Program MB-KM serta penjelasan terkait lainnya melalui link yang disediakan.","['A. Bagi Mahasiswa 1. Membuat perencanaan Kegiatan SKEM/ Program MB-KM dilaksanakan di awal semester. 2. Memilih kelas MB-KM secara mandiri melalui menu Formulir Rencana Studi (FRS) di SI Akademik. 3. Membuat dan menyimpan usulan portofolio yang tersedia di myITS StudentConnect untuk 1 (satu) semester ke depan. 4. Merencanakan SKEM dan memetakan portofolio (sehubungan dengan Bentuk Kegiatan Pembelajaran/ BKP MB-KM) yang telah diusulkan dengan sks mata kuliah yang ingin dikonversikan. 5. Melakukan perwalian dengan dosen wali untuk kemudian mendapatkan persetujuan FRS. 6. Panduan pengguna dan rencana kegiatan SKEM/ Program MB-KM dan penjelasan terkait lainnya dapat diakses di link https://its.id/panduan-rencana-skem-MBKM dan https://its.id/RencanaKegiatanSKEMMBKM . 7. Bagi mahasiswa yang merencanakan Program MB-KM, mengajukan Form 1 Matching Up Program MB-KM Ke MK Inti Prodi (jika konversi kegiatan ke Mata Kuliah Inti) dan Form 2 Surat Permohonan Kredit Transfer (Learning Agreement). 8.'
 'Sehubungan dengan kurikulum Program Sarjana dan Sarjana Terapan tahun 2023 – 2028 maka Berikut kami sampaikan beberapa teknis terkait pelaksanaan perencanaan kegiatan Satuan Kegiatan Ekstrakurikuler Mahasiswa (SKEM)/ program Merdeka Belajar–Kampus Merdeka (MB-KM) disampaikan bahwa:'
 'B. Bagi Dosen Wali 1. Melakukan pendampingan dan pengecekan dari pengajuan perencanaan kegiatan SKEM/ program MB-KM yang diajukan oleh mahasiswa. 2. Jika dinilai sudah sesuai pengajuan perencanaan Kegiatan SKEM/ Program MB-KM oleh mahasiswa, dosen wali dapat melakukan persetujuan FRS. \nDemikian Surat Edaran ini dibuat untuk dilaksanakan dengan sebaik - baiknya. Atas perhatiannya diucapkan terimakasih.'
 'di Microsoft Excel dan mengirimkan file hasil rekapitulasi data pendaf tar sidang proposal \ntesis ke masing -masing ketua RMK yang terkait dengan topik penelitian tesis mahasiswa \nuntuk meminta di -plotting -kan jadwal sidang tesis dan dosen penguji.  \n6. Ketua RMK mem -plotting jadwal dan dosen penguji sidang proposal tesis untuk masi ng-\nmasing mahasiswa dan menginfokannya ke Admin Akademik Pascasarjana . \n7. Admin Akademik Pascasarjana  mengirimkan jadwal dan virtual background sidang \nproposal tesis ke mahasiswa melalui grup Whatsapp.  \n8. Mahasiswa standby 30 menit sebelum sesi dimulai dan bergabung ke link meeting sesuai \njadwal sidang proposal tesis yang telah ditentukan.  \n9. Dosen pembimbing dan penguji bergabung ke link meeting sesuai jadwal sidang proposal \ntesis yang telah ditentukan.  \n10. Mahasiswa melaksanakan sidang proposal tesis. Sedangkan, dosen pembimbing dan \npenguji memberikan feedback ke mahasiswa, mengisi berita acara , memberikan penilaian']",Mengajukan Form 1 Matching Up Program MB-KM Ke MK Inti Prodi dan Form 2 Surat Permohonan Kredit Transfer (Learning Agreement),0.9125155345167428,1.0,0.999999999975,1.0
2,Apa masalah utama lulusan ITS menurut kondisi eksisting?,"Masalah utama lulusan ITS menurut kondisi eksisting adalah kurangnya kemampuan dalam Leadership, Interpersonal skill, teamwork, dan endurance.","['Kondisi Eksisting\n1. Masalah utama lulusan ITS adalah Leadership, Interpersonal skill, teamwork, dan\nendurance.\n2. Mahasiswa dengan nilai SKEM diatas 3.000 tidak terlihat memiliki softskill yang\nlebih baik dari yang 1300.\n3. Mendapatkan nilai SKEM 1300 belum bisa dipakai secara efektif untuk mengukur\ncapaian softskill mahasiswa.\n4. Pengisian SKEM didominasi pada semester 2 dan semester 8 (untuk Sarjana)\nsehingga tidak terbaca bagaimana track peningkatan softskill mahasiswa.\n5. Hanya 46% mahasiswa yang mengikuti kompetisi, tergabung dalam ormawa,\nwirausaha, delegasi dll.'
 'Yth. :\n - Para Dekan\n - Para Kepala Departemen\nInstitut Teknologi Sepuluh Nopember\nKampus ITS, Surabaya\n\n\nSehubungan dengan telah terbitnya Peraturan Rektor Institut Teknologi Sepuluh Nopember\nNomor 18 Tahun 2023 tentang Peraturan Akademik Program Pendidikan Akademik, Vokasi dan\nProfesi Institut Teknologi Sepuluh Nopember Tahun 2023, bersama ini kami mohon bapak/ibu\nmencermati beberapa perubahan terkait syarat ujian tugas akhir serta yudisium mulai periode ke\n129 sebagai berikut:\nPasal 11\n1. Ayat 10, Kemampuan salah satu bahasa asing dan nilai SKEM digunakan sebagai\n    persyaratan mendaftar ujian Tugas/Proyek Akhir, Skripsi, Tesis, dan Disertasi dengan skor\n    paling sedikit sebagaimana tercantum dalam tabel.\n\n2. Ayat 13, Penentuan predikat kelulusan menggunakan Indeks Prestasi Kumulatif Predikat\n   (IPKP) yang dihitung berdasar pada semua sks Mata Kuliah yang pernah diambil dan\n   dirumuskan sebagai berikut:'
 '3. Ayat 14, Penetapan predikat kelulusan ditentukan berdasarkan Indeks Prestasi Kumulatif\n    Predikat (IPKP) dan masa studi.\n\nAtas perhatian dan kerjasama yang diberikan, kami sampaikan terima kasih.\n\n\n                                                    Wakil Rektor Bidang Akademik dan\n                                                    Kemahasiswaan,\n\n\n\n\n                                                    Prof. Dr. Ir. Adi Soeprijanto, M.T.\n                                                    NIP. 196404051990021001\n\nTembusan :\n- Kepala Bagian Administrasi Umum dan Kearsipan Digital'
 'Lampiran 10.A\nContoh Form Evaluasi Ujian Akhir Tesis (Rekapitulasi)\nDEPARTEMEN PENDIDIKAN NASIONAL\nINSTITUT TEKNOLOGI SEPULUH NOPEMBER SURABAYA\nPROGRAM PASCASARJANA\nDAFTAR NILAI UJIAN TESIS\n:.............\nJudul Tesis\nOleh Nrp.\nBidang Keahlian\nProgram Studi\n: Pascasarjana\nFakultas / Jurusan\nTanda Tangan\nI. NILAI UJIAN (kisaran antara 40 - 60%)\n\nPenguji I\nPenguji II\nPenguji II\nPenguji IV\nPenguji V\nRata-rata\nMateri (80%)\n\n\n\n\n\n\nSikap /\nPresentasi (20%)\n\n\n\n\n\n\n\n\nNilai Total\n\n\n\n\nCatatan : Pembimbing juga bertindak sebagai penguji\nII. NILAI PEMBIMBING (kisaran antara 40 - 60%)\n\nDosen Pembimbing\nNilai\n\nPembimbing I\nPembimbing I\n\n54\n\nNilai rata-rata : .............(dalam angka)\n... (dalam huruf)\nSurabaya, .......................\nMengetahui :\nKetuaProgram Studi,\n55']","Leadership, Interpersonal skill, teamwork, dan endurance.",0.9851190012529507,1.0,0.99999999995,1.0
3,"Berapa persen mahasiswa yang mengikuti kompetisi, tergabung dalam ormawa, wirausaha, delegasi, dll?",Saya tidak tahu.,"['17. Pentas Paduan Suara Gerejawi (PESPARAWI)\n18. Kompetisi Inovasi Bisnis Mahasiswa (KIBM) 2020\n19. Akselerasi Startup Mahasiswa Indonesia (ASMI)\n20. Kompetisi Mahasiswa Nasional Bidang Ilmu Bisnis, Manajemen dan Keuangan 2020\nAdapun lomba yang Non Kemdikbud adalah semua lomba (Nasional atau Internasional)\nyang diadakan sebuah institusi resmi yang bukan termasuk dalam Kemdikbud.\nContoh Perhitungan:\nSekelompok mahasiswa mendapatkan medali perak Poster PKMM yang tidak berhubungan\ndengan bidang ilmu, Maka perhitungannya :\nNilai = 5 orang (3) * Nasional (2) * Pelaksanaan (2) * > 6 bulan (3) *\ntidak berhubungan (1) * Penunjang non Kemdikbud (1) = 36 SKEM dengan nilai AB'
 'dimana pesertanya berasal dari sekurang-kurangnya diikuti oleh 3 negara.\n5. Dalam penentuan penyetaraan apresiasi yang bisa diekivalensikan dengan juara 1, 2,\ndan 3 ditentukan oleh Ditmawa.'
 'Kompetisi, Wirausaha, dan Magang\nKompetisi dinilai berdasarkan 6 elemen\nELEMEN PENILAIAN KATEGORI BOBOT\nJumlah Peserta\nIndividu 1\nBeregu (2 Anggota) 2\nBeregu (>2 Anggota) 3\nSkala\nInstitut 1\nRegional 2\nNasional 3\nInternasional 4\nLuaran\nIde 1\nPelaksanaan 2\nHasil 3\nRentang Waktu\n< 3 Bulan 1\n3-6 Bulan 2\n> 6 Bulan 3\nBidang Ilmu\nTidak Berhubungan 1\nBerhubungan 2\nLevel\nKompetisi Kemdikbud 2\nKompetisi non Kemdikbud 1\nAspek Penilaian\n(Kompetisi)\nPENILAIAN\nHURUF ANGKA\nJuara 1 / emas A 4.0\nJuara 2 / perak AB 3.5\nJuara 3 / perunggu B 3.0\nJuara Harapan / Finalis BC 2.5\nPeserta C 2.0\nAspek Penilaian\n(PKM)\nPENILAIAN\nHURUF ANGKA\nPeserta PIMNAS A 4.0\nProposal didanai AB 3.5\nUpload proposal ke\nSIM BELMAWA\nB 3.0\nPeserta Liga PKM ITS BC 2.5\nToT / Workshop PKM C 2.0'
 'Wirausaha dinilai berdasarkan 6 elemen:\nAspek Penilaian\nPENILAIAN\nHURUF ANGKA\nOmzet > 50 Juta/Tahun A 4.0\nOmzet 20-50 Juta/Tahun AB 3.5\nOmzet 5-19,9 Juta/Tahun B 3.0\nOmzet 2 – 4,9 Juta/Tahun BC 2.5\nOmzet < 2 Juta/Tahun C 2.0\nELEMEN PENILAIAN KATEGORI BOBOT\nPeran\nAnggota 1\nKetua 2\nJumlah Pelaku\nIndividu 1\nTim (Mahasiswa ITS) 2\nBadan Hukum\nNon 1\nCV / UKM 2\nPT 3\nRentang Waktu\n< 1 Tahun 1\n> 1 Tahun 2\nBidang Ilmu\nTidak Berhubungan 1\nBerhubungan 2\nNotes:\nKhusus untuk peran sebagai Direktur Utama atau owner bisa mendapatkan dua kategori\nkegiatan yakni wirausaha dan abdimas.\nContoh Perhitungan:\nMahasiswa memiliki usaha konsultan bidang Teknik dalam bentuk CV yang berdiri sejak 2016\ndan memiliki omzet 100 juta per tahun, Maka perhitungan SKEMnya:\nNilai = individu (1) * CV (2) * > 1 tahun (2) * berhubungan (2) = 8 SKEM\ndengan nilai AB']",46%,1.0000000000000007,0.8,0.8055555555287036,0.0
4,Apa itu tesis?,"Tesis adalah sebuah karya tulis ilmiah yang disusun oleh seorang mahasiswa sebagai syarat untuk memperoleh gelar akademik tertentu, seperti gelar sarjana, magister, atau doktor. Tesis biasanya berisi penelitian yang mendalam tentang suatu topik tertentu dan harus disusun sesuai dengan aturan dan panduan yang berlaku di institusi pendidikan yang bersangkutan.","['\uf0b7   UNGGAH artikel WAJIB dilakukan oleh MAHASISWA PENDAFTAR YUDISIUM 121.'
 'ーー\nLampiran 8A\nA. Contoh sampul / cover dalam tesis mono disiplin\ne20 mm\n40 mm\n35 mm\nWarna Dibagian Atas Garis Biru ITS : Putih\n0.6 dari tinggi kertas\n• 15 mm\nWarna Biru ITS\nWarna Dibawah Garis Biru ITS :\nSesuai Warna Fakultas\nTesis - No. Kode Tesis\nJudul Tesis\nTrebuchet MS (Bold), 17 puchet Ms (Bold),\n18 point\n0.4 dari tinggi kertas\n40 mm\nNAMA MAHASISWA NRP MAHASISWA\nDOSEN PEMBIMBING\nProf. Ir. Wahyu Susilo, M.Sc., Ph.D.\nDr. Ir. Indah Wahyuni, M.Sc.\nPROGRAM MAGISTER BIDANG KEAHLIAN ...\n00.......\nPROGRAM STUDI..............\nDEPARTEMEN ..\nFAKULTAS ..\nINSTITUT TEKNOLOGI SEPULUH NOPEMBER\nSURABAYA\n>20..\n--1\n130 mm\nV\n- Trebuchet MS,\n12 point\n51'
 'Lampiran 8B\nC. Contoh sampul / cover dalam tesis multi disiplin\n20 mm\n40 mm\n35 mm\nWarna Dibagian Atas Garis Biru ITS : Putih\n@ 15 mm\n0.6 dari tinggi kertas\nーーーーー\nWarna Biru ITS\nWarna Dibawah Garis Biru ITS :\nSesuai Warna Fakultas\nTesis - No. Kode Tesis\nJudul Tesis\nTrebuchet MS (Bold),\n12 point\nTrebuchet MS (Bold),\n18 point\n0.4 dari tinggi kertas\n40 mm\nNAMA MAHASISWA NRP MAHASISWA\nDOSEN PEMBIMBING\nProf. Ir. Wahyu Susilo, M.Sc., Ph.D.\nDr. Ir. Indah Wahyuni, M.Sc.\nPROGRAM MAGISTER\nBIDANG KEAHLIAN .................\nPROGRAM STUDI .....\n•..\nPROGRAM PASCASARJANA\nINSTITUT TEKNOLOGI SEPULUH NOPEMBER\nSURABAYA\n720..\n: 30 mm\nV\nTrebuchet MS,\n12 point\n52'
 'Lampiran 11.A\nContoh abstrak tesis dalam Bahasa Indonesia\nKINERJA KOMPOS PRODUKSI UDPK BRATANG\nSEBAGAI MEDIA PENUKAR ION UNTUK MEREDUKSI LOGAM BERAT Cu DALAM AIR LIMBAH BUATAN\nNama mahasiswa\nNRP\nPembimbing\nABSTRAK\nKurangnya motivasi dalam kegiatan pengomposan salah\nsatunya adalah karena rendahnya nilai jual dan sempitnya pasar untuk produksi kompos. Pemanfaatan kompos sebagai media penukar 10n dharapkan dapat meningkatkan nila jual kompos sekaligus untuk memberikan alternatif pengolahan logam berat, khususnya Cu, yang murah. Kemampuan kompos untuk menukar ion berasal dari kandungan materi humus pada kompos yang mempunyai kapasitas tukar kation (KTK). Grup fungsi yang\nberperan\nadalah grup karboksil (-COOH) sehingga\nbisa\ndikategorikan sebagai resin asam lemah. Penelitian ini bertujuan untuk mengkaji kinerja kompos produksi UDPK Bratang sebagai media penukar ion untuk mereduksi Cu dalam air limbah buatan.\nKTK teoritis diukur dengan metode titrasi pH dan']",Tesis adalah karya ilmiah yang ditulis untuk memenuhi salah satu syarat untuk menyelesaikan studi pascasarjana strata 2 (program Magister) di Institut Teknologi Sepuluh Nopember.,0.0,0.0,0.8333333332916666,0.6
5,Bagaimana penulisan nomor halaman dalam proposal tesis?,"Penulisan nomor halaman dalam proposal tesis harus dilakukan secara berurutan dan konsisten. Nomor halaman biasanya diletakkan di bagian bawah halaman tengah atau kanan pada setiap halaman proposal tesis. Hal ini bertujuan untuk memudahkan pembaca dalam menavigasi dan mengakses informasi yang terdapat dalam proposal tesis. Jumlah halaman dalam proposal tesis juga harus disesuaikan dengan aturan yang berlaku, seperti batasan maksimum atau minimum yang ditetapkan oleh lembaga pendidikan terkait.","['THE TITLE OF THE FINAL PROJECT PROPOSAL IS WRITTEN BRIEFLY,\n            CLEARLY AND DESCRIBING THE MAIN THEME\n\n\n\n                        FINAL PROJECT PROPOSAL\n                    Submitted to fulfill one of the requirements\n                    for obtaining a degree <name of degree> at\n             Undergraduate Study Program of <name of Study Program>\n                      Department of <name of Department>\n                          Faculty of <name of Faculty>\n                       Institut Teknologi Sepuluh Nopember\n\n\n\n                          By: <NAME OF STUDENT>\n                              NRP. <XXXXXXXX>\n\n\n\n                Approved by Final Project Proposal Examiner Team:\n\n\n1. Name of Advisor and academic title                      Advisor\n\n\n2. Name of Co-Advisor/Examiner and academic title          Co-Advisor\n\n\n3. Name of Examiner and academic title                     Examiner\n\n\n4. Name of Examiner and academic title                     Examiner'
 '24\n\x0cLAMPIRAN 2: Contoh Halaman Pengesahan Proposal Tugas Akhir\n\n                         LEMBAR PENGESAHAN\n\n      JUDUL PROPOSAL TUGAS AKHIR DITULIS SINGKAT JELAS DAN\n                 MENGGAMBARKAN TEMA POKOK\n\n\n                         PROPOSAL TUGAS AKHIR\n                    Diajukan untuk memenuhi salah satu syarat\n                      memperoleh gelar <Nama Gelar> pada\n                    Program Studi S-1 <Nama Program Studi>\n                        Departemen <Nama Departemen>\n                            Fakultas <Nama Fakultas>\n                       Institut Teknologi Sepuluh Nopember\n\n\n\n                        Oleh : <NAMA MAHASISWA>\n                              NRP. <XXXXXXXX>\n\n\n\n                 Disetujui oleh Tim Penguji Proposal Tugas Akhir :\n\n\n1. Nama dan gelar pembimbing                             Pembimbing\n\n\n2. Nama dan gelar ko-pembimbing/penguji                  Ko-pembimbing'
 'diketik dala m huruf-huruf besar, tepat di tengah-tengah halaman  \nsimetri kiri-kanan. Contoh halaman pengesahan pada la mpiran 2. \n \n3.5. Halaman Abstrak \n Halaman ab strak berisi : judul, nama penulis, nrp, nam a \npembimbing, ko pembimbing,  abst rak dan kata k unci. Halaman  \nabstrak ditulis dalam bahasa Inggr is dan Indonesia dalam  halaman \nyang berbeda . Jum lah kata maksim um adalah 400,  term asuk kata \nkunci. Con toh halaman abstrak pada lam piran 3. \n \n3.6. Halaman Kata Pengantar  \n Kata  Pengantar tidak lebih  dari s atu hal aman, beri si penjelasan \ntentang m aksud penulisa n laporan tu gas akhir, term asuk ucap an \nterim akasih kepada orang-orang yang pun ya kontribusi langs ung \ndalam  peny usunan TA. Tulisan ”KATA PENGANTAR” sebagai \njudul dari h alaman ini dituliska n seluruhn ya dengan huruf-h uruf \nbesar. \n \n11 3.7. Halaman Daftar Isi \n Yang dicantum kan dalam daftar isi : halam an judul, lem bar'
 'dicantum kan. Cara menyebutkan sum ber ialah  dengan \nmenuliskan nam a pengarang dan tahun publi kasi didalam  \nkurung. Untuk kutipan yang diam bil tidak secara la ngsung \ndari aslin ya maka y ang dituliskan adal ah nama penulis asli \ndan nam a penyuntin g (contoh: Faqih  dalam  Sulistijono, \n2006). Cara menuliskan daftar acu an dapat dilihat pada Sub \nbab 3.1 0. \n \n3.3. Halaman Judul \n Halaman judul ( Lampiran 1 ) sama den gan halam an kulit luar, \nberisi : tulisan ”TUGAS AKHIR”, judul Tugas Akhir; lam bang ITS, \nnama penulis dengan nomor pokok (N RP); nama ju rusan, fakultas, \n10 institut (dit ulis lengkap), dan nam a kota (Surabaya), serta tah un \npembuatan. Halaman ju dul ditu lis dalam  bahasa Inggris dan  \nIndonesia dalam  halam an yang berbe da. Kedua halam an judul \ntersebut menggunakan karakteristik  huruf y ang sama dengan bagian \nhalam an yang lain (bukan  huruf tim bul atau warna). \n Judul Tugas Akhir harus diketik seluru hnya dengan huruf-h uruf']","Penomoran halaman sebelum teks (sebelum Bab 1) menggunakan angka Romawi kecil, sedangkan bagian teks menggunakan angka Arabic.",0.999999999999999,0.0,0.8333333332916666,0.0
6,Bagaimana pelaksanaan wisuda akan dilakukan?,"Pelaksanaan wisuda akan dilakukan dengan beberapa tahapan, antara lain:
1. Pengembalian Toga dilakukan pada tanggal 22 April 2024 dengan syarat dan ketentuan yang akan diinformasikan kemudian. Biaya jaminan Toga sebesar Rp. 300.000,- akan ditransfer oleh DWP ITS lewat BNI ke Rekening wisudawan setelah DWP - ITS menerima pengembalian Toga.
2. Pengisian data online dimulai dari tanggal 27 Februari 2024 hingga 15 Maret 2024 pukul 23.00 WIB. Peserta harus mengisi form peminjaman Toga secara lengkap dengan informasi seperti Nama, NRP, Departemen, Fakultas, Strata, No. Telp/WA Wisudawan, Ukuran Toga yang dipilih, dan bukti pembayaran Toga ke Rekening DWP ITS.
3. Pembayaran dilakukan dengan transfer ke Virtual Account BNI dalam waktu 1x24 jam. Jika kadaluarsa, pesanan dapat dilakukan kembali.
4. Setelah semua proses di atas dilakukan dengan benar, mahasiswa tinggal menunggu perubahan status proposal TA-nya via MONTA. Bagi mahasiswa yang status proposalnya OK, dapat melakukan bimbingan ke dosen pembimbing.

Jadi, pelaksanaan wisuda melibatkan proses pengembalian Toga, pengisian data online, pembayaran, dan penungguan perubahan status proposal TA.","['*Sebagai syarat kelengkapan pengembalian Toga anda bisa cetak QR di\nLACAK.\n8. Pengembalian Toga tanggal 22 April 2024.\n(Syarat, Ketentuan dan Teknis Pengembalian Toga akan di informasikan kemudian).\nBiaya Jaminan Toga sebesar Rp. 300.000,- (tiga ratus ribu rupiah) akan ditransfer oleh DWP ITS lewat BNI ke Rekening wisudawan setelah DWP - ITS MENERIMA PENGEMBALIAN TOGA\n*CP BNI perihal pengembalian uang jaminan: Ibu Inna Nurdianti, 0819 3812 5893.\nII. MENGISI DATA ONLINE di : wisuda.dwpits.id\n1. Pengisian Data Online dimulai 27 Februari 2024 - 15 Maret 2024.\nPukul: 23.00 WIB.\n2. Tidak menerima pendaftaran dan peminjaman toga setelah data online ditutup.\n3. Mengisi Form Peminjaman Toga secara lengkap.\n(Nama, NRP, Departemen, Fakultas, Strata, No. Telp / WA Wisudawan,\nUkuran Toga yang dipilih dan disertai bukti Pembayaran Toga ke Rekening\nDWP ITS).'
 'Lakukan pembayaran dengan transfer ke VA BNI. Berlaku 1x24 jam. Jika kadaluarsa bisa melakukan pesanan baru.\nMemantau Pesanan\n\nStatus Pesanan:\n\nMembuat pesanan cetak\nMenunggu pembayaran\nPembayaran diterima\nProses pencetakan\nSelesai dicetak\nPengiriman ke Perpustakaan / Departemen\nSelesai\nPesanan kadaluarsa\nPesanan dibatalkan\nJika ada permasalahan teknis dapat menghubungi:\n\nWA Layanan DPTSI: 0811 3333 8 222 (07:30 – 16:00 WIB)\nPortal Servicedesk: https://servicedesk.its.ac.id'
 'B. Bagi Dosen Wali 1. Melakukan pendampingan dan pengecekan dari pengajuan perencanaan kegiatan SKEM/ program MB-KM yang diajukan oleh mahasiswa. 2. Jika dinilai sudah sesuai pengajuan perencanaan Kegiatan SKEM/ Program MB-KM oleh mahasiswa, dosen wali dapat melakukan persetujuan FRS. \nDemikian Surat Edaran ini dibuat untuk dilaksanakan dengan sebaik - baiknya. Atas perhatiannya diucapkan terimakasih.'
 '5. Setelah semua proses diatas sudah dilakukan dengan benar, maka mahasiswa tinggal menunggu\n      perubahan status proposal TA-nya via MONTA (Mendaftar \uf0e0 Tunggu Sidang Proposal \uf0e0 OK/\n      Revisi/ Ditolak). Bagi mahasiswa yang status proposalnya OK, maka bisa segera melakukan\n      bimbingan ke dosen pembimbing. Sedangkan bagi proposalnya berstatus Revisi/Ditolak, harap\n      menghadap ke koordinator TA/Ketua RMK untuk mengambil hardcopy proposal dan menanyakan\n      keterangan lebih detail tenang status proposalnya.\n\x0c\uf076 Bimbingan TA\n\n  1. Setelah proposal TA mahasiswa berstatus “OK”, maka proses bimbingan TA bisa mulai dilakukan\n     baik secara online maupun offline. Untuk bimbingan online, mahasiswa mengisi kegiatan\n     bimbingan dengan memilih menu Progres TA, kemudian memilih menu Bimbingan Baru.\n\n\n\n\n  2. Berikut merupakan halaman bimbingan baru untuk diisikan item/catatan yang dijadikan topik\n     bimbingan.']",Pelaksanaan wisuda akan dilakukan secara offline.,0.9312732082214517,0.0,0.0,0.8898487178877762
7,Apakah calon wisudawan Sarjana dan Sarjana Terapan memiliki kewajiban yang sama terkait pengisian biodata dan proses wisuda?,"Calon wisudawan Sarjana dan Sarjana Terapan memiliki kewajiban yang sama terkait pengisian biodata untuk cetak ijazah di Direktorat Pendidikan dengan Pengisian Data di SIAKAD. Mereka juga memiliki kewajiban yang sama terkait pengisian data terkait peminjaman-pengembalian toga. Jadi, mereka memiliki kewajiban yang sama terkait proses pengisian biodata dan proses wisuda.","['Sedangkan untuk lomba yang terkait dengan reward prestasi maka verifikasi dilakukan\noleh Ditmawa sebelum diberikan ke Departemen.\n7. Verifikasi portofolio dilakukan oleh Ditmawa (Kewirausahaan, Magang, Kompetisi\ndan abdimas lain), DRPM (Abdimas), DKG (Internasionalisasi), dan dosen wali (selain\nkegiatan diatas).\n8. Terkait kesesuaian dengan bidang ilmu akan diverifikasi oleh dosen wali dari\nDepartemen masing-masing.\n9. Dosen wali mempunyai kewajiban untuk memantau perkembangan IP SKEM anak wali\nagar tidak dibawah 2.1 dan apabila pada semester berjalan IP SKEM berada dibawah\n2.1, maka dosen wali wajib mengingatkan mahasiswa yang bersangkutan untuk\nmemenuhi persyaratan ini pada semester berikutnya.\n10. Skem Baru ini berlaku juga untuk mahasiswa IUP dan RPL. Khusus mahasiswa RPL\nberlaku untuk angkatan 2021 keatas dimana kredit SKEMnya minimal 25.\n11. Dalam hal kegiatan yang digunakan untuk SKEM, mahasiswa wajib memiliki kegiatan'
 '(Bagi mahasiswa Program Sarjana dan Sarjana Terapan)\n\nhttp://lpmp2ki.its.ac.id/pomits\n5        \nMelunasi IKOMA.\n\n(Bagi mahasiswa Program Sarjana dan Sarjana Terapan)\n\nDapat bertanya ke Instagram @ikomaits \n6        Mengisi data-data untuk cetak ijazah di Direktorat Pendidikan dengan Pengisian Data di SIAKAD        Baca dokumen “Pemberitahuan untuk calon Wisudawan ITS…”\n7        Mengisi data terkait peminjaman-pengembalian toga.        https://wisuda.its.ac.id/\n8        Mengajak kepada semua calon wisudawan untuk berpartisipasi menjadi donatur dana abadi/endowment fund ITS.        http://danaabadi.its.ac.id/web/\n9        Mengisi Form Kepuasan & Yudisium Departemen        Link di atas :D'
 '24\n\x0cLAMPIRAN 2: Contoh Halaman Pengesahan Proposal Tugas Akhir\n\n                         LEMBAR PENGESAHAN\n\n      JUDUL PROPOSAL TUGAS AKHIR DITULIS SINGKAT JELAS DAN\n                 MENGGAMBARKAN TEMA POKOK\n\n\n                         PROPOSAL TUGAS AKHIR\n                    Diajukan untuk memenuhi salah satu syarat\n                      memperoleh gelar <Nama Gelar> pada\n                    Program Studi S-1 <Nama Program Studi>\n                        Departemen <Nama Departemen>\n                            Fakultas <Nama Fakultas>\n                       Institut Teknologi Sepuluh Nopember\n\n\n\n                        Oleh : <NAMA MAHASISWA>\n                              NRP. <XXXXXXXX>\n\n\n\n                 Disetujui oleh Tim Penguji Proposal Tugas Akhir :\n\n\n1. Nama dan gelar pembimbing                             Pembimbing\n\n\n2. Nama dan gelar ko-pembimbing/penguji                  Ko-pembimbing'
 'Mahasiswa ID\nPembimbing\nCo-Supervisor\n: Dwa Desa Warnana\n: 3107 301 202\n: Dr. Ir. Ria A. A. Soemitro, M.Eng\n: Dr. Ir. Widya Utama, DEA.\nABSTRAK\nPenggunaan metode resistivitas dan mikrotremor dalam\ninvestigasi kestabilan lereng berkembang sangat pesat dalam beberapa tahun terakhir. Keuntungan dari kedua metode tersebut adalah memberikan informasi tentang struktur internal dari tanah dengan penyelidikan non destruktif. Berdasarkan fenomena konduksi tanah, variasi spasial dan temporal dari kandungan air dan heterogenitas bawah permukaan dapat dievaluasi dari pengukuran resistivitas. Respon tanah terhadap ground motion dan efek tapak lokal dapat dievaluasi dari pengukuran microtremor. Meskipun begitu, hanya evaluasi bawah permukaan secara kualitatif yag dapat diperoleh dari kedua metode tersebut. Penilaian kestabilan lereng secara kuantitatif akibat hujan dan kegempaan dengan penerapan dari kedua metode dalam penelitian merupakan keterbaharuan\npenting yang diberikan dalam penelitian ini.']","Ya, semua calon wisudawan Sarjana dan Sarjana Terapan wajib mengikuti ketentuan yang sama.",0.0,0.999999999975,0.0,0.9633954400208825
8,Bagaimana cara mengajukan SKPI?,"Untuk mengajukan SKPI, calon wisudawan (Sarjana dan Sarjana Terapan) wajib menghadap dosen wali untuk persetujuan SKEM, serta wajib melakukan pengajuan SKPI di studentconnect paling lambat tanggal 9 Februari 2024. Jika ada kekeliruan pengisian data pada SKPI, akan diterbitkan surat keterangan.","['6. Apabila memerlukan informasi lebih lanjut dapat menghubungi dirpendikcare@its.ac.id atau di\ncall centre pada hari dan jam kerja melalui no (WA Text Only) 085186819604, 085186819605.\nB. Bagi semua calon wisudawan (Sarjana dan Sarjana Terapan) wajib menghadap dosen wali untuk persetujuan SKEM, serta wajib melakukan pengajuan SKPI di studentconnect paling lambat tanggal 9 Februari 2024;\nC. Ijazah dicetak berdasarkan data preview yang dipermanen oleh calon wisudawan. Ijazah dicetak hanya sekali saja, bila ada kekeliruan pengisian data pada point 3 maka akan diterbitkan surat keterangan.\nD.Pelaksanaan wisuda akan dilaksanakan secara offline (Informasi mengenai gladi bersih disampaikan lebih lanjut.\n Atas perhatian dan kerjasama yang diberikan, kami sampaikan terima kasih.\n Powered by TCPDF (www.tcpdf.org)\nTembusan Yth :\n1. Rektor ITS\n2. Kepala Bagian Administrasi Umum dan Kearsipan Digital 3. Sekretaris Institut\nSurabaya, 09 Januari 2024\nWakil Rektor Bidang Akademik dan Kemahasiswaan,'
 'LAYANAN ADAPTASI KEBIASAAN BARU\n\' 6. Kebutuhan Surat Lainnya\n| - Surat Keterangan Atumni ""Surat Permohonan Statement ette\n| "" Surat Rukomendasi Dekan, Rektor Cerhkfcalon Letter\n- - Surat Keterangan Pengganti Ijazah "" Surat keterangan Berkelakuar Bar\n| "" Venficaton of Academic Records. "" Surat Keterangan Pengembalian ke intansi Asai\nKirim dan sertakan dokumen pada Email pilints.ac.id\n|\n| .\n7. Spesimen Tanda Tangan Pejabat\nIntip informasi pada tautan: weru.its.ac.id/burb. id/ spesimen-tandatangan\n|\n| .\n8. Rekrutmen Dosen dan Tendik\n| Informasi dapat diakses pada tau:an: rekrut men.its.oc.id\n|\n| 9. Layanan LHKPN\n| Layanan dapat diakses pada tautan: elhikpn. hpk.go.id\n10. Layanan LHKASN\nIn Layanan dapat diakses pada tautan: siharka.menpan.go.id\nTI. Surat Keterangan Tidak Sedang Menerima Beasiswa\nKirim permintaan pada platform MyiTS SSO di fitur MyITS Student Commect\n12. Layanan Reset Password Sister\nKirim permintaan pada tautan: servicesdesh its.oc.id\n13. Layanan Aktivasi Gate'
 'BAB I  \nTUGAS AKHIR : PENGERTIAN DAN T UJUAN \n \n \n1.1  Pen gertian \n Tiap mahasis wa yang akan m enyelesai kan studiny a dala m \nprogram  sarjana dan di ploma di wajibkan un tuk meny usun  suatu \nkarya ilm iah yang disebut  Tugas Akhir, setelah y ang bersangkut an \nmemenuhi persy aratan tertentu. T ugas Akhir dapat berupa penelitian \natau perancan gan (desain) y ang m empunyai ciri-ciri antara lain : \n \n1. Mem puny ai perum usan masa lah untuk penelitian, dan \nide untu k perancangan \n2. Judul tugas akhir dipilih sendiri oleh mahasiswa atau \nditentukan oleh dosen pembim bing \n3. Didasarkan pada pengamata n labor atorium /lapan gan \n(data primer) dan/atau analisis data sekunder \n4. Harus ada  ketertiban metodologi \n5. Di bawah bim bingan berkala dan teratur oleh dosen  \npembimbing \n6. Harus cer mat dalam  sajian (tata tulis ilmiah atau  aturan \ngambar) \n7. Dipresentasik an dala m forum  seminar \n8. Dipertahankan dalam  ujian lisan di  depan tim  dosen \npenguji \n \n1.2  T ujuan'
 'Ketentuan dan Simulasi\n1. Pedoman SKEM ini mengikat bagi mahasiswa ITS mulai angkatan tahun akademik\n2018 keatas sebagai persyaratan mengikuti yudisium.\n2. Bukti atau dokumen pendukung kegiatan SKEM harus diunggah di myITS\nStudentConnect paling lambat satu tahun terhitung semenjak selesai kegiatan. Apabila\nmelebihi batas tersebut diatas maka dinyatakan tidak berlaku.\n3. Minimal kegiatan SKEM mencakup 2 bagian dari 4 bagian dalam peraturan (kecuali\nMagang/KP dan Kewirausahaan).\n4. Pengisian portofolio kegiatan SKEM dapat dilakukan pada akhir semester sebelumnya.']",SKPI diajukan melalui studentconnect.,1.0,0.7499999999625,1.0,0.8993357645052075
9,Apa ciri-ciri Tugas Akhir?,"Tugas Akhir memiliki ciri-ciri sebagai berikut:
1. Terdiri dari bagian 'Awal' yang meliputi judul Tugas Akhir dalam bahasa Indonesia dan bahasa Inggris, halaman pengesahan, abstrak dalam bahasa Indonesia dan bahasa Inggris, kata pengantar, daftar isi, daftar gambar, grafik, diagram, daftar tabel, dan daftar simbol.
2. Terdiri dari bagian 'Inti/Pokok' atau 'Batang Tubuh' yang berisi pendahuluan, tinjauan pustaka, dan metodologi.
3. Tinjauan pustaka berisi referensi yang terbaru, relevan, dan asli yang menguraikan teori, temuan, dan bahan penelitian lain yang digunakan dalam menyusun kerangka pemikiran atau konsep penelitian.
4. Metodologi berisi bahan-bahan, peralatan, cara kerja, teknik/proses pengerjaan, dan lokasi pelaksanaan Tugas Akhir.
5. Tugas Akhir juga dapat mencakup jadwal kegiatan penelitian dan evaluasi ujian akhir seperti nilai penguji dan pembimbing.

Jadi, ciri-ciri Tugas Akhir meliputi struktur yang terdiri dari bagian awal, inti/pokok, tinjauan pustaka, metodologi, jadwal kegiatan, dan evaluasi ujian akhir.","['6 BAB III  \nLAPORAN TUGAS AKHIR \n \n3.1. Sistem atika \n Siste matika l aporan Tugas Akhir terdiri atas  tiga ba gian besar, \nyaitu : \n \n1. Bagian ’Awal’ terdiri dari: \na. Judul Tu gas Akhir dala m bahasa In donesia dan  bahasa \nInggris pada kulit m uka dan kulit  dalam  (Lampiran 1 ) \nb. Hala man pengesahan ( Lampiran 2 ) \nc. Abstrak atau  uraian singkat dalam  bahasa Indonesia dan  \nbahasa Inggris ( Lampiran 3 ) \nd. Kata pengantar \ne. Daftar isi \nf. Daftar gam bar, grafik, diag ram \ng. Daftar tabel \nh. Daftar si mbol \n \n2. Bagian ‘Inti/Pokok’ atau ‘Batang Tubuh’ berisi :  \n a. Pendahuluan  \n• Latar belakan g masalah \n• Rumusan Per masalahan  \n• Batasan m asalah/ruang lingkup \n• Tujuan  \n• Manfaat (bila diperlukan untuk ditulis) \nb. Tinjauan Pustaka \n• Hasil peneliti an terdahulu yang relevan \n• Teori yang akan digunakan untuk meny elesaikan  \npermasalahan   \nc. Metodolog i  \n• Metode y ang digunakan \n• Bahan dan perala tan y ang digunakan \n• Urutan pelaksanaan percobaan'
 'Oleh : <NAMA MAHASISWA>\n                             NRP. <XXXXXXXX>\n\n\n\n                    Disetujui oleh Tim Penguji Tugas Akhir :\n\n\n1. Nama dan gelar pembimbing                            Pembimbing\n\n\n2. Nama dan gelar ko-pembimbing/penguji                 Ko-pembimbing\n\n\n3. Nama dan gelar penguji                               Penguji\n\n\n4. Nama dan gelar penguji                               Penguji\n\n\n5. Nama dan gelar penguji                               Penguji\n\n\n                                 SURABAYA\n                                 Bulan, Tahun\n\n\n\n                                                                        33\n\x0c                              APPROVAL SHEET\n\n\n\nTHE TITLE OF THE FINAL PROJECT IS WRITTEN BRIEFLY, CLEARLY AND\n                  DESCRIBING THE MAIN THEME'
 'Tinjauan pus taka berisi referensi yang terbaru, relevan, dan asli.  \nTinjauan pu staka menguraikan teori, tem uan, dan bahan  \npenelitian lain yang di arahkan unt uk m enyusun kerangka  \npemikiran atau konsep yang akan digunakan dalam  penelitian.  \n \ne.  Metodolog i  \nMetodolog i berisi bahan-bahan, peralatan, dan cara kerja serta \nteknik/proses pengerjaan. Yang dim aksud dengan ba han adalah : \nmateri al, data, dan hasil penelitia n lain. Yang dimaksud peralatan \n: alat-al at uji laboratorium dan lapan gan, perangk at keras dan \n5 lunak, teori  dan persamaan, serta variabel. Yang dimaksud \ndengan proses : teknik pengum pulan  dan analisis data, model \npendekatan yang digunakan, rancangan pene litian, cara penafsiran  \ndan pengum pulan hasil penelitian, u jicoba dan cara evaluasi, serta \ncara peny impulan. Pada bab ini perlu  dijelaskan tem pat/lokasi \npelaksanaan TA. \n \nf.  Jadwal kegiat an \nJadwal kegiatan berisi rincian setiap kegiatan penelitian y ang'
 'Lampiran 10.A\nContoh Form Evaluasi Ujian Akhir Tesis (Rekapitulasi)\nDEPARTEMEN PENDIDIKAN NASIONAL\nINSTITUT TEKNOLOGI SEPULUH NOPEMBER SURABAYA\nPROGRAM PASCASARJANA\nDAFTAR NILAI UJIAN TESIS\n:.............\nJudul Tesis\nOleh Nrp.\nBidang Keahlian\nProgram Studi\n: Pascasarjana\nFakultas / Jurusan\nTanda Tangan\nI. NILAI UJIAN (kisaran antara 40 - 60%)\n\nPenguji I\nPenguji II\nPenguji II\nPenguji IV\nPenguji V\nRata-rata\nMateri (80%)\n\n\n\n\n\n\nSikap /\nPresentasi (20%)\n\n\n\n\n\n\n\n\nNilai Total\n\n\n\n\nCatatan : Pembimbing juga bertindak sebagai penguji\nII. NILAI PEMBIMBING (kisaran antara 40 - 60%)\n\nDosen Pembimbing\nNilai\n\nPembimbing I\nPembimbing I\n\n54\n\nNilai rata-rata : .............(dalam angka)\n... (dalam huruf)\nSurabaya, .......................\nMengetahui :\nKetuaProgram Studi,\n55']","Perumusan masalah atau ide, judul dipilih sendiri atau oleh dosen pembimbing, berdasarkan pengamatan laboratorium/lapangan, ketertiban metodologi, bimbingan berkala, cermat dalam sajian, dipresentasikan dalam forum seminar, dipertahankan dalam ujian lisan",1.0,0.9999999999,1.0,1.0000000000000004
10,Apa bentuk Tugas Akhir?,"Tugas Akhir memiliki tiga bagian besar, yaitu:
1. Bagian 'Awal' yang terdiri dari:
   a. Judul Tugas Akhir dalam bahasa Indonesia dan bahasa Inggris pada kulit muka dan kulit dalam
   b. Halaman pengesahan
   c. Abstrak atau uraian singkat dalam bahasa Indonesia dan bahasa Inggris
   d. Kata pengantar
   e. Daftar isi
   f. Daftar gambar, grafik, diagram
   g. Daftar tabel
   h. Daftar simbol

2. Bagian 'Inti/Pokok' atau 'Batang Tubuh' yang berisi:
   a. Pendahuluan
      - Latar belakang masalah
      - Rumusan Permasalahan
      - Batasan masalah/ruang lingkup
      - Tujuan
      - Manfaat (bila diperlukan untuk ditulis)
   b. Tinjauan Pustaka
      - Hasil penelitian terdahulu yang relevan
      - Teori yang akan digunakan untuk menyelesaikan permasalahan
   c. Metodologi
      - Metode yang digunakan
      - Bahan dan peralatan yang digunakan
      - Urutan pelaksanaan percobaan

Jadi, bentuk Tugas Akhir terdiri dari bagian 'Awal' dan bagian 'Inti/Pokok'.","['6 BAB III  \nLAPORAN TUGAS AKHIR \n \n3.1. Sistem atika \n Siste matika l aporan Tugas Akhir terdiri atas  tiga ba gian besar, \nyaitu : \n \n1. Bagian ’Awal’ terdiri dari: \na. Judul Tu gas Akhir dala m bahasa In donesia dan  bahasa \nInggris pada kulit m uka dan kulit  dalam  (Lampiran 1 ) \nb. Hala man pengesahan ( Lampiran 2 ) \nc. Abstrak atau  uraian singkat dalam  bahasa Indonesia dan  \nbahasa Inggris ( Lampiran 3 ) \nd. Kata pengantar \ne. Daftar isi \nf. Daftar gam bar, grafik, diag ram \ng. Daftar tabel \nh. Daftar si mbol \n \n2. Bagian ‘Inti/Pokok’ atau ‘Batang Tubuh’ berisi :  \n a. Pendahuluan  \n• Latar belakan g masalah \n• Rumusan Per masalahan  \n• Batasan m asalah/ruang lingkup \n• Tujuan  \n• Manfaat (bila diperlukan untuk ditulis) \nb. Tinjauan Pustaka \n• Hasil peneliti an terdahulu yang relevan \n• Teori yang akan digunakan untuk meny elesaikan  \npermasalahan   \nc. Metodolog i  \n• Metode y ang digunakan \n• Bahan dan perala tan y ang digunakan \n• Urutan pelaksanaan percobaan'
 'THE TITLE OF THE FINAL PROJECT IS WRITTEN BRIEFLY, CLEARLY AND\n                  DESCRIBING THE MAIN THEME\n\n\n\n                               FINAL PROJECT\n                    Submitted to fulfill one of the requirements\n                    for obtaining a degree <name of degree> at\n             Undergraduate Study Program of <name of Study Program>\n                      Department of <name of Department>\n                          Faculty of <name of Faculty>\n                       Institut Teknologi Sepuluh Nopember\n\n\n\n                          By: <NAME OF STUDENT>\n                              NRP. <XXXXXXXX>\n\n\n\n                    Approved by Final Project Examiner Team:\n\n\n1. Name of Advisor and academic title                      Advisor\n\n\n2. Name of Co-Advisor/Examiner and academic title          Co-Advisor\n\n\n3. Name of Examiner and academic title                     Examiner\n\n\n4. Name of Examiner and academic title                     Examiner'
 'Oleh : <NAMA MAHASISWA>\n                             NRP. <XXXXXXXX>\n\n\n\n                    Disetujui oleh Tim Penguji Tugas Akhir :\n\n\n1. Nama dan gelar pembimbing                            Pembimbing\n\n\n2. Nama dan gelar ko-pembimbing/penguji                 Ko-pembimbing\n\n\n3. Nama dan gelar penguji                               Penguji\n\n\n4. Nama dan gelar penguji                               Penguji\n\n\n5. Nama dan gelar penguji                               Penguji\n\n\n                                 SURABAYA\n                                 Bulan, Tahun\n\n\n\n                                                                        33\n\x0c                              APPROVAL SHEET\n\n\n\nTHE TITLE OF THE FINAL PROJECT IS WRITTEN BRIEFLY, CLEARLY AND\n                  DESCRIBING THE MAIN THEME'
 '1. Nama dan gelar pembimbing                             Pembimbing\n\n\n2. Nama dan gelar ko-pembimbing/penguji                  Ko-pembimbing\n\n\n3. Nama dan gelar penguji                                Penguji\n\n\n4. Nama dan gelar penguji                                Penguji\n\n\n5. Nama dan gelar penguji                                Penguji\n\n\n\n                                  SURABAYA\n                                  Bulan, Tahun\n\n                                                                         25\n\x0c                              APPROVAL SHEET\n\n\n\n  THE TITLE OF THE FINAL PROJECT PROPOSAL IS WRITTEN BRIEFLY,\n            CLEARLY AND DESCRIBING THE MAIN THEME']",Penelitian atau perancangan yang terdiri dari proposal tugas akhir dan laporan tugas akhir,0.0,0.99999999995,1.0,0.9271879107375568
11,Apa isi bagian ‘Awal’ laporan tugas akhir?,"Isi bagian 'Awal' laporan tugas akhir meliputi:
a. Judul Tugas Akhir dalam bahasa Indonesia dan bahasa Inggris pada kulit muka dan kulit dalam
b. Halaman pengesahan
c. Abstrak atau uraian singkat dalam bahasa Indonesia dan bahasa Inggris
d. Kata pengantar
e. Daftar isi
f. Daftar gambar, grafik, diagram
g. Daftar tabel
h. Daftar simbol","['cara peny impulan. Pada bab ini perlu  dijelaskan tem pat/lokasi \npelaksanaan TA. \n \nf.  Jadwal kegiat an \nJadwal kegiatan berisi rincian setiap kegiatan penelitian y ang \ndirupakan dal am satuan minggu . \n \n g. Daftar acu an \n Daftar acuan berisi sem ua referensi y ang diacu dalam  proposal. \n \n2.2. F ormat Proposal \n Pengetikan p roposal tugas  akhir m engikuti ketentua n sebagai \nberikut : \n• Jenis dan uku ran kertas : \nKertas HVS ukuran A4 (2 10 mm  x 297 mm) \n• Jarak spasi : 1 (satu) \n• Jarak tepi ( margin) : \n- Tepi atas : 3.0 cm  \n- Tepi bawah : 2.5 cm  \n- Tepi kiri  : 3.0 cm  \n- Tepi kanan : 2.0 cm  \n• Jenis huruf : \n- Times New Roman, Norma l, ukuran 12 (khusus u ntuk judul \ndapat dipakai  ukuran 14). \n- Kata y ang be rasal dari bahasa a sing yang tidak \nditerjem ahkan ditulis m iring ( italic ) \n \n \n \n6 BAB III  \nLAPORAN TUGAS AKHIR \n \n3.1. Sistem atika \n Siste matika l aporan Tugas Akhir terdiri atas  tiga ba gian besar, \nyaitu : \n \n1. Bagian ’Awal’ terdiri dari:'
 'Lampiran 10.C\nContoh Berita Acara Ujian Akhir Tesis\nDEPARTEMEN PENDIDIKAN NASIONAL\nINSTITUT TEKNOLOGI SEPULUH NOPEMBER SURABAYA\nPROGRAM PASCASARJANA\nBERITA ACARA\nUJIAN TESIS\nPada\nHari, Tanggal Jam\nTempat\ntelah dilaksanakan Ujian Tesis\nJudul\nOleh Nrp.\nProgram Studi\nBidang Keahlian\n:.....\n:...\ndengan hasil\n1. disetujui\n2. disetujui dengan perbaikan / penyempurnaan\n3. tidak disetujui atau mengulang\nPerbaikan / penyempurnaan yang harus dilakukan adalah : (kalau diperlukan dapat ditulis di lembar terpisah)\nPenguji :\nKetua Sidang\n1..\n2.\nMengetahui,\nKetua Program Studi,\n3.\n4......\n5. Dst\n57\n\nCatatan : dibuat rangkap 4\n1. Direktur PPs - ITS\n2. Ketua Program Studi\n3. Dosen (-dosen) Pembimbing\n4. Mahasiswa yang bersangkutan'
 '14\n\x0c3.11 Daftar Acuan atau Daftar Pustaka\n    Penulisan daftar pustaka yang diletakkan di bagian akhir isi laporan TA/PA, dilakukan\ndengan menggunakan standar APA (Association Pshychology America) edisi ke 7. Standar\npenulisan ini digunakan untuk seluruh bidang ilmu, yaitu: sains, teknik, komputing, desain, seni\ndan yang lain (Southern Institute of Technology, 2020). Pengelompokan pustaka di dalam APA\nversi 7.0 ini lebih ringkas, dibandingkan dalam APA versi 6.0.\n    Secara umum penulisan daftar pustaka dalam standar APA, versi 7.0 adalah sebagai\nberikut:\n  1.  Daftar pustaka dimulai pada halaman terpisah dari halaman isi dalam laporan TA/PA.\n  2.  Daftar pustaka akan muncul dalam urutan abjad dengan nama belakang penulis pertama.\n  3.  Hasil cetak dengan standar APA menggunakan indentasi gantung. Baris ke dua dalam\n      daftar pustaka, menjorok ke dalam di bawah garis ke satu.\n  4. Penulisan kapitalisasi judul hanya di awal kalimat, yang berbeda dengan penulisan judul'
 '6 BAB III  \nLAPORAN TUGAS AKHIR \n \n3.1. Sistem atika \n Siste matika l aporan Tugas Akhir terdiri atas  tiga ba gian besar, \nyaitu : \n \n1. Bagian ’Awal’ terdiri dari: \na. Judul Tu gas Akhir dala m bahasa In donesia dan  bahasa \nInggris pada kulit m uka dan kulit  dalam  (Lampiran 1 ) \nb. Hala man pengesahan ( Lampiran 2 ) \nc. Abstrak atau  uraian singkat dalam  bahasa Indonesia dan  \nbahasa Inggris ( Lampiran 3 ) \nd. Kata pengantar \ne. Daftar isi \nf. Daftar gam bar, grafik, diag ram \ng. Daftar tabel \nh. Daftar si mbol \n \n2. Bagian ‘Inti/Pokok’ atau ‘Batang Tubuh’ berisi :  \n a. Pendahuluan  \n• Latar belakan g masalah \n• Rumusan Per masalahan  \n• Batasan m asalah/ruang lingkup \n• Tujuan  \n• Manfaat (bila diperlukan untuk ditulis) \nb. Tinjauan Pustaka \n• Hasil peneliti an terdahulu yang relevan \n• Teori yang akan digunakan untuk meny elesaikan  \npermasalahan   \nc. Metodolog i  \n• Metode y ang digunakan \n• Bahan dan perala tan y ang digunakan \n• Urutan pelaksanaan percobaan']","Judul Tugas Akhir, Halaman pengesahan, Abstrak, Kata pengantar, Daftar isi, Daftar gambar, grafik, diagram, Daftar tabel, Daftar simbol",0.0,0.999999999975,,0.9546811073776088
12,Apa yang harus ada dalam halaman abstrak laporan tugas akhir?,"Dalam halaman abstrak laporan tugas akhir, biasanya harus mencakup ringkasan singkat dari tujuan penelitian, metode yang digunakan, hasil yang diperoleh, dan kesimpulan yang diambil dari penelitian tersebut. Abstrak juga harus mencakup gambaran umum tentang topik penelitian dan relevansinya dalam bidang studi yang bersangkutan.","['THE TITLE OF THE FINAL PROJECT IS WRITTEN BRIEFLY, CLEARLY AND\n                  DESCRIBING THE MAIN THEME\n\n\n\n                               FINAL PROJECT\n                    Submitted to fulfill one of the requirements\n                    for obtaining a degree <name of degree> at\n             Undergraduate Study Program of <name of Study Program>\n                      Department of <name of Department>\n                          Faculty of <name of Faculty>\n                       Institut Teknologi Sepuluh Nopember\n\n\n\n                          By: <NAME OF STUDENT>\n                              NRP. <XXXXXXXX>\n\n\n\n                    Approved by Final Project Examiner Team:\n\n\n1. Name of Advisor and academic title                      Advisor\n\n\n2. Name of Co-Advisor/Examiner and academic title          Co-Advisor\n\n\n3. Name of Examiner and academic title                     Examiner\n\n\n4. Name of Examiner and academic title                     Examiner'
 'Oleh : <NAMA MAHASISWA>\n                             NRP. <XXXXXXXX>\n\n\n\n                    Disetujui oleh Tim Penguji Tugas Akhir :\n\n\n1. Nama dan gelar pembimbing                            Pembimbing\n\n\n2. Nama dan gelar ko-pembimbing/penguji                 Ko-pembimbing\n\n\n3. Nama dan gelar penguji                               Penguji\n\n\n4. Nama dan gelar penguji                               Penguji\n\n\n5. Nama dan gelar penguji                               Penguji\n\n\n                                 SURABAYA\n                                 Bulan, Tahun\n\n\n\n                                                                        33\n\x0c                              APPROVAL SHEET\n\n\n\nTHE TITLE OF THE FINAL PROJECT IS WRITTEN BRIEFLY, CLEARLY AND\n                  DESCRIBING THE MAIN THEME'
 '1. Nama dan gelar pembimbing                             Pembimbing\n\n\n2. Nama dan gelar ko-pembimbing/penguji                  Ko-pembimbing\n\n\n3. Nama dan gelar penguji                                Penguji\n\n\n4. Nama dan gelar penguji                                Penguji\n\n\n5. Nama dan gelar penguji                                Penguji\n\n\n\n                                  SURABAYA\n                                  Bulan, Tahun\n\n                                                                         25\n\x0c                              APPROVAL SHEET\n\n\n\n  THE TITLE OF THE FINAL PROJECT PROPOSAL IS WRITTEN BRIEFLY,\n            CLEARLY AND DESCRIBING THE MAIN THEME'
 'cara peny impulan. Pada bab ini perlu  dijelaskan tem pat/lokasi \npelaksanaan TA. \n \nf.  Jadwal kegiat an \nJadwal kegiatan berisi rincian setiap kegiatan penelitian y ang \ndirupakan dal am satuan minggu . \n \n g. Daftar acu an \n Daftar acuan berisi sem ua referensi y ang diacu dalam  proposal. \n \n2.2. F ormat Proposal \n Pengetikan p roposal tugas  akhir m engikuti ketentua n sebagai \nberikut : \n• Jenis dan uku ran kertas : \nKertas HVS ukuran A4 (2 10 mm  x 297 mm) \n• Jarak spasi : 1 (satu) \n• Jarak tepi ( margin) : \n- Tepi atas : 3.0 cm  \n- Tepi bawah : 2.5 cm  \n- Tepi kiri  : 3.0 cm  \n- Tepi kanan : 2.0 cm  \n• Jenis huruf : \n- Times New Roman, Norma l, ukuran 12 (khusus u ntuk judul \ndapat dipakai  ukuran 14). \n- Kata y ang be rasal dari bahasa a sing yang tidak \nditerjem ahkan ditulis m iring ( italic ) \n \n \n \n6 BAB III  \nLAPORAN TUGAS AKHIR \n \n3.1. Sistem atika \n Siste matika l aporan Tugas Akhir terdiri atas  tiga ba gian besar, \nyaitu : \n \n1. Bagian ’Awal’ terdiri dari:']","Judul, nama penulis, NRP, nama pembimbing, abstrak, kata kunci, ditulis dalam bahasa Inggris dan Indonesia",1.0,0.9999999999666667,0.8333333333333334,0.9870677690856908
13,Bagaimana cara login ke MONTA?,"Untuk login ke MONTA, mahasiswa perlu melakukan langkah-langkah berikut:
1. Buka website MONTA di monta.if.its.ac.id
2. Gunakan default username dan password, yang biasanya adalah NRP.
3. Setelah login berhasil, mahasiswa akan masuk ke halaman mahasiswa.","['SOP (Guidelines) Mahasiswa\n\n\nBerikut merupakan guidelines penggunaan MONTA untuk mahasiswa:\n\n\n\uf076 Login ke MONTA (monta.if.its.ac.id)\n   1. Melakukan login terlebih dahulu (default username dan password adalah NRP).\n\n\n\n\n   2. Setelah login, maka akan masuk ke halaman mahasiswa.'
 'KEMENTERIAN PENDIDIKAN, KEBUDAYAAN, RISET, DAN TEKNOLOGI INSTITUT TEKNOLOGI SEPULUH NOPEMBER\nKampus ITS Sukolilo Surabaya 60111\nTelepon: 031-5994251-54, 5947274, 5945472 (Hunting)\nFax: 031-5947264, 5950806\nhttp://www.its.ac.id\n4. Calon wisudawan diwajibkan login ke Aplikasi Wisuda (https://wisuda.dwpits.id)\nmenggunakan akun alumni yang didapatkan dari pendaftaran di myITS Alumni\n(https://alumni.its.ac.id).\nD. KEGIATAN LAIN :\n1. Pengambilan Gordon, Toga dan Pemesanan Foto Prosesi serta Undangan di gedung\nDharma Wanita Persatuan ITS sesuai dengan jadwal sebagai berikut:\n- Magister dan Doktor:\nMenyerahkan bukti slip pembayaran wisuda dan slip sewa toga dari bank.\n- Sarjana dan Sarjana Terapan:\nMenunjukkan identitas diri dan menyerahkan bukti pembayaran/slip sewa toga dari bank.\n- Pemesanan Foto Prosesi (tidak wajib)\n- Undangan Wisuda untuk orang tua:\nUndangan untuk orang tua/pendamping wisudawan diambil bersamaan dengan\npengambilan toga'
 '6. Apabila memerlukan informasi lebih lanjut dapat menghubungi dirpendikcare@its.ac.id atau di\ncall centre pada hari dan jam kerja melalui no (WA Text Only) 085186819604, 085186819605.\nB. Bagi semua calon wisudawan (Sarjana dan Sarjana Terapan) wajib menghadap dosen wali untuk persetujuan SKEM, serta wajib melakukan pengajuan SKPI di studentconnect paling lambat tanggal 9 Februari 2024;\nC. Ijazah dicetak berdasarkan data preview yang dipermanen oleh calon wisudawan. Ijazah dicetak hanya sekali saja, bila ada kekeliruan pengisian data pada point 3 maka akan diterbitkan surat keterangan.\nD.Pelaksanaan wisuda akan dilaksanakan secara offline (Informasi mengenai gladi bersih disampaikan lebih lanjut.\n Atas perhatian dan kerjasama yang diberikan, kami sampaikan terima kasih.\n Powered by TCPDF (www.tcpdf.org)\nTembusan Yth :\n1. Rektor ITS\n2. Kepala Bagian Administrasi Umum dan Kearsipan Digital 3. Sekretaris Institut\nSurabaya, 09 Januari 2024\nWakil Rektor Bidang Akademik dan Kemahasiswaan,'
 'Kirim permintaan pada platform MyiTS SSO di fitur: MyITS Student Connect\n12. Layanan Reset Password Sister\nKirim permintaan pada tautan: Servicesdesk.its.ac.id\n13. Layanan Aktivasi Gate\nLuring secara realtime di PLT, Gedung KPA, Plaza dr. Angka, Lantai 1\n14. Layanan Lost and Found\nLapor pada tautan: its.Id/lost\n15. Layanan Id Card Pegawai\nKirim ajuan pada tautan: its.id/idCard\nCatatan: Layanan dilakukan secara daring maupun luring di jam kerja\nSENIN - KAMIS JUMAT\nJam Kerja : 08.00 - 16.00 WIB Jam Kerja : 08.00 - 15.00 WIB\nJam Istirahat : 12.00 - 13.00 WIB Jam Istirahat : 12.00 - 13.00 WIB']",Melakukan login dengan default username dan password adalah NRP ke monta.if.its.ac.id,1.0,0.9166666666361111,1.0,0.9336975908970565
14,Apa yang dilakukan setelah topik dan draft proposal TA sudah disetujui?,"Setelah topik dan draft proposal TA sudah disetujui, langkah selanjutnya yang perlu dilakukan adalah:
1. Menyelesaikan revisi (jika ada).
2. Mendapatkan persetujuan dari penguji terkait revisi yang diberikan. Persetujuan bisa dilakukan dengan menggunakan form revisi atau melalui email.
3. Mengkompilasi buku versi terakhir dari proposal TA.
4. Memenuhi persyaratan yudisium.
5. Mengisi data wisudawan.

Setelah semua langkah tersebut selesai, mahasiswa dapat melanjutkan proses selanjutnya terkait tugas akhirnya.","['telah menyelesaikan revisi\nsidang proposal tesis dan\nmenginfokan ke Kaprodi\nMeng-update status sidang\nproposal tesis di MonT esMeng-upload lembar revisi sidang\nproposal tesis dan buku proposal\ntesis yang dilengkapi dengan\nlembar pengesahan yang sudah\ntertandatanganiLembar revisi dan\nlembar pengesahan yang\ntelah tertandatanganiData peserta sidang\nproposal tesis\nLembar revisi sidang\nproposal tesis  Usulan jadwal dan\npenguji sidang\nproposal tesis  \nLembar revisi dan\nlembar pengesahanSIDANG PROPOSAL TESIS (IF -185301) PROGRAM STUDI S2 TEKNIK \nINFORMATIKA, DEPARTEMEN TEKNIK INFORMATIKA, FT -EIC ITS  \n(SISTEM ONLINE ) \n \n1. Dalam satu semester, terdapat dua kali siding proposal tesis, yaitu minggu ke -5 – minggu \nke-6 dan minggu ke -17 – minggu  ke-18. \n2. Admin Akademik Pascasarjana  menginfokan jadwal, persyaratan, dan link Google Form \npendaftaran sidang proposal tesis melalui MonTes dan grup whatsapp.  \n3. Mahasiswa yang ingin mendaftar sidang proposal tesis, harus melengkapi berkas'
 'hasil revisiDokumen hasil\nrevisi sidang\nproposal tesis  \nApakah revisi\nsudah sesuai?Dokumen hasil\nrevisi sidang\nproposal tesis  Ketua RMK menentukan penguji\ndan menjadwalkan sidang\nproposal tesis setiap pesertaSOP PENDAFT ARAN SIDANG PROPOSAL TESIS PROGRAM STUDI S2 TEKNIK INFORMA TIKA (SISTEM ONLINE ), FT -EIC, ITS  \nYaDraft proposal tesis\ndan form persetujuan\npembimbing\nPemeriksa,\n \n \n \n \n \nLina Ambarwati, S.Kom.  \nNIP. 198003242014092001  Mengetahui,\nDr. Ahmad Saikhu, S.Si., M.T . \nNIP. 197107182006041001Pembuat,\n \n \n \n \n \nKartika Dwi Y uniavita Rahmawati, S.T .\nNPP. 1998202122056  \nJadwal sidang, link\nmeeting, dan VB\nTidak\nMenginfokan link google form\nuntuk meng-upload  seluruh\ndokumen hasil revisi sidang\nproposal tesis ke mahasiswa\nStatus sidang\nproposal tesis\nmenjadi ""Disetujui""Merekap data mahasiswa yang\ntelah menyelesaikan revisi\nsidang proposal tesis dan\nmenginfokan ke Kaprodi\nMeng-update status sidang\nproposal tesis di MonT esMeng-upload lembar revisi sidang'
 'pengerjaan revi si adalah 2 minggu setelah sidang proposal tesis berlangsung.  \n13. Apabila revisi yang dikerjakan mahasiswa dirasa sudah tepat, dosen pembimbing dan \npenguji dapat memberikan persetujuan yang dibuktikan dengan menandatangi form revisi  \ndan lembar pengesahan buku proposal tesis . 14. Admin Akademik Pascasarjana  menginfokan link untuk upload hasil revisi sidang \nproposal tesis ke mahasiswa melalui grup Whatsapp.  \n15. Mahasiswa meng -upload file hasil revisi sidang proposal tesis dan lembar revisi sidang \nproposal tesis ke link https://bit.ly/HasilRevisiProposalTesisDTIf . \n16. Apabila mahasiswa sudah mengumpulkan softfile buku proposal tesis, Admin Akademik \nPascasarjana  mengubah status sidang proposal tesis di MonTes  dari ‘Revisi’  menjad i \n‘Disetujui’.  \n17. Mahasiswa dapat mengecek nilai sidang proposal tesis di SIAKAD ITS mata kuliah IF \n185301 Tesis -Proposal.  \n \n \nNotes: Link google form akan di -update setiap tahun ajaran'
 'Jika TA expired atau jika pembimbing dan atau RMK ganti, maka mesti mengajukan proposal TA ulang dan mengambil Pra-TA lagi.\n\nQ : Setelah sidang, apa yang perlu dilakukan?\n\nA : 1. menyelesaikan revisi (jika ada)\n2. mendapatkan persetujuan dari penguji thdp revisi yang diberikan. Persetujuan bisa dengan menggunakan form revisi/email. Form ada di Pak Yudi Mulyono. Form ini disimpan mahasiswa, tidak wajib untuk dikirim ke dosenpenguji/pembimbing/sekdep 1\n3. mengkompilasi buku versi terakhir\n4. memenuhi persyaratan yudisium\n5. mengisi data wisudawan\n\nQ : Bagaimana follow Up setelah sidang TA?\n\nA : 1. mahasiswa mengerjakan revisi (jika ada)\n2. mahasiswa mengumpulkan persetujuan revisi dari penguji (menggunakan ttd digital atau email)\n3. mahasiswa memenuhi persyaratan-persyaratan yudisium.\n \n\nQ : Berapa lama waktu revisi TA setelah sidang?']",Melakukan pendaftaran proposal TA ke sistem MONTA dan mengunggah file draft proposal yang sudah disepakati pembimbing,1.0,0.9999999999666667,0.14285714285714285,0.853950986740084
15,Dimana mahasiswa dapat mencetak cover proposal TA?,Mahasiswa dapat mencetak cover proposal TA dengan memilih menu Cetak Cover -&gt; Cetak Cover Proposal TA pada sistem MONTA.,"['Berkas yang diperlukan untuk Yudisium S1 di Departemen Teknik Informatika DesclaimerBerkas yang diperlukan untuk Yudisium S1 di Departemen Teknik Informatika\nSOFTCOPY yang perlu dikumpulkan beserta penamaannya :\n\nPoster TA (NRP-nama-Video_TA contoh: 5102100006-Radityo-Anggoro-Video_TA)\nArtikel POMITS dalam format .doc atau .pdf (NRP-nama-POMITS contoh: 5102100006-Radityo-Anggoro-POMITS)\nVideo TA (NRP-nama-Poster_TA contoh: 5102100006-Radityo-Anggoro-Poster_TA)\nBuku TA (NRP-nama-Buku_TA contoh: 5102100006-Radityo-Anggoro-Buku_TA)\nPresentasi TA (NRP-nama-Slide_TA contoh: 5102100006-Radityo-Anggoro-Slide_TA)\n===============================\n= Ketentuan Video Tugas Akhir =\n==============================='
 'Judul\nData pelaksana (NRP & Nama mahasiswa serta NIP dan Nama Pembimbing)\nLogo ITS\nLatar belakang/introduksi\nMetode\nHasil (teks dan gambar/fotografi/skema)\nSimpulan dan Saran\nLogo perangkat lunak yang digunakan / Institusi mitra (jika ada)\n16.Gambar produk jika ada akan sangat mendukung impresi pelaksanaan kegiatan secara visual.\n17.Resolusi yang disarankan untuk kualitas cetakan adalah minimal 300 dpi dari sumber gambar aslinya.\n\nDesclaimer\n\nMahasiswa wajib mengisi Form Kepuasan Layanan & Pengumpulan Berkas Yudisium secara lengkap sebelum deadline pengumpulan berakhir.\n\nDeadline pengunggahan kelengkapan yudisium S1 di Departemen Teknik Informatika 10 Februari 2024\n\nLink Terkait\n\ue31d\nIsi Form Kepuasan Mahasiswa\n\uf548\nIsi Form Pengumpulan Berkas Yudisium\n\ueed6\nCek berkas-berkas yudisium\nWhat to do?*\n\n*Jika ada informasi yang kurang mohon informasikan kepada kami :))\n\n1        \nMengecek nilai TOEFL di UPT Bahasa.\n\nJika belum terpenuhi, segera melakukan perbaikan nilai!'
 'www.its.ac.id INSTITUT TEKNOLOGI SEPULUH NOPEMBER, Surabaya - Indonesia\n\nPemesanan Cetak Buku TA di myITS Printing\n\nSubdit. Aplikasi dan Platform Digital\nDirektorat Pengembangan Teknologi dan Sistem Informasi\n30 Juli 2020\n\nTata Cara Pemesanan\n\nMengunggah file buku TA yang sudah ditandatangani pembimbing ke repository.its.ac.id dan mencatat Eprint ID.\nMenunggu validasi buku TA 1x24 jam (hari kerja).\nMembuka my.its.ac.id dan memilih aplikasi myITS Printing.\nMemilih layanan Cetak Buku TA.\nMemasukkan Eprint ID.\nMemasukkan ukuran buku, opsi warna, opsi jilid sampul, dan jumlah buku.\nMelihat harga total dan melakukan pembayaran dengan cara transfer ke Virtual Account BNI.\nSelesai (mahasiswa dapat memantau status pencetakan di menu Daftar Pesanan Saya).\nMelihat Eprint ID terpublikasi\n\nMembuka laman repository.its.ac.id.\nMemilih menu Latest Addition.\nMencari publikasi yang sesuai.\nEprint ID:\n88888\n\nEprint ID berbeda-beda untuk setiap mahasiswa. Jangan menggunakan Eprint ID orang lain.'
 '1. Langkah awal sebelum mengisikan data proposal TA ke MONTA, mahasiswa wajib berdiskusi\n      terlebih dahulu dengan calon dosen pembimbing perihal topik TA yang ingin dikerjakan sambil\n      bimbingan dalam penyusunan draft proposal TA.\n\n   2. Setelah topik dan draft proposal TA sudah disetujui, mahasiswa melakukan pendaftaran proposal\n      TA ke sistem dengan memilih menu Proposal TA –> Buat Proposal serta mengunggah file draft\n      proposal yang sudah disepakati pembimbing.\n      Setelah mengisi semua isian form maka memilih tombol Buat Proposal Baru.\n\n\n\n\n   3. Setelah mendaftarkan proposal, mahasiswa dapat mencetak cover proposal TA dengan memilih\n      menu Cetak Cover –> Cetak Cover Proposal TA.\n\n\n\n\n   4. Mahasiswa wajib menyerahkan kepada koordinator TA/Ketua RMK, hardcopy proposal TA\n      lengkap dengan cover proposal yang dicetak dari MONTA dan sudah disetujui/ditandatangani\n      oleh dosen pembimbing.']",Menu Cetak Cover –> Cetak Cover Proposal TA di MONTA,0.0,0.999999999975,1.0,0.9788546408623744
16,Konten apa saja yang harus ada dalam video Tugas Akhir?,"Konten yang harus ada dalam video Tugas Akhir antara lain:
1. Logo ITS
2. Judul Tugas Akhir
3. Data Pembuat dan Pembimbing (NRP, NIP, Nama, menggunakan foto juga boleh)
4. Deskripsi singkat tugas akhir (boleh berupa narasi suara, anotasi dan atau tulisan)
5. Cara jalannya aplikasi (bisa direkam menggunakan video camcoder atau screen capture)
6. Animasi title clip, caption, maupun musik latar belakang.","['1. Jenis video adalah video promosi, boleh juga berupa video tutorial penggunaan software / hardware.\n2. Durasi video antara 1-5 menit\n3. Resolusi video 720p atau 1080i (HD)\n4. Bisa menggunakan video editor bebas, seperti Camtasia, Windows MovieMaker, dll.\n5. Format yang dikumpulkan berupa .mp4 atau .wmv\n6. Konten video minimal berisi :\n\nLogo ITS\nJudul Tugas Akhir\nData Pembuat dan Pembimbing (NRP, NIP, Nama, menggunakan foto juga boleh)\nDeskripsi singkat tugas akhir (boleh berupa narasi suara, anotasi dan atau tulisan)\nCara jalannya aplikasi (bisa direkam menggunakan video camcoder atau screen capture)\nSupaya lebih menarik, beri animasi title clip, caption, maupun musik latar belakang.\n================================\n= Ketentuan Poster Tugas Akhir =\n================================'
 'Oleh : <NAMA MAHASISWA>\n                             NRP. <XXXXXXXX>\n\n\n\n                    Disetujui oleh Tim Penguji Tugas Akhir :\n\n\n1. Nama dan gelar pembimbing                            Pembimbing\n\n\n2. Nama dan gelar ko-pembimbing/penguji                 Ko-pembimbing\n\n\n3. Nama dan gelar penguji                               Penguji\n\n\n4. Nama dan gelar penguji                               Penguji\n\n\n5. Nama dan gelar penguji                               Penguji\n\n\n                                 SURABAYA\n                                 Bulan, Tahun\n\n\n\n                                                                        33\n\x0c                              APPROVAL SHEET\n\n\n\nTHE TITLE OF THE FINAL PROJECT IS WRITTEN BRIEFLY, CLEARLY AND\n                  DESCRIBING THE MAIN THEME'
 'Kategori kompetisi ini ada dua yakni katagori kompetisi yang diselenggarakan oleh\nKemdikbud dan Non Kemdikbud\nBerikut lomba yang diadakan oleh Kemdikbud:\n1. Program Kreativitas Mahasiswa (PKM)\n2. Satria Data\n3. Mahasiswa berprestasi (Mawapres)\n4. Kompetisi Nasional Matematika dan Ilmu Pengetahuan Alam (KN MIPA)\n5. Kontes Robot Indonesia (KRI)\n6. Kontes Robot Terbang Indonesia (KRTI)\n7. Pagelaran Mahasiswa Bidang TIK (GEMASTIK)\n8. Kontes Mobil Hemat Energi (KMHE)\n9. Kontes Kapal Cepat Tak Berawak (KKCTB)\n10. Kompetisi Jembatan Indonesia (KJI)\n11. Kontes Bangungan Gedung Indonesia (KBGI)\n12. Kompetisi Bisnis Mahasiswa Indonesia (KBMI)\n13. Ekspo Kewirausahaan Mahasiswa (KMI)\n14. Startup Mahasiswa Indonesia\n15. Pekan Olahraga Mahasiswa Nasional (POMNAS)\n16. Musabaqah Tilawatil Qur-an Mahasiswa Nasional (MTQMN)\n17. Pentas Paduan Suara Gerejawi (PESPARAWI)\n18. Kompetisi Inovasi Bisnis Mahasiswa (KIBM) 2020\n19. Akselerasi Startup Mahasiswa Indonesia (ASMI)'
 '24\n\x0cLAMPIRAN 2: Contoh Halaman Pengesahan Proposal Tugas Akhir\n\n                         LEMBAR PENGESAHAN\n\n      JUDUL PROPOSAL TUGAS AKHIR DITULIS SINGKAT JELAS DAN\n                 MENGGAMBARKAN TEMA POKOK\n\n\n                         PROPOSAL TUGAS AKHIR\n                    Diajukan untuk memenuhi salah satu syarat\n                      memperoleh gelar <Nama Gelar> pada\n                    Program Studi S-1 <Nama Program Studi>\n                        Departemen <Nama Departemen>\n                            Fakultas <Nama Fakultas>\n                       Institut Teknologi Sepuluh Nopember\n\n\n\n                        Oleh : <NAMA MAHASISWA>\n                              NRP. <XXXXXXXX>\n\n\n\n                 Disetujui oleh Tim Penguji Proposal Tugas Akhir :\n\n\n1. Nama dan gelar pembimbing                             Pembimbing\n\n\n2. Nama dan gelar ko-pembimbing/penguji                  Ko-pembimbing']","Logo ITS, Judul Tugas Akhir, Data Pembuat dan Pembimbing, Deskripsi singkat Tugas Akhir, Cara jalannya aplikasi",1.0,0.9999999999,0.6666666666666666,0.9781081704854752
17,Bagaimana cara pengecekan file yang telah terunggah di POmITS?,"Untuk melakukan pengecekan file yang telah terunggah di POmITS, Anda dapat mengakses link berikut: http://lpmp2ki.its.ac.id/pomits. Pengecekan tersebut bertujuan untuk memastikan bahwa file yang diunggah memenuhi ketentuan publikasi yang telah ditetapkan. Jika terdapat penghapusan atau penarikan artikel, Anda dapat mengisi form pada link yang sesuai dengan jenis jurnal, yaitu http://bit.ly/FHAJTeknikITS untuk Jurnal Teknik ITS, http://bit.ly/FHAJSainsSeniITS untuk Jurnal Sains & Seni ITS, dan http://bit.ly/FHAJRepositoryITS untuk Repository. Selain itu, informasi mengenai artikel yang tidak memenuhi ketentuan publikasi juga dapat dilihat pada website jurnal yang diupdate setiap 3 hari.","['\uf0b7   Pengecekan file yang TERUNGGAH dapat dilihat di\n    http://lpmp2ki.its.ac.id/pomits.\n\n\uf0b7   Jika terdapat penghapusan/penarikan artikel, dapat mengisi form pada link\n    \uf031\uf02e http://bit.ly/FHAJTeknikITS, untuk Jurnal Teknik ITS;\n    \uf032\uf02e http://bit.ly/FHAJSainsSeniITS, untuk Jurnal Sains &Seni ITS;\n    \uf033\uf02e http://bit.ly/FHAJRepositoryITS, untuk Repository.\n\n\n\uf0b7   List data Artikel terhapus dapat dilihat pada website jurnal.\n    (http://ejurnal.its.ac.id, yang diupdate tiap 3 hari)\n\n\uf0b7   Artikel - artikel yang TIDAK MEMENUHI KETENTUAN PUBLIKASI (gaya selingkung tidak\n    sesuai format dan file pendukung tidak lengkap) tidak akan DIPUBLIKASIKAN di\n    Jurnal POMITS.\n\n\uf0b7   Periode unggah artikel untuk yudisium 122 adalah sampai dengan\n    7 Agustus 2020, pukul 24.00 WIB'
 ""melakukan UNGGAH di Jurnal Repository, menggunakan login 'mahasiswa', dengan.\nkata sandi 'M4h4sisw4lTs!' ke alamat 'https://ejurnal.its.ac.id/index.php/index/login'\ndengan mengunggah file artikel dan file Form Telaah(dalam format pdf) saja.\nPengecekan file vang TERuNGGAH dapat dilihat di\nhttps://lpmp2ki.its.ac.id/pomits.\nJika terdapat penghapusan/penarikan artikel, dapat mengisi form pada link :\nhttps://its.id/FHAJTeknikITSPOMITS, untuk Jurnal Teknik ITS;\n1.-\nhttps:/l/its.id/FHAJSainsSenilTSPOMITS, untuk Jurnal Sains &Seni ITS;\n3.https://its.id/FHAJRepositorylTSPOMITS, untuk Jurnal Repository..\n Penghapusan Artikel akan dilakukan setelah yudisium berakhir.\nArtikel - artikel yang TIDAK MEMENUHI KETENTUAN PUBLIKASI (gaya selingkung\ntidak sesuai format dan file pendukung tidak lengkap) tidak akan DIPUBLIKASIKAN\ndi Jurnal Teknik ITS dan Jurnal Sains & Seni ITS.\nPeriode unggah artikel untuk yudisium 29 adalah sampai dengan \n15 Februari 2024 pukul 24.00 WIB""
 'Pemberitahuan\nUnggah Artikel POmITS\nUNGGAH artikel WAJIB dilakukan oleh MAHASISWA PENDAFTAR YUDISIUM 129\n Mahasiswa yang Dosen Pembimbingnya memilih untuk MEMpuBLIKAsIKAN\nartikelnya pada Jurnal POmITS, dapat melakukan UNGGAH, dengan mengikuti langkah\npada BUKU PANDUAN TATA CARA UNGGAH. File yang HARUS DIUNGGAH adalah\n(ukuran masing-masing file tidak boleh lebih dari 2 MB):\nArtikel hasil dari Tugas Akhir, dalam format Ms. Word yang telah mengikuti tem-\n1.\nplate. (selain format Ms.Word artikel DITOLAK/REJECTED)\nFormulir Hak Cipta, dalam format PDF.\nForm Telaah Artikel POmITs, dalam format PDF.\nForm Revisi/Perbaikan/Penyempurnaan TA yang berisi nama penguji beserta\ntidak hanya TTD saja)\n Template, Formulir Hak Cipta, Buku Panduan Tata Cara Unggah, dan Form Telaah\n5.\nArtikel dapat diunduh pada link:\nhttps://ejurnal.its.ac.id/index.php/teknik (Jurnal Teknik ITS)\nhttps://ejurnal.its.ac.id/index.php/sains_seni (Jurnal Sains&Seni ITS)\nSection yang bisa dipilih pada Jurnal Teknik ITS:'
 '\uf0b7   Mahasiswa yang Dosen Pembimbingnya memilih untuk MEMPUBLIKASIKAN\n    artikelnya pada Jurnal POMITS, dapat melakukan UNGGAH, dengan mengikuti langkah\n    pada BUKU PANDUAN TATA CARA UNGGAH. File yang HARUS DIUNGGAH adalah\n    (ukuran masing-masing file tidak boleh lebih dari 2 MB):\n    \uf031\uf02e Artikel hasil dari Tugas Akhir, dalam format Ms. Word yang telah mengikuti tem-\n       plate. (selain format Ms.Word artikel DITOLAK/REJECTED)\n    \uf032\uf02e Formulir Hak Cipta.\n    \uf033\uf02e Form Telaah Artikel POMITS, dalam format PDF.\n    \uf034\uf02e Form Revisi/Perbaikan/Penyempurnaan TA yang berisi nama penguji beserta\n       komentar dari penguji, dalam format PDF. (Mohon nama penguji tidak disingkat/\n       tidak hanya TTD saja)\n    \uf035\uf02e Template, Formulir Hak Cipta, Buku Panduan Tata Cara Unggah, dan Form Telaah\n       Artikel dapat diunduh pada link:\n       http://ejurnal.its.ac.id/index.php/teknik (Jurnal Teknik ITS)\n        http://ejurnal.its.ac.id/index.php/sains_seni (Jurnal Sains&Seni ITS)']",Pengecekan file yang telah terunggah dapat dilakukan di https://lpmp2ki.its.ac.id/pomits.,1.0,0.999999999975,1.0,0.8547117745367271
18,Apa yang harus dilakukan jika terjadi kesalahan pada file yang sudah terunggah?,"Jika terjadi kesalahan pada file yang sudah terunggah, Anda dapat mengisi form pada link berikut:
1. https://its.id/FHAJTeknikITSPOMITS, untuk Jurnal Teknik ITS;
2. https://its.id/FHAJSainsSenilTSPOMITS, untuk Jurnal Sains & Seni ITS;
3. https://its.id/FHAJRepositorylTSPOMITS, untuk Jurnal Repository.

Setelah mengisi form tersebut, penghapusan atau penarikan artikel akan dilakukan setelah yudisium berakhir.","[""melakukan UNGGAH di Jurnal Repository, menggunakan login 'mahasiswa', dengan.\nkata sandi 'M4h4sisw4lTs!' ke alamat 'https://ejurnal.its.ac.id/index.php/index/login'\ndengan mengunggah file artikel dan file Form Telaah(dalam format pdf) saja.\nPengecekan file vang TERuNGGAH dapat dilihat di\nhttps://lpmp2ki.its.ac.id/pomits.\nJika terdapat penghapusan/penarikan artikel, dapat mengisi form pada link :\nhttps://its.id/FHAJTeknikITSPOMITS, untuk Jurnal Teknik ITS;\n1.-\nhttps:/l/its.id/FHAJSainsSenilTSPOMITS, untuk Jurnal Sains &Seni ITS;\n3.https://its.id/FHAJRepositorylTSPOMITS, untuk Jurnal Repository..\n Penghapusan Artikel akan dilakukan setelah yudisium berakhir.\nArtikel - artikel yang TIDAK MEMENUHI KETENTUAN PUBLIKASI (gaya selingkung\ntidak sesuai format dan file pendukung tidak lengkap) tidak akan DIPUBLIKASIKAN\ndi Jurnal Teknik ITS dan Jurnal Sains & Seni ITS.\nPeriode unggah artikel untuk yudisium 29 adalah sampai dengan \n15 Februari 2024 pukul 24.00 WIB""
 'Apakah berkas\nsudah lengkap?\nMelakukan pendaftaran sidang\nproposal tesis\nMeminta tanda tangan form revisi\nke dosen pembimbing dan\npenguji dan lembar pengesahan\nke dosen pembimbingJadwal sidang, link\nmeeting, form penilaian\ndan form berita acara  \nMengajukan hasil revisi\nke dosen pembimbing\ndan pengujiMelengkapi dan memeriksa\nberkas persyaratan pendaftaran\nsidang proposal tesis\nTidak\nYa\nCatatan revisi sidang proposal\ntesis dan data penilaian sidang\nproposal tesis dari\npembimbing dan penguji\nMahasiswa dapat mengecek nilai\nsidang proposal tesis melalui\nSIAKAD ITS di akhir semester\n(IF 185301 T esis-Proposal)Dosen (Pembimbing, Penguji, Ketua RMK)\nDosen pembimbing dan penguji\nmenandatangani form revisi dan\nlembar pengesahan, lalu\nmenyerahkan kembali ke mahasiswaDosen pembimbing\ndan penguji memeriksa\nhasil revisiDokumen hasil\nrevisi sidang\nproposal tesis  \nApakah revisi\nsudah sesuai?Dokumen hasil\nrevisi sidang\nproposal tesis  Ketua RMK menentukan penguji\ndan menjadwalkan sidang'
 '\uf0b7   Pengecekan file yang TERUNGGAH dapat dilihat di\n    http://lpmp2ki.its.ac.id/pomits.\n\n\uf0b7   Jika terdapat penghapusan/penarikan artikel, dapat mengisi form pada link\n    \uf031\uf02e http://bit.ly/FHAJTeknikITS, untuk Jurnal Teknik ITS;\n    \uf032\uf02e http://bit.ly/FHAJSainsSeniITS, untuk Jurnal Sains &Seni ITS;\n    \uf033\uf02e http://bit.ly/FHAJRepositoryITS, untuk Repository.\n\n\n\uf0b7   List data Artikel terhapus dapat dilihat pada website jurnal.\n    (http://ejurnal.its.ac.id, yang diupdate tiap 3 hari)\n\n\uf0b7   Artikel - artikel yang TIDAK MEMENUHI KETENTUAN PUBLIKASI (gaya selingkung tidak\n    sesuai format dan file pendukung tidak lengkap) tidak akan DIPUBLIKASIKAN di\n    Jurnal POMITS.\n\n\uf0b7   Periode unggah artikel untuk yudisium 122 adalah sampai dengan\n    7 Agustus 2020, pukul 24.00 WIB'
 'Lakukan pembayaran dengan transfer ke VA BNI. Berlaku 1x24 jam. Jika kadaluarsa bisa melakukan pesanan baru.\nMemantau Pesanan\n\nStatus Pesanan:\n\nMembuat pesanan cetak\nMenunggu pembayaran\nPembayaran diterima\nProses pencetakan\nSelesai dicetak\nPengiriman ke Perpustakaan / Departemen\nSelesai\nPesanan kadaluarsa\nPesanan dibatalkan\nJika ada permasalahan teknis dapat menghubungi:\n\nWA Layanan DPTSI: 0811 3333 8 222 (07:30 – 16:00 WIB)\nPortal Servicedesk: https://servicedesk.its.ac.id']","Jika terjadi kesalahan pada file, mahasiswa dapat melakukan penghapusan artikel dan unggah ulang dengan mengikuti form pada link: https://its.id/FHAJTeknikITSPOMITS, https://its.id/FHAJSainsSenilTSPOMITS, dan https://its.id/FHAJRepositorylTSPOMITS.",1.0,0.999999999975,1.0,0.0
19,Apa saja unsur dalam proposal tesis?,"Dalam proposal tesis terdapat beberapa unsur yang harus ada, antara lain:

1. Judul Proposal Tesis: Judul proposal tesis harus ditulis secara singkat, jelas, dan menggambarkan tema pokok dari penelitian yang akan dilakukan.
2. Identitas Mahasiswa: Nama mahasiswa dan NRP (Nomor Registrasi Mahasiswa) harus tercantum dalam proposal tesis.
3. Identitas Pembimbing dan Penguji: Nama dan gelar pembimbing serta penguji harus disebutkan dalam proposal tesis.
4. Tinjauan Pustaka: Berisi referensi terbaru, relevan, dan asli yang mendukung penelitian yang akan dilakukan.
5. Metodologi: Berisi tentang bahan-bahan, peralatan, cara kerja, teknik/proses pengerjaan, dan lokasi pelaksanaan penelitian.
6. Jadwal Kegiatan: Rincian setiap kegiatan penelitian yang akan dilakukan dalam proposal tesis.

Itulah beberapa unsur yang harus ada dalam sebuah proposal tesis.","['THE TITLE OF THE FINAL PROJECT PROPOSAL IS WRITTEN BRIEFLY,\n            CLEARLY AND DESCRIBING THE MAIN THEME\n\n\n\n                        FINAL PROJECT PROPOSAL\n                    Submitted to fulfill one of the requirements\n                    for obtaining a degree <name of degree> at\n             Undergraduate Study Program of <name of Study Program>\n                      Department of <name of Department>\n                          Faculty of <name of Faculty>\n                       Institut Teknologi Sepuluh Nopember\n\n\n\n                          By: <NAME OF STUDENT>\n                              NRP. <XXXXXXXX>\n\n\n\n                Approved by Final Project Proposal Examiner Team:\n\n\n1. Name of Advisor and academic title                      Advisor\n\n\n2. Name of Co-Advisor/Examiner and academic title          Co-Advisor\n\n\n3. Name of Examiner and academic title                     Examiner\n\n\n4. Name of Examiner and academic title                     Examiner'
 '24\n\x0cLAMPIRAN 2: Contoh Halaman Pengesahan Proposal Tugas Akhir\n\n                         LEMBAR PENGESAHAN\n\n      JUDUL PROPOSAL TUGAS AKHIR DITULIS SINGKAT JELAS DAN\n                 MENGGAMBARKAN TEMA POKOK\n\n\n                         PROPOSAL TUGAS AKHIR\n                    Diajukan untuk memenuhi salah satu syarat\n                      memperoleh gelar <Nama Gelar> pada\n                    Program Studi S-1 <Nama Program Studi>\n                        Departemen <Nama Departemen>\n                            Fakultas <Nama Fakultas>\n                       Institut Teknologi Sepuluh Nopember\n\n\n\n                        Oleh : <NAMA MAHASISWA>\n                              NRP. <XXXXXXXX>\n\n\n\n                 Disetujui oleh Tim Penguji Proposal Tugas Akhir :\n\n\n1. Nama dan gelar pembimbing                             Pembimbing\n\n\n2. Nama dan gelar ko-pembimbing/penguji                  Ko-pembimbing'
 'Tinjauan pus taka berisi referensi yang terbaru, relevan, dan asli.  \nTinjauan pu staka menguraikan teori, tem uan, dan bahan  \npenelitian lain yang di arahkan unt uk m enyusun kerangka  \npemikiran atau konsep yang akan digunakan dalam  penelitian.  \n \ne.  Metodolog i  \nMetodolog i berisi bahan-bahan, peralatan, dan cara kerja serta \nteknik/proses pengerjaan. Yang dim aksud dengan ba han adalah : \nmateri al, data, dan hasil penelitia n lain. Yang dimaksud peralatan \n: alat-al at uji laboratorium dan lapan gan, perangk at keras dan \n5 lunak, teori  dan persamaan, serta variabel. Yang dimaksud \ndengan proses : teknik pengum pulan  dan analisis data, model \npendekatan yang digunakan, rancangan pene litian, cara penafsiran  \ndan pengum pulan hasil penelitian, u jicoba dan cara evaluasi, serta \ncara peny impulan. Pada bab ini perlu  dijelaskan tem pat/lokasi \npelaksanaan TA. \n \nf.  Jadwal kegiat an \nJadwal kegiatan berisi rincian setiap kegiatan penelitian y ang'
 'hasil revisiDokumen hasil\nrevisi sidang\nproposal tesis  \nApakah revisi\nsudah sesuai?Dokumen hasil\nrevisi sidang\nproposal tesis  Ketua RMK menentukan penguji\ndan menjadwalkan sidang\nproposal tesis setiap pesertaSOP PENDAFT ARAN SIDANG PROPOSAL TESIS PROGRAM STUDI S2 TEKNIK INFORMA TIKA (SISTEM ONLINE ), FT -EIC, ITS  \nYaDraft proposal tesis\ndan form persetujuan\npembimbing\nPemeriksa,\n \n \n \n \n \nLina Ambarwati, S.Kom.  \nNIP. 198003242014092001  Mengetahui,\nDr. Ahmad Saikhu, S.Si., M.T . \nNIP. 197107182006041001Pembuat,\n \n \n \n \n \nKartika Dwi Y uniavita Rahmawati, S.T .\nNPP. 1998202122056  \nJadwal sidang, link\nmeeting, dan VB\nTidak\nMenginfokan link google form\nuntuk meng-upload  seluruh\ndokumen hasil revisi sidang\nproposal tesis ke mahasiswa\nStatus sidang\nproposal tesis\nmenjadi ""Disetujui""Merekap data mahasiswa yang\ntelah menyelesaikan revisi\nsidang proposal tesis dan\nmenginfokan ke Kaprodi\nMeng-update status sidang\nproposal tesis di MonT esMeng-upload lembar revisi sidang']","Unsur dalam proposal tesis terdiri dari: Judul, Lembar Pengesahan, Abstrak, Daftar isi, Bagian tubuh (bab-bab), Rencana dan Jadwal Kerja Penelitian dan Penyusunan Tesis, Daftar pustaka, dan Lampiran.",0.9166666666361111,0.9285714285714286,0.983274188166689,0.0
