,question,ground_truth,contexts,answer
0,Apa visi ITS?,Menjadi perguruan tinggi dengan reputasi internasional dalam ilmu pengetahuan dan teknologi terutama yang menunjang industri dan kelautan yang berwawasan lingkungan.,"['ERICHA VALENTINA\n5015201016\nS1 Perencanaan Wilayah d Vely Kukinul Siswanto\n\n\nFALDI FAKHRI\n5015201128\nS1 Perencanaan Wilayah d I Dewa Made Frendika S\n\nKK\nTerdapat inkonsistensi data / data yang belum diisi pada registras\nTerdapat laporan mingguan dengan foto aktivitas yang belum diis\nTerdapat laporan mingguan dengan foto aktivitas yang belum diis\nTerdapat laporan mingguan dengan foto aktivitas yang belum diis\nTerdapat laporan mingguan dengan foto aktivitas yang belum diis\nTerdapat laporan mingguan dengan foto aktivitas yang belum diis\nTerdapat laporan mingguan dengan foto aktivitas yang belum diis -\nits.id/ListSIMMagang\n+\nMix\nGenap 22/23\nGasal 23/24\nKementerian Pendidikan, Kebudayaan, Riset dan\nTeknologi\n\nSubdit. PK2\nADVANCING HUMANITY\niTS\nh\n4\nOverview MSIB 6\nd\n2023', '6. Jarak Spasi\n1 (satu)\n• SISTEMATIKA LAPORAN MAGANG\nCover Luar\nCover Dalam\nLembar Pengesahan\nKata Pengantar\nDaftar Isi\nDaftar Gambar\nDaftar Tabel\nBAB 1. PENDAHULUAN\n1.1. Latar Belakang\n1.2. Tujuan Magang\n1.3. Manfaat Magang\n1.4. Mahasiswa menguraikan tujuan penulisan topik magang.\nBAB 2. PENDAHULUAN\n2.1. Sejarah Mitra Magang\n2.2. Struktur Organisasi Mitra Magang\n2.3. Visi dan Misi Perusahaan\n2.4. Kegiatan Produksi (barang/jasa) (jika ada)\nBAB 3. PELAKSANAAN MAGANG\n3.1 Posisi / kedudukan kegiatan Magang\n3.2 Metodologi penyelesaian Tugas\n3.3 Pembelajaran Hal Baru\nBAB 4. KESIMPULAN DAN SARAN\nBAB 5. REFLEKSI DIRI\nLAMPIRAN\nBuku Petunjuk Teknis Magang\n47', 'PENGALAMAN TENTANG KEBUDAYAAN DAERAH LAIN\nMELALUI MODUL NUSANTARA\nSelain mengikuti pembelajaran mata kuliah di perguruan tinggi penerima, mahasiswa yang mengikuti program Pertukaran Mahasiswa Merdeka juga akan mendapatkan pengalaman langsung berinteraksi dengan mahasiswa dari daerah lain dan mempelajari kebudayaan daerah lain melalui Modul Nusantara. Modul Nusantara ini senilai 2 sks dan wajib diambil oleh mahasiswa peserta program Pertukaran Mahasiswa Merdeka. Modul Nusantara dilaksanakan di perguruan tinggi penerima. Modul Nusantara dibagi ke dalam empat jenis kegiatan yaitu kebinekaan, inspirasi, refleksi, dan kontribusi sosial. Dalam pelaksanaan Modul Nusantara, mahasiswa akan dibimbing oleh dosen pembimbing modul nusantara dan dibantu oleh mentor.\nBAGAIMANA MEKANISME PELAKSANAAN PERTUKARAN\nMAHASISWA MERDEKA?\nTerdapat dua mekanisme, yaitu:', '23. Mata Kuliah adalah satuan pelajaran yang diajarkan di tingkat perguruan tinggi.\r\n24. Mata Kuliah Inti adalah mata kuliah wajib yang terkait dengan program studi di ITS.\r\n25. Mata Kuliah Non-Inti adalah mata kuliah di ITS yang meliputi mata kuliah wajib kurikulum, mata kuliah penciri ITS, mata kuliah pilihan program studi, dan mata kuliah pengayaan.\r\n26. Mata Kuliah Wajib Kurikulum adalah mata kuliah yang terdiri dari Agama, Pancasila, Kewarganegaraan, dan Bahasa Indonesia.\r\n27. Mata Kuliah Penciri ITS adalah mata kuliah yang terdiri dari Bahasa Inggris, Teknopreneur, dan Wawasan dan Aplikasi Teknologi.']",Saya tidak tahu.
1,Apa itu Body of Knowledge?,"Istilah yang digunakan untuk mewakili secara lengkap konsep, istilah, dan aktivitas yang membentuk kemampuan profesional, yang didefinisikan oleh masyarakat terpelajar atau asosiasi profesional yang relevan.","['Hal ini dilakukan dengan tujuan memastikan keakuratan informasi akademik mahasiswa sebagai syarat mendaftar ke program Kampus Merdeka.\nJika ada pertanyaan atau bantuan yang dibutuhkan, harap hubungi tim kami di Pusat Bantuan.\nHormat kami,\nTim Kampus Merdeka\n8. Penanggung Jawab Fakultas/Prodi Anda akan menerima email notifikasi penugasan verifikasi data akademik mahasiswa untuk prodi tersebut untuk program Kampus Merdeka. Klik\n""Verifikasi Sekarang"".\n9. Contoh email notifikasi penugasan jika belum ada mahasiswa yang terdaftar\nMohon cek folder Spam jika email tidak muncul di folder Kotak Masuk.\nCatatan:\nPenanggung Jawab Fakultas/Prodi dapat menerima penugasan dan melakukan verifikasi hanya dengan klik tautan yang dikirimkan lewat email. Tidak perlu melakukan pendaftaran di laman MBKM.\nKementerian Pendidikan, Kebudayaan, Riset dan\nTeknologi', 'terlibat di dalam pro ses dan hasil pelaksanaan MBKM.  \n(2). SOP yang diterbitkan oleh: (a) Direktorat terkait sebagai koordinator pelaksana \nmasing -masing bentuk MBKM, (b) Prodi sebagai pelaksana MBKM  untuk memandu \ndosen, mahasiswa dan tenaga kependidikan yang terlibat di dalam proses dan hasil \npelaksanaan MBKM.  \nDokumen (1) dan (2) di atas, merupakan manual untuk seluruh stakeholder yang terlibat \ndi dalam implementasi MBKM, yang dapat disusun dalam satu dokumen atau lebih secara \nterpisah. Rambu -rambu dalam penyusunan ke dua dokumen di atas, dengan ketentuan \nmemuat unsur -unsur sebagai berikut, dan dapat dikembangkan sesuai dengan kebutuhan \ndan tujuan pelaksanaan MBKM.  \n1. Tujuan dan ma ksud Manual MBKM  \n2. Luas lingkup Manual MBKM  \na. Manual Penetapan standar  \nb. Manual pelaksanaan standar  \nc. Manual evaluasi standar  \nd. Manual pengendalian pelaksnanaan standar  \ne. Manual peningkatan standar  \n3. Rincian tentang hal yang harus dikerjakan', 'di luar ITS dapat  dikembangkan dan dikoordinasikan oleh Direktorat yang mengurusi \npendidikan bekerjasama dengan Direktorat yang mengurusi pascasarjana dan \npengembangan akademik . \n(5) Direktorat yang mengurusi kegiatan pertukaran pelajar/ kuliah dalam negeri harus 16 Dokumen Panduan Baku Mutu Pelaksanaan MBKM - 2021  \n NO ELEMEN PENILAIAN  INDIKATOR  \n(1) (2) (3) \nberkoordinasi dengan Program Studi terkait . \n Standar Pengelolaan – \nPerencanaan MBKM  1. Prodi mempunyai Dokumen panduan untuk implementasi MBKM / turunan dokumen \nPerek 21 tahun 202 1 yang menjadi konsideran  implementasi MBKM . \n2. Prodi mempunyai kurikulum implementasi MBKM, yang meliputi CPL yang ditetapkan \nsesuai dengan implementasi MBKM dan peta CPL – MK MBKM  \n3.  Prodi mempunyai Dokumen panduan untuk Dosen  Wali dan Dosen Pembimbing dalam \npelaksanaan MBKM   \n4. Prodi mempunyai Dokumen pan duan untuk Mahasiswa dalam perencanaan , \npelaksannaan, penilaian pelaksanaan  MBKM', 'jelas.\n\n2. Masalah dianalisis menggunakan\nlandasan teoritis dan bukti\npendukung yang kuat.\nKelengkapan subtansi laporan\n3. Kesimpulan dirumuskan sesuai\ndengan hasil analisis.\n\n4. Refleksi diri mencerminkan proses\npembelajaran selama magang\nskill dan social-emotional skill.\n\ninstitusi (jika ada).\nKesesuaian format laporan\nbuku Pedoman Magang ini.\n2. Logika penyajian yang runtun.\n\n3. Bahasa yang baku serta ilmiah.\n1. Pendahuluan / latar belakang dan\nperumusan masalah ditulis secara\nsecara pribadi, meliputi aspek technical\n5. Rekomendasi yang dibuat memuat\nrekomendasi terkait masalah yang\ndianalisis dan rekomendasi untuk\n1. Mengikuti panduan laporan magang\nseperti yang tertera dalam Bagian 8\nTabel 8.1 Butir Penilaian Laporan Magang\n54\n08 Penilaian Magang']",Saya tidak tahu.
2,Apa itu CPL?,Capaian Pembelajaran Lulusan,"['magang sesuai dengan ketentuan yang berlaku;  \n 9 Dokumen Panduan Baku Mutu Pelaksanaan MBKM - 2021  \n NO ELEMEN PENILAIAN  INDIKATOR  \n(1) (2) (3) \n9 Standar Proses –  \nKegiatan MBKM – bentuk \nPengabdian kepada Masyarakat  (i) Kegiatan MBKM dalam bentuk pengabdian kepada masyarakat  atau selanjutnya \ndikategorikan sebagai KKN  ditujukan untuk pembinaan karakter kebangsaan mahasiswa \nkhususnya untuk menumbuhkan kepedulian terhadap persoalan yang dihadapi \nmasyarakat , sebaga i salah satu CPL dalam aspek Sikap .  \n(ii) Kegiatan MBKM dalam bentuk KKN harus dibawah bimbingan dosen . \n(iii) Kegiatan MBKM dalam bentuk KKN dapat diakui sebagai  tambahan sks atau dapat \ndikompensasi dengan mata kuliah Program Studi yang memiliki capaian pembelajaran \nyang setara.  \n(iv) Kegiatan MBKM dalam bentuk KKN dilaksanakan pada semester 6 (enam) dan 7 (tujuh)  \natau sebelum nya dengan syarat telah lulus tahap persiapan.', 'PENDAFTARAN\nPERSYARATAN PENDAFTARAN MAHASISWA\n1. Mahasiswa aktif semester 3 - 7 di perguruan tinggi non vokasi di bawah Direktorat Jenderal Pendidikan Tinggi, Kementerian Pendidikan, Kebudayaan, Riset dan Teknologi RI;\n2. Memiliki indeks prestasi kumulatif (PK) 2,75 dari skala 4. Untuk mahasiswa yang memiliki IPK di bawah 2,75 dapat melampirkan sertifikat prestasi resmi minimal tingkat provinsi;\n3. Tidak pernah dikenakan sanksi akademik dan non akademik pada perguruan tinggi pengirim;\n4. Bukan mahasiswa peserta program PERMATA atau PERMATA SAKTI;\n5. Memiliki satu kali kesempatan untuk mengikuti dan memperoleh bantuan biaya program Pertukaran Mahasiswa Merdeka;\n6. Bersedia mentaati seluruh ketentuan yang tertulis di dalam POB\nprogram Pertukaran Mahasiswa Merdeka.\nAPA YANG HARUS MAHASISWA PERSIAPKAN SEBELUM MENDAFTAR?\n1. Mahasiswa memastikan data diri (nama, tempat tanggal lahir, NIM dan NIK) sesuai dengan data di PDDIKTI (https://\npddikti.kemdikbud.go.id)', '16. Tahap Persiapan adalah tahap pembelajaran yang dijadwalkan dalam dua semester pertama pada kurikulum Program Sarjana atau dua paket semester pertama pada kurikulum Program Sarjana Terapan.\r\n17. Standar kompetensi lulusan adalah kriteria minimal tentang kualifikasi kemampuan lulusan yang mencakup sikap, pengetahuan, dan keterampilan yang dinyatakan dalam rumusan capaian pembelajaran lulusan.\r\n\r\n18. Capaian Pembelajaran Lulusan yang selanjutnya disingkat CPL adalah kriteria minimal tentang kualifikasi kemampuan lulusan yang mencakup sikap, pengetahuan, dan keterampilan yang dinyatakan dalam rumusan capaian pembelajaran lulusan.\r\n19. Capaian Pembelajaran Mata Kuliah yang selanjutnya disingkat CPMK adalah capaian pembelajaran lulusan yang dibebankan ke mata kuliah.\r\n20. Sistem Kredit Semester yang selanjutnya disingkat SKS adalah suatu sistem penyelenggaraan pendidikan dengan menggunakan sks.', '5. Surat persetujuan orang tua/wali (contoh terlampir)\n6. Surat pakta integritas (contoh terlampir\nPERTANYAAN YANG SERING DITANYAKAN\nT. Mahasiswa dari perguruan tinggi apa saja yang dapat mengikuti program Pertukaran Mahasiswa Merdeka?\nJ. Mahasiswa dari perguruan tinggi negeri maupun swasta non vokasi di bawah Direktorat Jenderal Pendidikan Tinggi, Kementerian Pendidikan, Kebudayaan, Riset, dan Tenologi RI.\nJ. Apakah Pertukaran Mahasiswa Merdeka 2021 untuk mahasiswa S1 saja?\nA. Pertukaran Mahasiswa Merdeka 2021 diperuntukkan untuk mahasiswa jenjang St.\nT. Apakah mahasiswa yang lolos akan menerima bantuan potongan\nUKT?\nJ. Mahasiswa akan menerima bantuan potongan UKT sebesar maksimal Rp 2.400.000 dengan syarat bukan penerima bantuan\nUKT dari beasiswa pemerintah lainnya.\nT. Bagaimana jika UKT saya lebih kecil dari 2,4 juta?\nJ. Bantuan UKT akan dibayarkan at cost (sesuai besaran UKT mahasiswa).']","CPL adalah singkatan dari Capaian Pembelajaran Lulusan. CPL merupakan kriteria minimal tentang kualifikasi kemampuan lulusan yang mencakup sikap, pengetahuan, dan keterampilan yang dinyatakan dalam rumusan capaian pembelajaran lulusan."
3,Berapa jam kerja magang yang setara dengan 1 SKS?,1 SKS = 2.720 menit magang atau 45 jam,"['• LAMPIRAN 7: Form Rincian Tugas Magang\nRINCIAN TUGAS MAGANG\nSemester Magang :... Tahun Akademik 20.../20...\nNama Mahasiswa\nNRP\nDepartemen\nNama Dosen Pembimbing\nNama Perusahaan Mitra Magang\nWaktu Pelaksanaan Magang\nNama Proyek / Kegiatan Magang\nPosisi dalam Proyek\nNO\nRincian Tugas Magang\nWaktu Pelaksanaan\nSurabaya, ..\nMahasiswa peserta magang (.........\n........)\nBuku Petunjuk Teknis Magang\n69', 'b. Manual pelaksanaan standar  \nc. Manual evaluasi standar  \nd. Manual pengendalian pelaksnanaan standar  \ne. Manual peningkatan standar  \n3. Rincian tentang hal yang harus dikerjakan  \n4. Pihak yang bertanggung jawab mengerjakan sesuatu  \n5. Uraian tentang pekerjaan yang harus dilaksanakan sesuai manual  \n6. Uraian tentang bagaimana pekerjaan itu harus dilaksanakan  \n7. Rincian formulir / borang / proforma yang harus dibuat dan digunakan sebagai \nbagian dari manual MBKM  \n8. Rincian sarana yang digunakan sesuai petunjuk dalam manual  \n \n 19 Dokumen Panduan Baku Mutu Pelaksanaan MBKM - 2021  \n 2.3 Evaluasi  MBKM  \nEvaluasi MBKM dilakukan oleh organ mutu di masing -masing pelaksana MBKM, dalam \nwaktu setiap semester minimal 1 (satu) kali. Evaluasi dilakukan terhadap:  \na. Perencanaan bentuk MB KM, yang direncanakan oleh mahasiswa bersama dosen \nwali. Perencanaan terhadap unsur: (i) Waktu dan lama waktu pelaksanaan MBKM,', 'Sudah menyelesaikan segala pekerjaan terkait KP di perusahaan dan sudah kembali aktif di kampus\nMenemui dosen pembimbing untuk melakukan ujian lisan dan menyerahkan Formulir Penilaian Ujian Lisan Kerja Praktik untuk diisi oleh dosen pembimbing internal\nDosen pembimbing internal mengirimkan nilai ke koordinator KP via email\nJika nilai telah diterima koordinator KP, maka status KP akan menjadi FINISHED\nMenyerahkan Laporan KP\nSudah menyelesaikan segala urusan KP dengan dosen pembimbing\nDokumentasi KP sudah disetujui dan ditandatangani oleh dosen pembimbing\nDokumentasi tersebut berupa softcopy dan diunggah ke repo ITS (lihat manual unggah ke repo ITS di manual unggah mandiri)\nMenerima Bukti Penyerahan KP dari REPO ITS\nMengunggah buku KP dan bukti terima repo ITS ke MS TEAMS KP pada link berikut:\nhttps://teams.microsoft.com/l/team/19%3a447977fe03c040ff98ad9e82e63982e2%40thread.tacv2/conversations?groupId=862aa22c-c596-49e1-94dd-6354fd625a2e&tenantId=1d5169ac-c7cb-4275-9764-bf8c9c364a4c', '2\nKesungguhan melaksanakan Kerja Praktek\n15\n\n\n3\nDisiplin dalam menyelesaikan pekerjaan\n\n\n\n4\nTanggung jawab\n15\n\n\n5\nKeahlian / Keterampilan dalam Berprofesi\n20\n\n\n6\nKreatifitas / Inovasi\n15\n\n\n7\nSikap dan Perilaku dalam Bekerja\n\n\n\n8\nKemampuan Bekerjasama Dalam Tim\n5\n\n\nJUMLAH\n100\n\n\nNILAI AKHIR =\nJUMLAH (B X N)\nJUMLAH BOBOT\n100\nSurabaya,\nDosen Pembimbing Magang\n66\nLampiran\n\n• LAMPIRAN 5: Form Penilaian Magang (Pembimbing Lapangan)\nLEMBAR PENILAIAN KINERJA MAGANG\nSemester Magang :.... Tahun Akademik 20.../20...\nNama Mahasiswa\nNRP\nDepartemen\nNama Pembimbing Lapangan\nNo HP\nNama Perusahaan Mitra Magang\nWaktu Pelaksanaan Magang\nNama Proyek/ Kegiatan Magang\nNO\nASPEK YANG DINILAI\nBOBOT (B)\nNILAI (N)\n(0-100)\nJUMLAH\n(B XN)\n1\nKehadiran\n10\n\n\n2\nKesungguhan melaksanakan Kerja Praktek\n15\n\n\n3\nDisiplin dalam menyelesaikan pekerjaan\n10\n\n\n4\nTanggung jawab\n15\n\n\n5\nKeahlian / Keterampilan dalam Berprofesi\n20\n\n\n6\nKreatifitas / Inovasi\nST\n\n\n7\nSikap dan Perilaku dalam Bekerja\n10']",Saya tidak tahu.
4,Apa durasi maksimal magang menurut peraturan rektor?,Maksimal 6 bulan,"['Pasal 4\n Mahasiswa     dalam pelaksanaan magang harus        memenuhi ketentuan\n sebagai berikut:\n a. Magang memiliki durasi minimal 3 bulan sampai maksimal 6 bulan\n     dalam 1 periode;\n b. mahasiswa wajib dibimbing oleh pembimbing internal dari dosen ITS\n     dan pembimbing eksternal dari pihak industri;\n c. selama magang mahasiswa secara penuh waktu bekerja di lapangan\n     sesuai kesepakatan;\n d. mahasiswa dapat mendapatkan ijin untuk melakukan kegiatan\n     akademik tertentu, melalui pembicaraan dan kesepakatan dengan\n     pihak industri;\n e. pada waktu pelaksanaan magang, mahasiswa tidak harus cuti;\n f. industri yang menawarkan magang dapat memberikan sertifikat\n     kompetensi dengan syarat dan ketentuan tertentu; dan\n g. sebelum    kegiatan     magang    dilaksanakan    harus   ada   nota\n     kesepahaman dan perjanjian kerja sama.\n\n\n                                  Pasal II\nPeraturan Rektor ini mulai berlaku pada tanggal ditetapkan.', 'sesuai dengan kesepakata n tempat magang;  \n(ii) Mahasiswa yang melaksanakan magang dapat melakukan kegiatan praktek / kolaborasi \nriset / kerja sama pengembangan industri / bentu k kegiatan  lain  yang selaras dengan \nCPL’   \n(iii) Mahasiswa yang melaksanakan magang wajib  dibimbing oleh pembimbing internal dari \ndosen ITS dan  pembimbing eksternal dari pihak  instansi / lembaga /  industri  tempat \nmagang ;  \n(iv) Mahasiswa yang melaksanakan magang dapat melakukan kegiatan akademik yang lain \ndengan syarat telah mendapatkan ijin dari pihak penanggung jawab lembaga / badan / \nindustri magang ;  \n(v) Mahasiswa pada waktu melaksanaan magang  tidak harus cuti  studi ;  \n(vi) Mahasiswa yang melaksa nakan magang dapat diberi  memberikan surat keterangan \nhasil kegiatan magang / sertifikat kompetensi  dari lembaga / badan / industri letak \nmagang sesuai dengan ketentuan yang berlaku;  \n 9 Dokumen Panduan Baku Mutu Pelaksanaan MBKM - 2021  \n NO ELEMEN PENILAIAN  INDIKATOR  \n(1) (2) (3)', 'NO ELEMEN PENILAIAN  INDIKATOR  \n(1) (2) (3) \natau kombinasi keduanya  \n6 Standar Proses – Tempat \npelaksanaan MBKM  Tempat k egiatan MB – KM dapat dilaksanakan di luar Program Studi baik yang ada di internal \nITS maupun di luar ITS . \n7 Standar Proses –  \nLama waktu pelaksanaan \nMBKM  Lama waktu pelaksanaan MBKM, dapat dikonvesi ke MK, dengan syarat:  \ni. Lama kegiatan belajar dapat dikonversi ke dalam sks adalah minimal 2720 menit atau \n45.3 jam.  \nii. Lama kegiatan bentuk MBKM dihitung atas waktu untuk:  (a) persiapan  di tempat \nMBKM , (b) pelaksanaan, (c) penilaian, dan  (d)  pelaporan.  \niii. Lama waktu kegiatan MB -KM bentuk magang, minimal 3 bulan dan maksimal 6 bulan.  \n8 Standar Proses –  \nKegiatan akademik selama  \nMBKM  – bentuk magang  (i) Mahasiswa yang melaksakan magang harus bekerja di lapangan secara penuh waktu \nsesuai dengan kesepakata n tempat magang;  \n(ii) Mahasiswa yang melaksanakan magang dapat melakukan kegiatan praktek / kolaborasi', 'APA SAJA SYARAT DAN KETENTUAN UNTUK JENIS MAGANG MBKM ?\n\n1. Mahasiswa aktif ITS tingkat Sarjana dan Diploma\n2. Minimal mahasiswa sudah lulus 90 SKS atau sudah lulus semester 5.\n3. Mahasiswa tidak diperkenankan mengambil Program Kegiatan Magang (BKP)\nMBKM yang sama lebih dari 1 kali.\n4. Mahasiswa WAJIB melakukan konversi alih kredit ke SKS MK.\n5. Mahasiswa/Departemen WAJIB membuat/memiliki surat PKS.\n6. Pelaksanaan Magang sebelum minggu ke-3 perkuliahan di ITS.\n7. Mahasiswa tidak diperkenankan mengambil MK, atau hanya diperkenankan\nmengambil maks. 3 MK (setara 10 SKS).\n8. Pelaksanaan Magang selama 3 – 6 bulan.\n\nAPA SAJA\nSYARAT DAN\nKETENTUAN\nUNTUK JENIS\nMAGANG\nNON-MBKM']",Durasi maksimal magang menurut peraturan rektor adalah 6 bulan dalam 1 periode.
5,Apa itu MB-KM di ITS?,Merdeka Belajar - Kampus Merdeka di Institut Teknologi Sepuluh Nopember,"['13. Merdeka Belajar - Kampus Merdeka yang selanjutnya disingkat MB - KM adalah kebijakan Menteri Pendidikan dan Kebudayaan, yang bertujuan mendorong mahasiswa untuk menguasai berbagai keilmuan yang berguna untuk memasuki dunia kerja dengan memberikan kesempatan bagi mahasiswa untuk memilih mata kuliah yang akan mereka ambil.\r\n14. Kurikulum ITS adalah seperangkat rencana dan pengaturan mengenai capaian pembelajaran lulusan, bahan kajian, proses, dan penilaian yang digunakan sebagai pedoman penyelenggaraan program studi di ITS.\r\n15. Pembelajaran adalah proses interaksi mahasiswa dengan dosen dan sumber belajar pada suatu lingkungan belajar.\r\n16. Tahap Persiapan adalah tahap pembelajaran yang dijadwalkan dalam dua semester pertama pada kurikulum Program Sarjana atau dua paket semester pertama pada kurikulum Program Sarjana Terapan.', 'a. Perencanaan bentuk MB KM, yang direncanakan oleh mahasiswa bersama dosen \nwali. Perencanaan terhadap unsur: (i) Waktu dan lama waktu pelaksanaan MBKM, \n(ii) bentuk MBKM, (iii) kesesuaian bentuk MBKM dengan target perncapaian CPL, \n(iv) luaran dari pelaksanaan MBKM,  \nb. Pelaksanaan pe nilaian dapat dilakukan pada proses dan hasil MBKM dengan \nmenggunakan prinsip, teknik , instrumen dan waktu asesmen proses dan hasil \nMBKM.  Penilaian menggunakan prinsip edukatif, otentik, objektif, akuntabel, dan \ntransparan yang dilakukan secara terintegrasi . Teknik penilaian dapat \nmenggunakan satu atau lebih dari kombinasi berikut ini: observasi, partisipasi, \nunjuk kerja, tes tertulis, tes lisan, dan angket . Instrumen penilaian dapat \ndigunakan satu atau kombinasi dari: rubrik dan atau portofolio.   \nc. Jumlah penilaian terhadap pelaksanaan MBKM minimal sebanyak 4 (empat).  \nd. Pelaporan terhadap proses dan hasil penilaian dilakukan oleh Dosen pembimbing \nakademik dalam pelaksanaan MBKM.', 'Penelitian  (i) Kegiatan MBKM dalam bentuk penelitian /riset  dimaksudkan untuk mencapai CPL . \n(ii) Kegiatan MBKM dalam bentuk penelitian/ riset ditujukan untuk membangun dan \nmenerapkan cara berfikir logis, kritis,  sistematis, dalam konsteks pengembangan atau \nimplementasi ilmu pengetahuan dan teknologi yang memperhatikan dan menerapkan \nnilai humaniora yang sesuai dengan bidang kea hliannya , atau berkontribusi untuk \nmemecahkan permasalahan dan mendukung kepentingan nasional . \n(iii) Kegiatan MBKM dalam bentuk penelitian / riset dapat dilakukan di lembaga riset / pusat \nstudi / program studi melalui skema kerjasama.  \n(iv) Kegiatan MBKM dalam bentuk  Studi/ Proyek dikembangkan oleh Direktorat yang 11 Dokumen Panduan Baku Mutu Pelaksanaan MBKM - 2021  \n NO ELEMEN PENILAIAN  INDIKATOR  \n(1) (2) (3) \nmengurusi riset dan  pengabdian kepada masyarakat . \n(ix) Implementasi MBKM dalam bentuk penelitian/ riset dikembangkan dan dikoordin ir oleh', 'NO ELEMEN PENILAIAN  INDIKATOR  \n(1) (2) (3) \nmengurusi riset dan  pengabdian kepada masyarakat . \n(ix) Implementasi MBKM dalam bentuk penelitian/ riset dikembangkan dan dikoordin ir oleh \nDirektorat yang mengurusi riset dan pengabdian kepada masyarakat  bersama Prodi \nterkait ,  melalui tahapan kegiatan (a) persiapan, (b) Pelaksanaan, (c) Evaluasi, (d) \nPengendalian, dan (e) Peningkatan.  \n \n12 Standar Proses –  \nKegiatan MBKM – bentuk \nKewirausahaan  (i) Kegiatan MBKM dalam bentuk wirausaha  dimaksudkan untuk mendukung pencapaian \nprofil sebagai kader pengusaha yang mendukung perkembangan ITS di masa \nmendatang . \n(ii) Kegiatan MBKM dalam bentuk wirausaha  dapat dikonversi ke dalam sks MK sesuai \ndengan ketercapaian CPL atau bentuk lain  \n(iii) Kegiatan MBKM da lam bentuk wirausaha  dikembangkan oleh Direktorat yang \nmengurusi Kemahasiswaan.  \n(x) Implementasi  Kegiatan MBKM dalam bentuk wirausaha  dikoordinir oleh Direktorat']",MB-KM di ITS adalah singkatan dari Merdeka Belajar - Kampus Merdeka. Ini adalah kebijakan Menteri Pendidikan dan Kebudayaan yang bertujuan untuk mendorong mahasiswa untuk menguasai berbagai keilmuan yang berguna untuk memasuki dunia kerja dengan memberikan kesempatan bagi mahasiswa untuk memilih mata kuliah yang akan mereka ambil.
6,Apa saja bentuk kegiatan pembelajaran yang termasuk dalam MB-KM?,"Magang/Praktik Kerja, Membangun Desa/Kuliah Kerja Nyata Tematik, Pertukaran Pelajar, Proyek Kemanusiaan, Penelitian/Riset, Kegiatan Wirausaha, Studi/Proyek Independen, dan Asistensi Mengajar di Satuan Pendidikan.","['kegiatan (a) persiapan, (b) Pelaksanaa n, (c) Evaluasi, (d) Pengendalian, dan (e) \nPeningkatan  \n Standar Proses –  \nKegiatan MBKM – Bentuk \nMagang / Praktik Kerja dan \nWirausaha lingkup Hilirisasi  (i) Kegiatan MBKM dalam bentuk Magang/ Praktik Kerja dan Kegiatan Wirausaha Lingkup \nHilirisasi ditujukan untuk  memperlancar karir lulusan, pengayaan kompetensi \nmahasiswa, kolaborasi magang, wirausaha dan kerja sama pengembangan produk \ninovatif  dalam rangka meraih profil lulusan sebagai  inovator yang produktif.  \n(ii) Kegiatan MBKM dalam bentuk magang/ praktik kerja dan kegiatan wirausaha hilirisasi \ndapat berupa kegiatan penelitian dan pengabdian masyarakat bersama civitas \nakademika yang lain untuk memecahkan persoalan di masyarakat atau indust ri, inkubasi \ndan start -up.  \n(iii) Kegiatan MBKM dalam bentuk magang/ praktik kerja dan kegiatan wirausaha hilirisasi \ndikembangkan oleh  Direktorat yang mengurusi inovasi dan kawasan sains teknologi', 'NO ELEMEN PENILAIAN  INDIKATOR  \n(1) (2) (3) \natau kombinasi keduanya  \n6 Standar Proses – Tempat \npelaksanaan MBKM  Tempat k egiatan MB – KM dapat dilaksanakan di luar Program Studi baik yang ada di internal \nITS maupun di luar ITS . \n7 Standar Proses –  \nLama waktu pelaksanaan \nMBKM  Lama waktu pelaksanaan MBKM, dapat dikonvesi ke MK, dengan syarat:  \ni. Lama kegiatan belajar dapat dikonversi ke dalam sks adalah minimal 2720 menit atau \n45.3 jam.  \nii. Lama kegiatan bentuk MBKM dihitung atas waktu untuk:  (a) persiapan  di tempat \nMBKM , (b) pelaksanaan, (c) penilaian, dan  (d)  pelaporan.  \niii. Lama waktu kegiatan MB -KM bentuk magang, minimal 3 bulan dan maksimal 6 bulan.  \n8 Standar Proses –  \nKegiatan akademik selama  \nMBKM  – bentuk magang  (i) Mahasiswa yang melaksakan magang harus bekerja di lapangan secara penuh waktu \nsesuai dengan kesepakata n tempat magang;  \n(ii) Mahasiswa yang melaksanakan magang dapat melakukan kegiatan praktek / kolaborasi', '(4) Kegiatan MBKM – dalam bentuk pertukaran pelajar melalui MK di prodi di luar ITS, \ndengan ketentuan jumlah sks maksimal adalah 20 (dua puluh) sks, yang meliputi mata \nkuliah inti dan mata kuliah non inti.  \nIII STANDAR PROSES PEMBELAJARAN  \n5 Standar Proses –bentuk \npembelajaran MBKM  (i) Mahasiswa dapat melaksanakan kegiatan pembelajaran MBKM dalam rangka meraih CPL \nProdi dalam bentuk satu atau lebih bentuk berikut ini:  \na. Magang/ Praktik Kerja;  \nb. Membangun Desa/ Kuliah Kerja Nyata Tematik;  \nc. Pertukaran Pelajar;  \nd. Proyek Kemanusiaan;  \ne. Penelitian/ Riset;  \nf. Kegiatan Wirausaha;  \ng. Studi/ Proyek Independen; dan  \nh. Asistensi Mengajar di Satuan Pendidikan  \n(ii)  Pelaksanaan MB -KM bentuk (a) sd (h) dapat dilaksanakan dalam bentuk  online, offline 8 Dokumen Panduan Baku Mutu Pelaksanaan MBKM - 2021  \n NO ELEMEN PENILAIAN  INDIKATOR  \n(1) (2) (3) \natau kombinasi keduanya  \n6 Standar Proses – Tempat', '(3) Kegiatan magang/ praktik kerja pada program sarjana terapan diimplementasikan dalam bentuk mata kuliah wajib yang merupakan mata kuliah penciri Fakultas Vokasi sebesar 14 (empat belas) sks.\r\n(4) Kegiatan magang/ praktik kerja pada program sarjana dapat dikonversikan menjadi:\r\na. sks kerja praktek; atau\r\n\r\nb. sks satu atau beberapa mata kuliah yang memiliki Capaian Pembelajaran Mata Kuliah (CPMK) sama dengan magang; atau\r\nc. sks gabungan antara kerja praktek dengan mata kuliah yang memiliki CPMK sama dengan magang atau mata kuliah magang dengan total maksimal 20 (dua puluh) sks.\r\n(5) Persyaratan mahasiswa yang dapat mengikuti kegiatan magang di Program Studi yang belum memiliki mata kuliah magang adalah mahasiswa sudah lulus 72 (tujuh puluh dua sks.\r\n(6) Mekanisme dan penyelenggaraan kegiatan magang/ praktik kerja dikembangkan dan dikoordinasikan oleh Direktorat yang mengurusi kemahasiswaan.']","Bentuk kegiatan pembelajaran yang termasuk dalam MB-KM adalah:
1. Magang/Praktik Kerja
2. Membangun Desa/Kuliah Kerja Nyata Tematik
3. Pertukaran Pelajar
4. Proyek Kemanusiaan
5. Penelitian/Riset
6. Kegiatan Wirausaha
7. Studi/Proyek Independen
8. Asistensi Mengajar di Satuan Pendidikan

Selain itu, pelaksanaan MB-KM dapat dilakukan dalam bentuk online maupun offline."
7,Kapan pelaksanaan kegiatan pengabdian kepada masyarakat dapat dilakukan dalam program sarjana di ITS?,Pada semester 6 dan 7.,"['(4) Pelaksanaan kegiatan pengabdian kepada masyarakat adalah pada semester 6 (enam) dan 7 (tujuh).\r\n(5) Pelaksanaan kegiatan pengabdian kepada masyarakat dapat dilaksanakan sebelum semester 6 (enam) dan 7 (tujuh) tetapi sudah lulus tahap persiapan dengan menggunakan sistem tabung nilai.\r\n(6) Mekanisme dan penyelenggaraan kegiatan pengabdian kepada masyarakat dikembangkan dan dikoordinasikan oleh Direktorat yang mengurusi riset dan pengabdian kepada masyarakat.\r\n(7) Direktorat yang mengurusi riset dan pengabdian kepada masyarakat dalam menyelenggarakan kegiatan pengabdian kepada masyarakat sebagaimana dimaksud pada ayat (6) berkoordinasi dengan Program Studi terkait.\r\n\r\nBagian Ketiga\r\nPertukaran Pelajar/ Kuliah Lingkup Dalam Negeri\r\n\r\nPasal 7', '(v) Bentuk kegiatan pengabdian kepada masyarakat merupakan salah satu bentuk 7 Dokumen Panduan Baku Mutu Pelaksanaan MBKM - 2021  \n NO ELEMEN PENILAIAN  INDIKATOR  \n(1) (2) (3) \nimplementasi MK pengayaan dengan bobot 3 (tiga) sks.  \n \n4 Standar Isi  – Pengakuan bobot \nsks (1) Jumlah sks maksimal yang dapat diambil dalam rangka pelaksanaan kegiatan MB – KM \nadalah 40 (empat puluh) sks.  \n(2) Kegiatan magang/ praktik kerja pada program sarjana terapan diimplementasikan dalam \nbentuk mata kuliah wajib sebagai  mata kuliah penciri Fakultas  Vokasi sebesar 14 (empat \nbelas) sks.  \n(3) Konversi kegiatan MB -KM magang dapat dikonversikan ke dalam: (i) MK KP,  \n(ii) beberapa MK gabungan antara KP dengan MK lain dengan kesamaan CP MK,  \n(iii) MK magang dengan maksimum bobot 20 (dua puluh) sks.   \n(4) Kegiatan MBKM – dalam bentuk pertukaran pelajar melalui MK di prodi di luar ITS, \ndengan ketentuan jumlah sks maksimal adalah 20 (dua puluh) sks, yang meliputi mata', 'h. Asistensi Mengajar di Satuan Pendidikan.\r\n(3) Dalam hal ada penambahan dan atau perubahan BKP MBKM sebagaimana dimaksud pada ayat (2) ditetapkan melalui Keputusan Rektor.\r\n(4) Kegiatan Membangun Desa/ Kuliah Kerja Nyata Tematik sebagaimana dimaksud pada ayat (2) huruf b dan Proyek Kemanusiaan sebagaimana dimaksud pada ayat (2) huruf d diwujudkan melalui kegiatan pengabdian kepada masyarakat.\r\n\r\n              BAB IV PELAKSANAAN KEGIATAN MB - KM\r\n\r\nPasal 4\r\n(1) Jumlah sks maksimal yang dapat diambil dalam rangka pelaksanaan kegiatan MB -\r\nKM adalah 40 (empat puluh) sks.\r\n(2) Kegiatan MB-KM hanya bisa dilaksanakan dengan:\r\na. Perguruan tinggi yang mempunyai rangking setara atau lebih tinggi dari ITS,\r\nb. Perguruan tinggi yang mempunyai MoU dengan ITS; atau\r\nc. Lembaga non perguruan tinggi yang mempunyai MoU dengan ITS.\r\n(3) Pelaksanaan transfer kegiatan MB - KM menjadi sks mata kuliah, program studi atau direktorat membentuk tim pelaksana transfer kredit.', '(6) Mekanisme dan penyelenggaraan kegiatan magang/ praktik kerja dikembangkan dan dikoordinasikan oleh Direktorat yang mengurusi kemahasiswaan.\r\n(7) Direktorat Kemahasiswaan dalam menyelenggarakan kegiatan magang/ praktik kerja sebagaimana dimaksud pada ayat (6) berkoordinasi dengan Program Studi terkait.\r\n\r\n         Bagian Kedua Pengabdian Kepada Masyarakat\r\n\r\nPasal 6\r\n(1) Kegiatan pengabdian kepada masyarakat ditujukan untuk pembinaan karakter kebangsaan mahasiswa khususnya untuk menumbuhkan kepedulian terhadap persoalan yang dihadapi masyarakat.\r\n(2) Kegiatan pengabdian kepada masyarakat pada program sarjana diimplementasikan dalam bentuk mata kuliah pengayaan sebesar 3 (tiga) sks.\r\n(3) Kegiatan pengabdian kepada masyarakat pada program sarjana terapan, dapat diambil untuk tambahan sks atau dapat dikompensasi dengan mata kuliah Program Studi yang memiliki capaian pembelajaran yang setara.']","Pelaksanaan kegiatan pengabdian kepada masyarakat dalam program sarjana di ITS dapat dilakukan pada semester 6 (enam) dan 7 (tujuh). Namun, kegiatan pengabdian kepada masyarakat juga dapat dilaksanakan sebelum semester 6 (enam) dan 7 (tujuh) asalkan mahasiswa sudah lulus tahap persiapan dengan menggunakan sistem tabung nilai."
8,Apa fungsi dari Tim MB-KM ITS?,"Memfasilitasi implementasi kegiatan MB-KM di ITS, termasuk membuat prosedur operasional baku, dokumen teknis, penjaminan mutu, sistem aplikasi dan hal lainnya.","['NO ELEMEN PENILAIAN  INDIKATOR  \n(1) (2) (3) \nmengurusi riset dan  pengabdian kepada masyarakat . \n(ix) Implementasi MBKM dalam bentuk penelitian/ riset dikembangkan dan dikoordin ir oleh \nDirektorat yang mengurusi riset dan pengabdian kepada masyarakat  bersama Prodi \nterkait ,  melalui tahapan kegiatan (a) persiapan, (b) Pelaksanaan, (c) Evaluasi, (d) \nPengendalian, dan (e) Peningkatan.  \n \n12 Standar Proses –  \nKegiatan MBKM – bentuk \nKewirausahaan  (i) Kegiatan MBKM dalam bentuk wirausaha  dimaksudkan untuk mendukung pencapaian \nprofil sebagai kader pengusaha yang mendukung perkembangan ITS di masa \nmendatang . \n(ii) Kegiatan MBKM dalam bentuk wirausaha  dapat dikonversi ke dalam sks MK sesuai \ndengan ketercapaian CPL atau bentuk lain  \n(iii) Kegiatan MBKM da lam bentuk wirausaha  dikembangkan oleh Direktorat yang \nmengurusi Kemahasiswaan.  \n(x) Implementasi  Kegiatan MBKM dalam bentuk wirausaha  dikoordinir oleh Direktorat', '(3) Tim MB-KM ITS ditetapkan melalui Keputusan Rektor.\r\n\r\n        BAB V KETENTUAN PENUTUP\r\n\r\nPasal 16\r\nPada saat Peraturan Rektor ini mulai berlaku, maka Peraturan Rektor Institut Teknologi Sepuluh Nopember Nomor 30 Tahun 2020 tentang Penyelenggaraan Kegiatan Merdeka Belajar - Kampus Merdeka Di Institut Teknologi Sepuluh Nopember dicabut dan dinyatakan tidak berlaku.\r\n\r\nPasal 17\r\nPeraturan Rektor ini mulai berlaku pada tanggal ditetapkan.\r\n\r\n\r\nDitetapkan di Surabaya\r\npada tanggal 12 Oktober 2021\r\nREKTOR INSTITUT TEKNOLOGI SEPULUH NOPEMBER,\r\n\r\n\r\n\r\n\r\nMOCHAMAD ASHARI\r\nNIP 196510121990031003', 'a. Perencanaan bentuk MB KM, yang direncanakan oleh mahasiswa bersama dosen \nwali. Perencanaan terhadap unsur: (i) Waktu dan lama waktu pelaksanaan MBKM, \n(ii) bentuk MBKM, (iii) kesesuaian bentuk MBKM dengan target perncapaian CPL, \n(iv) luaran dari pelaksanaan MBKM,  \nb. Pelaksanaan pe nilaian dapat dilakukan pada proses dan hasil MBKM dengan \nmenggunakan prinsip, teknik , instrumen dan waktu asesmen proses dan hasil \nMBKM.  Penilaian menggunakan prinsip edukatif, otentik, objektif, akuntabel, dan \ntransparan yang dilakukan secara terintegrasi . Teknik penilaian dapat \nmenggunakan satu atau lebih dari kombinasi berikut ini: observasi, partisipasi, \nunjuk kerja, tes tertulis, tes lisan, dan angket . Instrumen penilaian dapat \ndigunakan satu atau kombinasi dari: rubrik dan atau portofolio.   \nc. Jumlah penilaian terhadap pelaksanaan MBKM minimal sebanyak 4 (empat).  \nd. Pelaporan terhadap proses dan hasil penilaian dilakukan oleh Dosen pembimbing \nakademik dalam pelaksanaan MBKM.', '(vii) Implementasi  Kegiatan MBKM dalam bentuk  Studi/  Proyek  dikoordinir oleh  Direktorat \nyang mengurusi kemahasiswaan  bersama Prodi terkait , melalui tahapan  kegiatan (a) \npersiapan, (b) Pelaksanaan, (c) Evaluasi, (d) Pengendalian, dan (e) Peningkatan.  \n \n14 Standar Proses –  \nKegiatan MBKM – Bentuk \nAsistensi Mengajar di Satuan \nPendidikan  (i) Kegiatan MBKM dalam bentuk asistensi mengajar di satuan pendidikan ditujukan untuk \nmemberikan kesempatan bagi mahasiswa yang memiliki minat dalam bidang pendidikan \ndalam rangka meraih profil sebagai pendidik , dan  membantu meningkatkan \npemerataan kualitas pendidikan  yang relevan dengan pendidikan tinggi dan \nperkembangan zaman . \n(ii) Kegiatan MBKM dalam bentuk asistensi mengajar  dilakukan di satuan pendidikan dasar \ndan menengah ,   \n(iii) Kegiatan MBKM dalam bentuk asistensi mengajar di satuan pendidikan , merupakan \nkegiatan dalam bentuk: bantuan mengajar, tutorial, bimbingan teknis, pelatihan dan']","Tim MB-KM ITS ditetapkan melalui Keputusan Rektor. Tim ini memiliki fungsi untuk mengkoordinasikan kegiatan MBKM dalam berbagai bentuk, seperti riset, pengabdian kepada masyarakat, wirausaha, studi/proyek, dan asistensi mengajar. Tim ini bertanggung jawab dalam tahapan kegiatan MBKM, yaitu persiapan, pelaksanaan, evaluasi, pengendalian, dan peningkatan."
9,Apa tujuan penjaminan mutu MBKM?,Untuk meningkatkan kompetensi lulusan dengan soft skills dan hard skills.,"['meingimplementasi MBKM, dengan tujuan:  \n(i) Melakukan pengukuran ketercapaian CPL untuk masing -masing bentuk \nMBKM.  \n(ii) Melakukan penilaian dan evaluasi atas proses dan hasil kegiatan MBKM  \n(iii) Melakukan pengendalian proses implementasi MBKM  \n(iv) Melakukan peningkatan impleme ntasi MBKM, atas hasil survey kepuasan \npihak internal dan eksternal stakeholder yang terlibat di dalam implementasi \nMBKM.    \n \n \n \n 21 Baku Mutu - MBKM   - 2021', '• BAB 5. REFLEKSI DIRI\n• Mahasiswa mendeskripsikan tentang hal-hal positif yang diterima selama perkuliahan yang bermanfaat / relevan terhadap pekerjaan selama magang.\n• Mahasiswa menjelaskan tentang manfaat magang terhadap pengembangan soft-skills dan kekurangan soft-skills yang dimilikinya.\n• Mahasiswa memberikan penjabaran tentang manfaat magang terhadap pengembangan kemampuan kognitif dan kekurangan kemampuan kognitif yang dimilikinya.\nBuku Petunjuk Teknis Magang\n49', 'NO ELEMEN PENILAIAN  INDIKATOR  \n(1) (2) (3) \nmengurusi riset dan  pengabdian kepada masyarakat . \n(ix) Implementasi MBKM dalam bentuk penelitian/ riset dikembangkan dan dikoordin ir oleh \nDirektorat yang mengurusi riset dan pengabdian kepada masyarakat  bersama Prodi \nterkait ,  melalui tahapan kegiatan (a) persiapan, (b) Pelaksanaan, (c) Evaluasi, (d) \nPengendalian, dan (e) Peningkatan.  \n \n12 Standar Proses –  \nKegiatan MBKM – bentuk \nKewirausahaan  (i) Kegiatan MBKM dalam bentuk wirausaha  dimaksudkan untuk mendukung pencapaian \nprofil sebagai kader pengusaha yang mendukung perkembangan ITS di masa \nmendatang . \n(ii) Kegiatan MBKM dalam bentuk wirausaha  dapat dikonversi ke dalam sks MK sesuai \ndengan ketercapaian CPL atau bentuk lain  \n(iii) Kegiatan MBKM da lam bentuk wirausaha  dikembangkan oleh Direktorat yang \nmengurusi Kemahasiswaan.  \n(x) Implementasi  Kegiatan MBKM dalam bentuk wirausaha  dikoordinir oleh Direktorat', 'b) Menjadi   sarana bagi perguruan tinggi dalam membentuk jejaring atau mitra \nstrategis dalam membantu pembangunan desa.\nc)  Menjadi sarana pengembangan tri dharma perguruan tinggi.\nd)  Menjadi sarana aktualisasi dosen dalam pengembangan ilmu pengetahuan.\n3) Bagi Desa\na) Memperoleh bantuan pemikiran dan tenaga dari tenaga terdidik untuk \nmenyusun Rencana Pembangunan Jangka Menengah Desa (RPJMDes) dan \nRencana Kegiatan Pembangunan Desa (RKPDes).\nb) Membantu perubahan/perbaikan tata kelola desa.  \nc)  Memacu terbentuknya tenaga muda yang diperlukan dalam pemberdayaan \nmasyarakat desa\nd)  Membantu pengayaan wawasan masyarakat terhadap pembangunan desa.\ne) Percepatan pembangunan di wilayah pedesaan.\nSelain persyaratan umum yang terdapat pada pelaksanaan kebijakan Merdeka Belajar \n- Kampus Merdeka di atas, untuk kegiatan KKNT terdapat persyaratan tambahan \nyang harus dipenuhi oleh mahasiswa, yaitu:\n1) Mahasiswa telah menyelesaikan proses pembelajaran setelah  semester 6.']","Tujuan penjaminan mutu MBKM adalah:
(i) Melakukan pengukuran ketercapaian CPL untuk masing-masing bentuk MBKM.
(ii) Melakukan penilaian dan evaluasi atas proses dan hasil kegiatan MBKM.
(iii) Melakukan pengendalian proses implementasi MBKM.
(iv) Melakukan peningkatan implementasi MBKM, atas hasil survey kepuasan pihak internal dan eksternal stakeholder yang terlibat di dalam implementasi MBKM."
10,Apa tujuan dari MBKM?,"Untuk menghasilkan lulusan yang berkualitas dan memenuhi visi, misi, tata nilai, dan tujuan ITS serta memenuhi SN-DIKTI.","['meingimplementasi MBKM, dengan tujuan:  \n(i) Melakukan pengukuran ketercapaian CPL untuk masing -masing bentuk \nMBKM.  \n(ii) Melakukan penilaian dan evaluasi atas proses dan hasil kegiatan MBKM  \n(iii) Melakukan pengendalian proses implementasi MBKM  \n(iv) Melakukan peningkatan impleme ntasi MBKM, atas hasil survey kepuasan \npihak internal dan eksternal stakeholder yang terlibat di dalam implementasi \nMBKM.    \n \n \n \n 21 Baku Mutu - MBKM   - 2021', 'Penelitian  (i) Kegiatan MBKM dalam bentuk penelitian /riset  dimaksudkan untuk mencapai CPL . \n(ii) Kegiatan MBKM dalam bentuk penelitian/ riset ditujukan untuk membangun dan \nmenerapkan cara berfikir logis, kritis,  sistematis, dalam konsteks pengembangan atau \nimplementasi ilmu pengetahuan dan teknologi yang memperhatikan dan menerapkan \nnilai humaniora yang sesuai dengan bidang kea hliannya , atau berkontribusi untuk \nmemecahkan permasalahan dan mendukung kepentingan nasional . \n(iii) Kegiatan MBKM dalam bentuk penelitian / riset dapat dilakukan di lembaga riset / pusat \nstudi / program studi melalui skema kerjasama.  \n(iv) Kegiatan MBKM dalam bentuk  Studi/ Proyek dikembangkan oleh Direktorat yang 11 Dokumen Panduan Baku Mutu Pelaksanaan MBKM - 2021  \n NO ELEMEN PENILAIAN  INDIKATOR  \n(1) (2) (3) \nmengurusi riset dan  pengabdian kepada masyarakat . \n(ix) Implementasi MBKM dalam bentuk penelitian/ riset dikembangkan dan dikoordin ir oleh', '13. Merdeka Belajar - Kampus Merdeka yang selanjutnya disingkat MB - KM adalah kebijakan Menteri Pendidikan dan Kebudayaan, yang bertujuan mendorong mahasiswa untuk menguasai berbagai keilmuan yang berguna untuk memasuki dunia kerja dengan memberikan kesempatan bagi mahasiswa untuk memilih mata kuliah yang akan mereka ambil.\r\n14. Kurikulum ITS adalah seperangkat rencana dan pengaturan mengenai capaian pembelajaran lulusan, bahan kajian, proses, dan penilaian yang digunakan sebagai pedoman penyelenggaraan program studi di ITS.\r\n15. Pembelajaran adalah proses interaksi mahasiswa dengan dosen dan sumber belajar pada suatu lingkungan belajar.\r\n16. Tahap Persiapan adalah tahap pembelajaran yang dijadwalkan dalam dua semester pertama pada kurikulum Program Sarjana atau dua paket semester pertama pada kurikulum Program Sarjana Terapan.', 'NO ELEMEN PENILAIAN  INDIKATOR  \n(1) (2) (3) \nmengurusi riset dan  pengabdian kepada masyarakat . \n(ix) Implementasi MBKM dalam bentuk penelitian/ riset dikembangkan dan dikoordin ir oleh \nDirektorat yang mengurusi riset dan pengabdian kepada masyarakat  bersama Prodi \nterkait ,  melalui tahapan kegiatan (a) persiapan, (b) Pelaksanaan, (c) Evaluasi, (d) \nPengendalian, dan (e) Peningkatan.  \n \n12 Standar Proses –  \nKegiatan MBKM – bentuk \nKewirausahaan  (i) Kegiatan MBKM dalam bentuk wirausaha  dimaksudkan untuk mendukung pencapaian \nprofil sebagai kader pengusaha yang mendukung perkembangan ITS di masa \nmendatang . \n(ii) Kegiatan MBKM dalam bentuk wirausaha  dapat dikonversi ke dalam sks MK sesuai \ndengan ketercapaian CPL atau bentuk lain  \n(iii) Kegiatan MBKM da lam bentuk wirausaha  dikembangkan oleh Direktorat yang \nmengurusi Kemahasiswaan.  \n(x) Implementasi  Kegiatan MBKM dalam bentuk wirausaha  dikoordinir oleh Direktorat']","Tujuan dari MBKM adalah:
1. Melakukan pengukuran ketercapaian CPL untuk masing-masing bentuk MBKM.
2. Melakukan penilaian dan evaluasi atas proses dan hasil kegiatan MBKM.
3. Melakukan pengendalian proses implementasi MBKM.
4. Melakukan peningkatan implementasi MBKM, berdasarkan hasil survey kepuasan pihak internal dan eksternal stakeholder yang terlibat di dalam implementasi MBKM."
11,Apa tujuan dari kegiatan magang/ praktik kerja?,"Memperlancar karir lulusan, pengayaan kompetensi mahasiswa, kolaborasi riset, dan kerja sama pengembangan industri.","['(3) Kegiatan magang/ praktik kerja pada program sarjana terapan diimplementasikan dalam bentuk mata kuliah wajib yang merupakan mata kuliah penciri Fakultas Vokasi sebesar 14 (empat belas) sks.\r\n(4) Kegiatan magang/ praktik kerja pada program sarjana dapat dikonversikan menjadi:\r\na. sks kerja praktek; atau\r\n\r\nb. sks satu atau beberapa mata kuliah yang memiliki Capaian Pembelajaran Mata Kuliah (CPMK) sama dengan magang; atau\r\nc. sks gabungan antara kerja praktek dengan mata kuliah yang memiliki CPMK sama dengan magang atau mata kuliah magang dengan total maksimal 20 (dua puluh) sks.\r\n(5) Persyaratan mahasiswa yang dapat mengikuti kegiatan magang di Program Studi yang belum memiliki mata kuliah magang adalah mahasiswa sudah lulus 72 (tujuh puluh dua sks.\r\n(6) Mekanisme dan penyelenggaraan kegiatan magang/ praktik kerja dikembangkan dan dikoordinasikan oleh Direktorat yang mengurusi kemahasiswaan.', '2\nKesungguhan melaksanakan Kerja Praktek\n15\n\n\n3\nDisiplin dalam menyelesaikan pekerjaan\n\n\n\n4\nTanggung jawab\n15\n\n\n5\nKeahlian / Keterampilan dalam Berprofesi\n20\n\n\n6\nKreatifitas / Inovasi\n15\n\n\n7\nSikap dan Perilaku dalam Bekerja\n\n\n\n8\nKemampuan Bekerjasama Dalam Tim\n5\n\n\nJUMLAH\n100\n\n\nNILAI AKHIR =\nJUMLAH (B X N)\nJUMLAH BOBOT\n100\nSurabaya,\nDosen Pembimbing Magang\n66\nLampiran\n\n• LAMPIRAN 5: Form Penilaian Magang (Pembimbing Lapangan)\nLEMBAR PENILAIAN KINERJA MAGANG\nSemester Magang :.... Tahun Akademik 20.../20...\nNama Mahasiswa\nNRP\nDepartemen\nNama Pembimbing Lapangan\nNo HP\nNama Perusahaan Mitra Magang\nWaktu Pelaksanaan Magang\nNama Proyek/ Kegiatan Magang\nNO\nASPEK YANG DINILAI\nBOBOT (B)\nNILAI (N)\n(0-100)\nJUMLAH\n(B XN)\n1\nKehadiran\n10\n\n\n2\nKesungguhan melaksanakan Kerja Praktek\n15\n\n\n3\nDisiplin dalam menyelesaikan pekerjaan\n10\n\n\n4\nTanggung jawab\n15\n\n\n5\nKeahlian / Keterampilan dalam Berprofesi\n20\n\n\n6\nKreatifitas / Inovasi\nST\n\n\n7\nSikap dan Perilaku dalam Bekerja\n10', 'kegiatan (a) persiapan, (b) Pelaksanaa n, (c) Evaluasi, (d) Pengendalian, dan (e) \nPeningkatan  \n Standar Proses –  \nKegiatan MBKM – Bentuk \nMagang / Praktik Kerja dan \nWirausaha lingkup Hilirisasi  (i) Kegiatan MBKM dalam bentuk Magang/ Praktik Kerja dan Kegiatan Wirausaha Lingkup \nHilirisasi ditujukan untuk  memperlancar karir lulusan, pengayaan kompetensi \nmahasiswa, kolaborasi magang, wirausaha dan kerja sama pengembangan produk \ninovatif  dalam rangka meraih profil lulusan sebagai  inovator yang produktif.  \n(ii) Kegiatan MBKM dalam bentuk magang/ praktik kerja dan kegiatan wirausaha hilirisasi \ndapat berupa kegiatan penelitian dan pengabdian masyarakat bersama civitas \nakademika yang lain untuk memecahkan persoalan di masyarakat atau indust ri, inkubasi \ndan start -up.  \n(iii) Kegiatan MBKM dalam bentuk magang/ praktik kerja dan kegiatan wirausaha hilirisasi \ndikembangkan oleh  Direktorat yang mengurusi inovasi dan kawasan sains teknologi', 'kepentingan yang dilakukan oleh organisasi tersebut (misalnya melalui produk atau jasa yang dihasilkan).\n• BAB 3. PELAKSANAAN MAGANG\n3.1. Posisi / Kedudukan Kegiatan Magang\n• Mahasiswa dapat menguraikan kedudukan / posisi kegiatan yang ditugaskan oleh mitra magang dalam lingkup pekerjaan / proyek keseluruhan. Hal ini dimaksudkan untuk mengetahui apakah mahasiswa memahami kaitan antara apa yang telah dilakukan / dihasilkan dengan pekerjaan tersebut.\n3.2. Metodologi penyelesaian Tugas\n• Mahasiswa menguraikan kasus / masalah menjadi topik pembahasan. Mahasiswa menganalisis kasus / masalah tersebut dengan menggunakan teori atau metode yang relevan. Analisis bukan mendeskripsikan teori, namun menggunakan teori guna menjelaskan dan membandingkan dengan kasus/masalah yang diangkat.\nUraian mengenai teori atau metode harus menyebutkan referensi yang valid dan handal.\n3.3. Pembelajaran Hal Baru']","Tujuan dari kegiatan magang/ praktik kerja adalah untuk memperlancar karir lulusan, mengaya kompetensi mahasiswa, kolaborasi magang, wirausaha, dan kerja sama pengembangan produk inovatif dalam rangka meraih profil lulusan sebagai inovator yang produktif. Selain itu, kegiatan magang/ praktik kerja juga bertujuan untuk memberikan pengalaman lapangan yang nyata kepada mahasiswa, memperluas jaringan profesional, serta mempersiapkan mahasiswa untuk masuk ke dunia kerja."
12,Apa yang dimaksud dengan PDDikti?,Pangkalan Data Perguruan Tinggi yang terintegrasi secara nasional.,"['Subdit. PK2\nSKEMA PELAKSANAAN\nPROGRAM MAGANG\nMANDIRI DI ITS\nMahasiswa / Departemen melakukan\nmenyertakan:\n1. Proposal Magang\n2. Surat Rekomendasi Departemen\n3. Surat Penerimaan Magang\nPelaksanaan Magang\nProses pengurusan\nPKS\nPKS tidak\ndisetujui\nPKS\nTertandatangan\nSelesai\nMagang berakhir <\nMahasiswa mendapatkan\nSertifikat / Penilaian Magang\nSelesai\nADVANCING HUMANITY\niTS\nMulai\nMahasiswa mengurus\nsurat rekomendasi\ndepartemen untuk pengajuan magang ke\nMitra\nMahasiswa mengajukan\npermohonan magang ke\nMitra\nMitra melakukan seleksi magang\nMahasiswa menerima hasil seleksi magang dari Mitra\nTidak diterima\nSelesai\nDiterima\nMahasiswa melaporkan\nke Departemen', '1.\n2.\n3.\nsubdit. PK2\n1\nPENUGASAN PENANGGUNG JAWAB FAKULTAS/PRODI\nDaftar Program Studi\nProgram studi vana me\nenuhi svarat menaikuti Kamous Merdeka • Semester Ganiil 2023/2024\n3\n® Lihat Panduan\nanggung Jawab Fakultas/Prodi adalah perwakilan program studi yang bertugas untuk memberikan izi\nemik manasiswa untuk meno kuri orocram Kamous Meraeka.\nla berands\nSiapa itu Penanaguna Jawab Fakultas/Prodi?\nPenanggung Jawab Fakultas/Prodi adalah perwakilan program studi yang bertugas untuk memberikan izin dan melakukan verifikasi data\n4 Segera si email Penancauna Jawab untuk 114 program studi selambat-lambatnva tancaal 28 Oktober 20231\nram Studi\nSegera lengkapi email Penanggung Jawab\nFakultas/Prodi!\nPastikan Anda seluruh program studi memiliki emil Penanggung Jawab memverifikasi data\nmahasiswa.\n2\nMasukkan nama program studi/email\nProgram StudiA-Z\nMemperlihatkan 114 Program Studi l\nPenanggung\nJawab\nProgram Stud\nEmail Penanggung Jawat\nTotal Prodi\n114\nBelum ada Penanggung Jawab\n114\nMasukkan\nMasukkan', 'Pimpinan PT mengunggah surat tugas dari PT dan spesimen tanda tangan yang akan diverifikasi oleh\nPPKM\nMahasiswa melakukan\npersetujuan terhadap poin-poin pertanggungjawaban\ndan kebenaran data\nPimpinan PT menunjuk penanggung jawab\nFakultas/Prodi untuk melakukan verifikasi data dengan mengisikan email pihak Fakultas/Prodi\nPIC Fakultas/Prodi verifikasi data dan melakukan approval mahasiswa melalui\ntautan yang dikirimkan\ndi email\n5\nPimpinan PT\nmelakukan approval mahasiswa secara\nbulk melalui platform\n2023', 'Subdit. PK2\nPeranan Perguruan Tinggi\nPimpinan Perguruan Tinggi\nPimpinan Perguruan Tinggi, bertugas untuk memberikan persetujuan final kepada mahasiswa yang ingin mendaftar program flagship MBKM, dengan ketentuan sebagai berikut:\n1) Pimpinan PT wajib mempunyai salah satu jabatan sebagai pimpinan perguruan tinggi;\n리\nPimpinan PT bertugas menentukan penanggung jawab dari masing-masing prodi atau fakultas untuk bertindak sebagai pihak yang akan merekomendasikan mahasiswa untuk mengikuti\nprogram MBKM; dan\n3)\nPimpinan PT bertugas memberikan persetujuan akhir daftar mahasiswa setelah mendapatkan rekomendasi dari prodi atau fakultas pada laman\nADVANCING HUMANITY\nPenanggungjawab Fakultas atau Prodi\nPenanggung Jawab Fakultas atau Prodi, bertugas untuk:\n1)\n2)\n3\nMelakukan verifikasi kebenaran data dan dokumen mahasiswa yang akan mendaftar Program flagship\nMBKM;']","PDDikti merupakan singkatan dari Pusat Data dan Informasi Pendidikan Tinggi, yang merupakan lembaga di bawah Kementerian Pendidikan, Kebudayaan, Riset, dan Teknologi yang bertugas mengelola data dan informasi mengenai pendidikan tinggi di Indonesia. PDDikti bertanggung jawab dalam menyediakan data mengenai perguruan tinggi, program studi, mahasiswa, dosen, dan berbagai informasi terkait pendidikan tinggi lainnya."
13,Berapa jumlah kredit Mata Kuliah KP?,2 SKS,"['KERJA PRAKTIK\nDepartemen Teknik Informatika ITS\n\nSekilas Kerja Praktik\n\nJumlah kredit Mata Kuliah KP: 2 SKS\nSKS KP diambil bersamaan / setelah menyelesaikan KP di organisasi (perusahaan, instansi, yayasan)\nLama KP: 1-2 bulan dengan hitungan kerja part time\nBisa perorangan atau berkelompok maksimal 2 (dua) mahasiswa\nBerkas-berkas KP bisa didapatkan di link resource akademik:\nhttps://intip.in/ResourceAkademikDanKemahasiswaanIF\nProsedur Kerja Praktik\n\nMengajukan KP\nSurat Pengantar KP\nDosen Pembimbing KP\nPelaksanaan KP\nPenilaian KP oleh Pembimbing Lapangan\nPenilaian KP oleh Dosen Pembimbing\nPenyerahan Laporan KP ke RBTC\nMengumpulkan bukti penyelesaian KP\nLulus KP\nSebelum berangkat KP\n\nMengajukan KP\n\nMemenuhi persyaratan sebagai berikut:\nMahasiswa aktif Teknik Informatika\nSKS tempuh minimum 90 SKS\nMengisi MONKP:\nmonkp.if.its.ac.id (registrasi akun dan data KP)\nStatus KP akan menjadi CREATED\nSurat Pengantar Kerja Praktik', '20. Sistem Kredit Semester yang selanjutnya disingkat SKS adalah suatu sistem penyelenggaraan pendidikan dengan menggunakan sks.\r\n21. Satuan Kredit Semester yang selanjutnya disingkat sks adalah takaran waktu kegiatan belajar yang dibebankan pada mahasiswa per minggu per semester dalam proses pembelajaran melalui berbagai bentuk pembelajaran atau besarnya pengakuan atas keberhasilan usaha mahasiswa dalam mengikuti kegiatan kurikuler di suatu program studi.\r\n22. Satuan Kegiatan Ekstrakurikuler Mahasiswa, yang selanjutnya disingkat SKEM, adalah satuan yang digunakan untuk mengukur kegiatan ekstrakurikuler mahasiswa dan berfungsi sebagai salah satu syarat kelulusan bagi mahasiswa Program Sarjana Terapan dan Sarjana.\r\n23. Mata Kuliah adalah satuan pelajaran yang diajarkan di tingkat perguruan tinggi.\r\n24. Mata Kuliah Inti adalah mata kuliah wajib yang terkait dengan program studi di ITS.', 'transfer kredit  \n(xi) Mekanisme dalam transfer kredit dapat dikembangkan oleh Prodi dan dikoordinasikan \ndengan Direktorat terkait.  \n7 Standar pengolaan – tempat \npelaksanaan MBKM   (1) MBKM dapat dilaksanakan oleh Prodi dengan cara menerima mahasiswa dari perguruan \ntinggi lain . \n(2) Persayaratan MBKM untuk mahasiswa luar ITS , dengan akreditasi Prodi asal mahasiswa \nminimal sama dengan Prodi di ITS.  \n(3) Jumlah mahasiswa dari luar ITS sebagai pelaksana MB -KM dibatasi maksimal sebesar 10 % \n(sepuluh persen) dari daya tampung Program Studi di ITS , kecuali dengan kerjasama \nkhusus.  \n(4) Mekanisme dan penyelenggaraan kegiatan pertukaran pelajar/ kuliah untuk mahasis wa \ndi luar ITS dapat  dikembangkan dan dikoordinasikan oleh Direktorat yang mengurusi \npendidikan bekerjasama dengan Direktorat yang mengurusi pascasarjana dan \npengembangan akademik .', 'dapat menuliskan hal-hal yang dilakukannya beserta hasilnya dalam bentuk tugas \nakhir.\nPelaksanaan KKNT dilakukan untuk mendukung kerja sama bersama Kementerian \nDesa PDTT serta Kementerian/ stakeholder  lainnya. Pemerintah melalui Kementerian \nDesa PDTT menyalurkan dana desa 1 milyar per desa kepada sejumlah 74.957 \ndesa di Indonesia, yang berdasarkan data Indeks Desa Membangun (IDM) tahun \n2019, terdapat desa sangat tertinggal sebanyak 6.549 dan desa tertinggal 20.128. \nPelaksanaan KKNT dapat dilakukan pada desa sangat tertinggal, tertinggal dan \nberkembang, yang sumber daya manusianya  belum memiliki kemampuan \nperencanaan pembangunan dengan fasilitas dana yang besar tersebut. Sehingga \nefektivitas penggunaan dana desa untuk menggerakkan pertumbuhan ekonomi \nmasih perlu ditingkatkan, salah satunya melalui mahasiswa yang dapat menjadi \nsumber daya manusia yang lebih memberdayakan dana desa.\n23       Buku Panduan Merdeka Belajar - Kampus Merdeka']",Jumlah kredit Mata Kuliah KP adalah 2 SKS.
14,Kapan SKS KP bisa diambil?,"Bersamaan atau setelah menyelesaikan KP di organisasi (perusahaan, instansi, yayasan)","['• LAMPIRAN 8: Form Persetujuan Konversi Mata Kuliah\nLAMPIRAN 1\nKOP Departemen\nNo\n:....\nLampiran :\nPerihal :.\nKepada yth :\nDosen Wali Departemen ...\nFakultas...\nITS\nSehubungan dengan adanya permohonan konversi mata kuliah dari mahasiswa peserta magang dengan detail sebagai berikut :\nNama\nNRP\nNama Mitra Magang :\nPeriode magang\nMahasiswa yang bersangkutan akan/ telah *) melakukan magang dengan rincian tugas sebagai berikut :\nBerdasarkan hasil telaah dan analisa dengan bidang akademik departemen, maka mahasiswa yang bersangkutan berhak untuk mendapatkan konversi mata kuliah dan SKS, dimana konversi ini akan di lakukan pada semester..... tahun ajaran ....\n.......Adapun mata kuliah yang dapat dikonversikan dengan\nkegiatan magang adalah sebagai berikut :\nNo.\nMata Kuliah Konversi\nJumlah SKS\n\n\n\n\n\n\n\n\n\nTotal SKS\n\nSurabaya, ....\n*) dicoret\nKepala Departemen ....\n70\nLampiran\n\nSUBDIREKTORAT PENGEMBANGAN KEWIRAUSAHAAN DAN KARIR\nDIREKTORAT KEMAHASISWAAN\nINSTITUT TEKNOLOGI SEPULUH NOPEMBER\n2020', '6.1\nKRITERIA DOSEN PEMBIMBING MAGANG\nW888\nDosen yang telah mengajar selama 4 semester berturut-turut.\nMemperoleh SK Pembimbing Magang dari Departemen dan ketetapan melalui\nKeputusan Dekan.\n6.2\nRINCIAN TUGAS DOSEN PEMBIMBING\nMAGANG\n• Memberikan saran dan masukan saat konsultasi keilmuan jika diperlukan oleh mahasiswa selama magang.\n• Melakukan kegiatan pembimbingan bagi mahasiswa magang untuk dapat berkonsultasi selama magang atau bimbingan penulisan laporan magang.\n• Memberikan persetujuan dan penilaian Laporan Magang.\n• Memberikan penilaian dapat dilakukan dalam bentuk penilaian laporan magang dan atau presentasi kegiatan magang.\n40\n06 Pembimbingan Magang', 'Subdit. PK2\nSKEMA PELAKSANAAN\nPROGRAM MAGANG\nMANDIRI DI ITS\nMahasiswa / Departemen melakukan\nmenyertakan:\n1. Proposal Magang\n2. Surat Rekomendasi Departemen\n3. Surat Penerimaan Magang\nPelaksanaan Magang\nProses pengurusan\nPKS\nPKS tidak\ndisetujui\nPKS\nTertandatangan\nSelesai\nMagang berakhir <\nMahasiswa mendapatkan\nSertifikat / Penilaian Magang\nSelesai\nADVANCING HUMANITY\niTS\nMulai\nMahasiswa mengurus\nsurat rekomendasi\ndepartemen untuk pengajuan magang ke\nMitra\nMahasiswa mengajukan\npermohonan magang ke\nMitra\nMitra melakukan seleksi magang\nMahasiswa menerima hasil seleksi magang dari Mitra\nTidak diterima\nSelesai\nDiterima\nMahasiswa melaporkan\nke Departemen', '31l83 0uluD 29 A0l 2U2120.0y mib\nFORMULIR PENDAFTARAN\nDalam Pertukaran Mahasiswa Merdeka (20 SKS), kamu bisa mengikuti perkuliahan luar jaringan di Perguruan Tinggi (PT) penerima dan dalam jaringan (maksimum 10 SKS) di beberapa PT mitra.\nUniversitas Luar Jaringan\nKalimantan\nsulawesi\nBali - NTT - NTB\nMaluku - Papua\nLainnya\n13. Selanjutnya mengisi pilihan Mata kuliah dalam jaringan (daring) yang ingin diikuti oleh pendaftar, dengan ketentuan jumlah SKS terpilih pada mata kuliah dalam jaringan yaitu maksimum 10 SKS.\nMahasiswa disarankan untuk mengambil 20 SKS secara luar jaringan (luring) di perguruan tinggi penerima.\nMata Kuliah Dalam Jaringan\nPilihan Mata Kuliah\nContoh pilihan beberapa Mata kuliah dan pendaftar bisa mencari menggunakan fitur Search dengan mengetik keyword Mata kuliah seperti pada gambar berikut:\nPilih Mata Kullah 1\nPilih Mata Kuliah 2\nSearch\nType keywords here\nKOMUNIKASI BISNIS\nUniversitas surabaya\nAkuntansi\nPANCASILA DAN KEWARGANEGARAAN\nFarmas']","SKS KP bisa diambil setelah mahasiswa melakukan magang dan mendapatkan persetujuan serta penilaian dari dosen pembimbing magang. Setelah itu, konversi mata kuliah dan SKS KP dapat dilakukan pada semester tertentu sesuai dengan hasil telaah dan analisa dengan bidang akademik departemen."
15,Apakah KP bisa dilakukan secara berkelompok?,"Ya, maksimal 2 (dua) mahasiswa","['kembali  (disarankan mendaftar pada Program BKP MBKM lainnya). Contoh: Magang \n●Mahasiswa yang akan mengikuti Program Magang dan Studi Independen (MSIB) Batch 6 Wajib \nmelakukan konversi alih kredit SKS MK. Subdit. PK2 \n2023 Magang dan Studi Independen Bersertifikat (MSIB) \nMengurangi Kesenjangan antara Ketersediaan SDM Berkualitas  \ndengan Permintaan Industri \nDipercaya oleh Perusahaan  \ndari Dalam dan Luar Negeri \nDan masih banyak lagi… \n Pemangku Kepentingan Program MSIB 6 \nSubdit. PK2 \nPeranan Perguruan Tinggi \n2023 \nSubdit. PK2 \nPimpinan Perguruan Tinggi Penanggungjawab Fakultas atau Prodi \nPimpinan Perguruan Tinggi, bertugas untuk memberikan \npersetujuan final kepada mahasiswa yang ingin \nmendaftar program flagship MBKM, dengan ketentuan \nsebagai berikut: \n1) Pimpinan PT wajib mempunyai salah satu jabatan \nsebagai pimpinan perguruan tinggi; \n2) Pimpinan PT bertugas menentukan penanggung \njawab dari masing-masing prodi atau fakultas \nuntuk bertindak sebagai pihak yang akan', 'diperoleh mahasiswa dalam pelaksanaan KKNT regular, dan mahasiswa diberi \nkesempatan untuk mengajukan perpanjangan KKNT selama maksimal 1 \nsemester atau setara dengan 20 SKS. Untuk melanjutkan program KKNT yang \ndiperpanjang, mahasiswa dapat memanfaatkan Program Holistik Pembinaan Buku Panduan Merdeka Belajar - Kampus Merdeka       26\ndan Pemberdayaan Desa (PHP2D) dengan mengikuti prosedur dari Direktorat \nBelmawa. Bentuk kegiatan KKNT yang Diperpanjang dapat berupa proyek  \npemberdayaan masyarakat di desa dan penelitian untuk tugas akhir mahasiswa.\nContoh Model KKNT yang Diperpanjang\n2) Model KKNT Pembangunan dan Pemberdayaan Desa\nPada model ini perguruan tinggi bekerja sama dengan Mitra dalam melakukan \nKKNT Pembangunan dan Pemberdayaan Desa berdasarkan peluang/kondisi \ndesa dalam bentuk paket kompetensi/pengembangan RPJMDes yang akan \ndiperoleh mahasiswa dalam pelaksanaan KKNT. Jumlah dan bidang Mahasiswa \nyang mengikuti program ini menyesuaikan dengan kebutuhan program di desa.', '31l83 0uluD 29 A0l 2U2120.0y mib\nFORMULIR PENDAFTARAN\nDalam Pertukaran Mahasiswa Merdeka (20 SKS), kamu bisa mengikuti perkuliahan luar jaringan di Perguruan Tinggi (PT) penerima dan dalam jaringan (maksimum 10 SKS) di beberapa PT mitra.\nUniversitas Luar Jaringan\nKalimantan\nsulawesi\nBali - NTT - NTB\nMaluku - Papua\nLainnya\n13. Selanjutnya mengisi pilihan Mata kuliah dalam jaringan (daring) yang ingin diikuti oleh pendaftar, dengan ketentuan jumlah SKS terpilih pada mata kuliah dalam jaringan yaitu maksimum 10 SKS.\nMahasiswa disarankan untuk mengambil 20 SKS secara luar jaringan (luring) di perguruan tinggi penerima.\nMata Kuliah Dalam Jaringan\nPilihan Mata Kuliah\nContoh pilihan beberapa Mata kuliah dan pendaftar bisa mencari menggunakan fitur Search dengan mengetik keyword Mata kuliah seperti pada gambar berikut:\nPilih Mata Kullah 1\nPilih Mata Kuliah 2\nSearch\nType keywords here\nKOMUNIKASI BISNIS\nUniversitas surabaya\nAkuntansi\nPANCASILA DAN KEWARGANEGARAAN\nFarmas', 'masyarakat di luar kampus, yang secara langsung bersama-sama masyarakat \nmengidentifikasi potensi dan menangani masalah sehingga diharapkan mampu \nmengembangkan potensi desa/daerah dan meramu solusi untuk masalah yang ada \ndi desa. Kegiatan KKNT diharapkan dapat mengasah softskill  kemitraan, kerjasama \ntim lintas disiplin/keilmuan (lintas kompetensi), dan leadership  mahasiswa dalam \nmengelola program pembangunan di wilayah perdesaan. Sejauh ini perguruan \ntinggi sudah menjalankan program KKNT, hanya saja Satuan Kredit Semesternya \n(SKS) belum bisa atau dapat diakui sesuai dengan program kampus merdeka yang \npengakuan kreditnya setara 6 – 12 bulan atau 20 – 40 SKS, dengan pelaksanaannya \nberdasarkan beberapa model. Diharapkan juga setelah pelaksanaan KKNT, mahasiswa \ndapat menuliskan hal-hal yang dilakukannya beserta hasilnya dalam bentuk tugas \nakhir.\nPelaksanaan KKNT dilakukan untuk mendukung kerja sama bersama Kementerian']","KP (Kuliah Kerja Nyata) biasanya dilakukan secara individu, namun dalam beberapa kasus tertentu, KP juga bisa dilakukan secara berkelompok. Hal ini tergantung pada kebijakan dan persetujuan dari pihak perguruan tinggi atau lembaga terkait yang menyelenggarakan program KP tersebut. Jika ingin melakukan KP secara berkelompok, mahasiswa perlu memastikan bahwa hal tersebut diizinkan dan memenuhi persyaratan yang ditetapkan."
16,Apa syarat mengajukan KP?,"Mahasiswa aktif Teknik Informatika, SKS tempuh minimum 90 SKS","['Untuk kondisi di poin 2.b, maka mahasiswa dapat memilih mata kuliah yang ditawarkan di aplikasi MBKM.\nTANGGAL PENTING PERTUKARAN MAHASISWA MERDEKA\nTAHUN 2021\nTanggal\nAgenda\n12 Juni 2021\nMenuju Festival Kampus Merdeka - Pertukaran\nMahasiswa Merdeka\n15 Juni 2021\nFestival Kampus Merdeka\n\n14-27 Juni 2021 Pendaftaran mahasiswa\nAkhir Juni/awal\nJuli 2021\nPengisian Survei Kebinekaan\nMinggu I-ll\nJuli 2021\nSeleksi dan penetapan peserta\nMinggu Ill Juli-Il Agustus 2021\nPerguruan tinggi mempersiapkan keberangkatan dan penerimaan mahasiswa\nAgustus 2021-Januari 2022\nPelaksanaan program Pertukaran Mahasiswa Merdeka (disesuaikan dengan kalender akademik masing-masing perguruan tinggi)\nAgustus 2021-Januari 2022\nMahasiswa memberikan laporan perkembangan program\nFebruari-Maret\n2022\nPelaksanaan kegiatan tindak lanjut oleh mahasiswa (opsional)', 'Mahasiswa tidak diperkenankan mengambil Program Kegiatan (BKP) MBKM yang sama lebih dari 1 kali. Mahasiswa yang sudah pernah mengikuti Program Kegiatan Studi Independen ( konversi ke SKS), tidak diperkenankan mendaftar Program kegiatan Studi Independen kembali (disarankan mendaftar pada Program BKP MBKM lainnya). Contoh: Magang Mahasiswa yang akan mengikuti Program Magang dan Studi Independen (MSIB) Batch 6 Wajib melakukan konversi alih kredit SKS MK.\n2023', '6. Mutu penilaian.\nBeberapa kriteria yang dianjurkan untuk kegiatan di luar kampus untuk menjaga mutu dan \nmendapatkan sks penuh:\nTabel 3.1. Kriteria Kegiatan di Luar Kampus\nNo. Kegiatan Kriteria untuk dapat sks penuh (20 sks)\n1. Magang/ Praktek Kerja • Tingkat kemampuan yang diperlukan untuk \nmagang harus setara dengan level sarjana (bukan \ntingkat SMA kebawah)\n• Mahasiswa menjadi bagian dari sebuah tim – \nterlibat secara aktif di kegiatan tim\n• Mahasiswa mendapatkan masukan terkait \nperforma kinerja setiap 2 bulan\n• Harus memberikan presentasi di akhir magang \nkepada salah satu pimpinan perusahaa\n2. Asistensi Mengajar di Satuan \nPendidikan• Menentukan target yang ingin dicapai selama \nkegiatan (mis. meningkatkan kemampuan \nnumerik siswa, dst.) dan pencapaiannya \ndievaluasi di akhir kegiatan\n3. Penelitian/ Riset • Jenis penelitian (tingkat kesulitan) harus sesuai \ndengan tingkat sarjana\n• Harus terlibat dalam pembuatan laporan akhir/', 'APA SAJA SYARAT DAN KETENTUAN UNTUK JENIS MAGANG MBKM ?\n\n1. Mahasiswa aktif ITS tingkat Sarjana dan Diploma\n2. Minimal mahasiswa sudah lulus 90 SKS atau sudah lulus semester 5.\n3. Mahasiswa tidak diperkenankan mengambil Program Kegiatan Magang (BKP)\nMBKM yang sama lebih dari 1 kali.\n4. Mahasiswa WAJIB melakukan konversi alih kredit ke SKS MK.\n5. Mahasiswa/Departemen WAJIB membuat/memiliki surat PKS.\n6. Pelaksanaan Magang sebelum minggu ke-3 perkuliahan di ITS.\n7. Mahasiswa tidak diperkenankan mengambil MK, atau hanya diperkenankan\nmengambil maks. 3 MK (setara 10 SKS).\n8. Pelaksanaan Magang selama 3 – 6 bulan.\n\nAPA SAJA\nSYARAT DAN\nKETENTUAN\nUNTUK JENIS\nMAGANG\nNON-MBKM']","Syarat mengajukan KP adalah mahasiswa aktif ITS tingkat Sarjana dan Diploma, minimal sudah lulus 90 SKS atau sudah lulus semester 5, tidak diperkenankan mengambil Program Kegiatan Magang (BKP) MBKM yang sama lebih dari 1 kali, wajib melakukan konversi alih kredit ke SKS MK, harus membuat atau memiliki surat PKS, pelaksanaan magang dilakukan sebelum minggu ke-3 perkuliahan di ITS, tidak diperkenankan mengambil mata kuliah, atau hanya diperkenankan mengambil maksimal 3 mata kuliah (setara 10 SKS), dan pelaksanaan magang berlangsung selama 3-6 bulan."
17,Apa yang harus dilakukan mahasiswa di lokasi KP?,"Mematuhi dan mengikuti segala aturan terkait kerja praktik, dan mengerjakan pekerjaan yang sesuai dengan kompetensi Informatika","['C Kerat\n@ DASHBOARD E KEGIATAN MAHASISWA & PROFIL\nINDAH SYAHYA DINATA\n凹\nPertukaran Mahasiswa Merdeka\nFORMULIR PENDAFTARAN\nPilih Penempatan & Mata Kuliah\nDalam Pertukaran Mahasiswa Merdeka (20 SKS), kamu bisa mengikuti perkuliahan luar jaringan di Perguruan Tinggi (PT) penerima dan dalam jaringan (maksimum 10 SKS) di beberapa PT mitra.\nUniversitas Luar Jaringan\n20 / 20 SKS\nPilihan Lokasi Pulau PT penerima\nPilihan lokasi putau harus di luar alamat KTP dan domisili PT asal. Preferensi mahasiswa akan dipertimbangkan namun keputusan panitia bersifat final dan tidak dapat digugat.\nPilih Lokasi Pulau 11\nロ\nPilhan lokasi pulau narus di luar alamat KIP dan domisili PI asal. Preterensi manasiswa akan diperumbangkan namun keputusan panta bersitat unai dan toak dapat diguga\nSulawesi\nBali - NTT - NTB\nBerikut adalah contoh Pilihan pulau yang telah di-cluster sesuai\ndomisili pendaftar:\n14', 'KEMENTERIAN PENDIDIKAN DAN KEBUDAYAAN\n                              INSTITUT TEKNOLOGI SEPULUH NOPEMBER\n                                                 Kampus ITS Sukolilo – Surabaya 60111\n                                          Telepon : 031-5994251-54, 5947274, 5945472 (Hunting)\n                                                        Fax: 031-5947264, 5950806\n                                                            http://www.its.ac.id\n\n\n                                           SURAT EDARAN\n                        WAKIL REKTOR BIDANG AKADEMIK DAN KEMAHASISWAAN\n                               INSTITUT TEKNOLOGI SEPULUH NOPEMBER\n                                   NOMOR: T/26434/IT2.I/TU.00.08/2021\n\n                                                    TENTANG\n\n       Panduan Evaluasi Kurikulum Program Studi Tahun 2018 – 2023 Untuk Program Pendidikan Akademik\n       Dalam Rangka Menyikapi Bentuk Kegiatan Pembelajaran Program Merdeka Belajar – Kampus Merdeka', 'KEMENTERIAN PENDIDIKAN, KEBUDAYAAN,\n                                     RISET DAN TEKNOLOGI\n                            INSTITUT TEKNOLOGI SEPULUH NOPEMBER\n                                          Kampus ITS Sukolilo – Surabaya 60111\n                                   Telepon : 031-5994251-54, 5947274, 5945472 (Hunting)\n                                                 Fax: 031-5947264, 5950806\n                                                     http://www.its.ac.id\n\n\n                                            SURAT EDARAN\n                 WAKIL REKTOR BIDANG AKADEMIK DAN KEMAHASISWAAN\n                          INSTITUT TEKNOLOGI SEPULUH NOPEMBER\n                                  NOMOR: 757/IT2.I/T/TU.00.08/2022\n\n\n                                              TENTANG\n             Pelaksanaan Bentuk Kegiatan Pembelajaran Merdeka Belajar – Kampus Merdeka\n\n\nKepada Yth. 1. Dekan\n           2. Kepala Departemen\n           di Lingkungan ITS', 'KEMENTERIAN PENDIDIKAN, KEBUDAYAAN, RISET, DAN TEKNOLOGI\r\nINSTITUT TEKNOLOGI SEPULUH NOPEMBER\r\n       Kampus ITS Sukolilo - Surabaya 60111 Telepon : 031-5994251-54, 5947274, 5945472 (Hunting)\r\nFax: 031-5947264, 5950806\r\nhttp://www.its.ac.id\r\n\r\n\r\nPERATURAN REKTOR INSTITUT TEKNOLOGI SEPULUH NOPEMBER NOMOR 22 TAHUN 2021\r\n\r\nTENTANG\r\n\r\nPENYELENGGARAAN KEGIATAN MERDEKA BELAJAR - KAMPUS MERDEKA DI INSTITUT TEKNOLOGI SEPULUH NOPEMBER\r\n\r\n      DENGAN RAHMAT TUHAN YANG MAHA ESA REKTOR INSTITUT TEKNOLOGI SEPULUH NOPEMBER,\r\nMenimbang : a. bahwa dalam rangka Institut Teknologi Sepuluh Nopember menuju perguruan tinggi dengan reputasi internasional (world class university) dalam ilmu pengetahuan dan teknologi, dipandang perlu menyusun peraturan penyelenggaraan kegiatan merdeka belajar - kampus merdeka yang mendukung perihal tersebut;']",Mahasiswa di lokasi KP harus memilih penempatan dan mata kuliah dalam Pertukaran Mahasiswa Merdeka. Mereka bisa mengikuti perkuliahan luar jaringan di Perguruan Tinggi penerima dan dalam jaringan di beberapa PT mitra. Pilihan lokasi pulau harus di luar alamat KTP dan domisili PT asal. Preferensi mahasiswa akan dipertimbangkan namun keputusan panitia bersifat final dan tidak dapat digugat.
18,Kapan batas waktu penyerahan laporan KP?,Paling lambat 1 bulan setelah tanggal selesainya kerja praktek di perusahaan,"['Meminta persetujuan form pengajuan KP ke Koordinator Kerja Praktek (Sekretaris Departemen 1)\nMenyerahkan Form Pengajuan KP yang sudah disetujui Koord. KP kepada Staf Akademik (Pak Sugeng) untuk dibuatkan surat pengantar ke tempat KP\nSurat pengantar KP dikeluarkan oleh departemen Teknik Informatika yang ditujukan kepada organisasi tempat KP yang berisi:\nPermohonan agar mahasiswa X diijinkan untuk melakukan KP di organisasi Y,\nTanggal mulai,\nDurasi kerja praktik\nSurat pengantar KP dikirimkan ke instansi penerima KP\nJika balasan persetujuan sudah didapatkan, unggah ke MONKP\nStatus KP akan menjadi CONFIRMED\nDosen Pembimbing Kerja Praktik\n\nSyarat mendapatkan dosen pembimbing internal KP:\nStatus KP akan menjadi CONFIRMED\nDosen Pembimbing KP dipilih oleh koordinator KP dengan menyesuaikan load pembimbingan dosen, kecuali ada rekomendasi khusus dari dosen ybs\nPengalokasian dilakukan secara batch operation\nDi lokasi KP\n4. Melaksanakan Kerja Praktik', 'diperoleh mahasiswa dalam pelaksanaan KKNT regular, dan mahasiswa diberi \nkesempatan untuk mengajukan perpanjangan KKNT selama maksimal 1 \nsemester atau setara dengan 20 SKS. Untuk melanjutkan program KKNT yang \ndiperpanjang, mahasiswa dapat memanfaatkan Program Holistik Pembinaan Buku Panduan Merdeka Belajar - Kampus Merdeka       26\ndan Pemberdayaan Desa (PHP2D) dengan mengikuti prosedur dari Direktorat \nBelmawa. Bentuk kegiatan KKNT yang Diperpanjang dapat berupa proyek  \npemberdayaan masyarakat di desa dan penelitian untuk tugas akhir mahasiswa.\nContoh Model KKNT yang Diperpanjang\n2) Model KKNT Pembangunan dan Pemberdayaan Desa\nPada model ini perguruan tinggi bekerja sama dengan Mitra dalam melakukan \nKKNT Pembangunan dan Pemberdayaan Desa berdasarkan peluang/kondisi \ndesa dalam bentuk paket kompetensi/pengembangan RPJMDes yang akan \ndiperoleh mahasiswa dalam pelaksanaan KKNT. Jumlah dan bidang Mahasiswa \nyang mengikuti program ini menyesuaikan dengan kebutuhan program di desa.', 'Menetapkan :    PERATURAN REKTOR INSTITUT TEKNOLOGI SEPULUH\n                NOPEMBER TENTANG PERUBAHAN ATAS PERATURAN\n                REKTOR INSTITUT TEKNOLOGI SEPULUH NOPEMBER\n                NOMOR 12 TAHUN 2019 TENTANG BAKU MUTU MAGANG\n                PROGRAM STUDI SARJANA TERAPAN DAN SARJANA.\n\n\n                                  Pasal I\n\n\nKetentuan Pasal 4 Peraturan Rektor Institut Teknologi Sepuluh Nopember\nNomor 12 Tahun 2019 tentang Baku Mutu Magang Program Studi Sarjana\nTerapan dan Sarjana, diubah sehingga Pasal 4 berbunyi sebagai berikut:', '6 Mei 2021\n                                                                     Wakil Rektor Bidang Akademik dan\n                                                                     Kemahasiswaan,\n\n\n\n\n                                                                     Prof. Dr. Ir. Adi Soeprijanto, MT\n                                                                     NIP. 19640405 199002 1 001']","Batas waktu penyerahan laporan KP adalah setelah mahasiswa menyelesaikan kerja praktik dan mengumpulkan semua dokumen yang diperlukan, biasanya sebelum akhir periode kerja praktik yang telah ditentukan."
19,Bagaimana format nama file untuk laporan KP dengan pengarang tunggal?,NRP-Project_Report,"['MENGISI METADATA / METADATA ENTRIES\n\nMonograph Type, pilih “Project Report”\nMonograph Type, choose “Project Report”.\nCorporate Creators, diisi nama Perusahaan yang berkontribusi dalam penulisan KP.\nNIDN, diisi NIDN dosen pembimbing. Boleh dikosongkan bila tidak tahu.\nNIDN, fill it with thesis advisor ID number. Can be blank.\nMENGISI METADATA / METADATA ENTRIES\n\nIsikan nama dosen pembimbing dengan nama belakang pada kolom family name.\nFill it with Thesis Advisors name.\nPilih “Thesis Advisor” / Choose “Thesis Advisor”.\nNRP/NIM: diisi NIM [no NRP]\nNRP/NIM: NIM [student ID number].\nCreators, isikan pengarang dengan nama belakang pada kolom family name.\nCreators, fill it with creators name.\nMENGISI METADATA / METADATA ENTRIES', 'Pilih “Monograph” / Choose “Monograph”\nKemudian klik “Next” / Then Click “Next”\n\nUpload file di sini / Upload file here\nKlik “Next” / Click “Next”\nUPLOAD FILE\n\nFile sudah masuk / Thesis file uploaded\nPilih “Accepted version” / Choose “Accepted version”\nPilih “Anyone” / Choose “Anyone”\nPilih Bahasa yang digunakan / Choose language as used on\nKlik “Next” / Click “Next”\nTitle, diisi judul bhs Ind, dengan gaya penulisan huruf besar tiap kata.\nTitle, fill it with thesis title, use Capitalize Each Word style.\n\nAbstract, diisi abstrak Ind dan Eng. Gunakan tanda “ = “ sebagai pemisah.\nAbstract, fill it with Ind and Eng abstracts. Use “ = “ as divider of Ind and Eng Abstracts.\n\nMENGISI METADATA / METADATA ENTRIES', '7.2\nKETENTUAN UMUM DALAM PENULISAN\nLAPORAN MAGANG\n• Laporan Magang ditulis dan dipresentasikan pada akhir magang (jika diperlukan).\n• Laporan Magang selain diserahkan ke departemen dan mitra magang, juga diserahkan ke Subdirektorat PK2 Direktorat Kemahasiswaan dalam bentuk softcopy melalui SIM Magang.\n7.3\nPRINSIP PENULISAN LAPORAN\nMAGANG\n• BENAR DAN OBYEKTIF\nLaporan magang harus sesuai dengan ketentuan yang ada dalam pedoman ini serta memuat informasi yang benar dan obyektif.\n• JELAS DAN CERMAT\nLaporan magang harus mudah dimengerti / dipahami oleh pembaca, dengan cara menghindari pemakaian kata / istilah, rangkaian kata / kalimat atau gaya bahasa yang kurang dapat dipahami oleh pembaca maupun penulisnya sendiri. Gunakan kata-kata yang sederhana tetapi jelas maksudnya.\n• LANGSUNG KE SASARAN', '• LAMPIRAN 3: Sampul Laporan Magang\nSampul Laporan Magang berwarna biru dengan logo ITS di kiri atas. Pada sampul tercetak: Judul Laporan Magang, Nama Lengkap Mahasiswa, Asal Departemen dan Fakultas, Institut Teknologi Sepuluh Nopember, dan tahun penyelesaian.\nJenis huruf: Calibri\nUkuran huruf: 14 pt\nContoh Sampul Laporan Magang :\nLAPORAN MAGANG\n(JUDUL LAPORAN MAGANG)\n(NAMA)\n(NRP)\nDosen Pembimbing\n(Nama Dosen Pembimbing)\nDosen Pembimbing\n(Nama Dosen Pembimbing Lapangan)\n(Departemen)\n(Fakultas )\nInstitut Teknologi Sepuluh Nopember Surabaya\n2020\nBuku Petunjuk Teknis Magang\n65\n\n• LAMPIRAN 4 : Form Penilaian Magang (Dosen Pembimbing)\nLEMBAR PENILAIAN KINERJA MAGANG\nSemester Magang :..... Tahun Akademik 20.../20...\nNama Mahasiswa\nNRP\nDepartemen\nNama Dosen Pembimbing\nNama Perusahaan Mitra Magang\nWaktu Pelaksanaan Magang\nNama Proyek/ Kegiatan Magang\nNO\nASPEK YANG DINILAI\nBOBOT (B)\nNILAI (N)\n(0-100)\nJUMLAH\n(B XN)\n1\nKehadiran\n10\n\n\n2\nKesungguhan melaksanakan Kerja Praktek\n15']","Format nama file untuk laporan KP dengan pengarang tunggal adalah sebagai berikut:
[Judul Laporan KP]_[Nama Pengarang]_[NIM/NRP].pdf

Contoh:
Laporan_KP_PutraJaya_123456789.pdf"
