,question,answer,contexts,ground_truth,context_precision,faithfulness,answer_relevancy,context_recall
0,Apa visi ITS?,Saya tidak tahu.,"['PENGALAMAN TENTANG KEBUDAYAAN DAERAH LAIN\nMELALUI MODUL NUSANTARA\nSelain mengikuti pembelajaran mata kuliah di perguruan tinggi penerima, mahasiswa yang mengikuti program Pertukaran Mahasiswa Merdeka juga akan mendapatkan pengalaman langsung berinteraksi dengan mahasiswa dari daerah lain dan mempelajari kebudayaan daerah lain melalui Modul Nusantara. Modul Nusantara ini senilai 2 sks dan wajib diambil oleh mahasiswa peserta program Pertukaran Mahasiswa Merdeka. Modul Nusantara dilaksanakan di perguruan tinggi penerima. Modul Nusantara dibagi ke dalam empat jenis kegiatan yaitu kebinekaan, inspirasi, refleksi, dan kontribusi sosial. Dalam pelaksanaan Modul Nusantara, mahasiswa akan dibimbing oleh dosen pembimbing modul nusantara dan dibantu oleh mentor.\nBAGAIMANA MEKANISME PELAKSANAAN PERTUKARAN\nMAHASISWA MERDEKA?\nTerdapat dua mekanisme, yaitu:'
 '23. Mata Kuliah adalah satuan pelajaran yang diajarkan di tingkat perguruan tinggi.\r\n24. Mata Kuliah Inti adalah mata kuliah wajib yang terkait dengan program studi di ITS.\r\n25. Mata Kuliah Non-Inti adalah mata kuliah di ITS yang meliputi mata kuliah wajib kurikulum, mata kuliah penciri ITS, mata kuliah pilihan program studi, dan mata kuliah pengayaan.\r\n26. Mata Kuliah Wajib Kurikulum adalah mata kuliah yang terdiri dari Agama, Pancasila, Kewarganegaraan, dan Bahasa Indonesia.\r\n27. Mata Kuliah Penciri ITS adalah mata kuliah yang terdiri dari Bahasa Inggris, Teknopreneur, dan Wawasan dan Aplikasi Teknologi.'
 'Teknologi Subdit. PK2 \nits.id/DigitalisasiSRSPTJM_ITS  \n2023 \nSubdit. PK2 \nAkses informasi lebih lanjut: \n@itscareercenter \nOfficial Instagram Subdit. PK2 ITS \nhttps://kampusmerdeka.kemdikbud.go.id 2023 \nSubdit. PK2 \nTERIMA KASIH'
 'pelaksanaan MBKM   \n4. Prodi mempunyai Dokumen pan duan untuk Mahasiswa dalam perencanaan , \npelaksannaan, penilaian pelaksanaan  MBKM  \n5. Prodi mempunyai d okumen panduan bagi administratur dalam perekaman pelaksanaan \ndan monev MBKM  \n \n8 Standar Pengelolaan – \nPeningkatan MBKM  Mutu, manfaat, kepuasan dan keberlanjutan kerjasama pendidikan  dalam MBKM  \n(i) UPPS dan Prodi melakukan survey kepuasaan kepada seluruh mitra kerjasama \npelaksanaan MBKM, sebagai upaya evaluasi dan keberlanjutan program MBKM.  \n(ii) Upaya yang dilakukan  Direktorat,  UPPS dan PS untuk meningkatkan animo \nmahasiswa dalam pelaksanaan MBKM  \n(iii) Ketersediaan layanan bagi mahasiswa dalam pelaksanaan MBKM di level Prodi dan \nlevel Direktorat terkait  \n(iv) Ketersediaan layanan bagi dosen pembimbing dalam dan pembimbing dari luar untuk \npelaksanaan MBKM  \n(v) Ketersediaan doku men panduan  17 Dokumen Panduan Baku Mutu Pelaksanaan MBKM - 2021  \n NO ELEMEN PENILAIAN  INDIKATOR  \n(1) (2) (3)']",Menjadi perguruan tinggi dengan reputasi internasional dalam ilmu pengetahuan dan teknologi terutama yang menunjang industri dan kelautan yang berwawasan lingkungan.,0.0,0.0,0.0,0.0
1,Apa itu Body of Knowledge?,Saya tidak tahu.,"['Teknologi Subdit. PK2 \nits.id/DigitalisasiSRSPTJM_ITS  \n2023 \nSubdit. PK2 \nAkses informasi lebih lanjut: \n@itscareercenter \nOfficial Instagram Subdit. PK2 ITS \nhttps://kampusmerdeka.kemdikbud.go.id 2023 \nSubdit. PK2 \nTERIMA KASIH'
 'MERDEKA BELAJAR – KAMPUS MERDEKA (MB-KM) DI INSTITUT TEKNOLOGI SEPULUH NOPEMBER\nDisampaikan di IPITS 2020\nINSTITUT TEKNOLOGI SEPULUH NOPEMBER, Surabaya - Indonesia\n\nMERDEKA BELAJAR DAN KAMPUS MERDEKA (MB-KM)\nOutline:\n\nPENDAHULUAN\nDASAR HUKUM MB-KM\nKEGIATAN MB-KM DI ITS\nTERIMA KASIH\nPENDAHULUAN\n\nTantangan Abad 21\nSosialisasi Program MB-KM, Ditjen Dikti, 2020\nKampus Merdeka\n\nHak Belajar 3 Semester di Luar Program Studi (Prodi)\nPermendikbud Nomor 3 Tahun 2020 tentang Standar Nasional Pendidikan Tinggi\n\nMahasiswa memiliki kesempatan untuk:\n\nSatu semester atau setara dengan 20 SKS menempuh pembelajaran di luar program studi pada perguruan tinggi yang sama.\nPaling lama dua semester atau setara dengan 40 SKS menempuh pembelajaran pada:\nProgram studi yang sama di perguruan tinggi yang berbeda\nProgram studi yang berbeda di perguruan tinggi yang berbeda\nDi luar perguruan tinggi\nDASAR HUKUM MB-KM'
 'b) Menjadi   sarana bagi perguruan tinggi dalam membentuk jejaring atau mitra \nstrategis dalam membantu pembangunan desa.\nc)  Menjadi sarana pengembangan tri dharma perguruan tinggi.\nd)  Menjadi sarana aktualisasi dosen dalam pengembangan ilmu pengetahuan.\n3) Bagi Desa\na) Memperoleh bantuan pemikiran dan tenaga dari tenaga terdidik untuk \nmenyusun Rencana Pembangunan Jangka Menengah Desa (RPJMDes) dan \nRencana Kegiatan Pembangunan Desa (RKPDes).\nb) Membantu perubahan/perbaikan tata kelola desa.  \nc)  Memacu terbentuknya tenaga muda yang diperlukan dalam pemberdayaan \nmasyarakat desa\nd)  Membantu pengayaan wawasan masyarakat terhadap pembangunan desa.\ne) Percepatan pembangunan di wilayah pedesaan.\nSelain persyaratan umum yang terdapat pada pelaksanaan kebijakan Merdeka Belajar \n- Kampus Merdeka di atas, untuk kegiatan KKNT terdapat persyaratan tambahan \nyang harus dipenuhi oleh mahasiswa, yaitu:\n1) Mahasiswa telah menyelesaikan proses pembelajaran setelah  semester 6.'
 'pelaksanaan MBKM   \n4. Prodi mempunyai Dokumen pan duan untuk Mahasiswa dalam perencanaan , \npelaksannaan, penilaian pelaksanaan  MBKM  \n5. Prodi mempunyai d okumen panduan bagi administratur dalam perekaman pelaksanaan \ndan monev MBKM  \n \n8 Standar Pengelolaan – \nPeningkatan MBKM  Mutu, manfaat, kepuasan dan keberlanjutan kerjasama pendidikan  dalam MBKM  \n(i) UPPS dan Prodi melakukan survey kepuasaan kepada seluruh mitra kerjasama \npelaksanaan MBKM, sebagai upaya evaluasi dan keberlanjutan program MBKM.  \n(ii) Upaya yang dilakukan  Direktorat,  UPPS dan PS untuk meningkatkan animo \nmahasiswa dalam pelaksanaan MBKM  \n(iii) Ketersediaan layanan bagi mahasiswa dalam pelaksanaan MBKM di level Prodi dan \nlevel Direktorat terkait  \n(iv) Ketersediaan layanan bagi dosen pembimbing dalam dan pembimbing dari luar untuk \npelaksanaan MBKM  \n(v) Ketersediaan doku men panduan  17 Dokumen Panduan Baku Mutu Pelaksanaan MBKM - 2021  \n NO ELEMEN PENILAIAN  INDIKATOR  \n(1) (2) (3)']","Istilah yang digunakan untuk mewakili secara lengkap konsep, istilah, dan aktivitas yang membentuk kemampuan profesional, yang didefinisikan oleh masyarakat terpelajar atau asosiasi profesional yang relevan.",0.499999999975,0.0,0.0,0.0
2,Apa itu CPL?,"CPL adalah singkatan dari Capaian Pembelajaran Lulusan. CPL merupakan proses pencapaian kompetensi atau hasil belajar yang diharapkan dari seorang mahasiswa setelah menyelesaikan program studi atau mata kuliah tertentu. Dalam konteks yang diberikan, CPL tersebut dapat diekuivalensikan ke dalam mata kuliah Kewirausahaan Sosial, Etika Bisnis, Pengantar Manajemen dan Bisnis, Pemasaran Digital, Desain Wirausaha dan Presentasi, Praktik Wirausaha, serta Laporan Wirausaha dan Presentasi yang setara dengan 20 SKS.","['Subdit. PK2\nPeranan Perguruan Tinggi\nPimpinan Perguruan Tinggi\nPimpinan Perguruan Tinggi, bertugas untuk memberikan persetujuan final kepada mahasiswa yang ingin mendaftar program flagship MBKM, dengan ketentuan sebagai berikut:\n1) Pimpinan PT wajib mempunyai salah satu jabatan sebagai pimpinan perguruan tinggi;\n리\nPimpinan PT bertugas menentukan penanggung jawab dari masing-masing prodi atau fakultas untuk bertindak sebagai pihak yang akan merekomendasikan mahasiswa untuk mengikuti\nprogram MBKM; dan\n3)\nPimpinan PT bertugas memberikan persetujuan akhir daftar mahasiswa setelah mendapatkan rekomendasi dari prodi atau fakultas pada laman\nADVANCING HUMANITY\nPenanggungjawab Fakultas atau Prodi\nPenanggung Jawab Fakultas atau Prodi, bertugas untuk:\n1)\n2)\n3\nMelakukan verifikasi kebenaran data dan dokumen mahasiswa yang akan mendaftar Program flagship\nMBKM;'
 'pelaksanaan MBKM   \n4. Prodi mempunyai Dokumen pan duan untuk Mahasiswa dalam perencanaan , \npelaksannaan, penilaian pelaksanaan  MBKM  \n5. Prodi mempunyai d okumen panduan bagi administratur dalam perekaman pelaksanaan \ndan monev MBKM  \n \n8 Standar Pengelolaan – \nPeningkatan MBKM  Mutu, manfaat, kepuasan dan keberlanjutan kerjasama pendidikan  dalam MBKM  \n(i) UPPS dan Prodi melakukan survey kepuasaan kepada seluruh mitra kerjasama \npelaksanaan MBKM, sebagai upaya evaluasi dan keberlanjutan program MBKM.  \n(ii) Upaya yang dilakukan  Direktorat,  UPPS dan PS untuk meningkatkan animo \nmahasiswa dalam pelaksanaan MBKM  \n(iii) Ketersediaan layanan bagi mahasiswa dalam pelaksanaan MBKM di level Prodi dan \nlevel Direktorat terkait  \n(iv) Ketersediaan layanan bagi dosen pembimbing dalam dan pembimbing dari luar untuk \npelaksanaan MBKM  \n(v) Ketersediaan doku men panduan  17 Dokumen Panduan Baku Mutu Pelaksanaan MBKM - 2021  \n NO ELEMEN PENILAIAN  INDIKATOR  \n(1) (2) (3)'
 '07\nPEDOMAN\nPENULISAN\nLAPORAN\nMAGANG\n\n07\nPEDOMAN PENULISAN LAPORAN\nMAGANG\n7.1\nFUNGSI LAPORAN MAGANG\nPertanggungjawaban kegiatan Magang mahasiswa kepada Mitra Magang dan\nDepartemen.\n女你公\n299\nBahan pertimbangan pemberian nilai kegiatan Magang\nДо\nPenyampaian informasi bagi pihak ITS, mahasiswa, maupun Mitra Magang\nSalah satu alat untuk membina hubungan kerjasama, saling pengertian, dan koordinasi antara mahasiswa dengan pihak ITS maupun Mitra Magang\nSalah satu alat untuk menyampaikan ide, pendapat, penilaian, dan pengalaman yang berkaitan dengan penyelenggaraan Magang kepada\npihak lain.\n44\n07 Pedoman Penulisan Laporan Magang'
 'Pemasaran Digital 3\nWirausaha\n1. Desain Wirausaha dan \nPresentasi\n2. Praktik Wirausaha\n3. Laporan Pelaksanaan \nWirausaha dan Presentasi3\n4\n3\nJumlah 6 MK 20 SKS\nPenjelasan Tabel 2.4. \nMahasiswa Ilmu Komunikasi mengambil bentuk kegiatan pembelajaran \nberupa Kewirausahaan untuk menambah kompetensinya di bidang wirausaha. \nKompetensi yang telah dicapai melalui serangkaian proses kegiatan pembelajaran \nkewirausahaan ini sesuai dengan CPL, proses pencapaian CPL tersebut dapat \ndiekuivalensikan kedalam mata kuliah Kewirausahaan Sosial, Etika Bisnis, \nPengantar Manajemen dan Bisnis, Pemasaran Digital, Desain Wirausaha dan \nPresentasi, Praktik Wirausaha, serta Laporan Wirausaha dan Presentasi yang \nsetara dengan 20 SKS.\nProses Program Wirausaha\n21       Buku Panduan Merdeka Belajar - Kampus Merdeka\ng. Studi/Proyek Independen\nBanyak mahasiswa yang memiliki passion untuk mewujudkan karya besar yang \ndilombakan di tingkat internasional atau karya dari ide yang inovatif. Idealnya, studi/']",Capaian Pembelajaran Lulusan,0.9999999999,0.0,0.9631687628816238,0.0
3,Berapa jam kerja magang yang setara dengan 1 SKS?,Satu SKS kerja magang setara dengan 40 jam kerja.,"['h. Asistensi Mengajar di Satuan Pendidikan.\r\n(3) Dalam hal ada penambahan dan atau perubahan BKP MBKM sebagaimana dimaksud pada ayat (2) ditetapkan melalui Keputusan Rektor.\r\n(4) Kegiatan Membangun Desa/ Kuliah Kerja Nyata Tematik sebagaimana dimaksud pada ayat (2) huruf b dan Proyek Kemanusiaan sebagaimana dimaksud pada ayat (2) huruf d diwujudkan melalui kegiatan pengabdian kepada masyarakat.\r\n\r\n              BAB IV PELAKSANAAN KEGIATAN MB - KM\r\n\r\nPasal 4\r\n(1) Jumlah sks maksimal yang dapat diambil dalam rangka pelaksanaan kegiatan MB -\r\nKM adalah 40 (empat puluh) sks.\r\n(2) Kegiatan MB-KM hanya bisa dilaksanakan dengan:\r\na. Perguruan tinggi yang mempunyai rangking setara atau lebih tinggi dari ITS,\r\nb. Perguruan tinggi yang mempunyai MoU dengan ITS; atau\r\nc. Lembaga non perguruan tinggi yang mempunyai MoU dengan ITS.\r\n(3) Pelaksanaan transfer kegiatan MB - KM menjadi sks mata kuliah, program studi atau direktorat membentuk tim pelaksana transfer kredit.'
 '(3) Kegiatan magang/ praktik kerja pada program sarjana terapan diimplementasikan dalam bentuk mata kuliah wajib yang merupakan mata kuliah penciri Fakultas Vokasi sebesar 14 (empat belas) sks.\r\n(4) Kegiatan magang/ praktik kerja pada program sarjana dapat dikonversikan menjadi:\r\na. sks kerja praktek; atau\r\n\r\nb. sks satu atau beberapa mata kuliah yang memiliki Capaian Pembelajaran Mata Kuliah (CPMK) sama dengan magang; atau\r\nc. sks gabungan antara kerja praktek dengan mata kuliah yang memiliki CPMK sama dengan magang atau mata kuliah magang dengan total maksimal 20 (dua puluh) sks.\r\n(5) Persyaratan mahasiswa yang dapat mengikuti kegiatan magang di Program Studi yang belum memiliki mata kuliah magang adalah mahasiswa sudah lulus 72 (tujuh puluh dua sks.\r\n(6) Mekanisme dan penyelenggaraan kegiatan magang/ praktik kerja dikembangkan dan dikoordinasikan oleh Direktorat yang mengurusi kemahasiswaan.'
 'KERJA PRAKTIK\nDepartemen Teknik Informatika ITS\n\nSekilas Kerja Praktik\n\nJumlah kredit Mata Kuliah KP: 2 SKS\nSKS KP diambil bersamaan / setelah menyelesaikan KP di organisasi (perusahaan, instansi, yayasan)\nLama KP: 1-2 bulan dengan hitungan kerja part time\nBisa perorangan atau berkelompok maksimal 2 (dua) mahasiswa\nBerkas-berkas KP bisa didapatkan di link resource akademik:\nhttps://intip.in/ResourceAkademikDanKemahasiswaanIF\nProsedur Kerja Praktik\n\nMengajukan KP\nSurat Pengantar KP\nDosen Pembimbing KP\nPelaksanaan KP\nPenilaian KP oleh Pembimbing Lapangan\nPenilaian KP oleh Dosen Pembimbing\nPenyerahan Laporan KP ke RBTC\nMengumpulkan bukti penyelesaian KP\nLulus KP\nSebelum berangkat KP\n\nMengajukan KP\n\nMemenuhi persyaratan sebagai berikut:\nMahasiswa aktif Teknik Informatika\nSKS tempuh minimum 90 SKS\nMengisi MONKP:\nmonkp.if.its.ac.id (registrasi akun dan data KP)\nStatus KP akan menjadi CREATED\nSurat Pengantar Kerja Praktik'
 'Sudah menyelesaikan segala pekerjaan terkait KP di perusahaan dan sudah kembali aktif di kampus\nMenemui dosen pembimbing untuk melakukan ujian lisan dan menyerahkan Formulir Penilaian Ujian Lisan Kerja Praktik untuk diisi oleh dosen pembimbing internal\nDosen pembimbing internal mengirimkan nilai ke koordinator KP via email\nJika nilai telah diterima koordinator KP, maka status KP akan menjadi FINISHED\nMenyerahkan Laporan KP\nSudah menyelesaikan segala urusan KP dengan dosen pembimbing\nDokumentasi KP sudah disetujui dan ditandatangani oleh dosen pembimbing\nDokumentasi tersebut berupa softcopy dan diunggah ke repo ITS (lihat manual unggah ke repo ITS di manual unggah mandiri)\nMenerima Bukti Penyerahan KP dari REPO ITS\nMengunggah buku KP dan bukti terima repo ITS ke MS TEAMS KP pada link berikut:\nhttps://teams.microsoft.com/l/team/19%3a447977fe03c040ff98ad9e82e63982e2%40thread.tacv2/conversations?groupId=862aa22c-c596-49e1-94dd-6354fd625a2e&tenantId=1d5169ac-c7cb-4275-9764-bf8c9c364a4c']",1 SKS = 2.720 menit magang atau 45 jam,0.9999999999666667,0.0,0.9801432918619408,0.0
4,Apa durasi maksimal magang menurut peraturan rektor?,Durasi maksimal magang menurut peraturan rektor adalah 6 bulan.,"['Panduan Umum Magang\n\nDurasi magang maksimal 6 bulan\nWajib dibimbing oleh dosen pembimbing internal (dosen ITS) dan pembimbing eksternal (pihak industri)\nMahasiswa bisa mendapatkan izin untuk melakukan kegiatan tertentu (sesuai kesepakatan)\nPada saat magang, mahasiswa tidak harus cuti\nIndustri dapat menawarkan pemberian sertifikat kompetensi dengan syarat dan ketentuan tertentu\nSebelum magang, akan ada nota kesepahaman dan perjanjian kerja sama\nKerja Praktek\n\nSatu atau beberapa MK yang memiliki capaian pembelajaran setara dengan kegiatan magang (disarankan lebih ke MK pilihan)\nGabungan kerja praktek dan satu atau beberapa MK yang memiliki capaian pembelajaran setara dengan kegiatan magang\nMK pilihan magang (diupayakan masuk dalam kurikulum)\nKonversi Magang\n\nMengambil beberapa MK (perkuliahan secara online)\nPenguatan Program Magang di ITS'
 '6.1\nKRITERIA DOSEN PEMBIMBING MAGANG\nW888\nDosen yang telah mengajar selama 4 semester berturut-turut.\nMemperoleh SK Pembimbing Magang dari Departemen dan ketetapan melalui\nKeputusan Dekan.\n6.2\nRINCIAN TUGAS DOSEN PEMBIMBING\nMAGANG\n• Memberikan saran dan masukan saat konsultasi keilmuan jika diperlukan oleh mahasiswa selama magang.\n• Melakukan kegiatan pembimbingan bagi mahasiswa magang untuk dapat berkonsultasi selama magang atau bimbingan penulisan laporan magang.\n• Memberikan persetujuan dan penilaian Laporan Magang.\n• Memberikan penilaian dapat dilakukan dalam bentuk penilaian laporan magang dan atau presentasi kegiatan magang.\n40\n06 Pembimbingan Magang'
 'Pasal 4\n Mahasiswa     dalam pelaksanaan magang harus        memenuhi ketentuan\n sebagai berikut:\n a. Magang memiliki durasi minimal 3 bulan sampai maksimal 6 bulan\n     dalam 1 periode;\n b. mahasiswa wajib dibimbing oleh pembimbing internal dari dosen ITS\n     dan pembimbing eksternal dari pihak industri;\n c. selama magang mahasiswa secara penuh waktu bekerja di lapangan\n     sesuai kesepakatan;\n d. mahasiswa dapat mendapatkan ijin untuk melakukan kegiatan\n     akademik tertentu, melalui pembicaraan dan kesepakatan dengan\n     pihak industri;\n e. pada waktu pelaksanaan magang, mahasiswa tidak harus cuti;\n f. industri yang menawarkan magang dapat memberikan sertifikat\n     kompetensi dengan syarat dan ketentuan tertentu; dan\n g. sebelum    kegiatan     magang    dilaksanakan    harus   ada   nota\n     kesepahaman dan perjanjian kerja sama.\n\n\n                                  Pasal II\nPeraturan Rektor ini mulai berlaku pada tanggal ditetapkan.'
 'Mengambil beberapa MK (perkuliahan secara online)\nPenguatan Program Magang di ITS\n\nPerubahan SOTK → Unit Pengelolaan Magang Industri (Direktorat Kemahasiswaan)\nPenambahan kuliah wajib MK Magang → Fakultas Vokasi\nJenis Program Magang di ITS\n\nBerdasarkan Mitra Magang: BUMN, Non-BUMN, ITS, UKM/Kewirausahaan\nBerdasarkan Jalur Magang: PMMB, Non-PMMB, Mandiri, Kerjasama\nPENGHARGAAN FHCI UNTUK ITS\nITS sebagai kontributor terbaik PMMB 2019 bersama UGM dan Politeknik Negeri Ujung Pandang.\n\nKuliah Kerja Nyata (KKN)\nKegiatan KKN sebagai metode pembelajaran dan sarana pengabdian kepada masyarakat dengan tujuan:']",Maksimal 6 bulan,0.8333333332916666,1.0,0.9933014353523553,0.625
5,Apa itu MB-KM di ITS?,MB-KM di ITS adalah singkatan dari Merdeka Belajar - Kampus Merdeka. Ini adalah kebijakan Menteri Pendidikan dan Kebudayaan yang bertujuan untuk mendorong mahasiswa untuk menguasai berbagai keilmuan yang berguna untuk memasuki dunia kerja dengan memberikan kesempatan bagi mahasiswa untuk memilih mata kuliah yang akan mereka ambil.,"['13. Merdeka Belajar - Kampus Merdeka yang selanjutnya disingkat MB - KM adalah kebijakan Menteri Pendidikan dan Kebudayaan, yang bertujuan mendorong mahasiswa untuk menguasai berbagai keilmuan yang berguna untuk memasuki dunia kerja dengan memberikan kesempatan bagi mahasiswa untuk memilih mata kuliah yang akan mereka ambil.\r\n14. Kurikulum ITS adalah seperangkat rencana dan pengaturan mengenai capaian pembelajaran lulusan, bahan kajian, proses, dan penilaian yang digunakan sebagai pedoman penyelenggaraan program studi di ITS.\r\n15. Pembelajaran adalah proses interaksi mahasiswa dengan dosen dan sumber belajar pada suatu lingkungan belajar.\r\n16. Tahap Persiapan adalah tahap pembelajaran yang dijadwalkan dalam dua semester pertama pada kurikulum Program Sarjana atau dua paket semester pertama pada kurikulum Program Sarjana Terapan.'
 'a. Perencanaan bentuk MB KM, yang direncanakan oleh mahasiswa bersama dosen \nwali. Perencanaan terhadap unsur: (i) Waktu dan lama waktu pelaksanaan MBKM, \n(ii) bentuk MBKM, (iii) kesesuaian bentuk MBKM dengan target perncapaian CPL, \n(iv) luaran dari pelaksanaan MBKM,  \nb. Pelaksanaan pe nilaian dapat dilakukan pada proses dan hasil MBKM dengan \nmenggunakan prinsip, teknik , instrumen dan waktu asesmen proses dan hasil \nMBKM.  Penilaian menggunakan prinsip edukatif, otentik, objektif, akuntabel, dan \ntransparan yang dilakukan secara terintegrasi . Teknik penilaian dapat \nmenggunakan satu atau lebih dari kombinasi berikut ini: observasi, partisipasi, \nunjuk kerja, tes tertulis, tes lisan, dan angket . Instrumen penilaian dapat \ndigunakan satu atau kombinasi dari: rubrik dan atau portofolio.   \nc. Jumlah penilaian terhadap pelaksanaan MBKM minimal sebanyak 4 (empat).  \nd. Pelaporan terhadap proses dan hasil penilaian dilakukan oleh Dosen pembimbing \nakademik dalam pelaksanaan MBKM.'
 '(3) Tim MB-KM ITS ditetapkan melalui Keputusan Rektor.\r\n\r\n        BAB V KETENTUAN PENUTUP\r\n\r\nPasal 16\r\nPada saat Peraturan Rektor ini mulai berlaku, maka Peraturan Rektor Institut Teknologi Sepuluh Nopember Nomor 30 Tahun 2020 tentang Penyelenggaraan Kegiatan Merdeka Belajar - Kampus Merdeka Di Institut Teknologi Sepuluh Nopember dicabut dan dinyatakan tidak berlaku.\r\n\r\nPasal 17\r\nPeraturan Rektor ini mulai berlaku pada tanggal ditetapkan.\r\n\r\n\r\nDitetapkan di Surabaya\r\npada tanggal 12 Oktober 2021\r\nREKTOR INSTITUT TEKNOLOGI SEPULUH NOPEMBER,\r\n\r\n\r\n\r\n\r\nMOCHAMAD ASHARI\r\nNIP 196510121990031003'
 'BAB III\r\nRUANG LINGKUP KEGIATAN\r\n\r\nPasal 3\r\n(1) Kegiatan MB - KM merupakan proses pembelajaran yang dilaksanakan di luar Program Studi baik yang ada di internal ITS maupun di luar ITS yang terdiri atas:\r\na. pembelajaran dalam Program Studi lain di internal ITS;\r\n\r\nb. pembelajaran dalam Program Studi yang sama pada Perguruan Tinggi di luar ITS;\r\nc. pembelajaran dalam Program Studi lain pada Perguruan Tinggi di luar ITS; dan\r\nd. pembelajaran pada lembaga non Perguruan Tinggi.\r\n(2) Ruang lingkup kegiatan MB - KM adalah 8 (delapan) bentuk kegiatan pembelajaran (BKP) yang meliputi:\r\na. Magang/ Praktik Kerja;\r\nb. Membangun Desa/ Kuliah Kerja Nyata Tematik;\r\nc. Pertukaran Pelajar;\r\nd. Proyek Kemanusiaan;\r\ne. Penelitian/ Riset;\r\nf. Kegiatan Wirausaha;\r\ng. Studi/ Proyek Independen; dan\r\nh. Asistensi Mengajar di Satuan Pendidikan.\r\n(3) Dalam hal ada penambahan dan atau perubahan BKP MBKM sebagaimana dimaksud pada ayat (2) ditetapkan melalui Keputusan Rektor.']",Merdeka Belajar - Kampus Merdeka di Institut Teknologi Sepuluh Nopember,0.999999999975,0.75,0.9650594384821577,0.0
6,Apa saja bentuk kegiatan pembelajaran yang termasuk dalam MB-KM?,"Dalam MB-KM, terdapat beberapa bentuk kegiatan pembelajaran yang termasuk di dalamnya, yaitu:
1. Magang/Praktik Kerja
2. Membangun Desa/Kuliah Kerja Nyata Tematik
3. Pertukaran Pelajar
4. Proyek Kemanusiaan
5. Penelitian/Riset
6. Kegiatan Wirausaha
7. Studi/Proyek Independen
8. Asistensi Mengajar di Satuan Pendidikan

Semua bentuk kegiatan tersebut dapat dilaksanakan dalam rangka meraih Capaian Pembelajaran Lulusan (CPL) Program Studi.","['(4) Kegiatan MBKM – dalam bentuk pertukaran pelajar melalui MK di prodi di luar ITS, \ndengan ketentuan jumlah sks maksimal adalah 20 (dua puluh) sks, yang meliputi mata \nkuliah inti dan mata kuliah non inti.  \nIII STANDAR PROSES PEMBELAJARAN  \n5 Standar Proses –bentuk \npembelajaran MBKM  (i) Mahasiswa dapat melaksanakan kegiatan pembelajaran MBKM dalam rangka meraih CPL \nProdi dalam bentuk satu atau lebih bentuk berikut ini:  \na. Magang/ Praktik Kerja;  \nb. Membangun Desa/ Kuliah Kerja Nyata Tematik;  \nc. Pertukaran Pelajar;  \nd. Proyek Kemanusiaan;  \ne. Penelitian/ Riset;  \nf. Kegiatan Wirausaha;  \ng. Studi/ Proyek Independen; dan  \nh. Asistensi Mengajar di Satuan Pendidikan  \n(ii)  Pelaksanaan MB -KM bentuk (a) sd (h) dapat dilaksanakan dalam bentuk  online, offline 8 Dokumen Panduan Baku Mutu Pelaksanaan MBKM - 2021  \n NO ELEMEN PENILAIAN  INDIKATOR  \n(1) (2) (3) \natau kombinasi keduanya  \n6 Standar Proses – Tempat'
 'dan menengah ,   \n(iii) Kegiatan MBKM dalam bentuk asistensi mengajar di satuan pendidikan , merupakan \nkegiatan dalam bentuk: bantuan mengajar, tutorial, bimbingan teknis, pelatihan dan \nkegiatan lainnya yang relevan  dengan kegiatan akademik di satuan pendidikan tersebut.  \n(iv) Kegiatan MBKM dalam bentuk asistensi mengajar  dapat dikonversi ke dalam sks MK  \natau bentuk lain sesuai dengan ketercapaian CPL serta lama waktu proses kegiatan  \n(v) Kegiatan MBKM dalam bentuk asistensi mengajar dikembangkan oleh Direktorat yang 13 Dokumen Panduan Baku Mutu Pelaksanaan MBKM - 2021  \n NO ELEMEN PENILAIAN  INDIKATOR  \n(1) (2) (3) \nmengurusi kemahasiswaan.  \n(vi) Implementasi kegiatan MBKM  dalam bentuk asistensi mengajar  dikoordinasi oleh \nDirektorat yang mengurusi Kemahasiswaan bersama Prodi terkait , melalui tahapan  \nkegiatan (a) persiapan, (b) Pelaksanaa n, (c) Evaluasi, (d) Pengendalian, dan (e) \nPeningkatan  \n Standar Proses –  \nKegiatan MBKM – Bentuk \nMagang / Praktik Kerja dan'
 'kegiatan (a) persiapan, (b) Pelaksanaa n, (c) Evaluasi, (d) Pengendalian, dan (e) \nPeningkatan  \n Standar Proses –  \nKegiatan MBKM – Bentuk \nMagang / Praktik Kerja dan \nWirausaha lingkup Hilirisasi  (i) Kegiatan MBKM dalam bentuk Magang/ Praktik Kerja dan Kegiatan Wirausaha Lingkup \nHilirisasi ditujukan untuk  memperlancar karir lulusan, pengayaan kompetensi \nmahasiswa, kolaborasi magang, wirausaha dan kerja sama pengembangan produk \ninovatif  dalam rangka meraih profil lulusan sebagai  inovator yang produktif.  \n(ii) Kegiatan MBKM dalam bentuk magang/ praktik kerja dan kegiatan wirausaha hilirisasi \ndapat berupa kegiatan penelitian dan pengabdian masyarakat bersama civitas \nakademika yang lain untuk memecahkan persoalan di masyarakat atau indust ri, inkubasi \ndan start -up.  \n(iii) Kegiatan MBKM dalam bentuk magang/ praktik kerja dan kegiatan wirausaha hilirisasi \ndikembangkan oleh  Direktorat yang mengurusi inovasi dan kawasan sains teknologi'
 'dan start -up.  \n(iii) Kegiatan MBKM dalam bentuk magang/ praktik kerja dan kegiatan wirausaha hilirisasi \ndikembangkan oleh  Direktorat yang mengurusi inovasi dan kawasan sains teknologi \nbekerjasama dengan Direktorat yang mengurusi kemahasiswaan . \n(iv) Impl ementasi kegiatan MBKM dalam bentuk  magang/ praktik kerja dan kegiatan \nwirausaha hilirisasi dikoordinir oleh Direktorat yang mengurusi  inovasi dan kawasan \nsains teknologi  bersama Prodi terkait, melalui tahapan  kegiatan (a) persiapan, (b) \nPelaksanaan, (c) Evaluasi, (d) Pengendalian, dan (e) Peningkatan   \n \nIV STANDAR PENILAIAN PEMBELAJARAN  \n11 Standar penilaian  (i) Penilaian atas proses dan hasil pelaksanaan MBKM mengacu pada prinsip penilaian.  \n \n 14 Dokumen Panduan Baku Mutu Pelaksanaan MBKM - 2021  \n NO ELEMEN PENILAIAN  INDIKATOR  \n(1) (2) (3) \nDalam hal mahasiswa mendapatkan nilai mata kuliah pengayaan kurang dari C, maka \nmahasiswa dapat menggantinya dengan mata kuliah pengayaan yang berbeda.']","Magang/Praktik Kerja, Membangun Desa/Kuliah Kerja Nyata Tematik, Pertukaran Pelajar, Proyek Kemanusiaan, Penelitian/Riset, Kegiatan Wirausaha, Studi/Proyek Independen, dan Asistensi Mengajar di Satuan Pendidikan.",0.999999999975,1.0,0.9999971938046656,1.0
7,Kapan pelaksanaan kegiatan pengabdian kepada masyarakat dapat dilakukan dalam program sarjana di ITS?,"Pelaksanaan kegiatan pengabdian kepada masyarakat dalam program sarjana di ITS dapat dilakukan pada semester 6 (enam) dan 7 (tujuh). Namun, kegiatan pengabdian kepada masyarakat juga dapat dilaksanakan sebelum semester 6 (enam) dan 7 (tujuh) asalkan mahasiswa sudah lulus tahap persiapan dengan menggunakan sistem tabung nilai.","['(4) Pelaksanaan kegiatan pengabdian kepada masyarakat adalah pada semester 6 (enam) dan 7 (tujuh).\r\n(5) Pelaksanaan kegiatan pengabdian kepada masyarakat dapat dilaksanakan sebelum semester 6 (enam) dan 7 (tujuh) tetapi sudah lulus tahap persiapan dengan menggunakan sistem tabung nilai.\r\n(6) Mekanisme dan penyelenggaraan kegiatan pengabdian kepada masyarakat dikembangkan dan dikoordinasikan oleh Direktorat yang mengurusi riset dan pengabdian kepada masyarakat.\r\n(7) Direktorat yang mengurusi riset dan pengabdian kepada masyarakat dalam menyelenggarakan kegiatan pengabdian kepada masyarakat sebagaimana dimaksud pada ayat (6) berkoordinasi dengan Program Studi terkait.\r\n\r\nBagian Ketiga\r\nPertukaran Pelajar/ Kuliah Lingkup Dalam Negeri\r\n\r\nPasal 7'
 '(v) Bentuk kegiatan pengabdian kepada masyarakat merupakan salah satu bentuk 7 Dokumen Panduan Baku Mutu Pelaksanaan MBKM - 2021  \n NO ELEMEN PENILAIAN  INDIKATOR  \n(1) (2) (3) \nimplementasi MK pengayaan dengan bobot 3 (tiga) sks.  \n \n4 Standar Isi  – Pengakuan bobot \nsks (1) Jumlah sks maksimal yang dapat diambil dalam rangka pelaksanaan kegiatan MB – KM \nadalah 40 (empat puluh) sks.  \n(2) Kegiatan magang/ praktik kerja pada program sarjana terapan diimplementasikan dalam \nbentuk mata kuliah wajib sebagai  mata kuliah penciri Fakultas  Vokasi sebesar 14 (empat \nbelas) sks.  \n(3) Konversi kegiatan MB -KM magang dapat dikonversikan ke dalam: (i) MK KP,  \n(ii) beberapa MK gabungan antara KP dengan MK lain dengan kesamaan CP MK,  \n(iii) MK magang dengan maksimum bobot 20 (dua puluh) sks.   \n(4) Kegiatan MBKM – dalam bentuk pertukaran pelajar melalui MK di prodi di luar ITS, \ndengan ketentuan jumlah sks maksimal adalah 20 (dua puluh) sks, yang meliputi mata'
 '(6) Mekanisme dan penyelenggaraan kegiatan magang/ praktik kerja dikembangkan dan dikoordinasikan oleh Direktorat yang mengurusi kemahasiswaan.\r\n(7) Direktorat Kemahasiswaan dalam menyelenggarakan kegiatan magang/ praktik kerja sebagaimana dimaksud pada ayat (6) berkoordinasi dengan Program Studi terkait.\r\n\r\n         Bagian Kedua Pengabdian Kepada Masyarakat\r\n\r\nPasal 6\r\n(1) Kegiatan pengabdian kepada masyarakat ditujukan untuk pembinaan karakter kebangsaan mahasiswa khususnya untuk menumbuhkan kepedulian terhadap persoalan yang dihadapi masyarakat.\r\n(2) Kegiatan pengabdian kepada masyarakat pada program sarjana diimplementasikan dalam bentuk mata kuliah pengayaan sebesar 3 (tiga) sks.\r\n(3) Kegiatan pengabdian kepada masyarakat pada program sarjana terapan, dapat diambil untuk tambahan sks atau dapat dikompensasi dengan mata kuliah Program Studi yang memiliki capaian pembelajaran yang setara.'
 'kegiatan (a) persiapan, (b) Pelaksanaa n, (c) Evaluasi, (d) Pengendalian, dan (e) \nPeningkatan  \n Standar Proses –  \nKegiatan MBKM – Bentuk \nMagang / Praktik Kerja dan \nWirausaha lingkup Hilirisasi  (i) Kegiatan MBKM dalam bentuk Magang/ Praktik Kerja dan Kegiatan Wirausaha Lingkup \nHilirisasi ditujukan untuk  memperlancar karir lulusan, pengayaan kompetensi \nmahasiswa, kolaborasi magang, wirausaha dan kerja sama pengembangan produk \ninovatif  dalam rangka meraih profil lulusan sebagai  inovator yang produktif.  \n(ii) Kegiatan MBKM dalam bentuk magang/ praktik kerja dan kegiatan wirausaha hilirisasi \ndapat berupa kegiatan penelitian dan pengabdian masyarakat bersama civitas \nakademika yang lain untuk memecahkan persoalan di masyarakat atau indust ri, inkubasi \ndan start -up.  \n(iii) Kegiatan MBKM dalam bentuk magang/ praktik kerja dan kegiatan wirausaha hilirisasi \ndikembangkan oleh  Direktorat yang mengurusi inovasi dan kawasan sains teknologi']",Pada semester 6 dan 7.,0.999999999975,1.0,0.9915681911611313,1.0
8,Apa fungsi dari Tim MB-KM ITS?,Tim MB-KM ITS memiliki fungsi untuk ditetapkan melalui Keputusan Rektor dan bertanggung jawab dalam pelaksanaan kegiatan Merdeka Belajar - Kampus Merdeka di Institut Teknologi Sepuluh Nopember. Tim ini memiliki peran penting dalam mengawasi dan mengkoordinasikan berbagai kegiatan pembelajaran di luar Program Studi baik di internal maupun di luar ITS sesuai dengan ketentuan yang berlaku.,"['13. Merdeka Belajar - Kampus Merdeka yang selanjutnya disingkat MB - KM adalah kebijakan Menteri Pendidikan dan Kebudayaan, yang bertujuan mendorong mahasiswa untuk menguasai berbagai keilmuan yang berguna untuk memasuki dunia kerja dengan memberikan kesempatan bagi mahasiswa untuk memilih mata kuliah yang akan mereka ambil.\r\n14. Kurikulum ITS adalah seperangkat rencana dan pengaturan mengenai capaian pembelajaran lulusan, bahan kajian, proses, dan penilaian yang digunakan sebagai pedoman penyelenggaraan program studi di ITS.\r\n15. Pembelajaran adalah proses interaksi mahasiswa dengan dosen dan sumber belajar pada suatu lingkungan belajar.\r\n16. Tahap Persiapan adalah tahap pembelajaran yang dijadwalkan dalam dua semester pertama pada kurikulum Program Sarjana atau dua paket semester pertama pada kurikulum Program Sarjana Terapan.'
 'a. Perencanaan bentuk MB KM, yang direncanakan oleh mahasiswa bersama dosen \nwali. Perencanaan terhadap unsur: (i) Waktu dan lama waktu pelaksanaan MBKM, \n(ii) bentuk MBKM, (iii) kesesuaian bentuk MBKM dengan target perncapaian CPL, \n(iv) luaran dari pelaksanaan MBKM,  \nb. Pelaksanaan pe nilaian dapat dilakukan pada proses dan hasil MBKM dengan \nmenggunakan prinsip, teknik , instrumen dan waktu asesmen proses dan hasil \nMBKM.  Penilaian menggunakan prinsip edukatif, otentik, objektif, akuntabel, dan \ntransparan yang dilakukan secara terintegrasi . Teknik penilaian dapat \nmenggunakan satu atau lebih dari kombinasi berikut ini: observasi, partisipasi, \nunjuk kerja, tes tertulis, tes lisan, dan angket . Instrumen penilaian dapat \ndigunakan satu atau kombinasi dari: rubrik dan atau portofolio.   \nc. Jumlah penilaian terhadap pelaksanaan MBKM minimal sebanyak 4 (empat).  \nd. Pelaporan terhadap proses dan hasil penilaian dilakukan oleh Dosen pembimbing \nakademik dalam pelaksanaan MBKM.'
 '(3) Tim MB-KM ITS ditetapkan melalui Keputusan Rektor.\r\n\r\n        BAB V KETENTUAN PENUTUP\r\n\r\nPasal 16\r\nPada saat Peraturan Rektor ini mulai berlaku, maka Peraturan Rektor Institut Teknologi Sepuluh Nopember Nomor 30 Tahun 2020 tentang Penyelenggaraan Kegiatan Merdeka Belajar - Kampus Merdeka Di Institut Teknologi Sepuluh Nopember dicabut dan dinyatakan tidak berlaku.\r\n\r\nPasal 17\r\nPeraturan Rektor ini mulai berlaku pada tanggal ditetapkan.\r\n\r\n\r\nDitetapkan di Surabaya\r\npada tanggal 12 Oktober 2021\r\nREKTOR INSTITUT TEKNOLOGI SEPULUH NOPEMBER,\r\n\r\n\r\n\r\n\r\nMOCHAMAD ASHARI\r\nNIP 196510121990031003'
 'BAB III\r\nRUANG LINGKUP KEGIATAN\r\n\r\nPasal 3\r\n(1) Kegiatan MB - KM merupakan proses pembelajaran yang dilaksanakan di luar Program Studi baik yang ada di internal ITS maupun di luar ITS yang terdiri atas:\r\na. pembelajaran dalam Program Studi lain di internal ITS;\r\n\r\nb. pembelajaran dalam Program Studi yang sama pada Perguruan Tinggi di luar ITS;\r\nc. pembelajaran dalam Program Studi lain pada Perguruan Tinggi di luar ITS; dan\r\nd. pembelajaran pada lembaga non Perguruan Tinggi.\r\n(2) Ruang lingkup kegiatan MB - KM adalah 8 (delapan) bentuk kegiatan pembelajaran (BKP) yang meliputi:\r\na. Magang/ Praktik Kerja;\r\nb. Membangun Desa/ Kuliah Kerja Nyata Tematik;\r\nc. Pertukaran Pelajar;\r\nd. Proyek Kemanusiaan;\r\ne. Penelitian/ Riset;\r\nf. Kegiatan Wirausaha;\r\ng. Studi/ Proyek Independen; dan\r\nh. Asistensi Mengajar di Satuan Pendidikan.\r\n(3) Dalam hal ada penambahan dan atau perubahan BKP MBKM sebagaimana dimaksud pada ayat (2) ditetapkan melalui Keputusan Rektor.']","Memfasilitasi implementasi kegiatan MB-KM di ITS, termasuk membuat prosedur operasional baku, dokumen teknis, penjaminan mutu, sistem aplikasi dan hal lainnya.",0.999999999975,0.16666666666666666,0.997360850458629,0.0
9,Apa tujuan penjaminan mutu MBKM?,"Tujuan penjaminan mutu MBKM antara lain adalah menjadi sarana bagi perguruan tinggi dalam membentuk jejaring atau mitra strategis dalam membantu pembangunan desa, menjadi sarana pengembangan tri dharma perguruan tinggi, menjadi sarana aktualisasi dosen dalam pengembangan ilmu pengetahuan. Bagi desa, tujuannya adalah memperoleh bantuan pemikiran dan tenaga dari tenaga terdidik untuk menyuusun Rencana Pembangunan Jangka Menengah Desa (RPJMDes) dan Rencana Kegiatan Pembangunan Desa (RKPDes), membantu perubahan/perbaikan tata kelola desa, memacu terbentuknya tenaga muda yang diperlukan dalam pemberdayaan masyarakat desa, membantu pengayaan wawasan masyarakat terhadap pembangunan desa, serta percepatan pembangunan di wilayah pedesaan.","['b) Menjadi   sarana bagi perguruan tinggi dalam membentuk jejaring atau mitra \nstrategis dalam membantu pembangunan desa.\nc)  Menjadi sarana pengembangan tri dharma perguruan tinggi.\nd)  Menjadi sarana aktualisasi dosen dalam pengembangan ilmu pengetahuan.\n3) Bagi Desa\na) Memperoleh bantuan pemikiran dan tenaga dari tenaga terdidik untuk \nmenyusun Rencana Pembangunan Jangka Menengah Desa (RPJMDes) dan \nRencana Kegiatan Pembangunan Desa (RKPDes).\nb) Membantu perubahan/perbaikan tata kelola desa.  \nc)  Memacu terbentuknya tenaga muda yang diperlukan dalam pemberdayaan \nmasyarakat desa\nd)  Membantu pengayaan wawasan masyarakat terhadap pembangunan desa.\ne) Percepatan pembangunan di wilayah pedesaan.\nSelain persyaratan umum yang terdapat pada pelaksanaan kebijakan Merdeka Belajar \n- Kampus Merdeka di atas, untuk kegiatan KKNT terdapat persyaratan tambahan \nyang harus dipenuhi oleh mahasiswa, yaitu:\n1) Mahasiswa telah menyelesaikan proses pembelajaran setelah  semester 6.'
 '• BAB 5. REFLEKSI DIRI\n• Mahasiswa mendeskripsikan tentang hal-hal positif yang diterima selama perkuliahan yang bermanfaat / relevan terhadap pekerjaan selama magang.\n• Mahasiswa menjelaskan tentang manfaat magang terhadap pengembangan soft-skills dan kekurangan soft-skills yang dimilikinya.\n• Mahasiswa memberikan penjabaran tentang manfaat magang terhadap pengembangan kemampuan kognitif dan kekurangan kemampuan kognitif yang dimilikinya.\nBuku Petunjuk Teknis Magang\n49'
 'PENDAFTARAN\nPERSYARATAN PENDAFTARAN MAHASISWA\n1. Mahasiswa aktif semester 3 - 7 di perguruan tinggi non vokasi di bawah Direktorat Jenderal Pendidikan Tinggi, Kementerian Pendidikan, Kebudayaan, Riset dan Teknologi RI;\n2. Memiliki indeks prestasi kumulatif (PK) 2,75 dari skala 4. Untuk mahasiswa yang memiliki IPK di bawah 2,75 dapat melampirkan sertifikat prestasi resmi minimal tingkat provinsi;\n3. Tidak pernah dikenakan sanksi akademik dan non akademik pada perguruan tinggi pengirim;\n4. Bukan mahasiswa peserta program PERMATA atau PERMATA SAKTI;\n5. Memiliki satu kali kesempatan untuk mengikuti dan memperoleh bantuan biaya program Pertukaran Mahasiswa Merdeka;\n6. Bersedia mentaati seluruh ketentuan yang tertulis di dalam POB\nprogram Pertukaran Mahasiswa Merdeka.\nAPA YANG HARUS MAHASISWA PERSIAPKAN SEBELUM MENDAFTAR?\n1. Mahasiswa memastikan data diri (nama, tempat tanggal lahir, NIM dan NIK) sesuai dengan data di PDDIKTI (https://\npddikti.kemdikbud.go.id)'
 '5. Surat persetujuan orang tua/wali (contoh terlampir)\n6. Surat pakta integritas (contoh terlampir\nPERTANYAAN YANG SERING DITANYAKAN\nT. Mahasiswa dari perguruan tinggi apa saja yang dapat mengikuti program Pertukaran Mahasiswa Merdeka?\nJ. Mahasiswa dari perguruan tinggi negeri maupun swasta non vokasi di bawah Direktorat Jenderal Pendidikan Tinggi, Kementerian Pendidikan, Kebudayaan, Riset, dan Tenologi RI.\nJ. Apakah Pertukaran Mahasiswa Merdeka 2021 untuk mahasiswa S1 saja?\nA. Pertukaran Mahasiswa Merdeka 2021 diperuntukkan untuk mahasiswa jenjang St.\nT. Apakah mahasiswa yang lolos akan menerima bantuan potongan\nUKT?\nJ. Mahasiswa akan menerima bantuan potongan UKT sebesar maksimal Rp 2.400.000 dengan syarat bukan penerima bantuan\nUKT dari beasiswa pemerintah lainnya.\nT. Bagaimana jika UKT saya lebih kecil dari 2,4 juta?\nJ. Bantuan UKT akan dibayarkan at cost (sesuai besaran UKT mahasiswa).']",Untuk meningkatkan kompetensi lulusan dengan soft skills dan hard skills.,0.99999999995,1.0,0.9711497854832265,0.0
10,Apa tujuan dari MBKM?,"Tujuan dari MBKM adalah:
1. Melakukan pengukuran ketercapaian CPL untuk masing-masing bentuk MBKM.
2. Melakukan penilaian dan evaluasi atas proses dan hasil kegiatan MBKM.
3. Melakukan pengendalian proses implementasi MBKM.
4. Melakukan peningkatan implementasi MBKM, berdasarkan hasil survey kepuasan pihak internal dan eksternal stakeholder yang terlibat di dalam implementasi MBKM.","['meingimplementasi MBKM, dengan tujuan:  \n(i) Melakukan pengukuran ketercapaian CPL untuk masing -masing bentuk \nMBKM.  \n(ii) Melakukan penilaian dan evaluasi atas proses dan hasil kegiatan MBKM  \n(iii) Melakukan pengendalian proses implementasi MBKM  \n(iv) Melakukan peningkatan impleme ntasi MBKM, atas hasil survey kepuasan \npihak internal dan eksternal stakeholder yang terlibat di dalam implementasi \nMBKM.    \n \n \n \n 21 Baku Mutu - MBKM   - 2021'
 'b) Menjadi   sarana bagi perguruan tinggi dalam membentuk jejaring atau mitra \nstrategis dalam membantu pembangunan desa.\nc)  Menjadi sarana pengembangan tri dharma perguruan tinggi.\nd)  Menjadi sarana aktualisasi dosen dalam pengembangan ilmu pengetahuan.\n3) Bagi Desa\na) Memperoleh bantuan pemikiran dan tenaga dari tenaga terdidik untuk \nmenyusun Rencana Pembangunan Jangka Menengah Desa (RPJMDes) dan \nRencana Kegiatan Pembangunan Desa (RKPDes).\nb) Membantu perubahan/perbaikan tata kelola desa.  \nc)  Memacu terbentuknya tenaga muda yang diperlukan dalam pemberdayaan \nmasyarakat desa\nd)  Membantu pengayaan wawasan masyarakat terhadap pembangunan desa.\ne) Percepatan pembangunan di wilayah pedesaan.\nSelain persyaratan umum yang terdapat pada pelaksanaan kebijakan Merdeka Belajar \n- Kampus Merdeka di atas, untuk kegiatan KKNT terdapat persyaratan tambahan \nyang harus dipenuhi oleh mahasiswa, yaitu:\n1) Mahasiswa telah menyelesaikan proses pembelajaran setelah  semester 6.'
 'NO ELEMEN PENILAIAN  INDIKATOR  \n(1) (2) (3) \nmengurusi riset dan  pengabdian kepada masyarakat . \n(ix) Implementasi MBKM dalam bentuk penelitian/ riset dikembangkan dan dikoordin ir oleh \nDirektorat yang mengurusi riset dan pengabdian kepada masyarakat  bersama Prodi \nterkait ,  melalui tahapan kegiatan (a) persiapan, (b) Pelaksanaan, (c) Evaluasi, (d) \nPengendalian, dan (e) Peningkatan.  \n \n12 Standar Proses –  \nKegiatan MBKM – bentuk \nKewirausahaan  (i) Kegiatan MBKM dalam bentuk wirausaha  dimaksudkan untuk mendukung pencapaian \nprofil sebagai kader pengusaha yang mendukung perkembangan ITS di masa \nmendatang . \n(ii) Kegiatan MBKM dalam bentuk wirausaha  dapat dikonversi ke dalam sks MK sesuai \ndengan ketercapaian CPL atau bentuk lain  \n(iii) Kegiatan MBKM da lam bentuk wirausaha  dikembangkan oleh Direktorat yang \nmengurusi Kemahasiswaan.  \n(x) Implementasi  Kegiatan MBKM dalam bentuk wirausaha  dikoordinir oleh Direktorat'
 'MERDEKA BELAJAR – KAMPUS MERDEKA (MB-KM) DI INSTITUT TEKNOLOGI SEPULUH NOPEMBER\nDisampaikan di IPITS 2020\nINSTITUT TEKNOLOGI SEPULUH NOPEMBER, Surabaya - Indonesia\n\nMERDEKA BELAJAR DAN KAMPUS MERDEKA (MB-KM)\nOutline:\n\nPENDAHULUAN\nDASAR HUKUM MB-KM\nKEGIATAN MB-KM DI ITS\nTERIMA KASIH\nPENDAHULUAN\n\nTantangan Abad 21\nSosialisasi Program MB-KM, Ditjen Dikti, 2020\nKampus Merdeka\n\nHak Belajar 3 Semester di Luar Program Studi (Prodi)\nPermendikbud Nomor 3 Tahun 2020 tentang Standar Nasional Pendidikan Tinggi\n\nMahasiswa memiliki kesempatan untuk:\n\nSatu semester atau setara dengan 20 SKS menempuh pembelajaran di luar program studi pada perguruan tinggi yang sama.\nPaling lama dua semester atau setara dengan 40 SKS menempuh pembelajaran pada:\nProgram studi yang sama di perguruan tinggi yang berbeda\nProgram studi yang berbeda di perguruan tinggi yang berbeda\nDi luar perguruan tinggi\nDASAR HUKUM MB-KM']","Untuk menghasilkan lulusan yang berkualitas dan memenuhi visi, misi, tata nilai, dan tujuan ITS serta memenuhi SN-DIKTI.",0.8055555555287036,1.0,0.9999990147135418,0.0
11,Apa tujuan dari kegiatan magang/ praktik kerja?,"Tujuan dari kegiatan magang/ praktik kerja adalah untuk memperlancar karir lulusan, mengaya kompetensi mahasiswa, kolaborasi magang, wirausaha, serta kerja sama pengembangan produk inovatif. Kegiatan magang juga bertujuan untuk memecahkan persoalan di masyarakat atau industri, serta untuk meningkatkan profil lulusan sebagai inovator yang produktif.","['(3) Kegiatan magang/ praktik kerja pada program sarjana terapan diimplementasikan dalam bentuk mata kuliah wajib yang merupakan mata kuliah penciri Fakultas Vokasi sebesar 14 (empat belas) sks.\r\n(4) Kegiatan magang/ praktik kerja pada program sarjana dapat dikonversikan menjadi:\r\na. sks kerja praktek; atau\r\n\r\nb. sks satu atau beberapa mata kuliah yang memiliki Capaian Pembelajaran Mata Kuliah (CPMK) sama dengan magang; atau\r\nc. sks gabungan antara kerja praktek dengan mata kuliah yang memiliki CPMK sama dengan magang atau mata kuliah magang dengan total maksimal 20 (dua puluh) sks.\r\n(5) Persyaratan mahasiswa yang dapat mengikuti kegiatan magang di Program Studi yang belum memiliki mata kuliah magang adalah mahasiswa sudah lulus 72 (tujuh puluh dua sks.\r\n(6) Mekanisme dan penyelenggaraan kegiatan magang/ praktik kerja dikembangkan dan dikoordinasikan oleh Direktorat yang mengurusi kemahasiswaan.'
 'kegiatan (a) persiapan, (b) Pelaksanaa n, (c) Evaluasi, (d) Pengendalian, dan (e) \nPeningkatan  \n Standar Proses –  \nKegiatan MBKM – Bentuk \nMagang / Praktik Kerja dan \nWirausaha lingkup Hilirisasi  (i) Kegiatan MBKM dalam bentuk Magang/ Praktik Kerja dan Kegiatan Wirausaha Lingkup \nHilirisasi ditujukan untuk  memperlancar karir lulusan, pengayaan kompetensi \nmahasiswa, kolaborasi magang, wirausaha dan kerja sama pengembangan produk \ninovatif  dalam rangka meraih profil lulusan sebagai  inovator yang produktif.  \n(ii) Kegiatan MBKM dalam bentuk magang/ praktik kerja dan kegiatan wirausaha hilirisasi \ndapat berupa kegiatan penelitian dan pengabdian masyarakat bersama civitas \nakademika yang lain untuk memecahkan persoalan di masyarakat atau indust ri, inkubasi \ndan start -up.  \n(iii) Kegiatan MBKM dalam bentuk magang/ praktik kerja dan kegiatan wirausaha hilirisasi \ndikembangkan oleh  Direktorat yang mengurusi inovasi dan kawasan sains teknologi'
 '(8) Mekanisme dan penyelenggaraan kegiatan asistensi mengajar di satuan pendidikan dikembangkan dan dikoordinasikan oleh Direktorat yang mengurusi kemahasiswaan.\r\n(9) Direktorat yang mengurusi kemahasiswaan dalam menyelenggarakan kegiatan asistensi mengajar di satuan pendidikan sebagaimana dimaksud pada ayat (8) berkoordinasi dengan Program Studi terkait.\r\n\r\nBagian Kesembilan\r\nMagang/ Praktik Kerja dan Kegiatan Wirausaha Lingkup Hilirisasi\r\n\r\nPasal 14\r\n(1) Kegiatan magang/ praktik kerja dan kegiatan wirausaha hilirisasi ditujukan untuk memperlancar karir lulusan, pengayaan kompetensi mahasiswa, kolaborasi magang, wirausaha dan kerja sama pengembangan produk inovatif.\r\n(2) Bentuk kegiatan magang/ praktik kerja dan kegiatan wirausaha hilirisasi dapat berupa kegiatan penelitian dan pengabdian masyarakat bersama civitas akademika yang lain untuk memecahkan persoalan di masyarakat atau industri, inkubasi dan start-up.'
 'sesuai dengan kesepakata n tempat magang;  \n(ii) Mahasiswa yang melaksanakan magang dapat melakukan kegiatan praktek / kolaborasi \nriset / kerja sama pengembangan industri / bentu k kegiatan  lain  yang selaras dengan \nCPL’   \n(iii) Mahasiswa yang melaksanakan magang wajib  dibimbing oleh pembimbing internal dari \ndosen ITS dan  pembimbing eksternal dari pihak  instansi / lembaga /  industri  tempat \nmagang ;  \n(iv) Mahasiswa yang melaksanakan magang dapat melakukan kegiatan akademik yang lain \ndengan syarat telah mendapatkan ijin dari pihak penanggung jawab lembaga / badan / \nindustri magang ;  \n(v) Mahasiswa pada waktu melaksanaan magang  tidak harus cuti  studi ;  \n(vi) Mahasiswa yang melaksa nakan magang dapat diberi  memberikan surat keterangan \nhasil kegiatan magang / sertifikat kompetensi  dari lembaga / badan / industri letak \nmagang sesuai dengan ketentuan yang berlaku;  \n 9 Dokumen Panduan Baku Mutu Pelaksanaan MBKM - 2021  \n NO ELEMEN PENILAIAN  INDIKATOR  \n(1) (2) (3)']","Memperlancar karir lulusan, pengayaan kompetensi mahasiswa, kolaborasi riset, dan kerja sama pengembangan industri.",0.999999999975,1.0,1.0000000000000013,1.0
12,Apa yang dimaksud dengan PDDikti?,"PDDikti merupakan singkatan dari Pusat Data dan Informasi Pendidikan Tinggi, yang merupakan lembaga di bawah naungan Kementerian Pendidikan, Kebudayaan, Riset, dan Teknologi Republik Indonesia. PDDikti bertanggung jawab dalam pengelolaan data dan informasi mengenai pendidikan tinggi di Indonesia, termasuk data mahasiswa, program studi, dan perguruan tinggi.","['TENTANG PROGRAM\nAPA ITU PERTUKARAN MAHASISWA MERDEKA?\nPertukaran Mahasiswa Merdeka adalah pertukaran mahasiswa selama satu semester dari satu klaster daerah ke klaster daerah lainnya yang memberikan pengalaman kebinekaan dan sistem alih kredit sebanyak 20 sks.\nMENGAPA MENDAFTAR PERTUKARAN MAHASISWA MERDEKA?\n1. Mahasiswa dapat berjumpa dengan mahasiswa lain dari perguruan tinggi yang berbeda;\n2. Mahasiswa dapat mendapatkan pengalaman langsung dan mempelajari kebudayaan daerah lainnya melalui pembelajaran\nModul Nusantara;\n3. Mahasiswa dapat memperluas atau meningkatkan kompetensi akademiknya;\n4. Mahasiswa dapat mengembangkan kepemimpinan, percaya diri dan kepekaan sosial\nSelain itu, mahasiswa juga akan mendapatkan insentif berupa:\n1. Bantuan biaya hidup selama 4 bulan Rp 700.000/bulan\n2. Bantuan biaya akomodasi selama 4 bulan Rp 500.000/bulan'
 'Subdit. PK2\nPeranan Perguruan Tinggi\nPimpinan Perguruan Tinggi\nPimpinan Perguruan Tinggi, bertugas untuk memberikan persetujuan final kepada mahasiswa yang ingin mendaftar program flagship MBKM, dengan ketentuan sebagai berikut:\n1) Pimpinan PT wajib mempunyai salah satu jabatan sebagai pimpinan perguruan tinggi;\n리\nPimpinan PT bertugas menentukan penanggung jawab dari masing-masing prodi atau fakultas untuk bertindak sebagai pihak yang akan merekomendasikan mahasiswa untuk mengikuti\nprogram MBKM; dan\n3)\nPimpinan PT bertugas memberikan persetujuan akhir daftar mahasiswa setelah mendapatkan rekomendasi dari prodi atau fakultas pada laman\nADVANCING HUMANITY\nPenanggungjawab Fakultas atau Prodi\nPenanggung Jawab Fakultas atau Prodi, bertugas untuk:\n1)\n2)\n3\nMelakukan verifikasi kebenaran data dan dokumen mahasiswa yang akan mendaftar Program flagship\nMBKM;'
 'pelaksanaan MBKM   \n4. Prodi mempunyai Dokumen pan duan untuk Mahasiswa dalam perencanaan , \npelaksannaan, penilaian pelaksanaan  MBKM  \n5. Prodi mempunyai d okumen panduan bagi administratur dalam perekaman pelaksanaan \ndan monev MBKM  \n \n8 Standar Pengelolaan – \nPeningkatan MBKM  Mutu, manfaat, kepuasan dan keberlanjutan kerjasama pendidikan  dalam MBKM  \n(i) UPPS dan Prodi melakukan survey kepuasaan kepada seluruh mitra kerjasama \npelaksanaan MBKM, sebagai upaya evaluasi dan keberlanjutan program MBKM.  \n(ii) Upaya yang dilakukan  Direktorat,  UPPS dan PS untuk meningkatkan animo \nmahasiswa dalam pelaksanaan MBKM  \n(iii) Ketersediaan layanan bagi mahasiswa dalam pelaksanaan MBKM di level Prodi dan \nlevel Direktorat terkait  \n(iv) Ketersediaan layanan bagi dosen pembimbing dalam dan pembimbing dari luar untuk \npelaksanaan MBKM  \n(v) Ketersediaan doku men panduan  17 Dokumen Panduan Baku Mutu Pelaksanaan MBKM - 2021  \n NO ELEMEN PENILAIAN  INDIKATOR  \n(1) (2) (3)'
 '5. Surat persetujuan orang tua/wali (contoh terlampir)\n6. Surat pakta integritas (contoh terlampir\nPERTANYAAN YANG SERING DITANYAKAN\nT. Mahasiswa dari perguruan tinggi apa saja yang dapat mengikuti program Pertukaran Mahasiswa Merdeka?\nJ. Mahasiswa dari perguruan tinggi negeri maupun swasta non vokasi di bawah Direktorat Jenderal Pendidikan Tinggi, Kementerian Pendidikan, Kebudayaan, Riset, dan Tenologi RI.\nJ. Apakah Pertukaran Mahasiswa Merdeka 2021 untuk mahasiswa S1 saja?\nA. Pertukaran Mahasiswa Merdeka 2021 diperuntukkan untuk mahasiswa jenjang St.\nT. Apakah mahasiswa yang lolos akan menerima bantuan potongan\nUKT?\nJ. Mahasiswa akan menerima bantuan potongan UKT sebesar maksimal Rp 2.400.000 dengan syarat bukan penerima bantuan\nUKT dari beasiswa pemerintah lainnya.\nT. Bagaimana jika UKT saya lebih kecil dari 2,4 juta?\nJ. Bantuan UKT akan dibayarkan at cost (sesuai besaran UKT mahasiswa).']",Pangkalan Data Perguruan Tinggi yang terintegrasi secara nasional.,0.49999999995,0.5,0.9285425354892162,0.0
13,Berapa jumlah kredit Mata Kuliah KP?,Jumlah kredit Mata Kuliah KP adalah 2 SKS.,"['KERJA PRAKTIK\nDepartemen Teknik Informatika ITS\n\nSekilas Kerja Praktik\n\nJumlah kredit Mata Kuliah KP: 2 SKS\nSKS KP diambil bersamaan / setelah menyelesaikan KP di organisasi (perusahaan, instansi, yayasan)\nLama KP: 1-2 bulan dengan hitungan kerja part time\nBisa perorangan atau berkelompok maksimal 2 (dua) mahasiswa\nBerkas-berkas KP bisa didapatkan di link resource akademik:\nhttps://intip.in/ResourceAkademikDanKemahasiswaanIF\nProsedur Kerja Praktik\n\nMengajukan KP\nSurat Pengantar KP\nDosen Pembimbing KP\nPelaksanaan KP\nPenilaian KP oleh Pembimbing Lapangan\nPenilaian KP oleh Dosen Pembimbing\nPenyerahan Laporan KP ke RBTC\nMengumpulkan bukti penyelesaian KP\nLulus KP\nSebelum berangkat KP\n\nMengajukan KP\n\nMemenuhi persyaratan sebagai berikut:\nMahasiswa aktif Teknik Informatika\nSKS tempuh minimum 90 SKS\nMengisi MONKP:\nmonkp.if.its.ac.id (registrasi akun dan data KP)\nStatus KP akan menjadi CREATED\nSurat Pengantar Kerja Praktik'
 '• Jika uang kuliah tunggal (UKT) saya lebih rendah dari Rp 2.400.000, maka bantuan UKT dari program ini akan dibayarkan\nsesuai biaya.\n• Jika saya tidak berhasil menyelesaikan program, maka saya bersedia untuk tidak menerima bantuan potongan UKT.\n• Untuk memastikan kebenaran data dan menyetujui semua ketentuan yang berlaku pada pendaftaran program Pertukaran\n17'
 'dapat menuliskan hal-hal yang dilakukannya beserta hasilnya dalam bentuk tugas \nakhir.\nPelaksanaan KKNT dilakukan untuk mendukung kerja sama bersama Kementerian \nDesa PDTT serta Kementerian/ stakeholder  lainnya. Pemerintah melalui Kementerian \nDesa PDTT menyalurkan dana desa 1 milyar per desa kepada sejumlah 74.957 \ndesa di Indonesia, yang berdasarkan data Indeks Desa Membangun (IDM) tahun \n2019, terdapat desa sangat tertinggal sebanyak 6.549 dan desa tertinggal 20.128. \nPelaksanaan KKNT dapat dilakukan pada desa sangat tertinggal, tertinggal dan \nberkembang, yang sumber daya manusianya  belum memiliki kemampuan \nperencanaan pembangunan dengan fasilitas dana yang besar tersebut. Sehingga \nefektivitas penggunaan dana desa untuk menggerakkan pertumbuhan ekonomi \nmasih perlu ditingkatkan, salah satunya melalui mahasiswa yang dapat menjadi \nsumber daya manusia yang lebih memberdayakan dana desa.\n23       Buku Panduan Merdeka Belajar - Kampus Merdeka'
 '5. Surat persetujuan orang tua/wali (contoh terlampir)\n6. Surat pakta integritas (contoh terlampir\nPERTANYAAN YANG SERING DITANYAKAN\nT. Mahasiswa dari perguruan tinggi apa saja yang dapat mengikuti program Pertukaran Mahasiswa Merdeka?\nJ. Mahasiswa dari perguruan tinggi negeri maupun swasta non vokasi di bawah Direktorat Jenderal Pendidikan Tinggi, Kementerian Pendidikan, Kebudayaan, Riset, dan Tenologi RI.\nJ. Apakah Pertukaran Mahasiswa Merdeka 2021 untuk mahasiswa S1 saja?\nA. Pertukaran Mahasiswa Merdeka 2021 diperuntukkan untuk mahasiswa jenjang St.\nT. Apakah mahasiswa yang lolos akan menerima bantuan potongan\nUKT?\nJ. Mahasiswa akan menerima bantuan potongan UKT sebesar maksimal Rp 2.400.000 dengan syarat bukan penerima bantuan\nUKT dari beasiswa pemerintah lainnya.\nT. Bagaimana jika UKT saya lebih kecil dari 2,4 juta?\nJ. Bantuan UKT akan dibayarkan at cost (sesuai besaran UKT mahasiswa).']",2 SKS,0.99999999995,1.0,1.0000000000000004,1.0
14,Kapan SKS KP bisa diambil?,"SKS KP bisa diambil selama maksimal 1 semester atau setara dengan 20 SKS. Mahasiswa diberi kesempatan untuk mengajukan perpanjangan KP selama maksimal 1 semester. Jadi, SKS KP bisa diambil setelah mahasiswa mengajukan perpanjangan KP dan memanfaatkan Program Holistik Pembinaan Buku Panduan Merdeka Belajar - Kampus Merdeka.","['20. Sistem Kredit Semester yang selanjutnya disingkat SKS adalah suatu sistem penyelenggaraan pendidikan dengan menggunakan sks.\r\n21. Satuan Kredit Semester yang selanjutnya disingkat sks adalah takaran waktu kegiatan belajar yang dibebankan pada mahasiswa per minggu per semester dalam proses pembelajaran melalui berbagai bentuk pembelajaran atau besarnya pengakuan atas keberhasilan usaha mahasiswa dalam mengikuti kegiatan kurikuler di suatu program studi.\r\n22. Satuan Kegiatan Ekstrakurikuler Mahasiswa, yang selanjutnya disingkat SKEM, adalah satuan yang digunakan untuk mengukur kegiatan ekstrakurikuler mahasiswa dan berfungsi sebagai salah satu syarat kelulusan bagi mahasiswa Program Sarjana Terapan dan Sarjana.\r\n23. Mata Kuliah adalah satuan pelajaran yang diajarkan di tingkat perguruan tinggi.\r\n24. Mata Kuliah Inti adalah mata kuliah wajib yang terkait dengan program studi di ITS.'
 'diperoleh mahasiswa dalam pelaksanaan KKNT regular, dan mahasiswa diberi \nkesempatan untuk mengajukan perpanjangan KKNT selama maksimal 1 \nsemester atau setara dengan 20 SKS. Untuk melanjutkan program KKNT yang \ndiperpanjang, mahasiswa dapat memanfaatkan Program Holistik Pembinaan Buku Panduan Merdeka Belajar - Kampus Merdeka       26\ndan Pemberdayaan Desa (PHP2D) dengan mengikuti prosedur dari Direktorat \nBelmawa. Bentuk kegiatan KKNT yang Diperpanjang dapat berupa proyek  \npemberdayaan masyarakat di desa dan penelitian untuk tugas akhir mahasiswa.\nContoh Model KKNT yang Diperpanjang\n2) Model KKNT Pembangunan dan Pemberdayaan Desa\nPada model ini perguruan tinggi bekerja sama dengan Mitra dalam melakukan \nKKNT Pembangunan dan Pemberdayaan Desa berdasarkan peluang/kondisi \ndesa dalam bentuk paket kompetensi/pengembangan RPJMDes yang akan \ndiperoleh mahasiswa dalam pelaksanaan KKNT. Jumlah dan bidang Mahasiswa \nyang mengikuti program ini menyesuaikan dengan kebutuhan program di desa.'
 'magang sesuai dengan ketentuan yang berlaku;  \n 9 Dokumen Panduan Baku Mutu Pelaksanaan MBKM - 2021  \n NO ELEMEN PENILAIAN  INDIKATOR  \n(1) (2) (3) \n9 Standar Proses –  \nKegiatan MBKM – bentuk \nPengabdian kepada Masyarakat  (i) Kegiatan MBKM dalam bentuk pengabdian kepada masyarakat  atau selanjutnya \ndikategorikan sebagai KKN  ditujukan untuk pembinaan karakter kebangsaan mahasiswa \nkhususnya untuk menumbuhkan kepedulian terhadap persoalan yang dihadapi \nmasyarakat , sebaga i salah satu CPL dalam aspek Sikap .  \n(ii) Kegiatan MBKM dalam bentuk KKN harus dibawah bimbingan dosen . \n(iii) Kegiatan MBKM dalam bentuk KKN dapat diakui sebagai  tambahan sks atau dapat \ndikompensasi dengan mata kuliah Program Studi yang memiliki capaian pembelajaran \nyang setara.  \n(iv) Kegiatan MBKM dalam bentuk KKN dilaksanakan pada semester 6 (enam) dan 7 (tujuh)  \natau sebelum nya dengan syarat telah lulus tahap persiapan.'
 '• LAMPIRAN 8: Form Persetujuan Konversi Mata Kuliah\nLAMPIRAN 1\nKOP Departemen\nNo\n:....\nLampiran :\nPerihal :.\nKepada yth :\nDosen Wali Departemen ...\nFakultas...\nITS\nSehubungan dengan adanya permohonan konversi mata kuliah dari mahasiswa peserta magang dengan detail sebagai berikut :\nNama\nNRP\nNama Mitra Magang :\nPeriode magang\nMahasiswa yang bersangkutan akan/ telah *) melakukan magang dengan rincian tugas sebagai berikut :\nBerdasarkan hasil telaah dan analisa dengan bidang akademik departemen, maka mahasiswa yang bersangkutan berhak untuk mendapatkan konversi mata kuliah dan SKS, dimana konversi ini akan di lakukan pada semester..... tahun ajaran ....\n.......Adapun mata kuliah yang dapat dikonversikan dengan\nkegiatan magang adalah sebagai berikut :\nNo.\nMata Kuliah Konversi\nJumlah SKS\n\n\n\n\n\n\n\n\n\nTotal SKS\n\nSurabaya, ....\n*) dicoret\nKepala Departemen ....\n70\nLampiran\n\nSUBDIREKTORAT PENGEMBANGAN KEWIRAUSAHAAN DAN KARIR\nDIREKTORAT KEMAHASISWAAN\nINSTITUT TEKNOLOGI SEPULUH NOPEMBER\n2020']","Bersamaan atau setelah menyelesaikan KP di organisasi (perusahaan, instansi, yayasan)",0.4166666666458333,0.8333333333333334,0.9058516269690609,0.0
15,Apakah KP bisa dilakukan secara berkelompok?,"KP (Kuliah Kerja Nyata) biasanya dilakukan secara berkelompok oleh mahasiswa. Dalam konteks yang diberikan, kegiatan KKNT (Kuliah Kerja Nyata Terpadu) dilakukan bersama-sama masyarakat di luar kampus untuk mengidentifikasi potensi dan menangani masalah di desa. Kegiatan ini diharapkan dapat mengembangkan potensi desa/daerah dan meramu solusi untuk masalah yang ada. Sehingga, KP dapat dilakukan secara berkelompok dalam kerjasama tim lintas disiplin/keilmuan (lintas kompetensi) untuk mengelola program pembangunan di wilayah perdesaan.","['masyarakat di luar kampus, yang secara langsung bersama-sama masyarakat \nmengidentifikasi potensi dan menangani masalah sehingga diharapkan mampu \nmengembangkan potensi desa/daerah dan meramu solusi untuk masalah yang ada \ndi desa. Kegiatan KKNT diharapkan dapat mengasah softskill  kemitraan, kerjasama \ntim lintas disiplin/keilmuan (lintas kompetensi), dan leadership  mahasiswa dalam \nmengelola program pembangunan di wilayah perdesaan. Sejauh ini perguruan \ntinggi sudah menjalankan program KKNT, hanya saja Satuan Kredit Semesternya \n(SKS) belum bisa atau dapat diakui sesuai dengan program kampus merdeka yang \npengakuan kreditnya setara 6 – 12 bulan atau 20 – 40 SKS, dengan pelaksanaannya \nberdasarkan beberapa model. Diharapkan juga setelah pelaksanaan KKNT, mahasiswa \ndapat menuliskan hal-hal yang dilakukannya beserta hasilnya dalam bentuk tugas \nakhir.\nPelaksanaan KKNT dilakukan untuk mendukung kerja sama bersama Kementerian'
 'sesuai dengan kesepakata n tempat magang;  \n(ii) Mahasiswa yang melaksanakan magang dapat melakukan kegiatan praktek / kolaborasi \nriset / kerja sama pengembangan industri / bentu k kegiatan  lain  yang selaras dengan \nCPL’   \n(iii) Mahasiswa yang melaksanakan magang wajib  dibimbing oleh pembimbing internal dari \ndosen ITS dan  pembimbing eksternal dari pihak  instansi / lembaga /  industri  tempat \nmagang ;  \n(iv) Mahasiswa yang melaksanakan magang dapat melakukan kegiatan akademik yang lain \ndengan syarat telah mendapatkan ijin dari pihak penanggung jawab lembaga / badan / \nindustri magang ;  \n(v) Mahasiswa pada waktu melaksanaan magang  tidak harus cuti  studi ;  \n(vi) Mahasiswa yang melaksa nakan magang dapat diberi  memberikan surat keterangan \nhasil kegiatan magang / sertifikat kompetensi  dari lembaga / badan / industri letak \nmagang sesuai dengan ketentuan yang berlaku;  \n 9 Dokumen Panduan Baku Mutu Pelaksanaan MBKM - 2021  \n NO ELEMEN PENILAIAN  INDIKATOR  \n(1) (2) (3)'
 'TENTANG PROGRAM\nAPA ITU PERTUKARAN MAHASISWA MERDEKA?\nPertukaran Mahasiswa Merdeka adalah pertukaran mahasiswa selama satu semester dari satu klaster daerah ke klaster daerah lainnya yang memberikan pengalaman kebinekaan dan sistem alih kredit sebanyak 20 sks.\nMENGAPA MENDAFTAR PERTUKARAN MAHASISWA MERDEKA?\n1. Mahasiswa dapat berjumpa dengan mahasiswa lain dari perguruan tinggi yang berbeda;\n2. Mahasiswa dapat mendapatkan pengalaman langsung dan mempelajari kebudayaan daerah lainnya melalui pembelajaran\nModul Nusantara;\n3. Mahasiswa dapat memperluas atau meningkatkan kompetensi akademiknya;\n4. Mahasiswa dapat mengembangkan kepemimpinan, percaya diri dan kepekaan sosial\nSelain itu, mahasiswa juga akan mendapatkan insentif berupa:\n1. Bantuan biaya hidup selama 4 bulan Rp 700.000/bulan\n2. Bantuan biaya akomodasi selama 4 bulan Rp 500.000/bulan'
 'kembali  (disarankan mendaftar pada Program BKP MBKM lainnya). Contoh: Magang \n●Mahasiswa yang akan mengikuti Program Magang dan Studi Independen (MSIB) Batch 6 Wajib \nmelakukan konversi alih kredit SKS MK. Subdit. PK2 \n2023 Magang dan Studi Independen Bersertifikat (MSIB) \nMengurangi Kesenjangan antara Ketersediaan SDM Berkualitas  \ndengan Permintaan Industri \nDipercaya oleh Perusahaan  \ndari Dalam dan Luar Negeri \nDan masih banyak lagi… \n Pemangku Kepentingan Program MSIB 6 \nSubdit. PK2 \nPeranan Perguruan Tinggi \n2023 \nSubdit. PK2 \nPimpinan Perguruan Tinggi Penanggungjawab Fakultas atau Prodi \nPimpinan Perguruan Tinggi, bertugas untuk memberikan \npersetujuan final kepada mahasiswa yang ingin \nmendaftar program flagship MBKM, dengan ketentuan \nsebagai berikut: \n1) Pimpinan PT wajib mempunyai salah satu jabatan \nsebagai pimpinan perguruan tinggi; \n2) Pimpinan PT bertugas menentukan penanggung \njawab dari masing-masing prodi atau fakultas \nuntuk bertindak sebagai pihak yang akan']","Ya, maksimal 2 (dua) mahasiswa",0.3333333333,0.5,0.8255544166477488,0.0
16,Apa syarat mengajukan KP?,"Syarat mengajukan KP antara lain:
1. Sudah menyelesaikan segala pekerjaan terkait KP di perusahaan dan sudah kembali aktif di kampus.
2. Menemui dosen pembimbing untuk melakukan ujian lisan dan menyerahkan Formulir Penilaian Ujian Lisan Kerja Praktik untuk diisi oleh dosen pembimbing internal.
3. Dosen pembimbing internal mengirimkan nilai ke koordinator KP via email.
4. Jika nilai telah diterima koordinator KP, maka status KP akan menjadi FINISHED.
5. Menyerahkan Laporan KP.
6. Sudah menyelesaikan segala urusan KP dengan dosen pembimbing.
7. Dokumentasi KP sudah disetujui dan ditandatangani oleh dosen pembimbing.
8. Dokumentasi tersebut berupa softcopy dan diunggah ke repo ITS.
9. Menerima Bukti Penyerahan KP dari REPO ITS.
10. Mengunggah buku KP dan bukti terima repo ITS ke MS TEAMS KP.","['APA SAJA SYARAT DAN KETENTUAN UNTUK JENIS MAGANG MBKM ?\n\n1. Mahasiswa aktif ITS tingkat Sarjana dan Diploma\n2. Minimal mahasiswa sudah lulus 90 SKS atau sudah lulus semester 5.\n3. Mahasiswa tidak diperkenankan mengambil Program Kegiatan Magang (BKP)\nMBKM yang sama lebih dari 1 kali.\n4. Mahasiswa WAJIB melakukan konversi alih kredit ke SKS MK.\n5. Mahasiswa/Departemen WAJIB membuat/memiliki surat PKS.\n6. Pelaksanaan Magang sebelum minggu ke-3 perkuliahan di ITS.\n7. Mahasiswa tidak diperkenankan mengambil MK, atau hanya diperkenankan\nmengambil maks. 3 MK (setara 10 SKS).\n8. Pelaksanaan Magang selama 3 – 6 bulan.\n\nAPA SAJA\nSYARAT DAN\nKETENTUAN\nUNTUK JENIS\nMAGANG\nNON-MBKM'
 'Sudah menyelesaikan segala pekerjaan terkait KP di perusahaan dan sudah kembali aktif di kampus\nMenemui dosen pembimbing untuk melakukan ujian lisan dan menyerahkan Formulir Penilaian Ujian Lisan Kerja Praktik untuk diisi oleh dosen pembimbing internal\nDosen pembimbing internal mengirimkan nilai ke koordinator KP via email\nJika nilai telah diterima koordinator KP, maka status KP akan menjadi FINISHED\nMenyerahkan Laporan KP\nSudah menyelesaikan segala urusan KP dengan dosen pembimbing\nDokumentasi KP sudah disetujui dan ditandatangani oleh dosen pembimbing\nDokumentasi tersebut berupa softcopy dan diunggah ke repo ITS (lihat manual unggah ke repo ITS di manual unggah mandiri)\nMenerima Bukti Penyerahan KP dari REPO ITS\nMengunggah buku KP dan bukti terima repo ITS ke MS TEAMS KP pada link berikut:\nhttps://teams.microsoft.com/l/team/19%3a447977fe03c040ff98ad9e82e63982e2%40thread.tacv2/conversations?groupId=862aa22c-c596-49e1-94dd-6354fd625a2e&tenantId=1d5169ac-c7cb-4275-9764-bf8c9c364a4c'
 '5. Surat persetujuan orang tua/wali (contoh terlampir)\n6. Surat pakta integritas (contoh terlampir\nPERTANYAAN YANG SERING DITANYAKAN\nT. Mahasiswa dari perguruan tinggi apa saja yang dapat mengikuti program Pertukaran Mahasiswa Merdeka?\nJ. Mahasiswa dari perguruan tinggi negeri maupun swasta non vokasi di bawah Direktorat Jenderal Pendidikan Tinggi, Kementerian Pendidikan, Kebudayaan, Riset, dan Tenologi RI.\nJ. Apakah Pertukaran Mahasiswa Merdeka 2021 untuk mahasiswa S1 saja?\nA. Pertukaran Mahasiswa Merdeka 2021 diperuntukkan untuk mahasiswa jenjang St.\nT. Apakah mahasiswa yang lolos akan menerima bantuan potongan\nUKT?\nJ. Mahasiswa akan menerima bantuan potongan UKT sebesar maksimal Rp 2.400.000 dengan syarat bukan penerima bantuan\nUKT dari beasiswa pemerintah lainnya.\nT. Bagaimana jika UKT saya lebih kecil dari 2,4 juta?\nJ. Bantuan UKT akan dibayarkan at cost (sesuai besaran UKT mahasiswa).'
 '31l83 0uluD 29 A0l 2U2120.0y mib\nFORMULIR PENDAFTARAN\nDalam Pertukaran Mahasiswa Merdeka (20 SKS), kamu bisa mengikuti perkuliahan luar jaringan di Perguruan Tinggi (PT) penerima dan dalam jaringan (maksimum 10 SKS) di beberapa PT mitra.\nUniversitas Luar Jaringan\nKalimantan\nsulawesi\nBali - NTT - NTB\nMaluku - Papua\nLainnya\n13. Selanjutnya mengisi pilihan Mata kuliah dalam jaringan (daring) yang ingin diikuti oleh pendaftar, dengan ketentuan jumlah SKS terpilih pada mata kuliah dalam jaringan yaitu maksimum 10 SKS.\nMahasiswa disarankan untuk mengambil 20 SKS secara luar jaringan (luring) di perguruan tinggi penerima.\nMata Kuliah Dalam Jaringan\nPilihan Mata Kuliah\nContoh pilihan beberapa Mata kuliah dan pendaftar bisa mencari menggunakan fitur Search dengan mengetik keyword Mata kuliah seperti pada gambar berikut:\nPilih Mata Kullah 1\nPilih Mata Kuliah 2\nSearch\nType keywords here\nKOMUNIKASI BISNIS\nUniversitas surabaya\nAkuntansi\nPANCASILA DAN KEWARGANEGARAAN\nFarmas']","Mahasiswa aktif Teknik Informatika, SKS tempuh minimum 90 SKS",0.9166666666361111,1.0,0.977779845697906,0.0
17,Apa yang harus dilakukan mahasiswa di lokasi KP?,"Mahasiswa di lokasi KP harus melakukan beberapa hal, antara lain:
1. Mengikuti program proyek di desa atau menjalin kerja sama langsung dengan pemerintah daerah untuk penyelenggaraan program proyek di desa.
2. Mengelola pendaftaran dan penempatan mahasiswa ke desa tujuan.
3. Dosen pembimbing akan membimbing mahasiswa selama KKNT.
4. Bila dimungkinkan, pembimbing melakukan kunjungan di lokasi KKNT untuk monitoring dan evaluasi.
5. Memberangkatkan dan memulangkan mahasiswa dari kampus ke lokasi penempatan program.
6. Memberikan pembekalan, pemeriksaan kesehatan, dan menyediakan jaminan kesehatan dan keselamatan kepada mahasiswa calon peserta KKNT.
7. Menyusun SOP pelaksanaan KKNT dengan mempertimbangkan jaminan Keamanan dan Keselamatan Mahasiswa selama di lapangan.
8. Memberikan pembekalan tentang kearifan lokal masyarakat kepada mahasiswa.","['masyarakat di luar kampus, yang secara langsung bersama-sama masyarakat \nmengidentifikasi potensi dan menangani masalah sehingga diharapkan mampu \nmengembangkan potensi desa/daerah dan meramu solusi untuk masalah yang ada \ndi desa. Kegiatan KKNT diharapkan dapat mengasah softskill  kemitraan, kerjasama \ntim lintas disiplin/keilmuan (lintas kompetensi), dan leadership  mahasiswa dalam \nmengelola program pembangunan di wilayah perdesaan. Sejauh ini perguruan \ntinggi sudah menjalankan program KKNT, hanya saja Satuan Kredit Semesternya \n(SKS) belum bisa atau dapat diakui sesuai dengan program kampus merdeka yang \npengakuan kreditnya setara 6 – 12 bulan atau 20 – 40 SKS, dengan pelaksanaannya \nberdasarkan beberapa model. Diharapkan juga setelah pelaksanaan KKNT, mahasiswa \ndapat menuliskan hal-hal yang dilakukannya beserta hasilnya dalam bentuk tugas \nakhir.\nPelaksanaan KKNT dilakukan untuk mendukung kerja sama bersama Kementerian'
 'C Kerat\n@ DASHBOARD E KEGIATAN MAHASISWA & PROFIL\nINDAH SYAHYA DINATA\n凹\nPertukaran Mahasiswa Merdeka\nFORMULIR PENDAFTARAN\nPilih Penempatan & Mata Kuliah\nDalam Pertukaran Mahasiswa Merdeka (20 SKS), kamu bisa mengikuti perkuliahan luar jaringan di Perguruan Tinggi (PT) penerima dan dalam jaringan (maksimum 10 SKS) di beberapa PT mitra.\nUniversitas Luar Jaringan\n20 / 20 SKS\nPilihan Lokasi Pulau PT penerima\nPilihan lokasi putau harus di luar alamat KTP dan domisili PT asal. Preferensi mahasiswa akan dipertimbangkan namun keputusan panitia bersifat final dan tidak dapat digugat.\nPilih Lokasi Pulau 11\nロ\nPilhan lokasi pulau narus di luar alamat KIP dan domisili PI asal. Preterensi manasiswa akan diperumbangkan namun keputusan panta bersitat unai dan toak dapat diguga\nSulawesi\nBali - NTT - NTB\nBerikut adalah contoh Pilihan pulau yang telah di-cluster sesuai\ndomisili pendaftar:\n14'
 'nyata adalah sebagai berikut.\n1) Perguruan Tinggi\na) Menjalin kerja sama dengan pihak Kementerian Desa PDTT, serta Kemdikbud \ndalam penyelenggaraan program proyek di desa atau menjalin kerja sama \nlangsung dengan pemerintah daerah untuk penyelenggaraan program \nproyek di desa.\nb) Mengelola pendaftaran dan penempatan mahasiswa ke desa tujuan.\nc) Menugaskan dosen pembimbing yang akan membimbing mahasiswa selama \nKKNT.\nd) Bila dimungkinkan pembimbing melakukan kunjungan di lokasi KKNT untuk \nmonitoring dan evaluasi.\ne) Memberangkatkan dan memulangkan   mahasiswa    dari kampus ke lokasi \npenempatan program.\nf) Memberikan pembekalan, pemeriksaan kesehatan, dan menyediakan \njaminan kesehatan dan keselamatan kepada mahasiswa calon peserta KKNT.\ng) Perguruan tinggi menyusun SOP pelaksanaan KKNT dengan \nmempertimbangkan jaminan Keamanan dan Keselamatan Mahasiswa \nselama di lapangan.\nh) Perguruan tinggi memberikan pembekalan tentang kearifan lokal masyarakat'
 '31l83 0uluD 29 A0l 2U2120.0y mib\nFORMULIR PENDAFTARAN\nDalam Pertukaran Mahasiswa Merdeka (20 SKS), kamu bisa mengikuti perkuliahan luar jaringan di Perguruan Tinggi (PT) penerima dan dalam jaringan (maksimum 10 SKS) di beberapa PT mitra.\nUniversitas Luar Jaringan\nKalimantan\nsulawesi\nBali - NTT - NTB\nMaluku - Papua\nLainnya\n13. Selanjutnya mengisi pilihan Mata kuliah dalam jaringan (daring) yang ingin diikuti oleh pendaftar, dengan ketentuan jumlah SKS terpilih pada mata kuliah dalam jaringan yaitu maksimum 10 SKS.\nMahasiswa disarankan untuk mengambil 20 SKS secara luar jaringan (luring) di perguruan tinggi penerima.\nMata Kuliah Dalam Jaringan\nPilihan Mata Kuliah\nContoh pilihan beberapa Mata kuliah dan pendaftar bisa mencari menggunakan fitur Search dengan mengetik keyword Mata kuliah seperti pada gambar berikut:\nPilih Mata Kullah 1\nPilih Mata Kuliah 2\nSearch\nType keywords here\nKOMUNIKASI BISNIS\nUniversitas surabaya\nAkuntansi\nPANCASILA DAN KEWARGANEGARAAN\nFarmas']","Mematuhi dan mengikuti segala aturan terkait kerja praktik, dan mengerjakan pekerjaan yang sesuai dengan kompetensi Informatika",0.8333333332916666,0.2222222222222222,0.9921594442300156,0.0
18,Kapan batas waktu penyerahan laporan KP?,"Batas waktu penyerahan laporan KP adalah setelah mahasiswa menyelesaikan segala pekerjaan terkait KP di perusahaan, menemui dosen pembimbing untuk melakukan ujian lisan, dan menyerahkan Formulir Penilaian Ujian Lisan Kerja Praktik untuk diisi oleh dosen pembimbing internal. Setelah itu, dosen pembimbing internal mengirimkan nilai ke koordinator KP via email. Jika nilai telah diterima oleh koordinator KP, maka status KP akan menjadi FINISHED. Selanjutnya, mahasiswa harus menyerahkan Laporan KP dan setelah itu mengunggah dokumentasi KP yang sudah disetujui dan ditandatangani oleh dosen pembimbing ke repo ITS. Setelah itu, mahasiswa harus menerima Bukti Penyerahan KP dari REPO ITS dan mengunggah buku KP serta bukti terima repo ITS ke MS TEAMS KP. Jadi, batas waktu penyerahan laporan KP tergantung pada proses yang harus dilalui setelah selesai melakukan ujian lisan dan menyerahkan Formulir Penilaian Ujian Lisan Kerja Praktik.","['Menetapkan :    PERATURAN REKTOR INSTITUT TEKNOLOGI SEPULUH\n                NOPEMBER TENTANG PERUBAHAN ATAS PERATURAN\n                REKTOR INSTITUT TEKNOLOGI SEPULUH NOPEMBER\n                NOMOR 12 TAHUN 2019 TENTANG BAKU MUTU MAGANG\n                PROGRAM STUDI SARJANA TERAPAN DAN SARJANA.\n\n\n                                  Pasal I\n\n\nKetentuan Pasal 4 Peraturan Rektor Institut Teknologi Sepuluh Nopember\nNomor 12 Tahun 2019 tentang Baku Mutu Magang Program Studi Sarjana\nTerapan dan Sarjana, diubah sehingga Pasal 4 berbunyi sebagai berikut:'
 'Mahasiswa Merdeka dan tidak dapat mendaftar program Kampus Merdeka lainnya.\nDemikian surat pernyataan ini dibuat dengan sebenarnya tanpa ada paksaan dari pihak manapun dan apabila dikemudian hari saya mengingkari pernyataan ini, saya bersedia menerima sanksi sesuai dengan ketentuan yang berlaku.\nKota, Tanggal\nPembuat Pernyataan\nTTD & materai Rp10.000\nNama lengkap'
 '• Memberikan arahan dalam penyelesaian revisi Laporan Magang.\nB. Dosen pembimbing harus memastikan bahwa Laporan Magang bebas dari plagiarisme.\n6.5\nPENGGANTIAN DOSEN PEMBIMBING\nMAGANG\n• Penggantian dosen pembimbing magang harus didasarkan pada alasan yang dapat dipertanggungjawabkan.\n• Pengajuan permohonan penggantian dosen pembimbing magang dapat dilakukan selambat-lambatnya 2 (dua) bulan setelah magang dimulai.\n• Penggantian dosen pembimbing magang harus dengan persetujuan dari Kepala\nDepartemen.\n42\n06 Pembimbingan Magang'
 'Sudah menyelesaikan segala pekerjaan terkait KP di perusahaan dan sudah kembali aktif di kampus\nMenemui dosen pembimbing untuk melakukan ujian lisan dan menyerahkan Formulir Penilaian Ujian Lisan Kerja Praktik untuk diisi oleh dosen pembimbing internal\nDosen pembimbing internal mengirimkan nilai ke koordinator KP via email\nJika nilai telah diterima koordinator KP, maka status KP akan menjadi FINISHED\nMenyerahkan Laporan KP\nSudah menyelesaikan segala urusan KP dengan dosen pembimbing\nDokumentasi KP sudah disetujui dan ditandatangani oleh dosen pembimbing\nDokumentasi tersebut berupa softcopy dan diunggah ke repo ITS (lihat manual unggah ke repo ITS di manual unggah mandiri)\nMenerima Bukti Penyerahan KP dari REPO ITS\nMengunggah buku KP dan bukti terima repo ITS ke MS TEAMS KP pada link berikut:\nhttps://teams.microsoft.com/l/team/19%3a447977fe03c040ff98ad9e82e63982e2%40thread.tacv2/conversations?groupId=862aa22c-c596-49e1-94dd-6354fd625a2e&tenantId=1d5169ac-c7cb-4275-9764-bf8c9c364a4c']",Paling lambat 1 bulan setelah tanggal selesainya kerja praktek di perusahaan,0.7499999999625,0.0,0.9999986146113432,0.0
19,Bagaimana format nama file untuk laporan KP dengan pengarang tunggal?,"Format nama file untuk laporan KP dengan pengarang tunggal adalah sebagai berikut:
[JUDUL LAPORAN MAGANG] - [NAMA PENGARANG].pdf

Contoh:
Laporan Magang - Anisa Fitriani.pdf","['• LAMPIRAN 3: Sampul Laporan Magang\nSampul Laporan Magang berwarna biru dengan logo ITS di kiri atas. Pada sampul tercetak: Judul Laporan Magang, Nama Lengkap Mahasiswa, Asal Departemen dan Fakultas, Institut Teknologi Sepuluh Nopember, dan tahun penyelesaian.\nJenis huruf: Calibri\nUkuran huruf: 14 pt\nContoh Sampul Laporan Magang :\nLAPORAN MAGANG\n(JUDUL LAPORAN MAGANG)\n(NAMA)\n(NRP)\nDosen Pembimbing\n(Nama Dosen Pembimbing)\nDosen Pembimbing\n(Nama Dosen Pembimbing Lapangan)\n(Departemen)\n(Fakultas )\nInstitut Teknologi Sepuluh Nopember Surabaya\n2020\nBuku Petunjuk Teknis Magang\n65\n\n• LAMPIRAN 4 : Form Penilaian Magang (Dosen Pembimbing)\nLEMBAR PENILAIAN KINERJA MAGANG\nSemester Magang :..... Tahun Akademik 20.../20...\nNama Mahasiswa\nNRP\nDepartemen\nNama Dosen Pembimbing\nNama Perusahaan Mitra Magang\nWaktu Pelaksanaan Magang\nNama Proyek/ Kegiatan Magang\nNO\nASPEK YANG DINILAI\nBOBOT (B)\nNILAI (N)\n(0-100)\nJUMLAH\n(B XN)\n1\nKehadiran\n10\n\n\n2\nKesungguhan melaksanakan Kerja Praktek\n15'
 'MENGISI METADATA / METADATA ENTRIES\n\nMonograph Type, pilih “Project Report”\nMonograph Type, choose “Project Report”.\nCorporate Creators, diisi nama Perusahaan yang berkontribusi dalam penulisan KP.\nNIDN, diisi NIDN dosen pembimbing. Boleh dikosongkan bila tidak tahu.\nNIDN, fill it with thesis advisor ID number. Can be blank.\nMENGISI METADATA / METADATA ENTRIES\n\nIsikan nama dosen pembimbing dengan nama belakang pada kolom family name.\nFill it with Thesis Advisors name.\nPilih “Thesis Advisor” / Choose “Thesis Advisor”.\nNRP/NIM: diisi NIM [no NRP]\nNRP/NIM: NIM [student ID number].\nCreators, isikan pengarang dengan nama belakang pada kolom family name.\nCreators, fill it with creators name.\nMENGISI METADATA / METADATA ENTRIES'
 'Pilih “Monograph” / Choose “Monograph”\nKemudian klik “Next” / Then Click “Next”\n\nUpload file di sini / Upload file here\nKlik “Next” / Click “Next”\nUPLOAD FILE\n\nFile sudah masuk / Thesis file uploaded\nPilih “Accepted version” / Choose “Accepted version”\nPilih “Anyone” / Choose “Anyone”\nPilih Bahasa yang digunakan / Choose language as used on\nKlik “Next” / Click “Next”\nTitle, diisi judul bhs Ind, dengan gaya penulisan huruf besar tiap kata.\nTitle, fill it with thesis title, use Capitalize Each Word style.\n\nAbstract, diisi abstrak Ind dan Eng. Gunakan tanda “ = “ sebagai pemisah.\nAbstract, fill it with Ind and Eng abstracts. Use “ = “ as divider of Ind and Eng Abstracts.\n\nMENGISI METADATA / METADATA ENTRIES'
 '• Mampu memilih dan mengorganisir data yang diperlukan.\n• Mampu mengamati dan menilai dengan jeli berbagai proses, peristiwa, manfaat dan kelemahan yang ada selama melakukan kegiatan Magang.\n7.4\nFORMAT DAN SISTEMATIKA LAPORAN\nMAGANG\n• FORMAT PENULISAN LAPORAN MAGANG\n1. Jenis dan Ukuran Kertas\nKertas HVS 70gram ukuran A5 (148 × 210 mm).\n2. Cover Laporan\n3. Lembar pengesahan dengan dasar polos berwarna putih\nPembimbing tempat magang tanda tangan terlebih dahulu.\n4. Jarak Tepi (margin)\n- Tepi Atas : 2,5 cm\n- Тері Bawah : 2,5 cm\n- Tepi Kiri\n: 2,5 cm\n- Tepi Kanan : 2,0 cm\n5. Jenis Huruf\nTimes New Roman, Normal, 12 pt (judul), 11 pt (isi)\n46\n07 Pedoman Penulisan Laporan Magang']",NRP-Project_Report,0.6388888888675925,1.0,0.9405819779212893,0.0
