,question,ground_truth,contexts,answer
0,Apa visi ITS?,Menjadi perguruan tinggi dengan reputasi internasional dalam ilmu pengetahuan dan teknologi terutama yang menunjang industri dan kelautan yang berwawasan lingkungan.,"['PENGALAMAN TENTANG KEBUDAYAAN DAERAH LAIN\nMELALUI MODUL NUSANTARA\nSelain mengikuti pembelajaran mata kuliah di perguruan tinggi penerima, mahasiswa yang mengikuti program Pertukaran Mahasiswa Merdeka juga akan mendapatkan pengalaman langsung berinteraksi dengan mahasiswa dari daerah lain dan mempelajari kebudayaan daerah lain melalui Modul Nusantara. Modul Nusantara ini senilai 2 sks dan wajib diambil oleh mahasiswa peserta program Pertukaran Mahasiswa Merdeka. Modul Nusantara dilaksanakan di perguruan tinggi penerima. Modul Nusantara dibagi ke dalam empat jenis kegiatan yaitu kebinekaan, inspirasi, refleksi, dan kontribusi sosial. Dalam pelaksanaan Modul Nusantara, mahasiswa akan dibimbing oleh dosen pembimbing modul nusantara dan dibantu oleh mentor.\nBAGAIMANA MEKANISME PELAKSANAAN PERTUKARAN\nMAHASISWA MERDEKA?\nTerdapat dua mekanisme, yaitu:', '23. Mata Kuliah adalah satuan pelajaran yang diajarkan di tingkat perguruan tinggi.\r\n24. Mata Kuliah Inti adalah mata kuliah wajib yang terkait dengan program studi di ITS.\r\n25. Mata Kuliah Non-Inti adalah mata kuliah di ITS yang meliputi mata kuliah wajib kurikulum, mata kuliah penciri ITS, mata kuliah pilihan program studi, dan mata kuliah pengayaan.\r\n26. Mata Kuliah Wajib Kurikulum adalah mata kuliah yang terdiri dari Agama, Pancasila, Kewarganegaraan, dan Bahasa Indonesia.\r\n27. Mata Kuliah Penciri ITS adalah mata kuliah yang terdiri dari Bahasa Inggris, Teknopreneur, dan Wawasan dan Aplikasi Teknologi.', ""Universitas, Program Studi, Tanggal mulai Kuliah, Jadwal Kuliah, dan mengunduh Rencana Pembelajaran Semester seperti pada gambar berikut:\nNUAH SYAHYA DINATA\n臼\n0 / 20 SKS\nPilihan Mata Kuliah\nJumiah SKS terpitin pada mata kutiah dalam jaringan (maksimum 10 SKS) akan menguranal kuota SKS kamu untuk perguruan tingel luar jaringan\nPilih Mata Kuliah 1\nUniversitas surabaya\n3 SKS\nDosen\nRUDDY J SUHATRIL\nProgram Studi\nAkuntansi\nTanggal Mulat Kuliah\n21/05/2021\nJadwal Kuliah\nSenin, 11:35 - 12:35\nUNDUH RPS\nKEMBALI\nPILIN\n14. Periksa kembali data diri, Lalu mengisi nilai IPK sesuai transkrip terakhir dan unggah dokumen transkrip nilai pada button 'Upload File' dengan format png/pdf maximal 5 MB sebagai bukti data terkini IPK\nINDAH SYAHYA DINATA 2\nNama Lengkap\nJenis Kelamin\nPeremouan\nPerguruan Tinggi Asal\nUniversitas Widyatama\nTOUGHA\nUntan vokumen Transarip\nIF telan aluban darl data rubikti. Monon unggan dokumen wanskrip sedagal dukt data terkint ink Anda.\nUPLOAD FILE"", 'melaksanakan program magang industri. Fokus evaluasi adalah individu mahasiswa, yaitu \nprestasi yang dicapai dalam pelaksanaan magang oleh mahasiswa. Melalui evaluasi akan \ndiperoleh tentang apa yang telah dicapai dan apa yang belum dicapai oleh mahasiswa \nselama mengikuti kegiatan.  Evaluasi dapat memberikan informasi terkait kemampuan apa \nyang telah dicapai oleh mahasiswa selama mengikuti program.  Selain itu, melalui evaluasi \ndapat dilakukan judgment terhadap nilai atau implikasi dari hasil program. Selanjutnya, \nprogram ini digunakan untuk meningkatkan kompetensi mahasiswa.\n1. Prinsip Penilaian\nPenilaian dalam pelaksanaan kebijakan Merdeka Belajar - Kampus Merdeka, program \n“hak belajar tiga semester di luar program studi” mengacu kepada 5 (lima) prinsip sesuai \nSNPT yaitu edukatif, otentik, objektif, akuntabel, dan transparan yang dilakukan secara \nterintegrasi.\n2. Aspek – aspek Penilaian\nSejalan dengan prinsip-prinsip penilaian di atas, maka aspek-aspek yang dinilai dalam']",Saya tidak mengetahui jawabannya.
1,Apa itu Body of Knowledge?,"Istilah yang digunakan untuk mewakili secara lengkap konsep, istilah, dan aktivitas yang membentuk kemampuan profesional, yang didefinisikan oleh masyarakat terpelajar atau asosiasi profesional yang relevan.","['terlibat di dalam pro ses dan hasil pelaksanaan MBKM.  \n(2). SOP yang diterbitkan oleh: (a) Direktorat terkait sebagai koordinator pelaksana \nmasing -masing bentuk MBKM, (b) Prodi sebagai pelaksana MBKM  untuk memandu \ndosen, mahasiswa dan tenaga kependidikan yang terlibat di dalam proses dan hasil \npelaksanaan MBKM.  \nDokumen (1) dan (2) di atas, merupakan manual untuk seluruh stakeholder yang terlibat \ndi dalam implementasi MBKM, yang dapat disusun dalam satu dokumen atau lebih secara \nterpisah. Rambu -rambu dalam penyusunan ke dua dokumen di atas, dengan ketentuan \nmemuat unsur -unsur sebagai berikut, dan dapat dikembangkan sesuai dengan kebutuhan \ndan tujuan pelaksanaan MBKM.  \n1. Tujuan dan ma ksud Manual MBKM  \n2. Luas lingkup Manual MBKM  \na. Manual Penetapan standar  \nb. Manual pelaksanaan standar  \nc. Manual evaluasi standar  \nd. Manual pengendalian pelaksnanaan standar  \ne. Manual peningkatan standar  \n3. Rincian tentang hal yang harus dikerjakan', '(3) Mekanisme dan penyelenggaraan kegiatan magang/ praktik kerja dan kegiatan wirausaha hilirisasi dikembangkan dan dikoordinasikan oleh Direktorat yang mengurusi inovasi dan kawasan sains teknologi bekerjasama dengan Direktorat yang mengurusi kemahasiswaan.\r\n\r\n(4) Direktorat yang mengurusi inovasi dan kawasan sains teknologi dalam menyelenggarakan kegiatan Magang/ Praktik Kerja dan Kegiatan Wirausaha Hilirisasi sebagaimana dimaksud pada ayat (3) berkoordinasi dengan Program Studi terkait.\r\n\r\nPasal 15\r\n(1) Dalam penyelenggaraan kegiatan MB - KM di ITS, dilaksanakan oleh Tim MB-KM ITS.\r\n(2) Tim MB-KM ITS berperan dalam memfasilitasi implementasi kegiatan MB-KM di ITS meliputi membuat prosedur operasional baku, dokumen teknis, penjaminan mutu, sistem aplikasi dan hal lainnya yang mendukung penyelenggaraan kegiatan MB-KM di ITS.\r\n(3) Tim MB-KM ITS ditetapkan melalui Keputusan Rektor.\r\n\r\n        BAB V KETENTUAN PENUTUP\r\n\r\nPasal 16', '07\nPEDOMAN\nPENULISAN\nLAPORAN\nMAGANG\n\n07\nPEDOMAN PENULISAN LAPORAN\nMAGANG\n7.1\nFUNGSI LAPORAN MAGANG\nPertanggungjawaban kegiatan Magang mahasiswa kepada Mitra Magang dan\nDepartemen.\n女你公\n299\nBahan pertimbangan pemberian nilai kegiatan Magang\nДо\nPenyampaian informasi bagi pihak ITS, mahasiswa, maupun Mitra Magang\nSalah satu alat untuk membina hubungan kerjasama, saling pengertian, dan koordinasi antara mahasiswa dengan pihak ITS maupun Mitra Magang\nSalah satu alat untuk menyampaikan ide, pendapat, penilaian, dan pengalaman yang berkaitan dengan penyelenggaraan Magang kepada\npihak lain.\n44\n07 Pedoman Penulisan Laporan Magang', '(8) Mekanisme dan penyelenggaraan kegiatan asistensi mengajar di satuan pendidikan dikembangkan dan dikoordinasikan oleh Direktorat yang mengurusi kemahasiswaan.\r\n(9) Direktorat yang mengurusi kemahasiswaan dalam menyelenggarakan kegiatan asistensi mengajar di satuan pendidikan sebagaimana dimaksud pada ayat (8) berkoordinasi dengan Program Studi terkait.\r\n\r\nBagian Kesembilan\r\nMagang/ Praktik Kerja dan Kegiatan Wirausaha Lingkup Hilirisasi\r\n\r\nPasal 14\r\n(1) Kegiatan magang/ praktik kerja dan kegiatan wirausaha hilirisasi ditujukan untuk memperlancar karir lulusan, pengayaan kompetensi mahasiswa, kolaborasi magang, wirausaha dan kerja sama pengembangan produk inovatif.\r\n(2) Bentuk kegiatan magang/ praktik kerja dan kegiatan wirausaha hilirisasi dapat berupa kegiatan penelitian dan pengabdian masyarakat bersama civitas akademika yang lain untuk memecahkan persoalan di masyarakat atau industri, inkubasi dan start-up.']","Body of Knowledge (BoK) adalah kumpulan pengetahuan, keterampilan, dan praktik terbaik yang diperlukan dalam suatu bidang atau disiplin tertentu. Dalam konteks yang diberikan, Body of Knowledge (BoK) merujuk pada standar, prosedur, dan panduan yang harus dipatuhi dan diikuti oleh semua stakeholder yang terlibat dalam implementasi Model Pembelajaran Merdeka Belajar dan Kreatif (MBKM). BoK ini mencakup tujuan, lingkup, standar penetapan, pelaksanaan, evaluasi, pengendalian, dan peningkatan standar dalam pelaksanaan MBKM. BoK juga dapat dikembangkan sesuai dengan kebutuhan dan tujuan pelaksanaan MBKM."
2,Apa itu CPL?,Capaian Pembelajaran Lulusan,"['Subdit. PK2\nADVANCING HUMANITY\niTS\nh\nf°\nPENDAHULUAN\nd\n2023\n\nSubdit. PK2\nADVANCING HUMANITY\niTS\nWebsite Resmi ITS Career Center (Subdit. PK2 ITS)\nITS CAREER CENTER\nREKTORAT\nSubdirektorat Pengembangan Kewirausahaan dan Kartr\nMagang Industri\nProgram Magang adalah suatu kegiatan dari mahasiswa untuk menerapkan dan memperoleh pengetahuan, keterampilan umum dan khusus / keahlian kerja, serta internalisasi sikap profesional dan budaya kerja yang sesuai dan diperlukan bagi dunia usaha. Program Magang di lingkungan ITS ini dikelola oleh Subdit Pengembangan Kewirausahaan dan Karir (PK2) di bawah koordinasi Direktorat Kemahasiswaan ITS.\nLowongan Magang\nSkema Program Magang di ITS\nhttps://www.its.ac.id/careers/id/\nmagang\nMAGANG FLAGSHIP\nSelengkapnya\nMAGANG KERJASAMA\nMAGANG MANDIRI\nSTUDI INDEPENDEN\nSelengkapnya\nSelengkapnya\nSelengkapnya\n2023', 'Subdit. PK2\nSKEMA PELAKSANAAN\nPROGRAM MAGANG\nMANDIRI DI ITS\nMahasiswa / Departemen melakukan\nmenyertakan:\n1. Proposal Magang\n2. Surat Rekomendasi Departemen\n3. Surat Penerimaan Magang\nPelaksanaan Magang\nProses pengurusan\nPKS\nPKS tidak\ndisetujui\nPKS\nTertandatangan\nSelesai\nMagang berakhir <\nMahasiswa mendapatkan\nSertifikat / Penilaian Magang\nSelesai\nADVANCING HUMANITY\niTS\nMulai\nMahasiswa mengurus\nsurat rekomendasi\ndepartemen untuk pengajuan magang ke\nMitra\nMahasiswa mengajukan\npermohonan magang ke\nMitra\nMitra melakukan seleksi magang\nMahasiswa menerima hasil seleksi magang dari Mitra\nTidak diterima\nSelesai\nDiterima\nMahasiswa melaporkan\nke Departemen', '16. Tahap Persiapan adalah tahap pembelajaran yang dijadwalkan dalam dua semester pertama pada kurikulum Program Sarjana atau dua paket semester pertama pada kurikulum Program Sarjana Terapan.\r\n17. Standar kompetensi lulusan adalah kriteria minimal tentang kualifikasi kemampuan lulusan yang mencakup sikap, pengetahuan, dan keterampilan yang dinyatakan dalam rumusan capaian pembelajaran lulusan.\r\n\r\n18. Capaian Pembelajaran Lulusan yang selanjutnya disingkat CPL adalah kriteria minimal tentang kualifikasi kemampuan lulusan yang mencakup sikap, pengetahuan, dan keterampilan yang dinyatakan dalam rumusan capaian pembelajaran lulusan.\r\n19. Capaian Pembelajaran Mata Kuliah yang selanjutnya disingkat CPMK adalah capaian pembelajaran lulusan yang dibebankan ke mata kuliah.\r\n20. Sistem Kredit Semester yang selanjutnya disingkat SKS adalah suatu sistem penyelenggaraan pendidikan dengan menggunakan sks.', 'Tabel 2.1 Standar dalam penyelenggaraan MB -KM di   ITS \nNO ELEMEN PENILAIAN  INDIKATOR  \n(1) (2) (3) \nI STANDAR KOMPETENSI LULUSAN  \n1 Standar Kompetensi Lulusan  (i) Pelaksanaan MBKM mengacu pada CPL Prodi sebagai target dari kemampuan lulusan, \ndengan minimal pencapaian 80%  CPL dan atau sebagai kompetensi tambahan  \n(ii) Kompetensi tambahan dimaksudkan untuk memperlancar karir lulusan, kolaborasi riset \ndan atau kerja sama p engembangan industri.  \nII STANDAR ISI PEMBELAJARAN  \n2 Standar Isi  – MK Pengayaan  (i) Prodi menyediakan kurikulum untuk pelaksanaan MBKM yang disusun bersama \npemangku kepentingan internal dan eksternal, serta direview oleh pakar bidang ilmu \nprogram studi nya.  \n(ii) Keterjaminan pemenuhan CPL  melalui MBKM ( ketersediaan matrik / peta CPL - MK \nMBKM ), dan ketersediaan modul MK melalui pembelajaran  untuk MK yang \ndilaksanakan secara MBKM']","CPL adalah singkatan dari Capaian Pembelajaran Lulusan. CPL merupakan kriteria minimal tentang kualifikasi kemampuan lulusan yang mencakup sikap, pengetahuan, dan keterampilan yang dinyatakan dalam rumusan capaian pembelajaran lulusan."
3,Berapa jam kerja magang yang setara dengan 1 SKS?,1 SKS = 2.720 menit magang atau 45 jam,"['KERJA PRAKTIK\nDepartemen Teknik Informatika ITS\n\nSekilas Kerja Praktik\n\nJumlah kredit Mata Kuliah KP: 2 SKS\nSKS KP diambil bersamaan / setelah menyelesaikan KP di organisasi (perusahaan, instansi, yayasan)\nLama KP: 1-2 bulan dengan hitungan kerja part time\nBisa perorangan atau berkelompok maksimal 2 (dua) mahasiswa\nBerkas-berkas KP bisa didapatkan di link resource akademik:\nhttps://intip.in/ResourceAkademikDanKemahasiswaanIF\nProsedur Kerja Praktik\n\nMengajukan KP\nSurat Pengantar KP\nDosen Pembimbing KP\nPelaksanaan KP\nPenilaian KP oleh Pembimbing Lapangan\nPenilaian KP oleh Dosen Pembimbing\nPenyerahan Laporan KP ke RBTC\nMengumpulkan bukti penyelesaian KP\nLulus KP\nSebelum berangkat KP\n\nMengajukan KP\n\nMemenuhi persyaratan sebagai berikut:\nMahasiswa aktif Teknik Informatika\nSKS tempuh minimum 90 SKS\nMengisi MONKP:\nmonkp.if.its.ac.id (registrasi akun dan data KP)\nStatus KP akan menjadi CREATED\nSurat Pengantar Kerja Praktik', 'NO ELEMEN PENILAIAN  INDIKATOR  \n(1) (2) (3) \natau kombinasi keduanya  \n6 Standar Proses – Tempat \npelaksanaan MBKM  Tempat k egiatan MB – KM dapat dilaksanakan di luar Program Studi baik yang ada di internal \nITS maupun di luar ITS . \n7 Standar Proses –  \nLama waktu pelaksanaan \nMBKM  Lama waktu pelaksanaan MBKM, dapat dikonvesi ke MK, dengan syarat:  \ni. Lama kegiatan belajar dapat dikonversi ke dalam sks adalah minimal 2720 menit atau \n45.3 jam.  \nii. Lama kegiatan bentuk MBKM dihitung atas waktu untuk:  (a) persiapan  di tempat \nMBKM , (b) pelaksanaan, (c) penilaian, dan  (d)  pelaporan.  \niii. Lama waktu kegiatan MB -KM bentuk magang, minimal 3 bulan dan maksimal 6 bulan.  \n8 Standar Proses –  \nKegiatan akademik selama  \nMBKM  – bentuk magang  (i) Mahasiswa yang melaksakan magang harus bekerja di lapangan secara penuh waktu \nsesuai dengan kesepakata n tempat magang;  \n(ii) Mahasiswa yang melaksanakan magang dapat melakukan kegiatan praktek / kolaborasi', 'yang setara.  \n(iv) Kegiatan MBKM dalam bentuk KKN dilaksanakan pada semester 6 (enam) dan 7 (tujuh)  \natau sebelum nya dengan syarat telah lulus tahap persiapan.  \n(v) Kegiatan MBKM dalam bentuk KKN yang dilaksanakan sebelum semester 6 (enam) dan \n7 (tujuh) dan s udah lulus tahap persiapan , diakui sebagai MBKM dengan sistem tabung \nnilai.  \n(vi) Kegiatan MBKM dalam bentuk KKN  dikembangkan oleh Direktorat yang mengurusi riset \ndan pengabdian kepada masyarakat . \n(vii) Implementasi MBKM dalam bentuk  KKN  dikoordinir oleh Direktorat yang m engurusi  \npengabdian kepada masyarakat bersama  Prodi  terkait , melalui tahapan kegiatan (a) \npersiapan, (b) Pelaksanaan, (c) Evaluasi, (d) Pengendalian, dan (e) Peningkatan . \n \n10 Standar Proses –  \nKegiatan MBKM – bentuk \nPertukaran Pelajar  (i) Kegiatan MBKM dalam bentuk pertukaran pelajar  dimaksudkan untuk mencapai CPL .  \n(ii) Kegiatan MBKM dalam bentuk pertukaran pelajar  dapat dilakukan dengan PT di dalam \nnegeri atau di luar negeri.', 'h. Asistensi Mengajar di Satuan Pendidikan.\r\n(3) Dalam hal ada penambahan dan atau perubahan BKP MBKM sebagaimana dimaksud pada ayat (2) ditetapkan melalui Keputusan Rektor.\r\n(4) Kegiatan Membangun Desa/ Kuliah Kerja Nyata Tematik sebagaimana dimaksud pada ayat (2) huruf b dan Proyek Kemanusiaan sebagaimana dimaksud pada ayat (2) huruf d diwujudkan melalui kegiatan pengabdian kepada masyarakat.\r\n\r\n              BAB IV PELAKSANAAN KEGIATAN MB - KM\r\n\r\nPasal 4\r\n(1) Jumlah sks maksimal yang dapat diambil dalam rangka pelaksanaan kegiatan MB -\r\nKM adalah 40 (empat puluh) sks.\r\n(2) Kegiatan MB-KM hanya bisa dilaksanakan dengan:\r\na. Perguruan tinggi yang mempunyai rangking setara atau lebih tinggi dari ITS,\r\nb. Perguruan tinggi yang mempunyai MoU dengan ITS; atau\r\nc. Lembaga non perguruan tinggi yang mempunyai MoU dengan ITS.\r\n(3) Pelaksanaan transfer kegiatan MB - KM menjadi sks mata kuliah, program studi atau direktorat membentuk tim pelaksana transfer kredit.']",Lama kegiatan belajar magang yang setara dengan 1 SKS adalah minimal 2720 menit atau 45.3 jam.
4,Apa durasi maksimal magang menurut peraturan rektor?,Maksimal 6 bulan,"['Pasal 4\n Mahasiswa     dalam pelaksanaan magang harus        memenuhi ketentuan\n sebagai berikut:\n a. Magang memiliki durasi minimal 3 bulan sampai maksimal 6 bulan\n     dalam 1 periode;\n b. mahasiswa wajib dibimbing oleh pembimbing internal dari dosen ITS\n     dan pembimbing eksternal dari pihak industri;\n c. selama magang mahasiswa secara penuh waktu bekerja di lapangan\n     sesuai kesepakatan;\n d. mahasiswa dapat mendapatkan ijin untuk melakukan kegiatan\n     akademik tertentu, melalui pembicaraan dan kesepakatan dengan\n     pihak industri;\n e. pada waktu pelaksanaan magang, mahasiswa tidak harus cuti;\n f. industri yang menawarkan magang dapat memberikan sertifikat\n     kompetensi dengan syarat dan ketentuan tertentu; dan\n g. sebelum    kegiatan     magang    dilaksanakan    harus   ada   nota\n     kesepahaman dan perjanjian kerja sama.\n\n\n                                  Pasal II\nPeraturan Rektor ini mulai berlaku pada tanggal ditetapkan.', '9.2\nETIKA BERKOMUNIKASI DENGAN\nDOSEN PEMBIMBING\n• Komunikasi dengan dosen pembimbing dilakukan dengan mengacu pada norma yang berlaku umum.\nDosen Pembimbing last seen today at 13:25\nSelamat pagi Bu, saya Rosyi, mahasiswa S1 PerencanaanWilayah\ndan Kota semester 7. Maaf bu, saya maumenanyakan\napakah besok Ibu ada waktu untuk bimbingan tugas\nkarya akhir? Terima Kasih\n7:20 AM J/\nSelamat siang Rosyi, hari Kamis pukul 10.00 WIB ya. Tolong ingatkan kembali.\n1:18 PM\nBaik bu, Terima Kasih\nHARI INI\n1:20 PM J/\nSelamat Pagi Bu, Saya Rosyi, maaf apakah saya jadi bimbingan hari ini pukul 10? Terima Kasih\n7:25 AM J/\n• Gunakan Bahasa Indonesia yang baik dan benar (bukan bahasa gaul). Pesan terdiri dari : salam, identitas, keperluan, dan ucapan terimakasih.\n• Pesan dimulai dengan salam/sapaan tanpa disingkat.\n• Mahasiswa harus menuliskan identitanya saat mengirim pesan kepada dosen.\n• Menuliskan pesan dengan singkat dan jelas.\n• Akhiri dengan ucapan terimakasih.\nJadi, temui saya di ruangan ya.', 'NO ELEMEN PENILAIAN  INDIKATOR  \n(1) (2) (3) \natau kombinasi keduanya  \n6 Standar Proses – Tempat \npelaksanaan MBKM  Tempat k egiatan MB – KM dapat dilaksanakan di luar Program Studi baik yang ada di internal \nITS maupun di luar ITS . \n7 Standar Proses –  \nLama waktu pelaksanaan \nMBKM  Lama waktu pelaksanaan MBKM, dapat dikonvesi ke MK, dengan syarat:  \ni. Lama kegiatan belajar dapat dikonversi ke dalam sks adalah minimal 2720 menit atau \n45.3 jam.  \nii. Lama kegiatan bentuk MBKM dihitung atas waktu untuk:  (a) persiapan  di tempat \nMBKM , (b) pelaksanaan, (c) penilaian, dan  (d)  pelaporan.  \niii. Lama waktu kegiatan MB -KM bentuk magang, minimal 3 bulan dan maksimal 6 bulan.  \n8 Standar Proses –  \nKegiatan akademik selama  \nMBKM  – bentuk magang  (i) Mahasiswa yang melaksakan magang harus bekerja di lapangan secara penuh waktu \nsesuai dengan kesepakata n tempat magang;  \n(ii) Mahasiswa yang melaksanakan magang dapat melakukan kegiatan praktek / kolaborasi', 'Panduan Umum Magang\n\nDurasi magang maksimal 6 bulan\nWajib dibimbing oleh dosen pembimbing internal (dosen ITS) dan pembimbing eksternal (pihak industri)\nMahasiswa bisa mendapatkan izin untuk melakukan kegiatan tertentu (sesuai kesepakatan)\nPada saat magang, mahasiswa tidak harus cuti\nIndustri dapat menawarkan pemberian sertifikat kompetensi dengan syarat dan ketentuan tertentu\nSebelum magang, akan ada nota kesepahaman dan perjanjian kerja sama\nKerja Praktek\n\nSatu atau beberapa MK yang memiliki capaian pembelajaran setara dengan kegiatan magang (disarankan lebih ke MK pilihan)\nGabungan kerja praktek dan satu atau beberapa MK yang memiliki capaian pembelajaran setara dengan kegiatan magang\nMK pilihan magang (diupayakan masuk dalam kurikulum)\nKonversi Magang\n\nMengambil beberapa MK (perkuliahan secara online)\nPenguatan Program Magang di ITS']",Durasi maksimal magang menurut peraturan rektor adalah 6 bulan.
5,Apa itu MB-KM di ITS?,Merdeka Belajar - Kampus Merdeka di Institut Teknologi Sepuluh Nopember,"['MERDEKA BELAJAR – KAMPUS MERDEKA (MB-KM) DI INSTITUT TEKNOLOGI SEPULUH NOPEMBER\nDisampaikan di IPITS 2020\nINSTITUT TEKNOLOGI SEPULUH NOPEMBER, Surabaya - Indonesia\n\nMERDEKA BELAJAR DAN KAMPUS MERDEKA (MB-KM)\nOutline:\n\nPENDAHULUAN\nDASAR HUKUM MB-KM\nKEGIATAN MB-KM DI ITS\nTERIMA KASIH\nPENDAHULUAN\n\nTantangan Abad 21\nSosialisasi Program MB-KM, Ditjen Dikti, 2020\nKampus Merdeka\n\nHak Belajar 3 Semester di Luar Program Studi (Prodi)\nPermendikbud Nomor 3 Tahun 2020 tentang Standar Nasional Pendidikan Tinggi\n\nMahasiswa memiliki kesempatan untuk:\n\nSatu semester atau setara dengan 20 SKS menempuh pembelajaran di luar program studi pada perguruan tinggi yang sama.\nPaling lama dua semester atau setara dengan 40 SKS menempuh pembelajaran pada:\nProgram studi yang sama di perguruan tinggi yang berbeda\nProgram studi yang berbeda di perguruan tinggi yang berbeda\nDi luar perguruan tinggi\nDASAR HUKUM MB-KM', 'NO ELEMEN PENILAIAN  INDIKATOR  \n(1) (2) (3) \natau kombinasi keduanya  \n6 Standar Proses – Tempat \npelaksanaan MBKM  Tempat k egiatan MB – KM dapat dilaksanakan di luar Program Studi baik yang ada di internal \nITS maupun di luar ITS . \n7 Standar Proses –  \nLama waktu pelaksanaan \nMBKM  Lama waktu pelaksanaan MBKM, dapat dikonvesi ke MK, dengan syarat:  \ni. Lama kegiatan belajar dapat dikonversi ke dalam sks adalah minimal 2720 menit atau \n45.3 jam.  \nii. Lama kegiatan bentuk MBKM dihitung atas waktu untuk:  (a) persiapan  di tempat \nMBKM , (b) pelaksanaan, (c) penilaian, dan  (d)  pelaporan.  \niii. Lama waktu kegiatan MB -KM bentuk magang, minimal 3 bulan dan maksimal 6 bulan.  \n8 Standar Proses –  \nKegiatan akademik selama  \nMBKM  – bentuk magang  (i) Mahasiswa yang melaksakan magang harus bekerja di lapangan secara penuh waktu \nsesuai dengan kesepakata n tempat magang;  \n(ii) Mahasiswa yang melaksanakan magang dapat melakukan kegiatan praktek / kolaborasi', 'BAB III\r\nRUANG LINGKUP KEGIATAN\r\n\r\nPasal 3\r\n(1) Kegiatan MB - KM merupakan proses pembelajaran yang dilaksanakan di luar Program Studi baik yang ada di internal ITS maupun di luar ITS yang terdiri atas:\r\na. pembelajaran dalam Program Studi lain di internal ITS;\r\n\r\nb. pembelajaran dalam Program Studi yang sama pada Perguruan Tinggi di luar ITS;\r\nc. pembelajaran dalam Program Studi lain pada Perguruan Tinggi di luar ITS; dan\r\nd. pembelajaran pada lembaga non Perguruan Tinggi.\r\n(2) Ruang lingkup kegiatan MB - KM adalah 8 (delapan) bentuk kegiatan pembelajaran (BKP) yang meliputi:\r\na. Magang/ Praktik Kerja;\r\nb. Membangun Desa/ Kuliah Kerja Nyata Tematik;\r\nc. Pertukaran Pelajar;\r\nd. Proyek Kemanusiaan;\r\ne. Penelitian/ Riset;\r\nf. Kegiatan Wirausaha;\r\ng. Studi/ Proyek Independen; dan\r\nh. Asistensi Mengajar di Satuan Pendidikan.\r\n(3) Dalam hal ada penambahan dan atau perubahan BKP MBKM sebagaimana dimaksud pada ayat (2) ditetapkan melalui Keputusan Rektor.', '(4) Kegiatan MBKM – dalam bentuk pertukaran pelajar melalui MK di prodi di luar ITS, \ndengan ketentuan jumlah sks maksimal adalah 20 (dua puluh) sks, yang meliputi mata \nkuliah inti dan mata kuliah non inti.  \nIII STANDAR PROSES PEMBELAJARAN  \n5 Standar Proses –bentuk \npembelajaran MBKM  (i) Mahasiswa dapat melaksanakan kegiatan pembelajaran MBKM dalam rangka meraih CPL \nProdi dalam bentuk satu atau lebih bentuk berikut ini:  \na. Magang/ Praktik Kerja;  \nb. Membangun Desa/ Kuliah Kerja Nyata Tematik;  \nc. Pertukaran Pelajar;  \nd. Proyek Kemanusiaan;  \ne. Penelitian/ Riset;  \nf. Kegiatan Wirausaha;  \ng. Studi/ Proyek Independen; dan  \nh. Asistensi Mengajar di Satuan Pendidikan  \n(ii)  Pelaksanaan MB -KM bentuk (a) sd (h) dapat dilaksanakan dalam bentuk  online, offline 8 Dokumen Panduan Baku Mutu Pelaksanaan MBKM - 2021  \n NO ELEMEN PENILAIAN  INDIKATOR  \n(1) (2) (3) \natau kombinasi keduanya  \n6 Standar Proses – Tempat']","MB-KM di ITS merupakan singkatan dari Merdeka Belajar dan Kampus Merdeka. Program ini memberikan kesempatan kepada mahasiswa untuk belajar di luar program studi mereka, baik di perguruan tinggi yang sama maupun di luar perguruan tinggi. Program ini diatur berdasarkan Permendikbud Nomor 3 Tahun 2020 tentang Standar Nasional Pendidikan Tinggi."
6,Apa saja bentuk kegiatan pembelajaran yang termasuk dalam MB-KM?,"Magang/Praktik Kerja, Membangun Desa/Kuliah Kerja Nyata Tematik, Pertukaran Pelajar, Proyek Kemanusiaan, Penelitian/Riset, Kegiatan Wirausaha, Studi/Proyek Independen, dan Asistensi Mengajar di Satuan Pendidikan.","['dan menengah ,   \n(iii) Kegiatan MBKM dalam bentuk asistensi mengajar di satuan pendidikan , merupakan \nkegiatan dalam bentuk: bantuan mengajar, tutorial, bimbingan teknis, pelatihan dan \nkegiatan lainnya yang relevan  dengan kegiatan akademik di satuan pendidikan tersebut.  \n(iv) Kegiatan MBKM dalam bentuk asistensi mengajar  dapat dikonversi ke dalam sks MK  \natau bentuk lain sesuai dengan ketercapaian CPL serta lama waktu proses kegiatan  \n(v) Kegiatan MBKM dalam bentuk asistensi mengajar dikembangkan oleh Direktorat yang 13 Dokumen Panduan Baku Mutu Pelaksanaan MBKM - 2021  \n NO ELEMEN PENILAIAN  INDIKATOR  \n(1) (2) (3) \nmengurusi kemahasiswaan.  \n(vi) Implementasi kegiatan MBKM  dalam bentuk asistensi mengajar  dikoordinasi oleh \nDirektorat yang mengurusi Kemahasiswaan bersama Prodi terkait , melalui tahapan  \nkegiatan (a) persiapan, (b) Pelaksanaa n, (c) Evaluasi, (d) Pengendalian, dan (e) \nPeningkatan  \n Standar Proses –  \nKegiatan MBKM – Bentuk \nMagang / Praktik Kerja dan', 'BAB III\r\nRUANG LINGKUP KEGIATAN\r\n\r\nPasal 3\r\n(1) Kegiatan MB - KM merupakan proses pembelajaran yang dilaksanakan di luar Program Studi baik yang ada di internal ITS maupun di luar ITS yang terdiri atas:\r\na. pembelajaran dalam Program Studi lain di internal ITS;\r\n\r\nb. pembelajaran dalam Program Studi yang sama pada Perguruan Tinggi di luar ITS;\r\nc. pembelajaran dalam Program Studi lain pada Perguruan Tinggi di luar ITS; dan\r\nd. pembelajaran pada lembaga non Perguruan Tinggi.\r\n(2) Ruang lingkup kegiatan MB - KM adalah 8 (delapan) bentuk kegiatan pembelajaran (BKP) yang meliputi:\r\na. Magang/ Praktik Kerja;\r\nb. Membangun Desa/ Kuliah Kerja Nyata Tematik;\r\nc. Pertukaran Pelajar;\r\nd. Proyek Kemanusiaan;\r\ne. Penelitian/ Riset;\r\nf. Kegiatan Wirausaha;\r\ng. Studi/ Proyek Independen; dan\r\nh. Asistensi Mengajar di Satuan Pendidikan.\r\n(3) Dalam hal ada penambahan dan atau perubahan BKP MBKM sebagaimana dimaksud pada ayat (2) ditetapkan melalui Keputusan Rektor.', 'meningkatkan prestasi mahasiswa dalam ajang nasional dan internasional.  \n(iii) Kegiatan  MBKM dalam bentuk Studi/ Proyek Independen adalah semua kegiatan untuk  \npenerapan saintek dalam rangka menghasilkan inovasi terdepan (frontie r).  12 Dokumen Panduan Baku Mutu Pelaksanaan MBKM - 2021  \n NO ELEMEN PENILAIAN  INDIKATOR  \n(1) (2) (3) \n(iv) Kegiatan  MBKM dalam bentuk Studi/ Proyek Independen dapat berupa lomba - lomba \nkemahasiswaan atau proyek - proyek untuk memecahkan persoalan di ITS, di \nmasyarakat atau industri.  \n(v) Kegiatan MBKM dalam bentuk  Studi/ Proyek Independen  dapat dikonversika n ke dalam \nsks MK  atau bentuk lain sesuai dengan ketercapaian CPL serta lama waktu proses \nkegiatan.  \n(vi) Kegiatan MBKM dalam bentuk  Studi/ Proyek dikembangkan oleh Direktorat yang \nmengurusi Kemahasiswaan.  \n(vii) Implementasi  Kegiatan MBKM dalam bentuk  Studi/  Proyek  dikoordinir oleh  Direktorat \nyang mengurusi kemahasiswaan  bersama Prodi terkait , melalui tahapan  kegiatan (a)', 'kegiatan (a) persiapan, (b) Pelaksanaa n, (c) Evaluasi, (d) Pengendalian, dan (e) \nPeningkatan  \n Standar Proses –  \nKegiatan MBKM – Bentuk \nMagang / Praktik Kerja dan \nWirausaha lingkup Hilirisasi  (i) Kegiatan MBKM dalam bentuk Magang/ Praktik Kerja dan Kegiatan Wirausaha Lingkup \nHilirisasi ditujukan untuk  memperlancar karir lulusan, pengayaan kompetensi \nmahasiswa, kolaborasi magang, wirausaha dan kerja sama pengembangan produk \ninovatif  dalam rangka meraih profil lulusan sebagai  inovator yang produktif.  \n(ii) Kegiatan MBKM dalam bentuk magang/ praktik kerja dan kegiatan wirausaha hilirisasi \ndapat berupa kegiatan penelitian dan pengabdian masyarakat bersama civitas \nakademika yang lain untuk memecahkan persoalan di masyarakat atau indust ri, inkubasi \ndan start -up.  \n(iii) Kegiatan MBKM dalam bentuk magang/ praktik kerja dan kegiatan wirausaha hilirisasi \ndikembangkan oleh  Direktorat yang mengurusi inovasi dan kawasan sains teknologi']","Dalam MB-KM, terdapat 8 bentuk kegiatan pembelajaran (BKP) yang meliputi:
1. Magang/ Praktik Kerja
2. Membangun Desa/ Kuliah Kerja Nyata Tematik
3. Pertukaran Pelajar
4. Proyek Kemanusiaan
5. Penelitian/ Riset
6. Kegiatan Wirausaha
7. Studi/ Proyek Independen
8. Asistensi Mengajar di Satuan Pendidikan

Itulah 8 bentuk kegiatan pembelajaran yang termasuk dalam MB-KM."
7,Kapan pelaksanaan kegiatan pengabdian kepada masyarakat dapat dilakukan dalam program sarjana di ITS?,Pada semester 6 dan 7.,"['(4) Pelaksanaan kegiatan pengabdian kepada masyarakat adalah pada semester 6 (enam) dan 7 (tujuh).\r\n(5) Pelaksanaan kegiatan pengabdian kepada masyarakat dapat dilaksanakan sebelum semester 6 (enam) dan 7 (tujuh) tetapi sudah lulus tahap persiapan dengan menggunakan sistem tabung nilai.\r\n(6) Mekanisme dan penyelenggaraan kegiatan pengabdian kepada masyarakat dikembangkan dan dikoordinasikan oleh Direktorat yang mengurusi riset dan pengabdian kepada masyarakat.\r\n(7) Direktorat yang mengurusi riset dan pengabdian kepada masyarakat dalam menyelenggarakan kegiatan pengabdian kepada masyarakat sebagaimana dimaksud pada ayat (6) berkoordinasi dengan Program Studi terkait.\r\n\r\nBagian Ketiga\r\nPertukaran Pelajar/ Kuliah Lingkup Dalam Negeri\r\n\r\nPasal 7', '(v) Bentuk kegiatan pengabdian kepada masyarakat merupakan salah satu bentuk 7 Dokumen Panduan Baku Mutu Pelaksanaan MBKM - 2021  \n NO ELEMEN PENILAIAN  INDIKATOR  \n(1) (2) (3) \nimplementasi MK pengayaan dengan bobot 3 (tiga) sks.  \n \n4 Standar Isi  – Pengakuan bobot \nsks (1) Jumlah sks maksimal yang dapat diambil dalam rangka pelaksanaan kegiatan MB – KM \nadalah 40 (empat puluh) sks.  \n(2) Kegiatan magang/ praktik kerja pada program sarjana terapan diimplementasikan dalam \nbentuk mata kuliah wajib sebagai  mata kuliah penciri Fakultas  Vokasi sebesar 14 (empat \nbelas) sks.  \n(3) Konversi kegiatan MB -KM magang dapat dikonversikan ke dalam: (i) MK KP,  \n(ii) beberapa MK gabungan antara KP dengan MK lain dengan kesamaan CP MK,  \n(iii) MK magang dengan maksimum bobot 20 (dua puluh) sks.   \n(4) Kegiatan MBKM – dalam bentuk pertukaran pelajar melalui MK di prodi di luar ITS, \ndengan ketentuan jumlah sks maksimal adalah 20 (dua puluh) sks, yang meliputi mata', 'juga dapat memanfaatkan Program Holistik Pembinaan dan Pemberdayaan Desa \n(PHP2D) dengan mengikuti prosedur dari Direktorat Belmawa.\n27       Buku Panduan Merdeka Belajar - Kampus Merdeka\nContoh Model KKNT Pembangunan dan Pemberdayaan bersama Kemendes\nContoh Model KKNT Pembangunan dan Pemberdayaan bersama Mitra\nBuku Panduan Merdeka Belajar - Kampus Merdeka       28\n3) Model KKNT Mengajar di Desa\nPelaksanaan kegiatan ini diutamakan pada mahasiswa program studi Pendidikan. \nBagi mahasiswa di luar program studi Pendidikan dapat melakukan kegiatan \nmengajar sesuai dengan bidang keahlian dalam rangka pemberdayaan \nmasyarakat misalnya penerapan teknologi tepat guna. Semua kegiatan KKNT \nmengajar ini bersifat membantu pengajaran formal dan non-formal. Bila di akhir \nkegiatan ini akan dijadikan sebagai tugas akhir, maka harus direncanakan sejak \nawal dalam bentuk proposal yang mengacu pada aturan prodi.\nContoh Model KKNT Mengajar di Desa\n4) Model KKNT Free Form', '(6) Mekanisme dan penyelenggaraan kegiatan magang/ praktik kerja dikembangkan dan dikoordinasikan oleh Direktorat yang mengurusi kemahasiswaan.\r\n(7) Direktorat Kemahasiswaan dalam menyelenggarakan kegiatan magang/ praktik kerja sebagaimana dimaksud pada ayat (6) berkoordinasi dengan Program Studi terkait.\r\n\r\n         Bagian Kedua Pengabdian Kepada Masyarakat\r\n\r\nPasal 6\r\n(1) Kegiatan pengabdian kepada masyarakat ditujukan untuk pembinaan karakter kebangsaan mahasiswa khususnya untuk menumbuhkan kepedulian terhadap persoalan yang dihadapi masyarakat.\r\n(2) Kegiatan pengabdian kepada masyarakat pada program sarjana diimplementasikan dalam bentuk mata kuliah pengayaan sebesar 3 (tiga) sks.\r\n(3) Kegiatan pengabdian kepada masyarakat pada program sarjana terapan, dapat diambil untuk tambahan sks atau dapat dikompensasi dengan mata kuliah Program Studi yang memiliki capaian pembelajaran yang setara.']","Pelaksanaan kegiatan pengabdian kepada masyarakat dalam program sarjana di ITS dapat dilakukan pada semester 6 (enam) dan 7 (tujuh). Namun, kegiatan pengabdian kepada masyarakat juga dapat dilaksanakan sebelum semester 6 (enam) dan 7 (tujuh) jika mahasiswa sudah lulus tahap persiapan dengan menggunakan sistem tabung nilai. Mekanisme dan penyelenggaraan kegiatan pengabdian kepada masyarakat dikembangkan dan dikoordinasikan oleh Direktorat yang mengurusi riset dan pengabdian kepada masyarakat."
8,Apa fungsi dari Tim MB-KM ITS?,"Memfasilitasi implementasi kegiatan MB-KM di ITS, termasuk membuat prosedur operasional baku, dokumen teknis, penjaminan mutu, sistem aplikasi dan hal lainnya.","['APA SAJA SYARAT DAN KETENTUAN UNTUK JENIS MAGANG MBKM ?\n\n1. Mahasiswa aktif ITS tingkat Sarjana dan Diploma\n2. Minimal mahasiswa sudah lulus 90 SKS atau sudah lulus semester 5.\n3. Mahasiswa tidak diperkenankan mengambil Program Kegiatan Magang (BKP)\nMBKM yang sama lebih dari 1 kali.\n4. Mahasiswa WAJIB melakukan konversi alih kredit ke SKS MK.\n5. Mahasiswa/Departemen WAJIB membuat/memiliki surat PKS.\n6. Pelaksanaan Magang sebelum minggu ke-3 perkuliahan di ITS.\n7. Mahasiswa tidak diperkenankan mengambil MK, atau hanya diperkenankan\nmengambil maks. 3 MK (setara 10 SKS).\n8. Pelaksanaan Magang selama 3 – 6 bulan.\n\nAPA SAJA\nSYARAT DAN\nKETENTUAN\nUNTUK JENIS\nMAGANG\nNON-MBKM', 'terlibat di dalam pro ses dan hasil pelaksanaan MBKM.  \n(2). SOP yang diterbitkan oleh: (a) Direktorat terkait sebagai koordinator pelaksana \nmasing -masing bentuk MBKM, (b) Prodi sebagai pelaksana MBKM  untuk memandu \ndosen, mahasiswa dan tenaga kependidikan yang terlibat di dalam proses dan hasil \npelaksanaan MBKM.  \nDokumen (1) dan (2) di atas, merupakan manual untuk seluruh stakeholder yang terlibat \ndi dalam implementasi MBKM, yang dapat disusun dalam satu dokumen atau lebih secara \nterpisah. Rambu -rambu dalam penyusunan ke dua dokumen di atas, dengan ketentuan \nmemuat unsur -unsur sebagai berikut, dan dapat dikembangkan sesuai dengan kebutuhan \ndan tujuan pelaksanaan MBKM.  \n1. Tujuan dan ma ksud Manual MBKM  \n2. Luas lingkup Manual MBKM  \na. Manual Penetapan standar  \nb. Manual pelaksanaan standar  \nc. Manual evaluasi standar  \nd. Manual pengendalian pelaksnanaan standar  \ne. Manual peningkatan standar  \n3. Rincian tentang hal yang harus dikerjakan', '(3) Pelaksanaan transfer kegiatan MB - KM menjadi sks mata kuliah, program studi atau direktorat membentuk tim pelaksana transfer kredit.\r\n(4) Mekanisme dan aturan transfer sks ini dikembangkan dan dikoordinasi oleh Direktorat terkait.\r\n(5) Kegiatan MB - KM dilaksanakan dalam bentuk online, offline atau kombinasi keduanya.\r\n\r\nBagian Kesatu Magang/ Praktik Kerja\r\n\r\nPasal 5\r\n(1) Kegiatan magang/ praktik kerja ditujukan untuk memperlancar karir lulusan, pengayaan kompetensi mahasiswa, kolaborasi riset dan kerja sama pengembangan industri.\r\n(2) Kegiatan magang/ praktik kerja diimplementasikan sesuai dengan ketentuan yang berlaku tentang baku mutu magang Program Studi pada program sarjana terapan dan program sarjana.\r\n(3) Kegiatan magang/ praktik kerja pada program sarjana terapan diimplementasikan dalam bentuk mata kuliah wajib yang merupakan mata kuliah penciri Fakultas Vokasi sebesar 14 (empat belas) sks.', 'NO ELEMEN PENILAIAN  INDIKATOR  \n(1) (2) (3) \nmengurusi riset dan  pengabdian kepada masyarakat . \n(ix) Implementasi MBKM dalam bentuk penelitian/ riset dikembangkan dan dikoordin ir oleh \nDirektorat yang mengurusi riset dan pengabdian kepada masyarakat  bersama Prodi \nterkait ,  melalui tahapan kegiatan (a) persiapan, (b) Pelaksanaan, (c) Evaluasi, (d) \nPengendalian, dan (e) Peningkatan.  \n \n12 Standar Proses –  \nKegiatan MBKM – bentuk \nKewirausahaan  (i) Kegiatan MBKM dalam bentuk wirausaha  dimaksudkan untuk mendukung pencapaian \nprofil sebagai kader pengusaha yang mendukung perkembangan ITS di masa \nmendatang . \n(ii) Kegiatan MBKM dalam bentuk wirausaha  dapat dikonversi ke dalam sks MK sesuai \ndengan ketercapaian CPL atau bentuk lain  \n(iii) Kegiatan MBKM da lam bentuk wirausaha  dikembangkan oleh Direktorat yang \nmengurusi Kemahasiswaan.  \n(x) Implementasi  Kegiatan MBKM dalam bentuk wirausaha  dikoordinir oleh Direktorat']","Tim MB-KM ITS memiliki fungsi untuk mengkoordinasikan transfer kegiatan MB-KM menjadi SKS mata kuliah. Mekanisme dan aturan transfer SKS ini dikembangkan dan dikoordinasikan oleh Direktorat terkait. Tim ini bertanggung jawab dalam pelaksanaan kegiatan MB-KM dalam bentuk online, offline, atau kombinasi keduanya."
9,Apa tujuan penjaminan mutu MBKM?,Untuk meningkatkan kompetensi lulusan dengan soft skills dan hard skills.,"['APA SAJA SYARAT DAN KETENTUAN UNTUK JENIS MAGANG MBKM ?\n\n1. Mahasiswa aktif ITS tingkat Sarjana dan Diploma\n2. Minimal mahasiswa sudah lulus 90 SKS atau sudah lulus semester 5.\n3. Mahasiswa tidak diperkenankan mengambil Program Kegiatan Magang (BKP)\nMBKM yang sama lebih dari 1 kali.\n4. Mahasiswa WAJIB melakukan konversi alih kredit ke SKS MK.\n5. Mahasiswa/Departemen WAJIB membuat/memiliki surat PKS.\n6. Pelaksanaan Magang sebelum minggu ke-3 perkuliahan di ITS.\n7. Mahasiswa tidak diperkenankan mengambil MK, atau hanya diperkenankan\nmengambil maks. 3 MK (setara 10 SKS).\n8. Pelaksanaan Magang selama 3 – 6 bulan.\n\nAPA SAJA\nSYARAT DAN\nKETENTUAN\nUNTUK JENIS\nMAGANG\nNON-MBKM', 'PERSYARATAN PENDAFTARAN MAHASISWA UNTUK MENGIKUTI BKP-MBKM\nPROGRAM MAGANG FLAGSHIP MSIB\n● Mahasiswa aktif ITS Tingkat S1/D4 yang belum Yudisium\n● Minimal sudah lulus ≥ 90 SKS (atau sudah lulus semester 5)\n● Mahasiswa tidak diperkenankan mengambil Program Kegiatan (BKP) MBKM yang sama lebih\ndari 1 kali. Mahasiswa yang sudah pernah mengikuti Program Kegiatan Magang (konversi ke\nSKS), tidak diperkenankan mendaftar Program kegiatan Magang kembali (disarankan\nmendaftar pada Program BKP MBKM lainnya). Contoh: Studi Independen\n● Mahasiswa tidak diperkenankan mengambil Program Kegiatan (BKP) MBKM yang sama lebih\ndari 1 kali. Mahasiswa yang sudah pernah mengikuti Program Kegiatan Studi Independen (\nkonversi ke SKS), tidak diperkenankan mendaftar Program kegiatan Studi Independen\nkembali (disarankan mendaftar pada Program BKP MBKM lainnya). Contoh: Magang\n● Mahasiswa yang akan mengikuti Program Magang dan Studi Independen (MSIB) Batch 6 Wajib\nmelakukan konversi alih kredit SKS MK.', 'meingimplementasi MBKM, dengan tujuan:  \n(i) Melakukan pengukuran ketercapaian CPL untuk masing -masing bentuk \nMBKM.  \n(ii) Melakukan penilaian dan evaluasi atas proses dan hasil kegiatan MBKM  \n(iii) Melakukan pengendalian proses implementasi MBKM  \n(iv) Melakukan peningkatan impleme ntasi MBKM, atas hasil survey kepuasan \npihak internal dan eksternal stakeholder yang terlibat di dalam implementasi \nMBKM.    \n \n \n \n 21 Baku Mutu - MBKM   - 2021', 'Tabel 2.1 Standar dalam penyelenggaraan MB -KM di   ITS \nNO ELEMEN PENILAIAN  INDIKATOR  \n(1) (2) (3) \nI STANDAR KOMPETENSI LULUSAN  \n1 Standar Kompetensi Lulusan  (i) Pelaksanaan MBKM mengacu pada CPL Prodi sebagai target dari kemampuan lulusan, \ndengan minimal pencapaian 80%  CPL dan atau sebagai kompetensi tambahan  \n(ii) Kompetensi tambahan dimaksudkan untuk memperlancar karir lulusan, kolaborasi riset \ndan atau kerja sama p engembangan industri.  \nII STANDAR ISI PEMBELAJARAN  \n2 Standar Isi  – MK Pengayaan  (i) Prodi menyediakan kurikulum untuk pelaksanaan MBKM yang disusun bersama \npemangku kepentingan internal dan eksternal, serta direview oleh pakar bidang ilmu \nprogram studi nya.  \n(ii) Keterjaminan pemenuhan CPL  melalui MBKM ( ketersediaan matrik / peta CPL - MK \nMBKM ), dan ketersediaan modul MK melalui pembelajaran  untuk MK yang \ndilaksanakan secara MBKM']","Tujuan penjaminan mutu MBKM adalah untuk melakukan pengukuran ketercapaian CPL untuk masing-masing bentuk MBKM, melakukan penilaian dan evaluasi atas proses dan hasil kegiatan MBKM, melakukan pengendalian proses implementasi MBKM, serta melakukan peningkatan implementasi MBKM berdasarkan hasil survey kepuasan pihak internal dan eksternal stakeholder yang terlibat dalam implementasi MBKM."
10,Apa tujuan dari MBKM?,"Untuk menghasilkan lulusan yang berkualitas dan memenuhi visi, misi, tata nilai, dan tujuan ITS serta memenuhi SN-DIKTI.","['meingimplementasi MBKM, dengan tujuan:  \n(i) Melakukan pengukuran ketercapaian CPL untuk masing -masing bentuk \nMBKM.  \n(ii) Melakukan penilaian dan evaluasi atas proses dan hasil kegiatan MBKM  \n(iii) Melakukan pengendalian proses implementasi MBKM  \n(iv) Melakukan peningkatan impleme ntasi MBKM, atas hasil survey kepuasan \npihak internal dan eksternal stakeholder yang terlibat di dalam implementasi \nMBKM.    \n \n \n \n 21 Baku Mutu - MBKM   - 2021', '(iii) Kegiatan MBKM da lam bentuk wirausaha  dikembangkan oleh Direktorat yang \nmengurusi Kemahasiswaan.  \n(x) Implementasi  Kegiatan MBKM dalam bentuk wirausaha  dikoordinir oleh Direktorat \nyang mengurusi kemahasiswaan  bersama Prodi terkait , melalui  tahapan kegiatan (a) \npersiapan, (b) Pelaksanaan, (c) Evaluasi, (d) Pengendalian, dan (e) Peningkatan.  \n \n13 Standar Proses –  \nKegiatan MBKM – bentuk Studi \nIndependen  (i) Kegiatan MBKM dalam bentuk Studi/ Proyek Independen dimaksudkan untuk \nmendukung pencapaian profil sebagai inovator yang produktif.  \n(ii) Kegiatan  MBKM dalam bentuk Studi/ Proyek Independen dalam rangka untuk \nmewujudkan gagasan mahasiswa dalam mengembangkan produk inovatif, \nmenyelenggarakan pendidikan berbasis ri set dan pengembangan (R&D) serta \nmeningkatkan prestasi mahasiswa dalam ajang nasional dan internasional.  \n(iii) Kegiatan  MBKM dalam bentuk Studi/ Proyek Independen adalah semua kegiatan untuk', 'meningkatkan prestasi mahasiswa dalam ajang nasional dan internasional.  \n(iii) Kegiatan  MBKM dalam bentuk Studi/ Proyek Independen adalah semua kegiatan untuk  \npenerapan saintek dalam rangka menghasilkan inovasi terdepan (frontie r).  12 Dokumen Panduan Baku Mutu Pelaksanaan MBKM - 2021  \n NO ELEMEN PENILAIAN  INDIKATOR  \n(1) (2) (3) \n(iv) Kegiatan  MBKM dalam bentuk Studi/ Proyek Independen dapat berupa lomba - lomba \nkemahasiswaan atau proyek - proyek untuk memecahkan persoalan di ITS, di \nmasyarakat atau industri.  \n(v) Kegiatan MBKM dalam bentuk  Studi/ Proyek Independen  dapat dikonversika n ke dalam \nsks MK  atau bentuk lain sesuai dengan ketercapaian CPL serta lama waktu proses \nkegiatan.  \n(vi) Kegiatan MBKM dalam bentuk  Studi/ Proyek dikembangkan oleh Direktorat yang \nmengurusi Kemahasiswaan.  \n(vii) Implementasi  Kegiatan MBKM dalam bentuk  Studi/  Proyek  dikoordinir oleh  Direktorat \nyang mengurusi kemahasiswaan  bersama Prodi terkait , melalui tahapan  kegiatan (a)', 'NO ELEMEN PENILAIAN  INDIKATOR  \n(1) (2) (3) \nmengurusi riset dan  pengabdian kepada masyarakat . \n(ix) Implementasi MBKM dalam bentuk penelitian/ riset dikembangkan dan dikoordin ir oleh \nDirektorat yang mengurusi riset dan pengabdian kepada masyarakat  bersama Prodi \nterkait ,  melalui tahapan kegiatan (a) persiapan, (b) Pelaksanaan, (c) Evaluasi, (d) \nPengendalian, dan (e) Peningkatan.  \n \n12 Standar Proses –  \nKegiatan MBKM – bentuk \nKewirausahaan  (i) Kegiatan MBKM dalam bentuk wirausaha  dimaksudkan untuk mendukung pencapaian \nprofil sebagai kader pengusaha yang mendukung perkembangan ITS di masa \nmendatang . \n(ii) Kegiatan MBKM dalam bentuk wirausaha  dapat dikonversi ke dalam sks MK sesuai \ndengan ketercapaian CPL atau bentuk lain  \n(iii) Kegiatan MBKM da lam bentuk wirausaha  dikembangkan oleh Direktorat yang \nmengurusi Kemahasiswaan.  \n(x) Implementasi  Kegiatan MBKM dalam bentuk wirausaha  dikoordinir oleh Direktorat']","Tujuan dari MBKM adalah:
1. Melakukan pengukuran ketercapaian CPL untuk masing-masing bentuk MBKM.
2. Melakukan penilaian dan evaluasi atas proses dan hasil kegiatan MBKM.
3. Melakukan pengendalian proses implementasi MBKM.
4. Melakukan peningkatan implementasi MBKM, berdasarkan hasil survey kepuasan pihak internal dan eksternal stakeholder yang terlibat dalam implementasi MBKM."
11,Apa tujuan dari kegiatan magang/ praktik kerja?,"Memperlancar karir lulusan, pengayaan kompetensi mahasiswa, kolaborasi riset, dan kerja sama pengembangan industri.","['kegiatan (a) persiapan, (b) Pelaksanaa n, (c) Evaluasi, (d) Pengendalian, dan (e) \nPeningkatan  \n Standar Proses –  \nKegiatan MBKM – Bentuk \nMagang / Praktik Kerja dan \nWirausaha lingkup Hilirisasi  (i) Kegiatan MBKM dalam bentuk Magang/ Praktik Kerja dan Kegiatan Wirausaha Lingkup \nHilirisasi ditujukan untuk  memperlancar karir lulusan, pengayaan kompetensi \nmahasiswa, kolaborasi magang, wirausaha dan kerja sama pengembangan produk \ninovatif  dalam rangka meraih profil lulusan sebagai  inovator yang produktif.  \n(ii) Kegiatan MBKM dalam bentuk magang/ praktik kerja dan kegiatan wirausaha hilirisasi \ndapat berupa kegiatan penelitian dan pengabdian masyarakat bersama civitas \nakademika yang lain untuk memecahkan persoalan di masyarakat atau indust ri, inkubasi \ndan start -up.  \n(iii) Kegiatan MBKM dalam bentuk magang/ praktik kerja dan kegiatan wirausaha hilirisasi \ndikembangkan oleh  Direktorat yang mengurusi inovasi dan kawasan sains teknologi', '(3) Kegiatan magang/ praktik kerja pada program sarjana terapan diimplementasikan dalam bentuk mata kuliah wajib yang merupakan mata kuliah penciri Fakultas Vokasi sebesar 14 (empat belas) sks.\r\n(4) Kegiatan magang/ praktik kerja pada program sarjana dapat dikonversikan menjadi:\r\na. sks kerja praktek; atau\r\n\r\nb. sks satu atau beberapa mata kuliah yang memiliki Capaian Pembelajaran Mata Kuliah (CPMK) sama dengan magang; atau\r\nc. sks gabungan antara kerja praktek dengan mata kuliah yang memiliki CPMK sama dengan magang atau mata kuliah magang dengan total maksimal 20 (dua puluh) sks.\r\n(5) Persyaratan mahasiswa yang dapat mengikuti kegiatan magang di Program Studi yang belum memiliki mata kuliah magang adalah mahasiswa sudah lulus 72 (tujuh puluh dua sks.\r\n(6) Mekanisme dan penyelenggaraan kegiatan magang/ praktik kerja dikembangkan dan dikoordinasikan oleh Direktorat yang mengurusi kemahasiswaan.', 'dan start -up.  \n(iii) Kegiatan MBKM dalam bentuk magang/ praktik kerja dan kegiatan wirausaha hilirisasi \ndikembangkan oleh  Direktorat yang mengurusi inovasi dan kawasan sains teknologi \nbekerjasama dengan Direktorat yang mengurusi kemahasiswaan . \n(iv) Impl ementasi kegiatan MBKM dalam bentuk  magang/ praktik kerja dan kegiatan \nwirausaha hilirisasi dikoordinir oleh Direktorat yang mengurusi  inovasi dan kawasan \nsains teknologi  bersama Prodi terkait, melalui tahapan  kegiatan (a) persiapan, (b) \nPelaksanaan, (c) Evaluasi, (d) Pengendalian, dan (e) Peningkatan   \n \nIV STANDAR PENILAIAN PEMBELAJARAN  \n11 Standar penilaian  (i) Penilaian atas proses dan hasil pelaksanaan MBKM mengacu pada prinsip penilaian.  \n \n 14 Dokumen Panduan Baku Mutu Pelaksanaan MBKM - 2021  \n NO ELEMEN PENILAIAN  INDIKATOR  \n(1) (2) (3) \nDalam hal mahasiswa mendapatkan nilai mata kuliah pengayaan kurang dari C, maka \nmahasiswa dapat menggantinya dengan mata kuliah pengayaan yang berbeda.', '(6) Mekanisme dan penyelenggaraan kegiatan magang/ praktik kerja dikembangkan dan dikoordinasikan oleh Direktorat yang mengurusi kemahasiswaan.\r\n(7) Direktorat Kemahasiswaan dalam menyelenggarakan kegiatan magang/ praktik kerja sebagaimana dimaksud pada ayat (6) berkoordinasi dengan Program Studi terkait.\r\n\r\n         Bagian Kedua Pengabdian Kepada Masyarakat\r\n\r\nPasal 6\r\n(1) Kegiatan pengabdian kepada masyarakat ditujukan untuk pembinaan karakter kebangsaan mahasiswa khususnya untuk menumbuhkan kepedulian terhadap persoalan yang dihadapi masyarakat.\r\n(2) Kegiatan pengabdian kepada masyarakat pada program sarjana diimplementasikan dalam bentuk mata kuliah pengayaan sebesar 3 (tiga) sks.\r\n(3) Kegiatan pengabdian kepada masyarakat pada program sarjana terapan, dapat diambil untuk tambahan sks atau dapat dikompensasi dengan mata kuliah Program Studi yang memiliki capaian pembelajaran yang setara.']","Tujuan dari kegiatan magang/ praktik kerja adalah untuk memperlancar karir lulusan, mengaya kompetensi mahasiswa, kolaborasi magang, wirausaha, dan kerja sama pengembangan produk inovatif dalam rangka meraih profil lulusan sebagai inovator yang produktif. Selain itu, kegiatan magang/ praktik kerja juga dapat berupa kegiatan penelitian dan pengabdian masyarakat bersama civitas akademika lainnya untuk memecahkan persoalan di masyarakat atau industri, serta untuk inkubasi dan start-up. Kegiatan ini dikembangkan oleh Direktorat yang mengurusi inovasi dan kawasan sains teknologi."
12,Apa yang dimaksud dengan PDDikti?,Pangkalan Data Perguruan Tinggi yang terintegrasi secara nasional.,"['Subdit. PK2\nSKEMA PELAKSANAAN\nPROGRAM MAGANG\nMANDIRI DI ITS\nMahasiswa / Departemen melakukan\nmenyertakan:\n1. Proposal Magang\n2. Surat Rekomendasi Departemen\n3. Surat Penerimaan Magang\nPelaksanaan Magang\nProses pengurusan\nPKS\nPKS tidak\ndisetujui\nPKS\nTertandatangan\nSelesai\nMagang berakhir <\nMahasiswa mendapatkan\nSertifikat / Penilaian Magang\nSelesai\nADVANCING HUMANITY\niTS\nMulai\nMahasiswa mengurus\nsurat rekomendasi\ndepartemen untuk pengajuan magang ke\nMitra\nMahasiswa mengajukan\npermohonan magang ke\nMitra\nMitra melakukan seleksi magang\nMahasiswa menerima hasil seleksi magang dari Mitra\nTidak diterima\nSelesai\nDiterima\nMahasiswa melaporkan\nke Departemen', 'PENGALAMAN TENTANG KEBUDAYAAN DAERAH LAIN\nMELALUI MODUL NUSANTARA\nSelain mengikuti pembelajaran mata kuliah di perguruan tinggi penerima, mahasiswa yang mengikuti program Pertukaran Mahasiswa Merdeka juga akan mendapatkan pengalaman langsung berinteraksi dengan mahasiswa dari daerah lain dan mempelajari kebudayaan daerah lain melalui Modul Nusantara. Modul Nusantara ini senilai 2 sks dan wajib diambil oleh mahasiswa peserta program Pertukaran Mahasiswa Merdeka. Modul Nusantara dilaksanakan di perguruan tinggi penerima. Modul Nusantara dibagi ke dalam empat jenis kegiatan yaitu kebinekaan, inspirasi, refleksi, dan kontribusi sosial. Dalam pelaksanaan Modul Nusantara, mahasiswa akan dibimbing oleh dosen pembimbing modul nusantara dan dibantu oleh mentor.\nBAGAIMANA MEKANISME PELAKSANAAN PERTUKARAN\nMAHASISWA MERDEKA?\nTerdapat dua mekanisme, yaitu:', '• LAMPIRAN 8: Form Persetujuan Konversi Mata Kuliah\nLAMPIRAN 1\nKOP Departemen\nNo\n:....\nLampiran :\nPerihal :.\nKepada yth :\nDosen Wali Departemen ...\nFakultas...\nITS\nSehubungan dengan adanya permohonan konversi mata kuliah dari mahasiswa peserta magang dengan detail sebagai berikut :\nNama\nNRP\nNama Mitra Magang :\nPeriode magang\nMahasiswa yang bersangkutan akan/ telah *) melakukan magang dengan rincian tugas sebagai berikut :\nBerdasarkan hasil telaah dan analisa dengan bidang akademik departemen, maka mahasiswa yang bersangkutan berhak untuk mendapatkan konversi mata kuliah dan SKS, dimana konversi ini akan di lakukan pada semester..... tahun ajaran ....\n.......Adapun mata kuliah yang dapat dikonversikan dengan\nkegiatan magang adalah sebagai berikut :\nNo.\nMata Kuliah Konversi\nJumlah SKS\n\n\n\n\n\n\n\n\n\nTotal SKS\n\nSurabaya, ....\n*) dicoret\nKepala Departemen ....\n70\nLampiran\n\nSUBDIREKTORAT PENGEMBANGAN KEWIRAUSAHAAN DAN KARIR\nDIREKTORAT KEMAHASISWAAN\nINSTITUT TEKNOLOGI SEPULUH NOPEMBER\n2020', 'terlibat di dalam pro ses dan hasil pelaksanaan MBKM.  \n(2). SOP yang diterbitkan oleh: (a) Direktorat terkait sebagai koordinator pelaksana \nmasing -masing bentuk MBKM, (b) Prodi sebagai pelaksana MBKM  untuk memandu \ndosen, mahasiswa dan tenaga kependidikan yang terlibat di dalam proses dan hasil \npelaksanaan MBKM.  \nDokumen (1) dan (2) di atas, merupakan manual untuk seluruh stakeholder yang terlibat \ndi dalam implementasi MBKM, yang dapat disusun dalam satu dokumen atau lebih secara \nterpisah. Rambu -rambu dalam penyusunan ke dua dokumen di atas, dengan ketentuan \nmemuat unsur -unsur sebagai berikut, dan dapat dikembangkan sesuai dengan kebutuhan \ndan tujuan pelaksanaan MBKM.  \n1. Tujuan dan ma ksud Manual MBKM  \n2. Luas lingkup Manual MBKM  \na. Manual Penetapan standar  \nb. Manual pelaksanaan standar  \nc. Manual evaluasi standar  \nd. Manual pengendalian pelaksnanaan standar  \ne. Manual peningkatan standar  \n3. Rincian tentang hal yang harus dikerjakan']","PDDikti merupakan singkatan dari Pusat Data dan Informasi Pendidikan Tinggi, yang merupakan lembaga di bawah Kementerian Pendidikan, Kebudayaan, Riset, dan Teknologi yang bertanggung jawab dalam pengelolaan data dan informasi mengenai pendidikan tinggi di Indonesia. PDDikti memiliki peran penting dalam menyediakan data-data terkait perguruan tinggi, program studi, mahasiswa, dosen, dan berbagai informasi terkait pendidikan tinggi di Indonesia."
13,Berapa jumlah kredit Mata Kuliah KP?,2 SKS,"['KERJA PRAKTIK\nDepartemen Teknik Informatika ITS\n\nSekilas Kerja Praktik\n\nJumlah kredit Mata Kuliah KP: 2 SKS\nSKS KP diambil bersamaan / setelah menyelesaikan KP di organisasi (perusahaan, instansi, yayasan)\nLama KP: 1-2 bulan dengan hitungan kerja part time\nBisa perorangan atau berkelompok maksimal 2 (dua) mahasiswa\nBerkas-berkas KP bisa didapatkan di link resource akademik:\nhttps://intip.in/ResourceAkademikDanKemahasiswaanIF\nProsedur Kerja Praktik\n\nMengajukan KP\nSurat Pengantar KP\nDosen Pembimbing KP\nPelaksanaan KP\nPenilaian KP oleh Pembimbing Lapangan\nPenilaian KP oleh Dosen Pembimbing\nPenyerahan Laporan KP ke RBTC\nMengumpulkan bukti penyelesaian KP\nLulus KP\nSebelum berangkat KP\n\nMengajukan KP\n\nMemenuhi persyaratan sebagai berikut:\nMahasiswa aktif Teknik Informatika\nSKS tempuh minimum 90 SKS\nMengisi MONKP:\nmonkp.if.its.ac.id (registrasi akun dan data KP)\nStatus KP akan menjadi CREATED\nSurat Pengantar Kerja Praktik', 'diperoleh mahasiswa dalam pelaksanaan KKNT. Jumlah dan bidang Mahasiswa \nyang mengikuti program ini menyesuaikan dengan kebutuhan program di desa. \nPelaksanaan KKNT Pembangunan dan Pemberdayaan Desa dilakukan selama        \n6 – 12 bulan di lokasi atau setara dengan maksimal 20 SKS. Perhitungan terhadap \ncapaian pembelajaran setara 20 SKS ini dapat disetarakan dalam beberapa mata \nkuliah yang relevan dengan kompetensi lulusan. Penilaian terhadap capaian \npembelajaran dapat diidentifikasi dari laporan dan ujian portofolio/rubrik \nkegiatan KKNT. Untuk kesesuaian dengan ketercapaian kompetensi lulusan \nmaka perlu dipersiapkan proposal/rancangan kegiatan yang dapat mewakili \nbidang keahlian. Dosen pembimbing lapangan harus mewakili program studi \npengampu mata kuliah semester akhir dari setiap program studi. Mahasiswa \njuga dapat memanfaatkan Program Holistik Pembinaan dan Pemberdayaan Desa \n(PHP2D) dengan mengikuti prosedur dari Direktorat Belmawa.', 'APA SAJA SYARAT DAN KETENTUAN UNTUK JENIS MAGANG MBKM ?\n\n1. Mahasiswa aktif ITS tingkat Sarjana dan Diploma\n2. Minimal mahasiswa sudah lulus 90 SKS atau sudah lulus semester 5.\n3. Mahasiswa tidak diperkenankan mengambil Program Kegiatan Magang (BKP)\nMBKM yang sama lebih dari 1 kali.\n4. Mahasiswa WAJIB melakukan konversi alih kredit ke SKS MK.\n5. Mahasiswa/Departemen WAJIB membuat/memiliki surat PKS.\n6. Pelaksanaan Magang sebelum minggu ke-3 perkuliahan di ITS.\n7. Mahasiswa tidak diperkenankan mengambil MK, atau hanya diperkenankan\nmengambil maks. 3 MK (setara 10 SKS).\n8. Pelaksanaan Magang selama 3 – 6 bulan.\n\nAPA SAJA\nSYARAT DAN\nKETENTUAN\nUNTUK JENIS\nMAGANG\nNON-MBKM', 'dapat menuliskan hal-hal yang dilakukannya beserta hasilnya dalam bentuk tugas \nakhir.\nPelaksanaan KKNT dilakukan untuk mendukung kerja sama bersama Kementerian \nDesa PDTT serta Kementerian/ stakeholder  lainnya. Pemerintah melalui Kementerian \nDesa PDTT menyalurkan dana desa 1 milyar per desa kepada sejumlah 74.957 \ndesa di Indonesia, yang berdasarkan data Indeks Desa Membangun (IDM) tahun \n2019, terdapat desa sangat tertinggal sebanyak 6.549 dan desa tertinggal 20.128. \nPelaksanaan KKNT dapat dilakukan pada desa sangat tertinggal, tertinggal dan \nberkembang, yang sumber daya manusianya  belum memiliki kemampuan \nperencanaan pembangunan dengan fasilitas dana yang besar tersebut. Sehingga \nefektivitas penggunaan dana desa untuk menggerakkan pertumbuhan ekonomi \nmasih perlu ditingkatkan, salah satunya melalui mahasiswa yang dapat menjadi \nsumber daya manusia yang lebih memberdayakan dana desa.\n23       Buku Panduan Merdeka Belajar - Kampus Merdeka']",Jumlah kredit Mata Kuliah KP adalah 2 SKS.
14,Kapan SKS KP bisa diambil?,"Bersamaan atau setelah menyelesaikan KP di organisasi (perusahaan, instansi, yayasan)","['yang setara.  \n(iv) Kegiatan MBKM dalam bentuk KKN dilaksanakan pada semester 6 (enam) dan 7 (tujuh)  \natau sebelum nya dengan syarat telah lulus tahap persiapan.  \n(v) Kegiatan MBKM dalam bentuk KKN yang dilaksanakan sebelum semester 6 (enam) dan \n7 (tujuh) dan s udah lulus tahap persiapan , diakui sebagai MBKM dengan sistem tabung \nnilai.  \n(vi) Kegiatan MBKM dalam bentuk KKN  dikembangkan oleh Direktorat yang mengurusi riset \ndan pengabdian kepada masyarakat . \n(vii) Implementasi MBKM dalam bentuk  KKN  dikoordinir oleh Direktorat yang m engurusi  \npengabdian kepada masyarakat bersama  Prodi  terkait , melalui tahapan kegiatan (a) \npersiapan, (b) Pelaksanaan, (c) Evaluasi, (d) Pengendalian, dan (e) Peningkatan . \n \n10 Standar Proses –  \nKegiatan MBKM – bentuk \nPertukaran Pelajar  (i) Kegiatan MBKM dalam bentuk pertukaran pelajar  dimaksudkan untuk mencapai CPL .  \n(ii) Kegiatan MBKM dalam bentuk pertukaran pelajar  dapat dilakukan dengan PT di dalam \nnegeri atau di luar negeri.', 'KERJA PRAKTIK\nDepartemen Teknik Informatika ITS\n\nSekilas Kerja Praktik\n\nJumlah kredit Mata Kuliah KP: 2 SKS\nSKS KP diambil bersamaan / setelah menyelesaikan KP di organisasi (perusahaan, instansi, yayasan)\nLama KP: 1-2 bulan dengan hitungan kerja part time\nBisa perorangan atau berkelompok maksimal 2 (dua) mahasiswa\nBerkas-berkas KP bisa didapatkan di link resource akademik:\nhttps://intip.in/ResourceAkademikDanKemahasiswaanIF\nProsedur Kerja Praktik\n\nMengajukan KP\nSurat Pengantar KP\nDosen Pembimbing KP\nPelaksanaan KP\nPenilaian KP oleh Pembimbing Lapangan\nPenilaian KP oleh Dosen Pembimbing\nPenyerahan Laporan KP ke RBTC\nMengumpulkan bukti penyelesaian KP\nLulus KP\nSebelum berangkat KP\n\nMengajukan KP\n\nMemenuhi persyaratan sebagai berikut:\nMahasiswa aktif Teknik Informatika\nSKS tempuh minimum 90 SKS\nMengisi MONKP:\nmonkp.if.its.ac.id (registrasi akun dan data KP)\nStatus KP akan menjadi CREATED\nSurat Pengantar Kerja Praktik', '20. Sistem Kredit Semester yang selanjutnya disingkat SKS adalah suatu sistem penyelenggaraan pendidikan dengan menggunakan sks.\r\n21. Satuan Kredit Semester yang selanjutnya disingkat sks adalah takaran waktu kegiatan belajar yang dibebankan pada mahasiswa per minggu per semester dalam proses pembelajaran melalui berbagai bentuk pembelajaran atau besarnya pengakuan atas keberhasilan usaha mahasiswa dalam mengikuti kegiatan kurikuler di suatu program studi.\r\n22. Satuan Kegiatan Ekstrakurikuler Mahasiswa, yang selanjutnya disingkat SKEM, adalah satuan yang digunakan untuk mengukur kegiatan ekstrakurikuler mahasiswa dan berfungsi sebagai salah satu syarat kelulusan bagi mahasiswa Program Sarjana Terapan dan Sarjana.\r\n23. Mata Kuliah adalah satuan pelajaran yang diajarkan di tingkat perguruan tinggi.\r\n24. Mata Kuliah Inti adalah mata kuliah wajib yang terkait dengan program studi di ITS.', 'diperoleh mahasiswa dalam pelaksanaan KKNT. Jumlah dan bidang Mahasiswa \nyang mengikuti program ini menyesuaikan dengan kebutuhan program di desa. \nPelaksanaan KKNT Pembangunan dan Pemberdayaan Desa dilakukan selama        \n6 – 12 bulan di lokasi atau setara dengan maksimal 20 SKS. Perhitungan terhadap \ncapaian pembelajaran setara 20 SKS ini dapat disetarakan dalam beberapa mata \nkuliah yang relevan dengan kompetensi lulusan. Penilaian terhadap capaian \npembelajaran dapat diidentifikasi dari laporan dan ujian portofolio/rubrik \nkegiatan KKNT. Untuk kesesuaian dengan ketercapaian kompetensi lulusan \nmaka perlu dipersiapkan proposal/rancangan kegiatan yang dapat mewakili \nbidang keahlian. Dosen pembimbing lapangan harus mewakili program studi \npengampu mata kuliah semester akhir dari setiap program studi. Mahasiswa \njuga dapat memanfaatkan Program Holistik Pembinaan dan Pemberdayaan Desa \n(PHP2D) dengan mengikuti prosedur dari Direktorat Belmawa.']","SKS KP bisa diambil bersamaan atau setelah menyelesaikan KP di organisasi (perusahaan, instansi, yayasan)."
15,Apakah KP bisa dilakukan secara berkelompok?,"Ya, maksimal 2 (dua) mahasiswa","['masyarakat di luar kampus, yang secara langsung bersama-sama masyarakat \nmengidentifikasi potensi dan menangani masalah sehingga diharapkan mampu \nmengembangkan potensi desa/daerah dan meramu solusi untuk masalah yang ada \ndi desa. Kegiatan KKNT diharapkan dapat mengasah softskill  kemitraan, kerjasama \ntim lintas disiplin/keilmuan (lintas kompetensi), dan leadership  mahasiswa dalam \nmengelola program pembangunan di wilayah perdesaan. Sejauh ini perguruan \ntinggi sudah menjalankan program KKNT, hanya saja Satuan Kredit Semesternya \n(SKS) belum bisa atau dapat diakui sesuai dengan program kampus merdeka yang \npengakuan kreditnya setara 6 – 12 bulan atau 20 – 40 SKS, dengan pelaksanaannya \nberdasarkan beberapa model. Diharapkan juga setelah pelaksanaan KKNT, mahasiswa \ndapat menuliskan hal-hal yang dilakukannya beserta hasilnya dalam bentuk tugas \nakhir.\nPelaksanaan KKNT dilakukan untuk mendukung kerja sama bersama Kementerian', 'diperoleh mahasiswa dalam pelaksanaan KKNT regular, dan mahasiswa diberi \nkesempatan untuk mengajukan perpanjangan KKNT selama maksimal 1 \nsemester atau setara dengan 20 SKS. Untuk melanjutkan program KKNT yang \ndiperpanjang, mahasiswa dapat memanfaatkan Program Holistik Pembinaan Buku Panduan Merdeka Belajar - Kampus Merdeka       26\ndan Pemberdayaan Desa (PHP2D) dengan mengikuti prosedur dari Direktorat \nBelmawa. Bentuk kegiatan KKNT yang Diperpanjang dapat berupa proyek  \npemberdayaan masyarakat di desa dan penelitian untuk tugas akhir mahasiswa.\nContoh Model KKNT yang Diperpanjang\n2) Model KKNT Pembangunan dan Pemberdayaan Desa\nPada model ini perguruan tinggi bekerja sama dengan Mitra dalam melakukan \nKKNT Pembangunan dan Pemberdayaan Desa berdasarkan peluang/kondisi \ndesa dalam bentuk paket kompetensi/pengembangan RPJMDes yang akan \ndiperoleh mahasiswa dalam pelaksanaan KKNT. Jumlah dan bidang Mahasiswa \nyang mengikuti program ini menyesuaikan dengan kebutuhan program di desa.', 'dapat menuliskan hal-hal yang dilakukannya beserta hasilnya dalam bentuk tugas \nakhir.\nPelaksanaan KKNT dilakukan untuk mendukung kerja sama bersama Kementerian \nDesa PDTT serta Kementerian/ stakeholder  lainnya. Pemerintah melalui Kementerian \nDesa PDTT menyalurkan dana desa 1 milyar per desa kepada sejumlah 74.957 \ndesa di Indonesia, yang berdasarkan data Indeks Desa Membangun (IDM) tahun \n2019, terdapat desa sangat tertinggal sebanyak 6.549 dan desa tertinggal 20.128. \nPelaksanaan KKNT dapat dilakukan pada desa sangat tertinggal, tertinggal dan \nberkembang, yang sumber daya manusianya  belum memiliki kemampuan \nperencanaan pembangunan dengan fasilitas dana yang besar tersebut. Sehingga \nefektivitas penggunaan dana desa untuk menggerakkan pertumbuhan ekonomi \nmasih perlu ditingkatkan, salah satunya melalui mahasiswa yang dapat menjadi \nsumber daya manusia yang lebih memberdayakan dana desa.\n23       Buku Panduan Merdeka Belajar - Kampus Merdeka', 'Meminta persetujuan form pengajuan KP ke Koordinator Kerja Praktek (Sekretaris Departemen 1)\nMenyerahkan Form Pengajuan KP yang sudah disetujui Koord. KP kepada Staf Akademik (Pak Sugeng) untuk dibuatkan surat pengantar ke tempat KP\nSurat pengantar KP dikeluarkan oleh departemen Teknik Informatika yang ditujukan kepada organisasi tempat KP yang berisi:\nPermohonan agar mahasiswa X diijinkan untuk melakukan KP di organisasi Y,\nTanggal mulai,\nDurasi kerja praktik\nSurat pengantar KP dikirimkan ke instansi penerima KP\nJika balasan persetujuan sudah didapatkan, unggah ke MONKP\nStatus KP akan menjadi CONFIRMED\nDosen Pembimbing Kerja Praktik\n\nSyarat mendapatkan dosen pembimbing internal KP:\nStatus KP akan menjadi CONFIRMED\nDosen Pembimbing KP dipilih oleh koordinator KP dengan menyesuaikan load pembimbingan dosen, kecuali ada rekomendasi khusus dari dosen ybs\nPengalokasian dilakukan secara batch operation\nDi lokasi KP\n4. Melaksanakan Kerja Praktik']","KP (Kerja Praktek) biasanya dilakukan secara individu oleh mahasiswa sebagai bagian dari program studi mereka. Namun, dalam beberapa kasus tertentu, KP juga bisa dilakukan secara berkelompok. Namun, hal ini perlu disesuaikan dengan kebijakan dan persetujuan dari institusi pendidikan yang bersangkutan serta instansi tempat KP dilakukan. Jika ingin melakukan KP secara berkelompok, mahasiswa perlu memastikan bahwa hal tersebut diizinkan dan memenuhi persyaratan yang berlaku."
16,Apa syarat mengajukan KP?,"Mahasiswa aktif Teknik Informatika, SKS tempuh minimum 90 SKS","['Meminta persetujuan form pengajuan KP ke Koordinator Kerja Praktek (Sekretaris Departemen 1)\nMenyerahkan Form Pengajuan KP yang sudah disetujui Koord. KP kepada Staf Akademik (Pak Sugeng) untuk dibuatkan surat pengantar ke tempat KP\nSurat pengantar KP dikeluarkan oleh departemen Teknik Informatika yang ditujukan kepada organisasi tempat KP yang berisi:\nPermohonan agar mahasiswa X diijinkan untuk melakukan KP di organisasi Y,\nTanggal mulai,\nDurasi kerja praktik\nSurat pengantar KP dikirimkan ke instansi penerima KP\nJika balasan persetujuan sudah didapatkan, unggah ke MONKP\nStatus KP akan menjadi CONFIRMED\nDosen Pembimbing Kerja Praktik\n\nSyarat mendapatkan dosen pembimbing internal KP:\nStatus KP akan menjadi CONFIRMED\nDosen Pembimbing KP dipilih oleh koordinator KP dengan menyesuaikan load pembimbingan dosen, kecuali ada rekomendasi khusus dari dosen ybs\nPengalokasian dilakukan secara batch operation\nDi lokasi KP\n4. Melaksanakan Kerja Praktik', 'APA SAJA SYARAT DAN KETENTUAN UNTUK JENIS MAGANG MBKM ?\n\n1. Mahasiswa aktif ITS tingkat Sarjana dan Diploma\n2. Minimal mahasiswa sudah lulus 90 SKS atau sudah lulus semester 5.\n3. Mahasiswa tidak diperkenankan mengambil Program Kegiatan Magang (BKP)\nMBKM yang sama lebih dari 1 kali.\n4. Mahasiswa WAJIB melakukan konversi alih kredit ke SKS MK.\n5. Mahasiswa/Departemen WAJIB membuat/memiliki surat PKS.\n6. Pelaksanaan Magang sebelum minggu ke-3 perkuliahan di ITS.\n7. Mahasiswa tidak diperkenankan mengambil MK, atau hanya diperkenankan\nmengambil maks. 3 MK (setara 10 SKS).\n8. Pelaksanaan Magang selama 3 – 6 bulan.\n\nAPA SAJA\nSYARAT DAN\nKETENTUAN\nUNTUK JENIS\nMAGANG\nNON-MBKM', '- Kampus Merdeka di atas, untuk kegiatan KKNT terdapat persyaratan tambahan \nyang harus dipenuhi oleh mahasiswa, yaitu:\n1) Mahasiswa telah menyelesaikan proses pembelajaran setelah  semester 6.\n2) Dilakukan secara berkelompok,  anggota berjumlah ± 10   orang per kelompok \ndan atau sesuai kebutuhan desa, dan bersifat multidisiplin (asal prodi/fakultas/\nkluster  yang berbeda).Buku Panduan Merdeka Belajar - Kampus Merdeka       24\n3) Peserta wajib tinggal di komunitas atau wajib “live in”  di lokasi yang telah \nditentukan. \n4) Sehat jasmani dan rohani serta tidak sedang hamil bagi wanita.\n5) IPK minimal 2.00 sampai dengan semester 5.\n6) Ketentuan lain dapat diatur oleh perguruan tinggi pelaksana.\nAdapun untuk mekanisme pelaksanaan kegiatan membangun desa/kuliah kerja \nnyata adalah sebagai berikut.\n1) Perguruan Tinggi\na) Menjalin kerja sama dengan pihak Kementerian Desa PDTT, serta Kemdikbud \ndalam penyelenggaraan program proyek di desa atau menjalin kerja sama', 'magang sesuai dengan ketentuan yang berlaku;  \n 9 Dokumen Panduan Baku Mutu Pelaksanaan MBKM - 2021  \n NO ELEMEN PENILAIAN  INDIKATOR  \n(1) (2) (3) \n9 Standar Proses –  \nKegiatan MBKM – bentuk \nPengabdian kepada Masyarakat  (i) Kegiatan MBKM dalam bentuk pengabdian kepada masyarakat  atau selanjutnya \ndikategorikan sebagai KKN  ditujukan untuk pembinaan karakter kebangsaan mahasiswa \nkhususnya untuk menumbuhkan kepedulian terhadap persoalan yang dihadapi \nmasyarakat , sebaga i salah satu CPL dalam aspek Sikap .  \n(ii) Kegiatan MBKM dalam bentuk KKN harus dibawah bimbingan dosen . \n(iii) Kegiatan MBKM dalam bentuk KKN dapat diakui sebagai  tambahan sks atau dapat \ndikompensasi dengan mata kuliah Program Studi yang memiliki capaian pembelajaran \nyang setara.  \n(iv) Kegiatan MBKM dalam bentuk KKN dilaksanakan pada semester 6 (enam) dan 7 (tujuh)  \natau sebelum nya dengan syarat telah lulus tahap persiapan.']","Syarat mengajukan KP adalah sebagai berikut:
1. Mahasiswa aktif ITS tingkat Sarjana dan Diploma.
2. Minimal mahasiswa sudah lulus 90 SKS atau sudah lulus semester 5.
3. Mahasiswa tidak diperkenankan mengambil Program Kegiatan Magang (BKP) MBKM yang sama lebih dari 1 kali.
4. Mahasiswa WAJIB melakukan konversi alih kredit ke SKS MK.
5. Mahasiswa/Departemen WAJIB membuat/memiliki surat PKS.
6. Pelaksanaan Magang sebelum minggu ke-3 perkuliahan di ITS.
7. Mahasiswa tidak diperkenankan mengambil MK, atau hanya diperkenankan mengambil maks. 3 MK (setara 10 SKS).
8. Pelaksanaan Magang selama 3 – 6 bulan."
17,Apa yang harus dilakukan mahasiswa di lokasi KP?,"Mematuhi dan mengikuti segala aturan terkait kerja praktik, dan mengerjakan pekerjaan yang sesuai dengan kompetensi Informatika","['C Kerat\n@ DASHBOARD E KEGIATAN MAHASISWA & PROFIL\nINDAH SYAHYA DINATA\n凹\nPertukaran Mahasiswa Merdeka\nFORMULIR PENDAFTARAN\nPilih Penempatan & Mata Kuliah\nDalam Pertukaran Mahasiswa Merdeka (20 SKS), kamu bisa mengikuti perkuliahan luar jaringan di Perguruan Tinggi (PT) penerima dan dalam jaringan (maksimum 10 SKS) di beberapa PT mitra.\nUniversitas Luar Jaringan\n20 / 20 SKS\nPilihan Lokasi Pulau PT penerima\nPilihan lokasi putau harus di luar alamat KTP dan domisili PT asal. Preferensi mahasiswa akan dipertimbangkan namun keputusan panitia bersifat final dan tidak dapat digugat.\nPilih Lokasi Pulau 11\nロ\nPilhan lokasi pulau narus di luar alamat KIP dan domisili PI asal. Preterensi manasiswa akan diperumbangkan namun keputusan panta bersitat unai dan toak dapat diguga\nSulawesi\nBali - NTT - NTB\nBerikut adalah contoh Pilihan pulau yang telah di-cluster sesuai\ndomisili pendaftar:\n14', 'Meminta persetujuan form pengajuan KP ke Koordinator Kerja Praktek (Sekretaris Departemen 1)\nMenyerahkan Form Pengajuan KP yang sudah disetujui Koord. KP kepada Staf Akademik (Pak Sugeng) untuk dibuatkan surat pengantar ke tempat KP\nSurat pengantar KP dikeluarkan oleh departemen Teknik Informatika yang ditujukan kepada organisasi tempat KP yang berisi:\nPermohonan agar mahasiswa X diijinkan untuk melakukan KP di organisasi Y,\nTanggal mulai,\nDurasi kerja praktik\nSurat pengantar KP dikirimkan ke instansi penerima KP\nJika balasan persetujuan sudah didapatkan, unggah ke MONKP\nStatus KP akan menjadi CONFIRMED\nDosen Pembimbing Kerja Praktik\n\nSyarat mendapatkan dosen pembimbing internal KP:\nStatus KP akan menjadi CONFIRMED\nDosen Pembimbing KP dipilih oleh koordinator KP dengan menyesuaikan load pembimbingan dosen, kecuali ada rekomendasi khusus dari dosen ybs\nPengalokasian dilakukan secara batch operation\nDi lokasi KP\n4. Melaksanakan Kerja Praktik', 'masyarakat di luar kampus, yang secara langsung bersama-sama masyarakat \nmengidentifikasi potensi dan menangani masalah sehingga diharapkan mampu \nmengembangkan potensi desa/daerah dan meramu solusi untuk masalah yang ada \ndi desa. Kegiatan KKNT diharapkan dapat mengasah softskill  kemitraan, kerjasama \ntim lintas disiplin/keilmuan (lintas kompetensi), dan leadership  mahasiswa dalam \nmengelola program pembangunan di wilayah perdesaan. Sejauh ini perguruan \ntinggi sudah menjalankan program KKNT, hanya saja Satuan Kredit Semesternya \n(SKS) belum bisa atau dapat diakui sesuai dengan program kampus merdeka yang \npengakuan kreditnya setara 6 – 12 bulan atau 20 – 40 SKS, dengan pelaksanaannya \nberdasarkan beberapa model. Diharapkan juga setelah pelaksanaan KKNT, mahasiswa \ndapat menuliskan hal-hal yang dilakukannya beserta hasilnya dalam bentuk tugas \nakhir.\nPelaksanaan KKNT dilakukan untuk mendukung kerja sama bersama Kementerian', 'Subdit. PK2\nADVANCING HUMANITY\niTS\nKebutuhan Perbaikan dan Pengembangan Platform\nProses saat ini\nPendaftaran di Platforn\nMahasiswa mendaftar ke\nMSIB/KM di platform\nMBKM\nPengisian Data dan Upload Dokumen\nMahasiswa meminta tanda tangan basah Prodi dan\nRektorat untuk SR/SPTJM dan\nupload di platform\nMahasiswa mengisi data dan upload dokumen diri\ndi platform\nMahasiswa paling banyak gugur\nVerifikasi Mahasiswa (Seleksi\nAdministrasi\nTim Program melakukan verifikasi data dan berkas mahasiswa, termasuk SR\ndan SPTJM, melalui\nplatform\nSeleksi Substansi\nPengumuman\nMahasiswa mengikuti\nproses seleksi substansi\nPengumuman hasil seleksi mahasiswa\nanjuskan Program PMM maka\nan den fasilitasi dengan Kepala Program Studi, an di PT Penerima:\nrgun perukaran mahasiswa\nan Kekerusan Seksual (PPKS)\nPMM secars luring: dan\nung mungkin tejadi selamal\nPendaftaran Kampus Mengajar\nLanokah Terakhir\n26.000+']","Mahasiswa di lokasi KP harus melaksanakan Kerja Praktik sesuai dengan surat pengantar KP yang dikeluarkan oleh departemen Teknik Informatika. Mereka juga harus mematuhi syarat-syarat yang telah ditetapkan, seperti tanggal mulai, durasi kerja praktik, dan petunjuk dari dosen pembimbing. Setelah balasan persetujuan didapatkan, mahasiswa harus mengunggahnya ke MONKP agar status KP menjadi CONFIRMED."
18,Kapan batas waktu penyerahan laporan KP?,Paling lambat 1 bulan setelah tanggal selesainya kerja praktek di perusahaan,"['Sudah menyelesaikan segala pekerjaan terkait KP di perusahaan dan sudah kembali aktif di kampus\nMenemui dosen pembimbing untuk melakukan ujian lisan dan menyerahkan Formulir Penilaian Ujian Lisan Kerja Praktik untuk diisi oleh dosen pembimbing internal\nDosen pembimbing internal mengirimkan nilai ke koordinator KP via email\nJika nilai telah diterima koordinator KP, maka status KP akan menjadi FINISHED\nMenyerahkan Laporan KP\nSudah menyelesaikan segala urusan KP dengan dosen pembimbing\nDokumentasi KP sudah disetujui dan ditandatangani oleh dosen pembimbing\nDokumentasi tersebut berupa softcopy dan diunggah ke repo ITS (lihat manual unggah ke repo ITS di manual unggah mandiri)\nMenerima Bukti Penyerahan KP dari REPO ITS\nMengunggah buku KP dan bukti terima repo ITS ke MS TEAMS KP pada link berikut:\nhttps://teams.microsoft.com/l/team/19%3a447977fe03c040ff98ad9e82e63982e2%40thread.tacv2/conversations?groupId=862aa22c-c596-49e1-94dd-6354fd625a2e&tenantId=1d5169ac-c7cb-4275-9764-bf8c9c364a4c', 'CARA DAFTAR AKUN REPOSITORY\nHOW TO REGISTER REPOSITORY ACCOUNT\n\nAccess this link: http://bit.ly/PengumpulanKP\n\nCatatan:\n\nKP dengan 2 pengarang cukup mendaftar 1 akun saja.\nLOGIN TO REPOSITORY\n\nAnda bisa login setelah akun diaktivasi oleh pustakawan, paling lama 20 menit setelah mendaftar di jam kerja (tanpa ada notifikasi melalui email).\nLogin to repository is available after the account is activated by librarian. Activation process need time around 20 minutes (work hours) without notification email.\nHubungi administrator apabila lebih dari 20 menit masih belum bisa login.\nContact the administrators (click About ITS Repository) if you are not able to login after that hours.\nPERSIAPAN / PREPARATIONS', 'Meminta persetujuan form pengajuan KP ke Koordinator Kerja Praktek (Sekretaris Departemen 1)\nMenyerahkan Form Pengajuan KP yang sudah disetujui Koord. KP kepada Staf Akademik (Pak Sugeng) untuk dibuatkan surat pengantar ke tempat KP\nSurat pengantar KP dikeluarkan oleh departemen Teknik Informatika yang ditujukan kepada organisasi tempat KP yang berisi:\nPermohonan agar mahasiswa X diijinkan untuk melakukan KP di organisasi Y,\nTanggal mulai,\nDurasi kerja praktik\nSurat pengantar KP dikirimkan ke instansi penerima KP\nJika balasan persetujuan sudah didapatkan, unggah ke MONKP\nStatus KP akan menjadi CONFIRMED\nDosen Pembimbing Kerja Praktik\n\nSyarat mendapatkan dosen pembimbing internal KP:\nStatus KP akan menjadi CONFIRMED\nDosen Pembimbing KP dipilih oleh koordinator KP dengan menyesuaikan load pembimbingan dosen, kecuali ada rekomendasi khusus dari dosen ybs\nPengalokasian dilakukan secara batch operation\nDi lokasi KP\n4. Melaksanakan Kerja Praktik', 'diperoleh mahasiswa dalam pelaksanaan KKNT. Jumlah dan bidang Mahasiswa \nyang mengikuti program ini menyesuaikan dengan kebutuhan program di desa. \nPelaksanaan KKNT Pembangunan dan Pemberdayaan Desa dilakukan selama        \n6 – 12 bulan di lokasi atau setara dengan maksimal 20 SKS. Perhitungan terhadap \ncapaian pembelajaran setara 20 SKS ini dapat disetarakan dalam beberapa mata \nkuliah yang relevan dengan kompetensi lulusan. Penilaian terhadap capaian \npembelajaran dapat diidentifikasi dari laporan dan ujian portofolio/rubrik \nkegiatan KKNT. Untuk kesesuaian dengan ketercapaian kompetensi lulusan \nmaka perlu dipersiapkan proposal/rancangan kegiatan yang dapat mewakili \nbidang keahlian. Dosen pembimbing lapangan harus mewakili program studi \npengampu mata kuliah semester akhir dari setiap program studi. Mahasiswa \njuga dapat memanfaatkan Program Holistik Pembinaan dan Pemberdayaan Desa \n(PHP2D) dengan mengikuti prosedur dari Direktorat Belmawa.']","Batas waktu penyerahan laporan KP tidak secara spesifik disebutkan dalam konteks yang diberikan. Namun, dalam proses penyelesaian Kerja Praktik, penyerahan laporan KP biasanya dilakukan setelah selesai melakukan ujian lisan dan mendapatkan nilai dari dosen pembimbing internal. Setelah semua proses terkait Kerja Praktik selesai, termasuk pengunggahan dokumentasi KP ke repo ITS dan menerima bukti penyerahan KP dari repo ITS, mahasiswa diharapkan untuk menyerahkan laporan KP sesuai dengan petunjuk yang diberikan oleh institusi atau program studi terkait. Sebaiknya, mahasiswa memperhatikan jadwal akademik dan petunjuk yang diberikan oleh koordinator KP atau pihak terkait untuk mengetahui batas waktu penyerahan laporan KP."
19,Bagaimana format nama file untuk laporan KP dengan pengarang tunggal?,NRP-Project_Report,"['MENGISI METADATA / METADATA ENTRIES\n\nMonograph Type, pilih “Project Report”\nMonograph Type, choose “Project Report”.\nCorporate Creators, diisi nama Perusahaan yang berkontribusi dalam penulisan KP.\nNIDN, diisi NIDN dosen pembimbing. Boleh dikosongkan bila tidak tahu.\nNIDN, fill it with thesis advisor ID number. Can be blank.\nMENGISI METADATA / METADATA ENTRIES\n\nIsikan nama dosen pembimbing dengan nama belakang pada kolom family name.\nFill it with Thesis Advisors name.\nPilih “Thesis Advisor” / Choose “Thesis Advisor”.\nNRP/NIM: diisi NIM [no NRP]\nNRP/NIM: NIM [student ID number].\nCreators, isikan pengarang dengan nama belakang pada kolom family name.\nCreators, fill it with creators name.\nMENGISI METADATA / METADATA ENTRIES', 'File PDF tanpa watermark. Berisi semua isi TA/Tesis/Disertasi dari cover sampai lampiran.\nPDF File without watermark. Full content from cover to Appendix.\nPastikan lembar Pengesahan sudah ditandatangani dosen pembimbing dan stempel departemen.\nInclude Approval sheet which has been signed by Thesis Advisors.\nLaporan KP dengan pengarang tunggal:\n\nNRP-Project_Report\nStudent ID Number-Project_Report\nContoh: / example: 04111060010007-Project_Report\nLaporan KP dengan 2 pengarang atau lebih:\n\nProject report with 2 authors or more\nNRP1_NRP2-Project_Report\nStudent ID Number1_ Student ID Number2-Project_Report\nContoh: / example: 04111060010007_04111060010111-Project_Report\nFormat Nama File / File Name\n\nGunakan NRP sebagai username dan password.\nUse your Student ID Number as username and password.\n123 Nama anda nampak di sini\nYour name appear here\nKlik “New item” / Click “New item”\nMANAGE DEPOSITS\n\nPilih “Monograph” / Choose “Monograph”\nKemudian klik “Next” / Then Click “Next”', '• LAMPIRAN 3: Sampul Laporan Magang\nSampul Laporan Magang berwarna biru dengan logo ITS di kiri atas. Pada sampul tercetak: Judul Laporan Magang, Nama Lengkap Mahasiswa, Asal Departemen dan Fakultas, Institut Teknologi Sepuluh Nopember, dan tahun penyelesaian.\nJenis huruf: Calibri\nUkuran huruf: 14 pt\nContoh Sampul Laporan Magang :\nLAPORAN MAGANG\n(JUDUL LAPORAN MAGANG)\n(NAMA)\n(NRP)\nDosen Pembimbing\n(Nama Dosen Pembimbing)\nDosen Pembimbing\n(Nama Dosen Pembimbing Lapangan)\n(Departemen)\n(Fakultas )\nInstitut Teknologi Sepuluh Nopember Surabaya\n2020\nBuku Petunjuk Teknis Magang\n65\n\n• LAMPIRAN 4 : Form Penilaian Magang (Dosen Pembimbing)\nLEMBAR PENILAIAN KINERJA MAGANG\nSemester Magang :..... Tahun Akademik 20.../20...\nNama Mahasiswa\nNRP\nDepartemen\nNama Dosen Pembimbing\nNama Perusahaan Mitra Magang\nWaktu Pelaksanaan Magang\nNama Proyek/ Kegiatan Magang\nNO\nASPEK YANG DINILAI\nBOBOT (B)\nNILAI (N)\n(0-100)\nJUMLAH\n(B XN)\n1\nKehadiran\n10\n\n\n2\nKesungguhan melaksanakan Kerja Praktek\n15', '7.2\nKETENTUAN UMUM DALAM PENULISAN\nLAPORAN MAGANG\n• Laporan Magang ditulis dan dipresentasikan pada akhir magang (jika diperlukan).\n• Laporan Magang selain diserahkan ke departemen dan mitra magang, juga diserahkan ke Subdirektorat PK2 Direktorat Kemahasiswaan dalam bentuk softcopy melalui SIM Magang.\n7.3\nPRINSIP PENULISAN LAPORAN\nMAGANG\n• BENAR DAN OBYEKTIF\nLaporan magang harus sesuai dengan ketentuan yang ada dalam pedoman ini serta memuat informasi yang benar dan obyektif.\n• JELAS DAN CERMAT\nLaporan magang harus mudah dimengerti / dipahami oleh pembaca, dengan cara menghindari pemakaian kata / istilah, rangkaian kata / kalimat atau gaya bahasa yang kurang dapat dipahami oleh pembaca maupun penulisnya sendiri. Gunakan kata-kata yang sederhana tetapi jelas maksudnya.\n• LANGSUNG KE SASARAN']",Format nama file untuk laporan KP dengan pengarang tunggal adalah NRP-Project_Report. Contoh: 04111060010007-Project_Report.
