,question,ground_truth,contexts,answer
0,Apa visi ITS?,Menjadi perguruan tinggi dengan reputasi internasional dalam ilmu pengetahuan dan teknologi terutama yang menunjang industri dan kelautan yang berwawasan lingkungan.,"['PENGALAMAN TENTANG KEBUDAYAAN DAERAH LAIN\nMELALUI MODUL NUSANTARA\nSelain mengikuti pembelajaran mata kuliah di perguruan tinggi penerima, mahasiswa yang mengikuti program Pertukaran Mahasiswa Merdeka juga akan mendapatkan pengalaman langsung berinteraksi dengan mahasiswa dari daerah lain dan mempelajari kebudayaan daerah lain melalui Modul Nusantara. Modul Nusantara ini senilai 2 sks dan wajib diambil oleh mahasiswa peserta program Pertukaran Mahasiswa Merdeka. Modul Nusantara dilaksanakan di perguruan tinggi penerima. Modul Nusantara dibagi ke dalam empat jenis kegiatan yaitu kebinekaan, inspirasi, refleksi, dan kontribusi sosial. Dalam pelaksanaan Modul Nusantara, mahasiswa akan dibimbing oleh dosen pembimbing modul nusantara dan dibantu oleh mentor.\nBAGAIMANA MEKANISME PELAKSANAAN PERTUKARAN\nMAHASISWA MERDEKA?\nTerdapat dua mekanisme, yaitu:', 'MSIB\nKampus\nMerdea\nINDONESIA JAYA\nDipercaya oleh Perusahaan dari Dalam dan Luar Negeri\nBPIS Kesehatan @ gojek\nBadan Penyelenggara Jaminan Sosial\nC• Pegadaian\nMencatasi Masalan Tanoa Masalan\nYAYASAN\nANAK\nBANGSA\nBISA\nS\nShopee\ntiket\ncom\nB\nruang guru\nBANK INDONESIA\nBANK SENTRAL REPUBLIK INDONESIA\nTelkom Indonesia O\nthe world in your hand\n• CIMB NIAGA\n• xL axiata\n•STECHOO\nBERKARYA UNTUK BANGSA\nGrab\nNET.\nY PARAGON\nTECHNOLOGY AND INNOVATION\nStartup\nCampus\nDanamon\nA member of © MUFG, a global financial group\n2PUPR\nSIGAP MEMBANGUN NEGERI\nB BANK BRI\nBNI\ntraveloka*\n• Lazada mandiri\nVidio\nKEMKOMINFO\nAlfamidi\nTOWER\nBERSAMA\nGROUP\nSchlumberger\nIndomaret\n) ВСА\nWhalodoc\nsimplifying healthcare\ntokopedia\n9\nPR\nBADAN POM\nBSI\nBANK SYARIAHI\nINDONESIA\nGROUP\nSCM\nSkilvul\nPLN\nKOMPAS GRAMEDIA\nDan masih banyak lagi...', 'ERICHA VALENTINA\n5015201016\nS1 Perencanaan Wilayah d Vely Kukinul Siswanto\n\n\nFALDI FAKHRI\n5015201128\nS1 Perencanaan Wilayah d I Dewa Made Frendika S\n\nKK\nTerdapat inkonsistensi data / data yang belum diisi pada registras\nTerdapat laporan mingguan dengan foto aktivitas yang belum diis\nTerdapat laporan mingguan dengan foto aktivitas yang belum diis\nTerdapat laporan mingguan dengan foto aktivitas yang belum diis\nTerdapat laporan mingguan dengan foto aktivitas yang belum diis\nTerdapat laporan mingguan dengan foto aktivitas yang belum diis\nTerdapat laporan mingguan dengan foto aktivitas yang belum diis -\nits.id/ListSIMMagang\n+\nMix\nGenap 22/23\nGasal 23/24\nKementerian Pendidikan, Kebudayaan, Riset dan\nTeknologi\n\nSubdit. PK2\nADVANCING HUMANITY\niTS\nh\n4\nOverview MSIB 6\nd\n2023', 'MERDEKA BELAJAR – KAMPUS MERDEKA (MB-KM) DI INSTITUT TEKNOLOGI SEPULUH NOPEMBER\nDisampaikan di IPITS 2020\nINSTITUT TEKNOLOGI SEPULUH NOPEMBER, Surabaya - Indonesia\n\nMERDEKA BELAJAR DAN KAMPUS MERDEKA (MB-KM)\nOutline:\n\nPENDAHULUAN\nDASAR HUKUM MB-KM\nKEGIATAN MB-KM DI ITS\nTERIMA KASIH\nPENDAHULUAN\n\nTantangan Abad 21\nSosialisasi Program MB-KM, Ditjen Dikti, 2020\nKampus Merdeka\n\nHak Belajar 3 Semester di Luar Program Studi (Prodi)\nPermendikbud Nomor 3 Tahun 2020 tentang Standar Nasional Pendidikan Tinggi\n\nMahasiswa memiliki kesempatan untuk:\n\nSatu semester atau setara dengan 20 SKS menempuh pembelajaran di luar program studi pada perguruan tinggi yang sama.\nPaling lama dua semester atau setara dengan 40 SKS menempuh pembelajaran pada:\nProgram studi yang sama di perguruan tinggi yang berbeda\nProgram studi yang berbeda di perguruan tinggi yang berbeda\nDi luar perguruan tinggi\nDASAR HUKUM MB-KM']",Saya tidak tahu.
1,Apa itu Body of Knowledge?,"Istilah yang digunakan untuk mewakili secara lengkap konsep, istilah, dan aktivitas yang membentuk kemampuan profesional, yang didefinisikan oleh masyarakat terpelajar atau asosiasi profesional yang relevan.","['terlibat di dalam pro ses dan hasil pelaksanaan MBKM.  \n(2). SOP yang diterbitkan oleh: (a) Direktorat terkait sebagai koordinator pelaksana \nmasing -masing bentuk MBKM, (b) Prodi sebagai pelaksana MBKM  untuk memandu \ndosen, mahasiswa dan tenaga kependidikan yang terlibat di dalam proses dan hasil \npelaksanaan MBKM.  \nDokumen (1) dan (2) di atas, merupakan manual untuk seluruh stakeholder yang terlibat \ndi dalam implementasi MBKM, yang dapat disusun dalam satu dokumen atau lebih secara \nterpisah. Rambu -rambu dalam penyusunan ke dua dokumen di atas, dengan ketentuan \nmemuat unsur -unsur sebagai berikut, dan dapat dikembangkan sesuai dengan kebutuhan \ndan tujuan pelaksanaan MBKM.  \n1. Tujuan dan ma ksud Manual MBKM  \n2. Luas lingkup Manual MBKM  \na. Manual Penetapan standar  \nb. Manual pelaksanaan standar  \nc. Manual evaluasi standar  \nd. Manual pengendalian pelaksnanaan standar  \ne. Manual peningkatan standar  \n3. Rincian tentang hal yang harus dikerjakan', '27. Mata Kuliah Penciri ITS adalah mata kuliah yang terdiri dari Bahasa Inggris, Teknopreneur, dan Wawasan dan Aplikasi Teknologi.\r\n28. Kuliah Kerja Nyata Tematik yang selanjutnya disingkat KKNT adalah suatu bentuk pendidikan dengan cara memberikan pengalaman belajar kepada mahasiswa untuk hidup di tengah masyarakat di luar kampus, yang secara langsung bersama-sama masyarakat mengidentifikasi potensi dan menangani masalah sehingga diharapkan mampu mengembangkan potensi desa/daerah dan meramu solusi untuk masalah yang ada di desa.\r\n\r\n        BAB II MAKSUD DAN TUJUAN\r\n\r\nPasal 2\r\n(1) Maksud diterbitkannya Peraturan Rektor ini adalah untuk memberikan pedoman dalam menyelenggarakan kegiatan Merdeka Belajar - Kampus Merdeka (MB - KM) di lingkungan ITS.\r\n(2) Tujuan diterbitkannya Peraturan Rektor ini adalah untuk mewujudkan kegiatan pembelajaran yang dapat menghasilkan lulusan yang berkualitas dan memenuhi visi, misi, tata nilai dan tujuan ITS serta memenuhi SN-DIKTI.\r\n\r\nBAB III', '(8) Mekanisme dan penyelenggaraan kegiatan asistensi mengajar di satuan pendidikan dikembangkan dan dikoordinasikan oleh Direktorat yang mengurusi kemahasiswaan.\r\n(9) Direktorat yang mengurusi kemahasiswaan dalam menyelenggarakan kegiatan asistensi mengajar di satuan pendidikan sebagaimana dimaksud pada ayat (8) berkoordinasi dengan Program Studi terkait.\r\n\r\nBagian Kesembilan\r\nMagang/ Praktik Kerja dan Kegiatan Wirausaha Lingkup Hilirisasi\r\n\r\nPasal 14\r\n(1) Kegiatan magang/ praktik kerja dan kegiatan wirausaha hilirisasi ditujukan untuk memperlancar karir lulusan, pengayaan kompetensi mahasiswa, kolaborasi magang, wirausaha dan kerja sama pengembangan produk inovatif.\r\n(2) Bentuk kegiatan magang/ praktik kerja dan kegiatan wirausaha hilirisasi dapat berupa kegiatan penelitian dan pengabdian masyarakat bersama civitas akademika yang lain untuk memecahkan persoalan di masyarakat atau industri, inkubasi dan start-up.', '(3) Mekanisme dan penyelenggaraan kegiatan magang/ praktik kerja dan kegiatan wirausaha hilirisasi dikembangkan dan dikoordinasikan oleh Direktorat yang mengurusi inovasi dan kawasan sains teknologi bekerjasama dengan Direktorat yang mengurusi kemahasiswaan.\r\n\r\n(4) Direktorat yang mengurusi inovasi dan kawasan sains teknologi dalam menyelenggarakan kegiatan Magang/ Praktik Kerja dan Kegiatan Wirausaha Hilirisasi sebagaimana dimaksud pada ayat (3) berkoordinasi dengan Program Studi terkait.\r\n\r\nPasal 15\r\n(1) Dalam penyelenggaraan kegiatan MB - KM di ITS, dilaksanakan oleh Tim MB-KM ITS.\r\n(2) Tim MB-KM ITS berperan dalam memfasilitasi implementasi kegiatan MB-KM di ITS meliputi membuat prosedur operasional baku, dokumen teknis, penjaminan mutu, sistem aplikasi dan hal lainnya yang mendukung penyelenggaraan kegiatan MB-KM di ITS.\r\n(3) Tim MB-KM ITS ditetapkan melalui Keputusan Rektor.\r\n\r\n        BAB V KETENTUAN PENUTUP\r\n\r\nPasal 16']","Body of Knowledge (BoK) adalah kumpulan pengetahuan dan informasi yang terstruktur dan terorganisir mengenai suatu bidang atau disiplin ilmu tertentu. BoK biasanya mencakup konsep, prinsip, metode, dan praktik terbaik yang diterima dalam bidang tersebut, serta dapat digunakan sebagai panduan atau referensi bagi para profesional yang terlibat dalam bidang tersebut."
2,Apa itu CPL?,Capaian Pembelajaran Lulusan,"['16. Tahap Persiapan adalah tahap pembelajaran yang dijadwalkan dalam dua semester pertama pada kurikulum Program Sarjana atau dua paket semester pertama pada kurikulum Program Sarjana Terapan.\r\n17. Standar kompetensi lulusan adalah kriteria minimal tentang kualifikasi kemampuan lulusan yang mencakup sikap, pengetahuan, dan keterampilan yang dinyatakan dalam rumusan capaian pembelajaran lulusan.\r\n\r\n18. Capaian Pembelajaran Lulusan yang selanjutnya disingkat CPL adalah kriteria minimal tentang kualifikasi kemampuan lulusan yang mencakup sikap, pengetahuan, dan keterampilan yang dinyatakan dalam rumusan capaian pembelajaran lulusan.\r\n19. Capaian Pembelajaran Mata Kuliah yang selanjutnya disingkat CPMK adalah capaian pembelajaran lulusan yang dibebankan ke mata kuliah.\r\n20. Sistem Kredit Semester yang selanjutnya disingkat SKS adalah suatu sistem penyelenggaraan pendidikan dengan menggunakan sks.', 'Subdit. PK2\nADVANCING HUMANITY\niTS\nh\nf°\nPENDAHULUAN\nd\n2023\n\nSubdit. PK2\nADVANCING HUMANITY\niTS\nWebsite Resmi ITS Career Center (Subdit. PK2 ITS)\nITS CAREER CENTER\nREKTORAT\nSubdirektorat Pengembangan Kewirausahaan dan Kartr\nMagang Industri\nProgram Magang adalah suatu kegiatan dari mahasiswa untuk menerapkan dan memperoleh pengetahuan, keterampilan umum dan khusus / keahlian kerja, serta internalisasi sikap profesional dan budaya kerja yang sesuai dan diperlukan bagi dunia usaha. Program Magang di lingkungan ITS ini dikelola oleh Subdit Pengembangan Kewirausahaan dan Karir (PK2) di bawah koordinasi Direktorat Kemahasiswaan ITS.\nLowongan Magang\nSkema Program Magang di ITS\nhttps://www.its.ac.id/careers/id/\nmagang\nMAGANG FLAGSHIP\nSelengkapnya\nMAGANG KERJASAMA\nMAGANG MANDIRI\nSTUDI INDEPENDEN\nSelengkapnya\nSelengkapnya\nSelengkapnya\n2023', 'Tabel 2.1 Standar dalam penyelenggaraan MB -KM di   ITS \nNO ELEMEN PENILAIAN  INDIKATOR  \n(1) (2) (3) \nI STANDAR KOMPETENSI LULUSAN  \n1 Standar Kompetensi Lulusan  (i) Pelaksanaan MBKM mengacu pada CPL Prodi sebagai target dari kemampuan lulusan, \ndengan minimal pencapaian 80%  CPL dan atau sebagai kompetensi tambahan  \n(ii) Kompetensi tambahan dimaksudkan untuk memperlancar karir lulusan, kolaborasi riset \ndan atau kerja sama p engembangan industri.  \nII STANDAR ISI PEMBELAJARAN  \n2 Standar Isi  – MK Pengayaan  (i) Prodi menyediakan kurikulum untuk pelaksanaan MBKM yang disusun bersama \npemangku kepentingan internal dan eksternal, serta direview oleh pakar bidang ilmu \nprogram studi nya.  \n(ii) Keterjaminan pemenuhan CPL  melalui MBKM ( ketersediaan matrik / peta CPL - MK \nMBKM ), dan ketersediaan modul MK melalui pembelajaran  untuk MK yang \ndilaksanakan secara MBKM', 'Peraturan Menteri Keuangan (PMK) 2019 tentang insentif pajak bidang vokasi & penelitian dan pengembangan memberikan pengurangan penghitungan penghasilan bruto maksimal 200% dari biaya yang dikeluarkan untuk kegiatan praktik kerja, pemagangan, dan pembelajaran.\nPROGRAM MAGANG WAJIB untuk BUMN\nProgram Magang Mahasiswa Bersertifikat (PMMB) dengan 9000 lowongan posisi magang di 142 BUMN diperebutkan oleh 3.500 PTN/PTS seluruh Indonesia. Uang saku: Rp 1,6 – 2 juta/bulan. Sertifikat Industri &/Sertifikat Kompetensi.\n\nManfaat Magang bagi Perusahaan & Departemen']","CPL adalah singkatan dari Capaian Pembelajaran Lulusan. CPL merupakan kriteria minimal tentang kualifikasi kemampuan lulusan yang mencakup sikap, pengetahuan, dan keterampilan yang dinyatakan dalam rumusan capaian pembelajaran lulusan."
3,Berapa jam kerja magang yang setara dengan 1 SKS?,1 SKS = 2.720 menit magang atau 45 jam,"['KERJA PRAKTIK\nDepartemen Teknik Informatika ITS\n\nSekilas Kerja Praktik\n\nJumlah kredit Mata Kuliah KP: 2 SKS\nSKS KP diambil bersamaan / setelah menyelesaikan KP di organisasi (perusahaan, instansi, yayasan)\nLama KP: 1-2 bulan dengan hitungan kerja part time\nBisa perorangan atau berkelompok maksimal 2 (dua) mahasiswa\nBerkas-berkas KP bisa didapatkan di link resource akademik:\nhttps://intip.in/ResourceAkademikDanKemahasiswaanIF\nProsedur Kerja Praktik\n\nMengajukan KP\nSurat Pengantar KP\nDosen Pembimbing KP\nPelaksanaan KP\nPenilaian KP oleh Pembimbing Lapangan\nPenilaian KP oleh Dosen Pembimbing\nPenyerahan Laporan KP ke RBTC\nMengumpulkan bukti penyelesaian KP\nLulus KP\nSebelum berangkat KP\n\nMengajukan KP\n\nMemenuhi persyaratan sebagai berikut:\nMahasiswa aktif Teknik Informatika\nSKS tempuh minimum 90 SKS\nMengisi MONKP:\nmonkp.if.its.ac.id (registrasi akun dan data KP)\nStatus KP akan menjadi CREATED\nSurat Pengantar Kerja Praktik', 'NO ELEMEN PENILAIAN  INDIKATOR  \n(1) (2) (3) \natau kombinasi keduanya  \n6 Standar Proses – Tempat \npelaksanaan MBKM  Tempat k egiatan MB – KM dapat dilaksanakan di luar Program Studi baik yang ada di internal \nITS maupun di luar ITS . \n7 Standar Proses –  \nLama waktu pelaksanaan \nMBKM  Lama waktu pelaksanaan MBKM, dapat dikonvesi ke MK, dengan syarat:  \ni. Lama kegiatan belajar dapat dikonversi ke dalam sks adalah minimal 2720 menit atau \n45.3 jam.  \nii. Lama kegiatan bentuk MBKM dihitung atas waktu untuk:  (a) persiapan  di tempat \nMBKM , (b) pelaksanaan, (c) penilaian, dan  (d)  pelaporan.  \niii. Lama waktu kegiatan MB -KM bentuk magang, minimal 3 bulan dan maksimal 6 bulan.  \n8 Standar Proses –  \nKegiatan akademik selama  \nMBKM  – bentuk magang  (i) Mahasiswa yang melaksakan magang harus bekerja di lapangan secara penuh waktu \nsesuai dengan kesepakata n tempat magang;  \n(ii) Mahasiswa yang melaksanakan magang dapat melakukan kegiatan praktek / kolaborasi', 'diperoleh mahasiswa dalam pelaksanaan KKNT. Jumlah dan bidang Mahasiswa \nyang mengikuti program ini menyesuaikan dengan kebutuhan program di desa. \nPelaksanaan KKNT Pembangunan dan Pemberdayaan Desa dilakukan selama        \n6 – 12 bulan di lokasi atau setara dengan maksimal 20 SKS. Perhitungan terhadap \ncapaian pembelajaran setara 20 SKS ini dapat disetarakan dalam beberapa mata \nkuliah yang relevan dengan kompetensi lulusan. Penilaian terhadap capaian \npembelajaran dapat diidentifikasi dari laporan dan ujian portofolio/rubrik \nkegiatan KKNT. Untuk kesesuaian dengan ketercapaian kompetensi lulusan \nmaka perlu dipersiapkan proposal/rancangan kegiatan yang dapat mewakili \nbidang keahlian. Dosen pembimbing lapangan harus mewakili program studi \npengampu mata kuliah semester akhir dari setiap program studi. Mahasiswa \njuga dapat memanfaatkan Program Holistik Pembinaan dan Pemberdayaan Desa \n(PHP2D) dengan mengikuti prosedur dari Direktorat Belmawa.', 'yang setara.  \n(iv) Kegiatan MBKM dalam bentuk KKN dilaksanakan pada semester 6 (enam) dan 7 (tujuh)  \natau sebelum nya dengan syarat telah lulus tahap persiapan.  \n(v) Kegiatan MBKM dalam bentuk KKN yang dilaksanakan sebelum semester 6 (enam) dan \n7 (tujuh) dan s udah lulus tahap persiapan , diakui sebagai MBKM dengan sistem tabung \nnilai.  \n(vi) Kegiatan MBKM dalam bentuk KKN  dikembangkan oleh Direktorat yang mengurusi riset \ndan pengabdian kepada masyarakat . \n(vii) Implementasi MBKM dalam bentuk  KKN  dikoordinir oleh Direktorat yang m engurusi  \npengabdian kepada masyarakat bersama  Prodi  terkait , melalui tahapan kegiatan (a) \npersiapan, (b) Pelaksanaan, (c) Evaluasi, (d) Pengendalian, dan (e) Peningkatan . \n \n10 Standar Proses –  \nKegiatan MBKM – bentuk \nPertukaran Pelajar  (i) Kegiatan MBKM dalam bentuk pertukaran pelajar  dimaksudkan untuk mencapai CPL .  \n(ii) Kegiatan MBKM dalam bentuk pertukaran pelajar  dapat dilakukan dengan PT di dalam \nnegeri atau di luar negeri.']",Lama waktu kerja magang yang setara dengan 1 SKS adalah minimal 2720 menit atau 45.3 jam.
4,Apa durasi maksimal magang menurut peraturan rektor?,Maksimal 6 bulan,"['Panduan Umum Magang\n\nDurasi magang maksimal 6 bulan\nWajib dibimbing oleh dosen pembimbing internal (dosen ITS) dan pembimbing eksternal (pihak industri)\nMahasiswa bisa mendapatkan izin untuk melakukan kegiatan tertentu (sesuai kesepakatan)\nPada saat magang, mahasiswa tidak harus cuti\nIndustri dapat menawarkan pemberian sertifikat kompetensi dengan syarat dan ketentuan tertentu\nSebelum magang, akan ada nota kesepahaman dan perjanjian kerja sama\nKerja Praktek\n\nSatu atau beberapa MK yang memiliki capaian pembelajaran setara dengan kegiatan magang (disarankan lebih ke MK pilihan)\nGabungan kerja praktek dan satu atau beberapa MK yang memiliki capaian pembelajaran setara dengan kegiatan magang\nMK pilihan magang (diupayakan masuk dalam kurikulum)\nKonversi Magang\n\nMengambil beberapa MK (perkuliahan secara online)\nPenguatan Program Magang di ITS', '6.1\nKRITERIA DOSEN PEMBIMBING MAGANG\nW888\nDosen yang telah mengajar selama 4 semester berturut-turut.\nMemperoleh SK Pembimbing Magang dari Departemen dan ketetapan melalui\nKeputusan Dekan.\n6.2\nRINCIAN TUGAS DOSEN PEMBIMBING\nMAGANG\n• Memberikan saran dan masukan saat konsultasi keilmuan jika diperlukan oleh mahasiswa selama magang.\n• Melakukan kegiatan pembimbingan bagi mahasiswa magang untuk dapat berkonsultasi selama magang atau bimbingan penulisan laporan magang.\n• Memberikan persetujuan dan penilaian Laporan Magang.\n• Memberikan penilaian dapat dilakukan dalam bentuk penilaian laporan magang dan atau presentasi kegiatan magang.\n40\n06 Pembimbingan Magang', 'Pasal 4\n Mahasiswa     dalam pelaksanaan magang harus        memenuhi ketentuan\n sebagai berikut:\n a. Magang memiliki durasi minimal 3 bulan sampai maksimal 6 bulan\n     dalam 1 periode;\n b. mahasiswa wajib dibimbing oleh pembimbing internal dari dosen ITS\n     dan pembimbing eksternal dari pihak industri;\n c. selama magang mahasiswa secara penuh waktu bekerja di lapangan\n     sesuai kesepakatan;\n d. mahasiswa dapat mendapatkan ijin untuk melakukan kegiatan\n     akademik tertentu, melalui pembicaraan dan kesepakatan dengan\n     pihak industri;\n e. pada waktu pelaksanaan magang, mahasiswa tidak harus cuti;\n f. industri yang menawarkan magang dapat memberikan sertifikat\n     kompetensi dengan syarat dan ketentuan tertentu; dan\n g. sebelum    kegiatan     magang    dilaksanakan    harus   ada   nota\n     kesepahaman dan perjanjian kerja sama.\n\n\n                                  Pasal II\nPeraturan Rektor ini mulai berlaku pada tanggal ditetapkan.', '9.2\nETIKA BERKOMUNIKASI DENGAN\nDOSEN PEMBIMBING\n• Komunikasi dengan dosen pembimbing dilakukan dengan mengacu pada norma yang berlaku umum.\nDosen Pembimbing last seen today at 13:25\nSelamat pagi Bu, saya Rosyi, mahasiswa S1 PerencanaanWilayah\ndan Kota semester 7. Maaf bu, saya maumenanyakan\napakah besok Ibu ada waktu untuk bimbingan tugas\nkarya akhir? Terima Kasih\n7:20 AM J/\nSelamat siang Rosyi, hari Kamis pukul 10.00 WIB ya. Tolong ingatkan kembali.\n1:18 PM\nBaik bu, Terima Kasih\nHARI INI\n1:20 PM J/\nSelamat Pagi Bu, Saya Rosyi, maaf apakah saya jadi bimbingan hari ini pukul 10? Terima Kasih\n7:25 AM J/\n• Gunakan Bahasa Indonesia yang baik dan benar (bukan bahasa gaul). Pesan terdiri dari : salam, identitas, keperluan, dan ucapan terimakasih.\n• Pesan dimulai dengan salam/sapaan tanpa disingkat.\n• Mahasiswa harus menuliskan identitanya saat mengirim pesan kepada dosen.\n• Menuliskan pesan dengan singkat dan jelas.\n• Akhiri dengan ucapan terimakasih.\nJadi, temui saya di ruangan ya.']",Durasi maksimal magang menurut peraturan rektor adalah 6 bulan.
5,Apa itu MB-KM di ITS?,Merdeka Belajar - Kampus Merdeka di Institut Teknologi Sepuluh Nopember,"['MERDEKA BELAJAR – KAMPUS MERDEKA (MB-KM) DI INSTITUT TEKNOLOGI SEPULUH NOPEMBER\nDisampaikan di IPITS 2020\nINSTITUT TEKNOLOGI SEPULUH NOPEMBER, Surabaya - Indonesia\n\nMERDEKA BELAJAR DAN KAMPUS MERDEKA (MB-KM)\nOutline:\n\nPENDAHULUAN\nDASAR HUKUM MB-KM\nKEGIATAN MB-KM DI ITS\nTERIMA KASIH\nPENDAHULUAN\n\nTantangan Abad 21\nSosialisasi Program MB-KM, Ditjen Dikti, 2020\nKampus Merdeka\n\nHak Belajar 3 Semester di Luar Program Studi (Prodi)\nPermendikbud Nomor 3 Tahun 2020 tentang Standar Nasional Pendidikan Tinggi\n\nMahasiswa memiliki kesempatan untuk:\n\nSatu semester atau setara dengan 20 SKS menempuh pembelajaran di luar program studi pada perguruan tinggi yang sama.\nPaling lama dua semester atau setara dengan 40 SKS menempuh pembelajaran pada:\nProgram studi yang sama di perguruan tinggi yang berbeda\nProgram studi yang berbeda di perguruan tinggi yang berbeda\nDi luar perguruan tinggi\nDASAR HUKUM MB-KM', 'BAB III\r\nRUANG LINGKUP KEGIATAN\r\n\r\nPasal 3\r\n(1) Kegiatan MB - KM merupakan proses pembelajaran yang dilaksanakan di luar Program Studi baik yang ada di internal ITS maupun di luar ITS yang terdiri atas:\r\na. pembelajaran dalam Program Studi lain di internal ITS;\r\n\r\nb. pembelajaran dalam Program Studi yang sama pada Perguruan Tinggi di luar ITS;\r\nc. pembelajaran dalam Program Studi lain pada Perguruan Tinggi di luar ITS; dan\r\nd. pembelajaran pada lembaga non Perguruan Tinggi.\r\n(2) Ruang lingkup kegiatan MB - KM adalah 8 (delapan) bentuk kegiatan pembelajaran (BKP) yang meliputi:\r\na. Magang/ Praktik Kerja;\r\nb. Membangun Desa/ Kuliah Kerja Nyata Tematik;\r\nc. Pertukaran Pelajar;\r\nd. Proyek Kemanusiaan;\r\ne. Penelitian/ Riset;\r\nf. Kegiatan Wirausaha;\r\ng. Studi/ Proyek Independen; dan\r\nh. Asistensi Mengajar di Satuan Pendidikan.\r\n(3) Dalam hal ada penambahan dan atau perubahan BKP MBKM sebagaimana dimaksud pada ayat (2) ditetapkan melalui Keputusan Rektor.', 'NO ELEMEN PENILAIAN  INDIKATOR  \n(1) (2) (3) \natau kombinasi keduanya  \n6 Standar Proses – Tempat \npelaksanaan MBKM  Tempat k egiatan MB – KM dapat dilaksanakan di luar Program Studi baik yang ada di internal \nITS maupun di luar ITS . \n7 Standar Proses –  \nLama waktu pelaksanaan \nMBKM  Lama waktu pelaksanaan MBKM, dapat dikonvesi ke MK, dengan syarat:  \ni. Lama kegiatan belajar dapat dikonversi ke dalam sks adalah minimal 2720 menit atau \n45.3 jam.  \nii. Lama kegiatan bentuk MBKM dihitung atas waktu untuk:  (a) persiapan  di tempat \nMBKM , (b) pelaksanaan, (c) penilaian, dan  (d)  pelaporan.  \niii. Lama waktu kegiatan MB -KM bentuk magang, minimal 3 bulan dan maksimal 6 bulan.  \n8 Standar Proses –  \nKegiatan akademik selama  \nMBKM  – bentuk magang  (i) Mahasiswa yang melaksakan magang harus bekerja di lapangan secara penuh waktu \nsesuai dengan kesepakata n tempat magang;  \n(ii) Mahasiswa yang melaksanakan magang dapat melakukan kegiatan praktek / kolaborasi', '13. Merdeka Belajar - Kampus Merdeka yang selanjutnya disingkat MB - KM adalah kebijakan Menteri Pendidikan dan Kebudayaan, yang bertujuan mendorong mahasiswa untuk menguasai berbagai keilmuan yang berguna untuk memasuki dunia kerja dengan memberikan kesempatan bagi mahasiswa untuk memilih mata kuliah yang akan mereka ambil.\r\n14. Kurikulum ITS adalah seperangkat rencana dan pengaturan mengenai capaian pembelajaran lulusan, bahan kajian, proses, dan penilaian yang digunakan sebagai pedoman penyelenggaraan program studi di ITS.\r\n15. Pembelajaran adalah proses interaksi mahasiswa dengan dosen dan sumber belajar pada suatu lingkungan belajar.\r\n16. Tahap Persiapan adalah tahap pembelajaran yang dijadwalkan dalam dua semester pertama pada kurikulum Program Sarjana atau dua paket semester pertama pada kurikulum Program Sarjana Terapan.']",MB-KM di ITS merupakan singkatan dari Merdeka Belajar - Kampus Merdeka. Ini adalah kebijakan yang bertujuan untuk mendorong mahasiswa untuk menguasai berbagai keilmuan yang berguna untuk memasuki dunia kerja dengan memberikan kesempatan bagi mahasiswa untuk memilih mata kuliah yang akan mereka ambil.
6,Apa saja bentuk kegiatan pembelajaran yang termasuk dalam MB-KM?,"Magang/Praktik Kerja, Membangun Desa/Kuliah Kerja Nyata Tematik, Pertukaran Pelajar, Proyek Kemanusiaan, Penelitian/Riset, Kegiatan Wirausaha, Studi/Proyek Independen, dan Asistensi Mengajar di Satuan Pendidikan.","['dan menengah ,   \n(iii) Kegiatan MBKM dalam bentuk asistensi mengajar di satuan pendidikan , merupakan \nkegiatan dalam bentuk: bantuan mengajar, tutorial, bimbingan teknis, pelatihan dan \nkegiatan lainnya yang relevan  dengan kegiatan akademik di satuan pendidikan tersebut.  \n(iv) Kegiatan MBKM dalam bentuk asistensi mengajar  dapat dikonversi ke dalam sks MK  \natau bentuk lain sesuai dengan ketercapaian CPL serta lama waktu proses kegiatan  \n(v) Kegiatan MBKM dalam bentuk asistensi mengajar dikembangkan oleh Direktorat yang 13 Dokumen Panduan Baku Mutu Pelaksanaan MBKM - 2021  \n NO ELEMEN PENILAIAN  INDIKATOR  \n(1) (2) (3) \nmengurusi kemahasiswaan.  \n(vi) Implementasi kegiatan MBKM  dalam bentuk asistensi mengajar  dikoordinasi oleh \nDirektorat yang mengurusi Kemahasiswaan bersama Prodi terkait , melalui tahapan  \nkegiatan (a) persiapan, (b) Pelaksanaa n, (c) Evaluasi, (d) Pengendalian, dan (e) \nPeningkatan  \n Standar Proses –  \nKegiatan MBKM – Bentuk \nMagang / Praktik Kerja dan', '(4) Kegiatan MBKM – dalam bentuk pertukaran pelajar melalui MK di prodi di luar ITS, \ndengan ketentuan jumlah sks maksimal adalah 20 (dua puluh) sks, yang meliputi mata \nkuliah inti dan mata kuliah non inti.  \nIII STANDAR PROSES PEMBELAJARAN  \n5 Standar Proses –bentuk \npembelajaran MBKM  (i) Mahasiswa dapat melaksanakan kegiatan pembelajaran MBKM dalam rangka meraih CPL \nProdi dalam bentuk satu atau lebih bentuk berikut ini:  \na. Magang/ Praktik Kerja;  \nb. Membangun Desa/ Kuliah Kerja Nyata Tematik;  \nc. Pertukaran Pelajar;  \nd. Proyek Kemanusiaan;  \ne. Penelitian/ Riset;  \nf. Kegiatan Wirausaha;  \ng. Studi/ Proyek Independen; dan  \nh. Asistensi Mengajar di Satuan Pendidikan  \n(ii)  Pelaksanaan MB -KM bentuk (a) sd (h) dapat dilaksanakan dalam bentuk  online, offline 8 Dokumen Panduan Baku Mutu Pelaksanaan MBKM - 2021  \n NO ELEMEN PENILAIAN  INDIKATOR  \n(1) (2) (3) \natau kombinasi keduanya  \n6 Standar Proses – Tempat', 'meningkatkan prestasi mahasiswa dalam ajang nasional dan internasional.  \n(iii) Kegiatan  MBKM dalam bentuk Studi/ Proyek Independen adalah semua kegiatan untuk  \npenerapan saintek dalam rangka menghasilkan inovasi terdepan (frontie r).  12 Dokumen Panduan Baku Mutu Pelaksanaan MBKM - 2021  \n NO ELEMEN PENILAIAN  INDIKATOR  \n(1) (2) (3) \n(iv) Kegiatan  MBKM dalam bentuk Studi/ Proyek Independen dapat berupa lomba - lomba \nkemahasiswaan atau proyek - proyek untuk memecahkan persoalan di ITS, di \nmasyarakat atau industri.  \n(v) Kegiatan MBKM dalam bentuk  Studi/ Proyek Independen  dapat dikonversika n ke dalam \nsks MK  atau bentuk lain sesuai dengan ketercapaian CPL serta lama waktu proses \nkegiatan.  \n(vi) Kegiatan MBKM dalam bentuk  Studi/ Proyek dikembangkan oleh Direktorat yang \nmengurusi Kemahasiswaan.  \n(vii) Implementasi  Kegiatan MBKM dalam bentuk  Studi/  Proyek  dikoordinir oleh  Direktorat \nyang mengurusi kemahasiswaan  bersama Prodi terkait , melalui tahapan  kegiatan (a)', 'kegiatan (a) persiapan, (b) Pelaksanaa n, (c) Evaluasi, (d) Pengendalian, dan (e) \nPeningkatan  \n Standar Proses –  \nKegiatan MBKM – Bentuk \nMagang / Praktik Kerja dan \nWirausaha lingkup Hilirisasi  (i) Kegiatan MBKM dalam bentuk Magang/ Praktik Kerja dan Kegiatan Wirausaha Lingkup \nHilirisasi ditujukan untuk  memperlancar karir lulusan, pengayaan kompetensi \nmahasiswa, kolaborasi magang, wirausaha dan kerja sama pengembangan produk \ninovatif  dalam rangka meraih profil lulusan sebagai  inovator yang produktif.  \n(ii) Kegiatan MBKM dalam bentuk magang/ praktik kerja dan kegiatan wirausaha hilirisasi \ndapat berupa kegiatan penelitian dan pengabdian masyarakat bersama civitas \nakademika yang lain untuk memecahkan persoalan di masyarakat atau indust ri, inkubasi \ndan start -up.  \n(iii) Kegiatan MBKM dalam bentuk magang/ praktik kerja dan kegiatan wirausaha hilirisasi \ndikembangkan oleh  Direktorat yang mengurusi inovasi dan kawasan sains teknologi']","Dalam MB-KM, terdapat beberapa bentuk kegiatan pembelajaran yang termasuk di dalamnya, antara lain:
1. Magang/ Praktik Kerja
2. Membangun Desa/ Kuliah Kerja Nyata Tematik
3. Pertukaran Pelajar
4. Proyek Kemanusiaan
5. Penelitian/ Riset
6. Kegiatan Wirausaha
7. Studi/ Proyek Independen
8. Asistensi Mengajar di Satuan Pendidikan

Selain itu, terdapat juga bentuk kegiatan lain seperti asistensi mengajar di satuan pendidikan, pertukaran pelajar melalui mata kuliah di prodi di luar ITS, dan studi/proyek independen untuk penerapan saintek dalam rangka menghasilkan inovasi terdepan."
7,Kapan pelaksanaan kegiatan pengabdian kepada masyarakat dapat dilakukan dalam program sarjana di ITS?,Pada semester 6 dan 7.,"['(4) Pelaksanaan kegiatan pengabdian kepada masyarakat adalah pada semester 6 (enam) dan 7 (tujuh).\r\n(5) Pelaksanaan kegiatan pengabdian kepada masyarakat dapat dilaksanakan sebelum semester 6 (enam) dan 7 (tujuh) tetapi sudah lulus tahap persiapan dengan menggunakan sistem tabung nilai.\r\n(6) Mekanisme dan penyelenggaraan kegiatan pengabdian kepada masyarakat dikembangkan dan dikoordinasikan oleh Direktorat yang mengurusi riset dan pengabdian kepada masyarakat.\r\n(7) Direktorat yang mengurusi riset dan pengabdian kepada masyarakat dalam menyelenggarakan kegiatan pengabdian kepada masyarakat sebagaimana dimaksud pada ayat (6) berkoordinasi dengan Program Studi terkait.\r\n\r\nBagian Ketiga\r\nPertukaran Pelajar/ Kuliah Lingkup Dalam Negeri\r\n\r\nPasal 7', '(v) Bentuk kegiatan pengabdian kepada masyarakat merupakan salah satu bentuk 7 Dokumen Panduan Baku Mutu Pelaksanaan MBKM - 2021  \n NO ELEMEN PENILAIAN  INDIKATOR  \n(1) (2) (3) \nimplementasi MK pengayaan dengan bobot 3 (tiga) sks.  \n \n4 Standar Isi  – Pengakuan bobot \nsks (1) Jumlah sks maksimal yang dapat diambil dalam rangka pelaksanaan kegiatan MB – KM \nadalah 40 (empat puluh) sks.  \n(2) Kegiatan magang/ praktik kerja pada program sarjana terapan diimplementasikan dalam \nbentuk mata kuliah wajib sebagai  mata kuliah penciri Fakultas  Vokasi sebesar 14 (empat \nbelas) sks.  \n(3) Konversi kegiatan MB -KM magang dapat dikonversikan ke dalam: (i) MK KP,  \n(ii) beberapa MK gabungan antara KP dengan MK lain dengan kesamaan CP MK,  \n(iii) MK magang dengan maksimum bobot 20 (dua puluh) sks.   \n(4) Kegiatan MBKM – dalam bentuk pertukaran pelajar melalui MK di prodi di luar ITS, \ndengan ketentuan jumlah sks maksimal adalah 20 (dua puluh) sks, yang meliputi mata', 'juga dapat memanfaatkan Program Holistik Pembinaan dan Pemberdayaan Desa \n(PHP2D) dengan mengikuti prosedur dari Direktorat Belmawa.\n27       Buku Panduan Merdeka Belajar - Kampus Merdeka\nContoh Model KKNT Pembangunan dan Pemberdayaan bersama Kemendes\nContoh Model KKNT Pembangunan dan Pemberdayaan bersama Mitra\nBuku Panduan Merdeka Belajar - Kampus Merdeka       28\n3) Model KKNT Mengajar di Desa\nPelaksanaan kegiatan ini diutamakan pada mahasiswa program studi Pendidikan. \nBagi mahasiswa di luar program studi Pendidikan dapat melakukan kegiatan \nmengajar sesuai dengan bidang keahlian dalam rangka pemberdayaan \nmasyarakat misalnya penerapan teknologi tepat guna. Semua kegiatan KKNT \nmengajar ini bersifat membantu pengajaran formal dan non-formal. Bila di akhir \nkegiatan ini akan dijadikan sebagai tugas akhir, maka harus direncanakan sejak \nawal dalam bentuk proposal yang mengacu pada aturan prodi.\nContoh Model KKNT Mengajar di Desa\n4) Model KKNT Free Form', '(6) Mekanisme dan penyelenggaraan kegiatan magang/ praktik kerja dikembangkan dan dikoordinasikan oleh Direktorat yang mengurusi kemahasiswaan.\r\n(7) Direktorat Kemahasiswaan dalam menyelenggarakan kegiatan magang/ praktik kerja sebagaimana dimaksud pada ayat (6) berkoordinasi dengan Program Studi terkait.\r\n\r\n         Bagian Kedua Pengabdian Kepada Masyarakat\r\n\r\nPasal 6\r\n(1) Kegiatan pengabdian kepada masyarakat ditujukan untuk pembinaan karakter kebangsaan mahasiswa khususnya untuk menumbuhkan kepedulian terhadap persoalan yang dihadapi masyarakat.\r\n(2) Kegiatan pengabdian kepada masyarakat pada program sarjana diimplementasikan dalam bentuk mata kuliah pengayaan sebesar 3 (tiga) sks.\r\n(3) Kegiatan pengabdian kepada masyarakat pada program sarjana terapan, dapat diambil untuk tambahan sks atau dapat dikompensasi dengan mata kuliah Program Studi yang memiliki capaian pembelajaran yang setara.']","Pelaksanaan kegiatan pengabdian kepada masyarakat dalam program sarjana di ITS dapat dilakukan pada semester 6 (enam) dan 7 (tujuh). Namun, kegiatan pengabdian kepada masyarakat juga dapat dilaksanakan sebelum semester 6 (enam) dan 7 (tujuh) jika mahasiswa sudah lulus tahap persiapan dengan menggunakan sistem tabung nilai. Mekanisme dan penyelenggaraan kegiatan pengabdian kepada masyarakat dikembangkan dan dikoordinasikan oleh Direktorat yang mengurusi riset dan pengabdian kepada masyarakat."
8,Apa fungsi dari Tim MB-KM ITS?,"Memfasilitasi implementasi kegiatan MB-KM di ITS, termasuk membuat prosedur operasional baku, dokumen teknis, penjaminan mutu, sistem aplikasi dan hal lainnya.","['NO ELEMEN PENILAIAN  INDIKATOR  \n(1) (2) (3) \nmengurusi riset dan  pengabdian kepada masyarakat . \n(ix) Implementasi MBKM dalam bentuk penelitian/ riset dikembangkan dan dikoordin ir oleh \nDirektorat yang mengurusi riset dan pengabdian kepada masyarakat  bersama Prodi \nterkait ,  melalui tahapan kegiatan (a) persiapan, (b) Pelaksanaan, (c) Evaluasi, (d) \nPengendalian, dan (e) Peningkatan.  \n \n12 Standar Proses –  \nKegiatan MBKM – bentuk \nKewirausahaan  (i) Kegiatan MBKM dalam bentuk wirausaha  dimaksudkan untuk mendukung pencapaian \nprofil sebagai kader pengusaha yang mendukung perkembangan ITS di masa \nmendatang . \n(ii) Kegiatan MBKM dalam bentuk wirausaha  dapat dikonversi ke dalam sks MK sesuai \ndengan ketercapaian CPL atau bentuk lain  \n(iii) Kegiatan MBKM da lam bentuk wirausaha  dikembangkan oleh Direktorat yang \nmengurusi Kemahasiswaan.  \n(x) Implementasi  Kegiatan MBKM dalam bentuk wirausaha  dikoordinir oleh Direktorat', 'terlibat di dalam pro ses dan hasil pelaksanaan MBKM.  \n(2). SOP yang diterbitkan oleh: (a) Direktorat terkait sebagai koordinator pelaksana \nmasing -masing bentuk MBKM, (b) Prodi sebagai pelaksana MBKM  untuk memandu \ndosen, mahasiswa dan tenaga kependidikan yang terlibat di dalam proses dan hasil \npelaksanaan MBKM.  \nDokumen (1) dan (2) di atas, merupakan manual untuk seluruh stakeholder yang terlibat \ndi dalam implementasi MBKM, yang dapat disusun dalam satu dokumen atau lebih secara \nterpisah. Rambu -rambu dalam penyusunan ke dua dokumen di atas, dengan ketentuan \nmemuat unsur -unsur sebagai berikut, dan dapat dikembangkan sesuai dengan kebutuhan \ndan tujuan pelaksanaan MBKM.  \n1. Tujuan dan ma ksud Manual MBKM  \n2. Luas lingkup Manual MBKM  \na. Manual Penetapan standar  \nb. Manual pelaksanaan standar  \nc. Manual evaluasi standar  \nd. Manual pengendalian pelaksnanaan standar  \ne. Manual peningkatan standar  \n3. Rincian tentang hal yang harus dikerjakan', 'APA SAJA SYARAT DAN KETENTUAN UNTUK JENIS MAGANG MBKM ?\n\n1. Mahasiswa aktif ITS tingkat Sarjana dan Diploma\n2. Minimal mahasiswa sudah lulus 90 SKS atau sudah lulus semester 5.\n3. Mahasiswa tidak diperkenankan mengambil Program Kegiatan Magang (BKP)\nMBKM yang sama lebih dari 1 kali.\n4. Mahasiswa WAJIB melakukan konversi alih kredit ke SKS MK.\n5. Mahasiswa/Departemen WAJIB membuat/memiliki surat PKS.\n6. Pelaksanaan Magang sebelum minggu ke-3 perkuliahan di ITS.\n7. Mahasiswa tidak diperkenankan mengambil MK, atau hanya diperkenankan\nmengambil maks. 3 MK (setara 10 SKS).\n8. Pelaksanaan Magang selama 3 – 6 bulan.\n\nAPA SAJA\nSYARAT DAN\nKETENTUAN\nUNTUK JENIS\nMAGANG\nNON-MBKM', 'c. Jumlah penilaian terhadap pelaksanaan MBKM minimal sebanyak 4 (empat).  \nd. Pelaporan terhadap proses dan hasil penilaian dilakukan oleh Dosen pembimbing \nakademik dalam pelaksanaan MBKM.  \ne. Sistem informasi untuk mempermudah pendataan – implementasi MBKM di Pro di. \n \n2.4 Pengendalian  \nPengendalian pelaksanaan MBKM dilakukan oleh Prodi bersama direktorat dan unit \nterkait, mulai dari perencanaan, pelaksanaan dan pelaporan kegiatan MBKM. \nPengendalian dilakukan atas unsur -unsur yang dikawatirkan akan menyimpang, atau \ntidak memenuhi  standar yang telah ditetapkan.  \n \n \n \n 20 Baku Mutu - MBKM   - 2021  \n \n 3 Penutup  \nBaku mutu MBKM yang disusun sesuai dengan SN Dikti dan kebijakan Rektor ITS \nyang berlaku, sebagai rujukan bagi Direktorat terkait dan Prodi di dalam \nmeingimplementasi MBKM, dengan tujuan:  \n(i) Melakukan pengukuran ketercapaian CPL untuk masing -masing bentuk \nMBKM.  \n(ii) Melakukan penilaian dan evaluasi atas proses dan hasil kegiatan MBKM']",Tim MB-KM ITS memiliki fungsi untuk mengurusi riset dan pengabdian kepada masyarakat. Mereka bertanggung jawab dalam implementasi MBKM dalam bentuk penelitian/riset yang dikembangkan dan dikoordinir oleh Direktorat yang mengurusi riset dan pengabdian kepada masyarakat bersama Prodi terkait. Mereka juga terlibat dalam kegiatan MBKM dalam bentuk wirausaha untuk mendukung pencapaian profil sebagai kader pengusaha yang mendukung perkembangan ITS di masa mendatang.
9,Apa tujuan penjaminan mutu MBKM?,Untuk meningkatkan kompetensi lulusan dengan soft skills dan hard skills.,"['APA SAJA SYARAT DAN KETENTUAN UNTUK JENIS MAGANG MBKM ?\n\n1. Mahasiswa aktif ITS tingkat Sarjana dan Diploma\n2. Minimal mahasiswa sudah lulus 90 SKS atau sudah lulus semester 5.\n3. Mahasiswa tidak diperkenankan mengambil Program Kegiatan Magang (BKP)\nMBKM yang sama lebih dari 1 kali.\n4. Mahasiswa WAJIB melakukan konversi alih kredit ke SKS MK.\n5. Mahasiswa/Departemen WAJIB membuat/memiliki surat PKS.\n6. Pelaksanaan Magang sebelum minggu ke-3 perkuliahan di ITS.\n7. Mahasiswa tidak diperkenankan mengambil MK, atau hanya diperkenankan\nmengambil maks. 3 MK (setara 10 SKS).\n8. Pelaksanaan Magang selama 3 – 6 bulan.\n\nAPA SAJA\nSYARAT DAN\nKETENTUAN\nUNTUK JENIS\nMAGANG\nNON-MBKM', 'Tabel 2.1 Standar dalam penyelenggaraan MB -KM di   ITS \nNO ELEMEN PENILAIAN  INDIKATOR  \n(1) (2) (3) \nI STANDAR KOMPETENSI LULUSAN  \n1 Standar Kompetensi Lulusan  (i) Pelaksanaan MBKM mengacu pada CPL Prodi sebagai target dari kemampuan lulusan, \ndengan minimal pencapaian 80%  CPL dan atau sebagai kompetensi tambahan  \n(ii) Kompetensi tambahan dimaksudkan untuk memperlancar karir lulusan, kolaborasi riset \ndan atau kerja sama p engembangan industri.  \nII STANDAR ISI PEMBELAJARAN  \n2 Standar Isi  – MK Pengayaan  (i) Prodi menyediakan kurikulum untuk pelaksanaan MBKM yang disusun bersama \npemangku kepentingan internal dan eksternal, serta direview oleh pakar bidang ilmu \nprogram studi nya.  \n(ii) Keterjaminan pemenuhan CPL  melalui MBKM ( ketersediaan matrik / peta CPL - MK \nMBKM ), dan ketersediaan modul MK melalui pembelajaran  untuk MK yang \ndilaksanakan secara MBKM', 'meingimplementasi MBKM, dengan tujuan:  \n(i) Melakukan pengukuran ketercapaian CPL untuk masing -masing bentuk \nMBKM.  \n(ii) Melakukan penilaian dan evaluasi atas proses dan hasil kegiatan MBKM  \n(iii) Melakukan pengendalian proses implementasi MBKM  \n(iv) Melakukan peningkatan impleme ntasi MBKM, atas hasil survey kepuasan \npihak internal dan eksternal stakeholder yang terlibat di dalam implementasi \nMBKM.    \n \n \n \n 21 Baku Mutu - MBKM   - 2021', 'PERSYARATAN PENDAFTARAN MAHASISWA UNTUK MENGIKUTI BKP-MBKM\nPROGRAM MAGANG FLAGSHIP MSIB\n● Mahasiswa aktif ITS Tingkat S1/D4 yang belum Yudisium\n● Minimal sudah lulus ≥ 90 SKS (atau sudah lulus semester 5)\n● Mahasiswa tidak diperkenankan mengambil Program Kegiatan (BKP) MBKM yang sama lebih\ndari 1 kali. Mahasiswa yang sudah pernah mengikuti Program Kegiatan Magang (konversi ke\nSKS), tidak diperkenankan mendaftar Program kegiatan Magang kembali (disarankan\nmendaftar pada Program BKP MBKM lainnya). Contoh: Studi Independen\n● Mahasiswa tidak diperkenankan mengambil Program Kegiatan (BKP) MBKM yang sama lebih\ndari 1 kali. Mahasiswa yang sudah pernah mengikuti Program Kegiatan Studi Independen (\nkonversi ke SKS), tidak diperkenankan mendaftar Program kegiatan Studi Independen\nkembali (disarankan mendaftar pada Program BKP MBKM lainnya). Contoh: Magang\n● Mahasiswa yang akan mengikuti Program Magang dan Studi Independen (MSIB) Batch 6 Wajib\nmelakukan konversi alih kredit SKS MK.']","Tujuan penjaminan mutu MBKM adalah untuk melakukan pengukuran ketercapaian CPL untuk masing-masing bentuk MBKM, melakukan penilaian dan evaluasi atas proses dan hasil kegiatan MBKM, melakukan pengendalian proses implementasi MBKM, serta melakukan peningkatan implementasi MBKM berdasarkan hasil survey kepuasan pihak internal dan eksternal stakeholder yang terlibat dalam implementasi MBKM."
10,Apa tujuan dari MBKM?,"Untuk menghasilkan lulusan yang berkualitas dan memenuhi visi, misi, tata nilai, dan tujuan ITS serta memenuhi SN-DIKTI.","['meingimplementasi MBKM, dengan tujuan:  \n(i) Melakukan pengukuran ketercapaian CPL untuk masing -masing bentuk \nMBKM.  \n(ii) Melakukan penilaian dan evaluasi atas proses dan hasil kegiatan MBKM  \n(iii) Melakukan pengendalian proses implementasi MBKM  \n(iv) Melakukan peningkatan impleme ntasi MBKM, atas hasil survey kepuasan \npihak internal dan eksternal stakeholder yang terlibat di dalam implementasi \nMBKM.    \n \n \n \n 21 Baku Mutu - MBKM   - 2021', 'meningkatkan prestasi mahasiswa dalam ajang nasional dan internasional.  \n(iii) Kegiatan  MBKM dalam bentuk Studi/ Proyek Independen adalah semua kegiatan untuk  \npenerapan saintek dalam rangka menghasilkan inovasi terdepan (frontie r).  12 Dokumen Panduan Baku Mutu Pelaksanaan MBKM - 2021  \n NO ELEMEN PENILAIAN  INDIKATOR  \n(1) (2) (3) \n(iv) Kegiatan  MBKM dalam bentuk Studi/ Proyek Independen dapat berupa lomba - lomba \nkemahasiswaan atau proyek - proyek untuk memecahkan persoalan di ITS, di \nmasyarakat atau industri.  \n(v) Kegiatan MBKM dalam bentuk  Studi/ Proyek Independen  dapat dikonversika n ke dalam \nsks MK  atau bentuk lain sesuai dengan ketercapaian CPL serta lama waktu proses \nkegiatan.  \n(vi) Kegiatan MBKM dalam bentuk  Studi/ Proyek dikembangkan oleh Direktorat yang \nmengurusi Kemahasiswaan.  \n(vii) Implementasi  Kegiatan MBKM dalam bentuk  Studi/  Proyek  dikoordinir oleh  Direktorat \nyang mengurusi kemahasiswaan  bersama Prodi terkait , melalui tahapan  kegiatan (a)', 'masih perlu ditingkatkan, salah satunya melalui mahasiswa yang dapat menjadi \nsumber daya manusia yang lebih memberdayakan dana desa.\n23       Buku Panduan Merdeka Belajar - Kampus Merdeka\nTujuan program membangun desa/kuliah kerja nyata antara lain:\n1) Kehadiran mahasiswa selama 6 – 12 bulan dapat memberikan kesempatan \nkepada mahasiswa untuk memanfaatkan ilmu pengetahuan, teknologi, \ndan keterampilan yang dimilikinya bekerjasama dengan banyak pemangku \nkepentingan di lapangan.\n2) Membantu percepatan pembangunan di wilayah pedesaan bersama dengan \nKementerian Desa PDTT.\nManfaat program membangun desa/kuliah kerja nyata antara lain:\n1) Bagi Mahasiswa\na) Membuat mahasiswa mampu melihat potensi desa, mengidentifikasi masalah \ndan mencari solusi untuk meningkatkan potensi dan menjadi desa mandiri. \nb) Membuat mahasiswa mampu berkolaborasi menyusun dan membuat \nRencana Pembangunan Jangka Menengah Desa (RPJMDes), Rencana Kegiatan', '(iii) Kegiatan MBKM da lam bentuk wirausaha  dikembangkan oleh Direktorat yang \nmengurusi Kemahasiswaan.  \n(x) Implementasi  Kegiatan MBKM dalam bentuk wirausaha  dikoordinir oleh Direktorat \nyang mengurusi kemahasiswaan  bersama Prodi terkait , melalui  tahapan kegiatan (a) \npersiapan, (b) Pelaksanaan, (c) Evaluasi, (d) Pengendalian, dan (e) Peningkatan.  \n \n13 Standar Proses –  \nKegiatan MBKM – bentuk Studi \nIndependen  (i) Kegiatan MBKM dalam bentuk Studi/ Proyek Independen dimaksudkan untuk \nmendukung pencapaian profil sebagai inovator yang produktif.  \n(ii) Kegiatan  MBKM dalam bentuk Studi/ Proyek Independen dalam rangka untuk \nmewujudkan gagasan mahasiswa dalam mengembangkan produk inovatif, \nmenyelenggarakan pendidikan berbasis ri set dan pengembangan (R&D) serta \nmeningkatkan prestasi mahasiswa dalam ajang nasional dan internasional.  \n(iii) Kegiatan  MBKM dalam bentuk Studi/ Proyek Independen adalah semua kegiatan untuk']","Tujuan dari MBKM adalah:
1. Melakukan pengukuran ketercapaian CPL untuk masing-masing bentuk MBKM.
2. Melakukan penilaian dan evaluasi atas proses dan hasil kegiatan MBKM.
3. Melakukan pengendalian proses implementasi MBKM.
4. Melakukan peningkatan implementasi MBKM, berdasarkan hasil survey kepuasan pihak internal dan eksternal stakeholder yang terlibat dalam implementasi MBKM."
11,Apa tujuan dari kegiatan magang/ praktik kerja?,"Memperlancar karir lulusan, pengayaan kompetensi mahasiswa, kolaborasi riset, dan kerja sama pengembangan industri.","['kegiatan (a) persiapan, (b) Pelaksanaa n, (c) Evaluasi, (d) Pengendalian, dan (e) \nPeningkatan  \n Standar Proses –  \nKegiatan MBKM – Bentuk \nMagang / Praktik Kerja dan \nWirausaha lingkup Hilirisasi  (i) Kegiatan MBKM dalam bentuk Magang/ Praktik Kerja dan Kegiatan Wirausaha Lingkup \nHilirisasi ditujukan untuk  memperlancar karir lulusan, pengayaan kompetensi \nmahasiswa, kolaborasi magang, wirausaha dan kerja sama pengembangan produk \ninovatif  dalam rangka meraih profil lulusan sebagai  inovator yang produktif.  \n(ii) Kegiatan MBKM dalam bentuk magang/ praktik kerja dan kegiatan wirausaha hilirisasi \ndapat berupa kegiatan penelitian dan pengabdian masyarakat bersama civitas \nakademika yang lain untuk memecahkan persoalan di masyarakat atau indust ri, inkubasi \ndan start -up.  \n(iii) Kegiatan MBKM dalam bentuk magang/ praktik kerja dan kegiatan wirausaha hilirisasi \ndikembangkan oleh  Direktorat yang mengurusi inovasi dan kawasan sains teknologi', '(3) Kegiatan magang/ praktik kerja pada program sarjana terapan diimplementasikan dalam bentuk mata kuliah wajib yang merupakan mata kuliah penciri Fakultas Vokasi sebesar 14 (empat belas) sks.\r\n(4) Kegiatan magang/ praktik kerja pada program sarjana dapat dikonversikan menjadi:\r\na. sks kerja praktek; atau\r\n\r\nb. sks satu atau beberapa mata kuliah yang memiliki Capaian Pembelajaran Mata Kuliah (CPMK) sama dengan magang; atau\r\nc. sks gabungan antara kerja praktek dengan mata kuliah yang memiliki CPMK sama dengan magang atau mata kuliah magang dengan total maksimal 20 (dua puluh) sks.\r\n(5) Persyaratan mahasiswa yang dapat mengikuti kegiatan magang di Program Studi yang belum memiliki mata kuliah magang adalah mahasiswa sudah lulus 72 (tujuh puluh dua sks.\r\n(6) Mekanisme dan penyelenggaraan kegiatan magang/ praktik kerja dikembangkan dan dikoordinasikan oleh Direktorat yang mengurusi kemahasiswaan.', '(6) Mekanisme dan penyelenggaraan kegiatan magang/ praktik kerja dikembangkan dan dikoordinasikan oleh Direktorat yang mengurusi kemahasiswaan.\r\n(7) Direktorat Kemahasiswaan dalam menyelenggarakan kegiatan magang/ praktik kerja sebagaimana dimaksud pada ayat (6) berkoordinasi dengan Program Studi terkait.\r\n\r\n         Bagian Kedua Pengabdian Kepada Masyarakat\r\n\r\nPasal 6\r\n(1) Kegiatan pengabdian kepada masyarakat ditujukan untuk pembinaan karakter kebangsaan mahasiswa khususnya untuk menumbuhkan kepedulian terhadap persoalan yang dihadapi masyarakat.\r\n(2) Kegiatan pengabdian kepada masyarakat pada program sarjana diimplementasikan dalam bentuk mata kuliah pengayaan sebesar 3 (tiga) sks.\r\n(3) Kegiatan pengabdian kepada masyarakat pada program sarjana terapan, dapat diambil untuk tambahan sks atau dapat dikompensasi dengan mata kuliah Program Studi yang memiliki capaian pembelajaran yang setara.', 'dan start -up.  \n(iii) Kegiatan MBKM dalam bentuk magang/ praktik kerja dan kegiatan wirausaha hilirisasi \ndikembangkan oleh  Direktorat yang mengurusi inovasi dan kawasan sains teknologi \nbekerjasama dengan Direktorat yang mengurusi kemahasiswaan . \n(iv) Impl ementasi kegiatan MBKM dalam bentuk  magang/ praktik kerja dan kegiatan \nwirausaha hilirisasi dikoordinir oleh Direktorat yang mengurusi  inovasi dan kawasan \nsains teknologi  bersama Prodi terkait, melalui tahapan  kegiatan (a) persiapan, (b) \nPelaksanaan, (c) Evaluasi, (d) Pengendalian, dan (e) Peningkatan   \n \nIV STANDAR PENILAIAN PEMBELAJARAN  \n11 Standar penilaian  (i) Penilaian atas proses dan hasil pelaksanaan MBKM mengacu pada prinsip penilaian.  \n \n 14 Dokumen Panduan Baku Mutu Pelaksanaan MBKM - 2021  \n NO ELEMEN PENILAIAN  INDIKATOR  \n(1) (2) (3) \nDalam hal mahasiswa mendapatkan nilai mata kuliah pengayaan kurang dari C, maka \nmahasiswa dapat menggantinya dengan mata kuliah pengayaan yang berbeda.']","Tujuan dari kegiatan magang/praktik kerja adalah untuk memperlancar karir lulusan, mengaya kompetensi mahasiswa, kolaborasi magang, wirausaha, dan kerja sama pengembangan produk inovatif dalam rangka meraih profil lulusan sebagai inovator yang produktif. Selain itu, kegiatan magang/praktik kerja juga dapat berupa kegiatan penelitian dan pengabdian masyarakat bersama civitas akademika lainnya untuk memecahkan persoalan di masyarakat atau industri, serta dapat berkontribusi dalam inkubasi dan start-up. Kegiatan magang/praktik kerja ini dikembangkan oleh Direktorat yang mengurusi inovasi dan kawasan sains teknologi."
12,Apa yang dimaksud dengan PDDikti?,Pangkalan Data Perguruan Tinggi yang terintegrasi secara nasional.,"['PENGALAMAN TENTANG KEBUDAYAAN DAERAH LAIN\nMELALUI MODUL NUSANTARA\nSelain mengikuti pembelajaran mata kuliah di perguruan tinggi penerima, mahasiswa yang mengikuti program Pertukaran Mahasiswa Merdeka juga akan mendapatkan pengalaman langsung berinteraksi dengan mahasiswa dari daerah lain dan mempelajari kebudayaan daerah lain melalui Modul Nusantara. Modul Nusantara ini senilai 2 sks dan wajib diambil oleh mahasiswa peserta program Pertukaran Mahasiswa Merdeka. Modul Nusantara dilaksanakan di perguruan tinggi penerima. Modul Nusantara dibagi ke dalam empat jenis kegiatan yaitu kebinekaan, inspirasi, refleksi, dan kontribusi sosial. Dalam pelaksanaan Modul Nusantara, mahasiswa akan dibimbing oleh dosen pembimbing modul nusantara dan dibantu oleh mentor.\nBAGAIMANA MEKANISME PELAKSANAAN PERTUKARAN\nMAHASISWA MERDEKA?\nTerdapat dua mekanisme, yaitu:', 'Subdit. PK2\nSKEMA PELAKSANAAN\nPROGRAM MAGANG\nMANDIRI DI ITS\nMahasiswa / Departemen melakukan\nmenyertakan:\n1. Proposal Magang\n2. Surat Rekomendasi Departemen\n3. Surat Penerimaan Magang\nPelaksanaan Magang\nProses pengurusan\nPKS\nPKS tidak\ndisetujui\nPKS\nTertandatangan\nSelesai\nMagang berakhir <\nMahasiswa mendapatkan\nSertifikat / Penilaian Magang\nSelesai\nADVANCING HUMANITY\niTS\nMulai\nMahasiswa mengurus\nsurat rekomendasi\ndepartemen untuk pengajuan magang ke\nMitra\nMahasiswa mengajukan\npermohonan magang ke\nMitra\nMitra melakukan seleksi magang\nMahasiswa menerima hasil seleksi magang dari Mitra\nTidak diterima\nSelesai\nDiterima\nMahasiswa melaporkan\nke Departemen', '5. Surat persetujuan orang tua/wali (contoh terlampir)\n6. Surat pakta integritas (contoh terlampir\nPERTANYAAN YANG SERING DITANYAKAN\nT. Mahasiswa dari perguruan tinggi apa saja yang dapat mengikuti program Pertukaran Mahasiswa Merdeka?\nJ. Mahasiswa dari perguruan tinggi negeri maupun swasta non vokasi di bawah Direktorat Jenderal Pendidikan Tinggi, Kementerian Pendidikan, Kebudayaan, Riset, dan Tenologi RI.\nJ. Apakah Pertukaran Mahasiswa Merdeka 2021 untuk mahasiswa S1 saja?\nA. Pertukaran Mahasiswa Merdeka 2021 diperuntukkan untuk mahasiswa jenjang St.\nT. Apakah mahasiswa yang lolos akan menerima bantuan potongan\nUKT?\nJ. Mahasiswa akan menerima bantuan potongan UKT sebesar maksimal Rp 2.400.000 dengan syarat bukan penerima bantuan\nUKT dari beasiswa pemerintah lainnya.\nT. Bagaimana jika UKT saya lebih kecil dari 2,4 juta?\nJ. Bantuan UKT akan dibayarkan at cost (sesuai besaran UKT mahasiswa).', 'terlibat di dalam pro ses dan hasil pelaksanaan MBKM.  \n(2). SOP yang diterbitkan oleh: (a) Direktorat terkait sebagai koordinator pelaksana \nmasing -masing bentuk MBKM, (b) Prodi sebagai pelaksana MBKM  untuk memandu \ndosen, mahasiswa dan tenaga kependidikan yang terlibat di dalam proses dan hasil \npelaksanaan MBKM.  \nDokumen (1) dan (2) di atas, merupakan manual untuk seluruh stakeholder yang terlibat \ndi dalam implementasi MBKM, yang dapat disusun dalam satu dokumen atau lebih secara \nterpisah. Rambu -rambu dalam penyusunan ke dua dokumen di atas, dengan ketentuan \nmemuat unsur -unsur sebagai berikut, dan dapat dikembangkan sesuai dengan kebutuhan \ndan tujuan pelaksanaan MBKM.  \n1. Tujuan dan ma ksud Manual MBKM  \n2. Luas lingkup Manual MBKM  \na. Manual Penetapan standar  \nb. Manual pelaksanaan standar  \nc. Manual evaluasi standar  \nd. Manual pengendalian pelaksnanaan standar  \ne. Manual peningkatan standar  \n3. Rincian tentang hal yang harus dikerjakan']","PDDikti merupakan singkatan dari Pusat Data dan Informasi Pendidikan Tinggi, yang merupakan lembaga di bawah Kementerian Pendidikan, Kebudayaan, Riset, dan Teknologi Republik Indonesia yang bertanggung jawab dalam pengelolaan data dan informasi pendidikan tinggi di Indonesia. PDDikti memiliki peran penting dalam menyediakan data dan informasi terkait perguruan tinggi, program studi, mahasiswa, dan berbagai kegiatan pendidikan tinggi lainnya."
13,Berapa jumlah kredit Mata Kuliah KP?,2 SKS,"['dapat menuliskan hal-hal yang dilakukannya beserta hasilnya dalam bentuk tugas \nakhir.\nPelaksanaan KKNT dilakukan untuk mendukung kerja sama bersama Kementerian \nDesa PDTT serta Kementerian/ stakeholder  lainnya. Pemerintah melalui Kementerian \nDesa PDTT menyalurkan dana desa 1 milyar per desa kepada sejumlah 74.957 \ndesa di Indonesia, yang berdasarkan data Indeks Desa Membangun (IDM) tahun \n2019, terdapat desa sangat tertinggal sebanyak 6.549 dan desa tertinggal 20.128. \nPelaksanaan KKNT dapat dilakukan pada desa sangat tertinggal, tertinggal dan \nberkembang, yang sumber daya manusianya  belum memiliki kemampuan \nperencanaan pembangunan dengan fasilitas dana yang besar tersebut. Sehingga \nefektivitas penggunaan dana desa untuk menggerakkan pertumbuhan ekonomi \nmasih perlu ditingkatkan, salah satunya melalui mahasiswa yang dapat menjadi \nsumber daya manusia yang lebih memberdayakan dana desa.\n23       Buku Panduan Merdeka Belajar - Kampus Merdeka', 'diperoleh mahasiswa dalam pelaksanaan KKNT. Jumlah dan bidang Mahasiswa \nyang mengikuti program ini menyesuaikan dengan kebutuhan program di desa. \nPelaksanaan KKNT Pembangunan dan Pemberdayaan Desa dilakukan selama        \n6 – 12 bulan di lokasi atau setara dengan maksimal 20 SKS. Perhitungan terhadap \ncapaian pembelajaran setara 20 SKS ini dapat disetarakan dalam beberapa mata \nkuliah yang relevan dengan kompetensi lulusan. Penilaian terhadap capaian \npembelajaran dapat diidentifikasi dari laporan dan ujian portofolio/rubrik \nkegiatan KKNT. Untuk kesesuaian dengan ketercapaian kompetensi lulusan \nmaka perlu dipersiapkan proposal/rancangan kegiatan yang dapat mewakili \nbidang keahlian. Dosen pembimbing lapangan harus mewakili program studi \npengampu mata kuliah semester akhir dari setiap program studi. Mahasiswa \njuga dapat memanfaatkan Program Holistik Pembinaan dan Pemberdayaan Desa \n(PHP2D) dengan mengikuti prosedur dari Direktorat Belmawa.', 'KERJA PRAKTIK\nDepartemen Teknik Informatika ITS\n\nSekilas Kerja Praktik\n\nJumlah kredit Mata Kuliah KP: 2 SKS\nSKS KP diambil bersamaan / setelah menyelesaikan KP di organisasi (perusahaan, instansi, yayasan)\nLama KP: 1-2 bulan dengan hitungan kerja part time\nBisa perorangan atau berkelompok maksimal 2 (dua) mahasiswa\nBerkas-berkas KP bisa didapatkan di link resource akademik:\nhttps://intip.in/ResourceAkademikDanKemahasiswaanIF\nProsedur Kerja Praktik\n\nMengajukan KP\nSurat Pengantar KP\nDosen Pembimbing KP\nPelaksanaan KP\nPenilaian KP oleh Pembimbing Lapangan\nPenilaian KP oleh Dosen Pembimbing\nPenyerahan Laporan KP ke RBTC\nMengumpulkan bukti penyelesaian KP\nLulus KP\nSebelum berangkat KP\n\nMengajukan KP\n\nMemenuhi persyaratan sebagai berikut:\nMahasiswa aktif Teknik Informatika\nSKS tempuh minimum 90 SKS\nMengisi MONKP:\nmonkp.if.its.ac.id (registrasi akun dan data KP)\nStatus KP akan menjadi CREATED\nSurat Pengantar Kerja Praktik', '31l83 0uluD 29 A0l 2U2120.0y mib\nFORMULIR PENDAFTARAN\nDalam Pertukaran Mahasiswa Merdeka (20 SKS), kamu bisa mengikuti perkuliahan luar jaringan di Perguruan Tinggi (PT) penerima dan dalam jaringan (maksimum 10 SKS) di beberapa PT mitra.\nUniversitas Luar Jaringan\nKalimantan\nsulawesi\nBali - NTT - NTB\nMaluku - Papua\nLainnya\n13. Selanjutnya mengisi pilihan Mata kuliah dalam jaringan (daring) yang ingin diikuti oleh pendaftar, dengan ketentuan jumlah SKS terpilih pada mata kuliah dalam jaringan yaitu maksimum 10 SKS.\nMahasiswa disarankan untuk mengambil 20 SKS secara luar jaringan (luring) di perguruan tinggi penerima.\nMata Kuliah Dalam Jaringan\nPilihan Mata Kuliah\nContoh pilihan beberapa Mata kuliah dan pendaftar bisa mencari menggunakan fitur Search dengan mengetik keyword Mata kuliah seperti pada gambar berikut:\nPilih Mata Kullah 1\nPilih Mata Kuliah 2\nSearch\nType keywords here\nKOMUNIKASI BISNIS\nUniversitas surabaya\nAkuntansi\nPANCASILA DAN KEWARGANEGARAAN\nFarmas']",Jumlah kredit Mata Kuliah KP adalah 2 SKS.
14,Kapan SKS KP bisa diambil?,"Bersamaan atau setelah menyelesaikan KP di organisasi (perusahaan, instansi, yayasan)","['yang setara.  \n(iv) Kegiatan MBKM dalam bentuk KKN dilaksanakan pada semester 6 (enam) dan 7 (tujuh)  \natau sebelum nya dengan syarat telah lulus tahap persiapan.  \n(v) Kegiatan MBKM dalam bentuk KKN yang dilaksanakan sebelum semester 6 (enam) dan \n7 (tujuh) dan s udah lulus tahap persiapan , diakui sebagai MBKM dengan sistem tabung \nnilai.  \n(vi) Kegiatan MBKM dalam bentuk KKN  dikembangkan oleh Direktorat yang mengurusi riset \ndan pengabdian kepada masyarakat . \n(vii) Implementasi MBKM dalam bentuk  KKN  dikoordinir oleh Direktorat yang m engurusi  \npengabdian kepada masyarakat bersama  Prodi  terkait , melalui tahapan kegiatan (a) \npersiapan, (b) Pelaksanaan, (c) Evaluasi, (d) Pengendalian, dan (e) Peningkatan . \n \n10 Standar Proses –  \nKegiatan MBKM – bentuk \nPertukaran Pelajar  (i) Kegiatan MBKM dalam bentuk pertukaran pelajar  dimaksudkan untuk mencapai CPL .  \n(ii) Kegiatan MBKM dalam bentuk pertukaran pelajar  dapat dilakukan dengan PT di dalam \nnegeri atau di luar negeri.', 'diperoleh mahasiswa dalam pelaksanaan KKNT. Jumlah dan bidang Mahasiswa \nyang mengikuti program ini menyesuaikan dengan kebutuhan program di desa. \nPelaksanaan KKNT Pembangunan dan Pemberdayaan Desa dilakukan selama        \n6 – 12 bulan di lokasi atau setara dengan maksimal 20 SKS. Perhitungan terhadap \ncapaian pembelajaran setara 20 SKS ini dapat disetarakan dalam beberapa mata \nkuliah yang relevan dengan kompetensi lulusan. Penilaian terhadap capaian \npembelajaran dapat diidentifikasi dari laporan dan ujian portofolio/rubrik \nkegiatan KKNT. Untuk kesesuaian dengan ketercapaian kompetensi lulusan \nmaka perlu dipersiapkan proposal/rancangan kegiatan yang dapat mewakili \nbidang keahlian. Dosen pembimbing lapangan harus mewakili program studi \npengampu mata kuliah semester akhir dari setiap program studi. Mahasiswa \njuga dapat memanfaatkan Program Holistik Pembinaan dan Pemberdayaan Desa \n(PHP2D) dengan mengikuti prosedur dari Direktorat Belmawa.', '20. Sistem Kredit Semester yang selanjutnya disingkat SKS adalah suatu sistem penyelenggaraan pendidikan dengan menggunakan sks.\r\n21. Satuan Kredit Semester yang selanjutnya disingkat sks adalah takaran waktu kegiatan belajar yang dibebankan pada mahasiswa per minggu per semester dalam proses pembelajaran melalui berbagai bentuk pembelajaran atau besarnya pengakuan atas keberhasilan usaha mahasiswa dalam mengikuti kegiatan kurikuler di suatu program studi.\r\n22. Satuan Kegiatan Ekstrakurikuler Mahasiswa, yang selanjutnya disingkat SKEM, adalah satuan yang digunakan untuk mengukur kegiatan ekstrakurikuler mahasiswa dan berfungsi sebagai salah satu syarat kelulusan bagi mahasiswa Program Sarjana Terapan dan Sarjana.\r\n23. Mata Kuliah adalah satuan pelajaran yang diajarkan di tingkat perguruan tinggi.\r\n24. Mata Kuliah Inti adalah mata kuliah wajib yang terkait dengan program studi di ITS.', 'diperoleh mahasiswa dalam pelaksanaan KKNT regular, dan mahasiswa diberi \nkesempatan untuk mengajukan perpanjangan KKNT selama maksimal 1 \nsemester atau setara dengan 20 SKS. Untuk melanjutkan program KKNT yang \ndiperpanjang, mahasiswa dapat memanfaatkan Program Holistik Pembinaan Buku Panduan Merdeka Belajar - Kampus Merdeka       26\ndan Pemberdayaan Desa (PHP2D) dengan mengikuti prosedur dari Direktorat \nBelmawa. Bentuk kegiatan KKNT yang Diperpanjang dapat berupa proyek  \npemberdayaan masyarakat di desa dan penelitian untuk tugas akhir mahasiswa.\nContoh Model KKNT yang Diperpanjang\n2) Model KKNT Pembangunan dan Pemberdayaan Desa\nPada model ini perguruan tinggi bekerja sama dengan Mitra dalam melakukan \nKKNT Pembangunan dan Pemberdayaan Desa berdasarkan peluang/kondisi \ndesa dalam bentuk paket kompetensi/pengembangan RPJMDes yang akan \ndiperoleh mahasiswa dalam pelaksanaan KKNT. Jumlah dan bidang Mahasiswa \nyang mengikuti program ini menyesuaikan dengan kebutuhan program di desa.']","SKS KP bisa diambil pada semester 6 (enam) dan 7 (tujuh) atau sebelumnya dengan syarat telah lulus tahap persiapan. Jika kegiatan KP dilaksanakan sebelum semester 6 (enam) dan 7 (tujuh) dan sudah lulus tahap persiapan, maka diakui sebagai SKS KP dengan sistem tabung nilai."
15,Apakah KP bisa dilakukan secara berkelompok?,"Ya, maksimal 2 (dua) mahasiswa","['masyarakat di luar kampus, yang secara langsung bersama-sama masyarakat \nmengidentifikasi potensi dan menangani masalah sehingga diharapkan mampu \nmengembangkan potensi desa/daerah dan meramu solusi untuk masalah yang ada \ndi desa. Kegiatan KKNT diharapkan dapat mengasah softskill  kemitraan, kerjasama \ntim lintas disiplin/keilmuan (lintas kompetensi), dan leadership  mahasiswa dalam \nmengelola program pembangunan di wilayah perdesaan. Sejauh ini perguruan \ntinggi sudah menjalankan program KKNT, hanya saja Satuan Kredit Semesternya \n(SKS) belum bisa atau dapat diakui sesuai dengan program kampus merdeka yang \npengakuan kreditnya setara 6 – 12 bulan atau 20 – 40 SKS, dengan pelaksanaannya \nberdasarkan beberapa model. Diharapkan juga setelah pelaksanaan KKNT, mahasiswa \ndapat menuliskan hal-hal yang dilakukannya beserta hasilnya dalam bentuk tugas \nakhir.\nPelaksanaan KKNT dilakukan untuk mendukung kerja sama bersama Kementerian', 'diperoleh mahasiswa dalam pelaksanaan KKNT regular, dan mahasiswa diberi \nkesempatan untuk mengajukan perpanjangan KKNT selama maksimal 1 \nsemester atau setara dengan 20 SKS. Untuk melanjutkan program KKNT yang \ndiperpanjang, mahasiswa dapat memanfaatkan Program Holistik Pembinaan Buku Panduan Merdeka Belajar - Kampus Merdeka       26\ndan Pemberdayaan Desa (PHP2D) dengan mengikuti prosedur dari Direktorat \nBelmawa. Bentuk kegiatan KKNT yang Diperpanjang dapat berupa proyek  \npemberdayaan masyarakat di desa dan penelitian untuk tugas akhir mahasiswa.\nContoh Model KKNT yang Diperpanjang\n2) Model KKNT Pembangunan dan Pemberdayaan Desa\nPada model ini perguruan tinggi bekerja sama dengan Mitra dalam melakukan \nKKNT Pembangunan dan Pemberdayaan Desa berdasarkan peluang/kondisi \ndesa dalam bentuk paket kompetensi/pengembangan RPJMDes yang akan \ndiperoleh mahasiswa dalam pelaksanaan KKNT. Jumlah dan bidang Mahasiswa \nyang mengikuti program ini menyesuaikan dengan kebutuhan program di desa.', 'dapat menuliskan hal-hal yang dilakukannya beserta hasilnya dalam bentuk tugas \nakhir.\nPelaksanaan KKNT dilakukan untuk mendukung kerja sama bersama Kementerian \nDesa PDTT serta Kementerian/ stakeholder  lainnya. Pemerintah melalui Kementerian \nDesa PDTT menyalurkan dana desa 1 milyar per desa kepada sejumlah 74.957 \ndesa di Indonesia, yang berdasarkan data Indeks Desa Membangun (IDM) tahun \n2019, terdapat desa sangat tertinggal sebanyak 6.549 dan desa tertinggal 20.128. \nPelaksanaan KKNT dapat dilakukan pada desa sangat tertinggal, tertinggal dan \nberkembang, yang sumber daya manusianya  belum memiliki kemampuan \nperencanaan pembangunan dengan fasilitas dana yang besar tersebut. Sehingga \nefektivitas penggunaan dana desa untuk menggerakkan pertumbuhan ekonomi \nmasih perlu ditingkatkan, salah satunya melalui mahasiswa yang dapat menjadi \nsumber daya manusia yang lebih memberdayakan dana desa.\n23       Buku Panduan Merdeka Belajar - Kampus Merdeka', 'KKN ABMAS: Kegiatan pengabdian kepada masyarakat oleh mahasiswa yang bergabung pada tim pengabdi dosen ITS dengan pendanaan dari ITS atau Kementerian Riset dan Teknologi/BRIN.\nKKN PPM/Reguler: Kegiatan pengabdian masyarakat multidisiplin dengan tema khusus dari kelompok mahasiswa.\nKKN Kolaborasi: Pengabdian masyarakat oleh mahasiswa bersama mitra atau perguruan tinggi lain dari dalam/luar negeri, termasuk KKN Kolaborasi PTN Jatim, KKN Kebangsaan, KKN Tanggap Bencana, dll.\nKKN Mandiri: Kesempatan bagi mahasiswa untuk beraktivitas sosial di berbagai tempat melalui berbagai kesempatan.']","KP (Kuliah Kerja Nyata) biasanya dilakukan secara berkelompok, di mana mahasiswa bekerja sama dalam tim untuk mengidentifikasi potensi dan menangani masalah di desa atau wilayah tertentu. Dalam konteks yang diberikan, kegiatan KP diharapkan dapat mengasah softskill kemitraan, kerjasama tim lintas disiplin/keilmuan, dan leadership mahasiswa dalam mengelola program pembangunan di wilayah perdesaan. Sehingga, KP biasanya dilakukan secara berkelompok untuk memaksimalkan hasil kerja sama dan kolaborasi antar mahasiswa."
16,Apa syarat mengajukan KP?,"Mahasiswa aktif Teknik Informatika, SKS tempuh minimum 90 SKS","['APA SAJA SYARAT DAN KETENTUAN UNTUK JENIS MAGANG MBKM ?\n\n1. Mahasiswa aktif ITS tingkat Sarjana dan Diploma\n2. Minimal mahasiswa sudah lulus 90 SKS atau sudah lulus semester 5.\n3. Mahasiswa tidak diperkenankan mengambil Program Kegiatan Magang (BKP)\nMBKM yang sama lebih dari 1 kali.\n4. Mahasiswa WAJIB melakukan konversi alih kredit ke SKS MK.\n5. Mahasiswa/Departemen WAJIB membuat/memiliki surat PKS.\n6. Pelaksanaan Magang sebelum minggu ke-3 perkuliahan di ITS.\n7. Mahasiswa tidak diperkenankan mengambil MK, atau hanya diperkenankan\nmengambil maks. 3 MK (setara 10 SKS).\n8. Pelaksanaan Magang selama 3 – 6 bulan.\n\nAPA SAJA\nSYARAT DAN\nKETENTUAN\nUNTUK JENIS\nMAGANG\nNON-MBKM', 'PERSYARATAN PENDAFTARAN MAHASISWA UNTUK MENGIKUTI BKP-MBKM\nPROGRAM MAGANG FLAGSHIP MSIB\n● Mahasiswa aktif ITS Tingkat S1/D4 yang belum Yudisium\n● Minimal sudah lulus ≥ 90 SKS (atau sudah lulus semester 5)\n● Mahasiswa tidak diperkenankan mengambil Program Kegiatan (BKP) MBKM yang sama lebih\ndari 1 kali. Mahasiswa yang sudah pernah mengikuti Program Kegiatan Magang (konversi ke\nSKS), tidak diperkenankan mendaftar Program kegiatan Magang kembali (disarankan\nmendaftar pada Program BKP MBKM lainnya). Contoh: Studi Independen\n● Mahasiswa tidak diperkenankan mengambil Program Kegiatan (BKP) MBKM yang sama lebih\ndari 1 kali. Mahasiswa yang sudah pernah mengikuti Program Kegiatan Studi Independen (\nkonversi ke SKS), tidak diperkenankan mendaftar Program kegiatan Studi Independen\nkembali (disarankan mendaftar pada Program BKP MBKM lainnya). Contoh: Magang\n● Mahasiswa yang akan mengikuti Program Magang dan Studi Independen (MSIB) Batch 6 Wajib\nmelakukan konversi alih kredit SKS MK.', 'Subdit. PK2\nADVANCING HUMANITY\niTS\nPERSYARATAN PENDAFTARAN MAHASISWA UNTUK MENGIKUTI BKP-MBKM\nPROGRAM MAGANG FLAGSHIP MSIB\nMahasiswa aktif ITS Tingkat Si/D4 yang belum Yudisium\nMinimal sudah lulus ≥ 90 SKS (atau sudah lulus semester 5)\nMahasiswa tidak diperkenankan mengambil Program Kegiatan (BKP) MBKM yang sama lebih dari 1 kali. Mahasiswa yang sudah pernah mengikuti Program Kegiatan Magang (konversi ke SKS), tidak diperkenankan mendaftar Program kegiatan Magang kembali (disarankan mendaftar pada Program ВКР MBKM lainnya). Contoh: Studi Independen', '- Kampus Merdeka di atas, untuk kegiatan KKNT terdapat persyaratan tambahan \nyang harus dipenuhi oleh mahasiswa, yaitu:\n1) Mahasiswa telah menyelesaikan proses pembelajaran setelah  semester 6.\n2) Dilakukan secara berkelompok,  anggota berjumlah ± 10   orang per kelompok \ndan atau sesuai kebutuhan desa, dan bersifat multidisiplin (asal prodi/fakultas/\nkluster  yang berbeda).Buku Panduan Merdeka Belajar - Kampus Merdeka       24\n3) Peserta wajib tinggal di komunitas atau wajib “live in”  di lokasi yang telah \nditentukan. \n4) Sehat jasmani dan rohani serta tidak sedang hamil bagi wanita.\n5) IPK minimal 2.00 sampai dengan semester 5.\n6) Ketentuan lain dapat diatur oleh perguruan tinggi pelaksana.\nAdapun untuk mekanisme pelaksanaan kegiatan membangun desa/kuliah kerja \nnyata adalah sebagai berikut.\n1) Perguruan Tinggi\na) Menjalin kerja sama dengan pihak Kementerian Desa PDTT, serta Kemdikbud \ndalam penyelenggaraan program proyek di desa atau menjalin kerja sama']","Syarat mengajukan KP adalah sebagai berikut:
1. Mahasiswa aktif ITS tingkat Sarjana dan Diploma.
2. Minimal mahasiswa sudah lulus 90 SKS atau sudah lulus semester 5.
3. Mahasiswa tidak diperkenankan mengambil Program Kegiatan Magang (BKP) MBKM yang sama lebih dari 1 kali.
4. Mahasiswa wajib melakukan konversi alih kredit ke SKS MK.
5. Mahasiswa/Departemen wajib membuat/memiliki surat PKS.
6. Pelaksanaan Magang dilakukan sebelum minggu ke-3 perkuliahan di ITS.
7. Mahasiswa tidak diperkenankan mengambil MK, atau hanya diperkenankan mengambil maksimal 3 MK (setara 10 SKS).
8. Pelaksanaan Magang dilakukan selama 3 - 6 bulan."
17,Apa yang harus dilakukan mahasiswa di lokasi KP?,"Mematuhi dan mengikuti segala aturan terkait kerja praktik, dan mengerjakan pekerjaan yang sesuai dengan kompetensi Informatika","['C Kerat\n@ DASHBOARD E KEGIATAN MAHASISWA & PROFIL\nINDAH SYAHYA DINATA\n凹\nPertukaran Mahasiswa Merdeka\nFORMULIR PENDAFTARAN\nPilih Penempatan & Mata Kuliah\nDalam Pertukaran Mahasiswa Merdeka (20 SKS), kamu bisa mengikuti perkuliahan luar jaringan di Perguruan Tinggi (PT) penerima dan dalam jaringan (maksimum 10 SKS) di beberapa PT mitra.\nUniversitas Luar Jaringan\n20 / 20 SKS\nPilihan Lokasi Pulau PT penerima\nPilihan lokasi putau harus di luar alamat KTP dan domisili PT asal. Preferensi mahasiswa akan dipertimbangkan namun keputusan panitia bersifat final dan tidak dapat digugat.\nPilih Lokasi Pulau 11\nロ\nPilhan lokasi pulau narus di luar alamat KIP dan domisili PI asal. Preterensi manasiswa akan diperumbangkan namun keputusan panta bersitat unai dan toak dapat diguga\nSulawesi\nBali - NTT - NTB\nBerikut adalah contoh Pilihan pulau yang telah di-cluster sesuai\ndomisili pendaftar:\n14', 'Meminta persetujuan form pengajuan KP ke Koordinator Kerja Praktek (Sekretaris Departemen 1)\nMenyerahkan Form Pengajuan KP yang sudah disetujui Koord. KP kepada Staf Akademik (Pak Sugeng) untuk dibuatkan surat pengantar ke tempat KP\nSurat pengantar KP dikeluarkan oleh departemen Teknik Informatika yang ditujukan kepada organisasi tempat KP yang berisi:\nPermohonan agar mahasiswa X diijinkan untuk melakukan KP di organisasi Y,\nTanggal mulai,\nDurasi kerja praktik\nSurat pengantar KP dikirimkan ke instansi penerima KP\nJika balasan persetujuan sudah didapatkan, unggah ke MONKP\nStatus KP akan menjadi CONFIRMED\nDosen Pembimbing Kerja Praktik\n\nSyarat mendapatkan dosen pembimbing internal KP:\nStatus KP akan menjadi CONFIRMED\nDosen Pembimbing KP dipilih oleh koordinator KP dengan menyesuaikan load pembimbingan dosen, kecuali ada rekomendasi khusus dari dosen ybs\nPengalokasian dilakukan secara batch operation\nDi lokasi KP\n4. Melaksanakan Kerja Praktik', 'masyarakat di luar kampus, yang secara langsung bersama-sama masyarakat \nmengidentifikasi potensi dan menangani masalah sehingga diharapkan mampu \nmengembangkan potensi desa/daerah dan meramu solusi untuk masalah yang ada \ndi desa. Kegiatan KKNT diharapkan dapat mengasah softskill  kemitraan, kerjasama \ntim lintas disiplin/keilmuan (lintas kompetensi), dan leadership  mahasiswa dalam \nmengelola program pembangunan di wilayah perdesaan. Sejauh ini perguruan \ntinggi sudah menjalankan program KKNT, hanya saja Satuan Kredit Semesternya \n(SKS) belum bisa atau dapat diakui sesuai dengan program kampus merdeka yang \npengakuan kreditnya setara 6 – 12 bulan atau 20 – 40 SKS, dengan pelaksanaannya \nberdasarkan beberapa model. Diharapkan juga setelah pelaksanaan KKNT, mahasiswa \ndapat menuliskan hal-hal yang dilakukannya beserta hasilnya dalam bentuk tugas \nakhir.\nPelaksanaan KKNT dilakukan untuk mendukung kerja sama bersama Kementerian', 'diperoleh mahasiswa dalam pelaksanaan KKNT regular, dan mahasiswa diberi \nkesempatan untuk mengajukan perpanjangan KKNT selama maksimal 1 \nsemester atau setara dengan 20 SKS. Untuk melanjutkan program KKNT yang \ndiperpanjang, mahasiswa dapat memanfaatkan Program Holistik Pembinaan Buku Panduan Merdeka Belajar - Kampus Merdeka       26\ndan Pemberdayaan Desa (PHP2D) dengan mengikuti prosedur dari Direktorat \nBelmawa. Bentuk kegiatan KKNT yang Diperpanjang dapat berupa proyek  \npemberdayaan masyarakat di desa dan penelitian untuk tugas akhir mahasiswa.\nContoh Model KKNT yang Diperpanjang\n2) Model KKNT Pembangunan dan Pemberdayaan Desa\nPada model ini perguruan tinggi bekerja sama dengan Mitra dalam melakukan \nKKNT Pembangunan dan Pemberdayaan Desa berdasarkan peluang/kondisi \ndesa dalam bentuk paket kompetensi/pengembangan RPJMDes yang akan \ndiperoleh mahasiswa dalam pelaksanaan KKNT. Jumlah dan bidang Mahasiswa \nyang mengikuti program ini menyesuaikan dengan kebutuhan program di desa.']","Mahasiswa harus melaksanakan Kerja Praktik di lokasi KP sesuai dengan surat pengantar yang dikeluarkan oleh departemen Teknik Informatika. Selain itu, mahasiswa juga harus mematuhi persyaratan yang telah ditetapkan dalam surat pengantar, seperti tanggal mulai, durasi kerja praktik, dan tugas yang harus dilakukan selama Kerja Praktik. Jika balasan persetujuan sudah didapatkan, mahasiswa harus mengunggahnya ke MONKP agar status KP menjadi CONFIRMED."
18,Kapan batas waktu penyerahan laporan KP?,Paling lambat 1 bulan setelah tanggal selesainya kerja praktek di perusahaan,"['CARA DAFTAR AKUN REPOSITORY\nHOW TO REGISTER REPOSITORY ACCOUNT\n\nAccess this link: http://bit.ly/PengumpulanKP\n\nCatatan:\n\nKP dengan 2 pengarang cukup mendaftar 1 akun saja.\nLOGIN TO REPOSITORY\n\nAnda bisa login setelah akun diaktivasi oleh pustakawan, paling lama 20 menit setelah mendaftar di jam kerja (tanpa ada notifikasi melalui email).\nLogin to repository is available after the account is activated by librarian. Activation process need time around 20 minutes (work hours) without notification email.\nHubungi administrator apabila lebih dari 20 menit masih belum bisa login.\nContact the administrators (click About ITS Repository) if you are not able to login after that hours.\nPERSIAPAN / PREPARATIONS', 'Sudah menyelesaikan segala pekerjaan terkait KP di perusahaan dan sudah kembali aktif di kampus\nMenemui dosen pembimbing untuk melakukan ujian lisan dan menyerahkan Formulir Penilaian Ujian Lisan Kerja Praktik untuk diisi oleh dosen pembimbing internal\nDosen pembimbing internal mengirimkan nilai ke koordinator KP via email\nJika nilai telah diterima koordinator KP, maka status KP akan menjadi FINISHED\nMenyerahkan Laporan KP\nSudah menyelesaikan segala urusan KP dengan dosen pembimbing\nDokumentasi KP sudah disetujui dan ditandatangani oleh dosen pembimbing\nDokumentasi tersebut berupa softcopy dan diunggah ke repo ITS (lihat manual unggah ke repo ITS di manual unggah mandiri)\nMenerima Bukti Penyerahan KP dari REPO ITS\nMengunggah buku KP dan bukti terima repo ITS ke MS TEAMS KP pada link berikut:\nhttps://teams.microsoft.com/l/team/19%3a447977fe03c040ff98ad9e82e63982e2%40thread.tacv2/conversations?groupId=862aa22c-c596-49e1-94dd-6354fd625a2e&tenantId=1d5169ac-c7cb-4275-9764-bf8c9c364a4c', 'diperoleh mahasiswa dalam pelaksanaan KKNT. Jumlah dan bidang Mahasiswa \nyang mengikuti program ini menyesuaikan dengan kebutuhan program di desa. \nPelaksanaan KKNT Pembangunan dan Pemberdayaan Desa dilakukan selama        \n6 – 12 bulan di lokasi atau setara dengan maksimal 20 SKS. Perhitungan terhadap \ncapaian pembelajaran setara 20 SKS ini dapat disetarakan dalam beberapa mata \nkuliah yang relevan dengan kompetensi lulusan. Penilaian terhadap capaian \npembelajaran dapat diidentifikasi dari laporan dan ujian portofolio/rubrik \nkegiatan KKNT. Untuk kesesuaian dengan ketercapaian kompetensi lulusan \nmaka perlu dipersiapkan proposal/rancangan kegiatan yang dapat mewakili \nbidang keahlian. Dosen pembimbing lapangan harus mewakili program studi \npengampu mata kuliah semester akhir dari setiap program studi. Mahasiswa \njuga dapat memanfaatkan Program Holistik Pembinaan dan Pemberdayaan Desa \n(PHP2D) dengan mengikuti prosedur dari Direktorat Belmawa.', 'diperoleh mahasiswa dalam pelaksanaan KKNT regular, dan mahasiswa diberi \nkesempatan untuk mengajukan perpanjangan KKNT selama maksimal 1 \nsemester atau setara dengan 20 SKS. Untuk melanjutkan program KKNT yang \ndiperpanjang, mahasiswa dapat memanfaatkan Program Holistik Pembinaan Buku Panduan Merdeka Belajar - Kampus Merdeka       26\ndan Pemberdayaan Desa (PHP2D) dengan mengikuti prosedur dari Direktorat \nBelmawa. Bentuk kegiatan KKNT yang Diperpanjang dapat berupa proyek  \npemberdayaan masyarakat di desa dan penelitian untuk tugas akhir mahasiswa.\nContoh Model KKNT yang Diperpanjang\n2) Model KKNT Pembangunan dan Pemberdayaan Desa\nPada model ini perguruan tinggi bekerja sama dengan Mitra dalam melakukan \nKKNT Pembangunan dan Pemberdayaan Desa berdasarkan peluang/kondisi \ndesa dalam bentuk paket kompetensi/pengembangan RPJMDes yang akan \ndiperoleh mahasiswa dalam pelaksanaan KKNT. Jumlah dan bidang Mahasiswa \nyang mengikuti program ini menyesuaikan dengan kebutuhan program di desa.']","Batas waktu penyerahan laporan KP adalah setelah mahasiswa menyelesaikan segala urusan KP dengan dosen pembimbing, dokumen KP disetujui dan ditandatangani oleh dosen pembimbing, serta dokumen tersebut diunggah ke repo ITS. Setelah itu, mahasiswa harus menerima Bukti Penyerahan KP dari REPO ITS dan mengunggah buku KP serta bukti terima repo ITS ke MS TEAMS KP. Jadi, tidak ada informasi spesifik mengenai batas waktu penyerahan laporan KP dalam konteks yang diberikan."
19,Bagaimana format nama file untuk laporan KP dengan pengarang tunggal?,NRP-Project_Report,"['MENGISI METADATA / METADATA ENTRIES\n\nMonograph Type, pilih “Project Report”\nMonograph Type, choose “Project Report”.\nCorporate Creators, diisi nama Perusahaan yang berkontribusi dalam penulisan KP.\nNIDN, diisi NIDN dosen pembimbing. Boleh dikosongkan bila tidak tahu.\nNIDN, fill it with thesis advisor ID number. Can be blank.\nMENGISI METADATA / METADATA ENTRIES\n\nIsikan nama dosen pembimbing dengan nama belakang pada kolom family name.\nFill it with Thesis Advisors name.\nPilih “Thesis Advisor” / Choose “Thesis Advisor”.\nNRP/NIM: diisi NIM [no NRP]\nNRP/NIM: NIM [student ID number].\nCreators, isikan pengarang dengan nama belakang pada kolom family name.\nCreators, fill it with creators name.\nMENGISI METADATA / METADATA ENTRIES', 'File PDF tanpa watermark. Berisi semua isi TA/Tesis/Disertasi dari cover sampai lampiran.\nPDF File without watermark. Full content from cover to Appendix.\nPastikan lembar Pengesahan sudah ditandatangani dosen pembimbing dan stempel departemen.\nInclude Approval sheet which has been signed by Thesis Advisors.\nLaporan KP dengan pengarang tunggal:\n\nNRP-Project_Report\nStudent ID Number-Project_Report\nContoh: / example: 04111060010007-Project_Report\nLaporan KP dengan 2 pengarang atau lebih:\n\nProject report with 2 authors or more\nNRP1_NRP2-Project_Report\nStudent ID Number1_ Student ID Number2-Project_Report\nContoh: / example: 04111060010007_04111060010111-Project_Report\nFormat Nama File / File Name\n\nGunakan NRP sebagai username dan password.\nUse your Student ID Number as username and password.\n123 Nama anda nampak di sini\nYour name appear here\nKlik “New item” / Click “New item”\nMANAGE DEPOSITS\n\nPilih “Monograph” / Choose “Monograph”\nKemudian klik “Next” / Then Click “Next”', '• LAMPIRAN 3: Sampul Laporan Magang\nSampul Laporan Magang berwarna biru dengan logo ITS di kiri atas. Pada sampul tercetak: Judul Laporan Magang, Nama Lengkap Mahasiswa, Asal Departemen dan Fakultas, Institut Teknologi Sepuluh Nopember, dan tahun penyelesaian.\nJenis huruf: Calibri\nUkuran huruf: 14 pt\nContoh Sampul Laporan Magang :\nLAPORAN MAGANG\n(JUDUL LAPORAN MAGANG)\n(NAMA)\n(NRP)\nDosen Pembimbing\n(Nama Dosen Pembimbing)\nDosen Pembimbing\n(Nama Dosen Pembimbing Lapangan)\n(Departemen)\n(Fakultas )\nInstitut Teknologi Sepuluh Nopember Surabaya\n2020\nBuku Petunjuk Teknis Magang\n65\n\n• LAMPIRAN 4 : Form Penilaian Magang (Dosen Pembimbing)\nLEMBAR PENILAIAN KINERJA MAGANG\nSemester Magang :..... Tahun Akademik 20.../20...\nNama Mahasiswa\nNRP\nDepartemen\nNama Dosen Pembimbing\nNama Perusahaan Mitra Magang\nWaktu Pelaksanaan Magang\nNama Proyek/ Kegiatan Magang\nNO\nASPEK YANG DINILAI\nBOBOT (B)\nNILAI (N)\n(0-100)\nJUMLAH\n(B XN)\n1\nKehadiran\n10\n\n\n2\nKesungguhan melaksanakan Kerja Praktek\n15', 'Meminta persetujuan form pengajuan KP ke Koordinator Kerja Praktek (Sekretaris Departemen 1)\nMenyerahkan Form Pengajuan KP yang sudah disetujui Koord. KP kepada Staf Akademik (Pak Sugeng) untuk dibuatkan surat pengantar ke tempat KP\nSurat pengantar KP dikeluarkan oleh departemen Teknik Informatika yang ditujukan kepada organisasi tempat KP yang berisi:\nPermohonan agar mahasiswa X diijinkan untuk melakukan KP di organisasi Y,\nTanggal mulai,\nDurasi kerja praktik\nSurat pengantar KP dikirimkan ke instansi penerima KP\nJika balasan persetujuan sudah didapatkan, unggah ke MONKP\nStatus KP akan menjadi CONFIRMED\nDosen Pembimbing Kerja Praktik\n\nSyarat mendapatkan dosen pembimbing internal KP:\nStatus KP akan menjadi CONFIRMED\nDosen Pembimbing KP dipilih oleh koordinator KP dengan menyesuaikan load pembimbingan dosen, kecuali ada rekomendasi khusus dari dosen ybs\nPengalokasian dilakukan secara batch operation\nDi lokasi KP\n4. Melaksanakan Kerja Praktik']","Format nama file untuk laporan KP dengan pengarang tunggal adalah NRP-Project_Report. Sebagai contoh, jika NRP mahasiswa adalah 04111060010007, maka format nama file laporan KP tersebut adalah 04111060010007-Project_Report."
