,question,ground_truth,contexts,answer
0,Apa visi ITS?,Menjadi perguruan tinggi dengan reputasi internasional dalam ilmu pengetahuan dan teknologi terutama yang menunjang industri dan kelautan yang berwawasan lingkungan.,"['terlibat di dalam pro ses dan hasil pelaksanaan MBKM.  \n(2). SOP yang diterbitkan oleh: (a) Direktorat terkait sebagai koordinator pelaksana \nmasing -masing bentuk MBKM, (b) Prodi sebagai pelaksana MBKM  untuk memandu \ndosen, mahasiswa dan tenaga kependidikan yang terlibat di dalam proses dan hasil \npelaksanaan MBKM.  \nDokumen (1) dan (2) di atas, merupakan manual untuk seluruh stakeholder yang terlibat \ndi dalam implementasi MBKM, yang dapat disusun dalam satu dokumen atau lebih secara \nterpisah. Rambu -rambu dalam penyusunan ke dua dokumen di atas, dengan ketentuan \nmemuat unsur -unsur sebagai berikut, dan dapat dikembangkan sesuai dengan kebutuhan \ndan tujuan pelaksanaan MBKM.  \n1. Tujuan dan ma ksud Manual MBKM  \n2. Luas lingkup Manual MBKM  \na. Manual Penetapan standar  \nb. Manual pelaksanaan standar  \nc. Manual evaluasi standar  \nd. Manual pengendalian pelaksnanaan standar  \ne. Manual peningkatan standar  \n3. Rincian tentang hal yang harus dikerjakan', '(v) Bentuk kegiatan pengabdian kepada masyarakat merupakan salah satu bentuk 7 Dokumen Panduan Baku Mutu Pelaksanaan MBKM - 2021  \n NO ELEMEN PENILAIAN  INDIKATOR  \n(1) (2) (3) \nimplementasi MK pengayaan dengan bobot 3 (tiga) sks.  \n \n4 Standar Isi  – Pengakuan bobot \nsks (1) Jumlah sks maksimal yang dapat diambil dalam rangka pelaksanaan kegiatan MB – KM \nadalah 40 (empat puluh) sks.  \n(2) Kegiatan magang/ praktik kerja pada program sarjana terapan diimplementasikan dalam \nbentuk mata kuliah wajib sebagai  mata kuliah penciri Fakultas  Vokasi sebesar 14 (empat \nbelas) sks.  \n(3) Konversi kegiatan MB -KM magang dapat dikonversikan ke dalam: (i) MK KP,  \n(ii) beberapa MK gabungan antara KP dengan MK lain dengan kesamaan CP MK,  \n(iii) MK magang dengan maksimum bobot 20 (dua puluh) sks.   \n(4) Kegiatan MBKM – dalam bentuk pertukaran pelajar melalui MK di prodi di luar ITS, \ndengan ketentuan jumlah sks maksimal adalah 20 (dua puluh) sks, yang meliputi mata', 'NO ELEMEN PENILAIAN  INDIKATOR  \n(1) (2) (3) \nmengurusi riset dan  pengabdian kepada masyarakat . \n(ix) Implementasi MBKM dalam bentuk penelitian/ riset dikembangkan dan dikoordin ir oleh \nDirektorat yang mengurusi riset dan pengabdian kepada masyarakat  bersama Prodi \nterkait ,  melalui tahapan kegiatan (a) persiapan, (b) Pelaksanaan, (c) Evaluasi, (d) \nPengendalian, dan (e) Peningkatan.  \n \n12 Standar Proses –  \nKegiatan MBKM – bentuk \nKewirausahaan  (i) Kegiatan MBKM dalam bentuk wirausaha  dimaksudkan untuk mendukung pencapaian \nprofil sebagai kader pengusaha yang mendukung perkembangan ITS di masa \nmendatang . \n(ii) Kegiatan MBKM dalam bentuk wirausaha  dapat dikonversi ke dalam sks MK sesuai \ndengan ketercapaian CPL atau bentuk lain  \n(iii) Kegiatan MBKM da lam bentuk wirausaha  dikembangkan oleh Direktorat yang \nmengurusi Kemahasiswaan.  \n(x) Implementasi  Kegiatan MBKM dalam bentuk wirausaha  dikoordinir oleh Direktorat', 'pelaksanaan MBKM   \n4. Prodi mempunyai Dokumen pan duan untuk Mahasiswa dalam perencanaan , \npelaksannaan, penilaian pelaksanaan  MBKM  \n5. Prodi mempunyai d okumen panduan bagi administratur dalam perekaman pelaksanaan \ndan monev MBKM  \n \n8 Standar Pengelolaan – \nPeningkatan MBKM  Mutu, manfaat, kepuasan dan keberlanjutan kerjasama pendidikan  dalam MBKM  \n(i) UPPS dan Prodi melakukan survey kepuasaan kepada seluruh mitra kerjasama \npelaksanaan MBKM, sebagai upaya evaluasi dan keberlanjutan program MBKM.  \n(ii) Upaya yang dilakukan  Direktorat,  UPPS dan PS untuk meningkatkan animo \nmahasiswa dalam pelaksanaan MBKM  \n(iii) Ketersediaan layanan bagi mahasiswa dalam pelaksanaan MBKM di level Prodi dan \nlevel Direktorat terkait  \n(iv) Ketersediaan layanan bagi dosen pembimbing dalam dan pembimbing dari luar untuk \npelaksanaan MBKM  \n(v) Ketersediaan doku men panduan  17 Dokumen Panduan Baku Mutu Pelaksanaan MBKM - 2021  \n NO ELEMEN PENILAIAN  INDIKATOR  \n(1) (2) (3)']",Saya tidak tahu.
1,Apa itu Body of Knowledge?,"Istilah yang digunakan untuk mewakili secara lengkap konsep, istilah, dan aktivitas yang membentuk kemampuan profesional, yang didefinisikan oleh masyarakat terpelajar atau asosiasi profesional yang relevan.","['terlibat di dalam pro ses dan hasil pelaksanaan MBKM.  \n(2). SOP yang diterbitkan oleh: (a) Direktorat terkait sebagai koordinator pelaksana \nmasing -masing bentuk MBKM, (b) Prodi sebagai pelaksana MBKM  untuk memandu \ndosen, mahasiswa dan tenaga kependidikan yang terlibat di dalam proses dan hasil \npelaksanaan MBKM.  \nDokumen (1) dan (2) di atas, merupakan manual untuk seluruh stakeholder yang terlibat \ndi dalam implementasi MBKM, yang dapat disusun dalam satu dokumen atau lebih secara \nterpisah. Rambu -rambu dalam penyusunan ke dua dokumen di atas, dengan ketentuan \nmemuat unsur -unsur sebagai berikut, dan dapat dikembangkan sesuai dengan kebutuhan \ndan tujuan pelaksanaan MBKM.  \n1. Tujuan dan ma ksud Manual MBKM  \n2. Luas lingkup Manual MBKM  \na. Manual Penetapan standar  \nb. Manual pelaksanaan standar  \nc. Manual evaluasi standar  \nd. Manual pengendalian pelaksnanaan standar  \ne. Manual peningkatan standar  \n3. Rincian tentang hal yang harus dikerjakan', 'NO ELEMEN PENILAIAN  INDIKATOR  \n(1) (2) (3) \nmengurusi riset dan  pengabdian kepada masyarakat . \n(ix) Implementasi MBKM dalam bentuk penelitian/ riset dikembangkan dan dikoordin ir oleh \nDirektorat yang mengurusi riset dan pengabdian kepada masyarakat  bersama Prodi \nterkait ,  melalui tahapan kegiatan (a) persiapan, (b) Pelaksanaan, (c) Evaluasi, (d) \nPengendalian, dan (e) Peningkatan.  \n \n12 Standar Proses –  \nKegiatan MBKM – bentuk \nKewirausahaan  (i) Kegiatan MBKM dalam bentuk wirausaha  dimaksudkan untuk mendukung pencapaian \nprofil sebagai kader pengusaha yang mendukung perkembangan ITS di masa \nmendatang . \n(ii) Kegiatan MBKM dalam bentuk wirausaha  dapat dikonversi ke dalam sks MK sesuai \ndengan ketercapaian CPL atau bentuk lain  \n(iii) Kegiatan MBKM da lam bentuk wirausaha  dikembangkan oleh Direktorat yang \nmengurusi Kemahasiswaan.  \n(x) Implementasi  Kegiatan MBKM dalam bentuk wirausaha  dikoordinir oleh Direktorat', 'dan start -up.  \n(iii) Kegiatan MBKM dalam bentuk magang/ praktik kerja dan kegiatan wirausaha hilirisasi \ndikembangkan oleh  Direktorat yang mengurusi inovasi dan kawasan sains teknologi \nbekerjasama dengan Direktorat yang mengurusi kemahasiswaan . \n(iv) Impl ementasi kegiatan MBKM dalam bentuk  magang/ praktik kerja dan kegiatan \nwirausaha hilirisasi dikoordinir oleh Direktorat yang mengurusi  inovasi dan kawasan \nsains teknologi  bersama Prodi terkait, melalui tahapan  kegiatan (a) persiapan, (b) \nPelaksanaan, (c) Evaluasi, (d) Pengendalian, dan (e) Peningkatan   \n \nIV STANDAR PENILAIAN PEMBELAJARAN  \n11 Standar penilaian  (i) Penilaian atas proses dan hasil pelaksanaan MBKM mengacu pada prinsip penilaian.  \n \n 14 Dokumen Panduan Baku Mutu Pelaksanaan MBKM - 2021  \n NO ELEMEN PENILAIAN  INDIKATOR  \n(1) (2) (3) \nDalam hal mahasiswa mendapatkan nilai mata kuliah pengayaan kurang dari C, maka \nmahasiswa dapat menggantinya dengan mata kuliah pengayaan yang berbeda.', '(v) Bentuk kegiatan pengabdian kepada masyarakat merupakan salah satu bentuk 7 Dokumen Panduan Baku Mutu Pelaksanaan MBKM - 2021  \n NO ELEMEN PENILAIAN  INDIKATOR  \n(1) (2) (3) \nimplementasi MK pengayaan dengan bobot 3 (tiga) sks.  \n \n4 Standar Isi  – Pengakuan bobot \nsks (1) Jumlah sks maksimal yang dapat diambil dalam rangka pelaksanaan kegiatan MB – KM \nadalah 40 (empat puluh) sks.  \n(2) Kegiatan magang/ praktik kerja pada program sarjana terapan diimplementasikan dalam \nbentuk mata kuliah wajib sebagai  mata kuliah penciri Fakultas  Vokasi sebesar 14 (empat \nbelas) sks.  \n(3) Konversi kegiatan MB -KM magang dapat dikonversikan ke dalam: (i) MK KP,  \n(ii) beberapa MK gabungan antara KP dengan MK lain dengan kesamaan CP MK,  \n(iii) MK magang dengan maksimum bobot 20 (dua puluh) sks.   \n(4) Kegiatan MBKM – dalam bentuk pertukaran pelajar melalui MK di prodi di luar ITS, \ndengan ketentuan jumlah sks maksimal adalah 20 (dua puluh) sks, yang meliputi mata']","Body of Knowledge (BoK) adalah kumpulan pengetahuan, keterampilan, dan praktik yang diperlukan dalam suatu bidang tertentu. Dalam konteks implementasi MBKM (Mata Kuliah Berbasis Kompetensi), Body of Knowledge merujuk pada standar proses, kegiatan, dan penilaian yang harus dipahami dan dikuasai oleh semua stakeholder yang terlibat dalam pelaksanaan MBKM. BoK ini mencakup panduan tentang penetapan standar, pelaksanaan standar, evaluasi standar, pengendalian pelaksanaan standar, dan peningkatan standar dalam rangka mencapai tujuan dan maksud dari Manual MBKM."
2,Apa itu CPL?,Capaian Pembelajaran Lulusan,"['Tabel 2.1 Standar dalam penyelenggaraan MB -KM di   ITS \nNO ELEMEN PENILAIAN  INDIKATOR  \n(1) (2) (3) \nI STANDAR KOMPETENSI LULUSAN  \n1 Standar Kompetensi Lulusan  (i) Pelaksanaan MBKM mengacu pada CPL Prodi sebagai target dari kemampuan lulusan, \ndengan minimal pencapaian 80%  CPL dan atau sebagai kompetensi tambahan  \n(ii) Kompetensi tambahan dimaksudkan untuk memperlancar karir lulusan, kolaborasi riset \ndan atau kerja sama p engembangan industri.  \nII STANDAR ISI PEMBELAJARAN  \n2 Standar Isi  – MK Pengayaan  (i) Prodi menyediakan kurikulum untuk pelaksanaan MBKM yang disusun bersama \npemangku kepentingan internal dan eksternal, serta direview oleh pakar bidang ilmu \nprogram studi nya.  \n(ii) Keterjaminan pemenuhan CPL  melalui MBKM ( ketersediaan matrik / peta CPL - MK \nMBKM ), dan ketersediaan modul MK melalui pembelajaran  untuk MK yang \ndilaksanakan secara MBKM', '(ii) Keterjaminan pemenuhan CPL  melalui MBKM ( ketersediaan matrik / peta CPL - MK \nMBKM ), dan ketersediaan modul MK melalui pembelajaran  untuk MK yang \ndilaksanakan secara MBKM  \n3 Standar Isi  – MK Pengayaan  (i) MK pengayaan sebagai salah satu kurikulum di dalam MB -KM adalah mata kuliah yang \ndiambil dari luar Program Studi dan ditempuh oleh mahasiswa program sarjana setelah \nmenempuh minimal 72 sks.  \n(ii) Pengambilan MK pengayaan minimal 3 sks dan maksimal 12 sks.  \n(iii) MK pengayaan dilak ukan untuk MK yang dikelompokkan sebagai MK non inti, yang \nterdiri dari: (a) MK wajib kurikulum, (b) MK penciri ITS, (c) MK kategori pengayaan lain, \nyang diatur sesuai dengan Peraturan Akademik di ITS.  \n(iv) Jumlah sks pada MK mata kuliah non inti maksimal sebesar 20 (dua puluh) sks   \n(v) Bentuk kegiatan pengabdian kepada masyarakat merupakan salah satu bentuk 7 Dokumen Panduan Baku Mutu Pelaksanaan MBKM - 2021  \n NO ELEMEN PENILAIAN  INDIKATOR  \n(1) (2) (3)', 'terlibat di dalam pro ses dan hasil pelaksanaan MBKM.  \n(2). SOP yang diterbitkan oleh: (a) Direktorat terkait sebagai koordinator pelaksana \nmasing -masing bentuk MBKM, (b) Prodi sebagai pelaksana MBKM  untuk memandu \ndosen, mahasiswa dan tenaga kependidikan yang terlibat di dalam proses dan hasil \npelaksanaan MBKM.  \nDokumen (1) dan (2) di atas, merupakan manual untuk seluruh stakeholder yang terlibat \ndi dalam implementasi MBKM, yang dapat disusun dalam satu dokumen atau lebih secara \nterpisah. Rambu -rambu dalam penyusunan ke dua dokumen di atas, dengan ketentuan \nmemuat unsur -unsur sebagai berikut, dan dapat dikembangkan sesuai dengan kebutuhan \ndan tujuan pelaksanaan MBKM.  \n1. Tujuan dan ma ksud Manual MBKM  \n2. Luas lingkup Manual MBKM  \na. Manual Penetapan standar  \nb. Manual pelaksanaan standar  \nc. Manual evaluasi standar  \nd. Manual pengendalian pelaksnanaan standar  \ne. Manual peningkatan standar  \n3. Rincian tentang hal yang harus dikerjakan', 'magang sesuai dengan ketentuan yang berlaku;  \n 9 Dokumen Panduan Baku Mutu Pelaksanaan MBKM - 2021  \n NO ELEMEN PENILAIAN  INDIKATOR  \n(1) (2) (3) \n9 Standar Proses –  \nKegiatan MBKM – bentuk \nPengabdian kepada Masyarakat  (i) Kegiatan MBKM dalam bentuk pengabdian kepada masyarakat  atau selanjutnya \ndikategorikan sebagai KKN  ditujukan untuk pembinaan karakter kebangsaan mahasiswa \nkhususnya untuk menumbuhkan kepedulian terhadap persoalan yang dihadapi \nmasyarakat , sebaga i salah satu CPL dalam aspek Sikap .  \n(ii) Kegiatan MBKM dalam bentuk KKN harus dibawah bimbingan dosen . \n(iii) Kegiatan MBKM dalam bentuk KKN dapat diakui sebagai  tambahan sks atau dapat \ndikompensasi dengan mata kuliah Program Studi yang memiliki capaian pembelajaran \nyang setara.  \n(iv) Kegiatan MBKM dalam bentuk KKN dilaksanakan pada semester 6 (enam) dan 7 (tujuh)  \natau sebelum nya dengan syarat telah lulus tahap persiapan.']","CPL merupakan singkatan dari Capaian Pembelajaran Lulusan. CPL merupakan target dari kemampuan lulusan yang harus dicapai minimal sebesar 80%. Selain itu, CPL juga dapat berfungsi sebagai kompetensi tambahan yang dimaksudkan untuk memperlancar karir lulusan, kolaborasi riset, dan/atau kerja sama pengembangan industri."
3,Berapa jam kerja magang yang setara dengan 1 SKS?,1 SKS = 2.720 menit magang atau 45 jam,"['NO ELEMEN PENILAIAN  INDIKATOR  \n(1) (2) (3) \natau kombinasi keduanya  \n6 Standar Proses – Tempat \npelaksanaan MBKM  Tempat k egiatan MB – KM dapat dilaksanakan di luar Program Studi baik yang ada di internal \nITS maupun di luar ITS . \n7 Standar Proses –  \nLama waktu pelaksanaan \nMBKM  Lama waktu pelaksanaan MBKM, dapat dikonvesi ke MK, dengan syarat:  \ni. Lama kegiatan belajar dapat dikonversi ke dalam sks adalah minimal 2720 menit atau \n45.3 jam.  \nii. Lama kegiatan bentuk MBKM dihitung atas waktu untuk:  (a) persiapan  di tempat \nMBKM , (b) pelaksanaan, (c) penilaian, dan  (d)  pelaporan.  \niii. Lama waktu kegiatan MB -KM bentuk magang, minimal 3 bulan dan maksimal 6 bulan.  \n8 Standar Proses –  \nKegiatan akademik selama  \nMBKM  – bentuk magang  (i) Mahasiswa yang melaksakan magang harus bekerja di lapangan secara penuh waktu \nsesuai dengan kesepakata n tempat magang;  \n(ii) Mahasiswa yang melaksanakan magang dapat melakukan kegiatan praktek / kolaborasi', 'yang setara.  \n(iv) Kegiatan MBKM dalam bentuk KKN dilaksanakan pada semester 6 (enam) dan 7 (tujuh)  \natau sebelum nya dengan syarat telah lulus tahap persiapan.  \n(v) Kegiatan MBKM dalam bentuk KKN yang dilaksanakan sebelum semester 6 (enam) dan \n7 (tujuh) dan s udah lulus tahap persiapan , diakui sebagai MBKM dengan sistem tabung \nnilai.  \n(vi) Kegiatan MBKM dalam bentuk KKN  dikembangkan oleh Direktorat yang mengurusi riset \ndan pengabdian kepada masyarakat . \n(vii) Implementasi MBKM dalam bentuk  KKN  dikoordinir oleh Direktorat yang m engurusi  \npengabdian kepada masyarakat bersama  Prodi  terkait , melalui tahapan kegiatan (a) \npersiapan, (b) Pelaksanaan, (c) Evaluasi, (d) Pengendalian, dan (e) Peningkatan . \n \n10 Standar Proses –  \nKegiatan MBKM – bentuk \nPertukaran Pelajar  (i) Kegiatan MBKM dalam bentuk pertukaran pelajar  dimaksudkan untuk mencapai CPL .  \n(ii) Kegiatan MBKM dalam bentuk pertukaran pelajar  dapat dilakukan dengan PT di dalam \nnegeri atau di luar negeri.', '(4) Kegiatan MBKM – dalam bentuk pertukaran pelajar melalui MK di prodi di luar ITS, \ndengan ketentuan jumlah sks maksimal adalah 20 (dua puluh) sks, yang meliputi mata \nkuliah inti dan mata kuliah non inti.  \nIII STANDAR PROSES PEMBELAJARAN  \n5 Standar Proses –bentuk \npembelajaran MBKM  (i) Mahasiswa dapat melaksanakan kegiatan pembelajaran MBKM dalam rangka meraih CPL \nProdi dalam bentuk satu atau lebih bentuk berikut ini:  \na. Magang/ Praktik Kerja;  \nb. Membangun Desa/ Kuliah Kerja Nyata Tematik;  \nc. Pertukaran Pelajar;  \nd. Proyek Kemanusiaan;  \ne. Penelitian/ Riset;  \nf. Kegiatan Wirausaha;  \ng. Studi/ Proyek Independen; dan  \nh. Asistensi Mengajar di Satuan Pendidikan  \n(ii)  Pelaksanaan MB -KM bentuk (a) sd (h) dapat dilaksanakan dalam bentuk  online, offline 8 Dokumen Panduan Baku Mutu Pelaksanaan MBKM - 2021  \n NO ELEMEN PENILAIAN  INDIKATOR  \n(1) (2) (3) \natau kombinasi keduanya  \n6 Standar Proses – Tempat', '2 PRINSIP PPEPP DALAM PENYELENGGARAAN MB -KM \n \nSiklus PPEPP dalam penyelenggaran MB -KM, ditunjukkan di dalam ilustrasi gambar 1.1 di \nbawah ini.  \n \nP: Penetapan   \nP: Pelaksanaan   \nE: Evaluasi  \nP: Pengendalian  \nP: Peningkatan  \n \n \nGambar 2.1 Siklus PPEPP di dalam SPMI  \n \n \n2.1 Penetapan Standar  \nStandar dalam penyelenggaraan MB -KM mengacu pada: (i) SN – Dikti, (ii) Peraturan \nRektor tentang MB -KM, dan (iii) Panduan yang telah dikeluarkan oleh D irektorat \nKemahasiswaan, Direktorat Pendidikan, dan Direktorat Riset dan Pengabdian kepada \nMasyarakat .  \nStandar yang digunakan di dalam penjaminan mutu MB -KM mengacu pada SN Dikti dan \nKebijakan yang telah ditetapkan oleh Rektor ITS yang masih berlaku. Standar tersebut  \ndituliskan di dalam Tabel di bawah ini.  6 Dokumen Panduan Baku Mutu Pelaksanaan MBKM - 2021  \n  \nTabel 2.1 Standar dalam penyelenggaraan MB -KM di   ITS \nNO ELEMEN PENILAIAN  INDIKATOR  \n(1) (2) (3) \nI STANDAR KOMPETENSI LULUSAN']",Jawaban: Lama waktu kegiatan belajar magang yang setara dengan 1 SKS adalah minimal 2720 menit atau 45.3 jam.
4,Apa durasi maksimal magang menurut peraturan rektor?,Maksimal 6 bulan,"['NO ELEMEN PENILAIAN  INDIKATOR  \n(1) (2) (3) \natau kombinasi keduanya  \n6 Standar Proses – Tempat \npelaksanaan MBKM  Tempat k egiatan MB – KM dapat dilaksanakan di luar Program Studi baik yang ada di internal \nITS maupun di luar ITS . \n7 Standar Proses –  \nLama waktu pelaksanaan \nMBKM  Lama waktu pelaksanaan MBKM, dapat dikonvesi ke MK, dengan syarat:  \ni. Lama kegiatan belajar dapat dikonversi ke dalam sks adalah minimal 2720 menit atau \n45.3 jam.  \nii. Lama kegiatan bentuk MBKM dihitung atas waktu untuk:  (a) persiapan  di tempat \nMBKM , (b) pelaksanaan, (c) penilaian, dan  (d)  pelaporan.  \niii. Lama waktu kegiatan MB -KM bentuk magang, minimal 3 bulan dan maksimal 6 bulan.  \n8 Standar Proses –  \nKegiatan akademik selama  \nMBKM  – bentuk magang  (i) Mahasiswa yang melaksakan magang harus bekerja di lapangan secara penuh waktu \nsesuai dengan kesepakata n tempat magang;  \n(ii) Mahasiswa yang melaksanakan magang dapat melakukan kegiatan praktek / kolaborasi', 'c. Jumlah penilaian terhadap pelaksanaan MBKM minimal sebanyak 4 (empat).  \nd. Pelaporan terhadap proses dan hasil penilaian dilakukan oleh Dosen pembimbing \nakademik dalam pelaksanaan MBKM.  \ne. Sistem informasi untuk mempermudah pendataan – implementasi MBKM di Pro di. \n \n2.4 Pengendalian  \nPengendalian pelaksanaan MBKM dilakukan oleh Prodi bersama direktorat dan unit \nterkait, mulai dari perencanaan, pelaksanaan dan pelaporan kegiatan MBKM. \nPengendalian dilakukan atas unsur -unsur yang dikawatirkan akan menyimpang, atau \ntidak memenuhi  standar yang telah ditetapkan.  \n \n \n \n 20 Baku Mutu - MBKM   - 2021  \n \n 3 Penutup  \nBaku mutu MBKM yang disusun sesuai dengan SN Dikti dan kebijakan Rektor ITS \nyang berlaku, sebagai rujukan bagi Direktorat terkait dan Prodi di dalam \nmeingimplementasi MBKM, dengan tujuan:  \n(i) Melakukan pengukuran ketercapaian CPL untuk masing -masing bentuk \nMBKM.  \n(ii) Melakukan penilaian dan evaluasi atas proses dan hasil kegiatan MBKM', '(1) (2) (3) \nDalam hal mahasiswa mendapatkan nilai mata kuliah pengayaan kurang dari C, maka \nmahasiswa dapat menggantinya dengan mata kuliah pengayaan yang berbeda.  \nV STANDAR DOSEN DAN TENDIK  \n12 Standar dosen dan Tendik  (i) Dosen wali ditugaskan oleh Prodi untuk membuat perencanaan bersama dengan \nmahasiswa yang akan melaksanakan kegatan MBKM  \n(ii) Dosen wali ditugaskan oleh Prodi untuk melakukan evaluasi terhadap kesesuaian \nbentuk dan lama pelaksanaan MBKM sesuai dengan CPL  \n(iii) Dosen wali di tugaskan oleh Prodi untuk melakukan penilaian atas rencana, \npelaksanaan dan evaluasi MBKM  \n(iv) Dosen pembimbing MBKM ditugaskan oleh Prodi sesuai dengan pengampu MK \nkonversi dan atau dosen wali  \n(v) Tendik Prodi ditugaskan untuk melayani administrasi dalam implement asi MBKM, \nmulai dari perencanaan, pelaksanaan, moneitoring dan evaluasi, serta pelaporan \nMBKM.  \n \nVI STANDAR PENGELOLAAN PEMBELAJARAN', '(ii) Keterjaminan pemenuhan CPL  melalui MBKM ( ketersediaan matrik / peta CPL - MK \nMBKM ), dan ketersediaan modul MK melalui pembelajaran  untuk MK yang \ndilaksanakan secara MBKM  \n3 Standar Isi  – MK Pengayaan  (i) MK pengayaan sebagai salah satu kurikulum di dalam MB -KM adalah mata kuliah yang \ndiambil dari luar Program Studi dan ditempuh oleh mahasiswa program sarjana setelah \nmenempuh minimal 72 sks.  \n(ii) Pengambilan MK pengayaan minimal 3 sks dan maksimal 12 sks.  \n(iii) MK pengayaan dilak ukan untuk MK yang dikelompokkan sebagai MK non inti, yang \nterdiri dari: (a) MK wajib kurikulum, (b) MK penciri ITS, (c) MK kategori pengayaan lain, \nyang diatur sesuai dengan Peraturan Akademik di ITS.  \n(iv) Jumlah sks pada MK mata kuliah non inti maksimal sebesar 20 (dua puluh) sks   \n(v) Bentuk kegiatan pengabdian kepada masyarakat merupakan salah satu bentuk 7 Dokumen Panduan Baku Mutu Pelaksanaan MBKM - 2021  \n NO ELEMEN PENILAIAN  INDIKATOR  \n(1) (2) (3)']",Durasi maksimal magang menurut peraturan rektor adalah 6 bulan.
5,Apa itu MB-KM di ITS?,Merdeka Belajar - Kampus Merdeka di Institut Teknologi Sepuluh Nopember,"['NO ELEMEN PENILAIAN  INDIKATOR  \n(1) (2) (3) \natau kombinasi keduanya  \n6 Standar Proses – Tempat \npelaksanaan MBKM  Tempat k egiatan MB – KM dapat dilaksanakan di luar Program Studi baik yang ada di internal \nITS maupun di luar ITS . \n7 Standar Proses –  \nLama waktu pelaksanaan \nMBKM  Lama waktu pelaksanaan MBKM, dapat dikonvesi ke MK, dengan syarat:  \ni. Lama kegiatan belajar dapat dikonversi ke dalam sks adalah minimal 2720 menit atau \n45.3 jam.  \nii. Lama kegiatan bentuk MBKM dihitung atas waktu untuk:  (a) persiapan  di tempat \nMBKM , (b) pelaksanaan, (c) penilaian, dan  (d)  pelaporan.  \niii. Lama waktu kegiatan MB -KM bentuk magang, minimal 3 bulan dan maksimal 6 bulan.  \n8 Standar Proses –  \nKegiatan akademik selama  \nMBKM  – bentuk magang  (i) Mahasiswa yang melaksakan magang harus bekerja di lapangan secara penuh waktu \nsesuai dengan kesepakata n tempat magang;  \n(ii) Mahasiswa yang melaksanakan magang dapat melakukan kegiatan praktek / kolaborasi', '(4) Kegiatan MBKM – dalam bentuk pertukaran pelajar melalui MK di prodi di luar ITS, \ndengan ketentuan jumlah sks maksimal adalah 20 (dua puluh) sks, yang meliputi mata \nkuliah inti dan mata kuliah non inti.  \nIII STANDAR PROSES PEMBELAJARAN  \n5 Standar Proses –bentuk \npembelajaran MBKM  (i) Mahasiswa dapat melaksanakan kegiatan pembelajaran MBKM dalam rangka meraih CPL \nProdi dalam bentuk satu atau lebih bentuk berikut ini:  \na. Magang/ Praktik Kerja;  \nb. Membangun Desa/ Kuliah Kerja Nyata Tematik;  \nc. Pertukaran Pelajar;  \nd. Proyek Kemanusiaan;  \ne. Penelitian/ Riset;  \nf. Kegiatan Wirausaha;  \ng. Studi/ Proyek Independen; dan  \nh. Asistensi Mengajar di Satuan Pendidikan  \n(ii)  Pelaksanaan MB -KM bentuk (a) sd (h) dapat dilaksanakan dalam bentuk  online, offline 8 Dokumen Panduan Baku Mutu Pelaksanaan MBKM - 2021  \n NO ELEMEN PENILAIAN  INDIKATOR  \n(1) (2) (3) \natau kombinasi keduanya  \n6 Standar Proses – Tempat', '(ii) Keterjaminan pemenuhan CPL  melalui MBKM ( ketersediaan matrik / peta CPL - MK \nMBKM ), dan ketersediaan modul MK melalui pembelajaran  untuk MK yang \ndilaksanakan secara MBKM  \n3 Standar Isi  – MK Pengayaan  (i) MK pengayaan sebagai salah satu kurikulum di dalam MB -KM adalah mata kuliah yang \ndiambil dari luar Program Studi dan ditempuh oleh mahasiswa program sarjana setelah \nmenempuh minimal 72 sks.  \n(ii) Pengambilan MK pengayaan minimal 3 sks dan maksimal 12 sks.  \n(iii) MK pengayaan dilak ukan untuk MK yang dikelompokkan sebagai MK non inti, yang \nterdiri dari: (a) MK wajib kurikulum, (b) MK penciri ITS, (c) MK kategori pengayaan lain, \nyang diatur sesuai dengan Peraturan Akademik di ITS.  \n(iv) Jumlah sks pada MK mata kuliah non inti maksimal sebesar 20 (dua puluh) sks   \n(v) Bentuk kegiatan pengabdian kepada masyarakat merupakan salah satu bentuk 7 Dokumen Panduan Baku Mutu Pelaksanaan MBKM - 2021  \n NO ELEMEN PENILAIAN  INDIKATOR  \n(1) (2) (3)', 'c. Jumlah penilaian terhadap pelaksanaan MBKM minimal sebanyak 4 (empat).  \nd. Pelaporan terhadap proses dan hasil penilaian dilakukan oleh Dosen pembimbing \nakademik dalam pelaksanaan MBKM.  \ne. Sistem informasi untuk mempermudah pendataan – implementasi MBKM di Pro di. \n \n2.4 Pengendalian  \nPengendalian pelaksanaan MBKM dilakukan oleh Prodi bersama direktorat dan unit \nterkait, mulai dari perencanaan, pelaksanaan dan pelaporan kegiatan MBKM. \nPengendalian dilakukan atas unsur -unsur yang dikawatirkan akan menyimpang, atau \ntidak memenuhi  standar yang telah ditetapkan.  \n \n \n \n 20 Baku Mutu - MBKM   - 2021  \n \n 3 Penutup  \nBaku mutu MBKM yang disusun sesuai dengan SN Dikti dan kebijakan Rektor ITS \nyang berlaku, sebagai rujukan bagi Direktorat terkait dan Prodi di dalam \nmeingimplementasi MBKM, dengan tujuan:  \n(i) Melakukan pengukuran ketercapaian CPL untuk masing -masing bentuk \nMBKM.  \n(ii) Melakukan penilaian dan evaluasi atas proses dan hasil kegiatan MBKM']","MB-KM di ITS adalah singkatan dari Magang Belajar Kurikulum Mandiri. Ini adalah salah satu bentuk pembelajaran yang dapat dilakukan oleh mahasiswa di luar Program Studi baik di internal maupun di luar ITS. Salah satu indikator dari MB-KM di ITS adalah lama waktu pelaksanaan yang minimal 2720 menit atau 45.3 jam, serta kegiatan akademik selama magang harus dilakukan secara penuh waktu sesuai dengan kesepakatan tempat magang."
6,Apa saja bentuk kegiatan pembelajaran yang termasuk dalam MB-KM?,"Magang/Praktik Kerja, Membangun Desa/Kuliah Kerja Nyata Tematik, Pertukaran Pelajar, Proyek Kemanusiaan, Penelitian/Riset, Kegiatan Wirausaha, Studi/Proyek Independen, dan Asistensi Mengajar di Satuan Pendidikan.","['dan menengah ,   \n(iii) Kegiatan MBKM dalam bentuk asistensi mengajar di satuan pendidikan , merupakan \nkegiatan dalam bentuk: bantuan mengajar, tutorial, bimbingan teknis, pelatihan dan \nkegiatan lainnya yang relevan  dengan kegiatan akademik di satuan pendidikan tersebut.  \n(iv) Kegiatan MBKM dalam bentuk asistensi mengajar  dapat dikonversi ke dalam sks MK  \natau bentuk lain sesuai dengan ketercapaian CPL serta lama waktu proses kegiatan  \n(v) Kegiatan MBKM dalam bentuk asistensi mengajar dikembangkan oleh Direktorat yang 13 Dokumen Panduan Baku Mutu Pelaksanaan MBKM - 2021  \n NO ELEMEN PENILAIAN  INDIKATOR  \n(1) (2) (3) \nmengurusi kemahasiswaan.  \n(vi) Implementasi kegiatan MBKM  dalam bentuk asistensi mengajar  dikoordinasi oleh \nDirektorat yang mengurusi Kemahasiswaan bersama Prodi terkait , melalui tahapan  \nkegiatan (a) persiapan, (b) Pelaksanaa n, (c) Evaluasi, (d) Pengendalian, dan (e) \nPeningkatan  \n Standar Proses –  \nKegiatan MBKM – Bentuk \nMagang / Praktik Kerja dan', 'kegiatan (a) persiapan, (b) Pelaksanaa n, (c) Evaluasi, (d) Pengendalian, dan (e) \nPeningkatan  \n Standar Proses –  \nKegiatan MBKM – Bentuk \nMagang / Praktik Kerja dan \nWirausaha lingkup Hilirisasi  (i) Kegiatan MBKM dalam bentuk Magang/ Praktik Kerja dan Kegiatan Wirausaha Lingkup \nHilirisasi ditujukan untuk  memperlancar karir lulusan, pengayaan kompetensi \nmahasiswa, kolaborasi magang, wirausaha dan kerja sama pengembangan produk \ninovatif  dalam rangka meraih profil lulusan sebagai  inovator yang produktif.  \n(ii) Kegiatan MBKM dalam bentuk magang/ praktik kerja dan kegiatan wirausaha hilirisasi \ndapat berupa kegiatan penelitian dan pengabdian masyarakat bersama civitas \nakademika yang lain untuk memecahkan persoalan di masyarakat atau indust ri, inkubasi \ndan start -up.  \n(iii) Kegiatan MBKM dalam bentuk magang/ praktik kerja dan kegiatan wirausaha hilirisasi \ndikembangkan oleh  Direktorat yang mengurusi inovasi dan kawasan sains teknologi', 'meningkatkan prestasi mahasiswa dalam ajang nasional dan internasional.  \n(iii) Kegiatan  MBKM dalam bentuk Studi/ Proyek Independen adalah semua kegiatan untuk  \npenerapan saintek dalam rangka menghasilkan inovasi terdepan (frontie r).  12 Dokumen Panduan Baku Mutu Pelaksanaan MBKM - 2021  \n NO ELEMEN PENILAIAN  INDIKATOR  \n(1) (2) (3) \n(iv) Kegiatan  MBKM dalam bentuk Studi/ Proyek Independen dapat berupa lomba - lomba \nkemahasiswaan atau proyek - proyek untuk memecahkan persoalan di ITS, di \nmasyarakat atau industri.  \n(v) Kegiatan MBKM dalam bentuk  Studi/ Proyek Independen  dapat dikonversika n ke dalam \nsks MK  atau bentuk lain sesuai dengan ketercapaian CPL serta lama waktu proses \nkegiatan.  \n(vi) Kegiatan MBKM dalam bentuk  Studi/ Proyek dikembangkan oleh Direktorat yang \nmengurusi Kemahasiswaan.  \n(vii) Implementasi  Kegiatan MBKM dalam bentuk  Studi/  Proyek  dikoordinir oleh  Direktorat \nyang mengurusi kemahasiswaan  bersama Prodi terkait , melalui tahapan  kegiatan (a)', '(4) Kegiatan MBKM – dalam bentuk pertukaran pelajar melalui MK di prodi di luar ITS, \ndengan ketentuan jumlah sks maksimal adalah 20 (dua puluh) sks, yang meliputi mata \nkuliah inti dan mata kuliah non inti.  \nIII STANDAR PROSES PEMBELAJARAN  \n5 Standar Proses –bentuk \npembelajaran MBKM  (i) Mahasiswa dapat melaksanakan kegiatan pembelajaran MBKM dalam rangka meraih CPL \nProdi dalam bentuk satu atau lebih bentuk berikut ini:  \na. Magang/ Praktik Kerja;  \nb. Membangun Desa/ Kuliah Kerja Nyata Tematik;  \nc. Pertukaran Pelajar;  \nd. Proyek Kemanusiaan;  \ne. Penelitian/ Riset;  \nf. Kegiatan Wirausaha;  \ng. Studi/ Proyek Independen; dan  \nh. Asistensi Mengajar di Satuan Pendidikan  \n(ii)  Pelaksanaan MB -KM bentuk (a) sd (h) dapat dilaksanakan dalam bentuk  online, offline 8 Dokumen Panduan Baku Mutu Pelaksanaan MBKM - 2021  \n NO ELEMEN PENILAIAN  INDIKATOR  \n(1) (2) (3) \natau kombinasi keduanya  \n6 Standar Proses – Tempat']","Bentuk kegiatan pembelajaran yang termasuk dalam MB-KM adalah:
1. Magang/ Praktik Kerja
2. Membangun Desa/ Kuliah Kerja Nyata Tematik
3. Pertukaran Pelajar
4. Proyek Kemanusiaan
5. Penelitian/ Riset
6. Kegiatan Wirausaha
7. Studi/ Proyek Independen
8. Asistensi Mengajar di Satuan Pendidikan

Semua bentuk kegiatan tersebut dapat dilaksanakan secara online, offline, atau kombinasi keduanya."
7,Kapan pelaksanaan kegiatan pengabdian kepada masyarakat dapat dilakukan dalam program sarjana di ITS?,Pada semester 6 dan 7.,"['(v) Bentuk kegiatan pengabdian kepada masyarakat merupakan salah satu bentuk 7 Dokumen Panduan Baku Mutu Pelaksanaan MBKM - 2021  \n NO ELEMEN PENILAIAN  INDIKATOR  \n(1) (2) (3) \nimplementasi MK pengayaan dengan bobot 3 (tiga) sks.  \n \n4 Standar Isi  – Pengakuan bobot \nsks (1) Jumlah sks maksimal yang dapat diambil dalam rangka pelaksanaan kegiatan MB – KM \nadalah 40 (empat puluh) sks.  \n(2) Kegiatan magang/ praktik kerja pada program sarjana terapan diimplementasikan dalam \nbentuk mata kuliah wajib sebagai  mata kuliah penciri Fakultas  Vokasi sebesar 14 (empat \nbelas) sks.  \n(3) Konversi kegiatan MB -KM magang dapat dikonversikan ke dalam: (i) MK KP,  \n(ii) beberapa MK gabungan antara KP dengan MK lain dengan kesamaan CP MK,  \n(iii) MK magang dengan maksimum bobot 20 (dua puluh) sks.   \n(4) Kegiatan MBKM – dalam bentuk pertukaran pelajar melalui MK di prodi di luar ITS, \ndengan ketentuan jumlah sks maksimal adalah 20 (dua puluh) sks, yang meliputi mata', 'di luar ITS dapat  dikembangkan dan dikoordinasikan oleh Direktorat yang mengurusi \npendidikan bekerjasama dengan Direktorat yang mengurusi pascasarjana dan \npengembangan akademik . \n(5) Direktorat yang mengurusi kegiatan pertukaran pelajar/ kuliah dalam negeri harus 16 Dokumen Panduan Baku Mutu Pelaksanaan MBKM - 2021  \n NO ELEMEN PENILAIAN  INDIKATOR  \n(1) (2) (3) \nberkoordinasi dengan Program Studi terkait . \n Standar Pengelolaan – \nPerencanaan MBKM  1. Prodi mempunyai Dokumen panduan untuk implementasi MBKM / turunan dokumen \nPerek 21 tahun 202 1 yang menjadi konsideran  implementasi MBKM . \n2. Prodi mempunyai kurikulum implementasi MBKM, yang meliputi CPL yang ditetapkan \nsesuai dengan implementasi MBKM dan peta CPL – MK MBKM  \n3.  Prodi mempunyai Dokumen panduan untuk Dosen  Wali dan Dosen Pembimbing dalam \npelaksanaan MBKM   \n4. Prodi mempunyai Dokumen pan duan untuk Mahasiswa dalam perencanaan , \npelaksannaan, penilaian pelaksanaan  MBKM', 'NO ELEMEN PENILAIAN  INDIKATOR  \n(1) (2) (3) \nperjanjian kerjasama antar ITS dengan  instansi / lembaga / i ndustri tempat magang  \n(vii) Kegiatan MB -KM hanya bisa dilaksanakan dengan: a. Perguruan tinggi yang \nmempunyai rangking setara atau lebih tinggi dari ITS, b. Perguruan tinggi yang \nmempunyai MoU dengan ITS; atau c. Lembaga non perguruan ting gi yang mempunyai \nMoU dengan ITS.  \n(viii) Kegiatan MB -KM dalam bentuk kuliah dapat dilakukan di Prodi yang mempunyai nilai \nakreditasi minimal dengan Prodi asal di ITS  \n(ix) Kegiatan MB -KM dapat di alih kreditkan menjadi sks MK Prodi, melalui mekanisme \npemeriksaan kese suaian dengan CPL  \n(x) Pemeriksa kesesuaian CPL dilakukan oleh Prodi atau Direktorat bersama tim pelaksana \ntransfer kredit  \n(xi) Mekanisme dalam transfer kredit dapat dikembangkan oleh Prodi dan dikoordinasikan \ndengan Direktorat terkait.  \n7 Standar pengolaan – tempat', '(1) (2) (3) \nDalam hal mahasiswa mendapatkan nilai mata kuliah pengayaan kurang dari C, maka \nmahasiswa dapat menggantinya dengan mata kuliah pengayaan yang berbeda.  \nV STANDAR DOSEN DAN TENDIK  \n12 Standar dosen dan Tendik  (i) Dosen wali ditugaskan oleh Prodi untuk membuat perencanaan bersama dengan \nmahasiswa yang akan melaksanakan kegatan MBKM  \n(ii) Dosen wali ditugaskan oleh Prodi untuk melakukan evaluasi terhadap kesesuaian \nbentuk dan lama pelaksanaan MBKM sesuai dengan CPL  \n(iii) Dosen wali di tugaskan oleh Prodi untuk melakukan penilaian atas rencana, \npelaksanaan dan evaluasi MBKM  \n(iv) Dosen pembimbing MBKM ditugaskan oleh Prodi sesuai dengan pengampu MK \nkonversi dan atau dosen wali  \n(v) Tendik Prodi ditugaskan untuk melayani administrasi dalam implement asi MBKM, \nmulai dari perencanaan, pelaksanaan, moneitoring dan evaluasi, serta pelaporan \nMBKM.  \n \nVI STANDAR PENGELOLAAN PEMBELAJARAN']",Pelaksanaan kegiatan pengabdian kepada masyarakat dalam program sarjana di ITS dapat dilakukan dalam bentuk kegiatan magang/praktik kerja yang diimplementasikan sebagai mata kuliah wajib dengan bobot 14 (empat belas) sks.
8,Apa fungsi dari Tim MB-KM ITS?,"Memfasilitasi implementasi kegiatan MB-KM di ITS, termasuk membuat prosedur operasional baku, dokumen teknis, penjaminan mutu, sistem aplikasi dan hal lainnya.","['terlibat di dalam pro ses dan hasil pelaksanaan MBKM.  \n(2). SOP yang diterbitkan oleh: (a) Direktorat terkait sebagai koordinator pelaksana \nmasing -masing bentuk MBKM, (b) Prodi sebagai pelaksana MBKM  untuk memandu \ndosen, mahasiswa dan tenaga kependidikan yang terlibat di dalam proses dan hasil \npelaksanaan MBKM.  \nDokumen (1) dan (2) di atas, merupakan manual untuk seluruh stakeholder yang terlibat \ndi dalam implementasi MBKM, yang dapat disusun dalam satu dokumen atau lebih secara \nterpisah. Rambu -rambu dalam penyusunan ke dua dokumen di atas, dengan ketentuan \nmemuat unsur -unsur sebagai berikut, dan dapat dikembangkan sesuai dengan kebutuhan \ndan tujuan pelaksanaan MBKM.  \n1. Tujuan dan ma ksud Manual MBKM  \n2. Luas lingkup Manual MBKM  \na. Manual Penetapan standar  \nb. Manual pelaksanaan standar  \nc. Manual evaluasi standar  \nd. Manual pengendalian pelaksnanaan standar  \ne. Manual peningkatan standar  \n3. Rincian tentang hal yang harus dikerjakan', 'NO ELEMEN PENILAIAN  INDIKATOR  \n(1) (2) (3) \nmengurusi riset dan  pengabdian kepada masyarakat . \n(ix) Implementasi MBKM dalam bentuk penelitian/ riset dikembangkan dan dikoordin ir oleh \nDirektorat yang mengurusi riset dan pengabdian kepada masyarakat  bersama Prodi \nterkait ,  melalui tahapan kegiatan (a) persiapan, (b) Pelaksanaan, (c) Evaluasi, (d) \nPengendalian, dan (e) Peningkatan.  \n \n12 Standar Proses –  \nKegiatan MBKM – bentuk \nKewirausahaan  (i) Kegiatan MBKM dalam bentuk wirausaha  dimaksudkan untuk mendukung pencapaian \nprofil sebagai kader pengusaha yang mendukung perkembangan ITS di masa \nmendatang . \n(ii) Kegiatan MBKM dalam bentuk wirausaha  dapat dikonversi ke dalam sks MK sesuai \ndengan ketercapaian CPL atau bentuk lain  \n(iii) Kegiatan MBKM da lam bentuk wirausaha  dikembangkan oleh Direktorat yang \nmengurusi Kemahasiswaan.  \n(x) Implementasi  Kegiatan MBKM dalam bentuk wirausaha  dikoordinir oleh Direktorat', 'dan start -up.  \n(iii) Kegiatan MBKM dalam bentuk magang/ praktik kerja dan kegiatan wirausaha hilirisasi \ndikembangkan oleh  Direktorat yang mengurusi inovasi dan kawasan sains teknologi \nbekerjasama dengan Direktorat yang mengurusi kemahasiswaan . \n(iv) Impl ementasi kegiatan MBKM dalam bentuk  magang/ praktik kerja dan kegiatan \nwirausaha hilirisasi dikoordinir oleh Direktorat yang mengurusi  inovasi dan kawasan \nsains teknologi  bersama Prodi terkait, melalui tahapan  kegiatan (a) persiapan, (b) \nPelaksanaan, (c) Evaluasi, (d) Pengendalian, dan (e) Peningkatan   \n \nIV STANDAR PENILAIAN PEMBELAJARAN  \n11 Standar penilaian  (i) Penilaian atas proses dan hasil pelaksanaan MBKM mengacu pada prinsip penilaian.  \n \n 14 Dokumen Panduan Baku Mutu Pelaksanaan MBKM - 2021  \n NO ELEMEN PENILAIAN  INDIKATOR  \n(1) (2) (3) \nDalam hal mahasiswa mendapatkan nilai mata kuliah pengayaan kurang dari C, maka \nmahasiswa dapat menggantinya dengan mata kuliah pengayaan yang berbeda.', 'c. Jumlah penilaian terhadap pelaksanaan MBKM minimal sebanyak 4 (empat).  \nd. Pelaporan terhadap proses dan hasil penilaian dilakukan oleh Dosen pembimbing \nakademik dalam pelaksanaan MBKM.  \ne. Sistem informasi untuk mempermudah pendataan – implementasi MBKM di Pro di. \n \n2.4 Pengendalian  \nPengendalian pelaksanaan MBKM dilakukan oleh Prodi bersama direktorat dan unit \nterkait, mulai dari perencanaan, pelaksanaan dan pelaporan kegiatan MBKM. \nPengendalian dilakukan atas unsur -unsur yang dikawatirkan akan menyimpang, atau \ntidak memenuhi  standar yang telah ditetapkan.  \n \n \n \n 20 Baku Mutu - MBKM   - 2021  \n \n 3 Penutup  \nBaku mutu MBKM yang disusun sesuai dengan SN Dikti dan kebijakan Rektor ITS \nyang berlaku, sebagai rujukan bagi Direktorat terkait dan Prodi di dalam \nmeingimplementasi MBKM, dengan tujuan:  \n(i) Melakukan pengukuran ketercapaian CPL untuk masing -masing bentuk \nMBKM.  \n(ii) Melakukan penilaian dan evaluasi atas proses dan hasil kegiatan MBKM']","Tim MB-KM ITS memiliki fungsi untuk mengkoordinasikan pelaksanaan dan hasil dari program MBKM di ITS. Mereka bertanggung jawab dalam menyusun SOP yang diterbitkan oleh Direktorat terkait dan Prodi sebagai panduan bagi dosen, mahasiswa, dan tenaga kependidikan yang terlibat dalam proses dan hasil pelaksanaan MBKM. Tim MB-KM ITS juga bertugas untuk melakukan pengendalian pelaksanaan MBKM mulai dari perencanaan, pelaksanaan, hingga pelaporan kegiatan MBKM. Selain itu, mereka juga bertanggung jawab dalam melakukan penilaian dan evaluasi atas proses dan hasil kegiatan MBKM."
9,Apa tujuan penjaminan mutu MBKM?,Untuk meningkatkan kompetensi lulusan dengan soft skills dan hard skills.,"['meingimplementasi MBKM, dengan tujuan:  \n(i) Melakukan pengukuran ketercapaian CPL untuk masing -masing bentuk \nMBKM.  \n(ii) Melakukan penilaian dan evaluasi atas proses dan hasil kegiatan MBKM  \n(iii) Melakukan pengendalian proses implementasi MBKM  \n(iv) Melakukan peningkatan impleme ntasi MBKM, atas hasil survey kepuasan \npihak internal dan eksternal stakeholder yang terlibat di dalam implementasi \nMBKM.    \n \n \n \n 21 Baku Mutu - MBKM   - 2021', 'Tabel 2.1 Standar dalam penyelenggaraan MB -KM di   ITS \nNO ELEMEN PENILAIAN  INDIKATOR  \n(1) (2) (3) \nI STANDAR KOMPETENSI LULUSAN  \n1 Standar Kompetensi Lulusan  (i) Pelaksanaan MBKM mengacu pada CPL Prodi sebagai target dari kemampuan lulusan, \ndengan minimal pencapaian 80%  CPL dan atau sebagai kompetensi tambahan  \n(ii) Kompetensi tambahan dimaksudkan untuk memperlancar karir lulusan, kolaborasi riset \ndan atau kerja sama p engembangan industri.  \nII STANDAR ISI PEMBELAJARAN  \n2 Standar Isi  – MK Pengayaan  (i) Prodi menyediakan kurikulum untuk pelaksanaan MBKM yang disusun bersama \npemangku kepentingan internal dan eksternal, serta direview oleh pakar bidang ilmu \nprogram studi nya.  \n(ii) Keterjaminan pemenuhan CPL  melalui MBKM ( ketersediaan matrik / peta CPL - MK \nMBKM ), dan ketersediaan modul MK melalui pembelajaran  untuk MK yang \ndilaksanakan secara MBKM', '(ii) Keterjaminan pemenuhan CPL  melalui MBKM ( ketersediaan matrik / peta CPL - MK \nMBKM ), dan ketersediaan modul MK melalui pembelajaran  untuk MK yang \ndilaksanakan secara MBKM  \n3 Standar Isi  – MK Pengayaan  (i) MK pengayaan sebagai salah satu kurikulum di dalam MB -KM adalah mata kuliah yang \ndiambil dari luar Program Studi dan ditempuh oleh mahasiswa program sarjana setelah \nmenempuh minimal 72 sks.  \n(ii) Pengambilan MK pengayaan minimal 3 sks dan maksimal 12 sks.  \n(iii) MK pengayaan dilak ukan untuk MK yang dikelompokkan sebagai MK non inti, yang \nterdiri dari: (a) MK wajib kurikulum, (b) MK penciri ITS, (c) MK kategori pengayaan lain, \nyang diatur sesuai dengan Peraturan Akademik di ITS.  \n(iv) Jumlah sks pada MK mata kuliah non inti maksimal sebesar 20 (dua puluh) sks   \n(v) Bentuk kegiatan pengabdian kepada masyarakat merupakan salah satu bentuk 7 Dokumen Panduan Baku Mutu Pelaksanaan MBKM - 2021  \n NO ELEMEN PENILAIAN  INDIKATOR  \n(1) (2) (3)', 'c. Jumlah penilaian terhadap pelaksanaan MBKM minimal sebanyak 4 (empat).  \nd. Pelaporan terhadap proses dan hasil penilaian dilakukan oleh Dosen pembimbing \nakademik dalam pelaksanaan MBKM.  \ne. Sistem informasi untuk mempermudah pendataan – implementasi MBKM di Pro di. \n \n2.4 Pengendalian  \nPengendalian pelaksanaan MBKM dilakukan oleh Prodi bersama direktorat dan unit \nterkait, mulai dari perencanaan, pelaksanaan dan pelaporan kegiatan MBKM. \nPengendalian dilakukan atas unsur -unsur yang dikawatirkan akan menyimpang, atau \ntidak memenuhi  standar yang telah ditetapkan.  \n \n \n \n 20 Baku Mutu - MBKM   - 2021  \n \n 3 Penutup  \nBaku mutu MBKM yang disusun sesuai dengan SN Dikti dan kebijakan Rektor ITS \nyang berlaku, sebagai rujukan bagi Direktorat terkait dan Prodi di dalam \nmeingimplementasi MBKM, dengan tujuan:  \n(i) Melakukan pengukuran ketercapaian CPL untuk masing -masing bentuk \nMBKM.  \n(ii) Melakukan penilaian dan evaluasi atas proses dan hasil kegiatan MBKM']","Tujuan penjaminan mutu MBKM adalah untuk melakukan pengukuran ketercapaian CPL untuk masing-masing bentuk MBKM, melakukan penilaian dan evaluasi atas proses dan hasil kegiatan MBKM, melakukan pengendalian proses implementasi MBKM, serta melakukan peningkatan implementasi MBKM berdasarkan hasil survey kepuasan pihak internal dan eksternal stakeholder yang terlibat di dalam implementasi MBKM."
10,Apa tujuan dari MBKM?,"Untuk menghasilkan lulusan yang berkualitas dan memenuhi visi, misi, tata nilai, dan tujuan ITS serta memenuhi SN-DIKTI.","['(iii) Kegiatan MBKM da lam bentuk wirausaha  dikembangkan oleh Direktorat yang \nmengurusi Kemahasiswaan.  \n(x) Implementasi  Kegiatan MBKM dalam bentuk wirausaha  dikoordinir oleh Direktorat \nyang mengurusi kemahasiswaan  bersama Prodi terkait , melalui  tahapan kegiatan (a) \npersiapan, (b) Pelaksanaan, (c) Evaluasi, (d) Pengendalian, dan (e) Peningkatan.  \n \n13 Standar Proses –  \nKegiatan MBKM – bentuk Studi \nIndependen  (i) Kegiatan MBKM dalam bentuk Studi/ Proyek Independen dimaksudkan untuk \nmendukung pencapaian profil sebagai inovator yang produktif.  \n(ii) Kegiatan  MBKM dalam bentuk Studi/ Proyek Independen dalam rangka untuk \nmewujudkan gagasan mahasiswa dalam mengembangkan produk inovatif, \nmenyelenggarakan pendidikan berbasis ri set dan pengembangan (R&D) serta \nmeningkatkan prestasi mahasiswa dalam ajang nasional dan internasional.  \n(iii) Kegiatan  MBKM dalam bentuk Studi/ Proyek Independen adalah semua kegiatan untuk', 'meingimplementasi MBKM, dengan tujuan:  \n(i) Melakukan pengukuran ketercapaian CPL untuk masing -masing bentuk \nMBKM.  \n(ii) Melakukan penilaian dan evaluasi atas proses dan hasil kegiatan MBKM  \n(iii) Melakukan pengendalian proses implementasi MBKM  \n(iv) Melakukan peningkatan impleme ntasi MBKM, atas hasil survey kepuasan \npihak internal dan eksternal stakeholder yang terlibat di dalam implementasi \nMBKM.    \n \n \n \n 21 Baku Mutu - MBKM   - 2021', 'NO ELEMEN PENILAIAN  INDIKATOR  \n(1) (2) (3) \nmengurusi riset dan  pengabdian kepada masyarakat . \n(ix) Implementasi MBKM dalam bentuk penelitian/ riset dikembangkan dan dikoordin ir oleh \nDirektorat yang mengurusi riset dan pengabdian kepada masyarakat  bersama Prodi \nterkait ,  melalui tahapan kegiatan (a) persiapan, (b) Pelaksanaan, (c) Evaluasi, (d) \nPengendalian, dan (e) Peningkatan.  \n \n12 Standar Proses –  \nKegiatan MBKM – bentuk \nKewirausahaan  (i) Kegiatan MBKM dalam bentuk wirausaha  dimaksudkan untuk mendukung pencapaian \nprofil sebagai kader pengusaha yang mendukung perkembangan ITS di masa \nmendatang . \n(ii) Kegiatan MBKM dalam bentuk wirausaha  dapat dikonversi ke dalam sks MK sesuai \ndengan ketercapaian CPL atau bentuk lain  \n(iii) Kegiatan MBKM da lam bentuk wirausaha  dikembangkan oleh Direktorat yang \nmengurusi Kemahasiswaan.  \n(x) Implementasi  Kegiatan MBKM dalam bentuk wirausaha  dikoordinir oleh Direktorat', 'meningkatkan prestasi mahasiswa dalam ajang nasional dan internasional.  \n(iii) Kegiatan  MBKM dalam bentuk Studi/ Proyek Independen adalah semua kegiatan untuk  \npenerapan saintek dalam rangka menghasilkan inovasi terdepan (frontie r).  12 Dokumen Panduan Baku Mutu Pelaksanaan MBKM - 2021  \n NO ELEMEN PENILAIAN  INDIKATOR  \n(1) (2) (3) \n(iv) Kegiatan  MBKM dalam bentuk Studi/ Proyek Independen dapat berupa lomba - lomba \nkemahasiswaan atau proyek - proyek untuk memecahkan persoalan di ITS, di \nmasyarakat atau industri.  \n(v) Kegiatan MBKM dalam bentuk  Studi/ Proyek Independen  dapat dikonversika n ke dalam \nsks MK  atau bentuk lain sesuai dengan ketercapaian CPL serta lama waktu proses \nkegiatan.  \n(vi) Kegiatan MBKM dalam bentuk  Studi/ Proyek dikembangkan oleh Direktorat yang \nmengurusi Kemahasiswaan.  \n(vii) Implementasi  Kegiatan MBKM dalam bentuk  Studi/  Proyek  dikoordinir oleh  Direktorat \nyang mengurusi kemahasiswaan  bersama Prodi terkait , melalui tahapan  kegiatan (a)']","Tujuan dari MBKM adalah untuk melakukan pengukuran ketercapaian CPL untuk masing-masing bentuk MBKM, melakukan penilaian dan evaluasi atas proses dan hasil kegiatan MBKM, melakukan pengendalian proses implementasi MBKM, serta melakukan peningkatan implementasi MBKM berdasarkan hasil survey kepuasan pihak internal dan eksternal stakeholder yang terlibat dalam implementasi MBKM."
11,Apa tujuan dari kegiatan magang/ praktik kerja?,"Memperlancar karir lulusan, pengayaan kompetensi mahasiswa, kolaborasi riset, dan kerja sama pengembangan industri.","['dan start -up.  \n(iii) Kegiatan MBKM dalam bentuk magang/ praktik kerja dan kegiatan wirausaha hilirisasi \ndikembangkan oleh  Direktorat yang mengurusi inovasi dan kawasan sains teknologi \nbekerjasama dengan Direktorat yang mengurusi kemahasiswaan . \n(iv) Impl ementasi kegiatan MBKM dalam bentuk  magang/ praktik kerja dan kegiatan \nwirausaha hilirisasi dikoordinir oleh Direktorat yang mengurusi  inovasi dan kawasan \nsains teknologi  bersama Prodi terkait, melalui tahapan  kegiatan (a) persiapan, (b) \nPelaksanaan, (c) Evaluasi, (d) Pengendalian, dan (e) Peningkatan   \n \nIV STANDAR PENILAIAN PEMBELAJARAN  \n11 Standar penilaian  (i) Penilaian atas proses dan hasil pelaksanaan MBKM mengacu pada prinsip penilaian.  \n \n 14 Dokumen Panduan Baku Mutu Pelaksanaan MBKM - 2021  \n NO ELEMEN PENILAIAN  INDIKATOR  \n(1) (2) (3) \nDalam hal mahasiswa mendapatkan nilai mata kuliah pengayaan kurang dari C, maka \nmahasiswa dapat menggantinya dengan mata kuliah pengayaan yang berbeda.', 'kegiatan (a) persiapan, (b) Pelaksanaa n, (c) Evaluasi, (d) Pengendalian, dan (e) \nPeningkatan  \n Standar Proses –  \nKegiatan MBKM – Bentuk \nMagang / Praktik Kerja dan \nWirausaha lingkup Hilirisasi  (i) Kegiatan MBKM dalam bentuk Magang/ Praktik Kerja dan Kegiatan Wirausaha Lingkup \nHilirisasi ditujukan untuk  memperlancar karir lulusan, pengayaan kompetensi \nmahasiswa, kolaborasi magang, wirausaha dan kerja sama pengembangan produk \ninovatif  dalam rangka meraih profil lulusan sebagai  inovator yang produktif.  \n(ii) Kegiatan MBKM dalam bentuk magang/ praktik kerja dan kegiatan wirausaha hilirisasi \ndapat berupa kegiatan penelitian dan pengabdian masyarakat bersama civitas \nakademika yang lain untuk memecahkan persoalan di masyarakat atau indust ri, inkubasi \ndan start -up.  \n(iii) Kegiatan MBKM dalam bentuk magang/ praktik kerja dan kegiatan wirausaha hilirisasi \ndikembangkan oleh  Direktorat yang mengurusi inovasi dan kawasan sains teknologi', '(v) Bentuk kegiatan pengabdian kepada masyarakat merupakan salah satu bentuk 7 Dokumen Panduan Baku Mutu Pelaksanaan MBKM - 2021  \n NO ELEMEN PENILAIAN  INDIKATOR  \n(1) (2) (3) \nimplementasi MK pengayaan dengan bobot 3 (tiga) sks.  \n \n4 Standar Isi  – Pengakuan bobot \nsks (1) Jumlah sks maksimal yang dapat diambil dalam rangka pelaksanaan kegiatan MB – KM \nadalah 40 (empat puluh) sks.  \n(2) Kegiatan magang/ praktik kerja pada program sarjana terapan diimplementasikan dalam \nbentuk mata kuliah wajib sebagai  mata kuliah penciri Fakultas  Vokasi sebesar 14 (empat \nbelas) sks.  \n(3) Konversi kegiatan MB -KM magang dapat dikonversikan ke dalam: (i) MK KP,  \n(ii) beberapa MK gabungan antara KP dengan MK lain dengan kesamaan CP MK,  \n(iii) MK magang dengan maksimum bobot 20 (dua puluh) sks.   \n(4) Kegiatan MBKM – dalam bentuk pertukaran pelajar melalui MK di prodi di luar ITS, \ndengan ketentuan jumlah sks maksimal adalah 20 (dua puluh) sks, yang meliputi mata', 'sesuai dengan kesepakata n tempat magang;  \n(ii) Mahasiswa yang melaksanakan magang dapat melakukan kegiatan praktek / kolaborasi \nriset / kerja sama pengembangan industri / bentu k kegiatan  lain  yang selaras dengan \nCPL’   \n(iii) Mahasiswa yang melaksanakan magang wajib  dibimbing oleh pembimbing internal dari \ndosen ITS dan  pembimbing eksternal dari pihak  instansi / lembaga /  industri  tempat \nmagang ;  \n(iv) Mahasiswa yang melaksanakan magang dapat melakukan kegiatan akademik yang lain \ndengan syarat telah mendapatkan ijin dari pihak penanggung jawab lembaga / badan / \nindustri magang ;  \n(v) Mahasiswa pada waktu melaksanaan magang  tidak harus cuti  studi ;  \n(vi) Mahasiswa yang melaksa nakan magang dapat diberi  memberikan surat keterangan \nhasil kegiatan magang / sertifikat kompetensi  dari lembaga / badan / industri letak \nmagang sesuai dengan ketentuan yang berlaku;  \n 9 Dokumen Panduan Baku Mutu Pelaksanaan MBKM - 2021  \n NO ELEMEN PENILAIAN  INDIKATOR  \n(1) (2) (3)']","Tujuan dari kegiatan magang/ praktik kerja adalah untuk memperlancar karir lulusan, mengaya kompetensi mahasiswa, kolaborasi magang, wirausaha, kerja sama pengembangan produk inovatif, serta meraih profil lulusan sebagai inovator yang produktif. Kegiatan magang juga dapat berupa penelitian, pengabdian masyarakat, inkubasi, dan start-up."
12,Apa yang dimaksud dengan PDDikti?,Pangkalan Data Perguruan Tinggi yang terintegrasi secara nasional.,"['terlibat di dalam pro ses dan hasil pelaksanaan MBKM.  \n(2). SOP yang diterbitkan oleh: (a) Direktorat terkait sebagai koordinator pelaksana \nmasing -masing bentuk MBKM, (b) Prodi sebagai pelaksana MBKM  untuk memandu \ndosen, mahasiswa dan tenaga kependidikan yang terlibat di dalam proses dan hasil \npelaksanaan MBKM.  \nDokumen (1) dan (2) di atas, merupakan manual untuk seluruh stakeholder yang terlibat \ndi dalam implementasi MBKM, yang dapat disusun dalam satu dokumen atau lebih secara \nterpisah. Rambu -rambu dalam penyusunan ke dua dokumen di atas, dengan ketentuan \nmemuat unsur -unsur sebagai berikut, dan dapat dikembangkan sesuai dengan kebutuhan \ndan tujuan pelaksanaan MBKM.  \n1. Tujuan dan ma ksud Manual MBKM  \n2. Luas lingkup Manual MBKM  \na. Manual Penetapan standar  \nb. Manual pelaksanaan standar  \nc. Manual evaluasi standar  \nd. Manual pengendalian pelaksnanaan standar  \ne. Manual peningkatan standar  \n3. Rincian tentang hal yang harus dikerjakan', 'dan start -up.  \n(iii) Kegiatan MBKM dalam bentuk magang/ praktik kerja dan kegiatan wirausaha hilirisasi \ndikembangkan oleh  Direktorat yang mengurusi inovasi dan kawasan sains teknologi \nbekerjasama dengan Direktorat yang mengurusi kemahasiswaan . \n(iv) Impl ementasi kegiatan MBKM dalam bentuk  magang/ praktik kerja dan kegiatan \nwirausaha hilirisasi dikoordinir oleh Direktorat yang mengurusi  inovasi dan kawasan \nsains teknologi  bersama Prodi terkait, melalui tahapan  kegiatan (a) persiapan, (b) \nPelaksanaan, (c) Evaluasi, (d) Pengendalian, dan (e) Peningkatan   \n \nIV STANDAR PENILAIAN PEMBELAJARAN  \n11 Standar penilaian  (i) Penilaian atas proses dan hasil pelaksanaan MBKM mengacu pada prinsip penilaian.  \n \n 14 Dokumen Panduan Baku Mutu Pelaksanaan MBKM - 2021  \n NO ELEMEN PENILAIAN  INDIKATOR  \n(1) (2) (3) \nDalam hal mahasiswa mendapatkan nilai mata kuliah pengayaan kurang dari C, maka \nmahasiswa dapat menggantinya dengan mata kuliah pengayaan yang berbeda.', '(v) Bentuk kegiatan pengabdian kepada masyarakat merupakan salah satu bentuk 7 Dokumen Panduan Baku Mutu Pelaksanaan MBKM - 2021  \n NO ELEMEN PENILAIAN  INDIKATOR  \n(1) (2) (3) \nimplementasi MK pengayaan dengan bobot 3 (tiga) sks.  \n \n4 Standar Isi  – Pengakuan bobot \nsks (1) Jumlah sks maksimal yang dapat diambil dalam rangka pelaksanaan kegiatan MB – KM \nadalah 40 (empat puluh) sks.  \n(2) Kegiatan magang/ praktik kerja pada program sarjana terapan diimplementasikan dalam \nbentuk mata kuliah wajib sebagai  mata kuliah penciri Fakultas  Vokasi sebesar 14 (empat \nbelas) sks.  \n(3) Konversi kegiatan MB -KM magang dapat dikonversikan ke dalam: (i) MK KP,  \n(ii) beberapa MK gabungan antara KP dengan MK lain dengan kesamaan CP MK,  \n(iii) MK magang dengan maksimum bobot 20 (dua puluh) sks.   \n(4) Kegiatan MBKM – dalam bentuk pertukaran pelajar melalui MK di prodi di luar ITS, \ndengan ketentuan jumlah sks maksimal adalah 20 (dua puluh) sks, yang meliputi mata', 'sesuai dengan kesepakata n tempat magang;  \n(ii) Mahasiswa yang melaksanakan magang dapat melakukan kegiatan praktek / kolaborasi \nriset / kerja sama pengembangan industri / bentu k kegiatan  lain  yang selaras dengan \nCPL’   \n(iii) Mahasiswa yang melaksanakan magang wajib  dibimbing oleh pembimbing internal dari \ndosen ITS dan  pembimbing eksternal dari pihak  instansi / lembaga /  industri  tempat \nmagang ;  \n(iv) Mahasiswa yang melaksanakan magang dapat melakukan kegiatan akademik yang lain \ndengan syarat telah mendapatkan ijin dari pihak penanggung jawab lembaga / badan / \nindustri magang ;  \n(v) Mahasiswa pada waktu melaksanaan magang  tidak harus cuti  studi ;  \n(vi) Mahasiswa yang melaksa nakan magang dapat diberi  memberikan surat keterangan \nhasil kegiatan magang / sertifikat kompetensi  dari lembaga / badan / industri letak \nmagang sesuai dengan ketentuan yang berlaku;  \n 9 Dokumen Panduan Baku Mutu Pelaksanaan MBKM - 2021  \n NO ELEMEN PENILAIAN  INDIKATOR  \n(1) (2) (3)']","PDDikti merupakan singkatan dari Pusat Data dan Informasi Pendidikan Tinggi, yang merupakan lembaga yang bertanggung jawab dalam pengelolaan data dan informasi mengenai pendidikan tinggi di Indonesia. PDDikti memiliki peran penting dalam menyediakan data-data yang diperlukan untuk keperluan pengembangan dan evaluasi kebijakan pendidikan tinggi di Indonesia."
13,Berapa jumlah kredit Mata Kuliah KP?,2 SKS,"['2 PRINSIP PPEPP DALAM PENYELENGGARAAN MB -KM \n \nSiklus PPEPP dalam penyelenggaran MB -KM, ditunjukkan di dalam ilustrasi gambar 1.1 di \nbawah ini.  \n \nP: Penetapan   \nP: Pelaksanaan   \nE: Evaluasi  \nP: Pengendalian  \nP: Peningkatan  \n \n \nGambar 2.1 Siklus PPEPP di dalam SPMI  \n \n \n2.1 Penetapan Standar  \nStandar dalam penyelenggaraan MB -KM mengacu pada: (i) SN – Dikti, (ii) Peraturan \nRektor tentang MB -KM, dan (iii) Panduan yang telah dikeluarkan oleh D irektorat \nKemahasiswaan, Direktorat Pendidikan, dan Direktorat Riset dan Pengabdian kepada \nMasyarakat .  \nStandar yang digunakan di dalam penjaminan mutu MB -KM mengacu pada SN Dikti dan \nKebijakan yang telah ditetapkan oleh Rektor ITS yang masih berlaku. Standar tersebut  \ndituliskan di dalam Tabel di bawah ini.  6 Dokumen Panduan Baku Mutu Pelaksanaan MBKM - 2021  \n  \nTabel 2.1 Standar dalam penyelenggaraan MB -KM di   ITS \nNO ELEMEN PENILAIAN  INDIKATOR  \n(1) (2) (3) \nI STANDAR KOMPETENSI LULUSAN', 'transfer kredit  \n(xi) Mekanisme dalam transfer kredit dapat dikembangkan oleh Prodi dan dikoordinasikan \ndengan Direktorat terkait.  \n7 Standar pengolaan – tempat \npelaksanaan MBKM   (1) MBKM dapat dilaksanakan oleh Prodi dengan cara menerima mahasiswa dari perguruan \ntinggi lain . \n(2) Persayaratan MBKM untuk mahasiswa luar ITS , dengan akreditasi Prodi asal mahasiswa \nminimal sama dengan Prodi di ITS.  \n(3) Jumlah mahasiswa dari luar ITS sebagai pelaksana MB -KM dibatasi maksimal sebesar 10 % \n(sepuluh persen) dari daya tampung Program Studi di ITS , kecuali dengan kerjasama \nkhusus.  \n(4) Mekanisme dan penyelenggaraan kegiatan pertukaran pelajar/ kuliah untuk mahasis wa \ndi luar ITS dapat  dikembangkan dan dikoordinasikan oleh Direktorat yang mengurusi \npendidikan bekerjasama dengan Direktorat yang mengurusi pascasarjana dan \npengembangan akademik .', 'c. Jumlah penilaian terhadap pelaksanaan MBKM minimal sebanyak 4 (empat).  \nd. Pelaporan terhadap proses dan hasil penilaian dilakukan oleh Dosen pembimbing \nakademik dalam pelaksanaan MBKM.  \ne. Sistem informasi untuk mempermudah pendataan – implementasi MBKM di Pro di. \n \n2.4 Pengendalian  \nPengendalian pelaksanaan MBKM dilakukan oleh Prodi bersama direktorat dan unit \nterkait, mulai dari perencanaan, pelaksanaan dan pelaporan kegiatan MBKM. \nPengendalian dilakukan atas unsur -unsur yang dikawatirkan akan menyimpang, atau \ntidak memenuhi  standar yang telah ditetapkan.  \n \n \n \n 20 Baku Mutu - MBKM   - 2021  \n \n 3 Penutup  \nBaku mutu MBKM yang disusun sesuai dengan SN Dikti dan kebijakan Rektor ITS \nyang berlaku, sebagai rujukan bagi Direktorat terkait dan Prodi di dalam \nmeingimplementasi MBKM, dengan tujuan:  \n(i) Melakukan pengukuran ketercapaian CPL untuk masing -masing bentuk \nMBKM.  \n(ii) Melakukan penilaian dan evaluasi atas proses dan hasil kegiatan MBKM', 'magang sesuai dengan ketentuan yang berlaku;  \n 9 Dokumen Panduan Baku Mutu Pelaksanaan MBKM - 2021  \n NO ELEMEN PENILAIAN  INDIKATOR  \n(1) (2) (3) \n9 Standar Proses –  \nKegiatan MBKM – bentuk \nPengabdian kepada Masyarakat  (i) Kegiatan MBKM dalam bentuk pengabdian kepada masyarakat  atau selanjutnya \ndikategorikan sebagai KKN  ditujukan untuk pembinaan karakter kebangsaan mahasiswa \nkhususnya untuk menumbuhkan kepedulian terhadap persoalan yang dihadapi \nmasyarakat , sebaga i salah satu CPL dalam aspek Sikap .  \n(ii) Kegiatan MBKM dalam bentuk KKN harus dibawah bimbingan dosen . \n(iii) Kegiatan MBKM dalam bentuk KKN dapat diakui sebagai  tambahan sks atau dapat \ndikompensasi dengan mata kuliah Program Studi yang memiliki capaian pembelajaran \nyang setara.  \n(iv) Kegiatan MBKM dalam bentuk KKN dilaksanakan pada semester 6 (enam) dan 7 (tujuh)  \natau sebelum nya dengan syarat telah lulus tahap persiapan.']",Saya tidak tahu.
14,Kapan SKS KP bisa diambil?,"Bersamaan atau setelah menyelesaikan KP di organisasi (perusahaan, instansi, yayasan)","['yang setara.  \n(iv) Kegiatan MBKM dalam bentuk KKN dilaksanakan pada semester 6 (enam) dan 7 (tujuh)  \natau sebelum nya dengan syarat telah lulus tahap persiapan.  \n(v) Kegiatan MBKM dalam bentuk KKN yang dilaksanakan sebelum semester 6 (enam) dan \n7 (tujuh) dan s udah lulus tahap persiapan , diakui sebagai MBKM dengan sistem tabung \nnilai.  \n(vi) Kegiatan MBKM dalam bentuk KKN  dikembangkan oleh Direktorat yang mengurusi riset \ndan pengabdian kepada masyarakat . \n(vii) Implementasi MBKM dalam bentuk  KKN  dikoordinir oleh Direktorat yang m engurusi  \npengabdian kepada masyarakat bersama  Prodi  terkait , melalui tahapan kegiatan (a) \npersiapan, (b) Pelaksanaan, (c) Evaluasi, (d) Pengendalian, dan (e) Peningkatan . \n \n10 Standar Proses –  \nKegiatan MBKM – bentuk \nPertukaran Pelajar  (i) Kegiatan MBKM dalam bentuk pertukaran pelajar  dimaksudkan untuk mencapai CPL .  \n(ii) Kegiatan MBKM dalam bentuk pertukaran pelajar  dapat dilakukan dengan PT di dalam \nnegeri atau di luar negeri.', 'magang sesuai dengan ketentuan yang berlaku;  \n 9 Dokumen Panduan Baku Mutu Pelaksanaan MBKM - 2021  \n NO ELEMEN PENILAIAN  INDIKATOR  \n(1) (2) (3) \n9 Standar Proses –  \nKegiatan MBKM – bentuk \nPengabdian kepada Masyarakat  (i) Kegiatan MBKM dalam bentuk pengabdian kepada masyarakat  atau selanjutnya \ndikategorikan sebagai KKN  ditujukan untuk pembinaan karakter kebangsaan mahasiswa \nkhususnya untuk menumbuhkan kepedulian terhadap persoalan yang dihadapi \nmasyarakat , sebaga i salah satu CPL dalam aspek Sikap .  \n(ii) Kegiatan MBKM dalam bentuk KKN harus dibawah bimbingan dosen . \n(iii) Kegiatan MBKM dalam bentuk KKN dapat diakui sebagai  tambahan sks atau dapat \ndikompensasi dengan mata kuliah Program Studi yang memiliki capaian pembelajaran \nyang setara.  \n(iv) Kegiatan MBKM dalam bentuk KKN dilaksanakan pada semester 6 (enam) dan 7 (tujuh)  \natau sebelum nya dengan syarat telah lulus tahap persiapan.', 'NO ELEMEN PENILAIAN  INDIKATOR  \n(1) (2) (3) \natau kombinasi keduanya  \n6 Standar Proses – Tempat \npelaksanaan MBKM  Tempat k egiatan MB – KM dapat dilaksanakan di luar Program Studi baik yang ada di internal \nITS maupun di luar ITS . \n7 Standar Proses –  \nLama waktu pelaksanaan \nMBKM  Lama waktu pelaksanaan MBKM, dapat dikonvesi ke MK, dengan syarat:  \ni. Lama kegiatan belajar dapat dikonversi ke dalam sks adalah minimal 2720 menit atau \n45.3 jam.  \nii. Lama kegiatan bentuk MBKM dihitung atas waktu untuk:  (a) persiapan  di tempat \nMBKM , (b) pelaksanaan, (c) penilaian, dan  (d)  pelaporan.  \niii. Lama waktu kegiatan MB -KM bentuk magang, minimal 3 bulan dan maksimal 6 bulan.  \n8 Standar Proses –  \nKegiatan akademik selama  \nMBKM  – bentuk magang  (i) Mahasiswa yang melaksakan magang harus bekerja di lapangan secara penuh waktu \nsesuai dengan kesepakata n tempat magang;  \n(ii) Mahasiswa yang melaksanakan magang dapat melakukan kegiatan praktek / kolaborasi', 'pelaksanaan MBKM  \n(v) Ketersediaan doku men panduan  17 Dokumen Panduan Baku Mutu Pelaksanaan MBKM - 2021  \n NO ELEMEN PENILAIAN  INDIKATOR  \n(1) (2) (3) \n(vi) Keterlaksanaan penjaminan mutu internal di UPPS dan Prodi dalam pelaksanaan \nMBKM, meliputi: (a) perencanaan kurikulum dan bentuk MBKM, (b) pelaksanaan \nMBKM, (c) evaluasi pelaksanaan MBKM, (d) pengendalian, dan (e) peningkatan \nimplementasi MBKM  di waktu berikutnya  18 Dokumen Panduan Baku Mutu Pelaksanaan MBKM - 2021  \n 2.2 Implementasi Standar MBKM   \nImplementasi dalam penjaminan mutu MBKM, dilengkapi dengan beberapa dokumen, \nyaitu:  \n(1). Dokumen Panduan pelaksanaan MBKM yang diterbitkan oleh: (a) Direktorat terkait \nsebagai koordinator pelaksana masing -masing bentuk MBKM, (b) Prodi sebagai \npelaksana MBKM  untuk memandu dosen, mahasiswa dan tenaga kependidikan yang \nterlibat di dalam pro ses dan hasil pelaksanaan MBKM.  \n(2). SOP yang diterbitkan oleh: (a) Direktorat terkait sebagai koordinator pelaksana']",SKS KP bisa diambil setelah mahasiswa telah lulus tahap persiapan dan menjalani KKN pada semester 6 (enam) dan 7 (tujuh) atau sebelumnya dengan syarat telah lulus tahap persiapan.
15,Apakah KP bisa dilakukan secara berkelompok?,"Ya, maksimal 2 (dua) mahasiswa","['magang sesuai dengan ketentuan yang berlaku;  \n 9 Dokumen Panduan Baku Mutu Pelaksanaan MBKM - 2021  \n NO ELEMEN PENILAIAN  INDIKATOR  \n(1) (2) (3) \n9 Standar Proses –  \nKegiatan MBKM – bentuk \nPengabdian kepada Masyarakat  (i) Kegiatan MBKM dalam bentuk pengabdian kepada masyarakat  atau selanjutnya \ndikategorikan sebagai KKN  ditujukan untuk pembinaan karakter kebangsaan mahasiswa \nkhususnya untuk menumbuhkan kepedulian terhadap persoalan yang dihadapi \nmasyarakat , sebaga i salah satu CPL dalam aspek Sikap .  \n(ii) Kegiatan MBKM dalam bentuk KKN harus dibawah bimbingan dosen . \n(iii) Kegiatan MBKM dalam bentuk KKN dapat diakui sebagai  tambahan sks atau dapat \ndikompensasi dengan mata kuliah Program Studi yang memiliki capaian pembelajaran \nyang setara.  \n(iv) Kegiatan MBKM dalam bentuk KKN dilaksanakan pada semester 6 (enam) dan 7 (tujuh)  \natau sebelum nya dengan syarat telah lulus tahap persiapan.', 'yang setara.  \n(iv) Kegiatan MBKM dalam bentuk KKN dilaksanakan pada semester 6 (enam) dan 7 (tujuh)  \natau sebelum nya dengan syarat telah lulus tahap persiapan.  \n(v) Kegiatan MBKM dalam bentuk KKN yang dilaksanakan sebelum semester 6 (enam) dan \n7 (tujuh) dan s udah lulus tahap persiapan , diakui sebagai MBKM dengan sistem tabung \nnilai.  \n(vi) Kegiatan MBKM dalam bentuk KKN  dikembangkan oleh Direktorat yang mengurusi riset \ndan pengabdian kepada masyarakat . \n(vii) Implementasi MBKM dalam bentuk  KKN  dikoordinir oleh Direktorat yang m engurusi  \npengabdian kepada masyarakat bersama  Prodi  terkait , melalui tahapan kegiatan (a) \npersiapan, (b) Pelaksanaan, (c) Evaluasi, (d) Pengendalian, dan (e) Peningkatan . \n \n10 Standar Proses –  \nKegiatan MBKM – bentuk \nPertukaran Pelajar  (i) Kegiatan MBKM dalam bentuk pertukaran pelajar  dimaksudkan untuk mencapai CPL .  \n(ii) Kegiatan MBKM dalam bentuk pertukaran pelajar  dapat dilakukan dengan PT di dalam \nnegeri atau di luar negeri.', 'NO ELEMEN PENILAIAN  INDIKATOR  \n(1) (2) (3) \nperjanjian kerjasama antar ITS dengan  instansi / lembaga / i ndustri tempat magang  \n(vii) Kegiatan MB -KM hanya bisa dilaksanakan dengan: a. Perguruan tinggi yang \nmempunyai rangking setara atau lebih tinggi dari ITS, b. Perguruan tinggi yang \nmempunyai MoU dengan ITS; atau c. Lembaga non perguruan ting gi yang mempunyai \nMoU dengan ITS.  \n(viii) Kegiatan MB -KM dalam bentuk kuliah dapat dilakukan di Prodi yang mempunyai nilai \nakreditasi minimal dengan Prodi asal di ITS  \n(ix) Kegiatan MB -KM dapat di alih kreditkan menjadi sks MK Prodi, melalui mekanisme \npemeriksaan kese suaian dengan CPL  \n(x) Pemeriksa kesesuaian CPL dilakukan oleh Prodi atau Direktorat bersama tim pelaksana \ntransfer kredit  \n(xi) Mekanisme dalam transfer kredit dapat dikembangkan oleh Prodi dan dikoordinasikan \ndengan Direktorat terkait.  \n7 Standar pengolaan – tempat', 'di luar ITS dapat  dikembangkan dan dikoordinasikan oleh Direktorat yang mengurusi \npendidikan bekerjasama dengan Direktorat yang mengurusi pascasarjana dan \npengembangan akademik . \n(5) Direktorat yang mengurusi kegiatan pertukaran pelajar/ kuliah dalam negeri harus 16 Dokumen Panduan Baku Mutu Pelaksanaan MBKM - 2021  \n NO ELEMEN PENILAIAN  INDIKATOR  \n(1) (2) (3) \nberkoordinasi dengan Program Studi terkait . \n Standar Pengelolaan – \nPerencanaan MBKM  1. Prodi mempunyai Dokumen panduan untuk implementasi MBKM / turunan dokumen \nPerek 21 tahun 202 1 yang menjadi konsideran  implementasi MBKM . \n2. Prodi mempunyai kurikulum implementasi MBKM, yang meliputi CPL yang ditetapkan \nsesuai dengan implementasi MBKM dan peta CPL – MK MBKM  \n3.  Prodi mempunyai Dokumen panduan untuk Dosen  Wali dan Dosen Pembimbing dalam \npelaksanaan MBKM   \n4. Prodi mempunyai Dokumen pan duan untuk Mahasiswa dalam perencanaan , \npelaksannaan, penilaian pelaksanaan  MBKM']","KP (Kuliah Kerja Praktek) biasanya dilakukan secara individu, namun dalam beberapa kasus tertentu, KP juga bisa dilakukan secara berkelompok. Namun, hal ini tergantung pada kebijakan dan persetujuan dari institusi pendidikan atau tempat KP dilakukan. Jika ingin melakukan KP secara berkelompok, mahasiswa perlu memastikan bahwa hal tersebut diizinkan dan sesuai dengan ketentuan yang berlaku."
16,Apa syarat mengajukan KP?,"Mahasiswa aktif Teknik Informatika, SKS tempuh minimum 90 SKS","['magang sesuai dengan ketentuan yang berlaku;  \n 9 Dokumen Panduan Baku Mutu Pelaksanaan MBKM - 2021  \n NO ELEMEN PENILAIAN  INDIKATOR  \n(1) (2) (3) \n9 Standar Proses –  \nKegiatan MBKM – bentuk \nPengabdian kepada Masyarakat  (i) Kegiatan MBKM dalam bentuk pengabdian kepada masyarakat  atau selanjutnya \ndikategorikan sebagai KKN  ditujukan untuk pembinaan karakter kebangsaan mahasiswa \nkhususnya untuk menumbuhkan kepedulian terhadap persoalan yang dihadapi \nmasyarakat , sebaga i salah satu CPL dalam aspek Sikap .  \n(ii) Kegiatan MBKM dalam bentuk KKN harus dibawah bimbingan dosen . \n(iii) Kegiatan MBKM dalam bentuk KKN dapat diakui sebagai  tambahan sks atau dapat \ndikompensasi dengan mata kuliah Program Studi yang memiliki capaian pembelajaran \nyang setara.  \n(iv) Kegiatan MBKM dalam bentuk KKN dilaksanakan pada semester 6 (enam) dan 7 (tujuh)  \natau sebelum nya dengan syarat telah lulus tahap persiapan.', 'yang setara.  \n(iv) Kegiatan MBKM dalam bentuk KKN dilaksanakan pada semester 6 (enam) dan 7 (tujuh)  \natau sebelum nya dengan syarat telah lulus tahap persiapan.  \n(v) Kegiatan MBKM dalam bentuk KKN yang dilaksanakan sebelum semester 6 (enam) dan \n7 (tujuh) dan s udah lulus tahap persiapan , diakui sebagai MBKM dengan sistem tabung \nnilai.  \n(vi) Kegiatan MBKM dalam bentuk KKN  dikembangkan oleh Direktorat yang mengurusi riset \ndan pengabdian kepada masyarakat . \n(vii) Implementasi MBKM dalam bentuk  KKN  dikoordinir oleh Direktorat yang m engurusi  \npengabdian kepada masyarakat bersama  Prodi  terkait , melalui tahapan kegiatan (a) \npersiapan, (b) Pelaksanaan, (c) Evaluasi, (d) Pengendalian, dan (e) Peningkatan . \n \n10 Standar Proses –  \nKegiatan MBKM – bentuk \nPertukaran Pelajar  (i) Kegiatan MBKM dalam bentuk pertukaran pelajar  dimaksudkan untuk mencapai CPL .  \n(ii) Kegiatan MBKM dalam bentuk pertukaran pelajar  dapat dilakukan dengan PT di dalam \nnegeri atau di luar negeri.', 'pelaksanaan MBKM  \n(v) Ketersediaan doku men panduan  17 Dokumen Panduan Baku Mutu Pelaksanaan MBKM - 2021  \n NO ELEMEN PENILAIAN  INDIKATOR  \n(1) (2) (3) \n(vi) Keterlaksanaan penjaminan mutu internal di UPPS dan Prodi dalam pelaksanaan \nMBKM, meliputi: (a) perencanaan kurikulum dan bentuk MBKM, (b) pelaksanaan \nMBKM, (c) evaluasi pelaksanaan MBKM, (d) pengendalian, dan (e) peningkatan \nimplementasi MBKM  di waktu berikutnya  18 Dokumen Panduan Baku Mutu Pelaksanaan MBKM - 2021  \n 2.2 Implementasi Standar MBKM   \nImplementasi dalam penjaminan mutu MBKM, dilengkapi dengan beberapa dokumen, \nyaitu:  \n(1). Dokumen Panduan pelaksanaan MBKM yang diterbitkan oleh: (a) Direktorat terkait \nsebagai koordinator pelaksana masing -masing bentuk MBKM, (b) Prodi sebagai \npelaksana MBKM  untuk memandu dosen, mahasiswa dan tenaga kependidikan yang \nterlibat di dalam pro ses dan hasil pelaksanaan MBKM.  \n(2). SOP yang diterbitkan oleh: (a) Direktorat terkait sebagai koordinator pelaksana', 'Tabel 2.1 Standar dalam penyelenggaraan MB -KM di   ITS \nNO ELEMEN PENILAIAN  INDIKATOR  \n(1) (2) (3) \nI STANDAR KOMPETENSI LULUSAN  \n1 Standar Kompetensi Lulusan  (i) Pelaksanaan MBKM mengacu pada CPL Prodi sebagai target dari kemampuan lulusan, \ndengan minimal pencapaian 80%  CPL dan atau sebagai kompetensi tambahan  \n(ii) Kompetensi tambahan dimaksudkan untuk memperlancar karir lulusan, kolaborasi riset \ndan atau kerja sama p engembangan industri.  \nII STANDAR ISI PEMBELAJARAN  \n2 Standar Isi  – MK Pengayaan  (i) Prodi menyediakan kurikulum untuk pelaksanaan MBKM yang disusun bersama \npemangku kepentingan internal dan eksternal, serta direview oleh pakar bidang ilmu \nprogram studi nya.  \n(ii) Keterjaminan pemenuhan CPL  melalui MBKM ( ketersediaan matrik / peta CPL - MK \nMBKM ), dan ketersediaan modul MK melalui pembelajaran  untuk MK yang \ndilaksanakan secara MBKM']",Syarat mengajukan KP adalah telah lulus tahap persiapan dan dilaksanakan pada semester 6 (enam) dan 7 (tujuh) atau sebelumnya dengan syarat telah lulus tahap persiapan. Kegiatan KP juga harus dibawah bimbingan dosen dan dapat diakui sebagai tambahan SKS atau dapat dikompensasi dengan mata kuliah Program Studi yang memiliki capaian pembelajaran yang setara.
17,Apa yang harus dilakukan mahasiswa di lokasi KP?,"Mematuhi dan mengikuti segala aturan terkait kerja praktik, dan mengerjakan pekerjaan yang sesuai dengan kompetensi Informatika","['magang sesuai dengan ketentuan yang berlaku;  \n 9 Dokumen Panduan Baku Mutu Pelaksanaan MBKM - 2021  \n NO ELEMEN PENILAIAN  INDIKATOR  \n(1) (2) (3) \n9 Standar Proses –  \nKegiatan MBKM – bentuk \nPengabdian kepada Masyarakat  (i) Kegiatan MBKM dalam bentuk pengabdian kepada masyarakat  atau selanjutnya \ndikategorikan sebagai KKN  ditujukan untuk pembinaan karakter kebangsaan mahasiswa \nkhususnya untuk menumbuhkan kepedulian terhadap persoalan yang dihadapi \nmasyarakat , sebaga i salah satu CPL dalam aspek Sikap .  \n(ii) Kegiatan MBKM dalam bentuk KKN harus dibawah bimbingan dosen . \n(iii) Kegiatan MBKM dalam bentuk KKN dapat diakui sebagai  tambahan sks atau dapat \ndikompensasi dengan mata kuliah Program Studi yang memiliki capaian pembelajaran \nyang setara.  \n(iv) Kegiatan MBKM dalam bentuk KKN dilaksanakan pada semester 6 (enam) dan 7 (tujuh)  \natau sebelum nya dengan syarat telah lulus tahap persiapan.', '(4) Kegiatan MBKM – dalam bentuk pertukaran pelajar melalui MK di prodi di luar ITS, \ndengan ketentuan jumlah sks maksimal adalah 20 (dua puluh) sks, yang meliputi mata \nkuliah inti dan mata kuliah non inti.  \nIII STANDAR PROSES PEMBELAJARAN  \n5 Standar Proses –bentuk \npembelajaran MBKM  (i) Mahasiswa dapat melaksanakan kegiatan pembelajaran MBKM dalam rangka meraih CPL \nProdi dalam bentuk satu atau lebih bentuk berikut ini:  \na. Magang/ Praktik Kerja;  \nb. Membangun Desa/ Kuliah Kerja Nyata Tematik;  \nc. Pertukaran Pelajar;  \nd. Proyek Kemanusiaan;  \ne. Penelitian/ Riset;  \nf. Kegiatan Wirausaha;  \ng. Studi/ Proyek Independen; dan  \nh. Asistensi Mengajar di Satuan Pendidikan  \n(ii)  Pelaksanaan MB -KM bentuk (a) sd (h) dapat dilaksanakan dalam bentuk  online, offline 8 Dokumen Panduan Baku Mutu Pelaksanaan MBKM - 2021  \n NO ELEMEN PENILAIAN  INDIKATOR  \n(1) (2) (3) \natau kombinasi keduanya  \n6 Standar Proses – Tempat', 'yang setara.  \n(iv) Kegiatan MBKM dalam bentuk KKN dilaksanakan pada semester 6 (enam) dan 7 (tujuh)  \natau sebelum nya dengan syarat telah lulus tahap persiapan.  \n(v) Kegiatan MBKM dalam bentuk KKN yang dilaksanakan sebelum semester 6 (enam) dan \n7 (tujuh) dan s udah lulus tahap persiapan , diakui sebagai MBKM dengan sistem tabung \nnilai.  \n(vi) Kegiatan MBKM dalam bentuk KKN  dikembangkan oleh Direktorat yang mengurusi riset \ndan pengabdian kepada masyarakat . \n(vii) Implementasi MBKM dalam bentuk  KKN  dikoordinir oleh Direktorat yang m engurusi  \npengabdian kepada masyarakat bersama  Prodi  terkait , melalui tahapan kegiatan (a) \npersiapan, (b) Pelaksanaan, (c) Evaluasi, (d) Pengendalian, dan (e) Peningkatan . \n \n10 Standar Proses –  \nKegiatan MBKM – bentuk \nPertukaran Pelajar  (i) Kegiatan MBKM dalam bentuk pertukaran pelajar  dimaksudkan untuk mencapai CPL .  \n(ii) Kegiatan MBKM dalam bentuk pertukaran pelajar  dapat dilakukan dengan PT di dalam \nnegeri atau di luar negeri.', 'mulai dari perencanaan, pelaksanaan, moneitoring dan evaluasi, serta pelaporan \nMBKM.  \n \nVI STANDAR PENGELOLAAN PEMBELAJARAN   \n6 Standar pengelolaan  (i) Tempat pelaksanaan MBKM dapat dilakukan di dalam ITS atau di luar ITS.  \n(ii) Tempat pelaksanaan di dalam ITS adalah Prodi lain di dalam ITS, dalam bentuk MK \npengayaan  \n(iii) Tempat lain di luar ITS, dapat berada pada Prodi yang sama atau Prodi berbeda di PT \nlain, atau institusi di luar PT.  \n(iv) PT lain dapat berada di dalam negeri atau di luar negeri . \n(v) Institusi lain di luar PT, dapat berbentuk lembaga / badan / industri dengan memenuhi \nkriteria yang ditentukan oleh Prodi atau Direktorat.  \n(vi) Kegiatan MBKM -magang harus didahului oleh ketersediaan  nota kesepahaman dan 15 Dokumen Panduan Baku Mutu Pelaksanaan MBKM - 2021  \n NO ELEMEN PENILAIAN  INDIKATOR  \n(1) (2) (3) \nperjanjian kerjasama antar ITS dengan  instansi / lembaga / i ndustri tempat magang']","Mahasiswa di lokasi KP harus melaksanakan kegiatan magang sesuai dengan ketentuan yang berlaku. Kegiatan magang harus dilakukan dengan bimbingan dosen, dan dapat diakui sebagai tambahan SKS atau dikompensasi dengan mata kuliah Program Studi yang memiliki capaian pembelajaran yang setara. Kegiatan magang dilaksanakan pada semester 6 dan 7 atau sebelumnya dengan syarat telah lulus tahap persiapan."
18,Kapan batas waktu penyerahan laporan KP?,Paling lambat 1 bulan setelah tanggal selesainya kerja praktek di perusahaan,"['yang setara.  \n(iv) Kegiatan MBKM dalam bentuk KKN dilaksanakan pada semester 6 (enam) dan 7 (tujuh)  \natau sebelum nya dengan syarat telah lulus tahap persiapan.  \n(v) Kegiatan MBKM dalam bentuk KKN yang dilaksanakan sebelum semester 6 (enam) dan \n7 (tujuh) dan s udah lulus tahap persiapan , diakui sebagai MBKM dengan sistem tabung \nnilai.  \n(vi) Kegiatan MBKM dalam bentuk KKN  dikembangkan oleh Direktorat yang mengurusi riset \ndan pengabdian kepada masyarakat . \n(vii) Implementasi MBKM dalam bentuk  KKN  dikoordinir oleh Direktorat yang m engurusi  \npengabdian kepada masyarakat bersama  Prodi  terkait , melalui tahapan kegiatan (a) \npersiapan, (b) Pelaksanaan, (c) Evaluasi, (d) Pengendalian, dan (e) Peningkatan . \n \n10 Standar Proses –  \nKegiatan MBKM – bentuk \nPertukaran Pelajar  (i) Kegiatan MBKM dalam bentuk pertukaran pelajar  dimaksudkan untuk mencapai CPL .  \n(ii) Kegiatan MBKM dalam bentuk pertukaran pelajar  dapat dilakukan dengan PT di dalam \nnegeri atau di luar negeri.', 'magang sesuai dengan ketentuan yang berlaku;  \n 9 Dokumen Panduan Baku Mutu Pelaksanaan MBKM - 2021  \n NO ELEMEN PENILAIAN  INDIKATOR  \n(1) (2) (3) \n9 Standar Proses –  \nKegiatan MBKM – bentuk \nPengabdian kepada Masyarakat  (i) Kegiatan MBKM dalam bentuk pengabdian kepada masyarakat  atau selanjutnya \ndikategorikan sebagai KKN  ditujukan untuk pembinaan karakter kebangsaan mahasiswa \nkhususnya untuk menumbuhkan kepedulian terhadap persoalan yang dihadapi \nmasyarakat , sebaga i salah satu CPL dalam aspek Sikap .  \n(ii) Kegiatan MBKM dalam bentuk KKN harus dibawah bimbingan dosen . \n(iii) Kegiatan MBKM dalam bentuk KKN dapat diakui sebagai  tambahan sks atau dapat \ndikompensasi dengan mata kuliah Program Studi yang memiliki capaian pembelajaran \nyang setara.  \n(iv) Kegiatan MBKM dalam bentuk KKN dilaksanakan pada semester 6 (enam) dan 7 (tujuh)  \natau sebelum nya dengan syarat telah lulus tahap persiapan.', 'c. Jumlah penilaian terhadap pelaksanaan MBKM minimal sebanyak 4 (empat).  \nd. Pelaporan terhadap proses dan hasil penilaian dilakukan oleh Dosen pembimbing \nakademik dalam pelaksanaan MBKM.  \ne. Sistem informasi untuk mempermudah pendataan – implementasi MBKM di Pro di. \n \n2.4 Pengendalian  \nPengendalian pelaksanaan MBKM dilakukan oleh Prodi bersama direktorat dan unit \nterkait, mulai dari perencanaan, pelaksanaan dan pelaporan kegiatan MBKM. \nPengendalian dilakukan atas unsur -unsur yang dikawatirkan akan menyimpang, atau \ntidak memenuhi  standar yang telah ditetapkan.  \n \n \n \n 20 Baku Mutu - MBKM   - 2021  \n \n 3 Penutup  \nBaku mutu MBKM yang disusun sesuai dengan SN Dikti dan kebijakan Rektor ITS \nyang berlaku, sebagai rujukan bagi Direktorat terkait dan Prodi di dalam \nmeingimplementasi MBKM, dengan tujuan:  \n(i) Melakukan pengukuran ketercapaian CPL untuk masing -masing bentuk \nMBKM.  \n(ii) Melakukan penilaian dan evaluasi atas proses dan hasil kegiatan MBKM', 'NO ELEMEN PENILAIAN  INDIKATOR  \n(1) (2) (3) \natau kombinasi keduanya  \n6 Standar Proses – Tempat \npelaksanaan MBKM  Tempat k egiatan MB – KM dapat dilaksanakan di luar Program Studi baik yang ada di internal \nITS maupun di luar ITS . \n7 Standar Proses –  \nLama waktu pelaksanaan \nMBKM  Lama waktu pelaksanaan MBKM, dapat dikonvesi ke MK, dengan syarat:  \ni. Lama kegiatan belajar dapat dikonversi ke dalam sks adalah minimal 2720 menit atau \n45.3 jam.  \nii. Lama kegiatan bentuk MBKM dihitung atas waktu untuk:  (a) persiapan  di tempat \nMBKM , (b) pelaksanaan, (c) penilaian, dan  (d)  pelaporan.  \niii. Lama waktu kegiatan MB -KM bentuk magang, minimal 3 bulan dan maksimal 6 bulan.  \n8 Standar Proses –  \nKegiatan akademik selama  \nMBKM  – bentuk magang  (i) Mahasiswa yang melaksakan magang harus bekerja di lapangan secara penuh waktu \nsesuai dengan kesepakata n tempat magang;  \n(ii) Mahasiswa yang melaksanakan magang dapat melakukan kegiatan praktek / kolaborasi']",Saya tidak menemukan informasi mengenai batas waktu penyerahan laporan KP dalam konteks yang diberikan.
19,Bagaimana format nama file untuk laporan KP dengan pengarang tunggal?,NRP-Project_Report,"['magang sesuai dengan ketentuan yang berlaku;  \n 9 Dokumen Panduan Baku Mutu Pelaksanaan MBKM - 2021  \n NO ELEMEN PENILAIAN  INDIKATOR  \n(1) (2) (3) \n9 Standar Proses –  \nKegiatan MBKM – bentuk \nPengabdian kepada Masyarakat  (i) Kegiatan MBKM dalam bentuk pengabdian kepada masyarakat  atau selanjutnya \ndikategorikan sebagai KKN  ditujukan untuk pembinaan karakter kebangsaan mahasiswa \nkhususnya untuk menumbuhkan kepedulian terhadap persoalan yang dihadapi \nmasyarakat , sebaga i salah satu CPL dalam aspek Sikap .  \n(ii) Kegiatan MBKM dalam bentuk KKN harus dibawah bimbingan dosen . \n(iii) Kegiatan MBKM dalam bentuk KKN dapat diakui sebagai  tambahan sks atau dapat \ndikompensasi dengan mata kuliah Program Studi yang memiliki capaian pembelajaran \nyang setara.  \n(iv) Kegiatan MBKM dalam bentuk KKN dilaksanakan pada semester 6 (enam) dan 7 (tujuh)  \natau sebelum nya dengan syarat telah lulus tahap persiapan.', 'di luar ITS dapat  dikembangkan dan dikoordinasikan oleh Direktorat yang mengurusi \npendidikan bekerjasama dengan Direktorat yang mengurusi pascasarjana dan \npengembangan akademik . \n(5) Direktorat yang mengurusi kegiatan pertukaran pelajar/ kuliah dalam negeri harus 16 Dokumen Panduan Baku Mutu Pelaksanaan MBKM - 2021  \n NO ELEMEN PENILAIAN  INDIKATOR  \n(1) (2) (3) \nberkoordinasi dengan Program Studi terkait . \n Standar Pengelolaan – \nPerencanaan MBKM  1. Prodi mempunyai Dokumen panduan untuk implementasi MBKM / turunan dokumen \nPerek 21 tahun 202 1 yang menjadi konsideran  implementasi MBKM . \n2. Prodi mempunyai kurikulum implementasi MBKM, yang meliputi CPL yang ditetapkan \nsesuai dengan implementasi MBKM dan peta CPL – MK MBKM  \n3.  Prodi mempunyai Dokumen panduan untuk Dosen  Wali dan Dosen Pembimbing dalam \npelaksanaan MBKM   \n4. Prodi mempunyai Dokumen pan duan untuk Mahasiswa dalam perencanaan , \npelaksannaan, penilaian pelaksanaan  MBKM', 'terlibat di dalam pro ses dan hasil pelaksanaan MBKM.  \n(2). SOP yang diterbitkan oleh: (a) Direktorat terkait sebagai koordinator pelaksana \nmasing -masing bentuk MBKM, (b) Prodi sebagai pelaksana MBKM  untuk memandu \ndosen, mahasiswa dan tenaga kependidikan yang terlibat di dalam proses dan hasil \npelaksanaan MBKM.  \nDokumen (1) dan (2) di atas, merupakan manual untuk seluruh stakeholder yang terlibat \ndi dalam implementasi MBKM, yang dapat disusun dalam satu dokumen atau lebih secara \nterpisah. Rambu -rambu dalam penyusunan ke dua dokumen di atas, dengan ketentuan \nmemuat unsur -unsur sebagai berikut, dan dapat dikembangkan sesuai dengan kebutuhan \ndan tujuan pelaksanaan MBKM.  \n1. Tujuan dan ma ksud Manual MBKM  \n2. Luas lingkup Manual MBKM  \na. Manual Penetapan standar  \nb. Manual pelaksanaan standar  \nc. Manual evaluasi standar  \nd. Manual pengendalian pelaksnanaan standar  \ne. Manual peningkatan standar  \n3. Rincian tentang hal yang harus dikerjakan', 'NO ELEMEN PENILAIAN  INDIKATOR  \n(1) (2) (3) \nmengurusi riset dan  pengabdian kepada masyarakat . \n(ix) Implementasi MBKM dalam bentuk penelitian/ riset dikembangkan dan dikoordin ir oleh \nDirektorat yang mengurusi riset dan pengabdian kepada masyarakat  bersama Prodi \nterkait ,  melalui tahapan kegiatan (a) persiapan, (b) Pelaksanaan, (c) Evaluasi, (d) \nPengendalian, dan (e) Peningkatan.  \n \n12 Standar Proses –  \nKegiatan MBKM – bentuk \nKewirausahaan  (i) Kegiatan MBKM dalam bentuk wirausaha  dimaksudkan untuk mendukung pencapaian \nprofil sebagai kader pengusaha yang mendukung perkembangan ITS di masa \nmendatang . \n(ii) Kegiatan MBKM dalam bentuk wirausaha  dapat dikonversi ke dalam sks MK sesuai \ndengan ketercapaian CPL atau bentuk lain  \n(iii) Kegiatan MBKM da lam bentuk wirausaha  dikembangkan oleh Direktorat yang \nmengurusi Kemahasiswaan.  \n(x) Implementasi  Kegiatan MBKM dalam bentuk wirausaha  dikoordinir oleh Direktorat']",FORMAT NAMA FILE UNTUK LAPORAN KP DENGAN PENGAARANG TUNGGAL adalah [Nama Pengarang]_[NIM]_LaporanKP.
