,question,ground_truth,contexts,answer
0,Apa visi ITS?,Menjadi perguruan tinggi dengan reputasi internasional dalam ilmu pengetahuan dan teknologi terutama yang menunjang industri dan kelautan yang berwawasan lingkungan.,"['ERICHA VALENTINA\n5015201016\nS1 Perencanaan Wilayah d Vely Kukinul Siswanto\n\n\nFALDI FAKHRI\n5015201128\nS1 Perencanaan Wilayah d I Dewa Made Frendika S\n\nKK\nTerdapat inkonsistensi data / data yang belum diisi pada registras\nTerdapat laporan mingguan dengan foto aktivitas yang belum diis\nTerdapat laporan mingguan dengan foto aktivitas yang belum diis\nTerdapat laporan mingguan dengan foto aktivitas yang belum diis\nTerdapat laporan mingguan dengan foto aktivitas yang belum diis\nTerdapat laporan mingguan dengan foto aktivitas yang belum diis\nTerdapat laporan mingguan dengan foto aktivitas yang belum diis -\nits.id/ListSIMMagang\n+\nMix\nGenap 22/23\nGasal 23/24\nKementerian Pendidikan, Kebudayaan, Riset dan\nTeknologi\n\nSubdit. PK2\nADVANCING HUMANITY\niTS\nh\n4\nOverview MSIB 6\nd\n2023', 'Subdit. PK2\nSKEMA PELAKSANAAN\nPROGRAM MAGANG\nMANDIRI DI ITS\nMahasiswa / Departemen melakukan\nmenyertakan:\n1. Proposal Magang\n2. Surat Rekomendasi Departemen\n3. Surat Penerimaan Magang\nPelaksanaan Magang\nProses pengurusan\nPKS\nPKS tidak\ndisetujui\nPKS\nTertandatangan\nSelesai\nMagang berakhir <\nMahasiswa mendapatkan\nSertifikat / Penilaian Magang\nSelesai\nADVANCING HUMANITY\niTS\nMulai\nMahasiswa mengurus\nsurat rekomendasi\ndepartemen untuk pengajuan magang ke\nMitra\nMahasiswa mengajukan\npermohonan magang ke\nMitra\nMitra melakukan seleksi magang\nMahasiswa menerima hasil seleksi magang dari Mitra\nTidak diterima\nSelesai\nDiterima\nMahasiswa melaporkan\nke Departemen', 'juga dapat memanfaatkan Program Holistik Pembinaan dan Pemberdayaan Desa \n(PHP2D) dengan mengikuti prosedur dari Direktorat Belmawa.\n27       Buku Panduan Merdeka Belajar - Kampus Merdeka\nContoh Model KKNT Pembangunan dan Pemberdayaan bersama Kemendes\nContoh Model KKNT Pembangunan dan Pemberdayaan bersama Mitra\nBuku Panduan Merdeka Belajar - Kampus Merdeka       28\n3) Model KKNT Mengajar di Desa\nPelaksanaan kegiatan ini diutamakan pada mahasiswa program studi Pendidikan. \nBagi mahasiswa di luar program studi Pendidikan dapat melakukan kegiatan \nmengajar sesuai dengan bidang keahlian dalam rangka pemberdayaan \nmasyarakat misalnya penerapan teknologi tepat guna. Semua kegiatan KKNT \nmengajar ini bersifat membantu pengajaran formal dan non-formal. Bila di akhir \nkegiatan ini akan dijadikan sebagai tugas akhir, maka harus direncanakan sejak \nawal dalam bentuk proposal yang mengacu pada aturan prodi.\nContoh Model KKNT Mengajar di Desa\n4) Model KKNT Free Form', 'PENGALAMAN TENTANG KEBUDAYAAN DAERAH LAIN\nMELALUI MODUL NUSANTARA\nSelain mengikuti pembelajaran mata kuliah di perguruan tinggi penerima, mahasiswa yang mengikuti program Pertukaran Mahasiswa Merdeka juga akan mendapatkan pengalaman langsung berinteraksi dengan mahasiswa dari daerah lain dan mempelajari kebudayaan daerah lain melalui Modul Nusantara. Modul Nusantara ini senilai 2 sks dan wajib diambil oleh mahasiswa peserta program Pertukaran Mahasiswa Merdeka. Modul Nusantara dilaksanakan di perguruan tinggi penerima. Modul Nusantara dibagi ke dalam empat jenis kegiatan yaitu kebinekaan, inspirasi, refleksi, dan kontribusi sosial. Dalam pelaksanaan Modul Nusantara, mahasiswa akan dibimbing oleh dosen pembimbing modul nusantara dan dibantu oleh mentor.\nBAGAIMANA MEKANISME PELAKSANAAN PERTUKARAN\nMAHASISWA MERDEKA?\nTerdapat dua mekanisme, yaitu:']",Saya tidak tahu.
1,Apa itu Body of Knowledge?,"Istilah yang digunakan untuk mewakili secara lengkap konsep, istilah, dan aktivitas yang membentuk kemampuan profesional, yang didefinisikan oleh masyarakat terpelajar atau asosiasi profesional yang relevan.","['(3) Mekanisme dan penyelenggaraan kegiatan magang/ praktik kerja dan kegiatan wirausaha hilirisasi dikembangkan dan dikoordinasikan oleh Direktorat yang mengurusi inovasi dan kawasan sains teknologi bekerjasama dengan Direktorat yang mengurusi kemahasiswaan.\r\n\r\n(4) Direktorat yang mengurusi inovasi dan kawasan sains teknologi dalam menyelenggarakan kegiatan Magang/ Praktik Kerja dan Kegiatan Wirausaha Hilirisasi sebagaimana dimaksud pada ayat (3) berkoordinasi dengan Program Studi terkait.\r\n\r\nPasal 15\r\n(1) Dalam penyelenggaraan kegiatan MB - KM di ITS, dilaksanakan oleh Tim MB-KM ITS.\r\n(2) Tim MB-KM ITS berperan dalam memfasilitasi implementasi kegiatan MB-KM di ITS meliputi membuat prosedur operasional baku, dokumen teknis, penjaminan mutu, sistem aplikasi dan hal lainnya yang mendukung penyelenggaraan kegiatan MB-KM di ITS.\r\n(3) Tim MB-KM ITS ditetapkan melalui Keputusan Rektor.\r\n\r\n        BAB V KETENTUAN PENUTUP\r\n\r\nPasal 16', '07\nPEDOMAN\nPENULISAN\nLAPORAN\nMAGANG\n\n07\nPEDOMAN PENULISAN LAPORAN\nMAGANG\n7.1\nFUNGSI LAPORAN MAGANG\nPertanggungjawaban kegiatan Magang mahasiswa kepada Mitra Magang dan\nDepartemen.\n女你公\n299\nBahan pertimbangan pemberian nilai kegiatan Magang\nДо\nPenyampaian informasi bagi pihak ITS, mahasiswa, maupun Mitra Magang\nSalah satu alat untuk membina hubungan kerjasama, saling pengertian, dan koordinasi antara mahasiswa dengan pihak ITS maupun Mitra Magang\nSalah satu alat untuk menyampaikan ide, pendapat, penilaian, dan pengalaman yang berkaitan dengan penyelenggaraan Magang kepada\npihak lain.\n44\n07 Pedoman Penulisan Laporan Magang', '(6) Mekanisme dan penyelenggaraan kegiatan magang/ praktik kerja dikembangkan dan dikoordinasikan oleh Direktorat yang mengurusi kemahasiswaan.\r\n(7) Direktorat Kemahasiswaan dalam menyelenggarakan kegiatan magang/ praktik kerja sebagaimana dimaksud pada ayat (6) berkoordinasi dengan Program Studi terkait.\r\n\r\n         Bagian Kedua Pengabdian Kepada Masyarakat\r\n\r\nPasal 6\r\n(1) Kegiatan pengabdian kepada masyarakat ditujukan untuk pembinaan karakter kebangsaan mahasiswa khususnya untuk menumbuhkan kepedulian terhadap persoalan yang dihadapi masyarakat.\r\n(2) Kegiatan pengabdian kepada masyarakat pada program sarjana diimplementasikan dalam bentuk mata kuliah pengayaan sebesar 3 (tiga) sks.\r\n(3) Kegiatan pengabdian kepada masyarakat pada program sarjana terapan, dapat diambil untuk tambahan sks atau dapat dikompensasi dengan mata kuliah Program Studi yang memiliki capaian pembelajaran yang setara.', '(8) Mekanisme dan penyelenggaraan kegiatan asistensi mengajar di satuan pendidikan dikembangkan dan dikoordinasikan oleh Direktorat yang mengurusi kemahasiswaan.\r\n(9) Direktorat yang mengurusi kemahasiswaan dalam menyelenggarakan kegiatan asistensi mengajar di satuan pendidikan sebagaimana dimaksud pada ayat (8) berkoordinasi dengan Program Studi terkait.\r\n\r\nBagian Kesembilan\r\nMagang/ Praktik Kerja dan Kegiatan Wirausaha Lingkup Hilirisasi\r\n\r\nPasal 14\r\n(1) Kegiatan magang/ praktik kerja dan kegiatan wirausaha hilirisasi ditujukan untuk memperlancar karir lulusan, pengayaan kompetensi mahasiswa, kolaborasi magang, wirausaha dan kerja sama pengembangan produk inovatif.\r\n(2) Bentuk kegiatan magang/ praktik kerja dan kegiatan wirausaha hilirisasi dapat berupa kegiatan penelitian dan pengabdian masyarakat bersama civitas akademika yang lain untuk memecahkan persoalan di masyarakat atau industri, inkubasi dan start-up.']",Saya tidak tahu.
2,Apa itu CPL?,Capaian Pembelajaran Lulusan,"['Tabel 2.1 Standar dalam penyelenggaraan MB -KM di   ITS \nNO ELEMEN PENILAIAN  INDIKATOR  \n(1) (2) (3) \nI STANDAR KOMPETENSI LULUSAN  \n1 Standar Kompetensi Lulusan  (i) Pelaksanaan MBKM mengacu pada CPL Prodi sebagai target dari kemampuan lulusan, \ndengan minimal pencapaian 80%  CPL dan atau sebagai kompetensi tambahan  \n(ii) Kompetensi tambahan dimaksudkan untuk memperlancar karir lulusan, kolaborasi riset \ndan atau kerja sama p engembangan industri.  \nII STANDAR ISI PEMBELAJARAN  \n2 Standar Isi  – MK Pengayaan  (i) Prodi menyediakan kurikulum untuk pelaksanaan MBKM yang disusun bersama \npemangku kepentingan internal dan eksternal, serta direview oleh pakar bidang ilmu \nprogram studi nya.  \n(ii) Keterjaminan pemenuhan CPL  melalui MBKM ( ketersediaan matrik / peta CPL - MK \nMBKM ), dan ketersediaan modul MK melalui pembelajaran  untuk MK yang \ndilaksanakan secara MBKM', 'sesuai dengan kesepakata n tempat magang;  \n(ii) Mahasiswa yang melaksanakan magang dapat melakukan kegiatan praktek / kolaborasi \nriset / kerja sama pengembangan industri / bentu k kegiatan  lain  yang selaras dengan \nCPL’   \n(iii) Mahasiswa yang melaksanakan magang wajib  dibimbing oleh pembimbing internal dari \ndosen ITS dan  pembimbing eksternal dari pihak  instansi / lembaga /  industri  tempat \nmagang ;  \n(iv) Mahasiswa yang melaksanakan magang dapat melakukan kegiatan akademik yang lain \ndengan syarat telah mendapatkan ijin dari pihak penanggung jawab lembaga / badan / \nindustri magang ;  \n(v) Mahasiswa pada waktu melaksanaan magang  tidak harus cuti  studi ;  \n(vi) Mahasiswa yang melaksa nakan magang dapat diberi  memberikan surat keterangan \nhasil kegiatan magang / sertifikat kompetensi  dari lembaga / badan / industri letak \nmagang sesuai dengan ketentuan yang berlaku;  \n 9 Dokumen Panduan Baku Mutu Pelaksanaan MBKM - 2021  \n NO ELEMEN PENILAIAN  INDIKATOR  \n(1) (2) (3)', '16. Tahap Persiapan adalah tahap pembelajaran yang dijadwalkan dalam dua semester pertama pada kurikulum Program Sarjana atau dua paket semester pertama pada kurikulum Program Sarjana Terapan.\r\n17. Standar kompetensi lulusan adalah kriteria minimal tentang kualifikasi kemampuan lulusan yang mencakup sikap, pengetahuan, dan keterampilan yang dinyatakan dalam rumusan capaian pembelajaran lulusan.\r\n\r\n18. Capaian Pembelajaran Lulusan yang selanjutnya disingkat CPL adalah kriteria minimal tentang kualifikasi kemampuan lulusan yang mencakup sikap, pengetahuan, dan keterampilan yang dinyatakan dalam rumusan capaian pembelajaran lulusan.\r\n19. Capaian Pembelajaran Mata Kuliah yang selanjutnya disingkat CPMK adalah capaian pembelajaran lulusan yang dibebankan ke mata kuliah.\r\n20. Sistem Kredit Semester yang selanjutnya disingkat SKS adalah suatu sistem penyelenggaraan pendidikan dengan menggunakan sks.', 'Pemasaran Digital 3\nWirausaha\n1. Desain Wirausaha dan \nPresentasi\n2. Praktik Wirausaha\n3. Laporan Pelaksanaan \nWirausaha dan Presentasi3\n4\n3\nJumlah 6 MK 20 SKS\nPenjelasan Tabel 2.4. \nMahasiswa Ilmu Komunikasi mengambil bentuk kegiatan pembelajaran \nberupa Kewirausahaan untuk menambah kompetensinya di bidang wirausaha. \nKompetensi yang telah dicapai melalui serangkaian proses kegiatan pembelajaran \nkewirausahaan ini sesuai dengan CPL, proses pencapaian CPL tersebut dapat \ndiekuivalensikan kedalam mata kuliah Kewirausahaan Sosial, Etika Bisnis, \nPengantar Manajemen dan Bisnis, Pemasaran Digital, Desain Wirausaha dan \nPresentasi, Praktik Wirausaha, serta Laporan Wirausaha dan Presentasi yang \nsetara dengan 20 SKS.\nProses Program Wirausaha\n21       Buku Panduan Merdeka Belajar - Kampus Merdeka\ng. Studi/Proyek Independen\nBanyak mahasiswa yang memiliki passion untuk mewujudkan karya besar yang \ndilombakan di tingkat internasional atau karya dari ide yang inovatif. Idealnya, studi/']","CPL adalah singkatan dari Capaian Pembelajaran Lulusan. CPL adalah kriteria minimal tentang kualifikasi kemampuan lulusan yang mencakup sikap, pengetahuan, dan keterampilan yang dinyatakan dalam rumusan capaian pembelajaran lulusan."
3,Berapa jam kerja magang yang setara dengan 1 SKS?,1 SKS = 2.720 menit magang atau 45 jam,"['KERJA PRAKTIK\nDepartemen Teknik Informatika ITS\n\nSekilas Kerja Praktik\n\nJumlah kredit Mata Kuliah KP: 2 SKS\nSKS KP diambil bersamaan / setelah menyelesaikan KP di organisasi (perusahaan, instansi, yayasan)\nLama KP: 1-2 bulan dengan hitungan kerja part time\nBisa perorangan atau berkelompok maksimal 2 (dua) mahasiswa\nBerkas-berkas KP bisa didapatkan di link resource akademik:\nhttps://intip.in/ResourceAkademikDanKemahasiswaanIF\nProsedur Kerja Praktik\n\nMengajukan KP\nSurat Pengantar KP\nDosen Pembimbing KP\nPelaksanaan KP\nPenilaian KP oleh Pembimbing Lapangan\nPenilaian KP oleh Dosen Pembimbing\nPenyerahan Laporan KP ke RBTC\nMengumpulkan bukti penyelesaian KP\nLulus KP\nSebelum berangkat KP\n\nMengajukan KP\n\nMemenuhi persyaratan sebagai berikut:\nMahasiswa aktif Teknik Informatika\nSKS tempuh minimum 90 SKS\nMengisi MONKP:\nmonkp.if.its.ac.id (registrasi akun dan data KP)\nStatus KP akan menjadi CREATED\nSurat Pengantar Kerja Praktik', 'Kegiatan Mahasiswa yang Dapat Dilakukan di Luar Program Studi (Prodi)\n\nPertukaran pelajar\nMagang\nMengapa Magang Menjadi Program Strategis ITS?\n\nMagang telah menjadi kebijakan nasional berdasarkan Keputusan Menristekdikti No. 123/M/KPT/2019 tentang magang industri dan pengakuan satuan kredit semester untuk magang kuliah.\nMahasiswa bekerja di perusahaan dan melaksanakan tugas secara profesional sesuai jam kerja kantor (minimal 8 jam/hari, 5 hari/minggu, & min. 1 bulan). 1 SKS = 2.720 menit magang atau 45 jam. Sehingga 1 BULAN = 160 jam = 3,5 SKS; 6 BULAN = 21 SKS\nBerlaku untuk program magang di dalam dan luar negeri.\nMahasiswa TIDAK KEHILANGAN Jam Belajar (Tidak Harus Cuti) & Tertunda Kelulusannya.\nDapat diambil saat mahasiswa libur panjang selama 2-3 bulan.\nInsentif Pajak Super 200% Perusahaan Penyedia Magang', 'h. Asistensi Mengajar di Satuan Pendidikan.\r\n(3) Dalam hal ada penambahan dan atau perubahan BKP MBKM sebagaimana dimaksud pada ayat (2) ditetapkan melalui Keputusan Rektor.\r\n(4) Kegiatan Membangun Desa/ Kuliah Kerja Nyata Tematik sebagaimana dimaksud pada ayat (2) huruf b dan Proyek Kemanusiaan sebagaimana dimaksud pada ayat (2) huruf d diwujudkan melalui kegiatan pengabdian kepada masyarakat.\r\n\r\n              BAB IV PELAKSANAAN KEGIATAN MB - KM\r\n\r\nPasal 4\r\n(1) Jumlah sks maksimal yang dapat diambil dalam rangka pelaksanaan kegiatan MB -\r\nKM adalah 40 (empat puluh) sks.\r\n(2) Kegiatan MB-KM hanya bisa dilaksanakan dengan:\r\na. Perguruan tinggi yang mempunyai rangking setara atau lebih tinggi dari ITS,\r\nb. Perguruan tinggi yang mempunyai MoU dengan ITS; atau\r\nc. Lembaga non perguruan tinggi yang mempunyai MoU dengan ITS.\r\n(3) Pelaksanaan transfer kegiatan MB - KM menjadi sks mata kuliah, program studi atau direktorat membentuk tim pelaksana transfer kredit.', '(v) Bentuk kegiatan pengabdian kepada masyarakat merupakan salah satu bentuk 7 Dokumen Panduan Baku Mutu Pelaksanaan MBKM - 2021  \n NO ELEMEN PENILAIAN  INDIKATOR  \n(1) (2) (3) \nimplementasi MK pengayaan dengan bobot 3 (tiga) sks.  \n \n4 Standar Isi  – Pengakuan bobot \nsks (1) Jumlah sks maksimal yang dapat diambil dalam rangka pelaksanaan kegiatan MB – KM \nadalah 40 (empat puluh) sks.  \n(2) Kegiatan magang/ praktik kerja pada program sarjana terapan diimplementasikan dalam \nbentuk mata kuliah wajib sebagai  mata kuliah penciri Fakultas  Vokasi sebesar 14 (empat \nbelas) sks.  \n(3) Konversi kegiatan MB -KM magang dapat dikonversikan ke dalam: (i) MK KP,  \n(ii) beberapa MK gabungan antara KP dengan MK lain dengan kesamaan CP MK,  \n(iii) MK magang dengan maksimum bobot 20 (dua puluh) sks.   \n(4) Kegiatan MBKM – dalam bentuk pertukaran pelajar melalui MK di prodi di luar ITS, \ndengan ketentuan jumlah sks maksimal adalah 20 (dua puluh) sks, yang meliputi mata']","Magang yang setara dengan 1 SKS adalah minimal 8 jam/hari selama 5 hari/minggu, atau total 40 jam."
4,Apa durasi maksimal magang menurut peraturan rektor?,Maksimal 6 bulan,"['(3) Tim MB-KM ITS ditetapkan melalui Keputusan Rektor.\r\n\r\n        BAB V KETENTUAN PENUTUP\r\n\r\nPasal 16\r\nPada saat Peraturan Rektor ini mulai berlaku, maka Peraturan Rektor Institut Teknologi Sepuluh Nopember Nomor 30 Tahun 2020 tentang Penyelenggaraan Kegiatan Merdeka Belajar - Kampus Merdeka Di Institut Teknologi Sepuluh Nopember dicabut dan dinyatakan tidak berlaku.\r\n\r\nPasal 17\r\nPeraturan Rektor ini mulai berlaku pada tanggal ditetapkan.\r\n\r\n\r\nDitetapkan di Surabaya\r\npada tanggal 12 Oktober 2021\r\nREKTOR INSTITUT TEKNOLOGI SEPULUH NOPEMBER,\r\n\r\n\r\n\r\n\r\nMOCHAMAD ASHARI\r\nNIP 196510121990031003', 'Pasal 4\n Mahasiswa     dalam pelaksanaan magang harus        memenuhi ketentuan\n sebagai berikut:\n a. Magang memiliki durasi minimal 3 bulan sampai maksimal 6 bulan\n     dalam 1 periode;\n b. mahasiswa wajib dibimbing oleh pembimbing internal dari dosen ITS\n     dan pembimbing eksternal dari pihak industri;\n c. selama magang mahasiswa secara penuh waktu bekerja di lapangan\n     sesuai kesepakatan;\n d. mahasiswa dapat mendapatkan ijin untuk melakukan kegiatan\n     akademik tertentu, melalui pembicaraan dan kesepakatan dengan\n     pihak industri;\n e. pada waktu pelaksanaan magang, mahasiswa tidak harus cuti;\n f. industri yang menawarkan magang dapat memberikan sertifikat\n     kompetensi dengan syarat dan ketentuan tertentu; dan\n g. sebelum    kegiatan     magang    dilaksanakan    harus   ada   nota\n     kesepahaman dan perjanjian kerja sama.\n\n\n                                  Pasal II\nPeraturan Rektor ini mulai berlaku pada tanggal ditetapkan.', 'h. Asistensi Mengajar di Satuan Pendidikan.\r\n(3) Dalam hal ada penambahan dan atau perubahan BKP MBKM sebagaimana dimaksud pada ayat (2) ditetapkan melalui Keputusan Rektor.\r\n(4) Kegiatan Membangun Desa/ Kuliah Kerja Nyata Tematik sebagaimana dimaksud pada ayat (2) huruf b dan Proyek Kemanusiaan sebagaimana dimaksud pada ayat (2) huruf d diwujudkan melalui kegiatan pengabdian kepada masyarakat.\r\n\r\n              BAB IV PELAKSANAAN KEGIATAN MB - KM\r\n\r\nPasal 4\r\n(1) Jumlah sks maksimal yang dapat diambil dalam rangka pelaksanaan kegiatan MB -\r\nKM adalah 40 (empat puluh) sks.\r\n(2) Kegiatan MB-KM hanya bisa dilaksanakan dengan:\r\na. Perguruan tinggi yang mempunyai rangking setara atau lebih tinggi dari ITS,\r\nb. Perguruan tinggi yang mempunyai MoU dengan ITS; atau\r\nc. Lembaga non perguruan tinggi yang mempunyai MoU dengan ITS.\r\n(3) Pelaksanaan transfer kegiatan MB - KM menjadi sks mata kuliah, program studi atau direktorat membentuk tim pelaksana transfer kredit.', '4. Hasil penilaian dilakukan dengan cara mengisi formulir yang ada dan diserahkan\npada departemen.\n8.2\nPENILAIAN PRESTASI KINERJA MAGANG\nOLEH UNIT MITRA MAGANG\nDalam melakukan kegiatan magang, mahasiswa akan memperoleh penilaian dari unit tempat magang. Formulir penilaian magang diisi dan ditandatangani oleh atasan yang berwenang di tempat magang (minimal level manajer) dan dicap menggunakan stempel unit tempat magang. Berikut adalah butir penilaian kinerja magang:\n52\n08 Penilaian Magang']",Durasi maksimal magang menurut peraturan rektor adalah 6 bulan dalam 1 periode.
5,Apa itu MB-KM di ITS?,Merdeka Belajar - Kampus Merdeka di Institut Teknologi Sepuluh Nopember,"['NO ELEMEN PENILAIAN  INDIKATOR  \n(1) (2) (3) \natau kombinasi keduanya  \n6 Standar Proses – Tempat \npelaksanaan MBKM  Tempat k egiatan MB – KM dapat dilaksanakan di luar Program Studi baik yang ada di internal \nITS maupun di luar ITS . \n7 Standar Proses –  \nLama waktu pelaksanaan \nMBKM  Lama waktu pelaksanaan MBKM, dapat dikonvesi ke MK, dengan syarat:  \ni. Lama kegiatan belajar dapat dikonversi ke dalam sks adalah minimal 2720 menit atau \n45.3 jam.  \nii. Lama kegiatan bentuk MBKM dihitung atas waktu untuk:  (a) persiapan  di tempat \nMBKM , (b) pelaksanaan, (c) penilaian, dan  (d)  pelaporan.  \niii. Lama waktu kegiatan MB -KM bentuk magang, minimal 3 bulan dan maksimal 6 bulan.  \n8 Standar Proses –  \nKegiatan akademik selama  \nMBKM  – bentuk magang  (i) Mahasiswa yang melaksakan magang harus bekerja di lapangan secara penuh waktu \nsesuai dengan kesepakata n tempat magang;  \n(ii) Mahasiswa yang melaksanakan magang dapat melakukan kegiatan praktek / kolaborasi', 'c. Jumlah penilaian terhadap pelaksanaan MBKM minimal sebanyak 4 (empat).  \nd. Pelaporan terhadap proses dan hasil penilaian dilakukan oleh Dosen pembimbing \nakademik dalam pelaksanaan MBKM.  \ne. Sistem informasi untuk mempermudah pendataan – implementasi MBKM di Pro di. \n \n2.4 Pengendalian  \nPengendalian pelaksanaan MBKM dilakukan oleh Prodi bersama direktorat dan unit \nterkait, mulai dari perencanaan, pelaksanaan dan pelaporan kegiatan MBKM. \nPengendalian dilakukan atas unsur -unsur yang dikawatirkan akan menyimpang, atau \ntidak memenuhi  standar yang telah ditetapkan.  \n \n \n \n 20 Baku Mutu - MBKM   - 2021  \n \n 3 Penutup  \nBaku mutu MBKM yang disusun sesuai dengan SN Dikti dan kebijakan Rektor ITS \nyang berlaku, sebagai rujukan bagi Direktorat terkait dan Prodi di dalam \nmeingimplementasi MBKM, dengan tujuan:  \n(i) Melakukan pengukuran ketercapaian CPL untuk masing -masing bentuk \nMBKM.  \n(ii) Melakukan penilaian dan evaluasi atas proses dan hasil kegiatan MBKM', 'yang setara.  \n(iv) Kegiatan MBKM dalam bentuk KKN dilaksanakan pada semester 6 (enam) dan 7 (tujuh)  \natau sebelum nya dengan syarat telah lulus tahap persiapan.  \n(v) Kegiatan MBKM dalam bentuk KKN yang dilaksanakan sebelum semester 6 (enam) dan \n7 (tujuh) dan s udah lulus tahap persiapan , diakui sebagai MBKM dengan sistem tabung \nnilai.  \n(vi) Kegiatan MBKM dalam bentuk KKN  dikembangkan oleh Direktorat yang mengurusi riset \ndan pengabdian kepada masyarakat . \n(vii) Implementasi MBKM dalam bentuk  KKN  dikoordinir oleh Direktorat yang m engurusi  \npengabdian kepada masyarakat bersama  Prodi  terkait , melalui tahapan kegiatan (a) \npersiapan, (b) Pelaksanaan, (c) Evaluasi, (d) Pengendalian, dan (e) Peningkatan . \n \n10 Standar Proses –  \nKegiatan MBKM – bentuk \nPertukaran Pelajar  (i) Kegiatan MBKM dalam bentuk pertukaran pelajar  dimaksudkan untuk mencapai CPL .  \n(ii) Kegiatan MBKM dalam bentuk pertukaran pelajar  dapat dilakukan dengan PT di dalam \nnegeri atau di luar negeri.', '2 PRINSIP PPEPP DALAM PENYELENGGARAAN MB -KM \n \nSiklus PPEPP dalam penyelenggaran MB -KM, ditunjukkan di dalam ilustrasi gambar 1.1 di \nbawah ini.  \n \nP: Penetapan   \nP: Pelaksanaan   \nE: Evaluasi  \nP: Pengendalian  \nP: Peningkatan  \n \n \nGambar 2.1 Siklus PPEPP di dalam SPMI  \n \n \n2.1 Penetapan Standar  \nStandar dalam penyelenggaraan MB -KM mengacu pada: (i) SN – Dikti, (ii) Peraturan \nRektor tentang MB -KM, dan (iii) Panduan yang telah dikeluarkan oleh D irektorat \nKemahasiswaan, Direktorat Pendidikan, dan Direktorat Riset dan Pengabdian kepada \nMasyarakat .  \nStandar yang digunakan di dalam penjaminan mutu MB -KM mengacu pada SN Dikti dan \nKebijakan yang telah ditetapkan oleh Rektor ITS yang masih berlaku. Standar tersebut  \ndituliskan di dalam Tabel di bawah ini.  6 Dokumen Panduan Baku Mutu Pelaksanaan MBKM - 2021  \n  \nTabel 2.1 Standar dalam penyelenggaraan MB -KM di   ITS \nNO ELEMEN PENILAIAN  INDIKATOR  \n(1) (2) (3) \nI STANDAR KOMPETENSI LULUSAN']","MB-KM di ITS merupakan singkatan dari Magang Berbasis Kampus-Masyarakat. Magang ini dapat dilaksanakan di luar Program Studi baik yang ada di internal ITS maupun di luar ITS. Selain itu, MB-KM juga dapat berbentuk magang yang dilakukan minimal selama 3 bulan dan maksimal 6 bulan. Selama pelaksanaan magang, mahasiswa harus bekerja di lapangan secara penuh waktu sesuai dengan kesepakatan tempat magang. Proses pelaksanaan MB-KM juga melibatkan penilaian dan evaluasi yang dilakukan oleh Dosen pembimbing akademik, serta dilakukan pengendalian oleh Prodi bersama direktorat dan unit terkait."
6,Apa saja bentuk kegiatan pembelajaran yang termasuk dalam MB-KM?,"Magang/Praktik Kerja, Membangun Desa/Kuliah Kerja Nyata Tematik, Pertukaran Pelajar, Proyek Kemanusiaan, Penelitian/Riset, Kegiatan Wirausaha, Studi/Proyek Independen, dan Asistensi Mengajar di Satuan Pendidikan.","['BAB III\r\nRUANG LINGKUP KEGIATAN\r\n\r\nPasal 3\r\n(1) Kegiatan MB - KM merupakan proses pembelajaran yang dilaksanakan di luar Program Studi baik yang ada di internal ITS maupun di luar ITS yang terdiri atas:\r\na. pembelajaran dalam Program Studi lain di internal ITS;\r\n\r\nb. pembelajaran dalam Program Studi yang sama pada Perguruan Tinggi di luar ITS;\r\nc. pembelajaran dalam Program Studi lain pada Perguruan Tinggi di luar ITS; dan\r\nd. pembelajaran pada lembaga non Perguruan Tinggi.\r\n(2) Ruang lingkup kegiatan MB - KM adalah 8 (delapan) bentuk kegiatan pembelajaran (BKP) yang meliputi:\r\na. Magang/ Praktik Kerja;\r\nb. Membangun Desa/ Kuliah Kerja Nyata Tematik;\r\nc. Pertukaran Pelajar;\r\nd. Proyek Kemanusiaan;\r\ne. Penelitian/ Riset;\r\nf. Kegiatan Wirausaha;\r\ng. Studi/ Proyek Independen; dan\r\nh. Asistensi Mengajar di Satuan Pendidikan.\r\n(3) Dalam hal ada penambahan dan atau perubahan BKP MBKM sebagaimana dimaksud pada ayat (2) ditetapkan melalui Keputusan Rektor.', 'dan menengah ,   \n(iii) Kegiatan MBKM dalam bentuk asistensi mengajar di satuan pendidikan , merupakan \nkegiatan dalam bentuk: bantuan mengajar, tutorial, bimbingan teknis, pelatihan dan \nkegiatan lainnya yang relevan  dengan kegiatan akademik di satuan pendidikan tersebut.  \n(iv) Kegiatan MBKM dalam bentuk asistensi mengajar  dapat dikonversi ke dalam sks MK  \natau bentuk lain sesuai dengan ketercapaian CPL serta lama waktu proses kegiatan  \n(v) Kegiatan MBKM dalam bentuk asistensi mengajar dikembangkan oleh Direktorat yang 13 Dokumen Panduan Baku Mutu Pelaksanaan MBKM - 2021  \n NO ELEMEN PENILAIAN  INDIKATOR  \n(1) (2) (3) \nmengurusi kemahasiswaan.  \n(vi) Implementasi kegiatan MBKM  dalam bentuk asistensi mengajar  dikoordinasi oleh \nDirektorat yang mengurusi Kemahasiswaan bersama Prodi terkait , melalui tahapan  \nkegiatan (a) persiapan, (b) Pelaksanaa n, (c) Evaluasi, (d) Pengendalian, dan (e) \nPeningkatan  \n Standar Proses –  \nKegiatan MBKM – Bentuk \nMagang / Praktik Kerja dan', '(4) Kegiatan MBKM – dalam bentuk pertukaran pelajar melalui MK di prodi di luar ITS, \ndengan ketentuan jumlah sks maksimal adalah 20 (dua puluh) sks, yang meliputi mata \nkuliah inti dan mata kuliah non inti.  \nIII STANDAR PROSES PEMBELAJARAN  \n5 Standar Proses –bentuk \npembelajaran MBKM  (i) Mahasiswa dapat melaksanakan kegiatan pembelajaran MBKM dalam rangka meraih CPL \nProdi dalam bentuk satu atau lebih bentuk berikut ini:  \na. Magang/ Praktik Kerja;  \nb. Membangun Desa/ Kuliah Kerja Nyata Tematik;  \nc. Pertukaran Pelajar;  \nd. Proyek Kemanusiaan;  \ne. Penelitian/ Riset;  \nf. Kegiatan Wirausaha;  \ng. Studi/ Proyek Independen; dan  \nh. Asistensi Mengajar di Satuan Pendidikan  \n(ii)  Pelaksanaan MB -KM bentuk (a) sd (h) dapat dilaksanakan dalam bentuk  online, offline 8 Dokumen Panduan Baku Mutu Pelaksanaan MBKM - 2021  \n NO ELEMEN PENILAIAN  INDIKATOR  \n(1) (2) (3) \natau kombinasi keduanya  \n6 Standar Proses – Tempat', 'meningkatkan prestasi mahasiswa dalam ajang nasional dan internasional.  \n(iii) Kegiatan  MBKM dalam bentuk Studi/ Proyek Independen adalah semua kegiatan untuk  \npenerapan saintek dalam rangka menghasilkan inovasi terdepan (frontie r).  12 Dokumen Panduan Baku Mutu Pelaksanaan MBKM - 2021  \n NO ELEMEN PENILAIAN  INDIKATOR  \n(1) (2) (3) \n(iv) Kegiatan  MBKM dalam bentuk Studi/ Proyek Independen dapat berupa lomba - lomba \nkemahasiswaan atau proyek - proyek untuk memecahkan persoalan di ITS, di \nmasyarakat atau industri.  \n(v) Kegiatan MBKM dalam bentuk  Studi/ Proyek Independen  dapat dikonversika n ke dalam \nsks MK  atau bentuk lain sesuai dengan ketercapaian CPL serta lama waktu proses \nkegiatan.  \n(vi) Kegiatan MBKM dalam bentuk  Studi/ Proyek dikembangkan oleh Direktorat yang \nmengurusi Kemahasiswaan.  \n(vii) Implementasi  Kegiatan MBKM dalam bentuk  Studi/  Proyek  dikoordinir oleh  Direktorat \nyang mengurusi kemahasiswaan  bersama Prodi terkait , melalui tahapan  kegiatan (a)']","Dalam MB-KM, terdapat 8 (delapan) bentuk kegiatan pembelajaran (BKP) yang termasuk dalam ruang lingkup kegiatan tersebut, yaitu:

1. Magang/ Praktik Kerja
2. Membangun Desa/ Kuliah Kerja Nyata Tematik
3. Pertukaran Pelajar
4. Proyek Kemanusiaan
5. Penelitian/ Riset
6. Kegiatan Wirausaha
7. Studi/ Proyek Independen
8. Asistensi Mengajar di Satuan Pendidikan

Itulah 8 bentuk kegiatan pembelajaran yang termasuk dalam MB-KM."
7,Kapan pelaksanaan kegiatan pengabdian kepada masyarakat dapat dilakukan dalam program sarjana di ITS?,Pada semester 6 dan 7.,"['(4) Pelaksanaan kegiatan pengabdian kepada masyarakat adalah pada semester 6 (enam) dan 7 (tujuh).\r\n(5) Pelaksanaan kegiatan pengabdian kepada masyarakat dapat dilaksanakan sebelum semester 6 (enam) dan 7 (tujuh) tetapi sudah lulus tahap persiapan dengan menggunakan sistem tabung nilai.\r\n(6) Mekanisme dan penyelenggaraan kegiatan pengabdian kepada masyarakat dikembangkan dan dikoordinasikan oleh Direktorat yang mengurusi riset dan pengabdian kepada masyarakat.\r\n(7) Direktorat yang mengurusi riset dan pengabdian kepada masyarakat dalam menyelenggarakan kegiatan pengabdian kepada masyarakat sebagaimana dimaksud pada ayat (6) berkoordinasi dengan Program Studi terkait.\r\n\r\nBagian Ketiga\r\nPertukaran Pelajar/ Kuliah Lingkup Dalam Negeri\r\n\r\nPasal 7', '(6) Mekanisme dan penyelenggaraan kegiatan magang/ praktik kerja dikembangkan dan dikoordinasikan oleh Direktorat yang mengurusi kemahasiswaan.\r\n(7) Direktorat Kemahasiswaan dalam menyelenggarakan kegiatan magang/ praktik kerja sebagaimana dimaksud pada ayat (6) berkoordinasi dengan Program Studi terkait.\r\n\r\n         Bagian Kedua Pengabdian Kepada Masyarakat\r\n\r\nPasal 6\r\n(1) Kegiatan pengabdian kepada masyarakat ditujukan untuk pembinaan karakter kebangsaan mahasiswa khususnya untuk menumbuhkan kepedulian terhadap persoalan yang dihadapi masyarakat.\r\n(2) Kegiatan pengabdian kepada masyarakat pada program sarjana diimplementasikan dalam bentuk mata kuliah pengayaan sebesar 3 (tiga) sks.\r\n(3) Kegiatan pengabdian kepada masyarakat pada program sarjana terapan, dapat diambil untuk tambahan sks atau dapat dikompensasi dengan mata kuliah Program Studi yang memiliki capaian pembelajaran yang setara.', 'banyak)\n8. Pertukaran Pelajar • Jenis mata pelajaran yang diambil harus \nmemenuhi ketentuan yang ditetapkan prodi asal \nuntuk lulus (mis. memenuhi kurikulum dasar, \nmemenuhi persyaratan kuliah umum, memenuhi \npersyaratan electives, etc)Buku Panduan Merdeka Belajar - Kampus Merdeka       32\nSatuan penjaminan mutu di perguruan tinggi penyelenggara Merdeka Belajar - Kampus \nMerdeka, program “hak belajar tiga semester di luar program studi” wajib memiliki \nmekanisme formal untuk mengevaluasi dan memonitor mahasiswa secara periodik. Untuk \nmenjamin mutu program tersebut maka pelaksanaan monitor dan evaluasi dilakukan mulai \ndari tahap persiapan, pelaksanaan, dan penilaian. Penilaian/evaluasi merupakan salah \nsatu rangkaian kegiatan dalam meningkatkan kualitas, kinerja, dan produktifitas dalam \nmelaksanakan program magang industri. Fokus evaluasi adalah individu mahasiswa, yaitu \nprestasi yang dicapai dalam pelaksanaan magang oleh mahasiswa. Melalui evaluasi akan', 'juga dapat memanfaatkan Program Holistik Pembinaan dan Pemberdayaan Desa \n(PHP2D) dengan mengikuti prosedur dari Direktorat Belmawa.\n27       Buku Panduan Merdeka Belajar - Kampus Merdeka\nContoh Model KKNT Pembangunan dan Pemberdayaan bersama Kemendes\nContoh Model KKNT Pembangunan dan Pemberdayaan bersama Mitra\nBuku Panduan Merdeka Belajar - Kampus Merdeka       28\n3) Model KKNT Mengajar di Desa\nPelaksanaan kegiatan ini diutamakan pada mahasiswa program studi Pendidikan. \nBagi mahasiswa di luar program studi Pendidikan dapat melakukan kegiatan \nmengajar sesuai dengan bidang keahlian dalam rangka pemberdayaan \nmasyarakat misalnya penerapan teknologi tepat guna. Semua kegiatan KKNT \nmengajar ini bersifat membantu pengajaran formal dan non-formal. Bila di akhir \nkegiatan ini akan dijadikan sebagai tugas akhir, maka harus direncanakan sejak \nawal dalam bentuk proposal yang mengacu pada aturan prodi.\nContoh Model KKNT Mengajar di Desa\n4) Model KKNT Free Form']","Pelaksanaan kegiatan pengabdian kepada masyarakat dalam program sarjana di ITS dapat dilakukan pada semester 6 (enam) dan 7 (tujuh). Namun, kegiatan tersebut juga dapat dilaksanakan sebelum semester 6 (enam) dan 7 (tujuh) asalkan mahasiswa sudah lulus tahap persiapan dengan menggunakan sistem tabung nilai."
8,Apa fungsi dari Tim MB-KM ITS?,"Memfasilitasi implementasi kegiatan MB-KM di ITS, termasuk membuat prosedur operasional baku, dokumen teknis, penjaminan mutu, sistem aplikasi dan hal lainnya.","['c. Jumlah penilaian terhadap pelaksanaan MBKM minimal sebanyak 4 (empat).  \nd. Pelaporan terhadap proses dan hasil penilaian dilakukan oleh Dosen pembimbing \nakademik dalam pelaksanaan MBKM.  \ne. Sistem informasi untuk mempermudah pendataan – implementasi MBKM di Pro di. \n \n2.4 Pengendalian  \nPengendalian pelaksanaan MBKM dilakukan oleh Prodi bersama direktorat dan unit \nterkait, mulai dari perencanaan, pelaksanaan dan pelaporan kegiatan MBKM. \nPengendalian dilakukan atas unsur -unsur yang dikawatirkan akan menyimpang, atau \ntidak memenuhi  standar yang telah ditetapkan.  \n \n \n \n 20 Baku Mutu - MBKM   - 2021  \n \n 3 Penutup  \nBaku mutu MBKM yang disusun sesuai dengan SN Dikti dan kebijakan Rektor ITS \nyang berlaku, sebagai rujukan bagi Direktorat terkait dan Prodi di dalam \nmeingimplementasi MBKM, dengan tujuan:  \n(i) Melakukan pengukuran ketercapaian CPL untuk masing -masing bentuk \nMBKM.  \n(ii) Melakukan penilaian dan evaluasi atas proses dan hasil kegiatan MBKM', 'meingimplementasi MBKM, dengan tujuan:  \n(i) Melakukan pengukuran ketercapaian CPL untuk masing -masing bentuk \nMBKM.  \n(ii) Melakukan penilaian dan evaluasi atas proses dan hasil kegiatan MBKM  \n(iii) Melakukan pengendalian proses implementasi MBKM  \n(iv) Melakukan peningkatan impleme ntasi MBKM, atas hasil survey kepuasan \npihak internal dan eksternal stakeholder yang terlibat di dalam implementasi \nMBKM.    \n \n \n \n 21 Baku Mutu - MBKM   - 2021', 'terlibat di dalam pro ses dan hasil pelaksanaan MBKM.  \n(2). SOP yang diterbitkan oleh: (a) Direktorat terkait sebagai koordinator pelaksana \nmasing -masing bentuk MBKM, (b) Prodi sebagai pelaksana MBKM  untuk memandu \ndosen, mahasiswa dan tenaga kependidikan yang terlibat di dalam proses dan hasil \npelaksanaan MBKM.  \nDokumen (1) dan (2) di atas, merupakan manual untuk seluruh stakeholder yang terlibat \ndi dalam implementasi MBKM, yang dapat disusun dalam satu dokumen atau lebih secara \nterpisah. Rambu -rambu dalam penyusunan ke dua dokumen di atas, dengan ketentuan \nmemuat unsur -unsur sebagai berikut, dan dapat dikembangkan sesuai dengan kebutuhan \ndan tujuan pelaksanaan MBKM.  \n1. Tujuan dan ma ksud Manual MBKM  \n2. Luas lingkup Manual MBKM  \na. Manual Penetapan standar  \nb. Manual pelaksanaan standar  \nc. Manual evaluasi standar  \nd. Manual pengendalian pelaksnanaan standar  \ne. Manual peningkatan standar  \n3. Rincian tentang hal yang harus dikerjakan', 'a. Perencanaan bentuk MB KM, yang direncanakan oleh mahasiswa bersama dosen \nwali. Perencanaan terhadap unsur: (i) Waktu dan lama waktu pelaksanaan MBKM, \n(ii) bentuk MBKM, (iii) kesesuaian bentuk MBKM dengan target perncapaian CPL, \n(iv) luaran dari pelaksanaan MBKM,  \nb. Pelaksanaan pe nilaian dapat dilakukan pada proses dan hasil MBKM dengan \nmenggunakan prinsip, teknik , instrumen dan waktu asesmen proses dan hasil \nMBKM.  Penilaian menggunakan prinsip edukatif, otentik, objektif, akuntabel, dan \ntransparan yang dilakukan secara terintegrasi . Teknik penilaian dapat \nmenggunakan satu atau lebih dari kombinasi berikut ini: observasi, partisipasi, \nunjuk kerja, tes tertulis, tes lisan, dan angket . Instrumen penilaian dapat \ndigunakan satu atau kombinasi dari: rubrik dan atau portofolio.   \nc. Jumlah penilaian terhadap pelaksanaan MBKM minimal sebanyak 4 (empat).  \nd. Pelaporan terhadap proses dan hasil penilaian dilakukan oleh Dosen pembimbing \nakademik dalam pelaksanaan MBKM.']","Tim MB-KM ITS bertanggung jawab untuk melakukan pengendalian pelaksanaan MBKM di Program Studi bersama direktorat dan unit terkait, mulai dari perencanaan, pelaksanaan, hingga pelaporan kegiatan MBKM. Mereka melakukan pengendalian atas unsur-unsur yang dikawatirkan akan menyimpang atau tidak memenuhi standar yang telah ditetapkan. Selain itu, Tim MB-KM ITS juga bertujuan untuk melakukan pengukuran ketercapaian CPL untuk masing-masing bentuk MBKM, melakukan penilaian dan evaluasi atas proses dan hasil kegiatan MBKM, serta melakukan peningkatan implementasi MBKM berdasarkan hasil survey kepuasan pihak internal dan eksternal stakeholder yang terlibat dalam implementasi MBKM."
9,Apa tujuan penjaminan mutu MBKM?,Untuk meningkatkan kompetensi lulusan dengan soft skills dan hard skills.,"['meingimplementasi MBKM, dengan tujuan:  \n(i) Melakukan pengukuran ketercapaian CPL untuk masing -masing bentuk \nMBKM.  \n(ii) Melakukan penilaian dan evaluasi atas proses dan hasil kegiatan MBKM  \n(iii) Melakukan pengendalian proses implementasi MBKM  \n(iv) Melakukan peningkatan impleme ntasi MBKM, atas hasil survey kepuasan \npihak internal dan eksternal stakeholder yang terlibat di dalam implementasi \nMBKM.    \n \n \n \n 21 Baku Mutu - MBKM   - 2021', 'c. Jumlah penilaian terhadap pelaksanaan MBKM minimal sebanyak 4 (empat).  \nd. Pelaporan terhadap proses dan hasil penilaian dilakukan oleh Dosen pembimbing \nakademik dalam pelaksanaan MBKM.  \ne. Sistem informasi untuk mempermudah pendataan – implementasi MBKM di Pro di. \n \n2.4 Pengendalian  \nPengendalian pelaksanaan MBKM dilakukan oleh Prodi bersama direktorat dan unit \nterkait, mulai dari perencanaan, pelaksanaan dan pelaporan kegiatan MBKM. \nPengendalian dilakukan atas unsur -unsur yang dikawatirkan akan menyimpang, atau \ntidak memenuhi  standar yang telah ditetapkan.  \n \n \n \n 20 Baku Mutu - MBKM   - 2021  \n \n 3 Penutup  \nBaku mutu MBKM yang disusun sesuai dengan SN Dikti dan kebijakan Rektor ITS \nyang berlaku, sebagai rujukan bagi Direktorat terkait dan Prodi di dalam \nmeingimplementasi MBKM, dengan tujuan:  \n(i) Melakukan pengukuran ketercapaian CPL untuk masing -masing bentuk \nMBKM.  \n(ii) Melakukan penilaian dan evaluasi atas proses dan hasil kegiatan MBKM', 'a. Perencanaan bentuk MB KM, yang direncanakan oleh mahasiswa bersama dosen \nwali. Perencanaan terhadap unsur: (i) Waktu dan lama waktu pelaksanaan MBKM, \n(ii) bentuk MBKM, (iii) kesesuaian bentuk MBKM dengan target perncapaian CPL, \n(iv) luaran dari pelaksanaan MBKM,  \nb. Pelaksanaan pe nilaian dapat dilakukan pada proses dan hasil MBKM dengan \nmenggunakan prinsip, teknik , instrumen dan waktu asesmen proses dan hasil \nMBKM.  Penilaian menggunakan prinsip edukatif, otentik, objektif, akuntabel, dan \ntransparan yang dilakukan secara terintegrasi . Teknik penilaian dapat \nmenggunakan satu atau lebih dari kombinasi berikut ini: observasi, partisipasi, \nunjuk kerja, tes tertulis, tes lisan, dan angket . Instrumen penilaian dapat \ndigunakan satu atau kombinasi dari: rubrik dan atau portofolio.   \nc. Jumlah penilaian terhadap pelaksanaan MBKM minimal sebanyak 4 (empat).  \nd. Pelaporan terhadap proses dan hasil penilaian dilakukan oleh Dosen pembimbing \nakademik dalam pelaksanaan MBKM.', 'pelaksanaan MBKM  \n(v) Ketersediaan doku men panduan  17 Dokumen Panduan Baku Mutu Pelaksanaan MBKM - 2021  \n NO ELEMEN PENILAIAN  INDIKATOR  \n(1) (2) (3) \n(vi) Keterlaksanaan penjaminan mutu internal di UPPS dan Prodi dalam pelaksanaan \nMBKM, meliputi: (a) perencanaan kurikulum dan bentuk MBKM, (b) pelaksanaan \nMBKM, (c) evaluasi pelaksanaan MBKM, (d) pengendalian, dan (e) peningkatan \nimplementasi MBKM  di waktu berikutnya  18 Dokumen Panduan Baku Mutu Pelaksanaan MBKM - 2021  \n 2.2 Implementasi Standar MBKM   \nImplementasi dalam penjaminan mutu MBKM, dilengkapi dengan beberapa dokumen, \nyaitu:  \n(1). Dokumen Panduan pelaksanaan MBKM yang diterbitkan oleh: (a) Direktorat terkait \nsebagai koordinator pelaksana masing -masing bentuk MBKM, (b) Prodi sebagai \npelaksana MBKM  untuk memandu dosen, mahasiswa dan tenaga kependidikan yang \nterlibat di dalam pro ses dan hasil pelaksanaan MBKM.  \n(2). SOP yang diterbitkan oleh: (a) Direktorat terkait sebagai koordinator pelaksana']","Tujuan penjaminan mutu MBKM adalah untuk melakukan pengukuran ketercapaian CPL untuk masing-masing bentuk MBKM, melakukan penilaian dan evaluasi atas proses dan hasil kegiatan MBKM, melakukan pengendalian proses implementasi MBKM, serta melakukan peningkatan implementasi MBKM berdasarkan hasil survey kepuasan pihak internal dan eksternal stakeholder yang terlibat di dalam implementasi MBKM."
10,Apa tujuan dari MBKM?,"Untuk menghasilkan lulusan yang berkualitas dan memenuhi visi, misi, tata nilai, dan tujuan ITS serta memenuhi SN-DIKTI.","['meingimplementasi MBKM, dengan tujuan:  \n(i) Melakukan pengukuran ketercapaian CPL untuk masing -masing bentuk \nMBKM.  \n(ii) Melakukan penilaian dan evaluasi atas proses dan hasil kegiatan MBKM  \n(iii) Melakukan pengendalian proses implementasi MBKM  \n(iv) Melakukan peningkatan impleme ntasi MBKM, atas hasil survey kepuasan \npihak internal dan eksternal stakeholder yang terlibat di dalam implementasi \nMBKM.    \n \n \n \n 21 Baku Mutu - MBKM   - 2021', 'a. Perencanaan bentuk MB KM, yang direncanakan oleh mahasiswa bersama dosen \nwali. Perencanaan terhadap unsur: (i) Waktu dan lama waktu pelaksanaan MBKM, \n(ii) bentuk MBKM, (iii) kesesuaian bentuk MBKM dengan target perncapaian CPL, \n(iv) luaran dari pelaksanaan MBKM,  \nb. Pelaksanaan pe nilaian dapat dilakukan pada proses dan hasil MBKM dengan \nmenggunakan prinsip, teknik , instrumen dan waktu asesmen proses dan hasil \nMBKM.  Penilaian menggunakan prinsip edukatif, otentik, objektif, akuntabel, dan \ntransparan yang dilakukan secara terintegrasi . Teknik penilaian dapat \nmenggunakan satu atau lebih dari kombinasi berikut ini: observasi, partisipasi, \nunjuk kerja, tes tertulis, tes lisan, dan angket . Instrumen penilaian dapat \ndigunakan satu atau kombinasi dari: rubrik dan atau portofolio.   \nc. Jumlah penilaian terhadap pelaksanaan MBKM minimal sebanyak 4 (empat).  \nd. Pelaporan terhadap proses dan hasil penilaian dilakukan oleh Dosen pembimbing \nakademik dalam pelaksanaan MBKM.', '(iii) Kegiatan MBKM da lam bentuk wirausaha  dikembangkan oleh Direktorat yang \nmengurusi Kemahasiswaan.  \n(x) Implementasi  Kegiatan MBKM dalam bentuk wirausaha  dikoordinir oleh Direktorat \nyang mengurusi kemahasiswaan  bersama Prodi terkait , melalui  tahapan kegiatan (a) \npersiapan, (b) Pelaksanaan, (c) Evaluasi, (d) Pengendalian, dan (e) Peningkatan.  \n \n13 Standar Proses –  \nKegiatan MBKM – bentuk Studi \nIndependen  (i) Kegiatan MBKM dalam bentuk Studi/ Proyek Independen dimaksudkan untuk \nmendukung pencapaian profil sebagai inovator yang produktif.  \n(ii) Kegiatan  MBKM dalam bentuk Studi/ Proyek Independen dalam rangka untuk \nmewujudkan gagasan mahasiswa dalam mengembangkan produk inovatif, \nmenyelenggarakan pendidikan berbasis ri set dan pengembangan (R&D) serta \nmeningkatkan prestasi mahasiswa dalam ajang nasional dan internasional.  \n(iii) Kegiatan  MBKM dalam bentuk Studi/ Proyek Independen adalah semua kegiatan untuk', 'terlibat di dalam pro ses dan hasil pelaksanaan MBKM.  \n(2). SOP yang diterbitkan oleh: (a) Direktorat terkait sebagai koordinator pelaksana \nmasing -masing bentuk MBKM, (b) Prodi sebagai pelaksana MBKM  untuk memandu \ndosen, mahasiswa dan tenaga kependidikan yang terlibat di dalam proses dan hasil \npelaksanaan MBKM.  \nDokumen (1) dan (2) di atas, merupakan manual untuk seluruh stakeholder yang terlibat \ndi dalam implementasi MBKM, yang dapat disusun dalam satu dokumen atau lebih secara \nterpisah. Rambu -rambu dalam penyusunan ke dua dokumen di atas, dengan ketentuan \nmemuat unsur -unsur sebagai berikut, dan dapat dikembangkan sesuai dengan kebutuhan \ndan tujuan pelaksanaan MBKM.  \n1. Tujuan dan ma ksud Manual MBKM  \n2. Luas lingkup Manual MBKM  \na. Manual Penetapan standar  \nb. Manual pelaksanaan standar  \nc. Manual evaluasi standar  \nd. Manual pengendalian pelaksnanaan standar  \ne. Manual peningkatan standar  \n3. Rincian tentang hal yang harus dikerjakan']","MBKM memiliki beberapa tujuan, yaitu:
1. Melakukan pengukuran ketercapaian CPL untuk masing-masing bentuk MBKM.
2. Melakukan penilaian dan evaluasi atas proses dan hasil kegiatan MBKM.
3. Melakukan pengendalian proses implementasi MBKM.
4. Melakukan peningkatan implementasi MBKM berdasarkan hasil survey kepuasan pihak internal dan eksternal stakeholder yang terlibat di dalam implementasi MBKM."
11,Apa tujuan dari kegiatan magang/ praktik kerja?,"Memperlancar karir lulusan, pengayaan kompetensi mahasiswa, kolaborasi riset, dan kerja sama pengembangan industri.","['kegiatan (a) persiapan, (b) Pelaksanaa n, (c) Evaluasi, (d) Pengendalian, dan (e) \nPeningkatan  \n Standar Proses –  \nKegiatan MBKM – Bentuk \nMagang / Praktik Kerja dan \nWirausaha lingkup Hilirisasi  (i) Kegiatan MBKM dalam bentuk Magang/ Praktik Kerja dan Kegiatan Wirausaha Lingkup \nHilirisasi ditujukan untuk  memperlancar karir lulusan, pengayaan kompetensi \nmahasiswa, kolaborasi magang, wirausaha dan kerja sama pengembangan produk \ninovatif  dalam rangka meraih profil lulusan sebagai  inovator yang produktif.  \n(ii) Kegiatan MBKM dalam bentuk magang/ praktik kerja dan kegiatan wirausaha hilirisasi \ndapat berupa kegiatan penelitian dan pengabdian masyarakat bersama civitas \nakademika yang lain untuk memecahkan persoalan di masyarakat atau indust ri, inkubasi \ndan start -up.  \n(iii) Kegiatan MBKM dalam bentuk magang/ praktik kerja dan kegiatan wirausaha hilirisasi \ndikembangkan oleh  Direktorat yang mengurusi inovasi dan kawasan sains teknologi', '(6) Mekanisme dan penyelenggaraan kegiatan magang/ praktik kerja dikembangkan dan dikoordinasikan oleh Direktorat yang mengurusi kemahasiswaan.\r\n(7) Direktorat Kemahasiswaan dalam menyelenggarakan kegiatan magang/ praktik kerja sebagaimana dimaksud pada ayat (6) berkoordinasi dengan Program Studi terkait.\r\n\r\n         Bagian Kedua Pengabdian Kepada Masyarakat\r\n\r\nPasal 6\r\n(1) Kegiatan pengabdian kepada masyarakat ditujukan untuk pembinaan karakter kebangsaan mahasiswa khususnya untuk menumbuhkan kepedulian terhadap persoalan yang dihadapi masyarakat.\r\n(2) Kegiatan pengabdian kepada masyarakat pada program sarjana diimplementasikan dalam bentuk mata kuliah pengayaan sebesar 3 (tiga) sks.\r\n(3) Kegiatan pengabdian kepada masyarakat pada program sarjana terapan, dapat diambil untuk tambahan sks atau dapat dikompensasi dengan mata kuliah Program Studi yang memiliki capaian pembelajaran yang setara.', '(3) Mekanisme dan penyelenggaraan kegiatan magang/ praktik kerja dan kegiatan wirausaha hilirisasi dikembangkan dan dikoordinasikan oleh Direktorat yang mengurusi inovasi dan kawasan sains teknologi bekerjasama dengan Direktorat yang mengurusi kemahasiswaan.\r\n\r\n(4) Direktorat yang mengurusi inovasi dan kawasan sains teknologi dalam menyelenggarakan kegiatan Magang/ Praktik Kerja dan Kegiatan Wirausaha Hilirisasi sebagaimana dimaksud pada ayat (3) berkoordinasi dengan Program Studi terkait.\r\n\r\nPasal 15\r\n(1) Dalam penyelenggaraan kegiatan MB - KM di ITS, dilaksanakan oleh Tim MB-KM ITS.\r\n(2) Tim MB-KM ITS berperan dalam memfasilitasi implementasi kegiatan MB-KM di ITS meliputi membuat prosedur operasional baku, dokumen teknis, penjaminan mutu, sistem aplikasi dan hal lainnya yang mendukung penyelenggaraan kegiatan MB-KM di ITS.\r\n(3) Tim MB-KM ITS ditetapkan melalui Keputusan Rektor.\r\n\r\n        BAB V KETENTUAN PENUTUP\r\n\r\nPasal 16', '(8) Mekanisme dan penyelenggaraan kegiatan asistensi mengajar di satuan pendidikan dikembangkan dan dikoordinasikan oleh Direktorat yang mengurusi kemahasiswaan.\r\n(9) Direktorat yang mengurusi kemahasiswaan dalam menyelenggarakan kegiatan asistensi mengajar di satuan pendidikan sebagaimana dimaksud pada ayat (8) berkoordinasi dengan Program Studi terkait.\r\n\r\nBagian Kesembilan\r\nMagang/ Praktik Kerja dan Kegiatan Wirausaha Lingkup Hilirisasi\r\n\r\nPasal 14\r\n(1) Kegiatan magang/ praktik kerja dan kegiatan wirausaha hilirisasi ditujukan untuk memperlancar karir lulusan, pengayaan kompetensi mahasiswa, kolaborasi magang, wirausaha dan kerja sama pengembangan produk inovatif.\r\n(2) Bentuk kegiatan magang/ praktik kerja dan kegiatan wirausaha hilirisasi dapat berupa kegiatan penelitian dan pengabdian masyarakat bersama civitas akademika yang lain untuk memecahkan persoalan di masyarakat atau industri, inkubasi dan start-up.']","Tujuan dari kegiatan magang/praktik kerja adalah untuk memperlancar karir lulusan, mengaya kompetensi mahasiswa, kolaborasi magang, wirausaha, dan kerja sama pengembangan produk inovatif. Kegiatan magang/praktik kerja juga dapat berupa kegiatan penelitian dan pengabdian masyarakat bersama civitas akademika lainnya untuk memecahkan persoalan di masyarakat atau industri, serta untuk inkubasi dan start-up."
12,Apa yang dimaksud dengan PDDikti?,Pangkalan Data Perguruan Tinggi yang terintegrasi secara nasional.,"['Subdit. PK2\nSKEMA PELAKSANAAN\nPROGRAM MAGANG\nMANDIRI DI ITS\nMahasiswa / Departemen melakukan\nmenyertakan:\n1. Proposal Magang\n2. Surat Rekomendasi Departemen\n3. Surat Penerimaan Magang\nPelaksanaan Magang\nProses pengurusan\nPKS\nPKS tidak\ndisetujui\nPKS\nTertandatangan\nSelesai\nMagang berakhir <\nMahasiswa mendapatkan\nSertifikat / Penilaian Magang\nSelesai\nADVANCING HUMANITY\niTS\nMulai\nMahasiswa mengurus\nsurat rekomendasi\ndepartemen untuk pengajuan magang ke\nMitra\nMahasiswa mengajukan\npermohonan magang ke\nMitra\nMitra melakukan seleksi magang\nMahasiswa menerima hasil seleksi magang dari Mitra\nTidak diterima\nSelesai\nDiterima\nMahasiswa melaporkan\nke Departemen', '07\nPEDOMAN\nPENULISAN\nLAPORAN\nMAGANG\n\n07\nPEDOMAN PENULISAN LAPORAN\nMAGANG\n7.1\nFUNGSI LAPORAN MAGANG\nPertanggungjawaban kegiatan Magang mahasiswa kepada Mitra Magang dan\nDepartemen.\n女你公\n299\nBahan pertimbangan pemberian nilai kegiatan Magang\nДо\nPenyampaian informasi bagi pihak ITS, mahasiswa, maupun Mitra Magang\nSalah satu alat untuk membina hubungan kerjasama, saling pengertian, dan koordinasi antara mahasiswa dengan pihak ITS maupun Mitra Magang\nSalah satu alat untuk menyampaikan ide, pendapat, penilaian, dan pengalaman yang berkaitan dengan penyelenggaraan Magang kepada\npihak lain.\n44\n07 Pedoman Penulisan Laporan Magang', 'ERICHA VALENTINA\n5015201016\nS1 Perencanaan Wilayah d Vely Kukinul Siswanto\n\n\nFALDI FAKHRI\n5015201128\nS1 Perencanaan Wilayah d I Dewa Made Frendika S\n\nKK\nTerdapat inkonsistensi data / data yang belum diisi pada registras\nTerdapat laporan mingguan dengan foto aktivitas yang belum diis\nTerdapat laporan mingguan dengan foto aktivitas yang belum diis\nTerdapat laporan mingguan dengan foto aktivitas yang belum diis\nTerdapat laporan mingguan dengan foto aktivitas yang belum diis\nTerdapat laporan mingguan dengan foto aktivitas yang belum diis\nTerdapat laporan mingguan dengan foto aktivitas yang belum diis -\nits.id/ListSIMMagang\n+\nMix\nGenap 22/23\nGasal 23/24\nKementerian Pendidikan, Kebudayaan, Riset dan\nTeknologi\n\nSubdit. PK2\nADVANCING HUMANITY\niTS\nh\n4\nOverview MSIB 6\nd\n2023', 'PENGALAMAN TENTANG KEBUDAYAAN DAERAH LAIN\nMELALUI MODUL NUSANTARA\nSelain mengikuti pembelajaran mata kuliah di perguruan tinggi penerima, mahasiswa yang mengikuti program Pertukaran Mahasiswa Merdeka juga akan mendapatkan pengalaman langsung berinteraksi dengan mahasiswa dari daerah lain dan mempelajari kebudayaan daerah lain melalui Modul Nusantara. Modul Nusantara ini senilai 2 sks dan wajib diambil oleh mahasiswa peserta program Pertukaran Mahasiswa Merdeka. Modul Nusantara dilaksanakan di perguruan tinggi penerima. Modul Nusantara dibagi ke dalam empat jenis kegiatan yaitu kebinekaan, inspirasi, refleksi, dan kontribusi sosial. Dalam pelaksanaan Modul Nusantara, mahasiswa akan dibimbing oleh dosen pembimbing modul nusantara dan dibantu oleh mentor.\nBAGAIMANA MEKANISME PELAKSANAAN PERTUKARAN\nMAHASISWA MERDEKA?\nTerdapat dua mekanisme, yaitu:']","PDDikti merupakan singkatan dari Pusat Data dan Informasi Pendidikan Tinggi, yang merupakan lembaga yang bertanggung jawab dalam pengelolaan data dan informasi mengenai pendidikan tinggi di Indonesia. PDDikti bertugas untuk mengumpulkan, menyimpan, dan menyediakan data mengenai perguruan tinggi, program studi, mahasiswa, dosen, dan berbagai informasi terkait pendidikan tinggi di Indonesia."
13,Berapa jumlah kredit Mata Kuliah KP?,2 SKS,"['KERJA PRAKTIK\nDepartemen Teknik Informatika ITS\n\nSekilas Kerja Praktik\n\nJumlah kredit Mata Kuliah KP: 2 SKS\nSKS KP diambil bersamaan / setelah menyelesaikan KP di organisasi (perusahaan, instansi, yayasan)\nLama KP: 1-2 bulan dengan hitungan kerja part time\nBisa perorangan atau berkelompok maksimal 2 (dua) mahasiswa\nBerkas-berkas KP bisa didapatkan di link resource akademik:\nhttps://intip.in/ResourceAkademikDanKemahasiswaanIF\nProsedur Kerja Praktik\n\nMengajukan KP\nSurat Pengantar KP\nDosen Pembimbing KP\nPelaksanaan KP\nPenilaian KP oleh Pembimbing Lapangan\nPenilaian KP oleh Dosen Pembimbing\nPenyerahan Laporan KP ke RBTC\nMengumpulkan bukti penyelesaian KP\nLulus KP\nSebelum berangkat KP\n\nMengajukan KP\n\nMemenuhi persyaratan sebagai berikut:\nMahasiswa aktif Teknik Informatika\nSKS tempuh minimum 90 SKS\nMengisi MONKP:\nmonkp.if.its.ac.id (registrasi akun dan data KP)\nStatus KP akan menjadi CREATED\nSurat Pengantar Kerja Praktik', ""Mahasiswa Merdeka. Jika data telah lengkap dan menyetujui komitmen pada program Pertukaran Mahasiswa Merdeka, klik button 'Simpan Berkas' seperti di gambar berikut:\nINDAH SYAHYA DINATA =\nFORMULIR PENDAFTARAN\nPilih Penempatan & Mata Kuliah\nPeriksa Data Diri\nUnggah Berkas\nPernyataan Komitmen\nInformasi yang saya sampaikan adalah benar dan jika suatu hari nanti ditemukan informasi yang tidak sesual, saya bersedia untuk ditindak berdasarkan ketentuan yang berlaku.\n• Jika uang kuliah tunggal (UKT) saya lebih rendah dari Rp 2.400.000, maka bantuan UKT dari program ini akan dibayarkan sesuai biaya.\n• Jika saya tidak berhasil menyelesaikan program, maka saya bersedia untuk tidak menerima bantuan potongan UKT.\nSIMPAN BERKAS\nKIRIM\nTampilan halaman jika sudah menyelesaikan pendaftaran, lalu klik button 'Back To Home:\n©Korako\n• DASHBOARD E KEGIATAN MAHASISVIA & PROFIL\nTeguh Bintang Nugraha a\nSuccessfully Submitted!"", 'Peraturan Menteri Keuangan (PMK) 2019 tentang insentif pajak bidang vokasi & penelitian dan pengembangan memberikan pengurangan penghitungan penghasilan bruto maksimal 200% dari biaya yang dikeluarkan untuk kegiatan praktik kerja, pemagangan, dan pembelajaran.\nPROGRAM MAGANG WAJIB untuk BUMN\nProgram Magang Mahasiswa Bersertifikat (PMMB) dengan 9000 lowongan posisi magang di 142 BUMN diperebutkan oleh 3.500 PTN/PTS seluruh Indonesia. Uang saku: Rp 1,6 – 2 juta/bulan. Sertifikat Industri &/Sertifikat Kompetensi.\n\nManfaat Magang bagi Perusahaan & Departemen', '© Ya, sudah Sesuai\nlidak sesual\nData Akademil\nSaya munyatakanbaa Aahasisa sanunp dan bertanggung jawab untuk mengikut\n3.2\nSemester\nSava menvatakan bahwa sava menvetuiui tanna ada paksaan dari pihak manapun dan\n• apabila dikemudian hari pernyataan ini terbukti tidak benar, maka saya bersedia\nBeasiswal\nberancounclawao sera menerima konsekuensinva\nBeasiswa Pintar 2023\nNominal beas swa per bu an\nRp1.800.000\n \nData yang terverifkasi akan diteruskan ke pihak Pimpinan Perguruan Tinggi untuk\nproses pemberian rekomendasi. Pastikan Cata sudan tepat can sesuai\nSelanjutnya →\nKemball\nKirim Sekarang\n2\nLangkah terakhir adalah dengan memberikan Persetujuan\nVerifikasi Data Akademik Mahasiswa. Poin dalam memberikan persetujuan verifikasi data final adalah:\n• Menurut hasil verifikasi yang Anda lakukan, informasi yang diberikan oleh mahasiswa (termasuk semua dokumen yang telah diunggah) adalah akurat dan lengkap.\n• Anda sebagai Penanggung Jawab Fakultas/Prodi memahami bahwa ketidaksesuaian data dapat']",Jumlah kredit Mata Kuliah KP adalah 2 SKS.
14,Kapan SKS KP bisa diambil?,"Bersamaan atau setelah menyelesaikan KP di organisasi (perusahaan, instansi, yayasan)","['KERJA PRAKTIK\nDepartemen Teknik Informatika ITS\n\nSekilas Kerja Praktik\n\nJumlah kredit Mata Kuliah KP: 2 SKS\nSKS KP diambil bersamaan / setelah menyelesaikan KP di organisasi (perusahaan, instansi, yayasan)\nLama KP: 1-2 bulan dengan hitungan kerja part time\nBisa perorangan atau berkelompok maksimal 2 (dua) mahasiswa\nBerkas-berkas KP bisa didapatkan di link resource akademik:\nhttps://intip.in/ResourceAkademikDanKemahasiswaanIF\nProsedur Kerja Praktik\n\nMengajukan KP\nSurat Pengantar KP\nDosen Pembimbing KP\nPelaksanaan KP\nPenilaian KP oleh Pembimbing Lapangan\nPenilaian KP oleh Dosen Pembimbing\nPenyerahan Laporan KP ke RBTC\nMengumpulkan bukti penyelesaian KP\nLulus KP\nSebelum berangkat KP\n\nMengajukan KP\n\nMemenuhi persyaratan sebagai berikut:\nMahasiswa aktif Teknik Informatika\nSKS tempuh minimum 90 SKS\nMengisi MONKP:\nmonkp.if.its.ac.id (registrasi akun dan data KP)\nStatus KP akan menjadi CREATED\nSurat Pengantar Kerja Praktik', 'Meminta persetujuan form pengajuan KP ke Koordinator Kerja Praktek (Sekretaris Departemen 1)\nMenyerahkan Form Pengajuan KP yang sudah disetujui Koord. KP kepada Staf Akademik (Pak Sugeng) untuk dibuatkan surat pengantar ke tempat KP\nSurat pengantar KP dikeluarkan oleh departemen Teknik Informatika yang ditujukan kepada organisasi tempat KP yang berisi:\nPermohonan agar mahasiswa X diijinkan untuk melakukan KP di organisasi Y,\nTanggal mulai,\nDurasi kerja praktik\nSurat pengantar KP dikirimkan ke instansi penerima KP\nJika balasan persetujuan sudah didapatkan, unggah ke MONKP\nStatus KP akan menjadi CONFIRMED\nDosen Pembimbing Kerja Praktik\n\nSyarat mendapatkan dosen pembimbing internal KP:\nStatus KP akan menjadi CONFIRMED\nDosen Pembimbing KP dipilih oleh koordinator KP dengan menyesuaikan load pembimbingan dosen, kecuali ada rekomendasi khusus dari dosen ybs\nPengalokasian dilakukan secara batch operation\nDi lokasi KP\n4. Melaksanakan Kerja Praktik', '20. Sistem Kredit Semester yang selanjutnya disingkat SKS adalah suatu sistem penyelenggaraan pendidikan dengan menggunakan sks.\r\n21. Satuan Kredit Semester yang selanjutnya disingkat sks adalah takaran waktu kegiatan belajar yang dibebankan pada mahasiswa per minggu per semester dalam proses pembelajaran melalui berbagai bentuk pembelajaran atau besarnya pengakuan atas keberhasilan usaha mahasiswa dalam mengikuti kegiatan kurikuler di suatu program studi.\r\n22. Satuan Kegiatan Ekstrakurikuler Mahasiswa, yang selanjutnya disingkat SKEM, adalah satuan yang digunakan untuk mengukur kegiatan ekstrakurikuler mahasiswa dan berfungsi sebagai salah satu syarat kelulusan bagi mahasiswa Program Sarjana Terapan dan Sarjana.\r\n23. Mata Kuliah adalah satuan pelajaran yang diajarkan di tingkat perguruan tinggi.\r\n24. Mata Kuliah Inti adalah mata kuliah wajib yang terkait dengan program studi di ITS.', 'yang setara.  \n(iv) Kegiatan MBKM dalam bentuk KKN dilaksanakan pada semester 6 (enam) dan 7 (tujuh)  \natau sebelum nya dengan syarat telah lulus tahap persiapan.  \n(v) Kegiatan MBKM dalam bentuk KKN yang dilaksanakan sebelum semester 6 (enam) dan \n7 (tujuh) dan s udah lulus tahap persiapan , diakui sebagai MBKM dengan sistem tabung \nnilai.  \n(vi) Kegiatan MBKM dalam bentuk KKN  dikembangkan oleh Direktorat yang mengurusi riset \ndan pengabdian kepada masyarakat . \n(vii) Implementasi MBKM dalam bentuk  KKN  dikoordinir oleh Direktorat yang m engurusi  \npengabdian kepada masyarakat bersama  Prodi  terkait , melalui tahapan kegiatan (a) \npersiapan, (b) Pelaksanaan, (c) Evaluasi, (d) Pengendalian, dan (e) Peningkatan . \n \n10 Standar Proses –  \nKegiatan MBKM – bentuk \nPertukaran Pelajar  (i) Kegiatan MBKM dalam bentuk pertukaran pelajar  dimaksudkan untuk mencapai CPL .  \n(ii) Kegiatan MBKM dalam bentuk pertukaran pelajar  dapat dilakukan dengan PT di dalam \nnegeri atau di luar negeri.']","SKS KP bisa diambil bersamaan atau setelah menyelesaikan KP di organisasi (perusahaan, instansi, yayasan)."
15,Apakah KP bisa dilakukan secara berkelompok?,"Ya, maksimal 2 (dua) mahasiswa","['Meminta persetujuan form pengajuan KP ke Koordinator Kerja Praktek (Sekretaris Departemen 1)\nMenyerahkan Form Pengajuan KP yang sudah disetujui Koord. KP kepada Staf Akademik (Pak Sugeng) untuk dibuatkan surat pengantar ke tempat KP\nSurat pengantar KP dikeluarkan oleh departemen Teknik Informatika yang ditujukan kepada organisasi tempat KP yang berisi:\nPermohonan agar mahasiswa X diijinkan untuk melakukan KP di organisasi Y,\nTanggal mulai,\nDurasi kerja praktik\nSurat pengantar KP dikirimkan ke instansi penerima KP\nJika balasan persetujuan sudah didapatkan, unggah ke MONKP\nStatus KP akan menjadi CONFIRMED\nDosen Pembimbing Kerja Praktik\n\nSyarat mendapatkan dosen pembimbing internal KP:\nStatus KP akan menjadi CONFIRMED\nDosen Pembimbing KP dipilih oleh koordinator KP dengan menyesuaikan load pembimbingan dosen, kecuali ada rekomendasi khusus dari dosen ybs\nPengalokasian dilakukan secara batch operation\nDi lokasi KP\n4. Melaksanakan Kerja Praktik', 'diperoleh mahasiswa dalam pelaksanaan KKNT regular, dan mahasiswa diberi \nkesempatan untuk mengajukan perpanjangan KKNT selama maksimal 1 \nsemester atau setara dengan 20 SKS. Untuk melanjutkan program KKNT yang \ndiperpanjang, mahasiswa dapat memanfaatkan Program Holistik Pembinaan Buku Panduan Merdeka Belajar - Kampus Merdeka       26\ndan Pemberdayaan Desa (PHP2D) dengan mengikuti prosedur dari Direktorat \nBelmawa. Bentuk kegiatan KKNT yang Diperpanjang dapat berupa proyek  \npemberdayaan masyarakat di desa dan penelitian untuk tugas akhir mahasiswa.\nContoh Model KKNT yang Diperpanjang\n2) Model KKNT Pembangunan dan Pemberdayaan Desa\nPada model ini perguruan tinggi bekerja sama dengan Mitra dalam melakukan \nKKNT Pembangunan dan Pemberdayaan Desa berdasarkan peluang/kondisi \ndesa dalam bentuk paket kompetensi/pengembangan RPJMDes yang akan \ndiperoleh mahasiswa dalam pelaksanaan KKNT. Jumlah dan bidang Mahasiswa \nyang mengikuti program ini menyesuaikan dengan kebutuhan program di desa.', 'KKN ABMAS: Kegiatan pengabdian kepada masyarakat oleh mahasiswa yang bergabung pada tim pengabdi dosen ITS dengan pendanaan dari ITS atau Kementerian Riset dan Teknologi/BRIN.\nKKN PPM/Reguler: Kegiatan pengabdian masyarakat multidisiplin dengan tema khusus dari kelompok mahasiswa.\nKKN Kolaborasi: Pengabdian masyarakat oleh mahasiswa bersama mitra atau perguruan tinggi lain dari dalam/luar negeri, termasuk KKN Kolaborasi PTN Jatim, KKN Kebangsaan, KKN Tanggap Bencana, dll.\nKKN Mandiri: Kesempatan bagi mahasiswa untuk beraktivitas sosial di berbagai tempat melalui berbagai kesempatan.', 'Sudah menyelesaikan segala pekerjaan terkait KP di perusahaan dan sudah kembali aktif di kampus\nMenemui dosen pembimbing untuk melakukan ujian lisan dan menyerahkan Formulir Penilaian Ujian Lisan Kerja Praktik untuk diisi oleh dosen pembimbing internal\nDosen pembimbing internal mengirimkan nilai ke koordinator KP via email\nJika nilai telah diterima koordinator KP, maka status KP akan menjadi FINISHED\nMenyerahkan Laporan KP\nSudah menyelesaikan segala urusan KP dengan dosen pembimbing\nDokumentasi KP sudah disetujui dan ditandatangani oleh dosen pembimbing\nDokumentasi tersebut berupa softcopy dan diunggah ke repo ITS (lihat manual unggah ke repo ITS di manual unggah mandiri)\nMenerima Bukti Penyerahan KP dari REPO ITS\nMengunggah buku KP dan bukti terima repo ITS ke MS TEAMS KP pada link berikut:\nhttps://teams.microsoft.com/l/team/19%3a447977fe03c040ff98ad9e82e63982e2%40thread.tacv2/conversations?groupId=862aa22c-c596-49e1-94dd-6354fd625a2e&tenantId=1d5169ac-c7cb-4275-9764-bf8c9c364a4c']","Tidak, KP tidak bisa dilakukan secara berkelompok. KP harus dilakukan oleh mahasiswa secara individu."
16,Apa syarat mengajukan KP?,"Mahasiswa aktif Teknik Informatika, SKS tempuh minimum 90 SKS","['Meminta persetujuan form pengajuan KP ke Koordinator Kerja Praktek (Sekretaris Departemen 1)\nMenyerahkan Form Pengajuan KP yang sudah disetujui Koord. KP kepada Staf Akademik (Pak Sugeng) untuk dibuatkan surat pengantar ke tempat KP\nSurat pengantar KP dikeluarkan oleh departemen Teknik Informatika yang ditujukan kepada organisasi tempat KP yang berisi:\nPermohonan agar mahasiswa X diijinkan untuk melakukan KP di organisasi Y,\nTanggal mulai,\nDurasi kerja praktik\nSurat pengantar KP dikirimkan ke instansi penerima KP\nJika balasan persetujuan sudah didapatkan, unggah ke MONKP\nStatus KP akan menjadi CONFIRMED\nDosen Pembimbing Kerja Praktik\n\nSyarat mendapatkan dosen pembimbing internal KP:\nStatus KP akan menjadi CONFIRMED\nDosen Pembimbing KP dipilih oleh koordinator KP dengan menyesuaikan load pembimbingan dosen, kecuali ada rekomendasi khusus dari dosen ybs\nPengalokasian dilakukan secara batch operation\nDi lokasi KP\n4. Melaksanakan Kerja Praktik', 'Sudah menyelesaikan segala pekerjaan terkait KP di perusahaan dan sudah kembali aktif di kampus\nMenemui dosen pembimbing untuk melakukan ujian lisan dan menyerahkan Formulir Penilaian Ujian Lisan Kerja Praktik untuk diisi oleh dosen pembimbing internal\nDosen pembimbing internal mengirimkan nilai ke koordinator KP via email\nJika nilai telah diterima koordinator KP, maka status KP akan menjadi FINISHED\nMenyerahkan Laporan KP\nSudah menyelesaikan segala urusan KP dengan dosen pembimbing\nDokumentasi KP sudah disetujui dan ditandatangani oleh dosen pembimbing\nDokumentasi tersebut berupa softcopy dan diunggah ke repo ITS (lihat manual unggah ke repo ITS di manual unggah mandiri)\nMenerima Bukti Penyerahan KP dari REPO ITS\nMengunggah buku KP dan bukti terima repo ITS ke MS TEAMS KP pada link berikut:\nhttps://teams.microsoft.com/l/team/19%3a447977fe03c040ff98ad9e82e63982e2%40thread.tacv2/conversations?groupId=862aa22c-c596-49e1-94dd-6354fd625a2e&tenantId=1d5169ac-c7cb-4275-9764-bf8c9c364a4c', 'magang sesuai dengan ketentuan yang berlaku;  \n 9 Dokumen Panduan Baku Mutu Pelaksanaan MBKM - 2021  \n NO ELEMEN PENILAIAN  INDIKATOR  \n(1) (2) (3) \n9 Standar Proses –  \nKegiatan MBKM – bentuk \nPengabdian kepada Masyarakat  (i) Kegiatan MBKM dalam bentuk pengabdian kepada masyarakat  atau selanjutnya \ndikategorikan sebagai KKN  ditujukan untuk pembinaan karakter kebangsaan mahasiswa \nkhususnya untuk menumbuhkan kepedulian terhadap persoalan yang dihadapi \nmasyarakat , sebaga i salah satu CPL dalam aspek Sikap .  \n(ii) Kegiatan MBKM dalam bentuk KKN harus dibawah bimbingan dosen . \n(iii) Kegiatan MBKM dalam bentuk KKN dapat diakui sebagai  tambahan sks atau dapat \ndikompensasi dengan mata kuliah Program Studi yang memiliki capaian pembelajaran \nyang setara.  \n(iv) Kegiatan MBKM dalam bentuk KKN dilaksanakan pada semester 6 (enam) dan 7 (tujuh)  \natau sebelum nya dengan syarat telah lulus tahap persiapan.', 'Menghubungi dosen pembimbing yang sudah ditentukan oleh koordinator KP\nMematuhi dan mengikuti segala aturan terkait kerja praktik di perusahaan/tempat KP\nMengerjakan pekerjaan yang sesuai dengan kompetensi Informatika\nProgress report secara reguler ke dosen pembimbing dan pembimbing lapangan sesuai kesepakatan dengan pembimbing\nPenilaian KP oleh Pembimbing Lapangan\nSudah menyelesaikan segala tugas/pekerjaan yang diberikan pembimbing lapangan di tempat KP\nMeminta pembimbing lapangan untuk mengisi Formulir Penilaian Kerja Praktik Lapangan dilengkapi dengan stempel resmi perusahaan (beberapa perusahaan memiliki format penilaian sendiri)\nSetelah KP selesai\n6. Penilaian KP oleh Dosen Pembimbing']","Syarat mengajukan KP adalah sebagai berikut:
1. Meminta persetujuan form pengajuan KP ke Koordinator Kerja Praktek (Sekretaris Departemen)
2. Menyerahkan Form Pengajuan KP yang sudah disetujui Koordinator KP kepada Staf Akademik (Pak Sugeng) untuk dibuatkan surat pengantar ke tempat KP
3. Surat pengantar KP dikeluarkan oleh departemen Teknik Informatika yang ditujukan kepada organisasi tempat KP yang berisi:
   - Permohonan agar mahasiswa X diijinkan untuk melakukan KP di organisasi Y
   - Tanggal mulai
   - Durasi kerja praktik
4. Surat pengantar KP dikirimkan ke instansi penerima KP
5. Jika balasan persetujuan sudah didapatkan, unggah ke MONKP
6. Status KP akan menjadi CONFIRMED
7. Dosen Pembimbing Kerja Praktik dipilih oleh koordinator KP dengan menyesuaikan load pembimbingan dosen, kecuali ada rekomendasi khusus dari dosen tersebut
8. Pengalokasian dosen pembimbing dilakukan secara batch operation
9. Di lokasi KP, melaksanakan Kerja Praktik."
17,Apa yang harus dilakukan mahasiswa di lokasi KP?,"Mematuhi dan mengikuti segala aturan terkait kerja praktik, dan mengerjakan pekerjaan yang sesuai dengan kompetensi Informatika","['27. Mata Kuliah Penciri ITS adalah mata kuliah yang terdiri dari Bahasa Inggris, Teknopreneur, dan Wawasan dan Aplikasi Teknologi.\r\n28. Kuliah Kerja Nyata Tematik yang selanjutnya disingkat KKNT adalah suatu bentuk pendidikan dengan cara memberikan pengalaman belajar kepada mahasiswa untuk hidup di tengah masyarakat di luar kampus, yang secara langsung bersama-sama masyarakat mengidentifikasi potensi dan menangani masalah sehingga diharapkan mampu mengembangkan potensi desa/daerah dan meramu solusi untuk masalah yang ada di desa.\r\n\r\n        BAB II MAKSUD DAN TUJUAN\r\n\r\nPasal 2\r\n(1) Maksud diterbitkannya Peraturan Rektor ini adalah untuk memberikan pedoman dalam menyelenggarakan kegiatan Merdeka Belajar - Kampus Merdeka (MB - KM) di lingkungan ITS.\r\n(2) Tujuan diterbitkannya Peraturan Rektor ini adalah untuk mewujudkan kegiatan pembelajaran yang dapat menghasilkan lulusan yang berkualitas dan memenuhi visi, misi, tata nilai dan tujuan ITS serta memenuhi SN-DIKTI.\r\n\r\nBAB III', 'diperoleh mahasiswa dalam pelaksanaan KKNT regular, dan mahasiswa diberi \nkesempatan untuk mengajukan perpanjangan KKNT selama maksimal 1 \nsemester atau setara dengan 20 SKS. Untuk melanjutkan program KKNT yang \ndiperpanjang, mahasiswa dapat memanfaatkan Program Holistik Pembinaan Buku Panduan Merdeka Belajar - Kampus Merdeka       26\ndan Pemberdayaan Desa (PHP2D) dengan mengikuti prosedur dari Direktorat \nBelmawa. Bentuk kegiatan KKNT yang Diperpanjang dapat berupa proyek  \npemberdayaan masyarakat di desa dan penelitian untuk tugas akhir mahasiswa.\nContoh Model KKNT yang Diperpanjang\n2) Model KKNT Pembangunan dan Pemberdayaan Desa\nPada model ini perguruan tinggi bekerja sama dengan Mitra dalam melakukan \nKKNT Pembangunan dan Pemberdayaan Desa berdasarkan peluang/kondisi \ndesa dalam bentuk paket kompetensi/pengembangan RPJMDes yang akan \ndiperoleh mahasiswa dalam pelaksanaan KKNT. Jumlah dan bidang Mahasiswa \nyang mengikuti program ini menyesuaikan dengan kebutuhan program di desa.', '- Kampus Merdeka di atas, untuk kegiatan KKNT terdapat persyaratan tambahan \nyang harus dipenuhi oleh mahasiswa, yaitu:\n1) Mahasiswa telah menyelesaikan proses pembelajaran setelah  semester 6.\n2) Dilakukan secara berkelompok,  anggota berjumlah ± 10   orang per kelompok \ndan atau sesuai kebutuhan desa, dan bersifat multidisiplin (asal prodi/fakultas/\nkluster  yang berbeda).Buku Panduan Merdeka Belajar - Kampus Merdeka       24\n3) Peserta wajib tinggal di komunitas atau wajib “live in”  di lokasi yang telah \nditentukan. \n4) Sehat jasmani dan rohani serta tidak sedang hamil bagi wanita.\n5) IPK minimal 2.00 sampai dengan semester 5.\n6) Ketentuan lain dapat diatur oleh perguruan tinggi pelaksana.\nAdapun untuk mekanisme pelaksanaan kegiatan membangun desa/kuliah kerja \nnyata adalah sebagai berikut.\n1) Perguruan Tinggi\na) Menjalin kerja sama dengan pihak Kementerian Desa PDTT, serta Kemdikbud \ndalam penyelenggaraan program proyek di desa atau menjalin kerja sama', 'masyarakat di luar kampus, yang secara langsung bersama-sama masyarakat \nmengidentifikasi potensi dan menangani masalah sehingga diharapkan mampu \nmengembangkan potensi desa/daerah dan meramu solusi untuk masalah yang ada \ndi desa. Kegiatan KKNT diharapkan dapat mengasah softskill  kemitraan, kerjasama \ntim lintas disiplin/keilmuan (lintas kompetensi), dan leadership  mahasiswa dalam \nmengelola program pembangunan di wilayah perdesaan. Sejauh ini perguruan \ntinggi sudah menjalankan program KKNT, hanya saja Satuan Kredit Semesternya \n(SKS) belum bisa atau dapat diakui sesuai dengan program kampus merdeka yang \npengakuan kreditnya setara 6 – 12 bulan atau 20 – 40 SKS, dengan pelaksanaannya \nberdasarkan beberapa model. Diharapkan juga setelah pelaksanaan KKNT, mahasiswa \ndapat menuliskan hal-hal yang dilakukannya beserta hasilnya dalam bentuk tugas \nakhir.\nPelaksanaan KKNT dilakukan untuk mendukung kerja sama bersama Kementerian']","Mahasiswa di lokasi Kuliah Kerja Nyata (KKNT) harus tinggal di komunitas atau wajib ""live in"" di lokasi yang telah ditentukan. Selain itu, mahasiswa juga harus menjalankan kegiatan pembangunan desa atau pemberdayaan masyarakat di desa, mengidentifikasi potensi dan menangani masalah bersama masyarakat setempat, serta mengembangkan potensi desa/daerah dan meramu solusi untuk masalah yang ada di desa. Kegiatan KKNT diharapkan dapat mengasah softskill kemitraan, kerjasama tim lintas disiplin/keilmuan, dan leadership mahasiswa dalam mengelola program pembangunan di wilayah perdesaan."
18,Kapan batas waktu penyerahan laporan KP?,Paling lambat 1 bulan setelah tanggal selesainya kerja praktek di perusahaan,"['KERJA PRAKTIK\nDepartemen Teknik Informatika ITS\n\nSekilas Kerja Praktik\n\nJumlah kredit Mata Kuliah KP: 2 SKS\nSKS KP diambil bersamaan / setelah menyelesaikan KP di organisasi (perusahaan, instansi, yayasan)\nLama KP: 1-2 bulan dengan hitungan kerja part time\nBisa perorangan atau berkelompok maksimal 2 (dua) mahasiswa\nBerkas-berkas KP bisa didapatkan di link resource akademik:\nhttps://intip.in/ResourceAkademikDanKemahasiswaanIF\nProsedur Kerja Praktik\n\nMengajukan KP\nSurat Pengantar KP\nDosen Pembimbing KP\nPelaksanaan KP\nPenilaian KP oleh Pembimbing Lapangan\nPenilaian KP oleh Dosen Pembimbing\nPenyerahan Laporan KP ke RBTC\nMengumpulkan bukti penyelesaian KP\nLulus KP\nSebelum berangkat KP\n\nMengajukan KP\n\nMemenuhi persyaratan sebagai berikut:\nMahasiswa aktif Teknik Informatika\nSKS tempuh minimum 90 SKS\nMengisi MONKP:\nmonkp.if.its.ac.id (registrasi akun dan data KP)\nStatus KP akan menjadi CREATED\nSurat Pengantar Kerja Praktik', 'Meminta persetujuan form pengajuan KP ke Koordinator Kerja Praktek (Sekretaris Departemen 1)\nMenyerahkan Form Pengajuan KP yang sudah disetujui Koord. KP kepada Staf Akademik (Pak Sugeng) untuk dibuatkan surat pengantar ke tempat KP\nSurat pengantar KP dikeluarkan oleh departemen Teknik Informatika yang ditujukan kepada organisasi tempat KP yang berisi:\nPermohonan agar mahasiswa X diijinkan untuk melakukan KP di organisasi Y,\nTanggal mulai,\nDurasi kerja praktik\nSurat pengantar KP dikirimkan ke instansi penerima KP\nJika balasan persetujuan sudah didapatkan, unggah ke MONKP\nStatus KP akan menjadi CONFIRMED\nDosen Pembimbing Kerja Praktik\n\nSyarat mendapatkan dosen pembimbing internal KP:\nStatus KP akan menjadi CONFIRMED\nDosen Pembimbing KP dipilih oleh koordinator KP dengan menyesuaikan load pembimbingan dosen, kecuali ada rekomendasi khusus dari dosen ybs\nPengalokasian dilakukan secara batch operation\nDi lokasi KP\n4. Melaksanakan Kerja Praktik', 'Sudah menyelesaikan segala pekerjaan terkait KP di perusahaan dan sudah kembali aktif di kampus\nMenemui dosen pembimbing untuk melakukan ujian lisan dan menyerahkan Formulir Penilaian Ujian Lisan Kerja Praktik untuk diisi oleh dosen pembimbing internal\nDosen pembimbing internal mengirimkan nilai ke koordinator KP via email\nJika nilai telah diterima koordinator KP, maka status KP akan menjadi FINISHED\nMenyerahkan Laporan KP\nSudah menyelesaikan segala urusan KP dengan dosen pembimbing\nDokumentasi KP sudah disetujui dan ditandatangani oleh dosen pembimbing\nDokumentasi tersebut berupa softcopy dan diunggah ke repo ITS (lihat manual unggah ke repo ITS di manual unggah mandiri)\nMenerima Bukti Penyerahan KP dari REPO ITS\nMengunggah buku KP dan bukti terima repo ITS ke MS TEAMS KP pada link berikut:\nhttps://teams.microsoft.com/l/team/19%3a447977fe03c040ff98ad9e82e63982e2%40thread.tacv2/conversations?groupId=862aa22c-c596-49e1-94dd-6354fd625a2e&tenantId=1d5169ac-c7cb-4275-9764-bf8c9c364a4c', 'diperoleh mahasiswa dalam pelaksanaan KKNT regular, dan mahasiswa diberi \nkesempatan untuk mengajukan perpanjangan KKNT selama maksimal 1 \nsemester atau setara dengan 20 SKS. Untuk melanjutkan program KKNT yang \ndiperpanjang, mahasiswa dapat memanfaatkan Program Holistik Pembinaan Buku Panduan Merdeka Belajar - Kampus Merdeka       26\ndan Pemberdayaan Desa (PHP2D) dengan mengikuti prosedur dari Direktorat \nBelmawa. Bentuk kegiatan KKNT yang Diperpanjang dapat berupa proyek  \npemberdayaan masyarakat di desa dan penelitian untuk tugas akhir mahasiswa.\nContoh Model KKNT yang Diperpanjang\n2) Model KKNT Pembangunan dan Pemberdayaan Desa\nPada model ini perguruan tinggi bekerja sama dengan Mitra dalam melakukan \nKKNT Pembangunan dan Pemberdayaan Desa berdasarkan peluang/kondisi \ndesa dalam bentuk paket kompetensi/pengembangan RPJMDes yang akan \ndiperoleh mahasiswa dalam pelaksanaan KKNT. Jumlah dan bidang Mahasiswa \nyang mengikuti program ini menyesuaikan dengan kebutuhan program di desa.']","Batas waktu penyerahan laporan KP adalah setelah mahasiswa menyelesaikan segala pekerjaan terkait KP di perusahaan dan sudah kembali aktif di kampus. Setelah itu, mahasiswa harus menemui dosen pembimbing untuk melakukan ujian lisan dan menyerahkan Formulir Penilaian Ujian Lisan Kerja Praktik untuk diisi oleh dosen pembimbing internal. Dokumentasi KP yang sudah disetujui dan ditandatangani oleh dosen pembimbing berupa softcopy harus diunggah ke repo ITS. Kemudian, mahasiswa harus menerima Bukti Penyerahan KP dari REPO ITS dan mengunggah buku KP serta bukti terima repo ITS ke MS TEAMS KP."
19,Bagaimana format nama file untuk laporan KP dengan pengarang tunggal?,NRP-Project_Report,"['Meminta persetujuan form pengajuan KP ke Koordinator Kerja Praktek (Sekretaris Departemen 1)\nMenyerahkan Form Pengajuan KP yang sudah disetujui Koord. KP kepada Staf Akademik (Pak Sugeng) untuk dibuatkan surat pengantar ke tempat KP\nSurat pengantar KP dikeluarkan oleh departemen Teknik Informatika yang ditujukan kepada organisasi tempat KP yang berisi:\nPermohonan agar mahasiswa X diijinkan untuk melakukan KP di organisasi Y,\nTanggal mulai,\nDurasi kerja praktik\nSurat pengantar KP dikirimkan ke instansi penerima KP\nJika balasan persetujuan sudah didapatkan, unggah ke MONKP\nStatus KP akan menjadi CONFIRMED\nDosen Pembimbing Kerja Praktik\n\nSyarat mendapatkan dosen pembimbing internal KP:\nStatus KP akan menjadi CONFIRMED\nDosen Pembimbing KP dipilih oleh koordinator KP dengan menyesuaikan load pembimbingan dosen, kecuali ada rekomendasi khusus dari dosen ybs\nPengalokasian dilakukan secara batch operation\nDi lokasi KP\n4. Melaksanakan Kerja Praktik', 'File PDF tanpa watermark. Berisi semua isi TA/Tesis/Disertasi dari cover sampai lampiran.\nPDF File without watermark. Full content from cover to Appendix.\nPastikan lembar Pengesahan sudah ditandatangani dosen pembimbing dan stempel departemen.\nInclude Approval sheet which has been signed by Thesis Advisors.\nLaporan KP dengan pengarang tunggal:\n\nNRP-Project_Report\nStudent ID Number-Project_Report\nContoh: / example: 04111060010007-Project_Report\nLaporan KP dengan 2 pengarang atau lebih:\n\nProject report with 2 authors or more\nNRP1_NRP2-Project_Report\nStudent ID Number1_ Student ID Number2-Project_Report\nContoh: / example: 04111060010007_04111060010111-Project_Report\nFormat Nama File / File Name\n\nGunakan NRP sebagai username dan password.\nUse your Student ID Number as username and password.\n123 Nama anda nampak di sini\nYour name appear here\nKlik “New item” / Click “New item”\nMANAGE DEPOSITS\n\nPilih “Monograph” / Choose “Monograph”\nKemudian klik “Next” / Then Click “Next”', 'MENGISI METADATA / METADATA ENTRIES\n\nMonograph Type, pilih “Project Report”\nMonograph Type, choose “Project Report”.\nCorporate Creators, diisi nama Perusahaan yang berkontribusi dalam penulisan KP.\nNIDN, diisi NIDN dosen pembimbing. Boleh dikosongkan bila tidak tahu.\nNIDN, fill it with thesis advisor ID number. Can be blank.\nMENGISI METADATA / METADATA ENTRIES\n\nIsikan nama dosen pembimbing dengan nama belakang pada kolom family name.\nFill it with Thesis Advisors name.\nPilih “Thesis Advisor” / Choose “Thesis Advisor”.\nNRP/NIM: diisi NIM [no NRP]\nNRP/NIM: NIM [student ID number].\nCreators, isikan pengarang dengan nama belakang pada kolom family name.\nCreators, fill it with creators name.\nMENGISI METADATA / METADATA ENTRIES', 'Sudah menyelesaikan segala pekerjaan terkait KP di perusahaan dan sudah kembali aktif di kampus\nMenemui dosen pembimbing untuk melakukan ujian lisan dan menyerahkan Formulir Penilaian Ujian Lisan Kerja Praktik untuk diisi oleh dosen pembimbing internal\nDosen pembimbing internal mengirimkan nilai ke koordinator KP via email\nJika nilai telah diterima koordinator KP, maka status KP akan menjadi FINISHED\nMenyerahkan Laporan KP\nSudah menyelesaikan segala urusan KP dengan dosen pembimbing\nDokumentasi KP sudah disetujui dan ditandatangani oleh dosen pembimbing\nDokumentasi tersebut berupa softcopy dan diunggah ke repo ITS (lihat manual unggah ke repo ITS di manual unggah mandiri)\nMenerima Bukti Penyerahan KP dari REPO ITS\nMengunggah buku KP dan bukti terima repo ITS ke MS TEAMS KP pada link berikut:\nhttps://teams.microsoft.com/l/team/19%3a447977fe03c040ff98ad9e82e63982e2%40thread.tacv2/conversations?groupId=862aa22c-c596-49e1-94dd-6354fd625a2e&tenantId=1d5169ac-c7cb-4275-9764-bf8c9c364a4c']",Format nama file untuk laporan KP dengan pengarang tunggal adalah NRP-Project_Report. Contoh: 04111060010007-Project_Report.
