,question,ground_truth,contexts,answer
0,Apa visi ITS?,Menjadi perguruan tinggi dengan reputasi internasional dalam ilmu pengetahuan dan teknologi terutama yang menunjang industri dan kelautan yang berwawasan lingkungan.,"['PENGALAMAN TENTANG KEBUDAYAAN DAERAH LAIN\nMELALUI MODUL NUSANTARA\nSelain mengikuti pembelajaran mata kuliah di perguruan tinggi penerima, mahasiswa yang mengikuti program Pertukaran Mahasiswa Merdeka juga akan mendapatkan pengalaman langsung berinteraksi dengan mahasiswa dari daerah lain dan mempelajari kebudayaan daerah lain melalui Modul Nusantara. Modul Nusantara ini senilai 2 sks dan wajib diambil oleh mahasiswa peserta program Pertukaran Mahasiswa Merdeka. Modul Nusantara dilaksanakan di perguruan tinggi penerima. Modul Nusantara dibagi ke dalam empat jenis kegiatan yaitu kebinekaan, inspirasi, refleksi, dan kontribusi sosial. Dalam pelaksanaan Modul Nusantara, mahasiswa akan dibimbing oleh dosen pembimbing modul nusantara dan dibantu oleh mentor.\nBAGAIMANA MEKANISME PELAKSANAAN PERTUKARAN\nMAHASISWA MERDEKA?\nTerdapat dua mekanisme, yaitu:', 'Teknologi Subdit. PK2 \nits.id/DigitalisasiSRSPTJM_ITS  \n2023 \nSubdit. PK2 \nAkses informasi lebih lanjut: \n@itscareercenter \nOfficial Instagram Subdit. PK2 ITS \nhttps://kampusmerdeka.kemdikbud.go.id 2023 \nSubdit. PK2 \nTERIMA KASIH', 'Subdit. PK2\nSKEMA PELAKSANAAN\nPROGRAM MAGANG\nMANDIRI DI ITS\nMahasiswa / Departemen melakukan\nmenyertakan:\n1. Proposal Magang\n2. Surat Rekomendasi Departemen\n3. Surat Penerimaan Magang\nPelaksanaan Magang\nProses pengurusan\nPKS\nPKS tidak\ndisetujui\nPKS\nTertandatangan\nSelesai\nMagang berakhir <\nMahasiswa mendapatkan\nSertifikat / Penilaian Magang\nSelesai\nADVANCING HUMANITY\niTS\nMulai\nMahasiswa mengurus\nsurat rekomendasi\ndepartemen untuk pengajuan magang ke\nMitra\nMahasiswa mengajukan\npermohonan magang ke\nMitra\nMitra melakukan seleksi magang\nMahasiswa menerima hasil seleksi magang dari Mitra\nTidak diterima\nSelesai\nDiterima\nMahasiswa melaporkan\nke Departemen', '23. Mata Kuliah adalah satuan pelajaran yang diajarkan di tingkat perguruan tinggi.\r\n24. Mata Kuliah Inti adalah mata kuliah wajib yang terkait dengan program studi di ITS.\r\n25. Mata Kuliah Non-Inti adalah mata kuliah di ITS yang meliputi mata kuliah wajib kurikulum, mata kuliah penciri ITS, mata kuliah pilihan program studi, dan mata kuliah pengayaan.\r\n26. Mata Kuliah Wajib Kurikulum adalah mata kuliah yang terdiri dari Agama, Pancasila, Kewarganegaraan, dan Bahasa Indonesia.\r\n27. Mata Kuliah Penciri ITS adalah mata kuliah yang terdiri dari Bahasa Inggris, Teknopreneur, dan Wawasan dan Aplikasi Teknologi.']",Saya tidak menemukan informasi tentang visi ITS dalam konteks yang diberikan.
1,Apa itu Body of Knowledge?,"Istilah yang digunakan untuk mewakili secara lengkap konsep, istilah, dan aktivitas yang membentuk kemampuan profesional, yang didefinisikan oleh masyarakat terpelajar atau asosiasi profesional yang relevan.","['terlibat di dalam pro ses dan hasil pelaksanaan MBKM.  \n(2). SOP yang diterbitkan oleh: (a) Direktorat terkait sebagai koordinator pelaksana \nmasing -masing bentuk MBKM, (b) Prodi sebagai pelaksana MBKM  untuk memandu \ndosen, mahasiswa dan tenaga kependidikan yang terlibat di dalam proses dan hasil \npelaksanaan MBKM.  \nDokumen (1) dan (2) di atas, merupakan manual untuk seluruh stakeholder yang terlibat \ndi dalam implementasi MBKM, yang dapat disusun dalam satu dokumen atau lebih secara \nterpisah. Rambu -rambu dalam penyusunan ke dua dokumen di atas, dengan ketentuan \nmemuat unsur -unsur sebagai berikut, dan dapat dikembangkan sesuai dengan kebutuhan \ndan tujuan pelaksanaan MBKM.  \n1. Tujuan dan ma ksud Manual MBKM  \n2. Luas lingkup Manual MBKM  \na. Manual Penetapan standar  \nb. Manual pelaksanaan standar  \nc. Manual evaluasi standar  \nd. Manual pengendalian pelaksnanaan standar  \ne. Manual peningkatan standar  \n3. Rincian tentang hal yang harus dikerjakan', '07\nPEDOMAN\nPENULISAN\nLAPORAN\nMAGANG\n\n07\nPEDOMAN PENULISAN LAPORAN\nMAGANG\n7.1\nFUNGSI LAPORAN MAGANG\nPertanggungjawaban kegiatan Magang mahasiswa kepada Mitra Magang dan\nDepartemen.\n女你公\n299\nBahan pertimbangan pemberian nilai kegiatan Magang\nДо\nPenyampaian informasi bagi pihak ITS, mahasiswa, maupun Mitra Magang\nSalah satu alat untuk membina hubungan kerjasama, saling pengertian, dan koordinasi antara mahasiswa dengan pihak ITS maupun Mitra Magang\nSalah satu alat untuk menyampaikan ide, pendapat, penilaian, dan pengalaman yang berkaitan dengan penyelenggaraan Magang kepada\npihak lain.\n44\n07 Pedoman Penulisan Laporan Magang', 'Kepada Yth. 1. Dekan\n             2. Kepala Departemen\n             Pada Program Pendidikan Akademik di Lingkungan ITS\n\n\nMempertimbangkan:\n(1). Peraturan Menteri Pendidikan dan Kebudayaan Republik Indonesia Nomor 3 Tahun 2020 tentang Standar Nasional\n      Pendidikan Tinggi;\n(2) Keputusan Menteri Pendidikan dan Kebudayaan Nomor 74/P/2021 tentang Pengakuan Satuan Kredit Semester\n      Pembelajaran Program Kampus Merdeka;\n(3). Peraturan Rektor ITS Nomor 27 Tahun 2020 Tentang Pedoman Evaluasi Kurikulum Untuk Program Pendidikan\n      Akademik Dan Profesi Di Lingkungan Institut Teknologi Sepuluh Nopember;\n(4). Peraturan Rektor ITS Nomor 30 Tahun 2020 Tentang Penyelenggaraan Kegiatan Merdeka Belajar –       Kampus\n      Merdeka Di Institut Teknologi Sepuluh Nopember,', 'Subdit. PK2\nPeranan Perguruan Tinggi\nPimpinan Perguruan Tinggi\nPimpinan Perguruan Tinggi, bertugas untuk memberikan persetujuan final kepada mahasiswa yang ingin mendaftar program flagship MBKM, dengan ketentuan sebagai berikut:\n1) Pimpinan PT wajib mempunyai salah satu jabatan sebagai pimpinan perguruan tinggi;\n리\nPimpinan PT bertugas menentukan penanggung jawab dari masing-masing prodi atau fakultas untuk bertindak sebagai pihak yang akan merekomendasikan mahasiswa untuk mengikuti\nprogram MBKM; dan\n3)\nPimpinan PT bertugas memberikan persetujuan akhir daftar mahasiswa setelah mendapatkan rekomendasi dari prodi atau fakultas pada laman\nADVANCING HUMANITY\nPenanggungjawab Fakultas atau Prodi\nPenanggung Jawab Fakultas atau Prodi, bertugas untuk:\n1)\n2)\n3\nMelakukan verifikasi kebenaran data dan dokumen mahasiswa yang akan mendaftar Program flagship\nMBKM;']",Saya tidak tahu.
2,Apa itu CPL?,Capaian Pembelajaran Lulusan,"['magang sesuai dengan ketentuan yang berlaku;  \n 9 Dokumen Panduan Baku Mutu Pelaksanaan MBKM - 2021  \n NO ELEMEN PENILAIAN  INDIKATOR  \n(1) (2) (3) \n9 Standar Proses –  \nKegiatan MBKM – bentuk \nPengabdian kepada Masyarakat  (i) Kegiatan MBKM dalam bentuk pengabdian kepada masyarakat  atau selanjutnya \ndikategorikan sebagai KKN  ditujukan untuk pembinaan karakter kebangsaan mahasiswa \nkhususnya untuk menumbuhkan kepedulian terhadap persoalan yang dihadapi \nmasyarakat , sebaga i salah satu CPL dalam aspek Sikap .  \n(ii) Kegiatan MBKM dalam bentuk KKN harus dibawah bimbingan dosen . \n(iii) Kegiatan MBKM dalam bentuk KKN dapat diakui sebagai  tambahan sks atau dapat \ndikompensasi dengan mata kuliah Program Studi yang memiliki capaian pembelajaran \nyang setara.  \n(iv) Kegiatan MBKM dalam bentuk KKN dilaksanakan pada semester 6 (enam) dan 7 (tujuh)  \natau sebelum nya dengan syarat telah lulus tahap persiapan.', 'Subdit. PK2\nPeranan Perguruan Tinggi\nPimpinan Perguruan Tinggi\nPimpinan Perguruan Tinggi, bertugas untuk memberikan persetujuan final kepada mahasiswa yang ingin mendaftar program flagship MBKM, dengan ketentuan sebagai berikut:\n1) Pimpinan PT wajib mempunyai salah satu jabatan sebagai pimpinan perguruan tinggi;\n리\nPimpinan PT bertugas menentukan penanggung jawab dari masing-masing prodi atau fakultas untuk bertindak sebagai pihak yang akan merekomendasikan mahasiswa untuk mengikuti\nprogram MBKM; dan\n3)\nPimpinan PT bertugas memberikan persetujuan akhir daftar mahasiswa setelah mendapatkan rekomendasi dari prodi atau fakultas pada laman\nADVANCING HUMANITY\nPenanggungjawab Fakultas atau Prodi\nPenanggung Jawab Fakultas atau Prodi, bertugas untuk:\n1)\n2)\n3\nMelakukan verifikasi kebenaran data dan dokumen mahasiswa yang akan mendaftar Program flagship\nMBKM;', 'Pemasaran Digital 3\nWirausaha\n1. Desain Wirausaha dan \nPresentasi\n2. Praktik Wirausaha\n3. Laporan Pelaksanaan \nWirausaha dan Presentasi3\n4\n3\nJumlah 6 MK 20 SKS\nPenjelasan Tabel 2.4. \nMahasiswa Ilmu Komunikasi mengambil bentuk kegiatan pembelajaran \nberupa Kewirausahaan untuk menambah kompetensinya di bidang wirausaha. \nKompetensi yang telah dicapai melalui serangkaian proses kegiatan pembelajaran \nkewirausahaan ini sesuai dengan CPL, proses pencapaian CPL tersebut dapat \ndiekuivalensikan kedalam mata kuliah Kewirausahaan Sosial, Etika Bisnis, \nPengantar Manajemen dan Bisnis, Pemasaran Digital, Desain Wirausaha dan \nPresentasi, Praktik Wirausaha, serta Laporan Wirausaha dan Presentasi yang \nsetara dengan 20 SKS.\nProses Program Wirausaha\n21       Buku Panduan Merdeka Belajar - Kampus Merdeka\ng. Studi/Proyek Independen\nBanyak mahasiswa yang memiliki passion untuk mewujudkan karya besar yang \ndilombakan di tingkat internasional atau karya dari ide yang inovatif. Idealnya, studi/', 'Tabel 2.1 Standar dalam penyelenggaraan MB -KM di   ITS \nNO ELEMEN PENILAIAN  INDIKATOR  \n(1) (2) (3) \nI STANDAR KOMPETENSI LULUSAN  \n1 Standar Kompetensi Lulusan  (i) Pelaksanaan MBKM mengacu pada CPL Prodi sebagai target dari kemampuan lulusan, \ndengan minimal pencapaian 80%  CPL dan atau sebagai kompetensi tambahan  \n(ii) Kompetensi tambahan dimaksudkan untuk memperlancar karir lulusan, kolaborasi riset \ndan atau kerja sama p engembangan industri.  \nII STANDAR ISI PEMBELAJARAN  \n2 Standar Isi  – MK Pengayaan  (i) Prodi menyediakan kurikulum untuk pelaksanaan MBKM yang disusun bersama \npemangku kepentingan internal dan eksternal, serta direview oleh pakar bidang ilmu \nprogram studi nya.  \n(ii) Keterjaminan pemenuhan CPL  melalui MBKM ( ketersediaan matrik / peta CPL - MK \nMBKM ), dan ketersediaan modul MK melalui pembelajaran  untuk MK yang \ndilaksanakan secara MBKM']","CPL adalah singkatan dari Capaian Pembelajaran Lulusan. Dalam konteks yang diberikan, CPL digunakan sebagai acuan untuk menilai kemampuan lulusan, dengan minimal pencapaian 80% CPL sebagai target dari kemampuan lulusan. Selain itu, CPL juga dapat menjadi kompetensi tambahan yang dimaksudkan untuk memperlancar karir lulusan, kolaborasi riset, dan/atau kerja sama pengembangan industri."
3,Berapa jam kerja magang yang setara dengan 1 SKS?,1 SKS = 2.720 menit magang atau 45 jam,"['KERJA PRAKTIK\nDepartemen Teknik Informatika ITS\n\nSekilas Kerja Praktik\n\nJumlah kredit Mata Kuliah KP: 2 SKS\nSKS KP diambil bersamaan / setelah menyelesaikan KP di organisasi (perusahaan, instansi, yayasan)\nLama KP: 1-2 bulan dengan hitungan kerja part time\nBisa perorangan atau berkelompok maksimal 2 (dua) mahasiswa\nBerkas-berkas KP bisa didapatkan di link resource akademik:\nhttps://intip.in/ResourceAkademikDanKemahasiswaanIF\nProsedur Kerja Praktik\n\nMengajukan KP\nSurat Pengantar KP\nDosen Pembimbing KP\nPelaksanaan KP\nPenilaian KP oleh Pembimbing Lapangan\nPenilaian KP oleh Dosen Pembimbing\nPenyerahan Laporan KP ke RBTC\nMengumpulkan bukti penyelesaian KP\nLulus KP\nSebelum berangkat KP\n\nMengajukan KP\n\nMemenuhi persyaratan sebagai berikut:\nMahasiswa aktif Teknik Informatika\nSKS tempuh minimum 90 SKS\nMengisi MONKP:\nmonkp.if.its.ac.id (registrasi akun dan data KP)\nStatus KP akan menjadi CREATED\nSurat Pengantar Kerja Praktik', '(3) Kegiatan magang/ praktik kerja pada program sarjana terapan diimplementasikan dalam bentuk mata kuliah wajib yang merupakan mata kuliah penciri Fakultas Vokasi sebesar 14 (empat belas) sks.\r\n(4) Kegiatan magang/ praktik kerja pada program sarjana dapat dikonversikan menjadi:\r\na. sks kerja praktek; atau\r\n\r\nb. sks satu atau beberapa mata kuliah yang memiliki Capaian Pembelajaran Mata Kuliah (CPMK) sama dengan magang; atau\r\nc. sks gabungan antara kerja praktek dengan mata kuliah yang memiliki CPMK sama dengan magang atau mata kuliah magang dengan total maksimal 20 (dua puluh) sks.\r\n(5) Persyaratan mahasiswa yang dapat mengikuti kegiatan magang di Program Studi yang belum memiliki mata kuliah magang adalah mahasiswa sudah lulus 72 (tujuh puluh dua sks.\r\n(6) Mekanisme dan penyelenggaraan kegiatan magang/ praktik kerja dikembangkan dan dikoordinasikan oleh Direktorat yang mengurusi kemahasiswaan.', 'NO ELEMEN PENILAIAN  INDIKATOR  \n(1) (2) (3) \natau kombinasi keduanya  \n6 Standar Proses – Tempat \npelaksanaan MBKM  Tempat k egiatan MB – KM dapat dilaksanakan di luar Program Studi baik yang ada di internal \nITS maupun di luar ITS . \n7 Standar Proses –  \nLama waktu pelaksanaan \nMBKM  Lama waktu pelaksanaan MBKM, dapat dikonvesi ke MK, dengan syarat:  \ni. Lama kegiatan belajar dapat dikonversi ke dalam sks adalah minimal 2720 menit atau \n45.3 jam.  \nii. Lama kegiatan bentuk MBKM dihitung atas waktu untuk:  (a) persiapan  di tempat \nMBKM , (b) pelaksanaan, (c) penilaian, dan  (d)  pelaporan.  \niii. Lama waktu kegiatan MB -KM bentuk magang, minimal 3 bulan dan maksimal 6 bulan.  \n8 Standar Proses –  \nKegiatan akademik selama  \nMBKM  – bentuk magang  (i) Mahasiswa yang melaksakan magang harus bekerja di lapangan secara penuh waktu \nsesuai dengan kesepakata n tempat magang;  \n(ii) Mahasiswa yang melaksanakan magang dapat melakukan kegiatan praktek / kolaborasi', 'masih perlu ditingkatkan, salah satunya melalui mahasiswa yang dapat menjadi \nsumber daya manusia yang lebih memberdayakan dana desa.\n23       Buku Panduan Merdeka Belajar - Kampus Merdeka\nTujuan program membangun desa/kuliah kerja nyata antara lain:\n1) Kehadiran mahasiswa selama 6 – 12 bulan dapat memberikan kesempatan \nkepada mahasiswa untuk memanfaatkan ilmu pengetahuan, teknologi, \ndan keterampilan yang dimilikinya bekerjasama dengan banyak pemangku \nkepentingan di lapangan.\n2) Membantu percepatan pembangunan di wilayah pedesaan bersama dengan \nKementerian Desa PDTT.\nManfaat program membangun desa/kuliah kerja nyata antara lain:\n1) Bagi Mahasiswa\na) Membuat mahasiswa mampu melihat potensi desa, mengidentifikasi masalah \ndan mencari solusi untuk meningkatkan potensi dan menjadi desa mandiri. \nb) Membuat mahasiswa mampu berkolaborasi menyusun dan membuat \nRencana Pembangunan Jangka Menengah Desa (RPJMDes), Rencana Kegiatan']","Jam kerja magang yang setara dengan 1 SKS adalah minimal 45.3 jam, sesuai dengan standar proses yang dijelaskan dalam panduan pelaksanaan bentuk pembelajaran MBKM."
4,Apa durasi maksimal magang menurut peraturan rektor?,Maksimal 6 bulan,"['APA SAJA SYARAT DAN KETENTUAN UNTUK JENIS MAGANG MBKM ?\n\n1. Mahasiswa aktif ITS tingkat Sarjana dan Diploma\n2. Minimal mahasiswa sudah lulus 90 SKS atau sudah lulus semester 5.\n3. Mahasiswa tidak diperkenankan mengambil Program Kegiatan Magang (BKP)\nMBKM yang sama lebih dari 1 kali.\n4. Mahasiswa WAJIB melakukan konversi alih kredit ke SKS MK.\n5. Mahasiswa/Departemen WAJIB membuat/memiliki surat PKS.\n6. Pelaksanaan Magang sebelum minggu ke-3 perkuliahan di ITS.\n7. Mahasiswa tidak diperkenankan mengambil MK, atau hanya diperkenankan\nmengambil maks. 3 MK (setara 10 SKS).\n8. Pelaksanaan Magang selama 3 – 6 bulan.\n\nAPA SAJA\nSYARAT DAN\nKETENTUAN\nUNTUK JENIS\nMAGANG\nNON-MBKM', '(3) Tim MB-KM ITS ditetapkan melalui Keputusan Rektor.\r\n\r\n        BAB V KETENTUAN PENUTUP\r\n\r\nPasal 16\r\nPada saat Peraturan Rektor ini mulai berlaku, maka Peraturan Rektor Institut Teknologi Sepuluh Nopember Nomor 30 Tahun 2020 tentang Penyelenggaraan Kegiatan Merdeka Belajar - Kampus Merdeka Di Institut Teknologi Sepuluh Nopember dicabut dan dinyatakan tidak berlaku.\r\n\r\nPasal 17\r\nPeraturan Rektor ini mulai berlaku pada tanggal ditetapkan.\r\n\r\n\r\nDitetapkan di Surabaya\r\npada tanggal 12 Oktober 2021\r\nREKTOR INSTITUT TEKNOLOGI SEPULUH NOPEMBER,\r\n\r\n\r\n\r\n\r\nMOCHAMAD ASHARI\r\nNIP 196510121990031003', 'c. Jumlah penilaian terhadap pelaksanaan MBKM minimal sebanyak 4 (empat).  \nd. Pelaporan terhadap proses dan hasil penilaian dilakukan oleh Dosen pembimbing \nakademik dalam pelaksanaan MBKM.  \ne. Sistem informasi untuk mempermudah pendataan – implementasi MBKM di Pro di. \n \n2.4 Pengendalian  \nPengendalian pelaksanaan MBKM dilakukan oleh Prodi bersama direktorat dan unit \nterkait, mulai dari perencanaan, pelaksanaan dan pelaporan kegiatan MBKM. \nPengendalian dilakukan atas unsur -unsur yang dikawatirkan akan menyimpang, atau \ntidak memenuhi  standar yang telah ditetapkan.  \n \n \n \n 20 Baku Mutu - MBKM   - 2021  \n \n 3 Penutup  \nBaku mutu MBKM yang disusun sesuai dengan SN Dikti dan kebijakan Rektor ITS \nyang berlaku, sebagai rujukan bagi Direktorat terkait dan Prodi di dalam \nmeingimplementasi MBKM, dengan tujuan:  \n(i) Melakukan pengukuran ketercapaian CPL untuk masing -masing bentuk \nMBKM.  \n(ii) Melakukan penilaian dan evaluasi atas proses dan hasil kegiatan MBKM', 'h. Asistensi Mengajar di Satuan Pendidikan.\r\n(3) Dalam hal ada penambahan dan atau perubahan BKP MBKM sebagaimana dimaksud pada ayat (2) ditetapkan melalui Keputusan Rektor.\r\n(4) Kegiatan Membangun Desa/ Kuliah Kerja Nyata Tematik sebagaimana dimaksud pada ayat (2) huruf b dan Proyek Kemanusiaan sebagaimana dimaksud pada ayat (2) huruf d diwujudkan melalui kegiatan pengabdian kepada masyarakat.\r\n\r\n              BAB IV PELAKSANAAN KEGIATAN MB - KM\r\n\r\nPasal 4\r\n(1) Jumlah sks maksimal yang dapat diambil dalam rangka pelaksanaan kegiatan MB -\r\nKM adalah 40 (empat puluh) sks.\r\n(2) Kegiatan MB-KM hanya bisa dilaksanakan dengan:\r\na. Perguruan tinggi yang mempunyai rangking setara atau lebih tinggi dari ITS,\r\nb. Perguruan tinggi yang mempunyai MoU dengan ITS; atau\r\nc. Lembaga non perguruan tinggi yang mempunyai MoU dengan ITS.\r\n(3) Pelaksanaan transfer kegiatan MB - KM menjadi sks mata kuliah, program studi atau direktorat membentuk tim pelaksana transfer kredit.']",Durasi maksimal magang menurut peraturan rektor adalah selama 3 - 6 bulan.
5,Apa itu MB-KM di ITS?,Merdeka Belajar - Kampus Merdeka di Institut Teknologi Sepuluh Nopember,"['13. Merdeka Belajar - Kampus Merdeka yang selanjutnya disingkat MB - KM adalah kebijakan Menteri Pendidikan dan Kebudayaan, yang bertujuan mendorong mahasiswa untuk menguasai berbagai keilmuan yang berguna untuk memasuki dunia kerja dengan memberikan kesempatan bagi mahasiswa untuk memilih mata kuliah yang akan mereka ambil.\r\n14. Kurikulum ITS adalah seperangkat rencana dan pengaturan mengenai capaian pembelajaran lulusan, bahan kajian, proses, dan penilaian yang digunakan sebagai pedoman penyelenggaraan program studi di ITS.\r\n15. Pembelajaran adalah proses interaksi mahasiswa dengan dosen dan sumber belajar pada suatu lingkungan belajar.\r\n16. Tahap Persiapan adalah tahap pembelajaran yang dijadwalkan dalam dua semester pertama pada kurikulum Program Sarjana atau dua paket semester pertama pada kurikulum Program Sarjana Terapan.', 'BAB III\r\nRUANG LINGKUP KEGIATAN\r\n\r\nPasal 3\r\n(1) Kegiatan MB - KM merupakan proses pembelajaran yang dilaksanakan di luar Program Studi baik yang ada di internal ITS maupun di luar ITS yang terdiri atas:\r\na. pembelajaran dalam Program Studi lain di internal ITS;\r\n\r\nb. pembelajaran dalam Program Studi yang sama pada Perguruan Tinggi di luar ITS;\r\nc. pembelajaran dalam Program Studi lain pada Perguruan Tinggi di luar ITS; dan\r\nd. pembelajaran pada lembaga non Perguruan Tinggi.\r\n(2) Ruang lingkup kegiatan MB - KM adalah 8 (delapan) bentuk kegiatan pembelajaran (BKP) yang meliputi:\r\na. Magang/ Praktik Kerja;\r\nb. Membangun Desa/ Kuliah Kerja Nyata Tematik;\r\nc. Pertukaran Pelajar;\r\nd. Proyek Kemanusiaan;\r\ne. Penelitian/ Riset;\r\nf. Kegiatan Wirausaha;\r\ng. Studi/ Proyek Independen; dan\r\nh. Asistensi Mengajar di Satuan Pendidikan.\r\n(3) Dalam hal ada penambahan dan atau perubahan BKP MBKM sebagaimana dimaksud pada ayat (2) ditetapkan melalui Keputusan Rektor.', 'NO ELEMEN PENILAIAN  INDIKATOR  \n(1) (2) (3) \nmengurusi riset dan  pengabdian kepada masyarakat . \n(ix) Implementasi MBKM dalam bentuk penelitian/ riset dikembangkan dan dikoordin ir oleh \nDirektorat yang mengurusi riset dan pengabdian kepada masyarakat  bersama Prodi \nterkait ,  melalui tahapan kegiatan (a) persiapan, (b) Pelaksanaan, (c) Evaluasi, (d) \nPengendalian, dan (e) Peningkatan.  \n \n12 Standar Proses –  \nKegiatan MBKM – bentuk \nKewirausahaan  (i) Kegiatan MBKM dalam bentuk wirausaha  dimaksudkan untuk mendukung pencapaian \nprofil sebagai kader pengusaha yang mendukung perkembangan ITS di masa \nmendatang . \n(ii) Kegiatan MBKM dalam bentuk wirausaha  dapat dikonversi ke dalam sks MK sesuai \ndengan ketercapaian CPL atau bentuk lain  \n(iii) Kegiatan MBKM da lam bentuk wirausaha  dikembangkan oleh Direktorat yang \nmengurusi Kemahasiswaan.  \n(x) Implementasi  Kegiatan MBKM dalam bentuk wirausaha  dikoordinir oleh Direktorat', 'NO ELEMEN PENILAIAN  INDIKATOR  \n(1) (2) (3) \natau kombinasi keduanya  \n6 Standar Proses – Tempat \npelaksanaan MBKM  Tempat k egiatan MB – KM dapat dilaksanakan di luar Program Studi baik yang ada di internal \nITS maupun di luar ITS . \n7 Standar Proses –  \nLama waktu pelaksanaan \nMBKM  Lama waktu pelaksanaan MBKM, dapat dikonvesi ke MK, dengan syarat:  \ni. Lama kegiatan belajar dapat dikonversi ke dalam sks adalah minimal 2720 menit atau \n45.3 jam.  \nii. Lama kegiatan bentuk MBKM dihitung atas waktu untuk:  (a) persiapan  di tempat \nMBKM , (b) pelaksanaan, (c) penilaian, dan  (d)  pelaporan.  \niii. Lama waktu kegiatan MB -KM bentuk magang, minimal 3 bulan dan maksimal 6 bulan.  \n8 Standar Proses –  \nKegiatan akademik selama  \nMBKM  – bentuk magang  (i) Mahasiswa yang melaksakan magang harus bekerja di lapangan secara penuh waktu \nsesuai dengan kesepakata n tempat magang;  \n(ii) Mahasiswa yang melaksanakan magang dapat melakukan kegiatan praktek / kolaborasi']","MB-KM di ITS adalah singkatan dari Merdeka Belajar - Kampus Merdeka. Ini adalah kebijakan Menteri Pendidikan dan Kebudayaan yang bertujuan untuk mendorong mahasiswa agar dapat menguasai berbagai keilmuan yang berguna untuk memasuki dunia kerja. Kebijakan ini memberikan kesempatan bagi mahasiswa untuk memilih mata kuliah yang akan mereka ambil, serta melibatkan berbagai bentuk kegiatan pembelajaran di luar Program Studi baik di internal ITS maupun di luar ITS."
6,Apa saja bentuk kegiatan pembelajaran yang termasuk dalam MB-KM?,"Magang/Praktik Kerja, Membangun Desa/Kuliah Kerja Nyata Tematik, Pertukaran Pelajar, Proyek Kemanusiaan, Penelitian/Riset, Kegiatan Wirausaha, Studi/Proyek Independen, dan Asistensi Mengajar di Satuan Pendidikan.","['(4) Kegiatan MBKM – dalam bentuk pertukaran pelajar melalui MK di prodi di luar ITS, \ndengan ketentuan jumlah sks maksimal adalah 20 (dua puluh) sks, yang meliputi mata \nkuliah inti dan mata kuliah non inti.  \nIII STANDAR PROSES PEMBELAJARAN  \n5 Standar Proses –bentuk \npembelajaran MBKM  (i) Mahasiswa dapat melaksanakan kegiatan pembelajaran MBKM dalam rangka meraih CPL \nProdi dalam bentuk satu atau lebih bentuk berikut ini:  \na. Magang/ Praktik Kerja;  \nb. Membangun Desa/ Kuliah Kerja Nyata Tematik;  \nc. Pertukaran Pelajar;  \nd. Proyek Kemanusiaan;  \ne. Penelitian/ Riset;  \nf. Kegiatan Wirausaha;  \ng. Studi/ Proyek Independen; dan  \nh. Asistensi Mengajar di Satuan Pendidikan  \n(ii)  Pelaksanaan MB -KM bentuk (a) sd (h) dapat dilaksanakan dalam bentuk  online, offline 8 Dokumen Panduan Baku Mutu Pelaksanaan MBKM - 2021  \n NO ELEMEN PENILAIAN  INDIKATOR  \n(1) (2) (3) \natau kombinasi keduanya  \n6 Standar Proses – Tempat', 'dan menengah ,   \n(iii) Kegiatan MBKM dalam bentuk asistensi mengajar di satuan pendidikan , merupakan \nkegiatan dalam bentuk: bantuan mengajar, tutorial, bimbingan teknis, pelatihan dan \nkegiatan lainnya yang relevan  dengan kegiatan akademik di satuan pendidikan tersebut.  \n(iv) Kegiatan MBKM dalam bentuk asistensi mengajar  dapat dikonversi ke dalam sks MK  \natau bentuk lain sesuai dengan ketercapaian CPL serta lama waktu proses kegiatan  \n(v) Kegiatan MBKM dalam bentuk asistensi mengajar dikembangkan oleh Direktorat yang 13 Dokumen Panduan Baku Mutu Pelaksanaan MBKM - 2021  \n NO ELEMEN PENILAIAN  INDIKATOR  \n(1) (2) (3) \nmengurusi kemahasiswaan.  \n(vi) Implementasi kegiatan MBKM  dalam bentuk asistensi mengajar  dikoordinasi oleh \nDirektorat yang mengurusi Kemahasiswaan bersama Prodi terkait , melalui tahapan  \nkegiatan (a) persiapan, (b) Pelaksanaa n, (c) Evaluasi, (d) Pengendalian, dan (e) \nPeningkatan  \n Standar Proses –  \nKegiatan MBKM – Bentuk \nMagang / Praktik Kerja dan', '(ii) Kegiatan MBKM dalam bentuk pertukaran pelajar  dapat dilakukan dengan PT di dalam \nnegeri atau di luar negeri.  \n(iii) Kegiatan dalam Pertukaran pelajar yang dilaksanakan di dalam negeri maupun luar \nnegeri dalam rangka  memperluas wawasan mahasiswa, penyetaraan pendidikan, \npengkayaan sains dan teknologi (saintek) serta terjadinya kolaborasi invensi dan inovasi 10 Dokumen Panduan Baku Mutu Pelaksanaan MBKM - 2021  \n NO ELEMEN PENILAIAN  INDIKATOR  \n(1) (2) (3) \nmultidisiplin lingkup nasion al dan internasional .  \n(iv) Kegiatan pertukaran pelajar  dalam negeri (nasional) dalam bentuk kuliah dapat \ndilakukan  di luar program studi di internal ITS atau di luar program studi di luar ITS baik \ndalam bidang keilmuan sebidang atau tidak sebidang.  \n(v) Kegiatan pe rtukaran pelajar internasional dapat dilakukan dalam bentuk: (a) student \nexchange,  (b) internship, (c) short program, (d) public service/outreach program , atau (e) \nMK secara online .', 'NO ELEMEN PENILAIAN  INDIKATOR  \n(1) (2) (3) \natau kombinasi keduanya  \n6 Standar Proses – Tempat \npelaksanaan MBKM  Tempat k egiatan MB – KM dapat dilaksanakan di luar Program Studi baik yang ada di internal \nITS maupun di luar ITS . \n7 Standar Proses –  \nLama waktu pelaksanaan \nMBKM  Lama waktu pelaksanaan MBKM, dapat dikonvesi ke MK, dengan syarat:  \ni. Lama kegiatan belajar dapat dikonversi ke dalam sks adalah minimal 2720 menit atau \n45.3 jam.  \nii. Lama kegiatan bentuk MBKM dihitung atas waktu untuk:  (a) persiapan  di tempat \nMBKM , (b) pelaksanaan, (c) penilaian, dan  (d)  pelaporan.  \niii. Lama waktu kegiatan MB -KM bentuk magang, minimal 3 bulan dan maksimal 6 bulan.  \n8 Standar Proses –  \nKegiatan akademik selama  \nMBKM  – bentuk magang  (i) Mahasiswa yang melaksakan magang harus bekerja di lapangan secara penuh waktu \nsesuai dengan kesepakata n tempat magang;  \n(ii) Mahasiswa yang melaksanakan magang dapat melakukan kegiatan praktek / kolaborasi']","Dalam MB-KM, terdapat beberapa bentuk kegiatan pembelajaran yang termasuk di dalamnya, yaitu:
1. Magang/Praktik Kerja
2. Membangun Desa/Kuliah Kerja Nyata Tematik
3. Pertukaran Pelajar
4. Proyek Kemanusiaan
5. Penelitian/Riset
6. Kegiatan Wirausaha
7. Studi/Proyek Independen
8. Asistensi Mengajar di Satuan Pendidikan

Semua bentuk kegiatan pembelajaran tersebut dapat dilaksanakan dalam bentuk online maupun offline."
7,Kapan pelaksanaan kegiatan pengabdian kepada masyarakat dapat dilakukan dalam program sarjana di ITS?,Pada semester 6 dan 7.,"['(4) Pelaksanaan kegiatan pengabdian kepada masyarakat adalah pada semester 6 (enam) dan 7 (tujuh).\r\n(5) Pelaksanaan kegiatan pengabdian kepada masyarakat dapat dilaksanakan sebelum semester 6 (enam) dan 7 (tujuh) tetapi sudah lulus tahap persiapan dengan menggunakan sistem tabung nilai.\r\n(6) Mekanisme dan penyelenggaraan kegiatan pengabdian kepada masyarakat dikembangkan dan dikoordinasikan oleh Direktorat yang mengurusi riset dan pengabdian kepada masyarakat.\r\n(7) Direktorat yang mengurusi riset dan pengabdian kepada masyarakat dalam menyelenggarakan kegiatan pengabdian kepada masyarakat sebagaimana dimaksud pada ayat (6) berkoordinasi dengan Program Studi terkait.\r\n\r\nBagian Ketiga\r\nPertukaran Pelajar/ Kuliah Lingkup Dalam Negeri\r\n\r\nPasal 7', '(v) Bentuk kegiatan pengabdian kepada masyarakat merupakan salah satu bentuk 7 Dokumen Panduan Baku Mutu Pelaksanaan MBKM - 2021  \n NO ELEMEN PENILAIAN  INDIKATOR  \n(1) (2) (3) \nimplementasi MK pengayaan dengan bobot 3 (tiga) sks.  \n \n4 Standar Isi  – Pengakuan bobot \nsks (1) Jumlah sks maksimal yang dapat diambil dalam rangka pelaksanaan kegiatan MB – KM \nadalah 40 (empat puluh) sks.  \n(2) Kegiatan magang/ praktik kerja pada program sarjana terapan diimplementasikan dalam \nbentuk mata kuliah wajib sebagai  mata kuliah penciri Fakultas  Vokasi sebesar 14 (empat \nbelas) sks.  \n(3) Konversi kegiatan MB -KM magang dapat dikonversikan ke dalam: (i) MK KP,  \n(ii) beberapa MK gabungan antara KP dengan MK lain dengan kesamaan CP MK,  \n(iii) MK magang dengan maksimum bobot 20 (dua puluh) sks.   \n(4) Kegiatan MBKM – dalam bentuk pertukaran pelajar melalui MK di prodi di luar ITS, \ndengan ketentuan jumlah sks maksimal adalah 20 (dua puluh) sks, yang meliputi mata', 'h. Asistensi Mengajar di Satuan Pendidikan.\r\n(3) Dalam hal ada penambahan dan atau perubahan BKP MBKM sebagaimana dimaksud pada ayat (2) ditetapkan melalui Keputusan Rektor.\r\n(4) Kegiatan Membangun Desa/ Kuliah Kerja Nyata Tematik sebagaimana dimaksud pada ayat (2) huruf b dan Proyek Kemanusiaan sebagaimana dimaksud pada ayat (2) huruf d diwujudkan melalui kegiatan pengabdian kepada masyarakat.\r\n\r\n              BAB IV PELAKSANAAN KEGIATAN MB - KM\r\n\r\nPasal 4\r\n(1) Jumlah sks maksimal yang dapat diambil dalam rangka pelaksanaan kegiatan MB -\r\nKM adalah 40 (empat puluh) sks.\r\n(2) Kegiatan MB-KM hanya bisa dilaksanakan dengan:\r\na. Perguruan tinggi yang mempunyai rangking setara atau lebih tinggi dari ITS,\r\nb. Perguruan tinggi yang mempunyai MoU dengan ITS; atau\r\nc. Lembaga non perguruan tinggi yang mempunyai MoU dengan ITS.\r\n(3) Pelaksanaan transfer kegiatan MB - KM menjadi sks mata kuliah, program studi atau direktorat membentuk tim pelaksana transfer kredit.', '(6) Mekanisme dan penyelenggaraan kegiatan magang/ praktik kerja dikembangkan dan dikoordinasikan oleh Direktorat yang mengurusi kemahasiswaan.\r\n(7) Direktorat Kemahasiswaan dalam menyelenggarakan kegiatan magang/ praktik kerja sebagaimana dimaksud pada ayat (6) berkoordinasi dengan Program Studi terkait.\r\n\r\n         Bagian Kedua Pengabdian Kepada Masyarakat\r\n\r\nPasal 6\r\n(1) Kegiatan pengabdian kepada masyarakat ditujukan untuk pembinaan karakter kebangsaan mahasiswa khususnya untuk menumbuhkan kepedulian terhadap persoalan yang dihadapi masyarakat.\r\n(2) Kegiatan pengabdian kepada masyarakat pada program sarjana diimplementasikan dalam bentuk mata kuliah pengayaan sebesar 3 (tiga) sks.\r\n(3) Kegiatan pengabdian kepada masyarakat pada program sarjana terapan, dapat diambil untuk tambahan sks atau dapat dikompensasi dengan mata kuliah Program Studi yang memiliki capaian pembelajaran yang setara.']","Pelaksanaan kegiatan pengabdian kepada masyarakat dalam program sarjana di ITS dapat dilakukan pada semester 6 (enam) dan 7 (tujuh). Namun, kegiatan pengabdian kepada masyarakat juga dapat dilaksanakan sebelum semester 6 (enam) dan 7 (tujuh) asalkan mahasiswa sudah lulus tahap persiapan dengan menggunakan sistem tabung nilai. Mekanisme dan penyelenggaraan kegiatan pengabdian kepada masyarakat dikembangkan dan dikoordinasikan oleh Direktorat yang mengurusi riset dan pengabdian kepada masyarakat."
8,Apa fungsi dari Tim MB-KM ITS?,"Memfasilitasi implementasi kegiatan MB-KM di ITS, termasuk membuat prosedur operasional baku, dokumen teknis, penjaminan mutu, sistem aplikasi dan hal lainnya.","['b. bahwa dalam rangka meningkatkan kompetensi lulusan, baik soft skills maupun hard skills, agar lebih siap dan relevan dengan kebutuhan zaman, serta menyiapkan lulusan sebagai pemimpin masa depan bangsa yang unggul dan berkepribadian, dipandang perlu bagi Institut Teknologi Sepuluh Nopember untuk mengimplementasikan kebijakan Menteri Pendidikan dan Kebudayaan tentang Kegiatan Merdeka Belajar - Kampus Merdeka (MB - KM);\r\nc. bahwa Peraturan Rektor Institut Teknologi Sepuluh Nopember Nomor 30 Tahun 2020 tentang Penyelenggaraan Kegiatan Merdeka Belajar - Kampus Merdeka di Institut Teknologi Sepuluh Nopember perlu dilakukan penyesuaian untuk mengikuti perkembangan yang ada;', 'c. Jumlah penilaian terhadap pelaksanaan MBKM minimal sebanyak 4 (empat).  \nd. Pelaporan terhadap proses dan hasil penilaian dilakukan oleh Dosen pembimbing \nakademik dalam pelaksanaan MBKM.  \ne. Sistem informasi untuk mempermudah pendataan – implementasi MBKM di Pro di. \n \n2.4 Pengendalian  \nPengendalian pelaksanaan MBKM dilakukan oleh Prodi bersama direktorat dan unit \nterkait, mulai dari perencanaan, pelaksanaan dan pelaporan kegiatan MBKM. \nPengendalian dilakukan atas unsur -unsur yang dikawatirkan akan menyimpang, atau \ntidak memenuhi  standar yang telah ditetapkan.  \n \n \n \n 20 Baku Mutu - MBKM   - 2021  \n \n 3 Penutup  \nBaku mutu MBKM yang disusun sesuai dengan SN Dikti dan kebijakan Rektor ITS \nyang berlaku, sebagai rujukan bagi Direktorat terkait dan Prodi di dalam \nmeingimplementasi MBKM, dengan tujuan:  \n(i) Melakukan pengukuran ketercapaian CPL untuk masing -masing bentuk \nMBKM.  \n(ii) Melakukan penilaian dan evaluasi atas proses dan hasil kegiatan MBKM', 'pelaksanaan MBKM  \n(v) Ketersediaan doku men panduan  17 Dokumen Panduan Baku Mutu Pelaksanaan MBKM - 2021  \n NO ELEMEN PENILAIAN  INDIKATOR  \n(1) (2) (3) \n(vi) Keterlaksanaan penjaminan mutu internal di UPPS dan Prodi dalam pelaksanaan \nMBKM, meliputi: (a) perencanaan kurikulum dan bentuk MBKM, (b) pelaksanaan \nMBKM, (c) evaluasi pelaksanaan MBKM, (d) pengendalian, dan (e) peningkatan \nimplementasi MBKM  di waktu berikutnya  18 Dokumen Panduan Baku Mutu Pelaksanaan MBKM - 2021  \n 2.2 Implementasi Standar MBKM   \nImplementasi dalam penjaminan mutu MBKM, dilengkapi dengan beberapa dokumen, \nyaitu:  \n(1). Dokumen Panduan pelaksanaan MBKM yang diterbitkan oleh: (a) Direktorat terkait \nsebagai koordinator pelaksana masing -masing bentuk MBKM, (b) Prodi sebagai \npelaksana MBKM  untuk memandu dosen, mahasiswa dan tenaga kependidikan yang \nterlibat di dalam pro ses dan hasil pelaksanaan MBKM.  \n(2). SOP yang diterbitkan oleh: (a) Direktorat terkait sebagai koordinator pelaksana', 'meingimplementasi MBKM, dengan tujuan:  \n(i) Melakukan pengukuran ketercapaian CPL untuk masing -masing bentuk \nMBKM.  \n(ii) Melakukan penilaian dan evaluasi atas proses dan hasil kegiatan MBKM  \n(iii) Melakukan pengendalian proses implementasi MBKM  \n(iv) Melakukan peningkatan impleme ntasi MBKM, atas hasil survey kepuasan \npihak internal dan eksternal stakeholder yang terlibat di dalam implementasi \nMBKM.    \n \n \n \n 21 Baku Mutu - MBKM   - 2021']","Tim MB-KM ITS bertugas untuk melakukan pengendalian pelaksanaan kegiatan Merdeka Belajar - Kampus Merdeka (MB-KM) di Institut Teknologi Sepuluh Nopember (ITS). Mereka bertanggung jawab mulai dari perencanaan, pelaksanaan, hingga pelaporan kegiatan MB-KM. Tim ini melakukan pengendalian atas unsur-unsur yang dikawatirkan akan menyimpang atau tidak memenuhi standar yang telah ditetapkan. Selain itu, mereka juga bertugas untuk melakukan peningkatan implementasi MB-KM berdasarkan hasil survey kepuasan pihak internal dan eksternal stakeholder yang terlibat dalam implementasi MB-KM."
9,Apa tujuan penjaminan mutu MBKM?,Untuk meningkatkan kompetensi lulusan dengan soft skills dan hard skills.,"['Tabel 2.1 Standar dalam penyelenggaraan MB -KM di   ITS \nNO ELEMEN PENILAIAN  INDIKATOR  \n(1) (2) (3) \nI STANDAR KOMPETENSI LULUSAN  \n1 Standar Kompetensi Lulusan  (i) Pelaksanaan MBKM mengacu pada CPL Prodi sebagai target dari kemampuan lulusan, \ndengan minimal pencapaian 80%  CPL dan atau sebagai kompetensi tambahan  \n(ii) Kompetensi tambahan dimaksudkan untuk memperlancar karir lulusan, kolaborasi riset \ndan atau kerja sama p engembangan industri.  \nII STANDAR ISI PEMBELAJARAN  \n2 Standar Isi  – MK Pengayaan  (i) Prodi menyediakan kurikulum untuk pelaksanaan MBKM yang disusun bersama \npemangku kepentingan internal dan eksternal, serta direview oleh pakar bidang ilmu \nprogram studi nya.  \n(ii) Keterjaminan pemenuhan CPL  melalui MBKM ( ketersediaan matrik / peta CPL - MK \nMBKM ), dan ketersediaan modul MK melalui pembelajaran  untuk MK yang \ndilaksanakan secara MBKM', '• BAB 5. REFLEKSI DIRI\n• Mahasiswa mendeskripsikan tentang hal-hal positif yang diterima selama perkuliahan yang bermanfaat / relevan terhadap pekerjaan selama magang.\n• Mahasiswa menjelaskan tentang manfaat magang terhadap pengembangan soft-skills dan kekurangan soft-skills yang dimilikinya.\n• Mahasiswa memberikan penjabaran tentang manfaat magang terhadap pengembangan kemampuan kognitif dan kekurangan kemampuan kognitif yang dimilikinya.\nBuku Petunjuk Teknis Magang\n49', 'banyak)\n8. Pertukaran Pelajar • Jenis mata pelajaran yang diambil harus \nmemenuhi ketentuan yang ditetapkan prodi asal \nuntuk lulus (mis. memenuhi kurikulum dasar, \nmemenuhi persyaratan kuliah umum, memenuhi \npersyaratan electives, etc)Buku Panduan Merdeka Belajar - Kampus Merdeka       32\nSatuan penjaminan mutu di perguruan tinggi penyelenggara Merdeka Belajar - Kampus \nMerdeka, program “hak belajar tiga semester di luar program studi” wajib memiliki \nmekanisme formal untuk mengevaluasi dan memonitor mahasiswa secara periodik. Untuk \nmenjamin mutu program tersebut maka pelaksanaan monitor dan evaluasi dilakukan mulai \ndari tahap persiapan, pelaksanaan, dan penilaian. Penilaian/evaluasi merupakan salah \nsatu rangkaian kegiatan dalam meningkatkan kualitas, kinerja, dan produktifitas dalam \nmelaksanakan program magang industri. Fokus evaluasi adalah individu mahasiswa, yaitu \nprestasi yang dicapai dalam pelaksanaan magang oleh mahasiswa. Melalui evaluasi akan', 'pelaksanaan MBKM  \n(v) Ketersediaan doku men panduan  17 Dokumen Panduan Baku Mutu Pelaksanaan MBKM - 2021  \n NO ELEMEN PENILAIAN  INDIKATOR  \n(1) (2) (3) \n(vi) Keterlaksanaan penjaminan mutu internal di UPPS dan Prodi dalam pelaksanaan \nMBKM, meliputi: (a) perencanaan kurikulum dan bentuk MBKM, (b) pelaksanaan \nMBKM, (c) evaluasi pelaksanaan MBKM, (d) pengendalian, dan (e) peningkatan \nimplementasi MBKM  di waktu berikutnya  18 Dokumen Panduan Baku Mutu Pelaksanaan MBKM - 2021  \n 2.2 Implementasi Standar MBKM   \nImplementasi dalam penjaminan mutu MBKM, dilengkapi dengan beberapa dokumen, \nyaitu:  \n(1). Dokumen Panduan pelaksanaan MBKM yang diterbitkan oleh: (a) Direktorat terkait \nsebagai koordinator pelaksana masing -masing bentuk MBKM, (b) Prodi sebagai \npelaksana MBKM  untuk memandu dosen, mahasiswa dan tenaga kependidikan yang \nterlibat di dalam pro ses dan hasil pelaksanaan MBKM.  \n(2). SOP yang diterbitkan oleh: (a) Direktorat terkait sebagai koordinator pelaksana']","Tujuan penjaminan mutu MBKM adalah untuk memastikan bahwa pelaksanaan MBKM berjalan sesuai standar yang telah ditetapkan, termasuk perencanaan kurikulum dan bentuk MBKM, pelaksanaan MBKM, evaluasi pelaksanaan MBKM, pengendalian, dan peningkatan implementasi MBKM di waktu berikutnya. Penjaminan mutu juga melibatkan ketersediaan dokumen panduan dan pelaksanaan penjaminan mutu internal di UPPS dan Prodi dalam pelaksanaan MBKM."
10,Apa tujuan dari MBKM?,"Untuk menghasilkan lulusan yang berkualitas dan memenuhi visi, misi, tata nilai, dan tujuan ITS serta memenuhi SN-DIKTI.","['NO ELEMEN PENILAIAN  INDIKATOR  \n(1) (2) (3) \nmengurusi riset dan  pengabdian kepada masyarakat . \n(ix) Implementasi MBKM dalam bentuk penelitian/ riset dikembangkan dan dikoordin ir oleh \nDirektorat yang mengurusi riset dan pengabdian kepada masyarakat  bersama Prodi \nterkait ,  melalui tahapan kegiatan (a) persiapan, (b) Pelaksanaan, (c) Evaluasi, (d) \nPengendalian, dan (e) Peningkatan.  \n \n12 Standar Proses –  \nKegiatan MBKM – bentuk \nKewirausahaan  (i) Kegiatan MBKM dalam bentuk wirausaha  dimaksudkan untuk mendukung pencapaian \nprofil sebagai kader pengusaha yang mendukung perkembangan ITS di masa \nmendatang . \n(ii) Kegiatan MBKM dalam bentuk wirausaha  dapat dikonversi ke dalam sks MK sesuai \ndengan ketercapaian CPL atau bentuk lain  \n(iii) Kegiatan MBKM da lam bentuk wirausaha  dikembangkan oleh Direktorat yang \nmengurusi Kemahasiswaan.  \n(x) Implementasi  Kegiatan MBKM dalam bentuk wirausaha  dikoordinir oleh Direktorat', 'meingimplementasi MBKM, dengan tujuan:  \n(i) Melakukan pengukuran ketercapaian CPL untuk masing -masing bentuk \nMBKM.  \n(ii) Melakukan penilaian dan evaluasi atas proses dan hasil kegiatan MBKM  \n(iii) Melakukan pengendalian proses implementasi MBKM  \n(iv) Melakukan peningkatan impleme ntasi MBKM, atas hasil survey kepuasan \npihak internal dan eksternal stakeholder yang terlibat di dalam implementasi \nMBKM.    \n \n \n \n 21 Baku Mutu - MBKM   - 2021', '13. Merdeka Belajar - Kampus Merdeka yang selanjutnya disingkat MB - KM adalah kebijakan Menteri Pendidikan dan Kebudayaan, yang bertujuan mendorong mahasiswa untuk menguasai berbagai keilmuan yang berguna untuk memasuki dunia kerja dengan memberikan kesempatan bagi mahasiswa untuk memilih mata kuliah yang akan mereka ambil.\r\n14. Kurikulum ITS adalah seperangkat rencana dan pengaturan mengenai capaian pembelajaran lulusan, bahan kajian, proses, dan penilaian yang digunakan sebagai pedoman penyelenggaraan program studi di ITS.\r\n15. Pembelajaran adalah proses interaksi mahasiswa dengan dosen dan sumber belajar pada suatu lingkungan belajar.\r\n16. Tahap Persiapan adalah tahap pembelajaran yang dijadwalkan dalam dua semester pertama pada kurikulum Program Sarjana atau dua paket semester pertama pada kurikulum Program Sarjana Terapan.', 'Penelitian  (i) Kegiatan MBKM dalam bentuk penelitian /riset  dimaksudkan untuk mencapai CPL . \n(ii) Kegiatan MBKM dalam bentuk penelitian/ riset ditujukan untuk membangun dan \nmenerapkan cara berfikir logis, kritis,  sistematis, dalam konsteks pengembangan atau \nimplementasi ilmu pengetahuan dan teknologi yang memperhatikan dan menerapkan \nnilai humaniora yang sesuai dengan bidang kea hliannya , atau berkontribusi untuk \nmemecahkan permasalahan dan mendukung kepentingan nasional . \n(iii) Kegiatan MBKM dalam bentuk penelitian / riset dapat dilakukan di lembaga riset / pusat \nstudi / program studi melalui skema kerjasama.  \n(iv) Kegiatan MBKM dalam bentuk  Studi/ Proyek dikembangkan oleh Direktorat yang 11 Dokumen Panduan Baku Mutu Pelaksanaan MBKM - 2021  \n NO ELEMEN PENILAIAN  INDIKATOR  \n(1) (2) (3) \nmengurusi riset dan  pengabdian kepada masyarakat . \n(ix) Implementasi MBKM dalam bentuk penelitian/ riset dikembangkan dan dikoordin ir oleh']","Tujuan dari MBKM adalah untuk melakukan pengukuran ketercapaian CPL untuk masing-masing bentuk MBKM, melakukan penilaian dan evaluasi atas proses dan hasil kegiatan MBKM, melakukan pengendalian proses implementasi MBKM, serta melakukan peningkatan implementasi MBKM berdasarkan hasil survey kepuasan pihak internal dan eksternal stakeholder yang terlibat di dalam implementasi MBKM."
11,Apa tujuan dari kegiatan magang/ praktik kerja?,"Memperlancar karir lulusan, pengayaan kompetensi mahasiswa, kolaborasi riset, dan kerja sama pengembangan industri.","['(3) Kegiatan magang/ praktik kerja pada program sarjana terapan diimplementasikan dalam bentuk mata kuliah wajib yang merupakan mata kuliah penciri Fakultas Vokasi sebesar 14 (empat belas) sks.\r\n(4) Kegiatan magang/ praktik kerja pada program sarjana dapat dikonversikan menjadi:\r\na. sks kerja praktek; atau\r\n\r\nb. sks satu atau beberapa mata kuliah yang memiliki Capaian Pembelajaran Mata Kuliah (CPMK) sama dengan magang; atau\r\nc. sks gabungan antara kerja praktek dengan mata kuliah yang memiliki CPMK sama dengan magang atau mata kuliah magang dengan total maksimal 20 (dua puluh) sks.\r\n(5) Persyaratan mahasiswa yang dapat mengikuti kegiatan magang di Program Studi yang belum memiliki mata kuliah magang adalah mahasiswa sudah lulus 72 (tujuh puluh dua sks.\r\n(6) Mekanisme dan penyelenggaraan kegiatan magang/ praktik kerja dikembangkan dan dikoordinasikan oleh Direktorat yang mengurusi kemahasiswaan.', '4. Hasil penilaian dilakukan dengan cara mengisi formulir yang ada dan diserahkan\npada departemen.\n8.2\nPENILAIAN PRESTASI KINERJA MAGANG\nOLEH UNIT MITRA MAGANG\nDalam melakukan kegiatan magang, mahasiswa akan memperoleh penilaian dari unit tempat magang. Formulir penilaian magang diisi dan ditandatangani oleh atasan yang berwenang di tempat magang (minimal level manajer) dan dicap menggunakan stempel unit tempat magang. Berikut adalah butir penilaian kinerja magang:\n52\n08 Penilaian Magang', 'kepentingan yang dilakukan oleh organisasi tersebut (misalnya melalui produk atau jasa yang dihasilkan).\n• BAB 3. PELAKSANAAN MAGANG\n3.1. Posisi / Kedudukan Kegiatan Magang\n• Mahasiswa dapat menguraikan kedudukan / posisi kegiatan yang ditugaskan oleh mitra magang dalam lingkup pekerjaan / proyek keseluruhan. Hal ini dimaksudkan untuk mengetahui apakah mahasiswa memahami kaitan antara apa yang telah dilakukan / dihasilkan dengan pekerjaan tersebut.\n3.2. Metodologi penyelesaian Tugas\n• Mahasiswa menguraikan kasus / masalah menjadi topik pembahasan. Mahasiswa menganalisis kasus / masalah tersebut dengan menggunakan teori atau metode yang relevan. Analisis bukan mendeskripsikan teori, namun menggunakan teori guna menjelaskan dan membandingkan dengan kasus/masalah yang diangkat.\nUraian mengenai teori atau metode harus menyebutkan referensi yang valid dan handal.\n3.3. Pembelajaran Hal Baru', 'kegiatan (a) persiapan, (b) Pelaksanaa n, (c) Evaluasi, (d) Pengendalian, dan (e) \nPeningkatan  \n Standar Proses –  \nKegiatan MBKM – Bentuk \nMagang / Praktik Kerja dan \nWirausaha lingkup Hilirisasi  (i) Kegiatan MBKM dalam bentuk Magang/ Praktik Kerja dan Kegiatan Wirausaha Lingkup \nHilirisasi ditujukan untuk  memperlancar karir lulusan, pengayaan kompetensi \nmahasiswa, kolaborasi magang, wirausaha dan kerja sama pengembangan produk \ninovatif  dalam rangka meraih profil lulusan sebagai  inovator yang produktif.  \n(ii) Kegiatan MBKM dalam bentuk magang/ praktik kerja dan kegiatan wirausaha hilirisasi \ndapat berupa kegiatan penelitian dan pengabdian masyarakat bersama civitas \nakademika yang lain untuk memecahkan persoalan di masyarakat atau indust ri, inkubasi \ndan start -up.  \n(iii) Kegiatan MBKM dalam bentuk magang/ praktik kerja dan kegiatan wirausaha hilirisasi \ndikembangkan oleh  Direktorat yang mengurusi inovasi dan kawasan sains teknologi']","Tujuan dari kegiatan magang/ praktik kerja adalah untuk memperlancar karir lulusan, mengaya kompetensi mahasiswa, kolaborasi magang, wirausaha, dan kerja sama pengembangan produk inovatif dalam rangka meraih profil lulusan sebagai inovator yang produktif. Selain itu, kegiatan magang juga bertujuan untuk memecahkan persoalan di masyarakat atau industri, serta untuk melakukan inkubasi dan start-up."
12,Apa yang dimaksud dengan PDDikti?,Pangkalan Data Perguruan Tinggi yang terintegrasi secara nasional.,"['Subdit. PK2\nPeranan Perguruan Tinggi\nPimpinan Perguruan Tinggi\nPimpinan Perguruan Tinggi, bertugas untuk memberikan persetujuan final kepada mahasiswa yang ingin mendaftar program flagship MBKM, dengan ketentuan sebagai berikut:\n1) Pimpinan PT wajib mempunyai salah satu jabatan sebagai pimpinan perguruan tinggi;\n리\nPimpinan PT bertugas menentukan penanggung jawab dari masing-masing prodi atau fakultas untuk bertindak sebagai pihak yang akan merekomendasikan mahasiswa untuk mengikuti\nprogram MBKM; dan\n3)\nPimpinan PT bertugas memberikan persetujuan akhir daftar mahasiswa setelah mendapatkan rekomendasi dari prodi atau fakultas pada laman\nADVANCING HUMANITY\nPenanggungjawab Fakultas atau Prodi\nPenanggung Jawab Fakultas atau Prodi, bertugas untuk:\n1)\n2)\n3\nMelakukan verifikasi kebenaran data dan dokumen mahasiswa yang akan mendaftar Program flagship\nMBKM;', 'Subdit. PK2\nSKEMA PELAKSANAAN\nPROGRAM MAGANG\nMANDIRI DI ITS\nMahasiswa / Departemen melakukan\nmenyertakan:\n1. Proposal Magang\n2. Surat Rekomendasi Departemen\n3. Surat Penerimaan Magang\nPelaksanaan Magang\nProses pengurusan\nPKS\nPKS tidak\ndisetujui\nPKS\nTertandatangan\nSelesai\nMagang berakhir <\nMahasiswa mendapatkan\nSertifikat / Penilaian Magang\nSelesai\nADVANCING HUMANITY\niTS\nMulai\nMahasiswa mengurus\nsurat rekomendasi\ndepartemen untuk pengajuan magang ke\nMitra\nMahasiswa mengajukan\npermohonan magang ke\nMitra\nMitra melakukan seleksi magang\nMahasiswa menerima hasil seleksi magang dari Mitra\nTidak diterima\nSelesai\nDiterima\nMahasiswa melaporkan\nke Departemen', 'PENGALAMAN TENTANG KEBUDAYAAN DAERAH LAIN\nMELALUI MODUL NUSANTARA\nSelain mengikuti pembelajaran mata kuliah di perguruan tinggi penerima, mahasiswa yang mengikuti program Pertukaran Mahasiswa Merdeka juga akan mendapatkan pengalaman langsung berinteraksi dengan mahasiswa dari daerah lain dan mempelajari kebudayaan daerah lain melalui Modul Nusantara. Modul Nusantara ini senilai 2 sks dan wajib diambil oleh mahasiswa peserta program Pertukaran Mahasiswa Merdeka. Modul Nusantara dilaksanakan di perguruan tinggi penerima. Modul Nusantara dibagi ke dalam empat jenis kegiatan yaitu kebinekaan, inspirasi, refleksi, dan kontribusi sosial. Dalam pelaksanaan Modul Nusantara, mahasiswa akan dibimbing oleh dosen pembimbing modul nusantara dan dibantu oleh mentor.\nBAGAIMANA MEKANISME PELAKSANAAN PERTUKARAN\nMAHASISWA MERDEKA?\nTerdapat dua mekanisme, yaitu:', '5. Surat persetujuan orang tua/wali (contoh terlampir)\n6. Surat pakta integritas (contoh terlampir\nPERTANYAAN YANG SERING DITANYAKAN\nT. Mahasiswa dari perguruan tinggi apa saja yang dapat mengikuti program Pertukaran Mahasiswa Merdeka?\nJ. Mahasiswa dari perguruan tinggi negeri maupun swasta non vokasi di bawah Direktorat Jenderal Pendidikan Tinggi, Kementerian Pendidikan, Kebudayaan, Riset, dan Tenologi RI.\nJ. Apakah Pertukaran Mahasiswa Merdeka 2021 untuk mahasiswa S1 saja?\nA. Pertukaran Mahasiswa Merdeka 2021 diperuntukkan untuk mahasiswa jenjang St.\nT. Apakah mahasiswa yang lolos akan menerima bantuan potongan\nUKT?\nJ. Mahasiswa akan menerima bantuan potongan UKT sebesar maksimal Rp 2.400.000 dengan syarat bukan penerima bantuan\nUKT dari beasiswa pemerintah lainnya.\nT. Bagaimana jika UKT saya lebih kecil dari 2,4 juta?\nJ. Bantuan UKT akan dibayarkan at cost (sesuai besaran UKT mahasiswa).']","PDDikti merupakan singkatan dari Pusat Data dan Informasi Pendidikan Tinggi, yang merupakan lembaga di bawah Kementerian Pendidikan, Kebudayaan, Riset, dan Teknologi Republik Indonesia yang bertanggung jawab dalam pengelolaan data dan informasi pendidikan tinggi di Indonesia. PDDikti memiliki peran penting dalam menyediakan data-data terkait perguruan tinggi, program studi, mahasiswa, dan berbagai informasi terkait pendidikan tinggi di Indonesia."
13,Berapa jumlah kredit Mata Kuliah KP?,2 SKS,"['KERJA PRAKTIK\nDepartemen Teknik Informatika ITS\n\nSekilas Kerja Praktik\n\nJumlah kredit Mata Kuliah KP: 2 SKS\nSKS KP diambil bersamaan / setelah menyelesaikan KP di organisasi (perusahaan, instansi, yayasan)\nLama KP: 1-2 bulan dengan hitungan kerja part time\nBisa perorangan atau berkelompok maksimal 2 (dua) mahasiswa\nBerkas-berkas KP bisa didapatkan di link resource akademik:\nhttps://intip.in/ResourceAkademikDanKemahasiswaanIF\nProsedur Kerja Praktik\n\nMengajukan KP\nSurat Pengantar KP\nDosen Pembimbing KP\nPelaksanaan KP\nPenilaian KP oleh Pembimbing Lapangan\nPenilaian KP oleh Dosen Pembimbing\nPenyerahan Laporan KP ke RBTC\nMengumpulkan bukti penyelesaian KP\nLulus KP\nSebelum berangkat KP\n\nMengajukan KP\n\nMemenuhi persyaratan sebagai berikut:\nMahasiswa aktif Teknik Informatika\nSKS tempuh minimum 90 SKS\nMengisi MONKP:\nmonkp.if.its.ac.id (registrasi akun dan data KP)\nStatus KP akan menjadi CREATED\nSurat Pengantar Kerja Praktik', 'dapat menuliskan hal-hal yang dilakukannya beserta hasilnya dalam bentuk tugas \nakhir.\nPelaksanaan KKNT dilakukan untuk mendukung kerja sama bersama Kementerian \nDesa PDTT serta Kementerian/ stakeholder  lainnya. Pemerintah melalui Kementerian \nDesa PDTT menyalurkan dana desa 1 milyar per desa kepada sejumlah 74.957 \ndesa di Indonesia, yang berdasarkan data Indeks Desa Membangun (IDM) tahun \n2019, terdapat desa sangat tertinggal sebanyak 6.549 dan desa tertinggal 20.128. \nPelaksanaan KKNT dapat dilakukan pada desa sangat tertinggal, tertinggal dan \nberkembang, yang sumber daya manusianya  belum memiliki kemampuan \nperencanaan pembangunan dengan fasilitas dana yang besar tersebut. Sehingga \nefektivitas penggunaan dana desa untuk menggerakkan pertumbuhan ekonomi \nmasih perlu ditingkatkan, salah satunya melalui mahasiswa yang dapat menjadi \nsumber daya manusia yang lebih memberdayakan dana desa.\n23       Buku Panduan Merdeka Belajar - Kampus Merdeka', 'ERICHA VALENTINA\n5015201016\nS1 Perencanaan Wilayah d Vely Kukinul Siswanto\n\n\nFALDI FAKHRI\n5015201128\nS1 Perencanaan Wilayah d I Dewa Made Frendika S\n\nKK\nTerdapat inkonsistensi data / data yang belum diisi pada registras\nTerdapat laporan mingguan dengan foto aktivitas yang belum diis\nTerdapat laporan mingguan dengan foto aktivitas yang belum diis\nTerdapat laporan mingguan dengan foto aktivitas yang belum diis\nTerdapat laporan mingguan dengan foto aktivitas yang belum diis\nTerdapat laporan mingguan dengan foto aktivitas yang belum diis\nTerdapat laporan mingguan dengan foto aktivitas yang belum diis -\nits.id/ListSIMMagang\n+\nMix\nGenap 22/23\nGasal 23/24\nKementerian Pendidikan, Kebudayaan, Riset dan\nTeknologi\n\nSubdit. PK2\nADVANCING HUMANITY\niTS\nh\n4\nOverview MSIB 6\nd\n2023', 'APA SAJA SYARAT DAN KETENTUAN UNTUK JENIS MAGANG MBKM ?\n\n1. Mahasiswa aktif ITS tingkat Sarjana dan Diploma\n2. Minimal mahasiswa sudah lulus 90 SKS atau sudah lulus semester 5.\n3. Mahasiswa tidak diperkenankan mengambil Program Kegiatan Magang (BKP)\nMBKM yang sama lebih dari 1 kali.\n4. Mahasiswa WAJIB melakukan konversi alih kredit ke SKS MK.\n5. Mahasiswa/Departemen WAJIB membuat/memiliki surat PKS.\n6. Pelaksanaan Magang sebelum minggu ke-3 perkuliahan di ITS.\n7. Mahasiswa tidak diperkenankan mengambil MK, atau hanya diperkenankan\nmengambil maks. 3 MK (setara 10 SKS).\n8. Pelaksanaan Magang selama 3 – 6 bulan.\n\nAPA SAJA\nSYARAT DAN\nKETENTUAN\nUNTUK JENIS\nMAGANG\nNON-MBKM']",Jumlah kredit Mata Kuliah KP adalah 2 SKS.
14,Kapan SKS KP bisa diambil?,"Bersamaan atau setelah menyelesaikan KP di organisasi (perusahaan, instansi, yayasan)","['• LAMPIRAN 8: Form Persetujuan Konversi Mata Kuliah\nLAMPIRAN 1\nKOP Departemen\nNo\n:....\nLampiran :\nPerihal :.\nKepada yth :\nDosen Wali Departemen ...\nFakultas...\nITS\nSehubungan dengan adanya permohonan konversi mata kuliah dari mahasiswa peserta magang dengan detail sebagai berikut :\nNama\nNRP\nNama Mitra Magang :\nPeriode magang\nMahasiswa yang bersangkutan akan/ telah *) melakukan magang dengan rincian tugas sebagai berikut :\nBerdasarkan hasil telaah dan analisa dengan bidang akademik departemen, maka mahasiswa yang bersangkutan berhak untuk mendapatkan konversi mata kuliah dan SKS, dimana konversi ini akan di lakukan pada semester..... tahun ajaran ....\n.......Adapun mata kuliah yang dapat dikonversikan dengan\nkegiatan magang adalah sebagai berikut :\nNo.\nMata Kuliah Konversi\nJumlah SKS\n\n\n\n\n\n\n\n\n\nTotal SKS\n\nSurabaya, ....\n*) dicoret\nKepala Departemen ....\n70\nLampiran\n\nSUBDIREKTORAT PENGEMBANGAN KEWIRAUSAHAAN DAN KARIR\nDIREKTORAT KEMAHASISWAAN\nINSTITUT TEKNOLOGI SEPULUH NOPEMBER\n2020', '20. Sistem Kredit Semester yang selanjutnya disingkat SKS adalah suatu sistem penyelenggaraan pendidikan dengan menggunakan sks.\r\n21. Satuan Kredit Semester yang selanjutnya disingkat sks adalah takaran waktu kegiatan belajar yang dibebankan pada mahasiswa per minggu per semester dalam proses pembelajaran melalui berbagai bentuk pembelajaran atau besarnya pengakuan atas keberhasilan usaha mahasiswa dalam mengikuti kegiatan kurikuler di suatu program studi.\r\n22. Satuan Kegiatan Ekstrakurikuler Mahasiswa, yang selanjutnya disingkat SKEM, adalah satuan yang digunakan untuk mengukur kegiatan ekstrakurikuler mahasiswa dan berfungsi sebagai salah satu syarat kelulusan bagi mahasiswa Program Sarjana Terapan dan Sarjana.\r\n23. Mata Kuliah adalah satuan pelajaran yang diajarkan di tingkat perguruan tinggi.\r\n24. Mata Kuliah Inti adalah mata kuliah wajib yang terkait dengan program studi di ITS.', '31l83 0uluD 29 A0l 2U2120.0y mib\nFORMULIR PENDAFTARAN\nDalam Pertukaran Mahasiswa Merdeka (20 SKS), kamu bisa mengikuti perkuliahan luar jaringan di Perguruan Tinggi (PT) penerima dan dalam jaringan (maksimum 10 SKS) di beberapa PT mitra.\nUniversitas Luar Jaringan\nKalimantan\nsulawesi\nBali - NTT - NTB\nMaluku - Papua\nLainnya\n13. Selanjutnya mengisi pilihan Mata kuliah dalam jaringan (daring) yang ingin diikuti oleh pendaftar, dengan ketentuan jumlah SKS terpilih pada mata kuliah dalam jaringan yaitu maksimum 10 SKS.\nMahasiswa disarankan untuk mengambil 20 SKS secara luar jaringan (luring) di perguruan tinggi penerima.\nMata Kuliah Dalam Jaringan\nPilihan Mata Kuliah\nContoh pilihan beberapa Mata kuliah dan pendaftar bisa mencari menggunakan fitur Search dengan mengetik keyword Mata kuliah seperti pada gambar berikut:\nPilih Mata Kullah 1\nPilih Mata Kuliah 2\nSearch\nType keywords here\nKOMUNIKASI BISNIS\nUniversitas surabaya\nAkuntansi\nPANCASILA DAN KEWARGANEGARAAN\nFarmas', 'magang sesuai dengan ketentuan yang berlaku;  \n 9 Dokumen Panduan Baku Mutu Pelaksanaan MBKM - 2021  \n NO ELEMEN PENILAIAN  INDIKATOR  \n(1) (2) (3) \n9 Standar Proses –  \nKegiatan MBKM – bentuk \nPengabdian kepada Masyarakat  (i) Kegiatan MBKM dalam bentuk pengabdian kepada masyarakat  atau selanjutnya \ndikategorikan sebagai KKN  ditujukan untuk pembinaan karakter kebangsaan mahasiswa \nkhususnya untuk menumbuhkan kepedulian terhadap persoalan yang dihadapi \nmasyarakat , sebaga i salah satu CPL dalam aspek Sikap .  \n(ii) Kegiatan MBKM dalam bentuk KKN harus dibawah bimbingan dosen . \n(iii) Kegiatan MBKM dalam bentuk KKN dapat diakui sebagai  tambahan sks atau dapat \ndikompensasi dengan mata kuliah Program Studi yang memiliki capaian pembelajaran \nyang setara.  \n(iv) Kegiatan MBKM dalam bentuk KKN dilaksanakan pada semester 6 (enam) dan 7 (tujuh)  \natau sebelum nya dengan syarat telah lulus tahap persiapan.']",SKS KP bisa diambil setelah mahasiswa melakukan magang dan mendapatkan konversi mata kuliah serta SKS yang akan dilakukan pada semester tertentu sesuai dengan hasil telaah dan analisa dengan bidang akademik departemen.
15,Apakah KP bisa dilakukan secara berkelompok?,"Ya, maksimal 2 (dua) mahasiswa","['diperoleh mahasiswa dalam pelaksanaan KKNT regular, dan mahasiswa diberi \nkesempatan untuk mengajukan perpanjangan KKNT selama maksimal 1 \nsemester atau setara dengan 20 SKS. Untuk melanjutkan program KKNT yang \ndiperpanjang, mahasiswa dapat memanfaatkan Program Holistik Pembinaan Buku Panduan Merdeka Belajar - Kampus Merdeka       26\ndan Pemberdayaan Desa (PHP2D) dengan mengikuti prosedur dari Direktorat \nBelmawa. Bentuk kegiatan KKNT yang Diperpanjang dapat berupa proyek  \npemberdayaan masyarakat di desa dan penelitian untuk tugas akhir mahasiswa.\nContoh Model KKNT yang Diperpanjang\n2) Model KKNT Pembangunan dan Pemberdayaan Desa\nPada model ini perguruan tinggi bekerja sama dengan Mitra dalam melakukan \nKKNT Pembangunan dan Pemberdayaan Desa berdasarkan peluang/kondisi \ndesa dalam bentuk paket kompetensi/pengembangan RPJMDes yang akan \ndiperoleh mahasiswa dalam pelaksanaan KKNT. Jumlah dan bidang Mahasiswa \nyang mengikuti program ini menyesuaikan dengan kebutuhan program di desa.', 'masyarakat di luar kampus, yang secara langsung bersama-sama masyarakat \nmengidentifikasi potensi dan menangani masalah sehingga diharapkan mampu \nmengembangkan potensi desa/daerah dan meramu solusi untuk masalah yang ada \ndi desa. Kegiatan KKNT diharapkan dapat mengasah softskill  kemitraan, kerjasama \ntim lintas disiplin/keilmuan (lintas kompetensi), dan leadership  mahasiswa dalam \nmengelola program pembangunan di wilayah perdesaan. Sejauh ini perguruan \ntinggi sudah menjalankan program KKNT, hanya saja Satuan Kredit Semesternya \n(SKS) belum bisa atau dapat diakui sesuai dengan program kampus merdeka yang \npengakuan kreditnya setara 6 – 12 bulan atau 20 – 40 SKS, dengan pelaksanaannya \nberdasarkan beberapa model. Diharapkan juga setelah pelaksanaan KKNT, mahasiswa \ndapat menuliskan hal-hal yang dilakukannya beserta hasilnya dalam bentuk tugas \nakhir.\nPelaksanaan KKNT dilakukan untuk mendukung kerja sama bersama Kementerian', 'magang sesuai dengan ketentuan yang berlaku;  \n 9 Dokumen Panduan Baku Mutu Pelaksanaan MBKM - 2021  \n NO ELEMEN PENILAIAN  INDIKATOR  \n(1) (2) (3) \n9 Standar Proses –  \nKegiatan MBKM – bentuk \nPengabdian kepada Masyarakat  (i) Kegiatan MBKM dalam bentuk pengabdian kepada masyarakat  atau selanjutnya \ndikategorikan sebagai KKN  ditujukan untuk pembinaan karakter kebangsaan mahasiswa \nkhususnya untuk menumbuhkan kepedulian terhadap persoalan yang dihadapi \nmasyarakat , sebaga i salah satu CPL dalam aspek Sikap .  \n(ii) Kegiatan MBKM dalam bentuk KKN harus dibawah bimbingan dosen . \n(iii) Kegiatan MBKM dalam bentuk KKN dapat diakui sebagai  tambahan sks atau dapat \ndikompensasi dengan mata kuliah Program Studi yang memiliki capaian pembelajaran \nyang setara.  \n(iv) Kegiatan MBKM dalam bentuk KKN dilaksanakan pada semester 6 (enam) dan 7 (tujuh)  \natau sebelum nya dengan syarat telah lulus tahap persiapan.', '- Kampus Merdeka di atas, untuk kegiatan KKNT terdapat persyaratan tambahan \nyang harus dipenuhi oleh mahasiswa, yaitu:\n1) Mahasiswa telah menyelesaikan proses pembelajaran setelah  semester 6.\n2) Dilakukan secara berkelompok,  anggota berjumlah ± 10   orang per kelompok \ndan atau sesuai kebutuhan desa, dan bersifat multidisiplin (asal prodi/fakultas/\nkluster  yang berbeda).Buku Panduan Merdeka Belajar - Kampus Merdeka       24\n3) Peserta wajib tinggal di komunitas atau wajib “live in”  di lokasi yang telah \nditentukan. \n4) Sehat jasmani dan rohani serta tidak sedang hamil bagi wanita.\n5) IPK minimal 2.00 sampai dengan semester 5.\n6) Ketentuan lain dapat diatur oleh perguruan tinggi pelaksana.\nAdapun untuk mekanisme pelaksanaan kegiatan membangun desa/kuliah kerja \nnyata adalah sebagai berikut.\n1) Perguruan Tinggi\na) Menjalin kerja sama dengan pihak Kementerian Desa PDTT, serta Kemdikbud \ndalam penyelenggaraan program proyek di desa atau menjalin kerja sama']","Ya, KP (Kuliah Kerja Nyata) bisa dilakukan secara berkelompok. Mahasiswa yang melakukan KP biasanya dibagi dalam kelompok-kelompok dengan jumlah anggota yang ditentukan, biasanya sekitar ± 10 orang per kelompok atau sesuai dengan kebutuhan desa. Selain itu, kelompok KP juga bersifat multidisiplin, artinya anggota kelompok berasal dari prodi/fakultas/kluster yang berbeda."
16,Apa syarat mengajukan KP?,"Mahasiswa aktif Teknik Informatika, SKS tempuh minimum 90 SKS","['- Kampus Merdeka di atas, untuk kegiatan KKNT terdapat persyaratan tambahan \nyang harus dipenuhi oleh mahasiswa, yaitu:\n1) Mahasiswa telah menyelesaikan proses pembelajaran setelah  semester 6.\n2) Dilakukan secara berkelompok,  anggota berjumlah ± 10   orang per kelompok \ndan atau sesuai kebutuhan desa, dan bersifat multidisiplin (asal prodi/fakultas/\nkluster  yang berbeda).Buku Panduan Merdeka Belajar - Kampus Merdeka       24\n3) Peserta wajib tinggal di komunitas atau wajib “live in”  di lokasi yang telah \nditentukan. \n4) Sehat jasmani dan rohani serta tidak sedang hamil bagi wanita.\n5) IPK minimal 2.00 sampai dengan semester 5.\n6) Ketentuan lain dapat diatur oleh perguruan tinggi pelaksana.\nAdapun untuk mekanisme pelaksanaan kegiatan membangun desa/kuliah kerja \nnyata adalah sebagai berikut.\n1) Perguruan Tinggi\na) Menjalin kerja sama dengan pihak Kementerian Desa PDTT, serta Kemdikbud \ndalam penyelenggaraan program proyek di desa atau menjalin kerja sama', 'magang sesuai dengan ketentuan yang berlaku;  \n 9 Dokumen Panduan Baku Mutu Pelaksanaan MBKM - 2021  \n NO ELEMEN PENILAIAN  INDIKATOR  \n(1) (2) (3) \n9 Standar Proses –  \nKegiatan MBKM – bentuk \nPengabdian kepada Masyarakat  (i) Kegiatan MBKM dalam bentuk pengabdian kepada masyarakat  atau selanjutnya \ndikategorikan sebagai KKN  ditujukan untuk pembinaan karakter kebangsaan mahasiswa \nkhususnya untuk menumbuhkan kepedulian terhadap persoalan yang dihadapi \nmasyarakat , sebaga i salah satu CPL dalam aspek Sikap .  \n(ii) Kegiatan MBKM dalam bentuk KKN harus dibawah bimbingan dosen . \n(iii) Kegiatan MBKM dalam bentuk KKN dapat diakui sebagai  tambahan sks atau dapat \ndikompensasi dengan mata kuliah Program Studi yang memiliki capaian pembelajaran \nyang setara.  \n(iv) Kegiatan MBKM dalam bentuk KKN dilaksanakan pada semester 6 (enam) dan 7 (tujuh)  \natau sebelum nya dengan syarat telah lulus tahap persiapan.', 'Sudah menyelesaikan segala pekerjaan terkait KP di perusahaan dan sudah kembali aktif di kampus\nMenemui dosen pembimbing untuk melakukan ujian lisan dan menyerahkan Formulir Penilaian Ujian Lisan Kerja Praktik untuk diisi oleh dosen pembimbing internal\nDosen pembimbing internal mengirimkan nilai ke koordinator KP via email\nJika nilai telah diterima koordinator KP, maka status KP akan menjadi FINISHED\nMenyerahkan Laporan KP\nSudah menyelesaikan segala urusan KP dengan dosen pembimbing\nDokumentasi KP sudah disetujui dan ditandatangani oleh dosen pembimbing\nDokumentasi tersebut berupa softcopy dan diunggah ke repo ITS (lihat manual unggah ke repo ITS di manual unggah mandiri)\nMenerima Bukti Penyerahan KP dari REPO ITS\nMengunggah buku KP dan bukti terima repo ITS ke MS TEAMS KP pada link berikut:\nhttps://teams.microsoft.com/l/team/19%3a447977fe03c040ff98ad9e82e63982e2%40thread.tacv2/conversations?groupId=862aa22c-c596-49e1-94dd-6354fd625a2e&tenantId=1d5169ac-c7cb-4275-9764-bf8c9c364a4c', 'APA SAJA SYARAT DAN KETENTUAN UNTUK JENIS MAGANG MBKM ?\n\n1. Mahasiswa aktif ITS tingkat Sarjana dan Diploma\n2. Minimal mahasiswa sudah lulus 90 SKS atau sudah lulus semester 5.\n3. Mahasiswa tidak diperkenankan mengambil Program Kegiatan Magang (BKP)\nMBKM yang sama lebih dari 1 kali.\n4. Mahasiswa WAJIB melakukan konversi alih kredit ke SKS MK.\n5. Mahasiswa/Departemen WAJIB membuat/memiliki surat PKS.\n6. Pelaksanaan Magang sebelum minggu ke-3 perkuliahan di ITS.\n7. Mahasiswa tidak diperkenankan mengambil MK, atau hanya diperkenankan\nmengambil maks. 3 MK (setara 10 SKS).\n8. Pelaksanaan Magang selama 3 – 6 bulan.\n\nAPA SAJA\nSYARAT DAN\nKETENTUAN\nUNTUK JENIS\nMAGANG\nNON-MBKM']","Syarat mengajukan KP adalah sebagai berikut:
1. Sudah menyelesaikan segala pekerjaan terkait KP di perusahaan dan sudah kembali aktif di kampus.
2. Menemui dosen pembimbing untuk melakukan ujian lisan dan menyerahkan Formulir Penilaian Ujian Lisan Kerja Praktik untuk diisi oleh dosen pembimbing internal.
3. Dosen pembimbing internal mengirimkan nilai ke koordinator KP via email.
4. Jika nilai telah diterima koordinator KP, maka status KP akan menjadi FINISHED.
5. Menyerahkan Laporan KP.
6. Sudah menyelesaikan segala urusan KP dengan dosen pembimbing.
7. Dokumentasi KP sudah disetujui dan ditandatangani oleh dosen pembimbing.
8. Dokumentasi tersebut berupa softcopy dan diunggah ke repo ITS.
9. Menerima Bukti Penyerahan KP dari REPO ITS.
10. Mengunggah buku KP dan bukti terima repo ITS ke MS TEAMS KP pada link yang disediakan."
17,Apa yang harus dilakukan mahasiswa di lokasi KP?,"Mematuhi dan mengikuti segala aturan terkait kerja praktik, dan mengerjakan pekerjaan yang sesuai dengan kompetensi Informatika","['C Kerat\n@ DASHBOARD E KEGIATAN MAHASISWA & PROFIL\nINDAH SYAHYA DINATA\n凹\nPertukaran Mahasiswa Merdeka\nFORMULIR PENDAFTARAN\nPilih Penempatan & Mata Kuliah\nDalam Pertukaran Mahasiswa Merdeka (20 SKS), kamu bisa mengikuti perkuliahan luar jaringan di Perguruan Tinggi (PT) penerima dan dalam jaringan (maksimum 10 SKS) di beberapa PT mitra.\nUniversitas Luar Jaringan\n20 / 20 SKS\nPilihan Lokasi Pulau PT penerima\nPilihan lokasi putau harus di luar alamat KTP dan domisili PT asal. Preferensi mahasiswa akan dipertimbangkan namun keputusan panitia bersifat final dan tidak dapat digugat.\nPilih Lokasi Pulau 11\nロ\nPilhan lokasi pulau narus di luar alamat KIP dan domisili PI asal. Preterensi manasiswa akan diperumbangkan namun keputusan panta bersitat unai dan toak dapat diguga\nSulawesi\nBali - NTT - NTB\nBerikut adalah contoh Pilihan pulau yang telah di-cluster sesuai\ndomisili pendaftar:\n14', 'masyarakat di luar kampus, yang secara langsung bersama-sama masyarakat \nmengidentifikasi potensi dan menangani masalah sehingga diharapkan mampu \nmengembangkan potensi desa/daerah dan meramu solusi untuk masalah yang ada \ndi desa. Kegiatan KKNT diharapkan dapat mengasah softskill  kemitraan, kerjasama \ntim lintas disiplin/keilmuan (lintas kompetensi), dan leadership  mahasiswa dalam \nmengelola program pembangunan di wilayah perdesaan. Sejauh ini perguruan \ntinggi sudah menjalankan program KKNT, hanya saja Satuan Kredit Semesternya \n(SKS) belum bisa atau dapat diakui sesuai dengan program kampus merdeka yang \npengakuan kreditnya setara 6 – 12 bulan atau 20 – 40 SKS, dengan pelaksanaannya \nberdasarkan beberapa model. Diharapkan juga setelah pelaksanaan KKNT, mahasiswa \ndapat menuliskan hal-hal yang dilakukannya beserta hasilnya dalam bentuk tugas \nakhir.\nPelaksanaan KKNT dilakukan untuk mendukung kerja sama bersama Kementerian', 'Meminta persetujuan form pengajuan KP ke Koordinator Kerja Praktek (Sekretaris Departemen 1)\nMenyerahkan Form Pengajuan KP yang sudah disetujui Koord. KP kepada Staf Akademik (Pak Sugeng) untuk dibuatkan surat pengantar ke tempat KP\nSurat pengantar KP dikeluarkan oleh departemen Teknik Informatika yang ditujukan kepada organisasi tempat KP yang berisi:\nPermohonan agar mahasiswa X diijinkan untuk melakukan KP di organisasi Y,\nTanggal mulai,\nDurasi kerja praktik\nSurat pengantar KP dikirimkan ke instansi penerima KP\nJika balasan persetujuan sudah didapatkan, unggah ke MONKP\nStatus KP akan menjadi CONFIRMED\nDosen Pembimbing Kerja Praktik\n\nSyarat mendapatkan dosen pembimbing internal KP:\nStatus KP akan menjadi CONFIRMED\nDosen Pembimbing KP dipilih oleh koordinator KP dengan menyesuaikan load pembimbingan dosen, kecuali ada rekomendasi khusus dari dosen ybs\nPengalokasian dilakukan secara batch operation\nDi lokasi KP\n4. Melaksanakan Kerja Praktik', 'nyata adalah sebagai berikut.\n1) Perguruan Tinggi\na) Menjalin kerja sama dengan pihak Kementerian Desa PDTT, serta Kemdikbud \ndalam penyelenggaraan program proyek di desa atau menjalin kerja sama \nlangsung dengan pemerintah daerah untuk penyelenggaraan program \nproyek di desa.\nb) Mengelola pendaftaran dan penempatan mahasiswa ke desa tujuan.\nc) Menugaskan dosen pembimbing yang akan membimbing mahasiswa selama \nKKNT.\nd) Bila dimungkinkan pembimbing melakukan kunjungan di lokasi KKNT untuk \nmonitoring dan evaluasi.\ne) Memberangkatkan dan memulangkan   mahasiswa    dari kampus ke lokasi \npenempatan program.\nf) Memberikan pembekalan, pemeriksaan kesehatan, dan menyediakan \njaminan kesehatan dan keselamatan kepada mahasiswa calon peserta KKNT.\ng) Perguruan tinggi menyusun SOP pelaksanaan KKNT dengan \nmempertimbangkan jaminan Keamanan dan Keselamatan Mahasiswa \nselama di lapangan.\nh) Perguruan tinggi memberikan pembekalan tentang kearifan lokal masyarakat']","Mahasiswa harus melaksanakan Kerja Praktik di lokasi KP sesuai dengan surat pengantar yang telah dibuat oleh departemen Teknik Informatika. Selain itu, mahasiswa juga harus mematuhi persyaratan yang telah ditetapkan dalam surat pengantar, seperti tanggal mulai, durasi kerja praktik, dan persetujuan dari instansi penerima KP. Setelah balasan persetujuan diterima, mahasiswa harus mengunggahnya ke MONKP agar status KP menjadi CONFIRMED. Selama berada di lokasi KP, mahasiswa juga harus bekerja sesuai dengan tugas dan tanggung jawab yang telah ditetapkan."
18,Kapan batas waktu penyerahan laporan KP?,Paling lambat 1 bulan setelah tanggal selesainya kerja praktek di perusahaan,"['Meminta persetujuan form pengajuan KP ke Koordinator Kerja Praktek (Sekretaris Departemen 1)\nMenyerahkan Form Pengajuan KP yang sudah disetujui Koord. KP kepada Staf Akademik (Pak Sugeng) untuk dibuatkan surat pengantar ke tempat KP\nSurat pengantar KP dikeluarkan oleh departemen Teknik Informatika yang ditujukan kepada organisasi tempat KP yang berisi:\nPermohonan agar mahasiswa X diijinkan untuk melakukan KP di organisasi Y,\nTanggal mulai,\nDurasi kerja praktik\nSurat pengantar KP dikirimkan ke instansi penerima KP\nJika balasan persetujuan sudah didapatkan, unggah ke MONKP\nStatus KP akan menjadi CONFIRMED\nDosen Pembimbing Kerja Praktik\n\nSyarat mendapatkan dosen pembimbing internal KP:\nStatus KP akan menjadi CONFIRMED\nDosen Pembimbing KP dipilih oleh koordinator KP dengan menyesuaikan load pembimbingan dosen, kecuali ada rekomendasi khusus dari dosen ybs\nPengalokasian dilakukan secara batch operation\nDi lokasi KP\n4. Melaksanakan Kerja Praktik', 'Sudah menyelesaikan segala pekerjaan terkait KP di perusahaan dan sudah kembali aktif di kampus\nMenemui dosen pembimbing untuk melakukan ujian lisan dan menyerahkan Formulir Penilaian Ujian Lisan Kerja Praktik untuk diisi oleh dosen pembimbing internal\nDosen pembimbing internal mengirimkan nilai ke koordinator KP via email\nJika nilai telah diterima koordinator KP, maka status KP akan menjadi FINISHED\nMenyerahkan Laporan KP\nSudah menyelesaikan segala urusan KP dengan dosen pembimbing\nDokumentasi KP sudah disetujui dan ditandatangani oleh dosen pembimbing\nDokumentasi tersebut berupa softcopy dan diunggah ke repo ITS (lihat manual unggah ke repo ITS di manual unggah mandiri)\nMenerima Bukti Penyerahan KP dari REPO ITS\nMengunggah buku KP dan bukti terima repo ITS ke MS TEAMS KP pada link berikut:\nhttps://teams.microsoft.com/l/team/19%3a447977fe03c040ff98ad9e82e63982e2%40thread.tacv2/conversations?groupId=862aa22c-c596-49e1-94dd-6354fd625a2e&tenantId=1d5169ac-c7cb-4275-9764-bf8c9c364a4c', '• LAMPIRAN 8: Form Persetujuan Konversi Mata Kuliah\nLAMPIRAN 1\nKOP Departemen\nNo\n:....\nLampiran :\nPerihal :.\nKepada yth :\nDosen Wali Departemen ...\nFakultas...\nITS\nSehubungan dengan adanya permohonan konversi mata kuliah dari mahasiswa peserta magang dengan detail sebagai berikut :\nNama\nNRP\nNama Mitra Magang :\nPeriode magang\nMahasiswa yang bersangkutan akan/ telah *) melakukan magang dengan rincian tugas sebagai berikut :\nBerdasarkan hasil telaah dan analisa dengan bidang akademik departemen, maka mahasiswa yang bersangkutan berhak untuk mendapatkan konversi mata kuliah dan SKS, dimana konversi ini akan di lakukan pada semester..... tahun ajaran ....\n.......Adapun mata kuliah yang dapat dikonversikan dengan\nkegiatan magang adalah sebagai berikut :\nNo.\nMata Kuliah Konversi\nJumlah SKS\n\n\n\n\n\n\n\n\n\nTotal SKS\n\nSurabaya, ....\n*) dicoret\nKepala Departemen ....\n70\nLampiran\n\nSUBDIREKTORAT PENGEMBANGAN KEWIRAUSAHAAN DAN KARIR\nDIREKTORAT KEMAHASISWAAN\nINSTITUT TEKNOLOGI SEPULUH NOPEMBER\n2020', 'diperoleh mahasiswa dalam pelaksanaan KKNT regular, dan mahasiswa diberi \nkesempatan untuk mengajukan perpanjangan KKNT selama maksimal 1 \nsemester atau setara dengan 20 SKS. Untuk melanjutkan program KKNT yang \ndiperpanjang, mahasiswa dapat memanfaatkan Program Holistik Pembinaan Buku Panduan Merdeka Belajar - Kampus Merdeka       26\ndan Pemberdayaan Desa (PHP2D) dengan mengikuti prosedur dari Direktorat \nBelmawa. Bentuk kegiatan KKNT yang Diperpanjang dapat berupa proyek  \npemberdayaan masyarakat di desa dan penelitian untuk tugas akhir mahasiswa.\nContoh Model KKNT yang Diperpanjang\n2) Model KKNT Pembangunan dan Pemberdayaan Desa\nPada model ini perguruan tinggi bekerja sama dengan Mitra dalam melakukan \nKKNT Pembangunan dan Pemberdayaan Desa berdasarkan peluang/kondisi \ndesa dalam bentuk paket kompetensi/pengembangan RPJMDes yang akan \ndiperoleh mahasiswa dalam pelaksanaan KKNT. Jumlah dan bidang Mahasiswa \nyang mengikuti program ini menyesuaikan dengan kebutuhan program di desa.']","Batas waktu penyerahan laporan KP adalah setelah mahasiswa menyelesaikan segala pekerjaan terkait KP di perusahaan dan sudah kembali aktif di kampus. Setelah itu, mahasiswa harus menyerahkan laporan KP setelah melakukan ujian lisan dengan dosen pembimbing internal."
19,Bagaimana format nama file untuk laporan KP dengan pengarang tunggal?,NRP-Project_Report,"['• LAMPIRAN 3: Sampul Laporan Magang\nSampul Laporan Magang berwarna biru dengan logo ITS di kiri atas. Pada sampul tercetak: Judul Laporan Magang, Nama Lengkap Mahasiswa, Asal Departemen dan Fakultas, Institut Teknologi Sepuluh Nopember, dan tahun penyelesaian.\nJenis huruf: Calibri\nUkuran huruf: 14 pt\nContoh Sampul Laporan Magang :\nLAPORAN MAGANG\n(JUDUL LAPORAN MAGANG)\n(NAMA)\n(NRP)\nDosen Pembimbing\n(Nama Dosen Pembimbing)\nDosen Pembimbing\n(Nama Dosen Pembimbing Lapangan)\n(Departemen)\n(Fakultas )\nInstitut Teknologi Sepuluh Nopember Surabaya\n2020\nBuku Petunjuk Teknis Magang\n65\n\n• LAMPIRAN 4 : Form Penilaian Magang (Dosen Pembimbing)\nLEMBAR PENILAIAN KINERJA MAGANG\nSemester Magang :..... Tahun Akademik 20.../20...\nNama Mahasiswa\nNRP\nDepartemen\nNama Dosen Pembimbing\nNama Perusahaan Mitra Magang\nWaktu Pelaksanaan Magang\nNama Proyek/ Kegiatan Magang\nNO\nASPEK YANG DINILAI\nBOBOT (B)\nNILAI (N)\n(0-100)\nJUMLAH\n(B XN)\n1\nKehadiran\n10\n\n\n2\nKesungguhan melaksanakan Kerja Praktek\n15', 'PANDUAN UPLOAD MANDIRI\nHOW TO UPLOAD PROJECT REPORT FILE\n\n1 Januari 2021\nDivisi Pengembangan Perpustakaan Digital\n\nLANGKAH-LANGKAH UPLOAD FILE TUGAS AKHIR\nSTEP BY STEP THESIS FILE UPLOAD\n\nDaftar Akun / Create Repository Account\nLogin Repository / Login into Repository (Setelah diaktivasi / after activated by librarian)\nUpload File KP / Upload Project Report\nIsi Metadata / Fill out Metadata Entries\nTentukan Subyek / Determine Thesis Subjects\nDeposit Item / Deposit Item Process\nRepository.its.ac.id Login Panduan / Guidance Daftar Akun / Create Account WEBSITE REPOSITORY REPOSITORY WEBSITE\n\nCARA DAFTAR AKUN REPOSITORY\nHOW TO REGISTER REPOSITORY ACCOUNT\n\nAccess this link: http://bit.ly/PengumpulanKP\n\nCatatan:\n\nKP dengan 2 pengarang cukup mendaftar 1 akun saja.\nLOGIN TO REPOSITORY', 'Pilih “Monograph” / Choose “Monograph”\nKemudian klik “Next” / Then Click “Next”\n\nUpload file di sini / Upload file here\nKlik “Next” / Click “Next”\nUPLOAD FILE\n\nFile sudah masuk / Thesis file uploaded\nPilih “Accepted version” / Choose “Accepted version”\nPilih “Anyone” / Choose “Anyone”\nPilih Bahasa yang digunakan / Choose language as used on\nKlik “Next” / Click “Next”\nTitle, diisi judul bhs Ind, dengan gaya penulisan huruf besar tiap kata.\nTitle, fill it with thesis title, use Capitalize Each Word style.\n\nAbstract, diisi abstrak Ind dan Eng. Gunakan tanda “ = “ sebagai pemisah.\nAbstract, fill it with Ind and Eng abstracts. Use “ = “ as divider of Ind and Eng Abstracts.\n\nMENGISI METADATA / METADATA ENTRIES', 'Klik “Next” / Click “Next”.\n\nReferences, isikan konten daftar pustaka.\nReferences, bibliography contents.\n\nKetikkan subyek (Eng) yang sesuai dengan isi TA pada kolom yang tersedia. Kemudian klik “Search”. klik “Add” pada subyek yang cocok.\nType the subjects then click “Search” then click “Add” on the subject that is appropriate.\n\nMENENTUKAN SUBYEK / DETERMINE THE SUBJECTS\n\nBisa dilakukan dengan 2 cara:\nCan be done in 2 ways:\nSecara manual pilih subyek yang tersedia, kemudian klik “Add”.\nManually choose the subject on the menu then click “Add”.\nKlik “Next” / Click “Next”.\nDEPOSIT ITEM PROCESS\n\nDeposit item adalah proses terakhir untuk mengirimkan file anda ke sistem administrator. Klik “Deposit Item Now”.\nDeposit Item is the last process to send the thesis file to the administrator system. Click “Deposit Item Now”.\n# THANK YOU #\nFeel Free to Contact the administrators (click About ITS Repository) if you have any questions.']","Untuk format nama file laporan KP dengan pengarang tunggal, Anda dapat menggunakan format berikut:
[NRP-NamaLengkap-NamaDepartemen-TahunPenyelesaian.pdf]

Contoh:
[123456789-JohnDoe-TeknikInformatika-2021.pdf]"
