,question,answer,contexts,ground_truth,context_precision,faithfulness,answer_relevancy,context_recall
0,Apa tujuan dari Program Internship Internasional CCU/CoE 2024? ,"Tujuan dari Program Internship Internasional CCU/CoE 2024 adalah untuk memberikan kesempatan kepada mahasiswa universitas internasional untuk memahami penelitian CCU dalam bidang teknik dan teknologi, serta untuk berlatih keterampilan dalam proyek-proyek, memperoleh kompetensi baru, dan merasakan budaya yang berbeda. Program ini bertujuan agar mahasiswa dapat memiliki pengalaman akademis yang menyenangkan dan memperkaya, serta bertukar ide penelitian dengan mahasiswa CCU.","['2024 CCU/CoE\r\nINTERNATIONAL INTERNSHIP PROGRAM\r\nCOLLEGE OF ENGINEERING (CoE)\r\nNATIONAL CHUNG CHENG UNIVERSITY\r\n\r\nContinuing the yearly internship program in engineering field, the College\r\nof Engineering (CoE) offers on-campus research internships for\r\ninternational university students in 2024.\r\nThis project-based program provides an opportunity to better understand\r\nCCU’s research in engineering and technology. Students may practice their\r\nskills in the projects, acquire new competence, and experience a different\r\nculture.\r\nIn Engineering Field\r\n2024 CCU/COE INTERNATIONAL\r\nINTERNSHIP PROGRAM\r\nINTERNPERIOD\r\nSCHOLARSHIP\r\nPROGRAM\r\nBENIFITS\r\nTo have an enjoyable and enriching\r\nexperience in academic study and exchange\r\ntheir ideas of research with CCU students.\r\nMay 1 –December 31, 2024\r\nAt least 8 weeks. Individual mentors may have a\r\ndifferent definition of intern period. For self-\r\nsupported interns, the period may not be limited\r\nas mentioned above. Please refer to each'
 'application form, prepare\r\napplication materials, and send\r\nthem in a ZIP-compressed file to\r\ncoleng_dia@ccu.edu.tw.\r\n• The title of the e-mail please be\r\nmarked with “Application for 2024\r\nCCU/COE International Internship”.\r\nAll the intern research topics and\r\ntheir requirements are listed as\r\nfollows.\r\n• Application deadline: Mar. 3, 2024\r\n• More detailed information about\r\napplication can be found on the\r\nwebsite\r\nhttps://sites.google.com/view/ccu-\r\ncoe-internship/home\r\nCONTACT\r\n+886-5-2720411 ext. 23003, 23005\r\ncoleng_dia@ccu.edu.tw\r\nNo.168, Sec. 1, University Rd., Minhsiung,\r\nChiayi 621301, Taiwan (R.O.C.)\r\n\r\nINTERN RESEARCH TOPICS\r\nNumber P1\r\nProject title\r\nTrustable Artificial Intelligence for Critical Applications and\r\n6G Security\r\nDescription of the research\r\nArtificial Intelligence (AI) technologies, 6G networking,\r\nand quantum computing are the leading forces in\r\nbringing the world to an era of better intelligence and full'
 '1. Setiap mahasiswa ITS yang ingin mendaftar program internasional di perguruan tinggi mitra ITS luar negeri yang\nmembutuhkan surat rekomendasi atau dana dukungan dari ITS di antaranya IISMA/IISMA-Vo, pertukaran pelajar (exchange),\nlab-internship, short program, atau program lain di luar negeri, diharuskan memiliki sertifikat Global Competency\nWorkshop (GCW) atau Global Competency Academy (GCA). Sertifikat ini hanya bisa diperoleh dengan mengikuti program\nGCW atau GCA.'
 'Dipublikasikan tanggal 11 Januari 2024\nTentang LPDP\nLPDP berkomitmen untuk mempersiapkan\npemimpin dan profesional masa depan serta\nmendorong inovasi demi terwujudnya Indonesia\nyang sejahtera, demokratis, dan berkeadilan.\nLPDP menyelenggarakan program beasiswa\nmagister/doktor serta beasiswa dokter spesialis,\ndokter subspesialis dan Fellowship untuk putra-\nputri terbaik Indonesia.\nApa itu Beasiswa Prioritas?\nBeasiswa Prioritas merupakan program beasiswa\nyang memberikan kesempatan kepada pendaftar\nuntuk dapat melakukan pendaftaran pada dua\nprogram sekaligus, yaitu pada program Beasiswa\nKemitraan/Kerja Sama LPDP dan pada salah satu\nprogram Beasiswa Afirmasi/Beasiswa\nTargeted/Beasiswa Umum tujuan luar negeri.\nApa itu Beasiswa Prioritas LPDP – Campus\nFrance Program Master?\nBeasiswa Prioritas LPDP – Campus France\nProgram Master memberikan kesempatan bagi\npendaftar untuk dapat melakukan pendaftaran\npada Beasiswa Kemitraan LPDP – Campus\nFrance dan beasiswa Magister Luar Negeri']","Tujuannya adalah untuk memberikan kesempatan bagi mahasiswa internasional untuk memahami lebih baik penelitian di bidang teknik dan teknologi di CCU, serta untuk mempraktikkan keterampilan mereka, memperoleh kompetensi baru, dan mengalami budaya yang berbeda.",,0.999999999975,0.7142857142857143,0.9920465954407938
1,Kapan periode magang berlangsung?,Periode magang berlangsung setidaknya selama 12 minggu antara tanggal 1 Mei hingga 31 Desember.,"['Intern period At least 12 weeks between May 1st and Dec. 31th\r\n\r\nNumber P4\r\nProject title\r\nSimulation and Reconstruction of Pencil Beam Scanning of\r\nParticle Therapy\r\nDescription of the research\r\nPencil beam scanning in particle therapy is one of the\r\nhighlight radiation therapies for cancer treatment. Due to\r\nthe effectively and precisely control for particle-beam, the\r\nnarrow pulse and extremely high radiation dose rate\r\ndelivering becomes more and more significant. Basically,\r\nthe high dose rate will enable the recombination of the ion\r\npair effect, and it can lead to the received signal\r\nunderestimated. In addition, the higher spatial resolution\r\nand wide field of view is necessary. So, the main purpose of\r\nthe project is to develop a novel algorithm to reconstruct\r\nthe 2D image of the extremely high dose rate in\r\nproton/particle therapies. We hope that the students could\r\njoin us to implement a novel reconstruction algorithm and'
 'or large disturbances.\r\nMentor at CCU\r\nProf. Gary Chang, PhD, PE, IEEE Fellow\r\nDept. of Electrical Engineering,\r\nNational Chung Cheng University, Taiwan, ROC.\r\n(e-mail: ieegwc@ccu.edu.tw)\r\nExpected student level\r\n■ Post-graduate student\r\n■ Third/forth-year undergraduate senior student\r\nCategory\r\n█ Scholarship\r\n█ Self-supported\r\nIntern period 12 to 20 weeks between April 1 and Dec. 31, 2024\r\n\r\nNumber P3\r\nProject title Lidar and Camera fusion for autonomous driving\r\nDescription of the research\r\nThis project revolves around the integration of lidar and\r\ncamera sensor data, aiming to develop robust algorithms\r\nfor enhanced perception and decision-making in self-\r\ndriving systems. Interns will engage in the fusion of lidar\r\nand camera inputs, leveraging Python and advanced\r\nmachine learning models. The primary objectives include\r\ndeveloping algorithms for sensor data calibration, point\r\ncloud processing and image processing to create a\r\ncomprehensive and accurate representation of the'
 '■ Post-graduate student\r\n■ Third/forth-year undergraduate senior student\r\nCategory\r\n■ Scholarship\r\n■ Self-supported\r\nIntern period At least 8 weeks between May and December 2024\r\n\r\nNumber P13\r\nProject title\r\nApplication of Novel Snap-shot based hyperspectral imaging\r\ncombined with AI to detect Lesions\r\nDescription of the\r\nresearch\r\nThe early detection of esophageal cancer presents a\r\nconsiderable difficulty, which contributes to its high\r\nprevalence as a major cause of cancer-related fatalities. This\r\nproject will utilize various machine learning models, including\r\nYOLOv5, YOLOv8, R-CNN, and Faster R-CNN, to predict and\r\ndetect early-stage esophageal cancer. It will make use of two\r\nmodels of esophageal cancer images: the white-light images\r\n(WLI) model and the hyperspectral narrowband images (HSI-\r\nNBI) model. These models will be generated through a\r\nconversion algorithm referred to as the spectrum-aided\r\nvision enhancer (SAVE). The main goal will be to discover'
 ""At least 8 weeks. Individual mentors may have a\r\ndifferent definition of intern period. For self-\r\nsupported interns, the period may not be limited\r\nas mentioned above. Please refer to each\r\nresearch topic for precise definitions.\r\nResearch topics are offered in two types:\r\n(A) Scholarship and (B) self-supported.\r\nFor type-A, CCU offers a scholarship covering\r\non-campus accommodation, a weekly stipend\r\n(NTD1,500), and airfare reimbursement\r\n(maximum NTD10,000). These are standard\r\nitems and numbers, and the total amount may\r\nbe amended by the project mentor based on\r\nthe program budget and the interns'\r\nperformance.\r\nFEES FEE-FREE. The program fee and registration\r\nfee will be provided by CoE.\r\n\r\nPROGRAM ELIGIBILITY\r\n• Graduate school students (master & PhD students)\r\n• University junior students (3rd year or above).\r\n• Those who already complete PhD degree are NOT eligible to apply.\r\n• Passport holders of People's Republic of China, Hong Kong, or Macau\r\nare NOT eligible to apply.""]","Periode magang berlangsung antara 1 Mei hingga 31 Desember 2024, minimal 8 minggu.",1.0,0.999999999975,1.0,0.7921385511782505
2,Apa saja jenis beasiswa yang ditawarkan dalam program ini?,"Jenis beasiswa yang ditawarkan dalam program ini adalah:
1. Beasiswa Afirmasi
   a. Beasiswa Daerah Afirmasi
   b. Beasiswa Putra Putri Papua
   c. Beasiswa Penyandang Disabilitas
   d. Beasiswa Prasejahtera
2. Beasiswa Targeted
   a. Beasiswa PNS, TNI, POLRI
   b. Beasiswa Kewirausahaan
   c. Beasiswa Umum
      - Beasiswa Reguler
      - Beasiswa Parsial

Selain itu, terdapat juga Beasiswa Kemitraan LPDP - Campus France yang merupakan kerja sama antara LPDP dan Pemerintah Perancis untuk jenjang master dalam bidang prioritas pembangunan Indonesia.","['Dipublikasikan tanggal 11 Januari 2024\nprogram beasiswa lain yang dipilih, sesuai\ndengan syarat dan ketentuan yang berlaku.\nApa saja komponen Dana yang diberikan?\n1. Dana Pendidikan\na. Tuition Fee\nb. Dana Pendaftaran\nc. Dana Tunjangan Buku\nd. Dana Penelitian Tesis\ne. Dana Seminar Internasional\nf. Dana Publikasi Jurnal Internasional\n2. Dana Pendukung\na. Dana Transportasi\nb. Dana Aplikasi Visa\nc. Dana Asuransi Kesehatan\nd. Dana Kedatangan\ne. Dana Hidup Bulanan\nf. Dana Lomba Internasional\ng. Dana keadaaan darurat (jika diperlukan)\nApa saja persyaratan umum pendaftaran\nBeasiswa Prioritas LPDP – Campus\nFrance Program Master?\nPersyaratan umum Beasiswa Prioritas LPDP –\nCampus France Program Master adalah sebagai\nberikut:\n1. Warga Negara Indonesia.\n2. Telah menyelesaikan studi program diploma\nempat (D4) atau sarjana (S1).\n3. Pendaftar yang telah menyelesaikan studi\nmagister (S2) tidak diizinkan mendaftar.\n4. Bagi pendaftar lulusan perguruan tinggi luar'
 'beasiswa dengan kewajiban pengembalian\ndana studi yang telah diterima dan\npemblokiran untuk mengikuti program LPDP\ndi masa mendatang.\nBagaimana dengan ketentuan\nPengabdian yang ditetapkan LPDP?\n1. Penerima Beasiswa wajib kembali dan\nmengabdi di Indonesia setelah selesai studi\nsesuai dengan ketentuan LPDP.\n2. Kembali ke Indonesia dan berkontribusi di\nIndonesia selama 2 kali masa studi ditambah'
 'Program Master memberikan kesempatan bagi\npendaftar untuk dapat melakukan pendaftaran\npada Beasiswa Kemitraan LPDP – Campus\nFrance dan beasiswa Magister Luar Negeri\npada salah satu program:\n1. Beasiswa Afirmasi\na. Beasiswa Daerah Afirmasi\nb. Beasiswa Putra Putri Papua\nc. Beasiswa Penyandang Disabilitas\nd. Beasiswa Prasejahtera\n2. Beasiswa Targeted\na. Beasiswa PNS, TNI, POLRI\nb. Beasiswa Kewirausahaan\nc. Beasiswa Umum\na. Beasiswa Reguler\nb. Beasiswa Parsial\nBeasiswa Kemitraan LPDP - Campus France\nmerupakan beasiswa kerja sama antara LPDP dan\nPemerintah Perancis pada jenjang master untuk\nbidang prioritas pembangunan Indonesia sesuai\ndengan keahlian pengetahuan yang dimiliki oleh\nUniversitas di Perancis dalam rangka\nmenghasilkan pemimpin masa depan Indonesia\nyang kompeten di bidang tersebut.\nSiapakah Sasaran Beasiswa Prioritas\nLPDP – Campus France Program Master?\n1. Warga Negara Indonesia (WNI)\n2. PNS/TNI/POLRI\nSeperti Apa Skema Prioritas LPDP –\nCampus France Program Master?'
 'beasiswa dikategorikan sebagai pelanggaran\nketentuan dan persyaratan seleksi.\n2. Pendaftar yang melanggar ketentuan dan\npersyaratan seleksi akan digugurkan dan\ntidak dapat mengikuti tahapan seleksi\nberikutnya.\n3. Apabila pendaftar yang telah ditetapkan\nsebagai Calon Penerima Beasiswa atau\nPenerima Beasiswa di kemudian hari\ndiketahui melanggar ketentuan dan\npersyaratan seleksi dan/atau tidak memenuhi\npernyataan yang disampaikan pada surat\npernyataan, maka akan diberikan sanksi\nsesuai dengan ketentuan yang berlaku di\nLPDP.\n4. Apabila pendaftar yang telah ditetapkan\nsebagai Calon Penerima Beasiswa atau\nPenerima Beasiswa di kemudian hari\ndiketahui memberikan informasi atau\ndokumen yang tidak benar atau palsu, maka\nakan dikenakan sanksi administratif berat\nberupa pemberhentian sebagai penerima\nbeasiswa dengan kewajiban pengembalian\ndana studi yang telah diterima dan\npemblokiran untuk mengikuti program LPDP\ndi masa mendatang.\nBagaimana dengan ketentuan\nPengabdian yang ditetapkan LPDP?']",Program menawarkan dua jenis beasiswa: (A) Beasiswa dan (B) magang dengan biaya sendiri (self-supported).,0.8333333332916666,1.0,0.8224413046528971,0.0
3,Apa saja manfaat dari Beasiswa Tipe-A? ,Saya tidak tahu.,"['Dipublikasikan tanggal 11 Januari 2024\nprogram beasiswa lain yang dipilih, sesuai\ndengan syarat dan ketentuan yang berlaku.\nApa saja komponen Dana yang diberikan?\n1. Dana Pendidikan\na. Tuition Fee\nb. Dana Pendaftaran\nc. Dana Tunjangan Buku\nd. Dana Penelitian Tesis\ne. Dana Seminar Internasional\nf. Dana Publikasi Jurnal Internasional\n2. Dana Pendukung\na. Dana Transportasi\nb. Dana Aplikasi Visa\nc. Dana Asuransi Kesehatan\nd. Dana Kedatangan\ne. Dana Hidup Bulanan\nf. Dana Lomba Internasional\ng. Dana keadaaan darurat (jika diperlukan)\nApa saja persyaratan umum pendaftaran\nBeasiswa Prioritas LPDP – Campus\nFrance Program Master?\nPersyaratan umum Beasiswa Prioritas LPDP –\nCampus France Program Master adalah sebagai\nberikut:\n1. Warga Negara Indonesia.\n2. Telah menyelesaikan studi program diploma\nempat (D4) atau sarjana (S1).\n3. Pendaftar yang telah menyelesaikan studi\nmagister (S2) tidak diizinkan mendaftar.\n4. Bagi pendaftar lulusan perguruan tinggi luar'
 'Program Master memberikan kesempatan bagi\npendaftar untuk dapat melakukan pendaftaran\npada Beasiswa Kemitraan LPDP – Campus\nFrance dan beasiswa Magister Luar Negeri\npada salah satu program:\n1. Beasiswa Afirmasi\na. Beasiswa Daerah Afirmasi\nb. Beasiswa Putra Putri Papua\nc. Beasiswa Penyandang Disabilitas\nd. Beasiswa Prasejahtera\n2. Beasiswa Targeted\na. Beasiswa PNS, TNI, POLRI\nb. Beasiswa Kewirausahaan\nc. Beasiswa Umum\na. Beasiswa Reguler\nb. Beasiswa Parsial\nBeasiswa Kemitraan LPDP - Campus France\nmerupakan beasiswa kerja sama antara LPDP dan\nPemerintah Perancis pada jenjang master untuk\nbidang prioritas pembangunan Indonesia sesuai\ndengan keahlian pengetahuan yang dimiliki oleh\nUniversitas di Perancis dalam rangka\nmenghasilkan pemimpin masa depan Indonesia\nyang kompeten di bidang tersebut.\nSiapakah Sasaran Beasiswa Prioritas\nLPDP – Campus France Program Master?\n1. Warga Negara Indonesia (WNI)\n2. PNS/TNI/POLRI\nSeperti Apa Skema Prioritas LPDP –\nCampus France Program Master?'
 'beasiswa dengan kewajiban pengembalian\ndana studi yang telah diterima dan\npemblokiran untuk mengikuti program LPDP\ndi masa mendatang.\nBagaimana dengan ketentuan\nPengabdian yang ditetapkan LPDP?\n1. Penerima Beasiswa wajib kembali dan\nmengabdi di Indonesia setelah selesai studi\nsesuai dengan ketentuan LPDP.\n2. Kembali ke Indonesia dan berkontribusi di\nIndonesia selama 2 kali masa studi ditambah'
 'Penerima Beasiswa.\nd. Bagi pendaftar yang lulus seleksi\nsubstansi dan tidak memenuhi ketentuan\ntersebut di atas, maka LPDP dapat\nmembatalkan statusnya sebagai Calon\nPenerima Beasiswa.\ne. Bagi pendaftar yang menyelesaikan studi\ndan mendapat gelar sebelum\npengumuman seleksi substansi, maka\nLPDP dapat membatalkan statusnya\nsebagai Calon Penerima Beasiswa.\n6. Pendaftar yang pernah menempuh studi\nnamun tidak menyelesaikan studi pada\nprogram magister dapat mendaftar Beasiswa\nLPDP di jenjang studi yang sama, dibuktikan\ndengan melampirkan surat\npemberhentian/sejenisnya sebagai\nmahasiswa dari perguruan tinggi tersebut.\n7. Melampirkan surat rekomendasi sesuai\ndengan persyaratan masing-masing program\nyang diterbitkan paling lama 1 (satu) tahun di\nbulan yang sama dengan waktu pendaftaran']","Beasiswa Tipe-A mencakup akomodasi di kampus, tunjangan mingguan sebesar NTD 1,500, dan penggantian biaya tiket pesawat (maksimal NTD 10,000).",0.99999999995,,0.0,0.0
4,Siapa yang memenuhi syarat untuk mendaftar program ini?,Masyarakat KIP/Bidik Misi atau mahasiswa yang kurang mampu dapat mendaftar GCW/GCA terlebih dahulu tanpa melakukan pembayaran untuk kemudian dievaluasi. Beasiswa dan bebas biaya mengikuti GCW/GCA selalu dimungkinkan untuk mahasiswa KIP/Bidik Misi yang memenuhi persyaratan.,"['2. Look at the requirement of the program\nPreparing required document\n• Each program have different document\nrequirement listed on the web. Please\ncheck each of the requirement inside the\nrespected website link of the program for\ndetails\nwww.its.ac.id INSTITUT TEKNOLOGI SEPULUH NOPEMBER, Surabaya - Indonesia\n2a. Preparing Learning Agreement & Statement Letter\nFill Out Learning\nAgreement / Statement\nLetter\n• In case the description of the\nprogram required you to submit a\nLearning Agreement or Statement\nLetter file, please download the file\nform the web & fill it with your\ninformation first\nhttp://bit.ly/its-student-exchange\nhttps://intip.in/ResourceAkademikDanKemahasiswaanTIF\nwww.its.ac.id INSTITUT TEKNOLOGI SEPULUH NOPEMBER, Surabaya - Indonesia\n2b. Selecting Course to be Transferred\n• In case the description of the program required you to submit a Learning Agreement,\nplease check the Host University Syllabus & Informatics Syllabus to compare if the'
 '1. Setiap mahasiswa ITS yang ingin mendaftar program internasional di perguruan tinggi mitra ITS luar negeri yang\nmembutuhkan surat rekomendasi atau dana dukungan dari ITS di antaranya IISMA/IISMA-Vo, pertukaran pelajar (exchange),\nlab-internship, short program, atau program lain di luar negeri, diharuskan memiliki sertifikat Global Competency\nWorkshop (GCW) atau Global Competency Academy (GCA). Sertifikat ini hanya bisa diperoleh dengan mengikuti program\nGCW atau GCA.'
 'with the format written on the program web\n• After that, ITS GE will reply back to you email regarding further step to join the program\nwww.its.ac.id INSTITUT TEKNOLOGI SEPULUH NOPEMBER, Surabaya - Indonesia\n- Thank You-\nwww.its.ac.id its_campus institut teknologu sepuluh nopember'
 '4, Mahasiswa KIP/Bidik Misi atau mahasiswa yang kurang mampu dapat mendaftar GCW/GCA terlebih dahulu tanpa melakukan\npembayaran untuk kemudian dievaluasi. Beasiswa dan bebas biaya mengikuti GCW/GCA selalu dimungkinkan untuk\nmahasiswa KIP/Bidik Misi yang memenuhi persyaratan.']",Program ini terbuka untuk mahasiswa pascasarjana (S2/S3) dan mahasiswa tahun ketiga atau lebih tinggi. Mahasiswa yang sudah menyelesaikan gelar PhD tidak memenuhi syarat.,0.499999999975,1.0,0.8230620558319107,0.5
5,Apa persyaratan dokumen yang harus disiapkan untuk pendaftaran?,"Dokumen yang harus disiapkan untuk pendaftaran meliputi:

1. Learning Agreement & Statement Letter
2. Seleksi Mata Kuliah yang Akan Ditransfer
3. Komitmen kembali ke Indonesia, rencana pasca studi, dan rencana kontribusi di Indonesia (1500 – 2000 kata)
4. Persyaratan khusus Beasiswa Kemitraan LPDP – Campus France Program Master
5. Dokumen aplikasi seperti formulir aplikasi online, Curriculum Vitae, Transkrip Resmi, Surat Rekomendasi, Sertifikat kemampuan bahasa, Rencana Penelitian, Salinan Paspor, Foto, dan Dokumen Tambahan (opsional)

Semua persyaratan dokumen tersebut harus dipenuhi sesuai dengan ketentuan yang telah ditetapkan dalam masing-masing program beasiswa.","['2. Look at the requirement of the program\nPreparing required document\n• Each program have different document\nrequirement listed on the web. Please\ncheck each of the requirement inside the\nrespected website link of the program for\ndetails\nwww.its.ac.id INSTITUT TEKNOLOGI SEPULUH NOPEMBER, Surabaya - Indonesia\n2a. Preparing Learning Agreement & Statement Letter\nFill Out Learning\nAgreement / Statement\nLetter\n• In case the description of the\nprogram required you to submit a\nLearning Agreement or Statement\nLetter file, please download the file\nform the web & fill it with your\ninformation first\nhttp://bit.ly/its-student-exchange\nhttps://intip.in/ResourceAkademikDanKemahasiswaanTIF\nwww.its.ac.id INSTITUT TEKNOLOGI SEPULUH NOPEMBER, Surabaya - Indonesia\n2b. Selecting Course to be Transferred\n• In case the description of the program required you to submit a Learning Agreement,\nplease check the Host University Syllabus & Informatics Syllabus to compare if the'
 'Syarat dokumen mengikuti syarat program\nbeasiswa yang dipilih (mengacu pada Buku\nPanduan masing-masing program beasiswa).\nSeperti apa format Komitmen kembali ke\nIndonesia, rencana pasca studi, dan\nrencana kontribusi di Indonesia serta\nRencana Bisnis atau Rencana\nPengembangan Bisnis?\nKomitmen kembali ke Indonesia, rencana\npasca studi, dan rencana kontribusi di\nIndonesia (1500 – 2000 kata)\nDeskripsikan dalam tulisan secara jelas dan\nkonkret tentang tema di atas.'
 'kejuaraan/non kejuaraan, dan pengalaman\norganisasi pada aplikasi pendaftaran.\nApa saja persyaratan khusus pendaftaran\nBeasiswa Prioritas LPDP – Campus France\nProgram Master?\nPersyaratan khusus Beasiswa Kemitraan LPDP –\nCampus France Program Master adalah sebagai\nberikut:'
 ""• Those who already complete PhD degree are NOT eligible to apply.\r\n• Passport holders of People's Republic of China, Hong Kong, or Macau\r\nare NOT eligible to apply.\r\n• Current degree-seeking students, exchange, and visiting students in\r\nTaiwanese educational institutions are NOT eligible to apply.\r\nAPPLICATION\r\nMATERIALS\r\n1. Online Application Form\r\n2. Curriculum Vitae in PDF\r\nformat\r\n3. Official Transcripts\r\n4. Letter of\r\nRecommendation in PDF\r\nformat\r\n5. Certificate of language\r\nproficiency\r\n6. Research Plan in PDF\r\nformat\r\n7. Copy of Passport (Bio-\r\npage)\r\n8. Head-shot Photo in JPG\r\nformat (at least 300 KB\r\nfiles ize, 826X1062 pixels.)\r\n9. Other Supplementary\r\nDocuments(Optional)\r\nAPPLICATION\r\n• Applicants should read the\r\nrequirements of each research topic\r\ncarefully, complete the online\r\napplication form, prepare\r\napplication materials, and send\r\nthem in a ZIP-compressed file to\r\ncoleng_dia@ccu.edu.tw.\r\n• The title of the e-mail please be\r\nmarked with “Application for 2024""]","Dokumen yang diperlukan meliputi: formulir aplikasi online, CV, transkrip resmi, surat rekomendasi, sertifikat kemampuan bahasa, rencana penelitian, salinan paspor, foto head-shot, dan dokumen tambahan opsional.",0.8055555555287036,1.0,0.9822444837131344,1.0
6,Bagaimana cara mengajukan aplikasi untuk program ini?,"Untuk mengajukan aplikasi untuk program ini, Anda perlu menyiapkan materi aplikasi dan mengirimkannya dalam file ZIP ke coleng_dia@ccu.edu.tw. Pastikan judul email Anda mencantumkan ""Aplikasi untuk Internship Internasional CCU/COE 2024"". Batas waktu pengajuan aplikasi adalah 3 Maret 2024. Informasi lebih lanjut tentang aplikasi dapat ditemukan di website https://sites.google.com/view/ccu-coe-internship/home. Jika Anda membutuhkan bantuan lebih lanjut, Anda dapat menghubungi +886-5-2720411 ext. 23003, 23005 atau mengirim email ke coleng_dia@ccu.edu.tw.","['application form, prepare\r\napplication materials, and send\r\nthem in a ZIP-compressed file to\r\ncoleng_dia@ccu.edu.tw.\r\n• The title of the e-mail please be\r\nmarked with “Application for 2024\r\nCCU/COE International Internship”.\r\nAll the intern research topics and\r\ntheir requirements are listed as\r\nfollows.\r\n• Application deadline: Mar. 3, 2024\r\n• More detailed information about\r\napplication can be found on the\r\nwebsite\r\nhttps://sites.google.com/view/ccu-\r\ncoe-internship/home\r\nCONTACT\r\n+886-5-2720411 ext. 23003, 23005\r\ncoleng_dia@ccu.edu.tw\r\nNo.168, Sec. 1, University Rd., Minhsiung,\r\nChiayi 621301, Taiwan (R.O.C.)\r\n\r\nINTERN RESEARCH TOPICS\r\nNumber P1\r\nProject title\r\nTrustable Artificial Intelligence for Critical Applications and\r\n6G Security\r\nDescription of the research\r\nArtificial Intelligence (AI) technologies, 6G networking,\r\nand quantum computing are the leading forces in\r\nbringing the world to an era of better intelligence and full'
 'melampirkan surat usulan atau surat\nrekomendasi sekurang-kurangnya dari\npejabat setingkat eselon II yang membidangi\npembinaan/pengembangan SDM pada\nKementerian/Lembaga atau Pemerintah\nDaerah tempat pendaftar bekerja dengan\nketentuan;\na. mengusulkan atau merekomendasikan\npendaftar untuk mengikuti program\nBeasiswa LPDP; dan\nb. mencantumkan Nama Lengkap serta\nNomor Induk Pegawai (NIP) pendaftar.\n9. Bagi pendaftar yang merupakan PNS dengan\nstatus PNS dengan jabatan fungsional\nsebagai Peneliti/Perekayasa/Medis/\nParamedis/ Pendidik, mengunggah Surat\nKeputusan (SK) Jabatan Terakhir atau SK\nKenaikan Pangkat Terakhir atau sejenisnya\nyang menunjukkan bahwa pendaftar adalah\nPNS dengan jabatan fungsional sebagai\nPeneliti/Perekayasa/Medis/Paramedis/Pendi\ndik.\n10. Bagi pendaftar berstatus prajurit TNI di semua\nprogram beasiswa LPDP wajib melampirkan\nsurat usulan atau surat rekomendasi\nsekurang-kurangnya pejabat yang\nmembidangi pembinaan SDM pada Mabes\nTNI/ TNI AD/ TNI AL/ TNI AU untuk mengikuti'
 '2. Look at the requirement of the program\nPreparing required document\n• Each program have different document\nrequirement listed on the web. Please\ncheck each of the requirement inside the\nrespected website link of the program for\ndetails\nwww.its.ac.id INSTITUT TEKNOLOGI SEPULUH NOPEMBER, Surabaya - Indonesia\n2a. Preparing Learning Agreement & Statement Letter\nFill Out Learning\nAgreement / Statement\nLetter\n• In case the description of the\nprogram required you to submit a\nLearning Agreement or Statement\nLetter file, please download the file\nform the web & fill it with your\ninformation first\nhttp://bit.ly/its-student-exchange\nhttps://intip.in/ResourceAkademikDanKemahasiswaanTIF\nwww.its.ac.id INSTITUT TEKNOLOGI SEPULUH NOPEMBER, Surabaya - Indonesia\n2b. Selecting Course to be Transferred\n• In case the description of the program required you to submit a Learning Agreement,\nplease check the Host University Syllabus & Informatics Syllabus to compare if the'
 'program beasiswa LPDP wajib melampirkan\nsurat usulan atau surat rekomendasi\nsekurang-kurangnya pejabat yang\nmembidangi pembinaan SDM pada Mabes\nTNI/ TNI AD/ TNI AL/ TNI AU untuk mengikuti\nprogram beasiswa LPDP yang ditujukan\nkepada LPDP.\n11. Bagi pendaftar berstatus anggota POLRI di\nsemua program beasiswa LPDP wajib\nmelampirkan surat usulan atau surat\nrekomendasi sekurang-kurangnya pejabat\nyang membidangi pembinaan SDM pada\nMabes POLRI untuk mengikuti program\nbeasiswa LPDP kepada LPDP pada saat\npendaftaran beasiswa LPDP.\n12. Memilih Perguruan Tinggi Tujuan dan\nprogram studi sesuai dengan ketentuan LPDP\n13. Beasiswa hanya diperuntukkan bagi kelas\nreguler atau kelas lain yang ditetapkan oleh\nLPDP, dan tidak diperuntukkan untuk kelas-\nkelas sebagai berikut:\na. Kelas eksekutif;\nb. Kelas khusus;\nc. Kelas karyawan;\nd. Kelas jarak jauh;\ne. Kelas yang diselenggarakan bukan di\nperguruan tinggi induk;\nf. Kelas internasional bagi pendaftar tujuan\nstudi dalam negeri;']","Pelamar harus membaca persyaratan setiap topik penelitian dengan cermat, melengkapi formulir aplikasi online, menyiapkan dokumen aplikasi, dan mengirim semuanya dalam file ZIP ke coleng_dia@ccu.edu.tw dengan subjek email “Application for 2024 CCU/COE International Internship”.",0.9999999999666667,1.0,0.0,0.0
7,Apa tenggat waktu penyerahan aplikasi? ,Tenggat waktu penyerahan aplikasi adalah setidaknya 8 minggu antara 1 Mei hingga 31 Desember 2024.,"['Intern period At least 12 weeks between May 1st and Dec. 31th\r\n\r\nNumber P4\r\nProject title\r\nSimulation and Reconstruction of Pencil Beam Scanning of\r\nParticle Therapy\r\nDescription of the research\r\nPencil beam scanning in particle therapy is one of the\r\nhighlight radiation therapies for cancer treatment. Due to\r\nthe effectively and precisely control for particle-beam, the\r\nnarrow pulse and extremely high radiation dose rate\r\ndelivering becomes more and more significant. Basically,\r\nthe high dose rate will enable the recombination of the ion\r\npair effect, and it can lead to the received signal\r\nunderestimated. In addition, the higher spatial resolution\r\nand wide field of view is necessary. So, the main purpose of\r\nthe project is to develop a novel algorithm to reconstruct\r\nthe 2D image of the extremely high dose rate in\r\nproton/particle therapies. We hope that the students could\r\njoin us to implement a novel reconstruction algorithm and'
 'Please refer to the website of our lab at\r\nhttps://sites.google.com/view/ccuantlab/english\r\nMentor at CCU\r\nAssoc. Prof. Jen-Yi Pan\r\nDept. of Communications Engineering,\r\nNational Chung Cheng University, Taiwan, ROC.\r\n(e-mail: jypan@ccu.edu.tw)\r\nExpected student level\r\n■ Post-graduate student\r\n■ Third/forth-year undergraduate senior student\r\nCategory\r\n■ Scholarship\r\n■ Self-supported\r\nIntern period\r\nAt least 8 weeks between May 1 and December 31,\r\n2024'
 '■ Post-graduate student\r\n■ Third/forth-year undergraduate senior student\r\nCategory\r\n■ Scholarship\r\n■ Self-supported\r\nIntern period At least 8 weeks between May and December 2024\r\n\r\nNumber P13\r\nProject title\r\nApplication of Novel Snap-shot based hyperspectral imaging\r\ncombined with AI to detect Lesions\r\nDescription of the\r\nresearch\r\nThe early detection of esophageal cancer presents a\r\nconsiderable difficulty, which contributes to its high\r\nprevalence as a major cause of cancer-related fatalities. This\r\nproject will utilize various machine learning models, including\r\nYOLOv5, YOLOv8, R-CNN, and Faster R-CNN, to predict and\r\ndetect early-stage esophageal cancer. It will make use of two\r\nmodels of esophageal cancer images: the white-light images\r\n(WLI) model and the hyperspectral narrowband images (HSI-\r\nNBI) model. These models will be generated through a\r\nconversion algorithm referred to as the spectrum-aided\r\nvision enhancer (SAVE). The main goal will be to discover'
 'Category\r\n■ Scholarship\r\n■ Self-supported\r\nIntern period At least 8 weeks between 2024/5/1- 2024/12/31\r\n\r\nNumber P16\r\nProject title\r\nNext generation Wireless communication, B5G/6G,\r\nReconfigurable Intelligent Surface, System level\r\nsimulation, Artificial Intelligence-enhanced wireless\r\nresearch\r\nDescription of the\r\nresearch\r\nInnovate and design cutting-edge concepts and\r\narchitectures beyond 5G (B5G) and 6G.\r\nIdentify and validate solutions to key problems through\r\nsimulation or prototype experiments.\r\nConduct research on AI and machine learning\r\ntechniques applied to wireless communications and\r\nnetworks.\r\nDesign and implement novel algorithms, models, and\r\nprotocols to optimize wireless network performance.\r\nCollaborate with the research team to manage projects\r\nand ensure timely deliverables,\r\nPlease refer to the website of our lab at\r\nhttps://sites.google.com/view/ccuantlab/english\r\nMentor at CCU\r\nAssoc. Prof. Jen-Yi Pan\r\nDept. of Communications Engineering,']",Tenggat waktu penyerahan aplikasi adalah 3 Maret 2024.,0.6388888888675925,0.0,0.8422889647092674,1.0
8,Proyek apa saja yang tersedia dalam program ini?,"Terdapat beberapa proyek yang tersedia dalam program ini, di antaranya adalah:
1. Trustable Artificial Intelligence for Critical Applications and 6G Security

Itulah salah satu proyek yang tersedia dalam program ini.","['Dipublikasikan tanggal 11 Januari 2024\nprogram beasiswa lain yang dipilih, sesuai\ndengan syarat dan ketentuan yang berlaku.\nApa saja komponen Dana yang diberikan?\n1. Dana Pendidikan\na. Tuition Fee\nb. Dana Pendaftaran\nc. Dana Tunjangan Buku\nd. Dana Penelitian Tesis\ne. Dana Seminar Internasional\nf. Dana Publikasi Jurnal Internasional\n2. Dana Pendukung\na. Dana Transportasi\nb. Dana Aplikasi Visa\nc. Dana Asuransi Kesehatan\nd. Dana Kedatangan\ne. Dana Hidup Bulanan\nf. Dana Lomba Internasional\ng. Dana keadaaan darurat (jika diperlukan)\nApa saja persyaratan umum pendaftaran\nBeasiswa Prioritas LPDP – Campus\nFrance Program Master?\nPersyaratan umum Beasiswa Prioritas LPDP –\nCampus France Program Master adalah sebagai\nberikut:\n1. Warga Negara Indonesia.\n2. Telah menyelesaikan studi program diploma\nempat (D4) atau sarjana (S1).\n3. Pendaftar yang telah menyelesaikan studi\nmagister (S2) tidak diizinkan mendaftar.\n4. Bagi pendaftar lulusan perguruan tinggi luar'
 'Dipublikasikan tanggal 11 Januari 2024\nNo Bidang Study Program University\n51 Material Sciences\nGraduate Programme Innovative Materials and\nEnergy Systems (Emat) - Master\nNantes Université\n52 Urban Planning Economics for Smart Cities and Climate Policy Institut Polytechnique de Paris\nPoin-Poin Surat Pernyataan pada Aplikasi Pendaftaran (Disetujui Saat Akan Melakukan Submit)\n1. Setia kepada Pancasila, Negara Kesatuan Republik Indonesia, dan UUD 1945.\n2. Tidak pernah, sedang, atau akan mendukung atau terlibat dalam gerakan, organisasi, atau ideologi\nyang bertentangan dan/atau berpotensi mengganggu tegaknya ideologi Pancasila, Undang-\nUndang Dasar 1945, dan Negara Kesatuan Republik Indonesia.\n3. Mendahulukan kepentingan Bangsa dan Negara Kesatuan Republik Indonesia di atas kepentingan\npribadi.\n4. Tidak akan berpindah kewarganegaraan sejak pendaftaran beasiswa sampai dengan selesainya\nmasa kontribusi sebagai alumni beasiswa LPDP.'
 'Department. In this course, students would be assigned a project to design a\nresidential living house and business office in one building in Taiwan. Through the\nindividual discussion and idea exchange with the professor, students may enhance and\nextend their design ability to accomplish their project.\nThe Course Features\nThe goal of this course is to enhance the design potential and vision of students for\nthem to apply it in future projects. This course is to cultivate the logical thinking and\ncreativity of students. Students may improve their abilities through the discussion and\nexpression process in the course. There are two presentation phases during the\nsemester for students to present their improvement of design and project.\n77\nSyllabus\nWeek Contents\nTeaching\nHours\n1\n(Sep. 23)\n(Sep. 25)\nIntroduction of the Course; Self-introduction; Project description;\nIntroducing the base environment; Design concept\n6\n2 Student project observe and reviews of Asia University 6'
 'application form, prepare\r\napplication materials, and send\r\nthem in a ZIP-compressed file to\r\ncoleng_dia@ccu.edu.tw.\r\n• The title of the e-mail please be\r\nmarked with “Application for 2024\r\nCCU/COE International Internship”.\r\nAll the intern research topics and\r\ntheir requirements are listed as\r\nfollows.\r\n• Application deadline: Mar. 3, 2024\r\n• More detailed information about\r\napplication can be found on the\r\nwebsite\r\nhttps://sites.google.com/view/ccu-\r\ncoe-internship/home\r\nCONTACT\r\n+886-5-2720411 ext. 23003, 23005\r\ncoleng_dia@ccu.edu.tw\r\nNo.168, Sec. 1, University Rd., Minhsiung,\r\nChiayi 621301, Taiwan (R.O.C.)\r\n\r\nINTERN RESEARCH TOPICS\r\nNumber P1\r\nProject title\r\nTrustable Artificial Intelligence for Critical Applications and\r\n6G Security\r\nDescription of the research\r\nArtificial Intelligence (AI) technologies, 6G networking,\r\nand quantum computing are the leading forces in\r\nbringing the world to an era of better intelligence and full']","Terdapat berbagai proyek, termasuk ""Trustable Artificial Intelligence for Critical Applications and 6G Security,"" ""Grid-Forming and Grid-Following Inverter-based Resources for Low-Inertia Microgrid/Grid,"" dan banyak lagi.",0.8055555555287036,1.0,0.9876160605596421,1.0
9,"Siapa mentor yang terlibat dalam proyek P1 ""Trustable Artificial Intelligence for Critical Applications and 6G Security""?","Mentor yang terlibat dalam proyek P1 ""Trustable Artificial Intelligence for Critical Applications and 6G Security"" adalah Prof. Van-Linh Nguyen.","['Please refer to the website of our lab at\r\nhttps://sites.google.com/view/ccuantlab/english\r\nMentor at CCU\r\nAssoc. Prof. Jen-Yi Pan\r\nDept. of Communications Engineering,\r\nNational Chung Cheng University, Taiwan, ROC.\r\n(e-mail: jypan@ccu.edu.tw)\r\nExpected student level\r\n■ Post-graduate student\r\n■ Third/forth-year undergraduate senior student\r\nCategory\r\n■ Scholarship\r\n■ Self-supported\r\nIntern period\r\nAt least 8 weeks between May 1 and December 31,\r\n2024'
 'some preliminary knowledge on NN (neural network) or\r\ndeep learning and skilled in Python programming. He/She\r\nwill learn how to apply state-of-the-art deep learning\r\ntechniques to solve the indicated problems. For more detail\r\nabout my topics, please visit my Youtube vide at:\r\nhttps://youtu.be/tIwenpyFRhw\r\nMentor at CCU\r\nProf. Wen-Nung Lie\r\nDept. of Electrical Engineering,\r\nNational Chung Cheng University, Taiwan.\r\n(e-mail: ieewnl@ccu.edu.tw)\r\nExpected student level\r\n■ Post-graduate student\r\n■ Third/forth-year undergraduate senior student\r\nCategory ■ Scholarship\r\nIntern period\r\nAt least 8 weeks (2 months) between May 1, 2024 and June\r\n30, 2025. However, 3-6 months is better.\r\n\r\nNumber P6\r\nProject title\r\nImpulse Radar Imaging System, mmWave/RF Intergrated\r\nCircuit design and Energy Harvesting\r\nDescription of the research\r\nFour investigation topics over Ultra-Wideband Impulse\r\nRadar imaging system:\r\n1. A back-projection imaging algorithm used to\r\nreconstruct the radar image.'
 'or large disturbances.\r\nMentor at CCU\r\nProf. Gary Chang, PhD, PE, IEEE Fellow\r\nDept. of Electrical Engineering,\r\nNational Chung Cheng University, Taiwan, ROC.\r\n(e-mail: ieegwc@ccu.edu.tw)\r\nExpected student level\r\n■ Post-graduate student\r\n■ Third/forth-year undergraduate senior student\r\nCategory\r\n█ Scholarship\r\n█ Self-supported\r\nIntern period 12 to 20 weeks between April 1 and Dec. 31, 2024\r\n\r\nNumber P3\r\nProject title Lidar and Camera fusion for autonomous driving\r\nDescription of the research\r\nThis project revolves around the integration of lidar and\r\ncamera sensor data, aiming to develop robust algorithms\r\nfor enhanced perception and decision-making in self-\r\ndriving systems. Interns will engage in the fusion of lidar\r\nand camera inputs, leveraging Python and advanced\r\nmachine learning models. The primary objectives include\r\ndeveloping algorithms for sensor data calibration, point\r\ncloud processing and image processing to create a\r\ncomprehensive and accurate representation of the'
 'secure AI models are the top targets of many current\r\nresearch efforts. In short, our lab is recruiting talents who\r\nare interested in the following topics:\r\n(1) AI for Cybersecurity: Misbehavior detection in\r\nautonomous vehicles, Deep Reinforcement Learning for\r\naerial-assisted networks (UAV-satellite-space) or\r\nIntelligent Transportation Systems, Self-supervised\r\nLearning, autoDL /ML for Intrusion Detection Systems.\r\n(2) Cybersecurity for AI: Trustable AI for automated\r\nvehicles and AI-based control systems from adversarial\r\nattacks.\r\n(3) 6G security: Signal sensing, physical layer\r\nauthentication, high-accuracy localization and sensing.\r\n(4) Space and Quantum security: Blockchain for\r\nvehicular/aerial networks; Quantum - safe\r\nvehicular/aerial networks; Quantum - compatible IDS\r\nplatforms.\r\nAbout CISLab: CIS Lab is a leading security research group\r\nat National Chung Cheng University, established by Prof.\r\nVan-Linh Nguyen. CISLab has been the home of many']","Mentor untuk proyek ini adalah Asst. Prof. Van-Linh Nguyen dari Dept. of Computer Science and Information Engineering, CCU.",0.999999999975,0.0,0.931614830920208,0.0
10,Apa yang dapat diperoleh peserta selama periode magang pada proyek P1? ,"Selama periode magang pada proyek P1, peserta dapat memperoleh pengetahuan dan pengalaman dalam topik-topik penelitian tentang mesin Stirling dan aplikasi-aplikasinya dalam energi terbarukan. Mereka akan terlibat dalam kegiatan penelitian yang bertujuan untuk memahami lebih dalam tentang mesin Stirling dan cara penerapannya dalam bidang energi terbarukan.","['4, Mahasiswa KIP/Bidik Misi atau mahasiswa yang kurang mampu dapat mendaftar GCW/GCA terlebih dahulu tanpa melakukan\npembayaran untuk kemudian dievaluasi. Beasiswa dan bebas biaya mengikuti GCW/GCA selalu dimungkinkan untuk\nmahasiswa KIP/Bidik Misi yang memenuhi persyaratan.'
 'NBI) model. These models will be generated through a\r\nconversion algorithm referred to as the spectrum-aided\r\nvision enhancer (SAVE). The main goal will be to discover\r\nDysplasia and Squamous Cell Carcinoma (SCC). The\r\nevaluation of model performance will be conducted using the\r\ncreated confusion matrix and five important indicators:\r\nprecision, recall, F1-score, mAP, and the confusion matrix of\r\nthe trained model.\r\nMentor at CCU\r\nProf. Hsiang-Chen Wang\r\nDept. of Mechanical Engineering,\r\nNational Chung Cheng University, Taiwan, ROC.\r\n(e-mail: hcwang@ccu.edu.tw)\r\nExpected student level\r\n■ Post-graduate student\r\n■ Third/forth-year undergraduate senior student\r\nCategory ■ Scholarship\r\nIntern period At least 12 weeks between May and December 2024\r\n\r\nNumber P14\r\nProject title Stirling engines and their applications\r\nDescription of the\r\nresearch\r\nThe students will learn the research topics about Stirling\r\nengines and their applications in renewable energy,'
 'Dipublikasikan tanggal 11 Januari 2024\nprogram beasiswa lain yang dipilih, sesuai\ndengan syarat dan ketentuan yang berlaku.\nApa saja komponen Dana yang diberikan?\n1. Dana Pendidikan\na. Tuition Fee\nb. Dana Pendaftaran\nc. Dana Tunjangan Buku\nd. Dana Penelitian Tesis\ne. Dana Seminar Internasional\nf. Dana Publikasi Jurnal Internasional\n2. Dana Pendukung\na. Dana Transportasi\nb. Dana Aplikasi Visa\nc. Dana Asuransi Kesehatan\nd. Dana Kedatangan\ne. Dana Hidup Bulanan\nf. Dana Lomba Internasional\ng. Dana keadaaan darurat (jika diperlukan)\nApa saja persyaratan umum pendaftaran\nBeasiswa Prioritas LPDP – Campus\nFrance Program Master?\nPersyaratan umum Beasiswa Prioritas LPDP –\nCampus France Program Master adalah sebagai\nberikut:\n1. Warga Negara Indonesia.\n2. Telah menyelesaikan studi program diploma\nempat (D4) atau sarjana (S1).\n3. Pendaftar yang telah menyelesaikan studi\nmagister (S2) tidak diizinkan mendaftar.\n4. Bagi pendaftar lulusan perguruan tinggi luar'
 'or large disturbances.\r\nMentor at CCU\r\nProf. Gary Chang, PhD, PE, IEEE Fellow\r\nDept. of Electrical Engineering,\r\nNational Chung Cheng University, Taiwan, ROC.\r\n(e-mail: ieegwc@ccu.edu.tw)\r\nExpected student level\r\n■ Post-graduate student\r\n■ Third/forth-year undergraduate senior student\r\nCategory\r\n█ Scholarship\r\n█ Self-supported\r\nIntern period 12 to 20 weeks between April 1 and Dec. 31, 2024\r\n\r\nNumber P3\r\nProject title Lidar and Camera fusion for autonomous driving\r\nDescription of the research\r\nThis project revolves around the integration of lidar and\r\ncamera sensor data, aiming to develop robust algorithms\r\nfor enhanced perception and decision-making in self-\r\ndriving systems. Interns will engage in the fusion of lidar\r\nand camera inputs, leveraging Python and advanced\r\nmachine learning models. The primary objectives include\r\ndeveloping algorithms for sensor data calibration, point\r\ncloud processing and image processing to create a\r\ncomprehensive and accurate representation of the']","Peserta akan memperoleh keterampilan dalam penelitian state-of-the-art, keterampilan pemrograman melalui proyek mini, debat untuk mendapatkan ide kreatif, pelaporan hasil secara profesional, dan menghadiri tur industri serta kursus bahasa Tionghoa.",0.9166666666361111,1.0,0.8878897953543264,0.0
11,"Proyek P2 ""A Study of Grid-Forming and Grid-Following Inverter-based Resources for Low-Inertia Microgrid/Grid with Virtual Inertia and Grid Voltage Support Functions"" mencakup apa?",Saya tidak tahu.,"['Dipublikasikan tanggal 11 Januari 2024\nNo Bidang Study Program University\n51 Material Sciences\nGraduate Programme Innovative Materials and\nEnergy Systems (Emat) - Master\nNantes Université\n52 Urban Planning Economics for Smart Cities and Climate Policy Institut Polytechnique de Paris\nPoin-Poin Surat Pernyataan pada Aplikasi Pendaftaran (Disetujui Saat Akan Melakukan Submit)\n1. Setia kepada Pancasila, Negara Kesatuan Republik Indonesia, dan UUD 1945.\n2. Tidak pernah, sedang, atau akan mendukung atau terlibat dalam gerakan, organisasi, atau ideologi\nyang bertentangan dan/atau berpotensi mengganggu tegaknya ideologi Pancasila, Undang-\nUndang Dasar 1945, dan Negara Kesatuan Republik Indonesia.\n3. Mendahulukan kepentingan Bangsa dan Negara Kesatuan Republik Indonesia di atas kepentingan\npribadi.\n4. Tidak akan berpindah kewarganegaraan sejak pendaftaran beasiswa sampai dengan selesainya\nmasa kontribusi sebagai alumni beasiswa LPDP.'
 'Project title\r\nRenewable Energy Integration: Power System Analyses,\r\nPower Conversion or Intelligent Control\r\nDescription of the research\r\nThe students will learn the research topics about\r\nrenewable energy integration, which includes one of the\r\nfollowing issues:\r\n➢ Wind farm modeling and control\r\n➢ Fault diagnosis for solar power systems\r\n➢ Artificial intelligence applications on renewable\r\npower systems\r\n➢ Forecasting technologies for renewable power\r\nresources\r\n➢ Smart grid control and operation\r\n➢ Energy storage systems\r\n➢ Transmission and distribution system analyses\r\nMentor at CCU\r\nProf. Yuan-Kang Wu\r\nDept. of Electrical Engineering\r\nNational Chung Cheng University, Taiwan, ROC.\r\n(e-mail: allenwu@ccu.edu.tw)\r\nExpected student level\r\n█ Post-graduate student\r\n█ Third/forth-year undergraduate senior student\r\nCategory █ Scholarship\r\nIntern period At least 12 weeks between May 1 and December 31, 2024\r\n\r\nNumber P8\r\nProject title Silicon photonics and optical biosesnors'
 'Dipublikasikan tanggal 11 Januari 2024\nTentang LPDP\nLPDP berkomitmen untuk mempersiapkan\npemimpin dan profesional masa depan serta\nmendorong inovasi demi terwujudnya Indonesia\nyang sejahtera, demokratis, dan berkeadilan.\nLPDP menyelenggarakan program beasiswa\nmagister/doktor serta beasiswa dokter spesialis,\ndokter subspesialis dan Fellowship untuk putra-\nputri terbaik Indonesia.\nApa itu Beasiswa Prioritas?\nBeasiswa Prioritas merupakan program beasiswa\nyang memberikan kesempatan kepada pendaftar\nuntuk dapat melakukan pendaftaran pada dua\nprogram sekaligus, yaitu pada program Beasiswa\nKemitraan/Kerja Sama LPDP dan pada salah satu\nprogram Beasiswa Afirmasi/Beasiswa\nTargeted/Beasiswa Umum tujuan luar negeri.\nApa itu Beasiswa Prioritas LPDP – Campus\nFrance Program Master?\nBeasiswa Prioritas LPDP – Campus France\nProgram Master memberikan kesempatan bagi\npendaftar untuk dapat melakukan pendaftaran\npada Beasiswa Kemitraan LPDP – Campus\nFrance dan beasiswa Magister Luar Negeri'
 ""Dipublikasikan tanggal 11 Januari 2024\nDAFTAR PERGURUAN TINGGI\nPROGRAM BEASISWA PRIORITAS LPDP – CAMPUS FRANCE PROGRAM MASTER\n2024\nNo Bidang Study Program University\n1 Blue Economy Master on Ship Operation Naval Engineering Ecole Centrale de Nantes\n2 Blue Economy\nMaster in Marine Technology - Hydrodynamics for\nOcean Engineering\nEcole Centrale de Nantes\n3 Blue Economy\nMSc Marine Technology Atlantic Master on Ship\nOperation & Naval Engineering (M-TECH\nAMASONE)\nEcole Centrale de Nantes\n4 Creative Industry\nMDes International Design Strategy / Le Studio\nFrance\nEcole de design Nantes\nAtlantique\n5 Creative Industry\nMSc Fashion, Design and Luxury Management\n(MSc FDLM)\nGrenoble Ecole de\nManagement\n6 Creative Industry\nMaster in Communications, Media and Creative\nIndustries\nSciences Po\n7 Creative Industry\nMSc Creative Music and Sound Design for Visual\nMedia Scoring\nUniversité Côte d'Azur\n8 Creative Industry\nMaster of Arts in Character Animation and\nAnimated Filmmaking\nLes Gobelins\n9""]",Proyek ini mencakup penelitian berbasis simulasi untuk meningkatkan ketahanan dan stabilitas jaringan mikrogid/inverter berinertia rendah dengan menggunakan inverter GFM dan GFL dengan fungsi inertia virtual dan dukungan tegangan grid.,0.99999999995,,0.0,1.0
12,"Apa yang akan dipelajari dalam proyek P3 ""Lidar and Camera Fusion for Autonomous Driving""?","Dalam proyek P3 ""Lidar and Camera Fusion for Autonomous Driving"", peserta magang akan belajar tentang integrasi data sensor lidar dan kamera untuk mengembangkan algoritma yang kuat untuk persepsi dan pengambilan keputusan yang lebih baik dalam sistem self-driving. Mereka akan terlibat dalam penggabungan input lidar dan kamera, menggunakan Python dan model machine learning canggih. Tujuan utamanya termasuk pengembangan algoritma untuk kalibrasi data sensor, pemrosesan awan titik, dan pemrosesan gambar untuk menciptakan representasi yang komprehensif dan akurat dari lingkungan sekitar kendaraan.","['NBI) model. These models will be generated through a\r\nconversion algorithm referred to as the spectrum-aided\r\nvision enhancer (SAVE). The main goal will be to discover\r\nDysplasia and Squamous Cell Carcinoma (SCC). The\r\nevaluation of model performance will be conducted using the\r\ncreated confusion matrix and five important indicators:\r\nprecision, recall, F1-score, mAP, and the confusion matrix of\r\nthe trained model.\r\nMentor at CCU\r\nProf. Hsiang-Chen Wang\r\nDept. of Mechanical Engineering,\r\nNational Chung Cheng University, Taiwan, ROC.\r\n(e-mail: hcwang@ccu.edu.tw)\r\nExpected student level\r\n■ Post-graduate student\r\n■ Third/forth-year undergraduate senior student\r\nCategory ■ Scholarship\r\nIntern period At least 12 weeks between May and December 2024\r\n\r\nNumber P14\r\nProject title Stirling engines and their applications\r\nDescription of the\r\nresearch\r\nThe students will learn the research topics about Stirling\r\nengines and their applications in renewable energy,'
 ""developing algorithms for sensor data calibration, point\r\ncloud processing and image processing to create a\r\ncomprehensive and accurate representation of the\r\nvehicle's surroundings. The primary objective is to develop\r\nand optimize algorithms for efficiently processing and\r\ninterpreting the multi-modality. This includes tasks such as\r\nsemantic segmentation, feature extraction, and object\r\nrecognition, all of which are pivotal for the accurate\r\nperception of the vehicle's surroundings.\r\nMentor at CCU\r\nAssoc. Prof. Jui-Chiu Chiang\r\nDept. of Electrical Engineering,\r\nNational Chung Cheng University, Taiwan, ROC.\r\n(E-mail: rachel@ccu.edu.tw)\r\nExpected student level █ Third/forth-year undergraduate senior student\r\nCategory\r\n█ Scholarship\r\n█ Self-supported\r\nIntern period At least 12 weeks between May 1st and Dec. 31th\r\n\r\nNumber P4\r\nProject title\r\nSimulation and Reconstruction of Pencil Beam Scanning of\r\nParticle Therapy\r\nDescription of the research""
 'or large disturbances.\r\nMentor at CCU\r\nProf. Gary Chang, PhD, PE, IEEE Fellow\r\nDept. of Electrical Engineering,\r\nNational Chung Cheng University, Taiwan, ROC.\r\n(e-mail: ieegwc@ccu.edu.tw)\r\nExpected student level\r\n■ Post-graduate student\r\n■ Third/forth-year undergraduate senior student\r\nCategory\r\n█ Scholarship\r\n█ Self-supported\r\nIntern period 12 to 20 weeks between April 1 and Dec. 31, 2024\r\n\r\nNumber P3\r\nProject title Lidar and Camera fusion for autonomous driving\r\nDescription of the research\r\nThis project revolves around the integration of lidar and\r\ncamera sensor data, aiming to develop robust algorithms\r\nfor enhanced perception and decision-making in self-\r\ndriving systems. Interns will engage in the fusion of lidar\r\nand camera inputs, leveraging Python and advanced\r\nmachine learning models. The primary objectives include\r\ndeveloping algorithms for sensor data calibration, point\r\ncloud processing and image processing to create a\r\ncomprehensive and accurate representation of the'
 'Dipublikasikan tanggal 11 Januari 2024\nNo Bidang Study Program University\n51 Material Sciences\nGraduate Programme Innovative Materials and\nEnergy Systems (Emat) - Master\nNantes Université\n52 Urban Planning Economics for Smart Cities and Climate Policy Institut Polytechnique de Paris\nPoin-Poin Surat Pernyataan pada Aplikasi Pendaftaran (Disetujui Saat Akan Melakukan Submit)\n1. Setia kepada Pancasila, Negara Kesatuan Republik Indonesia, dan UUD 1945.\n2. Tidak pernah, sedang, atau akan mendukung atau terlibat dalam gerakan, organisasi, atau ideologi\nyang bertentangan dan/atau berpotensi mengganggu tegaknya ideologi Pancasila, Undang-\nUndang Dasar 1945, dan Negara Kesatuan Republik Indonesia.\n3. Mendahulukan kepentingan Bangsa dan Negara Kesatuan Republik Indonesia di atas kepentingan\npribadi.\n4. Tidak akan berpindah kewarganegaraan sejak pendaftaran beasiswa sampai dengan selesainya\nmasa kontribusi sebagai alumni beasiswa LPDP.']","Peserta akan mengembangkan algoritma untuk kalibrasi data sensor, pemrosesan titik awan, dan pemrosesan gambar untuk penggabungan data lidar dan kamera untuk sistem mengemudi otonom.",0.999999999975,0.8333333333333334,0.8929965244095057,1.0
13,"Apa yang membuat proyek P5 ""Computer Vision Applications based on Deep Learning Techniques"" menarik?","Proyek P5 ""Computer Vision Applications based on Deep Learning Techniques"" menarik karena melibatkan penggunaan teknik deep learning dalam aplikasi computer vision. Proyek ini akan menghasilkan model-model berbasis NBI yang dihasilkan melalui algoritma konversi yang disebut sebagai spectrum-aided vision enhancer (SAVE). Tujuan utamanya adalah untuk menemukan Dysplasia dan Squamous Cell Carcinoma (SCC) menggunakan model-model tersebut. Evaluasi kinerja model akan dilakukan menggunakan matriks kebingungan yang dibuat dan lima indikator penting: presisi, recall, F1-score, mAP, dan matriks kebingungan dari model yang dilatih. Selain itu, mahasiswa akan dibimbing oleh Prof. Hsiang-Chen Wang dari Departemen Teknik Mesin, National Chung Cheng University, Taiwan, ROC. Proyek ini cocok untuk mahasiswa tingkat pascasarjana atau mahasiswa tingkat senior sarjana tahun ketiga/keempat.","['NBI) model. These models will be generated through a\r\nconversion algorithm referred to as the spectrum-aided\r\nvision enhancer (SAVE). The main goal will be to discover\r\nDysplasia and Squamous Cell Carcinoma (SCC). The\r\nevaluation of model performance will be conducted using the\r\ncreated confusion matrix and five important indicators:\r\nprecision, recall, F1-score, mAP, and the confusion matrix of\r\nthe trained model.\r\nMentor at CCU\r\nProf. Hsiang-Chen Wang\r\nDept. of Mechanical Engineering,\r\nNational Chung Cheng University, Taiwan, ROC.\r\n(e-mail: hcwang@ccu.edu.tw)\r\nExpected student level\r\n■ Post-graduate student\r\n■ Third/forth-year undergraduate senior student\r\nCategory ■ Scholarship\r\nIntern period At least 12 weeks between May and December 2024\r\n\r\nNumber P14\r\nProject title Stirling engines and their applications\r\nDescription of the\r\nresearch\r\nThe students will learn the research topics about Stirling\r\nengines and their applications in renewable energy,'
 'Department. In this course, students would be assigned a project to design a\nresidential living house and business office in one building in Taiwan. Through the\nindividual discussion and idea exchange with the professor, students may enhance and\nextend their design ability to accomplish their project.\nThe Course Features\nThe goal of this course is to enhance the design potential and vision of students for\nthem to apply it in future projects. This course is to cultivate the logical thinking and\ncreativity of students. Students may improve their abilities through the discussion and\nexpression process in the course. There are two presentation phases during the\nsemester for students to present their improvement of design and project.\n77\nSyllabus\nWeek Contents\nTeaching\nHours\n1\n(Sep. 23)\n(Sep. 25)\nIntroduction of the Course; Self-introduction; Project description;\nIntroducing the base environment; Design concept\n6\n2 Student project observe and reviews of Asia University 6'
 'Dipublikasikan tanggal 11 Januari 2024\nTentang LPDP\nLPDP berkomitmen untuk mempersiapkan\npemimpin dan profesional masa depan serta\nmendorong inovasi demi terwujudnya Indonesia\nyang sejahtera, demokratis, dan berkeadilan.\nLPDP menyelenggarakan program beasiswa\nmagister/doktor serta beasiswa dokter spesialis,\ndokter subspesialis dan Fellowship untuk putra-\nputri terbaik Indonesia.\nApa itu Beasiswa Prioritas?\nBeasiswa Prioritas merupakan program beasiswa\nyang memberikan kesempatan kepada pendaftar\nuntuk dapat melakukan pendaftaran pada dua\nprogram sekaligus, yaitu pada program Beasiswa\nKemitraan/Kerja Sama LPDP dan pada salah satu\nprogram Beasiswa Afirmasi/Beasiswa\nTargeted/Beasiswa Umum tujuan luar negeri.\nApa itu Beasiswa Prioritas LPDP – Campus\nFrance Program Master?\nBeasiswa Prioritas LPDP – Campus France\nProgram Master memberikan kesempatan bagi\npendaftar untuk dapat melakukan pendaftaran\npada Beasiswa Kemitraan LPDP – Campus\nFrance dan beasiswa Magister Luar Negeri'
 'some preliminary knowledge on NN (neural network) or\r\ndeep learning and skilled in Python programming. He/She\r\nwill learn how to apply state-of-the-art deep learning\r\ntechniques to solve the indicated problems. For more detail\r\nabout my topics, please visit my Youtube vide at:\r\nhttps://youtu.be/tIwenpyFRhw\r\nMentor at CCU\r\nProf. Wen-Nung Lie\r\nDept. of Electrical Engineering,\r\nNational Chung Cheng University, Taiwan.\r\n(e-mail: ieewnl@ccu.edu.tw)\r\nExpected student level\r\n■ Post-graduate student\r\n■ Third/forth-year undergraduate senior student\r\nCategory ■ Scholarship\r\nIntern period\r\nAt least 8 weeks (2 months) between May 1, 2024 and June\r\n30, 2025. However, 3-6 months is better.\r\n\r\nNumber P6\r\nProject title\r\nImpulse Radar Imaging System, mmWave/RF Intergrated\r\nCircuit design and Energy Harvesting\r\nDescription of the research\r\nFour investigation topics over Ultra-Wideband Impulse\r\nRadar imaging system:\r\n1. A back-projection imaging algorithm used to\r\nreconstruct the radar image.']","Proyek ini mencakup teknik pembelajaran mendalam seperti CNN, RNN, LSTM, dan lain-lain untuk aplikasi seperti ekstraksi kerangka 3D manusia, pengenalan tindakan, dan estimasi pose objek dari gambar RGB tunggal.",0.7499999999625,0.8333333333333334,0.8873061431271223,0.0
14,"Apa fokus dari proyek P8 ""Silicon Photonics and Optical Biosensors""? ","FOKUS dari proyek P8 ""Silicon Photonics and Optical Biosensors"" adalah pengembangan jenis baru fotodetektor berbasis silikon yang kompatibel dengan CMOS, serta pengembangan biosensor optik sekali pakai baru untuk deteksi biomedis yang hemat biaya dan cepat untuk pengobatan yang tepat.","['Category █ Scholarship\r\nIntern period At least 12 weeks between May 1 and December 31, 2024\r\n\r\nNumber P8\r\nProject title Silicon photonics and optical biosesnors\r\nDescription of the research\r\nThe topic is to develope (a) new types of silicon-based,\r\nCMOS compatible photodetectors, which have many\r\nadvantages over conventional III-V based counterparts for\r\nmid-infrared applications, (b) new disposable optical\r\nbiosensors for cost-effective and rapid biomedical\r\ndetection for precise medicine. This internship program is\r\nopen for talents who are interested in advanced\r\noptoelectronic-sensing technologies. Focus will be placed\r\non designing, simulating, and analyzing new Si-based\r\ngroup-IV photodetectors and optical biosensors. For\r\nrelated information, please refer to the website of our lab\r\nat https://ccuphotonics307.wixsite.com/ccuphotonics307\r\nMentor at CCU\r\nProf. Guo-En Chang\r\nDept. of Mechanical Engineering\r\nNational Chung Cheng University, Taiwan, ROC.\r\n(e-mail: imegec@ccu.edu.tw)'
 'be placed on designing, simulating, and analyzing new optical\r\nmonitoring systems for metal additive systems. For related information,\r\nplease refer to the website of our lab at\r\nhttps://ccuphotonics307.wixsite.com/ccuphotonics307\r\nMentor at CCU\r\nProf. Guo-En Chang\r\nDept. of Mechanical Engineering\r\nNational Chung Cheng University, Taiwan, ROC.\r\n(e-mail: imegec@ccu.edu.tw)\r\nExpected student\r\nlevel\r\n█ Post-graduate student\r\n█ Third/forth-year undergraduate senior student\r\nCategory ■ Scholarship\r\nIntern period At least 8 weeks (up to 6 months) between May and December 2024\r\n\r\nNumber P10\r\nProject title\r\nEffect of operating conditions on the performance of an\r\nall-vanadium redox flow battery\r\nDescription of the research\r\nThe performance of the VRFB is influenced by operating\r\nconditions, such as electrolyte concentration and\r\nelectrolyte flow rate. Students will conduct experiments\r\nto investigate the effect of operating conditions on the\r\nperformance of the VRFB and determine a suitable'
 'NBI) model. These models will be generated through a\r\nconversion algorithm referred to as the spectrum-aided\r\nvision enhancer (SAVE). The main goal will be to discover\r\nDysplasia and Squamous Cell Carcinoma (SCC). The\r\nevaluation of model performance will be conducted using the\r\ncreated confusion matrix and five important indicators:\r\nprecision, recall, F1-score, mAP, and the confusion matrix of\r\nthe trained model.\r\nMentor at CCU\r\nProf. Hsiang-Chen Wang\r\nDept. of Mechanical Engineering,\r\nNational Chung Cheng University, Taiwan, ROC.\r\n(e-mail: hcwang@ccu.edu.tw)\r\nExpected student level\r\n■ Post-graduate student\r\n■ Third/forth-year undergraduate senior student\r\nCategory ■ Scholarship\r\nIntern period At least 12 weeks between May and December 2024\r\n\r\nNumber P14\r\nProject title Stirling engines and their applications\r\nDescription of the\r\nresearch\r\nThe students will learn the research topics about Stirling\r\nengines and their applications in renewable energy,'
 'Dipublikasikan tanggal 11 Januari 2024\nNo Bidang Study Program University\n51 Material Sciences\nGraduate Programme Innovative Materials and\nEnergy Systems (Emat) - Master\nNantes Université\n52 Urban Planning Economics for Smart Cities and Climate Policy Institut Polytechnique de Paris\nPoin-Poin Surat Pernyataan pada Aplikasi Pendaftaran (Disetujui Saat Akan Melakukan Submit)\n1. Setia kepada Pancasila, Negara Kesatuan Republik Indonesia, dan UUD 1945.\n2. Tidak pernah, sedang, atau akan mendukung atau terlibat dalam gerakan, organisasi, atau ideologi\nyang bertentangan dan/atau berpotensi mengganggu tegaknya ideologi Pancasila, Undang-\nUndang Dasar 1945, dan Negara Kesatuan Republik Indonesia.\n3. Mendahulukan kepentingan Bangsa dan Negara Kesatuan Republik Indonesia di atas kepentingan\npribadi.\n4. Tidak akan berpindah kewarganegaraan sejak pendaftaran beasiswa sampai dengan selesainya\nmasa kontribusi sebagai alumni beasiswa LPDP.']",Fokusnya adalah mengembangkan photodetektor berbasis silikon baru yang kompatibel dengan CMOS dan biosensor optik sekali pakai untuk deteksi biomedis yang cepat dan hemat biaya.,0.999999999975,1.0,0.9922818453932076,1.0
15,"Apa yang menjadi target penelitian dalam proyek P10 ""Effect of Operating Conditions on the Performance of an All-Vanadium Redox Flow Battery""?","Target penelitian dalam proyek P10 ""Effect of Operating Conditions on the Performance of an All-Vanadium Redox Flow Battery"" adalah untuk mengeksplorasi pengaruh kondisi operasional terhadap kinerja dari baterai aliran redoks vanadium. Penelitian ini bertujuan untuk memahami bagaimana variabel-variabel seperti suhu, arus, dan kecepatan aliran akan mempengaruhi efisiensi dan daya tahan baterai tersebut.","['plasma agriculture due to the generation of abundant\r\nreactive species being critical for manipulating reaction\r\npathways in different fields. Therefore, it is essential to\r\ncharacterize the densities of reactive species introduced\r\nby plasma jets in the liquid phase for various applications.\r\nIn this project, the densities of OH/NO2\r\n-/NO3\r\n- will be\r\nexplored by using the microplate reader\r\nspectrophotometer under different operating conditions\r\nto reveal the correlations among reactive species\r\ngenerated in the liquid phase and the discharge\r\nparameters. Anyone interested in plasma technology and\r\ncharacterization is welcome to join the project.\r\nMentor at CCU\r\nAssoc. Prof. Kun-Mo Lin\r\nDept. of, Mechanical Engineering\r\nNational Chung Cheng University, Taiwan, ROC.\r\n(e-mail: imekml@ccu.edu.tw; kmlin.tw@gmail.com)\r\nExpected student level\r\n■ Post-graduate student\r\n■ Third/forth-year undergraduate senior student\r\nCategory\r\n■ Scholarship\r\n■ Self-supported'
 'Project title\r\nRenewable Energy Integration: Power System Analyses,\r\nPower Conversion or Intelligent Control\r\nDescription of the research\r\nThe students will learn the research topics about\r\nrenewable energy integration, which includes one of the\r\nfollowing issues:\r\n➢ Wind farm modeling and control\r\n➢ Fault diagnosis for solar power systems\r\n➢ Artificial intelligence applications on renewable\r\npower systems\r\n➢ Forecasting technologies for renewable power\r\nresources\r\n➢ Smart grid control and operation\r\n➢ Energy storage systems\r\n➢ Transmission and distribution system analyses\r\nMentor at CCU\r\nProf. Yuan-Kang Wu\r\nDept. of Electrical Engineering\r\nNational Chung Cheng University, Taiwan, ROC.\r\n(e-mail: allenwu@ccu.edu.tw)\r\nExpected student level\r\n█ Post-graduate student\r\n█ Third/forth-year undergraduate senior student\r\nCategory █ Scholarship\r\nIntern period At least 12 weeks between May 1 and December 31, 2024\r\n\r\nNumber P8\r\nProject title Silicon photonics and optical biosesnors'
 'NBI) model. These models will be generated through a\r\nconversion algorithm referred to as the spectrum-aided\r\nvision enhancer (SAVE). The main goal will be to discover\r\nDysplasia and Squamous Cell Carcinoma (SCC). The\r\nevaluation of model performance will be conducted using the\r\ncreated confusion matrix and five important indicators:\r\nprecision, recall, F1-score, mAP, and the confusion matrix of\r\nthe trained model.\r\nMentor at CCU\r\nProf. Hsiang-Chen Wang\r\nDept. of Mechanical Engineering,\r\nNational Chung Cheng University, Taiwan, ROC.\r\n(e-mail: hcwang@ccu.edu.tw)\r\nExpected student level\r\n■ Post-graduate student\r\n■ Third/forth-year undergraduate senior student\r\nCategory ■ Scholarship\r\nIntern period At least 12 weeks between May and December 2024\r\n\r\nNumber P14\r\nProject title Stirling engines and their applications\r\nDescription of the\r\nresearch\r\nThe students will learn the research topics about Stirling\r\nengines and their applications in renewable energy,'
 '(e-mail: imekml@ccu.edu.tw; kmlin.tw@gmail.com)\r\nExpected student level\r\n■ Post-graduate student\r\n■ Third/forth-year undergraduate senior student\r\nCategory\r\n■ Scholarship\r\n■ Self-supported\r\nIntern period At least 8 weeks between May and December 2024\r\n\r\nNumber P12\r\nProject title\r\nNumerical modeling and Experiments of an atmospheric\r\npressure plasma jet operated in air with shielding gas\r\nDescription of the research\r\nAtmospheric-pressure plasma jets have been developed\r\nextensively for applications such as plasma medicine and\r\nplasma agriculture due to the generation of abundant\r\nreactive species being critical for manipulating reaction\r\npathways in different fields. However, it is still challenging\r\nto develop a proper plasma source with controlled\r\nparameters by experimental measurements because of\r\nfast discharge dynamics and complex plasma chemistry.\r\nAlternatively, numerical simulations can be used to\r\ncapture discharge dynamics with detailed chemistry']",Penelitian ini bertujuan untuk mempelajari efek kondisi operasi seperti konsentrasi elektrolit dan laju aliran elektrolit pada kinerja baterai aliran redoks vanadium.,0.9166666666361111,0.0,0.8952305692020343,0.0
16,"Apa tujuan dari proyek P12 ""Numerical Modeling and Experiments of an Atmospheric Pressure Plasma Jet Operated in Air with Shielding Gas""?","Tujuan dari proyek P12 ""Numerical Modeling and Experiments of an Atmospheric Pressure Plasma Jet Operated in Air with Shielding Gas"" adalah untuk mengembangkan model numerik dua dimensi yang akan diintegrasikan dengan model aliran gas dua dimensi untuk memprediksi perilaku dinamis dari plasma jet tekanan atmosfer yang dioperasikan dengan helium. Hasil simulasi akan dibandingkan dengan foto yang diambil oleh kamera CCD yang diperkuat untuk memvalidasi model tersebut. Proyek ini bertujuan untuk memahami dan mengendalikan parameter plasma dengan menggunakan simulasi numerik karena dinamika pelepasan yang cepat dan kimia plasma yang kompleks.","['(e-mail: imekml@ccu.edu.tw; kmlin.tw@gmail.com)\r\nExpected student level\r\n■ Post-graduate student\r\n■ Third/forth-year undergraduate senior student\r\nCategory\r\n■ Scholarship\r\n■ Self-supported\r\nIntern period At least 8 weeks between May and December 2024\r\n\r\nNumber P12\r\nProject title\r\nNumerical modeling and Experiments of an atmospheric\r\npressure plasma jet operated in air with shielding gas\r\nDescription of the research\r\nAtmospheric-pressure plasma jets have been developed\r\nextensively for applications such as plasma medicine and\r\nplasma agriculture due to the generation of abundant\r\nreactive species being critical for manipulating reaction\r\npathways in different fields. However, it is still challenging\r\nto develop a proper plasma source with controlled\r\nparameters by experimental measurements because of\r\nfast discharge dynamics and complex plasma chemistry.\r\nAlternatively, numerical simulations can be used to\r\ncapture discharge dynamics with detailed chemistry'
 'fast discharge dynamics and complex plasma chemistry.\r\nAlternatively, numerical simulations can be used to\r\ncapture discharge dynamics with detailed chemistry\r\nrevealed. In this project, a two-dimensional axisymmetric\r\nplasma fluid model will be integrated with a two-\r\ndimensional axisymmetric gas flow model to predict the\r\ndynamic behavior of a helium atmospheric pressure\r\nplasma jet. The simulated results will be compared with\r\nphotos taken by an intensified CCD camera to validate the\r\nmodel. It is a topic involving thermofluid science, which is\r\nsuitable for students in mechanical engineering.\r\nMentor at CCU\r\nAssoc. Prof. Kun-Mo Lin\r\nDept. of, Mechanical Engineering\r\nNational Chung Cheng University, Taiwan, ROC.\r\n(e-mail: imekml@ccu.edu.tw; kmlin.tw@gmail.com)\r\nExpected student level\r\n■ Post-graduate student\r\n■ Third/forth-year undergraduate senior student\r\nCategory\r\n■ Scholarship\r\n■ Self-supported\r\nIntern period At least 8 weeks between May and December 2024\r\n\r\nNumber P13'
 'NBI) model. These models will be generated through a\r\nconversion algorithm referred to as the spectrum-aided\r\nvision enhancer (SAVE). The main goal will be to discover\r\nDysplasia and Squamous Cell Carcinoma (SCC). The\r\nevaluation of model performance will be conducted using the\r\ncreated confusion matrix and five important indicators:\r\nprecision, recall, F1-score, mAP, and the confusion matrix of\r\nthe trained model.\r\nMentor at CCU\r\nProf. Hsiang-Chen Wang\r\nDept. of Mechanical Engineering,\r\nNational Chung Cheng University, Taiwan, ROC.\r\n(e-mail: hcwang@ccu.edu.tw)\r\nExpected student level\r\n■ Post-graduate student\r\n■ Third/forth-year undergraduate senior student\r\nCategory ■ Scholarship\r\nIntern period At least 12 weeks between May and December 2024\r\n\r\nNumber P14\r\nProject title Stirling engines and their applications\r\nDescription of the\r\nresearch\r\nThe students will learn the research topics about Stirling\r\nengines and their applications in renewable energy,'
 'plasma agriculture due to the generation of abundant\r\nreactive species being critical for manipulating reaction\r\npathways in different fields. Therefore, it is essential to\r\ncharacterize the densities of reactive species introduced\r\nby plasma jets in the liquid phase for various applications.\r\nIn this project, the densities of OH/NO2\r\n-/NO3\r\n- will be\r\nexplored by using the microplate reader\r\nspectrophotometer under different operating conditions\r\nto reveal the correlations among reactive species\r\ngenerated in the liquid phase and the discharge\r\nparameters. Anyone interested in plasma technology and\r\ncharacterization is welcome to join the project.\r\nMentor at CCU\r\nAssoc. Prof. Kun-Mo Lin\r\nDept. of, Mechanical Engineering\r\nNational Chung Cheng University, Taiwan, ROC.\r\n(e-mail: imekml@ccu.edu.tw; kmlin.tw@gmail.com)\r\nExpected student level\r\n■ Post-graduate student\r\n■ Third/forth-year undergraduate senior student\r\nCategory\r\n■ Scholarship\r\n■ Self-supported']",Tujuan proyek ini adalah menggabungkan model plasma fluida dua dimensi axisimetrik dengan model aliran gas untuk memprediksi perilaku dinamis plasma jet tekanan atmosfer menggunakan gas helium.,0.9166666666361111,0.875,0.8974137769664038,1.0
17,"Proyek P13 ""Application of Novel Snap-shot based Hyperspectral Imaging Combined with AI to Detect Lesions"" menggunakan metode apa?","Proyek P13 ""Application of Novel Snap-shot based Hyperspectral Imaging Combined with AI to Detect Lesions"" menggunakan berbagai model machine learning, termasuk YOLOv5, YOLOv8, R-CNN, dan Faster R-CNN, untuk memprediksi dan mendeteksi kanker esofagus pada tahap awal. Proyek ini juga akan menggunakan dua model gambar kanker esofagus: model gambar cahaya putih (WLI) dan model gambar hiperspektral narrowband (HSI-NBI). Model-model ini akan dihasilkan melalui algoritma konversi yang disebut sebagai spectrum-aided vision enhancer (SAVE). Tujuan utamanya adalah untuk menemukan Dysplasia dan Squamous Cell Carcinoma (SCC).","['■ Post-graduate student\r\n■ Third/forth-year undergraduate senior student\r\nCategory\r\n■ Scholarship\r\n■ Self-supported\r\nIntern period At least 8 weeks between May and December 2024\r\n\r\nNumber P13\r\nProject title\r\nApplication of Novel Snap-shot based hyperspectral imaging\r\ncombined with AI to detect Lesions\r\nDescription of the\r\nresearch\r\nThe early detection of esophageal cancer presents a\r\nconsiderable difficulty, which contributes to its high\r\nprevalence as a major cause of cancer-related fatalities. This\r\nproject will utilize various machine learning models, including\r\nYOLOv5, YOLOv8, R-CNN, and Faster R-CNN, to predict and\r\ndetect early-stage esophageal cancer. It will make use of two\r\nmodels of esophageal cancer images: the white-light images\r\n(WLI) model and the hyperspectral narrowband images (HSI-\r\nNBI) model. These models will be generated through a\r\nconversion algorithm referred to as the spectrum-aided\r\nvision enhancer (SAVE). The main goal will be to discover'
 'NBI) model. These models will be generated through a\r\nconversion algorithm referred to as the spectrum-aided\r\nvision enhancer (SAVE). The main goal will be to discover\r\nDysplasia and Squamous Cell Carcinoma (SCC). The\r\nevaluation of model performance will be conducted using the\r\ncreated confusion matrix and five important indicators:\r\nprecision, recall, F1-score, mAP, and the confusion matrix of\r\nthe trained model.\r\nMentor at CCU\r\nProf. Hsiang-Chen Wang\r\nDept. of Mechanical Engineering,\r\nNational Chung Cheng University, Taiwan, ROC.\r\n(e-mail: hcwang@ccu.edu.tw)\r\nExpected student level\r\n■ Post-graduate student\r\n■ Third/forth-year undergraduate senior student\r\nCategory ■ Scholarship\r\nIntern period At least 12 weeks between May and December 2024\r\n\r\nNumber P14\r\nProject title Stirling engines and their applications\r\nDescription of the\r\nresearch\r\nThe students will learn the research topics about Stirling\r\nengines and their applications in renewable energy,'
 ""developing algorithms for sensor data calibration, point\r\ncloud processing and image processing to create a\r\ncomprehensive and accurate representation of the\r\nvehicle's surroundings. The primary objective is to develop\r\nand optimize algorithms for efficiently processing and\r\ninterpreting the multi-modality. This includes tasks such as\r\nsemantic segmentation, feature extraction, and object\r\nrecognition, all of which are pivotal for the accurate\r\nperception of the vehicle's surroundings.\r\nMentor at CCU\r\nAssoc. Prof. Jui-Chiu Chiang\r\nDept. of Electrical Engineering,\r\nNational Chung Cheng University, Taiwan, ROC.\r\n(E-mail: rachel@ccu.edu.tw)\r\nExpected student level █ Third/forth-year undergraduate senior student\r\nCategory\r\n█ Scholarship\r\n█ Self-supported\r\nIntern period At least 12 weeks between May 1st and Dec. 31th\r\n\r\nNumber P4\r\nProject title\r\nSimulation and Reconstruction of Pencil Beam Scanning of\r\nParticle Therapy\r\nDescription of the research""
 'techniques. In this research, you will learn deep learning\r\ntechniques such as CNN, RNN, LSTM, AE, VAE, etc. The\r\npossible applications and topics include: (1) 3D human\r\nskeleton extraction, (2) skeleton-based action\r\nrecognition/behavior modeling, (3) action prediction for\r\nelderly monitoring, (4) 3D object (vehicle, pedestrian,\r\ncyclist) detection and positioning from fusion of RGB/LiDAR\r\nsensor data, (5) object (head/vehicle/ human/object) pose\r\nestimation from single RGB image, (6) deep learning-based\r\nadverse drug reaction (ADR) prediction for clinic medicine\r\nuse, (7) AI-generated content (AIGC), such as\r\n(text/audio/image) -to-(image/video), (8) elderly caring\r\napplication of AIGC, (9) heart rate estimation from facial\r\nimage sequence. The intern student is expected to have\r\nsome preliminary knowledge on NN (neural network) or\r\ndeep learning and skilled in Python programming. He/She\r\nwill learn how to apply state-of-the-art deep learning']","Proyek ini menggunakan model pembelajaran mesin seperti YOLOv5, YOLOv8, R-CNN, dan Faster R-CNN untuk mendeteksi kanker esofagus stadium awal menggunakan model gambar cahaya putih (WLI) dan gambar narrowband hiperspektral (HSI-NBI).",0.999999999975,1.0,0.8093457927441845,1.0
18,"Apa yang akan dikembangkan dalam proyek P16 ""Next Generation Wireless Communication, B5G/6G, Reconfigurable Intelligent Surface, System Level Simulation, Artificial Intelligence-enhanced Wireless Research""? ","Proyek P16 ""Next Generation Wireless Communication, B5G/6G, Reconfigurable Intelligent Surface, System Level Simulation, Artificial Intelligence-enhanced Wireless Research"" akan mengembangkan konsep dan arsitektur terdepan di luar 5G (B5G) dan 6G. Proyek ini juga akan mengidentifikasi dan memvalidasi solusi untuk masalah kunci melalui simulasi atau eksperimen prototipe. Selain itu, proyek ini akan melakukan penelitian tentang teknik kecerdasan buatan dan pembelajaran mesin yang diterapkan pada komunikasi nirkabel dan jaringan. Selain itu, proyek ini akan merancang dan menerapkan algoritma, model, dan protokol baru untuk mengoptimalkan kinerja jaringan nirkabel. Kolaborasi dengan tim penelitian juga akan dilakukan untuk mengelola proyek dan memastikan pengiriman tepat waktu.","['Category\r\n■ Scholarship\r\n■ Self-supported\r\nIntern period At least 8 weeks between 2024/5/1- 2024/12/31\r\n\r\nNumber P16\r\nProject title\r\nNext generation Wireless communication, B5G/6G,\r\nReconfigurable Intelligent Surface, System level\r\nsimulation, Artificial Intelligence-enhanced wireless\r\nresearch\r\nDescription of the\r\nresearch\r\nInnovate and design cutting-edge concepts and\r\narchitectures beyond 5G (B5G) and 6G.\r\nIdentify and validate solutions to key problems through\r\nsimulation or prototype experiments.\r\nConduct research on AI and machine learning\r\ntechniques applied to wireless communications and\r\nnetworks.\r\nDesign and implement novel algorithms, models, and\r\nprotocols to optimize wireless network performance.\r\nCollaborate with the research team to manage projects\r\nand ensure timely deliverables,\r\nPlease refer to the website of our lab at\r\nhttps://sites.google.com/view/ccuantlab/english\r\nMentor at CCU\r\nAssoc. Prof. Jen-Yi Pan\r\nDept. of Communications Engineering,'
 'Dipublikasikan tanggal 11 Januari 2024\nNo Bidang Study Program University\n51 Material Sciences\nGraduate Programme Innovative Materials and\nEnergy Systems (Emat) - Master\nNantes Université\n52 Urban Planning Economics for Smart Cities and Climate Policy Institut Polytechnique de Paris\nPoin-Poin Surat Pernyataan pada Aplikasi Pendaftaran (Disetujui Saat Akan Melakukan Submit)\n1. Setia kepada Pancasila, Negara Kesatuan Republik Indonesia, dan UUD 1945.\n2. Tidak pernah, sedang, atau akan mendukung atau terlibat dalam gerakan, organisasi, atau ideologi\nyang bertentangan dan/atau berpotensi mengganggu tegaknya ideologi Pancasila, Undang-\nUndang Dasar 1945, dan Negara Kesatuan Republik Indonesia.\n3. Mendahulukan kepentingan Bangsa dan Negara Kesatuan Republik Indonesia di atas kepentingan\npribadi.\n4. Tidak akan berpindah kewarganegaraan sejak pendaftaran beasiswa sampai dengan selesainya\nmasa kontribusi sebagai alumni beasiswa LPDP.'
 'NBI) model. These models will be generated through a\r\nconversion algorithm referred to as the spectrum-aided\r\nvision enhancer (SAVE). The main goal will be to discover\r\nDysplasia and Squamous Cell Carcinoma (SCC). The\r\nevaluation of model performance will be conducted using the\r\ncreated confusion matrix and five important indicators:\r\nprecision, recall, F1-score, mAP, and the confusion matrix of\r\nthe trained model.\r\nMentor at CCU\r\nProf. Hsiang-Chen Wang\r\nDept. of Mechanical Engineering,\r\nNational Chung Cheng University, Taiwan, ROC.\r\n(e-mail: hcwang@ccu.edu.tw)\r\nExpected student level\r\n■ Post-graduate student\r\n■ Third/forth-year undergraduate senior student\r\nCategory ■ Scholarship\r\nIntern period At least 12 weeks between May and December 2024\r\n\r\nNumber P14\r\nProject title Stirling engines and their applications\r\nDescription of the\r\nresearch\r\nThe students will learn the research topics about Stirling\r\nengines and their applications in renewable energy,'
 'Dipublikasikan tanggal 11 Januari 2024\nprogram beasiswa lain yang dipilih, sesuai\ndengan syarat dan ketentuan yang berlaku.\nApa saja komponen Dana yang diberikan?\n1. Dana Pendidikan\na. Tuition Fee\nb. Dana Pendaftaran\nc. Dana Tunjangan Buku\nd. Dana Penelitian Tesis\ne. Dana Seminar Internasional\nf. Dana Publikasi Jurnal Internasional\n2. Dana Pendukung\na. Dana Transportasi\nb. Dana Aplikasi Visa\nc. Dana Asuransi Kesehatan\nd. Dana Kedatangan\ne. Dana Hidup Bulanan\nf. Dana Lomba Internasional\ng. Dana keadaaan darurat (jika diperlukan)\nApa saja persyaratan umum pendaftaran\nBeasiswa Prioritas LPDP – Campus\nFrance Program Master?\nPersyaratan umum Beasiswa Prioritas LPDP –\nCampus France Program Master adalah sebagai\nberikut:\n1. Warga Negara Indonesia.\n2. Telah menyelesaikan studi program diploma\nempat (D4) atau sarjana (S1).\n3. Pendaftar yang telah menyelesaikan studi\nmagister (S2) tidak diizinkan mendaftar.\n4. Bagi pendaftar lulusan perguruan tinggi luar']","Proyek ini berfokus pada inovasi dan desain konsep-konsep canggih dan arsitektur di luar 5G dan 6G, mengidentifikasi dan memvalidasi solusi untuk masalah kunci melalui simulasi atau eksperimen prototipe, serta merancang algoritma, model, dan protokol baru untuk mengoptimalkan kinerja jaringan nirkabel.",0.9166666666361111,1.0,0.9049975563527258,1.0
19,Bagaimana cara menghubungi penyelenggara program internship ini?,Anda dapat menghubungi penyelenggara program internship ini melalui email di coleng_dia@ccu.edu.tw atau melalui nomor telepon +886-5-2720411 ext. 23003 atau 23005. Informasi lebih lanjut juga dapat ditemukan di website https://sites.google.com/view/ccu-coe-internship/home.,"['application form, prepare\r\napplication materials, and send\r\nthem in a ZIP-compressed file to\r\ncoleng_dia@ccu.edu.tw.\r\n• The title of the e-mail please be\r\nmarked with “Application for 2024\r\nCCU/COE International Internship”.\r\nAll the intern research topics and\r\ntheir requirements are listed as\r\nfollows.\r\n• Application deadline: Mar. 3, 2024\r\n• More detailed information about\r\napplication can be found on the\r\nwebsite\r\nhttps://sites.google.com/view/ccu-\r\ncoe-internship/home\r\nCONTACT\r\n+886-5-2720411 ext. 23003, 23005\r\ncoleng_dia@ccu.edu.tw\r\nNo.168, Sec. 1, University Rd., Minhsiung,\r\nChiayi 621301, Taiwan (R.O.C.)\r\n\r\nINTERN RESEARCH TOPICS\r\nNumber P1\r\nProject title\r\nTrustable Artificial Intelligence for Critical Applications and\r\n6G Security\r\nDescription of the research\r\nArtificial Intelligence (AI) technologies, 6G networking,\r\nand quantum computing are the leading forces in\r\nbringing the world to an era of better intelligence and full'
 'melampirkan surat usulan atau surat\nrekomendasi sekurang-kurangnya dari\npejabat setingkat eselon II yang membidangi\npembinaan/pengembangan SDM pada\nKementerian/Lembaga atau Pemerintah\nDaerah tempat pendaftar bekerja dengan\nketentuan;\na. mengusulkan atau merekomendasikan\npendaftar untuk mengikuti program\nBeasiswa LPDP; dan\nb. mencantumkan Nama Lengkap serta\nNomor Induk Pegawai (NIP) pendaftar.\n9. Bagi pendaftar yang merupakan PNS dengan\nstatus PNS dengan jabatan fungsional\nsebagai Peneliti/Perekayasa/Medis/\nParamedis/ Pendidik, mengunggah Surat\nKeputusan (SK) Jabatan Terakhir atau SK\nKenaikan Pangkat Terakhir atau sejenisnya\nyang menunjukkan bahwa pendaftar adalah\nPNS dengan jabatan fungsional sebagai\nPeneliti/Perekayasa/Medis/Paramedis/Pendi\ndik.\n10. Bagi pendaftar berstatus prajurit TNI di semua\nprogram beasiswa LPDP wajib melampirkan\nsurat usulan atau surat rekomendasi\nsekurang-kurangnya pejabat yang\nmembidangi pembinaan SDM pada Mabes\nTNI/ TNI AD/ TNI AL/ TNI AU untuk mengikuti'
 'KEMENTERIAN PENDIDIKAN, KEBUDAYAAN,\nRISET, DAN TEKNOLOGI\nINSTITUT TEKNOLOGI SEPULUH NOPEMBER\nDIREKTORAT KEMITRAAN GLOBAL\nGedung Global Kampong Kampus ITS Sukolilo - Surabaya 60111 Indonesia\n(0) Telepon: 031 5923411 (Hunting): 031 5994251-54 ext.1224\nFax: 031 5923411\nhttps://www.its.ac.id/, https://www.its.ac.id/international/ email: international(ajits.ac.id\nNomor : 7518/IT2MVIII/T/TU.00.08/2023\n\nLampiran :2 (dua) lembar\nPerihal : Pemberitahuan Informasi Persyaratan Eksposur Internasional\nKepada Yth.\nKepala Departemen dan Ketua Program Studi\ndi lingkungan ITS\nDengan hormat,\nsehubungan dengan surat kami dengan nomor 7311/!T2.VINI/T/TU.00.08/2023 perihal Pemberitahuan Informasi Persyaratan\nEksposur Internasional, bersama dengan ini memberikan informasi lebih lanjut tentang persyaratan yang harus dipenuhi oleh\nseluruh mahasiswa ITS dalam rangka pelaksanaan kegiatan eksposur internasional. Persyaratan tersebut adalah sebagai berikut:'
 'with the format written on the program web\n• After that, ITS GE will reply back to you email regarding further step to join the program\nwww.its.ac.id INSTITUT TEKNOLOGI SEPULUH NOPEMBER, Surabaya - Indonesia\n- Thank You-\nwww.its.ac.id its_campus institut teknologu sepuluh nopember']","Kontak dapat dilakukan melalui nomor +886-5-2720411 ext. 23003, 23005, atau email coleng_dia@ccu.edu.tw. Alamatnya adalah No.168, Sec. 1, University Rd., Minhsiung, Chiayi 621301, Taiwan (R.O.C.).",0.9999999999,1.0,1.0000000000000002,1.0
