,question,ground_truth,contexts,answer
0,Apa tujuan dari Program Internship Internasional CCU/CoE 2024? ,"Tujuannya adalah untuk memberikan kesempatan bagi mahasiswa internasional untuk memahami lebih baik penelitian di bidang teknik dan teknologi di CCU, serta untuk mempraktikkan keterampilan mereka, memperoleh kompetensi baru, dan mengalami budaya yang berbeda.","['2024 CCU/CoE\r\nINTERNATIONAL INTERNSHIP PROGRAM\r\nCOLLEGE OF ENGINEERING (CoE)\r\nNATIONAL CHUNG CHENG UNIVERSITY\r\n\r\nContinuing the yearly internship program in engineering field, the College\r\nof Engineering (CoE) offers on-campus research internships for\r\ninternational university students in 2024.\r\nThis project-based program provides an opportunity to better understand\r\nCCU’s research in engineering and technology. Students may practice their\r\nskills in the projects, acquire new competence, and experience a different\r\nculture.\r\nIn Engineering Field\r\n2024 CCU/COE INTERNATIONAL\r\nINTERNSHIP PROGRAM\r\nINTERNPERIOD\r\nSCHOLARSHIP\r\nPROGRAM\r\nBENIFITS\r\nTo have an enjoyable and enriching\r\nexperience in academic study and exchange\r\ntheir ideas of research with CCU students.\r\nMay 1 –December 31, 2024\r\nAt least 8 weeks. Individual mentors may have a\r\ndifferent definition of intern period. For self-\r\nsupported interns, the period may not be limited\r\nas mentioned above. Please refer to each', 'application form, prepare\r\napplication materials, and send\r\nthem in a ZIP-compressed file to\r\ncoleng_dia@ccu.edu.tw.\r\n• The title of the e-mail please be\r\nmarked with “Application for 2024\r\nCCU/COE International Internship”.\r\nAll the intern research topics and\r\ntheir requirements are listed as\r\nfollows.\r\n• Application deadline: Mar. 3, 2024\r\n• More detailed information about\r\napplication can be found on the\r\nwebsite\r\nhttps://sites.google.com/view/ccu-\r\ncoe-internship/home\r\nCONTACT\r\n+886-5-2720411 ext. 23003, 23005\r\ncoleng_dia@ccu.edu.tw\r\nNo.168, Sec. 1, University Rd., Minhsiung,\r\nChiayi 621301, Taiwan (R.O.C.)\r\n\r\nINTERN RESEARCH TOPICS\r\nNumber P1\r\nProject title\r\nTrustable Artificial Intelligence for Critical Applications and\r\n6G Security\r\nDescription of the research\r\nArtificial Intelligence (AI) technologies, 6G networking,\r\nand quantum computing are the leading forces in\r\nbringing the world to an era of better intelligence and full', 'Dipublikasikan tanggal 11 Januari 2024\nprogram beasiswa lain yang dipilih, sesuai\ndengan syarat dan ketentuan yang berlaku.\nApa saja komponen Dana yang diberikan?\n1. Dana Pendidikan\na. Tuition Fee\nb. Dana Pendaftaran\nc. Dana Tunjangan Buku\nd. Dana Penelitian Tesis\ne. Dana Seminar Internasional\nf. Dana Publikasi Jurnal Internasional\n2. Dana Pendukung\na. Dana Transportasi\nb. Dana Aplikasi Visa\nc. Dana Asuransi Kesehatan\nd. Dana Kedatangan\ne. Dana Hidup Bulanan\nf. Dana Lomba Internasional\ng. Dana keadaaan darurat (jika diperlukan)\nApa saja persyaratan umum pendaftaran\nBeasiswa Prioritas LPDP – Campus\nFrance Program Master?\nPersyaratan umum Beasiswa Prioritas LPDP –\nCampus France Program Master adalah sebagai\nberikut:\n1. Warga Negara Indonesia.\n2. Telah menyelesaikan studi program diploma\nempat (D4) atau sarjana (S1).\n3. Pendaftar yang telah menyelesaikan studi\nmagister (S2) tidak diizinkan mendaftar.\n4. Bagi pendaftar lulusan perguruan tinggi luar', '1. Setiap mahasiswa ITS yang ingin mendaftar program internasional di perguruan tinggi mitra ITS luar negeri yang\nmembutuhkan surat rekomendasi atau dana dukungan dari ITS di antaranya IISMA/IISMA-Vo, pertukaran pelajar (exchange),\nlab-internship, short program, atau program lain di luar negeri, diharuskan memiliki sertifikat Global Competency\nWorkshop (GCW) atau Global Competency Academy (GCA). Sertifikat ini hanya bisa diperoleh dengan mengikuti program\nGCW atau GCA.']","Tujuan dari Program Internship Internasional CCU/CoE 2024 adalah untuk memberikan kesempatan kepada mahasiswa universitas internasional untuk memahami penelitian CCU dalam bidang teknik dan teknologi, serta untuk berlatih keterampilan dalam proyek-proyek, memperoleh kompetensi baru, dan merasakan budaya yang berbeda."
1,Kapan periode magang berlangsung?,"Periode magang berlangsung antara 1 Mei hingga 31 Desember 2024, minimal 8 minggu.","['dan Seleksi Substansi\n18 – 27 Maret\n2024\nShort Listed untuk\nKampus Tujuan\n3 April 2024\nLoA Unconditional dari\nKampus Tujuan\n27 Mei 2024\nPengumuman Hasil\nSeleksi Substansi\n10 Juni 2024\nMulai Perkuliahan Paling\nCepat\nJuli 2024\nCatatan:\nPendaftar diharuskan melakukan pendaftaran\npada:\na. universitas sesuai jadwal dan ketentuan yang\nberlaku di Perguruan Tinggi; dan\nb. Campus France sesuai jadwal dan ketentuan\nyang berlaku di Campus France.\nBagi pendaftar yang mendaftar dengan LoA\nUnconditional yang sesuai dengan ketentuan\nLPDP pada beasiswa lain yang dipilih (beasiswa\nafirmasi, targeted, atau umum) dapat melanjutkan\nke tahap Seleksi Substansi tanpa mengikuti\nSeleksi Bakat Skolastik.\nApa saja Pelanggaran dan Sanksi yang\ndiberlakukan oleh LPDP?\n1. Pendaftar yang melakukan kecurangan\nselama tahapan pendaftaran dan/atau seleksi\nbeasiswa dikategorikan sebagai pelanggaran\nketentuan dan persyaratan seleksi.\n2. Pendaftar yang melanggar ketentuan dan\npersyaratan seleksi akan digugurkan dan', '■ Post-graduate student\r\n■ Third/forth-year undergraduate senior student\r\nCategory\r\n■ Scholarship\r\n■ Self-supported\r\nIntern period At least 8 weeks between May and December 2024\r\n\r\nNumber P13\r\nProject title\r\nApplication of Novel Snap-shot based hyperspectral imaging\r\ncombined with AI to detect Lesions\r\nDescription of the\r\nresearch\r\nThe early detection of esophageal cancer presents a\r\nconsiderable difficulty, which contributes to its high\r\nprevalence as a major cause of cancer-related fatalities. This\r\nproject will utilize various machine learning models, including\r\nYOLOv5, YOLOv8, R-CNN, and Faster R-CNN, to predict and\r\ndetect early-stage esophageal cancer. It will make use of two\r\nmodels of esophageal cancer images: the white-light images\r\n(WLI) model and the hyperspectral narrowband images (HSI-\r\nNBI) model. These models will be generated through a\r\nconversion algorithm referred to as the spectrum-aided\r\nvision enhancer (SAVE). The main goal will be to discover', 'Category\r\n■ Scholarship\r\n■ Self-supported\r\nIntern period At least 8 weeks between 2024/5/1- 2024/12/31\r\n\r\nNumber P16\r\nProject title\r\nNext generation Wireless communication, B5G/6G,\r\nReconfigurable Intelligent Surface, System level\r\nsimulation, Artificial Intelligence-enhanced wireless\r\nresearch\r\nDescription of the\r\nresearch\r\nInnovate and design cutting-edge concepts and\r\narchitectures beyond 5G (B5G) and 6G.\r\nIdentify and validate solutions to key problems through\r\nsimulation or prototype experiments.\r\nConduct research on AI and machine learning\r\ntechniques applied to wireless communications and\r\nnetworks.\r\nDesign and implement novel algorithms, models, and\r\nprotocols to optimize wireless network performance.\r\nCollaborate with the research team to manage projects\r\nand ensure timely deliverables,\r\nPlease refer to the website of our lab at\r\nhttps://sites.google.com/view/ccuantlab/english\r\nMentor at CCU\r\nAssoc. Prof. Jen-Yi Pan\r\nDept. of Communications Engineering,', '5. Dengan memperhatikan poin 1, DKG menginformasikan bahwa Test GCW Non-Degree yang sebelumnya diselenggarakan\nsetiap bulan tidak akan lagi diselenggarakan, kecuali dalam kondisi yang sangat khusus, dengan mempertimbangkan surat\npermohonan oleh mahasiswa yang diketahui oleh Kepala Departemen. Pelaksanaan Test GCW Non Degree akan diputuskan\noleh Direktur Kemitraan Global.\nBersama ini kami juga melampirkan poster informasi penyelenggaraan Global Competency Academy yang pendaftarannya dibuka\nsampai dengan 17 September 2023. Kami mohon bantuan dari Bapak/Ibu Kepala Departemen dan Ketua Program Studi untuk\nmenyebarkan informasi ini kepada mahasiswa di departemen masing-masing.\nUntuk pertanyaan lebih lanjut, kiranya dapat disampaikan melalui email studyabroad@its.ac.id , LINE Official @yao2114f , atau\nmelalui Instagram @itsinternationaloffice.\nDemikian surat ini kami sampaikan. Atas perhatian dan kerjasamanya kami sampaikan terima kasih.\n\nSurabaya, 13 September 2023']",Periode magang berlangsung setidaknya selama 8 minggu antara bulan Mei dan Desember 2024.
2,Apa saja jenis beasiswa yang ditawarkan dalam program ini?,Program menawarkan dua jenis beasiswa: (A) Beasiswa dan (B) magang dengan biaya sendiri (self-supported).,"['Dipublikasikan tanggal 11 Januari 2024\nprogram beasiswa lain yang dipilih, sesuai\ndengan syarat dan ketentuan yang berlaku.\nApa saja komponen Dana yang diberikan?\n1. Dana Pendidikan\na. Tuition Fee\nb. Dana Pendaftaran\nc. Dana Tunjangan Buku\nd. Dana Penelitian Tesis\ne. Dana Seminar Internasional\nf. Dana Publikasi Jurnal Internasional\n2. Dana Pendukung\na. Dana Transportasi\nb. Dana Aplikasi Visa\nc. Dana Asuransi Kesehatan\nd. Dana Kedatangan\ne. Dana Hidup Bulanan\nf. Dana Lomba Internasional\ng. Dana keadaaan darurat (jika diperlukan)\nApa saja persyaratan umum pendaftaran\nBeasiswa Prioritas LPDP – Campus\nFrance Program Master?\nPersyaratan umum Beasiswa Prioritas LPDP –\nCampus France Program Master adalah sebagai\nberikut:\n1. Warga Negara Indonesia.\n2. Telah menyelesaikan studi program diploma\nempat (D4) atau sarjana (S1).\n3. Pendaftar yang telah menyelesaikan studi\nmagister (S2) tidak diizinkan mendaftar.\n4. Bagi pendaftar lulusan perguruan tinggi luar', 'Program Master memberikan kesempatan bagi\npendaftar untuk dapat melakukan pendaftaran\npada Beasiswa Kemitraan LPDP – Campus\nFrance dan beasiswa Magister Luar Negeri\npada salah satu program:\n1. Beasiswa Afirmasi\na. Beasiswa Daerah Afirmasi\nb. Beasiswa Putra Putri Papua\nc. Beasiswa Penyandang Disabilitas\nd. Beasiswa Prasejahtera\n2. Beasiswa Targeted\na. Beasiswa PNS, TNI, POLRI\nb. Beasiswa Kewirausahaan\nc. Beasiswa Umum\na. Beasiswa Reguler\nb. Beasiswa Parsial\nBeasiswa Kemitraan LPDP - Campus France\nmerupakan beasiswa kerja sama antara LPDP dan\nPemerintah Perancis pada jenjang master untuk\nbidang prioritas pembangunan Indonesia sesuai\ndengan keahlian pengetahuan yang dimiliki oleh\nUniversitas di Perancis dalam rangka\nmenghasilkan pemimpin masa depan Indonesia\nyang kompeten di bidang tersebut.\nSiapakah Sasaran Beasiswa Prioritas\nLPDP – Campus France Program Master?\n1. Warga Negara Indonesia (WNI)\n2. PNS/TNI/POLRI\nSeperti Apa Skema Prioritas LPDP –\nCampus France Program Master?', 'Panduan Pendaftaran\nBeasiswa Prioritas\nLPDP - Campus France\nProgram Master\nTahun 2024\nlpdp.kemenkeu.go.id', 'kejuaraan/non kejuaraan, dan pengalaman\norganisasi pada aplikasi pendaftaran.\nApa saja persyaratan khusus pendaftaran\nBeasiswa Prioritas LPDP – Campus France\nProgram Master?\nPersyaratan khusus Beasiswa Kemitraan LPDP –\nCampus France Program Master adalah sebagai\nberikut:']","Jenis beasiswa yang ditawarkan dalam program ini adalah:
1. Beasiswa Afirmasi
   a. Beasiswa Daerah Afirmasi
   b. Beasiswa Putra Putri Papua
   c. Beasiswa Penyandang Disabilitas
   d. Beasiswa Prasejahtera
2. Beasiswa Targeted
   a. Beasiswa PNS, TNI, POLRI
   b. Beasiswa Kewirausahaan
   c. Beasiswa Umum
      - Beasiswa Reguler
      - Beasiswa Parsial

Itulah jenis-jenis beasiswa yang tersedia dalam program Beasiswa Prioritas LPDP - Campus France."
3,Apa saja manfaat dari Beasiswa Tipe-A? ,"Beasiswa Tipe-A mencakup akomodasi di kampus, tunjangan mingguan sebesar NTD 1,500, dan penggantian biaya tiket pesawat (maksimal NTD 10,000).","['Program Master memberikan kesempatan bagi\npendaftar untuk dapat melakukan pendaftaran\npada Beasiswa Kemitraan LPDP – Campus\nFrance dan beasiswa Magister Luar Negeri\npada salah satu program:\n1. Beasiswa Afirmasi\na. Beasiswa Daerah Afirmasi\nb. Beasiswa Putra Putri Papua\nc. Beasiswa Penyandang Disabilitas\nd. Beasiswa Prasejahtera\n2. Beasiswa Targeted\na. Beasiswa PNS, TNI, POLRI\nb. Beasiswa Kewirausahaan\nc. Beasiswa Umum\na. Beasiswa Reguler\nb. Beasiswa Parsial\nBeasiswa Kemitraan LPDP - Campus France\nmerupakan beasiswa kerja sama antara LPDP dan\nPemerintah Perancis pada jenjang master untuk\nbidang prioritas pembangunan Indonesia sesuai\ndengan keahlian pengetahuan yang dimiliki oleh\nUniversitas di Perancis dalam rangka\nmenghasilkan pemimpin masa depan Indonesia\nyang kompeten di bidang tersebut.\nSiapakah Sasaran Beasiswa Prioritas\nLPDP – Campus France Program Master?\n1. Warga Negara Indonesia (WNI)\n2. PNS/TNI/POLRI\nSeperti Apa Skema Prioritas LPDP –\nCampus France Program Master?', 'Dipublikasikan tanggal 11 Januari 2024\nprogram beasiswa lain yang dipilih, sesuai\ndengan syarat dan ketentuan yang berlaku.\nApa saja komponen Dana yang diberikan?\n1. Dana Pendidikan\na. Tuition Fee\nb. Dana Pendaftaran\nc. Dana Tunjangan Buku\nd. Dana Penelitian Tesis\ne. Dana Seminar Internasional\nf. Dana Publikasi Jurnal Internasional\n2. Dana Pendukung\na. Dana Transportasi\nb. Dana Aplikasi Visa\nc. Dana Asuransi Kesehatan\nd. Dana Kedatangan\ne. Dana Hidup Bulanan\nf. Dana Lomba Internasional\ng. Dana keadaaan darurat (jika diperlukan)\nApa saja persyaratan umum pendaftaran\nBeasiswa Prioritas LPDP – Campus\nFrance Program Master?\nPersyaratan umum Beasiswa Prioritas LPDP –\nCampus France Program Master adalah sebagai\nberikut:\n1. Warga Negara Indonesia.\n2. Telah menyelesaikan studi program diploma\nempat (D4) atau sarjana (S1).\n3. Pendaftar yang telah menyelesaikan studi\nmagister (S2) tidak diizinkan mendaftar.\n4. Bagi pendaftar lulusan perguruan tinggi luar', 'jenjang sebelumnya; dan/atau\nd. Persyaratan tambahan lain yang tidak\nberisiko mengubah status diterimanya\norang tersebut sebagai mahasiswa pada\nprogram studi yang dituju.\n4. Pendaftar Beasiswa LPDP yang melampirkan\nLoA dengan waktu mulai studi yang tidak\nsesuai dengan ketentuan LPDP wajib\nmelampirkan surat keterangan penundaan\njadwal perkuliahan program studi dari\nPerguruan Tinggi yang diunggah bersamaan\ndengan LoA.\n5. Bagi pendaftar Beasiswa LPDP dengan\nskema double degree/joint degree dapat\nmelampirkan LoA dari Perguruan Tinggi Luar\nNegeri dan/atau Perguruan Tinggi Dalam\nNegeri yang menyatakan program double\ndegree/joint degree.\n6. Jika pendaftar mengunggah LoA\nUnconditional yang tidak sesuai ketentuan\nLPDP, maka dianggap tidak memenuhi\nkriteria pendaftaran.\nBagaimana Cara Mendaftar Beasiswa\nLPDP?\n1. Mendaftar secara online pada situs\nPendaftaran Beasiswa LPDP:\nhttps://beasiswalpdp.kemenkeu.go.id/', 'beasiswa dengan kewajiban pengembalian\ndana studi yang telah diterima dan\npemblokiran untuk mengikuti program LPDP\ndi masa mendatang.\nBagaimana dengan ketentuan\nPengabdian yang ditetapkan LPDP?\n1. Penerima Beasiswa wajib kembali dan\nmengabdi di Indonesia setelah selesai studi\nsesuai dengan ketentuan LPDP.\n2. Kembali ke Indonesia dan berkontribusi di\nIndonesia selama 2 kali masa studi ditambah']","Beasiswa Tipe-A memiliki beberapa manfaat, antara lain:
1. Beasiswa Daerah Afirmasi
2. Beasiswa Putra Putri Papua
3. Beasiswa Penyandang Disabilitas
4. Beasiswa Prasejahtera

Manfaat dari beasiswa ini adalah memberikan kesempatan kepada penerima beasiswa untuk melanjutkan pendidikan di jenjang master di luar negeri, khususnya di Perancis, sesuai dengan bidang prioritas pembangunan Indonesia. Selain itu, beasiswa ini juga bertujuan untuk menghasilkan pemimpin masa depan Indonesia yang kompeten di bidang tersebut."
4,Siapa yang memenuhi syarat untuk mendaftar program ini?,Program ini terbuka untuk mahasiswa pascasarjana (S2/S3) dan mahasiswa tahun ketiga atau lebih tinggi. Mahasiswa yang sudah menyelesaikan gelar PhD tidak memenuhi syarat.,"['2. Look at the requirement of the program\nPreparing required document\n• Each program have different document\nrequirement listed on the web. Please\ncheck each of the requirement inside the\nrespected website link of the program for\ndetails\nwww.its.ac.id INSTITUT TEKNOLOGI SEPULUH NOPEMBER, Surabaya - Indonesia\n2a. Preparing Learning Agreement & Statement Letter\nFill Out Learning\nAgreement / Statement\nLetter\n• In case the description of the\nprogram required you to submit a\nLearning Agreement or Statement\nLetter file, please download the file\nform the web & fill it with your\ninformation first\nhttp://bit.ly/its-student-exchange\nhttps://intip.in/ResourceAkademikDanKemahasiswaanTIF\nwww.its.ac.id INSTITUT TEKNOLOGI SEPULUH NOPEMBER, Surabaya - Indonesia\n2b. Selecting Course to be Transferred\n• In case the description of the program required you to submit a Learning Agreement,\nplease check the Host University Syllabus & Informatics Syllabus to compare if the', 'melampirkan surat usulan atau surat\nrekomendasi sekurang-kurangnya dari\npejabat setingkat eselon II yang membidangi\npembinaan/pengembangan SDM pada\nKementerian/Lembaga atau Pemerintah\nDaerah tempat pendaftar bekerja dengan\nketentuan;\na. mengusulkan atau merekomendasikan\npendaftar untuk mengikuti program\nBeasiswa LPDP; dan\nb. mencantumkan Nama Lengkap serta\nNomor Induk Pegawai (NIP) pendaftar.\n9. Bagi pendaftar yang merupakan PNS dengan\nstatus PNS dengan jabatan fungsional\nsebagai Peneliti/Perekayasa/Medis/\nParamedis/ Pendidik, mengunggah Surat\nKeputusan (SK) Jabatan Terakhir atau SK\nKenaikan Pangkat Terakhir atau sejenisnya\nyang menunjukkan bahwa pendaftar adalah\nPNS dengan jabatan fungsional sebagai\nPeneliti/Perekayasa/Medis/Paramedis/Pendi\ndik.\n10. Bagi pendaftar berstatus prajurit TNI di semua\nprogram beasiswa LPDP wajib melampirkan\nsurat usulan atau surat rekomendasi\nsekurang-kurangnya pejabat yang\nmembidangi pembinaan SDM pada Mabes\nTNI/ TNI AD/ TNI AL/ TNI AU untuk mengikuti', 'with the format written on the program web\n• After that, ITS GE will reply back to you email regarding further step to join the program\nwww.its.ac.id INSTITUT TEKNOLOGI SEPULUH NOPEMBER, Surabaya - Indonesia\n- Thank You-\nwww.its.ac.id its_campus institut teknologu sepuluh nopember', '1. Setiap mahasiswa ITS yang ingin mendaftar program internasional di perguruan tinggi mitra ITS luar negeri yang\nmembutuhkan surat rekomendasi atau dana dukungan dari ITS di antaranya IISMA/IISMA-Vo, pertukaran pelajar (exchange),\nlab-internship, short program, atau program lain di luar negeri, diharuskan memiliki sertifikat Global Competency\nWorkshop (GCW) atau Global Competency Academy (GCA). Sertifikat ini hanya bisa diperoleh dengan mengikuti program\nGCW atau GCA.']","Untuk mendaftar program ini, mahasiswa ITS yang ingin mendaftar program internasional di perguruan tinggi mitra ITS luar negeri yang membutuhkan surat rekomendasi atau dana dukungan dari ITS di antaranya IISMA/IISMA-Vo, pertukaran pelajar (exchange), lab-internship, short program, atau program lain di luar negeri, diharuskan memiliki sertifikat Global Competency Workshop (GCW) atau Global Competency Academy (GCA). Sertifikat ini hanya bisa diperoleh dengan mengikuti program GCW atau GCA."
5,Apa persyaratan dokumen yang harus disiapkan untuk pendaftaran?,"Dokumen yang diperlukan meliputi: formulir aplikasi online, CV, transkrip resmi, surat rekomendasi, sertifikat kemampuan bahasa, rencana penelitian, salinan paspor, foto head-shot, dan dokumen tambahan opsional.","['melampirkan surat usulan atau surat\nrekomendasi sekurang-kurangnya dari\npejabat setingkat eselon II yang membidangi\npembinaan/pengembangan SDM pada\nKementerian/Lembaga atau Pemerintah\nDaerah tempat pendaftar bekerja dengan\nketentuan;\na. mengusulkan atau merekomendasikan\npendaftar untuk mengikuti program\nBeasiswa LPDP; dan\nb. mencantumkan Nama Lengkap serta\nNomor Induk Pegawai (NIP) pendaftar.\n9. Bagi pendaftar yang merupakan PNS dengan\nstatus PNS dengan jabatan fungsional\nsebagai Peneliti/Perekayasa/Medis/\nParamedis/ Pendidik, mengunggah Surat\nKeputusan (SK) Jabatan Terakhir atau SK\nKenaikan Pangkat Terakhir atau sejenisnya\nyang menunjukkan bahwa pendaftar adalah\nPNS dengan jabatan fungsional sebagai\nPeneliti/Perekayasa/Medis/Paramedis/Pendi\ndik.\n10. Bagi pendaftar berstatus prajurit TNI di semua\nprogram beasiswa LPDP wajib melampirkan\nsurat usulan atau surat rekomendasi\nsekurang-kurangnya pejabat yang\nmembidangi pembinaan SDM pada Mabes\nTNI/ TNI AD/ TNI AL/ TNI AU untuk mengikuti', '2. Look at the requirement of the program\nPreparing required document\n• Each program have different document\nrequirement listed on the web. Please\ncheck each of the requirement inside the\nrespected website link of the program for\ndetails\nwww.its.ac.id INSTITUT TEKNOLOGI SEPULUH NOPEMBER, Surabaya - Indonesia\n2a. Preparing Learning Agreement & Statement Letter\nFill Out Learning\nAgreement / Statement\nLetter\n• In case the description of the\nprogram required you to submit a\nLearning Agreement or Statement\nLetter file, please download the file\nform the web & fill it with your\ninformation first\nhttp://bit.ly/its-student-exchange\nhttps://intip.in/ResourceAkademikDanKemahasiswaanTIF\nwww.its.ac.id INSTITUT TEKNOLOGI SEPULUH NOPEMBER, Surabaya - Indonesia\n2b. Selecting Course to be Transferred\n• In case the description of the program required you to submit a Learning Agreement,\nplease check the Host University Syllabus & Informatics Syllabus to compare if the', 'Dipublikasikan tanggal 11 Januari 2024\n2. Memilih menu Beasiswa Prioritas.\n3. Melengkapi dan mengunggah semua\ndokumen yang dipersyaratkan pada aplikasi\npendaftaran.\n4. Pastikan melakukan submit aplikasi\npendaftaran untuk mendapatkan kode\nregistrasi/pendaftaran.\nApa saja tahapan dan jadwal Beasiswa\nPrioritas LPDP – Campus France Program\nMaster?\nProses Seleksi Beasiswa Prioritas LPDP –\nCampus France Program Master sebagai berikut:\n1. Seleksi Administrasi\n2. Seleksi Bakat Skolastik\n3. Seleksi Substansi\nTahapan Jadwal\nPendaftaran\n11 Januari – 12\nFebruari 2024\nSeleksi Administrasi\n15 – 28 Februari\n2024\nPengumuman Hasil\nSeleksi Administrasi\n1 Maret 2024\nPegajuan Sanggah Hasil\nSeleksi Administrasi\n2 - 3 Maret 2024\nPengumuman Hasil\nSanggah Seleksi\nAdministrasi\n14 Maret 2024\nSeleksi Bakat Skolastik\ndan Seleksi Substansi\n18 – 27 Maret\n2024\nShort Listed untuk\nKampus Tujuan\n3 April 2024\nLoA Unconditional dari\nKampus Tujuan\n27 Mei 2024\nPengumuman Hasil\nSeleksi Substansi\n10 Juni 2024', 'Kementerian Agama mengenai\npenyetaraan ijazah dan konversi IPK\nbagi pendaftar yang penyetaraan ijazah\ndan/atau konversi IPKnya belum terbit.\n5. Pendaftar yang sedang menempuh studi (on\ngoing) dapat mendaftar dengan ketentuan\nberikut:\na. Mendaftar pada program studi dan/atau\nperguruan tinggi tujuan yang berbeda dari\nyang sedang ditempuh;\nb. Pendaftar yang lulus seleksi substansi\nwajib membuat dan menandatangani surat\npengunduran diri yang ditujukan kepada\nperguruan tinggi atas program studi yang\nsedang ditempuh serta menyampaikan\nsurat tersebut kepada LPDP paling lambat\n2 (dua) pekan setelah diumumkan lulus\nseleksi substansi.\nc. Pendaftar wajib untuk menyerahkan surat\npemberhentian resmi dari program studi\natau perguruan tinggi sebelum\npenandatanganan surat pernyataan\nPenerima Beasiswa.\nd. Bagi pendaftar yang lulus seleksi\nsubstansi dan tidak memenuhi ketentuan\ntersebut di atas, maka LPDP dapat\nmembatalkan statusnya sebagai Calon\nPenerima Beasiswa.']","Untuk pendaftaran, persyaratan dokumen yang harus disiapkan antara lain:

1. Surat usulan atau surat rekomendasi sekurang-kurangnya dari pejabat setingkat eselon II yang membidangi pembinaan/pengembangan SDM pada Kementerian/Lembaga atau Pemerintah Daerah tempat pendaftar bekerja.
2. Surat Keputusan (SK) Jabatan Terakhir atau SK Kenaikan Pangkat Terakhir bagi pendaftar yang merupakan PNS dengan jabatan fungsional sebagai Peneliti/Perekayasa/Medis/Paramedis/Pendidik.
3. Surat usulan atau surat rekomendasi sekurang-kurangnya dari pejabat yang membidangi pembinaan SDM pada Mabes TNI/ TNI AD/ TNI AL/ TNI AU bagi pendaftar berstatus prajurit TNI.
4. Dokumen lain yang dipersyaratkan sesuai dengan program beasiswa yang dilamar.

Semua dokumen harus diunggah sesuai dengan ketentuan yang berlaku pada aplikasi pendaftaran."
6,Bagaimana cara mengajukan aplikasi untuk program ini?,"Pelamar harus membaca persyaratan setiap topik penelitian dengan cermat, melengkapi formulir aplikasi online, menyiapkan dokumen aplikasi, dan mengirim semuanya dalam file ZIP ke coleng_dia@ccu.edu.tw dengan subjek email “Application for 2024 CCU/COE International Internship”.","['2. Look at the requirement of the program\nPreparing required document\n• Each program have different document\nrequirement listed on the web. Please\ncheck each of the requirement inside the\nrespected website link of the program for\ndetails\nwww.its.ac.id INSTITUT TEKNOLOGI SEPULUH NOPEMBER, Surabaya - Indonesia\n2a. Preparing Learning Agreement & Statement Letter\nFill Out Learning\nAgreement / Statement\nLetter\n• In case the description of the\nprogram required you to submit a\nLearning Agreement or Statement\nLetter file, please download the file\nform the web & fill it with your\ninformation first\nhttp://bit.ly/its-student-exchange\nhttps://intip.in/ResourceAkademikDanKemahasiswaanTIF\nwww.its.ac.id INSTITUT TEKNOLOGI SEPULUH NOPEMBER, Surabaya - Indonesia\n2b. Selecting Course to be Transferred\n• In case the description of the program required you to submit a Learning Agreement,\nplease check the Host University Syllabus & Informatics Syllabus to compare if the', 'application form, prepare\r\napplication materials, and send\r\nthem in a ZIP-compressed file to\r\ncoleng_dia@ccu.edu.tw.\r\n• The title of the e-mail please be\r\nmarked with “Application for 2024\r\nCCU/COE International Internship”.\r\nAll the intern research topics and\r\ntheir requirements are listed as\r\nfollows.\r\n• Application deadline: Mar. 3, 2024\r\n• More detailed information about\r\napplication can be found on the\r\nwebsite\r\nhttps://sites.google.com/view/ccu-\r\ncoe-internship/home\r\nCONTACT\r\n+886-5-2720411 ext. 23003, 23005\r\ncoleng_dia@ccu.edu.tw\r\nNo.168, Sec. 1, University Rd., Minhsiung,\r\nChiayi 621301, Taiwan (R.O.C.)\r\n\r\nINTERN RESEARCH TOPICS\r\nNumber P1\r\nProject title\r\nTrustable Artificial Intelligence for Critical Applications and\r\n6G Security\r\nDescription of the research\r\nArtificial Intelligence (AI) technologies, 6G networking,\r\nand quantum computing are the leading forces in\r\nbringing the world to an era of better intelligence and full', 'with the format written on the program web\n• After that, ITS GE will reply back to you email regarding further step to join the program\nwww.its.ac.id INSTITUT TEKNOLOGI SEPULUH NOPEMBER, Surabaya - Indonesia\n- Thank You-\nwww.its.ac.id its_campus institut teknologu sepuluh nopember', 'melampirkan surat usulan atau surat\nrekomendasi sekurang-kurangnya dari\npejabat setingkat eselon II yang membidangi\npembinaan/pengembangan SDM pada\nKementerian/Lembaga atau Pemerintah\nDaerah tempat pendaftar bekerja dengan\nketentuan;\na. mengusulkan atau merekomendasikan\npendaftar untuk mengikuti program\nBeasiswa LPDP; dan\nb. mencantumkan Nama Lengkap serta\nNomor Induk Pegawai (NIP) pendaftar.\n9. Bagi pendaftar yang merupakan PNS dengan\nstatus PNS dengan jabatan fungsional\nsebagai Peneliti/Perekayasa/Medis/\nParamedis/ Pendidik, mengunggah Surat\nKeputusan (SK) Jabatan Terakhir atau SK\nKenaikan Pangkat Terakhir atau sejenisnya\nyang menunjukkan bahwa pendaftar adalah\nPNS dengan jabatan fungsional sebagai\nPeneliti/Perekayasa/Medis/Paramedis/Pendi\ndik.\n10. Bagi pendaftar berstatus prajurit TNI di semua\nprogram beasiswa LPDP wajib melampirkan\nsurat usulan atau surat rekomendasi\nsekurang-kurangnya pejabat yang\nmembidangi pembinaan SDM pada Mabes\nTNI/ TNI AD/ TNI AL/ TNI AU untuk mengikuti']","Untuk mengajukan aplikasi untuk program ini, Anda perlu melakukan langkah-langkah berikut:
1. Persiapkan dokumen yang diperlukan sesuai dengan persyaratan program yang tercantum di website resmi program tersebut.
2. Isi Learning Agreement atau Statement Letter sesuai dengan informasi pribadi Anda. Anda dapat mengunduh formulirnya dari website resmi program.
3. Pilih mata kuliah yang akan ditransfer dengan membandingkan silabus dari Host University dan Silabus Informatika.
4. Isi formulir aplikasi, siapkan materi aplikasi, dan kirim dalam file ZIP ke coleng_dia@ccu.edu.tw. Pastikan judul email Anda mencantumkan ""Aplikasi untuk 2024 CCU/COE International Internship"".
5. Perhatikan batas waktu pengajuan aplikasi, yaitu tanggal 3 Maret 2024.
6. Untuk informasi lebih lanjut, kunjungi website resmi program di https://sites.google.com/view/ccu-coe-internship/home.

Jika ada pertanyaan lebih lanjut, Anda dapat menghubungi kontak yang tertera di pengumuman program tersebut."
7,Apa tenggat waktu penyerahan aplikasi? ,Tenggat waktu penyerahan aplikasi adalah 3 Maret 2024.,"['Category\r\n■ Scholarship\r\n■ Self-supported\r\nIntern period At least 8 weeks between 2024/5/1- 2024/12/31\r\n\r\nNumber P16\r\nProject title\r\nNext generation Wireless communication, B5G/6G,\r\nReconfigurable Intelligent Surface, System level\r\nsimulation, Artificial Intelligence-enhanced wireless\r\nresearch\r\nDescription of the\r\nresearch\r\nInnovate and design cutting-edge concepts and\r\narchitectures beyond 5G (B5G) and 6G.\r\nIdentify and validate solutions to key problems through\r\nsimulation or prototype experiments.\r\nConduct research on AI and machine learning\r\ntechniques applied to wireless communications and\r\nnetworks.\r\nDesign and implement novel algorithms, models, and\r\nprotocols to optimize wireless network performance.\r\nCollaborate with the research team to manage projects\r\nand ensure timely deliverables,\r\nPlease refer to the website of our lab at\r\nhttps://sites.google.com/view/ccuantlab/english\r\nMentor at CCU\r\nAssoc. Prof. Jen-Yi Pan\r\nDept. of Communications Engineering,', '17 Designing and Managing Integrated Marketing Communications II 3\n18\n(Jan. 22)\nFinal Exam 3\n48\n28. Big Data Analysis\nDepartment: Finance\nWeek of day: Wednesday\nCourse Time: 09:10 am-12:00 pm (Taiwan time)\nGrades: 4th\nyear\nCredits: 3\nInstructor: Dr. Chih-Chung, Chien (andrewchien@asia.edu.tw)\nAbout the Course\nData scientist has been called “the great potential job of the 21st century,” presumably\nby someone who has never visited a fire station. Nonetheless, data science is a hot\nand growing field, and it doesn’t take a great deal of sleuthing to find analysts\nbreathlessly prognosticating that over the next 10 years, we’ll need billions and billions\nmore data scientists than we currently have.\nBut what is data science? After all, we can’t produce data scientists if we don’t know\nwhat data science is. According to a Venn diagram that is somewhat famous in the\nindustry, data science lies at the intersection of:\n1. Math and statistics knowledge\n2. Substantive expertise\nThe Course Features', '5. Dengan memperhatikan poin 1, DKG menginformasikan bahwa Test GCW Non-Degree yang sebelumnya diselenggarakan\nsetiap bulan tidak akan lagi diselenggarakan, kecuali dalam kondisi yang sangat khusus, dengan mempertimbangkan surat\npermohonan oleh mahasiswa yang diketahui oleh Kepala Departemen. Pelaksanaan Test GCW Non Degree akan diputuskan\noleh Direktur Kemitraan Global.\nBersama ini kami juga melampirkan poster informasi penyelenggaraan Global Competency Academy yang pendaftarannya dibuka\nsampai dengan 17 September 2023. Kami mohon bantuan dari Bapak/Ibu Kepala Departemen dan Ketua Program Studi untuk\nmenyebarkan informasi ini kepada mahasiswa di departemen masing-masing.\nUntuk pertanyaan lebih lanjut, kiranya dapat disampaikan melalui email studyabroad@its.ac.id , LINE Official @yao2114f , atau\nmelalui Instagram @itsinternationaloffice.\nDemikian surat ini kami sampaikan. Atas perhatian dan kerjasamanya kami sampaikan terima kasih.\n\nSurabaya, 13 September 2023', 'Kementerian Agama mengenai\npenyetaraan ijazah dan konversi IPK\nbagi pendaftar yang penyetaraan ijazah\ndan/atau konversi IPKnya belum terbit.\n5. Pendaftar yang sedang menempuh studi (on\ngoing) dapat mendaftar dengan ketentuan\nberikut:\na. Mendaftar pada program studi dan/atau\nperguruan tinggi tujuan yang berbeda dari\nyang sedang ditempuh;\nb. Pendaftar yang lulus seleksi substansi\nwajib membuat dan menandatangani surat\npengunduran diri yang ditujukan kepada\nperguruan tinggi atas program studi yang\nsedang ditempuh serta menyampaikan\nsurat tersebut kepada LPDP paling lambat\n2 (dua) pekan setelah diumumkan lulus\nseleksi substansi.\nc. Pendaftar wajib untuk menyerahkan surat\npemberhentian resmi dari program studi\natau perguruan tinggi sebelum\npenandatanganan surat pernyataan\nPenerima Beasiswa.\nd. Bagi pendaftar yang lulus seleksi\nsubstansi dan tidak memenuhi ketentuan\ntersebut di atas, maka LPDP dapat\nmembatalkan statusnya sebagai Calon\nPenerima Beasiswa.']",Tenggat waktu penyerahan aplikasi adalah setidaknya 8 minggu antara tanggal 1 Mei 2024 hingga 31 Desember 2024.
8,Proyek apa saja yang tersedia dalam program ini?,"Terdapat berbagai proyek, termasuk ""Trustable Artificial Intelligence for Critical Applications and 6G Security,"" ""Grid-Forming and Grid-Following Inverter-based Resources for Low-Inertia Microgrid/Grid,"" dan banyak lagi.","['2. Look at the requirement of the program\nPreparing required document\n• Each program have different document\nrequirement listed on the web. Please\ncheck each of the requirement inside the\nrespected website link of the program for\ndetails\nwww.its.ac.id INSTITUT TEKNOLOGI SEPULUH NOPEMBER, Surabaya - Indonesia\n2a. Preparing Learning Agreement & Statement Letter\nFill Out Learning\nAgreement / Statement\nLetter\n• In case the description of the\nprogram required you to submit a\nLearning Agreement or Statement\nLetter file, please download the file\nform the web & fill it with your\ninformation first\nhttp://bit.ly/its-student-exchange\nhttps://intip.in/ResourceAkademikDanKemahasiswaanTIF\nwww.its.ac.id INSTITUT TEKNOLOGI SEPULUH NOPEMBER, Surabaya - Indonesia\n2b. Selecting Course to be Transferred\n• In case the description of the program required you to submit a Learning Agreement,\nplease check the Host University Syllabus & Informatics Syllabus to compare if the', 'Dipublikasikan tanggal 11 Januari 2024\nprogram beasiswa lain yang dipilih, sesuai\ndengan syarat dan ketentuan yang berlaku.\nApa saja komponen Dana yang diberikan?\n1. Dana Pendidikan\na. Tuition Fee\nb. Dana Pendaftaran\nc. Dana Tunjangan Buku\nd. Dana Penelitian Tesis\ne. Dana Seminar Internasional\nf. Dana Publikasi Jurnal Internasional\n2. Dana Pendukung\na. Dana Transportasi\nb. Dana Aplikasi Visa\nc. Dana Asuransi Kesehatan\nd. Dana Kedatangan\ne. Dana Hidup Bulanan\nf. Dana Lomba Internasional\ng. Dana keadaaan darurat (jika diperlukan)\nApa saja persyaratan umum pendaftaran\nBeasiswa Prioritas LPDP – Campus\nFrance Program Master?\nPersyaratan umum Beasiswa Prioritas LPDP –\nCampus France Program Master adalah sebagai\nberikut:\n1. Warga Negara Indonesia.\n2. Telah menyelesaikan studi program diploma\nempat (D4) atau sarjana (S1).\n3. Pendaftar yang telah menyelesaikan studi\nmagister (S2) tidak diizinkan mendaftar.\n4. Bagi pendaftar lulusan perguruan tinggi luar', 'Dipublikasikan tanggal 11 Januari 2024\nNo Bidang Study Program University\n51 Material Sciences\nGraduate Programme Innovative Materials and\nEnergy Systems (Emat) - Master\nNantes Université\n52 Urban Planning Economics for Smart Cities and Climate Policy Institut Polytechnique de Paris\nPoin-Poin Surat Pernyataan pada Aplikasi Pendaftaran (Disetujui Saat Akan Melakukan Submit)\n1. Setia kepada Pancasila, Negara Kesatuan Republik Indonesia, dan UUD 1945.\n2. Tidak pernah, sedang, atau akan mendukung atau terlibat dalam gerakan, organisasi, atau ideologi\nyang bertentangan dan/atau berpotensi mengganggu tegaknya ideologi Pancasila, Undang-\nUndang Dasar 1945, dan Negara Kesatuan Republik Indonesia.\n3. Mendahulukan kepentingan Bangsa dan Negara Kesatuan Republik Indonesia di atas kepentingan\npribadi.\n4. Tidak akan berpindah kewarganegaraan sejak pendaftaran beasiswa sampai dengan selesainya\nmasa kontribusi sebagai alumni beasiswa LPDP.', 'application form, prepare\r\napplication materials, and send\r\nthem in a ZIP-compressed file to\r\ncoleng_dia@ccu.edu.tw.\r\n• The title of the e-mail please be\r\nmarked with “Application for 2024\r\nCCU/COE International Internship”.\r\nAll the intern research topics and\r\ntheir requirements are listed as\r\nfollows.\r\n• Application deadline: Mar. 3, 2024\r\n• More detailed information about\r\napplication can be found on the\r\nwebsite\r\nhttps://sites.google.com/view/ccu-\r\ncoe-internship/home\r\nCONTACT\r\n+886-5-2720411 ext. 23003, 23005\r\ncoleng_dia@ccu.edu.tw\r\nNo.168, Sec. 1, University Rd., Minhsiung,\r\nChiayi 621301, Taiwan (R.O.C.)\r\n\r\nINTERN RESEARCH TOPICS\r\nNumber P1\r\nProject title\r\nTrustable Artificial Intelligence for Critical Applications and\r\n6G Security\r\nDescription of the research\r\nArtificial Intelligence (AI) technologies, 6G networking,\r\nand quantum computing are the leading forces in\r\nbringing the world to an era of better intelligence and full']",Saya tidak menemukan informasi tentang proyek yang tersedia dalam program ini.
9,"Siapa mentor yang terlibat dalam proyek P1 ""Trustable Artificial Intelligence for Critical Applications and 6G Security""?","Mentor untuk proyek ini adalah Asst. Prof. Van-Linh Nguyen dari Dept. of Computer Science and Information Engineering, CCU.","['secure AI models are the top targets of many current\r\nresearch efforts. In short, our lab is recruiting talents who\r\nare interested in the following topics:\r\n(1) AI for Cybersecurity: Misbehavior detection in\r\nautonomous vehicles, Deep Reinforcement Learning for\r\naerial-assisted networks (UAV-satellite-space) or\r\nIntelligent Transportation Systems, Self-supervised\r\nLearning, autoDL /ML for Intrusion Detection Systems.\r\n(2) Cybersecurity for AI: Trustable AI for automated\r\nvehicles and AI-based control systems from adversarial\r\nattacks.\r\n(3) 6G security: Signal sensing, physical layer\r\nauthentication, high-accuracy localization and sensing.\r\n(4) Space and Quantum security: Blockchain for\r\nvehicular/aerial networks; Quantum - safe\r\nvehicular/aerial networks; Quantum - compatible IDS\r\nplatforms.\r\nAbout CISLab: CIS Lab is a leading security research group\r\nat National Chung Cheng University, established by Prof.\r\nVan-Linh Nguyen. CISLab has been the home of many', 'Description of the research\r\nArtificial Intelligence (AI) technologies, 6G networking,\r\nand quantum computing are the leading forces in\r\nbringing the world to an era of better intelligence and full\r\nautomation. However, the rapid development of such\r\ntechnologies raises concerns that they could be used to\r\ndamage human life, destroy critical infrastructure, and\r\nfurther violate user privacy. For example, AI power can be\r\nexploited to scan the vulnerabilities of critical control\r\nsystems (SCADA, ITS) or track a target user in a restricted\r\naccess building, even without physical intrusion. Similarly,\r\nthe attackers can launch adversarial attacks against AI-\r\nbased Advanced Driver-Assistance Systems (ADAS) and\r\nforce connected vehicles to act as unexpected weapons\r\nto hit civilians. Early detection of security attacks and\r\nsecure AI models are the top targets of many current\r\nresearch efforts. In short, our lab is recruiting talents who\r\nare interested in the following topics:', 'some preliminary knowledge on NN (neural network) or\r\ndeep learning and skilled in Python programming. He/She\r\nwill learn how to apply state-of-the-art deep learning\r\ntechniques to solve the indicated problems. For more detail\r\nabout my topics, please visit my Youtube vide at:\r\nhttps://youtu.be/tIwenpyFRhw\r\nMentor at CCU\r\nProf. Wen-Nung Lie\r\nDept. of Electrical Engineering,\r\nNational Chung Cheng University, Taiwan.\r\n(e-mail: ieewnl@ccu.edu.tw)\r\nExpected student level\r\n■ Post-graduate student\r\n■ Third/forth-year undergraduate senior student\r\nCategory ■ Scholarship\r\nIntern period\r\nAt least 8 weeks (2 months) between May 1, 2024 and June\r\n30, 2025. However, 3-6 months is better.\r\n\r\nNumber P6\r\nProject title\r\nImpulse Radar Imaging System, mmWave/RF Intergrated\r\nCircuit design and Energy Harvesting\r\nDescription of the research\r\nFour investigation topics over Ultra-Wideband Impulse\r\nRadar imaging system:\r\n1. A back-projection imaging algorithm used to\r\nreconstruct the radar image.', 'Category\r\n■ Scholarship\r\n■ Self-supported\r\nIntern period At least 8 weeks between 2024/5/1- 2024/12/31\r\n\r\nNumber P16\r\nProject title\r\nNext generation Wireless communication, B5G/6G,\r\nReconfigurable Intelligent Surface, System level\r\nsimulation, Artificial Intelligence-enhanced wireless\r\nresearch\r\nDescription of the\r\nresearch\r\nInnovate and design cutting-edge concepts and\r\narchitectures beyond 5G (B5G) and 6G.\r\nIdentify and validate solutions to key problems through\r\nsimulation or prototype experiments.\r\nConduct research on AI and machine learning\r\ntechniques applied to wireless communications and\r\nnetworks.\r\nDesign and implement novel algorithms, models, and\r\nprotocols to optimize wireless network performance.\r\nCollaborate with the research team to manage projects\r\nand ensure timely deliverables,\r\nPlease refer to the website of our lab at\r\nhttps://sites.google.com/view/ccuantlab/english\r\nMentor at CCU\r\nAssoc. Prof. Jen-Yi Pan\r\nDept. of Communications Engineering,']","Mentor yang terlibat dalam proyek P1 ""Trustable Artificial Intelligence for Critical Applications and 6G Security"" adalah Prof. Van-Linh Nguyen dari CIS Lab di National Chung Cheng University."
10,Apa yang dapat diperoleh peserta selama periode magang pada proyek P1? ,"Peserta akan memperoleh keterampilan dalam penelitian state-of-the-art, keterampilan pemrograman melalui proyek mini, debat untuk mendapatkan ide kreatif, pelaporan hasil secara profesional, dan menghadiri tur industri serta kursus bahasa Tionghoa.","['Syarat dokumen mengikuti syarat program\nbeasiswa yang dipilih (mengacu pada Buku\nPanduan masing-masing program beasiswa).\nSeperti apa format Komitmen kembali ke\nIndonesia, rencana pasca studi, dan\nrencana kontribusi di Indonesia serta\nRencana Bisnis atau Rencana\nPengembangan Bisnis?\nKomitmen kembali ke Indonesia, rencana\npasca studi, dan rencana kontribusi di\nIndonesia (1500 – 2000 kata)\nDeskripsikan dalam tulisan secara jelas dan\nkonkret tentang tema di atas.', 'Dipublikasikan tanggal 11 Januari 2024\nprogram beasiswa lain yang dipilih, sesuai\ndengan syarat dan ketentuan yang berlaku.\nApa saja komponen Dana yang diberikan?\n1. Dana Pendidikan\na. Tuition Fee\nb. Dana Pendaftaran\nc. Dana Tunjangan Buku\nd. Dana Penelitian Tesis\ne. Dana Seminar Internasional\nf. Dana Publikasi Jurnal Internasional\n2. Dana Pendukung\na. Dana Transportasi\nb. Dana Aplikasi Visa\nc. Dana Asuransi Kesehatan\nd. Dana Kedatangan\ne. Dana Hidup Bulanan\nf. Dana Lomba Internasional\ng. Dana keadaaan darurat (jika diperlukan)\nApa saja persyaratan umum pendaftaran\nBeasiswa Prioritas LPDP – Campus\nFrance Program Master?\nPersyaratan umum Beasiswa Prioritas LPDP –\nCampus France Program Master adalah sebagai\nberikut:\n1. Warga Negara Indonesia.\n2. Telah menyelesaikan studi program diploma\nempat (D4) atau sarjana (S1).\n3. Pendaftar yang telah menyelesaikan studi\nmagister (S2) tidak diizinkan mendaftar.\n4. Bagi pendaftar lulusan perguruan tinggi luar', 'Dipublikasikan tanggal 11 Januari 2024\nTentang LPDP\nLPDP berkomitmen untuk mempersiapkan\npemimpin dan profesional masa depan serta\nmendorong inovasi demi terwujudnya Indonesia\nyang sejahtera, demokratis, dan berkeadilan.\nLPDP menyelenggarakan program beasiswa\nmagister/doktor serta beasiswa dokter spesialis,\ndokter subspesialis dan Fellowship untuk putra-\nputri terbaik Indonesia.\nApa itu Beasiswa Prioritas?\nBeasiswa Prioritas merupakan program beasiswa\nyang memberikan kesempatan kepada pendaftar\nuntuk dapat melakukan pendaftaran pada dua\nprogram sekaligus, yaitu pada program Beasiswa\nKemitraan/Kerja Sama LPDP dan pada salah satu\nprogram Beasiswa Afirmasi/Beasiswa\nTargeted/Beasiswa Umum tujuan luar negeri.\nApa itu Beasiswa Prioritas LPDP – Campus\nFrance Program Master?\nBeasiswa Prioritas LPDP – Campus France\nProgram Master memberikan kesempatan bagi\npendaftar untuk dapat melakukan pendaftaran\npada Beasiswa Kemitraan LPDP – Campus\nFrance dan beasiswa Magister Luar Negeri', 'program beasiswa LPDP wajib melampirkan\nsurat usulan atau surat rekomendasi\nsekurang-kurangnya pejabat yang\nmembidangi pembinaan SDM pada Mabes\nTNI/ TNI AD/ TNI AL/ TNI AU untuk mengikuti\nprogram beasiswa LPDP yang ditujukan\nkepada LPDP.\n11. Bagi pendaftar berstatus anggota POLRI di\nsemua program beasiswa LPDP wajib\nmelampirkan surat usulan atau surat\nrekomendasi sekurang-kurangnya pejabat\nyang membidangi pembinaan SDM pada\nMabes POLRI untuk mengikuti program\nbeasiswa LPDP kepada LPDP pada saat\npendaftaran beasiswa LPDP.\n12. Memilih Perguruan Tinggi Tujuan dan\nprogram studi sesuai dengan ketentuan LPDP\n13. Beasiswa hanya diperuntukkan bagi kelas\nreguler atau kelas lain yang ditetapkan oleh\nLPDP, dan tidak diperuntukkan untuk kelas-\nkelas sebagai berikut:\na. Kelas eksekutif;\nb. Kelas khusus;\nc. Kelas karyawan;\nd. Kelas jarak jauh;\ne. Kelas yang diselenggarakan bukan di\nperguruan tinggi induk;\nf. Kelas internasional bagi pendaftar tujuan\nstudi dalam negeri;']",Saya tidak tahu.
11,"Proyek P2 ""A Study of Grid-Forming and Grid-Following Inverter-based Resources for Low-Inertia Microgrid/Grid with Virtual Inertia and Grid Voltage Support Functions"" mencakup apa?",Proyek ini mencakup penelitian berbasis simulasi untuk meningkatkan ketahanan dan stabilitas jaringan mikrogid/inverter berinertia rendah dengan menggunakan inverter GFM dan GFL dengan fungsi inertia virtual dan dukungan tegangan grid.,"['Project title\r\nRenewable Energy Integration: Power System Analyses,\r\nPower Conversion or Intelligent Control\r\nDescription of the research\r\nThe students will learn the research topics about\r\nrenewable energy integration, which includes one of the\r\nfollowing issues:\r\n➢ Wind farm modeling and control\r\n➢ Fault diagnosis for solar power systems\r\n➢ Artificial intelligence applications on renewable\r\npower systems\r\n➢ Forecasting technologies for renewable power\r\nresources\r\n➢ Smart grid control and operation\r\n➢ Energy storage systems\r\n➢ Transmission and distribution system analyses\r\nMentor at CCU\r\nProf. Yuan-Kang Wu\r\nDept. of Electrical Engineering\r\nNational Chung Cheng University, Taiwan, ROC.\r\n(e-mail: allenwu@ccu.edu.tw)\r\nExpected student level\r\n█ Post-graduate student\r\n█ Third/forth-year undergraduate senior student\r\nCategory █ Scholarship\r\nIntern period At least 12 weeks between May 1 and December 31, 2024\r\n\r\nNumber P8\r\nProject title Silicon photonics and optical biosesnors', 'systems (IBRs) has been displacing conventional\r\nsynchronous generators and causing a reduction in system\r\ninertia. IBRs are integrated into power grids through power-\r\nelectronics inverters. These are generally categorized as (i)\r\ngrid-following (GFL) and (ii) grid-forming (GFM) inverters.\r\nThe GFM inverter is a promising emerging technology that\r\ngenerates its own voltage signal and has the capability to\r\nregulate the frequency and voltage at the point of\r\ninterconnection. GFM and GFL with virtual inertia and grid\r\nvoltage support functions are in great demand when the\r\npenetration level of IBRs in the grid is high. The simulation-\r\nbased research project will focus on investigating the\r\npotential applications to enhance low-inertia microgrid/grid\r\nresilience and stability when the grid is subjected to minor\r\nor large disturbances.\r\nMentor at CCU\r\nProf. Gary Chang, PhD, PE, IEEE Fellow\r\nDept. of Electrical Engineering,\r\nNational Chung Cheng University, Taiwan, ROC.', 'Dipublikasikan tanggal 11 Januari 2024\nNo Bidang Study Program University\n51 Material Sciences\nGraduate Programme Innovative Materials and\nEnergy Systems (Emat) - Master\nNantes Université\n52 Urban Planning Economics for Smart Cities and Climate Policy Institut Polytechnique de Paris\nPoin-Poin Surat Pernyataan pada Aplikasi Pendaftaran (Disetujui Saat Akan Melakukan Submit)\n1. Setia kepada Pancasila, Negara Kesatuan Republik Indonesia, dan UUD 1945.\n2. Tidak pernah, sedang, atau akan mendukung atau terlibat dalam gerakan, organisasi, atau ideologi\nyang bertentangan dan/atau berpotensi mengganggu tegaknya ideologi Pancasila, Undang-\nUndang Dasar 1945, dan Negara Kesatuan Republik Indonesia.\n3. Mendahulukan kepentingan Bangsa dan Negara Kesatuan Republik Indonesia di atas kepentingan\npribadi.\n4. Tidak akan berpindah kewarganegaraan sejak pendaftaran beasiswa sampai dengan selesainya\nmasa kontribusi sebagai alumni beasiswa LPDP.', 'Description of the research\r\nFour investigation topics over Ultra-Wideband Impulse\r\nRadar imaging system:\r\n1. A back-projection imaging algorithm used to\r\nreconstruct the radar image.\r\n2. The studies of the transmitting and receiving circuits\r\nand Vivaldi antenna array.\r\n3. mmWave/RF integrated circuit design such as PA and\r\nLNA, by CMOS process or III-V technology.\r\nEnergy harvesting within wireless communications\r\nenvironment\r\nMentor at CCU\r\nAssoc. Prof. Janne-Wha Wu\r\nDept. of, Electrical Engineering\r\nNational Chung Cheng University, Taiwan, ROC.\r\n(e-mail: jwwu@ccu.edu.tw)\r\nExpected student level\r\n■ Post-graduate student\r\n■ Third/forth-year undergraduate senior student\r\nCategory\r\n█ Scholarship\r\n█ Self-supported\r\nIntern period At least 10 weeks between May 1 and Dec. 31\r\n\r\nNumber P7\r\nProject title\r\nRenewable Energy Integration: Power System Analyses,\r\nPower Conversion or Intelligent Control\r\nDescription of the research\r\nThe students will learn the research topics about']","Proyek P2 ""A Study of Grid-Forming and Grid-Following Inverter-based Resources for Low-Inertia Microgrid/Grid with Virtual Inertia and Grid Voltage Support Functions"" mencakup investigasi potensi aplikasi untuk meningkatkan ketahanan dan stabilitas mikrogrid/grid berinersia rendah ketika grid mengalami gangguan kecil atau besar. Proyek ini fokus pada inverter berbasis grid-forming (GFM) dan grid-following (GFL) yang memiliki fungsi virtual inertia dan dukungan tegangan grid."
12,"Apa yang akan dipelajari dalam proyek P3 ""Lidar and Camera Fusion for Autonomous Driving""?","Peserta akan mengembangkan algoritma untuk kalibrasi data sensor, pemrosesan titik awan, dan pemrosesan gambar untuk penggabungan data lidar dan kamera untuk sistem mengemudi otonom.","[""developing algorithms for sensor data calibration, point\r\ncloud processing and image processing to create a\r\ncomprehensive and accurate representation of the\r\nvehicle's surroundings. The primary objective is to develop\r\nand optimize algorithms for efficiently processing and\r\ninterpreting the multi-modality. This includes tasks such as\r\nsemantic segmentation, feature extraction, and object\r\nrecognition, all of which are pivotal for the accurate\r\nperception of the vehicle's surroundings.\r\nMentor at CCU\r\nAssoc. Prof. Jui-Chiu Chiang\r\nDept. of Electrical Engineering,\r\nNational Chung Cheng University, Taiwan, ROC.\r\n(E-mail: rachel@ccu.edu.tw)\r\nExpected student level █ Third/forth-year undergraduate senior student\r\nCategory\r\n█ Scholarship\r\n█ Self-supported\r\nIntern period At least 12 weeks between May 1st and Dec. 31th\r\n\r\nNumber P4\r\nProject title\r\nSimulation and Reconstruction of Pencil Beam Scanning of\r\nParticle Therapy\r\nDescription of the research"", 'or large disturbances.\r\nMentor at CCU\r\nProf. Gary Chang, PhD, PE, IEEE Fellow\r\nDept. of Electrical Engineering,\r\nNational Chung Cheng University, Taiwan, ROC.\r\n(e-mail: ieegwc@ccu.edu.tw)\r\nExpected student level\r\n■ Post-graduate student\r\n■ Third/forth-year undergraduate senior student\r\nCategory\r\n█ Scholarship\r\n█ Self-supported\r\nIntern period 12 to 20 weeks between April 1 and Dec. 31, 2024\r\n\r\nNumber P3\r\nProject title Lidar and Camera fusion for autonomous driving\r\nDescription of the research\r\nThis project revolves around the integration of lidar and\r\ncamera sensor data, aiming to develop robust algorithms\r\nfor enhanced perception and decision-making in self-\r\ndriving systems. Interns will engage in the fusion of lidar\r\nand camera inputs, leveraging Python and advanced\r\nmachine learning models. The primary objectives include\r\ndeveloping algorithms for sensor data calibration, point\r\ncloud processing and image processing to create a\r\ncomprehensive and accurate representation of the', 'NBI) model. These models will be generated through a\r\nconversion algorithm referred to as the spectrum-aided\r\nvision enhancer (SAVE). The main goal will be to discover\r\nDysplasia and Squamous Cell Carcinoma (SCC). The\r\nevaluation of model performance will be conducted using the\r\ncreated confusion matrix and five important indicators:\r\nprecision, recall, F1-score, mAP, and the confusion matrix of\r\nthe trained model.\r\nMentor at CCU\r\nProf. Hsiang-Chen Wang\r\nDept. of Mechanical Engineering,\r\nNational Chung Cheng University, Taiwan, ROC.\r\n(e-mail: hcwang@ccu.edu.tw)\r\nExpected student level\r\n■ Post-graduate student\r\n■ Third/forth-year undergraduate senior student\r\nCategory ■ Scholarship\r\nIntern period At least 12 weeks between May and December 2024\r\n\r\nNumber P14\r\nProject title Stirling engines and their applications\r\nDescription of the\r\nresearch\r\nThe students will learn the research topics about Stirling\r\nengines and their applications in renewable energy,', 'Description of the research\r\nFour investigation topics over Ultra-Wideband Impulse\r\nRadar imaging system:\r\n1. A back-projection imaging algorithm used to\r\nreconstruct the radar image.\r\n2. The studies of the transmitting and receiving circuits\r\nand Vivaldi antenna array.\r\n3. mmWave/RF integrated circuit design such as PA and\r\nLNA, by CMOS process or III-V technology.\r\nEnergy harvesting within wireless communications\r\nenvironment\r\nMentor at CCU\r\nAssoc. Prof. Janne-Wha Wu\r\nDept. of, Electrical Engineering\r\nNational Chung Cheng University, Taiwan, ROC.\r\n(e-mail: jwwu@ccu.edu.tw)\r\nExpected student level\r\n■ Post-graduate student\r\n■ Third/forth-year undergraduate senior student\r\nCategory\r\n█ Scholarship\r\n█ Self-supported\r\nIntern period At least 10 weeks between May 1 and Dec. 31\r\n\r\nNumber P7\r\nProject title\r\nRenewable Energy Integration: Power System Analyses,\r\nPower Conversion or Intelligent Control\r\nDescription of the research\r\nThe students will learn the research topics about']","Dalam proyek P3 ""Lidar and Camera Fusion for Autonomous Driving"", peserta magang akan belajar tentang integrasi data sensor lidar dan kamera untuk mengembangkan algoritma yang kuat untuk persepsi dan pengambilan keputusan yang lebih baik dalam sistem self-driving. Mereka akan terlibat dalam penggabungan input lidar dan kamera, dengan memanfaatkan Python dan model machine learning canggih. Tujuan utamanya termasuk pengembangan algoritma untuk kalibrasi data sensor, pemrosesan awan titik, dan pemrosesan gambar untuk menciptakan representasi yang komprehensif dan akurat dari sekitar kendaraan."
13,"Apa yang membuat proyek P5 ""Computer Vision Applications based on Deep Learning Techniques"" menarik?","Proyek ini mencakup teknik pembelajaran mendalam seperti CNN, RNN, LSTM, dan lain-lain untuk aplikasi seperti ekstraksi kerangka 3D manusia, pengenalan tindakan, dan estimasi pose objek dari gambar RGB tunggal.","['NBI) model. These models will be generated through a\r\nconversion algorithm referred to as the spectrum-aided\r\nvision enhancer (SAVE). The main goal will be to discover\r\nDysplasia and Squamous Cell Carcinoma (SCC). The\r\nevaluation of model performance will be conducted using the\r\ncreated confusion matrix and five important indicators:\r\nprecision, recall, F1-score, mAP, and the confusion matrix of\r\nthe trained model.\r\nMentor at CCU\r\nProf. Hsiang-Chen Wang\r\nDept. of Mechanical Engineering,\r\nNational Chung Cheng University, Taiwan, ROC.\r\n(e-mail: hcwang@ccu.edu.tw)\r\nExpected student level\r\n■ Post-graduate student\r\n■ Third/forth-year undergraduate senior student\r\nCategory ■ Scholarship\r\nIntern period At least 12 weeks between May and December 2024\r\n\r\nNumber P14\r\nProject title Stirling engines and their applications\r\nDescription of the\r\nresearch\r\nThe students will learn the research topics about Stirling\r\nengines and their applications in renewable energy,', 'techniques. In this research, you will learn deep learning\r\ntechniques such as CNN, RNN, LSTM, AE, VAE, etc. The\r\npossible applications and topics include: (1) 3D human\r\nskeleton extraction, (2) skeleton-based action\r\nrecognition/behavior modeling, (3) action prediction for\r\nelderly monitoring, (4) 3D object (vehicle, pedestrian,\r\ncyclist) detection and positioning from fusion of RGB/LiDAR\r\nsensor data, (5) object (head/vehicle/ human/object) pose\r\nestimation from single RGB image, (6) deep learning-based\r\nadverse drug reaction (ADR) prediction for clinic medicine\r\nuse, (7) AI-generated content (AIGC), such as\r\n(text/audio/image) -to-(image/video), (8) elderly caring\r\napplication of AIGC, (9) heart rate estimation from facial\r\nimage sequence. The intern student is expected to have\r\nsome preliminary knowledge on NN (neural network) or\r\ndeep learning and skilled in Python programming. He/She\r\nwill learn how to apply state-of-the-art deep learning', 'some preliminary knowledge on NN (neural network) or\r\ndeep learning and skilled in Python programming. He/She\r\nwill learn how to apply state-of-the-art deep learning\r\ntechniques to solve the indicated problems. For more detail\r\nabout my topics, please visit my Youtube vide at:\r\nhttps://youtu.be/tIwenpyFRhw\r\nMentor at CCU\r\nProf. Wen-Nung Lie\r\nDept. of Electrical Engineering,\r\nNational Chung Cheng University, Taiwan.\r\n(e-mail: ieewnl@ccu.edu.tw)\r\nExpected student level\r\n■ Post-graduate student\r\n■ Third/forth-year undergraduate senior student\r\nCategory ■ Scholarship\r\nIntern period\r\nAt least 8 weeks (2 months) between May 1, 2024 and June\r\n30, 2025. However, 3-6 months is better.\r\n\r\nNumber P6\r\nProject title\r\nImpulse Radar Imaging System, mmWave/RF Intergrated\r\nCircuit design and Energy Harvesting\r\nDescription of the research\r\nFour investigation topics over Ultra-Wideband Impulse\r\nRadar imaging system:\r\n1. A back-projection imaging algorithm used to\r\nreconstruct the radar image.', ""developing algorithms for sensor data calibration, point\r\ncloud processing and image processing to create a\r\ncomprehensive and accurate representation of the\r\nvehicle's surroundings. The primary objective is to develop\r\nand optimize algorithms for efficiently processing and\r\ninterpreting the multi-modality. This includes tasks such as\r\nsemantic segmentation, feature extraction, and object\r\nrecognition, all of which are pivotal for the accurate\r\nperception of the vehicle's surroundings.\r\nMentor at CCU\r\nAssoc. Prof. Jui-Chiu Chiang\r\nDept. of Electrical Engineering,\r\nNational Chung Cheng University, Taiwan, ROC.\r\n(E-mail: rachel@ccu.edu.tw)\r\nExpected student level █ Third/forth-year undergraduate senior student\r\nCategory\r\n█ Scholarship\r\n█ Self-supported\r\nIntern period At least 12 weeks between May 1st and Dec. 31th\r\n\r\nNumber P4\r\nProject title\r\nSimulation and Reconstruction of Pencil Beam Scanning of\r\nParticle Therapy\r\nDescription of the research""]","Proyek P5 ""Computer Vision Applications based on Deep Learning Techniques"" menarik karena melibatkan penggunaan teknik deep learning seperti CNN, RNN, LSTM, AE, VAE, dan lainnya dalam aplikasi visi komputer. Beberapa aplikasi dan topik yang mungkin termasuk dalam proyek ini antara lain: ekstraksi kerangka manusia 3D, pengenalan tindakan berbasis kerangka/tata perilaku, prediksi tindakan untuk pemantauan lansia, deteksi dan penempatan objek 3D (kendaraan, pejalan kaki, pengendara sepeda) dari fusi data sensor RGB/LiDAR, estimasi pose objek (kepala/kendaraan/manusia/objek) dari gambar RGB tunggal, prediksi reaksi obat yang merugikan (ADR) berbasis deep learning untuk penggunaan obat klinik, konten yang dihasilkan oleh AI (AIGC), seperti (teks/audio/gambar) -to-(gambar/video), aplikasi perawatan lansia dari AIGC, estimasi detak jantung dari urutan gambar wajah. Selain itu, mahasiswa magang diharapkan memiliki pengetahuan awal tentang NN (jaringan saraf) atau deep learning dan terampil dalam pemrograman Python. Mereka akan belajar bagaimana menerapkan teknik deep learning terkini untuk memecahkan masalah yang diindikasikan."
14,"Apa fokus dari proyek P8 ""Silicon Photonics and Optical Biosensors""? ",Fokusnya adalah mengembangkan photodetektor berbasis silikon baru yang kompatibel dengan CMOS dan biosensor optik sekali pakai untuk deteksi biomedis yang cepat dan hemat biaya.,"['Category █ Scholarship\r\nIntern period At least 12 weeks between May 1 and December 31, 2024\r\n\r\nNumber P8\r\nProject title Silicon photonics and optical biosesnors\r\nDescription of the research\r\nThe topic is to develope (a) new types of silicon-based,\r\nCMOS compatible photodetectors, which have many\r\nadvantages over conventional III-V based counterparts for\r\nmid-infrared applications, (b) new disposable optical\r\nbiosensors for cost-effective and rapid biomedical\r\ndetection for precise medicine. This internship program is\r\nopen for talents who are interested in advanced\r\noptoelectronic-sensing technologies. Focus will be placed\r\non designing, simulating, and analyzing new Si-based\r\ngroup-IV photodetectors and optical biosensors. For\r\nrelated information, please refer to the website of our lab\r\nat https://ccuphotonics307.wixsite.com/ccuphotonics307\r\nMentor at CCU\r\nProf. Guo-En Chang\r\nDept. of Mechanical Engineering\r\nNational Chung Cheng University, Taiwan, ROC.\r\n(e-mail: imegec@ccu.edu.tw)', 'be placed on designing, simulating, and analyzing new optical\r\nmonitoring systems for metal additive systems. For related information,\r\nplease refer to the website of our lab at\r\nhttps://ccuphotonics307.wixsite.com/ccuphotonics307\r\nMentor at CCU\r\nProf. Guo-En Chang\r\nDept. of Mechanical Engineering\r\nNational Chung Cheng University, Taiwan, ROC.\r\n(e-mail: imegec@ccu.edu.tw)\r\nExpected student\r\nlevel\r\n█ Post-graduate student\r\n█ Third/forth-year undergraduate senior student\r\nCategory ■ Scholarship\r\nIntern period At least 8 weeks (up to 6 months) between May and December 2024\r\n\r\nNumber P10\r\nProject title\r\nEffect of operating conditions on the performance of an\r\nall-vanadium redox flow battery\r\nDescription of the research\r\nThe performance of the VRFB is influenced by operating\r\nconditions, such as electrolyte concentration and\r\nelectrolyte flow rate. Students will conduct experiments\r\nto investigate the effect of operating conditions on the\r\nperformance of the VRFB and determine a suitable', 'NBI) model. These models will be generated through a\r\nconversion algorithm referred to as the spectrum-aided\r\nvision enhancer (SAVE). The main goal will be to discover\r\nDysplasia and Squamous Cell Carcinoma (SCC). The\r\nevaluation of model performance will be conducted using the\r\ncreated confusion matrix and five important indicators:\r\nprecision, recall, F1-score, mAP, and the confusion matrix of\r\nthe trained model.\r\nMentor at CCU\r\nProf. Hsiang-Chen Wang\r\nDept. of Mechanical Engineering,\r\nNational Chung Cheng University, Taiwan, ROC.\r\n(e-mail: hcwang@ccu.edu.tw)\r\nExpected student level\r\n■ Post-graduate student\r\n■ Third/forth-year undergraduate senior student\r\nCategory ■ Scholarship\r\nIntern period At least 12 weeks between May and December 2024\r\n\r\nNumber P14\r\nProject title Stirling engines and their applications\r\nDescription of the\r\nresearch\r\nThe students will learn the research topics about Stirling\r\nengines and their applications in renewable energy,', ""Dipublikasikan tanggal 11 Januari 2024\nNo Bidang Study Program University\n17\nDigital / Information\nTechnologies\nMaster in Computer Vision (VIBOT)\nUniversité Bourgogne Franche-\nComté\n18\nDigital / Information\nTechnologies\nMaster in Physics & Computational Physics\n(CompuPhys)\nUniversité Bourgogne Franche-\nComté\n19 Energy\nMaster Solar Energy, Law, Economics and\nManagement (SoLEM)\nUniversité Savoie Mont Blanc\n20 Energy Master Nuclear Energy Université Paris-Saclay\n21 Energy Master Nuclear Energy Institut Polytechnique de Paris\n22 Energy\nMaster's Degree - Fundamental Physics:\nInternational Centre for Fundamental Physics\n(ICFP)\nUniversité Paris Cité\n23 Energy\nMaster MaNuEn - International master Program in\nMaterial Sciences for Nuclear Energy\nGrenoble INP - Université\nGrenoble Alpes\n24 Energy\nInternational Master's Degree in Transport and\nEnergy\nINSA Hauts-de-France -\nInstitut National des Sciences\nAppliquées""]","FOKUS dari proyek P8 ""Silicon Photonics and Optical Biosensors"" adalah pengembangan jenis baru fotodetektor berbasis silikon yang kompatibel dengan CMOS, serta pengembangan biosensor optik sekali pakai untuk deteksi biomedis yang hemat biaya dan cepat untuk pengobatan yang tepat. Proyek ini terbuka bagi bakat yang tertarik pada teknologi sensor optoelektronik canggih. Fokus utamanya adalah merancang, mensimulasikan, dan menganalisis fotodetektor grup-IV berbasis Si baru dan biosensor optik."
15,"Apa yang menjadi target penelitian dalam proyek P10 ""Effect of Operating Conditions on the Performance of an All-Vanadium Redox Flow Battery""?",Penelitian ini bertujuan untuk mempelajari efek kondisi operasi seperti konsentrasi elektrolit dan laju aliran elektrolit pada kinerja baterai aliran redoks vanadium.,"['Category\r\n■ Scholarship\r\n■ Self-supported\r\nIntern period At least 12 weeks between May 1 and December 31, 2024\r\n\r\nNumber P15\r\nProject title\r\nStudy of lithium ion battery, lithium sulfur battery,\r\nmetal-air battery, fuel cell and supercapacitor\r\nDescription of the\r\nresearch\r\nThe research will primarily concentrate on the study of\r\nelectrocatalysts and nanomaterials with the aim of\r\nexploring innovative applications in the realm of energy\r\nstorage. These applications encompass metal ion\r\nbatteries, metal-air batteries, fuel cells and\r\nsupercapacitors.\r\nMentor at CCU\r\nProf. Yuan-Yao Li\r\nDept. of Chemical Engineering\r\nNational Chung Cheng University, Taiwan, ROC.\r\n(e-mail: chmyyl@ccu.edu.tw)\r\nExpected student level\r\n■ Post-graduate student\r\n■ Third/forth-year undergraduate senior student\r\nCategory\r\n■ Scholarship\r\n■ Self-supported\r\nIntern period At least 8 weeks between 2024/5/1- 2024/12/31\r\n\r\nNumber P16\r\nProject title\r\nNext generation Wireless communication, B5G/6G,', 'plasma agriculture due to the generation of abundant\r\nreactive species being critical for manipulating reaction\r\npathways in different fields. Therefore, it is essential to\r\ncharacterize the densities of reactive species introduced\r\nby plasma jets in the liquid phase for various applications.\r\nIn this project, the densities of OH/NO2\r\n-/NO3\r\n- will be\r\nexplored by using the microplate reader\r\nspectrophotometer under different operating conditions\r\nto reveal the correlations among reactive species\r\ngenerated in the liquid phase and the discharge\r\nparameters. Anyone interested in plasma technology and\r\ncharacterization is welcome to join the project.\r\nMentor at CCU\r\nAssoc. Prof. Kun-Mo Lin\r\nDept. of, Mechanical Engineering\r\nNational Chung Cheng University, Taiwan, ROC.\r\n(e-mail: imekml@ccu.edu.tw; kmlin.tw@gmail.com)\r\nExpected student level\r\n■ Post-graduate student\r\n■ Third/forth-year undergraduate senior student\r\nCategory\r\n■ Scholarship\r\n■ Self-supported', 'fast discharge dynamics and complex plasma chemistry.\r\nAlternatively, numerical simulations can be used to\r\ncapture discharge dynamics with detailed chemistry\r\nrevealed. In this project, a two-dimensional axisymmetric\r\nplasma fluid model will be integrated with a two-\r\ndimensional axisymmetric gas flow model to predict the\r\ndynamic behavior of a helium atmospheric pressure\r\nplasma jet. The simulated results will be compared with\r\nphotos taken by an intensified CCD camera to validate the\r\nmodel. It is a topic involving thermofluid science, which is\r\nsuitable for students in mechanical engineering.\r\nMentor at CCU\r\nAssoc. Prof. Kun-Mo Lin\r\nDept. of, Mechanical Engineering\r\nNational Chung Cheng University, Taiwan, ROC.\r\n(e-mail: imekml@ccu.edu.tw; kmlin.tw@gmail.com)\r\nExpected student level\r\n■ Post-graduate student\r\n■ Third/forth-year undergraduate senior student\r\nCategory\r\n■ Scholarship\r\n■ Self-supported\r\nIntern period At least 8 weeks between May and December 2024\r\n\r\nNumber P13', 'Project title\r\nRenewable Energy Integration: Power System Analyses,\r\nPower Conversion or Intelligent Control\r\nDescription of the research\r\nThe students will learn the research topics about\r\nrenewable energy integration, which includes one of the\r\nfollowing issues:\r\n➢ Wind farm modeling and control\r\n➢ Fault diagnosis for solar power systems\r\n➢ Artificial intelligence applications on renewable\r\npower systems\r\n➢ Forecasting technologies for renewable power\r\nresources\r\n➢ Smart grid control and operation\r\n➢ Energy storage systems\r\n➢ Transmission and distribution system analyses\r\nMentor at CCU\r\nProf. Yuan-Kang Wu\r\nDept. of Electrical Engineering\r\nNational Chung Cheng University, Taiwan, ROC.\r\n(e-mail: allenwu@ccu.edu.tw)\r\nExpected student level\r\n█ Post-graduate student\r\n█ Third/forth-year undergraduate senior student\r\nCategory █ Scholarship\r\nIntern period At least 12 weeks between May 1 and December 31, 2024\r\n\r\nNumber P8\r\nProject title Silicon photonics and optical biosesnors']",TARGET PENELITIAN: Studi tentang pengaruh kondisi operasional terhadap kinerja dari baterai aliran redoks vanadium.
16,"Apa tujuan dari proyek P12 ""Numerical Modeling and Experiments of an Atmospheric Pressure Plasma Jet Operated in Air with Shielding Gas""?",Tujuan proyek ini adalah menggabungkan model plasma fluida dua dimensi axisimetrik dengan model aliran gas untuk memprediksi perilaku dinamis plasma jet tekanan atmosfer menggunakan gas helium.,"['(e-mail: imekml@ccu.edu.tw; kmlin.tw@gmail.com)\r\nExpected student level\r\n■ Post-graduate student\r\n■ Third/forth-year undergraduate senior student\r\nCategory\r\n■ Scholarship\r\n■ Self-supported\r\nIntern period At least 8 weeks between May and December 2024\r\n\r\nNumber P12\r\nProject title\r\nNumerical modeling and Experiments of an atmospheric\r\npressure plasma jet operated in air with shielding gas\r\nDescription of the research\r\nAtmospheric-pressure plasma jets have been developed\r\nextensively for applications such as plasma medicine and\r\nplasma agriculture due to the generation of abundant\r\nreactive species being critical for manipulating reaction\r\npathways in different fields. However, it is still challenging\r\nto develop a proper plasma source with controlled\r\nparameters by experimental measurements because of\r\nfast discharge dynamics and complex plasma chemistry.\r\nAlternatively, numerical simulations can be used to\r\ncapture discharge dynamics with detailed chemistry', 'fast discharge dynamics and complex plasma chemistry.\r\nAlternatively, numerical simulations can be used to\r\ncapture discharge dynamics with detailed chemistry\r\nrevealed. In this project, a two-dimensional axisymmetric\r\nplasma fluid model will be integrated with a two-\r\ndimensional axisymmetric gas flow model to predict the\r\ndynamic behavior of a helium atmospheric pressure\r\nplasma jet. The simulated results will be compared with\r\nphotos taken by an intensified CCD camera to validate the\r\nmodel. It is a topic involving thermofluid science, which is\r\nsuitable for students in mechanical engineering.\r\nMentor at CCU\r\nAssoc. Prof. Kun-Mo Lin\r\nDept. of, Mechanical Engineering\r\nNational Chung Cheng University, Taiwan, ROC.\r\n(e-mail: imekml@ccu.edu.tw; kmlin.tw@gmail.com)\r\nExpected student level\r\n■ Post-graduate student\r\n■ Third/forth-year undergraduate senior student\r\nCategory\r\n■ Scholarship\r\n■ Self-supported\r\nIntern period At least 8 weeks between May and December 2024\r\n\r\nNumber P13', 'plasma agriculture due to the generation of abundant\r\nreactive species being critical for manipulating reaction\r\npathways in different fields. Therefore, it is essential to\r\ncharacterize the densities of reactive species introduced\r\nby plasma jets in the liquid phase for various applications.\r\nIn this project, the densities of OH/NO2\r\n-/NO3\r\n- will be\r\nexplored by using the microplate reader\r\nspectrophotometer under different operating conditions\r\nto reveal the correlations among reactive species\r\ngenerated in the liquid phase and the discharge\r\nparameters. Anyone interested in plasma technology and\r\ncharacterization is welcome to join the project.\r\nMentor at CCU\r\nAssoc. Prof. Kun-Mo Lin\r\nDept. of, Mechanical Engineering\r\nNational Chung Cheng University, Taiwan, ROC.\r\n(e-mail: imekml@ccu.edu.tw; kmlin.tw@gmail.com)\r\nExpected student level\r\n■ Post-graduate student\r\n■ Third/forth-year undergraduate senior student\r\nCategory\r\n■ Scholarship\r\n■ Self-supported', 'Project title\r\nRenewable Energy Integration: Power System Analyses,\r\nPower Conversion or Intelligent Control\r\nDescription of the research\r\nThe students will learn the research topics about\r\nrenewable energy integration, which includes one of the\r\nfollowing issues:\r\n➢ Wind farm modeling and control\r\n➢ Fault diagnosis for solar power systems\r\n➢ Artificial intelligence applications on renewable\r\npower systems\r\n➢ Forecasting technologies for renewable power\r\nresources\r\n➢ Smart grid control and operation\r\n➢ Energy storage systems\r\n➢ Transmission and distribution system analyses\r\nMentor at CCU\r\nProf. Yuan-Kang Wu\r\nDept. of Electrical Engineering\r\nNational Chung Cheng University, Taiwan, ROC.\r\n(e-mail: allenwu@ccu.edu.tw)\r\nExpected student level\r\n█ Post-graduate student\r\n█ Third/forth-year undergraduate senior student\r\nCategory █ Scholarship\r\nIntern period At least 12 weeks between May 1 and December 31, 2024\r\n\r\nNumber P8\r\nProject title Silicon photonics and optical biosesnors']","Tujuan dari proyek P12 ""Numerical Modeling and Experiments of an Atmospheric Pressure Plasma Jet Operated in Air with Shielding Gas"" adalah untuk mengembangkan model numerik dua dimensi yang akan diintegrasikan dengan model aliran gas dua dimensi untuk memprediksi perilaku dinamis dari plasma jet tekanan atmosfer yang dioperasikan dengan helium. Hasil simulasi akan dibandingkan dengan foto yang diambil oleh kamera CCD yang diperkuat untuk memvalidasi model tersebut. Proyek ini bertujuan untuk memahami dinamika plasma dengan detail kimia yang terkait, dan cocok untuk mahasiswa teknik mesin."
17,"Proyek P13 ""Application of Novel Snap-shot based Hyperspectral Imaging Combined with AI to Detect Lesions"" menggunakan metode apa?","Proyek ini menggunakan model pembelajaran mesin seperti YOLOv5, YOLOv8, R-CNN, dan Faster R-CNN untuk mendeteksi kanker esofagus stadium awal menggunakan model gambar cahaya putih (WLI) dan gambar narrowband hiperspektral (HSI-NBI).","['■ Post-graduate student\r\n■ Third/forth-year undergraduate senior student\r\nCategory\r\n■ Scholarship\r\n■ Self-supported\r\nIntern period At least 8 weeks between May and December 2024\r\n\r\nNumber P13\r\nProject title\r\nApplication of Novel Snap-shot based hyperspectral imaging\r\ncombined with AI to detect Lesions\r\nDescription of the\r\nresearch\r\nThe early detection of esophageal cancer presents a\r\nconsiderable difficulty, which contributes to its high\r\nprevalence as a major cause of cancer-related fatalities. This\r\nproject will utilize various machine learning models, including\r\nYOLOv5, YOLOv8, R-CNN, and Faster R-CNN, to predict and\r\ndetect early-stage esophageal cancer. It will make use of two\r\nmodels of esophageal cancer images: the white-light images\r\n(WLI) model and the hyperspectral narrowband images (HSI-\r\nNBI) model. These models will be generated through a\r\nconversion algorithm referred to as the spectrum-aided\r\nvision enhancer (SAVE). The main goal will be to discover', 'NBI) model. These models will be generated through a\r\nconversion algorithm referred to as the spectrum-aided\r\nvision enhancer (SAVE). The main goal will be to discover\r\nDysplasia and Squamous Cell Carcinoma (SCC). The\r\nevaluation of model performance will be conducted using the\r\ncreated confusion matrix and five important indicators:\r\nprecision, recall, F1-score, mAP, and the confusion matrix of\r\nthe trained model.\r\nMentor at CCU\r\nProf. Hsiang-Chen Wang\r\nDept. of Mechanical Engineering,\r\nNational Chung Cheng University, Taiwan, ROC.\r\n(e-mail: hcwang@ccu.edu.tw)\r\nExpected student level\r\n■ Post-graduate student\r\n■ Third/forth-year undergraduate senior student\r\nCategory ■ Scholarship\r\nIntern period At least 12 weeks between May and December 2024\r\n\r\nNumber P14\r\nProject title Stirling engines and their applications\r\nDescription of the\r\nresearch\r\nThe students will learn the research topics about Stirling\r\nengines and their applications in renewable energy,', ""developing algorithms for sensor data calibration, point\r\ncloud processing and image processing to create a\r\ncomprehensive and accurate representation of the\r\nvehicle's surroundings. The primary objective is to develop\r\nand optimize algorithms for efficiently processing and\r\ninterpreting the multi-modality. This includes tasks such as\r\nsemantic segmentation, feature extraction, and object\r\nrecognition, all of which are pivotal for the accurate\r\nperception of the vehicle's surroundings.\r\nMentor at CCU\r\nAssoc. Prof. Jui-Chiu Chiang\r\nDept. of Electrical Engineering,\r\nNational Chung Cheng University, Taiwan, ROC.\r\n(E-mail: rachel@ccu.edu.tw)\r\nExpected student level █ Third/forth-year undergraduate senior student\r\nCategory\r\n█ Scholarship\r\n█ Self-supported\r\nIntern period At least 12 weeks between May 1st and Dec. 31th\r\n\r\nNumber P4\r\nProject title\r\nSimulation and Reconstruction of Pencil Beam Scanning of\r\nParticle Therapy\r\nDescription of the research"", 'techniques. In this research, you will learn deep learning\r\ntechniques such as CNN, RNN, LSTM, AE, VAE, etc. The\r\npossible applications and topics include: (1) 3D human\r\nskeleton extraction, (2) skeleton-based action\r\nrecognition/behavior modeling, (3) action prediction for\r\nelderly monitoring, (4) 3D object (vehicle, pedestrian,\r\ncyclist) detection and positioning from fusion of RGB/LiDAR\r\nsensor data, (5) object (head/vehicle/ human/object) pose\r\nestimation from single RGB image, (6) deep learning-based\r\nadverse drug reaction (ADR) prediction for clinic medicine\r\nuse, (7) AI-generated content (AIGC), such as\r\n(text/audio/image) -to-(image/video), (8) elderly caring\r\napplication of AIGC, (9) heart rate estimation from facial\r\nimage sequence. The intern student is expected to have\r\nsome preliminary knowledge on NN (neural network) or\r\ndeep learning and skilled in Python programming. He/She\r\nwill learn how to apply state-of-the-art deep learning']","Proyek P13 ""Application of Novel Snap-shot based Hyperspectral Imaging Combined with AI to Detect Lesions"" menggunakan berbagai model machine learning, termasuk YOLOv5, YOLOv8, R-CNN, dan Faster R-CNN, untuk memprediksi dan mendeteksi kanker esofagus pada tahap awal. Proyek ini juga menggunakan dua model gambar kanker esofagus: model gambar cahaya putih (WLI) dan model gambar hiperspektral narrowband (HSI-NBI). Model-model ini dihasilkan melalui algoritma konversi yang disebut sebagai spectrum-aided vision enhancer (SAVE). Tujuan utamanya adalah untuk menemukan Dysplasia dan Squamous Cell Carcinoma (SCC)."
18,"Apa yang akan dikembangkan dalam proyek P16 ""Next Generation Wireless Communication, B5G/6G, Reconfigurable Intelligent Surface, System Level Simulation, Artificial Intelligence-enhanced Wireless Research""? ","Proyek ini berfokus pada inovasi dan desain konsep-konsep canggih dan arsitektur di luar 5G dan 6G, mengidentifikasi dan memvalidasi solusi untuk masalah kunci melalui simulasi atau eksperimen prototipe, serta merancang algoritma, model, dan protokol baru untuk mengoptimalkan kinerja jaringan nirkabel.","['Category\r\n■ Scholarship\r\n■ Self-supported\r\nIntern period At least 8 weeks between 2024/5/1- 2024/12/31\r\n\r\nNumber P16\r\nProject title\r\nNext generation Wireless communication, B5G/6G,\r\nReconfigurable Intelligent Surface, System level\r\nsimulation, Artificial Intelligence-enhanced wireless\r\nresearch\r\nDescription of the\r\nresearch\r\nInnovate and design cutting-edge concepts and\r\narchitectures beyond 5G (B5G) and 6G.\r\nIdentify and validate solutions to key problems through\r\nsimulation or prototype experiments.\r\nConduct research on AI and machine learning\r\ntechniques applied to wireless communications and\r\nnetworks.\r\nDesign and implement novel algorithms, models, and\r\nprotocols to optimize wireless network performance.\r\nCollaborate with the research team to manage projects\r\nand ensure timely deliverables,\r\nPlease refer to the website of our lab at\r\nhttps://sites.google.com/view/ccuantlab/english\r\nMentor at CCU\r\nAssoc. Prof. Jen-Yi Pan\r\nDept. of Communications Engineering,', 'Dipublikasikan tanggal 11 Januari 2024\nNo Bidang Study Program University\n51 Material Sciences\nGraduate Programme Innovative Materials and\nEnergy Systems (Emat) - Master\nNantes Université\n52 Urban Planning Economics for Smart Cities and Climate Policy Institut Polytechnique de Paris\nPoin-Poin Surat Pernyataan pada Aplikasi Pendaftaran (Disetujui Saat Akan Melakukan Submit)\n1. Setia kepada Pancasila, Negara Kesatuan Republik Indonesia, dan UUD 1945.\n2. Tidak pernah, sedang, atau akan mendukung atau terlibat dalam gerakan, organisasi, atau ideologi\nyang bertentangan dan/atau berpotensi mengganggu tegaknya ideologi Pancasila, Undang-\nUndang Dasar 1945, dan Negara Kesatuan Republik Indonesia.\n3. Mendahulukan kepentingan Bangsa dan Negara Kesatuan Republik Indonesia di atas kepentingan\npribadi.\n4. Tidak akan berpindah kewarganegaraan sejak pendaftaran beasiswa sampai dengan selesainya\nmasa kontribusi sebagai alumni beasiswa LPDP.', 'Description of the research\r\nFour investigation topics over Ultra-Wideband Impulse\r\nRadar imaging system:\r\n1. A back-projection imaging algorithm used to\r\nreconstruct the radar image.\r\n2. The studies of the transmitting and receiving circuits\r\nand Vivaldi antenna array.\r\n3. mmWave/RF integrated circuit design such as PA and\r\nLNA, by CMOS process or III-V technology.\r\nEnergy harvesting within wireless communications\r\nenvironment\r\nMentor at CCU\r\nAssoc. Prof. Janne-Wha Wu\r\nDept. of, Electrical Engineering\r\nNational Chung Cheng University, Taiwan, ROC.\r\n(e-mail: jwwu@ccu.edu.tw)\r\nExpected student level\r\n■ Post-graduate student\r\n■ Third/forth-year undergraduate senior student\r\nCategory\r\n█ Scholarship\r\n█ Self-supported\r\nIntern period At least 10 weeks between May 1 and Dec. 31\r\n\r\nNumber P7\r\nProject title\r\nRenewable Energy Integration: Power System Analyses,\r\nPower Conversion or Intelligent Control\r\nDescription of the research\r\nThe students will learn the research topics about', 'Project title\r\nRenewable Energy Integration: Power System Analyses,\r\nPower Conversion or Intelligent Control\r\nDescription of the research\r\nThe students will learn the research topics about\r\nrenewable energy integration, which includes one of the\r\nfollowing issues:\r\n➢ Wind farm modeling and control\r\n➢ Fault diagnosis for solar power systems\r\n➢ Artificial intelligence applications on renewable\r\npower systems\r\n➢ Forecasting technologies for renewable power\r\nresources\r\n➢ Smart grid control and operation\r\n➢ Energy storage systems\r\n➢ Transmission and distribution system analyses\r\nMentor at CCU\r\nProf. Yuan-Kang Wu\r\nDept. of Electrical Engineering\r\nNational Chung Cheng University, Taiwan, ROC.\r\n(e-mail: allenwu@ccu.edu.tw)\r\nExpected student level\r\n█ Post-graduate student\r\n█ Third/forth-year undergraduate senior student\r\nCategory █ Scholarship\r\nIntern period At least 12 weeks between May 1 and December 31, 2024\r\n\r\nNumber P8\r\nProject title Silicon photonics and optical biosesnors']","Dalam proyek P16 ""Next Generation Wireless Communication, B5G/6G, Reconfigurable Intelligent Surface, System Level Simulation, Artificial Intelligence-enhanced Wireless Research"" akan dikembangkan konsep dan arsitektur terbaru di luar 5G (B5G) dan 6G. Selain itu, akan diidentifikasi dan divalidasi solusi untuk masalah kunci melalui simulasi atau eksperimen prototipe. Penelitian juga akan dilakukan pada teknik kecerdasan buatan dan pembelajaran mesin yang diterapkan pada komunikasi nirkabel dan jaringan. Selain itu, akan dirancang dan diimplementasikan algoritma, model, dan protokol baru untuk mengoptimalkan kinerja jaringan nirkabel. Kolaborasi dengan tim penelitian juga akan dilakukan untuk mengelola proyek dan memastikan pengiriman tepat waktu."
19,Bagaimana cara menghubungi penyelenggara program internship ini?,"Kontak dapat dilakukan melalui nomor +886-5-2720411 ext. 23003, 23005, atau email coleng_dia@ccu.edu.tw. Alamatnya adalah No.168, Sec. 1, University Rd., Minhsiung, Chiayi 621301, Taiwan (R.O.C.).","['application form, prepare\r\napplication materials, and send\r\nthem in a ZIP-compressed file to\r\ncoleng_dia@ccu.edu.tw.\r\n• The title of the e-mail please be\r\nmarked with “Application for 2024\r\nCCU/COE International Internship”.\r\nAll the intern research topics and\r\ntheir requirements are listed as\r\nfollows.\r\n• Application deadline: Mar. 3, 2024\r\n• More detailed information about\r\napplication can be found on the\r\nwebsite\r\nhttps://sites.google.com/view/ccu-\r\ncoe-internship/home\r\nCONTACT\r\n+886-5-2720411 ext. 23003, 23005\r\ncoleng_dia@ccu.edu.tw\r\nNo.168, Sec. 1, University Rd., Minhsiung,\r\nChiayi 621301, Taiwan (R.O.C.)\r\n\r\nINTERN RESEARCH TOPICS\r\nNumber P1\r\nProject title\r\nTrustable Artificial Intelligence for Critical Applications and\r\n6G Security\r\nDescription of the research\r\nArtificial Intelligence (AI) technologies, 6G networking,\r\nand quantum computing are the leading forces in\r\nbringing the world to an era of better intelligence and full', ""At least 8 weeks. Individual mentors may have a\r\ndifferent definition of intern period. For self-\r\nsupported interns, the period may not be limited\r\nas mentioned above. Please refer to each\r\nresearch topic for precise definitions.\r\nResearch topics are offered in two types:\r\n(A) Scholarship and (B) self-supported.\r\nFor type-A, CCU offers a scholarship covering\r\non-campus accommodation, a weekly stipend\r\n(NTD1,500), and airfare reimbursement\r\n(maximum NTD10,000). These are standard\r\nitems and numbers, and the total amount may\r\nbe amended by the project mentor based on\r\nthe program budget and the interns'\r\nperformance.\r\nFEES FEE-FREE. The program fee and registration\r\nfee will be provided by CoE.\r\n\r\nPROGRAM ELIGIBILITY\r\n• Graduate school students (master & PhD students)\r\n• University junior students (3rd year or above).\r\n• Those who already complete PhD degree are NOT eligible to apply.\r\n• Passport holders of People's Republic of China, Hong Kong, or Macau\r\nare NOT eligible to apply."", 'melampirkan surat usulan atau surat\nrekomendasi sekurang-kurangnya dari\npejabat setingkat eselon II yang membidangi\npembinaan/pengembangan SDM pada\nKementerian/Lembaga atau Pemerintah\nDaerah tempat pendaftar bekerja dengan\nketentuan;\na. mengusulkan atau merekomendasikan\npendaftar untuk mengikuti program\nBeasiswa LPDP; dan\nb. mencantumkan Nama Lengkap serta\nNomor Induk Pegawai (NIP) pendaftar.\n9. Bagi pendaftar yang merupakan PNS dengan\nstatus PNS dengan jabatan fungsional\nsebagai Peneliti/Perekayasa/Medis/\nParamedis/ Pendidik, mengunggah Surat\nKeputusan (SK) Jabatan Terakhir atau SK\nKenaikan Pangkat Terakhir atau sejenisnya\nyang menunjukkan bahwa pendaftar adalah\nPNS dengan jabatan fungsional sebagai\nPeneliti/Perekayasa/Medis/Paramedis/Pendi\ndik.\n10. Bagi pendaftar berstatus prajurit TNI di semua\nprogram beasiswa LPDP wajib melampirkan\nsurat usulan atau surat rekomendasi\nsekurang-kurangnya pejabat yang\nmembidangi pembinaan SDM pada Mabes\nTNI/ TNI AD/ TNI AL/ TNI AU untuk mengikuti', 'Program Master memberikan kesempatan bagi\npendaftar untuk dapat melakukan pendaftaran\npada Beasiswa Kemitraan LPDP – Campus\nFrance dan beasiswa Magister Luar Negeri\npada salah satu program:\n1. Beasiswa Afirmasi\na. Beasiswa Daerah Afirmasi\nb. Beasiswa Putra Putri Papua\nc. Beasiswa Penyandang Disabilitas\nd. Beasiswa Prasejahtera\n2. Beasiswa Targeted\na. Beasiswa PNS, TNI, POLRI\nb. Beasiswa Kewirausahaan\nc. Beasiswa Umum\na. Beasiswa Reguler\nb. Beasiswa Parsial\nBeasiswa Kemitraan LPDP - Campus France\nmerupakan beasiswa kerja sama antara LPDP dan\nPemerintah Perancis pada jenjang master untuk\nbidang prioritas pembangunan Indonesia sesuai\ndengan keahlian pengetahuan yang dimiliki oleh\nUniversitas di Perancis dalam rangka\nmenghasilkan pemimpin masa depan Indonesia\nyang kompeten di bidang tersebut.\nSiapakah Sasaran Beasiswa Prioritas\nLPDP – Campus France Program Master?\n1. Warga Negara Indonesia (WNI)\n2. PNS/TNI/POLRI\nSeperti Apa Skema Prioritas LPDP –\nCampus France Program Master?']","Anda dapat menghubungi penyelenggara program internship ini melalui email di coleng_dia@ccu.edu.tw atau melalui nomor telepon +886-5-2720411 ext. 23003 atau 23005. Alamat kantor mereka juga tertera di No.168, Sec. 1, University Rd., Minhsiung, Chiayi 621301, Taiwan (R.O.C.)."
