,question,ground_truth,contexts,answer
0,Apa tujuan dari Program Internship Internasional CCU/CoE 2024? ,"Tujuannya adalah untuk memberikan kesempatan bagi mahasiswa internasional untuk memahami lebih baik penelitian di bidang teknik dan teknologi di CCU, serta untuk mempraktikkan keterampilan mereka, memperoleh kompetensi baru, dan mengalami budaya yang berbeda.","['2024 CCU/CoE\r\nINTERNATIONAL INTERNSHIP PROGRAM\r\nCOLLEGE OF ENGINEERING (CoE)\r\nNATIONAL CHUNG CHENG UNIVERSITY\r\n\r\nContinuing the yearly internship program in engineering field, the College\r\nof Engineering (CoE) offers on-campus research internships for\r\ninternational university students in 2024.\r\nThis project-based program provides an opportunity to better understand\r\nCCU’s research in engineering and technology. Students may practice their\r\nskills in the projects, acquire new competence, and experience a different\r\nculture.\r\nIn Engineering Field\r\n2024 CCU/COE INTERNATIONAL\r\nINTERNSHIP PROGRAM\r\nINTERNPERIOD\r\nSCHOLARSHIP\r\nPROGRAM\r\nBENIFITS\r\nTo have an enjoyable and enriching\r\nexperience in academic study and exchange\r\ntheir ideas of research with CCU students.\r\nMay 1 –December 31, 2024\r\nAt least 8 weeks. Individual mentors may have a\r\ndifferent definition of intern period. For self-\r\nsupported interns, the period may not be limited\r\nas mentioned above. Please refer to each', 'Dipublikasikan tanggal 11 Januari 2024\nprogram beasiswa lain yang dipilih, sesuai\ndengan syarat dan ketentuan yang berlaku.\nApa saja komponen Dana yang diberikan?\n1. Dana Pendidikan\na. Tuition Fee\nb. Dana Pendaftaran\nc. Dana Tunjangan Buku\nd. Dana Penelitian Tesis\ne. Dana Seminar Internasional\nf. Dana Publikasi Jurnal Internasional\n2. Dana Pendukung\na. Dana Transportasi\nb. Dana Aplikasi Visa\nc. Dana Asuransi Kesehatan\nd. Dana Kedatangan\ne. Dana Hidup Bulanan\nf. Dana Lomba Internasional\ng. Dana keadaaan darurat (jika diperlukan)\nApa saja persyaratan umum pendaftaran\nBeasiswa Prioritas LPDP – Campus\nFrance Program Master?\nPersyaratan umum Beasiswa Prioritas LPDP –\nCampus France Program Master adalah sebagai\nberikut:\n1. Warga Negara Indonesia.\n2. Telah menyelesaikan studi program diploma\nempat (D4) atau sarjana (S1).\n3. Pendaftar yang telah menyelesaikan studi\nmagister (S2) tidak diizinkan mendaftar.\n4. Bagi pendaftar lulusan perguruan tinggi luar', 'Dipublikasikan tanggal 11 Januari 2024\n2. Memilih menu Beasiswa Prioritas.\n3. Melengkapi dan mengunggah semua\ndokumen yang dipersyaratkan pada aplikasi\npendaftaran.\n4. Pastikan melakukan submit aplikasi\npendaftaran untuk mendapatkan kode\nregistrasi/pendaftaran.\nApa saja tahapan dan jadwal Beasiswa\nPrioritas LPDP – Campus France Program\nMaster?\nProses Seleksi Beasiswa Prioritas LPDP –\nCampus France Program Master sebagai berikut:\n1. Seleksi Administrasi\n2. Seleksi Bakat Skolastik\n3. Seleksi Substansi\nTahapan Jadwal\nPendaftaran\n11 Januari – 12\nFebruari 2024\nSeleksi Administrasi\n15 – 28 Februari\n2024\nPengumuman Hasil\nSeleksi Administrasi\n1 Maret 2024\nPegajuan Sanggah Hasil\nSeleksi Administrasi\n2 - 3 Maret 2024\nPengumuman Hasil\nSanggah Seleksi\nAdministrasi\n14 Maret 2024\nSeleksi Bakat Skolastik\ndan Seleksi Substansi\n18 – 27 Maret\n2024\nShort Listed untuk\nKampus Tujuan\n3 April 2024\nLoA Unconditional dari\nKampus Tujuan\n27 Mei 2024\nPengumuman Hasil\nSeleksi Substansi\n10 Juni 2024', '2. GCA adalah program persiapan Study Abroad yang berlangsung selama 8 pertemuan selama 8 pekan dan diselenggarakan\nsatu kali setahun. Program ini sangat sesuai bagi mahasiswa yang ingin mempersiapkan diri secara mendalam. Sementara\nitu, GCW adalah program persiapan Study Abroad yang berlangsung selama 3 hari dan diadakan tiga kali dalam satu\nsemester. GCW lebih cocok bagi mahasiswa yang telah memiliki dasar pengetahuan. Untuk informasi lebih lanjut tentang\nprogram ini, silahkan membaca detil informasi di https://www.its.ac.id/international/its-goes-global/students/global-\ncompetencies-program/\n\n3. Sertifikat GCA/GCW tidak diwajibkan bagi mahasiswa yang mengikuti kegiatan Studi Ekskursi (SE), Short Program in-country,\nGPbL in-country, atau program internasionalisasi in-country lainnya yang diselenggarakan oleh ITS, serta program AIESEC,\nlomba internasional, dan lain sebagainya yang tidak membutuhkan rekomendasi dan dukungan dana dari ITS.']","Tujuan dari Program Internship Internasional CCU/CoE 2024 adalah untuk memberikan kesempatan kepada mahasiswa universitas internasional untuk memahami penelitian CCU dalam bidang teknik dan teknologi, serta untuk berlatih keterampilan dalam proyek-proyek, memperoleh kompetensi baru, dan mengalami budaya yang berbeda."
1,Kapan periode magang berlangsung?,"Periode magang berlangsung antara 1 Mei hingga 31 Desember 2024, minimal 8 minggu.","['empat (D4) atau sarjana (S1).\n3. Pendaftar yang telah menyelesaikan studi\nmagister (S2) tidak diizinkan mendaftar.\n4. Bagi pendaftar lulusan perguruan tinggi luar\nnegeri pada jenjang pendidikan sebelumnya,\nwajib melampirkan\na. hasil penyetaraan ijazah Kementerian\nPendidikan, Kebudayaan, Riset, dan\nTeknologi, melalui laman\nhttps://piln.kemdikbud.go.id/ atau dari\nKementerian Agama melalui laman\nhttps://diktis.kemenag.go.id/penyetaraan\nijazah/\nb. hasil konversi IPK dari Kementerian\nPendidikan, Kebudayaan, Riset, dan\nTeknologi, melalui laman\nhttps://piln.kemdikbud.go.id/ atau dari\nKementerian Agama melalui laman\nhttps://diktis.kemenag.go.id/penyetaraan\nijazah/\nc. tangkapan layar ajuan penyetaraan\nijazah dan/atau ajuan konversi IPK pada\nlaman Kementerian Pendidikan,\nKebudayaan, Riset, dan Teknologi atau\nKementerian Agama mengenai\npenyetaraan ijazah dan konversi IPK\nbagi pendaftar yang penyetaraan ijazah\ndan/atau konversi IPKnya belum terbit.\n5. Pendaftar yang sedang menempuh studi (on', '10. Tidak pernah menyelesaikan studi pada jenjang yang sama dengan jenjang studi yang dilamar.\n11. Bersedia untuk tidak bekerja selama masa studi, kecuali atas persetujuan LPDP.\n12. Kembali ke Indonesia dan berkontribusi di Indonesia selama 2 kali masa studi ditambah 1 tahun\nsetelah selesai studi.\n13. Sebagai pendaftar yang sedang menjalani studi (on going) bersedia untuk:\na. diwajibkan membuat dan menandatangani surat pengunduran diri yang ditujukan kepada\nPerguruan Tinggi atas program studi yang sedang ditempuh serta menyampaikan surat\ntersebut kepada LPDP paling lambat 2 (dua) pekan setelah diumumkan lulus seleksi\nsubstansi;\nb. diwajibkan menyerahkan surat pemberhentian resmi dari program studi atau perguruan tinggi\nsebelum penandatanganan surat pernyataan Penerima Beasiswa; dan\nc. diberhentikan beasiswanya apabila tidak memenuhi kewajiban pada huruf a atau b.\n14. Sebagai pendaftar Beasiswa LPDP program magister belum pernah menyelesaikan studi magister', 'Kementerian Agama mengenai\npenyetaraan ijazah dan konversi IPK\nbagi pendaftar yang penyetaraan ijazah\ndan/atau konversi IPKnya belum terbit.\n5. Pendaftar yang sedang menempuh studi (on\ngoing) dapat mendaftar dengan ketentuan\nberikut:\na. Mendaftar pada program studi dan/atau\nperguruan tinggi tujuan yang berbeda dari\nyang sedang ditempuh;\nb. Pendaftar yang lulus seleksi substansi\nwajib membuat dan menandatangani surat\npengunduran diri yang ditujukan kepada\nperguruan tinggi atas program studi yang\nsedang ditempuh serta menyampaikan\nsurat tersebut kepada LPDP paling lambat\n2 (dua) pekan setelah diumumkan lulus\nseleksi substansi.\nc. Pendaftar wajib untuk menyerahkan surat\npemberhentian resmi dari program studi\natau perguruan tinggi sebelum\npenandatanganan surat pernyataan\nPenerima Beasiswa.\nd. Bagi pendaftar yang lulus seleksi\nsubstansi dan tidak memenuhi ketentuan\ntersebut di atas, maka LPDP dapat\nmembatalkan statusnya sebagai Calon\nPenerima Beasiswa.', 'kemitraan/kerja sama beasiswa prioritas, maka tidak dapat berpindah program studi, perguruan\ntinggi, dan/atau program Beasiswa LPDP lainnya, atau kelulusan akan dibatalkan.\nDemikian surat pernyataan ini dibuat dengan sebenar-benarnya untuk dapat digunakan sebagaimana\nmestinya. Apabila saya melanggar dan tidak mematuhi surat pernyataan ini, saya bersedia menerima\nsanksi sesuai ketentuan yang berlaku.']",Saya tidak menemukan informasi mengenai periode magang dalam konteks yang diberikan.
2,Apa saja jenis beasiswa yang ditawarkan dalam program ini?,Program menawarkan dua jenis beasiswa: (A) Beasiswa dan (B) magang dengan biaya sendiri (self-supported).,"['Syarat dokumen mengikuti syarat program\nbeasiswa yang dipilih (mengacu pada Buku\nPanduan masing-masing program beasiswa).\nSeperti apa format Komitmen kembali ke\nIndonesia, rencana pasca studi, dan\nrencana kontribusi di Indonesia serta\nRencana Bisnis atau Rencana\nPengembangan Bisnis?\nKomitmen kembali ke Indonesia, rencana\npasca studi, dan rencana kontribusi di\nIndonesia (1500 – 2000 kata)\nDeskripsikan dalam tulisan secara jelas dan\nkonkret tentang tema di atas.', 'program beasiswa LPDP wajib melampirkan\nsurat usulan atau surat rekomendasi\nsekurang-kurangnya pejabat yang\nmembidangi pembinaan SDM pada Mabes\nTNI/ TNI AD/ TNI AL/ TNI AU untuk mengikuti\nprogram beasiswa LPDP yang ditujukan\nkepada LPDP.\n11. Bagi pendaftar berstatus anggota POLRI di\nsemua program beasiswa LPDP wajib\nmelampirkan surat usulan atau surat\nrekomendasi sekurang-kurangnya pejabat\nyang membidangi pembinaan SDM pada\nMabes POLRI untuk mengikuti program\nbeasiswa LPDP kepada LPDP pada saat\npendaftaran beasiswa LPDP.\n12. Memilih Perguruan Tinggi Tujuan dan\nprogram studi sesuai dengan ketentuan LPDP\n13. Beasiswa hanya diperuntukkan bagi kelas\nreguler atau kelas lain yang ditetapkan oleh\nLPDP, dan tidak diperuntukkan untuk kelas-\nkelas sebagai berikut:\na. Kelas eksekutif;\nb. Kelas khusus;\nc. Kelas karyawan;\nd. Kelas jarak jauh;\ne. Kelas yang diselenggarakan bukan di\nperguruan tinggi induk;\nf. Kelas internasional bagi pendaftar tujuan\nstudi dalam negeri;', 'kemitraan/kerja sama beasiswa prioritas, maka tidak dapat berpindah program studi, perguruan\ntinggi, dan/atau program Beasiswa LPDP lainnya, atau kelulusan akan dibatalkan.\nDemikian surat pernyataan ini dibuat dengan sebenar-benarnya untuk dapat digunakan sebagaimana\nmestinya. Apabila saya melanggar dan tidak mematuhi surat pernyataan ini, saya bersedia menerima\nsanksi sesuai ketentuan yang berlaku.', 'c. diberhentikan beasiswanya apabila tidak memenuhi kewajiban pada huruf a atau b.\n14. Sebagai pendaftar Beasiswa LPDP program magister belum pernah menyelesaikan studi magister\n(S2) atau sebagai pendaftar Beasiswa LPDP program doktor belum menyelesaikan studi doktor\n(S3).\n15. Sebagai CPNS, PNS, prajurit TNI, atau anggota POLRI, bersedia memenuhi ketentuan tugas\nbelajar dan mendapatkan surat izin mengikuti seleksi dari pejabat yang berwenang.\n16. Sebagai CPNS, PNS, prajurit TNI, atau anggota POLRI bersedia:']",Jenis beasiswa yang ditawarkan dalam program ini adalah beasiswa LPDP.
3,Apa saja manfaat dari Beasiswa Tipe-A? ,"Beasiswa Tipe-A mencakup akomodasi di kampus, tunjangan mingguan sebesar NTD 1,500, dan penggantian biaya tiket pesawat (maksimal NTD 10,000).","['Syarat dokumen mengikuti syarat program\nbeasiswa yang dipilih (mengacu pada Buku\nPanduan masing-masing program beasiswa).\nSeperti apa format Komitmen kembali ke\nIndonesia, rencana pasca studi, dan\nrencana kontribusi di Indonesia serta\nRencana Bisnis atau Rencana\nPengembangan Bisnis?\nKomitmen kembali ke Indonesia, rencana\npasca studi, dan rencana kontribusi di\nIndonesia (1500 – 2000 kata)\nDeskripsikan dalam tulisan secara jelas dan\nkonkret tentang tema di atas.', 'Penerima Beasiswa.\nd. Bagi pendaftar yang lulus seleksi\nsubstansi dan tidak memenuhi ketentuan\ntersebut di atas, maka LPDP dapat\nmembatalkan statusnya sebagai Calon\nPenerima Beasiswa.\ne. Bagi pendaftar yang menyelesaikan studi\ndan mendapat gelar sebelum\npengumuman seleksi substansi, maka\nLPDP dapat membatalkan statusnya\nsebagai Calon Penerima Beasiswa.\n6. Pendaftar yang pernah menempuh studi\nnamun tidak menyelesaikan studi pada\nprogram magister dapat mendaftar Beasiswa\nLPDP di jenjang studi yang sama, dibuktikan\ndengan melampirkan surat\npemberhentian/sejenisnya sebagai\nmahasiswa dari perguruan tinggi tersebut.\n7. Melampirkan surat rekomendasi sesuai\ndengan persyaratan masing-masing program\nyang diterbitkan paling lama 1 (satu) tahun di\nbulan yang sama dengan waktu pendaftaran', '✔\nSertifikat Bahasa Asing yang\ndipersyaratkan dan Masih\nBerlaku (Asli)\n✔\nSurat rekomendasi dari\nakademisi atau tokoh\nmasyarakat *)\n✔ ✔\nSurat usulan dari pejabat\nyang membidangi SDM untuk\npendaftar PNS/TNI/POLRI\nsesuai ketentuan\n✔\nSurat pernyataan pada\naplikasi pendaftaran saat\n✔\nDokumen\nOnline\nForm\nUnggah\nakan melakukan submit\n(poin-poin terlampir)\nProfil diri pada formulir\npendaftaran online\n✔\nKomitmen kembali ke\nIndonesia, rencana pasca\nstudi, dan rencana kontribusi\ndi Indonesia.\n✔\nPublikasi ilmiah, prestasi\nkejuaraan/non kejuaraan,\ndan pengalaman organisasi.\n✔\nSK Jabatan terakhir bagi\nPNS\nPeneliti/Perekayasa/Medis/\nParamedis/Pendidik\n✔\n*) Surat harus diterbitkan paling lama 1 (satu)\ntahun di bulan yang sama dengan waktu\npendaftaran beasiswa\n2. Syarat dokumen program beasiswa lain\nSyarat dokumen mengikuti syarat program\nbeasiswa yang dipilih (mengacu pada Buku\nPanduan masing-masing program beasiswa).\nSeperti apa format Komitmen kembali ke\nIndonesia, rencana pasca studi, dan', 'Kementerian Agama mengenai\npenyetaraan ijazah dan konversi IPK\nbagi pendaftar yang penyetaraan ijazah\ndan/atau konversi IPKnya belum terbit.\n5. Pendaftar yang sedang menempuh studi (on\ngoing) dapat mendaftar dengan ketentuan\nberikut:\na. Mendaftar pada program studi dan/atau\nperguruan tinggi tujuan yang berbeda dari\nyang sedang ditempuh;\nb. Pendaftar yang lulus seleksi substansi\nwajib membuat dan menandatangani surat\npengunduran diri yang ditujukan kepada\nperguruan tinggi atas program studi yang\nsedang ditempuh serta menyampaikan\nsurat tersebut kepada LPDP paling lambat\n2 (dua) pekan setelah diumumkan lulus\nseleksi substansi.\nc. Pendaftar wajib untuk menyerahkan surat\npemberhentian resmi dari program studi\natau perguruan tinggi sebelum\npenandatanganan surat pernyataan\nPenerima Beasiswa.\nd. Bagi pendaftar yang lulus seleksi\nsubstansi dan tidak memenuhi ketentuan\ntersebut di atas, maka LPDP dapat\nmembatalkan statusnya sebagai Calon\nPenerima Beasiswa.']",Saya tidak tahu.
4,Siapa yang memenuhi syarat untuk mendaftar program ini?,Program ini terbuka untuk mahasiswa pascasarjana (S2/S3) dan mahasiswa tahun ketiga atau lebih tinggi. Mahasiswa yang sudah menyelesaikan gelar PhD tidak memenuhi syarat.,"['1. Setiap mahasiswa ITS yang ingin mendaftar program internasional di perguruan tinggi mitra ITS luar negeri yang\nmembutuhkan surat rekomendasi atau dana dukungan dari ITS di antaranya IISMA/IISMA-Vo, pertukaran pelajar (exchange),\nlab-internship, short program, atau program lain di luar negeri, diharuskan memiliki sertifikat Global Competency\nWorkshop (GCW) atau Global Competency Academy (GCA). Sertifikat ini hanya bisa diperoleh dengan mengikuti program\nGCW atau GCA.', 'c. diberhentikan beasiswanya apabila tidak memenuhi kewajiban pada huruf a atau b.\n14. Sebagai pendaftar Beasiswa LPDP program magister belum pernah menyelesaikan studi magister\n(S2) atau sebagai pendaftar Beasiswa LPDP program doktor belum menyelesaikan studi doktor\n(S3).\n15. Sebagai CPNS, PNS, prajurit TNI, atau anggota POLRI, bersedia memenuhi ketentuan tugas\nbelajar dan mendapatkan surat izin mengikuti seleksi dari pejabat yang berwenang.\n16. Sebagai CPNS, PNS, prajurit TNI, atau anggota POLRI bersedia:', 'jenjang sebelumnya; dan/atau\nd. Persyaratan tambahan lain yang tidak\nberisiko mengubah status diterimanya\norang tersebut sebagai mahasiswa pada\nprogram studi yang dituju.\n4. Pendaftar Beasiswa LPDP yang melampirkan\nLoA dengan waktu mulai studi yang tidak\nsesuai dengan ketentuan LPDP wajib\nmelampirkan surat keterangan penundaan\njadwal perkuliahan program studi dari\nPerguruan Tinggi yang diunggah bersamaan\ndengan LoA.\n5. Bagi pendaftar Beasiswa LPDP dengan\nskema double degree/joint degree dapat\nmelampirkan LoA dari Perguruan Tinggi Luar\nNegeri dan/atau Perguruan Tinggi Dalam\nNegeri yang menyatakan program double\ndegree/joint degree.\n6. Jika pendaftar mengunggah LoA\nUnconditional yang tidak sesuai ketentuan\nLPDP, maka dianggap tidak memenuhi\nkriteria pendaftaran.\nBagaimana Cara Mendaftar Beasiswa\nLPDP?\n1. Mendaftar secara online pada situs\nPendaftaran Beasiswa LPDP:\nhttps://beasiswalpdp.kemenkeu.go.id/', 'Dipublikasikan tanggal 11 Januari 2024\n1. Beasiswa hanya untuk Program Master\nsesuai daftar progam studi dan universitas\nterlampir.\n2. Pendaftar diharuskan melakukan pendaftaran\npada:\na. universitas sesuai jadwal dan ketentuan\nyang berlaku di Perguruan Tinggi; dan\nb. Campus France sesuai jadwal dan\nketentuan yang berlaku di Campus\nFrance.\n3. Memenuhi ketentuan batas usia pendaftar\npada 31 Desember di tahun pendaftaran\nsebagai berikut:\na. Pendaftar non CPNS/PNS paling tinggi\nberusia 35 (tiga puluh lima) tahun.\nb. Pendaftar Pegawai Sipil Negara (PNS)\npaling tinggi berusia 37 (tiga puluh tujuh)\ntahun\nc. Pendaftar Pegawai Sipil Negara (PNS)\ndengan jabatan fungsional sebagai\nPeneliti/Perekayasa/Medis/Paramedis/\nPendidik paling tinggi 42 (empat puluh\ndua) tahun.\nd. Pendaftar Prajurit TNI atau anggota\nPOLRI paling tinggi 40 (empat puluh)\ntahun.\n4. Mengunggah dokumen Indeks Prestasi\nKumulatif (IPK) dengan ketentuan Indeks\nPrestasi Kumulatif (IPK) pada jenjang studi']","Untuk dapat mendaftar program internasional di perguruan tinggi mitra ITS luar negeri yang membutuhkan surat rekomendasi atau dana dukungan dari ITS, mahasiswa ITS harus memiliki sertifikat Global Competency Workshop (GCW) atau Global Competency Academy (GCA). Selain itu, mahasiswa juga harus memenuhi persyaratan yang ditetapkan oleh LPDP, seperti batas usia pendaftar dan dokumen Indeks Prestasi Kumulatif (IPK) sesuai dengan ketentuan yang berlaku."
5,Apa persyaratan dokumen yang harus disiapkan untuk pendaftaran?,"Dokumen yang diperlukan meliputi: formulir aplikasi online, CV, transkrip resmi, surat rekomendasi, sertifikat kemampuan bahasa, rencana penelitian, salinan paspor, foto head-shot, dan dokumen tambahan opsional.","['Syarat dokumen mengikuti syarat program\nbeasiswa yang dipilih (mengacu pada Buku\nPanduan masing-masing program beasiswa).\nSeperti apa format Komitmen kembali ke\nIndonesia, rencana pasca studi, dan\nrencana kontribusi di Indonesia serta\nRencana Bisnis atau Rencana\nPengembangan Bisnis?\nKomitmen kembali ke Indonesia, rencana\npasca studi, dan rencana kontribusi di\nIndonesia (1500 – 2000 kata)\nDeskripsikan dalam tulisan secara jelas dan\nkonkret tentang tema di atas.', '✔\nSertifikat Bahasa Asing yang\ndipersyaratkan dan Masih\nBerlaku (Asli)\n✔\nSurat rekomendasi dari\nakademisi atau tokoh\nmasyarakat *)\n✔ ✔\nSurat usulan dari pejabat\nyang membidangi SDM untuk\npendaftar PNS/TNI/POLRI\nsesuai ketentuan\n✔\nSurat pernyataan pada\naplikasi pendaftaran saat\n✔\nDokumen\nOnline\nForm\nUnggah\nakan melakukan submit\n(poin-poin terlampir)\nProfil diri pada formulir\npendaftaran online\n✔\nKomitmen kembali ke\nIndonesia, rencana pasca\nstudi, dan rencana kontribusi\ndi Indonesia.\n✔\nPublikasi ilmiah, prestasi\nkejuaraan/non kejuaraan,\ndan pengalaman organisasi.\n✔\nSK Jabatan terakhir bagi\nPNS\nPeneliti/Perekayasa/Medis/\nParamedis/Pendidik\n✔\n*) Surat harus diterbitkan paling lama 1 (satu)\ntahun di bulan yang sama dengan waktu\npendaftaran beasiswa\n2. Syarat dokumen program beasiswa lain\nSyarat dokumen mengikuti syarat program\nbeasiswa yang dipilih (mengacu pada Buku\nPanduan masing-masing program beasiswa).\nSeperti apa format Komitmen kembali ke\nIndonesia, rencana pasca studi, dan', 'kemitraan/kerja sama beasiswa prioritas, maka tidak dapat berpindah program studi, perguruan\ntinggi, dan/atau program Beasiswa LPDP lainnya, atau kelulusan akan dibatalkan.\nDemikian surat pernyataan ini dibuat dengan sebenar-benarnya untuk dapat digunakan sebagaimana\nmestinya. Apabila saya melanggar dan tidak mematuhi surat pernyataan ini, saya bersedia menerima\nsanksi sesuai ketentuan yang berlaku.', 'pribadi.\n4. Tidak akan berpindah kewarganegaraan sejak pendaftaran beasiswa sampai dengan selesainya\nmasa kontribusi sebagai alumni beasiswa LPDP.\n5. Tidak akan menerima beasiswa untuk studi dengan jenjang bergelar dari sumber lain yang\nberpotensi double funding apabila ditetapkan sebagai Penerima Beasiswa.\n6. Tidak menggunakan media informasi dan media sosial untuk menyampaikan informasi yang belum\nterkonfirmasi kebenarannya yang berpotensi menimbulkan konflik di kalangan masyarakat.\n7. Tidak pernah, sedang, atau akan terlibat dalam aktivitas atau tindakan yang melanggar hukum dan\nnorma sosial masyarakat Indonesia.\n8. Tidak pernah, sedang, atau akan terlibat dalam tindak pidana apapun.\n9. Tidak pernah, sedang, atau akan melakukan tindakan terkait dengan penggunaan atau\npengedaran zat adiktif atau narkoba.\n10. Tidak pernah menyelesaikan studi pada jenjang yang sama dengan jenjang studi yang dilamar.\n11. Bersedia untuk tidak bekerja selama masa studi, kecuali atas persetujuan LPDP.']","Untuk pendaftaran, persyaratan dokumen yang harus disiapkan meliputi:
1. Sertifikat Bahasa Asing yang diperlukan dan masih berlaku (Asli)
2. Surat rekomendasi dari akademisi atau tokoh masyarakat
3. Surat usulan dari pejabat yang membidangi SDM untuk pendaftar PNS/TNI/POLRI sesuai ketentuan
4. Surat pernyataan pada aplikasi pendaftaran saat melakukan submit
5. Profil diri pada formulir pendaftaran online
6. Komitmen kembali ke Indonesia, rencana pasca studi, dan rencana kontribusi di Indonesia
7. Publikasi ilmiah, prestasi kejuaraan/non kejuaraan, dan pengalaman organisasi
8. SK Jabatan terakhir bagi PNS
9. Surat rekomendasi harus diterbitkan paling lama 1 (satu) tahun di bulan yang sama dengan waktu pendaftaran beasiswa

Selain itu, syarat dokumen juga harus mengikuti syarat program beasiswa yang dipilih sesuai dengan buku panduan masing-masing program beasiswa."
6,Bagaimana cara mengajukan aplikasi untuk program ini?,"Pelamar harus membaca persyaratan setiap topik penelitian dengan cermat, melengkapi formulir aplikasi online, menyiapkan dokumen aplikasi, dan mengirim semuanya dalam file ZIP ke coleng_dia@ccu.edu.tw dengan subjek email “Application for 2024 CCU/COE International Internship”.","['kemitraan/kerja sama beasiswa prioritas, maka tidak dapat berpindah program studi, perguruan\ntinggi, dan/atau program Beasiswa LPDP lainnya, atau kelulusan akan dibatalkan.\nDemikian surat pernyataan ini dibuat dengan sebenar-benarnya untuk dapat digunakan sebagaimana\nmestinya. Apabila saya melanggar dan tidak mematuhi surat pernyataan ini, saya bersedia menerima\nsanksi sesuai ketentuan yang berlaku.', '1. Setiap mahasiswa ITS yang ingin mendaftar program internasional di perguruan tinggi mitra ITS luar negeri yang\nmembutuhkan surat rekomendasi atau dana dukungan dari ITS di antaranya IISMA/IISMA-Vo, pertukaran pelajar (exchange),\nlab-internship, short program, atau program lain di luar negeri, diharuskan memiliki sertifikat Global Competency\nWorkshop (GCW) atau Global Competency Academy (GCA). Sertifikat ini hanya bisa diperoleh dengan mengikuti program\nGCW atau GCA.', '10. Tidak pernah menyelesaikan studi pada jenjang yang sama dengan jenjang studi yang dilamar.\n11. Bersedia untuk tidak bekerja selama masa studi, kecuali atas persetujuan LPDP.\n12. Kembali ke Indonesia dan berkontribusi di Indonesia selama 2 kali masa studi ditambah 1 tahun\nsetelah selesai studi.\n13. Sebagai pendaftar yang sedang menjalani studi (on going) bersedia untuk:\na. diwajibkan membuat dan menandatangani surat pengunduran diri yang ditujukan kepada\nPerguruan Tinggi atas program studi yang sedang ditempuh serta menyampaikan surat\ntersebut kepada LPDP paling lambat 2 (dua) pekan setelah diumumkan lulus seleksi\nsubstansi;\nb. diwajibkan menyerahkan surat pemberhentian resmi dari program studi atau perguruan tinggi\nsebelum penandatanganan surat pernyataan Penerima Beasiswa; dan\nc. diberhentikan beasiswanya apabila tidak memenuhi kewajiban pada huruf a atau b.\n14. Sebagai pendaftar Beasiswa LPDP program magister belum pernah menyelesaikan studi magister', 'Dipublikasikan tanggal 11 Januari 2024\nprogram beasiswa lain yang dipilih, sesuai\ndengan syarat dan ketentuan yang berlaku.\nApa saja komponen Dana yang diberikan?\n1. Dana Pendidikan\na. Tuition Fee\nb. Dana Pendaftaran\nc. Dana Tunjangan Buku\nd. Dana Penelitian Tesis\ne. Dana Seminar Internasional\nf. Dana Publikasi Jurnal Internasional\n2. Dana Pendukung\na. Dana Transportasi\nb. Dana Aplikasi Visa\nc. Dana Asuransi Kesehatan\nd. Dana Kedatangan\ne. Dana Hidup Bulanan\nf. Dana Lomba Internasional\ng. Dana keadaaan darurat (jika diperlukan)\nApa saja persyaratan umum pendaftaran\nBeasiswa Prioritas LPDP – Campus\nFrance Program Master?\nPersyaratan umum Beasiswa Prioritas LPDP –\nCampus France Program Master adalah sebagai\nberikut:\n1. Warga Negara Indonesia.\n2. Telah menyelesaikan studi program diploma\nempat (D4) atau sarjana (S1).\n3. Pendaftar yang telah menyelesaikan studi\nmagister (S2) tidak diizinkan mendaftar.\n4. Bagi pendaftar lulusan perguruan tinggi luar']","Untuk mengajukan aplikasi untuk program Beasiswa Prioritas LPDP - Campus France 2024 S1, Anda perlu memenuhi persyaratan umum yang telah ditetapkan, seperti menjadi Warga Negara Indonesia, telah menyelesaikan studi program diploma empat (D4) atau sarjana (S1), dan belum menyelesaikan studi magister (S2). Selain itu, Anda juga perlu memperhatikan komponen Dana yang diberikan, seperti Dana Pendidikan (Tuition Fee, Dana Pendaftaran, Dana Tunjangan Buku, Dana Penelitian Tesis, Dana Seminar Internasional, Dana Publikasi Jurnal Internasional) dan Dana Pendukung (Dana Transportasi, Dana Aplikasi Visa, Dana Asuransi Kesehatan, Dana Kedatangan, Dana Hidup Bulanan, Dana Lomba Internasional, Dana keadaaan darurat).

Setelah memastikan bahwa Anda memenuhi persyaratan dan memahami komponen Dana yang diberikan, Anda dapat mengajukan aplikasi dengan mengikuti prosedur yang telah ditentukan oleh pihak penyelenggara. Pastikan untuk mematuhi semua ketentuan yang berlaku dan mengikuti petunjuk yang diberikan dalam pengumuman resmi program Beasiswa Prioritas LPDP - Campus France 2024 S1."
7,Apa tenggat waktu penyerahan aplikasi? ,Tenggat waktu penyerahan aplikasi adalah 3 Maret 2024.,"['Syarat dokumen mengikuti syarat program\nbeasiswa yang dipilih (mengacu pada Buku\nPanduan masing-masing program beasiswa).\nSeperti apa format Komitmen kembali ke\nIndonesia, rencana pasca studi, dan\nrencana kontribusi di Indonesia serta\nRencana Bisnis atau Rencana\nPengembangan Bisnis?\nKomitmen kembali ke Indonesia, rencana\npasca studi, dan rencana kontribusi di\nIndonesia (1500 – 2000 kata)\nDeskripsikan dalam tulisan secara jelas dan\nkonkret tentang tema di atas.', '✔\nSertifikat Bahasa Asing yang\ndipersyaratkan dan Masih\nBerlaku (Asli)\n✔\nSurat rekomendasi dari\nakademisi atau tokoh\nmasyarakat *)\n✔ ✔\nSurat usulan dari pejabat\nyang membidangi SDM untuk\npendaftar PNS/TNI/POLRI\nsesuai ketentuan\n✔\nSurat pernyataan pada\naplikasi pendaftaran saat\n✔\nDokumen\nOnline\nForm\nUnggah\nakan melakukan submit\n(poin-poin terlampir)\nProfil diri pada formulir\npendaftaran online\n✔\nKomitmen kembali ke\nIndonesia, rencana pasca\nstudi, dan rencana kontribusi\ndi Indonesia.\n✔\nPublikasi ilmiah, prestasi\nkejuaraan/non kejuaraan,\ndan pengalaman organisasi.\n✔\nSK Jabatan terakhir bagi\nPNS\nPeneliti/Perekayasa/Medis/\nParamedis/Pendidik\n✔\n*) Surat harus diterbitkan paling lama 1 (satu)\ntahun di bulan yang sama dengan waktu\npendaftaran beasiswa\n2. Syarat dokumen program beasiswa lain\nSyarat dokumen mengikuti syarat program\nbeasiswa yang dipilih (mengacu pada Buku\nPanduan masing-masing program beasiswa).\nSeperti apa format Komitmen kembali ke\nIndonesia, rencana pasca studi, dan', 'pribadi.\n4. Tidak akan berpindah kewarganegaraan sejak pendaftaran beasiswa sampai dengan selesainya\nmasa kontribusi sebagai alumni beasiswa LPDP.\n5. Tidak akan menerima beasiswa untuk studi dengan jenjang bergelar dari sumber lain yang\nberpotensi double funding apabila ditetapkan sebagai Penerima Beasiswa.\n6. Tidak menggunakan media informasi dan media sosial untuk menyampaikan informasi yang belum\nterkonfirmasi kebenarannya yang berpotensi menimbulkan konflik di kalangan masyarakat.\n7. Tidak pernah, sedang, atau akan terlibat dalam aktivitas atau tindakan yang melanggar hukum dan\nnorma sosial masyarakat Indonesia.\n8. Tidak pernah, sedang, atau akan terlibat dalam tindak pidana apapun.\n9. Tidak pernah, sedang, atau akan melakukan tindakan terkait dengan penggunaan atau\npengedaran zat adiktif atau narkoba.\n10. Tidak pernah menyelesaikan studi pada jenjang yang sama dengan jenjang studi yang dilamar.\n11. Bersedia untuk tidak bekerja selama masa studi, kecuali atas persetujuan LPDP.', 'Penerima Beasiswa.\nd. Bagi pendaftar yang lulus seleksi\nsubstansi dan tidak memenuhi ketentuan\ntersebut di atas, maka LPDP dapat\nmembatalkan statusnya sebagai Calon\nPenerima Beasiswa.\ne. Bagi pendaftar yang menyelesaikan studi\ndan mendapat gelar sebelum\npengumuman seleksi substansi, maka\nLPDP dapat membatalkan statusnya\nsebagai Calon Penerima Beasiswa.\n6. Pendaftar yang pernah menempuh studi\nnamun tidak menyelesaikan studi pada\nprogram magister dapat mendaftar Beasiswa\nLPDP di jenjang studi yang sama, dibuktikan\ndengan melampirkan surat\npemberhentian/sejenisnya sebagai\nmahasiswa dari perguruan tinggi tersebut.\n7. Melampirkan surat rekomendasi sesuai\ndengan persyaratan masing-masing program\nyang diterbitkan paling lama 1 (satu) tahun di\nbulan yang sama dengan waktu pendaftaran']","Tenggat waktu penyerahan aplikasi tidak disebutkan dalam konteks yang diberikan. Oleh karena itu, saya tidak dapat memberikan informasi mengenai tenggat waktu penyerahan aplikasi."
8,Proyek apa saja yang tersedia dalam program ini?,"Terdapat berbagai proyek, termasuk ""Trustable Artificial Intelligence for Critical Applications and 6G Security,"" ""Grid-Forming and Grid-Following Inverter-based Resources for Low-Inertia Microgrid/Grid,"" dan banyak lagi.","['Syarat dokumen mengikuti syarat program\nbeasiswa yang dipilih (mengacu pada Buku\nPanduan masing-masing program beasiswa).\nSeperti apa format Komitmen kembali ke\nIndonesia, rencana pasca studi, dan\nrencana kontribusi di Indonesia serta\nRencana Bisnis atau Rencana\nPengembangan Bisnis?\nKomitmen kembali ke Indonesia, rencana\npasca studi, dan rencana kontribusi di\nIndonesia (1500 – 2000 kata)\nDeskripsikan dalam tulisan secara jelas dan\nkonkret tentang tema di atas.', 'program beasiswa LPDP wajib melampirkan\nsurat usulan atau surat rekomendasi\nsekurang-kurangnya pejabat yang\nmembidangi pembinaan SDM pada Mabes\nTNI/ TNI AD/ TNI AL/ TNI AU untuk mengikuti\nprogram beasiswa LPDP yang ditujukan\nkepada LPDP.\n11. Bagi pendaftar berstatus anggota POLRI di\nsemua program beasiswa LPDP wajib\nmelampirkan surat usulan atau surat\nrekomendasi sekurang-kurangnya pejabat\nyang membidangi pembinaan SDM pada\nMabes POLRI untuk mengikuti program\nbeasiswa LPDP kepada LPDP pada saat\npendaftaran beasiswa LPDP.\n12. Memilih Perguruan Tinggi Tujuan dan\nprogram studi sesuai dengan ketentuan LPDP\n13. Beasiswa hanya diperuntukkan bagi kelas\nreguler atau kelas lain yang ditetapkan oleh\nLPDP, dan tidak diperuntukkan untuk kelas-\nkelas sebagai berikut:\na. Kelas eksekutif;\nb. Kelas khusus;\nc. Kelas karyawan;\nd. Kelas jarak jauh;\ne. Kelas yang diselenggarakan bukan di\nperguruan tinggi induk;\nf. Kelas internasional bagi pendaftar tujuan\nstudi dalam negeri;', '✔\nSertifikat Bahasa Asing yang\ndipersyaratkan dan Masih\nBerlaku (Asli)\n✔\nSurat rekomendasi dari\nakademisi atau tokoh\nmasyarakat *)\n✔ ✔\nSurat usulan dari pejabat\nyang membidangi SDM untuk\npendaftar PNS/TNI/POLRI\nsesuai ketentuan\n✔\nSurat pernyataan pada\naplikasi pendaftaran saat\n✔\nDokumen\nOnline\nForm\nUnggah\nakan melakukan submit\n(poin-poin terlampir)\nProfil diri pada formulir\npendaftaran online\n✔\nKomitmen kembali ke\nIndonesia, rencana pasca\nstudi, dan rencana kontribusi\ndi Indonesia.\n✔\nPublikasi ilmiah, prestasi\nkejuaraan/non kejuaraan,\ndan pengalaman organisasi.\n✔\nSK Jabatan terakhir bagi\nPNS\nPeneliti/Perekayasa/Medis/\nParamedis/Pendidik\n✔\n*) Surat harus diterbitkan paling lama 1 (satu)\ntahun di bulan yang sama dengan waktu\npendaftaran beasiswa\n2. Syarat dokumen program beasiswa lain\nSyarat dokumen mengikuti syarat program\nbeasiswa yang dipilih (mengacu pada Buku\nPanduan masing-masing program beasiswa).\nSeperti apa format Komitmen kembali ke\nIndonesia, rencana pasca studi, dan', 'kemitraan/kerja sama beasiswa prioritas, maka tidak dapat berpindah program studi, perguruan\ntinggi, dan/atau program Beasiswa LPDP lainnya, atau kelulusan akan dibatalkan.\nDemikian surat pernyataan ini dibuat dengan sebenar-benarnya untuk dapat digunakan sebagaimana\nmestinya. Apabila saya melanggar dan tidak mematuhi surat pernyataan ini, saya bersedia menerima\nsanksi sesuai ketentuan yang berlaku.']",Saya tidak menemukan informasi tentang proyek yang tersedia dalam program ini dalam konteks yang diberikan.
9,"Siapa mentor yang terlibat dalam proyek P1 ""Trustable Artificial Intelligence for Critical Applications and 6G Security""?","Mentor untuk proyek ini adalah Asst. Prof. Van-Linh Nguyen dari Dept. of Computer Science and Information Engineering, CCU.","['application form, prepare\r\napplication materials, and send\r\nthem in a ZIP-compressed file to\r\ncoleng_dia@ccu.edu.tw.\r\n• The title of the e-mail please be\r\nmarked with “Application for 2024\r\nCCU/COE International Internship”.\r\nAll the intern research topics and\r\ntheir requirements are listed as\r\nfollows.\r\n• Application deadline: Mar. 3, 2024\r\n• More detailed information about\r\napplication can be found on the\r\nwebsite\r\nhttps://sites.google.com/view/ccu-\r\ncoe-internship/home\r\nCONTACT\r\n+886-5-2720411 ext. 23003, 23005\r\ncoleng_dia@ccu.edu.tw\r\nNo.168, Sec. 1, University Rd., Minhsiung,\r\nChiayi 621301, Taiwan (R.O.C.)\r\n\r\nINTERN RESEARCH TOPICS\r\nNumber P1\r\nProject title\r\nTrustable Artificial Intelligence for Critical Applications and\r\n6G Security\r\nDescription of the research\r\nArtificial Intelligence (AI) technologies, 6G networking,\r\nand quantum computing are the leading forces in\r\nbringing the world to an era of better intelligence and full', 'Description of the research\r\nArtificial Intelligence (AI) technologies, 6G networking,\r\nand quantum computing are the leading forces in\r\nbringing the world to an era of better intelligence and full\r\nautomation. However, the rapid development of such\r\ntechnologies raises concerns that they could be used to\r\ndamage human life, destroy critical infrastructure, and\r\nfurther violate user privacy. For example, AI power can be\r\nexploited to scan the vulnerabilities of critical control\r\nsystems (SCADA, ITS) or track a target user in a restricted\r\naccess building, even without physical intrusion. Similarly,\r\nthe attackers can launch adversarial attacks against AI-\r\nbased Advanced Driver-Assistance Systems (ADAS) and\r\nforce connected vehicles to act as unexpected weapons\r\nto hit civilians. Early detection of security attacks and\r\nsecure AI models are the top targets of many current\r\nresearch efforts. In short, our lab is recruiting talents who\r\nare interested in the following topics:', 'empat (D4) atau sarjana (S1).\n3. Pendaftar yang telah menyelesaikan studi\nmagister (S2) tidak diizinkan mendaftar.\n4. Bagi pendaftar lulusan perguruan tinggi luar\nnegeri pada jenjang pendidikan sebelumnya,\nwajib melampirkan\na. hasil penyetaraan ijazah Kementerian\nPendidikan, Kebudayaan, Riset, dan\nTeknologi, melalui laman\nhttps://piln.kemdikbud.go.id/ atau dari\nKementerian Agama melalui laman\nhttps://diktis.kemenag.go.id/penyetaraan\nijazah/\nb. hasil konversi IPK dari Kementerian\nPendidikan, Kebudayaan, Riset, dan\nTeknologi, melalui laman\nhttps://piln.kemdikbud.go.id/ atau dari\nKementerian Agama melalui laman\nhttps://diktis.kemenag.go.id/penyetaraan\nijazah/\nc. tangkapan layar ajuan penyetaraan\nijazah dan/atau ajuan konversi IPK pada\nlaman Kementerian Pendidikan,\nKebudayaan, Riset, dan Teknologi atau\nKementerian Agama mengenai\npenyetaraan ijazah dan konversi IPK\nbagi pendaftar yang penyetaraan ijazah\ndan/atau konversi IPKnya belum terbit.\n5. Pendaftar yang sedang menempuh studi (on', 'secure AI models are the top targets of many current\r\nresearch efforts. In short, our lab is recruiting talents who\r\nare interested in the following topics:\r\n(1) AI for Cybersecurity: Misbehavior detection in\r\nautonomous vehicles, Deep Reinforcement Learning for\r\naerial-assisted networks (UAV-satellite-space) or\r\nIntelligent Transportation Systems, Self-supervised\r\nLearning, autoDL /ML for Intrusion Detection Systems.\r\n(2) Cybersecurity for AI: Trustable AI for automated\r\nvehicles and AI-based control systems from adversarial\r\nattacks.\r\n(3) 6G security: Signal sensing, physical layer\r\nauthentication, high-accuracy localization and sensing.\r\n(4) Space and Quantum security: Blockchain for\r\nvehicular/aerial networks; Quantum - safe\r\nvehicular/aerial networks; Quantum - compatible IDS\r\nplatforms.\r\nAbout CISLab: CIS Lab is a leading security research group\r\nat National Chung Cheng University, established by Prof.\r\nVan-Linh Nguyen. CISLab has been the home of many']",Saya tidak tahu.
10,Apa yang dapat diperoleh peserta selama periode magang pada proyek P1? ,"Peserta akan memperoleh keterampilan dalam penelitian state-of-the-art, keterampilan pemrograman melalui proyek mini, debat untuk mendapatkan ide kreatif, pelaporan hasil secara profesional, dan menghadiri tur industri serta kursus bahasa Tionghoa.","['Syarat dokumen mengikuti syarat program\nbeasiswa yang dipilih (mengacu pada Buku\nPanduan masing-masing program beasiswa).\nSeperti apa format Komitmen kembali ke\nIndonesia, rencana pasca studi, dan\nrencana kontribusi di Indonesia serta\nRencana Bisnis atau Rencana\nPengembangan Bisnis?\nKomitmen kembali ke Indonesia, rencana\npasca studi, dan rencana kontribusi di\nIndonesia (1500 – 2000 kata)\nDeskripsikan dalam tulisan secara jelas dan\nkonkret tentang tema di atas.', 'empat (D4) atau sarjana (S1).\n3. Pendaftar yang telah menyelesaikan studi\nmagister (S2) tidak diizinkan mendaftar.\n4. Bagi pendaftar lulusan perguruan tinggi luar\nnegeri pada jenjang pendidikan sebelumnya,\nwajib melampirkan\na. hasil penyetaraan ijazah Kementerian\nPendidikan, Kebudayaan, Riset, dan\nTeknologi, melalui laman\nhttps://piln.kemdikbud.go.id/ atau dari\nKementerian Agama melalui laman\nhttps://diktis.kemenag.go.id/penyetaraan\nijazah/\nb. hasil konversi IPK dari Kementerian\nPendidikan, Kebudayaan, Riset, dan\nTeknologi, melalui laman\nhttps://piln.kemdikbud.go.id/ atau dari\nKementerian Agama melalui laman\nhttps://diktis.kemenag.go.id/penyetaraan\nijazah/\nc. tangkapan layar ajuan penyetaraan\nijazah dan/atau ajuan konversi IPK pada\nlaman Kementerian Pendidikan,\nKebudayaan, Riset, dan Teknologi atau\nKementerian Agama mengenai\npenyetaraan ijazah dan konversi IPK\nbagi pendaftar yang penyetaraan ijazah\ndan/atau konversi IPKnya belum terbit.\n5. Pendaftar yang sedang menempuh studi (on', 'c. diberhentikan beasiswanya apabila tidak memenuhi kewajiban pada huruf a atau b.\n14. Sebagai pendaftar Beasiswa LPDP program magister belum pernah menyelesaikan studi magister\n(S2) atau sebagai pendaftar Beasiswa LPDP program doktor belum menyelesaikan studi doktor\n(S3).\n15. Sebagai CPNS, PNS, prajurit TNI, atau anggota POLRI, bersedia memenuhi ketentuan tugas\nbelajar dan mendapatkan surat izin mengikuti seleksi dari pejabat yang berwenang.\n16. Sebagai CPNS, PNS, prajurit TNI, atau anggota POLRI bersedia:', 'Kementerian Agama mengenai\npenyetaraan ijazah dan konversi IPK\nbagi pendaftar yang penyetaraan ijazah\ndan/atau konversi IPKnya belum terbit.\n5. Pendaftar yang sedang menempuh studi (on\ngoing) dapat mendaftar dengan ketentuan\nberikut:\na. Mendaftar pada program studi dan/atau\nperguruan tinggi tujuan yang berbeda dari\nyang sedang ditempuh;\nb. Pendaftar yang lulus seleksi substansi\nwajib membuat dan menandatangani surat\npengunduran diri yang ditujukan kepada\nperguruan tinggi atas program studi yang\nsedang ditempuh serta menyampaikan\nsurat tersebut kepada LPDP paling lambat\n2 (dua) pekan setelah diumumkan lulus\nseleksi substansi.\nc. Pendaftar wajib untuk menyerahkan surat\npemberhentian resmi dari program studi\natau perguruan tinggi sebelum\npenandatanganan surat pernyataan\nPenerima Beasiswa.\nd. Bagi pendaftar yang lulus seleksi\nsubstansi dan tidak memenuhi ketentuan\ntersebut di atas, maka LPDP dapat\nmembatalkan statusnya sebagai Calon\nPenerima Beasiswa.']",Saya tidak menemukan informasi mengenai proyek P1 dalam konteks yang diberikan.
11,"Proyek P2 ""A Study of Grid-Forming and Grid-Following Inverter-based Resources for Low-Inertia Microgrid/Grid with Virtual Inertia and Grid Voltage Support Functions"" mencakup apa?",Proyek ini mencakup penelitian berbasis simulasi untuk meningkatkan ketahanan dan stabilitas jaringan mikrogid/inverter berinertia rendah dengan menggunakan inverter GFM dan GFL dengan fungsi inertia virtual dan dukungan tegangan grid.,"['vision.\r\n3. Publications in my research field\r\n4. International English proficiency certificate (TOEIC >=\r\n550, IELTS >=5.0, TOEFL iBT >= 80 )\r\nMentor at CCU\r\nAsst. Prof. Van-Linh Nguyen\r\nDept. of Computer Science and Information Engineering\r\nNational Chung Cheng University, Taiwan, ROC.\r\ne-mail: nvlinh@ccu.edu.tw\r\nExpected student level\r\n■ Post-graduate student\r\n■Third/forth-year undergraduate senior student\r\nCategory\r\n■ Scholarship\r\n■ Self-supported\r\nIntern period 8 weeks to 6 months between May and December 2024\r\n\r\nNumber P2\r\nProject title\r\nA Study of Grid-Forming and Grid-Following Inverter-based\r\nResources for Low-Inertia Microgrid/Grid with Virtual Inertia\r\nand Grid Voltage Support Functions\r\nDescription of the research\r\nMassive integration of inverter-based renewable energy\r\nsystems (IBRs) has been displacing conventional\r\nsynchronous generators and causing a reduction in system\r\ninertia. IBRs are integrated into power grids through power-', 'systems (IBRs) has been displacing conventional\r\nsynchronous generators and causing a reduction in system\r\ninertia. IBRs are integrated into power grids through power-\r\nelectronics inverters. These are generally categorized as (i)\r\ngrid-following (GFL) and (ii) grid-forming (GFM) inverters.\r\nThe GFM inverter is a promising emerging technology that\r\ngenerates its own voltage signal and has the capability to\r\nregulate the frequency and voltage at the point of\r\ninterconnection. GFM and GFL with virtual inertia and grid\r\nvoltage support functions are in great demand when the\r\npenetration level of IBRs in the grid is high. The simulation-\r\nbased research project will focus on investigating the\r\npotential applications to enhance low-inertia microgrid/grid\r\nresilience and stability when the grid is subjected to minor\r\nor large disturbances.\r\nMentor at CCU\r\nProf. Gary Chang, PhD, PE, IEEE Fellow\r\nDept. of Electrical Engineering,\r\nNational Chung Cheng University, Taiwan, ROC.', 'Project title\r\nRenewable Energy Integration: Power System Analyses,\r\nPower Conversion or Intelligent Control\r\nDescription of the research\r\nThe students will learn the research topics about\r\nrenewable energy integration, which includes one of the\r\nfollowing issues:\r\n➢ Wind farm modeling and control\r\n➢ Fault diagnosis for solar power systems\r\n➢ Artificial intelligence applications on renewable\r\npower systems\r\n➢ Forecasting technologies for renewable power\r\nresources\r\n➢ Smart grid control and operation\r\n➢ Energy storage systems\r\n➢ Transmission and distribution system analyses\r\nMentor at CCU\r\nProf. Yuan-Kang Wu\r\nDept. of Electrical Engineering\r\nNational Chung Cheng University, Taiwan, ROC.\r\n(e-mail: allenwu@ccu.edu.tw)\r\nExpected student level\r\n█ Post-graduate student\r\n█ Third/forth-year undergraduate senior student\r\nCategory █ Scholarship\r\nIntern period At least 12 weeks between May 1 and December 31, 2024\r\n\r\nNumber P8\r\nProject title Silicon photonics and optical biosesnors', ""Grenoble INP - Université\nGrenoble Alpes\n24 Energy\nInternational Master's Degree in Transport and\nEnergy\nINSA Hauts-de-France -\nInstitut National des Sciences\nAppliquées\n25 Energy Master Energy for Solar Buildings and Cities Université Savoie Mont Blanc\n26 Engineering\nMSc Nuclear Engineering / Track Advanced\nNuclear Waste Management\nIMT Atlantique\n27 Engineering\nMSc Nuclear Engineering / Track Nuclear Energy\nProduction and Industrial Applications\nIMT Atlantique\n28 Engineering\nMaster of Science in Water Engineering and Water\nManagement\nInstitut National Polytechnique\nde Toulouse\n29 Engineering\nMaster Industrial BioTechnology for a Bio-Based\nEconomy (BioTechEco)\nInstitut National Polytechnique\nde Toulouse\n30 Engineering\nMaster in Control and Robotics - Embedded Real\nTime Systems\nEcole Centrale de Nantes\n31 Engineering\nMaster Biotecnologies track Life sciences and\ntechnologies\nUniversité de Lille\n32 Engineering\nM1 Nanosciences and Nanotechnologies tracks\nNanophysics""]","Proyek P2 ""A Study of Grid-Forming and Grid-Following Inverter-based Resources for Low-Inertia Microgrid/Grid with Virtual Inertia and Grid Voltage Support Functions"" mencakup penelitian tentang integrasi besar-besaran sistem energi terbarukan berbasis inverter (IBRs) yang menggantikan generator sinkron konvensional dan menyebabkan penurunan inersia sistem. IBRs diintegrasikan ke dalam jaringan listrik melalui inverter elektronik daya. Inverter ini umumnya dikategorikan sebagai (i) grid-following (GFL) dan (ii) grid-forming (GFM) inverters. GFM inverter adalah teknologi yang menjanjikan yang menghasilkan sinyal tegangan sendiri dan memiliki kemampuan untuk mengatur frekuensi dan tegangan di titik interkoneksi. GFM dan GFL dengan inersia virtual dan fungsi dukungan tegangan grid sangat diminati ketika tingkat penetrasi IBRs dalam grid tinggi. Proyek penelitian berbasis simulasi akan fokus pada penyelidikan aplikasi potensial untuk meningkatkan ketahanan dan stabilitas mikrogrid/grid dengan inersia rendah ketika grid mengalami gangguan kecil atau besar."
12,"Apa yang akan dipelajari dalam proyek P3 ""Lidar and Camera Fusion for Autonomous Driving""?","Peserta akan mengembangkan algoritma untuk kalibrasi data sensor, pemrosesan titik awan, dan pemrosesan gambar untuk penggabungan data lidar dan kamera untuk sistem mengemudi otonom.","['or large disturbances.\r\nMentor at CCU\r\nProf. Gary Chang, PhD, PE, IEEE Fellow\r\nDept. of Electrical Engineering,\r\nNational Chung Cheng University, Taiwan, ROC.\r\n(e-mail: ieegwc@ccu.edu.tw)\r\nExpected student level\r\n■ Post-graduate student\r\n■ Third/forth-year undergraduate senior student\r\nCategory\r\n█ Scholarship\r\n█ Self-supported\r\nIntern period 12 to 20 weeks between April 1 and Dec. 31, 2024\r\n\r\nNumber P3\r\nProject title Lidar and Camera fusion for autonomous driving\r\nDescription of the research\r\nThis project revolves around the integration of lidar and\r\ncamera sensor data, aiming to develop robust algorithms\r\nfor enhanced perception and decision-making in self-\r\ndriving systems. Interns will engage in the fusion of lidar\r\nand camera inputs, leveraging Python and advanced\r\nmachine learning models. The primary objectives include\r\ndeveloping algorithms for sensor data calibration, point\r\ncloud processing and image processing to create a\r\ncomprehensive and accurate representation of the', 'empat (D4) atau sarjana (S1).\n3. Pendaftar yang telah menyelesaikan studi\nmagister (S2) tidak diizinkan mendaftar.\n4. Bagi pendaftar lulusan perguruan tinggi luar\nnegeri pada jenjang pendidikan sebelumnya,\nwajib melampirkan\na. hasil penyetaraan ijazah Kementerian\nPendidikan, Kebudayaan, Riset, dan\nTeknologi, melalui laman\nhttps://piln.kemdikbud.go.id/ atau dari\nKementerian Agama melalui laman\nhttps://diktis.kemenag.go.id/penyetaraan\nijazah/\nb. hasil konversi IPK dari Kementerian\nPendidikan, Kebudayaan, Riset, dan\nTeknologi, melalui laman\nhttps://piln.kemdikbud.go.id/ atau dari\nKementerian Agama melalui laman\nhttps://diktis.kemenag.go.id/penyetaraan\nijazah/\nc. tangkapan layar ajuan penyetaraan\nijazah dan/atau ajuan konversi IPK pada\nlaman Kementerian Pendidikan,\nKebudayaan, Riset, dan Teknologi atau\nKementerian Agama mengenai\npenyetaraan ijazah dan konversi IPK\nbagi pendaftar yang penyetaraan ijazah\ndan/atau konversi IPKnya belum terbit.\n5. Pendaftar yang sedang menempuh studi (on', 'Kementerian Agama mengenai\npenyetaraan ijazah dan konversi IPK\nbagi pendaftar yang penyetaraan ijazah\ndan/atau konversi IPKnya belum terbit.\n5. Pendaftar yang sedang menempuh studi (on\ngoing) dapat mendaftar dengan ketentuan\nberikut:\na. Mendaftar pada program studi dan/atau\nperguruan tinggi tujuan yang berbeda dari\nyang sedang ditempuh;\nb. Pendaftar yang lulus seleksi substansi\nwajib membuat dan menandatangani surat\npengunduran diri yang ditujukan kepada\nperguruan tinggi atas program studi yang\nsedang ditempuh serta menyampaikan\nsurat tersebut kepada LPDP paling lambat\n2 (dua) pekan setelah diumumkan lulus\nseleksi substansi.\nc. Pendaftar wajib untuk menyerahkan surat\npemberhentian resmi dari program studi\natau perguruan tinggi sebelum\npenandatanganan surat pernyataan\nPenerima Beasiswa.\nd. Bagi pendaftar yang lulus seleksi\nsubstansi dan tidak memenuhi ketentuan\ntersebut di atas, maka LPDP dapat\nmembatalkan statusnya sebagai Calon\nPenerima Beasiswa.', 'Dipublikasikan tanggal 11 Januari 2024\na. diberhentikan beasiswanya apabila mengundurkan diri sebagai CPNS, PNS, prajurit TNI, atau\nanggota POLRI setelah ditetapkan sebagai Calon Penerima Beasiswa;\nb. diberhentikan beasiswanya dan melakukan pengembalian dana studi apabila mengundurkan\ndiri sebagai CPNS, PNS, prajurit TNI, atau anggota POLRI setelah ditetapkan sebagai\nPenerima Beasiswa LPDP.\n17. Memberikan dokumen dan data pendaftaran yang benar, akurat, dan sesuai aslinya serta bersedia\nmenerima sanksi pemblokiran bila terdapat informasi pada dokumen dan data pendaftaran yang\ntidak benar.\n18. Berkomitmen melaksanakan ketentuan beasiswa LPDP.\n19. Apabila dinyatakan lulus pada program studi dan perguruan tinggi pada pogram beasiswa\nkemitraan/kerja sama beasiswa prioritas, maka tidak dapat berpindah program studi, perguruan\ntinggi, dan/atau program Beasiswa LPDP lainnya, atau kelulusan akan dibatalkan.']","Dalam proyek P3 ""Lidar and Camera Fusion for Autonomous Driving"", akan dipelajari integrasi data sensor lidar dan kamera dengan tujuan mengembangkan algoritma yang kuat untuk persepsi dan pengambilan keputusan yang lebih baik dalam sistem self-driving. Para intern akan terlibat dalam penggabungan input lidar dan kamera, menggunakan Python dan model machine learning canggih. Tujuan utamanya termasuk pengembangan algoritma untuk kalibrasi data sensor, pemrosesan awan titik, dan pemrosesan gambar untuk menciptakan representasi yang komprehensif dan akurat."
13,"Apa yang membuat proyek P5 ""Computer Vision Applications based on Deep Learning Techniques"" menarik?","Proyek ini mencakup teknik pembelajaran mendalam seperti CNN, RNN, LSTM, dan lain-lain untuk aplikasi seperti ekstraksi kerangka 3D manusia, pengenalan tindakan, dan estimasi pose objek dari gambar RGB tunggal.","['techniques. In this research, you will learn deep learning\r\ntechniques such as CNN, RNN, LSTM, AE, VAE, etc. The\r\npossible applications and topics include: (1) 3D human\r\nskeleton extraction, (2) skeleton-based action\r\nrecognition/behavior modeling, (3) action prediction for\r\nelderly monitoring, (4) 3D object (vehicle, pedestrian,\r\ncyclist) detection and positioning from fusion of RGB/LiDAR\r\nsensor data, (5) object (head/vehicle/ human/object) pose\r\nestimation from single RGB image, (6) deep learning-based\r\nadverse drug reaction (ADR) prediction for clinic medicine\r\nuse, (7) AI-generated content (AIGC), such as\r\n(text/audio/image) -to-(image/video), (8) elderly caring\r\napplication of AIGC, (9) heart rate estimation from facial\r\nimage sequence. The intern student is expected to have\r\nsome preliminary knowledge on NN (neural network) or\r\ndeep learning and skilled in Python programming. He/She\r\nwill learn how to apply state-of-the-art deep learning', 'Syarat dokumen mengikuti syarat program\nbeasiswa yang dipilih (mengacu pada Buku\nPanduan masing-masing program beasiswa).\nSeperti apa format Komitmen kembali ke\nIndonesia, rencana pasca studi, dan\nrencana kontribusi di Indonesia serta\nRencana Bisnis atau Rencana\nPengembangan Bisnis?\nKomitmen kembali ke Indonesia, rencana\npasca studi, dan rencana kontribusi di\nIndonesia (1500 – 2000 kata)\nDeskripsikan dalam tulisan secara jelas dan\nkonkret tentang tema di atas.', 'empat (D4) atau sarjana (S1).\n3. Pendaftar yang telah menyelesaikan studi\nmagister (S2) tidak diizinkan mendaftar.\n4. Bagi pendaftar lulusan perguruan tinggi luar\nnegeri pada jenjang pendidikan sebelumnya,\nwajib melampirkan\na. hasil penyetaraan ijazah Kementerian\nPendidikan, Kebudayaan, Riset, dan\nTeknologi, melalui laman\nhttps://piln.kemdikbud.go.id/ atau dari\nKementerian Agama melalui laman\nhttps://diktis.kemenag.go.id/penyetaraan\nijazah/\nb. hasil konversi IPK dari Kementerian\nPendidikan, Kebudayaan, Riset, dan\nTeknologi, melalui laman\nhttps://piln.kemdikbud.go.id/ atau dari\nKementerian Agama melalui laman\nhttps://diktis.kemenag.go.id/penyetaraan\nijazah/\nc. tangkapan layar ajuan penyetaraan\nijazah dan/atau ajuan konversi IPK pada\nlaman Kementerian Pendidikan,\nKebudayaan, Riset, dan Teknologi atau\nKementerian Agama mengenai\npenyetaraan ijazah dan konversi IPK\nbagi pendaftar yang penyetaraan ijazah\ndan/atau konversi IPKnya belum terbit.\n5. Pendaftar yang sedang menempuh studi (on', 'Dipublikasikan tanggal 11 Januari 2024\na. diberhentikan beasiswanya apabila mengundurkan diri sebagai CPNS, PNS, prajurit TNI, atau\nanggota POLRI setelah ditetapkan sebagai Calon Penerima Beasiswa;\nb. diberhentikan beasiswanya dan melakukan pengembalian dana studi apabila mengundurkan\ndiri sebagai CPNS, PNS, prajurit TNI, atau anggota POLRI setelah ditetapkan sebagai\nPenerima Beasiswa LPDP.\n17. Memberikan dokumen dan data pendaftaran yang benar, akurat, dan sesuai aslinya serta bersedia\nmenerima sanksi pemblokiran bila terdapat informasi pada dokumen dan data pendaftaran yang\ntidak benar.\n18. Berkomitmen melaksanakan ketentuan beasiswa LPDP.\n19. Apabila dinyatakan lulus pada program studi dan perguruan tinggi pada pogram beasiswa\nkemitraan/kerja sama beasiswa prioritas, maka tidak dapat berpindah program studi, perguruan\ntinggi, dan/atau program Beasiswa LPDP lainnya, atau kelulusan akan dibatalkan.']","Proyek P5 ""Computer Vision Applications based on Deep Learning Techniques"" menarik karena melibatkan penggunaan teknik deep learning seperti CNN, RNN, LSTM, AE, VAE, dan lainnya. Beberapa aplikasi dan topik yang mungkin dijelajahi dalam proyek ini termasuk ekstraksi kerangka manusia 3D, pengenalan tindakan berbasis kerangka, prediksi tindakan untuk pemantauan lansia, deteksi dan penempatan objek 3D (kendaraan, pejalan kaki, pengendara sepeda) dari fusi data sensor RGB/LiDAR, estimasi pose objek (kepala/kendaraan/manusia/objek) dari gambar RGB tunggal, prediksi reaksi obat yang merugikan berbasis deep learning untuk penggunaan obat klinik, konten yang dihasilkan oleh AI (AIGC), seperti (teks/audio/gambar) -to-(gambar/video), aplikasi perawatan lansia dari AIGC, estimasi detak jantung dari urutan gambar wajah, dan lain-lain. Selain itu, mahasiswa magang diharapkan memiliki pengetahuan awal tentang NN (jaringan saraf) atau deep learning dan terampil dalam pemrograman Python. Ini adalah kesempatan untuk belajar dan menerapkan teknologi deep learning terkini."
14,"Apa fokus dari proyek P8 ""Silicon Photonics and Optical Biosensors""? ",Fokusnya adalah mengembangkan photodetektor berbasis silikon baru yang kompatibel dengan CMOS dan biosensor optik sekali pakai untuk deteksi biomedis yang cepat dan hemat biaya.,"['Category █ Scholarship\r\nIntern period At least 12 weeks between May 1 and December 31, 2024\r\n\r\nNumber P8\r\nProject title Silicon photonics and optical biosesnors\r\nDescription of the research\r\nThe topic is to develope (a) new types of silicon-based,\r\nCMOS compatible photodetectors, which have many\r\nadvantages over conventional III-V based counterparts for\r\nmid-infrared applications, (b) new disposable optical\r\nbiosensors for cost-effective and rapid biomedical\r\ndetection for precise medicine. This internship program is\r\nopen for talents who are interested in advanced\r\noptoelectronic-sensing technologies. Focus will be placed\r\non designing, simulating, and analyzing new Si-based\r\ngroup-IV photodetectors and optical biosensors. For\r\nrelated information, please refer to the website of our lab\r\nat https://ccuphotonics307.wixsite.com/ccuphotonics307\r\nMentor at CCU\r\nProf. Guo-En Chang\r\nDept. of Mechanical Engineering\r\nNational Chung Cheng University, Taiwan, ROC.\r\n(e-mail: imegec@ccu.edu.tw)', 'KEMENTERIAN PENDIDIKAN, KEBUDAYAAN,\nRISET, DAN TEKNOLOGI\nINSTITUT TEKNOLOGI SEPULUH NOPEMBER\nDIREKTORAT KEMITRAAN GLOBAL\nGedung Global Kampong Kampus ITS Sukolilo - Surabaya 60111 Indonesia\n(0) Telepon: 031 5923411 (Hunting): 031 5994251-54 ext.1224\nFax: 031 5923411\nhttps://www.its.ac.id/, https://www.its.ac.id/international/ email: international(ajits.ac.id\nNomor : 7518/IT2MVIII/T/TU.00.08/2023\n\nLampiran :2 (dua) lembar\nPerihal : Pemberitahuan Informasi Persyaratan Eksposur Internasional\nKepada Yth.\nKepala Departemen dan Ketua Program Studi\ndi lingkungan ITS\nDengan hormat,\nsehubungan dengan surat kami dengan nomor 7311/!T2.VINI/T/TU.00.08/2023 perihal Pemberitahuan Informasi Persyaratan\nEksposur Internasional, bersama dengan ini memberikan informasi lebih lanjut tentang persyaratan yang harus dipenuhi oleh\nseluruh mahasiswa ITS dalam rangka pelaksanaan kegiatan eksposur internasional. Persyaratan tersebut adalah sebagai berikut:', 'Syarat dokumen mengikuti syarat program\nbeasiswa yang dipilih (mengacu pada Buku\nPanduan masing-masing program beasiswa).\nSeperti apa format Komitmen kembali ke\nIndonesia, rencana pasca studi, dan\nrencana kontribusi di Indonesia serta\nRencana Bisnis atau Rencana\nPengembangan Bisnis?\nKomitmen kembali ke Indonesia, rencana\npasca studi, dan rencana kontribusi di\nIndonesia (1500 – 2000 kata)\nDeskripsikan dalam tulisan secara jelas dan\nkonkret tentang tema di atas.', '✔\nSertifikat Bahasa Asing yang\ndipersyaratkan dan Masih\nBerlaku (Asli)\n✔\nSurat rekomendasi dari\nakademisi atau tokoh\nmasyarakat *)\n✔ ✔\nSurat usulan dari pejabat\nyang membidangi SDM untuk\npendaftar PNS/TNI/POLRI\nsesuai ketentuan\n✔\nSurat pernyataan pada\naplikasi pendaftaran saat\n✔\nDokumen\nOnline\nForm\nUnggah\nakan melakukan submit\n(poin-poin terlampir)\nProfil diri pada formulir\npendaftaran online\n✔\nKomitmen kembali ke\nIndonesia, rencana pasca\nstudi, dan rencana kontribusi\ndi Indonesia.\n✔\nPublikasi ilmiah, prestasi\nkejuaraan/non kejuaraan,\ndan pengalaman organisasi.\n✔\nSK Jabatan terakhir bagi\nPNS\nPeneliti/Perekayasa/Medis/\nParamedis/Pendidik\n✔\n*) Surat harus diterbitkan paling lama 1 (satu)\ntahun di bulan yang sama dengan waktu\npendaftaran beasiswa\n2. Syarat dokumen program beasiswa lain\nSyarat dokumen mengikuti syarat program\nbeasiswa yang dipilih (mengacu pada Buku\nPanduan masing-masing program beasiswa).\nSeperti apa format Komitmen kembali ke\nIndonesia, rencana pasca studi, dan']","FOKUS dari proyek P8 ""Silicon Photonics and Optical Biosensors"" adalah pengembangan jenis baru fotodetektor berbasis silikon yang kompatibel dengan CMOS, serta pengembangan biosensor optik sekali pakai baru untuk deteksi biomedis yang hemat biaya dan cepat untuk pengobatan yang tepat."
15,"Apa yang menjadi target penelitian dalam proyek P10 ""Effect of Operating Conditions on the Performance of an All-Vanadium Redox Flow Battery""?",Penelitian ini bertujuan untuk mempelajari efek kondisi operasi seperti konsentrasi elektrolit dan laju aliran elektrolit pada kinerja baterai aliran redoks vanadium.,"['be placed on designing, simulating, and analyzing new optical\r\nmonitoring systems for metal additive systems. For related information,\r\nplease refer to the website of our lab at\r\nhttps://ccuphotonics307.wixsite.com/ccuphotonics307\r\nMentor at CCU\r\nProf. Guo-En Chang\r\nDept. of Mechanical Engineering\r\nNational Chung Cheng University, Taiwan, ROC.\r\n(e-mail: imegec@ccu.edu.tw)\r\nExpected student\r\nlevel\r\n█ Post-graduate student\r\n█ Third/forth-year undergraduate senior student\r\nCategory ■ Scholarship\r\nIntern period At least 8 weeks (up to 6 months) between May and December 2024\r\n\r\nNumber P10\r\nProject title\r\nEffect of operating conditions on the performance of an\r\nall-vanadium redox flow battery\r\nDescription of the research\r\nThe performance of the VRFB is influenced by operating\r\nconditions, such as electrolyte concentration and\r\nelectrolyte flow rate. Students will conduct experiments\r\nto investigate the effect of operating conditions on the\r\nperformance of the VRFB and determine a suitable', 'Dipublikasikan tanggal 11 Januari 2024\nNo Bidang Study Program University\n51 Material Sciences\nGraduate Programme Innovative Materials and\nEnergy Systems (Emat) - Master\nNantes Université\n52 Urban Planning Economics for Smart Cities and Climate Policy Institut Polytechnique de Paris\nPoin-Poin Surat Pernyataan pada Aplikasi Pendaftaran (Disetujui Saat Akan Melakukan Submit)\n1. Setia kepada Pancasila, Negara Kesatuan Republik Indonesia, dan UUD 1945.\n2. Tidak pernah, sedang, atau akan mendukung atau terlibat dalam gerakan, organisasi, atau ideologi\nyang bertentangan dan/atau berpotensi mengganggu tegaknya ideologi Pancasila, Undang-\nUndang Dasar 1945, dan Negara Kesatuan Republik Indonesia.\n3. Mendahulukan kepentingan Bangsa dan Negara Kesatuan Republik Indonesia di atas kepentingan\npribadi.\n4. Tidak akan berpindah kewarganegaraan sejak pendaftaran beasiswa sampai dengan selesainya\nmasa kontribusi sebagai alumni beasiswa LPDP.', 'Surabaya, 13 September 2023\n\nDirektur Kemitraan Global\n \nDr. Maria Anityasari, S.T., M.E.\nNIP . 197011201997032001', 'empat (D4) atau sarjana (S1).\n3. Pendaftar yang telah menyelesaikan studi\nmagister (S2) tidak diizinkan mendaftar.\n4. Bagi pendaftar lulusan perguruan tinggi luar\nnegeri pada jenjang pendidikan sebelumnya,\nwajib melampirkan\na. hasil penyetaraan ijazah Kementerian\nPendidikan, Kebudayaan, Riset, dan\nTeknologi, melalui laman\nhttps://piln.kemdikbud.go.id/ atau dari\nKementerian Agama melalui laman\nhttps://diktis.kemenag.go.id/penyetaraan\nijazah/\nb. hasil konversi IPK dari Kementerian\nPendidikan, Kebudayaan, Riset, dan\nTeknologi, melalui laman\nhttps://piln.kemdikbud.go.id/ atau dari\nKementerian Agama melalui laman\nhttps://diktis.kemenag.go.id/penyetaraan\nijazah/\nc. tangkapan layar ajuan penyetaraan\nijazah dan/atau ajuan konversi IPK pada\nlaman Kementerian Pendidikan,\nKebudayaan, Riset, dan Teknologi atau\nKementerian Agama mengenai\npenyetaraan ijazah dan konversi IPK\nbagi pendaftar yang penyetaraan ijazah\ndan/atau konversi IPKnya belum terbit.\n5. Pendaftar yang sedang menempuh studi (on']","Target penelitian dalam proyek P10 ""Effect of Operating Conditions on the Performance of an All-Vanadium Redox Flow Battery"" adalah untuk menyelidiki pengaruh kondisi operasional, seperti konsentrasi elektrolit dan laju aliran elektrolit, terhadap kinerja dari baterai aliran redoks vanadium (VRFB). Tujuan dari penelitian ini adalah untuk menentukan kondisi operasional yang sesuai untuk meningkatkan kinerja dari VRFB."
16,"Apa tujuan dari proyek P12 ""Numerical Modeling and Experiments of an Atmospheric Pressure Plasma Jet Operated in Air with Shielding Gas""?",Tujuan proyek ini adalah menggabungkan model plasma fluida dua dimensi axisimetrik dengan model aliran gas untuk memprediksi perilaku dinamis plasma jet tekanan atmosfer menggunakan gas helium.,"['(e-mail: imekml@ccu.edu.tw; kmlin.tw@gmail.com)\r\nExpected student level\r\n■ Post-graduate student\r\n■ Third/forth-year undergraduate senior student\r\nCategory\r\n■ Scholarship\r\n■ Self-supported\r\nIntern period At least 8 weeks between May and December 2024\r\n\r\nNumber P12\r\nProject title\r\nNumerical modeling and Experiments of an atmospheric\r\npressure plasma jet operated in air with shielding gas\r\nDescription of the research\r\nAtmospheric-pressure plasma jets have been developed\r\nextensively for applications such as plasma medicine and\r\nplasma agriculture due to the generation of abundant\r\nreactive species being critical for manipulating reaction\r\npathways in different fields. However, it is still challenging\r\nto develop a proper plasma source with controlled\r\nparameters by experimental measurements because of\r\nfast discharge dynamics and complex plasma chemistry.\r\nAlternatively, numerical simulations can be used to\r\ncapture discharge dynamics with detailed chemistry', 'fast discharge dynamics and complex plasma chemistry.\r\nAlternatively, numerical simulations can be used to\r\ncapture discharge dynamics with detailed chemistry\r\nrevealed. In this project, a two-dimensional axisymmetric\r\nplasma fluid model will be integrated with a two-\r\ndimensional axisymmetric gas flow model to predict the\r\ndynamic behavior of a helium atmospheric pressure\r\nplasma jet. The simulated results will be compared with\r\nphotos taken by an intensified CCD camera to validate the\r\nmodel. It is a topic involving thermofluid science, which is\r\nsuitable for students in mechanical engineering.\r\nMentor at CCU\r\nAssoc. Prof. Kun-Mo Lin\r\nDept. of, Mechanical Engineering\r\nNational Chung Cheng University, Taiwan, ROC.\r\n(e-mail: imekml@ccu.edu.tw; kmlin.tw@gmail.com)\r\nExpected student level\r\n■ Post-graduate student\r\n■ Third/forth-year undergraduate senior student\r\nCategory\r\n■ Scholarship\r\n■ Self-supported\r\nIntern period At least 8 weeks between May and December 2024\r\n\r\nNumber P13', 'electrolyte flow rate. Students will conduct experiments\r\nto investigate the effect of operating conditions on the\r\nperformance of the VRFB and determine a suitable\r\noperating strategy.\r\nMentor at CCU\r\nProf. Yong-Song Chen\r\nDept. of Mechanical Engineering,\r\nNational Chung Cheng University, Taiwan, ROC.\r\n(e-mail: imeysc@ccu.edu.tw)\r\nExpected student level\r\n█ Post-graduate student\r\n█ Third/forth-year undergraduate senior student\r\nCategory ■ Scholarship\r\nIntern period At least 8 weeks between May 1 and Dec. 31, 2024\r\n\r\nNumber P11\r\nProject title\r\nMeasurements of densities of liquid-phase reactive\r\nspecies generated by atmospheric pressure plasma jets\r\nDescription of the research\r\nAtmospheric-pressure plasma jets have been developed\r\nextensively for applications such as plasma medicine and\r\nplasma agriculture due to the generation of abundant\r\nreactive species being critical for manipulating reaction\r\npathways in different fields. Therefore, it is essential to', 'plasma agriculture due to the generation of abundant\r\nreactive species being critical for manipulating reaction\r\npathways in different fields. Therefore, it is essential to\r\ncharacterize the densities of reactive species introduced\r\nby plasma jets in the liquid phase for various applications.\r\nIn this project, the densities of OH/NO2\r\n-/NO3\r\n- will be\r\nexplored by using the microplate reader\r\nspectrophotometer under different operating conditions\r\nto reveal the correlations among reactive species\r\ngenerated in the liquid phase and the discharge\r\nparameters. Anyone interested in plasma technology and\r\ncharacterization is welcome to join the project.\r\nMentor at CCU\r\nAssoc. Prof. Kun-Mo Lin\r\nDept. of, Mechanical Engineering\r\nNational Chung Cheng University, Taiwan, ROC.\r\n(e-mail: imekml@ccu.edu.tw; kmlin.tw@gmail.com)\r\nExpected student level\r\n■ Post-graduate student\r\n■ Third/forth-year undergraduate senior student\r\nCategory\r\n■ Scholarship\r\n■ Self-supported']","Tujuan dari proyek P12 ""Numerical Modeling and Experiments of an Atmospheric Pressure Plasma Jet Operated in Air with Shielding Gas"" adalah untuk mengembangkan model numerik dua dimensi yang akan diintegrasikan dengan model aliran gas dua dimensi untuk memprediksi perilaku dinamis dari plasma jet tekanan atmosfer yang dioperasikan dengan gas pelindung. Hasil simulasi akan dibandingkan dengan foto yang diambil oleh kamera CCD yang diperkuat untuk memvalidasi model tersebut. Proyek ini bertujuan untuk memahami dinamika plasma dengan detail kimia yang melibatkan ilmu termofluida, yang cocok untuk mahasiswa teknik mesin."
17,"Proyek P13 ""Application of Novel Snap-shot based Hyperspectral Imaging Combined with AI to Detect Lesions"" menggunakan metode apa?","Proyek ini menggunakan model pembelajaran mesin seperti YOLOv5, YOLOv8, R-CNN, dan Faster R-CNN untuk mendeteksi kanker esofagus stadium awal menggunakan model gambar cahaya putih (WLI) dan gambar narrowband hiperspektral (HSI-NBI).","['■ Post-graduate student\r\n■ Third/forth-year undergraduate senior student\r\nCategory\r\n■ Scholarship\r\n■ Self-supported\r\nIntern period At least 8 weeks between May and December 2024\r\n\r\nNumber P13\r\nProject title\r\nApplication of Novel Snap-shot based hyperspectral imaging\r\ncombined with AI to detect Lesions\r\nDescription of the\r\nresearch\r\nThe early detection of esophageal cancer presents a\r\nconsiderable difficulty, which contributes to its high\r\nprevalence as a major cause of cancer-related fatalities. This\r\nproject will utilize various machine learning models, including\r\nYOLOv5, YOLOv8, R-CNN, and Faster R-CNN, to predict and\r\ndetect early-stage esophageal cancer. It will make use of two\r\nmodels of esophageal cancer images: the white-light images\r\n(WLI) model and the hyperspectral narrowband images (HSI-\r\nNBI) model. These models will be generated through a\r\nconversion algorithm referred to as the spectrum-aided\r\nvision enhancer (SAVE). The main goal will be to discover', 'NBI) model. These models will be generated through a\r\nconversion algorithm referred to as the spectrum-aided\r\nvision enhancer (SAVE). The main goal will be to discover\r\nDysplasia and Squamous Cell Carcinoma (SCC). The\r\nevaluation of model performance will be conducted using the\r\ncreated confusion matrix and five important indicators:\r\nprecision, recall, F1-score, mAP, and the confusion matrix of\r\nthe trained model.\r\nMentor at CCU\r\nProf. Hsiang-Chen Wang\r\nDept. of Mechanical Engineering,\r\nNational Chung Cheng University, Taiwan, ROC.\r\n(e-mail: hcwang@ccu.edu.tw)\r\nExpected student level\r\n■ Post-graduate student\r\n■ Third/forth-year undergraduate senior student\r\nCategory ■ Scholarship\r\nIntern period At least 12 weeks between May and December 2024\r\n\r\nNumber P14\r\nProject title Stirling engines and their applications\r\nDescription of the\r\nresearch\r\nThe students will learn the research topics about Stirling\r\nengines and their applications in renewable energy,', 'Surabaya, 13 September 2023\n\nDirektur Kemitraan Global\n \nDr. Maria Anityasari, S.T., M.E.\nNIP . 197011201997032001', 'the 2D image of the extremely high dose rate in\r\nproton/particle therapies. We hope that the students could\r\njoin us to implement a novel reconstruction algorithm and\r\ntry to publish the research work in intern period.\r\nMentor at CCU\r\nProf. Chi-Wen, Hsieh\r\nDept. of Electrical Engineering\r\nNational Chung Cheng University, Taiwan, ROC.\r\n(E-mail: chiwenh@ccu.edu.tw)\r\nExpected student level\r\n■ Post-graduate student\r\n■ Third/forth-year undergraduate senior student\r\nCategory\r\n■ Scholarship\r\n■ Self-supported\r\nIntern period At least 8 weeks between May 1 and September 30\r\n\r\nNumber P5\r\nProject title\r\nComputer vision applications based on deep learning\r\ntechniques\r\nDescription of the research\r\nThis project is to do researches on computer vision based\r\non the modern deep learning (machine learning)\r\ntechniques. In this research, you will learn deep learning\r\ntechniques such as CNN, RNN, LSTM, AE, VAE, etc. The\r\npossible applications and topics include: (1) 3D human']","Proyek P13 ""Application of Novel Snap-shot based Hyperspectral Imaging Combined with AI to Detect Lesions"" menggunakan metode machine learning, termasuk model-model seperti YOLOv5, YOLOv8, R-CNN, dan Faster R-CNN, untuk memprediksi dan mendeteksi kanker kerongkongan pada tahap awal. Proyek ini juga menggunakan dua model gambar kanker kerongkongan: model gambar cahaya putih (WLI) dan model gambar hiperspektral narrowband (HSI-NBI). Model-model ini dihasilkan melalui algoritma konversi yang disebut spectrum-aided vision enhancer (SAVE). Tujuan utamanya adalah untuk menemukan Dysplasia dan Squamous Cell Carcinoma (SCC)."
18,"Apa yang akan dikembangkan dalam proyek P16 ""Next Generation Wireless Communication, B5G/6G, Reconfigurable Intelligent Surface, System Level Simulation, Artificial Intelligence-enhanced Wireless Research""? ","Proyek ini berfokus pada inovasi dan desain konsep-konsep canggih dan arsitektur di luar 5G dan 6G, mengidentifikasi dan memvalidasi solusi untuk masalah kunci melalui simulasi atau eksperimen prototipe, serta merancang algoritma, model, dan protokol baru untuk mengoptimalkan kinerja jaringan nirkabel.","['Category\r\n■ Scholarship\r\n■ Self-supported\r\nIntern period At least 8 weeks between 2024/5/1- 2024/12/31\r\n\r\nNumber P16\r\nProject title\r\nNext generation Wireless communication, B5G/6G,\r\nReconfigurable Intelligent Surface, System level\r\nsimulation, Artificial Intelligence-enhanced wireless\r\nresearch\r\nDescription of the\r\nresearch\r\nInnovate and design cutting-edge concepts and\r\narchitectures beyond 5G (B5G) and 6G.\r\nIdentify and validate solutions to key problems through\r\nsimulation or prototype experiments.\r\nConduct research on AI and machine learning\r\ntechniques applied to wireless communications and\r\nnetworks.\r\nDesign and implement novel algorithms, models, and\r\nprotocols to optimize wireless network performance.\r\nCollaborate with the research team to manage projects\r\nand ensure timely deliverables,\r\nPlease refer to the website of our lab at\r\nhttps://sites.google.com/view/ccuantlab/english\r\nMentor at CCU\r\nAssoc. Prof. Jen-Yi Pan\r\nDept. of Communications Engineering,', 'application form, prepare\r\napplication materials, and send\r\nthem in a ZIP-compressed file to\r\ncoleng_dia@ccu.edu.tw.\r\n• The title of the e-mail please be\r\nmarked with “Application for 2024\r\nCCU/COE International Internship”.\r\nAll the intern research topics and\r\ntheir requirements are listed as\r\nfollows.\r\n• Application deadline: Mar. 3, 2024\r\n• More detailed information about\r\napplication can be found on the\r\nwebsite\r\nhttps://sites.google.com/view/ccu-\r\ncoe-internship/home\r\nCONTACT\r\n+886-5-2720411 ext. 23003, 23005\r\ncoleng_dia@ccu.edu.tw\r\nNo.168, Sec. 1, University Rd., Minhsiung,\r\nChiayi 621301, Taiwan (R.O.C.)\r\n\r\nINTERN RESEARCH TOPICS\r\nNumber P1\r\nProject title\r\nTrustable Artificial Intelligence for Critical Applications and\r\n6G Security\r\nDescription of the research\r\nArtificial Intelligence (AI) technologies, 6G networking,\r\nand quantum computing are the leading forces in\r\nbringing the world to an era of better intelligence and full', 'Syarat dokumen mengikuti syarat program\nbeasiswa yang dipilih (mengacu pada Buku\nPanduan masing-masing program beasiswa).\nSeperti apa format Komitmen kembali ke\nIndonesia, rencana pasca studi, dan\nrencana kontribusi di Indonesia serta\nRencana Bisnis atau Rencana\nPengembangan Bisnis?\nKomitmen kembali ke Indonesia, rencana\npasca studi, dan rencana kontribusi di\nIndonesia (1500 – 2000 kata)\nDeskripsikan dalam tulisan secara jelas dan\nkonkret tentang tema di atas.', 'KEMENTERIAN PENDIDIKAN, KEBUDAYAAN,\nRISET, DAN TEKNOLOGI\nINSTITUT TEKNOLOGI SEPULUH NOPEMBER\nDIREKTORAT KEMITRAAN GLOBAL\nGedung Global Kampong Kampus ITS Sukolilo - Surabaya 60111 Indonesia\n(0) Telepon: 031 5923411 (Hunting): 031 5994251-54 ext.1224\nFax: 031 5923411\nhttps://www.its.ac.id/, https://www.its.ac.id/international/ email: international(ajits.ac.id\nNomor : 7518/IT2MVIII/T/TU.00.08/2023\n\nLampiran :2 (dua) lembar\nPerihal : Pemberitahuan Informasi Persyaratan Eksposur Internasional\nKepada Yth.\nKepala Departemen dan Ketua Program Studi\ndi lingkungan ITS\nDengan hormat,\nsehubungan dengan surat kami dengan nomor 7311/!T2.VINI/T/TU.00.08/2023 perihal Pemberitahuan Informasi Persyaratan\nEksposur Internasional, bersama dengan ini memberikan informasi lebih lanjut tentang persyaratan yang harus dipenuhi oleh\nseluruh mahasiswa ITS dalam rangka pelaksanaan kegiatan eksposur internasional. Persyaratan tersebut adalah sebagai berikut:']","Proyek P16 ""Next Generation Wireless Communication, B5G/6G, Reconfigurable Intelligent Surface, System Level Simulation, Artificial Intelligence-enhanced Wireless Research"" akan mengembangkan konsep dan arsitektur terdepan di luar 5G (B5G) dan 6G. Proyek ini juga akan mengidentifikasi dan memvalidasi solusi untuk masalah kunci melalui simulasi atau eksperimen prototipe. Selain itu, proyek ini akan melakukan penelitian tentang teknik kecerdasan buatan dan pembelajaran mesin yang diterapkan pada komunikasi nirkabel dan jaringan. Selain itu, proyek ini akan merancang dan menerapkan algoritma, model, dan protokol baru untuk mengoptimalkan kinerja jaringan nirkabel. Kolaborasi dengan tim penelitian juga akan dilakukan untuk mengelola proyek dan memastikan pengiriman tepat waktu."
19,Bagaimana cara menghubungi penyelenggara program internship ini?,"Kontak dapat dilakukan melalui nomor +886-5-2720411 ext. 23003, 23005, atau email coleng_dia@ccu.edu.tw. Alamatnya adalah No.168, Sec. 1, University Rd., Minhsiung, Chiayi 621301, Taiwan (R.O.C.).","['1. Setiap mahasiswa ITS yang ingin mendaftar program internasional di perguruan tinggi mitra ITS luar negeri yang\nmembutuhkan surat rekomendasi atau dana dukungan dari ITS di antaranya IISMA/IISMA-Vo, pertukaran pelajar (exchange),\nlab-internship, short program, atau program lain di luar negeri, diharuskan memiliki sertifikat Global Competency\nWorkshop (GCW) atau Global Competency Academy (GCA). Sertifikat ini hanya bisa diperoleh dengan mengikuti program\nGCW atau GCA.', 'Dipublikasikan tanggal 11 Januari 2024\nprogram beasiswa lain yang dipilih, sesuai\ndengan syarat dan ketentuan yang berlaku.\nApa saja komponen Dana yang diberikan?\n1. Dana Pendidikan\na. Tuition Fee\nb. Dana Pendaftaran\nc. Dana Tunjangan Buku\nd. Dana Penelitian Tesis\ne. Dana Seminar Internasional\nf. Dana Publikasi Jurnal Internasional\n2. Dana Pendukung\na. Dana Transportasi\nb. Dana Aplikasi Visa\nc. Dana Asuransi Kesehatan\nd. Dana Kedatangan\ne. Dana Hidup Bulanan\nf. Dana Lomba Internasional\ng. Dana keadaaan darurat (jika diperlukan)\nApa saja persyaratan umum pendaftaran\nBeasiswa Prioritas LPDP – Campus\nFrance Program Master?\nPersyaratan umum Beasiswa Prioritas LPDP –\nCampus France Program Master adalah sebagai\nberikut:\n1. Warga Negara Indonesia.\n2. Telah menyelesaikan studi program diploma\nempat (D4) atau sarjana (S1).\n3. Pendaftar yang telah menyelesaikan studi\nmagister (S2) tidak diizinkan mendaftar.\n4. Bagi pendaftar lulusan perguruan tinggi luar', 'Program Master memberikan kesempatan bagi\npendaftar untuk dapat melakukan pendaftaran\npada Beasiswa Kemitraan LPDP – Campus\nFrance dan beasiswa Magister Luar Negeri\npada salah satu program:\n1. Beasiswa Afirmasi\na. Beasiswa Daerah Afirmasi\nb. Beasiswa Putra Putri Papua\nc. Beasiswa Penyandang Disabilitas\nd. Beasiswa Prasejahtera\n2. Beasiswa Targeted\na. Beasiswa PNS, TNI, POLRI\nb. Beasiswa Kewirausahaan\nc. Beasiswa Umum\na. Beasiswa Reguler\nb. Beasiswa Parsial\nBeasiswa Kemitraan LPDP - Campus France\nmerupakan beasiswa kerja sama antara LPDP dan\nPemerintah Perancis pada jenjang master untuk\nbidang prioritas pembangunan Indonesia sesuai\ndengan keahlian pengetahuan yang dimiliki oleh\nUniversitas di Perancis dalam rangka\nmenghasilkan pemimpin masa depan Indonesia\nyang kompeten di bidang tersebut.\nSiapakah Sasaran Beasiswa Prioritas\nLPDP – Campus France Program Master?\n1. Warga Negara Indonesia (WNI)\n2. PNS/TNI/POLRI\nSeperti Apa Skema Prioritas LPDP –\nCampus France Program Master?', 'b. Kelas khusus;\nc. Kelas karyawan;\nd. Kelas jarak jauh;\ne. Kelas yang diselenggarakan bukan di\nperguruan tinggi induk;\nf. Kelas internasional bagi pendaftar tujuan\nstudi dalam negeri;\ng. Kelas yang diselenggarakan di lebih dari\n1 (satu) negara perguruan tinggi; atau\nh. Kelas lainnya yang tidak memenuhi\nketentuan LPDP.\n14. Menyetujui surat pernyataan yang telah\ndisediakan pada aplikasi pendaftaran\nbeasiswa LPDP (poin-poin terlampir).\n15. Menulis profil diri termasuk riwayat pendidikan\nyang tidak diselesaikan pada aplikasi\npendaftaran.\n16. Menulis komitmen kembali ke Indonesia,\nrencana pasca studi, dan rencana kontribusi\ndi Indonesia.\n17. Jika pendaftar memiliki publikasi ilmiah,\nprestasi kejuaraan/non kejuaraan, dan\npengalaman organisasi maka pendaftar\nmengisi riwayat publikasi ilmiah, prestasi\nkejuaraan/non kejuaraan, dan pengalaman\norganisasi pada aplikasi pendaftaran.\nApa saja persyaratan khusus pendaftaran\nBeasiswa Prioritas LPDP – Campus France\nProgram Master?']","Untuk menghubungi penyelenggara program internship ini, Anda dapat mencari informasi kontak dari ITS atau lembaga terkait yang menyelenggarakan program tersebut. Biasanya informasi kontak dapat ditemukan melalui website resmi atau langsung bertanya kepada pihak terkait di kampus. Jika informasi kontak tidak tersedia secara publik, Anda juga dapat mencoba menghubungi bagian administrasi atau pusat informasi kampus untuk bantuan lebih lanjut."
