,question,ground_truth,contexts,answer
0,Apa tujuan dari Program Internship Internasional CCU/CoE 2024? ,"Tujuannya adalah untuk memberikan kesempatan bagi mahasiswa internasional untuk memahami lebih baik penelitian di bidang teknik dan teknologi di CCU, serta untuk mempraktikkan keterampilan mereka, memperoleh kompetensi baru, dan mengalami budaya yang berbeda.","['Dipublikasikan tanggal 11 Januari 2024\nprogram beasiswa lain yang dipilih, sesuai\ndengan syarat dan ketentuan yang berlaku.\nApa saja komponen Dana yang diberikan?\n1. Dana Pendidikan\na. Tuition Fee\nb. Dana Pendaftaran\nc. Dana Tunjangan Buku\nd. Dana Penelitian Tesis\ne. Dana Seminar Internasional\nf. Dana Publikasi Jurnal Internasional\n2. Dana Pendukung\na. Dana Transportasi\nb. Dana Aplikasi Visa\nc. Dana Asuransi Kesehatan\nd. Dana Kedatangan\ne. Dana Hidup Bulanan\nf. Dana Lomba Internasional\ng. Dana keadaaan darurat (jika diperlukan)\nApa saja persyaratan umum pendaftaran\nBeasiswa Prioritas LPDP – Campus\nFrance Program Master?\nPersyaratan umum Beasiswa Prioritas LPDP –\nCampus France Program Master adalah sebagai\nberikut:\n1. Warga Negara Indonesia.\n2. Telah menyelesaikan studi program diploma\nempat (D4) atau sarjana (S1).\n3. Pendaftar yang telah menyelesaikan studi\nmagister (S2) tidak diizinkan mendaftar.\n4. Bagi pendaftar lulusan perguruan tinggi luar', '1. Setiap mahasiswa ITS yang ingin mendaftar program internasional di perguruan tinggi mitra ITS luar negeri yang\nmembutuhkan surat rekomendasi atau dana dukungan dari ITS di antaranya IISMA/IISMA-Vo, pertukaran pelajar (exchange),\nlab-internship, short program, atau program lain di luar negeri, diharuskan memiliki sertifikat Global Competency\nWorkshop (GCW) atau Global Competency Academy (GCA). Sertifikat ini hanya bisa diperoleh dengan mengikuti program\nGCW atau GCA.', 'Program Master memberikan kesempatan bagi\npendaftar untuk dapat melakukan pendaftaran\npada Beasiswa Kemitraan LPDP – Campus\nFrance dan beasiswa Magister Luar Negeri\npada salah satu program:\n1. Beasiswa Afirmasi\na. Beasiswa Daerah Afirmasi\nb. Beasiswa Putra Putri Papua\nc. Beasiswa Penyandang Disabilitas\nd. Beasiswa Prasejahtera\n2. Beasiswa Targeted\na. Beasiswa PNS, TNI, POLRI\nb. Beasiswa Kewirausahaan\nc. Beasiswa Umum\na. Beasiswa Reguler\nb. Beasiswa Parsial\nBeasiswa Kemitraan LPDP - Campus France\nmerupakan beasiswa kerja sama antara LPDP dan\nPemerintah Perancis pada jenjang master untuk\nbidang prioritas pembangunan Indonesia sesuai\ndengan keahlian pengetahuan yang dimiliki oleh\nUniversitas di Perancis dalam rangka\nmenghasilkan pemimpin masa depan Indonesia\nyang kompeten di bidang tersebut.\nSiapakah Sasaran Beasiswa Prioritas\nLPDP – Campus France Program Master?\n1. Warga Negara Indonesia (WNI)\n2. PNS/TNI/POLRI\nSeperti Apa Skema Prioritas LPDP –\nCampus France Program Master?', 'Siapakah Sasaran Beasiswa Prioritas\nLPDP – Campus France Program Master?\n1. Warga Negara Indonesia (WNI)\n2. PNS/TNI/POLRI\nSeperti Apa Skema Prioritas LPDP –\nCampus France Program Master?\nPendaftar wajib mendaftar secara bersamaan\npada beasiswa Kemitraan LPDP – Campus France\nProgram Master dan salah satu program Magister\nbeasiswa Afirmasi/Targeted/Umum tujuan luar\nnegeri, dengan skema berikut.\n1. Beasiswa Kemitraan LPDP – Campus France\nProgram Master:\na. Beasiswa LPDP – Campus France\nProgram Master diperuntukkan bagi\nWarga Negara Indonesia untuk dapat\nmenempuh pendidikan pada program\nmagister di program studi dan universitas\nsebagaimana daftar terlampir dengan\ndurasi pendanaan paling lama 24 (dua\npuluh empat) bulan.\nb. Pendaftar diharuskan untuk melakukan\npendaftaran pada:\n● Perguruan Tinggi Tujuan Studi\nsesuai jadwal dan ketentuan yang\nberlaku di Perguruan Tinggi, dan\n● Campus France sesuai jadwal dan\nketentuan yang berlaku di Campus\nFrance.\n2. Persyaratan dan dokumen pada Beasiswa']",Saya tidak menemukan informasi tentang Program Internship Internasional CCU/CoE 2024 dalam konteks yang diberikan.
1,Kapan periode magang berlangsung?,"Periode magang berlangsung antara 1 Mei hingga 31 Desember 2024, minimal 8 minggu.","['Program Master memberikan kesempatan bagi\npendaftar untuk dapat melakukan pendaftaran\npada Beasiswa Kemitraan LPDP – Campus\nFrance dan beasiswa Magister Luar Negeri\npada salah satu program:\n1. Beasiswa Afirmasi\na. Beasiswa Daerah Afirmasi\nb. Beasiswa Putra Putri Papua\nc. Beasiswa Penyandang Disabilitas\nd. Beasiswa Prasejahtera\n2. Beasiswa Targeted\na. Beasiswa PNS, TNI, POLRI\nb. Beasiswa Kewirausahaan\nc. Beasiswa Umum\na. Beasiswa Reguler\nb. Beasiswa Parsial\nBeasiswa Kemitraan LPDP - Campus France\nmerupakan beasiswa kerja sama antara LPDP dan\nPemerintah Perancis pada jenjang master untuk\nbidang prioritas pembangunan Indonesia sesuai\ndengan keahlian pengetahuan yang dimiliki oleh\nUniversitas di Perancis dalam rangka\nmenghasilkan pemimpin masa depan Indonesia\nyang kompeten di bidang tersebut.\nSiapakah Sasaran Beasiswa Prioritas\nLPDP – Campus France Program Master?\n1. Warga Negara Indonesia (WNI)\n2. PNS/TNI/POLRI\nSeperti Apa Skema Prioritas LPDP –\nCampus France Program Master?', 'Siapakah Sasaran Beasiswa Prioritas\nLPDP – Campus France Program Master?\n1. Warga Negara Indonesia (WNI)\n2. PNS/TNI/POLRI\nSeperti Apa Skema Prioritas LPDP –\nCampus France Program Master?\nPendaftar wajib mendaftar secara bersamaan\npada beasiswa Kemitraan LPDP – Campus France\nProgram Master dan salah satu program Magister\nbeasiswa Afirmasi/Targeted/Umum tujuan luar\nnegeri, dengan skema berikut.\n1. Beasiswa Kemitraan LPDP – Campus France\nProgram Master:\na. Beasiswa LPDP – Campus France\nProgram Master diperuntukkan bagi\nWarga Negara Indonesia untuk dapat\nmenempuh pendidikan pada program\nmagister di program studi dan universitas\nsebagaimana daftar terlampir dengan\ndurasi pendanaan paling lama 24 (dua\npuluh empat) bulan.\nb. Pendaftar diharuskan untuk melakukan\npendaftaran pada:\n● Perguruan Tinggi Tujuan Studi\nsesuai jadwal dan ketentuan yang\nberlaku di Perguruan Tinggi, dan\n● Campus France sesuai jadwal dan\nketentuan yang berlaku di Campus\nFrance.\n2. Persyaratan dan dokumen pada Beasiswa', 'kejuaraan/non kejuaraan, dan pengalaman\norganisasi pada aplikasi pendaftaran.\nApa saja persyaratan khusus pendaftaran\nBeasiswa Prioritas LPDP – Campus France\nProgram Master?\nPersyaratan khusus Beasiswa Kemitraan LPDP –\nCampus France Program Master adalah sebagai\nberikut:', 'beasiswa dengan kewajiban pengembalian\ndana studi yang telah diterima dan\npemblokiran untuk mengikuti program LPDP\ndi masa mendatang.\nBagaimana dengan ketentuan\nPengabdian yang ditetapkan LPDP?\n1. Penerima Beasiswa wajib kembali dan\nmengabdi di Indonesia setelah selesai studi\nsesuai dengan ketentuan LPDP.\n2. Kembali ke Indonesia dan berkontribusi di\nIndonesia selama 2 kali masa studi ditambah']",Saya tidak tahu.
2,Apa saja jenis beasiswa yang ditawarkan dalam program ini?,Program menawarkan dua jenis beasiswa: (A) Beasiswa dan (B) magang dengan biaya sendiri (self-supported).,"['Program Master memberikan kesempatan bagi\npendaftar untuk dapat melakukan pendaftaran\npada Beasiswa Kemitraan LPDP – Campus\nFrance dan beasiswa Magister Luar Negeri\npada salah satu program:\n1. Beasiswa Afirmasi\na. Beasiswa Daerah Afirmasi\nb. Beasiswa Putra Putri Papua\nc. Beasiswa Penyandang Disabilitas\nd. Beasiswa Prasejahtera\n2. Beasiswa Targeted\na. Beasiswa PNS, TNI, POLRI\nb. Beasiswa Kewirausahaan\nc. Beasiswa Umum\na. Beasiswa Reguler\nb. Beasiswa Parsial\nBeasiswa Kemitraan LPDP - Campus France\nmerupakan beasiswa kerja sama antara LPDP dan\nPemerintah Perancis pada jenjang master untuk\nbidang prioritas pembangunan Indonesia sesuai\ndengan keahlian pengetahuan yang dimiliki oleh\nUniversitas di Perancis dalam rangka\nmenghasilkan pemimpin masa depan Indonesia\nyang kompeten di bidang tersebut.\nSiapakah Sasaran Beasiswa Prioritas\nLPDP – Campus France Program Master?\n1. Warga Negara Indonesia (WNI)\n2. PNS/TNI/POLRI\nSeperti Apa Skema Prioritas LPDP –\nCampus France Program Master?', 'Dipublikasikan tanggal 11 Januari 2024\nprogram beasiswa lain yang dipilih, sesuai\ndengan syarat dan ketentuan yang berlaku.\nApa saja komponen Dana yang diberikan?\n1. Dana Pendidikan\na. Tuition Fee\nb. Dana Pendaftaran\nc. Dana Tunjangan Buku\nd. Dana Penelitian Tesis\ne. Dana Seminar Internasional\nf. Dana Publikasi Jurnal Internasional\n2. Dana Pendukung\na. Dana Transportasi\nb. Dana Aplikasi Visa\nc. Dana Asuransi Kesehatan\nd. Dana Kedatangan\ne. Dana Hidup Bulanan\nf. Dana Lomba Internasional\ng. Dana keadaaan darurat (jika diperlukan)\nApa saja persyaratan umum pendaftaran\nBeasiswa Prioritas LPDP – Campus\nFrance Program Master?\nPersyaratan umum Beasiswa Prioritas LPDP –\nCampus France Program Master adalah sebagai\nberikut:\n1. Warga Negara Indonesia.\n2. Telah menyelesaikan studi program diploma\nempat (D4) atau sarjana (S1).\n3. Pendaftar yang telah menyelesaikan studi\nmagister (S2) tidak diizinkan mendaftar.\n4. Bagi pendaftar lulusan perguruan tinggi luar', 'Syarat dokumen mengikuti syarat program\nbeasiswa yang dipilih (mengacu pada Buku\nPanduan masing-masing program beasiswa).\nSeperti apa format Komitmen kembali ke\nIndonesia, rencana pasca studi, dan\nrencana kontribusi di Indonesia serta\nRencana Bisnis atau Rencana\nPengembangan Bisnis?\nKomitmen kembali ke Indonesia, rencana\npasca studi, dan rencana kontribusi di\nIndonesia (1500 – 2000 kata)\nDeskripsikan dalam tulisan secara jelas dan\nkonkret tentang tema di atas.', '1. Setiap mahasiswa ITS yang ingin mendaftar program internasional di perguruan tinggi mitra ITS luar negeri yang\nmembutuhkan surat rekomendasi atau dana dukungan dari ITS di antaranya IISMA/IISMA-Vo, pertukaran pelajar (exchange),\nlab-internship, short program, atau program lain di luar negeri, diharuskan memiliki sertifikat Global Competency\nWorkshop (GCW) atau Global Competency Academy (GCA). Sertifikat ini hanya bisa diperoleh dengan mengikuti program\nGCW atau GCA.']","Jenis beasiswa yang ditawarkan dalam program ini adalah:
1. Beasiswa Afirmasi
   a. Beasiswa Daerah Afirmasi
   b. Beasiswa Putra Putri Papua
   c. Beasiswa Penyandang Disabilitas
   d. Beasiswa Prasejahtera
2. Beasiswa Targeted
   a. Beasiswa PNS, TNI, POLRI
   b. Beasiswa Kewirausahaan
   c. Beasiswa Umum
      - Beasiswa Reguler
      - Beasiswa Parsial

Beasiswa Kemitraan LPDP - Campus France merupakan beasiswa kerja sama antara LPDP dan Pemerintah Perancis pada jenjang master untuk bidang prioritas pembangunan Indonesia."
3,Apa saja manfaat dari Beasiswa Tipe-A? ,"Beasiswa Tipe-A mencakup akomodasi di kampus, tunjangan mingguan sebesar NTD 1,500, dan penggantian biaya tiket pesawat (maksimal NTD 10,000).","['Program Master memberikan kesempatan bagi\npendaftar untuk dapat melakukan pendaftaran\npada Beasiswa Kemitraan LPDP – Campus\nFrance dan beasiswa Magister Luar Negeri\npada salah satu program:\n1. Beasiswa Afirmasi\na. Beasiswa Daerah Afirmasi\nb. Beasiswa Putra Putri Papua\nc. Beasiswa Penyandang Disabilitas\nd. Beasiswa Prasejahtera\n2. Beasiswa Targeted\na. Beasiswa PNS, TNI, POLRI\nb. Beasiswa Kewirausahaan\nc. Beasiswa Umum\na. Beasiswa Reguler\nb. Beasiswa Parsial\nBeasiswa Kemitraan LPDP - Campus France\nmerupakan beasiswa kerja sama antara LPDP dan\nPemerintah Perancis pada jenjang master untuk\nbidang prioritas pembangunan Indonesia sesuai\ndengan keahlian pengetahuan yang dimiliki oleh\nUniversitas di Perancis dalam rangka\nmenghasilkan pemimpin masa depan Indonesia\nyang kompeten di bidang tersebut.\nSiapakah Sasaran Beasiswa Prioritas\nLPDP – Campus France Program Master?\n1. Warga Negara Indonesia (WNI)\n2. PNS/TNI/POLRI\nSeperti Apa Skema Prioritas LPDP –\nCampus France Program Master?', 'Dipublikasikan tanggal 11 Januari 2024\nprogram beasiswa lain yang dipilih, sesuai\ndengan syarat dan ketentuan yang berlaku.\nApa saja komponen Dana yang diberikan?\n1. Dana Pendidikan\na. Tuition Fee\nb. Dana Pendaftaran\nc. Dana Tunjangan Buku\nd. Dana Penelitian Tesis\ne. Dana Seminar Internasional\nf. Dana Publikasi Jurnal Internasional\n2. Dana Pendukung\na. Dana Transportasi\nb. Dana Aplikasi Visa\nc. Dana Asuransi Kesehatan\nd. Dana Kedatangan\ne. Dana Hidup Bulanan\nf. Dana Lomba Internasional\ng. Dana keadaaan darurat (jika diperlukan)\nApa saja persyaratan umum pendaftaran\nBeasiswa Prioritas LPDP – Campus\nFrance Program Master?\nPersyaratan umum Beasiswa Prioritas LPDP –\nCampus France Program Master adalah sebagai\nberikut:\n1. Warga Negara Indonesia.\n2. Telah menyelesaikan studi program diploma\nempat (D4) atau sarjana (S1).\n3. Pendaftar yang telah menyelesaikan studi\nmagister (S2) tidak diizinkan mendaftar.\n4. Bagi pendaftar lulusan perguruan tinggi luar', 'Siapakah Sasaran Beasiswa Prioritas\nLPDP – Campus France Program Master?\n1. Warga Negara Indonesia (WNI)\n2. PNS/TNI/POLRI\nSeperti Apa Skema Prioritas LPDP –\nCampus France Program Master?\nPendaftar wajib mendaftar secara bersamaan\npada beasiswa Kemitraan LPDP – Campus France\nProgram Master dan salah satu program Magister\nbeasiswa Afirmasi/Targeted/Umum tujuan luar\nnegeri, dengan skema berikut.\n1. Beasiswa Kemitraan LPDP – Campus France\nProgram Master:\na. Beasiswa LPDP – Campus France\nProgram Master diperuntukkan bagi\nWarga Negara Indonesia untuk dapat\nmenempuh pendidikan pada program\nmagister di program studi dan universitas\nsebagaimana daftar terlampir dengan\ndurasi pendanaan paling lama 24 (dua\npuluh empat) bulan.\nb. Pendaftar diharuskan untuk melakukan\npendaftaran pada:\n● Perguruan Tinggi Tujuan Studi\nsesuai jadwal dan ketentuan yang\nberlaku di Perguruan Tinggi, dan\n● Campus France sesuai jadwal dan\nketentuan yang berlaku di Campus\nFrance.\n2. Persyaratan dan dokumen pada Beasiswa', 'kejuaraan/non kejuaraan, dan pengalaman\norganisasi pada aplikasi pendaftaran.\nApa saja persyaratan khusus pendaftaran\nBeasiswa Prioritas LPDP – Campus France\nProgram Master?\nPersyaratan khusus Beasiswa Kemitraan LPDP –\nCampus France Program Master adalah sebagai\nberikut:']","Tipe-A adalah salah satu jenis Beasiswa Prioritas LPDP - Campus France Program Master yang memberikan manfaat berupa dana pendidikan seperti tuition fee, dana pendaftaran, dana tunjangan buku, dana penelitian tesis, dana seminar internasional, dan dana publikasi jurnal internasional. Selain itu, manfaatnya juga mencakup dana pendukung seperti dana transportasi, dana aplikasi visa, dana asuransi kesehatan, dana kedatangan, dana hidup bulanan, dana lomba internasional, dan dana keadaan darurat jika diperlukan."
4,Siapa yang memenuhi syarat untuk mendaftar program ini?,Program ini terbuka untuk mahasiswa pascasarjana (S2/S3) dan mahasiswa tahun ketiga atau lebih tinggi. Mahasiswa yang sudah menyelesaikan gelar PhD tidak memenuhi syarat.,"['Siapakah Sasaran Beasiswa Prioritas\nLPDP – Campus France Program Master?\n1. Warga Negara Indonesia (WNI)\n2. PNS/TNI/POLRI\nSeperti Apa Skema Prioritas LPDP –\nCampus France Program Master?\nPendaftar wajib mendaftar secara bersamaan\npada beasiswa Kemitraan LPDP – Campus France\nProgram Master dan salah satu program Magister\nbeasiswa Afirmasi/Targeted/Umum tujuan luar\nnegeri, dengan skema berikut.\n1. Beasiswa Kemitraan LPDP – Campus France\nProgram Master:\na. Beasiswa LPDP – Campus France\nProgram Master diperuntukkan bagi\nWarga Negara Indonesia untuk dapat\nmenempuh pendidikan pada program\nmagister di program studi dan universitas\nsebagaimana daftar terlampir dengan\ndurasi pendanaan paling lama 24 (dua\npuluh empat) bulan.\nb. Pendaftar diharuskan untuk melakukan\npendaftaran pada:\n● Perguruan Tinggi Tujuan Studi\nsesuai jadwal dan ketentuan yang\nberlaku di Perguruan Tinggi, dan\n● Campus France sesuai jadwal dan\nketentuan yang berlaku di Campus\nFrance.\n2. Persyaratan dan dokumen pada Beasiswa', 'Program Master memberikan kesempatan bagi\npendaftar untuk dapat melakukan pendaftaran\npada Beasiswa Kemitraan LPDP – Campus\nFrance dan beasiswa Magister Luar Negeri\npada salah satu program:\n1. Beasiswa Afirmasi\na. Beasiswa Daerah Afirmasi\nb. Beasiswa Putra Putri Papua\nc. Beasiswa Penyandang Disabilitas\nd. Beasiswa Prasejahtera\n2. Beasiswa Targeted\na. Beasiswa PNS, TNI, POLRI\nb. Beasiswa Kewirausahaan\nc. Beasiswa Umum\na. Beasiswa Reguler\nb. Beasiswa Parsial\nBeasiswa Kemitraan LPDP - Campus France\nmerupakan beasiswa kerja sama antara LPDP dan\nPemerintah Perancis pada jenjang master untuk\nbidang prioritas pembangunan Indonesia sesuai\ndengan keahlian pengetahuan yang dimiliki oleh\nUniversitas di Perancis dalam rangka\nmenghasilkan pemimpin masa depan Indonesia\nyang kompeten di bidang tersebut.\nSiapakah Sasaran Beasiswa Prioritas\nLPDP – Campus France Program Master?\n1. Warga Negara Indonesia (WNI)\n2. PNS/TNI/POLRI\nSeperti Apa Skema Prioritas LPDP –\nCampus France Program Master?', '1. Setiap mahasiswa ITS yang ingin mendaftar program internasional di perguruan tinggi mitra ITS luar negeri yang\nmembutuhkan surat rekomendasi atau dana dukungan dari ITS di antaranya IISMA/IISMA-Vo, pertukaran pelajar (exchange),\nlab-internship, short program, atau program lain di luar negeri, diharuskan memiliki sertifikat Global Competency\nWorkshop (GCW) atau Global Competency Academy (GCA). Sertifikat ini hanya bisa diperoleh dengan mengikuti program\nGCW atau GCA.', 'b. Kelas khusus;\nc. Kelas karyawan;\nd. Kelas jarak jauh;\ne. Kelas yang diselenggarakan bukan di\nperguruan tinggi induk;\nf. Kelas internasional bagi pendaftar tujuan\nstudi dalam negeri;\ng. Kelas yang diselenggarakan di lebih dari\n1 (satu) negara perguruan tinggi; atau\nh. Kelas lainnya yang tidak memenuhi\nketentuan LPDP.\n14. Menyetujui surat pernyataan yang telah\ndisediakan pada aplikasi pendaftaran\nbeasiswa LPDP (poin-poin terlampir).\n15. Menulis profil diri termasuk riwayat pendidikan\nyang tidak diselesaikan pada aplikasi\npendaftaran.\n16. Menulis komitmen kembali ke Indonesia,\nrencana pasca studi, dan rencana kontribusi\ndi Indonesia.\n17. Jika pendaftar memiliki publikasi ilmiah,\nprestasi kejuaraan/non kejuaraan, dan\npengalaman organisasi maka pendaftar\nmengisi riwayat publikasi ilmiah, prestasi\nkejuaraan/non kejuaraan, dan pengalaman\norganisasi pada aplikasi pendaftaran.\nApa saja persyaratan khusus pendaftaran\nBeasiswa Prioritas LPDP – Campus France\nProgram Master?']",Yang memenuhi syarat untuk mendaftar program Beasiswa Prioritas LPDP - Campus France Program Master adalah Warga Negara Indonesia (WNI) dan PNS/TNI/POLRI.
5,Apa persyaratan dokumen yang harus disiapkan untuk pendaftaran?,"Dokumen yang diperlukan meliputi: formulir aplikasi online, CV, transkrip resmi, surat rekomendasi, sertifikat kemampuan bahasa, rencana penelitian, salinan paspor, foto head-shot, dan dokumen tambahan opsional.","['✔\nSertifikat Bahasa Asing yang\ndipersyaratkan dan Masih\nBerlaku (Asli)\n✔\nSurat rekomendasi dari\nakademisi atau tokoh\nmasyarakat *)\n✔ ✔\nSurat usulan dari pejabat\nyang membidangi SDM untuk\npendaftar PNS/TNI/POLRI\nsesuai ketentuan\n✔\nSurat pernyataan pada\naplikasi pendaftaran saat\n✔\nDokumen\nOnline\nForm\nUnggah\nakan melakukan submit\n(poin-poin terlampir)\nProfil diri pada formulir\npendaftaran online\n✔\nKomitmen kembali ke\nIndonesia, rencana pasca\nstudi, dan rencana kontribusi\ndi Indonesia.\n✔\nPublikasi ilmiah, prestasi\nkejuaraan/non kejuaraan,\ndan pengalaman organisasi.\n✔\nSK Jabatan terakhir bagi\nPNS\nPeneliti/Perekayasa/Medis/\nParamedis/Pendidik\n✔\n*) Surat harus diterbitkan paling lama 1 (satu)\ntahun di bulan yang sama dengan waktu\npendaftaran beasiswa\n2. Syarat dokumen program beasiswa lain\nSyarat dokumen mengikuti syarat program\nbeasiswa yang dipilih (mengacu pada Buku\nPanduan masing-masing program beasiswa).\nSeperti apa format Komitmen kembali ke\nIndonesia, rencana pasca studi, dan', 'Syarat dokumen mengikuti syarat program\nbeasiswa yang dipilih (mengacu pada Buku\nPanduan masing-masing program beasiswa).\nSeperti apa format Komitmen kembali ke\nIndonesia, rencana pasca studi, dan\nrencana kontribusi di Indonesia serta\nRencana Bisnis atau Rencana\nPengembangan Bisnis?\nKomitmen kembali ke Indonesia, rencana\npasca studi, dan rencana kontribusi di\nIndonesia (1500 – 2000 kata)\nDeskripsikan dalam tulisan secara jelas dan\nkonkret tentang tema di atas.', 'b. Kelas khusus;\nc. Kelas karyawan;\nd. Kelas jarak jauh;\ne. Kelas yang diselenggarakan bukan di\nperguruan tinggi induk;\nf. Kelas internasional bagi pendaftar tujuan\nstudi dalam negeri;\ng. Kelas yang diselenggarakan di lebih dari\n1 (satu) negara perguruan tinggi; atau\nh. Kelas lainnya yang tidak memenuhi\nketentuan LPDP.\n14. Menyetujui surat pernyataan yang telah\ndisediakan pada aplikasi pendaftaran\nbeasiswa LPDP (poin-poin terlampir).\n15. Menulis profil diri termasuk riwayat pendidikan\nyang tidak diselesaikan pada aplikasi\npendaftaran.\n16. Menulis komitmen kembali ke Indonesia,\nrencana pasca studi, dan rencana kontribusi\ndi Indonesia.\n17. Jika pendaftar memiliki publikasi ilmiah,\nprestasi kejuaraan/non kejuaraan, dan\npengalaman organisasi maka pendaftar\nmengisi riwayat publikasi ilmiah, prestasi\nkejuaraan/non kejuaraan, dan pengalaman\norganisasi pada aplikasi pendaftaran.\nApa saja persyaratan khusus pendaftaran\nBeasiswa Prioritas LPDP – Campus France\nProgram Master?', 'negeri lainnya (Beasiswa Afirmasi/Beasiswa\nTargeted/Beasiswa Umum), mengikuti syarat\nprogram beasiswa yang dipilih.\nKetentuan tentang LoA\nLetter of Admission/Acceptance (LoA) adalah surat\nresmi dari perguruan tinggi yang menyatakan\nbahwa seseorang telah diterima sebagai\nmahasiswa di perguruan tinggi tersebut.\n1. LoA sekurang-kurangnya mencantumkan\nnama lengkap, jenjang studi, program studi,\ndan memuat informasi waktu memulai studi\nsesuai ketentuan LPDP.\n2. Perguruan Tinggi dan Program Studi harus\nsesuai dengan pilihan pada aplikasi\npendaftaran.\n3. LoA yang dapat diterima oleh LPDP adalah\nLoA tanpa persyaratan untuk studi di\nperguruan tinggi, kecuali persyaratan berupa:\na. Persyaratan sponsor pendanaan;\nb. Persyaratan dokumen fisik ijazah;\nc. Persyaratan dokumen fisik transkrip nilai\njenjang sebelumnya; dan/atau\nd. Persyaratan tambahan lain yang tidak\nberisiko mengubah status diterimanya\norang tersebut sebagai mahasiswa pada\nprogram studi yang dituju.']","Untuk pendaftaran, berikut adalah persyaratan dokumen yang harus disiapkan:

1. Sertifikat Bahasa Asing yang masih berlaku (Asli)
2. Surat rekomendasi dari akademisi atau tokoh masyarakat
3. Surat usulan dari pejabat yang membidangi SDM untuk pendaftar PNS/TNI/POLRI sesuai ketentuan
4. Surat pernyataan pada aplikasi pendaftaran saat melakukan submit
5. Profil diri pada formulir pendaftaran online
6. Komitmen kembali ke Indonesia, rencana pasca studi, dan rencana kontribusi di Indonesia
7. Publikasi ilmiah, prestasi kejuaraan/non kejuaraan, dan pengalaman organisasi
8. SK Jabatan terakhir bagi PNS
9. Dokumen sesuai dengan syarat program beasiswa yang dipilih

Demikianlah persyaratan dokumen yang harus disiapkan untuk pendaftaran."
6,Bagaimana cara mengajukan aplikasi untuk program ini?,"Pelamar harus membaca persyaratan setiap topik penelitian dengan cermat, melengkapi formulir aplikasi online, menyiapkan dokumen aplikasi, dan mengirim semuanya dalam file ZIP ke coleng_dia@ccu.edu.tw dengan subjek email “Application for 2024 CCU/COE International Internship”.","['Program Master memberikan kesempatan bagi\npendaftar untuk dapat melakukan pendaftaran\npada Beasiswa Kemitraan LPDP – Campus\nFrance dan beasiswa Magister Luar Negeri\npada salah satu program:\n1. Beasiswa Afirmasi\na. Beasiswa Daerah Afirmasi\nb. Beasiswa Putra Putri Papua\nc. Beasiswa Penyandang Disabilitas\nd. Beasiswa Prasejahtera\n2. Beasiswa Targeted\na. Beasiswa PNS, TNI, POLRI\nb. Beasiswa Kewirausahaan\nc. Beasiswa Umum\na. Beasiswa Reguler\nb. Beasiswa Parsial\nBeasiswa Kemitraan LPDP - Campus France\nmerupakan beasiswa kerja sama antara LPDP dan\nPemerintah Perancis pada jenjang master untuk\nbidang prioritas pembangunan Indonesia sesuai\ndengan keahlian pengetahuan yang dimiliki oleh\nUniversitas di Perancis dalam rangka\nmenghasilkan pemimpin masa depan Indonesia\nyang kompeten di bidang tersebut.\nSiapakah Sasaran Beasiswa Prioritas\nLPDP – Campus France Program Master?\n1. Warga Negara Indonesia (WNI)\n2. PNS/TNI/POLRI\nSeperti Apa Skema Prioritas LPDP –\nCampus France Program Master?', 'Siapakah Sasaran Beasiswa Prioritas\nLPDP – Campus France Program Master?\n1. Warga Negara Indonesia (WNI)\n2. PNS/TNI/POLRI\nSeperti Apa Skema Prioritas LPDP –\nCampus France Program Master?\nPendaftar wajib mendaftar secara bersamaan\npada beasiswa Kemitraan LPDP – Campus France\nProgram Master dan salah satu program Magister\nbeasiswa Afirmasi/Targeted/Umum tujuan luar\nnegeri, dengan skema berikut.\n1. Beasiswa Kemitraan LPDP – Campus France\nProgram Master:\na. Beasiswa LPDP – Campus France\nProgram Master diperuntukkan bagi\nWarga Negara Indonesia untuk dapat\nmenempuh pendidikan pada program\nmagister di program studi dan universitas\nsebagaimana daftar terlampir dengan\ndurasi pendanaan paling lama 24 (dua\npuluh empat) bulan.\nb. Pendaftar diharuskan untuk melakukan\npendaftaran pada:\n● Perguruan Tinggi Tujuan Studi\nsesuai jadwal dan ketentuan yang\nberlaku di Perguruan Tinggi, dan\n● Campus France sesuai jadwal dan\nketentuan yang berlaku di Campus\nFrance.\n2. Persyaratan dan dokumen pada Beasiswa', 'Syarat dokumen mengikuti syarat program\nbeasiswa yang dipilih (mengacu pada Buku\nPanduan masing-masing program beasiswa).\nSeperti apa format Komitmen kembali ke\nIndonesia, rencana pasca studi, dan\nrencana kontribusi di Indonesia serta\nRencana Bisnis atau Rencana\nPengembangan Bisnis?\nKomitmen kembali ke Indonesia, rencana\npasca studi, dan rencana kontribusi di\nIndonesia (1500 – 2000 kata)\nDeskripsikan dalam tulisan secara jelas dan\nkonkret tentang tema di atas.', 'beasiswa dengan kewajiban pengembalian\ndana studi yang telah diterima dan\npemblokiran untuk mengikuti program LPDP\ndi masa mendatang.\nBagaimana dengan ketentuan\nPengabdian yang ditetapkan LPDP?\n1. Penerima Beasiswa wajib kembali dan\nmengabdi di Indonesia setelah selesai studi\nsesuai dengan ketentuan LPDP.\n2. Kembali ke Indonesia dan berkontribusi di\nIndonesia selama 2 kali masa studi ditambah']","Untuk mengajukan aplikasi pada program Beasiswa Prioritas LPDP - Campus France Program Master, Anda perlu melakukan langkah-langkah berikut:

1. Pilih salah satu program beasiswa Magister luar negeri yang sesuai dengan kriteria Anda, seperti Beasiswa Afirmasi atau Beasiswa Targeted.
2. Daftar secara bersamaan pada Beasiswa Kemitraan LPDP - Campus France Program Master dan program Magister beasiswa yang Anda pilih.
3. Pastikan Anda memenuhi persyaratan dan dokumen yang dibutuhkan sesuai dengan Buku Panduan masing-masing program beasiswa.
4. Tulislah Komitmen kembali ke Indonesia, rencana pasca studi, rencana kontribusi di Indonesia, serta Rencana Bisnis atau Rencana Pengembangan Bisnis dalam 1500-2000 kata dengan jelas dan konkret.
5. Pahami dan patuhi ketentuan Pengabdian yang ditetapkan oleh LPDP, yaitu kembali dan mengabdi di Indonesia setelah selesai studi sesuai dengan ketentuan yang berlaku.

Dengan mengikuti langkah-langkah di atas, Anda dapat mengajukan aplikasi untuk program Beasiswa Prioritas LPDP - Campus France Program Master."
7,Apa tenggat waktu penyerahan aplikasi? ,Tenggat waktu penyerahan aplikasi adalah 3 Maret 2024.,"['beasiswa dengan kewajiban pengembalian\ndana studi yang telah diterima dan\npemblokiran untuk mengikuti program LPDP\ndi masa mendatang.\nBagaimana dengan ketentuan\nPengabdian yang ditetapkan LPDP?\n1. Penerima Beasiswa wajib kembali dan\nmengabdi di Indonesia setelah selesai studi\nsesuai dengan ketentuan LPDP.\n2. Kembali ke Indonesia dan berkontribusi di\nIndonesia selama 2 kali masa studi ditambah', 'Program Master memberikan kesempatan bagi\npendaftar untuk dapat melakukan pendaftaran\npada Beasiswa Kemitraan LPDP – Campus\nFrance dan beasiswa Magister Luar Negeri\npada salah satu program:\n1. Beasiswa Afirmasi\na. Beasiswa Daerah Afirmasi\nb. Beasiswa Putra Putri Papua\nc. Beasiswa Penyandang Disabilitas\nd. Beasiswa Prasejahtera\n2. Beasiswa Targeted\na. Beasiswa PNS, TNI, POLRI\nb. Beasiswa Kewirausahaan\nc. Beasiswa Umum\na. Beasiswa Reguler\nb. Beasiswa Parsial\nBeasiswa Kemitraan LPDP - Campus France\nmerupakan beasiswa kerja sama antara LPDP dan\nPemerintah Perancis pada jenjang master untuk\nbidang prioritas pembangunan Indonesia sesuai\ndengan keahlian pengetahuan yang dimiliki oleh\nUniversitas di Perancis dalam rangka\nmenghasilkan pemimpin masa depan Indonesia\nyang kompeten di bidang tersebut.\nSiapakah Sasaran Beasiswa Prioritas\nLPDP – Campus France Program Master?\n1. Warga Negara Indonesia (WNI)\n2. PNS/TNI/POLRI\nSeperti Apa Skema Prioritas LPDP –\nCampus France Program Master?', 'Syarat dokumen mengikuti syarat program\nbeasiswa yang dipilih (mengacu pada Buku\nPanduan masing-masing program beasiswa).\nSeperti apa format Komitmen kembali ke\nIndonesia, rencana pasca studi, dan\nrencana kontribusi di Indonesia serta\nRencana Bisnis atau Rencana\nPengembangan Bisnis?\nKomitmen kembali ke Indonesia, rencana\npasca studi, dan rencana kontribusi di\nIndonesia (1500 – 2000 kata)\nDeskripsikan dalam tulisan secara jelas dan\nkonkret tentang tema di atas.', 'Siapakah Sasaran Beasiswa Prioritas\nLPDP – Campus France Program Master?\n1. Warga Negara Indonesia (WNI)\n2. PNS/TNI/POLRI\nSeperti Apa Skema Prioritas LPDP –\nCampus France Program Master?\nPendaftar wajib mendaftar secara bersamaan\npada beasiswa Kemitraan LPDP – Campus France\nProgram Master dan salah satu program Magister\nbeasiswa Afirmasi/Targeted/Umum tujuan luar\nnegeri, dengan skema berikut.\n1. Beasiswa Kemitraan LPDP – Campus France\nProgram Master:\na. Beasiswa LPDP – Campus France\nProgram Master diperuntukkan bagi\nWarga Negara Indonesia untuk dapat\nmenempuh pendidikan pada program\nmagister di program studi dan universitas\nsebagaimana daftar terlampir dengan\ndurasi pendanaan paling lama 24 (dua\npuluh empat) bulan.\nb. Pendaftar diharuskan untuk melakukan\npendaftaran pada:\n● Perguruan Tinggi Tujuan Studi\nsesuai jadwal dan ketentuan yang\nberlaku di Perguruan Tinggi, dan\n● Campus France sesuai jadwal dan\nketentuan yang berlaku di Campus\nFrance.\n2. Persyaratan dan dokumen pada Beasiswa']","Tenggat waktu penyerahan aplikasi untuk Beasiswa Prioritas LPDP - Campus France 2024 S1 tidak disebutkan dalam konteks yang diberikan. Oleh karena itu, saya tidak dapat memberikan informasi mengenai tenggat waktu penyerahan aplikasi."
8,Proyek apa saja yang tersedia dalam program ini?,"Terdapat berbagai proyek, termasuk ""Trustable Artificial Intelligence for Critical Applications and 6G Security,"" ""Grid-Forming and Grid-Following Inverter-based Resources for Low-Inertia Microgrid/Grid,"" dan banyak lagi.","['Program Master memberikan kesempatan bagi\npendaftar untuk dapat melakukan pendaftaran\npada Beasiswa Kemitraan LPDP – Campus\nFrance dan beasiswa Magister Luar Negeri\npada salah satu program:\n1. Beasiswa Afirmasi\na. Beasiswa Daerah Afirmasi\nb. Beasiswa Putra Putri Papua\nc. Beasiswa Penyandang Disabilitas\nd. Beasiswa Prasejahtera\n2. Beasiswa Targeted\na. Beasiswa PNS, TNI, POLRI\nb. Beasiswa Kewirausahaan\nc. Beasiswa Umum\na. Beasiswa Reguler\nb. Beasiswa Parsial\nBeasiswa Kemitraan LPDP - Campus France\nmerupakan beasiswa kerja sama antara LPDP dan\nPemerintah Perancis pada jenjang master untuk\nbidang prioritas pembangunan Indonesia sesuai\ndengan keahlian pengetahuan yang dimiliki oleh\nUniversitas di Perancis dalam rangka\nmenghasilkan pemimpin masa depan Indonesia\nyang kompeten di bidang tersebut.\nSiapakah Sasaran Beasiswa Prioritas\nLPDP – Campus France Program Master?\n1. Warga Negara Indonesia (WNI)\n2. PNS/TNI/POLRI\nSeperti Apa Skema Prioritas LPDP –\nCampus France Program Master?', '1. Setiap mahasiswa ITS yang ingin mendaftar program internasional di perguruan tinggi mitra ITS luar negeri yang\nmembutuhkan surat rekomendasi atau dana dukungan dari ITS di antaranya IISMA/IISMA-Vo, pertukaran pelajar (exchange),\nlab-internship, short program, atau program lain di luar negeri, diharuskan memiliki sertifikat Global Competency\nWorkshop (GCW) atau Global Competency Academy (GCA). Sertifikat ini hanya bisa diperoleh dengan mengikuti program\nGCW atau GCA.', 'Syarat dokumen mengikuti syarat program\nbeasiswa yang dipilih (mengacu pada Buku\nPanduan masing-masing program beasiswa).\nSeperti apa format Komitmen kembali ke\nIndonesia, rencana pasca studi, dan\nrencana kontribusi di Indonesia serta\nRencana Bisnis atau Rencana\nPengembangan Bisnis?\nKomitmen kembali ke Indonesia, rencana\npasca studi, dan rencana kontribusi di\nIndonesia (1500 – 2000 kata)\nDeskripsikan dalam tulisan secara jelas dan\nkonkret tentang tema di atas.', 'Siapakah Sasaran Beasiswa Prioritas\nLPDP – Campus France Program Master?\n1. Warga Negara Indonesia (WNI)\n2. PNS/TNI/POLRI\nSeperti Apa Skema Prioritas LPDP –\nCampus France Program Master?\nPendaftar wajib mendaftar secara bersamaan\npada beasiswa Kemitraan LPDP – Campus France\nProgram Master dan salah satu program Magister\nbeasiswa Afirmasi/Targeted/Umum tujuan luar\nnegeri, dengan skema berikut.\n1. Beasiswa Kemitraan LPDP – Campus France\nProgram Master:\na. Beasiswa LPDP – Campus France\nProgram Master diperuntukkan bagi\nWarga Negara Indonesia untuk dapat\nmenempuh pendidikan pada program\nmagister di program studi dan universitas\nsebagaimana daftar terlampir dengan\ndurasi pendanaan paling lama 24 (dua\npuluh empat) bulan.\nb. Pendaftar diharuskan untuk melakukan\npendaftaran pada:\n● Perguruan Tinggi Tujuan Studi\nsesuai jadwal dan ketentuan yang\nberlaku di Perguruan Tinggi, dan\n● Campus France sesuai jadwal dan\nketentuan yang berlaku di Campus\nFrance.\n2. Persyaratan dan dokumen pada Beasiswa']","Terdapat beberapa proyek beasiswa yang tersedia dalam program ini, antara lain:
1. Beasiswa Afirmasi
   a. Beasiswa Daerah Afirmasi
   b. Beasiswa Putra Putri Papua
   c. Beasiswa Penyandang Disabilitas
   d. Beasiswa Prasejahtera
2. Beasiswa Targeted
   a. Beasiswa PNS, TNI, POLRI
   b. Beasiswa Kewirausahaan
   c. Beasiswa Umum
      - Beasiswa Reguler
      - Beasiswa Parsial

Selain itu, terdapat juga Beasiswa Kemitraan LPDP - Campus France yang merupakan kerja sama antara LPDP dan Pemerintah Perancis untuk jenjang master dalam bidang prioritas pembangunan Indonesia."
9,"Siapa mentor yang terlibat dalam proyek P1 ""Trustable Artificial Intelligence for Critical Applications and 6G Security""?","Mentor untuk proyek ini adalah Asst. Prof. Van-Linh Nguyen dari Dept. of Computer Science and Information Engineering, CCU.","['Program Master memberikan kesempatan bagi\npendaftar untuk dapat melakukan pendaftaran\npada Beasiswa Kemitraan LPDP – Campus\nFrance dan beasiswa Magister Luar Negeri\npada salah satu program:\n1. Beasiswa Afirmasi\na. Beasiswa Daerah Afirmasi\nb. Beasiswa Putra Putri Papua\nc. Beasiswa Penyandang Disabilitas\nd. Beasiswa Prasejahtera\n2. Beasiswa Targeted\na. Beasiswa PNS, TNI, POLRI\nb. Beasiswa Kewirausahaan\nc. Beasiswa Umum\na. Beasiswa Reguler\nb. Beasiswa Parsial\nBeasiswa Kemitraan LPDP - Campus France\nmerupakan beasiswa kerja sama antara LPDP dan\nPemerintah Perancis pada jenjang master untuk\nbidang prioritas pembangunan Indonesia sesuai\ndengan keahlian pengetahuan yang dimiliki oleh\nUniversitas di Perancis dalam rangka\nmenghasilkan pemimpin masa depan Indonesia\nyang kompeten di bidang tersebut.\nSiapakah Sasaran Beasiswa Prioritas\nLPDP – Campus France Program Master?\n1. Warga Negara Indonesia (WNI)\n2. PNS/TNI/POLRI\nSeperti Apa Skema Prioritas LPDP –\nCampus France Program Master?', '1. Setiap mahasiswa ITS yang ingin mendaftar program internasional di perguruan tinggi mitra ITS luar negeri yang\nmembutuhkan surat rekomendasi atau dana dukungan dari ITS di antaranya IISMA/IISMA-Vo, pertukaran pelajar (exchange),\nlab-internship, short program, atau program lain di luar negeri, diharuskan memiliki sertifikat Global Competency\nWorkshop (GCW) atau Global Competency Academy (GCA). Sertifikat ini hanya bisa diperoleh dengan mengikuti program\nGCW atau GCA.', 'Siapakah Sasaran Beasiswa Prioritas\nLPDP – Campus France Program Master?\n1. Warga Negara Indonesia (WNI)\n2. PNS/TNI/POLRI\nSeperti Apa Skema Prioritas LPDP –\nCampus France Program Master?\nPendaftar wajib mendaftar secara bersamaan\npada beasiswa Kemitraan LPDP – Campus France\nProgram Master dan salah satu program Magister\nbeasiswa Afirmasi/Targeted/Umum tujuan luar\nnegeri, dengan skema berikut.\n1. Beasiswa Kemitraan LPDP – Campus France\nProgram Master:\na. Beasiswa LPDP – Campus France\nProgram Master diperuntukkan bagi\nWarga Negara Indonesia untuk dapat\nmenempuh pendidikan pada program\nmagister di program studi dan universitas\nsebagaimana daftar terlampir dengan\ndurasi pendanaan paling lama 24 (dua\npuluh empat) bulan.\nb. Pendaftar diharuskan untuk melakukan\npendaftaran pada:\n● Perguruan Tinggi Tujuan Studi\nsesuai jadwal dan ketentuan yang\nberlaku di Perguruan Tinggi, dan\n● Campus France sesuai jadwal dan\nketentuan yang berlaku di Campus\nFrance.\n2. Persyaratan dan dokumen pada Beasiswa', 'Category\r\n■ Scholarship\r\n■ Self-supported\r\nIntern period At least 8 weeks between 2024/5/1- 2024/12/31\r\n\r\nNumber P16\r\nProject title\r\nNext generation Wireless communication, B5G/6G,\r\nReconfigurable Intelligent Surface, System level\r\nsimulation, Artificial Intelligence-enhanced wireless\r\nresearch\r\nDescription of the\r\nresearch\r\nInnovate and design cutting-edge concepts and\r\narchitectures beyond 5G (B5G) and 6G.\r\nIdentify and validate solutions to key problems through\r\nsimulation or prototype experiments.\r\nConduct research on AI and machine learning\r\ntechniques applied to wireless communications and\r\nnetworks.\r\nDesign and implement novel algorithms, models, and\r\nprotocols to optimize wireless network performance.\r\nCollaborate with the research team to manage projects\r\nand ensure timely deliverables,\r\nPlease refer to the website of our lab at\r\nhttps://sites.google.com/view/ccuantlab/english\r\nMentor at CCU\r\nAssoc. Prof. Jen-Yi Pan\r\nDept. of Communications Engineering,']",Saya tidak tahu.
10,Apa yang dapat diperoleh peserta selama periode magang pada proyek P1? ,"Peserta akan memperoleh keterampilan dalam penelitian state-of-the-art, keterampilan pemrograman melalui proyek mini, debat untuk mendapatkan ide kreatif, pelaporan hasil secara profesional, dan menghadiri tur industri serta kursus bahasa Tionghoa.","['Program Master memberikan kesempatan bagi\npendaftar untuk dapat melakukan pendaftaran\npada Beasiswa Kemitraan LPDP – Campus\nFrance dan beasiswa Magister Luar Negeri\npada salah satu program:\n1. Beasiswa Afirmasi\na. Beasiswa Daerah Afirmasi\nb. Beasiswa Putra Putri Papua\nc. Beasiswa Penyandang Disabilitas\nd. Beasiswa Prasejahtera\n2. Beasiswa Targeted\na. Beasiswa PNS, TNI, POLRI\nb. Beasiswa Kewirausahaan\nc. Beasiswa Umum\na. Beasiswa Reguler\nb. Beasiswa Parsial\nBeasiswa Kemitraan LPDP - Campus France\nmerupakan beasiswa kerja sama antara LPDP dan\nPemerintah Perancis pada jenjang master untuk\nbidang prioritas pembangunan Indonesia sesuai\ndengan keahlian pengetahuan yang dimiliki oleh\nUniversitas di Perancis dalam rangka\nmenghasilkan pemimpin masa depan Indonesia\nyang kompeten di bidang tersebut.\nSiapakah Sasaran Beasiswa Prioritas\nLPDP – Campus France Program Master?\n1. Warga Negara Indonesia (WNI)\n2. PNS/TNI/POLRI\nSeperti Apa Skema Prioritas LPDP –\nCampus France Program Master?', 'Siapakah Sasaran Beasiswa Prioritas\nLPDP – Campus France Program Master?\n1. Warga Negara Indonesia (WNI)\n2. PNS/TNI/POLRI\nSeperti Apa Skema Prioritas LPDP –\nCampus France Program Master?\nPendaftar wajib mendaftar secara bersamaan\npada beasiswa Kemitraan LPDP – Campus France\nProgram Master dan salah satu program Magister\nbeasiswa Afirmasi/Targeted/Umum tujuan luar\nnegeri, dengan skema berikut.\n1. Beasiswa Kemitraan LPDP – Campus France\nProgram Master:\na. Beasiswa LPDP – Campus France\nProgram Master diperuntukkan bagi\nWarga Negara Indonesia untuk dapat\nmenempuh pendidikan pada program\nmagister di program studi dan universitas\nsebagaimana daftar terlampir dengan\ndurasi pendanaan paling lama 24 (dua\npuluh empat) bulan.\nb. Pendaftar diharuskan untuk melakukan\npendaftaran pada:\n● Perguruan Tinggi Tujuan Studi\nsesuai jadwal dan ketentuan yang\nberlaku di Perguruan Tinggi, dan\n● Campus France sesuai jadwal dan\nketentuan yang berlaku di Campus\nFrance.\n2. Persyaratan dan dokumen pada Beasiswa', 'beasiswa dengan kewajiban pengembalian\ndana studi yang telah diterima dan\npemblokiran untuk mengikuti program LPDP\ndi masa mendatang.\nBagaimana dengan ketentuan\nPengabdian yang ditetapkan LPDP?\n1. Penerima Beasiswa wajib kembali dan\nmengabdi di Indonesia setelah selesai studi\nsesuai dengan ketentuan LPDP.\n2. Kembali ke Indonesia dan berkontribusi di\nIndonesia selama 2 kali masa studi ditambah', '1. Setiap mahasiswa ITS yang ingin mendaftar program internasional di perguruan tinggi mitra ITS luar negeri yang\nmembutuhkan surat rekomendasi atau dana dukungan dari ITS di antaranya IISMA/IISMA-Vo, pertukaran pelajar (exchange),\nlab-internship, short program, atau program lain di luar negeri, diharuskan memiliki sertifikat Global Competency\nWorkshop (GCW) atau Global Competency Academy (GCA). Sertifikat ini hanya bisa diperoleh dengan mengikuti program\nGCW atau GCA.']",Saya tidak menemukan informasi mengenai proyek P1 dalam konteks yang diberikan.
11,"Proyek P2 ""A Study of Grid-Forming and Grid-Following Inverter-based Resources for Low-Inertia Microgrid/Grid with Virtual Inertia and Grid Voltage Support Functions"" mencakup apa?",Proyek ini mencakup penelitian berbasis simulasi untuk meningkatkan ketahanan dan stabilitas jaringan mikrogid/inverter berinertia rendah dengan menggunakan inverter GFM dan GFL dengan fungsi inertia virtual dan dukungan tegangan grid.,"['beasiswa dengan kewajiban pengembalian\ndana studi yang telah diterima dan\npemblokiran untuk mengikuti program LPDP\ndi masa mendatang.\nBagaimana dengan ketentuan\nPengabdian yang ditetapkan LPDP?\n1. Penerima Beasiswa wajib kembali dan\nmengabdi di Indonesia setelah selesai studi\nsesuai dengan ketentuan LPDP.\n2. Kembali ke Indonesia dan berkontribusi di\nIndonesia selama 2 kali masa studi ditambah', 'Description of the research\r\nFour investigation topics over Ultra-Wideband Impulse\r\nRadar imaging system:\r\n1. A back-projection imaging algorithm used to\r\nreconstruct the radar image.\r\n2. The studies of the transmitting and receiving circuits\r\nand Vivaldi antenna array.\r\n3. mmWave/RF integrated circuit design such as PA and\r\nLNA, by CMOS process or III-V technology.\r\nEnergy harvesting within wireless communications\r\nenvironment\r\nMentor at CCU\r\nAssoc. Prof. Janne-Wha Wu\r\nDept. of, Electrical Engineering\r\nNational Chung Cheng University, Taiwan, ROC.\r\n(e-mail: jwwu@ccu.edu.tw)\r\nExpected student level\r\n■ Post-graduate student\r\n■ Third/forth-year undergraduate senior student\r\nCategory\r\n█ Scholarship\r\n█ Self-supported\r\nIntern period At least 10 weeks between May 1 and Dec. 31\r\n\r\nNumber P7\r\nProject title\r\nRenewable Energy Integration: Power System Analyses,\r\nPower Conversion or Intelligent Control\r\nDescription of the research\r\nThe students will learn the research topics about', 'some preliminary knowledge on NN (neural network) or\r\ndeep learning and skilled in Python programming. He/She\r\nwill learn how to apply state-of-the-art deep learning\r\ntechniques to solve the indicated problems. For more detail\r\nabout my topics, please visit my Youtube vide at:\r\nhttps://youtu.be/tIwenpyFRhw\r\nMentor at CCU\r\nProf. Wen-Nung Lie\r\nDept. of Electrical Engineering,\r\nNational Chung Cheng University, Taiwan.\r\n(e-mail: ieewnl@ccu.edu.tw)\r\nExpected student level\r\n■ Post-graduate student\r\n■ Third/forth-year undergraduate senior student\r\nCategory ■ Scholarship\r\nIntern period\r\nAt least 8 weeks (2 months) between May 1, 2024 and June\r\n30, 2025. However, 3-6 months is better.\r\n\r\nNumber P6\r\nProject title\r\nImpulse Radar Imaging System, mmWave/RF Intergrated\r\nCircuit design and Energy Harvesting\r\nDescription of the research\r\nFour investigation topics over Ultra-Wideband Impulse\r\nRadar imaging system:\r\n1. A back-projection imaging algorithm used to\r\nreconstruct the radar image.', 'vision.\r\n3. Publications in my research field\r\n4. International English proficiency certificate (TOEIC >=\r\n550, IELTS >=5.0, TOEFL iBT >= 80 )\r\nMentor at CCU\r\nAsst. Prof. Van-Linh Nguyen\r\nDept. of Computer Science and Information Engineering\r\nNational Chung Cheng University, Taiwan, ROC.\r\ne-mail: nvlinh@ccu.edu.tw\r\nExpected student level\r\n■ Post-graduate student\r\n■Third/forth-year undergraduate senior student\r\nCategory\r\n■ Scholarship\r\n■ Self-supported\r\nIntern period 8 weeks to 6 months between May and December 2024\r\n\r\nNumber P2\r\nProject title\r\nA Study of Grid-Forming and Grid-Following Inverter-based\r\nResources for Low-Inertia Microgrid/Grid with Virtual Inertia\r\nand Grid Voltage Support Functions\r\nDescription of the research\r\nMassive integration of inverter-based renewable energy\r\nsystems (IBRs) has been displacing conventional\r\nsynchronous generators and causing a reduction in system\r\ninertia. IBRs are integrated into power grids through power-']","Proyek P2 ""A Study of Grid-Forming and Grid-Following Inverter-based Resources for Low-Inertia Microgrid/Grid with Virtual Inertia and Grid Voltage Support Functions"" mencakup studi tentang integrasi sistem energi terbarukan berbasis inverter ke dalam jaringan listrik dengan fungsi virtual inertia dan dukungan tegangan grid. Ini termasuk penelitian tentang integrasi sistem energi terbarukan berbasis inverter (IBRs) yang menggantikan generator sinkron konvensional dan menyebabkan penurunan inersia sistem. IBRs diintegrasikan ke dalam jaringan listrik melalui teknologi power-grid-forming dan grid-following."
12,"Apa yang akan dipelajari dalam proyek P3 ""Lidar and Camera Fusion for Autonomous Driving""?","Peserta akan mengembangkan algoritma untuk kalibrasi data sensor, pemrosesan titik awan, dan pemrosesan gambar untuk penggabungan data lidar dan kamera untuk sistem mengemudi otonom.","['Program Master memberikan kesempatan bagi\npendaftar untuk dapat melakukan pendaftaran\npada Beasiswa Kemitraan LPDP – Campus\nFrance dan beasiswa Magister Luar Negeri\npada salah satu program:\n1. Beasiswa Afirmasi\na. Beasiswa Daerah Afirmasi\nb. Beasiswa Putra Putri Papua\nc. Beasiswa Penyandang Disabilitas\nd. Beasiswa Prasejahtera\n2. Beasiswa Targeted\na. Beasiswa PNS, TNI, POLRI\nb. Beasiswa Kewirausahaan\nc. Beasiswa Umum\na. Beasiswa Reguler\nb. Beasiswa Parsial\nBeasiswa Kemitraan LPDP - Campus France\nmerupakan beasiswa kerja sama antara LPDP dan\nPemerintah Perancis pada jenjang master untuk\nbidang prioritas pembangunan Indonesia sesuai\ndengan keahlian pengetahuan yang dimiliki oleh\nUniversitas di Perancis dalam rangka\nmenghasilkan pemimpin masa depan Indonesia\nyang kompeten di bidang tersebut.\nSiapakah Sasaran Beasiswa Prioritas\nLPDP – Campus France Program Master?\n1. Warga Negara Indonesia (WNI)\n2. PNS/TNI/POLRI\nSeperti Apa Skema Prioritas LPDP –\nCampus France Program Master?', 'Siapakah Sasaran Beasiswa Prioritas\nLPDP – Campus France Program Master?\n1. Warga Negara Indonesia (WNI)\n2. PNS/TNI/POLRI\nSeperti Apa Skema Prioritas LPDP –\nCampus France Program Master?\nPendaftar wajib mendaftar secara bersamaan\npada beasiswa Kemitraan LPDP – Campus France\nProgram Master dan salah satu program Magister\nbeasiswa Afirmasi/Targeted/Umum tujuan luar\nnegeri, dengan skema berikut.\n1. Beasiswa Kemitraan LPDP – Campus France\nProgram Master:\na. Beasiswa LPDP – Campus France\nProgram Master diperuntukkan bagi\nWarga Negara Indonesia untuk dapat\nmenempuh pendidikan pada program\nmagister di program studi dan universitas\nsebagaimana daftar terlampir dengan\ndurasi pendanaan paling lama 24 (dua\npuluh empat) bulan.\nb. Pendaftar diharuskan untuk melakukan\npendaftaran pada:\n● Perguruan Tinggi Tujuan Studi\nsesuai jadwal dan ketentuan yang\nberlaku di Perguruan Tinggi, dan\n● Campus France sesuai jadwal dan\nketentuan yang berlaku di Campus\nFrance.\n2. Persyaratan dan dokumen pada Beasiswa', 'kejuaraan/non kejuaraan, dan pengalaman\norganisasi pada aplikasi pendaftaran.\nApa saja persyaratan khusus pendaftaran\nBeasiswa Prioritas LPDP – Campus France\nProgram Master?\nPersyaratan khusus Beasiswa Kemitraan LPDP –\nCampus France Program Master adalah sebagai\nberikut:', 'beasiswa dengan kewajiban pengembalian\ndana studi yang telah diterima dan\npemblokiran untuk mengikuti program LPDP\ndi masa mendatang.\nBagaimana dengan ketentuan\nPengabdian yang ditetapkan LPDP?\n1. Penerima Beasiswa wajib kembali dan\nmengabdi di Indonesia setelah selesai studi\nsesuai dengan ketentuan LPDP.\n2. Kembali ke Indonesia dan berkontribusi di\nIndonesia selama 2 kali masa studi ditambah']","Saya tidak mengetahui informasi terkait proyek P3 ""Lidar and Camera Fusion for Autonomous Driving"" tersebut."
13,"Apa yang membuat proyek P5 ""Computer Vision Applications based on Deep Learning Techniques"" menarik?","Proyek ini mencakup teknik pembelajaran mendalam seperti CNN, RNN, LSTM, dan lain-lain untuk aplikasi seperti ekstraksi kerangka 3D manusia, pengenalan tindakan, dan estimasi pose objek dari gambar RGB tunggal.","['Program Master memberikan kesempatan bagi\npendaftar untuk dapat melakukan pendaftaran\npada Beasiswa Kemitraan LPDP – Campus\nFrance dan beasiswa Magister Luar Negeri\npada salah satu program:\n1. Beasiswa Afirmasi\na. Beasiswa Daerah Afirmasi\nb. Beasiswa Putra Putri Papua\nc. Beasiswa Penyandang Disabilitas\nd. Beasiswa Prasejahtera\n2. Beasiswa Targeted\na. Beasiswa PNS, TNI, POLRI\nb. Beasiswa Kewirausahaan\nc. Beasiswa Umum\na. Beasiswa Reguler\nb. Beasiswa Parsial\nBeasiswa Kemitraan LPDP - Campus France\nmerupakan beasiswa kerja sama antara LPDP dan\nPemerintah Perancis pada jenjang master untuk\nbidang prioritas pembangunan Indonesia sesuai\ndengan keahlian pengetahuan yang dimiliki oleh\nUniversitas di Perancis dalam rangka\nmenghasilkan pemimpin masa depan Indonesia\nyang kompeten di bidang tersebut.\nSiapakah Sasaran Beasiswa Prioritas\nLPDP – Campus France Program Master?\n1. Warga Negara Indonesia (WNI)\n2. PNS/TNI/POLRI\nSeperti Apa Skema Prioritas LPDP –\nCampus France Program Master?', 'Siapakah Sasaran Beasiswa Prioritas\nLPDP – Campus France Program Master?\n1. Warga Negara Indonesia (WNI)\n2. PNS/TNI/POLRI\nSeperti Apa Skema Prioritas LPDP –\nCampus France Program Master?\nPendaftar wajib mendaftar secara bersamaan\npada beasiswa Kemitraan LPDP – Campus France\nProgram Master dan salah satu program Magister\nbeasiswa Afirmasi/Targeted/Umum tujuan luar\nnegeri, dengan skema berikut.\n1. Beasiswa Kemitraan LPDP – Campus France\nProgram Master:\na. Beasiswa LPDP – Campus France\nProgram Master diperuntukkan bagi\nWarga Negara Indonesia untuk dapat\nmenempuh pendidikan pada program\nmagister di program studi dan universitas\nsebagaimana daftar terlampir dengan\ndurasi pendanaan paling lama 24 (dua\npuluh empat) bulan.\nb. Pendaftar diharuskan untuk melakukan\npendaftaran pada:\n● Perguruan Tinggi Tujuan Studi\nsesuai jadwal dan ketentuan yang\nberlaku di Perguruan Tinggi, dan\n● Campus France sesuai jadwal dan\nketentuan yang berlaku di Campus\nFrance.\n2. Persyaratan dan dokumen pada Beasiswa', 'b. Kelas khusus;\nc. Kelas karyawan;\nd. Kelas jarak jauh;\ne. Kelas yang diselenggarakan bukan di\nperguruan tinggi induk;\nf. Kelas internasional bagi pendaftar tujuan\nstudi dalam negeri;\ng. Kelas yang diselenggarakan di lebih dari\n1 (satu) negara perguruan tinggi; atau\nh. Kelas lainnya yang tidak memenuhi\nketentuan LPDP.\n14. Menyetujui surat pernyataan yang telah\ndisediakan pada aplikasi pendaftaran\nbeasiswa LPDP (poin-poin terlampir).\n15. Menulis profil diri termasuk riwayat pendidikan\nyang tidak diselesaikan pada aplikasi\npendaftaran.\n16. Menulis komitmen kembali ke Indonesia,\nrencana pasca studi, dan rencana kontribusi\ndi Indonesia.\n17. Jika pendaftar memiliki publikasi ilmiah,\nprestasi kejuaraan/non kejuaraan, dan\npengalaman organisasi maka pendaftar\nmengisi riwayat publikasi ilmiah, prestasi\nkejuaraan/non kejuaraan, dan pengalaman\norganisasi pada aplikasi pendaftaran.\nApa saja persyaratan khusus pendaftaran\nBeasiswa Prioritas LPDP – Campus France\nProgram Master?', '1. Setiap mahasiswa ITS yang ingin mendaftar program internasional di perguruan tinggi mitra ITS luar negeri yang\nmembutuhkan surat rekomendasi atau dana dukungan dari ITS di antaranya IISMA/IISMA-Vo, pertukaran pelajar (exchange),\nlab-internship, short program, atau program lain di luar negeri, diharuskan memiliki sertifikat Global Competency\nWorkshop (GCW) atau Global Competency Academy (GCA). Sertifikat ini hanya bisa diperoleh dengan mengikuti program\nGCW atau GCA.']","Proyek P5 ""Computer Vision Applications based on Deep Learning Techniques"" menarik karena merupakan proyek yang berfokus pada pengembangan aplikasi visi komputer menggunakan teknik deep learning. Teknik deep learning merupakan salah satu pendekatan yang sangat powerful dalam bidang pengolahan citra dan visi komputer, sehingga proyek ini menjanjikan kemampuan untuk menciptakan solusi yang inovatif dan efektif dalam berbagai aplikasi visi komputer. Selain itu, penggunaan teknologi deep learning juga dapat memberikan hasil yang lebih akurat dan canggih dalam pengenalan objek, deteksi pola, dan analisis citra, sehingga proyek ini memiliki potensi untuk memberikan kontribusi yang signifikan dalam pengembangan teknologi visi komputer."
14,"Apa fokus dari proyek P8 ""Silicon Photonics and Optical Biosensors""? ",Fokusnya adalah mengembangkan photodetektor berbasis silikon baru yang kompatibel dengan CMOS dan biosensor optik sekali pakai untuk deteksi biomedis yang cepat dan hemat biaya.,"['Program Master memberikan kesempatan bagi\npendaftar untuk dapat melakukan pendaftaran\npada Beasiswa Kemitraan LPDP – Campus\nFrance dan beasiswa Magister Luar Negeri\npada salah satu program:\n1. Beasiswa Afirmasi\na. Beasiswa Daerah Afirmasi\nb. Beasiswa Putra Putri Papua\nc. Beasiswa Penyandang Disabilitas\nd. Beasiswa Prasejahtera\n2. Beasiswa Targeted\na. Beasiswa PNS, TNI, POLRI\nb. Beasiswa Kewirausahaan\nc. Beasiswa Umum\na. Beasiswa Reguler\nb. Beasiswa Parsial\nBeasiswa Kemitraan LPDP - Campus France\nmerupakan beasiswa kerja sama antara LPDP dan\nPemerintah Perancis pada jenjang master untuk\nbidang prioritas pembangunan Indonesia sesuai\ndengan keahlian pengetahuan yang dimiliki oleh\nUniversitas di Perancis dalam rangka\nmenghasilkan pemimpin masa depan Indonesia\nyang kompeten di bidang tersebut.\nSiapakah Sasaran Beasiswa Prioritas\nLPDP – Campus France Program Master?\n1. Warga Negara Indonesia (WNI)\n2. PNS/TNI/POLRI\nSeperti Apa Skema Prioritas LPDP –\nCampus France Program Master?', 'Siapakah Sasaran Beasiswa Prioritas\nLPDP – Campus France Program Master?\n1. Warga Negara Indonesia (WNI)\n2. PNS/TNI/POLRI\nSeperti Apa Skema Prioritas LPDP –\nCampus France Program Master?\nPendaftar wajib mendaftar secara bersamaan\npada beasiswa Kemitraan LPDP – Campus France\nProgram Master dan salah satu program Magister\nbeasiswa Afirmasi/Targeted/Umum tujuan luar\nnegeri, dengan skema berikut.\n1. Beasiswa Kemitraan LPDP – Campus France\nProgram Master:\na. Beasiswa LPDP – Campus France\nProgram Master diperuntukkan bagi\nWarga Negara Indonesia untuk dapat\nmenempuh pendidikan pada program\nmagister di program studi dan universitas\nsebagaimana daftar terlampir dengan\ndurasi pendanaan paling lama 24 (dua\npuluh empat) bulan.\nb. Pendaftar diharuskan untuk melakukan\npendaftaran pada:\n● Perguruan Tinggi Tujuan Studi\nsesuai jadwal dan ketentuan yang\nberlaku di Perguruan Tinggi, dan\n● Campus France sesuai jadwal dan\nketentuan yang berlaku di Campus\nFrance.\n2. Persyaratan dan dokumen pada Beasiswa', 'beasiswa dengan kewajiban pengembalian\ndana studi yang telah diterima dan\npemblokiran untuk mengikuti program LPDP\ndi masa mendatang.\nBagaimana dengan ketentuan\nPengabdian yang ditetapkan LPDP?\n1. Penerima Beasiswa wajib kembali dan\nmengabdi di Indonesia setelah selesai studi\nsesuai dengan ketentuan LPDP.\n2. Kembali ke Indonesia dan berkontribusi di\nIndonesia selama 2 kali masa studi ditambah', 'Category █ Scholarship\r\nIntern period At least 12 weeks between May 1 and December 31, 2024\r\n\r\nNumber P8\r\nProject title Silicon photonics and optical biosesnors\r\nDescription of the research\r\nThe topic is to develope (a) new types of silicon-based,\r\nCMOS compatible photodetectors, which have many\r\nadvantages over conventional III-V based counterparts for\r\nmid-infrared applications, (b) new disposable optical\r\nbiosensors for cost-effective and rapid biomedical\r\ndetection for precise medicine. This internship program is\r\nopen for talents who are interested in advanced\r\noptoelectronic-sensing technologies. Focus will be placed\r\non designing, simulating, and analyzing new Si-based\r\ngroup-IV photodetectors and optical biosensors. For\r\nrelated information, please refer to the website of our lab\r\nat https://ccuphotonics307.wixsite.com/ccuphotonics307\r\nMentor at CCU\r\nProf. Guo-En Chang\r\nDept. of Mechanical Engineering\r\nNational Chung Cheng University, Taiwan, ROC.\r\n(e-mail: imegec@ccu.edu.tw)']","FOKUS dari proyek P8 ""Silicon Photonics and Optical Biosensors"" adalah pengembangan (a) jenis baru fotodetektor berbasis silikon yang kompatibel dengan CMOS, yang memiliki banyak keunggulan dibandingkan dengan pendahulunya berbasis III-V untuk aplikasi mid-infrared, dan (b) biosensor optik sekali pakai baru untuk deteksi biomedis yang hemat biaya dan cepat untuk pengobatan yang tepat. Program magang ini terbuka bagi bakat-bakat yang tertarik pada teknologi sensor optoelektronik canggih. Fokus akan diberikan pada desain, simulasi, dan analisis fotodetektor grup-IV berbasis Si dan biosensor optik baru."
15,"Apa yang menjadi target penelitian dalam proyek P10 ""Effect of Operating Conditions on the Performance of an All-Vanadium Redox Flow Battery""?",Penelitian ini bertujuan untuk mempelajari efek kondisi operasi seperti konsentrasi elektrolit dan laju aliran elektrolit pada kinerja baterai aliran redoks vanadium.,"['beasiswa dengan kewajiban pengembalian\ndana studi yang telah diterima dan\npemblokiran untuk mengikuti program LPDP\ndi masa mendatang.\nBagaimana dengan ketentuan\nPengabdian yang ditetapkan LPDP?\n1. Penerima Beasiswa wajib kembali dan\nmengabdi di Indonesia setelah selesai studi\nsesuai dengan ketentuan LPDP.\n2. Kembali ke Indonesia dan berkontribusi di\nIndonesia selama 2 kali masa studi ditambah', 'be placed on designing, simulating, and analyzing new optical\r\nmonitoring systems for metal additive systems. For related information,\r\nplease refer to the website of our lab at\r\nhttps://ccuphotonics307.wixsite.com/ccuphotonics307\r\nMentor at CCU\r\nProf. Guo-En Chang\r\nDept. of Mechanical Engineering\r\nNational Chung Cheng University, Taiwan, ROC.\r\n(e-mail: imegec@ccu.edu.tw)\r\nExpected student\r\nlevel\r\n█ Post-graduate student\r\n█ Third/forth-year undergraduate senior student\r\nCategory ■ Scholarship\r\nIntern period At least 8 weeks (up to 6 months) between May and December 2024\r\n\r\nNumber P10\r\nProject title\r\nEffect of operating conditions on the performance of an\r\nall-vanadium redox flow battery\r\nDescription of the research\r\nThe performance of the VRFB is influenced by operating\r\nconditions, such as electrolyte concentration and\r\nelectrolyte flow rate. Students will conduct experiments\r\nto investigate the effect of operating conditions on the\r\nperformance of the VRFB and determine a suitable', 'Syarat dokumen mengikuti syarat program\nbeasiswa yang dipilih (mengacu pada Buku\nPanduan masing-masing program beasiswa).\nSeperti apa format Komitmen kembali ke\nIndonesia, rencana pasca studi, dan\nrencana kontribusi di Indonesia serta\nRencana Bisnis atau Rencana\nPengembangan Bisnis?\nKomitmen kembali ke Indonesia, rencana\npasca studi, dan rencana kontribusi di\nIndonesia (1500 – 2000 kata)\nDeskripsikan dalam tulisan secara jelas dan\nkonkret tentang tema di atas.', 'Siapakah Sasaran Beasiswa Prioritas\nLPDP – Campus France Program Master?\n1. Warga Negara Indonesia (WNI)\n2. PNS/TNI/POLRI\nSeperti Apa Skema Prioritas LPDP –\nCampus France Program Master?\nPendaftar wajib mendaftar secara bersamaan\npada beasiswa Kemitraan LPDP – Campus France\nProgram Master dan salah satu program Magister\nbeasiswa Afirmasi/Targeted/Umum tujuan luar\nnegeri, dengan skema berikut.\n1. Beasiswa Kemitraan LPDP – Campus France\nProgram Master:\na. Beasiswa LPDP – Campus France\nProgram Master diperuntukkan bagi\nWarga Negara Indonesia untuk dapat\nmenempuh pendidikan pada program\nmagister di program studi dan universitas\nsebagaimana daftar terlampir dengan\ndurasi pendanaan paling lama 24 (dua\npuluh empat) bulan.\nb. Pendaftar diharuskan untuk melakukan\npendaftaran pada:\n● Perguruan Tinggi Tujuan Studi\nsesuai jadwal dan ketentuan yang\nberlaku di Perguruan Tinggi, dan\n● Campus France sesuai jadwal dan\nketentuan yang berlaku di Campus\nFrance.\n2. Persyaratan dan dokumen pada Beasiswa']","Target penelitian dalam proyek P10 ""Effect of Operating Conditions on the Performance of an All-Vanadium Redox Flow Battery"" adalah untuk menyelidiki pengaruh kondisi operasional, seperti konsentrasi elektrolit dan laju aliran elektrolit, terhadap kinerja baterai aliran redoks vanadium (VRFB). Para mahasiswa akan melakukan eksperimen untuk menginvestigasi efek kondisi operasional terhadap kinerja VRFB dan menentukan kondisi yang sesuai untuk meningkatkan kinerja baterai tersebut."
16,"Apa tujuan dari proyek P12 ""Numerical Modeling and Experiments of an Atmospheric Pressure Plasma Jet Operated in Air with Shielding Gas""?",Tujuan proyek ini adalah menggabungkan model plasma fluida dua dimensi axisimetrik dengan model aliran gas untuk memprediksi perilaku dinamis plasma jet tekanan atmosfer menggunakan gas helium.,"['Siapakah Sasaran Beasiswa Prioritas\nLPDP – Campus France Program Master?\n1. Warga Negara Indonesia (WNI)\n2. PNS/TNI/POLRI\nSeperti Apa Skema Prioritas LPDP –\nCampus France Program Master?\nPendaftar wajib mendaftar secara bersamaan\npada beasiswa Kemitraan LPDP – Campus France\nProgram Master dan salah satu program Magister\nbeasiswa Afirmasi/Targeted/Umum tujuan luar\nnegeri, dengan skema berikut.\n1. Beasiswa Kemitraan LPDP – Campus France\nProgram Master:\na. Beasiswa LPDP – Campus France\nProgram Master diperuntukkan bagi\nWarga Negara Indonesia untuk dapat\nmenempuh pendidikan pada program\nmagister di program studi dan universitas\nsebagaimana daftar terlampir dengan\ndurasi pendanaan paling lama 24 (dua\npuluh empat) bulan.\nb. Pendaftar diharuskan untuk melakukan\npendaftaran pada:\n● Perguruan Tinggi Tujuan Studi\nsesuai jadwal dan ketentuan yang\nberlaku di Perguruan Tinggi, dan\n● Campus France sesuai jadwal dan\nketentuan yang berlaku di Campus\nFrance.\n2. Persyaratan dan dokumen pada Beasiswa', 'beasiswa dengan kewajiban pengembalian\ndana studi yang telah diterima dan\npemblokiran untuk mengikuti program LPDP\ndi masa mendatang.\nBagaimana dengan ketentuan\nPengabdian yang ditetapkan LPDP?\n1. Penerima Beasiswa wajib kembali dan\nmengabdi di Indonesia setelah selesai studi\nsesuai dengan ketentuan LPDP.\n2. Kembali ke Indonesia dan berkontribusi di\nIndonesia selama 2 kali masa studi ditambah', 'Program Master memberikan kesempatan bagi\npendaftar untuk dapat melakukan pendaftaran\npada Beasiswa Kemitraan LPDP – Campus\nFrance dan beasiswa Magister Luar Negeri\npada salah satu program:\n1. Beasiswa Afirmasi\na. Beasiswa Daerah Afirmasi\nb. Beasiswa Putra Putri Papua\nc. Beasiswa Penyandang Disabilitas\nd. Beasiswa Prasejahtera\n2. Beasiswa Targeted\na. Beasiswa PNS, TNI, POLRI\nb. Beasiswa Kewirausahaan\nc. Beasiswa Umum\na. Beasiswa Reguler\nb. Beasiswa Parsial\nBeasiswa Kemitraan LPDP - Campus France\nmerupakan beasiswa kerja sama antara LPDP dan\nPemerintah Perancis pada jenjang master untuk\nbidang prioritas pembangunan Indonesia sesuai\ndengan keahlian pengetahuan yang dimiliki oleh\nUniversitas di Perancis dalam rangka\nmenghasilkan pemimpin masa depan Indonesia\nyang kompeten di bidang tersebut.\nSiapakah Sasaran Beasiswa Prioritas\nLPDP – Campus France Program Master?\n1. Warga Negara Indonesia (WNI)\n2. PNS/TNI/POLRI\nSeperti Apa Skema Prioritas LPDP –\nCampus France Program Master?', '(e-mail: imekml@ccu.edu.tw; kmlin.tw@gmail.com)\r\nExpected student level\r\n■ Post-graduate student\r\n■ Third/forth-year undergraduate senior student\r\nCategory\r\n■ Scholarship\r\n■ Self-supported\r\nIntern period At least 8 weeks between May and December 2024\r\n\r\nNumber P12\r\nProject title\r\nNumerical modeling and Experiments of an atmospheric\r\npressure plasma jet operated in air with shielding gas\r\nDescription of the research\r\nAtmospheric-pressure plasma jets have been developed\r\nextensively for applications such as plasma medicine and\r\nplasma agriculture due to the generation of abundant\r\nreactive species being critical for manipulating reaction\r\npathways in different fields. However, it is still challenging\r\nto develop a proper plasma source with controlled\r\nparameters by experimental measurements because of\r\nfast discharge dynamics and complex plasma chemistry.\r\nAlternatively, numerical simulations can be used to\r\ncapture discharge dynamics with detailed chemistry']","Tujuan dari proyek P12 ""Numerical Modeling and Experiments of an Atmospheric Pressure Plasma Jet Operated in Air with Shielding Gas"" adalah untuk mengembangkan plasma jet tekanan atmosfer yang dapat dioperasikan di udara dengan gas pelindung. Plasma jet ini dikembangkan untuk aplikasi seperti kedokteran plasma dan pertanian plasma karena kemampuannya menghasilkan spesies reaktif yang melimpah yang penting untuk memanipulasi jalur reaksi dalam berbagai bidang. Tantangannya adalah untuk mengembangkan sumber plasma yang tepat dengan parameter yang terkontrol melalui pengukuran eksperimental dan simulasi numerik untuk menangkap dinamika pembuangan dengan kimia plasma yang kompleks."
17,"Proyek P13 ""Application of Novel Snap-shot based Hyperspectral Imaging Combined with AI to Detect Lesions"" menggunakan metode apa?","Proyek ini menggunakan model pembelajaran mesin seperti YOLOv5, YOLOv8, R-CNN, dan Faster R-CNN untuk mendeteksi kanker esofagus stadium awal menggunakan model gambar cahaya putih (WLI) dan gambar narrowband hiperspektral (HSI-NBI).","['■ Post-graduate student\r\n■ Third/forth-year undergraduate senior student\r\nCategory\r\n■ Scholarship\r\n■ Self-supported\r\nIntern period At least 8 weeks between May and December 2024\r\n\r\nNumber P13\r\nProject title\r\nApplication of Novel Snap-shot based hyperspectral imaging\r\ncombined with AI to detect Lesions\r\nDescription of the\r\nresearch\r\nThe early detection of esophageal cancer presents a\r\nconsiderable difficulty, which contributes to its high\r\nprevalence as a major cause of cancer-related fatalities. This\r\nproject will utilize various machine learning models, including\r\nYOLOv5, YOLOv8, R-CNN, and Faster R-CNN, to predict and\r\ndetect early-stage esophageal cancer. It will make use of two\r\nmodels of esophageal cancer images: the white-light images\r\n(WLI) model and the hyperspectral narrowband images (HSI-\r\nNBI) model. These models will be generated through a\r\nconversion algorithm referred to as the spectrum-aided\r\nvision enhancer (SAVE). The main goal will be to discover', 'Program Master memberikan kesempatan bagi\npendaftar untuk dapat melakukan pendaftaran\npada Beasiswa Kemitraan LPDP – Campus\nFrance dan beasiswa Magister Luar Negeri\npada salah satu program:\n1. Beasiswa Afirmasi\na. Beasiswa Daerah Afirmasi\nb. Beasiswa Putra Putri Papua\nc. Beasiswa Penyandang Disabilitas\nd. Beasiswa Prasejahtera\n2. Beasiswa Targeted\na. Beasiswa PNS, TNI, POLRI\nb. Beasiswa Kewirausahaan\nc. Beasiswa Umum\na. Beasiswa Reguler\nb. Beasiswa Parsial\nBeasiswa Kemitraan LPDP - Campus France\nmerupakan beasiswa kerja sama antara LPDP dan\nPemerintah Perancis pada jenjang master untuk\nbidang prioritas pembangunan Indonesia sesuai\ndengan keahlian pengetahuan yang dimiliki oleh\nUniversitas di Perancis dalam rangka\nmenghasilkan pemimpin masa depan Indonesia\nyang kompeten di bidang tersebut.\nSiapakah Sasaran Beasiswa Prioritas\nLPDP – Campus France Program Master?\n1. Warga Negara Indonesia (WNI)\n2. PNS/TNI/POLRI\nSeperti Apa Skema Prioritas LPDP –\nCampus France Program Master?', 'Siapakah Sasaran Beasiswa Prioritas\nLPDP – Campus France Program Master?\n1. Warga Negara Indonesia (WNI)\n2. PNS/TNI/POLRI\nSeperti Apa Skema Prioritas LPDP –\nCampus France Program Master?\nPendaftar wajib mendaftar secara bersamaan\npada beasiswa Kemitraan LPDP – Campus France\nProgram Master dan salah satu program Magister\nbeasiswa Afirmasi/Targeted/Umum tujuan luar\nnegeri, dengan skema berikut.\n1. Beasiswa Kemitraan LPDP – Campus France\nProgram Master:\na. Beasiswa LPDP – Campus France\nProgram Master diperuntukkan bagi\nWarga Negara Indonesia untuk dapat\nmenempuh pendidikan pada program\nmagister di program studi dan universitas\nsebagaimana daftar terlampir dengan\ndurasi pendanaan paling lama 24 (dua\npuluh empat) bulan.\nb. Pendaftar diharuskan untuk melakukan\npendaftaran pada:\n● Perguruan Tinggi Tujuan Studi\nsesuai jadwal dan ketentuan yang\nberlaku di Perguruan Tinggi, dan\n● Campus France sesuai jadwal dan\nketentuan yang berlaku di Campus\nFrance.\n2. Persyaratan dan dokumen pada Beasiswa', 'beasiswa dengan kewajiban pengembalian\ndana studi yang telah diterima dan\npemblokiran untuk mengikuti program LPDP\ndi masa mendatang.\nBagaimana dengan ketentuan\nPengabdian yang ditetapkan LPDP?\n1. Penerima Beasiswa wajib kembali dan\nmengabdi di Indonesia setelah selesai studi\nsesuai dengan ketentuan LPDP.\n2. Kembali ke Indonesia dan berkontribusi di\nIndonesia selama 2 kali masa studi ditambah']","Proyek P13 ""Application of Novel Snap-shot based Hyperspectral Imaging Combined with AI to Detect Lesions"" menggunakan berbagai model machine learning, termasuk YOLOv5, YOLOv8, R-CNN, dan Faster R-CNN, untuk memprediksi dan mendeteksi kanker esofagus tahap awal. Selain itu, proyek ini juga menggunakan dua model gambar kanker esofagus: model gambar cahaya putih (WLI) dan model gambar hiperspektral narrowband (HSI-NBI). Model-model ini dihasilkan melalui algoritma konversi yang disebut sebagai spectrum-aided vision enhancer (SAVE)."
18,"Apa yang akan dikembangkan dalam proyek P16 ""Next Generation Wireless Communication, B5G/6G, Reconfigurable Intelligent Surface, System Level Simulation, Artificial Intelligence-enhanced Wireless Research""? ","Proyek ini berfokus pada inovasi dan desain konsep-konsep canggih dan arsitektur di luar 5G dan 6G, mengidentifikasi dan memvalidasi solusi untuk masalah kunci melalui simulasi atau eksperimen prototipe, serta merancang algoritma, model, dan protokol baru untuk mengoptimalkan kinerja jaringan nirkabel.","['Category\r\n■ Scholarship\r\n■ Self-supported\r\nIntern period At least 8 weeks between 2024/5/1- 2024/12/31\r\n\r\nNumber P16\r\nProject title\r\nNext generation Wireless communication, B5G/6G,\r\nReconfigurable Intelligent Surface, System level\r\nsimulation, Artificial Intelligence-enhanced wireless\r\nresearch\r\nDescription of the\r\nresearch\r\nInnovate and design cutting-edge concepts and\r\narchitectures beyond 5G (B5G) and 6G.\r\nIdentify and validate solutions to key problems through\r\nsimulation or prototype experiments.\r\nConduct research on AI and machine learning\r\ntechniques applied to wireless communications and\r\nnetworks.\r\nDesign and implement novel algorithms, models, and\r\nprotocols to optimize wireless network performance.\r\nCollaborate with the research team to manage projects\r\nand ensure timely deliverables,\r\nPlease refer to the website of our lab at\r\nhttps://sites.google.com/view/ccuantlab/english\r\nMentor at CCU\r\nAssoc. Prof. Jen-Yi Pan\r\nDept. of Communications Engineering,', 'Program Master memberikan kesempatan bagi\npendaftar untuk dapat melakukan pendaftaran\npada Beasiswa Kemitraan LPDP – Campus\nFrance dan beasiswa Magister Luar Negeri\npada salah satu program:\n1. Beasiswa Afirmasi\na. Beasiswa Daerah Afirmasi\nb. Beasiswa Putra Putri Papua\nc. Beasiswa Penyandang Disabilitas\nd. Beasiswa Prasejahtera\n2. Beasiswa Targeted\na. Beasiswa PNS, TNI, POLRI\nb. Beasiswa Kewirausahaan\nc. Beasiswa Umum\na. Beasiswa Reguler\nb. Beasiswa Parsial\nBeasiswa Kemitraan LPDP - Campus France\nmerupakan beasiswa kerja sama antara LPDP dan\nPemerintah Perancis pada jenjang master untuk\nbidang prioritas pembangunan Indonesia sesuai\ndengan keahlian pengetahuan yang dimiliki oleh\nUniversitas di Perancis dalam rangka\nmenghasilkan pemimpin masa depan Indonesia\nyang kompeten di bidang tersebut.\nSiapakah Sasaran Beasiswa Prioritas\nLPDP – Campus France Program Master?\n1. Warga Negara Indonesia (WNI)\n2. PNS/TNI/POLRI\nSeperti Apa Skema Prioritas LPDP –\nCampus France Program Master?', ""43 Health\nMaster's Degree - Biomedical engineering (BME\nPARIS) - BioEngineering and Innovation in\nNeuroscience (BIN)\nUniversité Paris Cité\n44 Health\nMaster's Degree Biomedical engineering (BME) -\nBioMaterials and BioDevices (BioMat)\nUniversité Paris Cité\n45 Health\nMaster's Degree - Biomedical Engineering (BME\nPARIS) - BioMechanics (BioMECH)\nUniversité Paris Cité\n46 Health\nMaster's Degree - Biomedical Engineering (BME\nPARIS) - Molecular and Cellular Biotherapies\n(MCB)\nUniversité Paris Cité\n47 Health Master in Cognitive Science Université PSL\n48 Health Master of Public Health\nEcole des Hautes Etudes en\nSanté Publique\n49 Maritime MSc International Trade & Logistics KEDGE Business School\n50 Maritime\nMSc Environmental Hazards and Risks\nManagement\nUniversité Côte d'Azur"", ""Dipublikasikan tanggal 11 Januari 2024\nNo Bidang Study Program University\n17\nDigital / Information\nTechnologies\nMaster in Computer Vision (VIBOT)\nUniversité Bourgogne Franche-\nComté\n18\nDigital / Information\nTechnologies\nMaster in Physics & Computational Physics\n(CompuPhys)\nUniversité Bourgogne Franche-\nComté\n19 Energy\nMaster Solar Energy, Law, Economics and\nManagement (SoLEM)\nUniversité Savoie Mont Blanc\n20 Energy Master Nuclear Energy Université Paris-Saclay\n21 Energy Master Nuclear Energy Institut Polytechnique de Paris\n22 Energy\nMaster's Degree - Fundamental Physics:\nInternational Centre for Fundamental Physics\n(ICFP)\nUniversité Paris Cité\n23 Energy\nMaster MaNuEn - International master Program in\nMaterial Sciences for Nuclear Energy\nGrenoble INP - Université\nGrenoble Alpes\n24 Energy\nInternational Master's Degree in Transport and\nEnergy\nINSA Hauts-de-France -\nInstitut National des Sciences\nAppliquées""]","Proyek P16 ""Next Generation Wireless Communication, B5G/6G, Reconfigurable Intelligent Surface, System Level Simulation, Artificial Intelligence-enhanced Wireless Research"" akan mengembangkan konsep dan arsitektur terdepan di luar 5G (B5G) dan 6G. Proyek ini juga akan mengidentifikasi dan memvalidasi solusi untuk masalah kunci melalui simulasi atau eksperimen prototipe. Selain itu, proyek ini akan melakukan penelitian tentang teknik kecerdasan buatan dan pembelajaran mesin yang diterapkan pada komunikasi nirkabel dan jaringan. Selain itu, proyek ini juga akan merancang dan menerapkan algoritma, model, dan protokol baru untuk mengoptimalkan kinerja jaringan nirkabel. Kolaborasi dengan tim penelitian juga akan dilakukan untuk mengelola proyek dan memastikan pengiriman tepat waktu."
19,Bagaimana cara menghubungi penyelenggara program internship ini?,"Kontak dapat dilakukan melalui nomor +886-5-2720411 ext. 23003, 23005, atau email coleng_dia@ccu.edu.tw. Alamatnya adalah No.168, Sec. 1, University Rd., Minhsiung, Chiayi 621301, Taiwan (R.O.C.).","['Program Master memberikan kesempatan bagi\npendaftar untuk dapat melakukan pendaftaran\npada Beasiswa Kemitraan LPDP – Campus\nFrance dan beasiswa Magister Luar Negeri\npada salah satu program:\n1. Beasiswa Afirmasi\na. Beasiswa Daerah Afirmasi\nb. Beasiswa Putra Putri Papua\nc. Beasiswa Penyandang Disabilitas\nd. Beasiswa Prasejahtera\n2. Beasiswa Targeted\na. Beasiswa PNS, TNI, POLRI\nb. Beasiswa Kewirausahaan\nc. Beasiswa Umum\na. Beasiswa Reguler\nb. Beasiswa Parsial\nBeasiswa Kemitraan LPDP - Campus France\nmerupakan beasiswa kerja sama antara LPDP dan\nPemerintah Perancis pada jenjang master untuk\nbidang prioritas pembangunan Indonesia sesuai\ndengan keahlian pengetahuan yang dimiliki oleh\nUniversitas di Perancis dalam rangka\nmenghasilkan pemimpin masa depan Indonesia\nyang kompeten di bidang tersebut.\nSiapakah Sasaran Beasiswa Prioritas\nLPDP – Campus France Program Master?\n1. Warga Negara Indonesia (WNI)\n2. PNS/TNI/POLRI\nSeperti Apa Skema Prioritas LPDP –\nCampus France Program Master?', 'Siapakah Sasaran Beasiswa Prioritas\nLPDP – Campus France Program Master?\n1. Warga Negara Indonesia (WNI)\n2. PNS/TNI/POLRI\nSeperti Apa Skema Prioritas LPDP –\nCampus France Program Master?\nPendaftar wajib mendaftar secara bersamaan\npada beasiswa Kemitraan LPDP – Campus France\nProgram Master dan salah satu program Magister\nbeasiswa Afirmasi/Targeted/Umum tujuan luar\nnegeri, dengan skema berikut.\n1. Beasiswa Kemitraan LPDP – Campus France\nProgram Master:\na. Beasiswa LPDP – Campus France\nProgram Master diperuntukkan bagi\nWarga Negara Indonesia untuk dapat\nmenempuh pendidikan pada program\nmagister di program studi dan universitas\nsebagaimana daftar terlampir dengan\ndurasi pendanaan paling lama 24 (dua\npuluh empat) bulan.\nb. Pendaftar diharuskan untuk melakukan\npendaftaran pada:\n● Perguruan Tinggi Tujuan Studi\nsesuai jadwal dan ketentuan yang\nberlaku di Perguruan Tinggi, dan\n● Campus France sesuai jadwal dan\nketentuan yang berlaku di Campus\nFrance.\n2. Persyaratan dan dokumen pada Beasiswa', '1. Setiap mahasiswa ITS yang ingin mendaftar program internasional di perguruan tinggi mitra ITS luar negeri yang\nmembutuhkan surat rekomendasi atau dana dukungan dari ITS di antaranya IISMA/IISMA-Vo, pertukaran pelajar (exchange),\nlab-internship, short program, atau program lain di luar negeri, diharuskan memiliki sertifikat Global Competency\nWorkshop (GCW) atau Global Competency Academy (GCA). Sertifikat ini hanya bisa diperoleh dengan mengikuti program\nGCW atau GCA.', 'kejuaraan/non kejuaraan, dan pengalaman\norganisasi pada aplikasi pendaftaran.\nApa saja persyaratan khusus pendaftaran\nBeasiswa Prioritas LPDP – Campus France\nProgram Master?\nPersyaratan khusus Beasiswa Kemitraan LPDP –\nCampus France Program Master adalah sebagai\nberikut:']","Untuk menghubungi penyelenggara program internship, Anda dapat mencari informasi kontak yang tertera pada situs web atau dokumen resmi yang terkait dengan program tersebut. Jika informasi kontak tidak tersedia, Anda juga dapat mencoba menghubungi pihak perguruan tinggi atau lembaga terkait yang bekerja sama dengan program tersebut untuk meminta bantuan dalam menghubungi penyelenggara program internship."
