,question,answer,contexts,ground_truth,context_precision,faithfulness,answer_relevancy,context_recall
0,Apa tujuan dari Program Internship Internasional CCU/CoE 2024? ,"Tujuan dari Program Internship Internasional CCU/CoE 2024 adalah untuk memberikan kesempatan kepada mahasiswa universitas internasional untuk memahami penelitian CCU dalam bidang teknik dan teknologi, serta untuk berlatih keterampilan dalam proyek-proyek, memperoleh kompetensi baru, dan merasakan budaya yang berbeda.","['2024 CCU/CoE\r\nINTERNATIONAL INTERNSHIP PROGRAM\r\nCOLLEGE OF ENGINEERING (CoE)\r\nNATIONAL CHUNG CHENG UNIVERSITY\r\n\r\nContinuing the yearly internship program in engineering field, the College\r\nof Engineering (CoE) offers on-campus research internships for\r\ninternational university students in 2024.\r\nThis project-based program provides an opportunity to better understand\r\nCCU’s research in engineering and technology. Students may practice their\r\nskills in the projects, acquire new competence, and experience a different\r\nculture.\r\nIn Engineering Field\r\n2024 CCU/COE INTERNATIONAL\r\nINTERNSHIP PROGRAM\r\nINTERNPERIOD\r\nSCHOLARSHIP\r\nPROGRAM\r\nBENIFITS\r\nTo have an enjoyable and enriching\r\nexperience in academic study and exchange\r\ntheir ideas of research with CCU students.\r\nMay 1 –December 31, 2024\r\nAt least 8 weeks. Individual mentors may have a\r\ndifferent definition of intern period. For self-\r\nsupported interns, the period may not be limited\r\nas mentioned above. Please refer to each'
 'application form, prepare\r\napplication materials, and send\r\nthem in a ZIP-compressed file to\r\ncoleng_dia@ccu.edu.tw.\r\n• The title of the e-mail please be\r\nmarked with “Application for 2024\r\nCCU/COE International Internship”.\r\nAll the intern research topics and\r\ntheir requirements are listed as\r\nfollows.\r\n• Application deadline: Mar. 3, 2024\r\n• More detailed information about\r\napplication can be found on the\r\nwebsite\r\nhttps://sites.google.com/view/ccu-\r\ncoe-internship/home\r\nCONTACT\r\n+886-5-2720411 ext. 23003, 23005\r\ncoleng_dia@ccu.edu.tw\r\nNo.168, Sec. 1, University Rd., Minhsiung,\r\nChiayi 621301, Taiwan (R.O.C.)\r\n\r\nINTERN RESEARCH TOPICS\r\nNumber P1\r\nProject title\r\nTrustable Artificial Intelligence for Critical Applications and\r\n6G Security\r\nDescription of the research\r\nArtificial Intelligence (AI) technologies, 6G networking,\r\nand quantum computing are the leading forces in\r\nbringing the world to an era of better intelligence and full'
 'Dipublikasikan tanggal 11 Januari 2024\nTentang LPDP\nLPDP berkomitmen untuk mempersiapkan\npemimpin dan profesional masa depan serta\nmendorong inovasi demi terwujudnya Indonesia\nyang sejahtera, demokratis, dan berkeadilan.\nLPDP menyelenggarakan program beasiswa\nmagister/doktor serta beasiswa dokter spesialis,\ndokter subspesialis dan Fellowship untuk putra-\nputri terbaik Indonesia.\nApa itu Beasiswa Prioritas?\nBeasiswa Prioritas merupakan program beasiswa\nyang memberikan kesempatan kepada pendaftar\nuntuk dapat melakukan pendaftaran pada dua\nprogram sekaligus, yaitu pada program Beasiswa\nKemitraan/Kerja Sama LPDP dan pada salah satu\nprogram Beasiswa Afirmasi/Beasiswa\nTargeted/Beasiswa Umum tujuan luar negeri.\nApa itu Beasiswa Prioritas LPDP – Campus\nFrance Program Master?\nBeasiswa Prioritas LPDP – Campus France\nProgram Master memberikan kesempatan bagi\npendaftar untuk dapat melakukan pendaftaran\npada Beasiswa Kemitraan LPDP – Campus\nFrance dan beasiswa Magister Luar Negeri'
 'This course aims to help students cultivate their expertise in guided tourism and\nenhance the proficiency (fluency and accuracy) of their communicative competences\nas well as oral expression.\nThe contents cover not only advanced theme-based vocabulary and conversation but\nalso diverse multimedia resources related to tourism topics, with which immersive\nsimulation and flipped learning strengthens students’ reading, listening, and\ndiscussion abilities.\nIn addition, group collaboration will be practiced to enhance students’ capacity for\ngroup project, to sharpen their oral presentation skills, to improve teamwork and\naccountability. Experts in the tourism field will be invited to share their hands-on\nexperiences to further develop students’ civil concern and spirit of service, inspire\ninnovative thinking, and enhance core competency.\nGrading:\n1. Presence - 15%\n2. In-class participation - 10%\n3. Group conversation - 20%\n4. Individual oral presentation on Scenic spot introduction - 20%']","Tujuannya adalah untuk memberikan kesempatan bagi mahasiswa internasional untuk memahami lebih baik penelitian di bidang teknik dan teknologi di CCU, serta untuk mempraktikkan keterampilan mereka, memperoleh kompetensi baru, dan mengalami budaya yang berbeda.",,0.9999999999666667,1.0,0.9924022191463724
1,Kapan periode magang berlangsung?,Periode magang berlangsung setidaknya selama 8 minggu antara tanggal 1 Mei 2024 hingga 31 Desember 2024.,"['Category\r\n■ Scholarship\r\n■ Self-supported\r\nIntern period At least 8 weeks between 2024/5/1- 2024/12/31\r\n\r\nNumber P16\r\nProject title\r\nNext generation Wireless communication, B5G/6G,\r\nReconfigurable Intelligent Surface, System level\r\nsimulation, Artificial Intelligence-enhanced wireless\r\nresearch\r\nDescription of the\r\nresearch\r\nInnovate and design cutting-edge concepts and\r\narchitectures beyond 5G (B5G) and 6G.\r\nIdentify and validate solutions to key problems through\r\nsimulation or prototype experiments.\r\nConduct research on AI and machine learning\r\ntechniques applied to wireless communications and\r\nnetworks.\r\nDesign and implement novel algorithms, models, and\r\nprotocols to optimize wireless network performance.\r\nCollaborate with the research team to manage projects\r\nand ensure timely deliverables,\r\nPlease refer to the website of our lab at\r\nhttps://sites.google.com/view/ccuantlab/english\r\nMentor at CCU\r\nAssoc. Prof. Jen-Yi Pan\r\nDept. of Communications Engineering,'
 ""At least 8 weeks. Individual mentors may have a\r\ndifferent definition of intern period. For self-\r\nsupported interns, the period may not be limited\r\nas mentioned above. Please refer to each\r\nresearch topic for precise definitions.\r\nResearch topics are offered in two types:\r\n(A) Scholarship and (B) self-supported.\r\nFor type-A, CCU offers a scholarship covering\r\non-campus accommodation, a weekly stipend\r\n(NTD1,500), and airfare reimbursement\r\n(maximum NTD10,000). These are standard\r\nitems and numbers, and the total amount may\r\nbe amended by the project mentor based on\r\nthe program budget and the interns'\r\nperformance.\r\nFEES FEE-FREE. The program fee and registration\r\nfee will be provided by CoE.\r\n\r\nPROGRAM ELIGIBILITY\r\n• Graduate school students (master & PhD students)\r\n• University junior students (3rd year or above).\r\n• Those who already complete PhD degree are NOT eligible to apply.\r\n• Passport holders of People's Republic of China, Hong Kong, or Macau\r\nare NOT eligible to apply.""
 'Category\r\n■ Scholarship\r\n■ Self-supported\r\nIntern period At least 12 weeks between May 1 and December 31, 2024\r\n\r\nNumber P15\r\nProject title\r\nStudy of lithium ion battery, lithium sulfur battery,\r\nmetal-air battery, fuel cell and supercapacitor\r\nDescription of the\r\nresearch\r\nThe research will primarily concentrate on the study of\r\nelectrocatalysts and nanomaterials with the aim of\r\nexploring innovative applications in the realm of energy\r\nstorage. These applications encompass metal ion\r\nbatteries, metal-air batteries, fuel cells and\r\nsupercapacitors.\r\nMentor at CCU\r\nProf. Yuan-Yao Li\r\nDept. of Chemical Engineering\r\nNational Chung Cheng University, Taiwan, ROC.\r\n(e-mail: chmyyl@ccu.edu.tw)\r\nExpected student level\r\n■ Post-graduate student\r\n■ Third/forth-year undergraduate senior student\r\nCategory\r\n■ Scholarship\r\n■ Self-supported\r\nIntern period At least 8 weeks between 2024/5/1- 2024/12/31\r\n\r\nNumber P16\r\nProject title\r\nNext generation Wireless communication, B5G/6G,'
 '5. Dengan memperhatikan poin 1, DKG menginformasikan bahwa Test GCW Non-Degree yang sebelumnya diselenggarakan\nsetiap bulan tidak akan lagi diselenggarakan, kecuali dalam kondisi yang sangat khusus, dengan mempertimbangkan surat\npermohonan oleh mahasiswa yang diketahui oleh Kepala Departemen. Pelaksanaan Test GCW Non Degree akan diputuskan\noleh Direktur Kemitraan Global.\nBersama ini kami juga melampirkan poster informasi penyelenggaraan Global Competency Academy yang pendaftarannya dibuka\nsampai dengan 17 September 2023. Kami mohon bantuan dari Bapak/Ibu Kepala Departemen dan Ketua Program Studi untuk\nmenyebarkan informasi ini kepada mahasiswa di departemen masing-masing.\nUntuk pertanyaan lebih lanjut, kiranya dapat disampaikan melalui email studyabroad@its.ac.id , LINE Official @yao2114f , atau\nmelalui Instagram @itsinternationaloffice.\nDemikian surat ini kami sampaikan. Atas perhatian dan kerjasamanya kami sampaikan terima kasih.\n\nSurabaya, 13 September 2023']","Periode magang berlangsung antara 1 Mei hingga 31 Desember 2024, minimal 8 minggu.",1.0,0.9999999999666667,1.0,0.8122294024982439
2,Apa saja jenis beasiswa yang ditawarkan dalam program ini?,Jenis beasiswa yang ditawarkan dalam program ini adalah Beasiswa Prioritas LPDP yang memiliki ketentuan kewajiban pengembalian dana studi yang telah diterima dan pemblokiran untuk mengikuti program LPDP di masa mendatang. Beasiswa ini juga menetapkan ketentuan Pengabdian yang meliputi kewajiban penerima beasiswa untuk kembali dan mengabdi di Indonesia setelah selesai studi sesuai dengan ketentuan LPDP.,"['beasiswa dengan kewajiban pengembalian\ndana studi yang telah diterima dan\npemblokiran untuk mengikuti program LPDP\ndi masa mendatang.\nBagaimana dengan ketentuan\nPengabdian yang ditetapkan LPDP?\n1. Penerima Beasiswa wajib kembali dan\nmengabdi di Indonesia setelah selesai studi\nsesuai dengan ketentuan LPDP.\n2. Kembali ke Indonesia dan berkontribusi di\nIndonesia selama 2 kali masa studi ditambah'
 'Dipublikasikan tanggal 11 Januari 2024\n1. Beasiswa hanya untuk Program Master\nsesuai daftar progam studi dan universitas\nterlampir.\n2. Pendaftar diharuskan melakukan pendaftaran\npada:\na. universitas sesuai jadwal dan ketentuan\nyang berlaku di Perguruan Tinggi; dan\nb. Campus France sesuai jadwal dan\nketentuan yang berlaku di Campus\nFrance.\n3. Memenuhi ketentuan batas usia pendaftar\npada 31 Desember di tahun pendaftaran\nsebagai berikut:\na. Pendaftar non CPNS/PNS paling tinggi\nberusia 35 (tiga puluh lima) tahun.\nb. Pendaftar Pegawai Sipil Negara (PNS)\npaling tinggi berusia 37 (tiga puluh tujuh)\ntahun\nc. Pendaftar Pegawai Sipil Negara (PNS)\ndengan jabatan fungsional sebagai\nPeneliti/Perekayasa/Medis/Paramedis/\nPendidik paling tinggi 42 (empat puluh\ndua) tahun.\nd. Pendaftar Prajurit TNI atau anggota\nPOLRI paling tinggi 40 (empat puluh)\ntahun.\n4. Mengunggah dokumen Indeks Prestasi\nKumulatif (IPK) dengan ketentuan Indeks\nPrestasi Kumulatif (IPK) pada jenjang studi'
 'program beasiswa LPDP wajib melampirkan\nsurat usulan atau surat rekomendasi\nsekurang-kurangnya pejabat yang\nmembidangi pembinaan SDM pada Mabes\nTNI/ TNI AD/ TNI AL/ TNI AU untuk mengikuti\nprogram beasiswa LPDP yang ditujukan\nkepada LPDP.\n11. Bagi pendaftar berstatus anggota POLRI di\nsemua program beasiswa LPDP wajib\nmelampirkan surat usulan atau surat\nrekomendasi sekurang-kurangnya pejabat\nyang membidangi pembinaan SDM pada\nMabes POLRI untuk mengikuti program\nbeasiswa LPDP kepada LPDP pada saat\npendaftaran beasiswa LPDP.\n12. Memilih Perguruan Tinggi Tujuan dan\nprogram studi sesuai dengan ketentuan LPDP\n13. Beasiswa hanya diperuntukkan bagi kelas\nreguler atau kelas lain yang ditetapkan oleh\nLPDP, dan tidak diperuntukkan untuk kelas-\nkelas sebagai berikut:\na. Kelas eksekutif;\nb. Kelas khusus;\nc. Kelas karyawan;\nd. Kelas jarak jauh;\ne. Kelas yang diselenggarakan bukan di\nperguruan tinggi induk;\nf. Kelas internasional bagi pendaftar tujuan\nstudi dalam negeri;'
 'Please refer to the website of our lab at\r\nhttps://sites.google.com/view/ccuantlab/english\r\nMentor at CCU\r\nAssoc. Prof. Jen-Yi Pan\r\nDept. of Communications Engineering,\r\nNational Chung Cheng University, Taiwan, ROC.\r\n(e-mail: jypan@ccu.edu.tw)\r\nExpected student level\r\n■ Post-graduate student\r\n■ Third/forth-year undergraduate senior student\r\nCategory\r\n■ Scholarship\r\n■ Self-supported\r\nIntern period\r\nAt least 8 weeks between May 1 and December 31,\r\n2024']",Program menawarkan dua jenis beasiswa: (A) Beasiswa dan (B) magang dengan biaya sendiri (self-supported).,1.0,0.6388888888675925,0.5,0.8184323190591951
3,Apa saja manfaat dari Beasiswa Tipe-A? ,Saya tidak tahu.,"['Dipublikasikan tanggal 11 Januari 2024\nprogram beasiswa lain yang dipilih, sesuai\ndengan syarat dan ketentuan yang berlaku.\nApa saja komponen Dana yang diberikan?\n1. Dana Pendidikan\na. Tuition Fee\nb. Dana Pendaftaran\nc. Dana Tunjangan Buku\nd. Dana Penelitian Tesis\ne. Dana Seminar Internasional\nf. Dana Publikasi Jurnal Internasional\n2. Dana Pendukung\na. Dana Transportasi\nb. Dana Aplikasi Visa\nc. Dana Asuransi Kesehatan\nd. Dana Kedatangan\ne. Dana Hidup Bulanan\nf. Dana Lomba Internasional\ng. Dana keadaaan darurat (jika diperlukan)\nApa saja persyaratan umum pendaftaran\nBeasiswa Prioritas LPDP – Campus\nFrance Program Master?\nPersyaratan umum Beasiswa Prioritas LPDP –\nCampus France Program Master adalah sebagai\nberikut:\n1. Warga Negara Indonesia.\n2. Telah menyelesaikan studi program diploma\nempat (D4) atau sarjana (S1).\n3. Pendaftar yang telah menyelesaikan studi\nmagister (S2) tidak diizinkan mendaftar.\n4. Bagi pendaftar lulusan perguruan tinggi luar'
 'Dipublikasikan tanggal 11 Januari 2024\n1. Beasiswa hanya untuk Program Master\nsesuai daftar progam studi dan universitas\nterlampir.\n2. Pendaftar diharuskan melakukan pendaftaran\npada:\na. universitas sesuai jadwal dan ketentuan\nyang berlaku di Perguruan Tinggi; dan\nb. Campus France sesuai jadwal dan\nketentuan yang berlaku di Campus\nFrance.\n3. Memenuhi ketentuan batas usia pendaftar\npada 31 Desember di tahun pendaftaran\nsebagai berikut:\na. Pendaftar non CPNS/PNS paling tinggi\nberusia 35 (tiga puluh lima) tahun.\nb. Pendaftar Pegawai Sipil Negara (PNS)\npaling tinggi berusia 37 (tiga puluh tujuh)\ntahun\nc. Pendaftar Pegawai Sipil Negara (PNS)\ndengan jabatan fungsional sebagai\nPeneliti/Perekayasa/Medis/Paramedis/\nPendidik paling tinggi 42 (empat puluh\ndua) tahun.\nd. Pendaftar Prajurit TNI atau anggota\nPOLRI paling tinggi 40 (empat puluh)\ntahun.\n4. Mengunggah dokumen Indeks Prestasi\nKumulatif (IPK) dengan ketentuan Indeks\nPrestasi Kumulatif (IPK) pada jenjang studi'
 'Dipublikasikan tanggal 11 Januari 2024\nTentang LPDP\nLPDP berkomitmen untuk mempersiapkan\npemimpin dan profesional masa depan serta\nmendorong inovasi demi terwujudnya Indonesia\nyang sejahtera, demokratis, dan berkeadilan.\nLPDP menyelenggarakan program beasiswa\nmagister/doktor serta beasiswa dokter spesialis,\ndokter subspesialis dan Fellowship untuk putra-\nputri terbaik Indonesia.\nApa itu Beasiswa Prioritas?\nBeasiswa Prioritas merupakan program beasiswa\nyang memberikan kesempatan kepada pendaftar\nuntuk dapat melakukan pendaftaran pada dua\nprogram sekaligus, yaitu pada program Beasiswa\nKemitraan/Kerja Sama LPDP dan pada salah satu\nprogram Beasiswa Afirmasi/Beasiswa\nTargeted/Beasiswa Umum tujuan luar negeri.\nApa itu Beasiswa Prioritas LPDP – Campus\nFrance Program Master?\nBeasiswa Prioritas LPDP – Campus France\nProgram Master memberikan kesempatan bagi\npendaftar untuk dapat melakukan pendaftaran\npada Beasiswa Kemitraan LPDP – Campus\nFrance dan beasiswa Magister Luar Negeri'
 'program beasiswa LPDP wajib melampirkan\nsurat usulan atau surat rekomendasi\nsekurang-kurangnya pejabat yang\nmembidangi pembinaan SDM pada Mabes\nTNI/ TNI AD/ TNI AL/ TNI AU untuk mengikuti\nprogram beasiswa LPDP yang ditujukan\nkepada LPDP.\n11. Bagi pendaftar berstatus anggota POLRI di\nsemua program beasiswa LPDP wajib\nmelampirkan surat usulan atau surat\nrekomendasi sekurang-kurangnya pejabat\nyang membidangi pembinaan SDM pada\nMabes POLRI untuk mengikuti program\nbeasiswa LPDP kepada LPDP pada saat\npendaftaran beasiswa LPDP.\n12. Memilih Perguruan Tinggi Tujuan dan\nprogram studi sesuai dengan ketentuan LPDP\n13. Beasiswa hanya diperuntukkan bagi kelas\nreguler atau kelas lain yang ditetapkan oleh\nLPDP, dan tidak diperuntukkan untuk kelas-\nkelas sebagai berikut:\na. Kelas eksekutif;\nb. Kelas khusus;\nc. Kelas karyawan;\nd. Kelas jarak jauh;\ne. Kelas yang diselenggarakan bukan di\nperguruan tinggi induk;\nf. Kelas internasional bagi pendaftar tujuan\nstudi dalam negeri;']","Beasiswa Tipe-A mencakup akomodasi di kampus, tunjangan mingguan sebesar NTD 1,500, dan penggantian biaya tiket pesawat (maksimal NTD 10,000).",0.0,0.9999999999,,0.0
4,Siapa yang memenuhi syarat untuk mendaftar program ini?,"Untuk dapat mendaftar program internasional di perguruan tinggi mitra ITS luar negeri yang membutuhkan surat rekomendasi atau dana dukungan dari ITS, mahasiswa ITS harus memiliki sertifikat Global Competency Workshop (GCW) atau Global Competency Academy (GCA). Selain itu, mahasiswa KIP/Bidik Misi atau mahasiswa yang kurang mampu juga dapat mendaftar GCW/GCA terlebih dahulu tanpa melakukan pembayaran untuk kemudian dievaluasi. Beasiswa dan bebas biaya mengikuti GCW/GCA selalu dimungkinkan untuk mahasiswa KIP/Bidik Misi yang memenuhi persyaratan.","['1. Setiap mahasiswa ITS yang ingin mendaftar program internasional di perguruan tinggi mitra ITS luar negeri yang\nmembutuhkan surat rekomendasi atau dana dukungan dari ITS di antaranya IISMA/IISMA-Vo, pertukaran pelajar (exchange),\nlab-internship, short program, atau program lain di luar negeri, diharuskan memiliki sertifikat Global Competency\nWorkshop (GCW) atau Global Competency Academy (GCA). Sertifikat ini hanya bisa diperoleh dengan mengikuti program\nGCW atau GCA.'
 '4, Mahasiswa KIP/Bidik Misi atau mahasiswa yang kurang mampu dapat mendaftar GCW/GCA terlebih dahulu tanpa melakukan\npembayaran untuk kemudian dievaluasi. Beasiswa dan bebas biaya mengikuti GCW/GCA selalu dimungkinkan untuk\nmahasiswa KIP/Bidik Misi yang memenuhi persyaratan.'
 'kejuaraan/non kejuaraan, dan pengalaman\norganisasi pada aplikasi pendaftaran.\nApa saja persyaratan khusus pendaftaran\nBeasiswa Prioritas LPDP – Campus France\nProgram Master?\nPersyaratan khusus Beasiswa Kemitraan LPDP –\nCampus France Program Master adalah sebagai\nberikut:'
 '2. Look at the requirement of the program\nPreparing required document\n• Each program have different document\nrequirement listed on the web. Please\ncheck each of the requirement inside the\nrespected website link of the program for\ndetails\nwww.its.ac.id INSTITUT TEKNOLOGI SEPULUH NOPEMBER, Surabaya - Indonesia\n2a. Preparing Learning Agreement & Statement Letter\nFill Out Learning\nAgreement / Statement\nLetter\n• In case the description of the\nprogram required you to submit a\nLearning Agreement or Statement\nLetter file, please download the file\nform the web & fill it with your\ninformation first\nhttp://bit.ly/its-student-exchange\nhttps://intip.in/ResourceAkademikDanKemahasiswaanTIF\nwww.its.ac.id INSTITUT TEKNOLOGI SEPULUH NOPEMBER, Surabaya - Indonesia\n2b. Selecting Course to be Transferred\n• In case the description of the program required you to submit a Learning Agreement,\nplease check the Host University Syllabus & Informatics Syllabus to compare if the']",Program ini terbuka untuk mahasiswa pascasarjana (S2/S3) dan mahasiswa tahun ketiga atau lebih tinggi. Mahasiswa yang sudah menyelesaikan gelar PhD tidak memenuhi syarat.,0.0,0.999999999975,1.0,0.8407412779267492
5,Apa persyaratan dokumen yang harus disiapkan untuk pendaftaran?,"Untuk pendaftaran, persyaratan dokumen yang harus disiapkan meliputi:
1. Paspor
2. Sertifikat kemampuan berbahasa Inggris
3. Transkrip akademik resmi dalam bahasa Inggris
4. Sertifikat pendaftaran
5. Perjanjian pembelajaran
6. Surat pernyataan
7. Surat rekomendasi dalam bahasa Inggris
8. Permintaan bantuan pendanaan (opsional)
9. Sertifikat uji GCW* non-degree / sertifikat GCW (non-degree/basic/adv (untuk IUP))
*Global Competencies Workshop

Selain itu, terdapat persyaratan khusus pendaftaran untuk Beasiswa Prioritas LPDP - Campus France Program Master yang harus dipenuhi sesuai dengan ketentuan yang berlaku.","['Syarat dokumen mengikuti syarat program\nbeasiswa yang dipilih (mengacu pada Buku\nPanduan masing-masing program beasiswa).\nSeperti apa format Komitmen kembali ke\nIndonesia, rencana pasca studi, dan\nrencana kontribusi di Indonesia serta\nRencana Bisnis atau Rencana\nPengembangan Bisnis?\nKomitmen kembali ke Indonesia, rencana\npasca studi, dan rencana kontribusi di\nIndonesia (1500 – 2000 kata)\nDeskripsikan dalam tulisan secara jelas dan\nkonkret tentang tema di atas.'
 'kejuaraan/non kejuaraan, dan pengalaman\norganisasi pada aplikasi pendaftaran.\nApa saja persyaratan khusus pendaftaran\nBeasiswa Prioritas LPDP – Campus France\nProgram Master?\nPersyaratan khusus Beasiswa Kemitraan LPDP –\nCampus France Program Master adalah sebagai\nberikut:'
 '~ 80%\nGeneral Important Document\n• Passport\n• Certificate of english proficiency\n• Official academic transcript in english\n• Certificate of enrollment\n• Learning agreement\n• Statement letter\n• Recommendation letter in english\n• Funding request assistance (optional)\n• GCW* non-degree test / GCW (non-degree/basic/adv (for IUP) ) certificate\n*Global Competencies Workshop\nwww.its.ac.id INSTITUT TEKNOLOGI SEPULUH NOPEMBER, Surabaya - Indonesia\n1.Finding International Program to Join\nCheck ITS GE Web / Social Media\n• You can find list of the available international program either form ITS GE Web / other\nsocial media (Instagram, Line, Facebook)\n• Website: www.its.ac.id/international\n• Instagram: @itsinternationaloffice\n• Line: @its_io\n• Facebook: facebook.com/ioits\nwww.its.ac.id INSTITUT TEKNOLOGI SEPULUH NOPEMBER, Surabaya - Indonesia\n2. Look at the requirement of the program\nPreparing required document\n• Each program have different document\nrequirement listed on the web. Please'
 '2. Look at the requirement of the program\nPreparing required document\n• Each program have different document\nrequirement listed on the web. Please\ncheck each of the requirement inside the\nrespected website link of the program for\ndetails\nwww.its.ac.id INSTITUT TEKNOLOGI SEPULUH NOPEMBER, Surabaya - Indonesia\n2a. Preparing Learning Agreement & Statement Letter\nFill Out Learning\nAgreement / Statement\nLetter\n• In case the description of the\nprogram required you to submit a\nLearning Agreement or Statement\nLetter file, please download the file\nform the web & fill it with your\ninformation first\nhttp://bit.ly/its-student-exchange\nhttps://intip.in/ResourceAkademikDanKemahasiswaanTIF\nwww.its.ac.id INSTITUT TEKNOLOGI SEPULUH NOPEMBER, Surabaya - Indonesia\n2b. Selecting Course to be Transferred\n• In case the description of the program required you to submit a Learning Agreement,\nplease check the Host University Syllabus & Informatics Syllabus to compare if the']","Dokumen yang diperlukan meliputi: formulir aplikasi online, CV, transkrip resmi, surat rekomendasi, sertifikat kemampuan bahasa, rencana penelitian, salinan paspor, foto head-shot, dan dokumen tambahan opsional.",1.0,0.6388888888675925,1.0,0.8991909695194328
6,Bagaimana cara mengajukan aplikasi untuk program ini?,"Untuk mengajukan aplikasi untuk program ini, berikut langkah-langkah yang perlu diikuti:

1. Baca dengan teliti persyaratan dari setiap topik penelitian yang tersedia.
2. Isi formulir aplikasi online.
3. Siapkan semua materi aplikasi yang diminta, seperti Curriculum Vitae dalam format PDF, Transkrip Resmi, Surat Rekomendasi dalam format PDF, Sertifikat kemampuan bahasa, Rencana Penelitian dalam format PDF, Salinan Paspor (halaman biodata), Foto close-up dalam format JPG (minimal 300 KB, 826X1062 piksel), dan dokumen tambahan lainnya (jika diperlukan).
4. Kumpulkan semua materi aplikasi dalam file ZIP dan kirimkan ke coleng_dia@ccu.edu.tw.
5. Judul email harus mencantumkan ""Aplikasi untuk Internship Internasional CCU/COE 2024"".
6. Pastikan untuk mengirimkan aplikasi sebelum batas waktu pendaftaran pada tanggal 3 Maret 2024.
7. Informasi lebih lanjut mengenai aplikasi dapat ditemukan di website https://sites.google.com/view/ccu-coe-internship/home.

Jika ada pertanyaan lebih lanjut, Anda dapat menghubungi kontak +886-5-2720411 ext. 23003 atau 23005 atau melalui email coleng_dia@ccu.edu.tw.","['application form, prepare\r\napplication materials, and send\r\nthem in a ZIP-compressed file to\r\ncoleng_dia@ccu.edu.tw.\r\n• The title of the e-mail please be\r\nmarked with “Application for 2024\r\nCCU/COE International Internship”.\r\nAll the intern research topics and\r\ntheir requirements are listed as\r\nfollows.\r\n• Application deadline: Mar. 3, 2024\r\n• More detailed information about\r\napplication can be found on the\r\nwebsite\r\nhttps://sites.google.com/view/ccu-\r\ncoe-internship/home\r\nCONTACT\r\n+886-5-2720411 ext. 23003, 23005\r\ncoleng_dia@ccu.edu.tw\r\nNo.168, Sec. 1, University Rd., Minhsiung,\r\nChiayi 621301, Taiwan (R.O.C.)\r\n\r\nINTERN RESEARCH TOPICS\r\nNumber P1\r\nProject title\r\nTrustable Artificial Intelligence for Critical Applications and\r\n6G Security\r\nDescription of the research\r\nArtificial Intelligence (AI) technologies, 6G networking,\r\nand quantum computing are the leading forces in\r\nbringing the world to an era of better intelligence and full'
 ""• Those who already complete PhD degree are NOT eligible to apply.\r\n• Passport holders of People's Republic of China, Hong Kong, or Macau\r\nare NOT eligible to apply.\r\n• Current degree-seeking students, exchange, and visiting students in\r\nTaiwanese educational institutions are NOT eligible to apply.\r\nAPPLICATION\r\nMATERIALS\r\n1. Online Application Form\r\n2. Curriculum Vitae in PDF\r\nformat\r\n3. Official Transcripts\r\n4. Letter of\r\nRecommendation in PDF\r\nformat\r\n5. Certificate of language\r\nproficiency\r\n6. Research Plan in PDF\r\nformat\r\n7. Copy of Passport (Bio-\r\npage)\r\n8. Head-shot Photo in JPG\r\nformat (at least 300 KB\r\nfiles ize, 826X1062 pixels.)\r\n9. Other Supplementary\r\nDocuments(Optional)\r\nAPPLICATION\r\n• Applicants should read the\r\nrequirements of each research topic\r\ncarefully, complete the online\r\napplication form, prepare\r\napplication materials, and send\r\nthem in a ZIP-compressed file to\r\ncoleng_dia@ccu.edu.tw.\r\n• The title of the e-mail please be\r\nmarked with “Application for 2024""
 'melampirkan surat usulan atau surat\nrekomendasi sekurang-kurangnya dari\npejabat setingkat eselon II yang membidangi\npembinaan/pengembangan SDM pada\nKementerian/Lembaga atau Pemerintah\nDaerah tempat pendaftar bekerja dengan\nketentuan;\na. mengusulkan atau merekomendasikan\npendaftar untuk mengikuti program\nBeasiswa LPDP; dan\nb. mencantumkan Nama Lengkap serta\nNomor Induk Pegawai (NIP) pendaftar.\n9. Bagi pendaftar yang merupakan PNS dengan\nstatus PNS dengan jabatan fungsional\nsebagai Peneliti/Perekayasa/Medis/\nParamedis/ Pendidik, mengunggah Surat\nKeputusan (SK) Jabatan Terakhir atau SK\nKenaikan Pangkat Terakhir atau sejenisnya\nyang menunjukkan bahwa pendaftar adalah\nPNS dengan jabatan fungsional sebagai\nPeneliti/Perekayasa/Medis/Paramedis/Pendi\ndik.\n10. Bagi pendaftar berstatus prajurit TNI di semua\nprogram beasiswa LPDP wajib melampirkan\nsurat usulan atau surat rekomendasi\nsekurang-kurangnya pejabat yang\nmembidangi pembinaan SDM pada Mabes\nTNI/ TNI AD/ TNI AL/ TNI AU untuk mengikuti'
 'Department. In this course, students would be assigned a project to design a\nresidential living house and business office in one building in Taiwan. Through the\nindividual discussion and idea exchange with the professor, students may enhance and\nextend their design ability to accomplish their project.\nThe Course Features\nThe goal of this course is to enhance the design potential and vision of students for\nthem to apply it in future projects. This course is to cultivate the logical thinking and\ncreativity of students. Students may improve their abilities through the discussion and\nexpression process in the course. There are two presentation phases during the\nsemester for students to present their improvement of design and project.\n77\nSyllabus\nWeek Contents\nTeaching\nHours\n1\n(Sep. 23)\n(Sep. 25)\nIntroduction of the Course; Self-introduction; Project description;\nIntroducing the base environment; Design concept\n6\n2 Student project observe and reviews of Asia University 6']","Pelamar harus membaca persyaratan setiap topik penelitian dengan cermat, melengkapi formulir aplikasi online, menyiapkan dokumen aplikasi, dan mengirim semuanya dalam file ZIP ke coleng_dia@ccu.edu.tw dengan subjek email “Application for 2024 CCU/COE International Internship”.",0.99999999995,1.0,0.9536755607921451,1.0
7,Apa tenggat waktu penyerahan aplikasi? ,Tenggat waktu penyerahan aplikasi adalah setidaknya 8 minggu antara tanggal 1 Mei 2024 hingga 31 Desember 2024.,"['Category\r\n■ Scholarship\r\n■ Self-supported\r\nIntern period At least 8 weeks between 2024/5/1- 2024/12/31\r\n\r\nNumber P16\r\nProject title\r\nNext generation Wireless communication, B5G/6G,\r\nReconfigurable Intelligent Surface, System level\r\nsimulation, Artificial Intelligence-enhanced wireless\r\nresearch\r\nDescription of the\r\nresearch\r\nInnovate and design cutting-edge concepts and\r\narchitectures beyond 5G (B5G) and 6G.\r\nIdentify and validate solutions to key problems through\r\nsimulation or prototype experiments.\r\nConduct research on AI and machine learning\r\ntechniques applied to wireless communications and\r\nnetworks.\r\nDesign and implement novel algorithms, models, and\r\nprotocols to optimize wireless network performance.\r\nCollaborate with the research team to manage projects\r\nand ensure timely deliverables,\r\nPlease refer to the website of our lab at\r\nhttps://sites.google.com/view/ccuantlab/english\r\nMentor at CCU\r\nAssoc. Prof. Jen-Yi Pan\r\nDept. of Communications Engineering,'
 '10. Tidak pernah menyelesaikan studi pada jenjang yang sama dengan jenjang studi yang dilamar.\n11. Bersedia untuk tidak bekerja selama masa studi, kecuali atas persetujuan LPDP.\n12. Kembali ke Indonesia dan berkontribusi di Indonesia selama 2 kali masa studi ditambah 1 tahun\nsetelah selesai studi.\n13. Sebagai pendaftar yang sedang menjalani studi (on going) bersedia untuk:\na. diwajibkan membuat dan menandatangani surat pengunduran diri yang ditujukan kepada\nPerguruan Tinggi atas program studi yang sedang ditempuh serta menyampaikan surat\ntersebut kepada LPDP paling lambat 2 (dua) pekan setelah diumumkan lulus seleksi\nsubstansi;\nb. diwajibkan menyerahkan surat pemberhentian resmi dari program studi atau perguruan tinggi\nsebelum penandatanganan surat pernyataan Penerima Beasiswa; dan\nc. diberhentikan beasiswanya apabila tidak memenuhi kewajiban pada huruf a atau b.\n14. Sebagai pendaftar Beasiswa LPDP program magister belum pernah menyelesaikan studi magister'
 'Kementerian Agama mengenai\npenyetaraan ijazah dan konversi IPK\nbagi pendaftar yang penyetaraan ijazah\ndan/atau konversi IPKnya belum terbit.\n5. Pendaftar yang sedang menempuh studi (on\ngoing) dapat mendaftar dengan ketentuan\nberikut:\na. Mendaftar pada program studi dan/atau\nperguruan tinggi tujuan yang berbeda dari\nyang sedang ditempuh;\nb. Pendaftar yang lulus seleksi substansi\nwajib membuat dan menandatangani surat\npengunduran diri yang ditujukan kepada\nperguruan tinggi atas program studi yang\nsedang ditempuh serta menyampaikan\nsurat tersebut kepada LPDP paling lambat\n2 (dua) pekan setelah diumumkan lulus\nseleksi substansi.\nc. Pendaftar wajib untuk menyerahkan surat\npemberhentian resmi dari program studi\natau perguruan tinggi sebelum\npenandatanganan surat pernyataan\nPenerima Beasiswa.\nd. Bagi pendaftar yang lulus seleksi\nsubstansi dan tidak memenuhi ketentuan\ntersebut di atas, maka LPDP dapat\nmembatalkan statusnya sebagai Calon\nPenerima Beasiswa.'
 'sesuai jadwal dan ketentuan yang\nberlaku di Perguruan Tinggi, dan\n● Campus France sesuai jadwal dan\nketentuan yang berlaku di Campus\nFrance.\n2. Persyaratan dan dokumen pada Beasiswa\nAfirmasi/Targeted/Umum yang dipilih,\nmengikuti syarat dan ketentuan pada masing-\nmasing program beasiswa.\n3. Pendaftar yang lolos seleksi pada program\nBeasiswa Kemitraan LPDP – Campus France\nProgram Master wajib menempuh studi pada\nprogram studi dan universitas tersebut.\n4. Apabila dinyatakan lulus pada program studi\ndan perguruan tinggi pada program beasiswa\nkemitraan/kerja sama beasiswa prioritas,\nmaka tidak dapat berpindah program studi,\nperguruan tinggi, dan/atau Beasiswa LPDP\nlainnya, atau kelulusan akan dibatalkan.\n5. Pendaftar yang tidak lolos seleksi pada\nprogram Beasiswa Kemitraan LPDP –\nCampus France, maka akan diproses pada']",Tenggat waktu penyerahan aplikasi adalah 3 Maret 2024.,0.999999999975,0.0,0.9763418697449812,0.0
8,Proyek apa saja yang tersedia dalam program ini?,"Terdapat dua proyek yang tersedia dalam program ini, yaitu merancang rumah tinggal dan kantor bisnis dalam satu bangunan di Taiwan serta membangun kemampuan komunitas.","['Department. In this course, students would be assigned a project to design a\nresidential living house and business office in one building in Taiwan. Through the\nindividual discussion and idea exchange with the professor, students may enhance and\nextend their design ability to accomplish their project.\nThe Course Features\nThe goal of this course is to enhance the design potential and vision of students for\nthem to apply it in future projects. This course is to cultivate the logical thinking and\ncreativity of students. Students may improve their abilities through the discussion and\nexpression process in the course. There are two presentation phases during the\nsemester for students to present their improvement of design and project.\n77\nSyllabus\nWeek Contents\nTeaching\nHours\n1\n(Sep. 23)\n(Sep. 25)\nIntroduction of the Course; Self-introduction; Project description;\nIntroducing the base environment; Design concept\n6\n2 Student project observe and reviews of Asia University 6'
 '6 Community Capability Construction 3\n7 Community Network Construction 3\n8 Planning and Evaluation of Community Service Plans 3\n9 Field Visit II / Mid-term 3\n10 Community Care 3\n11 Field Visit III 3\n12 Localized Welfare and role model community(ies) 3\n13 Community Building 3\n14 Field Visit IV/ Community Building 3\n15 Development of Community Work in Taiwan 3\n16\nTowards a Sustainable Community-The Future of Community\nWork in Taiwan\n3\n17 Field Visit V /Final Report 3\n18\n(Jan. 19)\nFinal Report 3\n58\n33. Social Policy and Legislation\n(Practice in Taiwan)\nDepartment: Social Work\nWeek of day: Monday\nCourse Time: 15:10 pm-18:00 pm (Taiwan time)\nGrades: 3rd\n& 4th\nyear\nCredits: 3\nInstructor: Dr. Chih-Bang Hsiao (chb-hsiao@asia.edu.tw)/ Dr. Song-Lin\nHuang (slh4221@asia.edu.tw)\nAbout the Course\nThe course starts with introducing social policy and legislation concepts, such as social\npolicy history, definition, related theory, and perspectives from different angles. It'
 'Dipublikasikan tanggal 11 Januari 2024\nTentang LPDP\nLPDP berkomitmen untuk mempersiapkan\npemimpin dan profesional masa depan serta\nmendorong inovasi demi terwujudnya Indonesia\nyang sejahtera, demokratis, dan berkeadilan.\nLPDP menyelenggarakan program beasiswa\nmagister/doktor serta beasiswa dokter spesialis,\ndokter subspesialis dan Fellowship untuk putra-\nputri terbaik Indonesia.\nApa itu Beasiswa Prioritas?\nBeasiswa Prioritas merupakan program beasiswa\nyang memberikan kesempatan kepada pendaftar\nuntuk dapat melakukan pendaftaran pada dua\nprogram sekaligus, yaitu pada program Beasiswa\nKemitraan/Kerja Sama LPDP dan pada salah satu\nprogram Beasiswa Afirmasi/Beasiswa\nTargeted/Beasiswa Umum tujuan luar negeri.\nApa itu Beasiswa Prioritas LPDP – Campus\nFrance Program Master?\nBeasiswa Prioritas LPDP – Campus France\nProgram Master memberikan kesempatan bagi\npendaftar untuk dapat melakukan pendaftaran\npada Beasiswa Kemitraan LPDP – Campus\nFrance dan beasiswa Magister Luar Negeri'
 'Dipublikasikan tanggal 11 Januari 2024\nprogram beasiswa lain yang dipilih, sesuai\ndengan syarat dan ketentuan yang berlaku.\nApa saja komponen Dana yang diberikan?\n1. Dana Pendidikan\na. Tuition Fee\nb. Dana Pendaftaran\nc. Dana Tunjangan Buku\nd. Dana Penelitian Tesis\ne. Dana Seminar Internasional\nf. Dana Publikasi Jurnal Internasional\n2. Dana Pendukung\na. Dana Transportasi\nb. Dana Aplikasi Visa\nc. Dana Asuransi Kesehatan\nd. Dana Kedatangan\ne. Dana Hidup Bulanan\nf. Dana Lomba Internasional\ng. Dana keadaaan darurat (jika diperlukan)\nApa saja persyaratan umum pendaftaran\nBeasiswa Prioritas LPDP – Campus\nFrance Program Master?\nPersyaratan umum Beasiswa Prioritas LPDP –\nCampus France Program Master adalah sebagai\nberikut:\n1. Warga Negara Indonesia.\n2. Telah menyelesaikan studi program diploma\nempat (D4) atau sarjana (S1).\n3. Pendaftar yang telah menyelesaikan studi\nmagister (S2) tidak diizinkan mendaftar.\n4. Bagi pendaftar lulusan perguruan tinggi luar']","Terdapat berbagai proyek, termasuk ""Trustable Artificial Intelligence for Critical Applications and 6G Security,"" ""Grid-Forming and Grid-Following Inverter-based Resources for Low-Inertia Microgrid/Grid,"" dan banyak lagi.",0.999999999975,0.3333333333333333,0.9762473608677998,0.0
9,"Siapa mentor yang terlibat dalam proyek P1 ""Trustable Artificial Intelligence for Critical Applications and 6G Security""?","Mentor yang terlibat dalam proyek P1 ""Trustable Artificial Intelligence for Critical Applications and 6G Security"" adalah Assoc. Prof. Jen-Yi Pan dari Departemen Teknik Komunikasi, Universitas Nasional Chung Cheng, Taiwan, ROC.","['Description of the research\r\nArtificial Intelligence (AI) technologies, 6G networking,\r\nand quantum computing are the leading forces in\r\nbringing the world to an era of better intelligence and full\r\nautomation. However, the rapid development of such\r\ntechnologies raises concerns that they could be used to\r\ndamage human life, destroy critical infrastructure, and\r\nfurther violate user privacy. For example, AI power can be\r\nexploited to scan the vulnerabilities of critical control\r\nsystems (SCADA, ITS) or track a target user in a restricted\r\naccess building, even without physical intrusion. Similarly,\r\nthe attackers can launch adversarial attacks against AI-\r\nbased Advanced Driver-Assistance Systems (ADAS) and\r\nforce connected vehicles to act as unexpected weapons\r\nto hit civilians. Early detection of security attacks and\r\nsecure AI models are the top targets of many current\r\nresearch efforts. In short, our lab is recruiting talents who\r\nare interested in the following topics:'
 'secure AI models are the top targets of many current\r\nresearch efforts. In short, our lab is recruiting talents who\r\nare interested in the following topics:\r\n(1) AI for Cybersecurity: Misbehavior detection in\r\nautonomous vehicles, Deep Reinforcement Learning for\r\naerial-assisted networks (UAV-satellite-space) or\r\nIntelligent Transportation Systems, Self-supervised\r\nLearning, autoDL /ML for Intrusion Detection Systems.\r\n(2) Cybersecurity for AI: Trustable AI for automated\r\nvehicles and AI-based control systems from adversarial\r\nattacks.\r\n(3) 6G security: Signal sensing, physical layer\r\nauthentication, high-accuracy localization and sensing.\r\n(4) Space and Quantum security: Blockchain for\r\nvehicular/aerial networks; Quantum - safe\r\nvehicular/aerial networks; Quantum - compatible IDS\r\nplatforms.\r\nAbout CISLab: CIS Lab is a leading security research group\r\nat National Chung Cheng University, established by Prof.\r\nVan-Linh Nguyen. CISLab has been the home of many'
 'Please refer to the website of our lab at\r\nhttps://sites.google.com/view/ccuantlab/english\r\nMentor at CCU\r\nAssoc. Prof. Jen-Yi Pan\r\nDept. of Communications Engineering,\r\nNational Chung Cheng University, Taiwan, ROC.\r\n(e-mail: jypan@ccu.edu.tw)\r\nExpected student level\r\n■ Post-graduate student\r\n■ Third/forth-year undergraduate senior student\r\nCategory\r\n■ Scholarship\r\n■ Self-supported\r\nIntern period\r\nAt least 8 weeks between May 1 and December 31,\r\n2024'
 ""developing algorithms for sensor data calibration, point\r\ncloud processing and image processing to create a\r\ncomprehensive and accurate representation of the\r\nvehicle's surroundings. The primary objective is to develop\r\nand optimize algorithms for efficiently processing and\r\ninterpreting the multi-modality. This includes tasks such as\r\nsemantic segmentation, feature extraction, and object\r\nrecognition, all of which are pivotal for the accurate\r\nperception of the vehicle's surroundings.\r\nMentor at CCU\r\nAssoc. Prof. Jui-Chiu Chiang\r\nDept. of Electrical Engineering,\r\nNational Chung Cheng University, Taiwan, ROC.\r\n(E-mail: rachel@ccu.edu.tw)\r\nExpected student level █ Third/forth-year undergraduate senior student\r\nCategory\r\n█ Scholarship\r\n█ Self-supported\r\nIntern period At least 12 weeks between May 1st and Dec. 31th\r\n\r\nNumber P4\r\nProject title\r\nSimulation and Reconstruction of Pencil Beam Scanning of\r\nParticle Therapy\r\nDescription of the research""]","Mentor untuk proyek ini adalah Asst. Prof. Van-Linh Nguyen dari Dept. of Computer Science and Information Engineering, CCU.",0.999999999975,0.5,0.9570273019795711,0.0
10,Apa yang dapat diperoleh peserta selama periode magang pada proyek P1? ,"Selama periode magang pada proyek P1, peserta dapat memperoleh pengalaman dalam menginovasi dan merancang konsep serta arsitektur terkini di luar 5G (B5G) dan 6G. Mereka juga dapat mengidentifikasi dan memvalidasi solusi untuk masalah kunci melalui simulasi atau percobaan prototipe. Selain itu, peserta akan melakukan penelitian tentang teknik kecerdasan buatan dan pembelajaran mesin yang diterapkan pada komunikasi nirkabel dan jaringan. Mereka akan merancang dan menerapkan algoritma, model, dan protokol baru untuk mengoptimalkan kinerja jaringan nirkabel. Kolaborasi dengan tim penelitian untuk mengelola proyek dan memastikan pengiriman tepat waktu juga merupakan bagian dari pengalaman magang ini.","['4, Mahasiswa KIP/Bidik Misi atau mahasiswa yang kurang mampu dapat mendaftar GCW/GCA terlebih dahulu tanpa melakukan\npembayaran untuk kemudian dievaluasi. Beasiswa dan bebas biaya mengikuti GCW/GCA selalu dimungkinkan untuk\nmahasiswa KIP/Bidik Misi yang memenuhi persyaratan.'
 'university and non partner,\nwith the duration depending\non each university (1-3\nMonths) and recommended\nfor final year students.\nShort Program\nThe opportunities to study\nabroad with ITS partner\nuniversity and non partner,\nwith the duration of 2 weeks –\n1 month, fully-funded or self-\nfunded programs.\nDouble Degree\nThe opportunities to study\nabroad with ITS partner\nuniversity and graduate with\ntwo independent degrees,\nwith the duration depending\non each university (2:2, 2.5:1.5,\n3:1) and have to make credit\ntransfer.\nwww.its.ac.id INSTITUT TEKNOLOGI SEPULUH NOPEMBER, Surabaya - Indonesia\nShort Program\nØ National Cheng Kung University Summer School\nØ International Summer/Winter University at Hochschule Darmstadt University of\nApplied Science, Germany\nØ Feng Chia International Summer School\nØ GKS ASEAN SCIENCES\nØ Delightful Istanbul Summer or Winter School\nØ Global Project Based Learning (GPBL) Shibaura Institute of Technology (SIT) Japan\nand KMUTT\nØ …\nbit.ly/its-short-program'
 'Category\r\n■ Scholarship\r\n■ Self-supported\r\nIntern period At least 8 weeks between 2024/5/1- 2024/12/31\r\n\r\nNumber P16\r\nProject title\r\nNext generation Wireless communication, B5G/6G,\r\nReconfigurable Intelligent Surface, System level\r\nsimulation, Artificial Intelligence-enhanced wireless\r\nresearch\r\nDescription of the\r\nresearch\r\nInnovate and design cutting-edge concepts and\r\narchitectures beyond 5G (B5G) and 6G.\r\nIdentify and validate solutions to key problems through\r\nsimulation or prototype experiments.\r\nConduct research on AI and machine learning\r\ntechniques applied to wireless communications and\r\nnetworks.\r\nDesign and implement novel algorithms, models, and\r\nprotocols to optimize wireless network performance.\r\nCollaborate with the research team to manage projects\r\nand ensure timely deliverables,\r\nPlease refer to the website of our lab at\r\nhttps://sites.google.com/view/ccuantlab/english\r\nMentor at CCU\r\nAssoc. Prof. Jen-Yi Pan\r\nDept. of Communications Engineering,'
 'b. Kelas khusus;\nc. Kelas karyawan;\nd. Kelas jarak jauh;\ne. Kelas yang diselenggarakan bukan di\nperguruan tinggi induk;\nf. Kelas internasional bagi pendaftar tujuan\nstudi dalam negeri;\ng. Kelas yang diselenggarakan di lebih dari\n1 (satu) negara perguruan tinggi; atau\nh. Kelas lainnya yang tidak memenuhi\nketentuan LPDP.\n14. Menyetujui surat pernyataan yang telah\ndisediakan pada aplikasi pendaftaran\nbeasiswa LPDP (poin-poin terlampir).\n15. Menulis profil diri termasuk riwayat pendidikan\nyang tidak diselesaikan pada aplikasi\npendaftaran.\n16. Menulis komitmen kembali ke Indonesia,\nrencana pasca studi, dan rencana kontribusi\ndi Indonesia.\n17. Jika pendaftar memiliki publikasi ilmiah,\nprestasi kejuaraan/non kejuaraan, dan\npengalaman organisasi maka pendaftar\nmengisi riwayat publikasi ilmiah, prestasi\nkejuaraan/non kejuaraan, dan pengalaman\norganisasi pada aplikasi pendaftaran.\nApa saja persyaratan khusus pendaftaran\nBeasiswa Prioritas LPDP – Campus France\nProgram Master?']","Peserta akan memperoleh keterampilan dalam penelitian state-of-the-art, keterampilan pemrograman melalui proyek mini, debat untuk mendapatkan ide kreatif, pelaporan hasil secara profesional, dan menghadiri tur industri serta kursus bahasa Tionghoa.",0.999999999975,0.2,0.0,0.2
11,"Proyek P2 ""A Study of Grid-Forming and Grid-Following Inverter-based Resources for Low-Inertia Microgrid/Grid with Virtual Inertia and Grid Voltage Support Functions"" mencakup apa?","Proyek P2 ""A Study of Grid-Forming and Grid-Following Inverter-based Resources for Low-Inertia Microgrid/Grid with Virtual Inertia and Grid Voltage Support Functions"" mencakup penelitian tentang sumber daya inverter berbasis grid-forming dan grid-following untuk mikrogrid/grid dengan inersia rendah yang dilengkapi dengan fungsi virtual inertia dan dukungan tegangan grid. Penelitian ini akan membahas topik integrasi energi terbarukan, termasuk model dan kontrol farm angin, diagnosis kesalahan untuk sistem tenaga surya, aplikasi kecerdasan buatan pada sistem tenaga terbarukan, teknologi peramalan untuk sumber daya energi terbarukan, kontrol dan operasi grid pintar, sistem penyimpanan energi, serta analisis sistem transmisi dan distribusi.","['Project title\r\nRenewable Energy Integration: Power System Analyses,\r\nPower Conversion or Intelligent Control\r\nDescription of the research\r\nThe students will learn the research topics about\r\nrenewable energy integration, which includes one of the\r\nfollowing issues:\r\n➢ Wind farm modeling and control\r\n➢ Fault diagnosis for solar power systems\r\n➢ Artificial intelligence applications on renewable\r\npower systems\r\n➢ Forecasting technologies for renewable power\r\nresources\r\n➢ Smart grid control and operation\r\n➢ Energy storage systems\r\n➢ Transmission and distribution system analyses\r\nMentor at CCU\r\nProf. Yuan-Kang Wu\r\nDept. of Electrical Engineering\r\nNational Chung Cheng University, Taiwan, ROC.\r\n(e-mail: allenwu@ccu.edu.tw)\r\nExpected student level\r\n█ Post-graduate student\r\n█ Third/forth-year undergraduate senior student\r\nCategory █ Scholarship\r\nIntern period At least 12 weeks between May 1 and December 31, 2024\r\n\r\nNumber P8\r\nProject title Silicon photonics and optical biosesnors'
 'Department. In this course, students would be assigned a project to design a\nresidential living house and business office in one building in Taiwan. Through the\nindividual discussion and idea exchange with the professor, students may enhance and\nextend their design ability to accomplish their project.\nThe Course Features\nThe goal of this course is to enhance the design potential and vision of students for\nthem to apply it in future projects. This course is to cultivate the logical thinking and\ncreativity of students. Students may improve their abilities through the discussion and\nexpression process in the course. There are two presentation phases during the\nsemester for students to present their improvement of design and project.\n77\nSyllabus\nWeek Contents\nTeaching\nHours\n1\n(Sep. 23)\n(Sep. 25)\nIntroduction of the Course; Self-introduction; Project description;\nIntroducing the base environment; Design concept\n6\n2 Student project observe and reviews of Asia University 6'
 'Dipublikasikan tanggal 11 Januari 2024\nTentang LPDP\nLPDP berkomitmen untuk mempersiapkan\npemimpin dan profesional masa depan serta\nmendorong inovasi demi terwujudnya Indonesia\nyang sejahtera, demokratis, dan berkeadilan.\nLPDP menyelenggarakan program beasiswa\nmagister/doktor serta beasiswa dokter spesialis,\ndokter subspesialis dan Fellowship untuk putra-\nputri terbaik Indonesia.\nApa itu Beasiswa Prioritas?\nBeasiswa Prioritas merupakan program beasiswa\nyang memberikan kesempatan kepada pendaftar\nuntuk dapat melakukan pendaftaran pada dua\nprogram sekaligus, yaitu pada program Beasiswa\nKemitraan/Kerja Sama LPDP dan pada salah satu\nprogram Beasiswa Afirmasi/Beasiswa\nTargeted/Beasiswa Umum tujuan luar negeri.\nApa itu Beasiswa Prioritas LPDP – Campus\nFrance Program Master?\nBeasiswa Prioritas LPDP – Campus France\nProgram Master memberikan kesempatan bagi\npendaftar untuk dapat melakukan pendaftaran\npada Beasiswa Kemitraan LPDP – Campus\nFrance dan beasiswa Magister Luar Negeri'
 'Dipublikasikan tanggal 11 Januari 2024\nNo Bidang Study Program University\n51 Material Sciences\nGraduate Programme Innovative Materials and\nEnergy Systems (Emat) - Master\nNantes Université\n52 Urban Planning Economics for Smart Cities and Climate Policy Institut Polytechnique de Paris\nPoin-Poin Surat Pernyataan pada Aplikasi Pendaftaran (Disetujui Saat Akan Melakukan Submit)\n1. Setia kepada Pancasila, Negara Kesatuan Republik Indonesia, dan UUD 1945.\n2. Tidak pernah, sedang, atau akan mendukung atau terlibat dalam gerakan, organisasi, atau ideologi\nyang bertentangan dan/atau berpotensi mengganggu tegaknya ideologi Pancasila, Undang-\nUndang Dasar 1945, dan Negara Kesatuan Republik Indonesia.\n3. Mendahulukan kepentingan Bangsa dan Negara Kesatuan Republik Indonesia di atas kepentingan\npribadi.\n4. Tidak akan berpindah kewarganegaraan sejak pendaftaran beasiswa sampai dengan selesainya\nmasa kontribusi sebagai alumni beasiswa LPDP.']",Proyek ini mencakup penelitian berbasis simulasi untuk meningkatkan ketahanan dan stabilitas jaringan mikrogid/inverter berinertia rendah dengan menggunakan inverter GFM dan GFL dengan fungsi inertia virtual dan dukungan tegangan grid.,0.9999999999,0.8,0.8687681703237239,1.0
12,"Apa yang akan dipelajari dalam proyek P3 ""Lidar and Camera Fusion for Autonomous Driving""?","Dalam proyek P3 ""Lidar and Camera Fusion for Autonomous Driving"", peserta magang akan belajar tentang integrasi data sensor lidar dan kamera untuk mengembangkan algoritma yang kuat untuk persepsi dan pengambilan keputusan yang lebih baik dalam sistem self-driving. Mereka akan terlibat dalam penggabungan input lidar dan kamera, menggunakan Python dan model machine learning canggih. Tujuan utamanya termasuk mengembangkan algoritma untuk kalibrasi data sensor, pemrosesan awan titik, dan pemrosesan gambar untuk menciptakan representasi yang komprehensif dan akurat dari sekitar kendaraan.","['or large disturbances.\r\nMentor at CCU\r\nProf. Gary Chang, PhD, PE, IEEE Fellow\r\nDept. of Electrical Engineering,\r\nNational Chung Cheng University, Taiwan, ROC.\r\n(e-mail: ieegwc@ccu.edu.tw)\r\nExpected student level\r\n■ Post-graduate student\r\n■ Third/forth-year undergraduate senior student\r\nCategory\r\n█ Scholarship\r\n█ Self-supported\r\nIntern period 12 to 20 weeks between April 1 and Dec. 31, 2024\r\n\r\nNumber P3\r\nProject title Lidar and Camera fusion for autonomous driving\r\nDescription of the research\r\nThis project revolves around the integration of lidar and\r\ncamera sensor data, aiming to develop robust algorithms\r\nfor enhanced perception and decision-making in self-\r\ndriving systems. Interns will engage in the fusion of lidar\r\nand camera inputs, leveraging Python and advanced\r\nmachine learning models. The primary objectives include\r\ndeveloping algorithms for sensor data calibration, point\r\ncloud processing and image processing to create a\r\ncomprehensive and accurate representation of the'
 ""developing algorithms for sensor data calibration, point\r\ncloud processing and image processing to create a\r\ncomprehensive and accurate representation of the\r\nvehicle's surroundings. The primary objective is to develop\r\nand optimize algorithms for efficiently processing and\r\ninterpreting the multi-modality. This includes tasks such as\r\nsemantic segmentation, feature extraction, and object\r\nrecognition, all of which are pivotal for the accurate\r\nperception of the vehicle's surroundings.\r\nMentor at CCU\r\nAssoc. Prof. Jui-Chiu Chiang\r\nDept. of Electrical Engineering,\r\nNational Chung Cheng University, Taiwan, ROC.\r\n(E-mail: rachel@ccu.edu.tw)\r\nExpected student level █ Third/forth-year undergraduate senior student\r\nCategory\r\n█ Scholarship\r\n█ Self-supported\r\nIntern period At least 12 weeks between May 1st and Dec. 31th\r\n\r\nNumber P4\r\nProject title\r\nSimulation and Reconstruction of Pencil Beam Scanning of\r\nParticle Therapy\r\nDescription of the research""
 'b. Kelas khusus;\nc. Kelas karyawan;\nd. Kelas jarak jauh;\ne. Kelas yang diselenggarakan bukan di\nperguruan tinggi induk;\nf. Kelas internasional bagi pendaftar tujuan\nstudi dalam negeri;\ng. Kelas yang diselenggarakan di lebih dari\n1 (satu) negara perguruan tinggi; atau\nh. Kelas lainnya yang tidak memenuhi\nketentuan LPDP.\n14. Menyetujui surat pernyataan yang telah\ndisediakan pada aplikasi pendaftaran\nbeasiswa LPDP (poin-poin terlampir).\n15. Menulis profil diri termasuk riwayat pendidikan\nyang tidak diselesaikan pada aplikasi\npendaftaran.\n16. Menulis komitmen kembali ke Indonesia,\nrencana pasca studi, dan rencana kontribusi\ndi Indonesia.\n17. Jika pendaftar memiliki publikasi ilmiah,\nprestasi kejuaraan/non kejuaraan, dan\npengalaman organisasi maka pendaftar\nmengisi riwayat publikasi ilmiah, prestasi\nkejuaraan/non kejuaraan, dan pengalaman\norganisasi pada aplikasi pendaftaran.\nApa saja persyaratan khusus pendaftaran\nBeasiswa Prioritas LPDP – Campus France\nProgram Master?'
 'NBI) model. These models will be generated through a\r\nconversion algorithm referred to as the spectrum-aided\r\nvision enhancer (SAVE). The main goal will be to discover\r\nDysplasia and Squamous Cell Carcinoma (SCC). The\r\nevaluation of model performance will be conducted using the\r\ncreated confusion matrix and five important indicators:\r\nprecision, recall, F1-score, mAP, and the confusion matrix of\r\nthe trained model.\r\nMentor at CCU\r\nProf. Hsiang-Chen Wang\r\nDept. of Mechanical Engineering,\r\nNational Chung Cheng University, Taiwan, ROC.\r\n(e-mail: hcwang@ccu.edu.tw)\r\nExpected student level\r\n■ Post-graduate student\r\n■ Third/forth-year undergraduate senior student\r\nCategory ■ Scholarship\r\nIntern period At least 12 weeks between May and December 2024\r\n\r\nNumber P14\r\nProject title Stirling engines and their applications\r\nDescription of the\r\nresearch\r\nThe students will learn the research topics about Stirling\r\nengines and their applications in renewable energy,']","Peserta akan mengembangkan algoritma untuk kalibrasi data sensor, pemrosesan titik awan, dan pemrosesan gambar untuk penggabungan data lidar dan kamera untuk sistem mengemudi otonom.",0.99999999995,1.0,0.9820219550296985,1.0
13,"Apa yang membuat proyek P5 ""Computer Vision Applications based on Deep Learning Techniques"" menarik?","Proyek P5 ""Computer Vision Applications based on Deep Learning Techniques"" menarik karena proyek ini akan menggunakan model Neural Network (NN) dan model Neural Network Bayesian Inference (NBI) yang dihasilkan melalui algoritma konversi yang disebut sebagai spectrum-aided vision enhancer (SAVE). Tujuan utamanya adalah untuk menemukan Dysplasia dan Squamous Cell Carcinoma (SCC) dengan melakukan evaluasi kinerja model menggunakan matriks kebingungan yang dibuat dan lima indikator penting: presisi, recall, F1-score, mAP, dan matriks kebingungan dari model yang dilatih. Selain itu, proyek ini akan dibimbing oleh Prof. Hsiang-Chen Wang dari Departemen Teknik Mesin, Universitas Nasional Chung Cheng, Taiwan, ROC.","['Department. In this course, students would be assigned a project to design a\nresidential living house and business office in one building in Taiwan. Through the\nindividual discussion and idea exchange with the professor, students may enhance and\nextend their design ability to accomplish their project.\nThe Course Features\nThe goal of this course is to enhance the design potential and vision of students for\nthem to apply it in future projects. This course is to cultivate the logical thinking and\ncreativity of students. Students may improve their abilities through the discussion and\nexpression process in the course. There are two presentation phases during the\nsemester for students to present their improvement of design and project.\n77\nSyllabus\nWeek Contents\nTeaching\nHours\n1\n(Sep. 23)\n(Sep. 25)\nIntroduction of the Course; Self-introduction; Project description;\nIntroducing the base environment; Design concept\n6\n2 Student project observe and reviews of Asia University 6'
 'NBI) model. These models will be generated through a\r\nconversion algorithm referred to as the spectrum-aided\r\nvision enhancer (SAVE). The main goal will be to discover\r\nDysplasia and Squamous Cell Carcinoma (SCC). The\r\nevaluation of model performance will be conducted using the\r\ncreated confusion matrix and five important indicators:\r\nprecision, recall, F1-score, mAP, and the confusion matrix of\r\nthe trained model.\r\nMentor at CCU\r\nProf. Hsiang-Chen Wang\r\nDept. of Mechanical Engineering,\r\nNational Chung Cheng University, Taiwan, ROC.\r\n(e-mail: hcwang@ccu.edu.tw)\r\nExpected student level\r\n■ Post-graduate student\r\n■ Third/forth-year undergraduate senior student\r\nCategory ■ Scholarship\r\nIntern period At least 12 weeks between May and December 2024\r\n\r\nNumber P14\r\nProject title Stirling engines and their applications\r\nDescription of the\r\nresearch\r\nThe students will learn the research topics about Stirling\r\nengines and their applications in renewable energy,'
 'Dipublikasikan tanggal 11 Januari 2024\nTentang LPDP\nLPDP berkomitmen untuk mempersiapkan\npemimpin dan profesional masa depan serta\nmendorong inovasi demi terwujudnya Indonesia\nyang sejahtera, demokratis, dan berkeadilan.\nLPDP menyelenggarakan program beasiswa\nmagister/doktor serta beasiswa dokter spesialis,\ndokter subspesialis dan Fellowship untuk putra-\nputri terbaik Indonesia.\nApa itu Beasiswa Prioritas?\nBeasiswa Prioritas merupakan program beasiswa\nyang memberikan kesempatan kepada pendaftar\nuntuk dapat melakukan pendaftaran pada dua\nprogram sekaligus, yaitu pada program Beasiswa\nKemitraan/Kerja Sama LPDP dan pada salah satu\nprogram Beasiswa Afirmasi/Beasiswa\nTargeted/Beasiswa Umum tujuan luar negeri.\nApa itu Beasiswa Prioritas LPDP – Campus\nFrance Program Master?\nBeasiswa Prioritas LPDP – Campus France\nProgram Master memberikan kesempatan bagi\npendaftar untuk dapat melakukan pendaftaran\npada Beasiswa Kemitraan LPDP – Campus\nFrance dan beasiswa Magister Luar Negeri'
 ""Ø GKS ASEAN SCIENCES\nØ Delightful Istanbul Summer or Winter School\nØ Global Project Based Learning (GPBL) Shibaura Institute of Technology (SIT) Japan\nand KMUTT\nØ …\nbit.ly/its-short-program\nwww.its.ac.id INSTITUT TEKNOLOGI SEPULUH NOPEMBER, Surabaya - Indonesia\nInternship\nØ Universiti Kuala Lumpur (UniKL) – MFI (Malaysia France Institute) Campus\nØ Shibaura Institute of Technology, Japan\nØ Universiti Teknologi Malaysia, Malaysia\nØ Tarlac Agricultural University (TAU), Philippines\nØ King Mongkut's University of Technology Thonburi (KMUTT), Thailand\nØ National Chung Hsing University (NCHU), Taiwan\nØ Pompeu Fabra University, Spain\nØ …\nbit.ly/ its-internship\nwww.its.ac.id INSTITUT TEKNOLOGI SEPULUH NOPEMBER, Surabaya - Indonesia\nStudent Exchange\nØ Kumamoto University, Japan\nØ Chung Ang University, South Korea\nØ Chulalongkorn University, Thailand\nØ King Mongkut's University of Technology Thonburi, Thailand\nØ …\nbit.ly/ its-student-exchange""]","Proyek ini mencakup teknik pembelajaran mendalam seperti CNN, RNN, LSTM, dan lain-lain untuk aplikasi seperti ekstraksi kerangka 3D manusia, pengenalan tindakan, dan estimasi pose objek dari gambar RGB tunggal.",0.499999999975,0.3333333333333333,0.8684982328270361,0.0
14,"Apa fokus dari proyek P8 ""Silicon Photonics and Optical Biosensors""? ","Jawaban: Fokus dari proyek P8 ""Silicon Photonics and Optical Biosensors"" adalah pengembangan jenis baru fotodetektor berbasis silikon yang kompatibel dengan CMOS, serta pengembangan biosensor optik sekali pakai baru untuk deteksi biomedis yang hemat biaya dan cepat untuk pengobatan yang tepat.","['Category █ Scholarship\r\nIntern period At least 12 weeks between May 1 and December 31, 2024\r\n\r\nNumber P8\r\nProject title Silicon photonics and optical biosesnors\r\nDescription of the research\r\nThe topic is to develope (a) new types of silicon-based,\r\nCMOS compatible photodetectors, which have many\r\nadvantages over conventional III-V based counterparts for\r\nmid-infrared applications, (b) new disposable optical\r\nbiosensors for cost-effective and rapid biomedical\r\ndetection for precise medicine. This internship program is\r\nopen for talents who are interested in advanced\r\noptoelectronic-sensing technologies. Focus will be placed\r\non designing, simulating, and analyzing new Si-based\r\ngroup-IV photodetectors and optical biosensors. For\r\nrelated information, please refer to the website of our lab\r\nat https://ccuphotonics307.wixsite.com/ccuphotonics307\r\nMentor at CCU\r\nProf. Guo-En Chang\r\nDept. of Mechanical Engineering\r\nNational Chung Cheng University, Taiwan, ROC.\r\n(e-mail: imegec@ccu.edu.tw)'
 ""Dipublikasikan tanggal 11 Januari 2024\nNo Bidang Study Program University\n17\nDigital / Information\nTechnologies\nMaster in Computer Vision (VIBOT)\nUniversité Bourgogne Franche-\nComté\n18\nDigital / Information\nTechnologies\nMaster in Physics & Computational Physics\n(CompuPhys)\nUniversité Bourgogne Franche-\nComté\n19 Energy\nMaster Solar Energy, Law, Economics and\nManagement (SoLEM)\nUniversité Savoie Mont Blanc\n20 Energy Master Nuclear Energy Université Paris-Saclay\n21 Energy Master Nuclear Energy Institut Polytechnique de Paris\n22 Energy\nMaster's Degree - Fundamental Physics:\nInternational Centre for Fundamental Physics\n(ICFP)\nUniversité Paris Cité\n23 Energy\nMaster MaNuEn - International master Program in\nMaterial Sciences for Nuclear Energy\nGrenoble INP - Université\nGrenoble Alpes\n24 Energy\nInternational Master's Degree in Transport and\nEnergy\nINSA Hauts-de-France -\nInstitut National des Sciences\nAppliquées""
 'be placed on designing, simulating, and analyzing new optical\r\nmonitoring systems for metal additive systems. For related information,\r\nplease refer to the website of our lab at\r\nhttps://ccuphotonics307.wixsite.com/ccuphotonics307\r\nMentor at CCU\r\nProf. Guo-En Chang\r\nDept. of Mechanical Engineering\r\nNational Chung Cheng University, Taiwan, ROC.\r\n(e-mail: imegec@ccu.edu.tw)\r\nExpected student\r\nlevel\r\n█ Post-graduate student\r\n█ Third/forth-year undergraduate senior student\r\nCategory ■ Scholarship\r\nIntern period At least 8 weeks (up to 6 months) between May and December 2024\r\n\r\nNumber P10\r\nProject title\r\nEffect of operating conditions on the performance of an\r\nall-vanadium redox flow battery\r\nDescription of the research\r\nThe performance of the VRFB is influenced by operating\r\nconditions, such as electrolyte concentration and\r\nelectrolyte flow rate. Students will conduct experiments\r\nto investigate the effect of operating conditions on the\r\nperformance of the VRFB and determine a suitable'
 'NBI) model. These models will be generated through a\r\nconversion algorithm referred to as the spectrum-aided\r\nvision enhancer (SAVE). The main goal will be to discover\r\nDysplasia and Squamous Cell Carcinoma (SCC). The\r\nevaluation of model performance will be conducted using the\r\ncreated confusion matrix and five important indicators:\r\nprecision, recall, F1-score, mAP, and the confusion matrix of\r\nthe trained model.\r\nMentor at CCU\r\nProf. Hsiang-Chen Wang\r\nDept. of Mechanical Engineering,\r\nNational Chung Cheng University, Taiwan, ROC.\r\n(e-mail: hcwang@ccu.edu.tw)\r\nExpected student level\r\n■ Post-graduate student\r\n■ Third/forth-year undergraduate senior student\r\nCategory ■ Scholarship\r\nIntern period At least 12 weeks between May and December 2024\r\n\r\nNumber P14\r\nProject title Stirling engines and their applications\r\nDescription of the\r\nresearch\r\nThe students will learn the research topics about Stirling\r\nengines and their applications in renewable energy,']",Fokusnya adalah mengembangkan photodetektor berbasis silikon baru yang kompatibel dengan CMOS dan biosensor optik sekali pakai untuk deteksi biomedis yang cepat dan hemat biaya.,0.999999999975,1.0,0.9922818453932076,1.0
15,"Apa yang menjadi target penelitian dalam proyek P10 ""Effect of Operating Conditions on the Performance of an All-Vanadium Redox Flow Battery""?",TARGET PENELITIAN: Mempelajari efek dari kondisi operasional terhadap kinerja dari sebuah baterai aliran redoks vanadium penuh.,"['Project title\r\nRenewable Energy Integration: Power System Analyses,\r\nPower Conversion or Intelligent Control\r\nDescription of the research\r\nThe students will learn the research topics about\r\nrenewable energy integration, which includes one of the\r\nfollowing issues:\r\n➢ Wind farm modeling and control\r\n➢ Fault diagnosis for solar power systems\r\n➢ Artificial intelligence applications on renewable\r\npower systems\r\n➢ Forecasting technologies for renewable power\r\nresources\r\n➢ Smart grid control and operation\r\n➢ Energy storage systems\r\n➢ Transmission and distribution system analyses\r\nMentor at CCU\r\nProf. Yuan-Kang Wu\r\nDept. of Electrical Engineering\r\nNational Chung Cheng University, Taiwan, ROC.\r\n(e-mail: allenwu@ccu.edu.tw)\r\nExpected student level\r\n█ Post-graduate student\r\n█ Third/forth-year undergraduate senior student\r\nCategory █ Scholarship\r\nIntern period At least 12 weeks between May 1 and December 31, 2024\r\n\r\nNumber P8\r\nProject title Silicon photonics and optical biosesnors'
 'Category\r\n■ Scholarship\r\n■ Self-supported\r\nIntern period At least 12 weeks between May 1 and December 31, 2024\r\n\r\nNumber P15\r\nProject title\r\nStudy of lithium ion battery, lithium sulfur battery,\r\nmetal-air battery, fuel cell and supercapacitor\r\nDescription of the\r\nresearch\r\nThe research will primarily concentrate on the study of\r\nelectrocatalysts and nanomaterials with the aim of\r\nexploring innovative applications in the realm of energy\r\nstorage. These applications encompass metal ion\r\nbatteries, metal-air batteries, fuel cells and\r\nsupercapacitors.\r\nMentor at CCU\r\nProf. Yuan-Yao Li\r\nDept. of Chemical Engineering\r\nNational Chung Cheng University, Taiwan, ROC.\r\n(e-mail: chmyyl@ccu.edu.tw)\r\nExpected student level\r\n■ Post-graduate student\r\n■ Third/forth-year undergraduate senior student\r\nCategory\r\n■ Scholarship\r\n■ Self-supported\r\nIntern period At least 8 weeks between 2024/5/1- 2024/12/31\r\n\r\nNumber P16\r\nProject title\r\nNext generation Wireless communication, B5G/6G,'
 'fast discharge dynamics and complex plasma chemistry.\r\nAlternatively, numerical simulations can be used to\r\ncapture discharge dynamics with detailed chemistry\r\nrevealed. In this project, a two-dimensional axisymmetric\r\nplasma fluid model will be integrated with a two-\r\ndimensional axisymmetric gas flow model to predict the\r\ndynamic behavior of a helium atmospheric pressure\r\nplasma jet. The simulated results will be compared with\r\nphotos taken by an intensified CCD camera to validate the\r\nmodel. It is a topic involving thermofluid science, which is\r\nsuitable for students in mechanical engineering.\r\nMentor at CCU\r\nAssoc. Prof. Kun-Mo Lin\r\nDept. of, Mechanical Engineering\r\nNational Chung Cheng University, Taiwan, ROC.\r\n(e-mail: imekml@ccu.edu.tw; kmlin.tw@gmail.com)\r\nExpected student level\r\n■ Post-graduate student\r\n■ Third/forth-year undergraduate senior student\r\nCategory\r\n■ Scholarship\r\n■ Self-supported\r\nIntern period At least 8 weeks between May and December 2024\r\n\r\nNumber P13'
 'review\n6\n13 Plan of the design project; Individual discussion; Project review 6\n14 Plan of the design project; Individual discussion; Project review 6\n15 Plan of the design project; Individual discussion; Project review 6\n16\nPlan of the design project; Individual discussion; Project review;\nStudent project observe and reviews of Asia University\n6\n17 Final Critique 6\n18\n(Jan. 20)\n(Jan. 22)\nFinal Report due Course Introspection and Review 6\n78']",Penelitian ini bertujuan untuk mempelajari efek kondisi operasi seperti konsentrasi elektrolit dan laju aliran elektrolit pada kinerja baterai aliran redoks vanadium.,0.9999999999666667,0.0,0.8436674155426506,0.0
16,"Apa tujuan dari proyek P12 ""Numerical Modeling and Experiments of an Atmospheric Pressure Plasma Jet Operated in Air with Shielding Gas""?","Tujuan dari proyek P12 ""Numerical Modeling and Experiments of an Atmospheric Pressure Plasma Jet Operated in Air with Shielding Gas"" adalah untuk mengembangkan model numerik dua dimensi yang akan diintegrasikan dengan model aliran gas dua dimensi untuk memprediksi perilaku dinamis dari plasma jet tekanan atmosfer yang dioperasikan dengan helium. Hasil simulasi akan dibandingkan dengan foto yang diambil oleh kamera CCD yang diperkuat untuk memvalidasi model tersebut. Proyek ini bertujuan untuk memahami dinamika plasma dengan detail kimia yang terkait dan cocok untuk mahasiswa teknik mesin.","['(e-mail: imekml@ccu.edu.tw; kmlin.tw@gmail.com)\r\nExpected student level\r\n■ Post-graduate student\r\n■ Third/forth-year undergraduate senior student\r\nCategory\r\n■ Scholarship\r\n■ Self-supported\r\nIntern period At least 8 weeks between May and December 2024\r\n\r\nNumber P12\r\nProject title\r\nNumerical modeling and Experiments of an atmospheric\r\npressure plasma jet operated in air with shielding gas\r\nDescription of the research\r\nAtmospheric-pressure plasma jets have been developed\r\nextensively for applications such as plasma medicine and\r\nplasma agriculture due to the generation of abundant\r\nreactive species being critical for manipulating reaction\r\npathways in different fields. However, it is still challenging\r\nto develop a proper plasma source with controlled\r\nparameters by experimental measurements because of\r\nfast discharge dynamics and complex plasma chemistry.\r\nAlternatively, numerical simulations can be used to\r\ncapture discharge dynamics with detailed chemistry'
 'fast discharge dynamics and complex plasma chemistry.\r\nAlternatively, numerical simulations can be used to\r\ncapture discharge dynamics with detailed chemistry\r\nrevealed. In this project, a two-dimensional axisymmetric\r\nplasma fluid model will be integrated with a two-\r\ndimensional axisymmetric gas flow model to predict the\r\ndynamic behavior of a helium atmospheric pressure\r\nplasma jet. The simulated results will be compared with\r\nphotos taken by an intensified CCD camera to validate the\r\nmodel. It is a topic involving thermofluid science, which is\r\nsuitable for students in mechanical engineering.\r\nMentor at CCU\r\nAssoc. Prof. Kun-Mo Lin\r\nDept. of, Mechanical Engineering\r\nNational Chung Cheng University, Taiwan, ROC.\r\n(e-mail: imekml@ccu.edu.tw; kmlin.tw@gmail.com)\r\nExpected student level\r\n■ Post-graduate student\r\n■ Third/forth-year undergraduate senior student\r\nCategory\r\n■ Scholarship\r\n■ Self-supported\r\nIntern period At least 8 weeks between May and December 2024\r\n\r\nNumber P13'
 'plasma agriculture due to the generation of abundant\r\nreactive species being critical for manipulating reaction\r\npathways in different fields. Therefore, it is essential to\r\ncharacterize the densities of reactive species introduced\r\nby plasma jets in the liquid phase for various applications.\r\nIn this project, the densities of OH/NO2\r\n-/NO3\r\n- will be\r\nexplored by using the microplate reader\r\nspectrophotometer under different operating conditions\r\nto reveal the correlations among reactive species\r\ngenerated in the liquid phase and the discharge\r\nparameters. Anyone interested in plasma technology and\r\ncharacterization is welcome to join the project.\r\nMentor at CCU\r\nAssoc. Prof. Kun-Mo Lin\r\nDept. of, Mechanical Engineering\r\nNational Chung Cheng University, Taiwan, ROC.\r\n(e-mail: imekml@ccu.edu.tw; kmlin.tw@gmail.com)\r\nExpected student level\r\n■ Post-graduate student\r\n■ Third/forth-year undergraduate senior student\r\nCategory\r\n■ Scholarship\r\n■ Self-supported'
 'Project title\r\nRenewable Energy Integration: Power System Analyses,\r\nPower Conversion or Intelligent Control\r\nDescription of the research\r\nThe students will learn the research topics about\r\nrenewable energy integration, which includes one of the\r\nfollowing issues:\r\n➢ Wind farm modeling and control\r\n➢ Fault diagnosis for solar power systems\r\n➢ Artificial intelligence applications on renewable\r\npower systems\r\n➢ Forecasting technologies for renewable power\r\nresources\r\n➢ Smart grid control and operation\r\n➢ Energy storage systems\r\n➢ Transmission and distribution system analyses\r\nMentor at CCU\r\nProf. Yuan-Kang Wu\r\nDept. of Electrical Engineering\r\nNational Chung Cheng University, Taiwan, ROC.\r\n(e-mail: allenwu@ccu.edu.tw)\r\nExpected student level\r\n█ Post-graduate student\r\n█ Third/forth-year undergraduate senior student\r\nCategory █ Scholarship\r\nIntern period At least 12 weeks between May 1 and December 31, 2024\r\n\r\nNumber P8\r\nProject title Silicon photonics and optical biosesnors']",Tujuan proyek ini adalah menggabungkan model plasma fluida dua dimensi axisimetrik dengan model aliran gas untuk memprediksi perilaku dinamis plasma jet tekanan atmosfer menggunakan gas helium.,0.99999999995,1.0,0.8974566602703087,1.0
17,"Proyek P13 ""Application of Novel Snap-shot based Hyperspectral Imaging Combined with AI to Detect Lesions"" menggunakan metode apa?","Proyek P13 ""Application of Novel Snap-shot based Hyperspectral Imaging Combined with AI to Detect Lesions"" menggunakan berbagai model machine learning, termasuk YOLOv5, YOLOv8, R-CNN, dan Faster R-CNN, untuk memprediksi dan mendeteksi kanker esofagus pada tahap awal. Proyek ini juga menggunakan dua model gambar kanker esofagus: model gambar cahaya putih (WLI) dan model gambar hiperspektral narrowband (HSI-NBI). Model-model ini dihasilkan melalui algoritma konversi yang disebut spectrum-aided vision enhancer (SAVE). Tujuan utamanya adalah untuk menemukan Dysplasia dan Squamous Cell Carcinoma (SCC).","['■ Post-graduate student\r\n■ Third/forth-year undergraduate senior student\r\nCategory\r\n■ Scholarship\r\n■ Self-supported\r\nIntern period At least 8 weeks between May and December 2024\r\n\r\nNumber P13\r\nProject title\r\nApplication of Novel Snap-shot based hyperspectral imaging\r\ncombined with AI to detect Lesions\r\nDescription of the\r\nresearch\r\nThe early detection of esophageal cancer presents a\r\nconsiderable difficulty, which contributes to its high\r\nprevalence as a major cause of cancer-related fatalities. This\r\nproject will utilize various machine learning models, including\r\nYOLOv5, YOLOv8, R-CNN, and Faster R-CNN, to predict and\r\ndetect early-stage esophageal cancer. It will make use of two\r\nmodels of esophageal cancer images: the white-light images\r\n(WLI) model and the hyperspectral narrowband images (HSI-\r\nNBI) model. These models will be generated through a\r\nconversion algorithm referred to as the spectrum-aided\r\nvision enhancer (SAVE). The main goal will be to discover'
 'NBI) model. These models will be generated through a\r\nconversion algorithm referred to as the spectrum-aided\r\nvision enhancer (SAVE). The main goal will be to discover\r\nDysplasia and Squamous Cell Carcinoma (SCC). The\r\nevaluation of model performance will be conducted using the\r\ncreated confusion matrix and five important indicators:\r\nprecision, recall, F1-score, mAP, and the confusion matrix of\r\nthe trained model.\r\nMentor at CCU\r\nProf. Hsiang-Chen Wang\r\nDept. of Mechanical Engineering,\r\nNational Chung Cheng University, Taiwan, ROC.\r\n(e-mail: hcwang@ccu.edu.tw)\r\nExpected student level\r\n■ Post-graduate student\r\n■ Third/forth-year undergraduate senior student\r\nCategory ■ Scholarship\r\nIntern period At least 12 weeks between May and December 2024\r\n\r\nNumber P14\r\nProject title Stirling engines and their applications\r\nDescription of the\r\nresearch\r\nThe students will learn the research topics about Stirling\r\nengines and their applications in renewable energy,'
 'Intern period At least 12 weeks between May 1st and Dec. 31th\r\n\r\nNumber P4\r\nProject title\r\nSimulation and Reconstruction of Pencil Beam Scanning of\r\nParticle Therapy\r\nDescription of the research\r\nPencil beam scanning in particle therapy is one of the\r\nhighlight radiation therapies for cancer treatment. Due to\r\nthe effectively and precisely control for particle-beam, the\r\nnarrow pulse and extremely high radiation dose rate\r\ndelivering becomes more and more significant. Basically,\r\nthe high dose rate will enable the recombination of the ion\r\npair effect, and it can lead to the received signal\r\nunderestimated. In addition, the higher spatial resolution\r\nand wide field of view is necessary. So, the main purpose of\r\nthe project is to develop a novel algorithm to reconstruct\r\nthe 2D image of the extremely high dose rate in\r\nproton/particle therapies. We hope that the students could\r\njoin us to implement a novel reconstruction algorithm and'
 'techniques. In this research, you will learn deep learning\r\ntechniques such as CNN, RNN, LSTM, AE, VAE, etc. The\r\npossible applications and topics include: (1) 3D human\r\nskeleton extraction, (2) skeleton-based action\r\nrecognition/behavior modeling, (3) action prediction for\r\nelderly monitoring, (4) 3D object (vehicle, pedestrian,\r\ncyclist) detection and positioning from fusion of RGB/LiDAR\r\nsensor data, (5) object (head/vehicle/ human/object) pose\r\nestimation from single RGB image, (6) deep learning-based\r\nadverse drug reaction (ADR) prediction for clinic medicine\r\nuse, (7) AI-generated content (AIGC), such as\r\n(text/audio/image) -to-(image/video), (8) elderly caring\r\napplication of AIGC, (9) heart rate estimation from facial\r\nimage sequence. The intern student is expected to have\r\nsome preliminary knowledge on NN (neural network) or\r\ndeep learning and skilled in Python programming. He/She\r\nwill learn how to apply state-of-the-art deep learning']","Proyek ini menggunakan model pembelajaran mesin seperti YOLOv5, YOLOv8, R-CNN, dan Faster R-CNN untuk mendeteksi kanker esofagus stadium awal menggunakan model gambar cahaya putih (WLI) dan gambar narrowband hiperspektral (HSI-NBI).",0.9166666666361111,1.0,0.8087029728182772,1.0
18,"Apa yang akan dikembangkan dalam proyek P16 ""Next Generation Wireless Communication, B5G/6G, Reconfigurable Intelligent Surface, System Level Simulation, Artificial Intelligence-enhanced Wireless Research""? ","Proyek P16 ""Next Generation Wireless Communication, B5G/6G, Reconfigurable Intelligent Surface, System Level Simulation, Artificial Intelligence-enhanced Wireless Research"" akan mengembangkan konsep dan arsitektur terdepan di luar 5G (B5G) dan 6G. Proyek ini juga akan mengidentifikasi dan memvalidasi solusi untuk masalah kunci melalui simulasi atau eksperimen prototipe. Selain itu, proyek ini akan melakukan penelitian tentang teknik kecerdasan buatan dan pembelajaran mesin yang diterapkan pada komunikasi nirkabel dan jaringan. Selain itu, proyek ini akan merancang dan menerapkan algoritma, model, dan protokol baru untuk mengoptimalkan kinerja jaringan nirkabel. Kolaborasi dengan tim penelitian akan dilakukan untuk mengelola proyek dan memastikan pengiriman tepat waktu.","[""Dipublikasikan tanggal 11 Januari 2024\nDAFTAR PERGURUAN TINGGI\nPROGRAM BEASISWA PRIORITAS LPDP – CAMPUS FRANCE PROGRAM MASTER\n2024\nNo Bidang Study Program University\n1 Blue Economy Master on Ship Operation Naval Engineering Ecole Centrale de Nantes\n2 Blue Economy\nMaster in Marine Technology - Hydrodynamics for\nOcean Engineering\nEcole Centrale de Nantes\n3 Blue Economy\nMSc Marine Technology Atlantic Master on Ship\nOperation & Naval Engineering (M-TECH\nAMASONE)\nEcole Centrale de Nantes\n4 Creative Industry\nMDes International Design Strategy / Le Studio\nFrance\nEcole de design Nantes\nAtlantique\n5 Creative Industry\nMSc Fashion, Design and Luxury Management\n(MSc FDLM)\nGrenoble Ecole de\nManagement\n6 Creative Industry\nMaster in Communications, Media and Creative\nIndustries\nSciences Po\n7 Creative Industry\nMSc Creative Music and Sound Design for Visual\nMedia Scoring\nUniversité Côte d'Azur\n8 Creative Industry\nMaster of Arts in Character Animation and\nAnimated Filmmaking\nLes Gobelins\n9""
 'Department. In this course, students would be assigned a project to design a\nresidential living house and business office in one building in Taiwan. Through the\nindividual discussion and idea exchange with the professor, students may enhance and\nextend their design ability to accomplish their project.\nThe Course Features\nThe goal of this course is to enhance the design potential and vision of students for\nthem to apply it in future projects. This course is to cultivate the logical thinking and\ncreativity of students. Students may improve their abilities through the discussion and\nexpression process in the course. There are two presentation phases during the\nsemester for students to present their improvement of design and project.\n77\nSyllabus\nWeek Contents\nTeaching\nHours\n1\n(Sep. 23)\n(Sep. 25)\nIntroduction of the Course; Self-introduction; Project description;\nIntroducing the base environment; Design concept\n6\n2 Student project observe and reviews of Asia University 6'
 'Dipublikasikan tanggal 11 Januari 2024\nNo Bidang Study Program University\n51 Material Sciences\nGraduate Programme Innovative Materials and\nEnergy Systems (Emat) - Master\nNantes Université\n52 Urban Planning Economics for Smart Cities and Climate Policy Institut Polytechnique de Paris\nPoin-Poin Surat Pernyataan pada Aplikasi Pendaftaran (Disetujui Saat Akan Melakukan Submit)\n1. Setia kepada Pancasila, Negara Kesatuan Republik Indonesia, dan UUD 1945.\n2. Tidak pernah, sedang, atau akan mendukung atau terlibat dalam gerakan, organisasi, atau ideologi\nyang bertentangan dan/atau berpotensi mengganggu tegaknya ideologi Pancasila, Undang-\nUndang Dasar 1945, dan Negara Kesatuan Republik Indonesia.\n3. Mendahulukan kepentingan Bangsa dan Negara Kesatuan Republik Indonesia di atas kepentingan\npribadi.\n4. Tidak akan berpindah kewarganegaraan sejak pendaftaran beasiswa sampai dengan selesainya\nmasa kontribusi sebagai alumni beasiswa LPDP.'
 'Category\r\n■ Scholarship\r\n■ Self-supported\r\nIntern period At least 8 weeks between 2024/5/1- 2024/12/31\r\n\r\nNumber P16\r\nProject title\r\nNext generation Wireless communication, B5G/6G,\r\nReconfigurable Intelligent Surface, System level\r\nsimulation, Artificial Intelligence-enhanced wireless\r\nresearch\r\nDescription of the\r\nresearch\r\nInnovate and design cutting-edge concepts and\r\narchitectures beyond 5G (B5G) and 6G.\r\nIdentify and validate solutions to key problems through\r\nsimulation or prototype experiments.\r\nConduct research on AI and machine learning\r\ntechniques applied to wireless communications and\r\nnetworks.\r\nDesign and implement novel algorithms, models, and\r\nprotocols to optimize wireless network performance.\r\nCollaborate with the research team to manage projects\r\nand ensure timely deliverables,\r\nPlease refer to the website of our lab at\r\nhttps://sites.google.com/view/ccuantlab/english\r\nMentor at CCU\r\nAssoc. Prof. Jen-Yi Pan\r\nDept. of Communications Engineering,']","Proyek ini berfokus pada inovasi dan desain konsep-konsep canggih dan arsitektur di luar 5G dan 6G, mengidentifikasi dan memvalidasi solusi untuk masalah kunci melalui simulasi atau eksperimen prototipe, serta merancang algoritma, model, dan protokol baru untuk mengoptimalkan kinerja jaringan nirkabel.",0.4166666666458333,1.0,0.9535158648008496,1.0
19,Bagaimana cara menghubungi penyelenggara program internship ini?,"Anda dapat menghubungi penyelenggara program internship ini melalui email di coleng_dia@ccu.edu.tw atau melalui nomor telepon +886-5-2720411 ext. 23003 atau 23005. Alamat lengkap penyelenggara program ini adalah No.168, Sec. 1, University Rd., Minhsiung, Chiayi 621301, Taiwan (R.O.C.).","['application form, prepare\r\napplication materials, and send\r\nthem in a ZIP-compressed file to\r\ncoleng_dia@ccu.edu.tw.\r\n• The title of the e-mail please be\r\nmarked with “Application for 2024\r\nCCU/COE International Internship”.\r\nAll the intern research topics and\r\ntheir requirements are listed as\r\nfollows.\r\n• Application deadline: Mar. 3, 2024\r\n• More detailed information about\r\napplication can be found on the\r\nwebsite\r\nhttps://sites.google.com/view/ccu-\r\ncoe-internship/home\r\nCONTACT\r\n+886-5-2720411 ext. 23003, 23005\r\ncoleng_dia@ccu.edu.tw\r\nNo.168, Sec. 1, University Rd., Minhsiung,\r\nChiayi 621301, Taiwan (R.O.C.)\r\n\r\nINTERN RESEARCH TOPICS\r\nNumber P1\r\nProject title\r\nTrustable Artificial Intelligence for Critical Applications and\r\n6G Security\r\nDescription of the research\r\nArtificial Intelligence (AI) technologies, 6G networking,\r\nand quantum computing are the leading forces in\r\nbringing the world to an era of better intelligence and full'
 'melampirkan surat usulan atau surat\nrekomendasi sekurang-kurangnya dari\npejabat setingkat eselon II yang membidangi\npembinaan/pengembangan SDM pada\nKementerian/Lembaga atau Pemerintah\nDaerah tempat pendaftar bekerja dengan\nketentuan;\na. mengusulkan atau merekomendasikan\npendaftar untuk mengikuti program\nBeasiswa LPDP; dan\nb. mencantumkan Nama Lengkap serta\nNomor Induk Pegawai (NIP) pendaftar.\n9. Bagi pendaftar yang merupakan PNS dengan\nstatus PNS dengan jabatan fungsional\nsebagai Peneliti/Perekayasa/Medis/\nParamedis/ Pendidik, mengunggah Surat\nKeputusan (SK) Jabatan Terakhir atau SK\nKenaikan Pangkat Terakhir atau sejenisnya\nyang menunjukkan bahwa pendaftar adalah\nPNS dengan jabatan fungsional sebagai\nPeneliti/Perekayasa/Medis/Paramedis/Pendi\ndik.\n10. Bagi pendaftar berstatus prajurit TNI di semua\nprogram beasiswa LPDP wajib melampirkan\nsurat usulan atau surat rekomendasi\nsekurang-kurangnya pejabat yang\nmembidangi pembinaan SDM pada Mabes\nTNI/ TNI AD/ TNI AL/ TNI AU untuk mengikuti'
 'KEMENTERIAN PENDIDIKAN, KEBUDAYAAN,\nRISET, DAN TEKNOLOGI\nINSTITUT TEKNOLOGI SEPULUH NOPEMBER\nDIREKTORAT KEMITRAAN GLOBAL\nGedung Global Kampong Kampus ITS Sukolilo - Surabaya 60111 Indonesia\n(0) Telepon: 031 5923411 (Hunting): 031 5994251-54 ext.1224\nFax: 031 5923411\nhttps://www.its.ac.id/, https://www.its.ac.id/international/ email: international(ajits.ac.id\nNomor : 7518/IT2MVIII/T/TU.00.08/2023\n\nLampiran :2 (dua) lembar\nPerihal : Pemberitahuan Informasi Persyaratan Eksposur Internasional\nKepada Yth.\nKepala Departemen dan Ketua Program Studi\ndi lingkungan ITS\nDengan hormat,\nsehubungan dengan surat kami dengan nomor 7311/!T2.VINI/T/TU.00.08/2023 perihal Pemberitahuan Informasi Persyaratan\nEksposur Internasional, bersama dengan ini memberikan informasi lebih lanjut tentang persyaratan yang harus dipenuhi oleh\nseluruh mahasiswa ITS dalam rangka pelaksanaan kegiatan eksposur internasional. Persyaratan tersebut adalah sebagai berikut:'
 'program beasiswa LPDP wajib melampirkan\nsurat usulan atau surat rekomendasi\nsekurang-kurangnya pejabat yang\nmembidangi pembinaan SDM pada Mabes\nTNI/ TNI AD/ TNI AL/ TNI AU untuk mengikuti\nprogram beasiswa LPDP yang ditujukan\nkepada LPDP.\n11. Bagi pendaftar berstatus anggota POLRI di\nsemua program beasiswa LPDP wajib\nmelampirkan surat usulan atau surat\nrekomendasi sekurang-kurangnya pejabat\nyang membidangi pembinaan SDM pada\nMabes POLRI untuk mengikuti program\nbeasiswa LPDP kepada LPDP pada saat\npendaftaran beasiswa LPDP.\n12. Memilih Perguruan Tinggi Tujuan dan\nprogram studi sesuai dengan ketentuan LPDP\n13. Beasiswa hanya diperuntukkan bagi kelas\nreguler atau kelas lain yang ditetapkan oleh\nLPDP, dan tidak diperuntukkan untuk kelas-\nkelas sebagai berikut:\na. Kelas eksekutif;\nb. Kelas khusus;\nc. Kelas karyawan;\nd. Kelas jarak jauh;\ne. Kelas yang diselenggarakan bukan di\nperguruan tinggi induk;\nf. Kelas internasional bagi pendaftar tujuan\nstudi dalam negeri;']","Kontak dapat dilakukan melalui nomor +886-5-2720411 ext. 23003, 23005, atau email coleng_dia@ccu.edu.tw. Alamatnya adalah No.168, Sec. 1, University Rd., Minhsiung, Chiayi 621301, Taiwan (R.O.C.).",0.9999999999,1.0,1.0000000000000002,1.0
